{
  "fuente": "ANLA_GACETA",
  "numero_resolución": "RESOLUCIÓN N° 1364",
  "fecha_resolución": "1993-12-22",
  "anio_resolucion": "1993",
  "nombre_proyecto": "en mención",
  "nombre_proyecto_normalizado": "EN MENCION",
  "ubicación": "departamento de Bolívar; Puerto Wilches y Sabana",
  "empresa": "ECOPETROL",
  "empresa_normalizada": "ECOPETROL",
  "numero_expediente": "con",
  "radicados": [
    "2021238407",
    "2022007704",
    "2022051346",
    "2022185339",
    "2022217153",
    "2023036560",
    "2018110466",
    "2021189747",
    "2020132578",
    "2021047795"
  ],
  "descripcion": "POR LA CUAL SE RESUELVE UN RECURSO DE REPOSICIÓN",
  "tipos_infraccion": [
    "Manejo de aguas",
    "Tala o afectación de bosques",
    "Incumplimiento del PMA"
  ],
  "tipos_infraccion_normalizados": [
    "MANEJO DE AGUAS",
    "TALA O AFECTACION DE BOSQUES",
    "INCUMPLIMIENTO DEL PMA"
  ],
  "pdf_id": "42998",
  "file_name": "ANLA_42998.pdf",
  "texto_completo": " \nRepública de Colombia \nMinisterio de Ambiente y Desarrollo Sostenible \n \nAUTORIDAD NACIONAL DE LICENCIAS AMBIENTALES \n- ANLA – \nRESOLUCIÓN N° 1364 \n(27 JUN. 2023) \n \nPágina 1 de 27 \n \n“POR LA CUAL SE RESUELVE UN RECURSO DE REPOSICIÓN” \n \nEL ASESOR DEL DESPACHO DEL DIRECTOR DE LA AUTORIDAD NACIONAL DE \nLICENCIAS AMBIENTALES – ANLA \n \nEn ejercicio de las facultades legales establecidas mediante la Ley 99 del 22 de diciembre \nde 1993, el Decreto Ley 3573 del 27 de septiembre de 2011, modificado por el Decreto \n376 del 11 de marzo de 2020, por el cual se modifica la estructura de la Autoridad \nNacional de Licencias Ambientales y acorde con lo regulado en el Decreto 1076 del 26 de \nmayo de 2015, la Resolución 669 del 14 de abril de 2020, la Resolución 1957 del 5 de \nnoviembre de 2021, y la Resolución 2795 del 25 de noviembre de 2022, expedidas por la \nAutoridad Nacional de Licencias Ambientales, y \n   \nCONSIDERANDO: \n \nQue mediante Resolución 211 del 21 de febrero de 2003, el entonces Ministerio de \nAmbiente, Vivienda y Desarrollo Territorial (MAVDT), en adelante el Ministerio, estableció \nmedidas ambientales a la Sociedad ECOPETROL S.A. identificada con NIT 899.999.068-\n1, en adelante la Sociedad, para las actividades en los Campos Cantagallo - Yariguí, \nSogamoso, Garzas, Cristalina, Pavas - Cáchira, Barranca - Lebrija y Totumal, localizados \nen los municipios de Cantagallo en el departamento de Bolívar; Puerto Wilches y Sabana \nde Torres en el departamento de Santander y Aguachica en el departamento del Cesar.  \n \nQue por medio de la Resolución 1015 del 22 septiembre de 2003, el Ministerio resolvió el \nrecurso de reposición interpuesto contra de la Resolución 211 del 21 de febrero de 2003, \nen el sentido de implementar las medidas de seguridad necesarias en los dispositivos o \nequipos mecánicos asociados a los pozos, para evitar su libre manipulación por terceros, \nentre otros.  \n \nQue a través de la Resolución 110 del 28 de enero de 2005, el Ministerio modificó la \nResolución 211 del 21 de febrero de 2003, en el sentido de variar las coordenadas de \nlocalización del polígono del Campo Barranca - Lebrija, entre otras.  \n \nQue mediante Resolución 2132 del 21 de diciembre de 2005, el Ministerio modificó la \nResolución 211 del 21 de febrero de 2003, en el sentido de establecer la localización real \npolítico-administrativa del campo Pavas – Cáchira y Totumal. \n \nQue por medio de la Resolución 1769 del 5 de septiembre de 2006, el Ministerio resolvió el \nrecurso de reposición interpuesto contra la Resolución 2132 del 21 de diciembre de 2005, \n\nResolución No. 1364       Del 27 JUN. 2023          Hoja No. 2 de 27 \n \n“POR LA CUAL SE RESUELVE UN RECURSO DE REPOSICIÓN” \nPágina 2 de 27 \n \nen el sentido de ampliar el plazo a tres meses para la presentación del complemento al Plan \nde Manejo Ambiental (PMA).  \n \nQue a través de la Resolución 653 del 13 de abril de 2007, el Ministerio autorizó la cesión \nparcial de las Medidas de Manejo Ambiental establecidas en la Resolución 211 del 21 de \nfebrero de 2003, de la Sociedad ECOPETROL S.A. en favor de la Sociedad EMERALD \nENERGY PLC., en cuanto a los derechos y obligaciones ambientales del Campo Totumal. \n \nQue mediante Resolución 496 del 10 de marzo de 2010, el Ministerio modificó la Resolución \n211 del 21 de febrero de 2003, en el sentido de cambiar la frecuencia de presentación de \nlos Informes de Cumplimiento Ambiental de anual a semestral, entre otras disposiciones.  \n \nQue por medio de la Resolución 1226 del 29 de junio de 2010, el Ministerio resolvió el \nrecurso de reposición interpuesto contra la Resolución 496 del 10 de marzo de 2010, en el \nsentido de confirmar todas las disposiciones.  \n \nQue a través de la Resolución 1316 del 4 de noviembre de 2014, la Autoridad Nacional de \nLicencias Ambientales (ANLA), en adelante la Autoridad Nacional, modificó la Resolución \n211 del 21 de febrero de 2003, en el sentido de aclarar el artículo primero de la mencionada \nresolución precisando “que en lugar de establecer Medidas Ambientales para los Campos \nCantagallo – Yariguí, Sogamoso, Garzas, Cristalina, Pavas – Cáchira, Barranca – Lebrija y \nTotumal, se establece Plan de Manejo Ambiental (PMA)”.  \n \nQue mediante Resolución 539 del 12 de mayo de 2015, la Autoridad Nacional resolvió el \nrecurso de reposición interpuesto contra la Resolución 1316 del 4 de noviembre de 2014, \nen el sentido de revocar la expresión \"Totumal\" de los artículos primero, segundo, tercero \ny sexto.  \n \nQue por medio de la Resolución 828 del 4 de mayo de 2020, la Autoridad Nacional impuso \nunas medidas de manejo ambiental para la Línea de Transferencia de Crudo desde la Isla \nVI a comuneros.  \n \nQue a través de la Resolución 406 del 26 de febrero de 2021, la Autoridad Nacional modificó \nel Plan de Manejo Ambiental – PMA, incluyendo infraestructura, obras y actividad para el \nCampo Yariguí – Cantagallo, entre otros.  \n \nQue mediante Resolución 1895 del 27 de octubre de 2021, la Autoridad Nacional impuso \nunas medidas adicionales y se adoptan otras determinaciones.  \n \nQue a través de la comunicación con radicación 2021238407-1-000 del 3 de noviembre de \n2021, la Sociedad presentó la solicitud de acogimiento al régimen de transición establecido \nen el numeral 2 del artículo 10 de la Resolución 256 del 22 de febrero de 2018, modificada \npor la Resolución 1428 del 31 de julio de 2018, junto con el documento “PLAN DE \nCOMPENSACIÓN DEL COMPONENTE BIÓTICO” relacionado con el Manual de \nCompensaciones del Componente Biótico para el proyecto en mención. \n \nQue a través del oficio con radicación 2022007704-2-000 del 20 de enero de 2022, la \nAutoridad Nacional requirió a la Sociedad información complementaria con el fin de resolver \nde fondo el acogimiento al artículo primero de la Resolución 370 del 15 de abril de 2021. \n \n\nResolución No. 1364       Del 27 JUN. 2023          Hoja No. 3 de 27 \n \n“POR LA CUAL SE RESUELVE UN RECURSO DE REPOSICIÓN” \nPágina 3 de 27 \n \nQue mediante comunicación con radicación 2022028035-1-000 del 18 de febrero de 2022, \nla Sociedad solicitó a la Autoridad Nacional prórroga para la entrega de la información \nrequerida mediante oficio con radicación 2022007704-2-000 del 20 de enero de 2022.  \n \nQue por medio del oficio con radicación 2022035311-2-000 del 28 de febrero de 2022, la \nAutoridad Nacional informó a la Sociedad que se le otorga un plazo único de un (1) mes \ncontado a partir del día siguiente del vencimiento del plazo inicialmente concedido, para \ncompletar de lleno los requisitos requeridos mediante oficio con radicación 2022007704-2-\n000 del 20 de enero de 2022. \n \nQue a través de la comunicación con radicación 2022051346-1-000 del 18 de marzo de \n2022, la Sociedad entregó a la Autoridad Nacional respuesta a los requerimientos de \ninformación complementaria solicitados realizados mediante oficio con radicación \n2022007704-2-000 del 20 de enero de 2022.  \n \nQue por medio de la Resolución 799 del 21 de abril de 2022, la Autoridad Nacional resuelve \nrecurso de reposición interpuesto contra de la Resolución 1895 del 27 de octubre de 2021, \nen el sentido de modificar el artículo primero de la Resolución recurrida, imponiendo a la \nSociedad la medida adicional consistente de monitoreo, de acuerdo con los parámetros que \nhacen parte de la Ficha 7.6.3.6 – Manejo de aguas subterráneas del Plan de Manejo \nAmbiental y Ficha 8.4.3 - Aguas subterráneas del Plan de Seguimiento y Monitoreo, entre \notras disposiciones. \n \nQue a través del oficio con radicación 2022185339-2-000 del 26 de agosto de 2022, la \nAutoridad Nacional realizó requerimientos a la Sociedad relacionados con la información \nallegada a través de la comunicación con radicación 2022051346-1-000 del 18 de marzo \nde 2022. \n \nQue mediante comunicación con radicación 2022217153-1-000 del 29 de septiembre de \n2022, la Sociedad entregó a la Autoridad Nacional respuesta a los requerimientos de \ninformación complementaria solicitados realizados mediante oficio con radicación \n2022185339-2-000 del 26 de agosto de 2022, relacionados con la solicitud de acogimiento \nal artículo primero de la Resolución 370 del 15 de abril de 2021.  \n \nQue por medio de la comunicación con radicación 2023036560-1-000 del 24 de febrero de \n2023, la Sociedad remitió los anexos de dos (2) documentos: “ANEXO 1. RESPUESTA A \nLOS REQUERIMIENTOS DEL OFICIO RADICADO ANLA No. 2022185339-2-000 DE 26 \nDE AGOSTO DE 2022” y “Plan de compensación del componente biótico - Campos Yariguí \n– Cantagallo y Aledaños”, en el cual se incluye el ajuste del plan con la información \ncomplementaria solicitada por la Autoridad Nacional. \n \nQue mediante Resolución 607 del 29 de marzo de 2023, la Autoridad Nacional no aceptó \nla solicitud de acogimiento al régimen de transición establecido en el numeral 2° del artículo \n10 de la Resolución 256 del 22 de febrero de 2018, modificada por la Resolución 1428 del \n31 de julio de 2018, de acuerdo con la solicitud presentada por la Sociedad mediante \ncomunicación con radicación 2021238407-1-000 del 3 de noviembre de 2021, en virtud del \nartículo primero de la Resolución 370 del 15 de abril de 2021, en lo referente al DÓNDE y \nCÓMO compensar. Acto administrativo que fue notificado por correo electrónico el 29 de \nmarzo de 2023. \n \n\nResolución No. 1364       Del 27 JUN. 2023          Hoja No. 4 de 27 \n \n“POR LA CUAL SE RESUELVE UN RECURSO DE REPOSICIÓN” \nPágina 4 de 27 \n \nQue mediante la comunicación con radicación 2023078886-1-000 del 14 de abril de 2023, \nla Sociedad interpuso recurso de reposición contra la Resolución 607 del 29 de marzo de \n2023, argumentos que fueron evaluados por el equipo técnico de la Autoridad Nacional a \ntravés del Concepto técnico 2964 del 31 de mayo de 2023. \n \nCOMPETENCIA DE LA AUTORIDAD NACIONAL  \n \nEl Gobierno Nacional, mediante Decreto Ley 3573 del 27 de septiembre de 2011, creó la \nAutoridad Nacional de Licencias Ambientales (ANLA), como una entidad con autonomía \nadministrativa y financiera, sin personería jurídica, la cual hace parte del Sector \nAdministrativo de Ambiente y Desarrollo Sostenible, en los términos del artículo 67 de la \nLey 489 de 1998. \n \nEl numeral 1° del artículo tercero del mencionado decreto estableció dentro de las funciones \nde la Autoridad Nacional, la de otorgar o negar las licencias, permisos y trámites \nambientales de competencia del Ministerio, de conformidad con la ley y los reglamentos. \n \nMediante el Decreto 376 del 11 de marzo de 2020, se modificó la estructura de la Autoridad \nNacional de Licencias Ambientales. \n \nMediante la Resolución 669 del 14 de abril de 2020, se nombró como servidor público a \nEDILBERTO PEÑARANDA CORREA, identificado con cédula de ciudadanía 4.052.851, en \nel empleo de libre nombramiento y remoción de Asesor, código 1020, grado 15, adscrito a \nla Dirección General de la planta global de la ANLA. \n \nEl 5 de noviembre de 2021, la Autoridad Nacional emitió la Resolución 1957 -Por la cual se \nadopta el Manual Específico de Funciones y de Competencias Laborales para los empleos de la \nplanta de personal de la Autoridad Nacional de Licencias Ambientales – ANLA-, en donde se \nestablece que corresponde al Despacho del Director General de la Autoridad Nacional de \nLicencias Ambientales - ANLA, -Suscribir los actos administrativos que otorgan, niegan, \nmodifican, ajustan o declaran la terminación de las licencias, permisos y trámites ambientales-. \n \nEn ejercicio de las facultades conferidas por la Ley 489 de 1998, se expidió la Resolución \n2795 del 25 de noviembre de 2022, “Por la cual se delegan unas funciones y se dictan otras \ndisposiciones”, que en el numeral 15 del artículo primero se delegó en el Asesor Código \n1020 Grado 15 del Despacho del Director General, entre otras, la función de resolver los \nrecursos de reposición interpuestos contra los actos administrativos que se emiten en \ncumplimiento de las funciones delegadas. \n \nTeniendo en cuenta lo anterior, es el Asesor del Despacho del Director General de la \nAutoridad Nacional el competente para pronunciarse sobre el recurso de reposición \ninterpuesto por la Sociedad ECOPETROL S.A. en contra de la Resolución 607 del 29 de \nmarzo de 2023. \n \nFUNDAMENTOS JURÍDICOS \n \nEl procedimiento para la presentación y resolución de recursos contra los actos \nadministrativos se encuentra reglado en el Código de Procedimiento Administrativo y de lo \nContencioso Administrativo artículos 74 y siguientes, que particularmente respecto del \nrecurso de reposición al tenor literal expresan: \n \n\nResolución No. 1364       Del 27 JUN. 2023          Hoja No. 5 de 27 \n \n“POR LA CUAL SE RESUELVE UN RECURSO DE REPOSICIÓN” \nPágina 5 de 27 \n \n“Artículo 74. Recursos contra los actos administrativos. \n \n Por regla general, contra los actos definitivos procederán los siguientes recursos:  \n \n1. El de reposición, ante quien expidió la decisión para que la aclare, modifique, adicione o \nrevoque (…)” \n \nA su vez, los artículos 76 y 77 del Código enunciado preceptúan:  \n \n“Artículo 76. Oportunidad y presentación. \n \nLos recursos de reposición y apelación deberán interponerse por escrito en la diligencia de \nnotificación personal, o dentro de los diez (10) días siguientes a ella, o a la notificación por aviso, \no al vencimiento del término de publicación, según el caso. Los recursos contra los actos \npresuntos podrán interponerse en cualquier tiempo, salvo en el evento en que se haya acudido \nante el juez.  \n \nLos recursos se presentarán ante el funcionario que dictó la decisión, salvo lo dispuesto para el \nde queja, y si quien fuere competente no quisiere recibirlos podrán presentarse ante el procurador \nregional o ante el personero municipal, para que ordene recibirlos y tramitarlos, e imponga las \nsanciones correspondientes, si a ello hubiere lugar.  \n \nEl recurso de apelación podrá interponerse directamente, o como subsidiario del de reposición y \ncuando proceda será obligatorio para acceder a la jurisdicción.  \n \nLos recursos de reposición y de queja no serán obligatorios.  \n \nArtículo 77. Requisitos. \n \nPor regla general los recursos se interpondrán por escrito que no requiere de presentación \npersonal si quien lo presenta ha sido reconocido en la actuación. Igualmente, podrán presentarse \npor medios electrónicos.  \n \nLos recursos deberán reunir, además, los siguientes requisitos:  \n \n1. Interponerse dentro del plazo legal, por el interesado o su representante o apoderado \ndebidamente constituido.  \n \n2. Sustentarse con expresión concreta de los motivos de inconformidad. \n \n3. Solicitar y aportar las pruebas que se pretende hacer valer.  \n \n4. Indicar el nombre y la dirección del recurrente, así como la dirección electrónica si desea ser \nnotificado por este medio.  \n \nSólo los abogados en ejercicio podrán ser apoderados (…) \n \nA su vez, el artículo 80 del citado Código, establece el alcance del contenido de la decisión \nque resuelve el recurso: \n \n“Artículo 80. Decisión de los recursos. -Vencido el período probatorio, si a ello hubiere \nlugar, y sin necesidad de acto que así lo declare, deberá proferirse la decisión motivada que \nresuelva el recurso.  \n \n\nResolución No. 1364       Del 27 JUN. 2023          Hoja No. 6 de 27 \n \n“POR LA CUAL SE RESUELVE UN RECURSO DE REPOSICIÓN” \nPágina 6 de 27 \n \nLa decisión resolverá todas las peticiones que hayan sido oportunamente planteadas y las \nque surjan con motivo del recurso.”  \n \nCONSIDERACIONES DE LA AUTORIDAD NACIONAL FRENTE AL RECURSO DE \nREPOSICIÓN INTERPUESTO POR LA SOCIEDAD.  \n \nDesde el punto de vista procedimental, se observa que el recurso de reposición interpuesto \npor la Sociedad ECOPETROL S.A. en contra de la Resolución 607 del 29 de marzo de \n2023, cumple con los requisitos establecidos en el artículo 77 y concordantes del Código \nde Procedimiento Administrativo y de lo Contencioso Administrativo, en cuanto a lo \nsiguiente:  \n \n1. Interponerse dentro del plazo legal, por el interesado o su representante o apoderado \ndebidamente constituido. \n \nSe encuentra acreditado que el día 29 de marzo de 2023, la Sociedad se notificó por correo \nelectrónico de la Resolución 607 del 29 de marzo de 2023, frente a la cual interpuso recurso \nde reposición a través de su Apoderado General el día 14 de abril de 2023, mediante la \ncomunicación con radicación 2023078886-1-000, es decir, dentro de los diez (10) días \nhábiles siguientes a la notificación, de conformidad con lo preceptuado en el artículo 76 de \nla Ley 1437 del 18 de enero de 2011. \n \n2. Sustentarse con expresión concreta de los motivos de inconformidad.  \n \nLa Sociedad presentó los argumentos en contra de las disposiciones recurridas de la \nResolución 607 del 29 de marzo de 2023, los cuales serán tenidos en cuenta para decidir \nel presente recurso de reposición. \n \n3. Solicitar y aportar las pruebas que se pretende hacer valer. \n \nEn el recurso de reposición no se aportaron pruebas. \n \nEn el recurso presentado la Sociedad señaló que recibe notificaciones en el correo \nelectrónico notificacionesjudicialesecopetrol@ecopetrol.com.co.  \n \nCon base en lo anterior, verificado el cumplimiento de los requisitos establecidos en el \nCódigo de Procedimiento Administrativo y de lo Contencioso Administrativo (CPACA), \nrespecto a la procedencia del señalado recurso de reposición, la Autoridad Nacional \nprocederá a resolverlo, teniendo en cuenta las consideraciones realizadas en el Concepto \nTécnico 2964 del 31 de mayo de 2023; en el mismo orden de los argumentos presentados \npor la Sociedad, a saber: \n \n1. \nDISPOSICIÓN RECURRIDA – ARTÍCULOS PRIMERO Y SEGUNDO DE LA \nRESOLUCIÓN 607 DEL 29 DE MARZO DE 2023. \n \n“ARTÍCULO PRIMERO. No Aprobar la solicitud de acogimiento al régimen de transición establecido \nen el numeral 2° del artículo 10 de la Resolución 256 del 22 de febrero de 2018, modificada por la \nResolución 1428 del 31 de julio de 2018, de acuerdo con la solicitud presentada por la sociedad \nECOPETROL S.A. mediante comunicación con radicación 2021238407-1-000 del 3 de noviembre \nde 2021, en virtud del artículo 1 de la Resolución 370 del 15 de abril de 2021, en lo referente al \nDÓNDE y CÓMO compensar, de conformidad con lo expuesto en la parte motiva del presente acto \nadministrativo. \n\nResolución No. 1364       Del 27 JUN. 2023          Hoja No. 7 de 27 \n \n“POR LA CUAL SE RESUELVE UN RECURSO DE REPOSICIÓN” \nPágina 7 de 27 \n \n \nARTÍCULO SEGUNDO. No Aprobar el Plan de Compensación del Componente Biótico presentado \npor la Sociedad a través de la comunicación con radicación 2021238407-1-000 del 3 de noviembre \nde 2021, de conformidad con lo expuesto en la parte motiva del presente acto administrativo. \n \n1.1 Petición de la Sociedad. \n \n“REPONER el artículo primero de la Resolución No. 00607 de (sic) 29 de marzo de 2023, “POR LA \nCUAL SE EVALÚA UN PLAN DE COMPENSACIÓN Y SE ADOPTAN OTRAS DISPOSICIONES”, \nen el sentido de APROBAR el acogimiento al régimen de transición establecido en el numeral 2° del \nartículo 10 de la Resolución No. 256 de (sic) 22 de febrero de 2018, modificada por la Resolución \nNo. 1428 de (sic) 31 de julio de 2018, de acuerdo con la solicitud presentada por Ecopetrol S.A., \nmediante comunicación con radicación 2021238407-1-000 de (sic) 3 de noviembre de 2021, en virtud \ndel artículo 1 de la Resolución No. 370 de 15 de abril de 2021, en lo referente al DÓNDE y CÓMO \ncompensar. \n \nREPONER el artículo segundo de la Resolución No. 00607 de (sic) 29 de marzo de 2023, “POR LA \nCUAL SE EVALÚA UN PLAN DE COMPENSACIÓN Y SE ADOPTAN OTRAS DISPOSICIONES”, \nen el sentido de APROBAR el Plan de Compensación del Componente Biótico presentado por \nEcopetrol S.A., a través del radicado 2021238407-1-000 de (sic) 3 de noviembre de 2021, e \ninformación complementaria presentada mediante radicados 2022217153-1- 000 de (sic) 29 de \nseptiembre de 2022 y 2023036560-1-000 de (sic) 24 de febrero de 2023.” \n \n1.2 Argumentos de la Sociedad. \n \n“Frente a la decisión de la Autoridad Ambiental, sea lo primero indicar que, para la solicitud de \nacogimiento presentada por Ecopetrol S.A., se tuvieron en cuenta los lineamientos definidos en el \ncapítulo 5.4.1. contenido del plan de compensación del Manual de Compensación del Componente \nBiótico, adoptado por la Resolución No. 256 de (sic) 22 de febrero de 2018, modificada por la \nResolución No. 1428 de (sic) 31 de julio de 2018, para lo cual, el plan de compensación presentado \na la ANLA contenía la información relacionada a continuación: \n \n \n\nResolución No. 1364       Del 27 JUN. 2023          Hoja No. 8 de 27 \n \n“POR LA CUAL SE RESUELVE UN RECURSO DE REPOSICIÓN” \nPágina 8 de 27 \n \n \n \nTal como se detalló anteriormente, la Empresa allegó la información requerida por el Manual de \nCompensación de Componente Biótico y adicionalmente, hizo dos (2) entregas de información \ncomplementaria de conformidad con lo señalado por la ANLA.  \n \nAhora bien, se precisa que analizadas las consideraciones expuestas en el Concepto Técnico No. \n00983 de (sic) 9 de marzo de 2023, acogido mediante la Resolución No. 00607 de (sic) 29 de marzo \nde 2023, Ecopetrol S.A., no evidenció que en ningún apartado se estableciera que, la información \naportada estuviera incompleta o no estuviera acorde a las disposiciones señaladas por la ANLA en \nlos oficios de información complementaria de (sic) 20 de enero de 2022 y 26 de agosto de 2022. \nPues, en algunos apartados que se interpretan como motivantes de la decisión la Autoridad \nAmbiental señala:  \n \n“Al respecto de los objetivos específicos, las metas y el alcance propuesto, si bien están \norientados a las acciones de preservación, rehabilitación, y acciones complementarias mediante \nuso sostenible, se considera que no cuentan con el detalle necesario ni especificidad que \npermita poder definir en específico que es lo que se debe esperar para verificar que se haya \ndado cumplimiento a la obligación.”  \n \nFrente a lo anterior, Ecopetrol S.A., aclara que, en relación con los objetivos específicos, las metas \ny el alcance propuesto, estos fueron elaborados teniendo en cuenta las diferentes alternativas de \nacciones planteadas para el cumplimiento de la compensación, de tal forma que se tenga la \noportunidad de su implementación de acuerdo con las condiciones de los predios e intereses de los \nparticipantes que sean seleccionados dentro del área preliminar presentada. \n \nEn este punto, es fundamental traer a colación la importante gestión adelantada por Ecopetrol S.A. \nque data desde el 2015, a través del convenio ejecutado con el Instituto Alexander Von Humboldt \npara la definición de la metodología de priorización de núcleos y áreas de interés estratégico \nambiental en zonas de influencia de proyectos y operaciones de la Empresa en el marco de las \nsubzonas hidrográficas del país, donde se están implementando actualmente varias obligaciones de \ncompensación ambiental que contribuyen con los ejes estratégicos ambientales corporativos sobre \nel recurso hídrico, cambio climático, biodiversidad, entre otros.  \n \nEn este orden de ideas, tal como se ha venido presentando a la Autoridad Ambiental en los planes \nde compensación para la solicitud de acogimientos de diferentes proyectos, a partir de la \nmetodología desarrollada por Ecopetrol S.A., para la construcción del portafolio de áreas prioritarias \npara la inversión ambiental, se definieron núcleos de priorización, para este caso de los campos \nYarigui - Cantagallo y aledaños (con excepción del campo Barranca-Lebrija), estos se encuentran \nubicados al interior de los núcleos Lebrija y Yondó-Cantagallo, los cuales se localizan en la zona \nhidrográfica Magdalena Medio, subzonas hidrográficas de los Río Lebrija y Río Cimitarra y otros \ndirectos al Magdalena, en los municipios de Puerto Wilches, Sabana de Torres y Rionegro en \nSantander, La Esperanza en Norte de Santander, San Martín en Cesar y Cantagallo en Bolívar.  \n \nCon base en lo anterior, Ecopetrol S.A., reitera lo indicado en el Plan de compensación respecto a \nlas metas “Cabe aclarar que, las metas del plan de compensación serán ajustadas una vez sean \n\nResolución No. 1364       Del 27 JUN. 2023          Hoja No. 9 de 27 \n \n“POR LA CUAL SE RESUELVE UN RECURSO DE REPOSICIÓN” \nPágina 9 de 27 \n \nseleccionados los predios en los cuales se implementarán las acciones de compensación, teniendo \nen cuenta los resultados de la caracterización de línea base, el estado de conservación de las áreas, \nel tiempo en que se realizan las actividades y las acciones y diseños a implementar”, toda vez que, \nmediante el proceso de selección de predios durante la ejecución del plan se obtendrá la información \nmás detallada tal como lo requiere la autoridad ambiental.  \n \nDe otra parte, en relación con el DÓNDE y el TIEMPO DE INICIO DE LA IMPLEMENTACIÓN DEL \nPLAN, en el Concepto Técnico No. 983 de (sic) 9 de marzo de 2023, la Autoridad Ambiental \nmencionó:  \n \n“De lo anterior debe especificarse que el área propuesta para la compensación presentada por \nla Sociedad corresponde a 8.748,138 hectáreas presentadas como “preliminares”, mientras que \nen el Plan de compensación presentado por la Sociedad se calcula un área a compensar de \n32,25 hectáreas (esto se verifica en el ítem cuánto compensar), encontrándose que el área \n“preliminar” propuesta por ECOPETROL S.A, es un área que está por encima en un 27.126,01% \nde lo proyectado a ejecutar efectivamente. \n \n(…)  \n \nSe debe resaltar que en el marco del acogimiento se debe garantizar que la implementación se \ninicie en un término no mayor a 6 meses de la aprobación del plan, lo cual no es viable dado \nque se presentan unas áreas excesivas (8.748,138 hectáreas), frente a lo proyectado a ejecutar \n(32,25 hectáreas), en las cuales no hay ningún tipo de aproximación, línea base, verificación de \ncondiciones existentes y sobre las cuales no es posible analizar la pertinencia de \nimplementación de acciones propuestas, de la que se derivará la verificación del principio de no \npérdida neta de biodiversidad y la adicionalidad; además tampoco es posible definir como se \nrealizará el seguimiento a la obligación por cuanto no se cuenta con un estimado real respecto \na las mediciones a realizar en cuanto a indicadores.” \n \nDe lo anterior, se considera pertinente aclarar que, dentro del área preliminar propuesta en el Plan \nde compensación, se localizaron áreas ecológicamente equivalentes a las intervenidas en el \ndesarrollo del proyecto Campos Petroleros Cantagallo y Aledaños y en lugares que representan la \nmejor oportunidad de conservación efectiva, teniendo en cuenta esto, para definir las áreas \npreliminares se priorizaron áreas de los núcleos (Yondo - Cantagallo y Lebrija), y atendiendo el \nrequerimiento de información complementaria realizado por la Autoridad Ambiental, se puntualizaron \na nivel veredal garantizando su localización al interior del polígono de las subzonas hidrográficas Río \nCimitarra, Río Lebrija y otros directos al Magdalena, donde se ubican los biomas y ecosistemas \nequivalentes a los existentes en los polígonos de los campos YariguíCantagallo y aledaños \n(Helobioma Magdalena medio y depresión momposina, Hidrobioma Magdalena medio y depresión \nmomposina y Zonobioma Húmedo Tropical Magdalena medio y depresión momposina), cumpliendo \nde esta forma con los criterios mínimos del ámbito geográfico establecidos por el Manual de \ncompensaciones del componente biótico.  \n \nEs importante mencionar que, según lo estipulado en el Manual de compensaciones del componente \nbiótico, el plan de compensación de un proyecto debe contener como mínimo la “Localización \npreliminar de las áreas para la implementación de las medidas de compensación. Las áreas \ndetalladas serán presentadas en el marco del seguimiento y ejecución del Plan”, de conformidad con \nlo anterior, Ecopetrol S.A. presentó un área preliminar de 8748,138 hectáreas donde se enfocará la \nselección de predios y participantes para implementar la medida de compensación de 32,25 \nhectáreas.  \n \nEn tal sentido, se puede deducir que esta área preliminar no representa desproporcionalidad \nteniendo en cuenta que en los procesos de implementación de medidas de compensación \nhistóricamente se ha evidenciado a la Autoridad Ambiental las dificultades que se presentan en el \nmomento de la búsqueda de participantes con interés en el desarrollo de este tipo de actividades, \nrazón por la cual es necesaria una estrategia mediante el diseño de un procedimiento para la \n\nResolución No. 1364       Del 27 JUN. 2023          Hoja No. 10 de 27 \n \n“POR LA CUAL SE RESUELVE UN RECURSO DE REPOSICIÓN” \nPágina 10 de 27 \n \nselección de predios y participantes en las áreas priorizadas, estableciendo criterios que permiten \nidentificar en el territorio las áreas con mayor potencial para la ejecución de la medida de \ncompensación, y en el cual se consideran las siguientes actividades de acuerdo con el cronograma \npresentado a la Autoridad Ambiental: \n \n• \nSocialización del proyecto \n• \nVisitas a predios y aplicación encuestas de diagnóstico \n• \nAnálisis de tenencia del predio \n• \nSuscripción de acuerdo de conservación \n• \nDiseño predial concertado \n• \nCaracterización físico-biótica \n• \nLínea base de indicadores \n \nSin embargo, para poder adelantar el procedimiento anteriormente mencionado es necesario contar \ncon la aprobación del plan de compensación por parte de la Autoridad Ambiental, ya que de acuerdo \na las experiencias en Ecopetrol S.A., frente a las obligaciones de compensación que se tienen \nactualmente en ejecución, mediante esta misma estrategia, el realizar el proceso de selección de \npredios y participantes como parte de la implementación del plan, permite un proceso continuo y \neficiente con los participantes, evitando tiempo muertos que desmotiven a los propietarios de los \npredios en su intención de participar en el proyecto de compensación.  \n \nY producto de lo antes señalado, se reduce la posibilidad de que se dé una pérdida de interés por \nparte de estos y a la vez permitiendo realizar la ejecución de acuerdo con el cronograma y plan \naprobados; evitando que se deba reiniciar el proceso y/o se genere un detrimento patrimonial por los \nrecursos invertidos puesto que como ya se ha manifestado en reiteradas oportunidades, Ecopetrol \nS.A. es una sociedad de economía mixta que administra dineros públicos debiendo velar por su \nrigurosa destinación. \n \n De manera complementaria, es importante conocer el contexto regional, especialmente de los \nmunicipios de Cantagallo y Puerto Wilches, donde existe una complejidad marcada por inundabilidad \nde los terrenos, proliferación de cultivos de palma, carencia o estado precario de las vías, presencia \nde grupos armados al margen de la ley, presencia de cultivos ilícitos, predios en proceso de \nrestitución de tierras, falsa tenencias de los predios, entre otras, condiciones que dificultan a \nEcopetrol S.A. la consecución de áreas para la implementación de sus proyectos de compensación, \npor tal razón, es muy arriesgado disminuir aún más el área preliminar propuesta ya que durante el \nproceso de socialización del proyecto, se tiene previsto incursionar en muchos sectores para lograr \nconseguir las áreas idóneas y los participantes interesados en suscribir los acuerdos de \nconservación, además se considera que, disponer de un área amplia permite mayores alternativas \nde hallar predios que cumplan con la equivalencia de ecosistemas garantizando precisamente el \ncumplimiento oportuno de la medida y logrando el propósito de la compensación.  \n \nDe acuerdo a lo expuesto anteriormente, Ecopetrol S.A., observa que la consideración de la \nAutoridad Ambiental en cuanto a la necesidad de presentar con un mayor detalle las áreas \npropuestas para la compensación generaría una obligación imposible de cumplir teniendo en \ncuenta que para su ejecución se requiere realizar un despliegue del proceso de selección de predios \ny participantes previo a la aprobación del plan de compensación, sobre meras expectativas con los \nparticipantes de los acuerdos de conservación, frente a acciones de compensación propuestas que \nen esta instancia aún no cuentan con aprobación por parte de la ANLA, lo cual traería consigo una \npotencial pérdida en la credibilidad de la Empresa frente a las propuestas presentadas en la etapa \ninicial de selección de los participantes. \n \nEn una comprensión del tema, no es dable la exigencia de la Autoridad en cuanto a la exigencia de \nmayor detalle de las áreas propuestas para la compensación. Para explicar este evento, es acertado \ntomar en cuenta la intervención de la Corte Constitucional en la Sentencia T-875 de 2010 de la cual \nse extrae cómo desde el punto de vista de cumplimiento a las obligaciones son admisibles \n\nResolución No. 1364       Del 27 JUN. 2023          Hoja No. 11 de 27 \n \n“POR LA CUAL SE RESUELVE UN RECURSO DE REPOSICIÓN” \nPágina 11 de 27 \n \ncircunstancias de imposibilidad justificadas que eximen de su reclamación a los destinatarios, lo cual \nlleva implícito el reconocimiento de los efectos atribuibles al principio en desarrollo: \n \n“(…) No obstante, las exigencias sustanciales de la respuesta, que en últimas se resumen en el \nhecho de que la misma sea de fondo [17], no podrían desconocer la incidencia de \neventualidades que obstaculicen o impidan su cumplimiento, en vigor de aquella máxima del \nderecho que ordena: “nadie está obligado a lo imposible.” En este sentido, cuando se aduzcan \nmotivos que reflejen la imposibilidad de la administración para dar respuesta a la petición con \nbase en circunstancias que desborden las posibilidades y la voluntad del sujeto, ora porque se \ntrate de asuntos de competencia privativa de otra autoridad, ora porque acaezcan hechos que \nsobrepasen la esfera de dominio humano, éste estaría eximido de la obligación de ofrecer \nuna respuesta materialmente conexa. (…)” (Negrilla ajena al texto)  \n \nEl principio “Nadie está obligado a lo imposible”, se pregona frente a condiciones de imposibilidad \ncierta, como acontece cabalmente para el asunto de debate en el cual se condiciona la exigencia \nde mayor detalle de las áreas propuestas para la compensación, sin tener en cuenta que el hecho \nde no contar con un predio avalado y aprobado por la ANLA resulta imposible para Ecopetrol S.A., \nrecolectar la información que manifiesta la Autoridad a tal grado de escala, lo que resulta además en \nuna abierta contradicción con el principio de seguridad jurídica, el cual será desarrollado más \nadelante, en donde se expondrá la evaluación de la Autoridad sobre un expediente con \ncaracterísticas similares.  \n \nAdicionalmente, se debe tener en cuenta que no se pueden firmar acuerdos de conservación, ya que \nel plan de compensación no ha sido aceptado por la ANLA, lo cual genera riesgo de un potencial \ndesistimiento del participante del acuerdo de conservación, teniendo en cuenta los tiempos que \nconlleva las etapas de evaluación y aprobación a cargo de la Autoridad Ambiental; como también la \nposterior gestión precontractual del vehículo comercial para la ejecución del plan de compensación \na cargo de la Empresa. Lo anterior, considerando la dinámica de la actividad productiva que tiene el \nparticipante y basado en que el acuerdo de conservación tiene como principio la voluntad de este, \nsu interés de participar puede verse alterado con el tiempo y declinar en su decisión inicial de \nparticipar. \n \nEsto, a la vez genera reprocesos al interior de la Empresa ocasionando un detrimento patrimonial \ncomo se indicó en líneas anteriores; así como la transgresión del principio de planeación y economía, \nalterando las etapas definidas en los cronogramas propuestos por Ecopetrol S.A., en los planes de \ncompensación, los cuales tienen como origen los aspectos administrativos y técnicos establecidos \ninternamente para desarrollar la actividad.  \n \nTodo lo anterior, terminaría en una solicitud de modificación del plan de compensación de manera \ncontinua, aspecto tal que va en contravía de las necesidades del territorio e intereses en el ámbito \nambiental de Ecopetrol S.A., y nuestro país, esto sin mencionar el desgaste administrativo que dichos \nreprocesos generan para la Autoridad Ambiental representado en la frecuente evaluación de planes \nde compensación de un mismo proyecto, así como la extensión del tiempo para su pronunciamiento, \nel cual puede transcurrir entre 6 meses a 2 años y como consecuencia de ello, se presenta los \ndesistimientos por parte de participantes o cambios relacionados a la propiedad del predio que \nafectan directamente los acuerdos.  \n \nEn cuanto al lineamiento sobre el inicio de la implementación del plan (en un término no mayor a \nseis (6) meses de la aprobación del plan), es preciso aclarar que, en el cronograma presentado para \naprobación de la Autoridad Ambiental, las actividades programadas para el semestre uno (1) del \nprimer año corresponden a la Etapa Precontractual, esto significa que sí es posible dar inicio al plan \ndentro del tiempo señalado por la ANLA en varios apartados del concepto técnico No. 00983 de (sic) \n09 de marzo de 2023, acogido bajo la Resolución No. 00607 de (sic) 29 de marzo de 2023.  \n \nCabe denotar que, en la Regional Central de Ecopetrol S.A., actualmente se están ejecutando nueve \n(9) planes de compensación del componente biótico con diecisiete (17) acuerdos de conservación \n\nResolución No. 1364       Del 27 JUN. 2023          Hoja No. 12 de 27 \n \n“POR LA CUAL SE RESUELVE UN RECURSO DE REPOSICIÓN” \nPágina 12 de 27 \n \nsuscritos, para un total de 53.92 hectáreas en implementación, dichos planes fueron presentados \npara la aprobación de la Autoridad Ambiental bajo los mismos criterios y lineamientos técnicos, así \nmismo, han sido objeto de seguimiento y control por parte de la ANLA, sin generarse inconformidad \no requerimiento alguno al respecto; para evidencia de esto podemos citar del área del Magdalena \nMedio y Catatumbo, proyectos tales como: APE Nafta, APE Aullador y APE Rumbero, entre otros.  \n \nPor lo anteriormente expuesto, Ecopetrol S.A., desvirtúa las consideraciones expuestas por la \nAutoridad Nacional de Licencias Ambientales - ANLA, en la Resolución No. 00607 de (sic) 29 de \nmarzo de 2023, mediante la cual resolvió no aprobar la solicitud de acogimiento al régimen de \ntransición establecido en el numeral 2° del artículo 10 de la Resolución No. 256 de (sic) 22 de febrero \nde 2018, modificada por la Resolución No. 1428 del 31 de julio de 2018, ni el plan de compensación \ndel componente biótico; reiterando que hizo la entrega de la información mínima requerida tendiente \na aprobar el acogimiento y el plan de compensación. \n \n1.3 Consideraciones de la Autoridad Nacional. \n \nA través del Concepto Técnico 2964 del 31 de mayo de 2023, el equipo técnico de la \nAutoridad Nacional, señaló: \n \n“ECOPETROL S.A., expresa como primer argumento para la solicitud de aprobación de los artículos \nPrimero y Segundo de la Resolución 607 del 29 de marzo de 2023, lo siguiente:  \n \n“(…) para la solicitud de acogimiento presentada por Ecopetrol S.A., se tuvieron en cuenta los \nlineamientos definidos en el capítulo 5.4.1. contenido del plan de compensación del Manual de \nCompensación del Componente Biótico, adoptado por la Resolución No. 256 de (sic) 22 de \nfebrero de 2018, modificada por la Resolución No. 1428 de (sic) 31 de julio de 2018, para lo \ncual, el plan de compensación presentado a la ANLA contenía la información relacionada a \ncontinuación.  \n \n(…)  \n \nla Empresa allegó la información requerida por el Manual de Compensación de Componente \nBiótico y adicionalmente, hizo dos (2) entregas de información complementaria de conformidad \ncon lo señalado por la ANLA. Ahora bien, se precisa que analizadas las consideraciones \nexpuestas en el Concepto Técnico No. 00983 de (sic) 9 de marzo de 2023, acogido mediante \nla Resolución No. 00607 de (sic) 29 de marzo de 2023, Ecopetrol S.A., no evidenció que en \nningún apartado se estableciera que, la información aportada estuviera incompleta o no \nestuviera acorde a las disposiciones señaladas por la ANLA en los oficios de información \ncomplementaria de 20 de enero de 2022 y 26 de agosto de 2022. \n \n(…)”  \n \nAl respecto, tal y como lo señala la Sociedad, para el proyecto “Campos Petroleros Cantagallo y \nAledaños” expediente LAM2317, ECOPETROL S.A., ha entregado en tres (3) oportunidades, \ninformación relacionada con la solicitud de acogimiento al artículo primero de la Resolución 370 del \n15 de abril de 2021 y el plan de compensación del componente biótico, de acuerdo con lo siguiente: \n \n- \nRadicado ANLA 2021238407-1-000 del 3 de noviembre de 2021: la Sociedad presentó la \nsolicitud de acogimiento al artículo primero de la Resolución MADS 0370 del 15 de abril de 2021 \ncon respecto al plan de compensación del componente biótico. Esta información fue evaluada \nen el Concepto Técnico 48 del 13 de enero de 2022, en el cual se señala que la Sociedad \npresentó las áreas afectadas por las actividades del proyecto, pero no hizo entrega a esta \nAutoridad de las áreas propuestas para la ejecución de las estrategias propuestas para la \ncompensación y la información asociada requerida y por tanto la ANLA, mediante oficio con \nradicado 2022007704-2- 000 del 20 de enero de 2022, requirió a la Sociedad información \n\nResolución No. 1364       Del 27 JUN. 2023          Hoja No. 13 de 27 \n \n“POR LA CUAL SE RESUELVE UN RECURSO DE REPOSICIÓN” \nPágina 13 de 27 \n \nadicional para emitir un pronunciamiento de fondo. \n \n- \nRadicado ANLA 2022051346-1-000 del 18 de marzo de 2022: la Sociedad entregó la \nrespuesta al oficio remitido por ANLA mediante radicado 2022007704-2-000 del 20 de enero de \n2022, y presentó el documento “Plan de Compensación del Componente Biótico Campos \nYarigui-Cantagallo, Garzas y Cristalina Resolución 1316 de 2014 y Resolución 539 de 2015”. \nEsta información fue evaluada en el Concepto Técnico 4520 del 3 de agosto de 2022, acogido \nmediante oficio con radicado 2022185339-2-000 del 26 de agosto de 2022, en el cual esta \nAutoridad menciona que: \n \n“(…) la información de las áreas propuestas no cuenta con un detalle apropiado para evaluar \nsus condiciones biofísicas específicas frente a las acciones de compensación a realizar, y \ncon esto poder evaluar si se presentan las condiciones adecuadas a nivel ecosistémico para \nla acción propuesta. \n \n(…)  \n \nSe considera que la incertidumbre en cuanto al ¿Dónde Compensar? Sigue siendo muy alta, \nteniendo en cuenta que la extensión del área preliminar propuesta por la Sociedad es de \n79.284,584155 hectáreas, en comparación con las 32.25 ha inicialmente identificadas como \nárea a compensar (Negrilla por fuera del texto).  \n \nDicho esto, se considera entonces que el área presentada como preliminar no guarda \ncoherencia y proporcionalidad frente al área que debe compensar la Sociedad a la fecha, en \ndonde más allá de la equivalencia de unidades bióticas y la concordancia de la Subzona \nhidrográfica no se presenta una delimitación minuciosa, que se esperaría con el fin de \ndelimitar o acotar las áreas de forma que la ANLA pudiera evaluar pertinentemente la \nviabilidad o no de ellas.  \n \nEn ese sentido, al no tener un área específica, no es posible establecer el cumplimiento del \nprincipio de adicionalidad, que permita determinar si el plan de compensación que la \nSociedad pretende ejecutar generará beneficios ecológicos y de recuperación o ganancias \ndemostrables en el estado de conservación de la biodiversidad, las cuales no serán \nobtenidas sin la implementación de las correspondientes acciones de compensación.  \n \n(…) respecto a la respuesta dada por la Sociedad a los Requerimientos 2 y 3, solicitados \nmediante oficio 2022007704-2-000 del 20 de enero de 2022, se considera que éstos no \nfueron subsanados con la información presentada en el radicado 2022051346-1000 del 18 \nde marzo de 2022, ya que al no contar con las áreas seleccionadas o preliminares guardando \nproporción con la cantidad de área a compensar de forma que se aterricen las condiciones \nreales del territorio y ecosistema del área, no se pude garantizar la equivalencia ecológica” \n \nEn línea con lo anterior la ANLA, mediante oficio con radicado 2022185339-2-000 del 26 de agosto \nde 2022, requirió nuevamente a la Sociedad información adicional para emitir un pronunciamiento \nde fondo. \n \n- \nRadicado ANLA 2022217153-1-000 del 29 de septiembre de 2022 y radicado ANLA \n2023036560-1-000 del 24 de febrero de 2023: la Sociedad entregó el documento “Plan de \nCompensación del Componente Biótico Campos Yarigui-Cantagallo y Aledaños. Resolución N° \n1316 de 2014 y Resolución N° 539 de 2015 Expediente LAM2317”, en respuesta a la segunda \nsolicitud de información adicional realizada por esta Autoridad mediante el radicado ANLA \n2022185339-2-000 del 26 de agosto de 2022, la cual fue objeto de evaluación por parte de \nANLA en el Concepto Técnico 983 del 9 de marzo de 2023, acogido mediante la Resolución \n607 de 29 de marzo de 2023. Frente a la información presentada, esta Autoridad señaló lo \nsiguiente: \n\nResolución No. 1364       Del 27 JUN. 2023          Hoja No. 14 de 27 \n \n“POR LA CUAL SE RESUELVE UN RECURSO DE REPOSICIÓN” \nPágina 14 de 27 \n \n \n“(…) el área propuesta para la compensación presentada por la Sociedad corresponde a \n8.748,138 hectáreas presentadas como “preliminares”, mientras que en el Plan de \ncompensación presentado por la Sociedad se calcula un área a compensar de 32,25 \nhectáreas (esto se verifica en el ítem cuanto compensar), encontrándose que el área \n“preliminar” propuesta por ECOPETROL S.A, es un área que está por encima en un \n27.126,01% de lo proyectado a ejecutar efectivamente (Negrilla por fuera del texto).  \n \nDe tal forma, se considera que esto no es un preliminar, pues se sale de toda proporción y \nno corresponde a un estimado, sino más bien a un área de carácter general en donde no se \npuede realizar ningún tipo de análisis de pertinencia de las acciones propuestas frente a las \ncondiciones de las áreas.  \n \nDado lo anterior, se entiende que un área “preliminar”, por su definición, corresponde a una \nselección previa a la selección final y sirve como “preparación” o “preámbulo” para esta; sin \nembargo, se observa que la información proporcionada de 8.748,138 hectáreas, no \ncorresponde a una preselección, o una etapa preparatoria, pues no brinda ningún tipo de \ninformación que pueda servir de insumo concreto para evaluar el área y acción a seleccionar \nefectivamente, y deja un alto nivel de incertidumbre, no aceptable en esta etapa del proyecto, \ndado que el porcentaje de exceso de área presentado como preliminar es de 27.126,01% \npor encima del área a compensar.  \n \n(…) \n \nPor tanto, se considera que la información relacionada al DONDE y COMO compensar, no \npermite realizar una evaluación fiable, frente al plan de compensación, dado que con esta, \nno se puede definir si con la propuesta se cumplirá o no, con los principios orientadores del \nmismo (no pérdida neta de biodiversidad - adicionalidad), y además con esta información, \nno se puede garantizar que se compensarán efectivamente los impactos residuales del \nproyecto y se resarcirá al ecosistema en la misma proporción sobre lo impactado; \nigualmente, tampoco permite tener certeza que la ejecución se iniciará a los seis meses \nposteriores a la ejecutoria de un acto administrativo y no permite pronunciarse frente a algún \nárea o acción en específico; lo cual no es aceptable considerando que la generación del \nimpacto viene de años atrás y que no se está teniendo en cuenta lo establecido en el artículo \ntercero de la Resolución 256 de 2018 del MADS en cuanto al inicio de ejecución a los seis \n(6) meses de generado el impacto.  \n \n(…) \n \nSe debe resaltar que en el marco del acogimiento se debe garantizar que la implementación \nse inicie en un término no mayor a 6 meses de la aprobación del plan, lo cual no es viable \ndado que se presentan unas áreas excesivas (8.748,138 hectáreas), frente a lo proyectado \na ejecutar (32,25 hectáreas), en las cuales no hay ningún tipo de aproximación, línea base, \nverificación de condiciones existentes y sobre las cuales no es posible analizar la pertinencia \nde implementación de acciones propuestas, de la que se derivará la verificación del principio \nde no pérdida neta de biodiversidad y la adicionalidad; además tampoco es posible definir \ncomo se realizará el seguimiento a la obligación por cuanto no se cuenta con un estimado \nreal respecto a las mediciones a realizar en cuanto a indicadores.  \n \n(…) \n \nAhora bien, la Resolución 256 del 22 de febrero de 2018 del MADS y posteriormente la \nResolución 370 del 15 de abril de 2021 del MADS, permiten a los proyectos que obtuvieron \nlicencia ambiental previo a la entrada en vigencia de la Resolución 256 de 2018, acogerse \nal DONDE y al COMO, implementar las medidas de compensación; sin embargo debe \nponerse de presente que, para esos casos mencionados, como el que atañe al expediente \n\nResolución No. 1364       Del 27 JUN. 2023          Hoja No. 15 de 27 \n \n“POR LA CUAL SE RESUELVE UN RECURSO DE REPOSICIÓN” \nPágina 15 de 27 \n \nLAM2317, ya se ha generado el impacto de manera previa, es decir ya se ha configurado la \nobligación, pues las actividades impactantes se autorizaron mediante la Resolución 1316 del \n4 de noviembre de 2014 (…)” \n \nEn línea con lo anterior, es claro que la Sociedad presentó en tres (3) oportunidades información \nrelacionada con los lineamientos establecidos en el “capítulo 5.4.1. contenido del plan de \ncompensación del Manual de Compensación del Componente Biótico”, y que el pronunciamiento por \nparte de esta Autoridad frente a la información presentada no está relacionada con la ausencia de \ncontenido, sino que hace referencia específicamente a la escala y nivel de incertidumbre de la \ninformación presentada para los ítems ¿Dónde compensar? y ¿Cómo compensar?, ya que esta \ninformación no fue presentada con el detalle suficiente para emitir un pronunciamiento en cuanto a \nla pertinencia de las áreas y propuestas de compensación presentadas. \n \nAl respecto, el Parágrafo del Artículo 2 de la Resolución 370 del 15 de abril de 2021 señala que:  \n \n“La autoridad ambiental competente evaluara la viabilidad de aprobación de la propuesta del \ndónde y cómo implementar las medidas de compensación o la propuesta de modificación en el \nque se cuente con un plan de compensación aprobado por la Autoridad Ambiental competente; \nsin perjuicio de las infracciones ambientales a que haya lugar de conformidad con la Ley 1333 \nde 2009”. \n \nEs decir, la sola solicitud de acogimiento y entrega de información no es garantía de aprobación del \nacogimiento y del plan de compensación, la propuesta debe ser viable y contar con una evaluación \nde la autoridad competente, y para el proyecto “Campos Petroleros Cantagallo y Aledaños”, \nexpediente LAM2317, al que compete el presente recurso de reposición, resaltando que esta \nAutoridad realizó en tres (3) oportunidades la evaluación de viabilidad de la propuesta, \npronunciándose en los términos antes expuestos. \n \nPor otra parte, la Sociedad también señala dentro de los argumentos presentados, lo siguiente: “(…) \nse puede deducir que esta área preliminar no representa desproporcionalidad teniendo en cuenta \nque en los procesos de implementación de medidas de compensación históricamente se ha \nevidenciado a la Autoridad Ambiental las dificultades que se presentan en el momento de la \nbúsqueda de participantes con interés en el desarrollo de este tipo de actividades, razón por la cual \nes necesaria una estrategia mediante el diseño de un procedimiento para la selección de predios y \nparticipantes en las áreas priorizadas, estableciendo criterios que permiten identificar en el territorio \nlas áreas con mayor potencial para la ejecución de la medida de compensación” \n \nEn cuanto a lo estipulado en el manual de compensaciones del componente biótico, se menciona \nque es una herramienta desarrollada inicialmente para un proceso que debe realizarse durante la \nelaboración del estudio de impacto ambiental, lo que determina que la localización que se establece \nen el numeral 5.4.1 haga referencia a una información preliminar. Sin embargo, cabe resaltar que \neste manual es el punto de partida para que, como en este caso, proyectos que ya cuentan con una \nlicencia ambiental puedan acogerse al marco normativo actual. \n \nCon relación a la escala establecida para la presentación de información, el manual de \ncompensaciones del componente biótico señala que “Para el área de influencia del proyecto, obra o \nactividad se debe generar un mapa de ecosistemas naturales terrestres y vegetación secundaria \npartiendo de la fotointerpretación de cobertura vegetal y uso actual del suelo a escala mínima de \n1:25.000.”. Adicionalmente, el numeral 4 del título 5.4.1 determina que la información de áreas \necológicamente equivalentes debe presentarse a la “escala más detallada posible”, por cuanto la \nSociedad no cumplió con los criterios establecidos en cuanto a la escala para la presentación de la \ninformación. \n \nEn línea con lo anterior, cabe aclarar que, desde la Subdirección de Seguimiento a Licencias \nAmbientales se realiza la evaluación de las propuestas de compensación a estos proyectos que ya \nhan surtido la etapa de licenciamiento, y que ya han realizado intervenciones en el área y tengan \n\nResolución No. 1364       Del 27 JUN. 2023          Hoja No. 16 de 27 \n \n“POR LA CUAL SE RESUELVE UN RECURSO DE REPOSICIÓN” \nPágina 16 de 27 \n \npendiente el cumplimiento de la obligación, por cuanto la información que se requiere para la \nverificación de las propuestas que presentan los responsables de los proyectos deben ser \naterrizadas al territorio y en una instancia avanzada de concertación con la comunidad de modo que \nla probabilidad de ejecución sea alta.  \n \nDel mismo modo, se evalúan propuestas que ya cuentan con un nivel de detalle que permite discernir \nsi lo propuesto es coherente con el estado actual del territorio y los objetivos que se pretendan \nalcanzar, tanto a nivel local, como enmarcados en un contexto regional que pueda aportar realmente \nal mejoramiento en estructura, composición y función de un ecosistema, que es el fin último de las \ncompensaciones bióticas.  \n \nEn línea con lo anterior, ECOPETROL S.A., presentó para este y otros proyectos una propuesta de \ncompensación global y generalizada que abarca técnicamente todas las acciones de compensación \nde modo que pueda seleccionar cualquiera opción para aplicación en amplios territorios, dejando \ncomo condicional que puede realizar cualquier cambio en cualquier momento de acuerdo con la \ndisponibilidad de áreas, predios, propietarios y recursos, lo que no le permite a esta Autoridad \npronunciarse correctamente en relación con la aprobación o no de una propuesta para \ncompensación, ya que la incertidumbre de lo que se propone es muy alta, y por tanto, no permitirá \nvalidar el cabal cumplimiento de la obligación, teniendo en cuenta que finalmente sería decisión de \nla Sociedad en dónde ejecutar las acciones, sin un proceso de revisión detallado y en coherencia \ncon las funciones y competencias de esta Autoridad Ambiental. \n \nEn otras palabras, los planes de compensación presentados por Ecopetrol S.A., en estos términos \nsolicitan la aprobación para realizar cualquier actividad, en cualquier área que finalmente consideren \na su criterio pertinente, sin un aval de la Autoridad. \n \nCabe resaltar que, específicamente para el expediente LAM2317, la Sociedad señala en el plan de \ncompensación presentado en el radicado ANLA 2022217153-1-000 del 29 de septiembre de 2022 y \nradicado ANLA 2023036560-1-000 del 24 de febrero de 2023, que: “A partir del 12 de mayo de 2015, \nfecha en la cual entró en vigencia el Plan de Manejo Ambiental establecido para los Campos Yariguí-\nCantagallo y aledaños (…) y hasta el 31 de diciembre de 2020, se han ejecutado estrategias de \ndesarrollo correspondientes a construcción y ampliación de locaciones y construcción de líneas de \nflujo y líneas eléctricas y otras estructuras asociadas a la explotación de hidrocarburos, en un área \ntotal de 39,04 hectáreas, en las cuales se generaron impactos por cambio de uso del suelo y \nafectación de cobertura vegetal que serán objeto de compensación de acuerdo con las estrategias \ny acciones planteadas en el presente plan (…)”  \n \nEsta Autoridad aclara que, si bien la ejecución de los planes de compensación conlleva unos \nprocesos de acercamiento específicos, los licenciatarios mantienen constante comunicación con las \ncomunidades del área de influencia como parte de la ejecución de las medidas de manejo ambiental \ny en el marco de los procesos participativos a los que tienen derecho como grupos de interés del \nproyecto. En ese sentido, el conocimiento tanto del proyecto como de sus obligaciones se origina \ndesde el desarrollo del estudio de impacto ambiental y se mantiene a lo largo de la ejecución del \nproyecto, por cuanto ya hay espacios de socialización con los grupos de interés, que se han \npropiciado sin la aprobación del plan, y que específicamente para este proyecto, hace referencia a \nlos acercamientos y gestiones comunitarias que debió realizar para la ejecución de estrategias de \ndesarrollo que ha venido adelantando desde el año 2015. \n \nPor otra parte, ECOPETROL S.A., señala que “se diseñó un procedimiento para la selección de \npredios y participantes en las áreas priorizadas, estableciendo criterios que permitan identificar en el \nterritorio las áreas con mayor potencial para la ejecución de la medida de compensación (…) Sin \nembargo, para poder adelantar el procedimiento anteriormente mencionado es necesario que el plan \nde compensación se encuentre aprobado por la Autoridad Ambiental, teniendo en cuenta los \nantecedentes y experiencias previas de Ecopetrol S.A. frente al cumplimiento de las obligaciones de \ncompensación a nivel nacional”, en línea con lo anterior, si bien ECOPETROL S.A., es autónoma en \nimplementar diferentes estrategias para el cumplimiento de sus obligaciones, estas deben alinearse \n\nResolución No. 1364       Del 27 JUN. 2023          Hoja No. 17 de 27 \n \n“POR LA CUAL SE RESUELVE UN RECURSO DE REPOSICIÓN” \nPágina 17 de 27 \n \ncon la normatividad aplicable, y por tanto los procesos internos de la Sociedad deben contemplar los \ntiempos establecidos por las autoridades y demás entidades a las que competa la evaluación y \nseguimiento de sus obligaciones. \n \nPor otra parte, la Sociedad señala que: “la consideración de la Autoridad Ambiental en cuanto a la \nnecesidad de presentar con un mayor detalle las áreas propuestas para la compensación \ngeneraría una obligación imposible de cumplir teniendo en cuenta que para su ejecución se \nrequiere realizar un despliegue del proceso de selección de predios y participantes previo a la \naprobación del plan de compensación, sobre meras expectativas con los participantes de los \nacuerdos de conservación, frente a acciones de compensación propuestas que en esta instancia aún \nno cuentan con aprobación por parte de la ANLA, lo cual traería consigo una potencial pérdida en la \ncredibilidad de la Empresa frente a las propuestas presentadas en la etapa inicial de selección de \nlos participantes”.  \n \nEs importante resaltar que, ECOPETROL S.A. es la principal empresa del sector hidrocarburos en \nColombia, con 70 años de experiencia, que al corte del tercer trimestre de 2022 reporta un \ndesempeño operativo y comercial sobresaliente y que cuenta con suficiente información a nivel \nregional y un robusto sistema de gestión social organizado en núcleos o áreas de trabajo por \nregiones, teniendo en cuenta que realiza proyectos licenciados en gran parte del territorio nacional, \ncon operación propia o en asocio con otras empresas del sector. Por tanto, es improcedente y \ndesacertado mencionar que hay alguna posibilidad de que ECOPETROL S.A. no pueda acotar una \ninformación en torno a una propuesta de compensación y considere que son “hechos que \nsobrepasen la esfera de dominio humano”, teniendo en cuenta que, cualquier proyecto que cuente \ncon una licencia ambiental debe, en simultáneo con las intervenciones o actividades que realice, \ncontemplar el cumplimiento de todas las obligaciones ambientales, entre ellas la de compensación, \nmás aún cuando esta obligación corresponde a intervenciones que se han ejecutado desde hace 8 \naños. \n \nLa Sociedad también señala como argumento asociado a la “obligación imposible de cumplir” que \nexiste un “Riesgo de un potencial desistimiento del participante del acuerdo de conservación, \nteniendo en cuenta la duración de las etapas de evaluación y aprobación del plan de \ncompensaciones a cargo de la Autoridad Ambiental, así como los tiempos establecidos para la \ngestión del vehículo contractual con el fin de iniciar la ejecución del plan.”. En cuanto a los tiempos \nde evaluación y pronunciamiento por parte de esta Autoridad, se evidencia que la Sociedad ha \nentregado información en tres (3) oportunidades (Radicados ANLA 2021238407-1-000 del 3 de \nnoviembre de 2021, ANLA 2022051346-1-000 del 18 de marzo de 2022 y ANLA 2022217153-1-000 \ndel 29 de septiembre de 2022 y 2023036560-1-000 del 24 de febrero de 2023), la cual ha sido \nevaluada por esta Autoridad con la diligencia requerida por la Sociedad, solicitando en dos (2) \noportunidades la información con el detalle y especificidad técnica requerida para un \npronunciamiento correcto, y que en ninguno de los casos fue atendido correctamente por Ecopetrol. \nCon relación a los tiempos de gestión del vehículo contractual, son responsabilidad del ejecutor, no \nde la Autoridad. \n \nAdicionalmente, este riesgo se puede materializar en cualquier etapa del proceso de ejecución de \nlas compensaciones, incluso cuando ya se cuenta con un plan de compensación aprobado, por lo \nque la Sociedad debe considerar estos riesgos al momento de realizar el planteamiento de la \npropuesta para ejecución de la compensación, por lo que es improcedente que la Sociedad señale \nque este aspecto no le permite presentar las áreas en las que propone ejecutar la compensación, \nteniendo en cuenta adicionalmente que la Sociedad puede informar a los participantes los procesos \ny fases que se requieren para poder avanzar en la implementación, que permita evitar las falsas \nexpectativas y mantener una comunicación clara y transparente con las comunidades.  \n \nEn cuanto al argumento de “Esto, a la vez genera reprocesos al interior de la Empresa ocasionando \nun detrimento patrimonial como se indicó en líneas anteriores; así como la transgresión del principio \nde planeación y economía, alterando las etapas definidas en los cronogramas propuestos por \nEcopetrol S.A., en los planes de compensación, los cuales tienen como origen los aspectos \n\nResolución No. 1364       Del 27 JUN. 2023          Hoja No. 18 de 27 \n \n“POR LA CUAL SE RESUELVE UN RECURSO DE REPOSICIÓN” \nPágina 18 de 27 \n \nadministrativos y técnicos establecidos internamente para desarrollar la actividad”, es claro para esta \nAutoridad que, en línea con lo señalado por la Sociedad, el cumplimiento de la obligación de \ncompensación por el cambio del uso del suelo ya debería estar adelantado teniendo en cuenta que \nel impacto ya fue generado, y por tanto, ya debería estar contemplado como parte de los procesos \nde planeación de Ecopetrol S.A., esto teniendo en cuenta que la Sociedad tiene impuesta esta \nobligación por intervenciones que viene realizando hace aproximadamente 8 años, tiempo suficiente \npara conocer el territorio y realizar una selección más detallada de la zona de ejecución del plan de \ncompensación.  \n \nFinalmente, la Sociedad señala que “en la Regional Central de Ecopetrol S.A., actualmente se están \nejecutando nueve (9) planes de compensación del componente biótico con diecisiete (17) acuerdos \nde conservación suscritos, para un total de 53.92 hectáreas en implementación, dichos planes fueron \npresentados para la aprobación de la Autoridad Ambiental bajo los mismos criterios y lineamientos \ntécnicos, así mismo, han sido objeto de seguimiento y control por parte de la ANLA, sin generarse \ninconformidad o requerimiento alguno al respecto; para evidencia de esto podemos citar del área del \nMagdalena Medio y Catatumbo, proyectos tales como: APE Nafta, APE Aullador y APE Rumbero, \nentre otros.”  \n \nAl respecto, cabe resaltar en primera instancia que, si la Sociedad ya se encuentra ejecutando \nalgunos planes de compensación y ya ha suscrito acuerdos de conservación, tiene el conocimiento \ndel territorio con el detalle suficiente para presentar una propuesta en los términos y escala que le \nha sido solicitado por esta Autoridad para este y otros expedientes que tienen pendiente el \ncumplimiento de la obligación de compensación. Por el contrario, la negativa de la Sociedad en \npresentar información a una escala coherente para el análisis y evaluación por parte de esta \nAutoridad da cuenta de la falta de planeación y de establecimiento de procesos claros para una \nimplementación en el territorio, y la extensión en el tiempo para el cumplimiento de las obligaciones \nambientales por la intervención y los impactos que ya fueron generados. \n \nPor otra parte, se aclara a la Sociedad que cada proyecto presenta unas particularidades técnicas y \njurídicas que obran en el correspondiente expediente. Esta Autoridad en cumplimiento de sus \nfunciones de seguimiento y control, analiza y evalúa la información remitida de forma independiente \nlo que conlleva a una conclusión diferencial y por tanto un pronunciamiento y actuar administrativo \nconcreto en cada caso. No obstante, una vez revisados los casos citados, se presenta lo siguiente: \n \nPara el expediente LAV0054-00-2015 que corresponde al proyecto “Área de Perforación Exploratoria \nNafta 1 y 2”, si bien la Resolución 481 del 20 de marzo de 2020 aceptó en el Artículo Segundo el \nPlan de Compensación del Componente Biótico, esta Autoridad en el Artículo Octavo hizo \nrequerimientos para la presentación de información específica, de las áreas ya intervenidas y los \npredios puntuales para la ejecución de la compensación propuesta, entre los que se destaca lo \nsiguiente: \n \n“(…) \n2. Determinar y cuantificar claramente los impactos no evitados, mitigados o corregidos que dan \norigen a la compensación, detallando las coberturas intervenidas por cada obra o actividad y \nanexando los polígonos de las áreas efectivamente intervenidas y las coberturas de la tierra \nasociadas, siguiendo los lineamientos de la Resolución 2182 del 23 de diciembre de 2016, o \ncualquier otra que la derogue o modifique.  \n(…) \n4. Presentar la caracterización ecosistémica y las áreas específicas o predios en donde se \nestablecerán las acciones de compensación, anexando información cartográfica de detalle \n(≥1:5.000) que permita evaluar la pertinencia de las respectivas acciones a ejecutar. Esta \ndeberá involucrar la información general presentada mediante radicado 2018110466-1-000 del \n15 de agosto de 2018, e involucrar los criterios de estructura, composición y riqueza de \nespecies, entre otros, a la escala más detallada posible del área a compensar. (negrilla y \nsubrayado fuera de texto).  \n(…) \n\nResolución No. 1364       Del 27 JUN. 2023          Hoja No. 19 de 27 \n \n“POR LA CUAL SE RESUELVE UN RECURSO DE REPOSICIÓN” \nPágina 19 de 27 \n \n9. Allegar la metodología con los respectivos criterios a tener en cuenta para la selección puntual \no definitiva de las áreas donde se pretende realizar la compensación, en donde se deberá \ninvolucrar el criterio de equivalencia ecosistémica para esa definición.  \n(…) \n11. Allegar el formato de selección del predio propuesto por la Sociedad, al igual que toda la \ndescripción metodológica y justificación de las áreas finalmente seleccionadas, dentro de los \npolígonos denominados como “Área de interés para compensación”.  \n(…) \n22. Proponer áreas o predios específicamente para la implementación de la acción con \nproyectos de uso sostenible sobre los ecosistemas equivalentes no naturalizados a compensar \nen colindancia con corredores ecológicos con potencial para la restauración y/o conservación.  \n(…) \n27. Determinar y cuantificar claramente las áreas afectadas o a afectar y su respectivo cálculo \nde las áreas a compensar.  \n(…) \n33. Presentar un Plan de Monitoreo y Seguimiento para evaluar las condiciones ecológicas \ndentro de las tres (3) acciones propuestas para ejecutar la compensación: Conservación, \nRestauración y de Uso Sostenible - Agroforestal.  \n(…).” \n \nSe destaca que esta Autoridad en el numeral 4 del Artículo Octavo de la Resolución 481 del 20 de \nmarzo de 2020, estableció para el expediente LAV0054-00-2015, la presentación de información \npara evaluación, por lo que, si bien se aprobaron algunos aspectos técnicos relacionados con la \ncompensación, la pertinencia de la ejecución de las acciones en áreas específicas continúa siendo \nobjeto de evaluación, y por tanto, de aprobación por parte de esta Autoridad. \n \nPor su parte, en el Concepto Técnico 3504 del 22 de junio de 2022 acogido en el Acta 332 del 22 de \njunio de 2022, esta Autoridad señala frente al cumplimiento de esta obligación, que “De acuerdo con \nel radicado 2021189747-1-000 del 6 de septiembre del 2021, la Sociedad en respuesta a este \nrequerimiento informa que, de acuerdo con la Resolución 1501 del 9 de septiembre de 2020 \nentregará esta información en los ICA, puesto que se encuentra en el proceso de selección de \nparticipantes y selección de predios para realizar la caracterización correspondiente, por lo anterior \nla sociedad deberá dar cumplimiento a la presente obligación considerando que ya han pasado dos \naños desde la aprobación del plan de compensación.” \n \nLo anterior evidencia, que la aprobación del plan de compensación no es garantía de que la Sociedad \nrealice los procesos de selección de participantes y predios de forma eficiente, toda vez que, al 29 \nde marzo de 2022, fecha de corte documental del seguimiento realizado, la Sociedad aún no había \nreportado avances en cuanto a la selección de áreas finales para la compensación por las \nintervenciones que viene adelantando desde 2016, y de un plan de compensación aprobado dos (2) \naños atrás. Este requerimiento se reiteró en el Acta 332 del 22 de junio de 2022, lo que permite \nestablecer un incumplimiento por parte de la Sociedad que contradice los argumentos presentados \nen cuanto a la pertinencia de la aprobación del plan de compensación en los términos presentados. \n \nPara el expediente LAM4852 que corresponde al proyecto “Área de Perforación Exploratoria \nAullador”, la Resolución 1528 del 30 de julio de 2019 aprobó en el Artículo Segundo el Plan de \nCompensación del Componente Biótico, y requirió en el subnumeral 1.1 del numeral 1 del Artículo \nTercero, para que en un plazo no mayor a seis (6) meses contados a partir de la ejecutoria de dicho \nacto administrativo, la presentación de las “las áreas específicas en las cuales se propone realizar \nlas acciones de Compensación para el proyecto exploratorio Aullador, referentes a Rehabilitación \nactiva y Proyectos de Uso Sostenible – Silvopastoril y Agroforestal con Cacao”. \n \nAl respecto, en el Concepto Técnico 5980 del 28 de septiembre de 2020 acogido mediante Auto \n10317 del 23 de octubre de 2020, se señala que aun cuando la Sociedad entregó el ajuste al plan \nde compensación componente biótico mediante radicado 2020132578-1-000 del 14 de agosto de \n2020, no incluyó la ubicación de las áreas específicas seleccionadas para la compensación biótica, \n\nResolución No. 1364       Del 27 JUN. 2023          Hoja No. 20 de 27 \n \n“POR LA CUAL SE RESUELVE UN RECURSO DE REPOSICIÓN” \nPágina 20 de 27 \n \npor lo que se reiteró el requerimiento de información. \n \nCon relación al avance de las actividades, en el Concepto Técnico 2000 del 20 de abril de 2022, \nacogido mediante Resolución 1483 del 13 de julio de 2022, que correspondió al seguimiento \nambiental durante el periodo del 15 agosto de 2020 al 2 de marzo de 2022, se señala que “a la fecha \nla Sociedad ya debe contar con la caracterización de los predios, elaboración del diseño predial y \nfirma del acuerdo, aislamiento e inicio del establecimiento de barreas y franjas (teniendo en cuenta \nque el primer mes de ejecutoria correspondió del 18 de febrero del 2020 al 18 de marzo del 2020, \ndía en que se suspendieron las actividades, dadas las circunstancias de fuerza mayor originadas por \nla pandemia COVID-19). Luego, a partir del 2 de septiembre de 2020, la Sociedad debió dar \ncontinuidad al cronograma propuesto”.  \n \nFrente a lo anterior, la Sociedad mediante radicado 2021047795-1-000 del 17 de marzo de 2021, \npresentó ante esta Autoridad la “Actualización del cronograma de actividades del Plan de \nCompensación Componente Biótico del Proyecto Área de Perforación Exploratoria Aullador”, el cual \nfue aceptado en la Resolución 1483 del 13 de julio de 2022; sin embargo, al cierre documental del \ncitado Concepto, la Sociedad no había remitido las áreas específicas seleccionadas para la ejecución \ndel plan, teniendo en cuenta que la selección de áreas y predios fue propuesta para ejecución entre \nel cuarto trimestre del año 1 y el segundo trimestre del año 2 de ejecución del plan de compensación. \n \nAl respecto, es claro que la Sociedad, con el paso del tiempo, extiende en el tiempo el cumplimiento \nde la obligación presentando modificaciones a la información ya aprobada, en términos de áreas y \ncronograma, lo cual se traduce en la no ejecución de las acciones que permitan demostrar el \ncumplimiento de la obligación. \n \nFinalmente, en cuanto al plan de compensación del proyecto “Área de Perforación Exploratoria \nRumbero”, con expediente LAM4816, de igual forma que en los casos anteriores, en la Resolución \n1819 del 11 de septiembre de 2019, la cual aprobó acogimiento al régimen de transición establecido \nen el numeral 2 del artículo 10 de la Resolución 0256 del 22 de febrero de 2018 y el plan de \ncompensación del componente biótico presentado, se solicitó en el literal a del numeral 1 del Artículo \nNoveno, la presentación de la “cartografía correspondiente a las áreas específicas en las cuales se \npropone realizar las acciones de Compensación”.  \n \nAl respecto, en el Concepto Técnico 4702 del 12 de agosto de 2022 acogido mediante Acta de \nReunión de control y seguimiento ambiental No. 511 del 22 de agosto de 2022, y que realizó el \nseguimiento ambiental a los ICA No. 10 (periodo enero a diciembre de 2020) y 11 (periodo enero a \ndiciembre de 2021), con fecha de corte documental 25 de julio de 2022, se indica que la Sociedad \npresentó la cartografía de las áreas seleccionadas para las acciones de compensación para los \npredios La Oni, La Primavera y Mayporillal. Sin embargo, la Sociedad en el ICA No. 11 indica que \n“en la GDB se presenta la información del predio Mayporillal donde se adelantó parte de las acciones \nde rehabilitación para dar cumplimiento a la obligación de compensación del APE Rumbero, debido \na que por cambios de opinión de los demás participantes no se pudo realizar las acciones de \nrehabilitación y usos sostenible contempladas en los predios La Oni y la Primavera durante el periodo \nde reporte (año 2021). La información relacionada con las áreas faltantes, donde se establezca las \nacciones de compensación para el cumplimiento de la obligación de compensación del APE \nRumbero se informará en el respectivo ICA”.  \n \nDe lo anterior se destaca que, de las 6,25 ha por compensar, a la fecha de corte de este seguimiento \nsolamente se ha logrado el establecimiento de 1,06 ha por desistimiento por parte de beneficiarios \nseleccionados, posterior a la aprobación del plan de compensación. Ahora bien, en cuanto a la \npertinencia de las acciones ejecutadas, esta Autoridad señaló en el citado concepto técnico de \nseguimiento:  \n \n“respecto a la ortofoto adjunta en el anexo A5 del ICA 11 y que corresponde al estado del área \nantes de la siembra, al ser comparada con la imagen DigitalGlobe del año 2022, no se evidencia \nun cambio significativo en cuanto a la cobertura de pastos y del Bosque de galería, tal como se \n\nResolución No. 1364       Del 27 JUN. 2023          Hoja No. 21 de 27 \n \n“POR LA CUAL SE RESUELVE UN RECURSO DE REPOSICIÓN” \nPágina 21 de 27 \n \nevidencia en la anterior imagen. Esto permite concluir que en el área de bosque protector del \npredio Mayporillal aumentó su cobertura antes de la ejecución de las acciones de rehabilitación \nimplementadas por la Sociedad para el plan de compensación del proyecto “Área Perforación \nExploratoria Rumbero”. Uno de los principios orientadores de las compensaciones del \ncomponente biótico corresponde a la adicionalidad, que se define como las ganancias \ndemostrables que se deben alcanzar en el estado de conservación de la biodiversidad, que no \nserían obtenidas sin la implementación de la acción de compensación. En ese sentido, un \ncambio positivo en la cobertura vegetal de bosques antes de la implementación del plan de \ncompensación por parte de la Sociedad significa que posiblemente la implementación de \nacciones de rehabilitación en la cobertura boscosa no generará resultados diferentes a los que \nse podrían obtener en el área sin realizar acción alguna, es decir, la acción no genera \nadicionalidad. \n \nA partir de lo anterior, esta Autoridad considera relevante requerir a la Sociedad la delimitación \ndel polígono que se encuentran en proceso de implementación de las acciones de rehabilitación \nen el predio Mayporillal, a partir del análisis de cumplimiento del principio de adicionalidad en \nlos términos anteriormente citados. Asimismo, deberá garantizar el cumplimiento del principio \nde adicionalidad para los polígonos a presentar para el cumplimiento de esta obligación \npresentando el análisis correspondiente.” \n \nLo anterior permite concluir que, si bien hay un proceso de selección predial que la Sociedad \nadelanta a partir de la aprobación de un plan de compensación, esta selección no está garantizando \nel cumplimiento de los principios orientadores establecidos en el Manual de Compensaciones del \nComponente Biótico, como lo es el principio de adicionalidad, lo que generará reprocesos a la \nSociedad teniendo en cuenta que las acciones de compensación deben cumplir con los lineamientos \nestablecidos en el marco normativo en el que se enmarque la obligación. En ese sentido, es claro \nque el proceso de desistimiento no se genera por la presentación de las áreas definitivas para el \nproceso de evaluación, como lo menciona la Sociedad. \n \nPor esta razón es relevante la presentación por parte de la Sociedad de información que pueda servir \nde insumo concreto para evaluar el área y acción a ejecutar, y que permita definir si con la propuesta \nse cumplirá o no con los principios orientadores establecidos para la compensación (no pérdida neta \nde biodiversidad - adicionalidad). \n \nA partir de los anteriores ejemplos citados por la Sociedad se puede afirmar que, si bien es claro que \nla ejecución de las actividades asociadas a la compensación no están exentas de situaciones de \nfuerza mayor que obligan a replantear los cronogramas para su ejecución, es claro que la ejecución \nde los planes de compensación ya aprobados bajo la normatividad establecida en la Resolución 256 \ndel 256 de 22 de febrero de 2018, no se están ejecutando en los términos establecidos en la citada \nResolución, ya que al ser acogimiento de proyectos que ya habían realizado el impacto o afectación \nobjeto de compensación, los planes debieron iniciar una vez fueron aprobados, y deberían cumplir \ncon los principios orientadores establecidos para la compensación (no pérdida neta de biodiversidad \n– adicionalidad). \n \nEn línea con lo anterior, cabe resaltar que la aprobación de un plan no es garantía de la ejecución \nde procesos más eficientes o de selección de predios con mayor facilidad, por esto la Sociedad debe \npropender por avanzar en el cumplimiento de las obligaciones en paralelo con la ejecución de las \nactividades propias de la operación de las actividades.  \n \nFinalmente, la Sociedad señala que “Ecopetrol S.A., desvirtúa las consideraciones expuestas por la \nAutoridad Nacional de Licencias Ambientales - ANLA, (…); reiterando que hizo la entrega de la \ninformación mínima requerida tendiente a aprobar el acogimiento y el plan de compensación.”. \nNuevamente se aclara que, la sola solicitud de acogimiento y entrega de información no es garantía \nde aprobación ya que, acorde con lo señalado en el Parágrafo del Artículo 2 de la Resolución 370 \ndel 15 de abril de 2021, la propuesta debe ser viable y contar con una evaluación de la autoridad \ncompetente.  \n\nResolución No. 1364       Del 27 JUN. 2023          Hoja No. 22 de 27 \n \n“POR LA CUAL SE RESUELVE UN RECURSO DE REPOSICIÓN” \nPágina 22 de 27 \n \n \nAl respecto, se aclara que esta Autoridad realizó dos evaluaciones de información antes del \npronunciamiento definitivo, a partir de las cuales expuso claramente en los oficios con radicado \n2022007704-2-000 del 20 de enero de 2022 y 2022185339-2-000 del 26 de agosto de 2022 los \ntérminos en los cuales debía ser presentada la información, y contando adicionalmente con mesas \ntécnicas desarrolladas con funcionarios de la Sociedad en las que se expuso de forma detallada la \ninformación requerida y como debía ser presentada y se resolvieron las inquietudes al respecto. Sin \nembargo, la Sociedad no atendió la información requerida en las dos oportunidades señaladas, ni \nacogió las recomendaciones de las mesas técnicas, las cuales entre otros objetivos, pretende evitar \nlos reprocesos administrativos al realizar evaluaciones de información que no cumple con la \nnormatividad ambiental vigente para el cumplimiento de obligaciones ambientales que están en \ndeuda por parte de la Sociedad, y que redunda en los tiempos que la Sociedad señala, se extienden \nlos procesos de aprobación.  \n \nEn conclusión, se considera que los argumentos expuestos por la Sociedad en cuanto a la \nimposibilidad de presentar una información en una escala adecuada para la evaluación y \npronunciamiento por parte de esta Autoridad no son procedentes teniendo en cuenta que la solicitud \nde acogimiento hace referencia al cumplimiento de una obligación de compensación por los impactos \nque ya fueron generados, por cuanto la información que se requiere para la verificación de las \npropuestas que presentan los responsables de los proyectos deben ser aterrizadas al territorio y en \nuna instancia avanzada de concertación con la comunidad de modo que la probabilidad de ejecución \nsea alta.  \n \nCon base en todo lo expuesto anteriormente, se CONFIRMA lo dispuesto en el Artículo Primero y \nArtículo Segundo de la Resolución 607 del 29 de marzo de 2023, toda vez que la Sociedad no \npresentó la información requerida en cuanto al DÓNDE y CÓMO compensar, en una escala \nadecuada para la evaluación y pronunciamiento en cuanto a la pertinencia de las áreas y propuestas \nde compensación presentadas. \n \n(…)” \n \nSi bien es cierto que la Sociedad a través de la comunicación son radicación 2021238407-\n1-000 del 3 de noviembre de 2021, presentó solicitud de acogimiento al régimen de \ntransición establecido en el numeral 2 del artículo 10 de la Resolución 256 del 22 de febrero \nde 2018, modificada por la Resolución 1428 del 31 de julio de 2018, es importante resaltar \nque la información no cumplía con los mínimos necesarios para decidir de fondo la solicitud \nen comento, razón por la cual la Autoridad Nacional requirió información adicional mediante \nlos oficios con radicación 2022007704-2- 000 del 20 de enero de 2022 y 2022185339-2-\n000 del 26 de agosto de 2022, atendida por medio de las comunicaciones con radicación \n2022051346-1-000 del 18 de marzo de 2022, 2022217153-1-000 del 29 de septiembre de \n2022, y 2023036560-1-000 del 24 de febrero de 2023. \n \nAhora bien, aun cuando la Autoridad Nacional en ejercicio y cumplimiento del debido \nproceso le otorgó la posibilidad a la Sociedad de ajustar la información conforme con los \nlineamientos del Manual de Compensaciones Ambientales del Componente Biótico, \nadoptado mediante la Resolución 256 del 22 de febrero de 2018, modificada por la \nResolución 1428 del 31 de julio de 2018, el titular de la licencia ambiental presentó áreas \npreliminares para la compensación salidas de proporción por su gran extensión \n(79.284,584155 ha, 8.748,138 ha), mientras que en el Plan de compensación calculaba un \nárea a compensar de 32,25 ha.  \n \nEs importante resaltar que las áreas presentadas por la Sociedad son áreas generales en \nlas cuales no se puede llevar a cabo un análisis de pertinencia de las acciones propuestas \n\nResolución No. 1364       Del 27 JUN. 2023          Hoja No. 23 de 27 \n \n“POR LA CUAL SE RESUELVE UN RECURSO DE REPOSICIÓN” \nPágina 23 de 27 \n \nfrente a las condiciones de las áreas, lo que conlleva a que no se puedan tener como \nselección previa pues dejan un alto nivel de incertidumbre, el cual no es aceptable en esta \netapa del proyecto, impidiendo una evaluación fiable frente al plan de compensación y la \nadicionalidad que debe proporcionar. \n \nPor otra parte, a la luz de la norma se debe tener en cuenta que el parágrafo del artículo 2 \nde la Resolución 370 del 15 de abril de 2021, estableció que la autoridad competente \nevaluaría la propuesta del DÓNDE y CÓMO implementar las medidas de compensación o \nla propuesta de modificación, y en ningún aparte estableció que la sola presentación de la \nsolicitud y la información garantizaba al usuario la aprobación del acogimiento a lo dispuesto \nen el artículo primero de la resolución en comento, y el respectivo plan. \n \nEn lo que concierne con la escala en la cual se debe presentar la información cartográfica, \nel Manual de Compensaciones Ambientales del Componente Biótico estableció que “Para \nel área de influencia del proyecto, obra o actividad se debe generar un mapa de \necosistemas naturales terrestres y vegetación secundaria partiendo de la fotointerpretación \nde cobertura vegetal y uso actual del suelo a escala mínima de 1:25.000.”; y aunado a ello, \nen el numeral 4 del contenido del plan de compensación se determinó que debía contener \n“Información de las áreas ecológicamente equivalentes para compensación (Tipo de \necosistema, estructura, condición, composición y riqueza de especies, entre otros) a la \nescala más detallada posible.”, lo cual, no fue atendido por el titular de la licencia \nambiental en la información aportada del DÓNDE y CÓMO compensar. \n \nPor otra parte, el titular de la licencia ambiental debe tener en cuenta que los riesgos que \nse pueden presentar a causa del desistimiento de los propietarios de los predios con los \ncuales se pretendan realizar acuerdos de conservación, son una situación que se puede \npresentar en cualquier momento del proceso, por lo cual, no se configura como un eximente \npara la falta de puntualización de la información. Aunado a ello, al ser la Sociedad quien \nrealiza los planteamientos del Plan de compensación y las fases para la respectiva \nimplementación, puede establecer con claridad los ejecutables y las propuestas a presentar \nfrente a los propietarios de los predios en los cuales pretende realizar las acciones del Plan \nen comento, aún más, cuando viene realizando intervenciones hace aproximadamente 8 \naños lo que le ha permitido conocer el territorio. \n \nAhora bien, aun cuando los Planes de Compensación presentados por la Sociedad no están \nexentos de situaciones de caso fortuito y/o fuerza mayor llevándolos a ser modificados, es \nnecesaria la presentación de la información de manera concreta y detallada con el fin de \nque la Autoridad Nacional en el marco de sus competencias y bajo la luz de la normatividad \nambiental vigente y aplicable al proyecto “Campos Petroleros Cantagallo y Aledaños”, \nrealice el respectivo seguimiento y control ambiental al cumplimiento de cada una de las \nobligaciones impuestas por la ejecución del proyecto, y a su vez, vele por el cumplimiento \nde los diferentes preceptos constitucionales ecologistas que ordenan defender y conservar \nel medio ambiente, así como proteger los bienes y riquezas ecológicas indispensables para \nobtener un desarrollo sostenible. \n \nEs importante resaltar que el actuar de la Autoridad Nacional se encuentra acorde con el \nprincipio de igualdad consagrado en el artículo 13 de la Constitución Política de Colombia, \ny frente al cual la Sentencia C-571 del 13 de septiembre de 2017, Magistrado Ponente \nALEJANDRO LINARES CANTILLO dispuso lo siguiente: \n \n“(…) \n\nResolución No. 1364       Del 27 JUN. 2023          Hoja No. 24 de 27 \n \n“POR LA CUAL SE RESUELVE UN RECURSO DE REPOSICIÓN” \nPágina 24 de 27 \n \n \nEl derecho a la igualdad está previsto en el artículo 13 de la Constitución Política, así como en \ninstrumentos internacionales de derechos humanos que, en virtud del artículo 93 numeral 2, \nhacen parte del bloque de constitucionalidad. De este derecho se desprenden dos mandatos \nbásicos: (i) otorgar el mismo trato a supuestos de hecho equivalentes y (ii) otorgar un trato \ndiferente a situaciones de hecho disímiles. Como se observa, el rasgo esencial del derecho a la \nigualdad es que implica un juicio de comparación entre dos personas o grupos de personas. Para \ndeterminar con mayor precisión el alcance del derecho a la igualdad, la Corte ha especificado \nestos dos mandatos generales en cuatro reglas, a saber: (i) debe darse un tratamiento distinto a \nsituaciones de hecho que no tienen ningún elemento en común; (ii) debe darse el mismo trato a \nsituaciones de hecho idénticas; (iii) debe darse un trato paritario a situaciones de hecho que \npresenten similitudes y diferencias, cuando las similitudes sean más relevantes que las \ndiferencias; y (iv) debe darse un trato diferente a situaciones de hecho que presenten similitudes \ny diferencias, cuando las diferencias sean más relevantes que las similitudes. Con el propósito \nde determinar cuándo se presenta alguna de las hipótesis mencionadas antes, la Corte ha tenido \nen cuenta un juicio a partir de tres etapas de análisis.  \n \nPrimero, se debe establecer el criterio de comparación (también denominado tertium \ncomparationis). Segundo, se debe definir si en el plano fáctico y en el plano jurídico existe \nrealmente un trato igual o diferenciado. Así, una vez establecido el criterio de comparación, debe \nverificarse si efectivamente existe un trato igual o un trato diferenciado o si en realidad el cargo \npor vulneración del derecho a la igualdad parte de una indebida comprensión o interpretación de \nlo que establece la medida analizada. De este juicio pueden entonces desprenderse dos \nhipótesis: o los grupos o personas no son comparables a la luz del criterio de comparación y, en \nconsecuencia, no se afecta el mandato de trato igual; o los grupos o personas si pueden ser \nasimiladas y, en esa medida, se presenta una afectación prima facie del derecho a la igualdad.   Si \nocurre lo segundo (si las personas o grupos pueden ser asimilados), en tercer lugar, se debe \ndeterminar si la diferencia de trato se encuentra constitucionalmente justificada, análisis que \nvaría, pues puede hacerse en intensidades distintas, teniendo como propósito salvaguardar el \nprincipio democrático y la separación de poderes, sin afectar gravemente los derechos \ninalienables de la persona (artículos 1, 5 y 113 de la Constitución, respectivamente). En este \nsentido, la Corte ha señalado que el juicio de proporcionalidad no puede ser aplicado con la \nmisma intensidad en todos los casos. De no proceder así (es decir, si siempre se aplicara la \nmisma intensidad en el análisis de proporcionalidad), las competencias de los diferentes órganos \ndel Estado, al igual que las posibilidades de actuación de los particulares en ejercicio de la libre \niniciativa privada, podrían resultar anuladas o afectadas gravemente. Ello se debe a que, en \núltimas, en este paso lo que se analiza es si la diferenciación prevista por la medida analizada es \no no proporcional. Con fundamento en lo anterior, la jurisprudencia constitucional ha reconocido \ntres intensidades que pueden tenerse en cuenta para este análisis, a saber: leve, intermedia y \nestricta. (…) En cada caso deberá el juez valorar las diferentes razones que concurren para \nfundamentar la intensidad del juicio, de acuerdo con los criterios jurisprudencialmente \nestablecidos. \n \n(…)” \n \nAsí las cosas, la Autoridad Nacional realiza una aplicación objetiva de la normativa \nambiental sin crear criterios de distinción que representen algún tipo de concesión o \nfavorecimiento para alguno de los administrados o de los instrumentos de manejo \nambiental, razón por la cual, exige claridad y puntualidad en la información acorde a cada \nterritorio y sus respectivas condiciones y/o necesidades en concordancia con el marco \nnormativo de cada proyecto.  \n \nDe igual forma la Autoridad Nacional actúa de buena fe y en el marco de la legalidad con el \nanálisis, evaluación y pronunciamiento de las diferentes solicitudes que presentan los \ntitulares de las licencias ambientales de su competencia, siendo así concordante con lo \n\nResolución No. 1364       Del 27 JUN. 2023          Hoja No. 25 de 27 \n \n“POR LA CUAL SE RESUELVE UN RECURSO DE REPOSICIÓN” \nPágina 25 de 27 \n \nseñalado en la Sentencia C-1194 del 3 de diciembre de 2008, por el Magistrado Ponente \nDr. RODRIGO ESCOBAR GIL: \n \n“(…) \n \nEn este orden de ideas la jurisprudencia constitucional ha definido el principio de buena fe como \naquel que exige a los particulares y a las autoridades públicas ajustar sus comportamientos a una \nconducta honesta, leal y conforme con las actuaciones que podrían esperarse de una “persona \ncorrecta (vir bonus)”. En este contexto, la buena fe presupone la existencia de relaciones \nreciprocas con trascendencia jurídica, y se refiere a la “confianza, seguridad y credibilidad que \notorga la palabra dada” \n \nEn este sentido la Corte ha señalado que la buena fe es un principio que “de conformidad con el \nartículo 83 de la Carta Política se presume, y dicha presunción solamente se desvirtúa con los \nmecanismos consagrados por el ordenamiento jurídico vigente”. \n \nConcretamente con respecto al contenido concreto del artículo 83 superior, debe la Corte indicar \nque conforme con este (i) las actuaciones de los particulares y de las autoridades públicas deben \nestar gobernadas por el principio de buena fe y; (ii) ella se presume en las actuaciones que los \nparticulares adelanten ante las autoridades públicas, es decir en las relaciones jurídico \nadministrativas. \n \n(…)” \n \nComo se mencionó anteriormente, las actuaciones y decisiones de la Autoridad Nacional \nse encuentran fundadas en el análisis de la documentación particular remitida por el titular \nde licencia ambiental observando las directrices establecidas en la normatividad ambiental, \nla cual, actúa como un garante del cumplimiento de las obligaciones. \n \nPor lo anterior, la Autoridad Nacional procederá a confirmar los artículos primero y segundo \nde la Resolución 607 del 29 de marzo de 2023, tal y como quedará plasmado en la parte \nresolutiva. \n \nRESUELVE \n \nARTÍCULO PRIMERO. Confirmar el contenido de los artículos primero y segundo de la \nResolución 607 del 29 de marzo de 2023, de conformidad con lo expuesto en la parte motiva \ndel presente acto administrativo. \n \nARTÍCULO SEGUNDO. Notificar el presente acto administrativo al representante legal, o \nal apoderado debidamente constituido o a la persona debidamente autorizada de la \nSociedad ECOPETROL S.A. identificada con NIT. 899.999.068-1, o a quien haga sus \nveces, de conformidad con lo dispuesto en los artículos 67 y 69 del Código de \nProcedimiento Administrativo y de lo Contencioso Administrativo.  \n \nPARÁGRAFO. En el evento en que el titular de la licencia o el permiso, según el caso, sea \nuna persona natural que se acoja al proceso de insolvencia regulado por las normas \nvigentes, o se trate de una sociedad comercial o de una sucursal de sociedad extranjera \nque entre en proceso de disolución o régimen de insolvencia empresarial o liquidación \nregulados por las normas vigentes, informará inmediatamente de esta situación a esta \nAutoridad, con fundamento, entre otros, en los artículos 8, 58, 79, 80, 81, 95 numeral 8 de \n\nResolución No. 1364       Del 27 JUN. 2023          Hoja No. 26 de 27 \n \n“POR LA CUAL SE RESUELVE UN RECURSO DE REPOSICIÓN” \nPágina 26 de 27 \n \nla Constitución Política de 1991, en la Ley 43 de 1990, en la Ley 222 de 1995, en la Ley \n1333 de 2009 y demás normas vigentes y jurisprudencia aplicable. \n \nAdicional a la obligación de informar a esta Autoridad de tal situación, el titular de la licencia \no permiso aprovisionará contablemente las obligaciones contingentes que se deriven de la \nexistencia de un procedimiento ambiental sancionatorio conforme con el artículo 40 de la \nLey 1333 de 2009 o la norma que la adicione, modifique o derogue.  \n \nARTÍCULO TERCERO. Por parte de la Autoridad Nacional, comunicar el contenido del \npresente acto administrativo a la Corporación Autónoma Regional del Sur de Bolívar (CSB), \na la Corporación Autónoma Regional de Santander (CAS), a la Corporación Autónoma \nRegional del Cesar (CORPOCESAR), a la Corporación Autónoma Regional de Norte de \nSantander (CORPONOR), a la Corporación Autónoma Regional para la Defensa de la \nMeseta de Bucaramanga (CDMB). \n \nARTÍCULO CUARTO. Publicar la presente Resolución en la Gaceta Ambiental de la \nAutoridad Nacional de Licencias Ambientales (ANLA) de conformidad con lo señalado en el \nartículo 71 de la Ley 99 del 22 de diciembre de 1993. \n \nARTÍCULO QUINTO. Contra el presente acto administrativo no procede recurso alguno, de \nconformidad con lo establecido en el artículo 87 del Código de Procedimiento Administrativo \ny de lo Contencioso Administrativo. \n \nNOTIFÍQUESE, COMUNÍQUESE, PUBLÍQUESE Y CÚMPLASE \n \n \n \nDado en Bogotá D.C., a los 27 JUN. 2023 \n \n \n \n \n \nEDILBERTO PENARANDA CORREA \nASESOR \n \n \n \n \n \nYURI KATHERINE ROA BUITRAGO \nCONTRATISTA \n \n \n \nANDREA DEL PILAR SANABRIA DEL RIO \nCONTRATISTA \n \n \n\nResolución No. 1364       Del 27 JUN. 2023          Hoja No. 27 de 27 \n \n“POR LA CUAL SE RESUELVE UN RECURSO DE REPOSICIÓN” \nPágina 27 de 27 \n \n \nExpediente No. LAM2317 \nConcepto Técnico N° 2964 del 31 de mayo de 2023. \nFecha: 6 de junio de 2023 \n \n \nProceso No.: 20231000013644 \n \nNota: Este es un documento electrónico generado desde los Sistemas de Información de la ANLA. El original reposa en los archivos digitales de la \nEntidad \n \n \n \n \n \n \n \n \n \n \n \n \n \n \n \n \n \n \n \n \n \n"
}