{
  "fuente": "ANLA_GACETA",
  "numero_resolución": "RESOLUCIÓN N° 00701",
  "fecha_resolución": "2023-04-10",
  "anio_resolucion": "2023",
  "nombre_proyecto": "Campo de Producción Cumanday”, localizado en",
  "nombre_proyecto_normalizado": "CAMPO DE PRODUCCION CUMANDAY LOCALIZADO EN",
  "ubicación": "municipio de Puerto Gaitán en el departamento del Meta",
  "empresa": "ECOPETROL",
  "empresa_normalizada": "ECOPETROL",
  "numero_expediente": "ATV-00791",
  "radicados": [
    "2023000555",
    "2022071099",
    "2020118588",
    "2019149888",
    "20201185881",
    "2020005006"
  ],
  "descripcion": "POR LA CUAL SE RESUELVE UN RECURSO DE REPOSICIÓN",
  "tipos_infraccion": [
    "Manejo de aguas",
    "Tala o afectación de bosques"
  ],
  "tipos_infraccion_normalizados": [
    "MANEJO DE AGUAS",
    "TALA O AFECTACION DE BOSQUES"
  ],
  "pdf_id": "42239",
  "file_name": "ANLA_42239.pdf",
  "texto_completo": "|\nRepública de Colombia\nMinisterio de Ambiente y Desarrollo Sostenible\nAUTORIDAD NACIONAL DE LICENCIAS AMBIENTALES \n- ANLA –\nRESOLUCIÓN N°  00701\n( 10 de abril de 2023 )\nOficinas: Carrera 13 A No. 34 – 72 Edificio 13 35 Pisos 8 al 11 Bogotá, D.C.\nCentro de Orientación y Radicación de Correspondencia: Carrera 13 A No. 34 – 72 Edificio 13 35 \nLocales 110 al 112 Bogotá, D.C.  \nCódigo Postal 110311156\nNit.: 900.467.239-2\nLínea de Orientación y Contacto Ciudadano: 57 (1) 2540100 / 018000112998 PBX: 57 (1) 2540111\nwww.anla.gov.co    Email: licencias@anla.gov.co  \nPágina 1 de 36\n“POR LA CUAL SE RESUELVE UN RECURSO DE REPOSICIÓN”\nEL ASESOR DEL DESPACHO DEL DIRECTOR DE LA AUTORIDAD NACIONAL DE \nLICENCIAS AMBIENTALES – ANLA\nEn ejercicio de las facultades legales establecidas mediante la Ley 99 del 22 de diciembre \nde 1993, el Decreto Ley 3573 del 27 de septiembre de 2011, modificado por el Decreto \n376 del 11 de marzo de 2020, por el cual se modifica la estructura de la Autoridad \nNacional de Licencias Ambientales y acorde con lo regulado en el Decreto 1076 del 26 de \nmayo de 2015, la Resolución 669 del 14 de abril de 2020, la Resolución 1957 del 5 de \nnoviembre de 2021 y la Resolución 2795 del 25 de noviembre de 2022, expedidas por la \nAutoridad Nacional de Licencias Ambientales, y\nCONSIDERANDO\nQue mediante Resolución 1 del 2 de enero de 2019, la Autoridad Nacional de Licencias \nAmbientales - ANLA, (En adelante la Autoridad Nacional), otorgó licencia ambiental global \na la Sociedad ECOPETROL S.A., identificada con NIT. 899.999.068-1, (En adelante la \nSociedad), para el proyecto denominado “Campo de Producción Cumanday”, localizado en \njurisdicción del municipio de Puerto Gaitán en el departamento del Meta.\nQue mediante Resolución 1148 del 20 de junio de 2019, la Autoridad Nacional resolvió \nrecurso de reposición interpuesto contra la Resolución 1 del 2 de enero de 2019, en el \nsentido de autorizar el recibo de agua de otros campos, entre otras disposiciones.\nQue mediante Auto 10887 del 17 de noviembre del 2020, la Autoridad Nacional avocó \nconocimiento de unas actuaciones administrativas remitidas por el Ministerio de Ambiente \ny Desarrollo Sostenible (MADS), obrantes en el expediente ATV-00791 allegado por medio \ndel oficio con radicación 2020038963-1-000 del 11 de marzo de 2020, contentivo de las \nautorizaciones de levantamiento parcial de veda a favor de la Sociedad.\nQue mediante Resolución 676 del 13 de abril de 2021, la Autoridad Nacional impuso \nmedidas adicionales de control y seguimiento consistentes en incluir los parámetros \nfisicoquímicos y microbiológicos que se deberán monitorear en los pozos de agua \nsubterránea concesionados y adoptó otras determinaciones.\nQue mediante la Resolución 3012 del 20 de diciembre de 2022, la Autoridad Nacional \naceptó la solicitud de acogimiento a la Resolución 256 del 22 de febrero de 2018, modificada \npor la Resolución 1428 del 31 de julio de 2018, Manual de Compensaciones del \nComponente Biótico, en virtud del artículo 1 de la Resolución 370 del 15 de abril de 2021, \nen lo referente al DÓNDE y CÓMO implementar las medidas de compensación. La decisión \nfue notificada mediante correo electrónico a la Sociedad el día 20 de diciembre de 2022.\nQue a través de la comunicación con radicación 2023000555-1-000 del 02 de enero de \n2023, la Sociedad interpuso Recurso de Reposición en contra de la Resolución 3012 del 20 \nde diciembre de 2022, argumentos que fueron evaluados por el equipo técnico de la \n\nResolución No.  00701           Del   10 de abril de 2023            Hoja No. 2 de 36\n“POR LA CUAL SE RESUELVE UN RECURSO DE REPOSICIÓN”\nOficinas: Carrera 13 A No. 34 – 72 Edificio 13 35 Pisos 8 al 11 Bogotá, D.C.\nCentro de Orientación y Radicación de Correspondencia: Carrera 13 A No. 34 – 72 Edificio 13 35 \nLocales 110 al 112 Bogotá, D.C.  \nCódigo Postal 110311156\nNit.: 900.467.239-2\nLínea de Orientación y Contacto Ciudadano: 57 (1) 2540100 / 018000112998 PBX: 57 (1) 2540111\nwww.anla.gov.co    Email: licencias@anla.gov.co  \nPágina 2 de 36\nAutoridad Nacional y en consecuencia expidió el Concepto técnico 1003 del 09 de marzo \nde 2023.\nCOMPETENCIA DE LA AUTORIDAD NACIONAL\nEl Gobierno Nacional, mediante Decreto Ley 3573 del 27 de septiembre de 2011, creó la \nAutoridad Nacional de Licencias Ambientales – ANLA, como una entidad con autonomía \nadministrativa y financiera, sin personería jurídica, la cual hace parte del Sector \nAdministrativo de Ambiente y Desarrollo Sostenible, en los términos del artículo 67 de la \nLey 489 de 1998. \n \nEl numeral 1° del artículo tercero del mencionado decreto estableció dentro de las funciones \nde la Autoridad Nacional, la de otorgar o negar las licencias, permisos y trámites \nambientales de competencia del Ministerio, de conformidad con la ley y los reglamentos. \n \nMediante el Decreto 376 del 11 de marzo de 2020, se modificó la estructura de la Autoridad \nNacional de Licencias Ambientales. \n \nMediante la Resolución 669 del 14 de abril de 2020, se nombró como servidor público a \nEDILBERTO PEÑARANDA CORREA, identificado con cédula de ciudadanía 4.052.851, en \nel empleo de libre nombramiento y remoción de Asesor, código 1020, grado 15, adscrito a \nla Dirección General de la planta global de la ANLA.  \n \nEl 5 de noviembre de 2021, la Autoridad Nacional emitió la Resolución 1957 “Por la cual se \nadopta el Manual Específico de Funciones y de Competencias Laborales para los empleos \nde la planta de personal de la Autoridad Nacional de Licencias Ambientales - ANLA”, en \ndonde se establece que corresponde al Despacho del Director General de la Autoridad \nNacional de Licencias Ambientales - ANLA, “Suscribir los actos administrativos que otorgan, \nniegan, modifican, ajustan o declaran la terminación de las licencias, permisos y trámites \nambientales”.  \n \nEn ejercicio de las facultades conferidas por la Ley 489 de 1998, se expidió la Resolución \n2795 del 25 de noviembre de 2022 “Por la cual se delegan unas funciones y se dictan otras \ndisposiciones”, en su artículo primero, numeral 15° delegó en el Asesor Código 1020 Grado \n15 del Despacho del Director General, la función de “Resolver los recursos de reposición \ninterpuestos contra los actos administrativos que se emiten en cumplimiento de las \nfunciones anteriores.”\nTeniendo en cuenta lo anterior, es el Asesor del Despacho del Director General de la \nAutoridad Nacional el competente para pronunciarse sobre el recurso de reposición \ninterpuesto por la Sociedad en contra de la Resolución 3012 del 20 de diciembre de 2022.\nFUNDAMENTOS JURIDICOS\nEl procedimiento para la presentación y resolución de recursos contra los actos \nadministrativos se encuentra reglado en el Código de Procedimiento Administrativo y de lo \nContencioso Administrativo artículos 74 y siguientes, que particularmente respecto del \nrecurso de reposición al tenor literal expresan:\n“Artículo 74. Recursos contra los actos administrativos.\nPor regla general, contra los actos definitivos procederán los siguientes recursos: \n1. El de reposición, ante quien expidió la decisión para que la aclare, modifique, adicione o \nrevoque (…)”\nA su vez, los artículos 76 y 77 del Código enunciado preceptúan: \n“Artículo 76. Oportunidad y presentación.\nLos recursos de reposición y apelación deberán interponerse por escrito en la diligencia de \nnotificación personal, o dentro de los diez (10) días siguientes a ella, o a la notificación por aviso, \no al vencimiento del término de publicación, según el caso. Los recursos contra los actos \n\nResolución No.  00701           Del   10 de abril de 2023            Hoja No. 3 de 36\n“POR LA CUAL SE RESUELVE UN RECURSO DE REPOSICIÓN”\nOficinas: Carrera 13 A No. 34 – 72 Edificio 13 35 Pisos 8 al 11 Bogotá, D.C.\nCentro de Orientación y Radicación de Correspondencia: Carrera 13 A No. 34 – 72 Edificio 13 35 \nLocales 110 al 112 Bogotá, D.C.  \nCódigo Postal 110311156\nNit.: 900.467.239-2\nLínea de Orientación y Contacto Ciudadano: 57 (1) 2540100 / 018000112998 PBX: 57 (1) 2540111\nwww.anla.gov.co    Email: licencias@anla.gov.co  \nPágina 3 de 36\npresuntos podrán interponerse en cualquier tiempo, salvo en el evento en que se haya acudido \nante el juez. \nLos recursos se presentarán ante el funcionario que dictó la decisión (…)”\nArtículo 77. Requisitos.\nPor regla general los recursos se interpondrán por escrito que no requiere de presentación \npersonal si quien lo presenta ha sido reconocido en la actuación. Igualmente, podrán presentarse \npor medios electrónicos. \nLos recursos deberán reunir, además, los siguientes requisitos: \n1. Interponerse dentro del plazo legal, por el interesado o su representante o apoderado \ndebidamente constituido. \n2. Sustentarse con expresión concreta de los motivos de inconformidad.\n3. Solicitar y aportar las pruebas que se pretende hacer valer. \n4. Indicar el nombre y la dirección del recurrente, así como la dirección electrónica si desea ser \nnotificado por este medio. \nSólo los abogados en ejercicio podrán ser apoderados (…)\nA su vez, el artículo 80 del citado Código, establece el alcance del contenido de la decisión \nque resuelve el recurso:\n“Artículo 80. Decisión de los recursos. -Vencido el período probatorio, si a ello hubiere \nlugar, y sin necesidad de acto que así lo declare, deberá proferirse la decisión motivada que \nresuelva el recurso. \nLa decisión resolverá todas las peticiones que hayan sido oportunamente planteadas y las \nque surjan con motivo del recurso.” \nCONSIDERACIONES DE LA AUTORIDAD NACIONAL FRENTE AL RECURSO DE \nREPOSICIÓN INTERPUESTO POR LA SOCIEDAD.\nDesde el punto de vista procedimental, se observa que el recurso de reposición interpuesto \npor la Sociedad en contra de la Resolución 3012 del 20 de diciembre de 2022, cumple con \nlos requisitos establecidos en el artículo 77 y concordantes del Código de Procedimiento \nAdministrativo y de lo Contencioso Administrativo, en cuanto a lo siguiente:\n1.\nInterponerse dentro del plazo legal, por el interesado o su representante o apoderado \ndebidamente constituido.\nSe encuentra acreditado que el día 20 de diciembre de 2022, la Sociedad fue debidamente \nnotificada mediante correo electrónico de la Resolución 3012 del 20 de diciembre de 2022, \nfrente a la cual interpuso recurso de reposición por intermedio de Apoderado General el día \n02 de enero de 2023 y presentado en la Autoridad Nacional bajo el radicado 2023000555-\n1-000, esto es, dentro de los diez (10) días siguientes a la notificación, de conformidad con \nlo preceptuado en el artículo 76 de la Ley 1437 de 2011.\n2.\nSustentarse con expresión concreta de los motivos de inconformidad.\nLa Sociedad presentó los argumentos en contra de las disposiciones recurridas de la \nResolución 3012 del 20 de diciembre de 2022, los cuales serán tenidos en cuenta para \ndecidir el presente recurso de reposición.\n3.\nSolicitar y aportar las pruebas que se pretende hacer valer.\nEn el recurso de reposición la Sociedad aportó las siguientes pruebas:\n“Certificado de existencia y representación legal de Ecopetrol S.A con el cual se acredita el \npoder general para actuar en el presente recurso de reposición.\nCorreo Electrónico de la ANLA (AGENDA PROVISIONAL Y ASISTENCIA VISITA DE \nSEGUIMIETNO MARES LAM2249)”\n\nResolución No.  00701           Del   10 de abril de 2023            Hoja No. 4 de 36\n“POR LA CUAL SE RESUELVE UN RECURSO DE REPOSICIÓN”\nOficinas: Carrera 13 A No. 34 – 72 Edificio 13 35 Pisos 8 al 11 Bogotá, D.C.\nCentro de Orientación y Radicación de Correspondencia: Carrera 13 A No. 34 – 72 Edificio 13 35 \nLocales 110 al 112 Bogotá, D.C.  \nCódigo Postal 110311156\nNit.: 900.467.239-2\nLínea de Orientación y Contacto Ciudadano: 57 (1) 2540100 / 018000112998 PBX: 57 (1) 2540111\nwww.anla.gov.co    Email: licencias@anla.gov.co  \nPágina 4 de 36\n4.\nIndicar el nombre y la dirección del recurrente, así como la dirección electrónica si desea ser \nnotificado por este medio.\nLa Sociedad manifestó que, para efectos de la notificación: “Ecopetrol S.A. recibirá \nnotificaciones, a través de la Gerencia Jurídica de Entorno de la Vicepresidencia Jurídica, para lo \ncual puede dirigirse al correo electrónico notificacionesjudicialesecopetrol@ecopetrol.com.co o en el \ndespacho de la Autoridad Ambiental.”\nCon base en lo anterior, verificado el cumplimiento de los requisitos establecidos en el \nCódigo de Procedimiento Administrativo y de lo Contencioso Administrativo -CPACA-, \nrespecto a la procedencia del señalado recurso de reposición, la Autoridad Nacional \nprocederá a resolverlo, teniendo en cuenta las consideraciones realizadas en el Concepto \ntécnico 1003 del 09 de marzo de 2023; en el mismo orden de los argumentos presentados \npor la Sociedad, a saber:\n1.\nOBLIGACIONES RECURRIDAS – NUMERALES 1, 2, 3, 4, 5, 6, 7, 8, 9, 10, 11 Y 12 \nDEL ARTÍCULO SEGUNDO.\n“ARTÍCULO SEGUNDO. Presentar para evaluación de la Autoridad Nacional de Licencias \nAmbientales, en un término máximo de tres (3) meses, contados a partir de la generación del impacto \ny/o afectación de áreas por el desarrollo del proyecto “Campo de Producción Cumanday”, el Plan de \nCompensación del Componente Biótico, ajustado e incluyendo la siguiente información:\n1.\nLos objetivos generales y específicos del plan de compensación, ajustados de forma que se \nencuentren acotados y en concordancia con las áreas efectivamente seleccionadas para la \ncompensación (DÓNDE) y las acciones propuestas en estas áreas (CÓMO).\n2.\nEl alcance del plan de compensación ajustado, teniendo en cuenta las áreas efectivamente \nseleccionadas para la compensación (DÓNDE) y las acciones propuestas en estas áreas \n(CÓMO).\n3.\nLas metas del plan de compensación, ajustadas de acuerdo con los objetivos de \ncompensación propuestos, teniendo en cuenta las áreas efectivamente seleccionadas para \nla compensación (DÓNDE) y las acciones propuestas en estas áreas (CÓMO).\n4.\nEl área efectivamente seleccionada para la compensación (DÓNDE compensar), \ngarantizando que exista equivalencia ecosistémica con base en la unidad de análisis \nespacial (Bioma IAVH) del Mapa de Ecosistemas de Colombia en escala 1:100.000 (IDEAM \net al., 2017) conforme las áreas intervenidas.\n5.\nLa propuesta de acciones específicas relacionadas con el CÓMO compensar, teniendo en \ncuenta la pertinencia y concordancia de la implementación de las acciones propuestas, \nfrente a las condiciones físico-bióticas de las áreas seleccionadas (DÓNDE compensar) \nconforme con los lineamientos del Manual de Compensaciones del Componente Biótico. \n6.\nEl listado de especies propuestas a utilizar para cada tipo de acción, en donde las especies \na proponer deberán ser nativas de la región biogeográfica del área efectivamente \nseleccionada para la compensación. \n7.\nLa propuesta del plan de monitoreo y seguimiento con un alcance concreto, teniendo en \ncuenta las áreas efectivamente seleccionadas (DÓNDE) y acciones propuestas en estas \náreas (CÓMO), considerando que el plan debe plantearse hasta el cumplimiento de los \nobjetivos de compensación.\n8.\nIndicadores de impacto medibles y cuantificables en el tiempo, acotados de forma que sean \ncoherentes con las áreas efectivamente seleccionadas (DÓNDE) y las acciones propuestas \nen estas áreas (CÓMO), con los cuales se evidencie el cumplimiento de las metas y \nobjetivos de compensación propuestos. \n9.\nEl cronograma actualizado acorde con la propuesta del DÓNDE y CÓMO compensar. Este \ndeberá plantearse hasta el cumplimiento de los objetivos de compensación.\n\nResolución No.  00701           Del   10 de abril de 2023            Hoja No. 5 de 36\n“POR LA CUAL SE RESUELVE UN RECURSO DE REPOSICIÓN”\nOficinas: Carrera 13 A No. 34 – 72 Edificio 13 35 Pisos 8 al 11 Bogotá, D.C.\nCentro de Orientación y Radicación de Correspondencia: Carrera 13 A No. 34 – 72 Edificio 13 35 \nLocales 110 al 112 Bogotá, D.C.  \nCódigo Postal 110311156\nNit.: 900.467.239-2\nLínea de Orientación y Contacto Ciudadano: 57 (1) 2540100 / 018000112998 PBX: 57 (1) 2540111\nwww.anla.gov.co    Email: licencias@anla.gov.co  \nPágina 5 de 36\n10. De forma detallada, presentar las particularidades técnicas del modo, mecanismo y forma \nefectivamente propuestos para la implementación de las acciones de compensación \nseleccionadas. \n11. La evaluación de los potenciales riesgos para la implementación del plan y la propuesta \npara minimizarlos, ajustada conforme las áreas efectivamente seleccionadas para las \nacciones de compensación. \n12. La propuesta de manejo a largo plazo ajustada conforme las áreas efectivamente \nseleccionadas para las acciones de compensación.\n(…)”\n1.1. Petición de la sociedad\n“1. REPONER el artículo segundo de la Resolución No. 03012 del 20 de diciembre de 2022, en el \nsentido de APROBAR el Plan de Compensación del Componente Biótico, presentado por \nECOPETROL S.A., mediante radicado 2022071099-1-000 del 13 de abril de 2022, para el proyecto \n\"Campo de producción Cumanday\".\n2. MODIFICAR la temporalidad de la obligación establecida en el artículo segundo de la Resolución \n03012 del 20 de diciembre de 2022, en la que se mencione de manera explícita que la información \nsolicitada deberá ser entregada en los sucesivos Informes de Cumplimiento Ambiental, de acuerdo \ncon los avances consignados en el cronograma entregado mediante radicado 2022071099-1-000 del \n13 de abril de 2022.”\n1.2. Argumentos de la sociedad\nMediante comunicación con radicación 2023000555-1-000 del 02 de enero de 2023, la \nSociedad presentó los siguientes argumentos:\n“3.2. APLICACIÓN DEL PRINCIPIO, NADIE ESTA OBLIGADO A LO IMPOSIBLE \nCon el fin de analizar la resolución objeto de estudio frente al principio general del derecho \ndenominado “nadie está obligado a lo imposible”, es preciso mencionar que la Corte Constitucional \nen Sentencia T-875/10 MP. Humberto Antonio Sierra Porto; Sentencia T-062 A/11 MP. Mauricio \nGonzález Cuervo; Sentencia C-010/03 MP. Eduardo Montealegre Lynett; Sentencia T-425/11 MP. \nJuan Carlos Henao Pérez, las cuales señalan:\n“(…) Durante su actuación, el juez deberá garantizar el debido proceso a la parte presuntamente \nincumplida permitiéndole manifestar las circunstancias que han rodeado el acatamiento del respectivo \nfallo. No obstante, puede ocurrir que el incumplimiento obedezca a situaciones que hacen que la \norden impartida sea materialmente imposible de acatar.\nFrente a estas circunstancias, la Corte Constitucional se ha abstenido de proferir órdenes dirigidas \na garantizar el cumplimiento de la sentencia de tutela, bajo el argumento de que no se puede obligar \na una persona natural o jurídica, a lo imposible, como es el caso de la garantía de la estabilidad laboral \nde un trabajador vinculado a una empresa que ha dejado de existir…” (Subrayado y negrilla fuera de texto \noriginal)\nDe lo anterior, ECOPETROL S.A., considera procedente enunciar que la Corte Constitucional ha \nsido enfática en reiterar que a ninguna persona natural o jurídica se le puede forzar a realizar algo si \na pesar de asistirle el derecho a quien lo invoque, no cuenta con las herramientas, técnicas o medios \npara hacerlo, aun cuando en él, radique la obligación de ejecutar ese algo1.\nHecho por el cual ECOPETROL S.A., considera que el cumplimiento de la Resolución No. 03012 del \n20 de diciembre de 2022, específicamente en su artículo segundo, señala:\n“(…) ARTÍCULO SEGUNDO. Presentar para evaluación de la Autoridad Nacional de Licencias \nAmbientales, en un término máximo de tres (3) meses, contados a partir de la generación del impacto y/o \nafectación de áreas por el desarrollo del proyecto “Campo de Producción Cumanday”, el Plan de \nCompensación del Componente Biótico, ajustado e incluyendo la siguiente información: (…)” (Subrayado \nfuera del texto original) \nRelacionando las obligaciones establecidas en los numerales 1, 2, 3, 4 ,5, 6, 7, 8, 9, 10, 11, y 12, del \nartículo segundo, donde existe un término común para los anteriores numerales y es “las áreas \nefectivamente seleccionadas”, en el marco del Dónde compensar.\n\nResolución No.  00701           Del   10 de abril de 2023            Hoja No. 6 de 36\n“POR LA CUAL SE RESUELVE UN RECURSO DE REPOSICIÓN”\nOficinas: Carrera 13 A No. 34 – 72 Edificio 13 35 Pisos 8 al 11 Bogotá, D.C.\nCentro de Orientación y Radicación de Correspondencia: Carrera 13 A No. 34 – 72 Edificio 13 35 \nLocales 110 al 112 Bogotá, D.C.  \nCódigo Postal 110311156\nNit.: 900.467.239-2\nLínea de Orientación y Contacto Ciudadano: 57 (1) 2540100 / 018000112998 PBX: 57 (1) 2540111\nwww.anla.gov.co    Email: licencias@anla.gov.co  \nPágina 6 de 36\nUna vez revisado el pronunciamiento de la Autoridad Nacional de Licencias Ambientales- ANLA, está \ntransgrediendo este principio de “Nadie está obligado a lo imposible”, pues al momento de evaluar \nel plan de compensación radicado mediante número 2022071099-1-000 del 13 de abril de 2022, el \ncual contiene la información requerida según el numeral 5.4.1 del Manual de compensación del \ncomponente biótico, dicha Autoridad Ambiental obliga y limita a ECOPETROL S.A, al solicitar las \n“áreas efectivamente seleccionadas”, con su localización para la implementación de las medidas \ncompensación, ya que, de acuerdo con lo estipulado en el numeral 5.4.1 del Manual de \ncompensaciones del componente biótico, el plan de compensación de un proyecto debe contener \ncomo mínimo la “Localización preliminar de las áreas para la implementación de las medidas de \ncompensación. Las áreas detalladas serán presentadas en el marco del seguimiento y ejecución del Plan”. \n(Negrita fuera del texto original)\nAsí mismo no se especifica una escala determinada para las áreas preliminares, no obstante, de \nacuerdo al concepto técnico 7263 del 24 de noviembre de 2022, acogido por la Resolución 3012 de \n2022, hace alusión a una escala más detallada a nivel de predios (pág.82), la cual, para llegar a esa \ndefinición de predios, se debe surtir varias actividades previas que se detallan más adelante, las \ncuales, en un término de 3 meses, es imposible de realizar por lo tanto la ANLA si bien es operadora \nde la norma, está aumentando el alcance del plan de compensación respecto al Dónde compensar, \nrequiriendo información detallada en esta etapa sin ningún sustento normativo, dado que las áreas \nefectivamente seleccionadas según el Manual de compensación adoptado por la Resolución 256 de \n2018, establece que serán presentadas en el marco del seguimiento y ejecución del Plan, condición \nde tiempo en la que aún no se encuentra, aplicando en esta instancia la entrega de la localización \npreliminar de las áreas para la implementación de la compensación.\nEs importante mencionar que, en los diferentes planes de compensación presentados por la empresa \nECOPETROL S.A, en el marco de los acogimientos a la Resolución 256 de 2018, emitida por el \nMADS, se ha indicado que el desarrollo de los proyectos exploratorios y de producción se realiza por \nfases, por ende, la compensación de los impactos residuales que se lleguen a generar por las \nactividades autorizadas en la licencia ambiental, se efectuará en el marco del plan de compensación \nque sea aprobado por la Autoridad Ambiental.\nAsí las cosas, a medida que se van realizando las intervenciones del proyecto licenciado \nECOPETROL S.A., reportará a la Autoridad el ajuste y/o actualización correspondiente al área a \ncompensar (Cuánto) en los correspondientes Informes de Cumplimiento Ambiental, hecho que es \nconocido por la Autoridad Ambiental, pues se ha expuesto en las diferentes mesas técnicas que se \nhan realizado entre las partes, así como también se ha venido desarrollando para los proyectos de \nECOPETROL S.A. \nPara tal caso, es necesario resaltar que para la ejecución de las obligaciones de compensación \nambiental, ECOPETROL S.A., estableció como estrategia la definición de núcleos o áreas de trabajo \ndentro de las subzonas hidrográficas donde la compañía tiene operaciones y proyectos de \nexploración, producción, transporte y refinación, como también, la priorización de áreas a escala de \npaisaje al interior de dichos núcleos con base en la definición de la estructura ecológica principal del \nterritorio y el análisis de aspectos físicos, bióticos y sociales, incluyendo la equivalencia ecosistémica, \ncumpliendo de esta forma con los criterios mínimos relacionados con el Dónde compensar, de \nacuerdo a lo establecido en el Manual de compensaciones del componente biótico.\nDe esta forma, se realiza la priorización de áreas en donde se enfocará la selección de predios y \nparticipantes para implementar las acciones de compensación.\nA partir de esta estrategia, se diseñó un procedimiento para la selección de predios y participantes \nen las áreas priorizadas, estableciendo criterios que permiten identificar en el territorio las áreas con \nmayor potencial para la ejecución de la medida de compensación, y en el cual se consideran las \nsiguientes actividades:\n• Socialización del proyecto\n• Visitas y encuestas de diagnóstico\n• Análisis jurídico de tenencia del predio\n• Suscripción de acuerdo de conservación\n• Diseño predial concertado\n• Caracterización físico-biótica de las áreas de interés\n• Línea base de indicadores\nSin embargo, para poder adelantar el procedimiento anteriormente mencionado es necesario contar \ncon la aprobación del plan de compensación por parte de la Autoridad Ambiental, ya que de acuerdo \n\nResolución No.  00701           Del   10 de abril de 2023            Hoja No. 7 de 36\n“POR LA CUAL SE RESUELVE UN RECURSO DE REPOSICIÓN”\nOficinas: Carrera 13 A No. 34 – 72 Edificio 13 35 Pisos 8 al 11 Bogotá, D.C.\nCentro de Orientación y Radicación de Correspondencia: Carrera 13 A No. 34 – 72 Edificio 13 35 \nLocales 110 al 112 Bogotá, D.C.  \nCódigo Postal 110311156\nNit.: 900.467.239-2\nLínea de Orientación y Contacto Ciudadano: 57 (1) 2540100 / 018000112998 PBX: 57 (1) 2540111\nwww.anla.gov.co    Email: licencias@anla.gov.co  \nPágina 7 de 36\na las experiencias que tiene ECOPETROL S.A., frente a las obligaciones de compensación que se \ntienen actualmente en ejecución mediante esta misma estrategia, el realizar el proceso de selección \nde predios y participantes como parte de la implementación del plan, permite un proceso continuo, \neficiente y con grado de confianza con los participantes, así como en las poblaciones del área de \ninfluencia del proyecto, cuando es socializado el estado de la obligación, cuando se tiene el plan \naprobado existe seguridad para la ejecución de las actividades.\nProducto de lo antes señalado se reduce la posibilidad de que se dé una pérdida de interés por parte \nde los posibles participantes (propietarios de los predios) dada la incertidumbre en sí, se ejecutarán \nlas acciones de conservación ya que no existe un respaldo que lo soporte. Adicionalmente, respecto \na temas administrativos internos sin contar con el plan de compensación aprobado existe riesgo \njurídico para ejecutar actividades que no han sido aprobadas, generando que se reinicien los \nprocesos y/o se genere un detrimento patrimonial por los recursos invertidos que finalmente no \ncontribuirán a compensar las áreas intervenidas por el desarrollo del proyecto licenciado.\nDe acuerdo con lo expuesto anteriormente, ECOPETROL S.A, considera que la solicitud efectuada \nen el artículo segundo de la Resolución No. 03012 del 20 de diciembre de 2022, en cuanto a \npresentar para evaluación en un en un término máximo de tres (3) meses, contados a partir de la \ngeneración del impacto y/o afectación de áreas por el desarrollo del proyecto, el plan de \ncompensación del componente biótico, ajustado e incluyendo la información de los numerales 1, 2, \n3, 4 ,5, 6, 7, 8, 9, 10, 11, y 12, del artículo segundo, acotados a las “áreas efectivamente \nseleccionadas”, genera una obligación imposible de cumplir impuesta a ECOPETROL S.A., teniendo \nen cuenta que:\n3.2.1. Con la información solicitada por la ANLA a ECOPETROL S.A, se requiere realizar un \ndespliegue del proceso de selección de predios y participantes en el corto plazo (3 meses) y en una \nfase preliminar a la aprobación del plan de compensación, sobre meras expectativas. Las cuales \npuede derivar en un detrimento patrimonial teniendo en cuenta que los predios específicos a \ncompensar se definirán una vez sean precisadas las áreas a intervenir con el desarrollo del proyecto.\n3.2.2. Generación de meras expectativas con los participantes de los acuerdos de conservación, \nfrente a acciones propuestas que en esta instancia aún no cuentan con aprobación por parte de esta \nAutoridad, lo cual traería consigo una potencial perdida en la credibilidad de la Empresa frente a las \npropuestas presentadas en la etapa inicial de selección de los participantes. Lo anterior teniendo en \ncuenta que no se pueden firmar acuerdos de conservación ya que el plan de compensación no ha \nsido aprobado por la ANLA y sin él, mismo no se podría saber el área finalmente a preservar, los \nobjetivos específicos, metas, acciones específicas finales, especies nativas a sembrar del área \nseleccionada, las propuestas de monitoreo y seguimiento ya que estas, dependen y se definirían una \nvez se realice la caracterización físico biótica de las áreas finalmente seleccionadas, que permita \ndefinir indicadores de acuerdo con dichas características de las áreas a conservar, por ello el plan \npresentado mediante radicado 2022071099-1-000 del 13 de abril de 2022, se trabajó desde las áreas \nglobales del núcleo del Tillavá con la información lo más acotada posible para la instancia en la que \nestamos de planeación y formulación del plan. Para que una vez sea aprobado el plan, poder dar \ninicio a la ejecución de acuerdo al cronograma planteado, de allí la importancia del mismo.\n3.2.3. Riesgo de un potencial desistimiento del participante del acuerdo de conservación, teniendo \nen cuenta los tiempos que conlleva las etapas de evaluación y aprobación a cargo de la Autoridad \nAmbiental; como también la posterior gestión precontractual del vehículo comercial, es decir el \ncontrato a gestionar para la ejecución del plan de compensación a cargo de la empresa.\nLo anterior, considerando la dinámica de la actividad productiva que tiene el participante y basado \nen que el acuerdo de conservación tiene como principio la voluntad de este, su interés de participar \npuede verse alterado con el tiempo y declinar en su decisión inicial de participar. Lo cual genera \nreprocesos al interior de la empresa ocasionando un detrimento patrimonial; así como la transgresión \ndel principio de planeación y economía.\n3.2.4. Alteración en las etapas definidas en los cronogramas propuestos por la empresa en los planes \nde compensación, los cuales tienen como origen los aspectos administrativos y técnicos, en la etapa \npreoperativa -diagnóstico, así como también los establecidos internamente para desarrollar la \nactividad. Que para el caso particular tal como se evidencia en el cronograma entregado mediante \nradicado 2022071099-1-000 del 13 de abril de 2022 (Ver tabla 1), las áreas efectivamente \nseleccionadas solicitadas por la ANLA, solo se tendrán cuando se suscriba el acuerdo de \nconservación contemplado a realizarse una vez se surtan las actividades previas de: selección y \nelaboración del contrato para la ejecución de las obligaciones, revisión de instrumentos de \nplanificación, diseño especifico de las áreas priorizadas a escala de paisaje que permitirán identificar \nlos predios y participantes, así como también el estudio de títulos que comprende la respuesta por \n\nResolución No.  00701           Del   10 de abril de 2023            Hoja No. 8 de 36\n“POR LA CUAL SE RESUELVE UN RECURSO DE REPOSICIÓN”\nOficinas: Carrera 13 A No. 34 – 72 Edificio 13 35 Pisos 8 al 11 Bogotá, D.C.\nCentro de Orientación y Radicación de Correspondencia: Carrera 13 A No. 34 – 72 Edificio 13 35 \nLocales 110 al 112 Bogotá, D.C.  \nCódigo Postal 110311156\nNit.: 900.467.239-2\nLínea de Orientación y Contacto Ciudadano: 57 (1) 2540100 / 018000112998 PBX: 57 (1) 2540111\nwww.anla.gov.co    Email: licencias@anla.gov.co  \nPágina 8 de 36\nparte de la URT y ANT, es decir se necesitará del tiempo estipulado en el cronograma y solo será \nen el mes 11 del año 1 que se tendrá las áreas efectivamente seleccionadas y con la misma se podrá \nacotar la información requerida en los numerales 1, 2, 3, 4 ,5, 6, 7, 8, 9, 10, 11, y 12, del artículo \nsegundo de la Resolución ibídem, por lo tanto la ANLA no puede desconocer las actividades \ncontempladas en el cronograma entregado en virtud de una planificación para lograr los objetivos \npropuesto (sic) y la ejecución de la misma, imponiendo tres (3) meses para la entrega de información, \nla cual está limitada a las áreas efectivamente seleccionadas, las cuales es imposible tenerlas en \ndicho tiempo, de acuerdo con lo antes expuesto.\n(Ver Tabla 1 en las páginas 9 y 10 del Concepto técnico 1003 del 09 de marzo de 2023)\n(...)\nPor otro lado, de acuerdo con lo señalado en el concepto técnico 7263 del 24 de noviembre de 2022, \nacogido por la resolución 3012 de 2022, el cual evalúa el plan de compensación en el numeral 5.8.1, \nseñala lo siguiente:\n“✓ Objetivo general y objetivos específicos, “…es claro en términos ecológicos y \necosistémicos respecto a lo que se espera al implementar las acciones de compensación, y, \npor tanto, es acorde con las actividades a ejecutar del Plan de Compensación presentado y lo \nestablecido en el Manual de Compensaciones del Componente Biótico.”\nRespecto a los objetivos específicos, estos están orientados al cumplimiento del objetivo general y \nse considera que permiten dimensionar el cumplimiento de la obligación pues desglosan y \nespecifican las actividades que permitirán el cumplimiento del objetivo general en los 5 ítems \nplanteados, con lo cual se logrará cumplir el principio de no pérdida de biodiversidad mediante \nactividades de preservación y restauración y acciones complementarias mediante implementación \nde proyectos de uso sostenible.”\n✓ Alcance, “…Se observa que en el alcance se presenta el origen de la obligación y cuáles \nson los objetivos para su cumplimiento, que se encuentra acorde con los objetivos propuestos \nen el plan.”\n✓ Metas, “…se observa que estas se encuentran acordes con la propuesta de compensación \nentregada y se proponen de forma tal que puedan ser medibles mediante el uso de \nindicadores…”\nPosteriormente, la ANLA realiza un análisis respecto al Qué, Cuánto, Dónde y Cómo Compensar, el \ncual si bien menciona que los objetivos, alcance y metas están acordes con lo requerido; debido a \nque no se ha materializado el impacto se “debe ajustar y acotar los objetivos de forma que se encuentren \nacordes a la intervención realizada (QUÉ), el área por compensar (CUÁNTO), las áreas propuestas \nefectivamente seleccionadas para la compensación (DÓNDE) y las acciones propuestas en estas áreas \n(CÓMO)”.(Negrita fuera del texto original)\n“… se considera que el alcance presentado es adecuado y presenta a nivel general el QUÉ, CUÁNTO, DÓNDE \ny CÓMO compensar. No obstante, esta información deberá ser ajustada y presentada para evaluación de la \nAutoridad Nacional de Licencias Ambientales, una vez se genere el impacto…”\n“…deberá ajustar las metas de forma que se encuentren acordes al QUÉ, CUÁNTO, DÓNDE y CÓMO \ncompensar…”\nAl respecto, ECOPETROL S.A, considera estar de acuerdo con la argumentación de la ANLA \nrespecto al QUÉ y CUÁNTO compensar, no obstante nuevamente limita la ANLA a acotar los \nobjetivos, alcance y metas a las áreas efectivamente seleccionadas (DÓNDE) y a las acciones \npropuestas (CÓMO), las cuales de acuerdo con los argumentos expuestos en el presente numeral, \nestos dos últimos factores limitan la entrega de la información en los tres (3) meses requeridos por \nlo tanto se solicita a la ANLA ajustar la temporalidad de entrega de la información en comento según \nel avance de las actividades propuestas en el cronograma, así como también aprobar el plan ya que \nestos tres ítems del plan de compensación están acordes según lo manifestado por la ANLA para la \ninstancia es la que se está y serán ajustados una vez se tengan las áreas efectivamente \nseleccionadas, según el tiempo estipulado en el cronograma entregado.\n✓ Dónde Compensar: numeral 4, artículo segundo resolución 03012 de 2022. ECOPETROL \nS.A, en el plan de compensación informa que se realizará a nivel de ZSH del Alto Vichada, \nacotándolo al núcleo Tillavá, al respecto la ANLA menciona que “…con la información \npresentada, no es posible realizar la evaluación de pertinencia de la acción frente al estado \n\nResolución No.  00701           Del   10 de abril de 2023            Hoja No. 9 de 36\n“POR LA CUAL SE RESUELVE UN RECURSO DE REPOSICIÓN”\nOficinas: Carrera 13 A No. 34 – 72 Edificio 13 35 Pisos 8 al 11 Bogotá, D.C.\nCentro de Orientación y Radicación de Correspondencia: Carrera 13 A No. 34 – 72 Edificio 13 35 \nLocales 110 al 112 Bogotá, D.C.  \nCódigo Postal 110311156\nNit.: 900.467.239-2\nLínea de Orientación y Contacto Ciudadano: 57 (1) 2540100 / 018000112998 PBX: 57 (1) 2540111\nwww.anla.gov.co    Email: licencias@anla.gov.co  \nPágina 9 de 36\nactual del área finalmente seleccionada, así como el análisis de adicionalidad en esta acción, \ntoda vez que el área presentada no cuenta con un alcance específico y se considera que \n804.908,52 hectáreas, se sale de la proporción esperada para considerarse como un área \npreliminar.\nNo obstante, es válido el planteamiento de la Sociedad al respecto de que no se ha realizado \nla afectación de áreas, por tanto, no se ha configurado la obligación y de tal forma, no le es \nposible especificar los ecosistemas, coberturas y áreas que intervendrá efectivamente y, por \ntanto, el área y ecosistemas a compensar.\nDe la misma forma, la Resolución 256 del 22 de febrero de 2018 especifica en su artículo 3 \nque la implementación del Plan de Compensación del Componente Biótico se debe iniciar a \nmás tardar a los seis (6) meses a partir de la realización del impacto.\nPor lo anterior, la Sociedad debe definir y especificar el área destinada para realizar las \nacciones de compensación y las acciones a implementar dentro de estas, por lo que deberá \npresentar, para evaluación y aprobación de la Autoridad Nacional de Licencias Ambientales y \nen un término no mayor a tres (3) meses posteriores a la intervención de áreas para la \nejecución de las actividades autorizadas del proyecto Campo de Producción Cumanday…”\nDado que la norma legal ambiental para compensaciones en este caso la Resolución 256 de 2018, \nhace referencia a entregar áreas preliminares para la implementación de las medidas de \ncompensación y que las áreas detalladas serán presentadas en el marco del seguimiento y ejecución \ndel Plan, en ningún caso se precisa ningún tipo de escala, por lo tanto, no es válido que la ANLA no \nacepte estas áreas preliminares ya que lo que se quiere, es tener un área bastante grande como \nabanico de posibilidades según los biomas a impactar para la ejecución. Respecto al Dónde \ncompensar como ha sido mencionado con anterioridad a lo largo de este numeral 3.2, se detalla los \nargumentos que limitan a ECOPETROL S.A, para poder seleccionar esas áreas en los tres (3) meses \nsolicitados.\nAhora bien, la Resolución 256 de 2018, en el artículo 3, estable (sic) la condición de tiempo para la \nejecución del plan de compensación del componente biótico, el cual deberá iniciar la implementación \na más tardar dentro de los seis (6) meses a partir de la realización del impacto o afectación por el \nproyecto, obra o actividad sujeto a licencia ambiental o aprovechamiento único forestal. Por lo \nanterior, nuevamente se evidencia limitante por parte de la ANLA respecto al no pronunciamiento de \naprobación del plan y solicitud de información detallada que solo se tendrá cuando se tengan las \náreas seleccionadas para la implementación de las acciones propuestas, es decir en el mes 11 del \naño 1 del cronograma entregado en el plan de compensación, antes no se podrá realizar dado que \ndebe surtir las actividades establecidas en la etapa preoperativa - diagnóstico.\n✓ Cómo Compensar: numeral 5 y 10, artículo segundo resolución 03012 de 2022.\nDe acuerdo con lo requerido “La propuesta de acciones específicas relacionadas con el CÓMO \ncompensar, teniendo en cuenta la pertinencia y concordancia de la implementación de las acciones \npropuestas, frente a las condiciones físico-bióticas de las áreas seleccionadas (DÓNDE compensar) \nconforme con los lineamientos del Manual de Compensaciones del Componente Biótico.”, se limita \na las condiciones físico bióticas de las áreas seleccionadas por lo tanto la actividad de \ncaracterización físico biótica, de acuerdo con el cronograma entregado mediante radicado \n2022071099-1-000 del 13 de abril de 2022, se contempla realizar en el año 2 (Ver tabla 1), por lo \ntanto lo requerido por la ANLA de acotar las acciones específicas relacionadas con el CÓMO \ncompensar, solo se podrán realizar una vez se cuente con la firma del acuerdo de conservación y se \nejecute la actividad de caracterización físico biótica ya que será en ese momento que se conocerá \nlas condiciones para proponer la pertinencia y concordancia de las acciones, modos, mecanismos y \nformas a realizar frente a las áreas seleccionadas, por lo anterior la importancia de no desconocer \nlas actividades del cronograma propuesto y su orden cronológico para la correcta ejecución ya que \nen tres (3) meses como lo estipula la Autoridad, es imposible realizarlo.\nEs de resaltar que de acuerdo a la real academia de España -RAE, el termino implementación se \ndefine como “Poner en funcionamiento o llevar a cabo una cosa determinada” por lo anterior se \nentiende que la implementación del plan obedece a la realización de la primera actividad del \ncronograma, de acuerdo al orden establecido en el mismo, de esta manera se estaría cumplimiento \n(sic) con lo estipulado en el artículo 3 (sic) una vez sea aprobado el plan de compensación, objeto \ndel presente recurso de reposición.\nCon respecto a la propuesta de monitoreo y seguimiento, indicadores, cronograma, riesgos y \npropuesta a largo plazo (numerales 7, 8, 9, 11 y 12 artículo segundo resolución 3012 de 2022), la \n\nResolución No.  00701           Del   10 de abril de 2023            Hoja No. 10 de 36\n“POR LA CUAL SE RESUELVE UN RECURSO DE REPOSICIÓN”\nOficinas: Carrera 13 A No. 34 – 72 Edificio 13 35 Pisos 8 al 11 Bogotá, D.C.\nCentro de Orientación y Radicación de Correspondencia: Carrera 13 A No. 34 – 72 Edificio 13 35 \nLocales 110 al 112 Bogotá, D.C.  \nCódigo Postal 110311156\nNit.: 900.467.239-2\nLínea de Orientación y Contacto Ciudadano: 57 (1) 2540100 / 018000112998 PBX: 57 (1) 2540111\nwww.anla.gov.co    Email: licencias@anla.gov.co  \nPágina 10 de 36\nANLA en su análisis acota los ajustes a realizarse en el marco de las áreas efectivamente \nseleccionadas, la cual ya fue argumentada la imposibilidad de llevarlas a cabo en los tres (3) meses \nen el presente numeral 3.2.\nDe acuerdo a lo expuesto, es claro señalar que se está quebrantando este principio de “NADIE ESTA \nOBLIGADO A LO IMPOSIBLE” con la emisión de la condición de la temporalidad del artículo segundo \nde la Resolución 3012 del 20 de diciembre de 2022 y el no pronunciamiento respecto a la aprobación \ndel plan de compensación radicado mediante número 2022071099-1-000 del 13 de abril de 2022.\n3.3. En cuanto a la aplicación del principio de confianza legítima y seguridad jurídica de los \nadministrados.\nDe conformidad con lo señalado por la Corte Constitucional, en la sentencia C131 de 2004, la \nMagistrada Ponente: Clara Inés Vargas Hernández2, ha establecido que el Principio de Confianza \nLegítima, consiste en que:\n“(…) el ciudadano debe poder evolucionar en un medio jurídico estable y previsible, en cual pueda \nconfiar. Para Müller, este vocablo significa, en términos muy generales, que ciertas expectativas, que \nson suscitadas por un sujeto de derecho en razón de un determinado comportamiento en relación con \notro, o ante la comunidad jurídica en su conjunto, y que producen determinados efectos jurídicos; y si se \ntrata de autoridades públicas, consiste en que la obligación para las mismas de preservar un \ncomportamiento consecuente, no contradictorio frente a los particulares, surgido en un acto o acciones \nanteriores, incluso ilegales, salvo interés público imperioso contrario. Se trata, por tanto, que el particular \ndebe ser protegido frente a cambios bruscos e inesperados efectuados por las autoridades públicas. \n(…)”. (Subrayado fuera de texto)\nEn el mismo sentido ECOPETROL S.A, ha analizado el principio de seguridad jurídica, respecto al \ncual la Corte Constitucional de la República de Colombia, ha señalado en Sentencia SU0723 con \nMagistrado Ponente: JOSÉ FERNANDO REYES CUARTAS, que:\n“(…) Esta obligación también tiene matices, toda vez que a la par de los principios de igualdad, seguridad \njurídica y confianza legítima pervive el principio de la autonomía judicial y la necesidad de ajustar tanto \nel derecho como su interpretación a las realidades sociales que se van imponiendo en garantía de un \nordenamiento justo; claro está, con la observancia de las estrictas exigencias que deben cumplirse \ncuando de modificar o apartarse del precedente se trata.\nTeniendo en cuenta la relevancia que tiene la jurisprudencia de los órganos de cierre, en tanto con ella \nse asegura la uniformidad en las decisiones de los jueces y se ofrecen criterios de interpretación que \npermiten lograr la seguridad jurídica, (…)”\n3.3.1. En cuanto a la aplicación del principio de confianza legítima en la emisión de actos \nadministrativos de diferentes sentidos.\nPara el análisis del presente ítem, es preciso mencionar que la Autoridad Ambiental mediante la \nResolución No. 00481 del 20 de marzo de 2020, en su artículo segundo aceptó el Plan de \nCompensación del Componente Biótico, presentado por ECOPETROL S.A., para el proyecto “Área \nde Perforación Exploratoria Nafta 1 y 2”, en lo concerniente al DÓNDE y el CÓMO implementar las \nmedidas de compensación con áreas y acciones preliminares. Otro ejemplo de este caso es la \nResolución 1491 del 24 de julio de 2019, en donde en el artículo tercero aprobó el Plan de \nCompensación del Componente Biótico para el proyecto \"Campo de producción Mago\". Para estos \nproyectos, se precisa que se encuentran en ejecución y al momento cumpliendo con el cronograma \ny las actividades autorizadas según las fases establecidas, sin presentar ningún tipo de \ninconveniente.\nEn línea con lo anterior, ECOPETROL S.A., tomó como lineamientos técnicos para la elaboración \nde los planes de compensación de los demás proyectos de su interés los documentos técnicos ya \naprobado en la Resolución No. 00481 del 20 de marzo de 2020 y 1491 del 24 de julio de 2019, por \nla ANLA.\nDe esta manera, si bien es claro que las anteriores resoluciones fueron aprobadas en el marco del \nacogimiento a la Resolución 256 de 2018, lo estipulado en la Resolución 370 de 2021, hace \nreferencia a otorgar un periodo de doce (12) meses a los usuarios que se encuentren bajo un régimen \nanterior al regulado por la Resolución 256 de 2018, para que en dicho termino se puedan acoger al \nManual de compensaciones del componente biótico conforme a lo estipulado en la Resolución 256 \nde 2018 y no modifica lo contemplado en el mismo por lo que las condiciones siguen siendo las \nmismas como bien, lo estipula el artículo 3 de dicha resolución, caso de ello es la tabla de contenido \ndel Manual en su numeral 5.4.1, en la cual expresa la estructura e información que debe contener el \n\nResolución No.  00701           Del   10 de abril de 2023            Hoja No. 11 de 36\n“POR LA CUAL SE RESUELVE UN RECURSO DE REPOSICIÓN”\nOficinas: Carrera 13 A No. 34 – 72 Edificio 13 35 Pisos 8 al 11 Bogotá, D.C.\nCentro de Orientación y Radicación de Correspondencia: Carrera 13 A No. 34 – 72 Edificio 13 35 \nLocales 110 al 112 Bogotá, D.C.  \nCódigo Postal 110311156\nNit.: 900.467.239-2\nLínea de Orientación y Contacto Ciudadano: 57 (1) 2540100 / 018000112998 PBX: 57 (1) 2540111\nwww.anla.gov.co    Email: licencias@anla.gov.co  \nPágina 11 de 36\nplan de compensación, documentación que fue entregada mediante radicado 2022071099-1-000 del \n13 de abril de 2022 acorde con dichos numerales.\nDe esta manera para ECOPETROL S.A, el pronunciamiento de la ANLA del artículo segundo de la \nResolución 3012 del 20 de diciembre de 2022, transgrede de esta forma el principio de confianza \nlegítima y seguridad jurídica de los administrados, pues a pesar de que las tres (3) actuaciones se \nevaluaron bajo los mismos criterios técnicos; los conceptos acogidos mediante los actos \nadministrativos antes referidos no van en el mismo sentido ya que para el caso del expediente de \ninterés LAV0012-00-2018 del proyecto Campo de Producción Cumanday, no se precisa que fue \naprobado el plan de compensación como si fue realizado para los proyectos antes mencionados, \nasí como tampoco se impone por parte de la ANLA el tiempo de entregar la información requerida \nen el artículo segundo en este caso de tres (3) meses, ya que va en contra del cronograma planteado \ny la imposibilidad de realizarlo en las áreas efectivamente seleccionadas ya que estas últimas solo \nse sabrán una vez surtidas las actividades en las etapas iniciales contempladas en el cronograma \nde acuerdo con lo expuesto en el numeral 3.2.4 del presente oficio y una vez se cuente aprobado el \nplan de compensación, ya que sin la aprobación por parte de la ANLA, ECOPETROL S.A, estaría en \nposible riesgo de detrimento patrimonial por ser una empresa de economía mixta sujeta a verificación \npor parte de los órganos de control nacional realizar actividades sin tener un pronunciamiento de \nfondo plasmado en un acto administrativo que especifique, la aprobación del plan de compensación \npara su ejecución.\nAsí las cosas, la Autoridad Ambiental, con estas tres (3) actuaciones administrativas ambientales de \ncarácter permisivas, no preservó la obligación de garantizar un comportamiento y pronunciamiento \nconsecuente.\nPor último, ECOPETROL S.A., considera que con este tipo de actuaciones por parte de la Autoridad \nAmbiental se han generado cambios bruscos e inesperados lo cual ha transgredido los principios de \neconomía y planeación pues se generan reprocesos en el actuar de la entidad, contraviniendo \nfinalmente los principios de confianza legítima y seguridad jurídica que se analiza en el presente \nítems.\n1.3. Consideraciones de la Autoridad Nacional\nLos argumentos de inconformidad presentados por el recurrente fueron objeto de \nevaluación por el equipo técnico de la Autoridad Nacional y mediante Concepto técnico \n1003 del 09 de marzo de 2023, se presentaron las siguientes consideraciones:\n“Respecto a la “APLICACIÓN DEL PRINCIPIO, NADIE ESTA OBLIGADO A LO IMPOSIBLE”, como \nprimera medida esta Autoridad considera pertinente reiterar lo dispuesto en la Resolución 370 del \n15 de abril de 2021, que indicó:\n“Articulo 1. Objeto y Ámbito de aplicación. La presente resolución tiene por objeto otorgar un periodo \nde doce (12) meses a los usuarios o titulares de licencias ambientales, permisos de aprovechamiento \nforestal único y autorizaciones de sustracción de áreas de reserva forestal nacional o regional que sen \nencuentren bajo un régimen anterior al regulado por la Resolución No.256 del 22 de febrero de 2018 \nmodificada por la Resolución No. 1428 del 31 de julio de 2018, para que en el término concedido puedan \nacogerse al actual manual de compensaciones del componente biótico, a través de la presentación de \nun documento propuesta en el cual se especifique el Dónde y el Cómo implementar las medidas de \ncompensación o la propuesta de modificación en el caso que se cuente con un plan de compensación \naprobado por la Autoridad Ambiental Competente. Todo lo anterior conforme a lo estipulado en la \nResolución 256 de 2018.”\nDicho esto, todos los proyectos que presentaron acogimiento a la Resolución 370 de 2021, deben \ntener en cuenta que, conforme al manual, el proceso general de compensaciones comprende el \n¿Qué compensar?, ¿Cuánto compensar?, ¿Dónde compensar? Y ¿Cómo compensar? por \ncuanto, una vez identificadas las obligaciones de compensación, el titular DEBERÁ definir el área y \ntipo de ecosistema afectado.\nEn este caso, si bien es claro para esta Autoridad que los proyectos exploratorios y de producción \nse realizan por fases, se debe tener en cuenta que la Sociedad cuenta con un instrumento de manejo \ny control que corresponde a la Resolución 0001 de 2 de enero de 2019, donde se establece la \nubicación del proyecto Campo de Producción Cumanday, lo que quiere decir que, para la Sociedad \nes posible identificar las áreas donde el proyecto generará los impactos que no pueden ser evitados, \nmitigados o corregidos. \n\nResolución No.  00701           Del   10 de abril de 2023            Hoja No. 12 de 36\n“POR LA CUAL SE RESUELVE UN RECURSO DE REPOSICIÓN”\nOficinas: Carrera 13 A No. 34 – 72 Edificio 13 35 Pisos 8 al 11 Bogotá, D.C.\nCentro de Orientación y Radicación de Correspondencia: Carrera 13 A No. 34 – 72 Edificio 13 35 \nLocales 110 al 112 Bogotá, D.C.  \nCódigo Postal 110311156\nNit.: 900.467.239-2\nLínea de Orientación y Contacto Ciudadano: 57 (1) 2540100 / 018000112998 PBX: 57 (1) 2540111\nwww.anla.gov.co    Email: licencias@anla.gov.co  \nPágina 12 de 36\nEn línea con lo anterior, mediante herramientas SIG, el titular podrá identificar el tipo de biomas a \nque pertenece el polígono a intervenir, aplicar los tipos de compensación por tipo de bioma y buscar \nlos ecosistemas equivalentes, para de esta manera definir las acciones, modos y mecanismos de \ncompensación que se plantean en el plan de compensación.\nEs así como, de manera acertada a partir de la revisión de los ecosistemas naturales, seminaturales \ny transformados identificados en el Campo de Producción Cumanday, en los cuales se autorizó la \nintervención de áreas y la aplicación de los factores de compensación anteriormente relacionados, \nse presenta el área máxima estimada a compensar de 3264,67 hectáreas para dicho proyecto.\nEs así como la Sociedad ya tendrá identificados los polígonos a intervenir, por cuanto podrá definir \nQUÉ y CUÁNTO compensar, un ejemplo claro de esto es la información presentada por la Sociedad \nmediante el radicado 2022071099-1-000 del 13 de abril de 2022, donde se informa a esta Autoridad, \nsobre la solicitud de Acogimiento al Art. 1 de la Resolución 0370 de 2021 del MADS – Manual de \nCompensaciones del Componente Biótico , y que en el documento titulado “PLAN DE \nCOMPENSACIÓN DEL COMPONENTE BIÓTICO PARA EL PROYECTO CAMPO DE \nPRODUCCIÓN CUMANDAY – ACOGIMIENTO A LA RESOLUCIÓN 370 DE 2021”, la Sociedad \nmenciona lo siguiente:\n“Ahora bien, en el corto plazo, se tiene proyectado la intervención de potenciales áreas para la construcción \nde 3 clúster (plataformas), 3 ZODMES y vías de acceso a los clúster, por lo tanto con el fin de precisar el \nárea potencial a intervenir y entregar información cartográfica, se presenta en la Tabla 17, la información \nasociada a las obras contempladas a realizarse ya que no se cuenta con información de las demás obras, \naclarando que son áreas preliminares de ubicación (Figura 9), las cuales son entregadas para facilitar la \nubicación espacial que permita definir los ecosistemas proyectados a intervenir con el fin de hacer el \ncálculo del cuánto compensar más aproximado y posteriormente visualizar el dónde compensar que \ncumpla con la equivalencia ecosistémica (Anexo 3 GDB). Es de aclarar que el área proyectada a intervenir \nen el escenario máximo contemplado en la Tabla 16, tiene inmersa la información de la Tabla 17.\n(Ver Tabla 17 en la página 18 del Concepto técnico 1003 del 09 de marzo de 2023)\n(...)\nAhora bien, teniendo en cuenta que, como se indica en el Articulo 1 el acogimiento al actual manual \nde compensaciones se realizará conforme a lo estipulado en la Resolución 256 de 2018, y conforme \na los argumentos presentados por la Sociedad donde señala que:\n“(…) la Corte Constitucional ha sido enfática en reiterar que a ninguna persona natural o jurídica se le \npuede forzar a realizar algo si a pesar de asistirle el derecho a quien lo invoque, no cuenta con las \nherramientas, técnicas o medios para hacerlo, aun cuando en él radique la obligación de ejecutar ese algo”\nEs importante resaltar que, en primer lugar, es imperioso que el titular identifique las áreas a \ncompensar para que de esa manera pueda implementar el plan conforme a los términos establecidos \nen el Artículo 3 de la Resolución 256 de 2018, es decir, y como es de conocimiento de \nECOPETROL S.A., Una vez se realice el impacto, el titular tiene un plazo a más tardar dentro de \nlos seis (6) meses, para ejecutar las acciones de compensación aprobadas. En consecuencia, \ncon base en las áreas aprobadas en la licencia ambiental, el proyecto identificará las áreas a \ncompensar, esto teniendo en cuenta lo dispuesto en el numeral “5.2.6 CALCULO DE ÁREA A \nCOMPENSAR” del manual, donde se establece que se debe definir el tamaño del área impactada \ncon base en la información generada en el estudio de impacto ambiental, después de aplicar la \njerarquía de la mitigación.\nAhora bien, frente a los ejemplos relacionados por la sociedad donde esta Autoridad Nacional \naprueba los planes de compensación, mediante la Resolución No. 00481 del 20 de marzo de 2020 \ny la Resolución 491 del 24 de julio de 2019, si bien esta Autoridad aprueba dichos planes los mismos \nse realizan con diferentes requerimientos entre estos se exige que se cuantifique de manera clara \nlos impactos no evitados mitigados o corregidos que dan origen a la compensación, de la siguiente \nmanera:\n“ARTÍCULO OCTAVO. La Sociedad, en un plazo no mayor a seis (6) meses contados a partir del día \nsiguiente de la ejecutoria del presente acto administrativo deberá: \n(…)\n2. Determinar y cuantificar claramente los impactos no evitados, mitigados o corregidos que dan origen a \nla compensación, detallando las coberturas intervenidas por cada obra o actividad y anexando los \npolígonos de las áreas efectivamente intervenidas y las coberturas de la tierra asociadas, siguiendo los \n\nResolución No.  00701           Del   10 de abril de 2023            Hoja No. 13 de 36\n“POR LA CUAL SE RESUELVE UN RECURSO DE REPOSICIÓN”\nOficinas: Carrera 13 A No. 34 – 72 Edificio 13 35 Pisos 8 al 11 Bogotá, D.C.\nCentro de Orientación y Radicación de Correspondencia: Carrera 13 A No. 34 – 72 Edificio 13 35 \nLocales 110 al 112 Bogotá, D.C.  \nCódigo Postal 110311156\nNit.: 900.467.239-2\nLínea de Orientación y Contacto Ciudadano: 57 (1) 2540100 / 018000112998 PBX: 57 (1) 2540111\nwww.anla.gov.co    Email: licencias@anla.gov.co  \nPágina 13 de 36\nlineamientos de la Resolución 2182 del 23 de diciembre de 2016, o cualquier otra que la derogue o \nmodifique.”\nTeniendo en cuenta lo anterior no es cierto lo mencionado por la sociedad cuando asegura que:\n “(…) el pronunciamiento de la ANLA del artículo segundo de la Resolución 3012 del 20 de diciembre de \n2022, transgrede de esta forma el principio de confianza legítima y seguridad jurídica de los administrados, \npues a pesar de que las tres (3) actuaciones se evaluaron bajo los mismos criterios técnicos; los conceptos \nacogidos mediante los actos administrativos antes referidos no van en el mismo sentido (…)”\nToda vez que los mencionados actos administrativos se evalúan bajo los mismos criterios técnicos \ny los requerimientos surgen a partir de la particularidad de cada plan de compensación presentado, \npor lo que si bien la sociedad manifiesta que tomó como lineamientos técnicos los planes de \ncompensación ya presentados y aprobados por esta Autoridad, esto no significa que sea garante de \nuna aceptación por parte de esta Autoridad Nacional, considerando la especificidad de cada plan \nconforme a las condiciones de sitio seleccionado, área afectada y acciones seleccionadas para \nejecutar las medidas de compensación.\nAdicionalmente el Manual de Compensaciones del Componente Biótico, frente a la planificación de \nlos proyectos, obras o actividades menciona que los proyectos, obras o actividades en el marco de \nlas licencias ambientales, las solicitudes de permisos o autorizaciones de aprovechamiento forestal \núnico de bosque natural y la solicitud de sustracciones temporales y definitivas de reservas forestales \nnacionales o regionales por cambio de uso del suelo, podrán consolidar una adecuada y efectiva \nplanificación que contribuya a disminuir la pérdida de biodiversidad, teniendo como base la aplicación \nde la jerarquía de la mitigación en el diseño y preinversión de los proyectos, de acuerdo con las \nsiguientes etapas: \n“1. Utilizar herramientas e información referenciada en el Sistema de Información Ambiental de Colombia \n(SIAC) u otros geovisores que ayuden a identificar preliminarmente los impactos sobre ecosistemas \ndonde se pretende implementar la actividad. En esta etapa se deben identificar a su vez otros impactos \nsinérgicos y acumulativos sobre el componente biótico que se produzcan por la interrelación que se dé \ncon otros proyectos, obras o actividades.\n2. Identificar y evaluar los impactos y las afectaciones contenidos en los estudios ambientales, y evaluar \ncuáles se pueden minimizar a través de medidas de manejo o buenas prácticas ambientales. Para los \nimpactos y afectaciones que no pudieron ser evitados, mitigados o corregidos, se cuantifica la \ncompensación por el tipo de ecosistema, respondiendo a ¿Qué?, ¿Cuánto?, ¿Dónde? y ¿Cómo?.\n3. Implementar las medidas de compensación presentadas en el plan de compensaciones y aprobadas \npor la autoridad ambiental competente.\n4. Una vez verificado el cumplimiento del plan de compensaciones, la autoridad ambiental expide el acto \nadministrativo que así lo consagra.”\nEs así como la primera etapa consiste en identificar de manera previa los impactos sinérgicos y \nacumulativos sobre los ecosistemas en donde se planea realizar la actividad, de tal manera que una \nvez la Sociedad inicie el impacto, debe tener claras las áreas a intervenir, los ecosistemas y demás \naspectos del desarrollo del proyecto, no es coherente el argumento que se inicie la ejecución de \nactividades del proyecto licenciado sin una previa planeación e identificación de posibles impactos \nconforme al diseño del proyecto, teniendo de esta manera ya definidos el qué y cuánto compensar, \nsiendo esta la base para la definición del dónde compensar, por lo tanto se considera adecuado el \ntiempo definido para la entrega de la información solicitada, toda vez que esta Autoridad requiere \nevaluar las áreas donde se [ejecutará] el plan de compensación con el fin de verificar que estas \ncumplan con los objetivos definidos en el manual en busca de garantizar la no pérdida neta de \nbiodiversidad, adicionalidad y que claramente se demuestre la compensación por los impactos \ngenerados por el proyecto de acuerdo a lo definido en el Decreto 1076 de 2015.\nAhora bien, respecto a dónde compensar, el plan debe estar dirigido a conservar áreas \necológicamente equivalentes a las afectadas, es así como la estrategia principal de selección de \náreas para ejecutar la compensación consiste en reconocer los ecosistemas equivalentes dentro del \nárea de influencia del proyecto, de tal manera que las compensaciones deberán localizarse en el \nsiguiente ámbito geográfico y orden de prioridades: \na) La subzona hidrográfica dentro de la cual se desarrolla el proyecto, obra o actividad o las \nsubzonas hidrográficas circundantes \nb) La zona hidrográfica dentro de la cual se desarrolla el proyecto, obra o actividad. \n\nResolución No.  00701           Del   10 de abril de 2023            Hoja No. 14 de 36\n“POR LA CUAL SE RESUELVE UN RECURSO DE REPOSICIÓN”\nOficinas: Carrera 13 A No. 34 – 72 Edificio 13 35 Pisos 8 al 11 Bogotá, D.C.\nCentro de Orientación y Radicación de Correspondencia: Carrera 13 A No. 34 – 72 Edificio 13 35 \nLocales 110 al 112 Bogotá, D.C.  \nCódigo Postal 110311156\nNit.: 900.467.239-2\nLínea de Orientación y Contacto Ciudadano: 57 (1) 2540100 / 018000112998 PBX: 57 (1) 2540111\nwww.anla.gov.co    Email: licencias@anla.gov.co  \nPágina 14 de 36\nLa selección de la zona hidrográfica deberá ser sustentada con base en condiciones técnicas que \njustifiquen su priorización; Se reitera que la sociedad debe ejecutar conforme a lo establecido en el \nManual de compensaciones del componente biótico.\nEs así como en la evaluación de la propuesta presentada por la Sociedad en el marco del \nacogimiento a la Resolución 370 del 15 de abril de 2021 esta Autoridad mediante el concepto técnico \n7263 del 24 de noviembre de 2022 menciona lo siguiente:\n“(…) la Sociedad debe definir y especificar el área destinada para realizar las acciones de compensación \ny las acciones a implementar dentro de estas, por lo que deberá presentar, para evaluación y aprobación \nde la Autoridad Nacional de Licencias Ambientales y en un término no mayor a tres (3) meses posterior a \nla intervención de áreas para la ejecución de las actividades autorizadas del proyecto Campo de \nProducción Cumanday, el área propuesta para la compensación (DÓNDE compensar), garantizando que \nexista equivalencia ecosistémica con base en la unidad de análisis espacial (Bioma IAVH) del Mapa de \nEcosistemas de Colombia en escala 1:100.000 (IDEAM et al., 2017), conforme las áreas efectivamente \nintervenidas.”\nLo anterior teniendo en cuenta lo mencionado en el artículo tercero de la Resolución 256 de 22 de \nfebrero de 2018\n“Articulo 3. Ejecución del Plan de Compensaciones del Componente Biótico. La implementación del plan \nde compensación deberá iniciarse a más tardar dentro de los seis (6) meses a partir de la realización del \nimpacto o afectación por el proyecto, obra o actividad sujeto de licencia ambiental o aprovechamiento \núnico forestal. En el caso de la sustracción temporal o definitiva de reservas forestales será a partir de la \nejecutoria del acto administrativo que apruebe el plan de compensación.”\nEs así como , para cuando hayan transcurrido seis (6) meses después de la intervención, la sociedad \nya debe contar con un plan de compensación aprobado que pueda implementar y para que este \npueda ser aprobado, debe incluir todos los elementos técnicos, jurídicos y financieros necesarios \npara una compensación efectiva como indica el numeral 5.4 “Plan de compensación” del Manual, \nadicionalmente, la Sociedad deberá tener en cuenta los principios orientadores de las \ncompensaciones del componente biótico, entendiendo que la jerarquía de la mitigación “…establece \nque la única manera para compensar un ecosistema impactado de forma negativa, es realizando previamente \ny de forma secuencial medidas que eviten, minimicen o corrijan dicha afectación o impacto, planeando el \nproyecto, obra o actividad de tal manera que permita un desarrollo sostenible de los recursos naturales”, \ncon base en lo anterior y como indica el numeral 4.2 “Jerarquía de la mitigación” se proponen y \ndiseñan las medidas orientadas a prevenir, mitigar, corregir y compensar los impactos de un \nproyecto, obra o actividad, en aras de lograr la no pérdida de biodiversidad.\nLa Autoridad Nacional de Licencias Ambientales-ANLA enfatiza su interés respecto a que los titulares \nde licencia con obligaciones de compensación ejecuten las actividades en los términos establecidos, \npor lo que, en cuanto ECOPETROL S.A. presente los requerimientos conforme las especificaciones \nsolicitadas, esta Autoridad realizará la respectiva evaluación en aras de viabilizar su ejecución, \nbuscado así que esta compensaciones contribuyan en el objetivo de la construcción de una paz \nestable y duradera, tal y como se menciona en el manual de compensaciones del componente \nbiótico:\n“(…) Se debe resaltar que las compensaciones se suman a los esfuerzos del Estado Colombiano para \nla construcción de una paz estable y duradera, promoviendo un actuar responsable por parte de los \nproponentes y ejecutores de proyectos e inversiones, cuyos proyectos, obras o actividades generen un \nimpacto negativo con el fin de que pueda ser sistemáticamente compensado. En tal sentido este manual \nbusca ser un instrumento que genere confianza tanto a la sociedad como a los interesados en el \ndesarrollo de proyectos, obras o actividades, viendo a la autoridad ambiental como un garante del \ncumplimiento de las obligaciones de prevenir, mitigar y corregir los impactos ambientales negativos, y \ncompensar aquellos impactos cuando sea el caso.”\nCon base en todo lo expuesto anteriormente, se [considera pertinente] CONFIRMAR lo dispuesto en \nlos numerales 1, 2, 3, 4 ,5, 6, 7, 8, 9, 10, 11, y 12 del artículo segundo de la Resolución 3012 del 20 \nde diciembre de 2022, toda vez que en dicho requerimiento es claro que el plazo de los tres meses \naplica luego de la generación del impacto y/o afectación de áreas en el desarrollo del proyecto \n“Campo de Producción Cumanday”.\n(…)”\nSumado a lo anterior, en relación con los argumentos expuestos por el recurrente sobre la \npresunta vulneración del: a) Principio de derecho según el cual “Nadie está obligado a lo \nimposible” y el b) Principio de \"Confianza legitima y seguridad jurídica\"; sustentados en el \nescrito del recurso, se resalta que la Autoridad Nacional es garante de la Constitución, la \n\nResolución No.  00701           Del   10 de abril de 2023            Hoja No. 15 de 36\n“POR LA CUAL SE RESUELVE UN RECURSO DE REPOSICIÓN”\nOficinas: Carrera 13 A No. 34 – 72 Edificio 13 35 Pisos 8 al 11 Bogotá, D.C.\nCentro de Orientación y Radicación de Correspondencia: Carrera 13 A No. 34 – 72 Edificio 13 35 \nLocales 110 al 112 Bogotá, D.C.  \nCódigo Postal 110311156\nNit.: 900.467.239-2\nLínea de Orientación y Contacto Ciudadano: 57 (1) 2540100 / 018000112998 PBX: 57 (1) 2540111\nwww.anla.gov.co    Email: licencias@anla.gov.co  \nPágina 15 de 36\nLey y los procedimientos que rigen la actuación administrativa en materia ambiental, en ese \nsentido las decisiones que se profieren en el marco de los procesos de competencia de la \nAutoridad Nacional se encuentran debidamente sustentadas tanto técnica como \njurídicamente.\nBajo ese contexto, y revisada la decisión objeto de recurso, no se encuentra situación \nalguna que deba ser objeto de análisis o pronunciamiento adicional a lo ya dicho en las \nconsideraciones precedentes; no obstante, es preciso resaltar a la Sociedad que los \nrequerimientos impuestos en la Resolución 3012 del 20 de diciembre de 2022, objeto de \nrecurso, se han formulado con fundamento en lo previsto en el Manual de Compensaciones \ndel Componente Biótico adoptado mediante Resolución 256 del 22 de febrero de 2018, a la \ncual la Sociedad presentó solicitud de acogimiento, tal como se evidencia en la \ncomunicación con radicación 2022071099-1-000 del 13 de abril de 2022.\nEn ese mismo sentido, vale la pena señalar que, en efecto la Sociedad no está obligada al \ncumplimiento de obligaciones cuya acreditación resulte imposible, pero sí debe someterse \nal acatamiento de las obligaciones previstas en la Ley, pues en materia ambiental no se \ntrata simplemente de gozar de una autorización ambiental otorgada por la Autoridad \nNacional sin que se genere correlativamente una obligación para el titular, pues la \nnaturaleza de los instrumentos de manejo y control, es justamente que se puedan \nestablecer acciones y límites dentro de los cuales pueda desarrollarse una actividad \ndeterminada, la cual por sí misma genera impactos ambientales sobre los recursos, y así, \nquien ejecute dichas actividades cumpla con ciertas condiciones y obligaciones.\nPor otro lado, en lo que atañe al principio de la Seguridad Jurídica, la Honorable Corte \nConstitucional ha señalado que (…) “[E]ste principio ostenta rango constitucional y lo ha derivado \ndel preámbulo de la Constitución y de los artículos 1, 2, 4, 5 y 6 de la Carta. La seguridad jurídica es \nun principio que atraviesa la estructura del Estado de Derecho y abarca varias dimensiones. En \ntérminos generales supone una garantía de certeza. Esta garantía acompaña otros principios y \nderechos en el ordenamiento. La seguridad jurídica no es un principio que pueda esgrimirse \nautónomamente, sino que se predica de algo. Así, la seguridad jurídica no puede invocarse de \nmanera autónoma para desconocer la jerarquía normativa, en particular frente a la garantía de la \nefectividad de los derechos constitucionales y humanos de las personas” (…)1\nDe acuerdo con lo anterior, se señala que los argumentos esgrimidos por el recurrente \nsobre dicho precepto Constitucional no se predica para el caso en concreto es así, que la \nAutoridad Nacional no ha quebrantado o modificado los Actos Administrativos antepuestos, \npor el contrario los requerimientos que se realizan se encuentran debidamente \nfundamentados con los argumentos técnicos y jurídicos necesarios y en caminados al \ncumplimiento de la obligación de Compensación Ambiental, de acuerdo con la normativa \nque la regula.\nAsí las cosas y atendiendo a las consideraciones expuestas por el Concepto técnico 1003 \ndel 09 de marzo de 2023 se confirmará lo dispuesto en los numerales 1, 2, 3, 4 ,5, 6, 7, 8, \n9, 10, 11, y 12 del artículo segundo de la Resolución 3012 del 20 de diciembre de 2022, tal \ncomo se señalará en la parte resolutiva del presente acto administrativo.\n2.\nOBLIGACIÓN RECURRIDA – ARTÍCULO TERCERO Y CONSIDERACIONES DEL \nACTO ADMINISTRATIVO.\n“ARTÍCULO TERCERO. Requerir a la Sociedad ECOPETROL S.A., para que en el término de tres \n(3) meses, contados a partir de la ejecutoria del presente acto administrativo, presente la siguiente \ninformación complementaria, necesaria para que esta Autoridad cuente con los elementos \nsuficientes para pronunciarse acerca de la viabilidad del ajuste del Plan de inversión forzosa de no \nmenos del 1%:\n1.\nAjustar el Plan de Inversión forzosa de no menos del 1%, en el sentido de incluir información \ntécnica relacionada con las actividades a desarrollar y con las áreas donde se realizarán las \nacciones de conservación y sus aislamientos como eje principal de la destinación de los recursos \n1 Sentencia T-502 de 2002\n\nResolución No.  00701           Del   10 de abril de 2023            Hoja No. 16 de 36\n“POR LA CUAL SE RESUELVE UN RECURSO DE REPOSICIÓN”\nOficinas: Carrera 13 A No. 34 – 72 Edificio 13 35 Pisos 8 al 11 Bogotá, D.C.\nCentro de Orientación y Radicación de Correspondencia: Carrera 13 A No. 34 – 72 Edificio 13 35 \nLocales 110 al 112 Bogotá, D.C.  \nCódigo Postal 110311156\nNit.: 900.467.239-2\nLínea de Orientación y Contacto Ciudadano: 57 (1) 2540100 / 018000112998 PBX: 57 (1) 2540111\nwww.anla.gov.co    Email: licencias@anla.gov.co  \nPágina 16 de 36\nen el marco de la obligación de la inversión forzosa de no menos del 1%; con la siguiente \ninformación:\na)\nAlcance acorde con acciones de protección, conservación y/o preservación.\nb)\nObjetivo acorde con acciones de protección, conservación y/o preservación.\nc)\nUbicación en la subzona hidrográfica.\nd)\nIdentificación de la localización de las actividades propuestas y los límites del proyecto.\ne)\nExcluir de los listados de especies vegetales aquellas que no sean nativas de la región, \nforáneas y/o introducidas, como, por ejemplo, la especie Cordia alliodora.\nf)\nMetas e indicadores de seguimiento y cumplimiento (Cualitativos y cuantitativos) que \ncontribuyan al objetivo de las acciones de recuperación, preservación, conservación y \nvigilancia de la cuenca hidrográfica; y que permita realizar el seguimiento de las actividades \npropuestas.\ng)\nCronograma de actividades.\nh)\nPlan operativo y de inversiones.\ni)\nFormulación del Plan de monitoreo, seguimiento y evaluación.\nj)\nUbicación geográfica y soportada en el Modelo de Almacenamiento Geográfico, acorde con \nlo establecido en la Resolución 2182 del 23 de diciembre de 2016 o el que lo derogue, \nsustituya o modifique.\n2.\nAjustar los siguientes aspectos específicos de la línea de inversión relacionada con las acciones \nde protección, conservación y preservación a través de restauración ecológica, rehabilitación y \nrecuperación:\na)\nCriterios de selección del área propuesta a trabajar, justificando su importancia.\nb)\nDiagnóstico socioambiental del área de interés (biofísicos, identificación y cuantificación de \nla cobertura vegetal (inventario de especies de flora y/o fauna, registro fotográfico).\nc)\nMétodo y/o estrategias de las acciones a implementar.\nd)\nDescripción de los posibles factores de disturbio; causa, magnitud, intensidad y severidad.\ne)\nIdentificación de actores locales y autorización o acuerdo con el propietario.\nf)\nDefinición de la meta.\n1.4. Petición de la sociedad\n1.\n“REPONER el Artículo Tercero de la Resolución 3012 del 20 de diciembre de 2022, en el sentido \nde APROBAR el Plan de inversión forzosa de no menos del 1%, con sus respectivas líneas de \ndestinación de recursos y ámbito geográfico presentado por ECOPETROL S.A., mediante \nradicado 2020118588-1-000 del 24 de julio de 2022, para el proyecto \"Campo de producción \nCumanday\".\n2.\nMODIFICAR la temporalidad de la obligación establecida en el artículo Tercero de la Resolución \n03012 del 20 de diciembre de 2022, en la que se mencione de manera explícita que la \ninformación solicitada deberá ser entregada en los sucesivos Informes de Cumplimiento \nAmbiental, de acuerdo con los avances consignados en el cronograma entregado mediante \nradicado 2020118588-1-000 del 24 de julio de 2022 y se elimine la siguiente información “…para \nque esta Autoridad cuente con los elementos suficientes para pronunciarse acerca de la \nviabilidad del ajuste del Plan de inversión forzosa de no menos del 1%.”\n3.\nREVOCAR el literal a), del numeral 2, artículo Tercero de la Resolución 3012 del 20 de diciembre \nde 2022.\n4.\nREVOCAR el literal c), numeral 2, artículo Tercero de la Resolución 3012 del 20 de diciembre \nde 2022.\n\nResolución No.  00701           Del   10 de abril de 2023            Hoja No. 17 de 36\n“POR LA CUAL SE RESUELVE UN RECURSO DE REPOSICIÓN”\nOficinas: Carrera 13 A No. 34 – 72 Edificio 13 35 Pisos 8 al 11 Bogotá, D.C.\nCentro de Orientación y Radicación de Correspondencia: Carrera 13 A No. 34 – 72 Edificio 13 35 \nLocales 110 al 112 Bogotá, D.C.  \nCódigo Postal 110311156\nNit.: 900.467.239-2\nLínea de Orientación y Contacto Ciudadano: 57 (1) 2540100 / 018000112998 PBX: 57 (1) 2540111\nwww.anla.gov.co    Email: licencias@anla.gov.co  \nPágina 17 de 36\n5.\nACLARAR la consideración realizada en el concepto técnico 7263 del 24 de noviembre de 2022, \npágina 14, subtitulo Mantenimiento y Monitoreo en el sentido de, APROBAR el uso de \ncomponentes para la fertilización y demás actividades del proceso, el uso de agroquímicos para \nlas actividades que así lo demanden, durante la siembra y el mantenimiento del sistema \nagroforestal propuesto, de conformidad con los lineamientos dados por el Ministerio de \nAgricultura y Desarrollo Rural y la Federación Nacional de Cacaoteros. \n6.\nACLARAR, la consideración realizada en el concepto técnico 7263 del 24 de noviembre de 2022, \npágina 14, subtitulo Mantenimiento y Monitoreo en el sentido de APROBAR el mantenimiento de \nlos arreglos agroforestales durante los (3) tres años iniciales a partir del establecimiento.”\n1.5. Argumentos de la sociedad\nMediante comunicación con radicación 2023000555-1-000 del 02 de enero de 2023, la \nSociedad presentó los siguientes argumentos:\n“Inicialmente es importante mencionar que lo requerido por la ANLA en la Resolución 00001 del 2 \nde enero de 2019 mediante, la cual se otorgó la licencia ambiental al proyecto Campo de Producción \nCumanday, establece:\n“ARTÍCULO TRIGÉSIMO: La sociedad ECOPETROL S.A., en el término de tres (3) meses a partir de la \nejecutoria de este acto administrativo, deberá presentar la propuesta de líneas de generales de inversión \nde no menos del 1%, para el desarrollo de las actividades autorizadas en la presente licencia ambiental \nglobal, según lo establecido el Decreto 1076 de 2015 modificado por el Decreto 2099 de 2016, el cual ha \nsido modificado por el Decreto 75 del 20 de enero de 2017 y el Decreto 1120 del 29 de junio de 2017.” \n(Negrita fuera del texto original)\nPosteriormente, mediante comunicación con radicación en ANLA 2019010304-1-000 del 19 de \nfebrero de 2019, ECOPETROL S.A., interpuso recurso de reposición contra la Resolución 0001 del \n2 de enero de 2019, por la cual se otorgó Licencia Ambiental para el desarrollo del proyecto \ndenominado “Campo de Producción Cumanday”. Dicho recurso fue resuelto mediante la Resolución \n01148 del 20 de junio de 2019, modificando parcialmente la Resolución 00001 de 2019.\nMediante documento con Radicado 2019149888-1-000 del 30 de septiembre de 2019, ECOPETROL \nS. A. presentó ante la ANLA el documento \"Líneas generales de inversión del Plan de Inversión \nForzosa de no menos del 1% del Proyecto Campo de Producción Cumanday - cumplimiento al \nArtículo Trigésimo de la Resolución 001 del 02 de enero de 2019”, en el cual se propuso las \nsiguientes líneas de inversión:\na)\nFormulación del plan de ordenamiento de la cuenca del (POMCA) río Planas, siempre y cuando \nCORMACARENA asegure, con otras fuentes de recursos, el financiamiento total de este instrumento en el \nmarco del numeral 3 del Artículo 2.2.9.3.1.9 del Decreto 1076 de 2015 del Ministerio de Ambiente y \nDesarrollo Sostenible, modificado por el Decreto 2099 de 2016.\nb)\nAcciones de protección, conservación y preservación a través de la restauración ecológica, rehabilitación y \nrecuperación, dentro de las cuales se puede incluir desarrollo de proyectos de usos sostenible, orientado \nal impulso de actividades productivas sostenibles a través de buenas prácticas de producción en el marco \ndel literal (a) del numeral 1 del artículo 2.2.9.3.1.9 del Decreto 1076 de 2015 del Ministerio de Ambiente y \nDesarrollo Sostenible dada la vigencia del Plan de Ordenación y Manejo de la cuenca del río Tillavá, \naprobado y adoptado por CORMACARENA mediante la Resolución No. PS-GJ. 1.2.6.19-0141 de 2019.\nA través de la comunicación PM-GPO.1.3.19.1928 del 16 de octubre de 2019, Cormacarena dio \nrespuesta a la comunicación con radicado 017903 del 4 de septiembre de 2019 sobre la priorización \ny fuentes de recursos de financiamiento del POMCA del río Planas. En dicha respuesta Cormacarena \ninforma que la información sobre la priorización de cuencas se encuentra disponible en la página \nweb \nde \nla \ncorporación. \nUna \nvez \nrealizada \nla \nconsulta \nen \nla \ndirección \nURL: \nhttp://www.cormacarena.gov.co/planificacion.php#collapseFive. Se realizó la descarga de la \n“Priorización de cuencas hidrográficas en el departamento del Meta Jurisdicción de \nCORMACARENA 2014”, observando que la cuenca del río Planas se encuentra en el número de \nprioridad 18 dentro del tercer grupo (cuencas priorizadas para la ordenación y que no cuentan con \ndisponibilidad de recursos en el corto plazo) con año propuesto de inicio 2022. En cuanto a fuentes \nde recursos de financiamiento del POMCA, Cormacarena no entrega información.\nMediante comunicación con radicado 2020118588-1-000 del 24 de julio de 2020, ECOPETROL S.A, \nentregó a la ANLA copia del documento “Ajuste al Plan de Inversión Forzosa de no menos del 1% \ndel Proyecto Campo de Producción Cumanday – cumplimiento de la Resolución 00001 del 2 de \nenero de 2019” y copia de su radicación ante Cormacarena. Información que fue evaluada por la \n\nResolución No.  00701           Del   10 de abril de 2023            Hoja No. 18 de 36\n“POR LA CUAL SE RESUELVE UN RECURSO DE REPOSICIÓN”\nOficinas: Carrera 13 A No. 34 – 72 Edificio 13 35 Pisos 8 al 11 Bogotá, D.C.\nCentro de Orientación y Radicación de Correspondencia: Carrera 13 A No. 34 – 72 Edificio 13 35 \nLocales 110 al 112 Bogotá, D.C.  \nCódigo Postal 110311156\nNit.: 900.467.239-2\nLínea de Orientación y Contacto Ciudadano: 57 (1) 2540100 / 018000112998 PBX: 57 (1) 2540111\nwww.anla.gov.co    Email: licencias@anla.gov.co  \nPágina 18 de 36\nANLA mediante concepto técnico 7956 del 30 de diciembre de 2020, el cual considero (sic) “…viable \naprobar las líneas generales de inversión de no menos del 1%, presentadas por la empresa mediante \nradicado 2020118588-1-000 del 24 de julio del 2020.” (Negrita fuera del texto original) concepto que fue \nacogido mediante Auto 263 del 29 de enero de 2021, el cual en la página 34 y 35, la ANLA, indicó \nque la obligación del Artículo Trigésimo, de la Resolución 0001 de 2019 relacionado con la \npresentación de la propuesta de líneas generales de inversión de no menos del 1%, fue cumplida \ny concluida, mencionando lo siguiente “De conformidad con el concepto técnico 07956 del 30 de diciembre \nde 2020, el titular del proyecto dio cumplimiento a las siguientes obligaciones ambientales, razón a ello se \nconsideran cumplidas y concluidas, y bajo esta perspectiva, esta Autoridad Nacional no volverá a \nefectuar seguimiento y control ambiental sobre las mismas, por ser de único cumplimiento.” (Negrita \nfuera del texto original)\nNo obstante, lo anterior pese a que se consideró el cumplimiento de la obligación por parte de la \nANLA en el concepto técnico 7956 del 30 de diciembre de 2020 (Pág. 119) y Auto 263 de 2021, no \nse tiene pronunciamiento de manera explícita mediante acto administrativo de la aprobación de las \nlíneas generales de inversión y el ámbito geográfico donde se debe realizar la inversión de acuerdo \ncon lo dispuesto en el numeral 2.2.9.3.1.5 del Decreto 2099 de 2016, compilado en el Decreto 1076 \nde 2015. Solicitud que fue reiterada a la ANLA en la visita guiada de seguimiento y control ambiental \nque generó el concepto técnico 8443 del 28 de diciembre de 2021, acogido según Acta No. 744 del \n28 de diciembre de 2021, en donde se precisó por parte de ANLA en observaciones y aclaraciones \nlo siguiente (Pág.18):\n“…se remitió al equipo jurídico de la Autoridad Nacional para que, a través de acto administrativo \nindependiente proceda a pronunciarse frente a lo solicitado por la Sociedad.”\nPosteriormente, la ANLA mediante concepto técnico 7263 del 24 de noviembre de 2022, volvió a \nevaluar el ajuste al plan de inversión forzosa de no menos del 1%, radicado 2020118588-1-000 del \n24 de julio de 2020, requiriendo en la Resolución 3012 del 20 de diciembre de 2022, Artículo Tercero \ninformación complementaria para pronunciamiento de fondo respecto a la viabilidad del ajuste del \nPlan de Inversión, al respecto se tiene las siguientes consideraciones:\n1. Bajo el anterior contexto se tiene que de acuerdo con la normatividad legal ambiental en este caso el \nDecreto 2099 de 2018, incorporado en el Decreto 1076 de 2015, en el artículo 2.2.9.3.1.5 Aprobación de \nlas líneas generales de inversión forzosa de no menos del 1%, menciona que la Autoridad Ambiental se \npronunciará sobre el mismo, sin embargo pese a que el alcance de la norma hace alusión a líneas \ngenerales y ámbito geográfico, el cual como fue mencionado con anterioridad ya había sido evaluado \ninicialmente en el concepto técnico 7956 del 30 de diciembre de 2020 (acogido por el Auto 263 de 2020) \ndonde consideró viables las líneas de destinación, no obstante en este último concepto 7263 del 24 de \nnoviembre de 2022 (acogido por la Resolución 3012 del 2022), desconoce el pronunciamiento realizado \npor la misma Autoridad en los años anteriores, el cual va en contravía al pronunciamiento previamente \nestablecido por la ANLA, evidenciándose contradicción por parte de dicha Autoridad en los \npronunciamientos emitidos, lo cual viola la seguridad jurídica.\n2.Posteriormente, en el concepto técnico 8086 del 23 de diciembre de 2022, acogido mediante acta de \nreunión de control y seguimiento 993 del 23 de diciembre de 2022, hace seguimiento a la obligación del \nArtículo Trigésimo respecto a entregar las líneas generales de destinación, mencionado (sic) que es de \ncarácter, permanente y si cumple, no obstante contradice la información del Auto 263 del 29 de enero de \n2021, en donde se da por cumplida y concluida la obligación y se menciona de manera explícita en la \npágina 35, lo siguiente:\n“De conformidad con el concepto técnico 07956 del 30 de diciembre de 2020, el titular del proyecto dio \ncumplimiento a las siguientes obligaciones ambientales, razón a ello se consideran cumplidas y \nconcluidas, y bajo esta perspectiva, esta Autoridad Nacional no volverá a efectuar seguimiento y \ncontrol ambiental sobre las mismas, por ser de único cumplimiento: …”\n“…Artículo Trigésimo, relacionado con la presentación de la propuesta de líneas de generales de inversión \nde no menos del 1%...”\nAl respecto se evidencia, nuevamente pronunciamientos contradictorios por parte de la ANLA, lo cual viola \nla seguridad jurídica al revivir una obligación cumplida y concluida previamente.\n3. Tal cual como fue mencionado en el anterior numeral 1 del presente acápite, el Decreto 2099 de 2016 \ncontempla para la instancia del EIA, la entrega de las líneas generales, requiriéndolo en el artículo \ntrigésimo de la Resolución 0001 de 2019 mediante la cual se otorgó la licencia ambiental para el proyecto \nCampo de producción Cumanday, sin embargo ECOPETROL S.A, en su responsabilidad, buena fe y \ncumplimiento de la obligación en comento, no se limitó al mismo (líneas generales de destinación), si no \npor el contrario mediante radicado 2020118588-1-000 del 24 de julio de 2020 entregó el plan de inversión \nforzosa de no menos del 1%, con una estructura e información robusta, el cual contiene Introducción, \nnorma aplicable, descripción del proyecto que generará la obligación, localización, antecedes, valor de la \ninversión, objetivos del plan (generales y específicos), ámbito geográfico de la obligación, estrategia para \nla implementación de las obligaciones, descripción de las líneas de destinación, metodología y plan \n\nResolución No.  00701           Del   10 de abril de 2023            Hoja No. 19 de 36\n“POR LA CUAL SE RESUELVE UN RECURSO DE REPOSICIÓN”\nOficinas: Carrera 13 A No. 34 – 72 Edificio 13 35 Pisos 8 al 11 Bogotá, D.C.\nCentro de Orientación y Radicación de Correspondencia: Carrera 13 A No. 34 – 72 Edificio 13 35 \nLocales 110 al 112 Bogotá, D.C.  \nCódigo Postal 110311156\nNit.: 900.467.239-2\nLínea de Orientación y Contacto Ciudadano: 57 (1) 2540100 / 018000112998 PBX: 57 (1) 2540111\nwww.anla.gov.co    Email: licencias@anla.gov.co  \nPágina 19 de 36\noperativo para el desarrollo de acuerdos de conservación, indicadores, riesgos, presupuesto y cronograma, \npese a que en la actualidad no existen lineamientos oficiales por parte del ente regulador en este caso el \nMADS o por parte de la ANLA como operador de la norma que precise de manera tacita, el contenido de \nun plan de inversión.\nDe esta manera no es claro para ECOPETROL S.A, el pronunciamiento de la ANLA respecto a \nrequerir información del artículo tercero, dado que según lo contemplado en el Decreto 2099 de 2018, \nincorporado en el Decreto 1076 de 2015, “ARTÍCULO 2.2.9.3.1.8 APROBACIÓN DEL PLAN INVERSIÓN \nFORZOSA DE NO MENOS DEL 1 %. El titular la licencia ambiental, a los seis (6) meses de finalizadas las \nactividades de construcción y montaje del proyecto, deberá presentar las acciones específicas de \ndestinación los recursos en el marco de las líneas y ámbito geográfico de la propuesta de plan de inversión de \nno menos del 1% aprobadas en el administrativo que otorgó la licencia ambiental …”. (Negrita fuera del texto \noriginal)\n“…La autoridad ambiental competente procederá a su aprobación en un término de treinta (30) días hábiles, \nsiguiendo el procedimiento administrativo general de la Ley 1437 de 2011. Este pronunciamiento constituirá el \nplan inversión forzosa de no menos del 1% proyecto, cuya ejecución deberá iniciarse siempre y cuando se haya \nrealizado la captación del recurso hídrico de la natural...”\nPor lo tanto, la información que se solicitó en el Artículo Trigésimo de la Resolución 0001 de 2019, \nobedece a nivel de aprobación de líneas de destinación de los recursos y ámbito geográfico que \nhasta la fecha no ha sido aprobado por la ANLA pese a que se ha entregado la información en varias \noportunidades desde el 2018 de acuerdo con lo estipulado en el artículo 2.2.9.3.1.5 del Decreto 2099 \nde 2016, incorporado por el Decreto 1076 de 2015 y que ahora ANLA después de dos evaluaciones \nmediante conceptos técnicos 7956 del 30 de diciembre de 2020 y 7263 del 24 de noviembre de 2022, \nevalúa la misma información radicada 2020118588-1-000 el 24 de julio de 2020, solicitando en este \núltimo concepto acogido por la resolución 3012 del 20 de diciembre de 2022, más información que \nno es procedente para lo requerido en el alcance puntual de la obligación en comento.\n4. ECOPETROL S.A., considera procedente enunciar que la Corte Constitucional ha sido enfática \nen reiterar que a ninguna persona natural o jurídica se le puede forzar a realizar algo, si a pesar de \nasistirle el derecho a quien lo invoque, no cuenta con las herramientas, técnicas o medios para \nhacerlo, aun cuando en él, radique la obligación de ejecutar ese algo.\nHecho por el cual ECOPETROL S.A., considera que el cumplimiento de la Resolución No. 03012 del \n20 de diciembre de 2022, específicamente en su artículo tercero señala:\n“(…) ARTÍCULO TERCERO. Requerir a la Sociedad ECOPETROL S.A., para que en el término de tres (3) \nmeses, contados a partir de la ejecutoria del presente acto administrativo, presente la siguiente información \ncomplementaria, necesaria para que esta Autoridad cuente con los elementos suficientes para pronunciarse \nacerca de la viabilidad del ajuste del Plan de inversión forzosa de no menos del 1%: (Subrayado fuera \ndel texto original)\n1. Ajustar el Plan de Inversión forzosa de no menos del 1%, en el sentido de incluir información técnica \nrelacionada con las actividades a desarrollar y con las áreas donde se realizarán las acciones de \nconservación y sus aislamientos como eje principal de la destinación de los recursos en el marco de la \nobligación de la inversión forzosa de no menos del 1%; con la siguiente información: (Subrayado fuera del \ntexto original) (…)”\nRelacionando las obligaciones establecidas en los literales a), b), c), d), e), f), g), h), i), j), del numeral \n1, artículo tercero, limitándolas a incluir información de las actividades a desarrollar y con las áreas \ndonde se realizarán las acciones de conservación y sus aislamientos.\nPor lo anterior, una vez revisado el pronunciamiento de la Autoridad Nacional de Licencias \nAmbientales-ANLA, se evidencia que transgrede el principio de “Nadie está obligado a lo imposible”, \npues al momento de evaluar el plan de inversión forzosa de no menos del 1% radicado mediante \nnúmero 2020118588-1-000 del 24 de julio de 2022, el cual contiene la información requerida según \nel Artículo Trigésimo de la Resolución 0001 de 2019, la ANLA obliga y limita a ECOPETROL S.A, al \nsolicitar las acciones a desarrollar y las áreas donde se realizarán las acciones de conservación, \npese a que la información fue entregada en el plan de inversión en comento no con el detalle \nespecifico que requiere la ANLA, el cual carece de justificación o sustento jurídico que requiera dicho \ndetalle para un proyecto que si bien a la fecha no se ha activado la obligación por el no uso de agua \nde fuente natural autorizada en la licencia ambiental, no es la instancia para solicitarlo según el \nArtículo 2.2.9.3.1.8 del Decreto 2099 de 2016.\nEn línea con lo anterior, la norma que regula la inversión forzosa de no menos del 1%, no precisa y \nrequiere información detallada o una escala determinada de las áreas donde se ejecutará la inversión \npor lo tanto el plan de inversión entregado mediante radicado 2020118588-1-000 del 24 de julio de \n\nResolución No.  00701           Del   10 de abril de 2023            Hoja No. 20 de 36\n“POR LA CUAL SE RESUELVE UN RECURSO DE REPOSICIÓN”\nOficinas: Carrera 13 A No. 34 – 72 Edificio 13 35 Pisos 8 al 11 Bogotá, D.C.\nCentro de Orientación y Radicación de Correspondencia: Carrera 13 A No. 34 – 72 Edificio 13 35 \nLocales 110 al 112 Bogotá, D.C.  \nCódigo Postal 110311156\nNit.: 900.467.239-2\nLínea de Orientación y Contacto Ciudadano: 57 (1) 2540100 / 018000112998 PBX: 57 (1) 2540111\nwww.anla.gov.co    Email: licencias@anla.gov.co  \nPágina 20 de 36\n2020, indica en el numeral 4, el ámbito geográfico aplicable a la obligación en este caso la SZH del \nAlto Vichada priorizando el área del Núcleo Tillavá, así como las actividades a desarrollar en el \nnumeral 9. Descripción de las líneas de inversión en donde se describe e indica que el proyecto \nconsiderará 5 etapas en el diseño e implementación como lo muestra la siguiente tabla y que son \ndescritas en detalle en el plan de inversión entregado y referenciadas también por la ANLA en el \nnumeral 5.7.2.2 Metodología página 11 del concepto técnico 7263 del 24 de noviembre de 2022. \n(Ver Tabla 2 en la página 30 del Concepto técnico 1003 del 09 de marzo de 2023)\n(...)\nAsí mismo en el concepto técnico 7263 del 24 de noviembre de 2022, numeral 5.7.2.4.1 se menciona \n(páginas 22-23) “Estas áreas se justificarán en función de su importancia ambiental y se aislarán una \nvez firmen el acuerdo de conservación. En el diseño predial definirán las áreas para la conservación \nen las cuales implementarán acciones para propender por la preservación, restauración, \nrehabilitación y áreas de importancia ambiental.\nDe igual forma, plantean que de manera global a escala de paisaje las áreas sujetas a las acciones \nde conservación y/o recuperación, implementadas serán mayores o en su defecto, iguales en \nextensión a las áreas intervenidas con el proyecto productivo sostenible.\nEn relación con el aislamiento de áreas de conservación, la Sociedad indica que dichas áreas serán \ncerradas para garantizar su permanencia y el restablecimiento de los servicios ecosistémicos que \nestas prestan. Sin embargo, la Sociedad deberá indicar el tipo de cerramiento a implementar y \nentregar evidencias de la instalación de este, de igual forma deberá presentar registro fotográfico del \nmantenimiento de dicho aislamiento.\nNo obstante lo anterior, la Sociedad no presentó información documental ni en el Modelo de \nAlmacenamiento Geográfico relacionada con las actividades a desarrollar ni con las áreas donde \nrealizarían las acciones de conservación y sus aislamientos como eje principal de la destinación de \nlos recursos en el marco de la obligación de la inversión forzosa de no menos del 1%, teniendo en \ncuenta que los proyectos de uso sostenible, como es el caso de los sistemas agroforestales y \nsilvopastoriles, deben cumplir con los objetivos definidos en la norma, que en este caso es la \nrecuperación, preservación, conservación y vigilancia de la cuenca hidrográfica que alimenta la \nrespectiva fuente hídrica, tal como se expone en el documento “Criterios de Usos Sostenibles Para \nla Formulación de Proyectos en el Marco del Manual de Compensaciones del Componente Biótico”, cuyo \ncampo de aplicación abarca la obligación de la inversión forzosa de no menos del 1%. Por ello, la Sociedad \ndeberá precisar dicha información para la correspondiente evaluación por parte de la ANLA…” (Negrita fuera \ndel texto original)\nDe acuerdo con lo anterior si bien la ANLA relaciona la información entregada por ECOPETROL S.A, \nen donde se precisa que se sigue un orden cronológico de actividades plasmadas en un cronograma \npara identificar áreas y ejecutar las acciones en función de su importancia ambiental, siguiendo los \ncriterios para seleccionar los predios establecidos en el numeral 9.1.2.1 del pan (sic) de inversión \nentregado, la ANLA solicita en el literal a), del numeral 2, artículo tercero de la Resolución 3012 del \n20 de diciembre de 2022, los criterios de selección del área propuesta, los cuales están discriminados \ny detallados en el plan entregado en las Tabla 8 Encuesta de selección de predios y participantes, \nTabla 9. Criterios Determinantes, Tabla 10. Puntajes criterios generales, Tabla 11. Puntajes \nParticipantes, Tabla 12. Puntajes datos generales del predio y Tabla 13. Estado de vías de acceso, \ncriterios que serán aplicados en la ejecución del plan según el cronograma de actividades planteado, \nsiendo así que no es coherente, el requerimiento establecido por la ANLA dado que la información \nsi fue presentada por lo tanto se solicita Revocar este requerimiento.\nDe acuerdo con lo anterior, en el plan de inversión numeral 9. Descripción de las líneas de inversión \nentregado mediante radicado 2020118588-1-000 del 24 de julio de 2020 y tabla 2 del presente oficio, \nse describe la metodología y acciones a implementar una vez se tengan las áreas donde se \nrealizarán las acciones de conservación por lo tanto no es claro y carece de argumento técnico el \nrequerimiento realizado en el literal c), del numeral 2, artículo tercero de la Resolución 3012 de 2022 \nrespecto al Método y/o estrategias de las acciones a implementar ya que en el concepto técnico \n7263 del 2022 no fue justificada su motivación dado que se enfoca, es en realizar el análisis de los \nproyectos de uso sostenible como acciones complementarias más no precisa las acciones \nprincipales de conservación por lo tanto se solicita su revocatoria.\nPor otro lado, es importante reiterar que una vez definidos los predios, se firmaran (sic) los acuerdos \nde conservación, siendo en el diseño predial participativo en el que precisaran (sic) las áreas a \nconservar y su posterior aislamiento por lo tanto no es acorde por parte de la ANLA que en esta \n\nResolución No.  00701           Del   10 de abril de 2023            Hoja No. 21 de 36\n“POR LA CUAL SE RESUELVE UN RECURSO DE REPOSICIÓN”\nOficinas: Carrera 13 A No. 34 – 72 Edificio 13 35 Pisos 8 al 11 Bogotá, D.C.\nCentro de Orientación y Radicación de Correspondencia: Carrera 13 A No. 34 – 72 Edificio 13 35 \nLocales 110 al 112 Bogotá, D.C.  \nCódigo Postal 110311156\nNit.: 900.467.239-2\nLínea de Orientación y Contacto Ciudadano: 57 (1) 2540100 / 018000112998 PBX: 57 (1) 2540111\nwww.anla.gov.co    Email: licencias@anla.gov.co  \nPágina 21 de 36\ninstancia de evaluación solicite a ECOPETROL S.A, la entrega de dicha información en 3 meses \ncuando según cronograma para llegar a esas áreas con su respectiva GDB, se debe surtir varias \nactividades previas que se describen más adelante, siendo imposible realizarlo además por que \ndichas actividades obedecen a la ejecución del plan de inversión que aún no ha sido aprobado por \nlo tanto si bien la ANLA, es operadora de la norma, está aumentando el alcance y detalle del plan de \ninversión forzosa de no menos del 1%, respecto a la ubicación de las áreas a conservar y las \nacciones a implementar, requiriendo información detallada en esta etapa sin ningún sustento \nnormativo.\nRespecto a los proyectos de uso sostenible, se aclara que son un incentivo en especie que se le da \nal propietario con el fin de liberar las áreas a conservar por lo tanto lo mencionado por la ANLA “… \ncomo es el caso de los sistemas agroforestales y silvopastoriles, deben cumplir con los objetivos definidos en \nla norma, que en este caso es la recuperación, preservación, conservación y vigilancia de la cuenca hidrográfica \nque alimenta la respectiva fuente hídrica, tal como se expone en el documento “Criterios de Usos \nSostenibles Para la Formulación de Proyectos en el Marco del Manual de Compensaciones del \nComponente Biótico”, cuyo campo de aplicación abarca la obligación de la inversión forzosa de no \nmenos del 1%...”, no es claro porque la ANLA en su análisis técnico trae a colación información de \ncompensaciones en este caso los criterios de usos sostenible para la formulación de proyectos en \nel marco del Manual de compensación bióticas, cuando la obligación de interés evaluada según \nnumeral 5.7 del concepto técnico 7263 del 24 de noviembre de 2022, obedece a la inversión forzosa \nde no menos del 1%, la cual tiene una motivación completamente diferente a la de compensación, \nen este caso la recuperación, conservación, preservación y vigilancia de la cuenca hidrográfica, en \nla cual se hizo uso del recurso hídrico y no la compensación del impacto generado por el desarrollo \ndel proyecto.\nEs de resaltar que para la ejecución de las obligaciones de inversión forzosa, ECOPETROL S.A., \nestableció como estrategia la definición de núcleos o áreas de trabajo dentro de las subzonas \nhidrográficas donde la compañía tiene operaciones y proyectos de exploración, producción, \ntransporte y refinación, como también, la priorización de áreas a escala de paisaje al interior de \ndichos núcleos con base en la definición de la estructura ecológica principal del territorio y el análisis \nde aspectos físicos, bióticos y sociales, de esta forma, se realiza la priorización de áreas en donde \nse enfocará la selección de predios y participantes para implementar las acciones de conservación.\nA partir de esta estrategia, se diseñó un procedimiento para la selección de predios y participantes \nen las áreas priorizadas, estableciendo criterios que permiten identificar en el territorio las áreas con \nmayor potencial para la ejecución de la inversión forzosa de no menos del 1%, y en el cual se \nconsideran las siguientes actividades:\n• Socialización del proyecto\n• Visitas y encuestas de diagnóstico\n• Análisis jurídico de tenencia del predio\n• Suscripción de acuerdo de conservación\n• Diseño predial concertado\n• Caracterización físico-biótica de las áreas de interés\n• Línea base de indicadores\nSin embargo, para poder adelantar el procedimiento anteriormente mencionado es necesario contar \ncon la aprobación del plan de inversión por parte de la Autoridad Ambiental, ya que de acuerdo con \nlas experiencias que tiene ECOPETROL S.A., frente a las obligaciones de inversión forzosa que se \ntienen actualmente en ejecución mediante esta misma estrategia, el realizar el proceso de selección \nde predios y participantes como parte de la implementación del plan, permite un proceso continuo, \neficiente y con grado de confianza con los participantes, así como en las poblaciones del área de \ninfluencia del proyecto, cuando es socializado el estado de la obligación, así como también cuando \nse tiene el plan aprobado existe seguridad para la ejecución de las actividades.\nProducto de lo antes señalado, se reduce la posibilidad de que se dé una pérdida de interés por \nparte de los posibles participantes (propietarios de los predios) dada la incertidumbre en sí, se \nejecutarán las acciones de conservación ya que no existe un respaldo que lo soporte. Adicionalmente, \nrespecto a temas administrativos internos sin contar con el plan de inversión aprobado existe riesgo \njurídico para ejecutar actividades que no han sido aprobadas, generando que se reinicien los \nprocesos y/o se genere un detrimento patrimonial por los recursos invertidos que finalmente no \ncontribuirán a preservar y conservar la cuenca hidrográfica en la que se captó agua.\nDe acuerdo a lo expuesto anteriormente, ECOPETROL S.A, considera que la solicitud efectuada en \nel numeral 1 (literales a), b), c), d), e), f), g), h), i), j) y numeral 2 (literales a), b), c), d), e), f) del \nartículo tercero de la Resolución 03012 del 20 de diciembre de 2022, en cuanto a presentar para \n\nResolución No.  00701           Del   10 de abril de 2023            Hoja No. 22 de 36\n“POR LA CUAL SE RESUELVE UN RECURSO DE REPOSICIÓN”\nOficinas: Carrera 13 A No. 34 – 72 Edificio 13 35 Pisos 8 al 11 Bogotá, D.C.\nCentro de Orientación y Radicación de Correspondencia: Carrera 13 A No. 34 – 72 Edificio 13 35 \nLocales 110 al 112 Bogotá, D.C.  \nCódigo Postal 110311156\nNit.: 900.467.239-2\nLínea de Orientación y Contacto Ciudadano: 57 (1) 2540100 / 018000112998 PBX: 57 (1) 2540111\nwww.anla.gov.co    Email: licencias@anla.gov.co  \nPágina 22 de 36\nevaluación en un término máximo de tres (3) meses, contados a partir de la ejecutoria de la \nResolución 3012 de 2022, información complementaria, para pronunciarse acerca de la viabilidad \ndel ajuste del Plan de inversión forzosa de no menos del 1%, genera una obligación imposible de \ncumplir impuesta a ECOPETROL S.A., teniendo lo antes señalado y lo siguiente:\n1. Con la información solicitada por la ANLA a ECOPETROL S.A, se requiere realizar un despliegue \ndel proceso de selección de predios y participantes y posterior firma del acuerdo de conservación \ncomo es solicitado en el literal e), del numeral segundo del artículo tercero en el corto plazo (3 meses) \ny demás actividades del artículo 2 y 3 de la resolución en comento, en una fase preliminar a la \naprobación del plan de inversión, sobre meras expectativas. Las cuales puede derivar (sic) en un \ndetrimento patrimonial teniendo en cuenta que los predios específicos donde se realizará la inversión \nse definirán una vez se surtan las actividades previas de la etapa preoperativa-planeación, la cual \nsegún cronograma de actividades contempla 1 año, para dar paso a la actividad de identificación y \nselección de predios y participantes en el año 2 (Ver tabla 3).\n2. Generación de meras expectativas con los participantes de los acuerdos de conservación, frente \na acciones propuestas que en esta instancia aún no cuentan con aprobación por parte de esta \nAutoridad, lo cual traería consigo una potencial perdida en la credibilidad de la Empresa frente a las \npropuestas presentadas en la etapa inicial de selección de los participantes.\nLo anterior teniendo en cuenta que no se pueden firmar acuerdos de conservación ya que el plan de \ninversión no ha sido aprobado por la ANLA y sin él, mismo no se podría saber el área finalmente a \nconservar, así como tampoco acotar el alcance, objetivos, localización de las actividades propuestas \ny los límites del proyecto, metas e indicadores, cronograma, plan operativo y de inversiones, Plan de \nmonitoreo, seguimiento y evaluación, así como su ubicación geográfica y descripción de los posibles \nfactores de disturbio (causa, magnitud, intensidad y severidad), ya que estas, dependen de la \nidentificación de áreas, selección de predios y participantes, caracterización físico biótica de las \náreas finalmente seleccionadas que permita tener elementos de juicio para proponer indicadores y \ndemás información antes mencionada de acuerdo con las resultados (sic) obtenidos de las \ncondiciones físico bióticas, así como también la identificación de los factores de disturbios junto con \nsu respectiva evaluación de las 4 variables requeridas por la ANLA (causa, magnitud, intensidad y \nseveridad) de las áreas a conservar, por ello el plan presentado mediante radicado 2020118588-1-\n000 del 24 de julio de 2020, se trabajó en el ámbito geográfico aplicable ZSH Alto Vichada y \npriorizando el área del núcleo del Tillavá con la información lo más acotada posible para la instancia \nen la que se encuentra en este caso planeación y formulación del plan. De tal manera que una vez \nsea aprobado el plan, poder iniciar la ejecución de acuerdo con el cronograma planteado, de allí la \nimportancia del mismo.\n3. Riesgo de un potencial desistimiento del participante del acuerdo de conservación, teniendo en \ncuenta los tiempos que conlleva las etapas de evaluación y aprobación a cargo de la Autoridad \nAmbiental; como también la posterior gestión precontractual del vehículo comercial, es decir el \ncontrato a gestionar para la ejecución del plan de inversión a cargo de la empresa.\nLo anterior, considerando la dinámica de la actividad productiva que tiene el participante y basado \nen que el acuerdo de conservación tiene como principio la voluntad de este, su interés de participar \npuede verse alterado con el tiempo y declinar en su decisión inicial de participar. Lo cual genera \nreprocesos al interior de la empresa ocasionando un detrimento patrimonial; así como la transgresión \ndel principio de planeación y economía.\n4.Alteración en las etapas definidas en el cronograma propuesto por ECOPETROL S.A, en el plan \nde inversión, el cual tiene como origen los aspectos administrativos y técnicos, en la etapa \npreoperativa -planeación, así como también lo establecido internamente para desarrollar la actividad. \nQue para el caso particular tal como se evidencia en el cronograma entregado mediante radicado \n20201185881-000 del 24 de julio de 2020 (Ver tabla 3), las áreas donde se realizarán las acciones \nde conservación solicitadas por la ANLA, solo se tendrán cuando se suscriba el acuerdo de \nconservación contemplado a realizarse una vez se surtan las actividades previas descritas en el plan \nde inversión en el numeral 9.1 Selección y elaboración del contrato para la ejecución de las \nobligaciones, revisión de instrumentos de planificación, selección del paisaje, diseño especifico de \nlas áreas priorizadas a escala de paisaje que permitirán identificar los predios y participantes, \naplicación de los criterios para seleccionar las áreas establecido en el numeral 9.1.2.1 del plan de \ninversión entregado, así como también el estudio de títulos de las áreas potenciales que comprende \nla respuesta por parte de la URT y ANT, es decir se necesitará del tiempo estipulado en el \ncronograma y solo será en el primer y segundo trimestre del año 2 que se tendrán las áreas donde \nse realizarán las acciones de conservación y con la misma se podrá acotar la información requerida \nen los literales a), b), c), d, e), f), g), h), i), j), del numeral 1 y literales b), d), e) y f), del numeral 2 del \nartículo tercero de la Resolución objeto del presente recurso, por lo tanto la ANLA no puede \n\nResolución No.  00701           Del   10 de abril de 2023            Hoja No. 23 de 36\n“POR LA CUAL SE RESUELVE UN RECURSO DE REPOSICIÓN”\nOficinas: Carrera 13 A No. 34 – 72 Edificio 13 35 Pisos 8 al 11 Bogotá, D.C.\nCentro de Orientación y Radicación de Correspondencia: Carrera 13 A No. 34 – 72 Edificio 13 35 \nLocales 110 al 112 Bogotá, D.C.  \nCódigo Postal 110311156\nNit.: 900.467.239-2\nLínea de Orientación y Contacto Ciudadano: 57 (1) 2540100 / 018000112998 PBX: 57 (1) 2540111\nwww.anla.gov.co    Email: licencias@anla.gov.co  \nPágina 23 de 36\ndesconocer las actividades contempladas en el cronograma entregado en virtud de una planificación \npara lograr los objetivos propuestos, el cumplimiento de la obligación y su ejecución, imponiendo tres \n(3) meses para la entrega de la misma, la cual está limitada a las áreas donde se realizarán la \nconservación y a las acciones a implementar, ya que hasta que no se conozca las condiciones físico \nbióticas por medio del diagnóstico socio ambiental, no se puede tener certeza de las acciones que \nserían las más adecuadas a ejecutar en las áreas a seleccionar, las cuales es imposible tenerlas en \ndicho tiempo, de acuerdo con lo antes expuesto.\n(Ver Tabla 3 en la página 36 del Concepto técnico 1003 del 09 de marzo de 2023)\n(...)\nRespecto a lo requerido en el literal b), numeral 2, artículo tercero de la resolución Ibidem, \n“Diagnóstico socioambiental del área de interés (biofísicos, identificación y cuantificación de la \ncobertura vegetal (inventario de especies de flora y/o fauna, registro fotográfico)”, tal cual como lo \nestablece el plan de inversión en el numeral 9.1.3 la actividad de línea base propuesta solo se hará \nen la etapa operativa-planeación, es decir en la ejecución del plan y como ha sido mencionado, en \nla actualidad se está en la planeación y aprobación del mismo, etapa que se realizará en el segundo \ntrimestre del año 2 de acuerdo con el cronograma del plan de inversión entregado, el cual está \nincluido en la actividad “Definición del diseño de siembra, métodos obtención de insumos, \ndelimitación de áreas”, por lo tanto sumado a los anteriores argumentos respecto a las actividades \nprevias (numerales 1, 2, 3, 4), esta actividad es imposible de realizar en los tres (3) meses \nestablecidos por la ANLA en el artículo tercero de la resolución objeto el presente recurso.\nDe acuerdo con lo expuesto, es claro señalar que se está quebrantando este principio de “NADIE \nESTA OBLIGADO A LO IMPOSIBLE” con la emisión de la condición de la temporalidad del artículo \ntercero de la Resolución 3012 del 20 de diciembre de 2022 y el no pronunciamiento respecto a la \naprobación de las líneas generales de destinación, ámbito geográfico y del plan de inversión forzosa \nde no menos del 1%, radicado mediante número 2020118588-1-000 del 24 de julio de 2020.\nPor otro lado, la ANLA señala en el concepto técnico 7263 del 24 de noviembre de 2022, página 14, \nsubtitulo Mantenimiento y Monitoreo lo siguiente:\n“Referente a las actividades descritas con anterioridad, esta Autoridad señala que en caso de ser \nnecesario la implementación de fertilización, esta debe realizarse sólo con productos orgánicos y \nque la implementación de esta etapa deberá prolongarse por un período mínimo de cinco (5) años, \nlapso mínimo requerido para que el cacao empieza a dar frutos.” (…)\nAl respecto, relacionado con la utilización de bioinsumos o productos orgánicos, cabe resaltar que el \nmanejo de los arreglos agroforestales se hará teniendo en cuenta todas las practicas \nconservacionistas que causen los menores impactos. La fertilización y control de plagas y \nenfermedades se realizarán bajo un estricto seguimiento y de acuerdo con los requerimientos que \nse presenten durante el proceso de establecimiento, desarrollo y producción, de acuerdo con las \nrecomendaciones realizadas en las medidas de manejo propuestas en la guía ambiental para el \ncultivo de cacao del Ministerio de Agricultura y Desarrollo Rural y la Federación Nacional de \nCacaoteros, se aplicarán las siguientes practicas:\n<0000>\nCapacitación a los agricultores y operarios en el uso seguro y adecuado de agroquímicos en \nla cual se orientará a evaluar las aplicaciones, a medir la residualidad, a usar las dosis \nadecuadas, aplicar el manejo integrado de plagas y enfermedades.\n<0000>\nRacionalizar el uso de fertilizantes químicos apoyados en un análisis de suelo y usando \nfuentes de nutrientes con un bajo potencial de contaminación.\n<0000>\nUtilización de abonos orgánicos como lombricompost, humus, compost, bocachi, etc.\nIgualmente, basados en los análisis de suelos y de acuerdo con el estado de desarrollo en los que \nse requiera complementos nutricionales para el cultivo, se acudirá a complementar el abonamiento \ncon el uso racional de elementos químicos que garanticen una producción óptima para el productor.\nDe esta manera el proyecto agroforestal prevé el uso de insumos orgánicos e inorgánicos con el \npropósito de garantizar el éxito en el crecimiento y establecimiento, tanto en los árboles de cacao \ncomo en los árboles nativos de porte forestal del arreglo agroforestal, el cual podría ser con \nbioinsumos o agroquímicos, pero no exclusivamente con bioinsumos.\n\nResolución No.  00701           Del   10 de abril de 2023            Hoja No. 24 de 36\n“POR LA CUAL SE RESUELVE UN RECURSO DE REPOSICIÓN”\nOficinas: Carrera 13 A No. 34 – 72 Edificio 13 35 Pisos 8 al 11 Bogotá, D.C.\nCentro de Orientación y Radicación de Correspondencia: Carrera 13 A No. 34 – 72 Edificio 13 35 \nLocales 110 al 112 Bogotá, D.C.  \nCódigo Postal 110311156\nNit.: 900.467.239-2\nLínea de Orientación y Contacto Ciudadano: 57 (1) 2540100 / 018000112998 PBX: 57 (1) 2540111\nwww.anla.gov.co    Email: licencias@anla.gov.co  \nPágina 24 de 36\nEn consideración con lo anterior, desde el punto de vista técnico no es viable plantar la \nimplementación del proyecto con el uso de bioinsumos como única alternativa posible para tener en \ncuenta para los procesos de fertilización, control fitosanitario y los demás requeridos para asegurar \nla correcta implementación y el mantenimiento del sistema agroforestal con cacao, el cual debe \nfuncionar como un sistema.\nEs de mencionar que, ECOPETROL S.A, ejecutará las actividades priorizando el uso de bioinsumos, \npero en los casos en los que por excepción resulte necesario la aplicación de un producto \nagroquímico lo aplicará teniendo en cuenta los lineamientos de la guía ambiental para el cultivo de \ncacao del Ministerio de Agricultura y Desarrollo Rural y la Federación Nacional de Cacaoteros; sin \nembargo, es necesario que la Autoridad permita el uso de esos elementos con la finalidad de \ngarantizar el establecimiento de las plantaciones.\nPor lo anterior, ECOPETROL S.A, solicita a la ANLA revisar la consideración realizada en el concepto \ntécnico 7263 del 24 de noviembre de 2022, página 14, subtitulo Mantenimiento y Monitoreo en el \nsentido de, aprobar el uso de componente para la fertilización y demás actividades del proceso, el \nuso de agroquímicos para las actividades que así lo demanden, durante la siembra y el \nmantenimiento del sistema agroforestal propuesto, de conformidad con los lineamientos dados por \nel Ministerio de Agricultura y Desarrollo Rural y la Federación Nacional de Cacaoteros.\nRespecto a lo mencionado por la ANLA “…y que la implementación de esta etapa deberá prolongarse \npor un período mínimo de cinco (5) años, lapso mínimo requerido para que el cacao empieza a dar \nfrutos” (Pág. 14 concepto técnico 7263 del 24 de noviembre de 2022), se resalta que, en la \nconcepción moderna, el cacao puede ser manejado como un sistema agroforestal, en el que se \naprovecha eficientemente el suelo, se obtienen buenos rendimientos económicos, sin afectar \nnegativamente el ambiente, y se pueden manejar en el espacio y tiempo, especies de ciclo corto, \nmediano y largo. Las especies de ciclo medio conforman el sombrío transitorio (para este caso el \nplátano) y las de largo plazo (p.ej. especies arbóreas), el cultivo definitivo. Todas ellas cumplen una \nfunción en la generación de ingresos al productor y en la sostenibilidad del cultivo.\nDe acuerdo con FEDECACAO (2015), para el establecimiento de los sistemas agroforestales con \ncacao, se requiere de sombrío temporal y para ello se utilizan especies de rápido crecimiento, en \neste caso, el plátano, que inicia producción entre los 12 y 15 meses de establecido, ofreciendo \ningresos al productor. El cultivo de cacao logra un flujo de caja positivo para el productor a partir del \ncuarto año.\nDe forma complementaria, las etapas básicas para garantizar plantaciones de alto rendimiento \ncomprenden (ver Figura 1): a) etapa 1, la ubicación en el terreno y el manejo de todas las especies \ndel sistema, de manera escalonada; b) etapa 2, el manejo desde la instalación del cultivo hasta que \ninicia su producción; y c) etapa 3, el sostenimiento de la plantación en su fase productiva.\nSegún FEDECACAO (2015) entidad que consideramos con experiencia y competencia para indicar \nque, la producción de frutos de cacao empieza en el año 3 y la cosecha de plátano en el año 1, lo \nque confirma que el sistema agroforestal genera rentabilidad durante la segunda etapa del \nestablecimiento del sistema agroforestal y en el periodo de intervención.\nRespecto a las especies forestales es importante resaltar que éstas serán las que proveerán el \nsombrío permanente a los árboles de Cacao. El sistema agroforestal está diseñado para que, en el \naño 4, se de la transición entre plátano – especies forestales en cuanto a sombrío, reduciendo la \ncompetencia por luz y nutrientes entre las especies forestales y el plátano garantizando, el \nestablecimiento de estas especies.\nEste cambio se genera una vez finalizado el ciclo productivo del plátano que se da después de haber \nrealizado el tercer mantenimiento correspondiente al año 4. Todo esto previsto dentro del periodo de \nintervención del proyecto (1 año establecimiento, 3 años de mantenimiento).\n(Ver Figura 1 en la página 39 del Concepto técnico 1003 del 09 de marzo de 2023)\n(...)\nA continuación, se relacionan los rendimientos productivos esperados del sistema agroforestal de \ncacao (ver tabla 4) que evidencian la productividad del sistema en el periodo de intervención del \nproyecto. En este punto de desarrollo del proyecto, es importante recordar que los mantenimientos \nsuministrados por ECOPETROL S.A, finalizarán en el año 4. Los futuros mantenimientos estarán a \ncargo del propietario del predio, conforme a los acuerdos de conservación que se suscriban.\n\nResolución No.  00701           Del   10 de abril de 2023            Hoja No. 25 de 36\n“POR LA CUAL SE RESUELVE UN RECURSO DE REPOSICIÓN”\nOficinas: Carrera 13 A No. 34 – 72 Edificio 13 35 Pisos 8 al 11 Bogotá, D.C.\nCentro de Orientación y Radicación de Correspondencia: Carrera 13 A No. 34 – 72 Edificio 13 35 \nLocales 110 al 112 Bogotá, D.C.  \nCódigo Postal 110311156\nNit.: 900.467.239-2\nLínea de Orientación y Contacto Ciudadano: 57 (1) 2540100 / 018000112998 PBX: 57 (1) 2540111\nwww.anla.gov.co    Email: licencias@anla.gov.co  \nPágina 25 de 36\n(Ver Tabla 4 en la página 40 del Concepto técnico 1003 del 09 de marzo de 2023)\n(...)\nEn consideración con lo anterior, se propone que los mantenimientos para los arreglos agroforestales \ncon cacao se realicen durante los primeros tres años de establecidos, pues los beneficiarios del \nproyecto pueden asumir los costos de los mantenimientos posteriores a través de los ingresos \nobtenidos con la producción del plátano y a partir del cuarto año con los ingresos obtenidos por el \nmismo cultivo de cacao, en el marco que se trata de un proyecto productivo sostenible”.\nAsí las cosas, ECOPETROL S.A, solicita a la ANLA revisar la consideración realizada en el concepto \ntécnico 7263 del 24 de noviembre de 2022, página 14, subtitulo Mantenimiento y Monitoreo en el \nsentido que, se apruebe un periodo de mantenimiento de los arreglos agroforestales durante los (3) \ntres años iniciales a partir del establecimiento.\nRespecto a lo mencionado por la ANLA, en el concepto técnico 7263 del 24 de noviembre de 2022, \npágina 18 y 26 “Teniendo en cuenta el contexto en el cual se plantea la ejecución de esta actividad, la cual \nestá asociada a compensación biótica por la intervención de ecosistemas naturales y seminaturales, las \nespecies a emplear deben ser nativas y de la región, las cuales a su vez proveen servicios ecosistémicos para \nla fauna local, por lo cual el Titular de la licencia ambiental deberá omitir la especie Cordia alliodora; y bajo \nningún argumento podrán ser incluidas especies foráneas y/o introducidas en el desarrollo de las actividades \nrelacionadas con compensaciones bióticas.” (Negrita fuera del texto original), ECOPETROL S.A, \nexcluirá del plan de inversión forzosa de no menos del 1%, la especie forestal Cordia alliodora de los \nsistemas agroforestales y silvopastoriles, no obstante, aclara que la información mencionada por la \nANLA hace alusión a compensación biótica cuando la obligación evaluada en el numeral 5.7.2.4 \nobedece a la inversión forzosa de no menos del 1%, lo anterior para fines pertinentes.\nDe la misma manera ECOPETROL S.A, se permite informar a la ANLA que el radicado 2020005006-\n1-000 del 15 de enero del 2020, según fuente de la tabla 3 (Pág. 18) del concepto técnico 7263 del \n24 de noviembre de 2022, numeral 5.7.2.4.1 Sistema Agroforestal de Cacao, no hace parte del \nproyecto de Campo de Producción Cumanday radicado 2020118588-1-000 del 24 de julio de 2020 \nobjeto de evaluación.\n(Ver Tabla 3 en la página 41 del Concepto técnico 1003 del 09 de marzo de 2023)\n(...)”\n1.6. Consideraciones de la Autoridad Nacional\nLos argumentos de inconformidad presentados por el recurrente fueron objeto de \nevaluación por el equipo técnico de la Autoridad Nacional y mediante Concepto técnico \n1003 del 09 de marzo de 2023, se presentaron las siguientes consideraciones:\n“Frente a lo manifestado por la Sociedad y teniendo en cuenta los argumentos presentados para \nREPONER el Artículo Tercero de la Resolución 3012 del 20 de diciembre de 2022 en el sentido de \nAPROBAR el plan de inversión forzosa de no menos del 1%, se aclara, conforme a la revisión \ndocumental realizada y que reposa en el Sistema de Información de Licencias Ambientales –SILA, \nlo siguiente: \nEn el seguimiento realizado en el año 2020, esta Autoridad presentó las consideraciones realizadas \na la propuesta de inversión, en el Concepto Técnico 7956 del 30 de diciembre de 2020 y acogido por \nel Auto 0263 del 29 de enero de 2021, esta Autoridad validó la información presentada por la \nSociedad mediante radicado 2020118588-1-000 del 24 de julio del 2020 dentro de dicho seguimiento, \ntal y como se cita a continuación: \n“(…)\nDe acuerdo a lo anterior el Equipo de seguimiento ambiental considera viable aprobar las líneas \ngenerales de inversión de no menos del 1%, presentadas por la empresa mediante radicado \n2020118588-1-000 del 24 de julio del 2020.\na)\nApoyo financiero a la formulación del Plan de Ordenamiento de la Cuenca del Río Planas, siempre \ny cuando CORMACARENA asegure, con otras fuentes de recursos, el financiamiento total de \neste instrumento.\nb)\nAcciones de protección, conservación y preservación a través restauración ecológica, \nrehabilitación y recuperación, dentro las cuales se puede incluir desarrollo de proyectos de uso \n\nResolución No.  00701           Del   10 de abril de 2023            Hoja No. 26 de 36\n“POR LA CUAL SE RESUELVE UN RECURSO DE REPOSICIÓN”\nOficinas: Carrera 13 A No. 34 – 72 Edificio 13 35 Pisos 8 al 11 Bogotá, D.C.\nCentro de Orientación y Radicación de Correspondencia: Carrera 13 A No. 34 – 72 Edificio 13 35 \nLocales 110 al 112 Bogotá, D.C.  \nCódigo Postal 110311156\nNit.: 900.467.239-2\nLínea de Orientación y Contacto Ciudadano: 57 (1) 2540100 / 018000112998 PBX: 57 (1) 2540111\nwww.anla.gov.co    Email: licencias@anla.gov.co  \nPágina 26 de 36\nsostenible, orientado al impulso de actividades productivas sostenibles a través de buenas \nprácticas de producción. Donde el componente ambiental y de conservación se le adjudica la \nmayor proporción en relación con las demás actividades productivas planteadas.”\nNo obstante lo anterior, y si bien, se realizaron consideraciones, es importante resaltar que en el \nConcepto Técnico 7956 del 30 de diciembre de 2020 y acogido por el Auto 0263 del 29 de enero de \n2021, esta Autoridad, presentó dentro de sus consideraciones la aceptación de las líneas de \ninversión propuestas por la Sociedad, sin embargo, en dicho seguimiento no se realizó \npronunciamiento respecto a aprobación de proyectos y/o programas a desarrollar. Teniendo en \ncuenta esto, no quedó establecido en el Dispone, la aceptación de las líneas de inversión propuestas \npor la Sociedad, así como lo expresa la Sociedad en su argumento, como se cita a continuación:\n“(…)\nLo anterior pese a que se consideró el cumplimiento de la obligación por parte de la ANLA en el concepto \ntécnico 7956 del 30 de diciembre de 2020 (Pág. 119) y Auto 263 de 2021, no se tiene pronunciamiento \nde manera explícita mediante acto administrativo de la aprobación de las líneas generales de \ninversión y el ámbito geográfico donde se debe realizar la inversión de acuerdo con lo dispuesto en el \nnumeral 2.2.9.3.1.5 del Decreto 2099 de 2016, compilado en el Decreto 1076 de 2015.(…)” (Negrilla \nfuera de texto original)\nAhora bien, teniendo en cuenta que la propuesta remitida por la Sociedad, no contó con un \npronunciamiento de fondo respecto a la viabilidad de la propuesta, esta Autoridad  incluyó la \ninformación del radicado 2020118588-1-000 del 24 de julio de 2020 en el seguimiento realizado en \nel año 2022, mediante el Concepto Técnico 7263 del 24 de noviembre de 2022, y acogido por la \nResolución 3012 del 20 de diciembre de 2022, sin embargo, al no contar con la totalidad de insumos \npara realizar un pronunciamiento de fondo, esta Autoridad solicitó la presentación de información \nadicional, de manera tal que se garantice que se puede evaluar la información con la información \n(sic) necesaria para tal fin, razón por la cual, se solicitó en el Artículo Tercero de la Resolución \nanteriormente mencionada, el ajuste de plan de inversión, “(…) en el sentido de incluir información técnica \nrelacionada con las actividades a desarrollar y con las áreas donde se realizarán las acciones de conservación \ny sus aislamientos como eje principal de la destinación de los recursos en el marco de la obligación de la \ninversión forzosa de no menos del 1%.(…)”\nTeniendo en cuenta lo anterior, esta Autoridad hace claridad que no significa que se desconozca la \nviabilidad de las líneas de inversión presentadas por la Sociedad, sin embargo, se reitera que, el \npronunciamiento que realice esta Autoridad sobre su aceptación o negación se realizará una vez la \nSociedad remita la información requerida en el Artículo Tercero de la Resolución 3012 del 20 de \ndiciembre de 2022.  \nAhora bien, y conforme al argumento presentado por la Sociedad en la página 20 y citando \ntextualmente: \n“(…)\nPor lo anterior, una vez revisado el pronunciamiento de la Autoridad Nacional de Licencias Ambientales-\nANLA, se evidencia que transgrede el principio de “Nadie está obligado a lo imposible”, pues al momento \nde evaluar el plan de inversión forzosa de no menos del 1% radicado mediante número 2020118588-1-\n000 del 24 de julio de 2022, el cual contiene la información requerida según el Artículo Trigésimo de la \nResolución 0001 de 2019, la ANLA obliga y limita a ECOPETROL S.A, al solicitar las acciones a \ndesarrollar y las áreas donde se realizarán las acciones de conservación, pese a que la información fue \nentregada en el plan de inversión en comento no con el detalle especifico que requiere la ANLA, el cual \ncarece de justificación o sustento jurídico que requiera dicho detalle para un proyecto que si bien a la \nfecha no se ha activado la obligación por el no uso de agua de fuente natural autorizada en la licencia \nambiental, no es la instancia para solicitarlo según el Artículo 2.2.9.3.1.8 del Decreto 2099 de 2016. \nEn línea con lo anterior, la norma que regula la inversión forzosa de no menos del 1%, no precisa y \nrequiere información detallada o una escala determinada de las áreas donde se ejecutará la inversión \npor lo tanto el plan de inversión entregado mediante radicado 2020118588-1-000 del 24 de julio de 2020, \nindica en el numeral 4, el ámbito geográfico aplicable a la obligación en este caso la SZH del Alto Vichada \npriorizando el área del Núcleo Tillavá, así como las actividades a desarrollar en el numeral 9. Descripción \nde las líneas de inversión en donde se describe e indica que el proyecto considerará 5 etapas en el \ndiseño e implementación como lo muestra la siguiente tabla y que son descritas en detalle en el plan de \ninversión entregado y referenciadas también por la ANLA en el numeral 5.7.2.2 Metodología página 11 \ndel concepto técnico 7263 del 24 de noviembre de 2022.”\nTeniendo en cuenta lo anterior, esta Autoridad considera que la información requerida no se \nconsidera imposible de presentar, toda vez que se requiere el ajuste del plan ya presentado, \nincluyendo las áreas específicas en donde se plantearían realizar las acciones propuestas para la \n\nResolución No.  00701           Del   10 de abril de 2023            Hoja No. 27 de 36\n“POR LA CUAL SE RESUELVE UN RECURSO DE REPOSICIÓN”\nOficinas: Carrera 13 A No. 34 – 72 Edificio 13 35 Pisos 8 al 11 Bogotá, D.C.\nCentro de Orientación y Radicación de Correspondencia: Carrera 13 A No. 34 – 72 Edificio 13 35 \nLocales 110 al 112 Bogotá, D.C.  \nCódigo Postal 110311156\nNit.: 900.467.239-2\nLínea de Orientación y Contacto Ciudadano: 57 (1) 2540100 / 018000112998 PBX: 57 (1) 2540111\nwww.anla.gov.co    Email: licencias@anla.gov.co  \nPágina 27 de 36\nSociedad, toda vez que, para esta Autoridad es fundamental determinar el estado actual de dichas \náreas, y así determinar la viabilidad de las acciones que la Sociedad plantea implementar por lo que \nse considera que es información base para un pronunciamiento, esto de manera adicional al \ncumplimiento del ámbito geográfico. \nAhora bien, una vez verificada la información remitida por la Sociedad mediante radicado \n2020118588-1-000 del 24 de julio de 2020, especialmente el documento denominado “Anexo 2. \nAJUSTE AL PLAN DE INVERSIÓN FORZOSA DE NO MENOS DEL 1% DEL PROYECTO CAMPO \nDE PRODUCCIÓN CUMANDAY – CUMPLIMIENTO DE LA RESOLUCIÓN 00001 DEL 2 DE ENERO \nDE 2019”, en el cual la Sociedad indicó en el numeral 8.2 Definición del Núcleo, lo siguiente: \n“Para el caso del Campo de Producción Cumanday se pretende realizar la inversión forzosa de no menos \ndel 1% bajo la línea de inversión en “Acciones de protección, conservación y preservación a través \nrestauración ecológica, rehabilitación y recuperación, (Subrayado fuera de texto original), dentro las \ncuales se puede incluir desarrollo de proyectos de uso sostenible” en el núcleo Tillavá, el cual se \nencuentra dentro de la zona hidrográfica del Alto Vichada. \nPara el Campo de Producción Cumanday se pretende realizar la inversión forzosa de no menos del 1% \nbajo la línea de inversión “Acciones de protección, conservación y preservación a través restauración \necológica, rehabilitación y recuperación, dentro las cuales se puede incluir desarrollo de proyectos de \nuso sostenible, la cual se ejecutará por medio de acuerdos de conservación” en el núcleo Tillavá, el cual \nse encuentra dentro de la zona hidrográfica del Alto Vichada. La ubicación del núcleo se muestra en la \nFigura 8. Es importante mencionar que de acuerdo con el POMCA del río Tillavá acogido por parte de \nCormacarena mediante la Resolución PS-GJ.1.2.6.19.0141 del 21 de febrero de 2019, Ecopetrol hizo un \najuste del núcleo teniendo en cuenta las zonas priorizadas de intervención y la hidrografía de dicha \ncuenca ordenada.\n(Ver Figura 8 en la página 45 del Concepto técnico 1003 del 09 de marzo de 2023)\n(...)\nEs así que, se evidencia que la Sociedad propone desarrollar la línea de inversión de “Acciones de \nprotección, conservación y  preservación a través de restauración ecológica, rehabilitación y recuperación \ndentro de las cuales se puede incluir desarrollo de proyectos de uso sostenible”, en área localizada en la \nsubzona hidrológica Alto Vichada, en el municipio de Puerto Gaitán del departamento del Meta, para \nlo cual se daría cumplimiento al ámbito geográfico establecido para el proyecto Campo de \nProducción Cumanday, sin embargo, es fundamental para esta Autoridad que la Sociedad indique \nde manera más detallada las áreas específicas en las cuales desarrollará la línea de inversión \nanteriormente mencionada, toda vez que esta Autoridad requiere de todos los insumos para \ndeterminar la viabilidad de las acciones que se propongan en las áreas, para así lograr el éxito del \nproyecto, en el sentido de restaurar, rehabilitar y/o recuperar zonas que presenten zonas \ndesprovistas de vegetación, o que las coberturas presentes se han afectado de manera significativa, \nrazón por la cual esta Autoridad presentó las siguientes consideraciones en el Concepto Técnico \n7263 del 24 de noviembre de 2022, y el cual fue acogido por la Resolución 3012 del 20 de diciembre \nde 2022, así: \n“(…)\nLa Sociedad remitirá a esta Autoridad en los Informes de Cumplimiento Ambiental la información sobre \nla caracterización físico-biótica de los predios seleccionados, realizando la evaluación del estado actual \ndel ecosistema y conservación incluyendo tipos de cobertura, caracterización de especies, áreas de \nimportancia ambiental dentro del predio, generando de esta manera la información de soporte técnico \npara la selección de este. (subrayado fuera de texto original) \nLa Sociedad solicita poder invertir hasta un 10% del valor total de la actividad en la realización de los \nestudios y/o diseños dentro de las líneas de inversión establecidas, tal como lo establece el parágrafo 4 \ndel artículo 2.2.9.3.1.9, Título 9, Parte 2, Libro 2, Capítulo 3 del Decreto número 1076 de 2015 modificado \npor el artículo primero del Decreto 2099 del 22 de diciembre de 2016.\nDe igual forma enviará la localización de los predios y áreas donde implementarán los proyectos \nproductivos sostenibles del plan de inversión forzosa de no menos del 1% para el Campo de \nProducción Cumanday y el respectivo Modelo de Almacenamiento Geográfico, teniendo en cuenta \nlos términos y condiciones establecidos en la Resolución 2182 del 23 de diciembre de 2016, o la que la \nmodifique o sustituya, indicando el área destinada dentro del predio a cada una de las actividades \npropuestas, es decir, diferenciando las zonas de conservación y las áreas donde implementarán \nlos proyectos de uso sostenible. (negrilla fuera de texto original) \nEs oportuno mencionar que, para cada uno de los predios, la Sociedad deberá definir el objetivo de \nconservación, preservación y/o protección y suministrar los documento(s) suscrito(s) por el(los) \npropietario(s) en el cual autorice dichas actividades y se comprometa a garantizar el mantenimiento \nacorde con el modelo presentado. (…)”\n\nResolución No.  00701           Del   10 de abril de 2023            Hoja No. 28 de 36\n“POR LA CUAL SE RESUELVE UN RECURSO DE REPOSICIÓN”\nOficinas: Carrera 13 A No. 34 – 72 Edificio 13 35 Pisos 8 al 11 Bogotá, D.C.\nCentro de Orientación y Radicación de Correspondencia: Carrera 13 A No. 34 – 72 Edificio 13 35 \nLocales 110 al 112 Bogotá, D.C.  \nCódigo Postal 110311156\nNit.: 900.467.239-2\nLínea de Orientación y Contacto Ciudadano: 57 (1) 2540100 / 018000112998 PBX: 57 (1) 2540111\nwww.anla.gov.co    Email: licencias@anla.gov.co  \nPágina 28 de 36\nEn consecuencia a lo anterior, y teniendo en cuenta lo solicitado por la Sociedad, esta Autoridad \nreconoce la entrega de información por parte de la Sociedad, refiriéndose de manera más explícita \na la entrega de información del plan de inversión así: “(…) entregó el plan de inversión forzosa de no \nmenos del 1%, con una estructura e información robusta, el cual contiene Introducción, norma aplicable, \ndescripción del proyecto que generará la obligación, localización, antecedes, valor de la inversión, objetivos del \nplan (generales y específicos), ámbito geográfico de la obligación, estrategia para la implementación de las \nobligaciones, descripción de las líneas de destinación, metodología y plan operativo para el desarrollo de \nacuerdos de conservación, indicadores, riesgos, presupuesto y cronograma (…)”, sin embargo y al no contar \ncon los insumos documentales ni cartográficos necesarios, para evaluar las áreas en donde se \nimplementaría las acciones de conservación, así como las actividades relacionadas con proyectos \nde uso sostenible, no fue posible para esta Autoridad realizar un pronunciamiento de fondo respecto \na la información radicada por la Sociedad.\nTeniendo en cuenta los argumentos expuestos anteriormente, se [considera pertinente] \nCONFIRMAR el Artículo Tercero de la Resolución 3012 del 20 de diciembre de 2022., en el sentido \nde solicitar ajustes al Plan de Inversión Forzosa de no menos del 1%.\n(…)”\nAcorde con las consideraciones técnicas presentadas, se concluye que no hay lugar a \nreponer lo dispuesto en el artículo tercero de la Resolución 3012 del 20 de diciembre de \n2022 en el sentido de aprobar el plan de inversión forzosa de no menos del 1% presentado \npor la sociedad, como quiera que la Autoridad Nacional no cuenta con la información \nsuficiente para emitir un pronunciamiento de fondo sobre la aceptación o negación del plan. \nEs por esto, y en garantía del “Principio de eficacia” contemplado en el numeral 11 del \nartículo tercero de la Ley 1437 de 2011, que se considera procedente requerir la \npresentación de información adicional previo a adoptar la decisión que en derecho \ncorresponda.\nAsí las cosas, se confirmará lo dispuesto en el artículo tercero de la Resolución 3012 del \n20 de diciembre de 2022 en lo relacionado con el plan de inversión forzosa de no menos \ndel 1% presentado por la sociedad.\n“Ahora bien, respecto a la solicitud de MODIFICAR la temporalidad establecida para la entrega de \nla información requerida por esta Autoridad en los Informes de Cumplimiento Ambiental, y que tal y \ncomo solicita la Sociedad bajo el argumento que se cita a continuación “(…) que la información solicitada \ndeberá ser entregada en los sucesivos Informes de Cumplimiento Ambiental, de acuerdo con los avances \nconsignados en el cronograma entregado mediante radicado 2020118588-1-000 del 24 de julio de 2022 (…)”\n(…)\n“Es importante resaltar que actualmente la obligación de inversión de forzosa de no menos del 1% no se ha \nactivado, y por ende no se cuenta con  montos aprobados para la inversión a realizar en el  cumplimiento de \nla citada obligación, por lo tanto, es necesario la presentación del ajuste del plan de inversión  \npresentado por la Sociedad, para que de esta manera esta Autoridad pueda determinar de manera \ndetallada las obligaciones que se derivaran de la evaluación a realizar, tanto del área técnica como \nfinanciera.\nAhora bien, teniendo en cuenta la información presentada por la Sociedad en el documento \"Ajuste \nal Plan de Inversión Forzosa de no menos del 1% del Proyecto Campo de Producción Cumanday – \nCumplimiento de la Resolución 00001 del 2 de enero de 2019”, la Sociedad indica que a la fecha de \npresentación del plan de inversión, y citando textualmente “(…) no se han realizado actividades \nconstructivas ni captaciones en el Campo Cumanday y por ende no se ha configurado la obligación de inversión \nforzosa del 1%. (…)”\nBajo el argumento presentado por la Sociedad, y así como la verificación de la información que \nreposa en el Sistema de Información de Licencias Ambientales-SILA se evidencia que, a la fecha de \ncorte del Concepto técnico [1003 del 09 de marzo de 2023], la Sociedad no ha realizado obras \nconstructivas.\nTeniendo en cuenta los argumentos anteriormente expuestos, y validando la solicitud realizada por \nla Sociedad, esta Autoridad considera viable la solicitud de modificación de la temporalidad \nestablecida en el artículo [tercero] de la Resolución 3012 del 20 de diciembre de 2022, en el sentido \nde APROBAR la entrega de información requerida por esta Autoridad en los Informes de \nCumplimiento Ambiental, del proyecto Campo de Producción Cumanday.\n\nResolución No.  00701           Del   10 de abril de 2023            Hoja No. 29 de 36\n“POR LA CUAL SE RESUELVE UN RECURSO DE REPOSICIÓN”\nOficinas: Carrera 13 A No. 34 – 72 Edificio 13 35 Pisos 8 al 11 Bogotá, D.C.\nCentro de Orientación y Radicación de Correspondencia: Carrera 13 A No. 34 – 72 Edificio 13 35 \nLocales 110 al 112 Bogotá, D.C.  \nCódigo Postal 110311156\nNit.: 900.467.239-2\nLínea de Orientación y Contacto Ciudadano: 57 (1) 2540100 / 018000112998 PBX: 57 (1) 2540111\nwww.anla.gov.co    Email: licencias@anla.gov.co  \nPágina 29 de 36\nAsí mismo, la Sociedad en la petición realizada, pide, adicional a la solicitud de modificación de la \ntemporalidad de la obligación establecida en el Artículo Tercero de la Resolución 3012 del 20 de \ndiciembre de 2022; que se elimine la información “(…) para que esta Autoridad cuente con los elementos \nsuficientes para pronunciarse acerca de la viabilidad del ajuste del Plan de inversión forzosa de no menos del \n1%.”\nEs así que, bajo los argumentos anteriormente expuestos, y considerando que no ha materializado \nla obligación de la inversión forzosa de no menos del 1%, se considera apropiado [modificar] la \n[expresión] relacionada con el pronunciamiento de fondo, por lo tanto, se [estima procedente] \nMODIFICAR el Artículo Tercero de la [Resolución 3012 del 20 de diciembre de 2022].\n(…)”\nConforme con lo anterior, se precisa que se encuentra procedente acoger parcialmente los \nargumentos del recurrente en el sentido de modificar lo dispuesto en el artículo tercero de \nla Resolución 3012 del 20 de diciembre de 2022 en lo que refiere a la temporalidad para el \ncumplimiento de la obligación y suprimir la expresión “necesaria para que esta Autoridad cuente \ncon los elementos suficientes para pronunciarse acerca de la viabilidad del ajuste del Plan de \ninversión forzosa de no menos del 1%”.\nEn consecuencia, se modificará el inciso primero del artículo tercero de la Resolución 3012 \ndel 20 de diciembre de 2022, tal como se señalará en la parte resolutiva del presente acto \nadministrativo.\n“Por otro lado, la Sociedad solicitó REVOCAR los literales a y c del Numeral 2 del Artículo Tercero \nde la Resolución 3012 del 20 de diciembre de 2022, bajo los siguientes argumentos:\n“(…) ANLA solicita en el literal a), del numeral 2, artículo tercero de la Resolución 3012 del 20 de \ndiciembre de 2022, los criterios de selección del área propuesta, los cuales están discriminados y \ndetallados en el plan entregado en las Tabla 8 Encuesta de selección de predios y participantes, Tabla \n9. Criterios Determinantes, Tabla 10. Puntajes criterios generales, Tabla 11. Puntajes Participantes, \nTabla 12. Puntajes datos generales del predio y Tabla 13. Estado de vías de acceso, criterios que serán \naplicados en la ejecución del plan según el cronograma de actividades planteado, siendo así que no es \ncoherente, el requerimiento establecido por la ANLA dado que la información si fue presentada por lo \ntanto se solicita Revocar este requerimiento.\nDe acuerdo con lo anterior, en el plan de inversión numeral 9. Descripción de las líneas de inversión \nentregado mediante radicado 2020118588-1-000 del 24 de julio de 2020 y tabla 2 del presente oficio, se \ndescribe la metodología y acciones a implementar una vez se tengan las áreas donde se realizarán las \nacciones de conservación por lo tanto no es claro y carece de argumento técnico el requerimiento \nrealizado en el literal c), del numeral 2, artículo tercero de la Resolución 3012 de 2022 respecto al Método \ny/o estrategias de las acciones a implementar ya que en el concepto técnico 7263 del 2022 no fue \njustificada su motivación dado que se enfoca, es en realizar el análisis de los proyectos de uso sostenible \ncomo acciones complementarias más no precisa las acciones principales de conservación por lo tanto \nse solicita su revocatoria.(…)”\nConforme a lo anterior, esta Autoridad se permite realizar las siguientes precisiones: \n-\nEn el Subnumeral 9.1.2.1 Criterios para seleccionar los predios del documento denominado \n“Ajuste al Plan de Inversión Forzosa de no menos del 1% del Proyecto Campo de Producción \nCumanday – Cumplimiento de la Resolución 00001 del 2 de enero de 2019”, la Sociedad \npresenta los criterios tenidos en cuenta para la selección de predios así como los \nparticipantes, indicando que podrían variar dependiendo de los requerimientos que esta \nAutoridad pudiera generar así como aspectos socio-ambientales que se presenten. Así \nmismo indican que se recolectará información primaria y secundaria respecto a las \ncaracterísticas del área. \n-\nEn la tabla 8 del documento en mención presentan la encuesta de selección de predios y \nparticipantes a implementar.\n-\nEn la tabla 9 se presentan los criterios determinantes a la hora de elegir los predios en donde \nse implementarían las acciones que se están proponiendo por parte de la Sociedad, siendo \nestos, las coberturas vegetales presentes, si los propietarios o tenedores de estos tienen \ningresos menores al promedio de la región, el uso actual del predio y si el desarrollo del \nproyecto afectaría los ecosistemas naturales presentes. \n\nResolución No.  00701           Del   10 de abril de 2023            Hoja No. 30 de 36\n“POR LA CUAL SE RESUELVE UN RECURSO DE REPOSICIÓN”\nOficinas: Carrera 13 A No. 34 – 72 Edificio 13 35 Pisos 8 al 11 Bogotá, D.C.\nCentro de Orientación y Radicación de Correspondencia: Carrera 13 A No. 34 – 72 Edificio 13 35 \nLocales 110 al 112 Bogotá, D.C.  \nCódigo Postal 110311156\nNit.: 900.467.239-2\nLínea de Orientación y Contacto Ciudadano: 57 (1) 2540100 / 018000112998 PBX: 57 (1) 2540111\nwww.anla.gov.co    Email: licencias@anla.gov.co  \nPágina 30 de 36\n-\nEn la tabla 10 y 11 presentan los puntajes a los criterios y puntajes a participantes \nrespectivamente.\nEn virtud de lo anterior esta Autoridad considera que la información se encuentra debidamente \nplanteada, sin embargo, al no contar con las áreas específicas para la implementación de la línea de \ninversión “Acciones de protección, conservación y  preservación a través de restauración ecológica, \nrehabilitación y recuperación dentro de las cuales se puede incluir desarrollo de proyectos de uso \nsostenible”, no se tiene certeza de los criterios que realmente aplicarían, teniendo en cuenta que la \nSociedad, presentó en el numeral 7- Ámbito Geográfico del documento “Ajuste al Plan de Inversión \nForzosa de no menos del 1% del Proyecto Campo de Producción Cumanday”, la información \nrelacionada con la ubicación del núcleo Tillavá, en donde se evidencia que el polígono se localiza \nsobre la Cuenca del Rio Tillavá tal y como se muestra en la siguiente figura:\n(Ver Figura 4 en la página 50 del Concepto técnico 1003 del 09 de marzo de 2023)\n(...)\nAhora bien, en el Subnumeral 8.2 del documento anteriormente relacionado, se presenta información \nrespecto a la definición del núcleo, en donde la Sociedad indica que: \n“(…)\nPara el Campo de Producción Cumanday se pretende realizar la inversión forzosa de no menos del 1% \nbajo la línea de inversión “Acciones de protección, conservación y preservación a través restauración \necológica, rehabilitación y recuperación, dentro las cuales se puede incluir desarrollo de proyectos de \nuso sostenible, la cual se ejecutará por medio de acuerdos de conservación” en el núcleo Tillavá, el cual \nse encuentra dentro de la zona hidrográfica del Alto Vichada. La ubicación del núcleo se muestra en la \nFigura 8. Es importante mencionar que de acuerdo con el POMCA del río Tillavá acogido por parte de \nCormacarena mediante la Resolución PS-GJ.1.2.6.19.0141 del 21 de febrero de 2019, Ecopetrol hizo un \najuste del núcleo teniendo en cuenta las zonas priorizadas de intervención y la hidrografía de dicha \ncuenca ordenada. (…)”\n(Ver Figura 8 en la página 51 del Concepto técnico 1003 del 09 de marzo de 2023)\n(...)\nConforme a lo anterior y teniendo en cuenta que la Sociedad indicó que podrían variar,  no es posible \npara esta Autoridad determinar la viabilidad de poder aprobar acciones sin contar con un área \ndeterminada de manera tal que se pueda analizar la viabilidad de las mismas, por lo que, con la \ninformación presentada por la Sociedad y con el nivel de incertidumbre que se presenta, se consideró \nnecesario solicitar información complementaria, para que presente de manera más detallada toda \nvez que permita determinar la viabilidad de las acciones propuestas en las áreas específicas en \ndonde se implementarían las mismas.\nEs así que el requerimiento relacionado en los literales a y c del Numeral 2 del Artículo Tercero de \nla Resolución 3012 del 20 de diciembre de 2022, se encamina a que presenten la información \ndetallada a las áreas específicas, es decir los criterios que sean objeto de evaluación por parte de la \nSociedad para elegir los predios a proponer, conforme a lo requerido en el numeral 1 [del Artículo \nTercero] de la resolución en mención, esto sin desconocer la información presentada por la Sociedad \nen el radicado 2020118588-1-000 del 24 de julio de 2020.\nPor lo anterior, [se considera necesario] CONFIRMAR los literales a y c del Numeral 2 del Artículo \nTercero de la Resolución 3012 del 20 de diciembre de 2022.\n(…)”\nAsí las cosas, atendiendo a las consideraciones expuestas en el Concepto técnico 1003 del \n09 de marzo de 2023, se confirmarán los requerimientos establecidos en los literales a) y \nc) del numeral 2 del artículo tercero de la Resolución 3012 del 20 de diciembre de 2022, tal \ncomo se indicará en la parte resolutiva del presente acto administrativo.\n“También  la Sociedad solicita ACLARAR la consideración realizada en el concepto técnico 7263 del \n24 de noviembre de 2022, página 14, subtitulo Mantenimiento y Monitoreo en el sentido de, \nAPROBAR el uso de componentes para la fertilización y demás actividades del proceso, el uso de \nagroquímicos para las actividades que así lo demanden, durante la siembra y el mantenimiento del \nsistema agroforestal propuesto, de conformidad con los lineamientos dados por el Ministerio de \nAgricultura y Desarrollo Rural y la Federación Nacional de Cacaoteros.\n\nResolución No.  00701           Del   10 de abril de 2023            Hoja No. 31 de 36\n“POR LA CUAL SE RESUELVE UN RECURSO DE REPOSICIÓN”\nOficinas: Carrera 13 A No. 34 – 72 Edificio 13 35 Pisos 8 al 11 Bogotá, D.C.\nCentro de Orientación y Radicación de Correspondencia: Carrera 13 A No. 34 – 72 Edificio 13 35 \nLocales 110 al 112 Bogotá, D.C.  \nCódigo Postal 110311156\nNit.: 900.467.239-2\nLínea de Orientación y Contacto Ciudadano: 57 (1) 2540100 / 018000112998 PBX: 57 (1) 2540111\nwww.anla.gov.co    Email: licencias@anla.gov.co  \nPágina 31 de 36\nValidando la consideración realizada en el Concepto Técnico 7263 del 24 de noviembre de 2022, \nesta Autoridad indicó lo siguiente: \n“(…)\nReferente a las actividades descritas con anterioridad, esta Autoridad señala que en caso de ser \nnecesario la implementación de fertilización, esta debe realizarse sólo con productos orgánicos y que la \nimplementación de esta etapa deberá prolongarse por un período mínimo de cinco (5) años, lapso \nmínimo requerido para que el cacao empieza a dar frutos. (…)”\nBajo la solicitud realizada por la Sociedad, esta Autoridad se permite realizar la siguiente \nconsideración: \nEn el numeral 9.2.2.6 Insumos, del documento denominado “Ajuste al Plan de Inversión Forzosa de \nno menos del 1% del Proyecto Campo de Producción Cumanday – Cumplimiento de la Resolución \n00001 del 2 de enero de 2019”, la Sociedad presentó lo siguiente:\n“Se usarán bioinsumos utilizados en la producción agropecuaria ecológica en el país y reglamentados \npor la Resolución 187 del 2006 del Instituto Colombiano Agropecuario-ICA. Además de la aplicación de \ndiferentes métodos de preparación de biofermentados sólidos y líquidos, que remplazan el uso de \nfertilizantes químicos, con resultados similares y con el beneficio adicional de dar a conocer y capacitar \na las comunidades y empresas en producción ecológica y de bajo costo. Sin embargo, es factible el uso \nde agroquímicos siempre y cuando la Empresa presente la justificación para su empleo y especifique la \nfase y actividades puntuales del proyecto que requieran su aplicación.\nSe optará como primera opción el uso de fertilizantes orgánicos como: Gallinaza, Bovinaza, Porquinaza, \nabono de origen prehúmico, Compostaje y Lombrinaza. Sin embargo, si se observa que por las \ncondiciones climáticas los fertilizantes orgánicos utilizados se descomponen muy rápido, no son \nasimilados por las plantas o el suelo o no sea posible realizar el manejo de Plagas y enfermedades con \nbioinsumos, se optará por el uso de agroquímicos siguiendo con lo requerido.\n(…)”\nTeniendo en cuenta la información presentada, así como la consideración realizada en la página 14 \ndel Concepto Técnico, 7263 del 24 de noviembre de 2022, se considera viable el uso de los \nfertilizantes orgánicos siendo estos Gallinaza, bonivana, porquinaza y/o el abono de origen \nprehúmico, compostaje, lombrinaza, entre otros. Ahora bien, y una vez se inicien las actividades de \nmantenimiento, si la Sociedad identifica que los fertilizantes orgánicos no están siendo efectivos y \nno están cumpliendo con el objetivo de su aplicación, se considera que en caso de que se requiera \nde la implementación de agroquímicos, la Sociedad deberá presentar la justificación técnica de la \nnecesidad de los mismos y la pertinencia de su aplicación sobre las actividades a realizar, \nadicionalmente, se deberán tener en cuenta los lineamientos dados por el Ministerio de Agricultura \ny Desarrollo Rural y la Federación Nacional de Cacaoteros. \n(…)”\nAdicional a las consideraciones técnicas expuestas, se precisa lo siguiente: El recurso de \nreposición procede contra los actos administrativos definitivos, de conformidad con lo \nseñalado en el artículo 74 de la Ley 1437 de 2011; así las cosas, si bien el concepto técnico \nhace parte integral y fundamental para la toma de decisiones que se expresan en el acto \nadministrativo, este no es objeto de recurso, de tal modo que la aclaración, modificación, \nadición o revocatoria debe ser implorada en contra de la decisión administrativa y no en \ncontra del concepto técnico.\nHecha la precisión anterior, se evidencia que la consideración que es motivo de solicitud de \naclaración y sobre la cual se realiza el pronunciamiento se encuentra contenida en el párrafo \ntercero del acápite \"MANTENIMIENTO Y MONITOREO\" de la Resolución 3012 del 20 de \ndiciembre de 2022 (página 33).\nAhora, considerando que desde el aspecto técnico se evidenció la pertinencia de aclarar \nque el uso de los fertilizantes orgánicos, si bien deben ser una primera opción, no pueden \nser la única, de tal manera que no se puede condicionar su uso como única alternativa, se \nhace necesario ajustar la consideración reseñada en el párrafo tercero del acápite \n\"MANTENIMIENTO Y MONITOREO\" de la Resolución 3012 del 20 de diciembre de 2022, \naclarando dicha situación.\n\nResolución No.  00701           Del   10 de abril de 2023            Hoja No. 32 de 36\n“POR LA CUAL SE RESUELVE UN RECURSO DE REPOSICIÓN”\nOficinas: Carrera 13 A No. 34 – 72 Edificio 13 35 Pisos 8 al 11 Bogotá, D.C.\nCentro de Orientación y Radicación de Correspondencia: Carrera 13 A No. 34 – 72 Edificio 13 35 \nLocales 110 al 112 Bogotá, D.C.  \nCódigo Postal 110311156\nNit.: 900.467.239-2\nLínea de Orientación y Contacto Ciudadano: 57 (1) 2540100 / 018000112998 PBX: 57 (1) 2540111\nwww.anla.gov.co    Email: licencias@anla.gov.co  \nPágina 32 de 36\nNo obstante, si bien se encuentra pertinente ajustar la consideración objeto de análisis, ello \nno implica una modificación de aceptación o negación en la parte resolutiva del acto \nadministrativo; de un lado, porque en la parte resolutiva de la Resolución 3012 del 20 de \ndiciembre de 2022 no se incluyó un pronunciamiento al respecto, y de otro lado, porque el \npronunciamiento a que haya lugar se emitirá en el acto administrativo en que se evalúe la \ninformación que se le ha requerido a la sociedad.\nPor lo anterior, se procederá a aclarar la consideración contenido en el párrafo tercero del \nacápite \"MANTENIMIENTO Y MONITOREO\" de la Resolución 3012 del 20 de diciembre de \n2022 (página 33), tal como se señalará en la parte resolutiva del presente acto \nadministrativo.\n“Por último, la Sociedad solicita a esta Autoridad, ACLARAR, la consideración realizada en el \nconcepto técnico 7263 del 24 de noviembre de 2022, página 14, subtitulo Mantenimiento y Monitoreo \nen el sentido de APROBAR el mantenimiento de los arreglos agroforestales durante los (3) tres años \niniciales a partir del establecimiento.\nPartiendo de la información presentada por la Sociedad, en el documento “Plan de Inversión Forzosa \nde No Menos del 1% del Proyecto Campo de Producción Cumanday” la Sociedad plantea las \nsiguientes actividades a desarrollar en el Mantenimiento y Monitoreo:\n“(…)\nA continuación, se describen algunas de las actividades más relevantes:\na.\nPlateo.\n Se deberá eliminar a ras del suelo todas las especies invasoras que se encuentre presente \nen un diámetro de 1 m alrededor del árbol, en la zona que comúnmente denominamos plato. Se \ndebe realizar de manera manual, mecánica o química. En el desarrollo de este tipo de proyectos \nproductivos se incentivará y capacitará el uso de prácticas culturales que resulten más amigables \ncon el suelo y la fauna relacionada a este tipo de coberturas.\nb.\nLimpias.\n Actividad que se debe llevar a cabo una vez se ha hecho el plateo, por ningún motivo se \ndebe adelantar esta labor, sin haberse efectuado el plateo, esto para evitar que la guadaña o el \nmachete arrase con el material vegetal que se encuentre muy pequeño y que en la mayoría de los \ncasos se confunde con la maleza. A medida que el modelo se consolida en cada uno de los estratos \ny componentes la implementación de esta práctica será menos frecuente y necesaria.\nc.\nFertilización.\n Se recomienda aplicar en cada hoyo, 500 g de abono orgánico, en caso de ser \nnecesario se complementará con 50 g/árbol de fertilizantes compuestos (Triple 15 o 10-30-10) y 25 \ng/árbol de fertilizantes con elementos menores. El método de aplicación de los fertilizantes podrá \nser en media corona, o en dos hoyos con ángulo hacia la raíz a lado y lado del árbol (retirados unos \n10 cm del tallo del árbol). El fertilizante no puede quedar por fuera de los orificios, debe quedar \ntotalmente cubierto. Antes de iniciar las actividades de fertilización, se debe verificar las cantidades \ny tipos de fertilizantes en cada uno de los predios, con base en los análisis de suelos que se \nrealizarán.\nd.\nControl Fitosanitario.\n El control fitosanitario comprende varias actividades, entre las que se \ndestacan: Control de malezas, control de plagas y enfermedades, control de nematodos, control de \nhormiga, entre otras, estas actividades se deben ejecutar de manera continuada hasta la entrega \nde la plantación. Para el control fitosanitario es muy importante atender la condición climática del \nmomento, dado que según la estación que se presente, se debe poner más atención a una o a otra \nsituación, por ejemplo durante la temporada invernal son muy frecuentes los ataques fungosos es \ndecir aquellas enfermedades producidas por hongos que generalmente involucran las partes \naéreas de la planta, mientras que en la temporada seca son más propicios los ataques de las plagas, \nquienes afectan las diferentes estructuras de la planta, mediante diferentes mecanismos \n(chupadores, barrenadores, anilladores, minadores, taladradores, etc.), para esto se deberá \ndiseñar estrategias de monitoreo y control más adecuados como ubicación y eliminación de \nhormigueros, aplicación de purines, alelopatía y control biológico. Igualmente se debe mantener un \ncontrol de gramíneas invasoras tales como pastos y demás especies invasoras que puedan \ncompetir por nutrientes y luz con la plantación.\ne.\nProtección contra incendios y sequias\n. Consiste en una vigilancia continua y preventiva en \népocas de marcada sequía para evitar daños por fuegos espontáneos o provocados en el arreglo \nagroforestal y sus alrededores. En algunos casos se debe realizar un desmonte y limpieza de líneas \ncortafuegos estratégicamente localizados dentro y en los alrededor (sic) de los lotes plantados, \nestas fajas servirán de cortafuegos.\nf.\nMantenimiento completo (MC)\n Para el mantenimiento completo se llevarán a cabo la totalidad de \nactividades que corresponden a un mantenimiento: plateos, limpias, resiembra, fertilización, control \n\nResolución No.  00701           Del   10 de abril de 2023            Hoja No. 33 de 36\n“POR LA CUAL SE RESUELVE UN RECURSO DE REPOSICIÓN”\nOficinas: Carrera 13 A No. 34 – 72 Edificio 13 35 Pisos 8 al 11 Bogotá, D.C.\nCentro de Orientación y Radicación de Correspondencia: Carrera 13 A No. 34 – 72 Edificio 13 35 \nLocales 110 al 112 Bogotá, D.C.  \nCódigo Postal 110311156\nNit.: 900.467.239-2\nLínea de Orientación y Contacto Ciudadano: 57 (1) 2540100 / 018000112998 PBX: 57 (1) 2540111\nwww.anla.gov.co    Email: licencias@anla.gov.co  \nPágina 33 de 36\nde plagas, control de enfermedades y manejo silvicultural (podas de formación, cicatrizaciones, \ncontrol de incendios, control de heladas, etc.). Los mantenimientos completos (MC) se deben hacer \nen un lapso no menor a seis (6) meses entre mantenimiento, procurando que estos se realicen en \népoca de lluvias.\ng.\nMantenimiento Parcial (MP).\n Para el mantenimiento parcial sólo se contemplan tres actividades \n(replateos, limpias, y control fitosanitario). Básicamente se trata de control de malezas para evitar \nel retraso del material vegetal establecido por competencia de luz y nutrientes; control de plagas y \nenfermedades que, como se dijo anteriormente, debe ser continuado durante todas las etapas del \nproyecto y preventivo, para evitar que las plagas o enfermedades lleguen a la plantación; para un \ncontrol efectivo es muy importante tener en cuenta la estación climática del momento. Los \nmantenimientos parciales se deberán programar entre los mantenimientos completos. En la Tabla \n17 se definen los mantenimientos a realizar durante la ejecución del proyecto. \nEs importate (sic) aclarar que la intensidad de los mantenimientos podrá variar de acuerdo con las \nnecesidades de la plantación; es decir que si evidencia la necesidad de ejecutar el mantenimiento \n(sic) con una mayor frecuencia que la propuesta se realizará un mayo número de manteniientos \n(sic) por año. Por el contrario, si el estado fitosanitario es bueno y la maleza no pone en riesgo la \nsuperviviencia (sic) de los individuos el mantenimiento se podrá realizar con una menor frecuencia.\n(Ver Tabla 17 en la página 56 del Concepto técnico 1003 del 09 de marzo de 2023)\n(...)\nSe continuará brindando asistencia técnica durante un año más hasta cumplir los 4 años, con el fin de \nasegurar la productividad y continuidad del sistema.\n(…)”\nAhora bien, verificando el Concepto Técnico 7263 del 24 de noviembre de 2022 no se presentó \npronunciamiento respecto a la temporalidad de los mantenimientos a realizar [es decir, no se señaló \nde manera expresa cada cuánto se debían realizar los mantenimientos] sin embargo [sí] se presentó \nla siguiente consideración [relacionada con el lapso mínimo para la implementación de los \nfertilizantes]:\n“(…) referente a las actividades descritas con anterioridad, esta Autoridad señala que en caso de ser \nnecesario la implementación de fertilización, esta debe realizarse sólo con productos orgánicos y que la \nimplementación de esta etapa deberá prolongarse por un período mínimo de cinco (5) años, lapso \nde tiempo mínimo requerido para que el cacao empieza a dar frutos. “(negrilla fuera de texto original) \nRespecto a lo anterior, esta Autoridad considera que, la temporalidad presentada por la Sociedad \ndeberá ser modificada, toda vez que, y conforme a los lineamientos establecidos en el Plan Nacional \nde Restauración, no es un tiempo suficiente para la realización de las acciones de implementación y \nde esta manera estaría siguiendo también los lineamientos en mención. \nPor lo anterior, no es posible [aceptar los argumentos con los cuales solicita la aclaración de la \nconsideración, en lo relacionado al] mantenimiento de los arreglos agroforestales durante los (3) tres \naños iniciales a partir del establecimiento conforme a lo solicitado por la Sociedad.\nEn ese orden de ideas, una vez la Sociedad presente la información solicitada, esta Autoridad \nevaluará y [validará] la pertinencia o no de aprobar el mantenimiento, tal y como lo solicitó.\n(…)”\nSumado a las anteriores consideraciones técnicas, se indica que no hay lugar a adicionar \nel pronunciamiento contenido en la Resolución 3012 del 20 de diciembre de 2022, en el \nsentido de aceptar o negar la temporalidad preestablecida para el mantenimiento de los \narreglos agroforestales, toda vez que es preciso que la sociedad allegue la información que \nle ha sido requerida y una vez se evalúe la misma, se efectuará el pronunciamiento que se \nestime viable tanto técnica como jurídicamente.\nPor lo anterior, no hay lugar a modificar y en consecuencia se confirmará la consideración \ncontenida en el párrafo tercero del acápite \"MANTENIMIENTO Y MONITOREO\" de la \nResolución 3012 del 20 de diciembre de 2022 (página 33), en lo relacionado a temporalidad \nde los arreglos agroforestales.\nEn mérito de lo expuesto, \n\nResolución No.  00701           Del   10 de abril de 2023            Hoja No. 34 de 36\n“POR LA CUAL SE RESUELVE UN RECURSO DE REPOSICIÓN”\nOficinas: Carrera 13 A No. 34 – 72 Edificio 13 35 Pisos 8 al 11 Bogotá, D.C.\nCentro de Orientación y Radicación de Correspondencia: Carrera 13 A No. 34 – 72 Edificio 13 35 \nLocales 110 al 112 Bogotá, D.C.  \nCódigo Postal 110311156\nNit.: 900.467.239-2\nLínea de Orientación y Contacto Ciudadano: 57 (1) 2540100 / 018000112998 PBX: 57 (1) 2540111\nwww.anla.gov.co    Email: licencias@anla.gov.co  \nPágina 34 de 36\nRESUELVE\nARTÍCULO PRIMERO. Confirmar el artículo segundo de la Resolución 3012 del 20 de \ndiciembre de 2022, de conformidad con lo expuesto en la parte motiva del presente acto \nadministrativo.\nARTÍCULO SEGUNDO. Confirmar lo dispuesto en el artículo tercero de la Resolución \n3012 del 20 de diciembre de 2022 en lo relacionado con el plan de inversión forzosa de no \nmenos del 1% presentado por la sociedad, de conformidad con lo expuesto en la parte \nmotiva del presente acto administrativo.\nARTÍCULO TECERO. Modificar el inciso primero del artículo tercero de la Resolución 3012 \ndel 20 de diciembre de 2022, respecto a la temporalidad para el cumplimiento de la \nobligación, de conformidad con lo expuesto en la parte motiva del presente acto \nadministrativo, el cual quedará de la siguiente manera:\n“ARTÍCULO TERCERO. Requerir a la Sociedad ECOPETROL S.A., para que en \nlos Informes de Cumplimiento Ambiental - ICA’s, presente la siguiente información, \nrespecto a la obligación de inversión forzosa de no menos del 1%:\n(…)”\nARTÍCULO CUARTO. Confirmar los literales a) y c) del numeral 2 del artículo tercero de \nla Resolución 3012 del 20 de diciembre de 2022, de conformidad con lo expuesto en la \nparte motiva del presente acto administrativo.\nARTÍCULO QUINTO. Aclarar la consideración contenida en el párrafo tercero del acápite \n\"MANTENIMIENTO Y MONITOREO\" de la Resolución 3012 del 20 de diciembre de 2022 \n(página 33), en lo relacionado a la implementación de fertilizantes orgánicos, de \nconformidad con lo expuesto en la parte motiva del presente acto administrativo, la cual \nquedará de la siguiente manera:\n“(…) en caso de ser necesaria la implementación de fertilización, esta se “podrá” \nrealizar mediante el uso de los fertilizantes orgánicos siendo estos Gallinaza, \nbonivana, porquinaza y/o el abono de origen prehúmico, compostaje, lombrinaza, \nentre otros. Ahora bien, y una vez se inicien las actividades de mantenimiento, si la \nSociedad identifica que los fertilizantes orgánicos no están siendo efectivos y no \nestán cumpliendo con el objetivo de su aplicación, se considera que en caso de que \nse requiera de la implementación de agroquímicos, la Sociedad presentará a la \nAutoridad Nacional la justificación técnica de la necesidad de los mismos y la \npertinencia de su aplicación sobre las actividades a realizar, adicionalmente, se \ndeberán tener en cuenta los lineamientos dados por el Ministerio de Agricultura y \nDesarrollo Rural y la Federación Nacional de Cacaoteros.”\nARTÍCULO SEXTO. Confirmar la consideración contenida en el párrafo tercero del acápite \n\"MANTENIMIENTO Y MONITOREO\" de la Resolución 3012 del 20 de diciembre de 2022 \n(página 33), en lo relacionado a temporalidad de los arreglos agroforestales, de \nconformidad con lo expuesto en la parte motiva del presente acto administrativo.\nARTÍCULO SÉPTIMO. Las demás disposiciones contenidas en la Resolución 3012 del 20 \nde diciembre de 2022 y no modificadas en el presente acto administrativo, continúan \nvigentes.\nARTÍCULO OCTAVO. Notificar el presente acto administrativo al representante legal, o al \napoderado debidamente constituido o a la persona debidamente autorizada por la Sociedad \nECOPETROL S.A., identificada con NIT. 899.999.068-1, o a quien haga sus veces de \nconformidad con lo dispuesto en los artículos 67 y siguientes de la Ley 1437 de 2011.\nPARÁGRAFO. En el suceso en que el titular de la licencia o el permiso, entre en proceso \nde disolución o régimen de insolvencia empresarial o liquidación regulados por las normas \n\nResolución No.  00701           Del   10 de abril de 2023            Hoja No. 35 de 36\n“POR LA CUAL SE RESUELVE UN RECURSO DE REPOSICIÓN”\nOficinas: Carrera 13 A No. 34 – 72 Edificio 13 35 Pisos 8 al 11 Bogotá, D.C.\nCentro de Orientación y Radicación de Correspondencia: Carrera 13 A No. 34 – 72 Edificio 13 35 \nLocales 110 al 112 Bogotá, D.C.  \nCódigo Postal 110311156\nNit.: 900.467.239-2\nLínea de Orientación y Contacto Ciudadano: 57 (1) 2540100 / 018000112998 PBX: 57 (1) 2540111\nwww.anla.gov.co    Email: licencias@anla.gov.co  \nPágina 35 de 36\nvigentes, informará inmediatamente de esta situación a esta Autoridad, con fundamento, \nentre otros, en los artículos 8, 58, 79, 80, 81, 95 numeral 8 de la Constitución Política de \n1991, en la Ley 43 de 1990, en la Ley 222 de 1995, en la Ley 1333 de 2009 y demás normas \nvigentes y jurisprudencia aplicable. \nAdicional a la obligación de informar a esta Autoridad de tal situación, el titular de la licencia \no permiso aprovisionará contablemente las obligaciones contingentes que se deriven de la \nexistencia de un procedimiento ambiental sancionatorio conforme con el artículo 40 de la \nLey 1333 de 2009 o la norma que la adicione, modifique o derogue.\nARTÍCULO NOVENO. Comunicar el contenido del presente acto administrativo a la \nCorporación para el Desarrollo Sostenible del Área de Manejo Especial de La Macarena – \nCORMACARENA, para su conocimiento y fines pertinentes.\nARTÍCULO DÉCIMO. Publicar la presente Resolución en la Gaceta Ambiental de la \nAutoridad Nacional de Licencias Ambientales – ANLA, de conformidad con lo señalado en \nel artículo 71 de la Ley 99 de 1993.\nARTÍCULO DÉCIMO PRIMERO. Contra el presente acto administrativo no procede recurso \nalguno de conformidad con lo establecido en el artículo 87 del Código de Procedimiento \nAdministrativo y de lo Contencioso Administrativo.\nNOTIFÍQUESE, COMUNÍQUESE, PUBLÍQUESE Y CÚMPLASE\nDada en Bogotá D.C., a los 10 de abril de 2023\nEDILBERTO PEÑARANDA CORREA\nAsesor\nEjecutores\nIBLER ANDERSON MOLANO \nRINCON\nContratista\n \n \nRevisor / L\u0000der\nANDREA DEL PILAR SANABRIA \nDEL RIO\nContratista\n \n \nExpediente\nLAV0012-00-2018\nConcepto técnico \n1003 del 09 de marzo de 2023\nFecha:\n5 de abril de 2023\nProceso No.: 2023073899\nArchívese en: LAV0012-00-2018 \nPlantilla_Resolución_SILA_v3_42852\nNota: Este es un documento electrónico generado desde los Sistemas de Información de la ANLA. El original reposa en los archivos digitales de la \nEntidad.\n\nResolución No.  00701           Del   10 de abril de 2023            Hoja No. 36 de 36\n“POR LA CUAL SE RESUELVE UN RECURSO DE REPOSICIÓN”\nOficinas: Carrera 13 A No. 34 – 72 Edificio 13 35 Pisos 8 al 11 Bogotá, D.C.\nCentro de Orientación y Radicación de Correspondencia: Carrera 13 A No. 34 – 72 Edificio 13 35 \nLocales 110 al 112 Bogotá, D.C.  \nCódigo Postal 110311156\nNit.: 900.467.239-2\nLínea de Orientación y Contacto Ciudadano: 57 (1) 2540100 / 018000112998 PBX: 57 (1) 2540111\nwww.anla.gov.co    Email: licencias@anla.gov.co  \nPágina 36 de 36\n"
}