{
  "fuente": "ANLA_GACETA",
  "numero_resolución": "RESOLUCIÓN N° 01910",
  "fecha_resolución": "2022-09-08",
  "nombre_proyecto": "proyecto denominado “Explotación de Hidrocarburos en el Campo Vikingo del Bloque Lla-47”, localizado en",
  "ubicación": "departamento del Casanare, con un área de 6,03 hectáreas.",
  "empresa": "El recurso de reposición fue interpuesto por quién cuenta con la capacidad legal para adelantar la actuación, a su vez, el escrito contiene los motivos de inconformidad y el lugar de notificación, por lo tanto, se considera que reúne los requisitos de ley para que el mismo sea resuelto por esta Autoridad. De otro lado, es preciso señalar que dentro del escrito del recurso de reposición no se solicitó práctica de pruebas ni se decretaron de oficio por parte de la Autoridad. Así las cosas",
  "numero_expediente": "LAV0078-00-2021",
  "radicados": [
    "2022140398",
    "2022051066",
    "2021240155"
  ],
  "descripcion": "Por la cual se resuelve el Recurso de Reposición interpuesto contra la Resolución 1350 del 21 de junio de 2022.",
  "tipos_infraccion": [
    "Vertimientos",
    "Emisiones atmosféricas",
    "Manejo de aguas",
    "Tala o afectación de bosques"
  ],
  "pdf_id": "40370",
  "file_name": "ANLA_40370.pdf",
  "texto_completo": "|\nRepública de Colombia\nMinisterio de Ambiente y Desarrollo Sostenible\nAUTORIDAD NACIONAL DE LICENCIAS AMBIENTALES \n- ANLA –\nRESOLUCIÓN N°  01910\n( 08 de septiembre de 2022 )\nOficinas: Carrera 13 A No. 34 – 72 Edificio 13 35 Pisos 8 al 11 Bogotá, D.C.\nCentro de Orientación y Radicación de Correspondencia: Carrera 13 A No. 34 – 72 Edificio 13 35 \nLocales 110 al 112 Bogotá, D.C.  \nCódigo Postal 110311156\nNit.: 900.467.239-2\nLínea de Orientación y Contacto Ciudadano: 57 (1) 2540100 / 018000112998 PBX: 57 (1) 2540111\nwww.anla.gov.co    Email: licencias@anla.gov.co  \nPágina 1 de 39\n“Por la cual se resuelve el Recurso de Reposición interpuesto contra la Resolución 1350 del \n21 de junio de 2022.”\nEL DIRECTOR GENERAL DE LA AUTORIDAD NACIONAL DE LICENCIAS AMBIENTALES-\nANLA\nEn uso de sus facultades legales establecidas mediante la Ley 99 de 1993, el Decreto Ley 3573 del \n2011 y acorde con lo regulado en el Decreto 1076 del 26 de mayo de 2015, el Decreto 376 de 11 de \nmarzo de 2020, la Resolución 1690 del 6 de septiembre de 2018, la Resolución 1957 del 05 de \nnoviembre de 2021 de la Autoridad Nacional de Licencias Ambientales – ANLA y,\n  \nCONSIDERANDO:\nQue mediante Resolución 1350 del 21 de junio de 2022, la Autoridad Nacional de Licencias \nAmbientales – ANLA, otorgó Licencia Ambiental Global a la sociedad INTEROIL COLOMBIA \nEXPLORATION AND PRODUCTION, identificada con Nit. 860.529.657-0, para el proyecto \ndenominado “Explotación de Hidrocarburos en el Campo Vikingo del Bloque Lla-47”, localizado en \njurisdicción del municipio de Orocué en el departamento del Casanare, con un área de 6,03 hectáreas.\nQue esta resolución se notificó a la sociedad INTEROIL COLOMBIA EXPLORATION AND \nPRODUCTION, vía electrónica el 22 de junio de 2022.\nQue mediante el radicado 2022140398-1-000 del 8 de julio de 2022, la sociedad INTEROIL \nCOLOMBIA EXPLORATION AND PRODUCTION, interpuso recurso de reposición contra la \nmencionada resolución, por intermedio de Andrea Giraldo Dussan, en calidad apoderada especial, tal \ny como se encuentra acreditado en el Certificado de Existencia y Representación Legal del 5 de julio \nde 2022, expedido por la Cámara de Comercio de Bogotá.\nQue a través de Concepto Técnico 05417 del 07 de septiembre de 2022, esta Autoridad Nacional \nevaluó los argumentos expuestos por la sociedad sociedad INTEROIL COLOMBIA EXPLORATION \nAND PRODUCTION.\n \nFUNDAMENTOS LEGALES. \nCompetencia. \nMediante Decreto-Ley 3573 de septiembre 27 de 2011, el Gobierno Nacional, en uso de las facultades \nextraordinarias conferidas por la Ley 1444 de 2011, creó la Autoridad Nacional de Licencias \nAmbientales -ANLA- como una Unidad Administrativa Especial, con autonomía administrativa y \nfinanciera, sin personería jurídica, adscrita al Ministerio de Ambiente y Desarrollo Sostenible, \nencargada de que los proyectos, obras o actividades sujetos a licenciamiento, permiso o trámite \nambiental cumplan con la normativa ambiental, de tal manera que contribuyan al desarrollo sostenible \n\nResolución No.  01910           Del   08 de septiembre de 2022            Hoja No. 2 de 39\n“Por la cual se Resuelve el Recurso de Reposición interpuesto contra la Resolución 01350 del 21 de \njunio de 2022”\nOficinas: Carrera 13 A No. 34 – 72 Edificio 13 35 Pisos 8 al 11 Bogotá, D.C.\nCentro de Orientación y Radicación de Correspondencia: Carrera 13 A No. 34 – 72 Edificio 13 35 \nLocales 110 al 112 Bogotá, D.C.  \nCódigo Postal 110311156\nNit.: 900.467.239-2\nLínea de Orientación y Contacto Ciudadano: 57 (1) 2540100 / 018000112998 PBX: 57 (1) 2540111\nwww.anla.gov.co    Email: licencias@anla.gov.co  \nPágina 2 de 39\nambiental del País; desconcentrando así funciones del Ministerio de Ambiente y Desarrollo Sostenible \nque, antes de la escisión del Ministerio de Ambiente, Vivienda y Desarrollo Territorial, ejercía éste a \ntravés la Dirección de Licencias, Permisos y Trámites Ambientales. \nDentro de las actividades administrativas funcionales, territoriales y temporales que legalmente fueron \ndesconcentradas en la ANLA, está la función de conocer administrativamente de los instrumentos de \ncontrol y manejo ambiental que para los proyectos de su competencia se hayan adoptado, siendo por \ntanto viable que conozca las solicitudes de modificación, seguimiento y control ambiental, hasta el \ndesmantelamiento y abandono de acuerdo con lo dispuesto por la Ley 99 de 1993, y el Decreto 1076 \nde 2015. \nPara el presente caso la Autoridad Nacional de Licencias Ambientales - ANLA, a través de su Director \nGeneral, es la competente para decidir administrativamente el recurso de reposición interpuesto \ncontra la Resolución 767 del 18 de abril de 2022, por ser esta Autoridad quien expidió dicho acto \nadministrativo.  \nMediante la Resolución 1690 del 6 de septiembre de 2018, se efectuó el nombramiento ordinario del \nIngeniero Rodrigo Suárez Castaño, en el empleo de Director General de la Unidad Administrativa, \nCódigo 015 de la Autoridad Nacional de Licencias Ambientales – ANLA. \nEl Decreto 376 del 11 de marzo de 2020 “Por el cual se modifica la estructura de la Autoridad Nacional \nde Licencias Ambientales ANLA”, modificó la estructura de la Entidad, correspondiéndole al Despacho \nde la Dirección General de esta Entidad la suscripción del presente acto administrativo, conforme se \nevidencia en el artículo 2 del precitado Decreto.\nRespecto a la competencia para suscribir el presente acto administrativo, se tiene en cuenta la función \nestablecida a la Dirección General, en el Decreto 376 de 11 de marzo de 2020, “Por el cual se modifica \nla estructura de la Autoridad Nacional de Licencias Ambientales ANLA” y la Resolución 01957 del 5 \nde noviembre de 2021, “Por la cual se adopta el Manual Específico de Funciones y de Competencias \nLaborales para los empleos de la planta de personal de la Autoridad Nacional de Licencias \nAmbientales - ANLA”. \nProcedimiento.\nEl procedimiento para la presentación y resolución de recursos contra los actos administrativos se \nencuentra reglado en el Código de Procedimiento Administrativo y de lo Contencioso Administrativo \nartículos 74 y siguientes, que particularmente respecto del recurso de reposición expresan:\n “Artículo 74. Recursos contra los actos administrativos. - Por regla general, contra los actos \ndefinitivos procederán los siguientes recursos: \n1. El de reposición, ante quien expidió la decisión para que la aclare, modifique, adicione o \nrevoque…” \nAsí mismo, en cuanto a la oportunidad y presentación de los recursos, el artículo 76 del citado código, \ndispone: \n“Artículo 76. Oportunidad y presentación. - Los recursos de reposición y apelación deberán \ninterponerse por escrito en la diligencia de notificación personal, o dentro de los diez (10) días \nsiguientes a ella, o a la notificación por aviso, o al vencimiento del término de publicación, según el \ncaso. Los recursos contra los actos presuntos podrán interponerse en cualquier tiempo, salvo en el \nevento en que se haya acudido ante el juez. \nLos recursos se presentarán ante el funcionario que dictó la decisión, salvo lo dispuesto para el de \nqueja, y si quien fuere competente no quisiere recibirlos podrán presentarse ante el procurador \n\nResolución No.  01910           Del   08 de septiembre de 2022            Hoja No. 3 de 39\n“Por la cual se Resuelve el Recurso de Reposición interpuesto contra la Resolución 01350 del 21 de \njunio de 2022”\nOficinas: Carrera 13 A No. 34 – 72 Edificio 13 35 Pisos 8 al 11 Bogotá, D.C.\nCentro de Orientación y Radicación de Correspondencia: Carrera 13 A No. 34 – 72 Edificio 13 35 \nLocales 110 al 112 Bogotá, D.C.  \nCódigo Postal 110311156\nNit.: 900.467.239-2\nLínea de Orientación y Contacto Ciudadano: 57 (1) 2540100 / 018000112998 PBX: 57 (1) 2540111\nwww.anla.gov.co    Email: licencias@anla.gov.co  \nPágina 3 de 39\nregional o ante el personero municipal, para que ordene recibirlos y tramitarlos, e imponga las \nsanciones correspondientes, si a ello hubiere lugar. \nEl recurso de apelación podrá interponerse directamente, o como subsidiario del de reposición y \ncuando proceda será obligatorio para acceder a la jurisdicción. \nLos recursos de reposición y de queja no serán obligatorios.” \nDe acuerdo con lo previsto en el artículo 77 del mencionado Código, los recursos deberán reunir los \nsiguientes requisitos: \n“Artículo 77. Requisitos. - Por regla general los recursos se interpondrán por escrito que no requiere \nde presentación personal si quien lo presenta ha sido reconocido en la actuación. Igualmente, \npodrán presentarse por medios electrónicos.\nLos recursos deberán reunir, además, los siguientes requisitos: \nInterponerse dentro del plazo legal, por el interesado o su representante o apoderado \ndebidamente constituido. \nSustentarse con expresión concreta de los motivos de inconformidad. \nSolicitar y aportar las pruebas que se pretende hacer valer. \nIndicar el nombre y la dirección del recurrente, así como la dirección electrónica si desea ser \nnotificado por este medio”. \nSólo los abogados en ejercicio podrán ser apoderados. Si el recurrente obra como agente oficioso, \ndeberá acreditar la calidad de abogado en ejercicio, y prestar la caución que se le señale para \ngarantizar que la persona por quien obra ratificará su actuación dentro del término de dos (2) meses. \nSi no hay ratificación se hará efectiva la caución y se archivará el expediente. \nPara el trámite del recurso el recurrente no está en la obligación de pagar la suma que el acto \nrecurrido le exija. Con todo, podrá pagar lo que reconoce deber.” \nEl artículo 80 del citado Código, establece el alcance del contenido de la decisión que resuelve el \nrecurso:\n“Artículo 80. Decisión de los recursos. -Vencido el período probatorio, si a ello hubiere lugar, y sin \nnecesidad de acto que así lo declare, deberá proferirse la decisión motivada que resuelva el recurso. \nLa decisión resolverá todas las peticiones que hayan sido oportunamente planteadas y las que \nsurjan con motivo del recurso.” \nEl recurso de reposición constituye un instrumento legal mediante el cual la parte interesada tiene la \noportunidad de ejercer el derecho de controvertir una decisión, para que la administración, previa su \nevaluación la confirme, aclare, modifique o revoque. \nEs deber de la administración decidir en derecho el acto impugnado, habiéndose ejercido en \noportunidad legal la contradicción, que no solamente garantiza conocer las decisiones de la \nadministración sino también la oportunidad de controvertir por el medio de defensa aludido. \nRevisada la normativa relacionada sobre la oportunidad y requisitos, se precisa que contra la \nResolución 1350 del 21 de junio de 2022, que otorgó Licencia Ambiental Global a la sociedad \nINTEROIL COLOMBIA EXPLORATION AND PRODUCTION, para el proyecto denominado \n“Explotación de Hidrocarburos en el Campo Vikingo del Bloque Lla-47”, es procedente el recurso de \nreposición, sobre el cual se procede a verificar el cumplimiento de los requisitos legales para su \ninterposición. \n\nResolución No.  01910           Del   08 de septiembre de 2022            Hoja No. 4 de 39\n“Por la cual se Resuelve el Recurso de Reposición interpuesto contra la Resolución 01350 del 21 de \njunio de 2022”\nOficinas: Carrera 13 A No. 34 – 72 Edificio 13 35 Pisos 8 al 11 Bogotá, D.C.\nCentro de Orientación y Radicación de Correspondencia: Carrera 13 A No. 34 – 72 Edificio 13 35 \nLocales 110 al 112 Bogotá, D.C.  \nCódigo Postal 110311156\nNit.: 900.467.239-2\nLínea de Orientación y Contacto Ciudadano: 57 (1) 2540100 / 018000112998 PBX: 57 (1) 2540111\nwww.anla.gov.co    Email: licencias@anla.gov.co  \nPágina 4 de 39\nQue la sociedad INTEROIL COLOMBIA EXPLORATION AND PRODUCTION, presentó el 8 de julio \nde 2022, recurso de reposición contra la Resolución 1350 del 21 de junio de 2022, constatándose que \nse radicó dentro de los diez (10) días hábiles siguientes a la fecha de dicha notificación, la cual fue el \n22 de junio de 2022, es decir, tal como se consagra en el artículo 76 de la Ley 1437 de 2011.\nEl recurso de reposición fue interpuesto por quién cuenta con la capacidad legal para adelantar la \nactuación, a su vez, el escrito contiene los motivos de inconformidad y el lugar de notificación, por lo \ntanto, se considera que reúne los requisitos de ley para que el mismo sea resuelto por esta Autoridad. \nDe otro lado, es preciso señalar que dentro del escrito del recurso de reposición no se solicitó práctica \nde pruebas ni se decretaron de oficio por parte de la Autoridad.\nAsí las cosas, y habiéndose acreditado el cumplimento de las exigencias previstas para la procedencia \ndel recurso de reposición, esta Autoridad procederá a resolver el mismo; con base en lo evaluado y \nanalizado mediante el Concepto Técnico 05417 del 07 de septiembre de 2022, indicando las \ndecisiones cuestionadas, las peticiones, los argumentos expuestos por el recurrente, y los \nfundamentos de esta Autoridad. \nCONSIDERACIONES Y ANÁLISIS DEL RECURSO DE REPOSICIÓN INTERPUESTO POR LA \nSOCIEDAD INTEROIL COLOMBIA EXPLORATION AND PRODUCTION\nA continuación, se presenta el análisis del recurso de reposición interpuesto por la sociedad \nINTEROIL COLOMBIA EXPLORATION AND PRODUCTION, en adelante “la Sociedad”, por medio \ndel radicado 2022140398-1-000 del 8 de julio de 2022.\n1. RESPECTO DE LO DISPUESTO EN EL ARTÍCULO NOVENO DE LA RESOLUCIÓN 1350 DEL 21 DE \nJUNIO DE 2022.\nARTÍCULO NOVENO. Establecer la siguiente zonificación de manejo ambiental para el proyecto \n“Explotación de Hidrocarburos en el Campo Vikingo del Bloque Lla-47”, de conformidad con lo expuesto en \nla parte motiva del presente acto administrativo:\nTabla 79 Zonificación de manejo ambiental \nÁREAS DE INTERVENCIÓN\n- Cobertura de la tierra de explotación de hidrocarburos\nÁREAS DE EXCLUSIÓN\n- Franjas de protección de nacimientos de 100 metros, dentro del cual se incluye el punto identificado como el nacimiento del \ncaño Las Queseras, identificado por la Sociedad en las coordenadas planas Datum Magna Sirgas – Origen Nacional Este: \n5.186.917,871 y Norte: 2.106.982,888.\n- Franja de retiro de 30 metros a jagüeyes, tanques de agua y/o estanques piscícolas, caños o quebradas, lagunas, lagos, \nciénagas naturales, y meandros y otros cuerpos de agua lenticos y lóticos, haciendo la precisión que, para el caño Pirito esta \nexclusión no es aplicable, por ser un cuerpo de agua construido por la comunidad, para la recolección de las aguas que caen \nen la sabana en épocas de lluvia.   \n- Otra infraestructura petrolera o industrial existente en el área y su distancia de protección de 50 metros (Resolución 18-1495 \nde 2009), de la cual la Sociedad no presenta alguna intervención relacionada con las actividades del Proyecto, dentro de la \ncual se deben considerar:\nCaño Duya 1, coordenadas planas Datum Magna Sirgas – Origen Nacional E: 5179175,0427 N: 2104773,10332 el \ncual actualmente se encuentra inactivo. \nCaño Duya 2, coordenadas planas Datum Magna Sirgas – Origen Nacional E: 5180052,98787 N: 2105385,75492 el \ncual actualmente es un pozo productor.\nPozo Cocoa, coordenadas planas Datum Magna Sirgas – Origen Nacional E: 5200021,84036 N: 2103156,33859.\nPozo Oropéndola 1, coordenadas planas Datum Magna Sirgas – Origen Nacional E: 5180214,72858 N: \n2113405,91866 el cual actualmente es un pozo inactivo.\nParavare 1, coordenadas planas Datum Magna Sirgas – Origen Nacional E: 5171643,5273 N: 2119653,15924 el cual \nactualmente es un pozo inactivo. \nParavare 2, coordenadas planas Datum Magna Sirgas – Origen Nacional E: 5171573,19595 N: 2119697,93983 el cual \nactualmente es un pozo Productor.\n- Unidades geomorfológicas identificadas en la caracterización como Planicie de inundación (Fpdi), delta de desborde (Fddb) \n\nResolución No.  01910           Del   08 de septiembre de 2022            Hoja No. 5 de 39\n“Por la cual se Resuelve el Recurso de Reposición interpuesto contra la Resolución 01350 del 21 de \njunio de 2022”\nOficinas: Carrera 13 A No. 34 – 72 Edificio 13 35 Pisos 8 al 11 Bogotá, D.C.\nCentro de Orientación y Radicación de Correspondencia: Carrera 13 A No. 34 – 72 Edificio 13 35 \nLocales 110 al 112 Bogotá, D.C.  \nCódigo Postal 110311156\nNit.: 900.467.239-2\nLínea de Orientación y Contacto Ciudadano: 57 (1) 2540100 / 018000112998 PBX: 57 (1) 2540111\nwww.anla.gov.co    Email: licencias@anla.gov.co  \nPágina 5 de 39\ny cuenca de decantación (Fcd). \n- Pendientes mayores a 12 %, identificadas en la caracterización como terrenos fuertemente inclinados y terrenos ligeramente \nempinados. \n- Unidades geológicas caracterizadas como Depósitos aluviales limo-arcillosos (Qal lim-Arc), unidad asociada a los planos de \ninundación del área de influencia y los depósitos aluviales arcillosos (Qal Arc), unidad asociada a las áreas donde por su \ncomposición, la infiltración del agua es lenta y las últimas en evacuar el agua acumulada por crecientes o lluvias. \n- Unidad de suelo denominada suelo RVA, RVB, RVC y RVE, por su susceptibilidad extremadamente alta a la erosión y, las \nunidades de suelo CAN y CAA por ser unidades propensas a presentar inundaciones.\n- Unidad de paisaje UP30, asociadas a las coberturas de bosque de galería y/o ripario en planicie de inundación.\n- Áreas en categoría de vulnerabilidad según la Lista Roja de Ecosistemas.\n- Áreas susceptibles a la inundación con un índice de vulnerabilidad del territorio alta.  \n- Ecosistemas de humedales identificados en la capa de Humedales V3 2020 (Ecosistemas Acuáticos 2015).\n- Áreas priorizadas para la conservación CONPES 3680 de 2010 definidas como “bosques naturales del peinobioma de la \nAmazonia y Orinoquia” en categoría de “alta insuficiencia y urgente prioridad”.\n- Áreas definidas como prioritarias de conservación de la biodiversidad definida como “bosque y sabanas Orocué del Sistema \nde Información Ambiental de Colombia - SIAC.\n- Área susceptible a procesos de restauración ecológica definida dentro de la capa “Portafolio de Restauración del Registro \nde Ecosistemas y Áreas Ambientales” del SIAC.\n- Áreas de alto valor de conservación según la capa de WWF 2011.\n- Áreas de alta representatividad ecosistémica según el Instituto de Hidrología, Meteorología y Estudios Ambientales – IDEAM.\n- Áreas con erosión moderada de tipo hídrico y clase laminar identificadas en la capa de zonificación de degradación de suelos \npor erosión del SIAC.\n- Áreas o figuras de protección establecidas en el EOT del municipio de Orocué.\n- Bosque de galería y/o ripario.\n- Herbazal denso de tierra firme no arbolado.\n- Herbazal denso de tierra firme arbolado.\n- Herbazal denso inundable no arbolado.\n- Herbazal denso inundable arbolado.\n- Vegetación secundaria alta.\n- Vegetación secundaria baja.\n- Tierras desnudas y degradadas.\n- Canales.\n- Cuerpos de agua artificiales.\n- Las viviendas y el tejido urbano discontinuo y demás infraestructura social tal como establecimientos educativos, centros de \nculto religioso, salones o casetas comunales, infraestructura recreativa, entre otros, y su ronda mínima de protección de 100 \nmetros.\nÁREAS DE INTERVENCIÓN CON RESTRICCIONES\nDESCRIPCIÓN DEL ÁREA\nRESTRICCIONES\n- Pendientes menores a 12 %, identificadas en la \ncaracterización como terrenos a nivel hasta terrenos \nmoderadamente inclinados.  \n- \nUnidades \ngeomorfológicas \nidentificadas \nen \nla \ncaracterización como Dique o albordón (Fa) y Terraza \naluvial (Fta).\n- Unidades geológicas caracterizadas como Depósitos \naluviales actuales areno-limosos (Q2al Are-lim), Depósitos \naluviales areno-limosos (Q1al Are-lim), Depósitos aluviales \nrecientes areno-gravoso (Q2al Are-G) y Depósitos de \nterraza aluvial (Qta). \n- Unidades de suelo denominadas ZVZ, dentro de la cual se \nencuentran las vías que hacen parte del área de influencia \ndel Proyecto y el área ya intervenida para la exploración de \nhidrocarburos.\nNo se podrá realizar ninguna intervención adicional a lo ya \nexistente. \nTodas las actividades aprobadas (mantenimiento de vías y \nlocación, transporte de hidrocarburos por carrotanques, \npruebas hidrostáticas, manejo de residuos, operación de \nfacilidades de producción y facilidades logísticas, \ngeneración de energía, entrega de residuos a terceros) solo \npodrán ser realizadas dentro de las áreas que se traslapen \ncon estos elementos y se encuentren intervenidas en la \netapa de exploración del Proyecto, es decir las coberturas \nindicadas dentro de la caracterización como ZVZ. \nPredios con extensión menor a 20 hectáreas (microfundios, \nminifundios y pequeña propiedad)\nEn los predios con tamaño menor a 20 hectáreas \n(microfundios, minifundios y pequeña propiedad), su \nintervención solo se podrá realizar previa autorización y/o \npermiso del propietario y se deberá garantizar que no dé \nlugar a la fragmentación de estos o afectación de alguna \nactividad de subsistencia (seguridad alimentaria). Se \npodrán realizar las actividades aprobadas para el proyecto \nconsiderando lo anteriormente mencionado.\nResguardo Indígena.\nLas \nactividades \nque \npodrán \nrealizarse \nserán \nexclusivamente las acordadas con esta comunidad en el \nmarco del proceso de consulta previa adelantado y avalado \npor la autoridad competente para el presente trámite\nFuente: Equipo Evaluador de la ANLA, 2022\n(…)”.\nPetición de la Sociedad\n\nResolución No.  01910           Del   08 de septiembre de 2022            Hoja No. 6 de 39\n“Por la cual se Resuelve el Recurso de Reposición interpuesto contra la Resolución 01350 del 21 de \njunio de 2022”\nOficinas: Carrera 13 A No. 34 – 72 Edificio 13 35 Pisos 8 al 11 Bogotá, D.C.\nCentro de Orientación y Radicación de Correspondencia: Carrera 13 A No. 34 – 72 Edificio 13 35 \nLocales 110 al 112 Bogotá, D.C.  \nCódigo Postal 110311156\nNit.: 900.467.239-2\nLínea de Orientación y Contacto Ciudadano: 57 (1) 2540100 / 018000112998 PBX: 57 (1) 2540111\nwww.anla.gov.co    Email: licencias@anla.gov.co  \nPágina 6 de 39\nAprobar la siguiente zonificación de manejo ambiental, teniendo en cuenta lo expuesto en el numeral V, \nliteral A (ver. Figura 14 y Tabla 5)\nTabla 4. Resumen Zonificación de Manejo Ambiental Propuesta para el Área de Influencia del Campo Vikingo\nÁREAS DE INTERVENCIÓN\n- Cobertura de la tierra de exploración de Hidrocarburos\nÁREAS DE EXCLUSIÓN\n- Franjas de protección de nacimientos de 100 metros, dentro del cual se incluye el punto identificado como el nacimiento del caño \nLas Queseras, identificado por la Sociedad en las coordenadas planas Datum Magna Sirgas – Origen Nacional Este: 5.186.917,871 \ny Norte: 2.106.982,888.\n \n- Franja de retiro de 30 metros a jagüeyes, tanques de agua y/o estanques piscícolas, caños o quebradas, lagunas, lagos, ciénagas \nnaturales, y meandros y otros cuerpos de agua lenticos y lóticos, haciendo la precisión que, para el caño Pirito esta exclusión no es \naplicable, por ser un cuerpo de agua construido por la comunidad, para la recolección de las aguas que caen en la sabana en épocas \nde lluvia. \n- Otra infraestructura petrolera o industrial existente en el área y su distancia de protección de 50 metros (Resolución 18-1495 de \n2009), de la cual la Sociedad no presenta alguna intervención relacionada con las actividades del Proyecto, dentro de la cual se deben \nconsiderar: \nCaño Duya 1, coordenadas planas Datum Magna Sirgas – Origen Nacional E: 5179175,0427 N: 2104773,10332 el cual \nactualmente se encuentra inactivo. \nCaño Duya 2, coordenadas planas Datum Magna Sirgas – Origen Nacional E: 5180052,98787 N: 2105385,75492 el cual \nactualmente es un pozo productor. \nPozo Cocoa, coordenadas planas Datum Magna Sirgas – Origen Nacional E: 5200021,84036 N: 2103156,33859. \nPozo Oropéndola 1, coordenadas planas Datum Magna Sirgas – Origen Nacional E: 5180214,72858 N: 2113405,91866 el cual \nactualmente es un pozo inactivo. \nParavare 1, coordenadas planas Datum Magna Sirgas – Origen Nacional E: 5171643,5273 N: 2119653,15924 el cual \nactualmente es un pozo inactivo. \nParavare 2, coordenadas planas Datum Magna Sirgas – Origen Nacional E: 5171573,19595 N: 2119697,93983 el cual \nactualmente es un pozo Productor.\n- Zonas de erosión y sedimentación activa.\n \n- Pendientes mayores a 25%, identificadas en la caracterización como terrenos fuertemente inclinados y terrenos ligeramente \nempinados. \n- Unidades de suelo clasificado como Clase VIII por capacidad de uso de las tierras\n \n- Áreas en categoría de vulnerabilidad según la Lista Roja de Ecosistemas.\n \n- Áreas susceptibles a la inundación con un índice de vulnerabilidad del territorio alta.\n \n- Ecosistemas de humedales identificados en la capa de Humedales V3 2020 (Ecosistemas Acuáticos 2015). \n \n- Áreas priorizadas para la conservación CONPES 3680 de 2010 definidas como “bosques naturales del peinobioma de la \nAmazonia y Orinoquia” en categoría de “alta insuficiencia y urgente prioridad”. \n- Áreas definidas como prioritarias de conservación de la biodiversidad definida como “bosque y sabanas Orocué del Sistema de \nInformación Ambiental de Colombia - SIAC. \n- Área susceptible a procesos de restauración ecológica definida dentro de la capa “Portafolio de Restauración del Registro de \nEcosistemas y Áreas Ambientales” del SIAC. \n- Áreas de alto valor de conservación según la capa de WWF 2011.\n \n- Áreas de alta representatividad ecosistémica según el Instituto de Hidrología, Meteorología y Estudios Ambientales – IDEAM. \n- Áreas con erosión moderada de tipo hídrico y clase laminar identificadas en la capa de zonificación de degradación de suelos por \nerosión del SIAC. \n- Áreas o figuras de protección establecidas en el EOT del municipio de Orocué.\n \n- Bosque de galería y/o ripario.\n \n- Vegetación secundaria alta.\n \n- Vegetación secundaria baja.\n \n- Tierras desnudas y degradadas.\n\nResolución No.  01910           Del   08 de septiembre de 2022            Hoja No. 7 de 39\n“Por la cual se Resuelve el Recurso de Reposición interpuesto contra la Resolución 01350 del 21 de \njunio de 2022”\nOficinas: Carrera 13 A No. 34 – 72 Edificio 13 35 Pisos 8 al 11 Bogotá, D.C.\nCentro de Orientación y Radicación de Correspondencia: Carrera 13 A No. 34 – 72 Edificio 13 35 \nLocales 110 al 112 Bogotá, D.C.  \nCódigo Postal 110311156\nNit.: 900.467.239-2\nLínea de Orientación y Contacto Ciudadano: 57 (1) 2540100 / 018000112998 PBX: 57 (1) 2540111\nwww.anla.gov.co    Email: licencias@anla.gov.co  \nPágina 7 de 39\n \n- Canales.\n \n- Cuerpos de agua artificiales.\n \n- Las viviendas y el tejido urbano discontinuo y demás infraestructura social tal como establecimientos educativos, centros de culto \nreligioso, salones o casetas comunales, infraestructura recreativa, entre otros, y su ronda mínima de protección de 100 metros.\nÁREAS DE INTERVENCIÓN CON RESTRICCIONES\nRESTRICCIÓN ALTA\n- Herbazal denso de tierra firme no arbolado.\n- Herbazal denso de tierra firme arbolado.\n \n- Herbazal denso inundable no arbolado.\n \n- Herbazal denso inundable arbolado.\n \n- Pendientes menores a 25 %, identificadas en la caracterización como terrenos a nivel hasta terrenos moderadamente inclinados \n \n- Unidad de suelo denominada suelo RVA, RVB, RVC y RVE y CAA\n \n- Unidad de paisaje UP30, asociadas a coberturas de Herbazal denso inundable no arbolado en Planicie de inundación\nFigura 14. Zonificación de Manejo Ambiental Propuesta para el Área de Influencia del Campo\nVikingo\n\nResolución No.  01910           Del   08 de septiembre de 2022            Hoja No. 8 de 39\n“Por la cual se Resuelve el Recurso de Reposición interpuesto contra la Resolución 01350 del 21 de \njunio de 2022”\nOficinas: Carrera 13 A No. 34 – 72 Edificio 13 35 Pisos 8 al 11 Bogotá, D.C.\nCentro de Orientación y Radicación de Correspondencia: Carrera 13 A No. 34 – 72 Edificio 13 35 \nLocales 110 al 112 Bogotá, D.C.  \nCódigo Postal 110311156\nNit.: 900.467.239-2\nLínea de Orientación y Contacto Ciudadano: 57 (1) 2540100 / 018000112998 PBX: 57 (1) 2540111\nwww.anla.gov.co    Email: licencias@anla.gov.co  \nPágina 8 de 39\nArgumentos de la Sociedad\nA. ZONIFICACIÓN DE MANEJO AMBIENTAL\nTeniendo en cuenta lo dispuesto por la ANLA en el Artículo Noveno de la Resolución No. 01350 del 21 de \njunio de 2022, en relación con la Zonificación de Manejo Ambiental, es menester de INTEROIL señalar que, \nal revisar Zonificación de Manejo Ambiental elaborada por la ANLA, y que se presenta por esta autoridad \nen la Figura 49 del acto administrativo en mención, se identifican incongruencias que limitan la operación \ndel proyecto como se evidencia a continuación.\n➢ Criterio asociado con la pendiente \nLa ANLA, al considerar que todas las pendientes que sean mayores al 12 % deben ser identificadas como \nzonas de exclusión, incluyó como un área de exclusión un pequeño tramo de la vía de acceso a la plataforma \nVikingo que atraviesa la vía de lado a lado como se puede observar en la figura que se presenta a \ncontinuación:\nTabla 1. Áreas de exclusión asociado a pendientes mayores al 12%\nLa interpretación y análisis realizado por la ANLA, respecto al criterio asociado a las pendientes estaría \nlimitando el uso de un pequeño tramo de la vía en desarrollo de las actividades del proyecto, condición que \nimposibilitaría el desarrollo del proyecto toda vez que impediría el tránsito por la vía, el desarrollo de \nactividades de mantenimiento rutinario y permanente de esta.\nEl análisis de las pendientes del terreno desarrollado a partir del procesamiento digital y categorización de \nModelos Digitales de Elevación (DEM), arrojó como resultado que el Área de Influencia del Campo Vikingo \nexhibe un relieve con laderas planas a ligeramente escarpadas, de 0% al 50%, lo que corresponde con un \nterreno con pendientes de 0° a máximo 26° de inclinación (ver Figura 1).\nDe acuerdo con lo anterior, se observa un predominio de laderas con pendientes del 3% a 7%, seguidos de \npendientes del 7% al 12%, del 1% a 3%, y del 0% al 1%, que corresponden a pendientes típicas en los \nterrenos asociados con un ambiente morfogenético fluvial. Se observa además que para el Área de \nInfluencia del Campo Vikingo no se identifican terrenos con pendientes mayores al 50% de inclinación (ver \nTabla 2).\nTabla 2. Pendientes del terreno para el Área de Influencia del Campo Vikingo\nPendiente\nInclinación (%)\nÁrea (Ha)\nÁrea (%)\nAA nivel l\n0 – 10 – 1\n943,71\n9,909,90\nLigeramente plana \n1 – 3\n416,0416,088\n4,37 \nLigeramente inclinada\n3 – 7\n5638,88\n59,16\nModeradamente inclinada\n7 – 12\n2305,11\n24,18 \n\nResolución No.  01910           Del   08 de septiembre de 2022            Hoja No. 9 de 39\n“Por la cual se Resuelve el Recurso de Reposición interpuesto contra la Resolución 01350 del 21 de \njunio de 2022”\nOficinas: Carrera 13 A No. 34 – 72 Edificio 13 35 Pisos 8 al 11 Bogotá, D.C.\nCentro de Orientación y Radicación de Correspondencia: Carrera 13 A No. 34 – 72 Edificio 13 35 \nLocales 110 al 112 Bogotá, D.C.  \nCódigo Postal 110311156\nNit.: 900.467.239-2\nLínea de Orientación y Contacto Ciudadano: 57 (1) 2540100 / 018000112998 PBX: 57 (1) 2540111\nwww.anla.gov.co    Email: licencias@anla.gov.co  \nPágina 9 de 39\nFuertemente inclinada\n12 – 25\n2,37\nLigeramente escarpada\n25 – 50\n1,46\n0,02 \nModeradamente \nescarpada\n50 – 75\n---\n--\nFuertemente escarpada\n75 – 100\n--\n-\nTotalmente escarpada\n>100\n-\n- \n9531,33\n100,00\nFuente: Interoil. 2021\nPor lo anterior, se considera que las pendientes de 12% a 25% en la Orinoquia no son un criterio para \nconsiderar áreas de exclusión en la zonificación de manejo ambiental, dado que estas pendientes (12% al \n25%) que representan el 2,37% se reparten en casi toda la totalidad del Área de Influencia del Campo \nVikingo, y su única expresión marcada se localiza en el extremo nororiental del AI, asociada con zonas \nonduladas sobre geoformas de terrazas aluviales, las cuales son las de menor grado de susceptibilidad a la \ninundación, ya que estas por tener una elevación mayor respecto al terreno circundante no se ven afectadas \npor los procesos de desbordamiento lateral periódicos propios del área donde se localiza el proyecto (ver \nFigura 2).\nTampoco se considera que las pendientes del 12% al 25% puedan jugar un papel importante en el desarrollo \nde otros fenómenos como el desarrollo de procesos de remoción en masa, ya que estas pendientes en las \nmetodologías de amenazas por remoción en masa por lo general son calificadas con susceptibilidad \nmoderada. \nPor todo lo anterior se encuentran insuficientes los criterios para considerar las pendientes del 12% al 25%, \npresentes en el Área de Influencia del Campo Vikingo como zonas de exclusión, y se solicita valorarlas \ncomo de Media Restricción.\nAdicionalmente, el parámetro pendiente fue evaluado dentro del contexto de la zonificación geotécnica, el \ncual es uno de los elementos utilizados en la elaboración de la zonificación ambiental, por lo cual se \nconsidera que se le estaría dando doble calificación al elemento pendiente al utilizarlo directamente para \ngenerar zonas de cualquier categoría en la zonificación ambiental y así mismo en la zonificación de manejo.\nTeniendo en cuenta lo anteriormente expuesto, se solicita a la Autoridad establecer las pendientes entres \n12-25% como alta restricción en la zonificación ambiental, al considerar que no hay suficientes motivos de \nvalorarlo como de exclusión, además de que esta exclusión traería implicaciones en el desarrollo de las \nactividades de operaciones del proyecto al cual se le otorgó la licencia global de explotación. Para lo cual \nen la Figura 3 se presenta la zonificación ambiental propuesta para de acuerdo a las condiciones de \npendiente del área de influencia del proyecto, colocando únicamente las áreas con pendientes superiores a \n25% como de exclusión. Así mismo y considerando que las actividades del proyecto involucrados en la \nLicencia Ambiental aprobaron la vía de acceso existente a la locación y las operaciones en la locación \nexistente, se solicita que tanto la vía de acceso como el área que circunscribe a la locación sean valoradas \ncomo Áreas de Intervención.\nCriterio asociado con geología y geomorfología\nDe las consideraciones para la Zonificación Ambiental y la Zonificación de Manejo por parte del Equipo \nEvaluador de la ANLA, se considera excesivo la calificación de algunas unidades geológicas, \ngeomorfológicas y algunas categorías de pendientes como zonas de exclusión, ya que si bien se entiende \nla alta sensibilidad ambiental del área donde se localiza el proyecto, y la importancia en cuanto a la relación \nde los tres medios (abiótico, biótico y socioeconómico), que encierran desde el componente geológico y \ngeomorfológico, la conformación del terreno tanto en su composición (litología), como en su distribución y \nforma (morfografía y morfología), no se comparte la consideración de algunos elementos como área de \nexclusión.\nUnidades Geomorfológicas \nDe la clasificación de las unidades geomorfológicas se obtuvo que el Área de Influencia del Campo Vikingo \nse localiza sobre la geomorfoestructura del Sistema de planicies precratónicas, la cual se localiza sobre la \nprovincia geomorfológica de las Peniplanicies de la Orinoquia. Para el área de influencia del proyecto se \nidentificó que todas las geoformas presentes se asocian con el ambiente morfogenético Fluvial, el cual \ngenera una región denominada Llanura aluvial de desborde; finalmente, se identificaron dos unidades \n\nResolución No.  01910           Del   08 de septiembre de 2022            Hoja No. 10 de 39\n“Por la cual se Resuelve el Recurso de Reposición interpuesto contra la Resolución 01350 del 21 de \njunio de 2022”\nOficinas: Carrera 13 A No. 34 – 72 Edificio 13 35 Pisos 8 al 11 Bogotá, D.C.\nCentro de Orientación y Radicación de Correspondencia: Carrera 13 A No. 34 – 72 Edificio 13 35 \nLocales 110 al 112 Bogotá, D.C.  \nCódigo Postal 110311156\nNit.: 900.467.239-2\nLínea de Orientación y Contacto Ciudadano: 57 (1) 2540100 / 018000112998 PBX: 57 (1) 2540111\nwww.anla.gov.co    Email: licencias@anla.gov.co  \nPágina 10 de 39\ngeomorfológicas, que se subdividen en 3 subunidades y a su vez estas se subdividen en cinco componentes \ngeomorfológicos (ver Tabla 3).\nSe observa entonces un esquema generalizado (ver Figura 4), en el cual los componentes geomorfológicos \nde mayor susceptibilidad a la inundación claramente corresponden a los identificados por el Equipo \nevaluador ANLA (planicie de inundación – Fpdi, Delta de desborde – Fddb y cuenca de decantación – Fcd); \nsin embargo, no se comparte la consideración de tratar toda la extensión del área de estos elementos \ngeomorfológicos como zonas de exclusión, ya que la configuración actual del relieve no obedece solamente \na los procesos actuales, sino que son el resultado de la modificación de la superficie de la tierra por la acción \nde eventos exógenos y endógenos en el transcurso de miles o incluso millones de años, los cuales para la \nconfiguración del terreno en el área donde se localiza el proyecto son el resultado de como mínimo los \neventos que han afectado el relieve durante el último periodo geológico que corresponde con el periodo \nCuaternario, el cual empezó hace 2,59 millones de años.\nLo anterior para hacer referencia a que no es un sustento claro el determinar la extensión total de una unidad \ngeomorfológica como una zona de exclusión, ya que si bien toda la extensión del elemento geomorfológico \ncomparte características similares en cuanto a su morfogénesis y morfología, lo que quiere decir que toda \nla unidad ha sido formada por eventos geológicos y morfodinámicos similares, no toda la extensión del \nelemento geomorfológico está expuesta en la actualidad a los mismos eventos morfodinámicos que lo formó.\nEn el EIA, a solicitud de la ANLA como información adicional, se presentó como complemento del análisis \ngeomorfológico, el análisis de las zonas de erosión y sedimentación activas, las cuales sí reflejan el \ncompartimiento de los procesos morfodinámicos actuales, los cuales podrían ser un factor determinante \nmás claro para considerar posibles áreas de exclusión, siendo estas áreas las que en las últimas décadas \nhan estado realmente expuestas a los eventos dinámicos modeladores del relieve.\nEn el análisis que fue desarrollado por medio de la interpretación de las imágenes satelitales adquiridas \npara el desarrollo del proyecto, se observa una clara relación del desarrollo de procesos erosivos sobre el \nárea del elemento geomorfológicos Delta de desborde (Fddb), y así mismo la dominancia de procesos de \nsedimentación activa sobre áreas del elemento geomorfológico Cuenca de decantación (Fcd) y planicie de \ninundación (Fpdi), observando además que claramente estos procesos no cubren la totalidad del área de \nlos elementos geomorfológicos. Quedando claro que sobre estos elementos sí se desarrollan procesos de \ninundación periódica con desbordes laterales, propios de del área donde se localiza el proyecto, pero que \nestos procesos no afectan la totalidad del área de estas geoformas.\nDe acuerdo con lo anterior, se observa que las áreas de erosión y sedimentación activa en el Área de \nInfluencia del proyecto son de gran importancia, asociadas a eventos periódicos, relacionados con el \ncomportamiento natural de estas zonas clasificadas como llanuras de desborde, en las cuales las \ninundaciones relacionadas con las temporadas lluviosas, generan desbordamiento lateral de las corrientes \nde agua que recorren el área, observando además que estos procesos no cubren la totalidad de las \ngeoformas consideradas como áreas de exclusión por parte del Equipo evaluador ANLA.\nSe observa además que el área denominada como Área de Desarrollo y en la cual se localiza la \ninfraestructura del proyecto, no presenta afectación visible, por los procesos morfodinámicos ya \nmencionados, por su ubicación respecto a los cauces, las zonas de desbordamiento y las cuencas de \ndecantación, y también por intervenciones antrópicas del territorio que han generado que estas zonas se \nencuentren elevadas un par de metros de su entorno.\nTeniendo en cuenta lo anteriormente expuesto, se solicita a la Autoridad aceptar la propuesta de INTEROIL \nde establecer como exclusión las zonas de erosión y sedimentación activa, además de las zonas cubiertas \ncon bosque de galería (Figura 6) y establecer la Zonificación de Manejo Ambiental del componente \ngeomorfológico como se presenta en la Figura 7.\nUnidades Geológicas\nEn cuanto a las unidades geológicas, estas, de la misma forma que las unidades geomorfológicas, son el \nresultado para el caso del Área de Influencia del Campo Vikingo, de la acumulación de materiales detríticos \ndurante por lo menos la última serie geológica, la cual comenzó hace 11.700 años, y que recibe el nombre \n\nResolución No.  01910           Del   08 de septiembre de 2022            Hoja No. 11 de 39\n“Por la cual se Resuelve el Recurso de Reposición interpuesto contra la Resolución 01350 del 21 de \njunio de 2022”\nOficinas: Carrera 13 A No. 34 – 72 Edificio 13 35 Pisos 8 al 11 Bogotá, D.C.\nCentro de Orientación y Radicación de Correspondencia: Carrera 13 A No. 34 – 72 Edificio 13 35 \nLocales 110 al 112 Bogotá, D.C.  \nCódigo Postal 110311156\nNit.: 900.467.239-2\nLínea de Orientación y Contacto Ciudadano: 57 (1) 2540100 / 018000112998 PBX: 57 (1) 2540111\nwww.anla.gov.co    Email: licencias@anla.gov.co  \nPágina 11 de 39\nde Holoceno. Esto quiere decir que los materiales presentes en el Área de Influencia del Campo Vikingo, no \nrepresentan la dinámica actual del área, si no que representan el resultado de los eventos geológicos de los \nultima decena de miles de años, por lo cual así como las unidades geomorfológicas, resulta demasiado \narbitrario utilizar la totalidad del área de una unidad geológica como zonas de exclusión, aun cuando no se \nha demostrado que allá una relación entre zonas de mayor sensibilidad ambiental o de menor sensibilidad \nen respuesta al tipo de materiales litológicos que las conforman.\nSe podría hablar de una zona de exclusión cuando el material en particular de una unidad geológica, brinda \nsustento a un tipo de ecosistema especifico de alta sensibilidad; pero para el caso del Área de Influencia del \nCampo Vikingo, la totalidad del área está conformada por materiales detríticos, es decir sedimentos \ngenerados por la erosión de otras unidades geológicas, que son erodados y transportados principalmente \npor acción del agua y el viento, y luego depositados por cambios en la energía de los cuerpos de agua que \nlos transportan.\nRespecto a todo lo anteriormente expuesto, no se observa suficiente sustento para determinar unidades \ngeológicas como zonas de exclusión, por la homogeneidad de los materiales que conforman el Área de \nInfluencia del Campo Vikingo, encontrando que no hay una diferencia notable más allá de la granulometría \nde las unidades, lo cual no se ve como una variable diferenciable entre un depósito u otro, ya que todos \nestán conformados por el mismo tipo de materiales provenientes de la erosión de los materiales de la \nCordillera Oriental y de su piedemonte.\n  \nEl equipo evaluador ANLA, considera las unidades geológicas asociadas con las geoformas de planicie de \ninundación y cuenca de decantación como áreas de exclusión, en especial los sedimentos asociados con \nla geoforma de cuenca de decantación por ser áreas donde la infiltración es lenta y corresponden con las \nultimas áreas en evacuar el agua acumulada en crecientes y en épocas de lluvias; sin embargo, se evidencia \nque estos fenómenos en donde el agua de lluvias o de crecientes permanece mayor tiempo estancada, \ncorresponde con las mismas áreas donde se desarrollan los procesos de sedimentación activa.\nPor lo cual, se estima que de la misma forma que no toda el área de las unidades geomorfológicas se debe \nconsiderar como zonas de exclusión por no ser afectada en su totalidad por procesos de sedimentación \nactiva, del mismo modo se puede aplicar para las unidades geológicas en donde de acuerdo con todo lo \nanteriormente explicado, y lo expuesto en el apartado de geomorfología, no se debe considerar toda la \nextensión de una unidad geológica como áreas de exclusión.\nTeniendo en cuenta lo anteriormente expuesto, se solicita a la Autoridad aceptar la Zonificación de Manejo \nAmbiental propuesta para el componente de geología en el EIA entregado para obtención de la licencia \nambiental (Figura 9).\nCriterio asociado con las unidades de suelo\nEl abordar las clases por capacidad de uso de las tierras, nos infiere cual es el manejo adecuado que se le \npuede dar a los suelos. No obstante, esto no significa que las tierras no puedan ser utilizadas para un fin, \npor el contrario, con medidas de manejo adecuadas pueden ser empleadas para una finalidad específica. \nPor ello cuando se lleva a cabo una zonificación ambiental es importante conocer las características \nprincipales de la clase agrologica y cómo repercute su uso con el medio. A continuación, se explica las \nprincipales características y diferencias entre la clase VII y VIII según normas adaptadas por IGAC.\n“CLASE VII: Tierras fuertemente onduladas a escarpadas con pendientes del (50%-75%). (…) Por las \nlimitaciones que presenta esta clase, el uso se limita principalmente a la vegetación forestal y en áreas de \npendientes menos abruptas a potreros con manejo adecuado. En general requieren buen manejo, \nespecialmente en relación con la conservación de las cuencas hidrográficas.” \nLo anterior no significa que la clase agrologica VII no se pueda utilizar, por el contrario, son tierras que tiene \nque tener un manejo especial para evitar el deterioro o daño de los recursos naturales. Por tal motivo pueden \nser empleadas y en pendientes ligeramente planas a planas se utilizan para manejo de potreros con un \nbuen manejo.  Esta clase se encuentra ocupando un área de 9384,20 ha equivalente a l 98,46%. Como se \nlogra inferir de lo anteriormente expuesto, esta clase agrologica no implica conservación como lo representa \nla clase VIII que se explica a continuación.\n\nResolución No.  01910           Del   08 de septiembre de 2022            Hoja No. 12 de 39\n“Por la cual se Resuelve el Recurso de Reposición interpuesto contra la Resolución 01350 del 21 de \njunio de 2022”\nOficinas: Carrera 13 A No. 34 – 72 Edificio 13 35 Pisos 8 al 11 Bogotá, D.C.\nCentro de Orientación y Radicación de Correspondencia: Carrera 13 A No. 34 – 72 Edificio 13 35 \nLocales 110 al 112 Bogotá, D.C.  \nCódigo Postal 110311156\nNit.: 900.467.239-2\nLínea de Orientación y Contacto Ciudadano: 57 (1) 2540100 / 018000112998 PBX: 57 (1) 2540111\nwww.anla.gov.co    Email: licencias@anla.gov.co  \nPágina 12 de 39\n“CLASE VIII: Tierras con las más severas limitaciones para el uso; pendientes muy escarpadas (>75%); \nerosión severa a muy severa; piedras y rocas en la superficie en más del 90% del área; suelos muy \nsuperficiales; fuertemente salinos o sódicos. En esta clase se incluyen las áreas pantanosas e inundables \npor más de 8 meses/año, las localizadas a más de 4.000 mts de altitud, páramos y las playas de arenas y \nmanglares sin posibilidad de utilización agropecuaria. Debe protegerse la vegetación natural existente con \nmiras a la conservación de las cuencas hidrográficas y la vida silvestre.”\nAl contrario de la anterior clase agrologica, esta sí presenta restricciones para cualquier tipo de manejo o \nuso. Por tal razón la clase agrologica VIII solamente puede ser utilizada para conservación. Esta clase se \nencuentra ocupando un área de 29,56 ha correspondiente al 0,31%.\nTeniendo en cuenta lo anteriormente expuesto, se solicita a la Autoridad establecer como exclusión en la \nzonificación de manejo ambiental solo la clase agrológica VIII (Figura 10) y aceptar lo Zonificación de Manejo \npropuesta en la Figura 11.\nCriterio asociado con las coberturas\nDe acuerdo con la parte considerativa de la Resolución No. 01350 del 21 de junio de 2022, se solicita a la \nAutoridad Nacional de Licencias Ambientales, ajustar el ARTICULO NOVENO correspondiente a la \nZonificación Ambiental, en el sentido de recategorizar las unidades de cobertura de la tierra Herbazal denso \nde tierra firme no arbolado, Herbazal denso de tierra firme arbolado, Herbazal denso inundable no arbolado \ny Herbazal denso inundable arbolado, a la categoría ÁREAS DE INTERVENCIÓN CON RESTRICCIONES, \nesto teniendo en cuenta que la Autoridad Nacional realizó una sobrevaloración en cuanto a la sensibilidad \nambiental de estas unidades de cobertura, dado el estado actual y la dinámica regional y ecológica de éstas \nen la región, de manera que al realizar el análisis en la Zonificación de Manejo Ambiental, se incluyeron \nestas coberturas en la categoría de exclusión en la cual no es viable desarrollar futuras obras y actividades \ndel proyecto.\nAl realizar el análisis de la sensibilidad ambiental de estas unidades de coberturas, es posible identificar que \nlas coberturas Herbazal denso de tierra firme no arbolado, Herbazal denso de tierra firme arbolado, Herbazal \ndenso inundable no arbolado y Herbazal denso inundable arbolado presentan una potencialidad y fragilidad \nAlta y una sensibilidad Media, consideradas de esta manera por ser coberturas representativas de la \nsabana, constituidas por una comunidad vegetal dominada por elementos naturales herbáceos, que si bien \nson naturales, no se observa una variación significativa a nivel estructural en cuanto el tipo de vegetación, \npues su composición florística se encuentra representada principalmente por especies herbáceas y en \nalgunos casos con elementos arbustivos y/o arbóreos dispersos; adicionalmente, estas unidades de \ncobertura presentan una destinación ganadera a nivel regional.\nPor otra parte, y de acuerdo con la caracterización realizada para el medio biótico-componente fauna \nsilvestre, los herbazales fueron la unidad de cobertura donde se registraron menos especies para el grupo \nde mamíferos con cuatro (4) especies y para anfibios no se registran; para el grupo de reptiles se asocian \nseis (6) especies, donde en su mayoría de destacan especies de hábitos generalistas.\nCabe resaltar que si bien estas unidades de cobertura son de importancia ecológica, no existen \ndeterminantes ambientales de tipo jurídico que impidan el desarrollo de actividades en estas, por lo que en \nlínea con la caracterización ambiental y el análisis de sensibilidad  se identificó que estas unidades \npresentan un potencial y fragilidad Alta, así como una sensibilidad Alta/Media, de modo que pueden ser \nincluidas en la Zonificación de Manejo en la categoría ÁREAS DE INTERVENCIÓN CON \nRESTRICCIONES.\nTeniendo en cuenta lo anteriormente expuesto, se solicita a la Autoridad establecer las coberturas Herbazal \ndenso de tierra firme no arbolado, Herbazal denso de tierra firme arbolado, Herbazal denso inundable no \narbolado y Herbazal denso inundable arbolado como Alta Restricción en la Zonificación de Manejo \nAmbiental. En la Figura 12 se presentan las coberturas que se propone deben ser consideradas como de \nexclusión en la zonificación de manejo y en la Figura 13 se encuentra la Zonificación propuesta para las \ncoberturas de la tierra del área de influencia del Campo Vikingo.\n\nResolución No.  01910           Del   08 de septiembre de 2022            Hoja No. 13 de 39\n“Por la cual se Resuelve el Recurso de Reposición interpuesto contra la Resolución 01350 del 21 de \njunio de 2022”\nOficinas: Carrera 13 A No. 34 – 72 Edificio 13 35 Pisos 8 al 11 Bogotá, D.C.\nCentro de Orientación y Radicación de Correspondencia: Carrera 13 A No. 34 – 72 Edificio 13 35 \nLocales 110 al 112 Bogotá, D.C.  \nCódigo Postal 110311156\nNit.: 900.467.239-2\nLínea de Orientación y Contacto Ciudadano: 57 (1) 2540100 / 018000112998 PBX: 57 (1) 2540111\nwww.anla.gov.co    Email: licencias@anla.gov.co  \nPágina 13 de 39\nCriterio asociado a la posibilidad de ampliar y modificar la licencia global actual en el futuro\nSi bien INTEROIL solicitó con la actual licencia global del campo vikingo solo la operación del pozo vikingo \ncon la infraestructura existe (vía, locación y facilidades), en ningún momento la compañía con la obtención \nde esta licencia está renunciando a su intención de ampliar en un futuro las áreas de explotación actuales \ny con ello ampliar las áreas de operación, contemplando realizar a futuro la modificación de esta licencia \nglobal.  \nBajo este entendido, y teniendo en cuenta que para la ANLA las condiciones bajo las cuales se otorgó la \npresente licencia global serán un antecedente importante para cualquier proceso futuro que se lleve a cabo, \nsolicitamos reconsiderar las áreas de exclusión presentadas por la ANLA que están conexas al proyecto.\nPor otra parte, de las áreas de exclusión se identificaron las siguientes inconsistencias en la Resolución de \nla ANLA: \n- Dentro del medio abiótico se menciona que INTEROIL no podrá realizar ningún tipo de intervención  \nadicional a lo ya existente además de otras unidades a la “unidad de Paisaje UP30, asociada a las \ncoberturas de bosques de galería y/o ripario en planicie de inundación”, no obstante en la página 75 de la \nResolución 01350 de 2022 por la cual se otorga una licencia Ambiente al Global, se menciona la unidad de \nPaisaje “UP30 como Herbazal denso inundable no arbolado en terraza aluvial”, por lo que no queda claro \npara Interoil, la unidad de paisaje que la autoridad incluye dentro de las zonas de exclusión consideradas. \nINTEROIL solicita a la Autoridad revisar las unidades de paisaje ya que, las coberturas de bosques de \ngalería y/o ripario no corresponden a la unidad UP30, esto conlleva a que, en la zonificación ambiental \npropuesta por la ANLA, la zona de exclusión abarque más del 90% del área de influencia del proyecto.\n- Teniendo en cuenta que el 98.54% del área, se encuentra dentro del elemento de corredor natural  \n(bosques) como se cita en el párrafo segundo de la página 76, y que a partir de esta distribución la autoridad \nconcluye que se trata de “un paisaje con pocos parches y con predominancia de conexiones entre sí”, sin \nembargo, en el párrafo 4 de la misma página se menciona que las “unidades UP29 y UP30, las cuales no \nse encuentran totalmente intervenidas y puede concluirse aceptarían cambios en el paisaje de manera \nmoderada sin interferir en un impacto significativo sobre éstos, pues aunque en menor grado se identifican \nintervenciones antrópicas, lo cual es coherente con lo identificado por el Equipo Evaluador de la ANLA en \nla visita de evaluación” (subrayado fuera de texto).  \nA partir de las afirmaciones anteriormente expuestas por la ANLA en la Resolución 01350 de 2022, se \nconcuerda que al tener una extensión considerable los planos inundables, las intervenciones antrópicas \npuntuales, deben ser llevadas a cabo bajo medidas de manejo ambiental, por lo que se solicita continuar \ncon la clasificación de áreas con alta restricción y no clasificar dichas áreas como de exclusión, pues como \nmenciona el párrafo cuarto del medio biótico en la página 166 de la citada Resolución si bien “… las \nintervenciones antrópicas conllevan a rellenar el terreno y conformar terrazas, modifica de forma inmediata \ny permanente el plano inundable…”,  estas intervenciones (parches de perturbación) como se observó con \nel actual proyecto son de carácter puntual y podrían como menciona la autoridad “…aceptaría cambios en \nel paisaje de manera moderada sin interferir en un impacto significativo…”.\nConsideraciones de la ANLA\nA continuación, se realizarán las consideraciones de esta Autoridad, con ocasión de los argumentos \nexpuestos por el recurrente, en cuanto a lo dispuesto en el Artículo Noveno de la Resolución 01350 del 21 \nde junio de 2022.\nRespecto a los criterios asociados con las pendientes, la Sociedad realiza la siguiente solicitud:\nTeniendo en cuenta lo anteriormente expuesto, se solicita a la Autoridad establecer las pendientes entres \n(sic) 12-25% como alta restricción en la zonificación ambiental, al considerar que no hay suficientes motivos \nde valorarlo como de exclusión, además de que esta exclusión traería implicaciones en el desarrollo de las \nactividades de operaciones del proyecto al cual se le otorgó la licencia global de explotación. Para lo cual \nen la Figura 3 se presenta la zonificación ambiental propuesta para de acuerdo con las condiciones de \n\nResolución No.  01910           Del   08 de septiembre de 2022            Hoja No. 14 de 39\n“Por la cual se Resuelve el Recurso de Reposición interpuesto contra la Resolución 01350 del 21 de \njunio de 2022”\nOficinas: Carrera 13 A No. 34 – 72 Edificio 13 35 Pisos 8 al 11 Bogotá, D.C.\nCentro de Orientación y Radicación de Correspondencia: Carrera 13 A No. 34 – 72 Edificio 13 35 \nLocales 110 al 112 Bogotá, D.C.  \nCódigo Postal 110311156\nNit.: 900.467.239-2\nLínea de Orientación y Contacto Ciudadano: 57 (1) 2540100 / 018000112998 PBX: 57 (1) 2540111\nwww.anla.gov.co    Email: licencias@anla.gov.co  \nPágina 14 de 39\npendiente del área de influencia del proyecto, colocando únicamente las áreas con pendientes superiores a \n25% como de exclusión.\nEs importante señalar que las pendientes superiores al 12% fueron integradas dentro de la zonificación de \nmanejo ambiental del proyecto Campo Vikingo del Bloque Lla-47, en adelante el proyecto, teniendo en \ncuenta la caracterización presentada por la sociedad INTEROIL COLOMBIA EXPLORATION AND \nPRODUCTION, en adelante la Sociedad, en el Capítulo 3.6 del EIA consolidado correspondiente al radicado \nANLA 2022051066-1-000 y radicado VITAL – Ventanilla Única de Trámites Ambientales \n3500086052965722001 del 18 de marzo de 2022; donde se reconoce la alta sensibilidad ambiental de estas \náreas, de la siguiente manera:\n“(…) La valoración de aptitud de las pendientes busca optimizar las áreas que presentan una menor \npendiente, ya que, desde el punto de vista de la instalación de las facilidades petroleras, se adapta más \nfácilmente en los terrenos planos, además de que, mientras más plana sea el área, el control a eventuales \ncontingencias se facilita ya que el desplazamiento del producto será muy lento y solamente alrededor del \npunto crítico.\nPor lo tanto, la favorabilidad en la aptitud de uso del territorio debe ir de lo más plano hacia lo empinado; \nvale la pena mencionar que, dado que para la elaboración del mapa de pendientes se utilizó una imagen \nsatelital con excelente nivel de detalle, su interpretación permitió distinguir los taludes de los drenajes, los \ncuales tienen una pendiente de 12% y superior.\n(…)”.\nMás adelante, en el mismo capítulo, se presenta la siguiente tabla, donde se reconoce la alta sensibilidad \nambiental de las pendientes superiores al 12%, así: \nTabla 3-7 Clasificación de sensibilidad e importancia ambiental desde la perspectiva de las pendientes del \nterreno.\nPendiente\nCaracterística\nPotencialidad \ny fragilidad\nSensibilidad\nAptitud\n>25%\nTerreno ligeramente empinado\nMuy Alta\nAlta\n12 – 25%\nTerreno fuertemente inclinado\nMedia\nAlta\n7 – 12%\nTerreno moderadamente inclinado \nMedia\nMedia\n3 -7%\nTerreno ligeramente inclinado\nMedia\nModerada\n1 -3 %\nTerreno ligeramente plano \nAlta\nBaja\n0 -1 %\nTerreno a nivel\nAlta\nBaja\nFuente: EIA Consolidado con radicado ANLA 2022051066-1-000 y radicado VITAL – Ventanilla Única de Trámites Ambientales \n3500086052965722001 del 18 de marzo de 2022.\nCon base en lo anterior, el Equipo Evaluador de la ANLA (EEA), en el Numeral 9.1 del Concepto Técnico \n03397 del 17 de junio de 2022 acogido mediante Resolución 01350 del 21 de junio de 2022, concluyó lo \nsiguiente:\n“…En relación con la tabla anterior, el Equipo Evaluador de la ANLA encuentra coherente la sensibilidad \notorgada a cada una de las pendientes que se encuentran en el área de estudio, ya que estas se encuentran \nasociadas a la estabilidad el terreno por movimiento en masas en caso de una intervención serán aquellas \npendientes que tienden a ser planas, las que mayor estabilidad darán en caso de una intervención, aunado \na esto, durante la visita de evaluación, se corroboró la predominancia de llanura en el área del Proyecto y \nno se detectó amenazas de movimientos en masa por la ubicación del área del Proyecto en terrenos \nfuertemente inclinados…”.\nDe otro lado, se identificó que en el escrito de recurso de reposición interpuesto contra de la Resolución \n1350 del 21 de junio de 2022, la sociedad hizo las siguientes afirmaciones:\nMEDIA\n\nResolución No.  01910           Del   08 de septiembre de 2022            Hoja No. 15 de 39\n“Por la cual se Resuelve el Recurso de Reposición interpuesto contra la Resolución 01350 del 21 de \njunio de 2022”\nOficinas: Carrera 13 A No. 34 – 72 Edificio 13 35 Pisos 8 al 11 Bogotá, D.C.\nCentro de Orientación y Radicación de Correspondencia: Carrera 13 A No. 34 – 72 Edificio 13 35 \nLocales 110 al 112 Bogotá, D.C.  \nCódigo Postal 110311156\nNit.: 900.467.239-2\nLínea de Orientación y Contacto Ciudadano: 57 (1) 2540100 / 018000112998 PBX: 57 (1) 2540111\nwww.anla.gov.co    Email: licencias@anla.gov.co  \nPágina 15 de 39\n“…La interpretación y análisis realizado por la Anla (sic) con respecto al criterio asociado a las pendientes \nestaría limitando el uso de un pequeño tramo de la vía en desarrollo de las actividades del proyecto, \ncondición que imposibilitaría el desarrollo del proyecto toda vez que impediría el tránsito por la vía, el \ndesarrollo de actividades de mantenimiento rutinario y permanente de esta…”\nRespecto a lo anterior, se observa que las pendientes, por corresponder a zonas con pocas variaciones de \ninclinación, no marcan diferencias sustanciales, lo cual claramente se puede relacionar con el paisaje \ngeomorfológico de llanura aluvial de desborde. \nPor lo anterior, se considera que las pendientes de 12% a 25% en la Orinoquia no son un criterio para \nconsiderar áreas de exclusión en la zonificación de manejo ambiental, dado que estas pendientes (12% al \n25%) que representan el 2,37% se reparten en casi toda la totalidad del Área de Influencia del Campo \nVikingo, y su única expresión marcada se localiza en el extremo nororiental del AI, asociada con zonas \nonduladas sobre geoformas de terrazas aluviales, las cuales son las de menor grado de susceptibilidad a la \ninundación, ya que estas por tener una elevación mayor respecto al terreno circundante no se ven afectadas \npor los procesos de desbordamiento lateral periódicos propios del área donde se localiza el proyecto (…)\nAdicionalmente, el parámetro pendiente fue evaluado dentro del contexto de la zonificación geotécnica, el \ncual es uno de los elementos utilizados en la elaboración de la zonificación ambiental, por lo cual se \nconsidera que se le estaría dando doble calificación al elemento pendiente al utilizarlo directamente para \ngenerar zonas de cualquier categoría en la zonificación ambiental y así mismo en la zonificación de manejo.\nAsí entonces, y en atención a los argumentos expuestos por el recurrente y las consideraciones contenidas \nen la Resolución atacada, el Equipo Evaluador de la ANLA, encuentra procedente mantener lo allí dispuesto, \ndonde se valida la sensibilidad ambiental alta de las áreas con pendientes superiores al 12%, que de ser \nintervenidas proveen al área características de inestabilidad para actividades constructivas como las \nsolicitadas por la Sociedad para el desarrollo del Proyecto.\nNo obstante, y sin desconocer la sensibilidad ambiental alta identificada por la Sociedad en el EIA \ncorrespondiente al radicado ANLA 2022051066-1-000 y radicado VITAL – Ventanilla Única de Trámites \nAmbientales 3500086052965722001 del 18 de marzo de 2022; de las pendientes entre el 12% al 25% \ncorrespondientes a terreno fuertemente inclinado, el Equipo Evaluador de la ANLA considera que, tal y como \nlo indica la Sociedad dentro del recurso de reposición presentado, las áreas que ocupan las pendientes de \n12 % y 25 %, la cual corresponde a  1,46 hectáreas, no es significativa, en comparación al área que abarca \nel área de influencia del Proyecto (9.531,33 hectáreas) y se puede concluir que, la probabilidad de eventos \nde remoción de masas es baja y no determinante en la zonificación de manejo del Proyecto.\nAunado a lo anterior, el argumento presentado respecto a la exclusión que quedó sobre la vía de acceso se \nconsidera válido, ya que esta área se encuentra intervenida por parte del Proyecto en su etapa de \nexploración y, actualmente de acuerdo con lo presentado en el EIA consolidado correspondiente al radicado \nANLA 2022051066-1-000 y radicado VITAL – Ventanilla Única de Trámites Ambientales \n3500086052965722001 del 18 de marzo de 2022; y lo evidenciado en la visita de evaluación ambiental, esta \nvía se encuentra en condiciones óptimas para su uso por parte del Proyecto y su operación será \nambientalmente viable, siempre y cuando se implementen las medidas de manejo, seguimiento y monitoreo \nambiental establecidas mediante la Resolución 1350 del 21 de junio de 2022.  \nFinalmente, en lo concerniente a que este aspecto fue incluido en la zonificación geotécnica, es importante \nresaltar el análisis del acápite sobre consideraciones del medio abiótico del Concepto Técnico 03397 del 17 \nde junio de 2022 acogido mediante Resolución 1350 del 21 de junio de 2022, sobre la zonificación ambiental \ndel Proyecto, donde se indicó que el análisis de las pendientes se realizó de manera independiente, toda \nvez que, no se encontró coherencia con lo caracterizado en los componentes de geotecnia, geomorfología, \nsuelo e hidrología, de la siguiente manera:\nEn lo relacionado con la tabla anterior, el Equipo Evaluador de la ANLA considera importante recalcar, que \nsi bien se realiza una zonificación geotécnica con los elementos adecuados, al validar los elementos \nincluidos en cada nivel de sensibilidad presentado en la tabla anterior, la clasificación de sensibilidad \npresentada no es acorde con lo presentado para los componentes geotécnico, geomorfología, suelo e \n\nResolución No.  01910           Del   08 de septiembre de 2022            Hoja No. 16 de 39\n“Por la cual se Resuelve el Recurso de Reposición interpuesto contra la Resolución 01350 del 21 de \njunio de 2022”\nOficinas: Carrera 13 A No. 34 – 72 Edificio 13 35 Pisos 8 al 11 Bogotá, D.C.\nCentro de Orientación y Radicación de Correspondencia: Carrera 13 A No. 34 – 72 Edificio 13 35 \nLocales 110 al 112 Bogotá, D.C.  \nCódigo Postal 110311156\nNit.: 900.467.239-2\nLínea de Orientación y Contacto Ciudadano: 57 (1) 2540100 / 018000112998 PBX: 57 (1) 2540111\nwww.anla.gov.co    Email: licencias@anla.gov.co  \nPágina 16 de 39\nhidrología y por tanto se reitera la sensibilidad otorgada por el Equipo Evaluador de la ANLA en las \nconsideraciones presentadas para cada uno de estos componentes en el presente capítulo. \nAunado a lo anterior no se incluyen la totalidad de las unidades geomorfológicas, recalcando que, no se \nincluye dentro del análisis las áreas identificadas como planicies de inundación, siendo estas de gran \nsensibilidad por la ubicación del área del Proyecto y su tendencia a las inundaciones, aspecto que será \nintegrado en la zonificación de manejo y se establecerán las restricciones respectivas, adicionalmente, se \nencuentra contradicción con lo presentado en el análisis de la zonificación ambiental para el componente \ngeomorfológico, ya que, se presentan con alta sensibilidad las pendientes menores 2° y en el componente \nse precisan con baja sensibilidad, lo último validado por el Equipo Evaluador de la ANLA, pues como se \nindicó esta baja pendiente proporciona mayor estabilidad y menores riesgos de movimientos en masa.\nPor lo tanto, el Equipo Evaluador de la ANLA considera apropiado técnicamente acceder a la solicitud de la \nSociedad, retirando el elemento de pendientes mayores al 12% de las áreas de exclusión e incluyendo \núnicamente aquellas áreas con pendientes mayores al 25%, lo que conlleva a ajustar las zonificación de \nmanejo ambiental en las áreas de intervención con restricciones, en el sentido de incluir las pendientes \nmenores a 25 %, el cual corresponderá al ajuste presentado en negrilla en la Tabla 1 y en la Figura 1 del \npresente acto administrativo. \nRespecto a los criterios asociados con la geología y la geomorfología, la Sociedad realiza la siguiente \nsolicitud:\nTeniendo en cuenta lo anteriormente expuesto, se solicita a la Autoridad aceptar la propuesta de INTEROIL \nde establecer como exclusión las zonas de erosión y sedimentación activa, además de las zonas cubiertas \ncon bosque de galería.\nSobre esta solicitud el Equipo Evaluador de la ANLA, se permite citar los siguientes apartes del Concepto \nTécnico 03397 del 17 de junio de 2022, acogido mediante Resolución 1350 del 21 de junio de 2022, \nrelacionados con las características de las unidades geológicas que afloran en el área del Proyecto, así: \n“…la Sociedad presenta las siguientes características locales que a nivel geológico se identifican en el área \nde influencia: “El área de estudio se encuentra cubierta por depósitos cuaternarios generados a partir \nde la dinámica fluvial que se desarrolla en la zona como una llanura aluvial de desborde, en la cual \nperiódicamente se generan crecidas a raíz de las precipitaciones durante los meses de lluvias (abril-\noctubre), las cuales aumentan el caudal de los caños y drenajes, produciendo desbordamientos laterales \nhacia las áreas aledañas (…)” (negrilla fuera de texto).\nCon sustento en lo anterior, y teniendo en cuenta la predominancia de pendientes inferiores al 12% en el \nárea del Proyecto, no existen barreras naturales que permitan identificar una amortiguación del fenómeno \nde inundaciones; aunado a que en la información adicional presentada y contenida en el documento \nidentificado como EIA consolidado correspondiente al radicado ANLA 2022051066-1-000 y radicado VITAL \n– Ventanilla Única de Trámites Ambientales 3500086052965722001 del 18 de marzo de 2022, se reconoce \nque las áreas identificadas como:  depósitos aluviales actuales areno-limosos (Q2al Are-lim), depósitos \naluviales areno-limosos (Qal Are-lim), depósitos aluviales limo-arcillosos (Qal lim-Arc) y depósitos aluviales \narcillosos (Qal Arc), son depósitos cuaternarios que se encuentran presentes en el área de influencia del \nProyecto, por los aportes de los sedimentos de los cuerpos hídricos presentes, lo que sustenta la importante \ninfluencia actual de la dinámica de los cuerpos de agua, en la conformación y consolidación de los suelos \nen el área de influencia del Proyecto.\nAunado a lo anterior, es importante resaltar que, dentro de la información adicional presentada y contenida \nen el documento identificado como EIA consolidado correspondiente al radicado ANLA 2022051066-1-000 \ny radicado VITAL – Ventanilla Única de Trámites Ambientales 3500086052965722001 del 18 de marzo de \n2022, se identificó dentro de las unidades geológicas, la unidad de terraza aluvial (Q2t), la cual por su \ncercanía a cuerpos naturales como los caños Las Queseras y Churruvay o al cuerpo artificial denominado \ncaño Pirito, y las bajas pendientes presentes en el áreas del Proyecto, la hacen un área susceptible a \ninundaciones e igualmente importante en la dinámica hídrica de las cuencas hidrográficas de las cuales \nhacen parte los cuerpos de agua anteriormente mencionados.\n\nResolución No.  01910           Del   08 de septiembre de 2022            Hoja No. 17 de 39\n“Por la cual se Resuelve el Recurso de Reposición interpuesto contra la Resolución 01350 del 21 de \njunio de 2022”\nOficinas: Carrera 13 A No. 34 – 72 Edificio 13 35 Pisos 8 al 11 Bogotá, D.C.\nCentro de Orientación y Radicación de Correspondencia: Carrera 13 A No. 34 – 72 Edificio 13 35 \nLocales 110 al 112 Bogotá, D.C.  \nCódigo Postal 110311156\nNit.: 900.467.239-2\nLínea de Orientación y Contacto Ciudadano: 57 (1) 2540100 / 018000112998 PBX: 57 (1) 2540111\nwww.anla.gov.co    Email: licencias@anla.gov.co  \nPágina 17 de 39\nPor lo anterior, se determinó por parte del Equipo Evaluador de la ANLA, permitir la intervención del Proyecto \nsolo hasta donde fue solicitado y con la infraestructura ya existente, implementando las mejoras que se \nrequieran de acuerdo con el análisis hidrológico realizado, para de esta manera evitar, mitigar o corregir las \nafectaciones que estas intervenciones antrópicas puedan causar en la dinámica hídrica del área de \ninfluencia del Proyecto. \nEn concordancia con lo anterior, fueron incluidas las unidades geomorfológicas asociadas al plano inundable \ncomo una exclusión, estas también por su asociación con fenómenos de inundación, principalmente por el \ndesborde de los cuerpos de agua presentes en el área de influencia del Proyecto y las bajas pendientes, \ncaracterísticas de esta región del país.\n \nAdicionalmente, nuevamente se destaca que el área donde se encuentra ubicada la infraestructura existente \ndel Proyecto fue caracterizada como una terraza aluvial, lo cual no la excluye de ser un área sensible e \nimportante ambientalmente, pues su cercanía a los cuerpos de agua caños Churruvay, Pirito y Las Queseras \ny las bajas pendientes presentes, permiten identificar y no desconocer la conexión hidrológica que existente \nen estas áreas en las épocas de lluvia del año; lo que permite nuevamente concluir que, es evidente la \nsensibilidad del área a las inundaciones, por crecientes de los cuerpos de agua cercanos y la influencia de \nestos en la dinámica geomorfológica del área del Proyecto; y de acuerdo con el alcance del Proyecto, el \ndesarrollo de las actividades solo podrá realizarse en las áreas ya intervenidas y con las pertinentes medidas \nde manejo ya establecidas. \nLo anterior también sustentado en el Concepto Técnico 03397 del 17 de junio de 2022, acogido mediante \nResolución 1350 del 21 de junio de 2022, en el cual, desde el componente hidrológico, se realizaron las \nsiguientes consideraciones:\nPara este componente, la Sociedad no cita dentro de su análisis la totalidad de los cuerpos de agua \npresentes en el área del Proyecto, a los cuales se establecerán las condiciones de su exclusión en el capítulo \nde zonificación de manejo ambiental, en lo que corresponde a su sensibilidad e importancia, teniendo en \ncuenta el paisaje plano predominante y la influencia de material aluvial en la formación de los suelos \npresentes en el área de influencia, se corrobora la sensibilidad de los cuerpos de agua, especialmente en \népocas húmedas, lo que permite al Equipo Evaluador de la ANLA otorgar a todos los cuerpos de agua \npresentes en el área del Proyecto, una sensibilidad Muy Alta y no se valida lo presentado en la tabla anterior, \ntoda vez que, los cuerpos de agua, sean corrientes estacionales o no, significan una importancia y \nsensibilidad muy alta en la dinámica hídrica de una cuenca, incluyendo aquellas áreas donde en ciertas \népocas del años se interconectan por la formación de espejos de agua. \nPor esta razón la Sociedad deberá asegurar que, las obras de drenaje que actualmente hacen parte de la \nlocación sigan garantizando el normal flujo del agua y que permita a su vez garantizar la dinámica hídrica \nde la zona. \nAhora bien, en lo relacionado con el caño Pirito, es importante precisar que como se ve en las siguientes \nimágenes, este corresponde a un cauce artificial, sin embargo, durante la visita de evaluación, el Equipo \nEvaluador de la ANLA evidencio su interconexión en épocas de lluvia con el plano inundable predominante \nen los alrededores del área del proyecto y por tanto la sensibilidad de este cuerpo de agua no puede ser \nestablecida como moderada, debido a su cercanía con el área del Proyecto la cual tomada desde la \ncoordenada de la fotografía 2 corresponde a aproximadamente 32.9 metros, medidos en el sistema AGIL, \npor lo tanto, se recalca su alta sensibilidad y se impondrán las medidas necesarias para dar manejo a los \nposibles impactos que sobre este cuerpo artificial se puedan manifestar.\nEs importante precisar que el análisis de las áreas de sedimentación y erosión, solicitado mediante \nrequerimiento No. 6 en la reunión de información adicional celebrada el 18 de enero de 2022 y soportada \nbajo el Acta No. 3 de 2022, fue tenido en cuenta por el Equipo Evaluador de la ANLA, del cual se concluyó \nlo siguiente:\nDe lo anterior, el Equipo Evaluador de la ANLA concluye se dio respuesta a lo solicitado en la reunión de \ninformación adicional y se dio claridad sobre los procesos morfodinámicos presentes en el área, \ncorroborando así lo identificado durante la visita de evaluación, respecto a la alta sensibilidad del área por \ninundaciones, atribuido principalmente al plano inundable predominante en el paisaje del área del Proyecto \n\nResolución No.  01910           Del   08 de septiembre de 2022            Hoja No. 18 de 39\n“Por la cual se Resuelve el Recurso de Reposición interpuesto contra la Resolución 01350 del 21 de \njunio de 2022”\nOficinas: Carrera 13 A No. 34 – 72 Edificio 13 35 Pisos 8 al 11 Bogotá, D.C.\nCentro de Orientación y Radicación de Correspondencia: Carrera 13 A No. 34 – 72 Edificio 13 35 \nLocales 110 al 112 Bogotá, D.C.  \nCódigo Postal 110311156\nNit.: 900.467.239-2\nLínea de Orientación y Contacto Ciudadano: 57 (1) 2540100 / 018000112998 PBX: 57 (1) 2540111\nwww.anla.gov.co    Email: licencias@anla.gov.co  \nPágina 18 de 39\ny la influencia de los cuerpos hídricos más cercanos como lo son los caños Pirito y Las Queseras, que \ndrenan el área, identificándose su influencia en los procesos erosivos y de sedimentación en las áreas \ncercanas al área del Proyecto, la cual se encuentra interconectadas, ya que como se mencionó, estas hacen \nparte del paisaje de plano inundable donde se ubica el Proyecto.\nSi bien, este análisis realizado a partir de imágenes multitemporales, permitieron identificar una delimitación \nde las áreas activas de sedimentación y erosión en el área del Proyecto, el Equipo Evaluador de la ANLA \ntomó como referencia lo allí identificado, como validación de lo caracterizado en el EIA correspondiente al \nradicado ANLA 2022051066-1-000 y radicado VITAL – Ventanilla Única de Trámites Ambientales \n3500086052965722001 del 18 de marzo de 2022, concluyendo nuevamente que la influencia de los cuerpos \nhídricos cercanos y su influencia en el área de influencia del Proyecto es importante ambientalmente, dadas \nlas características geomorfológicas de ésta.\nSin embargo, no será esta la información que determine las áreas de exclusión, ya que de acuerdo con lo \nindicado en el EIA correspondiente al radicado ANLA 2022051066-1-000 y radicado VITAL – Ventanilla \nÚnica de Trámites Ambientales 3500086052965722001 del 18 de marzo de 2022, corresponde a \ninformación primaria y secundaria. Para el caso del componente geológico se indica:\nEl componente geológico se realizará mediante la revisión, actualización y complementación de los estudios \nregionales. El énfasis de la metodología radica en un proceso de recolección cualitativo y cuantitativo de los \ndatos geológicos, determinación de contactos, identificación del control estructural (si lo hay) y \ncaracterización de las unidades presentes en el área. \nPara el caso geomorfológico, se especifica que el nivel de detalle en el estudio corresponde al mayor, el \ncual concierne al componente y no unidad geomorfológica, como se indica en el recurso de reposición, esta \nclasificación de acuerdo con el esquema de jerarquización geomorfológica del Servicio Geológico \nColombiano – SGC (2012), presentado de la siguiente manera:\nLa caracterización geomorfológica estará basada en la “Propuesta metodológica sistemática para la \ngeneración de mapas geomorfológicos analíticos aplicados a la zonificación de amenaza por movimientos \nen masa”, del Servicio Geológico Colombiano – SGC (2012), donde se determinan parámetros que permiten \nuna clara diferenciación de las unidades, como son:\n- Morfoestructura: Rasgos asociados a la deformación tectónica que incide en el modelado del paisaje.\n- Morfogénesis: Origen de las formas del terreno.\n- Morfografía: Características de las geoformas con base en criterios geométricos y dimensionales.\n- Morfodinámica: Procesos erosivos que han modelado y continúan modelando las geoformas.\nLa cartografía geomorfológica se presentará a escala 1: 10.000 (de acuerdo a lo estipulado en los términos \nde referencia y al alcance que se pretenda para el estudio en cuestión). Dicha cartografía se rige a una \nestructura jerárquica para el detalle.\nPor lo anterior, y en atención a la evidente sensibilidad e importancia del área de influencia del Proyecto a \nlas inundaciones y dinámica hidrológica de los cuerpos de agua presentes, el Equipo Evaluador de la ANLA, \nno concuerda con lo expresado en los argumentos del recurso de reposición, respecto con calificar como \nexcesiva la calificación otorgada a estas áreas y la no pertinencia de establecer la totalidad de una unidad \ngeomorfológica como área de exclusión, de la siguiente manera:\nDe las consideraciones para la Zonificación Ambiental y la Zonificación de Manejo por parte del Equipo \nEvaluador de la ANLA, se considera excesivo la calificación de algunas unidades geológicas, \ngeomorfológicas y algunas categorías de pendientes como zonas de exclusión, ya que si bien se entiende \nla alta sensibilidad ambiental del área donde se localiza el proyecto, y la importancia en cuanto a la relación \nde los tres medios (abiótico, biótico y socioeconómico), que encierran desde el componente geológico y \ngeomorfológico, la conformación del terreno tanto en su composición (litología), como en su distribución y \nforma (morfografía y morfología), no se comparte la consideración de algunos elementos como área de \nexclusión.\n\nResolución No.  01910           Del   08 de septiembre de 2022            Hoja No. 19 de 39\n“Por la cual se Resuelve el Recurso de Reposición interpuesto contra la Resolución 01350 del 21 de \njunio de 2022”\nOficinas: Carrera 13 A No. 34 – 72 Edificio 13 35 Pisos 8 al 11 Bogotá, D.C.\nCentro de Orientación y Radicación de Correspondencia: Carrera 13 A No. 34 – 72 Edificio 13 35 \nLocales 110 al 112 Bogotá, D.C.  \nCódigo Postal 110311156\nNit.: 900.467.239-2\nLínea de Orientación y Contacto Ciudadano: 57 (1) 2540100 / 018000112998 PBX: 57 (1) 2540111\nwww.anla.gov.co    Email: licencias@anla.gov.co  \nPágina 19 de 39\nLo anterior para hacer referencia a que no es un sustento claro el determinar la extensión total de una unidad \ngeomorfológica como una zona de exclusión, ya que si bien toda la extensión del elemento geomorfológico \ncomparte características similares en cuanto a su morfogénesis y morfología, lo que quiere decir que toda \nla unidad ha sido formada por eventos geológicos y morfodinámicos similares, no toda la extensión del \nelemento geomorfológico está expuesta en la actualidad a los mismos eventos morfodinámicos que lo \nformó.”\nEn conclusión, el Equipo Evaluador de la ANLA no considera técnicamente viable acceder a la propuesta \nde la Sociedad, en el sentido de incluir como zonas de exclusión las zonas de erosión y sedimentación \npresentadas en respuesta al requerimiento No. 6 en la reunión de información adicional celebrada el 18 de \nenero de 2022 y soportada bajo el Acta No. 3 de 2022, ratificándose como áreas de exclusión, los siguientes \nelementos asociados a los componentes geológico y geomorfológico:\n<0000>\nUnidades geomorfológicas identificadas en la caracterización como Planicie de inundación (Fpdi), delta \nde desborde (Fddb) y cuenca de decantación (Fcd).\n<0000>\nUnidades geológicas caracterizadas como Depósitos aluviales limo-arcillosos (Qal lim-Arc), unidad \nasociada a los planos de inundación del área de influencia y los depósitos aluviales arcillosos (Qal \nArc), unidad asociada a las áreas donde por su composición, la infiltración del agua es lenta y las \núltimas en evacuar el agua acumulada por crecientes o lluvias.\nEn relación con las características de las unidades de suelo, la Sociedad presenta la siguiente solicitud:\nTeniendo en cuenta lo anteriormente expuesto, se solicita a la Autoridad establecer como exclusión en la \nzonificación de manejo ambiental solo la clase agrológica VIII.\nSobre esta solicitud, es importante reiterar lo indicado en el acápite de consideraciones del medio abiótico \ndel Concepto Técnico 3397 del 17 de junio de 2022 acogido mediante Resolución 1350 del 21 de junio de \n2022, así:\n“(…) En primera instancia el Equipo Evaluador de la ANLA considera importante incluir dentro del análisis, \nla sensibilidad alta de las unidades de suelo denominadas RVA, RVB, RVC, RVD, RVE, CAN y CAA, las \ncuales cubren la totalidad del área de influencia y, corresponden en su totalidad a un paisaje de planicie \ncon presencia de ambiente fluvial y denudacional, con tendencia a las inundaciones y/o encharcamiento, \ndestacando las unidades de suelo CAN, CAA, RVA y RVB, caracterizadas por pertenecer a geoformas \ngeneradas por los procesos relacionados con la actividad fluvial. \nAhora bien, en cuanto al criterio establecido por la Sociedad para identificar la sensibilidad e \nimportancia del área del Proyecto, el Equipo Evaluador de la ANLA considera apropiado indicar que \nlas tierras sin conflicto de uso son catalogadas con baja sensibilidad, las tierras con sobreutilización \nmoderada como sensibilidad moderada y las tierras con sobreutilización severa con alta \nsensibilidad, dado que, como se evidenció en la caracterización las áreas identificadas con \nsobreutilización del suelo, son más propensas a intensificar los impactos que se manifiesten del \ndesarrollo del Proyecto, de manera sinérgica y en tal sentido de forma más intensa…)”. (Negrilla \nfuera de texto).\nTeniendo en cuenta lo anterior, es preciso resaltar que el análisis de sensibilidad ambiental presentado por \nla Sociedad en el EIA correspondiente al radicado ANLA 2022051066-1-000 y radicado VITAL – Ventanilla \nÚnica de Trámites Ambientales 3500086052965722001 del 18 de marzo de 2022, fue tenido en cuenta con \nla sensibilidad ambiental de los suelos de acuerdo con la capacidad de su uso, sin embargo, el Equipo \nEvaluador de la ANLA, atendiendo la sensibilidad del área del Proyecto, por su predominancia de planicie \naluvial y pendientes poco pronunciadas; la importante conexión hídrica superficial en la mayoría del año, \nespecialmente entre los meses de abril a octubre, correspondientes a la época de lluvias; la relación de los \nsuelos y su composición arcillosa y tendiente a la infiltración lenta de las agua aportadas por las crecientes \nde los cuerpos de agua y las lluvias; así como el aumento del nivel de las tablas de agua en el área de \ninfluencia, consideró la inclusión dentro de áreas de exclusión las unidades caracterizadas como: RVA, \nRVB, RVC, RVE, CAN y CAA.\n\nResolución No.  01910           Del   08 de septiembre de 2022            Hoja No. 20 de 39\n“Por la cual se Resuelve el Recurso de Reposición interpuesto contra la Resolución 01350 del 21 de \njunio de 2022”\nOficinas: Carrera 13 A No. 34 – 72 Edificio 13 35 Pisos 8 al 11 Bogotá, D.C.\nCentro de Orientación y Radicación de Correspondencia: Carrera 13 A No. 34 – 72 Edificio 13 35 \nLocales 110 al 112 Bogotá, D.C.  \nCódigo Postal 110311156\nNit.: 900.467.239-2\nLínea de Orientación y Contacto Ciudadano: 57 (1) 2540100 / 018000112998 PBX: 57 (1) 2540111\nwww.anla.gov.co    Email: licencias@anla.gov.co  \nPágina 20 de 39\nNo obstante, y dado que a pesar de las bajas pendientes y la influencia de cuerpos de agua, tales como los \ncaños Las Queseras y Churruvay, el Equipo Evaluador de la ANLA considera, teniendo en cuenta el \nargumento de la Sociedad, relacionado con posibles modificaciones a la Licencia Ambiental Global, para la \nintervención de área Proyecto diferentes a las solicitadas en el trámite actual, se encontró pertinente \nestablecer la exclusión de estas áreas, específicamente en época de lluvias del año, que para el caso del \nárea del Proyecto fue identificada entre los meses de abril a octubre; esto en correspondencia con la \nsensibilidad del área del Proyecto ya identificada desde los componentes geomorfológico, geológico \nsuperficial e hidrológico. \nAsí las cosas, el equipo evaluador de la ANLA encuentra procedente y de forma parcial, lo solicitado por la \nSociedad en el escrito de recurso de reposición, en el sentido de mantener en áreas de exclusión las \nunidades de suelo clasificadas con clase agrológica: CLASE VIII (RVEb2, RVCb2, RVAc2, RVBb2, RVCc2 \ny RVAb2) y las unidades identificadas en el EIA consolidado correspondiente al radicado ANLA \n2022051066-1-000 y radicado VITAL – Ventanilla Única de Trámites Ambientales 3500086052965722001 \ndel 18 de marzo de 2022; como CAN y CAA dentro de las áreas de exclusión; e incluir las unidades de \nsuelo: RVAb, RVAbi, RVAbz, RVAc, RVAci, RVAcz, RVAd, RVAdi, RVAdz, RVBai, RVBaz, RVBb, RVBbi, \nRVBbz, RVBc, RVBci, RVBcz, RVCai, RVCaz, RVCb, RVCbi, RVCbz, RVCc, RVCci, RVCcz, RVEai, RVEb, \nRVEbi, RVEbz, RVEc, RVEci y RVEcz; dentro de áreas de intervención con restricciones, las cuales no \npodrán ser intervenidas en épocas de lluvia para ninguna actividad del Proyecto, es decir entre los meses \nde abril a octubre.\nEn relación con lo mencionado en el recurso de reposición, sobre la inclusión de la unidad de paisaje \ncaracterizada como UP30 en área de exclusión, así:\n“(…)\nPor otra parte, de las áreas de exclusión se identificaron las siguientes inconsistencias en la Resolución \nde la ANLA: \n- Dentro del medio abiótico se menciona que INTEROIL no podrá realizar ningún tipo de intervención \nadicional a lo ya existente además de otras unidades a la “unidad de Paisaje UP30, asociada a las \ncoberturas de bosques de galería y/o ripario en planicie de inundación”, no obstante en la página 75 de \nla Resolución 01350 de 2022 por la cual se otorga una licencia Ambiente al Global, se menciona la \nunidad de Paisaje “UP30 como Herbazal denso inundable no arbolado en terraza aluvial”, por lo que no \nqueda claro para Interoil, la unidad de paisaje que la autoridad incluye dentro de las zonas de exclusión \nconsideradas. INTEROIL solicita a la autoridad revisar las unidades de paisaje ya que, las coberturas de \nbosques de galería y/o ripario no corresponden a la unidad UP30, esto conlleva a que, en la zonificación \nambiental propuesta por la ANLA, la zona de exclusión abarque más del 90% del área de influencia del \nproyecto.\n(…)”.\nEl Equipo Evaluador de la ANLA se permite aclarar que, esto correspondió a un error de digitación y la \nunidad de paisaje asociada a las coberturas de bosques de galería y/o ripario en planicie de inundación, \ncaracterizadas como unidad UP3, son las coberturas relacionadas con la sensibilidad identificada por los \ncuerpos de agua presentes en el área del Proyecto y su influencia en los niveles de los espejos de agua \nque se forman en la planicie aluvial. \nPor lo tanto, el Equipo Evaluador de la ANLA considera adecuado retirar la unidad de paisaje UP 30 \n“Herbazal denso inundable no arbolado en Terraza Aluvial” e incluir en áreas de exclusión la asociada a UP \n3 “coberturas de bosques de galería y/o ripario en planicie de inundación”.\nCriterio asociado con las coberturas\nEn lo relacionado con la Zonificación de Manejo Ambiental, específicamente a los criterios asociados con \nlas coberturas, la Sociedad solicita ajustar la Resolución 01350 del 21 de junio de 2022, en su Artículo \nNoveno, en el sentido de recategorizar las unidades de cobertura de la tierra herbazal denso de tierra firme \n\nResolución No.  01910           Del   08 de septiembre de 2022            Hoja No. 21 de 39\n“Por la cual se Resuelve el Recurso de Reposición interpuesto contra la Resolución 01350 del 21 de \njunio de 2022”\nOficinas: Carrera 13 A No. 34 – 72 Edificio 13 35 Pisos 8 al 11 Bogotá, D.C.\nCentro de Orientación y Radicación de Correspondencia: Carrera 13 A No. 34 – 72 Edificio 13 35 \nLocales 110 al 112 Bogotá, D.C.  \nCódigo Postal 110311156\nNit.: 900.467.239-2\nLínea de Orientación y Contacto Ciudadano: 57 (1) 2540100 / 018000112998 PBX: 57 (1) 2540111\nwww.anla.gov.co    Email: licencias@anla.gov.co  \nPágina 21 de 39\nno arbolado, herbazal denso de tierra firme arbolado, herbazal denso inundable no arbolado y herbazal \ndenso inundable arbolado, a la categoría Áreas de Intervención con Restricciones. \nEn lo que respecta a la afirmación que realiza la Sociedad, acerca de la “(…) sobrevaloración en cuanto a \nla sensibilidad ambiental de estas unidades de cobertura, dado el estado actual y la dinámica regional y \necológica de éstas en la región, de manera que, al realizar el análisis en la Zonificación de Manejo \nAmbiental, se incluyeron estas coberturas en la categoría de exclusión en la cual no es viable \ndesarrollar futuras obras y actividades del proyecto. (…)” (Subrayado y negrilla fuera de texto).\nEl Equipo Evaluador de la ANLA, considera procedente precisar, que la evaluación ambiental, se efectuó a \nla luz del objeto del proyecto de “Explotación de Hidrocarburos en el Campo Vikingo del Bloque Lla-47” y la \nsolicitud realizada ante esta Autoridad Nacional para el trámite de licenciamiento ambiental mediante Auto \nNo. 10478 del 06 de diciembre de 2021, por medio del cual se inició el trámite administrativo de evaluación \nde la Licencia Ambiental Global, donde se ordena la apertura del expediente LAV0078-00-2021 y se adoptan \notras decisiones, entre ellas, que se revisará, analizará, evaluará y conceptuará sobre el Estudio de Impacto \nAmbiental presentado por la Sociedad mediante radicado ANLA 2022051066-1-000 y radicado VITAL – \nVentanilla Única de Trámites Ambientales 3500086052965722001 del 18 de marzo de 2022.\nAsí mismo, considera preciso traer a colación apartes de los Artículos Primero y Segundo de la parte \nresolutiva de la Resolución 01350 del 21 de junio de 2022, por medio de la cual se otorga la Licencia \nAmbiental Global al proyecto denominado “Explotación de Hidrocarburos en el Campo Vikingo del Bloque \nLla-47”.\n“(…)\nARTÍCULO PRIMERO. Otorgar Licencia Ambiental Global a la sociedad INTEROIL COLOMBIA \nEXPLORATION AND PRODUCTION, identificada con Nit. 860.529.657-0, para el proyecto denominado \n“Explotación de Hidrocarburos en el Campo Vikingo del Bloque Lla-47”, localizado en jurisdicción del \nmunicipio de Orocué en el departamento de Casanare, con un área de 6,03 hectáreas, ubicado en las \nsiguientes coordenadas: (…)\nARTÍCULO SEGUNDO. Autorizar a la sociedad INTEROIL COLOMBIA EXPLORATION AND \nPRODUCTION, desde el punto de vista ambiental, la realización de las siguientes obras, \ninfraestructura y actividades, con el cumplimiento de las obligaciones señaladas:\n(…)” (Subrayado y negrilla fuera de texto).\nEn este sentido, lo establecido en los precitados articulados da total claridad a las condiciones de viabilidad \nambiental en que se autoriza a la sociedad INTEROIL COLOMBIA EXPLORATION AND PRODUCTION, el \ndesarrollo y ejecución del Proyecto, por lo que no es procedente para el Equipo Evaluador de la ANLA, \nconsiderar acerca de la viabilidad de desarrollar futuras obras y actividades que no fueron objeto de \nevaluación dentro del trámite de licenciamiento ambiental. Lo cual fue igualmente manifestado por la \nSociedad en el EIA Consolidado correspondiente al radicado ANLA 2022051066-1-000 y radicado VITAL – \nVentanilla Única de Trámites Ambientales 3500086052965722001 del 18 de marzo de 2022; al afirmar que: \n“(…) como se ha insistido en este Estudio de Impacto Ambiental, que no se tiene previsto la modificación \no ampliación del área intervenida por la infraestructura existente asociada al pozo Vikingo-1. (…)” \n(Subrayado y negrilla fuera de texto).\nEn cuanto a lo que respecta a la sensibilidad ambiental de las unidades de coberturas de herbazal denso \nde tierra firme no arbolado, herbazal denso de tierra firme arbolado, herbazal denso inundable no arbolado \ny herbazal denso inundable arbolado presentan una potencialidad y fragilidad Alta y una sensibilidad Media. \nAl respecto, el Equipo Evaluador de la ANLA, considera mencionar que la valoración realizada por la \nSociedad a estas coberturas vegetales en el EIA correspondiente al radicado ANLA 2022051066-1-000 y \nradicado VITAL – Ventanilla Única de Trámites Ambientales 3500086052965722001 del 18 de marzo de \n2022, fue de sensibilidad Baja y no Media como se afirma. Así mismo, se otorgó un potencial y fragilidad \nMuy Bajo y una sensibilidad Muy Baja según la clasificación de sensibilidad e importancia ambiental desde \nla perspectiva de cobertura vegetal y uso actual del suelo, con todo lo cual, la Sociedad categorizó a estas \ncoberturas vegetales dentro de la Zonificación de Manejo Ambiental como “ÁREAS DE INTERVENCIÓN”. \n\nResolución No.  01910           Del   08 de septiembre de 2022            Hoja No. 22 de 39\n“Por la cual se Resuelve el Recurso de Reposición interpuesto contra la Resolución 01350 del 21 de \njunio de 2022”\nOficinas: Carrera 13 A No. 34 – 72 Edificio 13 35 Pisos 8 al 11 Bogotá, D.C.\nCentro de Orientación y Radicación de Correspondencia: Carrera 13 A No. 34 – 72 Edificio 13 35 \nLocales 110 al 112 Bogotá, D.C.  \nCódigo Postal 110311156\nNit.: 900.467.239-2\nLínea de Orientación y Contacto Ciudadano: 57 (1) 2540100 / 018000112998 PBX: 57 (1) 2540111\nwww.anla.gov.co    Email: licencias@anla.gov.co  \nPágina 22 de 39\nAhora bien, de los argumentos expuestos en el recurso de reposición en relación con esta comunidad \nvegetal, donde se afirma que si bien estas unidades de cobertura “(…) son de importancia ecológica (…)”, \ny que debido a que, “(…) no existen determinantes ambientales de tipo jurídico que impidan el \ndesarrollo de actividades en estas (…)”, por lo que en línea con la caracterización ambiental y el análisis \nde sensibilidad “(…) se identificó que estas unidades presentan un potencial y fragilidad Alta, así \ncomo una sensibilidad Alta/Media, de modo que pueden ser incluidas en la Zonificación de Manejo \nen la categoría ÁREAS DE INTERVENCIÓN CON RESTRICCIONES. (…)”.\nEl Equipo Evaluador de la ANLA, se permite considerar que, dicha valoración y recategorización para las \ncoberturas en discusión, no fueron expuestos por la Sociedad en el EIA correspondiente al radicado ANLA \n2022051066-1-000 y radicado VITAL – Ventanilla Única de Trámites Ambientales 3500086052965722001 \ndel 18 de marzo de 2022; objeto de evaluación y pronunciamiento del Concepto Técnico 03397 del 17 de \njunio de 2022, acogido mediante Resolución 01350 del 21 de junio de 2022. No obstante, se precisa \nmencionar que, el hecho de que un ecosistema natural no cuente con un instrumento de tipo jurídico que \nimpida el desarrollo de actividades, no significa que su estructura y funcionalidad ecológica pierda su valor, \ntoda vez que los elementos de flora y fauna, silvestre y acuática, que allí interactúan, son el reflejo de \nmúltiples adaptaciones morfológicas y fisiológicas a las condiciones de inundación producto de las \ndinámicas hídricas de la región.\nEn este sentido, los ecosistemas de herbazales son importantes como pasos para especies migratorias, \ndonde los pulsos de agua y el comportamiento animal están programados como relojes vitales, factores \nfácilmente modificables en la medida que se afecten las propiedades de regulación y reserva de agua, que \nson definidas por los niveles de los cauces, atenuados por las crecientes ocasionadas por las lluvias y \nregulados por el flujo de agua casi constante durante la época de menores lluvias.\nAsí las cosas, y teniendo en cuenta que, en el EIA correspondiente al radicado ANLA 2022051066-1-000 y \nradicado VITAL – Ventanilla Única de Trámites Ambientales 3500086052965722001 del 18 de marzo de \n2022, objeto de evaluación y pronunciamiento del Concepto Técnico 03397 del 17 de junio de 2022 acogido \nmediante Resolución 01350 del 21 de junio de 2022, únicamente se evidenció información que da cuenta \nde impactos ambientales correspondientes a las actividades solicitadas dentro del trámite de evaluación, \nlas cuales fueron reiteradas a lo largo del EIA correspondiente al radicado ANLA 2022051066-1-000 y \nradicado VITAL – Ventanilla Única de Trámites Ambientales 3500086052965722001 del 18 de marzo de \n2022, y también explícitas en el capítulo 5. Evaluación Ambienta del precitado documento.\n“(…)\nEs importante mencionar que la infraestructura petrolera para el desarrollo del Campo de Explotación \nVikingo es la que se construyó en la etapa de exploración en el marco de la Resolución 1927 del 31 de \noctubre de 2007. En este sentido el proyecto a licenciar para la explotación de hidrocarburos en el \ncampo Vikingo no contempla dentro de las actividades a desarrollar construcción y/o ampliación de \nlocaciones y facilidades, construcción de pozos, tampoco se contempla la adecuación y \nconstrucción de nuevas vías, pues se usarían las vías ya existentes y empleadas en la etapa de \nexploración. En conclusión, solo se pretende usar la infraestructura actual del campo Vikingo.\n(…)” (Subrayado y negrilla fuera de texto).\nEn virtud de lo anterior, el Equipo Evaluador de la ANLA no considera procedente la solicitud realizada por \nla Sociedad, con relación a incluir dentro de la categoría de manejo ambiental de Alta Restricción, las \ncoberturas de herbazal denso de tierra firme no arbolado, herbazal denso de tierra firme arbolado, herbazal \ndenso inundable no arbolado y herbazal denso inundable arbolado. En este sentido, se confirma la categoría \nde dichas áreas en exclusión de conformidad con lo establecido en la Zonificación de Manejo Ambiental \npara el proyecto denominado “Explotación de Hidrocarburos en el Campo Vikingo del Bloque Lla-47” \nmediante la Resolución 01350 del 21 de junio de 2022, que acogió el Concepto Técnico 03397 del 17 de \njunio de 2022.\nCriterio asociado a la posibilidad de ampliar y modificar la Licencia Ambiental Global actual en el \nfuturo\n\nResolución No.  01910           Del   08 de septiembre de 2022            Hoja No. 23 de 39\n“Por la cual se Resuelve el Recurso de Reposición interpuesto contra la Resolución 01350 del 21 de \njunio de 2022”\nOficinas: Carrera 13 A No. 34 – 72 Edificio 13 35 Pisos 8 al 11 Bogotá, D.C.\nCentro de Orientación y Radicación de Correspondencia: Carrera 13 A No. 34 – 72 Edificio 13 35 \nLocales 110 al 112 Bogotá, D.C.  \nCódigo Postal 110311156\nNit.: 900.467.239-2\nLínea de Orientación y Contacto Ciudadano: 57 (1) 2540100 / 018000112998 PBX: 57 (1) 2540111\nwww.anla.gov.co    Email: licencias@anla.gov.co  \nPágina 23 de 39\nEn lo que respecta a este apartado del recurso de reposición interpuesto por la sociedad INTEROIL \nCOLOMBIA EXPLORATION AND PRODUCTION, en contra de lo dispuesto en la Resolución 01350 del 21 \nde junio de 2022, en donde se afirma que:\n“(…)\nSi bien INTEROIL solicitó con la actual licencia global del campo vikingo solo la operación del pozo vikingo \ncon la infraestructura existe (vía, locación y facilidades), en ningún momento la compañía con la obtención \nde esta licencia está renunciando a su intención de ampliar en un futuro las áreas de explotación actuales \ny con ello ampliar las áreas de operación, contemplando realizar a futuro la modificación de esta licencia \nglobal.\nBajo este entendido, y teniendo en cuenta que para la ANLA las condiciones bajo las cuales se otorgó la \npresente licencia global serán un antecedente importante para cualquier proceso futuro que se lleve a \ncabo, solicitamos reconsiderar las áreas de exclusión presentadas por la ANLA que están conexas al \nproyecto.\n(…)”.\nA lo cual, según INTEROIL COLOMBIA EXPLORATION AND PRODUCTION, en la página 68 (Sic) de la \nprecitada Resolución, se afirma que: \n“…Ahora bien, teniendo en cuenta que, el Proyecto no contempla dentro de las actividades a desarrollar \nconstrucción y/o ampliación de locaciones y facilidades, solo pretende usar la infraestructura actual del \nCampo Vikingo (es decir, el pozo Vikingo-1 e infraestructura asociada) y, tampoco se tiene contemplado \nla adecuación y construcción de nuevas vías, pues se usarían las vías ya existentes y empleadas en la \netapa de exploración, la cobertura de la tierra de explotación de hidrocarburos, se incorpora dentro de esta \ncategoría de Manejo Ambiental…)”.\nEl Equipo Evaluador de la ANLA, encuentra necesario dar claridad a lo siguiente:\nMediante radicado VITAL 0200086052965721002 y radicado ANLA 2021240155-1-000 del 5 \nde noviembre de 2021, la sociedad INTEROIL COLOMBIA EXPLORATION AND PRODUCTION, \nsolicitó Licencia Ambiental para el proyecto denominado “Explotación de Hidrocarburos en el Campo \nVikingo del Bloque Lla-47”, localizado en el municipio de Orocué departamento del Casanare, en la \ncual se entregó el Estudio de Impacto Ambiental.\nMediante Auto 10478 del 06 de diciembre de 2021, se inició el trámite administrativo de \nevaluación de la Licencia Ambiental Global para el proyecto “Explotación de Hidrocarburos en el \nCampo Vikingo del Bloque Lla-47”, localizado en los municipios de Orocué en el departamento del \nCasanare, presentado por la sociedad INTEROIL COLOMBIA EXPLORATION AND PRODUCTION, y \nse conformó el expediente LAV0078-00-2021. \nAhora bien, en la Resolución 01350 del 21 de junio de 2022, queda explícito que:\n“(…)\nEs importante mencionar que la infraestructura petrolera para el desarrollo del Campo de Explotación \nVikingo es la que se construyó en la etapa de exploración en el marco de la Resolución 1927 del 31 \nde octubre de 2007 para el Área de Perforación Exploratoria Lince-Leopardo… \nEn este sentido el proyecto a licenciar tiene como único fin convertir el pozo exploratorio Vikingo 1 y \nsu infraestructura asociada (locación, acceso, facilidades) en pozo productor, para lo cual se \nestableció un área de influencia para el polígono del Campo Vikingo; no se tiene previsto realizar \npozos de hidrocarburos adicionales a Vikingo-1 y, por ende, tampoco nuevos accesos, locaciones, \netc. Lo anterior conlleva, además, que en este Estudio de Impacto Ambiental no se requiere solicitar el uso, \naprovechamiento o afectación de recursos naturales relacionado con el aprovechamiento forestal, \nocupación de cauce y vertimientos en agua y/o suelo; se solicitarán solamente captación de aguas \nsuperficiales (un punto), aguas subterráneas (un punto) y emisiones atmosféricas. \n\nResolución No.  01910           Del   08 de septiembre de 2022            Hoja No. 24 de 39\n“Por la cual se Resuelve el Recurso de Reposición interpuesto contra la Resolución 01350 del 21 de \njunio de 2022”\nOficinas: Carrera 13 A No. 34 – 72 Edificio 13 35 Pisos 8 al 11 Bogotá, D.C.\nCentro de Orientación y Radicación de Correspondencia: Carrera 13 A No. 34 – 72 Edificio 13 35 \nLocales 110 al 112 Bogotá, D.C.  \nCódigo Postal 110311156\nNit.: 900.467.239-2\nLínea de Orientación y Contacto Ciudadano: 57 (1) 2540100 / 018000112998 PBX: 57 (1) 2540111\nwww.anla.gov.co    Email: licencias@anla.gov.co  \nPágina 24 de 39\nIgualmente, se anota que no será necesario pedir levantamiento de veda para especies epífitas por cuanto \nque no habrá aprovechamiento forestal, ni se realizará un programa por pérdida de biodiversidad, teniendo \nen cuenta que no se tiene previsto remover coberturas vegetales, ni generar cambios en el uso del \nsuelo, toda vez que solo se usara la infraestructura ya construida en el campo Vikingo, sin intervenir \nnuevas áreas. (…)” (Subrayado y negrilla fuera de texto).\nLo anterior obedece a lo expuesto por la Sociedad dentro del objetivo propuesto para el proyecto de \n“Explotación de Hidrocarburos en el Campo Vikingo del Bloque Lla-47”, y cuya referencia no se hizo mención \nen la página 68 de la Resolución 01350 del 21 de junio de 2022, como indica la Sociedad, sino que se \nreferenció en la página 143 y se reiteró posteriormente en la página 168 del acto administrativo en mención, \ncon lo cual, se reafirmó el alcance al Artículo 2.2.2.3.1.4. Licencia Ambiental Global del Decreto 1076 de \n2015, donde se establece: \n“(…) Para el desarrollo de obras y actividades relacionadas con los proyectos de explotación minera \ny de hidrocarburos, la autoridad ambiental competente otorgará una licencia ambiental global, que abarque \ntoda el área de explotación que se solicite. (…)” (Subrayado y negrilla fuera de texto).\nDicho lo anterior, es claro para la ANLA que las condiciones bajo las cuales se evaluó y otorgó la Licencia \nAmbiental Global para el proyecto de “Explotación de Hidrocarburos en el Campo Vikingo del Bloque Lla-\n47”, fueron las que el solicitante expuso como parte del objetivo del Proyecto dentro trámite de licenciamiento \nambiental y bajo el soporte técnico relacionado dentro del Estudio de Impacto Ambiental. Por lo que es \npertinente indicar, que los pronunciamientos de las autoridades administrativas son rogados, es decir, aparte \nde lo que sea señalado en el EIA, esta Autoridad no puede dar respuestas o emitir pronunciamientos más \nallá de lo solicitado.\nAhora bien, en lo que respecta a lo expresado por la Sociedad como “inconsistencias en la Resolución de \nla ANLA en las áreas de exclusión”, el Equipo Evaluador de la ANLA, considera:\nDe lo expuesto en la página 113 y 114, referente a la cobertura de herbazales, que la Sociedad trae a \ncolación: \n“…si se tiene en cuenta que la cobertura de herbazales tiene una extensión de 8.873.02 hectáreas, es decir \nel 93.1% del área de influencia, se comprende la gran relevancia de estas coberturas dentro de la dinámica \necosistémica de la zona, puesto que albergan determinadas especies de flora y fauna, las cuales hacen uso \nde los recursos disponibles en época de lluvia para llevar a cabo sus procesos biológicos, por lo que su \nestablecimiento y permanencia está enteramente ligado a la dinámica hídrica del área inundada…”\n“En este sentido, los herbazales ofrecen condiciones para el desarrollo de vegetación arbórea… siendo las \náreas boscosas (bosques de galería y vegetación secundaria alta) las que permiten albergar un mayor \nnúmero de especies, seguida de las coberturas de herbazales…”  De esta forma, los herbazales, \nespecíficamente los inundables, son ecosistemas de gran valor… Razón por la cual, cualquier obra o \nactividad de infraestructura existente deberá contemplar diseños estructurales de contención como medidas \nde manejo ambiental que mitiguen o corrijan la afectación de las dinámicas hídricas en esta área…)”.\nEl Equipo Evaluador de la ANLA, precisa pertinente contextualizar dichas referencias, así:\nEn las páginas 113 y 114 se aborda las consideraciones bióticas referentes al capítulo de Zonificación \nAmbiental del Estudio de Impacto Ambiental - EIA correspondiente al radicado ANLA 2022051066-1-000 y \nradicado VITAL – Ventanilla Única de Trámites Ambientales 3500086052965722001 del 18 de marzo de \n2022 presentado por la Sociedad, en dicho apartado del Concepto Técnico 03397 del 17 de junio de 2022, \nel cual fue acogido mediante Resolución 01350 del 21 de junio de 2022, se evaluó la clasificación de \nsensibilidad e importancia ambiental otorgada por la Sociedad a las coberturas vegetales, afirmando el \nEquipo Evaluador de la ANLA que, dicha valoración no fue consecuente con la categoría de sensibilidad \nambiental asignada. A lo que hace referencia a la actividad ganadera extensiva que se práctica en dichas \náreas, y que debido a la extensión que ofrecen estos ecosistemas dentro del área de influencia del Proyecto, \nreflejan su importancia dentro del soporte estructural y funcional de la biodiversidad allí presente, todo ello \nligado a los periodos de lluvias, inundación y estiaje, que, en conjunto con las áreas boscosas asociadas, \nreafirman su importancia ecológica.\n\nResolución No.  01910           Del   08 de septiembre de 2022            Hoja No. 25 de 39\n“Por la cual se Resuelve el Recurso de Reposición interpuesto contra la Resolución 01350 del 21 de \njunio de 2022”\nOficinas: Carrera 13 A No. 34 – 72 Edificio 13 35 Pisos 8 al 11 Bogotá, D.C.\nCentro de Orientación y Radicación de Correspondencia: Carrera 13 A No. 34 – 72 Edificio 13 35 \nLocales 110 al 112 Bogotá, D.C.  \nCódigo Postal 110311156\nNit.: 900.467.239-2\nLínea de Orientación y Contacto Ciudadano: 57 (1) 2540100 / 018000112998 PBX: 57 (1) 2540111\nwww.anla.gov.co    Email: licencias@anla.gov.co  \nPágina 25 de 39\nLo anteriormente expuesto, se sustenta también por lo afirmado por la Sociedad en el Capítulo 3.6 \nZonificación Ambiental del EIA Consolidado correspondiente al radicado ANLA 2022051066-1-000 y \nradicado VITAL – Ventanilla Única de Trámites Ambientales 3500086052965722001 del 18 de marzo de \n2022; y que pese a lo que a continuación se relaciona, las coberturas de herbazales fueron definidas en \ndicho documento, con potencialidad y fragilidad Alta y valoradas con sensibilidad ambiental Baja:\n“(…)\n- Las áreas de herbazales y las antropogénicas usadas para actividades agropecuarias deben priorizarse, \nya que implica una alteración y/o intervención constante sobre el ecosistema natural; esta preferencia debe \nincluir a las tierras desnudas y degradadas ya que en la actualidad carecen de valor ecológico. Los territorios \nartificializados también recaen en esta categoría, ya que representan la artificialización del ecosistema.\n- Los cuerpos de agua artificiales, a pesar de su origen antropogénico, tienen un valor ecológico importante \nya que estas unidades se han transformado, al igual que en los cuerpos de agua naturales, en sitios de \nabrevadero de fauna silvestre, paso de aves migratorias, etc. \n- Los ecosistemas que aún preservan en alguna medida atributos naturales, particularmente las coberturas \nboscosas y cuerpos de agua naturales, deben calificarse como de áreas sensibles o de alta restricción \nsegún cada caso. (…)”   (Subrayado fuera de texto).\nAsí mismo, el Equipo Evaluador de la ANLA, reafirmó y amplió su argumentación, expresando que:\n“(…)\nlos herbazales ofrecen condiciones para el desarrollo de vegetación arbórea, debido a la presencia de agua \nfreática durante todo el año. Además, aparecen como corredores para la dispersión de especies de flora y \ncomo albergue para la fauna silvestre. La continuidad de estos ecosistemas y su conectividad con el bosque \nde galería y/o ripario a lo largo de las corrientes de agua que los bordean, generan una dinámica ecológica \nque refleja la compleja estructura ecosistémica de la región, la cual ofrece diferentes hábitats y nichos \necológicos para el establecimiento de un sin número de especies que se distribuyen según la oferta de \nrecursos disponibles, siendo las áreas boscosas (bosque de galería y vegetación secundaria alta) las que \npermiten albergar un mayor número de especies, seguida de las coberturas de herbazales.\nEn este contexto, los herbazales son formaciones más homogéneas en cuanto a estructura, por estar \nconformados especialmente por gramíneas o pastos naturales, no obstante, en algunos casos se \nencuentran asociadas a arboles dispersos, arbustos o arbolitos, con los que se amplía la estructura \ntridimensional de la sabana y permiten la conformación de un ecotono, cuya transición al bosque de galería \ny/o ripario, admite el establecimiento de un mayor número de especies silvestres debido a que presenta una \nmayor disponibilidad de hábitat para refugio, acecho, alimentación, reproducción y cría, gracias a las \ndinámicas hídricas que permiten flujos de materia y energía para el sistema y una compleja estructura trófica \nde las comunidades de fauna y flora.\nLo anterior, es de gran relevancia en la valoración ambiental de las coberturas inundables, debido a \nque la reproducción y crecimiento de numerosas especies de organismos acuáticos se realiza en un \nperiodo corto y es explosiva. Tanto el fitoplancton como el zooplancton así como especies de flora \nacuática, presentan en época de lluvia su fase reproductiva y de crecimiento, lo que aunado con la \ncomplejidad y heterogeneidad de ambientes inundados, garantiza la reproducción, crecimiento y protección \na numerosas especies hidrobiológicas, muchas de las cuales están adaptadas a los cambios abruptos de \ntransición de sequía a lluvia.\nDe esta forma, los herbazales, específicamente los inundables, son ecosistemas de gran valor \ndebido a que almacenan, filtran y proveen agua a diferentes hábitats en época de estiaje, razón por \nla cual, cualquier obra o actividad de infraestructura existente deberá contemplar diseños estructurales de \ncontención como medidas de manejo ambiental que mitiguen o corrijan, la afectación de la dinámica hídrica \nen estas áreas.\nAsí las cosas, para el Equipo Evaluador de la ANLA, no es aceptable la calificación de sensibilidad e \nimportancia ambiental otorgada a las coberturas de vegetación secundaria (alta y baja) y herbazales \n\nResolución No.  01910           Del   08 de septiembre de 2022            Hoja No. 26 de 39\n“Por la cual se Resuelve el Recurso de Reposición interpuesto contra la Resolución 01350 del 21 de \njunio de 2022”\nOficinas: Carrera 13 A No. 34 – 72 Edificio 13 35 Pisos 8 al 11 Bogotá, D.C.\nCentro de Orientación y Radicación de Correspondencia: Carrera 13 A No. 34 – 72 Edificio 13 35 \nLocales 110 al 112 Bogotá, D.C.  \nCódigo Postal 110311156\nNit.: 900.467.239-2\nLínea de Orientación y Contacto Ciudadano: 57 (1) 2540100 / 018000112998 PBX: 57 (1) 2540111\nwww.anla.gov.co    Email: licencias@anla.gov.co  \nPágina 26 de 39\n(herbazal denso de tierra firme arbolado y no arbolado, y herbazal denso inundable arbolado y no \narbolado), las cuales deben contemplar igual valoración que el bosque de galería y/o ripario, con una \nsensibilidad ambiental “Muy Alta”. (…)” (Subrayado y negrilla fuera de texto).\nEn virtud de lo anterior, desde el punto de vista biótico no se considera procedente la solicitud de la Sociedad \nde mantener para las coberturas definidas como herbazal denso de tierra firme no arbolado, herbazal denso \nde tierra firme arbolado, herbazal denso inundable no arbolado y herbazal denso inundable arbolada, la \nclasificación propuesta en el del EIA Consolidado correspondiente al radicado ANLA 2022051066-1-000 y \nradicado VITAL – Ventanilla Única de Trámites Ambientales 3500086052965722001 del 18 de marzo de \n2022; como áreas de alta restricción, sustrayéndolas de la categoría de exclusión establecida por la ANLA \nmediante Resolución 01350 del 2022; toda vez que la Sociedad, no esgrime argumento distinto a los \nprocesos futuros de ampliación de la Licencia Ambiental que adelante INTEROIL COLOMBIA \nEXPLORATION AND PRODUCTION, los cuales no fueron ni son objeto de evaluación dentro del trámite de \nlicenciamiento ambiental iniciado mediante Auto 10478 del 06 de diciembre de 2021. En este sentido, se \nreafirma lo considerado por el Equipo Evaluador de la ANLA en el Concepto Técnico 03397 del 17 de junio \nde 2022 acogido mediante Resolución 01350 de 2022: \n“(…)\nla dinámica hídrica que se presenta en un área inundable no es el único factor que define los planos de \ndesborde que modifican el paisaje de manera constante y dinámica, puesto que la acción antrópica de \nrellenar el terreno y conformar terrazas, modifica de forma inmediata y permanente el plano \ninundable, situación actual que claramente se observa en el área y que supone un cambio drástico \nen el flujo de agua, que a nivel ecosistémico, modifica los hábitats de la fauna acuática y las \ninteracciones inter e interespecíficas de complejas tramas tróficas.\n(…)” (Subrayado y negrilla fuera de texto).\nDe conformidad con lo anteriormente expuesto, se confirma la categoría de exclusión a las coberturas \ndefinidas como herbazal denso de tierra firme no arbolado, herbazal denso de tierra firme arbolado, herbazal \ndenso inundable no arbolado y herbazal denso inundable arbolado.\nTeniendo en cuenta lo expuesto anteriormente desde los componentes abiótico y biótico, la Zonificación de \nManejo Ambiental establecida para el Proyecto será la siguiente: \nTabla 1 Zonificación de Manejo Ambiental definida por la ANLA.\nÁREAS DE INTERVENCIÓN\n- Cobertura de la tierra de explotación de hidrocarburos.\nÁREAS DE EXCLUSIÓN\n- Franjas de protección de nacimientos de 100 metros, dentro del cual se incluye el punto identificado como el nacimiento del \ncaño Las Queseras, identificado por la Sociedad en las coordenadas planas Datum Magna Sirgas – Origen Nacional Este: \n5.186.917,871 y Norte: 2.106.982,888.\n- Franja de retiro de 30 metros a jagüeyes, tanques de agua y/o estanques piscícolas, caños o quebradas, lagunas, lagos, \nciénagas naturales, y meandros y otros cuerpos de agua lenticos y lóticos, haciendo la precisión que, para el caño Pirito esta \nexclusión no es aplicable, por ser un cuerpo de agua construido por la comunidad, para la recolección de las aguas que caen \nen la sabana en épocas de lluvia.   \n- Otra infraestructura petrolera o industrial existente en el área y su distancia de protección de 50 metros (Resolución 18-1495 \nde 2009), de la cual la Sociedad no presenta alguna intervención relacionada con las actividades del Proyecto, dentro de la \ncual se deben considerar:\nCaño Duya 1, coordenadas planas Datum Magna Sirgas – Origen Nacional E: 5179175,0427 N: 2104773,10332 el \ncual actualmente se encuentra inactivo. \nCaño Duya 2, coordenadas planas Datum Magna Sirgas – Origen Nacional E: 5180052,98787 N: 2105385,75492 el \ncual actualmente es un pozo productor.\nPozo Cocoa, coordenadas planas Datum Magna Sirgas – Origen Nacional E: 5200021,84036 N: 2103156,33859.\nPozo Oropéndola 1, coordenadas planas Datum Magna Sirgas – Origen Nacional E: 5180214,72858 N: \n2113405,91866 el cual actualmente es un pozo inactivo.\nParavare 1, coordenadas planas Datum Magna Sirgas – Origen Nacional E: 5171643,5273 N: 2119653,15924 el cual \nactualmente es un pozo inactivo. \nParavare 2, coordenadas planas Datum Magna Sirgas – Origen Nacional E: 5171573,19595 N: 2119697,93983 el cual \nactualmente es un pozo Productor.\n- Unidades geomorfológicas identificadas en la caracterización como Planicie de inundación (Fpdi), delta de desborde (Fddb) \ny cuenca de decantación (Fcd). \n- Pendientes mayores al 25%, identificadas en la caracterización como terrenos ligeramente empinados. \n\nResolución No.  01910           Del   08 de septiembre de 2022            Hoja No. 27 de 39\n“Por la cual se Resuelve el Recurso de Reposición interpuesto contra la Resolución 01350 del 21 de \njunio de 2022”\nOficinas: Carrera 13 A No. 34 – 72 Edificio 13 35 Pisos 8 al 11 Bogotá, D.C.\nCentro de Orientación y Radicación de Correspondencia: Carrera 13 A No. 34 – 72 Edificio 13 35 \nLocales 110 al 112 Bogotá, D.C.  \nCódigo Postal 110311156\nNit.: 900.467.239-2\nLínea de Orientación y Contacto Ciudadano: 57 (1) 2540100 / 018000112998 PBX: 57 (1) 2540111\nwww.anla.gov.co    Email: licencias@anla.gov.co  \nPágina 27 de 39\n- Unidades geológicas caracterizadas como Depósitos aluviales limo-arcillosos (Qal lim-Arc), unidad asociada a los planos de \ninundación del área de influencia y los depósitos aluviales arcillosos (Qal Arc), unidad asociada a las áreas donde por su \ncomposición, la infiltración del agua es lenta y las últimas en evacuar el agua acumulada por crecientes o lluvias. \n- Unidad de suelo denominadas: RVEb2, RVCb2, RVAc2, RVBb2, RVCc2 y RVAb2, unidades de suelo CAN y CAA.\n- Unidad de paisaje UP3, asociadas a las coberturas de bosque de galería y/o ripario en planicie de inundación.\n- Áreas en categoría de vulnerabilidad según la Lista Roja de Ecosistemas.\n- Áreas susceptibles a la inundación con un índice de vulnerabilidad del territorio alta.  \n- Ecosistemas de humedales identificados en la capa de Humedales V3 2020 (Ecosistemas Acuáticos 2015).\n- Áreas priorizadas para la conservación CONPES 3680 de 2010 definidas como “bosques naturales del peinobioma de la \nAmazonia y Orinoquia” en categoría de “alta insuficiencia y urgente prioridad”.\n- Áreas definidas como prioritarias de conservación de la biodiversidad definida como “bosque y sabanas Orocué del Sistema \nde Información Ambiental de Colombia - SIAC.\n- Área susceptible a procesos de restauración ecológica definida dentro de la capa “Portafolio de Restauración del Registro \nde Ecosistemas y Áreas Ambientales” del SIAC.\n- Áreas de alto valor de conservación según la capa de WWF 2011.\n- Áreas de alta representatividad ecosistémica según el Instituto de Hidrología, Meteorología y Estudios Ambientales – IDEAM.\n- Áreas con erosión moderada de tipo hídrico y clase laminar identificadas en la capa de zonificación de degradación de suelos \npor erosión del SIAC.\n- Áreas o figuras de protección establecidas en el EOT del municipio de Orocué.\n- Bosque de galería y/o ripario.\n- Herbazal denso de tierra firme no arbolado.\n- Herbazal denso de tierra firme arbolado.\n- Herbazal denso inundable no arbolado.\n- Herbazal denso inundable arbolado.\n- Vegetación secundaria alta.\n- Vegetación secundaria baja.\n- Tierras desnudas y degradadas.\n- Canales.\n- Cuerpos de agua artificiales.\n- Las viviendas y el tejido urbano discontinuo y demás infraestructura social tal como establecimientos educativos, centros de \nculto religioso, salones o casetas comunales, infraestructura recreativa, entre otros, y su ronda mínima de protección de 100 \nmetros.\nÁREAS DE INTERVENCIÓN CON RESTRICCIONES\nDESCRIPCIÓN DEL ÁREA\nRESTRICCIONES\n- Unidades de suelo: RVAb, RVAbi, RVAbz, RVAc, \nRVAci, RVAcz, RVAd, RVAdi, RVAdz, RVBai, RVBaz, \nRVBb, RVBbi, RVBbz, RVBc, RVBci, RVBcz, RVCai, \nRVCaz, RVCb, RVCbi, RVCbz, RVCc, RVCci, RVCcz, \nRVEai, RVEb, RVEbi, RVEbz, RVEc, RVEci y RVEcz.\nNo se podrá realizar ninguna intervención en épocas de \nlluvia.\n- Pendientes menores al 25% identificadas en la \ncaracterización como terrenos a nivel hasta terrenos \nmoderadamente inclinados.  \n- \nUnidades \ngeomorfológicas \nidentificadas \nen \nla \ncaracterización como Dique o albordón (Fa) y Terraza \naluvial (Fta).\n- Unidades geológicas caracterizadas como Depósitos \naluviales actuales areno-limosos (Q2al Are-lim), Depósitos \naluviales areno-limosos (Q1al Are-lim), Depósitos aluviales \nrecientes areno-gravoso (Q2al Are-G) y Depósitos de \nterraza aluvial (Qta). \n- Unidades de suelo denominadas ZVZ, dentro de la cual se \nencuentran las vías que hacen parte del área de influencia \ndel Proyecto y el área ya intervenida para la exploración de \nhidrocarburos.\nNo se podrá realizar ninguna intervención adicional a lo ya \nexistente. \nTodas las actividades aprobadas (mantenimiento de vías y \nlocación, transporte de hidrocarburos por carrotanques, \npruebas hidrostáticas, manejo de residuos, operación de \nfacilidades de producción y facilidades logísticas, \ngeneración de energía, entrega de residuos a terceros) solo \npodrán ser realizadas dentro de las áreas que se traslapen \ncon estos elementos y se encuentren intervenidas en la \netapa de exploración del Proyecto, es decir las coberturas \nindicadas dentro de la caracterización como ZVZ. \nPredios con extensión menor a 20 hectáreas (microfundios, \nminifundios y pequeña propiedad)\nEn los predios con tamaño menor a 20 hectáreas \n(microfundios, minifundios y pequeña propiedad), su \nintervención solo se podrá realizar previa autorización y/o \npermiso del propietario y se deberá garantizar que no dé \nlugar a la fragmentación de estos o afectación de alguna \nactividad de subsistencia (seguridad alimentaria). Se \npodrán realizar las actividades aprobadas para el proyecto \nconsiderando lo anteriormente mencionado.\nResguardo Indígena.\nLas \nactividades \nque \npodrán \nrealizarse \nserán \nexclusivamente las acordadas con esta comunidad en el \nmarco del proceso de consulta previa adelantado y avalado \npor la autoridad competente para el presente trámite\nFuente: Equipo Evaluador de la ANLA, 2022.\n\nResolución No.  01910           Del   08 de septiembre de 2022            Hoja No. 28 de 39\n“Por la cual se Resuelve el Recurso de Reposición interpuesto contra la Resolución 01350 del 21 de \njunio de 2022”\nOficinas: Carrera 13 A No. 34 – 72 Edificio 13 35 Pisos 8 al 11 Bogotá, D.C.\nCentro de Orientación y Radicación de Correspondencia: Carrera 13 A No. 34 – 72 Edificio 13 35 \nLocales 110 al 112 Bogotá, D.C.  \nCódigo Postal 110311156\nNit.: 900.467.239-2\nLínea de Orientación y Contacto Ciudadano: 57 (1) 2540100 / 018000112998 PBX: 57 (1) 2540111\nwww.anla.gov.co    Email: licencias@anla.gov.co  \nPágina 28 de 39\nFigura 1 Zonificación de Manejo Ambiental del Proyecto.\nFuente: Grupo de Servicios Geoespaciales - ANLA. Generado el 04/08/2022.\nFRENTE A LO ESTABLECIDO EN EL NUMERAL 1 DEL ARTÍCULO SÉPTIMO DE LA \nRESOLUCIÓN 1350 DEL 21 DE JUNIO DE 2022\n“…ARTÍCULO SÉPTIMO. La Licencia Ambiental Global contenida en el presente acto administrativo, lleva \nimplícito el uso, aprovechamiento y/o manejo de los recursos naturales renovables necesarios para el \ndesarrollo de las actividades del proyecto “Explotación de Hidrocarburos en el Campo Vikingo del Bloque \nLla-47”, de acuerdo con las condiciones, especificaciones y obligaciones que se exponen a continuación:\n1. CONCESIÓN DE AGUAS SUBTERRÁNEAS\nOtorgar a la sociedad INTEROIL COLOMBIA EXPLORATION AND PRODUCTION, concesión de aguas \nsubterráneas en un nuevo pozo perforado hasta una profundidad de 80m en la locación Vikingo y con un \ncaudal de 3l/s en un régimen de bombeo de 12 horas/día.\n\nResolución No.  01910           Del   08 de septiembre de 2022            Hoja No. 29 de 39\n“Por la cual se Resuelve el Recurso de Reposición interpuesto contra la Resolución 01350 del 21 de \njunio de 2022”\nOficinas: Carrera 13 A No. 34 – 72 Edificio 13 35 Pisos 8 al 11 Bogotá, D.C.\nCentro de Orientación y Radicación de Correspondencia: Carrera 13 A No. 34 – 72 Edificio 13 35 \nLocales 110 al 112 Bogotá, D.C.  \nCódigo Postal 110311156\nNit.: 900.467.239-2\nLínea de Orientación y Contacto Ciudadano: 57 (1) 2540100 / 018000112998 PBX: 57 (1) 2540111\nwww.anla.gov.co    Email: licencias@anla.gov.co  \nPágina 29 de 39\nObligaciones:\n1. Construir un nuevo pozo para la captación de aguas subterráneas, con tramos filtrantes entre 32 y 68 \nmetros y una profundidad máxima de pozo de 80 metros, así mismo, las características de la perforación y \ncompletamiento del nuevo pozo deberá tener en cuenta lo estipulado en la Norma Técnica Colombiana \nNTC-5539. Este pozo deberá tener un aislamiento hidráulico cerca de la profundidad techo del primer filtro \ny deberá ser identificado con el siguiente código ANLA: CSBLAV0078-00-2021-0001. Lo anterior, previo o \ndurante la actividad de perforación y completamiento del nuevo pozo de agua subterránea.\n2. Instalar sello sanitario en el pozo Vikingo ubicado en las coordenadas planas E: 5.187.327 m - N: \n2.106.956 m (Origen Único Nacional), en caso de no llevarse a cabo la instalación de dicho sello, el pozo \ndeberá ser abandonado teniendo en cuenta los lineamientos para clausurar pozos de agua subterránea \nestablecidos en la NTC 5539-2007. Lo anterior, previo o durante la actividad de perforación y \ncompletamiento del nuevo pozo de agua subterránea…”.\nPetición de la Sociedad\nOtorgar la concesión de aguas subterráneas para el pozo existente en la locación Vikingo.\nArgumentos de la Sociedad\nB. CONCESIÓN DE AGUAS SUBTERRÁNEAS \nSello sanitario y aislamiento hidráulico \nLa empresa SLS Energy, que realizó la perforación del pozo de agua en la locación Vikingo, envió a Interoil \noficio de fecha 7 de julio de 2022 (ANEXO), aclarando que, si realizó la construcción del sello sanitario de \n12 metros de profundidad, sin embargo, por errores de dibujo y edición en el “Informe técnico de pozo de \nagua vikingo 3774” esto no quedó consignado.\nPor otro lado, de acuerdo con la descripción litológica de los materiales perforados en el pozo de agua de \nla locación Vikingo, en la parte superior se encuentran 32 metros de rocas arcillosas, frente a los cuales se \ninstaló tubería ciega de revestimiento, es decir que el pozo no está conectado con los acuíferos superficiales \nmayoritariamente utilizados por la comunidad (aunque los pozos de la zona se ubican a más de 1.9 km de \ndistancia y no se afectarían). \nEsto se considera adecuado por parte de la autoridad ambiental, pues en la Resolución No 01350 del 21 de \njunio de 2022, la ANLA menciona: \n \n“En relación con el análisis de conflicto por aprovechamiento del recurso hídrico subterráneo, la Sociedad \nmenciona que, “se concluye que no se presentará interferencia de los conos de abatimiento entre los pozos \nexistentes en el área, dado que la distancia al pozo más cercano de la comunidad es de 1,9 Km (ver Figura \n4.12) y además tienen diferente profundidad, por lo que aprovechan distintos acuíferos”, lo anterior se \nconsidera adecuado teniendo en cuenta que actualmente no presentan puntos de la comunidad captando \ndel mismo nivel acuífero y cercanos a la locación.”\nNo se considera pertinente ni necesario perforar un nuevo pozo para extracción de aguas subterráneas, lo \ncual implicará impactos ambientales adicionales (entre otros, desplazamiento de equipos, consumo de \ncombustibles, utilización de insumos y recursos naturales, etc.), por lo que respetuosamente se solicita a la \nANLA otorgar la concesión de agua subterránea al pozo existente, el cual resultó productivo y la prueba de \nbombeo indica que se podría explotar con el caudal de 3 l/s durante 12 horas al día sin afectar el acuífero \nni pozos cercanos.\nEn todo caso, si se construyera el nuevo pozo concesionado, con las características mencionadas por la \nANLA en la Resolución 01350 del 21 de junio de 2022, también se produciría mezcla de agua de los dos \nacuíferos por el espacio anular rellenado con grava pues el sello sanitario se instalaría solo en la parte \nsuperior, donde no habría filtros.\n\nResolución No.  01910           Del   08 de septiembre de 2022            Hoja No. 30 de 39\n“Por la cual se Resuelve el Recurso de Reposición interpuesto contra la Resolución 01350 del 21 de \njunio de 2022”\nOficinas: Carrera 13 A No. 34 – 72 Edificio 13 35 Pisos 8 al 11 Bogotá, D.C.\nCentro de Orientación y Radicación de Correspondencia: Carrera 13 A No. 34 – 72 Edificio 13 35 \nLocales 110 al 112 Bogotá, D.C.  \nCódigo Postal 110311156\nNit.: 900.467.239-2\nLínea de Orientación y Contacto Ciudadano: 57 (1) 2540100 / 018000112998 PBX: 57 (1) 2540111\nwww.anla.gov.co    Email: licencias@anla.gov.co  \nPágina 30 de 39\nNo obstante, lo anterior, las características fisicoquímicas del agua resultado de la mencionada mezcla \ncumplen con la calidad de agua cruda para potabilizar, según la normatividad vigente, por lo que no es una \nfuente de contaminación para acuíferos superficiales.\nEs decir, a pesar de que el empaque de grava instalado en el pozo, produce interconexión de los 2 acuíferos \nperforados, no hay riesgo de que con esto se afecten los pozos de la comunidad, ni en cantidad ni en calidad \ndel agua subterránea.\nConsideraciones de la ANLA\nEn lo relacionado con la petición realizada por el recurrente en cuanto a “otorgar la concesión de aguas \nsubterráneas para el pozo existente en la locación Vikingo”, el equipo evaluador de la ANLA revisa y analiza \ncada uno de sus argumentos, como se presenta a continuación:\nSi bien la Sociedad dentro de los argumentos del recurso de reposición mencionó: “La empresa SLS Energy, \nque realizó la perforación del pozo de agua en la locación Vikingo, envió a Interoil oficio de fecha 7 de julio \nde 2022 (ANEXO)” y dicho anexo a pesar de que fue enlistado por la Sociedad dentro del acápite de anexos \ndel recurso, éste no fue presentado, por lo cual, el Equipo Evaluador de la ANLA no realizó un \npronunciamiento frente a este archivo indicado por la Sociedad\nEn cuanto a lo mencionado por la Sociedad, respecto que, si se realizó el sello sanitario de 12 metros de \nprofundidad y que lo anterior fue aclarado por la empresa SLS Energy, el EEA aclara que el pronunciamiento \nde la ANLA, se realizó basado en la información presentada por la Sociedad mediante radicado ANLA \n2022051066-1-000 y radicado VITAL – Ventanilla Única de Trámites Ambientales 3500086052965722001 \ndel 18 de marzo de 2022, en el cual no se observó las dimensiones y materiales del sello sanitario, y tal cual \ncomo se dijo en el respectivo acto administrativo y concepto técnico, el cual es una parte imprescindible de \ntoda captación de aguas subterráneas, debido a que garantiza el aislamiento de la misma, al evitar el ingreso \nde aguas superficiales o posibles sustancias contaminantes al empaque de grava y por ende a otros niveles \nacuíferos, es decir, el sello sanitario es una medida de manejo preventiva imprescindible con el objeto de \nevitar cambios en las características fisicoquímicas y/o microbiológicas de las aguas subterráneas.\nPor otro lado, la construcción del sello sanitario está contemplada en la Norma Técnica Colombiana (NTC-\n5539) la cual fue publicada desde el año 2007 y establece los requisitos mínimos para pozos profundos para \nsuministro de agua, dicha norma en el numeral 4.7.8.3 en lo relacionado con el sello sanitario menciona, “el \nespacio anular alrededor de la tubería de revestimiento del pozo y/o el conductor, desde la superficie hasta \nuna profundidad determinada, debe llevar lechada…”, dicha lechada es una mezcla fluida de cemento o \nbentonita con agua la cual debe ser dispuesta por el espacio anular del pozo, con el objeto de sellar y en el \ncaso del estudio ambiental se constituye como una medida de manejo preventiva que evita el ingreso de \naguas superficiales o posibles sustancias contaminantes a través el empaque de grava el cuál se caracteriza \npor ser permeable, facilitando el acceso de fluidos a todos los niveles acuíferos perforados en el pozo \nVikingo.\nFinalmente en lo relacionado con el empaque de grava, la norma menciona que éste se debe colocar en el \nespacio anular adyacente a los filtros del pozo, es decir, para el caso del pozo Vikingo se debe instalar entre \n32 a 44 metros y 50-68 metros, sin embargo, en el EIA Consolidado se observa que la Sociedad no tuvo en \ncuenta los requisitos mínimos para construcción de pozos profundos para suministro de agua establecidos \nen la norma ya mencionada y que desde el punto de vista de impactos son medidas adecuadas para el \nmanejo de los impactos del recurso hídrico subterráneo.\nEn cuanto a la descripción litológica del pozo de agua en la locación Vikingo y frente al argumento descrito \npor la Sociedad frente a que el pozo Vikingo no está conectado con los acuíferos superficiales considerando \nque se instaló tubería ciega de revestimiento, el Equipo Evaluador de la ANLA aclara que la tubería de \nrevestimiento del pozo tiene como propósito principal la conducción del agua subterránea y no presenta una \nfunción relacionada con el aislamiento de los niveles acuíferos, ya que la conexión entre diferentes niveles \nacuíferos ocurre por el espacio anular del pozo Vikingo.\n\nResolución No.  01910           Del   08 de septiembre de 2022            Hoja No. 31 de 39\n“Por la cual se Resuelve el Recurso de Reposición interpuesto contra la Resolución 01350 del 21 de \njunio de 2022”\nOficinas: Carrera 13 A No. 34 – 72 Edificio 13 35 Pisos 8 al 11 Bogotá, D.C.\nCentro de Orientación y Radicación de Correspondencia: Carrera 13 A No. 34 – 72 Edificio 13 35 \nLocales 110 al 112 Bogotá, D.C.  \nCódigo Postal 110311156\nNit.: 900.467.239-2\nLínea de Orientación y Contacto Ciudadano: 57 (1) 2540100 / 018000112998 PBX: 57 (1) 2540111\nwww.anla.gov.co    Email: licencias@anla.gov.co  \nPágina 31 de 39\nEn lo relacionado a que no se considera pertinente ni necesario perforar un nuevo pozo para extracción de \naguas subterráneas, debido a que implicará impactos ambientales adicionales, se aclara que el Estudio de \nImpacto Ambiental debe proponer e implementar las medidas de manejo necesarias y suficientes para el \nmanejo de cada uno de los impactos ambientales identificados para el recurso hídrico subterráneo, en este \nsentido, en el Estudio de Impacto Ambiental para la Explotación de hidrocarburos en el campo Vikingo del \nBloque LLA-47, la Sociedad no implementó la instalación de un sello sanitario como medida de manejo \npreventiva que evite el acceso de aguas superficiales y posibles contaminantes por el espacio anular del \npozo Vikingo, así mismo, como se indicó en la Resolución 1350 de 21 de junio de 2022, todos los niveles \nacuíferos hasta 120 metros de profundidad, están interconectados por el espacio anular del pozo Vikingo, \nes decir, que se está generando una mezcla de aguas entre los niveles acuíferos de la Formación Guayabo \ny niveles acuíferos de los Depósitos de Terraza Aluvial y en el caso de posibles contaminantes, \nconsiderando el almacenamiento de las aguas residuales no domésticas y domésticas (ARnD y ARD, \nrespectivamente) y manipulación de combustibles y crudo (Tabla 2.5 del EIA Consolidado con radicado \nANLA 2022051066-1-000 y radicado VITAL – Ventanilla Única de Trámites Ambientales \n3500086052965722001 del 18 de marzo de 2022), éstos tendrían acceso hasta los niveles acuíferos más \nprofundos.\nEn cuanto a que si se construyera un nuevo pozo de agua también se produciría mezcla de agua de los dos \nacuíferos por el espacio anular rellenado con grava, el Equipo Evaluador de la ANLA aclara que tal y como \nse dijo en el acto administrativo y en el concepto técnico que este acogió, el nuevo pozo deberá tener un \naislamiento hidráulico cerca de la profundidad techo del primer filtro, con el fin de aislar los niveles acuíferos \nde interés de la Sociedad de los niveles acuíferos más someros.\nFrente a las características fisicoquímicas del agua resultado de la mezcla de niveles acuíferos diferentes, \nse aclara que el Equipo Evaluador de la ANLA no indicó que la mezcla de aguas sea una fuente de \ncontaminación para acuíferos superficiales, la mezcla de aguas en el espacio anular del pozo, hace \nreferencia al posible impacto ambiental en la calidad del agua subterránea por la interconexión de dos \nacuíferos distintos que antes de la perforación estaban aislados hidráulicamente como se menciona en el \nnumeral 3.1.7.7 del EIA Consolidado correspondiente al radicado ANLA 2022051066-1-000 y radicado \nVITAL – Ventanilla Única de Trámites Ambientales 3500086052965722001 del 18 de marzo de 2022; por \notra parte, en caso de una carga contaminante, todos los niveles acuíferos serían vulnerables por el espacio \nanular del pozo hasta una profundidad de 120 metros, por lo anterior disponer medidas de manejo \nadecuadas como las instalación de un sello cerca de la profundidad techo del primer filtro, aislará los \nacuíferos, evitando la mezcla de agua entre ellos y el acceso de posibles cargas contaminantes hasta la \nprofundidad total del pozo.\nEn cuanto a que la interconexión de los acuíferos perforados no genera un riesgo que afecten los pozos de \nla comunidad ni en calidad ni en cantidad, este argumento se basa en que actualmente el pozo más cercano \nde la comunidad se halla a 1,9 kilómetros del pozo propuesto para captación de agua subterránea Vikingo, \nsin embargo, se desconoce lo mencionado anteriormente en cuanto a la medidas de manejo necesarias que \nse deben implementar para prevenir el impacto ambiental sobre la calidad del agua subterránea por mezcla \nde agua entre acuíferos diferentes y posibles cargas contaminantes provenientes de las aguas superficiales \no de las actividades al interior de la locación, es por ello que se debe implementar un sello sanitario y el \nsello hidráulico en el nuevo pozo solicitado.\nPor todo lo anterior, el EEA no considera adecuado “otorgar la concesión de aguas subterráneas para el \npozo existente en la locación Vikingo”, por los motivos anteriormente expuestos en la parte argumentativa \ndel presente acto administrativo, así las cosas, el EEA confirma lo dispuesto en el Numeral 1 del Artículo \nSéptimo de la Resolución 01350 del 21 de junio de 2022, asociadas a la concesión de agua subterránea.\nEn conclusión, en lo relacionado con la zonificación de manejo ambiental, de acuerdo a lo señalado \npor el Equipo Evaluador de la ANLA, sin desconocer la alta sensibilidad ambiental de las pendientes \nentre el 12% al 25%, las áreas que ocupan las mismas no son significativas frente al área que abarca \nel área de influencia del proyecto, disminuyendo la probabilidad de eventos en remoción de masa no \nsiendo determinante en la zonificación de manejo del proyecto, entre otras, se considera apropiado \ntécnicamente acceder a la solicitud de la Sociedad, retirando el elemento de pendientes mayores al \n12% de las áreas de exclusión e incluyendo únicamente aquellas áreas con pendientes mayores al \n\nResolución No.  01910           Del   08 de septiembre de 2022            Hoja No. 32 de 39\n“Por la cual se Resuelve el Recurso de Reposición interpuesto contra la Resolución 01350 del 21 de \njunio de 2022”\nOficinas: Carrera 13 A No. 34 – 72 Edificio 13 35 Pisos 8 al 11 Bogotá, D.C.\nCentro de Orientación y Radicación de Correspondencia: Carrera 13 A No. 34 – 72 Edificio 13 35 \nLocales 110 al 112 Bogotá, D.C.  \nCódigo Postal 110311156\nNit.: 900.467.239-2\nLínea de Orientación y Contacto Ciudadano: 57 (1) 2540100 / 018000112998 PBX: 57 (1) 2540111\nwww.anla.gov.co    Email: licencias@anla.gov.co  \nPágina 32 de 39\n25%, lo que conlleva a ajustar las zonificación de manejo ambiental en las áreas de intervención con \nrestricciones, en el sentido de incluir las pendientes menores a 25 %, como quedará establecido en la \nparte resolutiva del presente acto administrativo. \nAsí mismo, en cuanto a la solicitud de la sociedad de incluir como zonas de exclusión las zonas de \nerosión y sedimentación activa y las zonas cubiertas con bosque de galería en la zonificación de \nmanejo ambiental, de acuerdo a los argumentos expuestos por el Equipo Evaluador no se considera \ntécnicamente viable acceder a la propuesta, ya que teniendo en cuenta la predominancia de \npendientes inferiores al 12% en el área del Proyecto, no existen barreras naturales que permitan \nidentificar una amortiguación del fenómeno de inundaciones, aunado a lo anterior, de acuerdo a la \ninformación presentada por la sociedad, los depósitos aluviales actuales areno-limosos (Q2al Are-lim), \ndepósitos aluviales areno-limosos (Qal Are-lim), depósitos aluviales limo-arcillosos (Qal lim-Arc) y \ndepósitos aluviales arcillosos (Qal Arc), son depósitos cuaternarios que se encuentran presentes en \nel área de influencia del Proyecto, por los aportes de los sedimentos de los cuerpos hídricos presentes, \nlo que sustenta la importante influencia actual de la dinámica de los cuerpos de agua, en la \nconformación y consolidación de los suelos en el área de influencia del Proyecto. Por lo anterior, se \nautorizó la intervención del proyecto hasta donde fue solicitado y la infraestructura existente con las \nmejoras requeridas, para evitar, mitigar o corregir las afectaciones que estas intervenciones antrópicas \npuedan causar en la dinámica hídrica del área de influencia del Proyecto. \nPor lo anterior, se confirman como áreas de exclusión, los siguientes elementos asociados a los \ncomponentes geológico y geomorfológico: -Unidades geomorfológicas identificadas en la \ncaracterización como Planicie de inundación (Fpdi), delta de desborde (Fddb) y cuenca de decantación \n(Fcd). -Unidades geológicas caracterizadas como Depósitos aluviales limo-arcillosos (Qal lim-Arc), \nunidad asociada a los planos de inundación del área de influencia y los depósitos aluviales arcillosos \n(Qal Arc), -unidad asociada a las áreas donde por su composición, la infiltración del agua es lenta y \nlas últimas en evacuar el agua acumulada por crecientes o lluvias\nEn relación a las unidades de suelo, el equipo evaluador de la ANLA encuentra ambientalmente viable \nacceder de forma parcial, a lo solicitado por la Sociedad en el escrito de recurso de reposición, en el \nsentido de mantener en áreas de exclusión las unidades de suelo clasificadas con clase agrológica \nCLASE VIII (RVEb2, RVCb2, RVAc2, RVBb2, RVCc2 y RVAb2) y las unidades identificadas en el EIA \nconsolidado correspondiente al radicado ANLA 2022051066-1-000 y radicado VITAL – Ventanilla \nÚnica de Trámites Ambientales 3500086052965722001 del 18 de marzo de 2022; como CAN y CAA \nen estas mismas áreas de exclusión; e incluir las unidades de suelo: RVAb, RVAbi, RVAbz, RVAc, \nRVAci, RVAcz, RVAd, RVAdi, RVAdz, RVBai, RVBaz, RVBb, RVBbi, RVBbz, RVBc, RVBci, RVBcz, \nRVCai, RVCaz, RVCb, RVCbi, RVCbz, RVCc, RVCci, RVCcz, RVEai, RVEb, RVEbi, RVEbz, RVEc, \nRVEci y RVEcz; dentro de áreas de intervención con restricciones, las cuales no podrán ser \nintervenidas en épocas de lluvia para ninguna actividad del Proyecto, es decir entre los meses de abril \na octubre.\nRespecto a la solicitud de la sociedad de que la autoridad revise la unidad de paisaje UP30 que quedó \nen zona de exclusión, el Equipo Evaluador efectivamente encontró que las coberturas de bosques de \ngalería y/o ripario no corresponden a la unidad UP30 sino a la UP3, de acuerdo con la sensibilidad \nidentificada por los cuerpos de agua presentes en el área del Proyecto y su influencia en los niveles \nde los espejos de agua que se forman en la planicie aluvial. \nLa Autoridad al revisar, encuentra que se trató de un error de digitación y se considera procedente \nretirar la unidad de paisaje UP 30 “Herbazal denso inundable no arbolado en Terraza Aluvial” e incluir \nen áreas de exclusión la asociada a UP3 “coberturas de bosques de galería y/o ripario en planicie de \ninundación”, por lo cual se procederá a realizar la respectiva aclaración y en consecuencia la \nmodificación, teniendo en cuenta que dentro del Concepto Técnico acogido en el acto administrativo \nobjeto de recurso, todo el análisis de sensibilidad se realizó entorno a las coberturas ripario y/o \n\nResolución No.  01910           Del   08 de septiembre de 2022            Hoja No. 33 de 39\n“Por la cual se Resuelve el Recurso de Reposición interpuesto contra la Resolución 01350 del 21 de \njunio de 2022”\nOficinas: Carrera 13 A No. 34 – 72 Edificio 13 35 Pisos 8 al 11 Bogotá, D.C.\nCentro de Orientación y Radicación de Correspondencia: Carrera 13 A No. 34 – 72 Edificio 13 35 \nLocales 110 al 112 Bogotá, D.C.  \nCódigo Postal 110311156\nNit.: 900.467.239-2\nLínea de Orientación y Contacto Ciudadano: 57 (1) 2540100 / 018000112998 PBX: 57 (1) 2540111\nwww.anla.gov.co    Email: licencias@anla.gov.co  \nPágina 33 de 39\nbosques de galería y que la unidad de paisaje que corresponde a esa cobertura es la UP3, aunque \npor error quedara UP30.  \nAsí las cosas, y de acuerdo a lo establecido en el artículo 74 de la Ley 1437 de 2011, el cual señala: \n“ARTÍCULO 74. Recursos contra los actos administrativos. Por regla general, contra los actos \ndefinitivos procederán los siguientes recursos:\n1. El de reposición, ante quien expidió la decisión para que la aclare, modifique, adicione o revoque.\n(…)”\nSe procederá a realizar la aclaración respectiva, en lo relacionado con la zonificación de manejo \nambiental, estableciendo que la unidad de paisaje UP3, asociada a las coberturas de bosque de \ngalería y/o ripario en planicie de inundación, es la que pertenece a la categoría de exclusión.\nEn lo relacionado con los criterios asociados a las coberturas: herbazal denso de tierra firme no \narbolado, herbazal denso de tierra firme arbolado, herbazal denso inundable no arbolado y herbazal \ndenso inundable arbolado, respecto a la afirmación de la sociedad que al sobrevalorar la sensibilidad \nambiental de estas coberturas no permite la viabilidad de desarrollar futuras obras y/o actividades, el \nEquipo Evaluador precisa, en primer lugar, que el pronunciamiento por parte de la Autoridad solo se \nenfoca en la viabilidad de desarrollar obras o actividades que fueron objeto de solicitud de evaluación \ndentro del trámite de licenciamiento y en ese mismo sentido se analizan los permisos o autorizaciones, \npor lo que no es posible ni es competencia de esta Autoridad contemplar posibles solicitudes de \nmodificaciones a la licencia ambiental otorgada. \nPor lo cual, para las licencias ambientales, tal como lo dispone el artículo 2.2.2.3.5.1 del Decreto 1076 \nde 2015, el EIA es: “… el instrumento básico para la toma de decisiones sobre los proyectos, obras o \nactividades que requieren licencia ambiental y se exigirá en todos los casos en que de acuerdo con la \nley y el presente reglamento se requiera”.\nDe acuerdo con lo anterior, el fundamento para la toma de decisiones con respecto a la viabilidad de \nuna licencia ambiental se basa en uno de los principios de la política ambiental colombiana previstos \nen el artículo 1.º de la Ley 99 de 1993, cuyo numeral 11 señala:\n“(…)11. Los estudios de impacto ambiental serán el instrumento básico para la toma de decisiones \nrespecto a la construcción de obras y actividades que afecten significativamente el medio ambiente \nnatural o artificial…”\nDe esa manera la decisión en cuanto a la ejecución de un proyecto, obra o actividad sujeto a licencia \nambiental debe basarse en principio, en el análisis de cada uno de los elementos aportados dentro \nde la información que presentó la sociedad, bien sea en el EIA o en la información adicional requerida.\nEn segundo lugar, si bien estas coberturas o ecosistemas no cuentan con un instrumento ambiental \nespecífico, que prohíba el desarrollo de actividades relacionadas con proyectos de hidrocarburos, el \nEquipo Evaluador considera desde el punto de vista técnico que no significa que su estructura y \nfuncionalidad ecológica pierda su valor, toda vez que los elementos de flora y fauna, silvestre y \nacuática, que allí interactúan, son el reflejo de múltiples adaptaciones morfológicas y fisiológicas a las \ncondiciones de inundación producto de las dinámicas hídricas de la región.\nEn ese sentido, como un deber del Estado, entre otras, consagrado en el artículo 79 de la Constitución \nPolítica de Colombia, es el de proteger la diversidad e integridad del ambiente y conservar las áreas \nde especial importancia ecológica, por lo cual, teniendo en cuenta la función de las autoridades \nambientales de evaluar los posibles impactos ambientales y de acuerdo con lo establecido en el \n\nResolución No.  01910           Del   08 de septiembre de 2022            Hoja No. 34 de 39\n“Por la cual se Resuelve el Recurso de Reposición interpuesto contra la Resolución 01350 del 21 de \njunio de 2022”\nOficinas: Carrera 13 A No. 34 – 72 Edificio 13 35 Pisos 8 al 11 Bogotá, D.C.\nCentro de Orientación y Radicación de Correspondencia: Carrera 13 A No. 34 – 72 Edificio 13 35 \nLocales 110 al 112 Bogotá, D.C.  \nCódigo Postal 110311156\nNit.: 900.467.239-2\nLínea de Orientación y Contacto Ciudadano: 57 (1) 2540100 / 018000112998 PBX: 57 (1) 2540111\nwww.anla.gov.co    Email: licencias@anla.gov.co  \nPágina 34 de 39\nartículo 3 de la Ley 99 de 1993, es posible el desarrollo de actividades encaminadas al desarrollo \neconómico sin agotar la base de recursos naturales renovables en que se sustenta ni deteriorar el \nmedio ambiente; así las cosas, la competencia de esta Autoridad se dirige a imponer medidas \nambientales para los posibles impactos que se generen en desarrollo de los proyectos, obras o \nactividades sujetos a licenciamiento ambiental y por tanto es un deber, evaluar los ecosistemas \nsensibles que merecen especial protección a través de las medidas correspondientes. En \nconsecuencia, esta Autoridad confirmará la categoría de exclusión en la que se encuentran las \ncoberturas señaladas.\nPor otro lado, respecto a la solicitud de la Sociedad de otorgar la concesión de aguas subterráneas \npara el pozo existente en la locación Vikingo, teniendo en cuenta que si se construyó el sello sanitario \nde 12 metros de profundidad, pero por errores de dibujo y edición en el “Informe técnico de pozo de \nagua vikingo 3774” no quedó consignado y que no se considera necesaria la perforación de un nuevo \npozo para extraer aguas subterráneas, en aras de evitar impactos ambientales adicionales, el Equipo \nTécnico Evaluador conceptuó que de acuerdo a la información presentada, al no poderse verificar las \ndimensiones y materiales del sello sanitario (Toda vez que el anexo enlistado en el acápite de pruebas \ndel recurso “Certificación sello hidráulico o sello sanitario en pozo Vikingo, contrato 018 – 17, emitido \npor la empresa SLS ENERGY S.A.S”, no fue aportado), no garantizó que se evitarían cambios en las \ncaracterísticas fisicoquímicas y/o microbiológicas de las aguas subterráneas, así mismo, precisamente \npara evitar impactos ambientales adicionales, el nuevo pozo deberá tener un aislamiento hidráulico \ncerca de la profundidad techo del primer filtro, con el fin de aislar los niveles acuíferos de interés de la \nSociedad de los niveles acuíferos más someros. Por lo expuesto, esta Autoridad procederá a confirmar \nintegralmente el numeral primero del artículo séptimo de la resolución recurrida.\nPor lo anterior, acogiendo las recomendaciones presentadas en el Concepto Técnico 05417 del 07 de \nseptiembre de 2022 y las consideraciones expuestas, esta Autoridad procederá a confirmar lo \ndispuesto, en cuanto a la concesión de aguas subterráneas en un nuevo pozo perforado, establecida \nen el numeral primero del Artículo Séptimo y de otro lado, reponer en el sentido de modificar la \nzonificación de manejo ambiental establecida en el Artículo Noveno de la Resolución 01350 del 21 de \njunio de 2022, mediante la cual se otorgó Licencia Ambiental para el proyecto “Explotación de \nHidrocarburos en el Campo Vikingo del Bloque Lla-47”, localizado en jurisdicción del municipio de \nOrocué en el departamento del Casanare, conforme las consideraciones expuestas por el Equipo \nEvaluador Técnico.\nEn mérito de lo expuesto,\nRESUELVE:\nARTÍCULO PRIMERO: Confirmar el numeral primero del Artículo Séptimo de la Resolución 1350 del \n21 de junio de 2022, conforme lo expuesto en la parte motiva del presente acto administrativo.\nARTÍCULO SEGUNDO: Reponer en el sentido de modificar lo dispuesto en el Artículo Noveno de la \nResolución 1350 del 21 de junio de 2022, de conformidad con lo expuesto en la parte motiva del \npresente acto administrativo, el cual quedara así:\n“ARTÍCULO NOVENO. Establecer la zonificación de manejo ambiental para el proyecto \n“Explotación de Hidrocarburos en el Campo Vikingo del Bloque Lla-47”, de conformidad con lo \nexpuesto en la parte motiva del presente acto administrativo:\nTabla. Zonificación de Manejo Ambiental\nÁREAS DE INTERVENCIÓN\n- Cobertura de la tierra de explotación de hidrocarburos.\nÁREAS DE EXCLUSIÓN\n- Franjas de protección de nacimientos de 100 metros, dentro del cual se incluye el punto identificado \ncomo el nacimiento del caño Las Queseras, identificado por la Sociedad en las coordenadas planas \n\nResolución No.  01910           Del   08 de septiembre de 2022            Hoja No. 35 de 39\n“Por la cual se Resuelve el Recurso de Reposición interpuesto contra la Resolución 01350 del 21 de \njunio de 2022”\nOficinas: Carrera 13 A No. 34 – 72 Edificio 13 35 Pisos 8 al 11 Bogotá, D.C.\nCentro de Orientación y Radicación de Correspondencia: Carrera 13 A No. 34 – 72 Edificio 13 35 \nLocales 110 al 112 Bogotá, D.C.  \nCódigo Postal 110311156\nNit.: 900.467.239-2\nLínea de Orientación y Contacto Ciudadano: 57 (1) 2540100 / 018000112998 PBX: 57 (1) 2540111\nwww.anla.gov.co    Email: licencias@anla.gov.co  \nPágina 35 de 39\nDatum Magna Sirgas – Origen Nacional Este: 5.186.917,871 y Norte: 2.106.982,888.\n- Franja de retiro de 30 metros a jagüeyes, tanques de agua y/o estanques piscícolas, caños o \nquebradas, lagunas, lagos, ciénagas naturales, y meandros y otros cuerpos de agua lenticos y lóticos, \nhaciendo la precisión que, para el caño Pirito esta exclusión no es aplicable, por ser un cuerpo de agua \nconstruido por la comunidad, para la recolección de las aguas que caen en la sabana en épocas de \nlluvia.   \n- Otra infraestructura petrolera o industrial existente en el área y su distancia de protección de 50 metros \n(Resolución 18-1495 de 2009), de la cual la Sociedad no presenta alguna intervención relacionada \ncon las actividades del Proyecto, dentro de la cual se deben considerar:\nCaño Duya 1, coordenadas planas Datum Magna Sirgas – Origen Nacional E: \n5179175,0427 N: 2104773,10332 el cual actualmente se encuentra inactivo. \nCaño Duya 2, coordenadas planas Datum Magna Sirgas – Origen Nacional E: \n5180052,98787 N: 2105385,75492 el cual actualmente es un pozo productor.\nPozo Cocoa, coordenadas planas Datum Magna Sirgas – Origen Nacional E: \n5200021,84036 N: 2103156,33859.\nPozo Oropéndola 1, coordenadas planas Datum Magna Sirgas – Origen Nacional E: \n5180214,72858 N: 2113405,91866 el cual actualmente es un pozo inactivo.\nParavare 1, coordenadas planas Datum Magna Sirgas – Origen Nacional E: \n5171643,5273 N: 2119653,15924 el cual actualmente es un pozo inactivo. \nParavare 2, coordenadas planas Datum Magna Sirgas – Origen Nacional E: \n5171573,19595 N: 2119697,93983 el cual actualmente es un pozo Productor.\n- Unidades geomorfológicas identificadas en la caracterización como Planicie de inundación (Fpdi), \ndelta de desborde (Fddb) y cuenca de decantación (Fcd). \n- Pendientes mayores al 25%, identificadas en la caracterización como terrenos ligeramente empinados. \n- Unidades geológicas caracterizadas como Depósitos aluviales limo-arcillosos (Qal lim-Arc), unidad \nasociada a los planos de inundación del área de influencia y los depósitos aluviales arcillosos (Qal \nArc), unidad asociada a las áreas donde por su composición, la infiltración del agua es lenta y las \núltimas en evacuar el agua acumulada por crecientes o lluvias. \n- Unidad de suelo denominadas: RVEb2, RVCb2, RVAc2, RVBb2, RVCc2 y RVAb2, unidades de suelo \nCAN y CAA.\n- Unidad de paisaje UP3, asociadas a las coberturas de bosque de galería y/o ripario en planicie de \ninundación.\n- Áreas en categoría de vulnerabilidad según la Lista Roja de Ecosistemas.\n- Áreas susceptibles a la inundación con un índice de vulnerabilidad del territorio alta.  \n- Ecosistemas de humedales identificados en la capa de Humedales V3 2020 (Ecosistemas Acuáticos \n2015).\n- Áreas priorizadas para la conservación CONPES 3680 de 2010 definidas como “bosques naturales \ndel peinobioma de la Amazonia y Orinoquia” en categoría de “alta insuficiencia y urgente prioridad”.\n- Áreas definidas como prioritarias de conservación de la biodiversidad definida como “bosque y \nsabanas Orocué del Sistema de Información Ambiental de Colombia - SIAC.\n- Área susceptible a procesos de restauración ecológica definida dentro de la capa “Portafolio de \nRestauración del Registro de Ecosistemas y Áreas Ambientales” del SIAC.\n- Áreas de alto valor de conservación según la capa de WWF 2011.\n- Áreas de alta representatividad ecosistémica según el Instituto de Hidrología, Meteorología y Estudios \nAmbientales – IDEAM.\n- Áreas con erosión moderada de tipo hídrico y clase laminar identificadas en la capa de zonificación de \ndegradación de suelos por erosión del SIAC.\n- Áreas o figuras de protección establecidas en el EOT del municipio de Orocué.\n- Bosque de galería y/o ripario.\n- Herbazal denso de tierra firme no arbolado.\n- Herbazal denso de tierra firme arbolado.\n- Herbazal denso inundable no arbolado.\n- Herbazal denso inundable arbolado.\n- Vegetación secundaria alta.\n- Vegetación secundaria baja.\n- Tierras desnudas y degradadas.\n\nResolución No.  01910           Del   08 de septiembre de 2022            Hoja No. 36 de 39\n“Por la cual se Resuelve el Recurso de Reposición interpuesto contra la Resolución 01350 del 21 de \njunio de 2022”\nOficinas: Carrera 13 A No. 34 – 72 Edificio 13 35 Pisos 8 al 11 Bogotá, D.C.\nCentro de Orientación y Radicación de Correspondencia: Carrera 13 A No. 34 – 72 Edificio 13 35 \nLocales 110 al 112 Bogotá, D.C.  \nCódigo Postal 110311156\nNit.: 900.467.239-2\nLínea de Orientación y Contacto Ciudadano: 57 (1) 2540100 / 018000112998 PBX: 57 (1) 2540111\nwww.anla.gov.co    Email: licencias@anla.gov.co  \nPágina 36 de 39\n- Canales.\n- Cuerpos de agua artificiales.\n- Las viviendas y el tejido urbano discontinuo y demás infraestructura social tal como establecimientos \neducativos, centros de culto religioso, salones o casetas comunales, infraestructura recreativa, entre \notros, y su ronda mínima de protección de 100 metros.\nÁREAS DE INTERVENCIÓN CON RESTRICCIONES\nDESCRIPCIÓN DEL ÁREA\nRESTRICCIONES\n- Unidades de suelo: RVAb, RVAbi, RVAbz, RVAc, \nRVAci, RVAcz, RVAd, RVAdi, RVAdz, RVBai, \nRVBaz, RVBb, RVBbi, RVBbz, RVBc, RVBci, \nRVBcz, RVCai, RVCaz, RVCb, RVCbi, RVCbz, \nRVCc, RVCci, RVCcz, RVEai, RVEb, RVEbi, \nRVEbz, RVEc, RVEci y RVEcz.\nNo se podrá realizar ninguna intervención en épocas \nde lluvia.\n- Pendientes menores al 25% identificadas en la \ncaracterización como terrenos a nivel hasta terrenos \nmoderadamente inclinados.  \n- Unidades geomorfológicas identificadas en la \ncaracterización como Dique o albordón (Fa) y \nTerraza aluvial (Fta).\n- Unidades geológicas caracterizadas como \nDepósitos aluviales actuales areno-limosos (Q2al \nAre-lim), Depósitos aluviales areno-limosos (Q1al \nAre-lim), Depósitos aluviales recientes areno-\ngravoso (Q2al Are-G) y Depósitos de terraza aluvial \n(Qta). \n- Unidades de suelo denominadas ZVZ, dentro de la \ncual se encuentran las vías que hacen parte del área \nde influencia del Proyecto y el área ya intervenida \npara la exploración de hidrocarburos.\nNo se podrá realizar ninguna intervención adicional \na lo ya existente. \nTodas las actividades aprobadas (mantenimiento de \nvías y locación, transporte de hidrocarburos por \ncarrotanques, pruebas hidrostáticas, manejo de \nresiduos, operación de facilidades de producción y \nfacilidades logísticas, generación de energía, \nentrega de residuos a terceros) solo podrán ser \nrealizadas dentro de las áreas que se traslapen con \nestos elementos y se encuentren intervenidas en la \netapa de exploración del Proyecto, es decir las \ncoberturas indicadas dentro de la caracterización \ncomo ZVZ. \nPredios con extensión menor a 20 hectáreas \n(microfundios, minifundios y pequeña propiedad)\nEn los predios con tamaño menor a 20 hectáreas \n(microfundios, minifundios y pequeña propiedad), su \nintervención solo se podrá realizar previa \nautorización y/o permiso del propietario y se deberá \ngarantizar que no dé lugar a la fragmentación de \nestos o afectación de alguna actividad de \nsubsistencia (seguridad alimentaria). Se podrán \nrealizar las actividades aprobadas para el proyecto \nconsiderando lo anteriormente mencionado.\nResguardo Indígena.\nLas actividades que podrán realizarse serán \nexclusivamente las acordadas con esta comunidad \nen el marco del proceso de consulta previa \nadelantado y avalado por la autoridad competente \npara el presente trámite.\nFuente: Equipo Evaluador de la ANLA, 2022.\nFigura 49 Zonificación de manejo ambiental del Proyecto.\n\nResolución No.  01910           Del   08 de septiembre de 2022            Hoja No. 37 de 39\n“Por la cual se Resuelve el Recurso de Reposición interpuesto contra la Resolución 01350 del 21 de \njunio de 2022”\nOficinas: Carrera 13 A No. 34 – 72 Edificio 13 35 Pisos 8 al 11 Bogotá, D.C.\nCentro de Orientación y Radicación de Correspondencia: Carrera 13 A No. 34 – 72 Edificio 13 35 \nLocales 110 al 112 Bogotá, D.C.  \nCódigo Postal 110311156\nNit.: 900.467.239-2\nLínea de Orientación y Contacto Ciudadano: 57 (1) 2540100 / 018000112998 PBX: 57 (1) 2540111\nwww.anla.gov.co    Email: licencias@anla.gov.co  \nPágina 37 de 39\nFuente: Grupo de Servicios Geoespaciales - ANLA. Generado el 04/08/2022.\nARTÍCULO TERCERO: Los demás términos y condiciones establecidos en la Resolución 1350 del 21 \nde junio de 2022, mediante la cual se otorgó Licencia Ambiental a la sociedad INTEROIL COLOMBIA \nEXPLORATION AND PRODUCTION para el proyecto denominado “Explotación de Hidrocarburos en \nel Campo Vikingo del Bloque Lla-47”, continúan vigentes de conformidad con las consideraciones \nexpuestas en la parte motiva de este acto administrativo.\nARTÍCULO CUARTO: Notificar el presente acto administrativo a la sociedad INTEROIL COLOMBIA \nEXPLORATION AND PRODUCTION, a través de su representante legal, o apoderado, o a la persona \nautorizada, de conformidad con lo establecido en los artículos 67 y siguientes del Código de \nProcedimiento Administrativo y de lo Contencioso Administrativo.\nARTÍCULO QUINTO: Comunicar el contenido del presente acto administrativo, a la Alcaldía del \nmunicipio Orocué en el departamento del Casanare, a la Corporación Autónoma Regional de la \nOrinoquía – CORPORINOQUIA, a la Procuraduría Delegada para Asuntos Ambientales y Agrarios y \na la Agencia Nacional de Hidrocarburos – ANH.\n\nResolución No.  01910           Del   08 de septiembre de 2022            Hoja No. 38 de 39\n“Por la cual se Resuelve el Recurso de Reposición interpuesto contra la Resolución 01350 del 21 de \njunio de 2022”\nOficinas: Carrera 13 A No. 34 – 72 Edificio 13 35 Pisos 8 al 11 Bogotá, D.C.\nCentro de Orientación y Radicación de Correspondencia: Carrera 13 A No. 34 – 72 Edificio 13 35 \nLocales 110 al 112 Bogotá, D.C.  \nCódigo Postal 110311156\nNit.: 900.467.239-2\nLínea de Orientación y Contacto Ciudadano: 57 (1) 2540100 / 018000112998 PBX: 57 (1) 2540111\nwww.anla.gov.co    Email: licencias@anla.gov.co  \nPágina 38 de 39\nARTÍCULO SEXTO: Disponer la publicación de la presente Resolución en la gaceta ambiental de esta \nEntidad. \nARTÍCULO SÉPTIMO: Contra el presente acto administrativo no procede ningún recurso, de \nconformidad con lo establecido en el inciso segundo del numeral 2 del artículo 74 de la Ley 1437 de \n2011.\nNOTIFÍQUESE, COMUNÍQUESE, PUBLÍQUESE Y CÚMPLASE\nDada en Bogotá D.C., a los 08 de septiembre de 2022\nRODRIGO SUAREZ CASTAÑO\nDirector General\nEjecutores\nMARIA CATALINA SANTANA \nHERNANDEZ\nContratista\n \n \nRevisor / L\u0000der\nALVARO CEBALLOS HERNANDEZ\nContratista\n \nANA MARIA VILLEGAS RAMIREZ\nProfesional Especializado\n \nJHON WILLAN MARMOL \nMONCAYO\nContratista\n \n \nExpediente No. \nLAV0078-00-2021\nConcepto Técnico \nConcepto Técnico 05417 del 07 de septiembre de 2022\nFecha:\nSeptiembre de 2022   \nProceso No.: 2022197058\nArchívese en: LAV0078-00-2021     \nPlantilla_Resolución_SILA_v3_42852\nNota: Este es un documento electrónico generado desde los Sistemas de Información de la ANLA. El original reposa en los archivos digitales de la \nEntidad.\n\nResolución No.  01910           Del   08 de septiembre de 2022            Hoja No. 39 de 39\n“Por la cual se Resuelve el Recurso de Reposición interpuesto contra la Resolución 01350 del 21 de \njunio de 2022”\nOficinas: Carrera 13 A No. 34 – 72 Edificio 13 35 Pisos 8 al 11 Bogotá, D.C.\nCentro de Orientación y Radicación de Correspondencia: Carrera 13 A No. 34 – 72 Edificio 13 35 \nLocales 110 al 112 Bogotá, D.C.  \nCódigo Postal 110311156\nNit.: 900.467.239-2\nLínea de Orientación y Contacto Ciudadano: 57 (1) 2540100 / 018000112998 PBX: 57 (1) 2540111\nwww.anla.gov.co    Email: licencias@anla.gov.co  \nPágina 39 de 39\n"
}