{
  "fuente": "ANLA_GACETA",
  "numero_resolución": "RESOLUCIÓN N° 001291",
  "fecha_resolución": "2024-02-28",
  "nombre_proyecto": "proyecto de expansión del Gaseoducto desde Cusiana Fases 1 y II, la compra de predios en áreas",
  "ubicación": "departamento de Casanare, Páez, Miraflores, Zetaquirá, Ramiriquí, Jenesano, Boyacá, Samacá, Villa de Leyva, Sáchica, Sutamarchán, Santa Sofía y Moniquirá en el departamento de Boyacá, Puente Nacional, Jesús María, Florián y Albania en el departamento de Santander.",
  "empresa": "PMA a la sociedad ECOPETROL S.A.",
  "numero_expediente": "LAM0054",
  "radicados": [
    "2020225100",
    "2022005934",
    "2023069393",
    "20246200290002",
    "20236200731332",
    "20236200336002"
  ],
  "descripcion": "POR LA CUAL SE RESUELVE UN RECURSO DE REPOSICIÓN EN CONTRA DE LA RESOLUCIÓN 314 DEL 28 DE FEBRERO DE 2024",
  "tipos_infraccion": [
    "Vertimientos",
    "Emisiones atmosféricas",
    "Residuos sólidos",
    "Manejo de aguas",
    "Tala o afectación de bosques",
    "Incumplimiento del PMA"
  ],
  "pdf_id": "46907",
  "file_name": "ANLA_46907.pdf",
  "texto_completo": "República de Colombia\nMinisterio de Ambiente y Desarrollo Sostenible\nAUTORIDAD NACIONAL DE LICENCIAS \nAMBIENTALES\n- ANLA –\nRESOLUCIÓN N° 001291\n(27 JUN. 2024)\nPágina 1 de 42\n“POR LA CUAL SE RESUELVE UN RECURSO DE REPOSICIÓN EN CONTRA DE LA \nRESOLUCIÓN 314 DEL 28 DE FEBRERO DE 2024”\nEL DIRECTOR DE LA AUTORIDAD NACIONAL DE LICENCIAS AMBIENTALES – \nANLA\nEn uso de sus facultades legales, en especial de aquellas conferidas por medio de la Ley \n99 de 1993, el Decreto ley 3573 de 2011, el Decreto 3578 de 2011, el Decreto 376 de \n2020, el Decreto 1076 del 26 de 2015, la Resolución 1957 del 05 de noviembre de 2021 y,\nCONSIDERANDO:\nQue mediante Resolución 847 del 22 de septiembre de 1997, el entonces Ministerio del \nMedio Ambiente, hoy Ministerio de Ambiente y Desarrollo Sostenible, en adelante el \nMinisterio, estableció Plan de Manejo Ambiental – PMA a la sociedad ECOPETROL S.A., \npara la conversión del Oleoducto a Gasoducto en el sector Cusiana - La Belleza (Oleoducto \nCentral de Los Llanos), localizado en jurisdicción de los municipios de Tauramena y \nMonterrey en el departamento de Casanare, Páez, Miraflores, Zetaquirá, Ramiriquí, \nJenesano, Boyacá, Samacá, Villa de Leyva, Sáchica, Sutamarchán, Santa Sofía y \nMoniquirá en el departamento de Boyacá, Puente Nacional, Jesús María, Florián y Albania \nen el departamento de Santander.\nQue mediante Resolución 335 del 22 de abril de 1998, el Ministerio autorizó la cesión de \nlos derechos y obligaciones contenidos en la Resolución 847 de 1997 a favor de la \nEMPRESA COLOMBIANA DE GAS - ECOGAS.\nQue mediante Auto 285 del 21 de julio de 1999, el Ministerio ordenó la acumulación de los \nexpedientes LAM0849 y LAM0054.\nQue mediante Resolución 2193 del 29 de diciembre de 2005, el Ministerio modificó la \nResolución 847 de 1997 en el sentido de autorizar la construcción y operación de la estación \ncompresora de gas Miraflores, localizada en la vereda Guamal jurisdicción del municipio de \nMiraflores en el departamento de Boyacá.\nQue mediante Resolución 855 del 17 de mayo de 2007, el Ministerio autorizó la cesión del \nPlan de Manejo Ambiental – PMA establecido mediante la Resolución 847 del 22 de \nseptiembre de 1997 a favor de la sociedad TRANSPORTADORA DE GAS DEL INTERIOR \nS.A. E.S.P - TGI.\n\nResolución No. 001291       Del 27 JUN. 2024          Hoja No. 2 de 42\n“POR LA CUAL SE RESUELVE UN RECURSO DE REPOSICIÓN EN CONTRA DE LA \nRESOLUCIÓN 314 DEL 28 DE FEBRERO DE 2024”\nPágina 2 de 42\nQue mediante Resolución 1007 del 1 de junio de 2009, el Ministerio modificó la Resolución \n847 del 22 de septiembre de 1997, en el sentido de autorizar la construcción del Loop de \n37 km en el tramo comprendido entre Samacá y Santa Sofía, departamento de Boyacá; la \nconstrucción de la Estación compresora de Puente Guillermo, la construcción de un tramo \nde 1.8 km en tubería de 20” para conectar la nueva estación y el gasoducto existente en el \nmunicipio de Puente Nacional, departamento de Santander y las obras de ampliación de la \nestación compresora de Miraflores, en el municipio de Miraflores, departamento de Boyacá.\nQue mediante la Resolución 1671 del 1 de septiembre de 2009, el Ministerio aclaró los \nnumerales 1) y 3) del artículo segundo de la Resolución 1007 del 1 de junio de 2009, en el \nsentido de autorizar la construcción del Loop en el tramo comprendido entre Samacá y \nSanta Sofía, departamento de Boyacá, la construcción de la estación compresora de \nPuente Guillermo, municipio de Puente Nacional en el departamento de Santander, y la \nampliación de la estación compresora de Miraflores, obras localizadas dentro de la estación \nexistente, municipio de Miraflores, departamento de Boyacá.\nQue mediante la Resolución 2277 del 25 de noviembre de 2009, el Ministerio modificó el \nartículo primero de la Resolución 847 del 22 de septiembre de 1997, en el sentido de \nautorizar la construcción y operación de dos loops, y de una variante del corredor en la cual \nse construye tanto el nuevo Loop como el gasoducto, entre otras determinaciones.\nQue mediante la Resolución 1006 del 27 de mayo de 2010, el Ministerio aclaró el artículo \ndécimo de la Resolución 2277 del 25 de noviembre de 2009, en el sentido de precisar que, \nen caso de requerirse la utilización y aprovechamiento de los recursos naturales renovables \npor el desarrollo del proyecto, los permisos correspondientes deberán tramitarse y \nobtenerse de forma previa ante la autoridad ambiental regional competente.\nQue mediante la Resolución 1359 del 15 de julio de 2010, el Ministerio aceptó el cambio de \nrazón social del titular del Plan de Manejo Ambiental TRANSPORTADORA DE GAS DEL \nINTERIOR S.A. E.S.P, por el de TRANSPORTADORA DE GAS INTERNACIONAL S.A. \nESP - TGI S.A. E.S.P - TGI S.A. E.S.P.\nQue mediante Resolución 799 del 3 de mayo de 2011, el Ministerio autorizó el \nlevantamiento parcial y temporal de la veda de las especies de las familias Bromeliaceae, \nOrchidiaceae y Cyatheceae, igualmente de las especies de Musgos, Hepáticas y Líquenes \npresentes en el proyecto.\nQue mediante Resolución 839 del 10 de mayo de 2011, el Ministerio repuso los artículos \nsegundo, tercero, cuarto, quinto y sexto de la Resolución 799 del 3 de mayo de 2011. \nQue mediante Resolución 25 del 23 de enero de 2012, el Ministerio aclaró el artículo \nséptimo de la Resolución 2277 del 25 de noviembre de 2009, en el sentido de modificar la \nzonificación de manejo ambiental.\nQue mediante la Resolución 160 del 9 de marzo de 2012, la Autoridad Nacional de Licencias \nAmbientales – ANLA, en adelante esta Autoridad Nacional, ajustó vía seguimiento la \nResolución 1007 del 1 de junio de 2009, en el sentido de incluir como medida de \n\nResolución No. 001291       Del 27 JUN. 2024          Hoja No. 3 de 42\n“POR LA CUAL SE RESUELVE UN RECURSO DE REPOSICIÓN EN CONTRA DE LA \nRESOLUCIÓN 314 DEL 28 DE FEBRERO DE 2024”\nPágina 3 de 42\ncompensación por cambio en el uso del suelo en áreas nuevas a afectar, la compra de \npredios en ecosistemas y áreas estratégicas en la misma proporción que el programa de \nrevegetalización, es decir con el establecimiento de especies forestales nativas en \nproporción 1:1.\nQue mediante Resolución 475 del 15 de junio de 2012, esta Autoridad Nacional modificó \nvía seguimiento la Resolución 2277 del 25 de noviembre de 2009, en el sentido de \nestablecer la obligación de diseñar e implementar un programa de revegetalización con el \nestablecimiento de especies forestales nativas, en predios adquiridos por la sociedad o en \nsu defecto realizar la compra de predios en ecosistemas y áreas estratégicas como medida \nde compensación establecida para el proyecto.\nQue mediante Resolución 827 del 28 de septiembre de 2012, esta Autoridad Nacional \naclaró el artículo primero de la Resolución 475 del 15 de junio de 2012, mediante la cual se \nmodificó la medida de compensación establecida para el proyecto.\nQue mediante Resolución 777 del 2 de julio de 2015, esta Autoridad Nacional modificó el \nartículo octavo de la Resolución 1007 de 2009 en el sentido de incluir como alternativa para \nel cumplimiento de la compensación forestal establecida por la construcción del proyecto \nde expansión del Gaseoducto desde Cusiana Fases 1 y II, la compra de predios en áreas \nestratégicas, entre otras determinaciones.\nQue mediante Auto 3518 del 28 de junio de 2018, esta Autoridad Nacional aclaró el numeral \n18 del artículo cuarto del Auto 4959 del 31 de octubre de 2017 relacionado con el retiro de \ntodas las obras de arte de los cuerpos de agua NN que se encuentran ubicadas a lo largo \ndel tramo objeto de abandono, exceptuando las obras de canalización de la Quebrada La \nCecilia, entre otras determinaciones.\nQue mediante Resolución 738 del 3 de mayo de 2019, esta Autoridad Nacional modificó el \nPlan de Manejo Ambiental establecido mediante la Resolución 847 del 22 de septiembre de \n1997, para la construcción y operación del Loop denominado Puente Guillermo - La Belleza.\nQue mediante Resolución 2523 del 24 de diciembre de 2019, esta Autoridad Nacional \nmodificó el Plan de Manejo Ambiental establecido mediante la Resolución 847 del 22 de \nseptiembre de 1997, en el sentido de autorizar una infraestructura para la construcción y \noperación del Loop El Porvenir – Miraflores y de autorizar algunas actividades para la \nconstrucción y operación del Loop Puente Guillermo – La Belleza, entre otras \ndeterminaciones.\nQue mediante los Autos 10412 del 27 de octubre de 2020, 10810 del 12 de noviembre de \n2020 y 8657 del 4 de octubre de 2022, esta Autoridad Nacional avocó conocimiento de las \nactuaciones administrativas relacionadas con unas autorizaciones de levantamiento parcia \nde veda, remitidas por el Ministerio de Ambiente y Desarrollo Sostenible – MADS, obrantes \nen los expedientes ATV00027, ATV00765 y ATV0546).\nQue mediante los Autos 4466 del 9 de octubre de 2014, 2245 del 5 de junio de 2015, 4959 \ndel 31 de octubre de 2017, 5440 del 7 de septiembre de 2018, 7261 del 6 de septiembre de \n2019, 11867 del 16 de diciembre de 2020, 6344 del 17 de agosto de 2021, 9013 del 25 de \n\nResolución No. 001291       Del 27 JUN. 2024          Hoja No. 4 de 42\n“POR LA CUAL SE RESUELVE UN RECURSO DE REPOSICIÓN EN CONTRA DE LA \nRESOLUCIÓN 314 DEL 28 DE FEBRERO DE 2024”\nPágina 4 de 42\noctubre de 2021, 10196 del 29 de noviembre de 2021, 8366 del 27 de septiembre de 2022, \n11870 del 30 de diciembre de 2022 y 6374 del 17 de agosto de 2023, y las Actas de Control \ny Seguimiento Ambiental No. 24 del 3 de marzo de 2022, No. 144 del 4 de abril de 2023 y \nNo. 199 del 30 de abril de 2024, esta Autoridad Nacional realizó control y seguimiento \nambiental al proyecto, y efectuó algunos requerimientos.\nQue mediante radicado 2020225100-1-000 del 18 de diciembre de 2020, la sociedad remitió \nactualización del Plan de Manejo Ambiental y del Plan de Seguimiento y Monitoreo para las \nfases de operación y mantenimiento del proyecto Gasoducto El Porvenir – La Belleza. \nQue mediante radicado 2022005934-1-000 del 18 de enero de 2022, la sociedad solicitó \npronunciamiento respecto a la actualización del Plan de Manejo Ambiental y Plan de \nSeguimiento y Monitoreo para las fases de operación y mantenimiento del proyecto \nGasoducto El Porvenir – La Belleza, entregado mediante radicado 2020225100-1-000 del \n18 de diciembre de 2020.\nQue mediante radicado 2023069393-1-000 del 31 de marzo del 2023, la sociedad presentó \nrespuesta al artículo tercero del Auto 11870 del 30 de diciembre de 2022, presentando los \najustes solicitados y relacionados con el PMA y al PSM. \nQue mediante Concepto Técnico 3601 del 22 de junio de 2023, esta Autoridad Nacional \nrealizó el análisis técnico a los radicados 2020225100-1-000 del 18 de diciembre de 2020 \ny 2023069393-1-000 del 31 de marzo del 2023 y evaluó el documento denominado \n“Actualización del Plan de Manejo Ambiental”, el cual fue acogido mediante la Resolución \n314 del 28 de febrero de 2024.\nQue mediante el Concepto Técnico 5041 del 15 de agosto de 2023, esta Autoridad Nacional \nefectuó seguimiento y control ambiental al Proyecto, acogido mediante el Auto 6374 del 17 \nde agosto de 2023, del que se extrajeron algunas consideraciones técnicas que hicieron \nparte de la Resolución 314 del 28 de febrero de 2024.\nQue mediante Resolución 314 del 28 de febrero de 2024, esta Autoridad Nacional actualizó \nel Plan de Manejo Ambiental, señalando las medidas y programas de manejo ambiental, \nlas fichas y medidas de seguimiento y monitoreo y las medidas a tener en cuenta en las \nactividades de abandono y restauración parcial, así como otras determinaciones dentro del \nexpediente LAM0054 Gasoducto Cusiana Porvenir - La Belleza, de conformidad con los \nConceptos Técnicos 3601 del 22 de junio de 2023 y 5041 del 15 de agosto de 2023.\nQue a través de comunicación con radicación 20246200290002 del 14 de marzo de 2024, \nla Doctora ANGÉLICA MARÍA RIVERA MANTILLA, en calidad de apoderada general de la \nsociedad TRANSPORTADORA DE GAS INTERNACIONAL S.A. ESP - TGI S.A. E.S.P ESP \ncon NIT 900.134.459-7, interpuso recurso de reposición en contra de la Resolución 314 del \n28 de febrero de 2024.\nCOMPETENCIA DE LA AUTORIDAD NACIONAL DE LICENCIAS AMBIENTALES – \nANLA.\n \nEn ejercicio de las facultades extraordinarias conferidas en los literales d), e) y f), del artículo \n18 de la Ley 1444 de 2011, el Gobierno Nacional expide el Decreto 3573 del 27 de \n\nResolución No. 001291       Del 27 JUN. 2024          Hoja No. 5 de 42\n“POR LA CUAL SE RESUELVE UN RECURSO DE REPOSICIÓN EN CONTRA DE LA \nRESOLUCIÓN 314 DEL 28 DE FEBRERO DE 2024”\nPágina 5 de 42\nseptiembre de 2011, creando la Autoridad Nacional de Licencias Ambientales - ANLA, y le \nasigna entre otras funciones, la de otorgar o negar las licencias, permisos y trámites \nambientales de competencia del Ministerio de Ambiente y Desarrollo Sostenible.\nEl citado Decreto-Ley 3573 del 27 de septiembre de 2011, en su artículo tercero, numerales \n1 y 2 prevé como funciones de la Autoridad Nacional de Licencias Ambientales la de otorgar \no negar las licencias, permisos y trámites ambientales de competencia del Ministerio de \nAmbiente y Desarrollo Sostenible de conformidad con la Ley y los Reglamentos, como \ntambién la de realizar el seguimiento de las licencias, permisos y trámites ambientales. \nQue el Decreto 3578 del 27 de septiembre de 2011, por el cual se establece la planta de \npersonal de la Autoridad Nacional de Licencias Ambientales -ANLA y se le confiere a ésta \nel carácter de planta global, en su artículo 2°, dispuso la distribución de los cargos de la \nplanta global teniendo en cuenta la estructura, los planes, los programas y las necesidades \nde la institución.\nQue mediante el artículo 2.2.2.3.1.2, del Decreto 1076 de 2015 “Por medio del cual se \nexpide el Decreto Único Reglamentario del Sector Ambiente y Desarrollo Sostenible”, se \nestablece que la Autoridad nacional de Licencias Ambientales – ANLA, es competente para \notorgar o negar licencia ambiental, conforme a la ley y a las reglamentaciones vigentes.\nQue mediante el numeral 2 del artículo segundo del Decreto 376 de 2020, “Por el cual se \nmodifica la estructura de la Autoridad Nacional de Licencias Ambientales ANLA”, se atribuyó \nal Despacho de la Dirección General, entre otras funciones, suscribir los actos \nadministrativos que otorgan, niegan, modifican, ajustan o declaran la terminación de las \nlicencias, permisos y trámites ambientales.\nQue mediante la Resolución 1597 del 5 de noviembre de 2021, se adopta el Manual \nEspecífico de Funciones y de Competencias Laborales, para los empleos de la planta de \npersonal de la Autoridad Nacional de Licencias Ambientales – ANLA.\nQue en consideración a que el director general de la Autoridad Nacional de Licencias \nAmbientales -ANLA-, suscribió la Resolución 314 del 28 de febrero de 2024, es el \nfuncionario competente para resolver el presente recurso de reposición interpuesto por la \nsociedad TRANSPORTADORA DE GAS INTERNACIONAL S.A. ESP - TGI S.A. E.S.P ESP \nde conformidad con lo señalado en artículo 74 de la Ley 1437 de 2011.\nFUNDAMENTOS CONSTITUCIONALES Y LEGALES.\nEl artículo 8 de la Constitución Política establece que \"Es obligación del Estado y de las \npersonas proteger las riquezas culturales y naturales de la nación\".\nLa Constitución Política elevó a rango constitucional la obligación que tiene el Estado de \nproteger el medio ambiente, y el derecho que tienen todos los ciudadanos a gozar de un \nambiente sano y así mismo \"Es deber del Estado proteger la diversidad e integridad del \nambiente, conservar las áreas de especial importancia ecológica y fomentar la educación \npara el logro de estos fines.\" (artículo 79 de la Constitución Política). El medio ambiente es \n\nResolución No. 001291       Del 27 JUN. 2024          Hoja No. 6 de 42\n“POR LA CUAL SE RESUELVE UN RECURSO DE REPOSICIÓN EN CONTRA DE LA \nRESOLUCIÓN 314 DEL 28 DE FEBRERO DE 2024”\nPágina 6 de 42\nun derecho colectivo que debe ser protegido por el Estado, estableciendo todos los \nmecanismos necesarios para su protección.\nAdicionalmente, el Estado debe planificar el manejo y aprovechamiento de los recursos \nnaturales para garantizar su desarrollo sostenible, su conservación, restauración o \nsustitución, tal y como lo establece el artículo 80 de la Constitución Política. Al efecto, la \nplanificación se debe realizar utilizando una serie de mecanismos que permitan analizar, \nevaluar y prever unas circunstancias que faciliten la toma de decisión, con el fin de alcanzar \nun objetivo propuesto, en este caso, el Desarrollo Sostenible.\nDEL RECURSO DE REPOSICIÓN.\nDe acuerdo con la legislación, el recurso de reposición constituye un instrumento legal \nmediante el cual la parte interesada tiene la oportunidad de ejercer el derecho de \ncontrovertir una decisión, para que la administración previa su evaluación, la confirme, \naclare modifique o revoque, previo el lleno de las exigencias legales establecidas para dicho \nefecto. \nFrente al recurso de reposición, ha manifestado la doctrina: \n“El de reposición se ha considerado históricamente como recurso connatural al \nEstado de derecho; en especial al derecho fundamental a la controversia de toda \ndecisión administrativa. Se funda esta tesis en el criterio de que no existe acto \nadministrativo sin control. Se trata, pues, del más elemental de todos los recursos \npara garantizar el principio de la contradicción y el debido proceso”1\nEn dicho sentido, la finalidad esencial del recurso de reposición no es otra distinta que \nfacultar para que el funcionario de la administración que tomó una decisión administrativa \ntenga la oportunidad para enmendar o corregir un error, o los posibles errores que se hayan \npodido presentar en el acto administrativo por él expedido, en ejercicio de sus funciones.\nPROCEDENCIA DEL RECURSO INTERPUESTO\nEsta Autoridad Nacional considera necesario indicar algunos aspectos relacionados con las \nfacultades de las autoridades administrativas en la expedición de los actos administrativos \nmediante los cuales se resuelven recursos contra los actos administrativos.\nEl procedimiento, oportunidad y requisitos para la interposición del recurso de reposición se \nencuentra reglado en el Código de Procedimiento Administrativo y de lo Contencioso \nAdministrativo en los siguientes artículos:\n\"ARTICULO 74. Recursos contra los actos administrativos. Por regla general, contra \nlos actos definitivos procederán los siguientes recursos:\nEl de reposición, ante quien expidió la decisión, para que la aclare, modifique o \nrevoque.\n1 Santofimio Gamboa Jaime Orlando. Tratado de derecho Administrativo, 4ta edición. Universidad Externado de \nColombia, 1998, p. 266.\n\nResolución No. 001291       Del 27 JUN. 2024          Hoja No. 7 de 42\n“POR LA CUAL SE RESUELVE UN RECURSO DE REPOSICIÓN EN CONTRA DE LA \nRESOLUCIÓN 314 DEL 28 DE FEBRERO DE 2024”\nPágina 7 de 42\n(…)\nARTICULO 76. Oportunidad y presentación. Los recursos de reposición y apelación \ndeberán interponerse por escrito en la diligencia de notificación personal, o dentro \nde los diez (10) días siguientes a ella, o a la notificación por aviso, o al vencimiento \ndel término de publicación, según el caso (…) \nLos recursos se presentarán ante el funcionario que dictó la decisión…”\nA su vez, el artículo 77 del precitado Código señala:\n\"ARTICULO 77. Requisitos. Por regla general los recursos se interpondrán por \nescrito que no requiere de presentación personal sí quien lo presenta ha sido \nreconocido en la actuación. Igualmente, podrán presentarse por medios \nelectrónicos.\nLos recursos deberán reunir, además los siguientes requisitos:\n1.\nInterponerse dentro del plazo legal, por el interesado o su representante o \napoderado debidamente constituido.\n2.\nSustentarse con expresión concreta de los motivos de inconformidad.\n3.\nSolicitar y aportar las pruebas que se pretende hacer valer.\n4.\nIndicar el nombre y la dirección del recurrente, así como la dirección \nelectrónica si desea ser notificado por este medio. ( ... )”\nPor su parte, el artículo 80 del Código de Procedimiento Administrativo y de lo Contencioso \nAdministrativo, determina:\n\"ARTÍCULO 80. Decisión de los Recursos. Vencido el periodo probatorio, si a ello \nhubiere lugar, y sin necesidad de acto que así lo declare, deberá proferirse la \ndecisión motivada que resuelva el recurso.\nLa decisión resolverá todas las peticiones que hayan sido oportunamente \nplanteadas y las que surjan con motivo del recurso.\"\nPara el caso concreto que nos ocupa, la Resolución 314 del 28 de noviembre de 2024, es \nun proveído susceptible de ser recurrido, según el artículo 74 de la Ley 1437 de 2011, \npuesto que se trata de un acto definitivo en la medida en que adopta una decisión que \nmanifiesta la voluntad del Estado y es generadora de efectos jurídicos que, en los términos \ndel Consejo de Estado, tal como lo señaló en sentencia de la Sección Tercera de la Sala \nde lo Contencioso Administrativo del 8 de marzo de 2012, se caracteriza por lo siguiente:\n“(…) Por el contrario, los actos definitivos ponen fin de manera perentoria a la \nactuación administrativa sea de oficio o impulsada a petición de parte, de modo que \nen ellos se agota la actividad de la administración, o tan sólo queda pendiente la \nejecución de lo decidido. Ahora bien, es cierto que los únicos actos susceptibles de \nla Acción Contenciosa Administrativa son los actos definitivos, es decir que se \nexcluyen los de trámite, pues éstos se controlan jurisdiccionalmente como parte \n\nResolución No. 001291       Del 27 JUN. 2024          Hoja No. 8 de 42\n“POR LA CUAL SE RESUELVE UN RECURSO DE REPOSICIÓN EN CONTRA DE LA \nRESOLUCIÓN 314 DEL 28 DE FEBRERO DE 2024”\nPágina 8 de 42\nintegrante del acto definitivo y conjuntamente con éste, es decir de aquel que cierra \nla actuación administrativa.”\nA partir de lo anteriormente expuesto, se procede a revisar si el recurso de reposición \ninterpuesto y que es objeto de este pronunciamiento administrativo, ha cumplido los \nrequisitos legales que lo rigen para efectos de emitir decisión de fondo:\nLa Resolución 314 del 28 de febrero de 2024 por medio de la cual se actualiza el Plan de \nManejo Ambiental y se adoptan otras determinaciones objeto de reproche, fue notificada a \nla sociedad TRANSPORTADORA DE GAS INTERNACIONAL S.A. ESP - TGI S.A. E.S.P \nESP, el 29 de febrero de 2024.\nAhora bien, el recurso de reposición se interpuso el 14 de marzo de 2024, es decir, dentro \ndel término de diez (10) días hábiles siguientes al de la fecha de la citada notificación, \nobservando así, el requisito de oportunidad legal para su presentación.\nDe igual manera, el recurso de reposición fue interpuesto mediante comunicación con \nradicado ANLA    20246200290002 de 14 de marzo de 2024, por la doctora ANGÉLICA \nMARÍA RIVERA MANTILLA, en calidad de apoderada general de la sociedad \nTRANSPORTADORA DE GAS INTERNACIONAL S.A. ESP - TGI S.A. E.S.P ESP de \nacuerdo a poder otorgado mediante Escritura Pública No.1274 de la Notaría 6 de Bogotá \ndel 14 de octubre de 2020, inscrita el 4 de noviembre de 2020 bajo el No. 00044277 del \nlibro V , conforme al Certificado de Existencia y Representación que obra en el expediente, \nverificándose así, la legitimidad por activa para impulsar el presente recurso. A su vez, el \nrecurso contiene los motivos de inconformidad y dirección de notificaciones, cumpliéndose \nasí los requisitos expuestos en el artículo 77 de la Ley 1437 de 2011. \nSiendo ello así, al verificarse el cumplimiento de los requisitos legales establecidos para la \nprocedencia del recurso de reposición, se efectuará el análisis de fondo de los motivos de \ninconformidad del recurrente tal y como se expone a continuación.\nSOBRE EL RECURSO DE REPOSICIÓN INTERPUESTO. \nA continuación, se realiza el análisis uno a uno de los argumentos del recurso de reposición \npresentado por la apoderada general de la sociedad TRANSPORTADORA DE GAS \nINTERNACIONAL S.A. ESP - TGI S.A. E.S.P ESP, mediante radicado 20246200290002 de \n14 de marzo de 2024. \nPara tal efecto, en primer lugar se indicará la petición elevada por la recurrente; \nposteriormente los argumentos o motivos de inconformidad del recurso y seguido de ello, \nlas consideraciones de esta Autoridad frente a cada argumento, con el objeto de adoptar \nlas decisiones de fondo.\nel desarrollo de la presente actuación administrativa se llevará a cabo de la siguiente \nmanera: 1. Cita de la disposición administrativa recurrida; 2. La petición del recurrente; 3. \nLos argumentos o motivos de inconformidad del recurrente y 4. Consideraciones jurídicas \nde la ANLA, tal y como se expone a continuación.  \n\nResolución No. 001291       Del 27 JUN. 2024          Hoja No. 9 de 42\n“POR LA CUAL SE RESUELVE UN RECURSO DE REPOSICIÓN EN CONTRA DE LA \nRESOLUCIÓN 314 DEL 28 DE FEBRERO DE 2024”\nPágina 9 de 42\n1.\nOBLIGACIÓN RECURRIDA FICHA AMS-5 MANEJO DE ESCORRENTÍA DEL \nNUMERAL 3 DEL ARTICULO SEGUNDO.  \nEl acto administrativo en cita señala:\n“ARTÍCULO SEGUNDO. AJUSTAR las siguientes fichas del PMA, presentadas por la \nsociedad TRANSPORTADORA DE GAS INTERNACIONAL S.A. ESP - TGI S.A. E.S.P., \npara lo cual deberá incluir y reportar su implementación, en los Informes de \nCumplimiento Ambiental:\n(…)\n3. Ficha AMS-5 Manejo de escorrentía. \nMeta: Construir y mantener de forma oportuna el 100% de obras de drenaje requeridas \npara garantizar el adecuado manejo de aguas lluvias y/o escorrentía que se generen en \nlas áreas operativas del gasoducto El Porvenir La Belleza.”\nPetición de la sociedad.\nLa sociedad en el Recurso de Reposición presentado mediante comunicación con radicado \nANLA 20246200290002 del 14 de marzo de 2024, solicitó:\n“Modificar el Artículo Segundo, numeral 3 Ficha AMS-5 Manejo de escorrentía”.\nArgumentos de la sociedad.\nSegún lo enunciado en el recurso de reposición la sociedad argumenta lo siguiente:\n“(…) Respecto al ajuste requerido para la ficha AMS-5 Manejo de escorrentía, en \ndonde se solicitó incluir la meta de “Construir y mantener de forma oportuna el 100% \nde obras de drenaje requeridas para garantizar el adecuado manejo de aguas lluvias \ny/o escorrentía que se generen en las áreas operativas del gasoducto El Porvenir La \nBelleza”, es importante resaltar, en primera instancia, que el objetivo principal de la \nficha de manejo, corresponde a evitar: 1) la afectación de la calidad de las aguas \nsuperficiales, 2) el desarrollo de procesos erosivos, 3) el deterioro progresivo de los \nsuelos y 4) el aporte de sedimentos a los drenajes naturales, todo ello, mediante el \nmanejo adecuado de las aguas de escorrentía; \nSiendo así como la identificación de las medidas a adoptar para el adecuado manejo \nde las aguas de escorrentía se debe realizar a partir de la valoración objetiva que \nproporcionan las inspecciones periódicas al derecho de vía DDV y la viabilización \ntécnica, social y ambiental, las cuales proporcionarían información sobre el grado de \ncriticidad de la zona de afectación y la solución efectiva para contrarrestar, mitigar y \ncontrolar las afectaciones evidenciados, todas ellas en conjunto los factores objetivos \nque determinarán la viabilidad o necesidad de construcción de nuevas obras de \ndrenaje y/o realizar los mantenimientos necesarios. \n\nResolución No. 001291       Del 27 JUN. 2024          Hoja No. 10 de 42\n“POR LA CUAL SE RESUELVE UN RECURSO DE REPOSICIÓN EN CONTRA DE LA \nRESOLUCIÓN 314 DEL 28 DE FEBRERO DE 2024”\nPágina 10 de 42\nTeniendo en cuenta el contexto anterior, la ficha AMS-5 Manejo de escorrentía \nestablece una serie de medidas de manejo, indicadores de cumplimiento, costos y \ncronograma de ejecución, enfocados en el adecuado manejo de las aguas de \nescorrentía a partir de las inspecciones periódicas, la valoración del proyecto y las \nnecesidades puntuales sobre manejo adecuado de las aguas de escorrentía.\nEs así, que, al definir una meta enfocada en la construcción del 100% de las obras \nde drenaje, se eliminaría el aporte fundamental que generan los resultados de las \ninspecciones periódicas al derecho de vía DDV, así como la valoración técnica, social \ny ambiental, teniente a identificar la solución de manejo de aguas de escorrentía más \nadecuada a la zona y a los impactos evidenciados. Razón por lo cual, se solicita a \nesta autoridad reevaluar el ajuste de la meta requerida, en los siguientes términos: \nMeta: Inspeccionar y mantener de forma oportuna el 100% de obras de \ndrenaje y construir las que se estimen necesarias para garantizar el \nadecuado manejo de aguas lluvias y/o escorrentía que se generen en las \náreas operativas del gasoducto El Porvenir- La Belleza.”\nConsideraciones Técnicas de la ANLA\nEsta Autoridad Nacional como parte de la verificación de los aspectos referentes al proyecto \n“Gasoducto El Porvenir – La Belleza” contenido en el expediente LAM0054 y en particular \nlos argumentos expuestos por la sociedad respecto la Resolución recurrida, emitió el \nConcepto Técnico 2860 del 7 de mayo de 2024, considerando lo siguiente:\n“(…) Revisado el expediente, se encuentra que la meta inicialmente planteada por la \nSociedad a través de los radicados 2020225100-1-000 del 18 de diciembre de 2020 \ny 2021219792-1-000 del 11 de octubre de 2021 fue la siguiente: \n“Garantizar en un 100% el funcionamiento del sistema de drenaje de aguas lluvias \nen los centros operacionales de gas y área superficiales de la infraestructura del \ngasoducto donde sea aplicable”\nEsta Autoridad Nacional luego de la evaluación técnica de dicha información a través \nde los conceptos técnicos 8004 del 21 de diciembre de 2022 y 3601 del 22 de junio \nde 2023, este último acogido por el numeral 3 del artículo segundo de la Resolución \n314 de 28 de febrero de 2024 (recurrida), consideró que dicha meta debía ser \najustada dado que el proyecto no contaba con centros operacionales; en \nconsecuencia, se ajustó e impuso a la Sociedad que la meta quedara en los siguientes \ntérminos:\n“Construir y mantener de forma oportuna el 100% de obras de drenaje \nrequeridas para garantizar el adecuado manejo de aguas lluvias y/o escorrentía \nque se generen en las áreas operativas del gasoducto El Porvenir La Belleza.”\nLa Sociedad recurre esta obligación solicitando que la meta sea ajustada en los \nsiguientes términos:\n\nResolución No. 001291       Del 27 JUN. 2024          Hoja No. 11 de 42\n“POR LA CUAL SE RESUELVE UN RECURSO DE REPOSICIÓN EN CONTRA DE LA \nRESOLUCIÓN 314 DEL 28 DE FEBRERO DE 2024”\nPágina 11 de 42\n “Inspeccionar y mantener de forma oportuna el 100% de obras de drenaje y \nconstruir las que se estimen necesarias para garantizar el adecuado manejo de \naguas lluvias y/o escorrentía que se generen en las áreas operativas del \ngasoducto El Porvenir- La Belleza.” \nPara resolver, se encuentra que la reposición solicitada por la Sociedad se refiere \nespecíficamente al ajuste de la meta asociada a la Ficha AMS-5 Manejo de \nescorrentía, meta que fue ajustada e impuesta por esta Autoridad a través de la \nResolución 314 del 28 de febrero de 2024; es de tener claro que, siendo el objetivo \nde la Ficha AMS-5 evitar la afectación de la calidad de las aguas superficiales, el \ndesarrollo de procesos erosivos, deterioro progresivo de los suelos y aporte de \nsedimentos a los drenajes naturales mediante el manejo adecuado de las aguas de \nescorrentía, la meta se concentra en garantizar el adecuado manejo de estas aguas \nde escorrentía y construir las obras necesarias que lo soporten y/o acrediten. \nSe debe considerar que el proyecto se encuentra actualmente en etapa de \noperación y en consecuencia ya fueron construidas e implementadas las obras \nnecesarias para manejo de aguas de escorrentía, proyectadas en el PMA aprobado; \nen este momento, lo que queda pendiente es construir aquellas obras adicionales o \nel mantenimiento de las existentes que, como resultado del seguimiento a través de \nvisitas e inspecciones, bien sea por parte de la Sociedad o de esta Autoridad \nNacional, se identifiquen necesarias con el fin de poder cumplir con el objetivo de la \nficha. \nEn este sentido, es claro para esta Autoridad que, estando el proyecto en etapa de \noperación, las inspecciones al derecho de vía y al proyecto en general resultan \nfundamentales para establecer las condiciones del mismo ya que a partir de ellas \nse pueden identificar los sitios y las obras del sistema de drenaje que, dada su \ncriticidad, deben ser objeto de mantenimiento; además, en estas inspecciones \npueden ser identificados nuevos sitios que, igualmente, dada su criticidad ameritan \nla construcción de adicionales obras de drenaje, todo aquello con el fin de garantizar \nel adecuado manejo de aguas lluvias y/o escorrentía que se generen en las áreas \noperativas del gasoducto. \nConsiderando lo anteriormente manifestado, se encuentra que al enfocar la meta en \nla construcción del 100% de las obras de drenaje, se deja de lado el aporte que \npueden generan las inspecciones periódicas al proyecto, que, en la etapa de \noperación, son la esencia fundamental del seguimiento, las cuales se enfocan en \nidentificar los puntos críticos y también la solución del manejo de aguas de \nescorrentía más adecuada a la zona y los impactos evidenciados y, si es del caso, \nla obra que se ajuste a esas necesidades. (…)”\n2.\nOBLIGACIÓN RECURRIDA FICHA AMS-6 MANEJO DE RESIDUOS SOLIDOS Y \nESPECIALES DEL NUMERAL 4 DEL ARTICULO SEGUNDO.\nEl acto administrativo en cita señala:\n\nResolución No. 001291       Del 27 JUN. 2024          Hoja No. 12 de 42\n“POR LA CUAL SE RESUELVE UN RECURSO DE REPOSICIÓN EN CONTRA DE LA \nRESOLUCIÓN 314 DEL 28 DE FEBRERO DE 2024”\nPágina 12 de 42\n“ARTÍCULO SEGUNDO. AJUSTAR las siguientes fichas del PMA, presentadas por la \nsociedad TRANSPORTADORA DE GAS INTERNACIONAL S.A. ESP - TGI S.A. E.S.P., \npara lo cual deberá incluir y reportar su implementación, en los Informes de \nCumplimiento Ambiental:\n(…)\n4. Ficha AMS-6 Manejo de residuos sólidos y especiales:\na) Ajustar el cronograma de ejecución de la ficha e implementar a la periodicidad \nmensual, manteniéndose en periodicidad bimensual la actividad de capacitaciones. \n(…)”\nPetición de la sociedad\nLa sociedad en el Recurso de Reposición presentado mediante comunicación con radicado \nANLA 20246200290002 del 14 de marzo de 2024, solicitó:\n“Modificar el Artículo segundo numeral 4 Ficha AMS-6 Manejo de residuos sólidos \ny especiales.”\nArgumentos de la sociedad\nSegún lo enunciado en el recurso de reposición la sociedad argumenta lo siguiente:\n“(…) Dentro de la Ficha de manejo AMS-6 Manejo de residuos sólidos y especiales, \nse estableció como medida asociada a las capacitaciones, el divulgar el Plan de \nGestión Integral de Residuos Sólidos - PGIRS y sus resultados a través de actividades \nde sensibilización, usando los medios de comunicación interna de la empresa ya sea \nde manera presencial o virtual; siendo así, como dentro del PGRIS definido para toda \nla organización, TGI S.A. ESP., ha establecido adecuado para los fines de mantener \ninformado al personal sobre la gestión integral de residuos sólidos, realizar los \nespacios de capacitación de manera semestral, es decir dos (2) veces al año, esto, \ncon el fin de dar mayor alcance a los procesos de formación y concientización \ndefinidos en las componentes de acción del PGIRS. \nEs importante anotar que considerar un frecuencia bimensual (dos veces al mes) de \nlas actividades de capacitación, no permitiría un proceso de apropiación de \nconocimientos eficiente por parte de los colaboradores, esto, en términos de que, \nestablecer periodos tan cortos lo que ocasionaría seria generar información repetitiva, \ndesconociendo el fin de actualización de estas socializaciones y desgastes \nadministrativos y técnico tanto de los colaboradores como los capacitadores, siendo \ncontraproducente para lograr el fin de la medida, la cual como se ha indicado, \ncorresponden en mantener actualizado al personal respecto al cumplimiento de las \nnormativas ambientales nuevas y existentes asociadas al manejo de residuos sólidos, \nasí como, de reforzar temáticas relacionadas. \n\nResolución No. 001291       Del 27 JUN. 2024          Hoja No. 13 de 42\n“POR LA CUAL SE RESUELVE UN RECURSO DE REPOSICIÓN EN CONTRA DE LA \nRESOLUCIÓN 314 DEL 28 DE FEBRERO DE 2024”\nPágina 13 de 42\nOtro aspecto a tener en cuenta es que dentro de la ficha SECP-1 Educación y \nCapacitación al Personal Vinculado al Proyecto, donde se detalla a mayor escala la \nmedida de manejo enfocada en la capacitación al personal directo de TGI frente al \nmanejo y protección ambiental y sociocultural, describe todos los temas que se \ntrabajaran desde el medio abiótico, como es el manejo de residuos sólidos y \nespeciales, con una frecuencia de aplicación anual. No obstante, esta ficha también \npropone la ejecución de charlas educativas al personal vinculado de manera \ntrimestral, enfocadas en las mismas temáticas que las capacitaciones. \nPor lo anterior, se solicita a esta autoridad reevaluar el ajuste a la periodicidad de la \nactividad de capacitación de bimensual a semestral, esto, con el fin de poder generar \nespacios de formación completos con programación de tiempos suficientes para el \ndesarrollo de distintas temáticas de capacitación ambiental con el personal vinculado, \nlo anterior fundamentado las siguientes variables:\n1. Eficiencia de tiempo y recursos: la ejecución de capacitaciones semestrales \npermite concentrar de manera más eficiente el tiempo y los recursos en la \nplanificación y ejecución de dos (2) únicas sesiones anuales de capacitación extensa, \nlo cual evitaría interrupciones frecuentes en la operación normal del negocio, situación \nque pueden ocurrir con mayor probabilidad en la ejecución de capacitaciones \nquincenales.\n2. Profundidad y cobertura: Con una periodicidad semestral, se pueden cubrir no \nsolo temáticas de gestión de residuos, si no, también temáticas ambientales de otros \nmedios como el biótico o socioeconómico, lo que permite una comprensión más \ncompleta de los temas tratados. En contraste, las sesiones bimensuales pueden \nlimitarse a temas más superficiales debido a la restricción de tiempo.\nCon base en lo anterior se solicita el ajuste de la medida en los siguientes términos: \n4. Ficha AMS-6 Manejo de residuos sólidos y especiales: \na) Ajustar el cronograma de ejecución de la ficha e implementar a la \nperiodicidad semestral, manteniéndose en periodicidad semestral la \nactividad de capacitaciones”.\nConsideraciones Técnicas de la ANLA\nEsta Autoridad Nacional como parte de la verificación de los aspectos referentes al proyecto \n“Gasoducto El Porvenir – La Belleza” contenido en el expediente LAM0054 y en particular \nlos argumentos expuestos por la sociedad respecto la Resolución recurrida, emitió el \nConcepto Técnico 2860 del 7 de mayo de 2024, considerando lo siguiente:\n“Al revisar la información presentada por la Sociedad, que fundamenta la solicitud, \nse encuentra que, para la primera parte, no presenta argumentación alguna que \nsoporte el cambio de periodicidad de ejecución de la ficha de mensual a semestral, \nen consecuencia, se mantiene la periodicidad mensual ya establecida y no procede \nel ajuste solicitado.\n\nResolución No. 001291       Del 27 JUN. 2024          Hoja No. 14 de 42\n“POR LA CUAL SE RESUELVE UN RECURSO DE REPOSICIÓN EN CONTRA DE LA \nRESOLUCIÓN 314 DEL 28 DE FEBRERO DE 2024”\nPágina 14 de 42\nEn cuanto a realizar las capacitaciones de manera semestral y no bimensual (2 \nveces al mes) se considera que, el PMA establecido, cuenta con una ficha exclusiva \nde educación y capacitación para \nel personal vinculado al proyecto, siendo ésta la ficha SECP-1 Educación y \nCapacitación al Personal \nVinculado al Proyecto, que incluye medidas de manejo que contemplan la actividad \nde capacitación al personal vinculado al proyecto, con periodicidad anual, en temas \nrelacionados con las obligaciones del instrumento de manejo, entre ellos, el manejo \nde residuos sólidos y especiales.\nDe otra parte, se encuentra válido lo indicado por la Sociedad en su argumento, \nrespecto a que la periodicidad bimensual (dos veces/mes), “(…) no permitiría un \nproceso de apropiación de conocimiento eficiente por parte de los colaboradores”, \nlo que podría “generar información repetitiva”,\nsin cumplir con el objetivo de mantener actualizado al personal en el manejo de \nresiduos, dado el periodo tan corto entre una y otra capacitación. \nEn este sentido, teniendo en cuenta que la periodicidad para las capacitaciones \nestablecida en la ficha SECP-1 Educación y Capacitación al Personal Vinculado al \nProyecto es anual y el ajuste solicitado por la Sociedad en la Ficha AMS-6 Manejo \nde residuos sólidos y especiales es semestral, se encuentra viable técnicamente \nacceder a la solicitud de modificación del artículo segundo numeral 4 Ficha AMS-6 \nManejo de residuos sólidos y especiales, únicamente en lo relacionado con la \nperiodicidad semestral de las actividades de capacitaciones; lo anterior dado que \ndesde esta ficha AMS-6 se realizarán dos capacitaciones al año, y en este sentido \nse tendrá un mayor alcance de lo planteado en la ficha SECP-1, que es la ficha que \nen el proyecto acompaña los procesos de capacitación, formación y concientización \ndel personal, entre otros aspectos, en la gestión de los residuos sólidos y especiales \ngenerados por el proyecto”.\n3.\nOBLIGACIÓN RECURRIDA FICHA AMH-1 MANEJO DE RESIDUOS LÍQUIDOS DEL \nNUMERAL 5 DEL ARTÍCULO SEGUNDO.\nEl acto administrativo en cita señala:\n“ARTÍCULO SEGUNDO. AJUSTAR las siguientes fichas del PMA, presentadas por la \nsociedad TRANSPORTADORA DE GAS INTERNACIONAL S.A. ESP - TGI S.A. E.S.P., \npara lo cual deberá incluir y reportar su implementación, en los Informes de \nCumplimiento Ambiental:\n(…)\n5. Ficha AMH-1 Manejo de residuos líquidos:\n(…)\nc) La periodicidad de la entrega de aguas residuales a terceros será mensual”\n\nResolución No. 001291       Del 27 JUN. 2024          Hoja No. 15 de 42\n“POR LA CUAL SE RESUELVE UN RECURSO DE REPOSICIÓN EN CONTRA DE LA \nRESOLUCIÓN 314 DEL 28 DE FEBRERO DE 2024”\nPágina 15 de 42\nPetición de la sociedad. \nLa sociedad en el Recurso de Reposición presentado mediante comunicación con radicado \nANLA 20246200290002 del 14 de marzo de 2024, solicitó:\n“Modificar el Artículo Segundo, numeral 5 Ficha AMH-1 Manejo de residuos \nlíquidos.”\nArgumentos de la sociedad\nSegún lo enunciado en el recurso de reposición la sociedad argumenta lo siguiente:\n“Es de aclarar que como se había establecido inicialmente dentro del cronograma de \nejecución de la ficha AMH-1 Manejo de residuos líquidos, la entrega de estos residuos \nlíquidos mediante terceros autorizados se programa de acuerdo con las capacidades \nde almacenamiento definidas para cada tanque; siendo así, que al tenerse una \nocupación aproximada al 80% de la capacidad, se realiza el debido proceso de \ngestión y entrega de dichos residuos mediante un tercero autorizado, quien para el \ncaso de TGI S.A. ESP, es la empresa Albedo by Veolia S.A.S, con la cual se cuenta \ncon un contrato macro para la gestión, recolección y disposición final de las aguas \nresiduales que se generen en las áreas operativas de la organización. \nLo anterior, debido a que según datos históricos reportados a esta autoridad \nambiental, a través de la presentación de los Informes de Cumplimiento Ambiental – \nICA, se ha remitido la relación anual de volúmenes generados y dispuestos de aguas \nresiduales en frecuencias que oscilan entre los tres y cuatro meses aproximadamente; \nrazón por la cual, se propone ajustar la periodicidad de entrega de las aguas \nresiduales a terceros, de manera trimestral y/o en el momento en que se alcance el \n80% de la capacidad de almacenamiento, sin incurrir en riesgos de desbordamientos \no contaminación ambiental, teniendo así una cantidad suficiente para justificar su \ntransporte y entrega al tercero autorizado, resultando más eficiente logísticamente y \neconómicamente, ya que, con esto se reduce la frecuencia de transporte y minimiza \ncostos asociados.\nPor tanto, se solicita el ajuste de la medida en los siguientes términos:\n5. Ficha AMH-1 Manejo de residuos líquidos: \nc) La periodicidad de la entrega de aguas residuales a terceros será \ntrimestral y/o en el momento en que se alcance el 80% de la capacidad de \nalmacenamiento. (…)”\nConsideraciones Técnicas de la ANLA\nEsta Autoridad Nacional como parte de la verificación de los aspectos referentes al proyecto \n“Gasoducto El Porvenir – La Belleza” contenido en el expediente LAM0054 y en particular \nlos argumentos expuestos por la sociedad respecto la Resolución recurrida, emitió el \nConcepto Técnico 2860 del 7 de mayo de 2024, considerando lo siguiente:\n\nResolución No. 001291       Del 27 JUN. 2024          Hoja No. 16 de 42\n“POR LA CUAL SE RESUELVE UN RECURSO DE REPOSICIÓN EN CONTRA DE LA \nRESOLUCIÓN 314 DEL 28 DE FEBRERO DE 2024”\nPágina 16 de 42\n“En cuanto a la solicitud de la Sociedad de modificar la periodicidad establecida en \nla ficha para la entrega de aguas residuales a terceros de mensual a trimestral y/o \nen el momento en que se alcance \nel 80% de la capacidad de almacenamiento, soportada en los datos históricos de \nmanejo de estas aguas a través de gestores externos, cuya periodicidad ha sido \ntrimestral y cada cuatro meses, reportando la información anualmente en el \ncorrespondiente ICA, se tiene lo siguiente: \nRevisado el trámite administrativo, se encuentra que lo inicialmente planteado por \nla Sociedad mediante radicados 2020225100-1-000 del 18 de diciembre de 2020 y \n2021219792-1-000 del 11 de octubre de 2021, era la entrega de agua residual a \nterceros cada que se requiriera o anualmente; esta Autoridad Nacional, luego de la \nevaluación técnica de dicha información realizada en el concepto técnico 8004 del \n21 de diciembre de 2022, en el cual manifiesta: “Consideración: En cuanto a la \nentrega a terceros autorizados, se debe hacer de forma mensual.” resuelve a través \ndel literal g) del numeral 1 del artículo tercero del Auto 11870 del 30 de diciembre \nde 2022 requerir cronograma de ejecución mensual. La Sociedad con radicado \n2023069393-1-000 del 31 de marzo del 2023 da respuesta a estos requerimientos \ny esta Autoridad Nacional los evalúa en el concepto técnico 3601 del 22 de junio de \n2023, acogido en la Resolución 314 de 2024, resolviendo imponer periodicidad \nmensual para la entrega de aguas residual a terceros autorizados.\nExpuesto lo anterior, es necesario que técnicamente se considere lo siguiente: \nComo parte de la revisión de la información que reposa en el expediente LAM0054, \nse encuentra que la Sociedad ha venido reportando a esta Autoridad Nacional \nvolúmenes de agua residual generados y entregados a terceros de manera \ntrimestral; como ejemplo de este manejo se encuentra que la Sociedad con radicado \nANLA 20236200731332 del 12 de octubre de 2023, da respuesta a requerimientos \nestablecidos en el Auto 6374 del 17 de agosto de 2023, incluido el manejo del agua \nresidual, información evaluada en el concepto técnico 2693 de 2024 en donde se \nreportan los volúmenes de agua residual doméstica generados en los referidos \nperiodos, la cual es entregada a \nterceros en éstos mismos volúmenes:\nPeriodo\nVolumen m3\nOctubre a diciembre de 2020 \n19,82\nEnero a marzo de 2021\n21,03\nAbril a mayo de 2021\n1,47\nDe otra parte, en los seguimientos realizados al proyecto por esta Autoridad \nNacional, particularmente en el concepto técnico 5041 del 15 de agosto de 2023 \n(acogido mediante Auto 6374 del 17 de agosto de 2023) y el último realizado a través \ndel concepto técnico 2693 de 2024 (acogido mediante Acta 199 del 30 de abril de \n2024), no se evidencian requerimientos asociados a un mal manejo de las aguas \nresiduales, aun siendo manejadas con periodicidad trimestral, lo anterior, \ndeterminado por el volumen de agua residual que manejan.\n\nResolución No. 001291       Del 27 JUN. 2024          Hoja No. 17 de 42\n“POR LA CUAL SE RESUELVE UN RECURSO DE REPOSICIÓN EN CONTRA DE LA \nRESOLUCIÓN 314 DEL 28 DE FEBRERO DE 2024”\nPágina 17 de 42\nTambién se encuentra válido que el agua residual sea evacuada cuando se tenga \nuna ocupación aproximada del 80% de la capacidad del tanque, dado que este lleno \nno permitirá el desbordamiento \ndel tanque y esto independiente de sus dimensiones.\nAsí mismo, se consideran las condiciones en que se encuentran los espacios donde \nse adelanta el manejo y almacenamiento del agua residual; al respecto, según el \ninforme de visita 503931 del 22 de junio de 2023 de esta Autoridad Nacional, las \ninstalaciones se observan limpias, en buen estado y no se perciben olores que \npudieran indicar un mal manejo y en el segundo informe de visita identificado con el \nnúmero 514213 del 4 de abril de 2024 de esta Autoridad Nacional, se manifiesta que \nel agua residual doméstica generada pasa a tratamiento en tanque séptico cuyo \nefluente se maneja con gestor externo, sin evidenciar o identificar, en ningún aparte, \nolores ofensivos que permitieran establecer malos manejos. Igualmente, el concepto \ntécnico 5041 del 15 de agosto de 2023 de seguimiento ambiental al proyecto \ndescribe estas instalaciones como en buen estado, limpias, libres de residuos, \npastos podados y no se percibieron olores ofensivos que pudieran denotar y/o \nindicar un mal manejo.\nAsí las cosas, considerando que la Sociedad ha venido reportando con periodicidad \ntrimestral, la entrega a terceros de las aguas residuales, dados los volúmenes de \nagua generados, no evidenciando como parte del seguimiento realizado al proyecto \nrequerimientos asociados a un mal manejo de estas aguas, y de otra parte, las \ncondiciones específicas de los sitios de tratamiento y almacenamiento de agua \nresidual que se especifican en los informes de visita y conceptos técnicos, los cuales \nevidencian el buen estado en que se encuentran estas instalaciones, sin generar \nolores ofensivos que permitan denotar un mal manejo, se considera viable \ntécnicamente acceder a la solicitud presentada por la sociedad de modificar el \nartículo segundo, numeral 5 Ficha AMH-1 Manejo de residuos líquidos, en razón a \nque le permitiría a esta Autoridad Nacional concluir que la entrega a terceros \nautorizados del agua residual generada con periodicidad trimestral o cuando esta \nalcance una ocupación del 80% de su capacidad, es adecuada para las condiciones \noperativas del proyecto, y cumple con los objetivos de la ficha mencionada”. \n4.\nOBLIGACION RECURRIDA FICHA BMS-2 MANEJO DE FLORA DEL NUMERAL 8 \nDEL ARTÍCULO SEGUNDO.\nEl acto administrativo en cita señala:\n“ARTÍCULO SEGUNDO. AJUSTAR las siguientes fichas del PMA, presentadas por la \nsociedad TRANSPORTADORA DE GAS INTERNACIONAL S.A. ESP - TGI S.A. E.S.P., \npara lo cual deberá incluir y reportar su implementación, en los Informes de \nCumplimiento Ambiental:\n(…)\n8. Ficha BMS-2 Manejo de flora: \n\nResolución No. 001291       Del 27 JUN. 2024          Hoja No. 18 de 42\n“POR LA CUAL SE RESUELVE UN RECURSO DE REPOSICIÓN EN CONTRA DE LA \nRESOLUCIÓN 314 DEL 28 DE FEBRERO DE 2024”\nPágina 18 de 42\nb) Incluir e implementar la meta: Realizar el 100% de rescate de especies de flora nativa \ny/o en veda arbórea y epifita vascular y no vascular.”\nPetición de la sociedad\nLa sociedad en el Recurso de Reposición presentado mediante comunicación con radicado \nANLA 20246200290002 del 14 de marzo de 2024, solicitó:\n“Modificar el Artículo Segundo, numeral 8 Ficha BMS-2 Manejo de flora.”\nArgumentos de la sociedad\nSegún lo enunciado en el recurso de reposición la sociedad argumenta lo siguiente:\n“(…) TGI S.A. ESP está comprometida con la no pérdida neta de la biodiversidad y la \naplicación de la jerarquía de la mitigación en todas sus actividades; sin embargo, se \nconsidera inviable el desarrollo de la meta anteriormente mencionada en el sentido \nde: \n• Respecto al rescate de flora nativa: Según el último reporte de biodiversidad del \nSIB Colombia2 , en Colombia hay registradas 37.290 especies de flora de las cuales \ncerca del 90% se puede considerar que son nativas3 , teniendo en cuenta el concepto \nde especies nativa: “las especies nativas corresponden a aquellas que viven de forma \nnatural en un lugar (para Colombia aplica región tropical), es decir, que se cree que \nse originaron o llegaron naturalmente al país, sin intervención humana…” (WWF, \n2021)4 . \nPor ende, se solicita encaminar el concepto de rescate a especies de flora nativa a \nflora arbórea endémica y/o en veda las cuales son especies con características \necológicas únicas, generalmente con algún grado de amenaza y son especies \nrestringidas a un ámbito geográfico específico y/o ecosistema. \nAdicionalmente, se solicita encaminar esta meta y/o actividad a flora arbórea \nendémica y/o en veda a individuos de tipo brinzal ya que se ha demostrado que \nlogísticamente y por principio de precaución, el rescate y traslado de individuos \nlatizales o fustales en entornos rurales (donde se distribuye principalmente la \nactividad de TGI S.A. ESP) pude ser perjudicial para coberturas vegetales, flujos \nhídricos y/o inconvenientes socioeconómicos en la zona, en cuanto se requiere para \nsu rescate la utilización de maquinaria voluminosa como grúas, retroexcavadoras y \ncamiones; a diferencia de individuos de tipo brinzal que se puede realizar de manera \n2 SIB Colombia (2022). Biodiversidad en cifras. https://cifras.biodiversidad.co/\n3 Raz L, Agudelo Zamora H (2023). Catálogo de Plantas y Líquenes de Colombia. Version 1.3. Universidad \nNacional de Colombia. Checklist dataset https://doi.org/10.15472/7avdhn accessed via GBIF.org on 2024-03-\n11\n4 \nWWF \nInternacional \n(2021). \nhttps://www.wwf.cl/?367212/Nativo-Endemico-y-Exotico-tres-importantes-\nconceptos-que-debes-conocer\n\nResolución No. 001291       Del 27 JUN. 2024          Hoja No. 19 de 42\n“POR LA CUAL SE RESUELVE UN RECURSO DE REPOSICIÓN EN CONTRA DE LA \nRESOLUCIÓN 314 DEL 28 DE FEBRERO DE 2024”\nPágina 19 de 42\nmanual, individual por personal especializado y con un porcentaje de supervivencia \nmucho mayor. \nEstas solicitudes se encuentran se fundamentan en lo determinado por la circular \nMADS 8201-2808 del 09/12/2019, numeral 2.1.1. sobre los lineamientos técnicos para \nla conservación de especies de flora en veda menciona que:\n“El rescate, traslado y reubicación se entiende como la actividad de rescatar del \nárea de intervención del proyecto, individuos de especies de flora en veda que \nse encuentren en estado físico, reproductivo y fitosanitario óptimo, para \nposteriormente reubicarlo en un área que cuente con características ecológicas \nque permitan su desarrollo, con el fin de salvaguardar las especies y el acervo \ngenético presente en la región. \nEspecíficamente para especies de tipo arbóreo, arbustivo y helechos \narborescentes, esta actividad se define como bloqueo y traslado, el cual es una \noperación más compleja y se lleva a cabo en situaciones específicas para \nindividuos en categoría de desarrollo fustal y en general para el rescate de \nindividuos en categoría de desarrollo brinzal…”\n• Respecto al rescate de epifita vascular y no vascular: Según el Decreto 2106 de \n2019, la circular MADS 8201-2808 del 09/12/20195 y la guía de Indicadores de \nseguimiento a la efectividad de las medidas de manejo para las especies de flora y \nlíquenes en veda (ANLA, 203)6, mencionan medidas in situ asociadas al recate, \ntraslado y reubicación de especies para epífitas vasculares únicamente y que \ncumplan con: 1. Estado fitosanitario bueno u óptimo. 2. Individuos no senescentes y \n3. Estado reproductivo bueno u óptimo. Por ende, se recomienda el rescate solo para \nepífitas vasculares y que cumplan con los requisitos mencionados. \nAdicionalmente, se solicita para especies no vasculares afectadas, actividades de \nrecuperación, rehabilitación o restauración ecológica por la afectación agregados de \nespecies de musgos, hepáticas, anthoceros y líquenes, ante lo cual el objetivo de la \nmedida es recuperar, rehabilitar o restaurar los ecosistemas que sean hábitat de estas \nespecies. \nEn este sentido esta medida se deberá realizar siguiendo los lineamientos \nestablecidos en el Plan Nacional de Restauración: Restauración Ecológica, \nRehabilitación y Recuperación de áreas Disturbadas (MADS, 2015)7 , en el cual se \ndefine que “(…) la restauración debe considerarse como una estrategia de manejo de \ntipo adaptativo, cuya aproximación no solo se basa en un ecosistema de referencia \n5 MADS (2019). Dirección de Bosques, Biodiversidad y Servicios Ecosistémicos. Lineamientos técnicos para la \nconservación \nde \nespecies \nde \nflora \nen \nveda \nhttps://www.minambiente.gov.co/wp-\ncontent/uploads/2021/10/Circular-MADS-8201-2-808-del-09-12-2019.pdf\n6 ANLA (2023). Indicadores de seguimiento a la efectividad de las medidas de manejo para las especies de flora \ny \nlíquenes \nen \nveda. \nSubdirección \nde \ninstrumentos \npermisos \ny \ntrámites \nambientales. \nhttps://www.anla.gov.co/images/documentos/informes/2023-08-23-anlainf-Ind-efectividad-vedas.pdf\n7 Ministerio de Ambiente y Desarrollo Sostenible –MADS-. 2015. Plan Nacional de Restauración: restauración \necológica, rehabilitación y recuperación de áreas disturbadas. ISBN: 978-958-8901-02-2 Medio electrónico o \ndigital. Bogotá, D.C.: Colombia. 92 Pg.\n\nResolución No. 001291       Del 27 JUN. 2024          Hoja No. 20 de 42\n“POR LA CUAL SE RESUELVE UN RECURSO DE REPOSICIÓN EN CONTRA DE LA \nRESOLUCIÓN 314 DEL 28 DE FEBRERO DE 2024”\nPágina 20 de 42\nsino también en el contexto real, en el cual se amplían los escenarios posibles hacia \nlos que se direccionaría la restauración”.\nPor lo anterior, se solicita la modificación de esta meta en los siguientes términos: \n8. Ficha BMS-2 Manejo de flora: \nb) Incluir e implementar la meta: Realizar el 100% de rescate de especies de \nflora endémica y/o en veda arbórea en categoría brinzal con condiciones \nadecuadas*, y el 100% de epifitas vasculares con condiciones adecuadas”\nLas condiciones adecuadas para flora arbórea endémica y/o en veda son: 1. \nEstado fitosanitario bueno u óptimo. 2. Individuos no senescentes y 3. \nUbicado en sitio adecuado para rescate sin poner en riesgo la integridad de \notros individuos aledaños, del personal que realiza el rescate o sin poner en \nriesgo el entorno de la zona.\n**Las condiciones adecuadas para flora epífita vascular son: 1. Estado \nfitosanitario bueno u óptimo. 2. Individuos no senescentes y 3. Estado \nreproductivo bueno u óptimo”\nConsideraciones técnicas de la ANLA\nEsta Autoridad Nacional como parte de la verificación de los aspectos referentes al proyecto \n“Gasoducto El Porvenir – La Belleza” contenido en el expediente LAM0054 y en particular \nlos argumentos expuestos por la sociedad respecto la Resolución recurrida, emitió el \nConcepto Técnico 2860 del 7 de mayo de 2024, considerando lo siguiente:\n“Con relación a las especies de flora nativa, es necesario realizar una aclaración \ncon respecto a la afirmación “realizar el 100% de rescate de especies de flora nativa” \ndeterminada en el concepto técnico 3601 del 22 de junio de 2023, acogido mediante \nResolución 314 del 28 de febrero del 2024, toda vez que estas especies presentan \nun rango de distribución mucho más amplio, es decir, se pueden encontrar \nnaturalmente en una determinada región, pero también distribuirse naturalmente \nfuera de esta, al contrario de las especies endémicas cuya distribución se restringe \na una determinada zona geográfica en particular y con algún grado de amenaza, lo \nque las hace únicas para su conservación y protección, por lo tanto, se considera \nviable técnicamente aceptar el cambio de especies de flora nativa a especies de \nflora endémica.\nEn relación con la categoría de tamaño de las especies endémicas y/o en veda \narbórea a rescatar, la Sociedad propone hacerlo únicamente a especies en estado \nbrinzal, entendiéndose que esta categoría corresponde a individuos con alturas \nentre 0,30 hasta 1,5 metros según Rojas 19757, por lo que esta Autoridad Nacional \nconsidera viable técnicamente la propuesta, puesto que se identifica el rango de \ncrecimiento de las especies para aplicar el respectivo rescate, reubicación y \ntraslado, cuya actividad se realizaría con herramientas manuales, reduciendo el \nimpacto generado a los ecosistemas. \n\nResolución No. 001291       Del 27 JUN. 2024          Hoja No. 21 de 42\n“POR LA CUAL SE RESUELVE UN RECURSO DE REPOSICIÓN EN CONTRA DE LA \nRESOLUCIÓN 314 DEL 28 DE FEBRERO DE 2024”\nPágina 21 de 42\nAdicionalmente, la Sociedad propone incluir el término “condiciones adecuadas”, \nrefiriéndose al estado y características que un individuo (sea flora arbórea o epífita \nvascular) debe presentar para aplicar el respectivo rescate, traslado y reubicación; \ntérmino que se encuentra en línea con lo dispuesto en la Circular MADS 8201 2 808 \ndel 09 de diciembre de 2019 (lineamientos técnicos para la conservación de \nespecies de flora en veda), que considera “El rescate, traslado y reubicación se \nentiende como la actividad de rescatar del área de intervención del proyecto, \nindividuos de especies de flora en veda que se encuentren en estado físico, \nreproductivo y fitosanitario óptimo, para posteriormente reubicarlo en un área que \ncuente con características ecológicas que permitan su desarrollo, con el fin de \nsalvaguardar las especies y el acervo genético presente en la región”. Así las cosas, \nesta Autoridad Nacional considera viable técnicamente adicionar el término \n“condiciones adecuadas” con sus respectivas características de estado fitosanitario.\nPor otro lado, esta Autoridad Nacional acepta excluir de la meta el rescate de epífitas \nno vasculares, \npuesto que esta comunidad vegetal no posee sistema radicular ni vascular, lo que \nimposibilita su prendimiento al ser extraída de su hábitat, por ello, al presentarse \ncualquier intervención o alteración en el ecosistema donde se registra, se realiza su \nrecuperación, rehabilitación o restauración, siguiendo los lineamientos establecidos \nen el Plan Nacional de Restauración.\nPor último, se deben adicionar los términos “traslado y reubicación” a la meta, puesto \nque estas actividades son complementarias al respectivo rescate de las especies \nde flora endémica y/o en veda arbórea y de especies vasculares, además que \nmetodológicamente sigue los lineamientos de la Circular MADS 8201 2 808 del 09 \nde diciembre de 2019 (lineamientos técnicos para la conservación de especies de \nflora en veda)”.\n5.\nOBLIGACIÓN RECURRIDA FICHA BR-1 PROGRAMA DE REVEGETACILIZACIÓN \nDEL NUMERAL 11 DEL ARTÍCULO SEGUNDO.\nEl acto administrativo en cita señala:\n“ARTÍCULO SEGUNDO. AJUSTAR las siguientes fichas del PMA, presentadas \npor la sociedad TRANSPORTADORA DE GAS INTERNACIONAL S.A. ESP - TGI \nS.A. E.S.P., para lo cual deberá incluir y reportar su implementación, en los \nInformes de Cumplimiento Ambiental:\n(…)\n11. Ficha BR-1 Programa de revegetalización: \na) Incluir e implementar el objetivo: Implementación de obras de bioingeniería.”\nPetición de la sociedad\n\nResolución No. 001291       Del 27 JUN. 2024          Hoja No. 22 de 42\n“POR LA CUAL SE RESUELVE UN RECURSO DE REPOSICIÓN EN CONTRA DE LA \nRESOLUCIÓN 314 DEL 28 DE FEBRERO DE 2024”\nPágina 22 de 42\nLa sociedad en el Recurso de Reposición presentado mediante comunicación con radicado \nANLA 20246200290002 del 14 de marzo de 2024, solicitó:\n“Modificar el Artículo Segundo, numeral 11 Ficha BR-1 Programa de \nrevegetalización.”\nArgumentos de la sociedad\nSegún lo enunciado en el recurso de reposición la sociedad argumenta lo siguiente:\n“(…) Se solicita ajustar el objetivo en el sentido de incluir una evaluación objetiva, \ntécnica y ecológica en las zonas que por sus condiciones físico-bióticas permiten la \nimplementación de obras de bioingeniería como primera medida. Este análisis técnico \ny ecológico se realizará de manera previa en cada situación de revegetalización \nasegurando la valoración adecuada de cada obra en particular y resaltando las \nprincipales conclusiones de la elección del tipo de obra a implementar. \n(...) ARTICULO SEGUNDO: … \n11. Ficha BR-1 Programa de revegetalización: \na) Incluir e implementar el objetivo: Evaluación técnica en la viabilidad de \nobras de bioingeniería”.\nConsideraciones técnicas de la ANLA\nEsta Autoridad Nacional como parte de la verificación de los aspectos referentes al proyecto \n“Gasoducto El Porvenir – La Belleza” contenido en el expediente LAM0054 y en particular \nlos argumentos expuestos por la sociedad respecto la Resolución recurrida, emitió el \nConcepto Técnico 2860 del 7 de mayo de 2024, considerando lo siguiente:\n“Una vez verificados los antecedentes de la evaluación del PMA, se observó con \nrespecto al objetivo de la ficha BR-1 Programa de revegetalización, la Sociedad lo \npresentó en los siguientes términos “Determinar las medidas de manejo ambiental \npara el restablecimiento de la cobertura vegetal, la protección de taludes, \nconservación de suelos en las áreas intervenidas para las actividades de \nmantenimiento del gasoducto”, el cual no fue aprobado por esta Autoridad Nacional \npor lo que solicitó se ajustará en los siguientes términos: “Proteger taludes y \nconservar los suelos mediante la implementación de obras de bioingeniería”; sin \nembargo, al hacer la transcripción en el Auto 11870 del 30 de diciembre de 2022, \nque acogió el concepto técnico 8004 del 21 de diciembre del 2022, el objetivo quedó \ndividido así: \n“m. Ficha BR-1 Revegetalización y/o empradización:\ni. Objetivos: Incluir: Proteger taludes y conservar los suelos mediante la \nii. implementación de obras de bioingeniería”\n\nResolución No. 001291       Del 27 JUN. 2024          Hoja No. 23 de 42\n“POR LA CUAL SE RESUELVE UN RECURSO DE REPOSICIÓN EN CONTRA DE LA \nRESOLUCIÓN 314 DEL 28 DE FEBRERO DE 2024”\nPágina 23 de 42\nAsí las cosas, el error de digitación en la transcripción de los dos objetivos \nindependientes se replicó en el concepto técnico 3601 del 22 de junio de 2023, \nacogido por la Resolución 314 del 28 de febrero de 2024.\nAsí mismo, con respecto a los argumentos de la sociedad de ajustar el objetivo \nincluyendo la “Evaluación técnica en la viabilidad de obras de bioingeniería”, esta \nAutoridad Nacional consideró que con la evaluación técnica se daría soporte a los \nanálisis de las características fisicobióticas del lugar (topografía, suelo, vegetación), \nantes de determinar las obras de bioingeniería a ejecutar.” \n6.\nOBLIGACIÓN RECURRIDA NOTA DEL NUMERAL 1 DEL ARTÍCULO SEXTO.\nEl acto administrativo en cita señala:\n“ARTÍCULO SEXTO. La sociedad TRANSPORTADORA DE GAS INTERNACIONAL \nS.A. ESP - TGI S.A. E.S.P., deberá dar cumplimiento a las siguientes obligaciones \nespecificas:\n(…)\n1.\nPresentar en los Informes de Cumplimiento Ambiental – ICA, los soportes de las \ncapacitaciones dirigidas al personal del proyecto y las divulgaciones, \nsocializaciones, simulaciones y simulacros sobre el plan de contingencia \ninvolucrando las entidades de los Consejos Municipales de Gestión dé Riesgo \nde Desastres (CMGRD) y los Consejos Departamentales de Gestión de Riesgo \nde Desastres (CDGRD) y las comunidades del área de probable afectación, \nsegún corresponda. En concordancia con el artículo 2.3.1.5.2.5.1. del Decreto \n1081 del 26 de mayo de 2015, adicionado por el Decreto 2157 del 20 de \ndiciembre 2017. \nNota. Incluir el soporte de su aplicación en los Informes de Cumplimiento \nAmbiental, en caso de no presentarse algunos de los convocados, remitir las \nrazones y soportarlo con las evidencias correspondientes a través de oficios, \ninformes, actas, registros fotográficos, entre otros.”\nPetición de la sociedad. \nLa sociedad en el Recurso de Reposición presentado mediante comunicación con radicado \nANLA 20246200290002 del 14 de marzo de 2024, solicitó:\n“Modificar el Artículo Sexto numeral 1 Nota.”\nArgumentos de la sociedad\nSegún lo enunciado en el recurso de reposición la sociedad argumenta lo siguiente:\n“TGI S.A ESP, precisa que el Plan de Manejo Ambiental – PMA ajustado mediante \nResolución 314 del 28 de febrero del 2024, cuenta con dos (2) programas que son \n\nResolución No. 001291       Del 27 JUN. 2024          Hoja No. 24 de 42\n“POR LA CUAL SE RESUELVE UN RECURSO DE REPOSICIÓN EN CONTRA DE LA \nRESOLUCIÓN 314 DEL 28 DE FEBRERO DE 2024”\nPágina 24 de 42\nSIPC-1 Programa de Información y Participación Comunitaria y SCGI-1 Programa de \nApoyo a la capacidad de Gestión Institucional, en donde se establecen los procesos \nde convocatoria para los grupos de interés que cita: \n“Convocatoria: Se coordinará la convocatoria y las fechas para la realización de \nlas actividades con los funcionarios de las diferentes Alcaldías, dejando como \nconstancia, evidencia de la convocatoria, informando la fecha, hora, lugar y \nmotivo de la actividad. Adicionalmente, se realizará entrega de un oficio formal \n(puede ser por correo electrónico) en el cual se presentará el objetivo de la \nactividad y la agenda propuesta”. \nEn concordancia con lo anteriormente expuesto, para TGI S.A ESP realizando dicho \nproceso de convocatoria, se da por cumplida la obligación. \nPara TGI S.A ESP, la solicitud de “remitir las razones y soportarlo con las evidencias \ncorrespondientes a través de oficios, informes, actas, registros fotográficos, entre \notros”, es de alta complejidad, pues el cumplimiento de esta obligación dependerá de \nla manifestación o no de terceros, tales como serán los funcionarios pertenecientes a \nentidades de los Consejos Municipales de Gestión de Riesgo de Desastres (CMGRD) \ny los Consejos Departamentales de Gestión de Riesgo de Desastres (CDGRD, \naunado, a que la experiencia nos ha demostrado que las entidades no certifican la no \nparticipación de sus funcionarios a las convocatorias de los espacios concertados por \nTGI S.A ESP, de manera que, solicitamos modificar la nota de la siguiente manera, \ncon el fin poder brindar la trazabilidad de la organización de los espacios, las \nconvocatorias y su realización: \n“Nota. Incluir el soporte de su aplicación en los Informes de Cumplimiento \nAmbiental, allegando los soportes de convocatoria con las evidencias \ncorrespondientes mediante oficios, informes, actas, registros fotográficos, \nentre otros”.\nConsideraciones técnicas de la ANLA\nEsta Autoridad Nacional como parte de la verificación de los aspectos referentes al proyecto \n“Gasoducto El Porvenir – La Belleza” contenido en el expediente LAM0054 y en particular \nlos argumentos expuestos por la sociedad respecto la Resolución recurrida, emitió el \nConcepto Técnico 2860 del 7 de mayo de 2024, considerando lo siguiente:\n“Esta Autoridad Nacional revisó la solicitud de modificación en relación con la \ninclusión de soportes de convocatoria en los Informes de Cumplimiento Ambiental, \nla cual se presenta a continuación: \n“Nota. Incluir el soporte de su aplicación en los Informes de Cumplimiento \nAmbiental, allegando los soportes de convocatoria con las evidencias \ncorrespondientes mediante oficios, informes, actas, registros fotográficos, entre \notros.”\n\nResolución No. 001291       Del 27 JUN. 2024          Hoja No. 25 de 42\n“POR LA CUAL SE RESUELVE UN RECURSO DE REPOSICIÓN EN CONTRA DE LA \nRESOLUCIÓN 314 DEL 28 DE FEBRERO DE 2024”\nPágina 25 de 42\nEn igual sentido, se aclara que, el Decreto 2157 del 20 de diciembre de 2017, \nespecíficamente en su Artículo 2.3.1.5.2.1.1 numeral 3.1.1 literal b, establece \nclaramente que las simulaciones y simulacros, como parte del plan de emergencias \ny contingencias, deben realizarse al menos una vez al año.\nAdicionalmente, el artículo 2.3.1.5.2.5.1 Socialización y comunicación del \nPGRDEPP, busca promover el aumento de la conciencia del riesgo, la participación, \nla sensibilización, la corresponsabilidad social y la socialización de las estrategias \ndefinidas, desarrollando aspectos como formular una estrategia de comunicación \nefectiva del PGRDEPP y comunicar a la población de la empresa (interna) y del área \nde influencia (externa) los resultados del Plan y mecanismos de participación del \nmismo, en lo pertinente, lo que implica que las actividades relacionadas con la \nconvocatoria, como parte de estos ejercicios, ya están contempladas dentro de los \nrequisitos establecidos por el Decreto. \nEn ese sentido, esta Autoridad Nacional en el artículo sexto determinó \nexplícitamente la presentación \nde los soportes de las evidencias del desarrollo de capacitaciones, divulgaciones, \nsocializaciones, simulaciones y simulacros, tanto con el personal interno del \nproyecto como con los actores del Sistema Nacional de Gestión de Riesgo de \nDesastres; en igual sentido, se determinó por esta Autoridad Nacional requerir a la \nSociedad soportar la imposibilidad de realizar las actividades convocadas por no \nasistencia del personal interno y/o de los actores del SNGRD.\nAhora bien, lo que precisa la Nota es que, si no se pueden presentar dichos soportes \npor la no asistencia de los convocados, se deben presentar las razones de lo \nsucedido, anexando oficios, informes, actas, registros fotográficos, entre otros, que \nevidencien que la Sociedad realizó la gestión \npara el cumplimiento del requerimiento. \nPor lo anteriormente expuesto, la solicitud de modificar la nota en los términos \nsolicitados por el recurrente, en el sentido de incluir específicamente los soportes \nde convocatoria en los Informes de Cumplimiento Ambiental no es viable, aun así, \npara dar más claridad a la Nota, se considera viable técnicamente ajustar la nota \ndel numeral 1 del artículo sexto de la Resolución 314 del 28 de febrero de 2024”.\n7.\nOBLIGACIÓN RECURRIDA NUMERALES 1 Y 3 DEL ARTÍCULO SÉPTIMO \nEl acto administrativo en cita señala:\n“ARTICULO SÉPTIMO. IMPONER a la Sociedad TRANSPORTADORA DE GAS \nINTERNACIONAL S.A. ESP - TGI S.A. E.S.P., las siguientes medidas dentro de la \nficha SIPC-1. Información y participación comunitaria:\n1. Involucrar a la comunidad en los monitoreos de ruido y calidad del aire.\n(…)\n\nResolución No. 001291       Del 27 JUN. 2024          Hoja No. 26 de 42\n“POR LA CUAL SE RESUELVE UN RECURSO DE REPOSICIÓN EN CONTRA DE LA \nRESOLUCIÓN 314 DEL 28 DE FEBRERO DE 2024”\nPágina 26 de 42\n3. Establecer un punto de atención a los ciudadanos en las zonas de mayor \nsensibilidad social del proyecto como son la vereda Yamunta del municipio de Páez \ny la vereda Guamal del municipio de Miraflores del departamento de Boyacá y en la \nvereda Laderas del municipio de Jesús María, Santander, especificando los horarios \nde atención. \nPetición de la sociedad\nLa sociedad en el Recurso de Reposición presentado mediante comunicación con radicado \nANLA 20246200290002 del 14 de marzo de 2024, solicitó:\n“Modificar el Artículo 7 numeral 1 y 3 Ficha SIPC-1. Información y participación \ncomunitaria:”\nArgumentos de la sociedad\nSegún lo enunciado en el recurso de reposición la sociedad argumenta lo siguiente:\n“TGI S.A ESP, precisa que el Plan de Manejo Ambiental ajustado mediante \nResolución 314 del 28 de febrero del 2024, cuenta con un programa SIPC-1 Programa \nde Información y Participación Comunitaria, donde citan: \n“Convocatoria: Se coordinará con representantes de Juntas de Acción Comunal o \nLíderes comunitarios de las unidades territoriales menores que hacen parte del \nÁrea de Influencia donde se vaya a ejecutar la actividad puntual de \nmantenimiento, con el fin de establecer, la fecha y el lugar de la reunión con toda \nla comunidad de la unidad territorial donde se vaya a ejecutar la actividad \nprogramada, dejando constancia de la convocatoria detallando: fecha, hora, lugar \ny motivo de la reunión”\nTGI S.A ESP, viene dando cumplimiento a lo establecido en su Plan de Manejo \nAmbiental, convocando a las comunidades y Autoridades Locales mediante oficios, \nllamadas telefónicas las fechas de inicio, nombre de la empresa que va a estar en \nterritorio realizando los monitoreos, así como poniendo de presente las diferentes \nactividades de operación y el mantenimiento rutinario que realiza la empresa. \nPor tal razón, TGI S.A ESP solicita precisar el numeral 1 “Involucrar a la comunidad \nen los monitoreos de ruido y calidad del aire”, ya que se viene dando cumplimiento, a \ntravés de la información sobre las actividades y convocando a los grupos de interés \na las diferentes actividades que se planean. \nPor otra parte, en relación con el numeral 3 del artículo séptimo, se precisa que TGI \nSA ESP dentro de su Plan de Manejo Ambiental, en su ficha SIPC-1 Información y \nParticipación Comunitaria, se encuentra contemplado mantener una comunicación \nconstante y acertada con los grupos de interés; habiéndose dispuesto cuatro (4) \ncanales de comunicación como lo son:\n1. Línea de emergencia gratuita 01-800-517-220. \n\nResolución No. 001291       Del 27 JUN. 2024          Hoja No. 27 de 42\n“POR LA CUAL SE RESUELVE UN RECURSO DE REPOSICIÓN EN CONTRA DE LA \nRESOLUCIÓN 314 DEL 28 DE FEBRERO DE 2024”\nPágina 27 de 42\n2. Los profesionales sociales que se encuentran en territorio atendiendo las \nnecesidades de los grupos de interés del área de influencia del Gasoducto. \n3. En los Centros Operacionales de Gas y las Estaciones de Compresión a nivel \nNacional, se cuenta con buzón de PQRS, en donde se pueden allegar las \nPeticiones, Quejas, Reclamos y Solicitudes de los grupos de interés. \n4. Se cuenta con un correo electrónico participacion.ciudadana@tgi.com.co \nLos cuales son socializados con la comunidad y se consideran adecuados y eficientes \npara la atención a los grupos de Interés de las áreas de influencia.\nSe precisa que para el Municipio Páez en la vereda Yamunta, a la fecha TGI S.A ESP \nrealizó una modificación a su variante y a la fecha no tiene operación en dicha vereda. \nPara la vereda Guamal del Municipio de Miraflores se cuenta con el buzón de PQRS \nen la Estación Compresora de Gas de Miraflores en donde hace presencia de manera \npermanente la profesional Social asignada, así mismo, para la vereda Laderas del \nmunicipio de Jesús María las comunidades pueden acudir el Centro Operacional de \nPaipa y/o contactar a la profesional social que realiza recorridos de manera \npermanente en el territorio en mención. \nAsí mismo se cuenta con la estrategia del proyecto Piloto SUMEMOS una herramienta \ntecnológica con mayor cobertura, mayor eficiencia, rapidez y alcance de \nrelacionamiento alternativo, para los grupos de interés del área de influencia, quienes \na través de su liderazgo aportan a la actualización de la información en los territorios. \nEsta herramienta brinda constante comunicación con nuestros Líderes, mediante la \nobtención de estímulos para el diligenciamiento de la información, así como la \ncomunicación constante con nosotros. Se precisa que en esta herramienta se \nencuentran nuestro canal de comunicación y recepción de PQRS, que tiene como \nalcance dar respuesta a las solicitudes en un máximo de 5 días e informar sobre los \navances de las solicitudes. Siendo esto, más eficiente que los mecanismos \npresenciales. \nPor tanto, solicitamos aclarar el alcance del numeral 1 del artículo 7 de la Resolución \n314 del 28 de febrero de 2024 y modificar el numeral 3 del artículo 7 de la Resolución \n314 del 28 de febrero de 2024 de la siguiente manera: \n3.Socializar los canales de atención de PQRS a los ciudadanos en las zonas de \nmayor sensibilidad social del proyecto como son la vereda Yamunta del \nmunicipio de Páez y la vereda Guamal del municipio de Miraflores del \ndepartamento de Boyacá y en la vereda Laderas del municipio de Jesús María, \nSantander, especificando los horarios de atención.”\nConsideración técnica de la ANLA\nEsta Autoridad Nacional como parte de la verificación de los aspectos referentes al proyecto \n“Gasoducto El Porvenir – La Belleza” contenido en el expediente LAM0054 y en particular \nlos argumentos expuestos por la sociedad respecto la Resolución recurrida, emitió el \nConcepto Técnico 2860 del 7 de mayo de 2024, considerando lo siguiente:\n\nResolución No. 001291       Del 27 JUN. 2024          Hoja No. 28 de 42\n“POR LA CUAL SE RESUELVE UN RECURSO DE REPOSICIÓN EN CONTRA DE LA \nRESOLUCIÓN 314 DEL 28 DE FEBRERO DE 2024”\nPágina 28 de 42\n“Respecto a la solicitud de la Sociedad de aclarar el alcance del numeral 1 del \nartículo 7 de la Resolución 314 del 28 de febrero de 2024 de “1. Involucrar a la \ncomunidad en los monitoreos de ruido y calidad del aire”, bajo el argumento de que \n“TGI S.A ESP, precisa que el Plan de Manejo Ambiental ajustado mediante \nResolución 314 del 28 de febrero del 2024, cuenta con un programa SIPC-1 \nPrograma de Información y Participación Comunitaria, donde cita:\n“Convocatoria: Se coordinará con representantes de Juntas de Acción Comunal \no Líderes comunitarios de las unidades territoriales menores que hacen parte \ndel Área de Influencia donde se vaya a ejecutar la actividad puntual de \nmantenimiento, con el fin de establecer, la fecha y el lugar de la reunión con toda \nla comunidad de la unidad territorial donde se vaya a ejecutar la actividad \nprogramada, dejando constancia de la convocatoria detallando: fecha, hora, \nlugar y motivo de la reunión”.\nSe indica que la mencionada convocatoria solo hace referencia a informar a grupos \nde interés dónde\nse van a ejecutar actividades puntuales de mantenimiento, mas no hace referencia \na la gestión informativa por los impactos generados por la operación permanente de \nla Estación Miraflores, por lo tanto, la solicitud de involucrar a la comunidad en \nactividades puntuales relacionadas con la operación permanente, en particular los \nmonitores de ruido y calidad de aire, es un complemento a las medidas establecidas \nen el programa de información y comunicación que fomentará la transparencia, ya \nque la comunidad aledaña tiene derecho a saber cómo los niveles de emisiones \npueden o no afectar su bienestar.\nAdemás de la socialización de los resultados de monitoreo de ruido establecida en \nel numeral 2 del artículo séptimo de la Resolución 314 del 28 de febrero de 2024, \nse resalta que, ya que para la comunidad no han sido efectivos los canales de \ncomunicación y recepción de PQRS en medios presenciales, es necesario detallar \nla forma en la cual se requiere el involucramiento de la comunidad en los monitoreos, \nlos cuales constarán de tres (3) momentos a saber: i) La notificación de los \nmonitoreos de calidad del aire y ruido, ii) El acompañamiento de la comunidad a los \nmonitoreos, cuando sea posible, con la respectiva recopilación de inquietudes o \nPQR, y iii) La notificación de respuestas a las inquietudes o PQR de la comunidad \ndespués de haber sido realizado el acompañamiento a los monitoreos. \nLo anterior considerando que la obligación inicialmente establecida en el numeral 1 \ndel artículo 7 de la Resolución 314 del 28 de febrero de 2024 no detalló a qué hacía \nreferencia el involucramiento de la comunidad para hacerlos partícipes de la \nejecución de los monitoreos de ruido y calidad del aire, ya que estos están \nrelacionados con los impactos en el componente atmosférico, de acuerdo con lo \ncomunicado por la vereda Guamal del municipio de Miraflores, mediante radicado \n20236200336002 del 11 de julio de 2023, relacionado en el Concepto Técnico 5041 \ndel 15 de agosto de 2023 insumo fundamental de la Resolución 314 del 28 de \nfebrero de 2024.\n\nResolución No. 001291       Del 27 JUN. 2024          Hoja No. 29 de 42\n“POR LA CUAL SE RESUELVE UN RECURSO DE REPOSICIÓN EN CONTRA DE LA \nRESOLUCIÓN 314 DEL 28 DE FEBRERO DE 2024”\nPágina 29 de 42\nAdicionalmente, los habitantes locales son quienes experimentan directamente los \nefectos de las emisiones por lo que su participación en los monitoreos puede \nproporcionar información sobre las áreas específicas donde se encuentran los \nproblemas y las horas del día en las que son más pronunciados, permitiendo \ncomplementar los datos observados por la Sociedad y mejorar la precisión de los \ninformes y la consecuente búsqueda de soluciones que, entre otras, conducirán a \nla implementación de acciones preventivas y correctivas de manera oportuna (…)\nEn cuanto a la solicitud de modificar el numeral 3 del artículo séptimo de la \nResolución 314 del 28 de febrero de 2024, dado que el texto propuesto implicaría \neliminar el punto de atención presencial de PQRS a los ciudadanos en las zonas de \nmayor sensibilidad social del proyecto, considerando que las tres unidades \nterritoriales en mención (veredas Yamunta, Guamal y Laderas) cuentan con \nacciones populares y/o denuncias ambientales ante entes de control, lo que hace \nevidente que socializar los canales de atención de PQRS no es una medida \nsuficiente para obtener un diálogo directo entre los miembros de la comunidad \nafectada y la Sociedad, que conlleve a responder a las inquietudes de manera \ninmediata y efectiva lo que ayudaría a prevenir la escalada de los conflictos, esta \nAutoridad Nacional no accede a la petición de la Sociedad de modificar el numeral \n3 del artículo séptimo Ficha SIPC-1. Información y participación comunitaria de la \nResolución 314 del 28 de febrero de 2024 y lo confirma en los términos inicialmente \nestablecidos”.\nCONSIDERACIONES JURÍDICAS DE LA AUTORIDAD NACIONAL RESPECTO A LA \nRESOLUCIÓN RECURRIDA. \nEl artículo 209 de la Constitución Política establece que la función administrativa está al \nservicio de los intereses generales y se desarrolla con fundamento en los principios de \nigualdad, moralidad, eficacia, economía, celeridad e imparcialidad.\nEs así como, frente a las decisiones que el Estado pueda adoptar limitando la libertad \neconómica y estableciendo un equilibrio entre esta libertad y el bien común la Corte en \nSentencia C-035 de 2016, dispone que:\n“La Constitución Política reconoce la libertad económica y de empresa como pilares \ndel modelo económico colombiano. En este sentido, según el artículo 333, la \nactividad económica y la iniciativa privada son libres y se podrán ejercer sin que \nnadie pueda exigir permisos previos ni requisitos, sin autorización de la ley. Lo \nanterior, por cuanto se trata de garantías indispensables para el logro del desarrollo \neconómico y la prosperidad general.\nEsta libertad presupone la facultad que tiene toda persona de realizar actividades \nde carácter económico, según sus preferencias o habilidades, con el fin de crear, \nmantener o incrementar su patrimonio. Sin embargo, la libertad económica no es un \nderecho absoluto, pues en nuestro sistema constitucional tanto la propiedad (artículo \n58) como la empresa (artículo 333) deben cumplir una función social que implica \nobligaciones.\n\nResolución No. 001291       Del 27 JUN. 2024          Hoja No. 30 de 42\n“POR LA CUAL SE RESUELVE UN RECURSO DE REPOSICIÓN EN CONTRA DE LA \nRESOLUCIÓN 314 DEL 28 DE FEBRERO DE 2024”\nPágina 30 de 42\nPor tal motivo, la misma Carta Política establece ciertos límites al ejercicio de la \nlibertad económica y de empresa. Estas libertades deben ejercerse dentro de los \nlímites del bien común y de conformidad con los alcances que fije la ley cuando así \nlo exijan el interés social, el ambiente, y el patrimonio cultural de la Nación.\nPara garantizar que ello sea así, y que la prosperidad económica se traduzca en la \nrealidad en beneficios que se distribuyen al interior de la sociedad para garantizar la \nigualdad de oportunidades, la Constitución le impone al Estado el deber de dirigir de \nmanera general la economía, y le atribuye amplias funciones de regulación del \nmercado, tanto de manera general, como sectorialmente en la Constitución. De lo \nanterior se infiere entonces que, si bien el modelo económico planteado por la \nConstitución Política garantiza la libertad para el ejercicio de actividades \neconómicas, el mismo está sometido a ciertas limitaciones y a la intervención del \nEstado. En la Sentencia C-150 de 2003, la Corte se pronunció sobre este tema de \nla siguiente manera:\n“Ahora bien, la intervención del Estado en la economía puede ser de diferente tipo, \nsin que siempre pueda efectuarse una diferenciación clara entre las formas de \nintervención correspondientes. Así, por ejemplo, en la doctrina se habla de \nintervención estatal global, cuando versa sobre la economía como un todo, sectorial, \ncuando recae en una determinada área de actividad, o particular, si apunta a una \ncierta situación como por ejemplo a la de una empresa; de intervención estatal \ndirecta, cuando recae sobre la existencia o la actividad de los agentes económicos, \no indirecta, cuando está orientada no a la actividad económica propiamente dicha \nsino al resultado de la misma; intervención unilateral, cuando el Estado autoriza, \nprohíbe o reglamenta una actividad económica, o intervención convencional, cuando \nel Estado pacta con los agentes económicos las políticas o programas que \npropenden por el interés general; intervención por vía directiva, cuando el Estado \nadopta medidas que orientan a los agentes económicos privados, o intervención por \nvía de gestión, cuando el Estado se hace cargo el mismo de actividades económicas \npor medio de personas jurídicas generalmente públicas.”\nVisto lo anterior se puede concluir que el Estado tiene un amplio margen de \nintervención en la economía, que lo faculta para adoptar medidas y políticas \norientadas al mejoramiento de la calidad de vida de los habitantes, a la distribución \nequitativa de las oportunidades y beneficios del desarrollo, y a la preservación de un \nambiente sano, tal como lo dispone el artículo 334 de la Carta Política. Sin embargo, \nel alcance de las potestades estatales no es indiferente a la materia objeto de \nregulación, al sector, o la actividad económica de que se trate. El alcance de la \npotestad de intervención del Estado está determinada por la función social \nespecífica de la actividad económica que se desarrolle”.\nEn virtud de los principios orientadores consagrados en el artículo 209 de la Carta Política, \nen concordancia con lo establecido en el artículo tercero del Código de Procedimiento \nAdministrativo y de lo Contencioso Administrativo, que establece los principios orientadores \nde las actuaciones administrativas, especialmente, en los principios de responsabilidad, \nlegalidad, coordinación, eficacia y celeridad, a saber:\n\nResolución No. 001291       Del 27 JUN. 2024          Hoja No. 31 de 42\n“POR LA CUAL SE RESUELVE UN RECURSO DE REPOSICIÓN EN CONTRA DE LA \nRESOLUCIÓN 314 DEL 28 DE FEBRERO DE 2024”\nPágina 31 de 42\n“Artículo 3°. Principios. Todas las autoridades deberán interpretar y aplicar las \ndisposiciones que regulan las actuaciones y procedimientos administrativos a la luz de \nlos principios consagrados en la Constitución Política, en la Parte Primera de este \nCódigo y en las leyes especiales. Las actuaciones administrativas se desarrollarán, \nespecialmente, con arreglo a los principios del debido proceso, igualdad, imparcialidad, \nbuena fe, moralidad, participación, responsabilidad, transparencia, publicidad, \ncoordinación, eficacia, economía y celeridad.\n(…)\n7. En virtud del principio de responsabilidad, las autoridades y sus agentes asumirán \nlas consecuencias por sus decisiones, omisiones o extralimitación de funciones, de \nacuerdo con la Constitución, las leyes y los reglamentos.\n(…)\n10. En virtud del principio de coordinación, las autoridades concertarán sus actividades \ncon las de otras instancias estatales en el cumplimiento de sus cometidos y en el \nreconocimiento de sus derechos a los particulares.\n (…)\n11. En virtud del principio de eficacia, las autoridades buscarán que los procedimientos \nlogren su finalidad y, para el efecto, removerán de oficio los obstáculos puramente \nformales, evitarán decisiones inhibitorias, dilaciones o retardos y sanearán, de acuerdo \ncon este Código las irregularidades procedimentales que se presenten, en procura de \nla efectividad del derecho material objeto de la actuación administrativa. \n(…)\n13. En virtud del principio de celeridad, las autoridades impulsarán oficiosamente los \nprocedimientos, e incentivarán el uso de las tecnologías de la información y las \ncomunicaciones, a efectos de que los procedimientos se adelanten con diligencia, \ndentro de los términos legales y sin dilaciones injustificadas.”\nAhora bien, esta Autoridad Nacional en sus actuaciones administrativas debe cumplir con \nlos principios orientadores antes mencionados toda vez que dichas actuaciones son la \nmanifestación de la voluntad de la administración, sus efectos se traducen en crear, \nmodificar o extinguir derechos u obligaciones de carácter particular, personal y concreto, \ncon el fin de establecer una obligación tendiente a crear situaciones específicas, teniendo \ncomo presupuesto la sujeción al orden público y el respeto por las garantías y derechos de \nlos administrados.\nEs preciso señalar en el presente caso, la importancia que el principio fundamental al debido \nproceso reviste para asegurar también el cumplimiento de otros postulados fundamentales \ny de derechos de consagración constitucional y legal, como el derecho colectivo al ambiente \nsano, responsabilidad de autoridades y particulares.\n\nResolución No. 001291       Del 27 JUN. 2024          Hoja No. 32 de 42\n“POR LA CUAL SE RESUELVE UN RECURSO DE REPOSICIÓN EN CONTRA DE LA \nRESOLUCIÓN 314 DEL 28 DE FEBRERO DE 2024”\nPágina 32 de 42\nLa Corte Constitucional ha establecido que el derecho al debido proceso tiene unas \ngarantías previas y unas garantías posteriores, así:\n“La jurisprudencia constitucional ha diferenciado entre las garantías previas y \nposteriores que implica el derecho al debido proceso en materia administrativa. Las \ngarantías mínimas previas se relacionan con aquellas garantías mínimas que \nnecesariamente deben cobijar la expedición y ejecución de cualquier acto o \nprocedimiento administrativo, tales como el acceso libre y en condiciones de igualdad a \nla justicia, el juez natural, el derecho de defensa, la razonabilidad de los plazos y la \nimparcialidad, autonomía e independencia de los jueces, entre otras”.\nDe otro lado, las garantías mínimas posteriores se refieren a la posibilidad de cuestionar la \nvalidez jurídica de una decisión administrativa, mediante los recursos de la vía gubernativa \ny la jurisdicción contenciosa administrativa.\nDicho lo anterior, sea lo primero indicar que la sociedad allegó mediante los radicados \n2020225100-1-000 del 18 de diciembre de 2020 y 2023069393-1-000 del 31 de marzo del \n2023, la actualización y ajustes del Plan de Manejo Ambiental y del Plan de Seguimiento y \nMonitoreo para las fases de operación y mantenimiento del proyecto Gasoducto El Porvenir \n– La Belleza; Es así como, mediante los Conceptos Técnicos 3601 del 22 de junio de 2023 \ny 5041 del 15 de agosto de 2023, esta Autoridad Nacional realizó el análisis técnico de los \nradicados antes mencionados, mismos que fueron acogidos mediante la Resolución 314 \ndel 28 de febrero de 2024 por medio de la cual se actualizo el Plan de Manejo Ambiental \ndel proyecto denominado “Gasoducto Porvenir - La Belleza”. \nPosteriormente y verificado por parte de esta Autoridad Nacional el cumplimiento de los \nrequisitos legales para interponer recurso de reposición, esta Autoridad procedió a evaluar \nlos argumentos de la recurrente, expidiendo para el efecto el Concepto Técnico 2860 del 7 \nde mayo de 2024 el cual se acoge en el presente acto Administrativo.\nHecha la anterior claridad, esta Autoridad Nacional se pronunciará frente a cada uno de los \nreparos del recurso interpuesto, de la siguiente manera:\n1.\nRESPECTO A LA SOLICITUD DE MODIFICAR EL NUMERAL 3 DE LA FICHA AMS-\n5 MANEJO DE ESCORRENTÍA, NUMERAL 4 DE LA FICHA AMS-6 MANEJO DE \nRESIDUOS SÓLIDOS Y ESPECIALES, NUMERAL 5 DE LA FICHA AMH-1 MANEJO \nDE RESIDUOS LÍQUIDOS; DEL NUMERAL 8 DE LA FICHA BMS-2 MANEJO DE \nFLORA Y NUMERAL 11 DE LA FICHA BR-1 PROGRAMA DE REVEGETALIZACIÓN \nDEL ARTÍCULO SEGUNDO DE LA RESOLUCIÓN 314 DEL 28 DE FEBRERO DE \n2024.\nSobre la solicitud de modificar el numeral 3 alusivo a la Ficha AMS-5 Manejo de escorrentía \ndel artículo segundo de la Resolución 314 del 28 de febrero de 2024, es oportuno recordar \nque la meta inicialmente planteada por la recurrente mediante los radicados 2020225100-\n1-000 del 18 de diciembre de 2020 y 2021219792-1-000 del 11 de octubre de 2021, debió \nser ajustada toda vez que la sociedad no contaba con centros operacionales, razón por la \ncual se ajustó la meta en el sentido de dejar consignado que las obras de drenaje requeridas \n\nResolución No. 001291       Del 27 JUN. 2024          Hoja No. 33 de 42\n“POR LA CUAL SE RESUELVE UN RECURSO DE REPOSICIÓN EN CONTRA DE LA \nRESOLUCIÓN 314 DEL 28 DE FEBRERO DE 2024”\nPágina 33 de 42\npara garantizar el manejo de las aguas lluvias recaen sobre las áreas operativa del \ngasoducto. \nAhora bien, la solicitud de la recurrente recae en ajustar nuevamente la meta asociada a la \nFicha AMS-5 Manejo de escorrentía, en el sentido de incorporar dentro de la meta la \nconstrucción de las obras de drenaje que se estimen necesarias. Sobre el particular, \nteniendo en cuenta que el objetivo de la Ficha AMS-5 consiste en evitar la afectación de la \ncalidad de las aguas superficiales, el desarrollo de procesos erosivos, deterioro progresivo \nde los suelos y aporte de sedimentos a los drenajes naturales mediante el manejo adecuado \nde las aguas de escorrentía, para esta Autoridad Nacional es imprescindible contar con una \ninfraestructura completa y funcional. \nPor lo anterior, es del recibo la solicitud incoada por la recurrente por lo que se repondrá en \nel sentido de modificar el artículo segundo, numeral 3 Ficha AMS-5 Manejo de escorrentía, \ntoda vez que la propuesta permite que se cumpla el objetivo de la Ficha de manera robusta, \nesto es, cumpliendo la meta inicialmente establecida por esta Autoridad Nacional de realizar \ninspecciones periódicas al proyecto, identificar puntos críticos y brindar solución al manejo \nde aguas de escorrentía a partir de los impactos evidenciados, e igualmente construir las \nobras adicionales que se puedan requerir para honrar el objetivo de la ficha. \nEn cuanto a la solicitud de modificar el numeral 4 Ficha AMS-6 Manejo de residuos sólidos \ny especiales del artículo segundo de la Resolución 314 del 28 de febrero de 2024, esta \nrecae en modificar tanto la periodicidad mensual de la ficha como la periodicidad bimensual \nde las capacitaciones contenidas en el literal a) del numeral 4, a vigencias semestrales. \nEs así como se tiene que la sociedad no presentó argumento alguno que soporte el cambio \nde periodicidad de ejecución de la ficha de mensual a semestral, razón por la cual se \nmantendrá la periodicidad mensual inicialmente establecida y no se accede a modificar esta \nperiodicidad y se confirma en este sentido el literal a) del numeral 4 Ficha AMS-6 Manejo \nde residuos sólidos y especiales del artículo segundo de la Resolución 314 del 28 de febrero \nde 2024.\nSin embargo, teniendo de presente que el Plan de Manejo Ambiental cuenta con la Ficha \nSECP-1 Educación y Capacitación al Personal Vinculado al Proyecto, en donde se \nestableció la temporalidad necesaria para lograr procesos de apropiación del conocimiento \neficiente por parte de los colaboradores, esta Autoridad Nacional considera viable, reponer \nen el sentido de modificar la temporalidad expuesta en el literal a) del numeral 4 del artículo \nsegundo, únicamente en lo que concierne a la periodicidad semestral de las actividades de \ncapacitaciones. \nCon relación a la modificación del numeral 5 Ficha AMH-1 Manejo de residuos líquidos esta \nrecae en modificar la temporalidad expuesta en el literal c), donde la entrega de aguas \nresiduales a terceros pasaría de ser mensual a trimestral y/o cuando se cumpla la condición \nde 80% de capacidad de almacenamiento. \nDe ello es oportuno señalar que la sociedad ha venido reportando los volúmenes de agua \nresidual generados y entregados a terceros de manera trimestral. A su vez, mediante los \nradicados 2020225100-1-000 del 18 de diciembre de 2020 y 2021219792-1-000 del 11 de \n\nResolución No. 001291       Del 27 JUN. 2024          Hoja No. 34 de 42\n“POR LA CUAL SE RESUELVE UN RECURSO DE REPOSICIÓN EN CONTRA DE LA \nRESOLUCIÓN 314 DEL 28 DE FEBRERO DE 2024”\nPágina 34 de 42\noctubre de 2021, la recurrente indicó para esta ficha que la temporalidad de la entrega de \nagua residual a terceros fuese cada que se requiriera o anualmente. \nSi bien en su momento esta Autoridad Nacional determinó que la periodicidad fuese \nmensual en la resolución recurrida, es preciso señalar con base en los antes mencionado, \nel buen manejo de estas aguas y las instalaciones que las contienen es viable acceder a lo \nsolicitado por la recurrente, por lo que se repondrá en el sentido de modificar la periodicidad \npara entregar a terceros autorizados el agua residual de manera trimestral y/o cuando se \nalcance el 80% de la capacidad de almacenamiento. \nRespecto a la solicitud de modificar el numeral 8 alusivo a la Ficha BMS-2 Manejo de flora \ndel artículo segundo de la Resolución 314 del 28 de febrero de 2024, esta recae sobre el \nrescate de especies de flora endémica y no nativas, e igualmente que sean de categoría \nbrinzal con condiciones adecuadas y 100% de epifitas vasculares con condiciones \nadecuadas.\nComo primera medida tenemos que la solicitud de cambiar la flora nativa por endémica \nresulta acordé. Lo anterior, si se tiene de presente los objetivos de conservación, ya que \nlas especies nativas tienen un rango de distribución mucho más amplio, en la medida que \nsi bien se encuentran de manera natural en una región determinada, también pueden \ndistribuirse fuera de la misma. Diferente caso de las especies endémicas cuyas \ncaracterísticas les restringe a una región, ecosistema, cuenca hidrográfica y/o área \ngeográfica mucho más puntual y especifica, configurándose como cruciales para su \nprotección y conservación ya que representan un objeto de conservación de alto valor \ndebido a que su pérdida conlleva generalmente a la pérdida o disminución de variedad \ngenética, atributos funcionales y características ecológicas únicas que no se pueden \nrecuperar,8 por lo que se acogerá el cambio solicitado. \nEn lo que refiere a la propuesta de rescatar las especies endémicas y/o arbóreas en estado \nbrinzal, dado que se hará uso de herramientas manuales, sumado a individuos cuya altura \noscila entre 0,30 y 1,5 metros, es viable acoger la propuesta de la sociedad, toda vez que \nse identifica de manera clara y específica el rango de crecimiento a rescatar, reubicar y \ntrasladar. A la par y en lo que a incluir “condiciones adecuadas” se refiere, es del recibo \nacoger dicha solicitud, ya que los individuos de especie de flora en veda a rescatar, trasladar \ny reubicar deberán encontrarse en un óptimo estado físico, reproductivo y fitosanitario. \nPor último, es factible prescindir del rescate de epífitas no vasculares de la meta objeto de \nreproche, ya que dada las características de esta comunidad vegetal, se torna \nprácticamente imposible su prendimiento al ser extraídas de su ambiente. En igual sentido \ny de conformidad con los argumentos presentados por el recurrente, es pertinente que \ncomo complemento de las actividades de rescate de las especies de flora endémica, en \nveda arbórea y de especies vasculares, se incluyan los términos “traslado y reubicación” a \nla meta propuesta por la sociedad, ya que metodológicamente atiende los lineamientos de \nla Circular 8201 2 808 del 9 de diciembre de 2019 alusiva a los lineamientos técnicos para \n8 González-García, F. & Gómez de Silva, H. (2003). Especies endémicas: riqueza, patrones de distribución y \nretos para su conservación. En H. Gómez de Silva & A. Oliveras de Ita (Eds.), Conservación de aves. \nExperiencias en México (pp. 150-164). México D. F., México: Sección Mexicana del Consejo Internacional para \nla Preservación de las Aves.\n\nResolución No. 001291       Del 27 JUN. 2024          Hoja No. 35 de 42\n“POR LA CUAL SE RESUELVE UN RECURSO DE REPOSICIÓN EN CONTRA DE LA \nRESOLUCIÓN 314 DEL 28 DE FEBRERO DE 2024”\nPágina 35 de 42\nla conservación de especies de flora en veda del Ministerio de Ambiente y Desarrollo \nSostenible -MADS. \nCorolario de lo expuesto, resulta procedente reponer en el sentido de modificar el literal b) \nde la Ficha BMS-2 manejo de flora, en el sentido de alternar la flora nativa por endémica, \nincorporar las características de la flora a rescatar y la inclusión de los términos de traslado \ny reubicación. \nFinalmente, sobre la solicitud de modificar el literal a) del numeral 5 Ficha BR-1 Programa \nde revegetalización, del artículo segundo de la Resolución 314 del 28 de febrero de 2024, \nen cuanto a incluir la “evaluación técnica en la viabilidad” de las obras de bioingeniería a \nque haya lugar, resulta factible acoger la propuesta allegada, por lo que se repondrá en el \nsentido de modificar dicha obligación, ya que la evaluación técnica de las obras reca sobre \nlos análisis de las características del lugar, a saber, topografía, suelo y vegetación, actividad \nque resulta complementaria en el marco de la implementación de las obras de bioingeniería. \n2.\nRESPECTO LA SOLICITUD DE MODIFICAR LA NOTA DEL NUMERAL 1 DEL \nARTÍCULO SEXTO DE LA RESOLUCIÓN 314 DEL 28 DE FEBRERO DE 2024.\nLa sociedad solicita se modifique la Nota del numeral 1 del artículo sexto en el sentido de \nallegar las evidencias de convocatoria en lugar de las evidencias que soporten las razones \npor la cual no se presentaron algunos de los convocados. Bajo ese contexto es preciso traer \nen cita el Decreto 2157 del 20 de diciembre de 2017 por medio del cual se adoptan \ndirectrices generales para la elaboración del Plan de Gestión del Riesgo de desastres de \nlas entidades públicas y privadas en el marco del artículo 42 de la ley 1523 de 2012.\nEl artículo 2.3.1.5.2.5.1 contentivo de la Socialización y comunicación del Plan de Gestión \ndel Riesgo de Desastres de Entidades Públicas y Privadas - PGRDEPP, propende por la \npromoción del aumento de la conciencia frente al riesgo, la participación, la sensibilización, \nla corresponsabilidad social y la socialización de las estrategias definidas en el Plan. Por su \nparte, el literal b del numeral 3.1.1. del artículo 2.3.1.5.2.1.1 esboza que deberá realizarse \ncomo mínimo para cada vigencia anual, la evaluación del Plan de Gestión del Riesgo por \nmedio de las simulaciones y simulacros que permitan materializar una mejora continua. \nCon base en los apartes normativos previamente referenciados es claro que este tipo de \nobligación tiene una doble connotación, ya que por un lado debe mediar el deber de \nconvocatoria efectiva a los interesados y por el otro, el soporte que dé cuenta que la \nactividad en efecto se realizó con los convocados. Por ello, esta Autoridad Nacional \nprocederá a reponer en el sentido de modificar la redacción de la nota, y complementar la \nevidencia requerida más allá de las constancias de convocatoria.\n3.\nRESPECTO A LA SOLICITUD DE ACLARAR EL ALCANCE DEL NUMERAL 1 Y \nMODIFICAR EL NUMERAL 3 DEL ARTÍCULO 7 DE LA RESOLUCIÓN 314 DEL 28 \nDE FEBRERO DE 2024.\nPor un lado, la recurrente solicita aclarar el alcance de la obligación contenida en el numeral \n1 del artículo 7 de la Resolución 314 del 28 de febrero de 2024 referida al involucramiento \nde la comunidad en los monitoreos de ruido y calidad del aire. Por otro, que se modifique la \n\nResolución No. 001291       Del 27 JUN. 2024          Hoja No. 36 de 42\n“POR LA CUAL SE RESUELVE UN RECURSO DE REPOSICIÓN EN CONTRA DE LA \nRESOLUCIÓN 314 DEL 28 DE FEBRERO DE 2024”\nPágina 36 de 42\nredacción de la obligación contenida en el numeral 3 del artículo 7 de la Resolución 314 del \n28 de febrero de 2024, en el sentido de cambiar el deber de “establecer un punto de \natención a los ciudadanos en las zonas de mayor sensibilidad social” por “socializar los \ncanales de atención de PQRS”.\nSobre la primera petición es menester aclarar que la solicitud de involucrar a la comunidad \nen actividades puntuales relacionadas con la operación permanente, en particular los \nmonitoreos de ruido y calidad de aire, es un complemento a las medidas establecidas en el \nprograma de información y comunicación (programa SIPC-1 Programa de Información y \nParticipación Comunitaria) que busca fomentar la transparencia a partir del conocimiento \npor parte de la comunidad aledaña sobre los niveles de emisiones y como estos pueden o \nno afectarles. \nDicho lo anterior, si bien la obligación solo hace referencia a involucrar a la comunidad en \nlos monitoreos de ruido y calidad del aire, y en la medida que el concepto “involucrar” reviste \nun abordaje sumamente amplio, es preciso señalar que el alcance de la precitada obligación \nesta dado a atender unos mínimos, de ahí que aunque puntualmente la sociedad haya \nsolicitado la aclaración del alcance al numeral 1 del artículo séptimo de la Resolución 314 \ndel 28 de febrero de 2024, y partiendo de la necesidad de la sociedad de aclarar el alcance \nde la precitada disposición, esta Autoridad Nacional considera pertinente reponerla en el \nsentido de modificarla, con el fin de que las obligaciones asociadas al involucramiento de \nla comunidad en los monitoreos de ruido y calidad del aire contemplar como mínimo los \nsiguientes aspectos: \na.\nNotificación a la comunidad mediante los canales de atención físicos, telefónicos o \nvirtuales establecidos, la programación de los monitoreos de calidad del aire, emisión \nde ruido y ruido ambiental (jornada diurna y nocturna) invitándolos a estar presentes en \nel desarrollo de estos; \nb. Realizar registros fotográficos y de listados de asistencia de la comunidad que pueda \nacompañar la realización de los monitoreos; \nc.\nDocumentar las inquietudes de la comunidad durante el acompañamiento a los \nmonitoreos, empleando los formatos establecidos por TGI S.A E.S.P., para la atención \nde peticiones, quejas, reclamos o sugerencias; \nd. Documentar las respuestas dadas a las peticiones, quejas, reclamos o sugerencias \npresentadas durante el acompañamiento a los monitoreos; \ne.\nPresentar los soportes de los literales a, b, c y d, radicando la información solicitada en \nel expediente del proyecto a los 15 días de ejecutado cada monitoreo\nAhora bien, en lo que refiere a la solicitud de modificación del numeral 3 del artículo séptimo \nde la Resolución 314 del 28 de febrero de 2024, teniendo en cuenta que la propuesta de \nsocializar los canales de atención de peticiones, quejas, reclamos o sugerencias se queda \ncorta para atender a los ciudadanos en las zonas de mayor sensibilidad, sumado a que \nimplicaría eliminar el punto de atención presencial que atienda a la comunidad que habita \nen estas áreas, no se accederá a la petición incoada. \nEn este sentido, y teniendo en cuenta que las unidades territoriales correspondientes a las \nveredas de Yamunta, Guamal y Laderas responden a zonas de mayor sensibilidad social \npuesto que allí se han presentado acciones populares y/o denuncias ambientales, se \n\nResolución No. 001291       Del 27 JUN. 2024          Hoja No. 37 de 42\n“POR LA CUAL SE RESUELVE UN RECURSO DE REPOSICIÓN EN CONTRA DE LA \nRESOLUCIÓN 314 DEL 28 DE FEBRERO DE 2024”\nPágina 37 de 42\nrequiere de un enlace directo que permita atender las solicitudes de manera inmediata y \nefectiva, razón por la cual no se repondrá y consecuencia se mantendrá la obligación tal y \ncomo fue establecida en la resolución recurrida. \nPor lo anterior, se reitera la importancia de informar a las autoridades municipales y \ncomunidades del área de influencia del proyecto, la actualización del Plan de Manejo, \nincluyendo objetivos, metas, medidas de manejo e indicadores, de tal manera que los \ngrupos de interés tenga conocimiento claro de las fichas de manejo establecidas para la \netapa de operación y mantenimiento del proyecto, y de esta forma cumplir a satisfacción la \nfinalidad de las fichas y medidas establecidas en el instrumento de manejo y control \nambiental. \nFinalmente, y con base en las recomendaciones técnicas descritas en el Concepto Técnico \n2860 del 7 de mayo de 2024 y teniendo en cuenta que esta Autoridad Nacional analizó lo \nexpuesto por la sociedad recurrente, estableciendo para cada obligación recurrida un \nanálisis claro de las medidas que se establecieron, su pertinencia y proporcionalidad, se \nconsidera:\na) Reponer en el sentido de modificar el numeral 3 del artículo segundo de la Resolución \n314 del 28 de febrero de 2024.\nb) Reponer en el sentido de modificar el literal a) del numeral 4 del artículo segundo de la \nResolución 314 del 28 de febrero de 2024.\nc) Reponer en el sentido de modificar el literal c) del numeral 5 del artículo segundo de la \nResolución 314 del 28 de febrero de 2024.\nd) Reponer en el sentido de modificar el literal b) del numeral 8 del artículo segundo de la \nResolución 314 del 28 de febrero de 2024.\ne) Reponer en el sentido de modificar el literal a) del numeral 11 del artículo segundo de \nla Resolución 314 del 28 de febrero de 2024.\nf)\nReponer en el sentido de modificar la nota del numeral 1 del artículo sexto de la \nResolución 314 del 28 de febrero de 2024.\ng) Reponer en el sentido de modificar el alcance del numeral 1 del artículo séptimo de la \nResolución 314 del 28 de febrero de 2024.\nh) No reponer el numeral 3 del artículo séptimo de la Resolución 314 del 28 de febrero de \n2024.\nAhora bien, el presente pronunciamiento se emite al amparo de los principios de la función \nadministrativa consagrados en el artículo 209 de la Constitución Política de Colombia, \ndesarrollados por la Ley 1437 de 2011, así como los principios de la política ambiental \nprevistos en la Ley 99 de 1993 y sus reglamentos, y en aplicación de la garantía del derecho \nde defensa y contradicción que le asiste al administrado, en este caso a la sociedad \nTRANSPORTADORA DE GAS INTERNACIONAL S.A. ESP - TGI S.A. E.S.P. conforme al \nartículo 29 de la Carta Política Nacional.\nEn mérito de lo antes expuesto,\nRESUELVE:\n\nResolución No. 001291       Del 27 JUN. 2024          Hoja No. 38 de 42\n“POR LA CUAL SE RESUELVE UN RECURSO DE REPOSICIÓN EN CONTRA DE LA \nRESOLUCIÓN 314 DEL 28 DE FEBRERO DE 2024”\nPágina 38 de 42\nARTÍCULO PRIMERO. REPONER en el sentido de modificar el numeral 3 del artículo \nsegundo de la Resolución 314 del 28 de febrero de 2024, de conformidad con la parte \nmotiva del presente acto administrativo, el cual quedará en los siguientes términos: \n“ARTÍCULO SEGUNDO. AJUSTAR las siguientes fichas del PMA, presentadas por \nla sociedad TRANSPORTADORA DE GAS INTERNACIONAL S.A. ESP - TGI S.A. \nE.S.P., para lo cual deberá incluir y reportar su implementación, en los Informes de \nCumplimiento Ambiental: (…)\n3. Ficha AMS-5 Manejo de escorrentía.\nMeta: Inspeccionar y mantener de forma oportuna el 100% de obras de drenaje y \nconstruir las que sean necesarias para garantizar el adecuado manejo de aguas \nlluvias y/o escorrentía que se generen en las áreas operativas del gasoducto El \nPorvenir- La Belleza.”\nARTÍCULO SEGUNDO. REPONER en el sentido de modificar el literal a) del numeral 4 del \nartículo segundo de la Resolución 314 del 28 de febrero de 2024, de conformidad con la \nparte motiva del presente acto administrativo, el cual quedará en los siguientes términos:\n“ARTÍCULO SEGUNDO. AJUSTAR las siguientes fichas del PMA, presentadas por \nla sociedad TRANSPORTADORA DE GAS INTERNACIONAL S.A. ESP - TGI S.A. \nE.S.P., para lo cual deberá incluir y reportar su implementación, en los Informes de \nCumplimiento Ambiental: (…)\n4. Ficha AMS-6 Manejo de residuos sólidos y especiales:\na) Ajustar el cronograma de ejecución de la ficha e implementar con una periodicidad \nmensual, y para las actividades de capacitaciones una periodicidad semestral.”\nARTICULO TERCERO. REPONER en el sentido de modificar el literal c) del numeral 5 del \nartículo segundo de la Resolución 314 del 28 de febrero de 2024, de conformidad con la \nparte motiva del presente acto administrativo, el cual quedará en los siguientes términos: \n“ARTÍCULO SEGUNDO. AJUSTAR las siguientes fichas del PMA, presentadas por \nla sociedad TRANSPORTADORA DE GAS INTERNACIONAL S.A. ESP - TGI S.A. \nE.S.P., para lo cual deberá incluir y reportar su implementación, en los Informes de \nCumplimiento Ambiental: (…) \n5. Ficha AMH-1 Manejo de residuos líquidos: \nc) La periodicidad de la entrega de aguas residuales a terceros será trimestral y/o \nen el momento en que se alcance el 80% de la capacidad de almacenamiento.”\nARTÍCULO CUARTO. REPONER en el sentido de modificar el literal b) del numeral 8 del \nartículo segundo de la Resolución 314 del 28 de febrero de 2024, de conformidad con la \nparte motiva del presente acto administrativo, en cual quedará en los siguientes términos:\n\nResolución No. 001291       Del 27 JUN. 2024          Hoja No. 39 de 42\n“POR LA CUAL SE RESUELVE UN RECURSO DE REPOSICIÓN EN CONTRA DE LA \nRESOLUCIÓN 314 DEL 28 DE FEBRERO DE 2024”\nPágina 39 de 42\n“ARTICULO SEGUNDO. AJUSTAR las siguientes fichas del PMA, presentadas por \nla sociedad TRANSPORTADORA DE GAS INTERNACIONAL S.A. ESP - TGI S.A. \nE.S.P., para lo cual deberá incluir y reportar su implementación, en los Informes de \nCumplimiento Ambiental: (…)\n8. Ficha BMS-2 Manejo de flora: \nb) Incluir e implementar la meta: Realizar el 100% de rescate, traslado y reubicación \nde especies de flora endémica y/o en veda arbórea en categoría brinzal con \ncondiciones adecuadas* y el 100% de epifitas vasculares con condiciones \nadecuadas**. \n*Las condiciones adecuadas para flora arbórea endémica y/o en veda son: 1. \nEstado fitosanitario bueno u óptimo. 2. Individuos no senescentes y 3. Ubicado \nen sitio adecuado para rescate sin poner en riesgo la integridad de otros \nindividuos aledaños, del personal que realiza el rescate o sin poner en riesgo el \nentorno de la zona. \n**Las condiciones adecuadas para flora epífita vascular son: 1. Estado \nfitosanitario bueno u óptimo. 2. Individuos no senescentes y 3. Estado \nreproductivo bueno u óptimo.”\nARTÍCULO QUINTO. REPONER en el sentido de modificar el literal a) del numeral 11 del \nartículo segundo de la Resolución 314 del 28 de febrero de 2024, de conformidad con la \nparte motiva del presente acto administrativo, el cual quedará en los siguientes términos: \n“ARTICULO SEGUNDO: AJUSTAR las siguientes fichas del PMA, presentadas por \nla sociedad TRANSPORTADORA DE GAS INTERNACIONAL S.A. ESP - TGI S.A. \nE.S.P., para lo cual deberá incluir y reportar su implementación, en los Informes de \nCumplimiento Ambiental: (…)\n11. Ficha BR-1 Programa de revegetalización: \na) Incluir e implementar el objetivo: Proteger taludes y conservar los suelos mediante \nla implementación de obras de bioingeniería, previa evaluación técnica de viabilidad \nde estas.”\nARTÍCULO SEXTO. REPONER en el sentido de modificar la nota del numeral 1 del artículo \nsexto de la Resolución 314 del 28 de febrero de 2024, de conformidad con la parte motiva \ndel presente acto administrativo, el cual quedará en los siguientes términos:\n“ARTÍCULO \nSEXTO. \nLa \nsociedad \nTRANSPORTADORA \nDE \nGAS \nINTERNACIONAL S.A. ESP - TGI S.A. E.S.P., deberá dar cumplimiento a las \nsiguientes obligaciones especificas: (...)”\nNota. Incluir el soporte de su aplicación en los Informes de Cumplimiento Ambiental, \nallegando los soportes de convocatoria con las evidencias correspondientes. En \ncaso de que los convocados no se presenten a la actividad programada, la Sociedad \n\nResolución No. 001291       Del 27 JUN. 2024          Hoja No. 40 de 42\n“POR LA CUAL SE RESUELVE UN RECURSO DE REPOSICIÓN EN CONTRA DE LA \nRESOLUCIÓN 314 DEL 28 DE FEBRERO DE 2024”\nPágina 40 de 42\ndeberá levantar evidencias (registros fotográficos, informes, actas, entre otros) que \nsoporten que efectivamente los convocados no asistieron.”\n ARTICULO SEPTIMO. REPONER en el sentido de modificar el numeral 1 del artículo \nséptimo de la Resolución 314 del 28 de febrero de 2024, de conformidad con la parte motiva \ndel presente acto administrativo, el cual deberá contemplar los siguientes aspectos para el \ninvolucramiento efectivo de la comunidad en los monitoreos de ruido y calidad del aire:\na. Notificar a la comunidad mediante los canales de atención físicos, telefónicos o \nvirtuales establecidos, la programación de los monitoreos de calidad del aire, \nemisión de ruido y ruido ambiental (jornada diurna y nocturna) invitándolos a estar \npresentes durante el desarrollo de estos. \nb. Realizar registros fotográficos y de listados de asistencia de la comunidad que \npueda acompañar la realización de los monitoreos. \nc. Documentar las inquietudes de la comunidad durante el acompañamiento a los \nmonitoreos empleando los formatos establecidos por TGI S.A E.S.P. para la \natención de peticiones, quejas, reclamos o sugerencias. \nd. Documentar las respuestas dadas a las peticiones, quejas, reclamos o \nsugerencias presentadas durante el acompañamiento a los monitoreos.\n e. Presentar los soportes de los literales a, b, c y d, radicando la información \nsolicitada en el expediente del proyecto a los 15 días de ejecutado cada monitoreo.”\nARTICULO OCTAVO. No REPONER y en consecuencia confirmar el numeral 3 del artículo \nséptimo de la Resolución 314 del 28 de febrero de 2024, conforme la parte motiva de este \nproveído.\nPARÁGRAFO. La sociedad TRANSPORTADORA DE GAS INTERNACIONAL S.A. ESP– \nTGI S.A. E.S.P., deberá presentar los soportes que den cuenta de la ejecución de las \nactividades contempladas en la Resolución 314 del 28 de febrero de 2024, en el informe de \ncumplimiento Ambiental - ICA donde reporte las obligaciones del periodo 2024.\nARTÍCULO NOVENO. Por la Autoridad Nacional de Licencias Ambientales - ANLA, notificar \nel contenido del presente acto administrativo al representante legal o apoderado \ndebidamente constituido, apoderado debidamente constituido o a la persona debidamente \nautorizada, de la sociedad TRANSPORTADORA DE GAS INTERNACIONAL S.A. ESP - \nTGI S.A. E.S.P., por medios electrónicos.\nPARÁGRAFO. Para la notificación electrónica se tendrá en cuenta lo previsto en el artículo \n56 de la Ley 1437 de 2011, modificado por el artículo 56 de la Ley 2080 de 2021. En el \nevento en que la notificación no pueda hacerse de forma electrónica, se seguirá el \nprocedimiento previsto en los artículos 67 y siguientes de la Ley 1437 de 2011.\nARTÍCULO DÉCIMO. En el evento en que el titular del Plan de Manejo Ambiental sea \nadmitido a proceso de disolución o régimen de insolvencia empresarial o liquidación, \nregulados por las normas vigentes, informará inmediatamente de esta situación a esta \nAutoridad, con fundamento, entre otros, en los artículos 8, 58, 79, 80, 81, 95 Numeral 8 de \nla Constitución Política de 1991, en la Ley 43 de 1990, en la Ley 222 de 1995, en la Ley \n1333 de 2009 y demás normas vigentes al y jurisprudencia aplicable. Adicional a la \n\nResolución No. 001291       Del 27 JUN. 2024          Hoja No. 41 de 42\n“POR LA CUAL SE RESUELVE UN RECURSO DE REPOSICIÓN EN CONTRA DE LA \nRESOLUCIÓN 314 DEL 28 DE FEBRERO DE 2024”\nPágina 41 de 42\nobligación de informar a esta Autoridad de tal situación, el titular de la licencia o permiso \naprovisionará contablemente las obligaciones contingentes que se deriven de la existencia \nde un procedimiento ambiental sancionatorio conforme con el artículo 40 de la ley 1333 de \n2009 o la norma que la adicione, modifique o derogue.\nARTÍCULO DÉCIMO PRIMERO. Comunicar el presente acto administrativo a los \nmunicipios de Monterrey y Sabanalarga (Departamento de Casanare), municipios de Páez, \nMiraflores, Zetaquirá, Ramiriquí, Jenesano, Boyacá, Ventaquemada, Samacá, Sáchica, \nVilla de Leiva, Sutamarchán, Santa Sofía, y Moniquirá (Departamento de Boyacá) y los \nmunicipios de Puente Nacional, Albania, Jesús María y Florián (Departamento de \nSantander), a la Corporación Autónoma Regional de la Orinoquía - CORPORINOQUIA, a \nla Corporación Autónoma Regional de Boyacá - CORPOBOYACÁ, a la Corporación \nAutónoma Regional de Chivor – CORPOCHIVOR, a la Corporación Autónoma Regional de \nSantander – CAS y a la Procuraduría Delegada para Asuntos Ambientales y Agrarios.\nARTÍCULO DÉCIMO SEGUNDO. Por la Autoridad Nacional de Licencias Ambientales – \nANLA, publicar el presente acto administrativo en la Gaceta Ambiental de la Entidad.\nARTÍCULO DÉCIMO TERCERO. Contra el presente acto administrativo no procede \nrecurso alguno, de conformidad con lo establecido en el artículo 87 del Código de \nProcedimiento Administrativo y de lo Contencioso Administrativo.\nNOTIFÍQUESE, COMUNÍQUESE, PUBLÍQUESE Y CÚMPLASE\nDado en Bogotá D.C., a los 27 JUN. 2024\nRODRIGO ELIAS NEGRETE MONTES\nDIRECTOR GENERAL\nCARLOS ALFONSO RUEDA ARDILA\nCONTRATISTA\nGLADYS CATALINA PELAEZ MENDIETA\nCONTRATISTA\nSANDRA PATRICIA BEJARANO RINCON\nCONTRATISTA\n\nResolución No. 001291       Del 27 JUN. 2024          Hoja No. 42 de 42\n“POR LA CUAL SE RESUELVE UN RECURSO DE REPOSICIÓN EN CONTRA DE LA \nRESOLUCIÓN 314 DEL 28 DE FEBRERO DE 2024”\nPágina 42 de 42\nBETSY RUBIANE PALMA PACHECO\nPROFESIONAL ESPECIALIZADO\nDANIEL ESTEBAN JURADO OSORIO\nCONTRATISTA\nGERMAN BARRETO ARCINIEGAS\nSUBDIRECTOR DE SEGUIMIENTO DE LICENCIAS AMBIENTALES\nExpediente No. LAM0054\nConcepto Técnico 2860 del 7 de mayo de 2024.\nFecha: Mayo de 2024\nProceso No.: 20241000012914\nNota: Este es un documento electrónico generado desde los Sistemas de Información de la ANLA. El original reposa en los \narchivos digitales de la Entidad\n"
}