{
  "fuente": "ANLA_GACETA",
  "numero_resolución": "RESOLUCIÓN N° 000042",
  "fecha_resolución": "2023-08-14",
  "nombre_proyecto": "proyecto Construcción y Operación de la",
  "ubicación": "departamento del Meta hasta las facilidades del CPF Cusiana ubicado en el municipio de Tauramena departamento de Casanare.",
  "empresa": "MAVDT, hoy Ministerio de Ambiente y Desarrollo Sostenible - MADS en adelante Ministerio otorgó Licencia Ambiental a la sociedad Meta Petroleum LTD",
  "numero_expediente": "LAM2965",
  "radicados": [
    "20236200538812"
  ],
  "descripcion": "Por el cual se resuelve un recurso de reposición interpuesto contra la Resolución 01771 del 14 de agosto de 2023",
  "tipos_infraccion": [
    "Vertimientos",
    "Emisiones atmosféricas",
    "Residuos sólidos",
    "Tala o afectación de bosques",
    "Incumplimiento del PMA"
  ],
  "pdf_id": "45178",
  "file_name": "ANLA_45178.pdf",
  "texto_completo": "República de Colombia\nMinisterio de Ambiente y Desarrollo Sostenible\nAUTORIDAD NACIONAL DE LICENCIAS \nAMBIENTALES\n- ANLA –\nRESOLUCIÓN N° 000042\n(15 ENE. 2024)\nPágina 1 de 14\n“Por el cual se resuelve un recurso de reposición interpuesto contra la \nResolución 01771 del 14 de agosto de 2023”\nEL DIRECTOR DE LA AUTORIDAD NACIONAL DE LICENCIAS AMBIENTALES \n– ANLA\nEn uso de sus facultades legales asignadas en la Ley 99 de 1993, la Ley 1437 de \n2011, el Decreto-ley 3573 del 27 de septiembre de 2011, el Decreto 1076 del 26 \nde mayo de 2015, el Decreto 376 de 11 de marzo de 2020, la Resolución 1957 del \n5 de noviembre de 2021, Resolución 1223 del 19 de septiembre de 2022 y,\nCONSIDERANDO:\nQue mediante la Resolución 1712 del 29 de agosto de 2006, el entonces Ministerio \nde Ambiente, Vivienda y Desarrollo Territorial – MAVDT, hoy Ministerio de Ambiente \ny Desarrollo Sostenible - MADS en adelante Ministerio otorgó Licencia Ambiental a \nla sociedad Meta Petroleum LTD., para el proyecto Construcción y Operación de la \nLínea de Conducción de Hidrocarburos desde el Campo Rubiales ubicado en el \nmunicipio de Puerto Gaitán en el departamento del Meta hasta las facilidades del \nCPF Cusiana ubicado en el municipio de Tauramena departamento de Casanare. \nQue a través de la Resolución 1500 del 27 de agosto de 2008, el Ministerio, autorizó \nla cesión de la Licencia Ambiental otorgada a la sociedad Meta Petroleum LTD, a \nfavor de la sociedad Oleoducto de los Llanos Orientales S.A., - ODL, para el \nproyecto “Construcción y operación de la Línea de conducción de hidrocarburos \nCampo Rubiales – CPF Cusiana”.\nQue por Resolución 1617 del 17 de septiembre de 2008, el Ministerio, modificó la \nResolución 1712 del 29 de agosto de 2008, en el sentido de autorizar la derivación \ndenominada “El Viento- Estación Monterrey”, aprueba unas actividades, modifica \npermisos de uso y aprovechamiento de los recursos \nnaturales renovables e impone unas obligaciones.\n\nResolución No. 000042       Del 15 ENE. 2024          Hoja No. 2 de 14\n“Por el cual se resuelve un recurso de reposición interpuesto contra la Resolución 01771 del \n14 de agosto de 2023”\nPágina 2 de 14\nQue mediante la Resolución 1623 del 19 de agosto de 2010, el Ministerio, modificó \nla Resolución 1712  de 29 de agosto de 2006, en el sentido de adicionar actividades \nrelacionadas con la construcción y  operación de dos (2) estaciones de rebombeo; \nconcesión de aguas superficiales; permiso de vertimientos; compensación por \nafectación paisajística, fauna y flora; permiso de emisiones atmosféricas; ajuste a \nlas fichas del Plan de Manejo Ambiental; aprobación transitoria del Plan de Inversión \ndel 1%; además se adicionan obligaciones asociadas con los registros de los \nvolúmenes de \nresiduos sólidos producidos y entregados, el uso de fibras naturales, entre otros.\nQue a través de la Resolución 553 del 7 de junio de 2013, la Autoridad Nacional de \nLicencias Ambientales, modificó el numeral tercero del Artículo Quinto de la \nResolución 1712 del 29 de agosto \nde 2006, en el sentido de adicionar actividades relativas al Plan de Contingencias.\nQue por medio de la Resolución 182 del 28 febrero de 2014, la Autoridad Nacional \nde Licencias Ambientales, modificó la Resolución 1712 del 29 agosto de 2006, en \nel sentido de adicionar actividades de expansión de la Estación de rebombeo de \nRubiales, Corocora y Jaguey; construcción y operación de campamentos entre \notras.\nQue mediante la Resolución 1202 del 15 de octubre de 2014, la Autoridad Nacional \nde Licencias Ambientales, modificó el numerales 2 y 4, del Artículo Primero de la \nResolución 182 del 28 de febrero de 2014, en el sentido de realizar anualmente \ncapacitación y/o divulgación a las comunidades del área de influencia del Proyecto \nel Plan de contingencias. De igual manera se modificó el literal f del Artículo Primero \nde la Resolución 1623 de 19 de agosto de 2010 con relación a la construcción de la \ninfraestructura eléctrica.\nQue a través de la Resolución 619 del 28 de mayo de 2015, la Autoridad Nacional \nde Licencias Ambientales, modificó la Resolución 182 del 28 febrero de 2008, \nrelacionado con los ajustes de la Ficha del PMA del medio Biótico BS-3 Manejo de \nFauna.\nQue mediante la Resolución 1002 del 12 de septiembre de 2016 la Autoridad \nNacional de Licencias Ambientales modificó la Resolución 1712 del 29 de agosto \nde 2006, con relación a la concesión de aguas subterráneas para los pozos \nprofundos perforados en las estaciones de rebombeo Corocora y Jagüey; entre \notros. \nQue a través de la Resolución 450 del 2 de abril de 2018, la Autoridad Nacional de \nLicencias Ambientales modificó la Resolución 1002 del 12 de septiembre de 2016, \nmodificatoria del artículo tercero de la Resolución 1712 del 29 de agosto de 2006, \ncon relación a la concesión de aguas subterráneas para los pozos profundos en las \nestaciones de rebombeo Corocora y Jaguey.\n\nResolución No. 000042       Del 15 ENE. 2024          Hoja No. 3 de 14\n“Por el cual se resuelve un recurso de reposición interpuesto contra la Resolución 01771 del \n14 de agosto de 2023”\nPágina 3 de 14\nQue por Resolución 2344 del 18 de diciembre de 2018, la Autoridad Nacional de \nLicencias Ambientales \nmodificó la Resolución 1712 del 29 de agosto de 2006, en el sentido de aprobar las \nfichas del Plan de \nManejo Ambiental que serán utilizadas en la etapa de operación del proyecto.\nQue a través de la Resolución 01771 del 14 de agosto de 2023, la Autoridad \nNacional de Licencias Ambientales ajustó vía seguimiento la FICHA PM-1 Programa \nMonitoreo establecida en la Resolución 1712 del 29 de agosto de 2006, modificada \npor las Resoluciones 1617 del 17 de septiembre de 2008, 1623 del 19 de agosto de \n2010, 182 del 28 de febrero de 2014 y 2344 de 2018, en el sentido establecer e \nimplementar la acción de manejo relacionada con las condiciones de tiempo y modo \ndel monitoreo de los pozos profundos Jagüey y Rubiales y los 3 piezómetros que \nhacen parte de la red de cada pozo.  \nQue mediante radicado 20236200538812 del 29 de agosto de 2023, la sociedad \nOleoducto de los Llanos Orientales S.A., presentó recurso de reposición en contra \nde la Resolución 01771 del 14 de agosto de 2023.\nDE LA COMPETENCIA DE LA AUTORIDAD NACIONAL DE LICENCIAS \nAMBIENTALES\nMediante Decreto-Ley 3573 de 27 de septiembre de 2011, el Gobierno Nacional en \nuso de las facultades extraordinarias conferidas mediante la Ley 1444 de 2011 creó \nla Autoridad Nacional de Licencias Ambientales– ANLA, entidad encargada de que \nlos proyectos, obras o actividades sujetos a licenciamiento, permiso o trámite \nambiental cumplan con la normativa ambiental. De tal manera que contribuyan al \ndesarrollo sostenible ambiental del país.\nDe acuerdo con el numeral 2 del artículo segundo del Decreto 376 del 11 de marzo \nde 2020, “Por medio del cual se modifica la estructura de la Autoridad Nacional de \nLicencias Ambientales”, le corresponde al director general de la Entidad, suscribir \nlos actos administrativos que otorgan, niegan, modifican, ajustan o declaran la \nterminación de las licencias, permisos y trámites ambientales.\nDe conformidad con el Decreto 376 del 11 de marzo de 2020 que modificó la \nestructura de la Autoridad Nacional de Licencias Ambientales -ANLA, corresponde \nal Despacho de la Dirección General de esta Entidad, la suscripción del presente \nacto administrativo.\nA través de la Resolución 1957 del 5 de noviembre de 2021 se adoptó el Manual \nEspecífico de Funciones y de Competencias Laborales para los empleos de la \nPlanta de Personal de la Autoridad Nacional de Licencias Ambientales, asignando \nla función de suscripción del presente acto administrativo al Director General\n\nResolución No. 000042       Del 15 ENE. 2024          Hoja No. 4 de 14\n“Por el cual se resuelve un recurso de reposición interpuesto contra la Resolución 01771 del \n14 de agosto de 2023”\nPágina 4 de 14\nMediante Resolución 1223 del 19 de septiembre de 2022, el Ministerio de Ambiente \ny Desarrollo Sostenible nombró en el empleo de director general de Unidad \nAdministrativa Código 015 de la Autoridad Nacional de Licencias Ambientales –\nANLA, al abogado RODRIGO ELÍAS NEGRETE MONTES\nFUNDAMENTOS CONSTITUCIONALES Y LEGALES\nDe los deberes estatales con relación al ambiente y recursos naturales\nLa Constitución Política de Colombia en el Capítulo Tercero del Título Segundo \ndenominado “De los derechos, las garantías y los deberes”, incluyó los derechos \ncolectivos y del ambiente, o también llamados derechos de tercera generación, con \nel fin de regular la preservación del ambiente y de sus recursos naturales, \ncomprendiendo el deber que tienen el Estado y sus ciudadanos de realizar todas \nlas acciones para protegerlo, e implementar aquellas que sean necesarias para \nmitigar el impacto que genera la actividad antrópica sobre el entorno natural.\nEn relación con la protección del medio ambiente, la Carta Política establece que \nes obligación del Estado y de las personas, proteger las riquezas culturales y \nnaturales de la Nación (Art. 8º); en el mismo sentido, se señala que es deber de la \npersona y del ciudadano proteger los recursos culturales y naturales del país y velar \npor la conservación de un ambiente sano (Art. 95); y establece adicionalmente, la \nCarta Constitucional que todas las personas tienen derecho a gozar de un ambiente \nsano, y es deber del Estado proteger la diversidad e integridad del ambiente, \nconservar la áreas de especial importancia ecológica y fomentar la educación para \nel logro de estos fines (Art. 79).\nAsí mismo, por mandato constitucional le corresponde al Estado planificar el manejo \ny aprovechamiento de los recursos naturales, para garantizar su desarrollo \nsostenible, su conservación, restauración o sustitución. Además, deberá prevenir y \ncontrolar los factores de deterioro ambiental, imponiendo las sanciones legales y \nexigiendo la reparación de los daños causados (Art. 80).\nDel recurso de reposición frente a los actos administrativos\nDe acuerdo con la legislación, el recurso de reposición constituye un instrumento \nlegal mediante el cual la parte interesada tiene la oportunidad de ejercer el derecho \nde controvertir una decisión, para que la administración la evalúe, la confirme, aclare \nmodifique o revoque, previo el lleno de las exigencias legales establecidas para \ndicho efecto.\nEn dicho sentido, la finalidad esencial del recurso de reposición no es otra distinta \na que al funcionario de la administración que tomó una decisión administrativa, \ntenga la oportunidad para que enmiende o corrija un error, o los posibles errores \n\nResolución No. 000042       Del 15 ENE. 2024          Hoja No. 5 de 14\n“Por el cual se resuelve un recurso de reposición interpuesto contra la Resolución 01771 del \n14 de agosto de 2023”\nPágina 5 de 14\nque se hayan podido presentar en el acto administrativo por él expedido, en ejercicio \nde sus funciones; o en su defecto lo confirme.\nEl procedimiento para la presentación y decisión de recursos contra los actos \nadministrativos se encuentra reglado en el Código de Procedimiento Administrativo \ny de lo Contencioso Administrativo - Ley 1437 de 2011-, en los artículos 74 y \nsiguientes, que señalan:\n“Artículo 74. Recursos contra los actos administrativos. – Por regla general, \ncontra los actos definitivos procederán los siguientes recursos:\n1. El de reposición, ante quien expidió la decisión para que la aclare, modifique, \nadicione o revoque.”\nFrente a la oportunidad y presentación del recurso de reposición, el artículo 76 del \nmismo Código, señala:\n“Artículo 76. Los recursos de reposición y apelación deberán interponerse por \nescrito en la diligencia de notificación personal, o dentro de los diez (10) días \nsiguientes a ella, o a la notificación por aviso, o al vencimiento del término de \npublicación, según el caso. Los recursos contra los actos presuntos podrán \ninterponerse en cualquier tiempo, salvo en el evento en que se haya acudido ante \nel juez.\nLos recursos se presentarán ante el funcionario que dictó la decisión (…)”\nAdemás del plazo para el ejercicio de los recursos, el artículo 77 del precitado \nCódigo fija los requisitos formales que deben cumplir para su interposición, así:\n“Artículo 77. Por regla general los recursos se interpondrán por escrito que no \nrequiere de presentación personal si quien lo presenta ha sido reconocido en la \nactuación. Igualmente, podrán presentarse por medios electrónicos.\nLos recursos deberán reunir, además, los siguientes requisitos:\n1.Interponerse dentro del plazo legal, por el interesado o su representante o \napoderado debidamente constituido.\n2.Sustentarse con expresión concreta de los motivos de inconformidad.\n3.Solicitar y aportar las pruebas que se pretende hacer valer.\n4.Indicar el nombre y la dirección del recurrente, así como la dirección electrónica si \ndesea ser notificado por este medio.\nSólo los abogados en ejercicio podrán ser apoderados. Si el recurrente obra como \nagente oficioso, deberá acreditar la calidad de abogado en ejercicio, y prestar la \ncaución que se le señale para garantizar que la persona por quien obra ratificará su \nactuación dentro del término de dos (2) meses.\n\nResolución No. 000042       Del 15 ENE. 2024          Hoja No. 6 de 14\n“Por el cual se resuelve un recurso de reposición interpuesto contra la Resolución 01771 del \n14 de agosto de 2023”\nPágina 6 de 14\nSi no hay ratificación se hará efectiva la caución y se archivará el expediente. Para \nel trámite del recurso el recurrente no está en la obligación de pagar la suma que el \nacto recurrido le exija. Con todo, podrá pagar lo que reconoce deber”.\nDe otra parte, el artículo 80 establece el alcance del contenido de la decisión que \nresuelve el recurso:\n“Artículo 80. Decisión de los recursos. - Vencido el período probatorio, si a ello \nhubiere lugar, y sin necesidad de acto que así lo declare, deberá proferirse la \ndecisión motivada que resuelva el recurso.\nLa decisión resolverá todas las peticiones que hayan sido oportunamente \nplanteadas y las que surjan con motivo del recurso.”\nPor su parte y con relación a la conclusión del procedimiento administrativo, expresa \nel artículo 87 de la mencionada Ley, lo siguiente:\n“Artículo 87. Firmeza de los actos administrativos. Los actos administrativos \nquedarán en firme: \n(…)\n“2 Desde el día siguiente a la publicación, comunicación o notificación de la decisión \nsobre los recursos interpuestos (…)”.\nPara el caso concreto, la Resolución 01771 del 14 de agosto de 2023 es un acto \nadministrativo susceptible de ser recurrido según lo dispone el artículo 74 de la Ley \n1437 de 2011, puesto que se trata de un acto definitivo, que adopta una decisión \nque manifiesta la voluntad del Estado, generadora de efectos jurídicos y que pone \nfin a una actuación iniciada de manera oficiosa, que en los términos del Consejo de \nEstado, tal como lo señaló en sentencia de la Sección Tercera de la Sala de lo \nContencioso Administrativo, del 8 de marzo de 2012, se caracteriza por lo siguiente:\n“… Por el contrario, los actos definitivos ponen fin de manera perentoria a la \nactuación administrativa sea de oficio o impulsada a petición de parte, de modo que \nen ellos se agota la actividad de la administración, o tan sólo queda pendiente la \nejecución de lo decidido. Ahora bien, es cierto que los únicos actos susceptibles de \nla Acción Contenciosa Administrativa son los actos definitivos, es decir que se \nexcluyen los de trámite, pues éstos se controlan jurisdiccionalmente como parte \nintegrante del acto definitivo y conjuntamente con éste, es decir de aquel que cierra \nla actuación administrativa.”\nEn relación a los requisitos y condiciones que deben observarse al interponer el \nrecurso de reposición, en el presente caso, se puede concluir lo siguiente:\n1. El recurso se interpuso por escrito ante el director de la Autoridad Nacional \nde Licencias Ambientales, por lo que se cumple este requisito.\n\nResolución No. 000042       Del 15 ENE. 2024          Hoja No. 7 de 14\n“Por el cual se resuelve un recurso de reposición interpuesto contra la Resolución 01771 del \n14 de agosto de 2023”\nPágina 7 de 14\n2. En cuanto a la oportunidad legal para interponer el recurso de reposición, se \ntiene que la notificación de la Resolución 01771 del 14 de agosto de 2023 a \nla sociedad Oleoducto de los Llanos Orientales S.A., - hoy recurrente -, se \nefectuó por medio de correo electrónico el 14 de agosto de 2023 y quedó \nsurtida el día hábil siguiente; atendiendo a los diez (10) días hábiles de \ntérmino para interponer el recurso, contados a partir del día siguiente de la \nnotificación, tal término vencía el 29 de agosto de 2023, el cual fue \npresentado en dicha fecha, encontrándose dentro del término legalmente \nestablecido para tal fin. Por lo tanto, se concluye que el mismo fue presentado \ndentro de la oportunidad legal.\n3. En el escrito del recurso, la sociedad Oleoducto de los Llanos Orientales S.A., \nexpone de manera concreta, los motivos de inconformidad frente a la \nResolución 01771 del 14 de agosto de 2023. En esa medida, este requisito \nse cumple.\n4. Asimismo, es interpuesto por la apoderada especial de la sociedad \nOleoducto de los Llanos Orientales S.A., de conformidad con el documento \nprivado del 26 de julio de 2023 de Bogotá D.C., registrado en la Cámara de \nComercio el 24 de agosto de 2023, con el No. 00343404 del Libro VI, según \nconsta en el certificado de existencia y representación legal, el cual lo faculta \npara recurrir la resolución 01771 del 14 de agosto de 2023. Así las cosas, la \napoderada se encuentra legitimada para interponer el recurso.\n5. Por último, la dirección de notificaciones del recurrente se encuentra \ndebidamente registrada y es inequívoca su individualización, por lo tanto, se \ntiene por cumplido este requisito.\nEn armonía con lo indicado, en el plano de lo axiológico, en toda actuación \nadministrativa que se surta ante esta Autoridad Ambiental, deben respetarse los \nprincipios que orientan las relaciones entre el Estado y los particulares consagrados \nen el artículo 209 de la Constitución Política de 1991, desarrollados igualmente en \nel artículo tercero de la Ley 1437 de 2011, con el fin de asegurar que con la actividad \nadministrativa de las entidades del Estado, se garantice y se satisfaga el interés \ncomún y, desde lo ambiental, la materialización de los principios y directrices que \ngobiernan y son derroteros en la materia.\nSiendo ello así, al verificarse el cumplimiento de los requisitos legales establecidos \nen la normatividad vigente para la admisibilidad del recurso de reposición, se \nprocederá al análisis de fondo de los motivos de inconformidad del recurrente tal y \ncomo se expone a continuación.\nCONSIDERACIONES \nTÉCNICAS \nDE \nLA \nAUTORIDAD \nNACIONAL \nDE \nLICENCIAS AMBIENTALES FRENTE AL RECURSO DE REPOSICIÓN \n\nResolución No. 000042       Del 15 ENE. 2024          Hoja No. 8 de 14\n“Por el cual se resuelve un recurso de reposición interpuesto contra la Resolución 01771 del \n14 de agosto de 2023”\nPágina 8 de 14\nINTERPUESTO POR LA SOCIEDAD OLEODUCTO DE LOS LLANOS \nORIENTALES S.A.   \nEsta Autoridad, analizó los argumentos expuestos por el recurrente en su escrito de \nrecurso para dar respuesta y adoptar decisión de fondo frente al pronunciamiento \nemitido con la Resolución 01771 del 14 de agosto de 2023, previo análisis de los \nmotivos de inconformidad argumentados por la sociedad Oleoducto de los Llanos \nOrientales S.A.\nSe precisa que en el escrito del recurso de reposición presentado por la recurrente \nmediante radicado 20236200538812 del 29 de agosto de 2023, se observó la \npetición y el argumento recurrido el cual se tendrá en cuenta para emitir \npronunciamiento definitivo. \nA continuación, se procede a desarrollar el recurso de conformidad a lo recurrido \npor la titular del instrumento de manejo y control ambiental, para lo cual se indicarán: \nA. La obligación recurrida, B. La petición y los argumentos expuestas por la titular \ndel instrumento de manejo, y C. las consideraciones de la Autoridad Nacional de \nLicencias Ambientales respecto a las disposiciones recurridas. \nA. DISPOSICIÓN RECURRIDA - Artículo Primero de la Resolución No. 1771 de 14 de agosto \nde 2023.\nARTÍCULO PRIMERO. Ajustar vía seguimiento, la FICHA PM-1 Programa Monitoreo, \nestablecida en la Resolución 1712 del 29 de agosto de 2006, modificada por las \nResoluciones 1617 del 17 de septiembre de 2008, 1623 del 19 de agosto de 2010, 182 \ndel 28 de febrero de 2014 y 2344 de 2018, en el sentido establecer e implementar la \nacción de manejo relacionada con las condiciones de tiempo y modo del monitoreo de \nlos pozos profundos Jagüey y Rubiales y los 3 piezómetros que hacen parte de la red \nde cada pozo, que serán incluidos dentro de la red de monitoreo regional del recurso \nhídrico subterráneo; como se especifica a continuación:\n(…)\nB. PETICIONES Y ARGUMENTOS DE LA EMPRESA \nEn virtud de lo señalado en los fundamentos técnicos y de derecho, ODL solicita se \nmodifique el artículo primero de la Resolución No. 1771-4 de 14 de agosto de 2023, \nen el sentido de adicionar dentro de ésta que la misma aplicará a partir del 1 de enero \nde 2024.\nArgumentos del recurrente\nEs de recalcar que ODL, realiza anualmente la planeación presupuestal con el fin de \nincluir los costos y gastos en que incurre la compañía para ejecutar las funciones de \nmantenimiento de activos entre los que se involucra los servicios de monitoreos de \ncalidad ambiental para las instalaciones que componen el sistema de transporte de \n\nResolución No. 000042       Del 15 ENE. 2024          Hoja No. 9 de 14\n“Por el cual se resuelve un recurso de reposición interpuesto contra la Resolución 01771 del \n14 de agosto de 2023”\nPágina 9 de 14\nhidrocarburos Oleoducto Rubiales Monterrey – Viento CPF Cusiana y las estaciones \nRubiales, Corocora y Jagüey; por ello para la vigencia actual, los recursos económicos \ndispuestos para el desarrollo de dichas actividades no fueron contemplados en la \nplaneación inicial, y considerando que la Compañía se encuentra en la última etapa de \nsu ejecución presupuestal es imposible disponer de recursos adicionales para la \nejecución de dichos monitoreos. \nLo anterior, teniendo en cuenta que la planeación presupuestal es una herramienta \nnecesaria para las Compañías, en tanto les permite establecer las actividades a \nejecutar en un año. En ese sentido, para el caso concreto, ODL realizó su presupuesto \npara el año 2023, sin que la Autoridad hubiese notificado de modificación de la \nperiodicidad y parámetros requeridos para los monitoreos en los pozos profundos y \npiezómetros de Jagüey y Rubiales, por lo cual resulta improcedente para la Compañía \nejecutar estos monitoreos en el presente año, toda vez que no es posible incluir los \ncostos asociados dentro del presupuesto aprobado para la vigencia 2023. \nEn este sentido, dentro de la programación dispuesta para el ciclo de planeación \npresupuestal dentro de la vigencia 2024 a 2026 se incluyó dentro de la misma este \nnuevo rubro que permita dar cumplimiento a lo indicado en el artículo primero por la \nResolución No. 1771-4 de 14 de agosto de 2023, con lo cual se hace necesario que la \nAutoridad Nacional de Licencias Ambientales modifique el plazo de la obligación y este \nempiece a regir a partir de enero de 2023. (Sic).\nC. CONSIDERACIONES \nDE \nESTA \nAUTORIDAD \nRESPECTO \nDE \nLOS \nARGUMENTOS EXPUESTOS \nFrente a lo manifestado por la sociedad en relación con la planeación presupuestal \nanual que realiza con el fin de incluir costos y gastos para ejecutar las funciones de \nmantenimiento de activos incluyendo los servicios de monitoreo de la calidad \nambiental para las instalaciones que componen el sistema de trasporte de \nhidrocarburos en el proyecto, encontrándose a la fecha de notificación de la \nResolución 01771 del 14 de agosto de 2023 en su última etapa de ejecución, se \nconsidera pertinente indicar a la sociedad que la Resolución recurrida dentro del \nnumeral 2 del artículo primero hace una distinción frente a las condiciones de tiempo \n–(frecuencia de monitoreo) estableciendo dos monitoreos al año  para la época de \nestiaje, el cual deberá realizarse dentro los meses de diciembre y febrero y para la  \népoca lluviosa, el cual deberá realizarse entre los meses de mayo a julio, de cada \nanualidad.\nDe igual forma, el numeral 3 del artículo primero estableció la condición de modo- \n(parámetros fisicoquímicos y microbiológicos) estableciendo su medición 2 veces al \naño, en época de estiaje para los meses de enero y febrero y para la época de lluvia \nentre los meses de mayo a julio, de cada anualidad.\nPor tal razón, esta Autoridad considera que la Resolución recurrida es clara en \nestablecer la temporalidad para realizar los monitoreos, los cuales coinciden y/o se \nencuentran dentro del plan presupuestal anual que manifiesta la recurrente que \n\nResolución No. 000042       Del 15 ENE. 2024          Hoja No. 10 de 14\n“Por el cual se resuelve un recurso de reposición interpuesto contra la Resolución 01771 del \n14 de agosto de 2023”\nPágina 10 de 14\nrealiza la sociedad, con el fin de cumplir con las obligaciones. Por lo que no se \nconsidera procedente modificar el artículo recurrido y en consecuencia confirmar en \nsu integridad el artículo primero de la Resolución 01771 del 14 de agosto de 2023.\nConsideraciones jurídicas de la Autoridad Nacional de Licencias Ambientales\nDe la expedición de la Resolución 01771 del 14 de agosto de 2023 y sus \nfundamentos.\nEs necesario señalar  los motivos jurídicos y técnicos por los cuales fue expedida la \nResolución objeto del presente recurso de reposición; pues, teniendo en  cuenta los \nargumentos y los documentos que reposan en el expediente, así como  lo observado \nen la visita de seguimiento ambiental, es dable indicar que esta Autoridad adelantó \nuna revisión documental al expediente LAM2965 y consideró pertinente realizar un \najuste vía seguimiento, debido al carácter dinámico de la licencia  y con el fin de \nprevenir, mitigar, corregir y compensar los impactos generados por el proyecto \najustando  a la realidad actual del proyecto garantizando la eficiencia y eficacia de \nestas medidas. \nComo resultado de lo anterior, se emitió el Concepto Técnico 005859 del 27 de \nseptiembre de 2022, el cual sirvió como fundamento y sustento técnico para la \nexpedición del Acto Administrativo objeto de recurso, el cual expone en su parte \nconsiderativa argumentos que para el presente acto administrativo permanecen \nvigentes y válidos a la fecha.\nCon relación a la decisión que se adopta en el presente acto administrativo, y en \nparticular en lo relacionado con la implementación de la acción de manejo \nrelacionado condiciones de tiempo y modo del monitoreo de pozos profundos \nJaguey y Rubiales y los piezómetros que hacen parte de la red de cada pozo incluido \ndentro de la red de monitoreo regional del recurso hídrico subterráneo, es preciso \nconsiderar que las mismas se encuentran soportadas sobre decisiones técnicas \nobjetivas adecuadas a la realidad del proyecto. Por lo tanto, las decisiones \nadministrativas que se adoptan en la presente actuación, le permiten a esta \nAutoridad ambiental la adopción e imposición de medidas de manejo que sean \ncoherentes y eficaces, sin perjuicio de las medidas que debe adoptar el beneficiario \nde la licencia ambiental a fin de compensar el impacto ambiental que la ejecución \nde las obras produce, impidiendo la degradación del medio ambiental. \nDe las anteriores consideraciones, es necesario colegir, que las medidas \nestablecidas por parte de esta Autoridad corresponden a las circunstancias \nencontradas en campo, y se contraen en prevenir los impactos evidenciados, en \nesa medida las decisiones tomadas se presentan como proporcionales para el \ncumplimiento de los fines pretendidos por esta Autoridad, en ejercicio de sus \ncompetencias y los motivos para los cuales fue creada mediante el Decreto 3573 \nde 2011.\n\nResolución No. 000042       Del 15 ENE. 2024          Hoja No. 11 de 14\n“Por el cual se resuelve un recurso de reposición interpuesto contra la Resolución 01771 del \n14 de agosto de 2023”\nPágina 11 de 14\nCon relación a la proporcionalidad de las medidas adoptadas, se señala que en \nsentencia C-520 de 2016 la Corte Constitucional indicó:\n“Las razones que resultan legítimas para adoptar tratos diferenciales deben \nprocurar, además, restringir en la menor medida posible, tanto el derecho general a \nla igualdad, como los demás derechos y principios constitucionales que puedan \nverse involucrados (afectados, intervenidos) en la decisión. En tal sentido, las \nmedidas deben ser proporcionales. \nPor esa razón, la Corte ha expresado que para que un trato diferenciado sea \nconstitucionalmente válido, debe tener un propósito constitucionalmente \nlegítimo, y debe ser proporcional, en el sentido de que no implique afectaciones \nexcesivas a otros propósitos constitucionalmente protegidos. La proporcionalidad \ndel medio se determina, entonces, mediante una evaluación de su “idoneidad para \nobtener el fin (constitucionalmente legítimo de acuerdo con el principio de razón \nsuficiente); necesidad, en el sentido de que no existan medios alternativos \nigualmente adecuados o idóneos para la obtención del fin, pero menos restrictivos \nde los principios afectados; y proporcionalidad en sentido estricto, esto es, que el fin \nque la efectividad del fin que se persigue se alcance en una medida mayor a la \nafectación de los principios que sufren restricción, y particularmente, del principio de \nigualdad” (Resaltado fuera del texto)\nDe manera que las medidas adoptadas mediante la Resolución recurrida, no son \notra cosa que una manifestación de los mandatos constitucionales anteriormente \ncitados en el presente acto administrativo, que pretenden que el Estado controle los \nfactores de deterioro ambiental, y en virtud del principio de proporcionalidad, se \nestablecieran unas medidas que esta Autoridad considera adecuadas para el \nefecto, y que van en la correcta dirección, para asegurar los fines del Estado, los \nmandatos, principios de la función administrativa y el interés general, dentro del \ncual, por supuesto, se encuentra la preservación, conservación y racional y \nsustentable uso de los recursos naturales, el patrimonio común de la humanidad y \nque, a entender de esta Autoridad, no se presentan como excesivas frente al titular \nde la licencia ambiental.\nTeniendo en cuenta las consideraciones técnicas y jurídicas esgrimidas en este \npronunciamiento, se considera procedente confirmar en su integridad la Resolución \n01771 del 14 de agosto de 2023 por medio de la cual se ajustó vía seguimiento la \nFicha PM-1 Programa Monitoreo implementando la acción de manejo relacionada \ncon las condiciones de tiempo y modo del monitoreo de los pozos profundos y 3 \npiezómetros que hacen parte de la red de cada pozo, incluidos dentro de la red de \nmonitoreo del recurso hídrico subterráneo. \nDe conformidad con lo señalado en el artículo 87 del Código de Procedimiento \nAdministrativo y de lo Contencioso Administrativo, contra el presente acto \nadministrativo no procede ningún recurso. \n\nResolución No. 000042       Del 15 ENE. 2024          Hoja No. 12 de 14\n“Por el cual se resuelve un recurso de reposición interpuesto contra la Resolución 01771 del \n14 de agosto de 2023”\nPágina 12 de 14\nEn mérito de lo expuesto,\nRESUELVE:\nARTÍCULO PRIMERO.  No reponer y en consecuencia confirmar en su integridad \nel artículo primero de la Resolución 01771 del 14 de agosto de 2023.\nARTÍCULO SEGUNDO. Los demás términos, condiciones y obligaciones de la \nResolución 01771 del 14 de agosto de 2023, que no son objeto de modificación \nexpresa en este proveído, se mantienen vigentes y son exigibles para la Sociedad \nOLEODUCTO DE LOS LLANOS ORIENTALES S.A., a partir de la ejecutoria del \npresente acto administrativo.\nARTÍCULO TERCERO. Notificar personalmente o por aviso, cuando a ello hubiere \nlugar, el contenido del presente acto administrativo al representante legal, \napoderado debidamente constituido o a la persona debidamente autorizada por la \nSociedad OLEODUCTO DE LOS LLANOS ORIENTALES S.A., identificada con Nit. \n900.203.441-1, de conformidad con los artículos 56 modificado por el artículo 10 de \nla Ley 2080 de 2021 y 67 y 69 del Código de Procedimiento Administrativo y de lo \nContencioso Administrativo.\nARTÍCULO CUARTO. Comunicar el presente acto administrativo a las alcaldías \nmunicipales de Puerto Gaitán y Puerto López en el departamento de Meta, de \nMonterrey y Tauramena en el departamento de Casanare, a la Corporación para el \nDesarrollo Sostenible del Área de Manejo Especial La Macarena - Cormacarena, a \nla Corporación Autónoma Regional de la Orinoquia – Corporinoquia y a la Agencia \nNacional de Hidrocarburos – ANH.\nARTÍCULO QUINTO. Publicar el presente acto administrativo en la Gaceta \nAmbiental de la Autoridad Nacional de Licencias Ambientales – ANLA, de \nconformidad con los términos señalados en el artículo 71 de la Ley 99 de 1993.\nARTÍCULO SEXTO. Contra el presente acto administrativo no procede recurso \nalguno, de conformidad con lo dispuesto en el Artículo 87 de la Ley 1437 de 18 de \nenero de 2011 por medio de la cual se expidió el Código de Procedimiento \nAdministrativo y de lo Contencioso Administrativo.\nNOTIFÍQUESE, COMUNÍQUESE, PUBLÍQUESE Y CÚMPLASE \nDado en Bogotá D.C., a los 15 ENE. 2024\n\nResolución No. 000042       Del 15 ENE. 2024          Hoja No. 13 de 14\n“Por el cual se resuelve un recurso de reposición interpuesto contra la Resolución 01771 del \n14 de agosto de 2023”\nPágina 13 de 14\nRODRIGO ELIAS NEGRETE MONTES\nDIRECTOR GENERAL\nERIKA PATRICIA GARNICA TARAZONA\nCONTRATISTA\nYEIMY PAOLA VELASQUEZ PENA\nCONTRATISTA\nNANCY RUBIELA CUBIDES PERILLA\nCONTRATISTA\nSANDRA PATRICIA BEJARANO RINCON\nCONTRATISTA\nALEXANDER MARTINEZ MONTERO\nASESOR\nGERMAN BARRETO ARCINIEGAS\nSUBDIRECTOR DE SEGUIMIENTO DE LICENCIAS AMBIENTALES\nExpediente No. LAM2965\nProceso No.: 20241000000424\nNota: Este es un documento electrónico generado desde los Sistemas de Información de la ANLA. El original reposa en los \narchivos digitales de la Entidad\n\nResolución No. 000042       Del 15 ENE. 2024          Hoja No. 14 de 14\n“Por el cual se resuelve un recurso de reposición interpuesto contra la Resolución 01771 del \n14 de agosto de 2023”\nPágina 14 de 14\n"
}