{
  "fuente": "ANLA_GACETA",
  "numero_resolución": "RESOLUCIÓN N° 00359",
  "fecha_resolución": "2023-02-28",
  "nombre_proyecto": "proyecto denominado “Construcción del Oleoducto Castilla -",
  "ubicación": "departamento del Meta.",
  "empresa": "por medio de la cual se declara la cesación del procedimiento sancionatorio ambiental iniciado en contra de la sociedad CENIT TRANSPORTE Y LOGISTICA DE HIDROCARBUROS S.A.",
  "numero_expediente": "SAN0094-00-2016",
  "radicados": [
    "2014053250",
    "2014068168",
    "2015016595",
    "2015016596",
    "2015017514",
    "2015018414",
    "2015021261",
    "2015024446",
    "2015037678",
    "2015051041",
    "2015053796",
    "2015056024",
    "2015056450",
    "2015063281",
    "2016002793",
    "2016030296",
    "2022044624",
    "2022136613",
    "2022180941",
    "2022282017",
    "2022293450"
  ],
  "descripcion": "POR LA CUAL SE RESUELVE EL RECURSO DE REPOSICIÓN INTERPUESTO CONTRA LA RESOLUCIÓN No. 01192 DEL 07 DE JUNIO DE 2022 Y SE ADOPTAN OTRAS DETERMINACIONES",
  "tipos_infraccion": [
    "Vertimientos",
    "Manejo de aguas",
    "Tala o afectación de bosques",
    "Incumplimiento del PMA"
  ],
  "pdf_id": "41712",
  "file_name": "ANLA_41712.pdf",
  "texto_completo": "|\nRepública de Colombia\nMinisterio de Ambiente y Desarrollo Sostenible\nAUTORIDAD NACIONAL DE LICENCIAS AMBIENTALES \n- ANLA –\nRESOLUCIÓN N°  00359\n( 28 de febrero de 2023 )\nOficinas: Carrera 13 A No. 34 – 72 Edificio 13 35 Pisos 8 Bogotá, D.C.\nCentro de Orientación y Radicación de Correspondencia: Carrera 13 A No. 34 – 72 Edificio 13 35 \nLocales 110 al 112 Bogotá, D.C.  \nCódigo Postal 110311156\nNit.: 900.467.239-2\nLínea de Orientación y Contacto Ciudadano: 57 (1) 2540100 / 018000112998 PBX: 57 (1) 2540111\nwww.anla.gov.co    Email: licencias@anla.gov.co  \nPágina 1 de 42\n“POR LA CUAL SE RESUELVE EL RECURSO DE REPOSICIÓN INTERPUESTO \nCONTRA LA RESOLUCIÓN No. 01192 DEL 07 DE JUNIO DE 2022 Y SE \nADOPTAN OTRAS DETERMINACIONES”\nEL JEFE DE LA OFICINA ASESORA JURÍDICA DE LA AUTORIDAD\nNACIONAL DE LICENCIAS AMBIENTALES-ANLA-.\nEn uso de las facultades legales establecidas en las Leyes 99 de 1993 y 1333 de \n2009, las conferidas por el Decreto-Ley 3573 de 2011, el Decreto 376 de 2020, la \nResolución No. 02795 del 25 de noviembre de 2022, y considerando:\nI. Asunto a decidir\nDentro del procedimiento administrativo sancionatorio ambiental adelantado bajo el \nexpediente SAN0094-00-2016, se procede a resolver el recurso de reposición \ninterpuesto por el señor Miguel Ángel Cruz Romero, contra la Resolución  No.01192 \ndel 07 de junio de 2022 por medio de la cual se declara la cesación del \nprocedimiento sancionatorio ambiental iniciado en contra de la sociedad CENIT \nTRANSPORTE Y LOGISTICA DE HIDROCARBUROS S.A.S, con Nit.900.531.210 \n– 3, relacionado con el proyecto denominado “Construcción del Oleoducto Castilla - \nApiay”,  localizado en jurisdicción de los  municipios de Castilla La Nueva, Acacías \ny Villavicencio, en el departamento del Meta.\nII. Competencia\nLa ANLA es competente para iniciar, adelantar y culminar el procedimiento de \ninvestigación, preventivo y sancionatorio en materia ambiental, teniendo en cuenta \nque es la autoridad facultada para otorgar y efectuar seguimiento al instrumento \nambiental del presente proyecto.\nDicha facultad le fue transferida del Ministerio de Ambiente y Desarrollo Sostenible \n- MADS, de acuerdo con la desconcentración administrativa prevista en los \nnumerales 1°, 2° y 7° del artículo tercero del Decreto 3573 de 2011, en concordancia \ncon lo previsto en el artículo 2 de la Ley 1333 de 2009.\nDe esta manera, el numeral 7 del mismo artículo 3 citado asignó a la ANLA la función \nde “Adelantar y culminar el procedimiento de investigación, preventivo y \nsancionatorio en materia ambiental de acuerdo con lo dispuesto en la Ley 1333 de \n2009 o la norma que la modifique o sustituya\".\n\nResolución No.  00359           Del   28 de febrero de 2023            Hoja No. 2 de 42\n“POR LA CUAL SE RESUELVE EL RECURSO DE REPOSICIÓN INTERPUESTO \nCONTRA LA RESOLUCIÓN No. 01192 DEL 07 DE JUNIO DE 2022 Y SE ADOPTAN \nOTRAS DETERMINACIONES”\nOficinas: Carrera 13 A No. 34 – 72 Edificio 13 35 Pisos 8 Bogotá, D.C.\nCentro de Orientación y Radicación de Correspondencia: Carrera 13 A No. 34 – 72 Edificio 13 35 \nLocales 110 al 112 Bogotá, D.C.  \nCódigo Postal 110311156\nNit.: 900.467.239-2\nLínea de Orientación y Contacto Ciudadano: 57 (1) 2540100 / 018000112998 PBX: 57 (1) 2540111\nwww.anla.gov.co    Email: licencias@anla.gov.co  \nPágina 2 de 42\nAunado a lo anterior, se destaca que la Dirección General de la Autoridad Nacional \nde Licencias Ambientales-ANLA-, mediante el literal b., numeral 2 del artículo \nsegundo de la Resolución No. 02795 del 25 de noviembre de 2022, delegó en  el  \nJefe de la Oficina Asesora Jurídica ,  la siguiente función:\n“(…)\n2. En relación con el procedimiento ambiental sancionatorio de que trata la Ley 1333 de \n2009 o la que la modifique o sustituya, suscribir los siguientes actos administrativos:\n(…)\nb. Los que ordenan la cesación del procedimiento sancionatorio ambiental.\n(…)”\nPor su parte, el numeral 1 del artículo 74 de la Ley 1437 de 2011 -Código de \nProcedimiento Administrativo y de lo Contencioso Administrativo- establece como \nregla general, que el recurso de reposición procede ante quien expidió la decisión \npara que la aclare, modifique, adicione o revoque. \nIII.Antecedentes Relevantes y Actuación Administrativa\n1. A través de la Resolución No. 0517 del 11 de mayo de 2004, el entonces \nMinisterio de Ambiente, Vivienda y Desarrollo Territorial- MAVDT-, hoy Ministerio \nde Ambiente y Desarrollo Sostenible, -MADS-, otorgó Licencia Ambiental a la \nEMPRESA COLOMBIANA DE PETRÓLEOS - ECOPETROL S.A, para el \nProyecto “Construcción del Oleoducto Castilla - Apiay”, localizado en jurisdicción \nde los municipios de Castilla La Nueva, Acacías y Villavicencio, en el \nDepartamento del Meta (Expediente LAM2947).\n2. Posteriormente, la Autoridad Nacional de Licencias Ambientales, en adelante la \nANLA, mediante Resolución No. 0203 del 29 de marzo de 2012 determinó entre \notros aspectos, aclarar el literal a), numeral 1, artículo segundo de la Resolución \nNo. 517 del 11 de mayo de 2004 y modificar el artículo primero del citado acto \nadministrativo, en el sentido de adicionar una nueva línea de transporte de crudo \nde 30\" de diámetro a partir de la estación de bombeo Castilla 2.\n3. Luego, en Resolución No. 852 del 09 de octubre de 2012, la ANLA resolvió el \nrecurso de reposición interpuesto en contra de la Resolución No. 203 del 29 de \nmarzo de 2012, en el sentido de confirmar en todas sus partes el acto \nadministrativo recurrido. \n4. Mediante la Resolución No.0374 del 11 de abril de 2014, la ANLA autorizó la \ncesión total de los derechos y obligaciones originados y derivados de la Licencia \nAmbiental otorgada mediante Resolución No. 517 del 11 de mayo de 2004 (sus \nmodificaciones y aclaraciones) para el Oleoducto Castilla - Apiay, a favor de la \nsociedad CENIT TRANSPORTE Y LOGÍSTICA DE HIDROCARBUROS S.A.S.\n5. Mediante Resolución No. 0867 del 30 de julio de 2014, esta Autoridad modificó \nel artículo segundo de la Resolución No. 0203 del 29 de marzo de 2012 \n(modificatoria de la Resolución No. 0517 del 11 de mayo de 2004) en el sentido \nde reemplazar la tabla (Georreferenciación de realineamientos y justificación con \nrespecto al oleoducto Castilla - Apiay existente (16 pulgadas) y adicionar \n\nResolución No.  00359           Del   28 de febrero de 2023            Hoja No. 3 de 42\n“POR LA CUAL SE RESUELVE EL RECURSO DE REPOSICIÓN INTERPUESTO \nCONTRA LA RESOLUCIÓN No. 01192 DEL 07 DE JUNIO DE 2022 Y SE ADOPTAN \nOTRAS DETERMINACIONES”\nOficinas: Carrera 13 A No. 34 – 72 Edificio 13 35 Pisos 8 Bogotá, D.C.\nCentro de Orientación y Radicación de Correspondencia: Carrera 13 A No. 34 – 72 Edificio 13 35 \nLocales 110 al 112 Bogotá, D.C.  \nCódigo Postal 110311156\nNit.: 900.467.239-2\nLínea de Orientación y Contacto Ciudadano: 57 (1) 2540100 / 018000112998 PBX: 57 (1) 2540111\nwww.anla.gov.co    Email: licencias@anla.gov.co  \nPágina 3 de 42\nrealineamientos para la Estación Apiay y el Sector Caño Quenane, entre otros \naspectos.\n6. Mediante radicado 2014053250-1-000 del 01 de octubre de 2014, el señor \nGonzalo Cruz Romero, en su condición de tercero interviniente en el trámite de \nmodificación de la Licencia Ambiental, remitió a esta Autoridad copia de la \ncomunicación dirigida a ECOPETROL S.A.,  invocando el principio de precaución \ny el derecho fundamental de protección del recurso hídrico, mediante la cual \nalertó sobre un eventual daño en el Caño Los Hornos con ocasión del trazado del \noleoducto de 30” autorizado mediante la Resolución No. 0203 del 29 de marzo \nde 2012.\n7. En atención prenombrado radicado, la ANLA  a través del oficio con radicación \n4120-E2-64958 del 21 de noviembre de 2014, informó al señor Gonzalo Cruz \nRomero que se realizaría  visita de seguimiento para verificar el estado actual de \nla quebrada Los Hornos y sus afluentes con el fin de conceptuar al respecto y si \nes el caso adoptar las medidas a que haya lugar, informando además que   “(…) \nse va a solicitar a la empresa CENIT – Transporte y Logística de Hidrocarburos \n(…), informe a esta Autoridad las medidas de manejo ambiental que ha \nimplementado o que va implementar la Empresa en el cruce sobre el Caño Los \nHornos (…)”,  donde se tenga en cuenta la observación presentada  mediante \nradicado 2014053250-1-000 del 01 de octubre de 2014.\n8. Mediante radicado 4120-E2-64956 del 21 de noviembre de 2014, la ANLA solicitó \na la sociedad CENIT TRANSPORTE Y LOGISTICA DE HIDROCARBUROS \nS.A.S. informar sobre las medidas de manejo ambiental implementadas y a \nimplementar en el cruce sobre el Caño Los Hornos, teniendo en cuenta la \nobservación remitida por el señor Gonzalo Cruz Romero.\n9. Luego, a través de radicado 2014068168-1-000 del 09 de diciembre de 2014, la \nsociedad CENIT TRANSPORTE Y LOGISTICA DE HIDROCARBUROS S.A.S. \nbrindó respuesta al oficio 4120-E2-64956 del 21 de noviembre de 2014 \nrelacionando las medidas de manejo ambiental que serán implementadas en el \ncruce a cielo abierto del Caño Los Hornos, localizado en la vereda Quebraditas, \nmunicipio de Acacías. Así mismo, aclara que, a la fecha de la comunicación, las \nobras tendientes a la construcción del proyecto no han dado inicio.\n10. El señor Miguel Ángel Cruz Romero identificado con C.C. 3.296.513 y el señor \nHernando Cruz Romero identificado con C.C. 3.294.350, mediante radicado \n2015016595-1-000 del 25 de marzo de 2015, remiten queja informando de un \nposible delito y daño ambiental a causa de “a causa de “(…) la ocupación, \nintervención, perturbación de la estructura física del lecho natural del Humedal \ncaño Hornos, Zona de Nacimientos de agua de la Recarga Hídrica de la \nSubcuenca del Río Guayuriba (…)”.\n11. A través de radicado 2015016596-1-000 del 25 de marzo de 2015, el señor \nMiguel Ángel Cruz Romero y el señor Hernando Cruz Romero, remiten copia de \nla petición radicada ante el Ministerio de Ambiente y Desarrollo Sostenible de \naplicación del “(…)  PRINCIPIO DE PRECAUCIÓN, PROTECCIÓN AL \nHUMEDAL CAÑO HORNOS, ZONA DE RECARGA HÍDRICA DE LA \nSUBCUENCA DEL RÍO GUAYURIBA (…)”.\n\nResolución No.  00359           Del   28 de febrero de 2023            Hoja No. 4 de 42\n“POR LA CUAL SE RESUELVE EL RECURSO DE REPOSICIÓN INTERPUESTO \nCONTRA LA RESOLUCIÓN No. 01192 DEL 07 DE JUNIO DE 2022 Y SE ADOPTAN \nOTRAS DETERMINACIONES”\nOficinas: Carrera 13 A No. 34 – 72 Edificio 13 35 Pisos 8 Bogotá, D.C.\nCentro de Orientación y Radicación de Correspondencia: Carrera 13 A No. 34 – 72 Edificio 13 35 \nLocales 110 al 112 Bogotá, D.C.  \nCódigo Postal 110311156\nNit.: 900.467.239-2\nLínea de Orientación y Contacto Ciudadano: 57 (1) 2540100 / 018000112998 PBX: 57 (1) 2540111\nwww.anla.gov.co    Email: licencias@anla.gov.co  \nPágina 4 de 42\n12. En radicado 2015017514-1-000 del 30 de marzo de 2015, la Procuraduría 6 \nJudicial II Agraria y Ambiental del Meta –Vaupés y Vichada dio traslado a la ANLA \nde las solicitudes realizadas por los señores Miguel Ángel Cruz Romero y \nHernando Cruz Romero, solicitando dar respuesta a los ciudadanos, “(…) donde \nse fundamente con claridad la procedencia o no de la aplicación del principio de \nprecaución, o el hecho que se determine que entrará a estudio la respectiva \nsolicitud, enviando copia de las actuaciones correspondientes”.\n13. La ANLA, mediante oficio con radicado 2015016595-2-001 del 13 de abril de \n2015, remitió repuesta a las comunicaciones 2015016595-1-000 y 2015016596-\n1-000 del  25 de marzo de 2015, informando a los señores Miguel Ángel Cruz \nRomero y Hernando Cruz Romero que por medio de radicado 2014068168-1-000 \ndel 09 de diciembre de 2014, la sociedad CENIT TRANSPORTE Y LOGISTICA \nDE HIDROCARBUROS S.A.S. explicó las medidas de manejo ambiental a \nimplementar durante la construcción del cruce a cielo abierto en el Caño Los \nHornos, la cual se manifestó que no se había iniciado aún. \nAsí mismo, se les indicó que de acuerdo con la información obrante en el \nexpediente no se evidenció incumplimiento de las obligaciones emanadas de la \nLicencia Ambiental ni la existencia de daño o riesgo al ambiente. Por lo anterior, \nse concluyó que no aplica el Principio de Precaución pero que, en todo caso, se \nharía el correspondiente seguimiento ambiental para verificar los hechos.  \n14. A través de oficio con radicado 2015018414-2-001 del 21 de abril de 2015, la \nANLA informó al MADS que mediante radicado 2015016595-2-001 del 13 de abril \nde 2015, se brindó respuesta a las comunicaciones de los señores Cruz Romero.\n15. En radicado 2015021261-1-000 del 22 de abril de 2015, la Procuraduría \nDelegada para Asuntos Ambientales y Agrarios solicitó información a la ANLA \nrespecto a una denuncia motivada por los presuntos daños ambientales sobre \nlos humedales caños Hornos y Mitú, ubicados en la vereda Quebraditas del \nmunicipio de Acacías - Meta, la construcción del oleoducto San Fernando – \nMonterrey y el vertimiento de la estación Acacías sobre el río Guayuriba.\n16. La ANLA, mediante oficio con radicado 2015017514-2-001 del 24 de abril de \n2015, atendió el oficio 2015017514-1-000 del 30 de marzo de 2015, presentado \npor la Procuraduría 6 Judicial II Agraria y Ambiental del Meta –Vaupés y Vichada \nindicando que se brindó respuesta a los señores Cruz Romero, mediante oficio \n2015016595-2-001 del 13 de abril de 2015.\n17. Por medio del radicado 2015021261-2-001 del 04 de mayo de 2015, en respuesta \nal radicado 2015021261-1-000 del 22 de abril de 2015 allegado por la \nProcuraduría Delegada para Asuntos Ambientales y Agrarios, la ANLA informó \nque mediante radicado 2015016595-2-001 del 13 de abril de 2015 dio respuesta \na las comunicaciones 2015016595-1-000 y 2015016596-1-000 del 25 de marzo \nde 2015, señalando que no se evidenciaron afectaciones sobre caño Los Hornos \ny Mitú.  \n18. La sociedad CENIT TRANSPORTE Y LOGISTICA DE HIDROCARBUROS \nS.A.S., a través del radicado 2015024446-1-000 del 11 de mayo de 2015, \npresentó el ICA No. 1 del proyecto “Sistema de Transporte de Hidrocarburos \nOleoducto Castilla – Apiay de 30 pulgadas”, reportando las actividades del \nperiodo comprendido entre el 01 de diciembre de 2014 y el 28 de febrero de 2015.\n\nResolución No.  00359           Del   28 de febrero de 2023            Hoja No. 5 de 42\n“POR LA CUAL SE RESUELVE EL RECURSO DE REPOSICIÓN INTERPUESTO \nCONTRA LA RESOLUCIÓN No. 01192 DEL 07 DE JUNIO DE 2022 Y SE ADOPTAN \nOTRAS DETERMINACIONES”\nOficinas: Carrera 13 A No. 34 – 72 Edificio 13 35 Pisos 8 Bogotá, D.C.\nCentro de Orientación y Radicación de Correspondencia: Carrera 13 A No. 34 – 72 Edificio 13 35 \nLocales 110 al 112 Bogotá, D.C.  \nCódigo Postal 110311156\nNit.: 900.467.239-2\nLínea de Orientación y Contacto Ciudadano: 57 (1) 2540100 / 018000112998 PBX: 57 (1) 2540111\nwww.anla.gov.co    Email: licencias@anla.gov.co  \nPágina 5 de 42\n19. Luego, mediante radicado 2015037678-1-000 del 16 de julio de 2015, la precitada \nsociedad presentó el ICA No. 2 (marzo-mayo 2015) del proyecto “Sistema de \nTransporte de Hidrocarburos Oleoducto Castilla – Apiay de 30 pulgadas”.\n20. La Procuraduría Delegada para Asuntos Ambientales y Agrarios, por medio del \nradicado 2015051041-1-000 del 25 de septiembre de 2015, solicitó a la ANLA el \nacompañamiento a visita de seguimiento a denuncia presentada por presuntos \ndaños ambientales ocasionados sobre los caños Hornos y Mitú.\n21. Por medio del radicado 2015053796-1-000 del 13 de octubre de 2015, la \nContraloría Departamental del Meta remitió por competencia a la ANLA, denuncia\nenviada por el señor Miguel Cruz Romero sobre posibles afectaciones \nambientales a los caños Hornos y Mitú.\n22. La sociedad CENIT TRANSPORTE Y LOGISTICA DE HIDROCARBUROS \nS.A.S., en radicado 2015056024-1-000 del 23 de octubre de 2015, presentó el \nICA No. 3 del proyecto “Sistema de Transporte de Hidrocarburos Oleoducto \nCastilla – Apiay de 30 pulgadas”, reportando las actividades del periodo \ncomprendido entre el 01 de junio y el 31 de agosto de 2015.\n23. Mediante radicado 2015056450-1-000 del 26 de octubre de 2015, el señor Miguel \nÁngel Cruz Romero presentó información relacionada con presuntos daños \nambientales ocasionados por la construcción del oleoducto, línea 30”, sobre \nhumedales y cauce natural de los caños Hornos y Mitú. \n24. Por medio del radicado 2015053796-2-001 del 10 de noviembre de 2015, en \nrespuesta a la comunicación remitida bajo radicación 2015053796-1-000 del 13 \nde octubre de 2015, la ANLA informó al señor Miguel Ángel Cruz Romero sobre \nlas respuestas proferidas a la queja interpuesta por presunto daño ambiental y \nsobre la visita de inspección al predio Brisas – Cucharito de la vereda \nQuebraditas (municipio de Acacías – Meta), para verificar la denuncia \npresentada, visita de la cual se emanaría el pronunciamiento respectivo.\n25. Mediante radicado 2015063281-1-000 del 26 de noviembre de 2015, la \nProcuraduría Delegada para Asuntos Ambientales y Agrarios remitió a la ANLA \nel informe técnico 067-2014 titulado \"Presuntas afectaciones ambientales \nocasionadas a los Caños Hornos y Mitú, por la construcción del Oleoducto \nCastilla-Apiay II en el municipio de Acacias, Meta\", generado a partir de una visita \nefectuada el 21 de octubre de 2015 en compañía de personal de \nCORMACARENA y ECOPETROL S.A. en el sector por donde discurren los caños \nHornos y Mitú, vereda Quebraditas del municipio de Acacías – Meta. Se concluye \nen dicho informe que se han realizado “vertimientos no autorizados” sobre \ncuerpos de agua superficiales.\n26. La ANLA, a través del oficio con radicado 2015063281-2-001 del 22 de diciembre \nde 2015, atendió el prenombrado radicado 2015063281-1-000 del 26 de \nnoviembre de 2015 , indicando que mediante radicado 2015016595-2-001 del 13 \nde abril de 2015 dio respuesta a  los señores Miguel Ángel Cruz Romero y \nHernando Cruz Romero, aclarando que la actividad del cruce subfluvial a cielo \nabierto en el caño los Hornos fue autorizada una vez evaluados los impactos \nambientales asociados a esta actividad y sus respectivas medidas de manejo; y \nse precisó, además, que en atención a las recomendaciones recibidas en el \n\nResolución No.  00359           Del   28 de febrero de 2023            Hoja No. 6 de 42\n“POR LA CUAL SE RESUELVE EL RECURSO DE REPOSICIÓN INTERPUESTO \nCONTRA LA RESOLUCIÓN No. 01192 DEL 07 DE JUNIO DE 2022 Y SE ADOPTAN \nOTRAS DETERMINACIONES”\nOficinas: Carrera 13 A No. 34 – 72 Edificio 13 35 Pisos 8 Bogotá, D.C.\nCentro de Orientación y Radicación de Correspondencia: Carrera 13 A No. 34 – 72 Edificio 13 35 \nLocales 110 al 112 Bogotá, D.C.  \nCódigo Postal 110311156\nNit.: 900.467.239-2\nLínea de Orientación y Contacto Ciudadano: 57 (1) 2540100 / 018000112998 PBX: 57 (1) 2540111\nwww.anla.gov.co    Email: licencias@anla.gov.co  \nPágina 6 de 42\ninforme técnico No. 67-2014 se realizará el seguimiento respectivo durante la \nvigencia 2016.\n27. Ulteriormente, mediante radicado 2016002793-1-000 del 22 de enero de 2016, la \nsociedad CENIT TRANSPORTE Y LOGISTICA DE HIDROCARBUROS S.A.S. \npresentó el ICA No. 4 del proyecto “Sistema de Transporte de Hidrocarburos \nOleoducto Castilla – Apiay de 30 pulgadas”, reportando las actividades del \nperiodo comprendido entre el 01 de septiembre y el 30 de noviembre de 2015.\n28. Mediante Auto No. 1306 del 12 de abril de 2016, la ANLA efectuó seguimiento y \ncontrol ambiental al proyecto a partir de la visita realizada el 21 de octubre de \n2015, cuyos resultados se consignaron en el Concepto Técnico No. 1097 del 15 \nde marzo de 2016. Se requirió a la sociedad “(…) para que una vez ejecutoriado \nel presente acto administrativo implemente y adecúe sistemas para el control de \nsedimentos y arrastre por efectos de escorrentía, en los tramos donde se \ndesarrollan las actividades de zanjado, para la instalación de la tubería del \noleoducto de 30\", de acuerdo con la ficha 7. Manejo de Aguas de Escorrentía, \nnumeral 3.”\n29. En radicado 2016030296-1-000 del 14 de junio de 2016, la sociedad CENIT \nTRANSPORTE Y LOGISTICA DE HIDROCARBUROS S.A.S. brindó respuesta \nal requerimiento efectuado mediante Auto No. 1306 del 12 de abril de 2016.\n30. La ANLA, mediante Auto No. 04623 del 08 de agosto de 2018, el cual atendió  las \nconsideraciones expuestas en el Concepto Técnico No. 4867 del 23 de \nseptiembre de 2016 ordenó la apertura del procedimiento sancionatorio \nambiental en contra de la sociedad CENIT TRANSPORTE Y LOGISTICA DE \nHIDROCARBUROS S.A.S, actuación que se  desarrolla en el expediente \nSAN0094-00-2016.\nEl inicio del referido trámite se desató por la siguiente omisión presuntamente \nconstitutiva de infracción ambiental:\n“Por no haber garantizado que las medidas adoptadas en la Ficha de Manejo No. 7 \nManejo de Aguas de Escorrentía, fueran efectivas para lograr el control del impacto de \naporte de sedimentos y materiales en los Caños Hornos y Mitú en la vereda Quebraditas \ndel municipio de Acacias, Departamento del Meta, incurriendo con ello en presunta \ninfracción de lo establecido en el parágrafo del Artículo Décimo Primero de la Resolución \nNo. 203 del 29 de marzo de 2012.”\n31. El Auto No. 04623 del 08 de agosto de 2018 fue notificado a la sociedad CENIT \nTRANSPORTE Y LOGISTICA DE HIDROCARBUROS S.A.S. por medios \nelectrónicos el 13 de agosto de 2018.\n32. A su vez, el referido acto administrativo fue comunicado a la Superintendencia de \nSociedades, a la Agencia Nacional de Hidrocarburos y a la Procuraduría \ndelegada para Asuntos Ambientales y Agrarios mediante correos electrónicos \nenviados el 13 de septiembre de 2018.\n33. En cumplimiento a lo establecido en el artículo 70 de la Ley 99 de 1993, el Auto \nNo. 04623 del 08 de agosto de 2018, fue publicado en la Gaceta Oficial de la \nANLA.1\n1 https://ct.anla.gov.co/GACETA/Consultar-gaceta\n\nResolución No.  00359           Del   28 de febrero de 2023            Hoja No. 7 de 42\n“POR LA CUAL SE RESUELVE EL RECURSO DE REPOSICIÓN INTERPUESTO \nCONTRA LA RESOLUCIÓN No. 01192 DEL 07 DE JUNIO DE 2022 Y SE ADOPTAN \nOTRAS DETERMINACIONES”\nOficinas: Carrera 13 A No. 34 – 72 Edificio 13 35 Pisos 8 Bogotá, D.C.\nCentro de Orientación y Radicación de Correspondencia: Carrera 13 A No. 34 – 72 Edificio 13 35 \nLocales 110 al 112 Bogotá, D.C.  \nCódigo Postal 110311156\nNit.: 900.467.239-2\nLínea de Orientación y Contacto Ciudadano: 57 (1) 2540100 / 018000112998 PBX: 57 (1) 2540111\nwww.anla.gov.co    Email: licencias@anla.gov.co  \nPágina 7 de 42\n34. Mediante radicado 2022044624-1-000 del 10 de marzo de 2022, la sociedad \nCENIT TRANSPORTE Y LOGISTICA DE HIDROCARBUROS S.A.S. presentó \nsolicitud de cesación del procedimiento sancionatorio ambiental.\n35. Mediante la Resolución No. 01192 del 07 de junio de 2022, la ANLA declaró la \ncesación del procedimiento sancionatorio ambiental iniciado a través del Auto No. \n04623 del 08 de agosto de 2018 en contra de la sociedad CENIT TRANSPORTE \nY LOGISTICA DE HIDROCARBUROS S.A.S. \n36. El referido acto administrativo fue notificado el 08 de junio de 2022 a la sociedad \ninvestigada mediante correo electrónico; al señor Gonzalo Cruz Romero, \nmediante aviso del 22 de junio de 2022; al señor Miguel Ángel Cruz Romero, \nmediante correo electrónico del 16 de junio de 2022; y al señor Hernando Cruz \nRomero mediante aviso del 21 de junio de 2022.\n37. Aunado a lo anterior, la Resolución No.01192 del 07 de junio de 2022 fue \ncomunicada a la Agencia Nacional de Hidrocarburos, a la Procuraduría Delegada \npara Asuntos Ambientales y Agrarios y a la Superintendencia de Sociedades \nmediante correos electrónicos del 13 de junio de 2022.\n38. La referida resolución fue publicada en la Gaceta Ambiental de la ANLA, el 07 de \njulio de 2022, en cumplimiento a lo determinado en el artículo 71 de la Ley 99 de \n1993. \n39. Mediante radicado 2022136613-1-000 del 05 de julio de 2022, el señor Miguel \nÁngel Cruz Romero, interpuso recurso de reposición y en subsidio apelación en \ncontra de la Resolución No. 01192 del 7 de junio de 2022.\n40. A través de la Resolución No. 01711 del 08 de agosto de 2022, la ANLA resolvió \nrechazar por improcedente el recurso interpuesto en contra de la Resolución No. \n01192 del 07 de junio de 2022, presuntamente por la extemporaneidad en la \npresentación del medio de impugnación propuesto.  \n41. La Resolución No. 01711 del 08 de agosto de 2022, fue notificada la sociedad \nCENIT TRANSPORTE Y LOGISTICA DE HIDROCARBUROS S.A.S y al señor \nMiguel Ángel Cruz Romero mediante correo electrónico del 09 de agosto de 2022; \ny a los señores Gonzalo Cruz Romero y Hernando Cruz Romero mediante aviso \nenviado por correo electrónico del 18 de agosto de 2022. \n42. Así mismo, la referida Resolución fue comunicada a la Agencia Nacional de \nHidrocarburos, la Procuraduría delegada para Asuntos Ambientales y Agrarios y \na la Superintendencia de Sociedades mediante correo electrónico del 09 de \nagosto de 2022.\n43. Con ocasión de la solicitud elevada por el señor Miguel Ángel Cruz Romero, la \nProcuraduría 6 Judicial II Ambiental y Agraria del Meta – Vichada y Guaviare, \nmediante radicado 2022180941-1-000 del 23 de agosto del 2022, dio traslado de \nla información referida, con el objeto de que se le dé el trámite correspondiente, \nde igual manera, solicitó dar respuesta directa al peticionario respecto de las \nobservaciones y requisiciones que anuncia no han sido atendidas por parte de la \nAutoridad Ambiental.\n\nResolución No.  00359           Del   28 de febrero de 2023            Hoja No. 8 de 42\n“POR LA CUAL SE RESUELVE EL RECURSO DE REPOSICIÓN INTERPUESTO \nCONTRA LA RESOLUCIÓN No. 01192 DEL 07 DE JUNIO DE 2022 Y SE ADOPTAN \nOTRAS DETERMINACIONES”\nOficinas: Carrera 13 A No. 34 – 72 Edificio 13 35 Pisos 8 Bogotá, D.C.\nCentro de Orientación y Radicación de Correspondencia: Carrera 13 A No. 34 – 72 Edificio 13 35 \nLocales 110 al 112 Bogotá, D.C.  \nCódigo Postal 110311156\nNit.: 900.467.239-2\nLínea de Orientación y Contacto Ciudadano: 57 (1) 2540100 / 018000112998 PBX: 57 (1) 2540111\nwww.anla.gov.co    Email: licencias@anla.gov.co  \nPágina 8 de 42\n44. Ulteriormente a ANLA través de la Resolución No.  01896  del  06 de septiembre \nde 2022 , ordenó dejar sin efectos la Resolución No. 01711 del 08 de agosto de \n2022  y adicionalmente ordenó la preparación del acto administrativo que emita  \n“(…) un pronunciamiento respecto del recurso de reposición presentado en \ncontra de la Resolución 1192 del 7 de junio de 2022, por los señores Miguel Ángel \nCruz Romero, Gonzalo Cruz Romero y Hernando Cruz Romero, mediante \nradicado ANLA 2022136613-1-000 del 5 de julio de 2022.”\n45. La Resolución No. 01896 del 06 de septiembre de 2022 fue notificada a la \nsociedad investigada mediante correo electrónico del 07 de septiembre de 2022, \ny comunicada a los señores Miguel Ángel Cruz Romero y Hernando Cruz Romero \nel 09 de septiembre de 2022 y al señor  Gonzalo Cruz Romero el 15 de \nseptiembre de 2022 .\n46. Aunado a lo anterior, la referida resolución fue comunicada a la Agencia Nacional \nde Hidrocarburos, a la Procuraduría Delegada para Asuntos Ambientales y \nAgrarios y a la Superintendencia de Sociedades mediante correos electrónicos \ndel 09 de septiembre de 2022.  \n47. En atención a lo decidido en la Resolución No. 01896  del  06 de septiembre de \n2022 y con el fin de analizar técnicamente el recurso de reposición presentado a \ntravés del radicado 2022136613-1-000 del 05 de julio de 2022 , el equipo técnico \ndel Grupo de Actuaciones Sancionatorias Ambientales adscrito a la Oficina \nAsesora Jurídica,  emitió el Concepto Técnico No. 06882 del 08 de noviembre de \n2022, el cual servirá de fundamento para la motivación de la presente decisión. \n48. Por último, se destaca que mediante radicado 2022282017-1-000 del 15 de \ndiciembre de 2022, el señor Miguel Ángel Cruz Romero , solicitó a la ANLA  que \nindicara si se había emitido pronunciamiento relacionado con el recurso de \ninterpuesto contra la Resolución No. 01192 del 07 de junio de 2022.\nDicha  petición que fue atendida por esta Autoridad Ambiental a través del oficio \ncon radicado  2022293450-2-000 del 27 de diciembre de 2022,  en el cual entre \notros puntos, se precisó lo siguiente: “(…)la Autoridad Nacional de Licencias \nAmbientales, en ejercicio de su competencia y conforme a los procedimientos \nseñalados la Ley 1333 de 2009 y en armonía con la Ley 1437 de 2011, emitirá el \npronunciamiento administrativo de acuerdo con el material probatorio, y una vez \nemitido el acto administrativo, se notificará y comunicará a quien \ncorresponda(…)”\n  \nIV. Recurso de Reposición\nEn el marco del procedimiento sancionatorio ambiental, el artículo 30 de la Ley 1333 \nde 2009 establece que cuando no haya superior jerárquico, contra el acto \nadministrativo que pone fin a una investigación sancionatoria ambiental, procede el \nrecurso de reposición en los términos y condiciones señalados en el Código \nContencioso Administrativo2.\nMediante radicado 2022136613-1-000 del 05 de julio de 2022, el señor Miguel Ángel \nCruz Romero, en calidad de interviniente, interpuso recurso de reposición y en \nsubsidio apelación en contra de la Resolución No. 01192 del 07 de junio de 2022.\n2 Hoy Código de Procedimiento Administrativo y de lo Contencioso Administrativo. Ley 1437 de 2011.\n\nResolución No.  00359           Del   28 de febrero de 2023            Hoja No. 9 de 42\n“POR LA CUAL SE RESUELVE EL RECURSO DE REPOSICIÓN INTERPUESTO \nCONTRA LA RESOLUCIÓN No. 01192 DEL 07 DE JUNIO DE 2022 Y SE ADOPTAN \nOTRAS DETERMINACIONES”\nOficinas: Carrera 13 A No. 34 – 72 Edificio 13 35 Pisos 8 Bogotá, D.C.\nCentro de Orientación y Radicación de Correspondencia: Carrera 13 A No. 34 – 72 Edificio 13 35 \nLocales 110 al 112 Bogotá, D.C.  \nCódigo Postal 110311156\nNit.: 900.467.239-2\nLínea de Orientación y Contacto Ciudadano: 57 (1) 2540100 / 018000112998 PBX: 57 (1) 2540111\nwww.anla.gov.co    Email: licencias@anla.gov.co  \nPágina 9 de 42\nEn ese sentido y conforme a lo expuesto en la Resolución No. 01896 del 06 de \nseptiembre de 2022, se tiene que la decisión controvertida fue notificada al señor \nMiguel Ángel Cruz Romero el día 16 de junio de 2022, discurriendo el término para \nla interposición del recurso entre el 17 de junio y el 05 de julio de 2022, lo cual \nconlleva a concluir que el medio de impugnación propuesto fue presentado dentro \ndel término legal establecido en el artículo 30 de la Ley 1333 de 2009.\nSuperado lo anterior, se procederá a analizar los argumentos expuestos dentro del \nrecurso, para lo cual se señalarán los apartes pertinentes del escrito presentado y \nposteriormente, esta Autoridad Nacional efectuará las consideraciones que \ncorrespondan frente a ellos.\nAsí las cosas, el escrito contentivo del recurso allegado mediante radicado \n2022136613-1-000 del 05 de julio de 2022, se presentó en los siguientes términos:\n“(…)\nEl suscrito, junto con el Dr. GONZALO CRUZ ROMERO, el lng. HERNANDO CRUZ \nROMERO presentamos APLICACIÓN DEL PRINCIPIO DE PRECAUCIÓN, para \nque se protegieran los Humedales Hornos-Mitú, ubicados en los predios: Las Brisas-\nCucharita, en la Vereda: Quebraditas, Municipio de Acacias-Meta, propiedad de \nCoganagri Ltda. en Liq. Nit.: 800066563-0, con ocasión a la Resolución 0519 del 11 \nde Mayo de 2004 para la construcción del oleoducto Estación Castilla-Apiay I, de \n16\", por el trazado definido de éste y en la construcción del oleoducto Estación \nCastilla-Apiay II de 30”. Acorde a las siguientes inquietudes de orden ambiental:\n1. DEL PRINCIPIO DE PRECAUCIÓN\n(…)\nCuando invocamos el Principio de Precaución para que se Aplicara en Protección \nas (Sic) los Humedales Hornos-Mitú ubicados en los predios: Las Brisas-Cucharita, \nen la Vereda: Quebraditas, Municipio de Acacias-Meta, propiedad de Coganagri \nLtda en Liq,  es porque existía un inminente riesgo que fue sustentado en el avance \nde la actuación con  evidencias científicas de que ese proceso de línea de \nconducción presentaban riesgos potenciales al medio ambiente,  púes de las \nResoluciones: 0517 del 11 de Mayo de 2004, que autoriza la construcción del \noleoducto Estación  Castilla-Apiay I, de '16\", por el trazado definido de éste. \"El \ntrazado compartirá el derecho de vía de las líneas de transferencia de energía \neléctrica a lo largo de 31.3 km hasta mediaciones de Pompeya 1, desde donde \ncontinuará por un nuevo derecho de vía a lo largo de 4.2 km hasta encontrar el \noleoducto Chichimene- Apiay para compartir su derecho de vía durante el tramo final \nde 7.7 km hasta la estación de bombeo Apiay\".\nEsta Resolución 0517 de 2004, no autoriza servidumbre por los predios: Las Brisas- \nCucharita, ubicados en la Vereda: Quebraditas, Municipio de Acacias-Meta, \npropiedad de Coganagri Ltda. en Liq. Nit.: 800066563-0 y\nLa Resolución No. 0157 del 12 de Febrero de 2004, también del MAVDT, \"por la \ncual se reglamentan el uso sostenible, conservación y manejo de los humedales, y \nse desarrollan aspectos referidos a los mismos en aplicación de la Convención de \nRamsar. Artículo. 1° y 3°, La Ley 99 de 1993 Art. 1. Nos: 1-2-3-4-6-7-8-9-12, Artículo. \n1. Principios Generales Ambientales. Numeral:1. El proceso de desarrollo \neconómico y social del país. se orientará según los Principios Universales y del \n\nResolución No.  00359           Del   28 de febrero de 2023            Hoja No. 10 de 42\n“POR LA CUAL SE RESUELVE EL RECURSO DE REPOSICIÓN INTERPUESTO \nCONTRA LA RESOLUCIÓN No. 01192 DEL 07 DE JUNIO DE 2022 Y SE ADOPTAN \nOTRAS DETERMINACIONES”\nOficinas: Carrera 13 A No. 34 – 72 Edificio 13 35 Pisos 8 Bogotá, D.C.\nCentro de Orientación y Radicación de Correspondencia: Carrera 13 A No. 34 – 72 Edificio 13 35 \nLocales 110 al 112 Bogotá, D.C.  \nCódigo Postal 110311156\nNit.: 900.467.239-2\nLínea de Orientación y Contacto Ciudadano: 57 (1) 2540100 / 018000112998 PBX: 57 (1) 2540111\nwww.anla.gov.co    Email: licencias@anla.gov.co  \nPágina 10 de 42\ndesarrollo sostenibles contenidos en la Declaración de Río de Janeiro de Junio de \n1992 sobre Medio Ambiente y Desarrollo.\"\nEcopetrol S.A., en la construcción del oleoducto Estación Castilla-Apiay II de 30\" \nIncumple la Resolución 0517 del 11 de Mayo de 2004 del MAVDT, en los \nARTÍCULOS: SEGUNDO - DÉCIMO PRIMERO Y DÉCIMO SEPTIMO; La \nResolución 0157 del MAVDT del 12 de Febrero de 2004 del MAVDT,\" Que \nreglamenta el uso sostenible, conservación y manejo de los Humedales en \nAplicación a la Convención de Ramsar: ARTÍCULO.: 1° - 3°, Incumple a la Aplicación \ndel Principio de Precaución establecido en el Artículo 1. Numeral 6 de la Ley 99 de \n1993, igualmente Incumple a La Constitucionalización en el Convenio Ramsar y El \nAcuerdo de Río de Janeiro de 1992, firmados por el Gobierno Nacional,\n“ La Corte Constitucional, como corporación encargada de velar por la integridad y \nla supremacía de la Constitución, establece a través de sus fallos las reglas \njurisprudenciales sobre el alcance de las normas contenidas en la Constitución \nPolítica, A través de sus pronunciamientos el Máximo Tribunal Constitucional, \ndesarrolla líneas jurisprudenciales que van sentando precedentes, los cuales a su \nvez constituyen la base de las decisiones judiciales.\nPor lo tanto, el precedente a constituirse en la base de las decisiones judiciales, \nadquiere fuerza vinculante, convirtiéndose de esa manera en una herramienta \nnecesaria tanto para los operadores judiciales como para los operadores jurídicos.\nDentro de los distintos precedentes que ha sentado la Corte, se encuentran los \nrelacionados con el principio de precaución; el cual según la misma corte, aunque \ntiene un desarrollo normativo de orden legal, se encuentra constitucionalizado por \nla internacionalización de las relaciones ecológicas y los deberes de protección y \nprevención contenidos en la carta; esta constitucionalización se deriva del deber \nimpuesto a las autoridades de evitar daños y riesgos a la vida, a la salud y al medio \nambiente ( Sentencia C-703 de 2010 MP Gabriel Eduardo Mendoza Martelo)”. \nEcopetrol S.A., igualmente Incumple la Ley 99 de 1993 Art. 1° No.: 1-2-3-4-6-7-8-9-\n12 del Acuerdo de Río de Janeiro de 1992, Principio 15, Principio de Precaución, \nejecutando un ilegal desvío aproximado de 2 kilómetros + 570 metros de longitud, \npara construir el oleoducto Estación Castilla-Apiay II de 30\", como también lo hizo \ncon el oleoducto Estación Castilla-Apiay I de 16\" que violó el Principio de Precaución \ninvocado por Coganagri Ltda, construyendo estos citados proyectos en Áreas \nEstratégicas, de alta Sensibilidad Ambiental con Protección Especial por ser \nNacimientos de Agua ocasionando la pérdida total y absoluta del Humedal Mitú y su \nCaño del mismo nombre, Humedales: Hornos-Mitú, violando la Constitución \nNacional por Delito Ambiental, muerte Ambiental de estos Ecosistemas, en plena \népoca de invierno, fecha: Septiembre de 2015 en la etapa de construcción del \noleoducto Estación Castilla-Apiay de 30\", lo que se denunció ante la Procuraduría 6 \nJudicial II Agraria y Ambiental del Meta y demás Entes de Control Ambiental de la \nNación, por lo que Ecopetrol S.A., tiene el Deber Constitucional y Legal de \nResponder, ante los daños ocasionados.\nEl Dr. Gonzalo Cruz Romero actuando como: Tercero lnterviniente solicitó a La \nANLA, Aplicación del Principio de Precaución-Prevención-Protección a los \nHumedales: Hornos- Mitú, al Derecho Fundamental al Recurso Hídrico, sin \nactuación de La ANLA de solución adecuada al respecto. Como constancia se cita \nel No.: 6, Resolución 01192 de 07 de 2022.\n\"6. Mediante radicado 2014053250-1-000 del 1 de octubre de 2014, el señor \nGonzalo Cruz Romero, en su condición de tercero interviniente en el trámite de \nmodificación de la Licencia Ambiental, remitió a esta Autoridad copia de la \ncomunicación dirigida a ECOPETROL S.A. invocando el principio de precaución y \n\nResolución No.  00359           Del   28 de febrero de 2023            Hoja No. 11 de 42\n“POR LA CUAL SE RESUELVE EL RECURSO DE REPOSICIÓN INTERPUESTO \nCONTRA LA RESOLUCIÓN No. 01192 DEL 07 DE JUNIO DE 2022 Y SE ADOPTAN \nOTRAS DETERMINACIONES”\nOficinas: Carrera 13 A No. 34 – 72 Edificio 13 35 Pisos 8 Bogotá, D.C.\nCentro de Orientación y Radicación de Correspondencia: Carrera 13 A No. 34 – 72 Edificio 13 35 \nLocales 110 al 112 Bogotá, D.C.  \nCódigo Postal 110311156\nNit.: 900.467.239-2\nLínea de Orientación y Contacto Ciudadano: 57 (1) 2540100 / 018000112998 PBX: 57 (1) 2540111\nwww.anla.gov.co    Email: licencias@anla.gov.co  \nPágina 11 de 42\nel derecho fundamental de protección del recurso hídrico, mediante la cual alertó \nsobre un eventual daño en el Caño Los Hornos con ocasión del trazado del \noleoducto de 30\" autorizado mediante la Resolución 203 del 29 de marzo de 2012\".\n(…)\n\"11. Mediante radicado 2015016596-1-000 del25 de marzo de 2015, el señor \nMiguel Ángel Cruz Romero y el señor Hernando Cruz Romero, remiten copia de la \npetición radicada ante el Ministerio de Ambiente y Desarrollo Sostenible de  \naplicación del \"(...) PRINCIPIO DE PRECAUCIÓN, PROTECCIÓN AL HUMEDAL \nCAÑO HORNOS, ZONA DE RECARGA HÍDRICA DE LA E!UBCUENCA DEL RÍO \nGUAYURIBA (...)\".\n\"12. Mediante radicado 2015017514-1-000 del 30 de marzo de 2015, la \nProcuraduría 6 Judicial II Agraria y Ambiental del Meta -Vaupés y Vichada dio \ntraslado de las solicitudes realizadas por los señores Miguel Ángel Cruz Romero y \nHernando Cruz Romero, solicitando dar respuesta a los ciudadanos, \"(...) donde \nse fundamente con claridad la procedencia o no de la aplicación del principio de \nprecaución, o el hecho que se determine que entrará a estudio la respectiva \nsolicitud, enviando copia de las actuaciones correspondientes\".\nLa ANLA, Autoridad Nacional de Licencias Ambientales, no actúa para dar \nAplicación al Principio de Precaución, invocado por Coganagri Ltda. en Liq. a pesar \nde que Ecopetrol S.A., incumple las Resoluciones 0517 del 11 de Mayo de 2004, \nenlos ARTICULOS: SEGUNDO- DÉCIMO PRIMERO Y DÉCIMO SÉPTIMO de \nésta y Resolución 0157 del 12 de Febrero de 2004 de Protección a Humedales en \nAplicación de la Convención de Ramsar, Artículo 1° y 3°.\n“ARTÍCULO SEGUNDO.- La presente Licencia Ambiental comprende las \nsiguientes actividades:\n1. La construcción de un derecho de vía para el oleoducto en los siguientes \ntérminos:\nA. El tramo correspondiente a los primero 28 km tendrá un ancho de 15,40m \ndesde el eje axial de la línea eléctrica, compartiendo su derecho de vía\nB. El tramo restante compartirá el derecho de vía con el oleoducto existente \nChichimene - Apiay con un ancho de 12 metros.\n2. La adecuación de la infraestructura vial existente. (…)\nARTÍCULO DÉCIMO PRIMERO: La empresa Colombiana de Petróleos \nECOPETROL S.A., será responsable por cualquier  deterioro y/o daño ambiental \ncausado directamente o por los contratistas a su cargo y deberá realizar las \nactividades . \n(…)\nARTÍCULO DÉCIMO SÉPTIMO.- la Empresa Colombiana de Petróleos \nECOPETROL S.A., únicamente podrá acceder a los recursos naturales \nrenovables que están implícitos en la presente Licencia Ambiental y por lo tanto \nno se podrá hacer uso, aprovechamiento o afectación de recursos naturales \nrenovables. \nLa Resolución 0517 del 11 de mayo de 2004 del MAVDT no autoriza a Ecopetrol \nS.A servidumbre para la construcción del oleoducto Estación Castilla Apiay II de \n30”, que al igual no lo autorizó para la construcción del oleoducto Estación Castilla \n-Apiay I de 16” por los predios: Las Brisas-Cucharito, donde están ubicados los \n\nResolución No.  00359           Del   28 de febrero de 2023            Hoja No. 12 de 42\n“POR LA CUAL SE RESUELVE EL RECURSO DE REPOSICIÓN INTERPUESTO \nCONTRA LA RESOLUCIÓN No. 01192 DEL 07 DE JUNIO DE 2022 Y SE ADOPTAN \nOTRAS DETERMINACIONES”\nOficinas: Carrera 13 A No. 34 – 72 Edificio 13 35 Pisos 8 Bogotá, D.C.\nCentro de Orientación y Radicación de Correspondencia: Carrera 13 A No. 34 – 72 Edificio 13 35 \nLocales 110 al 112 Bogotá, D.C.  \nCódigo Postal 110311156\nNit.: 900.467.239-2\nLínea de Orientación y Contacto Ciudadano: 57 (1) 2540100 / 018000112998 PBX: 57 (1) 2540111\nwww.anla.gov.co    Email: licencias@anla.gov.co  \nPágina 12 de 42\nHUMEDALES: HORNOS: que es el Nacimiento del Caño Hornos (…) y MITÚ, del \nCaño del mismo nombre, Áreas Estratégicas, de Alta Sensibilidad Ambiental de \nEspecial \nProtección, \nde \nEXCLUSIÓN \nPARA \nACTIVIDADES \nDE \nHIDROCARBUROS por ser Zonas de Nacimientos de Agua (….) Ecopetrol S.A., \nIncumplió La Resolución 0517 de 11 de mayo de 2004 descrito en la página 4 \núltimo párrafo.\nEl oleoducto compartirá en los primeros 28 kilómetros el derecho de vía de la \nlínea eléctrica entre el pozo Pompeya 1 y la estación Castilla 2. Teniendo en \ncuenta los inconvenientes operativos que se pueden presentar por la cercanía de \nla tubería a una línea eléctrica (generación de campos electromagnéticos que \nhagan arco con la tubería durante su manipulación) y las Normas de Ingeniería \nde Oleoductos, se realizó un cálculo para determinar la distancia mínima que \ngarantice el desarrollo de las labores donde se estimó que se requerirá de un \nancho de 15.40 m desde el eje axial de la línea eléctrica.\n(continúa en la página 5, primer párrafo Resolución 0517 del MAVDT 2004)\nEl trazado, de acuerdo con el abscisado adoptado, tiene su K0+000 en fa trampa \nde envío de raspadores de la Estación Castilla 2, para finalizar en la trampa de \nrecibo de raspadores de la Estación de Bombeo Apiay. El trazado compartirá el \nderecho de vía de las líneas de transferencia de energía eléctrica a lo largo de \n31.3 km hasta mediaciones del pozo Pompeya 1, desde donde continuará por un \nnuevo derecho de vía a lo largo de 4.2 km hasta encontrar el oleoducto \nChichimene - Apiay para compartir su derecho de vía durante el tramo final de \n7.7 km hasta la estación de bombeo Apiay.\n1. Trazado del oleoducto: , Al Ecopetrol S.A., ejecutar ese Ilegal desvío del trazado \nen más de 2 kilómetros+ 570 metros de longitud, e incumplir la Resolución 0517 \ndel11 de Mayo de 2004 del MAVDT, autorizado paralelo a la línea de transferencia \nde energía eléctrica de Estación Castilla 2. a Estación Pompeya 1.cómo se \ndescribió.\n2. EN EL PUNTO ESTABLECIENDO EL LIMITE para tener localización del recorrido \ndel oleoducto estación Castilla-Apiay 16\", después de la carretera que de Acacias \nconduce a Pajure, el punto origen en la Resolución 0517 del 11 de Mayo de 2004, \nahí es aproximadamente en las Coordenadas: 3° 58' 04\" N 73o 31' 15\" W, donde \nestá ubicada la torre de la línea de transferencia de energía eléctrica de Castilla-2 a \nPompeya-1 identificada con el No. 36 (ilegible en la fotografía adjunta) ubicada en \nel Predio: La Ponderosa de Propiedad de la familia: Micán-Torres Versus el ilegal \ndesvió del citado oleoducto estación Castilla Apiay I de 16\" que lo construyeron por \nel predio de propiedad del Sr. Libardo Ovalle ubicado. Vereda: La Loma, en las \nCoordenadas aproximadas 3° 58'49\" N 73° 32'25\" W, con una longitud de desvió \nilegal aproximada de: 2 km +570 metros, la Resolución en mención no autoriza hacer \nocupación en los predios: Las Brisas- Cucharita, de propiedad de Coganagri Ltda. \nen Liq., Ecopetrol S.A., realiza invasión y daños en los Predios de Coganagri Ltda. \nen Liq. Con intervención en estos predios: Las Brisas: Coordenadas aproximadas \ndel Cardinal Norte, Limite con los predios: familia Torres-Rojas: E: 1060917.274N: \n932657.660 luego en el Cardinal Oriente del predio: Las Brisas y Occidente predio \nCucharita: / Coordenadas: E: 1062664.421 N: 932765.288 Y Cardinal Oriente: \npredio: Cucharita y Occidente predio San Jorge del Sr. Eusebio Baquero, \nCoordenadas E: 1062913.860 N: 932800.52, servidumbre de ocupación en una \nlongitud aproximada de 2 km + 042 m. X 15 metros de ancho, por los citados predios \nde Coganagri Ltda. en Liq. Que continúa y llega a la margen derecha del cauce del \nRio Guayuriba, en el predio: El Placer de propiedad del Sr. Genaro Ortiz.\n\nResolución No.  00359           Del   28 de febrero de 2023            Hoja No. 13 de 42\n“POR LA CUAL SE RESUELVE EL RECURSO DE REPOSICIÓN INTERPUESTO \nCONTRA LA RESOLUCIÓN No. 01192 DEL 07 DE JUNIO DE 2022 Y SE ADOPTAN \nOTRAS DETERMINACIONES”\nOficinas: Carrera 13 A No. 34 – 72 Edificio 13 35 Pisos 8 Bogotá, D.C.\nCentro de Orientación y Radicación de Correspondencia: Carrera 13 A No. 34 – 72 Edificio 13 35 \nLocales 110 al 112 Bogotá, D.C.  \nCódigo Postal 110311156\nNit.: 900.467.239-2\nLínea de Orientación y Contacto Ciudadano: 57 (1) 2540100 / 018000112998 PBX: 57 (1) 2540111\nwww.anla.gov.co    Email: licencias@anla.gov.co  \nPágina 13 de 42\n3. Luego Ecopetrol S.A. ejecuta segunda ilegal ocupación, que tampoco La \nResolución 0517 del11 de Mayo de 2004 autoriza servidumbre para el Proyecto: \nVertimiento Estación Acacias al Rio Guayuriba de 36\" sobre los predios de \nCoganagri Ltda. en Liq., que inicia en el Cardinal Occidente del predio las Brisas en \ncolindancia con los predios de la familia Torres.-Rojas. Cardinal Oriental: Las Brisas \ny Occidental: Cucharita Y Cardinal Oriente predio: Cucharita Y Occidente predio: \nSan Jorge del Sr Eusebio Baquero, servidumbre de ocupación que va en el sentido \nCardinal de Occidente a Oriente y se ubica 20 m más al norte y más lejos del trayecto \nde la Resolución 0517 del 2004.\nde (sic) Acacias conduce a Pajure en San Carlos de Guaroa, en el predio La \nPonderosa de propiedad de la familia Micán Torres, donde está ubicada la torre de \nla línea de transmisión de energía eléctrica de Castilla-2 a Pompeya-1, identificada \ncon el No. 36 (ilegible en la foto adjunto anexa), con Coordenadas aproximadas: 3° \n58' 04\" N 73° 31' 15\" W, Versus la ilegal desviación del citado proyecto construido \nen predio del Sr: Libardo Ovalle, Coordenadas aproximadas: 3° 58' 49\" N 73° 32' \n25\" W, y 7 años después de inicio de la ocasión del daño, Hacen una modificación \na la Resolución 0517 del11 de mayo del 2004, injustificada, absurda, porque \nocasiona daños a los Humedales Hornos-.Mitú y sitios de Recarga de la Cuenca \nHídrica del Río Guayuriba y de manera temeraria invoca una reforma a una \nocupación no contemplada en la  Resolución 0517 del 11 de Mayo de 2004; Siendo \naún mayor la desviación al tener en cuenta los puntos de incidencia dados por la \ncitada Resolución, y el punto de Vertimiento en el Rio Guayuriba ocasionado por \nilegal ocupación.\n5. En qué consisten los daños: Afectación a los Humedales. Hornos-Mitú, dren \nfrancés, Aquitardos y Acuíferos corren paralelos a la tubería instalada, cambiando \nla dirección de esta Riqueza Ambiental, disminuyendo la cantidad de agua sobre los \nterrenos y cambiando su utilidad agrícola hacia una obligada utilización ganadera, \ndada la escasez de humedad superficial del suelo para cultivos semestrales.\n6. Tercera Ilegal intervención, sin La Resolución 0517 del 11 de Mayo de 2004 \nautorizar la construcción del proyecto Oleoducto Estación Casilla 11 de 30\", que \ninterviene perturba, ocupa los Álveos, Lecho Natural, Rondas Hídricas de Protección \nde los Humedales Hornos-Mitú, ocasionando daños graves, permanentes e \nirreversibles, causando la muerte total y absoluta del Humedal y Caño Mitú, en plena \népoca de invierno septiembre del 2015, como se denunció a la Procuraduría 6 \nJudicial JI Agraria y Ambiental y demás Entes de Control Ambiental de la Nación.\nLínea de transferencia de energía eléctrica Estación Castilla 2 a Estación Pompeya 1, Torre \nNo. 36, ubicada en el predio: La Ponderosa, Vereda Quebraditas, Acacias-Meta, de \npropiedad de la Familia: Micán-Torres, donde es el K0+000 del Ilegal desvío del Oleoducto \nEstación Castilla Apiay II de 30\" e igual del oleoducto Estación Castilla-A.piay 1 de 16\".\n\nResolución No.  00359           Del   28 de febrero de 2023            Hoja No. 14 de 42\n“POR LA CUAL SE RESUELVE EL RECURSO DE REPOSICIÓN INTERPUESTO \nCONTRA LA RESOLUCIÓN No. 01192 DEL 07 DE JUNIO DE 2022 Y SE ADOPTAN \nOTRAS DETERMINACIONES”\nOficinas: Carrera 13 A No. 34 – 72 Edificio 13 35 Pisos 8 Bogotá, D.C.\nCentro de Orientación y Radicación de Correspondencia: Carrera 13 A No. 34 – 72 Edificio 13 35 \nLocales 110 al 112 Bogotá, D.C.  \nCódigo Postal 110311156\nNit.: 900.467.239-2\nLínea de Orientación y Contacto Ciudadano: 57 (1) 2540100 / 018000112998 PBX: 57 (1) 2540111\nwww.anla.gov.co    Email: licencias@anla.gov.co  \nPágina 14 de 42\n                                         \nLocación de Ecopetrol S.A, ubicado en el Predio del Sr Libardo Ovalle, por donde cruza el \nIlegal desvío del oleoducto Estación Castilla-Apiay II de 30\" y oleoducto Estación Castilla-\nApiay I de 16\" desde 2 km + 570 m de longitud aproximada desde las líneas de transferencia \nde energía eléctrica Estación Castilla 2 a Estación de bombeo Pompeya 1, con \nCoordenadas: 3° 58' 49\" N 73° 32' 25\" W, presentado en Imagen Satelital Google.\nUbicación del punto del Ilegal desvío de 2 km + 570 metros del oleoducto Estación Castilla-\nApiay II de 30\" y oleoducto Estación Castilla I de 16\" , en el predio del Sr Libardo Ovalle, \nVereda: La Loma Acacias- Meta, con Coordenadas 3° 58' 49\" N 73° 32' 25\" W, señalada en \ncolor rojo la línea que indica la longitud de desviación de 2km + 570 metros, desde el \nkm00+000 Torre No. 36 de la Línea de transferencia de energía eléctrica Estación Castilla 2 \na Estación de bombeo Pompeya1.\n\nResolución No.  00359           Del   28 de febrero de 2023            Hoja No. 15 de 42\n“POR LA CUAL SE RESUELVE EL RECURSO DE REPOSICIÓN INTERPUESTO \nCONTRA LA RESOLUCIÓN No. 01192 DEL 07 DE JUNIO DE 2022 Y SE ADOPTAN \nOTRAS DETERMINACIONES”\nOficinas: Carrera 13 A No. 34 – 72 Edificio 13 35 Pisos 8 Bogotá, D.C.\nCentro de Orientación y Radicación de Correspondencia: Carrera 13 A No. 34 – 72 Edificio 13 35 \nLocales 110 al 112 Bogotá, D.C.  \nCódigo Postal 110311156\nNit.: 900.467.239-2\nLínea de Orientación y Contacto Ciudadano: 57 (1) 2540100 / 018000112998 PBX: 57 (1) 2540111\nwww.anla.gov.co    Email: licencias@anla.gov.co  \nPágina 15 de 42\nImagen Satelítal Google de los predios: Las Brisas-Cucharito, Vereda Quebraditas, Acacias-\nMeta, de propiedad de Coganagri Ltda. en Liq .donde EcopetrolS.A., Ilegalmente Incumple \nla Resolución 0517 de Mayo dé 2004 y 0157 de 12 Feb de 2004 del MAVDT, construyó el \nOleoducto Estación Acacias-Apiay II de 30\" y el oleoducto Estación Castilla-Apiay I de 16\", \nsobre Los Humedales: Hornos-Mitú, Ocupando- Perturbando directamente: Álveos, Lecho \nNatural, Rondas de Protección, sobre Áreas Estratégicas de Especial Importancia Ambiental, \nser Zonas de Nacimientos de Agua con un Inconstitucional desvío, en una longitud mayor a \nlos 2 km + 570 m EN ZONAS DE EXCLUSIÓN PARA ACTIVIDADES DE \nHIDROCARBUROS, SEÑALADAS EN COLOR. AZUL, LOS HUMEDALES: HORNOS-MITÚ, \nLA EXTENSIÓN DE ÁREA AMBIENTAL AFECTADA, CAUCES DE CAÑOS Y CHUCUAS\n(…)\nLa Resolución 0517 del 11 de mayo de 2004 no autoriza a Ecopetrol S.A, \nservidumbre por los predios: Las Brisas-Cucharito, al ejecutar éste desvío del \nTrazado del oleoducto Estación Castilla Apiay II de 30”, como también lo hizo con el \noleoducto Estación Castilla -Apiay de 16” en el año 2005, y el Vertimiento Estación \nAcacias al Río Guayuriba de 36”. Ocasionó daños graves, permanentes e \nirreversibles al Medio Ambiente, en los Humedales Horno-Mitú, al Recurso Hídrico \nde los predios y de la Región, Incumpliendo Ecopetrol S.A, La Resolución No. 0157 \ndel MAVDT, del 12 de Febrero de 2004, Por la cual se reglamentan el uso sostenible, \nconservación y manejo de los humedales, y se desarrollan aspectos referidos a los \nmismos en aplicación de la Convención Ramsar.\n(…) \n“25. Mediante radicado 2015063281-1-000 del26 de noviembre de 2015, la \nProcuraduría Delegada para Asuntos Ambientales y Agrarios remitió a la ANLA el \ninforme \ntécnico \n067-2014 \ntitulado \n\"Presuntas \nafectaciones \nambientales \nocasionadas a los Caños Hornos y Mitú, por la construcción del Oleoducto Castilla-\nApiay II en el municipio de Acacias, Meta\", generado a partir de una visita \nefectuada el 21 de octubre de 2015 en compañía de personal de CORMACARENA \ny ECOPETROL S.A. en el sector por donde discurren los caños Hornos y Mitú, \nvereda Quebraditas del municipio de Acacias - Meta. Se concluye en dicho informe \nque se han realizado \"vertimientos no autorizados\" sobre cuerpos de agua \nsuperficiales\".\n\"30. Mediante Auto 4623 del 8 de agosto de 2018, acogió el Concepto Técnico \n4867 del 23 de septiembre de 2016 y ordenó la apertura del procedimiento \nsancionatorio ambiental en contra de la sociedad CENIT TRANSPORTE Y \n\nResolución No.  00359           Del   28 de febrero de 2023            Hoja No. 16 de 42\n“POR LA CUAL SE RESUELVE EL RECURSO DE REPOSICIÓN INTERPUESTO \nCONTRA LA RESOLUCIÓN No. 01192 DEL 07 DE JUNIO DE 2022 Y SE ADOPTAN \nOTRAS DETERMINACIONES”\nOficinas: Carrera 13 A No. 34 – 72 Edificio 13 35 Pisos 8 Bogotá, D.C.\nCentro de Orientación y Radicación de Correspondencia: Carrera 13 A No. 34 – 72 Edificio 13 35 \nLocales 110 al 112 Bogotá, D.C.  \nCódigo Postal 110311156\nNit.: 900.467.239-2\nLínea de Orientación y Contacto Ciudadano: 57 (1) 2540100 / 018000112998 PBX: 57 (1) 2540111\nwww.anla.gov.co    Email: licencias@anla.gov.co  \nPágina 16 de 42\nLOGISTICA \nDE \nHIDROCARBUROS \nS.A.S. \npor \nla \nsiguiente \nomisión \npresuntamente constitutiva de infracción ambiental:\nPor no haber garantizado que las medidas adoptadas en la Ficha de Manejo No. 7 \nManejo de Aguas de Escorrentía, fueran efectivas para lograr el control del impacto \nde aporte de sedimentos y materiales en los Caños Hornos y Mitú en la vereda \nQuebraditas del municipio de Acacias, Departamento del Meta, incurriendo con ello \nen presunta infracción de lo establecido en el parágrafo del Artículo Décimo \nPrimero de la Resolución No. 203 del29 de marzo de 2012\".\nSe solicita a la ANLA acogerse completamente al contenido del citado Informe \nTécnico y no ocultar el incumplimiento de Ecopetrol a La Resolución 0517 del11 de \nMayo de 2004 Que textual cita:\n\"La Procuraduría General de la Nación Delegada para Asuntos Ambientales y \nAgrarios en el Informe Técnico No. 067- 2015 ,\nPRESUNTAS AFECTACIONES AMBENTALES (sic) OCASIONADAS A LOS \nCAÑOS HORNOS- \"MITU, POR LA CONSTRUCCIÓN DEL OLEODUCTO \nCASTILLA-APIAY II EN EL MUNICIPIO DE ACACIAS, META.,\n\"A través del artículo 1° de la Resolución 204 de 2012, la ANLA aclara el Artículo 2° \nde la Resolución 504 en el sentido de modificar el trazado autorizado inicialmente \npara el oleoducto de 16 pulgadas Castilla- Apiay entre los K15+200 y K26+650 \nargumentando que este era el indicado en el EIA. Frente a esto vale la pena señalar \nque Ecopetrol tuvo en su momento la oportunidad de interponer un recurso de \nreposición para solicitar la modificación de la licencia ambiental, sin embargo, \nejecutó las obras con un trazado diferente al autorizado, constituyéndose así en un \nincumplimiento por la autoridad competente, la cual realizó una aclaración \nretroactiva con el fin de solucionar el asunto, a pesar de ya haberse ejecutado la \nactividad, generando impactos adicionales o diferentes a los contemplados en el \ninstrumento ambiental\"\n2. FRENTE A LA CESACIÓN DEL PROCEDIMIENTO\n(…)\n\"La Autoridad Ambiental no hizo un adecuado seguimiento y control a la Licencia \notorgada mediante Resolución 504 de 2004, pues el oleoducto se ejecutó con un \ntrazado diferente al autorizado lo cual quedo debidamente demostrado ya en la \nactuación pretérita con resolución ejecutoriada y con el informe presentado por la \nProcuraduría ambiental y en ningún momento tomó las acciones correspondientes \npara corregir o sancionar dicho incumplimiento.\nFrente a lo anterior es Aterradora esta situación de Depreciación Ambiental, \nAgresión Aleve, ejecutada por Ecopetrol S.A. A LOS RECURSOS NATURALES \nRENOVABLES DE LOS PREDIOS: LAS BRISAS-CUCHARITO, Propiedad de, ésta \nSociedad comercial: Coganagri Ltda. en Liq., que cómo prueba directa y oficial de \nlos Hechos, se tiene radicado como lo anotó la Procuraduría General de la Nación \nDelegada para Asuntos Ambientales, en el \"INFORME TÉCNICO No. 067-2015, \n\"que la ANLA haga una modificación retroactiva de una Licencia Ambiental, como \nmanera de solucionar un incumplimiento a la misma.\". Ello no es entendible, ni \ncomprensible, el porqué, se incumplen las Resoluciones: 0517 del 11 de Mayo de \n2004 y 0157 del 12 de Febrero de 2004 del MAVDT, y la Aplicación del Principio de \nPrecaución-Protección a los Humedales: Hornos-Mitú, EL DAÑO AMBIENTAL  \nOCASIONADO POR: ECOPETROL S.A., EN ZONAS DE EXCLUSIÓN PARA \nACTIVIDADES ' DE HIDROCARBUROS POR SER HUMEDALES, ÁREAS DE \nNACIMIENTOS DE AGUA, para la construcción del oleoducto Estación Castila \n\nResolución No.  00359           Del   28 de febrero de 2023            Hoja No. 17 de 42\n“POR LA CUAL SE RESUELVE EL RECURSO DE REPOSICIÓN INTERPUESTO \nCONTRA LA RESOLUCIÓN No. 01192 DEL 07 DE JUNIO DE 2022 Y SE ADOPTAN \nOTRAS DETERMINACIONES”\nOficinas: Carrera 13 A No. 34 – 72 Edificio 13 35 Pisos 8 Bogotá, D.C.\nCentro de Orientación y Radicación de Correspondencia: Carrera 13 A No. 34 – 72 Edificio 13 35 \nLocales 110 al 112 Bogotá, D.C.  \nCódigo Postal 110311156\nNit.: 900.467.239-2\nLínea de Orientación y Contacto Ciudadano: 57 (1) 2540100 / 018000112998 PBX: 57 (1) 2540111\nwww.anla.gov.co    Email: licencias@anla.gov.co  \nPágina 17 de 42\nApiay II de 30\" e igual para el oleoducto Estación Castilla-Apiay I de 16\", un \ngravísimo perjuicio ambiental con el daño ocasionado a los Humedales Hornos-Mitú \nque irrigan los predios.”\n(…)\nEs definida la situación Jurídica de Ecopetrol S.A., en la Resolución 0517 del11 de \nMayo de 2004, como Operador responsable en el oleoducto Estación Castilla-Apiay \nI de 16\" cómo también del oleoducto Estación Castilla-,Apiay de 30\", donde el citado \nOperador de manera Inconstitucional ejecuta desvío del trazado de estos proyectos \nen más de 2 kilómetros + 570 metros del trazado autorizado en la Resolución 0517 \ndel11 de Mayo de 2004, ocasionando Daños Graves, Permanentes e Irreversibles a \nlos Humedales: Hornos-Mitú, Ecosistemas de: EXCLUSIÓN PARA ACTIVIDADES \nDEHIDROCARBUROS, Áreas Estratégicas,: de Alta Sensibilidad Ambiental, de \nProtección Especial, Por Ser Zonas de Nacimientos, de Agua, como se han aportado \nlas pruebas que soportan los Hechos relevantes para tomar una decisión, teniendo \nEcopetrol S.A., la responsabilidad Constitucional y Legal de responder ante los \nEntes de Control Ambiental, a Coganagri Ltda. en Liq. en las medidas de: MITIGAR-\nENMENDAR-COMPENSAR- CORREGIR-RESTITUIR- SUSTITUIR las aguas en \népoca de verano desde el Distrito de Riego del Río Guayuriba conducida por tubería \nsubterránea y luego por lechos naturales que las lleven a los Humedales: Hornos-\nMitú, y sus Caños: Hornos-Mitú, como se ha peticionado en escritos radicados a los \ndiferentes Entes de Control Ambiental de la Nación, Amparados en La Constitución \nNacional, la Ley Ambiental y los Convenios y Tratados Universales, firmados por el \nGobierno Nacional, transferidos en Ley de la Nación.\nCAUSALES DE CESACION DE PROCEDIMIENTO\nLa ANLA inició los trámites y actuaciones correspondientes hasta llegar al auto 4623 \ndel 8 de agosto de 2018, disponiendo dar apertura al trámite sancionatorio contra \nCENIT. Véase el numeral 30 de la resolución aquí atacada. En los numerales \nsiguientes de la citada resolución menciona la notificación del auto y su ejecutoria. \nEn el registro de antecedentes de la actuación no se observa el procedimiento \niniciado respecto a la apertura del Procedimiento Sancionatorio Ambiental y las \nactuaciones posteriores a la misma, máxime cuando el suscrito estuvo denunciando, \npresentando y radicando soportes del Daño Ambiental ocasionados a los \nHumedales. Hornos- Mitú, al Recurso Hídrico de los predios: Las Brisas-Cucharita, \nante el correo electrónico de La Procuraduría 6 Judicial 11 Agraria y Ambiental del \nMeta, a La Fiscalía General del Meta, por solicitud de ésta Autoridad, a La ANLA, \npero ésta Autoridad se limita a unos informes presentados por la transportadora, \npero de manera irresponsable y cómplice, oculta, desconoce y no tiene en cuenta el \nprincipal incumplimiento de Ecopetrol S.A., como Operador del proyecto en la \nILEGAL OCUPACIÓN DE SERVIDUMBRE DE LOS PREDIOS: LAS BRISAS \nCUCHARITO, pero que si lo hace el Informe técnico 067-2015 de la Procuraduría \nGeneral de la Nación Delegada para  Asuntos Ambientales, indicando del \nincumplimiento tanto de Ecopetrol S.A, como operador del oleoducto Estación \nCastilla- Apiay II de 30\" y de La ANLA, cómo Autoridad Ambienta; que se adjuntó \ntextual en las CONCLUSIONES: del citado Informe Técnico.\nConsidera el suscrito que no se están cumpliendo las causales de Cesación del \nProcedimiento Sancionatorio en Materia Ambiental pues e artículo 9 de la Ley 1333 \nde 2009 , exige para su concesión que se reúnan las siguientes causales:\n1°. Muerte del investigado cuando es una persona natural.\n2°. Inexistencia del hecho investigado.\n3°. Que la conducta investigada no sea imputable al presunto infractor.\n4°. Que la actividad esté legalmente amparada y/o autorizada.\n\nResolución No.  00359           Del   28 de febrero de 2023            Hoja No. 18 de 42\n“POR LA CUAL SE RESUELVE EL RECURSO DE REPOSICIÓN INTERPUESTO \nCONTRA LA RESOLUCIÓN No. 01192 DEL 07 DE JUNIO DE 2022 Y SE ADOPTAN \nOTRAS DETERMINACIONES”\nOficinas: Carrera 13 A No. 34 – 72 Edificio 13 35 Pisos 8 Bogotá, D.C.\nCentro de Orientación y Radicación de Correspondencia: Carrera 13 A No. 34 – 72 Edificio 13 35 \nLocales 110 al 112 Bogotá, D.C.  \nCódigo Postal 110311156\nNit.: 900.467.239-2\nLínea de Orientación y Contacto Ciudadano: 57 (1) 2540100 / 018000112998 PBX: 57 (1) 2540111\nwww.anla.gov.co    Email: licencias@anla.gov.co  \nPágina 18 de 42\nPARÁGRAFO . Las causales consagradas en los numerales 1º y 4º operan sin \nperjuicio de continuar el procedimiento frente a los otros investigados si los \nhubiere.\nRespecto al ordinal 1°, el investigado es persona jurídica activa, pues se trata de la \nempresa CENIT TRANSPORTES Y LOGÍSTICA DE HIDROCARBUROS S.A..S y \nde ECOPETROL S.A.\nRespecto 2°. El hecho existe, por cuanto ya se estableció que hubo un \nincumplimiento de las resoluciones 0517 de 11 de mayo de 2004 del Ministerio de \nAmbiente y Desarrollo Territorial MAVDT, que es el Ente Ambiental que autoriza el \ntrazado del oleoducto Estación Castilla-Apiay i de 16\", incumplimiento a la \nResolución 0157 del12 de febrero de 2004 de protección a Humedales, igualmente \nde la Ley 99 de 1993 en el Art.: 1. Numerales 1-2-3-4-6-7-8-9, en especial al Numeral \n6 por incumplimiento a la Aplicación del Principio de Precaución, Protección de los \nHumedales: Contemplado en el Principio 15 del Acuerdo de Río de Janeiro de 1992, \nincumple a la Constitucionalización de estos Tratados Universales.,.\nRespecto al ordinal 3°. Los daños ocasionados sobre los Predios: Las Brisas-\nCucharita, propiedad de Coganagri Ltda. en Liq. Productor Agrícola quien solicitó \ncréditos ante el ayer Banco Ganadero hoy Banco BBVA, invirtió en maquinaria \nagrícola para cultivos semestrales: arroz- soya principalmente, que luego tuvo la \nimperiosa necesidad de desplazarse a la producción pecuaria, ocasionada por la \nIlegal imposición de servidumbre Petrolera, sobre áreas de Alta Sensibilidad \nEcológica de protección especial por ser Zonas de Nacimientos de agua, de la \nRecarga de la Cuenca Hídrica del Río Guayuriba y Chichimene, que disponían de \nlos Humedales: Hornos-Mitú 4 caños: Hornos- Brisas-Ceiba- Mitú, de 7 Nacimientos \nPrincipales y 9 Nacimientos secundarios, con formación de chucuas que irrigaban \nla extensión total de los predios: Las Brisas-La Ceiba-Cucharito en una extensión \naproximada de 420 hectáreas, disponibles de aguas superficiales que mantenían \nbuena disponibilidad de humedad, en los suelos en la época de verano que es la \nmás crítica, pero que estos predios gozaban y eran privilegiados por su Riqueza \nHídrica, para cultivos del segundo semestre en soya, Maíz o sorgo, (ver Imagen \nSatelital Google explicativa de la Riqueza Hídrica: en sus Humedales: Hornos-Mitú, \nsus Caños, sus Nacimientos, adjunta), pero que Ecopetrol S.A., impuso ilegal \nservidumbre para el oleoducto Estación Castilla-Apiay I de 16 pulgadas, proyecto \nque intervino,. ocupó, perturbó y afectó directamente inicialmente el Humedal \nHornos, que origina el Caño Hornos afluente que recibía la Recarga Hídrica de Norte \na Sur y se desplaza de Occidente a Oriente por toda la parte media de los Predios \ncitados, que la tubería de este Oleoducto también va en igual dirección Cardinal de \nOccidente a Oriente, produciendo con esta tubería un dren Francés, que arrastra las \naguas de la Recarga Hídrica del Río Guayuriba que se dirigen en dirección Cardinal: \nde Norte a Sur, pero la instalación de esta tubería, actúa negando el paso del agua \nde la Recarga de la Cuenca Hídrica del Río Guayuriba, hacia la parte Occidental y \nSur de los citados Predios, causando pérdida de agua de los Humedales Hornos-\nMitú, de los 7 Nacimientos Principales y 9 secundarios, secando las múltiples \nchucuas, perdiendo por una parte humedad superficial de los suelos agrícolas, por \nlo que se dejó de trabajar la agricultura por pérdidas económicas, se pasó a sembrar \nla totalidad de los Predios en 4 variedades de gramíneas: Brachiarias : decumbens, \nbrizantha marandú, dictipneura y Mombaza y leguminosa Kudzu, para la producción \npecuaria, que por la misma razón de la pérdida de humedad superficial de los suelos, \nse perdieron estas praderas sembradas con buena cobertura de asociación \nGramíneas-Leguminosa, que hoy se puede observar directamente la degradación y \npérdida de estas praderas técnicamente establecidas, como también las pérdidas \neconómicas·, por daños ocasionados por acción directa de maquinaria pesada que \naccionó en el descapote del suelo con buldócer, excavado, instalación de tubería de \n16\", tapado del excavado, sobre: Álveos, Lecho Natural, Rondas de Protección, \ncauce del Humedal: Hornos, ÁREAS DE EXCLUSION PARA ACTIVIDADES DE \n\nResolución No.  00359           Del   28 de febrero de 2023            Hoja No. 19 de 42\n“POR LA CUAL SE RESUELVE EL RECURSO DE REPOSICIÓN INTERPUESTO \nCONTRA LA RESOLUCIÓN No. 01192 DEL 07 DE JUNIO DE 2022 Y SE ADOPTAN \nOTRAS DETERMINACIONES”\nOficinas: Carrera 13 A No. 34 – 72 Edificio 13 35 Pisos 8 Bogotá, D.C.\nCentro de Orientación y Radicación de Correspondencia: Carrera 13 A No. 34 – 72 Edificio 13 35 \nLocales 110 al 112 Bogotá, D.C.  \nCódigo Postal 110311156\nNit.: 900.467.239-2\nLínea de Orientación y Contacto Ciudadano: 57 (1) 2540100 / 018000112998 PBX: 57 (1) 2540111\nwww.anla.gov.co    Email: licencias@anla.gov.co  \nPágina 19 de 42\nHIDRICARBUROS, donde Ecopetrol S,A, ejecuta un Inconstitucional desvío del \ntrazado del Oleoducto Estación Castilla-Apiay de 30\", como igual lo ejecutó con el \noleoducto Estación Castilla-Apiay de 16\", en una longitud mayor de 2 km + 570 m, \ndesde donde tiene autorizado y definido el derecho de vía que debe ir paralelo a la \nlínea de transferencia de energía eléctrica de la Estación Castilla 2 a la: Estación de \nbombeo Pompeya 1, debidamente definido en la Resolución 0517 del 11de Mayo \nde 2004, son infracciones imputables a  La compañía CENIT Transporte y Logística \nde Hidrocarburos y ECOPETROL S.A, por haber incurrido en ellas y haber afectado \nel medio ambiental de especial protección constitucional.\nRespecto al ordinal 4° La compañía CENIT Transporte y Logística de Hidrocarburos \ny ECOPETROL S.A, son personas jurídicas responsables de las Normas \nviolentadas citadas.\nCONCLUSIONES\nLos Hechos del Daño Ambiental a los Humedales: Hornos-Mitú, al Recurso Hídrico \nde los predios: Las Brisas-Cucharita, son evidentes, cómo también lo es la violación \nConstitucional y no han sido corregidos, por lo cual el Procedimiento Sancionatoria \ndebe \ncontinuar \ncontra \nEcopetrol \nS.A, \nOperador \nresponsable \nante \nlos \nincumplimientos: a los Artículos: Segundo – Décimo Primero - Décimo Séptimo, de \nla Resolución 0517 del 11 de Mayo de 2004 del MAVDT y demás citados, imponer \nlas sanciones a que haya lugar y exigir ejecutar las actividades necesarias para \ncorregir, enmendar, compensar, mitigar, restituir, sustituir las aguas en época de \nverano de los Humedales: Hornos-Mitú y sus Caños del mismo nombre.\nEs de recordar a los Entes de Control: Ambiental, Judicial, Fiscal, Administrativos \nSuperiores y Constitucionales, de que la ANLA impuso sanción económica a \nEcopetrol S.A., por medio de la Resolución 01613 del 10 de Septiembre de 2021, la \nque respetuosamente solicité al Sr. Procurador 6 Judicial ll Ambiental del Meta, para \nque La ANLA allegara, que está radicada en la investigación.\nQue sanciona:\n\"Por obras adelantadas en el proyecto Área de Exploratoria CP009, ubicado en el \nMunicipio de Acacias-Meta por construir locaciones a una distancia menor a las \nzonas de ronda y preservación del recurso hídrico de los caños Lejía y el NN\"\nEn éste denunciado caso por Coganagri Ltda en Liq., ante La ANLA, de la \nInconstitucional ocupación por Ecopetrol S.A., a los Predios: Las Brisas-Cucharita, \nincumpliendo las Resoluciones: 0517 del 11 de Mayo de 2004 y 0157 d4112 de \nFebrero de 2004 del MAVDT, a la Aplicación del Principio de Precaución- Protección \na los Humedales: Hornos-Mitú, que ocasionó Daños Graves, Permanentes e \nIrreversibles a estos citados Humedales , al Recurso Hídrico, pérdida total y absoluta \nde las aguas del Humedal y Caño Mitú, ocasionando la muerte de estos \nEcosistemas, en la construcción del oleoducto Estación Acacias-Apiay 11 de 30\" en \nel mes de Septiembre de 2015, por ilegal y directa mecanización sobre el álveo, \nlecho natural, cauce, cotas máximas de Protección, con descapote de la superficie \ndel suelo con buldózer, excavado, instalación ge tubería de 30 pulgadas, tapado del \nexcavado donde son alterados los perfiles naturales del suelo, causando la muerte \ny ECOCIDIO AMBIENTAL QUE AFECTÓ NO SÓLO A LOS PREDIOS, SINO A LA \nREGION DE LOS AFLUENTES HORNOS-MITÚ, SIN HABER EXISTIDO LA \nAPLICACIÓN DEL PRINCIPIO DE PRECAUCIÓN INVOADO (sic) POR \nCOGANAGRI LTDA. EN LIQ., SIN SANCION - REPARACIÓN ALGUNA, por lo cual \nse solicita seguir con el Procedimiento Sancionatorio y de Reparación exigidos por \nla Ley 1333 del 21 de Julio de 2009, que estableció el Procedimiento Sancionatorio \nAmbiental, de La Constitución Nacional y La Ley Ambiental, contra Ecopetrol S.A., \n\nResolución No.  00359           Del   28 de febrero de 2023            Hoja No. 20 de 42\n“POR LA CUAL SE RESUELVE EL RECURSO DE REPOSICIÓN INTERPUESTO \nCONTRA LA RESOLUCIÓN No. 01192 DEL 07 DE JUNIO DE 2022 Y SE ADOPTAN \nOTRAS DETERMINACIONES”\nOficinas: Carrera 13 A No. 34 – 72 Edificio 13 35 Pisos 8 Bogotá, D.C.\nCentro de Orientación y Radicación de Correspondencia: Carrera 13 A No. 34 – 72 Edificio 13 35 \nLocales 110 al 112 Bogotá, D.C.  \nCódigo Postal 110311156\nNit.: 900.467.239-2\nLínea de Orientación y Contacto Ciudadano: 57 (1) 2540100 / 018000112998 PBX: 57 (1) 2540111\nwww.anla.gov.co    Email: licencias@anla.gov.co  \nPágina 20 de 42\nOperador responsable como lo define el ARTICULO DÉCIMO PRIMERO DE LA \nRESOLUCIÓN 0517 DEL 11 DE MAYO DE 2004 del MAVDT.\nDe estas acciones ejecutadas por Ecopetrol S.A., Ocasionando Daños Graves, \nPermanentes e Irreversibles, a los Humedales Hornos-Mitú, Áreas Estratégicas de \nAlta Sensibilidad Ambiental por ser Zonas de Nacimientos de Agua de la cuenca \nHídrica del Río Guayuriba y Chichimene, de gran importancia para el Municipio de \nAcacias, porque tienen su origen en la Hacienda: Las Brisas, el Humedal Hornos y \nsu caño del mismo nombre, igualmente el Humedal Mitú, que mantenía las aguas \ndel caño Mitú, ubicado en el Predio: Cucharita las aguas de estos afluentes, \ndesembocan en el Río Pajure en el Municipio de San Carlos de Guaroa, irrigando \nterrenos de su vecindad en las Veredas: Quebraditas, Palomas, el Borrego, \nPalmeras, Pajure y otras de Interés Regional y  Departamental (…).\n(…)\nLos hechos del daño ambiental son evidentes y no han sido corregidos por lo cual \nla actuación sancionatoria debe continuar e imponer las sanciones a que haya lugar \nante el incumplimiento Inconstitucional de Ecopetrol S.A., y la ANLA, a la Resolución \n0517 de 10 de Mayo de 2004 y Resolución 0157 del 11 de Febrero de 2004 del  \nMAVDT, que lo sigue siendo como tal y por eso se solicita a La ANLA REVOQUE \nLA RESOLUCIÓN 01192 DE 07 DE JUNIO DE 202EE E INICIAR Y CONTINUAR \nCON EL PROCEDIMIENTO SANCIONATORIO Y REPARACCIÓN CONTRA \nECOPETROL S.A PERTADOR RESPONSABLE, COMO LO DEFINE EL \nARTÍCULO DÉCIMO PRIMERO, DE LA RESOLUCIÓN 0517 DEL 11 DE MAYO DE \n2004 DEL MAVDT.\n(…)”\nV. Análisis del Recurso\nUna vez revisados los argumentos que sustentan el recurso propuesto a través del  \nradicado 2022136613-1-000 del 05 de julio de 2022 en contra de la Resolución No.  \n01192  del   07 de junio de 2022  y en el cual se  solicita la revocatoria del referido \nacto administrativo, el despacho atenderá  los motivos de inconformidad expuestos \nen el mismo orden en el que fueron presentados en el escrito, de  la siguiente \nmanera:  \n1. Consideraciones respecto al principio de precaución.\n2. Consideraciones frente a la cesación de procedimiento.\n3. Consideraciones respecto a las conclusiones. \nRealizadas las anteriores precisiones, procede la Autoridad Nacional de Licencias \nAmbientales-ANLA-, a manifestarse respecto a cada uno de los puntos arriba \nseñalados, así:\n1. Consideraciones de la ANLA respecto al principio de precaución:\n En lo que corresponde a la temática controvertida, arguye el recurrente que \n“Ecopetrol S.A., en la construcción del oleoducto Estación Castilla-Apiay II de 30\" Incumple \nla Resolución 0517 del 11 de Mayo de 2004 del MAVDT, en los ARTÍCULOS: SEGUNDO - \nDÉCIMO PRIMERO Y DÉCIMO SEPTIMO (…)  (…) Incumple a la Aplicación del Principio \nde Precaución establecido en el Artículo 1. Numeral 6 de la Ley 99 de 1993, igualmente \n\nResolución No.  00359           Del   28 de febrero de 2023            Hoja No. 21 de 42\n“POR LA CUAL SE RESUELVE EL RECURSO DE REPOSICIÓN INTERPUESTO \nCONTRA LA RESOLUCIÓN No. 01192 DEL 07 DE JUNIO DE 2022 Y SE ADOPTAN \nOTRAS DETERMINACIONES”\nOficinas: Carrera 13 A No. 34 – 72 Edificio 13 35 Pisos 8 Bogotá, D.C.\nCentro de Orientación y Radicación de Correspondencia: Carrera 13 A No. 34 – 72 Edificio 13 35 \nLocales 110 al 112 Bogotá, D.C.  \nCódigo Postal 110311156\nNit.: 900.467.239-2\nLínea de Orientación y Contacto Ciudadano: 57 (1) 2540100 / 018000112998 PBX: 57 (1) 2540111\nwww.anla.gov.co    Email: licencias@anla.gov.co  \nPágina 21 de 42\nIncumple a La Constitucionalización en el Convenio Ramsar y El Acuerdo de Río de Janeiro \nde 1992, firmados por el Gobierno Nacional.(…)”\nPosteriormente indica:\n“(…)\n “Ecopetrol S.A., igualmente Incumple la Ley 99 de 1993 Art. 1° No.: 1-2-3-4-6-7-8-\n9-12 del Acuerdo de Río de Janeiro de 1992, Principio 15, Principio de Precaución, \nejecutando un ilegal desvío aproximado de 2 kilómetros + 570 metros de longitud, \npara construir el oleoducto Estación Castilla-Apiay II de 30\", como también lo hizo \ncon el oleoducto Estación Castilla-Apiay I de 16\" que violó el Principio de Precaución \ninvocado por Coganagri Ltda, construyendo estos citados proyectos en Áreas \nEstratégicas, de alta Sensibilidad Ambiental con Protección Especial por ser \nNacimientos de Agua ocasionando la pérdida total y absoluta del Humedal Mitú y su \nCaño del mismo nombre, Humedales: Hornos-Mitú, violando la Constitución \nNacional por Delito Ambiental, muerte Ambiental de estos Ecosistemas, en plena \népoca de invierno, fecha: Septiembre de 2015 en la etapa de construcción del \noleoducto Estación Castilla-Apiay de 30\", lo que se denunció ante la Procuraduría 6 \nJudicial II Agraria y Ambiental del Meta y demás Entes de Control Ambiental de la \nNación, por lo que Ecopetrol S.A., tiene el Deber Constitucional y Legal de \nResponder, ante los daños ocasionados.\n(…)  (Subrayado insertado). \nDe los apartes anteriores, se desprende que para la parte recurrente,  la EMPRESA \nCOLOMBIANA DE PETRÓLEOS - ECOPETROL S.A, en la construcción del \n“(…)oleoducto Estación Castilla-Apiay II de 30 como también lo hizo con el \noleoducto Estación Castilla-Apiay I de 16\" (…) incurrió en una vulneración de sendas \ndisposiciones contenidas en la Resolución No. 0517 del 11 de mayo de 2004,  a \ntravés de la cual el MAVDT le otorgó inicialmente Licencia Ambiental para el \nProyecto  “Construcción del Oleoducto Castilla -  Apiay”  así como lo normado en el \nnumeral 6, artículo 1 de la Ley 99 de 1993, contentivo del Principio de Precaución y  \notras disposiciones de carácter ambiental.\nAl respecto, el despacho considera esencial realizar las siguientes aclaraciones: \nEn primera medida cobra notoria importancia resaltar que la Resolución No. 0517 \ndel 11 de mayo de 2004, a través de la cual el MAVDT resolvió otorgar a la \nEMPRESA COLOMBIANA DE PETRÓLEOS - ECOPETROL S.A, Licencia \nAmbiental para el desarrollo del proyecto “Construcción del Oleoducto Castilla - \nApiay” fue aclarada y modificada por la ANLA  a través de la Resolución No. 0203 \ndel 29 de marzo de 2012 , la cual fue confirmada en todas sus partes en la \nResolución No. 852 del 09 de octubre de 2012.\nBajo dicho contexto, se tiene que en el artículo segundo de la Resolución No. 203 \ndel 29 de marzo de 2012, esta Entidad determinó modificar el artículo primero de la \nResolución No. 517 del 11 de mayo de 2004, en el sentido de adicionar una de la \nnueva línea de transporte de crudo de 30”, en los siguientes términos:  \n“ (…)\nARTÍCULO SEGUNDO.- Modificar el artículo primero de la Resolución 517 del 11 \nde mayo de 2004, en el sentido de adicionar una nueva línea de transporte de crudo \nde 30” a partir de la estación de bombeo Castilla 2 (ubicada en el municipio de \n\nResolución No.  00359           Del   28 de febrero de 2023            Hoja No. 22 de 42\n“POR LA CUAL SE RESUELVE EL RECURSO DE REPOSICIÓN INTERPUESTO \nCONTRA LA RESOLUCIÓN No. 01192 DEL 07 DE JUNIO DE 2022 Y SE ADOPTAN \nOTRAS DETERMINACIONES”\nOficinas: Carrera 13 A No. 34 – 72 Edificio 13 35 Pisos 8 Bogotá, D.C.\nCentro de Orientación y Radicación de Correspondencia: Carrera 13 A No. 34 – 72 Edificio 13 35 \nLocales 110 al 112 Bogotá, D.C.  \nCódigo Postal 110311156\nNit.: 900.467.239-2\nLínea de Orientación y Contacto Ciudadano: 57 (1) 2540100 / 018000112998 PBX: 57 (1) 2540111\nwww.anla.gov.co    Email: licencias@anla.gov.co  \nPágina 22 de 42\nCastilla La Nueva), con una longitud de 42 km y cuyo trazado irá contiguo a los \nderechos de vía de los proyectos lineales existentes (los oleoductos Castilla – Apiay \nde 16” y Chichimene – Apiay de 16”, la línea de vertimiento Estación Acacías – \nGuayuriba y en algunos sectores con la línea eléctrica de 115 kV -Pompeya 1 - \nEstación Castilla), con los siguientes realineamientos:\n(…)”\nLuego, la ANLA expidió la Resolución No. 0374 del 11 de abril de 2014, acto \nadministrativo a través del cual se autorizó la cesión total de los derechos y \nobligaciones derivados de la Licencia Ambiental otorgada a través de la Resolución \nNo. 0517 del 11 de mayo de 2004 para el proyecto “Construcción del Oleoducto \nCastilla - Apiay” (con sus respectivas modificaciones y aclaraciones), a favor de la \nsociedad CENIT TRANSPORTE Y LOGISTICA DE HIDROCARBUROS S.A.S.\nConforme a lo anterior, se concluye que la EMPRESA COLOMBIANA DE \nPETRÓLEOS - ECOPETROL S.A, a quien se alude de manera frecuente en el \nescrito contentivo del recurso, dejó de ostentar la titularidad de la Licencia Ambiental \notorgada a través de la Resolución No. 0517 del 11 de mayo de 2004  junto con  sus \nmodificatorias y aclaratorias,  con la expedición y firmeza de la Resolución No. 0374 \ndel 11 de abril de 2014, acto administrativo a  través del cual, esta Entidad autorizó \nla cesión del referido instrumento, a favor de la sociedad CENIT TRANSPORTE Y \nLOGISTICA DE HIDROCARBUROS S.A.S.\nBajo dicho contexto, siendo ya CENIT TRANSPORTE Y LOGISTICA DE \nHIDROCARBUROS S.A.S., la titular de la Licencia Ambiental y con sustento en las \nconsideraciones expuestas en el Concepto Técnico No. 04867 del 23 de septiembre \nde 2016, la ANLA expidió el Auto No. 04623 del 08 de agosto de 2018, en el cual  \ndeterminó iniciar procedimiento administrativo sancionatorio ambiental en contra de \nla referida persona jurídica, en los siguientes términos:\n“(…)\nARTÍCULO PRIMERO. Ordenar el inicio del procedimiento sancionatorio ambiental \nen contra de la sociedad denominada CENIT TRANSPORTE Y LOGISTICA DE \nHIDROCARBUROS S.A.S, identificada con el Nit. 900531210 – 3, titular del \nProyecto Oleoducto Castilla – Apiay, de acuerdo con el artículo 18 de la Ley 1333 \nde 2009, con fundamento en las consideraciones expuestas en la parte motiva de \neste auto, por el hecho relacionado a continuación y aquellos que les sean conexos:\n<0000>\nPor no haber garantizado que las medidas adoptadas en la Ficha de Manejo \nNo. 7 Manejo de Aguas de Escorrentía, fueran efectivas para lograr el control \ndel impacto de aporte de sedimentos y materiales en los Caños Hornos y \nMitú en la vereda Quebraditas del municipio de Acacias, Departamento del \nMeta, incurriendo con ello en presunta infracción de lo establecido en el \nparágrafo del Artículo Décimo Primero de la Resolución No. 203 del 29 de \nmarzo de 2012.  \n(…)”\nDe todo lo expuesto hasta el momento, el despacho se permite abstraer las \nsiguientes apreciaciones:\n<0000>\nLa ANLA, en Resolución No. 0203 del 29 de marzo de 2012, determinó modificar \nel artículo primero de la Resolución No. 0517 del 11 de mayo de 2004, en el \n\nResolución No.  00359           Del   28 de febrero de 2023            Hoja No. 23 de 42\n“POR LA CUAL SE RESUELVE EL RECURSO DE REPOSICIÓN INTERPUESTO \nCONTRA LA RESOLUCIÓN No. 01192 DEL 07 DE JUNIO DE 2022 Y SE ADOPTAN \nOTRAS DETERMINACIONES”\nOficinas: Carrera 13 A No. 34 – 72 Edificio 13 35 Pisos 8 Bogotá, D.C.\nCentro de Orientación y Radicación de Correspondencia: Carrera 13 A No. 34 – 72 Edificio 13 35 \nLocales 110 al 112 Bogotá, D.C.  \nCódigo Postal 110311156\nNit.: 900.467.239-2\nLínea de Orientación y Contacto Ciudadano: 57 (1) 2540100 / 018000112998 PBX: 57 (1) 2540111\nwww.anla.gov.co    Email: licencias@anla.gov.co  \nPágina 23 de 42\nsentido de adicionar una nueva línea de transporte de crudo de 30\". Así las \ncosas la construcción de la referida línea de 30” aludida en el escrito de \nimpugnación, fue autorizada por esta Entidad dentro de la Licencia Ambiental \npara el proyecto “Construcción del Oleoducto Castilla - Apiay”, bajo los criterios \ntécnicos y jurídicos de la valoración administrativa.\n<0000>\nA través de la Resolución No. 0374 del 11 de abril de 2014, la ANLA autorizó la \ncesión de la Licencia Ambiental otorgada a través de la Resolución No. 0517 \ndel 11 de mayo de 2004, junto con sus aclaratorias y sus modificatorias, a favor \nde CENIT TRANSPORTE Y LOGISTICA DE HIDROCARBUROS S.A.S, razón \npor la cual a partir de la firmeza de la resolución de cesión, ECOPETROL S.A, \ndejó de ser la titular del instrumento ambiental.\n<0000>\nConforme  el Auto No. 04623  del 08 de agosto de 2018, por el cual se inició el \nprocedimiento sancionatorio ambiental, la calidad de investigada dentro del \nreferido trámite  solamente la ostenta la sociedad CENIT TRANSPORTE Y \nLOGISTICA DE HIDROCARBUROS S.A.S, teniendo en cuenta que los hechos \nque dieron origen a la investigación fueron evidenciados en visita de \nseguimiento llevada a cabo el 21 de octubre de 2015, cuyos resultados \nquedaron consignados en el Concepto Técnico No. 4867 del 23 de septiembre \nde 2016, sin que dentro del auto en comento se evidencie la vinculación de \nECOPETROL S.A como investigada, entidad que para dicha fecha, ya no era la \ntitular de la Licencia. \n<0000>\nPor último, se destaca que los hechos por los cuales se dio inicio al \nprocedimiento sancionatorio ambiental a través del Auto No. 04623 del 08 de \nagosto de 2018, se encuentran asociados a la ya referida Resolución No. 0203 \ndel 29 de marzo de 2012, en la cual se autorizó la línea de transporte de crudo \nde 30”, tal y como se expuso en párrafos precedentes.\nEn línea con lo anteriormente expuesto, el Concepto Técnico No. 06882 del 08 de \nnoviembre de 2022, el cual sirve de fundamento para la motivación de la presente \ndecisión, expone lo siguiente:\n“(…)\nCabe mencionar que, en un principio la sociedad ECOPETROL S.A. era la \nresponsable de la licencia ambiental otorgada mediante la Resolución 517 del 11 de \nmayo de 2004 por el entonces Ministerio de Ambiente, Vivienda y Desarrollo   \nTerritorial – MVDT para la construcción del oleoducto Castilla-Apiay, que fue \nmodificada por la Resolución 203 del 29 de   marzo de 2012;   luego, a través de la \nResolución 374 del 11 de abril de 2014, la ANLA autorizó la cesión total de los  \nderechos y obligaciones originados y derivados de la Licencia Ambiental a favor de \nla sociedad CENIT Transporte y Logística de Hidrocarburos S.A.S., siendo ahora \nCENIT el responsable ambiental del proyecto de hidrocarburos.\nAhora bien, a lo largo de su escrito de reposición con radicación 2022136613-1-000 \ndel 05 de julio de 2022, el señor Cruz Romero reitera el incumplimiento por parte de \nla sociedad ECOPETROL S.A. de las obligaciones impuestas por el entonces \nMinisterio de Ambiente, Vivienda y Desarrollo Territorial - MAVDT en los Artículos \nSegundo, Décimo Primero y Décimo Séptimo de la Resolución 517 del 11 de mayo \nde 2004 referentes a la construcción del oleoducto Castilla-Apiay de 43,2 km \nde longitud y un diámetro de 16 pulgadas, así:\n(…)\n\nResolución No.  00359           Del   28 de febrero de 2023            Hoja No. 24 de 42\n“POR LA CUAL SE RESUELVE EL RECURSO DE REPOSICIÓN INTERPUESTO \nCONTRA LA RESOLUCIÓN No. 01192 DEL 07 DE JUNIO DE 2022 Y SE ADOPTAN \nOTRAS DETERMINACIONES”\nOficinas: Carrera 13 A No. 34 – 72 Edificio 13 35 Pisos 8 Bogotá, D.C.\nCentro de Orientación y Radicación de Correspondencia: Carrera 13 A No. 34 – 72 Edificio 13 35 \nLocales 110 al 112 Bogotá, D.C.  \nCódigo Postal 110311156\nNit.: 900.467.239-2\nLínea de Orientación y Contacto Ciudadano: 57 (1) 2540100 / 018000112998 PBX: 57 (1) 2540111\nwww.anla.gov.co    Email: licencias@anla.gov.co  \nPágina 24 de 42\nAl respecto, se debe indicar que la apertura de investigación sancionatoria a la que \nrefiere el Auto 4623 del 8 de agosto de 2018  y que es objeto de este análisis, se \ngeneró a partir de las observaciones efectuadas por la ANLA en la visita de \nseguimiento del día 21 de octubre de 2015, que quedaron plasmadas en el Concepto \nTécnico 1097 del 15 de marzo de 2016 y sirvieron de fundamento para la expedición \ndel Auto 1306 del 12 de abril de 2016; donde se dejó en evidencia que con ocasión \nde la construcción de la nueva línea de transporte de crudo de 30\" (a partir de \nla estación de bombeo Castilla 2, ubicada en el municipio de Castilla La Nueva, con \nuna longitud de 42 km), autorizada mediante la Resolución 0203 del 29 de marzo \nde 2012, no se había realizado un manejo efectivo de las aguas de escorrentía \nconforme con lo establecido en la Ficha de manejo 7 del Plan de Manejo Ambiental. \nEn este sentido, lo enunciado por el señor Cruz Romero en la referida radicación \n(2022136613-1-000 del 05 de julio de 2022), no se podría asociar con la \nconstrucción y el manejo ambiental del oleoducto de 30” que es objeto de la presente \ninvestigación sancionatoria.\n(…)”\nConforme lo expuesto, esta Autoridad Ambiental considera que las alusiones \nefectuadas por el recurrente respecto a “Incumplimientos” presuntamente \nperpetrados por ECOPETROL S.A, resultan a todas luces alejadas del escenario \ndentro del cual se enmarcó la investigación iniciada a través del Auto No. 04623 del \n08 de agosto de 2018, al evidenciarse que: \na) Para la fecha de los hechos relacionados en el referido auto de apertura de \ninvestigación , esto es el 21 de octubre de 2015, ECOPETROL S.A ya no \nostentaba la titularidad de la Licencia Ambiental y , \nb) Los acontecimientos por los cual se inició el trámite sancionatorio ambiental, los \ncuales se concentran en no haber realizado un manejo efectivo de las aguas de \nescorrentía conforme con lo establecido en la Ficha de manejo 7 del Plan de \nManejo Ambiental, se encuentran asociados a la Resolución No. 0203 del 29 de \nmarzo de 2012, referente a  la línea de transporte de crudo de 30\",  y no a la \nResolución No. 0517 del 11 de mayo de 2004 “referente a la construcción del \noleoducto Castilla-Apiay de 43,2 km de longitud y un diámetro de 16 pulgadas”.\nDecantado lo anterior frente a al sujeto pasivo de la acción sancionatoria que se \nadelanta en el expediente SAN0094-00-2016, así como el contexto fáctico sobre la \ncual aquella recae, desciende el despacho a realizar las siguientes consideraciones \nen punto del Principio de Precaución.\nEl artículo primero de la Ley 99 de 1993 “Por la cual se crea el Ministerio del Medio \nAmbiente, se reordena el Sector Público encargado de la gestión y conservación \ndel medio ambiente y los recursos naturales renovables, se organiza el Sistema \nNacional Ambiental, SINA y se dictan otras disposiciones” , estableció dentro del \nordenamiento  jurídico nacional, los Principios Generales Ambientales.\nAsí, en el numeral 6 de la referida disposición, el legislador colombiano introdujo el \ndenominado Principio de Precaución, así\n“6. La formulación de las políticas ambientales tendrá en cuenta el resultado del \nproceso de investigación científica. No obstante, las autoridades ambientales y los \nparticulares darán aplicación al principio de precaución conforme al cual, cuando \nexista peligro de daño grave e irreversible, la falta de certeza científica absoluta no \n\nResolución No.  00359           Del   28 de febrero de 2023            Hoja No. 25 de 42\n“POR LA CUAL SE RESUELVE EL RECURSO DE REPOSICIÓN INTERPUESTO \nCONTRA LA RESOLUCIÓN No. 01192 DEL 07 DE JUNIO DE 2022 Y SE ADOPTAN \nOTRAS DETERMINACIONES”\nOficinas: Carrera 13 A No. 34 – 72 Edificio 13 35 Pisos 8 Bogotá, D.C.\nCentro de Orientación y Radicación de Correspondencia: Carrera 13 A No. 34 – 72 Edificio 13 35 \nLocales 110 al 112 Bogotá, D.C.  \nCódigo Postal 110311156\nNit.: 900.467.239-2\nLínea de Orientación y Contacto Ciudadano: 57 (1) 2540100 / 018000112998 PBX: 57 (1) 2540111\nwww.anla.gov.co    Email: licencias@anla.gov.co  \nPágina 25 de 42\ndeberá utilizarse como razón para postergar la adopción de medidas eficaces para \nimpedir la degradación del medio ambiente.” (Subrayado insertado) \nAhora bien, en relación a la aplicación del referido principio por parte de las \nAutoridades Ambientales, la Corte Constitucional en sentencia C-293 de 20023, \nrealizó las siguientes consideraciones:\n“(…)Al leer detenidamente el artículo (…) se llega a la conclusión de que, cuando la \nautoridad ambiental debe tomar decisiones específicas, encaminadas a evitar un \npeligro de daño grave, sin contar con la certeza científica absoluta, lo debe hacer de \nacuerdo con las políticas ambientales trazadas por la ley, en desarrollo de la \nConstitución, en forma motivada y alejada de toda posibilidad de arbitrariedad o \ncapricho.\nPara tal efecto, debe constatar que se cumplan los siguientes elementos : \n 1.Que exista peligro de daño;\n2. Que éste sea grave e irreversible;\n \n3. Que exista un principio de certeza científica, así no sea ésta absoluta;\n \n4. Que la decisión que la autoridad adopte esté encaminada a impedir la degradación \ndel medio ambiente.\n \n5. Que el acto en que se adopte la decisión sea motivado.\nEs decir, el acto administrativo por el cual la autoridad ambiental adopta decisiones, sin \nla certeza científica absoluta, en uso del principio de precaución, debe ser excepcional \ny motivado.  (…) . Esto hace que la decisión de la autoridad se enmarque dentro del \nEstado de Derecho, en el que no puede haber decisiones arbitrarias o caprichosas (…)” \n(Subrayado dentro del texto ).\nPor otra parte, la doctrina especializada, en particular los profesores Gloria Amparo \nRodríguez, Álvaro José Henao Mera y Andrés Gómez Rey, indican respecto al tema, \nlo siguiente:\n“(…)\nEn consecuencia, el principio de precaución se ha constituido como uno de los pilares \ndel derecho ambiental nacional e internacional (…) asimismo, se ha recogido en el \námbito interno de Colombia tanto en la ley como en la jurisprudencia.\n(…)\nSu consagración legal se encuentra en la Ley 99 de 1993 en el artículo 1° numeral 6° \n(…), aplicado por los altos tribunales colombianos. Este principio debe colegir en cada \ncaso concreto ante un riesgo que puede ocasionar un daño en la salud o en el ambiente \nque se pretenda y se requiera evitar. La importancia en la utilización de dicho principio \nradica en el hecho de mantener una postura razonablemente preventiva frene a los \nposibles efectos adversos que determinadas actividades puedan generar (…)” 4 .\n3 Corte Constitucional de Colombia-Sentencia C-293 del 23 de abril de 2002. Magistrado Ponente: Alfredo \nBeltrán Sierra. \n4 Gómez Rey, Andrés; Henao Mera, Álvaro José; Rodríguez, Gloria Amparo. “Autorizaciones Ambientales- Licencias, \npermisos y concesiones en la realidad colombiana”. Editorial Legis- Universidad del Rosario, Primera Edición. 2020. \nPág. 11.\n\nResolución No.  00359           Del   28 de febrero de 2023            Hoja No. 26 de 42\n“POR LA CUAL SE RESUELVE EL RECURSO DE REPOSICIÓN INTERPUESTO \nCONTRA LA RESOLUCIÓN No. 01192 DEL 07 DE JUNIO DE 2022 Y SE ADOPTAN \nOTRAS DETERMINACIONES”\nOficinas: Carrera 13 A No. 34 – 72 Edificio 13 35 Pisos 8 Bogotá, D.C.\nCentro de Orientación y Radicación de Correspondencia: Carrera 13 A No. 34 – 72 Edificio 13 35 \nLocales 110 al 112 Bogotá, D.C.  \nCódigo Postal 110311156\nNit.: 900.467.239-2\nLínea de Orientación y Contacto Ciudadano: 57 (1) 2540100 / 018000112998 PBX: 57 (1) 2540111\nwww.anla.gov.co    Email: licencias@anla.gov.co  \nPágina 26 de 42\nDel marco jurídico expuesto se desprende que el Principio de Precaución, irradia el \nordenamiento normativo ambiental nacional y que su aplicación por parte de las \nAutoridades Ambientales no puede desatarse de manera arbitraria, toda vez que \naquella se encuentra supeditada a la observancia o cumplimiento de los siguientes \nelementos, a saber: i) que exista peligro de daño , ii) que este sea grave e irreversible, \niii) que exista un principio de certeza científica, así no sea ésta absoluta; iv) que la \ndecisión que la autoridad adopte esté encaminada a impedir la degradación del medio \nambiente y finalmente, v) que el acto en que se adopte la decisión sea motivado.\nDescendiendo al  caso objeto de análisis, se tiene que a través de la radicación \n2014053250-1-000 del 01 de octubre de 2014, el señor Gonzalo Cruz Romero en su \ncondición de tercero interviniente dentro del trámite de la modificación de la Licencia \nAmbiental otorgada mediante Resolución No. 0517 del  11 de mayo de 2004,  remitió \na la ANLA copia de la comunicación dirigida a ECOPETROL S.A. invocando el principio \nde precaución y el derecho fundamental de protección del recurso hídrico precisando \nentre otros puntos  “señales de ALERTA frente al daño que va a ocurrir con el trazado del \noleoducto de 30 pulgadas y el vertimiento de 42 pulgadas sobre el humedal y sitio de recarga \ndel caño Los Hornos. Esta advertencia la hemos hecho reiteradamente mostrando como el \nCaño Los Hornos es una fuente de aguas veraneras”.\nLuego,  conforme se desprende de los antecedentes de la actuación administrativa, se \ntiene que la referida  comunicación fue atendida por esta Autoridad Ambiental a través \ndel oficio con radicación 4120- E2-64958  del 21 de noviembre de 2014, escrito en el \ncual se precisó al señor Cruz Romero, entre otros puntos que “(…) el cruce sobre el Caño \nLos Hornos se encuentra autorizado dentro de la Licencia Ambiental otorgada para el \nOleoducto Castilla - Apiay (Resolución 517 del 11 de mayo de 2004) autorización que tuvo en \ncuenta lineamientos técnicos y jurídicos evaluados por esta Autoridad y que ampararon su \nviabilidad (…)”.\nAdicionalmente en el referido oficio se indicó que: \n“(…) en la próxima visita de seguimiento que se realice al proyecto se verificará el \nestado actual de la quebrada los Hornos y sus afluentes, con el fin de conceptuar al \nrespecto y si es del caso adoptar las medidas a que haya lugar.\nAdicionalmente, se va a solicitar a la empresa CENIT- Transporte y Logística de \nHidrocarburos, actual titular de la licencia ambiental del oleoducto Castilla Apiay, \ninforme a esta Autoridad las medidas de manejo ambiental que ha implementado o va \na implementar en el cruce sobre el Caño los Hornos, donde se tena en cuenta la \nobservación presentada en su comunicación en la que manifiesta su preocupación por \nla afectación de la microcuenca del Caño  Los Hornos, ante la construcción del cruce \nde la línea de 30” del oleoducto Castila Apiay.\n(…)” \nEn armonía con lo indicado en el oficio 4120-E2-64958 del 21 de noviembre de 2014 \npreviamente referenciado, la ANLA a través del oficio con radicación 4120-E2-64956 \ndel 21 de noviembre de 2014, requirió a la sociedad CENIT TRANSPORTE Y \nLOGÍSTICA DE HIDROCARBUROS S.A.S, titular del instrumento ambiental, para \nefectos de que “(…) se informe a esta Autoridad las medidas de manejo ambiental que ha \nimplementado o va a implementar la Empresa en el cruce sobre el Caño Los Hornos, donde \nse tenga en cuenta la observación presentada por el señor Gonzalo Cruz Romero (…).  \n\nResolución No.  00359           Del   28 de febrero de 2023            Hoja No. 27 de 42\n“POR LA CUAL SE RESUELVE EL RECURSO DE REPOSICIÓN INTERPUESTO \nCONTRA LA RESOLUCIÓN No. 01192 DEL 07 DE JUNIO DE 2022 Y SE ADOPTAN \nOTRAS DETERMINACIONES”\nOficinas: Carrera 13 A No. 34 – 72 Edificio 13 35 Pisos 8 Bogotá, D.C.\nCentro de Orientación y Radicación de Correspondencia: Carrera 13 A No. 34 – 72 Edificio 13 35 \nLocales 110 al 112 Bogotá, D.C.  \nCódigo Postal 110311156\nNit.: 900.467.239-2\nLínea de Orientación y Contacto Ciudadano: 57 (1) 2540100 / 018000112998 PBX: 57 (1) 2540111\nwww.anla.gov.co    Email: licencias@anla.gov.co  \nPágina 27 de 42\nDicho llamamiento fue atendido por la referida sociedad mediante radicado \n2014068168-1-000 del 09 de diciembre de 2014, en el cual se precisó entre otras cosas \nque “(…) a la fecha, las obras tendientes a la construcción del proyecto no han dado inicio” \n(…)”\nDe lo expuesto hasta este punto, el despacho se permite exaltar los siguientes puntos:\nEn primera medida, la comunicación con radicado 2014053250-1-000 del 01 de octubre \nde 2014 fue presentada por el señor Gonzalo Cruz Romero, con posterioridad a la \nexpedición de las Resoluciones No. 0203 del 29 de marzo de 2012 y 0374 del 11 de \nabril de 2014, a través de las cuales la ANLA autorizó respectivamente, la línea de \ntransporte de crudo de 30\" y la cesión del instrumento ambiental, a favor de la sociedad \nCENIT TRANSPORTE Y LOGISTICA DE HIDROCARBUROS S.A.S.\nAunado a lo anterior, y conforme lo indicado en el Concepto Técnico No. 06882 del 08 \nde noviembre de 2022, se tiene que aquella se “(…) trató del manifiesto de una posible \nafectación ambiental que sucedería con ocasión de la construcción del oleoducto de 30 \npulgadas autorizado mediante la Resolución 203 del 29 de marzo de 2012, sin presentar \nevidencias técnicas que permitieran comprobar para ese entonces, que la predicción descrita \ndentro de dicha comunicación, en efecto, se concretaría en una afectación ambiental durante \nla etapa de construcción del proyecto (…) (Subrayado insertado). \nPor otra parte, se establece que para la fecha de la referida radicación, la construcción \ndel proyecto autorizado en la Resolución No. 0203 del 29 de marzo de 2012, aún no \nse había iniciado, toda vez que aquellas actividades, tal y como lo menciona el referido \nconcepto, se empezaron a ejecutar solamente “(…) hasta el primer semestre del año \n2015.”\nDe lo anteriormente expuesto, se puede colegir entonces, que del radicado \n2014053250-1-000 del 01 de octubre de 2014, así como de las actuaciones \nadministrativas emitidas por la ANLA con el fin de atender la referida misiva, no se \ndesprendía la presencia de indicios con fundamento científico, que permitiesen \ndeterminar la posible ocurrencia del “presunto daño”, al cual se aludía en aquella. \nAhora bien, en el medio de impugnación propuesto, se hace alusión a los siguientes \nescritos, los cuales fueron allegados  a la ANLA en  el año 2015:\n-\nRadicado 2015016595-1-000 del 25 de marzo de 2015, en el cual los señores \nMiguel Ángel Cruz Romero y Hernando Cruz Romero, presentaron memorial \nalusivo al (…) análisis deductivo del Daño Ambiental, ocasionado por Ecopetrol \nS.A., con el proyecto Oleoducto Castilla Apiay EBA 16” construido en el año 2004 \n(…)” informando del  “(…) daño y delito ambiental a los recursos naturales, al medio \nambiente, con la  ocupación, intervención, perturbación de la estructura física del \nlecho natural del Humedal caño Hornos, Zona de Nacimientos de agua de la \nRecarga Hídrica de la Subcuenca del Río Guayuriba (…)”.\n-\nRadicado 2015016596-1-000 del 25 de marzo del 2015, en el cual los mencionados \nseñores Cruz Romero allegaron copia de la queja interpuesta ante el MADS \nreferente al “(…) PRINCIPIO DE PRECAUCIÓN, PROTECCIÓN AL HUMEDAL \nCAÑO HORNOS, ZONA DE RECARGA HÍDRICA DE LA SUBCUENCA DEL RÍO \nGUAYURIBA (…)”.\n\nResolución No.  00359           Del   28 de febrero de 2023            Hoja No. 28 de 42\n“POR LA CUAL SE RESUELVE EL RECURSO DE REPOSICIÓN INTERPUESTO \nCONTRA LA RESOLUCIÓN No. 01192 DEL 07 DE JUNIO DE 2022 Y SE ADOPTAN \nOTRAS DETERMINACIONES”\nOficinas: Carrera 13 A No. 34 – 72 Edificio 13 35 Pisos 8 Bogotá, D.C.\nCentro de Orientación y Radicación de Correspondencia: Carrera 13 A No. 34 – 72 Edificio 13 35 \nLocales 110 al 112 Bogotá, D.C.  \nCódigo Postal 110311156\nNit.: 900.467.239-2\nLínea de Orientación y Contacto Ciudadano: 57 (1) 2540100 / 018000112998 PBX: 57 (1) 2540111\nwww.anla.gov.co    Email: licencias@anla.gov.co  \nPágina 28 de 42\n-\nRadicado 2015017514-1-000 del 30 de marzo de 2015, correspondiente al traslado \na la ANLA por parte de la Procuraduría 6 Judicial II Agraria y Ambiental del Meta – \nVaupés y Vichada de las solicitudes realizadas por los señores Miguel Ángel Cruz \nRomero y Hernando Cruz Romero, en el que además, el referido Ente de Control \nsolicitó a la ANLA emitir pronunciamiento donde se fundamente con claridad la \nprocedencia o no de la aplicación del principio de precaución.\nFrente a las radicaciones 2015016595-1-000 y 2015016596-1-000 del 25 de marzo \nde 2015, encuentra el despacho que la ANLA brindó respuesta a aquellas mediante \noficio 2015016595-2-000 del 13 de abril de 2015, documento frente al cual el \nConcepto Técnico No. 06682 del 08 de noviembre de 2022, realiza el siguiente \nanálisis:\n“(…)\nla ANLA mediante oficio 2015016595-2-000 del 13 de abril de 2015 da respuesta a las \ncomunicaciones interpuestas por los señores Cruz Romero (radicaciones 2015016595-\n1-000 del 25 de marzo de 2015 y 2015016596-1- 000 del 25 de marzo del 2015 y \nademás sirvió de soporte para responder los requerimientos de la radicación \n2015017514- 1-000 del 30 de marzo de 2015) reiterando que el proyecto Oleoducto \nCastilla-Apiay de 43,2 km de longitud y un diámetro de 16 pulgadas estaba autorizado \ncon Licencia Ambiental otorgada mediante Resolución 517 del 11 de mayo de 2004 \npara su construcción y operación y que a partir de los seguimiento realizados al mismo \n(Auto 2562 de 26 de Agosto de 2008 y Auto 3012 del 21 de septiembre de 2012) no se \nevidenció incumplimientos en las obligaciones relacionadas con el Caño Hornos. \nAunado a esto, que según lo dispuesto en el numeral 5 del Artículo Sexto de la \nResolución 203 del 29 de marzo de 2012 (que autorizó adicionar una nueva línea de \ntransporte de crudo 30”) se autorizó un total de 78 cruces subfluviales por medio de \nexcavación a cielo abierto entre los que se encuentra el cruce en el caño Hornos; en tal \nsentido, que el cruce por el caño en mención es una actividad autorizada por la ANLA \nuna vez fueron evaluados y analizados los impactos ambientales y formuladas las \nrespectivas las medidas de manejo, por lo que no se evidencia el posible daño \nambiental al que se refieren los denunciantes ni las actividades ilegales.\nEspecíficamente sobre la aplicación del principio de precaución, el oficio 2015016595-\n2-000 del 13 de abril de 2015 indicó que la ANLA dentro del trámite de licenciamiento \nambiental exigió previo al otorgamiento de la Licencia la presentación de estudios que \npermitieran evaluar la viabilidad de otorgar o no dicha de licencia (radicaciones 4120-\nE1-3464 del 26 de enero de 2004 y 4120-E1-122614 del 24 de septiembre de 2010); \nque el principio de precaución se aplica cuando no hay certeza científica de los riesgos \no daños que podría ocasionar un proyecto, luego entonces a este momento no hay \nevidencia de posibles afectaciones que sufre el caño Los Hornos - Mitú. Así pues, se \nreitera la no ocurrencia de un posible daño ambiental.\n(…)”\nAunado a lo anterior se tiene que la ANLA, mediante oficio con radicado 2015017514- \n-001 del 24 de abril de 2015, atendió el oficio 2015017514-1-000 del 30 de marzo de \n2015, presentado por la Procuraduría 6 Judicial II Agraria y Ambiental del Meta –\nVaupés y Vichada indicando que se brindó respuesta a los señores Cruz Romero, \nmediante oficio 2015016595-2-001 del 13 de abril de 2015.\nDe lo descrito en los párrafos precedentes, en particular, de la valoración realizada en \nel Concepto Técnico No. 06682 del 08 de noviembre de 2022, es dable para esta \nAutoridad Nacional abstraer las siguientes consideraciones: \n\nResolución No.  00359           Del   28 de febrero de 2023            Hoja No. 29 de 42\n“POR LA CUAL SE RESUELVE EL RECURSO DE REPOSICIÓN INTERPUESTO \nCONTRA LA RESOLUCIÓN No. 01192 DEL 07 DE JUNIO DE 2022 Y SE ADOPTAN \nOTRAS DETERMINACIONES”\nOficinas: Carrera 13 A No. 34 – 72 Edificio 13 35 Pisos 8 Bogotá, D.C.\nCentro de Orientación y Radicación de Correspondencia: Carrera 13 A No. 34 – 72 Edificio 13 35 \nLocales 110 al 112 Bogotá, D.C.  \nCódigo Postal 110311156\nNit.: 900.467.239-2\nLínea de Orientación y Contacto Ciudadano: 57 (1) 2540100 / 018000112998 PBX: 57 (1) 2540111\nwww.anla.gov.co    Email: licencias@anla.gov.co  \nPágina 29 de 42\nEn los memoriales allegados por los señores Cruz Romero a través de las \nradicaciones 2015016595-1-000 y 2015016596-1-000 del 25 de marzo de 2015, se \nhizo referencia a “(…) un posible daño ambiental asociado a la construcción del oleoducto \nCastilla Apiay de 43,2 km de longitud y un diámetro de 16 pulgadas y no a la construcción de \nla nueva línea de transporte de crudo de 30 pulgadas que es el que nos ocupa en la presente \ninvestigación”, tal y como lo precisa el mencionado Concepto Técnico. \nPor otra parte, se observa que la ANLA, en  el oficio con radicación  2015016595-2-\n000 del 13 de abril de 2015, fue expresa en indicar que  la referida “construcción del \noleoducto Castilla Apiay de 43,2 km de longitud y un diámetro de 16 pulgadas” contaba \ncon la debida Licencia Ambiental otorgada mediante Resolución No. 0517 del 11 de \nmayo de 2004. \nAdicionalmente, en el oficio 2015016595-2-000 del 13 de abril de 2015, frente a la \ntemática de las servidumbres, el despacho encuentra que esta Autoridad Nacional \naclaró a los señores Cruz Romero, lo siguiente:  \n“(…) \nEn cuanto a la servidumbre impuesta sobre los predios las Brisas y Cucharito \nlocalizados en las veredas Quebraditas del municipio de Acacias - Meta, la ley 1274 \nde 2009, regula el trámite de servidumbres como una negociación directa entre el \ninteresado y el propietario, poseedor u ocupante del predio o terreno que se va a \nocupar, como se dio en el presente caso, por lo tanto, aquella no es materia de \nconocimiento de esta Autoridad ni hace parte del procedimiento de licenciamiento \nambiental.\nComo corolario de lo anterior, se establece que el foro para dirimir los conflictos \nrelativos a las indemnizaciones patrimoniales vinculadas a la actividad petrolífera es el \nde la jurisdicción ordinaria, a la cual todo Colombiano tiene derecho de acudir para que \nsean reconocidos sus derechos, como en el caso que nos ocupa, de orden patrimonial \nprivado, luego entonces esta Autoridad no está facultada para tomar determinaciones \nsobre los supuestos indicados en su petición sobre la afectación de sus predios.\n(…)”\nPor otra parte, del análisis efectuado en el Concepto Técnico No. 06682 del 08 de \nnoviembre de 2022, se destaca que, previo análisis de los impactos ambientales así \ncomo de las respectivas medidas de manejo ambiental, en la Resolución No. 203 del \n29 de marzo de 2012 - acto administrativo en el cual se  dio viabilidad a  la  nueva \nlínea de transporte de crudo 30”-  se autorizaron cruces subfluviales por medio de \nexcavación a cielo abierto,  dentro de los cuales se contempló el cruce del Caño \nHornos y  adicionalmente que “a partir de los seguimiento realizados al mismo (Auto 2562 \nde 26 de Agosto de 2008 y Auto 3012 del 21 de septiembre de 2012) no se evidenció \nincumplimientos en las obligaciones relacionadas con el Caño Hornos.”\nPor último se resalta que, frente al principio de precaución, en el oficio 2015016595-\n2-000 del 13 de abril de 2015, la ANLA indicó de manera puntual que aquel “(…) se \naplica cuando no hay certeza científica de los riesgos o daños que podría ocasionar un \nproyecto (…) Luego, en este momento no hay evidencia de las posibles afectaciones que \nsufre el caño señalado (…)”  (Subrayado insertado). \nLuego, pese a lo señalado en el  referido oficio, en el cual la ANLA fue concluyente  \nen señalar a los señores Cruz Romero  que conforme al Principio de Precaución , a \nfecha no se presentaban evidencias que dieran lugar a posibles afectaciones \n\nResolución No.  00359           Del   28 de febrero de 2023            Hoja No. 30 de 42\n“POR LA CUAL SE RESUELVE EL RECURSO DE REPOSICIÓN INTERPUESTO \nCONTRA LA RESOLUCIÓN No. 01192 DEL 07 DE JUNIO DE 2022 Y SE ADOPTAN \nOTRAS DETERMINACIONES”\nOficinas: Carrera 13 A No. 34 – 72 Edificio 13 35 Pisos 8 Bogotá, D.C.\nCentro de Orientación y Radicación de Correspondencia: Carrera 13 A No. 34 – 72 Edificio 13 35 \nLocales 110 al 112 Bogotá, D.C.  \nCódigo Postal 110311156\nNit.: 900.467.239-2\nLínea de Orientación y Contacto Ciudadano: 57 (1) 2540100 / 018000112998 PBX: 57 (1) 2540111\nwww.anla.gov.co    Email: licencias@anla.gov.co  \nPágina 30 de 42\nambientales , se tiene que a través  del radicado  2015053796-1-000 del 13 de octubre \nde 2015,  la Contraloría Departamental del Meta remitió por competencia a esta \nEntidad, memorial enviado por el señor Miguel Ángel Cruz Romero, en la cual se \ndesvelaban presuntos daños ambientales ocasionados por la construcción del \noleoducto, línea 30”, sobre humedales y cauce natural de los caños Hornos y Mitú en \nla vereda Quebraditas del municipio de Acacías departamento del Meta.\nAsí,  con el propósito de  atender  el mentado escrito, la ANLA, en ejercicio de sus \nfacultades de seguimiento y control ambiental,  efectuó visita  el día 21 de octubre de \n2015 al oleoducto Castilla-Apiay, cuyos resultados fueron consignados en el Concepto \nTécnico No. 1097 del 15 de marzo de 2016 -atendido jurídicamente en el Auto No. \n1306 del 12 de abril de 2016 y en el cual se indicó entre otras cosas que  las \nactividades constructivas se estaban desplegando conforme a las determinaciones \nadoptadas en el Resolución No. 0203 del 29 de marzo de 2012. \nEn efecto, en lo que corresponde a las mentadas actuaciones administrativas, el \nConcepto Técnico No. 06882 del 08 de noviembre de 2022, resalta lo siguiente:\n“(…)  \nla ANLA realizó visita de seguimiento el día 21 de octubre de 2015 al oleoducto \nCastilla-Apiay II, emitiendo como resultado de dicha visita el Concepto Técnico 1097 \ndel 15 de marzo de 2016, que hace parte de las consideraciones del Auto 1306 del 12 \nde abril de 2016, donde se dejó en evidencia a la altura del km 1,8 del oleoducto, el \ndesarrollo de las actividades de adecuación de derecho de vía, apertura de zanja para \nel bajado y tendido de tubería de 30” a una profundidad mayor de 1,5 metros, en los \npuntos con coordenadas E: 1061181; N: 932685 y E: 1061425; N: 932661.\nAhora, continuado con el análisis de las evidencias encontradas en el seguimiento a \nla queja interpuesta por los señores Cruz Romero al que hace referencia el Concepto \nTécnico 1097 del 15 de marzo de 2016 se encontró al momento de la vista y \nespecíficamente a la altura del kilómetro 1,8 del oleoducto dentro de la servidumbre \nde los predios las Brisas y Cucharito la adecuación del derecho de la vía, la apertura \nde la zanja, bajado de la tubería y estado actual del área intervenida principalmente en \nlos Cruces de cuerpos de agua, además, que el trazado en este punto  “se ajusta a lo \ndispuesto  en los Artículos Segundo y Tercero de la Resolución 203 de 29 de marzo \nde 2012; igualmente el DDV se ajusta a lo estipulado siendo este de 20 metros de \nancho en los tramos paralelos a los proyectos lineales existentes como lo son el \nOleoductos Castilla-Apiay 16”, línea de vertimientos Estación Acacías-Guayuriba de \n36”, y 25 metros de ancho para el realineamiento 8 caño Los Hornos con una longitud \nde 885 metros”. En tal entendido, la sociedad se encontraba realizando las actividades \nconstructivas de acuerdo con  lo establecido en la resolución 203 del 29 de marzo de \n2012, específicamente en lo que respecta en el punto del caño Los Hornos.\nReferente a la presunta intervención, perturbación, ocupación permanente, sobre \nhumedales y cauces naturales de los caños Hornos y Mitú, el precitado seguimiento \nreiteró según lo dispuesto en el Numeral 5 del Artículo sexto de la Resolución 203 del \n29 de marzo de 2012, que la Licencia Ambiental autorizó las ocupaciones de cauce \nsobre la fuente hídrica caño Los Hornos y que los cuatro (4) cruces georreferenciados \ndurante la visita se autorizaron dentro del permiso de ocupación de cauces de cuerpos \nde agua menores; además, que estas ocupaciones se encuentran excluidas de \nNacimientos de agua (manantiales), aljibes y pozos de agua junto con sus ronda \nperimetral de 100 metros.\n(…)”  (Subrayado insertado)\n\nResolución No.  00359           Del   28 de febrero de 2023            Hoja No. 31 de 42\n“POR LA CUAL SE RESUELVE EL RECURSO DE REPOSICIÓN INTERPUESTO \nCONTRA LA RESOLUCIÓN No. 01192 DEL 07 DE JUNIO DE 2022 Y SE ADOPTAN \nOTRAS DETERMINACIONES”\nOficinas: Carrera 13 A No. 34 – 72 Edificio 13 35 Pisos 8 Bogotá, D.C.\nCentro de Orientación y Radicación de Correspondencia: Carrera 13 A No. 34 – 72 Edificio 13 35 \nLocales 110 al 112 Bogotá, D.C.  \nCódigo Postal 110311156\nNit.: 900.467.239-2\nLínea de Orientación y Contacto Ciudadano: 57 (1) 2540100 / 018000112998 PBX: 57 (1) 2540111\nwww.anla.gov.co    Email: licencias@anla.gov.co  \nPágina 31 de 42\nEn armonía con lo considerado en el Concepto Técnico No. 06882 del 08 de \nnoviembre de 2022, frente a las actuaciones administrativas generadas por la ANLA \ncon ocasión de la visita técnica llegada a cabo el 21 de octubre de 2015  (Concepto \nTécnico No. 1097 del 15 de marzo de 2016  acogido  en el Auto No. 1306 del 12 de \nabril de 2016), el despacho considera que de aquellos, tampoco se desprendieron  \nindicios con sustento científico,  que permitiesen  dilucidar un eventual daño ambiental, \nderivado de la construcción del oleoducto y que recayese “sobre humedales y cauce \nnatural de los caños Hornos y Mitú en la vereda Quebraditas del municipio de Acacías \ndepartamento del Meta”.\nAhora bien,  frente a  la alusión del recurrente  referente a solicitar a esta Autoridad \nAmbiental que se acoja a lo determinado en el informe técnico 067-2014 titulado \n\"Presuntas afectaciones ambientales  ocasionadas a los Caños Hornos y Mitú, por la \nconstrucción del Oleoducto Castilla-Apiay II en el municipio de Acacias, Meta”, \nallegado a esta Entidad por parte de la Procuraduría Delegada para Asuntos \nAmbientales y Agrarios en el radicado 2015063281-1-000 del 26 de noviembre de \n2015, el despacho resalta  que el referido informe,  fue objeto de análisis por parte de \nla ANLA en el Concepto Técnico No. 1097 del 15 de marzo de 2016 acogido en el \nAuto No. 1306 del 12 de abril de 2016. \nAunado a lo anterior respecto al precitado informe así como en lo concerniente a las \nmencionadas actuaciones administrativas emitidas por la ANLA en el año 2016, el \npluricitado Concepto Técnico No. 06882 del 08 de noviembre de 2022, realiza la \nsiguiente valoración:\n“(…) \na través de la radicación 2015063281-1-000 del 26 de noviembre de 2015 la \nProcuraduría Delegada para Asuntos Ambientales y Agrarios remitió a la ANLA el \ninforme técnico 067-2014 titulado \" Presuntas afectaciones ambientales  ocasionadas \na los Caños Hornos y Mitú, por la construcción del Oleoducto Castilla-Apiay II en el \nmunicipio de Acacias, Meta\", generado a partir de una visita efectuada el 21 de octubre \nde 2015 en compañía de personal de CORMACARENA y ECOPETROL S.A. en el \nsector por donde discurren los caños Hornos y Mitú, vereda Quebraditas del municipio \nde Acacías – Meta  \n(…)\nDe acuerdo con el informe técnico en mención (067-2014), en los puntos de cruce del \nproyecto sobre el caño los Hornos se hicieron estructuras que permiten el flujo de agua \ny se evitó afectar la vegetación arbustiva y arbórea presente en particular en el boque \nde galería e individuos aislados, en general, se notó el cumplimiento de lo establecido \nen la Resolución 203 del 29 de marzo de 2012 en cuanto al permiso de ocupación de \ncauce y la implementación de las medidas de manejo ambiental, pero, se evidenció el \naporte de sedimentos no solo del agua de escorrentía sino del vertimiento del agua \nque se infiltraba a la excavación del oleoducto por nivel freático y la que aportaban \naguas lluvias.\n(…)\nDe lo anterior, es preciso traer al presente análisis que el Concepto Técnico 4867 del \n23 de septiembre de 2016, que sirvió de fundamento para la expedición del Auto 4623 \ndel 8 de agosto de 2018 , por el cual se ordenó el inicio del procedimiento  sancionatorio \nambiental del análisis que nos ocupa, donde se realizó la siguiente precisión, \nencaminada a dilucidar las diferencias conceptuales que se hicieron evidentes en el \n\nResolución No.  00359           Del   28 de febrero de 2023            Hoja No. 32 de 42\n“POR LA CUAL SE RESUELVE EL RECURSO DE REPOSICIÓN INTERPUESTO \nCONTRA LA RESOLUCIÓN No. 01192 DEL 07 DE JUNIO DE 2022 Y SE ADOPTAN \nOTRAS DETERMINACIONES”\nOficinas: Carrera 13 A No. 34 – 72 Edificio 13 35 Pisos 8 Bogotá, D.C.\nCentro de Orientación y Radicación de Correspondencia: Carrera 13 A No. 34 – 72 Edificio 13 35 \nLocales 110 al 112 Bogotá, D.C.  \nCódigo Postal 110311156\nNit.: 900.467.239-2\nLínea de Orientación y Contacto Ciudadano: 57 (1) 2540100 / 018000112998 PBX: 57 (1) 2540111\nwww.anla.gov.co    Email: licencias@anla.gov.co  \nPágina 32 de 42\nconcepto técnico 1097 del 23 de septiembre de 2016, entre un vertimiento y el manejo \nde aguas de escorrentía:\n“(…)\nRespecto a las aguas de escorrentía es importante definirlas como el agua lluvia que \ndiscurre por la superficie de un terreno, una vez se ha superado el índice de evaporación \ny la capacidad de infiltración del suelo, que son de origen natural,  producto de \ncondiciones climáticas locales y regionales, estas aguas no son producto de \nprocesos industriales ni domésticos, es decir no son aguas residuales. por esta razón \ndeben ser retornadas al medio implementando las medidas de manejo propuestas por la \nempresa y acogidas por la ANLA mediante la Resolución 203 del 29 de marzo de 2012.\nTomando lo expuesto en el Decreto 3930 de 2010. la Resolución 0631 de 2015 y Decreto \n1076 de 2015, los vertimientos puntuales corresponden a las aguas residuales \ndomésticas y no domésticas dentro de los procesos o actividades de las industrias. \nPara el caso puntual, las aguas de escorrentía no son producto de actividades \nindustriales durante la etapa de construcción del ducto, ya que no se han incorporado \ndentro de los procesos que requieren de agua como insumo, adicionalmente no se ha \nalterado su calidad debido a las actividades industriales,  las aguas de escorrentía como \nse evidencia en el Conceptos Técnicos de la Procuraduría (radicado 2015063281-1-\n000 de 26 de noviembre de 2015) y el Concepto Técnico de Seguimiento No 1097 (15 \nmarzo de 2016) son producto de la acumulación en la zanja del ducto (…)” Resaltado \nfuera de texto.\nLuego entonces, se confirma que las aguas de escorrentía como se evidencia en el \nConcepto Técnico de la Procuraduría 067-2014 (radicado 2015063281-1-000 de 26 de \nnoviembre de 2015) y el Concepto Técnico de Seguimiento 1097 (15 marzo de 2016) \nson producto de la acumulación en la zanja del ducto y no de actividades industriales, \npor lo que no es posible determinar que hubo incumplimiento de la Resolución 203 del \n29 de marzo de 2012. Ahora bien, a partir de estas precisiones, la ANLA determinó \nque aun cuando la Sociedad durante la etapa constructiva del oleoducto pudo haber \ntenido falencias en la implementación de la medida de manejo N°3 que se describe en \nla Ficha de manejo 7. Manejo de Aguas de Escorrentía, estas fueron atendidas \noportunamente la sociedad CENIT Transporte y Logística de Hidrocarburos S.A.S., en \ncumplimiento de los requerimientos establecidos en el Auto 1306 del 12 de abril de \n2016, además presentando soportes de laboratorio que desvirtúan una posible \nafectación o riesgo sobre los recursos en protección asociados al caño Los Hornos.\n(…)”\nEn armonía con todo lo analizado en el presente acápite, el despacho procede a \nrealizar las siguientes conclusiones:\na) De las diferentes comunicaciones presentadas por los señores Cruz Romero a \nesta Entidad , así como de las diferentes actuaciones desplegadas por la ANLA  \npara atenderlas -las cuales fueron desarrolladas en ejercicio de las facultades de \nseguimiento y control ambiental-, no se  desprendió la configuración  de indicios \ncon fundamento científico,  que permitiesen determinar la posible ocurrencia de \nun presunto daño ambiental respecto a los Caños Hornos y Mitú, derivado de las \nactividades relacionadas con el proyecto del cual trata la Resolución No.517 del \n11 de mayo de 2004, modificado por la Resolución No. 203 del 29 de marzo de \n2012 (sus modificatorias y aclaratorias). \nEn ese orden de ideas y atendiendo al marco jurídico señalado en párrafos \nprecedentes, en particular los elementos decantados por la Corte Constitucional \nen la denotada sentencia  C-293 de 2002 ,  para las circunstancias fácticas objeto \nde estudio , esta Autoridad Nacional no evidenció la configuración de los requisitos \n\nResolución No.  00359           Del   28 de febrero de 2023            Hoja No. 33 de 42\n“POR LA CUAL SE RESUELVE EL RECURSO DE REPOSICIÓN INTERPUESTO \nCONTRA LA RESOLUCIÓN No. 01192 DEL 07 DE JUNIO DE 2022 Y SE ADOPTAN \nOTRAS DETERMINACIONES”\nOficinas: Carrera 13 A No. 34 – 72 Edificio 13 35 Pisos 8 Bogotá, D.C.\nCentro de Orientación y Radicación de Correspondencia: Carrera 13 A No. 34 – 72 Edificio 13 35 \nLocales 110 al 112 Bogotá, D.C.  \nCódigo Postal 110311156\nNit.: 900.467.239-2\nLínea de Orientación y Contacto Ciudadano: 57 (1) 2540100 / 018000112998 PBX: 57 (1) 2540111\nwww.anla.gov.co    Email: licencias@anla.gov.co  \nPágina 33 de 42\nexigidos para proceder a la aplicación del Principio de Precaución,  que \nsustentaran la debida motivación y expedición de una determinada decisión \nadministrativa, en cual dicho principio se empleara. \nb) Por otra parte, se considera oportuno recordar al recurrente que, tal y como lo \nseñala la doctrina especializada, la Licencia Ambiental “(…)  es precisamente ese \ninstrumento de manejo y control, en otras palabras, es la autorización que otorga la \nautoridad ambiental para la ejecución de un proyecto, obra o actividad que pueda producir \ndeterioro grave a los recursos naturales renovables o al medio ambiente o introducir \nmodificaciones considerables o notorias al paisaje”5 y que en el proceso de \nlicenciamiento ambiental (…) la autoridad competente evalúa los posibles impactos que \nlos proyectos, obras o actividades puedan generar (…)”6\nc) Ahora bien, en lo que atañe a la temática de las servidumbres, el despacho se \npermite recordar que la ANLA en el oficio con radicación  2015016595-2-000 del \n13 de abril de 2015, señaló  puntualmente a los señores Cruz Romero que  tanto \nel trámite como las controversias que se originaran  con ocasión aquella figura, no \nrecaen dentro del ámbito de competencia de esta Autoridad Ambiental,  \nprecisando que “(…) que el foro para dirimir los conflictos relativos a las indemnizaciones \npatrimoniales vinculadas a la actividad petrolífera es el de la jurisdicción ordinaria (…)”\nd) Por otra parte , se destaca que la apertura de investigación sancionatoria a la que \nrefiere el Auto No. 04623 del 08 de agosto de 2018 y que es  objeto de análisis \nesta decisión, se encuentra asociada a la presunta desatención en la cual incurrió \nCENIT  TRANSPORTE Y LOGISTICA DE HIDROCARBUROS S.A.S, mas no  \nECOPETROL S.A-, frente a lo determinado  en la Resolución No. 0203 del 29 de \nmarzo de 2012, en la cual se autorizó la construcción de la nueva línea de \ntransporte de crudo de 30\" (a partir de la estación de bombeo Castilla 2, ubicada \nen el municipio de Castilla La Nueva, con una longitud de 42 km).\nEn ese orden e ideas, lo atinente a las obras del oleoducto de 16 pulgadas, no se \npueden asociar con la construcción y el manejo ambiental del oleoducto de 30”, \nrelacionado con el trámite objeto del presente pronunciamiento.\nPara tales efectos, se considera oportuno traer a colación la figura 1 consignada \nen el Concepto Técnico No. 06882 del 08 de noviembre de 2022, con su \ncorrespondiente descripción, así:\n“(…)\nFinalmente, sobre las imágenes aportadas por el señor Cruz Romero en su \nescrito de reposición, tal y como se presenta a continuación, corresponden al \ncitado desvió del oleoducto de 16 pulgadas Castilla-Apiay que no está \nrelacionado con la investigación sancionatoria a la que refiere el Auto 4623 del \n8 de agosto de 2018. Asimismo, se determina en torno a las imágenes en \ncuestión que estas no constituyen evidencias técnicas que permitan comprobar \nque en efecto se concretó una afectación ambiental durante la etapa de \nconstrucción del proyecto.\n5 Ibid., Pág. 47\n6 Ibid., Pág. 50. \n\nResolución No.  00359           Del   28 de febrero de 2023            Hoja No. 34 de 42\n“POR LA CUAL SE RESUELVE EL RECURSO DE REPOSICIÓN INTERPUESTO \nCONTRA LA RESOLUCIÓN No. 01192 DEL 07 DE JUNIO DE 2022 Y SE ADOPTAN \nOTRAS DETERMINACIONES”\nOficinas: Carrera 13 A No. 34 – 72 Edificio 13 35 Pisos 8 Bogotá, D.C.\nCentro de Orientación y Radicación de Correspondencia: Carrera 13 A No. 34 – 72 Edificio 13 35 \nLocales 110 al 112 Bogotá, D.C.  \nCódigo Postal 110311156\nNit.: 900.467.239-2\nLínea de Orientación y Contacto Ciudadano: 57 (1) 2540100 / 018000112998 PBX: 57 (1) 2540111\nwww.anla.gov.co    Email: licencias@anla.gov.co  \nPágina 34 de 42\nFigura 1. Superposición de los trazados de los oleoductos del proyecto Construcción y operación Del \nOleoducto Castilla -Apiay de 16 pulgadas (línea negra) y de 30 pulgadas (línea morada), las ocupaciones de \ncauce sobre el caño Los Hornos autorizadas en el numeral 5 del Artículo Sexto de la Resolución 203 del 29 de \nmarzo de 2012 (puntos en color azul) y los puntos asociados al presunto desvío al que hace alusión el \nrecurrente en la Radicación 2022136613-1-000 del 05 de julio de 2022 (puntos en color amarillo), esto sobre \nuna imagen satelital con fecha de captura del 10 de enero de 2020.\n(…)” \ne) Finalmente, frente al hecho que motivó el inicio del procedimiento administrativo \nsancionatorio ambiental a la sociedad CENIT TRANSPORTE Y LOGISTICA DE \nHIDROCARBUROS S.A.S,  a través del Auto No. 04623 del 08 de agosto de \n2018, esto es “ no haber garantizado que las medidas adoptadas en la Ficha de Manejo \nNo. 7 Manejo de Aguas de Escorrentía, fueran efectivas para lograr el control del \nimpacto de aporte de sedimentos y materiales en los Caños Hornos y Mitú en la vereda \nQuebraditas del municipio de Acacias, Departamento del Meta, incurriendo con ello en \npresunta infracción de lo establecido en el parágrafo del Artículo Décimo Primero de la \nResolución No. 203 del 29 de marzo de 2012.” el despacho en armonía con la \nvaloración realizada en el No. Concepto Técnico No. 06882 del 08 de noviembre \nde 2022, reafirma  lo decidido en el acto administrativo recurrido, en el cual, entre \notras cosas se precisó:\n“(…)\nDe conformidad con lo expuesto, en el caso que nos ocupa se encuentra que \nla sociedad investigada no incurrió en una transgresión al contenido sustancial \ndel Artículo Décimo primero de la Resolución 203 del 29 de marzo de 2012, \npues a través de las visitas de seguimiento se pudo constatar que sí se \nimplementaron las medidas de manejo estipuladas en la Ficha No. 7 y que \ncuando \nla \nsociedad \nCENIT \nTRANSPORTE \nY \nLOGISTICA \nDE \nHIDROCARBUROS S.A.S. fue requerida a efectos de que mejorara la \nefectividad de dichas medidas, esta atendió lo exigido por esta Autoridad \nsubsanando las falencias que en principio se había observado durante la \nconstrucción de la tubería de 30”. Con ello, se tiene que además de haber dado \ninmediato cumplimiento a la solicitud de la Autoridad Ambiental, no se tiene \nevidencia de que se haya afectado el bien objeto de protección.\n(…)”\n\nResolución No.  00359           Del   28 de febrero de 2023            Hoja No. 35 de 42\n“POR LA CUAL SE RESUELVE EL RECURSO DE REPOSICIÓN INTERPUESTO \nCONTRA LA RESOLUCIÓN No. 01192 DEL 07 DE JUNIO DE 2022 Y SE ADOPTAN \nOTRAS DETERMINACIONES”\nOficinas: Carrera 13 A No. 34 – 72 Edificio 13 35 Pisos 8 Bogotá, D.C.\nCentro de Orientación y Radicación de Correspondencia: Carrera 13 A No. 34 – 72 Edificio 13 35 \nLocales 110 al 112 Bogotá, D.C.  \nCódigo Postal 110311156\nNit.: 900.467.239-2\nLínea de Orientación y Contacto Ciudadano: 57 (1) 2540100 / 018000112998 PBX: 57 (1) 2540111\nwww.anla.gov.co    Email: licencias@anla.gov.co  \nPágina 35 de 42\nCon base en todo lo expuesto, puede concluirse entonces que no prosperan los \nargumentos incoaos en el escrito contentivo del medio de impugnación propuesto, \nrazón por la cual la ANLA se mantiene en lo decidido en el acto administrativo \nrecurrido.\n2. Consideraciones de la ANLA frente a la cesación de procedimiento.\nProcede el despacho al pronunciarse frente a las consideraciones propuestas por el \nrecurrente, respecto a las causales de cesación de procedimiento sancionatorio \nambiental, en armonía con lo señalado en el acápite precedente, en el cual se dejó \npor sentado que para el presente caso: \ni) La ANLA no evidenció la configuración de los requisitos exigidos para proceder a \nla aplicación del Principio de Precaución.\nii) Tanto en el proceso de licenciamiento como en la licencia ambiental, la Autoridad \ncompetente, evalúa, analiza y tiene en cuenta los eventuales impactos que se \npuedan derivar de la ejecución del proyecto, obra o actividad a autorizar.  \niii) Esta Autoridad Ambiental no es competente para dirimir las diferencias o \ncontroversias que se deriven o se susciten con ocasión de las servidumbres, entre \nel propietario de un predio y el interesado. \niv)La acción sancionatoria ambiental promovida en el Auto No. 04623 del 08 de \nagosto de 2018, recae sobre la sociedad CENIT TRANSPORTE Y LOGISTICA \nDE HIDROCARBUROS S.A.S, no sobre ECOPETROL S.A, \nv) Dicha acción se desató por hechos asociados a una presunta desatención a las \ndisposiciones establecidas en la Resolución No. 0203 del 29 de marzo de 2012, \nla cual no configuró una transgresión al contenido sustancial de dicho acto \nadministrativo y por último,  \nvi)La ANLA, ha considerado las actuaciones adelantadas por los señores Cruz \nRomero ante esta Entidad y ante los distintos Entes de Control, tal y como se \ndesprende del Concepto Técnico No.02740 del 07 de mayo de 2020, que sirvió \nde fundamento para la expedición de la Resolución  No. 01192 del 07 de junio de \n2022;  así como también las actuaciones de seguimiento y control adelantadas \nreferentes al proyecto Construcción y Operación del oleoducto Castilla – Apiay, \nlos cuales sustentaron  la decisión de declarar la cesación del procedimiento \nsancionatorio ambiental, a través del referido acto administrativo\nAhora, descendiendo al tema examinado, sea lo primero destacar, el contenido del \nartículo 23 de la Ley 1333 del 21 de julio de 2009, el cual, en punto de la cesación de \nprocedimiento sancionatorio ambiental, determina lo siguiente:\n“ARTÍCULO 23. Cesación \nde \nprocedimiento. Cuando \naparezca \nplenamente \ndemostrada alguna de las causales señaladas en el artículo 9º del proyecto de ley, así \nserá declarado mediante acto administrativo motivado y se ordenará cesar todo \nprocedimiento contra el presunto infractor, el cual deberá ser notificado de dicha \ndecisión. La cesación de procedimiento solo puede declararse antes del auto de \nformulación de cargos, excepto en el caso de fallecimiento del infractor. Dicho acto \nadministrativo deberá ser publicado en los términos del artículo 71 de la ley 99 de 1993 \ny contra él procede el recurso de reposición en las condiciones establecidas en los \nartículos 51 y 52 del Código Contencioso Administrativo” (Subrayado insertado). \n\nResolución No.  00359           Del   28 de febrero de 2023            Hoja No. 36 de 42\n“POR LA CUAL SE RESUELVE EL RECURSO DE REPOSICIÓN INTERPUESTO \nCONTRA LA RESOLUCIÓN No. 01192 DEL 07 DE JUNIO DE 2022 Y SE ADOPTAN \nOTRAS DETERMINACIONES”\nOficinas: Carrera 13 A No. 34 – 72 Edificio 13 35 Pisos 8 Bogotá, D.C.\nCentro de Orientación y Radicación de Correspondencia: Carrera 13 A No. 34 – 72 Edificio 13 35 \nLocales 110 al 112 Bogotá, D.C.  \nCódigo Postal 110311156\nNit.: 900.467.239-2\nLínea de Orientación y Contacto Ciudadano: 57 (1) 2540100 / 018000112998 PBX: 57 (1) 2540111\nwww.anla.gov.co    Email: licencias@anla.gov.co  \nPágina 36 de 42\nConforme a lo establecido  en la referida norma, el argumento propuesto por el \nimpugnante en su escrito, en el cual indica que “(…) no se están cumpliendo las causales \nde Cesación del Procedimiento en Materia Ambiental pues el artículo 9 de la Ley 1333 de \n2009, exige para su concesión que se reúnan las siguientes causales (…), resulta \ndesacertado,  toda vez que del transcrito artículo 23  se desprende que para proceder \na la declaratoria de cesación de procedimiento a través de acto administrativo \ndebidamente motivado, deberá estar plenamente demostrada alguna de las causales \nprevistas en el artículo 9 de la Ley 1333 de 2009, y no todas de manera concomitante  \no conjunta.  \nAhora bien, para efectos del análisis de las precisiones efectuadas en el recurso frente \na cada una de las causales de cesación, procede el despacho a atender cada uno de \nellos, para cuyos efectos empleará la tabla que se describe a continuación:\nCausal de cesación \nestablecida en el \nartículo 9 de la Ley \n1333 de 2009\nArgumento propuesto en el \nrecurso\nConsideraciones de la ANLA\n1º. \nMuerte \ndel \ninvestigado cuando \nes \nuna \npersona \nnatural.\n“El \ninvestigado \nes \npersona \njurídica activa, pues se trata de la \nempresa \nCENIT \nTRANSPORTES Y LOGÍSITCA \nDE HIDROCARBUROS S.A.S  y \nECOPETROL S.A\nComo se ha indicado a lo largo de la \npresente decisión, el sujeto pasivo de la \nacción sancionatoria, únicamente es la \nsociedad CENIT TRANSPORTES Y \nLOGÍSITCA DE HIDROCARBUROS \nS.A.S, teniendo en cuenta que para la \nfecha de los hechos por los cuales se \ndio \ninicio \na \nla \ninvestigación \nsancionatoria a través del Auto No. \n04623 del 08 de agosto de 2018, fueron \nevidenciados en el año 2015, fecha \npara la cual la referida persona jurídica \nya era la titular del instrumento \nambiental. \nAdicionalmente, dicha causal no fue la \naplicada por esta Autoridad Ambiental \nen el acto administrativo controvertido.\n 2° Inexistencia del \nhecho investigado.\n“El hecho existe, por cuanto se \nestableció \nque \nhubo \nun \nincumplimiento \nde \nlas \nresoluciones 0517 de 11 de \nmayo de 2004(…) resolución \n0157 del 12 de febrero de 2004 \nde protección a Humedales (…) \nLa Ley 99 de 1993 (…) en \nespecial al Numeral 6 por \nincumplimiento a la Aplicación \ndel Principio de Precaución (…)\nTal y como se ha resaltado en el \npresente acto administrativo, el hecho \npor el cual se desató la investigación \nsancionatoria iniciada en el  Auto No. \n04623  del 08 de agosto de 2018, se \nconcentró en “no haber garantizado que \nlas medidas adoptadas en la Ficha de \nManejo No. 7 Manejo de Aguas de \nEscorrentía, fueran efectivas para lograr \nel control del impacto de aporte de \nsedimentos y materiales en los Caños \nHornos y Mitú en la vereda Quebraditas \ndel municipio de Acacias, Departamento \ndel \nMeta \n(…), \nconducta \nque \npresuntamente iba en contravía de las \ndisposiciones \nadoptadas \nen \nla \nResolución No. 0203 del 29 de marzo de \n2012. \nSin embargo, conforme a la valoración \nrealizada en el Concepto Técnico No. \n2740 del 07 de mayo de 2020, atendido \na través de la Resolución No.01192 del  \n07 \nde \njunio \nde \n2022 \ny \nlas \nconsideraciones del Concepto Técnico \n\nResolución No.  00359           Del   28 de febrero de 2023            Hoja No. 37 de 42\n“POR LA CUAL SE RESUELVE EL RECURSO DE REPOSICIÓN INTERPUESTO \nCONTRA LA RESOLUCIÓN No. 01192 DEL 07 DE JUNIO DE 2022 Y SE ADOPTAN \nOTRAS DETERMINACIONES”\nOficinas: Carrera 13 A No. 34 – 72 Edificio 13 35 Pisos 8 Bogotá, D.C.\nCentro de Orientación y Radicación de Correspondencia: Carrera 13 A No. 34 – 72 Edificio 13 35 \nLocales 110 al 112 Bogotá, D.C.  \nCódigo Postal 110311156\nNit.: 900.467.239-2\nLínea de Orientación y Contacto Ciudadano: 57 (1) 2540100 / 018000112998 PBX: 57 (1) 2540111\nwww.anla.gov.co    Email: licencias@anla.gov.co  \nPágina 37 de 42\nCausal de cesación \nestablecida en el \nartículo 9 de la Ley \n1333 de 2009\nArgumento propuesto en el \nrecurso\nConsideraciones de la ANLA\nNo. 06882 del 08 de noviembre de 2022, \nse demostró de manera comprobada la \nprocedencia de la aplicación de la \nreferida causal 2° de cesación, frente al \nsuceso sobre el cual recayó el mentado \nauto de apertura de investigación.\n3º. Que la conducta \ninvestigada no sea \nimputable \nal \npresunto infractor.\n4º. Que la actividad \nesté \nlegalmente \namparada \ny/o \nautorizada.\nRespecto al ordinal 3°“(…) Los \ndaños ocasionados sobre los \nPredios : las Brisas-Cucharito ( \nocasionada \npor \nla \nilegal \nimposición \nde \nservidumbre \npetrolera, sobre áreas de Alta \nSensibilidad \nEcológica \nde \nprotección \nespecial \npor \nser \nZonas de Nacimientos de Agua, \nde la Recarga de la Cuenca \nHídrica del Río Guayuriba y \nChichimene, que disponían de \nlos Humedales Horno-Mitú (…) \npero que Ecopetrol S.A impuso \nilegal \nservidumbre \npara \nel \noleoducto Castilla -Apiay 1 de 16 \npulgadas \n(…) \nÁREAS \nDE \nEXCLUSIÓN \nPARA \nACTIVIDADES \nDE \nHIDROCARUROS, \ndonde \nECOPETROL S.A ejecuta un \nInconstitucional \ndesvío \ndel \ntrazado del Oleoducto Estación \nCastilla-Apiay de 30”, como igual \nlo ejecutó con el oleoducto \nEstación Castilla Apiay de 16” \n(…) son infracciones imputables \na \nLa \nCompañía \nCENIT \nTransporte \ny \nLogística \nde \nHidrocarburos y ECOPETROL \nS.A, por haber incurrido en ellas \ny haber afectado el medio \nambiental ( sic) de especial \nprotección constitucional. \n4°Respecto al ordinal 4° La \ncompañía CENIT Transporte y \nLogística de Hidrocarburos y  \nECOPETROL S.A, son personas \njurídicas responsables de las \nNormas violentadas citadas. \nRespecto a los argumentos planteados \nen el recurso en lo que corresponde a \nla improcedencia de la aplicación de las \ncausales 3° y 4°, se precisa que \naquellas causales no fueron aplicadas \npor la ANLA en la resolución atacada.\nAhora bien, frente a los puntos alusivos \na las servidumbres petroleras, las \nreferencias a ECOPETROL S.A y a las \npresuntas \ndaños \ny \nafectaciones \nambientales, el despacho se acoge a lo \nampliamente decantado en la presente \nresolución, en la cual se explica que:\ni) La ANLA  no es competente para \ndirimir las diferencias o controversias \nque se deriven de las servidumbres , ii) \nECOPETROL S.A, no ostenta la \ncalidad de investigado en el trámite \nsancionatorio ambiental iniciado a \ntravés de Auto No. 04623  del 08 de \nagosto de 2018 iii) La ANLA no \nevidenció la configuración  de indicios \ncon \nfundamento \ncientífico, \n \nque \npermitiesen \ndeterminar \nla \nposible \nocurrencia \nde \nun \npresunto \ndaño \nambiental y iv) los hechos por los \ncuales se inició el procedimiento \nsancionatorio ambiental a través del \nAuto No. 04623  del 08 de agosto de \n2018, se encuentran asociados a la \nResolución No. 203 del 29 de marzo de \n2012, en la cual se autorizó la línea de \ntransporte de crudo de 30\" . \nPor las razones expuestas en el presente acápite, este despacho se permite \ndescartar los razonamientos expuestos en el medio de impugnación incoado, \nmanteniéndose entonces en la posición fijada en la Resolución No. 01192 del 07 de \njunio de 2022.\n\nResolución No.  00359           Del   28 de febrero de 2023            Hoja No. 38 de 42\n“POR LA CUAL SE RESUELVE EL RECURSO DE REPOSICIÓN INTERPUESTO \nCONTRA LA RESOLUCIÓN No. 01192 DEL 07 DE JUNIO DE 2022 Y SE ADOPTAN \nOTRAS DETERMINACIONES”\nOficinas: Carrera 13 A No. 34 – 72 Edificio 13 35 Pisos 8 Bogotá, D.C.\nCentro de Orientación y Radicación de Correspondencia: Carrera 13 A No. 34 – 72 Edificio 13 35 \nLocales 110 al 112 Bogotá, D.C.  \nCódigo Postal 110311156\nNit.: 900.467.239-2\nLínea de Orientación y Contacto Ciudadano: 57 (1) 2540100 / 018000112998 PBX: 57 (1) 2540111\nwww.anla.gov.co    Email: licencias@anla.gov.co  \nPágina 38 de 42\n3. Consideraciones de la ANLA respecto a las conclusiones. \nTeniendo en cuenta que las conclusiones expresadas en el escrito allegado \nmediante el radicado 2022136613-1-000 del 05 de julio de 2022, refieren a los \nmismos puntos tratados y desatados por esta Autoridad Nacional en acápites \nprecedentes, el despacho se acoge a lo expuesto en estos, en aras de evitar \nreiteraciones redundantes respecto al análisis que al detalle, en este acto \nadministrativo se ha expuesto. \nPor último, respecto a las alusiones que se realiza en el memorial de impugnación \nfrente a la Resolución No. 01613 del 10 de septiembre de 2021, acto administrativo \na través del cual esta Autoridad Nacional, impuso sanción ambiental ECOPETROL \nS.A, el despacho no entrará a realizar pronunciamiento alguno en lo concerniente a \nla prenombrada decisión, toda vez que dicha actuación pertenece a un escenario \nprocesal que no guarda relación con lo analizado en la presente determinación.  \nVI. Consideraciones de la ANLA respecto al Recurso de Apelación\nEn relación con el recurso de apelación incoado en forma subsidiaria en el radicado \n2022136613-1-000 del 05 de julio de 2022, el despacho considera oportuno resaltar  \nen primera medida,   el contenido del artículo 74 del  Código de Procedimiento \nAdministrativo y de Contencioso Administrativo ( Ley 1437 de 2011)  disposición \nque establece  como excepción frente a la interposición del mismo, la  que se resalta \na continuación: \n“ARTÍCULO 74. Recursos contra los actos administrativos. Por regla general, contra \nlos actos definitivos procederán los siguientes recursos:\n1. El de reposición, ante quien expidió la decisión para que la aclare, modifique, adicione \no revoque.\n2. El de apelación, para ante el inmediato superior administrativo o funcional con el mismo \npropósito.\nNo habrá apelación de las decisiones de los Ministros, Directores de Departamento \nAdministrativo, \nsuperintendentes \ny \nrepresentantes \nlegales \nde \nlas \nentidades \ndescentralizadas ni de los directores u organismos superiores de los órganos \nconstitucionales autónomos. (subrayado insertado) \nEn relación con la ANLA, es procedente anotar que según el artículo 1 del Decreto \n3573 de 20117, esta Entidad se encuentra constituida como una Unidad \nAdministrativa Especial del orden nacional, con autonomía administrativa y \nfinanciera, la cual en virtud de la desconcentración administrativa efectuada a \ntravés del precitado decreto, cumple funciones propias del Ministerio de Ambiente y \nDesarrollo Sostenible.\nAhora bien, respecto a la figura de la desconcentración administrativa, el artículo 8 \nde la Ley 489 de 19988, establece la siguiente definición: \n7 “Por el cual se crea la Autoridad Nacional de Licencias Ambientales –ANLA– y se dictan otras disposiciones”\n8 \"Por la cual se dictan normas sobre la organización y funcionamiento de las entidades del orden nacional, se \nexpiden las disposiciones, principios y reglas generales para el ejercicio de las atribuciones previstas en los \nnumerales 15 y 16 del artículo 189 de la Constitución Política y se dictan otras disposiciones.\"\n\nResolución No.  00359           Del   28 de febrero de 2023            Hoja No. 39 de 42\n“POR LA CUAL SE RESUELVE EL RECURSO DE REPOSICIÓN INTERPUESTO \nCONTRA LA RESOLUCIÓN No. 01192 DEL 07 DE JUNIO DE 2022 Y SE ADOPTAN \nOTRAS DETERMINACIONES”\nOficinas: Carrera 13 A No. 34 – 72 Edificio 13 35 Pisos 8 Bogotá, D.C.\nCentro de Orientación y Radicación de Correspondencia: Carrera 13 A No. 34 – 72 Edificio 13 35 \nLocales 110 al 112 Bogotá, D.C.  \nCódigo Postal 110311156\nNit.: 900.467.239-2\nLínea de Orientación y Contacto Ciudadano: 57 (1) 2540100 / 018000112998 PBX: 57 (1) 2540111\nwww.anla.gov.co    Email: licencias@anla.gov.co  \nPágina 39 de 42\n“ARTÍCULO 8.- Desconcentración administrativa. La desconcentración es la \nradicación de competencias y funciones en dependencias ubicadas fuera de la sede \nprincipal del organismo o entidad administrativa, sin perjuicio de las potestades y deberes \nde orientación e instrucción que corresponde ejercer a los jefes superiores de la \nAdministración, la cual no implica delegación y podrá hacerse por territorio y por \nfunciones...”\nCabe anotar que la transferencia de competencias funcionales, territoriales e \ninstrumentales a un ente, opera de forma permanente, teniendo el límite de la \nrespectiva norma que las dispone; originando de dicha manera una mayor celeridad \nen la resolución de los asuntos administrativos que se trasladan por \ndesconcentración.\nAhora bien, respecto a los recursos que proceden frente a los actos emitidos en \nejercicio de la desconcentración administrativa,  dentro del  parágrafo del artículo 8 \nde la Ley 489 de 1998  se preceptúa:\n“PARÁGRAFO .-(…)…Los actos cumplidos por las autoridades en virtud de \ndesconcentración administrativa sólo serán susceptibles del recurso de reposición en los \ntérminos establecidos en las normas pertinentes”.\nAsí las cosas, es importante destacar que en el numeral 7, artículo 3 del Decreto \n3573 de 2011, se estableció como función de la ANLA,  el “Adelantar y culminar el \nprocedimiento de investigación, preventivo y sancionatorio en materia ambiental, de \nacuerdo con lo dispuesto en la Ley 1333 de 2009 o la norma que la modifique o sustituya”\nPor su parte, en el numeral 4, artículo 2 del Decreto 376 de 2020 “ Por el cual se \nmodifica la estructura de la Autoridad Nacional de Licencias Ambientales -ANLA.”, \nse estableció como una de las funciones del Despacho del Director General de esta \nEntidad el “Expedir los actos administrativos mediante los cuales se imponen y levantan \nmedidas preventivas, al igual que, expedir las medidas sancionatorias ambientales por \npresunta infracción en materia ambiental, en los asuntos objeto de su competencia.”\nDel marco jurídico expuesto hasta este el momento, se destacan los siguientes \npuntos: \n<0000> En virtud de la desconcentración administrativa , se estableció como una de las \nfunciones del despacho del Director General de la ANLA,  la expedición de los \nactos administrativos de carácter sancionatorio ambiental, de conformidad con \nlo establecido en la Ley 1333 de 2009 o la norma que la modifique o sustituya.\n<0000> Los actos emitidos por el Director General de la ANLA, desatados en virtud de \nla desconcentración administrativa, solo serán susceptibles de recurso de \nreposición, conforme lo prevé el  parágrafo del artículo 8 de la Ley 489 de 1998, \narriba transcrito. \nDecantado lo anterior, en punto de delegación administrativa, esta Autoridad \nAmbiental se permite traer a colación lo normado en el artículo 9 de la Ley 489 de \n1998,  cuyo contenido literal es el siguiente: \n\nResolución No.  00359           Del   28 de febrero de 2023            Hoja No. 40 de 42\n“POR LA CUAL SE RESUELVE EL RECURSO DE REPOSICIÓN INTERPUESTO \nCONTRA LA RESOLUCIÓN No. 01192 DEL 07 DE JUNIO DE 2022 Y SE ADOPTAN \nOTRAS DETERMINACIONES”\nOficinas: Carrera 13 A No. 34 – 72 Edificio 13 35 Pisos 8 Bogotá, D.C.\nCentro de Orientación y Radicación de Correspondencia: Carrera 13 A No. 34 – 72 Edificio 13 35 \nLocales 110 al 112 Bogotá, D.C.  \nCódigo Postal 110311156\nNit.: 900.467.239-2\nLínea de Orientación y Contacto Ciudadano: 57 (1) 2540100 / 018000112998 PBX: 57 (1) 2540111\nwww.anla.gov.co    Email: licencias@anla.gov.co  \nPágina 40 de 42\n“(…)\nARTÍCULO 9.- Delegación. Las autoridades administrativas, en virtud de lo dispuesto en \nla Constitución Política y de conformidad con la presente Ley, podrán mediante acto de \ndelegación, transferir el ejercicio de funciones a sus colaboradores o a otras autoridades, \ncon funciones afines o complementarias.\nSin perjuicio de las delegaciones previstas en leyes orgánicas, en todo caso, los ministros, \ndirectores de departamento administrativo, superintendentes, representantes legales de \norganismos y entidades que posean una estructura independiente y autonomía \nadministrativa podrán delegar la atención y decisión de los asuntos a ellos confiados por \nla ley y los actos orgánicos respectivos, en los empleados públicos de los niveles directivo \ny asesor vinculados al organismo correspondiente, con el propósito de dar desarrollo a los \nprincipios de la función administrativa enunciados en el artículo 209 de la Constitución \nPolítica y en la presente Ley.\n(…)”\nEn armonía con la disposición normativa referida, se considera relevante traer a \ncolación lo analizado por la Corte Constitucional, en sentencia  C - 372 de 20029,  \nen la cual, frente a las decisiones del delegatario se analizó lo siguiente:\n“(...)\ni)  Decisiones del delegatario. El delegatario toma dos tipos de decisiones: unas, para \nel cumplimiento de las funciones del empleo del cual es titular, y otras, en ejercicio de la \ncompetencia delegada, para el cumplimiento de las correspondientes funciones del \nempleo del delegante. En estricto sentido, es frente a estas últimas que se actúa en \ncalidad de delegatario pues en el primer evento él no es delegatario sino el titular de su \nempleo. Además, las decisiones que toma en calidad de delegatario tienen el mismo nivel \ny la misma fuerza vinculante como si la decisión hubiese sido tomada por el delegante y, \nse asume, “que el delegado es el autor real de las actuaciones que  ejecuta en uso de las \ncompetencias delegadas, y ante él se elevan las solicitudes y se surten los recursos a que \nhaya lugar, como si él fuera el titular mismo de la función”  \n( Subrayado insertado)\nAsí, en ejercicio de la figura de la delegación administrativa, el Director General de \nla ANLA a través de la Resolución No. 423 del 12 de marzo de 2020, modificada por \nla Resolución No. 740 del 11 de abril de 2022  (vigente para la fecha de expedición \ndel acto administrativo atacado  y posteriormente derogada por la Resolución No. \n02795  del  25 de noviembre de 2022) delegó en el jefe de la Oficina Asesora \nJurídica, la función de suscribir los actos administrativos a través del cual se ordena \nla cesación del procedimiento sancionatorio ambiental. \nConforme el marco jurídico expuesto, se concluye entonces que el Jefe la Oficina \nAsesora Jurídica de la ANLA, al expedir  el acto administrativo controvertido, esto \nes la Resolución No. 01192  del  07 de junio de 2022, actuó en calidad de delegatario \ndel Director General de esta Entidad , ostentando dicha decisión “(…) la misma \nfuerza vinculante como si la decisión hubiese sido tomada por el delegante”  y \nsurtiéndose ante ella “(…) los recursos a que haya lugar, como si él fuera el titular \n9 Corte Constitucional de Colombia. Sentencia C-372 del 15 de mayo de 2002. Magistrado Ponente Jaime \nCórdoba Triviño\n\nResolución No.  00359           Del   28 de febrero de 2023            Hoja No. 41 de 42\n“POR LA CUAL SE RESUELVE EL RECURSO DE REPOSICIÓN INTERPUESTO \nCONTRA LA RESOLUCIÓN No. 01192 DEL 07 DE JUNIO DE 2022 Y SE ADOPTAN \nOTRAS DETERMINACIONES”\nOficinas: Carrera 13 A No. 34 – 72 Edificio 13 35 Pisos 8 Bogotá, D.C.\nCentro de Orientación y Radicación de Correspondencia: Carrera 13 A No. 34 – 72 Edificio 13 35 \nLocales 110 al 112 Bogotá, D.C.  \nCódigo Postal 110311156\nNit.: 900.467.239-2\nLínea de Orientación y Contacto Ciudadano: 57 (1) 2540100 / 018000112998 PBX: 57 (1) 2540111\nwww.anla.gov.co    Email: licencias@anla.gov.co  \nPágina 41 de 42\nmismo de la función (…) , tal y como lo resalta el máximo Tribunal Constitucional, \nen la ya referida sentencia C - 372 de 2002.\nAsí las cosas, y recordando que en virtud del mencionado 8 de la Ley 489 de 1998, \nsobre los actos emitidos por el Director General de la ANLA solo es procedente el \nrecurso de reposición y que dentro de aquellos actos se encuentran contemplados \naquellas decisiones expedidas por los funcionarios a los cuales se efectuó la \nrespectiva delegación de funciones, tal y como es el caso de la citada Resolución \nNo. 01192  del  07 de junio de 2022, se concluye que el recurso de apelación  \ninterpuesto en forma subsidiaria en contra de la resolución controvertida , no resulta \nprocedente, razón por la cual en la parte resolutiva del presente acto administrativo, \nse procederá a rechazar el mencionado medio de impugnación pretendido. \nCon fundamento en lo expuesto, en el presente caso se advierte la procedencia de \nno reponer la Resolución No. 01192 del  07 de junio de 2022 y en consecuencia, \nRESUELVE\nARTÍCULO PRIMERO. - No reponer la Resolución No. 01192 del 07 de junio de \n2022, expedida dentro del procedimiento sancionatorio ambiental iniciado mediante \nel Auto No. 04623  del 08 de agosto de 2018, por las razones expuestas en la parte \nmotiva del presente acto administrativo. \nARTÍCULO SEGUNDO. - Rechazar por improcedente, el recurso de apelación \ninterpuesto en forma subsidiaria, contra la Resolución No. 01192 del  07 de junio de \n2022. Lo anterior, conforme a las razones expuestas en la parte motiva del presente \nacto administrativo.\nARTÍCULO TERCERO. - Notificar la presente Resolución al señor Miguel Ángel \nCruz Romero directamente o a su apoderado , de haberse conferido mandato en la \npresente actuación.\nARTÍCULO CUARTO. -  Notificar la presente resolución a la sociedad CENIT \nTRANSPORTE Y LOGISTICA DE HIDROCARBUROS S.A.S, con Nit. 900.531.210-\n3, a través de su apoderado debidamente constituido, de haberse conferido \nmandato en la presente actuación sancionatoria o en su defecto, por intermedio de \nsu representante legal.\nARTÍCULO QUINTO. - Comunicar la presente decisión a los señores Gonzalo Cruz \nRomero y Hernando Cruz Romero. \nARTÍCULO SEXTO. - Comunicar el contenido de este acto administrativo a la \nProcuraduría Delegada para Asuntos Ambientales y Agrarios, en cumplimiento de \nlo establecido en el artículo 56 de la Ley 1333 de 2009 y a la Agencia Nacional de \nHidrocarburos y a la Superintendencia de Sociedades, para su conocimiento y fines \npertinentes. \nARTÍCULO SÉPTIMO - Publicar la presente resolución en la Gaceta Ambiental de \nla Autoridad Nacional de Licencias Ambientales, de conformidad con lo dispuesto \nen el artículo 29 de la Ley 1333 de 2009 y en el artículo 71 de la Ley 99 de 1993.\n\nResolución No.  00359           Del   28 de febrero de 2023            Hoja No. 42 de 42\n“POR LA CUAL SE RESUELVE EL RECURSO DE REPOSICIÓN INTERPUESTO \nCONTRA LA RESOLUCIÓN No. 01192 DEL 07 DE JUNIO DE 2022 Y SE ADOPTAN \nOTRAS DETERMINACIONES”\nOficinas: Carrera 13 A No. 34 – 72 Edificio 13 35 Pisos 8 Bogotá, D.C.\nCentro de Orientación y Radicación de Correspondencia: Carrera 13 A No. 34 – 72 Edificio 13 35 \nLocales 110 al 112 Bogotá, D.C.  \nCódigo Postal 110311156\nNit.: 900.467.239-2\nLínea de Orientación y Contacto Ciudadano: 57 (1) 2540100 / 018000112998 PBX: 57 (1) 2540111\nwww.anla.gov.co    Email: licencias@anla.gov.co  \nPágina 42 de 42\nARTÍCULO OCTAVO. - Contra lo establecido en el presente acto administrativo no \nproceden recursos.\nNOTIFÍQUESE, COMUNÍQUESE, PUBLÍQUESE Y CÚMPLASE\nDada en Bogotá D.C., a los 28 de febrero de 2023\nDANIEL RICARDO PÁEZ DELGADO\nJefe Oficina Asesora Jurídica \nEjecutores\nCONSTANZA PANTOJA CABRERA\nContratista\n \n \nRevisor / L\u0000der\nCARLOS EDUARDO SILVA \nORJUELA\nContratista\n \n \nExpediente No. SAN0094-00-2016\nConcepto Técnico N°06882 del 08 de noviembre de 2022\nFecha:  27 de enero de 2023\nProceso No.: 2023039906\nArchívese en: SAN0094-00-2016  \nPlantilla_Resolución_SILA_v3_42852\nNota: Este es un documento electrónico generado desde los Sistemas de Información de la ANLA. El original reposa en los archivos digitales de la \nEntidad.\n"
}