{
  "fuente": "ANLA_GACETA",
  "numero_resolución": "RESOLUCIÓN N° 03115",
  "fecha_resolución": "2022-12-30",
  "nombre_proyecto": "proyecto de desarrollo del Campo Yaguará, a favor de",
  "ubicación": "departamento del Huila.",
  "empresa": "otorgó a la sociedad PETROBRAS INTERNACIONAL S.A.",
  "numero_expediente": "No",
  "radicados": [
    "2022247986",
    "2022248191"
  ],
  "descripcion": "Por la cual se resuelve un recurso de reposición contra de la Resolución 2526 del 19 de octubre de 2022",
  "tipos_infraccion": [
    "Vertimientos",
    "Emisiones atmosféricas",
    "Residuos sólidos",
    "Manejo de aguas",
    "Tala o afectación de bosques",
    "Incumplimiento del PMA"
  ],
  "pdf_id": "41308",
  "file_name": "ANLA_41308.pdf",
  "texto_completo": "|\nRepública de Colombia\nMinisterio de Ambiente y Desarrollo Sostenible\nAUTORIDAD NACIONAL DE LICENCIAS AMBIENTALES \n- ANLA –\nRESOLUCIÓN N°  03115\n( 30 de diciembre de 2022 )\nOficinas: Carrera 13 A No. 34 – 72 Edificio 13 35 Pisos 8 Bogotá, D.C.\nCentro de Orientación y Radicación de Correspondencia: Carrera 13 A No. 34 – 72 Edificio 13 35 \nLocales 110 al 112 Bogotá, D.C.  \nCódigo Postal 110311156\nNit.: 900.467.239-2\nLínea de Orientación y Contacto Ciudadano: 57 (1) 2540100 / 018000112998 PBX: 57 (1) 2540111\nwww.anla.gov.co    Email: licencias@anla.gov.co  \nPágina 1 de 34\n“Por la cual se resuelve un recurso de reposición contra de la Resolución 2526 del 19 de \noctubre de 2022”\nEL DIRECTOR GENERAL DE LA AUTORIDAD NACIONAL DE LICENCIAS AMBIENTALES – \nANLA\nEn uso de sus facultades legales establecidas mediante la Ley 99 de 1993, el Decreto Ley 3573 del \n2011 y acorde con lo regulado en el Decreto 1076 del 26 de mayo de 2015, el Decreto 376 de 11 de \nmarzo de 2020, la Resolución 1957 del 05 de noviembre de 2021, la Resolución 1223 del 19 de \nseptiembre de 2022 y\nCONSIDERANDO:\nQue mediante la Resolución 944 del 9 de noviembre de 1999, el entonces Ministerio del Medio \nAmbiente, hoy Ministerio de Medio Ambiente y Desarrollo Sostenible (en adelante el Ministerio) otorgó \na la sociedad PETROBRAS INTERNACIONAL S.A. - BRASPETRO Licencia Ambiental Global para el \ndesarrollo del Campo de Producción Yaguará, localizado en jurisdicción del municipio de Yaguará en \nel departamento del Huila. \nQue si bien en el artículo sexto de la mencionada resolución, se estableció que la licencia ambiental \nglobal llevaba implícitos los permisos concesiones y autorizaciones que se requieren pare el uso, \naprovechamiento o afectación de los recursos naturales renovables necesarios pare el desarrollo del \nproyecto; la misma no incluyó todos los permisos que se han requerido durante la ejecución del \nproyecto, al punto que los demás permisos que se han necesitado se han tramitado ante la \nCORPORACIÓN AUTÓNOMA REGIONAL DEL ALTO MAGDALENA –CAM. \nQue a través de la Resolución 442 del 21 de abril de 2004, el Ministerio autorizó la cesión la Licencia \nAmbiental otorgada mediante Resolución 944 del 9 de noviembre de 1999 a la sociedad PETROBRAS \nINTERNACIONAL S.A. - BRASPETRO para el proyecto de desarrollo del Campo Yaguará, a favor de \nla sociedad PETROBRAS INTERNATIONAL BRASPETRO B.V. \nQue mediante la Resolución 318 del 14 de mayo de 2012, la Autoridad Nacional de Licencias \nAmbientales – ANLA, en adelante esta Autoridad Nacional, autorizó la cesión de la Licencia Ambiental \notorgada mediante la Resolución 944 del 9 de noviembre de 1999 y modificada mediante Resolución \n442 del 21 de abril de 2004 a la sociedad PETROBRAS INTERNATIONAL BRASPETRO B.V., para el \nproyecto de desarrollo del Campo Yaguará, a favor de la sociedad ECOPETROL S.A. \nQue mediante la Resolución 1224 del 1 de octubre de 2015, esta Autoridad Nacional modificó la \nResolución 944 del 9 de noviembre de 1999, modificada a su vez por la Resolución 664 de 2013, en \nel sentido de autorizar algunas actividades, ajustar la zonificación de manejo ambiental y del Plan de \nManejo Ambiental, entre otros aspectos. \n\nResolución No.  03115           Del   30 de diciembre de 2022            Hoja No. 2 de 34\n“Por la cual se resuelve un recurso de reposición contra de la Resolución 2526 del 19 de octubre de 2022”\nOficinas: Carrera 13 A No. 34 – 72 Edificio 13 35 Pisos 8 Bogotá, D.C.\nCentro de Orientación y Radicación de Correspondencia: Carrera 13 A No. 34 – 72 Edificio 13 35 \nLocales 110 al 112 Bogotá, D.C.  \nCódigo Postal 110311156\nNit.: 900.467.239-2\nLínea de Orientación y Contacto Ciudadano: 57 (1) 2540100 / 018000112998 PBX: 57 (1) 2540111\nwww.anla.gov.co    Email: licencias@anla.gov.co  \nPágina 2 de 34\nQue mediante la Resolución 297 del 22 marzo de 2016, esta Autoridad Nacional resolvió recurso de \nreposición interpuesto por la sociedad ECOPETROL S.A., en contra de la Resolución 1224 del 1° de\noctubre de 2015, en el sentido de modificar el literal a, inciso iv, numeral II del parágrafo primero del \nartículo primero, autorizando la reposición de tuberías de transporte de crudo y prueba de inyección \nde agua dentro del campo y Gas Anular, de diámetros iguales o inferiores a 8 pulgadas; en el periodo \n2014 - 2025, entre otras determinaciones. \nQue mediante la Resolución 757 del 24 de abril de 2020, esta Autoridad Nacional modificó el Auto \n5964 del 17 de diciembre de 2015, relacionado con el seguimiento a la inversión de no menos del 1%, \nen el sentido de aprobar el acogimiento al artículo 321 del Plan Nacional de Desarrollo - PND (Ley \n1955 del 25 de mayo del 2019), realizando ajustes al Plan de Inversión de no menos del 1%. \nQue mediante la Resolución 2526 del 19 de octubre de 2022, esta Autoridad Nacional modificó la \nlicencia ambiental otorgada para el proyecto denominado “Campo de Producción Yaguará”, \nresolviendo entre otros, otorgar a la sociedad ECOPETROL S.A. la concesión de aguas superficiales, \nel permiso de exploración de aguas subterráneas y el permiso de Emisiones Atmosféricas, para la \nquema de gas y operación con combustibles.\nQue el mencionado acto administrativo fue notificado mediante correo electrónico el 20 de octubre de \n2022, a la sociedad ECOPETROL S.A.\nQue mediante la comunicación con radicado 2022247986-1-000 del 3 de noviembre de 2022, la señora \nTANIA VANESSA TORRES ROCHA, en calidad de apoderada general de ECOPETROL S.A., \ninterpuso recurso de reposición en contra de la Resolución 2526 del 19 de octubre de 2022, \nsolicitando: \n“(…)\n1.\nModificar el artículo primero de la Resolución 2526 de 2022, en el sentido de otorgar la \nconcesión de superficiales de 70 l/s del Embalse de Betania para uso doméstico e industrial, \nen el punto denominado Peñalisa, vereda Vilú del municipio de Yaguará, bajo los siguientes \ntérminos: \n• Se solicita no incluir las obligaciones consignadas en los literales a, b y c del numeral 2 del \nartículo primero, toda vez que no son aplicables al cuerpo de agua donde se tiene el punto de \ncaptación. \n• Se permita a ECOPETROL S.A., desistir del permiso ante la CAM con el fin de que la vigencia \nde la concesión bajo la licencia se haga efectiva una vez se radique la solicitud de \ndesistimiento del permiso ante la CAM. \n2.\nModificar el artículo tercero de la Resolución 2526 de 2022, en el sentido de otorgar el permiso \nde emisiones atmosféricas bajo los siguientes términos: \n• Adicionar los motocompresores y bombas de transferencia a la relación de equipos \nautorizados dentro del permiso de emisiones atmosféricas para el Campo Yaguará. \n• Se aclare el nombre de las teas, toda vez que en el artículo tercero se menciona dos veces \nla tea de alta y se omite la tea de baja. \n• Se permita a ECOPETROL S.A., desistir del permiso ante la CAM con el fin de que la vigencia \nde la concesión bajo la licencia se haga efectiva una vez se radique la solicitud de \ndesistimiento del permiso ante la CAM. \n\nResolución No.  03115           Del   30 de diciembre de 2022            Hoja No. 3 de 34\n“Por la cual se resuelve un recurso de reposición contra de la Resolución 2526 del 19 de octubre de 2022”\nOficinas: Carrera 13 A No. 34 – 72 Edificio 13 35 Pisos 8 Bogotá, D.C.\nCentro de Orientación y Radicación de Correspondencia: Carrera 13 A No. 34 – 72 Edificio 13 35 \nLocales 110 al 112 Bogotá, D.C.  \nCódigo Postal 110311156\nNit.: 900.467.239-2\nLínea de Orientación y Contacto Ciudadano: 57 (1) 2540100 / 018000112998 PBX: 57 (1) 2540111\nwww.anla.gov.co    Email: licencias@anla.gov.co  \nPágina 3 de 34\n3.\nModificar el artículo quinto de la Resolución 2526 de 2022 en el sentido de que sean incluidos \ny aprobados los ajustes efectuados en las fichas de manejo 1.3, 1.4, 1.6, 1.8, 1.9, 2.2, 3.1, \n3.2, 6.1, 7.3, 8.3, 8.4, 8.5, 8.6, 8.7, 9.3 y 9.4 del Plan de Manejo Ambiental. \n4.\nModificar el artículo sexto de la Resolución 2526 de 2022, revocando la obligación establecida \npor medio del literal b del numeral 3, teniendo en cuenta la imposibilidad de contar con un \nmomento previo a la ejecución del proyecto. \n5.\nModificar el artículo séptimo de la Resolución 2526 de 2022 en el sentido de que sean \nincluidos y aprobados los ajustes efectuados en las fichas 1.4, 1.5, 2.1, 2.2, 2.3, 2.4, 2.5, 2.6, \n3.2, 3.3, 3.4 y 3.5 del Plan de Seguimiento y Monitoreo.”\nQue una vez estudiados los argumentos del recurso de reposición presentado contra la Resolución \n2526 del 19 de octubre de 2022, el equipo evaluador de la Autoridad Nacional de Licencias \nAmbientales - ANLA, emitió el Concepto Técnico 8278 del 29 de diciembre de 2022.\nFUNDAMENTOS LEGALES. \nDe la Competencia de esta Autoridad.\nPor medio del Decreto-Ley 3573 del 27 de septiembre de 2011, el Gobierno Nacional, en uso de las \nfacultades extraordinarias conferidas mediante la Ley 1444 de 2011, creó la Autoridad Nacional de \nLicencias Ambientales – ANLA, como entidad encargada de que los proyectos, obras o actividades \nsujetos a licenciamiento, permiso o trámite ambiental cumplan con la normativa ambiental, de tal \nmanera que contribuyan al desarrollo sostenible ambiental del País, y en tal sentido le asignó entre \notras funciones a la Dirección General, la de \"Otorgar o negar las licencias, permisos y trámites \nambientales de Competencia del Ministerio de Ambiente y Desarrollo Sostenible\" de conformidad con \nla Ley y los reglamentos. \nQue mediante Decreto 376 de 11 de marzo de 2020, el Gobierno Nacional, en uso de sus facultades \nconstitucionales y legales, modificó la estructura de la Autoridad Nacional de Licencias Ambientales – \nANLA. \nRespecto a la competencia para suscribir el presente acto administrativo, se tiene en cuenta la función \nestablecida a la Dirección General, en el Decreto 376 de 11 de marzo de 2020, “Por el cual se modifica \nla estructura de la Autoridad Nacional de Licencias Ambientales ANLA” y la Resolución 1957 del 05 \nde noviembre de 2021 “Por la cual se adopta el Manual Específico de Funciones y de Competencias \nLaborales para los empleos de la planta de personal de la Autoridad Nacional de Licencias \nAmbientales - ANLA”.\nDe otro lado, mediante Resolución 1223 del 19 de septiembre de 2022, el Ministro de Ambiente y \nDesarrollo Sostenible, designó en el empleo de Director General de Unidad Administrativa Código 015, \nde la Autoridad Nacional de Licencias Ambientales –ANLA, al doctor RODRIGO ELIAS NEGRETE \nMONTES.\nProcedimiento. \nEl procedimiento para la presentación y resolución de recursos contra los actos administrativos se \nencuentra reglado en el Código de Procedimiento Administrativo y de lo Contencioso Administrativo \nartículos 74 y siguientes, que particularmente respecto del recurso de reposición al tenor expresan:\n\nResolución No.  03115           Del   30 de diciembre de 2022            Hoja No. 4 de 34\n“Por la cual se resuelve un recurso de reposición contra de la Resolución 2526 del 19 de octubre de 2022”\nOficinas: Carrera 13 A No. 34 – 72 Edificio 13 35 Pisos 8 Bogotá, D.C.\nCentro de Orientación y Radicación de Correspondencia: Carrera 13 A No. 34 – 72 Edificio 13 35 \nLocales 110 al 112 Bogotá, D.C.  \nCódigo Postal 110311156\nNit.: 900.467.239-2\nLínea de Orientación y Contacto Ciudadano: 57 (1) 2540100 / 018000112998 PBX: 57 (1) 2540111\nwww.anla.gov.co    Email: licencias@anla.gov.co  \nPágina 4 de 34\n“Artículo 74. Recursos contra los actos administrativos. - Por regla general, contra los actos \ndefinitivos procederán los siguientes recursos: \n1.\nEl de reposición, ante quien expidió la decisión para que la aclare, modifique, adicione o revoque \n(…)” \nAsí mismo, en cuanto a la oportunidad y presentación de los recursos, el artículo 76 del Código de \nProcedimiento Administrativo y de lo Contencioso Administrativo, dispone: \n“Artículo 76. Oportunidad y presentación. - Los recursos de reposición y apelación deberán \ninterponerse por escrito en la diligencia de notificación personal, o dentro de los diez (10) días \nsiguientes a ella, o a la notificación por aviso, o al vencimiento del término de publicación, según \nel caso. Los recursos contra los actos presuntos podrán interponerse en cualquier tiempo, salvo \nen el evento en que se haya acudido ante el juez. \nLos recursos se presentarán ante el funcionario que dictó la decisión, salvo lo dispuesto para el \nde queja, y si quien fuere competente no quisiere recibirlos podrán presentarse ante el \nprocurador regional o ante el personero municipal, para que ordene recibirlos y tramitarlos, e \nimponga las sanciones correspondientes, si a ello hubiere lugar. \nEl recurso de apelación podrá interponerse directamente, o como subsidiario del de reposición y \ncuando proceda será obligatorio para acceder a la jurisdicción. \nLos recursos de reposición y de queja no serán obligatorios.” \nDe acuerdo con lo previsto en el artículo 77 del mencionado Código, los recursos deberán reunir los \nsiguientes requisitos: \n“Artículo 77. Requisitos. - Por regla general los recursos se interpondrán por escrito que no \nrequiere de presentación personal si quien lo presenta ha sido reconocido en la actuación. \nIgualmente, podrán presentarse por medios electrónicos. \nLos recursos deberán reunir, además, los siguientes requisitos: \n1. Interponerse dentro del plazo legal, por el interesado o su representante o apoderado \ndebidamente constituido. \n2. Sustentarse con expresión concreta de los motivos de inconformidad. \n3. Solicitar y aportar las pruebas que se pretende hacer valer. \n4. Indicar el nombre y la dirección del recurrente, así como la dirección electrónica si desea ser \nnotificado por este medio. \nSólo los abogados en ejercicio podrán ser apoderados. Si el recurrente obra como agente \noficioso, deberá acreditar la calidad de abogado en ejercicio, y prestar la caución que se le señale \npara garantizar que la persona por quien obra ratificará su actuación dentro del término de dos \n(2) meses. \nSi no hay ratificación se hará efectiva la caución y se archivará el expediente. \nPara el trámite del recurso el recurrente no está en la obligación de pagar la suma que el acto \nrecurrido le exija. Con todo, podrá pagar lo que reconoce deber.”\nEl artículo 80 del citado Código, establece el alcance del contenido de la decisión que resuelve el \nrecurso:\n\nResolución No.  03115           Del   30 de diciembre de 2022            Hoja No. 5 de 34\n“Por la cual se resuelve un recurso de reposición contra de la Resolución 2526 del 19 de octubre de 2022”\nOficinas: Carrera 13 A No. 34 – 72 Edificio 13 35 Pisos 8 Bogotá, D.C.\nCentro de Orientación y Radicación de Correspondencia: Carrera 13 A No. 34 – 72 Edificio 13 35 \nLocales 110 al 112 Bogotá, D.C.  \nCódigo Postal 110311156\nNit.: 900.467.239-2\nLínea de Orientación y Contacto Ciudadano: 57 (1) 2540100 / 018000112998 PBX: 57 (1) 2540111\nwww.anla.gov.co    Email: licencias@anla.gov.co  \nPágina 5 de 34\n“Artículo 80. Decisión de los recursos. -Vencido el período probatorio, si a ello hubiere lugar, y \nsin necesidad de acto que así lo declare, deberá proferirse la decisión motivada que resuelva el \nrecurso. \nLa decisión resolverá todas las peticiones que hayan sido oportunamente planteadas y las que \nsurjan con motivo del recurso.” \nEl recurso de reposición constituye un instrumento legal mediante el cual la parte interesada tiene la \noportunidad de ejercer el derecho de controvertir una decisión, para que la administración, previa su \nevaluación la confirme, aclare, modifique o revoque.\nEs deber de la administración decidir en derecho el acto impugnado, habiéndose ejercido en \noportunidad legal la contradicción, que no solamente garantiza conocer las decisiones de la \nadministración sino también la oportunidad de controvertir por el medio de defensa aludido.\nRevisada la norma relacionada sobre la oportunidad y requisitos, se precisa que contra la Resolución \n2526 del 19 de octubre de 2022, por la cual se modificó la licencia ambiental otorgada para el proyecto \ndenominado “Campo de Producción Yaguará”, es procedente interponer recurso de reposición, sobre \nel cual se procede a verificar el cumplimiento de los requisitos legales para su interposición.\nQue el proceso de notificación de la precitada Resolución se surtió para la sociedad ECOPETROL \nS.A. mediante correo electrónico el 20 de octubre de 2022; y esta interpuso recurso de reposición en \ncontra de la Resolución 2526 del 19 de octubre de 2022 mediante la comunicación con radicado \n2022248191-1-000 del 3 de noviembre de 2022, esto es, dentro de los diez (10) días siguientes a la \nfecha de notificación, tal como se consagra en el artículo 76 de la Ley 1437 de 2011. \nEste recurso de reposición fue interpuesto por quien cuenta con la capacidad legal para adelantar la \nactuación, dentro de los términos señalados para ello. A su vez, el escrito contiene los motivos de \ninconformidad y el lugar de notificación, por lo tanto, se considera que reúne los requisitos de ley para \nque los mismos sean resueltos por esta Autoridad.\nRespecto de este recurso, es preciso establecer que no fueron solicitadas pruebas.\nCONSIDERACIONES Y ANÁLISIS DEL RECURSO DE REPOSICIÓN PRESENTADO POR LA \nSOCIEDAD.\nA continuación, se presenta el análisis de los argumentos presentados por la sociedad ECOPETROL \nS.A. en el recurso de reposición con radicado 2022248191-1-000 del 3 de noviembre de 2022, en \ncontra de la Resolución 2526 del 19 de octubre de 2022, mediante la cual esta Autoridad Nacional \nmodificó la licencia ambiental otorgada para el proyecto denominado “Campo de Producción Yaguará”, \ncon fundamento en el Concepto Técnico 8278 del 29 de diciembre de 2022.\n1.\nRESPECTO A LA SOLICITUD DE MODIFICAR EL ARTÍCULO PRIMERO DE LA \nRESOLUCIÓN 2526 DEL 19 DE OCTUBRE DE 2022.\nArgumentos y Petición de la sociedad:\n“Conforme lo dispuesto en el Artículo Primero la ANLA otorga a Ecopetrol permiso de captación sobre el \nembalse Betania de la siguiente manera: “Modificar el artículo sexto de la Resolución 944 del 9 de \nnoviembre de 1999, modificado por el artículo noveno de la Resolución 1224 del 01 de octubre de 2015, \npor la cual se modificó la licencia ambiental para el proyecto denominado “Campo de Producción Yaguará”, \nlocalizado en jurisdicción del municipio de Yaguará del departamento del Huila, en elsentido de otorgar a \nla sociedad ECOPETROL S.A. la concesión de aguas superficiales de 70 l/s del Embalse de Betania para \nuso doméstico e industrial, en el punto denominado Peñalisa, vereda Vilú del municipio de Yaguará”.\nEn el mismo artículo, se establecen obligaciones asociadas al permiso de uso y aprovechamiento de \n\nResolución No.  03115           Del   30 de diciembre de 2022            Hoja No. 6 de 34\n“Por la cual se resuelve un recurso de reposición contra de la Resolución 2526 del 19 de octubre de 2022”\nOficinas: Carrera 13 A No. 34 – 72 Edificio 13 35 Pisos 8 Bogotá, D.C.\nCentro de Orientación y Radicación de Correspondencia: Carrera 13 A No. 34 – 72 Edificio 13 35 \nLocales 110 al 112 Bogotá, D.C.  \nCódigo Postal 110311156\nNit.: 900.467.239-2\nLínea de Orientación y Contacto Ciudadano: 57 (1) 2540100 / 018000112998 PBX: 57 (1) 2540111\nwww.anla.gov.co    Email: licencias@anla.gov.co  \nPágina 6 de 34\nrecursos naturales y puntualmente las relacionadas en los literales a, b y c del numeral 2 requieren los \nsiguiente:\n2.\nRealizar mediciones de nivel y caudal de agua captada bajo las siguientes condiciones:\na.Localizar una sección transversal estable en un punto inmediatamente aguas arriba del sitio \nde la captación, teniendo en cuenta que no haya aportes o extracciones significativas de \ncaudal (naturales o antrópicas), siguiendo los lineamientos establecidos por el Protocolo para \nel Monitoreo y Seguimiento del Agua (IDEAM, 2007), o aquel que lo modifique, derogue o \nsustituya, para  la medición de caudal e instalar allí un medidor de nivel en el que se \nestablezca el nivel correspondiente al caudal ambiental. Presentar en los Informes de \nCumplimiento Ambiental – ICA los métodos seleccionados para medición de caudal y nivel y \nsu justificación, de acuerdo con los métodos establecidos en el Protocolo en mención.\nb.Para captaciones permanentes, con una frecuencia semanal durante todo el año y para \ncaptaciones intermitentes, inmediatamente antes del inicio de la captación y durante el \nperiodo de la captación. A partir de la curva de calibración, presentar el cálculo de los \ncaudales correspondientes. Presentar la base de datos en los respectivos Informes de \nCumplimiento Ambiental –ICA.\nc.La calibración de la curva nivel-caudal de la sección transversal del cuerpo de agua, siguiendo \nlo establecido en el Protocolo en mención, dos veces al año considerando épocas de \nmáximas y mínimas precipitaciones, de acuerdo con la variación hidrológica presentada en \nel EIA. En caso de que por condicionesde variabilidad climática no sea posible realizar la \ncalibración de la curva nivel-caudal en dichas épocas, justificar en el correspondiente ICA su \nejecución en épocas de transición. De la misma forma, realizar una vez al año, el \nlevantamiento de la sección transversal donde se calibró la curva nivel-caudal, y en caso de \nque identifique un cambio significativo en la geometría de la sección transversal presentada \nhistóricamente, proyectar los ajustes necesarios de la curva. Presentar los respectivos \nsoportes en los Informes de Cumplimiento Ambiental – ICA.\nVisto lo anterior, se presentan las siguientes consideraciones:\n<0000> De acuerdo con lo presentando en el FUN y en el numeral 4.1.1 Nombre de las fuentes de captación \ndel capítulo 4 Demanda de recursos naturales, el punto de captación para el cual se solicitó el \npermiso se encuentra sobre el espejo de agua del embalse de Betania en las coordenadas E \n4723114,97 y N 1847701,86 en el predio conocido como “Peñalisa” en la vereda Vilú del municipio \ndeYaguará, tal como se aprecia en la Tabla 1 y Figura 1.\n2. Tabla 1. Localización punto de captación\nCOORDENADA\nS PLANAS \nMAGNA \nSIRGAS \nORIGEN \nCENTRAL\nCOORDENADAS \nPLANAS MAGNA \nSIRGAS ORIGEN \nNACIONAL\nCUERP\nO DE \nAGUA\nID\nESTE\nNORTE\nESTE\nNORTE\nPREDIO\nVEREDA\nMUNICIPIO\nCAUDAL\n(l/s)\nEmbalse \nde \nBetania\nCAPT_AS_\n1\n842.788 781.465 4.723.114,9\n7\n1.847.701,8\n6\nPeñalisa Vilú Yaguará\n70\nFuente: ECOPETROL, 2022. \n\nResolución No.  03115           Del   30 de diciembre de 2022            Hoja No. 7 de 34\n“Por la cual se resuelve un recurso de reposición contra de la Resolución 2526 del 19 de octubre de 2022”\nOficinas: Carrera 13 A No. 34 – 72 Edificio 13 35 Pisos 8 Bogotá, D.C.\nCentro de Orientación y Radicación de Correspondencia: Carrera 13 A No. 34 – 72 Edificio 13 35 \nLocales 110 al 112 Bogotá, D.C.  \nCódigo Postal 110311156\nNit.: 900.467.239-2\nLínea de Orientación y Contacto Ciudadano: 57 (1) 2540100 / 018000112998 PBX: 57 (1) 2540111\nwww.anla.gov.co    Email: licencias@anla.gov.co  \nPágina 7 de 34\nFigura 1. Localización punto de \ncaptación\nFuente: ECOPETROL, 2022.\n<0000>\nSegún el Glosario Hidrológico Internacional emitido por la Organización Meteorológica Mundial \n(OMM) y por la Organización de las Naciones Unidas para la Educación, la Ciencia y la Cultura \n(UNESCO), el término sección transversal, se define como: “Sección perpendicular a la dirección \nprincipal del flujo delimitada por la superficie libre y el perímetro mojado de la corriente o del cauce”. \nAsí mismo, este glosario define el termino cauce, como: “Curso de agua claramente definido por \nel que fluye agua de forma periódica o continua”. Las anteriores definiciones no se adecuan a las \ncaracterísticas hidrológicas del cuerpo de agua donde se tiene el punto de captación toda vez que \ncorrespondea un embalse o represa como ya se mencionó.\n<0000>En el numeral 3.2.4.2.1.2 Sistemas lenticos artificiales del capítulo 3.2 Medio Abiótico presentado \nen el EIA para el trámite de la presente modificación de la licencia de Campo Yaguará, se \nrelaciona el embalse de Betania como un sistema lentico de origen antrópico y no como un \ncuerpo de agua lótico.\n<0000>Según Monsalve Sáenz2, “La finalidad de la regla limnimétrica es la de relacionar el nivel de agua \nen un río con su caudal. El limnígrafo es un aparato que mide la variación continua en el tiempo \ndel nivel de agua en una sección de una corriente. Dicha sección se debe localizar en un trecho \nde la corriente relativamente estable, rectilíneo y de fácil acceso. Así mismo, Monsalve Sáenz \nindica lo siguiente respecto a las curvas nivel – caudal: “De esta manera se miden, utilizando el \nmolinete, los caudales en el río para varios niveles de agua. Anotando el caudal correspondiente \na un nivel de agua, se puede construir una curva de calibración, que relaciona el nivel de agua \nen un determinado momento de la sección con su caudal respectivo”. De estas consideraciones, \nse concluye que tanto los medidores de nivel o reglas limnimétrica, así como las curvas de \ncalibración nivel - caudal tienen aplicabilidad en la práctica en cuerpos de agua lóticos donde se \ncumplan criterios como secciones transversales perpendiculares al flujo de agua, relativamente \nestables y rectilíneas, aspectos que no se presentan en un cuerpo de agua léntico como lo es el \nembalse de Betania.\n<0000>En virtud de los argumentos citados anteriormente, ECOPETROL S.A., se permite reponer los \nliterales a, b y c del numeral 2 del artículo primero en el sentido de no incluir estas obligaciones \nen la presente modificación de la licencia ambiental del Campo Yaguará, toda vez que el embalse \nBetania es considerado un cuerpo de agua antrópico lentico, por lo que, las obligaciones \nestablecidas no son técnicamente aplicables al cuerpo de agua donde se tiene el punto de \ncaptación. En virtud de esto, se propuso la respectiva medida de manejo correspondiente a la \nmedición del caudal captado y dicha medida se encuentra consignada en la ficha de manejo 4.1 \nCaptación de agua superficial, la cual fue aprobada por esta autoridad ambiental. Sumado a lo \nanterior, el embalse es un sistema de origen antrópico y el nivel de la lámina de agua varia \nconforme las necesidades operativas de la empresa operadora de la central hidroeléctrica. En \ncuanto a su capacidad total, el embalse de Betania puede contener hasta 1971 millones de m3 \nen un área de 5235 hectáreas aproximadamente, y por tanto el caudal concesionado de 70 l/s \nno tiene la capacidad de afectar el caudal ambiental del cuerpo de agua en mención.\n\nResolución No.  03115           Del   30 de diciembre de 2022            Hoja No. 8 de 34\n“Por la cual se resuelve un recurso de reposición contra de la Resolución 2526 del 19 de octubre de 2022”\nOficinas: Carrera 13 A No. 34 – 72 Edificio 13 35 Pisos 8 Bogotá, D.C.\nCentro de Orientación y Radicación de Correspondencia: Carrera 13 A No. 34 – 72 Edificio 13 35 \nLocales 110 al 112 Bogotá, D.C.  \nCódigo Postal 110311156\nNit.: 900.467.239-2\nLínea de Orientación y Contacto Ciudadano: 57 (1) 2540100 / 018000112998 PBX: 57 (1) 2540111\nwww.anla.gov.co    Email: licencias@anla.gov.co  \nPágina 8 de 34\nPor otro lado, el parágrafo del artículo primero de la Resolución 2526 de octubre de 2022 establece lo \nsiguiente:\n“PARÁGRAFO: El permiso que se otorga en el presente artículo comenzará a regir una vez termine la \nvigencia del permiso otorgado a la sociedad por la Corporación Autónoma Regional del Alto Magdalena \n–CAM.”\nTeniendo en cuenta que el permiso otorgado por la Corporación Autónoma Regional del Alto Magdalena \n– CAM finaliza vigencia en el mes de abril del 2025, la sociedad solicita que se modifique el parágrafo del \nartículo primero, de tal manera que el permiso entre a regir a partir del momento en que se radique la \nsolicitud de desistimiento del permiso ante la CAM y no desde que se termine la vigencia del permiso \notorgado por la corporación, lo anterior, teniendo en cuenta además lo dispuesto en el Decreto 1076 de \n2015, en su artículo 2.2.2.3.1.3, que establece que las licencias ambientales llevan implícitos los permisos \nde uso y aprovechamiento de recursos naturales, por ende el instrumento que nos entra a regir sería la \npresente modificación de la licencia y ya no el permiso otorgado por la CAM:\n“(…)\nLa licencia ambiental llevará implícitos todos los permisos, autorizaciones y/o concesiones para el uso, \naprovechamiento y/o afectación de los recursos naturales renovables, que sean necesarios por el tiempo \nde vida útil del proyecto, obra o actividad.\nEl uso aprovechamiento y/o afectación de los recursos naturales renovables, deberán ser claramente \nidentificados en el respectivo estudio de impacto ambiental”.\n(…)\nSe solicita a esa autoridad MODIFICAR el artículo primero de la Resolución 2526 de 2022, en el sentido \nde otorgar la concesión de superficiales de 70 l/s del Embalse de Betania para uso doméstico e industrial, \nen el punto denominado Peñalisa, vereda Vilú del municipio de Yaguará, bajo los siguientes términos:\n•\nSe solicita no incluir las obligaciones consignadas en los literales a, b y c del numeral 2 del artículo \nprimero, toda vez que no son aplicables al cuerpo de agua donde se tiene el punto de captación.\n•\nSe permita a ECOPETROL S.A., desistir del permiso ante la CAM con el fin de que la vigencia de la \nconcesión bajo la licencia se haga efectiva una vez se radique la solicitud de desistimiento del permiso \nante la CAM.\n(…)”\nCONSIDERACIONES TÉCNICAS DE LA ANLA\nAnalizada la solicitud presentada por la sociedad y de conformidad con lo establecido en el Concepto \nTécnico 8278 del 29 de diciembre de 2022, el cual dispuso:\n“Considerando por parte del equipo técnico de evaluación de la ANLA, lo presentando en el recurso de \nreposición, se resalta que efectivamente en el estricto sentido en que la Sociedad argumenta que para \nmedir el caudal de agua captado de la represa de Betania (cuerpo de agua de carácter léntico de origen \nantrópico), la metodología de la curva de nivel-caudal de la sección transversal del cuerpo de agua \n(sección perpendicular a la dirección principal del flujo delimitada por la superficie libre y el perímetro \nmojado de la corriente o del cauce), no es la más efectiva y/o adecuada, debido a que es un método de \nmedición aplicado a cuerpos de agua loticos (corrientes de agua en cauces) principalmente, en el cual se \nemplea la ecuación hidrodinámica, que define que el caudal de agua es igual a la multiplicación del área \nde la sección transversal por la velocidad de flujo del fluido (medido mediante instrumentos tales como \nmolinete u ostros) y basado en esto, se desarrolla una ecuación lineal directa (calibración) entre caudal \nde agua (en l/s, m3/s, etc.) y altura de una regleta o limnímetro (instrumento que mide longitud o en este \ncaso altura en cm, m,etc), para poder establecer cualitativamente y cuantitativamente (no de forma exacta) \nel caudal de agua del cauce (en cualquier momento) y/o corriente de agua respecto a la altura de la regleta, \n\nResolución No.  03115           Del   30 de diciembre de 2022            Hoja No. 9 de 34\n“Por la cual se resuelve un recurso de reposición contra de la Resolución 2526 del 19 de octubre de 2022”\nOficinas: Carrera 13 A No. 34 – 72 Edificio 13 35 Pisos 8 Bogotá, D.C.\nCentro de Orientación y Radicación de Correspondencia: Carrera 13 A No. 34 – 72 Edificio 13 35 \nLocales 110 al 112 Bogotá, D.C.  \nCódigo Postal 110311156\nNit.: 900.467.239-2\nLínea de Orientación y Contacto Ciudadano: 57 (1) 2540100 / 018000112998 PBX: 57 (1) 2540111\nwww.anla.gov.co    Email: licencias@anla.gov.co  \nPágina 9 de 34\nasí las cosas y dado que la represa de Betania no es un cuerpo lótico, la relación directa entre altura de \nla regleta y/o limnímetro, no reporta información sobre el caudal de agua en la represa.\nBasado en lo anterior, el equipo técnico de evaluación de ANLA, considera que la sociedad Ecopetrol S.A.  \npresenta argumentos adecuados en cuanto a que la metodología de medición de niveles y caudales \nestablecida en las obligaciones a, b, c, del numeral 2 del artículo primero de la Resolución 2526 de 2022, \npuede no ser  aplicable a la represa de Betania y aclara que la implementación de la instrumentación de \nregleta o limnímetro en las represas o presas se emplea  para tener información primaria de niveles de \nagua y monitoreo de zonas de posible inundación de este tipo de cuerpos de agua y es una información \nque en este caso debe levantar la central hidroeléctrica.\nSin embargo, siguiendo con lo expuesto, y considerando los argumentos presentados por la Sociedad en \ncuanto a que los 70 l/s autorizados por la ANLA en la captación de agua para el proyecto Campo de \nProducción Yaguará, no tiene la capacidad de afectar el caudal ecológico de la represa de Betania, dado \nque esta tiene una capacidad de contener y almacenar 1.971 millones de m3 , el grupo técnico de \nevaluación de la ANLA, le aclara a la Sociedad que cualquier impacto ambiental que se genere sobre el \ncuerpo de agua en este caso en la represa de Betania bien sea por captaciones, vertimientos, uso y \nusuarios actuales y/o potenciales, tiene un carácter acumulativo, por lo que se debe llevar un monitoreo \nperiódico del recurso natural agua, el cual presta unos servicios ecosistémicos en la zona de ejecución del \nproyecto y en general a la región, por lo tanto,  la ANLA en su labor de seguimiento del uso y \naprovechamiento de los recursos naturales del país y de su estado actual y futuro, establece una serie de \nobligaciones mínimas que permitan garantizar el adecuado manejo ambiental del proyecto en mención \ndurante la vida útil de los proyectos, dado que debe contar con el total de la información local, regional y \nnacional del cuerpo de agua de la Represa de Betania, para la toma de decisiones de carácter ambiental \nde los proyectos que se pretendan ejecutar en esta región.\nBasados en todo lo anterior, el equipo técnico de evaluación de la ANLA considera modificar la obligación \ndel numeral 2 del artículo primero de la Resolución 2526 de 2022, en el sentido de eliminar la medición \ndel nivel de agua captado y la metodología establecida en los lineamientos del Protocolo para el Monitoreo \ny Seguimiento del Agua (IDEAM, 2007), por lo cual la obligación quedara así:\n2.\nRealizar mediciones de caudal de agua captada bajo las siguientes condiciones:\na. Localizar un medidor de flujo debidamente calibrado en el sitio de la captación, para la medición de \ncaudal. Presentar en los Informes de Cumplimiento Ambiental – ICA los métodos seleccionados para \nmedición de caudal y su justificación, de acuerdo con los métodos establecidos para este tipo de mención.\nb. Para la captación sobre la represa de Betania, se deberá realizar un registro durante todo el año y \npresentar el cálculo de los caudales correspondientes. Presentar la base de datos en los respectivos \nInformes de Cumplimiento Ambiental – ICA.\nc. Presentar en los Informes de Cumplimiento Ambiental – ICA el análisis de la información acumulada y \nsu comparación con los caudales obtenidos en la línea base (caudales medios mínimos, máximos \nmensuales multianuales y caudales ambientales).”\nCONSIDERACIONES JURÍDICAS DE LA ANLA \nDe acuerdo con las consideraciones técnicas expuestas anteriormente, no es adecuado medir el \ncaudal captado de la represa de Betania mediante la metodología de la curva de nivel-caudal, por \ntratarse de un cuerpo de agua léntico, por lo cual se acepta los argumentos presentados por la \nsociedad en este aspecto.\nNo obstante lo señalado, considera esta autoridad que no es viable eliminar las obligaciones, sino \nmodificarlas en el sentido de establecer monitoreos que permita realizar seguimiento sobre si se llega \na presentar un impacto ambiental en dicho cuerpo de agua. \nDe otra parte, en lo que respecta a la petición relacionada con que la vigencia de la concesión otorgada \nmediante la Resolución 2526 del 19 de octubre de 2022 por la ANLA, se haga efectiva con la radicación \ndel desistimiento del permiso ante la Corporación Autónoma Regional del Alto Magdalena –CAM, es \n\nResolución No.  03115           Del   30 de diciembre de 2022            Hoja No. 10 de 34\n“Por la cual se resuelve un recurso de reposición contra de la Resolución 2526 del 19 de octubre de 2022”\nOficinas: Carrera 13 A No. 34 – 72 Edificio 13 35 Pisos 8 Bogotá, D.C.\nCentro de Orientación y Radicación de Correspondencia: Carrera 13 A No. 34 – 72 Edificio 13 35 \nLocales 110 al 112 Bogotá, D.C.  \nCódigo Postal 110311156\nNit.: 900.467.239-2\nLínea de Orientación y Contacto Ciudadano: 57 (1) 2540100 / 018000112998 PBX: 57 (1) 2540111\nwww.anla.gov.co    Email: licencias@anla.gov.co  \nPágina 10 de 34\npreciso indicar que si bien, el artículo 2.2.2.3.1.3. del Decreto 1076 de 2015 establece que “la licencia \nambiental llevará implícitos todos los permisos, autorizaciones y/o concesiones para el uso, \naprovechamiento y/o afectación de los recursos naturales renovables, que sean necesarios por el \ntiempo de vida útil del proyecto, obra o actividad”; el numeral 2 del artículo 2.2.2.3.11.1 del citado \nDecreto consagró:\n“(…)\n2.\nLos proyectos, obras o actividades, que de acuerdo con las normas vigentes antes de la expedición \ndel presente decreto, obtuvieron los permisos, concesiones, licencias y demás autorizaciones de \ncarácter ambiental que se requerían, continuarán sus actividades sujetos a los términos, condiciones \ny obligaciones señalados en los actos administrativos así expedidos.”\nAsí las cosas, como el presente proyecto comenzó a ejecutarse antes de la entrada en vigencia de la \nley 99 de 1993, éste contaba con permisos ambientales en el momento en que se otorgó la licencia \nambiental global, esto es en 1999, es decir que la licencia ambiental fue otorgada por el entonces \nMinisterio del Medio Ambiente, pero ya tenía, algunos permisos ambientales otorgados por la \nCorporación, por lo que se ajusta a lo establecido en el artículo 2.2.2.3.11.1. \nEn ese caso, los permisos continuaban rigiéndose por las reglas con las cuales  fueron otorgadas, y \naunque se permite solicitar el permiso con la autoridad con la que tiene la licencia ambiental, no es \nposible que mantenga dos permisos vigentes al tiempo.\nAhora, la sociedad solicita que se permita desistir del permiso que cuenta actualmente con la autoridad \nregional y solo se mantenga el otorgado por la ANLA, sin embargo, se aclara que el desistimiento es \nuna figura jurídica de aplicación durante los trámites administrativos y no cuando ya hay una decisión \nen firme.\nDel mismo modo, es claro que actualmente la sociedad cuenta con un permiso otorgado por la \nautoridad regional bajo un acto administrativo que cuenta con presunción de legalidad hasta que el \nmismo finalice o desaparezcan sus fundamentos. \nEs así como, la vigencia de la concesión otorgada por esta Autoridad solo comenzará hasta que \nfinalice el permiso otorgado por la Corporación ya sea porque se cumple el término para el cual fue \notorgado  o por otra figura jurídica, siempre que sea soportado que ya no se tiene el permiso con dicha \nautoridad.\nAdicional a lo anterior, la simple radicación de una solicitud de no continuar con el permiso ante la \nautoridad regional, no puede generar efecto alguno sin una desición de fondo en firme que resuelva \nla solicitud presentada ante la autoridad regional.\nEs así como, aun cuando la empresa presente el radicado de una solicitud de no continuar con el \npermiso ante la autoridad regional, si no cuenta con el pronunciamiento de la Corporación, el permiso \ncontinuaría vigente, por lo que, de acceder a esta petición, se generaría una duplicidad de permisos \npara un mismo fin.\nEn este entendido el parágrafo del artículo primero de la Resolución 2526 de 2022, se establece en \ntérminos de vigencia, con el fin de dar claridad que para la ANLA, solo rige el permiso que otorgó en \nla resolución citada cuando no tenga vigencia el permiso de la autoridad regional, ya sea por \nfinalización del plazo o concluya (bajo la figura jurídica que resulte), por lo tanto no hay lugar a \nmodificar el parágrafo recurrido.\nEn este sentido, esta Autoridad procederá a modificar la obligación establecida en el numeral 2 del \nartículo primero de la Resolución 2526 del 19 de octubre de 2022, en el sentido de eliminar la medición \ndel nivel de agua captada y la metodología establecida en los lineamientos del Protocolo para el \n\nResolución No.  03115           Del   30 de diciembre de 2022            Hoja No. 11 de 34\n“Por la cual se resuelve un recurso de reposición contra de la Resolución 2526 del 19 de octubre de 2022”\nOficinas: Carrera 13 A No. 34 – 72 Edificio 13 35 Pisos 8 Bogotá, D.C.\nCentro de Orientación y Radicación de Correspondencia: Carrera 13 A No. 34 – 72 Edificio 13 35 \nLocales 110 al 112 Bogotá, D.C.  \nCódigo Postal 110311156\nNit.: 900.467.239-2\nLínea de Orientación y Contacto Ciudadano: 57 (1) 2540100 / 018000112998 PBX: 57 (1) 2540111\nwww.anla.gov.co    Email: licencias@anla.gov.co  \nPágina 11 de 34\nMonitoreo y Seguimiento del Agua (IDEAM, 2007); sin embargo, no se accederá a la petición de \nmodificar el parágrafo del artículo primero de la mencionada Resolución, por lo que se procederá a \nconfirmar.\n2.\nRESPECTO A LA SOLICITUD DE MODIFICAR EL ARTÍCULO TERCERO DE LA \nRESOLUCIÓN 2526 DEL 19 DE OCTUBRE DE 2022.\nArgumentos y Petición de la sociedad:\n“Según lo indicado en el artículo tercero de la Resolución 2526 de 2022, referente a: “otorgar a la sociedad \nECOPETROL S.A. permiso de Emisiones Atmosféricas, para la quema de gas y operación con \ncombustibles en las actividades planteadas en el proyecto, mediante la instalación y operación de \ngeneradores, teas y demás equipos de menor tamaño necesarios para la actividad.”, la ANLA autoriza las \nemisiones atmosféricas de los equipos relacionados en dicho artículo. Sin embargo, en la tabla presentada \npor la autoridad, no se incluyen equipos solicitados en el trámite de modificación de la licencia ambiental \ncomo los motocompresores y las bombas de despacho de crudo.\nEn relación con lo establecido para el permiso de emisiones se tienen las siguientes consideraciones\n<0000>En el formato único nacional de solicitud de permiso de emisiones atmosféricas de las fuentes \nfijas FUN presentado en el anexo 7.5 del estudio de impacto ambiental para la presente \nmodificación, se relacionaron dos (2) motocompresores a gas con una capacidad de 300 HP y \ntres (3) bombas de despacho de crudo tambiéna gas y con capacidad de 12 KCFD. De igual \nmanera, en el numeral 4.7.1 Emisión de contaminantes del aire – fuentes de emisión del capítulo \n4 Demanda de recursos naturales, tal como se presenta a continuación:\n3. Tabla 2. Fuentes fijas de emisiones atmosféricas\nCOORDENADAS \nPLANAS MAGNA \nSIRGAS ORIGEN \nNACIONAL\nINSTALACIÓNCODIGO EQUPOS\nESTE\nNORTE\nCapacidad Consumo Combustible\nTE_1\nTratador \nelectrostático 1\n4719564\n1848230 60.000\nPCG/día\n6.300 ft3/h\nGas\nTratadores \nelectrostáticos\nTE_2\nTratador \nelectrostático 2\n4719571\n1848226 5.000\nBBL/día\n6.300 ft3/h\nGas\nMG_1\nMotorgenerador 1\n4719439\n1848297 1.200 HP\n124 m3/día\nGas\nMG_2\nMotorgenerador 2\n4719444\n1848297 1.200 HP\n124 m3/día\nGas\nMG_3\nMotorgenerador 3\n4719449\n1848296 1.200 HP\n159 m3/día\nGas\nEstación de \ngeneradores\nMG_4\nMotorgenerador 4\n4719454\n1848296 2.200 HP\n8,2 Gal/día\nDiesel\nMC_1\nMotor compresor 1\n4719580\n1848273 1.340 HP\n100 m3/día\nGas\nCaseta de \ncompresores\nMC_2\nMotor compresor 2\n4719587\n1848268 1.340 HP\n100 m3/día\nGas\nTEA_A\nTea alta presión\n4719540\n1848573\n300 HP\n100 m3/día\nGas\nTea de alta y \ntea de baja\nTEA_B\nTea baja presión\n4719561\n1848572\n300 HP\n100 m3/día\nGas\nMB_1\nMotor bomba 1\n4719511\n1848360\n300 HP\n100 m3/día\nGas\nMB_2\nMotor bomba 2\n4719517\n1848360\n12 KCFD\n309 m3/día Gas residual\nBombas de \ndespacho\nMB_3\nMotor bomba 3\n4719524\n1848360\n12 KCFD\n85 m3/día Gas residual\nFuente: ECOPETROL, 2022. \n\nResolución No.  03115           Del   30 de diciembre de 2022            Hoja No. 12 de 34\n“Por la cual se resuelve un recurso de reposición contra de la Resolución 2526 del 19 de octubre de 2022”\nOficinas: Carrera 13 A No. 34 – 72 Edificio 13 35 Pisos 8 Bogotá, D.C.\nCentro de Orientación y Radicación de Correspondencia: Carrera 13 A No. 34 – 72 Edificio 13 35 \nLocales 110 al 112 Bogotá, D.C.  \nCódigo Postal 110311156\nNit.: 900.467.239-2\nLínea de Orientación y Contacto Ciudadano: 57 (1) 2540100 / 018000112998 PBX: 57 (1) 2540111\nwww.anla.gov.co    Email: licencias@anla.gov.co  \nPágina 12 de 34\nFigura 2. Localización fuentes fijas de emisiones atmosféricas de la BateríaYaguará\nFuente: ECOPETROL, 2022.\n<0000>\nDentro de lo consignado en el numeral 4.7.1 Emisión de contaminantes del aire – fuentes \nde emisión del capítulo 4 Demanda de recursos naturales se presentó a descripción de los \nmotocompresores y bombas de despacho, así como el cálculo de las emisiones por \ncontaminante para estos equipos según factores de emisión, como se presenta a \ncontinuación:\nCompresores de gas\nUna cantidad de gas asociado y reciclado proveniente de los separadores de producción y de prueba es \ncomprimida y deshidratada. Dos (2) compresores con tres etapas de compresión son impulsados por \nmotores a gas con una presión desucción de 34 Psi y una presión de descarga de 1.280 Psi.\nBombas oleoducto\nEl crudo de la estación Yaguará se transporta por un ducto de 8” de diámetro con una longitud \ncercana de KK 68+159 m. Para llevar a cabo el transporte, la Facilidad Yaguará cuenta con una caseta \nde bombas de despacho compuesta por tres (3) bombas de transferencia tipo bomba-tornillo, que \nfuncionan con gas natural como combustible.\nEmisiones en teas\nDe acuerdo con la información presentada (en el Anexo 12. Modelación de Aire y ruido/1. Calidad del \nAire/1. Anexos/4. Fichas técnicas y datos de procesos) se presenta los procedimientos y bases de \ncálculo).\n4. Tabla 3. Tasa de emisiones en teas\nEmisiones\n(g/ s)\nPM10\nPM2.5\nSO2\nNO2\nCO\nBenceno\nTolueno\nTea alta\n3,22x10-3\n3,22x10-3\n1,69x10-3\n3,54x10-3\n1,61x10-2\n9,10x10-6 3,32x10-6\nTea baja\n8,82x10-4\n4,64x10-4\n9,72x10-4\n4,43x10-3\n9,43x10-3\n9,11x10-7 4,55x10-7\nFuente: ECOPETROL, 2022.\n\nResolución No.  03115           Del   30 de diciembre de 2022            Hoja No. 13 de 34\n“Por la cual se resuelve un recurso de reposición contra de la Resolución 2526 del 19 de octubre de 2022”\nOficinas: Carrera 13 A No. 34 – 72 Edificio 13 35 Pisos 8 Bogotá, D.C.\nCentro de Orientación y Radicación de Correspondencia: Carrera 13 A No. 34 – 72 Edificio 13 35 \nLocales 110 al 112 Bogotá, D.C.  \nCódigo Postal 110311156\nNit.: 900.467.239-2\nLínea de Orientación y Contacto Ciudadano: 57 (1) 2540100 / 018000112998 PBX: 57 (1) 2540111\nwww.anla.gov.co    Email: licencias@anla.gov.co  \nPágina 13 de 34\nEmisiones por combustión interna y externa a gas natural\nPara la estimación de las emisiones se toma como referencia los factores de emisión de los \nmotores generadores principales de la batería, así como las bombas de transferencia y \ncompresores.\n5. Tabla 4. Tasa de emisión en fuentes de combustión\nEmisión \n(g/s)\nPM10\nPM2.5\nSO2\nNO2\nCO\nBencen\no\nTolueno\nTratador \nElectroestático\n6,03x10-3\n6,03x10-3 2,34x10-\n2\n1,11x10-\n1\n6,67x1\n0-2\n1,67x10-\n6\n2,70x10-\n6\nMotorgenerador \n(gas)\n1,61x10-6\n1,61x10-6 1,23x10-\n5\n1,77x10-\n2\n1,17x1\n0-2\n9,20x10-\n6\n8,53x10-\n6\nMotorgenerador \n(diésel)\n6,79x10-3\n6,79x10-3 1,47x10-\n4\n1,86x10-\n1\n3,60x1\n0-2\n5,42x10-\n10\n1,96x10-\n10\nCompresor\n1,61x10-6\n1,61x10-6 1,23x10-\n5\n1,77x10-\n2\n1,17x1\n0-2\n9,20x10-\n6\n8,53x10-\n6\nBomba de \ntransferencia\n1,61x10-6\n1,61x10-6 1,23x10-\n5\n1,77x10-\n2\n1,17x1\n0-2\n9,20x10-\n6\n8,53x10-\n6\nFuente: ECOPETROL, 2022.\nDadas las consideraciones anteriores, ECOPETROL S.A., solicita reponer el artículo tercero de la \nResolución 2526 de octubre de 2026, en el sentido de adicionar los motocompresores y bombas de \ntransferencia a la relación de equipos autorizados dentro del permiso de emisiones atmosféricas para el \nCampo Yaguará ya que estas fuentes de emisión se solicitaron dentro del FUN y se relacionaron en el \nestudio de impacto ambiental. Adicionalmente, estos equipos se encuentran incluidos dentro del \npermiso de emisiones atmosféricas que se tiene con la Corporación Autónoma Regional del Alto \nMagdalena – CAM. \nCon relación a los equipos que, si se incluyen en el artículo tercero de la Resolución 2526 de 2022, \nECOPETROL S.A. solicita se aclare el nombre de las teas, toda vez que en la tabla presentada se \nmenciona dos veces la tea de alta y se omite la tea debaja.\nPor último, el parágrafo segundo del artículo tercero de la Resolución 2526 de octubre de 2022 establece \nlo siguiente:\n“PARÁGRAFO: El permiso que se otorga en el presente artículo comenzará a regir una vez \ntermine la vigencia del permiso otorgado a la sociedad por la Corporación Autónoma Regional \ndel Alto Magdalena –CAM.”\nEn este sentido y tal como lo manifestamos en el punto anterior, teniendo en cuenta  que el permiso \notorgado por la Corporación Autónoma Regional del Alto Magdalena-CAM finaliza vigencia en el mes de \nenero del 2024, la empresa solicita que se modifique el parágrafo segundo del artículo tercero, de tal \nmanera que se permita a ECOPETROL S.A., desistir del permiso ante la CAM con el fin de que la vigencia \nde la concesión otorgadas (SIC) bajo la presente modificación de la licencia se haga efectiva una vez se \nradique la solicitud de desistimiento del permiso ante la autoridad ambiental regional.\n(…)\nModificar el artículo tercero de la Resolución 2526 de 2022, en el sentido de otorgar el permiso de \nemisiones atmosféricas bajo los siguientes términos:\n<0000>\nAdicionar los motocompresores y bombas de transferencia a la relación de equipos autorizados \ndentro del permiso de emisiones atmosféricas para el Campo Yaguará.\n\nResolución No.  03115           Del   30 de diciembre de 2022            Hoja No. 14 de 34\n“Por la cual se resuelve un recurso de reposición contra de la Resolución 2526 del 19 de octubre de 2022”\nOficinas: Carrera 13 A No. 34 – 72 Edificio 13 35 Pisos 8 Bogotá, D.C.\nCentro de Orientación y Radicación de Correspondencia: Carrera 13 A No. 34 – 72 Edificio 13 35 \nLocales 110 al 112 Bogotá, D.C.  \nCódigo Postal 110311156\nNit.: 900.467.239-2\nLínea de Orientación y Contacto Ciudadano: 57 (1) 2540100 / 018000112998 PBX: 57 (1) 2540111\nwww.anla.gov.co    Email: licencias@anla.gov.co  \nPágina 14 de 34\n<0000>\nSe aclare el nombre de las teas, toda vez que en el artículo tercero se menciona dos veces la \ntea de alta y se omite la tea de baja.\n<0000>\nSe permita a ECOPETROL S.A., desistir del permiso ante la CAM con el fin de que la vigencia \nde la concesión bajo la licencia se haga efectiva una vez se radique la solicitud de desistimiento \ndel permiso ante la CAM.”\nCONSIDERACIONES TÉCNICAS DE LA ANLA\nAnalizada la solicitud presentada por la sociedad y de conformidad con lo establecido en el Concepto \nTécnico 8278 del 29 de diciembre de 2022, el cual dispuso:\n“El equipo técnico de evaluación de ANLA consideró las indicaciones técnicas y jurídicas presentadas por \nla Sociedad en el recurso de reposición, después de verificar los argumentos mostrados, este equipo se \npermite indicar lo siguiente, asociado a cada ítem de la solicitud de modificación del artículo tercero de la \nResolución 2526 del 19 de octubre de 2022.\nEn primera instancia se identificó que en el artículo tercero de la Resolución 2526 del 19 de octubre de \n2022 se está relacionando los equipos que componen el permiso de emisiones atmosféricas, en el cual \nse aclara que se puede usar “demás equipos de menor tamaño necesarios para la actividad”. \nAdicionalmente, se verificó que en el parágrafo primero de este artículo se relaciona la lista de equipos y \nse indica que se podrán usar “otros equipos requeridos para el funcionamiento de esta actividad.”  En \nconsecuencia, esta autoridad estimaba que en las indicaciones asociadas a “equipos de menor tamaño \ny otros tipos de equipos” se vinculaban los motocompresores y las bombas de despacho de crudo. Sin \nembargo, se comprende la solicitud generada por la Sociedad y se considera que es viable adicionar los \nequipos requeridos en el nombrado artículo.\nPor otra parte, se validó que existe un error tipográfico en el artículo 3 de la Resolución 2526 del 19 de \noctubre de 2022, debido a que en la tabla que describe los tipos de equipos autorizados, su capacidad, \nel combustible usado, la cantidad autorizada y las respectivas tasas de emisión, se evidenció que registra \ndos veces tea de alta. Lo cual se consideró como un error tipográfico al momento de generar dicha tabla, \npuesto que en todo el documento se especifica que es una Tea de Alta y una Tea de Baja. Por lo anterior, \nse considera necesario hacer la respectiva corrección y modificación de la tabla de este artículo. \n(…)\nTeniendo en cuenta lo antes descrito, se acogen las indicaciones suministradas por la Sociedad para \nrealizar la modificación de la tabla que contiene el artículo tercero de la Resolución 2526 del 19 de octubre \nde 2022. Por consiguiente, esta Autoridad Nacional concluye que es viable realizar la modificación del \nerror tipográfico en la nombrada tabla, adicionalmente, incluir los equipos solicitados de forma tal que \ncontenga lo solicitado por la sociedad, modificando la tabla de la siguiente forma:\nTasas de emisión por contaminante \nen (g/s)\nEquipo\nCapacidad\nComb\nCantidad.\n Autorizada\nPM \n10\nPM \n2.5\nSO2\nNO2\nCO\nGenerador\n575 kW\nGas\n2\n1,61x\n10-6\n1,61x\n10-6\n1,23x\n10-5\n1,77x\n10-2\n1,17x\n10-2\nGenerador\n1400 kW\nGas\n1\n1,61x\n10-6\n1,61x\n10-6\n1,23x\n10-5\n1,77x\n10-2\n1,17x\n10-2\nGenerador\n1360 kW\nDiesel\n1\n6,79x\n10-3\n6,79x\n10-3\n1,47x\n10-4\n1,86x\n10-1\n3,60x\n10-2\nTratador electrostático\nN/A\nGas\n2\n6,03x\n10-3\n6,03x\n10-3\n2,34x\n10-2\n1,11x\n10-1\n6,67x\n10-2\nTea de alta\nN/A\nGas\n1\n3,22x\n10-3\n3,22x\n10-3\n1,69x\n10-3\n3,54x\n10-3\n1,61x\n10-2\nTea de baja\nN/A\nGas\n1\n8,82x\n10-4\n4,64x\n10-4\n9,72x\n10-4\n4,43x\n10-3\n9,43x\n10-3\n\nResolución No.  03115           Del   30 de diciembre de 2022            Hoja No. 15 de 34\n“Por la cual se resuelve un recurso de reposición contra de la Resolución 2526 del 19 de octubre de 2022”\nOficinas: Carrera 13 A No. 34 – 72 Edificio 13 35 Pisos 8 Bogotá, D.C.\nCentro de Orientación y Radicación de Correspondencia: Carrera 13 A No. 34 – 72 Edificio 13 35 \nLocales 110 al 112 Bogotá, D.C.  \nCódigo Postal 110311156\nNit.: 900.467.239-2\nLínea de Orientación y Contacto Ciudadano: 57 (1) 2540100 / 018000112998 PBX: 57 (1) 2540111\nwww.anla.gov.co    Email: licencias@anla.gov.co  \nPágina 15 de 34\nMotocompresores\n300 HP\nGas\n2\n1,61x\n10-6\n1,61x\n10-6\n1,23x\n10-5\n1,77x\n10-2\n1,17x\n10-2\nBombas de \ntransferencia\n12 KCFD\nGas\n3\n1,61x\n10-6\n1,61x\n10-6\n1,23x\n10-5\n1,77x\n10-2\n1,17x\n10-2\nFuente: Equipo Evaluador Ambiental del documento EIA, 2022\n(…)”\nCONSIDERACIONES JURÍDICAS DE LA ANLA \nEn lo que respecta a la petición relacionada con que se permita desistir del permiso de emisiones \natmosféricas, otorgado por la Corporación Autónoma Regional del Alto Magdalena –CAM, con el fin \nde que la vigencia del mismo, otorgado en la modificación objeto de recurso, se haga efectiva con la \nradicación del desistimiento; es preciso indicar que, como se estableció en el punto anterior, el permiso \nal que hace referencia la sociedad, no fue otorgado por la ANLA, por lo tanto, es competencia de la \nautoridad regional definir la figura jurídica para dar por terminado el mismo.   \nEn ese sentido, actualmente la sociedad cuenta con un permiso otorgado por la autoridad regional \nbajo un acto administrativo que cuenta con presunción de legalidad hasta que el mismo finalice o \ndesaparezcan sus fundamentos. \n     \n Luego entonces, aun cuando la empresa cuente con el radicado del desistimiento, si no cuenta con \nel respectivo pronunciamiento de la Corporación, el permiso continuaría vigente, por lo que, de acceder \na esta petición, se generaría una duplicidad de permisos para un mismo fin. En este sentido, no es \nposible acceder a la petición presentada por la sociedad respecto del inicio de la vigencia del permiso \nde emisiones atmosféricas otorgado por la ANLA, desde el radicado del desistimiento ante la \nCorporación Autónoma Regional del Alto Magdalena –CAM, dado que se requiere una decisión de \nfondo en firme que resuelva la solicitud presentada ante la autoridad regional.\n \nDe conformidad con lo expuesto, esta Autoridad procederá a modificar la tabla que contiene el artículo \ntercero de la Resolución 2526 del 19 de octubre de 2022, en el sentido de modificar el error tipográfico \nen la misma y, adicionalmente, incluir los equipos solicitados por la sociedad; sin embargo, no se \naccederá a la petición de modificar el parágrafo del mencionado artículo, por lo que se procederá a \nconfirmar.\n3.\nRESPECTO A LA SOLICITUD DE MODIFICAR EL ARTÍCULO QUINTO DE LA \nRESOLUCIÓN 2526 DEL 19 DE OCTUBRE DE 2022.\nArgumentos y Petición de la sociedad:\n“Conforme lo establecido en el artículo quinto de la Resolución 2526 respecto a las fichas del Plan de \nManejo Ambiental, la Autoridad Nacional de Licencias Ambientales-ANLA se pronuncia en el sentido de \n“incluir la ficha 4.2 manejo de aguas subterráneas y aceptar las modificaciones presentadas para los \nsiguientes programas y fichas del Plan de Manejo Ambiental, para el proyecto “Campo de Producción \nYaguará”, que se relacionan a continuación:”\nFichas modificadas del Plan de Manejo Ambiental del Campo de Producción Yaguará.\nFICHAS DE MANEJO\n4.2 Manejo de Aguas subterráneas\n4.3 Manejo de la perforación de pozos de agua subterránea.\n4.1 Captación de agua superficial\n5.1 Control de contaminación atmosférica y ruido\nPara la presente modificación de licencia ambiental, se realizó el ajuste de las fichas del Plan de Manejo \nAmbiental de acuerdo con lo requerido en el parágrafo único del artículo cuarto la Resolución 1224 de \n2015 y en el artículo décimo segundo de la Resolución 0297 de 2016. Estos ajustes fueron presentados \n\nResolución No.  03115           Del   30 de diciembre de 2022            Hoja No. 16 de 34\n“Por la cual se resuelve un recurso de reposición contra de la Resolución 2526 del 19 de octubre de 2022”\nOficinas: Carrera 13 A No. 34 – 72 Edificio 13 35 Pisos 8 Bogotá, D.C.\nCentro de Orientación y Radicación de Correspondencia: Carrera 13 A No. 34 – 72 Edificio 13 35 \nLocales 110 al 112 Bogotá, D.C.  \nCódigo Postal 110311156\nNit.: 900.467.239-2\nLínea de Orientación y Contacto Ciudadano: 57 (1) 2540100 / 018000112998 PBX: 57 (1) 2540111\nwww.anla.gov.co    Email: licencias@anla.gov.co  \nPágina 16 de 34\nen el capítulo 7 del estudio de impacto ambiental (EIA) realizado para el presente trámite. Sin embargo, \nen el artículo quinto de la Resolución 2526 de 2022 no se menciona ningún concepto sobre las fichas y \nsolo se aprueban las directamente relacionadas con el uso y aprovechamiento de los recursos naturales. \nAl respecto, es necesario indicar a esta autoridad, que las Fichas de Manejo Ambiental fueron \ndebidamente ajustadas con el objetivo de establecer la integralidad del instrumento ambiental frente al \nseguimiento y control y abordar los requerimientos establecidos en las resoluciones 1224 de 2015 y 0297 \nde 2016.\nConforme lo mencionado, ECOPETROL S.A. solicita reponer el artículo quinto de la Resolución 2526 de \nla Resolución 2526 de 2022 en el sentido de que sean incluidos y aprobados los ajustes efectuados en \nlas fichas de manejo 1.3, 1.4, 1.6, 1.8, 1.9, 2.2, 3.1, 3.2, 6.1, 7.3, 8.3, 8.4, 8.5, 8.6, 8.7, 9.3 y 9.4 del Plan \nde Manejo Ambiental tal como lo requiere esta autoridad ambiental en las Resoluciones 1224 de 2015 y \n0297 de 2016.\n(…)\nModificar el artículo quinto de la Resolución 2526 de 2022 en el sentido de que sean incluidos y aprobados \nlos ajustes efectuados en las fichas de manejo 1.3, 1.4, 1.6, 1.8, 1.9, 2.2, 3.1, 3.2, 6.1, 7.3, 8.3, 8.4, 8.5, \n8.6, 8.7, 9.3 y 9.4 del Plan de Manejo Ambiental.\n(…)”\nCONSIDERACIONES TÉCNICAS DE LA ANLA\nAnalizada la solicitud presentada por la sociedad y de conformidad con lo establecido en el Concepto \nTécnico 8278 del 29 de diciembre de 2022, el cual dispuso:\n“Es importante aclarar por parte del equipo técnico de evaluación de ANLA, que es la Sociedad en el \nradicado VITAL 3500089999906822099 del 18 de agosto de 2022 (radicado ANLA No 2022177129-1-000 \ndel 18 de agosto del 2022) de respuesta a la información adicional, quien establece los programas y las \nfichas del Plan de Manejo Ambiental que van a ser modificadas en el trámite que dio lugar a la Resolución \n2526 de 2022, así las cosas, se extrae del radicado en comento lo siguiente:\nEn el Capítulo 7, Plan de Manejo Ambiental, en la página 1 en adelante, la Sociedad propone lo siguiente:\n“(…) El presente capítulo pretende mantener los programas y fichas de manejo ambiental \nestablecidas en la Resolución 1224 del 1 de octubre de 2015 (MADS) Por la cual se modifica \nuna licencia ambiental global y se toman otras determinaciones, las cuales abarcan el manejo \nambiental de los impactos ocasionados por todas las actividades de explotación del campo \nYaguará, incluyendo las medidas que se deben tener en cuenta al momento de hacer uso de \nlos permisos ambientales otorgados y solicitados en la presente modificación (concesión de \naguas superficiales, permiso de emisiones atmosféricas y prospección) y exploración de aguas \nsubterráneas.\nCabe resaltar que con el fin de dar cumplimiento a lo requerido en el Artículo 4 de la Resolución 1224 de \n2015, en el sentido de adicionar la frecuencia de monitoreo de cada uno de los indicadores de las fichas \nde manejo establecidas en la licencia ambiental, se incluyen en el presente capítulo todos los programas \ny fichas de manejo ambiental del campo Yaguará, aunque todas las actividades no sean objeto de la \npresente modificación.\nAdicionalmente, se incluye lo referido en la Resolución 297 de marzo de 2016, (MADS) Por la cual se \nresuelve un recurso de reposición contra la Resolución 1224 del 1 de octubre de 2015, en el Artículo \nDécimo Segundo Reponer en el sentido de modificar la obligación establecida en el Parágrafo del \nArtículo Cuarto Resolución 1224 del 1 de octubre de 2015, referente a la Ficha 7.3.9 \"Mantenimiento \ncorrectivo y construcción de líneas de flujo, inyección de fluidos y transferencia\" y Ficha 7.6.2, \"Manejo \nde aguas subterráneas\", del Plan de Plan de Manejo Ambiental.\nDado lo anterior, en la Tabla 7-1 se presentan las fichas de manejo ambiental establecidas en la \nResolución 1224 de 2015, ajustadas de acuerdo a los requerimientos mencionados, y se indican las que \n\nResolución No.  03115           Del   30 de diciembre de 2022            Hoja No. 17 de 34\n“Por la cual se resuelve un recurso de reposición contra de la Resolución 2526 del 19 de octubre de 2022”\nOficinas: Carrera 13 A No. 34 – 72 Edificio 13 35 Pisos 8 Bogotá, D.C.\nCentro de Orientación y Radicación de Correspondencia: Carrera 13 A No. 34 – 72 Edificio 13 35 \nLocales 110 al 112 Bogotá, D.C.  \nCódigo Postal 110311156\nNit.: 900.467.239-2\nLínea de Orientación y Contacto Ciudadano: 57 (1) 2540100 / 018000112998 PBX: 57 (1) 2540111\nwww.anla.gov.co    Email: licencias@anla.gov.co  \nPágina 17 de 34\ndan alcance a los permisos solicitados en la presente modificación de la licencia ambiental del campo \nYaguará:\nTabla 7-1 Relación de fichas de manejo ajustadas según requerimiento y las que dan alcance a \nla presente modificación\nPROGRAMA\nFICHA DE MANEJO\nCódigo\nNombre\nCódigo\nNombre\nREQUERIMIENTOS SEGÚN \nLA RESOLUCIÓN 1224 DE \n2015 Y RESOLUCIÓN 0297 \nDE 2016\nALCANCE PRESENTE \nMODIFICACIÓN\n1.1\nInstalación y operación deáreas de \napoyo\nEsta ficha no presenta ningún \nrequerimiento dentro de la \nResolución1224 de 2015\nEsta ficha no hace\nparte de la presente\nmodificación\n1.2\nMovilización de maquinaria,\nequipos,\npersonal\ny\nmateriales de construcción\nEsta ficha no presenta ningún \nrequerimiento dentro de la \nResolución1224 de 2015\nEsta ficha no hace parte de \nla presente\nmodificación\n1.3\nManejo de Remoción decobertura \ny descapote\nSe ajusta de acuerdo a la \nsolicitud del Resolución 1224 \nde 1 deoctubre de 2015, \nArtículo 4:\n<0000>\nVolumen material de \ndescapote dispuesto \nadecuadamente/Volumen\n<0000>\nVolumen de material vegetal \nremovido en obra / Volumen \ndematerial vegetal de diseño) x \n100. Criterio de éxito: 100%\nEsta ficha no hace parte de \nla presentemodificación\n1.4\nManejo del aprovechamiento\nforestal\nSe ajusta de acuerdo a la \nsolicitud del Resolución 1224 \nde 1 de octubre de 2015, \nArtículo 4:\n<0000>\nPrecisar que el permiso de \naprovechamiento forestal en \ncaso de ser requerido volumen \nadicional \nal \nya \naprobado \ndeberá tramitarse ante la ANLA \nmediante \nel \ntrámite \nde \nModificación \nde \nLicencia \nAmbiental\n<0000>\nAjustar la ficha en el sentido de \naclarar que en el caso de la \ncobertura Bosque ripario no se \nautoriza la intervención de \nnuevas áreas, puesto que las \núnicas actividades qua allí \npodrán \ndesarrollarse, \ncorresponden al Mantenimiento \nde vías de acceso existentes \nConstrucción, \noperación \ny \nmantenimiento de líneas deflujo \ndentro \nde \ncorredores \nexistentes\". Ahora bien, en \ncuanto \na \nlas \ncoberturas \nVegetación secundaría alta, \nArbustal Denso y Arbustal \nabierto \nesclerófila, \nno \nse \npermitirá su intervención para \nla Ampliación de locaciones de \nproducción existentes, solo \npara\nobras lineales.\nEsta ficha no hace parte de \nla presentemodificación\n1.5\nManejo de taludes\nEsta ficha no presenta ningún \nrequerimiento dentro de la \nResolución 1224 de 2015\nEsta ficha no hace parte de \nla presente\nmodificación\n1\nPROGRA\nMA DE\nOBRAS \nCIVILES\n1.6\nManejo\nde\nla\nrevegetalización\nSe ajusta de acuerdo a la solicitud del \nResolución 1224 de 1 de octubrede \n2015, Artículo 4:\nIncluir el siguiente indicador:\n<0000>\n(Área con prendimiento de \nEsta ficha no hace parte de \nla presentemodificación\n\nResolución No.  03115           Del   30 de diciembre de 2022            Hoja No. 18 de 34\n“Por la cual se resuelve un recurso de reposición contra de la Resolución 2526 del 19 de octubre de 2022”\nOficinas: Carrera 13 A No. 34 – 72 Edificio 13 35 Pisos 8 Bogotá, D.C.\nCentro de Orientación y Radicación de Correspondencia: Carrera 13 A No. 34 – 72 Edificio 13 35 \nLocales 110 al 112 Bogotá, D.C.  \nCódigo Postal 110311156\nNit.: 900.467.239-2\nLínea de Orientación y Contacto Ciudadano: 57 (1) 2540100 / 018000112998 PBX: 57 (1) 2540111\nwww.anla.gov.co    Email: licencias@anla.gov.co  \nPágina 18 de 34\nvegetación/área \nrevegetalizada)*100.Indicador \nde éxito: 90%\n1.7\nManejo de escorrentía ydrenajes\nEsta ficha no presenta ningún \nrequerimiento dentro de la Resolución \n1224 de 2015\nEsta ficha no hace parte de \nla presentemodificación\nPROGRAMA\nFICHA DE MANEJO\nCódigo\nNombre\nCódigo\nNombre\nREQUERIMIENTOS SEGÚN LA \nRESOLUCIÓN 1224 DE 2015 Y \nRESOLUCIÓN 0297 DE 2016\nALCANCE PRESENTE \nMODIFICACIÓN\nSe ajusta de acuerdo a la solicitud del \nResolución 1224 de 1 de octubrede \n2015, Artículo 4:\n<0000>\nCambiar la especificación del \nítem \"longitud máxima de la \nvíaadecuar\", el cual quedara \nasí:\nEsta ficha no hace parte de \nla presentemodificación\nITEM\nESPECIFICACIÓN\n1.8\nAdecuación de accesos y\nlocalizaciones\nLongitud máxima de vía\nadecuar\nLa suma de las longitudes \na adecuar no deberá \nexceder el 10% de la \nlongitud total de\nacceso\n1.9\nMantenimiento \ncorrectivo \ny\nconstrucción de líneas de flujo, \ninyección de fluidos y transferencia\nSe ajusta de acuerdo a la solicitud \ndel Resolución 0297 del 22 de\nmarzo 2016, Articulo décimo segundo:\n<0000>\nEn el caso de ser necesaria la \nentrega a terceros, de las \naguasresiduales de las \npruebas hidrostáticas, se \ndeberá reportar a la\nANLA o a quien haga sus \nveces, en el siguiente Informe \nICA, lajustificación técnica por \nla cual se optaría por esta \nalternativa.\nEsta ficha no hace parte de \nla presentemodificación\n1.10\nMantenimiento \ncorrectivo \ny\nconstrucción \nde \nlíneas \nde \ntransmisión eléctrica y\nsubestaciones\nEsta ficha no presenta ningún \nrequerimiento dentro de la Resolución \n1224 de 2015\nEsta ficha no hace parte de \nla presentemodificación\n1.11\nSeñalización\nEsta ficha no presenta ningún \nrequerimiento dentro de la Resolución \n1224 de 2015\nEsta ficha no hace\nparte de la presente\nmodificación\n2.1\nMontaje de equipos\nEsta ficha no presenta ningún \nrequerimiento dentro de la Resolución \n1224 de 2015\nEsta ficha no hace parte de \nla presentemodificación\n2.2\nManejo de fluidos, líquidos,sólidos \ny gases\nSe ajusta de acuerdo a la solicitud del \nResolución 1224 de 1 de octubre de \n2015, Artículo 4:\n<0000>\nSuprimir lo relacionado con la \nquema de gas en fosos de \nquemado, y proponer la(s) \nalternativa(s) ambientalmente \nviables. \nLas \nacciones \npropuestas en la Ficha para el \nmanejo de los lodos de gases\" \nperforación serán aplicables \núnicamente para los lodos base \nagua, en el manejo de los lodos \nbase aceite deberá tenerse\nen cuenta la Ficha Manejo de \nlodos y cortes de perforación\nEsta ficha no hace parte de \nla presentemodificación\n7.2\nPROGRAM\nA DE \nPERFORA\nCIÓN Y\nPRUEBAS \nDE \nPRODUCCI\nÓN\n2.3\nManejo\nde\nmateriales\nradioactivos\nEsta ficha no presenta ningún \nrequerimiento dentro de la Resolución \n1224 de 2015\nEsta ficha no hace parte de \nla presente\nmodificación\n\nResolución No.  03115           Del   30 de diciembre de 2022            Hoja No. 19 de 34\n“Por la cual se resuelve un recurso de reposición contra de la Resolución 2526 del 19 de octubre de 2022”\nOficinas: Carrera 13 A No. 34 – 72 Edificio 13 35 Pisos 8 Bogotá, D.C.\nCentro de Orientación y Radicación de Correspondencia: Carrera 13 A No. 34 – 72 Edificio 13 35 \nLocales 110 al 112 Bogotá, D.C.  \nCódigo Postal 110311156\nNit.: 900.467.239-2\nLínea de Orientación y Contacto Ciudadano: 57 (1) 2540100 / 018000112998 PBX: 57 (1) 2540111\nwww.anla.gov.co    Email: licencias@anla.gov.co  \nPágina 19 de 34\n7.3\nPROGRA\nMA DE\nOPERACI\nÓN DE\nFACILID\nADES\nPETROL\nERAS\n3.1\nManejo de aguas de producción y \nsistemas de recobro mejorado\nSe ajusta de acuerdo a la solicitud del \nResolución 1224 de 1 de octubrede \n2015, Artículo 4:\n<0000>\nAclarar que la disposición del \nagua do producción se \nrealizarainicialmente en la \nFormación productora.\nEsta ficha no hace parte de \nla presentemodificación\nPROGRAMA\nFICHA DE MANEJO\nCódi\ngo\nNombre\nCódigo\nNombre\nREQUERIMIENTOS SEGÚN LA \nRESOLUCIÓN 1224 DE 2015 Y \nRESOLUCIÓN 0297 DE 2016\nALCANCE PRESENTE \nMODIFICACIÓN\n<0000>\nSuprimir \nla \nreferencia \nde \ninyección de vapor.\n<0000>\nCorregir a ronda de protección \nde los puntos de agua, \nindependientemente del uso \ndel recurso hídrico; acorde con\nestablecido en el artículo \n2.2.1.1.18.2 del Decreto 1076 \nde 2015 y con la zonificación de \nmanejo ambiental que se \nestablece en la\npresente evaluación.\n3.2\nPerforación, \nmantenimiento y \nreacondicionamiento depozos\nSe ajusta de acuerdo a la solicitud del \nResolución 1224 de 1 de octubrede \n2015, Artículo 4:\n<0000>\nTener en cuenta la actividad \nde perforación en la \nformulación dela meta.\nEsta ficha no hace parte de \nla presentemodificación\n4.1\nCaptación de\nagua \nsuperficial\nEsta ficha no presenta ningún \nrequerimiento dentro de la Resolución \n1224 de 2015\nEsta ficha aplica\npara la presente\nmodificación\n7.4\nPROGRA\nMA DE\nRECURS\nO \nHÍDRICO\n4.2\nManejo\nde\nAguas\nsubterráneas\nSe ajusta de acuerdo con la solicitud \nde la Resolución 0297 del 22 de\nmarzo \n2016, \nArticulo \ndécimo \nsegundo:\n<0000>\nCorregir la ronda de protección \nde los puntos de agua, \nindependientemente del uso \ndel recurso hídrico; acorde con\nestablecido en el artículo \n2.2.1.1.18.2 del Decreto 1976 \nde 2015 y con la zonificación de \nmanejo ambiental que se \nestablece \nen \nla presente \nevaluación.\n<0000>\nAclarar si los monitoreos a la \ncalidad fisicoquímica del agua \nrelacionados con proyectos \ncuya duración sea inferior o \nsuperior a 3 meses, hacen \nreferencia a actividades de \nperforación y trabajos de pozo.\n<0000>\nIncluir lo relacionado con la red \nde monitoreo subterráneo que \nseplanteó en el EIA.\n<0000>\nVerificar \nsi \nla \nsiguiente \ninformación: \"limpieza a los \nequipos \nusados \npara \nla \nextracción del agua por lo \nmenos una vez al año\", \"Se \ndeberá contar con un sistema \nde medición que garantice el \ncumplimiento de los caudales \nautorizados.; \n\"Se \ndeberá \npresentar anualmente análisis \nfisicoquímico y bacteriológico \ndel agua del pozo teniendo en \ncuenta \nlos \nsiguientes \nparámetros...\",\ncorresponde al campo Yaguará; \nen su defecto suprimirla\nEsta ficha aplicapara la \npresentemodificación.\n\nResolución No.  03115           Del   30 de diciembre de 2022            Hoja No. 20 de 34\n“Por la cual se resuelve un recurso de reposición contra de la Resolución 2526 del 19 de octubre de 2022”\nOficinas: Carrera 13 A No. 34 – 72 Edificio 13 35 Pisos 8 Bogotá, D.C.\nCentro de Orientación y Radicación de Correspondencia: Carrera 13 A No. 34 – 72 Edificio 13 35 \nLocales 110 al 112 Bogotá, D.C.  \nCódigo Postal 110311156\nNit.: 900.467.239-2\nLínea de Orientación y Contacto Ciudadano: 57 (1) 2540100 / 018000112998 PBX: 57 (1) 2540111\nwww.anla.gov.co    Email: licencias@anla.gov.co  \nPágina 20 de 34\n4.3\nManejo de la perforación depozos \nde agua subterránea.\nSe incluye esta nueva ficha para \ndar alcance \npermiso \nprospección y \nexploración de \naguas \nsubterráneas.\nEsta ficha aplicapara la \npresentemodificación\n7.5\nPROGRA\nMA DE\nRECURSO \nAIRE\n5.1\nControl de contaminación\natmosférica y ruido\nSe ajusta de acuerdo a la solicitud del \nResolución 1224 de 1 de octubrede \n2015, Artículo 4:\n<0000>\nContemplar lo relacionado \ncon el manejo del gas \ndurante laspruebas de \nproducción.\nEsta ficha aplicapara la \npresentemodificación\nPROGRAMA\nFICHA DE MANEJO\nCódigo\nNombre\nCódigo\nNombre\nREQUERIMIENTOS SEGÚN LA \nRESOLUCIÓN 1224 DE 2015 Y \nRESOLUCIÓN 0297 DE 2016\nALCANCE PRESENTE \nMODIFICACIÓN\n<0000>\nAdicionar la realización do \nmonitoreos de ruido ambiental \ndurantela perforación y \ntrabajos de pozo (workover, \nwell service).\n6.1\nMantenimiento\nde\nla\nFacilidad Yaguará\nSe ajusta de acuerdo a la solicitud del \nResolución 1224 de 1 de octubre de \n2015, Artículo 4:\n<0000>\nReemplazar \nla \ninformación \nreferente a: impacto, elemento \nimpactado, \nactividad \ngeneradora del impacto, etapa \nde desarrollo y significancia \nambiental del impacto; acorde \ncon el contenido do\nesta Ficha.\nEsta ficha no hace parte de \nla presentemodificación\n6.2\nMantenimiento de líneas deflujo y \nderecho de vía\nEsta ficha no presenta ningún \nrequerimiento dentro de la \nResolución 1224 de 2015\nEsta ficha no hace\nparte de la presente\nmodificación\n7.6\nPROGRAM\nA DE \nMANTENIM\nIENTO\n6.3\nMantenimiento\nde\nredes\neléctricas y subestación\nEsta ficha no presenta ningún \nrequerimiento dentro de la \nResolución 1224 de 2015\nEsta ficha no hace parte de \nla presentemodificación\n7.1\nManejo\nde\nResiduos\nLíquidos\ndomésticos\ne\nindustriales\nEsta ficha no presenta ningún \nrequerimiento dentro de la \nResolución 1224 de 2015\nEsta ficha no hace parte de \nla presente\nmodificación\n7.2\nManejo de Residuos Sólidos\ndomésticos e industriales\nEsta ficha no presenta ningún \nrequerimiento dentro de la \nResolución 1224 de 2015\nEsta ficha no hace\nparte de la presente\nmodificación\n7.7\nPROGRA\nMA DE\nMANEJO \nDE \nRESIDUO\nS\n7.3\nManejo de lodos y cortes de\nperforación\nSe ajusta de acuerdo a la solicitud del \nResolución 1224 de 1 de octubre de \n2015, Artículo 4:\n<0000>\nAclarar que la disposición final \nde lodos base agua en \npiscinas, no podrá efectuarse si \nhubiere presencia del nivel \nfreático en ellas.\n<0000>\nSuprimir \nla \ninformación \nreferente a las alterativas de \naprovechamiento, tratamiento y \ndisposición final de lodos \naceitosos, y aclarar que la \núnica alternativa de disposición \nfinal, de estos lodos, para el \nproyecto del campo Yaguará, \nes la entrega a Terceros que \ncuenten con los permisos \nvigentes para\ntransporte, manejo y disposición \nfinal.\nEsta ficha no hace parte de \nla presentemodificación\n\nResolución No.  03115           Del   30 de diciembre de 2022            Hoja No. 21 de 34\n“Por la cual se resuelve un recurso de reposición contra de la Resolución 2526 del 19 de octubre de 2022”\nOficinas: Carrera 13 A No. 34 – 72 Edificio 13 35 Pisos 8 Bogotá, D.C.\nCentro de Orientación y Radicación de Correspondencia: Carrera 13 A No. 34 – 72 Edificio 13 35 \nLocales 110 al 112 Bogotá, D.C.  \nCódigo Postal 110311156\nNit.: 900.467.239-2\nLínea de Orientación y Contacto Ciudadano: 57 (1) 2540100 / 018000112998 PBX: 57 (1) 2540111\nwww.anla.gov.co    Email: licencias@anla.gov.co  \nPágina 21 de 34\n8.1\nManejo paisajístico\nEsta ficha no presenta ningún \nrequerimiento dentro de la \nResolución 1224 de 2015\nEsta ficha no hace\nparte de la presente\nmodificación\n8.2\nManejo de la flora\nEsta ficha no presenta ningún \nrequerimiento dentro de la \nResolución 1224 de 2015\nEsta ficha no hace parte de \nla presentemodificación\n7.8\nPROGRAM\nA MEDIO \nABIÓTICO\nY BIÓTICO\n8.3\nManejo de la fauna\nSe ajusta de acuerdo a la solicitud del \nResolución 1224 de 1 de octubrede \n2015, Artículo 4:\nIncluir los indicadores:\nEsta ficha no hace parte de \nla presente\nmodificación\nPROGRAMA\nFICHA DE MANEJO\nCódigo\nNombre\nCódigo\nNombre\nREQUERIMIENTOS SEGÚN LA \nRESOLUCIÓN 1224 DE 2015 Y \nRESOLUCIÓN 0297 DE 2016\nALCANCE PRESENTE \nMODIFICACIÓN\n<0000>\nNúmero de individuos \nahuyentados y \nrescatados / Total de \nindividuos observados y \nhallados en los frentes de \ntrabajo) x\n100. indicador de éxito: 100%\n<0000>\n(Número de individuos \nreubicados / Número de \nindividuos\n<0000>\nAhuyentados y rescatados) x \n100. Indicador de éxito: 100%\n8.4\nProtección y conservación de \nhábitats \ny \necosistemas \nestratégicos\nSe ajusta de acuerdo a la solicitud del \nResolución 1224 de 1 de octubre de \n2015, Artículo 4:\n<0000>\nReplantear \nel \nindicador \n“Identificación \nde \nmedidas \nsegún hallazgos y ejecución de \nmedidas \nde \nmanejo \nde \nmadrigueras, \nnidos \npreliminares \na \ncualquier \nintervención…” de manera que \nsea clara cuál es la medida de \nmanejo a la que se le hace \nmedición: por ejemplo: Numero \nde nidos reubicados/Numero \nde nidos hallados en los frentes \nde trabajo) x 100 y también \nllevar registros que den fe del \nlugar \nde \nhallazgo \ny \nreubicación a fin de poder\nverificar que se haya hecho en \ncoberturas \nequivalentes \ny \ncercanas\nEsta ficha no hace parte de \nla presentemodificación\n8.5\nPrograma de conservación de \nespecies vegetales, endémicas, \ncon alguna categoría de amenaza \nen peligro crítico o en veda.\nSe ajusta de acuerdo a la solicitud del \nResolución 1224 de 1 de octubre de \n2015, Artículo 4\n<0000>\nEn caso de llegar a intervenir \ncoberturas con presencia de \nespecies \namenazadas, \nse \nrealizará el rescate de plántulas \nen sus estados latizal y brinzal, \npar reubicación en sitios de \nrevegetalización, con objetivo \nde minimizar el impacto a estas \ncomunidades vulnerables y \npropender enriquecimiento de \ndichascoberturas.\n<0000>\nTambién \ndebe \nincluir \nun \nindicador que permita identificar \nel grado éxito de traslados \nrealizados \nde \nespecies \nendémicas o amaneadas: No. \nde especies endémicas o en \nalgún grado de\namenazas encontradas / No. \nde \nespecies \ntrasladadas \nexitosamente.\nEsta ficha no hace parte de \nla presentemodificación\n\nResolución No.  03115           Del   30 de diciembre de 2022            Hoja No. 22 de 34\n“Por la cual se resuelve un recurso de reposición contra de la Resolución 2526 del 19 de octubre de 2022”\nOficinas: Carrera 13 A No. 34 – 72 Edificio 13 35 Pisos 8 Bogotá, D.C.\nCentro de Orientación y Radicación de Correspondencia: Carrera 13 A No. 34 – 72 Edificio 13 35 \nLocales 110 al 112 Bogotá, D.C.  \nCódigo Postal 110311156\nNit.: 900.467.239-2\nLínea de Orientación y Contacto Ciudadano: 57 (1) 2540100 / 018000112998 PBX: 57 (1) 2540111\nwww.anla.gov.co    Email: licencias@anla.gov.co  \nPágina 22 de 34\n8.6\nPrograma de conservación de \nespecies faunísticas, endémicas, \namenazadas oen veda.\nSe ajusta de acuerdo a la solicitud del \nResolución 1224 de 1 de octubrede \n2015, Artículo 4:\n<0000>\nAclarar en cada uno de los \nindicadores que la medición \nestá\nenfocada a las medidas de \nmanejo propuestas en esta ficha \nparala conservación de \nespecies faunísticas y no \nespecies vegetales\nEsta ficha no hace parte de \nla presentemodificación\n8.7\nCompensación\npor\naprovechamiento forestal, cambio \nde uso del suelo y afectación de la \ncobertura\nvegetal\nSe ajusta de acuerdo a la solicitud del \nResolución 1224 de 1 de octubrede \n2015, Artículo 4:\n<0000>\nPresentar la ficha de acuerdo \na lo considerado en el acápite \ndePlanes y Programas del \npresente acto administrativo.\nEsta ficha no hace parte de \nla presentemodificación\nPROGRAMA\nFICHA DE MANEJO\nCódigo\nNombre\nCódigo\nNombre\nREQUERIMIENTOS \nSEGÚN \nLA \nRESOLUCIÓN 1224 DE 2015 Y \nRESOLUCIÓN 0297 DE 2016\nALCANCE PRESENTE \nMODIFICACIÓN\n9.1\nPrograma \nde \neducación \ny \ncapacitación al personal vinculado \nal proyecto\nEsta ficha no presenta ningún \nrequerimiento dentro de la Resolución \n1224 de 2015\nEsta ficha no hace parte de \nla presentemodificación\n9.2\nPrograma\nal\nacompañamiento\na\nla\ngestión institucional\nEsta ficha no presenta ningún \nrequerimiento dentro de la Resolución \n1224 de 2015\nEsta ficha no hace parte de \nla presente\nmodificación\n9.3\nPrograma \nde \nInformación \ny \ncomunicación a autoridades y \ncomunidad.\nSe ajusta de acuerdo a la solicitud del \nResolución 1224 de 1 de octubre de \n2015, Artículo 4:\n<0000>\nIncluir dentro de la población a \nla que va dirigida la medida a \nlos actores locales a los \nrepresentantes a la Asociación \nDistrito de Riego Yaguará\n<0000>\nIncluir \nla \nactividad \nde \nsuministrar copia de la Licencia \nAmbiental \na \nlos \nlíderes \ncomunitarios de las juntas de \nacción Comunal y\nAsociación de Distrito de riego \nYaguará ubicados en el área de \ninfluencia del proyecto.\nEsta ficha no hace parte de \nla presentemodificación\n9.4\nPrograma de Capacitación,\neducación y concientización\na la comunidad aledaña al\nproyecto\nSe ajusta de acuerdo a la solicitud del \nResolución 1224 de 1 de octubrede \n2015, Artículo 4:\n<0000>\nIncluir dentro de los actores \nlocales a los delegados de \nlasAsociación Distrito de Riego \nYaguará\nEsta ficha no hace parte de \nla presentemodificación\n9.5\nPrograma a atención apeticiones, \nquejas, reclamos\ny sugerencias PQRS\nEsta ficha no presenta ningún \nrequerimiento dentro de la Resolución \n1224 de 2015\nEsta ficha no hace parte de \nla presente\nmodificación\n9.6\nPrograma de cierre degestión \nsocial\nEsta ficha no presenta ningún \nrequerimiento dentro de la Resolución \n1224 de 2015\nEsta ficha no hace\nparte de la presente\nmodificación\n9.7\nPrograma de Compensaciónsocial\nEsta ficha no presenta ningún \nrequerimiento dentro de la Resolución \n1224 de 2015\nEsta ficha no hace\nparte de la presente\nmodificación\n7.9\nPLAN DE \nGESTIÓN \nSOCIAL\n9.8\nPrograma de Contrataciónde \nmano\nSe incluye esta ficha asociada a \nla contratación de mano de \nobrapara la nueva actividad de \nprospección de aguas \nsubterráneas.\nEsta ficha aplicapara la \npresente\nmodificación\nCabe aclarar que el presente capítulo contiene los ajustes solicitados a las fichas de manejo \nmencionadas en la Tabla 7-1 según el Artículo Cuarto de la Resolución 1124 de 2015 y el Articulo Décimo \n\nResolución No.  03115           Del   30 de diciembre de 2022            Hoja No. 23 de 34\n“Por la cual se resuelve un recurso de reposición contra de la Resolución 2526 del 19 de octubre de 2022”\nOficinas: Carrera 13 A No. 34 – 72 Edificio 13 35 Pisos 8 Bogotá, D.C.\nCentro de Orientación y Radicación de Correspondencia: Carrera 13 A No. 34 – 72 Edificio 13 35 \nLocales 110 al 112 Bogotá, D.C.  \nCódigo Postal 110311156\nNit.: 900.467.239-2\nLínea de Orientación y Contacto Ciudadano: 57 (1) 2540100 / 018000112998 PBX: 57 (1) 2540111\nwww.anla.gov.co    Email: licencias@anla.gov.co  \nPágina 23 de 34\nSegundo de la Resolución 0297 del 22 de marzo 2016, las cuales contienen los impactos aprobados en \nla matriz de evaluación con proyecto de la MODIFICACIÓN DE LICENCIA AMBIENTAL GLOBAL 944 \nDEL 9 DE NOVIEMBRE DE 1999 CAMPO YAGUARÁ, 2014 aprobada mediante la Resolución 1124 de \n2015.\nPor consiguiente, en el estudio de modificación de licencia sólo se presenta la información cartográfica \ny la evaluación ambiental con proyecto relacionada únicamente con los impactos y actividades objeto de \nla modificación a los cuales se presentan en la Tabla 7-2.\nTabla 7-2 Relación de actividades y fichas de para la presente modificación\nETAPA\nACTIVIDADES A\nEJECUTAR\nSUB-ACTIVIDADES COMUNES PARA LAS\nESTRATEGIAS DE DESARROLLO\nFICHAS DE MANEJO\nGestión social\nContratación de personal\n9.8 Programa de \nContratación de mano\nMovilización de maquinaria, equipos, personal ymateriales \nde construcción\n5.1 Control de\ncontaminación\natmosférica y ruido\nProspección y exploración de aguas subterráneas\n4.2 Manejo de Aguas\nsubterráneas\n4.3 Manejo de la \nperforación de pozos de\nagua subterránea.\nTRANSVERSAL\nApoyo Técnico\nCaptación, operación, mantenimiento y adecuación de\nla infraestructura asociada al manejo de aguassuperficiales\n4.1 Captación de agua\nsuperficial\nOperación, mantenimiento y adecuación de la\ninfraestructura asociada al manejo de crudo\nOperación, mantenimiento y adecuación de lainfraestructura \nasociada al manejo de gas de producción\nOperación, Mantenimiento y adecuación de la infraestructura \nasociada al manejo de Inyección deaguas\nOPERATIVA\n4. Adecuación,\noperación y\nmantenimiento de \nla infraestructura \nen la facilidad de \nproducción e\ninyección existente\nOperación y mantenimiento de Teas\n5.1 Control de\ncontaminación\natmosférica y ruido\nPor lo tanto, para dar alcance a la presente Modificación, se incluye las siguientes dentro de la \ncodificación de la estructura del Plan de Manejo Ambiental (Resolución 1224 de 2015) las fichas 4.3. \nManejo de la perforación de pozos de agua subterránea en el 4. Programa de Recurso hídrico y 9.8 \nPrograma de Contratación de mano de obra 9. Plan de Gestión Social, de tal forma que las juntó con \nlas medidas de manejo ambiental propuestas, se atiendan de manera completa los impactos \nambientales que fueron identificados a partir de las características técnicas del proyecto y los \nelementos del entorno presentes en el área de influencia del medio físico y social descritos en el \nCapítulo 5 del presente estudio. (…)”\nDe lo anterior el equipo técnico de evaluación de ANLA, considera que Ecopetrol S.A. en la respuesta \na la información adicional, está definiendo que va a mantener los programas y fichas del Plan de \nManejo Ambiental establecido la Resolución 1224 del 1 de octubre de 2015 (MADS), “Por la cual se \nmodifica una licencia ambiental global”, para lo cual está dando cumplimiento a lo requerido en el \nArtículo 4 de la Resolución 1224 de 2015, en el sentido de adicionar la frecuencia de monitoreo de \ncada uno de los indicadores de las fichas de manejo establecidas en la licencia ambiental.\nAdicionalmente, se incluye lo referido en la Resolución 297 de marzo de 2016, (MADS) Por la cual se \nresuelve un recurso de reposición contra la Resolución 1224 del 1 de octubre de 2015, en el Artículo \nDécimo Segundo Reponer en el sentido de modificar la obligación establecida en el Parágrafo del \nArtículo Cuarto Resolución 1224 del 1 de octubre de 2015, referente a la Ficha 7.3.9 \"Mantenimiento \ncorrectivo y construcción de líneas de flujo, inyección de fluidos y transferencia\" y Ficha 7.6.2, \"Manejo \nde aguas subterráneas\", del Plan de Plan de Manejo Ambiental.\n\nResolución No.  03115           Del   30 de diciembre de 2022            Hoja No. 24 de 34\n“Por la cual se resuelve un recurso de reposición contra de la Resolución 2526 del 19 de octubre de 2022”\nOficinas: Carrera 13 A No. 34 – 72 Edificio 13 35 Pisos 8 Bogotá, D.C.\nCentro de Orientación y Radicación de Correspondencia: Carrera 13 A No. 34 – 72 Edificio 13 35 \nLocales 110 al 112 Bogotá, D.C.  \nCódigo Postal 110311156\nNit.: 900.467.239-2\nLínea de Orientación y Contacto Ciudadano: 57 (1) 2540100 / 018000112998 PBX: 57 (1) 2540111\nwww.anla.gov.co    Email: licencias@anla.gov.co  \nPágina 24 de 34\nAsí las cosas, las modificaciones a los programas y fichas del PMA del proyecto, anotadas en los \npárrafos anteriores, ya hacen parte del Seguimiento Ambiental realizado por esta Autoridad al proyecto \nCampo de Producción Yaguará, dado que ya están establecidas en el PMA del proyecto, debido a que \nfueron obligaciones requeridas en los actos administrativos de Resolución 1224 del 1 de octubre de \n2015 y de Resolución 297 de marzo de 2016. \nSumado a lo anterior, se puede extraer de la respuesta a la información adicional, Tabla 7-1, “Relación \nde fichas de manejo ajustadas según requerimiento y las que dan alcance a la presente modificación”, \nque las fichas de código: 1.1, 1.2, 1.3, 1.4, 1.5, 1.6, 1.7, 1.8, 1.9, 1.10, 1.11. 2.1, 2.2, 2.3, 3.1, 3.2, 6.1, \n6.2, 6.3, 7.1, 7.3, 8.1, 8.2, 8.3, 8.4, 8.5, 8.6, 8.7, 9.1, 9.2, 9.3, 9.4, 9.5, 9.5, 9.7, no hacen parte de la \nmodificación del trámite que dio lugar a la Resolución 2526 de 2022.\nAhora bien de la respuesta a la información adicional, Tabla 7-2, Relación de actividades y fichas para \nla presente modificación, se puede concluir por parte del equipo técnico de evaluación de la ANLA, \nque las fichas de código: 9.8, 5.1, 4.2, 4.3, 4.1, 5.1, son sobre las cuales la Sociedad propone \nmodificaciones y fue sobre las cuales el equipo técnico de ANLA se pronunció como se puede observar \nen las Hojas de la 92 a la 99 de 139 del Resolución No 2526 de 2022 por la cual se otorga modificación \nde licencia ambiental al proyecto Campo de Producción Yaguará.\nCon lo anterior se le aclara a la sociedad Ecopetrol S.A. que los ajustes requeridos a los programas y \nlas fichas del Plan de Manejo Ambiental de acuerdo con lo establecido en el parágrafo único del artículo \ncuarto la Resolución 1224 de 2015 y en el artículo décimo segundo de la Resolución 0297 de 2016, \nque fueron presentados en el capítulo 7 del estudio respuesta a información adicional presentado a \nANLA mediante radicado VITAL 3500089999906822099 del 18 de agosto de 2022 (radicado ANLA  \nNo 2022177129-1-000 del 18 de agosto del 2022), hacen parte del Plan de Manejo Ambiental que está \nestablecido en la licencia ambiental desde el año 2016, y ajustes que fueron solicitados en dichos actos \nadministrativos para presentarse en la información que hace parte del seguimiento de esta autoridad \nal proyecto.   \nAsí las cosas para la modificación efectuada mediante acto administrativo de Resolución No 2526 de \n2022 la ANLA no se pronunció sobre estos ajustes solicitados en la Resolución 1224 de 2015 y en el \nartículo décimo segundo de la Resolución 0297 de 2016, debido a que la Sociedad no solicitó \nmodificación de estas fichas y programas y solo incluyó ajustes evaluados y ya solicitados por ANLA \nen actos administrativos pasados; sumado a lo anterior, es la misma Sociedad que deja claro que los \nprogramas contenidos en la que las fichas de código: 1.1, 1.2, 1.3, 1.4, 1.5, 1.6, 1.7, 1.8, 1.9, 1.10, \n1.11. 2.1, 2.2, 2.3, 3.1, 3.2, 6.1, 6.2, 6.3, 7.1, 7.3, 8.1, 8.2, 8.3, 8.4, 8.5, 8.6, 8.7, 9.1, 9.2, 9.3, 9.4, 9.5, \n9.5, 9.7, no hacen parte del trámite de modificación acogido mediante el acto administrativo de \nResolución 2526 de 2022 (ver tabla 7-1, Relación de fichas de manejo ajustadas según requerimiento), \nsino que propone modificaciones sobre los programas contenidos en las fichas de código: 9.8, 5.1, 4.2, \n4.3, 4.1, 5.1.(ver tabla 7 – 2 Relación actividades y fichas de para la presente modificación) \nPor todo lo anterior el equipo de evaluación de ANLA, se mantiene en lo establecido en el artículo \nquinto de la Resolución 2526 de 2022 respecto a las fichas del Plan de Manejo Ambiental.”\nCONSIDERACIONES JURÍDICAS DE LA ANLA \nDe acuerdo a las consideraciones técnicas expuestas, se concluye que no es procedente acceder a \nla solicitud presentada por la sociedad respecto a modificar el artículo quinto de la Resolución 2526 \ndel 19 de octubre de 2022, en el sentido de incluir y aprobar los ajustes efectuados en las fichas de \nmanejo 1.3, 1.4, 1.6, 1.8, 1.9, 2.2, 3.1, 3.2, 6.1, 7.3, 8.3, 8.4, 8.5, 8.6, 8.7, 9.3 y 9.4 del Plan de Manejo \nAmbiental, ya que tal como se estableció por el equipo evaluador, la sociedad no solicitó modificación \nde las mismas, por lo que para estas, se limitó a incluir los ajustes evaluados y ya solicitados por esta \nAutoridad Nacional en actos administrativos pasados. Adicionalmente, fue la misma sociedad la que \nindicó que las modificaciones propuestas para el trámite en comento, aplicaban sobre los programas \ncontenidos en las fichas de código: 9.8, 5.1, 4.2, 4.3, 4.1, 5.1., las cuales fueron evaluadas en la \nresolución recurrida. \n\nResolución No.  03115           Del   30 de diciembre de 2022            Hoja No. 25 de 34\n“Por la cual se resuelve un recurso de reposición contra de la Resolución 2526 del 19 de octubre de 2022”\nOficinas: Carrera 13 A No. 34 – 72 Edificio 13 35 Pisos 8 Bogotá, D.C.\nCentro de Orientación y Radicación de Correspondencia: Carrera 13 A No. 34 – 72 Edificio 13 35 \nLocales 110 al 112 Bogotá, D.C.  \nCódigo Postal 110311156\nNit.: 900.467.239-2\nLínea de Orientación y Contacto Ciudadano: 57 (1) 2540100 / 018000112998 PBX: 57 (1) 2540111\nwww.anla.gov.co    Email: licencias@anla.gov.co  \nPágina 25 de 34\nAhora, se aclara a la sociedad que no es que los ajustes o modificaciones no estén acordes o no \nhagan parte del Plan de Manejo Ambiental del proyecto, sino que no fueron aspectos de la presente \nmodificación, por el contrario, corresponde a ajustes solicitados en la Resolución 1224 de 2015 y en \nel artículo décimo segundo de la Resolución 0297 de 2016, que deben ser es presentados para el \nseguimiento al proyecto y es en esta etapa donde se validan los mismos.\n4.\nRESPECTO A LA SOLICITUD DE REVOCAR LA OBLIGACIÓN DEL LITERAL B DEL \nNUMERAL 3 DEL ARTÍCULO SEXTO DE LA RESOLUCIÓN 2526 DEL 19 DE OCTUBRE \nDE 2022\nArgumentos y Petición de la sociedad:\n“En relación con lo determinado en el Artículo sexto de la Resolución 2526 de 2022, referente a: “La \nsociedad ECOPETROL S.A. deberá realizar los ajustes requeridos al Plan de Manejo Ambiental para el \nproyecto “Campo de Producción Yaguará”, que se indican a continuación, y presentarlos en el término de \ntres (3) meses contados a partir de la ejecutoria de este acto administrativo”, la autoridad determina que \nla ficha de manejo 9.3 Información y comunicación a autoridades y comunidad debe ser ajustada en el \nsentido de:\n1.\n“Socializar los cambios que se presenten en cada uno de los puntos de agua con autoridades \nmunicipales y comunidades en relación con lo siguiente: “Se debe dejar constancia a través de \nactas de vecindad fechadas, registro fotográfico, registro fílmico del entorno, sobre el estado \ninicial de los aljibes y manantiales antes de la ejecución del proyecto, la cual deberá estar \nfirmada y avalada por miembros de la comunidad que hagan uso del punto y por el propietario o \nadministrador encargado del predio en su defecto; de tal manera que puedan ser consideradas \nlas afectaciones que tengan lugar por las actividades directas del proyecto. Así mismo se deberá \ndiligenciar actas del estado mensual de los aljibes y manantiales, durante la ejecución y al final \nde las operaciones; las actas deberán estar firmadas por el propietario o administrador del predio \ndonde se ubican estos puntos de agua, de todo se deberá dejar un registro escrito, fílmico y \nfotográfico fechado, especificandosi el registro se realizó en invierno o verano e informando de \nlos cambios que se presenten en cada uno de los puntos de agua” registrado en la ficha 4.2 \nManejo de Aguas Subterráneas.”\nConforme a lo establecido en el literal b del numeral 3 del artículo sexto de la Resolución 2526 de 2022, \nECOPETROL S.A., se permite aclarar que el alcance de la presente modificación no implica nuevas \nestrategias de desarrollo o actividades diferentes a las que se venían realizando. La modificación de la \nlicencia ambiental se determina exclusivamente en el uso y aprovechamiento de recursos naturales que \npreviamente se gestionaban con la Autoridad Ambiental Regional CAM.\nAunado a lo anterior, se debe precisar que el campo de producción Yaguará lleva más de 30 años en \noperación, 1992, incluso entro en operación con anterioridad a la expedición de la Ley 99 de 1993, por lo \ntanto, no es posible establecer una línea base de los puntos de agua mencionados por esta autoridad y \nsu posible afectación frente a la infraestructura del campo, debido a que en su momento la legislación en \nmateria ambiental para el sector de hidrocarburos esta incipiente y no se contaba en su momento ni \nahora con la información que nos permita establecer dicha línea base de los puntos de agua.\nDe acuerdo con lo anterior, la sociedad se permite reponer el literal b del numeral 3 del artículo sexto de \nla Resolución 2526 de 2022 en el sentido de revocar esta obligación teniendo en cuenta la imposibilidad \nde contar con un momento previo a la ejecución del proyecto por las razones expuestas anteriormente.\n(…)\nModificar el artículo sexto de la Resolución 2526 de 2022, revocando la obligación establecida por medio \ndel literal b del numeral 3, teniendo en cuenta la imposibilidad de contar con un momento previo a la \nejecución del proyecto.\n(…)”\n\nResolución No.  03115           Del   30 de diciembre de 2022            Hoja No. 26 de 34\n“Por la cual se resuelve un recurso de reposición contra de la Resolución 2526 del 19 de octubre de 2022”\nOficinas: Carrera 13 A No. 34 – 72 Edificio 13 35 Pisos 8 Bogotá, D.C.\nCentro de Orientación y Radicación de Correspondencia: Carrera 13 A No. 34 – 72 Edificio 13 35 \nLocales 110 al 112 Bogotá, D.C.  \nCódigo Postal 110311156\nNit.: 900.467.239-2\nLínea de Orientación y Contacto Ciudadano: 57 (1) 2540100 / 018000112998 PBX: 57 (1) 2540111\nwww.anla.gov.co    Email: licencias@anla.gov.co  \nPágina 26 de 34\nCONSIDERACIONES DE LA ANLA\nAnalizada la solicitud presentada por la sociedad y de conformidad con lo establecido en el Concepto \nTécnico 8278 del 29 de diciembre de 2022, el cual dispuso:\n“Frente a la solicitud presentada por la sociedad de reponer el literal b el numeral 3 del artículo sexto de \nla Resolución 2526 de 2022 en el sentido de revocar la obligación, esta Autoridad se permite aclarar que \ndicha obligación se encuentra contenida en la ficha de manejo 4.2 Manejo de Aguas Subterráneas en la \npágina 243 del EIA como se muestra en la siguiente imagen:\nFuente: EIA Campo Yaguará, página 243 Capítulo 7 Plan de Manejo Ambiental \nPor tanto, es la misma Sociedad la que propone la realización de actas de vecindad, registro fotográfico y \nfílmico del estado inicial de los aljibes y manantiales antes de la ejecución del proyecto o previo a la \nperforación del pozo profundo autorizado, así mismo, es claro para esta Autoridad que la presente \nmodificación no implica nuevas estrategias de desarrollo; sin embargo, la captación de agua subterránea \nsí se constituye en una actividad nueva que debe ser objeto de seguimiento y de establecimiento de \nmedidas de manejo.\nDado lo anterior, no es cierta la afirmación de la sociedad frente a que: “La modificación de la licencia \nambiental se determina exclusivamente en el uso y aprovechamiento de recursos naturales que \npreviamente se gestionaban con la Autoridad Ambiental Regional CAM”, toda vez que el proyecto Campo \nde Desarrollo Yaguará no contaba con permiso de captación de agua subterránea, el cual ha sido \nautorizado mediante la presente modificación de licencia ambiental otorgada mediante Resolución 2526 \nde 2022.\nCon respecto a que: “no es posible establecer una línea base de los puntos de agua mencionados por \nesta autoridad y su posible afectación frente a la infraestructura del campo, debido a que en su momento \nla legislación en materia ambiental para el sector de hidrocarburos esta (sic) incipiente y no se contaba en \nsu momento ni ahora con la información que nos permita establecer dicha línea base de los puntos de \nagua”, se reitera que dicha actividad de registro y verificación del estado de los puntos de agua ha sido \npropuesta por la misma Sociedad dentro de la ficha de manejo 4.2 y que dicho registro debe realizarse \n\nResolución No.  03115           Del   30 de diciembre de 2022            Hoja No. 27 de 34\n“Por la cual se resuelve un recurso de reposición contra de la Resolución 2526 del 19 de octubre de 2022”\nOficinas: Carrera 13 A No. 34 – 72 Edificio 13 35 Pisos 8 Bogotá, D.C.\nCentro de Orientación y Radicación de Correspondencia: Carrera 13 A No. 34 – 72 Edificio 13 35 \nLocales 110 al 112 Bogotá, D.C.  \nCódigo Postal 110311156\nNit.: 900.467.239-2\nLínea de Orientación y Contacto Ciudadano: 57 (1) 2540100 / 018000112998 PBX: 57 (1) 2540111\nwww.anla.gov.co    Email: licencias@anla.gov.co  \nPágina 27 de 34\nprevio a la perforación del pozo profundo para captación de agua subterránea y en los puntos de agua \nubicados a 2 km alrededor del área a intervenir, tal y como se registra en la ficha de manejo allegada por \nEcopetrol en la siguiente imagen: \nFuente: EIA Campo Yaguará, página 243 Capítulo 7 Plan de Manejo Ambiental \nDado lo anterior y debido a las reiteradas inquietudes de la comunidad y de las autoridades municipales \nde Yaguará frente al uso del recurso subterráneo, se considera pertinente mantener lo dispuesto en el \nliteral b el numeral 3 del artículo sexto de la Resolución 2526 de 2022 con respecto a que se socialice los \nresultados de los registros mensuales del estado de aljibes y manantiales durante la ejecución de la \noperación del campo, los cuales han sido propuestos por la misma sociedad en la ficha de manejo 4.2 \nManejo de Aguas Subterráneas y abordados de manera textual por esta Autoridad en la ficha 9.3 \nInformación y comunicación a autoridades y comunidad.\nPor tanto, se mantiene lo establecido en el literal b del numeral 3 del artículo sexto de la Resolución 2526 \nde 2022 respecto a la ficha 9.3 Información y Comunicación a Autoridades y Comunidad.\n(…)”\nCONSIDERACIONES JURÍDICAS DE LA ANLA \nDe acuerdo a las consideraciones técnicas expuestas, se concluye que no es procedente acceder a \nla solicitud presentada por la sociedad de revocar la obligación establecida por medio del literal b del \nnumeral 3 del artículo sexto de la Resolución 2526 del 19 de octubre de 2022, toda vez que fue la \nmisma sociedad la que propuso la obligación. Adicionalmente, esta obligación permite a la comunidad \ny a las autoridades municipales de Yaguará tener un mayor conocimiento respecto del recurso \nsubterráneo con relación al proyecto, respondiendo a varias de las inquietudes que al respecto se han \npresentado.\nIgualmente se aclara que la obligación corresponde a que se realice previamente a la perforación del \npozo subterráneo para captación de agua que se está autorizando mediante la Resolución 2526 de \n2022, es decir, que si es posible contar con dicho momento previo a la ejecución del permiso otorgado \nen el acto administrativo citado.  \nPor lo anterior, no se repone y se confirma la obligación recurrida. \n5.\nRESPECTO A LA SOLICITUD DE MODIFICAR EL ARTÍCULO SÉPTIMO DE LA \nRESOLUCIÓN 2526 DEL 19 DE OCTUBRE DE 2022\n\nResolución No.  03115           Del   30 de diciembre de 2022            Hoja No. 28 de 34\n“Por la cual se resuelve un recurso de reposición contra de la Resolución 2526 del 19 de octubre de 2022”\nOficinas: Carrera 13 A No. 34 – 72 Edificio 13 35 Pisos 8 Bogotá, D.C.\nCentro de Orientación y Radicación de Correspondencia: Carrera 13 A No. 34 – 72 Edificio 13 35 \nLocales 110 al 112 Bogotá, D.C.  \nCódigo Postal 110311156\nNit.: 900.467.239-2\nLínea de Orientación y Contacto Ciudadano: 57 (1) 2540100 / 018000112998 PBX: 57 (1) 2540111\nwww.anla.gov.co    Email: licencias@anla.gov.co  \nPágina 28 de 34\nArgumentos y Petición de la sociedad:\n“Según lo indicado en el artículo séptimo de la Resolución 2526 de 2022 referente a: “Modificar el artículo \nquinto de la Resolución 1224 del primero de octubre de 2015, en el sentido de incluir la ficha 1.6 \nperforación de pozos de agua subterránea y aceptar las modificaciones de presentadas para los \nProgramas de Seguimiento y Monitoreo que se relacionan a continuación:\nFichas modificadas del Plan de Monitoreo y Seguimiento del Campo de producciónYaguará\nPROGRAMAS DE MANEJO\nSUBPROGRAMA\n1.1 Monitoreo y seguimiento de la calidad del agua\n1.2 Emisiones atmosféricas, calidad del aire y ruido ambiental\n1.3 Aguas subterráneas\n8.1 MEDIO ABIÓTICO\n1.6 Perforación de pozos de agua subterránea.\n8.3 MEDIO SOCIOECONÓMICO\n3.1 Programa de seguimiento y monitoreo a la gestión social\nFuente: Documento de respuesta a la información adicional requerida por la ANLA medianteacta 59 del 21 de \njunio de 2022, capítulo 8 Plan de Seguimiento y monitoreo\nPARÁGRAFO. Las demás fichas del Plan de Seguimiento y Monitoreo se mantienen de acuerdo con lo \nestablecido en la Resolución 1224 del 1 de octubre de 2015.”\nPara la presente modificación de licencia ambiental, se realizó el ajuste de las fichas del Plan de Manejo \nAmbiental de acuerdo con lo requerido en el parágrafo único del artículo cuarto la Resolución 1224 de \n2015. Estos ajustes fueron presentados en el capítulo 8 del estudio de impacto ambiental (EIA) realizado \npara el presente trámite. Sin embargo, en el artículo séptimo de la Resolución 2526 de 2022 no se \nmenciona ningún concepto sobre las fichas y solo se aprueban las directamente relacionadas con el uso \ny aprovechamiento de los recursos naturales.\nConforme lo mencionado, ECOPETROL S.A. solicita reponer el artículo séptimo de la Resolución 2526 de \n2022 en el sentido de que sean incluidos y aprobados los ajustes efectuados en las fichas 1.4, 1.5, 2.1, \n2.2, 2.3, 2.4, 2.5, 2.6, 3.2, 3.3, 3.4 y 3.5 del Plan de Seguimiento y Monitoreo tal como lo requiere esta \nautoridad ambiental en la Resolución 1224 de 2015.”\n(…)\nModificar el artículo séptimo de la Resolución 2526 de 2022 en el sentido de que sean incluidos y \naprobados los ajustes efectuados en las fichas 1.4, 1.5, 2.1, 2.2, 2.3, 2.4, 2.5, 2.6, 3.2, 3.3, 3.4 y 3.5 del \nPlan de Seguimiento y Monitoreo.\n(…)”\nCONSIDERACIONES DE LA ANLA\nAnalizada la solicitud presentada por la sociedad y de conformidad con lo establecido en el Concepto \nTécnico 8278 del 29 de diciembre de 2022, el cual dispuso:\n“Es importante aclararle a Ecopetrol S.A. por parte del equipo técnico de evaluación de ANLA, que es la \nSociedad en el radicado VITAL 3500089999906822099 del 18 de agosto de 2022 de (radicado ANLA  No \n2022177129-1-000 del 18 de agosto del 2022) respuesta a la información adicional, quien establece los \nprogramas y las fichas del Plan de Seguimiento y Monitoreo que van a ser modificadas en el trámite que \ndio lugar a la Resolución 2526 de 2022, así las cosas, se extrae del radicado en comento lo siguiente:\nEn el Capítulo 8, Programa de Seguimiento y Monitoreo, en la página 3 en adelante, la Sociedad propone \nlo siguiente:\n“(…) El presente capítulo pretende mantener el Plan de Monitoreo y Seguimiento del Campo Yaguará \nestablecido en la Resolución 1224 del 1 de octubre de 2015, el cual abarca todos los componentes \nambientales que pueden verse afectados por la explotación de hidrocarburos del campo incluyendo los \n\nResolución No.  03115           Del   30 de diciembre de 2022            Hoja No. 29 de 34\n“Por la cual se resuelve un recurso de reposición contra de la Resolución 2526 del 19 de octubre de 2022”\nOficinas: Carrera 13 A No. 34 – 72 Edificio 13 35 Pisos 8 Bogotá, D.C.\nCentro de Orientación y Radicación de Correspondencia: Carrera 13 A No. 34 – 72 Edificio 13 35 \nLocales 110 al 112 Bogotá, D.C.  \nCódigo Postal 110311156\nNit.: 900.467.239-2\nLínea de Orientación y Contacto Ciudadano: 57 (1) 2540100 / 018000112998 PBX: 57 (1) 2540111\nwww.anla.gov.co    Email: licencias@anla.gov.co  \nPágina 29 de 34\ncomponentes ambientales impactados por el uso y aprovechamiento de los recursos naturales asociados \na los permisos solicitados: concesión de aguas superficiales, permiso de emisiones atmosféricas y \nprospección y exploración de aguas subterráneas.\nCabe resaltar que con el fin de dar cumplimiento a lo requerido en el artículo 5 de la Resolución 1224 de \n2015, en el sentido de ajustar algunas fichas del Plan de Monitoreo y Seguimiento del Campo Yaguará, \nse incluyen en el presente capítulo las fichas que fueron ajustadas junto con las fichas que son objeto de \nla presente modificación.\nDado lo anterior, en la Tabla 8-1 se presenta el Plan de Monitoreo y Seguimiento del Campo Yaguará \nestablecido en la Resolución 1224 de 2015 y se indican las fichas que fueron ajustadas de acuerdo con \nel requerimiento y las que dan alcance a los permisos solicitados para la modificación de la licencia \nambiental del campo Yaguará\nTabla 8-1 Relación de Plan de Monitoreo y Seguimiento del Campo Yaguará frente a las fichas \nque se desarrollan en el presente documento\nFICHAS CONTENIDAS EN EL PRESENTE EIA\nPROGRAMA\nFICHA DE \nSEGUIMIENTO\nREQUERIMIENTO\nRES. 1224 DE 2015 ARTICULO \nQUINTO\nALCANCE \nPRESENTE \nMODIFICACION\n1.1 Monitoreo y \nseguimiento de la \ncalidad del agua\n<0000>\nIncluir un punto adicional para el \nmonitoreo de agua superficial, \nsobre la quebrada Caraguaja.\n<0000>\nAdicionar siguientes parámetros \nal \nmonitoreo \nde \naguas \nsuperficiales\nEsta ficha aplica \npara la presente \nmodificación\n1.2 Emisiones \natmosféricas, calidad \ndel\naire y ruido ambiental\n<0000>\nIncluir un punto adicional para el \nmonitorea \nanual \nde \nruido \nambiental, dentro de la Batería \n(en la parte central). Incluir la \nrealización de rnonitoreos de \nruido ambiental\ndurante la ejecución de labores de \nperforación y trabajos de pozo.\nEsta ficha aplica \npara la presente \nmodificación\n1.3 Aguas subterráneas\n<0000>\nIncluir lo relacionado con la red de \nmonitoreo \nde \naguas \nsubterráneas, planteada en el \nEIA.\nEsta ficha aplica \npara la presente \nmodificación.\n1.4 Suelos\n<0000>\nSe ajusta la estructura de la \nficha de acuerdo a lo indicado en \nla Resolución\n1224 e 2015, Artículo Quinto.\nEsta ficha no hace \nparte de la \npresente\nmodificación\n1.5. Sistemas de \nmanejo, tratamiento y \ndisposición de \nresiduos\nsólidos y lodos de \nperforación\n<0000>\nAclarar que no se podrá realizar \nel tratamiento de los residuos \nbase aceite en el campo, sino que \nserán retirados por las compañías \nespecializadas para ser tratados \nen la\nsede de las mismas\nEsta ficha no hace \nparte de la \npresente \nmodificación\n1. MEDIO ABIÓTICO\n1.6 Manejo de la \nperforación de pozos \nde\nagua subterránea.\n<0000>\nSe incluye esta nueva ficha para \ndar alcance permiso prospección \ny \nexploración \nde \naguas \nsubterráneas.\nEsta ficha aplica \npara la presente \nmodificación\n2. MEDIO BIÓTICO\n2.1 Manejo de Flora\n<0000>\nSe ajusta la estructura de la ficha \nde acuerdo a lo indicado en la \nResolución 1224 e 2015, Artículo \nQuinto.\nEsta ficha no hace \nparte de la \npresente \nmodificación\n\nResolución No.  03115           Del   30 de diciembre de 2022            Hoja No. 30 de 34\n“Por la cual se resuelve un recurso de reposición contra de la Resolución 2526 del 19 de octubre de 2022”\nOficinas: Carrera 13 A No. 34 – 72 Edificio 13 35 Pisos 8 Bogotá, D.C.\nCentro de Orientación y Radicación de Correspondencia: Carrera 13 A No. 34 – 72 Edificio 13 35 \nLocales 110 al 112 Bogotá, D.C.  \nCódigo Postal 110311156\nNit.: 900.467.239-2\nLínea de Orientación y Contacto Ciudadano: 57 (1) 2540100 / 018000112998 PBX: 57 (1) 2540111\nwww.anla.gov.co    Email: licencias@anla.gov.co  \nPágina 30 de 34\nESTRUCTURA DEL PROGRAMA DE MONITOREO Y SEGUIMIENTO\nComo se mencionó, el presente documento considera todas las fichas del Plan de Seguimiento y \nMonitoreo del Campo Yaguará aprobadas en la Resolución 1224 de 1 de octubre de 2015 junto con los \najustes requeridos por la ANLA en el artículo quinto de dicho acto administrativo (Ver Tabla 8-1). No \nobstante, es importante aclarar que para el presente estudio de modificación, en la Tabla 8-2 se \nrelacionan los programas y fichas de monitoreo y seguimiento considerados en el presente capítulo, \ncorrespondientes a los programas de los medios abiótico y socioeconómico.\nTabla 8-2 Fichas de Monitoreo y Seguimiento para la presente modificación\nPROGRAMAS DE MANEJO\nSUBPROGRAMA\n1.1 Monitoreo y seguimiento de la calidad del agua\n1.2 Emisiones atmosféricas, calidad del aire y ruido ambiental\n1.3 Aguas subterráneas\n8.1 MEDIO ABIÓTICO\n1.6 Perforación de pozos de agua subterránea.\n8.3 MEDIO SOCIOECONÓMICO\n3.1 Programa de seguimiento y monitoreo a la gestión social\nFuente: Estudios Técnicos S.A.S, 2021\n(…)”\nDe lo anterior el equipo técnico de evaluación de ANLA, considera que Ecopetrol S.A. en la respuesta a \nla información adicional, está definiendo que va a mantener el Plan de Seguimiento y Monitoreo del Campo \nde Producción Yaguará, establecido en la Resolución 1224 del 1 de octubre de 2015, “Por la cual se \nmodifica una licencia ambiental global”, pero que en el Capítulo 8 del estudio, está incluyendo el \ncumplimiento a lo requerido en el Artículo 5 de la Resolución 1224 de 2015.\nAsí las cosas, las modificaciones a las fichas de Seguimiento del Plan de Seguimiento y Monitoreo del \nproyecto establecidas en la Resolución 1224 de 2015, ya hacen parte del Seguimiento Ambiental realizado \npor esta Autoridad al proyecto Campo de Producción Yaguará, dado que ya están establecidas en el Plan \nde Seguimiento y Monitoreo del proyecto, debido a que fueron obligaciones de estricto cumplimiento \nambiental requeridas en el acto administrativo de Resolución 1224 del 1 de octubre de 2015. \nSumado a lo anterior, se puede extraer de la respuesta a la información adicional, Tabla 8-1 “Relación de \nPlan de Monitoreo y Seguimiento del Campo Yaguará frente a las fichas que se desarrollan en el presente \ndocumento”, que las fichas de código: 1.4, 1.5, 2.1, 2.2, 2.3, 2.4, 2.5, 2.6, 3.2, 3.3, 3.4, 3.5, no hacen parte \nde la modificación del trámite que dio lugar a la Resolución 2526 de 2022.\nAhora bien de la respuesta a la información adicional, Tabla 8-2 “Fichas de Monitoreo y Seguimiento para \nla presente modificación”, se puede concluir por parte del equipo técnico de evaluación de la ANLA, que \nlas fichas de código: 1.1, 1.1, 1.3, 1.6, 3.11, son sobre las cuales la Sociedad propone modificaciones y \nfue sobre las cuales el equipo técnico de ANLA se pronunció como se puede observar en las Hojas de la \n99 a la 113 de 139 del Resolución No 2526 de 2022 por la cual se otorga modificación de licencia ambiental \nal proyecto Campo de Producción Yaguará.\nCon lo anterior se le aclara a la sociedad Ecopetrol S.A. que los ajustes requeridos a los programas y las \nfichas del Plan de Monitoreo y Seguimiento de acuerdo con lo requerido en el Artículo 5 de la Resolución \n1224 de 2015, que fueron presentados en el capítulo 8 del estudio respuesta a información adicional \nentregado a ANLA mediante radicado VITAL 3500089999906822099 del 18 de agosto de 2022 (radicado \nANLA  No 2022177129-1-000 del 18 de agosto del 2022), ya fueron evaluados por la ANLA y hacen parte \ndel Plan de Monitoreo y Seguimiento que está establecido en la licencia ambiental desde el año 2015, \ndado que son obligaciones de estricto cumplimiento ambiental.\nAsí las cosas para la modificación acogida mediante acto administrativo de Resolución No 2526 de 2022 \nel grupo técnico de ANLA no se pronunció sobre estos ajustes solicitados en las Resolución 1224 de 2015 \ny en el artículo 5, debido a que la Sociedad no solicitó modificación de estas fichas y solo incluyó los \najustes evaluados y ya solicitados por ANLA en actos administrativos pasados; sumado a lo anterior, la \nSociedad deja claro que los programas contenidos en las fichas de código: 1.4, 1.5, 2.1, 2.2, 2.3, 2.4, 2.5, \n2.6, 3.2, 3.3, 3.4, 3.5, no hacen parte del trámite de modificación acogido mediante el acto administrativo \nde Resolución 2526 de 2022 (ver Tabla 8-1 Relación de el Plan de Seguimiento y Monitoreo del Campo \n\nResolución No.  03115           Del   30 de diciembre de 2022            Hoja No. 31 de 34\n“Por la cual se resuelve un recurso de reposición contra de la Resolución 2526 del 19 de octubre de 2022”\nOficinas: Carrera 13 A No. 34 – 72 Edificio 13 35 Pisos 8 Bogotá, D.C.\nCentro de Orientación y Radicación de Correspondencia: Carrera 13 A No. 34 – 72 Edificio 13 35 \nLocales 110 al 112 Bogotá, D.C.  \nCódigo Postal 110311156\nNit.: 900.467.239-2\nLínea de Orientación y Contacto Ciudadano: 57 (1) 2540100 / 018000112998 PBX: 57 (1) 2540111\nwww.anla.gov.co    Email: licencias@anla.gov.co  \nPágina 31 de 34\nYaguará frente a las fichas que se desarrollan en el presente documento), sino que propone \nmodificaciones sobre los programas contenidos en las fichas de código: 1.1, 1.1, 1.3, 1.6, 3.11.\nPor todo lo anterior el equipo de evaluación de ANLA, se mantiene en lo establecido en el artículo séptimo \nde la Resolución 2526 de 2022 respecto a las fichas del el Plan de Seguimiento y Monitoreo Ambiental.\n(…)”\nCONSIDERACIONES JURÍDICAS DE LA ANLA \nNo es posible acceder a la solicitud presentada por la sociedad de modificar el artículo séptimo de la \nResolución 2526 del 19 de octubre de 2022 en el sentido de que se incluyan y aprueben los ajustes \nefectuados en las fichas 1.4, 1.5, 2.1, 2.2, 2.3, 2.4, 2.5, 2.6, 3.2, 3.3, 3.4 y 3.5 del Plan de Seguimiento \ny Monitoreo, ya que tal como se estableció por el equipo evaluador, la sociedad no solicitó modificación \nde las mismas, por lo que para estas, se limitó a incluir solo los ajustes evaluados y ya solicitados por \nesta Autoridad Nacional en actos administrativos pasados. Adicionalmente, fue la misma sociedad la \nque indicó que las modificaciones propuestas para el trámite en comento, aplicaba sobre los \nprogramas contenidos en las fichas de código 1.1, 1.1, 1.3, 1.6, 3.11, las cuales fueron evaluadas en \nla resolución recurrida. \nSe aclara a la sociedad que no es que los ajustes o modificaciones no estén acordes o no hagan parte \ndel plan de seguimiento y monitoreo del proyecto, sino que no fueron aspectos de la modificación que \nfue tramitada, por el contrario, corresponde a ajustes solicitados en la Resolución 1224 de 2015 y en \nel artículo décimo segundo de la Resolución 0297 de 2016, que deben ser es presentados para el \nseguimiento al proyecto y es en esta etapa donde se validan los mismo\nEn conclusión, esta Autoridad se pronunció y avaló la solicitud que realizó la misma sociedad para la \npresente modificación y no correspondía pronunciarse en este trámite lo correspondiente a \nseguimiento.  \nCONSIDERACIONES FINALES. \nLa Autoridad Nacional de Licencias Ambientales – ANLA, en atención al recurso de reposición \ninterpuesto, encuentra procedente modificar la Resolución 2526 del 19 de octubre de 2022, mediante \nla cual se modificó la licencia ambiental otorgada para el proyecto denominado “Campo de Producción \nYaguará”, en lo relacionado con: \n1.\nLas obligaciones establecidas en el numeral 2 del artículo primero de la Resolución 2526 del \n19 de octubre de 2022.\n2.\nLa tabla que lista los equipos autorizados en el permiso de emisiones atmosféricas, del artículo \ntercero de la Resolución 2526 del 19 de octubre de 2022\nEn cuanto al parágrafo del artículo primero, el parágrafo de tercero, el artículo quinto, la obligación \nestablecida en el literal b del numeral 3 del artículo sexto, y el artículo séptimo de la Resolución 2526 \ndel 19 de octubre de 2022, esta Autoridad no accederá a las solicitudes presentadas por la sociedad, \nde conformidad con las consideraciones expuestas en la presente resolución y, en consecuencia \nprocederá a su confirmación.  \nEn mérito de lo expuesto,\nRESUELVE:\nARTÍCULO PRIMERO. Reponer en el sentido de modificar la obligación establecida en el numeral 2 \ndel artículo primero de la Resolución 2526 del 19 de octubre de 2022, de conformidad con lo expuesto \nen la parte considerativa del presente acto administrativo, el cual quedará así:\n\nResolución No.  03115           Del   30 de diciembre de 2022            Hoja No. 32 de 34\n“Por la cual se resuelve un recurso de reposición contra de la Resolución 2526 del 19 de octubre de 2022”\nOficinas: Carrera 13 A No. 34 – 72 Edificio 13 35 Pisos 8 Bogotá, D.C.\nCentro de Orientación y Radicación de Correspondencia: Carrera 13 A No. 34 – 72 Edificio 13 35 \nLocales 110 al 112 Bogotá, D.C.  \nCódigo Postal 110311156\nNit.: 900.467.239-2\nLínea de Orientación y Contacto Ciudadano: 57 (1) 2540100 / 018000112998 PBX: 57 (1) 2540111\nwww.anla.gov.co    Email: licencias@anla.gov.co  \nPágina 32 de 34\n“ARTÍCULO PRIMERO: Modificar el artículo sexto de la Resolución 944 del 9 de noviembre de 1999, \nmodificado por el artículo noveno de la Resolución 1224 del 01 de octubre de 2015, por la cual se \nmodificó la licencia ambiental para el proyecto denominado “Campo de Producción Yaguará”, \nlocalizado en jurisdicción del municipio de Yaguará del departamento del Huila, en el sentido de otorgar \na la sociedad ECOPETROL S.A. la concesión de aguas superficiales de 70 l/s del Embalse de Betania \npara uso doméstico e industrial, en el punto denominado Peñalisa, vereda Vilú del municipio de \nYaguará; de acuerdo con las características que se presentan en la siguiente tabla:\n(…)\nObligaciones:\n(…)\n2.\nRealizar mediciones de caudal de agua captada bajo las siguientes condiciones:\na.\nLocalizar un medidor de flujo debidamente calibrado en el sitio de la captación, para la \nmedición de caudal. Presentar en los Informes de Cumplimiento Ambiental – ICA los métodos \nseleccionados para medición de caudal y su justificación, de acuerdo con los métodos establecidos \npara este tipo de mención.\nb.\nPara la captación sobre la represa de Betania, se deberá realizar un registro durante todo el \naño y presentar el cálculo de los caudales correspondientes. Presentar la base de datos en los \nrespectivos Informes de Cumplimiento Ambiental – ICA.\nc.\nPresentar en los Informes de Cumplimiento Ambiental – ICA el análisis de la información \nacumulada y su comparación con los caudales obtenidos en la línea base (caudales medios mínimos, \nmáximos mensuales multianuales y caudales ambientales).”\nARTÍCULO SEGUNDO. Reponer en el sentido de modificar la tabla correspondiente a “Equipos \nautorizados en el permiso de emisiones atmosféricas” establecida en el artículo tercero de la \nResolución 2526 del 19 de octubre de 2022, de conformidad con lo expuesto en la parte considerativa \ndel presente acto administrativo, la cual quedará así:\n“ARTÍCULO TERCERO: Modificar el artículo sexto de la Resolución 944 del 9 de noviembre de 1999, \nmodificado por el artículo noveno de la Resolución 1224 del 01 de octubre de 2015, en el sentido de \notorgar a la sociedad ECOPETROL S.A. permiso de Emisiones Atmosféricas, para la quema de gas y \noperación con combustibles en las actividades planteadas en el proyecto, mediante la instalación y \noperación de generadores, teas y demás equipos de menor tamaño necesarios para la actividad.\nTABLA EQUIPOS AUTORIZADOS EN EL PERMISO DE EMISIONES ATMOSFÉRICAS\nTasas de emisión por contaminante en (g/s)\nEquipo\nCapacidad\nComb\nCantidad.\n Autorizada\nPM 10\nPM 2.5\nSO2\nNO2\nCO\nGenerador\n575 kW\nGas\n2\n1,61x1\n0-6\n1,61x1\n0-6\n1,23x1\n0-5\n1,77x1\n0-2\n1,17x1\n0-2\nGenerador\n1400 kW\nGas\n1\n1,61x1\n0-6\n1,61x1\n0-6\n1,23x1\n0-5\n1,77x1\n0-2\n1,17x1\n0-2\nGenerador\n1360 kW\nDiesel\n1\n6,79x1\n0-3\n6,79x1\n0-3\n1,47x1\n0-4\n1,86x1\n0-1\n3,60x1\n0-2\nTratador electrostático\nN/A\nGas\n2\n6,03x1\n0-3\n6,03x1\n0-3\n2,34x1\n0-2\n1,11x1\n0-1\n6,67x1\n0-2\nTea de alta\nN/A\nGas\n1\n3,22x1\n0-3\n3,22x1\n0-3\n1,69x1\n0-3\n3,54x1\n0-3\n1,61x1\n0-2\nTea de baja\nN/A\nGas\n1\n8,82x1\n0-4\n4,64x1\n0-4\n9,72x1\n0-4\n4,43x1\n0-3\n9,43x1\n0-3\nMotocompresores\n300 HP\nGas\n2\n1,61x1\n0-6\n1,61x1\n0-6\n1,23x1\n0-5\n1,77x1\n0-2\n1,17x1\n0-2\nBombas de transferencia\n12 KCFD\nGas\n3\n1,61x1\n0-6\n1,61x1\n0-6\n1,23x1\n0-5\n1,77x1\n0-2\n1,17x1\n0-2\nFuente: Equipo Evaluador Ambiental del documento EIA, 2022”\n\nResolución No.  03115           Del   30 de diciembre de 2022            Hoja No. 33 de 34\n“Por la cual se resuelve un recurso de reposición contra de la Resolución 2526 del 19 de octubre de 2022”\nOficinas: Carrera 13 A No. 34 – 72 Edificio 13 35 Pisos 8 Bogotá, D.C.\nCentro de Orientación y Radicación de Correspondencia: Carrera 13 A No. 34 – 72 Edificio 13 35 \nLocales 110 al 112 Bogotá, D.C.  \nCódigo Postal 110311156\nNit.: 900.467.239-2\nLínea de Orientación y Contacto Ciudadano: 57 (1) 2540100 / 018000112998 PBX: 57 (1) 2540111\nwww.anla.gov.co    Email: licencias@anla.gov.co  \nPágina 33 de 34\nARTÍCULO TERCERO. No reponer y en consecuencia confirmar el parágrafo del artículo primero, el \nparágrafo del artículo tercero, el artículo quinto, la obligación establecida en el literal b del numeral 3 \ndel artículo sexto, y el artículo séptimo de la Resolución 2526 del 19 de octubre de 2022, de \nconformidad con lo expuesto en la parte motiva del presente acto administrativo.\nARTÍCULO CUARTO. Notificar el presente acto administrativo a la sociedad ECOPETROL S.A., \nidentificada con NIT. 9000148720-6, a través de su representante legal, o apoderado constituido, o a \nla persona autorizada, de conformidad con lo establecido en los artículos 67 y siguientes del Código \nde Procedimiento Administrativo y de lo Contencioso Administrativo.\nARTÍCULO QUINTO. Comunicar el contenido del presente acto administrativo, a la alcaldía del \nmunicipio de Yaguará en el departamento del Huila, a la Corporación Autónoma Regional del Alto \nMagdalena – CAM y a la Agencia Nacional de Hidrocarburos – ANH.\nARTÍCULO SEXTO. Publicar el presente acto administrativo, en la Gaceta Ambiental de la Autoridad \nNacional de Licencias Ambientales - ANLA.\nARTÍCULO SÉPTIMO. Contra el presente acto administrativo no procede ningún recurso, de \nconformidad con lo establecido en el inciso segundo del numeral 2 del artículo 74 de la Ley 1437 de \n2011.\nNOTIFÍQUESE, COMUNÍQUESE, PUBLÍQUESE Y CÚMPLASE\nDada en Bogotá D.C., a los 30 de diciembre de 2022\nRODRIGO ELIAS NEGRETE MONTES\nDirector General\nEjecutores\nDIANA MARCELA RUBIANO \nBECERRA\nContratista\n \n \nRevisor / L\u0000der\nALVARO CEBALLOS HERNANDEZ\nContratista\n \nJHON WILLAN MARMOL \nMONCAYO\nContratista\n \nLUIS ORLANDO FORERO \nHIGUERA\nContratista\n \nNATALIA SANCLEMENTE \nGUTIERREZ\nAsesor\n \n \n\nResolución No.  03115           Del   30 de diciembre de 2022            Hoja No. 34 de 34\n“Por la cual se resuelve un recurso de reposición contra de la Resolución 2526 del 19 de octubre de 2022”\nOficinas: Carrera 13 A No. 34 – 72 Edificio 13 35 Pisos 8 Bogotá, D.C.\nCentro de Orientación y Radicación de Correspondencia: Carrera 13 A No. 34 – 72 Edificio 13 35 \nLocales 110 al 112 Bogotá, D.C.  \nCódigo Postal 110311156\nNit.: 900.467.239-2\nLínea de Orientación y Contacto Ciudadano: 57 (1) 2540100 / 018000112998 PBX: 57 (1) 2540111\nwww.anla.gov.co    Email: licencias@anla.gov.co  \nPágina 34 de 34\nExpediente No. \nLAM0989\nConcepto Técnico N° 8278 del 29 de diciembre de 2022\nFecha:\nDiciembre de 2022\nProceso No.: 2022297523\nArchívese en: LAM0989  \nPlantilla_Resolución_SILA_v3_42852\nNota: Este es un documento electrónico generado desde los Sistemas de Información de la ANLA. El original reposa en los archivos digitales de la \nEntidad.\n"
}