{
  "fuente": "ANLA_GACETA",
  "numero_resolución": "RESOLUCIÓN N° 01793",
  "fecha_resolución": "2022-08-22",
  "anio_resolucion": "2022",
  "nombre_proyecto": "Construcción y Operación del",
  "nombre_proyecto_normalizado": "CONSTRUCCION Y OPERACION DEL",
  "ubicación": "Municipio De Aguazul En El Departamento De Casanare",
  "empresa": "ECOPETROL",
  "empresa_normalizada": "ECOPETROL",
  "numero_expediente": "LAM1146",
  "radicados": [
    "2021267786",
    "2020046903",
    "2022033597",
    "2022084858"
  ],
  "descripcion": "Por la cual se resuelve recurso de reposición interpuesto contra la Resolución 775 del 19 de abril de 2022",
  "tipos_infraccion": [
    "Tala o afectación de bosques"
  ],
  "tipos_infraccion_normalizados": [
    "TALA O AFECTACION DE BOSQUES"
  ],
  "pdf_id": "40154",
  "file_name": "ANLA_40154.pdf",
  "texto_completo": "|\nRepública de Colombia\nMinisterio de Ambiente y Desarrollo Sostenible\nAUTORIDAD NACIONAL DE LICENCIAS AMBIENTALES \n- ANLA –\nRESOLUCIÓN N°  01793\n( 22 de agosto de 2022 )\nOficinas: Carrera 13 A No. 34 – 72 Edificio 13 35 Pisos 8 al 11 Bogotá, D.C.\nCentro de Orientación y Radicación de Correspondencia: Carrera 13 A No. 34 – 72 Edificio 13 35 \nLocales 110 al 112 Bogotá, D.C.  \nCódigo Postal 110311156\nNit.: 900.467.239-2\nLínea de Orientación y Contacto Ciudadano: 57 (1) 2540100 / 018000112998 PBX: 57 (1) 2540111\nwww.anla.gov.co    Email: licencias@anla.gov.co  \nPágina 1 de 23\n“Por la cual se resuelve recurso de reposición interpuesto contra la Resolución 775 del 19 de \nabril de 2022”\nEL ASESOR DEL DESPACHO DEL DIRECTOR DE LA AUTORIDAD NACIONAL DE LICENCIAS \nAMBIENTALES – ANLA\nEn ejercicio de las facultades otorgadas por la Ley 99 de 1993, numeral 2 del artículo tercero y el \nnumeral 9 del artículo 13 del Decreto 3573 del 27 de septiembre de 2011, modificada por el Decreto \n376 del 11 de marzo de 2020, el artículo 2.2.2.3.9.1 del Decreto 1076 de 2015, la Resolución 423 del \n12 de marzo de 2020, la Resolución 566 del 31 de marzo de 2020 y la Resolución 1957 del 5 de \nnoviembre de 2021 y\nCONSIDERANDO\nQue mediante Resolución 1299 del 4 de diciembre de 1996, el entonces Ministerio del Medio \nAmbiente, hoy Ministerio de Ambiente y Desarrollo Sostenible, en adelante el Ministerio, otorgó \nLicencia Ambiental a la sociedad BP EXPLORATION COMPANY - COLOMBIA- LIMITED, en \nadelante la Sociedad, para la Construcción y Operación del proyecto “Construcción y Operación del \nÁrea de Pozos Múltiples Cupiagua T”, ubicados en la vereda Cupiagua en el municipio de Aguazul \nen el departamento de Casanare.\nQue a través de la Resolución 315 del 22 de febrero de 2007, el Ministerio modificó el inciso \nsegundo, literal c, numeral 1 del artículo segundo de la Resolución 1299 del 4 de diciembre de 1996, \nen el sentido de establecer que los Informes de Cumplimiento Ambiental – ICA, se debían presentar \ncon una frecuencia anual para la etapa de producción.\nQue con Resolución 1925 del 1 de octubre de 2010, el Ministerio autorizó la cesión de la Licencia \nAmbiental otorgada mediante Resolución 1299 del 4 de diciembre de 1996, a la sociedad BP \nEXPLORATION COMPANY -COLOMBIALIMITED, en favor de la sociedad ECOPETROL S.A., \nidentificada con el NIT. 899.999.068-1.\nQue mediante Resolución 2151 del 23 de noviembre de 2018, esta Autoridad Nacional modificó la \nResolución 1299 de 4 de diciembre de 1996, en el sentido de incluir como línea general del Plan de \ninversión de no menos del 1% las acciones de protección, conservación y preservación a través de \nla restauración ecológica, rehabilitación y recuperación, dentro de las cuales se incluye el desarrollo \nde proyectos de uso sostenible, para desarrollarse a través del desarrollo de los Proyectos \nproductivos de uso sostenible de Sistemas Agroforestales con Cacao – Forestales o Cacao – \nPlátano – Forestales en el área del Núcleo Piedemonte II, de conformidad con dispuesto en el literal \na) del numeral 1 del Artículo 2.2.9.3.1.9 del Decreto 2099 de 2016, modificado por el Decreto 075 del \n20 de enero 2017 y el Decreto 1120 del 29 de junio 2017, compilados en el Decreto 1076 de 2015. \n\nResolución No.  01793           Del   22 de agosto de 2022            Hoja No. 2 de 23\n“Por la cual se resuelve recurso de reposición interpuesto contra la Resolución 775 del 19 de abril de 2022”\nOficinas: Carrera 13 A No. 34 – 72 Edificio 13 35 Pisos 8 al 11 Bogotá, D.C.\nCentro de Orientación y Radicación de Correspondencia: Carrera 13 A No. 34 – 72 Edificio 13 35 \nLocales 110 al 112 Bogotá, D.C.  \nCódigo Postal 110311156\nNit.: 900.467.239-2\nLínea de Orientación y Contacto Ciudadano: 57 (1) 2540100 / 018000112998 PBX: 57 (1) 2540111\nwww.anla.gov.co    Email: licencias@anla.gov.co  \nPágina 2 de 23\nQue a través  Resolución 1138 del 19 de junio de 2019, esta Autoridad Nacional resolvió el recurso \nde reposición interpuesto contra la Resolución 2151 de fecha de 23 de noviembre de 2018, en el \nsentido de aclarar y dejar en firme unas obligaciones con relación a la inversión forzosa de no menos \ndel 1%.\nQue con Resolución 405 del 11 de marzo de 2020, esta Autoridad Nacional, modificó el artículo \ndécimo noveno de la Resolución 1299 del 4 de diciembre de 1996, en el sentido de aprobar el \nacogimiento al porcentaje incremental señalado en artículo 321 del Plan Nacional de Desarrollo - \nPND (Ley 1955 del 25 de mayo del 2019), presentado por la Sociedad, para el proyecto \n“Construcción y Operación del Área de Pozos Múltiples Cupiagua T”.\nQue mediante Resolución 1130 del 30 de junio de 2020, esta Autoridad Nacional resolvió recurso de \nreposición en contra de la Resolución 405 del 11 de marzo de 2020, en el sentido de modificar y \nmantener incólume obligaciones relacionados con el acogimiento al porcentaje incremental señalado \nen artículo 321 del Plan Nacional de Desarrollo – PND.\nQue la sociedad ECOPETROL S.A., mediante comunicación con radicado 2021267786-1-000 del 9 \nde diciembre de 2021, solicitó la declaratoria de cumplimiento de la línea de inversión \ncorrespondiente a restauración, conservación y protección de la cobertura vegetal, enriquecimientos \nvegetales y aislamiento de áreas para facilitar la sucesión natural desarrollada a través de los \nprogramas de Conservación de 28,47ha de Bosque Protector y reforestación de 2,65ha en los lotes \n1 y 13 del predio Cupiagua S.\nQue mediante Resolución 775 del 19 de abril de 2022, esta Autoridad Nacional declaró a la sociedad \nECOPETROL S.A. que ha ejecutado con relación a la línea de inversión de Restauración, \nconservación y protección de la cobertura vegetal, enriquecimientos vegetales y aislamiento de \náreas para facilitar la sucesión natural los proyectos “Conservación de 28,47ha” y “Reforestación de \n2,65ha...”, ubicados en el predio El Porvenir, propiedad de Ecopetrol S.A. \nQue por medio del radicado ANLA No. 2022084858-1-000 del 03 de mayo de 2022, la sociedad \nECOPETROL S.A. presentó recurso de reposición contra los artículos primero y segundo de la \nResolución 775 del 19 de abril de 2022.\nQue el equipo técnico de la Autoridad Nacional realizó la evaluación del recurso de reposición \ninterpuesto por la sociedad Ecopetrol S.A., en la comunicación 2022084858-1-000 del 03 de mayo \nde 2022, en contra de los artículos primero y segundo de la Resolución 0775 del 19 de abril de 2022, \npronunciándose mediante el Concepto Técnico 04124 del 19 de julio de 2022.\nFUNDAMENTOS CONSTITUCIONALES Y LEGALES\na.\nDe la protección del derecho al medio ambiente como deber social del estado.\nQue el artículo 8 de la Constitución Política, consagra como obligación del Estado y de las personas \nproteger las riquezas culturales y naturales de la Nación.\nQue el artículo 58 de la Constitución Política de Colombia, establece en su inciso segundo que la \npropiedad lleva inmersa una función social que implica obligaciones. Como tal, le es inherente una \nfunción ecológica que implica el respeto por el derecho a un medio ambiente sano y la protección a \nlos recursos naturales.\nQue el artículo 79 de la Constitución Política, establece la obligación que tiene el Estado de proteger \nel medio ambiente y el derecho que tienen todos los ciudadanos a gozar de un ambiente sano. Así \nmismo le impuso al Estado el deber de proteger la diversidad e integridad del ambiente, conservar \nlas áreas de especial importancia ecológica y fomentar la educación para el logro de estos fines.\n\nResolución No.  01793           Del   22 de agosto de 2022            Hoja No. 3 de 23\n“Por la cual se resuelve recurso de reposición interpuesto contra la Resolución 775 del 19 de abril de 2022”\nOficinas: Carrera 13 A No. 34 – 72 Edificio 13 35 Pisos 8 al 11 Bogotá, D.C.\nCentro de Orientación y Radicación de Correspondencia: Carrera 13 A No. 34 – 72 Edificio 13 35 \nLocales 110 al 112 Bogotá, D.C.  \nCódigo Postal 110311156\nNit.: 900.467.239-2\nLínea de Orientación y Contacto Ciudadano: 57 (1) 2540100 / 018000112998 PBX: 57 (1) 2540111\nwww.anla.gov.co    Email: licencias@anla.gov.co  \nPágina 3 de 23\nQue el artículo 80 de la Constitución Política de Colombia establece: “El Estado planificará el manejo \ny aprovechamiento de los recursos naturales, para garantizar su desarrollo sostenible, su \nconservación, restauración o sustitución; además, deberá prevenir y controlar los factores de \ndeterioro ambiental, imponer las sanciones legales y exigir la reparación de los daños causados”.\nQue el artículo 95 constitucional señala que es deber de la persona y del ciudadano proteger los \nrecursos culturales y naturales del país y velar por la conservación de un ambiente sano.\nQue en relación con la responsabilidad en la conservación y defensa del ambiente, es del caso tener \nen cuenta lo establecido en el artículo 333 de la Constitución Política, según el cual, la actividad \neconómica y la iniciativa privada son libres, pero “dentro de los límites del bien común”, al respecto la \nCorte Constitucional en la sentencia T-325 - 17 del quince (15) de mayo de dos mil diecisiete (2017), \nha conceptuado con relación a la defensa del derecho al Medio Ambiente Sano:\n“(…) La Corte ha atendido a la necesidad que propugna por la defensa del ambiente y de los \necosistemas, por lo que ha calificado al ambiente como un bien jurídico constitucionalmente \nprotegido, en el que concurren las siguientes dimensiones: “(i) es un principio que irradia todo el \norden jurídico en cuanto se le atribuye al Estado la obligación de conservarlo y protegerlo, \nprocurando que el desarrollo económico y social sea compatible con las políticas que buscan \nsalvaguardar las riquezas naturales de la Nación; (ii) aparece como un derecho constitucional de \ntodos los individuos que es exigible por distintas vías judiciales; (iii) tiene el carácter de servicio \npúblico, erigiéndose junto con la salud, la educación y el agua potable, en un objetivo social cuya \nrealización material encuentra pleno fundamento en el fin esencial de propender por el mejoramiento \nde la calidad de vida de la población del país; y (iv) aparece como una prioridad dentro de los fines \ndel Estado, comprometiendo la responsabilidad directa del Estado al atribuirle los deberes de \nprevención y control de los factores de deterioro ambiental y la adopción de las medidas de \nprotección (…)”.\nDe conformidad con lo anterior, la protección al medio ambiente corresponde a uno de los más \nimportantes cometidos estatales, es deber del Estado garantizar a las generaciones futuras la \nconservación del ambiente y la preservación de los recursos naturales. De ahí la necesidad de \ncontar con entidades como el Ministerio de Ambiente y Desarrollo Sostenible, como organismo rector \nde la gestión ambiental y de los recursos naturales, al que corresponde impulsar una relación de \nrespeto entre el hombre y la naturaleza y definir la política ambiental de protección, conservación y \npreservación, y la Autoridad Nacional de Licencias Ambientales –ANLA en su calidad de entidad \nencargada de que los proyectos sujetos a licenciamiento, permiso o trámite ambiental cumplan con \nla normativa ambiental, de tal manera que contribuyan al desarrollo sostenible ambiental del país.\nAsí las cosas, toda actividad, obra o proyecto que se enmarque dentro de las actividades \ncontempladas en el artículo 2.2.2.3.2.2. del Decreto 1076 de 2015, requiere de Licencia Ambiental, \nes decir requiere de un instrumento de control ambiental aprobado por Autoridad competente, que \ngarantice que el desarrollo del proyecto a ejecutar contenga igualmente las medidas de prevención, \nmitigación, y compensación de los impactos ambientales que genera su ejecución, al respecto la \nCorte Constitucional en Sentencia C-746 de 2012, señaló;\n“(…) Con fundamento en la jurisprudencia constitucional, se concluye que la licencia ambiental: (i) es \nuna autorización que otorga el Estado para la ejecución de obras o la realización de proyectos o \nactividades que puedan ocasionar un deterioro grave al ambiente o a los recursos naturales o \nintroducir una alteración significativa al paisaje (Ley 99/93 art. 49); (ii) tiene como propósitos prevenir, \nmitigar, manejar, corregir y compensar los efectos ambientales que produzcan tales actividades; (iii) \nes de carácter obligatoria y previa, por lo que debe ser obtenida antes de la ejecución o realización \nde dichas obras, actividades o proyectos; (iv) opera como instrumento coordinador, planificador, \npreventivo, cautelar y de gestión, mediante el cual el Estado cumple diversos mandatos \nconstitucionales, entre ellos proteger los recursos naturales y el medio ambiente, conservar áreas de \nespecial importancia ecológica, prevenir y controlar el deterioro ambiental y realizar la función \n\nResolución No.  01793           Del   22 de agosto de 2022            Hoja No. 4 de 23\n“Por la cual se resuelve recurso de reposición interpuesto contra la Resolución 775 del 19 de abril de 2022”\nOficinas: Carrera 13 A No. 34 – 72 Edificio 13 35 Pisos 8 al 11 Bogotá, D.C.\nCentro de Orientación y Radicación de Correspondencia: Carrera 13 A No. 34 – 72 Edificio 13 35 \nLocales 110 al 112 Bogotá, D.C.  \nCódigo Postal 110311156\nNit.: 900.467.239-2\nLínea de Orientación y Contacto Ciudadano: 57 (1) 2540100 / 018000112998 PBX: 57 (1) 2540111\nwww.anla.gov.co    Email: licencias@anla.gov.co  \nPágina 4 de 23\necológica de la propiedad; (v) es el resultado de un proceso administrativo reglado y complejo que \npermite la participación ciudadana, la cual puede cualificarse con la aplicación del derecho a la \nconsulta previa si en la zona de influencia de la obra, actividad o proyecto existen asentamientos \nindígenas o afrocolombianos; (vi) tiene simultáneamente un carácter técnico y otro participativo, en \ndonde se evalúan varios aspectos relacionados con los estudios de impacto ambiental y, en \nocasiones, con los diagnósticos ambientales de alternativas, en un escenario a su vez técnico \ncientífico y sensible a los intereses de las poblaciones afectadas (Ley 99/93 arts. 56 y ss); y, \nfinalmente, (vii) se concreta en la expedición de un acto administrativo de carácter especial, el cual \npuede ser modificado unilateralmente por la administración e incluso revocado sin el consentimiento \nprevio, expreso y escrito de su titular, cuando se advierta el incumplimiento de los términos que \ncondicionan la autorización (Ley 99/93 art. 62). En estos casos funciona como garantía de intereses \nconstitucionales protegidos por el principio de prevención y demás normas con carácter de orden \npúblico…” (…).\nb. Competencia de la Autoridad Nacional de Licencia Ambientales – ANLA\nEl artículo 49 de la Ley 99 de 1993, indicó que la ejecución de obras, el establecimiento de industrias \no el desarrollo de cualquier actividad, que, de acuerdo con la ley y los reglamentos, pueda producir \ndeterioro grave a los recursos naturales renovables o al medio ambiente o introducir modificaciones \nconsiderables o notorias al paisaje, requerirán de una licencia ambiental.\nEl numeral 1 del Artículo 52 de la Ley 99 de 1993, establece que el hoy Ministerio de Ambiente y \nDesarrollo Sostenible, otorgará la licencia ambiental para la ejecución de obras y actividades de \nexploración, explotación, transporte, conducción y depósito de hidrocarburos, y construcción de \nrefinerías, sin perjuicio de la potestad de la Autoridad Ambiental para adicionar o establecer \ncondiciones ambientales especificas requeridas en cada caso.\nMediante el Decreto Ley 3573 del 27 de septiembre de 2011, el presidente de la República en \nejercicio de las facultades extraordinarias conferidas en los literales d), e) y f) del artículo 18 de la \nLey 1444 de 2011, creó la Autoridad Nacional de Licencias Ambientales – ANLA, en los términos del \nartículo 67 de la Ley 489 de 1998, con autonomía administrativa y financiera, sin personería jurídica, \nla cual hará parte del Sector Administrativo de Ambiente y Desarrollo Sostenible.\nEs del caso señalar que la Autoridad Nacional de Licencias Ambientales - ANLA, acorde con lo \nestablecido en el artículo 2 del Decreto Ley 3573 del 27 de septiembre de 2011, es la entidad \nencargada de que los proyectos, obras o actividades sujetos de licenciamiento, permiso o trámite \nambiental cumplan con la normativa ambiental, de tal manera que contribuyan al desarrollo \nsostenible ambiental del País. \nDe acuerdo con la función establecida en el numeral 2 del artículo tercero del citado Decreto 3573 \ndel 27 de septiembre de 2011, a la Autoridad Nacional de Licencias Ambientales – ANLA le \ncorresponde realizar el seguimiento a las licencias, permisos y trámites ambientales por ella \notorgados.\nQue el Decreto 3578 de 2011, por el cual se establece la planta de personal de la Autoridad \nNacional de Licencias Ambientales -ANLA y se le confiere a ésta el carácter de planta global, en su \nartículo 2°, dispuso la distribución de los cargos de la planta global teniendo en cuenta la estructura, \nlos planes, los programas y las necesidades de la institución.\nQue mediante el Decreto 376 de 2020 fue modificada la estructura de la Autoridad Nacional de \nLicencias Ambientales – ANLA, con el fin de fortalecer los mecanismos de participación ciudadana \nambiental, los procesos de evaluación y seguimiento de licencias ambientales, los de gestión de \ntecnologías de la información, disciplinarios y de gestión de la Entidad, con el fin de aumentar los \nniveles de productividad de esta.\n\nResolución No.  01793           Del   22 de agosto de 2022            Hoja No. 5 de 23\n“Por la cual se resuelve recurso de reposición interpuesto contra la Resolución 775 del 19 de abril de 2022”\nOficinas: Carrera 13 A No. 34 – 72 Edificio 13 35 Pisos 8 al 11 Bogotá, D.C.\nCentro de Orientación y Radicación de Correspondencia: Carrera 13 A No. 34 – 72 Edificio 13 35 \nLocales 110 al 112 Bogotá, D.C.  \nCódigo Postal 110311156\nNit.: 900.467.239-2\nLínea de Orientación y Contacto Ciudadano: 57 (1) 2540100 / 018000112998 PBX: 57 (1) 2540111\nwww.anla.gov.co    Email: licencias@anla.gov.co  \nPágina 5 de 23\nQue producto de la reestructuración institucional, se expidió el Decreto 377 de 2020, por el cual se \nmodifica la planta de personal de la Autoridad Nacional de Licencias Ambientales – ANLA. \nMediante la Resolución 423 del 12 de marzo de 2020 “Por la cual se delegan unas funciones y se \ndictan otras disposiciones”, se delegó en el Asesor Código 1020 Grado 15 del Despacho del Director \nGeneral, la función de suscribir los actos administrativos que aprueben los planes de compensación \ny de no menos del 1%. \nMediante la Resolución 669 del 14 de abril de 2020, se nombró al servidor público EDILBERTO \nPEÑARANDA CORREA, identificado con cedula de ciudadanía No. 4.052.851, en el empleo de libre \nnombramiento y remoción de Asesor, código 1020, grado 15, adscrito a la Dirección General de la \nplanta global de la ANLA. \nMediante la Resolución 1957 del 5 de noviembre de 2021, se adoptó el Manual Específico de \nFunciones y de Competencias Laborales para los empleos de la Autoridad Nacional de Licencias \nAmbientales – ANLA, y en el que se establece la función de elaborar, revisar y suscribir los actos \nadministrativos requeridos en el proceso de seguimiento de licencias ambientales y otros \ninstrumentos.\nAunado a lo anterior, el numeral primero del artículo 74 de la Ley 1437 de 2011, establece que el \nrecurso de reposición deberá ser resuelto por quien expidió la decisión para que la aclare, modifique, \nadicione o revoque, en el presente caso, lo resolverá el Asesor Edilberto Peñaranda Correa quien se \nencuentra adscrito a la Dirección General de la Autoridad Nacional de Licencias Ambientales.\nc.\nProcedencia, oportunidad, presentación y requisitos del recurso de Reposición1\nConforme a lo previsto en el artículo sexto de la Resolución 775 del 19 de abril de 2022, contra dicho \nacto administrativo procede el recurso de reposición dentro de los 10 días siguientes a su \nnotificación, cumpliendo los requisitos establecidos en los artículos 74 y siguientes del Código de \nProcedimiento Administrativo y de lo Contencioso Administrativo (Ley 1437 de 2011).\nEn cuanto a la interposición del Recurso dentro del plazo legal, se constata que la referida \nResolución fue notificada electrónicamente el día 19 de abril de 2022 y el recurso fue presentado el \ndía 3 de mayo de 2022, esto es, dentro de los diez (10) días establecidos en la Ley.\nAdicionalmente, en cuanto a los requisitos que alude el artículo 77 de la Ley 1437 de 2011, para \npresentar el recurso de reposición, fueron debidamente cumplidos por el recurrente, por cuanto se \nexpresaron los motivos de inconformidad así como el nombre y la dirección del recurrente y fue \npresentado por la abogada BIBIANA ALEXANDRA BERNAL, en calidad de apoderada general, de la \nsociedad ECOPETROL S.A., como lo acredita el certificado de existencia y representación legal \nexpedido por la Cámara de Comercio de Bogotá, de fecha 2 de mayo de 2022 y anexo al recurso de \nreposición, resaltando que dicha sociedad es la titular del instrumento de control ambiental del \nproyecto “Área de Pozos Múltiples Cupiagua T”.\nA su vez, el artículo 79 ibídem, sobre el trámite de los recursos preceptúa que el recurso de \nreposición deberá resolverse de plano, a no ser que al interponerlo se haya solicitado la práctica de \npruebas, o que el funcionario que ha de decidir el recurso considere necesario decretarlas de oficio, \nsituaciones que no se presentan en el caso de estudio.\n1 El recurso de reposición constituye un instrumento legal mediante el cual la parte interesada tiene la oportunidad de ejercer el derecho de controvertir\nuna decisión, para que la administración previa su evaluación, la confirme, aclare, modifique o revoque, previo el lleno de las exigencias legales \nestablecidas para el efecto. Lla finalidad esencial del recurso de reposición no es otra distinta a que al funcionario de la administración que tomó una \ndecisión administrativa, se le dé la oportunidad para que enmiende o corrija un error, o los posibles errores que se hayan podido presentar en el acto \nadministrativo por él expedido en ejercicio de sus funciones.\n\nResolución No.  01793           Del   22 de agosto de 2022            Hoja No. 6 de 23\n“Por la cual se resuelve recurso de reposición interpuesto contra la Resolución 775 del 19 de abril de 2022”\nOficinas: Carrera 13 A No. 34 – 72 Edificio 13 35 Pisos 8 al 11 Bogotá, D.C.\nCentro de Orientación y Radicación de Correspondencia: Carrera 13 A No. 34 – 72 Edificio 13 35 \nLocales 110 al 112 Bogotá, D.C.  \nCódigo Postal 110311156\nNit.: 900.467.239-2\nLínea de Orientación y Contacto Ciudadano: 57 (1) 2540100 / 018000112998 PBX: 57 (1) 2540111\nwww.anla.gov.co    Email: licencias@anla.gov.co  \nPágina 6 de 23\nEn tal sentido, el funcionario de la administración a quien corresponde tomar la decisión definitiva, \ndebe hacerlo con base en la información que disponga; para este caso, es la contenida en el \nexpediente LAM1146.\nDISPOSICIONES RECURRIDAS\nLos artículos primero y segundo de la Resolución 0775 del 19 de abril de 2022 que señalan:\n“ARTÍCULO PRIMERO. Declarar a la sociedad ECOPETROL S.A. que ha ejecutado con relación a la \nlínea de inversión de “Restauración, conservación y protección de la cobertura vegetal, \nenriquecimientos vegetales y aislamiento de áreas para facilitar la sucesión natural” el proyecto \n“Conservación de 28,47ha” en conservación distribuidas en los lotes AC CP T1, AC CP T2 y AC CP \nT3, ubicado en el predio El Porvenir, propiedad de Ecopetrol S.A., en cumplimiento parcial de la \ninversión forzosa de no menos del 1% del proyecto Cupiagua T, establecida en el artículo segundo \nde la Resolución 405 del 11 de marzo de 2020, modificada por el artículo segundo de la Resolución \n1130 del 30 de junio de 2020. \nARTÍCULO SEGUNDO. Declarar a la sociedad ECOPETROL S.A. que ha ejecutado con relación a \nla línea de inversión de “Restauración, conservación y protección de la cobertura vegetal, \nenriquecimientos vegetales y aislamiento de áreas para facilitar la sucesión natural” el proyecto \n“Reforestación de 2,65ha ..” en los lotes ARCUPT 1 y ARCUPT 2, ubicado en el predio El Porvenir, \npropiedad de Ecopetrol S.A., en cumplimiento parcial de la inversión forzosa de no menos del 1% del \nproyecto Cupiagua T, establecida en el artículo segundo de la Resolución 405 del 11 de marzo de \n2020, modificada por el artículo segundo de la Resolución 1130 del 30 de junio de 2020..” (…)\nPetición:\nSeñala el recurso:\n“REPONER y en consecuencia ACLARAR el artículo primero de la Resolución No. 00775 \nde 19 de abril de 2022, en el sentido de reconocer el monto invertido en la ejecución de la \nactividad de Conservación de 28,47 hectáreas, el cual asciende a la suma de VEINTISIETE \nMILLONES CIENTO CINCUENTA Y SIETE MIL CUARENTA Y NUEVE PESOS M/CTE \n($27.157.049).\nREPONER y en consecuencia ACLARAR el artículo segundo de la Resolución No. 00775 \nde 19 de abril de 2022, en el sentido de reconocer el monto invertido en la ejecución de la \nactividad de Reforestación de 2,65 hectáreas, el cual asciende a la suma de VEINTIOCHO \nMILLONES CIENTO OCHENTA Y SIETE MIL CUATROCIENTOS OCHENTA Y UN PESOS \nCON OCHENTA Y UN CENTAVOS M/CTE ($28.187.481,81).”\nArgumentos del recurrente:\nSe precisa en este punto que el recurrente presenta un solo grupo de argumentos para las \ndisposiciones recurridas (artículos primero y segundo de la Resolución 0775 de 2022), así:\n“(…) Argumentos que sustentan el presente recurso de reposición\nCon la expedición de la Ley 1955 de 25 de mayo de 2019 “Por el cual se expide el Plan Nacional de \nDesarrollo 2018-2022 - Pacto por Colombia, Pacto por la Equidad”, Ecopetrol S.A. a través del \nradicado No. 2019182426-1-000 de 21 de noviembre de 2019 presentó a la ANLA la solicitud de \nacogimiento a los porcentajes de incremento a los que hace referencia el artículo 321 de la aludida \nnorma “Actualización del valor de la inversión de no menos del 1%, remitiendo para evaluación y \naprobación de la autoridad ambiental, la actualización del Plan de Inversión forzosa de no menos del \n1%, para el proyecto “Área de Pozos Múltiples Cupiagua T”. \nAhora bien, en la actualización del plan de inversión forzosa Ecopetrol S.A. presentó un balance \ndetallado en cuanto a la obligación de la inversión de 1%, especificando cada una de las actividades \n\nResolución No.  01793           Del   22 de agosto de 2022            Hoja No. 7 de 23\n“Por la cual se resuelve recurso de reposición interpuesto contra la Resolución 775 del 19 de abril de 2022”\nOficinas: Carrera 13 A No. 34 – 72 Edificio 13 35 Pisos 8 al 11 Bogotá, D.C.\nCentro de Orientación y Radicación de Correspondencia: Carrera 13 A No. 34 – 72 Edificio 13 35 \nLocales 110 al 112 Bogotá, D.C.  \nCódigo Postal 110311156\nNit.: 900.467.239-2\nLínea de Orientación y Contacto Ciudadano: 57 (1) 2540100 / 018000112998 PBX: 57 (1) 2540111\nwww.anla.gov.co    Email: licencias@anla.gov.co  \nPágina 7 de 23\nrealizadas, su descripción, estado, acto administrativo que declara el cumplimiento y monto invertido, \ncomo se detalla a continuación:\nTabla 1. Líneas de Inversión de 1% del proyecto Cupiagua T.\nLÍNEA DE INVERSIÓN\nDE 1%\nDescripción\nEstado\nACTO \nADMINISTRATIVO DE \nCUMPLIMIENTO\nVALOR \nEJECUTADO \nA LA FECHA \n(COP$)\nElaboración del Plan de \nOrdenación y Manejo de    \nla Cuenca Hidrográfica\nElaboración del Plan \nde \nOrdenación \ny \nManejo de la Cuenca \nHidrográfica del Rio \nÚnete.\nDeclarada\ncumplida\nAuto No. 1132 del    26 \nde marzo de 2015, \nartículo segundo\n$7.163.098,60\nRestauración,\nconservación y protección de \nla \ncobertura \nvegetal, \nenriquecimientos \nvegetales y aislamiento de \náreas \npara \nfacilitar \nla    \nsucesión natural\nConservación de 28,47 \nha\nPendiente\ndeclaración de\ncumplimiento\n$27.157.049\nRestauración, \nconservación y protección    \nde la cobertura vegetal, \nenriquecimientos \nvegetales \ny \naislamiento    \nde áreas para facilitar la    \nsucesión natural.\nReforestación de 2,65 \nha en lote 1 y 13 del \npredio Cupiagua S\nPendiente\ndeclaración de\ncumplimiento\n$28.187.481,81\nCapacitación \nambiental    \npara \nla \nformación \nde \npromotores \nde \nla    \ncomunidad\nEducación \nambiental \nbajo \nel \nconvenio \ninterinstitucional \nENV \n006 de 2005-Fase 1\nDeclarada\ncumplida\nAuto 1776 de 18 de \njunio de 2013, Artículo \nquinto\n$6.182.243,20\nAdquisición de predios y/o \nmejoras \nen \nzonas \nde    \npáramo, \nbosques \nde    \nniebla, \náreas \nde    \nnacimiento y recarga de \nacuíferos, \nestrellas    \nfluviales y rondas hídricas\nCompra \ndel \npredio \nBuena Vista con un \nárea de 42,49 ha, en el \nsector de San Miguel \nde Farallones\nDesistida\n$0\nAcciones \nde \nprotección, \nconservación                            \ny \npreservación a través de \nrestauración \necológica, \nrehabilitación                           \ny \nrecuperación,       dentro    \nde \nlas cuales se incluye el \ndesarrollo \nde \nproyectos    \nde uso sostenible\nProyectos productivos \nde uso sostenible de \nSistemas \nAgroforestales\nViabilizada–En\nplaneación\n$0\nTOTAL INVERTIDO\n$68.689.872,61\nFuente: Actualización del plan de inversión del 1% (Rad 2019182426-1-000 de 21 de noviembre de 2019)\nPosteriormente, la ANLA por medio de la Resolución No. 00405 de 11 de marzo de 2020 y aclarada \npor la Resolución No. 01130 de 30 de junio de 2020, aprobó el acogimiento al porcentaje incremental \nseñalado en el artículo 321 de la Ley 1955 de 2019, presentado por Ecopetrol S.A. para el proyecto \n“Construcción y Operación del Área de Pozos Múltiples Cupiagua T, disponiendo lo siguiente frente a \nla ejecución y estado de las líneas de inversión de 1%: \nEl artículo sexto de la Resolución No. 00405 de 11 de marzo de 2020, la Autoridad Ambiental aceptó \nel valor de la liquidación de no menos del 1% y balance financiero de la inversión forzosa de no \nmenos del 1%, en los siguientes términos:\n“(…) ARTICULO SEXTO. ACEPTAR la liquidación parcial actualizada al Artículo 321 de la Ley 1955 \ndel 25 de mayo de 2019, de la inversión forzosa de no menos del 1%, que corresponde a la suma de \nMIL CIENTO TREINTA Y NUEVE MILLONES SEISCIENTOS NOVENTA Y SIETE MIL \nCUATROCIENTOS NOVENTA Y CINCO PESOS CON OCHO CENTAVOS ($1.139.697.495,8) \nMCTE, liquidado sobre la base de liquidación actualizada que asciende a la suma de CIENTO \nTRECE MIL NOVECIENTOS SESENTA Y NUEVE MILLONES SETECIENTOS CUARENTA Y \n\nResolución No.  01793           Del   22 de agosto de 2022            Hoja No. 8 de 23\n“Por la cual se resuelve recurso de reposición interpuesto contra la Resolución 775 del 19 de abril de 2022”\nOficinas: Carrera 13 A No. 34 – 72 Edificio 13 35 Pisos 8 al 11 Bogotá, D.C.\nCentro de Orientación y Radicación de Correspondencia: Carrera 13 A No. 34 – 72 Edificio 13 35 \nLocales 110 al 112 Bogotá, D.C.  \nCódigo Postal 110311156\nNit.: 900.467.239-2\nLínea de Orientación y Contacto Ciudadano: 57 (1) 2540100 / 018000112998 PBX: 57 (1) 2540111\nwww.anla.gov.co    Email: licencias@anla.gov.co  \nPágina 8 de 23\nNUEVE MIL QUINIENTOS OCHENTA ($113.969.749.580) PESOS MCTE, para el periodo \ncomprendido entre 1997 y 2000.\nPARÁGRAFO PRIMERO. El valor actualizado de la Inversión forzosa de no menos del 1% \ncorresponde a la suma de TRESCIENTOS TREINTA Y DOS MILLONES TRESCIENTOS OCHENTA \nY UN MIL SEISCIENTOS SETENTA Y SEIS PESOS CON DIECISÉIS CENTAVOS \n($332.381.676,16) MCTE.\nPARÁGRAFO SEGUNDO. El valor de los proyectos del Plan de Inversión de no menos del 1% \nejecutados, corresponde a la suma de TRECE MILLONES TRESCIENTOS CUARENTA Y CINCO \nMIL TRESCIENTOS CUARENTA Y UN PESOS CON OCHO CENTAVOS ($13.345.341,08) MCTE.\nPARÁGRAFO TERCERO. El valor de los proyectos del Plan de Inversión de no menos del 1% que \nse encuentran en ejecución, corresponde a la suma de CINCUENTA Y CINCO MILLONES \nTRESCIENTOS CUARENTA Y CUATRO MIL QUINIENTOS TREINTA PESOS CON OCHENTA Y \nUN CENTAVOS ($55.344.530,81) MCTE.\nPARÁGRAFO CUARTO. El valor de los proyectos del Plan de Inversión de no menos del 1% que se \nencuentran por ejecutar, corresponde a la suma de MIL SETENTA Y UN MILLONES SIETE MIL \nSEISCIENTOS VEINTITRÉS PESOS CON DIECINUEVE CENTAVOS ($1.071.007.623,19) MCTE.\n(…)”\nDel mismo modo, en el artículo segundo de la Resolución No. 01130 de 2020, la autoridad ambiental \ndefinió las líneas de destinación, proyectos y/o programas del plan de inversión de no menos del 1% \nvigentes, como se transcribe a continuación:\n“(…) ARTICULO SEGUNDO. Modificar el artículo segundo de la Resolución 405 de 11 de marzo de \n2020, en el sentido de adicionar la numeración en el párrafo y tabla de las líneas vigentes, así como \nel numeral 2, que aprueba la nueva línea de inversión; de acuerdo con lo expuesto en la parte motiva \ndel presente acto administrativo, el cual quedara en los siguientes términos:”\n“ARTÍCULO SEGUNDO. 1. Tener como líneas de destinación, los proyectos y/o programas del plan \nde inversión forzosa de no menos del 1% vigentes para el proyecto “Construcción y Operación del \nÁrea de Pozos Múltiples Cupiagua T.”, las siguientes:\n\nResolución No.  01793           Del   22 de agosto de 2022            Hoja No. 9 de 23\n“Por la cual se resuelve recurso de reposición interpuesto contra la Resolución 775 del 19 de abril de 2022”\nOficinas: Carrera 13 A No. 34 – 72 Edificio 13 35 Pisos 8 al 11 Bogotá, D.C.\nCentro de Orientación y Radicación de Correspondencia: Carrera 13 A No. 34 – 72 Edificio 13 35 \nLocales 110 al 112 Bogotá, D.C.  \nCódigo Postal 110311156\nNit.: 900.467.239-2\nLínea de Orientación y Contacto Ciudadano: 57 (1) 2540100 / 018000112998 PBX: 57 (1) 2540111\nwww.anla.gov.co    Email: licencias@anla.gov.co  \nPágina 9 de 23\n2. Aceptar la línea de destinación de los recursos de inversión denominada “Acciones de vigilancia \ndel recurso hídrico a través de la instrumentación y monitoreo de variables climatológicas e \nhidrológicas con estaciones hidrometeorológicas y/o con radares, según la tecnología que defina el \nIDEAM”,a desarrollarse mediante el proyecto “Ampliación de la red hidrometereológica en la cuenca \ndel río Cusiana”, para el proyecto “Construcción y Operación del Área de Pozos Múltiples Cupiagua \nT.”, cuya ejecución deberá iniciar dentro de los seis (6) meses siguientes a la ejecutoria del presente \nacto, conforme a lo establecido en el artículo 321 de la Ley 1955 del 25 de mayo del 2019, Plan \nNacional de Desarrollo 2018- 2022 “Pacto por Colombia, Pacto por la Equidad”.\n(…)\nAhora bien, como se pudo evidenciar en el parágrafo cuarto del artículo sexto de la Resolución No. \n00405 de 2020, el “valor en ejecución” que asciende a la suma de CINCUENTA Y CINCO \nMILLONES TRESCIENTOS CUARENTA Y CUATRO MIL QUINIENTOS TREINTA PESOS CON \nOCHENTA Y UN CENTAVOS ($55.344.530,81), corresponde a la sumatoria de los montos \nejecutados en las actividades de Conservación de 28,47 hectáreas y Reforestación de 2,65 \nhectáreas en el lote 1 y 3 predio Cupiagua S, ya que como se ilustro anteriormente1  su estado era \n“En desarrollo”, toda vez que no contaban con la aprobación técnica y financiera por parte de ANLA.\nPor lo anterior, Ecopetrol S.A. mediante radicado No. 2021267786-1-000 de 9 de diciembre de 2021, \npresentó a la ANLA los argumentos técnicos que soportan la solicitud con el ánimo de obtener por \nparte de la autoridad ambiental, la declaratoria de cumplimiento total y definitivo de las siguientes \nactividades como parte de la obligación de inversión forzosa de no menos del 1% del proyecto \nConstrucción y Operación del Área de Pozos Múltiples Cupiagua T: \n• Conservación de 28,47 has de bosque protector, por un monto de VEINTISIETE MILLONES \nCIENTO CINCUENTA Y SIETE MIL CUARENTA Y NUEVE PESOS M/CTE ($27.157.049). \n• Reforestación de 2,65 Hectáreas en los lotes No. 1 y 13 del predio Cupiagua S, por un monto \nde VEINTIOCHO MILLONES CIENTO OCHENTA Y SIETE MIL CUATROCIENTOS OCHENTA Y UN \nPESOS CON OCHENTA Y UN CENTAVOS M/CTE ($28.187.481,81).\nPor otra parte, la ANLA en ejercicio de sus funciones, el 2 de diciembre de 2021 realizó visita de \nseguimiento guiada al proyecto “Área de Pozos Múltiples Cupiagua T”, efectuando a su vez la \nrevisión documental del expediente del proyecto en mención evaluando la solicitud presentada por la \nempresa2 referente a la solicitud de declaratoria de cumplimiento total de las actividades de inversión \nforzosa de no menos del 1%, emitiendo como consecuencia de esta labor el Concepto técnico No. \n08408 de 24 de diciembre de 2021, acogido por la Resolución No. 00775 de 19 de abril de 2022, la \ncual dispuso en los artículos primero y segundo, reconocer como ejecutadas las actividades de \nconservación de 28,47 hectáreas y Reforestación de 2,65 Ha” de la línea “Restauración, \nconservación y protección de la cobertura vegetal, enriquecimiento vegetales y aislamiento de las \náreas para facilitar la sucesión natural”, en cumplimiento parcial de la inversión forzosa de no menos \ndel 1% del proyecto ”Área de Pozos Múltiples Cupiagua T.\nSin embargo, la misma omitió reconocer y aprobar los montos invertidos en estas dos (2) \nactividades, lo cual es necesario y de gran importancia para la empresa, teniendo en cuenta que el \ncumplimiento de la obligación de inversión de 1%, se mide específicamente en recursos ejecutados, \nes decir corresponde a una obligación de fines y no de medios.\nPor lo anterior, Ecopetrol S.A. precisa que la obligación de no menos del 1% reglamentada en el \nDecreto 2099 de 2016, se fundamenta en la ejecución del 1% del valor base de liquidación de 1% \naprobado para el proyecto Construcción y operación del proyecto “Área de Pozos Múltiples Cupiagua \nT”, es decir dicha obligación se tasa de manera monetaria, por cuanto el cumplimiento de la misma \nse debe fundamentar en la declaración de cumplimiento tanto de la actividad como de los recursos \ninvertidos en la ejecución de misma (…)”  \nCONSIDERACIONES DE LA AUTORIDAD NACIONAL \n\nResolución No.  01793           Del   22 de agosto de 2022            Hoja No. 10 de 23\n“Por la cual se resuelve recurso de reposición interpuesto contra la Resolución 775 del 19 de abril de 2022”\nOficinas: Carrera 13 A No. 34 – 72 Edificio 13 35 Pisos 8 al 11 Bogotá, D.C.\nCentro de Orientación y Radicación de Correspondencia: Carrera 13 A No. 34 – 72 Edificio 13 35 \nLocales 110 al 112 Bogotá, D.C.  \nCódigo Postal 110311156\nNit.: 900.467.239-2\nLínea de Orientación y Contacto Ciudadano: 57 (1) 2540100 / 018000112998 PBX: 57 (1) 2540111\nwww.anla.gov.co    Email: licencias@anla.gov.co  \nPágina 10 de 23\nConsideraciones Técnicas\nTeniendo en cuenta los argumentos presentados por la recurrente, esta Autoridad procede al estudio \nde los aspectos allí formulados a partir de la evaluación efectuada a través del concepto técnico \n04124 del 19 de julio de 2022 que determinó:\nFrente al artículo primero de la Resolución No. 00775 de 19 de abril de 2022\n“(…) Se debe tener en cuenta que la información entregada por Ecopetrol S.A, mediante los  radicados \n2020046903-1-000 del 27 de marzo de 2020 y radicado No. 2021267786-1-000 del 9 de diciembre de 2021, \ndonde presentó argumentos técnicos del cumplimiento de los proyectos /programas “Conservación de \n28,47ha” distribuidas en los lotes AC CP T1, AC CP T2 y AC CP T3, ubicado en el predio El Porvenir, \npropiedad de Ecopetrol S.A.,” fue evaluada por esta Autoridad en el Concepto Técnico No. 08408 del 24 de \ndiciembre de 2021, (acogido mediante Resolución No. 0775 del 19 de abril de 2022) y donde se estableció lo \nsiguiente: \n“(…) se detalla que la Sociedad presenta los soportes de titularidad requeridos (…) Al analizar la información \npresentada por la Sociedad y los términos de la obligación de la inversión el 1% establecida en la licencia \nambiental del proyecto, se consideró que hay cumplimiento de este requerimiento y así mismo, se encuentra \npertinente aprobar la actividad de conservación de áreas en 28,47ha, desarrollada desde el año 1996 por el \nanterior titular de la licencia ambiental, según se indica en el numeral 9.2.3 de este concepto técnico. (…) \n(subrayado fuera de texto original)\nEs preciso indicar que, en el numeral 6.2 del Artículo cuarto del Auto 3553 del 31 de diciembre de 2009 el \nentonces Ministerio de Ambiente, Vivienda y Desarrollo Territorial – MAVDT (hoy Ministerio de Ambiente y \nDesarrollo Sostenible MADS) aceptó la actividad de conservación de áreas en el marco de la inversión \nforzosa de no menos del 1%, e impuso obligaciones a las cuales, la Sociedad dio cumplimiento como se \nrelaciona a continuación: \nAuto 3553 del 31 de diciembre de 2009\nObligación\nObservación\n7. En un término no mayor a un (1) mes, a partir \nde \nla \nnotificación \ndel \npresente \nacto \nadministrativo, presentar para su evaluación, la \nsiguiente información relacionada con las \nactividades aceptadas como parte del Plan de \nInversión del 1%:\n7.1 En relación a las áreas de conservación en \npredios de propiedad de la empresa, en la \ncuenca del Río Únete:\na.\nNombre \ndel \npredio, \npropietario, \nlocalización político administrativa del predio a \nnivel de vereda y municipio y área destinada a \nconservación\nEn la parte considerativa del Auto 1058 del 31 \nde marzo de 2017 se estableció el \ncumplimiento del presente literal.\nb.\nIdentificación y caracterización de los \ndiferentes tipos de cobertura vegetal que \nsustentan hectáreas conservadas, junto con la \nidentificación de las especies existentes y su \nestado de desarrollo. Plano ajustado de áreas \ndestinadas para conservación con cargo a la \ninversión del 1%, con la correspondiente \ngeoreferenciación de cada lote.\nEn la parte considerativa del Auto 1132 del 26 \nde marzo de 2015 se estableció el \ncumplimiento del presente literal.\nc.\nActividades realizadas y por realizar (si \naplica), \ncronograma \nde \nactividades \nespecificando \nhasta \ncuando \nse \nrealizan \ninversiones en el área de conservación\nEn la parte considerativa del Auto 1776 del 18 \nde \njunio \nde \n2013 \nse \nestableció \nel \ncumplimiento del presente literal.\nd.\nCaracterización del tipo de cobertura \nexistente en el área conservada junto con la las \nespecies existentes y su estado de desarrollo\nEn la parte considerativa Auto 1132 del 26 de \nmarzo de 2015 se estableció el cumplimiento \ndel presente literal.\n\nResolución No.  01793           Del   22 de agosto de 2022            Hoja No. 11 de 23\n“Por la cual se resuelve recurso de reposición interpuesto contra la Resolución 775 del 19 de abril de 2022”\nOficinas: Carrera 13 A No. 34 – 72 Edificio 13 35 Pisos 8 al 11 Bogotá, D.C.\nCentro de Orientación y Radicación de Correspondencia: Carrera 13 A No. 34 – 72 Edificio 13 35 \nLocales 110 al 112 Bogotá, D.C.  \nCódigo Postal 110311156\nNit.: 900.467.239-2\nLínea de Orientación y Contacto Ciudadano: 57 (1) 2540100 / 018000112998 PBX: 57 (1) 2540111\nwww.anla.gov.co    Email: licencias@anla.gov.co  \nPágina 11 de 23\ne.\nCostos detallados de la actividad y/o \nconservación de áreas y su cálculo\nEn la parte considerativa del Auto 1776 del 18 \nde \njunio \nde \n2013 \nse \nestableció \nel \ncumplimiento del presente literal.\nf.\nPresentar un balance ó comparación \nentre la condición ambiental inicial y posterior a \nla inversión del área, junto con la descripción de \nlos resultados obtenidos con las acciones de \nconservación, \nrestauración \nó \nprotección \naplicadas\nEn la parte considerativa del Auto 8275 del 30 \nseptiembre de 2019 se estableció el \ncumplimiento del presente literal.\nA causa de lo anterior y de no persistir obligaciones vigentes relacionadas con la conservación de áreas \npendiente de cumplimiento por parte de la Sociedad, en la Resolución No. 0775 del 19 de abril de 2022, se \nestableció en el artículo primero lo siguiente: \n(…) \nARTÍCULO PRIMERO. Declarar a la sociedad ECOPETROL S.A. que ha ejecutado con relación a la línea de \ninversión de “Restauración, conservación y protección de la cobertura vegetal, enriquecimientos vegetales y \naislamiento de áreas para facilitar la sucesión natural” el proyecto “Conservación de 28,47ha” en conservación \ndistribuidas en los lotes AC CP T1, AC CP T2 y AC CP T3, ubicado en el predio El Porvenir, propiedad de \nEcopetrol S.A., en cumplimiento parcial de la inversión forzosa de no menos del 1% del proyecto Cupiagua T, \nestablecida en el artículo segundo  de la Resolución 405 del 11 de marzo de 2020, modificada por el artículo \nsegundo de la Resolución 1130 del 30 de junio de 2020.\n(…)\nAhora bien, con respecto a la conservación de las 28,47 hectáreas distribuidas en los lotes AC CP T1, AC CP \nT2 y AC CP T3, ubicado en el predio El Porvenir, la Sociedad Ecopetrol S.A, mediante radicado 2020046903-\n1-000 del 27 de marzo de 2020, adjunta los siguientes soportes:\nOficio de Corporinoquia de fecha 13 de octubre de 2010, con asunto conservación de áreas de bosque natural \n-inversión del 1% y donde menciona que:\n“(…) A continuación, se relaciona las áreas en las que la empresa ha efectuado actividades de conservación de \nbosque natural para cada uno de los proyectos:\nCUENCA\nPROYECTOS \nAREA DE BOSQUE \nCONSERVADO (Ha)\nRio Unete\nCupiagua T\n30,90\nLa conservación ha determinado que el valor promedio a validar las actividades de Ambiente, vivienda y \nDesarrollo Territorial, por medio del cual se reglamenta el Certificado de Incentivo Forestal para la \nConservación.\nPara el cálculo del valor promedio por hectáreas de conservación, se aplicó lo definido en el Artículo 7 del \ndecreto 900 de 1997, que estipula que el valor base (VB) del certificado forestal de conservación será de 7 \nsalarios mínimos mensuales vigentes por hectárea de bosque natural primario (bosque secundario el 50%) y \naplicando el factor del piso térmico (FPT) de 0,63 y un factor de tamaño de predio  (FTP) de 1.4 tomado como \nbase de valor del salario vigente para el año 2002, se define la siguiente fórmula VA=(VB*50%)*FAR, en la cual \nFAR igual a FPT-FTP.\nDe acuerdo con lo anterior, se consideró viable por parte de la Corporación reconocer un valor de COL \n$953.883 por hectárea de bosque conservado por parte de la empresa BP EXPLOTATION COMPANY \nCOLOMBIA LTD. (…)”\nEn razón a lo anterior, se considera que la “Conservación de 28,47ha” distribuidas en los lotes AC CP T1, AC \nCP T2 y AC CP T3, ubicado en el predio El Porvenir, propiedad de Ecopetrol S.A” se realizó bajo el Convenio \nNo. ENV-005 del 2 de noviembre de 2005, celebrado entre la CORPORACIÓN AUTÓNOMA REGIONAL DE \nLA ORINOQUIA – CORPORINOQUIA, FUNDACIÓN AMANECER Y BP EXPLOTATION COMPANY – \n\nResolución No.  01793           Del   22 de agosto de 2022            Hoja No. 12 de 23\n“Por la cual se resuelve recurso de reposición interpuesto contra la Resolución 775 del 19 de abril de 2022”\nOficinas: Carrera 13 A No. 34 – 72 Edificio 13 35 Pisos 8 al 11 Bogotá, D.C.\nCentro de Orientación y Radicación de Correspondencia: Carrera 13 A No. 34 – 72 Edificio 13 35 \nLocales 110 al 112 Bogotá, D.C.  \nCódigo Postal 110311156\nNit.: 900.467.239-2\nLínea de Orientación y Contacto Ciudadano: 57 (1) 2540100 / 018000112998 PBX: 57 (1) 2540111\nwww.anla.gov.co    Email: licencias@anla.gov.co  \nPágina 12 de 23\nCOLOMBIA LTDA, HOY EQUIÓN ENERGÍA LIMITED.  Por valor de VEINTISIETE MILLONES CIENTO \nCINCUENTA Y SIETE MIL CUARENTA Y NUEVE PESOS MCTE ($27.157.049).\nPor lo anterior, desde el punto de vista técnico se conceptúa que es viable  modificar el artículo primero de la \nResolución No. 00775 de 19 de abril de 2022\n(...)\nFrente al artículo segundo de la Resolución No. 00775 de 19 de abril de 2022\nOBLIGACIÓN RECURRIDA – Artículo Primero (sic) de la Resolución 0775 del 19 de abril de 2022.\n(…) ARTÍCULO SEGUNDO. Declarar a la sociedad ECOPETROL S.A. que ha ejecutado con \nrelación a la línea de inversión de “Restauración, conservación y protección de la cobertura vegetal, \nenriquecimientos vegetales y aislamiento de áreas para facilitar la sucesión natural” el proyecto \n“Reforestación de 2,65ha ..” en los lotes ARCUPT 1 y ARCUPT 2, ubicado en el predio El Porvenir, \npropiedad de Ecopetrol S.A., en cumplimiento parcial de la inversión forzosa de no menos del 1% del \nproyecto Cupiagua T, establecida en el artículo segundo de la Resolución 405 del 11 de marzo de \n2020, modificada por el artículo segundo de la Resolución 1130 del 30 de junio de 2020 (…)”\nPetición de la Sociedad.\n“(…) 2. REPONER y en consecuencia ACLARAR el artículo segundo de la Resolución No. 00775 de \n19 de abril de 2022, en el sentido de reconocer el monto invertido en la ejecución de la actividad de \nReforestación de 2,65 hectáreas, el cual asciende a la suma de VEINTIOCHO MILLONES CIENTO \nOCHENTA Y SIETE MIL CUATROCIENTOS OCHENTA Y UN PESOS CON OCHENTA Y UN \nCENTAVOS M/CTE ($28.187.481,81). (…)”\nArgumentos de la Sociedad.\nSi bien se reponen dos artículos de la Resolución 0775 del 19 de abril de 2022 la sociedad presenta un solo \ngrupo de argumentos que se exponen a continuación: \n“(…) Con la expedición de la Ley 1955 de 25 de mayo de 2019 “Por el cual se expide el Plan Nacional de \nDesarrollo 2018-2022 - Pacto por Colombia, Pacto por la Equidad”, Ecopetrol S.A. a través del radicado No. \n2019182426-1-000 de 21 de noviembre de 2019 presentó a la ANLA la solicitud de acogimiento a los \nporcentajes de incremento a los que hace referencia el artículo 321 de la aludida norma “Actualización del valor \nde la inversión de no menos del 1%, remitiendo para evaluación y aprobación de la autoridad ambiental, la \nactualización del Plan de Inversión forzosa de no menos del 1%, para el proyecto “Área de Pozos Múltiples \nCupiagua T”. Ahora bien, en la actualización del plan de inversión forzosa Ecopetrol S.A. presentó un balance \ndetallado en cuanto a la obligación de la inversión de 1%, especificando cada una de las actividades \nrealizadas, su descripción, estado, acto administrativo que declara el cumplimiento y monto invertido, como se \ndetalla a continuación:\nLÍNEA DE INVERSIÓN\nDE 1%\nDescripción\nEstado\nACTO \nADMINISTRATIVO DE \nCUMPLIMIENTO\nVALOR \nEJECUTADO \nA LA FECHA \n(COP$)\nElaboración del Plan de \nOrdenación y Manejo de    \nla Cuenca Hidrográfica\nElaboración del Plan \nde \nOrdenación \ny \nManejo de la Cuenca \nHidrográfica del Rio \nÚnete.\nDeclarada\ncumplida\nAuto No. 1132 del    26 \nde marzo de 2015, \nartículo segundo\n$7.163.098,60\nRestauración,\nconservación y protección de \nla \ncobertura \nvegetal, \nenriquecimientos \nvegetales y aislamiento de \náreas \npara \nfacilitar \nla    \nsucesión natural\nConservación de 28,47 \nha\nPendiente\ndeclaración de\ncumplimiento\n$27.157.049\nRestauración, \nconservación y protección    \nde la cobertura vegetal, \nenriquecimientos \nvegetales \ny \naislamiento    \nde áreas para facilitar la    \nReforestación de 2,65 \nha en lote 1 y 13 del \npredio Cupiagua S\nPendiente\ndeclaración de\ncumplimiento\n$28.187.481,81\n\nResolución No.  01793           Del   22 de agosto de 2022            Hoja No. 13 de 23\n“Por la cual se resuelve recurso de reposición interpuesto contra la Resolución 775 del 19 de abril de 2022”\nOficinas: Carrera 13 A No. 34 – 72 Edificio 13 35 Pisos 8 al 11 Bogotá, D.C.\nCentro de Orientación y Radicación de Correspondencia: Carrera 13 A No. 34 – 72 Edificio 13 35 \nLocales 110 al 112 Bogotá, D.C.  \nCódigo Postal 110311156\nNit.: 900.467.239-2\nLínea de Orientación y Contacto Ciudadano: 57 (1) 2540100 / 018000112998 PBX: 57 (1) 2540111\nwww.anla.gov.co    Email: licencias@anla.gov.co  \nPágina 13 de 23\nLÍNEA DE INVERSIÓN\nDE 1%\nDescripción\nEstado\nACTO \nADMINISTRATIVO DE \nCUMPLIMIENTO\nVALOR \nEJECUTADO \nA LA FECHA \n(COP$)\nsucesión natural.\nCapacitación \nambiental    \npara \nla \nformación \nde \npromotores \nde \nla    \ncomunidad\nEducación \nambiental \nbajo \nel \nconvenio \ninterinstitucional \nENV \n006 de 2005-Fase 1\nDeclarada\ncumplida\nAuto 1776 de 18 de \njunio de 2013, Artículo \nquinto\n$6.182.243,20\nAdquisición de predios y/o \nmejoras \nen \nzonas \nde    \npáramo, \nbosques \nde    \nniebla, \náreas \nde    \nnacimiento y recarga de \nacuíferos, \nestrellas    \nfluviales y rondas hídricas\nCompra \ndel \npredio \nBuena Vista con un \nárea de 42,49 ha, en el \nsector de San Miguel \nde Farallones\nDesistida\n$0\nAcciones \nde \nprotección, \nconservación                            \ny \npreservación a través de \nrestauración \necológica, \nrehabilitación                           \ny \nrecuperación,       dentro    \nde \nlas cuales se incluye el \ndesarrollo \nde \nproyectos    \nde uso sostenible\nProyectos productivos \nde uso sostenible de \nSistemas \nAgroforestales\nViabilizada–En\nplaneación\n$0\nTOTAL INVERTIDO\n$68.689.872,61\n            Fuente: Actualización del plan de inversión del 1% (Rad 2019182426-1-000 de 21 de noviembre de 2019)\nPosteriormente, la ANLA por medio de la Resolución No. 00405 de 11 de marzo de 2020 y aclarada por la \nResolución No. 01130 de 30 de junio de 2020, aprobó el acogimiento al porcentaje incremental señalado en el \nartículo 321 de la Ley 1955 de 2019, presentado por Ecopetrol S.A. para el proyecto “Construcción y Operación \ndel Área de Pozos Múltiples Cupiagua T, disponiendo lo siguiente frente a la ejecución y estado de las líneas \nde inversión de 1%: \nEl artículo sexto de la Resolución No. 00405 de 11 de marzo de 2020, la Autoridad Ambiental aceptó el valor \nde la liquidación de no menos del 1% y balance financiero de la inversión forzosa de no menos del 1%, en los \nsiguientes términos:\n“(…) ARTICULO SEXTO. ACEPTAR la liquidación parcial actualizada al Artículo 321 de la Ley 1955 \ndel 25 de mayo de 2019, de la inversión forzosa de no menos del 1%, que corresponde a la suma de \nMIL CIENTO TREINTA Y NUEVE MILLONES SEISCIENTOS NOVENTA Y SIETE MIL \nCUATROCIENTOS NOVENTA Y CINCO PESOS CON OCHO CENTAVOS ($1.139.697.495,8) \nMCTE, liquidado sobre la base de liquidación actualizada que asciende a la suma de CIENTO \nTRECE MIL NOVECIENTOS SESENTA Y NUEVE MILLONES SETECIENTOS CUARENTA Y \nNUEVE MIL QUINIENTOS OCHENTA ($113.969.749.580) PESOS MCTE, para el periodo \ncomprendido entre 1997 y 2000.\nPARÁGRAFO PRIMERO. El valor actualizado de la Inversión forzosa de no menos del 1% \ncorresponde a la suma de TRESCIENTOS TREINTA Y DOS MILLONES TRESCIENTOS OCHENTA \nY UN MIL SEISCIENTOS SETENTA Y SEIS PESOS CON DIECISÉIS CENTAVOS \n($332.381.676,16) MCTE.\nPARÁGRAFO SEGUNDO. El valor de los proyectos del Plan de Inversión de no menos del 1% \nejecutados, corresponde a la suma de TRECE MILLONES TRESCIENTOS CUARENTA Y CINCO \nMIL TRESCIENTOS CUARENTA Y UN PESOS CON OCHO CENTAVOS ($13.345.341,08) MCTE.\nPARÁGRAFO TERCERO. El valor de los proyectos del Plan de Inversión de no menos del 1% que \nse encuentran en ejecución, corresponde a la suma de CINCUENTA Y CINCO MILLONES \nTRESCIENTOS CUARENTA Y CUATRO MIL QUINIENTOS TREINTA PESOS CON OCHENTA Y \nUN CENTAVOS ($55.344.530,81) MCTE.\nPARÁGRAFO CUARTO. El valor de los proyectos del Plan de Inversión de no menos del 1% que se \nencuentran por ejecutar, corresponde a la suma de MIL SETENTA Y UN MILLONES SIETE MIL \nSEISCIENTOS VEINTITRÉS PESOS CON DIECINUEVE CENTAVOS ($1.071.007.623,19) MCTE.\n\nResolución No.  01793           Del   22 de agosto de 2022            Hoja No. 14 de 23\n“Por la cual se resuelve recurso de reposición interpuesto contra la Resolución 775 del 19 de abril de 2022”\nOficinas: Carrera 13 A No. 34 – 72 Edificio 13 35 Pisos 8 al 11 Bogotá, D.C.\nCentro de Orientación y Radicación de Correspondencia: Carrera 13 A No. 34 – 72 Edificio 13 35 \nLocales 110 al 112 Bogotá, D.C.  \nCódigo Postal 110311156\nNit.: 900.467.239-2\nLínea de Orientación y Contacto Ciudadano: 57 (1) 2540100 / 018000112998 PBX: 57 (1) 2540111\nwww.anla.gov.co    Email: licencias@anla.gov.co  \nPágina 14 de 23\nDel mismo modo, en el artículo segundo de la Resolución No. 01130 de 2020, la autoridad ambiental \ndefinió las líneas de destinación, proyectos y/o programas del plan de inversión de no menos del 1% \nvigentes, como se transcribe a continuación:\n“(…) ARTICULO SEGUNDO. Modificar el artículo segundo de la Resolución 405 de 11 de marzo de \n2020, en el sentido de adicionar la numeración en el párrafo y tabla de las líneas vigentes, así como \nel numeral 2, que aprueba la nueva línea de inversión; de acuerdo con lo expuesto en la parte motiva \ndel presente acto administrativo, el cual quedara en los siguientes términos:”\n“ARTÍCULO SEGUNDO. 1. Tener como líneas de destinación, los proyectos y/o programas del plan \nde inversión forzosa de no menos del 1% vigentes para el proyecto “Construcción y Operación del \nÁrea de Pozos Múltiples Cupiagua T.”, las siguientes:\n2. Aceptar la línea de destinación de los recursos de inversión denominada “Acciones de vigilancia \ndel recurso hídrico a través de la instrumentación y monitoreo de variables climatológicas e \nhidrológicas con estaciones hidrometeorológicas y/o con radares, según la tecnología que defina el \nIDEAM”,a desarrollarse mediante el proyecto “Ampliación de la red hidrometereológica en la cuenca \ndel río Cusiana”, para el proyecto “Construcción y Operación del Área de Pozos Múltiples Cupiagua \nT.”, cuya ejecución deberá iniciar dentro de los seis (6) meses siguientes a la ejecutoria del presente \nacto, conforme a lo establecido en el artículo 321 de la Ley 1955 del 25 de mayo del 2019, Plan \nNacional de Desarrollo 2018- 2022 “Pacto por Colombia, Pacto por la Equidad”.(…)”\nAhora bien, como se pudo evidenciar en el parágrafo cuarto del artículo sexto de la Resolución No. \n00405 de 2020, el “valor en ejecución” que asciende a la suma de CINCUENTA Y CINCO \nMILLONES TRESCIENTOS CUARENTA Y CUATRO MIL QUINIENTOS TREINTA PESOS CON \nOCHENTA Y UN CENTAVOS ($55.344.530,81), corresponde a la sumatoria de los montos \nejecutados en las actividades de Conservación de 28,47 hectáreas y Reforestación de 2,65 hectáreas \nen el lote 1 y 3 predio Cupiagua S, ya que como se ilustro anteriormente1  su estado era “En \ndesarrollo”, toda vez que no contaban con la aprobación técnica y financiera por parte de ANLA.\nPor lo anterior, Ecopetrol S.A. mediante radicado No. 2021267786-1-000 de 9 de diciembre de 2021, \npresentó a la ANLA los argumentos técnicos que soportan la solicitud con el ánimo de obtener por \nparte de la autoridad ambiental, la declaratoria de cumplimiento total y definitivo de las siguientes \nactividades como parte de la obligación de inversión forzosa de no menos del 1% del proyecto \nConstrucción y Operación del Área de Pozos Múltiples Cupiagua T: \n• Conservación de 28,47 has de bosque protector, por un monto de VEINTISIETE MILLONES \nCIENTO CINCUENTA Y SIETE MIL CUARENTA Y NUEVE PESOS M/CTE ($27.157.049). \n\nResolución No.  01793           Del   22 de agosto de 2022            Hoja No. 15 de 23\n“Por la cual se resuelve recurso de reposición interpuesto contra la Resolución 775 del 19 de abril de 2022”\nOficinas: Carrera 13 A No. 34 – 72 Edificio 13 35 Pisos 8 al 11 Bogotá, D.C.\nCentro de Orientación y Radicación de Correspondencia: Carrera 13 A No. 34 – 72 Edificio 13 35 \nLocales 110 al 112 Bogotá, D.C.  \nCódigo Postal 110311156\nNit.: 900.467.239-2\nLínea de Orientación y Contacto Ciudadano: 57 (1) 2540100 / 018000112998 PBX: 57 (1) 2540111\nwww.anla.gov.co    Email: licencias@anla.gov.co  \nPágina 15 de 23\n• Reforestación de 2,65 Hectáreas en los lotes No. 1 y 13 del predio Cupiagua S, por un \nmonto de VEINTIOCHO MILLONES CIENTO OCHENTA Y SIETE MIL CUATROCIENTOS \nOCHENTA Y UN PESOS CON OCHENTA Y UN CENTAVOS M/CTE ($28.187.481,81).\nPor otra parte, la ANLA en ejercicio de sus funciones, el 2 de diciembre de 2021 realizó visita de \nseguimiento guiada al proyecto “Área de Pozos Múltiples Cupiagua T”, efectuando a su vez la \nrevisión documental del expediente del proyecto en mención evaluando la solicitud presentada \npor la empresa2 referente a la solicitud de declaratoria de cumplimiento total de las actividades de \ninversión forzosa de no menos del 1%, emitiendo como consecuencia de esta labor el Concepto \ntécnico No. 08408 de 24 de diciembre de 2021, acogido por la Resolución No. 00775 de 19 de \nabril de 2022, la cual dispuso en los artículos primero y segundo, reconocer como ejecutadas \nlas actividades de conservación de 28,47 hectáreas y Reforestación de 2,65 Ha” de la línea \n“Restauración, conservación y protección de la cobertura vegetal, enriquecimiento vegetales y \naislamiento de las áreas para facilitar la sucesión natural”, en cumplimiento parcial de la inversión \nforzosa de no menos del 1% del proyecto ”Área de Pozos Múltiples Cupiagua T.\nSin embargo, la misma omitió reconocer y aprobar los montos invertidos en estas dos (2) \nactividades, lo cual es necesario y de gran importancia para la empresa, teniendo en cuenta que \nel cumplimiento de la obligación de inversión de 1%, se mide específicamente en recursos \nejecutados, es decir corresponde a una obligación de fines y no de medios.\nPor lo anterior, Ecopetrol S.A. precisa que la obligación de no menos del 1% reglamentada en el \nDecreto 2099 de 2016, se fundamenta en la ejecución del 1% del valor base de liquidación de 1% \naprobado para el proyecto Construcción y operación del proyecto “Área de Pozos Múltiples \nCupiagua T”, es decir dicha obligación se tasa de manera monetaria, por cuanto el cumplimiento \nde la misma se debe fundamentar en la declaración de cumplimiento tanto de la actividad como \nde los recursos invertidos en la ejecución de misma.  \nConsideraciones de la ANLA\nAl respecto, es pertinente precisar que un proyecto/programa es considerado por esta Autoridad \nAmbiental como Ejecutado, cuando hay un acto administrativo que así lo exprese, de lo contrario, se \nconsidera en ejecución.\nPor lo tanto, los proyectos/programas “Reforestación de 2,65ha” en los lotes ARCUPT 1 y ARCUPT 2, \nubicado en el predio El Porvenir, propiedad de Ecopetrol S.A”, considerado por ECOPETROL S.A. \ncomo ejecutado; para esta Autoridad se encuentra en “En Ejecución” hasta tanto se determine su \naprobación técnica y financiera mediante acto administrativo, para lo cual, la Sociedad deberá haber \ncumplido con todos los requerimientos asociados a dicha obligación. \nSe debe tener en cuenta que la información entregada por Ecopetrol S.A, mediante los radicados \n2020046903-1-000 del 27 de marzo de 2020 y radicado No. 2021267786-1-000 del 9 de diciembre de \n2021, donde la Sociedad presentó argumentos técnicos del cumplimiento de los proyectos /programas \n“Reforestación de 2,65ha ” en los lotes ARCUPT 1 y ARCUPT 2, ubicado en el predio El Porvenir, \npropiedad de Ecopetrol S.A”, fue evaluada por esta Autoridad en el Concepto Técnico No. 08408 del \n24 de diciembre de 2021, (acogido mediante Resolución No. 00775 del 19 de abril de 2022) y donde \nse estableció lo siguiente:\n“(…) se detalla que la Sociedad presenta los soportes de titularidad requeridos en este literal. Así mismo, por \ntratarse del último requerimiento establecido por la ANLA para la actividad de reforestación de 2,65ha en el predo \nEl Provenir, donde tiene lugar la locación Cupiagua S, y al existir evidencias obtenidas en visitas de seguimiento \nde la ANLA sobre el desarrollo adecuado de la reforestación y sus respectivos mantenimientos, se considera \npertinente aprobar la actividad con cargo a la inversión forzosa del 1%. (…)” (subrayado fuera de texto original).\nA causa de lo anterior, específicamente que la Sociedad dio cumplimiento al (…) último requerimiento \nestablecido por la ANLA para la actividad de reforestación (…) y del acogimiento del Concepto Técnico \nNo. 08408 del 24 de diciembre de 2021 en la Resolución No. 00775 del 19 de abril de 2022, se \nestableció en el artículo segundo el cumplimiento técnico de la reforestación de 2.65 hectáreas en los \ntérminos que se citan a continuación:\n“(…) ARTÍCULO SEGUNDO. Declarar a la sociedad ECOPETROL S.A. que ha ejecutado con relación \na la línea de inversión de “Restauración, conservación y protección de la cobertura vegetal, \n\nResolución No.  01793           Del   22 de agosto de 2022            Hoja No. 16 de 23\n“Por la cual se resuelve recurso de reposición interpuesto contra la Resolución 775 del 19 de abril de 2022”\nOficinas: Carrera 13 A No. 34 – 72 Edificio 13 35 Pisos 8 al 11 Bogotá, D.C.\nCentro de Orientación y Radicación de Correspondencia: Carrera 13 A No. 34 – 72 Edificio 13 35 \nLocales 110 al 112 Bogotá, D.C.  \nCódigo Postal 110311156\nNit.: 900.467.239-2\nLínea de Orientación y Contacto Ciudadano: 57 (1) 2540100 / 018000112998 PBX: 57 (1) 2540111\nwww.anla.gov.co    Email: licencias@anla.gov.co  \nPágina 16 de 23\nenriquecimientos vegetales y aislamiento de áreas para facilitar la sucesión natural” el proyecto \n“Reforestación de 2,65ha.” en los lotes ARCUPT 1 y ARCUPT 2, ubicado en el predio El Porvenir, \npropiedad de Ecopetrol S.A., en cumplimiento parcial de la inversión forzosa de no menos del 1% del \nproyecto Cupiagua T, establecida en el artículo segundo de la Resolución 405 del 11 de marzo de \n2020, modificada por el artículo segundo de la Resolución 1130 del 30 de junio de 2020. (…)”\nEn complemento con lo anterior es preciso indicar que en el Artículo sexto del Auto 1776 del 18 de \njunio de 2013 ANLA hizo requerimientos respecto de la reforestación de 2,65 ha en el marco de la \ninversión forzosa de no menos del 1%, e impuso obligaciones a las cuales, la Sociedad dio \ncumplimiento como se relaciona a continuación: \nAuto 3553 del 31 de diciembre de 2009\nObligación\nObservación\nARTICULO SEXTO.- Requerir a la empresa \nECOPETROL S.A., para que con respecto a la \ninversión del 1%, en un término de seis (6) \nmeses contados a partir de la ejecutoria del \npresente acto administrativo, de manera previa \na determinar la aceptación de la actividad de \nReforestación de 2.65 ha como parte del plan \nde inversión de no menos del 1%, la \npresentación del documento con la propuesta \nde la actividad, la cual debe incluir como \nmínimo lo siguiente::\n1.\nObjetivo\nSe dio cumplimiento mediante Auto 1132 del \n26 de marzo de 2015.\n2. \nJustificación \nambiental \ndel \npredio \nseleccionado la obligación de inversión.\nSe dio cumplimiento mediante Auto 1132 del \n26 de marzo de 2015.\n3. Especificaciones económicas detalladas\nSe dio cumplimiento mediante Auto 8275 del \n30 de septiembre de 2019\n4. Cronograma de las actividades realizadas\nSe dio cumplimiento mediante Auto 1132 del \n26 de marzo de 2015\n5. Acta de concertación con la Corporación \nRegional\nSe dio cumplimiento mediante Auto 8275 del \n30 de septiembre de 2019\n6. Descripción del área propuesta\nSe dio cumplimiento mediante Auto 1132 del \n26 de marzo de 2015\n7. Soporte de la titularidad del predio a través \nde copia de escritura publica\nSe dio cumplimiento en la parte considerativa \nde la Resolución 00775 del 19 de abril de 2022\n8. Procedencia del material vegetal \nSe dio cumplimiento mediante Auto 8275 del \n30 de septiembre de 2019\n9. Especificaciones de la actividad de \nestablecimiento especificando si se requirió o \nno aislamiento.\nSe dio cumplimiento mediante Auto 1132 del \n26 de marzo de 2015\n10. \nSoportes \nde \nlas \nactividades \nde \nmantenimiento de la plantación a tres años \ncontados a partir de la siembra\nSe dio cumplimiento mediante Auto 1132 del \n26 de marzo de 2015\n11. Localización debidamente georeferenciada \nen formato de origen (shapes) y en PDF del \nárea donde se realizó la inversión, donde se \nvisualice la cuenca hidrográfica donde recae la \nobligación de inversión.\n12. Lo anterior, teniendo en cuenta los términos \ny condiciones que exige el Modelo de \nAlmacenamiento Geográfico Geodatabase que \nse adopta a través de la Resolución 188 del 27 \nde febrero de 2013.\nSe dio cumplimiento mediante Auto 1132 del \n26 de marzo de 2015\n13. Copia del convenio ENV 002- de 2004.\nSe dio cumplimiento mediante Auto 8275 del \n30 de septiembre de 2019\n\nResolución No.  01793           Del   22 de agosto de 2022            Hoja No. 17 de 23\n“Por la cual se resuelve recurso de reposición interpuesto contra la Resolución 775 del 19 de abril de 2022”\nOficinas: Carrera 13 A No. 34 – 72 Edificio 13 35 Pisos 8 al 11 Bogotá, D.C.\nCentro de Orientación y Radicación de Correspondencia: Carrera 13 A No. 34 – 72 Edificio 13 35 \nLocales 110 al 112 Bogotá, D.C.  \nCódigo Postal 110311156\nNit.: 900.467.239-2\nLínea de Orientación y Contacto Ciudadano: 57 (1) 2540100 / 018000112998 PBX: 57 (1) 2540111\nwww.anla.gov.co    Email: licencias@anla.gov.co  \nPágina 17 de 23\nUna vez revisado el Sistema de Información de Licencias Ambientales – SILA, la sociedad Ecopetrol, \nmediante el radicado 2022033597-1-000 del 25 de febrero de 2022, en el anexo 1. Consolidada \nliquidación Conv ENV002 de 2004, se presenta la siguiente información:\nMenciona que se realizó convenio inicial el 26 de noviembre de 2004, y 4 otrosí de fechas 30 de \nnoviembre de 2004, 15 de noviembre de 2005, 30 de septiembre de 2005 y 23 de octubre de 2008 \nrespectivamente.\nPara un total de convenio de \n$7.985.142.263\nTotal ejecutado\n$7.001.252.641\nEquion\n$5.846.470.163\nCORPORINOQUIA\n$1.154.782.478\nSaldos del convenio \n$  983.889.622\nPresenta relación de reforestaciones realizadas bajo el convenio ENV002-004, así:  \n\nResolución No.  01793           Del   22 de agosto de 2022            Hoja No. 18 de 23\n“Por la cual se resuelve recurso de reposición interpuesto contra la Resolución 775 del 19 de abril de 2022”\nOficinas: Carrera 13 A No. 34 – 72 Edificio 13 35 Pisos 8 al 11 Bogotá, D.C.\nCentro de Orientación y Radicación de Correspondencia: Carrera 13 A No. 34 – 72 Edificio 13 35 \nLocales 110 al 112 Bogotá, D.C.  \nCódigo Postal 110311156\nNit.: 900.467.239-2\nLínea de Orientación y Contacto Ciudadano: 57 (1) 2540100 / 018000112998 PBX: 57 (1) 2540111\nwww.anla.gov.co    Email: licencias@anla.gov.co  \nPágina 18 de 23\nEs decir, en esta relación presentada nos indica que en el predio “Cupiagua S” se realizó el proyecto \n“Cupiagua T Licencia Ambiental 1299 del 4 de diciembre de 1996”, correspondiente a 2,65 hectáreas y \npor un valor de $28.187.481,81.\nEn el anexo 2.  “Resolución 500-41-17-1924 convenio ENV002-2004”, por medio de la cual se adopta \nel balance financiero y se declara la perdida de competencia para liquidar el convenio No. ENV-02 del \n208 de noviembre de 2004, celebrado entre la Corporación Autónoma Regional de la Orinoquia -\nCORPORINOQUIA, Fundación Amanecer y BP EXPLORATION COMPANY COLOMBIA LTDA, hoy \nEQUION ENERGIA LIMITED.\nEn el artículo segundo de la Resolución 500-41-17-1924 de fecha 6 de diciembre de 2017, se adopta \nel Balance económico, en los siguientes términos: “Adoptar el Balance Económico del Convenio No. \nENV-02 del 26 de noviembre de 2004, celebrado entre la Corporación Autónoma Regional de la \nOrinoquia -CORPORINOQUIA, Fundación Amanecer y BP EXPLORATION COMPANY COLOMBIA \nLTDA, hoy EQUION ENERGIA LIMITED, el cual se describe:\n(…)\nA causa de lo anterior y de no persistir obligaciones vigentes relacionadas con la Reforestación de \n2,65ha.” en los lotes ARCUPT 1 y ARCUPT 2, ubicado en el predio El Porvenir, propiedad de \nEcopetrol S.A., pendiente de cumplimiento por parte de la Sociedad, en la Resolución No. 0775 del 19 \nde abril de 2022, se considera viable modificar lo establecido en el artículo segundo (…)” \nConsideraciones Jurídicas\nEn cuanto a la decisión que se adopta en el presente acto administrativo, y en particular sobre la \nobligación contenida en los artículos primero y segundo de la Resolución 0775 del 19 de abril de \n2022, es preciso considerar que las mismas se encuentran soportadas sobre decisiones técnicas \nque son proporcionales y debidamente analizadas de manera objetiva de manera tal que se adecúe \na la realidad del proyecto.\nResulta importante, traer a colación los motivos jurídicos y técnicos por los cuales fue emitida la \nResolución objeto de recurso en esta oportunidad. \nRespecto de ello, es dable indicar que esta Autoridad, realizó una visita al área del proyecto el día 2 \nde diciembre de 2021 y adelantó una revisión documental al expediente LAM1146. Como resultado \nde lo anterior, se emitió el Concepto Técnico 08408 del 24 de diciembre de 2021, el cual sirvió como \nfundamento y sustento técnico para la expedición del Acto Administrativo objeto de recurso, el cual \nexpone en su parte considerativa, argumentos que para el presente acto administrativo permanecen \nvigentes y válidos a la fecha:\n\nResolución No.  01793           Del   22 de agosto de 2022            Hoja No. 19 de 23\n“Por la cual se resuelve recurso de reposición interpuesto contra la Resolución 775 del 19 de abril de 2022”\nOficinas: Carrera 13 A No. 34 – 72 Edificio 13 35 Pisos 8 al 11 Bogotá, D.C.\nCentro de Orientación y Radicación de Correspondencia: Carrera 13 A No. 34 – 72 Edificio 13 35 \nLocales 110 al 112 Bogotá, D.C.  \nCódigo Postal 110311156\nNit.: 900.467.239-2\nLínea de Orientación y Contacto Ciudadano: 57 (1) 2540100 / 018000112998 PBX: 57 (1) 2540111\nwww.anla.gov.co    Email: licencias@anla.gov.co  \nPágina 19 de 23\n“(…) de conformidad con la evaluación realizada a través del Concepto Técnico No. 08408 del 24 de \ndiciembre de 2021, esta Autoridad Nacional considera viable en la parte resolutiva del presente acto \nadministrativo indicar lo siguiente:\n<0000>\nCon relación a la línea de inversión de “Restauración, conservación y protección de la \ncobertura vegetal, enriquecimientos vegetales y aislamiento de áreas para facilitar la \nsucesión natural” desarrollada a través del programa “Conservación de 28,47 ha y \nReforestación de 2,65 ha en lote 1 y 13 del predio Cupiagua S se deberá:\n<0000>\nAceptar la actividad de conservación de 28,47ha\n en conservación distribuidas en los lotes AC CP \nT1, AC CP T2 y AC CP T3, ubicado en el predio El Porvenir, propiedad de Ecopetrol S.A., en \ncumplimiento parcial de la inversión forzosa de no menos del 1% del proyecto Cupiagua T, \nestablecida en el artículo décimo noveno de la Resolución 1299 de 4 de diciembre de 1996.\n<0000>\nAceptar la actividad de reforestación de 2,65ha\n en los lotes ARCUPT 1 y ARCUPT 2, ubicado en \nel predio El Porvenir, propiedad de Ecopetrol S.A., en cumplimiento parcial de la inversión forzosa de \nno menos del 1% del proyecto Cupiagua T, establecida en el artículo décimo noveno de la \nResolución 1299 de 4 de diciembre de 1996.\nAsí las cosas, el cumplimiento a esta obligación únicamente recae en la línea de inversión \ndenominada “Restauración, conservación y protección de la cobertura vegetal, \nenriquecimientos vegetales y aislamiento de áreas para facilitar la sucesión natural” del \nDecreto 1900 de 2006, desarrollada a través de los programas de “Conservación de 28,47 \nha y Reforestación de 2,65 ha en lote 1 y 13 del predio Cupiagua S” señalada en el artículo \nsegundo de la Resolución 405 del 11 de marzo de 2020, modificada por el artículo segundo \nde la Resolución 1130 del 30 de junio de 2020.” (Negrillas Nuestras)\nAhora bien, la sociedad Ecopetrol S.A., a través del radicado 2022084858-1-000 del 03 de mayo de \n2022, presentó recurso de reposición donde manifiesta que si bien, la Resolución 00775 de 2022 en \nlos artículos primero y segundo reconoció como ejecutadas las actividades de conservación de \n28,47 hectáreas y Reforestación de 2,65 Ha” de la línea “Restauración, conservación y protección de \nla cobertura vegetal, enriquecimiento vegetales y aislamiento de las áreas para facilitar sucesión \nnatural”, también lo es que, en el referido acto administrativo se “omitió reconocer y aprobar los \nmontos invertidos en estas dos (2) actividades (…)”precisando que “la obligación de no menos del \n1% reglamentada en el Decreto 2099 de 2016, se fundamenta en la ejecución del 1% del valor base \nde liquidación de 1% aprobado para el proyecto (…), es decir dicha obligación se tasa de manera \nmonetaria, por cuanto el cumplimiento de la misma se debe fundamentar en la declaración de \ncumplimiento tanto de la actividad como de los recursos invertidos en la ejecución de misma.” \n(subrayado fuera de texto)\nAl respecto, esta Autoridad a través del concepto técnico 4124 del 19 de julio de 2022 evaluó el \ncontenido del recurso de reposición desde el punto de vista técnico y financiero, conceptuando que \nse complementen con el valor de los montos invertidos en las actividades de conservación y \nReforestación cuyas actividades fueron declaradas como ejecutadas en los artículos primero y \nsegundo de la Resolución 00775 de 2022, como se indica a continuación:\nFrente al monto invertido en la Conservación de 28,47ha, se conceptuó:\n“(…) se considera que la “Conservación de 28,47ha” distribuidas en los lotes AC CP T1, AC CP T2 y \nAC CP T3, ubicado en el predio El Porvenir, propiedad de Ecopetrol S.A” se realizó bajo el Convenio \nNo. ENV-005 del 2 de noviembre de 2005, celebrado entre la CORPORACIÓN AUTÓNOMA \nREGIONAL DE LA ORINOQUIA – CORPORINOQUIA, FUNDACIÓN AMANECER Y BP \nEXPLOTATION COMPANY – COLOMBIA LTDA, HOY EQUIÓN ENERGÍA LIMITED.  Por valor de \nVEINTISIETE MILLONES CIENTO CINCUENTA Y SIETE MIL CUARENTA Y NUEVE PESOS \nMCTE ($27.157.049). (Negrillas y subrayado fuera de texto)\n\nResolución No.  01793           Del   22 de agosto de 2022            Hoja No. 20 de 23\n“Por la cual se resuelve recurso de reposición interpuesto contra la Resolución 775 del 19 de abril de 2022”\nOficinas: Carrera 13 A No. 34 – 72 Edificio 13 35 Pisos 8 al 11 Bogotá, D.C.\nCentro de Orientación y Radicación de Correspondencia: Carrera 13 A No. 34 – 72 Edificio 13 35 \nLocales 110 al 112 Bogotá, D.C.  \nCódigo Postal 110311156\nNit.: 900.467.239-2\nLínea de Orientación y Contacto Ciudadano: 57 (1) 2540100 / 018000112998 PBX: 57 (1) 2540111\nwww.anla.gov.co    Email: licencias@anla.gov.co  \nPágina 20 de 23\nPor lo anterior, desde el punto de vista técnico (…) Modificar el artículo primero de la \nResolución No. 00775 de 19 de abril de 2022, el cual quedara así:\nARTÍCULO PRIMERO. Declarar a la sociedad ECOPETROL S.A. que ha ejecutado con \nrelación a la línea de inversión de “Restauración, conservación y protección de la cobertura \nvegetal, enriquecimientos vegetales y aislamiento de áreas para facilitar la sucesión natural” \nel proyecto “Conservación de 28,47ha” distribuidas en los lotes AC CP T1, AC CP T2 y AC \nCP T3, ubicado en el predio El Porvenir, propiedad de Ecopetrol S.A., en cumplimiento \nparcial de la inversión forzosa de no menos del 1% del proyecto Cupiagua T, establecida en \nel artículo segundo de la Resolución 405 del 11 de marzo de 2020, modificada por el \nartículo segundo de la Resolución 1130 del 30 de junio de 2020; por valor de VEINTISIETE \nMILLONES CIENTO CINCUENTA Y SIETE MIL CUARENTA Y NUEVE PESOS MCTE \n($27.157.049).” (Negrillas y subrayado fuera de texto)\nFrente al monto invertido en la Reforestación de 2,65ha, se conceptuó:\n“A causa de lo anterior y de no persistir obligaciones vigentes relacionadas con la \nReforestación de 2,65ha.” en los lotes ARCUPT 1 y ARCUPT 2, ubicado en el predio El \nPorvenir, propiedad de Ecopetrol S.A., pendiente de cumplimiento por parte de la Sociedad, \nen la Resolución No. 0775 del 19 de abril de 2022, se considera viable modificar lo \nestablecido en el artículo segundo en el sentido de complementar, quedando de la siguiente \nmanera\n(…) ARTÍCULO SEGUNDO. Declarar a la sociedad ECOPETROL S.A. que ha ejecutado con \nrelación a la línea de inversión de “Restauración, conservación y protección de la cobertura vegetal, \nenriquecimientos vegetales y aislamiento de áreas para facilitar la sucesión natural” el proyecto \n“Reforestación de 2,65ha ..” en los lotes ARCUPT 1 y ARCUPT 2, ubicado en el predio El Porvenir, \npropiedad de Ecopetrol S.A., en cumplimiento parcial de la inversión forzosa de no menos del 1% del \nproyecto Cupiagua T, establecida en el artículo segundo de la Resolución 405 del 11 de marzo de \n2020, modificada por el artículo segundo de la Resolución 1130 del 30 de junio de 2020 por un valor \nde VEINTIOCHO MILLONES CIENTO OCHENTA Y SIETE MIL CUATROCIENTOS OCHENTA Y \nUN PESOS CON OCHENTA Y UN CENTAVOS M/CTE ($28.187.481,81). “(Negrillas y subrayado \nfuera de texto)\nTeniendo en cuenta las consideraciones técnicas, financieras y jurídicas esgrimidas en este \npronunciamiento, se considera procedente reponer y, en consecuencia, modificar los artículos \nprimero y segundo de la Resolución 0775 del 19 de abril de 2022, en el sentido de complementar \ncomo monto invertido para  la Conservación de 28,47ha, el valor de VEINTISIETE MILLONES \nCIENTO CINCUENTA Y SIETE MIL CUARENTA Y NUEVE PESOS MCTE ($27.157.049) y para la \nReforestación de 2,65ha, el valor de VEINTIOCHO MILLONES CIENTO OCHENTA Y SIETE MIL \nCUATROCIENTOS OCHENTA Y UN PESOS CON OCHENTA Y UN CENTAVOS M/CTE \n($28.187.481,81), tal y como quedara definido en la parte resolutiva del  presente acto \nadministrativo.\nCONSIDERACIONES FINALES \nAhora bien, es importante señalar que las decisiones adoptadas en esta instancia procesal,  se \nsuscribieron  de conformidad a la normatividad vigente, resaltando que fue preciso reconsiderar \nalgunas de ellas y mantener incólume otras obligaciones,   pues es claro que dentro de los principios \nde la administración está el control gubernativo, el cual permite que la administración revise sus \npropios actos, los modifique, aclare o revoque, de acuerdo con la pertinencia y conducencia de los \nargumentos y pruebas presentados por el interesado en la decisión. Para el caso de la autoridad \nambiental, sus decisiones deben estar enmarcadas dentro de los principios generales del derecho y \nvalores constitucionales de la protección de los recursos naturales renovables, y la obligación de \ngarantizar el derecho a un medio ambiente sano. \n\nResolución No.  01793           Del   22 de agosto de 2022            Hoja No. 21 de 23\n“Por la cual se resuelve recurso de reposición interpuesto contra la Resolución 775 del 19 de abril de 2022”\nOficinas: Carrera 13 A No. 34 – 72 Edificio 13 35 Pisos 8 al 11 Bogotá, D.C.\nCentro de Orientación y Radicación de Correspondencia: Carrera 13 A No. 34 – 72 Edificio 13 35 \nLocales 110 al 112 Bogotá, D.C.  \nCódigo Postal 110311156\nNit.: 900.467.239-2\nLínea de Orientación y Contacto Ciudadano: 57 (1) 2540100 / 018000112998 PBX: 57 (1) 2540111\nwww.anla.gov.co    Email: licencias@anla.gov.co  \nPágina 21 de 23\nDe otro lado es importante manifestar que estando en el trámite de una actuación administrativa de \naceptar valores y ejecución de actividades  dentro de la obligación  forzosa de no menos del 1%  vía \nseguimiento, es indiscutible que la administración revise su actuación con motivo de un recurso de \nreposición, por lo que para el presente caso se dispondrá: modificar los artículos primero y  segundo \ny mantener incólume las demás disposiciones de la Resolución 775 del 19 de abril de 2022, \nconforme a lo motivado en el presente acto administrativo.  \nEn mérito de lo expuesto,\nRESUELVE\nARTÍCULO PRIMERO. Reponer, y en consecuencia modificar el artículo primero de la Resolución \n0775 del 19 de abril de 2022, el cual quedará así:\n“ARTÍCULO PRIMERO. Declarar a la sociedad ECOPETROL S.A. que ha ejecutado con \nrelación a la línea de inversión de “Restauración, conservación y protección de la cobertura \nvegetal, enriquecimientos vegetales y aislamiento de áreas para facilitar la sucesión natural” \nel proyecto “Conservación de 28,47ha” distribuidas en los lotes AC CP T1, AC CP T2 y AC \nCP T3, ubicado en el predio El Porvenir, propiedad de Ecopetrol S.A., en cumplimiento \nparcial de la inversión forzosa de no menos del 1% del proyecto Cupiagua T, establecida en \nel artículo segundo de la Resolución 405 del 11 de marzo de 2020, modificada por el artículo \nsegundo de la Resolución 1130 del 30 de junio de 2020, por valor de VEINTISIETE \nMILLONES CIENTO CINCUENTA Y SIETE MIL CUARENTA Y NUEVE PESOS MCTE \n($27.157.049).”\nARTÍCULO SEGUNDO. Reponer, y en consecuencia modificar el artículo segundo de la Resolución \n0775 del 19 de abril de 2022, el cual quedará así:\n“ARTÍCULO SEGUNDO. Declarar a la sociedad ECOPETROL S.A. que ha ejecutado con \nrelación a la línea de inversión de “Restauración, conservación y protección de la cobertura \nvegetal, enriquecimientos vegetales y aislamiento de áreas para facilitar la sucesión natural” \nel proyecto “Reforestación de 2,65ha ..” en los lotes ARCUPT 1 y ARCUPT 2, ubicado en el \npredio El Porvenir, propiedad de Ecopetrol S.A., en cumplimiento parcial de la inversión \nforzosa de no menos del 1% del proyecto Cupiagua T, establecida en el artículo segundo de \nla Resolución 405 del 11 de marzo de 2020, modificada por el artículo segundo de la \nResolución 1130 del 30 de junio de 2020, por un valor de VEINTIOCHO MILLONES CIENTO \nOCHENTA Y SIETE MIL CUATROCIENTOS OCHENTA Y UN PESOS CON OCHENTA Y \nUN CENTAVOS M/CTE ($28.187.481,81).”.\nARTÍCULO TERCERO. Los demás términos, condiciones y obligaciones de la Resolución 0775 del \n19 de abril de 2022, que no son objeto de modificación expresa en este proveído, se mantienen \nvigentes y son exigibles para el titular del instrumento de manejo ambiental.\nARTÍCULO CUARTO. Por la Autoridad Nacional de Licencias Ambientales – ANLA, notificar el \ncontenido del presente acto administrativo al Representante Legal o Apoderado debidamente \nconstituido de la sociedad ECOPETROL S.A., con NIT 899.999.068-1, o a quien haga sus veces, de \nconformidad con lo previsto en los artículos 67, 68  y 69 de la Ley 1437 de 2011.\nPARÁGRAFO PRIMERO. En el suceso en que el titular de la licencia o el permiso, entre en proceso \nde disolución o régimen de insolvencia empresarial o liquidación regulados por las normas vigentes, \ninformará inmediatamente de esta situación a esta Autoridad, con fundamento, entre otros, en los \nartículos 8, 58, 79, 80, 81, 95 numeral 8 de la Constitución Política de 1991, en la Ley 43 de 1990, \nen la Ley 222 de 1995, en la Ley 1333 de 2009 y demás normas vigentes al y jurisprudencia \naplicable.\n\nResolución No.  01793           Del   22 de agosto de 2022            Hoja No. 22 de 23\n“Por la cual se resuelve recurso de reposición interpuesto contra la Resolución 775 del 19 de abril de 2022”\nOficinas: Carrera 13 A No. 34 – 72 Edificio 13 35 Pisos 8 al 11 Bogotá, D.C.\nCentro de Orientación y Radicación de Correspondencia: Carrera 13 A No. 34 – 72 Edificio 13 35 \nLocales 110 al 112 Bogotá, D.C.  \nCódigo Postal 110311156\nNit.: 900.467.239-2\nLínea de Orientación y Contacto Ciudadano: 57 (1) 2540100 / 018000112998 PBX: 57 (1) 2540111\nwww.anla.gov.co    Email: licencias@anla.gov.co  \nPágina 22 de 23\nAdicional a la obligación de informar a esta Autoridad de tal situación, el titular de la licencia o \npermiso aprovisionará contablemente las obligaciones contingentes que se deriven de la existencia \nde un procedimiento ambiental sancionatorio conforme con el artículo 40 de la Ley 1333 de 2009 o la \nnorma que la adicione, modifique o derogue.\nARTÍCULO QUINTO. Por la Autoridad Nacional de Licencias Ambientales- ANLA, comunicar el \ncontenido del presente acto administrativo a la Corporación Autónoma Regional de la Orinoquía – \nCORPORINOQUIA, a la Gobernación de Casanare, al Municipio de Aguazul en el departamento de \nCasanare y a la Procuraduría Delegada para Asuntos Ambientales y Agrarios para su conocimiento y \nfines pertinentes.\nARTÍCULO SEXTO. Publicar la presente Resolución en la Gaceta Ambiental de la Autoridad \nNacional de Licencias Ambientales - ANLA y la copia de la publicación deberá remitirse al \nexpediente LAM1146.\nARTÍCULO SÉPTIMO. Contra el presente acto administrativo no procede recurso alguno de \nconformidad con lo establecido en el numeral 1º  del  artículo 87 del Código de Procedimiento \nAdministrativo y de lo Contencioso Administrativo.\nNOTIFÍQUESE, COMUNÍQUESE, PUBLÍQUESE Y CÚMPLASE\nDada en Bogotá D.C., a los 22 de agosto de 2022\nEDILBERTO PEÑARANDA CORREA\nAsesor\nEjecutores\nANA MATILDE CARRILLO PEÑA\nContratista\n \n \nRevisor / L\u0000der\nMARCELO ROJAS BALLESTEROS\nContratista\n \nMONICA  LILIANA  JURADO  \nGUTIERREZ\nAbogado/Contratista\n \n \nExpediente No. \nLAM1146\nConcepto Técnico N°     04124 del 19 de julio de 2022\nFecha:\n22 de julio de 2022\nProceso No.: 2022180398\nArchívese en: LAM1146  \nPlantilla_Resolución_SILA_v3_42852\n\nResolución No.  01793           Del   22 de agosto de 2022            Hoja No. 23 de 23\n“Por la cual se resuelve recurso de reposición interpuesto contra la Resolución 775 del 19 de abril de 2022”\nOficinas: Carrera 13 A No. 34 – 72 Edificio 13 35 Pisos 8 al 11 Bogotá, D.C.\nCentro de Orientación y Radicación de Correspondencia: Carrera 13 A No. 34 – 72 Edificio 13 35 \nLocales 110 al 112 Bogotá, D.C.  \nCódigo Postal 110311156\nNit.: 900.467.239-2\nLínea de Orientación y Contacto Ciudadano: 57 (1) 2540100 / 018000112998 PBX: 57 (1) 2540111\nwww.anla.gov.co    Email: licencias@anla.gov.co  \nPágina 23 de 23\nNota: Este es un documento electrónico generado desde los Sistemas de Información de la ANLA. El original reposa en los archivos digitales de la \nEntidad.\n"
}