{
  "fuente": "ANLA_GACETA",
  "numero_resolución": "RESOLUCIÓN N° 002053",
  "fecha_resolución": "1993-12-22",
  "anio_resolucion": "1993",
  "nombre_proyecto": "Prospecto Tacaré”, de",
  "nombre_proyecto_normalizado": "PROSPECTO TACARE DE",
  "ubicación": "Municipio De Nunchía, Departamento De Casanare",
  "empresa": null,
  "empresa_normalizada": null,
  "numero_expediente": "ambiental",
  "radicados": [
    "20236200150742",
    "20246200550452",
    "2022217406",
    "20246200933042",
    "20246200949262"
  ],
  "descripcion": "POR LA CUAL SE RESUELVE UN RECURSO DE REPOSICIÓN",
  "tipos_infraccion": null,
  "tipos_infraccion_normalizados": null,
  "pdf_id": "47986",
  "file_name": "ANLA_47986.pdf",
  "texto_completo": "AUTORIDAD NACIONAL DE LICENCIAS \nAMBIENTALES\n- ANLA –\nRESOLUCIÓN N° 002053\n(18 SEP. 2024)\nPágina 1 de 20\n“POR LA CUAL SE RESUELVE UN RECURSO DE REPOSICIÓN”\nEL ASESOR DEL DESPACHO DEL DIRECTOR DE LA AUTORIDAD \nNACIONAL DE LICENCIAS AMBIENTALES – ANLA\nEn ejercicio de las facultades legales establecidas mediante la Ley 99 del 22 de \ndiciembre de 1993, el Decreto Ley 3573 del 27 de septiembre de 2011, modificado \npor el Decreto 376 del 11 de marzo de 2020, por el cual se modifica la estructura \nde la Autoridad Nacional de Licencias Ambientales y acorde con lo regulado en el \nDecreto 1076 del 26 de mayo de 2015, la Resolución 669 del 14 de abril de 2020, \nla Resolución 1957 del 5 de noviembre de 2021 y la Resolución 2795 del 25 de \nnoviembre de 2022, expedidas por la Autoridad Nacional de Licencias \nAmbientales, y\nCONSIDERANDO:\nQue mediante Resolución 182 del 27 de febrero de 1995, el entonces Ministerio del \nMedio Ambiente, hoy Ministerio de Ambiente y Desarrollo Sostenible (En adelante \nel Ministerio), otorgó Licencia Ambiental Ordinaria a la Sociedad B.P. \nEXPLORATION COMPANY (COLOMBIA) LTD, para adelantar las obras y \nactividades de exploración de hidrocarburos en el área denominada “Prospecto \nTacaré”, localizadas en el Municipio de Nunchía, Departamento de Casanare. \nQue a través de la Resolución 311 del 29 de marzo de 1995, el entonces Ministerio \ndel Medio Ambiente estableció los Planes de Manejo Ambiental, para llevar a cabo \nlos proyectos de perforación del área de los pozos exploratorios Tacaré B, C y D, \nen el Prospecto Tacaré. \nQue por medio de la Resolución 147 del 16 de febrero de 1996, el Ministerio modificó \nla Resolución 311 del 29 de marzo de 1995, en el sentido de autorizar la quema de \ncrudo de las pruebas de los pozos hasta que en la zona se construyan líneas de \nflujo o una CPF.\n\nResolución No. 002053       Del 18 SEP. 2024          Hoja No. 2 de 20\n“POR LA CUAL SE RESUELVE UN RECURSO DE REPOSICIÓN”\nPágina 2 de 20\nQue mediante Resolución 1796 del 6 de septiembre de 2011, el Ministerio aceptó el \ncambio de razón social del titular de la Licencia Ambiental otorgada mediante \nResolución 182 del 27 de febrero de 1995 de BP EXPLORATION COMPANY \nCOLOMBIA LIMITED a EQUION ENERGÍA LIMITED (En adelante la Sociedad). \nQue a través de Resolución 561 del 30 de marzo del 2020, la Autoridad Nacional de \nLicencias Ambientales (En adelante La Autoridad Nacional) modificó la Resolución \n182 del 27 de febrero de 1995, en el sentido de aceptar transitoriamente el plan de \ninversión forzosa de no menos del 1% para el proyecto “Prospecto Tacaré”, de \nconformidad con lo establecido en el parágrafo del artículo 43 de la Ley 99 del 22 \nde diciembre de 1993, reglamentado por el Decreto 1900 del 12 de junio del 2006, \nen el sentido de invertir los recursos en la recuperación, conservación, preservación \ny vigilancia de la cuenca hidrográfica del Río Nunchía, mediante la Adquisición de \npredios en áreas para conservación. Igualmente, en la misma resolución fue \naceptado el acogimiento al porcentaje incremental señalado en el artículo 321 del \nPlan Nacional de Desarrollo - PND (Ley 1955 del 25 de mayo del 2019).\nQue mediante Resolución 768 del 29 de abril de 2024, la Autoridad Nacional aceptó \ncomo ejecutado el valor de DOSCIENTOS SESENTA Y DOS MILLONES \nNOVECIENTOS OCHENTA Y CUATRO MIL CIENTO SESENTA Y NUEVE CON \nTREINTA Y OCHO CENTAVOS ($262.984.169,38), con cargo a la obligación de la \ninversión forzosa de no menos del 1% para el proyecto “Prospecto Tacaré”, por la \ncompra del predio Alta Mira, ubicado en la vereda Tamuría del Municipio de Nunchía \n(Casanare) y del predio El Alcaraván, ubicado en la vereda Cofradía del Municipio \nde Nunchía (Casanare), la cual fue debidamente notificada a la Sociedad el 30 de \nabril de 2024, por correo electrónico.\nQue mediante comunicación con radicación 20246200550452 del 15 de mayo de \n2024, la Sociedad interpuso recurso de reposición en contra de la Resolución 768 \ndel 29 de abril de 2024; argumentos que fueron evaluados por el equipo técnico de \nla Autoridad Nacional y en consecuencia se expidió el Concepto Técnico 6299 del \n28 de agosto de 2024.\nQue mediante comunicación con radicación 20246200933042 del 16 de agosto de \n2024, la sociedad EQUION ENERGIA LIMITED presentó desistimiento a la \ncomunicación 20236200150742 del 26 de mayo de 2023 a través de la cual solicitó \nla asignación de montos de la inversión forzosa de no menos del 1% para los \nproyectos “Prospecto Tacare” (LAM0226) y “Niscota E” (LAM1464).\nCOMPETENCIA DE LA AUTORIDAD NACIONAL \nEl Gobierno Nacional, mediante Decreto Ley 3573 del 27 de septiembre de 2011, \ncreó la Autoridad Nacional de Licencias Ambientales (ANLA), como una entidad con \nautonomía administrativa y financiera, sin personería jurídica, la cual hace parte del \n\nResolución No. 002053       Del 18 SEP. 2024          Hoja No. 3 de 20\n“POR LA CUAL SE RESUELVE UN RECURSO DE REPOSICIÓN”\nPágina 3 de 20\nSector Administrativo de Ambiente y Desarrollo Sostenible, en los términos del \nartículo 67 de la Ley 489 de 1998.\nEl numeral 1° del artículo tercero del mencionado decreto estableció dentro de las \nfunciones de la Autoridad Nacional, la de otorgar o negar las licencias, permisos y \ntrámites ambientales de competencia del Ministerio, de conformidad con la ley y los \nreglamentos.\nMediante el Decreto 376 del 11 de marzo de 2020, se modificó la estructura de la \nAutoridad Nacional de Licencias Ambientales.\nMediante la Resolución 669 del 14 de abril de 2020, se nombró como servidor \npúblico a EDILBERTO PEÑARANDA CORREA, identificado con cédula de \nciudadanía 4.052.851, en el empleo de libre nombramiento y remoción de Asesor, \ncódigo 1020, grado 15, adscrito a la Dirección General de la planta global de la \nANLA.\nEl 5 de noviembre de 2021, la Autoridad Nacional emitió la Resolución 1957 “Por la \ncual se adopta el Manual Específico de Funciones y de Competencias Laborales \npara los empleos de la planta de personal de la Autoridad Nacional de Licencias \nAmbientales - ANLA”, en donde se establece que corresponde al Despacho del \nDirector General de la Autoridad Nacional de Licencias Ambientales - ANLA, \n“Suscribir los actos administrativos que otorgan, niegan, modifican, ajustan o \ndeclaran la terminación de las licencias, permisos y trámites ambientales”. \nEn ejercicio de las facultades conferidas por la Ley 489 de 1998, se expidió la \nResolución 2795 del 25 de noviembre de 2022, -“Por la cual se delegan unas \nfunciones y se dictan otras disposiciones”-, que en el numeral 15 del artículo primero \nse delegó en el Asesor Código 1020 Grado 15 del Despacho del Director General, \nentre otras, la función de resolver los recursos de reposición interpuestos contra los \nactos administrativos que emitan en cumplimiento de las funciones delegadas. \nTeniendo en cuenta lo anterior, es el Asesor del Despacho del Director General de \nla Autoridad Nacional el competente para pronunciarse sobre el recurso de \nreposición interpuesto por la Sociedad en contra de Resolución 768 del 29 de abril \nde 2024.\nFUNDAMENTOS JURÍDICOS\nEl procedimiento para la presentación y Resolución de recursos contra los actos \nadministrativos se encuentra reglado en el Código de Procedimiento Administrativo \ny de lo Contencioso Administrativo artículos 74 y siguientes, que particularmente \nrespecto del recurso de reposición al tenor literal expresan:\n“Artículo 74. Recursos contra los actos administrativos.\n\nResolución No. 002053       Del 18 SEP. 2024          Hoja No. 4 de 20\n“POR LA CUAL SE RESUELVE UN RECURSO DE REPOSICIÓN”\nPágina 4 de 20\nPor regla general, contra los actos definitivos procederán los siguientes recursos: \n1. El de reposición, ante quien expidió la decisión para que la aclare, modifique, adicione \no revoque (…)”\nA su vez, los artículos 76 y 77 del Código enunciado preceptúan: \n“Artículo 76. Oportunidad y presentación.\nLos recursos de reposición y apelación deberán interponerse por escrito en la diligencia \nde notificación personal, o dentro de los diez (10) días siguientes a ella, o a la notificación \npor aviso, o al vencimiento del término de publicación, según el caso. Los recursos contra \nlos actos presuntos podrán interponerse en cualquier tiempo, salvo en el evento en que \nse haya acudido ante el juez. \nLos recursos se presentarán ante el funcionario que dictó la decisión, salvo lo dispuesto \npara el de queja, y si quien fuere competente no quisiere recibirlos podrán presentarse \nante el procurador regional o ante el personero municipal, para que ordene recibirlos y \ntramitarlos, e imponga las sanciones correspondientes, si a ello hubiere lugar. \nEl recurso de apelación podrá interponerse directamente, o como subsidiario del de \nreposición y cuando proceda será obligatorio para acceder a la jurisdicción. \nLos recursos de reposición y de queja no serán obligatorios.\nArtículo 77. Requisitos.\nPor regla general los recursos se interpondrán por escrito que no requiere de \npresentación personal si quien lo presenta ha sido reconocido en la actuación. \nIgualmente, podrán presentarse por medios electrónicos. \nLos recursos deberán reunir, además, los siguientes requisitos: \n1. Interponerse dentro del plazo legal, por el interesado o su representante o apoderado \ndebidamente constituido. \n2. Sustentarse con expresión concreta de los motivos de inconformidad.\n3. Solicitar y aportar las pruebas que se pretende hacer valer. \n4. Indicar el nombre y la dirección del recurrente, así como la dirección electrónica si \ndesea ser notificado por este medio. \nSólo los abogados en ejercicio podrán ser apoderados (…)\nA su vez, el artículo 80 del citado Código, establece el alcance del contenido de la \ndecisión que resuelve el recurso:\n\nResolución No. 002053       Del 18 SEP. 2024          Hoja No. 5 de 20\n“POR LA CUAL SE RESUELVE UN RECURSO DE REPOSICIÓN”\nPágina 5 de 20\n“Artículo 80. Decisión de los recursos. -Vencido el período probatorio, si a ello hubiere \nlugar, y sin necesidad de acto que así lo declare, deberá proferirse la decisión motivada \nque resuelva el recurso. \nLa decisión resolverá todas las peticiones que hayan sido oportunamente planteadas y \nlas que surjan con motivo del recurso”.\nCONSIDERACIONES DE LA AUTORIDAD NACIONAL FRENTE AL RECURSO \nDE REPOSICIÓN INTERPUESTO POR LA SOCIEDAD \nDesde el punto de vista procedimental, se observa que el Recurso de Reposición \ninterpuesto por la Sociedad en contra de la Resolución 768 del 29 de abril de 2024, \ncumple con los requisitos establecidos en el artículo 77 y concordantes del Código \nde Procedimiento Administrativo y de lo Contencioso Administrativo, en cuanto a lo \nsiguiente: \n1.\nInterponerse dentro del plazo legal, por el interesado o su representante o \napoderado debidamente constituido.\nSe encuentra acreditado que el día 30 de abril de 2024, la Sociedad fue \ndebidamente notificada mediante correo electrónico de la Resolución 768 del 29 de \nabril de 2024, frente a la cual interpuso recurso de reposición por intermedio de su \nrepresentante legal el día 15 de mayo de 2024, radicado en la Autoridad Nacional \nbajo el número 20246200550452, esto es, dentro de los diez (10) días siguientes a \nla notificación, de conformidad con lo preceptuado en el artículo 76 de la Ley 1437 \nde 2011.\n2.\nSustentarse con expresión concreta de los motivos de inconformidad. \nLa Sociedad presentó los argumentos en contra de la disposición recurrida de la \nResolución 768 del 29 de abril de 2024, los cuales serán tenidos en cuenta para \ndecidir el presente recurso de reposición.\n3.\nSolicitar y aportar las pruebas que se pretende hacer valer.\nLa Sociedad no aportó pruebas al recurso de reposición\n4.\nIndicar el nombre y la dirección del recurrente, así como la dirección electrónica \nsi desea ser notificado por este medio.\nLa Sociedad manifestó que, para efectos de la notificación dentro del presente \nexpediente, las recibiría en la carrera 11B No. 98-08-43 Piso: 17 en la ciudad de \nBogotá D.C. o al correo electrónico  notificacionesjudiciales@equion.com\nCon base en lo anterior, verificado el cumplimiento de los requisitos establecidos en \nel Código de Procedimiento Administrativo y de lo Contencioso Administrativo -\n\nResolución No. 002053       Del 18 SEP. 2024          Hoja No. 6 de 20\n“POR LA CUAL SE RESUELVE UN RECURSO DE REPOSICIÓN”\nPágina 6 de 20\nCPACA-, respecto a la procedencia del señalado recurso de reposición, la Autoridad \nNacional procederá a resolverlo, teniendo en cuenta las consideraciones realizadas \nen el Concepto Técnico 6299 del 28 de agosto de 2024; en el mismo orden de los \nargumentos presentados por la Sociedad, a saber:\n1.\nDISPOSICIÓN RECURRIDA –ARTÍCULO PRIMERO DE LA RESOLUCIÓN \n768 DEL 29 DE ABRIL DE 2024. \n“(…)”\nARTÍCULO PRIMERO. ACEPTAR como ejecutado el valor de DOSCIENTOS \nSESENTA Y DOS MILLONES NOVECIENTOS OCHENTA Y CUATRO MIL CIENTO \nSESENTA Y NUEVE CON TREINTA Y OCHO CENTAVOS ($262.984.169,38), con \ncargo a la obligación de la inversión forzosa de no menos del 1% para el proyecto \n“Prospecto Tacaré”, por la compra del predio Alta Mira, ubicado en la vereda Tamuría \ndel Municipio de Nunchía (Casanare) y del predio El Alcaraván, ubicado en la vereda \nCofradía del Municipio de Nunchía (Casanare). “(…)”\n1.1 Petición de la Sociedad.\n“(…)”\nRevocar la decisión que tomó de acoger los montos recomendados de ser aprobados \nen el concepto técnico 00867 de 26 de febrero de 2024 de DOSCIENTOS SESENTA \nY DOS MILLONES NOVECIENTOS OCHENTA Y CUATRO MIL CIENTO SESENTA \nY NUEVE CON TREINTA Y OCHO CENTAVOS ($262.984.169,38), y en su lugar se \nsirva acoger el criterio expresado en el concepto técnico 00686 de 24 de febrero de \n2023,\n“(…)”\n1.2 Argumentos de la Sociedad.\n“(…)”\n“INEXISTENCIA DE FUNDAMENTOS PARA DESCONOCER EL CONTENIDO DEL \nCONCEPTO TÉCNICO 00686 DEL 24 DE FEBRERO DE 2023\n“Como se puede observar del capítulo de antecedentes, existe una diferencia \nsustancial entre lo considerado en el concepto técnico 00686 del 24 de febrero de \n2023, y el concepto 00867 del 26 de febrero de 2024. En el concepto 00686 del 24 \nde febrero de 2023 se concluyó que el valor  imputable a la obligación de inversión \ndel 1% para el proyecto Tacare ascendió a la suma de  TRESCIENTOS CINCUETA \n(SIC) Y TRES MILLONES CIENTO TREINTA Y NUEVE MIL NOVECIENTOS  \nNOVENTA Y UN PESOS CON CINCUENTA CENTAVOS (COP $353.139.991,50), \nmientras que en el concepto 00867 se aprueba un monto de apena (sic) \n\nResolución No. 002053       Del 18 SEP. 2024          Hoja No. 7 de 20\n“POR LA CUAL SE RESUELVE UN RECURSO DE REPOSICIÓN”\nPágina 7 de 20\nDOSCIENTOS SESENTA Y DOS MILLONES  NOVECIENTOS OCHENTA Y \nCUATRO MIL CIENTO SESENTA Y NUEVE CON TREINTA Y OCHO CENTAVOS \n($262.984.169,38), situación que es completamente gravosa e injustificada para \nEquion, de cara a todos los esfuerzos que se han desplegado para cumplir de manera \ncompleta y definitiva con la obligación de inversión del 1% para el proyecto Tacare.\nComo ya se mencionó en el antecedente No. 4, el valor total de la inversión del 1% \npara \nel \nproyecto \nTacare \nes \nde \nTRESCIENTOS \nTREINTA \nMILLONES \nOCHOCIENTOS NOVENTA Y DOS MIL CIENTO VEINTISEIS PESOS CON \nVEINTIDOS CENTAVOS (COP 330.892.126,22), lo que significa que ese es el valor \nmínimo que debe invertir Equion para poder solicitarle a la ANLA la declaratoria de \ncumplimiento de la obligación de inversión del 1% asociada al proyecto Tacare D.\nUna vez revisado el concepto 00686 del 24 de febrero de 2023 encontramos que el \nvalor que fue aceptado como efectivamente invertidos ascendió a la suma de \nTRESCIENTOS CINCUETA (SIC) Y TRES  MILLONES CIENTO TREINTA Y NUEVE \nMIL NOVECIENTOS NOVENTA Y UN PESOS CON  CINCUENTA CENTAVOS (COP \n$353.139.991,50), lo que significa que la Compañía había cumplido de manera \nefectiva con el 100% de la obligación de inversión del 1% para el proyecto Tacare, y \nque además de eso quedaría de este valor un remanente que fue efectivamente \ninvertido de VEINTIDÓS MILLONES DOSCIENTOS CUARENTA Y SIETE MIL \nOCHOCIENTOS SESENTA Y CINCO  PESOS CON VEINTIOCHO CENTAVOS \n(COP $22.247.865,28).\nEn una actuación que impacta negativamente el objetivo de cumplimiento de la \nobligación de  inversión del 1% asociada al proyecto Tacare para Equion, la ANLA al \nrealizar una nueva  evaluación, y sin desconocer, controvertir o desestimar de forma \nalguna el contenido del concepto  00686 de 24 de febrero de 2023, emitió el concepto \n00867 del 26 de febrero de 2024, en el que decidió aceptar como valor invertido para \nel cumplimiento de la obligación de inversión forzosa  del 1% del proyecto Tacare la \nsuma de DOSCIENTOS SESENTA Y DOS MILLONES NOVECIENTOS  OCHENTA \nY CUATRO MIL CIENTO SESENTA Y NUEVE CON TREINTA Y OCHO CENTAVOS  \n($262.984.169,38), lo que significó una variación sustancial y representativa a la baja \ndel monto aprobado y lo que además significó que Equion quedó aún con una \nobligación de inversión  pendiente que ascendería al valor de SESENTA Y SIETE \nMILLONES NOVECIENTOS SIETE MIL NOVECIENTOS CINCUENTA Y SEIS \nPESOS CON NOVENTA Y DOS CENTAVOS (COP $67.907.956.92).\nPodría considerarse que la variación entre uno y otro concepto deviene del radicado \n20236200150742 del 26 de mayo de 2023, en el que la Compañía presentó los \nargumentos que en su consideración justifican la aceptación de valores adicionales a \nlos que había sido efectivamente indicados como susceptibles de ser aceptados en \nel concepto técnico 00686 de 24 de febrero de 2023. Ahora bien, si esa era la \nsituación, y definitivamente la ANLA consideró que los argumentos para solicitar la \naceptación de valores adicionales como imputables al cumplimiento del obligación de \ninversión del 1% no eran de recibo, lo procedente hubiera sido mantener la postura \nque ya había asumido en el concepto técnico 00686 de 24 de febrero de  2023, \nespecialmente en cuanto al monto de la aprobación, en lugar de cambiar \ndrásticamente el  monto de la aprobación, generando un perjuicio para Equión habida \n\nResolución No. 002053       Del 18 SEP. 2024          Hoja No. 8 de 20\n“POR LA CUAL SE RESUELVE UN RECURSO DE REPOSICIÓN”\nPágina 8 de 20\ncuenta que en el concepto  técnico 00867 de 26 de febrero de 2024, como ya se \nmencionó, no hay argumentos que  desconozcan los análisis ya realizado en el \nconcepto técnico 00686 de 24 de febrero de 2023, pero si hay una mengua sustancial \nen el valor aprobado, dejando una obligación que en realidad ya fue cumplida por \nEquión, como cumplida parcialmente. \nEs relevante destacar que desde Equión entendemos que los concepto técnicos son \ncriterios  orientadores que terminan siendo acogidos total o parcialmente en los actos \nadministrativos a  través de los cuales se pronuncia la administración, sin embargo \npara el caso que nos concentra por tratarse de dos conceptos técnicos en los cuales \nse está analizando exactamente la misma  situación fáctica, es aceptable y legal \nsolicitar que se acoja el concepto 00686 de 24 de febrero de  2023, que como ya se \nmencionó estableció que la aprobación debe ser por un monto que cumple  con el \n100% del valor de la inversión del 1% para el proyecto Tacare, quedando un \nremanente que puede perfectamente ser imputado a otro proyecto en el que haya \ncoincidencia de la línea de inversión y del área geográfica en la cual estén pendientes \nel cumplimiento de obligaciones de inversión del 1%.\nCorresponde además dejar claro que el concepto técnico 00867 de 26 de febrero de \n2024 no  desconoce los valores ejecutados por la Compañía, lo que realmente hizo \ngravosa la situación  para Equión, fue que en el concepto de 2024 se dejara un \npendiente de inversión asociado al  proyecto Tacare, indicando que había un \nremanente de recursos que podía ser imputado a otro  proyecto, es decir, se \ndisminuyó el valor de la aprobación asociada al proyecto Tacare, dejando libres unos \ncuantiosos recursos para ser imputados a otros proyectos de inversión del 1%, lo que  \nsignifica de facto mantener abierta y pendiente la única obligación que de cara al \nproyecto Tacare existe en la actualidad, en lugar de declararla completamente \ncumplida, lo que permitiría  proseguir con la solicitud de archivo del expediente \nambiental.\nCon fundamento en todo lo expresado, respetuosamente lo que se pretende es que \nANLA reponga su decisión, y en lugar de aceptar un cumplimiento parcial de la \ninversión del 1% por  valor de DOSCIENTOS SESENTA Y DOS MILLONES \nNOVECIENTOS OCHENTA Y CUATRO MIL  CIENTO SESENTA Y NUEVE CON \nTREINTA Y OCHO CENTAVOS ($262.984.169,38), dejando además un remante \ncuantioso libre de ser imputado a otros proyectos de inversión del 1%, acepte el  \ncumplimiento total de la obligación de inversión del 1% para el proyecto Tacare por \nvalor de TRESCIENTOS TREINTA MILLONES OCHOCIENTOS NOVENTA Y DOS \nMIL CIENTO VEINTISEIS  PESOS CON VEINTIDOS CENTAVOS (COP \n330.892.126,22), dejando el remanente de VEINTIDÓS MILLONES DOSCIENTOS \nCUARENTA Y SIETE MIL OCHOCIENTOS SESENTA Y CINCO PESOS CON \nVEINTIOCHO CENTAVOS (COP $22.247.865,28), como valor disponible para ser \nimputado a otro proyecto siempre que se den las condiciones legales y técnicas que \ncorresponden.”\n1.3. Consideraciones de la Autoridad Nacional.\n\nResolución No. 002053       Del 18 SEP. 2024          Hoja No. 9 de 20\n“POR LA CUAL SE RESUELVE UN RECURSO DE REPOSICIÓN”\nPágina 9 de 20\nA través del Concepto Técnico 6299 del 28 de agosto de 2024, el equipo técnico de \nla Autoridad Nacional señaló:\n“(…)”\nCon relación a las consideraciones expuestas en el radicado 20246200550452 del 15 \nde mayo de 2024, esta Autoridad expone los siguientes argumentos:\nEn el Concepto Técnico 686 del 24 de febrero de 2023, se evalúo la información \nremitida en el radicado 2022217406-1-000 del 30 de septiembre de 2022 \ncorrespondiente al informe de cumplimiento ambiental ICA 29 (periodo comprendido \nentre 1 de enero al 30 de junio de 2022), donde se incluye el informe final de \ncumplimiento del plan de inversión del 1% para el proyecto Prospecto Tacare.\nEn la información remitida se indica que para la adquisición de los predios Alta Mira y \nel Alcaraván se invirtió el siguiente monto:\nFuente: Radicado 2022217406-1-000 del 30 de septiembre de 2022 (ICA 29)\nDe acuerdo con el análisis realizado en el citado concepto técnico, se concluyó que el \nmonto aceptable por la adquisición de estos predios era el siguiente:\n             \n\nResolución No. 002053       Del 18 SEP. 2024          Hoja No. 10 de 20\n“POR LA CUAL SE RESUELVE UN RECURSO DE REPOSICIÓN”\nPágina 10 de 20\nFuente: Concepto técnico No. 686 del 24 de febrero de 2023\nEn este sentido, el valor de los proyectos del Plan de Inversión de no menos del 1% \nejecutados, corresponde a la suma de TRESCIENTOS CINCUENTA Y TRES \nMILLONES CIENTO TREINTA Y OCHO MIL NOVECIENTOS NOVENTA Y UN PESOS \nCON CINCUENTA CENTAVOS MCTE. ($353.138.991,50), con los cuales se cumplía \ncon el monto de la inversión forzosa de no menos del 1% para el proyecto Prospecto \nTacare.\nAhora bien, a pesar que la Autoridad Nacional había realizado el ejercicio de validación \nde los montos presentados en la comunicación con radicación 2022217406-1-000 del \n30 de septiembre de 2022, concluyendo que no se tendría montos pendientes por \nejecutar, la Sociedad EQUION ENERGIA LIMITED mediante comunicación con \nradicación 20236200150742 del 26 de mayo del 2023, presentó aclaración de los \nmontos asignados a la inversión forzosa de no menos del 1%, especificando los valores \npara el proyecto “Prospecto Tacare” (Expediente LAM0226) y para el proyecto “Niscota \nE”, pertenecientes al “Área de Perforación Exploratoria Niscota (Sector Sur)” \n(Expediente LAM1464), en donde se realiza una redistribución de los montos asociados \nde la siguiente forma:\n           \nFuente: Radicado 20236200150742 del 26 de mayo de 2023\nEn la comunicación con radicación 20236200150742 del 26 de mayo de 2023, la \nSociedad solicita lo siguiente:\n“5. Solicitud\nConforme a lo anterior y teniendo en cuenta el Concepto Técnico No. 00686 del 24 \nde febrero de 2023, Equion se permite realizar las siguientes solicitudes en relación \n\nResolución No. 002053       Del 18 SEP. 2024          Hoja No. 11 de 20\n“POR LA CUAL SE RESUELVE UN RECURSO DE REPOSICIÓN”\nPágina 11 de 20\ncon la obligación de la inversión forzosa del 1% de los proyectos Tacare D y Niscota \nE:\n1.\nQué de acuerdo al concepto técnico No. 00686 del 24 de febrero de 2023 y con \nfundamento en este alcance, el valor excedente de la obligación total de Tacare \nD efectivamente invertido por la Compañía de acuerdo con la Tabla 1. Ajuste \nMontos imputables a la obligación de inversión forzosa del 1% de los proyectos \nTacare D y Niscota E sea aprobado o dejado libre para ser asignado al \ncumplimiento parcial de la obligación de Niscota E del expediente LAM1464.\n2.\n Que se tenga en cuenta como valor imputable a la obligación de (sic) del 1% la \nactividad de Evaluación Jurídica desarrollada por la Empresa GIP, ya que se \nconstituyen en actividades que son absolutamente necesarias y son \nindispensables para poder desarrollar la actividad de compra de predios. Un valor \nde $67,908,181.59 para el proyecto Tacare D, y un valor de $16,117,900.80 para \nel proyecto Niscota E, estos valores están debidamente soportados en las Actas \ny Facturas del Anexo 1.\n3.\nQue se apruebe como valor ejecutado de la inversión forzosa de no menos del \n1% para el proyecto Tacare D del expediente LAM0226, el siguiente valor:\n•\nTacare D: Trescientos treinta millones ochocientos noventa y dos mil \ntrescientos cincuenta pesos con noventa y siete centavos ($330,892,350.97).\n4.\nQue se apruebe o se deje libre como valor parcial ejecutado de la inversión \nforzosa de no menos del 1% para el proyecto Niscota E perteneciente al área de \nPerforación \nExploratoria \nNiscota \n(Sector \nSur) \nexpediente \nLAM1464 \nespecíficamente para Niscota E:\n•\n-Niscota E: Ciento seis millones doscientos setenta y cinco mil novecientos \nveintitrés pesos con cincuenta y cuatro centavos ($106,275,923.54) (…)”\nEn este punto es claro, que el cambio de postura entre los conceptos técnicos 686 del \n24 de febrero de 2023 y Concepto técnico 867 del 26 de febrero de 2024 obedeció a \nuna petición expresa de la Sociedad EQUION y no por una decisión sin fundamento de \nla Autoridad Nacional.\nEn línea con lo anterior, la Autoridad en el Concepto técnico No, 867 del 26 de febrero \nde 2024 analizó las solicitudes realizadas por la Sociedad en la comunicación con \nradicación 20236200150742 del 26 de mayo de 2023, determinando que no era factible \nla aceptación de los montos asociados a la evaluación jurídica, por lo cual, el monto de \nla inversión forzosa de no menos del 1% para el proyecto “Prospecto Tacare” asciende \na la suma de $262.984.169,38; dejando un remanente que podría ser imputado al \nproyecto “Niscota E” (Expediente LAM1464), en línea con la solicitud realizada por la \nSociedad.\nTambién es importante mencionar que los montos correspondientes al proyecto \n“Niscota E” (LAM1464), fueron evaluados en el Concepto Técnico 4594 del 2 de julio \n\nResolución No. 002053       Del 18 SEP. 2024          Hoja No. 12 de 20\n“POR LA CUAL SE RESUELVE UN RECURSO DE REPOSICIÓN”\nPágina 12 de 20\nde 2024, acogido mediante el Acta No. 451 del 28 de junio de 2024, en donde se \nmencionó lo siguiente:\n“De igual manera la Sociedad informó que las facturas correspondientes avalúos, \nestudios bióticos y abióticos, y levantamientos topográficos, escrituras y gastos \nnotariales se encontraban adjuntos dentro del Anexo 6. Soportes Financieros Compra \nPredios, sin embargo, una vez validad esta información, no se encontró la totalidad \nde los soportes referidos. En relación con lo mencionado anteriormente, en el numeral \n5.7.1.2 Avance Financiero del Plan de Inversión, del presente concepto técnico, se \nrealiza el análisis detallado de dicha información.\nEn este sentido, se considera que los valores invertidos por concepto de avalúos, \nestudios bióticos y abióticos, y levantamientos topográficos, quedan pendientes por \naceptar con cargo a la inversión forzosa de no menos del 1%, por concepto de la \ncompra de los predios El Alcaraván y Alta Mira, hasta tanto la Sociedad presente la \ntotalidad de los soportes de dichos montos”.\nDe acuerdo con lo anterior, la decisión tomada en el concepto técnico 867 del 26 de \nfebrero de 2024 y acogida mediante la Resolución 768 del 29 de abril de 2024, \nobedeció a un análisis juicioso de la información que reposa en el expediente LAM0226, \nde acuerdo con la normativa que rige la obligación de la inversión forzosa de no menos \ndel 1% y la evaluación de los costos que son elegibles para el cumplimiento de esta \nobligación. En este sentido, pese a que la decisión contenida en la Resolución 768 del \n29 de abril de 2024 guardó estricta congruencia con la petición presentada por la \nSociedad mediante comunicación con radicación 20236200150742 del 26 de mayo de \n2023, a continuación, se analizarán los  argumentos presentados por la Sociedad en el \nrecurso de reposición, teniendo en cuenta que a través de comunicación con radicación \n20246200933042 del 16 de agosto de 2024 la Sociedad desistió de la petición que \nmotivó la decisión adoptada en el acto administrativo recurrido.\nAhora bien, es importante mencionar que mediante comunicación con radicación \n20246200933042 del 16 de agosto de 2024, la Sociedad EQUION ENERGIA LIMITED \npresentó desistimiento a la comunicación con radicación 20236200150742 del 26 de \nmayo de 2023 a través de la cual solicitó la asignación de montos de la inversión \nforzosa de no menos del 1% para los proyectos “Prospecto Tacare” (LAM0226) y \n“Niscota E” (LAM1464), en los siguientes términos.\n“Por medio de la presente comunicación Equion Energía Limited (en adelante \n“Equion” o la “Compañía”) se permite realizar el DESISTIMIENTO de la solicitud \nelevada a través de la comunicación con radicado 20236200150742 del 26 de mayo \nde 2023 por medio de la cual se había solicitado la asignación de montos presentada \nasignados (sic) a la inversión forzosa del 1% del proyecto Tacare D (LAM0226) y del \nproyecto Niscota E (LAM1464). Teniendo en cuenta lo anterior, nos permitimos \naclarar que conforme a los valores aceptados por la autoridad en el concepto técnico \n00686 de 24 de febrero de 2023, para la adquisición de los predios El Alcaraván y \nAlta Mira por un valor de COP $353.139.991,50, lo que se requiere es que ese valor \nsea distribuido en los expedientes LAM0226 y LAM1464 de la siguiente forma:\n\nResolución No. 002053       Del 18 SEP. 2024          Hoja No. 13 de 20\n“POR LA CUAL SE RESUELVE UN RECURSO DE REPOSICIÓN”\nPágina 13 de 20\nAsí las cosas, con esta distribución de los valores efectivamente imputables a la \nobligación del 1% y evaluados por la ANLA se daría cumplimiento al 100% de la \nobligación de la inversión forzosa del 1% del proyecto Prospecto Tacare \nperteneciente al expediente LAM0226.”\nEn sentido, teniendo en el expediente LAM0226 una petición expresa de la Sociedad \nsobre el desistimiento de las solicitudes realizadas en la comunicación con radicación \n20236200150742 del 26 de mayo de 2023 y en línea con la petición expuesta en el \nrecurso \nde \nreposición \npresentado \nmediante \ncomunicación \ncon \nradicación \n20246200550452 del 15 de mayo de 2024, sobre acoger lo dispuesto en el concepto \ntécnico No. 686 del 24 de febrero de 2023, la Autoridad Nacional se permite realizar la \nverificación de la petición realizada.\nDe acuerdo con lo evaluado en el Concepto Técnico No. 686 del 24 de febrero de 2023, \nlos montos aceptados para la compra de predios en cumplimiento de la Inversión \nForzosa de no menos del 1% del proyecto “Prospecto Tacare”, son los siguientes:\n                \nFuente: Concepto Técnico No 686 del 24 de febrero de 2023\nEn la tabla anterior, se detalla cada uno de los costos que se aceptaron como costos \nelegibles con cargo a la inversión forzosa de no menos del 1%, de acuerdo con las \nactividades, cronograma y proyección financiera propuestos por la Sociedad, los cuales \nfueron aprobados mediante Resolución 561 del 30 de marzo 2020, así mismo, la \nSociedad presentó los soportes financieros que sustentan las actividades realizadas, \ntal y como se evalúo en el Concepto 686 del 24 de febrero de 2023.\nDe acuerdo con la evaluación de los documentos que reposan en el expediente \nLAM0226, se tiene que para la compra de los predios Alta Mira y Alcaraván, la Sociedad \nejecutó la sumas con cargo al plan de Inversión forzosa de no menos del 1% de \nTRESCIENTOS CINCUENTA Y TRES MILLONES CIENTO TREINTA Y OCHO MIL \nNOVECIENTOS NOVENTA Y UN PESOS CON CINCUENTA CENTAVOS \n($ 353.138.991,50)\n\nResolución No. 002053       Del 18 SEP. 2024          Hoja No. 14 de 20\n“POR LA CUAL SE RESUELVE UN RECURSO DE REPOSICIÓN”\nPágina 14 de 20\nFuente: Concepto Técnico No. 686 del 24 de febrero de 2023\nUna vez restado este valor ejecutado ($353.138.991,50) de la liquidación parcial \nactualizada al artículo 321 de la Ley 1955 del 25 de mayo de 2019, aceptada en el \nartículo séptimo de la Resolución 561 del 30 de marzo de 2020, queda una diferencia \nde $22.246.865,28, valor que la Sociedad en la comunicación de desistimiento con \nradicado 20246200933042 del 16 de agosto de 2024, solicita sea trasladado al \nexpediente LAM1464 – “Área de Perforación Exploratoria Niscota (Sector Sur)”. En este \nsentido, el valor de la inversión forzosa para el proyecto” Prospecto Tacare” asciende \na $ 330.892.126,22.\nCon relación al traslado de los montos a otro expediente, esta solicitud será analizada \nen el seguimiento ordinario que se realice el expediente LAM1464 teniendo en cuenta \nla documentación aportada en la comunicación con radicación 20246200949262 del 22 \nde agosto de 2024, la cual reposa en el citado expediente.\nDe acuerdo con lo anterior, una vez revisados los argumentos expuestos por la \nSociedad en el recurso de reposición y en la comunicación con radicación \n20246200933042 del 16 de agosto de 2024 a través de la cual desiste de la solicitud \ncontenida en la comunicación con radicado 20236200150742 del 26 de mayo de 2023, \nse confirma lo evaluado por la Autoridad Nacional en el concepto técnico 686 del 24 de \nfebrero de 2023.\nPor lo anterior, la Autoridad Nacional modificará el acto recurrido en los siguientes \ntérminos:\n-\nMODIFICAR el artículo primero de la Resolución 768 del 29 de abril de 2024, el cual \nquedará de la siguiente forma:\nARTÍCULO PRIMERO. ACEPTAR como ejecutado el valor de TRESCIENTOS \nTREINTA MILLONES OCHOCIENTOS NOVENTA Y DOS MIL CIENTO \nVEINTISEIS PESOS CON VEINTIDOS CENTAVOS ($330.892.126,22), con cargo \na la obligación de la inversión forzosa de no menos del 1% para el proyecto \n“Prospecto Tacaré”, por la compra del predio Alta Mira, ubicado en la vereda \nTamuría del Municipio de Nunchía (Casanare) y del predio El Alcaraván, ubicado en \nla vereda Cofradía del Municipio de Nunchía (Casanare).\n-\nMODIFICAR el parágrafo primero del artículo segundo de la Resolución 768 del 29 \nde abril de 2024.\n\nResolución No. 002053       Del 18 SEP. 2024          Hoja No. 15 de 20\n“POR LA CUAL SE RESUELVE UN RECURSO DE REPOSICIÓN”\nPágina 15 de 20\nPARÁGRAFO PRIMERO. El balance de la inversión forzosa de no menos del 1% \ndel proyecto “Prospecto Tacaré” es el siguiente:\nBALANCE DE INVERSIÓN FORZOSA DE NO MENOS DEL 1%\nLiquidación de la inversión forzosa \nde no menos del 1% actualizada \n(Artículo 321)\n$ 330.892.126,22\nValor ejecutado de la inversión \nforzosa de no menos del 1%-\n$ 330.892.126,22\nValor en ejecución de la inversión\nforzosa de no menos del 1%-\n$0\nValor de la inversión forzosa de no\nmenos del 1% por ejecutar\n$0\n-\nREVOCAR el artículo tercero de la Resolución 768 del 29 de abril de 2024.\nAclarando que el cambio de postura obedece a las solicitudes realizadas por la \nsociedad EQUION ENERGIA LIMITED las cuales reposan en el expediente LAM0226. \n“(...)”\nLa Autoridad Nacional considera necesario advertir, que la decisión recurrida, \nresolvió la petición presentada por la Sociedad en la comunicación con radicación \n20236200150742 del 26 de mayo de 2023; a través de la cual, le solicitó a la \nAutoridad Nacional reconsiderar el balance de la liquidación de la inversión forzosa \nde no menos del 1% efectuada en el Concepto Técnico 686 del 25 de febrero de \n2024, en el sentido de tener como costo elegible la erogación sufragada por \n“Evaluación jurídica”; adicionalmente presentó tabla de distribución de costos \n(Incluido la evaluación jurídica)  con el objetivo de asignar un monto de los rubros al \nproyecto “Área de Perforación Exploratoria Niscota (Sector Sur)”. (Expediente \nLAM1464), “[T]eniendo en cuenta que estos dos proyectos comparten como ámbito \ngeográfico la cuenca del río Nunchía, que hace parte de la cuenca del río Tocaría y \nla línea de inversión aprobada que es compra de predios”.\nEs así, como la Autoridad Nacional, reiterando la improcedencia de aceptar como \ncosto elegible el denominado “Evaluación jurídica”, a través de la Resolución 768 \ndel 29 de abril de 2024 realizó el Balance de la Inversión forzosa de no menos del \n1% para el expediente LAM0226, basado en la distribución de rubros que presentó \nla Sociedad, y en consecuencia en el artículo primero aceptó como valor ejecutado \nla suma de DOSCIENTOS SESENTA Y DOS MILLONES NOVECIENTOS \nOCHENTA Y CUATRO MIL CIENTO SESENTA Y NUEVE CON TREINTA Y OCHO \nCENTAVOS ($262.984.169,38)\nDe manera simultánea la Autoridad Nacional acogiendo la petición de la Sociedad \nEQUION ENERGÍA LIMITED relacionada con la asignación de rubros de la \ninversión forzosa de no menos del 1% al expediente LAM1464, dio trámite a la \n\nResolución No. 002053       Del 18 SEP. 2024          Hoja No. 16 de 20\n“POR LA CUAL SE RESUELVE UN RECURSO DE REPOSICIÓN”\nPágina 16 de 20\ncomunicación con radicación 20236200486772 del 16 de agosto de 2023, a través \nde la cual  la Sociedad HOCOL S.A. titular del instrumento de manejo y control  del \nproyecto “Niscota E”  adjuntó la comunicación con radicación 20236200150742 del \n26 de mayo de 20231; en consecuencia, respetando el poder dispositivo de la \nSociedad EQUION ENERGÍA LIMITED, mediante Concepto Técnico  4594 del 2 de \njulio de 2024, acogido mediante el Acta No. 451 del 28 de junio de 2024, se realizó \nel balance de la inversión forzosa de no menos del 1% del proyecto “Niscota E”, en \nel sentido de aplicar el valor solicitado por la Sociedad recurrente, destacando que \ndicho balance no ha sido acogido mediante Resolución.\nAhora bien, luego de decantar los hechos que dieron lugar a la decisión que hoy se \nrecurre, se tiene, que a la fecha no existe dentro de los expedientes LAM1464 y \nLAM0226 acto administrativo ejecutoriado que acoja el Balance de la inversión \nforzosa de no menos del 1% para los referidos proyectos; en este sentido, reiterando \nel poder dispositivo que la asiste a la Sociedad EQUION ENERGÍA LIMITED con \nrelación a la destinación de los montos que exceden la liquidación de la \nprenombrada obligación y atendiendo que la Sociedad mediante comunicación con \nradicación 20246200933042 del 16 de agosto de 2024 desistió de la petición inicial \ncontenida en el comunicación con radicación 20236200150742 del 26 de mayo de \n2023 y que dicha decisión también fue adjuntada al expediente LAM1464 mediante \ncomunicación con radicado 20246200949262 del 22 de agosto de 2024, concluye \nla Autoridad Nacional, que no obra razón de interés público para no aceptar el \ndesistimiento presentado por la Sociedad.\nAhora bien, dado que en la comunicación con radicación  20246200933042 del 16 \nde agosto de 2024, la Sociedad modula la pretensión del recurso de reposición, en \nel sentido de que se aplique el saldo de los recursos de la inversión forzosa de no \nmenos del 1% a favor del proyecto “Niscota E”, considera la Autoridad Nacional que \nen virtud de los principios de eficacia y economía consagrados en los numeral 11 y \n12 del artículo tercero de la Ley 1437 del 18 de enero de 2011, la solicitud es \njurídicamente procedente como quiera, que es una decisión que depende \nexclusivamente de la autonomía de la voluntad de la Sociedad EQUION ENERGÍA \nLIMITED; sin embargo, esta petición será resuelta  en el expediente LAM1464.\nClaro lo anterior, la Autoridad Nacional repondrá el acto administrativo recurrido en \nel sentido de modificar el artículo primero en lo relacionado con el monto aceptado \ncomo ejecutado; a su vez, de manera oficiosa modificará el parágrafo primero del \n1 EQUION ENERGÍA LIMITED titular del instrumento de manejo y control del proyecto “Prospecto \nTacaré” solicitó la asignación de sumas ejecutadas en cumplimiento de la obligación de inversión \nforzosa de no menos del 1%  a favor de la  proyecto “Niscota E”  (Expediente LAM1464) cuyo  titular \nes la Sociedad HOCOL S.A,  en virtud de acuerdos internos según los cuales EQUION ENERGÍA \nLIMITED está obligada a responder por la obligación de inversión forzosa de no menos del 1% del \nproyecto “Niscota E”;  conforme a lo anterior la Sociedad HOCOL S.A  mediante comunicación con \nradicación 20236200486772 del 16 de agosto de 2023 adjuntó copia de la comunicación con \nradicación 20236200150742 del 26 de mayo de 2023 a través del cual se da alcance al informe de \navance de la inversión forzosa de no menos del 1% del proyecto “Niscota E”.\n\nResolución No. 002053       Del 18 SEP. 2024          Hoja No. 17 de 20\n“POR LA CUAL SE RESUELVE UN RECURSO DE REPOSICIÓN”\nPágina 17 de 20\nartículo segundo asociado al balance de la inversión forzosa de no menos del 1%,  \ny revocará el artículo tercero como quiera que con la aceptación del valor de \nTRESCIENTOS TREINTA MILLONES OCHOCIENTOS NOVENTA Y DOS MIL \nCIENTO VEINTISEIS PESOS CON VEINTIDOS CENTAVOS ($330.892.126,22), \nfenece la referida obligación.\nEn consecuencia, la Autoridad Nacional modificará el contenido del artículo primero \ny del parágrafo primero del artículo segundo y revocará el artículo tercero de la \nResolución 768 del 29 de abril de 2024, tal y cómo se señalará en la parte resolutiva \ndel presente acto administrativo.\nEn mérito de lo expuesto, \nRESUELVE:\nARTÍCULO PRIMERO. MODIFICAR el contenido del artículo primero de la \nResolución 768 del 29 de abril de 2024, de conformidad con lo expuesto en la parte \nmotiva del presente acto administrativo, el cual quedará de la siguiente manera:\n“(…)”\nARTÍCULO PRIMERO. ACEPTAR como ejecutado el valor de TRESCIENTOS \nTREINTA MILLONES OCHOCIENTOS NOVENTA Y DOS MIL CIENTO \nVEINTISEIS PESOS CON VEINTIDOS CENTAVOS ($330.892.126,22), con cargo \na la obligación de la inversión forzosa de no menos del 1% para el proyecto \n“Prospecto Tacaré”, por la compra del predio Alta Mira, ubicado en la vereda \nTamuría del Municipio de Nunchía (Casanare) y del predio El Alcaraván, ubicado \nen la vereda Cofradía del Municipio de Nunchía (Casanare).\n“(…)”\nARTÍCULO SEGUNDO. MODIFICAR el contenido del parágrafo primero del artículo \nsegundo de la Resolución 768 del 29 de abril de 2024, de conformidad con lo \nexpuesto en la parte motiva del presente acto administrativo\n“(…)”\nARTÍCULO SEGUNDO. NO ACEPTAR los montos asociados a la actividad \n“Evaluación Jurídica” como imputables a la obligación de la inversión forzosa de no \nmenos del 1% del proyecto “Prospecto Tacaré”.\nPARÁGRAFO PRIMERO. El balance de la inversión forzosa de no menos del 1% \ndel proyecto “Prospecto Tacaré” es el siguiente:\nBALANCE DE INVERSIÓN FORZOSA DE NO MENOS DEL 1%\nLiquidación \nde \nla \ninversión \nforzosa de no menos del 1% \nactualizada (Artículo 321)\n$ 330.892.126,22\n\nResolución No. 002053       Del 18 SEP. 2024          Hoja No. 18 de 20\n“POR LA CUAL SE RESUELVE UN RECURSO DE REPOSICIÓN”\nPágina 18 de 20\nValor ejecutado de la inversión \nforzosa de no menos del 1%-\n$ 330.892.126,22\nValor en ejecución de la inversión\nforzosa de no menos del 1%-\n$0\nValor de la inversión forzosa de \nno\nmenos del 1% por ejecutar\n$0\n“(…)”\nARTÍCULO TERCERO. REVOCAR el contenido del artículo tercero de la \nResolución 768 del 29 de abril de 2024, de conformidad con lo expuesto en la parte \nmotiva del presente acto administrativo. \nARTÍCULO CUARTO. Notificar el presente acto administrativo al representante \nlegal, o al apoderado debidamente constituido o a la persona debidamente \nautorizada de la Sociedad EQUION ENERGÍA LIMITED de conformidad con lo \ndispuesto en los artículos 67 y siguientes de la Ley 1437 de 2011.\nPARÁGRAFO. En el evento en que el titular de la licencia o el permiso, según el \ncaso, sea una persona natural que se acoja al proceso de insolvencia regulado por \nlas normas vigentes, o se trate de una Sociedad comercial o de una sucursal de \nSociedad extranjera que entre en proceso de disolución o régimen de insolvencia \nempresarial o liquidación regulados por las normas vigentes, informará \ninmediatamente de esta situación a la Autoridad Nacional, con fundamento, entre \notros, en los artículos 8, 58, 79, 80, 81, 95 numeral 8 de la Constitución Política de \n1991, en la Ley 43 de 1990, en la Ley 222 de 1995, en la Ley 1333 de 2009 \nmodificada por la Ley 2387 del 25 de julio de 2024  y demás normas vigentes y \njurisprudencia aplicable. \nAdicional a la obligación de informar a la Autoridad Nacional de tal situación, el \ntitular de la licencia o permiso aprovisionará contablemente las obligaciones \ncontingentes que se deriven de la existencia de un procedimiento ambiental \nsancionatorio conforme con el artículo 40 de la Ley 1333 de 2009 modificada por la \nLey 2387 del 25 de julio de 2024   o la norma que la adicione, modifique o derogue.\nARTÍCULO QUINTO. Comunicar el presente acto administrativo a Corporación \nAutónoma Regional de la Orinoquía (CORPORINOQUÍA), a la Alcaldía del \nMunicipio de Nunchía Departamento de Casanare para su conocimiento y fines \npertinentes.\nARTÍCULO SEXTO. Publicar la presente Resolución en la Gaceta Ambiental de la \nAutoridad Nacional de Licencias Ambientales (ANLA) de conformidad con lo \nseñalado en el artículo 71 de la Ley 99 del 22 de diciembre de 1993.\n\nResolución No. 002053       Del 18 SEP. 2024          Hoja No. 19 de 20\n“POR LA CUAL SE RESUELVE UN RECURSO DE REPOSICIÓN”\nPágina 19 de 20\nARTÍCULO SÉPTIMO. Contra el presente acto administrativo no procede recurso \nalguno, de conformidad con lo establecido en el artículo 87 del Código de \nProcedimiento Administrativo y de lo Contencioso Administrativo.\nNOTIFÍQUESE, COMUNÍQUESE, PUBLÍQUESE Y CÚMPLASE\nDado en Bogotá D.C., a los 18 SEP. 2024\nEDILBERTO PENARANDA CORREA\nASESOR\nCARMEN SUSANA CAMACHO GUALDRON\nCONTRATISTA\nANDREA DEL PILAR SANABRIA DEL RIO\nCONTRATISTA\nExpediente No. LAM0226\nConcepto Técnico 6299 del 28 de agosto de 2024\nFecha:\n17 de septiembre de 2024\nProceso No.: 20241000020534\nNota: Este es un documento electrónico generado desde los Sistemas de Información de la ANLA. El original reposa en los \narchivos digitales de la Entidad\n\nResolución No. 002053       Del 18 SEP. 2024          Hoja No. 20 de 20\n“POR LA CUAL SE RESUELVE UN RECURSO DE REPOSICIÓN”\nPágina 20 de 20\n"
}