{
  "fuente": "ANLA_GACETA",
  "numero_resolución": "RESOLUCIÓN N° 002305",
  "fecha_resolución": "2024-06-28",
  "nombre_proyecto": "proyecto uso",
  "ubicación": "departamento del Meta.",
  "empresa": "así las cosas",
  "numero_expediente": "LAM2965",
  "radicados": [
    "20236200677722",
    "20246200813082",
    "2023069266",
    "2018186892",
    "2022055911",
    "2021223520"
  ],
  "descripcion": "Por el cual se resuelve un recurso de reposición interpuesto contra la Resolución 1303 del 28 de junio de 2024",
  "tipos_infraccion": [
    "Vertimientos",
    "Manejo de aguas",
    "Tala o afectación de bosques",
    "Incumplimiento del PMA"
  ],
  "pdf_id": "48465",
  "file_name": "ANLA_48465.pdf",
  "texto_completo": "AUTORIDAD NACIONAL DE LICENCIAS \nAMBIENTALES\n- ANLA –\nRESOLUCIÓN N° 002305\n(21 OCT. 2024)\nPágina 1 de 39\n “Por el cual se resuelve un recurso de reposición interpuesto contra la \nResolución 1303 del 28 de junio de 2024”\nEL ASESOR CÓDIGO 1020 GRADO 15 DE LA DIRECCION GENERAL DE LA \nAUTORIDAD NACIONAL DE LICENCIAS AMBIENTALES – ANLA\nEn uso de sus facultades legales asignadas en la Ley 99 de 1993, la Ley 1437 de \n2011, el Decreto-ley 3573 del 27 de septiembre de 2011, el Decreto 1076 del 26 \nde mayo de 2015, el Decreto 376 de 11 de marzo de 2020 del Ministerio de \nAmbiente y Desarrollo Sostenible, las Resoluciones 669 del 14 de abril de 2020, \n1957 del 5 de noviembre de 2021 y 2795 del 25 de noviembre de 2022 de la \nAutoridad Nacional de Licencias Ambientales y,\nCONSIDERANDO:\nQue mediante la Resolución 581 del 29 de septiembre de 1992, el entonces \nINDERENA otorgó licencia ambiental para la explotación petrolera de los campos \nApiay-Ariari, Libertad, Reforma y Suria, localizado en los municipios de Villavicencio \ny Acacias en el departamento del Meta.\nQue por medio de la Resolución 137 del 11 de febrero de 2002, el Ministerio de \nAmbiente, Vivienda y Desarrollo Territorial, hoy Ministerio de Ambiente y Desarrollo \nSostenible-MADS, en adelante el Ministerio, estableció un Plan de Manejo \nAmbiental a la Empresa Colombiana de Petróleos ECOPETROL., para el desarrollo \nde los campos del área de la gerencia Llanos, Bloque Apiay - Ariari, compuesto por \nlos campos Apiay, Suria y Reforma Libertad, localizado en los municipios de \nAcacias, San Carlos de Guaroa y Villavicencio, en el departamento del Meta.\nQue por medio de la Resolución 1048 del 15 de noviembre de 2002, el Ministerio \naclaró la Resolución 137 de 2002, en el sentido de establecer el estado actual del \npozo Apiay 10 y la estación Glicol.\n\nResolución No. 002305       Del 21 OCT. 2024          Hoja No. 2 de 39\n“Por el cual se resuelve un recurso de reposición interpuesto contra la Resolución 1303 del \n28 de junio de 2024”\nPágina 2 de 39\nQue mediante Resolución 782 del 18 de septiembre de 2012, la Autoridad Nacional \nde Licencias Ambientales ANLA, en adelante esta Autoridad Nacional, modificó la \nResolución 137 del 11 de febrero de 2002, aclarada por la Resolución 1048 del 15 \nde noviembre de 2002, a través de la cual se estableció un Plan de Manejo \nAmbiental, a la sociedad ECOPETROL S.A, para el desarrollo de los Campos del \nÁrea de la Gerencia Llanos, Área Bloque Apiay – Ariari, compuesto por los Campos \nApiay Suria y Reforma Libertad, y autorizó el desarrollo de nuevas actividades de \nexplotación y estrategias de desarrollo.\nQue a través de la Resolución 324 del 11 de abril de 2013, esta Autoridad Nacional \naclaró la Resolución 782 del 18 de septiembre de 2012, estableciendo la obligación \nde aislar térmicamente las líneas de flujo en los puntos en donde los niveles \nfreáticos sean altos.\nQue por medio de la Resolución 665 del 4 de julio de 2013, esta Autoridad Nacional \nmodificó el artículo quinto de la Resolución 137 del 11 de febrero de 2002, en el \nsentido de adicionar obligaciones del Plan de Manejo Ambiental.\nQue mediante Resolución 666 del 4 de julio de 2013, esta Autoridad Nacional \nmodificó el artículo quinto de la Resolución 137 del 11 de febrero de 2002, en el \nsentido de adicionar obligación relativa a ordenar una compensación por los \nimpactos generados por la adecuación del derecho vial para la línea de conducción \nde aguas residuales industriales.\nQue por medio de la Resolución 1267 del 11 de diciembre de 2013, esta Autoridad \nNacional resolvió recurso de reposición modificando el artículo tercero de la \nResolución 665 del 04 de julio de 2013 en el sentido de requerir a la sociedad para \nque realice el análisis de calidad del suelo del lecho y de la ribera del caño Quenane.\nQue mediante la Resolución 568 del 3 de junio de 2016, esta Autoridad Nacional \nmodificó la Resolución 782 del 18 de septiembre de 2012 en lo relacionado con el \nestado actual del pozo Apiay 10 y la estación Glicol.\nQue a través de la Resolución 1604 del 14 de agosto de 2019, esta Autoridad \nNacional modificó el artículo cuarto de la Resolución 782 del 18 de septiembre de \n2012, en lo relacionado con el plan de compensación forestal.\nQue por medio de la Resolución 340 del 28 de febrero de 2020, esta Autoridad \nNacional resolvió recurso de reposición contra la Resolución 1604 del 14 de agosto \nde 2019 relacionado con la aprobación de la implementación del proyecto uso \nsostenible del sistema silvopastoril y ajuste de las especies definidas para los dos \ntipos de arreglo (agroforestal tipo I Cacao-Forestal y agroforestal tipo II Cacao- \nPlátano - Forestales).\n\nResolución No. 002305       Del 21 OCT. 2024          Hoja No. 3 de 39\n“Por el cual se resuelve un recurso de reposición interpuesto contra la Resolución 1303 del \n28 de junio de 2024”\nPágina 3 de 39\nQue a través de la Resolución 1859 del 30 de agosto de 2022, la Autoridad Nacional \nde Licencias Ambientales modificó un Plan de Manejo Ambiental.\nQue mediante la Resolución 2711 del 15 de noviembre de 2022, esta Autoridad \nNacional resolvió el recurso de reposición interpuesto contra la Resolución 1859 del \n30 de agosto de 2022 modificando en el sentido de autorizar la construcción de \ninfraestructura y actividades, y las obligaciones del plan de manejo especifico y \nestableciendo nuevas obligaciones.\nQue a través comunicación con radicado 20236200677722 del 29 de septiembre de \n2023, la Sociedad ECOPETROL presentó el Informe de Cumplimiento Ambiental \nICA No. 33 correspondiente al periodo enero a junio del 2023.\nQue mediante Resolución 1303 del 28 de junio de 2024, esta Autoridad Nacional \naprobó la implementación de los proyectos de uso sostenible – sistemas \nagroforestales, en las áreas presentadas por la sociedad ECOPETROL S.A, \nmediante comunicación con radicado ANLA 20236200677722 del 29 de septiembre \nde 2023.\nQue a través de la comunicación con radicado ANLA 20246200813082 del 18 de \njulio de 2024, la sociedad ECOPETROL S.A presentó recurso de reposición contra \nlos artículos tercero y cuarto de la Resolución 1303 del 28 de junio de 2024.\nDE LA COMPETENCIA DE LA AUTORIDAD NACIONAL DE LICENCIAS \nAMBIENTALES\nEl Decreto Ley 3573 del 27 de septiembre de 2011, creó la Autoridad Nacional de \nLicencias Ambientales - ANLA, en los términos del artículo 67 de la Ley 489 de \n1998, con autonomía administrativa y financiera, sin personería jurídica, la cual hará \nparte del Sector Administrativo de Ambiente y Desarrollo Sostenible. \nDe acuerdo con la función establecida en el numeral 1 del artículo 3o del citado \nDecreto Ley 3573 del 27 de septiembre de 2011, a la Autoridad Nacional de \nLicencias Ambientales-ANLA le corresponde otorgar o negar las licencias, permisos \ny tramites ambientales de su competencia, de conformidad con la ley y los \nreglamentos y, consecuentemente, pronunciarse sobre las correspondientes \nmodificaciones a dichos instrumentos de manejo y control ambiental. \nA través del Decreto 376 del 11 de marzo de 2020, modificó la estructura de la \nAutoridad Nacional de Licencias Ambientales – ANLA, y estableció en el artículo \nsegundo las funciones del Despacho de la Dirección General de la Autoridad \nNacional de Licencias Ambientales. \nA través de la Resolución 669 del 14 de abril de 2020 se nombró al servidor público \nEDILBERTO PEÑARANDA CORREA, en el empleo de libre nombramiento y \n\nResolución No. 002305       Del 21 OCT. 2024          Hoja No. 4 de 39\n“Por el cual se resuelve un recurso de reposición interpuesto contra la Resolución 1303 del \n28 de junio de 2024”\nPágina 4 de 39\nremoción de Asesor, código 1020, grado 15, adscrito a la Dirección General de la \nplanta global de la ANLA.\nA través de la Resolución 1957 del 5 de noviembre de 2021 se adoptó el Manual \nEspecífico de Funciones y de Competencias Laborales para los empleos de la \nplanta de personal de la Autoridad Nacional de Licencias Ambientales - ANLA. \nMediante el numeral 15 del artículo primero de la Resolución 02795 del 25 de \nnoviembre de 2022, “Por la cual se delegan unas funciones y se dictan otras \ndisposiciones”, se delegó en el Asesor Código 1020 Grado 15 del Despacho del \nDirector General, la función de resolver los recursos de reposición interpuestos \ncontra los actos administrativos que se emiten en cumplimiento de las funciones \nasignadas.\nTeniendo en cuenta lo anterior, es el Asesor del Despacho del Director General de \nla Autoridad Nacional de Licencias Ambientales el competente para suscribir la \npresente resolución.\nFUNDAMENTOS CONSTITUCIONALES Y LEGALES\nEl procedimiento para la presentación y decisión de recursos contra los actos \nadministrativos, se encuentra reglado en el Código de Procedimiento Administrativo \ny de lo Contencioso Administrativo - Ley 1437 de 2011 -, en los artículos 74 y \nsiguientes, que señalan:\n“Artículo 74. Recursos contra los actos administrativos. – Por regla general, \ncontra los actos definitivos procederán los siguientes recursos:\n1. El de reposición, ante quien expidió la decisión para que la aclare, modifique, \nadicione o revoque.”\nFrente a la oportunidad y presentación del recurso de reposición, el artículo 76 del \nmismo Código, señala:\n“Artículo 76. Los recursos de reposición y apelación deberán interponerse por \nescrito en la diligencia de notificación personal, o dentro de los diez (10) días \nsiguientes a ella, o a la notificación por aviso, o al vencimiento del término de \npublicación, según el caso. Los recursos contra los actos presuntos podrán \ninterponerse en cualquier tiempo, salvo en el evento en que se haya acudido ante \nel juez.\nLos recursos se presentarán ante el funcionario que dictó la decisión (…)”\n\nResolución No. 002305       Del 21 OCT. 2024          Hoja No. 5 de 39\n“Por el cual se resuelve un recurso de reposición interpuesto contra la Resolución 1303 del \n28 de junio de 2024”\nPágina 5 de 39\nAdemás del plazo para el ejercicio de los recursos, el artículo 77 del precitado \nCódigo fija los requisitos formales que deben cumplir para su interposición, así:\n“Artículo 77. Por regla general los recursos se interpondrán por escrito que no \nrequiere de presentación personal si quien lo presenta ha sido reconocido en la \nactuación. Igualmente, podrán presentarse por medios electrónicos.\nLos recursos deberán reunir, además, los siguientes requisitos:\n1.Interponerse dentro del plazo legal, por el interesado o su representante o \napoderado debidamente constituido.\n2.Sustentarse con expresión concreta de los motivos de inconformidad.\n3.Solicitar y aportar las pruebas que se pretende hacer valer.\n4.Indicar el nombre y la dirección del recurrente, así como la dirección electrónica si \ndesea ser notificado por este medio.\nSólo los abogados en ejercicio podrán ser apoderados. Si el recurrente obra como \nagente oficioso, deberá acreditar la calidad de abogado en ejercicio, y prestar la \ncaución que se le señale para garantizar que la persona por quien obra ratificará su \nactuación dentro del término de dos (2) meses.\nSi no hay ratificación se hará efectiva la caución y se archivará el expediente. Para \nel trámite del recurso el recurrente no está en la obligación de pagar la suma que el \nacto recurrido le exija. Con todo, podrá pagar lo que reconoce deber”.\nAtendiendo a lo descrito con relación a los requisitos y condiciones que deben \nobservarse al interponer el recurso de reposición, en el presente caso, se puede \nconcluir lo siguiente:\n1. El recurso se interpuso por escrito ante la Autoridad Nacional de Licencias \nAmbientales, por lo que se cumple este requisito.\n2. En cuanto a la oportunidad legal para interponer el recurso de reposición, se \ntiene que la notificación de la Resolución 1303 del 28 de junio de 2024, a la \nsociedad ECOPETROL S.A, se realizó por medio de correo electrónico el día 03 \nde julio de 2024 y quedó surtida el día hábil siguiente; atendiendo a los diez (10) \ndías hábiles, que concede la Ley 1431 de 2011 para interponer el recurso, \ncontados a partir del día siguiente de la notificación, tal término vencía el día 18 \nde julio de 2024, teniendo en cuenta el Decreto Nacional 880 de 2024, por medio \ndel cual se establece el día 15 de julio de 2024, como “Día cívico de la conciencia \ny celebración deportiva” tomando este día cómo no hábil; así las cosas, fue \npresentado el día 18 de julio de 2024, encontrándose dentro del término \nlegalmente establecido para tal fin. Por lo tanto, se concluye que el mismo fue \npresentado dentro de la oportunidad legal.\n\nResolución No. 002305       Del 21 OCT. 2024          Hoja No. 6 de 39\n“Por el cual se resuelve un recurso de reposición interpuesto contra la Resolución 1303 del \n28 de junio de 2024”\nPágina 6 de 39\n3. En el escrito del recurso, la sociedad ECOPETROL S.A, expone de manera \nconcreta, los motivos de inconformidad frente a la Resolución 1303 del 8 de junio \nde 2024. En esa medida, este requisito se cumple.\n4. Asimismo, es interpuesto por la apoderada general de la sociedad ECOPETROL \nS.A., según consta en el certificado de existencia y representación legal inscrito \nen la cámara de comercio de Bogotá sede virtual del 02 de julio de 2024, \nmediante Escritura Pública No. 1585 del 4 de junio de 2021, otorgada en la \nNotaría 39 de Bogotá D.C, registrada en esta Cámara de Comercio el 23 de Julio \nde 2021, con el No. 00045669 del libro V, la persona jurídica confirió poder \ngeneral, amplio y suficiente a Diana Carolina Plata Calderón, identificada con la \ncédula de ciudadanía No. 1.121.858.695 expedida en Villavicencio (Meta), con \nTarjeta Profesional de abogada número 216.326 expedida por el Consejo \nSuperior de la Judicatura, el cual la faculta para  recurrir la Resolución 1303 del \n8 de junio de 2024. En esa medida, se encuentra legitimada para interponer el \nrecurso.\n5. Por último, la dirección de notificaciones del recurrente se encuentra \ndebidamente registrada y es inequívoca su individualización, por lo tanto, se \ntiene por cumplido este requisito.\nSiendo ello así, al verificarse el cumplimiento de los requisitos legales establecidos \nen la normatividad vigente para la admisibilidad del recurso de reposición, se \nprocederá al análisis de fondo de los motivos de inconformidad del recurrente tal y \ncomo se expone a continuación.\nCONSIDERACIONES \nTÉCNICAS \nDE \nLA \nAUTORIDAD \nNACIONAL \nDE \nLICENCIAS AMBIENTALES FRENTE AL RECURSO DE REPOSICIÓN \nINTERPUESTO POR LA SOCIEDAD ECOPETROL S.A\nEsta Autoridad, analizó los argumentos expuestos por el recurrente en su escrito de \nrecurso para dar respuesta y adoptar decisión de fondo frente al pronunciamiento \nemitido con la Resolución 1303 del 28 de junio de 2024, previo análisis de los \nmotivos de inconformidad argumentados por la sociedad ECOPETROL S.A.\nSe precisa que en el escrito de recurso presentado por la sociedad ECOPETROL \nS.A, mediante comunicación con radicado 20246200813082 del 18 de julio de 2024, \nse observaron las peticiones y argumentos recurridos. \nA continuación, se procede a desarrollar el recurso de conformidad a lo recurrido \npor el titular del instrumento de manejo y control ambiental, para lo cual se indicarán: \nA. La obligación recurrida, B. La petición y los argumentos expuestos por el titular \ndel instrumento de manejo, y C. las consideraciones de la Autoridad Nacional de \nLicencias Ambientales con relación a las disposiciones recurridas. \n\nResolución No. 002305       Del 21 OCT. 2024          Hoja No. 7 de 39\n“Por el cual se resuelve un recurso de reposición interpuesto contra la Resolución 1303 del \n28 de junio de 2024”\nPágina 7 de 39\nA. Disposición recurrida - Artículo Tercero\n“ARTÍCULO TERCERO. NO APROBAR las áreas designadas a las acciones de \npreservación presentadas por la sociedad ECOPETROL S.A, mediante comunicación \ncon radicado ANLA 20236200677722 del 29 de septiembre de 2023 (MAG del ICA 33), \npara un total de 54,98 ha distribuidas en los predios Canaima, Marsella, San Rafael, \nVilla Andrea, Montebello, San Sebastián, La Esperanza y La Esmeralda, por las \nconsideraciones expuestas en el presente acto administrativo.”\nB. Petición de la recurrente \nPrimera solicitud:\na.\nREVOCAR el artículo tercero de la Resolución 001303 de 28 de junio de 2024, y \nRECONOCER las áreas implementadas con acciones de preservación localizadas \nen los predios Canaima (1,07 ha), San Rafael (1,2 ha), Villa Andrea (3 ha), La \nEsperanza (0,41 ha) y La Esmeralda (2,37 ha), ubicados en las veredas Quebraditas \ndel municipio de Acacías, Santa Rosa, Peralonso, La Llanerita y Puerto Tembleque \ndel municipio de Villavicencio, respectivamente.\nA. Disposición recurrida – Artículo Cuarto\n“(…)\nARTICULO CUARTO: Requerir a la sociedad ECOPETROL S.A. para que en un plazo máximo \nde seis (6) meses contados a partir de la notificación del presente acto administrativo presente \nnuevas áreas para la ejecución de las acciones de preservación, que den cumplimiento al \nDONDE COMPENSAR de acuerdo con lo establecido en el Manual de compensaciones del \ncomponente biótico (MADS, 2018) de acuerdo con los lineamientos establecidos en el Manual \ndel Componente Biótico adoptado mediante Resolución 256 del 22 de febrero de 2028 “Por la \ncual se adopta la actualización del Manual de Compensaciones Ambientales del Componente \nBiótico” y a los requerimientos del Artículo quinto de la Resolución 1604 del 14 de agosto de \n2019”\n(…)”\nB. Petición de la recurrente\nSegunda solicitud:\nb. SEGUNDO: REVOCAR el artículo cuarto de la Resolución 1303 de 28 de junio de 2024\nArgumentos del recurrente\n“(…)\n- Los artículos tercero y cuarto de la Resolución 1303 de 28 de junio de \n2024 vulneran el principio de confianza legitima: \n\nResolución No. 002305       Del 21 OCT. 2024          Hoja No. 8 de 39\n“Por el cual se resuelve un recurso de reposición interpuesto contra la Resolución 1303 del \n28 de junio de 2024”\nPágina 8 de 39\nA través de las disposiciones enunciadas en el presente título, la autoridad ambiental \ndecide no aprobar las áreas seleccionadas e identificadas por Ecopetrol S.A. en el \nradicado No. 20236200677722 de 29 de septiembre de 2023 para llevar a cabo \nacciones de preservación (predios Canaima, Marsella, San Rafael, Villa Andrea, \nMontebello, San Sebastián, La Esperanza y La Esmeralda), y, como consecuencia \nde ello requiere la presentación de nuevas áreas para llevar a cabo las mencionadas \nactividades. \nSea lo primero indicar que la Autoridad Ambiental mediante Resolución 0560 de 21 \nde marzo de 2023, en el numeral 8 del artículo segundo, requiere a Ecopetrol S.A. \niniciar las actividades de la fase operativa en un plazo máximo de seis (6) meses \nposteriores a la generación de los impactos residuales que requieren ser \ncompensados, \niniciando \ncon \nactividades \nefectivas \nde \ncompensación \ncorrespondientes a las propuestas en las fases III (Operativa-Asistencia Técnica- \nMonitoreo) y IV (Operativa– Implementaciones), lo anterior relacionado con la \ncompensación del medio biótico para el Campo de Producción 50K. \nRecordemos que la precitada resolución fue expedida en el marco del acogimiento \na la Resolución 256 de 2018, modificada por la Resolución 0370 de 2021, actos \nadministrativos que establecen que las áreas respecto al Dónde Compensar, son \npresentadas en el marco del seguimiento y ejecución del Plan, condición que para \nla Resolución 1604 de 14 de agosto de 2019 se surtió oportunamente con la \npresentación de los informes de avance de la medida No. 05, 06, 07 y 08 adjuntos \nen los ICA No 31, 32, 33 y 34, respectivamente. \nDe otra parte, es importante mencionar que con ocasión al acogimiento a la \nResolución 256 de 2018, Ecopetrol S.A. mediante radicado No. 2018186892-1-000 \nde 31 de diciembre de 2018 presentó plan de compensación para el medio biótico \npara el proyecto “Pozos de Desarrollo Apiay A y Suria A y B y Libertad” del Bloque \nApiay, en cuyo contenido presentó el cronograma de actividades, el cual contempla \nlas diferentes fases, con su respectivo plazo de ejecución:\nFASE I. PRE-OPERATIVA – DIAGNÓSTICO: \n1. Procesos contractuales \n2. Habilitación del Contrato Asistencia Técnica para la Selección de \nPredios y Beneficiarios \n3.Habilitación \ndel \nContrato \nAsistencia \nTécnica \nAgroforestal \n4. Habilitación del Contrato Asistencia Técnica Silvopastoril \n5. Habilitación del Contrato de suministro de Insumos agropecuarios \n6. Habilitación de Contratos de Implementaciones \n7. Selección de áreas estratégicas a escala de paisajes para la \nimplementación proyectos de compensación. \n8. Ajuste de plan de compensación acorde a requerimientos de \nAutoridad Ambiental \n9. Construcción de metodología para la selección de Áreas a escala \nde paisajes 10.Selección de áreas a escala de paisajes para el núcleo \nPiedemonte Norte \n11. Definición de criterios para la priorización de los paisajes a \nintervenir \n\nResolución No. 002305       Del 21 OCT. 2024          Hoja No. 9 de 39\n“Por el cual se resuelve un recurso de reposición interpuesto contra la Resolución 1303 del \n28 de junio de 2024”\nPágina 9 de 39\n12. Identificación de biomas a compensar por paisaje priorizado\nFASE II. OPERATIVA - DIAGNÓSTICO \n1. Selección de predios y participantes (Acuerdos Voluntarios de \nConservación) \n2. Sesiones de trabajo con Entes Territoriales \n3. Reuniones de convocatorias masivas a nivel de municipios \n4. Reuniones veredales en los Paisajes priorizados \n5. Esquema de visitas para concertación y formalización de Acuerdos \nVoluntarios de Conservación \n6. Creación y actualización de GDB \nFASE III. OPERATIVA -ASISTENCIA TÉCNICA- MONITOREO \n1. Definición acciones de conservación \n2. Formalización de Acuerdos de Conservación (validación \ncondiciones de Acuerdo – Diseño predial) \n3. Selección de enfoque de restauración \n4. Diseño de técnicas de restauración \n5. Monitoreo de Indicadores Bióticos y Socio-económicos \n6. Creación y actualización de GDB \nAsistencia Técnica Silvopastoril \n1. Validación del diseño de siembra, métodos obtención de insumos, \ndelimitación de áreas \n2. Asistencia Técnica en predio primer año \n3. Asistencia Técnica en predio a partir del segundo año \n4. Talleres teórico – prácticos \n5. Elaboración de plan de monitoreo \n6. Monitoreo de Indicadores Bióticos y Socio-económicos \n7. Creación y actualización de GDB \nAsistencia Técnica Agroforestal \n1. Validación del diseño de siembra, métodos obtención de insumos, \ndelimitación de áreas \n2. Asistencia Técnica en predio primer año \n3. Asistencia Técnica en predio a partir del segundo año \n4. Talleres teórico – prácticos \n5. Elaboración de plan de monitoreo \n6. Monitoreo de Indicadores Bióticos y Socio-económicos 7. Creación \ny actualización de GDB\nFASE IV. OPERATIVA - IMPLEMENTACIONES \n1. Adecuación, mecanización, fertilización, siembra y construcción de \ncercado. Prácticas para la maduración. Implementación de acciones \nde conservación \n2. Aislamiento: Delimitación de áreas de conservación \n3. Implementación de técnicas de restauración \nImplementación Modelos Silvopastoriles \n\nResolución No. 002305       Del 21 OCT. 2024          Hoja No. 10 de 39\n“Por el cual se resuelve un recurso de reposición interpuesto contra la Resolución 1303 del \n28 de junio de 2024”\nPágina 10 de 39\n1. Preparación de terreno para la siembra \n2. Establecimiento de Especies Forestales\n3. Mantenimientos Parciales \n4. Mantenimientos Completos \nImplementación Modelos Agroforestales \n1. Preparación de terreno para la siembra \n2. Establecimiento de Especies Forestales \n3. Mantenimientos Parciales \n4. Mantenimientos Completos \nCierre de la obligación\nEn consideración con lo anterior, el plan de compensación presentado fue aprobado \nmediante Resolución 1604 de 14 de agosto de 2019, el cual consideró que las \netapas propuestas son acordes con las actividades planteadas y tiene su orden \nlógico. Sumado a esto, en el numeral 5 del artículo décimo primero del acto \nadministrativo en comento la ANLA requirió ajustar el cronograma incluyendo los \nenfoques de preservación y restauración a implementar, el cual debía estar ajustado \nal cumplimiento de los indicadores, metas y objetivos enmarcados en lo dispuesto \nen el Plan Nacional de Restauración (MADS, 2015) y adicionalmente, las actividades \ndeben estar discriminadas bien sea en etapas y/o fases de manera coherente. Por \nlo que, Ecopetrol S.A. en obediencia al requerimiento, presentó en el ICA No 27 los \najustes correspondientes. \nDe otra parte, al no aprobar las áreas concertadas y formalizadas para \nimplementación de acciones de preservación, se estarían desconociendo las \ngestiones desarrolladas por la empresa desde la fase I hasta la fase IV, ya que, para \nllegar a las actividades de Aislamiento: Delimitación de áreas de conservación e \nimplementación de técnicas de restauración, debió surtirse previamente la selección \nde predios y participantes, la divulgación de la estrategia en el territorio del área de \ninfluencia de las áreas ecológicamente equivalentes, la caracterización biótica y el \ndiseño predial de los AVC suscritos, así como, el levantamiento de línea base \nbiótica, la toma y análisis de suelos y las demás actividades menores relacionadas; \nlo anterior con ocasión al cumplimiento de la compensación del medio biótico del \nBloque Apiay. \nAhora bien, en relación con la definición de las áreas, resulta conveniente recordar \nque con la orden de servicio No. 5675538 habilitada para llevar a cabo la selección \nde predios y participantes, se realizó la priorización de áreas para la búsqueda de \nparticipantes dentro de los cuatro (4) paisajes definidos en el núcleo Piedemonte \nNorte, a partir de un análisis espacial basado en algebra de mapas, teniendo en \ncuenta aspectos socioeconómicos y ambientales del territorio, con criterios como el \ntamaño de los predios, amenazas naturales (fenómenos de remoción en masa, \navenidas torrenciales, inundación e incendio), conflictos y vocación de uso del suelo, \noferta hídrica, importancia hidrogeológica, diversidad de coberturas, fragmentación \nde la cobertura boscosa, entre otros. \nPosteriormente, se hizo un despliegue en el territorio que incluyó la divulgación del \nproyecto con comunidades, lideres, presidentes de JAC y entidades municipales, \n\nResolución No. 002305       Del 21 OCT. 2024          Hoja No. 11 de 39\n“Por el cual se resuelve un recurso de reposición interpuesto contra la Resolución 1303 del \n28 de junio de 2024”\nPágina 11 de 39\nseguidamente, la recepción y revisión de documentación de los postulados al \nproyecto complementado con un trabajo de campo robusto por parte del aliado \nSERAMBIENTE en donde se analizaba predio a predio el cumplimiento de los \nrequisitos entre ellos la verificación de áreas susceptibles a la conservación, \nvalidación de aptitud de uso del suelo para la implementación de incentivos, entre \notros aspectos técnicos y jurídicos que debieron ser juiciosamente analizados para \ndeterminar la viabilidad o no de los predios, a fin de continuar con la última fase en \ndonde se efectúa la caracterización ambiental de las áreas destinadas a la \nconservación, recuperación o preservación y la construcción conjunta con los \npropietarios o poseedores respecto al diseño predial participativo para la \nimplementación de los proyectos de usos sostenible, cuyas acciones quedan \nconcertadas y materializadas con la firma del Acuerdo de Conservación Voluntario. \nDurante la vigencia 2022, se logró la suscripción de ocho (8) acuerdos de \nconservación voluntarios, los cuales se asignaron a la compensación del medio \nbiótico del Bloque Apiay, información que fue remitida a la ANLA mediante el Informe \nNo. 6 de Núcleo Piedemonte Norte (Anexo ICA No. 32 entregado mediante radicado \n2023069266-1-000 de 31 de marzo de 2023). \nEn ese sentido, para la firma de estos acuerdos fue necesario surtir una serie de \netapas con una ruta de trabajo claramente definida, llegando a un nivel de detalle lo \nsuficientemente apropiado para la toma de decisiones y con una validación previa \nen terreno de todos los atributos ambientales, productivos y de conectividad de \npaisaje para la selección de un predio; por tal razón, para Ecopetrol S.A resulta \nincomprensible la postura de la Autoridad Ambiental de NO aprobar las acciones \nconcertadas para los 8 predios, toda vez que está desconociendo los lineamientos \nimpartidos en sus actos administrativos y está pasando por alto la evaluación \nrigurosa que realizó Ecopetrol S.A. a través de su aliado para lograr la suscripción y \nformalización del acuerdo de conservación voluntario, el cual evidentemente cumple \na cabalidad con los criterios que citan a continuación: \na.) Criterios establecidos para definición de áreas de conservación y \nselección de los predios. \nLa Autoridad Ambiental mediante la Resolución 1604 de 14 de agosto de 2019, \nartículo quinto, estableció entre otros, los siguientes criterios para establecer las \nacciones de conservación y realizar la selección de los predios:\n“ARTICULO QUINTO: Aprobar la implementación de las actividades de \nPreservación, presentadas por la sociedad ECOPETROL S.A., mediante \nescrito con radicación 2018186892-1-000 del 31 de diciembre de 2018, para \nel proyecto “Pozos de Desarrollo Apiay A y Suria A y B y Libertad” del Bloque \nApiay. \nPARAGRAFO: \nLa \nsociedad \nECOPETROL \nS.A. \npara \nla \nimplementación \nde \nlas \nactividades \nde \nPreservación, \ndeberá \ndar \ncumplimiento a la siguiente obligación en el próximo Informe de \nCumplimiento Ambiental – ICA, así como a las obligaciones establecidas en \nel Artículo Décimo Primero del presente acto administrativo: \n1. Presentar la caracterización del tipo de ecosistema, estructura, condición, \ncomposición y riqueza de especies, entre otros, a la escala más detallada \n\nResolución No. 002305       Del 21 OCT. 2024          Hoja No. 12 de 39\n“Por el cual se resuelve un recurso de reposición interpuesto contra la Resolución 1303 del \n28 de junio de 2024”\nPágina 12 de 39\nposible del área a compensar, lo cual deberá ser incluido como línea base \npara el seguimiento de los indicadores y el cumplimiento de los objetivos \nespecíficos, metas y alcance.\n2. Identificar aspectos tensionantes específicos del área propuesta y a partir \nde allí justificar la implementación de las actividades propuestas, así como la \nadicionalidad.” \nFinalmente, para Ecopetrol S.A. por ser una empresa de economía mixta, sujeta a \nverificación por parte de los órganos de control nacional, existe riesgo de detrimento \npatrimonial que se puede materializar al haber realizado actividades establecidas en \nel cronograma previamente aprobado en el plan de compensación mediante \nResolución 1604 de 14 de agosto de 2019. En este sentido, se informa que a la \nfecha se ha realizado una inversión de CUATROCIENTOS SESENTA Y SEIS \nMILLONES OCHOCIENTOS TREINTA Y DOS MIL SEISCIENTOS CINCUENTA Y \nCUATRO PESOS M/CTE $466.832.654, correspondiente a la implementación de \nlas acciones de preservación en los predios Canaima (1,07 ha), San Rafael (1,2 ha), \nVilla Andrea (3 ha), La Esperanza (0,41 ha) y La Esmeralda (2,37 ha), localizados \nen la vereda Quebraditas del municipio de Acacías y en las veredas Santa Rosa, \nPeralonso, La Llanerita y Puerto Tembleque del municipio de Villavicencio, \nrespectivamente. \nDe esta manera para Ecopetrol S.A. el pronunciamiento de la ANLA respecto del \nartículo tercero de la Resolución 001303 de 28 de junio de 2024, transgrede de esta \nforma el principio de confianza legítima y seguridad jurídica de los administrados, \npues a pesar de que las dos (2) actuaciones (Resolución 0560 de 21 de marzo de \n2021 y 001303 de 28 de junio de 2024) se evaluaron bajo los mismos criterios \ntécnicos; los conceptos acogidos mediante los actos administrativos antes referidos \nno van en el mismo sentido. \nPor último, Ecopetrol S.A. considera que con este tipo de actuaciones por parte de \nla Autoridad Ambiental se han generado cambios inesperados que han transgredido \nlos principios de economía y planeación, pues se generan reprocesos en el actuar \nde la entidad, contraviniendo finalmente los principios de confianza legítima y \nseguridad jurídica.\nAPLICACIÓN DEL PRINCIPIO, NADIE ESTA OBLIGADO A LO IMPOSIBLE\n(…)  Ecopetrol S.A. considera que entre otros aspectos la condición del tiempo \nestablecida para cumplimiento de la Resolución No. 1303 de 28 de junio de 2024, \nconfigura tal imposibilidad, específicamente en su artículo cuarto, al señalar:\n“(…) ARTÍCULO CUARTO: Requerir a la sociedad ECOPETROL S.A. para \nque en un plazo máximo de seis (6) meses contados a partir de la notificación \ndel presente acto administrativo presente nuevas áreas para la ejecución de \nlas acciones de preservación, que den cumplimiento al DONDE \nCOMPENSAR de acuerdo con lo establecido en el Manual de \ncompensaciones del componente biótico (MADS, 2018) de acuerdo con los \nlineamientos establecidos en el Manual del Componente Biótico adoptado \nmediante Resolución 256 del 22 de febrero de 2028 “Por la cual se adopta la \n\nResolución No. 002305       Del 21 OCT. 2024          Hoja No. 13 de 39\n“Por el cual se resuelve un recurso de reposición interpuesto contra la Resolución 1303 del \n28 de junio de 2024”\nPágina 13 de 39\nactualización del Manual de Compensaciones Ambientales del Componente \nBiótico” y a los requerimientos del Artículo quinto de la Resolución 1604 del \n14 de agosto de 2019: (…)” (Subrayado fuera del texto original) \nUna vez revisado el pronunciamiento de la Autoridad Nacional de Licencias \nAmbientales -ANLA-, se observa está transgrediendo el principio de “Nadie está \nobligado a lo imposible”, pues al momento de emitir tal obligación en el artículo \ncuarto de la Resolución 001303 de 28 de junio de 2024, dicha Autoridad Ambiental \nobliga y limita a Ecopetrol S.A. al solicitar “presente nuevas áreas para la \nejecución de las actividades de preservación”, con su localización para la \nimplementación de las medidas de compensación, ya que, de acuerdo con lo \nindicado en el Manual de compensaciones del componente biótico, las áreas serán \npresentadas en el marco del seguimiento y ejecución del Plan.\nOtros aspectos a considerar – De las áreas seleccionadas, concertadas y con \nimplementación de acciones de preservación. \nPara sentar claridad frente a este aspecto, se hace necesario exponer los \nargumentos a nivel de cada predio.\nPredio Canaima: Observación ANLA: \n“En el predio Canaima, se observa que el área delimitada como actividad de \npreservación no evidencia cambios considerables a través del tiempo. La cobertura \nde bosque se ha mantenido en condiciones similares por lo menos una década y no \nse evidencia pérdida de superficie o cambios en el patrón de la vegetación.” \nArgumento:\nBajo dicho concepto se tiene que con el análisis superficial de la imagen del área de \npreservación no se permiten identificar aspectos o motores de cambio que ejercen \npresión en el área de preservación, y que de acuerdo con los modelos productivos \noriginan una permanente afectación sobre el recurso suelo puntualmente en el \ndesarrollo de la regeneración natural, donde específicamente el ingreso de los \nsemovientes en efectos de la alimentación y el resguardo, deterioran la capa de \nmayor sensibilidad y porosidad, siendo clave para la emergencia y desarrollo de los \norganismos vegetales participes de la repoblación así como de recambio, y que en \ntendencia se convierten en focos de protección para promover ciclos naturales en la \nvía de incrementar la presencia de organismos clave para la variación de la \nbiodiversidad en el entorno, el cual debe ser y es medida en el componente florístico \na través de parcelas de monitoreo permanente, como herramienta para establecer \npatrones o conceptos que evidencian resultados positivos en aspectos de diversidad \ny riqueza, anclados en áreas basales, categorías de desarrollo brinzal a latizal y \nlatizal a fustal, esto sumado al análisis de información que se apoya con categorías \nde preservación y de uso; de la misma forma se entrelaza con datos en torno a fauna \nvertebrada, específicamente con Aves y Quirópteros y en invertebrada como \nFormícidos y Coleópteros dentro de la familia Scarabaeidae, desde los mismos \nconceptos y forjando el eje principal y/o columna vertebral como área de \npreservación, basada en criterios de ganancia neta de diversidad, la cual se mide \nactualmente en estos grupos, con metodologías que se aplican según los criterios \n\nResolución No. 002305       Del 21 OCT. 2024          Hoja No. 14 de 39\n“Por el cual se resuelve un recurso de reposición interpuesto contra la Resolución 1303 del \n28 de junio de 2024”\nPágina 14 de 39\ntécnicos requeridos, control de tensionantes que se modulan a través de la \nconstrucción de una barrera física a manera de cerca que reduce a cero la presencia \nde semovientes; y que es permanentemente sometida a seguimiento con el \npropósito de corregir cualquier tipo de eventualidad originada por efectos \nambientales, naturales o de otra índole que pongan en riesgo su función e \nintegralidad, en convergencia de lo aquí expuesto y en el ejercicio mismo de la \ncompensación se generan resultados que permitirán evidenciar adicionalidad, la \ncual se apoya principalmente en criterios de diversidad y control de tensionantes, \nbasados en el ejercicio del levantamiento de información en cada una de las áreas \nestipuladas para preservación en los Acuerdos Voluntarios de Preservación.\nPredio San Sebastián: Observación ANLA: \n“El predio San Sebastián muestra un escenario similar al del predio Canaima, ya \nque el área destinada a preservación no evidencia reducción en su superficie desde \n2005, por el contrario, a partir del año 2013, se observa cómo se empieza a \nrecuperar, que, si bien no hace parte del polígono asignado a la compensación, \nrefleja como estas zonas no están sometidas a un factor tensionante que disminuya \nlas coberturas vegetales remanentes, sino que estas están ampliando su extensión.” \nArgumento:\nEs clave tener en cuenta que los análisis de las imágenes para concluir una \nrecuperación del área de preservación depende intrínsecamente de valores \ntomados de manera puntual desde componentes bióticos, como lo son los grupos \nevaluados con los que se establece una línea base o tiempo cero (0), y que se mide \nde manera semestral desde los grupos faunísticos y anual a nivel de flora (en la \nvigencia del Acuerdo Voluntario de Preservación), esto con el fin de mostrar la \nrelevancia de las acciones de control a través de la construcción de cercas \nprotectoras y de delimitación, las cuales en el ejercicio mismo, reducen a cero la \npresencia de semovientes, quienes principalmente son una factor tensionante de \nalta frecuencia, que bloquea el desarrollo de la regeneración natural, proceso a \ntravés del cual se desarrollan especies pioneras que como principal efecto generan \nel microclima y estado físico ideal para el desarrollo de especies con requerimientos \nde mayor complejidad en el entorno, claves para que a la postre provean en el medio \nrecursos alimenticios que son tomados y dispersados por la fauna presente, \npromoviendo cambios a nivel de diversidad esperados con las medidas de control \nplanteadas en la estrategia de compensación y que se encuentran construidas con \nmetodologías con los criterios técnicos requeridos y avalados a nivel nacional. \nPredio La Esperanza: Observación ANLA: \n“En el predio La Esperanza, ... En contraste, se observa en el polígono de las áreas \nde preservación, que las áreas hacen parte de un fragmento de cobertura arbórea y \nuna zona que, de acuerdo con las imágenes, correspondió a pastos enmalezados o \narbolados entre los años 2005 y 2009. Se evidencia claramente que, en esta zona, \na partir de 2010 se iniciaron procesos aparentemente naturales de recuperación de \n\nResolución No. 002305       Del 21 OCT. 2024          Hoja No. 15 de 39\n“Por el cual se resuelve un recurso de reposición interpuesto contra la Resolución 1303 del \n28 de junio de 2024”\nPágina 15 de 39\nla cobertura vegetal, de manera que, a 2022, el patrón de la vegetación es casi \nhomogéneo y pasó de mostrar pastos a vegetación secundaria.” \nArgumento:\nLos patrones para determinar de manera concreta y precisa el inicio de procesos \nnaturales de recuperación se apoyan de criterios técnicos que se construyen a partir \ndel levantamiento de información in-situ, anidados con un monitoreo y seguimiento \nque permita establecer de manera clara cuál ha sido su desarrollo y en qué \ncondiciones se ha venido mostrando. Por otra parte es crucial tener en cuenta que \nel ejercicio del uso del suelo y del entorno a través de la ganadería se promueve a \npartir de espacios de sombrío para los semovientes que principalmente se \ndesarrollan en las áreas de bosque de galería, cerca de los cuerpos de agua, y en \ndonde es de interés común permitir el desarrollo de árboles que generen el espacio \nde reposo, y no desde el concepto de generación de diversidad o aumento en la \nriqueza de especies ya que no es tomado como fundamento que se desarrollen \nindividuos de alto valor ecológico para permitir sucesos ecológicos que denoten la \npresencia de fauna que en efecto de la actividad no se distribuye en el medio; lo \ncual si se establece como eje a partir de la estrategia de compensación, dentro de \nla cual se delimitan las áreas objeto de preservación para promover el desarrollo de \nvegetación clave para el incremento de la diversidad y que se disminuya por \ncompleto la presencia de semovientes para permitir el restablecimiento natural del \nsuelo, el cual en el engranaje natural es el recurso junto al agua más importante \ncomo sustento de la vida vegetal. \nPredio Montebello: Observación ANLA: \n“El área destinada para preservación en el predio Montebello, corresponde a una \nzona de bosque de galería del río Ocoa. De acuerdo con lo observado, a partir de \n2010 la superficie de cobertura boscosa ha mantenido su extensión. Es así como, a \npartir de 2017 se observa que el área contigua al polígono de preservación muestra \nuna transición en lo que inicialmente corresponde a una cobertura de pastos o a las \nplayas de la zona de inundación del río, hacia coberturas herbáceas y arbustivas \npropias de un patrón de vegetación secundaria baja. De esa manera, no es evidente \nuna afectación directa sobre el área seleccionada.”\nArgumento: \nLa escogencia de áreas de bosque de galería, como eje principal del sostenimiento \ny/o protección del recurso hídrico es clave para la estrategia, donde más allá de lo \nidentificado a través del análisis de la imagen, se requiere que se reduzcan las \npresiones constantes en las áreas de preservación, determinadas principalmente \npor semovientes, los cuales afectan de manera directa la calidad del suelo por el \npisoteo y permanencia, al igual que se genera consumo y perdida de regeneración \nnatural, se altera la diversidad de insectos con el ingreso de materia orgánica a \ntravés del estiércol, contaminación del agua toda vez que por medio del curso de \nesta son arrastrados a manera de lixiviados a los ecosistemas loticos afectando la \ncolumna de agua y la distribución de macrófitas y vertebrados acuáticos entre otras. \nAquí es clave tener en cuenta que la construcción de la cerca reduce potencialmente \nla presión ejercida desde el ejercicio relacionado con semovientes y su \n\nResolución No. 002305       Del 21 OCT. 2024          Hoja No. 16 de 39\n“Por el cual se resuelve un recurso de reposición interpuesto contra la Resolución 1303 del \n28 de junio de 2024”\nPágina 16 de 39\nmantenimiento, ya que se reduce a cero la presencia, promoviendo el desarrollo de \nvegetación que se encuentra directamente afectada, lo cual conlleva a un cambio \nen índices de diversidad en estas zonas, abriendo ampliamente posibilidades de \ndispersión de semillas a lo largo no solo del área de preservación sino de los relictos \nde bosques aledaños; donde es clave tener en cuenta que según la diversidad \nflorística y el desarrollo de especies mesoserales y tardicerales se dará la presencia \nde especies faunísticas que han sido desplazadas por las distintas actividades de \naprovechamiento y uso. \nPredio Marsella: Observación ANLA: \n“Para las áreas de preservación delimitadas en el predio Marsella, se evidencia que \nla cobertura no ha sufrido reducción en términos de área a partir del año 2005. La \nzona asignada se encuentra inmersa dentro de un polígono más grande que no \nrefleja cambios en términos de extensión o patrón de la vegetación.” \nArgumento:\nEs de alta importancia tener en cuenta que la dimensión o extensión del área no \ndetermina cada uno de los procesos que afectan directamente al estado de salud \ndel bosque, o los procesos que se ven interrumpidos por las distintas actividades de \nuso y aprovechamiento; que como derrotero es tomado para la aplicación de \nmetodologías y análisis dentro de Aves, Quirópteros, Formícidos y Coleópteros al \nigual en el componente florístico, medidos con la construcción de línea base o \ntiempo cero en condiciones de bajas y altas precipitaciones de manera semestral y \nanual contemplados dentro del planteamiento del monitoreo, para permitir mostrar \nresultados a nivel de ganancia neta de diversidad referidos por el establecimiento \nde cercas protectoras que como eje principal van en camino a reducir el impacto \ndirecto generado por las actividades realizadas en el entorno. \nPredio San Rafael: Observación ANLA: \n“Para el periodo comprendido entre 2010 y 2023, el patrón de vegetación de las \náreas de preservación del predio San Rafael, así como la zona de cobertura boscosa \nen la que se encuentra inmerso, no refleja cambios que indiquen que se ha visto \nafectada en términos de reducción de la superficie que abarca.”\nArgumento: \nLas áreas de vegetación como es característica del entorno donde prevalece el \nejercicio de la ganadería en la tenencia de la tierra, muestra signos marcados y \ndirectos de afectación sobre el suelo, específicamente en la regeneración natural, \nteniendo claridad en que la cobertura de tipo arbóreo tiene una longevidad que \npodría considerarse entre 20 y 30 años incluso mayor, la cual es determinante para \nla perpetuidad del bosque, en tanto este no mantenga presiones directas sobre la \nregeneración de orden natural, atendiendo a los procesos reproductivos de cada \nespecie que como base absolutamente necesaria, requieren del componente \nedáfico para permitir el desarrollo y adecuado establecimiento de su arquitectura y \ndonde se convierte en pieza armónica la construcción de cerca protectora, para \n\nResolución No. 002305       Del 21 OCT. 2024          Hoja No. 17 de 39\n“Por el cual se resuelve un recurso de reposición interpuesto contra la Resolución 1303 del \n28 de junio de 2024”\nPágina 17 de 39\nreducir la presencia de semovientes que afectan directamente tanto el suelo como \nel desarrollo de regeneración natural. \nPredio Villa Andrea: Observación ANLA: \n“En el predio Villa Andrea ... Por su parte se observa que, desde 2014, el polígono \ndestinado a preservación no muestra evidencias de intervención en la cobertura \nvegetal, ya que tanto la superficie como el patrón de la vegetación se mantiene hasta \n2023. A su vez, se observa un claro dentro del área a preservar, que no se amplía \nni se reduce en el periodo de tiempo estudiado, corroborando la ausencia de \nintervenciones que tiendan al deterioro de la cobertura vegetal.” \nArgumento:\nLa verificación in-situ, a través de la identificación de impactos es contundente para \npermitir un seguimiento idóneo para mostrar resultados positivos a la postre de la \nformalización de los Acuerdos Voluntarios de Conservación, dado esto se aplica el \nlevantamiento de información relacionada con factores tensionantes, con el fin de \nevidenciar la realidad del área previo a las actividades implícitas para la \npreservación, dentro de las cuales se plasman coordenadas, fotografías y \ndescripciones de cada uno de los aspectos que generan disturbios, y en una línea \nde tiempo con la aplicación de las medidas de control planteadas. De la misma forma \ncon la construcción de la cerca se busca que la configuración del paisaje cambie, ya \nque se detienen contundentemente la presencia de agentes que causan deterioro \nen la superficie vegetal en desarrollo como en la estructura del suelo. La presencia \nde áreas desprovistas de vegetación es un claro ejemplo de la afectación nivel del \ndesarrollo natural que asegura la progenie y longevidad del bosque, ya que con las \nactividades con semovientes se propicia deterioro, consumo y acumulación de \nmateria orgánica. \nPredio La Esmeralda: Observación ANLA: \n“Finalmente, en el predio La Esmeralda se observa la misma tendencia en la \ncobertura del área de preservación, donde no se reflejan disminuciones en la \nsuperficie ni cambios en el patrón de la vegetación que permitan concluir que estas \nzonas están sujetas al impacto de un tensionante.” \nArgumento:\nLa presencia de semovientes en las áreas de conservación de los predios con \nAcuerdo Voluntario de Conservación es una constante, la cual causa afectaciones \ndirectas sobre el suelo y la vegetación en desarrollo, la principal fuente de recambio \ny autopreservación del bosque, en donde es trascendental alinear los conceptos de \nimágenes con la situación puntual los polígonos de preservación, herramientas que \nson determinantes para conocer a detalle la realidad del entorno, por lo cual se \naplican distintas metodologías para el levantamiento de información que mantiene \nel curso de resultados en primer lugar hacia el conocimiento de la diversidad de la \nregión y en efecto de un cambio asociado a las actividades a ejecutar en las áreas \nde preservación según los monitoreos. \n\nResolución No. 002305       Del 21 OCT. 2024          Hoja No. 18 de 39\n“Por el cual se resuelve un recurso de reposición interpuesto contra la Resolución 1303 del \n28 de junio de 2024”\nPágina 18 de 39\nDe manera general, se precisa que: \n▪ Se efectuó el levantamiento de línea base en periodos de altas y bajas \nprecipitaciones en los ocho predios, lo cual se consolidó en los grupos \ntaxonómicos de Aves, Quirópteros, Formícidos y Coleópteros así como en \nflora complementada en el año 2023, la cual, será incluida dentro del ICA \nperiodo 2024 - A, esto acogido a diversos ajustes que se han tenido que \naplicar con las categorías taxonómicas. \n▪ Por cada predio se aplican encuestas que permiten mantener vinculados \nde otra manera los beneficiarios durante el ejercicio de la estrategia de la \ncompensación. \n▪ Como base del análisis y determinación de adicionalidad se levanta y \nanaliza información de composición, diversidad y riqueza de flora a nivel de \nparcelas de monitoreo permanente y fauna vertebrada, específicamente con \nAves y Quirópteros al igual que en invertebrada como Formícidos y \nColeópteros dentro de la familia Scarabaeidae, lo cual permitirá análisis en \nganancia neta de diversidad.\n▪ Por predio se consolida información puntal de los factores tensionantes, lo \ncual conlleva el levantamiento de datos geográficos, fotográficos y \ncaracterísticas generales, como parte de la adicionalidad. \n▪ En una línea de tiempo acorde con la vigencia del acuerdo voluntario de \nconservación y según el cronograma de ejecución se presentará trazabilidad \ndel seguimiento de cada punto estratégico identificado como tensionante \npermitiendo mostrar el cambio al controlar el ingreso de semovientes. \n▪ Para cada predio se construye una cerca de protección y/o delimitación \ncomo parte del control de tensionantes en la aplicabilidad del concepto de \nadicionalidad. \n▪ Las actividades con semovientes son el motor de cambio predominante de \ntodas las áreas de preservación y son objeto de control mediante la \nimplementación de cerca como delimitación.\n▪ La permanencia de cobertura arbórea no es un garante de un adecuado \nestado salud del bosque, ni del aseguramiento de la reproducción o del \nacervo genético; por lo cual es de absoluta relevancia asegurar mecanismos \nque permitan controlar las diferentes presiones que afectan el desarrollo de \nla regeneración natural, la cual se ve fuertemente afectada con la presencia \nde semovientes. \n▪ Se efectúan monitoreos a la integralidad y consistencia de la cerca como \nparte del armazón estructural que garantiza la reducción del acceso a los \nsemovientes en el área de conservación. \n▪ El análisis a través de imágenes arroja resultados que pueden ser tomados \ncomo derrotero para aplicar acciones en pro de la conservación, del estudio \n\nResolución No. 002305       Del 21 OCT. 2024          Hoja No. 19 de 39\n“Por el cual se resuelve un recurso de reposición interpuesto contra la Resolución 1303 del \n28 de junio de 2024”\nPágina 19 de 39\ny conocimiento de los recursos naturales, y debe estar armonizada con \nlevantamiento de datos in-situ, en el orden de los componentes bióticos. \n▪ Para comprender la importancia de cada área de preservación escogida, \nse debe tener en cuenta que la clave en el éxito de los resultados parte desde \nla construcción de una barrera física para el control de factores externos o \nexógenos, los cuales se identifican uno a uno durante las visitas de \nseguimiento. \nComo anexo se incluye un documento que engloba metodologías a nivel general, \nalcances y descripción de actividades ejecutadas hasta la fecha resultados aun en \nverificación para presentación final. (Ver Imágenes plasmadas en las páginas 14,15, \n16, 17, 18, 19, 20, 21, 22 del Concepto Técnico 7066 del 20 de septiembre de 2024)\n(…)\nSe observa la reducción del área de bosque y el efecto borde ocasionado por la \npresión de la ganadería en la zona. \nEn términos generales el análisis de las áreas de conservación seleccionadas se \ndebe realizar a diferentes escalas, es indiscutible el aumento de la deforestación a \nnivel regional y la presión constante sobre los recursos forestales, ya sea por \naumento en la frontera agrícola como por la expansión urbana, el análisis realizado \na nivel local demuestra que las áreas escogidas para conservación tienen riesgo de \nser afectadas si no se toman las medidas para su preservación, realizar un análisis \npuntual de estas áreas a partir de imágenes satelitales no permite determinar las \nafectaciones a nivel de estructura y composición que han tenido estas áreas \nnaturales y que de ser revertidas demostrarán la adicionalidad que busca el proceso \nde compensación en el área. \nOtros aspectos a considerar – De los polígonos que presentan superposición \ncon la compensación correspondiente al expediente LAM2965 Oleoducto \nCampo Rubiales – Estación Monterrey y viento – CPF Cusiana. \nRevisada la información cartográfica el polígono de área de conservación del predio \nSan Sebastián efectivamente se cruza con los polígonos OCT-AB19-06, OCT-AB19-\n07 y OCT-AB19-06, sin embargo, analizando la aerofotografía tomada al inicio de \nlas actividades se puede observar que las áreas identificadas por Ecopetrol S.A. \npara áreas de conservación corresponden a vegetación natural y difieren de lo \nidentificado como áreas sembradas de compensación. (Ver Imagen plasmada en la \npágina 23 del Concepto Técnico 7066 del 20 de septiembre de 2024).\nEn cuanto a esto se procederá a realizar el ajuste de las áreas excluyendo las \nidentificadas por otras compensaciones y serán entregadas con el respectivo otro si \nal acuerdo en el próximo informe de cumplimiento ambiental. \nOtros aspectos a considerar – De la naturaleza del acuerdo de conservación y \nsu implementación conforme lo aprobado por la ANLA \nConforme a las obligaciones establecidas en las Resoluciones No. 1604 de 14 de \nagosto de 2019 y 0340 de 28 de febrero de 2020, no hay disposición alguna que \n\nResolución No. 002305       Del 21 OCT. 2024          Hoja No. 20 de 39\n“Por el cual se resuelve un recurso de reposición interpuesto contra la Resolución 1303 del \n28 de junio de 2024”\nPágina 20 de 39\nseñale que la implementación de las actividades en cada predio estarán sujetas a la \naprobación por parte de ANLA, por cuanto el mecanismo de “Acuerdos de \nconservación”, nos permite desarrollar las acciones concertadas directamente entre \nel Propietario/Poseedor del predio y Ecopetrol S.A. dicho AVC es el resultado de la \ncaracterización de las áreas y el diseño predial acordado. \nPara ello resulta necesario recordar la definición contenida en el Decreto 2099 de \n2016 (Artículo 2.2.9.3.1.2), frente a dicho mecanismo: \n“Acuerdo de conservación: mecanismo de carácter voluntario entre el \ntitular de una licencia ambiental y el propietario, ocupante, tenedor o \nposeedor de un predio en el que se pactan acciones de protección, \nrecuperación, conservación y preservación del recurso hídrico, la \nbiodiversidad \ny \nsus \nservicios \necosistémicos \na \ncambio \nde \nuna \ncontraprestación en dinero o en especie.” (subraya fuera de texto). \nBajo \nlos \nanteriores \nargumentos, \nrespetuosamente \ndiscrepamos \nde \nlas \nconsideraciones realizadas por la ANLA al efectuar su pronunciamiento, el cual va \nen contravía de lo pactado en el Acuerdo de Conservación que se encuentra \ndebidamente formalizado y con obligaciones vinculantes para la Partes, en caso de \nincumplimiento de alguna de ellas, quedando de esta manera expuesta la Compañía \na responder por el incumplimientos y a las reclamaciones que se formulen por los \ncambios no justificados por la Autoridad ambiental, respecto a lo acordado con los \npropietarios de los ocho (8) predios.\nAdicionalmente, es preciso indicar que los Acuerdos de Conservación, son producto \ndel proceso que se desarrolla de la mano con los participantes postulados; por tanto, \ncualquier demora en la implementación del mismos o su reproceso, puede afectar \nel buen relacionamiento y materializar los riesgos como desistimientos de los \nparticipantes en continuar con el proyecto, lo cual acarrea para la Empresa pérdida \nde los recursos ya invertidos en el desarrollo de las actividades arriba enunciadas, \nvulnerando con ello los principios de proporcionalidad, razonabilidad y economía \nque gobiernan las actuaciones administrativas, al turno que puede generar un \ndetrimento patrimonial al Estado. Esto en tanto que Ecopetrol S.A. es una sociedad \nde economía mixta que administra dineros públicos, por lo que debe velar por su \nrigurosa inversión y/o administración. \nEn línea con lo anterior, los acuerdos de conservación una vez suscritos deben \niniciar lo más pronto posible la fase de implementación, a fin de mitigar los riesgos \narriba enunciados, y a su vez porque la Empresa debe acreditar ante la Autoridad \nAmbiental el cumplimiento de las actividades previstas en el cronograma aprobado \npara la ejecución de la obligación de la compensación. \nEn virtud de lo anterior, el pronunciamiento realizado por la ANLA en relación con la \nNO APROBACION de las áreas acordadas para la implementación de las acciones \nde preservación, resulta improcedente, y con mayor cuando no quedó estipulado, \nque el inicio de las actividades de implementación del acuerdo, estarían sujetas a \nuna nueva aprobación por parte de ANLA, ya que evidentemente se sale de los \ntiempos de ejecución establecidos en el cronograma de actividades que debe \n\nResolución No. 002305       Del 21 OCT. 2024          Hoja No. 21 de 39\n“Por el cual se resuelve un recurso de reposición interpuesto contra la Resolución 1303 del \n28 de junio de 2024”\nPágina 21 de 39\nejecutar la Empresa para el cumplimiento de la obligación de compensación del \nmedio biótico para el Bloque Apiay. \nAdicionalmente, la solicitud de presentar una propuesta en remplazo de lo señalado \nen los ocho (8) Acuerdos de Conservación, carece de una justificación técnica desde \nel punto de vista ambiental, productivo, de conectividad del paisaje; que le permita \na la Autoridad rechazar la selección de las áreas de conservación en los ocho (8) \npredios, y por el contrario se encuentran plenamente soportado los argumentos \ntécnicos que permitieron establecer que éstas áreas son acordes y cumplen a \ncabalidad los criterios y lineamientos técnicos definidos tanto en el Plan de \nCompensación, como los actos administrativos emitidos por la misma Autoridad \nAmbiental. \n(…)”\nC. Consideraciones de la Autoridad Nacional de Licencias Ambientales \n“(…)\nEsta Autoridad se permite analizar cada uno de los argumentos presentados en el radicado \nANLA 20246200813082 del 18 de julio de 2024, mediante el cual se presentó el recurso de \nreposición contra los artículos tercero y cuarto de la Resolución 01303 del 28 de junio de \n2024.\na.\nEn cuanto al desconocimiento de las gestiones desarrolladas para la \nformalización de los acuerdos de conservación\nFrente a los argumentos presentados por la sociedad, es importante señalar que a partir de \nla expedición de la Resolución 1604 del 14 de agosto de 2019, mediante la cual se modificó \nel Artículo 4 de la Resolución 782 del 18 de septiembre de 2012, la ANLA ha efectuado \nseguimiento a la ejecución del Plan de compensación del medio biótico, con base en la \ninformación presentada por la sociedad ECOPETROL S.A en los Informes de Cumplimiento \nAmbiental y en la demás información que reposa en el expediente, como bien lo detalla la \nSociedad en los antecedentes de su solicitud. En ese sentido, a través del pronunciamiento \nde los diferentes actos administrativos proferidos por esta Autoridad, se han efectuado \nrequerimientos y se han declarado cumplimientos en torno a la obligación.  Es así como, la \nANLA ha validado la aplicación de la metodología propuesta y presentada en el radicado \n2018186892-1-000 del 31 de diciembre de 2018 y evaluada mediante la Resolución 1604 \ndel 14 de agosto de 2019.\nSin embargo, se precisa que, hasta el seguimiento del año 20231, solo se había presentado \nla información documental del predio Canaima, por lo que mediante concepto técnico 1626 \ndel 05 de abril de 2023, acogido mediante Auto 3918 del 31 de mayo de 2023, se efectuó \nla siguiente aclaración:\n1 Adelantado mediante concepto técnico 1626 del 05 de abril de 2023, acogido mediante Auto 3918 del 31 de mayo de 2023\n\nResolución No. 002305       Del 21 OCT. 2024          Hoja No. 22 de 39\n“Por el cual se resuelve un recurso de reposición interpuesto contra la Resolución 1303 del \n28 de junio de 2024”\nPágina 22 de 39\n“Con relación a lo informado se prevé que la destinación de los 8 predios para la \ncompensación del proyecto, podrían suplir parcialmente el área pendiente por \ncompensar a corte del reporte del radicado 2022055911-1-000 de 25 de marzo de \n2022 (84,97ha) para el expediente LAM0198, no obstante, este aspecto podrá ser \nprecisado en el seguimiento que verifique el próximo ICA (No. 32), en el cual la \nSociedad remita la documentación de nuevos acuerdos de conservación y sustente \nsu elección conforme a los parámetros de la Resolución 1604 de 2019.\n(…) \nEs de señalar que el reporte documental de las gestiones adelantadas en dichos \npredios, con excepción del predio Canaima, hará parte del ICA 32 correspondiente \nal segundo semestre de 2022 ya que la suscripción de acuerdos de conservación \nen estos se adelantó en dicha vigencia. De igual maneral, la información de línea \nbase correspondiente a la caracterización florística, diseño de parcelas de \nseguimiento y monitoreo y caracterización de fauna, deberá ser presentada en dicho \nICA, por tratarse del cierre de la fase ll e inicio de la fase lll del cronograma de \nactividades del plan de compensación del proyecto conforme con esta aclaración se \nresalta que la evaluación de dicha información tendrá lugar en el próximo \nseguimiento del proyecto” (Subrayado fuera de texto).\nEs así como para la vigencia 2024, se adelantó la evaluación de las áreas de preservación \ny uso sostenible de los predios Canaima, La Esmeralda, Villa Andrea, Lote San Sebastián, \nMontebello, Marsella, La Esperanza y San Rafael.\nDe esa manera, se aclara que es menester de esta Autoridad Nacional validar que las áreas \ndefinitivas asignadas a las acciones de preservación, que son producto del análisis \nadelantado por la sociedad ECOPETROL S.A con base en la aplicación de la metodología \npropuesta y presentada en el radicado 2018186892-1-000 del 31 de diciembre de 2018, y \nque han sido objeto de validación por parte de esta Autoridad, cumplan con el criterio de \nadicionalidad que es el objetivo principal de la compensación del medio biótico.\nEs claro entonces que la ANLA no desconoce el proceso adelantado por \nECOPETROL S.A, toda vez que ha sido objeto de seguimiento permanente, y la \ndecisión de la no aprobación de las áreas de preservación obedece precisamente al \nresultado de la verificación de la información presentada por la Sociedad en el marco \nde las funciones de seguimiento misionales de la ANLA. \nb. En cuanto al riesgo de detrimento patrimonial y al principio de confianza \nlegítima y seguridad jurídica\nLa Sociedad argumenta que existe un riesgo de detrimento patrimonial toda vez que “(…) \npor ser una empresa de economía mixta, sujeta a verificación por parte de los órganos de \ncontrol nacional, existe riesgo de detrimento patrimonial que se puede materializar al haber \nrealizado actividades establecidas en el cronograma previamente aprobado en el plan de \ncompensación mediante Resolución 1604 de 14 de agosto de 2019. En este sentido, se \ninforma que a la fecha se ha realizado una inversión de CUATROCIENTOS SESENTA Y \nSEIS MILLONES OCHOCIENTOS TREINTA Y DOS MIL SEISCIENTOS CINCUENTA Y \n\nResolución No. 002305       Del 21 OCT. 2024          Hoja No. 23 de 39\n“Por el cual se resuelve un recurso de reposición interpuesto contra la Resolución 1303 del \n28 de junio de 2024”\nPágina 23 de 39\nCUATRO PESOS M/CTE $466.832.654, correspondiente a la implementación de las \nacciones de preservación (…)”\nSe precisa entonces que el artículo tercero de la Resolución 1604 del 14 de agosto de 2019 \nrequirió la presentación de las áreas específicas para la realización de las actividades de \ncompensación en los siguientes términos:\n“ARTÍCULO TERCERO. La Sociedad ECOPETROL S.A., para lo concerniente al \nDÓNDE implementar las medidas de compensación y antes de la ejecución de las \nacciones propuestas para la preservación, restauración y uso sostenible de los \necosistemas afectados por el cambio del uso del suelo, deberá dar cumplimiento a \nlas siguientes obligaciones, presentando un informe de inicio en el siguiente Informe \nde Cumplimiento Ambiental – ICA, un cronograma detallado para la ejecución del \nPlan y, posteriormente, los correspondientes informes de avance de seguimiento y \nmonitoreo del Plan:\n(…)\nd. Las áreas específicas en las cuales se propone la realización de las diferentes \nactividades de compensación que componen el plan (Preservación, Restauración y \nProyectos de Uso Sostenible - Silvopastoril) y las áreas autorizadas para intervenir”. \n(Subrayado y negrilla fuera de texto)\nDe lo anterior se deriva que, antes de la ejecución de las acciones de preservación y uso \nsostenible, esta Autoridad debió tener conocimiento de las áreas a intervenir, de manera tal \nque la sociedad ECOPETROL S.A adelantó las actividades previo a la verificación de la \nviabilidad de las áreas por parte de la Autoridad. Cabe señalar además que la \ncompensación del componente biótico tiene como objetivo resarcir los impactos residuales \ngenerados con ocasión a un proyecto, y no se encuentra dentro de las competencias de la \nAutoridad Nacional realizar la validación de la ejecución de recursos en el marco de la \nverificación del cumplimiento de dicha obligación.\nEn el mismo sentido se aclara que a través de la Resolución 1604 del 14 de agosto de \n2019, no se aprobó el cronograma de ejecución, por el contrario, este fue objeto de \nrequerimiento del citado acto administrativo, que consideró:\n“Para el caso de las acciones de Preservación, la Sociedad no presentó un \ncronograma donde se evidencie el desarrollo de las actividades propuestas, los hitos \ny el periodo de tiempo en donde se determine el cumplimiento de la obligación, lo \ncual deberá estar supeditado al cumplimento de los objetivos, metas y alcance”.\nEstableciendo en el artículo tercero de la nombrada Resolución 1604 de 2019, lo siguiente:\n“ARTÍCULO TERCERO. La Sociedad ECOPETROL S.A., para lo concerniente al \nDÓNDE implementar las medidas de compensación y antes de la ejecución de las \nacciones propuestas para la preservación, restauración y uso sostenible de los \necosistemas afectados por el cambio del uso del suelo, deberá dar cumplimiento a \nlas siguientes obligaciones, presentando un informe de inicio en el siguiente Informe \nde Cumplimiento Ambiental – ICA, un cronograma detallado para la ejecución \ndel Plan (…)” (Subrayado y negrita fuera de texto)\n\nResolución No. 002305       Del 21 OCT. 2024          Hoja No. 24 de 39\n“Por el cual se resuelve un recurso de reposición interpuesto contra la Resolución 1303 del \n28 de junio de 2024”\nPágina 24 de 39\nA su vez, la Sociedad señala que: \n“De esta manera para Ecopetrol S.A. el pronunciamiento de la ANLA respecto del \nartículo tercero de la Resolución 001303 de 28 de junio de 2024, transgrede de esta \nforma el principio de confianza legítima y seguridad jurídica de los administrados, \npues a pesar de que las dos (2) actuaciones (Resolución 0560 de 21 de marzo de \n2021 y 001303 de 28 de junio de 2024) se evaluaron bajo los mismos criterios \ntécnicos; los conceptos acogidos mediante los actos administrativos antes referidos \nno van en el mismo sentido. \nPor último, Ecopetrol S.A. considera que con este tipo de actuaciones por parte de \nla Autoridad Ambiental se han generado cambios inesperados que han transgredido \nlos principios de economía y planeación, pues se generan reprocesos en el actuar \nde la entidad, contraviniendo finalmente los principios de confianza legítima y \nseguridad jurídica” (Subrayado fuera de texto).\nComo se señaló con anterioridad, esta Autoridad ha venido adelantando la revisión de la \ninformación aportada por ECOPETROL S.A en cumplimiento de lo señalado en la \nResolución 1604 del 14 de agosto de 2019, efectuando las consideraciones respectivas a \ntravés de los conceptos técnicos y los actos administrativos que los acogen, y \npronunciándose a través de requerimientos específicos que fueron comunicados con \noportunidad al titular del instrumento de manejo y control. De manera específica y como ya \nse mencionó en el análisis de los argumentos del literal a, de las consideraciones de la \nANLA; mediante concepto técnico 1626 del 05 de abril de 2023, acogido mediante Auto \n3918 del 31 de mayo de 2023, esta Autoridad aclaró:\n“Con relación a lo informado se prevé que la destinación de los 8 predios para la \ncompensación del proyecto, podrían suplir parcialmente el área pendiente por \ncompensar a corte del reporte del radicado 2022055911-1-000 de 25 de marzo de \n2022 (84,97ha) para el expediente LAM0198, no obstante, este aspecto podrá ser \nprecisado en el seguimiento que verifique el próximo ICA (No. 32), en el cual la \nSociedad remita la documentación nuevos acuerdos de conservación y sustente su \nelección conforme a los parámetros de la Resolución 1604 de 2019.\n(…) \nEs de señalar que el reporte documental de las gestiones adelantadas en dichos \npredios, con excepción del predio Canaima, hará parte del ICA 32 correspondiente \nal segundo semestre de 2022 ya que la suscripción de acuerdos de conservación \nen estos se adelantó en dicha vigencia. De igual maneral, la información de línea \nbase correspondiente a la caracterización florística, diseño de parcelas de \nseguimiento y monitoreo y caracterización de fauna, deberá ser presentada en dicho \nICA, por tratarse del cierre de la fase ll e inicio de la fase lll del cronograma de \nactividades del plan de compensación del proyecto conforme con esta aclaración se \nresalta que la evaluación de dicha información tendrá lugar en el próximo \nseguimiento del proyecto” (Subrayado fuera de texto).\nPor lo tanto, la no aprobación de las áreas de preservación es un resultado de la \nrevisión permanente que efectúa la ANLA en el marco de sus funciones de \n\nResolución No. 002305       Del 21 OCT. 2024          Hoja No. 25 de 39\n“Por el cual se resuelve un recurso de reposición interpuesto contra la Resolución 1303 del \n28 de junio de 2024”\nPágina 25 de 39\nseguimiento y no se constituye como un cambio inesperado, en razón a que se le \nindicó de manera preliminar a la Sociedad ECOPETROL S.A en las consideraciones \ndel Auto 3918 del 31 de mayo de 2023. Adicionalmente, se deriva de la falta de certeza \nsobre la viabilidad de las áreas escogidas para demostrar la adicionalidad, con base \nen la revisión de la información aportada por ECOPETROL S.A, como se verá más \nadelante y como se describió en el concepto técnico 2808 del 6 de mayo de 2024, que \nfue acogido mediante Resolución 1303 del 28 de junio de 2024.\nSe aclara que la aprobación de las acciones de compensación no implica la \naceptación inmediata de las áreas donde se pretende ejecutar cada una de estas, \ntoda vez que se debe surtir un proceso de verificación por parte de la ANLA, en aras \nde garantizar que con las actividades a desarrollar en el sitio determinado, se cumpla \ncon el objetivo de la compensación en términos de adicionalidad.\nc.\nRespecto al principio de “Nadie está obligado a lo imposible”\nSobre lo consignado en el anterior enunciado, ECOPETROL S.A argumenta:\nUna vez revisado el pronunciamiento de la Autoridad Nacional de Licencias Ambientales \n-ANLA-, se observa está transgrediendo el principio de “Nadie está obligado a lo \nimposible”, pues al momento de emitir tal obligación en el artículo cuarto de la \nResolución 001303 de 28 de junio de 2024, dicha Autoridad Ambiental obliga y limita a \nEcopetrol S.A. al solicitar “presente nuevas áreas para la ejecución de las \nactividades de preservación”, con su localización para la implementación de las \nmedidas de compensación, ya que, de acuerdo con lo indicado en el Manual de \ncompensaciones del componente biótico, las áreas serán presentadas en el marco del \nseguimiento y ejecución del Plan.».\nDados los argumentos expuestos por la Sociedad, se aclara que los seis (6) meses \nrequeridos para la presentación de las nuevas áreas a preservar se contemplan \nconsiderando que el Plan de compensación fue aprobado desde la emisión de la Resolución \n1604 del 14 de agosto de 2019, en cuyo Artículo tercero requirió presentar “(…) antes de \nla ejecución de las acciones propuestas para la preservación, restauración y uso sostenible \nde los ecosistemas afectados por el cambio del uso del suelo” (…) d. Las áreas específicas \nen las cuales se propone la realización de las diferentes actividades de compensación que \ncomponen el plan (Preservación, Restauración y Proyectos de Uso Sostenible - \nSilvopastoril) y las áreas autorizadas para intervenir”, solicitando el informe inicial en el ICA \ndel año 2019 (ICA 24) y los posteriores informes de avance. \nAsí mismo, el pronunciamiento emitido hace parte del seguimiento a la ejecución del plan, \nentendiendo que sus actividades iniciaron en el año 2022, por lo que fijar un plazo para \nla presentación de las áreas se enmarca dentro de lo establecido en el Manual de \nCompensaciones del Componente Biótico (MADS, 2018)\nd. De las áreas seleccionadas, concertadas y con implementación de acciones \nde conservación\n\nResolución No. 002305       Del 21 OCT. 2024          Hoja No. 26 de 39\n“Por el cual se resuelve un recurso de reposición interpuesto contra la Resolución 1303 del \n28 de junio de 2024”\nPágina 26 de 39\nSobre el presente enunciado, ECOPETROL S.A consigna observaciones específicas para \ncada uno de los predios, considerando lo expuesto por la ANLA en la Resolución 1303 del \n28 de junio de 2024, de acuerdo con lo expuesto en el documento del recurso de reposición \nen su numeral 3.3. Otros aspectos a considerar – De las áreas seleccionadas, \nconcertadas y con implementación de acciones de preservación, donde la sociedad \nexpone los argumentos a nivel de los predios Canaima, San Sebastián, La Esperanza, \nMontebello, Marsella, San Rafael, Villa Andrea y La Esmeralda, esta Autoridad efectúa las \nsiguientes precisiones:\nLa Sociedad ECOPETROL S.A manifiesta que una parte primordial para la selección de las \náreas se basó en la presencia del ganado que genera afectaciones sobre la calidad del \nsuelo y la pérdida de regeneración natural. A su vez, se indica que el resultado del \naislamiento se dará a través del monitoreo de las comunidades de aves, quirópteros, \nformícidos y coleópteros.\nRespecto a la afectación ocasionada por el ganado, los documentos de caracterización con \ninformación secundaria anexos a los ICA 32 y 33, brindan una información general que no \npermite identificar las afectaciones específicas de la presencia de semovientes en las áreas \nde preservación, en razón a que esta se ve asociada a las áreas desprovistas de vegetación \narbórea. Si bien se hace mención de la existencia de esta actividad, como se consignó en \nla Tabla 122 del concepto técnico 2808 del 6 de mayo de 2024, que fue acogido mediante \nResolución 1303 del 28 de junio de 2024, no se presentan evidencias ni registros tanto \ndel ingreso del ganado como de las consecuencias de esto sobre la flora y fauna de \nlas áreas asignadas a preservación (registro fotográfico, datos de frecuencia de ingreso, \ncomparación del estado de la regeneración natural antes y después del ingreso del ganado, \netc.).\nA su vez y de acuerdo con lo considerado en la Resolución 1303 del 28 de junio de 2024, \n«los documentos de caracterización con información secundaria señalan en la descripción \nde las coberturas de los predios que en las áreas de bosque de galería “los procesos \necológicos no están significativamente alterados”, de hecho, se afirma en los predios \nMontebello y San Sebastián que “no se evidencia indicios de actividades humanas”».\nCabe resaltar que los documentos de línea base de fauna adjuntos al ICA 32, para los \npredios Montebello y Villa Andrea no correlacionan los resultados de la fauna con la \npresencia/ausencia de los tensionantes, y el documento del predio Marsella no incluyó la \ncaracterización de aves y mamíferos. \nAl respecto es pertinente señalar que, de la revisión del expediente, no se tiene claridad \nsobre los criterios técnicos definidos para la selección de los grupos de fauna a monitorear, \nacordes a las condiciones específicas de cada predio y de acuerdo con su potencial para \ndemostrar la adicionalidad, máxime cuando la caracterización del Estudio de Impacto \nAmbiental presentada para la modificación del plan de manejo ambiental para el proyecto2, \ny evaluada mediante Resolución 1859 del 30 de agosto de 2022, incluye los grupos de: \naves, mamíferos (no solo quirópteros), reptiles y anfibios, los cuales no fueron considerados \n2 Radicado ANLA 2021223520-1-000 del 14 de octubre del 2021\n\nResolución No. 002305       Del 21 OCT. 2024          Hoja No. 27 de 39\n“Por el cual se resuelve un recurso de reposición interpuesto contra la Resolución 1303 del \n28 de junio de 2024”\nPágina 27 de 39\nen su totalidad para el monitoreo de las áreas de conservación, aun cuando dentro del \ndiagnóstico del EIA se identificaron especies endémicas y amenazadas3.\nLo anterior se traduce en la incertidumbre respecto al concepto de No pérdida neta de la \nbiodiversidad4, en consideración a que se desconoce si hubo afectación de escarabajos y \nhormigas y no podría verificarse la ganancia para reptiles, anfibios y otros tipos de \nmamíferos, lo que deriva en la imposibilidad de determinar el balance de las pérdidas \ncon ocasión al proyecto respecto a las posibles ganancias derivadas de las \nactividades compensatorias para estos grupos.\nCon base en lo anteriormente expuesto, se presentan las observaciones a las conclusiones \nargumentadas por la sociedad ECOPETROL S.A:\n“(…)De manera general, se precisa que: \n▪ Se efectuó el levantamiento de línea base en periodos de altas y bajas \nprecipitaciones en los ocho predios, lo cual se consolidó en los grupos taxonómicos \nde Aves, Quirópteros, Formícidos y Coleópteros así como en flora complementada \nen el año 2023, la cual, será incluida dentro del ICA periodo 2024 - A, esto acogido \na diversos ajustes que se han tenido que aplicar con las categorías taxonómicas. \n▪ Como base del análisis y determinación de adicionalidad se levanta y analiza \ninformación de composición, diversidad y riqueza de flora a nivel de parcelas de \nmonitoreo permanente y fauna vertebrada, específicamente con Aves y Quirópteros \nal igual que en invertebrada como Formícidos y Coleópteros dentro de la familia \nScarabaeidae, lo cual permitirá análisis en ganancia neta de diversidad(…)”.\nCon la información aportada por ECOPETROL S.A y con base en la caracterización del \nEIA, no es posible determinar la pérdida no neta de biodiversidad con la totalidad de \nlos grupos seleccionados para el monitoreo en las áreas asignadas a preservación \ny, en ese sentido, su contribución a la adicionalidad, por lo que no se considera un \nargumento válido para la selección de áreas.\n“(…)▪ Por predio se consolida información puntal de los factores tensionantes, lo \ncual conlleva el levantamiento de datos geográficos, fotográficos y características \ngenerales, como parte de la adicionalidad(…)”. \n3 De acuerdo con las consideraciones de la Resolución 1859 del 30 de agosto de 2022, se tiene la siguiente descripción: \nAnfibios: reporta la presencia de especies endémicas las cuáles fueron Dendropsophus mathiassoni y Pristimantis savagei, \nmientras que entre las especies categorizadas como Casi Endémicas se incluyen  Scarthyla vigilans y Scinax kennedyi.\nReptiles: una especie endémica la cuál fue Gonatodes riveroi (Salamanqueja); una (1) especie amenazada: Chelonoidis carbonarius, (…) \npara el Libro Rojo de Reptiles de Colombia y la Resolución 1912 de 2017 del MADS, se encuentra incluida dentro de la categoría Vulnerable \n(VU) Chelonoidis carbonarius (Morrocoy).\nMamíferos: se registran dos (2) especie con distribución endémica para Colombia: el mico nocturno llanero (Aotus brumbacki) y el Mono \nZocay (Plecturocebus ornatus). En cuanto a especies amenazadas se identifican Myrmecophaga tridactyla (Hormiguero gigante), Aotus \nbrumbacki (Mico nocturno llanero) y Plecturocebus ornatus (Mono Zocay).\n4 «Entiéndase por “No Pérdida Neta de Biodiversidad (NPNB)”, el punto donde se balancean4 las pérdidas de biodiversidad \ngeneradas por las afectaciones o los impactos negativos de un proyecto, obra o actividad con las ganancias en biodiversidad \na través de la implementación de las medidas de compensación, a partir de la línea base definida en los estudios técnicos \nsoporte de los proyectos, obras o actividades cuya ejecución generarán la afectación o el impacto». Manual de \ncompensaciones del componen biótico. MADS, 2018.\n\nResolución No. 002305       Del 21 OCT. 2024          Hoja No. 28 de 39\n“Por el cual se resuelve un recurso de reposición interpuesto contra la Resolución 1303 del \n28 de junio de 2024”\nPágina 28 de 39\nEn la información presentada por la sociedad ECOPETROL S.A se incluyó una descripción \ngeneral de los tensionantes5, indicando la presencia de ganado en las áreas de \npreservación, pero no se detallan las evidencias puntuales de esto, ni tampoco de la \nafectación de dicha actividad sobre la flora y/o fauna de los polígonos.  \n“(…)▪ En una línea de tiempo acorde con la vigencia del acuerdo voluntario de \nconservación y según el cronograma de ejecución se presentará trazabilidad del \nseguimiento de cada punto estratégico identificado como tensionante permitiendo \nmostrar el cambio al controlar el ingreso de semovientes(…)”. \nEn el ICA 326, se presentó el documento del plan y monitoreo a los acuerdos de \nconservación por compensación ambiental e inversión forzosa de no menos del 1%. \nRespecto al ingreso del ganado se propone el indicador “Ingreso del ganado a las áreas de \nconservación”, cuya fórmula de cálculo corresponde a:\n𝐴𝑇 = # 𝑠𝑖𝑡𝑖𝑜𝑠 𝑑𝑒 𝑖𝑛𝑔𝑟𝑒𝑠𝑜 𝑡𝑖\n# 𝑎𝑠𝑖𝑡𝑖𝑜𝑠 𝑑𝑒 𝑖𝑛𝑔𝑟𝑒𝑠𝑜 𝑖𝑑𝑒𝑛𝑡𝑖𝑓𝑖𝑐𝑎𝑑𝑜𝑠 𝑒𝑛 𝐴𝑉𝐶 ∗ 100\nDonde:\n# sitios de ingreso ti: Número de sitios de ingreso registrados en el i-ésimo año de \nla medición\n# agentes tensionantes t0: Número de sitios registrados a la firma del AVC\nMedición: El ingreso de ganado se realizará en cada predio una vez se firme el \nacuerdo de conservación, en el momento del establecimiento y al final del proyecto, \ncon una periodicidad anual.\nConforme lo anterior, no se tiene certeza sobre cómo se va a demostrar la adicionalidad \nrespecto a la reducción del ingreso del ganado si no se cuenta con valores de referencia, \nen razón a que estos no se presentaron acorde a la medición establecida en el indicador, \ncon base en la revisión de los documentos de caracterización donde se incluye la \ndescripción de tensionantes, efectuada mediante concepto técnico 2808 del 6 de mayo de \n2024, que fue acogido mediante Resolución 1303 del 28 de junio de 2024. Al respecto se \naclara que la firma de los acuerdos se dio en las siguientes fechas, por lo que ha \ntranscurrido más de un año desde la formalización de los mismos.\nPredio\nFecha de firma del acuerdo\nLa Esmeralda\n15 de diciembre de 2022\nLa Esperanza\n9 de diciembre de 2022\nSan Sebastián\n30 de noviembre de 2022\nMarsella\n19 de octubre de 2022\nMontebello\n30 de noviembre de 2022\nSan Rafael\n31 de octubre de 2022\nVilla Andrea\n30 de noviembre de 2022\n52023069266-1-000_ICA32\\1_Res782_2012_ICA32\\Sharepoint\\A4_OTROS\\a_Legal \n3a-\n\\Actos_Administrativos_ANLA\\10_COMPENSACION\\Anexo 4.4 Caracterizaciones y línea base\n62023069266-1-000_ICA32\\1_Res782_2012_ICA32\\Sharepoint\\A4_OTROS\\a_Legal \n3a-\nb\\Actos_Administrativos_ANLA\\10_COMPENSACION\\Anexo 4.6 Programa de seguimiento, monitoreo y evaluación\\Anexos\n\nResolución No. 002305       Del 21 OCT. 2024          Hoja No. 29 de 39\n“Por el cual se resuelve un recurso de reposición interpuesto contra la Resolución 1303 del \n28 de junio de 2024”\nPágina 29 de 39\nPredio\nFecha de firma del acuerdo\nCanaima\n30 de junio de 2022\n“(…)▪ Para cada predio se construye una cerca de protección y/o delimitación como \nparte del control de tensionantes en la aplicabilidad del concepto de adicionalidad. \n▪ Para comprender la importancia de cada área de preservación escogida, se debe \ntener en cuenta que la clave en el éxito de los resultados parte desde la construcción \nde una barrera física para el control de factores externos o exógenos, los cuales se \nidentifican uno a uno durante las visitas de seguimiento\n▪ Las actividades con semovientes son el motor de cambio predominante de todas \nlas áreas de preservación y son objeto de control mediante la implementación de \ncerca como delimitación(…)”.\nDe acuerdo con el análisis multitemporal efectuado para las áreas asignadas a preservación \nen los ocho predios y como concluyó el concepto técnico 2808 del 6 de mayo de 2024, que \nfue acogido mediante Resolución 1303 del 28 de junio de 2024:\n“(…) es posible concluir que las áreas asignadas a las acciones de preservación en \nlos predios Canaima, La Esmeralda, La Esperanza, Marsella, Montebello, San \nRafael, San Sebastián y Villa Andrea, no evidencian afectaciones que incidan sobre \nla disminución en la superficie de la cobertura vegetal que se pretende preservar. \nEn particular, en los predios San Sebastián, La Esperanza y Montebello la cobertura \nvegetal muestra una recuperación dentro y/o en las áreas aledañas a los polígonos \ndelimitados. \nEn ese sentido, no es claro para esta Autoridad cómo se pretende demostrar la \nadicionalidad en áreas donde la cobertura ha persistido en condiciones similares por \nal menos una década, a pesar de que las áreas se encuentran inmersas en matrices \nde pastos limpios destinados a la ganadería”.\nEs así como el solo aislamiento no se constituye como una actividad suficiente para las \náreas seleccionadas, en el sentido de que con la información aportada por la sociedad \nECOPETROL S.A no se evidencia la afectación específica de estos polígonos, ocasionada \npor la presencia del ganado y, como consecuencia, el potencial de demostrar adicionalidad. \nLo anterior no excluye la posibilidad del uso de estas áreas para la implementación de otras \nacciones de compensación aprobadas mediante la Resolución 1604 del 14 de agosto de \n2019, como las de Restauración en cualquiera de sus enfoques, mientras se garantice la \nadicionalidad.\n▪ “(…)La permanencia de cobertura arbórea no es un garante de un adecuado \nestado salud del bosque, ni del aseguramiento de la reproducción o del acervo \ngenético; por lo cual es de absoluta relevancia asegurar mecanismos que permitan \ncontrolar las diferentes presiones que afectan el desarrollo de la regeneración \nnatural, la cual se ve fuertemente afectada con la presencia de semovientes.\n▪ El análisis a través de imágenes arroja resultados que pueden ser tomados como \nderrotero para aplicar acciones en pro de la conservación, del estudio y \nconocimiento de los recursos naturales, y debe estar armonizada con levantamiento \nde datos in-situ, en el orden de los componentes bióticos”. \n\nResolución No. 002305       Del 21 OCT. 2024          Hoja No. 30 de 39\n“Por el cual se resuelve un recurso de reposición interpuesto contra la Resolución 1303 del \n28 de junio de 2024”\nPágina 30 de 39\n \nEl análisis multitemporal de las áreas de preservación es una herramienta que, al igual que \nen las áreas de implementación de las acciones de uso sostenible, permite verificar el \nestado de la cobertura vegetal a través de una ventana de tiempo definida, que resulta ser \nde mayor utilidad cuando no se cuenta con información primaria específica en diferentes \nmomentos para los polígonos a intervenir. Entonces, si bien no es posible determinar a \ntravés de las imágenes el acervo genético, estas son insumo para la identificación de la \npérdida de cobertura en términos de área y de la afectación en su estructura a través de los \npatrones que se pueden observar, aunado a la ventaja de cubrir una mayor amplitud en el \ntiempo de análisis.  \nEn ese sentido y como se ha mencionado con anterioridad, la caracterización de los \ntensionantes presentada por la sociedad ECOPETROL S.A no permite evidenciar la \nafectación de estos sobre la flora y/o fauna de los polígonos delimitados. En contraste, en \nlos predios “San Sebastián, La Esperanza y Montebello la cobertura vegetal muestra una \nrecuperación dentro y/o en las áreas aledañas” estos, lo que revela la recuperación de la \nregeneración natural y su posterior crecimiento hasta conformar áreas identificables \nen las imágenes analizadas, de lo cual se deriva que hay una mayor certeza respecto \na los resultados del análisis multitemporal.\nPor lo anterior se considera que las áreas no son aptas para adelantar acciones de \npreservación en el marco de la compensación del componente biótico, lo que no \nimplica que sean descartadas para la implementación de otro tipo de acciones. \ne.\nDel análisis cartográfico de las áreas concertadas para preservación\nLa sociedad ECOPETROL S.A remite imágenes comparativas para los años 2016 y 2024, \nde las áreas próximas a los polígonos delimitados para actividades de preservación, en \ncada uno de los predios, argumentando lo siguiente:\n“Se observa presión en los relictos de bosque a causa de las practicas ganaderas, \nefectos borde y disminución de los cordones de vegetación.\n(…)\nPresión del recurso forestal en las áreas aledañas al área destinada a conservación, \nreducción de los árboles aislados, se notan efectos de borde en los cordones de \nvegetación riparia.\n(…)\nEn estas imágenes se puede observar el aumento en las áreas de tejido urbano y la \npresión ejercida en los bosques por este aumento.\n(…)\nEn estas imágenes se puede observar el aumento en las áreas de tejido urbano y la \npresión y reducción ejercida en los bosques.\n\nResolución No. 002305       Del 21 OCT. 2024          Hoja No. 31 de 39\n“Por el cual se resuelve un recurso de reposición interpuesto contra la Resolución 1303 del \n28 de junio de 2024”\nPágina 31 de 39\n(…)\nDisminución del recurso forestal principalmente de los árboles aislados en potreros \narbolados, dando indicios de intervenciones al interior de los bosques.\n(…)\nEn estas imágenes se puede observar el aumento en las áreas de tejido urbano y la \npresión ejercida en los bosques.\n(…)\nEn términos generales el análisis de las áreas de conservación seleccionadas se \ndebe realizar a diferentes escalas, es indiscutible el aumento de la deforestación a \nnivel regional y la presión constante sobre los recursos forestales, ya sea por \naumento en la frontera agrícola como por la expansión urbana, el análisis realizado \na nivel local demuestra que las áreas escogidas para conservación tienen riesgo de \nser afectadas si no se toman las medidas para su preservación, realizar un análisis \npuntual de estas áreas a partir de imágenes satelitales no permite determinar las \nafectaciones a nivel de estructura y composición que han tenido estas áreas \nnaturales y que de ser revertidas demostrarán la adicionalidad que busca el proceso \nde compensación en el área”.\nDe la revisión de las imágenes aportadas por la sociedad ECOPETROL S.A, así como en \nel análisis multitemporal realizado por esta Autoridad Nacional, se concluye que en las \náreas circundantes se denota la ampliación de las áreas de tejido urbano y la reducción de \nla cobertura vegetal en algunos sectores. Sin embargo, estos efectos no se reflejan \nespecíficamente en las áreas asignadas a preservación, tal y como se detalló en el concepto \ntécnico 2808 del 6 de mayo de 2024, que fue acogido mediante Resolución 1303 del 28 de \njunio de 2024, para cada uno de los predios y en una ventana de tiempo de diez (10) años. \nSe precisa que el análisis se efectúa de manera particular en los polígonos \nespecíficos, toda vez que es allí donde se adelanta la caracterización y donde se \nrealizarían los monitoreos que permitirían demostrarla adicionalidad, partiendo de la \nviabilidad de las áreas y que se demuestre que sobre estas se ha ejercido la presión \nde tensionantes que producen su afectación, lo cual no fue suficientemente \nsoportado en la información aportada por la sociedad ECOPETROL S.A en la \ndescripción de los tensionantes.\nf.\nDe los polígonos que presentan superposición con la compensación \ncorrespondiente al expediente LAM2965\nDe la situación identificada mediante concepto técnico 2808 del 6 de mayo de 2024, que \nfue acogido mediante Resolución 1303 del 28 de junio de 2024, respecto a la superposición \nde las áreas de compensación del Expediente LAM2965 “Oleoducto Campo Rubiales - \nEstación Monterrey” con las áreas destinadas a preservación del predio San Sebastián, \nECOPETROL S.A argumenta:\n\nResolución No. 002305       Del 21 OCT. 2024          Hoja No. 32 de 39\n“Por el cual se resuelve un recurso de reposición interpuesto contra la Resolución 1303 del \n28 de junio de 2024”\nPágina 32 de 39\n“Revisada la información cartográfica el polígono de área de conservación del predio \nSan Sebastián efectivamente se cruza con los polígonos OCT-AB19-06, OCT-AB19-\n07 y OCT-AB19-06, sin embargo, analizando la aerofotografía tomada al inicio de \nlas actividades se puede observar que las áreas identificadas por Ecopetrol S.A. \npara áreas de conservación corresponden a vegetación natural y difieren de lo \nidentificado como áreas sembradas de compensación,\n(…)\nEn cuanto a esto se procederá a realizar el ajuste de las áreas excluyendo las \nidentificadas por otras compensaciones y serán entregadas con el respectivo otro si \nal acuerdo en el próximo informe de cumplimiento ambiental”.\nSe considera adecuado que la sociedad ECOPETROL S.A efectúe los ajustes \ncorrespondientes a los polígonos en los que presenta superposición con \ncompensaciones de otros expedientes, sin embargo, deberá tener en consideración \nlas decisiones tomadas en el presente Acto administrativo. \ng. De la naturaleza del acuerdo de conservación y su implementación \nRespecto a las decisiones tomadas mediante la Resolución 1303 del 28 de junio de 2024, \nen sus artículos tercero y cuarto, ECOPETROL S.A expone los siguientes argumentos \nasociados a los acuerdos de conservación:\n“Conforme a las obligaciones establecidas en las Resoluciones No. 1604 de 14 de agosto \nde 2019 y 0340 de 28 de febrero de 2020, no hay disposición alguna que señale que la \nimplementación de las actividades en cada predio estarán sujetas a la aprobación por parte \nde ANLA, por cuanto el mecanismo de “Acuerdos de conservación”, nos permite desarrollar \nlas acciones concertadas directamente entre el Propietario/Poseedor del predio y Ecopetrol \nS.A. dicho AVC es el resultado de la caracterización de las áreas y el diseño predial \nacordado”. \nSe aclara, como se mencionó con anterioridad, que la Resolución 1604 del 14 de agosto \nde 2019, requiere la presentación de las áreas definitivas para la implementación de las \nacciones de compensación antes de su ejecución. \n“ARTÍCULO TERCERO. La Sociedad ECOPETROL S.A., para lo concerniente al \nDÓNDE implementar las medidas de compensación y antes de la ejecución de las \nacciones propuestas para la preservación, restauración y uso sostenible de los \necosistemas afectados por el cambio del uso del suelo, deberá dar cumplimiento a \nlas siguientes obligaciones, presentando un informe de inicio en el siguiente Informe \nde Cumplimiento Ambiental – ICA, un cronograma detallado para la ejecución del \nPlan y, posteriormente, los correspondientes informes de avance de seguimiento y \nmonitoreo del Plan:\n(…)\n\nResolución No. 002305       Del 21 OCT. 2024          Hoja No. 33 de 39\n“Por el cual se resuelve un recurso de reposición interpuesto contra la Resolución 1303 del \n28 de junio de 2024”\nPágina 33 de 39\nd. Las áreas específicas en las cuales se propone la realización de las diferentes \nactividades de compensación que componen el plan (Preservación, Restauración y \nProyectos de Uso Sostenible - Silvopastoril) y las áreas autorizadas para intervenir”.\nEs en ese sentido y como se ha detallado a lo largo de este documento, que toda la \ndocumentación aportada por la sociedad ECOPETROL S.A en el marco de la \ncompensación del componente biótico ha sido revisada y validada, y es sujeta de \nrequerimientos y/o pronunciamientos en el marco del seguimiento y de las funciones de la \nANLA. Por lo que se reitera que la aprobación de la acciones de preservación no implica \nla aceptación inmediata de las áreas donde se pretende ejecutar, toda vez que se \ndebe surtir un proceso de verificación por parte de la ANLA, en aras de garantizar \nque con las actividades a desarrollar en el sitio determinado, se dará la adicionalidad \nrequerida.\nContinuando con los argumentos, la Sociedad expresa: \n“(…), respetuosamente discrepamos de las consideraciones realizadas por la ANLA \nal efectuar su pronunciamiento, el cual va en contravía de lo pactado en el Acuerdo \nde Conservación que se encuentra debidamente formalizado y con obligaciones \nvinculantes para la Partes, en caso de incumplimiento de alguna de ellas, quedando \nde esta manera expuesta la Compañía a responder por el incumplimientos y a las \nreclamaciones que se formulen por los cambios no justificados por la Autoridad \nambiental, respecto a lo acordado con los propietarios de los ocho (8) predios. \n(…) cualquier demora en la implementación del mismos o su reproceso, puede \nafectar el buen relacionamiento y materializar los riesgos como desistimientos de \nlos participantes en continuar con el proyecto (…)\nEn línea con lo anterior, los acuerdos de conservación una vez suscritos deben \niniciar lo más pronto posible la fase de implementación, a fin de mitigar los riesgos \narriba enunciados, y a su vez porque la Empresa debe acreditar ante la Autoridad \nAmbiental el cumplimiento de las actividades previstas en el cronograma aprobado \npara la ejecución de la obligación de la compensación.\n(…) la NO APROBACION de las áreas acordadas para la implementación de las \nacciones de preservación, resulta improcedente, y con mayor cuando no quedó \nestipulado, que el inicio de las actividades de implementación del acuerdo, estarían \nsujetas a una nueva aprobación por parte de ANLA, ya que evidentemente se sale \nde los tiempos de ejecución establecidos en el cronograma de actividades que debe \nejecutar la Empresa para el cumplimiento de la obligación de compensación del \nmedio biótico para el Bloque Apiay.  \nAdicionalmente, la solicitud de presentar una propuesta en remplazo de lo señalado \nen los ocho (8) Acuerdos de Conservación, carece de una justificación técnica desde \nel punto de vista ambiental, productivo, de conectividad del paisaje; que le permita \na la Autoridad rechazar la selección de las áreas de conservación en los ocho (8) \npredios, y por el contrario se encuentran plenamente soportado los argumentos \ntécnicos que permitieron establecer que éstas áreas son acordes y cumplen a \ncabalidad los criterios y lineamientos técnicos definidos tanto en el Plan de \n\nResolución No. 002305       Del 21 OCT. 2024          Hoja No. 34 de 39\n“Por el cual se resuelve un recurso de reposición interpuesto contra la Resolución 1303 del \n28 de junio de 2024”\nPágina 34 de 39\nCompensación, como los actos administrativos emitidos por la misma Autoridad \nAmbiental.  \nLa no aprobación de las áreas de preservación se sustenta en la falta de certeza respecto \na cómo se demostrará la adicionalidad, toda vez que las coberturas no muestran una \nafectación, en términos de reducción de superficie o cambio del patrón de la \nvegetación, en una ventana de tiempo de diez (10) años. Como cita el concepto técnico \n2808 del 6 de mayo de 2024, que fue acogido mediante Resolución 1303 del 28 de junio de \n2024, incluso en los predios “San Sebastián, La Esperanza y Montebello la cobertura \nvegetal muestra una recuperación dentro y/o en las áreas aledañas a los polígonos \ndelimitados”. \nAcorde a lo previamente expuesto por esta Autoridad, la descripción de los tensionantes \npresentada por la sociedad ECOPETROL S.A en los documentos de caracterización \nde los predios, no detalla evidencias ni registros tanto del ingreso del ganado como \nde las consecuencias de esto sobre la flora y fauna de las áreas asignadas a \npreservación. Es en ese sentido que la decisión se soporta técnicamente, en razón a \nque no se evidencia la futura contribución del aislamiento en áreas que se han \nmantenido en las mismas condiciones a través del tiempo.\nSe reitera que la Resolución 1604 del 14 de agosto de 2019, no aprobó un cronograma de \nejecución, considerando que este fue objeto de requerimiento, como se expuso con \nanterioridad, las áreas definitivas para la implementación debieron presentarse antes de la \nejecución de las actividades.\nAhora bien, respecto a las afirmaciones asociadas a las posibles dificultades con los \npropietarios por los ajustes o modificaciones a los plazos de ejecución de las actividades, \nes claro que la vigencia de estos se extiende “hasta que se dé el cumplimiento definitivo de \nlas actividades propuestas” según lo requerido por la ANLA7 y soportado en los documentos \nformalizados presentados por la sociedad ECOPETROL S.A. Es en ese sentido que, en \nvarias ocasiones, la sociedad ECOPETROL S.A ha reportado el desplazamiento en el \ntiempo de las actividades a ejecutar debido, por ejemplo, a la pandemia o a la época \napropiada de siembra para los sistemas silvopastoriles, situaciones sobre las que la \nSociedad no ha reportado que hayan generado inconformidades por parte de los \nfirmantes. \nDebe entenderse que, de acuerdo con lo establecido en el Manual, los Acuerdos de \nconservación son un MODO de compensación, definido como “(…) alternativas de manejo \nque permiten la implementación de las acciones de compensación en las áreas definidas \npara tal fin (…)”. En ese sentido, son el medio de implementación, más no el fin último de \nla compensación, por lo que deben permitir posibles ajustes con base en el avance que se \ntenga respecto a la ejecución del plan, a los imprevistos que puedan generarse, como ya \nha sido el caso, y a los pronunciamientos de esta Autoridad Nacional, orientados al \ncumplimiento de los objetivos de la compensación del componente biótico. \nLa sociedad ECOPETROL S.A en el recurso argumenta que: \n7 Literal f del Numeral 9 del Artículo décimo primero de la Resolución 1604 del 14 de agosto de 2019\n\nResolución No. 002305       Del 21 OCT. 2024          Hoja No. 35 de 39\n“Por el cual se resuelve un recurso de reposición interpuesto contra la Resolución 1303 del \n28 de junio de 2024”\nPágina 35 de 39\n“(…) Así las cosas, la Resolución 1303 de 28 de junio de 2024,  vulnera el principio \nde confianza legitima y seguridad jurídica en la medida que, Ecopetrol S.A. ceñido \na los diferentes actos administrativos expedidos por la ANLA ha venido dando \ncumplimiento a la medida, los cuales la propia autoridad está desconociendo con la \ndecisión recurrida, dando paso a un escenario de incertidumbre respecto del \nacatamiento de la obligación la cual presenta un avance significativo que la \nautoridad ambiental omite, generando implicaciones de tipo técnico, fiscal y \nadministrativo cuya carga no puede ser asumida por la Empresa dado que el \ndesempeño ambiental se ha dado en el marco de la debida diligencia y acatamiento \nde las decisiones que ha adoptado la autoridad ambiental”.\nEsta Autoridad Nacional se permite aclarar que la decisión de no aprobar las acciones de \npreservación en las áreas designadas por la sociedad ECOPETROL S.A obedece a los \ncriterios técnicos que se han descrito y no se traducen en un incumplimiento del titular de \nla licencia, toda vez que hacen parte del seguimiento a la obligación, y por ende se generan \ntérminos para su cumplimiento. Como se ha mencionado con anterioridad, esta áreas \ndebieron presentarse previa a la ejecución de las actividades. \nFinalmente, habiendo atendido los argumentos expuestos por la sociedad ECOPETROL \nS.A respecto a la no aprobación de las áreas asignadas a acciones de preservación para \nel cumplimiento de las obligaciones de compensación del componente biótico, esta \nAutoridad Nacional mantiene la decisión de no aprobar la implementación de las \nacciones de preservación y el plazo para la presentación de las áreas con las que \nserán suplidas, aclarando que, es decisión del titular de la licencia validar si estas pueden \nser objeto de ejecución de otras acciones de compensación, dado que allí ya se han \nadelantado actividades de asilamiento y caracterización que podrían aportar a la línea base \nde otras estrategias. \n(…)\nCONSIDERACIONES JURÍDICAS \nSea lo primero señalar que la Resolución 1303 del 28 de junio de 2024, se emitió \nde conformidad con lo establecido mediante el Concepto Técnico 2808 del 06 de \nmayo de 2024, donde se evaluó la información allegada por parte de la Sociedad \nrespecto de la implementación de los proyectos de uso sostenible, sistemas \nagroforestales y sistemas silvopastoriles, en la cual, dentro de otras cosas se \nconsideró pertinente no aceptar las áreas designadas a acciones de preservación \npresentadas por la Sociedad, debido a que no se evidenció la disminución de áreas \nde bosque, la ampliación de la frontera agrícola o el cambio de la utilización de los \nsuelos por potrerización en una ventana de tiempo mínima de 10 años, ello \nobedeciendo al análisis y evaluación de la información remitida, motivo por el cual \nse realizó el respectivo requerimiento de presentar nuevas áreas para la ejecución \nde las acciones de preservación, que den cumplimiento al DÓNDE COMPENSAR. \nTeniendo en cuenta la consideración antes mencionada en este pronunciamiento, \nse considera procedente analizar el recurso de reposición interpuesto contra los \nartículos tercero y cuarto de la Resolución 1303 del 28 de junio de 2024, presentado \n\nResolución No. 002305       Del 21 OCT. 2024          Hoja No. 36 de 39\n“Por el cual se resuelve un recurso de reposición interpuesto contra la Resolución 1303 del \n28 de junio de 2024”\nPágina 36 de 39\nmediante el radicado 20246200813082 del 18 de julio de 2024, el cual ha basado \nsu argumentación en aspectos tales cómo vulneración a los principios de confianza \nlegítima y seguridad jurídica, desconocimiento de las acciones adelantadas por la \nSociedad, un posible detrimento patrimonial y la aplicación del principio referido a \nnadie está obligado a lo imposible.\nRespecto del desconocimiento a las gestiones desarrolladas por la Sociedad frente \na la formalización de acuerdos de conservación, es pertinente precisar qué, esta \nAutoridad Ambiental ha realizado los seguimientos correspondientes a la ejecución \ndel plan de compensación del medio biótico, efectuando los requerimientos \nconforme a lo evidenciado en campo, y se ha analizado la aplicación de la \nmetodología evaluada mediante la Resolución 1604 del 14 de agosto de 2019, pese \na ello no se había presentado la información completa y se aclara que las áreas que \nhan sido objeto de validación por parte de esta Entidad, deben cumplir con el criterio \nde adicionalidad que es el objetivo principal de la compensación del medio biótico, \nmotivo por el cual no se desconoció las labores efectuadas por parte de la Sociedad \ny la no aprobación de las áreas de preservación presentadas, se enmarca dentro \nde la valoración de la información presentada mediante comunicación con radicado \nANLA 20236200677722 del 29 de septiembre de 2023.\nFrente a la vulneración del principio de confianza legítima y seguridad jurídica en \nrelación al detrimento patrimonial, considerando la inversión económica que se ha \nefectuado en cuanto a la implementación de acciones, se considera pertinente \nexaltar el análisis efectuado por parte del Consejo de Estado. Sala de lo \nContencioso Administrativo. Sección Primera, Magistrado Ponente: Hernando \nSánchez \nSánchez, \ndentro \ndel \nproceso \nidentificado \ncon \nradicación \n25000232400020100005102, enmarcándose como que, dentro del actuar de la \nadministración, no se pueden presentar escenarios bajo los cuales se defraude la \nconfianza que han generado sus actuaciones, realizando cambios intempestivos, lo \nanterior se basa en el cumplimiento del principio de la buena fe; así las cosas, \nrespecto al caso que es materia de estudio, no se han afectado dichos principios en \nel marco del actuar de la Autoridad, toda vez que la no aprobación de las áreas de \npreservación presentadas, han surgido como producto de la valoración de \ninformación remitida por la Sociedad así cómo lo evidenciado en las visitas técnicas \nde seguimiento y control ambiental; por lo cual tampoco se ha configurado un \ncambio intempestivo o inesperado, mencionando en los actos administrativos \nademás la falta de certeza sobre la viabilidad de las áreas escogidas para demostrar \nla adicionalidad, cómo criterio valorado para la toma de decisión. \nUna vez analizados los argumentos de carácter técnico y jurídicos, esgrimidos en el \npresente acto administrativo, se considera pertinente no reponer el recurso \ninterpuesto en contra de los artículos tercero y cuarto de la Resolución 1303 del 28 \nde junio de 2024 y en consecuencia confirmar las disposiciones referidas, \nadicionando un parágrafo aclaratorio para el artículo cuarto, en el sentido de \ninformar a la sociedad ECOPETROL S.A que podrá verificar si las áreas no \n\nResolución No. 002305       Del 21 OCT. 2024          Hoja No. 37 de 39\n“Por el cual se resuelve un recurso de reposición interpuesto contra la Resolución 1303 del \n28 de junio de 2024”\nPágina 37 de 39\naprobadas para la implementación de acciones de preservación se ajustan a la \nejecución de otras actividades de compensación, atendiendo a los parámetros \nexpresos en el Manual de Compensaciones Ambientales del Componente Biótico y \nla Resolución 1604 del 14 de agosto de 2019.\nDe conformidad con lo señalado en el artículo 87 del Código de Procedimiento \nAdministrativo y de lo Contencioso Administrativo, no procede recurso contra los \nactos administrativos que resuelven recursos, tal como ocurre en el acto que nos \nocupa, el cual establece lo siguiente:\n“Artículo 87. Firmeza de los actos administrativos. Los actos administrativos quedarán en \nfirme:\n1. Cuando contra ellos no proceda ningún recurso, desde el día siguiente al de su \nnotificación, comunicación o publicación según el caso.”\nEn mérito de lo expuesto,\nRESUELVE:\nARTÍCULO PRIMERO.  No reponer y en consecuencia confirmar el artículo tercero \ny cuarto de la Resolución 1303 del 28 de junio de 2024, por las razones expuestas \nen el presente acto administrativo.\nARTÍCULO SEGUNDO.  Adicionar al artículo cuarto de la Resolución 1303 del 28 \nde junio de 2024, un parágrafo aclaratorio, el cual quedará de la siguiente manera:\nARTÍCULO CUARTO. Requerir a la sociedad ECOPETROL S.A para que en un \nplazo máximo de seis (6) meses contados a partir de la notificación del presente \nacto administrativo presente nuevas áreas para la ejecución de las acciones de \npreservación, que den cumplimiento al DÓNDE COMPENSAR de acuerdo con lo \nestablecido en el Manual de compensaciones del componente biótico (MADS, 2018) \nde acuerdo con los lineamientos establecidos en el Manual del Componente Biótico \nadoptado mediante Resolución 256 del 22 de febrero de 2018 “Por la cual se adopta \nla actualización del Manual de Compensaciones Ambientales del Componente \nBiótico” y a los requerimientos del Artículo quinto de la Resolución 1604 del 14 de \nagosto de 2019.\nPARÁGRAFO: Las áreas no aprobadas para la implementación de acciones de \npreservación podrán ser utilizadas para la implementación de otras acciones de \ncompensación, siempre y cuando atiendan lo establecido en la Resolución 1604 del \n14 de agosto de 2019, cumplan con los lineamientos establecidos en el Manual del \nComponente Biótico adoptado mediante Resolución 256 del 22 de febrero de 2018 \n“Por la cual se adopta la actualización del Manual de Compensaciones Ambientales \ndel Componente Biótico” y a los requerimientos del Artículo quinto de la Resolución \n1604 del 14 de agosto de 2019.\nARTÍCULO TERCERO. Los demás términos, condiciones y obligaciones \nestablecidos en la Resolución 1303 del 28 de junio de 2024, que no son objeto de \n\nResolución No. 002305       Del 21 OCT. 2024          Hoja No. 38 de 39\n“Por el cual se resuelve un recurso de reposición interpuesto contra la Resolución 1303 del \n28 de junio de 2024”\nPágina 38 de 39\nmodificación expresa en este proveído, se mantienen vigentes y son exigibles para \nel titular del instrumento de manejo ambiental, a partir de la ejecutoria del presente \nacto administrativo.\nARTÍCULO CUARTO. Notificar personalmente o por aviso, cuando a ello hubiere \nlugar, el contenido del presente acto administrativo al representante legal, \napoderado debidamente constituido o a la persona debidamente autorizada por la \nSociedad ECOPETROL S.A, de conformidad con los artículos 56 modificado por el \nartículo 10 de la Ley 2080 de 2021 y 67 y 69 del Código de Procedimiento \nAdministrativo y de lo Contencioso Administrativo.\nARTÍCULO QUINTO. Comunicar el presente acto administrativo a la Corporación \npara el Desarrollo Sostenible del Área de Manejo Especial de la Macarena – \nCORMACARENA, para su conocimiento y fines pertinentes\nARTÍCULO SEXTO. Publicar el presente acto administrativo en la Gaceta Ambiental \nde la Autoridad Nacional de Licencias Ambientales – ANLA, de conformidad con los \ntérminos señalados en el artículo 71 de la Ley 99 de 1993.\nARTÍCULO SÉPTIMO. Contra el presente acto administrativo no procede recurso \nalguno, de conformidad con lo dispuesto en el Artículo 87 de la Ley 1437 de 18 de \nenero de 2011 por medio de la cual se expidió el Código de Procedimiento \nAdministrativo y de lo Contencioso Administrativo.\nNOTIFÍQUESE, COMUNÍQUESE, PUBLÍQUESE Y CÚMPLASE\nDado en Bogotá D.C., a los 21 OCT. 2024\nEDILBERTO PENARANDA CORREA\nASESOR\nANGIE XIOMARA GONZALEZ MARTIN\nCONTRATISTA\nANDREA DEL PILAR SANABRIA DEL RIO\n\nResolución No. 002305       Del 21 OCT. 2024          Hoja No. 39 de 39\n“Por el cual se resuelve un recurso de reposición interpuesto contra la Resolución 1303 del \n28 de junio de 2024”\nPágina 39 de 39\nCONTRATISTA\nVICTORIA MORENO MURILLO\nCONTRATISTA\nExpediente No. LAVM0198  \n  Concepto Técnico N° 7066 del 20 de septiembre de 2024\nProceso No.: 20241000023054\nNota: Este es un documento electrónico generado desde los Sistemas de Información de la ANLA. El original reposa en los \narchivos digitales de la Entidad\n"
}