{
  "fuente": "ANLA_GACETA",
  "numero_resolución": "RESOLUCIÓN N° 000221",
  "fecha_resolución": "1993-12-22",
  "nombre_proyecto": "proyecto “Campo de Desarrollo Caricare” cuya infraestructura comprende 95",
  "ubicación": "Departamento de Arauca.",
  "empresa": "entre otras cosas",
  "numero_expediente": "LAM3368",
  "radicados": [
    "2020116833",
    "2019202901",
    "2023068153"
  ],
  "descripcion": "POR LA CUAL SE RESUELVE UN RECURSO DE REPOSICIÓN",
  "tipos_infraccion": [
    "Vertimientos",
    "Emisiones atmosféricas",
    "Tala o afectación de bosques",
    "Incumplimiento del PMA"
  ],
  "pdf_id": "45484",
  "file_name": "ANLA_45484.pdf",
  "texto_completo": "República de Colombia\nMinisterio de Ambiente y Desarrollo Sostenible\nAUTORIDAD NACIONAL DE LICENCIAS \nAMBIENTALES\n- ANLA –\nRESOLUCIÓN N° 000221\n(14 FEB. 2024)\nPágina 1 de 24\n“POR LA CUAL SE RESUELVE UN RECURSO DE REPOSICIÓN”\nEL ASESOR DEL DESPACHO DEL DIRECTOR DE LA AUTORIDAD NACIONAL DE \nLICENCIAS AMBIENTALES – ANLA\nEn ejercicio de las facultades legales establecidas mediante la Ley 99 del 22 de diciembre \nde 1993, el Decreto Ley 3573 del 27 de septiembre de 2011, modificado por el Decreto \n376 del 11 de marzo de 2020, por el cual se modifica la estructura de la Autoridad \nNacional de Licencias Ambientales y acorde con lo regulado en el Decreto 1076 del 26 de \nmayo de 2015, la Resolución 669 del 14 de abril de 2020, la Resolución 1957 del 5 de \nnoviembre de 2021 y la Resolución 2795 del 25 de noviembre de 2022, expedidas por la \nAutoridad Nacional de Licencias Ambientales, y\nCONSIDERANDO\nQue mediante Resolución 157 del 26 de enero de 2006, el entonces Ministerio de Ambiente \nVivienda y Desarrollo Territorial, hoy Ministerio de Ambiente y Desarrollo Sostenible (en \nadelante el Ministerio), otorgó Licencia Ambiental Global, a la Sociedad OCCIDENTAL DE \nCOLOMBIA INC. Identificada con NIT. 860.053.930-2 (En adelante la Sociedad), para el \ndesarrollo del proyecto “Campo de Desarrollo Caricare” cuya infraestructura comprende 95 \npozos, localizado en jurisdicción del Municipio de Arauquita en el Departamento de Arauca.\nQue por medio de la Resolución 945 del 26 de mayo de 2006, el Ministerio, modificó la \nResolución 157 del 26 de enero de 2006, en el sentido de ampliar el plazo de la \npresentación del Plan de inversión forzosa de no menos del 1%, con su respectivo \ncronograma de actividades. \nQue a través de la Resolución 1143 del 16 de junio de 2006, el Ministerio, modificó la \nResolución 157 del 26 de enero de 2006, entre otras cosas, en el sentido de otorgar \nconcesión de aguas subterráneas para la construcción y operación de las facilidades \ntempranas de producción. \nQue mediante Resolución 579 del 29 de marzo de 2007, el Ministerio modificó el artículo \nquinto y artículo séptimo de la Resolución 157 del 26 de enero de 2006, en el sentido de \nautorizar Concesión de Aguas Subterráneas, Aprovechamiento Forestal, permiso de \nemisiones atmosféricas, utilización de material de préstamo lateral, además de ordenar el \n\nResolución No. 000221       Del 14 FEB. 2024          Hoja No. 2 de 24\n“POR LA CUAL SE RESUELVE UN RECURSO DE REPOSICIÓN”\nPágina 2 de 24\najuste del monto de la inversión forzosa de no menos del 1% según la inversión del Proyecto \npor las obras y actividades autorizadas.\nQue por medio de la Resolución 1997 del 19 de noviembre de 2007, el Ministerio modificó \nlas Resoluciones 157 del 26 de enero de 2006, 1143 del 16 de junio de 2006 y la Resolución \n579 del 29 de marzo de 2007, en el sentido de establecer la ubicación de los dos (2) pozos \nde aguas subterráneas adicionales, requerir el monitoreo del acuífero de cada pozo \nperforado, autorizar vertimiento directo de aguas residuales domésticas tratadas en el Río \nEle, entre otros aspectos. \nQue a través de la Resolución 211 del 12 de febrero de 2007, el Ministerio resolvió el \nrecurso de reposición interpuesto contra la Resolución 1997 del 19 de noviembre de 2007, \nen el sentido de modificar el artículo sexto respecto a la inyección de aguas residuales. \nQue mediante Resolución 397 del 27 de febrero de 2009, el Ministerio modificó la \nResolución 157 del 26 de enero de 2006, artículo segundo, autorizando el desarrollo de \npozos existentes y vías de acceso, entre otros; artículo quinto Numeral 3 modificado por la \nResolución 579 del 29 de marzo de 2007, en el sentido de adicionar un volumen de \naprovechamiento forestal de 750m3; y el artículo décimo en el sentido de realizar el \nmonitoreo de la red de piezómetros una vez al mes y además de autorizar la reinyección \nde aguas residuales, entre otros aspectos. \nQue por medio de la Resolución 111 del 21 de enero de 2010, el Ministerio modificó las \nResoluciones 157 del 26 de enero de 2006, 579 del 29 de marzo de 2007, 1997 del 19 de \nnoviembre de 2007, en el sentido de autorizar un nuevo punto de captación de aguas \nsuperficiales, tomar la determinación de realización de monitoreos de vertimientos en forma \nanual y del empleo de fibras naturales para la recuperación de áreas intervenidas con \nactividades del proyecto. \nQue a través de la Resolución 1452 del 28 de julio de 2010, el Ministerio negó la \nmodificación de la Licencia Ambiental solicitada por la Sociedad, para el proyecto \ndenominado “Campo de Desarrollo Caricare”. \nQue mediante Resolución 1521 del 5 de agosto de 2010, el Ministerio modificó el literal g) \ndel artículo segundo de la Resolución 579 del 29 de marzo de 2007, respecto de la \ncompensación forestal, y declaró que el área a compensar por la Sociedad correspondiente \na 43.1 ha de un aprovechamiento forestal de 8.62 ha equivalentes a un volumen de 499.58 \nm3, de acuerdo con lo autorizado mediante la Resolución 579 del 29 de marzo de 2007. \nQue por medio de la Resolución 79 del 25 de enero de 2011, el Ministerio modificó la \nResolución 211 del 12 de febrero de 2008, en el sentido de ampliar el caudal de inyección \nde agua, entre otros aspectos. \nQue a través de la Resolución 248 del 16 de febrero de 2011, el Ministerio resolvió recurso \nde reposición presentado en contra de la Resolución 1452 del 28 de julio de 2010, en el \nsentido de confirmar íntegramente la decisión.\n\nResolución No. 000221       Del 14 FEB. 2024          Hoja No. 3 de 24\n“POR LA CUAL SE RESUELVE UN RECURSO DE REPOSICIÓN”\nPágina 3 de 24\nQue mediante Resolución 1441 del 18 de julio de 2011, el Ministerio tuvo en cuenta el \ncambio de razón social de la sociedad OCCIDENTAL DE COLOMBIA INC, para ser en \nadelante la sociedad OCCIDENTAL DE COLOMBIA LLC. \nQue mediante Resolución 683 del 21 de agosto de 2012, la Autoridad Nacional de Licencias \nAmbientales (ANLA), (En adelante la Autoridad Nacional), modificó el numeral 4 del artículo \nsegundo de la Resolución 157 del 26 de enero de 2006, en el sentido de incluir como \nalternativa adicional para la perforación de los pozos del “Campo de Desarrollo Caricare”, \nel uso de lodos base aceite de carácter mineral de baja toxicidad, como fluidos de \nperforación y se tomaron otras determinaciones. \nQue por medio de la Resolución 86 del 31 de enero de 2013, la Autoridad Nacional modificó \nla Resolución 157 del 26 de enero de 2006, en el sentido de ampliar el volumen de inyección \nde aguas residuales industriales tratadas y el volumen de aprovechamiento forestal \nautorizado y modificó la Resolución 211 del 12 de febrero de 2008, en el sentido de ampliar \nel caudal de inyección de agua y del aprovechamiento forestal. \nQue a través de la Resolución 1608 del 30 de septiembre de 2020, la Autoridad Nacional \nmodificó el artículo décimo séptimo de la Resolución 157 del 26 de enero de 2006, en el \nsentido de aprobar la actualización de la base de inversión forzosa de no menos del 1%, \nconforme al parágrafo primero del artículo 321 de la Ley 1955 del 25 de mayo del 2019, \npresentado por la Sociedad, para el proyecto “Campo de Desarrollo Caricare”. \nQue mediante Resolución 735 del 22 de abril de 2021, la Autoridad Nacional tuvo en cuenta \nel cambio de razón social de la Sociedad OCCIDENTAL DE COLOMBIA LLC, por \nSIERRACOL ENERGY ARAUCA, LLC.\nQue por medio de la Resolución 1611 del 10 de septiembre de 2021, la Autoridad Nacional \naceptó la liquidación parcial de la inversión forzosa de no menos del 1% y modificó el \nartículo quinto de la Resolución 1608 del 30 de septiembre de 2020, en lo relacionado con \nel valor de la base de liquidación de la inversión forzosa de no menos del 1%. \nQue a través de la Resolución 2257 del 13 de diciembre de 2021, la Autoridad Nacional \nresolvió el recurso de reposición interpuesto contra la Resolución 1611 del 10 de septiembre \nde 2021, en el sentido de modificar lo dispuesto en el subnumeral 2.1 del numeral 2° del \nartículo sexto del acto administrativo en comento.\nQue mediante Resolución 2590 del 8 de noviembre de 2023, la Autoridad Nacional \nestableció a la Sociedad SIERRACOL ENERGY ARAUCA LLC el incremento del valor de \nla inversión forzosa de no menos del 1%, del valor presupuestado para la ejecución de los \naños 2021 y 2022, por la inejecución del Plan de inversión en un tiempo superior a un (1) \naño fiscal, aplicando la fórmula del Parágrafo Primero del Artículo 321 de la Ley 1955 de \n2019, que corresponde a la suma de MIL DOSCIENTOS TREINTA Y SEIS MILLONES \nSETECIENTOS SESENTA Y NUEVE MIL SETECIENTOS TREINTA Y TRES PESOS CON \nCINCUENTA Y OCHO CENTAVOS ($1.236.769.733,58), actualizado de 2019 a 2022. Acto \nadministrativo notificado por correo electrónico el 9 de noviembre de 2023.\n\nResolución No. 000221       Del 14 FEB. 2024          Hoja No. 4 de 24\n“POR LA CUAL SE RESUELVE UN RECURSO DE REPOSICIÓN”\nPágina 4 de 24\nQue por medio de la comunicación con radicación 20236200910352 del 24 de noviembre \nde 2023, la Sociedad interpuso Recurso de Reposición en contra de la Resolución 2590 del \n8 de noviembre de 2023; argumentos que fueron evaluados por el equipo técnico de la \nAutoridad Nacional y en consecuencia expidió el Concepto técnico 185 del 23 de enero de \n2024.\nCOMPETENCIA DE LA AUTORIDAD NACIONAL \nEl Gobierno Nacional, mediante Decreto Ley 3573 del 27 de septiembre de 2011, creó la \nAutoridad Nacional de Licencias Ambientales – ANLA, como una entidad con autonomía \nadministrativa y financiera, sin personería jurídica, la cual hace parte del Sector \nAdministrativo de Ambiente y Desarrollo Sostenible, en los términos del artículo 67 de la \nLey 489 de 1998.\nEl numeral 1° del artículo tercero del mencionado decreto estableció dentro de las funciones \nde la Autoridad Nacional, la de otorgar o negar las licencias, permisos y trámites \nambientales de competencia del Ministerio, de conformidad con la ley y los reglamentos.\nMediante el Decreto 376 del 11 de marzo de 2020, se modificó la estructura de la Autoridad \nNacional de Licencias Ambientales.\nMediante la Resolución 669 del 14 de abril de 2020, se nombró como servidor público a \nEDILBERTO PEÑARANDA CORREA, identificado con cédula de ciudadanía 4.052.851, en \nel empleo de libre nombramiento y remoción de Asesor, código 1020, grado 15, adscrito a \nla Dirección General de la planta global de la ANLA.\nEl 5 de noviembre de 2021, la Autoridad Nacional emitió la Resolución 1957 “Por la cual se \nadopta el Manual Específico de Funciones y de Competencias Laborales para los empleos \nde la planta de personal de la Autoridad Nacional de Licencias Ambientales - ANLA”, en \ndonde se establece que corresponde al Despacho del Director General de la Autoridad \nNacional de Licencias Ambientales - ANLA, “Suscribir los actos administrativos que otorgan, \nniegan, modifican, ajustan o declaran la terminación de las licencias, permisos y trámites \nambientales”.\nEn ejercicio de las facultades conferidas por la Ley 489 de 1998, se expidió la Resolución \n2795 del 25 de noviembre de 2022 “Por la cual se delegan unas funciones y se dictan otras \ndisposiciones”, en su artículo primero, numeral 15° delegó en el Asesor Código 1020 Grado \n15 del Despacho del Director General, la función de “Resolver los recursos de reposición \ninterpuestos contra los actos administrativos que se emiten en cumplimiento de las \nfunciones anteriores.”\nTeniendo en cuenta lo anterior, es el Asesor del Despacho del Director General de la \nAutoridad Nacional el competente para pronunciarse sobre el recurso de reposición \ninterpuesto por la Sociedad en contra de la Resolución 2590 del 8 de noviembre de 2023.\nFUNDAMENTOS JURÍDICOS\nEl procedimiento para la presentación y resolución de recursos contra los actos \nadministrativos se encuentra reglado en el Código de Procedimiento Administrativo y de lo \n\nResolución No. 000221       Del 14 FEB. 2024          Hoja No. 5 de 24\n“POR LA CUAL SE RESUELVE UN RECURSO DE REPOSICIÓN”\nPágina 5 de 24\nContencioso Administrativo artículos 74 y siguientes, que particularmente respecto del \nrecurso de reposición al tenor literal expresan:\n“Artículo 74. Recursos contra los actos administrativos.\n Por regla general, contra los actos definitivos procederán los siguientes recursos: \n1.\nEl de reposición, ante quien expidió la decisión para que la aclare, modifique, adicione o \nrevoque \n(…)”\nA su vez, los artículos 76 y 77 del Código enunciado preceptúan: \n“Artículo 76. Oportunidad y presentación.\nLos recursos de reposición y apelación deberán interponerse por escrito en la diligencia de \nnotificación personal, o dentro de los diez (10) días siguientes a ella, o a la notificación por aviso, o \nal vencimiento del término de publicación, según el caso. Los recursos contra los actos presuntos \npodrán interponerse en cualquier tiempo, salvo en el evento en que se haya acudido ante el juez. \nLos recursos se presentarán ante el funcionario que dictó la decisión, salvo lo dispuesto para el de \nqueja, y si quien fuere competente no quisiere recibirlos podrán presentarse ante el procurador \nregional o ante el personero municipal, para que ordene recibirlos y tramitarlos, e imponga las \nsanciones correspondientes, si a ello hubiere lugar. \nEl recurso de apelación podrá interponerse directamente, o como subsidiario del de reposición y \ncuando proceda será obligatorio para acceder a la jurisdicción. \nLos recursos de reposición y de queja no serán obligatorios. \nArtículo 77. Requisitos.\nPor regla general los recursos se interpondrán por escrito que no requiere de presentación personal \nsi quien lo presenta ha sido reconocido en la actuación. Igualmente, podrán presentarse por medios \nelectrónicos. \nLos recursos deberán reunir, además, los siguientes requisitos: \n1. Interponerse dentro del plazo legal, por el interesado o su representante o apoderado debidamente \nconstituido. \n2. Sustentarse con expresión concreta de los motivos de inconformidad.\n3. Solicitar y aportar las pruebas que se pretende hacer valer. \n4. Indicar el nombre y la dirección del recurrente, así como la dirección electrónica si desea ser \nnotificado por este medio. \nSólo los abogados en ejercicio podrán ser apoderados (…)\nA su vez, el artículo 80 del citado Código, establece el alcance del contenido de la decisión que \nresuelve el recurso:\n\nResolución No. 000221       Del 14 FEB. 2024          Hoja No. 6 de 24\n“POR LA CUAL SE RESUELVE UN RECURSO DE REPOSICIÓN”\nPágina 6 de 24\n“Artículo 80. Decisión de los recursos. -Vencido el período probatorio, si a ello hubiere lugar, y sin \nnecesidad de acto que así lo declare, deberá proferirse la decisión motivada que resuelva el recurso. \n(…)”\nCONSIDERACIONES DE LA AUTORIDAD NACIONAL FRENTE AL RECURSO DE \nREPOSICIÓN INTERPUESTO POR LA SOCIEDAD. \nDesde el punto de vista procedimental, se observa que el recurso de reposición interpuesto \npor la sociedad SIERRACOL ENERGY ARAUCA, LLC en contra de la Resolución 2590 del \n8 de noviembre de 2023, cumple con los requisitos establecidos en el artículo 77 y \nconcordantes del Código de Procedimiento Administrativo y de lo Contencioso \nAdministrativo, en cuanto a lo siguiente: \n1.\nInterponerse dentro del plazo legal, por el interesado o su representante o apoderado \ndebidamente constituido.\nSe encuentra acreditado que el día 9 de noviembre de 2023, la Sociedad fue debidamente \nnotificada por correo electrónico de la Resolución 2590 del 8 de noviembre de 2023; frente \na la cual interpuso recurso de reposición por intermedio de su Apoderada General el día 24 \nde noviembre de 2023 y radicado en la Autoridad Nacional bajo el número 20236200910352 \nesto es, dentro de los diez (10) días siguientes a la notificación, de conformidad con lo \npreceptuado en el artículo 76 de la Ley 1437 de 2011.\n2.\nSustentarse con expresión concreta de los motivos de inconformidad. \nLa Sociedad presentó los argumentos en contra de las disposiciones recurridas de la \nResolución 2590 del 8 de noviembre de 2023, los cuales serán tenidos en cuenta para \ndecidir el presente recurso de reposición.\n3.\nSolicitar y aportar las pruebas que se pretende hacer valer.\nEn el recurso de reposición la Sociedad no solicitó, ni aportó pruebas de ninguna índole.\n4.\nIndicar el nombre y la dirección del recurrente, así como la dirección electrónica si desea ser \nnotificado por este medio.\nLa sociedad manifestó que, para efectos de la notificación dentro del presente expediente, \nque “(…)  Se recibirán notificaciones en la ciudad de Bogotá en la Calle 93A # 10 – 54 o al correo \nBogotaNotificaciones-Judiciales@sierracol.com (…)”\nCon base en lo anterior, verificado el cumplimiento de los requisitos establecidos en el \nCódigo de Procedimiento Administrativo y de lo Contencioso Administrativo -CPACA-, \nrespecto a la procedencia del señalado recurso de reposición, la Autoridad Nacional \nprocederá a resolverlo, teniendo en cuenta las consideraciones realizadas en el Concepto \nTécnico 185 del 23 de enero de 2024; en el mismo orden de los argumentos presentados \npor la sociedad, a saber:\n\nResolución No. 000221       Del 14 FEB. 2024          Hoja No. 7 de 24\n“POR LA CUAL SE RESUELVE UN RECURSO DE REPOSICIÓN”\nPágina 7 de 24\n1.\nDISPOSICIÓN RECURRIDA –ARTÍCULO SEGUNDO DE LA RESOLUCIÓN 2590 \nDEL 08 DE NOVIEMBRE DE 2023.\n“(…) ARTÍCULO SEGUNDO. ESTABLECER a la Sociedad SIERRACOL ENERGY ARAUCA \nLLC el incremento del valor de la inversión forzosa de no menos del 1%, del valor \npresupuestado para la ejecución de los años 2021 y 2022, por la inejecución del Plan de \ninversión en un tiempo superior a un (1) año fiscal, aplicando la fórmula del Parágrafo Primero \ndel Artículo 321 de la Ley 1955 de 2019, que corresponde a la suma de MIL DOSCIENTOS \nTREINTA Y SEIS MILLONES SETECIENTOS SESENTA Y NUEVE MIL SETECIENTOS \nTREINTA Y TRES PESOS CON CINCUENTA Y OCHO CENTAVOS ($1.236.769.733,58), \nactualizado de 2019 a 2022, de conformidad con lo expuesto en la parte motiva del presente \nacto administrativo.  (…)”\n1.1\nPetición de la Sociedad.\n“(…) ACLARAR si a partir de la fecha se tomará como base para la actualización de los valores \nde inversión del 1% (i) lo establecido en el artículo segundo y tercero de la Resolución 2590 \ndel 8 de noviembre de 2023, o (ii) sí se deberá continuar actualizando el valor de la totalidad \nde los valores no ejecutados a la fecha, que corresponde a la totalidad de la base de inversión \ndel 1%.\nDependiendo de la respuesta anterior, si es el caso, MODIFICAR el valor base de liquidación \nde la inversión de 1% que para marzo de 2024 correspondería a los Dieciocho mil diez millones \nochocientos sesenta y nueve mil ochocientos treinta y dos pesos (18.010.869.832) conforme \na lo reportado por el revisor fiscal de SierraCol Energy mediante radicado No. 2023068153-1-\n000 del 31 de marzo de 2023. (…)”\n1.2\nArgumentos de la Sociedad.\n“(…) \n3.1\nDe acuerdo con el cálculo realizado en el Concepto técnico 6608 del 6 de octubre de 2023, \néste toma como base de actualización la sumatoria del valor presupuestado para ejecutarse \nen los años 2021 y 2022, de acuerdo con la proyección financiera presentada en el radicado \n2020116833-1-000 del 22 de julio de 2020, quedando un valor de $5.774.930.200 para \nactualizar como se muestra en la Imagen No. 1.\n\nResolución No. 000221       Del 14 FEB. 2024          Hoja No. 8 de 24\n“POR LA CUAL SE RESUELVE UN RECURSO DE REPOSICIÓN”\nPágina 8 de 24\nImagen 1. Página 56 del concepto técnico 6608 del 6 de octubre de 2023\n3.2\nTomando este valor base, la Autoridad tomó los IPC de los años 2019 y 2022 y aplicó la \nformula (sic) establecida en el parágrafo primero del artículo 321 de la ley 1955 de 2019, dando \ncomo resultado un valor de siete mil once millones seiscientos noventa y nueve mil \nnovecientos treinta y tres pesos con cincuenta y ocho centavos ($7.011.699.933,58). En la \nImagen 2 se presenta el cálculo realizado por la Autoridad en la página 60 del concepto \ntécnico 6608 del 6 de octubre de 2023.\nImagen 2. Página 60 del concepto técnico 6608 del 6 de octubre de 2023\n3.3\nFinalmente, la Autoridad estableció un incremento de mil doscientos treinta y seis millones \nsetecientos sesenta y nueve mil setecientos treinta y tres pesos con cincuenta y ocho centavos \n($1.236.769.733,58), que fueron sumados al valor ya aprobado en la Resolución 1608 del 30 \nde septiembre de 2020 y que da como resultado un valor actualizado de la Inversión del 1% \ncon corte a diciembre de 2022 de Dieciséis mil trescientos cuatro millones doscientos noventa \ny dos mil seiscientos ochenta y tres pesos con dieciocho centavos ($16.304.292.683,18), tal \ncomo fue aceptado en el artículo tercero de la Resolución 2590 de 2023, que modifica el \nartículo quinto de la Resolución 1608 del 30 de septiembre de 2020.\n\nResolución No. 000221       Del 14 FEB. 2024          Hoja No. 9 de 24\n“POR LA CUAL SE RESUELVE UN RECURSO DE REPOSICIÓN”\nPágina 9 de 24\n3.4\nSin embargo, la proyección financiera con la cual la Autoridad sustenta el cálculo de la \nactualización del valor base de liquidación, fue elaborada previamente a la aprobación de las \nlíneas de inversión por la misma Autoridad y consideraba la ejecución de cinco proyectos \nincluidos en el Plan de inversión del 1%, presentados con Radicado 2019202901-1-000 del 23 \nde diciembre de 2019 (ver Anexo 2), de los cuales solamente fueron aprobados en el Artículo \ntercero de la Resolución 1608 de 2020, los proyectos No. 1 “Implementación de sistemas \nagroforestales” y No. 3 “Restauración ecológica pasiva” y No. 5 “Cosecha de agua”, \nAdicionalmente el proyecto No. 4 “Acuerdos de conservación voluntarios” fue redefinido como \nun mecanismo de ejecución de los dos proyectos aprobados y no como una línea de inversión.\n3.5\nTeniendo en cuenta las líneas de inversión aprobadas, la proyección financiera con la cual la \nAutoridad sustenta el cálculo de la actualización del valor base de liquidación en la Resolución \n2590 del 8 de noviembre de 2023 tuvo que ser modificada de manera sustancial por lo \ndispuesto en la Resolución 1608 de 2020 y no corresponde a la definitiva, por lo cual SierraCol \nconsidera que no puede ser la base para la actualización de los valores no ejecutados de la \ninversión forzosa de no menos del 1% del Campo de Desarrollo Caricare.\n3.6\nAhora bien, de acuerdo con lo indicado en el Parágrafo Primero del artículo 321 de la ley 1955 \nde 2019, la fórmula para calcular el incremento de la liquidación de la inversión del 1% es la \nsiguiente:\n VBL (Valor de la base de liquidación): es el \nvalor en pesos (COP) de la base de liquidación de la inversión forzosa del 1% certificado de \nacuerdo con lo señalado en el parágrafo 3 del presente artículo, actualizada al mes de \ndiciembre del año anterior a la fecha de presentación de la actualización.\nVIRa (Valor de la inversión realizada para cada año): es el valor en pesos (COP) \ncorrespondiente a las inversiones realizadas del proyecto para cada año, durante su \nejecución.\nIPC actual: corresponde al último valor del IPC a diciembre del año anterior reportado por el \nDANE, en índice - serie de empalme, con respecto a la fecha de presentación del plan de \ninversiones actualizado ante la ANLA.\nIPC inicial: corresponde al valor del IPC reportado por el DANE, en índice - serie de empalme, \npara el año en el que se ejecutó la inversión o actividad del proyecto, tomando el que \ncorresponda al mes de diciembre.\nEl valor total de la base actualizada de liquidación de la inversión de no menos del 1% será \nla sumatoria de los VBL de cada año.”\n3.7\nEs decir, los incrementos se calculan partiendo de las inversiones realizadas por la compañía \naño a año (VIRa), teniendo en cuenta los ítems establecidos en el artículo 321 de la Ley 1955 \nde 2019, pero no en las proyecciones financieras presentadas como parte del Plan de \nInversión del 1%.\n3.8\nAdicionalmente, el parágrafo Primero del artículo 321 de la ley 1955 de 2019, también \nestableció a todas las empresas que tienen obligación de Inversión del 1%: La actualización \ndel valor de la base de liquidación del 1% deberá ser realizada con corte a 31 de diciembre \nde cada año fiscal y deberá ser presentada a más tardar a 31 de marzo del año siguiente.\n3.9\nEn cumplimiento de lo anterior, SierraCol ha presentado con los radicados que se mencionan \na continuación la respectiva actualización de la base de liquidación de la Inversión del 1%, \n\nResolución No. 000221       Del 14 FEB. 2024          Hoja No. 10 de 24\n“POR LA CUAL SE RESUELVE UN RECURSO DE REPOSICIÓN”\nPágina 10 de 24\nteniendo como base los valores de las liquidaciones presentadas con certificado de revisor \nfiscal cada año:\na.\nRadicado No. 2020050335-1-000 del 1 de abril de 2020 mediante el cual se presentó \nla liquidación y actualización del valor de inversión forzosa de no menos del 1% para \nel periodo fiscal 2019.\nb.\nRadicado No. 2021223237-1-000 del 14 de octubre de 2021 mediante el cual se \npresentó la actualización de los valores de inversión forzosa de no menos del 1% para \nlos periodos fiscales 2006 a 2020. \nc.\nRadicado No. 2022119242-1-000 del 10 de junio de 2022 mediante el cual se presentó \nla actualización de los valores de inversión forzosa de no menos del 1% para los \nperiodos fiscales 2006 a 2021. \nd.\nRadicado No. 2023068153-1-000 del 31 de marzo de 2023 mediante el cual se \npresentó la liquidación y actualización del valor de inversión forzosa de no menos del \n1% para los periodos fiscales 2006 a 2022.\n3.10\nDe acuerdo con la última actualización del valor presentada por SierraCol en el radicado \n2023068153-1-000 del 31 de marzo de 2023, el valor de la Inversión del 1% con corte a \ndiciembre 31 de 2022 asciende a: Dieciocho mil diez millones ochocientos sesenta y nueve \nmil ochocientos treinta y dos pesos ($18.010.869.832).\n3.11\nCon la información aquí presentada existe una diferencia del valor actualizado a diciembre de \n2022 de la Inversión del 1% entre lo radicado por SierraCol Energy el 31 marzo de 2023 y lo \naprobado por la ANLA en la Resolución 2590 del 8 de noviembre de 2023, que asciende a mil \nsetecientos seis millones quinientos setenta y siete mil ciento cuarenta y ocho pesos con \nochenta y dos centavos ($1,706,577,148.82).\n3.12\nTeniendo en cuenta lo anterior y la diferencia presentada entre los valores actualizados por la \nANLA y los presentados por SierraCol, la Compañía respetuosamente considera necesario \nque la Autoridad aclarare si a partir de la fecha se tomará como base para la actualización de \nlos valores de inversión del 1% lo establecido en el artículo segundo y tercero de la Resolución \n2590 del 8 de noviembre de 2023 o sí se deberá continuar actualizando el valor a partir de la \ntotalidad de los valores no ejecutados a la fecha, es decir se seguiría actualizando la totalidad \nde la base de inversión del 1% y, dependiendo de la respuesta anterior, proceda a modificar \nel artículo segundo de la Resolución 2590 del 8 de noviembre de 2023, si es el caso. (…)”\n3.13 Consideraciones de la Autoridad Nacional.\nA través del Concepto Técnico 185 del 23 de enero de 2024, el equipo técnico de la \nAutoridad Nacional consideró:\n“(…) Con Relación a lo manifestado por la Sociedad en los numerales 3.1., 3.2., 3.3., 3,4., 3,5. \ny 3.6 y 3.7 es cierto que la ANLA estableció el incremento por inejecución del Plan de inversión del \nno menos del 1%, acorde con el cronograma y proyección financiera presentada por SIERRACOL \nENERGYARAUCA LLC. mediante radicados 2019202901-1-000 del 23 de diciembre de 2019 y \ncomplemento radicado 2020116833-1-000 del 22 de julio de 2020 en el marco de la actualización \nestablecida en el parágrafo primero del artículo 321 de la Ley 1955 del 25 de mayo de 2019. En la \ncual se observa, que la Sociedad asignó recursos por la suma de $1.997.598.299 para ser invertidos \nen el año 2021 y la suma de $3.777.331.901 para ser invertidos en el año 2022, para un total de \ninversión en estos dos años de $5.774.930.200 a costo histórico, según se observa en la siguiente \nimagen:\n\nResolución No. 000221       Del 14 FEB. 2024          Hoja No. 11 de 24\n“POR LA CUAL SE RESUELVE UN RECURSO DE REPOSICIÓN”\nPágina 11 de 24\nFigura 1 Captura de Pantalla Proyección Financiera.\nFuente: Radicado 2020116833-1-000 del 22 de julio de 2020\nAhora bien, en el concepto técnico 6608 del 6 de octubre de 2023, con base en la información que \nreposa en el expediente LAM3368, se estableció que con corte 31 de diciembre de 2022, la sociedad \nno presentó soporte de avance financiero en los proyectos:\n✓\nProyecto 1. Implementación de Sistemas Agroforestales en los municipios de Arauquita y \nArauca de la cuenca media del río Ele. y,\n✓\nProyecto 3. Restauración ecológica pasiva mediante aislamiento con cerramiento del área \npor medio de cercados con postes y alambre. \nCabe aclarar, que el proyecto 2. “Implementación de Sistemas Silvopastoriles en la cuenca media \ndel río Ele” y el proyecto 5. “Cosecha de Agua en la cuenca media del río Ele” no fueron aprobados \npor esta Autoridad en la Resolución 1608 del 30 de septiembre de 2020. En relación con el numeral \n4 “Acuerdos de Conservación Voluntarios”, se aprueba como mecanismo de ejecución, no como \nlínea de inversión. Teniendo en cuenta lo evaluado en el concepto técnico 5805 del 17 de septiembre \nde 2020, a continuación, se cita el artículo segundo de la Resolución en mención, en donde se \nestablece la no aceptación de dichos proyectos:\n“ARTICULO SEGUNDO. No aceptar como líneas de inversión y proyectos/programas del plan de \ninversión forzosa de no menos del 1% vigentes para el proyecto “Campo de Desarrollo Caricare”, los \nsiguientes:”\n\nResolución No. 000221       Del 14 FEB. 2024          Hoja No. 12 de 24\n“POR LA CUAL SE RESUELVE UN RECURSO DE REPOSICIÓN”\nPágina 12 de 24\n(…)”\nComo consecuencia, de la no aceptación de los anteriores proyectos, la Sociedad debió invertir los \nrecursos de la inversión forzosa de no menos del 1%, en los proyectos aprobados por esta autoridad, \norientando los recursos disponibles a las líneas de inversión efectivamente aprobadas por esta \nAutoridad en la Resolución 1608 del 30 de septiembre de 2020.  \nEn relación con lo anterior, debe tenerse en cuenta que el trámite para la obtención de Licencia \nAmbiental, así como algunas de las actuaciones posteriores a la obtención del instrumento \nambiental, tales como la presentación y ajustes del plan de inversión forzosa de no menos del 1%, \nen aplicación del numeral 3 del artículo 4 de la Ley 1437 de 2011, constituye un trámite rogado por \ncuanto su impulso inicial surge del peticionario, el cual en este caso tiene el deber de suministrar a \nla Autoridad los insumos necesarios para su evaluación y pronunciamiento.\nAsí las cosas, acorde con la reglamentación vigente en materia de la inversión forzosa de no menos \ndel 1%, conforme el Decreto 1900 del 12 de junio de  2006, el parágrafo primero del artículo 321 de \nla Ley 1955 del 25 de mayo de 2019, y las disposiciones de la Resolución 1608 del 30 de septiembre \nde 2020; se resalta que si bien la sociedad requería modificar la proyección financiera a partir de la \nnegación de esos proyectos, la Sociedad debió de presentarla ajustada para evaluación por parte \nde esta Autoridad en tanto que la norma lo permitía. Cosa que la empresa no hizo, por tanto, se \ndebían de ejecutar los recursos en la línea aprobada en la Resolución 1608 del 30 de septiembre de \n2020, por lo cual a esta fecha no es dable para esta Autoridad, que la Sociedad pretenda justificarse \nen tal, o que presente ajustes cuando se evidenció una inejecución en los montos con cargo al plan \nde inversión forzosa de no menos del 1% en los años 2021 y 2022.\nPor su parte, el concepto técnico 5805 del 17 de septiembre de 2020, acogido con la Resolución \n1608 del 30 de septiembre de 2020, recalcó la importancia de enfocar los recursos de la inversión \nforzosa de no menos del 1% a las actividades de preservación, conservación y recuperación de la \ncuenca hidrográfica, objetivo establecido en el parágrafo del artículo 43 de la Ley 99 del 22 de \ndiciembre 1993, reglamentada por el Decreto 1900 del 12 de junio de 2006. \nPor lo que los esfuerzos y los montos de esta obligación, deben ser invertidos, en estos objetivos y \nno en acciones “COMPLEMENTARIAS y TRANSVERSALES a estas”, y con respecto a la línea de \n“Acciones de protección, conservación y preservación a través de restauración ecológica, \nrehabilitación y recuperación, dentro de las cuales se puede incluir el desarrollo de proyectos \nsostenibles” y sus mecanismos de implementación, en el mencionado concepto, se aclaró lo \nsiguiente:\n“Corresponden a incentivos, como es el caso de los Sistemas Agroforestales, Sistemas \nSilvopastoriles y Cosecha de agua; y a mecanismos de ejecución como es el caso de los \nAcuerdos de Conservación, por su parte la Restauración pasiva corresponde a un programa \no proyecto a ejecutar en el marco de la línea “Restauración, conservación y protección de la \ncobertura vegetal, enriquecimientos vegetales y aislamiento de áreas para facilitar la sucesión \nnatural”; es decir que la única línea de inversión aprobada para ejecutar la inversión del 1%, \nen el proyecto Campo de Desarrollo Caricare, es la línea “Restauración, conservación y \n\nResolución No. 000221       Del 14 FEB. 2024          Hoja No. 13 de 24\n“POR LA CUAL SE RESUELVE UN RECURSO DE REPOSICIÓN”\nPágina 13 de 24\nprotección de la cobertura vegetal, enriquecimientos vegetales y aislamiento de áreas para \nfacilitar la sucesión natural”.\nTeniendo en cuenta lo anterior, es importante además aclarar a la Sociedad que los proyectos \nde uso sostenible como lo son los SAF, el Sistema Silvopastoril y la Cosecha de agua, \nsolamente son aceptados a ejecutar en el marco de la línea “Acciones de protección, \nconservación y preservación a través de restauración ecológica, rehabilitación y recuperación, \ndentro de las cuales se puede incluir el desarrollo de proyectos sostenibles” comprendida en \nel Artículo 2.2.9.3.1.9. del Decreto 2099 del 22 de diciembre de 2016; y este NO es el régimen \nnormativo que rige para la inversión del 1% del proyecto Campo de Desarrollo Caricare.”\nAsí las cosas, los recursos pendientes de ejecutar con cargo al Plan de Inversión forzosa de no \nmenos del 1%, acorde con las líneas aprobadas por esta Autoridad, a la fecha del presente \npronunciamiento, deben ser orientados a la línea de “Restauración, conservación y protección de la \ncobertura vegetal, enriquecimientos vegetales y aislamiento de áreas para facilitar la sucesión \nnatural”, la cual se encuentra vigente.\nPor lo anterior, se concluye que los montos de la proyección financiera asignados para ser \nejecutados en los años 2021 y 2022 debían ser ejecutados en esta línea de inversión. Por lo anterior \nel argumento de la Sociedad, de no haber invertido estos montos derivados de la negación de \nalgunos de los proyectos por parte de esta Autoridad, no es procedente.\nAcorde con lo anterior la suma de $1.997.598.299 del año 2021 y la suma de $3.777.331.901 para \nel año 2022, relacionados en la proyección financiera de la comunicación con radicación  \n2020116833-1-000 del 22 de julio de 2020, la cual hace pate integral de la actualización con \nparágrafo primero del artículo 321 de la Ley 1955 del 25 de mayo de 2019, aceptada mediante la \nResolución 1608 del 30 de septiembre de 2020, para un total de inversión para estos dos años de \n$5.774.930.200 a costo histórico, se debió ejecutar en los proyectos de “Implementación de Sistemas \nAgroforestales en los municipios de Arauquita y Arauca de la cuenca Media del Río Ele” y proyecto \nde “Recuperación ecológica pasiva mediante aislamiento con cerramiento el área por medio de \ncercados con postes de alambre”, los cuales fueron aprobados por la Autoridad Nacional en el marco \nde la Actualización establecida en el parágrafo primero del artículo 321 de la Ley 1955 del 25 de \nmayo de 2019 y  teniendo en cuenta que los programas sistemas silvopastoriles, y cosecha de agua \ncorresponden a incentivos y no a una acción de preservación, razón por la cual se no se aceptaron \nen el artículo segundo de la Resolución 1608 del 30 de septiembre de 2020.\nTeniendo esto de presente, la Autoridad Nacional aplicó la fórmula del parágrafo primero del artículo \n321 de la ley 1955 de 2019, a los valores no ejecutados de la proyección financiera. \nCabe aclarar que la actualización por inejecución, no se le aplica a la totalidad de los recursos por \nejecutar del Plan de Inversión forzosa de no menos del 1% aprobado en el artículo primero de la \nResolución 1608 del 30 de septiembre de 2020, considerando que son los titulares los que deben \npresentar el plan de inversión acompañado del cronograma de ejecución y  la proyección financiera, \ntal como lo establece el Decreto 1900 del 12 de junio de 2006 y el artículo 321 de la Ley 1955 del 25 \nde mayo de 2019, los cuales son evaluados por la ANLA en el marco del seguimiento y de ser \npertinentes y encontrarse ajustados a la Ley, se aprueban, de lo contrario se efectúan \nrequerimientos, o se niegan. Por tanto, para verificar la inejecución se tiene en cuenta la proyección \nfinanciera del plan vigente.\nPor otra parte, el monto base de liquidación aprobado mediante la Resolución 1608 del 30 de \nseptiembre de 2020, incluyó la actualización con la fórmula establecida en el parágrafo primero del \nartículo 321 de la Ley 1955 del 25 de mayo de 2019, el periodo 2006 a 2018; mecanismo que permitió \ntraer a valor presente (2019) los valores no ejecutados del plan de inversión del 1%, con base en los \ncertificados de contador público o revisor fiscal.\n\nResolución No. 000221       Del 14 FEB. 2024          Hoja No. 14 de 24\n“POR LA CUAL SE RESUELVE UN RECURSO DE REPOSICIÓN”\nPágina 14 de 24\nAhora bien, los valores no ejecutados del Plan de Inversión forzosa de no menos del 1% aprobado \nmediante la Resolución 1608 del 30 de septiembre de 2020, acorde con el cronograma y proyección \nfinanciera, luego del acogimiento o la actualización de conformidad con el mecanismo seleccionado \npor el titular de la licencia ambiental, en el marco de lo establecido en el artículo 321 de la Ley 1955 \ndel 25 de mayo de 2019; son objeto de incremento con IPC, solo en el caso de “Inejecución por un \ntiempo superior a un año fiscal”. Dicho incremento; se aplica para mantener vigente la obligación de \nla inversión forzosa de no menos del 1%, por efectos de la pérdida del valor del dinero por el paso \ndel tiempo, en economías como la nuestra, afectadas con procesos de inflación.\nPara este caso en particular, se aplica el cálculo del incremento por “inejecución” sobre los valores \nno ejecutados de la proyección financiera de los años 2021 y 2022, los cuales, una vez verificados \npor esta Autoridad se confirmó que no se reportó ejecución por parte de la Sociedad para estos años, \ny no sobre el total no ejecutado del Plan de inversión del 1%.  \nCabe aclarar que la fórmula a utilizar es la establecida en el parágrafo primero del artículo 321 de la \nLey 1955 del 25 de mayo de 2019. \n \nAsí las cosas, la ANLA en el concepto técnico 6608 del 6 de octubre de 2023, acogido con la \nResolución 2590 del 2023, aplicando la fórmula del parágrafo primero del artículo 321 de la Ley 1955 \nde 2019, a los valores no ejecutados de la proyección financiera, efectúo el siguiente cálculo:\n“(…)\n(…)”\nMediante la tabla anterior, el equipo evaluador trajo a valor presente (2022) con un IPC del 126,03 \n(de serie índice de empalme DANE) el valor no ejecutado del Plan de Inversión del 1% acorde con \nla proyección realizada por la Sociedad, es decir la suma de $5.774.930.200 para los años 2021 y \n2022, lo que da como resultado un valor actualizado por la suma de $7.011.699.933,58.\nEn la siguiente tabla se muestra el incremento por inejecución de los montos del 2021 y 2022, a valor \npresente de 2022.\nTabla 1. Incremento por Inejecución a valor presente 2022.\nValor proyectado de Inversión \n2021 -2022 a costo histórico.\nValor no ejecutado ajustado \ncon parágrafo primero del \nartículo 321 de la Ley 1955 \n(Serie de empalme DANE a \n2022)\nIncremento por Inejecución.\n$5.774.930.200,00\n$7.011.699.933,58\n$1.236.769.733,58\nFuente: Elaboración propia del Equipo Evaluador. -2024\n\nResolución No. 000221       Del 14 FEB. 2024          Hoja No. 15 de 24\n“POR LA CUAL SE RESUELVE UN RECURSO DE REPOSICIÓN”\nPágina 15 de 24\nFinalmente, se concluyó en el concepto 6608 del 6 de octubre de 2023, acogido por la Resolución \n2590 del 8 de noviembre de 2023, que el incremento por inejecución acorde con el cronograma por \nmás de un año fiscal, conforme con lo establecido en el artículo segundo de la Resolución en \nmención corresponde a la suma de MIL DOSCIENTOS TREINTA Y SEIS MILLONES \nSETECIENTOS SESENTA Y NUEVE MIL SETECIENTOS TREINTA Y TRES PESOS CON \nCINCUENTA Y OCHO CENTAVOS ($1.236.769.733,58), como incremento por inejecución de los \naños 2021 y 2022. Actualizado del año 2019 al año 2022, el valor no ejecutado de la proyección \nfinanciera, con la fórmula del parágrafo primero del artículo 321 de la Ley 1955 del 25 de mayo de \n2019. \nCon relación a los argumentos 3.8 y 3.9  de la Sociedad, el parágrafo primero del artículo 321 de la \nley 1955 del 25 de mayo de 2019 establece que “la actualización del valor base de liquidación \ndel 1% deberá ser realizada con corte 31 de diciembre de cada año fiscal y deberá ser \npresentada a más tardar a 31 de marzo del año siguiente”, dicho aparte de la norma citada, hace \nreferencia a la presentación de los certificados de contador público o revisor fiscal, en los que la \nSociedad debe informar la base de liquidación a costo histórico del año inmediatamente anterior, de \ntal manera que los valores de liquidación que se generan con posterioridad al año 2019, para los \nproyectos que se encuentran aún en etapa de desarrollo, reporten mediante este documento los \nvalores base de liquidación de la inversión forzosa de no menos del 1%, como es el caso del proyecto \n“Explotación de Hidrocarburos en el Área Caricare”. \nCon esto de presente, acorde con lo establecido en el parágrafo primero del artículo 321 de la ley \n1955 del 25 de mayo de 2019, la ANLA mediante la Resolución 1608 del 30 de septiembre de 2020 \naprobó el monto actualizado de 2006 a 2018 en los siguientes términos:\n \n“ARTÍCULO QUINTO. Aceptar para el proyecto “Campo de Desarrollo Caricare” la liquidación \nparcial actualizada al artículo 321 de la Ley 1955 del 25 de mayo de 2019, de la inversión \nforzosa de no menos del 1%, que corresponde a la suma de DIEZ MIL \nCUATROCIENTOSTREINTA Y SEIS MILLONES CIEN MIL OCHOCIENTOS SETENTA Y \nCUATRO PESOS MCTE. ($10.436.100.874), liquidado sobre la base de liquidación \nactualizada que asciende a la suma de UN BILLÓN CUARENTA Y TRES MIL SEISCIENTOS \nDIEZ \nMILLONES \nOCHENTA \nY \nSIETE \nMIL \nCUATROCIENTOS \nPESOS \nMCTE. \n($1.043.610.087.400), para el periodo comprendido entre 2006 a 2018.\nPARÁGRAFO PRIMERO. El incremento del valor de actualización de la Inversión forzosa de \nno menos del 1%, corresponde a la suma de MIL OCHOCIENTOS SETENTA Y TRES \nMILLONES CIENTO NUEVE MIL OCHOCIENTOS CINCO PESOS MCTE. ($1.873.109.805).”\nPosteriormente, con base en los valores certificados por revisor fiscal para los años 2019, 2020, \n2021 y 2022, a costo histórico, entregados en los radicados:\na.\nComunicación con radicación No. 2020050335-1-000 del 1 de abril de 2020 mediante el cual \nse presentó la liquidación para el periodo fiscal 2019.\nb.\nComunicación con radicación 2021223237-1-000 del 14 de octubre de 2021 mediante el cual \nse presentó la liquidación para el periodo 2020. \nc.\nComunicación con radicación 2022119242-1-000 del 10 de junio de 2022 mediante el cual \nse presentó la liquidación para el periodo 2021. \nd.\nComunicación con radicación 2023068153-1-000 del 31 de marzo de 2023 mediante el cual \nse presentó la liquidación para el periodo 2022.\n   \n\nResolución No. 000221       Del 14 FEB. 2024          Hoja No. 16 de 24\n“POR LA CUAL SE RESUELVE UN RECURSO DE REPOSICIÓN”\nPágina 16 de 24\nLa Autoridad Nacional evalúo los valores base de liquidación a “costo histórico” generados para los \naños 2019, 2020, 2021, y 2022 adicionando dichos valores a la base actualizada con IPC a 2018, \nanexos en las comunicaciones anteriores. \nCon respecto a las liquidaciones de las inversiones base de liquidación de la inversión forzosa de no \nmenos del 1% de los años 2023 y 2024, no han sido presentadas, encontrándose la Sociedad en \ntiempos para la entrega de las mismas a esta Autoridad.  Por lo que la base de liquidación para los \naños 2023, y 2024 se conocerá una vez la Sociedad presente los respectivos certificados de contador \npúblico o revisor fiscal. Contrario a lo manifestado en el siguiente aparte de la Petición:\n“Dependiendo de la respuesta anterior, si es el caso, MODIFICAR el valor base de liquidación \nde la inversión de 1% que para marzo de 2024 correspondería a los Dieciocho mil diez millones \nochocientos sesenta y nueve mil ochocientos treinta y dos pesos (18.010.869.832) conforme a \nlo reportado por el revisor fiscal de SierraCol Energy mediante radicado No. 2023068153-1-000 \ndel 31 de marzo de 2023.” (Subrayado y negrilla fuera de texto).\nAdicionalmente, como se dijo en párrafos anteriores, con posterioridad a la aprobación del monto \nactualizado a 2018, solo aplica el incremento por la “inejecución” de los valores no ejecutados acorde \ncon el cronograma y proyección financiera presentados por la Sociedad en el marco de lo establecido \nen el artículo 321 de la Ley 1955 del 25 de mayo de 2019, los cuales hacen parte integral del Plan \nde inversión forzosa de no menos del 1% aprobado por esta Autoridad en la Resolución 1608 del 30 \nde septiembre de 2020.\nCon relación a la base de liquidación de la inversión forzosa de no menos del 1%, a partir de la \nentrada en vigor de la Ley 1955 del 25 de mayo de 2019, Plan de Desarrollo “Pacto por Colombia, \npacto por la Equidad”; en cuyo artículo 321 se unifica la base de liquidación de la inversión Forzosa \nde no menos del 1%, se precisa la forma y los ítems a incluir en la Base de liquidación.\nA continuación, transcribimos lo dispuesto en el artículo 321 referente a la Base de liquidación de la \ninversión forzosa de no menos del 1%:\n“Para los que se acojan o no al artículo y los nuevos titulares de licencia, la liquidación de la \ninversión se realizará de conformidad con los siguientes ítems: a) adquisición de terrenos e \ninmuebles, b) obras civiles, c) adquisición y alquiler de maquinaria y equipo utilizado en las \nobras civiles y d) constitución de servidumbres. Los costos y gastos, incluidos los capitalizados \nen el activo, a que se refieren los literales anteriores, corresponden a los realizados en las \netapas previas a la producción de proyectos, obras o actividades sujetos de licenciamiento \nambiental o aquellas modificaciones de proyectos, obras o actividades que tengan como \ninstrumento de control un plan de manejo ambiental, siempre y cuando dicha modificación \ncumpla con las condiciones establecidas en la reglamentación vigente.”\nAcorde con los certificados por el Revisor fiscal de la Sociedad, la ANLA ha aceptado los siguientes \nvalores de liquidación de la inversión forzosa de no menos del 1%, para el periodo año 2006 al año \n2022:\n\nResolución No. 000221       Del 14 FEB. 2024          Hoja No. 17 de 24\n“POR LA CUAL SE RESUELVE UN RECURSO DE REPOSICIÓN”\nPágina 17 de 24\nTabla 2. Resumen valores base de liquidación Inversión Forzosa de no menos del 1% \nperiodo 2006 a 2022.\nDetalle/ Periodo.\nBase de liquidación\nValor \nLiquidación \n1%\nActo Administrativo\nLiquidación \npara \nel \nperiodo 2006 a 2018 \nincluye \nactualización \ncon parágrafo primero \ndel artículo 321 de la \nLey 1955 de 2019.\n \n$1.043.610.087.400,0\n0 \n$ 10.436.100.874\nArtículo \nquinto \nResolución 1608 del 30 \nde septiembre de 2020, \nmodificado por el artículo \nsegundo de la Resolución \n1611 \ndel \n10 \nde \nseptiembre de 2021 y por \nel artículo tercero de la \nResolución 2590 del 8 de \nnoviembre de 2023.\nLiquidación para el año \n2019. (costo histórico)\n $126.857.086.963,00  $1.268.570.869,63 \nArtículo Primero de la \nResolución 2590 del 8 de \nnoviembre de 2023.\nLiquidación para el año \n2020 (Costo histórico)\n $52.102.588.190,00 \n $521.025.881,90 \nArtículo \nprimero \nResolución 1611 del 10 \nde septiembre de 2021.\nLiquidación para el año \n2021 (Costo histórico)\n $150.276.770.457,00  $1.502.767.704,57 \nArtículo Primero de la \nResolución 2590 del 8 de \nnoviembre de 2023.\nLiquidación para el año \n2022 (Costo histórico)\n $133.905.761.950,00  $1.339.057.619,50 \nArtículo Primero de la \nResolución 2590 del 8 de \nnoviembre de 2023.\nTotal \nLiquidación \nperiodo 2006 a 2022. \n(Incluye actualización \na 2018 con parágrafo \nprimero del artículo \n321 de la Ley 1955 de \n2019)\n$1.506.752.294.960,0\n0 \n$ 15.067.522.949,60\nTotal \nLiquidación \nInversión Forzosa de no \nmenos del 1% (2006-\n2022)\nFuente: Elaboración propia del Equipo Evaluador. -2024\nDe tal forma, el valor certificado para los años 2019 a 2022, se adiciona al valor actualizado con el \nparágrafo primero del artículo 321 de la Ley 1955 del 25 de mayo de 2019 del periodo 2006 a 2018, \ndando como resultado una liquidación acumulada por la suma de QUINCE MIL SESENTA Y SIETE \nMILLONES QUINIENTOS VEINTIDOS MIL NOVECIENTOS CINCUENTA PESOS MCTE. \n($15.067.522.950), para el periodo 2006 a 2022, del proyecto “Explotación de hidrocarburos en el \nÁrea Caricare”, monto que no incluye, el incremento por inejecución del cronograma y proyección \nfinanciera por más de un año fiscal para los años 2021 y 2022, establecido en el artículo segundo \nde la Resolución 2590 del 8 de noviembre de 2023.\nAhora bien, en el artículo segundo de la Resolución 2590 del 8 de noviembre de 2023, la Autoridad \nNacional estableció el incremento por inejecución del plan de inversión del 1%, para los años 2021 \ny 2022, en los siguientes términos:\n“ARTÍCULO SEGUNDO. ESTABLECER a la Sociedad SIERRACOL ENERGY ARAUCA LLC \nel incremento del valor de la inversión forzosa de no menos del 1%, del valor presupuestado \npara la ejecución de los años 2021 y 2022, por la inejecución del Plan de inversión en un \ntiempo superior a un (1) año fiscal, aplicando la fórmula del Parágrafo Primero del Artículo 321 \nde la Ley 1955 de 2019, que corresponde a la suma de MIL DOSCIENTOS TREINTA Y SEIS \n\nResolución No. 000221       Del 14 FEB. 2024          Hoja No. 18 de 24\n“POR LA CUAL SE RESUELVE UN RECURSO DE REPOSICIÓN”\nPágina 18 de 24\nMILLONES SETECIENTOS SESENTA Y NUEVE MIL SETECIENTOS TREINTA Y TRES \nPESOS CON CINCUENTA Y OCHO CENTAVOS ($1.236.769.733,58), actualizado de 2019 \na 2022, de conformidad con lo expuesto en la parte motiva del presente acto administrativo.”\nAsí las cosas, el valor de liquidación de la inversión forzosa de no menos del 1%, para el periodo \n2006 a 2022 del proyecto de “Explotación de hidrocarburos en el Área Caricare”, incluyendo el \nincremento por inejecución, de los años 2021 y 2022, es el siguiente:\nTabla 3. Liquidación Actualizada (2006 a 2022) incluyendo incremento por Inejecución del \nPlan de Inversión 1%\nLiquidación \nacumulada \ninversión forzosa de no menos \ndel 1% periodo 2006 a 2022.\nIncremento \npor \nInejecución \nPlan \nde \nInversión \ndel \n1% \nestablecido en artículo segundo \nResolución \n2590 \ndel \n8 \nde \nnoviembre de 2023. Para los \naños 2021 y 2022.\nTotal \nLiquidación \ninversión \nforzosa de no menos del 1% \nactualizada \na \n2022, \nincluye \nincremento por Inejecución.\n$15.067.522.949,60\n$1.236.769.733,58\n$16.304.292.683,18\nFuente: Elaboración propia del Equipo Evaluador. -2024\nPor lo anterior, en el artículo tercero de la Resolución 2590 del 8 de noviembre de 2023, se modificó \nal artículo quinto de la Resolución 1608 del 30 de septiembre de 2020, en los siguientes términos:\nARTÍCULO TERCERO. MODIFICAR el artículo quinto de la Resolución 1608 del 30 de \nseptiembre de 2020, de conformidad con lo expuesto en la parte motiva del presente acto \nadministrativo, el cual quedará de la siguiente manera: \n“ARTÍCULO QUINTO. ACEPTAR la liquidación parcial acumulada de la inversión forzosa de \nno menos del 1%, que corresponde a la suma de DIECISEIS MIL TRESCIENTOS CUATRO \nMILLONES DOSCIENTOS NOVENTA Y DOS MIL SEISCIENTOS OCHENTA Y TRES PESOS \nCON DIECIOCHO CENTAVOS ($16.304.292.683,18), liquidado sobre la base de liquidación \nque asciende a la suma de UN BILLÓN SEISCIENTOS TREINTA MIL CUATROCIENTOS \nVEINTINUEVE MILLONES DOSCIENTOS SESENTA Y OCHO MIL TRESCIENTOS \nDIECIOCHO PESOS ($1.630.429.268.318), para el periodo comprendido entre los años 2006 \ny 2022.”  \nCon relación a los argumentos 3.10, 3.11 y 3.12 de la Sociedad, esta Autoridad manifiesta que el \nvalor de actualización calculado por la sociedad SIERRACOL ENERGY ARAUCA LLC, corresponde \na la suma de Dieciocho mil diez millones ochocientos sesenta y nueve mil ochocientos treinta \ny dos pesos ($18.010.869.832), de acuerdo con los cálculos que presentó en el radicado \n2023068153-1-00 del 31 de marzo de 2023. \nDicho valor es superior en la suma de mil setecientos seis millones quinientos setenta y siete \nmil ciento cuarenta y ocho pesos con ochenta y dos centavos ($1,706,577,148.82), respecto al \nestablecido por la ANLA en el artículo tercero de la Resolución 2590 del 8 de noviembre de 2023. \nLo anterior, debido a que la Sociedad actualizó con IPC la totalidad de los valores por ejecutar con \ncargo al Plan de Inversión del 1% del periodo 2019 a 2022, sin tener en cuenta que ya obraba en el \nexpediente LAM3368, una actualización aprobada hasta el año 2018, aprobada mediante el artículo \nquinto de la Resolución 1608 del 30 de septiembre de 2020, modificada por la Resolución 2590 del \n8 de noviembre de 2023. Faltando por actualizar los valores no ejecutados del Plan de Inversión del \n1%, acorde con el cronograma y proyección financiera aprobados en la Resolución 1608 del 30 de \nseptiembre de 2020.\n\nResolución No. 000221       Del 14 FEB. 2024          Hoja No. 19 de 24\n“POR LA CUAL SE RESUELVE UN RECURSO DE REPOSICIÓN”\nPágina 19 de 24\nComo se explicó anteriormente, los valores no ejecutados del Plan de Inversión forzosa de no menos \ndel 1% según el cronograma y proyección financiera de la comunicación con radicación 2020116833-\n1-000 del 22 de julio de 2020; luego del acogimiento o la actualización de conformidad con el \nmecanismo seleccionado por el titular de la licencia ambiental, en el marco de lo establecido en el \nartículo 321 de la Ley 1955 del 25 de mayo de 2019, son objeto de incremento con IPC, solo en el \ncaso de “Inejecución por un tiempo superior a un año fiscal”. Dicho incremento; se aplica para \nmantener vigente la obligación de la inversión forzosa de no menos del 1%, por efectos de la pérdida \ndel valor del dinero por el paso del tiempo, en economías como la nuestra, afectadas con procesos \nde inflación.\nPara este caso en particular, se aplica el cálculo del incremento por “inejecución” sobre los valores \nno ejecutados de la proyección financiera para los años 2021 y 2022 y no sobre el total no ejecutado \ndel Plan de inversión del 1%.  Cabe aclarar que la fórmula utilizada es la establecida en el parágrafo \nprimero del artículo 321 de la Ley 1955 de 2019.\nIgualmente, se aclaró que la ANLA con base en la proyección financiera realizada por la Sociedad, \ntomó la suma de $5.774.930.200, valor no ejecutado para los años 2021 y 2022, lo que dio como \nresultado un incremento por la suma de $1.236.769.733,58, por inejecución.\nPor otra parte, teniendo en cuenta, que el proyecto “Implementación de Sistemas Silvopastoriles en \nla cuenca media del río Ele” y  “Cosecha de Agua en la cuenca media del río Ele” no fueron \naprobados por esta Autoridad en la Resolución 1608 del 30 de septiembre de 2020, por ser incentivos \ny no obedecer a un proyecto de los establecidos en el Decreto 1900 de 2006, los recursos de la \ninversión forzosa de no menos del 1%, deben ser orientados a las líneas vigentes, sin disminuir el \nmonto del Plan de inversión del 1% proyectado como inversión a realizar en los años 2021 y 2022. \nA continuación, se detalla, la diferencia entre el monto actualizado por la Sociedad a 2022 y el valor \nde liquidación de la inversión forzosa de no menos del 1% acumulado de 2006 a 2022, establecido \npor la ANLA en la Resolución 2590 del 8 de noviembre de 2023, incluyendo el incremento por \ninejecución del Plan de Inversión acorde con el cronograma y proyección financiera.\nTabla 4.  Diferencia de liquidación acumulada inversión 1% actualizada 2006 a 2022 ANLA \nversus Sociedad.\nValor de liquidación \nestablecida por ANLA en \nartículo tercero Resolución \n2590 del 8 de noviembre de \n2023. (Periodo 2006-2022 \nincluye incremento por \ninejecución)\nValor actualizado por la \nSociedad para el periodo \n2006 a 2022 con la fórmula \ndel parágrafo primero del \nartículo 321 de la Ley 1955 \nde 2019.\nDiferencia\n$16.304.292.683,18\n$18.010.869.832\n$1.706.577.148.82\nFuente: Elaboración propia del Equipo Evaluador. -2024\nAhora bien, respecto a la petición puntual de la Sociedad:\n“ACLARAR si a partir de la fecha se tomará como base para la actualización de los valores \nde inversión del 1% (i) lo establecido en el artículo segundo y tercero de la Resolución 2590 \ndel 8 de noviembre de 2023, o (ii) sí se deberá continuar actualizando el valor de la totalidad \nde los valores no ejecutados a la fecha, que corresponde a la totalidad de la base de inversión \ndel 1%.”    \n“Dependiendo de la respuesta anterior, si es el caso, MODIFICAR el valor base de liquidación \nde la inversión de 1% que para marzo de 2024 correspondería a los Dieciocho mil diez millones \n\nResolución No. 000221       Del 14 FEB. 2024          Hoja No. 20 de 24\n“POR LA CUAL SE RESUELVE UN RECURSO DE REPOSICIÓN”\nPágina 20 de 24\nochocientos sesenta y nueve mil ochocientos treinta y dos pesos (18.010.869.832) conforme \na lo reportado por el revisor fiscal de SierraCol Energy mediante radicado No. 2023068153-1-\n000 del 31 de marzo de 2023.”\nEsta Autoridad, aclara que la liquidación de la inversión forzosa de no menos del 1%, se debe realizar \na más tardar cada 31 de marzo de cada vigencia fiscal, informando mediante certificado de contador \npúblico o revisor fiscal  la base de liquidación, a costo histórico, en pesos, las inversiones base de \nliquidación del proyecto licenciado realizadas en el año inmediatamente anterior, detalladas en los \nítems: a) adquisición terrenos e inmuebles, b) obras civiles, c) adquisición y alquiler de maquinaria y \nequipo utilizado en obras civiles y d) constitución de servidumbres; lo anterior de conformidad con lo \nestablecido en el artículo 321 de la Ley 1955 del 25 de mayo de 2019.\nEn cuanto a la actualización de los valores no ejecutados del plan de Inversión forzosa de no menos \ndel 1%, esta se aplicará sobre los valores no ejecutados acorde con el cronograma, por más de un \naño fiscal, partiendo de los valores de la proyección financiera presentados por la Sociedad, los \ncuales hacen parte integral de la actualización de la base de liquidación aprobada por esta Autoridad \nen la Resolución 1608 del 30 de septiembre de 2020, modificada por la Resolución 1611 del 10 de \nseptiembre de 2021 y Resolución 2590 del 8 de noviembre de 2023. \n \nEn cuanto a la proyección financiera de los montos de liquidación de los años 2006 a 2018, la \nsociedad debe presentar el ajuste, destinando la totalidad de los recursos inicialmente proyectados \nen la comunicación con radicación 2020116833-1-000 del 22 de julio de 2020, entre los proyectos y \nlíneas de inversión efectivamente aprobados en la Resolución 1608 del 30 de septiembre de 2020. \nNo obstante, para los montos de liquidación de los años 2019, 2020, 2021 y 2022, será necesario \nque la sociedad ajuste el plan de inversión del 1%, informando los programas o proyectos en los que \nserán invertidos los montos generados, en dicho periodo, en desarrollo del proyecto licenciado, \nacorde con las líneas de inversión del Decreto 1900 del 12 de junio de 2006, marco normativo que \naplica al plan de inversión forzosa de no menos del 1% del proyecto “Explotación de Hidrocarburos \nen el Área Caricare”. Lo anterior, según lo solicitado en el numeral 2 del artículo quinto de la \nResolución 2590 del 8 de noviembre de 2023, el cual a continuación se transcribe:\n“2. Ajustar el presupuesto del Plan de Inversión forzosa de no menos del 1%, acorde al monto \nactualizado, aceptado y modificado por la Autoridad Nacional de Licencias Ambientales, de \nconformidad con lo establecido en el Parágrafo Primero del Artículo 321 de la Ley 1955 de \n2019.”\nEn cuanto al presupuesto y proyección financiera de los montos de liquidación de los años 2019, \n2020, 2021 y 2022, en el numeral 3 del artículo quinto de la Resolución 2590 del 8 de noviembre de \n2023, se requirió a la Sociedad lo siguiente:\n“3. Presentar la proyección financiera para la ejecución del Plan de inversión ajustada al valor \nde actualización de la inversión forzosa de no menos del 1%, en la cual se detalle el presupuesto \na ejecutar por cada período (Año, mes o el período que corresponda), y su respectivo \ncronograma, acorde al monto actualizado de la inversión forzosa de no menos del 1%, de \nconformidad con lo establecido en el Parágrafo Primero del Artículo 321 de la Ley 1955 de \n2019.”\nPor su parte en el numeral 3.6 del artículo sexto de la Resolución 1611 del 10 de noviembre de 2021, \nse solicitó la presentación de los presupuestos de los proyectos del plan de inversión del 1% \npendientes de ejecutar, del periodo 2019 al 2022, en los siguientes términos:\n“3.6 Presentar el presupuesto y la respectiva proyección financiera para los valores pendientes \npor ejecutar de la inversión forzosa de no menos del 1% y de los que aún no se ha presentado \npresupuesto”\n\nResolución No. 000221       Del 14 FEB. 2024          Hoja No. 21 de 24\n“POR LA CUAL SE RESUELVE UN RECURSO DE REPOSICIÓN”\nPágina 21 de 24\nAsí las cosas, una vez la sociedad presente el ajuste a la proyección financiera y cronograma para \nla ejecución de los valores de liquidación de la inversión forzosa de no menos del 1%, acorde con el \nvalor de liquidación aprobado en el artículo  tercero de la Resolución 2590 del 8 de noviembre de \n2023, esta Autoridad aplicará la misma metodología para la actualización de los valores no \nejecutados del plan de inversión del 1%, en caso de inejecución de los montos y actividades que \nestablezca la Sociedad  en el cronograma y proyección financiera. Partiendo de dichos valores, solo \nen caso de presentarse “inejecución” por más de un año fiscal respecto a los valores de la proyección \ny actividades del cronograma respectivo.  No obstante, cabe aclarar que en caso de que la Sociedad \nno presente el plan de inversión para la ejecución de los montos generados durante los años 2019 \na 2022, con su respectiva proyección financiera y cronograma; la actualización se aplicará sobre el \nvalor total de los valores de liquidación a costo histórico, al no contar la Autoridad con las \nherramientas (Plan de inversión, proyección financiera y cronograma); necesarias para la estimación \nde la inejecución del Plan de inversión Forzosa de no menos del 1%.\nAcorde con las anteriores aclaraciones, se concluye, que no hay lugar a modificar el valor establecido \npor la Autoridad Nacional en el artículo segundo, ni en el artículo tercero de la Resolución 2590 del \n8 de noviembre de 2023, por medio del cual se modificó el artículo quinto de la Resolución 1608 del \n30 de septiembre de 2020; valor que corresponde a la suma de DIECISEIS MIL TRESCIENTOS \nCUATRO MILLONES DOSCIENTOS NOVENTA Y DOS MIL SEISCIENTOS OCHENTA Y TRES \nPESOS CON DIECIOCHO CENTAVOS ($16.304.292.683,18), liquidado sobre la base de liquidación \nque asciende a la suma de UN BILLÓN SEISCIENTOS TREINTA MIL CUATROCIENTOS \nVEINTINUEVE MILLONES DOSCIENTOS SESENTA Y OCHO MIL TRESCIENTOS DIECIOCHO \nPESOS ($1.630.429.268.318), para el periodo comprendido entre los años 2006 y 2022, monto que \nincluye el incremento por inejecución del Plan de Inversión forzosa de no menos del 1%\n(…)”\nDicho lo anterior, es pertinente señalar que la Autoridad Nacional es garante de la \nConstitución, de la Ley, de los principios de la función administrativa y de los procedimientos \nque rigen la actuación administrativa en materia ambiental; en ese sentido los actos y \npronunciamientos que se profieren en el marco de los procesos de seguimiento de los \ninstrumentos de manejo y control se encuentran debidamente sustentados tanto técnica \ncomo jurídicamente; es así como en aplicación de los principios del debido proceso, \nigualdad, imparcialidad, buena fe, moralidad, participación, responsabilidad, transparencia, \npublicidad, coordinación, eficacia, economía y celeridad, la Autoridad Nacional expidió la \nResolución 2590 del 8 de noviembre de 2023 respetando las normas jurídicas superiores, \nla normativa ambiental vigente y conforme a los soportes presentados por la Sociedad. \nAhora bien, es pertinente precisar que la Sociedad se encuentra bajo el régimen normativo \ndel Decreto 1900 del 12 de junio de 2006 y los recursos pendientes de ejecutar con cargo \nal Plan de Inversión forzosa de no menos del 1%, acorde con las líneas aprobadas por esta \nAutoridad, deben ser orientados a la línea de “Restauración, conservación y protección de \nla cobertura vegetal, enriquecimientos vegetales y aislamiento de áreas para facilitar la \nsucesión natural”, razón por la cual los montos de la proyección financiera asignados para \nser ejecutados en los años 2021 y 2022 debían ser ejecutados en esta línea de inversión.\nSumado a lo anterior, la Sociedad debe presentar el ajuste de la proyección financiera de \nlos montos de liquidación de los años 2006 a 2018, destinando la totalidad de los recursos \ninicialmente proyectados en la comunicación con radicación 2020116833-1-000 del 22 de \n\nResolución No. 000221       Del 14 FEB. 2024          Hoja No. 22 de 24\n“POR LA CUAL SE RESUELVE UN RECURSO DE REPOSICIÓN”\nPágina 22 de 24\njulio de 2020, entre los proyectos y líneas de inversión efectivamente aprobados en la \nResolución 1608 del 30 de septiembre de 2020.\nCon respecto a los montos de liquidación de los años 2019, 2020, 2021 y 2022, la sociedad \ndebe ajustar el plan de inversión del 1%, informando los programas y/o proyectos en los \nque serán invertidos los montos generados, en dicho periodo, en desarrollo del proyecto \nlicenciado, acorde con las líneas de inversión del Decreto 1900 del 12 de junio de 2006. \nAdicionalmente, valga manifestar que mientras la Resolución 2590 del 8 de noviembre de \n2023, no sea modificada a través de un pronunciamiento de la Autoridad Nacional, sea de \noficio o a petición de la Sociedad, goza de presunción de legalidad y comprende el estado \nactual de lo que se ha ejecutado con cargo a la inversión forzosa de no menos del 1%.\nFinalmente, teniendo en cuenta que la Sociedad no ejecutó las actividades de acuerdo con \nel cronograma, y que ha transcurrido un tiempo superior a un año (1) fiscal, de conformidad \ncon la formula señalada en el parágrafo 1 del Artículo 321 de la Ley 1955 del 25 de mayo \nde 2019 la Sociedad deberá actualizar los valores no ejecutados del plan de Inversión \nforzosa de no menos del 1% partiendo de los valores de la proyección financiera \npresentados, los cuales hacen parte integral de la actualización de la base de liquidación \naprobada por la Autoridad Nacional en la Resolución 1608 del 30 de septiembre de 2020, \nla cual fue modificada por las Resoluciones 1611 del 10 de septiembre de 2021 y 2590 del \n8 de noviembre de 2023.\nPor las razones anteriormente expuestas y una vez evaluados los argumentos presentados \npor la Sociedad recurrente y en concordancia con las consideraciones señaladas en el \nConcepto Técnico 185 del 23 de enero de 2024, la Autoridad Nacional no encuentra \nsustento para reponer el contenido de los artículos segundo y tercero de la Resolución 2590 \ndel 8 de noviembre de 2023 y en ese sentido, en la parte resolutiva del presente acto \nadministrativo, se confirmarán los mismos. \nRESUELVE\nARTÍCULO PRIMERO. Confirmar el contenido del artículo segundo de la Resolución 2590 \ndel 8 de noviembre de 2023, de conformidad con lo expuesto en la parte motiva del \npresente acto administrativo.\nARTÍCULO SEGUNDO. Confirmar el contenido del artículo tercero de la Resolución 2590 \ndel 8 de noviembre de 2023, de conformidad con lo expuesto en la parte motiva del \npresente acto administrativo.\nARTÍCULO TERCERO. Los demás términos, condiciones y obligaciones establecidas en \nla Resolución 2590 del 8 de noviembre de 2023, que no fueron objeto de pronunciamiento \nen el presente acto administrativo, continúan vigentes y exigibles en cualquier momento\nARTÍCULO CUARTO. Notificar el presente acto administrativo al representante legal, o al \napoderado debidamente constituido o a la persona debidamente autorizada de la Sociedad \nSIERRACOL ENERGY ARAUCA LLC, o a quien haga sus veces, de conformidad con lo \ndispuesto en los artículos 67 y 69 del Código de Procedimiento Administrativo y de lo \nContencioso Administrativo. \n\nResolución No. 000221       Del 14 FEB. 2024          Hoja No. 23 de 24\n“POR LA CUAL SE RESUELVE UN RECURSO DE REPOSICIÓN”\nPágina 23 de 24\nPARÁGRAFO. En el evento en que el titular de la licencia o el permiso, según el caso, sea \nuna persona natural que se acoja al proceso de insolvencia regulado por las normas \nvigentes, o se trate de una sociedad comercial o de una sucursal de sociedad extranjera \nque entre en proceso de disolución o régimen de insolvencia empresarial o liquidación \nregulados por las normas vigentes, informará inmediatamente de esta situación a esta \nAutoridad, con fundamento, entre otros, en los artículos 8, 58, 79, 80, 81, 95 numeral 8 de \nla Constitución Política de 1991, en la Ley 43 de 1990, en la Ley 222 de 1995, en la Ley \n1333 de 2009 y demás normas vigentes y jurisprudencia aplicable. \nAdicional a la obligación de informar a esta Autoridad de tal situación, el titular de la licencia \no permiso aprovisionará contablemente las obligaciones contingentes que se deriven de la \nexistencia de un procedimiento ambiental sancionatorio conforme con el artículo 40 de la \nLey 1333 de 2009 o la norma que la adicione, modifique o derogue. \nARTÍCULO QUINTO. Por la Autoridad Nacional de Licencias Ambientales (ANLA), \ncomunicar el contenido del presente acto administrativo a la Corporación Autónoma \nRegional de la Orinoquía – CORPORINOQUÍA, a la Agencia Nacional de Hidrocarburos \n(ANH), a los Municipios de Arauca y Arauquita del Departamento de Arauca, para su \nconocimiento y fines pertinentes.\nARTÍCULO SEXTO. Publicar la presente Resolución en la Gaceta Ambiental de la \nAutoridad Nacional de Licencias Ambientales (ANLA) de conformidad con lo señalado en el \nartículo 71 de la Ley 99 del 22 de diciembre de 1993.\nARTÍCULO SÉPTIMO. Contra el presente acto administrativo no procede recurso alguno, \nde conformidad con lo establecido en el artículo 87 del Código de Procedimiento \nAdministrativo y de lo Contencioso Administrativo.\nNOTIFÍQUESE, COMUNÍQUESE, PUBLÍQUESE Y CÚMPLASE \nDado en Bogotá D.C., a los 14 FEB. 2024\nEDILBERTO PENARANDA CORREA\nASESOR\nERIKA LORENA PARRADO CEPEDA\nPROFESIONAL ESPECIALIZADO\n\nResolución No. 000221       Del 14 FEB. 2024          Hoja No. 24 de 24\n“POR LA CUAL SE RESUELVE UN RECURSO DE REPOSICIÓN”\nPágina 24 de 24\nANDREA DEL PILAR SANABRIA DEL RIO\nCONTRATISTA\nExpediente No. LAM3368\nConcepto Técnico N° 185 del 23 de enero de 2024.\nFecha: 8 de febrero de 2024\nProceso No.: 20241000002214\nNota: Este es un documento electrónico generado desde los Sistemas de Información de la ANLA. El original reposa en los \narchivos digitales de la Entidad\n"
}