{
  "fuente": "ANLA_GACETA",
  "numero_resolución": "RESOLUCIÓN N° 000373",
  "fecha_resolución": "2023-08-01",
  "nombre_proyecto": "proyecto “Perforación Exploratoria, Bloque Palo Blanco”, localizado en",
  "ubicación": "departamento de Casanare.",
  "empresa": "otorgó Licencia Ambiental a la Sociedad HARKEN DE COLOMBIA LTD",
  "numero_expediente": "LAM1309",
  "radicados": [
    "2021040226",
    "20236200492492"
  ],
  "descripcion": "Por la cual se resuelve recurso de reposición interpuesto contra la Resolución 1658 del 1 de agosto de 2023",
  "tipos_infraccion": [
    "Vertimientos",
    "Incumplimiento del PMA"
  ],
  "pdf_id": "45710",
  "file_name": "ANLA_45710.pdf",
  "texto_completo": "República de Colombia\nMinisterio de Ambiente y Desarrollo Sostenible\nAUTORIDAD NACIONAL DE LICENCIAS \nAMBIENTALES\n- ANLA –\nRESOLUCIÓN N° 000373\n(11 MAR. 2024)\nPágina 1 de 23\n“Por la cual se resuelve recurso de reposición interpuesto contra la \nResolución 1658 del 1 de agosto de 2023”\nEL DIRECTOR DE LA AUTORIDAD NACIONAL DE LICENCIAS AMBIENTALES \n– ANLA\nEn uso de sus facultades legales, en especial de aquellas conferidas por la Ley 99 \nde 1993, el Decreto ley 3573 de 2011, el Decreto 376 de 2020, conforme a las \nreglas del Decreto 1076, y\nCONSIDERANDO:\nI.\nANTECEDENTES \nQue por Resolución 831 del 29 de julio de 1996, el entonces Ministerio de Medio \nAmbiente – MMA hoy Ministerio de Ambiente y Desarrollo Sostenible - MADS (en \nadelante el Ministerio) otorgó Licencia Ambiental a la Sociedad HARKEN DE \nCOLOMBIA LTDA identificada con NIT. 800.187.974-3 (en adelante la Sociedad) \npara el proyecto “Perforación Exploratoria, Bloque Palo Blanco”, localizado en \njurisdicción del municipio de Maní, departamento de Casanare.\nQue con Resolución 1405 de 12 de octubre de 1996, el entonces Ministerio del \nMedio Ambiente modificó la Licencia Ambiental del proyecto, en el sentido de \nestablecer el Plan de Manejo Ambiental del Pozo exploratorio Estero- 1 y los \npermisos quedan para que los otorgue la Autoridad Ambiental regional\nQue a través de Resolución 1088 y 1089 de 2 de diciembre de 1997, el entonces \nMinisterio del Medio Ambiente estableció un Plan de Manejo Ambiental al titular del \ninstrumento de manejo y control ambiental HARKEN DE COLOMBIA LTD para el \nproyecto de perforación del Pozo exploratorio Estero -2 y pruebas extensas de \nproducción del Pozo exploratorio Estero-1.\nQue mediante Resolución 631 de 10 de julio de 1998, el entonces Ministerio, \nresolvió modificar la licencia ambiental ordinaria por Resolución 831 de 1996, \nautorizando construir una línea desde el pozo estero-1 hasta Estación Guarimena \n\nResolución No. 000373       Del 11 MAR. 2024          Hoja No. 2 de 23\n“POR LA CUAL SE RESUELVE RECURSO DE REPOSICIÓN INTERPUESTO \nEN CONTRA DE LA RESOLUCIÓN 1658 DEL 1 DE AGOSTO DE 2023”\nPágina 2 de 23\nQue por Resolución 649 de 16 de julio de 1998, el Ministerio, resolvió recurso de \nreposición contra la Resolución 631 de 1998, modificando lo decidido en cuanto a \naclarar que la línea va desde pozo estero-1 a la línea Guarimena - Santiago, y el \ntérmino del proyecto es de seis meses. \nQue mediante Resolución 300 del 23 de marzo de 2000, el Ministerio, estableció un \nPlan de Manejo Ambiental al titular del instrumento de manejo y control ambiental \nHARKEN DE COLOMBIA LTD, para el Bloque Paloblanco Construcción y operación \nde la línea de flujo pozo Estero 2 y Construcción y operación de la línea de \nconducción.\nQue a través de la Resolución 089 del 30 de enero de 2002, el Ministerio otorgó \nLicencia Ambiental Global al titular del instrumento de manejo y control ambiental, \npara el proyecto “Explotación de hidrocarburos del Campo Estero”.\nQue con Resolución 393 de 9 de mayo de 2002, el Ministerio, resolvió un recurso \nde reposición interpuesto contra la Resolución 089 del 30 de enero de 2002, en el \nsentido de establecer nuevos parámetros de monitoreo para el agua de inyección.\nQue por Resolución 447 de 10 de marzo de 2006, el Ministerio, modificó la \nResolución 089 del 30 de enero de 2002, en el sentido de aclarar que el pozo Estero \n-3 es productor y el pozo Estero-4 A es inyector de agua; también modifica el \npermiso de vertimiento.\nQue a través de Resolución 2027 de 15 de octubre de 2010, el Ministerio, aceptó el \ncambio de razón social del titular del instrumento de manejo y control ambiental, de \nla sociedad HARKEN DE COLOMBIA LTD por la sociedad COLOMBIA ENERGY \nDEVELOPMENT CO.\nQue mediante Resolución 2151 de 29 de octubre de 2019, la Autoridad Nacional de \nLicencias Ambientales, ANLA, en adelante la Autoridad Nacional, modifica la \nResolución 089 de 30 de enero de 2002, en el sentido de aprobar la solicitud de \nacogimiento al régimen de transición establecido en el numeral 3 del artículo \n2.2.9.3.1.17 del Decreto 2099 del 22 de diciembre de 2016, modificado por el \nDecreto 075 del 20 de enero 2017 y el 1120 del 29 de junio 2017, entre otras \ndisposiciones\nQue con Resolución 187 del 3 de febrero del 2020, la Autoridad Nacional, modificó \nel artículo primero de la Resolución 089 del 30 de enero de 2002, en el sentido de \nampliar el área de explotación de hidrocarburos en el Campo Estero, y adoptó otras \ndisposiciones, decisión que fue recurrida y modificada por la Resolución 736 del 21 \nde abril de 2020, en lo que al contenido del artículo séptimo y literal h) del artículo \noctavo del acto administrativo recurrido, se refiere.\n\nResolución No. 000373       Del 11 MAR. 2024          Hoja No. 3 de 23\n“POR LA CUAL SE RESUELVE RECURSO DE REPOSICIÓN INTERPUESTO \nEN CONTRA DE LA RESOLUCIÓN 1658 DEL 1 DE AGOSTO DE 2023”\nPágina 3 de 23\nQue a través de Resolución 324 de 15 de febrero de 2021, la Autoridad Nacional, \nniega solicitud de acogimiento al porcentaje incremental de la base de liquidación \nde la inversión forzosa de no menos del 1%.\nQue por Resolución 359 de 11 de febrero de 2022, la Autoridad Nacional, aprueba \nel Plan de Compensación del componente biótico propuesto por la sociedad \nCOLOMBIA \nENERGY \nDEVELOPMENT \nCO., \nmediante \nradicado \nANLA \n2021040226-1-000 del 08 de marzo de 2021, para el proyecto “LICENCIA \nAMBIENTAL GLOBAL PARA LA EXPLOTACIÓN DE HIDROCARBUROS CAMPO \nESTERO (ALCARAVAN A)”.\nQue mediante Resolución 3062 de 27 de diciembre de 2022, la Autoridad Nacional, \nresolvió entre otras cosas, Aceptar la liquidación parcial de la inversión forzosa de \nno menos del 1%, actualizada al parágrafo primero del artículo 321 de la Ley 1955 \ndel 25 de mayo de 2019, para los periodos comprendidos entre los años 1996 y \n2019; y para el año 2021.\nQue mediante Resolución 1658 de 01 de agosto de 2023, la Autoridad Nacional, \nresolvió ajustar vía seguimiento, la Resolución 187 de 03 de febrero de 2020, en el \nsentido de incluir una nueva obligación para establecer e implementar las \ncondiciones de tiempo, modo y lugar de los puntos de agua subterránea dentro de \nla red de monitoreo regional del recurso hídrico subterráneo. \nQue el mencionado acto administrativo fue notificado a la sociedad COLOMBIA \nENERGY DEVELOPMENT CO, de forma electrónica, el 02 de agosto de 2023, de \nconformidad con lo previsto en los artículos 67, 68 y 69 de la Ley 1437 de 2011.\nQue a través de radicado ANLA 20236200492492 de 17 de agosto de 2023, la \nsociedad interesada presentó recurso de reposición en contra de la Resolución 1658 \nde 01 de agosto de 2023.\nQue por medio de comunicación, con radicado ANLA No. 20236200492492 del 17 \nde agosto de 2023, la Sociedad COLOMBIA ENERGY DEVELOPMENT CO., \npresentó recurso de reposición contra la Resolución 1658 de 1 de Agosto de 2023.\nQue esta Autoridad Nacional a través del grupo técnico de Regionalización y Centro \nde Monitoreo adscrito a la Subdirección de Instrumentos Permisos y Tramites \nAmbientales de la Autoridad Nacional de Licencias Ambientales de la ANLA, elaboró \nel concepto técnico 6491 del 4 de octubre de 2023, en cuyo texto se consignó el \nanálisis técnico a la comunicación con radicado ANLA No. 20236200492492 de \nfecha 4 de octubre de 2023, en el marco del monitoreo regional del recurso hídrico \nsubterráneo objeto de recurso.\n\nResolución No. 000373       Del 11 MAR. 2024          Hoja No. 4 de 23\n“POR LA CUAL SE RESUELVE RECURSO DE REPOSICIÓN INTERPUESTO \nEN CONTRA DE LA RESOLUCIÓN 1658 DEL 1 DE AGOSTO DE 2023”\nPágina 4 de 23\nII.\nFUNDAMENTOS CONSTITUCIONALES Y LEGALES\na. De la protección del derecho al medio ambiente como deber social del \nEstado\nQue el artículo 8 de la Constitución Política, consagra como obligación del Estado y \nde las personas proteger las riquezas culturales y naturales de la Nación. \nQue el artículo 58 de la misma Carta Fundamental, establece que la propiedad lleva \ninmersa una función social que implica obligaciones. Como tal, le es inherente una \nfunción ecológica que implica el respeto por el derecho a un medio ambiente sano \ny la protección a los recursos naturales.).\nQue el artículo 79, ibídem, señala como obligación del Estado proteger el medio \nambiente y el derecho que tienen todos los ciudadanos a gozar de un ambiente \nsano; también le impuso al Estado el deber de proteger la diversidad e integridad \ndel ambiente, conservar las áreas de especial importancia ecológica y fomentar la \neducación para el logro de estos fines. \nQue el artículo 80 de la Constitución Política de Colombia establece: “El Estado \nplanificará el manejo y aprovechamiento de los recursos naturales, para garantizar \nsu desarrollo sostenible, su conservación, restauración o sustitución; además, \ndeberá prevenir y controlar los factores de deterioro ambiental, imponer las \nsanciones legales y exigir la reparación de los daños causados”.\nQue el artículo 95 constitucional, señala que es deber de la persona y del ciudadano \nproteger los recursos culturales y naturales del país y velar por la conservación de \nun ambiente sano.\nQue con respecto a la responsabilidad en la conservación y defensa del ambiente, \nse debe observar lo establecido en el artículo 333 de la Constitución Política, según \nel cual, la actividad económica y la iniciativa privada son libres, pero “dentro de los \nlímites del bien común”.\nQue con respecto a la defensa del derecho a un medio ambiente sano, la Corte \nConstitucional en la sentencia T-325 - 17 del quince (15) de mayo de dos mil \ndiecisiete (2017), resaltó lo siguiente:\n“(…) La Corte ha atendido a la necesidad que propugna por la defensa del ambiente \ny de los ecosistemas, por lo que ha calificado al ambiente como un bien jurídico \nconstitucionalmente protegido, en el que concurren las siguientes dimensiones: “(i) es \nun principio que irradia todo el orden jurídico en cuanto se le atribuye al Estado la \nobligación de conservarlo y protegerlo, procurando que el desarrollo económico y \nsocial sea compatible con las políticas que buscan salvaguardar las riquezas \nnaturales de la Nación; (ii) aparece como un derecho constitucional de todos los \n\nResolución No. 000373       Del 11 MAR. 2024          Hoja No. 5 de 23\n“POR LA CUAL SE RESUELVE RECURSO DE REPOSICIÓN INTERPUESTO \nEN CONTRA DE LA RESOLUCIÓN 1658 DEL 1 DE AGOSTO DE 2023”\nPágina 5 de 23\nindividuos que es exigible por distintas vías judiciales; (iii) tiene el carácter de servicio \npúblico, erigiéndose junto con la salud, la educación y el agua potable, en un objetivo \nsocial cuya realización material encuentra pleno fundamento en el fin esencial de \npropender por el mejoramiento de la calidad de vida de la población del país; y (iv) \naparece como una prioridad dentro de los fines del Estado, comprometiendo la \nresponsabilidad directa del Estado al atribuirle los deberes de prevención y control de \nlos factores de deterioro ambiental y la adopción de las medidas de protección…” (…). \nQue la protección del medio ambiente es uno de los más importantes cometidos \nestatales; de manera que al Estado corresponde garantizar a las generaciones \nfuturas la conservación del ambiente y la preservación de los recursos naturales. \nQue el Decreto ley 2811 de 1974, por medio de su artículo 1º, reconoce que el \nambiente es patrimonio común y que tanto el Estado como los particulares deben \nparticipar en su preservación y manejo, actividades de utilidad pública e interés \nsocial; dispone, además, que la preservación y manejo de los recursos naturales \nrenovables también son de utilidad pública e interés social. \nQue toda actividad, obra o proyecto que se enmarque en las condiciones \ncontempladas en el artículo 2.2.2.3.2.2., del Decreto 1076 de 2015, requiere de \nLicencia Ambiental; es decir requiere de un instrumento de control ambiental \naprobado por Autoridad competente, que garantice que el desarrollo del proyecto a \nejecutar mitigue, maneje y compense los impactos ambientales que genera su \nejecución y finalización de este, sobre lo cual la Corte Constitucional en Sentencia \nC-746 de 2012, señaló;\n(…) “…Con fundamento en la jurisprudencia constitucional, se concluye que la \nlicencia ambiental: (i) es una autorización que otorga el Estado para la ejecución de \nobras o la realización de proyectos o actividades que puedan ocasionar un deterioro \ngrave al ambiente o a los recursos naturales o introducir una alteración significativa \nal paisaje (Ley 99/93 art. 49); (ii) tiene como propósitos prevenir, mitigar, manejar, \ncorregir y compensar los efectos ambientales que produzcan tales actividades; (iii) \nes de carácter obligatoria y previa, por lo que debe ser obtenida antes de la ejecución \no realización de dichas obras, actividades o proyectos; (iv) opera como instrumento \ncoordinador, planificador, preventivo, cautelar y de gestión, mediante el cual el \nEstado cumple diversos mandatos constitucionales, entre ellos proteger los recursos \nnaturales y el medio ambiente, conservar áreas de especial importancia ecológica, \nprevenir y controlar el deterioro ambiental y realizar la función ecológica de la \npropiedad; (v) es el resultado de un proceso administrativo reglado y complejo que \npermite la participación ciudadana, la cual puede cualificarse con la aplicación del \nderecho a la consulta previa si en la zona de influencia de la obra, actividad o \nproyecto existen asentamientos indígenas o afrocolombianos; (vi) tiene \nsimultáneamente un carácter técnico y otro participativo, en donde se evalúan varios \naspectos relacionados con los estudios de impacto ambiental y, en ocasiones, con \nlos diagnósticos ambientales de alternativas, en un escenario a su vez técnico \ncientífico y sensible a los intereses de las poblaciones afectadas (Ley 99/93 arts. 56 \ny ss); y, finalmente, (vii) se concreta en la expedición de un acto administrativo de \n\nResolución No. 000373       Del 11 MAR. 2024          Hoja No. 6 de 23\n“POR LA CUAL SE RESUELVE RECURSO DE REPOSICIÓN INTERPUESTO \nEN CONTRA DE LA RESOLUCIÓN 1658 DEL 1 DE AGOSTO DE 2023”\nPágina 6 de 23\ncarácter especial, el cual puede ser modificado unilateralmente por la administración \ne incluso revocado sin el consentimiento previo, expreso y escrito de su titular, \ncuando se advierta el incumplimiento de los términos que condicionan la \nautorización (Ley 99/93 art. 62). En estos casos funciona como garantía de intereses \nconstitucionales protegidos por el principio de prevención y demás normas con \ncarácter de orden público…” (…)\nb. Competencia de La Autoridad Nacional de Licencias Ambientales - \nANLA\nQue el artículo 49 de la Ley 99 de 1993, dispone “La ejecución de obras, el \nestablecimiento de industrias o el desarrollo de cualquier actividad, que de acuerdo \ncon la ley y los reglamentos, pueda producir deterioro grave a los recursos naturales \nrenovables o al medio ambiente o introducir modificaciones considerables o notorias \nal paisaje, requerirán de una licencia ambiental”. \nQue el numeral 1 del Artículo 52 de la Ley 99 de 1993, señaló como competencia \ndel hoy Ministerio de Ambiente y Desarrollo Sostenible, otorgar la licencia ambiental \npara la ejecución de obras y actividades de exploración, explotación, transporte, \nconducción y depósito de hidrocarburos, y construcción de refinerías, sin perjuicio \nde la potestad de la Autoridad Ambiental para adicionar o establecer condiciones \nambientales especificas requeridas en cada caso.\nQue mediante Decreto-Ley 3573 de 2011, se creó la Autoridad Nacional de \nLicencias Ambientales– ANLA, en los términos del artículo 67 de la Ley 489 de 1998, \ncon autonomía administrativa y financiera, sin personería jurídica y como entidad \nencargada de que los proyectos, obras o actividades sujetos a licenciamiento, \npermiso o trámite ambiental cumplan con la normativa ambiental, de tal manera que \ncontribuyan al desarrollo sostenible ambiental del País. \nQue entre las funciones conferidas por el artículo 3 del mencionado Decreto ley \n3573 de 2011, se encuentra la de otorgar o negar las licencias, permisos y trámites \nambientales de competencia del Ministerio de Ambiente y Desarrollo Sostenible, de \nconformidad con la ley y los reglamentos. \nQue por medio del Decreto 376 de 2020 “Por el cual se modifica la estructura de la \nAutoridad Nacional de Licencias Ambientales ANLA”, se estableció como atribución \ndel Despacho de la Dirección General, la función de suscribir los actos \nadministrativos que otorgan, niegan, modifican, ajustan o declaran la terminación de \nlas licencias, permisos y trámites ambientales. \nQue mediante el Decreto 1076 de 2015 “Por el cual se expide el Decreto Único \nReglamentario del Sector Ambiente y Desarrollo Sostenible”, artículo 2.2.2.3.9.1, se \nestablece que los proyectos, obras o actividades sujetos a licencia ambiental o plan \n\nResolución No. 000373       Del 11 MAR. 2024          Hoja No. 7 de 23\n“POR LA CUAL SE RESUELVE RECURSO DE REPOSICIÓN INTERPUESTO \nEN CONTRA DE LA RESOLUCIÓN 1658 DEL 1 DE AGOSTO DE 2023”\nPágina 7 de 23\nde manejo ambiental, serán objeto de control y seguimiento por parte las \nautoridades ambientales, con el propósito, entre otros, de verificar la eficiencia y \neficacia de las medidas de manejo ambiental implementadas en relación con el plan \nde manejo, el programa de seguimiento y monitoreo, el plan de contingencias, así \ncomo el plan de desmantelamiento y el plan de inversión del 1%, si aplican; y en \ndesarrollo de ese propósito se podrá realizar visitas al lugar donde se desarrolla el \nproyecto, hacer requerimientos, imponer obligaciones ambientales; así como \ncorroborar los resultados de los monitoreos realizados por el beneficiario de la \nlicencia o plan de manejo ambiental. \nQue el numeral primero del artículo 74 de la Ley 1437 de 2011 “Por la cual se expide \nel Código de Procedimiento Administrativo y de lo Contencioso Administrativo”, \nordena que el recurso de reposición lo deberá resolver quien expidió la decisión \npara que la aclare, modifique, adicione o revoque, en el presente caso, la resolverá \nla Dirección General de esta Autoridad Nacional. \nQue el Director General de la Autoridad Nacional de Licencias Ambientales es el \nfuncionario competente para firmar el presente acto administrativo.\nc. Procedencia, oportunidad, presentación y requisitos del recurso de \nReposición1\nQue según el artículo séptimo de la Resolución 1658 de 1 de agosto de 2023, contra \ndicho acto administrativo procede el recurso de reposición dentro de los 10 días \nsiguientes a su notificación, cumpliendo los requisitos establecidos en los artículos \n74 y siguientes del Código de Procedimiento Administrativo y de lo Contencioso \nAdministrativo (Ley 1437 de 2011). \nQue la Resolución 1658 de 1 de agosto de 2023, fue notificada de manera \nelectrónica el día 2 de agosto de 2023 y fue objeto de recurso de reposición \nmediante comunicación 2023-620-049249-2 de 17 de agosto de 2023, es decir, la \nsociedad COLOMBIA ENERGY DEVELOPMENT CO., presentó el recurso de \nmanera oportuna. \nQue en cuanto a los requisitos legales establecidos en el artículo 77 de la Ley 1437 \nde 2011 “Por la cual se expide el Código de Procedimiento Administrativo y de lo \nContencioso Administrativo”, se verificó que estos fueron observados por el \nrecurrente, por cuanto expresaron los motivos de inconformidad, así como su \nnombre y dirección; además, fue presentado por el representante legal  de la \nsociedad COLOMBIA ENERGY DEVELOPMENT CO., información corroborada en \n1 El recurso de reposición constituye un instrumento legal mediante el cual la parte interesada tiene la oportunidad de ejercer el derecho \nde controvertir una decisión, para que la administración previa su evaluación, la confirme, aclare, modifique o revoque, previo el lleno \nde las exigencias legales establecidas para el efecto. Lla finalidad esencial del recurso de reposición no es otra distinta a que al funcionario \nde la administración que tomó una decisión administrativa, se le dé la oportunidad para que enmiende o corrija un error, o los posibles \nerrores que se hayan podido presentar en el acto administrativo por él expedido en ejercicio de sus funciones.\n\nResolución No. 000373       Del 11 MAR. 2024          Hoja No. 8 de 23\n“POR LA CUAL SE RESUELVE RECURSO DE REPOSICIÓN INTERPUESTO \nEN CONTRA DE LA RESOLUCIÓN 1658 DEL 1 DE AGOSTO DE 2023”\nPágina 8 de 23\nel Registro Único Empresarial -RUES- el 19 de  enero de 2024 y resaltando que \ndicha sociedad es la titular del expediente LAM1309. \nQue el artículo 79, ibídem, preceptúa que el recurso de reposición deberá resolverse \nde plano, a no ser que al interponerlo se haya solicitado la práctica de pruebas, o \nque el funcionario que ha de decidir el recurso considere necesario decretarlas de \noficio, situaciones que no se presentan en el caso en estudio.\nIII.\nCONSIDERACIONES DE LA AUTORIDAD NACIONAL DE LICENCIAS \nAMBIENTALES \nFRENTE \nAL \nRECURSO \nDE \nREPOSICIÓN \nINTERPUESTO \nPOR \nLA \nSOCIEDAD \nCOLOMBIA \nENERGY \nDEVELOPMENT CO\na. Consideraciones y Petición de la Sociedad COLOMBIA ENERGY \nDEVELOPMENT CO\nEstablece la sociedad COLOMBIA ENERGY DEVELOPMENT CO, a través de su \nrepresentante legal, doctor FABIO ANDRES CUENCA LOZANO, en radicado ANLA \n2023-620-049249-2 de 17 de agosto de 2023, lo siguiente (se citan los apartes más \nrelevantes del mencionado escrito):\n“(…)\n“El artículo primero de la Resolución No. 1658 del 01 de agosto de 2023 \nmodifica el artículo cuarto de la Resolución 187 de 2020, en el sentido de \nagregar el numeral c a las obligaciones del permiso de exploración de aguas \nsubterráneas. Específicamente el artículo primero dispone los siguiente: \n \n“ARTÍCULO PRIMERO. Ajustar el artículo cuarto de la Resolución 187 del 3 \nde febrero de 2020, en el sentido de incluir una nueva obligación para \nestablecer e implementar las condiciones de tiempo, modo y lugar de los \npuntos de agua subterránea dentro de la red de monitoreo regional del recurso \nhídrico subterráneo. En tal sentido el artículo cuarto de la Resolución 187 del \n3 de febrero de 2020, quedara así: \n \n““ARTÍCULO CUARTO. - Modificar el Artículo Séptimo de la Resolución 0089 \ndel 30 de enero de 2002, en el sentido de autorizar los siguientes permisos de \nuso, aprovechamiento de recursos naturales, con las características y \ncondiciones especificadas a continuación: \n \nI. \nExploración de aguas subterráneas \n \n(…) \n \n\nResolución No. 000373       Del 11 MAR. 2024          Hoja No. 9 de 23\n“POR LA CUAL SE RESUELVE RECURSO DE REPOSICIÓN INTERPUESTO \nEN CONTRA DE LA RESOLUCIÓN 1658 DEL 1 DE AGOSTO DE 2023”\nPágina 9 de 23\nObligaciones: \na. (…) \nb. (…) \nc. Aguas Subterráneas, del Programa de Seguimiento y Monitoreo: Establecer \ne implementar la acción de manejo relacionada con las condiciones de tiempo, \nmodo y lugar del monitoreo del pozo profundo Estación Paloblanco y la red de \ncinco piezómetros, las cuales se indican a continuación: \n \n1. Condiciones de lugar (…) \n2. Condiciones de tiempo (…) \n3. Condiciones de modo – parámetros fisicoquímicos y microbiológicos: \n \nLos parámetros de monitoreo de calidad de las aguas subterráneas deben \ncontemplar aspectos físicos, químicos y microbiológicos, enfocándose, \nademás, en la identificación de los potenciales agentes contaminantes que se \npueden desprender de las actividades de exploración y explotación de \nhidrocarburos. Los parámetros fisicoquímicos y microbiológicos objeto de la \nestandarización son los siguientes: \n \n3.1. Monitoreo mensual: \nLos siguientes parámetros se deben medir con una periodicidad mensual: \n \n \na. Profundidad de toma de muestra: se debe medir siempre y cuando se \nconozca el diseño del punto de agua subterránea y/o el nivel acuífero \ncaptado. \nb. Caudal de explotación: la medición de este parámetro solo aplica para los \npozos de concesión de agua subterránea. \n\nResolución No. 000373       Del 11 MAR. 2024          Hoja No. 10 de 23\n“POR LA CUAL SE RESUELVE RECURSO DE REPOSICIÓN INTERPUESTO \nEN CONTRA DE LA RESOLUCIÓN 1658 DEL 1 DE AGOSTO DE 2023”\nPágina 10 de 23\nc. Nivel estático: debe reportarse la profundidad de la lámina de agua en \nmetros, al igual que en términos de la cota del terreno (en metros sobre el \nnivel del mar – m.s.n.m), siempre tomando como referencia el nivel del \nterreno, tal como se indica en la siguiente figura: \n(…)” \nEn relación con este requerimiento, CEDCO se permite aclarar lo siguiente: \n \n3.1.1. Actualmente, el plan de seguimiento y monitoreo de aguas subterráneas \nconsidera un monitoreo trimestral del pozo profundo, así como una frecuencia \nsemestral para la red piezométrica del campo. Ahora bien, la captación en el \nCampo Estero suele ser mucho menor al caudal concesionado, tal como se \nobserva para el caso de la operación del año de vigencia 2022, donde el caudal \npromedio captado fue de 0.11l/s, valor correspondiente al 4.60% de lo \nautorizado por el artículo séptimo de la Resolución No. 0089 de enero 30 de \n2002 (2.3l/s). Los registros de captación del año 2022 se adjuntan como Anexo \n2. \n \n \n3.1.2 Actualmente, los monitoreos están programados de acuerdo con lo \nestablecido en el Plan de seguimiento y monitoreo, cuyas frecuencias y \nparámetros se observan en las siguientes tablas y los resultados de \nmonitoreos del año 2022 se adjuntan como Anexo 3. \n \n\nResolución No. 000373       Del 11 MAR. 2024          Hoja No. 11 de 23\n“POR LA CUAL SE RESUELVE RECURSO DE REPOSICIÓN INTERPUESTO \nEN CONTRA DE LA RESOLUCIÓN 1658 DEL 1 DE AGOSTO DE 2023”\nPágina 11 de 23\n \n \n\nResolución No. 000373       Del 11 MAR. 2024          Hoja No. 12 de 23\n“POR LA CUAL SE RESUELVE RECURSO DE REPOSICIÓN INTERPUESTO \nEN CONTRA DE LA RESOLUCIÓN 1658 DEL 1 DE AGOSTO DE 2023”\nPágina 12 de 23\n \n \n3.1.5 Tal como se observa en las gráficas anteriores, los resultados de los \nmonitoreos de aguas subterráneas realizados en el pozo profundo y en los \npiezómetros en los últimos años muestran un comportamiento estable, sin \npresentar variaciones o picos de concentración que se puedan asociar a algún \ntipo de afectación por parte de la operación del campo o las actividades de \nperforación. \n \n3.1.6 Adicionalmente, esto demuestra que la frecuencia planteada \nactualmente es suficiente para determinar la situación del acuífero, por lo cual \nrespetuosamente se pone de presente a la Autoridad que no hay ninguna \nrazón que advierta ningún riesgo nuevo o adicional que amerite aumentar la \nfrecuencia del monitoreo a una periodicidad mensual, dado que es suficiente \nla periodicidad trimestral planteada en la ficha ASM-2: Seguimiento y \nmonitoreo del agua subterránea que se adjunta como Anexo 4. \n4. PETICION\n“Modificar el literal 3.1 del sub numeral C del Numeral I. del Artículo Cuarto de \nla Resolución 0089 del 30 de enero de 2002, modificado por el Artículo Primero \nde la Resolución No. 1658 del 01 de agosto de 2023, en el sentido de \nestablecer que el monitoreo de aguas subterráneas se realice una vez cada \ntres meses y no una vez al mes como quedó establecido”. \n\nResolución No. 000373       Del 11 MAR. 2024          Hoja No. 13 de 23\n“POR LA CUAL SE RESUELVE RECURSO DE REPOSICIÓN INTERPUESTO \nEN CONTRA DE LA RESOLUCIÓN 1658 DEL 1 DE AGOSTO DE 2023”\nPágina 13 de 23\nb. Consideraciones técnicas de la AUTORIDAD NACIONAL DE LICENCIAS \nAMBIENTALES,  frente al recurso de reposición interpuesto por la \nsociedad COLOMBIA ENERGY DEVELOPMENT CO.\nConsecuente con el recurso interpuesto en contra de la Resolución 1658 de 01 de \nagosto de 2023, esta autoridad a través del Grupo de Regionalización y Centro de \nMonitoreo emitió el concepto técnico 6491 de 04 de octubre de 2023, que en sus \napartes más relevantes sobre el particular asunto, estipula:\n“Consideraciones de la ANLA frente al artículo Primero:\nSi bien, con los resultados de los monitoreos presentados se ha podido \nverificar en los seguimientos ambientales realizados por la ANLA, que en el \nárea influencia del proyecto,  se ha mantenido la calidad del agua subterránea \nacorde con las condiciones naturales del medio, es decir, al momento, con la \ninformación reportada por la Sociedad no se han identificado impactos \nsignificativos sobre el recurso hídrico subterráneo como consecuencia  de las \nactividades operativas del proyecto; es preciso mencionar que la finalidad de \nla estandarización de las frecuencias y parámetros in-situ, fisicoquímicos y \nmicrobiológicos a través de la implementación de estrategias de monitoreos \nno solo es identificar afectaciones o impactos generados por un único \nproyecto, en este caso “Campo Estero”, sino el objetivo de la imposición de \neste tipo de medidas adicionales tambien es identificar y evaluar los impactos \nacumulativos a escala regional que se pueden generar en zonas con alta \nconcentración de proyectos que ejercen presión sobre los recursos naturales \ncomo lo es el área del Sistema Acuífero Yopal – Tauramena donde se localiza \nCampo Estero. \nSegún la Guía Práctica para la Evaluación y Gestión de Impactos \nAcumulativos en América Latina y el Caribe (BID – Invest), un “Impacto \nAcumulativo es aquel que resulta de los efectos sucesivos, incrementales o \ncombinados de una acción o proyecto, o cuando se suman a los efectos de \notros emprendimientos existentes, planificados o razonablemente previsibles. \nEn otras palabras, no es más que el efecto incremental, con respecto a una \nbase de referencia espacial y temporal, experimentada por un componente \nvalioso del ecosistema (“VEC”) al considerar, además de los causados por un \nproyecto en particular, los efectos de otros proyectos pasados, presentes y \nfuturos”. \n \nEl resultado de la Evaluación de Impactos Acumulativos que se pueden \npresentar sobre las aguas subterráneas, tiene una alta probabilidad de \ntrascender de la caracterización hidrogeológica local, en tal sentido, la ANLA \nbusca complementar el análisis de impactos que puede generarse por la \n\nResolución No. 000373       Del 11 MAR. 2024          Hoja No. 14 de 23\n“POR LA CUAL SE RESUELVE RECURSO DE REPOSICIÓN INTERPUESTO \nEN CONTRA DE LA RESOLUCIÓN 1658 DEL 1 DE AGOSTO DE 2023”\nPágina 14 de 23\npresión ejercida en el recurso hídrico debido a la alta concentración de \nproyectos, que constituye un escenario propicio para la acumulación potencial \nde impactos ambientales. Dicho análisis complementario se plantea a través \ndel establecimiento de una red de monitoreo regional que permita obtener \ninformación actualizada del estado del agua subterránea, de tal manera que \nse puedan identificar con antelación posibles afectaciones y de ser necesario \nimplementar las medidas a que haya lugar. \n \nEn el marco del proceso del control y seguimiento ambiental, la ANLA realiza \nla evaluación de impactos acumulativos tal como lo establece el Artículo \n2.2.2.3.9.1 del Decreto 1076 de 2015. “Control y seguimiento. Los proyectos, \nobras o actividades sujetos a licencia ambiental o plan de manejo ambiental, \nserán objeto de control y seguimiento por parte de las autoridades \nambientales, con el propósito de: (…) 4. Revisar los impactos acumulativos \ngenerados por los proyectos, obras o actividades sujetos a licencia ambiental \ny localizados en una misma área de acuerdo con los estudios que para el \nefecto exija de sus titulares e imponer a cada uno de los proyectos las \nrestricciones ambientales que considere pertinentes con el fin de disminuir el \nimpacto ambiental en el área.” \n \nLa estrategia de Monitoreo del Sistema Acuífero Yopal – Tauramena fue \ndiseñada y formulada por el Grupo de Regionalización y Centro de Monitoreo \nde la ANLA en el año 2021, en ella se busca estandarizar las condiciones de \ntiempo y modo de los monitoreos del recurso hídrico subterráneo en \nveinticuatro (24) proyectos del sector de hidrocarburos que, a través de \nactividades como la captación de aguas subterráneas, el vertimiento de aguas \nresiduales domésticas y no domesticas tratadas mediante campos de \ninfiltración y/o aspersión, o a través de pozos de inyección para disposición \nfinal (pozos disposal), de igual modo, con actividades de reinyección de aguas \nde formación para fines de recobro secundario de hidrocarburos, intervienen \nlos acuíferos presentes en la región. \n \nProducto de las estrategias de monitoreo del recurso hídrico subterráneo, la \nANLA pretende, desde el conocimiento hidrogeológico, fortalecer la gestión y \ncontrol del recurso hídrico en el Sistema Acuífero Yopal - Tauramena, de tal \nmanera que se tengan los argumentos técnicos suficientes para analizar y \ndeterminar con mayor certeza el estado de la calidad y disponibilidad del agua \nsubterránea en la región, evaluar la factibilidad del otorgamiento de nuevas \nconcesiones de captación, vertimientos en suelo o cualquier otro permiso que \npueda intervenir el recurso hídrico subterráneo y por último identificar de \nmanera temprana, posibles afectaciones sobre el agua subterránea o impactos \nacumulativos para así imponer medidas que permitan garantizar la protección \ny sostenibilidad del recurso. \n \n\nResolución No. 000373       Del 11 MAR. 2024          Hoja No. 15 de 23\n“POR LA CUAL SE RESUELVE RECURSO DE REPOSICIÓN INTERPUESTO \nEN CONTRA DE LA RESOLUCIÓN 1658 DEL 1 DE AGOSTO DE 2023”\nPágina 15 de 23\nEn el ejercicio del establecimiento de la red de monitoreo, se identificó que en \nel área de del proyecto objeto del presente concepto técnico, afloran las \nunidades geológicas definidas como acuíferos priorizados en el análisis de \nimpactos, sobre los cuales se realiza posiblemente intervención a través de \nlos siguientes permisos o actividades: \n \n•\nPermiso de captación de agua subterránea a través de pozo profundo \ndenominado “Estación Paloblanco” otorgado por esta Autoridad Ambiental \nmediante el numeral 1 del artículo séptimo de la Resolución 089 de 2002. \n•\nReinyección de aguas asociadas a producción del Campo Estero \nautorizada mediante Resolución 089 del 30 de enero de 2002 numeral 2 \ndel Artículo Séptimo y modificado mediante Resoluciones 0447 de marzo \n10 de 2006 y 00736 de 21 de abril de 2020. \n•\nVertimiento por aspersión autorizado mediante Resolución 447 de 10 de \nmarzo de 2006. \n \nComo se puede observar, el Campo Estero es uno de los proyectos que por \nsus actividades operativas ejerce, de alguna manera, presión sobre el recurso \nhídrico subterráneo, sin embargo, el proyecto cuenta con seis (6) puntos de \nagua subterránea (un pozo profundo y cinco piezómetros), cuyo monitoreo \nestandarizado aportaría información valiosa, en aras de generar alertas \ntempranas o identificar posibles impactos sobre el sistema acuífero y fortalecer \nla línea base hidrogeológica regional, por tal motivo, este proyecto fue \nseleccionado como parte de la estrategia del sistema acuífero Yopal \nTauramena para el recurso hídrico subterráneo y es imperante realizar el \najuste de las condiciones de tiempo y modo de dichos monitoreos. \nCon respecto al numeral 3.1.6. del recurso de reposición radicado con No. \n20236200492492 del 17 de agosto de 2023, que relaciona la frecuencia \nmensual establecida para la medición de los parámetros in-situ, se debe tener \nen cuenta, como ya se mencionó, que con este tipo de redes de monitoreo \ntambien se busca fortalecer la línea base hidrogeológica regional e identificar \ntendencias del comportamiento natural de las variables hidrogeológicas de \ninterés, en ese sentido El Protocolo de Monitoreo y Seguimiento del Agua 2021 \n(Ideam, Invemar (2021), menciona:  \n“El diseño de las redes de monitoreo depende del propósito que se establezca \nal inicio del programa de monitoreo. Estas redes pueden constituir sistemas \nprimarios, los cuales sirven para detectar cambios generales en el flujo del \nagua subterránea y sus tendencias de calidad, con el objetivo de aportar el \nconocimiento científico necesario para entender el recurso de agua \nsubterránea; además de sistemas secundarios y terciarios, los cuales permiten \nevaluar y controlar el impacto de riesgos específicos del agua subterránea” \n(Tuinhof et al., 2006). \n\nResolución No. 000373       Del 11 MAR. 2024          Hoja No. 16 de 23\n“POR LA CUAL SE RESUELVE RECURSO DE REPOSICIÓN INTERPUESTO \nEN CONTRA DE LA RESOLUCIÓN 1658 DEL 1 DE AGOSTO DE 2023”\nPágina 16 de 23\n(…) \n“… (…) la frecuencia puede ser ajustada dependiendo del tipo de monitoreo \nque se busque desarrollar. En este caso, se considera un monitoreo primario \ny un monitoreo de vigilancia. Si se está desarrollando una línea base de \ncualquier tipo de acuífero, se recomienda un ciclo de muestreo con una alta \nfrecuencia, similar al del monitoreo de tendencias, el cual puede ser reducido \ncuando se complete la información de la línea base (ACWI, 2009). \nNo obstante, analizando los argumentos expuestos por la Sociedad \nrelacionados con el caudal usado del pozo concesionado y las tendencias del \ncomportamiento de los parámetros fisicoquímicos reportados, el Grupo de \nRegionalización y Centro de Monitoreo considera viable acceder a la petición \nrealizada por la empresa en términos de establecer la frecuencia trimestral \npara el muestreo de parámetros in-situ señalados en el numeral 3.1 del artículo \nprimero de la Resolución 1658 del 01 de agosto de 2023. \nLo anterior, bajo la premisa que con los parámetros in-situ se obtiene un \nacercamiento al conocimiento del comportamiento del agua subterránea en la \nzona, y adicionalmente son los primeros indicadores que evidencian los \ncambios en las condiciones de calidad o cantidad del agua subterránea, \nindependientemente, la Sociedad debe continuar reportando sus obligaciones \ncomo lo ha venido realizando en el plan de seguimiento y monitoreo. \nConjuntamente debe realizar las mediciones solicitadas de los parámetros \nfisicoquímicos y microbiológicos cuantificados en laboratorio de acuerdo con \nlas condiciones impuestas en los numerales 1, 2 y 3 del Artículo Primero de la \nResolución 1658 del 1 de agosto de 2023 y reportar la información de las dos \nfrecuencias establecidas (trimestral para parámetros in-situ y semestral para \nparámetros de laboratorio) al Centro de Monitoreo de los Recurso Naturales \nde la ANLA según lo definido en el numeral 7 del Artículo Primero de la misma \nResolución (…)”\nc. CONSIDERACIONES JURÍDICAS DE LA AUTORIDAD NACIONAL DE \nLICENCIAS AMBIENTALES, FRENTE AL RECURSO DE REPOSICIÓN \nINTERPUESTO \nPOR \nLA \nSOCIEDAD \nCOLOMBIA \nENERGY \nDEVELOPMENT CO.\nQue realizada la revisión técnica frente al recurso de reposición interpuesto contra \nlo decidido en Resolución 355 de 28 de febrero de 2023, en relación con que el \n“monitoreo de aguas subterráneas se realice una vez cada tres meses y no una vez \nal mes” desde el punto de vista jurídico es importante indicar, que el numeral 3.1 del \nartículo Primero de la Resolución 1658 de 01 de agosto de 2023, resolvió:\nARTÍCULO PRIMERO. Ajustar el artículo cuarto de la Resolución 187 del 3 de febrero de \n2020, en el sentido de incluir una nueva obligación para establecer e implementar las \n\nResolución No. 000373       Del 11 MAR. 2024          Hoja No. 17 de 23\n“POR LA CUAL SE RESUELVE RECURSO DE REPOSICIÓN INTERPUESTO \nEN CONTRA DE LA RESOLUCIÓN 1658 DEL 1 DE AGOSTO DE 2023”\nPágina 17 de 23\ncondiciones de tiempo, modo y lugar de los puntos de agua subterránea dentro de la red de \nmonitoreo regional del recurso hídrico subterráneo. En tal sentido el artículo cuarto de la \nResolución 187 del 3 de febrero de 2020, quedara así: \n“ARTÍCULO CUARTO.- Modificar el Artículo Séptimo de la Resolución 0089 del 30 de enero \nde 2002, en el sentido de autorizar los siguientes permisos de uso, aprovechamiento de \nrecursos naturales, con las características y condiciones especificadas a continuación: \n(…)\n3.1. Monitoreo mensual  \n \nLos siguientes parámetros se deben medir con una periodicidad mensual: \n \nPARÁMETROS IN SITU \nUNIDADES \nConductividad Eléctrica \n(μS/cm) \nOxígeno Disuelto \nmg/L \npH \nUnidades de \npH \nPotencial Redox \nmV \nSolidos Disueltos Totales (SDT) \nmg/L \nTemperatura  \n°C \n*Caudal de explotación \nl/s \n*Nivel Estático \nm \n*Profundidad de toma de muestra  \nm  \n \na.\nProfundidad de toma de muestra: se debe medir siempre y cuando se conozca el \ndiseño del punto de agua subterránea y/o el nivel acuífero captado. \n \nb.\nCaudal de explotación: la medición de este parámetro solo aplica para los pozos con \nconcesión de agua subterránea. \n \nc.\nNivel estático: debe reportarse la profundidad de la lámina de agua en metros, al \nigual que en términos de la cota del terreno (en metros sobre el nivel del mar - m.s.n.m), \nsiempre tomando como referencia el nivel del terreno, tal como se indica en la siguiente figura: \n(…)\nAsí las cosas, en el marco de lo dispuesto por el numeral 4 del artículo 2.2.2.3.9.1 \ndel Decreto 1076 de 2015, que establece:\n\nResolución No. 000373       Del 11 MAR. 2024          Hoja No. 18 de 23\n“POR LA CUAL SE RESUELVE RECURSO DE REPOSICIÓN INTERPUESTO \nEN CONTRA DE LA RESOLUCIÓN 1658 DEL 1 DE AGOSTO DE 2023”\nPágina 18 de 23\nARTÍCULO 2.2.2.3.9.1. Control y seguimiento. Los proyectos, obras o \nactividades sujetos a licencia ambiental o plan de manejo ambiental, serán \nobjeto de control y seguimiento por parte de las autoridades ambientales, con \nel propósito de:\n1.….\n2.….\n3.…\n4. Revisar los impactos acumulativos generados por los proyectos, obras o \nactividades sujetos a licencia ambiental y localizados en una misma área de \nacuerdo con los estudios que para el efecto exija de sus titulares e imponer a \ncada uno de los proyectos las restricciones ambientales que considere \npertinentes con el fin de disminuir el impacto ambiental en el área.\nQue atendiendo a la definición de impacto acumulativo que se cita en el concepto \ntécnico 6491 de 04 de octubre de 2023, el cual sirve de soporte para la presente \ndecisión, la Autoridad Nacional busca, en el presente asunto “complementar el \nanálisis de impactos que puede generarse por la presión ejercida en el recurso \nhídrico debido a la alta concentración de proyectos, que constituye un escenario \npropicio para la acumulación potencial de impactos ambientales. Dicho análisis \ncomplementario se plantea a través del establecimiento de una red de monitoreo \nregional que permita obtener información actualizada del estado del agua \nsubterránea, de tal manera que se puedan identificar con antelación posibles \nafectaciones y de ser necesario implementar las medidas a que haya lugar”.\nQue el monitoreo que acá se cita, busca estandarizar las condiciones de tiempo y \nmodo en 24 proyectos del sector hidrocarburos que, a través de actividades como \ncapación de aguas, vertimiento de aguas domésticas y no domesticas debidamente \ntratadas y, actividades de reinyección de aguas de formación para fines de recobro \nsecundario de hidrocarburos, intervienen los acuíferos presentes en la región, así \nlas cosas, acorde a la información obtenida, se busca tener “los argumentos \ntécnicos suficientes para analizar y determinar con mayor certeza el estado de la \ncalidad y disponibilidad del agua subterránea en la región, evaluar la factibilidad del \notorgamiento de nuevas concesiones de captación, vertimientos en suelo o \ncualquier otro permiso que pueda intervenir el recurso hídrico subterráneo y por \núltimo identificar de manera temprana, posibles afectaciones sobre el agua \nsubterránea o impactos acumulativos para así imponer medidas que permitan \ngarantizar la protección y sostenibilidad del recurso”.\nQue en lo que a los argumentos esgrimidos por el recurrente se refiere, \nprincipalmente lo expresado en los numerales 3.1.1 a 3.1.6 del escrito de recurso \n\nResolución No. 000373       Del 11 MAR. 2024          Hoja No. 19 de 23\n“POR LA CUAL SE RESUELVE RECURSO DE REPOSICIÓN INTERPUESTO \nEN CONTRA DE LA RESOLUCIÓN 1658 DEL 1 DE AGOSTO DE 2023”\nPágina 19 de 23\nallegado, conforme a los cuales, el Plan de seguimiento y monitoreo de aguas \nsubterráneas, establece un monitoreo trimestral, así como un seguimiento \nsemestral para la red piezométrica del campo, sin dejar de lado que la captación \nsuele ser menor al caudal concesionado y, en cuyas evidencias allegadas se \nexpone un comportamiento estable en el pozo profundo y en los piezómetros en los \núltimos años, se afirma por el recurrente que dicha frecuencia de monitoreo resulta \nser suficiente  y, contrario a lo expuesto en el numeral 3.1 del artículo Primero de la \nResolución 1658 del 1 de agosto de 2023, que modificó el literal 3.1 del sub numeral \nC del Numeral I. del artículo Cuarto de la Resolución 0089 del 30 de enero de 2002, \nno amerita que dicha frecuencia en el monitoreo sufra variación alguna.\nQue resulta claro para esta autoridad que, la frecuencia de los monitoreos \npresentados por la sociedad en el área de influencia del proyecto, el caudal usado \ndel pozo concesionado, el análisis de los parámetros reportados, y el \ncomportamiento de los mismos, permiten evidenciar los cambios en las condiciones \nde calidad o cantidad del agua subterránea, es decir generan alertas tempranas, \nque en el caso de manifestación de algún impacto permiten actuar de manera \ndiligente con acciones correctivas o de remediación requeridas, y en el presente \ncaso es evidente el buen comportamiento de los mismos, por cuanto, tal y como ya \nse mencionó, los reportes de parámetros y caudal, allegados permiten a esta \nautoridad acceder a la petición realizada por la empresa en términos de establecer \nla frecuencia trimestral para el muestreo de parámetros in-situ señalados en el \nnumeral 3.1 del artículo primero de la Resolución 1658 del 01 de agosto de 2023, \nrazón por la cual, en la parte resolutiva del presente acto administrativo, así se \ndecidirá. \nCONSIDERACIONES FINALES\nQue esta autoridad encuentra procedente acceder a la petición del recurrente, en el \nsentido de modificar lo dispuesto en el numeral 3.1. del artículo Primero de la \nResolución No. 0355 del 28 de febrero de 2023, en cuanto a que la frecuencia del \nmuestreo de parámetros in-situ se siga realizando de forma trimestral, por \nconsiderar que elementos valorativos como los ya mencionados, esto es, frecuencia \nde los monitoreos presentados, el análisis de los parámetros reportados y el caudal \ndel pozo concesionado, soportan el interés de la sociedad en que los mismos se \nsigan manteniendo sin tener en cuenta lo decidido en la Resolución objeto de \nrecurso.\nQue en mérito de lo expuesto,\nRESUELVE:\n\nResolución No. 000373       Del 11 MAR. 2024          Hoja No. 20 de 23\n“POR LA CUAL SE RESUELVE RECURSO DE REPOSICIÓN INTERPUESTO \nEN CONTRA DE LA RESOLUCIÓN 1658 DEL 1 DE AGOSTO DE 2023”\nPágina 20 de 23\nARTÍCULO PRIMERO. Reponer y en consecuencia modificar el numeral 3.1 del \nartículo Primero de la Resolución 1658 del 1 de agosto de 2023, que modificó el \nliteral 3.1 del sub numeral C del Numeral I. del artículo Cuarto de la Resolución 0089 \ndel 30 de enero de 2002, en el sentido de establecer que el monitoreo de parámetros \nin-situ de aguas subterráneas se realice una vez cada tres meses; el cual quedará \nasí: \n“(…) \n3.1 Monitoreo Trimestral  \nLos siguientes parámetros se deben medir con una periodicidad trimestral  \nPARÁMETROS IN SITU \nUNIDADES \nConductividad Eléctrica \n(μS/cm) \nOxígeno Disuelto \nmg/L \npH \nUnidades de pH \nPotencial Redox \nmV \nSolidos Disueltos Totales (SDT) \nmg/L \nTemperatura  \n°C \n*Caudal de explotación (solo para pozos \nconcesionados) \nl/s \n*Nivel Estático \nm \n*Profundidad de toma de muestra  \nm  \n*Ver nota \n \na.\nProfundidad de toma de muestra: se debe medir siempre y cuando se conozca el \ndiseño del punto de agua subterránea y/o el nivel acuífero captado. \nb.\nCaudal de explotación: la medición de este parámetro solo aplica para los pozos \ncon concesión de agua subterránea.  \nc.\nNivel estático: debe reportarse la profundidad de la lámina de agua en metros, al \nigual que en términos de la cota del terreno (en metros sobre el nivel del mar -\nm.s.n.m), siempre tomando como referencia el nivel del terreno, tal como se indica \nen la siguiente figura: \n\nResolución No. 000373       Del 11 MAR. 2024          Hoja No. 21 de 23\n“POR LA CUAL SE RESUELVE RECURSO DE REPOSICIÓN INTERPUESTO \nEN CONTRA DE LA RESOLUCIÓN 1658 DEL 1 DE AGOSTO DE 2023”\nPágina 21 de 23\nLos niveles de agua deben ser reportados al nivel \ndel SUELO. \n \nH (altura desde el nivel del suelo hasta la boca del \npozo) = h1 + h2 \n \nNE = N - H \n (…)”\n \nARTÍCULO SEGUNDO. Los demás términos, condiciones y obligaciones de la \nResolución 1658 de 01 de agosto de 2023, que no son objeto de modificación \nexpresa en este proveído, se mantienen vigentes y son exigibles para el titular del \ninstrumento de manejo ambiental, a partir de la ejecutoria del presente acto \nadministrativo.\nARTÍCULO TERCERO. Por la Autoridad Nacional de Licencias Ambientales – \nANLA, notificar personalmente o por aviso, cuando a ello hubiere lugar, el contenido \ndel presente acto administrativo al representante legal, apoderado debidamente \nconstituido o a la persona debidamente autorizada por la Sociedad COLOMBIA \nENERGY DEVELOPMENT CO, identificada con NIT. 800187974-3, de conformidad \ncon los artículos 56, modificado por el artículo 10 de la Ley 2080 de 2021 y 67 y 69 \ndel Código de Procedimiento Administrativo y de lo Contencioso Administrativo.\nPARÁGRAFO PRIMERO. En el suceso en que el titular de la licencia o el permiso, \nentre en proceso de disolución o régimen de insolvencia empresarial o liquidación \nregulados por las normas vigentes, informará inmediatamente de esta situación a \nesta Autoridad, con fundamento, entre otros, en los artículos 8, 58, 79, 80, 81, 95 \nnumeral 8 de la Constitución Política de 1991, en la Ley 43 de 1990, en la Ley 222 \nde 1995, en la Ley 1333 de 2009 y demás normas vigentes y jurisprudencia \naplicable.\n PARÁGRAFO SEGUNDO. Adicional a la obligación de informar a esta Autoridad \nde tal situación, el titular de la licencia o permiso aprovisionará contablemente las \nobligaciones contingentes que se deriven de la existencia de un procedimiento \nambiental sancionatorio conforme con el artículo 40 de la Ley 1333 de 2009 o la \nnorma que la adicione, modifique o derogue. \nARTÍCULO CUARTO. Por la Autoridad Nacional de Licencias Ambientales – ANLA, \ncomunicar el presente acto administrativo a la alcaldía municipal de Maní, en el \ndepartamento de Casanare, a la Corporación Autónoma Regional de la Orinoquía - \nCORPORINOQUÍA y a la Procuraduría Ambiental y Agraria, para su conocimiento \ny fines pertinentes.\n\nResolución No. 000373       Del 11 MAR. 2024          Hoja No. 22 de 23\n“POR LA CUAL SE RESUELVE RECURSO DE REPOSICIÓN INTERPUESTO \nEN CONTRA DE LA RESOLUCIÓN 1658 DEL 1 DE AGOSTO DE 2023”\nPágina 22 de 23\nARTICULO QUINTO. Publicar el presente acto administrativo en la Gaceta \nAmbiental de la Autoridad Nacional de Licencias Ambientales – ANLA, de \nconformidad con los términos señalados en el artículo 71 de la Ley 99 de 1993.\nARTICULO SEXTO. Contra el presente acto administrativo no procede recurso \nalguno, de conformidad con lo dispuesto en el Artículo 87 de la Ley 1437 de 18 de \nenero de 2011 por medio de la cual se expidió el Código de Procedimiento \nAdministrativo y de lo Contencioso Administrativo.\nNOTIFIQUESE, COMUNIQUESE, PUBLIQUESE Y CUMPLASE\nDado en Bogotá D.C., a los 11 MAR. 2024\nRODRIGO ELIAS NEGRETE MONTES\nDIRECTOR GENERAL\nHECTOR HERNAN RAMOS AREVALO\nCONTRATISTA\nMONICA LILIANA JURADO GUTIERREZ\nCONTRATISTA\nSANDRA PATRICIA BEJARANO RINCON\nCONTRATISTA\nMARCELO ROJAS BALLESTEROS\nCONTRATISTA\nMANUEL SANTIAGO BURGOS NAVARRO\nCONTRATISTA\nExpediente No. LAM1309\nConcepto Técnico N° \n6491 de 04 de octubre de 2023\nFecha:\n12 de febrero de 2024\nProceso No.: 20241000003734\n\nResolución No. 000373       Del 11 MAR. 2024          Hoja No. 23 de 23\n“POR LA CUAL SE RESUELVE RECURSO DE REPOSICIÓN INTERPUESTO \nEN CONTRA DE LA RESOLUCIÓN 1658 DEL 1 DE AGOSTO DE 2023”\nPágina 23 de 23\nNota: Este es un documento electrónico generado desde los Sistemas de Información de la ANLA. El original reposa en los \narchivos digitales de la Entidad\n"
}