{
  "fuente": "ANLA_GACETA",
  "numero_resolución": "RESOLUCIÓN N° 002073",
  "fecha_resolución": "1993-12-22",
  "anio_resolucion": "1993",
  "nombre_proyecto": "Área de interés Perforación Exploratoria",
  "nombre_proyecto_normalizado": "AREA DE INTERES PERFORACION EXPLORATORIA",
  "ubicación": "Municipio De Hato Corozal, Departamento Del Casanare",
  "empresa": "HOCOL S",
  "empresa_normalizada": "HOCOL S",
  "numero_expediente": "exploratorio",
  "radicados": [
    "2023038544",
    "20246200643482",
    "20236200034212",
    "2022277159",
    "20236200586652",
    "20246200219062"
  ],
  "descripcion": "POR LA CUAL SE RESUELVE UN RECURSO DE REPOSICIÓN",
  "tipos_infraccion": [
    "Tala o afectación de bosques",
    "Incumplimiento del PMA"
  ],
  "tipos_infraccion_normalizados": [
    "TALA O AFECTACION DE BOSQUES",
    "INCUMPLIMIENTO DEL PMA"
  ],
  "pdf_id": "48025",
  "file_name": "ANLA_48025.pdf",
  "texto_completo": "AUTORIDAD NACIONAL DE LICENCIAS \nAMBIENTALES\n- ANLA –\nRESOLUCIÓN N° 002073\n(20 SEP. 2024)\nPágina 1 de 21\n“POR LA CUAL SE RESUELVE UN RECURSO DE REPOSICIÓN”\nEL ASESOR DEL DESPACHO DEL DIRECTOR DE LA AUTORIDAD \nNACIONAL DE LICENCIAS AMBIENTALES – ANLA\nEn ejercicio de las facultades legales establecidas mediante la Ley 99 del 22 de \ndiciembre de 1993, el Decreto Ley 3573 del 27 de septiembre de 2011, modificado \npor el Decreto 376 del 11 de marzo de 2020, por el cual se modifica la estructura \nde la Autoridad Nacional de Licencias Ambientales y acorde con lo regulado en el \nDecreto 1076 del 26 de mayo de 2015, la Resolución 669 del 14 de abril de 2020, \nla Resolución 1957 del 5 de noviembre de 2021 y la Resolución 2795 del 25 de \nnoviembre de 2022, expedidas por la Autoridad Nacional de Licencias \nAmbientales, y\nCONSIDERANDO\nQue mediante Resolución 2072 del 24 de noviembre de 2008, el entonces Ministerio \nde Ambiente, Vivienda y Desarrollo Territorial, hoy Ministerio de Ambiente y \nDesarrollo Sostenible (en adelante el Ministerio), otorgó Licencia Ambiental a la \nsociedad HOCOL S.A., para el proyecto “Área de interés Perforación Exploratoria \nTángara Norte”, ubicado en las veredas La Capilla, Las Camelias, El Banco de \nBuenos Aires, La Maraure, Rosa Blanca, El Porvenir, San Luis del Aricaporo, Casa \nRoja, La Veremos, Aricaporo, Palmas y Guayureme, todas ellas pertenecientes a la \njurisdicción del municipio de Hato Corozal, departamento del Casanare.\nQue a través de la Resolución 864 del 12 de mayo de 2020, la Autoridad Nacional \nde Licencias Ambientales (en adelante la Autoridad Nacional), modificó el artículo \ndécimo cuarto de la Resolución 2072 del 24 de noviembre de 2008, en el sentido de \naprobar la actualización de la base de inversión forzosa de no menos del 1% de los \nvalores no ejecutados, de conformidad con el artículo 321 de la Ley 1955 de 2019.\nQue por medio de la Resolución 1821 del 13 de noviembre de 2020, la Autoridad \nNacional resolvió un recurso de reposición interpuesto en contra de la Resolución \n864 del 12 de mayo de 2020, en el sentido de reponer el artículo primero aclarando \nque el proyecto se localiza en el municipio de Hato Corozal en el departamento del \nCasanare.\n\nResolución No. 002073       Del 20 SEP. 2024          Hoja No. 2 de 21\n“POR LA CUAL SE RESUELVE UN RECURSO DE REPOSICIÓN”\nPágina 2 de 21\nQue mediante la Resolución 626 del 5 de abril de 2021, la Autoridad Nacional ajustó \nvía seguimiento el instrumento de control ambiental del proyecto “Área de \nPerforación Exploratoria Tángara Norte”, en el sentido de excluir las fichas de \nmanejo 7.3.6 programa de contratación de mano de obra local y 7.3.7. – Programa \nde Arqueología Preventiva y modificar la medida 1 de la -Ficha 7.2.6.3 Por Fauna y \nFlora-del Programa de Compensación para el Medio Biótico.\nQue a través de la Resolución 1725 del 09 de agosto de 2022, la Autoridad Nacional \nmodificó el contenido del artículo cuarto de la Resolución 864 del 12 de mayo de \n2020, en el sentido de modificar el ámbito geográfico para realizar la inversión \nforzosa de no menos del 1% del proyecto “Área de Interés de Perforación \nExploratoria Tángara Norte” estableciéndolo en las cuencas hidrográfica del río \nChire y Aricaporo”.\nQue mediante Resolución 1041 del 17 de mayo de 2023, la Autoridad Nacional \naceptó el desistimiento presentado por la Sociedad HOCOL S.A., mediante \ncomunicación con radicación 2022277159-1-000 del 9 de diciembre de 2022, de la \nlínea de inversión forzosa de no menos del 1% de destinación Instrumentación y \nmonitoreo del recurso hídrico aprobada por medio de la Resolución 864 de 12 de \nmayo de 2020.\nQue por medio de la Resolución 1442 del 10 de julio de 2023, la Autoridad Nacional \naprobó el Plan de Compensación para el Medio Biótico, establecido en la medida 1 \nde la ficha FICHA 7.2.6.3 Por Fauna y Flora del Programa de Compensación para \nel Medio Biótico, del plan de manejo ambiental aprobado en el artículo octavo de la \nResolución 2072 del 24 de noviembre de 2008, modificada por la Resolución No. \n626 del 05 de abril de 2021, para el proyecto “Área de Interés de Perforación \nExploratoria Tángara Norte”, presentado por la sociedad HOCOL S.A., mediante \nradicado 2023038544-1-000 del 27 de febrero del 2023, consistente en Implementar \n1000 metros lineales de cercas vivas y mantenimiento durante 2 años.\nQue mediante la Resolución 942 del 22 de mayo de 2024, la Autoridad Nacional \nestableció el incremento de los valores no ejecutados del Plan de inversión forzosa \nde no menos del 1%, de acuerdo con la fórmula definida en el parágrafo primero del \nartículo 321 de la Ley 1955 del 25 de mayo de 2019, el cual corresponde a la suma \nde \nTREINTA \nY \nSEIS \nMILLLONES \nSEISCIENTOS \nVEINTINUEVE \nMIL \nNOVECIENTOS QUINCE PESOS MCTE. ($36.629.915), con corte al 31 de \ndiciembre de 2022 y requirió a la sociedad para que presentara la proyección \nfinanciera actualizada. Acto administrativo que fue notificado a la sociedad mediante \ncorreo electrónico el día 23 de mayo de 2024.\nQue a través de la comunicación con radicación 20246200643482 del 6 de junio de \n2024, la Sociedad interpuso recurso de reposición en contra de la Resolución 942 \ndel 22 de mayo de 2024, argumentos que fueron evaluados por el equipo técnico \n\nResolución No. 002073       Del 20 SEP. 2024          Hoja No. 3 de 21\n“POR LA CUAL SE RESUELVE UN RECURSO DE REPOSICIÓN”\nPágina 3 de 21\nde la Autoridad Nacional y en consecuencia se expidió el Concepto técnico 6383 \ndel 29 de agosto de 2024.\nCOMPETENCIA DE LA AUTORIDAD NACIONAL\nEl Gobierno Nacional, mediante Decreto Ley 3573 del 27 de septiembre de 2011, \ncreó la Autoridad Nacional de Licencias Ambientales - ANLA, como una entidad con \nautonomía administrativa y financiera, sin personería jurídica, la cual hace parte del \nSector Administrativo de Ambiente y Desarrollo Sostenible, en los términos del \nartículo 67 de la Ley 489 de 1998.\nEl numeral 1° del artículo tercero del mencionado decreto estableció dentro de las \nfunciones de la Autoridad Nacional, la de otorgar o negar las licencias, permisos y \ntrámites ambientales de competencia del Ministerio, de conformidad con la ley y los \nreglamentos.\nMediante el Decreto 376 del 11 de marzo de 2020, se modificó la estructura de la \nAutoridad Nacional de Licencias Ambientales.\nMediante la Resolución 669 del 14 de abril de 2020, se nombró como servidor \npúblico a EDILBERTO PEÑARANDA CORREA, identificado con cédula de \nciudadanía 4.052.851, en el empleo de libre nombramiento y remoción de Asesor, \ncódigo 1020, grado 15, adscrito a la Dirección General de la planta global de la \nANLA.\nEl 5 de noviembre de 2021, la Autoridad Nacional emitió la Resolución 1957 “Por la \ncual se adopta el Manual Específico de Funciones y de Competencias Laborales para los \nempleos de la planta de personal de la Autoridad Nacional de Licencias Ambientales - \nANLA”, en donde se establece que corresponde al Despacho del Director General \nde la Autoridad Nacional de Licencias Ambientales - ANLA, “Suscribir los actos \nadministrativos que otorgan, niegan, modifican, ajustan o declaran la terminación de las \nlicencias, permisos y trámites ambientales”.\nEn ejercicio de las facultades conferidas por la Ley 489 de 1998, se expidió la \nResolución 2795 del 25 de noviembre de 2022 “Por la cual se delegan unas \nfunciones y se dictan otras disposiciones”, en su artículo primero, numeral 15° \ndelegó en el Asesor Código 1020 Grado 15 del Despacho del Director General, la \nfunción de “Resolver los recursos de reposición interpuestos contra los actos \nadministrativos que se emiten en cumplimiento de las funciones anteriores.”\nTeniendo en cuenta lo anterior, es el Asesor del Despacho del Director General de \nla Autoridad Nacional el competente para pronunciarse sobre el recurso de \nreposición interpuesto por la Sociedad en contra de la Resolución 942 del 22 de \nmayo de 2024.\nFUNDAMENTOS JURÍDICOS\n\nResolución No. 002073       Del 20 SEP. 2024          Hoja No. 4 de 21\n“POR LA CUAL SE RESUELVE UN RECURSO DE REPOSICIÓN”\nPágina 4 de 21\nEl procedimiento para la presentación y resolución de recursos contra los actos \nadministrativos se encuentra reglado en el Código de Procedimiento Administrativo \ny de lo Contencioso Administrativo artículos 74 y siguientes, que particularmente \nrespecto del recurso de reposición al tenor literal expresan:\n“Artículo 74. Recursos contra los actos administrativos.\nPor regla general, contra los actos definitivos procederán los siguientes recursos: \n1. El de reposición, ante quien expidió la decisión para que la aclare, modifique, adicione \no revoque (…)”\nA su vez, los artículos 76 y 77 del Código enunciado preceptúan: \n“Artículo 76. Oportunidad y presentación.\nLos recursos de reposición y apelación deberán interponerse por escrito en la diligencia \nde notificación personal, o dentro de los diez (10) días siguientes a ella, o a la notificación \npor aviso, o al vencimiento del término de publicación, según el caso. Los recursos \ncontra los actos presuntos podrán interponerse en cualquier tiempo, salvo en el evento \nen que se haya acudido ante el juez. \nLos recursos se presentarán ante el funcionario que dictó la decisión (…)”\nArtículo 77. Requisitos.\nPor regla general los recursos se interpondrán por escrito que no requiere de \npresentación personal si quien lo presenta ha sido reconocido en la actuación. \nIgualmente, podrán presentarse por medios electrónicos. \nLos recursos deberán reunir, además, los siguientes requisitos: \n1. Interponerse dentro del plazo legal, por el interesado o su representante o apoderado \ndebidamente constituido. \n2. Sustentarse con expresión concreta de los motivos de inconformidad.\n3. Solicitar y aportar las pruebas que se pretende hacer valer. \n4. Indicar el nombre y la dirección del recurrente, así como la dirección electrónica si \ndesea ser notificado por este medio. \nSólo los abogados en ejercicio podrán ser apoderados (…)”\nA su vez, el artículo 80 del citado Código, establece el alcance del contenido de la \ndecisión que resuelve el recurso:\n\nResolución No. 002073       Del 20 SEP. 2024          Hoja No. 5 de 21\n“POR LA CUAL SE RESUELVE UN RECURSO DE REPOSICIÓN”\nPágina 5 de 21\n“Artículo 80. Decisión de los recursos. -Vencido el período probatorio, si a ello hubiere \nlugar, y sin necesidad de acto que así lo declare, deberá proferirse la decisión motivada \nque resuelva el recurso. \nLa decisión resolverá todas las peticiones que hayan sido oportunamente planteadas y \nlas que surjan con motivo del recurso.” \nCONSIDERACIONES DE LA AUTORIDAD NACIONAL FRENTE AL RECURSO \nDE REPOSICIÓN INTERPUESTO POR LA SOCIEDAD.\nDesde el punto de vista procedimental, se observa que el recurso de reposición \ninterpuesto por la Sociedad en contra de Resolución 942 del 22 de mayo de 2024, \ncumple con los requisitos establecidos en el artículo 77 y concordantes del Código \nde Procedimiento Administrativo y de lo Contencioso Administrativo, en cuanto a lo \nsiguiente:\n1. Interponerse dentro del plazo legal, por el interesado o su representante o \napoderado debidamente constituido.\nSe encuentra acreditado que el día 23 de mayo de 2024 la Sociedad fue notificada \nmediante correo electrónico de la Resolución 942 del 22 de mayo de 2024, frente a \nla cual interpuso recurso de reposición por intermedio de su Representante Legal el \ndía 6 de junio de 2024 bajo el radicado 20246200643482; es decir, que la \npresentación del recurso se efectuó dentro de los diez (10) días siguientes a la \nnotificación, de conformidad con lo preceptuado en el artículo 76 de la Ley 1437 de \n2011.\n2. Sustentarse con expresión concreta de los motivos de inconformidad.\nLa Sociedad presentó los argumentos en contra de las disposiciones recurridas de \nla Resolución 942 del 22 de mayo de 2024, los cuales serán tenidos en cuenta para \ndecidir el presente recurso de reposición.\n3. Solicitar y aportar las pruebas que se pretende hacer valer.\nEn el recurso de reposición la Sociedad no aportó pruebas:\n4. Indicar el nombre y la dirección del recurrente, así como la dirección \nelectrónica si desea ser notificado por este medio.\nLa Sociedad manifestó que, para efectos de la notificación: “(…) La Compañía recibirá \nnotificaciones en la siguiente dirección Carrera 7 No. 113-43 Piso: 17 en la ciudad de Bogotá \nD.C. o en el correo electrónico habilitado para tal fin: notificacionesjudiciales@hcl.com.co”\nCon base en lo anterior, verificado el cumplimiento de los requisitos establecidos en \nel Código de Procedimiento Administrativo y de lo Contencioso Administrativo -\n\nResolución No. 002073       Del 20 SEP. 2024          Hoja No. 6 de 21\n“POR LA CUAL SE RESUELVE UN RECURSO DE REPOSICIÓN”\nPágina 6 de 21\nCPACA-, respecto a la procedencia del señalado recurso de reposición, la Autoridad \nNacional procederá a resolverlo, teniendo en cuenta las consideraciones realizadas \nen el Concepto técnico 6383 del 29 de agosto de 2024; en el mismo orden de los \nargumentos presentados por la Sociedad, a saber:\n1. DISPOSICIÓN RECURRIDA - ARTÍCULO PRIMERO.\n“ARTÍCULO PRIMERO. ESTABLECER el incremento de los valores no ejecutados del \nPlan de inversión del 1%, de acuerdo con la fórmula definida en el parágrafo primero \ndel artículo 321 de la Ley 1955 de 2019, el cual corresponde a la suma de TREINTA Y \nSEIS MILLLONES SEICIENTOS VEINTINUEVE MIL NOVECIENTOS QUINCE PESOS \nMCTE. ($36.629.915), con corte al 31 de diciembre de 2022.\nPARÁGRAFO. El balance de la Inversión forzosa de no menos de 1%, para el proyecto \n“Área de Perforación Exploratoria Tángara Norte” es el siguiente:\nBalance de la Inversión forzosa de no menos del 1% con corte a 31 de\ndiciembre de 2023\nValor de la liquidación de la inversión forzosa de no menos en el marco del \nacogimiento al artículo 321 de la ley 1955 de 2019. (Periodo el 28 de \ndiciembre de 2008 al 21 de enero de 2011)\n$930.446.618,41\nIncremento Liquidación 1% con la fórmula del Parágrafo Primero del \nArtículo 321 de la ley 1955 de 2019, sobre valores no ejecutados del plan \nde Inversión del 1%.\n$36.629.915\nValor de Liquidación inversión forzosa de no menos del 1%, actualizado al \n31 de diciembre de 2022.\n$967.076.533,41\nValor ejecutado del Plan de Inversión del 1%\n$0\nValor en ejecución de la inversión forzosa de no menos del 1%\n$0\nValor por ejecutar del Plan de Inversión del 1% actualizado al Artículo 321 \nde la Ley 1955 de 2019. Con corte 31 de diciembre de 2022\n$967.076.533,41\n(…)”\n1.1.Petición de la sociedad\n“PRIMERA PETICIÓN: MODIFICAR el Artículo Primero (1) de la Resolución 0942 de mayo \n22 de 2024 en el sentido de reconocer que HOCOL S.A. ha realizado una inversión forzosa \nde no menos del 1% correspondiente a la suma de CERO PESOS M/C (COP$0), y, por lo \ntanto, los valores pendientes de ejecutar corresponden a la suma de NOVECIENTOS \nCUARENTA Y SIETE MILLONES SETECIENTOS OCHENTA Y OCHO PESOS CON \nOCHENTA Y NUEVE CENTAVOS M/C (COP$ 947.683.788,89). Así mismo, reconocer que \nel balance de la inversión forzosa de no menos del 1%, corresponde a lo siguiente \nNOVECIENTOS CUARENTA Y SIETE MILLONES SETECIENTOS OCHENTA Y OCHO \nPESOS CON OCHENTA Y NUEVE CENTAVOS M/C (COP$ 947.683.788,89) conforme al \nradicado 20236200034212 del 25 de abril de 2023”\n1.2.Argumentos de la sociedad\nMediante comunicación con radicación 20246200643482 del 6 de junio de 2024, la \nSociedad presentó los siguientes argumentos:\n\nResolución No. 002073       Del 20 SEP. 2024          Hoja No. 7 de 21\n“POR LA CUAL SE RESUELVE UN RECURSO DE REPOSICIÓN”\nPágina 7 de 21\n(…) \n“6.1. Que mediante Resolución 0942 del 22 de mayo de 2024, la ANLA en control y \nseguimiento al expediente exploratorio del APE Tangara Norte, estableció lo siguiente:\n“ARTÍCULO PRIMERO. ESTABLECER el incremento de los valores no ejecutados del Plan \nde inversión del 1%, de acuerdo con la fórmula definida en el parágrafo primero del artículo \n321 de la Ley 1955 de 2019, el cual corresponde a la suma de TREINTA Y SEIS \nMILLLONES SEICIENTOS VEINTINUEVE MIL NOVECIENTOS QUINCE PESOS MCTE. \n($36.629.915), con corte al 31 de diciembre de 2022. \nPARÁGRAFO. El balance de la Inversión forzosa de no menos de 1%, para el proyecto \n“Área de Perforación Exploratoria Tangara Norte” es el siguiente (…)\n6.2. En relación con lo anterior, se tienen las siguientes consideraciones: \n6.2.1. Respecto al Artículo Primero – Del Valor ajustado: La ANLA evaluó la información \npresentada por HOCOL mediante el radicado No. 20236200034212 del 25 de abril de 2023, \nlo cual consta en el concepto técnico No. 1692 del 22 de marzo de 2024, así: (…)\n6.2.2. De acuerdo con lo anterior, se solicita mantener el valor inicialmente presentado por \nHOCOL en la comunicación con radicado No. 20236200034212 del 25 de abril de 2023, \nconforme la información enviada por HOCOL en respuesta al Requerimiento 1 del Acta No. \n94 del 23 de marzo de 2023, teniendo en cuenta lo siguiente:\n6.2.2.1. En el año 2021, HOCOL realizó las gestiones necesarias con la administración \nmunicipal de Hato Corozal, Casanare, para que esta entidad recibiera las áreas, que fueran \nadquiridas en el marco del cumplimiento del programa de no menos del 1%. \n6.2.2.2. En el año 2022, HOCOL a través del área de tierras, inició el estudio de títulos de \nlos predios aprobados internamente para compra, con el fin de verificar la legalidad de \nestos. De igual manera se realizó visita técnica a cada uno de los predios para verificar sus \ncondiciones ambientales y verificar los límites correspondientes. \n6.2.2.3. En el mes de mayo de 2022, se realizó el levantamiento de los linderos de cada \nuno de los predios para su identificación plena, con el objeto de realizar la consulta ante las \nentidades correspondientes (ANT, URT, etc.) y así tener certeza de la legalidad de los \npredios. Esto hace parte del estudio de prefactibilidad de compra para el cumplimiento de \nla obligación de inversión forzosa de no menos del 1% para el proyecto. \n6.2.2.4. Sin embargo, solo hasta el mes de marzo de 2023, luego de efectuar las consultas \na la Unidad de Restitución de Tierras (UDT) y una vez realizada la revisión jurídico catastral \nde los tres (3) predios propuestos (Buena Vista, Buenos Aires y La Ilusión), el área de tierras \nde HOCOL identificó que dichos predios cuentan con elementos y situaciones en los \ndocumentos que acreditan su propiedad, que impiden técnica y jurídicamente la adquisición \nde estos bajo las condiciones actuales. La situación anterior es ajena a la Compañía \nteniendo en cuenta que dichas entidades hacen parte del Estado y la demora en emitir una \ndecisión de fondo sobre la consulta elevada no puede ser atribuida a HOCOL. \n\nResolución No. 002073       Del 20 SEP. 2024          Hoja No. 8 de 21\n“POR LA CUAL SE RESUELVE UN RECURSO DE REPOSICIÓN”\nPágina 8 de 21\n6.2.2.5. Bajo dicha premisa, en el mes de mayo de 2023 se inició un proceso de \nacercamiento con el propietario del predio La Ilusión, señor Roselino Fonseca, teniendo en \ncuenta que dicho predio tiene algunas situaciones que pueden ser subsanables para darle \nviabilidad a la compra del predio. En el marco del proceso se realizó reunión con el señor \nFonseca, donde se le explicó, entre otras cosas, las inconsistencias que debían subsanarse \npor parte de él como propietario del predio, para continuar con el proceso. \n6.2.2.6. Con lo anterior es evidente que HOCOL, ha venido ejecutando desde el año 2021, \nlas actividades previas a la adquisición de las áreas, sin embargo, por cuestiones ajenas a \nla Compañía no ha podido materializar su compra en los tiempos estimados inicialmente. \nDe manera que HOCOL no debe asumir asuntos ajenos a su resorte, por lo cual, se \nconstituye en una fuerza mayor, al estar por fuera del control de la Compañía, lo cual \nademás implica que HOCOL no puede verse afectado por situaciones que escapan de lo \nque razonablemente se puede hacer. \nEn dicho sentido, debe reconocerse la fuerza mayor basado en la imposibilidad de objeto, \nsobre lo cual las Altas Cortes han reconocido que en casos como estos debe darse \naplicación al principio de que “nadie está obligado a lo imposible”. \nEl Consejo de Estado ha reconocido en reiteradas oportunidades la aplicación del principio \nde que nadie está obligado a lo imposible. Veamos: \n-\nConsejo de Estado, Sección Primera. C.P. Rafael E. Osteau de Lafont Pianeta. \nSentencia del 15 de junio de 2006 con radicado 68001-23-15-000-2006-01031-\n01(AC)\n“El cierre total del lugar donde prestaban el servicio los demandantes hace imposible el \nreintegro, porque esa es una verdad axiomática. Más aún, para que una obligación exista \nes necesario que sea física y jurídicamente posible, de manera que una persona no puede \nobligarse por un acto o declaración de voluntad a cumplir lo imposible y, de la misma \nmanera, el juez no puede gravar al demandado, con una decisión judicial suya, a que \ncumpla un hecho o un acto materialmente imposible. Cuando el hecho debido se torna \nimposible, la obligación original (de dar, hacer o no hacer) se resuelve en una de indemnizar \nperjuicios de modo que lo jurídicamente procedente es la demanda judicial de los \nperjuicios”.\n“Por otra parte, cuando el Tribunal sostiene que el juez del trabajo debe analizar las \ncircunstancias que aparezcan en el juicio para decidir entre el reintegro o el pago de la \nindemnización y encuentra que la desaparición de la empresa es una de esas \ncircunstancias, aplica principios básicos del derecho común sobre la posibilidad del objeto \nde toda prestación, pues, como se dijo en el párrafo anterior, no es jurídicamente posible \nasumir una obligación que tenga por objeto el cumplimiento de un hecho o acto físicamente \nimposible, ni le está dado al juez hacer cumplir lo que se escapa de las leyes físicas.” \n(énfasis añadido).\n- Consejo de Estado, Sección Tercera. C.P. Mauricio Fajardo Gómez. Sentencia del 20 de \nmayo de 2013 con radicado 68001-23-15-000-1999-02379-01(26000)\n“Al respecto, la Subsección reitera la tesis expuesta por la Jurisprudencia de la Sección \ntercera de la Corporación en punto a la relatividad de la falla en el servicio, según la cual a \n\nResolución No. 002073       Del 20 SEP. 2024          Hoja No. 9 de 21\n“POR LA CUAL SE RESUELVE UN RECURSO DE REPOSICIÓN”\nPágina 9 de 21\npesar de que el Estado debe brindarle protección a todas las personas, no podrían resultarle \nimputables todos los daños que éstas llegaren a sufrir a causa de terceros, comoquiera que \nlas obligaciones del Estado son relativas y, por lo tanto, la Administración no se encuentra \nobligada a realizar lo imposible para cumplir con tal cometido; así ha discurrido la Sala:\n“No obstante, cabe señalar que la Sala ha considerado que a pesar de que es deber del \nEstado brindar protección a todas las personas residentes en el país, no le son imputables \ntodos los daños a la vida o a los bienes de las personas causados por terceros, porque las \nobligaciones del Estado son relativas, en tanto limitadas por las capacidades que en cada \ncaso concreto se establezcan, dado que “nadie está obligado a lo imposible”. Aunque, se \ndestaca que esta misma Corporación en providencias posteriores ha aclarado que la \nrelatividad de las obligaciones del Estado no excusa su incumplimiento, sino que debe \nindagarse en cada caso si en efecto fue imposible cumplir aquéllas que en relación con el \ncaso concreto le correspondían”. (énfasis añadido).\n- Consejo de Estado, Sección Tercero. C.P. Marta Nubia Velásquez Rico. Sentencia del 1 \nde agosto de 2016 con radicado 66001-23-31-000-2006-00159-02(36288)\n“(…) La obligación de prestar asistencia médica es compleja, es una relación jurídica total, \ncompuesta por una pluralidad de deberes de conducta (debe de ejecución, deber de \ndiligencia en la ejecución, deber de información, deber de guardar secreto médico, etc.). \nEse conjunto de deberes conforma una trama, un tejido, una urdimbre de la vida social \nresponde a la idea de organización - más que de organismos- en punto a la susodicha \nrelación jurídico total (…) Por tanto, aquel deber jurídico principal supone la presencia de \notros deberes secundarios de conducta, como los de diagnóstico, información, recepción \nde la voluntad jurídica del enfermo –llamada comúnmente consentimiento del paciente-, \nprescripción, guarda del secreto profesional, satisfacción del plan de prestación en su \nintegridad (actividad que supone no abandonar al enfermo y cuidar de él hasta darlo de \nalta)’ (subrayado fuera de texto).\n“(…) Del texto transcrito se tiene para concluir que, en este caso, se presentó una atención \nmédica oportuna donde se incluyeron los procedimientos que los médicos consideraron \nmás convenientes y los que hubiesen podido contribuir a salvaguardar la salud y la vida de \nla paciente, procedimientos que fueron informados a la paciente y a su compañero \npermanente, quienes además suscribieron la autorización para los procedimientos \nquirúrgicos en la que se les pone en conocimiento de los riesgos y complicaciones.” (énfasis \nañadido).\n- Consejo de Estado, Sección Tercera. C.P. Mauricio Fajardo Gómez. Sentencia del 11 de \njulio de 2012 con radicado 63001-23-31-000-2000-00190-01(24291) “En ese orden de \nideas, para esta Subsección resulta claro que si bien dentro del acervo probatorio obran las \ndeclaraciones rendidas por personas que estuvieron presentes en el lugar de los hechos \npor los cuales se demandó, encaminadas a señalar que las entidades públicas demandadas \nno habrían llevado a cabo las actuaciones o medidas tendientes a contrarrestar –se insiste– \nel saqueo de mercancías de que fue objeto la Empresa Asociativa de Trabajo MERCA DOS, \nlo cierto es que tales señalamientos no acreditan una falla del servicio en el presente caso, \ndado que la teoría de la relatividad de la falla precisa que a pesar de que el Estado debe \nbrindarle protección a todas las personas, no podrían resultarle imputables todos los daños \nque éstas o sus bienes llegaren a sufrir a causa de terceros, comoquiera que las \nobligaciones del Estado son relativas y, por lo tanto, la Administración no se encuentra \n\nResolución No. 002073       Del 20 SEP. 2024          Hoja No. 10 de 21\n“POR LA CUAL SE RESUELVE UN RECURSO DE REPOSICIÓN”\nPágina 10 de 21\nobligada a realizar lo imposible para cumplir con tal cometido; al respecto la Sala, en \nreiteradas oportunidades, se ha pronunciado en los siguientes términos:\n“No obstante, cabe señalar que la Sala ha considerado que a pesar de que es deber del \nEstado brindar protección a todas las personas residentes en el país, no le son imputables \ntodos los daños a la vida o a los bienes de las personas causados por terceros, porque las \nobligaciones del Estado son relativas, en tanto limitadas por las capacidades que en cada \ncaso concreto se establezcan, dado que “nadie está obligado a lo imposible”. Aunque, se \ndestaca que esta misma Corporación en providencias posteriores ha aclarado que la \nrelatividad de las obligaciones del Estado no excusa su incumplimiento, sino que debe \nindagarse en cada caso si en efecto fue imposible cumplir aquéllas que en relación con el \ncaso concreto le correspondían” (énfasis añadido).\nComo se puede observar el Consejo de Estado ha reconocido que no puede esperarse un \ncomportamiento de parte de una persona natural o jurídica cuando quiera que lograr su \ncometido resulta imposible. Así las cosas, en el caso en concreto habría lugar a la aplicación \nde dicho principio por parte de la ANLA y con ello el presente recurso está llamado a \nprosperar, en la medida en que la Compañía no está obligada a lo imposible, como lo es en \neste caso los trámites administrativos asociados a los predios vinculados a la inversión \nforzosa de no menos del 1% por ser asuntos ajenos al alcance de las acciones y gestiones \nque pueda realizar HOCOL.\n6.2.2.7. Respecto a la actualización de los valores no ejecutados, y concordancia con lo \nestablecido por la ANLA, el primer año fiscal abarca el periodo del 1 de enero de 2023 al \n31 de diciembre de 2023.\n6.2.2.8. A su vez, el primer año de ejecución del proyecto aprobado por la ANLA, \ncorresponde al periodo entre el 18 de mayo de 2021 y 19 de mayo de 2022, como \nclaramente lo expresa la autoridad en el concepto técnico 1692 del 22 de marzo de 2024, \ncon lo cual la empresa tenía como plazo máximo para la ejecución de los recursos \ncorrespondientes al primer año, hasta el día 19 de mayo del año 2022.\n6.2.2.9. Consecuentemente con lo anterior, la Compañía en el marco del proceso de \nactualización de los valores no ejecutados, en cumplimiento del requerimiento N° 9 del acta \n094 del 23 de marzo de 2023, aplico el índice de precios del consumidor del mes de mayo \nde 2022 (118.70), dado que era el tiempo máximo de ejecución del año 1 y no el valor del \nIPC del mes de diciembre de 2021 (111,41), que utilizó la ANLA para realizar el ajuste del \nvalor.\n6.2.2.10. Por tanto, para el ajuste de los valores del año 1, sólo se deben tener en cuenta \nlos que no estén en proceso de ejecución en el periodo diferido, de ahí la ponderación \nrealizada que genera una variación frente al valor impuesto por la ANLA en la Res. 0942 de \n2024 (IPC Inicial ANLA 111,41) y el valor empleado por HOCOL (IPC Inicial Hocol 118,7).”\n1.3.Consideraciones de la Autoridad Nacional\nLos argumentos de inconformidad presentados por el recurrente fueron objeto de \nevaluación por el equipo técnico de la Autoridad Nacional y mediante Concepto \ntécnico 6383 del 29 de agosto de 2024, se presentaron las siguientes \n\nResolución No. 002073       Del 20 SEP. 2024          Hoja No. 11 de 21\n“POR LA CUAL SE RESUELVE UN RECURSO DE REPOSICIÓN”\nPágina 11 de 21\nconsideraciones:\n“Frente a la petición de la Sociedad en que se mantenga el valor inicialmente presentado \npor HOCOL en la comunicación con radicado No. 20236200034212 del 25 de abril de 2023 \nen respuesta al Requerimiento 1 del Acta No. 94 del 23 de marzo de 2023, el cual asciende \na DOSCIENTOS NOVENTA Y SEIS MILLONES TRESCIENTOS SETENTA Y UN MIL \nCIENTO CINCUENTA Y SEIS PESOS MCTE ($296.371.156,oo), teniendo en cuenta las \ngestiones realizadas para el desarrollo de la inversión forzosa de no menos del 1%, \nrespecto a la visita a los predios, linderos, legalidad de los predios, determinándose las \ndificultades para la adquisición. Esta Autoridad Nacional mediante el concepto técnico 1692 \ndel 22 de marzo de 2024 [acogido mediante Resolución 942 del 22 de mayo de 2024], \nanalizó la totalidad de la información radicada en el expediente y se revisó el cronograma \naprobado para la línea de inversión del 1% correspondiente a la “Adquisición de predios y/o \nmejoras en zonas de páramo, bosques de niebla y áreas de influencia de nacimiento y \nrecarga de acuíferos, estrellas fluviales y rondas hídricas”: \nFigura 1. Cronograma para el desarrollo de la línea de inversión del 1% \ncorrespondiente a la compra de predios\nFuente: Radicado 2022277159-1-000 del 9 de diciembre de 2022\nEn línea con lo anterior, se analizó el informe de avance presentado mediante radicado \nANLA 20236200586652 del 8 de septiembre de 2023, donde en efecto se reportan las \nacciones realizadas, así como las conclusiones presentadas: \n(…)\n“IV - CONCLUSIONES: \nA manera de conclusión, se puede determinar entonces sin lugar a equívocos, con apoyo en \nel estudio de los títulos, las visitas de campo y las consultas realizadas a las distintas \nentidades, que las situaciones técnico jurídicas que padecen los predios objeto de estudio \nlos hacen inviables de cara a las necesidades de adquisición por parte de una compañía \ncomo HOCOL S.A., la cual debe contar con el lleno de los requisitos legales, sin vicios \naparentes y la debida diligencia que se propende en estos casos.”\nEn conclusión, los actos de compraventa se encuentran viciados por declaración de un valor \nmenor al real de la cosa, situación que se constituye en una limitante infranqueable para la \nadquisición de los inmuebles en el marco de las necesidades de cumplimiento de la \nobligación de inversión del 1% para el proyecto APE Tángara Norte. Lo anterior, toda vez \nque dichos inmuebles componen un riesgo de reclamación judicial por Lesión Enorme, \n\nResolución No. 002073       Del 20 SEP. 2024          Hoja No. 12 de 21\n“POR LA CUAL SE RESUELVE UN RECURSO DE REPOSICIÓN”\nPágina 12 de 21\nDeclaratoria de Nulidad de la Venta o solicitud de Restitución de Tierras, claro está, puesto \nque se logró evidenciar que los contratos de compraventa adolecen de defectos objetivos, \nsituación que opera de manera autónoma e independiente a las calidades o los actos de las \npartes contratantes; por lo que se evidencia la existencia de un desequilibrio sufrido al \ntransferir los fundos por valores inferiores a la mitad del justo precio de la cosa vendida.”\nAdicionalmente con el radicado 20236200586652 del 8 de septiembre de 2023 (Anexo 3) y \nen el ICA 11 (periodo 1 enero al 30 junio de 2023), se presenta un acta de reunión con el \npropietario del predio La Ilusión en donde HOCOL S.A reporta lo siguiente: \n“Luego del primer acercamiento realizado por la empresa en el mes de mayo con el \npropietario del predio La ilusión señor Roselino Fonseca, se realiza una nueva reunión el día \n14 de septiembre de 2023 con el fin hacer seguimiento y acompañamiento al proceso de \nsaneamiento predial, reunión en donde se tocaron principalmente los siguientes temas:\nTrámite de inclusión de cédula catastral en el Folio de Matrícula Inmobiliaria del predio \ndenominado La Ilusión (475-9729).\nContinuidad de saneamiento de las condiciones evidenciadas.\nContinuidad de Interés del señor Roselino Fonseca. \nEn el anexo 1 de este documento se presenta copia del acta suscrita son el señor Fonseca.\nA la fecha de este informe aún se continúa a la espera que sean subsanados algunos temas \nprediales por parte del propietario para continuar con el proceso de compra.”\nLo cual confirma que HOCOL S.A mantiene como alternativa de compra el predio La Ilusión, \nahora bien, con respecto a los predios Buenos Aires y Bella Vista no se informa si continúan \ncomo opción para la ejecución de la línea de inversión del 1% que, en el caso de ser factible \nse debe definir el procedimiento que se seguirá para resolver las inconsistencias que se \npresentan en los títulos de propiedad de estos predios.\nDe lo anterior y conforme con el cronograma de actividades vigente, para el primer semestre \ndel año 2023 debió culminarse el estudio de títulos, levantamiento topográfico, avalúo de \npredios y las demás actividades propuestas que, según lo planeado, se realizarían en \nparalelo, incluido los “Ajustes/aclaraciones de títulos, certificados y otros documentos \n(saneamiento predial, propietarios)”.\nPosteriormente, mediante radicado 20246200219062 del 28 de febrero de 2024, la \nSociedad presentó en el ICA 12 (Periodo del 1 julio al 31 diciembre de 2023), mediante el \ncual remitió el informe de avance del Plan de Inversión del 1% para el Área de Perforación \nExploratoria Tangara Norte, manifestando que a la fecha no se han ejecutado recursos a \ncargo del Plan de Inversión del 1%.\n\nResolución No. 002073       Del 20 SEP. 2024          Hoja No. 13 de 21\n“POR LA CUAL SE RESUELVE UN RECURSO DE REPOSICIÓN”\nPágina 13 de 21\nFuente: Radicado 20246200219062 del 28 de febrero de 2024\nConforme a lo anterior se verificó la información teniendo en cuenta que en la Resolución \n864 del 12 de mayo de 2020, modificada por la Resolución No. 1821 del 13 de noviembre \nde 2020, (ejecutoriada el 19 de noviembre de 2020), se aprobó el acogimiento al artículo \n321 de la Ley 1955 del 25 de mayo de 2019 con porcentaje incremental para el periodo \ncomprendido entre el 28 de diciembre de 2008 al 21 de enero de 2011, para el proyecto \n“Área de Perforación Exploratoria Tángara Norte”.\nDe acuerdo con lo anterior la Sociedad debió dar inicio al Plan de Inversión del 1% a más \ntardar el 20 de mayo de 2021, encontrándose que aun para la vigencia 2023, la Sociedad \nno presentó los soportes financieros de las actividades ejecutadas del cronograma del Plan \nde Inversión del 1% (estudio de títulos, levantamiento topográfico, ajustes / aclaraciones de \ntítulos), correspondientes al año 1 (periodo del 20 de mayo de 2021 al 19 de mayo de 2022), \nal respecto en el Artículo 321 de la Ley 1955 del 25 de mayo de 2019, precisa lo siguiente:\n“… En caso de no ejecutar las inversiones de acuerdo con el cronograma, por un tiempo \nsuperior a un año fiscal, deberán actualizar los valores no ejecutados, de acuerdo con la \nfórmula señalada en el parágrafo 1 del presente artículo…”\nPor lo cual, mediante el Requerimiento 1 del Acta de Oralidad 94 del 23 de marzo de 2023, \nesta Autoridad solicitó a HOCOL S.A. lo siguiente:\n“REQUERIMIENTOS PRODUCTO DEL SEGUIMIENTO\nPresentar con relación al plan de inversión forzosa de no menos del 1%, en un término no \nmayor a un (1) mes, lo siguiente:\na. La actualización de los valores que no fueron ejecutados de acuerdo con lo establecido \nen el cronograma del plan de inversión, conforme a lo establecido en la formula del parágrafo \nprimero del artículo 321 de la Ley 1955 del 25 de mayo de 2019.\nb. El ajuste a la proyección financiera de acuerdo con la actualización de los valores \npendientes de inversión de acuerdo con el cronograma, en cumplimiento de artículo 321 de \nla ley 1955 del 25 de mayo de 2019.”\n\nResolución No. 002073       Del 20 SEP. 2024          Hoja No. 14 de 21\n“POR LA CUAL SE RESUELVE UN RECURSO DE REPOSICIÓN”\nPágina 14 de 21\nDe lo anterior, HOCOL S.A., presentó mediante radicado 20236200034212 del 25 de abril \nde 2023, la actualización de los valores que no fueron ejecutados de acuerdo con lo \nestablecido en el cronograma del plan de inversión del 1%, sin embargo, no es conforme a \nlo establecido en la formula del parágrafo primero del artículo 321 de la Ley 1955 del 25 de \nmayo de 2019, ya que aplicó el índice correspondiente al año 2022 (126.03) [y] para el IPC \ninicial, la Sociedad aplicó el índice para el mes de mayo de 2022 (118.70), [Cuando lo \ncorrecto es] aplicar el índice correspondiente al mes de diciembre del año de la ejecución \nde la inversión que para este caso corresponde al año de 2021, cuyo índice corresponde a \n(111,41), tal como lo señala la formula del Parágrafo Primero del Artículo 321:\n“VBL = VIRa *(IPC actual/ IPC inicial), donde,\nVBL (Valor de la base de liquidación): es el valor en pesos (COP) de la base de liquidación \nde la inversión forzosa del 1% certificado de acuerdo con lo señalado en el parágrafo 3 del \npresente artículo, actualizada al mes de diciembre del año anterior a la fecha de presentación \nde la actualización.\nVIRa (Valor de la Inversión realizada para cada año): es el valor en pesos (COP) \ncorrespondiente a las inversiones realizadas del proyecto para cada año, durante su \nejecución.\nIPC actual: corresponde al último valor del IPC a diciembre del año anterior reportado por \nel DANE, en índice - serie de empalme, con respecto a la fecha de presentación del plan de \ninversiones actualizado ante la ANLA.\nIPC inicial: corresponde al valor del IPC reportado por el DANE, en índice - serie de \nempalme, para el año en el que se ejecutó la inversión o actividad del proyecto, tomando el \nque corresponda al mes de diciembre.” (Subrayado y en negrilla fuera de texto)\n \nPor lo anterior, esta Autoridad Nacional en el concepto técnico 1692 del 22 de marzo de \n2024 acogido mediante Resolución 942 del 22 de mayo de 2024 procedió a actualizar los \nvalores que no fueron ejecutados en el año 1, de acuerdo con el cronograma del plan de \ninversión, conforme a lo establecido en la formula del Parágrafo Primero del Artículo 321 \nde la Ley 1955 del 25 de mayo de 2019.\nFigura 4 Captura de pantalla actualización con Parágrafo Primero por no ejecución \ndel Plan de Inversión del 1%\nFuente: Construcción propia equipo evaluador ANLA.\n\nResolución No. 002073       Del 20 SEP. 2024          Hoja No. 15 de 21\n“POR LA CUAL SE RESUELVE UN RECURSO DE REPOSICIÓN”\nPágina 15 de 21\nEstableciéndose el incremento de los valores no ejecutados del Plan de inversión del 1% \npor la suma de TREINTA Y SEIS MILLLONES SEISCIENTOS VEINTINUEVE MIL \nNOVECIENTOS QUINCE PESOS MCTE. ($36.629.915), con corte al 31 de diciembre de \n2022.\nAhora bien, en relación al argumento que HOCOL, “ha venido ejecutando desde el año 2021, \nlas actividades previas a la adquisición de las áreas, sin embargo, por cuestiones ajenas a la \nCompañía no ha podido materializar su compra en los tiempos estimados inicialmente”, es \nimportante mencionar que esta Autoridad Nacional ha identificado en los seguimientos las \nacciones e informes presentados, sin embargo en el cronograma aprobado con el \nacogimiento no se identifica en el año 1 un periodo de alistamiento o gestión previa sin \nvalores a ejecutar, por el contrario se presenta en el año 1 para ejecutar un valor de \n$279.133.986, como se presenta a continuación:\nDe lo anterior, fue necesario requerir la actualización de los valores no ejecutados mediante \nel Requerimiento 1 (Producto del Seguimiento) del Acta 94 del 23 de marzo de 2023, que \ncomo se indicó en apartes anteriores fue presentado por la sociedad con el IPC del mes de \nmayo de 2022, diferente al que se debió aplicar de acuerdo con la formula del parágrafo \nprimero del artículo 321 de la Ley 1955 del 25 de mayo de 2019, que corresponde al mes \nde diciembre de 2021.\nAhora bien, respecto a reconocer que HOCOL S.A. ha realizado una inversión forzosa de \nno menos del 1% correspondiente a la suma de CERO PESOS M/C (COP$0), no es \nprocedente dicha solicitud ya que la actualización obedece a la NO EJECUCION de los \nvalores correspondiente a las actividades a realizar en el cronograma del plan de inversión \ndel año 1, tal como lo establece el artículo 321 de la Ley 1955 del 25 de mayo de 2019.\nSobre los valores pendientes por ejecutar que señala en la solicitud, se precisa que estos \nvalores no corresponden ya que el IPC aplicado por HOCOL S.A. fue del mes de mayo de \n2022 y la norma señala que se debe aplicar el mes de diciembre del año de ejecución, como \nfue analizado y considerado en el concepto técnico 1692 del 22 de marzo de 2024, acogido \ncon la Resolución objeto de recurso.\n\nResolución No. 002073       Del 20 SEP. 2024          Hoja No. 16 de 21\n“POR LA CUAL SE RESUELVE UN RECURSO DE REPOSICIÓN”\nPágina 16 de 21\nPor lo anterior se CONFIRMA, lo dispuesto en el artículo primero de la Resolución 942 del \n22 de mayo de 2024.”\n(…)”\nAdicional a las consideraciones presentadas por el Concepto técnico 6383 del 29 \nde agosto de 2024, en relación con la presunta vulneración del principio de “nadie \nestá obligado a lo imposible” fundando su argumento en que “debe reconocerse la \nfuerza mayor basado en la imposibilidad de objeto”, la Autoridad Nacional precisa \nlo siguiente:\nLa Honorable Corte Constitucional en Sentencia T-271 de 2016 ha sostenido que:\n“Las figuras jurídicas de la fuerza mayor y el caso fortuito (...) está regulada por el \nartículo 64 del Código Civil (subrogado por el artículo 1º de la ley 95 de 1890) el cual \ndispone que: “[s]e llama fuerza mayor o caso fortuito, el imprevisto a que no es posible \nresistir, como un naufragio, un terremoto, el apresamiento de enemigos, los autos de \nautoridad ejercidos por un funcionario público. etc.”. Esta causal, por tanto, requiere para \nobrar como justificación reunir un conjunto de características, las cuales son \nbásicamente: “(i) que el hecho sea irresistible; (ii) que sea imprevisible y (iii) que sea externo \nrespecto del obligado””.\nEn tal sentido, dado que la carga de la prueba de fuerza mayor exige que quien la \nalega, debe probar cada uno de sus elementos, basta con que uno no esté \ndebidamente demostrado, para que la fuerza mayor no opere como eximente de \nresponsabilidad.\nDe acuerdo con estas breves consideraciones está claro que, si bien la sociedad \ninvocó dicho argumento, no presentó prueba alguna que permita acreditar la \nexistencia de eventos de fuerza mayor que imposibiliten el cumplimiento de las \nobligaciones establecidas en el marco de la Licencia Ambiental.\nPor lo anterior, la Autoridad Nacional confirmará la disposición contenida en el \nartículo primero de la Resolución 942 del 22 de mayo de 2024, tal como se señalará \nen la parte resolutiva del presente acto administrativo.\n2. OBLIGACIÓN RECURRIDA - ARTÍCULO SEGUNDO\n“ARTÍCULO SEGUNDO. Requerir a la sociedad HOCOL S.A, para que en un término de \nun (1) mes, contados a partir de la ejecutoria del presente acto administrativo, presente la \nproyección financiera actualizada de la inversión forzosa de no menos del 1%, de acuerdo \ncon el valor por ejecutar que asciende a la suma de NOVECINETOS SESENTA Y SIETE \nMILLONES SETENA Y SEIS MIL QUINIENTOS TREINTA Y TRES PESOS CON \nCUARENTA Y UN CENTAVOS MCTE. ($967.076.533,41).”\n\nResolución No. 002073       Del 20 SEP. 2024          Hoja No. 17 de 21\n“POR LA CUAL SE RESUELVE UN RECURSO DE REPOSICIÓN”\nPágina 17 de 21\n2.1.Petición de la sociedad\n“Revocar el Artículo Segundo de la Resolución 0942 de mayo 22 de 2024, respecto a la \nproyección financiera.”\n2.2.Argumentos de la sociedad\nMediante comunicación con radicación 20246200643482 del 6 de junio de 2024, la \nSociedad presentó los siguientes argumentos:\n“6.2.3. Respecto al Articulo Segundo. De la Proyección Financiera.\n6.2.3.1. Teniendo en cuenta que para la elaboración de la proyección financiera de la \ninversión forzosa de no menos del 1% se deben tener claros los valores por ejecutar \nasociados al proyecto, que fueron descritos en el Artículo 1 de la Resolución 0942 de 2024, \ny que fueron recurridos por las causales expuestas en el numeral anterior, se solicita que \nel termino estipulado por la ANLA, sólo sea aplicable hasta que se aclare de fondo el recurso \nde reposición solicitado frente a el artículo 1 de la Resolución 0942 de 2024, toda vez que, \nsin este insumo no es posible la elaboración de la proyección financiera actualizada por \nparte de la Compañía.”\n2.3.Consideraciones de la Autoridad Nacional\nLos argumentos de inconformidad presentados por el recurrente fueron objeto de \nevaluación por el equipo técnico de la Autoridad Nacional y mediante Concepto \ntécnico 6383 del 29 de agosto de 2024, se presentaron las siguientes \nconsideraciones:\n“El artículo segundo de la Resolución 942 del 22 de mayo de 2024 está directamente \nrelacionado con el pronunciamiento del artículo primero, toda vez que se solicita la \nproyección financiera de los valores pendientes por ejecutar, que para el presente caso \nascienden a $967.076.533,41.\nComo se consideró anteriormente, este valor es el resultado de la actualización de los \nvalores no ejecutados correspondientes al año 1, ejercicio que HOCOL S.A presentó en el \nradicado 20236200034212 del 25 de abril de 2023 arrojando un valor de $ 947.683.788,89, \nsin embargo, como se explicó en el numeral 1.3 del presente [Acto administrativo], la \nSociedad cometió un error al no aplicar el IPC inicial correspondiente al 31 de diciembre de \n2021, sino el IPC del mes de mayo de 2022, por lo cual esta Autoridad procedió a realizar \nla verificación de la actualización de acuerdo al Parágrafo Primero del artículo 321 de la Ley \n1955 del 25 de mayo de 2019, aplicando el IPC a diciembre 31 de 2021 (111,41), \nobteniéndose así un valor pendiente por ejecutar del Plan de Inversión del 1% de \nNOVECIENTOS SESENTA Y SIETE MILLONES SETENTA Y SEIS MIL QUINIENTOS \nTREINTA Y TRES PESOS CON CUARENTA Y UN CENTAVOS MCTE. ($967.076.533,41).\nEn consecuencia, la Sociedad debe ajustar la proyección financiera de acuerdo con el valor \npor ejecutar establecido por esta Autoridad que asciende a la suma de $967.076.533,41.\n\nResolución No. 002073       Del 20 SEP. 2024          Hoja No. 18 de 21\n“POR LA CUAL SE RESUELVE UN RECURSO DE REPOSICIÓN”\nPágina 18 de 21\nPor lo anterior, se CONFIRMA el artículo segundo de la Resolución 942 del 22 de mayo de \n2024.\n(…)”\nSumado a las consideraciones del Concepto técnico 6383 del 29 de agosto de 2024 \ny, en contravía con los argumentos jurídicos expuestos por el recurrente en el \nrecurso de reposición presentado mediante comunicación con radicación \n20246200643482 del 6 de junio de 2024 especialmente los relacionados con \nindebida motivación del acto administrativo objeto de recurso, ninguna autoridad del Estado \npodrá ejercer funciones distintas de las que le atribuyen la Constitución y la Ley, entre \notras, conviene precisar que las funciones y competencia de la Autoridad Nacional \nse encuentran consagradas en el Decreto 3573 de 2011 compilado en el Decreto \n1076 de 26 de mayo de 2015 ( Decreto Único Reglamentario del Sector Ambiente y \nDesarrollo Sostenible), según el cual “La Autoridad Nacional de Licencias Ambientales \n-ANLA- es la encargada de que los proyectos, obras o actividades sujetos de \nlicenciamiento, permiso o trámite ambiental cumplan con la normativa ambiental, de tal \nmanera que contribuyan al desarrollo sostenible ambiental del País.”\nAsí mismo, el citado Decreto, en su artículo 2.2.2.3.9.1, estableció el deber de la \nautoridad nacional de realizar control y seguimiento a los proyectos, obras o \nactividades sujetos a licencia ambiental o plan de manejo ambiental, durante su \nconstrucción, operación, desmantelamiento o abandono, y en el desarrollo de dicha \ngestión, la potestad de realizar entre otras actividades, visitas al lugar donde se \ndesarrolla el proyecto, requerimientos, imponer obligaciones ambientales, \ncorroborar técnicamente o a través de pruebas los resultados de los monitoreos \nrealizados por el beneficiario de la licencia ambiental o plan de manejo ambiental.\nEste seguimiento que realiza la Autoridad Nacional se fundamenta en la verificación \nal cumplimiento no solo de las obligaciones previamente establecidas en el marco \nde la Licencia Ambiental, sino también de la normativa ambiental del país.\nProducto de este seguimiento, se expide un concepto técnico que sirve de \nfundamento para la toma de decisiones.\nAsí las cosas, para el caso en concreto, se indica que la motivación de la Resolución \n942 del 22 de mayo de 2024 se encuentra soportada jurídicamente (acorde con las \nobligaciones y requerimientos establecidos por la Autoridad Nacional y por la \nlegislación ambiental), pero la decisión objeto de recurso, también se encuentra \nfundamentada técnicamente tal como se evidencia en el Concepto técnico 1692 del \n22 de marzo de 2024 el cual sirvió de insumo para la toma de decisiones.\nPor lo anterior, es claro que la decisión objeto de recurso, no solo se encuentra \ndebidamente fundamentada, sino que también fue expedida en el marco de las \nfunciones y competencias atribuidas a la Autoridad Nacional.\n\nResolución No. 002073       Del 20 SEP. 2024          Hoja No. 19 de 21\n“POR LA CUAL SE RESUELVE UN RECURSO DE REPOSICIÓN”\nPágina 19 de 21\nEn suma, no son admisibles los argumentos expuestos por el recurrente y; por lo \ntanto, la Autoridad Nacional confirmará el requerimiento contenido en el artículo \nsegundo de la Resolución 942 del 22 de mayo de 2024, tal como se señalará en la \nparte resolutiva del presente acto administrativo.\nEn mérito de lo expuesto,\nRESUELVE\nARTÍCULO PRIMERO. Confirmar el artículo primero de la Resolución 942 del 22 \nde mayo de 2024, de conformidad con lo expuesto en la parte motiva del presente \nacto administrativo.\nARTÍCULO SEGUNDO. Confirmar el artículo segundo de la Resolución 942 del 22 \nde mayo de 2024, de conformidad con lo expuesto en la parte motiva del presente \nacto administrativo.\nARTÍCULO TERCERO. Notificar el presente acto administrativo al representante \nlegal, o al apoderado debidamente constituido o a la persona debidamente \nautorizada por la Sociedad HOCOL S.A., o a quien haga sus veces de conformidad \ncon lo dispuesto en los artículos 67 y siguientes de la Ley 1437 de 2011.\nPARÁGRAFO. En el suceso en que el titular de la licencia o el permiso, entre en \nproceso de disolución o régimen de insolvencia empresarial o liquidación regulados \npor las normas vigentes, informará inmediatamente de esta situación a la Autoridad \nNacional, con fundamento, entre otros, en los artículos 8, 58, 79, 80, 81, 95 numeral \n8 de la Constitución Política de 1991, en la Ley 43 de 1990, en la Ley 222 de 1995, \nen la Ley 1333 de 2009 modificada por la Ley 2387 del 25 de julio de 2024 y demás \nnormas vigentes y jurisprudencia aplicable.\nAdicional a la obligación de informar a la Autoridad Nacional de tal situación, el titular \nde la licencia o permiso aprovisionará contablemente las obligaciones contingentes \nque se deriven de la existencia de un procedimiento ambiental sancionatorio \nconforme con el artículo 40 de la Ley 1333 de 2009 modificada por la Ley 2387 del \n25 de julio de 2024 o la norma que la adicione, modifique o derogue.\nARTÍCULO CUARTO. Comunicar el presente acto administrativo a la Corporación \nAutónoma Regional de la Orinoquía – CORPORINOQUIA.\nARTÍCULO QUINTO. Publicar la presente Resolución en la Gaceta Ambiental de la \nAutoridad Nacional de Licencias Ambientales - ANLA, de conformidad con lo \nseñalado en el artículo 71 de la Ley 99 de 1993.\n\nResolución No. 002073       Del 20 SEP. 2024          Hoja No. 20 de 21\n“POR LA CUAL SE RESUELVE UN RECURSO DE REPOSICIÓN”\nPágina 20 de 21\nARTÍCULO SEXTO. Contra el presente acto administrativo no procede recurso \nalguno de conformidad con lo establecido en el artículo 87 del Código de \nProcedimiento Administrativo y de lo Contencioso Administrativo.\nNOTIFÍQUESE, COMUNÍQUESE, PUBLÍQUESE Y CÚMPLASE\nDado en Bogotá D.C., a los 20 SEP. 2024\nEDILBERTO PENARANDA CORREA\nASESOR\nIBLER ANDERSON MOLANO RINCON\nCONTRATISTA\nANDREA DEL PILAR SANABRIA DEL RIO\nCONTRATISTA\nExpediente No. LAM4182\nConcepto técnico 6383 del 29 de agosto de 2024\nFecha: 5 de septiembre de 2024\nProceso No.: 20241000020734\nNota: Este es un documento electrónico generado desde los Sistemas de Información de la ANLA. El original reposa en los \narchivos digitales de la Entidad\n\nResolución No. 002073       Del 20 SEP. 2024          Hoja No. 21 de 21\n“POR LA CUAL SE RESUELVE UN RECURSO DE REPOSICIÓN”\nPágina 21 de 21\n"
}