{
  "fuente": "ANLA_GACETA",
  "numero_resolución": "RESOLUCIÓN N° 000802",
  "fecha_resolución": "1993-12-22",
  "nombre_proyecto": "“Ampliación Poliducto Pozos Colorados- Ayacucho\" ubicado en jurisdicción de los Municipios de Santa Marta, Ciénaga, Zona",
  "nombre_proyecto_normalizada": "\"ampliacion poliducto pozos colorados- ayacucho\" ubicado en jurisdiccion de los municipios de santa marta, cienaga, zona",
  "ubicación": "el Municipio de Valledupar del Departamento del Cesar, entre otras disposiciones",
  "ubicacion_normalizada": "el municipio de valledupar del departamento del cesar, entre otras disposiciones",
  "empresa": "Colombiana de Petróleos ECOPETROL viabilidad ambiental para el proyecto “Ampliación Poliducto Pozos Colorados- Ayacucho\" ubicado en jurisdicción de los Municipios de Santa Marta",
  "empresa_normalizada": "colombiana de petroleos ecopetrol viabilidad ambiental para el proyecto \"ampliacion poliducto pozos colorados- ayacucho\" ubicado en jurisdiccion de los municipios de santa marta",
  "numero_expediente": "LAM0832",
  "radicados": [
    "20236201061902",
    "20236200378342",
    "2022252085",
    "20246200033422",
    "20246200264842",
    "20236200050792",
    "2022297415",
    "2022263125",
    "20244700052081"
  ],
  "descripcion": "POR LA CUAL SE RESUELVE UN RECURSO DE REPOSICIÓN",
  "tipos_infraccion": [
    "Tala o afectación de bosques",
    "Incumplimiento del PMA"
  ],
  "tipos_infraccion_normalizada": [
    "tala o afectacion de bosques",
    "incumplimiento del pma"
  ],
  "pdf_id": "46259",
  "file_name": "ANLA_46259.pdf",
  "texto_completo": "República de Colombia\nMinisterio de Ambiente y Desarrollo Sostenible\nAUTORIDAD NACIONAL DE LICENCIAS \nAMBIENTALES\n- ANLA –\nRESOLUCIÓN N° 000802\n(07 MAY. 2024)\nPágina 1 de 56\n“POR LA CUAL SE RESUELVE UN RECURSO DE REPOSICIÓN”\nEL ASESOR DEL DESPACHO DEL DIRECTOR DE LA AUTORIDAD NACIONAL DE \nLICENCIAS AMBIENTALES – ANLA\nEn ejercicio de las facultades legales establecidas mediante la Ley 99 del 22 de diciembre \nde 1993, el Decreto Ley 3573 del 27 de septiembre de 2011, modificado por el Decreto \n376 del 11 de marzo de 2020, por el cual se modifica la estructura de la Autoridad \nNacional de Licencias Ambientales y acorde con lo regulado en el Decreto 1076 del 26 de \nmayo de 2015, la Resolución 669 del 14 de abril de 2020, la Resolución 1957 del 5 de \nnoviembre de 2021, y la Resolución 2795 del 25 de noviembre de 2022, expedidas por la \nAutoridad Nacional de Licencias Ambientales,\nCONSIDERANDO:\nQue a través de la Resolución 414 del 17 de mayo de 1991, el Instituto Nacional de los \nRecursos Naturales (INDERENA), otorgó a la Sociedad Colombiana de Petróleos \nECOPETROL viabilidad ambiental para el proyecto “Ampliación Poliducto Pozos Colorados-\nAyacucho\" ubicado en jurisdicción de los Municipios de Santa Marta, Ciénaga, Zona \nBananera, Aracataca, Fundación y Algarrobo en el Departamento del Magdalena y El \nCopey, Bosconia, El Paso, Chiriguaná, Chimichagua, Curumaní, Pailitas, Tamalameque, \nPelaya y La Gloria en el Departamento del Cesar.\nQue a través de la Resolución 527 del 3 de diciembre de 1994, el entonces Ministerio del \nMedio Ambiente, hoy Ministerio de Ambiente y Desarrollo Sostenible (En adelante el \nMinisterio) otorgó Licencia Ambiental ordinaria a la Sociedad Colombiana de Petróleos \nECOPETROL, para la reposición de líneas y variantes de los sectores Pelaya, Aguachica y \nCanoas en el Departamento del Cesar. \nQue mediante Resolución 1800 del 21 de septiembre de 2009, el Ministerio modificó la \nLicencia Ambiental ordinaria otorgada mediante la Resolución 527 del 3 de diciembre de \n1994, para la reposición de líneas y variantes de los sectores Pelaya, Aguachica y Canoas, \nen jurisdicción del Departamento del Cesar, y que hacen parte del proyecto “Poliducto Pozos \nColorados – Ayacucho”, en el sentido de autorizar actividades adicionales. \n\nResolución No. 000802       Del 07 MAY. 2024          Hoja No. 2 de 56\n“POR LA CUAL SE RESUELVE UN RECURSO DE REPOSICIÓN”\nPágina 2 de 56\nQue mediante Resolución 230 del 4 de febrero de 2010, el Ministerio aclaró la Resolución \n1800 del 21 de septiembre de 2009, en lo referente al objetivo del proyecto consiste en la \nreposición de 119 km de la tubería de la línea del poliducto Estación Pozos Colorados – \nAyacucho, específicamente en (4) tramos, así Tramo 3 (K14+000-K84+000), Tramo 5 \n(K106+000-K116+000), tramo 7 (K125-K153) y Tramo 8 (K153+000-K164+000) para \nreemplazar la tubería con deterioro avanzado por corrosión, homogenizar el diámetro de \ntoda la tubería a 14 pulgadas y efectuar realineamientos.\nQue mediante Resolución 1547 del 9 de agosto de 2010, el Ministerio aclaró el artículo \nprimero de la Resolución 1800 del 21 de septiembre de 2009, por la cual se modificó la \nResolución 527 del 3 de diciembre de 1994, señalando que, el acto administrativo \nmodificado mediante la Resolución1800 de 2009, fue la Resolución 414 de mayo 17 de \n1991 por la cual se otorgó Viabilidad Ambiental para el proyecto “Poliducto Pozos Colorados \n– Ayacucho”. \nQue mediante Resolución 25 del 13 de enero de 2011, el Ministerio negó la solicitud de \nrevocatoria directa de la Resolución 230 del 4 de febrero de 2010.\nQue mediante Resolución 1693 del 19 de agosto de 2011, el Ministerio modificó la \nResolución 1547 de agosto 9 de 2010, en el sentido de incluir los tramos k2+000 a k5+000 \ny Pk195+700 a Pk200+745, entre otras disposiciones. \nQue mediante Resolución 417 del 5 de mayo de 2014, la Autoridad Nacional de Licencias \nAmbientales (En adelante la Autoridad Nacional), modificó la Resolución 1800 del 21 de \nseptiembre de 2009.\nQue mediante Resolución 503 del 21 de mayo de 2014, la Autoridad Nacional autorizó la \ncesión total de los derechos y obligaciones originados y derivados de la viabilidad ambiental \notorgada por la Resolución 414 de 17 de mayo de 1991 y de la licencia otorgada mediante \nla Resolución 527 de 3 de diciembre de 1994, de la Sociedad ECOPETROL S.A. a favor de \nla Sociedad CENIT TRANSPORTE Y LOGÍSTICA DE HIDROCARBUROS S.A.S. (En \nadelante la Sociedad).\nQue mediante Resolución 941 del 11 de agosto de 2017, la Autoridad Nacional establece \nel Plan de Manejo Ambiental para el proyecto “Sistema de Transporte de Hidrocarburos Pozos \nColorados – Galán”.\nQue a través de la Resolución 2049 del 15 de noviembre de 2018, la Autoridad Nacional \nmodificó la Resolución 527 del 3 de diciembre de 1994, en el sentido de establecer como \nlínea general de la obligación de inversión forzosa de no menos del 1% la denominada \n“Acciones de protección, conservación y preservación a través de restauración ecológica, \nrehabilitación y recuperación”, de conformidad con lo establecido en el literal a) del numeral 1  \ndel artículo 2.2.9.3.1.9, del Decreto 2099 del 22 de diciembre de 2016, modificado por el \nDecreto 75 del 20 de enero 2017 y el Decreto 1120 del 29 de junio 2017. \nQue mediante Resolución 933 del 30 de mayo de 2019, la Autoridad Nacional resolvió el \nrecurso de reposición interpuesto por la Sociedad contra la Resolución 2049 del 15 de \nnoviembre de 2018, en el sentido de confirmar la decisión.\nQue mediante Resolución 1582 del 25 de julio de 2022, la Autoridad Nacional modificó el \nartículo primero de la Resolución 2049 del 15 de noviembre de 2018, en el sentido aprobar \nel acogimiento al porcentaje incremental de la base de liquidación de la inversión forzosa \n\nResolución No. 000802       Del 07 MAY. 2024          Hoja No. 3 de 56\n“POR LA CUAL SE RESUELVE UN RECURSO DE REPOSICIÓN”\nPágina 3 de 56\nde no menos del 1%, de conformidad con lo señalado en el artículo 321 de la Ley 1955 del \n25 de mayo del 2019. \nQue mediante Resolución 2813 del 29 de noviembre de 2022, la Autoridad Nacional aprobó \nel Plan de compensación del proyecto “Sistema de transporte de hidrocarburos Pozos Colorados \n– Ayacucho - Galán” en el Banco de Hábitat del Bosque seco Tropical del Cesar “La Lope” \nubicado en el Municipio de Valledupar del Departamento del Cesar, entre otras \ndisposiciones. \nQue mediante la Resolución 3050 del 21 de diciembre de 2023, la Autoridad Nacional, \ndecidió no aceptar a la Sociedad CENIT TRANSPORTE Y LOGÍSTICA DE \nHIDROCARBUROS S.A.S. el plan de inversión forzosa de no menos del 1%, presentado \nmediante comunicaciones con radicación 2022252085-1-000 del 9 de noviembre de 2022 \ny 20236200378342 del 21 de julio de 2023, referente a las actividades de preservación y \nrestauración en el área de 40,38 ha dentro del Banco de Hábitat Bosque Seco Tropical del \nCesar “La Lope”, entre otras disposiciones; la cual fue debidamente notificada a la Sociedad \nel 22 de diciembre de 2023, por correo electrónico.\nQue mediante comunicación con radicación 20246200033422 del 10 de enero de 2024, la \nSociedad, interpuso recurso de reposición en contra de la Resolución 3050 del 21 de \ndiciembre de 2023; argumentos que fueron evaluados por el equipo técnico de la Autoridad \nNacional y en consecuencia se expidió el Concepto Técnico 1787 del 27 de marzo de 2024.\nQue posteriormente, mediante comunicación con radicación 20246200264842 del 8 de \nmarzo de 2024, la Sociedad Terrasos S.A.S, aludiendo su interés directo en las decisiones \nadoptadas en la Resolución 3050 del 21 de diciembre de 2023, con fundamento en el \nartículo 38 del CPACA, allega comunicación del 12 de febrero de 2024 para que sea \nvalorado como prueba sobreviniente dentro del procedimiento administrativo que resuelva \nel recurso de reposición instaurado por la Sociedad CENIT TRANSPORTE Y LOGÍSTICA \nDE HIDROCARBUROS S.A.S. mediante comunicación con radicación 20246200033422 \ndel 10 de enero de 2024.\nCOMPETENCIA DE LA AUTORIDAD NACIONAL \nEl Gobierno Nacional, mediante Decreto Ley 3573 del 27 de septiembre de 2011, creó la \nAutoridad Nacional de Licencias Ambientales (ANLA), como una entidad con autonomía \nadministrativa y financiera, sin personería jurídica, la cual hace parte del Sector \nAdministrativo de Ambiente y Desarrollo Sostenible, en los términos del artículo 67 de la \nLey 489 de 1998.\nEl numeral 1° del artículo tercero del mencionado decreto estableció dentro de las funciones \nde la Autoridad Nacional, la de otorgar o negar las licencias, permisos y trámites \nambientales de competencia del Ministerio, de conformidad con la ley y los reglamentos.\nMediante el Decreto 376 del 11 de marzo de 2020, se modificó la estructura de la Autoridad \nNacional de Licencias Ambientales.\nMediante la Resolución 669 del 14 de abril de 2020, se nombró como servidor público a \nEDILBERTO PEÑARANDA CORREA, identificado con cédula de ciudadanía 4.052.851, en \nel empleo de libre nombramiento y remoción de Asesor, código 1020, grado 15, adscrito a \nla Dirección General de la planta global de la ANLA.\n\nResolución No. 000802       Del 07 MAY. 2024          Hoja No. 4 de 56\n“POR LA CUAL SE RESUELVE UN RECURSO DE REPOSICIÓN”\nPágina 4 de 56\nEl 5 de noviembre de 2021, la Autoridad Nacional emitió la Resolución 1957 “Por la cual se \nadopta el Manual Específico de Funciones y de Competencias Laborales para los empleos \nde la planta de personal de la Autoridad Nacional de Licencias Ambientales - ANLA”, en \ndonde se establece que corresponde al Despacho del Director General de la Autoridad \nNacional de Licencias Ambientales - ANLA, “Suscribir los actos administrativos que otorgan, \nniegan, modifican, ajustan o declaran la terminación de las licencias, permisos y trámites \nambientales”. \nEn ejercicio de las facultades conferidas por la Ley 489 de 1998, se expidió la Resolución \n2795 del 25 de noviembre de 2022, -“Por la cual se delegan unas funciones y se dictan \notras disposiciones”-, que en el numeral 15 del artículo primero se delegó en el Asesor \nCódigo 1020 Grado 15 del Despacho del Director General, entre otras, la función de resolver \nlos recursos de reposición interpuestos contra los actos administrativos que emitan en \ncumplimiento de las funciones delegadas. \nTeniendo en cuenta lo anterior, es el Asesor del Despacho del Director General de la \nAutoridad Nacional el competente para pronunciarse sobre el recurso de reposición \ninterpuesto por la Sociedad en contra de Resolución 3050 del 21 de diciembre de 2023.\nFUNDAMENTOS JURÍDICOS\nEl procedimiento para la presentación y Resolución de recursos contra los actos \nadministrativos se encuentra reglado en el Código de Procedimiento Administrativo y de lo \nContencioso Administrativo artículos 74 y siguientes, que particularmente respecto del \nrecurso de reposición al tenor literal expresan:\n“Artículo 74. Recursos contra los actos administrativos.\nPor regla general, contra los actos definitivos procederán los siguientes recursos: \n1. El de reposición, ante quien expidió la decisión para que la aclare, modifique, adicione o \nrevoque (…)”\nA su vez, los artículos 76 y 77 del Código enunciado preceptúan: \n“Artículo 76. Oportunidad y presentación.\nLos recursos de reposición y apelación deberán interponerse por escrito en la diligencia de \nnotificación personal, o dentro de los diez (10) días siguientes a ella, o a la notificación por aviso, \no al vencimiento del término de publicación, según el caso. Los recursos contra los actos \npresuntos podrán interponerse en cualquier tiempo, salvo en el evento en que se haya acudido \nante el juez. \nLos recursos se presentarán ante el funcionario que dictó la decisión, salvo lo dispuesto para el \nde queja, y si quien fuere competente no quisiere recibirlos podrán presentarse ante el procurador \nregional o ante el personero municipal, para que ordene recibirlos y tramitarlos, e imponga las \nsanciones correspondientes, si a ello hubiere lugar. \nEl recurso de apelación podrá interponerse directamente, o como subsidiario del de reposición y \ncuando proceda será obligatorio para acceder a la jurisdicción. \nLos recursos de reposición y de queja no serán obligatorios.\nArtículo 77. Requisitos.\n\nResolución No. 000802       Del 07 MAY. 2024          Hoja No. 5 de 56\n“POR LA CUAL SE RESUELVE UN RECURSO DE REPOSICIÓN”\nPágina 5 de 56\nPor regla general los recursos se interpondrán por escrito que no requiere de presentación \npersonal si quien lo presenta ha sido reconocido en la actuación. Igualmente, podrán presentarse \npor medios electrónicos. \nLos recursos deberán reunir, además, los siguientes requisitos: \n1. Interponerse dentro del plazo legal, por el interesado o su representante o apoderado \ndebidamente constituido. \n2. Sustentarse con expresión concreta de los motivos de inconformidad.\n3. Solicitar y aportar las pruebas que se pretende hacer valer. \n4. Indicar el nombre y la dirección del recurrente, así como la dirección electrónica si desea ser \nnotificado por este medio. \nSólo los abogados en ejercicio podrán ser apoderados (…)\nA su vez, el artículo 80 del citado Código, establece el alcance del contenido de la decisión \nque resuelve el recurso:\n“Artículo 80. Decisión de los recursos. -Vencido el período probatorio, si a ello hubiere lugar, y \nsin necesidad de acto que así lo declare, deberá proferirse la decisión motivada que resuelva el \nrecurso. \nLa decisión resolverá todas las peticiones que hayan sido oportunamente planteadas y las que \nsurjan con motivo del recurso.\nCONSIDERACIONES DE LA AUTORIDAD NACIONAL FRENTE AL RECURSO DE \nREPOSICIÓN INTERPUESTO POR LA SOCIEDAD \nDesde el punto de vista procedimental, se observa que el Recurso de Reposición \ninterpuesto por la Sociedad en contra de la Resolución 3050 del 21 de diciembre de 2023, \ncumple con los requisitos establecidos en el artículo 77 y concordantes del Código de \nProcedimiento Administrativo y de lo Contencioso Administrativo, en cuanto a lo siguiente: \n1.\nInterponerse dentro del plazo legal, por el interesado o su representante o apoderado \ndebidamente constituido.\nSe encuentra acreditado que el día 22 de diciembre de 2023, la Sociedad fue debidamente \nnotificada mediante correo electrónico de la Resolución 3050 del 21 de diciembre de 2023, \nfrente a la cual interpuso recurso de reposición por intermedio de apoderado judicial el día \n10 de enero de 2024, radicado en la Autoridad Nacional bajo el número 20246200033422, \nesto es, dentro de los diez (10) días siguientes a la notificación, de conformidad con lo \npreceptuado en el artículo 76 de la Ley 1437 de 2011.\n2.\nSustentarse con expresión concreta de los motivos de inconformidad. \nLa Sociedad presentó los argumentos en contra de la disposición recurrida de la Resolución \n3050 del 21 de diciembre de 2023, los cuales serán tenidos en cuenta para decidir el \npresente recurso de reposición.\n3.\nSolicitar y aportar las pruebas que se pretende hacer valer.\nLa Sociedad aportó, junto con el recurso de reposición las siguientes pruebas \ndocumentales:\n\nResolución No. 000802       Del 07 MAY. 2024          Hoja No. 6 de 56\n“POR LA CUAL SE RESUELVE UN RECURSO DE REPOSICIÓN”\nPágina 6 de 56\nAnexo 1 Oficio registro BHC BST La Lope (Rad.2101-2-3384 del 7 de octubre de 2021)\nAnexo 2. Reporte de contabilidad oficial de cupos de biodiversidad a la Autoridad Nacional \n(Radicado 20236201061902 del 28 de diciembre de 2023)\nAnexo 3. Asignación de cupos CENIT-BHC- La Lope (Radicado 2023E1022188 del 19 de mayo \nde 2023).\nAnexo 4. Rta a requerimientos Art 3 - Res. 2813 del 29-11-22 (Rad. 2022297415-1-000 del 30-\n12-22) \nAnexo 5. Rta a requerimientos Art 4 - Res. 2813del 29-11-2022 (Rad. 20236200213162 del 09-\n06-23) \nAnexo 6. ICA 20 - 2023 (Rad.20236200050792 del 28-04-2023)\n4.\nIndicar el nombre y la dirección del recurrente, así como la dirección electrónica si desea \nser notificado por este medio.\nLa Sociedad manifestó que, para efectos de la notificación dentro del presente expediente, \nlas recibiría en el correo electrónico notificacionesambientales@cenir-transporte.com  y \njose.duque@cenir-transporte.com\nCon base en lo anterior, verificado el cumplimiento de los requisitos establecidos en el \nCódigo de Procedimiento Administrativo y de lo Contencioso Administrativo -CPACA-, \nrespecto a la procedencia del señalado recurso de reposición, la Autoridad Nacional \nprocederá a resolverlo, teniendo en cuenta las consideraciones realizadas en el Concepto \nTécnico 1787 del 27 de marzo de 2024; en el mismo orden de los argumentos presentados \npor la Sociedad, a saber:\n1.\nDISPOSICIÓN RECURRIDA – ARTÍCULO PRIMERO DE LA RESOLUCIÓN 3050 \nDEL 21 DE DICIEMBRE DE 2024. \n“(…)”\n“ARTÍCULO PRIMERO. No aceptar a la Sociedad CENIT TRANSPORTE Y LOGÍSTICA DE \nHIDROCARBUROS S.A.S. el plan de inversión forzosa de no menos del 1% presentado \nmediante comunicaciones con radicación 2022252085-1-000 del 9 de noviembre de 2022 y \n20236200378342 del 21 de julio de 2023, referente a las actividades de preservación y \nrestauración en el área de 40,38 ha dentro del Banco de Hábitat Bosque Seco Tropical del Cesar \nLa Lope, de conformidad con lo expuesto en la parte motiva del presente acto administrativo.”\n“(…)”\n1.1 Petición de la Sociedad.\n“(…)”\n“[S]e REVOQUE la decisión, y en consideración a ello se proceda a APROBAR las actividades \nde preservación y restauración en el área de 40,38 ha dentro del Banco de Hábitat Bosque Seco \nTropical del Cesar La Lope.”\n“(…)”\n\nResolución No. 000802       Del 07 MAY. 2024          Hoja No. 7 de 56\n“POR LA CUAL SE RESUELVE UN RECURSO DE REPOSICIÓN”\nPágina 7 de 56\n1.2 Argumentos de la Sociedad.\n“(...)”\n“Se solicita que la decisión de la ANLA sea revocada por cuando la entidad no está teniendo a \nconsideración la siguiente información la cual fue remitida por parte de CENIT: \n• Radicación 2022252085-1-000 del 9 de noviembre de 2022, en la que CENIT presentó la \nrespuesta a los requerimientos de la Resolución 1582 del 25 de julio de 2022, redireccionando \nla obligación de inversión forzosa de no menos del 1% a los Bancos de Hábitat Bosque Seco \nTropical del Cesar.\n• Radicación 20236200050792 del 28 de abril de 2023, en el cual CENIT anexó el ICA número \n20, el cual incluyó información complementaria asociada al artículo décimo primero, de la \nResolución 1582 del 25 de julio de 2022, en donde se presentó el avance del cronograma \nrespecto a las actividades de aislamiento, caracterización físico - biótica, soportes de los \nacuerdos suscritos con los propietarios donde se encuentra el Banco de Hábitat mediante un \ncontrato de usufructo, y actividades de restauración, y particularmente, en el alcance al numeral \n2.3.5: \n“Presentar los polígonos de las áreas objeto de restauración que evidencien los predios a \nintervenir, áreas, tipo de cobertura y uso del suelo, tipo de propiedad, vías de acceso y diseños \nde corredores de control de incendios, teniendo en cuento el modelo de almacenamiento de \ndatos geográficos establecido en la Resolución 2182 de 23 de diciembre de 2016 expedida \npor esta Autoridad o la que derogue, modifique o sustituya” (Subrayado por fuera del texto). \nCENIT presentó mediante salida gráfica y en formato GDB, la reserva preliminar ante Terrasos \nS.A.S., actual administrador del Banco de Hábitat en cuestión, así como la espacialización de \nlos 40.38 cupos de biodiversidad que permitirán dar alcance al plan de inversión forzosa de no \nmenos del 1% para el expediente LAM0832, mediante el mecanismo Banco de Hábitat Bosque \nSeco Tropical del Cesar - La Lope. Adicionalmente, se presentaron los siguientes anexos:\n•\nEscritura de usufructo del predio que conforma el Banco Hábitat Bosque Seco Tropical \ndel Cesar - La Lope. \n•\nCertificado de tradición y libertad del inmueble donde se encuentra el Banco Hábitat \nBosque Seco Tropical del Cesar - La Lope. \n•\nOficio de registro ante el MADS.\n•\n Anexo cartográfico (GDB) con la reserva preliminar y espacialización de los 40.38 cupos \nque darán alcance al plan de inversión forzosa de no menos del 1% para el expediente \nLAM0832.\nAdicionalmente, vale la pena mencionar lo siguiente respecto a los Bancos de Hábitat, conforme \nla Resolución 1051 del 2017.\n \nTerrasos S.A.S. registró el Banco Hábitat Bosque Seco Tropical del Cesar - La Lope ante la \nDirección de Bosques, Biodiversidad y Servicios Ecosistémicos (En adelante “DBBSE”) del \nMinisterio de Ambiente y Desarrollo Sostenible (En adelante “MADS”), conforme con lo \ndispuesto en el artículo 4 de la Resolución 1051 del 05 de junio de 2017 (Anexo 1).\nComo resultado del registro del Banco Hábitat Bosque Seco Tropical del Cesar - La Lope ante \nla DBBSE del MADS, Terrasos S.A.S. tiene la obligación de reportar a la DBBSE del MADS la \n\nResolución No. 000802       Del 07 MAY. 2024          Hoja No. 8 de 56\n“POR LA CUAL SE RESUELVE UN RECURSO DE REPOSICIÓN”\nPágina 8 de 56\nasignación de los cupos de biodiversidad que sean dirigidos a cada uno de sus Bancos de \nHábitat, como lo es, en este caso los cupos de biodiversidad derivados del registro del Banco \nHábitat Bosque Seco Tropical del Cesar - La Lope. \nConforme a lo dispuesto en la Resolución 1051 de 2017, Terrasos S.A.S. tiene la obligación de \nremitir a la DBBSE del MADS reportes periódicos con la contabilidad ambiental de los cupos de \nbiodiversidad de sus Bancos de Hábitat, conforme a lo dispuesto en el artículo 7 de la \nResolución 1051 del 05 de junio de 2017, con el fin de asegurar transparencia y trazabilidad \nfrente a la gestión asociada al proceso de asignación de cupos ante la DBBSE del MADS. \nPara el caso del Banco de Hábitat Bosque Seco Tropical del Cesar - La Lope, Terrasos S.A.S. \nha remitido las siguientes comunicaciones sobre la asignación y disponibilidad de cupos las \ncuales se encuentran en los siguientes anexos: \nAnexo 2. Reporte de contabilidad oficial de cupos de biodiversidad a ANLA, mediante el \nradicado 20236201061902 del 28 de diciembre de 2023. \nAnexo 3. Asignación de cupos CENIT – BHC-La Lope (Rad.2023E1022188 del 19 de mayo de \n2023) ante la DBBSE del MADS. \nComo se puede observar, en el caso del Banco de Hábitat Bosque Seco Tropical del Cesar - La \nLope, a la única empresa que se le ha asignado formalmente cupos es a CENIT. Esta \ninformación obra ante la DBBSE del MADS. \nEs preciso señalar que, la asignación de cupos de biodiversidad a favor de las empresas que \ndirigen el cumplimiento de sus obligaciones ambientales bajo el mecanismo de Banco de Hábitat \nse efectúa cuando suceden dos cosas: 1) En el momento que la Autoridad Ambiental se \npronuncia mediante acto administrativo aprobando la respectiva propuesta de compensación \ny/o inversión, y 2) cuando hay un acuerdo suscrito entre la empresa y el Banco de Hábitat. \nEs ahí cuando se da paso al proceso de asignación oficial de los cupos de biodiversidad a favor \nde la empresa ante el DBBSE del MADS, con lo cual se asegura de forma transparente la \ncontabilidad ambiental del Banco de Hábitat, diferenciando los cupos de biodiversidad \nasignados para cada expediente y asegurando que no se realice una doble contabilidad o \nsuperposición de los cupos asignados.\nEsto es totalmente transparente tanto para las empresas como para la ANLA puesto que en los \noficios que remite Terrasos S.A.S. a sus clientes, se hace la claridad respecto a que la \nasignación definitiva de los cupos solo se hace en el momento en el que se materialice la \nrelación contractual, como puede evidenciarse a continuación:\n(Ver Figura 1. “Comunicado dirigido a CENIT respecto a la disponibilidad de cupos en el BH”. \nPág. 7 Concepto Técnico 1787 del 27 de marzo de 2024)\nAunado a lo anterior, se debe señalar que sin la relación contractual, NO se puede establecer \nque el titular de la licencia está realmente ejecutando su obligación ambiental en el Banco de \nHábitat ya que el titular de la obligación no podría disponer de los cupos de biodiversidad sin \nhaber logrado el acuerdo contractual con el responsable del Banco de Hábitat; siendo \ncongruente con lo establecido en el parágrafo 1 del artículo sexto de la Resolución 1051 del 05 \nde junio de 2017, el cual establece: \n“ARTÍCULO 6o. FINANCIACIÓN DEL BANCO DE HÁBITAT. Los bancos de hábitat podrán \ntener total o parcialmente las siguientes fuentes: \n1. Inversiones del sector público y/o privado. \n\nResolución No. 000802       Del 07 MAY. 2024          Hoja No. 9 de 56\n“POR LA CUAL SE RESUELVE UN RECURSO DE REPOSICIÓN”\nPágina 9 de 56\n2. Recursos de cooperación internacional. \n3. Recursos de la inversión forzosa de no menos del 1% de los proyectos objeto de \nlicenciamiento ambiental y/o de compensaciones ambientales de licencias, permisos, \nconcesiones, y demás autorizaciones ambientales. \n4. Las demás que se consideren pertinentes. \nPARÁGRAFO 1o. Los acuerdos que se celebren respecto de cada banco de hábitat tanto en \nsu financiación como en su implementación únicamente comprometen la responsabilidad de \nquienes los suscriben (…)” (Subrayado por fuera del texto original). \nEs pertinente distinguir los actos de RESERVA y ASIGNACIÓN de cupos de biodiversidad, en \ndonde, la reserva de cupos hace referencia a la disponibilidad y expectativa que existe para \nusar cierta cantidad de cupos de biodiversidad, sujeto a que las partes lleguen a un acuerdo \nformal y contractual; mientras que, la asignación de cupos ya cuenta con un acto administrativo \nde aprobación del plan de compensación y/o inversión para la obligación ambiental por parte de \nla Autoridad Ambiental, como es el caso del expediente LAM0832 y un acuerdo formal \ncontractual entre el titular de la obligación y el responsable del Banco de Hábitat, estableciendo \nel proceso de asignación oficial de los cupos de biodiversidad ante el DBBSE del MADS. \nEn línea con lo argumentado en el presente capítulo, CENIT mediante el Anexo 2, se permite \nadjuntar el radicado 20236201061902 del 28 de diciembre de 2023 presentado por Terrasos \nS.A.S. ante la ANLA, en el que reporta la contabilidad ambiental oficial de los cupos asignados \ny disponibles en los Bancos de Hábitat administrados por ellos, ante el MADS. \nEn este, se puede evidenciar que el BH Bosque Seco Tropical del Cesar -La Lope de un total \nde 321 cupos bajo un contrato de usufructo y registro ante el MADS, cuenta únicamente con \n78,5 cupos de biodiversidad asignados a favor de CENIT para el cumplimiento de la \ncompensación aprobada por parte de la ANLA mediante la Resolución 2813 del 29 de \nnoviembre de 2022 (Expediente LAM0832) y 242,5 cupos disponibles para el cumplimiento de \nobligaciones ambientales de empresas que tengan aprobación, interés y la voluntad de cumplir \nsu obligación ambiental ante la respectiva Autoridad Ambiental (ANLA o Corporación Autónoma \nRegional) (Ver Tabla 1).\n(Ver Tabla 1. “Registro de asignación de cupos de biodiversidad actualizado en el BHC-La \nLope”. Pág. 8, Concepto Técnico 1787 del 27 de marzo de 2024)\nPor lo tanto, si bien hay empresas que presentan planes de compensación y/o inversión de no \nmenos del 1% aprobados por parte de la ANLA o una Corporación Autónoma Regional, como \nes el caso puntual de la Sociedad C.I. COLOMBIAN NATURAL RESOURCES I S.A.S. (En \nadelante “CNR I”), en donde, a través de la Resolución 00347 del 24 de febrero de 2023 \naprobaron algunas alternativas para las acciones del plan de compensación, entre ellas la \nalternativa 2 “BH-La Lope”, es de aclarar que según lo informado por Terrasos S.A.S., ésta aún \nno formaliza su ejecución a través de un acuerdo o contrato, en concordancia con lo dispuesto \nen el parágrafo primero del artículo sexto de la Resolución 1051 del 05 de junio de 2017. \nEs decir, acorde con el administrador del Banco de Hábitat con quien CENIT actualmente tiene \nun contrato de ejecución, si bien CNR I cuenta con el primer paso que es la aprobación de la \npropuesta de compensación o inversión por parte de la respectiva Autoridad Ambiental, es \nnecesario a partir de allí avanzar en la gestión asociada a la negociación contractual entre el \ntitular de la obligación y el responsable del Banco de Hábitat para el desarrollo de la obligación, \ninstancia que a la fecha según información aportada por el aliado, aún no se surte. \n\nResolución No. 000802       Del 07 MAY. 2024          Hoja No. 10 de 56\n“POR LA CUAL SE RESUELVE UN RECURSO DE REPOSICIÓN”\nPágina 10 de 56\nEn este sentido, de no formalizar dicho acuerdo contractual (Contrato, acuerdo, orden de \nservicio) no se puede, a la fecha, llevar a cabo el proceso de venta y asignación de los cupos \nde biodiversidad con Terrasos S.A.S., actual administrador del Banco de Hábitat, que requieran \npara el cumplimiento de la obligación ante la DBBSE del MADS y el posterior desarrollo de \nactividades para las distintas estrategias (Preservación y/o restauración) aprobadas.\nDe esta manera, se puede concluir que mientras que Terrasos S.A.S. no haya notificado \nformalmente a la DBBSE del MADS sobre la asignación de cupos, la disponibilidad de áreas en \nel Banco de Banco de Hábitat Bosque Seco Tropical del Cesar - La Lope para la ejecución por \nparte de CENIT, se mantiene. \nEn línea con la justificación proporcionada anteriormente, es posible verificar la información de \nlos cupos oficialmente asignados y disponibles en el BH Bosque Seco Tropical del Cesar - La \nLope mediante la presente comunicación y los soportes respectivos; por consiguiente, CENIT \nreitera que el plan de inversión de no menos del 1% presentado a través del comunicado con \nradicado ANLA 20236200378342 del 21 de julio de 2023 para el expediente LAM0832 y \nevaluado por la ANLA en la Resolución 3050 del 21 de diciembre de 2023 con el concepto \ntécnico 7764 del 15 de noviembre de 2023, actualmente NO presenta ninguna superposición en \nlos cupos propuestos para el cumplimiento de esta obligación ambiental, dado que los 40,38 \ncupos de biodiversidad presentados en el plan de inversión están disponibles a la fecha.\nPor lo anterior, se solicita a la Autoridad Nacional de Licencias Ambientales la REVOCATORIA \ndel artículo primero, de la Resolución 03050 del 21 de diciembre de 2023, y por lo mismo se \nproceda a APROBAR el plan de inversión forzosa de no menos del 1% presentado mediante \ncomunicaciones con radicación 2022252085-1-000 del 9 de noviembre de 2022 y \n20236200378342 del 21 de julio de 2023, en lo referente a las actividades de preservación y \nrestauración en el área de 40,38 ha dentro del Banco de Hábitat Bosque Seco Tropical del Cesar \nLa Lope, ya que no hay superposición de áreas y por lo tanto, razones que impidan el \ncumplimiento de la presente obligación en este Banco de Hábitat.”\n1.3. Consideraciones de la Autoridad Nacional.\nA través del Concepto Técnico 1787 del 27 de marzo de 2024, el equipo técnico de la \nAutoridad Nacional señaló:\n“(…)”\nEn atención a los argumentos que expresa la Sociedad CENIT TRANSPORTE Y LOGÍSTICA \nDE HIDROCARBUROS S.A.S., la Autoridad Nacional comprobó la información que reposa en \nel expediente, así como el análisis desarrollado en el Concepto Técnico 7764 del 15 de \nnoviembre de 2023 que fue acogido mediante la Resolución 3050 del 21 de diciembre de 2023, \nen el que se verificaron los aspectos referentes al proyecto “Sistema de transporte de \nhidrocarburos Pozos Colorados Ayacucho – Galán” específicamente en lo relacionado con la \nevaluación del plan de inversión forzosa de no menos del 1% presentado mediante \ncomunicaciones con radicación 2022252085-1-000 del 9 de noviembre de 2022 y \n20236200378342 del 21 de julio de 2023 y el seguimiento a las obligaciones de inversión forzosa \nde no menos del 1%, incluyendo la información de las comunicaciones con  radicación \n2022252085-1-000 del 9 de noviembre de 2022, 20236200120862 del 17 de mayo de 2023, \n20236200378342 del 21 de julio de 2023 y 20236200050792 del 28 de abril de 2023.\nComo parte inicial del análisis, en relación con el argumento de la Sociedad en cuanto a que la \nAutoridad Nacional no tuvo en consideración el radicado 2022252085-1-000 del 9 de noviembre \nde 2022, se aclara que la Sociedad en ese radicado presentó respuesta a los requerimientos \nde información de la Resolución 1582 del 25 de julio de 2022, no obstante en el mismo informa \nla solicitud de ajuste en el direccionamiento de los recursos de la inversión forzosa de no menos \n\nResolución No. 000802       Del 07 MAY. 2024          Hoja No. 11 de 56\n“POR LA CUAL SE RESUELVE UN RECURSO DE REPOSICIÓN”\nPágina 11 de 56\ndel 1% desistiendo de la ejecución en los predios Los Ceibotes y Contrabando previamente \naprobados en la mencionada Resolución.\nAl respecto de lo anterior, debe resaltarse que el plan aprobado mediante Resolución 1582 del \n25 de julio de 2022, la cual acogió el Concepto Técnico 3514 del 23 de junio de 2022, fue \nespecífico en el análisis de la propuesta para la ejecución en los predios Ceibotes y \nContrabando, por lo tanto, esta Resolución no tiene relación con la ejecución en el Banco de \nHábitat La Lope, puesto que esto no fue evaluado en el Concepto Técnico 3514 del 23 de junio \nde 20221.\nAhora bien, al respecto se observa que en respuesta al Artículo Décimo Primero de la \nResolución 1582 del 25 de julio de 2022, la Sociedad presenta mediante comunicación con \nradicación 2022252085-1-000 del 9 de noviembre de 2022, el desistimiento del uso de los \npredios Ceibotes y Contrabando, y el siguiente ajuste al plan de inversión forzosa de no menos \ndel 1%:\n “…[E]l direccionamiento de los recursos de la inversión forzosa de no menos del 1% asociada \nal expediente LAM0832 se dirigirá a dos nuevas áreas, las cuales conforman los Bancos \nde Hábitat en bosque seco tropical del Cesar – La Lope y Nueva Bethania, que fueron \nregistrados por la DBBSE del MADS mediante oficios 2101-2-3384 y 2101-2-3385 \nrespectivamente, ambos de fecha 7 de octubre de 2021…”\nPosteriormente la Autoridad Nacional se pronunció con respecto a la solicitud del ajuste al plan \nde inversión forzosa de no menos del 1%, presentado mediante radicado 2022252085-1-000 \ndel 9 de noviembre de 2022 y la información contenida en el Informe de Cumplimiento Ambiental \n-ICA- 20, mediante Resolución 3050 del 21 de diciembre de 2021. \nPor lo tanto, la propuesta aprobada en la Resolución 1582 del 25 de julio de 2022 de los predios \nCeibotes y Contrabando, no guarda relación con la aprobación del Banco de Hábitat La Lope; \nfueron dos propuestas distintas que dentro del debido proceso la Autoridad Nacional evaluó y \nse pronunció acerca de ellas de manera independiente.\nDe acuerdo con lo anterior, se aclara a la Sociedad que si se tuvo en cuenta el radicado \n2022252085-1-000 del 9 de noviembre de 2022, a partir del cual se realizó la evaluación de una \nnueva propuesta diferente a la aprobada mediante la Resolución 1582 del 25 de julio de 2022, \ncomo se explicó en el párrafo anterior; y que si bien la Sociedad manifestó que el radicado en \nmención se entregó en respuesta al Artículo Décimo Primero de la Resolución 1582 del 25 de \njulio de 2022, la misma Sociedad en este desistió de esa propuesta, y entregó una nueva; razón \npor la cual la Autoridad Nacional evaluó la nueva propuesta presentada para la ejecución en el \nBanco de Hábitat La Lope, mediante el Concepto Técnico 7764 del 15 de noviembre de 2023 \nque fue acogido mediante la Resolución 3050 del 21 de diciembre de 2023.\nHabiendo aclarado lo anterior, a continuación, se analizarán los argumentos presentados por la \nSociedad CENIT TRANSPORTE Y LOGÍSTICA DE HIDROCARBUROS S.A.S. en relación con \nel presente artículo:\nRespecto a que no existe superposición del área de inversión con las áreas de compensación \ndel proyecto “Extracción de carbón Mina La Francia” a cargo de C.I. COLOMBIAN NATURAL \nRESOURCES I S.A.S EN REORGANIZACIÓN., perteneciente al expediente LAM3199, a \ncontinuación, se trae lo descrito en el Concepto técnico 7764 del 15 de noviembre de 20232.\n1Acogido mediante la Resolución 1582 del 25 de julio de 2022\n2 Acogido mediante la Resolución 3050 del 21 de diciembre de 2023\n\nResolución No. 000802       Del 07 MAY. 2024          Hoja No. 12 de 56\n“POR LA CUAL SE RESUELVE UN RECURSO DE REPOSICIÓN”\nPágina 12 de 56\n“(…)” • Superposición del área de inversión con las áreas de compensación del proyecto \n“Extracción de carbón Mina La Francia”, a cargo de C.I. COLOMBIAN NATURAL \nRESOURCES I S.A.S EN REORGANIZACIÓN., perteneciente al expediente LAM3199.\nA partir del análisis de la información que reposa en el Sistema de Información de Licencias \nAmbientales – SILA, la Autoridad Nacional encontró que mediante el artículo sexto de la \nResolución 347 del 24 de febrero de 2023 modificada por la Resolución 1096 del 29 de mayo \nde 2023  (Aprobación del Plan de compensación) del expediente LAM3199 correspondiente al \nproyecto “Extracción de carbón Mina La Francia”, se aceptaron 354,59 ha en el Banco de \nHábitat Bosque Seco Tropical del Cesar “La Lope” para ejecutar su obligación de \ncompensación. \nEn el marco anterior, al realizar el análisis de la información geográfica presentada por la \nSociedad mediante comunicación con radicación 20236200378342 del 21 de julio de 2023, \npara la propuesta del plan de inversión forzosa de no menos del 1% del expediente LAM0832, \nse encuentra que el área propuesta se superpone con el área aprobada para el plan de \ncompensación del componente biótico para el expediente LAM3199 en el artículo sexto de la \nResolución 347 del 24 de febrero de 2023 modificada por la Resolución 1096 del 29 de mayo \nde 2023. \nEn la siguiente figura se muestra la ubicación de las áreas de compensación aprobadas para \nel expediente LAM3199 y el área para la ejecución de la inversión forzosa de no menos del \n1% propuesta mediante comunicación con radicación 20236200378342 del 21 de julio de 2023 \ndel expediente LAM00832:\n(Ver Figura 14. “Superposición del área de la propuesta de inversión forzosa de no menos del \n1% del expediente LAM0832 y el área aprobada de compensación del expediente LAM3199”. \nPág. 12 Concepto Técnico 1787 del 27 de marzo de 2024)\nDe acuerdo con lo que se evidencia en la figura anterior, el 100% del área propuesta del plan \nde inversión forzosa de no menos del 1% presentado mediante comunicación con radicación \n20236200378342 del 21 de julio de 2023, para el expediente LAM0832 se superpone con el \nárea aprobada para el plan de compensación del componente biótico del expediente LAM3199 \naprobado el artículo sexto de la Resolución 347 del 24 de febrero de 2023 modificada por la \nResolución 1096 del 29 de mayo de 2023. \nCon base en lo anterior, la Autoridad Nacional considera que no es viable aprobar el área \npropuesta para ejecutar el plan de inversión forzosa de no menos del 1% \ncorrespondiente a las 40,38 ha presentadas mediante radicado 20236200378342 del 21 \nde julio de 2023 en el Banco de Hábitat La Lope puesto que ya hace parte de las áreas \naprobadas para el expediente LAM3199. (Subrayado fuera de texto) “(…)”\nAl respecto, la Autoridad Nacional dando cumplimiento al debido proceso realizó nuevamente \nun estudio espacial con respecto a el área de 40,38 ha dentro del Banco de Hábitat Bosque \nSeco Tropical del Cesar La Lope, referente a las actividades de preservación y restauración \ndentro del plan de inversión forzosa de no menos del 1% presentado mediante comunicaciones \ncon radicación 2022252085-1-000 del 9 de noviembre de 2022 y 20236200378342 del 21 de \njulio de 2023 y la información presentada en el Informe de Cumplimiento Ambiental -ICA- 20 \nmediante comunicación con radicación 20236200050792 del 28 de abril de 2023, reafirmando \nlo concluido en el Concepto técnico 7764 del 15 de noviembre de 20233, con respecto a la \nsobreposición de áreas presentadas para evaluación del Plan de Inversión Forzosa de no \nmenos del 1% del proyecto “Sistema de transporte de hidrocarburos Pozos Colorados Ayacucho \n3 Acogido mediante la Resolución 3050 del 21 de diciembre de 2023\n\nResolución No. 000802       Del 07 MAY. 2024          Hoja No. 13 de 56\n“POR LA CUAL SE RESUELVE UN RECURSO DE REPOSICIÓN”\nPágina 13 de 56\n– Galán”, expediente LAM0832, frente a las áreas aprobadas para la obligación de \ncompensación del componente biótico del proyecto “Extracción de carbón Mina la Francia”, cuyo \ntitular corresponde a la Sociedad C.I. COLOMBIAN NATURAL RESOURCES I S.A.S EN \nREORGANIZACIÓN expediente LAM3199, como se muestra en las figuras a continuación: \n(Ver Figura 1. “Mapa general de predios propuestos para la inversión forzosa de no menos del \n1% del expediente LAM0832 vs áreas aprobadas para compensación del expediente LAM3199 \nen BH La Lope”. Pág. 14 Concepto Técnico 1787 del 27 de marzo de 2024)\nEn la Figura 1, se pueden observar los predios propuestos para dar cumplimiento a la obligación \nde inversión forzosa de no menos del 1% presentados por la Sociedad en el expediente \nLAM0832, versus los ya aprobados y no aprobados mediante el artículo sexto de la Resolución \n347 del 24 de febrero de 2023 modificada por la Resolución 1096 del 29 de mayo de 2023  \n(Aprobación del Plan de compensación) en el proyecto “Extracción de carbón Mina La Francia” \n(LAM3199), dentro del Banco de Hábitat La Lope, confirmándose el traslape existente.\n(Ver Figura 2. “Polígono propuesto para la inversión forzosa de no menos del 1% del expediente \nLAM0832 y el traslape con los polígonos aprobados para la compensación del componente \nbiótico en el expediente LAM3199.”. Pág. 15 Concepto Técnico 1787 del 27 de marzo de 2024)\nEn la figura 2, se puede observar que de las 40,38 ha propuestas en el expediente LAM0832, \npara ejecutar la inversión forzosa de no menos del 1%, 40,13 ha ya fueron aprobadas para la \nobligación de compensación del componente biótico en el expediente LAM3199 mediante el \nartículo sexto de la Resolución 347 del 24 de febrero de 2023 modificada por la Resolución 1096 \ndel 29 de mayo de 2023 , lo cual significa que el 99,3% del área presentada por la Sociedad \nCENIT TRANSPORTE Y LOGÍSTICA DE HIDROCARBUROS S.A.S., para esta obligación, no \nes válida para dar cumplimiento debido a la superposición existente. \nAhora bien, con respecto a la superposición entre áreas presentadas entre los expedientes \nLAM3199 y LAM0832, la Sociedad mediante comunicación con radicación 20246200033422 del \n10 de enero de 2024 correspondiente al Recurso de Reposición objeto del concepto técnico4, \nanexa el oficio de la “asignación” de 78,5 ha con cargo al expediente LAM0832 y 155 ha5 con \ncargo al expediente LAM2975, dentro del Banco de Hábitat Bosque Seco Tropical del Cesar La \nLope,  emitido por parte de la empresa estructuradora del banco Terrasos S.A.S, documentación \nentregada ante el Ministerio de Ambiente y Desarrollo Sostenible-MADS, mediante \ncomunicaciones con radicación MADS 2023E1048957 del 19 de octubre de 2023 y \n2023E1022188 del 19 de mayo de 2023. Al respecto, se aclara que ninguno de estos oficios \nespecifica que polígonos son los separados dentro del banco de hábitat por lo que no permiten \nla trazabilidad de la separación de cupos.\nIgualmente, debe resaltarse que estos oficios, previo a su presentación en el radicado del \nrecurso de reposición, no habían sido radicados al expediente LAM0832, al momento de la \nevaluación del plan de inversión forzosa de no menos del 1%, y finalización del concepto técnico \n7764 del 15 de noviembre de 20236 por tanto, si bien se verifican, no serán objeto de evaluación \nen el concepto técnico7. \nAsí mismo, una vez verificados los argumentos anexos a estos oficios, es de aclarar que en \nrelación con la comunicación con radicación MADS 2023E1048957 del 19 de octubre de 2023, \nno se entiende por parte de la Autoridad Nacional el por qué la presentación del documento de \n4 Concepto Técnico 1787 del 27 de marzo de 2024\n5 De acuerdo con el oficio de fecha 19 de octubre de 2023, la asignación de 155 ha (Cupos) con cargo al \nexpediente LAM2975 se efectúo dentro del Banco de Hábitat Meta\n6 Acogido mediante la Resolución 3050 del 21 de diciembre de 2023\n7 Concepto Técnico 1787 del 27 de marzo de 2024\n\nResolución No. 000802       Del 07 MAY. 2024          Hoja No. 14 de 56\n“POR LA CUAL SE RESUELVE UN RECURSO DE REPOSICIÓN”\nPágina 14 de 56\n“Asignación” de 155.28 cupos a nombre de la Sociedad CENIT TRANSPORTE Y LOGÍSTICA \nDE HIDROCARBUROS S.A.S. para el expediente LAM2947, el cual no está relacionado con \nel expediente objeto de recurso de reposición. Este documento se presenta a continuación.\n(Ver Figura. Pág. 17 Concepto Técnico 1787 del 27 de marzo de 2024)\nPor otra parte, en relación con la comunicación con radicación MADS 2023E1022188 del 19 de \nmayo de 2023, anexo al recurso de reposición, se reporta la “Asignación” de 78,5 ha, al \nexpediente LAM0832 así:\n(Ver Figura. Pág. 18 Concepto Técnico 1787 del 27 de marzo de 2024)\nAl respecto de lo anterior, en relación con la “Asignación” mencionada de cupos del Banco de \nHábitat La Lope, mediante comunicación con radicación 20246200033422 del 10 de enero de \n2024 la Sociedad describe lo siguiente:\n“(…)”\n…Es pertinente distinguir los actos de RESERVA y ASIGNACIÓN de cupos de biodiversidad, \nen donde, la reserva de cupos hace referencia a la disponibilidad y expectativa que existe para \nusar cierta cantidad de cupos de biodiversidad, sujeto a que las partes lleguen a un acuerdo \nformal y contractual; mientras que, la asignación de cupos ya cuenta con un acto administrativo \nde aprobación del plan de compensación y/o inversión para la obligación ambiental por parte \nde la Autoridad Ambiental, como es el caso del expediente LAM0832 y un acuerdo formal \ncontractual entre el titular de la obligación y el responsable del Banco de Hábitat, estableciendo \nel proceso de asignación oficial de los cupos de biodiversidad ante el DBBSE del MADS…\n“(…)”\n…Por lo tanto, si bien hay empresas que presentan planes de compensación y/o inversión de \nno menos del 1% aprobados por parte de la ANLA o una Corporación Autónoma Regional, \ncomo es el caso puntual de la Sociedad C.I. COLOMBIAN NATURAL RESOURCES I S.A.S. \n(En adelante “CNR I”), en donde, a través de la Resolución 00347 del 24 de febrero de 2023 \naprobaron algunas alternativas para las acciones del plan de compensación, entre ellas la \nalternativa 2 “BH-La Lope”, es de aclarar que según lo informado por Terrasos S.A.S., ésta \naún no formaliza su ejecución a través de un acuerdo o contrato, en concordancia con lo \ndispuesto en el parágrafo primero del artículo sexto de la Resolución 1051 del 05 de junio de \n2017…\n“(…)”\n CENIT tiene una relación contractual con el actual administrador del Banco de Hábitat \nTerrasos, para la ejecución cumplimiento (sic) de una parte de las obligaciones del expediente \nLAM0832, en concordancia con lo dispuesto en el parágrafo primero del artículo sexto de la \nResolución 1051 del 05 de junio de 2017, por esta razón y dado que los 78,5 cupos de \nbiodiversidad para el cumplimiento del plan de compensación de componente biótico están \nasignados a favor de CENIT ante la DBBSE del MADS; se solicita a la Autoridad Nacional de \nLicencias Ambientales la REVOCATORIA del artículo segundo de la Resolución 03050 del 21 \nde diciembre de 2023, ya que no se tienen razones para no permitir el uso del Banco de Hábitat \nBosque Seco Tropical del Cesar – La Lope, previamente aprobado por la misma Autoridad, y \npor lo tanto, se solicita se APRUEBE la obligación ambiental a cargo de CENIT para el \nexpediente LAM0832, bajo el mecanismo Banco de Hábitat Bosque Seco Tropical del Cesar \n– La Lope, en el marco del contrato ya suscrito entre la Compañía y Terrasos S.A.S. de cara \na la obligación de compensación del componente biótico”. \n\nResolución No. 000802       Del 07 MAY. 2024          Hoja No. 15 de 56\n“POR LA CUAL SE RESUELVE UN RECURSO DE REPOSICIÓN”\nPágina 15 de 56\n“(…)”\nEn relación con la situación manifestada por parte de la Sociedad en los párrafos anteriores, \nrespecto a que, según lo descrito en su argumento, para el proyecto denominado “Extracción \nde carbón Mina La Francia”, expediente LAM3199 a cargo de C.I. COLOMBIAN NATURAL \nRESOURCES I S.A.S EN REORGANIZACIÓN., se presenta una “Reserva” más no una \n“Asignación” de cupos; la Autoridad Nacional debe aclarar que  según lo aprobado en el artículo \nsexto de la Resolución 347 del 24 de febrero de 2023 modificada por la Resolución 1096 del 29 \nde mayo de 2023  (Aprobación del Plan de compensación), en el expediente LAM3199 se \naceptaron 354,59 ha en el Banco de Hábitat Bosque Seco Tropical del Cesar “La Lope” para \nejecutar la obligación de compensación, de conformidad con la evaluación realizada al Plan de \ncompensación del componente biótico presentado mediante comunicación con radicación \n2022263125-1-000 del 23 de noviembre de 2022, en el cual se solicitó a la Autoridad Nacional \nla aprobación de la ejecución en esas áreas, para el cumplimiento de la obligación.\nAsí mismo junto con el plan mencionado asociado al expediente LAM3199, se anexo un oficio \nemitido por Terrasos S.A.S, de fecha 22 de noviembre de 2022, en el cual el operador del banco \nde hábitat en mención informó que:\n “… [A]ctuando en mi calidad de Representante Legal de Terrasos, identificada con Nit \n900582496-0, me permito confirmar la disponibilidad de cupos de biodiversidad que permitirán \ndar alcance a la obligación de compensación a cargo de CNR I, en el Banco de Hábitat Bosque \nSeco Tropical del Cesar \"La Lope”, localizado en el Municipio de Valledupar, Cesar, el cual se \nencuentra registrado ante la Dirección de Bosques, Biodiversidad y Servicios Ecosistémicos \ndel Ministerio de Ambiente y Desarrollo Sostenible - MADS, según consta en el radicado N° \n2101-2-3384 del 7 de octubre de 2021”. \nCon base en lo anterior, se evaluaron y aprobaron las mencionadas áreas en el expediente \nLAM3199. Por tanto, conforme sus funciones, la Autoridad Nacional ya emitió un acto \nadministrativo vía Resolución en la cual conforme la solicitud presentada por C.I. COLOMBIAN \nNATURAL RESOURCES I S.A.S EN REORGANIZACIÓN., se pronunció de fondo frente al plan \nde compensación del expediente LAM3199 y las áreas aprobadas para su ejecución, que son \nobjeto de sobreposición con las áreas presentadas como propuesta en el expediente LAM0832.\nA lo anterior debe sumarse que esta  no es la única situación de sobreposición presentada con \nrespecto a estas áreas ubicadas en el Banco de Hábitat Bosque Seco Tropical del Cesar – La \nLope, ya que, una vez realizada una nueva revisión dentro del sistema de información de \nlicencias ambientales SILA, la Autoridad Nacional, encontró que estas áreas, habían sido \npropuestas también, dentro un plan de compensación del componente biótico, para el \nexpediente LAM1862 en titularidad de la Sociedad CNR III LTD SUCURSAL COLOMBIA EN \nREORGANIZACIÓN, entregado por la Sociedad en su solicitud de acogimiento a la Resolución \n370 del 15 de abril de 2021, mediante comunicaciones con radicación 2022071550-1-000 y \n2022071513-1-000, ambos con fecha del 13 de abril de 2022, sin que fueran aceptadas por las \nmismas razones por las que no fueron aceptadas en el expediente LAM0832 (Sobreposición de \náreas), como consta en el Concepto Técnico 01542 del 31 de marzo de 2023 acogido mediante \nResolución 0842-4 del 28 de abril de 2023 asociada al expediente LAM1862:\n“(…)”\n…La Lope, de la alternativa 6 Banco de Hábitat Bosque Seco Tropical del Cesar-La Lope; no \nhace parte de esta evaluación por contener los polígonos citados anteriormente y que fueron \nobjeto de evaluación para el expediente LAM3199 y quedaron bajo el pronunciamiento \nrealizado en la Resolución 347 del 24 de febrero de 2023…\n\nResolución No. 000802       Del 07 MAY. 2024          Hoja No. 16 de 56\n“POR LA CUAL SE RESUELVE UN RECURSO DE REPOSICIÓN”\nPágina 16 de 56\nDebido a que el Banco de Hábitat la Lope, fue propuesto en otro expediente y presenta las \nmismas áreas que las presentadas en este Plan de Compensación, este no se tiene en cuenta \npor cuanto no es factible aprobar los mismos polígonos para obligaciones de compensación \nen proyectos diferentes.\n“(…)”\nConsecuentemente la Resolución 0842-4 del 28 de abril de 2023, asociada al expediente \nLAM1862, estableció en su artículo cuarto:\n“ARTÍCULO CUARTO: No aprobar a la Sociedad COLOMBIAN NATURAL RESOURCES - \nCNR III LTD SUCURSAL COLOMBIA EN REORGANIZACION, de conformidad con lo \nexpuesto en la parte motiva del presente acto administrativo los predios denominados: \na. El Florito \nb. La Descubierta \nc. La Lope \nd. Lote #2 El Florito \ne. Lote #2 El Paraíso \nf. Mata de Lata”\nDe tal forma, la Autoridad Nacional observa con preocupación cómo unas áreas que ya se \nencuentran aprobadas mediante acto administrativo (Artículo Sexto de la Resolución 347 del 24 \nde febrero de 2023 modificada por la Resolución 1096 del 29 de mayo de 2023  en el expediente \nLAM3199) están siendo presentadas, para su aprobación igualmente en otros expedientes \n(LAM1862 y LAM0832), junto con oficios emitidos por el operador del Banco de Hábitat del \nBosque Seco Tropical La Lope manifestando la “Disponibilidad de cupos”.\nAhora bien, dentro de los argumentos presentados por la Sociedad, se alude en relación con lo \ndescrito en párrafo anterior, que no hay tal traslape, dado que el operador del banco remitió \ncomunicaciones al Ministerio, sobre la contabilidad de cupos de biodiversidad “Asignados” \nsegún la obligación que tiene ese operador con el Ministerio conforme la Resolución 1051 de \n2017.\nIgualmente sostiene la Sociedad que con esto se valida la “Asignación” de los cupos \npresentados como propuesta ante la Autoridad Nacional para el expediente LAM0832 y no para \nel LAM3199, además de derivar que las actuaciones del operador del Banco de Hábitat \n(Terrasos S.A.S) realizadas ante el Ministerio, son suficientes para la aprobación de estas áreas \nen el marco de la obligación de la inversión forzosa de no menos 1% del expediente LAM0832, \nobligación que se encuentra en competencia de la Autoridad Nacional.\nSe observa entonces que el argumento presentado por la Sociedad pretende invalidar lo \ndispuesto por la Autoridad Nacional en la Resolución 347 del 24 de febrero de 2023 modificada \npor la Resolución 1096 del 29 de mayo de 2023, en el expediente LAM3199, y en la Resolución \n0842-4 del 28 de abril de 2023 en el expediente LAM1862.\nLa Autoridad Nacional encuentra que esta situación dificulta el adecuado desarrollo de sus \nfunciones y ejercicio de su competencia, las cuales por norma superior son distintas a las del \n\nResolución No. 000802       Del 07 MAY. 2024          Hoja No. 17 de 56\n“POR LA CUAL SE RESUELVE UN RECURSO DE REPOSICIÓN”\nPágina 17 de 56\nMinisterio de Ambiente y Desarrollo Sostenible, por lo que la Autoridad Nacional se permite \nrecordar a la Sociedad CENIT TRANSPORTE Y LOGÍSTICA DE HIDROCARBUROS S.A.S., \nlas funciones que le han sido dadas mediante el Decreto 3573 de 27 de septiembre de 2011.\n“(…)”\nArtículo 2. Objeto. La Autoridad Nacional de Licencias Ambientales -ANLA- es la encargada \nde que los proyectos, obras o actividades sujetos de licenciamiento, permiso o trámite \nambiental cumplan con la normativa ambiental, de tal manera que contribuyan al desarrollo \nsostenible ambiental del País.\nArtículo 3. Funciones. La Autoridad Nacional de Licencias Ambientales -ANLA cumplirá, las \nsiguientes funciones:\n1. Otorgar o negar las licencias, permisos y trámites ambientales de competencia del \nMinisterio de Ambiente y Desarrollo Sostenible, de conformidad con la ley y los \nreglamentos.\n“(…)”\nArtículo 13. Funciones de la Subdirección de Evaluación y Seguimiento. Las funciones de la \nSubdirección de Evaluación y Seguimiento son las siguientes:\n1.Evaluar las solicitudes de licencias ambientales para definir la viabilidad ambiental de los \nproyectos, obras o actividades.\n2.  Emitir conceptos técnicos que soporten los actos administrativos para el otorgamiento \nde las licencias ambientales y los que sustenten los actos administrativos en la etapa de \nseguimiento ambiental.\n3.Preparar los actos administrativos mediante los cuales se otorgan o niegan licencias \nambientales.\n9. Realizar el seguimiento a las licencias ambientales. \n10. Dar lineamientos y directrices en materia de licencias ambientales de competencia del \nMinisterio, sujetos a la inversión forzosa de no menos del 1 % y/o compensación forestal, \nprevistas en la Ley 99 de 1993, artículo 43 y el Decreto 1900 de 2006 o la norma que lo \nmodifique o sustituya”\nDe acuerdo con lo anterior, la Autoridad Nacional cumplió de manera clara y definitiva con sus \nfunciones al otorgar la aprobación del Plan de Compensación del Componente Biótico al \nproyecto denominado “Extracción de carbón Mina La Francia”, a cargo de C.I. COLOMBIAN \nNATURAL RESOURCES I S.A.S EN REORGANIZACIÓN., perteneciente al expediente \nLAM3199, el cual se encuentra vigente y en ejecución ante la Autoridad Nacional, dado que al \nmomento de desarrollarse la evaluación del plan de inversión forzosa de no menos del 1% del \nexpediente LAM0832, la Sociedad  no ha presentado un desistimiento explícito de estas áreas \ny actividades dentro de su plan de compensación aprobado mediante artículo sexto de la \nResolución 347 del 24 de febrero de 2023 modificada por la Resolución 1096 del 29 de mayo \nde 2023  y mientras esta condición no cambie y sea previamente evaluada tal situación en el \nmarco de las competencias asignadas a la Autoridad Nacional en el expediente LAM3199, estas \náreas no serán evaluadas ni aprobadas para el cumplimiento de otras obligaciones asociadas \na  otro expediente manteniendo los principios del debido proceso.\n\nResolución No. 000802       Del 07 MAY. 2024          Hoja No. 18 de 56\n“POR LA CUAL SE RESUELVE UN RECURSO DE REPOSICIÓN”\nPágina 18 de 56\nDebe aclararse que de acuerdo con el parágrafo 1 del Artículo sexto de la Resolución 1051 del \n5 de junio de 2017 por la cual se reglamentan los Bancos de hábitat “Los acuerdos que se \ncelebren respecto de cada Banco de Hábitat tanto en su financiamiento como en su \nimplementación únicamente comprometen la responsabilidad de quienes los suscriben”.  \nIgualmente, el cumplimento de las funciones de la Autoridad Nacional no debe ser socavado, \npor las relaciones comerciales entre empresas titulares de licencias ambientales y sus \nproveedores comerciales.\nLo anterior, teniendo en cuenta que conforme lo establecido en el literal b) del artículo \n2.2.9.3.1.2. del Decreto 2099 de 2016, los bancos de hábitat corresponden a “[U]n área en la \nque se podrán realizar actividades de preservación, restauración, rehabilitación, recuperación \ny/o uso sostenible para la conservación de la biodiversidad” y no corresponden en sí a la acción \na realizar para el cumplimiento de la obligación; así mismo, conforme a lo definido en el \nparágrafo 2 del Artículo Sexto de la Resolución 1051 del 05 de junio de 2017 por la cual se \nreglamentan los Bancos de hábitat,  la Autoridad Nacional no tiene ninguna relación directa con \nlos responsables de los Bancos de Hábitat, dado que, en el marco de sus funciones y \ncompetencias, hace control y seguimiento a las obligaciones impuestas a los proyectos objeto \nde licencia ambiental, cuyos responsables son los titulares de esta.\nPor tanto, los acuerdos comerciales entre la Sociedad CENIT TRANSPORTE Y LOGÍSTICA DE \nHIDROCARBUROS S.A.S. y la empresa Terrasos S.A.S, no son válidos per se, para definir los \nresultados de la evaluación de los planes de inversión forzosa de no menos del 1% o verificar \nel cumplimiento a las obligaciones de la licencia ambiental.\nIgualmente, la pretensión de la Sociedad, de revocar el artículo primero, con los argumentos \nmencionados respecto a la no sobreposición de áreas, no se encuentra conforme lo plasmado \nen la Resolución 1051 del 05 de junio de 2017, que define en su artículo 6 parágrafo 2 lo \nsiguiente:\n“(…)”\nArtículo 6. Financiación del Banco de Hábitat. Los Bancos de Hábitat, podrán tener total o \nparcialmente las siguientes fuentes:\n“(…)”\n… Parágrafo 2: … En todo caso, la autoridad ambiental competente definirá la viabilidad de \neste mecanismo de implementación de dichas obligaciones ambientales, el cual procederá \nsiempre y cuando se cumpla con los requisitos legales y técnicos definidos para las mismas.  \nCuando se agrupen requerimientos de varias obligaciones en un mismo Banco de \nhábitat, no podrá haber traslapes entre ellas y su seguimiento pueda ser medible de \nmanera independiente. (Subrayado fuera del texto)\nLo anterior no implica una cesión de la obligación ambiental, la cual se mantendrá en cabeza \nde los titulares del instrumento de manejo y control ambiental.\n“(…)” \nA partir de lo anterior, es claro que las áreas aprobadas para cada obligación y expediente \ndeben ser distinguibles geográficamente y se debe poder verificar su cumplimiento de manera \nindependiente.\n\nResolución No. 000802       Del 07 MAY. 2024          Hoja No. 19 de 56\n“POR LA CUAL SE RESUELVE UN RECURSO DE REPOSICIÓN”\nPágina 19 de 56\nPor otra parte, la Sociedad argumenta dentro del radicado 20246200033422 del 10 de enero de \n2024 lo siguiente:\n“(…)” De esta manera, se puede concluir que mientras Terrasos S.A.S. no haya notificado \nformalmente a la DBBSE del MADS sobre la asignación de cupos, la disponibilidad de áreas \nen el Banco de Banco de Hábitat Bosque Seco Tropical del Cesar - La Lope para la ejecución \npor parte de CENIT, se mantiene. “(…)”\nDel párrafo anterior, es preciso aclarar que NO es función de la Autoridad Nacional la \nverificación de información de Bancos de Hábitat ante el Ministerio, como fue muy bien definido \nen la Resolución 1051 del 05 de junio de 2017, el encargado de hacer seguimiento a los bancos \nde hábitat y su implementación es el Ministerio mediante la Dirección de Bosque, Biodiversidad \ny Servicios Ecosistémicos, no la Autoridad Nacional, quien tiene en su competencia la obligación \nde la inversión forzosa de no menos del 1% y exige su cumplimiento al titular de la licencia \nambiental, por lo que, si bien existen canales de comunicación entre entidades, la ejecución de \nla funciones de la Autoridad Nacional no debe verse limitada por la confusión de roles realizadas \npor otros actores del proceso en este caso la Sociedad titular de la Licencia Ambiental y el \nresponsable del Banco de Hábitat; lo anterior dado que la contabilidad del banco de hábitat es \nun requisito exigido al responsable del banco por el Ministerio en mención dentro de su proceso \nde monitoreo del banco de hábitat, como se encuentra definido en Resolución 1051 del 05 de \njunio de 2017 en su artículo 7 numeral 2.\nAhora bien, la Autoridad Nacional cumplió a cabalidad con la función descrita en el parágrafo 2 \ndel Artículo Sexto de la Resolución 1051 del 05 de junio de 2017, evaluando las áreas y \nactividades propuestas por el titular de la licencia ambiental del expediente LAM3199 en el plan \nde compensación de componente biótico del proyecto “Extracción de carbón Mina La Francia”, \nel cual fue evaluado y aprobado mediante el Artículo Sexto de la Resolución 347 del 24 de \nfebrero de 2023 modificada por la Resolución 1096 del 29 de mayo de 2023  y en pro de la \nlegalidad y transparencia en sus procesos la Autoridad Nacional no puede aprobar la mismas \náreas otros expedientes o para otras obligaciones.\nDejando esto claro, los argumentos relacionados a la “Asignación” de cupos de biodiversidad \ndel Banco de Hábitat, atendiendo asuntos contractuales descritos por la Sociedad, y la supuesta \nno sobreposición de áreas, no se consideran procedentes para la Autoridad Nacional.\nPor otra parte, una vez realizada la verificación de las áreas objeto del recurso de reposición se \nencuentra que hay dos (2) polígonos que no presentan superposición con áreas aprobadas en \notro expediente, por tanto, para estos se realiza el correspondiente análisis espacial ecológico. \nA continuación, se presenta una figura general de los polígonos no aprobados en ningún \nexpediente, presentados por la Sociedad dentro del plan de inversión forzosa de no menos del \n1%:\n(Ver Figura 3. “Polígonos BHLL_LAM0832_R_1%_3 y BHLL_LAM0832_R_1%_9s propuestos \npara la inversión forzosa de no menos del 1% que no se encuentran asignados a ningún \nexpediente”. Pág. 26, Concepto Técnico 1787 del 27 de marzo de 2024)\nDurante el análisis espacial se pudo evidenciar como se observa en la figura 3, que existen 2 \npolígonos (BHLL_LAM0832_R_1%_3 y BHLL_LAM0832_R_1%_9) correspondientes a 0,25 \nha, que no se encuentran aprobados en ningún expediente, los cuales se observan en color \namarillo, dichos polígonos, la Sociedad los caracteriza como una cobertura de arbustal, los \ncuales serán analizados a mejor detalle en las siguientes imágenes.\n\nResolución No. 000802       Del 07 MAY. 2024          Hoja No. 20 de 56\n“POR LA CUAL SE RESUELVE UN RECURSO DE REPOSICIÓN”\nPágina 20 de 56\n(Ver Figura 4. “Polígono inversión forzosa de no menos del 1% BHLL_LAM0832_R_1%_3.” Pág. \n27, Concepto Técnico 1787 del 27 de marzo de 2024)\nMediante las comunicaciones con radicación 2022252085-1-000 del 9 de noviembre de 2022 y \n20236200378342 del 21 de julio de 2023, la Sociedad, caracteriza este polígono como cobertura \narbustal proponiendo actividades de restauración espontánea para este, pero como se puede \nobservar en la imagen anterior, el área corresponde a un bosque denso con un proceso de \nsucesión avanzado el cual no tiene presencia de tensionantes que ameriten realizar \n“Restauración espontánea” y presencia mínima  de claros en los cuales en todo caso requieren \nprocesos de restauración asistida, contrario a lo propuesto por la Sociedad, donde se espera \nque un área con procesos de fragmentación (Claros) se regenere por sí misma por medio de \naislamiento; adicionalmente la actividad propuesta de cercar el área cortaría el paso de la fauna \npresente en el área, lo que corta la conectividad con las áreas colindantes al polígono y teniendo \nen cuenta las actividades necesarias para generar un cercado (Quitar la cobertura del \nsotobosque, abrir huecos) impactando la regeneración natural del bosque y el suelo, lo que  \nresulta un mayor impacto con respecto beneficio generado, es importante aclarar que si bien \neste polígono no se solapa con alguno aprobado en otros proyectos la Autoridad Nacional no \nacepta esta área ni la actividad de restauración espontánea propuesta por la Sociedad dentro \ndel plan de inversión forzosa de no menos de 1% de acuerdo a las consideración técnicas ya \nexpuestas.\n(Ver Figura 5. “Polígono inversión de no menos del 1% BHLL_LAM0832_R_1%_9.”. Pág. 28 \nConcepto Técnico 1787 del 27 de marzo de 2024)\nMediante los radicados 2022252085-1-000 del 9 de noviembre de 2022 y 20236200378342 del \n21 de julio de 2023, caracteriza este polígono como cobertura arbustal proponiendo actividades \nde restauración asistida para este, pero como se puede observar en la imagen anterior, el área \ncorresponde a un bosque denso, donde no se evidencian procesos de fragmentación que \nrequieran algún tipo de restauración asistida como propone la Sociedad, se observa una \ncobertura con  buen estado de conservación; es importante aclarar que si bien este polígono no \nse solapa con otros proyectos, la Autoridad Nacional no acepta esta área ni la actividad de \nrestauración propuesta por la Sociedad dentro del plan de inversión forzosa de no menos de \n1% de acuerdo a las consideración técnicas ya expuestas.\nAdemás de lo anterior, se observa que mediante comunicación con radicación 20246200264842 \ndel 8 de marzo de 2024, presentado en el expediente LAM0832, la Sociedad TERRASOS S.A.S \nsolicitó se tenga como prueba sobreviniente, la comunicación con remitente C.I. COLOMBIAN \nNATURAL RESOURCES I S.A.S. EN REORGANIZACIÓN del 12 de febrero de 2024, enviada \na la Autoridad Nacional en respuesta a una solicitud de información realizada mediante oficio \n20244700052081 del 25 de enero de 2024, en el expediente LAM3199. En la prueba \nsobreviniente se expresan los siguientes argumentos:\n(Ver Figura 6. “Oficio de prueba sobreviniente”. Pág. 29 Concepto Técnico 1787 del 27 de marzo \nde 2024)\nComo se puede observar en el comunicado, la Sociedad C.I. COLOMBIAN NATURAL \nRESOURCES I S.A.S. EN REORGANIZACIÓN titular de la licencia ambiental del expediente \nLAM3199, manifiesta que al momento de su comunicado del 12 de febrero de 2024 no ha \nsuscrito ningún acuerdo comercial con TERRASOS S.A.S como responsable del Banco de \nHábitat Bosque Seco Tropical del Cesar “La Lope”, y que entre otros “…[N]o se puede \nconsiderar que CNR I viene ejecutando su plan de compensación en las áreas del Banco de \nHábitat Bosque Seco Tropical La Lope”.\n\nResolución No. 000802       Del 07 MAY. 2024          Hoja No. 21 de 56\n“POR LA CUAL SE RESUELVE UN RECURSO DE REPOSICIÓN”\nPágina 21 de 56\nEn el oficio en mención, la Sociedad C.I. COLOMBIAN NATURAL RESOURCES I S.A.S. EN \nREORGANIZACIÓN manifiesta igualmente que todavía se encuentra en los tiempos para iniciar \nlas actividades de sus obligaciones de compensación en los predios aprobados mediante \nartículo sexto de la Resolución 347 del 24 de febrero de 2023 modificada por la Resolución 1096 \ndel 29 de mayo de 2023.\nLos demás numerales contenidos en la comunicación con radicado 20246200264842 del 08 de \nmarzo de 2024, no serán tenidos en cuenta por no encontrarse relacionados con el objeto del \npresente recurso de reposición.\nAl realizar el análisis de esta prueba sobreviniente se concluye que no aporta ninguna nueva \ninformación que dé lugar a un cambio en la decisión tomada por la Autoridad Nacional toda vez \nque la Sociedad C.I. COLOMBIAN NATURAL RESOURCES I S.A.S EN REORGANIZACIÓN., \ntitular de licencia del expediente LAM3199, cuenta aún con las áreas aprobadas mediante el \nartículo sexto de la Resolución 347 del 24 de febrero de 2023 modificada por la Resolución 1096 \ndel 29 de mayo de 2023  que se encuentran ubicadas en el Banco de Hábitat Bosque Seco \nTropical del Cesar “La Lope” las cuales se sobreponen a las presentadas en el expediente \nLAM0832 para evaluación. \nPor lo que la Autoridad Nacional  no tiene evidencia de un desistimiento explícito de C.I. \nCOLOMBIAN NATURAL RESOURCES I S.A.S. EN REORGANIZACIÓN, acerca de estas áreas \npara el cumplimiento de sus obligaciones de compensación en el expediente LAM3199, al \nmomento de realizar este concepto técnico8; el cual de presentarse debe ser evaluado en ese \nexpediente y como ya fue explicado previamente mientras las áreas ya hayan sido aprobados \nmediante un acto administrativo vigente, para la ejecución en el marco del cumplimiento de \nalguna obligación ya sea de compensación o de inversión forzosa de no menos del 1%, \nconforme la solicitud de la Sociedad en este caso  C.I. COLOMBIAN NATURAL RESOURCES \nI S.A.S. EN REORGANIZACIÓN, estas no podrán ser aprobadas para otro expediente u \nobligación por lo que la condición de superposición de áreas persiste. \nIgualmente, como se describió previamente conforme con el parágrafo 1 del Artículo sexto de \nla Resolución 1051 del 05 de junio de 2017 el acuerdo celebrado internamente, respecto de \ncada Banco de Hábitat tanto en su financiamiento como en su implementación únicamente \ncomprometen la responsabilidad de quienes los suscriben; en este caso CENIT TRANSPORTE \nY LOGÍSTICA DE HIDROCARBUROS S.A.S.  y el responsable del Banco de Hábitat; o C.I. \nCOLOMBIAN NATURAL RESOURCES I S.A.S. EN REORGANIZACIÓN y el responsable del \nBanco de Hábitat. Por otra parte, las actuaciones administrativas que realiza la Autoridad \nNacional se realizan conforme lo establecido en la normatividad aplicable a cada obligación y \nen el marco de nuestra competencia.\nDe acuerdo con lo anterior, la prueba sobreviniente entregada mediante radicado \n20246200264842 del 08 de marzo de 2024, no cambia la decisión respecto al artículo primero \nde la Resolución 3050 del 21 de diciembre de 2023.\nDe tal forma, en atención a todas las consideraciones presentadas por la Autoridad Nacional en \nel concepto técnico9, se considera que si existe la superposición con las áreas aprobadas \nmediante el artículo sexto de la Resolución 347 del 24 de febrero de 2023 modificada por la \nResolución 1096 del 29 de mayo de 2023  para el expediente LAM3199 cuyo titular de licencia \nes la Sociedad C.I. COLOMBIAN NATURAL RESOURCES I S.A.S EN REORGANIZACIÓN., y \nes por tanto que estas áreas no son viables de aceptar para el cumplimiento de la obligación de \nla inversión forzosa de no menos del 1% del expediente LAM0832.\n8 Concepto Técnico 1787 del 27 de marzo de 2024\n9 Concepto Técnico 1787 del 27 de marzo de 2024\n\nResolución No. 000802       Del 07 MAY. 2024          Hoja No. 22 de 56\n“POR LA CUAL SE RESUELVE UN RECURSO DE REPOSICIÓN”\nPágina 22 de 56\nIgualmente, para las áreas que no presentaron la superposición, una vez realizado el análisis \npertinente, se verificó en el concepto técnico10 que en todo caso desde el punto de vista técnico \nno son viables de aceptar.\nConsiderando la información anterior la Autoridad Nacional reafirma lo plasmado en la \nResolución 3050 del 21 de diciembre de 2023,  en el sentido de no aceptar a la Sociedad CENIT \nTRANSPORTE Y LOGÍSTICA DE HIDROCARBUROS S.A.S. el plan de inversión forzosa de \nno menos del 1% presentado mediante comunicaciones con radicación 2022252085-1-000 del \n9 de noviembre de 2022 y 20236200378342 del 21 de julio de 2023, referente a las actividades \nde preservación y restauración en el área de 40,38 ha dentro del Banco de Hábitat Bosque Seco \nTropical del Cesar La Lope.\nDe acuerdo con esto, en ausencia de evidencia objetiva que permita cambiar la decisión tomada \nen el Concepto técnico 7764 del 15 de noviembre de 2023 acogido mediante la Resolución 3050 \ndel 21 de diciembre de 2023, esta se confirma.\n“(…)”\nAhora bien, es preciso reiterar a la Sociedad que la decisión de no aceptar el Plan de \ninversión forzosa de no menos del 1%  propuesto mediante comunicaciones con radicación \n2022252085-1-000 del 9 de noviembre de 2022 y 20236200378342 del 21 de julio de 2023, \npara adelantar acciones de preservación y restauración en un área de 40,38 ha dentro del \nBanco de Hábitat Bosque Seco Tropical del Cesar “La Lope”, en los términos que fueron \naducidos en la Resolución 3050 del 21 de diciembre de 2023, responde al deber legal que \nle asiste a la Autoridad Nacional de verificar que no se presenten superposiciones entre las \náreas que se proponen para el cumplimiento de las obligaciones de compensación o de \ninversión forzosa de no menos del 1%, según sea el caso; debido a las dificultades que este \nsupuesto fáctico puede ocasionar en los procesos de seguimiento ambiental, que a la postre \nredundaría, en incumplimientos por parte de los titulares de los instrumentos de manejo y \ncontrol, las cuales tendrían origen en decisiones contradictorias de la Autoridad Nacional.\nEs así, como la Autoridad Nacional, ejecuta los procesos de evaluación mediante la \nverificación de la información documental y cartográfica que se allega, para determinar si \nun área, terreno o polígono, cuenta con las características físico bióticas  para adelantar las \nacciones propuestas; luego entonces, la superposición la determina el traslape de áreas, \nsin que aspectos externos asociados a los mecanismos a través de los cuáles se van a \nimplementar, o negocios jurídicos que deben ejecutarse para que efectivamente puedan  \ndesarrollarse, tengan incidencia en este proceso; como quiera que, de acuerdo con las \nactividades que se propongan en los cronogramas, el responsable deberá allegar los \ndocumentos pertinentes para acreditar los acuerdos que permitan  materializar en el \nterritorio las acciones propuestas.\nEn el caso puntual, el análisis efectuado en el Concepto Técnico 1787 del 27 de marzo de \n2024, demuestra la innegable superposición física que existe entre las áreas propuesta por \nla Sociedad mediante comunicaciones con radicación 2022252085-1-000 del 9 de \nnoviembre de 2022 y 20236200378342 del 21 de julio de 2023 y las aprobadas a la \nSociedad C.I. COLOMBIAN NATURAL RESOURCES I S.A.S. EN REORGANIZACIÓN en \ndel artículo sexto de la Resolución 347 del 24 de febrero de 2023 modificada por la \nResolución 1096 del 29 de mayo de 2023.\n10 Concepto Técnico 1787 del 27 de marzo de 2024\n\nResolución No. 000802       Del 07 MAY. 2024          Hoja No. 23 de 56\n“POR LA CUAL SE RESUELVE UN RECURSO DE REPOSICIÓN”\nPágina 23 de 56\nAhora bien, pese a la superposición existente, la Sociedad recurrente, afirma que las áreas \npropuestas para ejecutar el Plan de Inversión de no menos del 1%, no presentan \nsuperposición con otros proyectos; para el efecto, adjunta como prueba documental las \ncomunicaciones con radicación 2023E1022188 del 19 mayo de 2023 y 2023E1048957 del \n19 de octubre de 2023, a través de las  cuales Terrasos S.A.S como estructurador del Banco \nde Hábitat Bosque Seco Tropical del Cesar “La Lope”,  reporta a la Dirección de Bosques, \nBiodiversidad y Servicios Ecosistémicos del Ministerio de Ambiente y Desarrollo Sostenible \ny comunica a la Autoridad Nacional; respectivamente, la contabilidad de cupos disponibles,  \nreservados y/o asignados, concluyendo que, mientras los cupos no hayan sido asignados, \nestos pueden ser utilizados por los interesados en adelantar acciones en su interior, sin que \nimporte, la existencia de actos administrativos previos, donde se hayan aprobado planes \nde  compensación o de inversión forzosa de no menos del 1% para las mismas áreas.\nDe acuerdo con lo anterior, se acota, que la Autoridad Nacional evalúa áreas, en \nconsecuencia, el “Cupo” al que hace alusión la Sociedad recurrente, es un término que se \nacuña para el proceso de negociación que se realice con el Banco de hábitat como un \nmecanismo de control para evitar que el administrador los asigne en más de una \noportunidad; esto indica entonces, que es un aspecto que no incide en la decisión adoptada \npor la Autoridad Nacional, en tanto, quien tiene la obligación de verificar dicho aspecto es \nla Dirección de Bosques, Biodiversidad y Servicios Ecosistémicos del Ministerio de \nAmbiente y Desarrollo Sostenible; mientras que a la Autoridad Nacional, le corresponde, \nverificar que las áreas propuestas, cumplan con todos los criterios del ¿Dónde compensar? \nestablecidos en el manual de compensación por el componente biótico, que se ubiquen en \nel ámbito geográfico previsto cuando de la obligación  de inversión forzosa de no menos \ndel 1%, se trata, y que las acciones, sean acordes a las condiciones físico bióticas de las \náreas propuestas.\nLo expuesto denota, que a la Autoridad Nacional le son inoponibles las negociaciones que \nse realicen entre el Terrasos S.A.S., como administrador del Banco de Hábitat Bosque Seco \nTropical del Cesar “La Lope” y los interesados en cumplir sus obligaciones ambientales a \ntravés de este mecanismo, conclusión que tiene asidero en el parágrafo primero del artículo \nsexto de la Resolución 1051 del 5 de junio de 2017 según la cual “Los acuerdos que se \ncelebren respecto de cada banco de Hábitat tanto en su financiación como en su implementación \núnicamente comprometen la responsabilidad de quienes los suscriben”.\nContrario a lo anterior, los actos administrativos que emite la Autoridad Nacional a través \nde los cuales se validan y viabilizan áreas específicas para la ejecución de compensaciones \nambientales, como ocurrió en el caso particular de lo aprobado en la Resolución 347 del 24 \nde febrero de 2023, modificada por la Resolución 1096 del 29 de mayo de 2023 (Expediente \nLAM3199), tienen fuerza ejecutiva y ejecutoria y deben ser acatados, por los particulares \nen virtud de la presunción de legalidad que los envuelve, y por la Autoridad Nacional, en \nvirtud del principio de respeto al acto propio.\nFrente al contenido y alcance del principio del respeto al acto propio, la Corte constitucional \nafirmó que “...[E]l principio de respeto al acto propio, opera cuando una autoridad ha emitido un \nacto que ha generado una situación particular, concreta y definida a favor de otro. Tal principio le \nimpide a esa autoridad modificar unilateralmente su decisión, pues la confianza del administrado no \nse genera por la convicción de la apariencia de legalidad de una actuación, sino por la seguridad de \nhaber obtenido una posición jurídica definida a través de un acto que creó situaciones particulares y \n\nResolución No. 000802       Del 07 MAY. 2024          Hoja No. 24 de 56\n“POR LA CUAL SE RESUELVE UN RECURSO DE REPOSICIÓN”\nPágina 24 de 56\nconcretas a su favor11 (…)De ello se desprende que el respeto al acto propio comprende una \nlimitación del ejercicio de las potestades consistente en la fidelidad de las autoridades a las \ndecisiones que toman, sin que puedan revocarlas por sí mismas, cuando afectan a particulares y sin \nseguir el debido proceso para ello, más aún cuando el acto posterior este fundado en criterios \nirrazonables, desproporcionados o extemporáneos12.”\nComo consecuencia de lo aludido, la Autoridad Nacional en cumplimiento de los principios \ndel respeto al acto propio, de responsabilidad, del debido proceso y de seguridad jurídica, \nno puede desacatar  las decisiones adoptadas en la Resolución 347 del 24 de febrero de \n2023, modificada por la Resolución 1096 del 29 de mayo de 2023; a través de las cuales \nse aprobaron áreas puntuales para la ejecución del Plan de compensación del proyecto \n“Extracción de carbón Mina La Francia” y se validó el cronograma que prevé una serie de \nactividades para la ejecución de la obligación, dentro de las cuales se contempla la \nnegoción con propietarios o gestores, lo cual incluye al administrador del Banco de Hábitat; \nactividad que a la fecha está dentro de los términos previstos para su cumplimiento; en \ntanto, de allí se derivan situaciones jurídicas que generan unas expectativas legítimas a la \nSociedad C.I. COLOMBIAN NATURAL RESOURCES I S.A.S EN REORGANIZACIÓN \n(Expediente LAM3199), frente al ¿Dónde compensar?.\nAhora bien, obra dentro del expediente LAM0832, comunicación con radicación \n20246200264842 del 8 de marzo de 2024, presentada por la Sociedad Terrasos S.A.S, \nquien aludiendo su interés directo en el procedimiento administrativo que resuelve el \nrecurso de reposición instaurado en contra de la Resolución 3050 del 21 de diciembre de \n2023, solicita se tenga como prueba sobreviniente la comunicación con radicación del 12 \nde febrero de 2024, a través de la cual la Sociedad C.I. COLOMBIAN NATURAL \nRESOURCES I S.A.S EN REORGANIZACIÓN, entre otras aspectos, informa a la Autoridad \nNacional que no ha establecido ninguna relación contractual con la Sociedad Terrasos \nS.A.S. conexa con la implementación de la Compensación en las áreas aprobadas \nmediante la Resolución 00347 del 24 de febrero de 2023 modificada por la Resolución 1096 \ndel 29 de mayo de 2023.\nLa Sociedad Terrasos S.A.S. justifica la intervención dentro del procedimiento \nadministrativo, señalando que concurre la condición establecida en el numeral 2 del Artículo \n38 del CPACA, en tanto “…[S]e verá afectado por la decisión que la ANLA adopte sobre el recurso \nde reposición interpuesto por la sociedad CENIT en contra de la Resolución No 03050 del 21 de \ndiciembre de 2023, por medio del radicado No 20246200033422 del 10 de enero de 2024 (en \nadelante el “Recurso”). Esto se debe a que TERRASOS es la sociedad estructuradora de Banco de \nHábitat La Lope; (ii) que TERRASOS no ha suscrito ningún acuerdo con CNR I respecto del Banco \nde Hábitat Bosque Seco tropical del Cesar “la Lope” (En adelante el “Banco de Hábitat”) y que por lo \ntanto esta empresa no tiene áreas o cupos formalmente asignados dentro del mismo. De manera \nque, cualquier decisión que la ANLA tome respecto del Bando de Habitat o sobre asuntos vinculados \ncon el mismo, tiene la potencialidad de afectar los derechos y/o la situación jurídica de TERRASOS”; \nsin embargo, se observa, que el pedimento se circunscribe a que se incorpore la prueba \nsobreviniente, sin que solicite su vinculación al procedimiento.\nEn hilo a lo expuesto, la Sociedad Terrasos S.A.S, si bien es un tercero interesado en la \nactuación; no es parte procesal ni está interesada en serlo, tal como se deduce de la \nsolicitud allegada; por tal razón, la posibilidad de incorporar el documento allegado al acervo \nprobatorio, debe abordarse desde la facultad oficiosa que le asiste a la Autoridad Nacional \n11 Ver Sentencia T-083 de 2003, M.P. Jaime Córdoba Triviño\n12 Ver Sentencia T-475 de 1992 M.P. Eduardo Cifuentes Muñoz.\n\nResolución No. 000802       Del 07 MAY. 2024          Hoja No. 25 de 56\n“POR LA CUAL SE RESUELVE UN RECURSO DE REPOSICIÓN”\nPágina 25 de 56\na partir de la verificación de los requisitos de idoneidad de la prueba, disgregado en la \nconducencia, pertinencia y necesidad de la prueba.\nEn este orden, la conducencia es la aptitud legal o jurídica que tiene la prueba, para \nconvencer al fallador sobre el hecho a que se refiere. Este requisito, persigue un fin que \napunta a la economía procesal, evitando que se entorpezca y dificulte la actividad probatoria \ncon medios que de antemano se sabe que no prestarán servicio alguno al proceso. \nPor su parte, la pertinencia se refiere a que el medio probatorio busque satisfacer el tema \nde prueba del proceso respectivo, esto es, si verdaderamente existe una relación \ndirecta entre la prueba y el hecho objeto de debate, para luego de ello rechazar aquellos \nmedios probatorios que no resultan idóneos frente al problema jurídico a resolver.\nFinalmente, la necesidad y/o utilidad del medio probatorio se manifiesta cuando con la \npráctica del mismo se puede establecer un hecho, que no ha sido demostrado con otra \nprueba; de suerte que la inutilidad se valorará cuando se esté frente a medios probatorios \nque, aunque puedan gozar de conducencia y pertinencia, resulten superfluos, redunden o \nesté de más su práctica en el trámite procesal.\nConforme a lo anterior, se considera que la prueba que se alude como sobreviniente, es \ninconducente, impertinente e innecesaria; inconducente por cuanto la prueba documental \nallegada, no es el medio idóneo para demostrar la inexistencia de superposición de áreas \nque dio lugar a la decisión adoptada por la Autoridad Nacional; impertinente e innecesaria, \nteniendo en cuenta que no agrega elementos probatorios adicionales a las pruebas \ndocumentales relacionadas en los Anexos 2 y 3 del  recurso de reposición, de las cuales  \nse deduce la inexistencia de una asignación de cupos oficiales a la Sociedad C.I. \nCOLOMBIAN NATURAL RESOURCES I S.A.S EN REORGANIZACIÓN (Expediente \nLAM3199), hecho que funge de asidero a la hipótesis planteada por Sociedad  para justificar \nla inexistencia de superposición de áreas, la cual que fue desechada por la Autoridad \nNacional, en los términos señalados en párrafos precedentes.\nAhora bien, se suma a lo predicho, que la prueba sobreviniente debe responder a un hecho \nocurrido con posterioridad a la oportunidad procesal para allegar la prueba; en el caso \nparticular del oficio datado del 12 de febrero de 2024, encuentra la Autoridad Nacional, que \nlo manifestado por la Sociedad C.I. COLOMBIAN NATURAL RESOURCES I S.A.S EN \nREORGANIZACIÓN, corresponde a la ratificación de un hecho que fue probado por la \nSociedad recurrente pero que carece de la potencialidad de modificar la decisión adoptada \nen el artículo primero de la Resolución 3050 de 21 de diciembre de 2023;  en consecuencia, \nno hay lugar a  efectuar una valoración adicional de la prueba allegada por la Sociedad.\nClaro lo anterior, La Autoridad Nacional Procederá a confirmar el contenido del Artículo \nPrimero de la Resolución 3050 de 21 de diciembre de 2023, tal y cómo se señalará en la \nparte resolutiva del presente acto administrativo.\n2.\nDISPOSICIÓN RECURRIDA – ARTÍCULO SEGUNDO DE LA RESOLUCIÓN 3050 \nDEL 21 DE DICIEMBRE DE 2023. \n“(…)”\nARTÍCULO SEGUNDO. No aceptar a la Sociedad CENIT TRANSPORTE Y LOGÍSTICA DE \nHIDROCARBUROS S.A.S. las áreas asignadas en el Banco de Hábitat Bosque Seco Tropical \ndel Cesar “La Lope” presentadas mediante comunicación con radicación 2022297415-1-000 del \n\nResolución No. 000802       Del 07 MAY. 2024          Hoja No. 26 de 56\n“POR LA CUAL SE RESUELVE UN RECURSO DE REPOSICIÓN”\nPágina 26 de 56\n30 de diciembre de 2022, para la ejecución del Plan de compensación aprobado mediante \nResolución 2813 del 29 de noviembre de 2022, de conformidad con lo expuesto en la parte \nmotiva del presente acto administrativo.\n“(…)”\n2.1 Petición de la Sociedad.\n“(…)”\n“…REVOCAR el referido artículo teniendo en cuenta que ANLA no tiene en cuenta que, a la \nfecha, esas áreas no están asignadas formalmente ante el MADS para el “otro expediente \nlicenciado a cargo de la ANLA” como se puede constatar en las evidencias presentadas”.\n“(…)”\n2.2 Argumentos de la Sociedad.\n“…CENIT se permite acotar, que el acto administrativo en el que se aprobaron las \n78,5 Ha en Banco de Hábitat Bosque Seco Tropical del Cesar “La Lope” es \nanterior al acto administrativo de aprobación del plan de compensación del \nexpediente LAM3199, tal como lo menciona el concepto técnico No 7774 del 15 \nde noviembre de 2023. \nUna vez aprobado el plan de compensación por medio del artículo primero de la Resolución \n2813 del 29 de noviembre de 2022, en el que resuelve “Aprobar a la Sociedad CENIT Transporte \ny Logística de Hidrocarburos S.A.S. el Plan de compensación de 78,5 ha del proyecto “Sistema \nde transporte de hidrocarburos Pozos Colorados – Ayacucho - Galán” en el Banco de Hábitat \ndel Bosque seco Tropical del Cesar “La Lope” ubicado en el Municipio de Valledupar, \nDepartamento del Cesar, de conformidad con lo expuesto en la parte motiva del presente acto \nadministrativo.”, se dio continuidad al proceso de formalización contractual tal y como lo \nestablece el cronograma aprobado del Plan de compensación en su página 120 (Figura 2), \nmostrando que el primer paso luego de la aprobación es la formalización de los acuerdos con \nel Banco de Hábitat dando paso con ello a la asignación de los cupos de biodiversidad a favor \nde CENIT ante el MADS, actividades que se pueden evidenciar en la Figura 3 y Anexo 3.\n(Ver Figura 2. “Cronograma aprobado por la ANLA para el plan de compensación en 78,5 ha \ndel BH-La Lope”. Pág. 32 Concepto Técnico 1787 del 27 de marzo de 2024)\nAcorde al cronograma aprobado, el interés y voluntad del titular de la obligación (CENIT) se \nestableció el contrato de prestación de servicios No. 8000008150 (Ver Figura 3), la orden de \nservicio y el acta de inicio con el responsable en la administración del BH Bosque Seco Tropical \ndel Cesar - La Lope (Terrasos S.A.S.), para el proceso de compra y asignación de cupos \noficiales para la ejecución de actividades, con el fin de dar cumplimiento a la obligación \nambiental, teniendo en cuenta la condición de pago por desempeño (Pago por resultado).\n(Ver Figura 3. “Contrato de prestación de servicios No. 8000008150”. Pág. 33 Concepto Técnico \n1787 del 27 de marzo de 2024)\nEn tal sentido, por medio del radicado MADS 2023E1022188 del 19 de mayo de 2023, la \nempresa Terrasos S.A.S., en el marco de lo dispuesto en el artículo séptimo de la Resolución \n1051 del 05 de junio de 2017 notificó a la DBBSE del MADS la asignación de 78.5 cupos de \nbiodiversidad a favor de CENIT (Remitirse Anexo 3 y ver Tabla 1), garantizó la asignación oficial \n\nResolución No. 000802       Del 07 MAY. 2024          Hoja No. 27 de 56\n“POR LA CUAL SE RESUELVE UN RECURSO DE REPOSICIÓN”\nPágina 27 de 56\nde estos cupos a favor del titular de la obligación de compensación (CENIT) y a su vez, dando \nclaridad y transparencia frente a la ausencia de una doble contabilidad, superposición o \nduplicidad de estos cupos de biodiversidad con otra obligación ambiental. \nAdicionalmente, vale la pena resaltar que el mecanismo de Banco de Hábitat asegura el \ndesarrollo de actividades de conservación por un tiempo mayor (30 años), y que estos cupos se \nasignan una única vez en el tiempo. \nEn tal sentido, los cupos de biodiversidad que adquirió CENIT en el BH Bosque Seco Tropical \ndel Cesar – La Lope para el cumplimiento de la obligación de compensación, no tendrán ninguna \nsuperposición o duplicidad con ningún otro expediente u obligación ambiental. \nDe forma paralela a la formalización del acuerdo contractual mencionado anteriormente, CENIT \ndio respuesta por medio del comunicado con radicado N° 2022297415-1-000 del 30 de \ndiciembre de 2022 (Anexo 4) a la solicitud por parte de la ANLA en el artículo tercero de la \nResolución 2813 del 29 de noviembre de 2022, en donde impuso los siguientes requerimientos \nen un término no mayor a un (1) mes contado a partir de la ejecutoria del acto administrativo: \n“(… )”\n1. Presentar el soporte que confirme la disponibilidad de cupos en el Banco de Hábitat del \nBosque seco Tropical del Cesar “La Lope” \n2. Presentar la ubicación de las 78,5 ha donde será implementada la compensación dentro del \nBanco de Hábitat del Bosque seco Tropical del Cesar “La Lope”. \n3. Presentar el documento de registro presentado por parte del Terrasos SAS al Ministerio de \nAmbiente y Desarrollo Sostenible (MADS). \n4. Presentar la manifestación por parte del administrador del Banco de Hábitat (Terrasos SAS) \ndonde se confirme la disponibilidad de cupos de biodiversidad para dirigir la compensación de \nlas 78,5 ha del proyecto “Sistema de hidrocarburos Pozos Colorados – Ayacucho – Galán”\n5. Ajustar en el cronograma incluyendo: \na) Las actividades de levantamiento de línea base \nb) El tiempo requerido para alcanzarlos objetivos y las metas de la compensación \n“(…)”\nComo se indicó, mediante el radicado con número N° 2022297415-1-000 del 30 de diciembre \nde 2022, CENIT dio alcance a cada una de las obligaciones impuestas por la ANLA en el artículo \ntercero de la Resolución 2813 del 29 de noviembre de 2022, presentando lo referente a los \ncupos de biodiversidad asignados a favor de la Compañía para el cumplimiento de esta \nobligación, como puede evidenciarse en la Figura 4:\n(Ver Figura 4. “Cupos Asignados a favor de la Compañía para el cumplimiento de esta \nobligación”. Pág. 34 Concepto Técnico 1787 del 27 de marzo de 2024).\nPosteriormente, dentro del periodo de los seis (6) meses establecidos por la Autoridad \nAmbiental (sic), CENIT dio alcance a lo requerido en el artículo cuarto de la Resolución 2813 \ndel 29 de noviembre de 2022, mediante el comunicado con radicado N° 20236200213162 del \n09 de junio de 2023 (Anexo 5), en lo referente a la línea base, acciones de compensación a \nimplementar, indicadores de impacto, plan de monitoreo, objetivos y metas de la compensación \n\nResolución No. 000802       Del 07 MAY. 2024          Hoja No. 28 de 56\n“POR LA CUAL SE RESUELVE UN RECURSO DE REPOSICIÓN”\nPágina 28 de 56\nen los cupos de biodiversidad asignados. CENIT, en el marco del cumplimiento de sus \nobligaciones asociadas al seguimiento por parte de la ANLA al expediente LAM0832, presentó \nmediante el radicado 20236200050792 del 28 de abril de 2023 (Anexo 6) el ICA 20- 2023; \nexponiendo los avances de las actividades previstas para el cumplimiento de la obligación del \nplan de compensación del componente biótico que contará con una duración de cinco (5) años.\nConforme a lo anterior, se puede evidenciar que de cara al cumplimiento de la obligación de \ncompensación ambiental ante ANLA, se vienen atendiendo los requerimientos establecidos en \nel artículo sexto de la Resolución 2813 del 29 de noviembre de 2022, respecto a la presentación \nde los informes de cumplimiento ambiental – ICA, conforme el estado de avance del \ncronograma. \nAcorde con la justificación anterior, es posible comprobar que, sobre los cupos asignados a \nCENIT en el Banco de Hábitat, y dado que existe un contrato en ejecución con el Banco de \nHábitat, con el fin de dar cumplimiento a la obligación de compensación aprobada por la ANLA \nmediante la Resolución 2813 del 29 de noviembre de 2022, además de la asignación ante el \nMADS de los cupos, NO existe una superposición de cupos de biodiversidad ante el MADS. \nAdicionalmente, se corrobora el cumplimiento a los distintos requerimientos impuestos en la \nResolución 2813 del 29 de noviembre de 2022 y, la ejecución y avance de las distintas \nactividades contempladas en el plan de compensación en función de lo aprobado por la \nAutoridad Ambiental (sic). \nEn este sentido, CENIT se permite expresar profunda preocupación, ya que después de \naprobado un Plan de compensación y remitida la información adicional solicitada por parte de \nla ANLA, evidenciando el cumplimiento de los requerimientos y del cronograma propuesto para \nla ejecución del plan, aunado con el seguimiento y control sobre las acciones de compensación \ne inversión de no menos del 1%, la ANLA niegue las áreas propuestas dentro del Banco de \nHábitat LA LOPE. \nCENIT tiene una relación contractual con el actual administrador del Banco de Hábitat Terrasos, \npara la ejecución cumplimiento de una parte de las obligaciones del expediente LAM0832, en \nconcordancia con lo dispuesto en el parágrafo primero del artículo sexto de la Resolución 1051 \ndel 05 de junio de 2017, por esta razón y dado que los 78,5 cupos de biodiversidad para el \ncumplimiento del plan de compensación de componente biótico están asignados a favor de \nCENIT ante la DBBSE del MADS; se solicita a la Autoridad Nacional de Licencias Ambientales \nla REVOCATORIA del artículo segundo de la Resolución 03050 del 21 de diciembre de 2023, \nya que no se tienen razones para no permitir el uso del Banco de Hábitat Bosque Seco Tropical \ndel Cesar – La Lope, previamente aprobado por la misma Autoridad, y por lo tanto, se solicita \nse APRUEBE la obligación ambiental a cargo de CENIT para el expediente LAM0832, bajo el \nmecanismo Banco de Hábitat Bosque Seco Tropical del Cesar – La Lope, en el marco del \ncontrato ya suscrito entre la Compañía y Terrasos S.A.S. de cara a la obligación de \ncompensación del componente biótico.\n“(…)” \n2.3. Consideraciones de la Autoridad Nacional.\nA través del Concepto Técnico 1787 del 27 de marzo de 2024, el equipo técnico de la \nAutoridad Nacional señaló:\n“(…)”\nPara la Autoridad Nacional es importante dar claridad respecto a lo manifestado por la Sociedad \nen la comunicación con radicación 20246200033422 del 10 de enero de 2024, en cuanto a que \n\nResolución No. 000802       Del 07 MAY. 2024          Hoja No. 29 de 56\n“POR LA CUAL SE RESUELVE UN RECURSO DE REPOSICIÓN”\nPágina 29 de 56\n“[E]l acto administrativo en el que se aprobaron las 78,5 Ha en Banco de Hábitat Bosque Seco \nTropical del Cesar “La Lope” es anterior al acto administrativo de aprobación del plan de \ncompensación del expediente LAM3199” antes de analizar los argumentos. De tal forma, en el \nradicado en mención la Sociedad manifiesta:\n“(…)” CENIT se permite acotar, que el acto administrativo en el que se aprobaron las 78,5 Ha \nen Banco de Hábitat Bosque Seco Tropical del Cesar “La Lope” es anterior al acto \nadministrativo de aprobación del plan de compensación del expediente LAM3199, tal como lo \nmenciona el concepto técnico No 7774 del 15 de noviembre de 2023.\nUna vez aprobado el plan de compensación por medio del artículo primero de la Resolución \n2813 del 29 de noviembre de 2022, en el que resuelve “Aprobar a la Sociedad CENIT \nTransporte y Logística de Hidrocarburos S.A.S. el Plan de compensación de 78,5 ha del \nproyecto “Sistema de transporte de hidrocarburos Pozos Colorados – Ayacucho - Galán” en \nel Banco de Hábitat del Bosque seco Tropical del Cesar “La Lope” ubicado en el Municipio de \nValledupar, Departamento del Cesar, de conformidad con lo expuesto en la parte motiva del \npresente acto administrativo.”, se dio continuidad al proceso de formalización contractual tal y \ncomo lo establece el cronograma aprobado del Plan de compensación en su página 120 \n(Figura 2), mostrando que el primer paso luego de la aprobación es la formalización de los \nacuerdos con el Banco de Hábitat dando paso con ello a la asignación de los cupos de \nbiodiversidad a favor de CENIT ante el MADS, actividades que se pueden evidenciar en la \nFigura 3 y Anexo 3. “(…)”\nAl respecto la Autoridad Nacional, aclara que mediante Resolución 2813 del 29 de noviembre \nde 2022, se le aprueba a la Sociedad CENIT TRANSPORTE Y LOGÍSTICA DE \nHIDROCARBUROS S.A.S la línea general de un plan de compensación del componente biótico \nmediante el siguiente artículo:\n“ARTÍCULO PRIMERO. Aprobar a la Sociedad CENIT TRANSPORTE Y LOGÍSTICA DE \nHIDROCARBUROS S.A.S. el Plan de compensación de 78,5 ha del proyecto “Sistema de \ntransporte de hidrocarburos Pozos Colorados – Ayacucho - Galán” en el Banco de Hábitat del \nBosque seco Tropical del Cesar “La Lope” ubicado en el Municipio de Valledupar, \nDepartamento del Cesar, de conformidad con lo expuesto en la parte motiva del presente acto \nadministrativo.”\nDe igual forma, se debe aclarar que, en este mismo acto administrativo en los artículos segundo \ny tercero, se le especifica a la Sociedad que deberá definir y especificar las acciones y las \náreas dentro del BH La Lope, para ejecutar las 78,5 ha del plan aprobado en el artículo \nprimero: \n“(…)”\nARTÍCULO SEGUNDO. La Sociedad CENIT Transporte y Logística de Hidrocarburos S.A.S, \nen el marco del desarrollo del Plan de compensación de 78,5 ha del proyecto “Sistema de \ntransporte de hidrocarburos Pozos Colorados – Ayacucho - Galán” en el Banco de Hábitat del \nBosque seco Tropical del Cesar “La Lope”, deberá: \n1. Seleccionar las actividades de las acciones de preservación y rehabilitación \nteniendo en cuenta el contexto y las condiciones del área en donde se ejecutarán las \nacciones, esto incluye considerar el estado sucesional y la fase de desarrollo en el que se \nencuentra la vegetación (…) (Subrayado y negrilla fuera de texto).\nARTÍCULO TERCERO. La Sociedad CENIT Transporte y Logística de Hidrocarburos S.A.S, \nen un término no mayor a un (1) mes contado a partir de la ejecutoria del presente acto \nadministrativo, deberá: \n\nResolución No. 000802       Del 07 MAY. 2024          Hoja No. 30 de 56\n“POR LA CUAL SE RESUELVE UN RECURSO DE REPOSICIÓN”\nPágina 30 de 56\n“(…)”\n2. Presentar la ubicación de las 78,5 ha donde será implementada la compensación \ndentro del Banco de Hábitat del Bosque seco Tropical del Cesar “La Lope” … \n(Subrayado y negrilla fuera de texto)\n“(…)”\nHasta este punto, se debe aclarar que la Sociedad CENIT TRANSPORTE Y LOGÍSTICA DE \nHIDROCARBUROS S.A.S., contaba con la aprobación de una línea general para la ejecución \ndel plan de compensación del componente biótico, pero la mencionada Resolución no aprobó \nla ubicación geográfica de las áreas específicas para la ejecución, en tanto la Sociedad \nno había presentado a ese momento la ubicación geográfica específica de las 78,5 ha \ndentro del Banco de Hábitat del Bosque seco Tropical del Cesar “La Lope”.\nLuego mediante comunicación con radicación 2022297415-1-000 del 30 de diciembre de 2022 \npresentado en el expediente LAM0832, la Sociedad entregó la respuesta a los requerimientos \nde la Resolución 2813 del 29 de noviembre de 2022, junto con las áreas específicas y acciones \npropuestas al interior del Banco de Hábitat del Bosque seco Tropical del Cesar “La Lope” y el \nsoporte confirmando la disponibilidad de cupos en este.\nUna vez realizada la evaluación, estas áreas específicas no fueron aprobadas por la Autoridad \nNacional en atención, entre otros, al traslape de áreas aprobadas en el expediente LAM3199, \npara el cumplimiento de la compensación del componente biótico mediante artículo sexto de la \nResolución 347 del 24 de febrero de 2023 modificada por la Resolución 1096 del 29 de mayo \nde 2023, así:\n“ARTÍCULO SEXTO. Aceptar las siguientes acciones de compensación a ejecutar en las \náreas de los polígonos presentados por la Sociedad C.I. COLOMBIAN NATURAL \nRESOURCES I S.A.S EN REORGANIZACIÓN., en la capa CompensacionBiodiversidad del \nanexo cartográfico de la comunicación con radicación 2022263125-1-000 del 23 de noviembre \nde 2022, de conformidad con lo expuesto en la parte motiva del presente acto administrativo \ny atendiendo a la información consignada en la siguiente tabla:“(…)”\nEn relación con lo anterior, debe resaltarse que si bien la Resolución 347 del 24 de febrero de \n2023 modificada por la Resolución 1096 del 29 de mayo de 2023  en el expediente LAM3199, \nes posterior al radicado 2022297415-1-000 del 30 de diciembre de 2022 presentado en el \nexpediente LAM0832; la información con la cual se evaluó el plan de compensación del \ncomponente biótico en el expediente LAM3199, fue presentada mediante radicados \n2022071548-1-000 del 13 de abril de 2022 y 2022071509- 1-000 del 13 de abril de 2022 \ncomplementada por la comunicación con radicación 2022263125-1-000 del 23 de noviembre de \n2022; todos anteriores al radicado 2022297415-1-000 del 30 de diciembre de 2022 \npresentado en el expediente LAM0832.\nComo se puede observar, para el momento que la Sociedad CENIT TRANSPORTE Y \nLOGÍSTICA DE HIDROCARBUROS S.A.S. presentó las áreas para su aprobación, ya estas \náreas se encontraban en evaluación en el expediente LAM3199, en el marco de la solicitud de \nacogimiento al artículo 1 de la Resolución 370 del 15 de abril de 2021, presentada por la \nSociedad C.I. COLOMBIAN NATURAL RESOURCES I S.A.S EN REORGANIZACIÓN, \nmediante las comunicaciones con radicación 2022071548-1-000 del 13 de abril de 2022 y \n2022071509-1-000 del 13 de abril de 2022 complementada por la comunicación con radicación \n2022263125-1-000 del 23 de noviembre de 2022, resaltando que en esta última se presentó \ncomo anexo un oficio emitido por el operador del Banco de Hábitat “La Lope”, manifestando la \n\nResolución No. 000802       Del 07 MAY. 2024          Hoja No. 31 de 56\n“POR LA CUAL SE RESUELVE UN RECURSO DE REPOSICIÓN”\nPágina 31 de 56\ndisponibilidad de cupos y, en consecuencia, la Autoridad Nacional emitió el Concepto técnico \n248 del 3 de febrero de 2023, referente al proyecto “Extracción de Carbón Mina la Francia” en \ntitularidad de la Sociedad C.I. COLOMBIAN NATURAL RESOURCES I S.A.S EN \nREORGANIZACIÓN., acogido mediante la Resolución 347 del 24 de febrero de 2023.\nPor lo tanto, la aprobación de las áreas objeto del presente recurso de reposición, ya se realizó \nen el expediente LAM3199. \nIgualmente, si bien la aprobación de la línea general del plan de compensación del componente \nbiótico fue primera en orden cronológico en el expediente LAM0832 cuyo titular es CENIT \nTRANSPORTE Y LOGÍSTICA DE HIDROCARBUROS S.A.S. en la Resolución de aprobación  \nno se contaba ni con la ubicación específica, ni la evaluación o aceptación de estas, \nmientras que para ese momento la Sociedad C.I. COLOMBIAN NATURAL RESOURCES I \nS.A.S EN REORGANIZACIÓN., ya había presentado estas áreas específicas en su plan para \nevaluación.\nDe esta manera queda claro que la Autoridad Nacional llevó a cabo el debido proceso de \nevaluación para estos dos expedientes y deja claro que al momento en que se realizó la \nevaluación del plan de compensación del componente biótico, presentado en el expediente \nLAM0832 cuyo pronunciamiento se realizó mediante la Resolución 3050 del 21 de diciembre de \n2023, no se había  presentado un desistimiento explícito por parte de la Sociedad C.I. \nCOLOMBIAN NATURAL RESOURCES I S.A.S. EN REORGANIZACIÓN del uso de estas áreas \nen su plan de compensación del componente biótico, que se pudiera evaluar, por lo que se \nconsidera que el argumento de la Sociedad no es procedente.\nEn tal caso, se debe aclarar a la Sociedad, que en tanto se cuente con un acto administrativo \nemitido por la Autoridad Nacional, que haya aprobado la ejecución de áreas en el marco del \nplan de compensación del componente biótico para determinado expediente, no se aceptará la \nejecución de estas mismas áreas, para esta u otra obligación en otros expedientes; lo anterior \nen cumplimiento del manual de compensaciones del componente biótico en el cual se describe:\n“Se deben identificar claramente las áreas correspondientes a cada uno de los proyectos, \nobras o actividades, diferenciando cada obligación en la Geodatabase”.\n \nUna vez aclarado lo anterior,  se observa por otra parte que, en atención a los argumentos que \nexpresa la Sociedad CENIT TRANSPORTE Y LOGÍSTICA DE HIDROCARBUROS S.A.S., \nrelacionados con la supuesta no sobreposición de áreas objeto del presente recurso de \nreposición, la Autoridad Nacional confirmó el análisis desarrollado en el Concepto Técnico 7764 \ndel 15 de noviembre de 2023 que acogió la Resolución 3050 del 21 de diciembre de 2023 en el \nque se verificaron  los aspectos referentes al proyecto “Sistema de transporte de hidrocarburos \nPozos Colorados Ayacucho – Galán” expediente LAM0832, específicamente la compensación \ndel componente biótico, de acuerdo a la información presentada mediante comunicación con \nradicación 2022297415-1-000 del 30 de diciembre de 2022. De tal forma en el concepto13 en \nmención se describe lo siguiente.\n“(…)” Si bien, las 78,5 ha seleccionadas siguen los criterios descritos en el Plan de \ncompensación aprobado en la Resolución 2813 del 29 de noviembre de 2022, la Autoridad \nNacional encuentra que en el mismo Banco de Hábitat Bosque Seco Tropical del Cesar “La \nLope” se aprobaron áreas que pertenecen a otro expediente licenciado a cargo de la Autoridad \nNacional, evidenciándose así una superposición entre las mismas, lo que indica que hay una \nduplicidad en las áreas reservadas, es decir, CENIT plantea la compensación en áreas que \nya fueron aprobadas para otro proyecto. \n13 Concepto Técnico 7764 del 15 de noviembre de 2023\n\nResolución No. 000802       Del 07 MAY. 2024          Hoja No. 32 de 56\n“POR LA CUAL SE RESUELVE UN RECURSO DE REPOSICIÓN”\nPágina 32 de 56\nLa situación manifestada ocurre con el proyecto denominado “Extracción de carbón Mina La \nFrancia” a cargo de C.I. COLOMBIAN NATURAL RESOURCES I S.A.S EN \nREORGANIZACIÓN., perteneciente al expediente LAM3199, para el cual, según lo aprobado \nen el artículo sexto de la Resolución 347 del 24 de febrero de 2023 (Aprobación del Plan de \ncompensación), se aceptaron 354,59 ha en el Banco de Hábitat Bosque Seco Tropical del \nCesar “La Lope” para ejecutar su obligación de compensación. En la siguiente figura se \nmuestra la ubicación de las áreas de compensación presentadas por CENIT y las aprobadas \npara el proyecto “Extracto Mina La Francia”: \n(Ver Figura 58. “Áreas de compensación presentadas y aprobadas para los proyectos con \nexpediente LAM0832 y LAM3199”. Pág. 40 Concepto Técnico 1787 del 27 de marzo de 2024)\nDe acuerdo con la figura anterior, lo que se pudo constatar es que de las 78,5 ha seleccionadas \npara la compensación, 71,12 ha ya fueron aprobadas para el proyecto “Extracción de Carbón \nMina La Francia” (LAM3199), es decir, el 90% del área presentada por CENIT no es válida para \ndar cumplimiento con la obligación debido a la superposición. \nAhora bien, como también puede observarse en la figura anterior, en el Banco de Hábitat existen \náreas libres sin aprobación que podrían considerarse disponibles, por lo cual, habría la \nposibilidad de plantear la alternativa de distribuir allí las 78,5 ha a cargo de CENIT, sin embargo, \nen la evaluación que se realizó al Plan de compensación presentado para el proyecto \n“Extracción de Carbón Mina La Francia” (LAM3199), se determinó que dichas áreas no eran \nviables de aprobación para la compensación por los siguientes argumentos desarrollados en el \nConcepto Técnico 248 del 3 de febrero de 202314:  “(…)”\n \n• Se observa para las actividades asociadas a Cordón protector, enriquecimiento y liberación \no nucleación, áreas que presentan cobertura de vegetación arbórea densa en la totalidad o \nla mayor parte del área del polígono. \n(…) [N]o se aceptan áreas en donde se proponen este tipo de acciones ya que al realizar \nanálisis cartográfico y de condiciones actuales de estas mediante el uso de imágenes \nsatelitales, se evidencia que la mayor parte del área del polígono presentado o su totalidad \ncuenta con cobertura arbórea ya establecida, que no tiene área suficiente de claros o zonas \nespecíficas donde se evidencien áreas disturbadas o degradadas evidentes para en ellas \nrealizar el enriquecimiento propuesto y en donde la adicionalidad al implementar la acción \nno es representativa ni proporcional en relación al área total del polígono, pudiendo tener \notras alternativas de áreas en donde se requieren acciones de este tipo en mayor proporción. \n“(…)” \n• Respecto a las áreas que se niegan en la Alternativa 6, correspondiente al Banco de Hábitat \n“La Lope”, (…) [S]e observó que en relación con la totalidad del polígono (s), el área visible \ndel claro es mínima. En este caso la Sociedad podrá proponer una acción principal diferente \ncon la implementación de acciones adicionales a la actividad principal, con el fin de que se \npueda garantizar adicionalidad en el área. De tal forma, con las condiciones que se \npresentan en el plan teniendo como tipo de actividad principal la de enriquecimiento no se \naceptan estas áreas para esa actividad (Ver tabla 13).\n “(…)” \n14 Acogido mediante la Resolución 347 del 24 de febrero de 2023\n\nResolución No. 000802       Del 07 MAY. 2024          Hoja No. 33 de 56\n“POR LA CUAL SE RESUELVE UN RECURSO DE REPOSICIÓN”\nPágina 33 de 56\nDe lo anterior es pertinente señalar que las áreas dentro del Banco de Hábitat que no fueron \naprobadas para el proyecto “Extracción de Carbón Mina la Francia” (LAM3199), \ncorresponden principalmente a la cobertura de bosque fragmentado con vegetación \nsecundaria, como se muestra a continuación:\n(Ver Figura 59. “Coberturas de la tierra de las áreas no aprobadas en el LAM3199 en el \nBanco de Hábitat Bosque Seco Tropical del Cesar “La Lope”. Pág. 42 Concepto Técnico \n1787 del 27 de marzo de 2024)\nAhora, en el caso del proyecto “Sistema de transporte de hidrocarburos Pozos Colorados \nAyacucho – Galán” a cargo de CENIT TRANSPORTE Y LOGÍSTICA DE HIDROCARBUROS \nS.A.S., el argumento de inviabilidad precitado también es aplicable pues para la cobertura \nde bosque fragmentado con vegetación secundaria la Sociedad propone acciones de \nenriquecimiento. Con esto, tal como se precisó en la evaluación del Plan de compensación \nque se realizó en el Concepto Técnico 6534 del 24 de octubre de 2022, que fue aprobado \nen la Resolución 2813 del 29 de noviembre de 2022, debido a la condición de las coberturas \nboscosas, las acciones de enriquecimiento solamente podrían ejecutarse en coberturas de \npastos enmalezados y vegetación secundaria.\n“(…)”\nCon respecto a lo anterior, y en relación con la superposición de áreas presentadas para \nevaluación del Plan de compensación del componente biótico, la Autoridad Nacional dando \ncumplimiento al debido proceso realiza nuevamente un estudio espacial con respecto a  las \náreas asignadas en el Banco de Hábitat Bosque Seco Tropical del Cesar “La Lope” presentadas \nmediante comunicación con radicación 2022297415-1-000 del 30 de diciembre de 2022, \nreafirmando lo concluido en el Concepto técnico 7764 del 15 de noviembre de 202315 con \nrespecto al solapamiento de áreas presentadas para evaluación del Plan de compensación del \ncomponente biótico del proyecto “Sistema de transporte de hidrocarburos Pozos Colorados \nAyacucho – Galán”, expediente LAM0832, frente a las áreas aprobadas para la obligación de \ncompensación del componente biótico con el  proyecto “Extracción de carbón Mina la Francia” \nexpediente LAM3199, cuyo titular corresponde a la Sociedad C.I. COLOMBIAN NATURAL \nRESOURCES I S.A.S. EN REORGANIZACION, como se muestra en las figuras a continuación:\n(Ver Figura 7. “Mapa general de predios del plan de compensación del LAM0832 e inversión \nLAM3199 En BH La Lope vs áreas aprobadas para compensación del expediente LAM3199 en \nBH “La Lope””. Pág. 43 Concepto Técnico 1787 del 27 de marzo de 2024)\nEn la Figura 7 se pueden observar los predios propuestos para dar cumplimiento a las \nobligaciones de compensación del componente biótico, por CENIT TRANSPORTE Y \nLOGÍSTICA DE HIDROCARBUROS S.A.S. (LAM0832), versus los ya aprobados y no \naprobados mediante artículo sexto de la Resolución 0347 del 24 de febrero de 2023 modificada \npor la Resolución 1096 del 29 de mayo de 2023  en el proyecto de “Extracción de Carbón Mina \nla Francia” (LAM3199), dentro del Banco de Hábitat “Bosque Seco Tropical del Cesar “La Lope”, \nconfirmándose el traslape existente.\nDe acuerdo con la figura anterior, lo que se pudo constatar es que de las 78,5 ha seleccionadas \npara la compensación del componente biótico del expediente LAM0832, 71,12 ha ya fueron \naprobadas para el proyecto “Extracción de Carbón Mina la Francia” (LAM3199), es decir, el 90% \ndel área presentada por CENIT TRANSPORTE Y LOGÍSTICA DE HIDROCARBUROS S.A.S. \nno es válida para dar cumplimiento con la obligación debido a la superposición.\n15 Acogido mediante Resolución 3050 del 21 de diciembre de 2023\n\nResolución No. 000802       Del 07 MAY. 2024          Hoja No. 34 de 56\n“POR LA CUAL SE RESUELVE UN RECURSO DE REPOSICIÓN”\nPágina 34 de 56\nAhora bien, con respecto a la superposición entre áreas presentadas entre los expedientes \nLAM3199 y LAM0832, la Sociedad mediante comunicación con radicación 20246200033422 del \n10 de enero de 2024 correspondiente al Recurso de Reposición objeto del concepto técnico16, \npresenta evidencia de la separación de 78,5 ha con cargo al expediente LAM0832 y 155 ha con \ncargo al expediente LAM2975, dentro del Banco de Hábitat Bosque Seco Tropical del Cesar “La \nLope”, por parte de la empresa estructuradora del banco Terrasos S.A.S, documentación \nentregada ante el Ministerio de Ambiente y Desarrollo Sostenible-MADS, mediante \ncomunicaciones con radicación 2023E1048957 del 19 de octubre de 2023 y 2023E1022188 del \n19 de mayo de 2023. Debe resaltarse que ninguno de estos oficios especifica que polígonos \nson los separados dentro del banco de hábitat por lo que no permiten la trazabilidad de la \nseparación de cupos.\nIgualmente, debe resaltarse que estos oficios no habían sido radicados al expediente LAM0832, \nal momento de la evaluación del plan de compensación del componente biótico, y finalización \ndel concepto técnico 7764 del 15 de noviembre de 202317 por tanto, si bien se verifican, no \nserán objeto de evaluación en el concepto técnico18.\nAsí mismo una vez verificados los argumentos anexos a estos oficios es de aclarar que en \nrelación con el radicado MADS 2023E1048957 del 19 de octubre de 2023, no se entiende por \nparte de la Autoridad Nacional el por qué la presentación del documento de separación de \n155,28 cupos a nombre de la Sociedad CENIT TRANSPORTE Y LOGÍSTICA DE \nHIDROCARBUROS S.A.S. en el expediente LAM2947, el cual no está relacionado con el \nexpediente objeto de recurso de reposición. Este documento se presenta a continuación:\n(Ver Figura. Pág. 45 Concepto Técnico 1787 del 27 de marzo de 2024)\nPor otra parte, en la comunicación con radicación MADS 2023E1022188 del 19 de mayo de \n2023, anexo al recurso de reposición, se reporta la “asignación” de 78,5 ha, al expediente \nLAM0832, donde se señala: \n(Ver Figura. Pág. 46 Concepto Técnico 1787 del 27 de marzo de 2024)\nRespecto de lo anterior, en relación con la “Asignación” de cupos del Banco de Hábitat “La \nLope”, en la comunicación con radicación 20246200033422 del 10 de enero de 2024, la \nSociedad describe lo siguiente:\n“(…)\nEs pertinente distinguir los actos de RESERVA y ASIGNACIÓN de cupos de biodiversidad, en \ndonde, la reserva de cupos hace referencia a la disponibilidad y expectativa que existe para \nusar cierta cantidad de cupos de biodiversidad, sujeto a que las partes lleguen a un acuerdo \nformal y contractual; mientras que, la asignación de cupos ya cuenta con un acto administrativo \nde aprobación del plan de compensación y/o inversión para la obligación ambiental por parte \nde la Autoridad Ambiental, como es el caso del expediente LAM0832 y un acuerdo formal \ncontractual entre el titular de la obligación y el responsable del Banco de Hábitat, estableciendo \nel proceso de asignación oficial de los cupos de biodiversidad ante el DBBSE del MADS…\n“(…)”\n…Por lo tanto, si bien hay empresas que presentan planes de compensación y/o inversión de \n16 Concepto Técnico 1787 del 27 de marzo de 2024\n17 Acogido mediante la Resolución 3050 del 21 de diciembre de 2023\n18 Concepto Técnico 1787 del 27 de marzo de 2024\n\nResolución No. 000802       Del 07 MAY. 2024          Hoja No. 35 de 56\n“POR LA CUAL SE RESUELVE UN RECURSO DE REPOSICIÓN”\nPágina 35 de 56\nno menos del 1% aprobados por parte de la ANLA o una Corporación Autónoma Regional, \ncomo es el caso puntual de la Sociedad C.I. COLOMBIAN NATURAL RESOURCES I S.A.S. \n(En adelante “CNR I”), en donde, a través de la Resolución 00347 del 24 de febrero de 2023 \naprobaron algunas alternativas para las acciones del plan de compensación, entre ellas la \nalternativa 2 “BH-”La Lope””, es de aclarar que según lo informado por Terrasos S.A.S., ésta \naún no formalizan su ejecución a través de un acuerdo o contrato, en concordancia con lo \ndispuesto en el parágrafo primero del artículo sexto de la Resolución 1051 del 05 de junio de \n2017…\n CENIT tiene una relación contractual con el actual administrador del Banco de Hábitat \nTerrasos, para la ejecución cumplimiento (sic) de una parte de las obligaciones del expediente \nLAM0832, en concordancia con lo dispuesto en el parágrafo primero del artículo sexto de la \nResolución 1051 del 05 de junio de 2017, por esta razón y dado que los 78,5 cupos de \nbiodiversidad para el cumplimiento del plan de compensación de componente biótico están \nasignados a favor de CENIT ante la DBBSE del MADS; se solicita a la Autoridad Nacional de \nLicencias Ambientales la REVOCATORIA del artículo segundo de la Resolución 03050 del 21 \nde diciembre de 2023, ya que no se tienen razones para no permitir el uso del Banco de Hábitat \nBosque Seco Tropical del Cesar – “La Lope”, previamente aprobado por la misma Autoridad, \ny por lo tanto, se solicita se APRUEBE la obligación ambiental a cargo de CENIT para el \nexpediente LAM0832, bajo el mecanismo Banco de Hábitat Bosque Seco Tropical del Cesar \n– “La Lope”, en el marco del contrato ya suscrito entre la Compañía y Terrasos S.A.S. de cara \na la obligación de compensación del componente biótico”. \n“(…)”\nEn relación con la situación manifestada por parte de la Sociedad, respecto a que según lo \ndescrito en su argumento, para el proyecto denominado “Extracción de carbón Mina La Francia” \na cargo de C.I. COLOMBIAN NATURAL RESOURCES I S.A.S., perteneciente al expediente \nLAM3199, se presenta una “Reserva” más no una “Asignación”, debe aclararse que  según lo \naprobado en el artículo sexto de la Resolución 347 del 24 de febrero de 2023 modificada por la \nResolución 1096 del 29 de mayo de 2023  (Aprobación del Plan de compensación), se aceptaron \n354,59 ha en el Banco de Hábitat Bosque Seco Tropical del Cesar ““La Lope”” para ejecutar su \nobligación de compensación, de conformidad con la evaluación realizada al Plan de \ncompensación del componente biótico presentado mediante radicado 2022263125-1-000 del 23 \nde noviembre de 2022, en el cual se solicitó a la Autoridad Nacional la aprobación de la \nejecución en esas áreas, para el cumplimiento de la obligación.\nAsí mismo junto con el plan se anexó un oficio emitido por Terrasos S.A.S, de fecha 22 de \nnoviembre de 2022 en el cual el operador del banco de hábitat en mención informó que:\n “(…) [A]ctuando en mi calidad de Representante Legal de Terrasos, identificada con Nit (sic) \n900582496-0, me permito confirmar la disponibilidad de cupos de biodiversidad que permitirán \ndar alcance a la obligación de compensación a cargo de CNR I, en el Banco de Hábitat Bosque \nSeco Tropical del Cesar \"“La Lope””, localizado en el municipio de Valledupar, Cesar, el cual \nse encuentra registrado ante la Dirección de Bosques, Biodiversidad y Servicios \nEcosistémicos del Ministerio de Ambiente y Desarrollo Sostenible - MADS, según consta en \nel radicado N° 2101-2-3384 del 7 de octubre de 2021”. \nCon base en lo anterior, se evaluaron y aprobaron las mencionadas áreas en el expediente \nLAM3199. Por tanto, conforme sus funciones, la Autoridad Nacional ya emitió un acto \nadministrativo vía Resolución en la cual conforme la solicitud presentada por C.I. COLOMBIAN \nNATURAL RESOURCES I S.A.S., se pronunció de fondo frente al plan de compensación del \nexpediente LAM3199 y las áreas aprobadas para su ejecución, que son objeto de sobreposición \ncon las áreas presentadas como propuesta en el expediente LAM0832.\n\nResolución No. 000802       Del 07 MAY. 2024          Hoja No. 36 de 56\n“POR LA CUAL SE RESUELVE UN RECURSO DE REPOSICIÓN”\nPágina 36 de 56\nA lo anterior debe sumarse que esta no es la única situación de sobreposición presentada con \nrespecto a estas áreas ubicadas en el Banco de Hábitat Bosque Seco Tropical del Cesar – “La \nLope”, ya que, una vez realizada una nueva revisión dentro de los sistemas de información de \nlicencias ambientales SILA, la Autoridad Nacional,  encontró que estas áreas, ya habían sido \npropuestas también, dentro un plan de compensación del componente biótico, para el \nexpediente LAM1862 en titularidad de la Sociedad CNR III LTD SUCURSAL COLOMBIA EN \nREORGANIZACIÓN, entregado por la Sociedad en su solicitud de acogimiento a la Resolución \n370 del 15 de abril de 2021, mediante comunicaciones con radicación 2022071550-1-000 y \n2022071513-1-000 del 13 de abril de 2022, no aceptadas por las mismas razones por las que \nno fueron aceptadas en el expediente LAM0832, como consta en el concepto técnico 01542 del \n31 de marzo de 2023, el cual sirvió como insumo para la expedición de la Resolución 0842-4 \ndel 28 de abril de 2023, asociada al expediente LAM1862:\n“(…)” “La Lope”, de la alternativa 6 Banco de Hábitat Bosque Seco Tropical del Cesar-”La \nLope”.; no hacen parte de esta evaluación por contener los polígonos citados anteriormente y \nque fueron objeto de evaluación para el expediente LAM3199 y quedaron bajo el \npronunciamiento realizado en la Resolución 347 del 24 de febrero de 2023…\nDebido a que el Banco de Hábitat “La Lope”, fue propuesto en otro expediente y presenta las \nmismas áreas que las presentadas en este Plan de Compensación, este no se tiene en cuenta \npor cuanto no es factible aprobar los mismos polígonos para obligaciones de compensación \nen proyectos diferentes “(…)”\nConsecuentemente la Resolución 0842-4 del 28 de abril de 2023, definió en su artículo cuarto:\n“ARTÍCULO CUARTO: No aprobar a la Sociedad COLOMBIAN NATURAL RESOURCES - \nCNR III LTD SUCURSAL COLOMBIA EN REORGANIZACIÓN, de conformidad con lo \nexpuesto en la parte motiva del presente acto administrativo los predios denominados: \na. El Florito \nb. La Descubierta \nc. La Lope \nd. Lote #2 El Florito \ne. Lote #2 El Paraíso \nf. Mata de Lata”\nDe tal forma, la Autoridad Nacional observa con preocupación cómo unas áreas que ya se \nencuentran aprobadas mediante acto administrativo (Artículo sexto de la Resolución 347 del 24 \nde febrero de 2023 modificada por la Resolución 1096 del 29 de mayo de 2023) están siendo \npresentadas, para su aprobación igualmente en otros expedientes, (LAM1862 y LAM0832), \njunto con oficios emitidos por el operador del Banco de Hábitat del Bosque Seco Tropical “La \nLope” manifestando la “disponibilidad de cupos”.\nAhora bien, dentro de los argumentos presentados por la Sociedad, se alude en relación con lo \ndescrito en párrafo anterior, a que no hay tal traslape, dado que el operador del banco remitió \ncomunicaciones al MADS, al respecto de la contabilidad de cupos de biodiversidad “asignados” \nsegún la obligación que tiene ese operador con el MADS conforme la Resolución 1051 de 2017.\n\nResolución No. 000802       Del 07 MAY. 2024          Hoja No. 37 de 56\n“POR LA CUAL SE RESUELVE UN RECURSO DE REPOSICIÓN”\nPágina 37 de 56\nIgualmente sostiene la Sociedad que con esto se valida la “Asignación” de los cupos \npresentados como propuesta ante la Autoridad Nacional para el expediente LAM0832 y no para \nel LAM3199, además de derivar que las actuaciones del operador del Banco de Hábitat \n(Terrasos S.A.S) realizadas frente al MADS, son suficientes para la aprobación de estas áreas \nen el marco de la obligación de la compensación del componente biótico del expediente \nLAM0832, obligación que se encuentra en competencia de la Autoridad Nacional.\nSe observa entonces que el argumento presentado por la Sociedad pretende invalidar lo \ndispuesto por la Autoridad Nacional, en la Resolución 347 del 24 de febrero de 2023 modificada \npor la Resolución 1096 del 29 de mayo de 2023 en el expediente LAM3199, y la Resolución \n0842-4 del 28 de abril de 2023 en el expediente LAM1862.\nLa Autoridad Nacional encuentra que esta situación dificulta el adecuado desarrollo de sus \nfunciones, las cuales por norma superior son distintas a las del Ministerio de Ambiente y \nDesarrollo Sostenible, por lo que se permite recordar a la Sociedad CENIT TRANSPORTE Y \nLOGÍSTICA DE HIDROCARBUROS S.A.S., las funciones que le han sido dadas mediante \nDecreto 3573 de 27 de septiembre de 2011.\n“(…)”\nArtículo 2. Objeto. La Autoridad Nacional de Licencias Ambientales -ANLA- es la encargada \nde que los proyectos. obras o actividades sujetos de licenciamiento, permiso o trámite \nambiental cumplan con la normativa ambiental, de tal manera que contribuyan al desarrollo \nsostenible ambiental del País.\nArtículo 3. Funciones. La Autoridad Nacional de Licencias Ambientales -ANLA cumplirá, las \nsiguientes funciones:\n1. \n Otorgar o negar las licencias, permisos y trámites ambientales de \ncompetencia del Ministerio de Ambiente y Desarrollo Sostenible, de conformidad con \nla ley y los reglamentos.\n(…)\nArtículo 13. Funciones de la Subdirección de Evaluación y Seguimiento. Las funciones de \nla Subdirección de Evaluación y Seguimiento son las siguientes:\n1.Evaluar las solicitudes de licencias ambientales para definir la viabilidad ambiental de \nlos proyectos, obras o actividades.\n2.  Emitir conceptos técnicos que soporten los actos administrativos para el \notorgamiento de las licencias ambientales y los que sustenten los actos\nadministrativos en la etapa de seguimiento ambiental.\n3.Preparar los actos administrativos mediante los cuales se otorgan o niegan licencias \nambientales.\n“(…)”\n9. Realizar el seguimiento a las licencias ambientales. \n10. Dar lineamientos y directrices en materia de licencias ambientales de competencia \ndel Ministerio, sujetos a la inversión forzosa de no menos del 1 % y/o compensación \n\nResolución No. 000802       Del 07 MAY. 2024          Hoja No. 38 de 56\n“POR LA CUAL SE RESUELVE UN RECURSO DE REPOSICIÓN”\nPágina 38 de 56\nforestal, previstas en la Ley 99 de 1993, artículo 43 y el Decreto 1900 de 2006 o la \nnorma que lo modifique o sustituya\n“(…)”\nDe acuerdo con lo anterior, la Autoridad Nacional cumplió de manera clara y definitiva con sus \nfunciones al otorgar la aprobación del Plan de Compensación del Componente Biótico al \nproyecto denominado “Extracción de carbón Mina La Francia” a cargo de C.I. COLOMBIAN \nNATURAL RESOURCES I S.A.S EN REORGANIZACIÓN., perteneciente al expediente \nLAM3199, el cual se encuentra vigente y en ejecución ante la Autoridad Nacional, dado que al \nmomento de desarrollarse la evaluación del plan de compensación del expediente LAM0832, la \nSociedad C.I. COLOMBIAN NATURAL RESOURCES I S.A.S. EN REORGANIZACIÓN no ha \npresentado un desistimiento explícito de estas áreas y actividades dentro de su plan de \ncompensación aprobado mediante artículo sexto de la Resolución 347 del 24 de febrero de 2023 \nmodificada por la Resolución 1096 del 29 de mayo de 2023  y mientras esta condición no cambie  \ny sea evaluada tal situación en el marco de las competencias asignadas a la Autoridad Nacional, \nestas áreas no serán evaluadas ni aprobadas para el cumplimiento de otras obligaciones \nasociadas a  otro expediente manteniendo los principios del debido proceso.\nDebe aclararse que de acuerdo con el parágrafo 1 del Artículo sexto de la Resolución 1051 del \n05 de junio de 2017 por la cual se reglamentan los Bancos de hábitat “Los acuerdos que se \ncelebren respecto de cada Banco de Hábitat tanto en su financiamiento como en su \nimplementación únicamente comprometen la responsabilidad de quienes los suscriben”.\nIgualmente, el cumplimento de las funciones de la Autoridad Nacional no puede ser socavado \nen perjuicio de las relaciones comerciales entre empresas titulares de expedientes y sus \nproveedores comerciales.\nLo anterior teniendo en cuenta que conforme lo establecido en el manual de compensaciones \ndel componente biótico, los bancos de hábitat son mecanismos para la implementación de las \ncompensaciones y no corresponden a la acción en sí y que conforme a lo definido en el \nparágrafo 2 del Artículo sexto de la Resolución 1051 del 05 de junio de 2017 por la cual se \nreglamentan los Bancos de hábitat en cuanto a la obligación a que hace referencia el concepto \ntécnico19, la Autoridad Nacional no tiene ninguna relación directa con los responsables de los \nBancos de Hábitat, dado que, en el marco de sus funciones y competencias, hace control y \nseguimiento a las obligaciones impuestas a los proyectos objeto de licencia ambiental, cuyos \nresponsables son los titulares de la misma.\nPor tanto, - los acuerdos comerciales entre la Sociedad CENIT TRANSPORTE Y LOGÍSTICA \nDE HIDROCARBUROS S.A.S. y la empresa Terrasos S.A.A, no son válidos para definir los \nresultados de la evaluación de los planes de compensación del componente biótico o verificar \nel cumplimiento a las obligaciones de la licencia. \nIgualmente, la pretensión de la Sociedad, de revocar el artículo segundo, con los argumentos \nmencionados respecto a la sobreposición de áreas verificada por la Autoridad Nacional, no se \nencuentra conforme plasmado en la Resolución 1051 del 05 de junio de 2017, que define en \nsu artículo 6 parágrafo 2:\n“(…)”\nArtículo 6. Financiación del Banco de Hábitat. Los Bancos de Hábitat, podrán tener total o \nparcialmente las siguientes fuentes:\n19 Concepto Técnico 1787 del 27 de marzo de 2024\n\nResolución No. 000802       Del 07 MAY. 2024          Hoja No. 39 de 56\n“POR LA CUAL SE RESUELVE UN RECURSO DE REPOSICIÓN”\nPágina 39 de 56\n… Parágrafo 2: … En todo caso, la autoridad ambiental competente definirá la viabilidad de \neste mecanismo de implementación de dichas obligaciones ambientales, el cual procederá \nsiempre y cuando se cumpla con los requisitos legales y técnicos definidos para las mismas.  \nCuando se agrupen requerimientos de varias obligaciones en un mismo Banco de \nhábitat, no podrá haber traslapes entre ellas y su seguimiento pueda ser medible de \nmanera independiente. (Subrayado fuera del texto)\nLo anterior no implica una cesión de la obligación ambiental, la cual se mantendrá en cabeza \nde los titulares del instrumento de manejo y control ambiental. \n“(…)”\nEs por lo anterior, que es claro que las áreas aprobadas para cada obligación y expediente \ndeben ser distinguibles geográficamente y se debe poder verificar su cumplimiento de manera \nindependiente.\nPor otra parte, la Sociedad argumenta dentro del radicado 20246200033422 del 10 de enero de \n2024 lo siguiente.\n“De esta manera, se puede concluir que mientras que Terrasos S.A.S. no haya notificado \nformalmente a la DBBSE del MADS sobre la asignación de cupos, la disponibilidad de áreas \nen el Banco de Banco de Hábitat Bosque Seco Tropical del Cesar - “La Lope” para la ejecución \npor parte de CENIT, se mantiene.”\nEs preciso aclarar que NO es función de la Autoridad Nacional la verificación de información de \nBancos de Hábitat ante el Ministerio, como fue muy bien definido por este, en la Resolución \n1051 de 2017 y la guía de “BANCOS DE HÁBITAT” Mecanismo para la implementación de \ncompensaciones bióticas” de 2019, en la cual define los roles y responsabilidades de los \ndistintos actores involucrados en el desarrollo, implementación y monitoreo de los Bancos de \nHábitat, los cuales se resumen en la figura 8.\n(Ver Figura 8 “Entidades y sus roles en el contexto de Bancos de Hábitat” Pág. 53 Concepto \nTécnico 1787 del 27 de marzo de 2024)\nSe observa en la figura anterior, que el encargado de hacer seguimiento a los bancos de hábitat \ny su implementación es el Ministerio mediante la Dirección de Bosques, Biodiversidad y \nServicios Ecosistémicos, no la Autoridad Nacional, quien tiene en su competencia la obligación \nde la compensación del componente biótico y exige su cumplimiento es al titular de la licencia \nambiental y no al operador del Banco de Hábitat, por lo que si bien existen canales de \ncomunicación entre entidades la ejecución de la funciones de la Autoridad Nacional no se deben \nver limitadas por la confusión de roles realizadas por otros actores del proceso en este caso la \nSociedad titular de la Licencia Ambiental y el responsable del Banco de Hábitat, dado que la \ncontabilidad del banco de hábitat es un requisito exigido al responsable del banco por el \nMinisterio en mención dentro de su proceso de monitoreo del banco de hábitat, como se \nencuentra definido en  el numeral 2 del artículo 7 de la Resolución 1051 del 05 de junio de 2017.\nAhora bien , la Autoridad Nacional cumplió a cabalidad con la función descrita en el parágrafo \n2 del Artículo sexto de la Resolución 1051 del 05 de junio de 2017, evaluando las áreas y \nactividades propuestas por el titular de la licencia ambiental del expediente LAM3199 en el plan \nde compensación de componente biótico del proyecto “Extracción de carbón Mina La Francia”, \nel cual fue evaluado y aprobado mediante el artículo sexto de la Resolución 347 del 24 de \nfebrero de 2023 modificada por la Resolución 1096 del 29 de mayo de 2023  y en pro de la \n\nResolución No. 000802       Del 07 MAY. 2024          Hoja No. 40 de 56\n“POR LA CUAL SE RESUELVE UN RECURSO DE REPOSICIÓN”\nPágina 40 de 56\nlegalidad y transparencia en sus procesos la Autoridad Nacional no puede evaluar la mismas \náreas en otros expedientes.\nDejando esto claro, los argumentos relacionados a la “Asignación” de cupos de \nbiodiversidad del Banco de Hábitat, atendiendo asuntos contractuales descritos por la \nSociedad, y la supuesta no sobreposición de áreas, no se consideran procedentes para \nla Autoridad Nacional.\nPor otra parte, una vez realizada la verificación de las áreas objeto del recurso de reposición se \nencuentra que hay dos (2) polígonos que no presentan superposición con áreas aprobadas \nen otro expediente, por tanto, para estos se realiza el correspondiente análisis espacial \necológico. \nA continuación, se presenta una figura general de los polígonos no aprobados en ningún \nexpediente, presentados por la Sociedad dentro del plan de compensación del componente \nbiótico:\n(Ver Figura 9 “Polígonos propuestos para la compensación del componente biótico en el \nexpediente LAM0832 que no se encuentran asignados a ningún expediente” Pág. 55 Concepto \nTécnico 1787 del 27 de marzo de 2024)\nAdicionalmente durante el análisis espacial se pudo evidenciar como se observa en la figura 9 \nque \nexisten \n4 \npolígonos \n(BHLL_LAM0832_E_19, \nBHLL_LAM0832_E_17, \nBHLL_LAM0832_E_16 y BHLL_LAM0832_E_16) correspondientes a 7.38 ha, que no se \nencuentran asignados a ningún expediente, los cuales se observan en color amarillo, dichos \npolígonos, la Sociedad los caracteriza como una cobertura de bosque fragmentado, los cuales \nserán analizados a mejor detalle en las siguientes imágenes.\n(Ver Figura 10 “Polígono Compensación BHLL_LAM0832_E_19” Pág. 56 Concepto Técnico \n1787 del 27 de marzo de 2024)\nMediante el radicado 2022297415-1-000 del 30 de diciembre de 2022, la Sociedad caracteriza \neste polígono como cobertura Bosque fragmentado proponiendo actividades de restauración \npara este, pero como se puede observar en la imagen anterior, el área corresponde a un bosque \ndenso con dosel cerrado, es de anotar que en la imagen anterior no hay evidencia de  áreas \ntransformadas o degradadas que muestren la necesidad de un proceso de restauración en este, \ncontrario a lo propuesto por la Sociedad; por lo que la Autoridad Nacional no acepta esta área \nni la actividad de restauración propuesta por la Sociedad dentro del plan de compensación del \ncomponente biótico  presentado.\n(Ver Figura 11 “Polígono Compensación BHLL_LAM0832_E_17” Pág. 57 Concepto Técnico \n1787 del 27 de marzo de 2024)\nMediante comunicación con radicación 2022297415-1-000 del 30 de diciembre de 2022, la \nSociedad caracteriza este polígono como cobertura Bosque fragmentado proponiendo \nactividades de restauración  para este, pero como se puede observar en la imagen anterior, el \nárea corresponde a un bosque denso con dosel cerrado, es de anotar que en la imagen anterior \nno hay evidencia de  áreas transformadas o degradadas que muestren la necesidad de un \nproceso de restauración en este; por lo que la Autoridad Nacional no acepta esta área ni la \nactividad de restauración propuesta por la Sociedad dentro del plan de compensación del \ncomponente biótico presentado.\n(Ver Figura 12 “Polígono Compensación BHLL_LAM0832_E_16” Pág. 58 Concepto Técnico \n1787 del 27 de marzo de 2024)\n\nResolución No. 000802       Del 07 MAY. 2024          Hoja No. 41 de 56\n“POR LA CUAL SE RESUELVE UN RECURSO DE REPOSICIÓN”\nPágina 41 de 56\nMediante comunicación con radicación 22022297415-1-000 del 30 de diciembre de 2022, la \nSociedad caracteriza este polígono como cobertura Bosque secundario proponiendo \nactividades de restauración  para este, pero como se puede observar en la imagen anterior, el \nárea corresponde efectivamente a un bosque denso con dosel cerrado, es de anotar que en la \nimagen anterior no hay evidencia de  áreas transformadas o degradadas que muestren la \nnecesidad de un proceso de restauración en este, contrario a lo propuesto por la Sociedad; por \nlo que la Autoridad Nacional no acepta esta área ni la actividad de restauración propuesta por \nla Sociedad dentro del plan de compensación del componente biótico presentado.\n(Ver Figura 13 “Polígono Compensación BHLL_LAM0832_E_18” Pág. 59 Concepto Técnico \n1787 del 27 de marzo de 2024)\nMediante el comunicación con radicación 2022297415-1-000 del 30 de diciembre de 2022, la \nSociedad caracteriza este polígono como cobertura Bosque secundario proponiendo \nactividades de restauración  para este, pero como se puede observar en la imagen anterior, el \nárea corresponde efectivamente a un bosque denso con dosel cerrado, es de anotar que en la \nimagen anterior no hay evidencia de áreas transformadas o degradadas que muestren la \nnecesidad de un proceso de restauración en este, contrario a lo propuesto por la Sociedad; por \nlo que la Autoridad Nacional no acepta esta área ni la actividad de restauración propuesta por \nla Sociedad dentro del de compensación del componente biótico presentado.\nDe otro lado, se observa que mediante comunicación con radicación 20246200264842 del 08 \nde marzo de 2024, presentado en el expediente LAM0832, la Sociedad Terrasos S.A.S. solicitó \nse tenga como prueba sobreviniente la comunicación con remitente C.I. COLOMBIAN \nNATURAL RESOURCES I S.A.S. EN REORGANIZACIÓN del 12 de febrero de 2024, enviada \na la Autoridad Nacional en respuesta a una solicitud de información realizada mediante radicado \n20244700052081 del 25 de enero de 2024 en el expediente LAM3199.\nTal como se describió en los argumentos realizados al respecto en el artículo primero, la \nAutoridad Nacional concluyó que esta no aporta ninguna nueva información que dé lugar a un \ncambio en la decisión tomada toda vez que la Sociedad C.I. COLOMBIAN NATURAL \nRESOURCES I S.A.S EN REORGANIZACIÓN, es el titular de licencia del expediente LAM3199, \nque cuenta con las áreas aprobadas mediante artículo sexto de la Resolución 347 del 24 de \nfebrero de 2023 modificada por la Resolución 1096 del 29 de mayo de 2023  ubicadas en el \nBanco de Hábitat Bosque Seco Tropical del Cesar “La Lope” que se sobreponen con las \npresentadas en el expediente LAM0832. \nSe aclara que la Autoridad Nacional no tiene evidencia de un desistimiento explícito de C.I. \nCOLOMBIAN NATURAL RESOURCES I S.A.S EN REORGANIZACIÓN acerca del uso de \nestas áreas para el cumplimiento de sus obligaciones de compensación al momento de realizar \neste concepto técnico20, y que como ya fue explicado, mientras los predios ya hayan sido \naprobados en otro expediente, estos no podrán ser aprobados en otro, dada la condición de \nsuperposición de áreas.\nConsiderando la información anterior,  la Autoridad Nacional reafirma lo plasmado en la \nResolución 3050 del 21 de diciembre de 2023,  en el sentido de no aceptar a la Sociedad CENIT \nTRANSPORTE Y LOGÍSTICA DE HIDROCARBUROS S.A.S. el plan de compensación del \ncomponente biótico presentado mediante comunicaciones con radicación 2022252085-1-000 \ndel 9 de noviembre de 2022 y 20236200378342 del 21 de julio de 2023, referente a las \nactividades de preservación y restauración en el área de 78,5 ha dentro del Banco de Hábitat \nBosque Seco Tropical del Cesar “La Lope”.\n20 Concepto Técnico 1787 del 27 de marzo de 2024\n\nResolución No. 000802       Del 07 MAY. 2024          Hoja No. 42 de 56\n“POR LA CUAL SE RESUELVE UN RECURSO DE REPOSICIÓN”\nPágina 42 de 56\nPor tanto, en atención a todas las consideraciones presentadas por la Autoridad Nacional en el \nconcepto técnico21, se considera que si existe la superposición con las áreas aprobadas \nmediante el artículo sexto de la Resolución 347 del 24 de febrero de 2023 modificada por la \nResolución 1096 del 29 de mayo de 2023   para el expediente LAM3199 cuyo titular de la licencia \nambiental es la Sociedad C.I. COLOMBIAN NATURAL RESOURCES I S.A.S. EN \nREORGANIZACIÓN, por lo que estas áreas no son viables de aceptar para el cumplimiento de \nla obligación de compensación del componente biótico del expediente LAM0832.\nIgualmente, para las áreas que no presentaron la superposición, una vez realizado el análisis \npertinente, se verificó en el concepto técnico22 que en todo caso desde el punto de vista técnico \nno son viables de aceptar.\nDe acuerdo con lo anterior en ausencia de evidencia objetiva que permita cambiar la decisión \ntomada en el Concepto técnico 7764 del 15 de noviembre de 2023 acogido mediante la \nResolución 3050 del 21 de diciembre de 2023, esta se confirma.\n“(…)”\nTeniendo en cuenta que la Sociedad CENIT TRANSPORTE Y LOGÍSTICA DE \nHIDROCARBUROS S.A.S., argumenta tener un “Mejor derecho” que la Sociedad C.I. \nCOLOMBIAN NATURAL RESOURCES I S.A.S. EN REORGANIZACIÓN, debido, entre \notros aspectos, a que la Resolución 2813 del 29 de noviembre de 2022 a través de la cual \nse aprobó el Plan de Compensación para el proyecto “Sistema de transporte de hidrocarburos \nPozos Colorados – Ayacucho - Galán”, fue anterior a la expedición de la Resolución 347 del 24 \nde febrero de 2023 por medio de la cual se aprueba el Plan de Compensación del proyecto \n“Extracción de Carbón a cielo abierto Mina La Francia” (Expediente LAM3199), le corresponde \na la Autoridad Nacional efectuar  algunas precisiones de orden jurídico.\nEl principio de “Primero en el tiempo primero en el derecho”, es concebido dentro de la \njurisprudencia Colombia, como un mecanismo adecuado para resolver problemas de \nigualdad, en la medida en que establece una diferenciación con base en un elemento \nobjetivo, esto es, el tiempo; en este contexto, se tiene que la Sociedad CENIT \nTRANSPORTES Y LOGÍSTICA DE HIDROCARBUROS S.A.S. mediante comunicación con \nradicación 2022069015-1-000 del 11 de abril de 2022,  presentó la propuesta de \ncompensación de 78,5 ha para el proyecto “Sistema de transporte de hidrocarburos Pozos \nColorados – Ayacucho - Galán”, relacionando que ejecutaría acciones  de preservación y \nrestauración ecológica al interior  del Banco de hábitat Bosque Seco Tropical Cesar “La \nLope”, sin embargo, no allegó información sobre las áreas específicas, ni documento \nexpedido por el administrador del Banco de hábitat sobre la disponibilidad de áreas; por su \nparte, la Sociedad C.I. COLOMBIAN NATURAL RESOURCES I S.A.S. EN \nREORGANIZACIÓN mediante comunicación con radicación 2022263125-1-000 del 23 de \nnoviembre de 2022  presentó información complementaria al Plan de compensación \npropuesto mediante comunicaciones con radicación  2022071548-1-000 y 2022071509- 1-\n000 del 13 de abril de 2022, en la cual caracterizó,  espacializó las áreas y definió las \nacciones de compensación para cada una de ellas,  adjuntando el oficio de fecha 22 de \nnoviembre de 2022 a través del cual Terrasos S.A.S confirmó la disponibilidad de cupos \npara dar alcance a la obligación de compensación.\n21 Concepto Técnico 1787 del 27 de marzo de 2024\n22 Concepto Técnico 1787 del 27 de marzo de 2024\n\nResolución No. 000802       Del 07 MAY. 2024          Hoja No. 43 de 56\n“POR LA CUAL SE RESUELVE UN RECURSO DE REPOSICIÓN”\nPágina 43 de 56\nDe acuerdo con lo anterior, es claro, que si bien la radicación de la Sociedad C.I. \nCOLOMBIAN NATURAL RESOURCES I S.A.S. EN REORGANIZACIÓN  fue posterior a la \nCENIT TRANSPORTES Y LOGÍSTICA DE HIDROCARBUROS S.A.S ,  fue la primera \nSociedad, quien presentó toda la información pertinente para la aprobación de áreas \nespecíficas dentro del Banco de hábitat Bosque Seco Tropical Cesar “La Lope”; mientras \nque, la Sociedad recurrente, allegó información general del Banco de hábitat, respaldada \nen el proceso metódico que involucró principalmente dos aspectos, a saber, el ámbito \ngeográfico y la equivalencia ecosistémica, en consecuencia aplicando el “Principio de primero \nen el tiempo primero en el derecho”, el mejor derecho radica en quien presentó inicialmente la \ninformación específica de las áreas, esto es C.I. COLOMBIAN NATURAL RESOURCES I \nS.A.S. EN REORGANIZACIÓN.\nEn orden a las radicaciones descritas anteriormente y de acuerdo a la información adjunta \na cada una de ellas, la Autoridad Nacional, resolvió en primer lugar la propuesta presentada \npor CENIT TRANSPORTES Y LOGÍSTICA DE HIDROCARBUROS S.A.S,  en \nconsecuencia expidió la Resolución 2813 del 29 de noviembre de 2022, en la cual, si bien \nse aprobó la propuesta consistente en realizar la compensación en 78,5 ha a través del \nmecanismo de Banco de Hábitat, en la parte motiva se advirtió “En observancia de la \ninformación presentada por la sociedad se tiene que no precisó el lugar en donde se ejecutarán las \n78,5 han pendientes de la obligación de compensación, así como tampoco presenta un soporte de \nla disponibilidad de cupos en el Banco de hábitat Bosque Seco Tropical Cesar “La Lope”, lo cual \nconlleva a que no se garantice que no haya superposición con otras obligaciones que se puedan \nestar llevando a cabo en el mismo lugar…”\nEs así, como en el numeral 2 del artículo tercero del citado acto administrativo se impuso \nla obligación de presentar en un término no mayor a un mes, la ubicación de las 78,5 ha; la \ncual fue allegada por la Sociedad recurrente mediante comunicación con radicación \n2022297415-1-000 del 30 de diciembre de 2022, evaluada mediante Concepto Técnico \n7764 del 15 de noviembre de 2023, el cual sirvió como insumo para la expedición de la \nResolución 3050 del 21 de diciembre de 2023, que hoy es objeto de recurso. \nTodo lo anterior, lleva a concluir, que aun cuando la Sociedad allegó la información \nsolicitada;  en la Resolución 2813 del 29 de noviembre de 2022, no se aprobaron áreas y \nse advirtió la posibilidad latente de una superposición; en consecuencia,  para la Sociedad \nCENIT TRANSPORTES Y LOGÍSTICA DE HIDROCARBUROS S.A.S se configuró una \nmera expectativa, en cuanto al ¿Dónde compensar?; mientras que, para la C.I. COLOMBIAN \nNATURAL RESOURCES I S.A.S. EN REORGANIZACIÓN, se configuró una expectativa \nlegítima respecto al  ¿Dónde compensar?, debido a que en la  Resolución 347 del 24 de \nfebrero de 2023 modificada por la Resolución 1096 del 29 de mayo de 2023  se aprobaron \náreas puntuales al interior del Banco de Hábitat, atendiendo entre otros aspectos, que para \nla fecha de emisión del acto administrativos no existían áreas aprobadas para los mismos \nfines con cargo a otros expedientes y a que la radicación de la propuesta con la información \npertinente, fue anterior a la presentada por la Sociedad CENIT TRANSPORTES Y \nLOGÍSTICA DE HIDROCARBUROS S.A.S.\nEn este orden de ideas, los argumentos propuestos por la Sociedad recurrente no están \nllamados a prosperar; en tanto, la configuración de una mera expectativa a su favor, no da \nlugar a desatender la decisión contenida en la Resolución 347 del 24 de febrero de 2013, \nmodificada por la Resolución 1096 del 29 de mayo de 2023, como quiera que las \nexpectativas legitimas que se consolidaron en cabeza de la Sociedad C.I. COLOMBIAN \nNATURAL RESOURCES I S.A.S. EN REORGANIZACIÓN, sugiere que solamente su \n\nResolución No. 000802       Del 07 MAY. 2024          Hoja No. 44 de 56\n“POR LA CUAL SE RESUELVE UN RECURSO DE REPOSICIÓN”\nPágina 44 de 56\ndesistimiento expreso de  las áreas aprobadas, dará a lugar a que estas puedan ser \nevaluadas para el cumplimiento de obligaciones similares con cargo a otros proyectos de \ncompetencia de la Autoridad Nacional.\nLo anterior teniendo en cuenta, que la expectativa legítima a diferencia de la mera \nexpectativa se configura cuando se logra consolidar una situación fáctica y jurídica concreta \nen virtud de la satisfacción de alguno de los requisitos relevantes de reconocimiento del \nderecho subjetivo y por tanto, debe ser respetada en virtud del principio de seguridad \njurídica; al respecto, Corte Constitucional23  ha señalado que (i) las meras expectativas \ncarecen de amparo en la resolución de casos concretos; (ii) los derechos adquiridos gozan \nde una poderosa salvaguarda por haber ingresado al patrimonio del titular y; (iii) las \nexpectativas legítimas son merecedoras de una protección intermedia atendiendo a los \nfactores relevantes del asunto específico y los criterios de razonabilidad y proporcionalidad.\nConforme con lo anterior, la Autoridad Nacional confirmará el contenido del artículo \nsegundo de la Resolución 3050 de 21 de diciembre de 2023, como se dispondrá en la parte \nresolutiva del presente acto administrativo. \n3.\nDISPOSICIÓN RECURRIDA –ARTÍCULO CUARTO DE LA RESOLUCIÓN 3050 DEL \n21 DE DICIEMBRE DE 2023. \n“(…)”\n“ARTÍCULO \nCUARTO. \nLa \nSociedad \nCENIT \nTRANSPORTE \nY \nLOGÍSTICA \nDE \nHIDROCARBUROS S.A.S., en un término no mayor a un (1) mes contado a partir de la \nejecutoria del presente acto administrativo, deberá: \n1. Presentar el soporte actualizado donde el administrador del Banco de Hábitat Bosque Seco \nTropical del Cesar “La Lope” manifieste la disponibilidad áreas (Cupos) para ejecutar la \ncompensación de 78,5 ha aprobadas mediante la Resolución 2813 del 29 de noviembre de 2022 \npara el proyecto “Sistema de transporte de hidrocarburos Pozos Colorados – Ayacucho - Galán”, \nde conformidad con los numerales 1 y 4 del artículo tercero de la Resolución 2813 del 29 de \nnoviembre de 2022. \n2. Presentar una nueva propuesta de áreas para ejecutar la compensación de 78,5 ha en el \nBanco de Hábitat Bosque Seco Tropical del Cesar “La Lope” aprobadas mediante la Resolución \n2813 del 29 de noviembre de 2022, para el proyecto “Sistema de transporte de hidrocarburos \nPozos Colorados – Ayacucho - Galán”, de conformidad con el numeral 2 del artículo tercero de \nla Resolución 2813 del 29 de noviembre de 2022.”\n3.1 Petición de la Sociedad.\n“(…)”\n“De acuerdo con los fundamentos fácticos, técnicos y jurídicos que se presentan en este recurso \nde reposición, CENIT solicita la REVOCATORIA del presente artículo en su totalidad teniendo \nen cuenta que una vez aprobado el plan de compensación por medio de la Resolución 2813 del \n29 de noviembre de 2022, CENIT dio respuesta por medio del comunicado con radicado N° \n2022297415-1-000 del 30 de diciembre de 2022 (Anexo 4) a la solicitud por parte de la ANLA \nde los numerales 1, 2, 3, 4 y 5 del artículo tercero, de la Resolución 2813 del 29 de noviembre \nde 2022. En esta comunicación CENIT presentó la manifestación del administrador del Banco \nde Hábitat de la disponibilidad de cupos como se puede ver en la Figura 1.”\n23Corte Constitucional, Sentencia C-789 de 2002\n\nResolución No. 000802       Del 07 MAY. 2024          Hoja No. 45 de 56\n“POR LA CUAL SE RESUELVE UN RECURSO DE REPOSICIÓN”\nPágina 45 de 56\n“(…)”\n3.2 Argumentos de la Sociedad.\n“En complemento con lo mencionado, es de anotar que acorde con lo establecido por Terrasos \nS.A.S., actual administrador del Banco de Hábitat, la reserva de cupos hace referencia a la \ndisponibilidad y expectativa que existe para usar cierta cantidad de cupos de biodiversidad, \nsujeto a que las partes lleguen a un acuerdo formal y contractual; mientras que CENIT cuenta \ncon la asignación de cupos y un acto administrativo de aprobación del plan de compensación \nprevio al acto administrativo del expediente LAM3199, para la obligación ambiental por parte de \nla ANLA y un acuerdo formal contractual entre el titular de la obligación y el responsable del \nBanco de Hábitat, estableciendo el proceso de asignación oficial de los cupos de biodiversidad \nante el DBBSE del MADS. \nUna vez efectuado el proceso de formalización contractual (Terrasos S.A.S-CENIT), la \nasignación de cupos se desarrolló por medio del radicado MADS 2023E1022188 del 19 de mayo \nde 2023, efectuado por la empresa Terrasos S.A.S. en calidad de administrador del Banco de \nHábitat, en el marco de lo dispuesto en el artículo séptimo de la Resolución 1051 del 05 de junio \nde 2017, oficiando así la asignación de los 78,5 cupos de biodiversidad a favor de CENIT ante \nla DBBSE del MADS, (Remitirse Anexo 2 y 3 y ver Tabla 1), garantizando de esta manera que \nactualmente NO existe una duplicidad o superposición de los cupos de biodiversidad asignados \nante el MADS a favor de CENIT, con los de ningún otro expediente u obligación ambiental. \nPor las razones anteriormente expuestas, CENIT solicita a la Autoridad Nacional de Licencias \nAmbientales la REVOCATORIA del artículo cuarto, de la Resolución 03050 del 21 de diciembre \nde 2023, ya que CENIT ha remitido la documentación actualizada donde el administrador del \nBanco de Hábitat Bosque Seco Tropical del Cesar “La Lope” manifiesta la disponibilidad áreas \n(Cupos), así mismo, no sería requerida una nueva propuesta de áreas debido a que como se \nha demostrado, no existe superposición real, basado en los soportes previamente remitidos a \nla ANLA, así como la información remitida por parte del administrador del Banco de Hábitat a la \nDBBSE del MADS donde se evidencia que no hay superposición real alguna (Anexo 4, 5 y 6)”. \n3.3 Consideraciones de la Autoridad Nacional.\nA través del Concepto Técnico 1787 del 27 de marzo de 2024, el equipo técnico de la \nAutoridad Nacional señaló:\n“(…)”\nPara la Autoridad Nacional es importante dar claridad con respecto a lo manifestado por la \nSociedad en la comunicación con radicación 20246200033422 del 10 de enero de 2024, en \ncuanto a que “CENIT cuenta con la asignación de cupos y un acto administrativo de aprobación \ndel plan de compensación previo al acto administrativo del expediente LAM3199” antes de \nanalizar los argumentos; de tal forma el radicado en mención describe:\n“(…)”\nEn complemento con lo mencionado, es de anotar que acorde con lo establecido por Terrasos \nS.A.S., actual administrador del Banco de Hábitat, la reserva de cupos hace referencia a la \ndisponibilidad y expectativa que existe para usar cierta cantidad de cupos de biodiversidad, \nsujeto a que las partes lleguen a un acuerdo formal y contractual; mientras que CENIT cuenta \ncon la asignación de cupos y un acto administrativo de aprobación del plan de compensación \nprevio al acto administrativo del expediente LAM3199, para la obligación ambiental por parte \n\nResolución No. 000802       Del 07 MAY. 2024          Hoja No. 46 de 56\n“POR LA CUAL SE RESUELVE UN RECURSO DE REPOSICIÓN”\nPágina 46 de 56\nde la ANLA y un acuerdo formal contractual entre el titular de la obligación y el responsable \ndel Banco de Hábitat, estableciendo el proceso de asignación oficial de los cupos de \nbiodiversidad ante el DBBSE del MADS.\n“(…)”\nAl respecto del argumento de la Sociedad en cuanto a que la aprobación de áreas en el \nexpediente LAM0832, fue previa a la aprobación de áreas en el expediente LAM3199; la \nAutoridad Nacional hace claridad en que mediante Resolución 2813 del 29 de noviembre de \n2022, se le aprueba a la Sociedad CENIT TRANSPORTE Y LOGÍSTICA DE \nHIDROCARBUROS S.A.S, la línea general de un plan de compensación del componente biótico \nmediante el siguiente artículo:\n“(…)”\nARTÍCULO PRIMERO. Aprobar a la Sociedad CENIT TRANSPORTE Y LOGÍSTICA DE \nHIDROCARBUROS S.A.S. el Plan de compensación de 78,5 ha del proyecto “Sistema de \ntransporte de hidrocarburos Pozos Colorados – Ayacucho - Galán” en el Banco de Hábitat del \nBosque seco Tropical del Cesar “La Lope” ubicado en el Municipio de Valledupar, \nDepartamento del Cesar, de conformidad con lo expuesto en la parte motiva del presente acto \nadministrativo.\n“(…)”\nDe igual forma en este mismo acto administrativo se le establece a la Sociedad que deberá \ndefinir y especificar las acciones y las áreas dentro del BH La Lope, para ejecutar las 78,5 \nha del plan aprobado en el artículo primero: \n“(…)”\nARTÍCULO SEGUNDO. La Sociedad CENIT Transporte y Logística de Hidrocarburos S.A.S, \nen el marco del desarrollo del Plan de compensación de 78,5 ha del proyecto “Sistema de \ntransporte de hidrocarburos Pozos Colorados – Ayacucho - Galán” en el Banco de Hábitat del \nBosque seco Tropical del Cesar “La Lope”, deberá: \n1. Seleccionar las actividades de las acciones de preservación y rehabilitación \nteniendo en cuenta el contexto y las condiciones del área en donde se ejecutarán las \nacciones, esto incluye considerar el estado sucesional y la fase de desarrollo en el que se \nencuentra la vegetación… (Negrilla y subrayado fuera de texto).\nARTÍCULO TERCERO. La Sociedad CENIT Transporte y Logística de Hidrocarburos S.A.S, \nen un término no mayor a un (1) mes contado a partir de la ejecutoria del presente acto \nadministrativo, deberá: \n“(…)”\n2. Presentar la ubicación de las 78,5 ha donde será implementada la compensación \ndentro del Banco de Hábitat del Bosque seco Tropical del Cesar “La Lope” … (Negrilla \ny subrayado fuera de texto). “(…)”\nHasta este punto la Sociedad CENIT TRANSPORTE Y LOGÍSTICA DE HIDROCARBUROS \nS.A.S., contaba con la aprobación de una línea general para la ejecución del plan de \ncompensación del componente biótico, pero la mencionada Resolución no aprobó las áreas \n\nResolución No. 000802       Del 07 MAY. 2024          Hoja No. 47 de 56\n“POR LA CUAL SE RESUELVE UN RECURSO DE REPOSICIÓN”\nPágina 47 de 56\nespecíficas para la ejecución en tanto que la Sociedad no había presentado la ubicación de \nlas 78,5 ha dentro del Banco de Hábitat del Bosque seco Tropical del Cesar “La Lope”.\nMas tarde mediante comunicación con radicación 2022297415-1-000 del 30 de diciembre de \n2022 presentado en el expediente LAM0832, la Sociedad entregó la respuesta a los \nrequerimientos de la Resolución 2813 del 29 de noviembre de 2022, junto con las áreas \nespecíficas y acciones propuestas al interior del Banco de Hábitat del Bosque seco Tropical del \nCesar “La Lope” y el soporte confirmando la disponibilidad de cupos en este.\nLas áreas no fueron aprobadas por la Autoridad Nacional, en atención al traslape de áreas con \nel expediente LAM3199, las cuales fueron aprobadas mediante artículo sexto de la Resolución \n347 del 24 de febrero de 2023.\n“ARTÍCULO SEXTO. Aceptar las siguientes acciones de compensación a ejecutar en las \náreas de los polígonos presentados por la Sociedad C.I. COLOMBIAN NATURAL \nRESOURCES I S.A.S., en la capa CompensacionBiodiversidad del anexo cartográfico de la \ncomunicación con radicación 2022263125-1-000 del 23 de noviembre de 2022, de \nconformidad con lo expuesto en la parte motiva del presente acto administrativo y atendiendo \na la información consignada en la siguiente tabla: (…)”\nEn relación con lo anterior, debe resaltarse que si bien la Resolución 347 del 24 de febrero de \n2023 modificada por la Resolución 1096 del 29 de mayo de 2023  en el expediente LAM3199, \nes posterior comunicación con radicación 2022297415-1-000 del 30 de diciembre de 2022 \npresentado en el expediente LAM0832; la información con la cual se evaluó el plan de \ncompensación del componente biótico en el expediente LAM3199, fue presentada mediante \ncomunicaciones con radicación 2022071548-1-000 del 13 de abril de 2022 y 2022071509- 1-\n000 del 13 de abril de 2022 complementada por la comunicación con radicación 2022263125-\n1-000 del 23 de noviembre de 2022; todos anteriores al radicado 2022297415-1-000 del 30 \nde diciembre de 2022 presentado en el expediente LAM0832.\nComo se puede observar para el momento que la Sociedad CENIT TRANSPORTE Y \nLOGÍSTICA DE HIDROCARBUROS S.A.S. presentó en el expediente LAM0832 las áreas para \nsu aprobación, ya estas áreas se encontraban en evaluación en el expediente LAM3199 en el \nmarco de la solicitud de acogimiento al artículo 1 de la Resolución 370 del 15 de abril de 2021, \npresentada por la Sociedad mediante las comunicaciones con radicación 2022071548-1-000 \ndel 13 de abril de 2022 y 2022071509- 1-000-1-000 del 13 de abril de 2022 complementada por \nla comunicación con radicación 2022263125-1-000 del 23 de noviembre de 2022 , resaltando \nque en esta última se presentó como anexo un oficio emitido por el operador del Banco de \nHábitat “La Lope”, manifestando la disponibilidad de cupos y, en consecuencia, la Autoridad \nNacional, emitió el Concepto técnico 248 del 3 de febrero de 2023, referente al proyecto \n“Extracción de Carbón Mina la Francia” en titularidad de la Sociedad C.I. COLOMBIAN \nNATURAL RESOURCES I S.A.S EN REORGANIZACIÓN., acogido mediante la Resolución 347 \ndel 24 de febrero de 2023.\nPor lo tanto, la aprobación de las áreas objeto del presente recurso de reposición, se realizó en \nel expediente LAM3199.\nIgualmente, si bien la aprobación de la línea general del plan de compensación del componente \nbiótico fue primera en orden cronológico en el expediente LAM0832 cuyo titular es CENIT \nTRANSPORTE Y LOGÍSTICA DE HIDROCARBUROS S.A.S. en la Resolución de aprobación \nno se contaba ni con la ubicación específica, ni la evaluación o aceptación de estas, mientras \nque para ese momento la Sociedad C.I. COLOMBIAN NATURAL RESOURCES I S.A.S EN \nREORGANIZACIÓN., ya había presentado estas áreas en su plan para evaluación.\n\nResolución No. 000802       Del 07 MAY. 2024          Hoja No. 48 de 56\n“POR LA CUAL SE RESUELVE UN RECURSO DE REPOSICIÓN”\nPágina 48 de 56\nDe esta manera queda claro que la Autoridad Nacional llevó a cabo el debido proceso de \nevaluación para estos dos expedientes y deja claro que en el  momento en que se realizó la \nevaluación del plan de compensación del componente biótico, presentado en el expediente \nLAM0832 no se había presentado un desistimiento explícito por parte de la Sociedad C.I. \nCOLOMBIAN NATURAL RESOURCES I S.A.S. EN REORGANIZACIÓN del uso de estas áreas \nen su plan de compensación del componente biótico, que se pudiera evaluar, por lo que se \nconsidera que el argumento de la Sociedad no es procedente.\nEn tal caso, se debe aclarar a la Sociedad, que en tanto se cuente con un acto administrativo \nemitido por la Autoridad Nacional, que haya aprobado la ejecución de áreas en el marco del \nplan de compensación del componente biótico para determinado expediente, no se aceptará la \nejecución de estas mismas áreas, para esta u otra obligación en otros expedientes; lo anterior \nen cumplimiento del manual de compensaciones del componente biótico en el cual se describe:\n“Se deben identificar claramente las áreas correspondientes a cada uno de los proyectos, \nobras o actividades, diferenciando cada obligación en la Geodatabase”.\nEn relación con lo que describe la Sociedad respecto a que ya cuenta con  un “Acuerdo formal \ncontractual” entre el titular de la licencia y el responsable del Banco de hábitat; debe aclararse \nque de acuerdo al parágrafo 1 del Artículo sexto de la Resolución 1051del 05 de junio de 2017 \npor la cual se reglamentan los Bancos de hábitat “Los acuerdos que se celebren respecto de \ncada Banco de Hábitat tanto en su financiamiento como en su implementación únicamente \ncomprometen la responsabilidad de quienes los suscriben”   igualmente el cumplimento de las \nfunciones de la Autoridad Nacional no puede ser socavado en perjuicio de las relaciones \ncomerciales entre empresas titulares de expedientes y sus proveedores comerciales, teniendo \nen cuenta que conforme lo establecido el manual de compensaciones del componente biótico, \nlos bancos de hábitat solo son mecanismos para la implementación de acciones y no \ncorresponden a la acción en sí.\nHabiendo aclarado lo anterior, en atención a los argumentos que expresa la  CENIT Transporte \ny Logística de Hidrocarburos S.A.S., respecto al supuesto de que no existe superposición de \náreas, la Autoridad Nacional comprobó el análisis desarrollado en el Concepto técnico 7764 del \n15 de noviembre de 2023 que acogió la Resolución 3050 del 21 de diciembre de 2023 en el que \nse verificaron de los aspectos referentes al proyecto “Sistema de transporte de hidrocarburos \nPozos Colorados Ayacucho – Galán” específicamente en  el seguimiento  plan de  \ncompensación del componente biótico, presentado mediante comunicación con radicación \n2022297415-1-000 del 30 de diciembre de 2022.\nY a su vez la Autoridad Nacional dando cumplimiento al debido proceso realizó nuevamente un \nestudio espacial con respecto a  las áreas asignadas en el Banco de Hábitat Bosque Seco \nTropical del Cesar “La Lope” reafirmando lo concluido en el Concepto técnico 7764 del 15 de \nnoviembre de 202324 con respecto al solapamiento de áreas del Plan de compensación del  \nproyecto “Extracción de carbón Mina la Francia”, presentado por la Sociedad C.I. COLOMBIAN \nNATURAL RESOURCES I S.A.S. EN REORGANIZACIÓN (Expediente LAM3199), como se \npuede verificar en el desarrollo de las consideraciones del artículo segundo.\nPor otra parte, se observa que mediante comunicación con radicación 20246200264842 del 08 \nde marzo de 2024 presentado en el expediente LAM0832, la Sociedad solicitó se tenga como \nprueba sobreviniente, la comunicación con remitente C.I. COLOMBIAN NATURAL \nRESOURCES I S.A.S. EN REORGANIZACION del 12 de febrero de 2024, enviada a la \nAutoridad Nacional en respuesta a una solicitud de información realizada mediante \ncomunicación con radicación 20244700052081 del 25 de enero de 2024 en el expediente \nLAM3199.\n24 Acogido mediante Resolución 3050 del 21 de diciembre de 2023\n\nResolución No. 000802       Del 07 MAY. 2024          Hoja No. 49 de 56\n“POR LA CUAL SE RESUELVE UN RECURSO DE REPOSICIÓN”\nPágina 49 de 56\nTal como se describió en los argumentos realizados en el artículo primero, la Autoridad Nacional \nconcluyó que esta no aporta ninguna nueva información que dé lugar a un cambio en la decisión \ntomada, toda vez que la Sociedad C.I. COLOMBIAN NATURAL RESOURCES I S.A.S EN \nREORGANIZACIÓN, es el titular de licencia del expediente LAM3199, que cuenta con las áreas \naprobadas mediante el artículo sexto de la Resolución 347 del 24 de febrero de 2023 modificada \npor la Resolución 1096 del 29 de mayo de 2023 ,  ubicadas en el Banco de Hábitat Bosque Seco \nTropical del Cesar “La Lope” que se sobreponen con las presentadas en el expediente \nLAM0832. \nSe aclara que la Autoridad Nacional no tiene evidencia de un desistimiento explícito de C.I. \nCOLOMBIAN NATURAL RESOURCES I S.A.S EN REORGANIZACIÓN acerca del uso de \nestas áreas para el cumplimiento de sus obligaciones de compensación al momento de realizar \neste concepto técnico25, y como ya fue explicado en las consideraciones técnicas de la \nAutoridad Nacional frente a los argumentos expuestos por la Sociedad para sustentar la solicitud \nde revocatoria del artículo primero de la Resolución 3050 del 21 de diciembre de 2023, mientras \nlos predios  hayan sido aprobados en otro expediente, estos no podrán ser aprobados en otro, \ndada la condición de superposición de áreas.\nDe tal forma, en atención a todas las consideraciones presentadas por la Autoridad Nacional \n(Desarrolladas ampliamente en las consideraciones técnicas y jurídicas frente a los argumentos \nexpuestos por la Sociedad para sustentar la solicitud de revocatoria de los artículo primero y \nsegundo de la Resolución 3050 del 21 de diciembre de 2023) en el concepto técnico26, se \nconsidera que sí existe la superposición con las áreas aprobadas mediante el artículo sexto de \nla Resolución 347 del 24 de febrero de 2023 modificada por la Resolución 1096 del 29 de mayo \nde 2023  para el expediente LAM3199 cuyo titular de licencia es la Sociedad C.I. COLOMBIAN \nNATURAL RESOURCES I S.A.S. EN REORGANIZACIÓN, por tanto, no es procedente el \nargumento de la Sociedad en cuanto a la supuesta no superposición de áreas.\nAhora bien, como consecuencia de la negación del plan y una vez analizada la información que \npresenta la Sociedad y la información existente en el expediente LAM0832 y LAM3199, se \nobserva en relación con el numeral 1 del artículo cuarto de la Resolución 3050 del 21 de \ndiciembre de 2023, este debe quedar sin efectos jurídicos,  ya que no se considera necesario \nrequerir información adicional de asignación de cupos  del Banco de Hábitat ante el Ministerio \npara este concepto técnico27, dado que está ya fue presentada por la Sociedad mediante \nradicado 20246200033422 del 10 de enero de 2024 y dadas las consideraciones mencionadas, \nesta no resultó relevante en el sentido de explicar o justificar la superposición de áreas \npresentadas entre los expediente LAM0832 y LAM3199 y no implicó un cambio en la decisión \ntomada.\nPor otra parte, en relación con el numeral 2 del artículo cuarto de la Resolución 3050 del 21 de \ndiciembre de 2023, se observa que la empresa debe presentar una nueva propuesta de \ncompensación, no obstante, se considera que se debe dar claridad en la redacción del numeral, \ndejando de manera explícita que la propuesta deberá ser una diferente a la ya presentada en \ncuanto a la ubicación de las áreas que se sobreponen con las aprobadas en el expediente \nLAM3199, por los argumentos ya presentados. “(…)”\nDe acuerdo a los argumentos traídos del Concepto Técnico 1787 del 27 de marzo de 2024 \ny las precisiones jurídicas expuestas por la Autoridad Nacional frente a las consideraciones \ndel recurso de reposición presentado contra los artículo primero y segundo de la Resolución \n3050 del 21 de diciembre de 2023, es diáfano, que existe una superposición física en el \n25 Concepto Técnico 1787 del 27 de marzo de 2024\n26 Concepto Técnico 1787 del 27 de marzo de 2024\n27 Concepto Técnico 1787 del 27 de marzo de 2024\n\nResolución No. 000802       Del 07 MAY. 2024          Hoja No. 50 de 56\n“POR LA CUAL SE RESUELVE UN RECURSO DE REPOSICIÓN”\nPágina 50 de 56\n90% de las áreas aprobadas mediante la Resolución 347 del 24 de febrero de 2023 \nmodificada por la Resolución 1096 del 29 de mayo de 2023  para el proyecto “Extracción de \nCarbón a cielo abierto Mina La Francia” (Expediente LAM3199) y las propuesta por CENIT \nTRANSPORTE Y LOGÍSTICA DE HIDROCARBUROS S.A.S en el Plan de compensación; \na lo cual se suma que las áreas restantes no ameritan la ejecución de acciones debido al \nbuen estado de conservación en que se encuentran.\nLo anterior denota, que no existen áreas remanentes al interior del banco de hábitat, que \npuedan ser dispuestas para cumplir con la obligación de compensación que tiene a su cargo \nCENIT TRANSPORTE Y LOGÍSTICA DE HIDROCARBUROS S.A.S; en consecuencia, el \nrequerimiento establecido en el numeral 1 del artículo cuarto de la Resolución 3050 del 21 \nde diciembre de 2023, carece de fundamentos de hecho, debido a que la disponibilidad o \nno de cupos que fue solicitada en el articulado en mención, no se relaciona con los \nargumentos fácticos que dieron lugar a la improbación de las áreas propuestas.\nEs así, como, aun cuando la Sociedad a través de comunicación con radicación del \n2022297415-1-000 del 30 de diciembre de 2022, adjuntó la información requerida en el \nnumeral 1 del artículo cuarto de la Resolución 3050 del 21 de diciembre de 2023, la \nobligación en si misma carece de ejecutividad; en consecuencia, se  dejará sin efectos \njurídicos el numeral 1 del artículo cuarto de la Resolución 3050 del 21 de diciembre de 2023 \npor las razones expuestas, las cuales difieren sustancialmente de las esbozadas por la \nSociedad. \nDe otra parte, la Sociedad solicita se revoque el numeral 2 del artículo cuarto de la \nResolución 3050 del 21 de diciembre de 2023, de contera con los argumentos que expuso \nen el recurso sobre la inexistencia de la superposición de áreas; en este sentido, la \nAutoridad Nacional reafirma la improcedencia de lo aducido por la recurrente, en atención \na los aspectos técnicos y jurídicos expuestos con antelación; no obstante, al ser evidente \nque no existen áreas disponibles dentro del banco de hábitat Banco de hábitat Bosque Seco \nTropical Cesar “La Lope” es pertinente modificar de oficio el artículo recurrido en el sentido, \nde señalar que el nuevo plan de compensación que se presente deberá ser diferente al \nnegado, con el fin de dar claridad al alcance de la obligación.\nLa aclaración oficiosa del numeral 2 del artículo cuarto de la Resolución 3050 del 21 de \ndiciembre de 2023, está orientada a incorporar palabras que fueron omitidas en la redacción \ninicial, pero que guardan coherencia con la motivación del acto administrativo; en \nconsecuencia, corresponde a una modificación formal, bajo el entendido que no genera \ncambios en el sentido material de la decisión, por tanto, contra esta decisión no proceden \nrecurso en sede gubernativa al tenor de lo establecido en el artículo 45 de la Ley 1437 del \n18 de enero de 2011, que a renglón seguido se cita:\n“ARTÍCULO 45. CORRECCIÓN DE ERRORES FORMALES. En cualquier tiempo, de oficio o a \npetición de parte, se podrán corregir los errores simplemente formales contenidos en los actos \nadministrativos, ya sean aritméticos, de digitación, de transcripción o de omisión de palabras. En \nningún caso la corrección dará lugar a cambios en el sentido material de la decisión, ni revivirá los \ntérminos legales para demandar el acto. Realizada la corrección, esta deberá ser notificada o \ncomunicada a todos los interesados, según corresponda.”\nClaro lo anterior, la Autoridad Nacional dejará sin efectos jurídicos el contenido del Numeral \n1 del artículo cuarto de la Resolución 3050 del 21 de diciembre de 2023 y aclarará de oficio \nel Numeral 2 del artículo cuarto de la Resolución 3050 del 21 de diciembre de 2023, tal y \ncómo se señalará en la parte resolutiva del presente acto administrativo.\n\nResolución No. 000802       Del 07 MAY. 2024          Hoja No. 51 de 56\n“POR LA CUAL SE RESUELVE UN RECURSO DE REPOSICIÓN”\nPágina 51 de 56\n4.\nDISPOSICIÓN RECURRIDA – NUMERAL 1 DEL ARTÍCULO QUINTO DE LA \nRESOLUCIÓN 3050 DEL 21 DE DICIEMBRE DE 2023. \n“ARTÍCULO \nQUINTO. \nLa \nSociedad \nCENIT \nTRANSPORTE \nY \nLOGÍSTICA \nDE \nHIDROCARBUROS S.A.S., para que en un término no mayor a seis (6) meses contados a partir \nde la ejecutoria del presente acto administrativo, deberá: \n1. Presentar una propuesta de plan de inversión forzosa de no menos del 1%, de acuerdo con \nlo señalado en el artículo 321 del Plan Nacional de Desarrollo - PND (Ley 1955 del 25 de mayo \ndel 2019) y de conformidad con establecido en el artículo primero de la Resolución 2049 del \n15 de noviembre de 2018, modificado por mediante la Resolución 1582 del 25 de julio de \n2022.”\n“(…)”\n4.1 Petición de la Sociedad.\n“(…)” De acuerdo con los fundamentos fácticos, técnicos y jurídicos que se presentan en este \nrecurso de reposición, CENIT solicita la REVOCATORIA del numeral 1 del artículo Quinto, de \nla Resolución 03050 del 21 de diciembre de 2023, dado que el argumento por parte de la ANLA \nestá dado en relación con la superposición que presentan las áreas propuestas de los proyectos \ncon expediente LAM 3199 para CNRI y LAM 0832 para CENIT; sin embargo, como se sustentó \nen el presente recurso de reposición para la revocatoria del artículo 1, al momento de \npronunciarse respecto a la superposición, no se tuvo en cuenta la contabilidad ambiental del \nBanco de Hábitat, la asignación oficial y formalidad de cupos de biodiversidad ante la DBBSE \ndel MADS, conforme a lo establecido en el artículo 7 de la Resolución 1051 del 05 de junio de \n2017, con el fin de asegurar transparencia y trazabilidad frente a la gestión asociada al \nproceso de asignación de cupos. (…)”\n4.2 Argumentos de la Sociedad.\n“ (…)”\nMediante el Anexo 2 se adjunta el radicado 20236201061902 del 28 de diciembre de 2023 \npresentado por Terrasos S.A.S. a la ANLA, en el que se reporta la contabilidad ambiental oficial \nde los cupos asignados y disponibles en los Bancos de Hábitat administrados por esta entidad, \ny reportados ante el MADS, en donde se puede evidenciar que el BH Bosque Seco Tropical del \nCesar - La Lope de un total de 321 ha = cupos bajo un contrato de usufructo y registro ante el \nMADS, tiene 78,5 cupos de biodiversidad asignados a favor de CENIT para el \ncumplimiento de la compensación aprobada por parte de la ANLA en la Resolución 2813 \ndel 29 de noviembre de 2022 (Expediente LAM0832). \nPartiendo de lo anterior, aunque a CNR I a través de los artículos sexto y octavo de la Resolución \n00347 del 24 de febrero de 2023 le fueron aprobados polígonos para las acciones del plan de \ncompensación en la alternativa 2 “BH-La Lope”, CENIT considera pertinente precisar que, según \nlo confirmado por Terrasos S.A.S., actual administrador del Banco de Hábitat, los polígonos \npreliminares normalmente no son áreas asignadas definitivas, teniendo en cuenta que los cupos \nde CNR I no están formalmente asignados ante la DBBSE del MADS por parte del administrador \ndel Banco de Hábitat (Fuente: Terrasos).\nEn este sentido, CENIT solicita a la ANLA la REVOCATORIA del numeral 1 del artículo Quinto, \nde la Resolución 03050 del 21 de diciembre de 2023, ya que por medio de la Resolución 1582 \ndel 25 de julio de 2022, la ANLA aprobó el plan de inversión forzosa de no menos de 1% y \nmediante el radicado 2022252085-1-000 del 9 de noviembre de 2022 CENIT informó sobre el \ndireccionamiento de esta obligación a las áreas de los BH del Cesar, destacando que se ha \n\nResolución No. 000802       Del 07 MAY. 2024          Hoja No. 52 de 56\n“POR LA CUAL SE RESUELVE UN RECURSO DE REPOSICIÓN”\nPágina 52 de 56\njustificado que no se está incurriendo en una superposición de cupos asignados para el \ncumplimiento de la obligación a favor y disponibles para CENIT (Fuente Terrasos)”\n4.3 Consideraciones de la Autoridad Nacional.\nA través del Concepto Técnico 1787 del 27 de marzo de 2024, el equipo técnico de la \nAutoridad Nacional señaló:\n“(…)”\nEn primer lugar, la Autoridad Nacional se permite anotar que la Sociedad cita como argumento \nel radicado 20236201061902 del 28 de diciembre de 2023, presentado por Terrasos S.A.S. ante \nla Autoridad Nacional, en el que reporta la contabilidad ambiental oficial de los cupos asignados \ny disponibles en los Bancos de Hábitat administrados por ellos, ante el Ministerio, este radicado \nes de una fecha posterior a la Resolución 3050 del 21 de diciembre de 2023 la cual es objeto \ndel presente recurso de reposición, por lo que la información contenida en este radicado no será \nobjeto de evaluación en el concepto técnico28. \nEn todo caso el mencionado documento, no ofrece información mediante la cual la Autoridad \nNacional pudiera cambiar la decisión, toda vez que corresponde al reporte de contabilidad del \nBanco de hábitat ante el MADS, en el marco de los acuerdos que tiene Terrasos S.A.S. con los \ntitulares de la Licencia, y no corresponde con la competencia de la Autoridad Nacional su \nverificación, toda vez que como se ha expresado en las consideraciones de los artículos \nanteriores también recurridos; los acuerdos a los que puedan llegar los titulares de licencia con \nlos operadores del Banco de hábitat no son de nuestra competencia.\nDebe aclararse que de acuerdo con el parágrafo 1 del Artículo sexto de la Resolución 1051 del \n05 de junio de 2017, por la cual se reglamentan los Bancos de hábitat:\n “Los acuerdos que se celebren respecto de cada Banco de Hábitat tanto en su financiamiento \ncomo en su implementación únicamente comprometen la responsabilidad de quienes los \nsuscriben”.\nAl respecto, en los numerales anteriores del Concepto Técnico29 la Autoridad Nacional ya ha \ndado un amplio análisis para este argumento, a partir del cual se ha verificado que sí existe la \nsuperposición de áreas, por lo tanto, para este numeral ya es claro que la Sociedad CENIT \nTRANSPORTE Y LOGÍSTICA DE HIDROCARBUROS S.A.S. presentó áreas para su \naprobación en el expediente LAM0832, que ya se encontraban aprobadas en el expediente \nLAM3199, en el marco  de la solicitud de acogimiento al artículo 1 de la Resolución 370 del 15 \nde abril de 2021, presentada por la Sociedad C.I. COLOMBIAN NATURAL RESOURCES I \nS.A.S EN REORGANIZACIÓN., mediante las comunicaciones con radicación 2022071548-1-\n000 del 13 de abril de 2022 y 2022071509- 1-000-1-000 del 13 de abril de 2022 complementada \npor la comunicación con radicación 2022263125-1-000 del 23 de noviembre de 2022, \ninformación evaluada mediante el Concepto técnico 248 del 3 de febrero de 2023, acogido \nmediante la Resolución 347 del 24 de febrero de 2023.\nIgualmente, se aclara que el cumplimiento de las funciones de la Autoridad Nacional no puede \nser socavado por las relaciones comerciales entre empresas titulares de expedientes y sus \nproveedores comerciales, teniendo en cuenta que conforme lo establecido en el literal b) del \nartículo 2.2.9.3.1.2. del Decreto 2099 de 2016, los bancos de hábitat corresponden a “[U]n área \nen la que se podrán realizar actividades de preservación, restauración, rehabilitación, \nrecuperación y/o uso sostenible para la conservación de la biodiversidad” y no corresponden a \nla acción a implementar en sí, y que conforme a lo definido en el parágrafo 2 del Artículo sexto \n28 Concepto Técnico 1787 del 27 de marzo de 2024\n29 Concepto Técnico 1787 del 27 de marzo de 2024\n\nResolución No. 000802       Del 07 MAY. 2024          Hoja No. 53 de 56\n“POR LA CUAL SE RESUELVE UN RECURSO DE REPOSICIÓN”\nPágina 53 de 56\nde la Resolución 1051 del 05 de junio de 2017 por la cual se reglamentan los Bancos de hábitat, \nen cuanto a la obligación a que hace referencia el concepto técnico30, la Autoridad Nacional no \ntiene ninguna relación directa con los responsables de los Bancos de Hábitat, dado que, en el \nmarco de sus funciones y competencias, hace control y seguimiento a las obligaciones \nimpuestas a los proyectos objeto de licencia ambiental, cuyos responsables son los titulares de \nla misma.\nPor tanto, los acuerdos comerciales celebrados entre la Sociedad CENIT TRANSPORTE Y \nLOGÍSTICA DE HIDROCARBUROS S.A.S. y la empresa Terrasos S.A.S, por sí solos, no son \nválidos para definir los resultados de la evaluación de los planes de inversión forzosa de no \nmenos del 1% o verificar el cumplimiento a las obligaciones de la licencia ambiental, para la \nAutoridad Nacional, quien evalúa conforme la información que repose en el expediente.\nPor otra parte, se observa que mediante radicado 20246200264842 del 8 de marzo de 2024, \npresentado en el expediente LAM0832, la Sociedad solicitó se tenga como prueba \nsobreviniente, la comunicación con remitente C.I. COLOMBIAN NATURAL RESOURCES I \nS.A.S. EN REORGANIZACIÓN del 12 de febrero de 2024, enviada a la Autoridad Nacional en \nrespuesta a una solicitud de información realizada mediante radicado 20244700052081 del 25 \nde enero de 2024 en el expediente LAM3199.\nTal como se describió en los argumentos realizados en el artículo primero, la Autoridad Nacional \nconcluyó que esta no aporta ninguna nueva información que dé lugar a un cambio en la decisión \ntomada, toda vez que la Sociedad C.I. COLOMBIAN NATURAL RESOURCES I S.A.S EN \nREORGANIZACIÓN, es el titular de licencia del expediente LAM3199, que cuenta con las áreas \naprobadas mediante artículo sexto de la Resolución 347 del 24 de febrero de 2023 modificada \npor la Resolución 1096 del 29 de mayo de 2023  ubicadas en el Banco de Hábitat Bosque Seco \nTropical del Cesar “La Lope” que se sobreponen con las presentadas en el expediente \nLAM0832. \nSe aclara que la Autoridad Nacional no tiene evidencia de un desistimiento explícito de C.I. \nCOLOMBIAN NATURAL RESOURCES I S.A.S EN REORGANIZACIÓN acerca del uso de \nestas áreas para el cumplimiento de sus obligaciones de compensación al momento de realizar \neste concepto técnico31, y como ya fue explicado mientras los predios ya hayan sido aprobados \nen otro expediente, estos no podrán ser aprobados en otro, dada la condición de superposición \nde áreas.\nDejando esto claro, los argumentos de asignación de cupos atendiendo asuntos contractuales \ndescritos por la Sociedad no se consideran procedentes.\n “(…)”\nDe acuerdo al análisis técnico efectuado en el Concepto Técnico 1787 del 27 de marzo de \n2024 y las acotaciones jurídicas presentadas por la Autoridad Nacional frente a las \nargumentos expuestos  por la Sociedad en contra de los artículo primero, segundo y cuarto \nla Resolución 3050 del 21 de diciembre de 2023, donde se concluyó que no están llamados \na prosperar, y teniendo en cuenta  que estos son nuevamente argüidos por la Sociedad \npara solicitar la revocatoria del numeral 1 del artículo quinto de la Resolución 3050 del 21 \nde diciembre de 2023, la Autoridad Nacional sin más consideraciones procederá a confirmar \nla disposición recurrida  tal y como se verá en la parte resolutiva del presente acto \nadministrativo.\nEn mérito de lo expuesto, \n30 Concepto Técnico 1787 del 27 de marzo de 2024\n31 Concepto Técnico 1787 del 27 de marzo de 2024\n\nResolución No. 000802       Del 07 MAY. 2024          Hoja No. 54 de 56\n“POR LA CUAL SE RESUELVE UN RECURSO DE REPOSICIÓN”\nPágina 54 de 56\nRESUELVE:\nARTÍCULO PRIMERO. CONFIRMAR el contenido del Artículo Primero de la Resolución \n3050 del 21 de diciembre de 2023, de conformidad con lo expuesto en la parte motiva del \npresente acto administrativo.\nARTÍCULO SEGUNDO. CONFIRMAR el contenido del Artículo Segundo de la Resolución \n3050 del 21 de diciembre de 2023, de conformidad con lo expuesto en la parte motiva del \npresente acto administrativo.\nARTÍCULO TERCERO. Reponer en el sentido de dejar sin efectos jurídicos el contenido \ndel numeral 1 del Artículo Cuarto de la Resolución 3050 del 21 de diciembre de 2023, de \nconformidad con lo expuesto en la parte motiva del presente acto administrativo.\nARTÍCULO CUARTO. MODIFICAR el contenido del numeral 2 del artículo cuarto de la \nResolución 3050 del 21 de diciembre de 2023, de conformidad con lo expuesto en la parte \nmotiva del presente acto administrativo, el cual quedará de la siguiente manera.\n“(…)”\nARTÍCULO CUARTO. La Sociedad CENIT TRANSPORTE Y LOGÍSTICA DE HIDROCARBUROS \nS.A.S., en un término no mayor a un (1) mes contado a partir de la ejecutoria del presente acto \nadministrativo, deberá:\n“(…)”\n2. Presentar una nueva propuesta para ejecutar la compensación del componente biótico del \nproyecto “Sistema de transporte de hidrocarburos Pozos Colorados – Ayacucho – Galán”, en \nreemplazo de la propuesta presentada mediante comunicación con radicación 2022297415-1-000 \ndel 30 de diciembre de 2022 para la ejecución de 78,5 ha, en el Banco de Hábitat Bosque Seco \nTropical del Cesar “La Lope” la cual no fue aprobada mediante el artículo segundo de la presente \nresolución.\n“(…)”\nARTÍCULO QUINTO. CONFIRMAR el contenido del numeral 1 del Artículo Quinto de la \nResolución 3050 del 21 de diciembre de 2023, de conformidad con lo expuesto en la parte \nmotiva del presente acto administrativo.\nARTÍCULO SEXTO. Los demás términos, condiciones y obligaciones establecidas en la \nResolución 3050 del 21 de diciembre de 2023, que no fueron objeto de pronunciamiento en \nel presente acto administrativo, continúan vigentes y exigibles en cualquier momento.\nARTÍCULO SÉPTIMO. Notificar el contenido del presente acto administrativo al \nRepresentante Legal o apoderado debidamente constituido de la Sociedad CENIT \nTRANSPORTE Y LOGÍSTICA DE HIDROCARBUROS S.A.S, o a quien haga sus veces, \nde conformidad con lo dispuesto en los artículos 67 y 69 del Código de Procedimiento \nAdministrativo y de lo Contencioso Administrativo.\nPARÁGRAFO. En el evento en que el titular de la licencia o el permiso, según el caso, sea \nuna persona natural que se acoja al proceso de insolvencia regulado por las normas \nvigentes, o se trate de una Sociedad comercial o de una sucursal de Sociedad extranjera \nque entre en proceso de disolución o régimen de insolvencia empresarial o liquidación \n\nResolución No. 000802       Del 07 MAY. 2024          Hoja No. 55 de 56\n“POR LA CUAL SE RESUELVE UN RECURSO DE REPOSICIÓN”\nPágina 55 de 56\nregulados por las normas vigentes, informará inmediatamente de esta situación a esta \nAutoridad, con fundamento, entre otros, en los artículos 8, 58, 79, 80, 81, 95 numeral 8 de \nla Constitución Política de 1991, en la Ley 43 de 1990, en la Ley 222 de 1995, en la Ley \n1333 de 2009 y demás normas vigentes y jurisprudencia aplicable. \nAdicional a la obligación de informar a la Autoridad Nacional de tal situación, el titular de la \nlicencia o permiso aprovisionará contablemente las obligaciones contingentes que se \nderiven de la existencia de un procedimiento ambiental sancionatorio conforme con el \nartículo 40 de la Ley 1333 de 2009 o la norma que la adicione, modifique o derogue.\nARTÍCULO OCTAVO. - Comunicar el presente acto administrativo a la Corporación \nAutónoma Regional del Magdalena (CORPAMAG), Corporación Autónoma Regional del \nCesar (CORPOCESAR), Corporación Autónoma Regional de la Frontera Nororiental \n(CORPONOR), Corporación Autónoma de Santander (CAS), Departamento Administrativo \nDistrital de Medio Ambiente de Santa Marta (DADSA), Municipios de Fundación y Sabanas \nde San Ángel del Departamento de Magdalena,  Sociedad TERRASOS S.A.S., y \nProcuraduría Delegada para Asuntos Ambientales y Agrarios, para su conocimiento y fines \npertinentes.\nARTÍCULO NOVENO. Publicar la presente Resolución en la Gaceta Ambiental de la \nAutoridad Nacional de Licencias Ambientales (ANLA) de conformidad con lo señalado en el \nartículo 71 de la Ley 99 del 22 de diciembre de 1993.\nARTÍCULO DÉCIMO. Contra el presente acto administrativo no procede recurso alguno, \nde conformidad con lo establecido en el artículo 87 del Código de Procedimiento \nAdministrativo y de lo Contencioso Administrativo.\nNOTIFÍQUESE, COMUNÍQUESE, PUBLÍQUESE Y CÚMPLASE\nDado en Bogotá D.C., a los 07 MAY. 2024\nEDILBERTO PENARANDA CORREA\nASESOR\nCARMEN SUSANA CAMACHO GUALDRON\nCONTRATISTA\nOSCAR GILBERTO GALVIS CAMACHO\n\nResolución No. 000802       Del 07 MAY. 2024          Hoja No. 56 de 56\n“POR LA CUAL SE RESUELVE UN RECURSO DE REPOSICIÓN”\nPágina 56 de 56\nCONTRATISTA\nExpediente No. LAM0832\nConcepto Técnico 1787 del 27 de marzo de 2024\nFecha:\n2 de mayo de 2024\nProceso No.: 20241000008024\nNota: Este es un documento electrónico generado desde los Sistemas de Información de la ANLA. El original reposa en los \narchivos digitales de la Entidad\n"
}