{
  "fuente": "ANLA_GACETA",
  "numero_resolución": "RESOLUCIÓN N° 00252",
  "fecha_resolución": "2023-02-14",
  "nombre_proyecto": "proyecto “Área de Perforación Exploratoria Llanos 40”, ubicado en la Vereda Chaparral",
  "ubicación": "Departamento de Casanare.",
  "empresa": "a cargo de la Sociedad RAMSHORN INTERNACIONAL LIMITED, en favor de la Sociedad PAREX RESOURCES COLOMBIA LTD",
  "numero_expediente": "de",
  "radicados": [
    "2022290928",
    "2021219785",
    "202124823",
    "2019051663"
  ],
  "descripcion": "POR LA CUAL SE RESUELVE UN RECURSO DE REPOSICIÓN",
  "tipos_infraccion": [
    "Tala o afectación de bosques"
  ],
  "pdf_id": "41604",
  "file_name": "ANLA_41604.pdf",
  "texto_completo": "|\nRepública de Colombia\nMinisterio de Ambiente y Desarrollo Sostenible\nAUTORIDAD NACIONAL DE LICENCIAS AMBIENTALES \n- ANLA –\nRESOLUCIÓN N°  00252\n( 14 de febrero de 2023 )\nOficinas: Carrera 13 A No. 34 – 72 Edificio 13 35 Pisos 8 al 11 Bogotá, D.C.\nCentro de Orientación y Radicación de Correspondencia: Carrera 13 A No. 34 – 72 Edificio 13 35 \nLocales 110 al 112 Bogotá, D.C.  \nCódigo Postal 110311156\nNit.: 900.467.239-2\nLínea de Orientación y Contacto Ciudadano: 57 (1) 2540100 / 018000112998 PBX: 57 (1) 2540111\nwww.anla.gov.co    Email: licencias@anla.gov.co  \nPágina 1 de 15\n“POR LA CUAL SE RESUELVE UN RECURSO DE REPOSICIÓN”\nEL ASESOR CÓDIGO 1020 GRADO 13 DE LA SUBDIRECCIÓN DE EVALUACIÓN DE \nLA AUTORIDAD NACIONAL DE LICENCIAS AMBIENTALES – ANLA\nEn ejercicio de las facultades legales establecidas mediante la Ley 99 del 22 de diciembre \nde 1993, el Decreto Ley 3573 del 27 de septiembre de 2011, modificado por el Decreto \n376 del 11 de marzo de 2020, por el cual se modifica la estructura de la Autoridad \nNacional de Licencias Ambientales y acorde con lo regulado en el Decreto 1076 del 26 de \nmayo de 2015, la Resolución 423 del 12 de marzo de 2020, la Resolución 1957 del 5 de \nnoviembre de 2021, la Resolución 2795 del 25 de noviembre de 2022 y la Resolución 157 \ndel 3 de febrero de 2023 expedidas por la Autoridad Nacional de Licencias Ambientales, y\nCONSIDERANDO\nQue mediante la Resolución 72 del 29 de enero de 2013, la Autoridad Nacional de Licencia \nAmbientales (ANLA), (en adelante la Autoridad Nacional), otorgó Licencia Ambiental a la \nsociedad RAMSHORN INTERNACIONAL LIMITED., identificada con NIT. 830.132.875-5, \npara el proyecto “Área de Perforación Exploratoria Llanos 40”, ubicado en la Vereda Chaparral \njurisdicción de los Municipios de Paz de Ariporo y Hato Corozal del Departamento de \nCasanare.\nQue mediante Resolución 1113 del 12 de noviembre de 2013, la Autoridad Nacional \nrechazó por extemporáneo el recurso de reposición interpuesto contra la Resolución 72 del \n29 de enero de 2013, y modificó de oficio el subnumeral ii del literal b) del numeral 1 del \nartículo segundo y aclaró el área y volumen autorizados en el numeral 4 (aprovechamiento \nforestal) del artículo cuarto de la resolución en comento.\nQue mediante Resolución 1117 del 12 de noviembre de 2013, la Autoridad Nacional \nautorizó la cesión total de derechos y obligaciones derivados de la Licencia Ambiental \notorgada mediante la Resolución 72 del 29 de enero de 2013, a cargo de la Sociedad \nRAMSHORN INTERNACIONAL LIMITED, en favor de la Sociedad PAREX RESOURCES \nCOLOMBIA LTD SUCURSAL, identificada con NIT. 900.268.747-9, (en adelante la \nsociedad).\nQue mediante Resolución 1403 del 21 de noviembre de 2014, la Autoridad Nacional \nmodificó la Resolución 72 del 29 de enero de 2013, en el sentido de incluir la concesión de \naguas subterráneas, entre otras disposiciones.\nQue mediante Resolución 210 del 2 de marzo de 2016, la Autoridad Nacional modificó la \nResolución 72 del 29 de enero de 2013, en el sentido de autorizar el uso y operación de las \ninfraestructuras existentes sobre el caño Las Tigras, en las coordenadas (Magna Sirgas \nOrigen Bogotá: E: 1284643 — N: 1125945, Magna Sirgas Origen Este: E: 952247 - N: \n1125945) de la vereda El Caribe en el Municipio de Paz de Ariporo del Departamento de \nCasanare y sobre el caño El Caracol en las coordenadas Magna Sirgas Origen Bogotá: E: \n1296588 — N: 1119068 Magna Sirgas Origen Este: E: 964144 - N: 1119068, en la vereda \nCaño Chiquito del Municipio de Paz de Ariporo, del Departamento de Casanare, entre otras.\n\nResolución No.  00252           Del   14 de febrero de 2023            Hoja No. 2 de 15\n“POR LA CUAL SE RESUELVE UN RECURSO DE REPOSICIÓN”\nOficinas: Carrera 13 A No. 34 – 72 Edificio 13 35 Pisos 8 al 11 Bogotá, D.C.\nCentro de Orientación y Radicación de Correspondencia: Carrera 13 A No. 34 – 72 Edificio 13 35 \nLocales 110 al 112 Bogotá, D.C.  \nCódigo Postal 110311156\nNit.: 900.467.239-2\nLínea de Orientación y Contacto Ciudadano: 57 (1) 2540100 / 018000112998 PBX: 57 (1) 2540111\nwww.anla.gov.co    Email: licencias@anla.gov.co  \nPágina 2 de 15\nQue mediante Resolución 168 del 12 de febrero de 2018, la Autoridad Nacional modificó la \nobligación legal de inversión forzosa de no menos del 1%, en el sentido de ajustar el Plan \nde la mencionada obligación de acuerdo a la propuesta denominada “PDI - \nFORTALECIMIENTO Y MONITOREO HIDROMETEREOLÓGICO ZONA HIDROGRÁFICA META, \nformulado en conjunto con el Instituto de Hidrología, Meteorología y Estudios Ambientales – IDEAM”, \npara lo que se incluye la zona hidrográfica del Meta y se permite la agrupación de la \ninversión con los recursos de la inversión de no menos del 1% correspondiente a otros \nproyectos; así como la agrupación de la inversión forzosa de no menos del 1% con las \nmedidas de compensación por el uso y/o aprovechamiento de recursos naturales \nrenovables, de conformidad con dispuesto en el artículo 2.2.9.3.1.12 del Decreto 2099 del \n22 de diciembre de 2016, modificado por el Decreto 75 del 20 de enero 2017 y el Decreto \n1120 del 29 de junio 2017, compilados en el Decreto 1076 del 26 de mayo de 2015.\nQue mediante Resolución 1817 del 10 de septiembre de 2019, la Autoridad Nacional \nmodificó la Resolución 72 del 29 de enero de 2013, en el sentido de aprobar el Plan de \nCompensación para el cumplimento de las obligaciones por aprovechamiento de la \ncobertura vegetal, establecidas en el artículo décimo séptimo de la Resolución 72 del 29 de \nenero de 2013 y la ficha de manejo LLA40-B9: Compensación por Aprovechamiento de la \nCobertura Vegetal, específicamente sobre 130 ha pendientes por compensar.\nQue mediante Resolución 288 del 20 de febrero de 2020, la Autoridad Nacional resolvió \nrecurso de reposición interpuesto contra la Resolución 1817 del 10 de septiembre de 2019, \nen el sentido de modificar los numerales 5, 6 y 7 del artículo cuarto de la resolución \nrecurrida.\nQue mediante Resolución 373 del 6 de marzo de 2020, la Autoridad Nacional modificó el \nartículo décimo noveno de la Resolución 72 del 29 de enero de 2013, en el sentido de \naprobar el acogimiento al porcentaje incremental de la base de liquidación de la inversión \nforzosa de no menos del 1%, de conformidad con lo señalado en el artículo 321 de la Ley \n1955 del 25 de mayo del 2019.\nQue mediante Resolución 2106 del 24 de noviembre de 2021, la Autoridad Nacional declaró \ncomo ejecutada la suma de DOSCIENTOS CINCUENTA Y DOS MILLONES DOSCIENTOS \nMIL SETECIENTOS CINCUENTA Y SEIS PESOS MCTE ($252.200.756), con cargo a la \nobligación de la inversión forzosa de no menos del 1%, aprobada en el artículo séptimo de \nla Resolución 373 del 6 de marzo de 2020, correspondiente a las actividades del Radar \nmeteorológico Doppler Polarimétrico en banda C) y las obras civiles desarrolladas para la \ninstalación del radar en la base militar de Carimagua en el Municipio de Puerto Gaitán en \nel Departamento de Meta y la Adecuación de la sala de crisis (Pronósticos y alertas) del \nMunicipio de Duitama del Departamento de Boyacá.\nQue de acuerdo con la Resolución 2957 del 13 de diciembre de 2022, la Autoridad Nacional \naceptó a la sociedad la suma de CERO PESOS MCTE. ($0) para el periodo comprendido \nentre el año 2016 al año de 2021, el cual queda con un valor total acumulado de \nactualización de la liquidación de la inversión forzosa de no menos del 1%, de \nCUATROCIENTOS \nMILLONES \nCUATROCIENTOS \nCUARENTA \nY \nSIETE \nMIL \nCUATROCIENTOS CUARENTA Y UN PESOS CON DIECIOCHO CENTAVOS MCTE. \n($400.447.441.18), para el periodo comprendido entre el mes de enero de 2013 al 31 de \ndiciembre de 2021 y adoptó otras determinaciones.\nAsí mismo, la citada Resolución 2957 del 13 de diciembre de 2022, en su artículo quinto \ndeclaró que la sociedad cumplió con la obligación de compensación establecida en el \nartículo décimo séptimo de la Resolución 72 del 29 de enero de 2013 y la ficha de manejo \nLLA40-B9: Compensación por Aprovechamiento de la Cobertura Vegetal, en el predio “La \nSolución” ubicado en el Municipio de Paz de Ariporo, Departamento de Casanare, que fue \naprobado en el artículo tercero de la Resolución 1817 del 10 de septiembre de 2019. La \ndecisión fue notificada mediante correo electrónico a la Sociedad el día 13 de diciembre de \n2022.\n\nResolución No.  00252           Del   14 de febrero de 2023            Hoja No. 3 de 15\n“POR LA CUAL SE RESUELVE UN RECURSO DE REPOSICIÓN”\nOficinas: Carrera 13 A No. 34 – 72 Edificio 13 35 Pisos 8 al 11 Bogotá, D.C.\nCentro de Orientación y Radicación de Correspondencia: Carrera 13 A No. 34 – 72 Edificio 13 35 \nLocales 110 al 112 Bogotá, D.C.  \nCódigo Postal 110311156\nNit.: 900.467.239-2\nLínea de Orientación y Contacto Ciudadano: 57 (1) 2540100 / 018000112998 PBX: 57 (1) 2540111\nwww.anla.gov.co    Email: licencias@anla.gov.co  \nPágina 3 de 15\nQue por medio de la Resolución 212 del 9 de febrero de 2023, la Autoridad Nacional \nmodificó vía seguimiento el artículo vigésimo tercero de la Resolución 72 del 29 de enero \ndel 2013, por la cual se otorgó Licencia Ambiental a la sociedad, en el sentido de señalar \nque los Informes de Cumplimiento Ambiental – ICA, que deberá presentar la sociedad a \nesta Autoridad Nacional, será bajo una periodicidad anual.\nQue a través de la comunicación con radicación 2022290928-1-000 del 26 de diciembre del \n2022, la Sociedad interpuso Recurso de Reposición en contra de la Resolución 2957 del 13 \nde diciembre de 2022, argumentos que fueron evaluados por el equipo técnico de la \nAutoridad Nacional y en consecuencia expidió el Concepto técnico 189 del 31 de enero de \n2023.\nCOMPETENCIA DE LA AUTORIDAD NACIONAL\nEl Gobierno Nacional, mediante Decreto Ley 3573 del 27 de septiembre de 2011, creó la \nAutoridad Nacional de Licencias Ambientales – ANLA, como una entidad con autonomía \nadministrativa y financiera, sin personería jurídica, la cual hace parte del Sector \nAdministrativo de Ambiente y Desarrollo Sostenible, en los términos del artículo 67 de la \nLey 489 de 1998.\nEl numeral 1° del artículo tercero del mencionado decreto estableció dentro de las funciones \nde la Autoridad Nacional, la de otorgar o negar las licencias, permisos y trámites \nambientales de competencia del Ministerio, de conformidad con la ley y los reglamentos. \nMediante el Decreto 376 del 11 de marzo de 2020, se modificó la estructura de la Autoridad \nNacional de Licencias Ambientales. \nMediante la Resolución 423 del 12 de marzo de 2020, se nombró como servidor público a \nJHON COBOS TELLEZ identificado con la cédula de ciudadanía 91.233.099, Asesor \nCódigo 1020 Grado 13, adscrito a la Subdirección de Evaluación de Licencias Ambientales \nde la planta global de la ANLA. \nEl 5 de noviembre de 2021, la Autoridad Nacional emitió la Resolución 1957 “Por la cual se \nadopta el Manual Específico de Funciones y de Competencias Laborales para los empleos \nde la planta de personal de la Autoridad Nacional de Licencias Ambientales - ANLA”, en \ndonde se establece que corresponde al Despacho del Director General de la Autoridad \nNacional de Licencias Ambientales - ANLA, la función de resolver los recursos de reposición \ninterpuestos contra los actos administrativos que se emiten en cumplimiento de las \nfunciones delegadas.\nEn ejercicio de las facultades conferidas por la Ley 489 de 1998, se expidió la Resolución \n2795 del 25 de noviembre de 2022 “Por la cual se delegan unas funciones y se dictan otras \ndisposiciones”, en su artículo primero, numeral 15° delegó en el Asesor Código 1020 Grado \n15 del Despacho del Director General, la función de resolver los recursos de reposición \ninterpuestos contra los actos administrativos que se emiten en cumplimiento de las \nfunciones delegadas.\nQue a través de la Resolución 157 del 3 de febrero de 2023, se delegó al servidor público \nJHON COBOS TELLEZ identificado con la cédula de ciudadanía No. 91.233.099 Asesor \nCódigo 1020 Grado 13, de la planta de personal, de la Subdirección de Evaluación de \nLicencias Ambientales – Grupo de Hidrocarburos de la Autoridad Nacional de Licencias \nAmbientales – ANLA, las funciones establecidas en el artículo primero de la Resolución \n2795 del 25 de noviembre de 2022.\nTeniendo en cuenta lo anterior, es el Asesor Código 1020 Grado 13, de la planta de \npersonal, de la Subdirección de Evaluación de Licencias Ambientales – Grupo de \nHidrocarburos de la Autoridad Nacional de Licencias Ambientales – ANLA, el competente \npara pronunciarse sobre el recurso de reposición interpuesto por la Sociedad en contra de \nla Resolución 2957 del 13 de diciembre de 2022.\n\nResolución No.  00252           Del   14 de febrero de 2023            Hoja No. 4 de 15\n“POR LA CUAL SE RESUELVE UN RECURSO DE REPOSICIÓN”\nOficinas: Carrera 13 A No. 34 – 72 Edificio 13 35 Pisos 8 al 11 Bogotá, D.C.\nCentro de Orientación y Radicación de Correspondencia: Carrera 13 A No. 34 – 72 Edificio 13 35 \nLocales 110 al 112 Bogotá, D.C.  \nCódigo Postal 110311156\nNit.: 900.467.239-2\nLínea de Orientación y Contacto Ciudadano: 57 (1) 2540100 / 018000112998 PBX: 57 (1) 2540111\nwww.anla.gov.co    Email: licencias@anla.gov.co  \nPágina 4 de 15\nFUNDAMENTOS JURIDICOS\nEl procedimiento para la presentación y resolución de recursos contra los actos \nadministrativos se encuentra reglado en el Código de Procedimiento Administrativo y de lo \nContencioso Administrativo artículos 74 y siguientes, que particularmente respecto del \nrecurso de reposición al tenor literal expresan:\n“Artículo 74. Recursos contra los actos administrativos.\nPor regla general, contra los actos definitivos procederán los siguientes recursos: \n1. El de reposición, ante quien expidió la decisión para que la aclare, modifique, adicione o \nrevoque (…)”\nA su vez, los artículos 76 y 77 del Código enunciado preceptúan: \n“Artículo 76. Oportunidad y presentación.\nLos recursos de reposición y apelación deberán interponerse por escrito en la diligencia de \nnotificación personal, o dentro de los diez (10) días siguientes a ella, o a la notificación por aviso, \no al vencimiento del término de publicación, según el caso. Los recursos contra los actos \npresuntos podrán interponerse en cualquier tiempo, salvo en el evento en que se haya acudido \nante el juez. \nLos recursos se presentarán ante el funcionario que dictó la decisión (…)”\nArtículo 77. Requisitos.\nPor regla general los recursos se interpondrán por escrito que no requiere de presentación \npersonal si quien lo presenta ha sido reconocido en la actuación. Igualmente, podrán presentarse \npor medios electrónicos. \nLos recursos deberán reunir, además, los siguientes requisitos: \n1. Interponerse dentro del plazo legal, por el interesado o su representante o apoderado \ndebidamente constituido. \n2. Sustentarse con expresión concreta de los motivos de inconformidad.\n3. Solicitar y aportar las pruebas que se pretende hacer valer. \n4. Indicar el nombre y la dirección del recurrente, así como la dirección electrónica si desea ser \nnotificado por este medio. \nSólo los abogados en ejercicio podrán ser apoderados (…)\nA su vez, el artículo 80 del citado Código, establece el alcance del contenido de la decisión \nque resuelve el recurso:\n“Artículo 80. Decisión de los recursos. -Vencido el período probatorio, si a ello hubiere \nlugar, y sin necesidad de acto que así lo declare, deberá proferirse la decisión motivada que \nresuelva el recurso. \nLa decisión resolverá todas las peticiones que hayan sido oportunamente planteadas y las \nque surjan con motivo del recurso.” \nCONSIDERACIONES DE LA AUTORIDAD NACIONAL FRENTE AL RECURSO DE \nREPOSICIÓN INTERPUESTO POR LA SOCIEDAD.\nDesde el punto de vista procedimental, se observa que el recurso de reposición interpuesto \npor la Sociedad en contra de la Resolución 2957 del 13 de diciembre de 2022, cumple con \nlos requisitos establecidos en el artículo 77 y concordantes del Código de Procedimiento \nAdministrativo y de lo Contencioso Administrativo, en cuanto a lo siguiente:\n1.\nInterponerse dentro del plazo legal, por el interesado o su representante o apoderado \ndebidamente constituido.\n\nResolución No.  00252           Del   14 de febrero de 2023            Hoja No. 5 de 15\n“POR LA CUAL SE RESUELVE UN RECURSO DE REPOSICIÓN”\nOficinas: Carrera 13 A No. 34 – 72 Edificio 13 35 Pisos 8 al 11 Bogotá, D.C.\nCentro de Orientación y Radicación de Correspondencia: Carrera 13 A No. 34 – 72 Edificio 13 35 \nLocales 110 al 112 Bogotá, D.C.  \nCódigo Postal 110311156\nNit.: 900.467.239-2\nLínea de Orientación y Contacto Ciudadano: 57 (1) 2540100 / 018000112998 PBX: 57 (1) 2540111\nwww.anla.gov.co    Email: licencias@anla.gov.co  \nPágina 5 de 15\nSe encuentra acreditado que el día 13 de diciembre de 2022, la Sociedad fue debidamente \nnotificada mediante correo electrónico de la Resolución 2957 del 13 de diciembre de 2022, \nfrente a la cual interpuso recurso de reposición por intermedio de Mandatario General \nSuplente (Abogado en ejercicio) el día 26 de diciembre de 2022 y presentado en la \nAutoridad Nacional bajo el radicado 2022290928-1-000, esto es, dentro de los diez (10) \ndías siguientes a la notificación, de conformidad con lo preceptuado en el artículo 76 de la \nLey 1437 de 2011.\n2.\nSustentarse con expresión concreta de los motivos de inconformidad.\nLa Sociedad presentó los argumentos en contra de las disposiciones recurridas de la \nResolución 2957 del 13 de diciembre de 2022, los cuales serán tenidos en cuenta para \ndecidir el presente recurso de reposición.\n3.\nSolicitar y aportar las pruebas que se pretende hacer valer.\nEn el recurso de reposición la Sociedad aportó las siguientes pruebas:\n“1. Certificado de Existencia y Representación Legal que acredita la calidad de mandatario \ngeneral suplente, el cual obra en el expediente de la referencia y se adjunta al presente \ndocumento.\n2. Informe final presentado mediante comunicación con radicado 2021219785-1-000 del 11 \nde octubre de 2021 en el cual se aclara que el área destinada a compensar en el predio la \nSolución para el proyecto “Área de perforación exploratoria Bloque Llanos 40” EXP LAM5607 \ncorresponde a 155,16 ha.\n3. GDB presentada mediante comunicación con radicado 202124823-1-000 del 17 de \nnoviembre de 2021 en el cual se especializa el área adquirida en el predio la Solución para \nel cumplimiento de las medidas de compensación para el proyecto “Área de perforación \nexploratoria Bloque Llanos 40” EXP LAM5607 corresponde a 357 ha, el cual incluye 155,16 \nha mas el factor de adicionalidad.”\n4.\nIndicar el nombre y la dirección del recurrente, así como la dirección electrónica si desea ser \nnotificado por este medio.\nLa Sociedad manifestó que, para efectos de la notificación: “Parex recibe notificaciones en el \ncorreo electrónico notificacionesjudiciales@parexresources.com”\nCon base en lo anterior, verificado el cumplimiento de los requisitos establecidos en el \nCódigo de Procedimiento Administrativo y de lo Contencioso Administrativo -CPACA-, \nrespecto a la procedencia del señalado recurso de reposición, la Autoridad Nacional \nprocederá a resolverlo, teniendo en cuenta las consideraciones realizadas en el Concepto \ntécnico 189 del 31 de enero de 2023; en el mismo orden de los argumentos presentados \npor la Sociedad, a saber:\n1.\nDISPOSICIÓN RECURRIDA: ARTÍCULO QUINTO.\n“ARTÍCULO QUINTO. Declarar que la sociedad PAREX RESOURCES COLOMBIA LTD \nSUCURSAL., cumplió con la obligación de compensación establecida en el artículo décimo \nséptimo de la Resolución 0072 de 29 de enero de 2013 y la ficha de manejo LLA40-B9: \nCompensación por Aprovechamiento de la Cobertura Vegetal, en el predio “La Solución” ubicado \nen el municipio de Paz de Ariporo, departamento de Casanare, que fue aprobado en el artículo \ntercero de la Resolución 1817 del 10 de septiembre de 2019, de conformidad con lo expuesto \nen la parte motiva del presente acto administrativo. “\n1.1. Petición de la Sociedad.\n“ACLARE el artículo quinto de la Resolución 02957 del 13 de diciembre de 2022, quedando de \nla siguiente manera: \n“ARTÍCULO QUINTO. Declarar que la sociedad PAREX RESOURCES COLOMBIA \nLTD SUCURSAL., cumplió con la obligación de compensación de 155.16 ha mas el \nfactor de adicionalidad, establecida en el artículo décimo séptimo de la Resolución 0072 \nde 29 de enero de 2013 y la ficha de manejo LLA40-B9: Compensación por \n\nResolución No.  00252           Del   14 de febrero de 2023            Hoja No. 6 de 15\n“POR LA CUAL SE RESUELVE UN RECURSO DE REPOSICIÓN”\nOficinas: Carrera 13 A No. 34 – 72 Edificio 13 35 Pisos 8 al 11 Bogotá, D.C.\nCentro de Orientación y Radicación de Correspondencia: Carrera 13 A No. 34 – 72 Edificio 13 35 \nLocales 110 al 112 Bogotá, D.C.  \nCódigo Postal 110311156\nNit.: 900.467.239-2\nLínea de Orientación y Contacto Ciudadano: 57 (1) 2540100 / 018000112998 PBX: 57 (1) 2540111\nwww.anla.gov.co    Email: licencias@anla.gov.co  \nPágina 6 de 15\nAprovechamiento de la Cobertura Vegetal, en el predio “La Solución” ubicado en el \nmunicipio de Paz de Ariporo, departamento de Casanare, aprobado en el artículo \ntercero de la Resolución 1817 del 10 de septiembre de 2019, de conformidad con lo \nexpuesto en la parte motiva del presente acto administrativo.”\n1.2. Argumentos de la Sociedad.\nMediante comunicación con radicación 2022290928-1-000 del 26 de diciembre del 2022, la \nSociedad presentó los siguientes argumentos:\n“Al respecto, es preciso mencionar que en el documento con radicado 2019051663-1-000 del 24 de \nabril de 2019, Parex presentó como alternativa para el cumplimiento de compensación ambiental del \nproyecto “Área de perforación exploratoria Bloque Llanos 40”, (entre otros proyectos), la compra del \npredio La Solución, para posteriormente realizar la transferencia de derechos (cesión) a favor de la \nAlcaldía Municipal de Paz de Ariporo, y que ésta sea la única titular de derechos sobre ese bien. En \nese sentido, mediante el artículo primero de la Resolución 1817 del 10 de septiembre de 2019, la \nANLA aprobó el plan de compensación presentado el cual establece que establece:\n“ARTÍCULO PRIMERO. Aprobar el plan de Compensación presentado por la sociedad PAREX \nRESOURCES COLOMBIA LTD SUCURSAL, mediante comunicación con radicación 2019051663-1-000 \ndel 24 de abril de 2019, para el cumplimento de las obligaciones por aprovechamiento de la cobertura \nvegetal, establecidas en el artículo décimo séptimo de la Resolución 0072 de 29 de enero de 2013 y la \nficha de manejo LLA40-B9: Compensación por Aprovechamiento de la Cobertura Vegetal, por el \ndesarrollo de las actividades para el proyecto “Área de Perforación Exploratoria Llanos 40\", \nespecíficamente sobre 130 ha pendientes por compensar”\nPosteriormente, mediante el artículo segundo de la Resolución 1817 del 10 de septiembre de 2019, \nla ANLA modificó el artículo décimo séptimo de la Resolución 72 del 29 de enero de 2013, en el \nsentido de incluir dentro de las actividades para el cumplimento de las obligaciones de compensación \npor aprovechamiento de la cobertura vegetal la adquisición de predios con fines de Preservación \no Restauración.\n“ARTÍCULO SEGUNDO. Aprobar la modificación el artículo décimo séptimo de la Resolución 0072 de \n29 de enero de 2013, en sentido de incluir dentro de las actividades para el cumplimento de las \nobligaciones de compensación por aprovechamiento de la cobertura vegetal la adquisición de predios \ncon fines de Preservación o Restauración, el cual quedará como sigue: \n“ARTÍCULO DÉCIMO SÉPTIMO. - Establecer medida de compensación a la sociedad RAMSHORN \nINTERNATIONAL LIMITED, por el aprovechamiento de la cobertura vegetal, consistente en el \nestablecimiento de cobertura vegetal con especies nativas en el área de influencia del Proyecto a través \nde la adquisición de predios con fines de Preservación o Restauración en las siguientes proporciones: \n1. Para bosques de galería, la compensación debe ser de 1:7. \n2. Para herbazales densos, cualquiera que sea sus características (de tierra firme arbolado o no \narbolado, inundables), la compensación debe ser de 1:5.\n3. En el resto de la cobertura (pastos limpios, cultivos transitorios y tierras degradadas), la \ncompensación será de 1:3. (…)”\nLuego, mediante el artículo tercero de la resolución en mención, la ANLA aprobó la adquisición del \npredio La solución citando\n“ARTÍCULO TERCERO. Aprobar la adquisición del predio denominado “La Solución” y su entrega a la \nalcaldía municipal de Paz de Ariporo, específicamente el polígono tercero para el cumplimiento de las \nobligaciones por aprovechamiento de la cobertura vegetal, establecidas en el artículo décimo séptimo \nde la Resolución 0072 de 29 de enero de 2013 y la ficha de manejo LLA40-B9: Compensación por \nAprovechamiento de la Cobertura Vegetal, correspondiente a un área de 298,6 ha, su única \ndestinación deberá corresponder a acciones de Preservación y Restauración”\nConsiderando que la propuesta de compensación ambiental se formuló de manera agrupada para \nlos siguientes expedientes: LAM5607, LAM5018, LAM4637, LAM4399, LAM5055, LAM5433, \nLAM4660, LAM5041, LAM4983 y LAM4525, la cual se centraba en la adquisición de áreas de interés \nambiental con fines de conservación y/o protección, incluyendo actividades de aislamiento, \nespecíficamente sobre el Predio La Solución; con la aprobación de la adquisición del predio La \nSolución, Parex adelantó la negociación y compra del predio mediante escritura pública No 5329 del \n16 de diciembre de 2019 (“Anexo 6. Soportes de compra del predio estudios previos” del Informe \nfinal), presentada mediante comunicación con radicado 2021219785-1-000.\n\nResolución No.  00252           Del   14 de febrero de 2023            Hoja No. 7 de 15\n“POR LA CUAL SE RESUELVE UN RECURSO DE REPOSICIÓN”\nOficinas: Carrera 13 A No. 34 – 72 Edificio 13 35 Pisos 8 al 11 Bogotá, D.C.\nCentro de Orientación y Radicación de Correspondencia: Carrera 13 A No. 34 – 72 Edificio 13 35 \nLocales 110 al 112 Bogotá, D.C.  \nCódigo Postal 110311156\nNit.: 900.467.239-2\nLínea de Orientación y Contacto Ciudadano: 57 (1) 2540100 / 018000112998 PBX: 57 (1) 2540111\nwww.anla.gov.co    Email: licencias@anla.gov.co  \nPágina 7 de 15\nPara el caso del proyecto “Área de Perforación Exploratoria Llanos 40” la propuesta fue evaluada \nmediante el Concepto Técnico 4106 del 30 de julio de 2019, cuyos apartes más relevantes quedaron \nconsignados en la parte considerativa de la Resolución 1817 del 10 de septiembre de 2019, entre \nlos cuales se destacan:\n“(…) Como se puede evidenciar, la obligación establecida en el artículo décimo séptimo, décimo octavo \nde la Resolución 0072 de 29 de enero de 2013 y la Ficha LLA40-B9: Compensación por aprovechamiento \nde la Cobertura Vegetal, se enfoca en el establecimiento de reforestaciones con especies nativas, sin \nembargo frente a la solicitud presentada por el Titular mediante radicado 2019051663-1-000 del 24 de \nabril de 2019, enfocada en la adquisición de predios, esta Autoridad considera viable modificar la \nobligación en sentido de incluir dentro de las actividades para el cumplimiento de las obligaciones \nderivadas del aprovechamiento de la cobertura vegetal por el desarrollo del proyecto “Área de \nPerforación Exploratoria Llanos 40” la compra de predios.\nEste pronunciamiento se emite bajo los siguientes argumentos: \n<0000> Los beneficios ambientales que se evidencian por la adquisición del predio La Solución, agrupando las \nobligaciones de varios expedientes permite la adquisición de un área aproximada de 631,984306 ha, \ncuyo predio colinda con una RNSC La Esperanza lo cual disminuye la presión antrópica sobre la reserva, \nfavoreciendo procesos de conectividad, servicios ecosistémicos, biodiversidad entre otros. \n<0000> Las actuales condiciones bióticas que se reportan sobre el predio La Solución.\n<0000> Se evidencia la gestión adelantada por el Titular en cuanto a la entrega del predio con fines de \npreservación y restauración a la alcaldía de Paz de Ariporo, conforme se soporta en el acta firmada el \n20 de marzo de 2019 y adjunta al radicado citado en el asunto en el Anexo 5. Acta de concertación \nAlcaldía Paz de Ariporo. \n<0000> El desarrollo de acciones de aislamiento con el fin de disminuir los tensionantes por las actividades \nagropecuarias que se desarrollan en los predios colindantes, favoreciendo las condiciones ambientales \nque presenta el predio La Solución y la RNSC La Esperanza. \nEspecíficamente; en el presente concepto técnico se evalúa el predio La Solución, el cual al realizarse \nde forma agrupada con otros nueve expedientes, “sin que esto implique alguna confusión en el \ncumplimento de las diferentes obligaciones” permite adquirir un predio con un área aproximadamente de \n631,984306 ha, lo cual evidencia beneficios ambientales, generando conectividad, servicios \necosistémicos, biodiversidad entre otros beneficios ambientales en el área.\n(…)\nDe acuerdo con el análisis realizado en el presente acto, en el cual se considera viable aprobar la compra \ndel predio La Solución y su entrega a la alcaldía de Paz de Ariporo, se aclara que no se presenta \ncumplimiento a ninguna de las obligaciones establecidas en el artículo décimo séptimo de la Resolución \n0072 de 29 de enero de 2013 y la ficha de manejo LLA40-B9: Compensación por aprovechamiento de \nla Cobertura Vegetal y los requerimientos que derivan de estas obligaciones en seguimientos posteriores, \nsiendo esta una nueva propuesta para el cumplimiento de las obligaciones de compensación por \naprovechamiento de la cobertura vegetal. \n(…)”\nAsí las cosas, con la aprobación de la adquisición del predio La Solución, Parex inició la ejecución \ndel plan de compensación ambiental presentado, adelantando la negociación y compra del predio \nLa solución mediante escritura pública No 5329 del 16 de diciembre de 2019 (“Anexo 6. Soportes de \ncompra del predio estudios previos” del Informe final), presentada mediante comunicación con \nradicado 2021219785-1-000. Durante el proceso de levantamiento topográfico, revisión de cabida y \nlinderos, se identificó que la superficie total del predio correspondía a 751 hectáreas (8.079 m²), y no \na las 633,53 hectáreas que aparecían inicialmente es la (sic) escritura de Resolución Número 3276 \ndel 26 de agosto de 1996 del INCORA, motivo por el cual se solicitó ante el Instituto Geográfico \nAgustín Codazzi ( IGAC), el ajuste de cabida para el predio la Solución tal como se soporta en el \nanexo 2 del Informe final presentado mediante el comunicado con radicado 2021219785-1-000 del \n11 de octubre de 2021.\nCon la identificación y verificación del área adicional que presentó el predio La Solución \ncorrespondiente a 118.25 ha, y considerando que el predio ya había sido aprobado por la Autoridad \nAmbiental y cumplía con todos los atributos físico ambientales para dar cumplimiento a obligaciones \nde compensación ambiental según los argumentos expuestos anteriormente, Parex redistribuyó el \nárea adicional para dar cumplimiento a una mayor obligación de compensación ambiental de los \ndiferentes expedientes para los cuales fue aprobada la propuesta.\n\nResolución No.  00252           Del   14 de febrero de 2023            Hoja No. 8 de 15\n“POR LA CUAL SE RESUELVE UN RECURSO DE REPOSICIÓN”\nOficinas: Carrera 13 A No. 34 – 72 Edificio 13 35 Pisos 8 al 11 Bogotá, D.C.\nCentro de Orientación y Radicación de Correspondencia: Carrera 13 A No. 34 – 72 Edificio 13 35 \nLocales 110 al 112 Bogotá, D.C.  \nCódigo Postal 110311156\nNit.: 900.467.239-2\nLínea de Orientación y Contacto Ciudadano: 57 (1) 2540100 / 018000112998 PBX: 57 (1) 2540111\nwww.anla.gov.co    Email: licencias@anla.gov.co  \nPágina 8 de 15\nPara el caso puntual del proyecto denominado \"Área de Perforación Exploratoria Llanos 40”, \nse adquirieron 357 ha (las cuales incluyen la obligación de compensación (155,16 ha) más el \nfactor de adicionalidad), y con dicha adquisición se dio cumplimiento a las 155,16 ha de las \nobligaciones de compensación ambiental por aprovechamiento de la cobertura vegetal, \nestablecidas en el artículo décimo séptimo de la Resolución 0072 de 29 de enero de 2013 y la \nficha de manejo LLA40- B9: Compensación por Aprovechamiento de la Cobertura Vegetal, tal \ncomo se relacionó en el Informe final (Ver Tabla 1), presentado mediante comunicación con radicado \n2021219785-1-000, soportado mediante escritura pública No 768 del 29 de julio de 2021 (“Anexo 7. \nSoportes de donación del predio” del Informe final), mediante la cual se realizó la cesión del predio \na favor de la Alcaldía del Municipio de Paz de Ariporo, y su respectiva GDB presentada mediante \ncomunicación con radicado 202124823-1-000.\nLa anterior información fue corroborada por la ANLA en la página 111 del concepto técnico No. 06710 \ndel 31 de octubre de 2022, el cual hace parte integral de la Resolución 02957 del 16 de diciembre \nde 2022 en el que cita:\n“(…) La GDB presentada cumple con la estructura del modelo de almacenamiento geográfico adoptado \npor la Resolución 2182 del 23 de diciembre de 2016, asimismo el contenido de la GDB es consistente \ncon la información reportada en el informe final de la compensación a través del predio La Solución (…)”\nPor lo anterior, y toda vez que la propuesta de compensación ambiental se formuló de manera \nagrupada para varios expedientes (10), es necesario aclarar que en cumplimiento de lo establecido \nen el artículo décimo séptimo de la Resolución 0072 de 29 de enero de 2013 y la ficha de manejo \nLLA40-B9: Compensación por Aprovechamiento de la Cobertura Vegetal, el área destinada para \ncompensación del proyecto “Área de perforación exploratoria Bloque Llanos 40” EXP \nLAM5607 corresponde a 155, 16 ha mas el factor de adicionalidad mediante la adquisición del \npredio “La Solución”, por lo cual Parex considera procedente aclarar el artículo quinto de la \nResolución 02957 del 16 de diciembre de 2022.”\n1.3. Consideraciones de la Autoridad Nacional.\nLos argumentos de inconformidad presentados por el recurrente fueron objeto de \nevaluación por el equipo técnico de la Autoridad Nacional y mediante Concepto técnico 189 \ndel 31 de enero de 2023, se presentaron las siguientes consideraciones:\n“En primer lugar, es necesario aclarar que la obligación de compensación se configuró a partir de lo \ndispuesto en el artículo cuarto de la Resolución 0072 del 29 de enero de 2013:\n\nResolución No.  00252           Del   14 de febrero de 2023            Hoja No. 9 de 15\n“POR LA CUAL SE RESUELVE UN RECURSO DE REPOSICIÓN”\nOficinas: Carrera 13 A No. 34 – 72 Edificio 13 35 Pisos 8 al 11 Bogotá, D.C.\nCentro de Orientación y Radicación de Correspondencia: Carrera 13 A No. 34 – 72 Edificio 13 35 \nLocales 110 al 112 Bogotá, D.C.  \nCódigo Postal 110311156\nNit.: 900.467.239-2\nLínea de Orientación y Contacto Ciudadano: 57 (1) 2540100 / 018000112998 PBX: 57 (1) 2540111\nwww.anla.gov.co    Email: licencias@anla.gov.co  \nPágina 9 de 15\n“4. APROVECHAMIENTO FORESTAL \n7. Desarrollar el programa de Compensación por aprovechamiento forestal, propuesto en el EIA, con los \najustes solicitados en el presente acto administrativo (Medidas de Manejo), para lo cual se deberán tener \nen cuenta las siguientes proporciones a compensar por cada hectárea intervenida, según sea el tipo de \ncobertura vegetal afectada, así: \n- Para bosques de galería la compensación debe ser de 1:7. \n- Para herbazales densos, cualquiera que sea sus características (de tierra firme arbolado o no arbolado, \ninundables), la compensación debe ser de 1:5.\n- En el resto de las coberturas (pastos limpios, cultivos transitorios y tierras degradadas), la \ncompensación será de 1:3”\nAsí las cosas, de acuerdo con las consideraciones expuestas en la Resolución 01817 del 10 de \nseptiembre de 2019 el área a compensar corresponde a 154,57 hectáreas:\n“Se concluye que el Titular presentó la información relacionada con las áreas a compensar, las cuales \ncoinciden en su totalidad con las presentadas mediante radicado 2019051663- 1-000 del 24 de abril de \n2019, indicando un área total a compensar de 154,57 ha por aprovechamiento de la cobertura vegetal \nestablecidas en el artículo décimo séptimo de la Resolución 0072 de 29 de enero de 2013 y las fichas \nde manejo LLA40-B9: Compensación por Aprovechamiento de la Cobertura Vegetal\n(…)” (Negrilla fuera de texto)\nLa Sociedad a la fecha cuenta con dos (2) planes de compensación aprobados para el proyecto \n“Área de Perforación Exploratoria Llanos 40”:\nTabla 1. Obligaciones de compensación vigentes para el expediente LAM5607\nPlan de compensación\nActo administrativo de \naprobación\nRadicados \nde \npresentación del plan\nÁreas aprobadas\nSistemas agroforestales \nde cacao\nAuto 6193 del 12 de \nagosto de 2019\n2018124208-1-000 \ndel \n10 de septiembre del \n2018\n130 ha\nAdquisición del predio La \nSolución\nResolución 1817 del 10 \nde septiembre de 2019.\n2019051663-1-000 \ndel \n24 de abril de 2019\n24.57 ha\nFuente: Adaptado del Concepto técnico 06710 del 31 de octubre de 2022\nAsí mismo, en el plan de compensación presentado mediante comunicación con radicación ANLA \n2019051663-1-000 del 24 de abril de 2019, la Sociedad presenta las áreas intervenidas y a \ncompensar, confirmándose el área de 154,7 hectáreas reportada en el radicado 2019051663- 1-000 \ndel 24 de abril de 2019. \nTabla 2. Áreas intervenidas por el proyecto APE Llanos 40.\nLOCACIÓ\nN\nPOZ\nOS\nVÍA \nDE \nACC\nESO \n(m2)\nZONA\nS \nDE \nPRÉST\nAMO \nVÍA \n(m2)\nPLATAF\nORMA \n(m2)\nÁREA \nTOTAL \nINTERVE\nNIDA \n(HA)\nCOBERT\nURA \nINTERVE\nNIDA\nÁREA \nTOTAL \nINTERVE\nNIDA \nPOR \nCOBERT\nURA (HA)\nFACTOR \nDE \nCOMPENS\nACIÓN\nÁREA A \nCOMPE\nNSAR \nPOR \nCOBERT\nURA \n(HA)\nCelti\ns - 1\nPastos\n2,47\n3\n7,41\nCELTIS\nArdis\nia - 1\n2.03\n9,39\n0\n22.880,40\n2,49\nBosque \nde \nGalería\n0,02\n7\n0,16\n\nResolución No.  00252           Del   14 de febrero de 2023            Hoja No. 10 de 15\n“POR LA CUAL SE RESUELVE UN RECURSO DE REPOSICIÓN”\nOficinas: Carrera 13 A No. 34 – 72 Edificio 13 35 Pisos 8 al 11 Bogotá, D.C.\nCentro de Orientación y Radicación de Correspondencia: Carrera 13 A No. 34 – 72 Edificio 13 35 \nLocales 110 al 112 Bogotá, D.C.  \nCódigo Postal 110311156\nNit.: 900.467.239-2\nLínea de Orientación y Contacto Ciudadano: 57 (1) 2540100 / 018000112998 PBX: 57 (1) 2540111\nwww.anla.gov.co    Email: licencias@anla.gov.co  \nPágina 10 de 15\nLOCACIÓ\nN\nPOZ\nOS\nVÍA \nDE \nACC\nESO \n(m2)\nZONA\nS \nDE \nPRÉST\nAMO \nVÍA \n(m2)\nPLATAF\nORMA \n(m2)\nÁREA \nTOTAL \nINTERVE\nNIDA \n(HA)\nCOBERT\nURA \nINTERVE\nNIDA\nÁREA \nTOTAL \nINTERVE\nNIDA \nPOR \nCOBERT\nURA (HA)\nFACTOR \nDE \nCOMPENS\nACIÓN\nÁREA A \nCOMPE\nNSAR \nPOR \nCOBERT\nURA \n(HA)\nPastos/ \nCultivos\n2,18\n3\n6,54\nHerbazal\n4,19\n5\n20,93\nTHALIA\nThali\na - 1\n29.9\n94,1\n2\n6.562,7\n5\n27.406,31\n6,40\nVegetació\nn \nSecundari\na\n0,03\n7\n0,21\nPastos/ \nCultivos\n1,62\n3\n4,86\nHerbazal\n12,78\n5\n63,89\nBERBENA\nBerb\nena - \n1\n94.9\n71,2\n7\n31.795,\n13\n25.048,20\n15,18\nBosque \nde \nGalería\n0,78\n7\n5,48\nBEGONI\nA\nBego\nnia - \n1\n35.6\n65,0\n9\n10.884,\n47\n30.431,16\n7,70\nHerbazal\n7,70\n5\n38,49\nLÍNEA \nDE \nFLUJO \nBEGONIA-\nBERBENA\nLíne\na de \nflujo\n13.1\n84,0\n0\n0\n0\n1,32\nHerbazal\n1,32\n5\n6,59\nTOTAL\n33,09\n154,57\nFuente: Tomado del Plan de compensación con radicado 2019051663-1-000 del 24 de abril de 2019\nAhora bien, conforme lo señala la Sociedad, a través del artículo primero de la Resolución 1817 del \n10 de septiembre del 2019 fue aprobado el plan de compensación presentado por PAREX \nRESOURCES COLOMBIA LTD SUCURSAL, mediante comunicación con radicación 2019051663-\n1-000 del 24 de abril de 2019, para el cumplimento de las obligaciones por aprovechamiento de la \ncobertura vegetal en el desarrollo del proyecto “Área de Perforación Exploratoria Llanos 40\", \nestableciendo un área específica de 130 hectáreas pendientes por compensar. \nDe acuerdo con el Concepto Técnico No. 04106 del 30 de julio de 2019, el cual fue acogido por la \nResolución 1817 del 10 de septiembre del 2019, el área propuesta para llevar a cabo las acciones \nde compensación en el predio la Solución correspondió a 130 hectáreas:\n“Cabe resaltar que el Titular incluye dentro de la propuesta como área intervenida un valor total de 154,57 \nha, sin embargo manifiesta que 24,57 ha ya se encuentra compensada o en ejecución, por lo tanto el \nárea destinada a compensar por la compra del predio la Solución corresponde a 130 ha, en donde \nse incluye a voluntad del Titular una relación adicional de 1:2,3, sumando un área total de 298,6 ha. \nComo conclusión se indica que la propuesta se centra en la compensación de 130 ha de las 154,57 ha \na compensar” (negrilla fuera de texto).\nInformación que es rectificada en el plan de compensación presentado mediante radicado \n2019051663-1-000 del 24 de abril de 2019:\nTabla 3. Distribución de áreas del predio La Solución, como cumplimiento a las obligaciones \nde compensación.\nExpedient\ne\nÁrea \nIntervenid\na (ha)\nÁrea \na \ncompensa\nr (ha)\nÁrea \ncompensad\na \no \nen \nejecución \n(ha)\nÁrea \ndestinada \na \ncompensació\nn compra del \npredio \nLa \nSolución (ha)\nÁrea \npropuest\na \na \nadquirir \ndel predio \nLa \nSolución \n(ha)\nRelación \nde \ncompensació\nn mediante la \ncompra \ndel \npredio \nLa \nSolución\nLAM5607\nÁrea \nde \nPerforación \nExploratori\n33,09\n154,57\n24,57\n130\n298,6\n1:2,3\n\nResolución No.  00252           Del   14 de febrero de 2023            Hoja No. 11 de 15\n“POR LA CUAL SE RESUELVE UN RECURSO DE REPOSICIÓN”\nOficinas: Carrera 13 A No. 34 – 72 Edificio 13 35 Pisos 8 al 11 Bogotá, D.C.\nCentro de Orientación y Radicación de Correspondencia: Carrera 13 A No. 34 – 72 Edificio 13 35 \nLocales 110 al 112 Bogotá, D.C.  \nCódigo Postal 110311156\nNit.: 900.467.239-2\nLínea de Orientación y Contacto Ciudadano: 57 (1) 2540100 / 018000112998 PBX: 57 (1) 2540111\nwww.anla.gov.co    Email: licencias@anla.gov.co  \nPágina 11 de 15\nExpedient\ne\nÁrea \nIntervenid\na (ha)\nÁrea \na \ncompensa\nr (ha)\nÁrea \ncompensad\na \no \nen \nejecución \n(ha)\nÁrea \ndestinada \na \ncompensació\nn compra del \npredio \nLa \nSolución (ha)\nÁrea \npropuest\na \na \nadquirir \ndel predio \nLa \nSolución \n(ha)\nRelación \nde \ncompensació\nn mediante la \ncompra \ndel \npredio \nLa \nSolución\na \nBloque \nLlanos 40\nLAM5018\nBloque de \nPerforación \nExploratori\na Llanos 26\n21,09\n54,12\n20,00\n34,12\n78,4\n1:2,3\nLAM4637\nBloque de \nPerforación \nExploratori\na Llanos 20\n17,58\n34,18\n3,93\n30,25\n69,5\n1:2,3\nLAM4399\nBloque de \nPerforación \nExploratori\na El Edén\n10,80\n21,60\n0,00\n21,60\n49,6\n1:2,3\nLAM5055\nÁrea \nde \ninterés \nde \nPerforación \nExploratori\na Cerrero\n7,67\n15,34\n0,00\n15,34\n35,2\n1:2,3\nLAM5433\nÁrea \nde \nPerforación \nExploratori\na Llanos 57\n15,02\n15,02\n0,00\n15,02\n34,5\n1:2,3\nLAM4660\nÁrea \nde \nInterés \nde \nPerforación \nExploratori\na Cebucán\n12,59\n12,59\n0,00\n12,59\n28,9\n1:2,3\nLAM5041\nÁrea \nde \nPerforación \nExploratori\na Llanos 17\n6,92\n6,92\n0,00\n6,92\n15,9\n1:2,3\nLAM4983\nÁrea \nde \nPerforación \nExploratori\na \nBloque \nLLA 24\n5,61\n5,61\n0,00\n5,61\n12,9\n1:2,3\nLAM4525\nBloque de \nPerforación \nExploratori\na Jagüeyes \nA- \nSector \n1A\n3,70\n3,70\n0,00\n3,70\n8,5\n1:2,3\nTotal\n134,07\n323,65\n48,5\n275,15\n633,54\nFuente: Tomado del Plan de compensación con radicado 2019051663-1-000 del 24 de abril de 2019\nDe acuerdo con la Tabla No. 3, la Sociedad reportó un área a compensar para el expediente \nLAM5607 dentro del predio la Solución de 130 hectáreas y un área propuesta a adquirir dentro del \npredio la Solución de 298,6 hectáreas. Área que coincide con la aprobada mediante el artículo tercero \nde la Resolución 1817 del 10 de septiembre del 2019:\n“ARTÍCULO TERCERO. Aprobar la adquisición del predio denominado “La Solución” y su entrega a la \nalcaldía municipal de Paz de Ariporo, específicamente el polígono tercero para el cumplimiento de las \nobligaciones por aprovechamiento de la cobertura vegetal, establecidas en el artículo décimo séptimo \n\nResolución No.  00252           Del   14 de febrero de 2023            Hoja No. 12 de 15\n“POR LA CUAL SE RESUELVE UN RECURSO DE REPOSICIÓN”\nOficinas: Carrera 13 A No. 34 – 72 Edificio 13 35 Pisos 8 al 11 Bogotá, D.C.\nCentro de Orientación y Radicación de Correspondencia: Carrera 13 A No. 34 – 72 Edificio 13 35 \nLocales 110 al 112 Bogotá, D.C.  \nCódigo Postal 110311156\nNit.: 900.467.239-2\nLínea de Orientación y Contacto Ciudadano: 57 (1) 2540100 / 018000112998 PBX: 57 (1) 2540111\nwww.anla.gov.co    Email: licencias@anla.gov.co  \nPágina 12 de 15\nde la Resolución 0072 de 29 de enero de 2013 y la ficha de manejo LLA40-B9: Compensación por \nAprovechamiento de la Cobertura Vegetal, correspondiente a un área de 298,6 ha, su única destinación \ndeberá corresponder a acciones de Preservación y Restauración, sin embargo, la sociedad mencionada \ndeberá cumplir con las obligaciones establecidas en el presente acto administrativo” (negrilla fuera texto). \nAsí mismo, en el concepto técnico No. 6710 del 31 de octubre de 2022 el cual fue acogido por la \nResolución 2957 del 13 de diciembre de 2022, donde se dio cumplimiento a la obligación de \ncompensación se indica el área a compensar de acuerdo con la Resolución 1817 del 10 de \nseptiembre de 2019 que aprobó el plan de compensación:\n“La compensación mediante la adquisición del predio La Solución fue aprobada por el artículo tercero de \nla Resolución 1817 del 10 de septiembre de 2019. El objetivo de la compra es el de restauración y \npreservación de 130 ha de las 154,57 ha que corresponde al total de la compensación del proyecto \nÁrea de Perforación Exploratoria Llanos 40” (negrilla fuera de texto). \nConforme a lo anteriormente descrito, para esta Autoridad no es claro porqué la Sociedad hace \nreferencia a que el área a compensar corresponde a 155,16 hectáreas, si de acuerdo con el plan de \ncompensación presentado mediante radicado 2019051663-1-000 del 24 de abril de 2019 y aprobado \na través del artículo primero Resolución 1817 del 10 de septiembre del 2019, el área a compensar \npor aprovechamiento de la cobertura vegetal para el proyecto “Área de Perforación Exploratoria \nLlanos 40” corresponde a 154,57 hectáreas; de las cuales 24,57 hectáreas se están ejecutando bajo \nsistemas agroforestales, acción aprobada mediante el Auto 6193 del 12 de agosto de 2019 y 130 \nhectáreas fueron ejecutadas a través de la adquisición del predio denominado “La Solución”, \naprobada mediante la Resolución 1817 del 10 de septiembre de 2019. \nPor otra parte, la Sociedad indica que, el área total del predio la Solución fue modificada debido a \nque durante el proceso de levantamiento topográfico se identificó que la superficie total del predio \ncorrespondía a 751 hectáreas y no a 633,53 hectáreas, por lo cual, se redistribuyó entre todos los \nproyectos el área adicional correspondiente a 118,25 hectáreas. \nAsí las cosas, para el caso del expediente LAM5607 la Sociedad indica que se adquirieron 357 \nhectáreas y no 298,6 hectáreas como se había establecido en el plan de compensación presentado \nmediante radicado 2019051663-1-000 del 24 de abril de 2019 y aprobado a través del artículo \nprimero Resolución 1817 del 10 de septiembre del 2019. \nFrente a lo anterior se aclara que, si bien el área compensada en el predio La Solución es mayor a \nlo aprobado mediante el artículo tercero de la Resolución 1817 del 10 de septiembre del 2019 (298,6 \nha), la obligación de compensación está determinada por lo dispuesto en el artículo décimo séptimo \nde la Resolución 0072 del 29 de enero de 2013 y la ficha de manejo LLA40-B9. Por lo tanto, de \nacuerdo con las áreas intervenidas y a compensar presentadas por la Sociedad mediante el Plan de \nCompensación remitido mediante radicado 2019051663-1-000 del 24 de abril de 2019, el área a \ncompensar corresponde a 154,57 hectáreas de las cuales 130 hectáreas fueron ejecutadas a partir \nde la adquisición del predio “La Solución” (Ver Tabla No. 1). \nPor lo tanto, respecto a la solicitud realizada por la Sociedad mediante radicado 2022290928-1-000 \ndel 26 de diciembre del 2022, la Autoridad Nacional de Licencias Ambientales considera propicio \naclarar el artículo quinto de la Resolución 02957 del 13 de diciembre de 2022, en el sentido de incluir \nel área compensada en el predio “La Solución” en cumplimiento a la obligación de compensación \npor aprovechamiento de la cobertura vegetal establecida en el artículo décimo séptimo de la \nResolución 0072 de 29 de enero de 2013 y la ficha de manejo LLA40-B9.\nNo obstante, se aclara que, si bien la Autoridad considera viable modificar el artículo quinto de la \nResolución 02957 del 13 de diciembre de 2022, no acepta el área indicada por la Sociedad mediante \nel oficio 2022290928-1-000 del 26 de diciembre del 2022, ya que, una vez realizada la respectiva \nrevisión documental se determinó que, el área compensada en el predio “La Solución”, aprobado en \nel artículo tercero de la Resolución 1817 del 10 de septiembre de 2019 no corresponde a 155,16 \nhectáreas sino a 130 hectáreas.\nAsí las cosas, se considera viable MODIFICAR el artículo quinto de la Resolución 02957 del 13 de \ndiciembre de 2022, en el sentido de incluir el área compensada en el predio la “Solución” \ncorrespondiente a 130 hectáreas.\n(…)”\nDe acuerdo con las consideraciones técnicas presentadas, se encuentra procedente acoger \nparcialmente las pretensiones del recurrente, en el sentido de ajustar el área de \ncompensación que se declara cumplida.\n\nResolución No.  00252           Del   14 de febrero de 2023            Hoja No. 13 de 15\n“POR LA CUAL SE RESUELVE UN RECURSO DE REPOSICIÓN”\nOficinas: Carrera 13 A No. 34 – 72 Edificio 13 35 Pisos 8 al 11 Bogotá, D.C.\nCentro de Orientación y Radicación de Correspondencia: Carrera 13 A No. 34 – 72 Edificio 13 35 \nLocales 110 al 112 Bogotá, D.C.  \nCódigo Postal 110311156\nNit.: 900.467.239-2\nLínea de Orientación y Contacto Ciudadano: 57 (1) 2540100 / 018000112998 PBX: 57 (1) 2540111\nwww.anla.gov.co    Email: licencias@anla.gov.co  \nPágina 13 de 15\nNo obstante, no es viable aceptar la cifra de 155.6 hectáreas referida por la Sociedad pues \ncomo ya se precisó en las anteriores consideraciones técnicas y como en efecto se señaló \nen el plan de compensación presentado por la Sociedad mediante comunicación con \nradicación 2019051663-1-000 del 24 de abril de 2019 y aprobado a través del artículo \nprimero Resolución 1817 del 10 de septiembre del 2019, el área a compensar por \naprovechamiento de la cobertura vegetal para el proyecto “Área de Perforación Exploratoria \nLlanos 40” corresponde a 154,57 hectáreas; de las cuales 24,57 hectáreas se están \nejecutando bajo sistemas agroforestales, acción aprobada mediante el Auto 6193 del 12 de \nagosto de 2019 y las restantes 130 hectáreas fueron ejecutadas a través de la adquisición \ndel predio denominado “La Solución”, aprobada mediante la Resolución 1817 del 10 de \nseptiembre de 2019.\nAdicionalmente, en relación con que la “GDB presentada mediante comunicación con radicado \n202124823-1-000 del 17 de noviembre de 2021 en el cual se especializa el área adquirida en el \npredio la Solución para el cumplimiento de las medidas de compensación para el proyecto “Área de \nperforación exploratoria Bloque Llanos 40” EXP LAM5607 corresponde a 357 ha, el cual incluye \n155,16 ha mas el factor de adicionalidad.”, como ya se señaló en las consideraciones técnicas, \nse reitera que si bien el área compensada en el predio denominado “La Solución”, es mayor \na lo aprobado mediante el artículo tercero de la Resolución 1817 del 10 de septiembre del \n2019, es decir 298,6 ha, la obligación de compensación está determinada por lo dispuesto \nen el artículo décimo séptimo de la Resolución 72 del 29 de enero de 2013 y la ficha de \nmanejo LLA40-B9.\nEn tal sentido, y en atención a las áreas intervenidas y a compensar presentadas por la \nsociedad en el Plan de Compensación remitido a través de la comunicación con radicación \n2019051663-1-000 del 24 de abril de 2019, el área a compensar corresponde a 154,57 \nhectáreas de las cuales 130 hectáreas fueron ejecutadas a partir de la adquisición del predio \n“La Solución”, como se precisó líneas atrás.\nEn consecuencia, se modificará la decisión contenida en el artículo quinto de la Resolución \n2957 del 13 de diciembre de 2022, en el sentido de indicar que se declara el cumplimiento \nde la obligación de compensación de 130 ha, tal como se señalará en la parte resolutiva \ndel presente acto administrativo.\nPara concluir, a fin de atender los argumentos jurídicos relacionados con el “Principio de \neficacia administrativa”, es preciso señalar que dicho principio supone que “(…) [L]as \nautoridades buscarán que los procedimientos logren su finalidad y, para el efecto, removerán de \noficio los obstáculos puramente formales, evitarán decisiones inhibitorias, dilaciones o retardos y \nsanearán, de acuerdo con este Código las irregularidades procedimentales que se presenten, en \nprocura de la efectividad del derecho material objeto de la actuación administrativa.”\nLo anterior, en virtud del numeral 11 del artículo tercero de la Ley 1437 de 2011.\nAsí pues, es claro que tal principio está orientado a que los procedimientos que adelanta la \nadministración logren su finalidad, y si bien es cierto que se deben remover los obstáculos \nmeramente formales, también es cierto que se deben evitar las decisiones inhibitorias. \nDicho de otra manera, la eficacia administrativa no implica que se deban pasar por alto \nrequisitos fundamentales para la toma de decisiones.\nEn línea con lo anterior, se resalta que es precisamente en virtud de este principio que la \nAutoridad Nacional encuentra ajustada tanto técnica como jurídicamente la decisión objeto \nde recurso, como quiera que, si bien es cierto, se debe ajustar parte del pronunciamiento, \nno hay lugar a acoger las pretensiones en los términos argumentados por el recurrente.\nEn mérito de lo expuesto, se\nRESUELVE\n\nResolución No.  00252           Del   14 de febrero de 2023            Hoja No. 14 de 15\n“POR LA CUAL SE RESUELVE UN RECURSO DE REPOSICIÓN”\nOficinas: Carrera 13 A No. 34 – 72 Edificio 13 35 Pisos 8 al 11 Bogotá, D.C.\nCentro de Orientación y Radicación de Correspondencia: Carrera 13 A No. 34 – 72 Edificio 13 35 \nLocales 110 al 112 Bogotá, D.C.  \nCódigo Postal 110311156\nNit.: 900.467.239-2\nLínea de Orientación y Contacto Ciudadano: 57 (1) 2540100 / 018000112998 PBX: 57 (1) 2540111\nwww.anla.gov.co    Email: licencias@anla.gov.co  \nPágina 14 de 15\nARTÍCULO PRIMERO. Modificar el artículo quinto de la Resolución 2957 del 13 de \ndiciembre de 2022, de conformidad con lo expuesto en la parte motiva del presente acto \nadministrativo, las cuales quedarán de la siguiente manera:\n“ARTÍCULO QUINTO. Declarar que la sociedad PAREX RESOURCES COLOMBIA \nLTD SUCURSAL., cumplió con la obligación de compensación de 130  ha, \nestablecida en el artículo décimo séptimo de la Resolución 0072 del 29 de enero de \n2013 y la ficha de manejo LLA40-B9: Compensación por Aprovechamiento de la \nCobertura Vegetal, en el predio “La Solución” ubicado en el municipio de Paz de \nAriporo, departamento de Casanare, aprobado en el artículo tercero de la \nResolución 1817 del 10 de septiembre de 2019, de conformidad con lo expuesto en \nla parte motiva del presente acto administrativo”.\nARTÍCULO SEGUNDO. Las demás disposiciones contenidas en la Resolución 2957 del 13 \nde diciembre de 2022 y no modificadas en el presente acto administrativo, continúan \nvigentes.\nARTÍCULO TERCERO. Notificar el presente acto administrativo al representante legal, o al \napoderado debidamente constituido o a la persona debidamente autorizada por la Sociedad \nPAREX RESOURCES COLOMBIA LTD SUCURSAL, identificada con NIT. 900.268.747-9, \no a quien haga sus veces de conformidad con lo dispuesto en los artículos 67 y siguientes \nde la Ley 1437 de 2011.\nPARÁGRAFO. En el suceso en que el titular de la licencia o el permiso, entre en proceso \nde disolución o régimen de insolvencia empresarial o liquidación regulados por las normas \nvigentes, informará inmediatamente de esta situación a esta Autoridad, con fundamento, \nentre otros, en los artículos 8, 58, 79, 80, 81, 95 numeral 8 de la Constitución Política de \n1991, en la Ley 43 de 1990, en la Ley 222 de 1995, en la Ley 1333 de 2009 y demás normas \nvigentes y jurisprudencia aplicable. \nAdicional a la obligación de informar a esta Autoridad de tal situación, el titular de la licencia \no permiso aprovisionará contablemente las obligaciones contingentes que se deriven de la \nexistencia de un procedimiento ambiental sancionatorio conforme con el artículo 40 de la \nLey 1333 de 2009 o la norma que la adicione, modifique o derogue.\nARTÍCULO CUARTO. Comunicar el contenido del presente acto administrativo a la \nCorporación Autónoma Regional de la Orinoquia – CORPORINOQUÍA, para su \nconocimiento y fines pertinentes.\nARTÍCULO QUINTO. Publicar la presente Resolución en la Gaceta Ambiental de la \nAutoridad Nacional de Licencias Ambientales – ANLA, de conformidad con lo señalado en \nel artículo 71 de la Ley 99 de 1993.\nARTÍCULO SEXTO. Contra el presente acto administrativo no procede recurso alguno de \nconformidad con lo establecido en el artículo 87 del Código de Procedimiento Administrativo \ny de lo Contencioso Administrativo.\nNOTIFÍQUESE, COMUNÍQUESE, PUBLÍQUESE Y CÚMPLASE\nDada en Bogotá D.C., a los 14 de febrero de 2023\nJHON COBOS TELLEZ\nAsesor\n\nResolución No.  00252           Del   14 de febrero de 2023            Hoja No. 15 de 15\n“POR LA CUAL SE RESUELVE UN RECURSO DE REPOSICIÓN”\nOficinas: Carrera 13 A No. 34 – 72 Edificio 13 35 Pisos 8 al 11 Bogotá, D.C.\nCentro de Orientación y Radicación de Correspondencia: Carrera 13 A No. 34 – 72 Edificio 13 35 \nLocales 110 al 112 Bogotá, D.C.  \nCódigo Postal 110311156\nNit.: 900.467.239-2\nLínea de Orientación y Contacto Ciudadano: 57 (1) 2540100 / 018000112998 PBX: 57 (1) 2540111\nwww.anla.gov.co    Email: licencias@anla.gov.co  \nPágina 15 de 15\nEjecutores\nIBLER ANDERSON MOLANO \nRINCON\nContratista\n \n \nRevisor / L\u0000der\nANDREA DEL PILAR SANABRIA \nDEL RIO\nContratista\n \n \nExpediente\nLAM5607\nConcepto técnico \n189 del 31 de enero de 2023\nFecha:\n14 de febrero de 2023\nProceso No.: 2023027838\nArchívese en: LAM5607 \nPlantilla_Resolución_SILA_v3_42852\nNota: Este es un documento electrónico generado desde los Sistemas de Información de la ANLA. El original reposa en los archivos digitales de la \nEntidad.\n"
}