{
  "fuente": "ANLA_GACETA",
  "numero_resolución": "RESOLUCIÓN N° 2651",
  "fecha_resolución": "2023-08-25",
  "anio_resolucion": "2023",
  "nombre_proyecto": "Área de Explotación de Hidrocarburos Quifa”, localizado en",
  "nombre_proyecto_normalizado": "AREA DE EXPLOTACION DE HIDROCARBUROS QUIFA LOCALIZADO EN",
  "ubicación": "Municipio De Puerto Gaitán En El Departamento Del Meta",
  "empresa": "META PETROLEUM CORP SUCURSAL COLOMBIA",
  "empresa_normalizada": "META PETROLEUM CORP SUCURSAL",
  "numero_expediente": "LAM4795",
  "radicados": [
    "2020050695",
    "20236200596802",
    "2022281350",
    "2022283750",
    "2022106948"
  ],
  "descripcion": "Por la cual se resuelve un recurso de reposición interpuesto contra la Resolución 1885 del 25 de agosto de 2023",
  "tipos_infraccion": [
    "Vertimientos",
    "Emisiones atmosféricas",
    "Residuos sólidos",
    "Manejo de aguas",
    "Tala o afectación de bosques",
    "Incumplimiento del PMA",
    "Cierre de pozos"
  ],
  "tipos_infraccion_normalizados": [
    "VERTIMIENTOS",
    "EMISIONES ATMOSFERICAS",
    "RESIDUOS SOLIDOS",
    "MANEJO DE AGUAS",
    "TALA O AFECTACION DE BOSQUES",
    "INCUMPLIMIENTO DEL PMA",
    "CIERRE DE POZOS"
  ],
  "pdf_id": "44586",
  "file_name": "ANLA_44586.pdf",
  "texto_completo": " \nRepública de Colombia \nMinisterio de Ambiente y Desarrollo Sostenible \n \nAUTORIDAD NACIONAL DE LICENCIAS AMBIENTALES \n- ANLA – \nRESOLUCIÓN N° 2651 \n(14 NOV. 2023) \n \nPágina 1 de 108 \n \n“Por la cual se resuelve un recurso de reposición interpuesto contra la Resolución 1885 del \n25 de agosto de 2023” \n \n \nEL DIRECTOR GENERAL DE LA AUTORIDAD NACIONAL DE LICENCIAS AMBIENTALES – \nANLA \n \nEn uso de sus facultades legales establecidas mediante la Ley 99 de 1993, el Decreto Ley 3573 del \n2011 y acorde con lo regulado en el Decreto 1076 del 26 de mayo de 2015, el Decreto 376 de 11 de \nmarzo de 2020, la Resolución 1957 del 5 de noviembre de 2021 de la Autoridad Nacional de \nLicencias Ambientales - ANLA, la Resolución 1223 del 19 de septiembre de 2022 del Ministerio de \nAmbiente y Desarrollo Sostenible y, \n \nCONSIDERANDO: \n \nQue mediante Resolución 2035 del 15 de octubre de 2010, el Ministerio de Ambiente, Vivienda y \nDesarrollo Territorial, hoy Ministerio de Ambiente y Desarrollo Sostenible (en adelante el Ministerio), \notorgó Licencia Ambiental Global a la sociedad Meta Petroleum Corp Sucursal Colombia, identificada \ncon NIT 830.126.302-2, para el proyecto “Área de Explotación de Hidrocarburos Quifa”, localizado en \njurisdicción del Municipio de Puerto Gaitán en el Departamento del Meta, para lo cual conformó el \nexpediente LAM4795. \n \nQue mediante la Resolución 987 del 30 de mayo de 2011, el Ministerio modificó la Resolución 2035 \ndel 15 de octubre de 2010, en el sentido de reducir el área licenciada, autorizar construcción y \noperación de treinta y cuatro (34) plataformas multipozo adicionales, reubicar PAD’s de inyección y \nadicionar obligaciones con respecto a la reinyección de aguas residuales y los programas de \nCompensación por Afectación Paisajística y Compensación por Flora y Fauna, Plan de Gestión Social \ne Inversión Forzosa de no menos del 1% \n \nQue a través de la Resolución 261 del 20 de marzo de 2013, la Autoridad Nacional de Licencia \nAmbientales -ANLA (En adelante la Autoridad Nacional), modificó la Resolución 987 del 30 de mayo \nde 2011, que a su vez modificó la Resolución 2035 del 15 de octubre de 2010, en el sentido de \nadicionar áreas de exclusión en relación con la zonificación de manejo ambiental; reducir el polígono \nautorizado para el proyecto “Área de Explotación de Hidrocarburos Quifa”; adicionar la autorización de \n\nResolución No. 2651       Del 14 NOV. 2023          Hoja No. 2 de 108 \n \n“Por la cual se resuelve un recurso de reposición contra la Resolución 1885 del 25 de agosto de 2023” \nPágina 2 de 108 \n \ninfraestructura; agregar puntos como concesión de aguas superficial para uso doméstico e industrial \nde las actividades autorizadas del referido proyecto en las fuentes de agua y puntos de captación \nestablecidos en dicha Resolución; adicionar el permiso de exploración de aguas subterráneas en los \npozos y sitios descritos en dicho acto administrativo y permiso de explotación de aguas subterráneas \ncampos de aspersión como sistema de disposición final de las aguas residuales domésticas en sitios \naledaños a las plataformas multipozo y PADs de inyección y no autorizar concesión de aguas \nsuperficial de los caños Rubiales y Nutria, como tampoco la exploración de aguas subterráneas en los \npozos localizados en el Campamento Maural, entre otras modificaciones y determinaciones. \n \nQue mediante la Resolución 587 del 7 de junio de 2016, esta Autoridad Nacional, en cumplimiento del \nartículo segundo de la Sentencia T-764 del 16 de septiembre de 2015, proferida por la honorable Corte \nConstitucional, resolvió que la sociedad deberá suspender del proyecto citado, las actividades que se \ncumplan a una distancia inferior a dos (2) kilómetros del límite del Resguardo Indígena Vencedor Pirirí \ndel municipio de Puerto Gaitán, departamento del Meta y de las demás necesariamente relacionadas \ncon aquellas, hasta tanto se realice un proceso de consulta previa entre el resguardo accionante y las \nempresas accionadas en relación con la continuidad de estas actividades. \n \nQue mediante Auto 2381 del 17 de mayo de 2018, esta Autoridad Nacional aceptó el cambio de razón \nsocial de la sociedad Meta Petroleum Corp Sucursal Colombia por el de Frontera Energy Colombia \nCorp., Sucursal Colombia, respecto a los diferentes actos administrativos surtidos dentro del \nexpediente LAM4795, correspondientes al proyecto denominado “Área de Explotación de \nHidrocarburos Quifa”, localizado en jurisdicción del municipio de Puerto Gaitán en el departamento del \nMeta. \n \nQue por medio de la Resolución 1736 del 8 de octubre de 2018, esta Autoridad Nacional resolvió el \nrecurso de reposición interpuesto por la Sociedad a través de la comunicación con radicación \n2017032197-1-000 del 04 de mayo de 2017, en contra de la Resolución 407 del 12 de abril de 2017, \nen el sentido de reponer y en consecuencia revocar el acto administrativo recurrido. \n \nQue a través de la Resolución 1077 del 17 de junio de 2019, esta Autoridad Nacional modificó el literal \nh), sub-numerales i y ii del literal k) del sub-numeral 1.1, del numeral 1 del artículo cuarto y el literal r) \ndel artículo décimo de la Resolución 2035 del 15 de octubre de 2011, modificada por los literales k) y \nl) del artículo tercero y el literal a), del numeral 2 del artículo trigésimo cuarto de la Resolución 261 del \n20 de marzo de 2013, en el sentido de incluir el monitoreo permanente del Río Tillavá, entre otros \najustes que se realizaron vía seguimiento. \n \nQue mediante la Resolución 453 del 17 de marzo de 2020, esta Autoridad Nacional modificó el numeral \n2° del artículo cuarto de la Resolución 2035 del 15 de octubre de 2010, en el sentido de incluir los \nparámetros fisicoquímicos y microbiológicos de aguas en todos los pozos de agua subterránea entre \notras obligaciones que se ajustaron vía seguimiento, relacionado con el monitoreo en aguas \nsubterráneas. \n \n\nResolución No. 2651       Del 14 NOV. 2023          Hoja No. 3 de 108 \n \n“Por la cual se resuelve un recurso de reposición contra la Resolución 1885 del 25 de agosto de 2023” \nPágina 3 de 108 \n \nQue por medio de la Resolución 1342 del 10 de agosto de 2020, esta Autoridad Nacional resolvió el \nrecurso de reposición interpuesto por la Sociedad a través de la comunicación con radicado \n2020050695-1-000 del 1 de abril de 2020 en contra de la Resolución 453 del 17 de marzo de 2020, \nen el sentido de aclarar que la inclusión de los parámetros fisicoquímicos y microbiológicos de aguas \nserá en todos los pozos de agua subterránea de explotación, suprimiendo los pozos de aguas \nsubterráneas exploratorios, adicionalmente estableció a la Sociedad la obligación de realizar los \nmonitoreos de aguas subterráneas de conformidad con la estandarización y frecuencia indicadas en \nel acto administrativo recurrido, en caso de obtener concesión de aguas subterráneas de los 12 pozos \nde exploración. \n \nQue a través de la Resolución 1714 del 20 de octubre de 2020, esta Autoridad Nacional no aceptó la \nactualización de la base de liquidación de la inversión forzosa de no menos del 1% conforme al \nparágrafo primero del artículo 321 de la Ley 1955 del 25 de mayo de 2019; y no aceptó la línea de \ninversión “Acciones de protección, conservación y preservación a través de restauración ecológica, \nrehabilitación y recuperación, dentro de las cuales se puede incluir el desarrollo de proyectos \nsostenibles”, propuesta para ejecutar a través del proyecto “Protección, conservación y preservación \na través de proyectos de uso sostenible”, en el marco de la obligación de la inversión forzosa de no \nmenos del 1% para el proyecto. \n \nQue mediante la Resolución 2109 del 23 de diciembre de 2020, esta Autoridad Nacional resolvió el \nrecurso de reposición interpuesto por la Sociedad, a través de la comunicación con radicación \n2020194950-1-000 del 5 de noviembre de 2020, en contra de la Resolución 1714 del 20 de octubre \nde 2020, en el sentido de modificar únicamente el artículo sexto del acto administrativo recurrido, \nseñalando que el ámbito geográfico para realizar la inversión forzosa de no menos del 1% del proyecto, \nes la Cuenca del río Tillavá, del cual hacen parte las cuencas caño Rubiales, caño La Palmita y afluente \ncaño Chutoba; y la cuenca del río Planas y afluentes caño Betania y Caño Nutria. \n \nQue mediante la Resolución 1885 del 25 de agosto de 2023, esta Autoridad Nacional modificó la \nLicencia Ambiental otorgada mediante Resolución 2035 del 15 de octubre de 2010, modificada por la \nResolución 987 de 2011 y la Resolución 261 de 2013, en el sentido de autorizar actividades, obras e \ninfraestructura adicionales para el proyecto “Área de Explotación de Hidrocarburos Quifa”, ubicado en \nel municipio de Puerto Gaitán en el departamento de Meta, con el fin de aumentar la producción y flujo \nde efectivo, bajo el desarrollo de actividades que promuevan los factores de recobro en el área del \nproyecto, optimizar las actividades que se vienen desarrollando al interior y la inclusión de nuevas \nestrategias de  desarrollo y actividades asociadas. \n \nQue dicho Acto Administrativo fue notificado a la sociedad Frontera Energy Colombia Corp Sucursal \nColombia, por medio de correo electrónico el 28 de agosto de 2023, y publicado en la Gaceta oficial \nde la ANLA el 27 de septiembre de 2023. \n \nQue mediante radicado ANLA 20236200596802 del 11 de septiembre de 2023, la sociedad Frontera \nEnergy Colombia Corp., Sucursal Colombia., en adelante la Sociedad, a través de su apoderado Jorge \n\nResolución No. 2651       Del 14 NOV. 2023          Hoja No. 4 de 108 \n \n“Por la cual se resuelve un recurso de reposición contra la Resolución 1885 del 25 de agosto de 2023” \nPágina 4 de 108 \n \nEnrique Paredes Tamayo, interpuso recurso de reposición en contra de la Resolución 1885 del 25 de \nagosto de 2023. \n \nQue a través del Concepto Técnico 7753 del 14 de noviembre de 2023, esta Autoridad Nacional evaluó \nlos argumentos expuestos por el recurrente, cuyas consideraciones sirven de insumo al presente acto \nadministrativo.  \n \nFUNDAMENTOS LEGALES  \n \nCompetencia. \n \nMediante Decreto-Ley 3573 de septiembre 27 de 2011, el Gobierno Nacional, en uso de las facultades \nextraordinarias conferidas por la Ley 1444 de 2011, creó la Autoridad Nacional de Licencias \nAmbientales -ANLA- como una Unidad Administrativa Especial, con autonomía administrativa y \nfinanciera, sin personería jurídica, adscrita al Ministerio de Ambiente y Desarrollo Sostenible, \nencargada de que los proyectos, obras o actividades sujetos a licenciamiento, permiso o trámite \nambiental cumplan con la normativa ambiental, de tal manera que contribuyan al desarrollo sostenible \nambiental del País; desconcentrando así funciones del Ministerio de Ambiente y Desarrollo Sostenible \nque, antes de la escisión del Ministerio de Ambiente, Vivienda y Desarrollo Territorial, ejercía éste a \ntravés la Dirección de Licencias, Permisos y Trámites Ambientales.  \n \nDentro de las actividades administrativas funcionales, territoriales y temporales que legalmente fueron \ndesconcentradas en la ANLA, está la función de conocer administrativamente de los instrumentos de \ncontrol y manejo ambiental que para los proyectos de su competencia se hayan adoptado, siendo por \ntanto perfectamente viable que conozca las solicitudes de modificación, seguimiento y control \nambiental, hasta el desmantelamiento y abandono de acuerdo con lo dispuesto por la Ley 99 de 1993, \ny el Decreto 1076 de 2015.  \n \nDe acuerdo con la Resolución 1957 del 5 de noviembre de 2021, “Por la cual se adopta el Manual \nEspecífico de Funciones y de Competencias Laborales para los empleos de la planta de personal de \nla Autoridad Nacional de Licencias Ambientales - ANLA”, le corresponde al Director General de la \nAutoridad Nacional de Licencias Ambientales la suscripción de los actos administrativos que otorgan, \nniegan, modifican, ajustan o declaran la terminación de las licencias, permisos, trámites ambientales \ny por ende los recursos que interponen contra estos.  \n \nPara el presente caso la Autoridad Nacional de Licencias Ambientales - ANLA, a través de su Director \nGeneral, es la competente para decidir administrativamente el recurso de reposición interpuesto contra \nla Resolución 1885 del 25 de agosto de 2023, por ser esta Autoridad la que expidió dicho acto \nadministrativo.  \n \nMediante Resolución 1223 del 19 de septiembre de 2022, se efectuó el nombramiento ordinario de \nRodrigo Elías Negrete Montes, en el empleo de Director General de la Unidad Administrativa, Código \n0015, de la Autoridad Nacional de Licencias Ambientales. \n\nResolución No. 2651       Del 14 NOV. 2023          Hoja No. 5 de 108 \n \n“Por la cual se resuelve un recurso de reposición contra la Resolución 1885 del 25 de agosto de 2023” \nPágina 5 de 108 \n \n \nProcedimiento \n \nQue las reglas y el procedimiento para la presentación y resolución de recursos contra los actos \nadministrativos definitivos se encuentran establecidos en la Ley 1437 de 2011” Por la cual se expide \nel Código de Procedimiento Administrativo y de lo Contencioso Administrativo”, artículos 74 y \nsiguientes, cuyo texto se transcribe para mayor claridad: \n \n“Artículo 74. Recursos contra los actos administrativos. Por regla general, contra los actos definitivos \nprocederán los siguientes recursos:  \n \n1. El de reposición, ante quien expidió la decisión para que la aclare, modifique, adicione o revoque.” \n \nAsí mismo, en cuanto a la oportunidad y presentación de los recursos, el artículo 76 del citado Código, \ndispone: \n \n“Artículo 76. Oportunidad y presentación. Los recursos de reposición y apelación deberán interponerse por \nescrito en la diligencia de notificación personal, o dentro de los diez (10) días siguientes a ella, o a la \nnotificación por aviso, o al vencimiento del término de publicación, según el caso.  \n \nLos recursos contra los actos presuntos podrán interponerse en cualquier tiempo, salvo en el evento en que \nse haya acudido ante el juez. Los recursos se presentarán ante el funcionario que dictó la decisión, salvo lo \ndispuesto para el de queja, y si quien fuere competente no quisiere recibirlos podrán presentarse ante el \nprocurador regional o ante el personero municipal, para que ordene recibirlos y tramitarlos, e imponga las \nsanciones correspondientes, si a ello hubiere lugar.  \n \nEl recurso de apelación podrá interponerse directamente, o como subsidiario del de reposición y cuando \nproceda será obligatorio para acceder a la jurisdicción.  \n \nLos recursos de reposición y de queja no serán obligatorios.” \n \nDe acuerdo con lo previsto en el artículo 77 del mencionado Código, los recursos deberán reunir los \nsiguientes requisitos: \n \n“Artículo 77. Requisitos. Por regla general los recursos se interpondrán por escrito que no requiere de \npresentación personal si quien lo presenta ha sido reconocido en la actuación. Igualmente, podrán \npresentarse por medios electrónicos.  \n \nLos recursos deberán reunir, además, los siguientes requisitos: \n \n1. Interponerse dentro del plazo legal, por el interesado o su representante o apoderado debidamente \nconstituido.  \n2. Sustentarse con expresión concreta de los motivos de inconformidad. \n3. Solicitar y aportar las pruebas que se pretende hacer valer.  \n4. Indicar el nombre y la dirección del recurrente, así como la dirección electrónica si desea ser notificado \npor este medio.  \n\nResolución No. 2651       Del 14 NOV. 2023          Hoja No. 6 de 108 \n \n“Por la cual se resuelve un recurso de reposición contra la Resolución 1885 del 25 de agosto de 2023” \nPágina 6 de 108 \n \n \nSólo los abogados en ejercicio podrán ser apoderados. Si el recurrente obra como agente oficioso, deberá \nacreditar la calidad de abogado en ejercicio, y prestar la caución que se le señale para garantizar que la \npersona por quien obra ratificará su actuación dentro del término de dos (2) meses.  \n \nSi no hay ratificación se hará efectiva la caución y se archivará el expediente.  \n \nPara el trámite del recurso el recurrente no está en la obligación de pagar la suma que el acto recurrido le \nexija. Con todo, podrá pagar lo que reconoce deber.” \n \nEl artículo 80 del citado Código, establece el alcance del contenido de la decisión que resuelve el \nrecurso: \n \n“Artículo 80. Decisión de los recursos. Vencido el período probatorio, si a ello hubiere lugar, y sin necesidad \nde acto que así lo declare, deberá proferirse la decisión motivada que resuelva el recurso. La decisión \nresolverá todas las peticiones que hayan sido oportunamente planteadas y las que surjan con motivo del \nrecurso.” \n \nEl recurso de reposición constituye un instrumento legal mediante el cual, la parte interesada tiene la \noportunidad de ejercer el derecho de controvertir una decisión, para que la administración previa su \nevaluación la confirme, aclare, modifique o revoque. \n \nEs deber de la administración decidir en derecho el acto impugnado, habiéndose ejercido en \noportunidad legal la contradicción, que no solamente garantiza conocer las decisiones de la \nadministración sino también la oportunidad de controvertir por el medio de defensa aludido. \n \nAsí las cosas, se precisa que contra la Resolución 1885 del 25 de agosto de 2023, por medio de la \ncual se modificó una Licencia Ambiental para el proyecto denominado: “Área de Explotación de \nHidrocarburos Quifa”, localizado en jurisdicción del municipio de Puerto Gaitán, departamento del \nMeta, se interpuso recurso de reposición por medio de su apoderado general, quien cuenta con la \ncapacidad tal y como consta en el certificado de existencia y representación legal  de la Cámara de \nComercio de Bogotá D.C., del 22 de agosto de 2023 y, a su vez, dicho escrito contiene los motivos de \ninconformidad y el lugar a notificar, por lo tanto, se considera que reúne los requisitos de ley para que \nel mismo sea resuelto por esta Autoridad Nacional. \n \nSe precisa, que en el escrito del recurso de reposición no fueron solicitadas ni aportadas pruebas, \npara ser tenidas en cuenta y valoradas para efectos de la decisión del mismo. \n \nComo se indicó anteriormente, la Resolución 1885 del 25 de agosto de 2023, fue notificada por medio \nde correo electrónico el 28 de agosto de 2023, y la sociedad presentó recurso de reposición mediante \nradicado ANLA 20236200596802 del 11 de septiembre de 2023 y número VITAL \n3500830126302223004, es decir, dentro de los diez (10) días siguientes a la fecha de notificación, tal \ncomo se consagra en el artículo 76 de la Ley 1437 de 2011. \n \n\nResolución No. 2651       Del 14 NOV. 2023          Hoja No. 7 de 108 \n \n“Por la cual se resuelve un recurso de reposición contra la Resolución 1885 del 25 de agosto de 2023” \nPágina 7 de 108 \n \nCONSIDERACIONES DE LA AUTORIDAD NACIONAL DE LICENCIAS AMBIENTALES ANLA, \nSOBRE EL RECURSO DE REPOSICIÓN INTERPUESTO POR LA SOCIEDAD FRONTERA \nENERGY COLOMBIA CORP SUCURSAL COLOMBIA \n \nA continuación, se presenta el análisis del recurso de reposición interpuesto por la sociedad Frontera \nEnergy Colombia Corp Sucursal Colombia., donde se expondrán cada una de las disposiciones \nrecurridas, la solicitud específica, los argumentos de la misma, las consideraciones técnicas de esta \nAutoridad Nacional y por último las consideraciones jurídicas.   \n \n1) OBLIGACION RECURRIDA – LITERAL A DEL ARTÍCULO CUARTO DE LA RESOLUCIÓN 1885 \nDEL 25 DE AGOSTO DE 2023  \n \n“ARTÍCULO CUARTO: Modificar el numeral 3 del artículo segundo de la Resolución 2035 de 2010, el \nnumeral 3 del artículo segundo de la Resolución 987 de 2011 y numeral 1 del artículo segundo de la \nResolución 261 de 2013, en el sentido de adicionar la construcción y/o ampliación de las siguientes \nplataformas: \n \na) \nConstrucción de treinta (30) plataformas multipozo adicionales con un área máxima hasta de dos (2) \nHas por zonificación de manejo ambiental. Para un total de 199 plataformas para todo el proyecto. \n \n(…)”. \nPETICIÓN DE LA SOCIEDAD \n \n“Se solicita respetuosamente a la ANLA aclarar el literal a del artículo cuarto de la Resolución en el sentido \nde contabilizar las plataformas existentes y debidamente autorizadas reportadas en el último ICA y las \nautorizadas en la Resolución (30 plataformas), para un total de [205].” \nARGUMENTOS DE LA SOCIEDAD \n \n“La Compañía inició la elaboración del EIA en el año 2021, en el proceso se llevaron a cabo visitas de campo \ny se tuvo en cuenta la información de desarrollo vigente para ese entonces. Con base en lo anterior, la \nCompañía reportó las cantidades referentes a la infraestructura existente del proyecto. No obstante, el área \ndel proyecto ha continuado operando y desarrollando su infraestructura, motivo por el cual a la fecha se han \npresentado cambios en el número de plataformas existentes. \nA la fecha de expedición de la Resolución, el proyecto “Área de Explotación de Hidrocarburos Quifa” cuenta \ncon [175] plataformas, dichas plataformas se encuentran debidamente autorizadas y han sido debidamente \nreportadas esta Autoridad Ambiental.” \nCONSIDERACIONES TÉCNICAS DE LA ANLA \n \nEs pertinente señalar que: \n- \nMediante el numeral 3 del Articulo Segundo de la Resolución 2035 de octubre 15 de 2010, se autorizó \nla: “Construcción de máximo quince (15) plataformas multipozos de 1,4 hectáreas, (…)” \n- \nMediante el numeral 1 del artículo 2 de la Resolución 261 del 20 de marzo de 2013, se modificó el \nnumeral 3 del Articulo Segundo de la Resolución 2035 de octubre 15 de 2010, en el sentido de: \n\nResolución No. 2651       Del 14 NOV. 2023          Hoja No. 8 de 108 \n \n“Por la cual se resuelve un recurso de reposición contra la Resolución 1885 del 25 de agosto de 2023” \nPágina 8 de 108 \n \n“Autorizar la construcción de máximo 120 plataformas multipozo adicionales (…)” \n- \nMediante el numeral 3 del Articulo Segundo de la Resolución 987 del 30 de mayo de 2011, la ANLA \nautorizó: \n“…la construcción de máximo treinta y cuatro (34) plataformas multipozo de 1,4 hectáreas, adicionales a las \nya autorizadas, (…)” \nCon lo anterior, se puede evidenciar que dichos actos administrativos dan cuenta de la autorización para la \nconstrucción de un máximo de ciento sesenta y nueve (169) plataformas multipozo. \nDe otra parte, en el Concepto Técnico No. 05406 del 07 de septiembre de 2022, indica la ANLA vía \nseguimiento, lo siguiente: \n“De acuerdo con lo informado en los ICA 21 y 22 (enero a diciembre de 2021), para el periodo de reporte \nno se construyeron nuevas plataformas, así como tampoco se llevaron a cabo obras de ampliación. A la \nfecha la Sociedad ha construido 169 plataformas y se han perforado 816 pozos de producción y 18 pozos \ninyectores.” \nAhora bien, esta Autoridad con el fin de realizar su pronunciamiento respecto a la modificación del proyecto, \nverificó el número máximo de plataformas multipozo autorizadas para su construcción en el “Área de \nExplotación de Hidrocarburos Quifa”, concluyendo que serían un total de ciento noventa y nueve (199), \nincluyendo las treinta (30) plataformas multipozo adicionales de la Resolución 1885 del 25 de agosto de \n2023. \nEn virtud de lo anterior, se considera pertinente CONFIRMAR el literal a del artículo cuarto en el sentido de \nratificar que el número de plataformas totales para el proyecto Área de Explotación de Hidrocarburos Quifa” \nes ciento noventa y nueve (199), incluyendo las treinta (30) plataformas multipozo adicionales de la \nResolución 1885 del 25 de agosto de 2023. \n \nCONSIDERACIONES JURÍDICAS \nRespecto a los argumentos expuestos por la sociedad, y teniendo en cuenta las consideraciones \ntécnicas dadas por el equipo evaluador de esta Autoridad Nacional en el Concepto Técnico 7753 del \n14 de noviembre de 2023, se realizó la siguiente contabilización: mediante la Resolución 2035 de \n2010, se autorizó la construcción de 15 plataformas multipozo, posteriormente mediante la Resolución \n261 de 2013 se modificó la 2035 adicionando 120 y finalmente mediante Resolución 987 de 2011, se \nautorizó la construcción de 34 más, por lo cual, se tenía un total de 169 plataformas multipozo. \nEn ese sentido, sumando la construcción de las 30 plataformas adicionales autorizadas en la \nresolución recurrida, arroja un total de 199 como fue indicado en el artículo cuarto de la misma. En \nese sentido, cada acto administrativo tiene el número de pozos adicionados y no habría duda sobre lo \nautorizado a la fecha. \nPor lo anterior, no se encuentra un error en la sumatoria de las mismas, a pesar que la Sociedad \nmanifestó que el proyecto al encontrarse en operación y desarrollar su infraestructura, ha presentado \ncambios en el número de plataformas, no siendo argumentos que soporten su petición y no ser de \nrecibo para esta Autoridad. Así las cosas, no se realiza la modificación solicitada y en su lugar se \nconfirma el artículo. \n\nResolución No. 2651       Del 14 NOV. 2023          Hoja No. 9 de 108 \n \n“Por la cual se resuelve un recurso de reposición contra la Resolución 1885 del 25 de agosto de 2023” \nPágina 9 de 108 \n \n2) OBLIGACION RECURRIDA – NUMERAL 5 DEL ARTÍCULO DÉCIMO TERCERO DE LA \nRESOLUCIÓN 1885 DEL 25 DE AGOSTO DE 2023 \n \n“ARTÍCULO DECIMO TERCERO: Modificar el artículo cuarto de la Resolución 2035 del 15 de octubre de \n2010, que otorgó Licencia Ambiental para el proyecto “Área de Explotación de Hidrocarburos Quifa”, en el \nsentido de adicionar el uso, aprovechamiento y/o manejo de los recursos naturales renovables necesarios, \nde acuerdo con las condiciones, especificaciones y obligaciones que se exponen a continuación: \n(…) \n5. Vertimiento al suelo \nOtorgar permiso de vertimiento al suelo por 13 años contados a partir del inicio de la actividad de riego por \naspersión, de las Aguas Residuales Domésticas Tratadas (ARD-T) generadas en las instalaciones sanitarias \nde las facilidades Campamento Quifa y Batería 4 a las ZODAR ubicadas en dichas locaciones, bajo las \nsiguientes condiciones y coordenadas: \nCondición \nCampamento Quifa \nBatería 4 \nCaudal de descarga (l/s) \n2,0185 \n0,06 \nTiempo de descarga (h/día) \n4,78 \n0,73 \nFrecuencia (días/mes) \n1 \n30 \n \nCoordenadas de ubicación ZODAR –Campamento Quifa \nVÉRTICE \nCOORDENADAS DATUM ORIGEN NACIONAL \nESTE \nNORTE \nA \n5152790,388 \n1976486,26 \nB \n5152795,82 \n1976459,027 \nC \n5152822,412 \n1976443,516 \nD \n5152841,657 \n1976410,864 \nE \n5152863,132 \n1976397,892 \nF \n5152925,311 \n1976382,326 \nG \n5152925,36 \n1976360,158 \nH \n5152916,358 \n1976338,185 \nI \n5152881,897 \n1976332,231 \nJ \n5152749,301 \n1976262,221 \nK \n5152580,537 \n1976335,47 \nL \n5152536,976 \n1976376,543 \nM \n5152534,127 \n1976436,887 \n\nResolución No. 2651       Del 14 NOV. 2023          Hoja No. 10 de 108 \n \n“Por la cual se resuelve un recurso de reposición contra la Resolución 1885 del 25 de agosto de 2023” \nPágina 10 de 108 \n \nN \n5152597,484 \n1976437,027 \nO \n5152632,775 \n1976450,142 \nP \n5152637,261 \n1976451,809 \nQ \n5152660,935 \n1976473,501 \nR \n5152661,531 \n1976509,001 \nS \n5152705,209 \n1976510,534 \nT \n5152748,539 \n1976547,793 \nU \n5152794,881 \n1976509,56 \n \nCoordenadas de ubicación ZODAR – Campamento Batería 4 \nVÉRTIC\nE \nCOORDENADAS DATUM ORIGEN NACIONAL \nESTE \nNORTE \nA \n5162562.97 \n1978277.58 \nB \n5162591.09 \n1978300.06 \nC \n5162618.35 \n1978269.75 \nD \n5162589.15 \n1978247.31 \n(…)” \nPETICIÓN DE LA SOCIEDAD  \n \nSe solicita respetuosamente a la ANLA corregir lo establecido en el numeral 5 del artículo décimo tercero \nde la Resolución en el sentido de autorizar la frecuencia de riego durante treinta (30) días al mes y \nveinticuatro (24) hora al día para el Campamento Quifa. \nARGUMENTOS DE LA SOCIEDAD \n \nLa Autoridad Ambiental estableció en la Resolución que: \n“Conforme a la evaluación de la información allegada por la Sociedad en relación con la solicitud del permiso \nde vertimiento a suelo en las ZODAR ubicadas en el Campamento Quifa y Batería 4, el Equipo Evaluador \nde ANLA considera que cumple con los requisitos establecidos en el Decreto 050 de 2018, teniendo en \ncuenta que se han planteado las medidas de disposición y manejo que son requeridas para este tipo de \nvertimiento; respecto a las consideraciones planteadas por CORMACARENA, estas son solventadas al \nconsiderar la modelación numérica del vertimiento presentada por la Sociedad, en la cual se pudo verificar \nla capacidad de infiltración en las áreas solicitadas, al igual que la atenuación de la carga contaminante del \nperfil de suelo. Por lo tanto, se considera viable el otorgamiento del permiso en los caudales de 2,0185 l/s \npara el Campamento Quifa y 0,06 l/s para Batería 4.” \nAhora bien, la ANLA en el numeral 5 del Artículo Décimo Tercero de la Resolución establece que la \nfrecuencia de riego autorizada es de un (1) día al mes. Por su parte, lo solicitado por Frontera durante el \n\nResolución No. 2651       Del 14 NOV. 2023          Hoja No. 11 de 108 \n \n“Por la cual se resuelve un recurso de reposición contra la Resolución 1885 del 25 de agosto de 2023” \nPágina 11 de 108 \n \nproceso de modificación de licencia ambiental fue poder realizar el riego de las aguas generadas en las \ninstalaciones sanitarias de las facilidades Campamento Quifa y Batería 4 a las Zonas de Disposición de \nAgua Residual Doméstica Tratada (en adelante “ZODAR”) durante treinta (30) días al mes por veinticuatro \n(24) horas diarias. Tal y como es reconocido por esta Autoridad Ambiental, el volumen solicitado por \nFrontera \nfue \ndebidamente \nsoportado \npor \nla \nCompañía \nen \nel \nEIA \nANEXO \nG_ANEXO_CARTOGRAFICO/GDB en la capa Vertimiento. \nSuelo en las columnas HORAS_DIA y DIAS_MES. \nEn el estudio de la ZODAR: Anexo B_ANEXO_ABIOTICO/B_5_AMBIENTAL/8_ZODAR/Documento Zodar, \nen las páginas 157 y 183, Frontera presentó las características de los suelos, la modelación de la zona \nsaturada y la modelación de solutos. La Compañía simuló varias láminas de riego de 3.2 mm/día y 4.2 \nmm/día, para campamento base QUIFA y BATERIA 4 respectivamente, con una frecuencia de riego de \ntreinta (30) días al mes por veinticuatro (24) horas evidenciando la ausencia de posibles afectaciones del \nacuífero o el suelo, donde se seleccionaron láminas de riego. \nCon base en estas modelaciones la Compañía estableció unos criterios de diseño para las áreas de \nvertimiento en el Campamento QUIFA y BATERIA 4, utilizando el riego por aspersión como el sistema \napropiado para realizar la actividad, debido a que se pueden aplicar láminas diarias con una uniformidad \nalta (superior al 85%), que garantiza una alta calidad en la aplicación del agua, para no afectar el suelo ni \nel acuífero en el tiempo calculado, de acuerdo a estas modelaciones, se estimó en 13 años. En la Tabla 4-\n75 Descripción de los Criterios de diseño para el campo de aspersión, para no afectar el suelo y al acuífero \nen el tiempo, donde se proyectó estas modelaciones a 13 años. \n“Tabla 4-75. Criterio de diseño para los campos de aspersión para la ZODAR de Campo QUIFA \nPARAMETRO \nDESCRIPCIÓN \n \nVolumen diario de vertimiento \nSe define como el volumen de agua, que cada campamento \nconsume para cubrir las demandas de lavandería, casino y \nla de los habitantes del campamento, se expresa en \nlitros/día. \n \n \nLámina de riego \nSe define como la lámina diaria de riego en mm/día, que el \nsistema de riego debe suministrar, para satisfacer los \nvolúmenes diarios de vertimiento, que es resultado de la lámina \ndel mejor escenario del Modelamiento realizado con HIDRUS \n2D, para cada campamento. \n \nÁrea de vertimiento \nSe define como el área donde se va a realizar el vertimiento, \ny está relacionado con el Volumen de vertimiento (litros/día) \ny la Lámina bruta de riego (mm/día). \n \n \n \nVelocidad de infiltración básica (mm/hr) \nDefine la capacidad del suelo de absorber agua. Al principio \n(cuando el suelo está más seco) la velocidad de penetración del \nagua en el suelo es más rápida, pero si se sigue aportando más \nagua, llega un momento en que esta velocidad es más o menos \nconstante. A esta velocidad se la conoce como velocidad de \ninfiltración básica, y se determinó con el modelo de Kostiakov \n(Montenegro y Malagón 1990). \n\nResolución No. 2651       Del 14 NOV. 2023          Hoja No. 12 de 108 \n \n“Por la cual se resuelve un recurso de reposición contra la Resolución 1885 del 25 de agosto de 2023” \nPágina 12 de 108 \n \n \n \nFrecuencia de riego (días) \nSe define como la frecuencia en días con que se aplica el agua, \nen particular, para el caso del vertimiento de ARDT, se \nconsideró una frecuencia diaria, para evitar aplicación de altos \nvolúmenes de agua, para impedir riesgos de afectar la calidad \nde las aguas freáticas. \n \n \nCoeficiente de uniformidad (%) \nEs una medida de la distribución espacial del agua en el suelo, \nque determina la calidad del riego, este parámetro se expresa \nen % y se considera que debe ser mayor a 85%, para calificar \nel riego de una calidad de aplicación buena (Merida Tello 2017). \nEl Coeficiente de Uniformidad es una representación estadística \nque mide la distribución del agua, del sistema de aspersión, el \ncual se considera un factor a tener en cuenta, ya que bajos \ncoeficientes de uniformidad indican una mala distribución, que \nimplica tener zonas sobre irrigadas, que podrían generar \nproblemas de percolación profunda, y otras sub irrigadas. \nLo anterior es importante, ya que en un sistema de aspersión se \nrequiere que el mayor porcentaje del área irrigada, la \ndistribución del agua sea uniforme, de ahí la importancia de \ndiseñar el sistema de riego, con una disposición en campo de \nlos aspersores, que garantice un coeficiente de uniformidad \nmayor al 85%. \n \n \nJornada de riego diaria (horas/día) \nSe define como el número de horas de operación diaria del \nsistema de riego, quizás el parámetro que más impacta los \ncostos de inversión de un sistema de riego, debido a que, a \nmayor número de horas de operación por día, el costo de \ninversión se reduce, principalmente por el uso de menores \ncaudales de bombeo. \n \nTiempo de riego (horas) \nSe define como el tiempo que demora el sistema de riego de \nriego en entregar la lámina de riego y se determina dividiendo \nla lámina (mm) sobre la intensidad de lluvia del sistema de \naspersión (mm/hora). \nNúmero de turnos de riego por día \nSe define como la jornada de riego (horas/día) sobre el Tiempo \nde riego (horas). \n \nSector de riego \nCorresponde al área a irrigar por turno y se determina dividiendo \nel Área de vertimiento sobre el número de turno de riego por día. \n \nÁrea de cada aspersor (m2) \nSe determina de acuerdo a la disposición del aspersor en \ncampo, que será criterio del equipo de ingeniería, para el caso \nde disposición en cuadro o rectángulo, se determina \nmultiplicando la distancia entre aspersores. \n \nRadio Húmedo (m) \nSe define como el radio de humedecimiento del aspersor, de \nacuerdo a las especificaciones técnicas del fabricante. \nNúmero de aspersores por sector de riego \nSe determina dividiendo el área del sector de riego entre el área \nde cada aspersor. \nIntensidad de lluvia del sistema de \naspersión (mm/hora) \nSe determina al dividir el caudal del aspersor (l/hr) sobre el área \nde cada aspersor (m2) \nFuente: SGI S.A.S, 2021” \n\nResolución No. 2651       Del 14 NOV. 2023          Hoja No. 13 de 108 \n \n“Por la cual se resuelve un recurso de reposición contra la Resolución 1885 del 25 de agosto de 2023” \nPágina 13 de 108 \n \nEn línea con esto, Frontera Energy estableció los criterios de diseño específicos para cada ZODAR como \nse relaciona en la “Tabla 4-76 Criterios de diseño para el campo de aspersión de la ZODAR de Campamento \nBase Quifa” y la “Tabla 4-92 Criterios de diseño para el campo de aspersión de la ZODAR de Batería 4”. En \ndichas tablas, se evidencia que la frecuencia de riego apta para las ZODAR es de un día lo cual implica \nrealizar la actividad 30 días al mes: \n“Tabla 4-76 Criterios de diseño para el campo de aspersión de la ZODAR de Campamento Base Quifa \nCRITERIOS DE DISEÑO- \nCAMPAMENTO BASE \nPARÁMETRO DE DISEÑO \nUNIDAD \nRESULT \nADO \nVolumen de vertimiento \nlitros/día \n174400 \nVelocidad de infiltración \nbásica \nmm/hora \n17.36 \nÁrea de vertimiento \nha \n5.87 \nFrecuencia de riego \nDías \n1 \nCoeficiente de uniformidad \n% \nMayor al \n85% \nLamina de riego \nmm/día \n3.2 \nFuente: SGI S.A.S, 2021 \n \nTabla 4-92. Criterios de diseño para el campo de aspersión de la ZODAR de Batería 4 \nCRITERIOS DE DISEÑO-BATERIA 4 \nPARÁMETRO DE DISEÑO \nUNIDAD \nRESULT \nADO \nVolumen de vertimiento \nlitros/día \n5100 \nVelocidad de infiltración \nbásica \nmm/hora \n39.13 \nÁrea de vertimiento \nha \n0.1476 \nFrecuencia de riego \nDías \n1 \nCoeficiente de uniformidad \n% \nMayor al 85% \nLamina de riego \nmm/día \n4.2 \nFuente: SGI S.A.S, 2021” \nDe acuerdo con lo expuesto, entiende la Compañía que, debido a que en el EIA, en el anexo \nB_ANEXO_ABIOTICO/B_5_AMBIENTAL/8_ZODAR/Documento Zodar, Frontera evidenció que para el \ncampamento base QUIFA es ambientalmente viable la frecuencia de riego de treinta (30) días al mes y \nveinticuatro (24) hora al día, expresado en días/mes, como está definida para la ZODAR de Batería 4, debido \na que las modelaciones y el diseño del sistema de riego se enfocó para realizar esta actividad todos los días \ndel mes. \nPor otra parte, tal como ha sido ampliamente desarrollado por las altas cortes colombianas, la motivación \nde los actos administrativos deberá guardar una estrecha relación con la parte resolutiva de estos, ya que \n\nResolución No. 2651       Del 14 NOV. 2023          Hoja No. 14 de 108 \n \n“Por la cual se resuelve un recurso de reposición contra la Resolución 1885 del 25 de agosto de 2023” \nPágina 14 de 108 \n \nes dicha motivación lo que le permite al administrado entender los motivos que llevaron a la administración \na tomar determinadas decisiones. \nTal como lo estableció la Corte Constitucional en sentencia T-204 de 2012: \n“La necesidad de motivación del acto administrativo no se reduce a un simple requisito formal de introducir \ncualquier argumentación en el texto de la providencia. Por el contrario, esta Corporación ha acudido al \nconcepto de “razón suficiente” para señalar que la motivación del acto deberá exponer los argumentos \npuntuales que describan de manera clara, detallada y precisa las razones a las que acude el ente \npúblico para retirar del servicio al funcionario. Un proceder distinto violaría el sustento constitucional \nque da origen a la necesidad de motivar las actuaciones de la administración y convertiría este requerimiento \nen un simple requisito inane y formal” (Subrayado fuera de texto). \nDe acuerdo con lo expuesto, entiende la Compañía que la ANLA incurrió en un error involuntario al haberse \nestablecido en la Resolución una frecuencia de riego autorizada de un (1) día al mes para el Campamento \nQuifa ya que, la motivación de la Resolución evidencia que la Autoridad Ambiental pudo verificar en su \nevaluación la viabilidad ambiental de realizar el riego en los términos solicitados por la Compañía, es decir \ntreinta (30) días al mes y veinticuatro (24) hora al día para el Campamento Quifa. \nEn conclusión, se evidencia que la solicitud de frecuencia de riego durante treinta (30) días al mes y \nveinticuatro (24) horas al día para el Campamento Quifa, en la cual se incluyó la correspondiente modelación \nen el EIA presentado en el anexo B_ANEXO_ABIOTICO/B_5_AMBIENTAL/8_ZODAR/Documento Zodar y \nen el anexo ANEXO G_ANEXO_CARTOGRAFICO/GDB en la capa Vertimiento Suelo en las columnas \nHORAS_DIA y DIAS_MES, resulta ambientalmente viable y así fue corroborado por la ANLA, como se \nevidencia de la Resolución. \nCONSIDERACIONES TÉCNICAS DE LA ANLA \n \nSea lo primero indicar que, en los Formatos Únicos Nacionales de Permiso de Vertimiento a Suelo, \nasociados a los permisos solicitados en el marco de la presente modificación de licencia ambiental, que \nfueron \nallegados \nen \nlos \nanexos \ndel \nEIA \nobjeto \nde \nevaluación \nen \nlas \nrutas \nB_ANEXO_ABIOTICO/B_5_AMBIENTALES\\11_FUN\\ZODAR \ny \nen \nB_ANEXO_ABIOTICO/B_5_AMBIENTALES\\8_ZODAR\\3_FUN, se encuentra consignada la información \nasociada con los caudales, tiempos y frecuencias de descarga para cada ZODAR, dichos datos se \npresentan en el numeral IV INFORMACIÓN GENERAL DEL ÁREA DE DISPOSICION Y DEL \nVERTIMIENTO de los mencionados formatos de la siguiente manera: \n \nPara ZODAR Campamento Quifa: \n \n\nResolución No. 2651       Del 14 NOV. 2023          Hoja No. 15 de 108 \n \n“Por la cual se resuelve un recurso de reposición contra la Resolución 1885 del 25 de agosto de 2023” \nPágina 15 de 108 \n \n \nFuente: Información adicional presentada mediante radicado 2022281350-1-000 de 14 de diciembre de 2022, FRONTERA ENERGY COLOMBIA. \n \nPara ZODAR Batería 4: \n \n \nFuente: Información adicional presentada mediante radicado 2022281350-1-000 de 14 de diciembre de 2022, FRONTERA ENERGY COLOMBIA. \n \nAsí pues, los datos referentes a caudales, tiempos y frecuencias de descarga que se indican en el numeral \n5 del artículo décimo tercero de la Resolución 1885 del 25 de agosto de 2023 para cada ZODAR, fueron los \nindicados por la sociedad en los documentos formales de solicitud de los permisos de vertimiento a suelo, \ncon lo cual, esta Autoridad Nacional no incurrió en ningún error en las condiciones de modo, tiempo y lugar \nestablecidas para estos permisos en el mencionado acto administrativo.  \n \nAhora bien, en relación con lo argumentado por la sociedad frente a las condiciones de modelación de \ntransporte de solutos, que consideran láminas de agua de 3.2 mm/día para el Campamento Quifa y 4,2 \nmm/día para Batería 4, datos que se asocian de manera correcta con los caudales de descarga solicitados \nen las áreas de disposición de cada ZODAR, es preciso indicar que, si bien estas condiciones simulan un \ninflujo permanente de agua durante el tiempo de modelación, que corresponde a 20 años, y que tal y como \nse indica en el Concepto Técnico 5269 del 24 de agosto de 2023, los resultados obtenidos indican una \nretención de solutos adecuada que hace viable, bajo estas condiciones, la disposición de estos residuos \n\nResolución No. 2651       Del 14 NOV. 2023          Hoja No. 16 de 108 \n \n“Por la cual se resuelve un recurso de reposición contra la Resolución 1885 del 25 de agosto de 2023” \nPágina 16 de 108 \n \nlíquidos desde el punto de vista de la disminución de la carga contaminante en el perfil de suelo por 13 años, \nestas, al implicar tiempos y frecuencias de descarga mayores a las solicitadas, pueden considerarse como \nun escenario crítico, por lo cual, los valores de tiempos y frecuencias de descarga solicitados formalmente \npor la sociedad en los formatos anteriormente referidos se hacen también ambientalmente viables a la luz \nde la información aportada, razón por la cual fueron otorgados los permisos.  \n \nNo obstante, se recalca que en el modelo de trasporte de solutos que fue presentado por la sociedad y \nvalidado por esta Entidad para los ZODAR solicitados, se establece una descarga permanente hacia el \nsuelo, que corresponde a un tiempo de descarga de 24 h/día y una frecuencia de descarga de 30 días al \nmes, y además, como se mencionó anteriormente, esta modelación se ajusta a las características del suelo \ndel área de disposición y a las condiciones de entrega al medio receptor, obteniendo como resultado una \nasimilación aceptable de la carga contaminante en el perfil de suelo.  \n \nAdicionalmente, en el Concepto Técnico 5269 del 24 de agosto de 2023, también se recogieron los \nresultados de los análisis de variación del nivel freático donde se estableció que dicha variación en los dos \nZODAR solicitados se encuentra calculada a partir de las condiciones de cada una de dichas zonas de \ndisposición y que las posibilidades de contacto entre los solutos simulados y el agua subterránea son \nmínimas, en tanto la carga contaminante disminuye en 97% de su concentración entre los 56 y 71 cm de \nprofundidad del perfil de suelo, en una zona no saturada estimada en 250 cm de espesor.  \n \nPor otra parte, tal y como lo indica la sociedad, en los criterios establecidos para el diseño del ZODAR \nCampamento Quifa, expuestos en el EIA de modificación, se consideró una frecuencia de riego (tiempo de \ndescarga) continua de un día, es decir 24 horas, para el dimensionamiento y estimación de las \ncaracterísticas requeridas del sistema de disposición de aguas residuales, información que fue validada \ndurante la evaluación del permiso. De esta manera, además del modelo de transporte de solutos, en dichos \ncriterios se consideró, como base de cálculo para el diseño de la ZODAR, un tiempo de descarga de 24 \nh/día y una frecuencia de descarga de 30 días/mes.  \n \nAsí las cosas, las condiciones de tiempo de descarga de 24 h/día y frecuencia de descarga de 30 días/mes \npara el ZODAR ubicado en el Campamento Quifa, fueron consideradas por la sociedad en la información \ntécnica vinculada a la solicitud del permiso de vertimiento a suelo, cuya evaluación, consignada en el \nConcepto Técnico 5269 del 24 de agosto de 2023, estableció la viabilidad del permiso y las consideró \nambientalmente viables, pues no suponen impactos o aspectos que no se hayan incluido en la evaluación \nde este. \n \nEn virtud de lo anterior, se recomienda MODIFICAR como fue solicitado por la sociedad. \nCONSIDERACIONES JURÍDICAS \n \nTeniendo en cuenta lo expuesto técnicamente, al revisarse la información consignada en los formatos \nque acompañan la solicitud de modificación del proyecto ya mencionado, se verificó que para la \nZODAR en el campamento Quifa se indicó una frecuencia de descarga de 1 día por 4.78 horas, por lo \ncual la Autoridad realizó su pronunciamiento sin caer en errores involuntarios como lo manifiesta la \nSociedad. \nSin embargo, 30 días por 24 horas es la frecuencia que utilizaron en el modelo de vertimiento al suelo \ny que fue inicialmente presentado, la cual, es más alta de la registrada en los formatos que acompañan \n\nResolución No. 2651       Del 14 NOV. 2023          Hoja No. 17 de 108 \n \n“Por la cual se resuelve un recurso de reposición contra la Resolución 1885 del 25 de agosto de 2023” \nPágina 17 de 108 \n \nel EIA (1 dia por 4.78 horas), por lo que aunque en el modelo que se desarrolló en el contexto del EIA \nno se indicó específicamente la frecuencia, la Autoridad con la evaluación que fue desarrollada por el \nEquipo Técnico, consideró que el modelo presentado era viable y se ajustaba a lo pedido en los \nmencionados formatos aunque fuese mucho menor, y en ese sentido fue el pronunciamiento de la \nAutoridad. \nPor lo anterior, el acto administrativo objeto de recurso, estuvo motivado en los datos registrados por \nla misma sociedad en los formatos adjuntos a la solicitud de modificación, lo cual correspondía, según \nel análisis técnico de esta Autoridad, con la totalidad de los análisis y argumentos señalados en la \nmencionada solicitud, por lo cual, no hubo lugar a interpretaciones distintas de lo que explícitamente \npidió la Sociedad. \nAl respecto, el acto administrativo recurrido para ser expedido, como se indicó anteriormente, fue \nfundamentado en el análisis plasmado en el Concepto Técnico 5269 del 24 de agosto de 2023, el cual \nrealizó una valoración de toda la información aportada por la sociedad y de la obrante en el expediente, \npara establecer las obras o actividades que serían adicionadas y bajo el trámite establecido en el \nartículo 2.2.2.3.8.1. del Decreto 1076 de 2015, para las solicitudes de modificación de licencia \nambiental.  \nFrente a la Sentencia T – 204 del 14 de marzo de 2012 de la Sala Quinta de Revisión de la Corte \nConstitucional1, que trae a colación la recurrente, vale indicar en primer lugar, que al tratarse de una \nsentencia en sede de tutela sus efectos son interpartes, en segundo lugar y en gracia de discusión, la \nratio decidendi (tenida en cuenta como precedente) hace un análisis genérico del fenómeno de la falta \nde motivación del acto administrativo que no guarda relación con lo debatido en el presente recurso. \nAdemás, se presenta una contradicción con el argumento del error formal, ya que este supone una \nanomalía menor en el acto administrativo que bajo ninguna circunstancia puede considerarse como \nfalta de motivación. Por último, si bien existe un error formal en el acto administrativo, este se originó \nen la sociedad solicitante y no en la Administración como afirma la recurrente, tal como se demuestra \nen los argumentos técnicos que anteceden. \n    \nEn virtud de lo mencionado, pese a que el error fue generado por la misma sociedad en la información \npresentada, en el contexto del EIA y el modelo reportado, muestran que efectivamente la solicitud \ncorrespondía a 30 días por 24 horas conforme los argumentos técnicos de la Autoridad; por \nconsiguiente, se considera viable modificar lo relacionado al permiso de vertimiento al suelo quedando \npara el campamento Quifa un tiempo de descarga (h/dia) de 24 y frecuencia (días/mes) de 30, lo cual, \nno supone impactos o aspectos que no se hayan considerado en la evaluación del permiso de \nvertimientos al suelo asociado a dicha locación para la modificación del proyecto mencionado. \n  \n3) OBLIGACIÓN RECURRIDA - NUMERAL 2 LITERAL B DEL ARTÍCULO DÉCIMO TERCERO, \nCONCESIÓN DE AGUAS SUBTERRÁNEAS Y ARTÍCULO VIGÉSIMO TERCERO DE LA \nRESOLUCIÓN 1885 DEL 25 DE AGOSTO DE 2023 \n \n \n1 En la cual la Sala Quinta de la Corte Constitucional, entra a revisar si el Tribunal Administrativo de Bolívar violó los derechos fundamentales del señor \nArturo Rodríguez Pedraza al haber revocado la sentencia de primera instancia que concedió el reintegro del cargo de carrera de notificador que \ndesempeñaba en provisionalidad en la Dirección Seccional de Fiscalías de Cartagena de Indias o a uno de igual o superior jerarquía, por considerar que \nlos actos administrativos que declaran la insubsistencia de funcionarios en cargos de carrera en provisionalidad no requieren motivación. \n\nResolución No. 2651       Del 14 NOV. 2023          Hoja No. 18 de 108 \n \n“Por la cual se resuelve un recurso de reposición contra la Resolución 1885 del 25 de agosto de 2023” \nPágina 18 de 108 \n \n“ARTÍCULO DÉCIMO TERCERO: Modificar el artículo cuarto de la Resolución 2035 del 15 de octubre de \n2010, que otorgó Licencia Ambiental para el proyecto “Área de Explotación de Hidrocarburos Quifa”, en el \nsentido de adicionar el uso, aprovechamiento y/o manejo de los recursos naturales renovables necesarios, \nde acuerdo con las condiciones, especificaciones y obligaciones que se exponen a continuación: \n(…)  \n2. \nConcesión de aguas subterráneas  \n \nOtorgar la concesión de agua subterránea para hacer captación de los niveles arenosos de la Formación \nGuayabo dispuestos desde los 100 m de profundidad, mediante cuatro (4) pozos profundos, con un caudal \nde extracción por pozo de 5 l/s, para un total de 20 l/s, distribuido de la siguiente manera: 3 l/s tendrán uso \ndoméstico y 2 l/s uso industrial, con un tiempo de bombeo diario de máximo 12 horas. Los pozos autorizados \nse listan en la siguiente tabla: \n \n(…) \nLo anterior teniendo en cuenta lo siguiente: \nb) El ID ANLA para el actual pozo de captación de agua subterránea PASUB 2 será el siguiente: CSB-\nLAM4795-0002. El pozo PASUB 1 quedará funcionando solamente como pozo de observación y monitoreo \ny por tanto no tendrá nomenclatura de concesión asignada por la ANLA.  \n(…)”  \n“ARTÍCULO VIGÉSIMO TERCERO: Dejar sin efecto el permiso de explotación de agua subterránea del \npozo PASUB 1, otorgado mediante la Resolución 261 de 2013, el cual quedará funcionando solamente \ncomo pozo de observación y monitoreo”. \nPETICIÓN DE LA SOCIEDAD  \n \nSe solicita respetuosamente a la ANLA aclarar lo dispuesto en el numeral 2 del artículo décimo tercero, \nconcesión de aguas subterráneas, literal 2.b. y artículo vigésimo tercero de la Resolución, manteniendo el \npermiso de concesión de aguas subterráneas del pozo PASUB 1 hasta tanto el pozo PASUB 1B QF deba \nentrar en operación y pueda suplir el volumen de agua aportado por este último. \n \nARGUMENTOS DE LA SOCIEDAD \n  \nDentro del trámite de modificación de Licencia Ambiental, la Compañía solicitó la concesión del pozo PASUB \n1B QF, como pozo gemelo y de reemplazo del pozo PASUB 1 debido a que este último ha venido \npresentando algunos problemas mecánicos. Por lo anterior, en aras de garantizar una operación continua y \nsegura la Compañía incluyó en el trámite de modificación de Licencia Ambiental el pozo PASUB 1B QF, el \ncual está previsto en el supuesto en que el pozo PASUB 1 deba ser clausurado, es decir que este está \nproyectado como un respaldo contingente en caso de falla del pozo actual. \nDebe precisarse que, a pesar de los problemas mecánicos que ha presentado el pozo PASUB 1, este \ncontinua operativo y produciendo cerca del 60% del agua de uso doméstico utilizada por la operación ya \nque, actualmente no presenta problemas que tengan como consecuencia su cierre a corto plazo. \nPor el contrario, ni ambiental ni operativamente resulta pertinente dar cierre a un pozo de agua subterránea \nactivo y funcional ya que es una infraestructura operativa que puede seguir siendo aprovechada \nadecuadamente por lo que clausurarlo anticipadamente no se encuentra en línea con la estrategia de \neconomía circular en la que viene trabajando fuertemente Frontera y la cual ha sido positivamente \n\nResolución No. 2651       Del 14 NOV. 2023          Hoja No. 19 de 108 \n \n“Por la cual se resuelve un recurso de reposición contra la Resolución 1885 del 25 de agosto de 2023” \nPágina 19 de 108 \n \nincentivada por esta Autoridad Ambiental. \nEl cese de la operación anticipada del pozo PASUB 1 generaría un grave daño al suministro de agua actual \nen campo sin que medie razón alguna para determinar el cierre actual del mencionado pozo como se \nevidencia de la Resolución y su motivación. De acuerdo con lo expuesto, desde el punto de vista ambiental \ny operativo resulta conveniente mantener operativo el pozo PASUB 1 y en caso de presentarse fallas o \nincremento de su deterioro, poderse activar el pozo PASUB 1B QF solicitado, notificando oportunamente a \nla ANLA el correspondiente cambio. \nCONSIDERACIONES TÉCNICAS DE LA ANLA \n \nFrente al argumento presentado por la Sociedad en relación con la solicitud de dar continuidad al ya \notorgado permiso de concesión de agua subterránea en el pozo PASUB 1, esta Autoridad se permite aclarar \nque de acuerdo con la información aportada por parte de Frontera Energy Colombia Corp. en el radicado \n2022283750-1-000 del 16 de diciembre de 2022, mediante el cual se remitió la información adicional \nrequerida en el Acta No. 98 del 2022, no se mencionó que el nuevo pozo solicitado en concesión \ndenominado “PASUB 1B QF” estuviera proyectado como un respaldo contingente en caso de falla del pozo \nactual PASUB 1, de igual manera, la Sociedad no especificó que el pozo PASUB 1 fuera a continuar en \nfuncionamiento. \nEn el Capítulo 4 - Demanda, uso, aprovechamiento y/o afectación de recursos naturales, del EIA presentado \npor la Sociedad, específicamente en la “Tabla 4-1 Relación de uso y aprovechamiento de recursos naturales \nactual y la pretensión a solicitar En el Área de Explotación de Hidrocarburos Quifa” se menciona que “El \nPASUB-1 va a ser reemplazado por el pozo denominado PASUB 1B QF debido a problemas mecánicos; \nósea que quedarían 5 pozos profundos en total”, y en la parte inferior de la tabla donde se listan los pozos \nactualmente concesionados al proyecto se cita para el pozo PASUB-1 que “*Será reemplazado por el \nPASUB-1B QF”. \nDe igual manera, en el numeral 4.2 CONCESIÓN AGUAS SUBTERRÁNEAS del Capítulo 4 del EIA, se \nespecifica lo siguiente:  \n“En el marco de la modificación de licencia que se viene adelantando por parte de la compañía Frontera \nEnergy, se tiene contemplada la solicitud de concesión de cuatro (4) puntos de agua subterránea dentro del \nÁrea de Explotación de hidrocarburos Quifa con un caudal de extracción por pozo de 5 l/s para un total de \n20 l/s. Estos pozos captarían los acuíferos que se encuentran por debajo de los 100 metros de profundidad \nde la Formación Guayabo y complementarían las actividades de captación que actualmente se están \ndesarrollando mediante los pozos captadores de agua subterránea denominados PASUB 1 y PASUB 2, \naclarando que uno de los puntos nuevos de captación denominado PASUB 1B QF, corresponde en \nrealidad a un pozo de reemplazo para el PASUB 1 existente, por ende, quedarían operativos \núnicamente 5 pozos y el PASUB 1 actual quedaría inactivo, funcionando como pozo de observación \ny monitoreo”. (Subrayado fuera de texto original). \nAdicionalmente, en el subnumeral 4.2.2.2 Rendimiento de los pozos proyectados, del Capítulo 4 del EIA, se \nvuelve a hacer mención del reemplazo del pozo PASUB-1, tal como se cita a continuación: “es importante \nmencionar que el PASUB-1 va a ser reemplazado por el pozo denominado PASUB 1B QF (ver Figura 4-36) \ndebido a problemas mecánicos, lo cual disminuirá la cantidad de pozos de agua subterránea a operar en el \ncampo.” \nDe acuerdo con los apartados anteriormente citados, es claro que el pozo actual PASUB 1 será reemplazado \npor el nuevo pozo solicitado en concesión denominado “PASUB 1B QF”, no obstante, en ninguna parte se \n\nResolución No. 2651       Del 14 NOV. 2023          Hoja No. 20 de 108 \n \n“Por la cual se resuelve un recurso de reposición contra la Resolución 1885 del 25 de agosto de 2023” \nPágina 20 de 108 \n \naclara que este último será puesto en funcionamiento solamente en caso contingente si llega a fallar el pozo \nactual, por el contrario, la Sociedad menciona en repetidas ocasiones que el pozo PASUB 1 presenta \nproblemas mecánicos y será reemplazado. \nConforme con la información presentada por la Sociedad en los Informes de Cumplimiento Ambiental - ICA \ny en el marco de los seguimientos ambientales, esta Autoridad ha evidenciado que actualmente el pozo \nPASUB 1 está en funcionamiento, no obstante, de acuerdo con la información evaluada en el marco del \ntrámite de modificación de Licencia Ambiental, la Sociedad resaltó en repetidas ocasiones que este pozo \npresenta fallas mecánicas, sin dar un mayor detalle de las mismas ni mencionar si estas afectaban de \nmanera inmediata la operación y producción del punto de agua subterránea; solamente es en el marco del \nrecurso de reposición que Frontera Energy Colombia Corp. aclara que actualmente el pozo PASUB 1 no \npresenta problemas que tengan como consecuencia su cierre a corto plazo.  \nUna vez aclarado el alcance de las fallas mecánicas presentadas en el pozo de agua subterránea PASUB \n1 y entendiendo que éstas no implican su cierre a corto plazo, la ANLA concuerda con la Sociedad en que \ndesde el punto de vista ambiental y operativo no resulta pertinente dar cierre a un pozo de agua subterránea \nactivo y funcional, siempre y cuando la infraestructura de este funcione adecuadamente y produzca los \ncaudales de agua necesarios para la operación del proyecto. \nRespecto al argumento de la Sociedad en el cual menciona que en la Resolución 1885 del 25 de agosto de \n2023 y su motivación no hay razón alguna para determinar el cierre actual del pozo PASUB 1, esta Autoridad \nrecalca los apartados del Capítulo 4 del EIA (radicado 2022283750-1-000 del 16 de diciembre de 2022) que \nanteriormente fueron citados, en los cuales la Sociedad menciona en repetidas ocasiones que el pozo \nPASUB 1 presenta problemas mecánicos y será reemplazado, por lo tanto esta Autoridad considera que si \nexistían argumentos para entender que Frontera Energy Colombia Corp. daría de manera pronta el cierre \ndel actual pozo concesionado.  \nAhora bien, de acuerdo con las aclaraciones expuestas en el recurso de reposición interpuesto contra la \nResolución 1885 del 25 de agosto de 2023, la ANLA considera que desde el punto de vista ambiental es \naceptable mantener operativo el pozo PASUB 1, siempre y cuando presente las condiciones óptimas de \noperatividad, pudiéndose reemplazar en caso de fallas o incremento de su deterioro por el pozo PASUB 1B \nQF, el cual fue solicitado en concesión en el marco de la modificación de licencia ambiental; este cambio \ndeberá ser notificando oportunamente a la ANLA.  \nDe acuerdo con lo expuesto anteriormente, la ANLA entiende y acepta la aclaración realizada por la \nSociedad, y considera pertinente aclarar lo dispuesto en el Literal b del Numeral 2, concesión de aguas \nsubterráneas, del Artículo Décimo Tercero, y el Artículo Vigésimo Tercero de la Resolución No. 1885 del 25 \nde agosto de 2023, en el sentido de mantener el permiso de concesión de aguas subterráneas del pozo \nPASUB 1 hasta tanto el pozo PASUB 1B QF deba entrar en operación, aclarando que en ningún momento \nambos pozos pueden estar funcionando al mismo tiempo, y cuyo cambio debe ser notificado a la ANLA, \nmomento a partir del cual el pozo PASUB 1 solamente tendrá funciones de monitoreo.  \nDe igual forma, si bien la Sociedad no recurrió lo dispuesto en el Artículo Trigésimo Cuarto de la Resolución \n1885 del 25 de agosto de 2023 en relación con la FICHA: PSMA-2 Aguas Subterráneas, como consecuencia \nde las anteriores aclaraciones, esta Autoridad considera necesario ajustar el literal a del numeral 1 de la \nmencionada ficha, en el sentido de eliminar la siguiente consideración: “Si bien el pozo denominado PASUB \n1 ya no será de captación de agua subterránea, continuará formando parte de la estrategia de monitoreo \nregional.”, de tal manera que sea reemplazada por la siguiente: Considerando que los pozos de captación \nde agua subterránea PASUB 1 y PASUB 1B QF de acuerdo con las condiciones de concesión del recurso \n\nResolución No. 2651       Del 14 NOV. 2023          Hoja No. 21 de 108 \n \n“Por la cual se resuelve un recurso de reposición contra la Resolución 1885 del 25 de agosto de 2023” \nPágina 21 de 108 \n \nno pueden funcionar al mismo tiempo, en el momento en que el pozo PASUB 1B QF entre en operación, el \npozo PASUB 1 solamente tendrá funciones de monitoreo y continuará formando parte de la estrategia de \nmonitoreo regional. \nPor otro lado, los argumentos presentados por la Sociedad para la solicitud de modificación del Literal b del \nNumeral 2, concesión de aguas subterráneas, del Artículo Décimo Tercero, son los mismos que presentó \npara la solicitud de modificación del Artículo Vigésimo Tercero, por lo tanto, las consideraciones y la decisión \nde esta Autoridad respecto a estos artículos de la Resolución No. 1885 del 25 de agosto de 2023, ya están \nincluidas en el presente concepto técnico, específicamente en el numeral 2.3.3. del concepto técnico \nacogido en el presente acto administrativo. \nCONSIDERACIONES JURÍDICAS \nTeniendo en cuenta lo anterior, si bien la Sociedad en su solicitud de modificación de la licencia \nambiental, requirió la concesión de agua subterránea del pozo PASUB 1B QF, por las razones \nexpuestas en el Capítulo 4 del EIA. En virtud de que los trámites administrativos son rogados, esta \nAutoridad Nacional, se pronunció según lo solicitado por la Sociedad y conforme fue indicado \ntécnicamente, la peticionaria manifestó con claridad que el pozo PASUB 1 dejaría de funcionar por \nproblemas mecánicos, sin especificar mayor detalle y que entraría a operar otro pozo (PASUB 1B QF), \npor lo cual, se emitió la decisión recurrida motivada en la información presentada y conforme a lo \nmanifestado por la sociedad. \nEn claro lo anterior, si es procedente aclarar que la pérdida de vigencia del permiso del pozo PASUB \n1, operará en el momento que entre en funcionamiento el nuevo pozo (PASUB 1B QF), sin embargo, \nen ningún caso se puede realizar una captación simultánea de los mismos o tener activos los dos para \ncaptar. En consecuencia, una vez entre en operación el pozo PASUB 1B QF, la Sociedad deberá \ninformarlo a la Autoridad. \nPor lo anterior, en virtud de la petición oportunamente formulada dentro del recurso como lo establece \nel artículo 80 de la Ley 1437 de 2011, considera pertinente modificar el literal b del numeral 2 del \nartículo décimo tercero y vigésimo tercero, en el sentido de aclarar que continuará en funcionamiento \nel pozo de captación de agua subterránea PASUB 1 siempre y cuando esté en óptimas condiciones, \nasí mismo aclarar la prohibición de que los pozos PASUB 1 y PASUB 1B QF funcionen al mismo \ntiempo, y que cuando este último entre en operación, el primero perderá su vigencia, lo cual deberá \ncomunicarse a esta Autoridad, como se especificará en la parte resolutiva del presente Acto \nAdministrativo. \nPor otro lado, de conformidad con el principio de congruencia en garantía del debido proceso, a fin de \nque todas las disposiciones del acto administrativo guarden relación, sean concordantes y evitar \ninconsistencias dentro del mismo, se observa que el cambio mencionado afecta directamente lo \nseñalado en el literal a numeral 1 de la FICHA: PSMA-2 Aguas Subterráneas del Artículo Trigésimo \nCuarto, por lo que se procederá a modificarlo, para señalarse que los mencionados pozos no pueden \nfuncionar al mismo tiempo y que en el momento en que el pozo PASUB 1B QF entre en operación, el \npozo PASUB 1 solamente tendrá funciones de monitoreo y continuará formando parte de la estrategia \nde monitoreo regional, como quedará consignado en el presente acto administrativo. \n \n\nResolución No. 2651       Del 14 NOV. 2023          Hoja No. 22 de 108 \n \n“Por la cual se resuelve un recurso de reposición contra la Resolución 1885 del 25 de agosto de 2023” \nPágina 22 de 108 \n \nPor otro lado, teniendo en cuenta que esta solicitud es la misma planteada en el numeral 9 del recurso, \nse deben tener en cuenta los argumentos desarrollados dentro de este punto. Por lo cual, no se \nconsidera necesario hacer un pronunciamiento adicional.  \n \n4) OBLIGACIÓN RECURRIDA - NUMERAL 3 DE LAS OBLIGACIONES DEL ARTÍCULO CUARTO \nY OBLIGACIÓN 4 DEL ARTÍCULO DÉCIMO SEGUNDO DE LA RESOLUCIÓN 1885 DEL 25 DE \nAGOSTO DE 2023 \n \n“ARTÍCULO CUARTO: Modificar el numeral 3 del artículo segundo de la Resolución 2035 de 2010, el \nnumeral 3 del artículo segundo de la Resolución 987 de 2011 y numeral 1 del artículo segundo de la \nResolución 261 de 2013, en el sentido de adicionar la construcción y/o ampliación de las siguientes \nplataformas: \n(…) \nObligaciones: \n(…) \n3. No se podrán realizar excavaciones para el establecimiento de áreas de piscinas de tratamiento de aguas \ny cortes de perforación. \n(…)” \n“ (…)  \nARTÍCULO DÉCIMO SEGUNDO: Modificar el artículo séptimo de la Resolución 2035 de 2010 y el numeral \n11 del artículo segundo de la Resolución 261 de 2013, en el sentido de aceptar la reubicación de la ZODME \n5 de acuerdo con la zonificación ambiental y la conversión de áreas de ZODME aprobadas en zonas mixtas \npara la disposición de Materiales de Excavación (ZODME) y Cortes de Perforación (ZTC), mantenido las \náreas aprobadas y con una redistribución al interior de las mismas en una relación 70-30 (70% ZTC - 30% \nZODME). Cuya construcción se realizará por fases, así: \n(…)  \nObligaciones:  \n(…) \n  \n4. No se podrá realizar excavación para la construcción de piscinas para almacenamiento y/o tratamiento \nde los cortes de perforación. \n(…).” \nPETICIÓN DE LA SOCIEDAD  \n \nSe solicita respetuosamente a esta Autoridad Ambiental revocar la obligación 3 del artículo cuarto y revocar \nla obligación 4 del artículo décimo segundo, autorizando la construcción de piscinas para almacenamiento \ny/o tratamiento de los cortes de perforación y para tratamiento de aguas en las zonas mixtas donde se \nincluyen las zonas destinadas y autorizadas desde la licencia original para su tratamiento, manejo y \ndisposición “Zonas de Cortes” y plataformas.  \n\nResolución No. 2651       Del 14 NOV. 2023          Hoja No. 23 de 108 \n \n“Por la cual se resuelve un recurso de reposición contra la Resolución 1885 del 25 de agosto de 2023” \nPágina 23 de 108 \n \n \nARGUMENTOS DE LA SOCIEDAD \nLa ANLA establece en la página 56, consideraciones de la Resolución, que: \n“En cuanto a los lodos, una vez salen del pozo son transportados a piscinas construidas como instalaciones \ntemporales dentro de localizaciones existentes para ser tratados y estabilizados con cal viva y luego ser \nllevados y dispuestos en las ZODME autorizadas.  \nDe acuerdo con lo anterior, el Equipo Evaluador considera que el tratamiento de los cortes de perforación \nse debe realizar en tanques portátiles únicamente, ya que por las condiciones de susceptibilidad a la \ninundación, los acuíferos relacionados a los depósitos aluviales recientes y llanuras de inundación, los \ncuales son de carácter superficial y cuentan con recarga directa por precipitación y por interconexión \nhidráulica con los diferentes cauces presentes en la zona, no se considera ambientalmente adecuada la \nexcavación para la construcción de piscinas para almacenamiento y/o tratamiento de los cortes de \nperforación(“….”) \nAdemás de lo expuesto, la Autoridad Ambiental establece en la página 57 de la Resolución que:  \n \n“De otra parte, vale resaltar que el tratamiento de los cortes de perforación se debe realizar en tanques \nportátiles únicamente, ya que, por las condiciones de susceptibilidad a la inundación, los acuíferos cuentan \ncon recarga directa por precipitación, por lo cual no se considera ambientalmente adecuada la excavación \npara la construcción de piscinas para almacenamiento y/o tratamiento de los cortes de perforación”. \nSi bien los argumentos presentados por la Autoridad, se fundamentan principalmente en la susceptibilidad \na la inundación, es preciso aclarar que, las piscinas se ubicarán dentro de infraestructura como plataformas, \ntal como lo indica el artículo cuarto de la Resolución 1885 del 25 de agosto de 2023, y/o dentro de las zonas \nmixtas, tal como lo indica el artículo décimo segundo de la Resolución 1885 dl (sic) 15 de agost (sic) de \n2023, las cuales cumplirán con la zonificación de manejo ambiental establecida para el proyecto en el \nartículo trigésimo de la Resolución 1885 del 25 de agosto de 2023, donde es preciso indicar los siguientes \nelementos y su categoría:  \n \n“ÁREAS DE EXCLUSIÓN  \n(…) \n \nFranja de 50m. a los drenajes naturales, ya sean permanentes o no, a cada lado de los cauces, medidos de \nla línea de aguas máximas* (...)  \n*Excepto para la ocupación de cauces autorizadas  \n(…)  \nAcuíferos Cuaternarios Aluviales A1 cuya vulnerabilidad a la contaminación es moderada  \n(…)  \nÁREAS DE INTERVENCIÓN CON RESTRICCIONES \n \n\nResolución No. 2651       Del 14 NOV. 2023          Hoja No. 24 de 108 \n \n“Por la cual se resuelve un recurso de reposición contra la Resolución 1885 del 25 de agosto de 2023” \nPágina 24 de 108 \n \nDESCRIPCIÓN DEL ÁREA  \nRESTRICCIONES  \n(…) -Zonas con susceptibilidad muy alta y alta a inundaciones (…).  \n(…) -Áreas con susceptibilidad moderada a las inundaciones (“….”).  \n(…) -Unidad de acuíferos de la Formación Guayabo(...).  \n(…) Se podrán realizar las actividades siempre y \ncuando se implementen las medidas de manejo \ncorrespondientes  \n \n \nCon lo anterior, se puede concluir que los elementos establecidos por la zonificación de manejo ambiental, \nasociados a la susceptibilidad por la inundación, así como sus asociados, es decir cuerpos de agua y \nacuíferos, ya establecen unas condiciones particulares de exclusión o intervención con restricciones, siendo \nesta última la implementación de medidas de manejo correspondientes.  \n \nAsí las cosas, la construcción y posterior operación de las piscinas no sólo dará cumplimiento a la \nzonificación de manejo, sino que, en caso de darse en áreas con restricciones, se ejecutarán según lo \nestablecido en las medidas de manejo ambiental que permitan dar manejo a los posibles impactos. Además, \ndesde los métodos constructivos, se busca minimizar los impactos ambientales, porque tal como se indicó \nen la página 99 del capítulo 2 Parte 2, del Estudio de Impacto Ambiental de la modificación de la Licencia \nAmbiental del Área de Explotación de Hidrocarburos Quifa, radicado ante la Autoridad Nacional mediante \nNúmero 2022283750-1-000 del 16 de diciembre de 2022, la construcción de piscinas como parte de las \ninstalaciones de apoyo en la perforación de pozos, tendrá en cuenta lo siguiente:  \n \n“En el caso de construir piscinas, éstas se excavan en el suelo de la localización o en zonas cercanas, y se \nimpermeabilizan con geomembrana, a fin de prevenir infiltraciones y evitar que los componentes químicos \ncon los cuales son tratados estos residuos comprometan el subsuelo o las aguas subterráneas, las \ncaracterísticas específicas de las piscinas para el tratamiento de los cortes de perforación varían de acuerdo \ncon las necesidades y requerimientos de la operación.  \n \nEl proceso constructivo inicia con la excavación con ayuda de maquinaria como retroexcavadora, \ncontrolando los taludes establecidos en los planos de diseño; posteriormente se construye en el fondo de la \nmisma, un filtro francés dispuesto de forma diagonal con el objetivo de evacuar posibles infiltraciones y \naguas subterráneas; luego se excava una zanja perimetral a una distancia promedio de 1,0 m del borde de \nla piscina para anclar la geomembrana, entre la zanja y el borde de la piscina se conforma un dique con \nsuelo o sacos rellenos de suelo para evitar que entren flujos al interior de las piscinas, finalmente se instala \nla geomembrana” (subrayado fuera del texto). \nAsimismo, se precisa que la construcción de piscinas en las zonas mixtas se enmarcará por los métodos \nconstructivos descritos en la página 289 del mismo capítulo allegado a la Autoridad (Capítulo 2 Parte 2), \ndonde se indicó:  \n \n“Obras de drenaje superficial y subsuperficial \nSe recomienda la construcción de cunetas en el perímetro de la zona de intervención y en la parte \ninterna de las bermas con el fin de captar y conducir el agua de escorrentía superficial. Estas conducirán \na canales escalonados (disipadores de energía), para una entrega adecuada sin producir erosión en el \nterreno, todo de acuerdo con lo indicado en los planos de diseño y estudios hidráulicos del PMA \nespecífico para cada ZODME y ZTC. \nPara el control del agua de infiltración y el drenaje subsuperficial se podrán disponer filtros tipo francés \no similar, perpendiculares a la dirección del talud, los cuales podrán entregar a los disipadores de \nenergía o según lo establecido en los estudios hidráulicos (Ver Figura 2-111), perpendiculares a la \n\nResolución No. 2651       Del 14 NOV. 2023          Hoja No. 25 de 108 \n \n“Por la cual se resuelve un recurso de reposición contra la Resolución 1885 del 25 de agosto de 2023” \nPágina 25 de 108 \n \ndirección del talud, los cuales podrán entregar a los disipadores de energía o según lo establecido en \nlos estudios hidráulicos” (subrayado fuera del texto). \nLos textos subrayados anteriormente resaltan la manera como los métodos constructivos permitirán que no \nse presenten afectaciones en los cauces presentes en la zona, por efectos de conexión de drenajes \nsubsuperficiales y superficiales con el fluido contenido en las piscinas. Además, para el caso específico de \nlas zonas mixtas se indica que las obras de drenaje superficial y subsuperficial se harán según los estudios \nhidráulicos, los cuales permitirán a su vez conocer las condiciones particulares del área y de esta manera \nelaborar diseños que evitan una afectación de los cuerpos de agua aledaños por posibles reboses de \npiscinas, entre otros aspectos. \nPor otro lado, ante el concepto indicado por la ANLA en sus obligaciones 3 y 4, del artículo cuarto y décimo \nsegundo, respectivamente de la Resolución de “no se realizarán excavaciones(…)”, es preciso indicar que, \nsi bien en la página 99 del capítulo 2 Parte 2, del Estudio de Impacto Ambiental de la modificación de la \nLicencia Ambiental del Área de Explotación de Hidrocarburos Quifa, radicado ante la Autoridad Nacional \nmediante Número 2022283750-1-000 del 16 de diciembre de 2022, para la construcción de piscinas como \nparte de las instalaciones de apoyo en la perforación de pozos se indicó: “Para el tratamiento de aguas \nresiduales con tanque de almacenamiento temporal, éstos son generalmente prefabricados y tienen como \nventajas evitar las excavaciones y reducir las dimensiones del sistema de tratamiento” (subrayado fuera del \ntexto original), la implementación de tanques para almacenamiento y/o tratamiento de los cortes de \nperforación requiere de excavaciones, porque es necesario tener firmeza para realizar todos los procesos \ndel tratamiento como la mezcla con retroexcavadoras. \nEs así como el uso de piscinas tanto para el tratamiento de aguas como para el almacenamiento y/o \ntratamiento de los cortes, facilitará cumplir con los objetivos y metas de dos fichas específicas, así como \nsus indicadores asociados, planteados en el capítulo 7 del Estudio de Impacto Ambiental de la modificación \nde la Licencia Ambiental del Área de Explotación de Hidrocarburos Quifa, radicado ante la Autoridad \nNacional mediante Número 2022283750-1-000 del 16 de diciembre de 2022, los cuales se presentan a \ncontinuación. \n \n \nEl uso de piscinas además de cumplir con la zonificación de manejo ambiental, los métodos constructivos, \nlas medidas de manejo ambiental y ser un elemento importante para que se dé cumplimiento a metas, \nobjetivos e indicadores asociadas a aguas residuales industriales y cortes de perforación, cumplirá con lo \n\nResolución No. 2651       Del 14 NOV. 2023          Hoja No. 26 de 108 \n \n“Por la cual se resuelve un recurso de reposición contra la Resolución 1885 del 25 de agosto de 2023” \nPágina 26 de 108 \n \nindicado por la Autoridad Ambiental en la Resolución 1885 del 25 de agosto de 2023 en sus siguientes \nartículos:  \n \n“Artículo décimo octavo: Autorizar el manejo de los residuos sólidos domésticos y no domésticos \ngenerados del proyecto “Área de Explotación de Hidrocarburos Quifa”, bajo las siguientes:  \nObligaciones  \n(…) \n10. Presentar la gestión de los lodos y cortes de perforación en los Informes de Cumplimiento \nAmbiental – ICA según el periodo reportado, y cumplir con las siguientes condiciones: \n \na. \nAlmacenarse en un tanque/ piscina impermeabilizada con geomembrana cercana al sitio de \nperforación, la cual contará con cunetas perimetrales de recolección y conducción de aguas lluvias hacia \nel medio natural. \n \n(…) \nArtículo trigésimo noveno: Modificar la Resolución 2035 de 2010 y sus respectivas modificaciones en \nel sentido de incluir las siguientes obligaciones relacionadas con el Desmantelamiento y Restauración \npara el desarrollo de las actividades del proyecto Área de Explotación de Hidrocarburos Quifa. \nObligaciones \n(…) \n2.Si el pozo resulta productor: Proceder al retiro de todos los equipos utilizados durante la perforación y \npruebas; solo se dejará en el lugar el equipo de superficie o unidad de producción con sus respectivas \ntuberías de conducción; se cerrará la piscina de cortes y se conservarán las piscinas de tratamiento de \naguas, si el operador lo considere necesario de acuerdo con los requerimientos del Proyecto. \n3. En caso de abandono del pozo: Retirar todos los equipos utilizados durante la perforación y pruebas; \ndebe cerrar todas las piscinas y realizar el desmantelamiento de las instalaciones, realizar limpieza del \nárea y ejecutar las acciones de restauración paisajística; debe desarmar las casetas de alojamiento, \nretirar del sitio los escombros resultantes y las construcciones provisionales de enramadas, remoción \nde los materiales de relleno de la locación y colocación de material de descapote con el propósito de \nrestaurar el terreno original y se deberán adelantar los programas de recuperación de la zona \nintervenida(“….”). subrayados fuera del texto original \nEs preciso aclarar que un rebose de piscina que conlleve a afectaciones en los cuerpos de agua, no hace \nparte de las condiciones normales de operación, sino por lo contrario de un evento contingente aislado y en \ncaso de presentarse un evento de estos, los cuales según la estadística de la operación del AEH Quifa y \nlas categorías de probabilidad de la matriz RAM es muy improbable (ha ocurrido por lo menos una vez en \nlos últimos 10 años), se aplicaría lo establecido en el Plan de Gestión del Riesgo, y el Plan de Emergencias \ny Contingencias, tal como lo exige la Autoridad Ambiental en la Licencia Ambiental.  \n \nA partir de los argumentos expuestos anteriormente por la Compañía, se concluye que la ubicación de las \npiscinas tanto para tratamiento de aguas, como para el almacenamiento y/o tratamiento de cortes de \nperforación, no afectarán los diferentes cauces presentes en la zona por las condiciones de susceptibilidad \na la inundación, ni los acuíferos relacionados a los depósitos aluviales recientes y llanuras de inundación, \n\nResolución No. 2651       Del 14 NOV. 2023          Hoja No. 27 de 108 \n \n“Por la cual se resuelve un recurso de reposición contra la Resolución 1885 del 25 de agosto de 2023” \nPágina 27 de 108 \n \nlos cuales son de carácter superficial y cuentan con recarga directa por precipitación y por interconexión \nhidráulica, puesto que, la construcción de estas piscinas cumplirá con la zonificación de manejo ambiental \nestablecida dos constructivos, previene la generación de impactos ambientales, principalmente en el \ncomponente hidrológico e hidrogeológico; y, su construcción y operación permitirán y facilitarán cumplir con \nobjetivos, metas e indicadores relacionadas con el manejo de aguas residuales industriales y cortes de \nperforación.  \n \nEn caso de presentarse una contingencia de rebose que conlleve a afectaciones en cuerpos de agua, lo \ncual tiene una probabilidad muy baja, se activará el Plan de Gestión del Riesgo, y el Plan de Emergencias \ny Contingencias, tal como lo exija la Autoridad Ambiental en la Licencia Ambiental.  \n \nCONSIDERACIONES TÉCNICAS DE LA ANLA \n \nDe acuerdo con lo expuesto por la Sociedad es preciso reiterar los argumentos sobre las condiciones de \nsusceptibilidad a la inundación, las características de los acuíferos existentes en el área del proyecto, los \ncuales están relacionados a los depósitos aluviales recientes y llanuras de inundación, los cuales son de \ncarácter superficial y cuentan con recarga directa por precipitación y por interconexión hidráulica con los \ndiferentes cauces presentes en la zona.  \n \nEn este sentido y pese a que las piscinas se pretendan ubicar dentro de infraestructura como plataformas \ny/o dentro de las zonas mixtas, la evaluación realizada por esta Autoridad versa en esas condiciones de \nsensibilidad de la zona a intervenir, razón por la cual NO se consideró ambientalmente viable realizar \nexcavación para la construcción de piscinas para almacenamiento y/o tratamiento de los cortes de \nperforación. \n \nRespecto a los elementos y categorías definidas en la zonificación de manejo ambiental establecida en el \nartículo Décimo Segundo de la Resolución 1885 de 2023 e indicadas por la Sociedad en el presente \nRecurso, se debe tener presente que estas aplican para todas aquellas infraestructuras puntuales o lineales \na desarrollar en el marco de las actividades autorizadas en la presente modificación del proyecto AEH Quifa, \ncon sus respectivas excepciones y/o restricciones, lo cual no convalida las actividades de excavación para \nla construcción de piscinas para el tratamiento de aguas residuales y/o cortes de perforación, aun cuando \nestas cuenten con medidas de impermeabilización, en razón a la sensibilidad ya mencionada del área del \nproyecto.  \n \nEn relación con el argumento referente a la construcción de piscinas en las zonas mixtas, es preciso señalar \nque el numeral 2.2.2.10.1 del capítulo 2 del complemento de EIA se presenta la solicitud de conversión de \náreas de ZODME aprobadas en zonas mixtas para la disposición de Materiales de Excavación (ZODME) y \nCortes de Perforación (ZTC), más no se indica sobre la construcción de piscinas de tratamiento en dichas \nZODME.  \n \nDe otra parte, sobre los métodos constructivos descritos en la página 289 del capítulo en mención, se hace \nreferencia a los procedimientos constructivos de las ZODME, los cuales tienen la función de prevenir las \nposibles afectaciones que se presenten en los cauces presentes en la zona, como consecuencia de la \ndisposición final de los materiales de excavación y/o cortes de perforación, como son las obras de drenaje \nsuperficial y subsuperficial construcción (cunetas perimetrales, disipadores de energía, instalación de filtros \ntipo francés o similar, entre otros), más no de obras de control para piscinas de tratamiento. \n \n\nResolución No. 2651       Del 14 NOV. 2023          Hoja No. 28 de 108 \n \n“Por la cual se resuelve un recurso de reposición contra la Resolución 1885 del 25 de agosto de 2023” \nPágina 28 de 108 \n \nAsí mismo, se resalta que los diseños tipo presentados en el complemento del EIA no dan cuenta de la \nubicación de piscinas para el tratamiento de cortes. \n \nTambién es preciso indicar que para la implementación de tanques para almacenamiento y/o tratamiento \nde los cortes de perforación no se requiere de excavaciones para dar firmeza al terreno, tal como lo indica \nla Sociedad en el presente Recurso.   \n \nRespecto al uso de piscinas para dar cumplimiento de los objetivos y metas el indicador formulado en la \nficha PMSA-7 Manejo de residuos sólidos industriales y peligrosos, no se considera un argumento válido, \ntoda vez que el indicador no está ligado a la construcción de piscinas para tratamiento, sino al volumen \ntratado en relación al volumen generado, en este caso de corte, como se presenta a continuación: \n \nAcción \n4: \nManejo \nde \ncortes y lodos \nPMSA-7-\nIC-5 \nTipo de indicador: \nEficacia \nFormula del indicador: \n𝑿 \n=\n𝑉𝑜𝑙𝑢𝑚𝑒𝑛 𝑡𝑟𝑎𝑡𝑎𝑑𝑜 𝑑𝑒 𝑐𝑜𝑟𝑡𝑒𝑠 𝑑𝑒 𝑝𝑒𝑟𝑓𝑜𝑟𝑎𝑐𝑖ó𝑛 \n𝑉𝑜𝑙𝑢𝑚𝑒𝑛 𝑑𝑒 𝑐𝑜𝑟𝑡𝑒𝑠 𝑑𝑒 𝑝𝑒𝑟𝑓𝑜𝑟𝑎𝑐𝑖ó𝑛 𝑝𝑟𝑜𝑑𝑢𝑐𝑖𝑑𝑜𝑠\n× 100 \n100% \nMensual \nFuente: Radicado 2022283750-1-000 del 16 de diciembre de 2022, capítulo 7 del complemento del EIA para la solicitud de modificación de la \nLicencia Ambiental para el Área de Explotación de Hidrocarburos Quifa - AEH Quifa. \n \nDe igual manera el argumento de la Sociedad frente a que el uso de las piscinas facilitaría el cumplimiento \nde la Acción 1 de la ficha PMRHSA-3 Manejo de aguas residuales industriales, no se considera válido, toda \nvez que como se observa en la tabla siguiente, el indicador está encaminado a verificar el cumplimiento \nnormativo de los parámetros a monitorear de las aguas del tratamiento de lodos de perforación, más no está \nasociado a la construcción de piscinas. \n \nAcción 1  \nAguas \nprovenientes del \ntratamiento \nde \nlodo \nde \nperforación \n(Dewatering) \nPMRHSA-\n3-IC-1 \nIndicador de:  \nEficacia \n \nFormula del indicador:  \n \n𝑿 \n= 𝑁ú𝑚𝑒𝑟𝑜 𝑑𝑒 𝑝𝑎𝑟á𝑚𝑒𝑡𝑟𝑜𝑠 𝑞𝑢𝑒 𝑐𝑢𝑚𝑝𝑙𝑒𝑛 𝑐𝑜𝑛 𝑙𝑜𝑠  𝑙𝑖𝑚\n𝑁ú𝑚𝑒𝑟𝑜 \n× 100 \n100% \nMensual \nFuente: Radicado 2022283750-1-000 del 16 de diciembre de 2022, capítulo 7 del complemento del EIA para la solicitud de \nmodificación de la Licencia Ambiental para el Área de Explotación de Hidrocarburos Quifa - AEH Quifa. \n \nEn lo que respecta a la obligación del Artículo Décimo Octavo, es pertinente indicar que la misma \ncorresponde no solo a obligaciones para las nuevas actividades, sino que cobija las actividades previamente \n\nResolución No. 2651       Del 14 NOV. 2023          Hoja No. 29 de 108 \n \n“Por la cual se resuelve un recurso de reposición contra la Resolución 1885 del 25 de agosto de 2023” \nPágina 29 de 108 \n \nautorizadas por la Resolución 2035 de 2010 y sus respectivas modificaciones, es en este sentido que el \nliteral a de la obligación 10, establece las dos alternativas de tratamiento de lodos y cortes de perforación. \n \nEn la misma línea, esta Autoridad formuló el Artículo Trigésimo Noveno el cual modificó la Resolución 2035 \nde 2010 y sus respectivas modificaciones, en el sentido de incluir obligaciones relacionadas con el \ndesmantelamiento y restauración, no solo para las nuevas actividades autorizadas en la presente \nmodificación, sino para las actividades ya autorizadas previamente, razón por la cual se establecen \nobligaciones de abandono de pozos y retiro de toda aquella infraestructura y equipos.  \n \nEn virtud de lo anterior, se considera pertinente RATIFICAR la obligación 3 del Artículo Cuarto y la obligación \n4 del Artículo Décimo Segundo de la Resolución 1885 del 25 de agosto de 2023. \n \nCONSIDERACIONES JURÍDICAS \nDe acuerdo con los argumentos técnicos señalados, teniendo en cuenta las condiciones de \nsusceptibilidad a la inundación, las características de los acuíferos existentes en el área del proyecto, \nrelacionados a los depósitos aluviales recientes y llanuras de inundación, los cuales son de carácter \nsuperficial y cuentan con recarga directa por precipitación y por interconexión hidráulica con los \ndiferentes cauces presentes en la zona, la restricción fue impuesta por esta Autoridad Nacional \nconforme a las condiciones de sensibilidad de la zona a intervenir. \n \nEn la Sentencia C-746 de 2012, la Corte Constitucional mencionó la Sentencia C-035 de 1999, en la \nque caracterizó la naturaleza jurídica de la Licencia Ambiental, reconociéndola como un instrumento \ncautelar y planificador, consustancial a los deberes especiales del Estado en la protección de los \nrecursos naturales y del ambiente. Al respecto, afirmó: \n  \n“La licencia habilita a su titular para obrar con libertad, dentro de ciertos límites, en la ejecución de la \nrespectiva obra o actividad; pero el ámbito de las acciones u omisiones que aquél puede desarrollar \naparece reglado por la autoridad ambiental, según las necesidades y conveniencias que ésta \ndiscrecional pero razonablemente aprecie, en relación con la prevención, mitigación, corrección, \ncompensación y manejo de los efectos o impactos ambientales que la obra o actividad produzca o sea \nsusceptible de producir. De este modo, la licencia ambiental tiene indudablemente un fin preventivo o \nprecautorio en la medida en que busca eliminar o por lo menos prevenir, mitigar o reversar, en cuanto \nsea posible, con la ayuda de la ciencia y la técnica, los efectos nocivos de una actividad en los recursos \nnaturales y el ambiente”. (Subrayas fuera de texto). \n \nAhora bien, teniendo en cuenta lo señalado en el Decreto 1076 de 2015, la licencia ambiental al ser \nuna autorización de naturaleza ambiental otorgada por la autoridad competente para la ejecución de \nuna obra o actividad, puede generar un deterioro a los recursos naturales renovables, al medio \nambiente o introducir modificaciones considerables o notorias al paisaje. Por lo tanto, sujeta al \nbeneficiario de la misma, al cumplimiento de los requisitos que la misma establezca en relación con la \nprevención, mitigación, corrección, compensación y manejo de los efectos ambientales de la obra o \nactividad autorizada, conforme lo señala el Artículo 2.2.2.3.1.3. de Decreto 1076 de 2015. \n \nEn ese sentido, al ser patrimonio común el medio ambiente, significa que es de todos y que es \npatrimonio de la humanidad, necesario para la supervivencia y el desarrollo económico y social de los \npueblos, siendo obligación del estado en cabeza de sus entidades, velar por la preservación del \nmismo, a través de los instrumentos administrativos y/o ambientales requeridos. A su vez, el artículo \n\nResolución No. 2651       Del 14 NOV. 2023          Hoja No. 30 de 108 \n \n“Por la cual se resuelve un recurso de reposición contra la Resolución 1885 del 25 de agosto de 2023” \nPágina 30 de 108 \n \n8 de la Constitución Política determinó como obligación del Estado y las personas proteger las riquezas \nnaturales de la Nación y el artículo 80 le impuso al Estado la obligación de planificar el manejo y \naprovechamiento de los recursos naturales, para garantizar su desarrollo sostenible, su conservación, \nrestauración y sustitución. Además, debe prevenir y controlar los factores de deterioro ambiental, \nimponer las sanciones legales y exigir la reparación de los daños causados. \n \nEn línea con lo anterior, en necesario precisar el concepto de discrecionalidad, entendida como la \nfacultad de que goza la Administración Pública para realizar juicios de valor, apreciaciones y \nestimaciones en pro de la concreción de los fines del Estado; constituye un mecanismo útil en la \nbúsqueda de la eficacia, eficiencia y celeridad necesarias en la adopción y ejecución de decisiones \nhacía los administrados. Acerca de la clara distinción que debe existir entre discrecionalidad y \narbitrariedad, la Corte Constitucional en Sentencia T–064 de 2007 sostuvo lo siguiente2:  \n“(…)… Las decisiones que adopte la Administración en ejercicio de dichas facultades, necesariamente \ndeben tener fundamento en motivos suficientes que permitan distinguir lo discrecional de lo puramente \narbitrario o caprichoso, tal como lo exige el artículo 36 del Código Contencioso Administrativo. De esta \nsuerte, las facultades discrecionales no pueden ser absolutas, sino limitadas por los objetivos que se \npersiguen con su otorgamiento y por la proporcionalidad en su aplicación. (…)” \nFrente a lo anterior, se precisa que a pesar de que la decisión que culmina el trámite de licenciamiento, \nes reglada, existe un grado de discrecionalidad técnica de la autoridad administrativa que le permite \nadoptar decisiones como esta. En ese sentido, la Autoridad usando ese mecanismo útil en el desarrollo \nde sus actuaciones administrativas, garantiza que el acto administrativo emanado de la misma dentro \ndel trámite y que fue recurrido, cumpliera su cometido bajo la protección del medio ambiente, de \nacuerdo a lo señalado en la Ley 23 de 1973. \nEl Honorable Consejo de Estado, Sala de lo Contencioso Administrativa, mencionó mediante \nSentencia del 7 de julio de 2022, dentro del expediente 110010326000201600140-00 (57819), sobre \nlos aspectos principales relacionados con la noción de discrecionalidad técnica y su incidencia en la \nnaturaleza jurídica de las facultades de la administración ejercidas en criterios técnicos: \n“El derecho público no es ajeno a la discrecionalidad técnica, toda vez que la utilización de conocimientos \ny nociones técnicas, y la consecuente atribución de márgenes de valoración a la administración para que \nresuelva los casos concretos con base en criterios de la misma naturaleza, no constituye una alternativa, \nsino una necesidad debido a los altos niveles de tecnificación alcanzados por la actividad administrativa \ndentro de los asuntos que le competen. Por tanto, en la medida en que la ciencia no siempre ofrece \nrespuestas únicas para la resolución de un supuesto específico (cuestiones técnicas complejas), las \ndecisiones basadas en criterios técnicos pueden dar lugar en algunos eventos a la existencia de márgenes \nde apreciación que pueden configurarse como facultades de naturaleza discrecional”3. \nEn ese sentido esta Autoridad, expidió la resolución recurrida con fundamento en el análisis efectuado \nen el Concepto Técnico 5269 del 24 de agosto de 2023, que contiene en cada uno de sus acápites los \ncriterios y elementos específicos para el proyecto, a fin de determinar las obras y actividades a \n \n2 Santos de Aguirre, M del R., & Torres Bayona, D. F. (2020). Límites de la discrecionalidad técnica en el otorgamiento de licencias ambientales. Revista \nAcademia & Derecho, 11(20), 155-192. \n3 Consejo de Estado. Sección Tercera. Sentencia del 31 de octubre de 2007. M.P. Mauricio Fajardo Gómez. Exp.11001-03-26-000-1997-13503-00 \n(13503). Reiterada por la Subsección A en sentencia del 19 de julio de 2018. Exp. 57576, M.P. Marta Nubia Velásquez Rico. \n\nResolución No. 2651       Del 14 NOV. 2023          Hoja No. 31 de 108 \n \n“Por la cual se resuelve un recurso de reposición contra la Resolución 1885 del 25 de agosto de 2023” \nPágina 31 de 108 \n \nautorizar, el área de influencia, caracterización ambiental, demanda, uso, aprovechamiento y/o \nafectación de recursos naturales, zonificación ambiental y de manejo, entre otras.  \nEs así como esta Autoridad en cumplimiento de sus funciones de protección al ambiente, puede \nimponer las restricciones que sean necesarias mediante actos administrativos debidamente \nmotivados, atendiendo las condiciones de sensibilidad y características especiales de cada proyecto \nevaluado, conforme lo permite el artículo 44 de la Ley 1437 de 2011, que indica: “En la medida en que \nel contenido de una decisión de carácter general o particular sea discrecional, debe ser adecuada a \nlos fines de la norma que la autoriza, y proporcional a los hechos que le sirven de causa”. Por lo cual, \nla prohibición de no realizar excavación para la construcción de piscinas para almacenamiento y/o \ntratamiento de los cortes de perforación, fue establecida teniendo en cuenta las condiciones de \nsensibilidad de la zona a intervenir, esto es, la susceptibilidad a la inundación, las características de \nlos acuíferos existentes en el área del proyecto, relacionados a los depósitos aluviales recientes y \nllanuras de inundación, los cuales son de carácter superficial y cuentan con recarga directa por \nprecipitación y por interconexión hidráulica con los diferentes cauces presentes en la zona. Por lo cual, \nno se revoca y se procederá a confirmar el numeral 3 (obligaciones) del artículo cuarto y el numeral 4 \n(obligaciones) del artículo décimo segundo de la resolución recurrida. \n \n5) OBLIGACIÓN RECURRIDA –LITERAL A DEL NUMERAL 1 DE LA FICHA PSMA3 – ARTICULO \nTRIGÉSIMO CUARTO DE LA RESOLUCIÓN 1885 DEL 25 DE AGOSTO DE 2023 \n \n“ARTÍCULO TRIGÉSIMO CUARTO: La sociedad Frontera Energy Colombia Corp. Sucursal Colombia, \ndeberá ajustar los siguientes programas y presentar los soportes de cumplimiento en un término de tres (3) \nmeses contados a partir de la firmeza del presente acto administrativo, de conformidad con las condiciones \nque se presentan a continuación: \n(…) \nFICHA PSMA 3 Emisiones atmosféricas, calidad del aire y ruido \n1. Especificar la realización de los monitoreos de calidad del aire y ruido de la siguiente forma: \na. Antes y durante la construcción de vías y plataformas nuevas. \n(…)” \nPETICIÓN DE LA SOCIEDAD  \n \n“Se solicita respetuosamente a esta Autoridad Ambiental modifique el literal a, numeral 1 del artículo \ntrigésimo cuarto de la Resolución, en el sentido de eliminar la obligación de realizar los monitoreos de calidad \ndel aire y ruido antes y durante la construcción de vías y plataformas nuevas y en su defecto establecer la \nobligación de realizar modelos de propagación de ruido y de dispersión de contaminantes atmosféricos \nantes de la construcción de vías y plataformas nuevas”. \nARGUMENTOS DE LA SOCIEDAD \n \n“La Autoridad Ambiental presenta en la Página 213 de la parte considerativa de la Resolución, \nespecíficamente la Tabla 37. Consideraciones de las Ponencias presentadas en la APA del proyecto \nÁrea de Explotación Quifa., respecto al tema atmósfera (Ruido-Aire), los siguientes argumentos: \n\nResolución No. 2651       Del 14 NOV. 2023          Hoja No. 32 de 108 \n \n“Por la cual se resuelve un recurso de reposición contra la Resolución 1885 del 25 de agosto de 2023” \nPágina 32 de 108 \n \n“1. En cuanto a la preocupación por la emisión del contaminante material particulado que generará el \nproyecto, se aclara que esta Autoridad impuso obligaciones adicionales a las propuestas por la Sociedad, \ncon la finalidad de realizar el seguimiento y control a la generación de este contaminante producido por la \nconstrucción de vías y otras actividades. Estas obligaciones se ubican en el capítulo 13 Consideraciones \nSobre los Planes y Programas del presente concepto, específicamente en la ficha de manejo PMRHA1 \nManejo de Fuentes de emisiones y ruido y la ficha de seguimiento PSMA 3 Emisiones atmosféricas, calidad \ndel aire y ruido, donde se solicitó: \n(…) \n• Realizar los monitoreos de calidad del aire donde se aclaró las especificaciones de ubicación de \nlas estaciones, etapas en las que se deben ejecutar y parámetros a medir. \n(…) \nCon lo anterior, se estima que el seguimiento de la calidad del aire en la zona podrá realizarse en buena \nmedida, para verificar que la contaminación por material particulado no exceda los niveles permisibles de \nlas normas nacionales que determinan estos estándares, en este caso la Resolución 2254 del 2017 (norma \nde calidad del aire ambiente) y la Resolución 909 del 2008 (que establecen las normas y estándares de \nemisión admisibles de contaminantes a la atmósfera por fuentes fijas), ambas resoluciones emitidas por el \nactual Ministerio de Ambiente y Desarrollo Sostenible (MADS).” \nDel mismo modo en el concepto técnico 5269 del 24 de agosto de 2023, el equipo evaluador de la ANLA \nargumentó lo siguiente: \n“Acción 2 Seguimiento a la tendencia del medio en Calidad de Aire (…) \n(…) no se especifican monitoreos puntuales para actividades de construcción de las plataformas o \nlocaciones y de las actividades de perforación de cada pozo. Es necesario realizar caracterización durante \ncada actividad de forma local ya que no todas las estaciones logran cubrir y evaluar espacialmente el \nimpacto específico de las actividades durante el desarrollo de las actividades de cada a los receptores \ncercanos (“…”). \n(“…) Acción 3 Manejo de los niveles de presión sonora (“…) \n(“…) Respecto al ruido, es importante que se realice monitoreo antes de la construcción de cada plataforma, \ncon el fin de tener datos comparables durante el desarrollo del proyecto de manera específica en la zona a \nintervenir.” \nRespecto a los argumentos entregados por la autoridad ambiental, es necesario realizar algunas \naclaraciones respecto a la solicitud de monitoreos puntuales debido a que no son suficientes para cubrir el \nimpacto específico. \nAsí, la Compañía considera pertinente precisar que las actividades que solicita la Autoridad Ambiental son \nde localización puntual y el hecho de realizar campañas focalizadas en actividades que cuenten con fuentes \nde emisión temporales (la perforación de un pozo en Quifa tarda en promedio 10 días y se utilizan hasta 3 \nequipos de perforación simultáneos) puede ir en contravía de los principios definidos por el Manual de \nDiseño del Protocolo Para El Monitoreo y Seguimiento de la Calidad del Aire, en el cual, de acuerdo a los \nprincipios de microlocalización, es claro que las estaciones deben estar ubicadas fuera del área de influencia \ndirecta de fuentes de emisión. Por lo anterior, la realización de los monitores ordenados por la ANLA no se \nencuentra en línea con el parágrafo del artículo 8 de la Resolución 2254 de 2017 donde se especifica que \n\nResolución No. 2651       Del 14 NOV. 2023          Hoja No. 33 de 108 \n \n“Por la cual se resuelve un recurso de reposición contra la Resolución 1885 del 25 de agosto de 2023” \nPágina 33 de 108 \n \nlos monitoreos deberán realizarse de acuerdo con los métodos, frecuencias y demás lineamientos \ncontenidos en el Protocolo para el Monitoreo y Seguimiento de la Calidad del Aire. \nDe acuerdo con lo mencionado en el capítulo 3.2.9.2 Calidad del aire en su numeral 3.2.9.2.3 Monitoreo de \ncalidad de aire del EIA, la Compañía especifica que con el objetivo de dar amplio cubrimiento al área de \nestudio y determinar los potenciales efectos que allí se presenten; se definieron ocho (8) estaciones de \nmonitoreo dispuestas e instaladas según los criterios de macro y micro localización numerales 6.3 y 6.4 \nexpuestos en el protocolo para el Monitoreo y Seguimiento de la Calidad del Aire - Resolución 2154 del 2 \nde noviembre de 2010 y el Código de Federal de Regulaciones de la Agencia de Protección Ambiental de \nlos Estados Unidos (CFR 40) Parte 58, donde se establecen criterios de representatividad para la \nlocalización de los sitios de muestreo. Los puntos de monitoreo que hacen parte del SVCI del campo están \nubicados de manera estratégica para poder caracterizar, no solo el área de influencia sino considerar el \nimpacto de las diferentes actividades de desarrollo a ejecutar. \nAdicionalmente, es importante aclarar que una campaña de perforación en un clúster tiene una duración \nmáxima de 10 días y puede rotar o ubicarse en diferentes puntos del campo, por lo cual no sería \nrepresentativo ni viable monitorear antes y durante la construcción de vías y plataformas nuevas. Igual \nsucede con lo relacionado a las actividades de construcción de infraestructura que puede ser puntual y no \nsería nada representativo con el objetivo que alcanza el monitoreo. \nDentro de los principales criterios analizados por la Compañía para definir las ocho (8) estaciones de \nmonitoreo dispuestas e instaladas se encuentran: \n• Centros poblados y comunidad aledaña (receptores sensibles) \n• Condiciones de Seguridad. \n• Representatividad. \n• Objetivo de estaciones. \n• Verificar dirección predominante del viento en la zona de estudio. \n• Modelo de Dispersión de contaminantes atmosféricos anteriores. \nEl Sistema de Vigilancia de Calidad del Aire Industrial (en adelante el “SVCAI”) definido para el proyecto \ncumple con los requisitos definidos en el Manual de Diseño del Protocolo Para El Monitoreo Y Seguimiento \nDe La Calidad Del Aire. En este sentido, los datos generados por dicho SVCAI cuentan con una escala que \npuede abarcar las definiciones de “vecindario” a “regional”, que garantiza la representatividad espacial de \nlos datos de tal forma que representen adecuadamente la totalidad del área de influencia del proyecto, \nsituación que además garantiza que los datos no podrán ser sesgados por fenómenos puntuales y de corta \nduración los cuales pueden ser el motivo de fondo de las molestias y las preocupaciones existentes en torno \na la calidad del aire. \nFinalmente, de acuerdo con los resultados obtenidos en el modelo de dispersión de contaminantes \natmosféricos (Anexo B Anexo Abiótico/ B_5_Ambientales/ 7_Modelac_Atmosf/1. Modelo de dispersión del \nEIA) para ninguno de los escenarios proyectados, las concentraciones exceden los límites normativos en \nlas áreas del proyecto en las métricas a largo plazo y por ende no se proyecta la necesidad de realizar los \nmonitoreos con frecuencias mayores a las ya proyectadas. Es de aclarar que en las métricas que se tienen \na corto plazo, los modelos indican la probabilidad de incrementos de concentraciones en escalas temporales \n\nResolución No. 2651       Del 14 NOV. 2023          Hoja No. 34 de 108 \n \n“Por la cual se resuelve un recurso de reposición contra la Resolución 1885 del 25 de agosto de 2023” \nPágina 34 de 108 \n \na corto plazo en localizaciones particulares en las cuales no es prudente localizar estaciones de monitoreo \nconsiderando los objetivos de representatividad espacial y temporal de los datos generados por el SVCAI. \nPara los monitoreos de ruido, si bien en algunos puntos del área se presentaron niveles superiores a los \nlímites permitidos, estos están relacionados con el ruido residual presente en el campo y relacionado con la \nfauna silvestre presente en la zona, por ende se puede identificar que el nivel de ruido ambiente típico de la \nzona puede alcanzar los 68,22 dB(A), dicho nivel de ruido es considerablemente más alto que el nivel de \nruido típico de las zonas de propagación de ruido o fuentes de emisión. \nEn los resultados presentados en el capítulo 3.2.9.3 Ruido del EIA y los resultados obtenidos en el modelo \nde ruido presentado (B_Anexo Abiótico/B_5_Ambientales/7_Modelac_Atmosf/2. Modelo de ruido) la \nCompañía considera que no se requiere aumentar las frecuencias de monitoreo de ruido mayores a las que \nviene trabajando el campo, las cuales, han evidenciado ser suficientes para dar manejo al posible impacto. \nEl sistema propuesto de monitoreo consideró dichas actividades y su localización. El sistema propuesto es \nbasto y suficiente para conocer cómo se mencionó anteriormente el posible impacto en la zona, aclarando \nnuevamente que la ubicación de las estaciones de calidad del aire del SVCAI deben estar ubicadas de tal \nforma que brinden datos con representatividad espacial del proyecto, sin que existan condiciones \nparticulares que puedan sesgar la información, de acuerdo a los principios establecidos por el Manual de \nDiseño del Protocolo Para El Monitoreo y Seguimiento de la Calidad del Aire. \nDe acuerdo con los argumentos presentados, se considera que existe sustento técnico suficiente para \nafirmar que el sistema de vigilancia y control de calidad de aire propuesto, en cuanto a la ubicación de \nestaciones de acuerdo con la malla proyectada del área de influencia, son suficientes para caracterizar las \náreas donde se ejecuten nuevas actividades por estrategias de desarrollo y no resulta necesario instalar \nestaciones locales a dichas actividades. \nDel mismo modo, es importante considerar que para evaluar la posible afectación a la calidad del aire y al \nambiente acústico, se realizarán modelos de propagación de ruido y de dispersión de contaminantes \natmosféricos con objetivos puntuales para proyectar la posible afectación a dichas matrices por la ejecución \nespecífica de la construcción de tramos particulares de vías y plataformas nuevas. En este sentido, se tendrá \nuna proyección de posible afectación para cada actividad programada, unas medidas de control asociadas \ny la evidencia de su implementación. Estos ejercicios de simulación cumplirían con los requisitos de calidad \nexigidos por la autoridad en el contexto de la presente modificación de licencia. \nComo alternativa, para evaluar la posible afectación a la calidad del aire y al ambiente acústico, se propone \nen cada caso realizar modelos de propagación de ruido y de dispersión de contaminantes atmosféricos con \nobjetivos puntuales de proyectar la afectación a dichas matrices por cada ejecución específica asociada a \nla construcción de tramos particulares de vías y plataformas nuevas, durante la perforación y pruebas de \nproducción de cada pozo y antes y durante la operación de las áreas de evaporación. En este sentido, se \ntendrá una proyección de afectaciones para cada actividad programada, unas medidas de control asociadas \ny la evidencia de su implementación. Estos ejercicios de simulación cumplirían con los requisitos de calidad \nexigidos por la autoridad en el contexto de la presente modificación de licencia. \nDe acuerdo con lo expuesto, se solicita respetuosamente a esta Autoridad Ambiental modifique el literal a, \nnumeral 1 del artículo trigésimo cuarto de la Resolución, en el sentido de eliminar la obligación de realizar \nlos monitoreos de calidad del aire y ruido antes y durante la construcción de vías y plataformas nuevas y en \nsu defecto establecer la obligación de realizar modelos de propagación de ruido y de dispersión de \ncontaminantes atmosféricos antes de la construcción de vías y plataformas nuevas”. \n\nResolución No. 2651       Del 14 NOV. 2023          Hoja No. 35 de 108 \n \n“Por la cual se resuelve un recurso de reposición contra la Resolución 1885 del 25 de agosto de 2023” \nPágina 35 de 108 \n \nCONSIDERACIONES TÉCNICAS DE LA ANLA \n \nRespecto a los argumentos planteados por la Sociedad sobre el carácter puntual de los monitoreos de \ncalidad del aire y de ruido ambiental, es importante considerar lo establecido en el Manual de Diseño del \nProtocolo para el Monitoreo y Seguimiento de la Calidad del Aire, adoptado mediante la Resolución 650 de \n2010 y ajustado por la Resolución 2154 de 2010 del entonces Ministerio de Ambiente, Vivienda y Desarrollo \nTerritorial, actual Ministerio de Ambiente y Desarrollo Sostenible. De manera particular, en cuanto a los \ncriterios de macro localización de las estaciones de monitoreo de calidad del aire, la “Tabla 27. Criterios de \nmacro localización para ubicar los puntos de muestreo” indica lo siguiente: \n \n“Los puntos de muestreo deben ubicarse de manera que proporcionen datos de las áreas situadas dentro \nde las zonas de interés, que concentren más de 50.000 habitantes y que registren las concentraciones más \naltas a las que la población puede llegar a verse expuesta directa o indirectamente durante un periodo \nsignificativo en comparación con el periodo promedio utilizado para el cálculo del valor o valores límite. \n \nDeben ubicarse de manera que proporcionen datos sobre los niveles registrados en otras áreas dentro de \nlas zonas y aglomeraciones que sean representativas del grado de exposición de la población. Además, \nserán situados, en general, de tal manera que se evite la medición de microambientes en las inmediaciones.” \n(subrayado fuera del texto). \n \nLas anteriores afirmaciones del Protocolo hacen alusión al análisis de la exposición directa o indirecta de la \npoblación durante un periodo significativo, tomando como referencia los tiempos de exposición asociados \ncon los niveles máximos permisibles establecidos en la Resolución 2254 de 2017 del Ministerio de Ambiente \ny Desarrollo Sostenible, aspecto que considera una perspectiva robusta de análisis. Además, este Protocolo \nindica que los puntos deben ubicarse en función de la representatividad asociada con el grado de exposición \nde la población y evitando la medición de microambientes en las inmediaciones. \n \nPor otro lado, en cuanto a los criterios de micro localización, el numeral “6.4.2.1 Distancia a fuentes” del \nmencionado Manual de Diseño indica que: \n \n“… si una estación de monitoreo va a ser utilizada para determinar la calidad del aire sobre un área mucho \nmayor, tal como un vecindario o un centro urbano, la autoridad ambiental o entidad encargada del monitoreo \ndebe evitar colocar el toma muestras, el camino de medición o la entrada del muestreador cerca de fuentes \nmenores locales. No debe permitirse que la pluma de fuentes menores locales interfiera y altere los datos \nde calidad del aire colectados en un sitio. Las estaciones para la medición de material particulado no deben \nubicarse cerca o en un área sin pavimentar”. (subrayado fuera del texto). \n \nTeniendo en cuenta el objetivo de determinar el estado global de la calidad del aire en el área de influencia \ndel proyecto de manera representativa y, atendiendo los criterios establecidos en el Protocolo, el Equipo \nEvaluador Ambiental considera que los ocho (8) puntos indicados en el literal c. del numeral 1 de la FICHA \nPSMA 3 del Articulo Trigésimo Cuarto de la Resolución 1885 del 25 de agosto de 2023, permiten tener una \nrepresentatividad espacial a nivel regional del estado de la calidad del aire en la zona en la cual se ubica el \nproyecto, lo cual fue evaluado con base en la información presentada por la Sociedad dentro del \ncomplemento del Estudio de Impacto Ambiental. Este aspecto evita la influencia directa de fuentes de \nemisiones cercanas como vías sin pavimentar o áreas en construcción, lo cual puede reducir el alcance \nespacial de los datos de monitoreo obtenidos. \n \n\nResolución No. 2651       Del 14 NOV. 2023          Hoja No. 36 de 108 \n \n“Por la cual se resuelve un recurso de reposición contra la Resolución 1885 del 25 de agosto de 2023” \nPágina 36 de 108 \n \nEn cuanto a los argumentos presentados por la Sociedad en los cuales indica que el monitoreo asociado \ncon las actividades del literal recurrido son de localización puntual, con fuentes de emisiones temporales y \nque las estaciones deben estar ubicadas fuera del área de influencia directa de las fuentes de emisión, el \nEquipo Evaluador Ambiental los considera apropiados, en virtud de los criterios de diseño establecidos en \nel Protocolo para el Monitoreo y Seguimiento de la Calidad del Aire. \n \nLa Sociedad indica que la perforación de un pozo tarda diez (10) días como máximo con rotación del equipo \nen campo, sustentando la ausencia de representatividad espacial y temporal en el monitoreo de calidad del \naire, el cual establece un periodo de medición de por lo menos dieciocho (18) días. Posteriormente, cita los \ncriterios para ubicar estaciones de monitoreo, mencionando la presencia de receptores sensibles, \nrepresentatividad, objetivo de las estaciones, comportamiento del viento y el modelo de dispersión de \ncontaminantes atmosféricos; este último aspecto se resalta dentro del Manual de Diseño del Protocolo, \ndonde se establece la ejecución de simulaciones de dispersión como fundamento para el diseño de los \nSistemas de Vigilancia de Calidad del Aire, lo cual se encuentra en el numeral 5.7.3 “DIAGNÓSTICO” y \n5.7.5.2. “Número de estaciones” en relación con el diseño del Sistema de Vigilancia de la Calidad del Aire \nIndustrial – SVCAI. En este sentido, dentro de la ruta “B_ANEXO ABIOTICO\\ B_5_AMBIENTALES\\ \n7_Modelac_Atmosf” del Estudio de Impacto Ambiental, la Sociedad presentó los archivos y resultados \nasociados con la ejecución del modelo de dispersión, los cuales permitieron evaluar los impactos presentes \ny proyectados en la calidad del aire, asociados a las actividades de la modificación solicitada. \n \nLos resultados de la ejecución de las simulaciones desarrolladas con este modelo mostraron que no ocurren \nexcedencias de los niveles máximos permisibles establecidos en la Resolución 2254 de 2017 del Ministerio \nde Ambiente y Desarrollo Sostenible en tiempo de exposición anual y, además, los resultados de las \ncampañas de monitoreo de calidad del aire cumplen con los niveles máximos permisibles diarios de la citada \nresolución. \n \nPor otro lado, la Sociedad expone en los argumentos que “El Sistema de Vigilancia de Calidad del Aire \nIndustrial (en adelante el “SVCAI”) definido para el proyecto cumple con los requisitos definidos en el Manual \nde Diseño del Protocolo Para El Monitoreo y Seguimiento de la Calidad del Aire” y que cuenta con \ninformación en una escala de “vecindario” a “regional” las cuales, según el Manual de Diseño del Protocolo, \nabarcan distancias entre 0,5 km y más de 20 km, lo cual pudo ser verificado por el Equipo Evaluador \nAmbiental en el diseño propuesto. Además, menciona que esta escala “… garantiza la representatividad \nespacial de los datos de tal forma que representen adecuadamente la totalidad del área de influencia del \nproyecto, situación que además garantiza que los datos no podrán ser sesgados por fenómenos puntuales \ny de corta duración los cuales pueden ser el motivo de fondo de las molestias y las preocupaciones \nexistentes en torno a la calidad del aire.” Al respecto, el Equipo Evaluador Ambiental verificó que el SVCAI \ndefinido por la Sociedad cumple con los criterios establecidos en el Protocolo, como fue evaluado en el \nConcepto Técnico 5269 del 24 de agosto de 2023, acogido por la Resolución 1885 del 25 de agosto de \n2023. \n \nEn cuanto a los niveles de ruido ambiental, en el mencionado concepto se evaluó la información de \ncaracterización de línea base presentada por la Sociedad, donde se indica que “Los resultados del \nmonitoreo de ruido evidencian en su mayoría sobrepasos a los estándares máximos permisibles a causa de \nfuentes de ruido antrópicas y naturales propias de la zona de estudio en horario diurno, y un total sobrepaso \na los niveles de ruido en horario nocturno en los 15 puntos caracterizados identificados en sector D \n(Resolución 627 de 2006), lo cual refleja un estado de ruido ya disturbado y, son niveles que deberán ser \ntenidos en cuenta por la Sociedad durante el seguimiento para evitar el aumento del ruido en la zona”. \n\nResolución No. 2651       Del 14 NOV. 2023          Hoja No. 37 de 108 \n \n“Por la cual se resuelve un recurso de reposición contra la Resolución 1885 del 25 de agosto de 2023” \nPágina 37 de 108 \n \n \nRespecto al modelo de ruido presentado, el cual complementa los resultados del monitoreo, en el mismo \nconcepto técnico se indica que “Los resultados del modelo, en relación con los mayores niveles de ruido \nobtenidos en los receptores cercanos, evidencian sobrepasos a los estándares máximos permisibles \nestablecidos en la Resolución 627 de 2006. Si bien se ha establecido una condición promedio de 59 dB en \nel día y 53 dB en la noche como condición de ruido de fondo sin la influencia de fuentes de ruido industriales, \na partir de los monitoreos de ruido ambiental o línea base, es decir, antes de las actividades objeto de la \nmodificación de licencia, vía seguimiento se deberán controlar los niveles generados en receptores \ncercanos, ya que el espectro de frecuencias de las fuentes de ruido difiere en el medio receptor”. \n \nDe acuerdo con lo anterior, es importante tener en cuenta que en la zona existen niveles de presión sonora \nde línea base asociados con el ruido de actividades antrópicas y naturales presentes actualmente, sobre lo \ncual el Equipo Evaluador Ambiental consideró importante que las actividades objeto de la modificación no \ngeneren impactos acumulativos adicionales, aspecto que fue evaluado en el Plan de Manejo Ambiental, \nficha “PMRHA-1 Manejo de fuentes de emisiones y ruido” en la cual se requirió su ajuste, en virtud del \ncumplimiento de los estándares máximos permisibles de niveles de emisión de ruido establecidos en la \nResolución 627 de 2006 del entonces Ministerio de Ambiente, Vivienda y Desarrollo Territorial, así como la \ndescripción e implementación de los sistemas de control, y establecimiento de horarios para la construcción \nde vías y plataformas. \n \nEs importante tener en cuenta que, mediante el ARTÍCULO TRIGÉSIMO CUARTO de la Resolución 1885 \ndel 25 de agosto de 2023, se establecieron 15 puntos de monitoreo de ruido ambiental, distribuidos en el \nárea de influencia del proyecto, los cuales permiten caracterizar el ambiente acústico de la zona. En este \nsentido, el Equipo Evaluador Ambiental encuentra válidos los argumentos presentados por la Sociedad y \nconsidera viable implementar modelos de ruido para determinar el impacto en operaciones puntuales con \nlos lineamientos técnicos establecidos en dicha resolución, con el objetivo de implementar medidas de \ncontrol efectivas. Garantizando la calidad de las simulaciones desarrolladas, los modelos de ruido permiten \ndeterminar de manera robusta los impactos a manera de pronóstico o diagnóstico, en una resolución \ntemporal suficiente para caracterizar la propagación sonora y la afectación sobre receptores sensibles. \n \nFinalmente, la Sociedad indica en el texto del recurso de reposición “…que para evaluar la posible afectación \na la calidad del aire y al ambiente acústico, se realizarán modelos de propagación de ruido y de dispersión \nde contaminantes atmosféricos con objetivos puntuales para proyectar la posible afectación a dichas \nmatrices por la ejecución específica de la construcción de tramos particulares de vías y plataformas nuevas.” \nAdemás, menciona que tendrá una proyección de la posible afectación para cada actividad programada, \nmedidas de control asociadas y la evidencia de su implementación, cumpliendo con los requisitos de calidad \nexigidos por la ANLA para la presente modificación. Al respecto, el Equipo Evaluador Ambiental considera \npertinente la propuesta de la Sociedad, al permitir evaluar previamente los impactos que podría presentar \ncada actividad a partir de modelos predictivos, ejecutados con criterios técnicos estandarizados que \ngaranticen la calidad de la información de entrada, acorde con la realidad de las actividades desarrolladas. \n \nSi bien los argumentos presentados por la Sociedad y el análisis realizado por parte del Equipo Evaluador \nAmbiental, en función de criterios técnicos y normativos, evidencian la inviabilidad técnica de realizar \nmonitoreos puntuales de calidad del aire y de ruido antes y durante la construcción de vías y plataformas \nnuevas, es importante considerar que no se descarta la posibilidad de ocurrencia de impactos puntuales en \nreceptores sensibles durante el desarrollo de estas actividades, y la eventual manifestación de quejas por \nparte de la comunidad. Lo anterior debe ser evaluado de forma constante, contando con el SVCAI \n\nResolución No. 2651       Del 14 NOV. 2023          Hoja No. 38 de 108 \n \n“Por la cual se resuelve un recurso de reposición contra la Resolución 1885 del 25 de agosto de 2023” \nPágina 38 de 108 \n \nrepresentativo de ocho (8) estaciones y la red de monitoreo de ruido ambiental de quince (15) puntos, que \nson fijos y están aprobados en la Resolución 1885 del 25 de agosto de 2023, junto con la posibilidad de \nevaluar los impactos a partir de modelos predictivos que derivan en medidas de control; esto último, acorde \ncon la propuesta de la Sociedad en el texto del recurso de reposición. Dependiendo de la magnitud de los \nimpactos caracterizados y evaluados con estas herramientas y la manifestación de las quejas de actores \nexternos, se pueden rediseñar los sistemas de monitoreo y realizar análisis para situaciones específicas. \n \nPor lo anterior, se resalta que en la ficha “PMRHA-1 Manejo de fuentes de emisiones y ruido” del \n“PROGRAMA DE MANEJO DE RECURSO AIRE” la Sociedad establece frente al manejo de emisiones \natmosféricas de fuentes móviles y fijas, y de los niveles de presión sonora “Mantener un seguimiento \npermanente de las quejas que interpongan los miembros de la comunidad ante la Empresa, autoridades \nambientales y entes de control, relacionados con el tema de emisiones atmosféricas”. Ante la manifestación \ncontinua de quejas asociadas con emisiones atmosféricas y sonoras, la Sociedad deberá evaluar los \nresultados del monitoreo del SVCAI, de la red de monitoreo de ruido ambiental, de las simulaciones con los \nmodelos predictivos y, en consecuencia, evaluar técnicamente la posibilidad de implementar nuevos puntos \nde monitoreo que proporcionen información técnica necesaria para evaluar la efectividad de las medidas de \nmanejo propuestas, así como la reducción de los impactos ambientales en el componente atmosférico. \n \nDe acuerdo con lo anterior, el Equipo Evaluador Ambiental recomienda revocar el literal a. del numeral 1 de \nla “FICHA PSMA 3 Emisiones atmosféricas, calidad del aire y ruido” del Artículo Trigésimo Cuarto de la \nResolución 1885 del 25 de agosto de 2023 y, en su lugar, complementar la parte final del literal c., quedando \nde la siguiente forma: \n \n“ARTÍCULO TRIGÉSIMO CUARTO: La sociedad Frontera Energy Colombia Corp. Sucursal Colombia, \ndeberá ajustar los siguientes programas y presentar los soportes de cumplimiento en un término de tres (3) \nmeses contados a partir de la firmeza del presente acto administrativo, de conformidad con las condiciones \nque se presentan a continuación: \n(…) \nFICHA PSMA 3 Emisiones atmosféricas, calidad del aire y ruido \n1. Especificar la realización de los monitoreos de calidad del aire y ruido de la siguiente forma: \nc. Durante la operación global del proyecto de manera semestral, en puntos representativos dentro del área \nde influencia considerando la ubicación de los puntos de línea base del EIA, la ubicación final de las \nplataformas, y receptores de interés. De acuerdo con lo anterior, en las siguientes tablas se indican los \npuntos, codificados por la ANLA, en los cuales se deben realizar los monitoreos de calidad del aire y de \nruido. Este código debe ser reportado dentro de las capas y tablas correspondientes del Modelo de \nAlmacenamiento Geográfico – MAG: \n(…) \nEn caso de no ejecutar los monitoreos en determinados puntos, deberá presentar la argumentación \ncorrespondiente, fundamentada en razones técnicas, logísticas, entre otras. \nAntes de la construcción de vías y plataformas nuevas, así como durante la perforación y pruebas de \nproducción de cada pozo, la Sociedad deberá realizar simulaciones con modelos de dispersión de \ncontaminantes atmosféricos y de propagación sonora cumpliendo con los lineamientos técnicos de \nejecución establecidos por la ANLA en la presente ficha, con el objetivo puntual de proyectar el futuro \n\nResolución No. 2651       Del 14 NOV. 2023          Hoja No. 39 de 108 \n \n“Por la cual se resuelve un recurso de reposición contra la Resolución 1885 del 25 de agosto de 2023” \nPágina 39 de 108 \n \nimpacto por su desarrollo, e implementar las medidas de control necesarias para reducir la potencial \nafectación sobre receptores sensibles cercanos, presentando soportes de su implementación. \nEn caso de evidenciar afectación constante sobre receptores sensibles por el desarrollo de las actividades \ndel proyecto, o la reiteración de quejas manifestadas por los miembros de la comunidad, la Sociedad deberá \nrevaluar el diseño del Sistema de Vigilancia de Calidad del Aire Industrial – SVCAI o de la red de monitoreo \nde ruido ambiental estableciendo, de ser necesario, puntos adicionales de medición, cuya ubicación debe \nestar soportada en los resultados de los modelos predictivos y, para calidad del aire, en lo establecido en el \nProtocolo para el Monitoreo y Seguimiento de la Calidad del Aire, adoptado mediante la Resolución 650 de \n2010 y ajustado por la Resolución 2154 de 2010 del entonces Ministerio de Ambiente, Vivienda y Desarrollo \nTerritorial, o aquel que lo modifique o sustituya”. \nCONSIDERACIONES JURÍDICAS \nRespecto a este punto, la Sociedad mencionó que tendrá una proyección de la posible afectación a la \ncalidad del aire y al ambiente acústico para cada actividad programada, así como las medidas de \ncontrol asociadas y su implementación, cumpliendo de esta manera con lo establecido en la \nResolución 627 de 2006, norma nacional de emisión de ruido y ruido ambiental, así mismo, en lo \nestablecido en el Protocolo para el Monitoreo y Seguimiento de la Calidad del Aire, adoptado mediante \nla Resolución 650 de 2010, ajustado por la Resolución 2154 de 2010 del entonces Ministerio de \nAmbiente, Vivienda y Desarrollo Territorial, toda vez que se permitiría evaluar previamente los \nimpactos que se llegasen a presentar. \nTambién manifestó, que fueron establecidas otras medidas de manejo relacionadas, como la Ficha \nPMRHA-1 Manejo de fuentes de emisiones y ruido, en la que se mantendría un seguimiento \npermanente de las quejas presentadas por la comunidad ante la Sociedad y entidades públicas, que \nle permita evaluar técnicamente la posibilidad de implementar nuevos puntos de monitoreo, a fin de \nverificar la efectividad de las medidas aprobadas por la Autoridad y reducir impactos ambientales. \nAl revisar dichos argumentos, la Autoridad eliminará aquellas obligaciones que pueden resultar \nredundantes y que se puede suplir con otras disposiciones contenidas dentro del mismo acto recurrido, \ncomo lo es la Ficha PMRHA-1 Manejo de fuentes de emisiones y ruido, que permitiría el seguimiento \na las quejas de la comunidad, a fin de evaluar la efectividad de las medidas implementadas en material \nde calidad del aire y ambiente acústico. \nIgualmente, esta Autoridad en ejercicio de sus funciones de protección al ambiente y en cumplimiento \nde su deber de salvaguardar el derecho a un medio ambiente sano, puede determinar o ajustar con \nmotivo del presente recurso y en una etapa posterior de seguimiento, aquellas medidas de prevención, \nmitigación, corrección y compensación por el impacto ambiental que produzca un proyecto \ndeterminado, a fin de reducir impactos ambientales. \nAsí las cosas, esta Autoridad, de conformidad con el principio de congruencia a fin de que todas las \ndisposiciones del acto administrativo guarden relación, sean concordantes y evitar inconsistencias \ndentro del mismo, y de acuerdo a lo argumentado técnicamente y a lo planteado por la sociedad, \nconsidera pertinente revocar el literal a) del numeral 1 de la FICHA PSMA 3 Emisiones atmosféricas, \npero conforme a lo planteado en el recurso, se complementará el literal c), a fin de indicar que antes \nde la construcción de vías y plataformas nuevas, así como durante la perforación y pruebas de \n\nResolución No. 2651       Del 14 NOV. 2023          Hoja No. 40 de 108 \n \n“Por la cual se resuelve un recurso de reposición contra la Resolución 1885 del 25 de agosto de 2023” \nPágina 40 de 108 \n \nproducción de cada pozo, la Sociedad deberá realizar simulaciones con modelos de dispersión de \ncontaminantes atmosféricos y de propagación sonora cumpliendo con los lineamientos técnicos de \nejecución establecidos por la ANLA en la mencionada ficha, entre otros aspectos, como quedará \nconsignado en la parte resolutiva del presente acto administrativo. \n \n6) OBLIGACIÓN RECURRIDA – LITERAL B NUMERAL 1 DE LA FICHA PSMA 3 DEL ARTÍCULO \nTRIGÉSIMO CUARTO DE LA RESOLUCIÓN 1885 DEL 25 DE AGOSTO DE 2023 \n \n“ARTÍCULO TRIGÉSIMO CUARTO: La sociedad Frontera Energy Colombia Corp. Sucursal Colombia, \ndeberá ajustar los siguientes programas y presentar los soportes de cumplimiento en un término de tres (3) \nmeses contados a partir de la firmeza del presente acto administrativo, de conformidad con las condiciones \nque se presentan a continuación: \n(…) \nFICHA PSMA 3 Emisiones atmosféricas, calidad del aire y ruido \n1. Especificar la realización de los monitoreos de calidad del aire y ruido de la siguiente forma: \nb. Durante la perforación y pruebas de producción de cada pozo  \n(…)” \nPETICIÓN DE LA SOCIEDAD  \n \n“Se solicita respetuosamente a la ANLA revocar el literal B, numeral 1 del artículo trigésimo cuarto de la \nResolución ya que, la ejecución de monitoreos de calidad de aire y ruido durante la construcción de vías y \nplataformas nuevas no es necesario para dar manejo a los posibles impactos del proyecto (sic)” \nTeniendo en cuenta que el literal b del numeral 1 de la ficha PSMA 3 del Artículo Trigésimo Cuarto de la \nResolución 1885 del 25 de agosto de 2023 no hace alusión a la construcción de vías y plataformas nuevas, \nsino a la perforación y pruebas de producción de cada pozo, se entiende, con base en los argumentos \nexpuestos, que la petición de la Sociedad hace alusión a este último aspecto. \nARGUMENTOS DE LA SOCIEDAD \n \n“De acuerdo con lo expuesto por la ANLA en la Resolución, la Compañía deberá especificar la realización \nde monitoreos de calidad de aire durante la perforación y pruebas de producción de cada pozo con el fin de \nverificar que la contaminación por material particulado no exceda los niveles permisibles de las normas \nnacionales que determinan estos estándares. Asimismo, frente a los monitoreos de ruido la Autoridad \nAmbiental considera necesario tener datos comparables durante el desarrollo del proyecto de manera \nespecífica en la zona a intervenir. \nRespecto a los argumentos entregados por la Autoridad Ambiental es necesario precisar que, las actividades \nque solicita la autoridad sean objeto de monitoreo en muchos casos tienen tiempos de ejecución entre 3 a \n5 días y por lo tanto no se podrían cumplir con los tiempos establecidos para la correcta ejecución de este. \nEn este sentido, existe la posibilidad de que algunas actividades tengan duraciones inferiores a las \nestablecidas para la ejecución de las campañas de calidad del aire, de tal forma que la información colectada \n\nResolución No. 2651       Del 14 NOV. 2023          Hoja No. 41 de 108 \n \n“Por la cual se resuelve un recurso de reposición contra la Resolución 1885 del 25 de agosto de 2023” \nPágina 41 de 108 \n \nno podrá dar información certera sobre los posibles impactos a la calidad del aire por actividades puntuales. \nAsí mimo, el hecho de realizar campañas focalizadas en actividades que cuenten con fuentes de emisión \ntemporales va en contravía de los principios definidos por el Manual de Diseño del Protocolo Para El \nMonitoreo y Seguimiento de la Calidad del Aire, en el cual, de acuerdo con los principios de \nmicrolocalización, las estaciones deben estar ubicadas fuera de la influencia directa de fuentes de emisión. \nEn el capítulo 3.2.9.2 Calidad del aire en su numeral 3.2.9.2.3 Monitoreo de calidad de aire del EIA se \nespecifica que con el objetivo de dar amplio cubrimiento al área de estudio y determinar los potenciales \nefectos que allí se presenten; se definieron ocho (8) estaciones de monitoreo dispuestas e instaladas según \nlos criterios de macro y micro localización numerales 6.3 y 6.4 expuestos en el protocolo para el Monitoreo \ny Seguimiento de la Calidad del Aire Resolución 2154 del 2 de noviembre de 2010 y el Código de Federal \nde Regulaciones de la Agencia de Protección Ambiental de los Estados Unidos (CFR 40) Parte 58, donde \nse establecen criterios de representatividad para la localización de los sitios de muestreo. Por lo cual, los \npuntos de monitoreo que hacen parte del SVCI del campo están ubicados de manera estratégica para poder \ncaracterizar no solo el área de influencia sino considerar el impacto de las diferentes actividades de \ndesarrollo a ejecutar. \nDentro de los criterios analizados por la Compañía se encuentran: \n• Centros poblados y comunidad aledaña (receptores sensibles) \n• Condiciones de Seguridad. \n• Representatividad. \n• Objetivo de estaciones. \n• Verificar dirección predominante del viento en la zona de estudio. \n• Modelo de Dispersión de contaminantes atmosféricos anteriores. \nEl SVCAI definido para el proyecto cumple con los requisitos definidos en el Manual de Diseño del Protocolo \nPara El Monitoreo Y Seguimiento De La Calidad Del Aire. En este sentido, los datos generados por dicho \nSVCAI cuentan con una escala que puede abarcar las definiciones de “vecindario” a “regional”, que \ngarantiza la representatividad espacial de los datos de tal forma que representen adecuadamente la \ntotalidad del área de influencia del proyecto, situación que además garantiza que los datos no podrán ser \nsesgados por fenómenos puntuales y de corta duración los cuales pueden ser el motivo de fondo de las \nmolestias y las preocupaciones existentes en torno a la calidad del aire. \nDe acuerdo con los resultados obtenidos en el modelo de dispersión de contaminantes atmosféricos (Anexo \nB Anexo Abiótico/ B_5_Ambientales/ 7_Modelac_Atmosf/1. Modelo de dispersión) para ninguno de los \nescenarios proyectados, las concentraciones exceden los límites normativos en las áreas del proyecto en \nlas métricas a largo plazo y por ende no se proyecta la necesidad de realizar los monitoreos con frecuencias \nmayores a las ya proyectadas. Es de aclarar que, en métricas a corto plazo los modelos indican la \nprobabilidad de incrementos de concentraciones en escalas temporales a corto plazo en localizaciones \nparticulares en las cuales no es prudente localizar estaciones de monitoreo considerando los objetivos de \nrepresentatividad espacial y temporal de los datos generados por el SVCAI. \nPara los monitoreos de ruido, si bien en algunos puntos del área se presentaron niveles superiores a los \nlímites permitidos, estos están relacionados con el ruido residual presente en el campo y relacionado con la \nfauna silvestre presente en la zona, por ende se puede identificar que le nivel de ruido ambiente típico de la \n\nResolución No. 2651       Del 14 NOV. 2023          Hoja No. 42 de 108 \n \n“Por la cual se resuelve un recurso de reposición contra la Resolución 1885 del 25 de agosto de 2023” \nPágina 42 de 108 \n \nzona puede alcanzar los 68,22 dB(A), dicho nivel de ruido es considerablemente más alto que el nivel de \nruido típico de las zonas de propagación de ruido o fuentes de emisión. \nEn el capítulo 3.2.9.3 Ruido del EIA, se puede evidenciar en los resultados el argumento anterior, y \nrelacionado con los resultados obtenidos en el modelo de ruido presentado (B_Anexo \nAbiótico/B_5_Ambientales/7_Modelac_Atmosf/2. Modelo de ruido) no se evidencia) (sic) no se plantea la \nnecesidad de frecuencias de monitoreo de ruido mayores a las que viene trabajando el campo, las cuales \nhan evidenciado ser suficientes. \nPor esta razón, el sistema propuesto de monitoreo consideró todas las actividades y su localización. El \nsistema propuesto es basto y suficiente para conocer cómo se mencionó anteriormente el posible impacto \nen la zona, aclarando nuevamente que la ubicación de las estaciones de calidad del aire del SVCAI deben \nestar ubicadas de tal forma que brinden datos con representatividad espacial del proyecto, sin que existan \ncondiciones particulares que puedan sesgar la información, de acuerdo a los principios establecidos por el \nManual de Diseño del Protocolo Para El Monitoreo y Seguimiento de la Calidad del Aire. \nDe acuerdo con los argumentos expuestos, se considera que existe sustento técnico suficiente para afirmar \nque el sistema de vigilancia y control de calidad de aire propuesto, en cuanto a la ubicación de estaciones \nde acuerdo con la malla proyectada del área de influencia, son suficientes para caracterizar las áreas donde \nse ejecuten nuevas actividades por estrategias de desarrollo y no se ve la necesidad de instalar estaciones \nlocales a dichas actividades. \nDel mismo modo, es importante considerar que, para evaluar la posible afectación a la calidad del aire y al \nambiente acústico, se realizarán modelos de propagación de ruido y de dispersión de contaminantes \natmosféricos con objetivos puntuales para proyectar la posible afectación a dichas matrices durante la \nperforación y pruebas de producción de cada pozo. En este sentido, se tendrá una proyección de posible \nafectación para cada actividad programada, unas medidas de control asociadas y la evidencia de su \nimplementación. Estos ejercicios de simulación cumplirían con los requisitos de calidad exigidos por la \nautoridad en el contexto de la presente modificación de licencia. \nDe acuerdo con lo expuesto, se solicita respetuosamente a la ANLA revocar el literal B, numeral 1 del artículo \ntrigésimo cuarto de la Resolución (…)”. \nCONSIDERACIONES TÉCNICAS DE LA ANLA \n \nLa Sociedad, dentro de sus argumentos, indica que las actividades objeto de monitoreo asociadas a la \nperforación y pruebas de producción de cada pozo tendrían una duración de 3 a 5 días, aspecto que, a \nconsideración del Equipo Evaluador Ambiental, no es representativo, en comparación con los tiempos de \nlas campañas de monitoreo de calidad del aire, teniendo en cuenta que la Tabla 20 del Manual de Diseño \ndel Protocolo para el Monitoreo y Seguimiento de la Calidad del Aire establece una toma de al menos 18 \nmuestras diarias. \n \nPor otro lado, la Sociedad indica que, según los criterios de localización, las estaciones deben estar \nubicadas fuera de la influencia directa de las fuentes de emisión, aspecto que el Equipo Evaluador Ambiental \nencuentra sustentado en el Manual de Diseño del citado Protocolo, particularmente en la Tabla 27 que \nindica, en cuanto a los criterios de macro localización, que los puntos de monitoreo serán situados, en \ngeneral, de tal manera que se evite la medición de microambientes en las inmediaciones. En este sentido, \nse consideran pertinentes los argumentos presentados en el texto del recurso de reposición. \n \n\nResolución No. 2651       Del 14 NOV. 2023          Hoja No. 43 de 108 \n \n“Por la cual se resuelve un recurso de reposición contra la Resolución 1885 del 25 de agosto de 2023” \nPágina 43 de 108 \n \nLa Sociedad menciona en este recurso de reposición que se encuentran definidas ocho (8) estaciones de \nmonitoreo de calidad del aire, ubicadas de acuerdo con los lineamientos técnicos expuestos en el Protocolo \npara el Monitoreo y Seguimiento de la Calidad del Aire, y que consideró como criterios de diseño la presencia \nde receptores sensibles, condiciones de seguridad, representatividad, los objetivos de las estaciones, el \ncomportamiento del viento y el modelo de dispersión de contaminantes atmosféricos. Sobre este último \naspecto, el mencionado Protocolo resalta el uso de modelos de dispersión para el diseño de Sistemas de \nVigilancia de Calidad del Aire Industriales – SVCAI, numeral “5.7.3. DIAGNÓSTICO”, abarcando escalas \ntemporales de vecindario a regional con un alcance de 0,5 km a 20 km, estableciendo robustez y \nrepresentatividad en el monitoreo para las actividades y ubicaciones asociadas con el trámite de \nmodificación. Según lo anterior, el Equipo Evaluador Ambiental considera válidos los argumentos \npresentados por la Sociedad, teniendo en cuenta que bajo el literal c. del numeral 1 de la “FICHA PSMA 3 \nEmisiones atmosféricas, calidad del aire y ruido” del Artículo Trigésimo Cuarto de la Resolución 1885 del 25 \nde agosto de 2023, se encuentra establecido el diseño del Sistema de Vigilancia de Calidad del Aire \nIndustrial – SVCAI del proyecto. \n \nPor otra parte, la Sociedad indica que entregó los resultados del modelo de dispersión de contaminantes \natmosféricos para las actividades objeto de la modificación, mencionando que se obtuvieron \nconcentraciones inferiores a los niveles máximos permisibles anuales establecidos en la Resolución 2254 \nde 2017 del Ministerio de Ambiente y Desarrollo Sostenible, por lo cual resalta la inviabilidad técnica de \nubicar estaciones de monitoreo puntuales durante la perforación y pruebas de producción de cada pozo, \nteniendo en cuenta los objetivos de representatividad espacial y temporal de las mediciones. \n \nEn cuanto a los niveles de ruido ambiental, en el Concepto Técnico 5269 del 24 de agosto de 2023, acogido \npor la Resolución 1885 del 25 de agosto de 2023, se evaluó la información de caracterización de línea base \npresentada por la Sociedad, donde se indica que “Los resultados del monitoreo de ruido evidencian en su \nmayoría sobrepasos a los estándares máximos permisibles a causa de fuentes de ruido antrópicas y \nnaturales propias de la zona de estudio en horario diurno, y un total sobrepaso a los niveles de ruido en \nhorario nocturno en los 15 puntos caracterizados identificados en sector D (Resolución 627 de 2006), lo cual \nrefleja un estado de ruido ya disturbado y, son niveles que deberán ser tenidos en cuenta por la Sociedad \ndurante el seguimiento para evitar el aumento del ruido en la zona”. \n \nRespecto al modelo de ruido presentado, el cual complementa los resultados del monitoreo para escenarios \nproyectados, en el mismo concepto técnico se indica que “Los resultados del modelo, en relación con los \nmayores niveles de ruido obtenidos en los receptores cercanos, evidencian sobrepasos a los estándares \nmáximos permisibles establecidos en la Resolución 627 de 2006. Si bien se ha establecido una condición \npromedio de 59 dB en el día y 53 dB en la noche como condición de ruido de fondo sin la influencia de \nfuentes de ruido industriales, a partir de los monitoreos de ruido ambiental o línea base, es decir, antes de \nlas actividades objeto de la modificación de licencia, vía seguimiento se deberán controlar los niveles \ngenerados en receptores cercanos, ya que el espectro de frecuencias de las fuentes de ruido difiere en el \nmedio receptor”. \n \nDe acuerdo con lo anterior, es importante tener en cuenta que en la zona existen niveles de presión sonora \nde línea base asociados con el ruido de actividades antrópicas y naturales presentes actualmente, sobre lo \ncual el Equipo Evaluador Ambiental consideró importante que las actividades objeto de la modificación no \ngeneren impactos acumulativos adicionales, aspecto que fue evaluado en el Plan de Manejo Ambiental, \nficha “PMRHA-1 Manejo de fuentes de emisiones y ruido” en la cual se requirió su ajuste, en virtud de los \nestándares de emisión de ruido establecidos en la Resolución 627 de 2006 del entonces Ministerio de \n\nResolución No. 2651       Del 14 NOV. 2023          Hoja No. 44 de 108 \n \n“Por la cual se resuelve un recurso de reposición contra la Resolución 1885 del 25 de agosto de 2023” \nPágina 44 de 108 \n \nAmbiente, Vivienda y Desarrollo Territorial, así como la descripción e implementación de los sistemas de \ncontrol, y horarios para la construcción de vías o plataformas. \n \nEs importante tener en cuenta que, mediante el literal c. del numeral 1 de la “FICHA PSMA 3 Emisiones \natmosféricas, calidad del aire y ruido” del ARTÍCULO TRIGÉSIMO CUARTO de la Resolución 1885 del 25 \nde agosto de 2023, se establecieron quince (15) puntos de monitoreo de ruido ambiental distribuidos en el \nárea de influencia del proyecto, los cuales permiten caracterizar el ambiente acústico de la zona. En este \nsentido, el Equipo Evaluador Ambiental encuentra válidos los argumentos presentados por la Sociedad y \nconsidera viable implementar modelos de ruido para determinar el impacto en operaciones puntuales con \nlos lineamientos técnicos establecidos en dicha resolución, con el objetivo de implementar medidas de \ncontrol efectivas. Garantizando la calidad de las simulaciones desarrolladas, los modelos de ruido permiten \ndeterminar de manera robusta los impactos a manera de pronóstico o diagnóstico, en una resolución \ntemporal suficiente para caracterizar la propagación sonora y la afectación sobre receptores sensibles. \n \nFinalmente, la Sociedad indica en el texto del recurso de reposición “…que, para evaluar la posible \nafectación a la calidad del aire y al ambiente acústico, se realizarán modelos de propagación de ruido y de \ndispersión de contaminantes atmosféricos con objetivos puntuales para proyectar la posible afectación a \ndichas matrices durante la perforación y pruebas de producción de cada pozo.” Además, menciona que \ntendrá una proyección de la posible afectación para cada actividad programada, medidas de control \nasociadas y la evidencia de su implementación, cumpliendo con los requisitos de calidad exigidos por la \nANLA para la presente modificación. Al respecto, el Equipo Evaluador Ambiental considera pertinente la \npropuesta de la Sociedad, al permitir evaluar con anterioridad los impactos ambientales que podría presentar \ncada actividad a partir de modelos predictivos, ejecutados con criterios técnicos estandarizados que \ngaranticen la calidad de la información de entrada, acorde con la realidad de las actividades desarrolladas. \n \nSi bien los argumentos presentados por la Sociedad y el análisis realizado por parte del Equipo Evaluador \nAmbiental, en función de criterios técnicos y normativos, evidencian la inviabilidad técnica de realizar \nmonitoreos puntuales de calidad del aire y de ruido durante la perforación y pruebas de producción de cada \npozo, es importante considerar que no se descarta la posibilidad de ocurrencia de impactos puntuales en \nreceptores sensibles durante el desarrollo de estas actividades, y la eventual manifestación de quejas por \nparte de la comunidad. Lo anterior debe ser evaluado de forma constante, contando con el SVCAI \nrepresentativo de ocho (8) estaciones y la red de monitoreo de ruido ambiental de quince (15) puntos, que \nson fijos y están aprobados en la Resolución 1885 del 25 de agosto de 2023, junto con la posibilidad de \nevaluar los impactos a partir de modelos predictivos que derivan en medidas de control, acorde con la \npropuesta de la Sociedad. Dependiendo de la magnitud de los impactos caracterizados y evaluados con \nestas herramientas y la manifestación de las quejas de actores externos, se pueden rediseñar los sistemas \nde monitoreo y realizar análisis para situaciones específicas. \n \nPor lo anterior, se resalta que en la ficha “PMRHA-1 Manejo de fuentes de emisiones y ruido” del \n“PROGRAMA DE MANEJO DE RECURSO AIRE” la Sociedad establece frente al manejo de emisiones \natmosféricas de fuentes móviles y fijas, y de los niveles de presión sonora “Mantener un seguimiento \npermanente de las quejas que interpongan los miembros de la comunidad ante la Empresa, autoridades \nambientales y entes de control, relacionados con el tema de emisiones atmosféricas”. Ante la manifestación \ncontinua de quejas asociadas con emisiones atmosféricas y sonoras, la Sociedad deberá evaluar los \nresultados del monitoreo del SVCAI, de la red de monitoreo de ruido ambiental, de las simulaciones con los \nmodelos predictivos y, en consecuencia, evaluar técnicamente la posibilidad de implementar nuevos puntos \n\nResolución No. 2651       Del 14 NOV. 2023          Hoja No. 45 de 108 \n \n“Por la cual se resuelve un recurso de reposición contra la Resolución 1885 del 25 de agosto de 2023” \nPágina 45 de 108 \n \nde monitoreo que proporcionen información técnica necesaria para evaluar la efectividad de las medidas de \nmanejo propuestas, así como la reducción de los impactos ambientales en el componente atmosférico. \n \nDe acuerdo con lo anterior, el Equipo Evaluador Ambiental recomienda revocar el literal b. del numeral 1 de \nla “FICHA PSMA 3 Emisiones atmosféricas, calidad del aire y ruido” del Artículo Trigésimo Cuarto de la \nResolución 1885 del 25 de agosto de 2023 y, en su lugar, complementar la parte final del literal c., quedando \nde la siguiente forma: \n \n“ARTÍCULO TRIGÉSIMO CUARTO: La sociedad Frontera Energy Colombia Corp. Sucursal Colombia, \ndeberá ajustar los siguientes programas y presentar los soportes de cumplimiento en un término de tres (3) \nmeses contados a partir de la firmeza del presente acto administrativo, de conformidad con las condiciones \nque se presentan a continuación: \n(…) \nFICHA PSMA 3 Emisiones atmosféricas, calidad del aire y ruido \n1. Especificar la realización de los monitoreos de calidad del aire y ruido de la siguiente forma: \nc. Durante la operación global del proyecto de manera semestral, en puntos representativos dentro del área \nde influencia considerando la ubicación de los puntos de línea base del EIA, la ubicación final de las \nplataformas, y receptores de interés. De acuerdo con lo anterior, en las siguientes tablas se indican los \npuntos, codificados por la ANLA, en los cuales se deben realizar los monitoreos de calidad del aire y de \nruido. Este código debe ser reportado dentro de las capas y tablas correspondientes del Modelo de \nAlmacenamiento Geográfico – MAG: \n(…) \nEn caso de no ejecutar los monitoreos en determinados puntos, deberá presentar la argumentación \ncorrespondiente, fundamentada en razones técnicas, logísticas, entre otras. \nAntes de la construcción de vías y plataformas nuevas, así como durante la perforación y pruebas de \nproducción de cada pozo, la Sociedad deberá realizar simulaciones con modelos de dispersión de \ncontaminantes atmosféricos y de propagación sonora cumpliendo con los lineamientos técnicos de \nejecución establecidos por la ANLA en la presente ficha, con el objetivo puntual de proyectar el futuro \nimpacto por su desarrollo, e implementar las medidas de control necesarias para reducir la potencial \nafectación sobre receptores sensibles cercanos, presentando soportes de su implementación. \nEn caso de evidenciar afectación constante sobre receptores sensibles por el desarrollo de las actividades \ndel proyecto, o la reiteración de quejas manifestadas por los miembros de la comunidad, la Sociedad deberá \nrevaluar el diseño del Sistema de Vigilancia de Calidad del Aire Industrial – SVCAI o de la red de monitoreo \nde ruido ambiental estableciendo, de ser necesario, puntos adicionales de medición, cuya ubicación debe \nestar soportada en los resultados de los modelos predictivos y, para calidad del aire, en lo establecido en el \nProtocolo para el Monitoreo y Seguimiento de la Calidad del Aire, adoptado mediante la Resolución 650 de \n2010 y ajustado por la Resolución 2154 de 2010 del entonces Ministerio de Ambiente, Vivienda y Desarrollo \nTerritorial, o aquel que lo modifique o sustituya”. \nCONSIDERACIONES JURÍDICAS \nEn relación con los argumentos expresados por la sociedad, entre otros, que para evaluar la posible \nafectación a la calidad del aire y al ambiente acústico, se realizarán modelos de propagación de ruido \n\nResolución No. 2651       Del 14 NOV. 2023          Hoja No. 46 de 108 \n \n“Por la cual se resuelve un recurso de reposición contra la Resolución 1885 del 25 de agosto de 2023” \nPágina 46 de 108 \n \ny de dispersión de contaminantes atmosféricos con objetivos puntuales para proyectar la posible \nafectación a dichas matrices durante la perforación y pruebas de producción de cada pozo, a fin de \ntener una proyección de posible afectación para cada actividad programada, unas medidas de control \nasociadas y la evidencia de su implementación. La Autoridad considera que se cumple con lo \nestablecido en la Resolución 627 de 2006, relativa a emisión de ruido y ruido ambiental, así mismo, \nen lo establecido en el Protocolo para el Monitoreo y Seguimiento de la Calidad del Aire, adoptado \nmediante la Resolución 650 de 2010 y ajustado por la Resolución 2154 de 2010 del entonces Ministerio \nde Ambiente, Vivienda y Desarrollo Territorial, toda vez que se permitiría evaluar previamente los \nimpactos que se llegasen a presentar. \nEn ese sentido, se reitera el argumento desarrollado en el numeral anterior (5), frente a que dentro del \nPMA aprobado, se encuentra la Ficha PMRHA-1 Manejo de fuentes de emisiones y ruido, que \npermitiría el seguimiento a las quejas de la comunidad, a fin de evaluar la efectividad de las medidas \nimplementadas en material de calidad del aire y ambiente acústico. \nAsí mismo, se reitera el argumento de la posibilidad que tiene esta Autoridad, en ejercicio de sus \nfunciones de protección al ambiente y en cumplimiento de su deber de salvaguardar el derecho a un \nambiente sano, de determinar o ajustar con motivo del presente recurso y en una etapa posterior de \nseguimiento, aquellas medidas de prevención, mitigación, corrección y compensación por el impacto \nambiental que produzca un proyecto determinado, a fin de reducir impactos ambientales. \nEn vista de lo precedente, esta Autoridad, de acuerdo a lo expuesto técnicamente y conforme al \nejercicio de las funciones de protección al medio ambiente, considera pertinente revocar el literal b) \ndel numeral 1 de la “FICHA PSMA 3 Emisiones atmosféricas, calidad del aire y ruido” del artículo \ntrigésimo cuarto y con ocasión de lo argumentado por la Sociedad, complementará el literal c del \nmismo numeral, como ya quedó consignado en el análisis del punto 5. \n \n7) OBLIGACION RECURRIDA – LITERAL C NUMERAL 1 DEL ARTICULO TRIGÉSIMO CUARTO \n– FICHA PSMA3 DE LA RESOLUCIÓN 1885 DEL 25 DE AGOSTO DE 2023 \n \n“ARTÍCULO TRIGÉSIMO CUARTO: La sociedad Frontera Energy Colombia Corp. Sucursal Colombia, \ndeberá ajustar los siguientes programas y presentar los soportes de cumplimiento en un término de tres (3) \nmeses contados a partir de la firmeza del presente acto administrativo, de conformidad con las condiciones \nque se presentan a continuación: \n(…) \nFICHA PSMA 3 Emisiones atmosféricas, calidad del aire y ruido \n1. Especificar la realización de los monitoreos de calidad del aire y ruido de la siguiente forma: \nc. Durante la operación global del proyecto de manera semestral, en puntos representativos dentro del área \nde influencia considerando la ubicación de los puntos de línea base del EIA, la ubicación final de las \nplataformas, y receptores de interés…” \nPETICIÓN DE LA SOCIEDAD  \n\nResolución No. 2651       Del 14 NOV. 2023          Hoja No. 47 de 108 \n \n“Por la cual se resuelve un recurso de reposición contra la Resolución 1885 del 25 de agosto de 2023” \nPágina 47 de 108 \n \n \n“Se solicita respetuosamente a la ANLA, modificar el literal C, numeral 1 del artículo trigésimo cuarto de la \nResolución, estableciendo una frecuencia anual de monitoreo de calidad de aire y ruido durante las \nactividades globales del proyecto”. \nARGUMENTOS DE LA SOCIEDAD \n \n“La autoridad presenta en la Página 213 de la parte considerativa del acto administrativo, la “Tabla 37. \nConsideraciones de las Ponencias presentadas en la APA del proyecto Área de Explotación Quifa”, respecto \nal componente atmosfera (Ruido-Aire) presenta los siguientes argumentos: \n“(…) 3 y 4 Como respuesta a las preocupaciones dadas sobre el seguimiento de la emisión de material \nparticulado y de gases nocivos emitidos a la atmósfera y la implementación de medidas eficaces orientadas \na su control, generados por las obras y actividades del proyecto. Se identifica que existen obligaciones para \nla mitigación y control de estos contaminantes, ubicados en el capítulo 13 Consideraciones Sobre los Planes \ny Programas del presente concepto, específicamente en la ficha de seguimiento PSMA 3 Emisiones \nAtmosféricas, Calidad del Aire y Ruido, de las cuales se resalta. \n(…) \n• Respecto del impacto por calidad del aire que vincula el material particulado y gases contaminantes, se \nimpuso dentro de las medidas de seguimiento un sistema de vigilancia de la calidad del aire industrial \n(SVCAI) con 8 estaciones de monitoreo en puntos representativos dentro del área de influencia \nconsiderando la ubicación de los puntos de línea base del EIA, la ubicación final de las plataformas, y \nreceptores de interés. Este sistema deberá realizar mediciones semestrales que le permita a esta Autoridad \nevidenciar el comportamiento de la calidad del aire. \n(…) \nPor lo antes descrito, se considera que las medidas de seguimiento de la calidad del aire, en lo relacionado \nal seguimiento y control de la emisión de material particulado y gases contaminantes a la atmósfera, se \nencuentran contemplados por esta Autoridad.” \nDel mismo modo en el concepto técnico 5269 de 24 de agosto de 2023, el equipo evaluador de la ANLA \nargumentó lo siguiente: \n“Acción 2 Seguimiento a la tendencia del medio en Calidad de Aire \n(…) \nLa periodicidad del monitoreo de calidad del aire se establece de forma semestral en 8 estaciones, pero no \nse especifican monitoreos puntuales para actividades de construcción de las plataformas o locaciones y de \nlas actividades de perforación de cada pozo. \n(…) \nAcción 3 Manejo de los niveles de presión sonora (…) \nLa frecuencia de los monitoreos se establece semestral sin diferenciar monitoreos particulares durante \nactividades de perforación o construcción. (“…). \nRespecto a los argumentos entregados por la Autoridad Ambiental, se precisa que, de acuerdo con los \nhistóricos de monitoreo de calidad de aire, presentados a través de los Informes de Cumplimiento Ambiental \n\nResolución No. 2651       Del 14 NOV. 2023          Hoja No. 48 de 108 \n \n“Por la cual se resuelve un recurso de reposición contra la Resolución 1885 del 25 de agosto de 2023” \nPágina 48 de 108 \n \nde los campos, se puede evidenciar que en ninguno de los puntos monitoreados se sobrepasa el límite \nnormativo a largo plazo (Resolución 2254 de 2017 del MADS) y que se relaciona con riesgo a la salud \nhumana. De acuerdo con esto, no se evidencia una condición por la que se requiera un aumento en la \nfrecuencia de monitoreo. \nAsí mismo, los datos obtenidos diariamente no sobrepasan los límites establecidos por la normatividad \n(Resolución 2254 de 2017 del MADS) a corto plazo, de tal forma que no se han evidenciado eventos de \ncontaminación atmosférica que permitan inferir condiciones de incumplimiento. En este sentido los estudios \nhistóricos en general permiten definir calidades del aire calificadas de buenas a aceptables de acuerdo con \nla escala definidas por los ICA (Índices de contaminación atmosférica) definidos por la citada norma. Así las \ncosas, los estudios realizados no permiten definir fuentes de contaminación atmosférica en el área de \ninfluencia del proyecto razón por la cual no se justifica intensificar campañas de medición. \nEn relación al monitoreo de calidad de aire realizado en el marco del EIA para la modificación de licencia y \npresentado a la autoridad por medio de la comunicación 2022283750-1-000 del 16 de diciembre de 2022, \nradicado VITAL 3500830126302222050, en el capítulo 3.2.9.2, numeral 3.2.9.2.3.1 Resultados Monitoreo \nCalidad de Aire se puede evidenciar que para la época de monitoreo ninguno de los parámetros evaluados \nsobrepasan la norma y por lo tanto no se evidencia la necesidad de una frecuencia mayor de monitoreo a \nla ya trabajada en el campo. En este sentido, igual que lo sugieren los históricos de calidad del aire, no \nexisten indicios de potenciales áreas fuentes de contaminación ni de la presencia de condiciones de calidad \ndel aire calificables ni siquiera con la escala ICA “dañinas para la salud de grupos sensibles”, razón por la \ncual, se considera que no es necesario intensificar los esfuerzos en términos de medición. \nEl SVCAI definido para el proyecto cumple con los requisitos definidos en el Manual de Diseño del Protocolo \nPara El Monitoreo Y Seguimiento De La Calidad Del Aire. En este sentido, los datos generados por dicho \nSVCAI cuentan con una escala que puede abarcar las definiciones de “vecindario” a “regional”, que \ngarantiza la representatividad espacial de los datos de tal forma que representen en buena manera la \ntotalidad del área de influencia del proyecto, situación que además garantiza que los datos no podrán ser \nsesgados por fenómenos puntuales y de corta duración los cuales pueden ser el motivo de fondo de las \nmolestias y las preocupaciones existentes en torno a la calidad del aire. \nDe acuerdo con los resultados obtenidos en el modelo de dispersión de contaminantes atmosféricos (Anexo \nB Anexo Abiótico/ B_5_Ambientales/ 7_Modelac_Atmosf/1. Modelo de dispersión) para ninguno de los \nescenarios proyectados, las concentraciones exceden los límites normativos en las áreas del proyecto en \nlas métricas a largo plazo y por ende no se proyecta la necesidad de realizar los monitoreos con frecuencias \nmayores a las ya proyectadas. Es de aclarar que, en métricas a corto plazo, los modelos indican la \nprobabilidad de incrementos de concentraciones en escalas temporales a corto plazo en localizaciones \nparticulares en las cuales no es prudente localizar estaciones de monitoreo considerando los objetivos de \nrepresentatividad espacial y temporal de los datos generados por el SVCAI. \nPara los monitoreos de ruido, si bien en algunos puntos del área se presentaron niveles superiores a los \nlímites permitidos, estos están relacionados con el ruido residual presente en el campo y relacionado con la \nfauna silvestre presente en la zona, por ende se puede identificar que el nivel de ruido ambiente típico de la \nzona puede alcanzar los 68,22 dB(A), dicho nivel de ruido es considerablemente más alto que el nivel de \nruido típico de las zonas de propagación de ruido o fuentes de emisión. \nDel capítulo 3.2.9.3 Ruido del EIA se puede evidenciar en los resultados el argumento expuesto por la \nCompañía, y relacionado con los resultados obtenidos en el modelo de ruido presentado (B_Anexo \n\nResolución No. 2651       Del 14 NOV. 2023          Hoja No. 49 de 108 \n \n“Por la cual se resuelve un recurso de reposición contra la Resolución 1885 del 25 de agosto de 2023” \nPágina 49 de 108 \n \nAbiótico/B_5_Ambientales/7_Modelac_Atmosf/2. Modelo de ruido) no se evidencia la necesidad de \nfrecuencias de monitoreo de ruido mayores a las que viene trabajando el campo. \nDe acuerdo con lo anterior, se considera que existe sustento técnico suficiente para afirmar que la frecuencia \nde monitoreo durante la operación global del proyecto puede ser anual y no hay alertas tempranas para \naumentar la misma, ya que las condiciones de calidad de aire y ruido de acuerdo con los monitoreos se \nencuentra inferior al límite impuesto por la norma. Por lo anterior, se solicita respetuosamente a la ANLA, \nmodificar el literal C, numeral 1 del artículo trigésimo cuarto de la Resolución, estableciendo una frecuencia \nanual de monitoreo de calidad de aire y ruido durante las actividades globales del proyecto”. \nCONSIDERACIONES TÉCNICAS DE LA ANLA \n \nCon el fin de argumentar la realización de monitoreos con una frecuencia anual, la Sociedad indica que, \nconforme a los resultados de los monitoreos históricos de calidad del aire presentados en los Informes de \nCumplimiento Ambiental, así como en el complemento del Estudio de Impacto Ambiental, radicado ANLA \n2022283750-1-000 del 16 de diciembre de 2022, no se han superado los niveles máximos permisibles \nestablecidos en la Resolución 2254 de 2017 del Ministerio de Ambiente y Desarrollo Sostenible, y que se \nhan obtenidos Índices de Calidad del Aire – ICA enmarcados principalmente en las categorías de “buena” y \n“aceptable”.  \nPor otro lado, indica que el Sistema de Vigilancia de Calidad del Aire Industrial – SVCAI definido para el \nproyecto cumple con los criterios técnicos establecidos en el Protocolo para el Monitoreo y Seguimiento de \nla Calidad del Aire con escalas de vecindario a regional, garantizando la representatividad espacial de los \ndatos. Además, menciona que los resultados de las simulaciones realizadas con el modelo de dispersión \ncumplen, en términos anuales, con los niveles máximos permisibles correspondientes establecidos en la \nResolución 2254 de 2017 del Ministerio de Ambiente y Desarrollo Sostenible. \nEn relación con los niveles de ruido ambiental, la Sociedad indica que los niveles relativamente altos que \nfueron identificados corresponden al ruido residual y a la influencia de la fauna silvestre, y que los resultados \ndel modelo de ruido no evidencian la necesidad de realizar el monitoreo con frecuencias de monitoreo \nmayores. \nRespecto a lo anterior, el Equipo Evaluador Ambiental procedió a verificar el complemento del Estudio de \nImpacto Ambiental presentado mediante radicado ANLA 2022283750-1-000 del 16 de diciembre de 2022, \nen el Capítulo “8. PROGRAMA DE SEGUIMIENTO Y MONITOREO DEL PROYECTO”, ficha “PSMA 3 \nEMISIONES ATMOSFÉRICAS, CALIDAD DEL AIRE Y RUIDO” encontrando, respecto a la “ACCIÓN 3: \nManejo de los niveles de presión sonora”, sección “Monitoreos de ruido ambiental”, lo siguiente: \n“Se realizará monitoreo de emisión de ruido continuamente durante las actividades de construcción, \nperforación y pruebas de producción, en diferentes zonas aledañas a los pozos a los equipos que se \ndeterminen necesario, en especial si se encuentran cercanas a asentamientos humanos o centros poblados. \nSe efectuarán como mínimo cada 6 meses para realizar la evaluación al medio”. (subrayado fuera del texto) \nDe manera que, conforme al texto anterior, citado del complemento del Estudio de Impacto Ambiental, la \nSociedad propuso la frecuencia semestral para los monitoreos de emisión de ruido y, en el mismo sentido, \nen la sección correspondiente a los “INDICADORES DE SEGUIMIENTO Y MONITOREO”, planteó una \nfrecuencia semestral para las medidas “Monitoreo de calidad del aire” y “Cumplimiento calidad del aire” de \nla “ACCIÓN 2. Seguimiento a la tendencia del medio Calidad de aire”, así como de las medidas “Monitoreo \nde ruido ambiental” y “Cumplimiento de ruido ambiental” de la “ACCIÓN 3: Manejo de los niveles de presión \nsonora”. \n\nResolución No. 2651       Del 14 NOV. 2023          Hoja No. 50 de 108 \n \n“Por la cual se resuelve un recurso de reposición contra la Resolución 1885 del 25 de agosto de 2023” \nPágina 50 de 108 \n \nDe acuerdo con lo expuesto, es claro que la Sociedad, en la información técnica que sustenta su solicitud \nde modificación de la Licencia Ambiental contenida en el complemento del Estudio de Impacto Ambiental, \nfue quien planteó la realización de monitoreos semestrales de calidad del aire y de ruido ambiental, lo cual \nfue resaltado en el Concepto Técnico 5269 del 24 de agosto de 2023, acogido por la Resolución 1885 del \n25 de agosto de 2023, siendo entonces una propuesta acogida, en el marco de la evaluación ambiental, \nconforme a la solicitud debidamente motivada. \nPor otro lado, es importante resaltar que el Manual de Diseño del Protocolo para el Monitoreo y Seguimiento \nde la Calidad del Aire, adoptado mediante la Resolución 650 de 2010 y ajustado por la Resolución 2154 de \n2010 del entonces Ministerio de Ambiente, Vivienda y Desarrollo Territorial establece en la “Tabla 20. \nDescripción SVCAI indicativo” que la periodicidad del monitoreo se realizará mínimo anualmente, lo cual \nimplica que es posible llevar a cabo el monitoreo con una frecuencia mayor como, por ejemplo, semestral, \natendiendo los criterios técnicos de la autoridad ambiental. Lo anterior, se sustenta en que, mediante el \nArtículo Décimo Cuarto de la Resolución 1885 del 25 de agosto de 2023, al permiso de emisiones \natmosféricas se le adicionan fuentes fijas puntuales como generadores, bombas, y equipos asociados con \nla evaporación por inducción, así como fuentes fijas dispersas y fuentes móviles, las cuales son generadoras \nde contaminantes atmosféricos y, por su cantidad e intensidad de emisiones, requieren un seguimiento \nrespecto a la alteración de la calidad del aire con una frecuencia superior a la mínima requerida, con el \nobjetivo de contar con información que permita verificar los resultados asociados con los escenarios \nproyectados en el modelo de dispersión de contaminantes atmosféricos, verificar el cambio respecto a la \nlínea base presentada en el complemento del Estudio de Impacto Ambiental y evaluar la efectividad de las \nmedidas de manejo propuestas. \nDe la misma manera, en cuanto a las emisiones sonoras, teniendo en cuenta que las fuentes asociadas al \ntrámite de modificación tienen el potencial de generar impactos acumulativos sobre los niveles actuales y, \nconsiderando que los resultados de los monitoreos de ruido ambiental muestran niveles por superiores a \nlos estándares máximos permisibles de ruido ambiental de la Resolución 627 de 2006 del entonces \nMinisterio de Ambiente, Vivienda y Desarrollo Territorial, para el Sector D, se considera necesario mantener \nuna frecuencia de monitoreo semestral, de manera que se cuente con mayor información que permita \nrealizar un análisis tendencial y verificar los resultados del modelo de ruido en el escenario proyectado, así \ncomo las medidas de manejo correspondientes. \nConsiderando que el recurso de reposición y su análisis se relacionan con lo establecido en la Resolución \n1885 del 25 de agosto de 2023 y en el complemento del Estudio de Impacto Ambiental, radicado ANLA \n2022283750-1-000 del 16 de diciembre de 2022, el Equipo Evaluador Ambiental recomienda no acceder a \nla solicitud de la Sociedad de establecer una frecuencia anual de monitoreo de calidad de aire y ruido durante \nlas actividades globales del proyecto, en lugar de semestral y, en consecuencia, no modificar en cuanto a \nfrecuencia el literal c. del numeral 1 de la “FICHA PSMA 3 Emisiones atmosféricas, calidad del aire y ruido” \ndel Artículo Trigésimo Cuarto de la Resolución 1885 del 25 de agosto de 2023. \nCONSIDERACIONES JURÍDICAS \nFrente al argumento de la sociedad de modificar el literal c del numeral 1 de la FICHA PSMA 3 \nEmisiones atmosféricas, calidad del aire y ruido, del artículo trigésimo cuarto, para que se establezca \nuna frecuencia anual de monitoreo durante las obligaciones globales del proyecto, y no semestral \ncomo quedó señalado, argumentando entre otros aspectos, que los datos históricos de calidad del \naire no demuestran indicios de potenciales áreas fuentes de contaminación ni condiciones propicias \npara esto, encuentra la Autoridad al evaluarse el complemento del Estudio de Impacto Ambiental que \n\nResolución No. 2651       Del 14 NOV. 2023          Hoja No. 51 de 108 \n \n“Por la cual se resuelve un recurso de reposición contra la Resolución 1885 del 25 de agosto de 2023” \nPágina 51 de 108 \n \nfue la Sociedad quien estableció inicialmente una frecuencia semestral y en esa línea se evaluó la \nsolicitud de modificación. \nPor lo cual, en virtud de que los trámites administrativos son rogados, esta Autoridad Nacional, se \npronunció según lo solicitado por la Sociedad, sin embargo al evaluar la frecuencia establecida en la \nresolución recurrida, se encuentra que se considera necesario mantenerla de manera semestral, para \ncontar con mayor información que permita realizar un análisis tendencial y verificar los resultados del \nmodelo de ruido en el escenario proyectado, así como las medidas de manejo correspondientes, \nsiendo acorde a las características presentadas en el complemento del EIA, para la modificación del \nproyecto. Adicionalmente, de acuerdo al argumento técnico expuesto, el Manual de Diseño del \nProtocolo para el Monitoreo y Seguimiento de la Calidad del Aire, establece una periodicidad de \nmonitoreo mínima de un año, lo que significa que puede ser con una frecuencia mayor, esto es, \nsemestral como lo fue en este caso, teniendo en cuenta que el escenario actual de ruido sobrepasa \nlos niveles permisibles señalados en la Resolución 627 de 2006 del entonces Ministerio de Ambiente, \nVivienda y Desarrollo Territorial. \nEn ese sentido, no se modifica la frecuencia semestral establecida en dicho literal c y en su lugar se \nconfirma, como quedará señalado en el presente acto administrativo. \n8) OBLIGACION RECURRIDA – LITERAL D DEL NUMERAL 1 DE LA FICHA PSMA 3 DEL \nARTICULO TRIGÉSIMO CUARTO DE LA RESOLUCIÓN 1885 DEL 25 DE AGOSTO DE 2023 \n \n“ARTÍCULO TRIGÉSIMO CUARTO: La sociedad Frontera Energy Colombia Corp. Sucursal Colombia, \ndeberá ajustar los siguientes programas y presentar los soportes de cumplimiento en un término de tres (3) \nmeses contados a partir de la firmeza del presente acto administrativo, de conformidad con las condiciones \nque se presentan a continuación: \n(…) \nFICHA PSMA 3 Emisiones atmosféricas, calidad del aire y ruido \n1. Especificar la realización de los monitoreos de calidad del aire y ruido de la siguiente forma: \nd. Antes y durante la operación de las áreas de evaporación, durante la operación la periodicidad será \nsemestral. \n(…)” \nPETICIÓN DE LA SOCIEDAD  \n \n“Se solicita respetuosamente a esta autoridad ambiental revocar el literal d, numeral 1 del artículo trigésimo \ncuarto de la Resolución.” \nARGUMENTOS DE LA SOCIEDAD \n \n“El capítulo 3.2.9.2 Calidad del aire en su numeral 3.2.9.2.3 Monitoreo de calidad de aire especifica que con \nel objetivo de dar amplio cubrimiento al área de estudio y determinar los potenciales efectos que allí se \npresenten; se definieron ocho (8) estaciones de monitoreo dispuestas e instaladas según los criterios de \nmacro y micro localización numerales 6.3 y 6.4 expuestos en el protocolo para el Monitoreo y Seguimiento \n\nResolución No. 2651       Del 14 NOV. 2023          Hoja No. 52 de 108 \n \n“Por la cual se resuelve un recurso de reposición contra la Resolución 1885 del 25 de agosto de 2023” \nPágina 52 de 108 \n \nde la Calidad del Aire Resolución 2154 del 2 de noviembre de 2010 y el Código de Federal de Regulaciones \nde la Agencia de Protección Ambiental de los Estados Unidos (CFR 40) Parte 58, donde se establecen \ncriterios de representatividad para la localización de los sitios de muestreo. Por lo cual, los puntos de \nmonitoreo que hacen parte del SVCI del campo están ubicados de manera estratégica para poder \ncaracterizar no solo el área de influencia sino considerar el impacto de las diferentes actividades de \ndesarrollo a ejecutar. \nDentro de los criterios considerados por la Compañía se encuentran: \n• Centros poblados y comunidad aledaña (receptores sensibles) \n• Condiciones de Seguridad. \n• Representatividad. \n• Objetivo de estaciones. \n• Verificar dirección predominante del viento en la zona de estudio. \nModelo de Dispersión de contaminantes atmosféricos anteriores. \nEl SVCAI definido para el proyecto cumple con los requisitos establecidos en el Manual de Diseño del \nProtocolo Para El Monitoreo Y Seguimiento De La Calidad Del Aire. En este sentido, los datos generados \npor dicho SVCAI cuentan con una escala que puede abarcar las definiciones de “vecindario” a “regional”, \nque garantiza la representatividad espacial de los datos de tal forma que representen en buena manera la \ntotalidad del área de influencia del proyecto, situación que además garantiza que los datos no podrán ser \nsesgados por fenómenos puntuales y de corta duración los cuales pueden ser el motivo de fondo de las \nmolestias y las preocupaciones existentes en torno a la calidad del aire. \nDe acuerdo con los resultados obtenidos en el modelo de dispersión de contaminantes atmosféricos donde \nse considera la ejecución de dicha actividad (Anexo B Anexo Abiótico/ B_5_Ambientales/ \n7_Modelac_Atmosf/1. Modelo de dispersión) para ninguno de los escenarios proyectados, las \nconcentraciones exceden los límites normativos en las áreas del proyecto en las métricas a largo plazo y \npor ende no se proyecta la necesidad de realizar los monitoreos con frecuencias mayores a las ya \nproyectadas. Es de aclarar que, en métricas a corto plazo, los modelos indican la probabilidad de \nincrementos de concentraciones en escalas temporales a corto plazo en localizaciones particulares en las \ncuales no es prudente localizar estaciones de monitoreo considerando los objetivos de representatividad \nespacial y temporal de los datos generados por el SVCAI. \nPara los monitoreos de ruido, si bien en algunos puntos del área se presentaron niveles superiores a los \nlímites permitidos, estos están relacionados con el ruido residual presente en el campo y relacionado con la \nfauna silvestre presente en la zona, por ende se puede identificar que el nivel de ruido ambiente típico de la \nzona puede alcanzar los 68,22 dB(A), dicho nivel de ruido es considerablemente más alto que el nivel de \nruido típico de las zonas de propagación de ruido o fuentes de emisión. \nEs por esta razón, que de acuerdo con el capítulo 3.2.9.3 Ruido del EIA entregado a esta autoridad se puede \nevidenciar en los resultados el argumento anterior, y relacionado con los resultados obtenidos en el modelo \nde ruido presentado (B_Anexo Abiótico/B_5_Ambientales/7_Modelac_Atmosf/2. Modelo de ruido) no se \nevidencia la necesidad de modificar las frecuencias de monitoreo de ruido incrementando las que vienen \nrealizándose en el campo. \n\nResolución No. 2651       Del 14 NOV. 2023          Hoja No. 53 de 108 \n \n“Por la cual se resuelve un recurso de reposición contra la Resolución 1885 del 25 de agosto de 2023” \nPágina 53 de 108 \n \nEl sistema propuesto de monitoreo consideró todas las actividades y su localización; es considerado basto \ny suficiente para conocer el posible impacto en la zona, aclarando nuevamente que la ubicación de las \nestaciones de calidad del aire del SVCAI deben estar ubicadas de tal forma que brinden datos con \nrepresentatividad espacial del proyecto, sin que existan condiciones particulares que puedan sesgar la \ninformación, de acuerdo a los principios establecidos por el Manual de Diseño del Protocolo Para El \nMonitoreo y Seguimiento de la Calidad del Aire. \nDe acuerdo a los argumentos anteriores se considera que existe sustento técnico suficiente para afirmar \nque el sistema de vigilancia y control de calidad de aire propuesto, en cuanto a la ubicación de estaciones \nde acuerdo a la malla proyectada del área de influencia, son suficientes para caracterizar las áreas donde \nse ejecuten nuevas actividades por estrategias de desarrollo y no se ve la necesidad de instalar estaciones \nlocales a dichas actividades y que puedan cumplir con localización y temporalidad para ser representativas. \nDel mismo modo, es importante considerar que, para evaluar la posible afectación a la calidad del aire y al \nambiente acústico, se realizarán modelos de propagación de ruido y de dispersión de contaminantes \natmosféricos con objetivos puntuales de proyectar la afectación a dichas matrices antes y durante la \noperación de las áreas de evaporación. En este sentido, se tendrá una proyección de afectaciones para \ncada actividad programada, unas medidas de control asociadas y la evidencia de su implementación. Estos \nejercicios de simulación cumplirían con los requisitos de calidad exigidos por la autoridad en el contexto de \nla presente modificación de licencia. \nDe acuerdo con lo expuesto, se solicita respetuosamente a esta autoridad ambiental revocar el literal d, \nnumeral 1 del artículo trigésimo cuarto de la Resolución”. \nCONSIDERACIONES TÉCNICAS DE LA ANLA \n \nDentro de los argumentos presentados por la Sociedad, se indica que el Sistema de Vigilancia de la Calidad \ndel Aire – SVCAI cuenta con ocho (8) estaciones de monitoreo, ubicadas de acuerdo con los criterios \nestablecidos en el Protocolo para el Monitoreo y Seguimiento de la Calidad del Aire, adoptado mediante la \nResolución 650 de 2010 y ajustado por la Resolución 2154 de 2010 del entonces Ministerio de Ambiente, \nVivienda y Desarrollo Territorial. Además, cita como criterios de diseño aspectos como la cercanía a \nreceptores sensibles, condiciones de seguridad, representatividad, objetivo de las estaciones, el \ncomportamiento de los vientos y los resultados de las simulaciones realizadas con el modelo de dispersión \nde contaminantes atmosféricos, y argumenta que este SVCAI cuenta con representatividad espacial que \nabarca escalas de “vecindario” a “regional”, argumentando su suficiencia en el contexto del trámite de \nmodificación y que los resultados no están sesgados por fenómenos puntuales y de corta duración. \n \nPor otro lado, la Sociedad indica que los resultados de las simulaciones con el modelo de dispersión no \nsuperan los niveles máximos permisibles establecidos en la Resolución 2254 de 2017 del Ministerio de \nAmbiente y Desarrollo Sostenible en términos anuales, y que los niveles de ruido ambiental en línea base \nson relativamente altos, atribuyendo como causas los niveles de ruido residual y la fauna silvestre presente \nen la zona, y además, menciona los resultados obtenidos del modelo de ruido, refiriendo las frecuencias de \nmonitoreo. \n \nLos argumentos anteriores se usan como sustento por la Sociedad para indicar que no es necesario instalar \nestaciones para monitoreo en una escala puntual y, en tal sentido, aclara que “…se realizarán modelos de \npropagación de ruido y de dispersión de contaminantes atmosféricos con objetivos puntuales de proyectar \nla afectación a dichas matrices antes y durante la operación de las áreas de evaporación…” para evaluar \n\nResolución No. 2651       Del 14 NOV. 2023          Hoja No. 54 de 108 \n \n“Por la cual se resuelve un recurso de reposición contra la Resolución 1885 del 25 de agosto de 2023” \nPágina 54 de 108 \n \nlos impactos y establecer medidas de control asociadas, cumpliendo con los lineamientos técnicos \nestablecidos en la Resolución 1885 del 25 de agosto de 2023. \n \nAl respecto, es importante mencionar que, en el complemento del Estudio de Impacto Ambiental, radicado \nANLA 2022283750-1-000 del 16 de diciembre de 2022, en el Capítulo “8. PROGRAMA DE SEGUIMIENTO \nY MONITOREO DEL PROYECTO”, ficha “PSMA 3 EMISIONES ATMOSFÉRICAS, CALIDAD DEL AIRE Y \nRUIDO” se señala, en relación con la “ACCIÓN 4: Seguimiento de evaporación mecánica”, lo siguiente: \n \n“Emisiones atmosféricas \nEfectuar el monitoreo de la calidad de aire en el área circundante a la zona del proceso, evaluando Material \nParticulado, Óxidos de Nitrógeno, Dióxido de Azufre, Hidrocarburos, VOC’S, Hidrocarburos (G y A, HAP, \nBTEX) y Monóxido de Carbono; de acuerdo con lo establecido en la Resolución 2254 de 2017 en los puntos \nespecíficos cercanos a la estrategia. \nSe deben reportar en los Informes de Cumplimiento Ambiental los resultados de los monitoreos, \ndebidamente analizados y evaluados, estableciendo como punto de comparación, los muestreos realizados \npara el último ICA entregado a la Autoridad Ambiental. \nEmisión de olores \nLlevar a cabo el monitoreo de calidad del aire de los parámetros NH3, H2S y TRS (generadores de olores \nofensivos) y otros compuestos identificados como de interés, de acuerdo a el resultado de calidad de agua \nobtenido, de manera trimestral, en condiciones de operación normal, para lo cual, se deberá argumentar \ntécnicamente la selección de las locaciones en donde se instalarán las estaciones de monitoreo, teniendo \nen cuenta los criterios establecidos en el Protocolo para el Monitoreo y Seguimiento de la Calidad del Aire \ndel MAVDT (2010). Asimismo, el reporte de los resultados de los monitoreos trimestrales deberá incluir el \nanálisis con respecto a los resultados obtenidos en la línea base. \nPresentar previo al inicio de operaciones, la modelación de la dispersión de los contaminantes H2S, TRS y \nNH3 (generadores de olores ofensivos), con los soportes de datos meteorológicos, plantillas de cálculo de \ninventarios y los archivos de entrada y salida de la modelación y su actualización semestral respectiva”. \n(subrayado fuera del texto). \nDe lo anterior, se resalta que la Sociedad propuso en el complemento del Estudio de Impacto Ambiental que \nrealizará monitoreos asociados con la actividad de evaporación mecánica en el área circundante a la zona \ndel proceso en puntos específicos cercanos a la estrategia. Al respecto, es importante indicar que, mediante \nel Artículo Vigésimo Quinto de la Resolución 1885 del 25 de agosto de 2023, la ANLA no autorizó a la \nsociedad Frontera Energy Colombia Corp. Sucursal Colombia, la implementación del proceso de \nevaporación mecánica a ciclo cerrado para el manejo de aguas de formación mediante 8 módulos de 2 ha \ncada uno, con una capacidad de 25.000 BWPD por módulo, para un total de 200.000 BWPD. Por tanto, el \nmonitoreo aplica para las actividades de evaporación que sí fueron aprobadas en la licencia, como la \nevaporación por inducción para un total de 200.000 BPWD. Se destaca que la Sociedad establece esta \nactividad como aplicable en el contexto de la ficha PSMA 3. \n \nAdemás, es importante destacar que la evaporación por inducción requiere energía proveniente de \ngeneradores, los cuales emiten contaminantes atmosféricos asociados al consumo de combustible líquido; \npor otro lado, considerando el caudal de agua a evaporar de 200.000 BWPD, se evidencia el potencial de \nalteración a la calidad del aire y a los niveles de presión sonora circundantes. Lo anterior resalta la \n\nResolución No. 2651       Del 14 NOV. 2023          Hoja No. 55 de 108 \n \n“Por la cual se resuelve un recurso de reposición contra la Resolución 1885 del 25 de agosto de 2023” \nPágina 55 de 108 \n \nimportancia de realizar el monitoreo antes y durante la operación de las áreas de evaporación con el fin \nrealizar un adecuado seguimiento a potenciales impactos ambientales y, de esta manera, verificar la \nefectividad de las medidas de manejo correspondientes. \n \nPor otro lado, en la ficha “PMRHSA-5 Manejo de evaporación mecánica a ciclo cerrado y evaporación por \ninducción a ciclo cerrado” del capítulo “7 PLAN DE MANEJO AMBIENTAL” del complemento del Estudio de \nImpacto Ambiental, la Sociedad establece respecto a la “ACCIÓN 2 CONDICIONES METEOROLOGICAS \nY AMBIENTALES” lo siguiente: \n \n“□ Previo al inicio de actividades se llevará a cabo el monitoreo de calidad del aire de los parámetros NH3, \nH2S y TRS (generadores de olores ofensivos), benceno, tolueno e hidrocarburos aromáticos policíclicos \n(HAP), con el fin de establecer la línea base, y posteriormente se realizarán monitoreos de forma trimestral \ncon el análisis comparativo con respecto a los resultados de la línea base. \n□ De igual manera, previo al inicio de actividades se realizará la modelación de la dispersión de los \ncontaminantes NH3, H2S y TRS y se remitirá a la autoridad con los soportes de datos meteorológicos, \nplantillas de cálculo de inventarios y los archivos de entrada y salida de la modelación”. (subrayado fuera \ndel texto). \nAdicionalmente, respecto a la ficha “PMRHA-1 Manejo de fuentes de emisiones y ruido”, la Sociedad indica \nlo siguiente: \n“Para las actividades asociadas a evaporación mecánica, se debe realizar la verificación del cumplimiento \nde los límites máximos permisibles acorde con lo establecido en el Decreto 1076 del 26 de mayo de 2015 \ndel MADS, en lo que respecta a las medidas de control para efectos del microclima. Para esto, se debe \nefectuar el monitoreo de la calidad de aire en el área circundante a la zona del proceso, evaluando Material \nParticulado, Óxidos de Nitrógeno, Dióxido de Azufre, Hidrocarburos, VOC’S y Monóxido de Carbono; de \nacuerdo con lo establecido en la Resolución 2254 de 2017 y los monitoreos realizados durante el desarrollo \nde las actividades del proyecto”. (subrayado fuera del texto). \nEl texto citado se complementa con el contenido de la ficha “PSMA 3 EMISIONES ATMOSFÉRICAS, \nCALIDAD DEL AIRE Y RUIDO”, en la cual se indica la comparación con los resultados del último Informe \nde Cumplimiento Ambiental, así como los resultados del monitoreo en línea base. Por tanto, lo establecido \npor la Sociedad en el complemento del Estudio de Impacto Ambiental se encuentra alineado con lo \nmencionado en la obligación recurrida en cuanto al análisis tendencial del impacto de la actividad sobre la \ncalidad del aire. \nDesde el punto de vista técnico, el Equipo Evaluador Ambiental considera que las actividades asociadas \ncon la evaporación no tendrán corta duración, como sí la tienen la construcción de vías y plataformas \nnuevas, así como la perforación y pruebas de producción de pozos; en su lugar, se realizarán de manera \nconstante para la disposición de aguas de formación. Estas actividades tienen el potencial de generar \nemisiones atmosféricas y sonoras, sobre las cuales no se cuenta con información obtenida en campo \nasociada con su impacto, en términos de monitoreos de calidad del aire y de ruido, razón por la cual se \nautorizó, por parte de la ANLA, la ejecución del citado piloto de evaporación mecánica en el radicado \n2022106948-2-000 del 27 de mayo de 2022, para la disposición de 1.500 BWPD. \nTeniendo en cuenta las consideraciones asociadas con la información que se encuentra en el complemento \ndel Estudio de Impacto Ambiental y las de índole técnico previamente indicadas, no se accede a la petición \n\nResolución No. 2651       Del 14 NOV. 2023          Hoja No. 56 de 108 \n \n“Por la cual se resuelve un recurso de reposición contra la Resolución 1885 del 25 de agosto de 2023” \nPágina 56 de 108 \n \nde la Sociedad de revocar el literal d., del numeral 1 de la “FICHA PSMA 3 Emisiones atmosféricas, calidad \ndel aire y ruido” del Artículo Trigésimo Cuarto de la Resolución 1885 del 25 de agosto de 2023. \nCONSIDERACIONES JURÍDICAS \nFrente a la solicitud de la Sociedad de que se revoque el literal d del numeral 1 del artículo trigésimo \ncuarto de la Resolución 1885 de 2023, argumentando entre otros, que el Sistema de Vigilancia de la \nCalidad del Aire –SVCAI propuesto, es suficiente en el contexto del trámite de modificación. Al \nrespecto se precisa, que fue la Sociedad en el complemento del EIA, quien estableció que realizaría \nmonitoreos asociados con la actividad de evaporación en el área circundante. \nAhora bien, teniendo en cuenta lo asociado con las actividades de evaporación, la Autoridad considera, \nque dicha actividad a diferencia de otras (como las constructivas), es constante durante toda la \noperación del proyecto y aunque no lo fuera, generaría emisiones. Así mismo, dicha actividad, implica \nla operación de maquinaria y por ende el uso de combustible que se sumarán al resto de emisiones, \nsobre las cuales no se tienen datos reales. Por lo cual, es necesario contar con la información sobre \nlos impactos que se llegasen a generar y en sentido no se revoca lo solicitado y en su lugar se \nconfirma. \n9) OBLIGACION RECURRIDA - LITERAL B NUMERAL 2 DEL ARTÍCULO DÉCIMO TERCERO, \nCONCESIÓN DE AGUAS SUBTERRÁNEAS, Y ARTÍCULO VIGÉSIMO TERCERO DE LA \nRESOLUCIÓN 1885 DEL 25 DE AGOSTO DE 2023 \n \nLos argumentos presentados por la Sociedad para la solicitud de modificación del Literal b del Numeral 2, \nconcesión de aguas subterráneas, del Artículo Décimo Tercero, son los mismos que presentó para la \nsolicitud de modificación del Artículo Vigésimo Tercero, por lo tanto, las consideraciones y la decisión de \nesta Autoridad respecto a estos artículos de la Resolución No. 1885 del 25 de agosto de 2023, ya están \nincluidas y desarrolladas en el numeral 3 de los argumentos del presente acto administrativo.  \n10) OBLIGACION RECURRIDA - ARTÍCULO VIGÉSIMO SÉPTIMO DE LA RESOLUCIÓN 1885 DEL \n25 DE AGOSTO DE 2023  \n \n“ARTÍCULO VIGÉSIMO SÉPTIMO: No autorizar a la sociedad Frontera Energy Colombia Corp. Sucursal \nColombia los siguientes volúmenes de aprovechamiento forestal, de conformidad con la parte motiva del \npresente acto administrativo: \nTipo \nObra \nCobertura \nÁrea \n(ha) \nVolumen \ntotal  \n(m3) \nVolumen \ncomercia\nl (m3) \nLocalizac\nión \ndefinida \nEstrategia \n3 \nConstrucción \ny \noperación \nde \nplataformas \nHerbazal denso de tierra firme no arbolado \n7,38 \n1,137 \n0,570 \nEstrategia \n6. \nConstrucción \ny \noperación de CPFs \nHerbazal denso de tierra firme no arbolado \n6,17 \n0,951 \n0,476 \n\nResolución No. 2651       Del 14 NOV. 2023          Hoja No. 57 de 108 \n \n“Por la cual se resuelve un recurso de reposición contra la Resolución 1885 del 25 de agosto de 2023” \nPágina 57 de 108 \n \nTipo \nObra \nCobertura \nÁrea \n(ha) \nVolumen \ntotal  \n(m3) \nVolumen \ncomercia\nl (m3) \nEstrategia \n7. \nConstrucción \nde \nPADs de inyección.  \nHerbazal denso de tierra firme no arbolado \n5,39 \n0,830 \n0,416 \nEstrategia \n9. \nInfraestructura \nde \napoyo eléctrica.  \nHerbazal denso de tierra firme no arbolado \n0,67 \n0,103 \n0,052 \nEstrategia \n11. \nConstrucción, \nadecuación \ny \nampliación de áreas \noperativas \nen \nla \nBatería 4 \nHerbazal denso de tierra firme no arbolado \n2,61 \n0,402 \n0,201 \nEstrategia \n12. \nConstrucción \ny \noperación \nde \nmódulos \npara \nel \nsistema de manejo \nde \naguas \npor \nevaporación \nmecánica \nHerbazal denso de tierra firme no arbolado \n32 \n4,928 \n2,469 \nZODAR \nHerbazal denso de tierra firme no arbolado \n5,86 \n0,903 \n0,452 \nZonificaci\nón \nEstrategia \n1. \nAdecuación de las \nvías existentes \nVegetación secundaria alta \n0,0053 \n0,134 \n0,055 \nVegetación secundaria baja \n0,0083 \n0,071 \n0,024 \nHerbazal denso de tierra firme no arbolado \n1,93 \n0,297 \n0,149 \nEstrategia \n2. \nConstrucción \nde \nvías de acceso \nVegetación secundaria alta \n0,23 \n5,736 \n2,368 \nVegetación secundaria baja \n0,35 \n3,061 \n1,033 \nHerbazal denso de tierra firme no arbolado \n82,70 \n12,736 \n6,382 \nEstrategia \n3 \nConstrucción \ny \noperación \nde \nplataformas \nHerbazal denso de tierra firme no arbolado \n55,66 \n8,571 \n4,295 \nEstrategia \n5 \nConstrucción \ny \noperación de Líneas \nde flujo \nVegetación secundaria alta \n1,65 \n41,449 \n17,114 \nVegetación secundaria baja \n2,56 \n22,116 \n7,461 \nHerbazal denso de tierra firme no arbolado \n597,59 \n92,028 \n46,112 \nEstrategia \n9. \nInfraestructura \nde \napoyo eléctrica.  \nHerbazal denso de tierra Firme No Arbolado \n27 \n4,158 \n2,083 \nCaptaciones \nHerbazal denso de tierra Firme No Arbolado \n0,4 \n0,062 \n0,031 \n\nResolución No. 2651       Del 14 NOV. 2023          Hoja No. 58 de 108 \n \n“Por la cual se resuelve un recurso de reposición contra la Resolución 1885 del 25 de agosto de 2023” \nPágina 58 de 108 \n \nTipo \nObra \nCobertura \nÁrea \n(ha) \nVolumen \ntotal  \n(m3) \nVolumen \ncomercia\nl (m3) \nOcupaciones \nDe \nCauce \nBosque de galería y/o ripario \n0,066 \n11,059 \n5,882 \nTotal \n830,24 \n210,73 \n97,62 \nFuente: Elaborado por el Equipo evaluador de la ANLA -EEA a partir de la información adicional presentada mediante radicado 2022283750-1-000 \ndel 16 de diciembre de 2022, Frontera Energy.” \nPETICIÓN DE LA SOCIEDAD  \n \nSe solicita respetuosamente a la ANLA modificar el artículo vigésimo séptimo Resolución, en el sentido de \nautorizar el aprovechamiento forestal solicitado para las coberturas de herbazal denso de tierra firme no \narbolado y vegetación secundaria, correspondiente a un volumen total de 195,15 m3 y volumen comercial \nde 94,82 m3. \nComo soporte a la solicitud se presenta el cuadro de volumen solicitado elaborado por la Compañía, en el \nque se excluyen las áreas de aquellas coberturas que la ANLA define como de exclusión, correspondiente \na la Vegetación Secundaria Alta y el área de la Ocupación de cauce que no fue aprobada en Bosque de \ngalería y/o ripario. \n \nTipo \nObra \nCobertura \nÁrea  \n(ha) \nVolume\nn  \ntotal  \n(m3) \nVolumen  \nComerci\nal  \n(m3) \nLocalización \nn definida \nEstrategia \n3  \nConstrucción \ny  \noperación \nde  \nplataformas \nHerbazal \ndenso \nde \ntierra  \nfirme no arbolado \n7,38 \n1,137 \n0,57 \nEstrategia \n6.  \nConstrucción \ny  \noperación de CPF \nHerbazal denso de \ntierra  \nfirme no arbolado \n6,17 \n0,951 \n0,48 \nEstrategia \n7.  \nConstrucción \nde \nPAD  \nde inyección. \nHerbazal denso de \ntierra  \nfirme no arbolado \n5,39 \n0,83 \n0,42 \n\nResolución No. 2651       Del 14 NOV. 2023          Hoja No. 59 de 108 \n \n“Por la cual se resuelve un recurso de reposición contra la Resolución 1885 del 25 de agosto de 2023” \nPágina 59 de 108 \n \nTipo \nObra \nCobertura \nÁrea  \n(ha) \nVolume\nn  \ntotal  \n(m3) \nVolumen  \nComerci\nal  \n(m3) \nEstrategia \n9.  \nInfraestructura \nde  \napoyo eléctrico. \nHerbazal denso de \ntierra  \nfirme no arbolado \n0,67 \n0,103 \n0,05 \nEstrategia \n11.  \nConstrucción,  \nadecuación \ny  \nampliación \nde \náreas  \noperativas \nen \nla \nBatería  \n4 \nHerbazal denso de \ntierra \nfirme \nno \narbolado \n2,61 \n0,402 \n0,2 \nEstrategia \n12.  \nConstrucción \ny  \noperación \nde \nmódulos  \npara \nel \nsistema \nde  \nmanejo \nde \naguas \npor  \nevaporación mecánica \nHerbazal denso de \ntierra \nfirme \nno \nArbolado \n32 \n4,928 \n2,47 \nZODAR \nHerbazal denso de \ntierra  \nfirme no arbolado \n5,86 \n0,903 \n0,45 \nLocalización \npor zonificación \nn definida \nEstrategia \n1.  \nAdecuación \nde \nlas \nvías  \nexistentes \nHerbazal denso de \ntierra  \nfirme no arbolado \n1,985 \n0,297 \n0,15 \nEstrategia \n1.  \nAdecuación \nde \nlas \nvías  \nexistentes \nVegetación \nsecundaria  \nbaja \n0,0083 \n0,071 \n0,02 \nEstrategia \n2.  \nConstrucción \nde \nvías \nde  \nacceso \nHerbazal denso de \ntierra  \nfirme no arbolado \n85,26 \n12,736 \n6,38 \nEstrategia \n2.  \nConstrucción \nde \nvías \nde  \nacceso \nVegetación \nsecundaria  \nbaja \n0,35 \n3,061 \n1,03 \n\nResolución No. 2651       Del 14 NOV. 2023          Hoja No. 60 de 108 \n \n“Por la cual se resuelve un recurso de reposición contra la Resolución 1885 del 25 de agosto de 2023” \nPágina 60 de 108 \n \nTipo \nObra \nCobertura \nÁrea  \n(ha) \nVolume\nn  \ntotal  \n(m3) \nVolumen  \nComerci\nal  \n(m3) \nEstrategia \n3  \nConstrucción \ny  \noperación \nde  \nplataformas \nHerbazal denso de \ntierra  \nfirme no arbolado \n57,38 \n8,571 \n4,29 \nEstrategia \n5  \nConstrucción \ny  \noperación \nde \nLíneas \nde  \nflujo \nHerbazal denso de \ntierra  \nfirme no arbolado \n616,04 \n92,028 \n46,11 \nEstrategia \n5  \nConstrucción \ny  \noperación \nde \nLíneas \nde  \nflujo \nVegetación \nsecundaria  \nbaja \n2,56 \n22,116 \n7,46 \nEstrategia \n9.  \nInfraestructura \nde  \napoyo eléctrico. \nHerbazal denso de \ntierra  \nfirme no arbolado \n27 \n4,158 \n2,08 \nCaptaciones \nHerbazal denso de \ntierra  \nfirme no arbolado \n0,4 \n0,062 \n0,03 \nTotal \ngeneral \n \n \n851,075 \n195,152 \n94,821 \n \nARGUMENTOS DE LA SOCIEDAD \n \nSobre el permiso de aprovechamiento forestal para el herbazal denso de tierra firme no arbolado, de la \nrevisión realizada por la ANLA a la información adicional remitida por Frontera mediante radicado número \n2022283750-1-000 del 16 de diciembre de 2022, en respuesta a lo requerido en el Acta No. 98 del 2022, se \nevidencia que la información allegada relacionada con los literales a, b y c del Requerimiento 28 fue \nconsiderada suficiente por la Autoridad Ambiental. \nAhora bien, la ANLA estableció algunas restricciones en la Resolución sobre la intervención de cobertura \nde herbazal denso de tierra firme no arbolado (página 404), cuyos argumentos se presentan a continuación: \n“En este sentido, posterior al ajuste realizado en la entrega de la información adicional y conforme a lo \ndispuesto dicho documento, la empresa indicó que solicita un volumen total de 483,264 m3 en 892,257 ha, \nde acuerdo con la siguiente tabla” (pág. 400). \n\nResolución No. 2651       Del 14 NOV. 2023          Hoja No. 61 de 108 \n \n“Por la cual se resuelve un recurso de reposición contra la Resolución 1885 del 25 de agosto de 2023” \nPágina 61 de 108 \n \nTabla 74 Volumen total solicitado para el aprovechamiento forestal para cada cobertura \n \nTipo \nde \nsolicitud \nCobertura  \nÁrea \n(ha) \nVolumen \ntotal \n(m3) \nVolumen comercial (m3) \nLocalización \ndefinitiva \nExplotación de Hidrocarburos \n2,166 \n0 \n0 \nHerbazal denso de tierra firme con arbustos \n1,81 \n12,602 \n4,389 \nHerbazal denso de tierra firme no arbolado \n52,704 \n8,117 \n4,066 \nRed vial y territorios asociados \n0,294 \n0 \n0 \nLocalización por \nzonificación \nBosque de galería y/o ripario \n0,265 \n42,8 \n22,616 \nExplotación de Hidrocarburos \n0 \n0 \n0 \nHerbazal denso de tierra Firme Con Arbustos \n34,765 \n228,189 \n79,468 \nHerbazal denso de tierra Firme no arbolado \n795,443 \n118,99 \n59,622 \nVegetación secundaria alta \n1,883 \n47,318 \n19,536 \nVegetación secundaria baja \n2,927 \n25,248 \n8,518 \nTotal \n892,257 \n483,264 \n198,215 \nFuente: Elaborado por el Equipo evaluador de la ANLA -EEA a partir de la información adicional presentada mediante radicado 2022283750-1-000 \ndel 16 de diciembre de 2022, Frontera Energy.” \nEn las páginas 402 y 403 de la Resolución, la ANLA refiere que en respuesta al requerimiento del literal a, \nla Compañía allegó la información adicional documental, cartográfica y base de datos en cumplimiento a \ncada solicitud realizada, identificándose un ajuste a la solicitud del permiso presentada inicialmente \nen la solicitud de modificación de licencia. No obstante, respecto a esto, la ANLA consideró: \n“Frente al literal a, La Sociedad allega de forma documental, cartográfica y en la base de datos, el ajuste \nrealizado al permiso de aprovechamiento forestal referido a la actualización del registro de información \nprimaria y por tanto revisión del error de muestreo para cada ecosistema objeto de solicitud, evidenciando \nque para la mayoría de los ecosistemas solicitados se reporta un error de muestreo inferior al 15% \ngarantizando de esta forma representatividad de la caracterización y con esto las existencias asociadas al \npermiso de aprovechamiento forestal, no obstante, respecto al ecosistema de herbazal denso de tierra firme \nno arbolado del Peinobioma de la Amazonía-Orinoquía, correspondiente al 95% de área a intervenir y el \n50% de volumen total a aprovechar de la solicitud, se evidencia un error de muestreo de 30,29 %. \nDicho aspecto, no permite tener certeza de la mayor parte de la solicitud y no se da cumplimiento a lo \nexpuesto en el numeral 4.6 Aprovechamiento forestal de los términos de referencia HI-TER-1-03 de 2010 \ndonde se solicita que: \n \n“…Se deberá presentar un inventario forestal de las unidades de cobertura vegetal de las cuales se solicita \naprovechamiento forestal mediante un muestreo estadístico que deberá cumplir con un error de muestreo \nno superior al 15% y una probabilidad del 95%. Así mismo, se deberá presentar los volúmenes comercial \ny total a ser aprovechado por tipo de cobertura vegetal…” (subrayado y negrilla fuera de texto). \nPosteriormente, en la página 403 de la Resolución, la ANLA considera que: \n\nResolución No. 2651       Del 14 NOV. 2023          Hoja No. 62 de 108 \n \n“Por la cual se resuelve un recurso de reposición contra la Resolución 1885 del 25 de agosto de 2023” \nPágina 62 de 108 \n \n“Respecto al literal b, se evidencia como en el numeral 4.6.7 del capítulo 4 del documento de información \nadicional (NUR 2022283750-1-000), Tabla 4-204 Tipo de infraestructura y estrategias por ecosistema en el \nAI Quifa, La Sociedad da especificidad al permiso de aprovechamiento forestal respecto a las obras con \nlocalización definida y aquellas que se proyectan mediante zonificación, soportada en el anexo 13 \nAprovechamiento forestal del documento de información adicional en comento.  \nFinalmente, al respecto del ajuste para la capa de aprovechamiento forestal contenida en el modelo de \nalmacenamiento geográfico (MAG) la Sociedad da cumplimiento al requerimiento, incluyendo la información \ncartográfica asociada a la infraestructura que cuenta con localización definida”. \nA partir de la revisión y análisis realizado por la ANLA en la página 404 de la Resolución, la Autoridad \nAmbiental considera lo siguiente: \n“En suma y acorde con lo descrito para cada uno de los literales que conformaron el requerimiento 28 \nrelacionado con la solicitud de aprovechamiento forestal, es preciso mencionar que este Equipo evaluador \nde la ANLA – EEA, encuentra suficiente la información para proceder a la evaluación, sin embargo, se \ndarán restricciones sobre la cobertura de herbazal denso de tierra firme no arbolado del Peinobioma \nde la Amazonia-Orinoquía, toda vez que no se evidencia representatividad estadística en la \ninformación de caracterización información necesaria para otorgar el permiso de aprovechamiento \nforestal.”(subrayado y negrilla fuera de texto). \nEn relación con la viabilidad del permiso de aprovechamiento, la ANLA realiza en la página 406 las \nsiguientes consideraciones: \n“(…) se puede concluir que el estudio cumple con la mayor parte de los criterios de información \nestablecidos en los términos de referencia y normatividad vigente, con respecto a la solicitud de \naprovechamiento forestal realizada (…) ANLA considera que no es viable otorgar permiso de \naprovechamiento forestal sobre la cobertura correspondiente al herbazal denso de tierra firme no arbolado, \ntoda vez que no se dio cumplimiento con el error de muestreo estadístico inferior al 15% en esta, siendo un \nrequisito dentro de los términos de referencia de la Metodología General para la Elaboración y Presentación \nde Estudios Ambientales de 2018 (numeral 6.5 Aprovechamiento forestal) y términos de referencia de \nproyectos de explotación de hidrocarburos HI-TER-1-03 de 2010 (numeral 4.6 Aprovechamiento forestal \npor lo cual la información del muestreo presentada por la Sociedad para esta cobertura no es \nestadísticamente representativa.” \nFrente a las consideraciones previamente descritas, y en específico respecto al permiso de \naprovechamiento forestal requerido para el presente proyecto, la ANLA señala como parte de las \nconsideraciones jurídicas en la página 407 de la Resolución que el artículo 212 del Decreto 2811 de 1974, \nestablece que las clases de aprovechamiento forestal pueden ser: persistentes, únicos y domésticos. \nDe igual forma, en las páginas 407 y 408 de la Resolución la ANLA estableció que: \n“el permiso de aprovechamiento forestal solicitado dentro de la licencia ambiental que se evalúa es el \ndescrito como único en el artículo 214 del Decreto 2811 de 1974, el cual establece: \n“Artículo 214º.- Son aprovechamientos forestales únicos los que técnicamente se realicen en bosques \nlocalizados en suelos que deban ser destinados a usos diferentes del forestal. (…)” \nEn el artículo 2.2.1.1.2.2 de la sección 2 del Capítulo 1 del Título 1, Parte 2 del Libro 2 del Decreto 1076 del \n26 de mayo de 2015, establece como uno de los principios generales que deben tenerse en cuenta en la \nregulación de los aprovechamientos forestales dentro del territorio nacional que: \n\nResolución No. 2651       Del 14 NOV. 2023          Hoja No. 63 de 108 \n \n“Por la cual se resuelve un recurso de reposición contra la Resolución 1885 del 25 de agosto de 2023” \nPágina 63 de 108 \n \n“…Los bosques, en tanto parte integrante y soporte de la diversidad biológica, étnica y de la oferta ambiental, \nson un recurso estratégico de la Nación y, por lo tanto, su conocimiento y manejo son tarea esencial del \nEstado con apoyo de la sociedad civil…” \nAun en las consideraciones jurídicas de la página 408 de la Resolución, la ANLA argumenta lo siguiente: \n“(…) frente al permiso de aprovechamiento forestal y teniendo en cuenta que el proyecto es de utilidad \npública, se enmarca en lo dispuesto en el literal a) del artículo 2.2.1.1.3.1 del Decreto 1076 de 2015 el cual \ndetermina: \n(…) ARTÍCULO 2.2.1.1.3.1. Se considera un aprovechamiento único por realizarse por una sola vez y por \nser un proyecto de utilidad pública e interés social…”. \nEn este entendido, los requisitos, trámite y procedimiento para los Aprovechamientos Forestales únicos, \nse encuentran regulados a partir del artículo 2.2.1.1.5.1 y hasta el artículo 2.2.1.1.5.7 del Decreto 1076 de \n2015. A su vez, el artículo 2.2.1.1.5.6 ibídem establece: “Artículo 2.2.1.1.5.6. Otras formas. Los \naprovechamientos forestales únicos de bosques naturales ubicados en terrenos de dominio privado se \nadquieren mediante autorización.” \nAsí las cosas, acorde con las consideraciones técnicas expuestas en el Concepto Técnico del análisis \nregional efectuado se tiene que hay unas coberturas sobre las cuales no se considera procedente otorgar \nsu aprovechamiento. \nPara el herbazal denso de tierra firme no arbolado la información no fue adecuada ya que el error de \nmuestreo estadístico no fue inferior a 15%, siendo esto necesario conforme el artículo 2.2.1.1.5.7 del decreto \n1076 de 2015 y en la metodología general para la presentación de estudios ambientales en el numeral 6.5, \nprimera viñeta página 176, por lo tanto, no se garantiza la representatividad de la caracterización de dicha \ncobertura, y de esta manera impide pronunciarse para otorgar el permiso. \nPor último, la ANLA en las páginas 492 y 493 de la Resolución hace referencia a la “Acción 3. \nAprovechamiento forestal”, del “PMSB-1 - Manejo de remoción de cobertura vegetal y descapote”, respecto \na la remoción de árboles aislados de conformidad con el artículo 2.2.1.1.9.6. del decreto 1076 de 2015 \nseñalando lo siguiente: \n“ACCIÓN 3 Aprovechamiento forestal: con respecto a lo relacionado con el aprovechamiento forestal, se \nconsidera necesario incluir un indicador de efectividad donde se verifique que el aprovechamiento forestal \nrealizado se ajusta a lo autorizado. \nFinalmente, en caso de realizar remoción de árboles aislados de conformidad con el artículo 2.2.1.1.9.6. del \ndecreto 1076 de 2015 se deberá reportar en cada ICA el volumen de aprovechamiento realizado en el \nperiodo y el acumulado, el cual no podrá superar los veinte metros cúbicos (20 m³) durante el desarrollo de \ntodas las actividades contempladas en el proyecto.” \nPor otra parte, la ANLA consideró en la página 406 de la Resolución para la vegetación secundaria (alta y \nbaja) lo siguiente: \n“…corresponden al 0,58% del área de influencia físico-biótico, y acorde con la necesidad de conservación \nsobre estas áreas expuesta por La Sociedad en el documento de información adicional, donde se menciona \nque las coberturas de vegetación secundaria alta y baja localizadas en el área de influencia físico-biótica \ndel proyecto se desarrollan principalmente aledañas a los bosques de galería, palmares o en las márgenes \nde cuerpos de agua, y que su mantenimiento en el tiempo puede favorecer la recuperación y \n\nResolución No. 2651       Del 14 NOV. 2023          Hoja No. 64 de 108 \n \n“Por la cual se resuelve un recurso de reposición contra la Resolución 1885 del 25 de agosto de 2023” \nPágina 64 de 108 \n \nrepresentatividad del bosque de galería, hábitat de importancia ecológica para la fauna local y regional, se \nconsidera necesario negar el permiso de aprovechamiento forestal en dichas coberturas”. \nAhora bien, para la Compañía es importante mencionar que por medio de la comunicación 2022283750-1-\n000 del 16 de diciembre de 2022, radicado VITAL 3500830126302222050, Frontera remitió la información \nadicional requerida mediante Acta No. 98 del 2022, dentro del trámite de evaluación de la solicitud de \nmodificación de licencia ambiental global para el proyecto. \nComo parte de la información adicional allegada por la Compañía a la ANLA en respuesta a lo requerido \nmediante Acta No. 98 del 2022, se presentó para la solicitud del permiso de aprovechamiento, de manera \ncomplementaria a la caracterización del estrato herbáceo predominante del herbazal denso de tierra firme \nno arbolado, la caracterización del componente arbóreo vinculado con los árboles aislados presentes en \nesta unidad de cobertura. Sin embargo, cabe aclarar que, al no tratarse de una cobertura boscosa, esta \nno se debe manejarse en los mismos términos del Aprovechamiento Forestal, toda vez que desde el punto \nde vista normativo el aprovechamiento de bosques naturales y de cobertura vegetal con presencia de \nbosques aislados, son conceptos diferentes, conforme se detalla en este apartado. \nFrente a las consideraciones jurídicas sobre el permiso de aprovechamiento forestal realizadas por la ANLA \nen la Resolución, la Compañía considera que la Autoridad Ambiental no está teniendo en cuenta que los \ndecretos citados están regulando el aprovechamiento forestal de la flora silvestre en áreas de bosque, no \nen áreas abiertas donde predominan otros tipos de vegetación diferentes a los bosques. Lo anterior, se \nsustenta en que para estos casos no hay un estrato arbóreo consolidado ni etapas sucesionales que \npermitan evidenciar la evolución en el nivel de complejidad de los ecosistemas u homeostasis posibles con \nel ambiente físico, lo que resulta en una oferta diferenciada de servicios ecosistémicos y en una dinámica \necológica de estructura, composición y función distinta a la de los bosques, donde, si es posible evidenciar \nuna estructura de dosel claramente diferenciable, con un avance sucesional reflejado en la presencia de \nvarios estratos verticales derivados de la capacidad de adaptación de las especies a condiciones de suelo, \nclima y disponibilidad de agua, lo que les permite tener una tendencia de desarrollo que se procura identificar \na partir de muestreos estadísticos. \nPara el caso de los herbazales, a diferencia de los bosques, las condiciones de suelo son tan restrictivas \nque impiden el desarrollo de gran cantidad de especies, lo que se sustenta con el predomino de especies \nde hábito herbáceo y algunas arbustivos como Curatella americana (Chaparro). Conforme se especificó en \nel capítulo 3. CARACTERIZACIÓN DEL ÁREA DE INFLUENCIA DE PROYECTO y en la página 479 del \ncapítulo 4. DEMANDA, USO APROVECHAMIENTO Y/O AFECTACIÓN DE RECURSOS NATURALES \nremitidos por medio de la comunicación 2022283750-1-000 del 16 de diciembre de 2022, para el herbazal \ndenso de tierra firme no arbolado no hay una tendencia de desarrollo de la vegetación arbórea que se pueda \nidentificar porque los árboles están muy dispersos e incluso en grandes distancias no se encuentran \nindividuos, al punto que para la caracterización se encontró solo un árbol en cada una de las siete (7) \nparcelas, lo que indica que aproximadamente la densidad es de cuatro (4) individuos por hectárea. \nA este respecto, se resalta la importancia de tener en cuenta lo establecido en el artículo 2.2.1.1.5.7 del \nDecreto 1076 de 2015: \n“Inventario. Para los aprovechamientos forestales únicos de bosque natural ubicados en terrenos de \ndominio público o privado, el interesado deberá presentar en el plan de aprovechamiento un inventario \nestadístico con error de muestreo no superior al quince por ciento (15%) y una probabilidad del noventa y \ncinco por ciento (95%).” \n\nResolución No. 2651       Del 14 NOV. 2023          Hoja No. 65 de 108 \n \n“Por la cual se resuelve un recurso de reposición contra la Resolución 1885 del 25 de agosto de 2023” \nPágina 65 de 108 \n \nAdicionalmente, es necesario que la Autoridad Ambiental tenga en consideración lo mencionado en el \nartículo 211 del decreto 2811 de 1974, el cual indica lo siguiente: “Se entiende por aprovechamiento forestal \nla extracción de productos de un bosque”. \nAsí, para el caso del herbazal denso de tierra firme no arbolado, donde se identifican árboles de manera \naislada o ausentes, como lo indica la metodología Corine Land Cover, no debe tratarse como un \naprovechamiento forestal en un bosque; sin embargo, la ANLA le está dando dicha connotación a esta \nunidad de cobertura a pesar de sus grandes diferencias. \nAdicionalmente, se debe tener en cuenta desde el punto de vista normativo, lo consignado en el Decreto \n2278 de 1953, según el artículo 2° y artículo 3°, donde se establece que los bosques del país se clasifican \nasí: \n“Bosques protectores: son los plantados en los terrenos que constituyen la “Zona Forestal Protectora”, con \nel fin de defender y regularizar los recursos hídricos, evitar la erosión y contribuir a la salubridad. \n \nBosques públicos: son los que pertenecen a entidades de derecho público, como la Nación, los \nDepartamentos, los Municipios, etc. \nBosques de interés general: son aquellos que contienen especies de elevado valor comercial que \neconómicamente conviene conservar, ya sean públicos o de propiedad privada. \nBosques de propiedad privada: son aquellos que han salido del dominio del Estado a cualquier título, o que \nestán amparados por títulos inscritos entre particulares otorgados con anterioridad al 7 de abril de 1917”. \nPor otra parte, en el decreto 1791 de 1996 (Cap. I, Art. 1), compilado en el Decreto 1076 de 2015, Decreto \nÚnico reglamentario del sector Ambiente y Desarrollo Sostenible, se hace la siguiente claridad: \n“Aprovechamiento. Es el uso, por parte del hombre, de los recursos maderables y no maderables \nprovenientes de la flora silvestre y de las plantaciones forestales. \nAprovechamiento forestal. Es la extracción de productos de un bosque y comprende desde la obtención \nhasta el momento de su transformación. \nPlan de manejo forestal. Es la formulación y descripción de los sistemas y labores silviculturales a aplicar \nen el bosque sujeto a aprovechamiento, con el objeto de asegurar su sostenibilidad, presentando por el \ninteresado en realizar aprovechamientos forestales persistentes. \nPlan de aprovechamiento forestal. Es la descripción de los sistemas, métodos y equipos a utilizar en la \ncosecha del bosque y extracción de los productos, presentando por el interesado en realizar \naprovechamientos forestales únicos.” \nDentro de la normatividad expuesta se evidencia la diferencia entre aprovechamiento y aprovechamiento \nforestal, estableciendo que los aprovechamientos forestales se tratan de la extracción de productos del \nbosque mientras que el aprovechamiento es el uso de productos maderables y no maderables de la flora \nsilvestre. \nAsí las cosas, se considera que, para el herbazal denso de tierra firme no arbolado, aplica la definición de \naprovechamiento, diferente de aprovechamiento forestal, que es el único concepto considerado en el \nnumeral 6.5 de la Metodología General para la Presentación de Estudios Ambientales. \nSe resalta que de acuerdo con las consideraciones realizadas por la ANLA frente a la acción relacionada \ncon el aprovechamiento forestal en la medida de manejo “PMSB-1 - Manejo de remoción de cobertura \n\nResolución No. 2651       Del 14 NOV. 2023          Hoja No. 66 de 108 \n \n“Por la cual se resuelve un recurso de reposición contra la Resolución 1885 del 25 de agosto de 2023” \nPágina 66 de 108 \n \nvegetal y descapote”, la Autoridad Ambiental solicita incluir un indicador asociado a la posibilidad de \naprovechar arboles aislados, amparado en el artículo 2.2.1.1.9.6. del decreto 1076 de 2015, lo que implica \nreconocer la condición de que áreas como el Herbazal denso de tierra firme no arbolado, \ncaracterizado justamente por la presencia ocasional de árboles, son unidades de cobertura no \nboscosas, para las cuales no rige la misma rigurosidad estadística en el cumplimiento del error de \nmuestreo que se solicita para coberturas boscosas de mayor complejidad estructural. \nFrente a las restricciones establecidas en la tabla de Zonificación de Manejo Ambiental definida por la ANLA \nen la parte considerativa de la Resolución (página 465), la Compañía considera adecuado restringir el \naprovechamiento en la vegetación secundaria baja en áreas adyacentes al bosque de galería, palmares o \ncuerpos de agua, teniendo en cuenta que la zonificación del campo de acuerdo con el artículo tercero de la \nResolución 2035 del 15 de octubre de 2010 establece como área de exclusión la franja de protección de 50 \nm a drenajes tanto permanentes como no permanentes y demás drenajes menores. Sin embargo, no se \nconsidera adecuado restringir este aprovechamiento forestal a la intervención en áreas sin \ninteracción con estos ecosistemas sensibles, teniendo en cuenta: (i) la normatividad que regula la \nmateria y; (ii) que esta unidad de cobertura vegetal se puede encontrar asociada a vías u obras de \ninfraestructura que no se localizan en cercanías a bosques, palmares o cuerpos de agua. \nEl herbazal denso de tierra firme no arbolado caracterizado, por ser una cobertura vegetal no boscosa, \ndonde la ocurrencia de individuos arbóreos se da de manera aislada, no se encuentra sujeta al cumplimiento \ndel error de muestreo para coberturas boscosas, el cual no debe ser superior al quince por ciento (15%) con \nuna probabilidad del noventa y cinco por ciento (95%) según los estadígrafos requeridos. \nSi bien se considera adecuado restringir el aprovechamiento forestal en la vegetación secundaria baja en \náreas adyacentes al bosque de galería, palmares o cuerpos de agua, dado que esta unidad de cobertura \npodría encontrarse también asociada a vías u obras de infraestructura que no se localizan en cercanías a \nbosques, palmares o cuerpos de agua, no se considera adecuado restringir el aprovechamiento a la totalidad \nde la cobertura. \nEn línea con lo expuesto, entiende la Compañía que la restricción del herbazal previamente mencionado \nestá enfocada al herbazal denso de tierra firme con arbustos que equivale al 3,28% del área y requiere una \nprotección especial y no al herbazal denso de tierra firme no arbolado con un 71,77% de representatividad \nen el área del proyecto. \n \n \n \n\nResolución No. 2651       Del 14 NOV. 2023          Hoja No. 67 de 108 \n \n“Por la cual se resuelve un recurso de reposición contra la Resolución 1885 del 25 de agosto de 2023” \nPágina 67 de 108 \n \n \nSobre la intervención de herbazal denso de tierra firme no arbolado, se evidencia que en todos los proyectos \nde hidrocarburos vecinos a Quifa la infraestructura petrolera (en un 98%) se ubica sobre el herbazal denso \nde tierra firme no arbolado debido a que son las coberturas con menor vulnerabilidad ambiental. La \nintervención del herbazal denso de tierra firme no arbolado genera los menores impactos con respecto a la \nintervención de cualquier otra cobertura existente en la zona mostrando esta condición, por lo cual es \nimportante que la toma de decisiones tenga en cuenta los impactos y el principio de equidad. \nEn caso de presentarse la restricción de intervención en las coberturas de herbazal denso de tierra firme no \narbolado, las estrategias aprobadas en el artículo séptimo de la Resolución no se podrían ejecutar debido a \nla restricción de áreas a ser intervenidas. \nCONSIDERACIONES TÉCNICAS DE LA ANLA \n \nEs oportuno mencionar que La Sociedad incluyó dentro de la solicitud de aprovechamiento forestal la \ncobertura vegetal de herbazal denso de tierra firme no arbolado para la cual el error de muestreo estadístico \nfue del 30,29%, y que de acuerdo con lo expuesto en el artículo  2.2.1.1.5.7 del decreto 1076 de 2015, así \ncomo en el numeral 4.6 Aprovechamiento Forestal de los términos de referencia HI-TER-1-03 de 2010 y \nnumeral 6.5 Aprovechamiento Forestal de la Metodología General Para La Elaboración Y Presentación De \nEstudios Ambientales del 2018, el error de muestreo estadístico en las unidades de cobertura vegetal donde \nse prevé realizar aprovechamiento forestal debe ser no superior al quince por ciento (15%) con una \nprobabilidad del noventa y cinco por ciento (95%), por lo cual para la referida cobertura no se garantizó la \nrepresentatividad del muestreo requerida en la normativa.  \nFrente a las consideraciones que la Sociedad presenta acerca del aprovechamiento forestal de flora silvestre \nen áreas abiertas donde predominan otros tipos de vegetación sin un estrato arbóreo consolidado que \npermita establecer muestreos estadísticos, y que “…para el caso de los herbazales, a diferencia de los \nbosques, las condiciones de suelo son tan restrictivas que impiden el desarrollo de gran cantidad de \nespecies, lo que se sustenta con el predomino de especies de hábito herbáceo y algunas arbustivos como \nCuratella americana”, en la información adicional remitida por La Sociedad mediante radicado número \n\nResolución No. 2651       Del 14 NOV. 2023          Hoja No. 68 de 108 \n \n“Por la cual se resuelve un recurso de reposición contra la Resolución 1885 del 25 de agosto de 2023” \nPágina 68 de 108 \n \n2022283750-1-000 del 16 de diciembre de 2022, allegó información relacionada con el ajuste solicitado por \nel Equipo Técnico Evaluador de la ANLA a la solicitud del permiso de aprovechamiento forestal: \n“Requerimiento 28:  \nComplementar el permiso de aprovechamiento forestal solicitado, teniendo en cuenta lo siguiente:  \na) El ajuste requerido a la descripción del proyecto y la caracterización florística acorde con los \nrequerimientos 1 y 17 respectivamente. …” \nFrente al literal a, La Sociedad allegó de forma documental, cartográfica y en la base de datos, la \nactualización del registro de información primaria y revisión del error de muestreo estadístico para cada \necosistema objeto de solicitud, en la que se encuentran entre otras, la cobertura vegetal herbazal denso de \ntierra Firme Con Arbustos, con una extensión del 3,28% del área de influencia del proyecto, la cual SI \ncumplió con el error de muestreo inferior al quince por ciento (15%) y probabilidad del noventa y cinco por \nciento (95%) como lo establecen los términos de referencia HI-TER-1-03 de 2010 y de la Metodología \nGeneral para la Elaboración y Presentación de Estudios Ambientales del 2018, siendo esta una cobertura \nvegetal sin un estrato arbóreo consolidado como lo argumenta la Sociedad.  \nPara la cobertura vegetal herbazal denso de tierra firme No arbolado, la Sociedad estableció siete (7) \nparcelas de caracterización, con las cuales se podría haber hecho un ejercicio de premuestreo para \nestablecer el numero adecuado de parcelas para alcanzar un error de muestreo menor o igual al quince por \nciento (15%); realizando ese ejercicio por este Equipo Técnico Evaluador a partir de la información levantada \npor La Sociedad (ver siguiente tabla), el número estimado de parcelas necesarias para cumplir con este \nerror de muestreo serian de veintinueve (29), las cuales en un área de 32.453,13 hectáreas que ocupa la \ncobertura en mención en el área de influencia del proyecto, era posible establecer y caracterizar, \nconsiderando que otras coberturas de menor extensión en el área de influencia cumplieron con el error de \nmuestreo inferior al quince por ciento (15%) como el herbazal denso de tierra firme con arbustos \n(mencionado anteriormente) y la vegetación secundaria baja con una extensión de área del 0,386%. \nEstadístico \nUnidades \nn \n7 \nparcelas \nx \n0,032 \nm3 \nDesEst \n0,011 \nm \nCV \n32,752 \n% \nt \n2,447 \n \nEM (CV) \n30,29 \n% \nn esperado (CV) \n29 \nparcelas \n \nFrente a lo expresado por La Sociedad acerca de que está Autoridad “…no está teniendo en cuenta que los \ndecretos citados están regulando el aprovechamiento forestal de la flora silvestre en áreas de bosque, no \nen áreas abiertas donde predominan otros tipos de vegetación diferentes a los boques”, es de aclarar que \nla norma no hace esta distinción que la Sociedad menciona, y por el contrario regula el uso, manejo, \naprovechamiento en bosques y flora silvestre como lo expresa el objeto del capítulo 1 Flora del decreto 1076 \nde 2015 en su artículo 2.2.1.1.2.1: “El presente Capítulo tiene por objeto regular las actividades de la \n\nResolución No. 2651       Del 14 NOV. 2023          Hoja No. 69 de 108 \n \n“Por la cual se resuelve un recurso de reposición contra la Resolución 1885 del 25 de agosto de 2023” \nPágina 69 de 108 \n \nadministración pública y de los particulares respecto al uso, manejo, aprovechamiento y conservación de \nlos bosques y la flora silvestre con el fin de lograr un desarrollo sostenible.”, así como en el principio \nexpuesto en el artículo 2.2.1.1.2.2. literal d), “El aprovechamiento sostenible de la flora silvestre y de los \nbosques es una estrategia de conservación y manejo del recurso. Por lo tanto, el Estado debe crear un \nambiente propicio para las inversiones en materia ambiental...” (negrita fuera de texto). Así las cosas, la \ncobertura de herbazal denso de tierra firme no arbolado hace parte de la flora silvestre de acuerdo con el \nprincipio en mención; por otro lado, esta norma solo hace la distinción de no requerir solicitud de \naprovechamiento forestal para las plantaciones forestales o cercas vivas como se enuncia en su artículo \n2.2.1.1.12.9. \nEn relación con el argumento que La Sociedad presenta a que el herbazal denso de tierra firme no arbolado \n“no debe tratarse como un aprovechamiento forestal en un bosque” como lo indica la metodología \nCORINE Land Cover, y que esta Autoridad le está dando una connotación a la unidad de cobertura, es de \naclarar que la ANLA no está dando ninguna connotación de la unidad de cobertura vegetal mencionada, y \nsi bien la metodología CORINE Land Cover adaptada para Colombia no se refiere al aprovechamiento \nforestal sino a una leyenda nacional para la elaboración del mapa de coberturas de la tierra y su descripción, \nes la Sociedad quien incluye la cobertura herbazal denso de tierra firme no arbolado dentro de la solicitud \nde aprovechamiento forestal, dado que se tiene previsto realizar una intervención sobre esta cobertura,  y \nde acuerdo con los términos de referencia HI-TER-1-03 de 2010 es necesario cumplir con el error de \nmuestreo inferior al quince por ciento (15%) como se detalla en el numeral 4.6 Aprovechamiento forestal: \n“…Se deberá presentar un inventario forestal de las unidades de cobertura vegetal de las cuales se \nsolicita aprovechamiento forestal mediante un muestreo estadístico que deberá cumplir con un error \nde muestreo no superior al 15% y una probabilidad del 95%. Así mismo, se deberá presentar los \nvolúmenes comercial y total a ser aprovechado por tipo de cobertura vegetal…” (Negrita fuera de texto). \nRespecto a las definiciones que expone la Sociedad de aprovechamiento y aprovechamiento forestal en el \ndecreto 2278 de 1953 y decreto 1791 de 1996 compilado en el Decreto 1076 de 2015, refiriéndose a que \npara el herbazal denso de tierra firme no arbolado no aplica la definición de aprovechamiento forestal que \nes el único concepto considerado en el numeral 6.5 de la Metodología General para la Presentación de \nEstudios Ambientales del 2018, es de mencionar que el numeral 6.5 APROVECHAMIENTO FORESTAL de \nlos términos de referencia de la metodología aludida expone que es necesario un censo o muestreo \nestadístico que debe cumplir con un error de muestreo no superior al 15% y una probabilidad del 95% en \nlas unidades de cobertura vegetal donde se prevé realizar la intervención de individuos arbóreos en \nrelación con las actividades y obras del proyecto, así como la presentación de un cuadro resumen por tipo \nde cobertura vegetal de los principales parámetros estadísticos conducentes al cálculo del error de \nmuestreo.  \nPor otro lado, lo que expone la Sociedad en reconocer la condición del herbazal denso de tierra firme no \narbolado como una cobertura no boscosa con presencia ocasional de árboles, que puede darse de manera \naislada, y para la cual no rige la misma rigurosidad estadística en el cumplimiento del error de muestreo, es \nde reiterar por parte de este Equipo Técnico Evaluador que en los términos de referencia HI-TER-1-03 de \n2010 y de la Metodología General para la Elaboración y Presentación de Estudios Ambientales del 2018, la \nsolicitud de aprovechamiento forestal se realiza sobre las unidades de cobertura vegetal a intervenir por \nel desarrollo del proyecto, y sobre las cuales se debe presentar un inventario forestal mediante un muestreo \nestadístico que deberá cumplir con un error de muestreo no superior al quince por ciento (15%) y una \nprobabilidad del noventa y cinco por ciento (95%). Así mismo, cuando no es posible realizar un muestreo \nrepresentativo por una alta dispersión generada por una variabilidad muy alta sobre coberturas vegetales a \nintervenir, es necesario realizar un inventario forestal al 100%. \n\nResolución No. 2651       Del 14 NOV. 2023          Hoja No. 70 de 108 \n \n“Por la cual se resuelve un recurso de reposición contra la Resolución 1885 del 25 de agosto de 2023” \nPágina 70 de 108 \n \nEn cuanto a lo que la Sociedad menciona de considerar inadecuado restringir el aprovechamiento forestal \na áreas sin interacción con ecosistemas sensibles, es de mencionar que de acuerdo con el ejercicio \nrealizado por parte de este Equipo Técnico Evaluador en el análisis regional del numeral 10.6.2 del concepto \ntécnico No. 5269 del 24 de agosto de 2023, cuyo resultado es consistente con el ejercicio a escala local \nrealizado por La Sociedad del análisis de conectividad funcional presentado en el capítulo 3. \nCARACTERIZACIÓN DEL AREA DE INFLUENCIA DE PROYECTO de la información adicional allegada, la \nmayoría de los fragmentos asociados, entre los que se encuentran la vegetación secundaria, son áreas de \nimportancia para el mantenimiento de las poblaciones de fauna, siendo necesaria su conservación.  \nAsí mismo, acorde con lo indicado por la Sociedad en los modelamientos de conectividad ecológica \nfuncional para las tres especies focales, como los resultados a nivel regional del ejercicio realizado por este \nEquipo Técnico Evaluador, las coberturas de vegetación secundaria alta y vegetación secundaria baja \nconstituyen una oferta importante de hábitat para la fauna silvestre (ver siguiente figura), y que corresponden \ntan solo al 0,58% de las coberturas presentes en el área de influencia del proyecto, y que como lo expuso \nla Sociedad en el documento de información adicional, son hábitat de importancia ecológica para la fauna \nlocal y regional, por lo cual su mantenimiento es necesario para la funcionalidad ecológica y por lo tanto se \nconsideró necesario negar la solicitud de aprovechamiento forestal sobre dichas coberturas. \n \n \n \nEn relación con el argumento de que la intervención de herbazal denso de tierra firme no arbolado genera \nlos menores impactos respecto a la intervención de cualquier otra cobertura existente en la zona, y por lo \ncual las decisiones deberían tener en cuenta los impactos y principio de equidad, se precisa a la Sociedad \nque la solicitud de aprovechamiento forestal presentada, donde se incluyó por parte de la misma la cobertura \n\nResolución No. 2651       Del 14 NOV. 2023          Hoja No. 71 de 108 \n \n“Por la cual se resuelve un recurso de reposición contra la Resolución 1885 del 25 de agosto de 2023” \nPágina 71 de 108 \n \nvegetal de herbazal denso de tierra firme no arbolado, se rige bajo los términos de referencia HI-TER-1-03 \npara proyectos de explotación de hidrocarburos y los de la Metodología General para la Elaboración y \nPresentación de Estudios Ambientales del 2018, en los cuales indica“…Se deberá presentar un inventario \nforestal de las unidades de cobertura vegetal de las cuales se solicita aprovechamiento forestal \nmediante un muestreo estadístico que deberá cumplir con un error de muestreo no superior al 15% y \nuna probabilidad del 95%” (Negrita fuera de texto), y que para la cobertura de herbazal denso de tierra \nfirme no arbolado caracterizada por la Sociedad se obtuvo un error de muestreo de 30,29%, con lo cual no \nes  posible para este Equipo Técnico Evaluador dar viabilidad ambiental sobre esta, toda vez que la \ninformación estadística no es representativa de acuerdo con lo anteriormente expuesto. \nPor otro lado, la Sociedad menciona la imposibilidad de ejecución de las estrategias aprobadas en el artículo \nséptimo de la resolución debido a la restricción de intervención en las coberturas de herbazal denso de tierra \nfirme no arbolado, para lo cual es de mencionar que las decisiones de este Equipo Técnico Evaluador se \nbasan en la información entregada por la Sociedad y obedece a criterios técnicos basados en los términos \nde referencia  HI-TER-1-03 para proyectos de explotación de hidrocarburos y los de la Metodología General \npara la Elaboración y Presentación de Estudios Ambientales del 2018, y no son arbitrarios. Así mismo, es \nde aclarar que las restricciones son para el aprovechamiento forestal y no para la intervención de la \ncobertura vegetal, y que dicha intervención puede ser efectiva para el desarrollo del proyecto con diseños \nadecuados donde no haya presencia de árboles, y en caso de ser necesario se podrá hacer uso de los 20 \nm3 amparado en el artículo 2.2.1.1.9.6 del decreto 1076 de 2015. \nPor todo lo anteriormente expuesto, este Equipo Técnico Evaluador considera pertinente confirmar lo \nestablecido en el artículo vigésimo séptimo de la Resolución 1885 del 2023, manteniéndose las restricciones \nsobre el aprovechamiento forestal en las coberturas de herbazal denso de tierra firme no arbolado y \nvegetación secundaria baja objeto del recurso. \nCONSIDERACIONES JURÍDICAS \nLa Sociedad solicitó reponer en el sentido de modificar el artículo vigésimo séptimo, autorizando el \naprovechamiento forestal solicitado para las coberturas de herbazal denso de tierra firme no arbolado \ny vegetación secundaria que corresponde a un volumen total de 195,15 m3, argumentando entre otros, \nque el herbazal al no tratarse de una cobertura boscosa, no debe manejarse en términos del \naprovechamiento forestal, ya que el aprovechamiento de bosques naturales y de cobertura vegetal \ncon presencia de bosques aislados, son conceptos diferentes, citando algunos artículos del Decreto \n1076 de 2015.  \nIgualmente, señaló que el herbazal denso de tierra firme no arbolado caracterizado, por ser una \ncobertura vegetal no boscosa, donde la ocurrencia de individuos arbóreos se da de manera aislada, \nno se encuentra sujeta al cumplimiento del error de muestreo para coberturas boscosas, el cual no \ndebe ser superior al quince por ciento (15%) con una probabilidad del noventa y cinco por ciento (95%) \nsegún los estadígrafos requeridos. \nAsí mismo, mencionó respecto al aprovechamiento de vegetación secundaria baja, dado que esta \nunidad de cobertura podría encontrarse también asociada a vías u obras de infraestructura que no se \nlocalizan en cercanías a bosques, palmares o cuerpos de agua, no se considera adecuado restringir \nel aprovechamiento a la totalidad de la cobertura. \n\nResolución No. 2651       Del 14 NOV. 2023          Hoja No. 72 de 108 \n \n“Por la cual se resuelve un recurso de reposición contra la Resolución 1885 del 25 de agosto de 2023” \nPágina 72 de 108 \n \nAl respecto, la Autoridad señala que cualquier cobertura vegetal al interior de un proyecto, obra o \nactividad sujeta a licencia ambiental debe ser caracterizado. En caso de que las actividades del \nproyecto afecten ese componente (biótico), se deberá solicitar permiso y proponer las medidas \npertinentes para mitigar o corregir por ese impacto (a menos que se trate de plantaciones forestales \ncomerciales). Los Términos de Referencia HI-TER-1-03 de 2010 y la Metodología General para la \nElaboración y Presentación de Estudios Ambientales del 2018, establecen qué tipo información se \ndebe aportar y cómo aportarla para que la autoridad evalué la posibilidad de otorgar la licencia \nambiental y los diferentes permisos que la acompañan. \n \nPara este caso, el solicitante no cumplió con esos requisitos mínimos que exige la norma ambiental y \npor ende no se otorgó el permiso para totalidad de las coberturas solicitadas, no tratándose de una \n\"restricción\" como pretende hacer ver el recurrente, sino una negación por insuficiencia de información. \n \nLo anterior, se refuerza además; por el hecho (traído por la Sociedad) verificable que en otros \nproyectos de hidrocarburos similares, se permitió la infraestructura petrolera del proyecto, en áreas \ncon ese tipo de coberturas. Por lo cual, no se trató de una falta de equidad; sino de verificación del \ncumplimiento de requisitos, lo que puede diferenciar que en casos similares se den decisiones \ndiferentes. \n \nFrente a lo argumentado por la Sociedad, en cuanto a que solo se encuentra reglamentado el \naprovechamiento forestal de la flora silvestre en áreas de bosque y no de otros tipos de vegetación; \nesta Autoridad le indica que la norma mencionada, no hace este tipo de distinción. \nPor lo cual, el herbazal denso de tierra firme no arbolado, al ser una cobertura natural, es considerada \nflora silvestre que puede ser objeto de aprovechamiento y sobre la cual debe obtenerse el respectivo \npermiso. En ese sentido, es preciso señalar que el aprovechamiento forestal no se limita al bosque, \nse hace extensivo a toda cobertura natural y seminatural, pastos arbolados, entre otros. Ahora bien, \nsi se trata de una plantación forestal que tiene registro ante el ICA, de carácter comercial o industrial, \nno necesitaría de un permiso de aprovechamiento, conforme lo establece el Decreto 1532 de 2019, \nasí como el aprovechamiento de las cercas vivas y barreras rompeviento, que no requieren de permiso \no autorización, según la norma ibídem,  \nPor lo anterior, resulta claro, que el permiso de aprovechamiento permite usar o aprovechar un recurso \nnatural, que para este caso, resulta ser forestal independientemente de la cobertura en que se \nencuentre.  \nEl uso de los recursos naturales tiene unas condiciones para ejecutarse y para estos proyectos, se \nencuentra establecida una metodología, la cual indica que para cualquier cobertura que se vaya \naprovechar, se requiere el cumplimiento del error de muestreo. Dicha metodología en su numeral 6.5 \nexpone que es necesario un censo o muestreo estadístico que debe cumplir con un error de muestreo \nno superior al 15% y una probabilidad del 95% en las unidades de cobertura vegetal donde se prevé \nrealizar la intervención de individuos arbóreos en relación con las actividades y obras del proyecto, así \ncomo la presentación de un cuadro resumen por tipo de cobertura vegetal de los principales \nparámetros estadísticos conducentes al cálculo del error de muestreo. Por lo cual, si bien, el artículo \n2.2.1.1.5.7. del Decreto 1076 de 2015, establece el inventario para los aprovechamientos forestales \n\nResolución No. 2651       Del 14 NOV. 2023          Hoja No. 73 de 108 \n \n“Por la cual se resuelve un recurso de reposición contra la Resolución 1885 del 25 de agosto de 2023” \nPágina 73 de 108 \n \núnicos de bosque natural, la metodología en mención indica que debe tenerse en cuenta las unidades \nde cobertura vegetal a intervenir por el desarrollo del proyecto. \nFrente a lo argumentado, y sumado a lo técnicamente expuesto, se tiene que fue la misma Sociedad, \nquien propuso el aprovechamiento forestal de la cobertura vegetal de herbazal denso de tierra firme \nno arbolado, no obstante, luego de revisarse la información adicional allegada, se tiene que para dicha \ncobertura la sociedad obtuvo un error de muestreo de 30,29%, es decir, no cumplió con el error de \nmuestreo que debe ser inferior al 15% y probabilidad del 95%, conforme con lo establecido en el \nartículo  2.2.1.1.5.7 del decreto 1076 de 2015 y los términos de referencia HI-TER-1-03 de 2010 y de \nla Metodología General para la Elaboración y Presentación de Estudios Ambientales del 2018, \nincumpliendo así, el muestreo requerido para las coberturas que pretendía aprovechar, por lo cual no \nera posible dar viabilidad a la solicitud requerida. \nAsí mismo, esta Autoridad tuvo en cuenta los modelamientos de conectividad ecológica funcional \npresentados por la Sociedad y de acuerdo al análisis realizado en el Concepto Técnico 5269 del 24 \nde agosto de 2023, la mayoría de los fragmentos asociados, como la vegetación secundaria, son áreas \nde importancia para el mantenimiento de las poblaciones de fauna, siendo necesaria su conservación. \nFrente a lo anterior, la Corte Constitucional ha manifestado en Sentencia C-035 de 2016. Lo siguiente:  \n“El modelo de desarrollo sostenible pretende garantizar el crecimiento económico de forma que se \nasegure el bienestar social y la preservación de los recursos naturales. Aunque la jurisprudencia \nha reconocido que ni la libertad económica, ni la conservación ambiental son valores absolutos a \nla luz en la Constitución Política, sí ha señalado que, en algunos eventos, en particular en \ntratándose de ecosistemas estratégicos, el crecimiento económico debe ceder a la protección \nambiental, de forma que se prohíba el ejercicio de ciertas actividades que, si bien producen riqueza \ntienen un alto costo en términos ecológicos.” \nDe acuerdo con la jurisprudencia transcrita, las Autoridades Ambientales deben imponer las medidas \nde compensación, mitigación o restauración necesarias, a fin de garantizar el desarrollo sostenible, \npreservando los recursos naturales, de tal forma que se busque en los proyectos, obras o actividades \nde su competencia, la reducción del uso y aprovechamiento de recursos, en aras de su preservación.  \nPor lo anterior, esta Autoridad en cumplimiento de sus funciones de protección al ambiente, \nfundamentada en la información entregada por la Sociedad y en atención a criterios técnicos basados \nen los términos de referencia  HI-TER-1-03 para proyectos de explotación de hidrocarburos y los de \nla Metodología General para la Elaboración y Presentación de Estudios Ambientales del 2018, no \nautoriza el aprovechamiento forestal para las coberturas de herbazal denso de tierra firma no arbolado \ny vegetación secundaria y en su lugar se confirma el artículo vigésimo séptimo de la Resolución 1885 \nde 2023, teniendo en cuenta lo expuesto previamente, conforme lo permite el artículo 44 de la Ley \n1437 de 2011. \nRespecto al principio de equidad, argumentado por la sociedad en el que indicó que en otros proyectos \nde hidrocarburos aledaños a este, “la infraestructura petrolera (en un 98%) se ubica sobre el herbazal \ndenso de tierra firme no arbolado debido a que son las coberturas con menor vulnerabilidad ambiental” \ny que por lo cual la toma de decisiones por parte de la Autoridad se deben sustentar en dicho principio. \n\nResolución No. 2651       Del 14 NOV. 2023          Hoja No. 74 de 108 \n \n“Por la cual se resuelve un recurso de reposición contra la Resolución 1885 del 25 de agosto de 2023” \nPágina 74 de 108 \n \nLa Ley 1437 de 2011, en su artículo 3 establece que las actuaciones administrativas deberán \ndesarrollarse con arreglo a varios principios del derecho administrativo, uno de ellos la igualdad, \ndefinida como: “Dar el mismo trato y protección a las personas e instituciones que intervengan en las \nactuaciones bajo su conocimiento. (…). En ese sentido, esta Autoridad al momento de evaluar \ncualquier solicitud de licenciamiento ambiental o su modificación, si bien realiza el análisis no solo en \nlos procedimientos, términos de referencia o metodologías establecidos para su evaluación, debe \ntener en cuenta las características y condiciones presentadas para cada proyecto, atendiendo sus \nparticularidades. En ese sentido, aunque se desarrollen proyectos similares en un área cercana, las \ncondiciones propuestas de ejecución de las obras y/o actividades pueden determinar la variabilidad \nen la decisión del instrumento ambiental; y de cualquier manera, las decisiones basadas en criterios \ntécnicos pueden dar lugar en algunos eventos a la existencia de márgenes de apreciación que pueden \nconfigurarse como facultades de naturaleza discrecional. Sumado a ello, y como fue ampliamente \ndesarrollado, la sociedad no cumplió con los términos de referencia y la metodología establecida para \nla solicitud de aprovechamiento, lo que no permitió su viabilidad ambiental.   \n11) OBLIGACION RECURRIDA –LITERAL i DEL NUMERAL 7 DEL ARTÍCULO SEGUNDO DE LA \nRESOLUCIÓN 1885 DEL 25 DE AGOSTO DE 2023 \n \n“ARTÍCULO SEGUNDO: Modificar el artículo segundo de la Resolución 2035 del 15 de octubre de 2010, \nmodificada por la Resolución 987 de 2011, 261 de 2013, entre otras, en el sentido de adicionar la \nautorización de visita ambiental de las siguientes actividades para el desarrollo del proyecto “Área de \nExplotación de Hidrocarburos Quifa”: \n(…) \n7. APOYO OPERACIONAL ENTRE CAMPOS \nSe autoriza desde el punto de vista ambiental la entrega y recibo de aguas residuales industriales tratadas \no sin tratamiento con otros campos cercanos de Frontera Energy Corp., y el socio Ecopetrol S.A., que se \nrelacionan a continuación: \n(…) \ni) Área de Explotación de Hidrocarburos Quifa Norte- Norte, LAV0037-00-2015. \n(…)”. \nPETICIÓN DE LA SOCIEDAD  \n \nSe solicita aclarar el error de digitación en el número de expediente incluido en la resolución 1885 de 2023 \npara el Área de Explotación de Hidrocarburos Quifa Norte-Norte, el cual corresponde al LAV0033-00-2015 \ny no al LAV0037-00-2015. Adicionalmente, se solicita a la ANLA aclarar la palabra visita en el encabezado \ndel artículo segundo. \nARGUMENTOS DE LA SOCIEDAD \n \nEn la resolución, Frontera evidenció un error de digitación ya que el número de expediente asignado por la \nANLA para el proyecto “Área de Explotación de Hidrocarburos Quifa Norte-Norte”, de acuerdo con la \n\nResolución No. 2651       Del 14 NOV. 2023          Hoja No. 75 de 108 \n \n“Por la cual se resuelve un recurso de reposición contra la Resolución 1885 del 25 de agosto de 2023” \nPágina 75 de 108 \n \nVentanilla Integral de Tramites Ambientales – VITAL, corresponde al LAV0033-00-2015, y no al LAV0037-\n00-2015, por lo que es pertinente hacer la debida aclaración.  \nAdicionalmente, se evidenció que el encabezado del numeral 7 del artículo segundo de la resolución se \nincluyó la palabra visita y no vista como entiende la Compañía se quería establecer. El mencionado artículo \nestableció: “Modificar el artículo segundo de la Resolución 2035 del 15 de octubre de 2010, modificada por \nla Resolución 987 de 2011, 261 de 2013, entre otras, en el sentido de adicionar la autorización de visita \nambiental de las siguientes actividades para el desarrollo del proyecto “Área de Explotación de \nHidrocarburos Quifa”:  \nCONSIDERACIONES TÉCNICAS DE LA ANLA \n \nDe acuerdo con los argumentos de la Sociedad y una vez verificado en el Sistema de Información de \nLicencias Ambientales – SILA, el expediente LAV0033-00-2015 en efecto corresponde al proyecto “Área de \nExplotación de Hidrocarburos Quifa Norte-Norte”, razón por la cual se considera pertinente realizar el ajuste \nsobre el error de digitación del expediente que quedó señalado en la Resolución 1885 de 2023. \n \nAsí mismo, se considera pertinente ajustar el artículo segundo dado que se presentó un error de digitación, \nya que el sentido de esta no es realizar una visita ambiental, sino dar viabilidad desde el punto de vista \nambiental a las actividades necesarias para el desarrollo del proyecto “Área de Explotación de Hidrocarburos \nQuifa”. \n \nEn virtud de lo anterior, se recomienda MODIFICAR la obligación de la siguiente manera: \nARTÍCULO SEGUNDO: Modificar el artículo segundo de la Resolución 2035 del 15 de octubre de 2010, \nmodificada por la Resolución 987 de 2011, 261 de 2013, entre otras, en el sentido de adicionar desde el \npunto de vista ambiental las siguientes actividades para el desarrollo del proyecto “Área de Explotación de \nHidrocarburos Quifa”: \n(…) \n7. APOYO OPERACIONAL ENTRE CAMPOS \nSe autoriza desde el punto de vista ambiental la entrega y recibo de aguas residuales industriales tratadas \no sin tratamiento con otros campos cercanos de Frontera Energy Corp., y el socio Ecopetrol S.A., que se \nrelacionan a continuación: \n(…) \ni) Área de Explotación de Hidrocarburos Quifa Norte- Norte, LAV0033-00-2015. \n \n(…) \nCONSIDERACIONES JURÍDICAS \nEn atención a la posibilidad de modificar los actos administrativos mediante la interposición de recurso \nde reposición y de conformidad con lo establecido en el artículo 45 de la Ley 1437 de 2011 “Código \nde Procedimiento Administrativo y de lo Contencioso Administrativo”, de corregir los errores formales \nde digitación contenidos en los actos administrativos, se realizará la corrección mencionada en el \n\nResolución No. 2651       Del 14 NOV. 2023          Hoja No. 76 de 108 \n \n“Por la cual se resuelve un recurso de reposición contra la Resolución 1885 del 25 de agosto de 2023” \nPágina 76 de 108 \n \nargumento técnico, en el encabezado del artículo segundo y el literal i del numeral 7 del mismo artículo, \nlo cual quedará consignado en la parte resolutiva del presente acto administrativo. Lo anterior, \nteniendo en cuenta que no cambia el sentido material de la decisión. \n12) OBLIGACION RECURRIDA – LITERAL D DE LA FICHA PMSB-3 – MANEJO DE FAUNA DEL \nARTÍCULO TRIGÉSIMO SEGUNDO DE LA RESOLUCIÓN 1885 DEL 25 DE AGOSTO DE 2023 \n \n“ARTÍCULO TRIGÉSIMO SEGUNDO: La sociedad Frontera Energy Colombia Corp. Sucursal \nColombia., deberá en el término de tres (3) meses contados a partir de la ejecutoria de este acto \nadministrativo, ajustar los siguientes programas del Plan de Manejo Ambiental, establecidos para \nel proyecto “Área de Desarrollo de Hidrocarburos Quifa”:  \n \n(…)  \n \nPROGRAMA DE SOSTENIBILIDAD \n \n(…) \n \nFICHA: PMSB-3 - Manejo de fauna \n(…) \n \nd. En cada Informe de Cumplimiento Ambiental, se deberá presentar el registro periódico (mensual) \ny estandarizado del uso del sistema de pasos de fauna por especies silvestres, información que \ntambién debe registrarse en la capa “punto de muestreo fauna” o en la que se actualice para tal fin \ndentro del modelo de datos vigente. En caso tal de identificarse cambios en las rutas de \nmovilización con el paso del tiempo, dichas rutas deberán ser reportadas en cada ICA a esta \nAutoridad Ambiental. Para el cumplimiento de este objetivo se podrán utilizar cámaras trampa, \nsiendo deseables seguimientos de telemetría en individuos, para garantizar la evaluación de los \npasos de fauna efectivamente utilizados por las especies (…)” \n \nPETICIÓN DE LA SOCIEDAD  \n \nLa Compañía solicita respetuosamente a esta Autoridad Ambiental modificar el Artículo trigésimo \nsegundo de la Resolución en el sentido de establecer que para la fase de producción del proyecto \nla periodicidad del registro estandarizado para el uso del sistema de pasos de fauna establecido \npor ANLA en la ficha PMSB-3 - Manejo de fauna será anual para la fase de producción, y mensual \nen las fases constructiva y de perforación. \nARGUMENTOS DE LA SOCIEDAD \n \nFrontera considera que las obligaciones establecidas por ANLA para la ficha PMSB-3 - Manejo de \nfauna son pertinentes para garantizar la prevención en el atropellamiento a la fauna de la zona; sin \nembargo, frente a dichas obligaciones, se debe tener en cuenta que la actividad por la cual \npotencialmente se configuraría una afectación al componente faunístico con el aumento en los \n\nResolución No. 2651       Del 14 NOV. 2023          Hoja No. 77 de 108 \n \n“Por la cual se resuelve un recurso de reposición contra la Resolución 1885 del 25 de agosto de 2023” \nPágina 77 de 108 \n \neventos de atropellamiento, se relaciona con el incremento en el tránsito por la actividad petrolera, \nque se da principalmente durante las fases constructiva y de perforación del proyecto por la \nmovilización y operación de maquinaria, materiales, equipos, personal y transporte de fluidos que, \nen la fase de producción, se ve significativamente reducida. \nLa instalación de pasos de fauna que respondan a las necesidades de las especies de mayor \nafectación, se realizará teniendo en cuenta aquellas áreas donde los monitoreos desarrollados en \nel marco de los Planes de Manejo Ambiental Específicos indiquen un alto potencial de movilización \nde fauna, y que por tanto, la construcción o adecuación de vías requeridas para el proyecto, así \ncomo el tráfico vehicular constante, puede resultar en el incremento de los eventos de \natropellamiento, siendo que durante estas fases de construcción y de perforación es cuando la \nCompañía considera pertinente la ejecución de reportes de seguimiento mensuales. No obstante, \ndurante la fase de producción, el seguimiento al atropellamiento de fauna podría llevarse a cabo \nde manera anual, mediante la implementación de cámaras trampa que se instalen con una duración \nmínima de 60 días, dada la significativa diminución en el tránsito vehicular. \nDadas las características propias del proyecto, para la definición de la periodicidad en el reporte \nestandarizado sobre el uso del sistema de pasos de fauna establecido por ANLA en la ficha PMSB-\n3 - Manejo de fauna, se debería tener en cuenta que durante las fases de construcción y perforación \nes cuando tiene lugar la mayor movilización constante por la actividad petrolera, que se ve \nsignificativamente reducida durante la fase de producción, por lo que para esta fase, la periodicidad \ndel reporte podría llevarse a cabo de manera anual, mediante la implementación de cámaras \ntrampa que se instalen con una duración mínima de 60 días, dada la significativa diminución en el \ntránsito vehicular. \nCONSIDERACIONES TÉCNICAS DE LA ANLA \n \nFrente a la petición de la Sociedad de modificar el Artículo trigésimo segundo de la Resolución \n1885 del 2023 en el sentido de establecer que para la fase de producción del proyecto la \nperiodicidad del registro estandarizado para el uso del sistema de pasos de fauna establecido por \nANLA en la ficha PMSB-3 - Manejo de fauna sea anual para la fase de producción, y mensual en \nlas fases constructiva y de perforación, esta Autoridad reconoce que dicha medida se planteó sin \nespecificar la periodicidad de la misma durante cada fase del proyecto (construcción y perforación, \nproducción). Por lo cual es de aclarar que la periodicidad mensual se refería únicamente a la fase \nde construcción y perforación; esto teniendo en cuenta, por ejemplo, los argumentos de la Sociedad \nque afirman que durante la fase de construcción y perforación el tráfico vehicular será constante y \npuede resultar en el incremento de eventos de atropellamiento de fauna silvestre.  \nPor otra parte, este Equipo Técnico Evaluador considera que para la fase de producción si es \nposible cambiar la periodicidad de los monitoreos; sin embargo, esta se deberá realizar como \nmínimo en tres (3) temporalidades climáticas (seco, lluvia y transición). Esto considerando que la \neficiencia de los pasos de fauna requieren de monitoreos periódicos que permitan identificar tanto \naciertos como elementos a mejorar en  estos con el fin de disminuir los índices de atropellamiento \n\nResolución No. 2651       Del 14 NOV. 2023          Hoja No. 78 de 108 \n \n“Por la cual se resuelve un recurso de reposición contra la Resolución 1885 del 25 de agosto de 2023” \nPágina 78 de 108 \n \nde fauna en las zonas donde se establecen estos4, la movilidad de las especies de fauna entre \nfragmentos, así como fluctuaciones temporales en las rutas de movilización y frecuencia del uso \nque pueden estar relacionadas con las diferentes temporalidades climáticas que se presentan en \nla región (temporada seca, transición, lluvias), y que con una periodicidad corta no es posible medir \nsu efectividad. \nEs importante tener en cuenta que el monitoreo de los pasos de fauna durante la fase de \nproducción estará sujeta a los resultados del seguimiento en la fase de construcción y perforación, \nen donde de identificarse cambios en las rutas de movimiento de los organismos con el paso del \ntiempo, se podrá replantear la localización de los pasos y su seguimiento, más no su periodicidad \nde monitoreo. Lo anterior deberá ser reportado en cada ICA a esta Autoridad Ambiental.  \nDe acuerdo con lo anterior, este Equipo Técnico Evaluador considera pertinente modificar lo \nestablecido en el artículo trigésimo segundo de la Resolución 1885 del 2023, en relación con lo \nseñalado en el literal d) de la ficha PMSB-3 – Manejo de fauna, así:  \n \nd. En cada Informe de Cumplimiento Ambiental, se deberá presentar para las fases de \nconstrucción y de perforación el registro periódico mensual y estandarizado del uso del sistema \nde pasos de fauna por especies silvestres, información que también debe registrarse en la capa \n“punto de muestreo fauna” o en la que se actualice para tal fin dentro del modelo de datos vigente. \nPara la fase de producción el monitoreo a los pasos de fauna se deberá realizar como \nmínimo en tres (3) temporalidades climáticas (seco, lluvia y transición). En caso tal de \nidentificarse cambios en las rutas de movilización con el paso del tiempo, dichas rutas deberán ser \nreportadas en cada ICA a esta Autoridad Ambiental. Para el cumplimiento de este objetivo se \npodrán utilizar cámaras trampa, siendo deseables seguimientos de telemetría en individuos, para \ngarantizar la evaluación de los pasos de fauna efectivamente utilizados por las especies.  \n \nCONSIDERACIONES JURÍDICAS \nEn atención a la solicitud de la Sociedad de modificar el literal d) del artículo trigésimo segundo de la \nResolución 1885 de 2023, a fin de establecer que para la fase de producción del proyecto la \nperiodicidad del registro estandarizado para el uso del sistema de pasos de fauna de la ficha PMSB-\n3, sea anual y para las fases constructivas y de perforación sea mensual, argumentando que el \nincremento del tránsito por la actividad petrolera es distinta para las etapas de construcción y \nperforación y de producción. Se tiene que: \nLa Autoridad ambiental al otorgar una licencia ambiental establece obligaciones a las cuales debe dar \ncumplimiento su titular, conforme el artículo 2.2.2.3.1.3 del Decreto 1076 de 2015, que reza: “La \nlicencia ambiental, es la autorización que otorga la autoridad ambiental competente para la ejecución \nde un proyecto, obra o actividad, que de acuerdo con la ley y los reglamentos, pueda producir deterioro \ngrave a los recursos naturales renovables o al medio ambiente o introducir modificaciones \nconsiderables o notorias al paisaje; la cual sujeta al beneficiario de esta, al cumplimiento de los \n \n4 Patrimonio Natural. 2020. Pasos de fauna en infraestructura lineal: Cartilla de referencia para toma de decisiones. \nContrato GEF CA-CPS-007 de 2020 – Darío Correa Quiñones. \n\nResolución No. 2651       Del 14 NOV. 2023          Hoja No. 79 de 108 \n \n“Por la cual se resuelve un recurso de reposición contra la Resolución 1885 del 25 de agosto de 2023” \nPágina 79 de 108 \n \nrequisitos, términos, condiciones y obligaciones que la misma establezca en relación con la \nprevención, mitigación, corrección, compensación y manejo de los efectos ambientales del proyecto, \nobra o actividad autorizada”. (subrayado y negrilla fuera de texto). Por lo que, en atención a la \nprevención de los efectos ambientales del proyecto, se impuso la medida, pero sin especificar la \nperiodicidad de las fases del proyecto. \nFrente a lo anterior, y sumado a los argumentos técnicos expuestos, la Autoridad considera viable \nambientalmente, modificar el literal mencionado, teniendo en cuenta que para la fase de producción si \nes posible cambiar la periodicidad de los monitoreos; realizándose como mínimo en tres (3) \ntemporalidades climáticas (seco, lluvia y transición) y que estará sujeta a los resultados del \nseguimiento en las fases de construcción y perforación, para las cuales, el registro periódico será \nmensual y estandarizado. En ese sentido, con el fin de disminuir los índices de atropellamiento de la \nfauna en la zona e identificar cambios en las rutas de movimiento de los organismos con el paso del \ntiempo, la Autoridad considera pertinente modificar el literal d) de la Ficha PMSB-3 Manejo de fauna. \n13) OBLIGACION RECURRIDA – LITERAL A ARTICULO DÉCIMO PRIMERO DE LA RESOLUCIÓN \n1885 DEL 25 DE AGOSTO DE 2023 \n \n“ARTÍCULO DÉCIMO PRIMERO: Modificar el numeral 10 del artículo segundo de la Resolución 261 e 2013, \nen el sentido de incluir dentro de la autorización ambiental lo siguiente: \n \na) Construcción y operación de Centros de maniobra y subestación eléctrica PAD 1, la cual se localizará \nsobre el límite sur del PAD 1, en un área de 0,69 ha y en las siguientes coordenadas: \n \nLocalización subestación PAD1. \n \n(…)” \n \nPETICIÓN DE LA SOCIEDAD  \n\nResolución No. 2651       Del 14 NOV. 2023          Hoja No. 80 de 108 \n \n“Por la cual se resuelve un recurso de reposición contra la Resolución 1885 del 25 de agosto de 2023” \nPágina 80 de 108 \n \n \nSe solicita respetuosamente a la ANLA corregir en la tabla de coordenadas de localización de la Subestación \nPAD 1 los vértices 7 y 8, establecidos en el literal a del artículo décimo primero de la Resolución dejando \nlas siguientes coordenadas. \n \n \n \nARGUMENTOS DE LA SOCIEDAD \n \nLa ANLA en la parte considerativa de la Resolución señala que: \n \n“La Sociedad propone se autorice la generación eléctrica de la siguiente manera: \n \nConstrucción y operación de Centros de maniobra y subestación eléctrica PAD 1. El área donde va a \nintervenir para la construcción de la Subestación PAD 1, se localiza sobre el límite sur del PAD 1, \ncorresponde a un área plana a levemente ondulada con pendientes que no superan el 7%; y se proponen \nlas siguientes coordenadas para la ubicación de la subestación eléctrica del PAD 1, en un área de 0,69 ha: \n \nTabla 27. Localización subestación PAD1. \n \n(ver tabla del numeral 4.13.1 del Recurso de Reposición). \n \nEs importante señalar que en el Capítulo 2 Parte 2 página 237 del EIA presentado con comunicado \n2022283750-1-000 del 16 de diciembre de 2022, radicado VITAL 3500830126302222050, se presentó un \nerror de transcripción por lo cual, este mismo error se evidencia en la tabla referenciada por la ANLA (EIA \nes la tabla 2-88). Se puede observar que las coordenadas de los vértices 5 y 6 se encuentran repetidos con \nlos vértices 7 y 8. Adicional a ello en la siguiente imagen se puede observar lo mencionado: \n \n\nResolución No. 2651       Del 14 NOV. 2023          Hoja No. 81 de 108 \n \n“Por la cual se resuelve un recurso de reposición contra la Resolución 1885 del 25 de agosto de 2023” \nPágina 81 de 108 \n \n \nLas coordenadas correctas de la subestación eléctrica del PAD 1 son las que se mencionan a continuación:  \n \n \n \nComo se expuso, debido a un error de digitación no fue definido correctamente el polígono solicitado para \nla localización de la Subestación PAD 1 en los vértices 7 y 8 ya que estos se encuentran repetidos. \n \nCONSIDERACIONES TÉCNICAS DE LA ANLA \n \n\nResolución No. 2651       Del 14 NOV. 2023          Hoja No. 82 de 108 \n \n“Por la cual se resuelve un recurso de reposición contra la Resolución 1885 del 25 de agosto de 2023” \nPágina 82 de 108 \n \nUna vez analizados los argumentos presentados por la Sociedad, en efecto en la tabla 2-88 del capítulo 2 \ndel complemento al EIA presentado mediante comunicación con radicado ANLA 2022283750-1-000 del 16 \nde diciembre de 2022, se observa que las coordenadas de los vértices 5 y 6, se repiten para los vértices 7 \ny 8. Ahora bien, en la figura 2-88 del capítulo en mención, se observa el polígono solicitado el cual cuenta \ncon seis (6) vértices conforme las coordenadas ajustas según el presente recurso: \nTabla 1. Localización general de la Subestación PAD 1 \n \nFuente: capítulo 2 del complemento al EIA presentado con comunicación con radicado 2022283750-1-000 del 16 de diciembre de 2022 \n \nEn virtud de lo anterior, se considera pertinente modificar el Artículo Décimo Primero en el sentido de ajustar \nlas coordenadas de la subestación PAD1, de la siguiente manera: \n \nARTÍCULO DÉCIMO PRIMERO: Modificar el numeral 10 del artículo segundo de la Resolución 261 e 2013, \nen el sentido de incluir dentro de la autorización ambiental lo siguiente: \n \na) Construcción y operación de Centros de maniobra y subestación eléctrica PAD 1, la cual se localizará \nsobre el límite sur del PAD 1, en un área de 0,69 ha y en las siguientes coordenadas: \n \nLocalización subestación PAD1 \n \nVÉRTICE \nMAGNA COLOMBIA ESTE \nSISTEMA NACIONAL \nESTE \nNORTE \nESTE \nNORTE \n1 \n952585,512 \n928749,376 \n5165977,281 \n1994818,936 \n2 \n952615,431 \n928756,916 \n5166007,167 \n1994826,542 \n\nResolución No. 2651       Del 14 NOV. 2023          Hoja No. 83 de 108 \n \n“Por la cual se resuelve un recurso de reposición contra la Resolución 1885 del 25 de agosto de 2023” \nPágina 83 de 108 \n \n3 \n952629,489 \n928699,960 \n5166021,350 \n1994769,645 \n4 \n952558,226 \n928682,372 \n5165950,163 \n1994751,901 \n5 \n952533,714 \n928781,687 \n5165925,433 \n1994851,111 \n6 \n952575,021 \n928791,882 \n5165966,697 \n1994861,396 \n9Área = 0,69 ha \n \nCONSIDERACIONES JURÍDICAS \nEn atención a la posibilidad de modificar los actos administrativos mediante la interposición de recurso \nde reposición y de conformidad con lo establecido en el artículo 45 de la Ley 1437 de 2011 “Código \nde Procedimiento Administrativo y de lo Contencioso Administrativo”, de corregir los errores formales \nde digitación contenidos en los actos administrativos, se realizará la corrección mencionada en el \nargumento técnico, en las coordenadas de localización de la subestación eléctrica PAD 1 indicadas \nen el literal a) del artículo décimo primero de la Resolución 1885 de 2023, toda vez que las \ncoordenadas de los vértices 5 y 6, se repiten en el 7 y 8, por lo que estos dos últimos serán eliminados, \nlo cual quedará consignado en la parte resolutiva del presente acto administrativo. Lo anterior, \nteniendo en cuenta que no cambia el sentido material de la decisión. \n14) OBLIGACION RECURRIDA - ARTÍCULO TRIGÉSIMO CUARTO – FICHA PSMB DE LA \nRESOLUCIÓN 1885 DEL 25 DE AGOSTO DE 2023 \n \nARTÍCULO TRIGÉSIMO CUARTO: La sociedad Frontera Energy Colombia Corp. Sucursal Colombia, \ndeberá ajustar los siguientes programas y presentar los soportes de cumplimiento en un término de tres (3) \nmeses contados a partir de la firmeza del presente acto administrativo, de conformidad con las condiciones \nque se presentan a continuación:  \n(…) \nFICHA PSMB 2 Flora y fauna (endémica, en peligro de extinción o vulnerable, entre otras) \n(…) \n3. Establecer un sistema de monitoreo de ruido para la fauna contemplando como mínimo la implementación \nde análisis de bioacústica direccional activo y pasivo, durante la etapa de construcción, operación y \ndesmantelamiento, contemplando las diferentes épocas climáticas y garantizando que los seguimientos se \nrealicen en los mismos momentos cada año. Para esto se deberá tener en cuenta las frecuencias de \ncomunicación de las especies presentes en las áreas de mayor sensibilidad ambiental con mayor cercanía \na la infraestructura a desarrollar que involucre equipos y maquinaria con potencia acústica que pueda \nexceder los niveles máximos permisibles de ruido durante el día (55 dB(A)) y la noche (45 dB(A)), definidos \nen la Resolución 627 de 2006 que se alinean con los umbrales de referencia del Servicio de Evaluación \nAmbiental de Chile-SEIA. Este diseño y las especificaciones técnicas de los equipos en cuanto a potencia \nacústica deberán ser entregados en cada uno de los planes de manejo específicos y en el Informe de \nCumplimiento Ambiental correspondiente, que deberá incluir un análisis comparable de datos a lo largo del \ntiempo y detectar posibles patrones en la respuesta de la fauna al ruido. \nPETICIÓN DE LA SOCIEDAD  \n\nResolución No. 2651       Del 14 NOV. 2023          Hoja No. 84 de 108 \n \n“Por la cual se resuelve un recurso de reposición contra la Resolución 1885 del 25 de agosto de 2023” \nPágina 84 de 108 \n \n \nRevocar el numeral 3, del artículo trigésimo cuarto de la Resolución 1885 del 25 de agosto de 2023, \nconcerniente a la ficha PSMB-2 Flora y fauna (endémica, en peligro de extinción o vulnerable entre otras). \nARGUMENTOS DE LA SOCIEDAD \n \nEn las consideraciones realizadas por la Autoridad Ambiental para la Ficha PSMB2 Flora y Fauna \n(endémica, en peligro de extinción o vulnerable entre otras) páginas 533 y 534 no se registra ningún \nplanteamiento relacionado con el monitoreo de ruido que permita evidenciar la necesidad de adoptar la \nmedida establecida en el Artículo Trigésimo Cuarto, Ficha PSMB-2 Numeral 3. Sin embargo, en la página \n495 se tiene la siguiente consideración realizada para la ficha PMSB-3 Manejo de fauna la cual se relaciona \ncon el tema de ruido en fauna:  \n“Para las demás actividades que contemplen equipos o maquinaria con potencia acústica que puedan \nsuperar los niveles de ruido que superen los niveles de referencia conforme al análisis realizado sobre la \nidentificación y valoración de impactos en el escenario con proyecto para el medio biótico (numeral 11.1.2.2 \ndel concepto técnico), es necesario que previo al establecimiento definitivo de la infraestructura con dichas \ncondiciones, se deberá validar la efectividad de las medidas de mitigación como el establecimiento de \npantallas acústicas propuesto en el sentido que la nueva infraestructura debe instalarse en función del \nalcance de los niveles de presión sonora que pueda representar una afectación a la fauna silvestre, para lo \ncual se sugiere adoptar los niveles máximos permisibles de ruido para el día 55dB(A) y para la noche de 45 \ndB(A) definidos en la Resolución 627 de 2006 del MAVDT hoy MADS, dado que contienen los umbrales de \nreferencia del SEIA empleados en el análisis del Equipo evaluador de la ANLA -EEA.”  \n \nAhora bien, es importante hacer referencia al requerimiento del artículo trigésimo segundo, página 656, \nNumeral 2 de la Resolución que establece:  \n \n“(…) 2. Sobre los niveles de presión sonora: a. Para las actividades del proyecto, que empleen equipos y \nmaquinaria con potencia acústica que puedan exceder los niveles máximos permisibles de ruido durante el \ndía (55 dB(A)) y la noche (45 dB(A)), definidos en la Resolución 627 de 2006 que se alinean con los umbrales \nde referencia del Servicio de Evaluación Ambiental de Chile-SEIA, se debe garantizar una distancia de \nalejamiento que cumpla con los niveles máximos mencionados en su ubicación definitiva con las áreas de \nmayor sensibilidad ambiental, como bosques de galería, palmares, vegetación secundaria alta y herbazales \ninundables (“…”), se establece que la Sociedad realizará acciones que permitan prevenir y mitigar la \nafectación a los grupos faunísticos por generación de ruido en áreas de alta sensibilidad ambiental, evitando \nasí la manifestación de impactos significativos.”  \n \nTeniendo en cuenta lo anterior, la Compañía plantea y tiene como otras obligaciones impuestas, el \ndesarrollo de medidas orientadas a la atenuación de la presión sonara (sic) en la fauna en áreas de \nsensibilidad ambiental como bosques de galería, palmares, vegetación secundaria alta y herbazales \ninundables, a fin de prevenir la manifestación de impactos significativos en relación con la emisión de ruido \nsobre la fauna silvestre.  \n \nDe otra parte, la Resolución 627 de 2006 del Ministerio de Ambiente y Desarrollo Sostenible no establece \nuna metodología para monitoreo de ruido ambiental en áreas de mayor sensibilidad ambiental como lo son \nlos bosques de galería, los palmares, la vegetación secundaria alta, entre otros. La metodología planteada \npor dicha Resolución para la determinación del ruido ambiental establece prácticas y procedimientos para \nrealizar mediciones de ruido ambiental en áreas urbanas y en expansión urbana. En ese sentido, no hay un \núnico instrumento técnico de consulta que permita definir un procedimiento para determinar cómo obtener \n\nResolución No. 2651       Del 14 NOV. 2023          Hoja No. 85 de 108 \n \n“Por la cual se resuelve un recurso de reposición contra la Resolución 1885 del 25 de agosto de 2023” \nPágina 85 de 108 \n \nmediciones representativas en zonas con gran cantidad de superficies de atenuación sonora. Por el \ncontrario, los procedimientos descritos en la citada Resolución evidencian que las mediciones de ruido \nambiental en áreas como la del proyecto deben realizarse por lo menos con 4 metros de distancia de la \nsuperficie qué interfiera en la medición y que se constituye como superficie reflectante, difractante, \nrefractante e inclusive atenuante.  \n \nDadas las limitaciones metodológicas definidas con anterioridad, las acreditaciones para la matriz ruido \nambiental, pierden alcance cuando se trata de la medición de presión sonora en ambiente acústicos con \nvegetación alta y frondosa, de tal forma que la validez de las mediciones de ruido ambiental y los ambientes \ndescritos puede ser cuestionable desde el punto de vista técnico.  \n \nLos monitoreos de ruido ambiental utilizados para el establecimiento de línea base indican que existen zonas \nque se encuentran libres de la influencia de actividad humana y, aun así, muestra ambientes acústicos con \npresiones sonoras superiores a los 55 dB(A) especialmente en horario nocturno, siendo una condición que \nredefine los umbrales máximos de ruido ambiental de acuerdo con los principios establecidos por la \nResolución 627 de 2006 del MADS en el Parágrafo 2 del Artículo 17. En este sentido, ante las dificultades \nmetodológicas de medición expuestas y ante los niveles asociados a la presencia de ruido residual, se \ngenera gran incertidumbre en las mediciones acústicas cuando se trata de realizar determinaciones de ruido \nambiental en pleno bosque de galería palmar, o cobertura de vegetación secundaria alta.  \n \nEn línea con la Resolución 627 de 2006, la Compañía puede concluir que no existe una metodología para \nmonitoreo de ruido ambiental en áreas de mayor sensibilidad ambiental como lo son los bosques de galería, \nlos palmares, la vegetación secundaria alta, entre otros, donde se puede encontrar árboles y arbustos con \nfollaje frondoso y con alturas que pueden llegar a ser superiores a los 4 m, en donde se presentan altos \nniveles de ruido ambiental.  \n \nDadas las limitaciones metodológicas definidas con anterioridad, las acreditaciones para la matriz de ruido \nambiental pierden precisión cuando se trata de la medición de presión sonora en ambiente acústicos con \nvegetación alta y frondosa, de tal forma que la validez de las mediciones de ruido ambiental y los ambientes \ndescritos puede ser cuestionable desde el punto de vista técnico. \n \nCONSIDERACIONES TÉCNICAS DE LA ANLA \n \nInicialmente frente al argumento “…no se registra ningún planteamiento relacionado con el monitoreo de \nruido que permita evidenciar la necesidad de adoptar la medida establecida en el Artículo Trigésimo Cuarto, \nFicha PSMB-2 Numeral 3”, es importante destacar que el pronunciamiento del Equipo Técnico Evaluador \nde la ANLA  se realiza de forma integral y en ese sentido en las consideraciones sobre la evaluación de \nimpactos plasmado en las páginas 438 a 441 de la parte considerativa de la Resolución 1885 del 25 de \nagosto de 2023, incorporado de las páginas 457 a 462 del concepto técnico 5269 del 24 de agosto de 2023 \nacogido por el mencionado acto administrativo, se realiza un análisis detallado sobre los posibles impactos \ndel ruido en fauna por las actividades a desarrollar, como también la posible afectación por las actividades \nque actualmente se desarrollan en el área del proyecto. \n \nPara este análisis, se observó el alcance de las isófonas que fueron realizadas para la caracterización del \nmedio abiótico tanto de la infraestructura existente como de la modelación de las actividades proyectadas, \nincluyendo los evaporadores mecánicos e inducción en etapa de operación. Estos datos se compararon con \nel mapa de coberturas de la tierra, lo que permitió deducir que valores como la Isófona diurna de 55dB \npodría alcanzar los 300 metros aproximadamente, mientras la isófona nocturna de 45dB abarca unos 748 \nmetros (ver figura 61).  Esta información sugiere la posibilidad de que las actividades del proyecto puedan \n\nResolución No. 2651       Del 14 NOV. 2023          Hoja No. 86 de 108 \n \n“Por la cual se resuelve un recurso de reposición contra la Resolución 1885 del 25 de agosto de 2023” \nPágina 86 de 108 \n \ntener un impacto en el comportamiento de la fauna, especialmente en vista de la ubicación de la \ninfraestructura propuesta y la identificación de hábitats de mayor riqueza y abundancia en el área de \ninfluencia del proyecto, esto considerando los umbrales de referencia definidos por el Servicio de Evaluación \nAmbiental de Chile -SEIA que contempla, por ejemplo, que un umbral de 52dB(Z) proveniente de una fuente \ncontinua o intermitente tiene un efecto fisiológico en mamíferos incrementando el estrés fisiológico y un \numbral de 58dB(A) puede tener efectos en la conducta de la avifauna con una disminución en el éxito \nreproductivo.  \n(…) \nPor lo anterior a través del artículo trigésimo primero de la Resolución 1885 del 25 de agosto de 2023, en la \nficha PMSB-3 - Manejo de fauna del Plan de manejo ambiental para el proyecto, el Equipo Evaluador de la \nANLA impuso una medida para la localización de las obras o actividades que involucren equipos con presión \nsonora que superen los niveles de referencia descritos por el SEIA, con la cual se deberá garantizar una \ndistancia de alejamiento entre la fuente generadora de ruido y el receptor, en este caso las áreas de mayor \nsensibilidad ambiental identificadas en el área de influencia del proyecto que prevén a la fauna recursos \npara su sustento, anidación, reproducción, entre otros, medida que la Sociedad referencia en su \nargumentación. \n \nEn segundo lugar, dado que cada medida del PMA debe contener su respectivo seguimiento y monitoreo \npara determinar la eficacia de la medida, como lo define la Metodología general para la elaboración y \npresentación de estudios ambientales (2018), en el aparte que establece lo siguiente: \n \n“El seguimiento y monitoreo a los planes y programas tiene como propósito revisar la eficacia y confiabilidad \nde los mismos, así como identificar potenciales oportunidades de mejora en el desarrollo del proyecto y de \nsus planes y programas, que permitan la aplicación de los ajustes a los que haya lugar. \n \nEste seguimiento y monitoreo se efectúa mediante el cálculo periódico y análisis de los indicadores que se \nformulen para los planes y programas del PMA.…” \nLas actividades de seguimiento y monitoreo objeto de la presente solicitud, se constituye en un herramienta \nque permitirá determinar si la aplicación de la medida de distanciamiento entre fuente y receptor es \nsuficiente, para determinar así la incidencia del impacto “Alteración de la riqueza y abundancia de las \nespecies de fauna terrestre”, considerando los umbrales de referencia del SEIA; dado que el sistema de \nmonitoreo planteado se enfoca en el comportamiento de la fauna a través de métodos no invasivos, de tal \nmanera que al identificar el ruido de fondo característico del entorno de los hábitats de mayor sensibilidad \nque concentra la fauna silvestre y conocidas las fuentes de ruido, se puede analizar cuantitativamente el \nefecto de las actividades del proyecto. \n \nAhora bien, es pertinente aclarar que el objeto de la medida de seguimiento es obtener datos de bioacústica \nmotivo por el cual el monitoreo de ruido ambiental establecido en la Resolución 627 de 2006 no aplica por \nlas razones que la misma Sociedad argumenta, en este caso se relacionan los valores de máximos \npermisibles de niveles de ruido ambiental en dB(A) definidos en dicha norma dado que se ajustan o \ncoinciden con los umbrales de referencia definidos por el Servicio de Evaluación Ambiental de Chile -SEIA, \nque registran alteraciones en los comportamientos de los grupos faunísticos.  \n \nEn cuanto a las limitaciones metodológicas, el sistema de monitoreo de fauna requerido no especifica una \nmetodología en particular; sin embargo, se sugiere que para la captura de información se puede consultar \n\nResolución No. 2651       Del 14 NOV. 2023          Hoja No. 87 de 108 \n \n“Por la cual se resuelve un recurso de reposición contra la Resolución 1885 del 25 de agosto de 2023” \nPágina 87 de 108 \n \nlas publicaciones realizadas por el Instituto de Investigación de Recursos Biológicos Alexander von \nHumboldt (IAvH) como “Recomendaciones para registrar y almacenar señales acústicas como especímenes \ndigitales en Colombia”5, así como el uso de repositorios de grabaciones acústicas de referencia de especies \nsensibles, además, para el procesamiento y análisis de esta información, se puede utilizar como referencia \nel “Protocolo para toma de medidas de grabaciones focales en espectro audible utilizando el programa \nRaven (Versión 1.6.1)”6 u otras guías o recursos técnicos más actualizados que puedan ser soportados \nsegún las condiciones del proyecto. Para cualquiera de las metodologías a emplear es relevante la entrega \nde anexos completos, donde se relacionen los puntos de muestreo y los registros obtenidos, siguiendo el \nMAG vigente para tal fin. \nFinalmente, considerando que la medida objeto de recurso de reposición es relevante para  determinar la \neficacia y confiabilidad en el seguimiento ambiental del proyecto sobre la medida de manejo de la ficha \nPMSB-3 - Manejo de fauna establecida para el impacto “Alteración de la riqueza y abundancia de las \nespecies de fauna terrestre” y que para implementar el sistema de monitoreo de ruido para la fauna solicitado \ncomo medida de seguimiento se puede utilizar como referencia  las metodologías y protocolos que entidades \ncomo el Instituto de Investigación de Recursos Biológicos Alexander von Humboldt (IAvH) ha implementado, \nse considera pertinente RATIFICAR el numeral 3, del artículo trigésimo cuarto de la Resolución 1885 del 25 \nde agosto de 2023, concerniente a la ficha PSMB-2 Flora y fauna (endémica, en peligro de extinción o \nvulnerable entre otras). \n \nCONSIDERACIONES JURÍDICAS \n \nLa Sociedad solicitó revocar el numeral 3 de la Ficha PSMB-2 Flora y fauna del artículo trigésimo \ncuarto de la Resolución 1885 de 2023, argumentando entre otros, que esta Autoridad no planteó \nargumentos que evidencien la necesidad de adoptar dicha medida, que tiene otras obligaciones \nimpuestas orientadas a la atenuación de la presión sonora en la fauna en áreas de sensibilidad \nambiental y que la Resolución 627 del Ministerio de Ambiente y Desarrollo Sostenible, no establece \nuna metodología para monitoreo de ruido ambiental en áreas de mayor sensibilidad como lo son los \nbosques de galería, palmares, vegetación secundaria alta, entre otros. \nAl respecto, como se indica en la argumentación técnica anterior, en el Concepto Técnico 5269 de \n2023 acogido por la resolución recurrida, se realizó un análisis integral y detallado sobre los posibles \nimpactos y afectaciones de ruido en la fauna por las actividades ejecutadas y por desarrollar, por lo \ncual en otras fichas aprobadas, por ejemplo en la Ficha PMSB-3 - Manejo de fauna; se estableció una \nmedida de localización de obras o actividades que involucren equipos con presión sonora importante, \nesto permitiría verificar de manera correlacionada con la ficha objeto de recurso, que el distanciamiento \nentre fuente y receptor es suficiente. Así mismo, teniendo en cuenta que el objetivo de la medida es \nobtener datos de bioacústica, el monitoreo de ruido ambiental de la Resolución 627 de 2006, no sería \naplicable y si bien no se especifica una metodología puntual para el sistema de monitoreo de ruido de \nfauna, para la captura de información se pueden consultar publicaciones de entidades como el Instituto \nde Investigación de Recursos Biológicos Alexander von Humboldt. \n \n5 Instituto de Investigación de Recursos Biológicos Alexander von Humboldt. 2021, junio.  Recomendaciones para registrar y almacenar señales acústicas \ncomo \nespecímenes \ndigitales \nen \nColombia. \nBiodiversidad \nen \nla \nPráctica, \nVolumen \n6. \nRecuperado \nde: \nhttps://revistas.humboldt.org.co/index.php/BEP/article/view/932/999 \n6 Instituto de Investigación de Recursos Biológicos Alexander von Humboldt. 2022. Protocolo para toma de medidas de grabaciones focales en espectro \naudible \nutilizando \nel \nprograma \nRaven \n(Versión \n1.6.1) \n/ \nColección \nde \nSonidos \nAmbientales. \nRecuperado \nen \nhttp://repository.humboldt.org.co/handle/20.500.11761/35978 \n\nResolución No. 2651       Del 14 NOV. 2023          Hoja No. 88 de 108 \n \n“Por la cual se resuelve un recurso de reposición contra la Resolución 1885 del 25 de agosto de 2023” \nPágina 88 de 108 \n \nEs así como esta Autoridad en cumplimiento de sus funciones de protección al ambiente y con \nfundamento en el análisis realizado para reducir los impactos ambientales que puedan afectar la fauna \ndel área de influencia del proyecto, puede imponer las medidas que sean necesarias, atendiendo las \ncondiciones de sensibilidad y características especiales de cada proyecto evaluado, conforme lo \npermite el artículo 44 de la Ley 1437 de 2011. En ese sentido, no se revoca el numeral 3, del artículo \ntrigésimo cuarto de la Resolución 1885 del 25 de agosto de 2023, concerniente a la ficha PSMB-2 \nFlora y fauna (endémica, en peligro de extinción o vulnerable entre otras). \nAhora bien, frente a los vacíos de metodología para cumplir las medidas impuestas, la Autoridad con \nfundamento en criterios técnicos que pueden dar lugar en algunos eventos a la existencia de márgenes \nde apreciación, configurándose como facultades de naturaleza discrecional relativa, puede determinar \no ajustar en una etapa posterior de seguimiento, aquellas medidas de prevención, mitigación, \ncorrección y compensación por el impacto ambiental que produzca un proyecto determinado, a fin de \nreducir impactos ambientales. \n \n15) OBLIGACION RECURRIDA - ARTÍCULO TRIGÉSIMO DE LA RESOLUCIÓN 1885 DEL 25 DE \nAGOSTO DE 2023 \n \nARTÍCULO TRIGÉSIMO: Modificar el artículo tercero de la Resolución 2035 del 15 de octubre de 2010, \nmodificada por la Resolución 987 del 30 de mayo y por la Resolución 261 del 19 de marzo de 2013, en el \nsentido de establecer la siguiente zonificación de manejo ambiental para las actividades de modificación y \nlas que no se han ejecutado en el proyecto “Área de Explotación de Hidrocarburos Quifa”, quedando de la \nsiguiente manera: (…) \n \nPETICIÓN DE LA SOCIEDAD  \n \nSe solicita respetuosamente a la ANLA aclarar el artículo Trigésimo de la Resolución 1885 de 2023 en el \nsentido de incluir que las siguientes restricciones se encuentran “sujeta al permiso de aprovechamiento \nforestal en los casos en que este se requiera” para la intervención de:  \n• Vegetación secundaria baja  \n• Herbazal denso de tierra firme no arbolado  \n• Herbazal denso de tierra firme con arbustos  \n• Herbazal abierto arenoso  \n• Pastos arbolados  \n• Pastos limpios  \n• Coberturas que puedan presentar individuos arbóreos no plantados. \n \nARGUMENTOS DE LA SOCIEDAD \n \nAl respecto de la zonificación de Manejo Ambiental, la ANLA en la página 463 de la Resolución condiciona \nla intervención de las unidades de cobertura de vegetación secundaria alta y baja, sujetas al permiso de uso \ny aprovechamiento, conforme se presenta a continuación:  \n“…la cobertura vegetación secundaria baja, al igual que la vegetación secundaria alta por su distribución \npuede encontrarse interactuando con el bosque de galería, palmares o en cuerpos de agua en cuyo caso \nsu sensibilidad ambiental es alta y no es pertinente su intervención; de igual manera puede presentarse \n\nResolución No. 2651       Del 14 NOV. 2023          Hoja No. 89 de 108 \n \n“Por la cual se resuelve un recurso de reposición contra la Resolución 1885 del 25 de agosto de 2023” \nPágina 89 de 108 \n \nentorno a la infraestructura existente donde su intervención estará condicionada por el permiso de uso y \naprovechamiento de los recursos que se detalla en el numeral 10.6, al igual que para las coberturas herbazal \ndenso de tierra firme con arbustos y herbazal denso de tierra firme no arbolado”.  \n \nDe igual forma, en la misma página 463 de la mencionada Resolución, la ANLA condiciona la intervención \nde coberturas de pastos al permiso de aprovechamiento forestal, conforme se menciona a continuación:  \n“Para las coberturas de vegetación secundaria baja, pastos arbolados, pastos enmalezados y pastos limpios \nse considera adecuada la categoría de intervención con restricciones para las actividades autorizadas que \nse restringirán al permiso de aprovechamiento forestal y las medidas pertinentes para el manejo de especies \nen condición de veda, en el caso que aplique”. \n \nCon respecto a las áreas de intervención sin restricciones, la ANLA en la página 464 considera que: \n \n“la cobertura herbazal denso de tierra firme no arbolado, se categoriza como de intervención con \nrestricciones debido a que está condicionado al permiso de aprovechamiento forestal; caso similar ocurre \ncon las coberturas pastos arbolados, pastos limpios, entre otras que puedan presentarse individuos \narbóreos, dado que al no presentarse caracterización y solicitud de permiso de aprovechamiento forestal, \nsu intervención está limitada al cumplimiento de la normatividad vigente para proyectos licenciados, así \ncomo a la aplicación de medidas de manejo en caso de identificarse especies epífitas, rupícolas o terrestres \nen condición de veda”. \n \nFinalmente, en la tabla denominada Áreas de intervención con restricciones de la zonificación de manejo \nde la página 465, la ANLA considera que la Vegetación secundaria baja, así como el herbazal denso de \ntierra firme no arbolado, el herbazal denso de tierra firme con arbustos y el herbazal abierto arenoso, Pastos \narbolados, Pastos limpios, entre otras coberturas que puedan presentar individuos arbóreos no plantados, \nson áreas de intervención con restricciones sujetas al permiso de aprovechamiento forestal: \nDe acuerdo con lo expuesto, entiende la Compañía que las áreas con cobertura de herbazal pueden ser \nintervenida sin restricción cuando: (i) no se encuentren interactuando con bosque de galería, palmares o en \ncuerpos de agua en cuyo caso su sensibilidad ambiental es alta y no es pertinente su intervención o; (ii) no \nes necesario el aprovechamiento forestal. \nAsí, las áreas en las que se debe llevar a cabo actividades de desmonte y descapote que no impliquen \naprovechamiento forestal se encuentran como áreas de intervención sin restricción. \n \nPara la Compañía, resulta claro que la restricción de obtener permiso de aprovechamiento forestal \núnicamente aplica para aquellos casos en que este deba obtenerse debido al aprovechamiento del recurso \nque se pretenda hacer pues las actividades de desmonte y descapote requeridas para el proyecto pueden \ndesarrollarse sin intervención de individuos arbóreos. Lo anterior se fundamenta en que: \n• Esta cobertura tiene árboles aislados, en general se trata de un área con muy baja densidad arbórea y en \nella predomina la matriz de herbáceas que se ha caracterizado. \n• Conforme se presentó en la caracterización florística capítulo 3 del EIA y en el Capítulo 5 evaluación de \nimpactos del EIA presentado mediante comunicación 2022283750-1-000 del 16 de diciembre de 2022, y \ncomo se pudo verificar durante la visita de la Autoridad Ambiental, este tipo de herbazal por sus \ncaracterísticas naturales tiene limitado el desarrollo de vegetación de mayor porte, denotando un predominio \ndel estrato herbáceo en el que se registra una menor diversidad respecto de otras coberturas boscosas, y \nen la región se asocia a un manejo de pastos para ganadería, por lo tanto, el proyecto al desarrollar el 95% \n\nResolución No. 2651       Del 14 NOV. 2023          Hoja No. 90 de 108 \n \n“Por la cual se resuelve un recurso de reposición contra la Resolución 1885 del 25 de agosto de 2023” \nPágina 90 de 108 \n \nde su intervención en esos sitios tiene en cuenta la jerarquía de la mitigación, donde se busca intervenir las \náreas con menor diversidad. \n• La mayor parte de la infraestructura petrolera que se localiza en el Meta, particularmente en el municipio \nde Puerto Gaitán, históricamente se ha desarrollado primordialmente sobre áreas de herbazal, debido a que \nla intervención de este tipo de unidades de cobertura, en términos ecológicos representa una afectación de \nmenor significancia respecto a la intervención de coberturas boscosas. \n \nEn línea con lo expuesto por la Compañía se encuentra el análisis realizado por la ANLA en el concepto \ntécnico 5269 del 24 de agosto del 2023, en la página 587 donde se observa el mapa de zonificación de \nmanejo ambiental, en donde la Autoridad Ambiental evidencia en el mapa que las coberturas de herbazales \nno son áreas de exclusión: \nEl análisis planteado por la Compañía y la ANLA se encuentra en línea con la regulación vigente según la \ncual el permiso de aprovechamiento no incluye las coberturas de pastos limpios, pastos enmalezados, ni \npastos arbolados, conforme se observa en la Tabla 4-205 Resumen de solicitud de aprovechamiento forestal \npara el proyecto, del capítulo 4. Demanda, uso, aprovechamiento y/o afectación de recursos naturales \nincluido en la información adiciona allegada a la Autoridad por medio de la comunicación 2022283750-1-\n000 del 16 de diciembre de 2022.  \nLa Compañía considera adecuado restringir la intervención en la vegetación secundaria baja en áreas \nadyacentes al bosque de galería, palmares o cuerpos de agua, teniendo en cuenta que la zonificación del \ncampo de acuerdo con el artículo tercero de la Resolución 2035 del 15 de octubre de 2010 establece como \nárea de exclusión la franja de protección de 50 m a drenajes tanto permanentes como no permanentes y \ndemás drenajes menores. Sin embargo, no resulta procedente restringir la intervención en áreas sin \ninteracción con estos ecosistemas sensibles, teniendo en cuenta que esta unidad de cobertura vegetal se \npuede encontrar asociada a vías u obras de infraestructura que no se localizan en cercanías a bosques, \npalmares o cuerpos de agua.  \nDebe precisarse que no siempre las áreas con vegetación secundaria se encuentran en inmediaciones con \nbosques de galería, palmares o cuerpos de agua por lo que, en los casos en que esto no sucede, se debe \nconsiderar que:  \n \n• La vegetación secundaria es un tipo de vegetación en recuperación luego del abandono de actividades \ncomo ganadería o agricultura.  \n• La vegetación secundaria en general es una cobertura o un ecosistema joven.  \n• La diversidad de esta cobertura no es comparable con la de un bosque.  \nCONSIDERACIONES TÉCNICAS DE LA ANLA \n \nUna vez revisados los argumentos de la Sociedad, es pertinente aclarar que conforme lo establece la \nrestricción “Sujeta al permiso de aprovechamiento forestal o normatividad vigente para áreas con \nlicenciamiento ambiental y manejo de especies de flora epífita, rupícola, terrestre, etc en condición de veda. \n“para las coberturas de la tierra “Herbazal denso de tierra firme no arbolado, Herbazal denso de tierra firme \ncon arbustos, Herbazal abierto arenoso, Pastos arbolados, Pastos limpios y Coberturas que puedan \npresentar individuos arbóreos no plantados.” esta se relaciona con el permiso de aprovechamiento forestal \notorgado conforme al numeral 4 del artículo décimo tercero de la Resolución 1885 del 25 de agosto de 2023, \nen la cual únicamente la cobertura Herbazal denso de tierra firme con arbustos se otorgó permiso de \naprovechamiento forestal. Por lo tanto, las demás coberturas de la tierra señaladas pueden ser objeto de \nintervención por las actividades del proyecto siempre y cuando no se realice aprovechamiento forestal o se \n\nResolución No. 2651       Del 14 NOV. 2023          Hoja No. 91 de 108 \n \n“Por la cual se resuelve un recurso de reposición contra la Resolución 1885 del 25 de agosto de 2023” \nPágina 91 de 108 \n \najuste a lo definido en el artículo 2.2.1.1.9.6 del Decreto 1076 de 2015 para la totalidad del proyecto; además \nde cumplir con las medidas de manejo de flora en veda y no deben entrar en conflicto con otras categorías \nde restricción de la zonificación de manejo ambiental. \nEs importante señalar que ninguna de las coberturas mencionadas se incluye en la categoría de intervención \nsin restricciones, y la cobertura \"herbazal denso inundable no arbolado\" se considera excluida de todas las \nactividades del proyecto. \nEn lo que respecta a la cobertura vegetación secundaria baja, debido a que en el área de influencia se \nlocaliza principalmente interactuando con las coberturas bosque de galería, palmares o cuerpos de agua y \nque su mantenimiento en el tiempo, junto con la vegetación secundaria alta, puede favorecer la recuperación \ny representatividad del bosque de galería, hábitat de importancia ecológica para la fauna local y regional \ncomo resultado del análisis de viabilidad del permiso de aprovechamiento forestal incluido en las páginas \n406 a 407 de la parte considerativa de la Resolución 1885 del 25 de agosto de 2023, siendo el argumento \ncon el cual se definió no otorgar permiso de aprovechamiento forestal para dicha cobertura de la tierra \nindependiente de su distribución dentro del área de influencia del proyecto, se considera pertinente aclarar \nla restricción asignada.  \nAcorde con lo anterior y considerando que de las coberturas de la tierra relacionadas en la petición \núnicamente fue autorizado permiso de aprovechamiento forestal sobre la cobertura herbazal denso de tierra \nfirme con arbustos, es pertinente aclarar las restricciones de las áreas de intervención de la zonificación de \nmanejo ambiental definidas en el artículo Trigésimo de la Resolución 1885 de 2023:. \n \nARTÍCULO TRIGÉSIMO: Modificar el artículo tercero de la Resolución 2035 del 15 de octubre de 2010, \nmodificada por la Resolución 987 del 30 de mayo y por la Resolución 261 del 19 de marzo de 2013, \nen el sentido de establecer la siguiente zonificación de manejo ambiental para las actividades: \n \n(…) \n \nÁREAS DE INTERVENCIÓN CON RESTRICCIONES \nDESCRIPCIÓN DEL ÁREA \nRESTRICCIONES \nHerbazal denso de tierra firme con \narbustos \nSujeta al permiso de aprovechamiento forestal y manejo de \nespecies de flora epífita, rupícola, terrestre, etc en condición \nde veda. \nVegetación secundaria baja \nSujeta a la normatividad vigente para áreas con \nlicenciamiento ambiental y manejo de especies de flora \nepífita, rupícola, terrestre, etc en condición de veda \nHerbazal denso de tierra firme no arbolado \nHerbazal abierto arenoso \nPastos arbolados, pastos limpios, entre \notras que puedan presentar individuos \narbóreos no plantados \nPlantación de latifoliadas \nÚnicamente plantaciones de tipo comercial \n(…) \n \n \nCONSIDERACIONES JURÍDICAS \n\nResolución No. 2651       Del 14 NOV. 2023          Hoja No. 92 de 108 \n \n“Por la cual se resuelve un recurso de reposición contra la Resolución 1885 del 25 de agosto de 2023” \nPágina 92 de 108 \n \n \nFrente a la solicitud de la Sociedad de aclarar el artículo trigésimo para que se indique que las \ncoberturas: Vegetación secundaria baja, herbazal denso de tierra firme no arbolado, herbazal denso \nde tierra firme con arbustos, herbazal abierto arenoso, Pastos arbolados, Pastos limpios, y coberturas \nque puedan presentar individuos arbóreos no plantados, deben tener restricción de estar sujetas al \npermiso de aprovechamiento forestal en los casos en que este se requiera, la Autoridad se permite \nindicar: \n \nLas coberturas sobre las cuales se negó el permiso de aprovechamiento forestal, si bien no pueden \nser aprovechadas en virtud del permiso, cuando se requiera la remoción de árboles aislados en un \nvolumen igual o menor a veinte metros cúbicos (20 m3), no se requerirá de ningún permiso, conforme \nlo indicado en el artículo 2.2.1.1.9.6. del Decreto 1076 de 2015, sin perjuicio de las obligaciones \nadicionales que pueda imponer la Autoridad. \n \nLa Resolución 1885 de 2023, en el numeral 4 del artículo décimo tercero otorgó aprovechamiento \nforestal único para las coberturas herbazal denso de tierra firme con arbustos y bosque de galería y/o \nripario, de acuerdo a las obras y a la autorización que fueron relacionadas. Por lo cual, las demás \ncoberturas de la tierra citadas que se encuentran en la categoría de intervención con restricciones, \npueden ser objeto de intervención por las actividades del proyecto, atendiendo las indicaciones o \nexcepciones señaladas en los argumentos técnicos expuestos.  \n \nSin embargo, como fue expuesto técnicamente, se realizará la aclaración solicitada por la sociedad \nen la restricción, atendiendo que en el marco del recurso de reposición conforme lo indica el numeral \n1 del artículo 74 de la Ley 1437 de 2011, se pueden realizar aclaraciones, por lo que para el herbazal \ndenso de tierra firme con arbustos, quedará de la siguiente manera: “Sujeta al permiso de \naprovechamiento forestal y manejo de especies de flora epífita, rupícola, terrestre, etc en condición de \nveda”. \n \nEn cuanto a la cobertura vegetación secundaria baja, herbazal denso de tierra firme no arbolado, \nherbazal abierto arenoso y pastos arbolados, pastos limpios, entre otras que puedan presentar \nindividuos arbóreos no plantados, su restricción se aclara, quedando de la siguiente manera: “Sujeta \na la normatividad vigente para áreas con licenciamiento ambiental y manejo de especies de flora \nepífita, rupícola, terrestre, etc en condición de veda”. \n \nLo anterior quedará consignado en la parte resolutiva del presente acto administrativo. \n \n16) OBLIGACION RECURRIDA – NUMERAL 2 DEL ARTÍCULO CUADRAGÉSIMO DE LA \nRESOLUCIÓN 1885 DEL 25 DE AGOSTO DE 2023 \n \nARTÍCULO CUADRAGÉSIMO: Aprobar el plan de compensación del medio biótico presentado por la \nsociedad Frontera Energy Colombia Corp. Sucursal Colombia, el cual consiste en la implementación de \nacciones de restauración con enfoque de recuperación bajo las siguientes acciones, mecanismos, modos y \nformas: \n \n\nResolución No. 2651       Del 14 NOV. 2023          Hoja No. 93 de 108 \n \n“Por la cual se resuelve un recurso de reposición contra la Resolución 1885 del 25 de agosto de 2023” \nPágina 93 de 108 \n \n \n \nSe consideran viables las áreas preliminares propuestas en la subzona hidrográfica del Alto Vichada, en el \nmunicipio de Puerto Gaitán, departamento del Meta. \n \nObligaciones: \n \n(…) \n \n2. \nCompensar un total de 195,7 ha de ecosistemas equivalentes correspondientes al cálculo de los \nimpactos bióticos identificados para la modificación del proyecto. Las áreas preliminares por compensar, de \nacuerdo con las áreas solicitadas, revisadas y aprobadas para intervención serán las siguientes: \n \n \n \n(…) \n \nPETICIÓN DE LA SOCIEDAD  \n \nSe solicita respetuosamente a la ANLA modificar el Artículo Cuadragésimo de la Resolución 1885 del 25 de \nagosto de 2023, en el sentido de ajustar el cuánto compensar de acuerdo con la tabla 10.2.2.3 del EIA \nradicado con comunicación número 2022283750-1-000 del 16 de diciembre de 2022, radicado VITAL \n3500830126302222050 con la inclusión de:  \n \n• Área potencial para intervenir que se requiere compensar, sobre la cual se debe aplicar el correspondiente \nfactor de compensación para establecer el total de área a compensar.  \n\nResolución No. 2651       Del 14 NOV. 2023          Hoja No. 94 de 108 \n \n“Por la cual se resuelve un recurso de reposición contra la Resolución 1885 del 25 de agosto de 2023” \nPágina 94 de 108 \n \n• Área susceptible de intervención en las coberturas de herbazales. \n \nARGUMENTOS DE LA SOCIEDAD \n \n“En términos de la compensación biótica, para la estimación del cuánto compensar, la ANLA en la página \n575 y 576 señala que: “Conforme el análisis de la información suministrada por el solicitante, en la tabla \n10.2.2.3 “Cálculo del área a compensar” del Plan de compensación, la Sociedad manifiesta que “Para el \ncálculo del área a compensar se consideró únicamente el área que potencialmente será intervenida en \ncoberturas naturales/seminaturales correspondiendo está a 151.49 ha; no se cuantifica el área para \nconstrucción de vías nuevas de acceso y adecuación, toda vez que estas áreas mediante Resolución 261 \nde 2013 artículo segundo numeral 5, ya se encuentran licenciadas y la compensación a la que da lugar se \nreportarán en el marco de las obligaciones de la licencia y modificaciones anteriores a esta”. Asimismo, \naclara que para el cálculo del área a compensar no se considera el área potencialmente afectable por el \ndesmonte y descapote para enterrar las líneas troncales y líneas de flujo que cruzarán los herbazales \ndensos de tierra firme no arbolado, debido a que esta actividad se desarrollará de forma puntual, a una \nprofundidad mínima de 1.5m, será temporal y contará con medida de manejo de corrección del impacto, lo \nque hace necesario que no sea llevado a compensación.” Teniendo en cuenta lo anterior, la Sociedad realizó \nla estimación del cuánto compensar a partir del Mapa de Ecosistemas definido por la Sociedad y los factores \nde compensación establecidos en el Anexo 2 del Manual de compensación del componente biótico, \nobteniendo un área a compensar de 795,85 ha por la afectación de 151,44ha. En este sentido, el equipo \ntécnico evaluador realizó la verificación del cuanto compensar, y verificó los criterios sobre jerarquía de la \nmitigación presentados en el Anexo Detalle de las áreas donde se menciona o explica porque algunas \nactividades y obras no se consideran en la estimación del cuanto compensar, producto de esta verificación \ny acorde con lo aprobado en el aprovechamiento forestal se obtuvieron los resultados del cuanto compensar, \ntal como se presenta en la siguiente tabla: \n \n \n \nAl verificar el cálculo realizado por la Sociedad, se considera que la misma realizó un ejercicio adecuado \nrespecto a la implementación de los factores de compensación y para algunos ecosistemas manifiesta que \nno aplica la compensación porque están inmersos en la Resolución 261 de 2013, estas áreas están \nasociadas específicamente a las actividades de adecuación de vías y otras relacionadas con obras ya \nejecutadas, por lo cual se considera acertado no incluir actividades y obras que ya están autorizadas. Por \n\nResolución No. 2651       Del 14 NOV. 2023          Hoja No. 95 de 108 \n \n“Por la cual se resuelve un recurso de reposición contra la Resolución 1885 del 25 de agosto de 2023” \nPágina 95 de 108 \n \notro lado, es preciso indicar que el cuanto compensar estimado por el equipo técnico evaluador se reduce \nteniendo en cuenta que no se aprobó el aprovechamiento forestal en el herbazal denso de tierra firme no \narbolado, el cual ocupaba un área importante y la vegetación secundaria alta y baja fueron catalogadas \ncomo áreas de exclusión, aspectos que inciden directamente en la estimación de las áreas de \ncompensación”.  \nTeniendo en cuenta la información consignada en el Plan de compensación Biótica radicado en el marco de \nla entrega de información adicional para la solicitud de modificación de licencia y las consideraciones \nrealizadas por la ANLA en la página 575, se observa diferencia en los valores referidos por la ANLA entorno \nal cuánto compensar, observando en el primer párrafo de la citada página una cifra de 151,49 ha, mientras \nque en el tercer párrafo esta cifra es de 151,44, conllevando a la obligación de compensar un total de 795,85 \nha por la potencial afectación. Al contrastar estas cifras con las presentadas en el documento radicado por \nla Sociedad, se observa un mayor valor de área referido por la Autoridad, siendo que, en el documento \nradicado, el área que potencialmente se va a intervenir en cobertura natural / seminatural corresponde a \n149,6 ha que conlleva a una obligación de compensación de 785,7 ha como se detalló en el anexo \nE_Planes_Programas / E_2_Compensacion_y_1_porcien / Anexo_6_Detalle áreas a compensar.  \nPosteriormente, la ANLA establece que se reduce el área considerada en el cuánto compensar dado que \nno se aprobó el aprovechamiento forestal en el herbazal denso de tierra firme no arbolado, el cual ocupaba \nun área importante y la Vegetación secundaria alta y baja fueron catalogadas como áreas de exclusión; sin \nembargo, al verificar los datos consignados en la tabla 89 Ecosistemas susceptibles de ser intervenidas por \nlas obras y actividades del proyecto, se observa que la Autoridad consideró erróneamente el área a \nintervenir sujeta a compensación, puesto que como la misma Autoridad lo nombra en las consideraciones \nrealizadas y expuestas anteriormente, la Sociedad no consideró en la cuantificación del área la construcción \nde vías y otras relacionadas con obras ya ejecutadas, toda vez que estas áreas mediante Resolución 261 \nde 2013, ya se encuentran licenciadas y la compensación a la que da lugar se reportarán en el marco de \nlas obligaciones de la licencia y modificaciones anteriores a esta, aspecto que la ANLA considera acertado \nen la página 576 de la Resolución 1885 de 2023.  \nEn virtud de lo anterior, para la estimación de las áreas potenciales a intervenir, no se incluyó por parte de \nla ANLA la cobertura de herbazal denso de tierra firme no arbolado, así como la Vegetación secundaria alta \ny baja, y para las áreas potenciales a intervenir que se requieren compensar la exclusión de las áreas en \ncoberturas antropizadas correspondientes a Red vial y territorios asociados, Explotación de hidrocarburos, \njunto con las áreas de las actividades u obras que ya están autorizadas, así como las coberturas referidas \nal inicio de este párrafo, y tomando como insumo base la información de la tabla 10.2.2.3 Cálculo del área \na compensar del Plan de compensación presentado para la modificación de licencia, se obtiene un total de \nárea potencial a intervenir que requiere compensarse de 4,7 ha que conlleva a una obligación de compensar \n24,75 ha como se describe en la siguiente tabla. \n \n\nResolución No. 2651       Del 14 NOV. 2023          Hoja No. 96 de 108 \n \n“Por la cual se resuelve un recurso de reposición contra la Resolución 1885 del 25 de agosto de 2023” \nPágina 96 de 108 \n \n \n \nSe reitera que el área potencial a intervenir que se requiere compensar no es igual al área potencial a \nintervenir, ya que en la primera, no se considera el área de las actividades y obras que ya están autorizadas, \nni las áreas potencialmente afectables por el desmonte y descapote para enterrar las líneas troncales y \nlíneas de flujo que cruzarán los herbazales y se desarrollará de forma puntual, a una profundidad mínima \nde 1,5 m, por lo que es temporal y contará con medida de manejo del impacto, lo que hace que no sea \nnecesario llevarla a la compensación, aspecto que la Autoridad también considera adecuado, en virtud de \nlo cual, es necesario que la Autoridad considere esta diferenciación para la definición total del cuánto \ncompensar. \n \nDe otra parte, FEC precisa que si bien, se restringe el aprovechamiento forestal en la cobertura de herbazal \ndenso de tierra firme no arbolado, esto no implica que en dicha cobertura deba restringirse la intervención \npor el desarrollo de actividades asociadas al desmonte y descapote requerido para el proyecto, teniendo en \ncuenta que puede hacerse sin intervención de individuos arbóreos; de la misma forma, se debe tener en \ncuenta que en la parte Resolutiva, página 642, la Vegetación secundaria baja no se cataloga como un área \nde exclusión como lo refiere la ANLA en el estimado de compensación de la página 575, sino que se \nenmarca al interior de la categoría de áreas con restricciones sujetas al permiso de aprovechamiento forestal \nen áreas sin interacción o adyacente al bosque de galería, palmares o cuerpos de agua; razón por la cual, \nse debe especificar que si bien no se aprueba aprovechamiento forestal, se puede realizar intervenciones \ncomo desmonte y descapote garantizando la no afectación de las coberturas sensibles y cuerpos hídricos.  \n \nEs importante tener en cuenta que dada la posibilidad de intervención en estas coberturas por cambio en el \nuso del suelo y no necesariamente por el aprovechamiento arbóreo, se debe ajustar el cuánto compensar \nde acuerdo con lo solicitado,  \n \nDe acuerdo con las consideraciones brindadas por la ANLA en las páginas 575 y 576 para FEC es muy \nimportante en la estimación del cuánto compensar diferenciar la premisa de área a intervenir y área potencial \na intervenir que requiere compensación, dados los argumentos brindados, en el sentido de no incluir:  \n \n• Áreas de las actividades y obras que ya están autorizadas.  \n\nResolución No. 2651       Del 14 NOV. 2023          Hoja No. 97 de 108 \n \n“Por la cual se resuelve un recurso de reposición contra la Resolución 1885 del 25 de agosto de 2023” \nPágina 97 de 108 \n \n• Áreas de coberturas antropizadas en las que se demuestren que las medidas de manejo a ser \nimplementadas logran evitar la generación de impactos residuales.  \n• Áreas asociadas a líneas de flujo que irán enterradas, generarán impactos temporales en zonas puntuales \ny contará con medida de manejo de corrección del impacto.  \n \nSi bien, se restringe el aprovechamiento forestal en la cobertura de herbazal denso de tierra firme no \narbolado, esto no implica que en dicha cobertura deba restringirse la intervención por el desarrollo de \nactividades asociadas al desmonte y descapote requerido para el proyecto; de igual forma, la vegetación \nsecundaria baja no se cataloga como un área de exclusión como lo refiere la ANLA en el estimado de \ncompensación, sino que constituye un área de intervención con restricciones mayores, que en áreas sin \ninteracción o adyacente al bosque de galería, palmares o cuerpos de agua, debería permitir la intervención \npor actividades ajenas al aprovechamiento forestal pero que pueden generar cambio en el uso del suelo. \n \nSe solicita respetuosamente a la ANLA modificar el Artículo Cuadragésimo de la Resolución 1885 del 25 de \nagosto de 2023, en el sentido de ajustar el cuánto compensar de acuerdo con la tabla 10.2.2.3 del EIA \nradicado con comunicación número 2022283750-1-000 del 16 de diciembre de 2022, radicado VITAL \n3500830126302222050 con la inclusión de: \n \n • Área potencial para intervenir que se requiere compensar, sobre la cual se debe aplicar el correspondiente \nfactor de compensación para establecer el total de área a compensar. • Área susceptible de intervención en \nlas coberturas de herbazales. \n \nA continuación, se presenta la tabla 10.2.2.3 del EIA: Cálculo del área a compensar del Plan de \ncompensación: \n \n \n \n\nResolución No. 2651       Del 14 NOV. 2023          Hoja No. 98 de 108 \n \n“Por la cual se resuelve un recurso de reposición contra la Resolución 1885 del 25 de agosto de 2023” \nPágina 98 de 108 \n \n(…)“ \n \nCONSIDERACIONES TÉCNICAS DE LA ANLA \n \nEn el numeral 3 del artículo cuadragésimo de la Resolución 1885 del 25 agosto de 2023, se estableció un \ntotal de 195,7 ha de ecosistemas equivalentes que contempla únicamente lo relacionado a los ecosistemas \nherbazal denso de tierra firme con arbustos y bosque de galería, ambos presentes en el helobioma y \npeiniobioma, lo cual se alinea con el permiso de aprovechamiento forestal otorgado mediante el numeral 4 \ndel artículo décimo tercero y la zonificación ambiental establecida en el Artículo Trigésimo del mismo acto \nadministrativo. \n \nPor otro lado, dado que el herbazal denso de tierra firme no arbolado abarca aproximadamente del 71% del \nárea de influencia del proyecto, la mayoría de actividades proyectadas se desarrollarán en esta unidad \nvegetal de origen natural sin que ello implique la intervención del componente arbóreo que pueda \nidentificarse, lo cual es posible por las características y distribución de los individuos, ajustándose así a la \nnegación del permiso de aprovechamiento forestal sobre dicha unidad vegetal conforme al artículo vigésimo \nséptimo de la Resolución 1885 del 25 agosto de 2023 y confirmado en el presente recurso de reposición.  \n \nEn este contexto, aunque el aprovechamiento forestal es negado, en esta cobertura se tienen autorizadas \nactividades del proyecto, las cuales ocasionaran impactos bióticos, por lo cual se considera procedente \nrevisar y ajustar las áreas de compensación de acuerdo a lo autorizado.  \n \nAsí las cosas, en la revisión de la “Tabla 10.2.2 3 Cálculo del área a compensar” y “Anexo_6_Detalle areas \na compensar” del radicado 2022283750-1-000 del 16 de diciembre de 2022, donde la Sociedad detalla cada \nuno de los ecosistemas a intervenir por las actividades o estrategias a desarrollar y correlacionado con los \nartículos vigésimo quinto, vigésimo sexto, vigésimo séptimo y trigésimo de la Resolución 1885 del 25 agosto \nde 2023, a continuación se detalla los resultados del cuánto compensar: \n \nBIOMA \nCOBERTURA \nTOTAL, ÁREA A \nINTERVENIR \nFC \nTOTAL ÁREA A \nCOMPENSAR \nHelobioma \nAltillanura \nBosque de galería y/o \nripario \n0,15 \n5,5 \n0,825 \nHerbazal denso de \ntierra \nfirme \ncon \narbustos \n0,15 \n5,5 \n0,825 \nHerbazal denso de \ntierra firme no arbolado \n1,72 \n5,5 \n9,46 \nPeinobioma \nAltillanura \nBosque de galería y/o \nripario \n0,04 \n5,25 \n0,21 \nHerbazal denso de \ntierra \nfirme \ncon \narbustos \n4,28 \n5,25 \n22,47 \nHerbazal denso de \ntierra firme no arbolado \n129,08 \n5,25 \n677,67 \n\nResolución No. 2651       Del 14 NOV. 2023          Hoja No. 99 de 108 \n \n“Por la cual se resuelve un recurso de reposición contra la Resolución 1885 del 25 de agosto de 2023” \nPágina 99 de 108 \n \nTotal \n135,42 \n \n711,5 \nFuente: Equipo Evaluador de la ANLA con base en información del radicado 2022283750-1-000 del 16 de diciembre de 2022. \nEn ese sentido se sugiere la modificación del numeral 3 del artículo cuadragésimo de la Resolución 1885 \ndel 25 agosto de 2023, el cual quedará de la siguiente manera: \n“ARTÍCULO CUADRAGÉSIMO: Aprobar el plan de compensación del medio biótico presentado por la \nsociedad Frontera Energy Colombia Corp. Sucursal Colombia, el cual consiste en la implementación de \nacciones de restauración con enfoque de recuperación bajo las siguientes acciones, mecanismos, modos y \nformas: \n  \n(…) \n \nObligaciones: \n(…) \n \n3. \nCompensar un total de 711,5 ha de ecosistemas equivalentes correspondientes al cálculo de los \nimpactos bióticos identificados para la modificación del proyecto. Las áreas preliminares por compensar, de \nacuerdo con las áreas solicitadas, revisadas y aprobadas para intervención serán las siguientes: \n(…). \n \nCONSIDERACIONES JURÍDICAS \n \nRespecto a la solicitud de modificar el artículo cuadragésimo de la Resolución 1885 de 2023, para que \nsea incluido en el numeral 2, en el sentido de ajustar el cuánto compensar a lo que fue propuesto por \nla sociedad en el EIA radicado 2022283750-1-000 del 16 de diciembre de 2022, como fue señalado \ntécnicamente, mediante el presente acto administrativo se hará la respectiva modificación, incluyendo \nla cobertura herbazal denso de tierra firme no arbolado, que aunque se negó el aprovechamiento \nforestal único en la misma, si se tienen autorizadas actividades del proyecto, que ocasionarían \nimpactos bióticos que deberán ser compensados. \nEn ese sentido, se modificará el numeral 3 del artículo mencionado, habiéndose hecho la solicitud \noportunamente dentro del recurso de reposición como lo indica el artículo 80 de la Ley 1437 de 2011, \npara indicar una compensación de un total de 711,5 ha de ecosistemas equivalentes, correspondientes \nal cálculo de los impactos bióticos identificados para la modificación del proyecto y en ese sentido se \najustará el contenido de la tabla como fue citado. \n \nCONSIDERACIONES FINALES \n \nAcogiendo las recomendaciones presentadas en el Concepto Técnico 7753 del 14 de noviembre de \n2023 y las razones de hecho y de derecho expuestas, esta Autoridad considera que existen \nobligaciones que corresponde modificar o aclarar, como lo son: encabezado del artículo segundo y \ndel literal i del numeral 7 del artículo segundo, literal a) del artículo décimo primero, numeral 5 del \nartículo décimo tercero, literal 2 del numeral 2 del artículo décimo tercero, artículo vigésimo tercero, \nartículo trigésimo, literal d) de la Ficha PSMB-3 del artículo trigésimo segundo, el literal a numeral 1 \n\nResolución No. 2651       Del 14 NOV. 2023          Hoja No. 100 de 108 \n \n“Por la cual se resuelve un recurso de reposición contra la Resolución 1885 del 25 de agosto de 2023” \nPágina 100 de 108 \n \nde la Ficha FICHA: PSMA-2 artículo trigésimo cuarto, el literal c del numeral 1 del artículo trigésimo \ncuarto (que se confirma y se complementa), artículo cuadragésimo. \n \nPor otro lado, se revocan el literal a) y b) del numeral 1 de la Ficha PSMA 3 del artículo trigésimo \ncuarto. \n \nFinalmente, no se revocan o modifican y en su lugar se confirman: el literal a) del artículo cuarto, el \nnumeral 3 del artículo cuarto, obligación 4 del artículo décimo segundo, artículo vigésimo séptimo, \nliteral d) de la Ficha PSMB-3 del artículo trigésimo segundo, literal d) del numeral 1 del artículo \ntrigésimo cuarto, numeral 3 de la Ficha PSMB-2 del artículo trigésimo cuarto.  \n \nEn mérito de lo anterior, \n \nRESUELVE \n \nARTÍCULO PRIMERO. Reponer el encabezado y el literal i) del numeral 7 del artículo segundo de la \nResolución 1885 del 25 de agosto de 2023, en el sentido de ajustar el error de digitación del expediente \nque quedó señalado en la Resolución 1885 de 2023, de conformidad con lo expuesto en la parte \nmotiva del presente acto administrativo, el cual quedará así: \n “ARTÍCULO SEGUNDO: Modificar el artículo segundo de la Resolución 2035 del 15 de octubre de 2010, \nmodificada por la Resolución 987 de 2011, 261 de 2013, entre otras, en el sentido de adicionar desde el \npunto de vista ambiental las siguientes actividades para el desarrollo del proyecto “Área de Explotación de \nHidrocarburos Quifa”: \n(…) \n7. APOYO OPERACIONAL ENTRE CAMPOS \nSe autoriza desde el punto de vista ambiental la entrega y recibo de aguas residuales industriales tratadas \no sin tratamiento con otros campos cercanos de Frontera Energy Corp., y el socio Ecopetrol S.A., que se \nrelacionan a continuación: \n(…) \ni) Área de Explotación de Hidrocarburos Quifa Norte- Norte, LAV0033-00-2015. \n \n(…)”.  \n \nARTÍCULO SEGUNDO. Reponer en el sentido de aclarar el literal a) del artículo décimo primero de la \nResolución 1885 del 25 de agosto de 2023, ajustando las coordenadas de la subestación PAD1, de \nconformidad con lo expuesto en la parte motiva del presente acto administrativo, el cual quedará así: \n“ARTÍCULO DÉCIMO PRIMERO: Modificar el numeral 10 del artículo segundo de la Resolución 261 e \n2013, en el sentido de incluir dentro de la autorización ambiental lo siguiente: \n \n\nResolución No. 2651       Del 14 NOV. 2023          Hoja No. 101 de 108 \n \n“Por la cual se resuelve un recurso de reposición contra la Resolución 1885 del 25 de agosto de 2023” \nPágina 101 de 108 \n \na) Construcción y operación de Centros de maniobra y subestación eléctrica PAD 1, la cual se localizará \nsobre el límite sur del PAD 1, en un área de 0,69 ha y en las siguientes coordenadas: \nLocalización subestación PAD1 \nVÉRTICE \nMAGNA COLOMBIA ESTE \nSISTEMA NACIONAL \nESTE \nNORTE \nESTE \nNORTE \n1 \n952585,512 \n928749,376 \n5165977,281 \n1994818,936 \n2 \n952615,431 \n928756,916 \n5166007,167 \n1994826,542 \n3 \n952629,489 \n928699,960 \n5166021,350 \n1994769,645 \n4 \n952558,226 \n928682,372 \n5165950,163 \n1994751,901 \n5 \n952533,714 \n928781,687 \n5165925,433 \n1994851,111 \n6 \n952575,021 \n928791,882 \n5165966,697 \n1994861,396 \nÁrea = 0,69 ha \n(…)”. \n \nARTÍCULO TERCERO. Reponer el numeral 5 del artículo décimo tercero de la Resolución 1885 del \n25 de agosto de 2023, en el sentido de modificar lo relacionado al permiso de vertimiento al suelo, de \nconformidad con lo expuesto en la parte motiva del presente acto administrativo, el cual quedará así: \n \n \n“ARTÍCULO DECIMO TERCERO: Modificar el artículo cuarto de la Resolución 2035 del 15 de octubre de \n2010, que otorgó Licencia Ambiental para el proyecto “Área de Explotación de Hidrocarburos Quifa”, en el \nsentido de adicionar el uso, aprovechamiento y/o manejo de los recursos naturales renovables necesarios, \nde acuerdo con las condiciones, especificaciones y obligaciones que se exponen a continuación: \n(…) \n5. Vertimiento al suelo \nOtorgar permiso de vertimiento al suelo por 13 años contados a partir del inicio de la actividad de riego por \naspersión, de las Aguas Residuales Domésticas Tratadas (ARD-T) generadas en las instalaciones sanitarias \nde las facilidades Campamento Quifa y Batería 4 a las ZODAR ubicadas en dichas locaciones, bajo las \nsiguientes condiciones y coordenadas: \n \nCondición \nCampamento Quifa \nBatería 4 \nCaudal de descarga (l/s) \n2,0185 \n0,06 \nTiempo de descarga (h/día) \n24 \n0,73 \nFrecuencia (días/mes) \n30 \n30 \n(…). \n\nResolución No. 2651       Del 14 NOV. 2023          Hoja No. 102 de 108 \n \n“Por la cual se resuelve un recurso de reposición contra la Resolución 1885 del 25 de agosto de 2023” \nPágina 102 de 108 \n \nARTÍCULO CUARTO. Reponer el literal b) del numeral 2 del artículo décimo tercero de la Resolución \n1885 del 25 de agosto de 2023, en el sentido de aclarar lo referente a la concesión de aguas \nsubterráneas, de conformidad con lo expuesto en la parte motiva del presente acto administrativo, el \ncual quedará así: \n \n“ARTÍCULO DÉCIMO TERCERO: Modificar el artículo cuarto de la Resolución 2035 del 15 de octubre de \n2010, que otorgó Licencia Ambiental para el proyecto “Área de Explotación de Hidrocarburos Quifa”, en el \nsentido de adicionar el uso, aprovechamiento y/o manejo de los recursos naturales renovables necesarios, \nde acuerdo con las condiciones, especificaciones y obligaciones que se exponen a continuación: \n(…)  \n2. Concesión de aguas subterráneas  \n(…)  \nb) El ID ANLA para los actuales pozos de captación de agua subterránea será: PASUB 1 tendrá el código \nCSB-LAM4795-0001 y el PASUB 2 el código CSB-LAM4795-0002. En el momento en que el pozo PASUB \n1B QF entre en operación el pozo PASUB 1 solamente tendrá funciones de monitoreo, es decir que en \nningún momento ambos pozos pueden estar en funcionamiento al mismo tiempo. Este cambio debe ser \nnotificado a la ANLA dentro del mes siguiente a que ocurra el cambio de operación de estos pozos. (…)”. \n \nARTÍCULO QUINTO: Reponer el literal d) de la Ficha PMSB-3 – Manejo de Fauna del artículo \ntrigésimo segundo, en el sentido de modificar la periodicidad del monitoreo de los pasos de fauna, el \ncual quedará de la siguiente forma, de conformidad con lo expuesto en la parte motiva: \n“ARTÍCULO TRIGÉSIMO SEGUNDO: La sociedad Frontera Energy Colombia Corp. Sucursal \nColombia., deberá en el término de tres (3) meses contados a partir de la ejecutoria de este acto \nadministrativo, ajustar los siguientes programas del Plan de Manejo Ambiental, establecidos para \nel proyecto “Área de Desarrollo de Hidrocarburos Quifa”:  \n \n(…)  \n \nPROGRAMA DE SOSTENIBILIDAD \n \n(…) \n \nFICHA: PMSB-3 - Manejo de fauna \n(…) \n \nd. En cada Informe de Cumplimiento Ambiental, se deberá presentar para las fases de construcción \ny de perforación el registro periódico mensual y estandarizado del uso del sistema de pasos de \nfauna por especies silvestres, información que también debe registrarse en la capa “punto de \nmuestreo fauna” o en la que se actualice para tal fin dentro del modelo de datos vigente. Para la \nfase de producción el monitoreo a los pasos de fauna se deberá realizar como mínimo en tres (3) \ntemporalidades climáticas (seco, lluvia y transición). En caso tal de identificarse cambios en las \n\nResolución No. 2651       Del 14 NOV. 2023          Hoja No. 103 de 108 \n \n“Por la cual se resuelve un recurso de reposición contra la Resolución 1885 del 25 de agosto de 2023” \nPágina 103 de 108 \n \nrutas de movilización con el paso del tiempo, dichas rutas deberán ser reportadas en cada ICA a \nesta Autoridad Ambiental. Para el cumplimiento de este objetivo se podrán utilizar cámaras trampa, \nsiendo deseables seguimientos de telemetría en individuos, para garantizar la evaluación de los \npasos de fauna efectivamente utilizados por las especies. \n \n(…)”  \n \nARTICULO SEXTO. Reponer el literal c) numeral 1 de la “FICHA PSMA 3 Emisiones atmosféricas, \ncalidad del aire y ruido” del artículo trigésimo cuarto de la Resolución 1885 del 25 de agosto de 2023, \nen el sentido de aclarar lo relacionado con Emisiones atmosféricas, calidad del aire y ruido, de \nconformidad con lo expuesto en la parte motiva del presente acto administrativo, el cual quedará así: \n“ARTÍCULO TRIGÉSIMO CUARTO: La sociedad Frontera Energy Colombia Corp. Sucursal Colombia, \ndeberá ajustar los siguientes programas y presentar los soportes de cumplimiento en un término de tres (3) \nmeses contados a partir de la firmeza del presente acto administrativo, de conformidad con las condiciones \nque se presentan a continuación: \n(…) \nFICHA PSMA 3 Emisiones atmosféricas, calidad del aire y ruido \n1. Especificar la realización de los monitoreos de calidad del aire y ruido de la siguiente forma: \n(…) \nc. Durante la operación global del proyecto de manera semestral, en puntos representativos dentro del área \nde influencia considerando la ubicación de los puntos de línea base del EIA, la ubicación final de las \nplataformas, y receptores de interés. De acuerdo con lo anterior, en las siguientes tablas se indican los \npuntos, codificados por la ANLA, en los cuales se deben realizar los monitoreos de calidad del aire y de \nruido. Este código debe ser reportado dentro de las capas y tablas correspondientes del Modelo de \nAlmacenamiento Geográfico – MAG: \n(…) \nEn caso de no ejecutar los monitoreos en determinados puntos, deberá presentar la argumentación \ncorrespondiente, fundamentada en razones técnicas, logísticas, entre otras. \nAntes de la construcción de vías y plataformas nuevas, así como durante la perforación y pruebas de \nproducción de cada pozo, la Sociedad deberá realizar simulaciones con modelos de dispersión de \ncontaminantes atmosféricos y de propagación sonora cumpliendo con los lineamientos técnicos de \nejecución establecidos por la ANLA en la presente ficha, con el objetivo puntual de proyectar el futuro \nimpacto por su desarrollo, e implementar las medidas de control necesarias para reducir la potencial \nafectación sobre receptores sensibles cercanos, presentando soportes de su implementación. \nEn caso de evidenciar afectación constante sobre receptores sensibles por el desarrollo de las actividades \ndel proyecto, o la reiteración de quejas manifestadas por los miembros de la comunidad, la Sociedad deberá \nrevaluar el diseño del Sistema de Vigilancia de Calidad del Aire Industrial – SVCAI o de la red de monitoreo \nde ruido ambiental estableciendo, de ser necesario, puntos adicionales de medición, cuya ubicación debe \nestar soportada en los resultados de los modelos predictivos y, para calidad del aire, en lo establecido en el \n\nResolución No. 2651       Del 14 NOV. 2023          Hoja No. 104 de 108 \n \n“Por la cual se resuelve un recurso de reposición contra la Resolución 1885 del 25 de agosto de 2023” \nPágina 104 de 108 \n \nProtocolo para el Monitoreo y Seguimiento de la Calidad del Aire, adoptado mediante la Resolución 650 de \n2010 y ajustado por la Resolución 2154 de 2010 del entonces Ministerio de Ambiente, Vivienda y Desarrollo \nTerritorial, o aquel que lo modifique o sustituya”. \nARTICULO SÉPTIMO. Reponer el artículo vigésimo tercero de la Resolución 1885 del 25 de agosto \nde 2023, en el sentido de aclarar lo relacionado a la concesión de agua subterránea, de conformidad \ncon lo expuesto en la parte motiva del presente acto administrativo, el cual quedará así: \n“ARTÍCULO VIGÉSIMO TERCERO: Mantener el permiso de concesión de agua subterránea del pozo \nPASUB 1, otorgado mediante la Resolución 261 de 2013, hasta tanto el pozo PASUB 1B QF deba entrar en \noperación, momento a partir del cual queda sin efecto el permiso de explotación de agua subterránea del \npozo PASUB 1 y solamente tendrá funciones de monitoreo, es decir que en ningún momento ambos pozos \npueden estar en funcionamiento al mismo tiempo. Este cambio debe ser notificado a la ANLA dentro del \nmes siguiente a que ocurra el cambio de operación de estos pozos”. \n \nARTÍCULO OCTAVO. Reponer el artículo trigésimo de la Resolución 1885 del 25 de agosto de 2023, \nen el sentido de aclarar la restricción a las mencionadas coberturas de la tierra, de conformidad con \nlo expuesto en la parte motiva del presente acto administrativo, el cual quedará así: \n \n“ARTÍCULO TRIGÉSIMO: Modificar el artículo tercero de la Resolución 2035 del 15 de octubre de \n2010, modificada por la Resolución 987 del 30 de mayo y por la Resolución 261 del 19 de marzo de \n2013, en el sentido de establecer la siguiente zonificación de manejo ambiental para las actividades: \n \n(…) \n \nÁREAS DE INTERVENCIÓN CON RESTRICCIONES \nDESCRIPCIÓN DEL ÁREA \nRESTRICCIONES \nHerbazal denso de tierra firme con \narbustos \nSujeta al permiso de aprovechamiento forestal y manejo de \nespecies de flora epífita, rupícola, terrestre, etc en condición \nde veda. \nVegetación secundaria baja \nSujeta a la normatividad vigente para áreas con \nlicenciamiento ambiental y manejo de especies de flora \nepífita, rupícola, terrestre, etc en condición de veda \nHerbazal denso de tierra firme no arbolado \nHerbazal abierto arenoso \nPastos arbolados, pastos limpios, entre \notras que puedan presentar individuos \narbóreos no plantados \nPlantación de latifoliadas \nÚnicamente plantaciones de tipo comercial \n(…) \n \nARTÍCULO NOVENO. Modificar el literal a) del numeral primero 1 de la FICHA: PSMA-2 Aguas \nSubterráneas, del Artículo Trigésimo Cuarto de la Resolución No. 1885 del 25 de agosto de 2023, en \nel sentido de aclarar las condiciones de concesión de agua subterránea de los pozos PASUB 1 y \nPASUB 1B QF, de conformidad con lo expuesto en la parte motiva del presente acto administrativo, el \n\nResolución No. 2651       Del 14 NOV. 2023          Hoja No. 105 de 108 \n \n“Por la cual se resuelve un recurso de reposición contra la Resolución 1885 del 25 de agosto de 2023” \nPágina 105 de 108 \n \ncual quedará así: \n“ARTÍCULO TRIGÉSIMO CUARTO: La sociedad Frontera Energy Colombia Corp. Sucursal Colombia, \ndeberá ajustar los siguientes programas y presentar los soportes de cumplimiento en un término de tres (3) \nmeses contados a partir de la firmeza del presente acto administrativo, de conformidad con las condiciones \nque se presentan a continuación: \n \n(…) \n \nFICHA: PSMA-2 Aguas Subterráneas. \n \n1. \nAjustar la acción 1: Monitoreo y adecuación de puntos de captación de aguas subterráneas, con \nrespecto a: \n \na. \n \n(…) \n \nConsiderando que los pozos de captación de agua subterránea PASUB 1 y PASUB 1B QF de acuerdo con \nlas condiciones de concesión del recurso no pueden funcionar al mismo tiempo, en el momento en que el \npozo PASUB 1B QF entre en operación, el pozo PASUB 1 solamente tendrá funciones de monitoreo y \ncontinuará formando parte de la estrategia de monitoreo regional. (…)”. \n \nARTÍCULO DÉCIMO. Reponer el numeral 3 de las obligaciones y el contenido de la tabla del artículo \ncuadragésimo de la Resolución 1885 del 25 de agosto de 2023, en el sentido modificar el total del \nárea a compensar de ecosistemas equivalentes, de conformidad con lo expuesto en la parte motiva \ndel presente acto administrativo, el cual quedará así: \n \n“ARTÍCULO CUADRAGÉSIMO: Aprobar el plan de compensación del medio biótico presentado por la \nsociedad Frontera Energy Colombia Corp. Sucursal Colombia, el cual consiste en la implementación de \nacciones de restauración con enfoque de recuperación bajo las siguientes acciones, mecanismos, modos y \nformas: \n  \n(…) \n \nObligaciones: \n(…) \n \n3. Compensar un total de 711,5 ha de ecosistemas equivalentes correspondientes al cálculo de los impactos \nbióticos identificados para la modificación del proyecto. Las áreas preliminares por compensar, de acuerdo \ncon las áreas solicitadas, revisadas y aprobadas para intervención serán las siguientes: \n \nBIOMA \nCOBERTURA \nTOTAL, \nÁREA \nA \nINTERVENIR \nFC \nTOTAL ÁREA \nA \nCOMPENSAR \nHelobioma \nAltillanura \nBosque de galería y/o ripario \n0,15 \n5,5 \n0,825 \nHerbazal denso de tierra firme con arbustos \n0,15 \n5,5 \n0,825 \n\nResolución No. 2651       Del 14 NOV. 2023          Hoja No. 106 de 108 \n \n“Por la cual se resuelve un recurso de reposición contra la Resolución 1885 del 25 de agosto de 2023” \nPágina 106 de 108 \n \nHerbazal denso de tierra firme no arbolado \n1,72 \n5,5 \n9,46 \nPeinobioma \nAltillanura \nBosque de galería y/o ripario \n0,04 \n5,25 \n0,21 \nHerbazal denso de tierra firme con arbustos \n4,28 \n5,25 \n22,47 \nHerbazal denso de tierra firme no arbolado \n129,08 \n5,25 \n677,67 \nTotal \n135,42 \n \n711,5 \n(…)”. \nARTICULO DÉCIMO PRIMERO. Confirmar el literal a) del artículo cuarto, el numeral 3 del artículo \ncuarto, obligación 4 del artículo décimo segundo, artículo vigésimo séptimo, literal d) del numeral 1 del \nartículo trigésimo cuarto, numeral 3 de la Ficha PSMB-2 del artículo trigésimo cuarto, de conformidad \ncon la parte motiva del presente acto administrativo. \n \nARTICULO DÉCIMO SEGUNDO. Reponer en el sentido de revocar los literales a y b del numeral 1 \nde la “FICHA PSMA 3 Emisiones atmosféricas, calidad del aire y ruido” del artículo trigésimo cuarto \nde la Resolución 1885 del 25 de agosto de 2023, de conformidad con la parte motiva del presente acto \nadministrativo. \n \nARTÍCULO DÉCIMO TERCERO. Los demás términos, condiciones y obligaciones establecidas en la \nResolución 1885 del 25 de agosto de 2023, que no fueron modificados en el presente acto \nadministrativo continúan vigentes. \n \nARTÍCULO DÉCIMO CUARTO. Notificar el presente acto administrativo a la sociedad Frontera Energy \nColombia Corp. Sucursal Colombia., a través de su representante legal, o apoderado, o a la persona \nautorizada, de conformidad con los artículos 67 y siguientes del Código de Procedimiento \nAdministrativo y de lo Contencioso Administrativo. \n \nARTÍCULO DÉCIMO QUINTO. Comunicar el presente Acto Administrativo a la Corporación para el \nDesarrollo Sostenible del Área Manejo Especial la Macarena - CORMACARENA, a la Alcaldía \nmunicipal de Puerto Gaitán en el departamento del Meta y a la Procuraduría Delegada para Asuntos \nAmbientales, Minero Energéticos y Agrarios, para lo de su competencia. \n \nARTÍCULO DÉCIMO SEXTO. Disponer la publicación de la presente Resolución en la gaceta \nambiental de esta Entidad.  \n \nARTÍCULO DÉCIMO SÉPTIMO. Contra el presente acto administrativo no procede ningún recurso, \nde conformidad con lo establecido en el inciso segundo del numeral 2 del artículo 74 de la Ley 1437 \nde 2011. \n \n \nNOTIFÍQUESE, COMUNÍQUESE, PUBLÍQUESE Y CÚMPLASE \n \nDado en Bogotá D.C., a los 14 NOV. 2023 \n\nResolución No. 2651       Del 14 NOV. 2023          Hoja No. 107 de 108 \n \n“Por la cual se resuelve un recurso de reposición contra la Resolución 1885 del 25 de agosto de 2023” \nPágina 107 de 108 \n \n \n \n \n \n \nRODRIGO ELIAS NEGRETE MONTES \nDIRECTOR GENERAL \n \n \n \n \n \nMARIA CATALINA SANTANA HERNANDEZ \nCONTRATISTA \n \n \n \nJHON WILLIAN MARMOL MONCAYO \nCONTRATISTA \n \n \n \nOSCAR MAURICIO JARAMILLO RODRIGUEZ \nASESOR \n \n \n \nALVARO CEBALLOS HERNANDEZ \nCONTRATISTA \n \n \n \nExpediente No. EXPEDIENTE LAM4795 \nConcepto Técnico N°  Concepto Técnico 7753 del 14 de noviembre de 2023 \nFecha: \n \nNoviembre de 2023 \n \nProceso No.: 20231000026514 \n \nNota: Este es un documento electrónico generado desde los Sistemas de Información de la ANLA. El original reposa en los archivos digitales de la \nEntidad \n \n \n \n \n \n \n \n \n \n \n \n \n \n\nResolución No. 2651       Del 14 NOV. 2023          Hoja No. 108 de 108 \n \n“Por la cual se resuelve un recurso de reposición contra la Resolución 1885 del 25 de agosto de 2023” \nPágina 108 de 108 \n \n \n \n \n \n \n \n \n \n"
}