{
  "fuente": "ANLA_GACETA",
  "numero_resolución": "RESOLUCIÓN N° 03040",
  "fecha_resolución": "2022-12-23",
  "nombre_proyecto": "proyecto “Explotación Bloque Cabrestero”.",
  "ubicación": "departamento de Casanare, a la Corporación Autónoma Regional de la Orinoquia – CORPORINOQUIA, y a la Procuraduría Delegada para Asuntos Ambientales y Agrarios.",
  "empresa": "esta Autoridad otorgó Licencia Ambiental a la empresa PAREX RESOURCES COLOMBIA LTD",
  "numero_expediente": "LAV0084-00-2014",
  "radicados": [
    "2021092418",
    "2022121736",
    "2019208071",
    "2020196716"
  ],
  "descripcion": "Por la cual se resuelve un recurso de reposición interpuesto contra la Resolución 1129 del 31 de mayo de 2022 y se adoptan otras determinaciones",
  "tipos_infraccion": [
    "Tala o afectación de bosques",
    "Incumplimiento del PMA"
  ],
  "pdf_id": "41391",
  "file_name": "ANLA_41391.pdf",
  "texto_completo": "|\nRepública de Colombia\nMinisterio de Ambiente y Desarrollo Sostenible\nAUTORIDAD NACIONAL DE LICENCIAS AMBIENTALES \n- ANLA –\nRESOLUCIÓN N°  03040\n( 23 de diciembre de 2022 )\nOficinas: Carrera 13 A No. 34 – 72 Edificio 13 35 Pisos 8 Bogotá, D.C.\nCentro de Orientación y Radicación de Correspondencia: Carrera 13 A No. 34 – 72 Edificio 13 35 \nLocales 110 al 112 Bogotá, D.C.  \nCódigo Postal 110311156\nNit.: 900.467.239-2\nLínea de Orientación y Contacto Ciudadano: 57 (1) 2540100 / 018000112998 PBX: 57 (1) 2540111\nwww.anla.gov.co    Email: licencias@anla.gov.co  \nPágina 1 de 26\n “Por la cual se resuelve un recurso de reposición interpuesto contra la Resolución 1129 del \n31 de mayo de 2022 y se adoptan otras determinaciones”\nEL DIRECTOR GENERAL DE LA AUTORIDAD NACIONAL DE LICENCIAS AMBIENTALES – \nANLA\nEn uso de sus facultades legales asignadas en la Ley 99 de 1993, la Ley 1437 de 2011, el Decreto-\nley 3573 del 27 de septiembre de 2011, el Decreto 1076 del 26 de mayo de 2015, el Decreto 376 de \n11 de marzo de 2020, la Resolución 1957 del 5 de noviembre de 2021, Resolución 1223 del 19 de \nseptiembre de 2022 y,\nCONSIDERANDO:\nQue mediante Resolución 1271 del 9 de octubre de 2015, esta Autoridad otorgó Licencia Ambiental a \nla empresa PAREX RESOURCES COLOMBIA LTD. SUCURSAL, para el desarrollo del proyecto \n“Explotación Bloque Cabrestero”.\nQue a través de la Resolución 1450 del 15 de noviembre de 2017, la Autoridad Nacional de Licencias \nAmbientales modificó la Licencia Ambiental Global otorgada mediante Resolución No. 1271 del 9 de \noctubre de 2015, en el sentido de incluir el permiso de explotación de aguas subterráneas y establecer \nen el Plan de Manejo Ambiental la Ficha AB-13 Manejo de la exploración de aguas subterráneas, para \nla etapa pre-operativa o de exploración de aguas subterráneas.\nQue por medio de la Resolución 1656 del 22 de agosto de 2019 la Autoridad Nacional de Licencias \nAmbientales modificó la licencia ambiental otorgada al proyecto en el sentido de aprobar la solicitud \nde acogimiento al régimen de transición establecido en el numeral 2 del artículo 10 de la Resolución \n0256 del 22 de febrero de 2018, modificada por la Resolución 1428 del 31 de julio de 2018, referida a \nla compensación para el medio biótico.\nQue mediante Resolución 1753 del 4 de septiembre de 2019 la Autoridad Nacional de Licencias \nAmbientales modificó la licencia ambiental otorgada al proyecto, respecto al alcance de la obligación \nde la inversión forzosa del 1%, en el sentido de aprobar la solicitud de acogimiento al régimen de \ntransición establecido en el numeral 3 del artículo 2.2.9.3.1.17 del Decreto 2099 del 22 de diciembre \nde 2016.\nQue a través de la Resolución 498 del 24 de marzo de 2020 la Autoridad Nacional de Licencias \nAmbientales modificó la Resolución 1271 del 9 de octubre de 2015, en el sentido de aprobar Plan de \nInversión Forzosa de no menos del 1%.\n\nResolución No.  03040           Del   23 de diciembre de 2022            Hoja No. 2 de 26\n“Por la cual se resuelve un recurso de reposición interpuesto contra la Resolución 01129 del 31 de mayo de 2022 y se \nadoptan otras determinaciones”\nOficinas: Carrera 13 A No. 34 – 72 Edificio 13 35 Pisos 8 Bogotá, D.C.\nCentro de Orientación y Radicación de Correspondencia: Carrera 13 A No. 34 – 72 Edificio 13 35 \nLocales 110 al 112 Bogotá, D.C.  \nCódigo Postal 110311156\nNit.: 900.467.239-2\nLínea de Orientación y Contacto Ciudadano: 57 (1) 2540100 / 018000112998 PBX: 57 (1) 2540111\nwww.anla.gov.co    Email: licencias@anla.gov.co  \nPágina 2 de 26\nQue a través de la Resolución 778 del 29 de abril de 2021 la Autoridad Nacional de Licencias \nAmbientales aprueba el Plan de compensación biótica y se adoptan otras disposiciones.\nQue por Resolución 1129 del 31 de mayo de 2022 la Autoridad Nacional de Licencias Ambientales \nimpone a solicitud de la sociedad PAREX RESOURCES COLOMBIA LTD. SUCURSAL, medidas de \nmanejo para la conservación de especies de la flora silvestre sujetas a veda en el área del proyecto \n“Explotación del Bloque Cabrestero”, presentadas a esta Autoridad mediante radicado 2021092418-\n1-000 del 11 de mayo de 2021.\nQue mediante radicado 2022121736-1-000 del 14 de junio de 2022 la Sociedad PAREX RESOURCES \nCOLOMBIA LTD. SUCURSAL interpuso recurso de reposición en contra de la Resolución 1129 de 31 \nde mayo de 2022.\nQue con fundamento en el referido recurso y para efectos de su decisión, esta Autoridad emitió el \nConcepto Técnico 5228 del 31 de agosto de 2022, a ser acogido en el presente acto administrativo.\nDE LA COMPETENCIA DE LA AUTORIDAD NACIONAL DE LICENCIAS AMBIENTALES\nMediante Decreto-Ley 3573 de 27 de septiembre de 2011, el Gobierno Nacional en uso de las \nfacultades extraordinarias conferidas mediante la Ley 1444 de 2011 creó la Autoridad Nacional de \nLicencias Ambientales– ANLA. Entidad encargada de que los proyectos, obras o actividades sujetos \na licenciamiento, permiso o trámite ambiental cumplan con la normativa ambiental. De tal manera que \ncontribuyan al desarrollo sostenible ambiental del País.\nDe acuerdo con el numeral 2 del artículo segundo del Decreto 376 del 11 de marzo de 2020, “por \nmedio del cual se modifica la estructura de la Autoridad Nacional de Licencias Ambientales”, le \ncorresponde al director general de la Entidad, suscribir los actos administrativos que otorgan, niegan, \nmodifican, ajustan o declaran la terminación de las licencias, permisos y trámites ambientales.\nA través de la Resolución 1957 del 5 de noviembre de 2021 se adoptó el Manual Específico de \nFunciones y de Competencias Laborales para los empleos de la Planta de Personal de la Autoridad \nNacional de Licencias Ambientales, asignando la función de suscripción del presente acto \nadministrativo al Director General.\nPara el presente caso, es de destacar que la Resolución 1129 de 31 de mayo de 2022, objeto del \npresente recurso de reposición, fue suscrita por el Director General de esta Autoridad. Por tal razón y \nen consideración a la finalidad y esencia del recurso de reposición, es el funcionario competente para \nla suscripción del presente acto administrativo que lo decide de fondo.\nMediante Resolución 1223 del 19 de septiembre de 2022, el Ministerio de Ambiente y Desarrollo \nSostenible nombró en el empleo de director general de Unidad Administrativa Código 015 de la \nAutoridad Nacional de Licencias Ambientales –ANLA, al abogado RODRIGO ELÍAS NEGRETE \nMONTES.\nDe los deberes estatales con relación al ambiente y recursos naturales\nLa Constitución Política de Colombia en el Capítulo Tercero del Título Segundo denominado “De los \nderechos, las garantías y los deberes”, incluyó los derechos colectivos y del ambiente, o también \nllamados derechos de tercera generación, con el fin de regular la preservación del ambiente y de sus \nrecursos naturales, comprendiendo el deber que tienen el Estado y sus ciudadanos de realizar todas \nlas acciones para protegerlo, e implementar aquellas que sean necesarias para mitigar el impacto que \ngenera la actividad antrópica sobre el entorno natural.\n\nResolución No.  03040           Del   23 de diciembre de 2022            Hoja No. 3 de 26\n“Por la cual se resuelve un recurso de reposición interpuesto contra la Resolución 01129 del 31 de mayo de 2022 y se \nadoptan otras determinaciones”\nOficinas: Carrera 13 A No. 34 – 72 Edificio 13 35 Pisos 8 Bogotá, D.C.\nCentro de Orientación y Radicación de Correspondencia: Carrera 13 A No. 34 – 72 Edificio 13 35 \nLocales 110 al 112 Bogotá, D.C.  \nCódigo Postal 110311156\nNit.: 900.467.239-2\nLínea de Orientación y Contacto Ciudadano: 57 (1) 2540100 / 018000112998 PBX: 57 (1) 2540111\nwww.anla.gov.co    Email: licencias@anla.gov.co  \nPágina 3 de 26\nEn relación con la protección del medio ambiente, la Carta Política establece que es obligación del \nEstado y de las personas, proteger las riquezas culturales y naturales de la Nación (Art. 8º); en el \nmismo sentido, se señala que es deber de la persona y del ciudadano proteger los recursos culturales \ny naturales del país y velar por la conservación de un ambiente sano (Art. 95); y establece \nadicionalmente, la Carta Constitucional que todas las personas tienen derecho a gozar de un ambiente \nsano, y es deber del Estado proteger la diversidad e integridad del ambiente, conservar la áreas de \nespecial importancia ecológica y fomentar la educación para el logro de estos fines (Art. 79).\nAsí mismo, por mandato constitucional le corresponde al Estado planificar el manejo y \naprovechamiento de los recursos naturales, para garantizar su desarrollo sostenible, su conservación, \nrestauración o sustitución. Además, deberá prevenir y controlar los factores de deterioro ambiental, \nimponiendo las sanciones legales y exigiendo la reparación de los daños causados (Art. 80).\nDel control y seguimiento ambiental\nEn lo que respecta al régimen jurídico aplicable a la presente actuación, se encuentra procedente \ncumplir con las prerrogativas establecidas en el Decreto 1076 de 2015, “Por medio del cual se expide \nel Decreto Único Reglamentario del Sector Ambiente y Desarrollo sostenible”, cuyo objeto es compilar \nla normatividad expedida por el Gobierno Nacional en el ejercicio de las facultades reglamentarias \nconferidas por el numeral 11 del artículo 189 de la Constitución Política, para la cumplida ejecución de \nlas leyes del sector Ambiente.\nAhora bien, el artículo 3.1.2 de la Parte 1 del Libro 3 del citado decreto, señala que el mismo rige a \npartir de su publicación en el Diario Oficial, hecho acaecido el 26 de mayo de 2015 en razón a la \npublicación efectuada en el Diario Oficial 49523.\nMediante el Decreto 1076 del 26 de mayo de 2015, el Gobierno Nacional reglamenta el Título VIII de \nla Ley 99 de 1993 sobre licencias con el objetivo de fortalecer el proceso de licenciamiento ambiental, \nla gestión de las autoridades ambientales y promover la responsabilidad ambiental en aras de la \nprotección del medio ambiente.\nDispone el Decreto 1076 de 2015, en su artículo 2.2.2.3.9.1, que es función de la Autoridad Ambiental, \nrealizar el control y seguimiento a los proyectos, obras o actividades sujetos a Licencia Ambiental o \nPlan de Manejo Ambiental, dentro de las cuales se encuentran las actividades sometidas al régimen \nlegal de permisos, concesiones y/o autorizaciones ambientales para el uso y aprovechamiento de \nrecursos naturales, como en el presente caso, durante todas sus fases de construcción, operación, \ndesmantelamiento o abandono.\nDicha gestión de seguimiento y control permite a la Autoridad Ambiental conocer el estado de \ncumplimiento de las obligaciones a cargo del titular del instrumento de manejo y control ambiental, así \ncomo los actos administrativos expedidos en razón del proyecto, lo que conlleva a efectuar los \nrequerimientos a que haya lugar.\nEn cuanto a la naturaleza dinámica de la Licencia Ambiental, la Corte Constitucional ha señalado, en \nSentencia C-035 de 1999 con M.P Antonio Barrera Carbonell, lo siguiente:\n“La licencia habilita a su titular para obrar con libertad, dentro de ciertos límites, en la ejecución de la respectiva \nobra o actividad; pero el ámbito de las acciones u omisiones que aquél puede desarrollar aparece reglado por \nla autoridad ambiental, según las necesidades y conveniencias que ésta discrecional pero razonablemente \naprecie, en relación con la prevención, mitigación, corrección, compensación y manejo de los efectos o impactos \nambientales que la obra o actividad produzca o sea susceptible de producir. De este modo, la licencia ambiental \ntiene indudablemente un fin preventivo o precautorio en la medida en que busca eliminar o por lo menos \nprevenir, mitigar o reversar, en cuanto sea posible, con la ayuda de la ciencia y la técnica, los efectos nocivos \nde una actividad en los recursos naturales y el ambiente”. (Subrayas fuera del texto original).\n\nResolución No.  03040           Del   23 de diciembre de 2022            Hoja No. 4 de 26\n“Por la cual se resuelve un recurso de reposición interpuesto contra la Resolución 01129 del 31 de mayo de 2022 y se \nadoptan otras determinaciones”\nOficinas: Carrera 13 A No. 34 – 72 Edificio 13 35 Pisos 8 Bogotá, D.C.\nCentro de Orientación y Radicación de Correspondencia: Carrera 13 A No. 34 – 72 Edificio 13 35 \nLocales 110 al 112 Bogotá, D.C.  \nCódigo Postal 110311156\nNit.: 900.467.239-2\nLínea de Orientación y Contacto Ciudadano: 57 (1) 2540100 / 018000112998 PBX: 57 (1) 2540111\nwww.anla.gov.co    Email: licencias@anla.gov.co  \nPágina 4 de 26\nDel recurso de reposición frente a los actos administrativos\nDe acuerdo con la legislación, el recurso de reposición constituye un instrumento legal mediante el \ncual la parte interesada tiene la oportunidad de ejercer el derecho de controvertir una decisión, para \nque la administración previa su evaluación, la confirme, aclare modifique o revoque, previo el lleno de \nlas exigencias legales establecidas para dicho efecto.\nEn dicho sentido, la finalidad esencial del recurso de reposición no es otra distinta a que al funcionario \nde la administración que tomó una decisión administrativa, tenga la oportunidad para que enmiende o \ncorrija un error, o los posibles errores que se hayan podido presentar en el acto administrativo por él \nexpedido, en ejercicio de sus funciones.\nEl procedimiento para la presentación y decisión de recursos contra los actos administrativos – antigua \nvía gubernativa-, se encuentra reglado en el Código de Procedimiento Administrativo y de lo \nContencioso Administrativo - Ley 1437 de 2011 -, en los artículos 74 y siguientes, que expresan:\n“Artículo 74. Recursos contra los actos administrativos. – Por regla general, contra los actos \ndefinitivos procederán los siguientes recursos:\n1. El de reposición, ante quien expidió la decisión para que la aclare, modifique, adicione o revoque.”\nLa oportunidad y presentación del recurso de reposición esta reglada en el artículo 76 del mismo \nCódigo, así:\n“Artículo 76. Los recursos de reposición y apelación deberán interponerse por escrito en la diligencia \nde notificación personal, o dentro de los diez (10) días siguientes a ella, o a la notificación por aviso, o \nal vencimiento del término de publicación, según el caso. Los recursos contra los actos presuntos \npodrán interponerse en cualquier tiempo, salvo en el evento en que se haya acudido ante el juez.\nLos recursos se presentarán ante el funcionario que dictó la decisión (…)”\nAdemás del plazo para el ejercicio de los recursos, el artículo 77 del precitado Código fija los requisitos \nformales que deben cumplir para su interposición, así:\n“Artículo 77. Por regla general los recursos se interpondrán por escrito que no requiere de \npresentación personal si quien lo presenta ha sido reconocido en la actuación. Igualmente, podrán \npresentarse por medios electrónicos.\nLos recursos deberán reunir, además, los siguientes requisitos:\n1.Interponerse dentro del plazo legal, por el interesado o su representante o apoderado debidamente \nconstituido.\n2.Sustentarse con expresión concreta de los motivos de inconformidad.\n3.Solicitar y aportar las pruebas que se pretende hacer valer.\n4.Indicar el nombre y la dirección del recurrente, así como la dirección electrónica si desea ser \nnotificado por este medio.\nSólo los abogados en ejercicio podrán ser apoderados. Si el recurrente obra como agente oficioso, \ndeberá acreditar la calidad de abogado en ejercicio, y prestar la caución que se le señale para \ngarantizar que la persona por quien obra ratificará su actuación dentro del término de dos (2) meses.\nSi no hay ratificación se hará efectiva la caución y se archivará el expediente. Para el trámite del \nrecurso el recurrente no está en la obligación de pagar la suma que el acto recurrido le exija. Con todo, \npodrá pagar lo que reconoce deber”.\nDe otra parte, el artículo 80 establece el alcance del contenido de la decisión que resuelve el recurso:\n\nResolución No.  03040           Del   23 de diciembre de 2022            Hoja No. 5 de 26\n“Por la cual se resuelve un recurso de reposición interpuesto contra la Resolución 01129 del 31 de mayo de 2022 y se \nadoptan otras determinaciones”\nOficinas: Carrera 13 A No. 34 – 72 Edificio 13 35 Pisos 8 Bogotá, D.C.\nCentro de Orientación y Radicación de Correspondencia: Carrera 13 A No. 34 – 72 Edificio 13 35 \nLocales 110 al 112 Bogotá, D.C.  \nCódigo Postal 110311156\nNit.: 900.467.239-2\nLínea de Orientación y Contacto Ciudadano: 57 (1) 2540100 / 018000112998 PBX: 57 (1) 2540111\nwww.anla.gov.co    Email: licencias@anla.gov.co  \nPágina 5 de 26\n“Artículo 80. Decisión de los recursos. - Vencido el período probatorio, si a ello hubiere lugar, y sin \nnecesidad de acto que así lo declare, deberá proferirse la decisión motivada que resuelva el recurso.\nLa decisión resolverá todas las peticiones que hayan sido oportunamente planteadas y las que surjan \ncon motivo del recurso.”\nPor su parte y con relación a la conclusión del procedimiento administrativo, expresa el artículo 87 del \nestatuto mencionado, lo siguiente:\n“Artículo 87. Firmeza de los actos administrativos. Los actos administrativos quedarán en firme: \n(…)\n“2 Desde el día siguiente a la publicación, comunicación o notificación de la decisión sobre los recursos \ninterpuestos (…)”.\nPara el caso concreto, la Resolución 01129 del 31 de mayo de 2022 es un acto administrativo \nsusceptible de ser recurrido según el artículo 74 de la Ley 1437 de 2011, puesto que se trata de un \nacto definitivo, adopta una decisión que manifiesta la voluntad del Estado, generadora de efectos \njurídicos y que pone fin a una actuación iniciada a petición de parte, que en los términos del Consejo \nde Estado, tal como lo señaló en sentencia de la Sección Tercera de la Sala de lo Contencioso \nAdministrativo, del 8 de marzo de 2012, se caracteriza por lo siguiente:\n“… Por el contrario, los actos definitivos ponen fin de manera perentoria a la actuación administrativa \nsea de oficio o impulsada a petición de parte, de modo que en ellos se agota la actividad de la \nadministración, o tan sólo queda pendiente la ejecución de lo decidido. Ahora bien, es cierto que los \núnicos actos susceptibles de la Acción Contenciosa Administrativa son los actos definitivos, es decir \nque se excluyen los de trámite, pues éstos se controlan jurisdiccionalmente como parte integrante del \nacto definitivo y conjuntamente con éste, es decir de aquel que cierra la actuación administrativa.”\nAtendiendo a lo descrito con relación a los requisitos y condiciones que deben observarse al interponer \nel recurso de reposición, en el presente caso, se puede concluir lo siguiente:\n1.El recurso se interpuso por escrito y está dirigido a la Autoridad Nacional de Licencias Ambientales, \npor lo que se cumple este requisito.\n2.En cuanto a la oportunidad legal para interponer el recurso, se tiene que la notificación de la \nResolución 001129 del 31 de mayo de 2022 a la sociedad PAREX RESORUCES COLOMBIA LTD. \nSUCURSAL .-  hoy recurrente -, se surtió por medio de correo electrónico el 01 de junio de 2022 y \nquedó efectuada surtida el día hábil siguiente; atendiendo a los diez (10) días hábiles de término para \ninterponer el recurso, contados a partir del día siguiente de la notificación, tal término vencía el 15 de \njunio de 2022,  y el 14 de junio de 2022  se interpuso el recurso. Por lo tanto, se concluye que el mismo \nfue presentado en la debida oportunidad legal.\n3.En el desarrollo del recurso, el apoderado general suplente de la sociedad expone de manera \nconcreta sus motivos de inconformidad, frente a la Resolución 001129 del 31 de mayo de 2022. En \nesa medida, este requisito se cumple.\n4. Asimismo, es interpuesto por el apoderado general suplente de la sociedad PAREX RESORUCES \nCOLOMBIA LTD. SUCURSAL., de conformidad con la Resolución del 16 de diciembre de 2015 de \nDirectorio, inscrita en la Cámara de Comercio el 26 de enero de 2016 con el No. 00253676 del libro \nIV, según consta en el certificado de existencia y representación legal, la cual lo faculta para adelantar \nel presente trámite. En esa medida, hay legitimación por activa para interponer el recurso.\n\nResolución No.  03040           Del   23 de diciembre de 2022            Hoja No. 6 de 26\n“Por la cual se resuelve un recurso de reposición interpuesto contra la Resolución 01129 del 31 de mayo de 2022 y se \nadoptan otras determinaciones”\nOficinas: Carrera 13 A No. 34 – 72 Edificio 13 35 Pisos 8 Bogotá, D.C.\nCentro de Orientación y Radicación de Correspondencia: Carrera 13 A No. 34 – 72 Edificio 13 35 \nLocales 110 al 112 Bogotá, D.C.  \nCódigo Postal 110311156\nNit.: 900.467.239-2\nLínea de Orientación y Contacto Ciudadano: 57 (1) 2540100 / 018000112998 PBX: 57 (1) 2540111\nwww.anla.gov.co    Email: licencias@anla.gov.co  \nPágina 6 de 26\n5. Por último, la dirección de notificaciones del recurrente se encuentra debidamente registrada y es \ninequívoca su individualización, por lo tanto, se tiene por cumplido este requisito.\nEn armonía con lo indicado, en el plano de lo axiológico, en toda actuación administrativa que se surta \nante esta Autoridad Ambiental, deben respetarse los principios que orientan las relaciones entre el \nEstado y los particulares consagrados en el artículo 209 de la Constitución Política de 1991, \ndesarrollados igualmente en el artículo tercero de la Ley 1437 de 2011, con el fin de asegurar que con \nla actividad administrativa de las entidades del Estado, se garantice y se satisfaga el interés común y, \ndesde lo ambiental, la materialización de los principios y directrices que gobiernan y son derroteros en \nla materia.\nSiendo ello así, al verificarse el cumplimiento de los requisitos legales establecidos en la normatividad \nvigente para la procedencia del recurso de reposición, se procederá al análisis de fondo de los motivos \nde inconformidad del recurrente tal y como se expone a continuación.\nCONSIDERACIONES TÉCNICAS DE LA AUTORIDAD NACIONAL DE LICENCIAS AMBIENTALES \nFRENTE AL RECURSO DE REPOSICIÓN INTERPUESTO POR LA SOCIEDAD PAREX \nRESOURCES COLOMBIA LTD SUCURSAL. \nEsta Autoridad, analizó los argumentos expuestos por el recurrente en su escrito de recurso y como \nresultado, se emitió el Concepto Técnico 5228 del 31 de agosto de 2022 para dar respuesta y adoptar \ndecisión frente a los argumentos presentados por la sociedad.\nEn ese orden de ideas y con el propósito de exponer las consideraciones efectuadas en el concepto \ntécnico aludido, esta Autoridad indicará la disposición recurrida (artículos) de la Resolución 01129 del \n31 de mayo de 2022 – las cuales se abordarán de manera independiente y con los respectivos literales \nA, B y C -, para luego presentar la solicitud que hace la sociedad, los argumentos que la sustentan y \nfinalmente, lo considerado por esta Autoridad, así como también la decisión adoptada frente a cada \npretensión en sede de recurso.\nA. DISPOSICIÓN RECURRIDA\n“(…) ARTÍCULO TERCERO. La sociedad PAREX RESOURCES COLOMBIA LTD. SUCURSAL, \ndeberá ajustar las fichas anteriormente citadas y presentarlas para verificación de la ANLA previo al \ndesarrollo de obras y actividades que requieran intervención de áreas con presencia de flora silvestre \nen condición de veda, según se indica a continuación: \n(…)\n2.7 Medida 7. Cronograma de actividades. Ajustar en el sentido de: \na. Establecer en el cronograma de actividades con tiempo total de seis (6) años, contemplando un (1) \naño para la fase de selección de áreas, caracterización de las condiciones ambientales del área a \nrehabilitar, definición de diseños florístico, establecimiento, aislamiento y montaje de parcelas \npermanentes de monitoreo; cinco (5) años en los cuales debe desarrollar tres (3) años mantenimiento, \nseguido de dos (2) años más para continuar con las actividades de monitoreo de las especies de flora \nepífita no vascular”. \nPetición de la empresa\nReponer en el sentido de modificar el literal a) del numeral 2.7. del artículo tercero de la Resolución 01129 de \n31 de mayo de 2022, de tal manera que el término total del cronograma sea de cuatro (4) años, teniendo en \ncuenta los lineamientos previstos por la ANLA y el MADS en el numeral 2.1.2. “Recuperación, Rehabilitación o \nRestauración Ecológica, quedando de la siguiente manera: \n\nResolución No.  03040           Del   23 de diciembre de 2022            Hoja No. 7 de 26\n“Por la cual se resuelve un recurso de reposición interpuesto contra la Resolución 01129 del 31 de mayo de 2022 y se \nadoptan otras determinaciones”\nOficinas: Carrera 13 A No. 34 – 72 Edificio 13 35 Pisos 8 Bogotá, D.C.\nCentro de Orientación y Radicación de Correspondencia: Carrera 13 A No. 34 – 72 Edificio 13 35 \nLocales 110 al 112 Bogotá, D.C.  \nCódigo Postal 110311156\nNit.: 900.467.239-2\nLínea de Orientación y Contacto Ciudadano: 57 (1) 2540100 / 018000112998 PBX: 57 (1) 2540111\nwww.anla.gov.co    Email: licencias@anla.gov.co  \nPágina 7 de 26\n“ARTÍCULO TERCERO. 2.7 Medida 7. Cronograma de actividades. Ajustar en el sentido de:\na. Establecer en el cronograma de actividades con tiempo total de cuatro (4) años, contemplando un \n(1) año para la fase de selección de áreas, caracterización de las condiciones ambientales del área a \nrehabilitar, definición de diseños florístico, establecimiento, aislamiento; y tres (3) años en los cuales \ndebe desarrollar el mantenimiento de los árboles sembrados y al finalizar dicho tiempo se realizará una \ncaracterización representativa de las especies no vasculares en veda sobre los nuevos feófitos”.\nArgumentos de la Empresa\nLa ANLA indica basar su análisis en la Circular 8201-2-808 del 9 de diciembre de 2019 del MADS, numeral \n2.1.2. Recuperación, Rehabilitación o Restauración Ecológica, el cual señala lo siguiente: \nh) Incluir en las acciones de recuperación, rehabilitación y restauración de ecosistemas, parcelas de \nmonitoreo o permanentes, que permitirán la toma de datos parametrizados con el fin de obtener \ninformación comparativa que evidencie la efectividad en el desarrollo de la medida a través del tiempo. \nSe deberá priorizar la evaluación de parámetros como colonización de especies en veda en sustratos \nepifitos, rupícolas y terrestres, presencia y ausencia, fenología, abundancia registrada en unidad de \nmedida (cobertura cm2), hospederos y estado fitosanitario. \nLa ANLA estableció en la parte considerativa, entre otros aspectos, lo siguiente:\n“(…) OTRAS CONSIDERACIONES. Evaluación de Solicitud de Establecimiento de Medidas para el Manejo y \nConservación de Especies en Veda. MEDIDAS DE MANEJO AMBIENTAL PARA ESPECIES EN VEDA. \nPrograma de Manejo Ambiental para el rescate, traslado y reubicación de las especies vasculares de hábito \nepífito (EVHE). Ficha de Manejo 02: Programa de manejo de epífitas (No Vasculares). Medida 7. Cronograma \nde actividades. Consideraciones: al verificar la ficha 02. Programa de manejo de epífitas No vasculares se \ndetalla la inclusión de un cronograma de actividades para el desarrollo de la medida de rehabilitación ecológica, \nen el cual se describen actividades para 4 años en total pese a que se plantea un calendario de 5 años, como \nse cita a continuación: (…tabla del cronograma presentado por Parex…). (…) De lo anterior se detalla que el \ncronograma de actividades debe ajustarse de manera que se proyecte completen actividades para un total de \n6 años, teniendo en cuenta lo señalado en el literal j) del numeral 2.1.2 de la circular 2019208071-3-000 del 31 \nde diciembre de 2019. \nObligación: Ajustar la ficha 02. Programa de manejo de epífitas No vasculares, en el sentido de establecer en \nel cronograma de actividades con tiempo total de seis (6) años, contemplando un (1) año para la fase de \nselección de áreas, caracterización de las condiciones ambientales del área a rehabilitar, definición de diseños \nflorístico, establecimiento, aislamiento y montaje de parcelas permanentes de monitoreo; cinco (5) años en los \ncuales debe desarrollar tres (3) años mantenimiento, seguido de dos (2) años más para continuar con las \nactividades de monitoreo de las especies de flora epífita no vascular.\nConsideraciones de Parex \n<0000> Temporalidad \nEn relación con la temporalidad, se aclara que Parex presentó un plan de manejo contemplando un tiempo de \nun (1) año para la fase de selección de áreas, caracterización de las condiciones ambientales del área a \nrehabilitar, definición de diseños florístico, establecimiento, aislamiento y tres (3) años de mantenimiento, \nmonitoreo y seguimiento, para un total de cuatro (4) años, lo cual es acorde con la Circular Interna No. 6 del 31 \nde diciembre de 2019 de la ANLA y la Circular 8201-2- 808 de 9 de diciembre de 2019 del MADS, archivo anexo \ndenominado “METODOLOGÍA PARA LA CARACTERIZACIÓN DE ESPECIES DE FLORA EN VEDA”, citadas \na continuación. \nLa Circular Interna No. 6 del 31 de diciembre de 2019 de la ANLA identificada con radicado 2019208071-3-000 \nseñala tres (3) años con respecto de los tiempos de seguimiento y monitoreo de especies no vasculares, \nestableció lo siguiente:\n“2. Medidas de Manejo \n\nResolución No.  03040           Del   23 de diciembre de 2022            Hoja No. 8 de 26\n“Por la cual se resuelve un recurso de reposición interpuesto contra la Resolución 01129 del 31 de mayo de 2022 y se \nadoptan otras determinaciones”\nOficinas: Carrera 13 A No. 34 – 72 Edificio 13 35 Pisos 8 Bogotá, D.C.\nCentro de Orientación y Radicación de Correspondencia: Carrera 13 A No. 34 – 72 Edificio 13 35 \nLocales 110 al 112 Bogotá, D.C.  \nCódigo Postal 110311156\nNit.: 900.467.239-2\nLínea de Orientación y Contacto Ciudadano: 57 (1) 2540100 / 018000112998 PBX: 57 (1) 2540111\nwww.anla.gov.co    Email: licencias@anla.gov.co  \nPágina 8 de 26\n(…) 2.1.1 Epífitas vasculares \n(…) Cronograma de actividades que contemplen el manejo, seguimiento y monitoreo por al menos 3 \naños, a partir de la terminación de las acciones de reubicación. \n(…) 2.1.1. Epifitas no vasculares \n(…) Definir las actividades de mantenimiento de los árboles plantados por un periodo de tres años, \npara garantizar la supervivencia de alrededor del 80% del material vegetal plantado. \n(…) 2.1.3 Especies arbóreas y helechos arbóreos \n(…) Respecto a las actividades de mantenimiento (riego, fertilización, resiembra, etc.) el solicitante \ndeberá indicar la duración de dichas actividades, la cual no será menor a tres (3) años. \n(…) El cronograma deberá indicar todas las actividades a desarrollar y deberá evidenciar de manera \ndetallada la periodicidad de las mismas. Es importante mencionar que la duración de las actividades \nno puede ser inferior a los tres (3) años. \n3. Plan de Seguimiento y Monitoreo \n(…) 3.1.2 Epifitas no vasculares \n(…) Establecer parcelas de monitoreo y conservación dentro de las áreas de reubicación en el proceso \nde rescate y traslado, para realizar seguimiento por tres (3) años, a los individuos de las especies no \nvasculares de hábito rupícola y terrestre, diferentes a las que se deben establecer dentro del proceso \nde Restauración Ecológica. \n3.1.3 Especies arbóreas y helechos arborescentes\n(…) El solicitante deberá presentar informes semestrales durante tres (3) años contados a partir de la \nfinalización de la reubicación y plantación por reposición del material vegetal. Estos informes deberán \nconsolidar la información relevante de los informes anteriores e incluir los avances a la fecha las \nacciones”. \nPor otra parte, la Circular 8201-2-808 de 9 de diciembre de 2019 del MADS, en el anexo denominado \n“METODOLOGÍA PARA LA CARACTERIZACIÓN DE ESPECIES DE FLORA EN VEDA”, también indica una \ntemporalidad de tres (3) años de seguimiento y monitoreo a partir de la siembra, así:\n2.1.2. Recuperación, Rehabilitación o Restauración Ecológica Esta medida de manejo se plantea por \nla afectación agregados de especies de musgos, hepáticas, anthoceros y líquenes, ante lo cual el \nobjetivo de la medida es recuperar, rehabilitar o restaurar los ecosistemas que sean hábitat de estas \nespecies. (…) \nh) Incluir en las acciones de recuperación, rehabilitación y restauración de ecosistemas, parcelas de \nmonitoreo o permanentes, que permitirán la toma de datos parametrizados con el fin de obtener \ninformación comparativa que evidencie la efectividad en el desarrollo de la medida a través del tiempo. \nSe deberá priorizar la evaluación de parámetros como colonización de especies en veda en sustratos \nepifitos, rupícolas y terrestres, presencia y ausencia, fenología, abundancia registrada en unidad de \nmedida (cobertura cm2), hospederos y estado fitosanitario. \n(…)\ni) Plantear y realizar un plan de seguimiento y mantenimiento que contemple mínimo tres años de \nmantenimiento y monitoreo, después de finalizado el establecimiento, o bien de acuerdo a los \nlineamientos del Plan Nacional de Restauración: Restauración Ecológica, Rehabilitación y \nRecuperación de áreas Disturbadas (MADS, 2015).\nComo se puede evidenciar, contrario a lo dispuesto en la Resolución 01129 de 31 de mayo de 2022 de ANLA, \nel lineamiento indicado en la Circular Interna No. 6 del 31 de diciembre de 2019 de la ANLA y la Circular 8201-2-\n808 de 9 de diciembre de 2019 del MADS es de tres (3) años, y no de un mayor tiempo, por lo tanto, en el \ncaso en concreto, todo el plan no debe superar los cuatro (4) años propuestos, un año aproximado de \nplaneación y tres (3) de ejecución. De lo contrario sería imponer una medida con un criterio de temporalidad \n\nResolución No.  03040           Del   23 de diciembre de 2022            Hoja No. 9 de 26\n“Por la cual se resuelve un recurso de reposición interpuesto contra la Resolución 01129 del 31 de mayo de 2022 y se \nadoptan otras determinaciones”\nOficinas: Carrera 13 A No. 34 – 72 Edificio 13 35 Pisos 8 Bogotá, D.C.\nCentro de Orientación y Radicación de Correspondencia: Carrera 13 A No. 34 – 72 Edificio 13 35 \nLocales 110 al 112 Bogotá, D.C.  \nCódigo Postal 110311156\nNit.: 900.467.239-2\nLínea de Orientación y Contacto Ciudadano: 57 (1) 2540100 / 018000112998 PBX: 57 (1) 2540111\nwww.anla.gov.co    Email: licencias@anla.gov.co  \nPágina 9 de 26\ndiferente al que tienen establecido la ANLA y el MADS para medidas de manejo de especies no vasculares \n(musgos, líquenes y hepáticas), desconociendo los lineamientos dados por dichas entidades. \n<0000> Especificaciones técnicas-Biológicas \nA nivel biológico, se aclara que la colonización reportada en diferentes continentes de especies no vasculares \nen veda sobre nuevos forófitos es muy lenta y los registros de crecimiento o aparición requieren lapsos en \nunidades de años usualmente, hecho ampliamente reportado por la literatura científica. También dado que la \núnica forma de caracterizarlas es mediante la colecta de muestras de herbario, tienen implícito este hecho la \nremoción de parte de la corteza de los forófitos y de las nuevas colonias de crecimiento para envío para \ndeterminación por parte de un herbario y/o especialista.\nPor lo tanto, Parex considera que no es recomendable, y además improcedente para los grupos biológicos no \nvasculares que recientemente se están desarrollando sobre esos nuevos forófitos implementar “…montaje de \nparcelas permanentes de monitoreo”, y también “…seguido de dos (2) años más para continuar con las \nactividades de monitoreo de las especies de flora epífita no vascular”. \nLo anterior, toda vez que la determinación taxonómica a especie o al mayor nivel de determinación en campo \nes imposible, dado que requiere el uso de estereoscopio y/o microscopio, incluso de reactivos químicos en \nalgunas especies y géneros, por tanto, el monitoreo repetitivo obligaría a una reiterada extracción de nuevas \nmuestras por cada monitoreo, que afectaría tanto el estado fitosanitario de los nuevos forófitos sembrados (en \nestado latizal y/o brinzal, los estados más pequeños de árboles), hecho que también reduciría o eliminaría gran \nparte o toda la colonización que se hubiese presentado hasta cada momento de monitoreo, por tanto no es \nrecomendable biológicamente y es contrario al objetivo de las medidas de manejo para especies no vasculares, \ndado que estas deben propender por el establecimiento de nuevas colonias de especies no vasculares en \nnuevos sustratos (corteza de árboles en este caso). \nPor lo anterior, y con el fin que se modifique el literal a del numeral 2.7 del artículo tercero de la Resolución \n01129 de 31 de mayo de 2022 (…) de tal manera que el término total del cronograma sea de cuatro (4) años, \nse incorpora en la actual ficha de manejo una propuesta de monitoreo directa de presencia y abundancia \nrepresentativa de especies no vasculares al finalizar los tres (3) años del mantenimiento de la plantación de \nrehabilitación ecológica, un único registro que permitirá describir las especies que han colonizado de manera \nrepresentativa algunos forófitos y relaciones de diversidad y abundancias generales/forófito, permitiendo que el \nmaterial continúe su desarrollo sin repetidas extracciones de especies no-vasculares sobre las superficies de \nlos árboles sembrados, evitando ocasionar daños o lesiones reiteradas o significativas a los nuevos forófitos y \ndisminución de las colonias que se hayan desarrollado sobre los forófitos sembrados. La propuesta incluye \nindicadores totales y por grupo biológico (…)”\nConsideraciones de la ANLA\nFrente a lo argumentado por la Sociedad, esta Autoridad realiza las siguientes precisiones con relación a la \ntemporalidad de las actividades de mantenimiento, monitoreo y seguimiento de especies no vasculares \nestablecidas en los apartes recurridos de la Resolución 1129 de 31 de mayo de 2022. \nSe aclara que el tiempo señalado de 6 años en el literal a) del numeral 2.7. del artículo tercero de la Resolución \n1129 de 31 de mayo de 2022, corresponde a una imprecisión en el proceso de evaluación a los tiempos \ndescritos por la Sociedad en el cronograma de actividades de la “Ficha 02. Programa de manejo de Epífitas No \nVasculares” presentada con radicado 2021092418-1-000 del 11 de mayo de 2021, dado que se asumió como \naño 1 del programa el denominado “año 0”al cual la Sociedad relaciona un tiempo de dos semestres “S1, S2” \npara la “Selección de las áreas objeto de la rehabilitación ecológica, Caracterización de las condiciones \nambientales del área a rehabilitar, Diseños florísticos definitivos, Proceso de siembra de la rehabilitación y \nmontaje de parcela permanente, Aislamiento con cerca inerte del área rehabilitada”\nA dicho año 1 se adicionó la directriz de 5 años para el desarrollo de actividades de “mantenimiento, seguimiento \ny monitoreo de las medidas de manejo a realizar (…) contados a partir de la finalización del establecimiento de \nla plantación” que señala el literal j) del subnumeral 2.1.2 Epifitas no vasculares del numeral 2. Medidas de \nManejo de la Circular No. 0016 del 31 de diciembre de 2019 (2019208071-3-000 del 31/12/2019) de la ANLA, \ncomo se cita a continuación. \n\nResolución No.  03040           Del   23 de diciembre de 2022            Hoja No. 10 de 26\n“Por la cual se resuelve un recurso de reposición interpuesto contra la Resolución 01129 del 31 de mayo de 2022 y se \nadoptan otras determinaciones”\nOficinas: Carrera 13 A No. 34 – 72 Edificio 13 35 Pisos 8 Bogotá, D.C.\nCentro de Orientación y Radicación de Correspondencia: Carrera 13 A No. 34 – 72 Edificio 13 35 \nLocales 110 al 112 Bogotá, D.C.  \nCódigo Postal 110311156\nNit.: 900.467.239-2\nLínea de Orientación y Contacto Ciudadano: 57 (1) 2540100 / 018000112998 PBX: 57 (1) 2540111\nwww.anla.gov.co    Email: licencias@anla.gov.co  \nPágina 10 de 26\n“2. Medidas de Manejo\n2.1.2 Epífitas no vasculares\n(…) f. Definir las actividades de mantenimiento de los árboles plantados por un periodo de tres años, \npara garantizar la supervivencia de alrededor del 80% del material vegetal plantado. (…).\n(…) j) Cronograma de actividades de mantenimiento, seguimiento y monitoreo de las medidas de manejo \na realizar en concordancia con el cronograma de ejecución de obra, con una duración de cinco (5) años, \ncontados a partir de la finalización del establecimiento de la plantación, donde se especifique la fecha de \ninicio de las obras del proyecto y la fecha de inicio del proceso de restauración ecológica. (…)”.\nAl respecto se precisa que las actividades que la Sociedad adelante en “año 0”, no están incluidas en el \ncronograma a que hace relación el literal j) citado, toda vez que están a cargo de la gestión y procedimientos \ndel titular del proyecto cuyos tiempos de ejecución pueden variar por circunstancias ajenas al desarrollo del \nprograma de rehabilitación ecológica de la ficha BI-14. Manejo de Epífitas No vasculares, razón por lo cual dicho \nliteral hace referencia al cronograma de actividades de “mantenimiento, seguimiento y monitoreo de las medidas \nde manejo a realizar” las cuales tendrán lugar a partir de la finalización del establecimiento de las especies del \nprograma de rehabilitación ecológica, efectuándolas de manera simultánea durante los primeros 3 años y en \nlos 2 años restantes continúa las labores de seguimiento y monitoreo.\nAdicionalmente, se aprecia que el literal j) del numeral 2.1.2 (2.1.2 Recuperación, Rehabilitación o Restauración \nEcológica) de la Circular 8201-2-808 del 9 de diciembre de 2019 del MADS, archivo anexo denominado \n“METODOLOGÍA PARA LA CARACTERIZACIÓN DE ESPECIES DE FLORA EN VEDA”, al que hace referencia \nla Sociedad, establece como medida: “j. Plantear y realizar un plan de seguimiento y mantenimiento que \ncontemple mínimo tres años de mantenimiento y monitoreo, después de finalizado el establecimiento, o bien \nde acuerdo con los lineamientos del Plan Nacional de Restauración: Restauración Ecológica, \nRehabilitación y Recuperación de áreas Disturbadas (MADS, 2015)”, de lo cual se destaca que el tiempo \nde 3 años para las labores de seguimiento y mantenimiento indicadas en esta circular son opcionales en el caso \nen que no se establezca un tiempo superior y conforme a los lineamiento del citado Plan Nacional de \nRestauración. \nConforme a ello se aclara a la Sociedad que el tiempo de 5 años para el desarrollo de las actividades de \nmantenimiento, seguimiento y monitoreo que indica el literal j) del subnumeral 2.1.2 Epifitas no vasculares del \nnumeral 2. Medidas de Manejo de la Circular No. 0016 del 31 de diciembre de 2019 de la ANLA., refleja los \npreceptos del Plan Nacional de Restauración Ecológica (2015) del Ministerio de Ambiente y Desarrollo \nSostenible, del cual se citan los respectivos apartes a continuación:\n“LAS ETAPAS DE UN PROYECTO DE RESTAURACIÓN\n(…)\nb. Ejecución del proyecto de restauración\n(…)\nEn cuanto al monitoreo a la restauración, éste se debe realizar durante todo el proyecto en su etapa de \nejecución, y articularse con la Estrategia Nacional de Monitoreo a la Restauración Ecológica, liderada por el \nMinisterio de Ambiente y Desarrollo Sostenible. Se tendrá entonces información veraz y actualizada \nperiódicamente que dé cuenta del proceso de restauración, con la aplicación de un programa de evaluación y \nseguimiento. Es necesario que la toma de datos sea estandarizada y continua a través del tiempo, y que esté \ndisponible para otros proyectos o investigaciones. El programa de monitoreo, en el marco de la Estrategia \nNacional de Monitoreo a la Restauración Ecológica, se llevará a cabo por lo menos durante cinco años, \ny en los casos que sea posible se considerará el monitoreo de las variables a largo plazo (más de 10 años).\n(…)\n2. MONITOREO DE LOS PROYECTOS DE RESTAURACIÓN ECOLÓGICA\n(…) el Plan Nacional de Restauración propone que se asocie siempre un programa de monitoreo a corto, \nmediano y largo plazo de los proyectos de restauración (…).\n\nResolución No.  03040           Del   23 de diciembre de 2022            Hoja No. 11 de 26\n“Por la cual se resuelve un recurso de reposición interpuesto contra la Resolución 01129 del 31 de mayo de 2022 y se \nadoptan otras determinaciones”\nOficinas: Carrera 13 A No. 34 – 72 Edificio 13 35 Pisos 8 Bogotá, D.C.\nCentro de Orientación y Radicación de Correspondencia: Carrera 13 A No. 34 – 72 Edificio 13 35 \nLocales 110 al 112 Bogotá, D.C.  \nCódigo Postal 110311156\nNit.: 900.467.239-2\nLínea de Orientación y Contacto Ciudadano: 57 (1) 2540100 / 018000112998 PBX: 57 (1) 2540111\nwww.anla.gov.co    Email: licencias@anla.gov.co  \nPágina 11 de 26\nAlgunas consideraciones mínimas para el montaje de este tipo de sistemas de monitoreo están asociadas al \nobjetivo de la restauración, al análisis de paisaje del área del proyecto, a la selección de indicadores robustos \ny de fácil medición y finalmente un levantamiento robusto y estandarizado de los datos de línea base, que \npermitirán comparar los cambios a mediano y largo plazo (e.g.: parcelas permanentes). Algunos autores \nrecomiendan hacer las mediciones de las variables al menos trimestralmente durante el primer año, luego cada \naño hasta los cinco años y luego cada cinco años como largo plazo (Herrick et ál., 2005); sin embargo, esto \nse debe ajustar a las condiciones de los diferentes ecosistemas del país”.\nTeniendo en cuenta los apartes citados del Plan Nacional de Restauración cabe mencionar que, el objetivo \nfijado por la Sociedad en la ficha “Programa de manejo de Epífitas No Vasculares” señala: \n“Objetivo: Establecer un programa de rehabilitación ecológica según los lineamientos establecidos en la circular \n8201-2-808 del 9 de diciembre del 2019 expedida por la Dirección de Bosques, Biodiversidad y Servicios \nEcosistémicos, con el fin de crear hábitats para el desarrollo de especies de los grupos taxonómicos de \nmusgos, hepáticas y líquenes” (…)\nDe esto se destaca que el desarrollo de las medidas de la ficha propuestas por la Sociedad debe estar acorde \ncon los lineamientos del Plan Nacional de Restauración Ecológica, en cuanto al tipo de actividades que \ncontempla la restauración ecológica y las acciones que éste estipula para su seguimiento y monitoreo, en este \nsentido tiene lugar que en la evaluación de la misma que adelanta la ANLA se establezca los ajustes del caso \npara que esto se cumpla.\nCabe mencionar que en la ficha de manejo de Epífitas No vasculares presentada por la Sociedad no se identificó \nmedidas para el monitoreo de las especies no vasculares del área donde se desarrolle el programa de \nrehabilitación ecológica, a través del cual se identifique el proceso de colonización y desarrollo de estos \norganismos como resultado de las acciones del programa de rehabilitación ecológica que plantea esta ficha. \nCon relación a ello se aclara que la estrategia de monitoreo a implementar para las medidas de restauración \necológica fundamentadas en el Plan Nacional de Restauración, deben basarse en la caracterización de las \ncondiciones ecológicas del área del proyecto, en lo que respecta a diversidad de especies no vasculares, grado \nde disturbio presente, objetivos, especies arbóreas y arbustivas nativas, potenciales forófitos de flora en veda \nnacional o regional y los ecosistemas de referencia seleccionados para emular en el diseño de la restauración \necológica. \nEs de mencionar que la ficha presentada no contiene indicadores para monitorear la colonización y \nestablecimiento de especies no vasculares sobre los árboles, arbustos y herbáceas existentes y especies \nforestales plantadas en el área donde se desarrollará la medida de rehabilitación ecológica, por lo cual se \nrequirió su incorporación en el literal a) del numeral 4.2 del artículo tercero de la Resolución 1129 de 2022. \nDe conformidad con lo anterior, se considera que los argumentos de la Sociedad no tienen un carácter técnico \nsuficiente que permitan contemplar la disminución del tiempo de 5 años para el desarrollo de las actividades de \nmantenimiento de especies plantadas y simultáneamente el monitoreo de las especie no vasculares al término \ndel establecimiento de dichas especies plantadas, conforme lo señala el literal j) del subnumeral 2.1.2 de la \nCircular No. 0016 del 31 de diciembre de 2019 de la ANLA y en concordancia con lo establecido en el Plan \nNacional de Restauración Ecológica. \nPor lo anterior, se considera que no procede la petición de la Sociedad en cuanto a la modificación del \nliteral a) del numeral 2.7. del artículo tercero de la Resolución 1129 de 31 de mayo de 2022, referido al \ncronograma de actividades de mantenimiento de especies forestales plantadas y el seguimiento y monitoreo \ntanto a éstas como a las especies no vasculares.  \nConclusión de la ANLA\nDe conformidad con el anterior análisis, se considera necesario ajustar la obligación de la Resolución \n1129 de 31 de mayo de 2022 recurrida por la Sociedad, en el siguiente sentido.\nAclarar el literal a) del numeral 2.7 del del artículo tercero (Monitoreo y seguimiento de especies no vasculares) \nde la Resolución 1129 de 31 de mayo de 2022, la cual quedará de la siguiente manera: \n\nResolución No.  03040           Del   23 de diciembre de 2022            Hoja No. 12 de 26\n“Por la cual se resuelve un recurso de reposición interpuesto contra la Resolución 01129 del 31 de mayo de 2022 y se \nadoptan otras determinaciones”\nOficinas: Carrera 13 A No. 34 – 72 Edificio 13 35 Pisos 8 Bogotá, D.C.\nCentro de Orientación y Radicación de Correspondencia: Carrera 13 A No. 34 – 72 Edificio 13 35 \nLocales 110 al 112 Bogotá, D.C.  \nCódigo Postal 110311156\nNit.: 900.467.239-2\nLínea de Orientación y Contacto Ciudadano: 57 (1) 2540100 / 018000112998 PBX: 57 (1) 2540111\nwww.anla.gov.co    Email: licencias@anla.gov.co  \nPágina 12 de 26\nARTÍCULO TERCERO. (…)\n2.7 Medida 7. Cronograma de actividades. Ajustar en el sentido de: \na. Establecer el cronograma de actividades de mantenimiento, seguimiento y monitoreo de las medidas \nde manejo a realizar en concordancia con el cronograma de ejecución de obra, con una duración de \ncinco (5) años, contados a partir de la finalización del establecimiento de la plantación, en los cuales \ndebe desarrollar tres (3) años de mantenimiento de las especies plantadas para la rehabilitación \necológica y 3 monitoreos de especies no vasculares: el primero se efectuará al término del \nestablecimiento de las especies forestales del programa, el segundo al finalizar el segundo semestre \ndel año 2 del cronograma de actividades y el tercero finalizando el quinto año del cronograma de \nactividades.\nUna vez revisados los argumentos expuestos por la sociedad en el recurso de reposición con \nfundamento en los cuales solicita se modifique el literal a del numeral 2.7 del artículo tercero de la \nResolución No. 1129 de 31 de mayo de 2022, en el sentido de cambiar  el término total del cronograma \na cuatro (04) años, de actividades de mantenimiento de especies forestales plantadas y el seguimiento \ny monitoreo tanto a estas como a las especies no vasculares; esta Autoridad considera que no es \npertinente disminuir el tiempo a 4 años como la sociedad PAREX RESOURCES COLOMBIA LTD. \nSUCURSAL propone, debido a que no sería posible dar cumplimiento al cronograma de actividades \nestablecido, sin embargo una vez evaluada la solicitud se consideró viable modificar el artículo en el \nsentido de establecer 5 años para el desarrollo de las actividades de mantenimiento de especies \nplantadas, así como el monitoreo de especies no vasculares actividades que se realizarán de manera \nsimultánea y empezarán a contar a partir de la finalización del establecimiento de la plantación.\nB. DISPOCISIÓN RECURRIDA\n“(…) ARTÍCULO TERCERO. La sociedad PAREX RESOURCES COLOMBIA LTD. SUCURSAL, \ndeberá ajustar las fichas anteriormente citadas y presentarlas para verificación de la ANLA previo al \ndesarrollo de obras y actividades que requieran intervención de áreas con presencia de flora silvestre \nen condición de veda, según se indica a continuación: \n(…)\n4. Medidas para el seguimiento y monitoreo a especies en veda (no vasculares)\n4.1. Medida 1. Plan de mantenimiento. Complementar la medida en el sentido de: \na. Presentar informes detallados del proceso de rehabilitación ecológica que incluyan formatos de \ncampo, registros fotográficos con fecha y coordenadas de ubicación, con la siguiente frecuencia:\n(…) \nii. Informes anuales de la fase de mantenimiento, seguimiento y monitoreo de las especies establecidas \nteniendo en cuenta un tiempo de cinco (5) años partir de la finalización del establecimiento de la \nplantación, donde se especifique la fecha de inicio de las obras del proyecto y la fecha de inicio del \nproceso de restauración ecológica. Para ello tener en cuenta que, el periodo de selección de áreas, \ncaracterización las mismas y establecimiento se desarrolla en el primer año, el mantenimiento se \nefectúa durante tres (3) años y el tiempo restante se destina al seguimiento y monitoreo de la \ncolonización de epífitas no vasculares en árboles existentes y plantados.\n(…)\nPetición:\nSeñala el recurso:\nReponer en el sentido de modificar el subnumeral ii del literal a) del numeral 4.1. del artículo tercero de la \nResolución 01129 de 31 de mayo de 2022, de tal manera que el término total del cronograma sea de cuatro (4) \n\nResolución No.  03040           Del   23 de diciembre de 2022            Hoja No. 13 de 26\n“Por la cual se resuelve un recurso de reposición interpuesto contra la Resolución 01129 del 31 de mayo de 2022 y se \nadoptan otras determinaciones”\nOficinas: Carrera 13 A No. 34 – 72 Edificio 13 35 Pisos 8 Bogotá, D.C.\nCentro de Orientación y Radicación de Correspondencia: Carrera 13 A No. 34 – 72 Edificio 13 35 \nLocales 110 al 112 Bogotá, D.C.  \nCódigo Postal 110311156\nNit.: 900.467.239-2\nLínea de Orientación y Contacto Ciudadano: 57 (1) 2540100 / 018000112998 PBX: 57 (1) 2540111\nwww.anla.gov.co    Email: licencias@anla.gov.co  \nPágina 13 de 26\naños, teniendo en cuenta los lineamientos previstos por la ANLA y el MADS en el numeral 2.1.2. “Recuperación, \nRehabilitación o Restauración Ecológica, quedando de la siguiente manera:\n“ARTÍCULO TERCERO. 4.1 Medida 1. Plan de mantenimiento. Complementar la medida en el sentido \nde: \na. Presentar informes detallados del proceso de rehabilitación ecológica que incluyan formatos de \ncampo, registros fotográficos con fecha y coordenadas de ubicación, con la siguiente frecuencia:\n(…)\nii. Informes anuales de la fase de mantenimiento, seguimiento y monitoreo de las especies establecidas \nteniendo en cuenta un tiempo de tres (3) años a partir de la finalización del establecimiento de la \nplantación, donde se especifique la fecha de inicio de las obras del proyecto y la fecha de inicio del \nproceso de restauración ecológica. Para ello tener en cuenta que, el periodo de selección de áreas, \ncaracterización las mismas y establecimiento se desarrolla en el primer año, el mantenimiento se \nefectúa durante tres (3) años, al término del cual se adelantará una caracterización representativa de \nlas especies no vasculares que han colonizado los forófitos.”\nArgumentos del recurrente\n“La ANLA indica basar su análisis en la Circular 8201-2-808 del 9 de diciembre de 2019 del MADS, numeral \n2.1.2. Recuperación, Rehabilitación o Restauración Ecológica, el cual señala lo siguiente: \nh) Incluir en las acciones de recuperación, rehabilitación y restauración de ecosistemas, parcelas de \nmonitoreo o permanentes, que permitirán la toma de datos parametrizados con el fin de obtener \ninformación comparativa que evidencie la efectividad en el desarrollo de la medida a través del tiempo. \nSe deberá priorizar la evaluación de parámetros como colonización de especies en veda en sustratos \nepifitos, rupícolas y terrestres, presencia y ausencia, fenología, abundancia registrada en unidad de \nmedida (cobertura cm2), hospederos y estado fitosanitario. \nLa ANLA estableció en la parte considerativa, entre otros aspectos, lo siguiente:\n“(…) OTRAS CONSIDERACIONES. Evaluación de Solicitud de Establecimiento de Medidas para el Manejo y \nConservación de Especies en Veda. MEDIDAS DE MANEJO AMBIENTAL PARA ESPECIES EN VEDA. \nPrograma de Manejo Ambiental para el rescate, traslado y reubicación de las especies vasculares de hábito \nepífito (EVHE). Ficha de Manejo 02: Programa de manejo de epífitas (No Vasculares). Medida 7. Cronograma \nde actividades. Consideraciones: al verificar la ficha 02. Programa de manejo de epífitas No vasculares se \ndetalla la inclusión de un cronograma de actividades para el desarrollo de la medida de rehabilitación ecológica, \nen el cual se describen actividades para 4 años en total pese a que se plantea un calendario de 5 años, como \nse cita a continuación: (…tabla del cronograma presentado por Parex…). (…) De lo anterior se detalla que el \ncronograma de actividades debe ajustarse de manera que se proyecte completen actividades para un total de \n6 años, teniendo en cuenta lo señalado en el literal j) del numeral 2.1.2 de la circular 2019208071-3-000 del 31 \nde diciembre de 2019. \nObligación: Ajustar la ficha 02. Programa de manejo de epífitas No vasculares, en el sentido de establecer en \nel cronograma de actividades con tiempo total de seis (6) años, contemplando un (1) año para la fase de \nselección de áreas, caracterización de las condiciones ambientales del área a rehabilitar, definición de diseños \nflorístico, establecimiento, aislamiento y montaje de parcelas permanentes de monitoreo; cinco (5) años en los \ncuales debe desarrollar tres (3) años mantenimiento, seguido de dos (2) años más para continuar con las \nactividades de monitoreo de las especies de flora epífita no vascular.\nConsideraciones de Parex \n<0000> Temporalidad \nEn relación con la temporalidad, se aclara que Parex presentó un plan de manejo contemplando un tiempo de \nun (1) año para la fase de selección de áreas, caracterización de las condiciones ambientales del área a \nrehabilitar, definición de diseños florístico, establecimiento, aislamiento y tres (3) años de mantenimiento, \n\nResolución No.  03040           Del   23 de diciembre de 2022            Hoja No. 14 de 26\n“Por la cual se resuelve un recurso de reposición interpuesto contra la Resolución 01129 del 31 de mayo de 2022 y se \nadoptan otras determinaciones”\nOficinas: Carrera 13 A No. 34 – 72 Edificio 13 35 Pisos 8 Bogotá, D.C.\nCentro de Orientación y Radicación de Correspondencia: Carrera 13 A No. 34 – 72 Edificio 13 35 \nLocales 110 al 112 Bogotá, D.C.  \nCódigo Postal 110311156\nNit.: 900.467.239-2\nLínea de Orientación y Contacto Ciudadano: 57 (1) 2540100 / 018000112998 PBX: 57 (1) 2540111\nwww.anla.gov.co    Email: licencias@anla.gov.co  \nPágina 14 de 26\nmonitoreo y seguimiento, para un total de cuatro (4) años, lo cual es acorde con la Circular Interna No. 6 del 31 \nde diciembre de 2019 de la ANLA y la Circular 8201-2- 808 de 9 de diciembre de 2019 del MADS, archivo anexo \ndenominado “METODOLOGÍA PARA LA CARACTERIZACIÓN DE ESPECIES DE FLORA EN VEDA”, citadas \na continuación. \nLa Circular Interna No. 6 del 31 de diciembre de 2019 de la ANLA identificada con radicado 2019208071-3-000 \nseñala tres (3) años con respecto de los tiempos de seguimiento y monitoreo de especies no vasculares, \nestableció lo siguiente:\n“2. Medidas de Manejo \n(…) 2.1.1 Epifitas vasculares \n+\n(…) Cronograma de actividades que contemplen el manejo, seguimiento y monitoreo por al menos 3 \naños, a partir de la terminación de las acciones de reubicación \n(…) 2.1.1. Epifitas no vasculares \n(…) Definir las actividades de mantenimiento de los árboles plantados por un periodo de tres años, \npara garantizar la supervivencia de alrededor del 80% del material vegetal plantado. \n(…) 2.1.3 Especies arbóreas y helechos arbóreos \n(…) Respecto a las actividades de mantenimiento (riego, fertilización, resiembra, etc.) el solicitante \ndeberá indicar la duración de dichas actividades, la cual no será menor a tres (3) años. \n(…) El cronograma deberá indicar todas las actividades a desarrollar y deberá evidenciar de manera \ndetallada la periodicidad de las mismas. Es importante mencionar que la duración de las actividades \nno puede ser inferior a los tres (3) años. \n3. Plan de Seguimiento y Monitoreo \n(…) 3.1.2 Epifitas no vasculares \n(…) Establecer parcelas de monitoreo y conservación dentro de las áreas de reubicación en el proceso \nde rescate y traslado, para realizar seguimiento por tres (3) años, a los individuos de las especies no \nvasculares de hábito rupícola y terrestre, diferentes a las que se deben establecer dentro del proceso \nde Restauración Ecológica. \n3.1.3 Especies arbóreas y helechos arborescentes\n(…) El solicitante deberá presentar informes semestrales durante tres (3) años contados a partir de la \nfinalización de la reubicación y plantación por reposición del material vegetal. Estos informes deberán \nconsolidar la información relevante de los informes anteriores e incluir los avances a la fecha las \nacciones”. \nPor otra parte, la Circular 8201-2-808 de 9 de diciembre de 2019 del MADS, en el anexo denominado \n“METODOLOGÍA PARA LA CARACTERIZACIÓN DE ESPECIES DE FLORA EN VEDA”, también indica una \ntemporalidad de tres (3) años de seguimiento y monitoreo a partir de la siembra, así:\n2.1.2. Recuperación, Rehabilitación o Restauración Ecológica Esta medida de manejo se plantea por \nla afectación agregados de especies de musgos, hepáticas, anthoceros y líquenes, ante lo cual el \nobjetivo de la medida es recuperar, rehabilitar o restaurar los ecosistemas que sean hábitat de estas \nespecies. (…) \nh) Incluir en las acciones de recuperación, rehabilitación y restauración de ecosistemas, parcelas de \nmonitoreo o permanentes, que permitirán la toma de datos parametrizados con el fin de obtener \ninformación comparativa que evidencie la efectividad en el desarrollo de la medida a través del tiempo. \nSe deberá priorizar la evaluación de parámetros como colonización de especies en veda en sustratos \nepifitos, rupícolas y terrestres, presencia y ausencia, fenología, abundancia registrada en unidad de \nmedida (cobertura cm2), hospederos y estado fitosanitario. \n(…)\n\nResolución No.  03040           Del   23 de diciembre de 2022            Hoja No. 15 de 26\n“Por la cual se resuelve un recurso de reposición interpuesto contra la Resolución 01129 del 31 de mayo de 2022 y se \nadoptan otras determinaciones”\nOficinas: Carrera 13 A No. 34 – 72 Edificio 13 35 Pisos 8 Bogotá, D.C.\nCentro de Orientación y Radicación de Correspondencia: Carrera 13 A No. 34 – 72 Edificio 13 35 \nLocales 110 al 112 Bogotá, D.C.  \nCódigo Postal 110311156\nNit.: 900.467.239-2\nLínea de Orientación y Contacto Ciudadano: 57 (1) 2540100 / 018000112998 PBX: 57 (1) 2540111\nwww.anla.gov.co    Email: licencias@anla.gov.co  \nPágina 15 de 26\ni) Plantear y realizar un plan de seguimiento y mantenimiento que contemple mínimo tres años de \nmantenimiento y monitoreo, después de finalizado el establecimiento, o bien de acuerdo a los \nlineamientos del Plan Nacional de Restauración: Restauración Ecológica, Rehabilitación y \nRecuperación de áreas Disturbadas (MADS, 2015).\nComo se puede evidenciar, contrario a lo dispuesto en la Resolución 01129 de 31 de mayo de 2022 de ANLA, \nel lineamiento indicado en la Circular Interna No. 6 del 31 de diciembre de 2019 de la ANLA y la Circular 8201-2-\n808 de 9 de diciembre de 2019 del MADS es de tres (3) años, y no de un mayor tiempo, por lo tanto, en el \ncaso en concreto, todo el plan no debe superar los cuatro (4) años propuestos, un año aproximado de \nplaneación y tres (3) de ejecución. De lo contrario sería imponer una medida con un criterio de temporalidad \ndiferente al que tienen establecido la ANLA y el MADS para medidas de manejo de especies no vasculares \n(musgos, líquenes y hepáticas), desconociendo los lineamientos dados por dichas entidades. \n<0000> Especificaciones técnicas-Biológicas \nA nivel biológico, se aclara que la colonización reportada en diferentes continentes de especies no vasculares \nen veda sobre nuevos forófitos es muy lenta y los registros de crecimiento o aparición requieren lapsos en \nunidades de años usualmente, hecho ampliamente reportado por la literatura científica. También dado que la \núnica forma de caracterizarlas es mediante la colecta de muestras de herbario, tienen implícito este hecho la \nremoción de parte de la corteza de los forófitos y de las nuevas colonias de crecimiento para envío para \ndeterminación por parte de un herbario y/o especialista.\nPor lo tanto, Parex considera que no es recomendable, y además improcedente para los grupos biológicos no \nvasculares que recientemente se están desarrollando sobre esos nuevos forófitos implementar “…montaje de \nparcelas permanentes de monitoreo”, y también “…seguido de dos (2) años más para continuar con las \nactividades de monitoreo de las especies de flora epífita no vascular”. \nLo anterior, toda vez que la determinación taxonómica a especie o al mayor nivel de determinación en campo \nes imposible, dado que requiere el uso de estereoscopio y/o microscopio, incluso de reactivos químicos en \nalgunas especies y géneros, por tanto, el monitoreo repetitivo obligaría a una reiterada extracción de nuevas \nmuestras por cada monitoreo, que afectaría tanto el estado fitosanitario de los nuevos forófitos sembrados (en \nestado latizal y/o brinzal, los estados más pequeños de árboles), hecho que también reduciría o eliminaría gran \nparte o toda la colonización que se hubiese presentado hasta cada momento de monitoreo, por tanto no es \nrecomendable biológicamente y es contrario al objetivo de las medidas de manejo para especies no vasculares, \ndado que estas deben propender por el establecimiento de nuevas colonias de especies no vasculares en \nnuevos sustratos (corteza de árboles en este caso). \n“Por lo anterior, y con el fin que se modifique el subnumeral ii del literal a) del numeral 4.1 del artículo \ntercero de la Resolución 01129 de 31 de mayo de 2022 (…) de tal manera que el término total del cronograma \nsea de cuatro (4) años, se incorpora en la actual ficha de manejo una propuesta de monitoreo directa de \npresencia y abundancia representativa de especies no vasculares al finalizar los tres (3) años del mantenimiento \nde la plantación de rehabilitación ecológica, un único registro que permitirá describir las especies que han \ncolonizado de manera representativa algunos forófitos y relaciones de diversidad y abundancias \ngenerales/forófito, permitiendo que el material continúe su desarrollo sin repetidas extracciones de especies no-\nvasculares sobre las superficies de los árboles sembrados, evitando ocasionar daños o lesiones reiteradas o \nsignificativas a los nuevos forófito y disminución de las colonias que se hayan desarrollado sobre los forófitos \nsembrados. La propuesta incluye indicadores totales y por grupo biológico (…)”\nConsideraciones de la ANLA respecto de los argumentos expuestos:\nEn cuanto a la petición de la Sociedad sobre la modificación del subnumeral ii) del literal a) del numeral 4.1 del \nartículo tercero de la Resolución 1129 de 31 de mayo de 2022, referido a la entrega de informes anuales de la \nfase de mantenimiento, seguimiento y monitoreo de las especies establecidas, se aclara que el tiempo de 5 \naños establecido en dicho subnumeral durante el cual se presentarían dichos informes corresponde a una \nimprecisión en el proceso de evaluación derivado de una interpretación errónea de la circular No. 0016 del 31 \nde diciembre de 2019, toda vez que esta indica en el literal f) del subnumeral 2.1.2 que las labores de \nmantenimiento, y monitoreo de las especies a plantar en el marco del programa de restauración ecológica a \ndesarrollar, será de 3 años. Conforme a ello se considera que procede modificar dicho subnumeral ii) con \n\nResolución No.  03040           Del   23 de diciembre de 2022            Hoja No. 16 de 26\n“Por la cual se resuelve un recurso de reposición interpuesto contra la Resolución 01129 del 31 de mayo de 2022 y se \nadoptan otras determinaciones”\nOficinas: Carrera 13 A No. 34 – 72 Edificio 13 35 Pisos 8 Bogotá, D.C.\nCentro de Orientación y Radicación de Correspondencia: Carrera 13 A No. 34 – 72 Edificio 13 35 \nLocales 110 al 112 Bogotá, D.C.  \nCódigo Postal 110311156\nNit.: 900.467.239-2\nLínea de Orientación y Contacto Ciudadano: 57 (1) 2540100 / 018000112998 PBX: 57 (1) 2540111\nwww.anla.gov.co    Email: licencias@anla.gov.co  \nPágina 16 de 26\nrelación al tiempo en el cual se debe presentar estos informes y adicionalmente precisar el contenido general \nde los informes. \nLa Sociedad también señala en su petición sobre este subnumeral que “al término del cual se adelantará una \ncaracterización representativa de las especies no vasculares que han colonizado los forófitos”, al respecto se \nconsidera que esta precisión no procede dado que no corresponde con el objeto de la obligación que se \nimpone. No obstante, dicha precisión se aborda en las consideraciones sobre las obligaciones establecidas en \nlos subnumerales i y ii del literal b del numeral 4.1 del artículo tercero de la Resolución 1129 de 31 de mayo de \n2022, que se presenta continuación.\nDecisión de la ANLA\nDe conformidad con el anterior análisis, se considera necesario ajustar la obligación de la Resolución \n1129 de 31 de mayo de 2022 recurrida por la Sociedad, en el siguiente sentido.\nAclarar el subnumeral ii del literal a) del numeral 4.1 del artículo tercero de la Resolución 01129 de 31 de mayo \nde 2022, cual quedará de la siguiente manera: \nARTÍCULO TERCERO. (…)\n4.1 Medida 1. Plan de mantenimiento. Complementar la medida en el sentido de: \na. Presentar informes detallados del proceso de rehabilitación ecológica que incluyan formatos de \ncampo, registros fotográficos con fecha y coordenadas de ubicación, con la siguiente frecuencia:\n(…) \nii. Informes anuales de la fase de mantenimiento, seguimiento y monitoreo de las especies establecidas \nteniendo en cuenta un tiempo de tres (3) años a partir de la finalización del establecimiento de la \nplantación, donde se especifique la fecha de inicio de las obras del proyecto y la fecha de inicio del \nproceso de restauración ecológica. Estos deberán relacionar datos del % de sobrevivencia, estado de \ncrecimiento y fitosanitario, actividades desarrolladas en cada mantenimiento y resiembras.  \nVistos los argumentos de la recurrente al respecto, como las consideraciones técnicas establecidas \nen el concepto técnico 5228 del 31 de agosto de 2022, es importante precisar que esta Autoridad \nacogiendo la recomendación técnica efectuada, modificará la disposición recurrida por la sociedad \nPAREX RESOURCES COLOMBIA LTD.SUCURSAL., aclarando que la entrega de informes anuales \nde la fase de mantenimiento, seguimiento y monitoreo de las especies establecidas será de 3 años \ncontados  a partir de la finalización del establecimiento de la plantación, donde se especifique la fecha \nde inicio de las obras del proyecto y la fecha de inicio del proceso de restauración ecológica.\nC. DISPOSICIÓN RECURRIDA\nARTÍCULO TERCERO. (…)\n4.1 Medida 1. Plan de mantenimiento. Complementar la medida en el sentido de: \n(…)\nb. Desarrollo de parcelas permanentes de monitoreo y conservación destinadas a la verificación de \nlos siguientes aspectos: \nii.\nMonitorear variables de la vegetación que permitan determinar si la rehabilitación promueve \nel mejoramiento de hábitats para epífitas no vasculares, empleando parámetros como \npresencia/ausencia, cobertura vegetal, hospederos y estado fitosanitario de estos. \nii. Seguimiento por tres 3 años a los individuos de las especies no vasculares de hábito rupícola y \nterrestre que se establezcan en el proceso de rehabilitación ecológica”.\n(…)”\nPetición:\n\nResolución No.  03040           Del   23 de diciembre de 2022            Hoja No. 17 de 26\n“Por la cual se resuelve un recurso de reposición interpuesto contra la Resolución 01129 del 31 de mayo de 2022 y se \nadoptan otras determinaciones”\nOficinas: Carrera 13 A No. 34 – 72 Edificio 13 35 Pisos 8 Bogotá, D.C.\nCentro de Orientación y Radicación de Correspondencia: Carrera 13 A No. 34 – 72 Edificio 13 35 \nLocales 110 al 112 Bogotá, D.C.  \nCódigo Postal 110311156\nNit.: 900.467.239-2\nLínea de Orientación y Contacto Ciudadano: 57 (1) 2540100 / 018000112998 PBX: 57 (1) 2540111\nwww.anla.gov.co    Email: licencias@anla.gov.co  \nPágina 17 de 26\nSeñala el recurso:\nReponer en el sentido de modificar los subnumerales i y ii del literal b del numeral 4.1. del artículo \ntercero de la Resolución 1129 de 31 de mayo de 2022 estableciendo que “se debe desarrollar una \ncaracterización representativa de la colonización de especies no vasculares presentes en el área de \nrehabilitación al finalizar los tres (3) años del mantenimiento. Para las epífitas no vasculares se debe \nemplear parámetros tales como determinación taxonómica, presencia/ausencia, abundancia, \ncobertura vegetal, hospederos y estado fitosanitario de estos y para para especies no vasculares que \nse establezcan en el área de rehabilitación ecológica sobre “otros sustratos” (en caso de desarrollarse), \nempleando parámetros tales como determinación taxonómica, presencia/ausencia, abundancia, \ncobertura vegetal y tipo de sustrato, teniendo en cuenta la Circular 8201-2-808 del 9 de diciembre de \n2019 del MADS, numeral 2.1.2. Recuperación, Rehabilitación o Restauración Ecológica”.\nArgumentos del recurrente\n“La ANLA indica basar su análisis en la Circular 8201-2-808 del 9 de diciembre de 2019 del MADS, numeral \n2.1.2. Recuperación, Rehabilitación o Restauración Ecológica, el cual señala lo siguiente: \n(…)\nh) Incluir en las acciones de recuperación, rehabilitación y restauración de ecosistemas, parcelas de \nmonitoreo o permanentes, que permitirán la toma de datos parametrizados con el fin de obtener \ninformación comparativa que evidencie la efectividad en el desarrollo de la medida a través del tiempo. \nSe deberá priorizar la evaluación de parámetros como colonización de especies en veda en sustratos \nepifitos, rupícolas y terrestres, presencia y ausencia, fenología, abundancia registrada en unidad de \nmedida (cobertura cm2), hospederos y estado fitosanitario. \nLa ANLA estableció en la parte considerativa, entre otros aspectos, lo siguiente:\n“(…) OTRAS CONSIDERACIONES. Evaluación de Solicitud de Establecimiento de Medidas para el \nManejo y Conservación de Especies en Veda. MEDIDAS DE MANEJO AMBIENTAL PARA ESPECIES \nEN VEDA. Programa de Manejo Ambiental para el rescate, traslado y reubicación de las especies \nvasculares de hábito epífito (EVHE). Ficha de Manejo 02: Programa de manejo de epífitas (No \nVasculares). Medida 7. Cronograma de actividades. Consideraciones: al verificar la ficha 02. Programa \nde manejo de epífitas No vasculares se detalla la inclusión de un cronograma de actividades para el \ndesarrollo de la medida de rehabilitación ecológica, en el cual se describen actividades para 4 años en \ntotal pese a que se plantea un calendario de 5 años, como se cita a continuación: (…tabla del \ncronograma presentado por Parex…). (…) De lo anterior se detalla que el cronograma de actividades \ndebe ajustarse de manera que se proyecte completen actividades para un total de 6 años, teniendo en \ncuenta lo señalado en el literal j) del numeral 2.1.2 de la circular 2019208071-3-000 del 31 de diciembre \nde 2019. \nObligación: Ajustar la ficha 02. Programa de manejo de epífitas No vasculares, en el sentido de \nestablecer en el cronograma de actividades con tiempo total de seis (6) años, contemplando un (1) \naño para la fase de selección de áreas, caracterización de las condiciones ambientales del área a \nrehabilitar, definición de diseños florístico, establecimiento, aislamiento y montaje de parcelas \npermanentes de monitoreo; cinco (5) años en los cuales debe desarrollar tres (3) años mantenimiento, \nseguido de dos (2) años más para continuar con las actividades de monitoreo de las especies de flora \nepífita no vascular.\nConsideraciones de Parex \n<0000> Temporalidad \nEn relación con la temporalidad, se aclara que Parex presentó un plan de manejo contemplando un tiempo de \nun (1) año para la fase de selección de áreas, caracterización de las condiciones ambientales del área a \nrehabilitar, definición de diseños florístico, establecimiento, aislamiento y tres (3) años de mantenimiento, \nmonitoreo y seguimiento, para un total de cuatro (4) años, lo cual es acorde con la Circular Interna No. 6 del 31 \nde diciembre de 2019 de la ANLA y la Circular 8201-2- 808 de 9 de diciembre de 2019 del MADS, archivo anexo \n\nResolución No.  03040           Del   23 de diciembre de 2022            Hoja No. 18 de 26\n“Por la cual se resuelve un recurso de reposición interpuesto contra la Resolución 01129 del 31 de mayo de 2022 y se \nadoptan otras determinaciones”\nOficinas: Carrera 13 A No. 34 – 72 Edificio 13 35 Pisos 8 Bogotá, D.C.\nCentro de Orientación y Radicación de Correspondencia: Carrera 13 A No. 34 – 72 Edificio 13 35 \nLocales 110 al 112 Bogotá, D.C.  \nCódigo Postal 110311156\nNit.: 900.467.239-2\nLínea de Orientación y Contacto Ciudadano: 57 (1) 2540100 / 018000112998 PBX: 57 (1) 2540111\nwww.anla.gov.co    Email: licencias@anla.gov.co  \nPágina 18 de 26\ndenominado “METODOLOGÍA PARA LA CARACTERIZACIÓN DE ESPECIES DE FLORA EN VEDA”, citadas \na continuación. \nLa Circular Interna No. 6 del 31 de diciembre de 2019 de la ANLA identificada con radicado 2019208071-3-000 \nseñala tres (3) años con respecto de los tiempos de seguimiento y monitoreo de especies no vasculares, \nestableció lo siguiente:\n“2. Medidas de Manejo \n(…) 2.1.1 Epifitas vasculares \n+\n(…) Cronograma de actividades que contemplen el manejo, seguimiento y monitoreo por al menos 3 \naños, a partir de la terminación de las acciones de reubicación \n(…) 2.1.1. Epifitas no vasculares \n(…) Definir las actividades de mantenimiento de los árboles plantados por un periodo de tres años, \npara garantizar la supervivencia de alrededor del 80% del material vegetal plantado. \n(…) 2.1.3 Especies arbóreas y helechos arbóreos \n(…) Respecto a las actividades de mantenimiento (riego, fertilización, resiembra, etc.) el solicitante \ndeberá indicar la duración de dichas actividades, la cual no será menor a tres (3) años. \n(…) El cronograma deberá indicar todas las actividades a desarrollar y deberá evidenciar de manera \ndetallada la periodicidad de las mismas. Es importante mencionar que la duración de las actividades \nno puede ser inferior a los tres (3) años. \n3. Plan de Seguimiento y Monitoreo \n(…) 3.1.2 Epifitas no vasculares \n(…) Establecer parcelas de monitoreo y conservación dentro de las áreas de reubicación en el proceso \nde rescate y traslado, para realizar seguimiento por tres (3) años, a los individuos de las especies no \nvasculares de hábito rupícola y terrestre, diferentes a las que se deben establecer dentro del proceso \nde Restauración Ecológica. \n3.1.3 Especies arbóreas y helechos arborescentes\n(…) El solicitante deberá presentar informes semestrales durante tres (3) años contados a partir de la \nfinalización de la reubicación y plantación por reposición del material vegetal. Estos informes deberán \nconsolidar la información relevante de los informes anteriores e incluir los avances a la fecha las \nacciones”. \nPor otra parte, la Circular 8201-2-808 de 9 de diciembre de 2019 del MADS, en el anexo denominado \n“METODOLOGÍA PARA LA CARACTERIZACIÓN DE ESPECIES DE FLORA EN VEDA”, también indica una \ntemporalidad de tres (3) años de seguimiento y monitoreo a partir de la siembra, así:\n2.1.2. Recuperación, Rehabilitación o Restauración Ecológica Esta medida de manejo se plantea por \nla afectación agregados de especies de musgos, hepáticas, anthoceros y líquenes, ante lo cual el \nobjetivo de la medida es recuperar, rehabilitar o restaurar los ecosistemas que sean hábitat de estas \nespecies. (…) \nh) Incluir en las acciones de recuperación, rehabilitación y restauración de ecosistemas, parcelas de \nmonitoreo o permanentes, que permitirán la toma de datos parametrizados con el fin de obtener \ninformación comparativa que evidencie la efectividad en el desarrollo de la medida a través del tiempo. \nSe deberá priorizar la evaluación de parámetros como colonización de especies en veda en sustratos \nepifitos, rupícolas y terrestres, presencia y ausencia, fenología, abundancia registrada en unidad de \nmedida (cobertura cm2), hospederos y estado fitosanitario. \n(…)\ni) Plantear y realizar un plan de seguimiento y mantenimiento que contemple mínimo tres años de \nmantenimiento y monitoreo, después de finalizado el establecimiento, o bien de acuerdo a los \n\nResolución No.  03040           Del   23 de diciembre de 2022            Hoja No. 19 de 26\n“Por la cual se resuelve un recurso de reposición interpuesto contra la Resolución 01129 del 31 de mayo de 2022 y se \nadoptan otras determinaciones”\nOficinas: Carrera 13 A No. 34 – 72 Edificio 13 35 Pisos 8 Bogotá, D.C.\nCentro de Orientación y Radicación de Correspondencia: Carrera 13 A No. 34 – 72 Edificio 13 35 \nLocales 110 al 112 Bogotá, D.C.  \nCódigo Postal 110311156\nNit.: 900.467.239-2\nLínea de Orientación y Contacto Ciudadano: 57 (1) 2540100 / 018000112998 PBX: 57 (1) 2540111\nwww.anla.gov.co    Email: licencias@anla.gov.co  \nPágina 19 de 26\nlineamientos del Plan Nacional de Restauración: Restauración Ecológica, Rehabilitación y \nRecuperación de áreas Disturbadas (MADS, 2015).\nComo se puede evidenciar, contrario a lo dispuesto en la Resolución 01129 de 31 de mayo de 2022 de ANLA, \nel lineamiento indicado en la Circular Interna No. 6 del 31 de diciembre de 2019 de la ANLA y la Circular 8201-2-\n808 de 9 de diciembre de 2019 del MADS es de tres (3) años, y no de un mayor tiempo, por lo tanto, en el \ncaso en concreto, todo el plan no debe superar los cuatro (4) años propuestos, un año aproximado de \nplaneación y tres (3) de ejecución. De lo contrario sería imponer una medida con un criterio de temporalidad \ndiferente al que tienen establecido la ANLA y el MADS para medidas de manejo de especies no vasculares \n(musgos, líquenes y hepáticas), desconociendo los lineamientos dados por dichas entidades. \n<0000> Especificaciones técnicas-Biológicas \nA nivel biológico, se aclara que la colonización reportada en diferentes continentes de especies no vasculares \nen veda sobre nuevos forófitos es muy lenta y los registros de crecimiento o aparición requieren lapsos en \nunidades de años usualmente, hecho ampliamente reportado por la literatura científica. También dado que la \núnica forma de caracterizarlas es mediante la colecta de muestras de herbario, tienen implícito este hecho la \nremoción de parte de la corteza de los forófitos y de las nuevas colonias de crecimiento para envío para \ndeterminación por parte de un herbario y/o especialista. Por lo tanto, Parex considera que no es recomendable, \ny además improcedente para los grupos biológicos no vasculares que recientemente se están desarrollando \nsobre esos nuevos forófitos implementar “…montaje de parcelas permanentes de monitoreo”, y también \n“…seguido de dos (2) años más para continuar con las actividades de monitoreo de las especies de flora epífita \nno vascular. \nLa determinación taxonómica a especie o al mayor nivel de determinación en campo es imposible, dado que \nrequiere el uso de estereoscopio y/o microscopio, incluso de reactivos químicos en algunas especies y géneros, \npor tanto, el monitoreo repetitivo obligaría a una reiterada extracción de nuevas muestras por cada monitoreo, \nque afectaría tanto el estado fitosanitario de los nuevos forófitos sembrados (en estado latizal y/o brinzal, los \nestados más pequeños de árboles), hecho que también reduciría o eliminaría gran parte o toda la colonización \nque se hubiese presentado hasta cada momento de monitoreo, por tanto no es recomendable biológicamente \ny es contrario al objetivo de las medidas de manejo para especies no vasculares, dado que estas deben \npropender por el establecimiento de nuevas colonias de especies no vasculares en nuevos sustratos (corteza \nde árboles en este caso).\nCon relación al literal ii del literal b del numeral 4.1. del artículo tercero de la Resolución 1129 de 31 de \nmayo de 2022, es importante tener en cuenta que si bien la Circular 8201-2-808 de 9 de diciembre de 2019 del \nMADS, en el anexo denominado “METODOLOGÍA PARA LA CARACTERIZACIÓN DE ESPECIES DE FLORA \nEN VEDA”, indica que: “2.1.2. Recuperación, Rehabilitación o Restauración Ecológica, (…) h) “priorizar la \nevaluación de parámetros como colonización de especies en veda en sustratos epifitos, rupícolas y terrestres”. \nSe aclara que cada bioma, ecosistema, cobertura de la tierra, morfología, geología entre otros aspectos generan \ndiferentes posibilidades de presencia de “otros sustratos” en cada área de intervención específica del país, por \ntanto, son muy diferentes las áreas de intervención potenciales y pueden estar ausentes por completo \ndeterminados sustratos de especies no vasculares, por tanto consideramos que la ANLA no puede especificar \nen la Resolución 01129 de 2022, los sustratos específicos a muestrear, por tanto, puede indicar “en otros \nsustratos, en caso de desarrollarse”, dando así posibilidad a las diferentes opciones reales y generales de su \ndesarrollo dentro de las áreas seleccionadas para la ejecución de esta ficha de manejo para el campo \nCabrestero. \nPor tanto, Parex plantea en caso de registrar desarrollo de especies no vasculares en el área de rehabilitación \necológica sobre “otros sustratos” al finalizar el seguimiento y monitoreo de los forófitos durante tres (3) años, \nrealizar un único muestreo representativo, similar al indicado para epífitas (sustrato forófito).\nPor lo anterior, y con el fin que se modifique los subnumerales i y ii del literal b del numeral 4.1. del artículo \ntercero de la Resolución 01129 de 31 de mayo de 2022, en cumplimiento del literal h de la Circular 8201-2-808 \ndel 9 de diciembre de 2019 del MADS, numeral 2.1.2. “Recuperación, Rehabilitación o Restauración Ecológica”, \nse incorpora en la actual ficha de manejo una propuesta de monitoreo directa de presencia y abundancia \nrepresentativa de especies no vasculares al finalizar los tres (3) años del mantenimiento de la plantación \n\nResolución No.  03040           Del   23 de diciembre de 2022            Hoja No. 20 de 26\n“Por la cual se resuelve un recurso de reposición interpuesto contra la Resolución 01129 del 31 de mayo de 2022 y se \nadoptan otras determinaciones”\nOficinas: Carrera 13 A No. 34 – 72 Edificio 13 35 Pisos 8 Bogotá, D.C.\nCentro de Orientación y Radicación de Correspondencia: Carrera 13 A No. 34 – 72 Edificio 13 35 \nLocales 110 al 112 Bogotá, D.C.  \nCódigo Postal 110311156\nNit.: 900.467.239-2\nLínea de Orientación y Contacto Ciudadano: 57 (1) 2540100 / 018000112998 PBX: 57 (1) 2540111\nwww.anla.gov.co    Email: licencias@anla.gov.co  \nPágina 20 de 26\nde rehabilitación ecológica, un único registro que permitirá describir las especies que han colonizado de \nmanera representativa algunos forófitos y relaciones de diversidad y abundancias generales/forófito, \npermitiendo que el material continúe su desarrollo sin repetidas extracciones de especies no-vasculares sobre \nlas superficies de los árboles sembrados, evitando ocasionar daños o lesiones reiteradas o significativas a los \nnuevos forófito y disminución de las colonias que se hayan desarrollado sobre los forófitos sembrados. La \npropuesta incluye indicadores totales y por grupo biológico (…)”.\nConsideraciones de la ANLA respecto de los argumentos expuestos:\nEn cuanto a los 3 argumentos presentados por la Sociedad sobre la modificación de las obligaciones \nestablecidas en los subnumerales i y ii del literal b del numeral 4.1 del artículo tercero de la Resolución 1129 de \n31 de mayo de 2022, se aclara lo siguiente\nPrimer argumento: la Sociedad señala que dando aplicación al literal h) de la Circular 8201-2-808 del 9 de \ndiciembre de 2019 del MADS, numeral 2.1.2. “Recuperación, Rehabilitación o Restauración Ecológica”, \ndesarrollará una “propuesta de monitoreo directa de presencia y abundancia representativa de especies no \nvasculares al finalizar los tres (3) años del mantenimiento de la plantación de rehabilitación ecológica, un único \nregistro que permitirá describir las especies que han colonizado de manera representativa algunos forófitos y \nrelaciones de diversidad y abundancias generales/forófito”; se aclara lo siguiente.\nEl numeral 2.1.2 y literal h) de la circular en mención establecen que el seguimiento y monitoreo de las medidas \nde restauración ecológica se efectúa a través de parcelas permanentes de observación, a fin de obtener \ninformación comparativa que permita identificar la efectividad de la medida a través del tiempo, de conformidad \ncon los objetivos del Plan Nacional de Restauración MADS 2015) que se cita a continuación. \n“2.1.2. Recuperación, Rehabilitación o Restauración Ecológica.\nEsta medida de manejo se plantea por la afectación agregados de especies de musgos, hepáticas, anthoceros \ny líquenes, ante lo cual el objetivo de la medida es recuperar, rehabilitar o restaurar los ecosistemas que sean \nhábitat de estas especies. En este sentido las acciones de recuperación, rehabilitación y restauración se deberá \nrealizar siguiendo los lineamientos establecidos en el Plan Nacional de Restauración: Restauración \nEcológica, Rehabilitación y Recuperación de áreas Disturbadas (MADS, 2015) (…) A continuación, se \nrelacionan los aspectos a tener en cuenta para el desarrollo de estos procesos como medida de manejo por la \nafectación de especies de flora silvestre en veda:\n(…)\nh) Incluir en las acciones de recuperación, rehabilitación y restauración de ecosistemas, parcelas de monitoreo \no permanentes, que permitirán la toma de datos parametrizados con el fin de obtener información comparativa \nque evidencie la efectividad en el desarrollo de la medida a través del tiempo. Se deberá priorizar la \nevaluación de parámetros como colonización de especies en veda en sustratos epifitos, rupícolas y terrestres, \npresencia y ausencia, fenología, abundancia registrada en unidad de medida (cobertura cm2), hospederos y \nestado fitosanitario. \nEntre la bibliografía a tener en cuenta para la implementación de estas parcelas de monitoreo, se recomienda \nla “Serie: Métodos para estudios ecológicos a largo plazo. ESTABLECIMIENTO DE PARCELAS \nPERMANENTES EN BOSQUES DE COLOMBIA. VOLUMEN I” (Vallejo, et al; 2005), el cual describe los \nmétodos para la localización de la parcela, tipos de muestreo, variables a medir, manejo y análisis de datos, \nentre otros aspectos para la implementación de parcelas permanentes”.\nConforme a lo citado se detalla que la estrategia de monitoreo para especies no vasculares sugerida por la \nSociedad en el oficio, no tiene de fundamento técnico en las indicaciones del Plan Nacional de Restauración, \ndado que el ejercicio de  monitoreo requiere la obtención de información sobre el proceso de colonización y \ndesarrollo de estos organismos tanto en los nuevos forófitos como en los existentes y en otros sustratos o \nhábitos, lo cual se obtiene con diferentes muestreos a lo largo de los 5 años establecidos y no con un único \nmuestreo al final del tiempo de ejecución del programa de rehabilitación ecológica. Conforme a ello se considera \nque no procede la petición de la Sociedad sobre este aspecto.    \n\nResolución No.  03040           Del   23 de diciembre de 2022            Hoja No. 21 de 26\n“Por la cual se resuelve un recurso de reposición interpuesto contra la Resolución 01129 del 31 de mayo de 2022 y se \nadoptan otras determinaciones”\nOficinas: Carrera 13 A No. 34 – 72 Edificio 13 35 Pisos 8 Bogotá, D.C.\nCentro de Orientación y Radicación de Correspondencia: Carrera 13 A No. 34 – 72 Edificio 13 35 \nLocales 110 al 112 Bogotá, D.C.  \nCódigo Postal 110311156\nNit.: 900.467.239-2\nLínea de Orientación y Contacto Ciudadano: 57 (1) 2540100 / 018000112998 PBX: 57 (1) 2540111\nwww.anla.gov.co    Email: licencias@anla.gov.co  \nPágina 21 de 26\nSegundo argumento: la Sociedad sustenta que para el monitoreo de especies no vasculares no se debe \nespecificar el hábito en el cual se efectuará dicha actividad, toda vez que existe incertidumbre sobre este \naspecto derivada de la diversidad de condiciones en biomas, ecosistemas, coberturas de la tierra, morfología, \ngeología del área del proyecto, y en tal sentido propone emplear el término “otros sustratos” para el ejercicio de \nseguimiento y monitoreo de especies no vasculares. Al respecto, se concuerda con la precisión de la Sociedad \nen cuanto a la pertinencia de dejar abierta la posibilidad de monitorear especies no vasculares en el hábito en \nque se encuentren durante las actividades de monitoreo de la medida, razón por la cual se tendrá en cuenta \npara el ajuste de los subnumerales recurridos.\nTercer argumento: la Sociedad refiere la prevención de afectaciones a las especies no vasculares con el \ndesarrollo de un único monitoreo al cabo de tercer año de mantenimiento de la plantación establecida para la \nrehabilitación ecológica; al respecto se aclara lo siguiente: \n<0000>\nEl desarrollo de monitoreos periódicos tiene como fundamento lo estipulado en el Plan Nacional de \nRestauración Ecológica - Anexo 2. Programa de Monitoreo, Seguimiento y Evaluación para la Restauración, \nel cual destaca la importancia de efectuar un “sistema de monitoreo y evaluación para identificar la relación \nentre un estado inicial del ecosistema, las acciones implementadas con la medida y los resultados \nesperados del programa de rehabilitación ecológica planteado”. De esto se destaca que la función del \nmonitoreo no puede simplificarse a un único muestreo al final del programa, toda vez que se debe obtener \ninformación a lo largo de la medida de rehabilitación que evidencie el proceso de colonización de especies \nno vasculares tanto en forófitos existentes como en los plantados y adicionalmente sobre otros sustratos \ndonde se detalle dicho proceso, a fin de demostrar el mejoramiento del hábitat para estos organismos y con \nello el cumplimiento del objetivo de la medida. \n<0000>\nLa obtención de la línea base del área que se elija para el desarrollo del programa de rehabilitación ecológica \naportará información a nivel taxonómico de las especies no vasculares epífitas o con otros hábitos, a partir \nde la cual los posteriores monitoreos podrán tomar referencia a fin de reducir en la medida de lo posible la \nobtención de muestras biológicas en el área destinada a la rehabilitación ecológica. Para dicho fin será \nrelevante un buen acopio y análisis de la información que se obtenga en cumplimiento de lo requerido en el \nliteral c) del numeral 2.4 del artículo tercero de la Resolución 1129 de 2022.\n<0000>\nDe conformidad con la instrucción de la circular MADS 8201-2-808 del del 09 de diciembre de 2019, \nseñalada en el numeral 1.3 Bromelias, Orquídeas, Briofitos (Musgos, hepáticas, anthocerotales) y líquenes, \nla caracterización de especies tanto vasculares como no vasculares a emplear en la fase de caracterización \ndel ecosistema de referencia (línea base), como del monitoreo del área objeto de la medida de rehabilitación \necológica, puede ser desarrollada mediante el protocolo de Gradstein et al. (2003)1, que establece la \nintensidad de muestreo y la zonificación del forófitos de Johansson (1974) modificada por Ter Steege & \nCornelissen (1989), así mismo señala que “En el caso, de tenerse que hacer modificaciones estas deben \nestar respaldadas con los estadígrafos usados para realizar reestructuración del diseño de muestreo \n(evaluación de las unidades muestreales, datos de error muestreal, distribución de los datos que se obtiene \nde los test estadísticos tal como desviación estándar o regresión lineal, entre otros, según ´el \ncomportamiento de datos), demostrando la representatividad estadística indicando el nivel mínimo de \nconfianza y error de muestreo utilizado”. De acuerdo con esta claridad se detalla que de ser necesario \nreducir el número de muestras para minimizar la afectación de las especies no vasculares en desarrollo, \nesto podrá ser justificado estadísticamente. \n<0000>\nLa colonización y desarrollo de especies no vasculares es lenta y compleja por lo cual requiere tiempos \namplios de monitoreo para identificar su comportamiento.\nDe acuerdo con los aspectos anteriormente señalados, se considera que no procede la petición de la Sociedad \nsobre este aspecto, toda vez que pueden ser empleados métodos estadísticos y estrategias de identificación \ntaxonómica de las especies que no impliquen retiro de material biológico en todas las fases de monitoreo y así \nmismo, se destaca la importancia que tiene efectuar monitoreo en varias etapas y no en un único evento al final \ndel programa de rehabilitación. \n1 Gradstein, S.R., Nadkarni, N.M., Krömer, T., Holz, I., Nöske, N. 2003. A Protocol For Rapid And Representative Sampling of Vascular \nand Non-Vascular Epiphyte Diversity of Tropical Rain Forest. Selbyana 24(1): 105-111.\n\nResolución No.  03040           Del   23 de diciembre de 2022            Hoja No. 22 de 26\n“Por la cual se resuelve un recurso de reposición interpuesto contra la Resolución 01129 del 31 de mayo de 2022 y se \nadoptan otras determinaciones”\nOficinas: Carrera 13 A No. 34 – 72 Edificio 13 35 Pisos 8 Bogotá, D.C.\nCentro de Orientación y Radicación de Correspondencia: Carrera 13 A No. 34 – 72 Edificio 13 35 \nLocales 110 al 112 Bogotá, D.C.  \nCódigo Postal 110311156\nNit.: 900.467.239-2\nLínea de Orientación y Contacto Ciudadano: 57 (1) 2540100 / 018000112998 PBX: 57 (1) 2540111\nwww.anla.gov.co    Email: licencias@anla.gov.co  \nPágina 22 de 26\nA partir de los aspectos citados se considera pertinente establecer la siguiente precisión para el desarrollo del \nmonitoreo a las especies no vasculares del programa de rehabilitación ecológica propuesto. \nCon base en las características regionales del área donde se ubica el proyecto EXPLOTACIÓN BLOQUE \nCABRESTERO, en cuanto humedad relativa, temperatura, así como de los ecosistemas existentes en el área \nlicenciada que corresponden a bosques naturales, vegetación secundaria y herbazales en el Helobioma a de \nla Amazonia y Orinoquia, según se detalla en el plan de compensación del proyecto (radicado 2020196716-1-\n000 del 09 de noviembre del 2020), evaluado con el concepto técnico 1893 del 16 de abril de 2021, acogido \ncon la Resolución 778 del 29 de abril de 2021, así como la información relacionada en los reportes de alertas \ntempranas de la ANLA con territorio cercano al área del proyecto (reporte de la SZH de los ríos Metica, \nGuayuriba, Guatiquia y Negro; reporte de la SZH Alto Vichada, Muco y Guarrojo), se considera pertinente \nestablecer el desarrollo de 3 monitoreos de especies no vasculares para el desarrollo del programa de \nrehabilitación ecológica. El primero se efectuará al término del establecimiento de las especies forestales del \nprograma (comienzo del cronograma de actividades), el segundo al finalizar el segundo semestre del año 2 del \ncronograma de actividades y el tercero finalizando el quinto año del cronograma de actividades.\nConclusión de la ANLA\nDe conformidad con el anterior análisis, se considera necesario ajustar la obligación de la Resolución \n1129 de 31 de mayo de 2022 recurrida por la Sociedad, en el siguiente sentido.\nAclarar el subnumeral ii del literal b) del numeral 4.1 del artículo tercero de la Resolución 1129 de 31 de mayo \nde 2022, \ncual quedará de la siguiente manera: \nARTÍCULO TERCERO. (…)\n(…)\n4.1 Medida 1. Plan de mantenimiento. Complementar la medida en el sentido de: \nb. Desarrollo de parcelas permanentes de monitoreo y conservación, destinadas a la verificación de los \nsiguientes aspectos: \ni. Monitorear variables de la vegetación que permitan determinar si la rehabilitación promueve el \nmejoramiento de hábitats para epífitas no vasculares, empleando parámetros como presencia/ausencia, \ncobertura vegetal, hospederos y estado fitosanitario de estos.\nii. Para el monitoreo en mención tener en cuenta las especies no vasculares en otros sustratos (en caso \nde desarrollarse).\nCon fundamento en las recomendaciones efectuadas en el concepto técnico 05228 del 31 de agosto \nde 2022, no se accede a la petición de la recurrente debido a la importancia que tiene efectuar \nmonitoreos en varias etapas del programa de rehabilitación ecológica. Sin embargo, se considera \npertinente modificar la disposición recurrida, como se señalará en la parte resolutiva del presente acto \nadministrativo. \nCONSIDERACIONES JURÍDICAS FINALES Y CONCLUSIÓN GENERAL\nDe la expedición de la Resolución 01129 del 31 de mayo de 2022 y sus fundamentos.\nResulta importante, traer a colación los motivos jurídicos y técnicos por los cuales fue emitida la \nResolución objeto de recurso en esta oportunidad. Respecto de ello, es dable indicar que esta \nAutoridad, adelantó una revisión documental de los aspectos referentes al documento “Solicitud de \nevaluación del Plan de rescate y traslado de flora en veda y el Plan de rehabilitación ecológica, como \nmedidas de manejo ambiental propuestas a implementar en el marco de desarrollo del proyecto \n\nResolución No.  03040           Del   23 de diciembre de 2022            Hoja No. 23 de 26\n“Por la cual se resuelve un recurso de reposición interpuesto contra la Resolución 01129 del 31 de mayo de 2022 y se \nadoptan otras determinaciones”\nOficinas: Carrera 13 A No. 34 – 72 Edificio 13 35 Pisos 8 Bogotá, D.C.\nCentro de Orientación y Radicación de Correspondencia: Carrera 13 A No. 34 – 72 Edificio 13 35 \nLocales 110 al 112 Bogotá, D.C.  \nCódigo Postal 110311156\nNit.: 900.467.239-2\nLínea de Orientación y Contacto Ciudadano: 57 (1) 2540100 / 018000112998 PBX: 57 (1) 2540111\nwww.anla.gov.co    Email: licencias@anla.gov.co  \nPágina 23 de 26\ndenominado “Explotación Bloque Cabrestero” con expediente LAV0084-00-2014, presentado por el \ntitular de instrumento de manejo y control ambiental, la sociedad PAREX RESOURCES COLOMBIA \nLTD. SUCURSAL, mediante comunicación con radicación ANLA 2021092418-1-000 del 11 de mayo \nde 2021.\nComo resultado de lo anterior, se emitió el Concepto Técnico 02212 del 28 de abril de 2022, el cual \nsirvió como fundamento y sustento técnico para la expedición del Acto Administrativo objeto de \nrecurso, el cual expone en su parte considerativa argumentos que para el presente acto administrativo \npermanecen vigentes y válidos a la fecha.\nEn cuando a la decisión que se adopta en el presente acto administrativo, y en particular en lo \nrelacionado con el establecimiento de medidas de manejo ambiental para la conservación de especies \nvedadas, es preciso considerar que las mismas se encuentran soportadas sobre decisiones técnicas \nobjetivas adecuadas a la realidad del proyecto. Por lo tanto, las decisiones administrativas que se \nadoptan en la presente actuación, le permiten a esta Autoridad ambiental la adopción e imposición de \nmedidas de manejo que sean coherentes y eficaces, sin perjuicio de las medidas que debe adoptar el \nbeneficiario de la licencia ambiental a fin de compensar el impacto ambiental que la ejecución de las \nobras produce impidiendo la degradación del medio ambiente, debiendo entenderse que las medidas \nde manejo ambiental para la conservación de especies vedadas eran necesarias para facilitar los \npróximos seguimientos y verificar el cumplimiento del objetivo propuesto con las medidas \nimplementadas.\nDe las anteriores consideraciones, es necesario colegir, que las medidas propuestas por la titular del \nproyecto y establecidas por parte de esta Autoridad corresponden con las necesidades de \nconservación de las especies vedadas dadas las particularidades del área del proyecto encontradas \nen campo y se contraen a mitigar, corregir, o compensar, los impactos susceptibles de presentarse, \nen esa medida las medidas impuestas son proporcionales para el cumplimiento de los fines \npretendidos en la normatividad, el desarrollo del proyecto bajo criterios de sostenibilidad que debe \nverificar esta Autoridad, en ejercicio de sus competencias y cumplimiento de los fines para los cuales \nfue creada mediante el Decreto 3573 de 2011.\nCon relación a la proporcionalidad de las medidas adoptadas, es menester traer a colación la sentencia \nC-520 de 2016 la Corte Constitucional indicó:\n“Las razones que resultan legítimas para adoptar tratos diferenciales deben procurar, además, \nrestringir en la menor medida posible, tanto el derecho general a la igualdad, como los demás derechos \ny principios constitucionales que puedan verse involucrados (afectados, intervenidos) en la decisión. \nEn tal sentido, las medidas deben ser proporcionales. \nPor esa razón, la Corte ha expresado que para que un trato diferenciado sea constitucionalmente \nválido, debe tener un propósito constitucionalmente legítimo, y debe ser proporcional, en el \nsentido de que no implique afectaciones excesivas a otros propósitos constitucionalmente protegidos. \nLa proporcionalidad del medio se determina, entonces, mediante una evaluación de su “idoneidad para \nobtener el fin (constitucionalmente legítimo de acuerdo con el principio de razón suficiente); necesidad, \nen el sentido de que no existan medios alternativos igualmente adecuados o idóneos para la obtención \ndel fin, pero menos restrictivos de los principios afectados; y proporcionalidad en sentido estricto, esto \nes, que el fin que la efectividad del fin que se persigue se alcance en una medida mayor a la afectación \nde los principios que sufren restricción, y particularmente, del principio de igualdad” (Resaltado fuera \ndel texto)\nDe manera que las medidas adoptadas mediante la Resolución recurrida, no son otra cosa que una \nmanifestación de los mandatos constitucionales anteriormente citados en el presente acto \nadministrativo, que pretenden que el estado controle los factores de deterioro ambiental, y en virtud \ndel principio de proporcionalidad, se establecieran unas medidas que esta autoridad considera \nadecuadas para el efecto, y que van en la correcta dirección, para asegurar los fines del Estado, los \n\nResolución No.  03040           Del   23 de diciembre de 2022            Hoja No. 24 de 26\n“Por la cual se resuelve un recurso de reposición interpuesto contra la Resolución 01129 del 31 de mayo de 2022 y se \nadoptan otras determinaciones”\nOficinas: Carrera 13 A No. 34 – 72 Edificio 13 35 Pisos 8 Bogotá, D.C.\nCentro de Orientación y Radicación de Correspondencia: Carrera 13 A No. 34 – 72 Edificio 13 35 \nLocales 110 al 112 Bogotá, D.C.  \nCódigo Postal 110311156\nNit.: 900.467.239-2\nLínea de Orientación y Contacto Ciudadano: 57 (1) 2540100 / 018000112998 PBX: 57 (1) 2540111\nwww.anla.gov.co    Email: licencias@anla.gov.co  \nPágina 24 de 26\nmandatos, principios de la función administrativa y el interés general, dentro del cual, por supuesto, se \nencuentra la preservación, conservación y racional y sustentable uso de los recursos naturales, el \npatrimonio común de la humanidad y que, a entender de esta Autoridad, no se presentan como \nexcesivas frente al titular de la licencia ambiental.\nTeniendo en cuenta las consideraciones técnicas y jurídicas esgrimidas en este pronunciamiento, se \nconsidera procedente reponer y, en consecuencia, modificar el literal a) del numeral 2.7 del artículo \ntercero (Monitoreo y seguimiento de especies no vasculares), el subnumeral ii del literal a) del numeral \n4.1 y el subnumeral ii del literal b) del numeral 4.1 del artículo tercero de la Resolución 1129 de 31 de \nmayo de 2022, Lo Anterior de conformidad con lo recomendado en el concepto técnico 5228 del 31 \nde agosto de 2022\nEn mérito de lo expuesto,\nRESUELVE\nARTÍCULO PRIMERO. Reponer y en consecuencia modificar el literal a, del numeral 2.7; el \nsubnumeral ii del literal a) y el subnumeral ii del literal b) del numeral 4.1 del artículo tercero, de la \nResolución 1129 de 31 de mayo de 2022, los cuales quedarán así: \n“ARTÍCULO TERCERO. La sociedad PAREX RESOURCES COLOMBIA LTD. SUCURSAL, deberá \najustar las fichas anteriormente citadas y presentarlas para verificación de la ANLA previo al desarrollo \nde obras y actividades que requieran intervención de áreas con presencia de flora silvestre en \ncondición de veda, según se indica a continuación:\nEn cuanto a las medidas de manejo de flora en veda, epífitas no vasculares: \n2. Ficha BI-14. Manejo de Epífitas No vasculares\n2.7 Medida 7. Cronograma de actividades \nAjustar en el sentido de: \na) Establecer el cronograma de actividades de mantenimiento, seguimiento y monitoreo de las medidas \nde manejo a realizar en concordancia con el cronograma de ejecución de obra, con una duración de \ncinco (5) años, contados a partir de la finalización del establecimiento de la plantación, en los cuales \ndebe desarrollar tres (3) años de mantenimiento de las especies plantadas para la rehabilitación \necológica y 3 monitoreos de especies no vasculares: el primero se efectuará al término del \nestablecimiento de las especies forestales del programa, el segundo al finalizar el segundo semestre \ndel año 2 del cronograma de actividades y el tercero finalizando el quinto año del cronograma de \nactividades.\n(…)”\n4. Medidas para el seguimiento y monitoreo a especies en veda (no vasculares)\n4.1 Medida 1. Plan de mantenimiento\na. Presentar informes detallados del proceso de rehabilitación ecológica que incluyan formatos de \ncampo, registros fotográficos con fecha y coordenadas de ubicación, con la siguiente frecuencia:\n(…) \nii. Informes anuales de la fase de mantenimiento, seguimiento y monitoreo de las especies establecidas \nteniendo en cuenta un tiempo de tres (3) años a partir de la finalización del establecimiento de la \nplantación, donde se especifique la fecha de inicio de las obras del proyecto y la fecha de inicio del \nproceso de restauración ecológica. Estos deberán relacionar datos del % de sobrevivencia, estado de \ncrecimiento y fitosanitario, actividades desarrolladas en cada mantenimiento y resiembras.  \n(…)\n\nResolución No.  03040           Del   23 de diciembre de 2022            Hoja No. 25 de 26\n“Por la cual se resuelve un recurso de reposición interpuesto contra la Resolución 01129 del 31 de mayo de 2022 y se \nadoptan otras determinaciones”\nOficinas: Carrera 13 A No. 34 – 72 Edificio 13 35 Pisos 8 Bogotá, D.C.\nCentro de Orientación y Radicación de Correspondencia: Carrera 13 A No. 34 – 72 Edificio 13 35 \nLocales 110 al 112 Bogotá, D.C.  \nCódigo Postal 110311156\nNit.: 900.467.239-2\nLínea de Orientación y Contacto Ciudadano: 57 (1) 2540100 / 018000112998 PBX: 57 (1) 2540111\nwww.anla.gov.co    Email: licencias@anla.gov.co  \nPágina 25 de 26\nb. Desarrollo de parcelas permanentes de monitoreo y conservación destinadas a la verificación de los \nsiguientes aspectos: \nii. Para el monitoreo en mención tener en cuenta las especies no vasculares en otros sustratos (en \ncaso de desarrollarse).\nARTÍCULO SEGUNDO: No Reponer y en consecuencia confirmar\n-El numeral i del literal b de la medida 4.1 Plan de Mantenimiento dentro de las medidas para el \nseguimiento y monitoreo a especies en veda (no vasculares), del articulo tercero de la Resolución \n1129 del 31 de mayo de 2022.\nARTÍCULO TERCERO: Los demás términos, condiciones y obligaciones de la Resolución 01129 del \n31 de mayo de 2022, que no son objeto de modificación expresa en este proveído, se mantienen \nvigentes y son exigibles para el titular del instrumento de manejo ambiental, a partir de la ejecutoria \ndel presente acto administrativo.\nARTÍCULO CUARTO. Por la Autoridad Nacional de Licencias Ambientales, notificar personalmente o \npor aviso, cuando a ello hubiere lugar, el contenido del presente acto administrativo al representante \nlegal, apoderado debidamente constituido o a la persona debidamente autorizada por la Sociedad \nPAREX RESOURCES COLOMBIA LTD. SUCURSAL., identificada con Nit. 900268747-9., de \nconformidad con los artículos 67 y 69 del Código de Procedimiento Administrativo y de lo Contencioso \nAdministrativo.\nARTÍCULO QUINTO. Por la Autoridad Nacional de Licencias Ambientales –ANLA, comunicar el \npresente acto administrativo a las alcaldías de los municipios de Villanueva y Tauramena en el \ndepartamento de Casanare, a la Corporación Autónoma Regional de la Orinoquia – \nCORPORINOQUIA, y a la Procuraduría Delegada para Asuntos Ambientales y Agrarios.\nARTÍCULO SEXTO. Por la Autoridad Nacional de Licencias Ambientales - ANLA, ordenar la \npublicación de la presente Resolución, en la Gaceta Ambiental de esta entidad.\nARTÍCULO SÉPTIMO. Contra el presente acto administrativo no procede recurso alguno, de \nconformidad con lo dispuesto en el Artículo 87 de la Ley 1437 de 18 de enero de 2011 por medio de \nla cual se expidió el Código de Procedimiento Administrativo y de lo Contencioso Administrativo.\nNOTIFÍQUESE, COMUNÍQUESE, PUBLÍQUESE Y CÚMPLASE\nDada en Bogotá D.C., a los 23 de diciembre de 2022\nRODRIGO ELIAS NEGRETE MONTES\nDirector General\nEjecutores\nERIKA PATRICIA GARNICA \nTARAZONA\nContratista\n\nResolución No.  03040           Del   23 de diciembre de 2022            Hoja No. 26 de 26\n“Por la cual se resuelve un recurso de reposición interpuesto contra la Resolución 01129 del 31 de mayo de 2022 y se \nadoptan otras determinaciones”\nOficinas: Carrera 13 A No. 34 – 72 Edificio 13 35 Pisos 8 Bogotá, D.C.\nCentro de Orientación y Radicación de Correspondencia: Carrera 13 A No. 34 – 72 Edificio 13 35 \nLocales 110 al 112 Bogotá, D.C.  \nCódigo Postal 110311156\nNit.: 900.467.239-2\nLínea de Orientación y Contacto Ciudadano: 57 (1) 2540100 / 018000112998 PBX: 57 (1) 2540111\nwww.anla.gov.co    Email: licencias@anla.gov.co  \nPágina 26 de 26\nEjecutores\n \n \nRevisor / L\u0000der\nANA MERCEDES CASAS FORERO\nSubdirectora de Seguimiento de \nLicencias Ambientales\n \nSANDRA PATRICIA BEJARANO \nRINCON\nContratista\n \nNANCY RUBIELA CUBIDES \nPERILLA\nContratista\n \nOSCAR MAURICIO JARAMILLO \nRODRIGUEZ\nProfesional Especializado\n \n \nExpediente No. \nLAV0084-00-2014\nConcepto Técnico N° CT 5228 del 31 de agosto de 2022\nFecha:\n23 de septiembre de 2022\nProceso No.: 2022289736\nArchívese en: LAV0084-00-2014 \nPlantilla_Resolución_SILA_v3_42852\nNota: Este es un documento electrónico generado desde los Sistemas de Información de la ANLA. El original reposa en los archivos digitales de la \nEntidad.\n"
}