{
  "fuente": "ANLA_GACETA",
  "numero_resolución": "RESOLUCIÓN N° 002195",
  "fecha_resolución": "2024-06-18",
  "anio_resolucion": "2024",
  "nombre_proyecto": null,
  "nombre_proyecto_normalizado": null,
  "ubicación": "Municipio De Puerto Gaitán, Departamento Del Meta",
  "empresa": "LA EMPRESA TETHYS PETROLEUM COMPANY LIMITED",
  "empresa_normalizada": "LA EMPRESA TETHYS PETROLEUM COMPANY LIMITED",
  "numero_expediente": "LAM0019",
  "radicados": [
    "20246200745942"
  ],
  "descripcion": "Por el cual se resuelve recurso de reposición contra la Resolución 1178 del 18 de junio de 2024",
  "tipos_infraccion": [
    "Vertimientos",
    "Incumplimiento del PMA"
  ],
  "tipos_infraccion_normalizados": [
    "VERTIMIENTOS",
    "INCUMPLIMIENTO DEL PMA"
  ],
  "pdf_id": "48378",
  "file_name": "ANLA_48378.pdf",
  "texto_completo": "AUTORIDAD NACIONAL DE LICENCIAS \nAMBIENTALES\n- ANLA –\nRESOLUCIÓN N° 002195\n(04 OCT. 2024)\nPágina 1 de 34\n“Por el cual se resuelve recurso de reposición contra la Resolución 1178 del \n18 de junio de 2024”\nEL DIRECTOR DE LA AUTORIDAD NACIONAL DE LICENCIAS AMBIENTALES \n– ANLA\nEn uso de sus facultades legales, en especial de aquellas conferidas por medio de \nla Ley 99 de 1993, el Decreto ley 3573 de 2011, la Ley 1437 de 2011, el Decreto \n1076 de 2015, y\n  \nCONSIDERANDO:\nQue mediante la Resolución 0233 de 16 de marzo de 2001, el entonces Ministerio \ndel Medio Ambiente – MMA, hoy Ministerio de Ambiente y Desarrollo Sostenible - \nMADS, otorgó Licencia Ambiental Global a la empresa COPLEX COLOMBIA \nLIMITED, para la explotación de hidrocarburos en el campo Rubiales, ubicado en el \nmunicipio de Puerto Gaitán, departamento del Meta.\nQue con la Resolución 0743 del 16 de agosto de 2001, el Ministerio, autorizó la \ncesión de los derechos y obligaciones contenidos en la Licencia Ambiental 0233 del \n16 de marzo de 2001 a favor de la empresa Tethys Petroleum Company Limited \n(posteriormente Meta Petroleum Limited).\nQue por medio de la Resolución 0613 del 27 de mayo de 2004, el Ministerio modificó \nel artículo primero de la Resolución 233 del 16 de marzo de 2001 en el sentido de \nampliar el área del Campo Rubiales, que consiste en adicionar un anillo de \naproximadamente 5 km alrededor del área licenciada, y autorizar otras actividades \nadicionando permisos, concesiones y autorizaciones.\nQue mediante la Resolución 1168 del 18 de agosto de 2005, el Ministerio modificó \nla Resolución 233 del 16 de marzo de 2001 en el sentido de incluir unas actividades \ncomo la adecuación en los sitios de captación, vertimiento y la construcción de un \npuente sobre el caño Masififeriana cuarenta metros aguas arribas del puente \nexistente, un PAD de inyección y adicionar permisos, concesiones y autorizaciones.\nQue a través de la Resolución 1686 del 10 de noviembre de 2005, el Ministerio, \naclaró la Resolución 1168 del 18 de agosto de 2005, en el sentido de autorizar a la \nempresa Meta Petroleum Limited, la ampliación del caudal máximo de aguas \n\nResolución No. 002195       Del 04 OCT. 2024          Hoja No. 2 de 34\n“Por el cual se resuelve recurso de reposición contra la Resolución 1178 del 18 de junio de \n2024”\nPágina 2 de 34\nresiduales a verter, incluidas todas las actividades del campo Rubiales en la \ncantidad de 17 l/s., para cada uno de los cinco puntos localizados.\nQue por medio de la Resolución 0524 del 26 de marzo de 2007, el Ministerio \nmodificó la Resolución 233 del 16 de marzo de 2001, en el sentido de adicionar una \nconcesión de aguas subterráneas para uso domésticos en unos pozos.\nQue mediante la Resolución 2355 del 27 de diciembre de 2007, el Ministerio \nmodificó la Resolución 233 de 16 de marzo de 2001, en el sentido de autorizar los \ncaudales de vertidos al caño Rubiales de aguas tratadas industriales y ajustar el \nplan de inversión del 1% a los nuevos costos del proyecto, entre otras.\nQue a través de la Resolución 1586 del 12 de septiembre de 2008, el Ministerio \nmodificó la Resolución 233 de 16 de marzo de 2001, en el sentido de autorizar a la \nsociedad Meta Petroleum Limited, la realización de nuevas actividades, entre ellas: \nconstrucción de vías, construcción de un PAD de inyección, perforación de pozos \ninyectores, construcción de Trunk Line, líneas de recolección, líneas de flujo, líneas \nde inyección, entre otros.\nQue por medio de la Resolución 473 de 9 de marzo de 2009, el Ministerio aclaró la \nResolución 1586 del 12 de septiembre de 2008, en lo relacionado con los PAD de \ninyección autorizando la adecuación de un área de 40.000 m2, igualmente, \nestableció que el monitoreo de ruido debe efectuarse por un período de 48 horas, \nasí mismo, la implementación de “cortafuegos”, alrededor del CPF 2.\nQue mediante la Resolución 1769 del 1 de septiembre de 2011, el Ministerio \nmodificó la Resolución 1168 de 2005 (modificatoria de la Resolución 1586 de \nseptiembre 12 de 2008), en el sentido de ampliar el volumen de reinyección de \n900.000 BWPD a 1.580.000 BWPD.\nQue por medio de la Resolución 617 del 8 de agosto de 2012, la Autoridad Nacional \nde Licencias Ambientales modificó el artículo primero de la Resolución 1769 del 1 \nde septiembre de 2011, mediante el cual se modificó el artículo sexto de la \nResolución 1168 de 2005, modificada por el artículo octavo de la Resolución 1586 \ndel 12 de septiembre de 2008, en el sentido de ampliar el volumen de reinyección \nde agua industrial tratada de 1.580.000 BWPD a 1.980.000 BWPD.\nQue a través de la Resolución 768 del 2 de agosto de 2013, esta Autoridad Nacional \nmodificó el parágrafo segundo del artículo primero de la Resolución 233 del 16 de \nmarzo de 2001, en el sentido de incluir entre otras actividades, la construcción y \noperación de un nuevo PAD de inyección, perforación de 8 pozos inyectores, \nconstrucción y operación de la línea de inyección entre el PAD 7 y el PAD 9 (Tramo \nII) y construcción, ampliación y mejoramiento de campamentos.\nQue mediante la Resolución 1032 del 9 de octubre de 2013, esta Autoridad Nacional \nautorizó la cesión parcial de los derechos y obligaciones originados y derivados de \nla Licencia Ambiental Global otorgada mediante la Resolución 233 del 16 de marzo \nde 2011, modificada a través de la Resolución 1586 del 12 de septiembre de 2008, \npara el proyecto “Campo Rubiales”, en lo referente a los siguientes aspectos: área, \n\nResolución No. 002195       Del 04 OCT. 2024          Hoja No. 3 de 34\n“Por el cual se resuelve recurso de reposición contra la Resolución 1178 del 18 de junio de \n2024”\nPágina 3 de 34\ninfraestructura y operación de la Estación de Bombeo Rubiales; área actual del \ncampamento definitivo; y área de aspersión. En dicha cesión actúan la empresa \nMeta Petroleum Corp., en calidad de cedente y la empresa Oleoducto de los Llanos \nS.A., en calidad de cesionaria.\nQue a través de la Resolución 1156 del 19 de noviembre de 2013, esta Autoridad \nNacional resuelve el recurso de reposición interpuesto por la sociedad Meta \nPetroleum Corp, contra la Resolución 768 del 2 de agosto de 2013, la cual se \nconfirma en todas sus partes.\nQue por medio de la Resolución 1236 del 5 de diciembre de 2013, esta Autoridad \nNacional amplía en un mes el plazo establecido en el artículo cuarto de la \nResolución 1032 del 9 de octubre de 2013, mediante la cual se autorizó la cesión \nparcial de los derechos y obligaciones originados y derivados de la Licencia \nAmbiental Global otorgada mediante la Resolución 233 del 16 de marzo de 2011, \nmodificada a través de la Resolución 1586 del 12 de septiembre de 2008. \nQue mediante la Resolución 1559 del 19 de diciembre de 2014, esta Autoridad \nNacional modificó el parágrafo segundo del artículo primero de la Resolución 0233 \ndel 16 de marzo de 2001, en el sentido de autorizar líneas de desahogo y ampliación \ndel volumen de inyección.\nQue por medio de la Resolución 1286 del 13 de octubre de 2015, esta Autoridad \nNacional autorizó la cesión parcial de los derechos y obligaciones contenidos en el \nexpediente LAM0019 derivados de la autorización otorgada para la operación de la \nBatería 4 y su infraestructura asociada a la empresa Metapetroleum Corp, \nremitiendo la documentación asociada al expediente LAM4795 correspondiente al \nproyecto “Área de Explotación de Hidrocarburos Quifa”, localizado en jurisdicción \ndel municipio de Puerto Gaitán, departamento del Meta.\nQue a través de la Resolución 745 del 26 de julio de 2016, esta Autoridad Nacional \naprobó la cesión total de los derechos y obligaciones de la infraestructura que hacía \nparte del proyecto derivados de la Licencia Ambiental Global otorgada mediante la \nResolución 233 de 16 de marzo de 2001, a favor de la sociedad Ecopetrol S.A, a \nexcepción de la Batería 4 y descargadero RB372 que fue cedido a la sociedad \nMetapetroleum Corp mediante Resolución 1286 del 13 de octubre de 2015 \nexpediente LAM4795, y la estación de bombeo rubiales EBR, campamento ODL y \nel área del campo de aspersión que fue cedida a la sociedad Oleoducto de los \nLlanos Orientales ODL mediante Resolución 1032 del 9 octubre de 2013 expediente \nLAM2965.\nQue mediante la Resolución 0931 del 08 de agosto de 2017, esta Autoridad \nNacional modificó la Resolución 0233 del 16 de marzo de 2001, en el sentido de \nactualizar las coordenadas de los puntos de captación de agua, entre otras \ndisposiciones.\nQue a través de la Resolución 0324 del 05 de marzo de 2018, esta Autoridad \nNacional resolvió el recurso de reposición interpuesto contra la Resolución 0931 del \n\nResolución No. 002195       Del 04 OCT. 2024          Hoja No. 4 de 34\n“Por el cual se resuelve recurso de reposición contra la Resolución 1178 del 18 de junio de \n2024”\nPágina 4 de 34\n08 de agosto de 2017, confirmando los artículos quinto, sexto, séptimo, noveno y \ndécimo de la Resolución 0931 del 08 de agosto de 2017.\nQue por medio de la Resolución 0782 del 23 de mayo de 2018, esta Autoridad \nNacional modificó las Resoluciones 233 del 16 de marzo de 2001, 1168 del 18 de \nagosto de 2005, 2355 del 24 de diciembre de 2007, 1586 del 12 de septiembre de \n2008, 768 del 2 de agosto de 2013, en el sentido de establecer como línea general \nde inversión del 1%, las acciones de protección, conservación y preservación a \ntravés de restauración ecológica, rehabilitación y recuperación, dentro de las cuales \nse puede incluir el desarrollo de proyectos de uso sostenible.\nQue mediante la Resolución 1076 del 17 de junio de 2019, esta Autoridad Nacional \nrealizó ajuste vía seguimiento relacionado con la inclusión de monitoreos \npermanentes en el caño Masififeriana y caño Rubiales.\nQue a través de la Resolución 1717 del 30 de agosto de 2019, esta Autoridad \nNacional modificó la Resolución 0233 del 16 de marzo de 2001, en el sentido de \nadicionar nueva infraestructura, obras y actividades al proyecto.\nQue por medio de la  Resolución 2475 del 18 de diciembre de 2019, esta Autoridad \nNacional resolvió un recurso de reposición en contra la Resolución 1717 del 30 de \nagosto de 2019, por medio de la cual se modificó parcialmente la Licencia Ambiental \nGlobal otorgada mediante la Resolución 0233 del 16 de marzo de 2001, en el \nsentido de modificar lo dispuesto en el numeral 18 del artículo cuarto; literal g del \nartículo quinto; numerales 1° y 2° del artículo sexto; numeral 3° del artículo séptimo; \nnumeral 4° y 5° del artículo octavo; artículo vigésimo segundo; vigésimo cuarto de \nla Resolución 1717 del 30 de agosto de 2019.\nQue a través de la Resolución 722 del 20 de abril de 2020, esta Autoridad Nacional \nmodificó la licencia ambiental vía seguimiento, en el sentido de actualizar la \ninfraestructura, obras y actividades, así como la imposición de medidas adiciones \nde conformidad con la ficha control de ruido y contaminación atmosférica para el \nCampo de explotación de hidrocarburos Rubiales.\nQue mediante la Resolución 1169 del 8 de julio de 2020, esta Autoridad Nacional \nresuelve el recurso de reposición interpuesto contra la Resolución 722 del 20 de \nabril de 2020. \nQue por medio de la Resolución 1236 del 21 de julio de 2020, esta Autoridad \nNacional, ajustó vía de seguimiento, el numeral segundo del artículo quinto de la \nResolución 0233 de 2001, en el sentido de incluir la actividad, “Autorizar la entrega \nde aguas residuales grises tratadas de los campamentos Arrayanes y Nuevo \nAmanecer con un caudal máximo de 60 m3 /d cada uno, a un tercero autorizado \ncon los debidos permisos vigentes para el transporte y disposición final.”\nQue mediante la Resolución 1989 del 9 de diciembre de 2020 esta Autoridad \nNacional modificó la Resolución 233 del 16 de marzo de 2001 en el sentido de \naprobar la actualización de la inversión forzosa de no menos del 1%, conforme al \n\nResolución No. 002195       Del 04 OCT. 2024          Hoja No. 5 de 34\n“Por el cual se resuelve recurso de reposición contra la Resolución 1178 del 18 de junio de \n2024”\nPágina 5 de 34\nparágrafo 1° del artículo 321 del Plan Nacional de Desarrollo - PND (Ley 1955 del \n25 de mayo del 2019).\nQue a través de la Resolución 495 del 15 de marzo de 2021 esta Autoridad Nacional \nresuelve recurso de reposición en contra de la Resolución 1989 del 9 de diciembre \nde 2020.\nQue mediante la Resolución 1282 del 10 de junio de 2022 esta Autoridad Nacional \nactualiza el Plan de Manejo Ambiental del proyecto y se adoptan otras \ndeterminaciones.\nQue a través de la Resolución 1768 de 18 de agosto de 2022 esta Autoridad \nNacional de Licencias Ambientales aprobó la actualización de la base de inversión \nforzosa de no menos del 1% de los valores no ejecutados, de conformidad con el \nParágrafo 1 del Artículo 321 de la Ley 1955 de 2019.\nQue por medio de la Resolución 2527 del 19 de octubre de 2022 esta Autoridad \nNacional resuelve un recurso de reposición contra la Resolución 1768 del 18 de \nagosto de 2022.\nQue mediante la Resolución 2999 del 19 de diciembre de 2022 esta Autoridad \nNacional resuelve un recurso de reposición interpuesto contra la Resolución 1282 \ndel 10 de junio de 2022 y se adoptan otras determinaciones.\nQue a través de la Resolución 3098 del 28 de diciembre de 2022 esta Autoridad \nautoriza la cesión parcial de la licencia ambiental global otorgada para la Explotación \nde Hidrocarburos en el Campo Rubiales en lo relacionado con la Central Térmica \nde Generación Eléctrica Termo EBR localizada en el área del IPP de CPF-2 y el \nCampo de Aspersión.\nQue por medio de la Resolución 517 del 10 de marzo de 2023 esta Autoridad acepto \nla liquidación parcial de la inversión forzosa de no menos del 1%, en el periodo \ncorrespondiente al año 2021.\nQue mediante la Resolución 1973 del 5 de septiembre de 2023 esta Autoridad \nNacional realiza ajuste vía seguimiento modificando la Resolución 1717 del 30 de \nagosto 2019 y Resolución 1282 del 10 de junio de 2022 en el sentido de incluir en \nla ficha 8.1.2 Seguimiento al Agua Subterránea, la estandarización de los \nparámetros y frecuencias de monitoreo de agua subterráneas en los pozos de \ncaptación y en la red piezométrica presente, en el área del proyecto.\nQue a través de la Resolución 2795 del 30 de noviembre de 2023 esta Autoridad \nNacional realizó ajuste vía seguimiento y acepto liquidación parcial de la inversión \nforzosa de no menos del 1%, correspondiente al año 2022.\nQue por medio de la Resolución 00198 del 12 de febrero de 2024 esta Autoridad \nNacional resuelve recurso de reposición interpuesto contra la Resolución 1973 del \n5 de septiembre de 2023.\n\nResolución No. 002195       Del 04 OCT. 2024          Hoja No. 6 de 34\n“Por el cual se resuelve recurso de reposición contra la Resolución 1178 del 18 de junio de \n2024”\nPágina 6 de 34\nQue mediante Resolución 502 del 22 de marzo de 2024 esta Autoridad Nacional \nrealizó ajuste vía seguimiento y acepta la liquidación parcial de la inversión forzosa \nde no menos del 1% para el periodo comprendido entre los años 2001 y 2019.\nQue a través de la Resolución 1178 del 18 de junio de 2024 esta Autoridad Nacional \nrealizó ajuste vía de seguimiento la codificación y estandarización de los puntos de \nvertimiento autorizados en el proyecto a través de la Resolución 2475 del 18 de \ndiciembre de 2019, que modificó los numerales 1 y 3 del Artículo Séptimo de la \nResolución 1717 del 30 de agosto de 2019.\nQue la Resolución 1178 de 18 de junio de 2024, fue notificada la sociedad Ecopetrol \nS.A el día 19 de junio de 2024.\nQue mediante Auto 4640 de 24 de junio de 2024, se reconoció como terceros \nintervinientes a los señores Susana Sierra Rincón y José Antonio Moncada \nGamboa, dentro del expediente LAM0019 correspondiente al proyecto “Explotación \nde Hidrocarburos en el Campo Rubiales.\nQue por medio del radicado 20246200745942 del 03 de julio de 2024, la sociedad \nEcopetrol S.A interpuso recurso de reposición contra la Resolución 1178 del 18 de \njunio de 2024.\nQue con fundamento en el referido recurso interpuesto y para su atención, esta \nAutoridad emitió el concepto técnico 6179 del 23 de agosto de 2024, el cual será \nacogido en el presente acto administrativo.\nDE LA COMPETENCIA DE LA AUTORIDAD NACIONAL DE LICENCIAS \nAMBIENTALES. \nQue mediante el Decreto ley 3573 de 2011, se creó la Autoridad Nacional de \nLicencias Ambientales – ANLA, en los términos del artículo 67 de la Ley 489 de \n1998, con autonomía administrativa y financiera, sin personería jurídica, la cual hace \nparte del Sector Administrativo de Ambiente y Desarrollo Sostenible. \nQue numeral 1 del artículo tercero del mismo Decreto ley 3573 de 2011, atribuyó a \nesta Autoridad Nacional, entre otras, la función de otorgar o negar las licencias, \npermisos y trámites ambientales de competencia del Ministerio de Ambiente y \nDesarrollo Sostenible, de conformidad con la ley y los reglamentos.\nQue por medio del Decreto 1076 de 2015, se señaló, en su artículo 1.1.2.2.1, que \nla Autoridad Nacional de Licencias Ambientales – ANLA – es la encargada de que \nlos proyectos, obras o actividades sujetos de licenciamiento, permiso o trámite \nambiental cumplan con la normativa ambiental, de tal manera que contribuyan al \ndesarrollo sostenible ambiental del País. \n\nResolución No. 002195       Del 04 OCT. 2024          Hoja No. 7 de 34\n“Por el cual se resuelve recurso de reposición contra la Resolución 1178 del 18 de junio de \n2024”\nPágina 7 de 34\nQue mediante el Decreto 376 de 2020 “Por el cual se modifica la estructura de la \nAutoridad Nacional de Licencias Ambientales – ANLA”, se le confirió al Despacho \nde la Dirección General, entre otras funciones, la de suscribir los actos \nadministrativos que otorgan, niegan, modifican, ajustan o declaran la terminación de \nlas licencias, permisos y trámites ambientales.\nQue por medio de la Resolución 1957 del 05 de noviembre de 2021, “Por la cual se \nadopta el Manual Específico de Funciones y de Competencias Laborales para los \nempleos de la planta de personal de la Autoridad Nacional de Licencias Ambientales \n– ANLA”, se subraya la responsabilidad del Director General de la Autoridad \nNacional de Licencias Ambientales, la suscripción de los actos administrativos que \notorgan, niegan, modifican, ajustan o declaran la terminación de las licencias, \npermisos y trámites ambientales.\nFUNDAMENTOS CONSTITUCIONALES Y LEGALES\nQue el procedimiento para la presentación y decisión de recursos contra los actos \nadministrativos se encuentra reglado en el Código de Procedimiento Administrativo \ny de lo Contencioso Administrativo - Ley 1437 de 2011 -, en los artículos 74 y \nsiguientes, que señalan:\n“Artículo 74. Recursos contra los actos administrativos. – Por regla general, \ncontra los actos definitivos procederán los siguientes recursos:\n1. El de reposición, ante quien expidió la decisión para que la aclare, modifique, \nadicione o revoque.”\nQue con respecto a la oportunidad y presentación del recurso de reposición, el \nartículo 76 del mismo Código, señala:\n“Artículo 76. Los recursos de reposición y apelación deberán interponerse por \nescrito en la diligencia de notificación personal, o dentro de los diez (10) días \nsiguientes a ella, o a la notificación por aviso, o al vencimiento del término de \npublicación, según el caso. Los recursos contra los actos presuntos podrán \ninterponerse en cualquier tiempo, salvo en el evento en que se haya acudido ante \nel juez.\nLos recursos se presentarán ante el funcionario que dictó la decisión (…)”\nQue para el ejercicio de los recursos, el artículo 77 del precitado Código, fija los \nrequisitos formales que deben cumplir para su interposición, así:\n“Artículo 77. Por regla general los recursos se interpondrán por escrito que no \nrequiere de presentación personal si quien lo presenta ha sido reconocido en la \nactuación. Igualmente, podrán presentarse por medios electrónicos.\n\nResolución No. 002195       Del 04 OCT. 2024          Hoja No. 8 de 34\n“Por el cual se resuelve recurso de reposición contra la Resolución 1178 del 18 de junio de \n2024”\nPágina 8 de 34\nLos recursos deberán reunir, además, los siguientes requisitos:\n1.Interponerse dentro del plazo legal, por el interesado o su representante o \napoderado debidamente constituido.\n2.Sustentarse con expresión concreta de los motivos de inconformidad.\n3.Solicitar y aportar las pruebas que se pretende hacer valer.\n4.Indicar el nombre y la dirección del recurrente, así como la dirección electrónica si \ndesea ser notificado por este medio.\nSólo los abogados en ejercicio podrán ser apoderados. Si el recurrente obra como \nagente oficioso, deberá acreditar la calidad de abogado en ejercicio, y prestar la \ncaución que se le señale para garantizar que la persona por quien obra ratificará su \nactuación dentro del término de dos (2) meses.\nSi no hay ratificación se hará efectiva la caución y se archivará el expediente. Para \nel trámite del recurso el recurrente no está en la obligación de pagar la suma que el \nacto recurrido le exija. Con todo, podrá pagar lo que reconoce deber”.\nQue atendiendo a lo descrito con relación a los requisitos y condiciones que deben \nobservarse al interponer el recurso de reposición, en el presente caso, se puede \nconcluir lo siguiente:\n1. El recurso se interpuso por escrito ante la Autoridad Nacional de Licencias \nAmbientales, por lo que se cumple este requisito.\n2. En cuanto a la oportunidad legal para interponer el recurso de reposición, se \ntiene que la notificación de la Resolución 1178 del 18 de junio de 2024 a la \nsociedad Ecopetrol S.A. - hoy recurrente -, se realizó por medio de correo \nelectrónico el 19 de junio de 2024 y quedó surtida el día hábil siguiente; \natendiendo a los diez (10) días hábiles, que concede la Ley 1431 de 2011 para \ninterponer el recurso, contados a partir del día siguiente de la notificación, fue \npresentado el día 3 de julio de 2024, encontrándose dentro del término \nlegalmente establecido para tal fin. Por lo tanto, se concluye que el mismo fue \npresentado dentro de la oportunidad legal.\n3. En el escrito del recurso, la sociedad Ecopetrol S.A., expone de manera \nconcreta, los motivos de inconformidad frente a la Resolución 1178 del 18 de \njunio de 2024. En esa medida, este requisito se cumple.\n4. Asimismo, es interpuesto por el apoderado general de la sociedad Ecopetrol \nS.A., y de conformidad con el certificado de existencia y representación legal de \nla cámara de comercio de Bogotá Sede Virtual de fecha 01 de diciembre de \n2023, se verificó que por Escritura Publica No. 43 del 13 de enero de 2020 de la \nNotaria 34 de Bogotá D.C., inscrita el 17 de enero de 2020 bajo el No. 00042933 \ndel Libro V, se faculta para recurrir la Resolución 1178 del 18 de junio de 2024. \nEn esa medida, se encuentra legitimado para interponer el recurso.\n\nResolución No. 002195       Del 04 OCT. 2024          Hoja No. 9 de 34\n“Por el cual se resuelve recurso de reposición contra la Resolución 1178 del 18 de junio de \n2024”\nPágina 9 de 34\n5. Por último, la dirección de notificaciones del recurrente se encuentra \ndebidamente registrada y es inequívoca su individualización, por lo tanto, se \ntiene por cumplido este requisito.\nQue al verificarse el cumplimiento de los requisitos legales establecidos en la \nnormativa vigente para la admisibilidad del recurso de reposición, se procederá al \nanálisis de fondo de los motivos de inconformidad del recurrente, tal y como se \nexpone a continuación.\nCONSIDERACIONES \nTÉCNICAS \nDE \nLA \nAUTORIDAD \nNACIONAL \nDE \nLICENCIAS AMBIENTALES FRENTE AL RECURSO DE REPOSICIÓN \nINTERPUESTO POR LA SOCIEDAD ECOPETROL S.A.    \nQue esta Autoridad, analizó los argumentos expuestos por el recurrente en su \nescrito de recurso para dar respuesta y adoptar decisión de fondo frente al \npronunciamiento emitido con la Resolución 1178 del 18 de junio de 2024, previo \nanálisis de los motivos de inconformidad argumentados por la sociedad Ecopetrol \nS.A. \nQue se procede a atender el recurso interpuesto, de conformidad a lo recurrido por \nla titular del instrumento de manejo y control ambiental, para lo cual se indicará: A. \nLa disposición recurrida, B. La petición y los motivos de inconformidad expuestos \npor la titular de la Licencia Ambiental y C. las consideraciones de la Autoridad \nNacional de Licencias Ambientales con relación a las disposiciones recurridas. \nA. DISPOSICIÓN RECURRIDA -– Artículo Primero de la Resolución 001178 del 18 \nde junio del 2024\n“(…)\nARTÍCULO PRIMERO. Ajustar vía seguimiento el artículo noveno de la Resolución \n2475 del 18 de diciembre de 2019, que modificó los numerales 1 y 3 del Artículo \nSéptimo de la Resolución 1717 del 30 de agosto de 2019, en el sentido de establecer \nla nomenclatura o codificación de los seis (6) puntos de vertimiento autorizados para \nel proyecto las cuales se encuentran localizados sobre el Caño Rubiales, con sus \nrespectivas coordenadas de ubicación, a partir de identificadores únicos asignados \npor el Centro de Monitoreo de la Autoridad de Licencias Ambientales, así:”\nNomenclatura o Codificación de los puntos de vertimiento Caño Rubiales.\nCoordenadas Planas \nMagna Sirgas Origen \nNacional\nCoordenadas Planas \nMagna SIRGAS Origen \nEste\nID Punto De \nvertimiento\nEste\nNorte\nEste\nNorte\nID ANLA\nPunto de Vertimiento \nV1\n5173686,88\n1979597,87\n960264,08\n913503,72 VER-LAM0019-0001\n\nResolución No. 002195       Del 04 OCT. 2024          Hoja No. 10 de 34\n“Por el cual se resuelve recurso de reposición contra la Resolución 1178 del 18 de junio de \n2024”\nPágina 10 de 34\nPunto de Vertimiento \nV2\n5173902,50\n1979546,67\n960479,68\n913452,02 VER-LAM0019-0002\nPunto de Vertimiento \nV3\n5175730,62\n1979433,55\n962308,35\n913334,76 VER-LAM0019-0003\nPunto de Vertimiento \nV4\n5175940,53\n1979612,02\n962518,75\n913512,84 VER-LAM0019-0004\nPunto de Vertimiento \nV5\n5176406,21\n1979112,18\n962983,51\n913011,75 VER-LAM0019-0005\nPunto de Vertimiento \nV6\n5174833,40\n1979151,87\n961394,64\n913034,76 VER-LAM0019-0006\nGrupo de regionalización Centro de monitoreo - ANLA\n(…)”\nB. PETICIÓN Y MOTIVOS DE INCONFORMIDAD DEL TITULAR  \nRespecto a esta Disposición la sociedad solicita:\n“(…)\nModificar y/o aclarar que, las coordenadas en la tabla con nombre “Nomenclatura o \nCodificación de los puntos de vertimiento Caño Rubiales” para el punto de vertimiento \nV6, conforme a lo que se encuentra establecido en la Resolución 1717 de artículo \nséptimo numeral 1 de la Resolución 1717 de 2019, con su respectiva conversión a \norigen único nacional, correspondiente al punto real del vertimiento autorizado V6.\nAdicional con lo anterior, se solicita respetuosamente a la Autoridad Ambiental que, \ncon el fin de estandarizar la precisión de las coordenadas, se manejen 3 decimales en \nlas coordenadas establecidas en la tabla “Nomenclatura o Codificación de los puntos \nde vertimiento Caño Rubiales”, tal como se encuentra en las demás tablas de la \nresolución 001178 del 18 de junio de 2024.\n(…)”\nMotivos de inconformidad\n“(…)\nRespecto de la tabla con nombre “Nomenclatura o Codificación de los puntos de \nvertimiento Caño Rubiales” se aprecia que el Punto de vertimiento V6, con ID ANLA \nVER-LAM0019-0006 presenta una coordenada diferente a la coordenada establecida \nen la resolución 1717 de 2019, generando una desviación frente a lo que corresponde \nrealmente en campo tal como se detalla en la siguiente figura.\n\nResolución No. 002195       Del 04 OCT. 2024          Hoja No. 11 de 34\n“Por el cual se resuelve recurso de reposición contra la Resolución 1178 del 18 de junio de \n2024”\nPágina 11 de 34\nAsí las cosas, las coordenadas que coinciden con la ubicación real del punto de \nvertimiento 6, corresponden a las establecidas en el artículo séptimo numeral 1 de la \nresolución 1717 de 2019, la cual corresponde a las siguientes:\nEs de pesarse que, la diferencia se encuentra en la conversión de coordenadas que la \nAutoridad Ambiental realizó para el vertimiento V6 al pasar de Planas Magna Sirgas \nOrigen este a Origen Nacional.\n(…)”\nC. CONSIDERACIONES DE LA AUTORIDAD NACIONAL DE LICENCIAS \nAMBIENTALES RESPECTO A LOS ARGUMENTOS EXPUESTOS\nRespecto al Artículo primero de la Resolución 1178 del 18 de junio de 2024 que ajusta el \nartículo noveno de la Resolución 2475 del 18 de diciembre de 2019, que modificó los \nnumerales 1 y 3 del Artículo Séptimo de la Resolución 1717 del 30 de agosto de 2019, \nrelacionado con las coordenadas y la Nomenclatura o Codificación de los puntos de \nvertimiento de Caño Rubiales, esta Autoridad Nacional realizó la verificación de dichas \ncoordenadas, encontrando lo siguiente:\nResolución 1717 de 2019 \nArt Séptimo Numeral 1\nResolución 1178 de 2024 Art Primero \nPunto de \nvertimiento\nCoordenadas Punto De \nVertimiento; Datum \nCoordenadas Planas \nMagna Sirgas Origen \nCoordenadas Planas \nMagna SIRGAS \n\nResolución No. 002195       Del 04 OCT. 2024          Hoja No. 12 de 34\n“Por el cual se resuelve recurso de reposición contra la Resolución 1178 del 18 de junio de \n2024”\nPágina 12 de 34\nMagna Sirgas Origen \nEste\nNacional\nOrigen Este\nESTE\nNORTE\nESTE\nNORTE\nESTE\nNORTE\n6\n961394,64\n913034,76\n5174833,40\n1979151,87\n961394,64\n913034,76\nEn ese sentido, se observa que en el artículo primero de la Resolución 1178 de 2024, se \nincluyeron las coordenadas planas magna sirgas en origen este, tal como se indicó en el \nnumeral 1 artículo séptimo de la resolución 1717 de 2019, adicionalmente y teniendo en \ncuenta la normatividad legal vigente a través de la resolución 0370 de 16 de junio de 2021 \nque estableció el sistema de proyección cartográfica oficial para Colombia, se procedió a \nrealizar la trasformación del origen de la coordenadas, en las cuales se evidencia que \nefectivamente y de acuerdo con lo señalado por  la sociedad existe una diferencia de 25.9 \nmetros entre las coordenadas.\nFuente: Ágil ANLA -06/08/2024\nPor lo anterior, esta Autoridad comparte el argumento de la sociedad en donde señala “(…) \nla diferencia se encuentra en la conversión de coordenadas que la Autoridad Ambiental \nrealizó para el vertimiento V6 al pasar de Planas Magna Sirgas Origen este a Origen \nNacional”.\nPor tal razón, se considera pertinente modificar la coordenada Planas Magna Sirgas Origen \nNacional en el sentido de ajustar Este y Norte del punto de vertimiento 6 de la tabla \ndenominada Nomenclatura o Codificación de los puntos de vertimiento Caño Rubiales.\nFrente a la solicitud adicional de la sociedad respecto al contenido de la tabla del artículo \nprimero de la Resolución 1178 de 2024, consistente en: “con el fin de estandarizar la \nprecisión de las coordenadas, se manejen 3 decimales en las coordenadas establecidas en \nla tabla “Nomenclatura o Codificación de los puntos de vertimiento Caño Rubiales”, tal como \nse encuentra en las demás tablas de la Resolución 001178 del 18 de junio de 2024.” esta \nAutoridad considera válido realizar dicha precisión toda vez que permitirá tener una \n\nResolución No. 002195       Del 04 OCT. 2024          Hoja No. 13 de 34\n“Por el cual se resuelve recurso de reposición contra la Resolución 1178 del 18 de junio de \n2024”\nPágina 13 de 34\ncoordenada inequívoca para cada punto de vertimiento evitando desplazamiento del \nmismo. \nAsí las cosas, se acepta la petición de aclaración presentada por la sociedad ECOPETROL \nS.A, y en consecuencia se accede a reponer en el sentido de incluir tres decimales en las \ncoordenadas este y norte de la columna Coordenadas Planas Magna Sirgas Origen \nNacional de la tabla Nomenclatura o Codificación de los puntos de vertimiento Caño \nRubiales.\nEn conclusión, esta Autoridad Nacional considera viable reponer y en consecuencia \nmodificar la Tabla del Artículo primero, denominada “Nomenclatura o Codificación de los \npuntos de vertimiento Caño Rubiales” de la Resolución 1178 del 18 de junio de 2024 en el \nsentido de ajustar las coordenadas planas del punto de vertimiento 6, así como incluir la \nprecisión de las coordenadas origen único nacional con tres (3) decimales.\nA-DISPOSICIÓN RECURRIDA- Artículo Segundo Literal b subnumeral iii \nResolución 001178 del 18 de junio de 2024. \n“(…)\nARTÍCULO SEGUNDO. Ajustar vía seguimiento el artículo vigésimo cuarto numeral 1 \nliteral c de la Resolución 1717 del 30 de agosto de 2019 y la Ficha 8.1.1 Seguimiento \na las aguas residuales y corrientes receptoras y aguas superficiales, en el sentido de \nestandarizar y codificar los muestreos de los vertimientos los cuales se reportarán de \nla siguiente manera: \n(…)\nb. Condiciones de Modo y Tiempo: Realizar los monitoreos de calidad de agua de \nparámetros fisicoquímicos bajo las siguientes condiciones:\n(…)\niii. Efectuar las mediciones de los siguientes parámetros según el caso: En la siguiente \ntabla se detallan los parámetros objeto de monitoreo con las respectivas \nespecificaciones de monitoreo:\nPERIODICIDAD\n(Frecuencia de \nmonitoreo)\nVENTANA DE MONITOREO \n(Meses)\nMEDIO \nENTREGA\nFRECUENCIA \nENTREGA\nMensual\nEntre abril y Diciembre\nPortal de \nRecepción\nPlantilla Tipo\nMensual\n(…)”\nB. PETICIÓN Y MOTIVOS DE INCONFORMIDAD DEL TITULAR  \nRespecto a esta disposición, la sociedad ECOPETROL S.A, solicita:\n“(…)\nAclarar este requerimiento en relación de indicar que parámetros se deben continuar \nevaluando a los puntos de vertimiento o si se deben continuar con los parámetros que \n\nResolución No. 002195       Del 04 OCT. 2024          Hoja No. 14 de 34\n“Por el cual se resuelve recurso de reposición contra la Resolución 1178 del 18 de junio de \n2024”\nPágina 14 de 34\nse desarrollan actualmente de forma mensual a cada uno de los puntos de vertimiento \nconforme a lo establecido en la resolución 1717 del 30 de agosto 2019.\n(…)”\nMotivos de inconformidad\n“(…)\nEn el literal b ítem iii, del artículo segundo de la resolución 001178 del 18 de junio de \n2024, la Autoridad Ambiental solicitó a Ecopetrol S.A efectuar la medición de unos \nparámetros, no obstante al revisar la tabla en la misma no se especifican los \nparámetros que requiere se continúen evaluando, dado que la tabla solo indica \nPeriodicidad, Ventana de monitoreo, Medio de entrega y frecuencia de entrega, no \nobstante la tabla en mención no detalla los parámetros que se deben continuar \nevaluando mensualmente. Frente a la duda anterior, la obligación para Ecopetrol no \nresultaría clara y expresa, en atención a que, no se conocerían los parámetros o lo \nlímites máximos permisibles que debería monitorear.\n(…)”\nC. CONSIDERACIONES DE LA AUTORIDAD NACIONAL DE LICENCIAS \nAMBIENTALES  \nRespecto al subnumeral iii del literal b del artículo segundo de la resolución 1178 del 18 de \njunio de 2024 que ajusta el artículo vigésimo cuarto numeral 1 literal c de la Resolución \n1717 del 30 de agosto de 2019 y la Ficha 8.1.1 Seguimiento a las aguas residuales y \ncorrientes receptoras y aguas superficiales, esta Autoridad Nacional realizó la verificación \nde los parámetros que deben ser reportados encontrando que corresponden a los \nestablecidos en la Resolución 1717 del 30 de agosto de 2019, razón por la cual no consideró \nnecesario realizar una aclaración de manera independiente en el artículo segundo de la \nResolución 001178 del 18 de junio de 2024. \nNo obstante, teniendo en cuenta lo indicado por la sociedad “la obligación para Ecopetrol \nno resultaría clara y expresa, en atención a que, no se conocerían los parámetros o lo \nlímites máximos permisibles que debería monitorear”.\nEn este sentido, y una vez revisados los argumentos de la sociedad se considera pertinente \naclarar que los parámetros a monitorear corresponden a los establecidos en la resolución \n1717 del 30 de agosto de 2019, adicionalmente, se aclara a Ecopetrol S.A que debe \ncontinuar tal como lo viene haciendo con el monitoreo y reporte de los parámetros que se \ndesarrollan actualmente de forma mensual a cada uno de los puntos de vertimiento \nconforme a lo establecido en la Resolución 1717 del 30 de agosto 2019. \nDe acuerdo con lo anterior, se considera pertinente, reponer y en consecuencia adicionar \nen la Tabla del ARTÍCULO SEGUNDO literal b subnumeral iii, de la Resolución 1178 del 18 \nde junio de 2024 la columna denominada Parámetro así:\n\nResolución No. 002195       Del 04 OCT. 2024          Hoja No. 15 de 34\n“Por el cual se resuelve recurso de reposición contra la Resolución 1178 del 18 de junio de \n2024”\nPágina 15 de 34\nPERIODICIDAD\n(Frecuencia de \nmonitoreo)\nVENTANA DE \nMONITOREO \n(Meses)\nMEDIO \nENTREGA\nFRECUENCIA \nENTREGA\nPARÁMETROS\nMensual\nEntre abril y \nDiciembre\nPortal de \nRecepción\nPlantilla Tipo\nMensual\nSegún lo establecido en la \nresolución 1717 del 30 de \nagosto 2019\nPor otra parte y teniendo en cuenta que en el presente recurso de reposición se accede a \nla petición de la sociedad de ajustar las coordenadas del punto de Vertimiento 6 establecido \nen el artículo primero de la resolución 1178 del 18 de junio de 2024, se considera necesario \nmodificar las coordenadas de la tabla del literal a, -condición de lugar- del artículo segundo \nde la misma resolución, únicamente en relación con el punto de vertimiento 6, con el fin de \nguardar una coherencia en la ubicación y precisión de los puntos de monitoreo. \nA. DISPOSICIÓN RECURRIDA - Artículo Tercero Resolución 001178 del 18 de \njunio de 2024 \n“(…)\n“ARTÍCULO TERCERO. Ajustar vía seguimiento el artículo décimo sexto, de la \nResolución 2475 del 18 de diciembre de 2019, que a su vez modifica del medio abiótico \nnumeral 1 Ficha 8.1.1 Seguimiento a las aguas residuales, corrientes receptoras y \naguas superficiales, literal b Artículo vigésimo cuarto de la Resolución 01717 del 30 de \nagosto de 2019, en el sentido de asignar los identificadores únicos de esta Autoridad \ndeterminados por el Centro de monitoreo del estado de los recursos ANLA, cómo se \nmuestra a continuación:\nCodificación estaciones automáticas de monitoreo y aforos sobre caño Rubiales\nCoordenadas Planas Magna \nSirgas Origen Nacional\nID ECOPETROL\nID\nID ANLA\nEste\nNorte\nEstación V0\nE0\nMSP-LAM0019-0001\n5173716,579\n1979695,336\nEstación V1\nE1\nMSP-LAM0019-0002\n5173757,743\n1979552,087\nEstación V2\nE2\nMSP-LAM0019-0003\n5173975,982\n1979634,993\nEstación V3\nE3\nMSP-LAM0019-0004\n5175804,439\n1979570,292\nEstación V4\nE4\nMSP-LAM0019-0005\n5176025,721\n1979682,135\nEstación V5\nE5\nMSP-LAM0019-0006\n5176506,914\n1979105,453\nEstación V6\nE6\nMSP-LAM0019-0007\n5174896,886\n1979206,819\nAforo aguas abajo de E0\nAforo_0\nMSP-LAM0019-0008\n5173718,44\n1979686,08\nAforo aguas abajo de E2\nAforo_1\nMSP-LAM0019-0009\n5173967,04\n1979649,96\nAforo aguas abajo de E3\nAforo_2\nMSP-LAM0019-0010\n5175791,71\n1979517,91\nAforo aguas abajo de E4\nAforo_3\nMSP-LAM0019-0011\n5176028,27\n1979661,04\nAforo aguas abajo de E5\nAforo_4\nMSP-LAM0019-0012\n5176524,15\n1979109,74\nAforo aguas abajo de E1\nAforo_5\nMSP-LAM0019-0013\n5000000,00\n2000000,00\nAforo aguas abajo de E6\nAforo_6\nMSP-LAM0019-0014\n5174903,49\n1979214,82\nGrupo de regionalización Centro de monitoreo - ANLA\n(…)”\nB. PETICIÓN Y MOTIVOS DE INCONFORMIDAD DEL TITULAR  \n\nResolución No. 002195       Del 04 OCT. 2024          Hoja No. 16 de 34\n“Por el cual se resuelve recurso de reposición contra la Resolución 1178 del 18 de junio de \n2024”\nPágina 16 de 34\nRespecto a esta disposición, la sociedad solicita:\n“(…)\na) Modificar en el sentido de ajustar, las coordenadas en la tabla con nombre \n“Codificación estaciones automáticas de monitoreo y aforos sobre caño Rubiales” \npara las estaciones: Estación V3, Estación V4 y Estación V5, de acuerdo con \nlas consideraciones expuestas.\nb) Modificar en el sentido de retirar, los puntos de la tabla con nombre “Codificación \nestaciones automáticas de monitoreo y aforos sobre caño Rubiales” para los \npuntos con ID: Aforo_2, Aforo_3, Aforo_4, Aforo_5 y Aforo_6.\n(…)”\nMotivos de inconformidad\n“(…)\nRespecto a la tabla con nombre “Codificación estaciones automáticas de monitoreo y \naforos sobre caño Rubiales” se presentan dudas frente a la ubicación de la bomba \nperistáltica encargada de succionar el agua del Caño Rubiales la cual descargará la \ncuba donde se tomarán los parámetros en línea.\nA continuación, se presentan las coordenadas que presentan desviaciones, empleando \npara ello el Ortomosaico para el tramo de caño Rubiales que levanto Ecopetrol S.A \neste año, en respuesta de una obligación de la autoridad Ambiental asociado a la \nidentificación de procesos erosivos sobre el caño Rubiales. Por lo cual, estas imágenes \npermiten identificar con alta precisión la ubicación de cada una de las infraestructuras \nque succionan el agua del caño Rubiales para el análisis en las cubas donde se realiza \nel análisis de forma automática.\n\nResolución No. 002195       Del 04 OCT. 2024          Hoja No. 17 de 34\n“Por el cual se resuelve recurso de reposición contra la Resolución 1178 del 18 de junio de \n2024”\nPágina 17 de 34\nTal como se aprecia en la figura 2, la localización de la estación V3, daría 54 metros \nabajo de donde se encuentra el sistema que succiona el agua del caño hacia la cuba \nque realiza el análisis automático. Así las cosas, las coordenadas que coinciden con la \nubicación real de la estación V3 son las siguientes:\n\nResolución No. 002195       Del 04 OCT. 2024          Hoja No. 18 de 34\n“Por el cual se resuelve recurso de reposición contra la Resolución 1178 del 18 de junio de \n2024”\nPágina 18 de 34\nTal como se aprecia en la figura 3, la localización de la estación V4, daría metros abajo \nde donde se encuentra el sistema que succiona el agua del caño hacia la cuba que \nrealiza el análisis automático. Así las cosas, las coordenadas que coinciden con la \nubicación real de la estación V4 son las siguientes:\n\nResolución No. 002195       Del 04 OCT. 2024          Hoja No. 19 de 34\n“Por el cual se resuelve recurso de reposición contra la Resolución 1178 del 18 de junio de \n2024”\nPágina 19 de 34\nTal como se aprecia en la figura 4, la localización de la estación V4, daría a más de 18 \nmetros de donde realmente se encuentra el sistema que succiona el agua del caño \nhacia la cuba que realiza el análisis automático. Así las cosas, las coordenadas que \ncoinciden con la ubicación real de la estación V5 son las siguientes:\n\nResolución No. 002195       Del 04 OCT. 2024          Hoja No. 20 de 34\n“Por el cual se resuelve recurso de reposición contra la Resolución 1178 del 18 de junio de \n2024”\nPágina 20 de 34\nPuntos Aforo con ID Aforo_2, Aforo_3, Aforo_4, Aforo_5 y Aforo_6\nEn la tabla con nombre “Codificación estaciones automáticas de monitoreo y aforos \nsobre caño Rubiales”, la Autoridad Ambiental indica incluir unos puntos de aforo sobre \ncaño Rubiales, identificados con ID: Aforo_2, Aforo_3, Aforo_4, Aforo_5 y Aforo_6, \ntal como se resumen en la siguiente tabla.\nNo obstante, es importante aclarar, tal como se presenta de verificar la data de \nestaciones Automáticas, considerando condiciones climáticas y otras que pueden \nafectar el aforo, son las de los puntos Aguas abajo de la E0 con ID Aforo_0 y aguas \nabajo de E2 con ID Aforo_1. Los demás puntos con ID: Aforo_2, Aforo_3, Aforo_4, \nAforo_5 y Aforo_6, no son objeto de medición tal como puede ser verificado en el \nhistórico de reportes diarios de las vigencias 2023 y 2024. La verificación de estos \naforos se realiza como una medida de control y seria improcedente tener personal de \nlaboratorio para aforo diarios en los 7 puntos, por temas de distancias, logística y \nrecursos, además con la verificación de estos 2 puntos es una referencia suficiente \npara el seguimiento de los caudales en el caño.\n(…)”\nC. CONSIDERACIONES DE LA AUTORIDAD NACIONAL DE LICENCIAS \nAMBIENTALES \nCon respecto a los argumentos expuestos por la sociedad, esta Autoridad tiene las \nsiguientes consideraciones: \nRespecto al artículo tercero de la Resolución 1178 del 18 de junio de 2024 que ajusta el \nartículo décimo sexto, de la Resolución 2475 del 18 de diciembre de 2019, que a su vez \nmodifica del medio abiótico numeral 1 Ficha 8.1.1 Seguimiento a las aguas residuales, \ncorrientes receptoras y aguas superficiales, literal b artículo vigésimo cuarto de la \nResolución 01717 del 30 de agosto de 2019 esta Autoridad considera lo siguiente:\nLiteral a\nRevisadas las coordenadas de las estaciones automáticas consignadas en el concepto \ntécnico 4434 de 24 de julio de 2023, (acogido en la resolución 1178 del junio de 2024), se \n\nResolución No. 002195       Del 04 OCT. 2024          Hoja No. 21 de 34\n“Por el cual se resuelve recurso de reposición contra la Resolución 1178 del 18 de junio de \n2024”\nPágina 21 de 34\nindicó en la FICHA SMA-1 Monitoreo de Aguas residuales y corrientes receptoras que las \ncoordenadas relacionadas en el Artículo Tercero de la Resolución 1178 del 18 de julio de \n2024, corresponden a las obtenidas por el equipo de seguimiento en la visita de campo \nrealizada entre el 29 de mayo y 2 de junio de 2023, precisando que fueron tomadas desde \ntierra debido a que la coordenada exacta requería equipos especiales para ingresar \ndirectamente al caño Rubiales.\n“(…)\n\nResolución No. 002195       Del 04 OCT. 2024          Hoja No. 22 de 34\n“Por el cual se resuelve recurso de reposición contra la Resolución 1178 del 18 de junio de \n2024”\nPágina 22 de 34\nEn consecuencia, de lo anterior y dados los impedimentos para ingresar al Caño Rubiales \npunto exacto donde se encuentran ubicadas las estaciones automáticas, esta Autoridad \nestableció como punto de localización las coordenadas tomadas desde tierra en la visita.\nEn ese sentido, y dado que la sociedad cuenta con información de coordenadas tomadas \nsobre la infraestructura puntual de cada una de las estaciones automáticas ubicadas al \ninterior del caño Rubiales, específicamente, la bomba peristáltica encargada de succionar \nel agua del Caño Rubiales, desde el punto de vista técnico y con el fin de tener una \nubicación precisa y exacta de la infraestructura que hace parte de las estaciones \nautomáticas de los vertimientos, se acepta la aclaración presentada por la sociedad y en \nconsecuencia se considera viable ajustar las coordenadas de las estaciones automáticas \nde los puntos identificados como Estación V3, V4 y V5.\nPor lo anterior, se procederá a acoger la recomendación técnica y en consecuencia se \nmodificará la tabla del artículo tercero, de la Resolución 1178 del 18 de junio de 2024, en el \nsentido de ajustar las coordenadas de las estaciones citadas.\nLiteral b\nFrente a la solicitud de “modificar en el sentido de retirar, los puntos de la tabla con \nnombre “Codificación estaciones automáticas de monitoreo y aforos sobre caño Rubiales” \npara los puntos con ID: Aforo_2, Aforo_3, Aforo_4, Aforo_5 y Aforo_6. \n\nResolución No. 002195       Del 04 OCT. 2024          Hoja No. 23 de 34\n“Por el cual se resuelve recurso de reposición contra la Resolución 1178 del 18 de junio de \n2024”\nPágina 23 de 34\nSe considera pertinente indicar que la sociedad Ecopetrol S.A., de manera voluntaria y sin \nexistir una obligación establecida en un acto administrativo, relacionada con los puntos de \naforo de las estaciones automáticas, viene entregando al centro de monitoreo de esta \nAutoridad Nacional, caudales aforados por un laboratorio certificado para calibrar el caudal \nde las estaciones automáticas sobre el Caño Rubiales en diferentes puntos denominados \nID: Aforo_2, Aforo_3, Aforo_4, Aforo_5 y Aforo_6. \nEs por lo que, a través de los diferentes seguimientos que se realizan al proyecto se revisan \ny analizan estos resultados, en consecuencia y con el fin de facilitar el procesamiento de \nlos datos y la verificación de los resultados, se estableció a través del Artículo Tercero de \nla Resolución 1178 del 18 de junio de 2024 una codificación a los aforos de las estaciones \nautomáticas sobre el Caño Rubiales. Los cuales tienen como objetivo que cada vez que la \nsociedad reporte esta información al centro de monitoreo la realice a partir de un código, \nsin que ello implique la imposición de nuevos puntos de monitoreo, por lo tanto, se señala \nque la Autoridad no busca establecer condiciones de tiempo y lugar, sino que por el \ncontrario la medida tiene como finalidad estandarizar la codificación de los aforos sin alterar \no modificar la frecuencia con la que lo vienen haciendo.\nAhora bien, frente al argumento de la sociedad en el cual señala “(…) Los demás puntos \ncon ID: Aforo_2, Aforo_3, Aforo_4, Aforo_5 y Aforo_6, no son objeto de medición tal como \npuede ser verificado en el histórico de reportes diarios de las vigencias 2023 y 2024. La \nverificación de estos aforos se realiza como una medida de control y sería improcedente \ntener personal de laboratorio para aforo diarios en los 7 puntos, por temas de distancias, \nlogística y recursos, además con la verificación de estos 2 puntos es una referencia \nsuficiente para el seguimiento de los caudales en el caño. (…)”\nAl respecto, y una vez verificados los diferentes actos administrativos se evidenció que el \nproyecto cuenta con una obligación relacionada con la presentación de los caudales con \nescala mínima horaria, la cual es reportada en los diferentes Informes de Cumplimiento \nAmbiental ICA.  FICHA: 8.1.1 – Seguimiento a las aguas residuales, corrientes receptoras \ny aguas superficiales; en concordancia con el literal c numeral 1 del Artículo Vigésimo \nCuarto de la Resolución 1717 del 30 de agosto de 2019 que establece: \nRealizar el monitoreo de las variables de calidad de agua que pueden ser obtenidas \nmediante sensores (pH, conductividad, turbidez, temperatura, iones de amonio, nitrato, \ncloruro, oxígeno disuelto, % de saturación o concentración, TDS (Sólidos Totales \nDisueltos), salinidad y caudales, a escala mínima de horario. (Negrita, cursiva fuera de \ntexto).\nEn ese sentido, no se hace necesario codificar nuevos puntos, aclarando a la sociedad que \ndeberá continuar reportando la información en cumplimiento del literal c numeral 1 del \nArtículo Vigésimo Cuarto de la Resolución 1717 del 30 de agosto de 2019 así como en la \nFICHA: 8.1.1 – Seguimiento a las aguas residuales, corrientes receptoras y aguas \nsuperficiales.\nQue la anterior consideración técnica, será acogida en la parte resolutiva del presente acto \nadministrativo y como consecuencia se modificará la tabla aludida en el sentido de retirar \nla codificación de los puntos denominados: Aforo aguas abajo de E3, (Aforo_2), Aforo aguas \n\nResolución No. 002195       Del 04 OCT. 2024          Hoja No. 24 de 34\n“Por el cual se resuelve recurso de reposición contra la Resolución 1178 del 18 de junio de \n2024”\nPágina 24 de 34\nabajo de E4 (Aforo_3), Aforo aguas abajo de E5 (Aforo_4), Aforo aguas abajo de E1 \n(Aforo_5) Aforo aguas abajo de E6 (Aforo_6), de la tabla del artículo tercero de la \nResolución 1178 del 18 de junio de 2024.\nA. DISPOSICIÓN RECURRIDA- Artículo Cuarto Numeral 1 Resolución 001178 del \n18 de junio de 2024\n“(…)\n“ARTÍCULO CUARTO. Se ajusta vía seguimiento el artículo primero, de la Resolución \n1076 del 17 de junio de 2019 el cual quedará de la siguiente manera:” \n1. Condición de lugar: los puntos de monitoreo para el área de estudio deberán adoptar \npara el reporte de resultados los ID_ANLA relacionados, como se indica en la siguiente \ntabla:\nID del \nusuario\n(código EIA)\nID ANLA\nNombre Fuente \n(Tipo y \nnombre)\nCoordena\nda Este \nOrigen \nÚnico \nNacional\nCoordena\nda Norte \nOrigen \nÚnico \nNacional\nEstrategia de \nmonitoreo \nasociada\nREH-004\nMSP-LAM0019-\n0020\nCaño Rubiales\n5171311,0\n0\n1981061,0\n0\nTillavá - Recurso \nHídrico \nSuperficial\nREH-008\nMSP-LAM0019-\n0021\nCaño Rubiales\n5176623,5\n49\n1979127,2\n40\nTillavá - Recurso \nHídrico \nSuperficial\nREH-002\nMSP-LAM0019-\n0022\nCaño Rubiales\n5193179,0\n0\n1981807,0\n0\nTillavá - Recurso \nHídrico \nSuperficial\nREH-009\nMSP-LAM0019-\n0023\nCaño \nMasififeriana\n5158707,0\n0\n1975783,0\n0\nTillavá - Recurso \nHídrico \nSuperficial\nREH-010\nMSP-LAM0019-\n0024\nCaño \nMasififeriana\n5171834\n1980581\nTillavá - Recurso \nHídrico \nSuperficial\n(…)”\nB. PETICIÓN Y MOTIVOS DE INCONFORMIDAD DEL TITULAR  \nRespecto a esta disposición, la sociedad solicita:\n(…)”\nModificar en el sentido de aclarar, si las coordenadas en la tabla en mención para el \npunto sobre caño Rubiales con ID REH-008, van a ser ajustadas o si se continúa con \nel punto que se tiene establecido en el artículo segundo de la resolución 1076 de 2019.\n(…)”\nMotivos de inconformidad\n“(…)\n\nResolución No. 002195       Del 04 OCT. 2024          Hoja No. 25 de 34\n“Por el cual se resuelve recurso de reposición contra la Resolución 1178 del 18 de junio de \n2024”\nPágina 25 de 34\nRespecto a la tabla del literal 1(sic)  del artículo cuarto literal 1 (sic) de la resolución \n001178 del 18 de junio de 2024 el punto REH-008 con ID ANLA MSP-LAM0019- 0021, \npresenta una coordenada diferente a la coordenada establecida en el artículo segundo \nde la resolución 1076 del 17 de junio de 2019, presentando una desviación de la \nubicación, frente a lo que se ha venido monitoreando desde que entró en vigor dicha \nresolución, tal como se detalla en la figura 5\n.\nAsí las cosas, si bien ambas coordenadas se encuentran sobre el caño Rubiales, se \nobserva una modificación del punto REH-008 respecto al punto que se venía evaluando \nespecificado en la resolución 1076 de 2019.\nBajo lo anterior es importante solicitar aclaración a la Autoridad Ambiental si la nueva \ncoordenada del ID REH-008 corresponde a una nueva ubicación que requiere ANLA o \nsi corresponde a un error involuntario.\n(…)”\nC. CONSIDERACIONES DE LA AUTORIDAD NACIONAL DE LICENCIAS \nAMBIENTALES \nEn relación con el artículo cuarto de la Resolución 1178 del 18 de junio de 2024 que ajusta \nla Resolución 1076 del 17 de junio de 2019, relacionado con el numeral 1. Condición de \nlugar.\n\nResolución No. 002195       Del 04 OCT. 2024          Hoja No. 26 de 34\n“Por el cual se resuelve recurso de reposición contra la Resolución 1178 del 18 de junio de \n2024”\nPágina 26 de 34\nVerificadas las coordenadas de los puntos de monitoreos sobre el Caño Rubiales, se \nevidenció que efectivamente como lo señala la sociedad en el presente recurso “se observa \nuna modificación del punto REH-008 respecto al punto que se venía evaluando, \nespecificado en la resolución 1076 de 2019”.\nEn ese sentido, al analizar los argumentos de la recurrente se tiene que, en el artículo \nsegundo de la Resolución 1076 de 2019, se estableció la coordenada para el punto \ndenominado REH-008 en Magna Sirgas origen Bogotá, no obstante, al realizar la \ntrasformación del origen de la coordenada al sistema de proyección cartográfica oficial para \nColombia establecido en la resolución 0370 de 16 de junio de 2021 se presentó una \ndesviación de ubicación de la coordenada generando un error en la trascripción de la \ninformación referente a la ubicación del punto denominado REH-008.\nEs importante resaltar que, la inconsistencia evidenciada en las coordenadas de ubicación \nde los puntos que conforman la estrategia de monitoreo de agua superficial solo se asocia \nal punto denominado REH-008 y que las demás coordenadas de los puntos asociados a la \nestrategia, establecidas en el Artículo Cuarto de la Resolución 001178 del 18 de junio de \n2024, sí son correctas.\nQue teniendo en cuenta lo anterior, y con el fin de dar claridad a la ubicación real de la \ncoordenada del punto REH-008, se considera viable reponer y en consecuencia modificar \nla tabla del numeral 1, del artículo cuarto de la Resolución 1178 del 18 de junio de 2024, en \nel sentido de aclarar las coordenadas para el punto sobre el caño Rubiales denominado ID \nREH-008.\nCONSIDERACIONES JURIDICAS\nQue como se indicó en la Resolución objeto de recurso, esta Autoridad Nacional a \ntravés del grupo de regionalización consideró necesario establecer una estrategia \nde monitoreo para la obtención de datos de calidad, en puntos definidos, \nestableciendo parámetros y frecuencias de monitoreo, en todos los proyectos \naledaños a la subzona hidrográfica del Rio Tillavá y particularmente en los seis (6) \npuntos de vertimiento autorizados para el proyecto Explotación de Hidrocarburos en \nel Campo Rubiales los cuales se encuentran localizados sobre el Caño Rubiales, \nesto con el fin de conocer el estado de la calidad y cantidad del agua superficial en \ndicha subzona, como estrategia para la optimización del proceso de evaluación de \nlos impactos acumulativos, actuación administrativa que se llevó a cabo en el año \n2019, mediante la Resolución 2475 del 18 de diciembre de 2019 .\nQue en la presente anualidad, se emitió la Resolución 1178 del 18 de junio de 2024, \nobjeto de recurso, en la cual se expone en su parte considerativa argumentos para \nestablecer una codificación a los puntos de vertimiento autorizados que se \nencuentran localizados sobre el caño Rubiales y de esta manera recibir y contar con \nlos reportes de monitoreos organizados para su verificación en los próximos \nseguimientos.  \n\nResolución No. 002195       Del 04 OCT. 2024          Hoja No. 27 de 34\n“Por el cual se resuelve recurso de reposición contra la Resolución 1178 del 18 de junio de \n2024”\nPágina 27 de 34\nQue en cuanto a la decisión que se adopta en el acto administrativo, y en particular \nen lo relacionado con la estrategia de monitoreo del recurso hídrico superficial, es \npreciso considerar que las medidas tomadas tales como, nomenclatura y \ncodificación de los puntos de vertimiento, estandarización y codificación de los \nmuestreos de los vertimientos, codificación de estaciones automática y aforos sobre \nel caño rubiales, se encuentran soportadas en decisiones técnicas.  \nQue es necesario advertir que, las medidas propuestas por parte de esta autoridad \ncorresponden a las circunstancias encontradas en campo y buscan mitigar, corregir, \no compensar, los impactos evidenciados o prevenir los que pudieran ocurrir; de \nmanera que las decisiones de esta autoridad se presentan como proporcionales \npara el cumplimiento de los fines pretendidos por esta Autoridad.\nQue de acuerdo con lo establecido en el régimen de transición del Decreto 2041 de \n2014, compilado en el Decreto 1076 de 2015, específicamente en el parágrafo 1º \ndel artículo 2.2.2.3.11.1., se señala lo siguiente respecto a las facultades de la \nAutoridad Ambiental encargada del control y seguimiento ambiental de los \nproyectos obras o actividades sujetas a licenciamiento ambiental:\n(…) las autoridades ambientales continuarán realizando las actividades de control y \nseguimiento necesarias, con el objeto de determinar el cumplimiento de las normas \nambientales. De igual forma, podrán realizar ajustes periódicos cuando a ello haya lugar, \nestablecer mediante acto administrativo motivado las medidas de manejo ambiental que se \nconsideren necesarias y/o suprimir las innecesarias (…)\nQue se acogerán las consideraciones técnicas expuestas en el concepto técnico  \n6179 del 23 de agosto de 2024, respecto a las solicitudes plasmadas en el recurso \nde reposición de la sociedad ECOPETROL S.A., y en ese sentido se procederá a \nmodificar la tabla del artículo primero de la Resolución 1178 del 18 de junio de 2024, \najustando las coordenadas del punto de vertimiento 6 del artículo primero de la \nResolución 1178 del 18 de junio de 2024 y como consecuencia de lo anterior, se \nmodificarán las coordenadas del punto de vertimiento 6 del literal a, condición de \nlugar del artículo segundo de la disposición recurrida.\nQue también se considera necesario adicionar la tabla del artículo segundo literal b \nordinal iii en la que se incluye la columna Parámetros; así como modificar la tabla \ndel artículo tercero de la Resolución 1178 del 18 de junio de 2024, retirando la \ncodificación establecida en la Resolución antes referenciada para los puntos \ndenominados ID: Aforo_2, Aforo_3, Aforo_4, Aforo_5 y Aforo_6 y se modifica la \ntabla del artículo cuarto numeral 1 de la disposición recurrida, aclarando las \ncoordenadas para el punto ID REH -008 sobre el caño Rubiales.  \nQue en mérito de lo expuesto,\nRESUELVE:\n\nResolución No. 002195       Del 04 OCT. 2024          Hoja No. 28 de 34\n“Por el cual se resuelve recurso de reposición contra la Resolución 1178 del 18 de junio de \n2024”\nPágina 28 de 34\nARTÍCULO PRIMERO. Reponer y en consecuencia modificar la Tabla del Artículo \nPrimero, denominada “Nomenclatura o Codificación de los puntos de vertimiento \nCaño Rubiales” de la Resolución 1178 del 18 de junio de 2024 en el sentido de \najustar las coordenadas planas del punto de vertimiento 6, así como incluir la \nprecisión de las coordenadas origen único nacional con tres (3) decimales así:\nARTÍCULO PRIMERO. Ajustar vía seguimiento el artículo noveno de la \nResolución 2475 del 18 de diciembre de 2019, que modificó los numerales 1 \ny 3 del Artículo Séptimo de la Resolución 1717 del 30 de agosto de 2019, en \nel sentido de establecer la nomenclatura o codificación de los seis (6) puntos \nde vertimiento autorizados para el proyecto las cuales se encuentran \nlocalizados sobre el Caño Rubiales, con sus respectivas coordenadas de \nubicación, a partir de identificadores únicos asignados por el Centro de \nMonitoreo de la Autoridad de Licencias Ambientales así:\nNomenclatura o Codificación de los puntos de vertimiento Caño Rubiales.\nCoordenadas Planas \nMagna Sirgas Origen \nNacional\nCoordenadas Planas \nMagna SIRGAS \nOrigen Este\nID Punto De \nvertimiento\nEste\nNorte\nEste\nNorte\nID ANLA\nPunto de \nVertimiento V1\n5173686,8791979597,870960264,08 913503,72 VER-LAM0019-\n0001 \nPunto de \nVertimiento V2\n5173902,4981979546,674960479,68 913452,02 VER-LAM0019-\n0002 \nPunto de \nVertimiento V3\n5175730,6201979433,546962308,35 913334,76 VER-LAM0019-\n0003 \nPunto de \nVertimiento V4\n5175940,5311979612,017962518,75 913512,84 VER-LAM0019-\n0004 \nPunto de \nVertimiento V5\n5176406,2061979112,182962983,51 913011,75 VER-LAM0019-\n0005 \nPunto de \nVertimiento V6\n5174817,9811979131,640961394,64 913034,76 VER-LAM0019-\n0006 \nGrupo de regionalización Centro de monitoreo – ANLA\nARTÍCULO SEGUNDO. Reponer y en consecuencia adicionar en la Tabla del \nArtículo Segundo, literal b, ordinal iii, de la Resolución 1178 del 18 de junio de 2024 \nincluyendo la columna -Parámetros- así:\nARTÍCULO SEGUNDO: Ajustar vía seguimiento el artículo vigésimo cuarto \nnumeral 1 literal c de la Resolución 1717 del 30 de agosto de 2019 y la Ficha \n8.1.1 Seguimiento a las aguas residuales y corrientes receptoras y aguas \nsuperficiales, en el sentido de estandarizar y codificar los muestreos de los \nvertimientos los cuales se reportarán de la siguiente manera:\n(…)\n\nResolución No. 002195       Del 04 OCT. 2024          Hoja No. 29 de 34\n“Por el cual se resuelve recurso de reposición contra la Resolución 1178 del 18 de junio de \n2024”\nPágina 29 de 34\nb. Condiciones de Modo y Tiempo:\nRealizar los monitoreos de calidad de agua de parámetros fisicoquímicos \nbajo las siguientes condiciones:\n(…)\niii. Efectuar las mediciones de los siguientes parámetros según el caso:\nEn la siguiente tabla se detallan los parámetros objeto de monitoreo con las \nrespectivas especificaciones de monitoreo:\nPERIODICIDAD\n(Frecuencia de \nmonitoreo)\nVENTANA \nDE \nMONITOREO \n(Meses)\nMEDIO \nENTREGA\nFRECUENCIA \nENTREGA\nPARÁMETROS\nMensual\nEntre abril y \nDiciembre\nPortal de \nRecepción\nPlantilla \nTipo\nMensual\nSegún lo \nestablecido en \nla Resolución \n1717 del 30 de \nagosto 2019.\nARTÍCULO TERCERO. Modificar la tabla del literal a, del Artículo Segundo, -\nCondiciones de lugar-, de la Resolución 1178 del 18 de junio de 2024 en el sentido \nde ajustar únicamente la coordenada del punto de Vertimiento 6, de conformidad \ncon lo indicado en Artículo Primero de la Resolución 1178 de 2024 así:\nARTÍCULO SEGUNDO: Ajustar vía seguimiento el artículo vigésimo cuarto \nnumeral 1 literal c de la Resolución 1717 del 30 de agosto de 2019 y la Ficha \n8.1.1 Seguimiento a las aguas residuales y corrientes receptoras y aguas \nsuperficiales, en el sentido de estandarizar y codificar los muestreos de los \nvertimientos los cuales se reportarán de la siguiente manera:\na. Condiciones de lugar: Se deberán realizar los monitoreos fisicoquímicos \nen los siguientes puntos de salida de los sistemas de tratamiento de \nvertimientos sobre el caño Rubiales asociados a monitoreo periódico, así:\nID del \nusuario \n(código \nEIA)\nID ANLA\nNombre \nFuente \n(Tipo y \nnombre)\nCoordenada \nEste Origen \nÚnico \nNacional\nCoordenada \nNorte \nOrigen \nÚnico \nNacional\nPermiso \nasociado \n(ID ANLA \ndel \npermiso)\nV1\nMSP- \nLAM0019- \n0015\nCaño \nRubiales\n5173686,879\n1979597,870\nVER-\nLAM0019- \n0001\nV2\nMSP- \nLAM0019- \n0016\nCaño \nRubiales 5173902,498\n1979546,674\nVER-\nLAM0019- \n0002\n\nResolución No. 002195       Del 04 OCT. 2024          Hoja No. 30 de 34\n“Por el cual se resuelve recurso de reposición contra la Resolución 1178 del 18 de junio de \n2024”\nPágina 30 de 34\nV3\nMSP- \nLAM0019- \n0017\nCaño \nRubiales 5175730,620\n1979433,546\nVER-\nLAM0019- \n0003\nV4\nMSP- \nLAM0019- \n0018\nCaño \nRubiales 5175940,531\n1979612,017\nVER-\nLAM0019- \n0004\nV5\nMSP- \nLAM0019- \n0019\nCaño \nRubiales 5176406,206\n1979112,182\nVER-\nLAM0019- \n0005\nV6\nMSP- \nLAM0019- \n0020\nCaño \nRubiales 5174817,981\n1979131,640\nVER-\nLAM0019- \n0006\nARTÍCULO CUARTO. Reponer en el sentido de modificar la tabla Artículo Tercero \nde la Resolución 1178 del 18 de junio de 2024, en el sentido de ajustar las \ncoordenadas de las estaciones V3, V4 y V5, así:\nARTÍCULO TERCERO: Ajustar vía seguimiento el artículo décimo sexto, de \nla Resolución 2475 del 18 de diciembre de 2019, que a su vez modifica del \nmedio abiótico numeral 1 Ficha 8.1.1 Seguimiento a las aguas residuales, \ncorrientes receptoras y aguas superficiales, literal b Artículo vigésimo cuarto \nde la Resolución 01717 del 30 de agosto de 2019, en el sentido de asignar \nlos identificadores únicos de esta Autoridad determinados por el Centro de \nmonitoreo del estado de los recursos ANLA, cómo se muestra a continuación:\nCodificación estaciones automáticas de monitoreo y aforos sobre caño \nRubiales\nCoordenadas Planas \nMagna Sirgas Origen \nNacional\nID ECOPETROL\nID\nID ANLA\nEste\nNorte\nEstación V3\nE3\nMSP-LAM0019-00045175791,710 1979517,910\nEstación V4\nE4\nMSP-LAM0019-00055176024,600 1979669,469\nEstación V5\nE5\nMSP-LAM0019-00065176492,640 1979094,368\nGrupo de regionalización Centro de monitoreo – ANLA\nARTÍCULO QUINTO: Reponer en el sentido de modificar la tabla codificación \nestaciones automáticas y monitoreo y aforos sobre el caño rubiales del articulo \ntercero de la Resolución 1178 del 18 de junio de 2024 en el sentido de retirar la \ncodificación establecida en la Resolución antes referenciada para los puntos \ndenominados con ID: Aforo_2, Aforo_3, Aforo_4, Aforo_5 y Aforo_6 el cual quedará \nde la siguiente manera.  \n\nResolución No. 002195       Del 04 OCT. 2024          Hoja No. 31 de 34\n“Por el cual se resuelve recurso de reposición contra la Resolución 1178 del 18 de junio de \n2024”\nPágina 31 de 34\nARTÍCULO TERCERO: Ajustar vía seguimiento  el artículo décimo sexto, de \nla Resolución 2475 del 18 de diciembre de 2019, que a su vez modifica del \nmedio abiótico numeral 1 Ficha 8.1.1 Seguimiento a las aguas residuales, \ncorrientes receptoras y aguas superficiales, literal b Artículo vigésimo cuarto \nde la Resolución 01717 del 30 de agosto de 2019, en el sentido de asignar \nlos identificadores únicos de esta Autoridad determinados por el Centro de \nmonitoreo del estado de los recursos ANLA, como se muestra a continuación.\nCodificación estaciones automáticas de monitoreo y aforos sobre caño \nRubiales\nCoordenadas Planas Magna \nSirgas Origen Nacional\nID ECOPETROL\nID\nID ANLA\nEste\nNorte\nEstación V0\nE0\nMSP-LAM0019-\n0001\n5173716,579\n1979695,336\nEstación V1\nE1\nMSP-LAM0019-\n0002\n5173757,743\n1979552,087\nEstación V2\nE2\nMSP-LAM0019-\n0003\n5173975,982\n1979634,993\nEstación V3\nE3\nMSP-LAM0019-\n0004\n5175791,710\n1979517,910\nEstación V4\nE4\nMSP-LAM0019-\n0005\n5176024,600\n1979669,469\nEstación V5\nE5\nMSP-LAM0019-\n0006\n5176506,914\n1979105,453\nEstación V6\nE6\nMSP-LAM0019-\n0007\n5174896,886\n1979206,819\nAforo aguas abajo de \nE0\nAforo_0 MSP-LAM0019-\n0008\n5173718,44\n1979686,08\nAforo aguas abajo de \nE2\nAforo_1 MSP-LAM0019-\n0009\n5173967,04\n1979649,96\nGrupo de regionalización Centro de monitoreo - ANLA\nARTÍCULO SEXTO: Reponer en el sentido de modificar la tabla del numeral 1, del \nArtículo Cuarto, de la Resolución 1178 del 18 de junio de 2024, en el sentido de \naclarar las coordenadas para el punto sobre el caño Rubiales denominado ID REH-\n008, así:\nARTÍCULO CUARTO. Se ajusta vía seguimiento el artículo primero, de la \nResolución 1076 del 17 de junio de 2019 el cual quedará de la siguiente \nmanera:\n\nResolución No. 002195       Del 04 OCT. 2024          Hoja No. 32 de 34\n“Por el cual se resuelve recurso de reposición contra la Resolución 1178 del 18 de junio de \n2024”\nPágina 32 de 34\n1. Condición de lugar: los puntos de monitoreo para el área de estudio \ndeberán adoptar para el reporte de resultados los ID_ANLA relacionados, \ncomo se indica en la siguiente tabla:\nID del \nusuari\no \n(códig\no EIA)\nID ANLA\nNombre \nFuente \n(Tipo y \nnombre)\nCoordenada \nEste Origen \nÚnico \nNacional\nCoordenada \nNorte \nOrigen \nÚnico \nNacional\nEstrategia \nde \nmonitoreo \nasociada\nREH-\n004\nMSP-\nLAM0019- \n0020\nCaño \nRubiales\n5171311,00\n1981061,00\nTillavá \n- \nRecurso \nHídrico \nSuperficial\nREH-\n008\nMSP-\nLAM0019- \n0021\nCaño \nRubiales\n5176953,34\n1979179,53\nTillavá \n- \nRecurso \nHídrico \nSuperficial\nREH-\n002\nMSP-\nLAM0019- \n0022\nCaño \nRubiales\n5193179,00\n1981807,00\nTillavá \n- \nRecurso \nHídrico \nSuperficial\nREH-\n009\nMSP-\nLAM0019- \n0023\nCaño \nMasififeriana\n5158707,00\n1975783,00\nTillavá \n- \nRecurso \nHídrico \nSuperficial\nREH-\n010\nMSP-\nLAM0019- \n0024\nCaño \nMasififeriana\n5171834\n1980581\nTillavá \n- \nRecurso \nHídrico \nSuperficial\nARTÍCULO SÉPTIMO: Los demás términos, condiciones y obligaciones de la \nResolución 1178 del 18 de junio de 2024, que no son objeto de modificación expresa \nen este proveído, se mantienen en los términos establecidos en dicho acto \nadministrativo y son exigibles para el titular del instrumento de manejo ambiental, a \npartir de la ejecutoria del presente acto administrativo.\nARTÍCULO OCTAVO. Notificar personalmente o por aviso, cuando a ello hubiere \nlugar, el contenido del presente acto administrativo al representante legal, \napoderado debidamente constituido o a la persona debidamente autorizada por la \nSociedad ECOPETROL S.A., identificada con Nit. 899.999.068, de conformidad con \nlos artículos 56 modificado por el artículo 10 de la Ley 2080 de 2021 y 67 y 69 del \nCódigo de Procedimiento Administrativo y de lo Contencioso Administrativo.\nARTÍCULO NOVENO. Notificar personalmente o por aviso, el contenido del \npresente acto administrativo a los señores Susana Rincón y José Antonio Moncada \nGamboa, en calidad de terceros intervinientes de conformidad con los artículos 56 \n\nResolución No. 002195       Del 04 OCT. 2024          Hoja No. 33 de 34\n“Por el cual se resuelve recurso de reposición contra la Resolución 1178 del 18 de junio de \n2024”\nPágina 33 de 34\nmodificado por el artículo 10 de la Ley 2080 de 2021 y 67 y 69 del Código de \nProcedimiento Administrativo y de lo Contencioso Administrativo\nARTÍCULO DÉCIMO. Comunicar el contenido del presente acto administrativo a la \nalcaldía del municipio de Puerto Gaitán en el departamento del Meta, a la \nCorporación para el Desarrollo Sostenible del Área de Manejo Especial La \nMacarena - CORMACARENA, y a la Procuraduría Delegada para Asuntos \nAmbientales, Minero Energéticos y Agrarios.\nARTÍCULO DÉCIMO PRIMERO. Publicar el presente acto administrativo en la \nGaceta Ambiental de la Autoridad Nacional de Licencias Ambientales – ANLA, de \nconformidad con los términos señalados en el artículo 71 de la Ley 99 de 1993.\nARTÍCULO DÉCIMO SEGUNDO. Contra el presente acto administrativo no \nprocede recurso alguno, de conformidad con lo dispuesto en el Artículo 87 de la Ley \n1437 de 18 de enero de 2011 por medio de la cual se expidió el Código de \nProcedimiento Administrativo y de lo Contencioso Administrativo.\nNOTIFÍQUESE, COMUNÍQUESE, PUBLÍQUESE Y CÚMPLASE\nDado en Bogotá D.C., a los 04 OCT. 2024\nRODRIGO ELIAS NEGRETE MONTES\nDIRECTOR GENERAL\nERIKA PATRICIA GARNICA TARAZONA\nCONTRATISTA\nHERNAN DARIO PAEZ GUTIERREZ\nCONTRATISTA\nNANCY RUBIELA CUBIDES PERILLA\nCONTRATISTA\nBETSY RUBIANE PALMA PACHECO\nPROFESIONAL ESPECIALIZADO\n\nResolución No. 002195       Del 04 OCT. 2024          Hoja No. 34 de 34\n“Por el cual se resuelve recurso de reposición contra la Resolución 1178 del 18 de junio de \n2024”\nPágina 34 de 34\nGERMAN BARRETO ARCINIEGAS\nSUBDIRECTOR DE SEGUIMIENTO DE LICENCIAS AMBIENTALES\nMANUEL SANTIAGO BURGOS NAVARRO\nCONTRATISTA\nExpediente No. LAM0019\nConcepto Técnico 6179 del 23 de agosto de 2024\nProceso No.: 20241000021954\nNota: Este es un documento electrónico generado desde los Sistemas de Información de la ANLA. El original reposa en los \narchivos digitales de la Entidad\n"
}