{
  "fuente": "ANLA_GACETA",
  "numero_resolución": "RESOLUCIÓN N° 000670",
  "fecha_resolución": "1993-12-22",
  "anio_resolucion": "1993",
  "nombre_proyecto": "Instalación de la línea de 37 kilómetros de 16\", denominado “Oleoducto",
  "nombre_proyecto_normalizado": "INSTALACION DE LA LINEA DE 37 KILOMETROS DE 16 DENOMINADO OLEODUCTO",
  "ubicación": "localizado en jurisdicción de los Municipios de Aguazul y Tauramena",
  "empresa": "OCENSA",
  "empresa_normalizada": "OCENSA",
  "numero_expediente": "LAM1226",
  "radicados": [
    "2022229297",
    "2022107968",
    "2023066564",
    "20236200170532"
  ],
  "descripcion": "POR LA CUAL SE RESUELVE UN RECURSO DE REPOSICIÓN",
  "tipos_infraccion": [
    "Tala o afectación de bosques"
  ],
  "tipos_infraccion_normalizados": [
    "TALA O AFECTACION DE BOSQUES"
  ],
  "pdf_id": "46003",
  "file_name": "ANLA_46003.pdf",
  "texto_completo": "República de Colombia\nMinisterio de Ambiente y Desarrollo Sostenible\nAUTORIDAD NACIONAL DE LICENCIAS \nAMBIENTALES\n- ANLA –\nRESOLUCIÓN N° 000670\n(16 ABR. 2024)\nPágina 1 de 26\n“POR LA CUAL SE RESUELVE UN RECURSO DE REPOSICIÓN”\nEL ASESOR DEL DESPACHO DEL DIRECTOR DE LA AUTORIDAD NACIONAL DE \nLICENCIAS AMBIENTALES – ANLA\nEn ejercicio de las facultades legales establecidas mediante la Ley 99 del 22 de diciembre \nde 1993, el Decreto Ley 3573 del 27 de septiembre de 2011, modificado por el Decreto \n376 del 11 de marzo de 2020, por el cual se modifica la estructura de la Autoridad \nNacional de Licencias Ambientales y acorde con lo regulado en el Decreto 1076 del 26 de \nmayo de 2015, la Resolución 423 del 12 de marzo de 2020, la Resolución 669 del 14 de \nabril de 2020 y la Resolución 1957 del 5 de noviembre de 2021, expedidas por la \nAutoridad Nacional de Licencias Ambientales, y\nCONSIDERANDO\nQue mediante Resolución 201 del 13 de marzo de 1997, el entonces Ministerio del Medio \nAmbiente, hoy Ministerio de Ambiente y Desarrollo Sostenible, (En adelante el Ministerio), \notorgó a la sociedad OLEODUCTO CENTRAL S.A. – OCENSA S.A., Licencia Ambiental \npara el proyecto “Instalación de la línea de 37 kilómetros de 16\", denominado “Oleoducto \nCupiagua – Cusiana”, localizado en jurisdicción de los Municipios de Aguazul y Tauramena \nen el Departamento del Casanare; asimismo en el artículo décimo primero se estableció la \nobligación de inversión forzosa de no menos del 1% en el marco de lo establecido en el \nArtículo 43 de la Ley 99 de 1993. \nQue por medio de la Resolución 219 del 10 de marzo de 1998, el Ministerio modificó la \nResolución 201 del 13 de marzo de 1997 del proyecto, en el sentido de aceptar el \nrealineamiento del Oleoducto Cupiagua - Cusiana en el K7+000 al K8+200 planteado por \nla Sociedad.\nQue a través de la Resolución 354 del 29 de abril de 1998, el Ministerio modificó la \nResolución 201 del 13 de marzo de 1997, en el sentido de autorizarla construcción del cruce \nsubfluvial sobre el río Unete del oleoducto CPF Cupiagua – CPF Cusiana, en época \nclimática diferente a la comtemplada en el Estudio de Impacto Ambiental y en el Plan de \nManejo Ambiental.\nQue mediante Resolución 548 del 18 de junio de 1998, el Ministerio, aceptó el Plan de \nContingencia presentado por la Sociedad para la operación del Oleoducto Cusiana – \n\nResolución No. 000670       Del 16 ABR. 2024          Hoja No. 2 de 26\n “POR LA CUAL SE RESUELVE UN RECURSO DE REPOSICIÓN”\nPágina 2 de 26\nCupiagua, localizado en jurisdicción de los Municipios de Aguazul y Tauramena en el \nDepartamento del Casanare.\nQue por medio de la Resolución 1236 del 18 de noviembre de 2003, el Ministerio, modificó \nel Artículo Tercero de la Resolución 201 del 13 de marzo de 1997, en el sentido de señalar \nde forma expresa la obligación de presentar informes de cumplimiento anual para la fase \nde operación del proyecto, los cuales deberán allegarse dentro de los tres primeros meses \nde cada año.\nQue a través de la Resolución 1484 del 19 de diciembre de 2003 la sociedad interpuso \nrecurso en el sentido de modificar el encabezado de la Resolución 1236 del 18 de \nnoviembre de 2003 del Ministerio, de la siguiente manera: “POR LA CUAL SE MODIFICA \nRESOLUCION No. 0201 DEL 13 DE MARZO DE 1997, MODIFICADA POR LA RESOLUCIÓN No. \n0219 DEL 10 DE MARZO DE 1998 Y POR LA RESOLUCION 0354 DEL 29 DE ABRIL DE 1998”\nQue mediante Resolución 574 del 18 de marzo de 2010, el Ministerio, modificó la \nResolución 201 del 12 de marzo de 1997, en el sentido de aceptar las fichas de manejo \npropuestas para las actuales actividades de operación y mantenimiento del oleoducto. \nQue por medio de la Resolución 1694 del 31 de agosto de 2010, el Ministerio resolvió el \nrecurso de reposición interpuesto en contra la Resolución 574 del 18 de marzo de 2010, en \nel sentido de modificar los literales a) y b) del numeral 4 del artículo 2, modificar el numeral \n1, confirmar el numeral 2 y revocar el numeral 3 del artículo 3, revocar el artículo 4, entre \notras disposiciones. \nQue a través de la Resolución 620 del 30 de abril de 2018, la Autoridad Nacional de \nLicencias Ambientales (ANLA), (En adelante la Autoridad Nacional), aprobó la modificación \ndel Plan de Inversión forzosa de no menos del 1%, de conformidad con la solicitud de \nacogimiento al Decreto 2099 del 22 de diciembre de 2016, modificado por el Decreto 075 \ndel 20 de enero 2017 y el 1120 del 29 de junio 2017.\nQue mediante Resolución 311 del 7 de marzo de 2019, la Autoridad Nacional resolvió el \nrecurso de reposición interpuesto en contra la Resolución 620 del 30 de abril de 2018, en \nel sentido de confirmar el contenido del numeral 2 del artículo segundo de la Resolución \n620 del 30 de abril de 2018.\nQue por medio de la Resolución 737 del 3 de mayo de 2019, la Autoridad Nacional resolvió \nel Recurso de Reposición interpuesto en contra la Resolución 311 del 7 de marzo de 2019, \nen el sentido de rechazarlo por improcedente. \nQue a través de la Resolución 705 del 16 de abril de 2020, la Autoridad Nacional modificó \nla Resolución 201 del 13 de marzo de 1997, en el sentido de aprobar el acogimiento al \nporcentaje incremental de la base de liquidación de la inversión forzosa de no menos del \n1%, de conformidad con lo señalado en el artículo 321 del Plan Nacional de Desarrollo - \nPND (Ley 1955 del 25 de mayo del 2019), presentado por la sociedad para el proyecto \n“Oleoducto Cupiagua – Cusiana”, localizado en jurisdicción de los Municipios de Aguazul y \nTauramena, en el Departamento del Casanare.\nQue mediante Resolución 1397 del 21 de agosto de 2020, la Autoridad Nacional resolvió el \nrecurso de reposición interpuesto en contra la Resolución 574 del 18 de marzo de 2010, en \n\nResolución No. 000670       Del 16 ABR. 2024          Hoja No. 3 de 26\n “POR LA CUAL SE RESUELVE UN RECURSO DE REPOSICIÓN”\nPágina 3 de 26\nel sentido en el sentido confirmar el artículo primero, modificar el artículo quinto, confirmar \nlos numerales 5, 6 7 y 8 del artículo décimo, modificar los artículos décimo primero y décimo \nsexto de la de la Resolución 705 del 16 de abril de 2020. \nQue mediante Resolución 3147 del 29 de diciembre de 2023, la Autoridad Nacional aceptó \npara el proyecto “Oleoducto Cupiagua - Cusiana” la liquidación parcial de la inversión \nforzosa de no menos del 1%, la suma de TRESCIENTOS CUARENTA MILLONES \nSETECIENTOS TRES MIL SEISCIENTOS TREINTA Y TRES PESOS MCTE. \n($340.703.633). para el periodo comprendido en el año 2006 al 2018 y año 2020.\nQue a través de la comunicación con radicación 20246200069852 del 18 de enero de 2023, \nla sociedad interpuso Recurso de Reposición en contra de la Resolución 3147 del 29 de \ndiciembre de 2023.\nAdicionalmente, se identifica la Sociedad OCENSA S.A., a través de la comunicación con \nradicación 20246200071942 del 19 de enero de 2024, da alcance al recurso de reposición \nen contra de la Resolución 3147 del 29 de diciembre de 2023, el cual fue remitido por medio \nde la comunicación con radicación 20246200069852 del 18 de enero de 2024 adjuntando \ndos anexos correspondientes para que sean incorporados al radicado del recurso. \nAhora bien, una vez revisada la comunicación con radicación 20246200071942 del 19 de \nenero de 2024 se constata que ésta fue remitida por correo electrónico el día 18 de enero \nde 2024 a las 22:30 p.m., razón por la cual la Autoridad Nacional le asignó como fecha de \nradicado el día 19 de enero de 2024.\nDicho lo anterior, los argumentos fueron evaluados por el equipo técnico de la Autoridad \nNacional y en consecuencia se expidió el Concepto técnico 1746 del 26 de marzo de 2024, \nel cual servirá como sustento técnico en el presente acto administrativo.\nCOMPETENCIA DE LA AUTORIDAD NACIONAL \nEl Gobierno Nacional, mediante Decreto Ley 3573 del 27 de septiembre de 2011, creó la \nAutoridad Nacional de Licencias Ambientales – ANLA, como una entidad con autonomía \nadministrativa y financiera, sin personería jurídica, la cual hace parte del Sector \nAdministrativo de Ambiente y Desarrollo Sostenible, en los términos del artículo 67 de la \nLey 489 del 29 de diciembre de 1998.\nEl numeral 1° del artículo tercero del mencionado decreto estableció dentro de las funciones \nde la Autoridad Nacional, la de otorgar o negar las licencias, permisos y trámites \nambientales de competencia del Ministerio, de conformidad con la ley y los reglamentos.\nMediante el Decreto 376 del 11 de marzo de 2020, se modificó la estructura de la Autoridad \nNacional de Licencias Ambientales.\nMediante la Resolución 669 del 14 de abril de 2020, se nombró como servidor público a \nEDILBERTO PEÑARANDA CORREA, identificado con cédula de ciudadanía 4.052.851, en \nel empleo de libre nombramiento y remoción de Asesor, código 1020, grado 15, adscrito a \nla Dirección General de la planta global de la ANLA.\n\nResolución No. 000670       Del 16 ABR. 2024          Hoja No. 4 de 26\n “POR LA CUAL SE RESUELVE UN RECURSO DE REPOSICIÓN”\nPágina 4 de 26\nEl 5 de noviembre de 2021, la Autoridad Nacional emitió la Resolución 1957 “Por la cual se \nadopta el Manual Específico de Funciones y de Competencias Laborales para los empleos de la \nplanta de personal de la Autoridad Nacional de Licencias Ambientales - ANLA”, en donde se \nestablece que corresponde al Despacho del Director General de la Autoridad Nacional de \nLicencias Ambientales - ANLA, “Suscribir los actos administrativos que otorgan, niegan, \nmodifican, ajustan o declaran la terminación de las licencias, permisos y trámites ambientales”.\nEn ejercicio de las facultades conferidas por la Ley 489 de 1998, se expidió la Resolución \n2795 del 25 de noviembre de 2022 “Por la cual se delegan unas funciones y se dictan otras \ndisposiciones”, en su artículo primero, numeral 15° delegó en el Asesor Código 1020 Grado \n15 del Despacho del Director General, la función de “Resolver los recursos de reposición \ninterpuestos contra los actos administrativos que se emiten en cumplimiento de las funciones \nanteriores.”\nTeniendo en cuenta lo anterior, es el Asesor del Despacho del Director General de la \nAutoridad Nacional el competente para pronunciarse sobre el recurso de reposición \ninterpuesto por la Sociedad en contra de la Resolución 3147 del 29 de diciembre de 2023. \nFUNDAMENTOS JURÍDICOS\nEl procedimiento para la presentación y resolución de recursos contra los actos \nadministrativos se encuentra reglado en el Código de Procedimiento Administrativo y de lo \nContencioso Administrativo artículos 74 y siguientes, que particularmente respecto del \nrecurso de reposición al tenor literal expresan:\n“(…) \nArtículo 74. Recursos contra los actos administrativos.\n Por regla general, contra los actos definitivos procederán los siguientes recursos: \n1.\nEl de reposición, ante quien expidió la decisión para que la aclare, modifique, adicione o \nrevoque \n(…)”\nA su vez, los artículos 76 y 77 del Código enunciado preceptúan: \n“Artículo 76. Oportunidad y presentación.\nLos recursos de reposición y apelación deberán interponerse por escrito en la diligencia de \nnotificación personal, o dentro de los diez (10) días siguientes a ella, o a la notificación por aviso, o \nal vencimiento del término de publicación, según el caso. Los recursos contra los actos presuntos \npodrán interponerse en cualquier tiempo, salvo en el evento en que se haya acudido ante el juez. \nLos recursos se presentarán ante el funcionario que dictó la decisión, salvo lo dispuesto para el de \nqueja, y si quien fuere competente no quisiere recibirlos podrán presentarse ante el procurador \nregional o ante el personero municipal, para que ordene recibirlos y tramitarlos, e imponga las \nsanciones correspondientes, si a ello hubiere lugar. \nEl recurso de apelación podrá interponerse directamente, o como subsidiario del de reposición y \ncuando proceda será obligatorio para acceder a la jurisdicción. \n\nResolución No. 000670       Del 16 ABR. 2024          Hoja No. 5 de 26\n “POR LA CUAL SE RESUELVE UN RECURSO DE REPOSICIÓN”\nPágina 5 de 26\nLos recursos de reposición y de queja no serán obligatorios. \nArtículo 77. Requisitos.\nPor regla general los recursos se interpondrán por escrito que no requiere de presentación personal \nsi quien lo presenta ha sido reconocido en la actuación. Igualmente, podrán presentarse por medios \nelectrónicos. \nLos recursos deberán reunir, además, los siguientes requisitos: \n1. Interponerse dentro del plazo legal, por el interesado o su representante o apoderado debidamente \nconstituido. \n2. Sustentarse con expresión concreta de los motivos de inconformidad.\n3. Solicitar y aportar las pruebas que se pretende hacer valer. \n4. Indicar el nombre y la dirección del recurrente, así como la dirección electrónica si desea ser \nnotificado por este medio. \nSólo los abogados en ejercicio podrán ser apoderados (…)\nA su vez, el artículo 80 del citado Código, establece el alcance del contenido de la decisión que \nresuelve el recurso:\n“Artículo 80. Decisión de los recursos. -Vencido el período probatorio, si a ello hubiere lugar, y sin \nnecesidad de acto que así lo declare, deberá proferirse la decisión motivada que resuelva el recurso. \nLa decisión resolverá todas las peticiones que hayan sido oportunamente planteadas y las que surjan \ncon motivo del recurso.\n(…)”\nCONSIDERACIONES DE LA AUTORIDAD NACIONAL FRENTE AL RECURSO DE \nREPOSICIÓN INTERPUESTO POR LA SOCIEDAD. \nDesde el punto de vista procedimental, se observa que el recurso de reposición interpuesto \npor la sociedad OCENSA S.A. en contra de la Resolución 3147 del 29 de diciembre de \n2023, cumple con los requisitos establecidos en el artículo 77 y concordantes del Código \nde Procedimiento Administrativo y de lo Contencioso Administrativo, en cuanto a lo \nsiguiente: \n1.\nInterponerse dentro del plazo legal, por el interesado o su representante o apoderado \ndebidamente constituido.\nSe encuentra acreditado que el día 3 de enero de 2024, la Sociedad fue debidamente \nnotificada por correo electrónico de la Resolución 3147 del 29 de diciembre de 2023; frente \na la cual interpuso recurso de reposición por intermedio de su Apoderada General el día 18 \nde enero de 2024 y radicado en la Autoridad Nacional bajo el número 20246200069852 \n\nResolución No. 000670       Del 16 ABR. 2024          Hoja No. 6 de 26\n “POR LA CUAL SE RESUELVE UN RECURSO DE REPOSICIÓN”\nPágina 6 de 26\nesto es, dentro de los diez (10) días siguientes a la notificación, de conformidad con lo \npreceptuado en el artículo 76 de la Ley 1437 de 2011. \nAdicionalmente, se identifica que la Apoderada de la Sociedad OCENSA S.A., a través de \nla comunicación con radicación 20246200071942 del 19 de enero de 2024 da alcance al \nrecurso de reposición interpuesto en contra de la Resolución 3147 del 29 de diciembre de \n2023 el cual fue remitido por medio de la comunicación con radicación 20246200069852 \ndel 18 de enero de 2024, adjuntando dos anexos correspondientes para que sean \nincorporados al radicado del recurso.\nAhora bien, una vez revisada la comunicación con radicación 20246200071942 del 19 de \nenero de 2024 se constata que ésta fue remitida por correo electrónico el día 18 de enero \nde 2024 a las 22:30 p.m., razón por la cual la Autoridad Nacional le asignó como fecha de \nradicado el día 19 de enero de 2024.\nDe lo anterior se concluye que el alcance al escrito del recurso de reposición presentado \nmediante el envío a la dirección electrónica licencias@anla.gov.co el día 19 de enero de \n2024, le resulta aplicable lo dispuesto en el párrafo final del artículo 54 de la Ley 1437 del \n18 de enero de  2011, razón por la cual se interpuso dentro del término señalado en el \nartículo 76 de la Ley ya mencionada y se debe proceder  su trámite y respectivo \npronunciamiento.  \n2.\nSustentarse con expresión concreta de los motivos de inconformidad. \nLa Sociedad presentó los argumentos en contra de las disposiciones recurridas de la \nResolución 3147 del 29 de diciembre de 2023, los cuales serán tenidos en cuenta para \ndecidir el presente recurso de reposición.\n3.\nSolicitar y aportar las pruebas que se pretende hacer valer.\nEn el recurso de reposición la Sociedad aportó las siguientes pruebas: \n“(…) \n-Anexo 1. Factura de venta PA No. 325 – Hito 1 \n-Anexo 2. Factura de venta electrónica PA No. PA7 – Hito 2 \n-Anexo 3. Factura de venta electrónica PA No. PA9 – Hito 3 \n-Anexo 4. Factura de venta electrónica PA No. PA15 – Hito 4 \n-Anexo 5. Comprobante de egreso OCENSA – Hito 1  \n-Anexo 6. Comprobante de egreso OCENSO – Hito 2 \n-Anexo 7. Comprobante de egreso OCENSO – Hito 3 \n-Anexo 8. Comprobante de egreso OCENSO – Hito 4\n-Anexo 9. Concepto técnico No. 8141 del 23 de noviembre de 2023\n\nResolución No. 000670       Del 16 ABR. 2024          Hoja No. 7 de 26\n “POR LA CUAL SE RESUELVE UN RECURSO DE REPOSICIÓN”\nPágina 7 de 26\n(…)”\n4.\nIndicar el nombre y la dirección del recurrente, así como la dirección electrónica si desea ser \nnotificado por este medio.\nLa sociedad manifestó que, “(…) Para todos los efectos se recibirán notificaciones en el correo \nelectrónico notificaciones.judiciales@ocensa.com.co. (…)”\n (…)”\nCon base en lo anterior, verificado el cumplimiento de los requisitos establecidos en el \nCódigo de Procedimiento Administrativo y de lo Contencioso Administrativo -CPACA-, \nrespecto a la procedencia del señalado recurso de reposición, la Autoridad Nacional \nprocederá a resolverlo, teniendo en cuenta las consideraciones realizadas en el Concepto \nTécnico 1746 del 26 de marzo de 2024; en el mismo orden de los argumentos presentados \npor la sociedad, a saber:\n1.\nDISPOSICIÓN RECURRIDA –ARTÍCULO PRIMERO Y PARÁGRAFO PRIMERO DE \nLA RESOLUCIÓN 3147 DEL 29 DE DICIEMBRE DE 2023.\n“(…) ARTÍCULO PRIMERO. ACEPTAR para el proyecto “Oleoducto Cupiagua - Cusiana” la \nliquidación parcial de la inversión forzosa de no menos del 1%, la suma de TRESCIENTOS \nCUARENTA MILLONES SETECIENTOS TRES MIL SEISCIENTOS TREINTA Y TRES \nPESOS MCTE. ($340.703.633). para el periodo comprendido en el año 2006 al 2018 y año \n2020, de conformidad a las razones expuestas en la parte motiva del presente acto \nadministrativo.\nPARÁGRAFO PRIMERO: La liquidación parcial actualizada al Artículo 321 de la Ley 1955 del \n25 de mayo de 2019, de la inversión forzosa de no menos del 1%, corresponde a la suma de \nTRESCIENTOS CUARENTA MILLONES SETECIENTOS TRES MIL SEISCIENTOS \nTREINTA Y TRES PESOS MCTE. ($340.703.633), liquidado sobre la base de liquidación \nactualizada que asciende a la suma de TREINTA Y CUATRO MIL SETENTA MILLONES \nTRESCIENTOS SESENTA Y TRES MIL TRESCIENTOS TREINTA Y CINCO PESOS MCTE. \n($34.070.363.335), para el periodo comprendido en el año 2006 al 2018 y año 2020”\n (…)”\n1.1\nPetición de la Sociedad.\n“(…) [S]e solicita a la ANLA la MODIFICACIÓN del artículo primero y su parágrafo primero de \nla Resolución 003147 del 29 de diciembre de 2023, y por lo mismo se proceda a tener en \nconsideración de la liquidación parcial actualizada de acuerdo con los montos aprobados para \nel periodo comprendido entre el año 2006 al 2022 y no para el periodo comprendido en el año \n2006 al 2018 y año 2020 como quedó reseñado en el pronunciamiento objeto del presente \nrecurso. De este modo, sin perjuicio del lenguaje utilizado por la ANLA, se sugiere la siguiente \nredacción para el artículo recurrido: \n“ARTÍCULO PRIMERO. ACEPTAR para el proyecto “Oleoducto Cupiagua - Cusiana” la \nliquidación parcial de la inversión forzosa de no menos del 1%, la suma de TRESCIENTOS \nCUARENTA MILLONES SETECIENTOS TRES MIL SEISCIENTOS TREINTA Y TRES \nPESOS MCTE. ($340.703.633). para el periodo comprendido entre el año 2006 al 2022, de \nconformidad a las razones expuestas en la parte motiva del presente acto administrativo.” ….\n\nResolución No. 000670       Del 16 ABR. 2024          Hoja No. 8 de 26\n “POR LA CUAL SE RESUELVE UN RECURSO DE REPOSICIÓN”\nPágina 8 de 26\n \n“PARÁGRAFO PRIMERO: La liquidación parcial actualizada al Artículo 321 de la Ley 1955 \ndel 25 de mayo de 2019, de la inversión forzosa de no menos del 1%, corresponde a la suma \nde TRESCIENTOS CUARENTA MILLONES SETECIENTOS TRES MIL SEISCIENTOS \nTREINTA Y TRES PESOS MCTE. ($340.703.633), liquidado sobre la base de liquidación \nactualizada que asciende a la suma de TREINTA Y CUATRO MIL SETENTA MILLONES \nTRESCIENTOS SESENTA Y TRES MIL TRESCIENTOS TREINTA Y CINCO PESOS MCTE. \n($34.070.363.335), para el periodo comprendido entre el año 2006 al 2022.”\n1.2\nArgumentos de la Sociedad.\n“(…) \n6.1\nMotivos de inconformidad frente a lo dispuesto en el Parágrafo Primero del Artículo \nPrimero (1) de la Resolución No. 003147 del 29 de diciembre de 2023.\nEl artículo establece lo siguiente: \n“ARTÍCULO PRIMERO. ACEPTAR para el proyecto “Oleoducto Cupiagua - Cusiana” la liquidación \nparcial de la inversión forzosa de no menos del 1%, la suma de TRESCIENTOS CUARENTA \nMILLONES SETECIENTOS TRES MIL SEISCIENTOS TREINTA Y TRES PESOS MCTE. \n($340.703.633). para el periodo comprendido en el año 2006 al 2018 y año 2020, de conformidad a \nlas razones expuestas en la parte motiva del presente acto administrativo.”….\n“PARÁGRAFO PRIMERO: La liquidación parcial actualizada al Artículo 321 de la Ley 1955 del 25 \nde mayo de 2019, de la inversión forzosa de no menos del 1%, corresponde a la suma de \nTRESCIENTOS CUARENTA MILLONES SETECIENTOS TRES MIL SEISCIENTOS TREINTA Y \nTRES PESOS MCTE. ($340.703.633), liquidado sobre la base de liquidación actualizada que \nasciende a la suma de TREINTA Y CUATRO MIL SETENTA MILLONES TRESCIENTOS SESENTA \nY TRES MIL TRESCIENTOS TREINTA Y CINCO PESOS MCTE. ($34.070.363.335), para el periodo \ncomprendido en el año 2006 al 2018 y año 2020.” \n6.1.1\nObjeto del recurso: \n6.1.1.1 De acuerdo con los fundamentos fácticos, técnicos y jurídicos que se presentan en este \nrecurso de reposición, OCENSA solicita se MODIFIQUE la decisión, y en consideración a \nello se proceda a APROBAR la Liquidación Parcial actualizada para la obligación \nincluyendo los años 2019, 2021 y 2022. \n6.1.2\nConsideraciones de la ANLA: \n6.1.2.1 La ANLA basó su decisión específicamente conforme a lo dispuesto la página 18 de la \nResolución No.003147 del 29 de diciembre de 2023 en la que manifiesta “…[N]o se \nencuentra la información correspondiente al periodo del 1 de enero al 31 de diciembre de \nlos años 2019 y 2021, por lo que la Sociedad deberá presentar las respectivas \ncertificaciones, en cumplimiento del artículo décimo primero de la Resolución 705 del 16 de \nabril de 2020.”\n6.1.3\nConsideraciones de la Compañía frente a las consideraciones de la ANLA:\n6.1.3.1 La decisión de la ANLA debe ser modificada por cuanto la entidad en el acto administrativo \nno está teniendo a consideración procesos y pronunciamientos relacionados con la \nevaluación de la obligación que se han adelantado de manera posterior al periodo evaluado \n\nResolución No. 000670       Del 16 ABR. 2024          Hoja No. 9 de 26\n “POR LA CUAL SE RESUELVE UN RECURSO DE REPOSICIÓN”\nPágina 9 de 26\nen el concepto técnico 05533 del 13 de septiembre de 2022 (1 de enero de 2021 al 31 de \ndiciembre de 2021). \nCon relación a ello, OCENSA se permite relacionar que mediante el concepto técnico 8141 del 23 \nde noviembre de 2023 acogido mediante Acta de Seguimiento 881 del 30 de noviembre de 2023, la \nANLA determinó las siguientes consideraciones: \n“Mediante radicado 2022229297-1-000 del 13 de octubre de 2022, la Sociedad OLEODUCTO \nCENTRAL S.A. -OCENSA S.A.- entregó a esta Autoridad Nacional respuesta al Acta 627 del 21 de \nseptiembre de 2022 y anexó el Certificado de revisoría fiscal vigencia 2019, en el cual se establece \nque, “Los registros contables del periodo comprendido del 1 de enero al 31 de diciembre de 2019, \nen CERO PESOS ($0)” (página 132).\n“Mediante radicado 2022107968-1-000 del 31 de mayo de 2022, la Sociedad presentó certificado \nfirmado por revisor fiscal Gustavo Andrés Porras Rodríguez con TP No.152081-T para el periodo \ncomprendido entre el 1 de enero al 31 de diciembre de 2021 en CERO PESOS ($0)” (página 134).\n“Mediante radicado 2023066564-1-000 del 30 de marzo de 2023, la Sociedad presenta certificado \nfirmado por revisor fiscal Gustavo Andrés Porras Rodríguez con TP No.152081-T para el periodo \ncomprendido entre el 1 de enero al 31 de diciembre de 2022 en CERO PESOS ($0)” (página 134). \n“De lo anterior esta Autoridad considera viable ACEPTAR para el proyecto “Oleoducto Cupiagua - \nCusiana”, la suma de CERO PESOS MCTE. ($0) para los años de 2019, 2021 y 2022, el cual no \nmodifica el valor de la obligación del 1% ya aceptado en el Artículo Séptimo de la Resolución 705 \ndel 16 de abril de 2020” (página 135). (Negrilla por fuera del texto original).\nDe esta manera, se entiende que conforme a la evaluación realizada por parte de la ANLA de los \ncertificados de revisoría fiscal presentados por OCENSA mediante el radicado 2022229297-1-000 \ndel 13 de octubre de 2022 para el año 2019, radicado 2022107968-1-000 del 31 de mayo de 2022, \npara el año 2021 y radicado 2023066564-1-000 del 30 de marzo de 2023 para el año 2022, la \nliquidación parcial actualizada al Artículo 321 de la Ley 1955 del 25 de mayo de 2019, de la inversión \nforzosa de no menos del 1% para el expediente LAM1226, corresponde a la suma de \nTRESCIENTOS CUARENTA MILLONES SETECIENTOS TRES MIL SEISCIENTOS TREINTA Y \nTRES PESOS MCTE. ($340.703.633), liquidado sobre la base de liquidación actualizada que \nasciende a la suma de TREINTA Y CUATRO MIL SETENTA MILLONES TRESCIENTOS SESENTA \nY TRES MIL TRESCIENTOS TREINTA Y CINCO PESOS MCTE. ($34.070.363.335), para el periodo \ncomprendido entre el año 2006 al 2022”.\n(…)\n1.3\nConsideraciones de la Autoridad Nacional.\nA través del Concepto técnico 1746 del 26 de marzo de 2024, el equipo técnico de la \nAutoridad Nacional consideró:\n“(…) \nDe acuerdo con los argumentos expuestos por la Sociedad y al verificar el Sistema de Información \nde Licencias Ambientales -SILA-, es necesario precisar que la resolución objeto de recurso, acogió \nel concepto técnico 5533 del 13 de septiembre de 2022, cuyo periodo de seguimiento corresponde \nal Informe de Cumplimiento Ambiental - ICA No. 19 ([A]ño 2021), presentado con radicado \n2022107968-1-000 del 31 de mayo de 2022 y corte documental del 26 de octubre de 2021 al 15 de \nagosto de 2022.\n\nResolución No. 000670       Del 16 ABR. 2024          Hoja No. 10 de 26\n “POR LA CUAL SE RESUELVE UN RECURSO DE REPOSICIÓN”\nPágina 10 de 26\nEn dicho concepto se analizó la información presentada por el titular en los radicados ANLA \n2020041855-1-000 del 17 de marzo de 2020, 2021054590-1-000 del 26 de marzo de 2021 y \n2021059039-1-000 del 31 de marzo de 2021, lo que llevó a aceptar para el proyecto “Oleoducto \nCupiagua - Cusiana”, la suma de CERO PESOS MCTE. ($0) para los años de 2006 a 2018 y el año \nde 2020, no modificándose el valor de la obligación del 1% ya aceptado en el artículo Séptimo de la \nResolución 705 del 16 de abril de 2020 e identificándose que no se encontraba la información \ncorrespondiente a las certificaciones de los años 2019 y 2021.\nAhora bien, la sociedad argumenta que esta Autoridad Nacional “(…) [N]o está teniendo a \nconsideración procesos y pronunciamientos relacionados con la evaluación de la obligación que se \nhan adelantado de manera posterior al periodo evaluado en el concepto técnico 05533 del 13 de \nseptiembre de 2022 (1 de enero de 2021 al 31 de diciembre de 2021)”, sobre lo cual se reitera que \nla Resolución 3147 del 29 de diciembre de 2023, consideró un periodo y corte documental específico, \ntal y como quedó registrado en diferentes apartes del acto administrativo, de lo cual se señala a \ncontinuación una referencia:\nFuente: Resolución 3147 del 29 de diciembre de 2023\nEn lo que respecta al concepto técnico 8141 del 23 de noviembre de 2023, acogido mediante Acta \nde Reunión de Control y Seguimiento 881 del 30 de noviembre de 2023, este consideró la \ninformación del Informe de Cumplimiento Ambiental ICA No. 20 ([P]eríodo del 1 de enero al 31 de \ndiciembre de 2022), presentado con radicado 20236200170532 del 31 de mayo de 2023 y corte \ndocumental del 15 de agosto de 2022 al 22 de septiembre de 2023, lo cual es claro que no se \nincorporó en la Resolución objeto de recurso de reposición, como puede apreciarse a continuación: \n\nResolución No. 000670       Del 16 ABR. 2024          Hoja No. 11 de 26\n “POR LA CUAL SE RESUELVE UN RECURSO DE REPOSICIÓN”\nPágina 11 de 26\nFuente: Resolución 3147 del 29 de diciembre de 2023\nSin embargo, en el numeral 5.7.3 Base de liquidación de la inversión forzosa de no menos del 1% \ndel concepto técnico 8141 del 23 de noviembre de 2023, se analizan los radicados 2022107968-1-\n000 del 31 de mayo de 2022, 2022229297-1-000 del 13 de octubre de 2022 y 2023066564-1-000 del \n30 de marzo de 2023, considerándose viable aceptar para el proyecto “Oleoducto Cupiagua - \nCusiana”, la suma de CERO PESOS MCTE. ($0) para los años de 2019, 2021 y 2022, el cual no \nmodifica el valor de la obligación del 1% ya aceptado en el artículo séptimo de la Resolución 705 del \n16 de abril de 2020, esta consideración, así como otros aspectos analizados en el concepto en \ncomento, serán objeto de pronunciamiento en el acto administrativo correspondiente al periodo de \nseguimiento, por lo tanto, no es posible acceder a la solicitud de modificación del parágrafo primero \ndel artículo primero de la Resolución 3147 del 29 de diciembre de 2023, en el sentido de tener en \nconsideración de la liquidación parcial actualizada de acuerdo con los montos aprobados para el \nperiodo comprendido entre los años 2006 y 2022. \n(…)”\nEn línea con lo anterior en relación con los argumentos expuestos por el recurrente la \nAutoridad Nacional efectúa las siguientes precisiones sobre los artículos 4, 6, 29, 83, 84, \n121 y 209 de la Constitución Política, así: \nCon relación al artículo 4 de la Constitución Política, se habla del principio de la supremacía \nnormativa de la Constitución.\n\nResolución No. 000670       Del 16 ABR. 2024          Hoja No. 12 de 26\n “POR LA CUAL SE RESUELVE UN RECURSO DE REPOSICIÓN”\nPágina 12 de 26\nCon relación a los principios consagrados en los artículos 6, 29, 83, 84, 121 y 209, de \nacuerdo con lo señalado por el tratadista Libardo Rodríguez1, en su escrito Derecho \nAdministrativo General y Colombiano se menciona lo siguiente:\nEl principio de legalidad (arts. 6 y 121). “En el derecho administrativo, este principio, consiste \nen que la administración está sujeta en su actividad al ordenamiento jurídico, es decir que todos \nlos actos administrativos y actuaciones que realice deben respetar las normas jurídicas \nsuperiores”.\nEl principio de la tutela judicial efectiva. (art. 292) “En virtud de este principio, el ordenamiento \njurídico debe garantizar el derecho de acceder a la administración de justicia para obtener una \ndecisión en derecho, a un debido proceso y a que una vez dictada la decisión, la misma sea \nejecutada y tenga plena efectividad”. \nEl principio de la buena fe (art 83). “Este principio se traduce en el deber, tanto para las \nautoridades administrativas como para los particulares que se relacionan con ellas, de actuar con \nhonestidad, corrección fidelidad y lealtad, esto es, de conformidad con lo que podría esperarse \nde una persona que goza de los citados atributos, de tal manera que se garantice la confianza, \nla seguridad y la credibilidad a la palabra dada”. (Negrita y Subrayado fuera de texto)\nAhora bien, el Consejo de Estado (Sentencia, 2018, Rad. 25000-23-24-000-2006- 00894-\n01, Col.) ha precisado que, “El debido proceso a que está sujeta la administración pública debe \ncoexistir con la necesidad y la obligación que tiene ésta de asegurar la eficiencia, la economía, la \nceleridad y la eficacia en el cumplimiento de las tareas a su cargo para la satisfacción del interés \ngeneral, lo que obliga a hacer una ponderación adecuada entre todos ellos a fin de lograr un perfecto \ny balanceado procedimiento debido.\nPor tanto, con relación al principio del debido proceso, es pertinente señalar que el acto \nadministrativo se ha expedido respetando las normas jurídicas superiores, pues de manera \nalguna la Autoridad Nacional no ha desplegado algún comportamiento, fuera del estricto \ncumplimiento de las disposiciones legales de carácter general y particular en la expedición \nde la Resolución 3147 del 29 de diciembre de 2023 a través de la cual se acepta para el \nproyecto “Oleoducto Cupiagua - Cusiana” la liquidación parcial de la inversión forzosa de \nno menos del 1%, la suma de TRESCIENTOS CUARENTA MILLONES SETECIENTOS \nTRES MIL SEISCIENTOS TREINTA Y TRES PESOS MCTE. ($340.703.633). para el \nperiodo comprendido en el año 2006 al 2018 y año 2020. Adicionalmente la Autoridad \nNacional ha actuado dentro del marco jurídico, de conformidad con los principios de la \nfunción administrativa.\nCon relación a la Acción de Cumplimiento el artículo 87 de la Constitución Política establece \nque “Toda persona podrá acudir ante la autoridad judicial para hacer efectivo el cumplimiento de \nuna ley o un acto administrativo. En caso de prosperar la acción, la sentencia ordenará a la autoridad \nrenuente el cumplimiento del deber omitido”.\n \nEn la Sentencia C-157 de 19983, la Corte Constitucional definió este mecanismo como:\n1 Rodríguez Ramírez Libardo, Derecho Administrativo General y Colombiano., Editorial Temis 2017, págs. 98-101\n2 Artículo 29 Constitución Política \n3 Magistrados Ponentes Antonio Barrera Carbonell y Hernando Herrera Vergara.\n\nResolución No. 000670       Del 16 ABR. 2024          Hoja No. 13 de 26\n “POR LA CUAL SE RESUELVE UN RECURSO DE REPOSICIÓN”\nPágina 13 de 26\n“(…) [E]l derecho que se le confiere a toda persona natural o jurídica, pública o privada, en \ncuanto titular de potestades e intereses jurídicos activos frente a las autoridades públicas y aún \nde los particulares que ejerzan funciones de esta índole, y no meramente destinataria de \nsituaciones pasivas, concretadas en deberes, obligaciones o estados de sujeción, demandados \nen razón de los intereses públicos o sociales, para poner en movimiento la actividad \njurisdiccional del Estado, mediante la formulación de una pretensión dirigida a obtener el \ncumplimiento de una ley o de un acto administrativo que ha impuesto ciertos deberes u \nobligaciones a una autoridad, la cual se muestra renuente a cumplirlos.”\n \nDel mismo modo, señaló que este mecanismo tiene por objeto hacer efectivos, de un lado, mandatos \ndel Legislador provenientes del Congreso o del Gobierno en ejercicio de funciones legislativas, cuyo \ncontenido corresponde a normas de carácter general, impersonal y abstracto; y, de otro, actos \nadministrativos, bien sea de contenido general o particular, en las condiciones que la misma ley \nprescribe.”\nAunado a lo anterior, el tratadista Libardo Rodríguez señaló lo siguiente con relación a los \nprincipios de la función administrativa (art. 209). “De acuerdo con esta norma constitucional \nejercicio de la función administrativa debe desarrollarse de conformidad con los principios de \nigualdad, moralidad, eficacia, economía, celeridad, imparcialidad y publicidad, los cuales son \ndesarrollados por las leyes expedidas para los diferentes sectores de la actividad administrativa”. \nAdicional a lo anterior, es de precisar lo dispuesto en el artículo 3 de la Ley 1437 del 18 de \nenero de 2011, que establece: \n“ARTÍCULO 3o. PRINCIPIOS. Todas las autoridades deberán interpretar y aplicar las \ndisposiciones que regulan las actuaciones y procedimientos administrativos a la luz de los \nprincipios consagrados en la Constitución Política, en la Parte Primera de este Código y en las \nleyes especiales. Las actuaciones administrativas se desarrollarán, especialmente, con arreglo a \nlos principios del debido proceso, igualdad, imparcialidad, buena fe, moralidad, participación, \nresponsabilidad, transparencia, publicidad, coordinación, eficacia, economía y celeridad. 1. En \nvirtud del principio del debido proceso, las actuaciones administrativas se adelantarán de \nconformidad con las normas de procedimiento y competencia establecidas en la Constitución y la \nley, con plena garantía de los derechos de representación, defensa y contradicción.”\nAdicionalmente, es pertinente precisar que la Autoridad Nacional es garante de la \nConstitución, de la Ley, de los principios de la función administrativa y de los procedimientos \nque rigen la actuación administrativa en materia ambiental; en ese sentido los actos y \npronunciamientos que se profieren en el marco de los procesos de seguimiento de los \ninstrumentos de manejo y control se encuentran debidamente sustentados tanto técnica \ncomo jurídicamente; es así como en aplicación de los principios de legalidad, debido \nproceso, igualdad, imparcialidad, buena fe, moralidad, participación, responsabilidad, \ntransparencia, publicidad, coordinación, eficacia, economía y celeridad, por lo que la \nAutoridad Nacional expidió la Resolución 3147 del 29 de diciembre de 2023, respetando las \nnormas jurídicas superiores, la normativa ambiental vigente y conforme a los soportes \npresentados por la Sociedad.\nAhora bien, con relación a la solicitud de la Sociedad de modificar el artículo primero y el \nparágrafo primero de la Resolución 3147 del 29 de diciembre de 2023 y que se proceda a \ntener en consideración la liquidación parcial actualizada de acuerdo con los montos \naprobados para el periodo comprendido entre el año 2006 al 2022; es de precisar que la \npresente Resolución, tiene por objeto resolver el recurso de reposición interpuesto en contra \nla Resolución 3147 del 29 de diciembre de 2023, acogiendo el concepto técnico 5533 del \n\nResolución No. 000670       Del 16 ABR. 2024          Hoja No. 14 de 26\n “POR LA CUAL SE RESUELVE UN RECURSO DE REPOSICIÓN”\nPágina 14 de 26\n13 de septiembre de 2022, cuyo periodo de seguimiento corresponde al Informe de \nCumplimiento Ambiental - ICA 19 del Año 2021, presentado mediante comunicación con \nradicación 2022107968-1-000 del 31 de mayo de 2022 y corte documental del 26 de octubre \nde 2021 al 15 de agosto de 2022 (Correspondiente al período del 1 de enero de 2021 al 31 \nde diciembre de 2021), en tal sentido la Resolución 3147 del 29 de diciembre de 2023, \nconsideró un periodo y corte documental específico.\nDe otra parte, en lo que corresponde al argumento expuesto por la recurrente, según el \ncual: “La decisión de la ANLA debe ser modificada por cuanto la entidad en el acto administrativo \nno está teniendo a consideración procesos y pronunciamientos relacionados con la evaluación de la \nobligación que se han adelantado de manera posterior al periodo evaluado en el concepto técnico \n05533 del 13 de septiembre de 2022 (1 de enero de 2021 al 31 de diciembre de 2021)”, es \npertinente señalar que en el concepto técnico 8141 del 23 de noviembre de 2023, acogido \nmediante Acta de Reunión de Control y Seguimiento 881 del 30 de noviembre de 2023, se \nanalizó y evaluó la información del Informe de Cumplimiento Ambiental ICA 20 (Período del \n1 de enero al 31 de diciembre de 2022), presentado por medio de la comunicación con \nradicación 20236200170532 del 31 de mayo de 2023 y corte documental del 15 de agosto \nde 2022 al 22 de septiembre de 2023, lo cual es claro que se evalúo un periodo y corte \ndocumental específico, razón por la cual la información del Informe de Cumplimiento \nAmbiental ICA 20 no se incluyó en la Resolución objeto de recurso de reposición. \nDicho lo anterior, no es dable por parte de la Autoridad Nacional evaluar la información \nnueva y adicional a la que se presentó para la evaluación realizada; al respecto el artículo \n80 del Código de Procedimiento Administrativo y lo Contencioso Administrativo, dispone: \n“(…) ARTÍCULO 80. DECISIÓN DE LOS RECURSOS. Vencido el período probatorio, si a ello \nhubiere lugar, y sin necesidad de acto que así lo declare, deberá proferirse la decisión \nmotivada que resuelva el recurso. \nLa decisión resolverá todas las peticiones que hayan sido oportunamente planteadas y las que \nsurjan con motivo del recurso. (Subrayado fuera de texto) \n(…)”\nDe allí que, los aspectos evaluados en el numeral “5.7.3 Base de liquidación de la inversión \nforzosa de no menos del 1%” del concepto técnico 8141 del 23 de noviembre de 2023, en el \ncual se analizan las comunicaciones con radicación 2022107968-1-000 del 31 de mayo de \n2022, 2022229297-1-000 del 13 de octubre de 2022 y 2023066564-1-000 del 30 de marzo \nde 2023, serán objeto de pronunciamiento por parte de la Autoridad Nacional en acto \nadministrativo independiente, por tanto el presente acto se circunscribe al pronunciamiento \nrespecto de las disposiciones recurridas, razón por la cual, no son de recibo los argumentos \nexpuestos por la Sociedad recurrente.\nSumado a lo anterior, es preciso señalar que la decisión adoptada en la Resolución 3147 \ndel 29 de diciembre de 2023, es producto de una evaluación realizada por un equipo técnico \ninterdisciplinario; y que de dicha evaluación al Informe de Cumplimiento Ambiental - ICA 19 \ndel Año 2021, presentado mediante comunicación con radicación 2022107968-1-000 del \n31 de mayo de 2022 y corte documental del 26 de octubre de 2021 al 15 de agosto de 2022, \n(Correspondiente al período del 1 de enero de 2021 al 31 de diciembre de 2021), se expidió \nel Concepto técnico 5533 del 13 de septiembre de 2022, el cual que sirvió de insumo y/o \n\nResolución No. 000670       Del 16 ABR. 2024          Hoja No. 15 de 26\n “POR LA CUAL SE RESUELVE UN RECURSO DE REPOSICIÓN”\nPágina 15 de 26\nfundamento para la elaboración de la Resolución en mención, razón por la cual la \nmotivación fue real, seria, adecuada y suficiente.\nAdicionalmente, la decisión contenida en la Resolución 3147 del 29 de diciembre de 2023, \nfue debidamente notificada a la Sociedad de conformidad con lo dispuesto en los artículos \n67 y 69 del Código de Procedimiento Administrativo y de lo Contencioso Administrativo a \nfin de que hiciera uso de los recursos de ley, ejerciera su derecho de contradicción como \nen efecto sucedió en el presente asunto. \nDe conformidad con lo anterior y una vez evaluados los argumentos expuestos por la \nSociedad recurrente y en concordancia con las consideraciones señaladas en el Concepto \ntécnico 1746 del 26 de marzo de 2024, la Autoridad Nacional confirmará el contenido del \nartículo primero y el parágrafo primero de la Resolución 3147 del 29 de diciembre de 2023.\n2.\nDISPOSICIÓN RECURRIDA –PARÁGRAFO TERCERO DEL ARTÍCULO PRIMERO \nDE LA RESOLUCIÓN 3147 DEL 29 DE DICIEMBRE DE 2023.\n “(…) ARTÍCULO PRIMERO. ACEPTAR para el proyecto “Oleoducto Cupiagua - Cusiana” la \nliquidación parcial de la inversión forzosa de no menos del 1%, la suma de TRESCIENTOS \nCUARENTA MILLONES SETECIENTOS TRES MIL SEISCIENTOS TREINTA Y TRES \nPESOS MCTE. ($340.703.633). para el periodo comprendido en el año 2006 al 2018 y año \n2020, de conformidad a las razones expuestas en la parte motiva del presente acto \nadministrativo.” \n(…)\n“PARÁGRAFO TERCERO: El valor de los proyectos del Plan de Inversión de no menos del \n1% que se encuentran en ejecución, corresponde a la suma de CERO PESOS MCTE. ($0).”\n (…)”\n2.1\nPetición de la Sociedad.\n“(…) [S]e solicita a la ANLA la MODIFICACIÓN del parágrafo tercero del artículo primero, de \nla Resolución 003147 del 29 de diciembre de 2023, y por lo mismo se proceda a tener en \nconsideración la suma de TRESCIENTOS TREINTA Y CUATRO MILLONES SEISCIENTOS \nTRECE MIL DOSCIENTOS NOVENTA Y NUEVE PESOS ($334.613.299) como valor \nejecutado a la fecha, como parte del cumplimiento del Plan de Inversión forzosa de no menos \ndel 1% para el expediente LAM1226 direccionados al Banco de Hábitat del Meta. De este \nmodo, sin perjuicio del lenguaje empleado por la ANLA, se sugiere la siguiente redacción para \nel artículo recurrido: \n“ARTÍCULO PRIMERO. ACEPTAR para el proyecto “Oleoducto Cupiagua - Cusiana” la \nliquidación parcial de la inversión forzosa de no menos del 1%, la suma de TRESCIENTOS \nCUARENTA MILLONES SETECIENTOS TRES MIL SEISCIENTOS TREINTA Y TRES \nPESOS MCTE. ($340.703.633). para el periodo comprendido entre el año 2006 al 2022, de \nconformidad a las razones expuestas en la parte motiva del presente acto administrativo.”\n\nResolución No. 000670       Del 16 ABR. 2024          Hoja No. 16 de 26\n “POR LA CUAL SE RESUELVE UN RECURSO DE REPOSICIÓN”\nPágina 16 de 26\n“PARÁGRAFO TERCERO: El valor de los proyectos del Plan de Inversión de no menos del \n1% que se encuentran en ejecución, corresponde a la suma de TRESCIENTOS TREINTA Y \nCUATRO MILLONES SEISCIENTOS TRECE MIL DOSCIENTOS NOVENTA Y NUEVE \nPESOS ($334.613.299).”\n(…)”\n2.2\nArgumentos de la Sociedad.\n“(…)\n6.2\nMotivos de inconformidad frente a lo dispuesto en el Parágrafo Tercero del Artículo \nPrimero (1) de la Resolución No. 003147 del 29 de diciembre de 2023.\nEl artículo establece lo siguiente:\n“ARTÍCULO PRIMERO. ACEPTAR para el proyecto “Oleoducto Cupiagua - Cusiana” la liquidación \nparcial de la inversión forzosa de no menos del 1%, la suma de TRESCIENTOS CUARENTA \nMILLONES SETECIENTOS TRES MIL SEISCIENTOS TREINTA Y TRES PESOS MCTE. \n($340.703.633). para el periodo comprendido en el año 2006 al 2018 y año 2020, de conformidad a \nlas razones expuestas en la parte motiva del presente acto administrativo.”…\n“PARÁGRAFO TERCERO: El valor de los proyectos del Plan de Inversión de no menos del 1% que \nse encuentran en ejecución, corresponde a la suma de CERO PESOS MCTE. ($0).” \n6.2.1\nObjeto del recurso:\n6.2.1.1 De acuerdo con los fundamentos fácticos, técnicos y jurídicos que se presentan en este \nrecurso de reposición, OCENSA solicita se MODIFIQUE la decisión, y en consideración a \nello se proceda a APROBAR el monto que se encuentra en ejecución a la fecha para la \nobligación, el cual, asciende a la suma total de TRESCIENTOS TREINTA Y CUATRO \nMILLONES SEISCIENTOS TRECE MIL DOSCIENTOS NOVENTA Y NUEVE PESOS \n($334.613.299) \n\nResolución No. 000670       Del 16 ABR. 2024          Hoja No. 17 de 26\n “POR LA CUAL SE RESUELVE UN RECURSO DE REPOSICIÓN”\nPágina 17 de 26\n6.2.2\nConsideraciones de la ANLA: \n6.2.2.1 La ANLA basó su decisión específicamente conforme a lo dispuesto la página 16 de la \nResolución No. 003147 del 29 de diciembre de 2023 en la que manifiesta: “… De acuerdo \ncon lo anterior, se tiene que no hay avances claros y precisos acerca de la obligación de la \ninversión forzosa de no menos del 1% para el Expediente LAM1226, por lo tanto, la Sociedad \ndeberá reportar el avance de las actividades desarrolladas de manera específica en el área \ndestinada para cupos en el Banco de Hábitat del Meta asociadas al Expediente LAM1266 \npara dar cumplimiento a la obligación de la inversión forzosa de no menos del 1%, soportado \nademás en el Modelo de Almacenamiento Geográfico establecido en la Resolución 2182 del \n23 de diciembre de 2016 del Ministerio de Ambiente y Desarrollo Sostenible…”. \n6.2.3\nConsideraciones de la Compañía frente a las consideraciones de la ANLA:\n6.2.3.1 La decisión de la ANLA debe ser modificada por cuanto la entidad en el acto administrativo \nno está teniendo a consideración procesos y pronunciamientos relacionados con la \nevaluación de la obligación que se han adelantado de manera posterior al periodo evaluado \nen el concepto técnico 05533 del 13 de septiembre de 2022 (1 de enero de 2021 al 31 de \ndiciembre de 2021). \nDe acuerdo con lo anterior, en primera instancia OCENSA se permite relacionar que conforme al \nconcepto técnico 8141 del 23 de noviembre de 2023 acogido mediante Acta de Seguimiento 881 del \n30 de noviembre de 2023, en lo que respecta al seguimiento del Requerimiento No. 8 del Acta No. \n627 del 21 de septiembre de 2022, en el cual se solicitaba: “Reportar el avance de las actividades \ndesarrolladas de manera específica en el área destinada para cupos en el Banco de Hábitat del \nMeta, para el proyecto del expediente LAM1226 y dar cumplimiento a la obligación de inversión \nforzosa de no menos del 1%, soportado además en el Modelo de Almacenamiento Geográfico \nestablecido en la Resolución 2182 del 23 de diciembre de 2016. Lo anterior, en cumplimiento de los \nartículos segundo, tercero y cuarto de la Resolución 705 del 16 de abril de 2020.”, la Autoridad \nrelaciona que (página 164):\n“… [L]a Sociedad entregó en el ICA No. 20 con radicado ANLA 20236200170532 del 31 de mayo de \n2023 el “Informe de avance y respuesta a solicitudes de información – Hito 4”, del Banco de Hábitat \ndel Meta, el cual contiene las actividades de operación realizadas en el Banco de Hábitat del Meta \nasociadas al expediente LAM1226, de acuerdo con el plan de trabajo establecido, para el periodo \ncomprendido entre el 24 de enero de 2022 y el 23 de enero de 2023. En este informe, que para el \ncumplimiento de la obligación de inversión forzosa de no menos del 1%, el área destinada en el \nBanco de Hábitat del Meta para el expediente LAM1226 es de 9,54 ha”.\nSobre dicha información, la Autoridad hace el análisis de la obligación teniendo en cuenta la \nproyección del cronograma aprobado para la ejecución de la obligación, de esta manera, reconoce \nen la página 165 de dicho concepto técnico que “…en el informe de avance se señala que están \ndesarrollando acciones de restauración ecológica en 4,58 ha que corresponden a pastos limpios y \nherbazales…”. Además de esto, en la página 166 hace referencia a:\n“Adicionalmente, la Sociedad presenta en el documento con radicado ANLA 20236200170532 del \n31 de mayo de 2023 incluye con las actividades programadas y ejecutadas en el año 3, que \ncorresponde al año 2022, y que se relacionan a continuación:\n•\nAcciones de vigilancia.\n•\nDifusión de información sobre el área de conservación y restauración.\n\nResolución No. 000670       Del 16 ABR. 2024          Hoja No. 18 de 26\n “POR LA CUAL SE RESUELVE UN RECURSO DE REPOSICIÓN”\nPágina 18 de 26\n•\nMantenimiento de las siembras con plateos, liberación de enredaderas, resiembras y fertilización.\n•\nMantenimiento de cerramientos, amojonamiento, señalización y sendero.\n•\nPresentación de avances en las actividades de destinación de recursos a la autoridad ambiental\n•\nMonitoreo”\nCon lo cual, cierra el análisis de cumplimiento de la obligación dispuesta por medio del Requerimiento \nNo. 8 del Acta No. 627 del 21 de septiembre de 2022 mediante el siguiente pronunciamiento ([P]ágina \n166 del concepto técnico 8141 del 23 de noviembre de 2023):\n“Acorde con lo anteriormente señalado, se considera que la Sociedad cumplió con la entrega de \nla información solicitada, por lo que se recomienda al equipo jurídico dar por cumplido y \nconcluido el requerimiento.” (Negrilla por fuera del texto original). \nDe esta manera, OCENSA se permite aclarar que la solicitud de recurrir el parágrafo tercero del \nartículo primero de la Resolución 003147 del 29 de diciembre de 2023, se da en cuanto a que en el \nproceso de seguimiento de la obligación existe un pronunciamiento por parte de la ANLA, en donde \nse realizó una revisión de información más actualizada ([R]especto a la evaluada en el concepto \ntécnico 05533 del 13 de septiembre de 2022), mediante la cual se da alcance y cumplimiento a la \nconsideración de la ANLA para no tener en cuenta el valor ejecutado a la fecha respecto a la inversión \nforzosa de no menos del 1% concerniente al presente expediente y que se direcciona al Banco de \nHábitat del Meta.\nLa información en mención se relaciona específicamente en cuanto a que para la ANLA, de acuerdo \ncon la parte motiva de la Resolución No. 003147 del 29 de diciembre de 2023 “…[L]os avances de \nactividades reportadas por la Sociedad no son específicos para el área destinada a la inversión \nforzosa de no menos del 1% para el Expediente LAM1226, sino que son actividades generales \ndesarrolladas en el Banco de Hábitat del Meta, que además no están debidamente soportadas en el \nModelo de Almacenamiento Geográfico establecido por el Ministerio de Ambiente y Desarrollo \nSostenible en la Resolución 2182 de 2016. De esta manera, no es posible verificar el avance de \ndicha obligación” ([P]ágina 15), lo cual, como se resaltó anteriormente el equipo técnico de la ANLA \nmediante concepto técnico 8141 del 23 de noviembre de 2023 acogido mediante Acta de \nSeguimiento 881 del 30 de noviembre de 2023, que evalúa el ICA número 20 del expediente, \nrecomienda al equipo jurídico de esta misma entidad dar por cumplido y concluido el requerimiento \nNo. 8 del Acta No. 627 del 21 de septiembre de 2022, que cita “Reportar el avance de las actividades \ndesarrolladas de manera específica en el área destinada para cupos en el Banco de Hábitat del Meta, para el \nproyecto del expediente LAM1226 y dar cumplimiento a la obligación de inversión forzosa de no menos del 1%, \nsoportado además en el Modelo de Almacenamiento Geográfico establecido en la Resolución 2182 del 23 de \ndiciembre de 2016”, por cuanto se considera que la Sociedad cumplió con la entrega de la información \nsolicitada en la información asociada al ICA 20.\nDe esta forma, OCENSA entiende que al ser un pronunciamiento realizado por parte de la ANLA \nsobre el análisis de una información más reciente, se debe considerar como improcedente no tener \nen cuenta el monto ejecutado de la obligación de inversión forzosa de no menos del 1% a la fecha \npor consideraciones que respectan al ICA 19 ([S]eguimiento del expediente para el periodo \ncomprendido entre el 1 de enero de 2021 y 31 de diciembre de 2021) cuando estas ya han sido \naclaradas, cumplidas y concluidas con información allegada a la Autoridad por medio del ICA 20 \n([S]eguimiento del expediente para el periodo comprendido entre el 1 de enero de 2022 y 31 de \ndiciembre de 2022).\nEs importante tener a consideración que si bien se está dando claridad en cuanto a que el monto de \nejecución a la fecha asociado a la obligación de inversión forzosa de no menos del 1% para el \n\nResolución No. 000670       Del 16 ABR. 2024          Hoja No. 19 de 26\n “POR LA CUAL SE RESUELVE UN RECURSO DE REPOSICIÓN”\nPágina 19 de 26\nexpediente LAM1226, se debe considerar “[E]n ejecución” para la obligación, dado que se está \npresentando la información de seguimiento específica para el área asignada para esta al interior del \nBanco de Hábitat del Meta, la Autoridad mediante el literal c del Requerimiento No. 3 del concepto \ntécnico 8141 del 23 de noviembre de 2023 solicitó “Aclarar los montos relacionados en las \nreferencias de cliente 000150 244, 0001500269 y 0001502728 entregadas en el informe de detalle \nde transacciones y estado de cuenta ([R]adicado 2023066564-1-000 del 30 de marzo de 2023), qué \nvalor corresponde al expediente LAM1226, anexando los soportes técnicos y financieros ([F]actura, \ncontrato, documento equivalente, etc.).”, siendo esta la razón actual por la cual la ANLA no reconoce \ncomo “[E]n ejecución” los montos asociados en el marco del desarrollo de la obligación de inversión.\nEs así como a continuación OCENSA se permite responder a este requerimiento con el fin de que el \nmonto de ejecución sea tenido en cuenta en el marco del seguimiento de la obligación por parte de \nla ANLA.\nEn primera instancia, a pesar de que es un acuerdo entre privados y de interés exclusivo de las \npartes involucradas, en la Figura 1 se relaciona el pantallazo del acuerdo contractual Número \n3803291 que se suscribió entre OCENSA y el Patrimonio Autónomo (PA) Banco de Hábitat \nAdministrado por la Fiduciaria Bancolombia S.A ([E]n virtud del mandato otorgado por este a \nTERRASOS SAS administrador del Banco de Hábitat del Meta), en donde se da cuenta que bajo el \nobjeto de este, se encuentra amparadas la reserva y gestión de biodiversidad al interior del Banco \nde Hábitat del Meta para el cumplimiento de las obligaciones de inversión forzosa de no menos del \n1% que conciernen a los expedientes LAM 0318 y LAM 1226, los cuales, hace parte de proyectos \noperados por la compañía”.\n“Es por esta razón que los soportes de transacciones y estado de cuenta presentados por la \nSociedad mediante radicado 2023066564-1-000 del 30 de marzo de 2023, no representan única y \nexclusivamente el valor de la obligación de inversión forzosa de no menos del 1% asociada al \nexpediente LAM1226, sino que dichos pagos se relacionan con el cumplimiento de los hitos de pagos \nestablecidos en el contrato para los dos expedientes. \n\nResolución No. 000670       Del 16 ABR. 2024          Hoja No. 20 de 26\n “POR LA CUAL SE RESUELVE UN RECURSO DE REPOSICIÓN”\nPágina 20 de 26\nAhora bien, en el caso del expediente LAM 1226, con la actualización en los montos del Plan de \nInversión Forzosa no menos del 1% por valor de $ 340.703.633 (IVA incluido) y entendiendo que el \nvalor de un cupo es de $35.700.000 (IVA incluido), el número de cupos totales requeridos para \ncubrir la totalidad exacta de la inversión es de 9,54 cupos ([C]on decimales exactos en la siguiente \ntabla). Con el fin de corroborar la totalidad de cupos que responden a la obligación del 1%, se debe \nmultiplicar el número de cupos (9,5435191317) por el valor total de cada cupo ($35.700.000). En la \nsiguiente tabla se realiza la discriminación de los valores tanto de la inversión del 1% como del valor \ndel cupo incluyendo el valor antes y después del IVA”.\nEn ese sentido y con el fin de dar claridad a los montos ejecutados a la fecha en lo que respecta a \nla ejecución del plan de inversión forzosa de no menos del 1% del expediente LAM 1226, a \ncontinuación, se relacionan los pagos ejecutados a la fecha por OCENSA correspondiente a los \ncuatro (4) primeros años de ejecución del Plan de Inversión forzosa de no menos del 1% del \nexpediente LAM 1226. Estos pagos se han ejecutado de la siguiente manera:\n“Como soporte de la ejecución presupuestal, los anexos N°5, N°6 y N°7 son los mismos compartidos \ny remitidos a la autoridad ambiental previamente en el radicado 2023066564-1-000 del 30 de marzo \nde 2023, los cuales de igual manera fueron evaluados mediante el concepto técnico 8141 del 23 de \n\nResolución No. 000670       Del 16 ABR. 2024          Hoja No. 21 de 26\n “POR LA CUAL SE RESUELVE UN RECURSO DE REPOSICIÓN”\nPágina 21 de 26\nnoviembre de 2023 acogido mediante Acta de Seguimiento 881 del 30 de noviembre de 2023 y del \ncual surgió el Requerimiento No. 3. Mientras que los anexos N°1, N°2, N°3, N°4 y N°8 se presenta \npor primera vez a esta autoridad con el fin de tener una actualización real en la ejecución de los \npagos realizados al momento de la presentación de este recurso de reposición.\nEn estos anexos se encuentran las facturas de venta y comprobantes de egreso de los cuatro pagos \ndel contrato N°3803291 suscrito entre Patrimonio autónomo Banco de Hábitat y OCENSA. Es \nimportante mencionar que se entiende que para dar cierre y cumplimiento a la obligación del \nexpediente LAM 1226, al final del quinto (5) año de la obligación, se debe demostrar técnica y \nfinancieramente la ejecución total del valor del Plan de Inversión del 1%, por lo tanto, los cuatro \npagos generados actualmente, solo reflejan un avance en su ejecución y permite que para el año \nrestante de la obligación se generen posibles ajustes en los pagos con el fin de que al quinto (5) año \nse haya ejecutado el valor total ($340.703.633) de la obligación de Inversión forzosa de no menos \ndel 1%.\nEs importante aclarar y resaltar, que los valores que se presentan en la Tabla 2 corresponden a los \nvalores pagados por parte de la compañía al Patrimonio Autónomo correspondiente a la ejecución \ndel plan de inversión del 1% del expediente LAM 1226. Sin embargo, como se ha mencionado \nanteriormente, la compañía realiza un único pago por cada uno de los hitos de cumplimiento \nrelacionando a las dos obligaciones de los expedientes que se encuentran actualmente en desarrollo \nal interior del Banco de Hábitat del Meta (LAM 1226 y LAM 0318), dado que se cuenta con un único \nacuerdo contractual entre las partes para el desarrollo de las dos obligaciones, de ahí que las \nfacturas de las transacciones marcadas como egresos por parte de la compañía y las facturas \nemitidas por el Patrimonio Autónomo presente valores superiores a la obligación del expediente \nLAM1226.\nEn este sentido, con el ánimo de detallar el valor asociado a la ejecución de la obligación de inversión \ndel 1% del expediente LAM 1226, a continuación, se resalta en color rojo dentro de las facturas \nemitidas por el Patrimonio Autónomo los montos antes de IVA para cada uno de los hitos de pagos \nasociados a dicho expediente, los cuales concuerdan con exactitud con los presentados \nanteriormente en la Tabla 2. Es importante hacer mención que estas facturas se emiten por cuenta \ndel Patrimonio Autónomo BANCO DE HABITAT en virtud del mandato otorgado por este a \nTERRASOS SAS”\n\nResolución No. 000670       Del 16 ABR. 2024          Hoja No. 22 de 26\n “POR LA CUAL SE RESUELVE UN RECURSO DE REPOSICIÓN”\nPágina 22 de 26\n(…)”\n2.3\nConsideraciones de la Autoridad Nacional.\nA través del Concepto técnico 1746 del 26 de marzo de 2024, el equipo técnico de la \nAutoridad Nacional consideró:\n“(…)\nConsiderando los argumentos presentados por la Sociedad, es preciso aclarar en lo que respecta al \nrequerimiento 8 del Acta de Reunión de Control y Seguimiento Ambiental 627 del 21 de septiembre \nde 2022, el cual se dio por cumplido y concluido con el Acta 881 del 30 de noviembre de 2023 que, \nproducto del seguimiento, se le requirió a la Sociedad OLEODUCTO CENTRAL S.A. (OCENSA) que \npresentara en el Informe de Cumplimiento Ambiental (el ICA 20), lo siguiente: \n“REQUERIMIENTO No. 8. Reportar el avance de las actividades desarrolladas de manera \nespecífica en el área destinada para cupos en el Banco de Hábitat del Meta, para el proyecto \ndel expediente LAM1226 y dar cumplimiento a la obligación de inversión forzosa de no \nmenos del 1%, soportado además en el Modelo de Almacenamiento Geográfico establecido \n\nResolución No. 000670       Del 16 ABR. 2024          Hoja No. 23 de 26\n “POR LA CUAL SE RESUELVE UN RECURSO DE REPOSICIÓN”\nPágina 23 de 26\nen la Resolución 2182 del 23 de diciembre de 2016. Lo anterior, en cumplimiento de los \nartículos segundo, tercero y cuarto de la Resolución 705 del 16 de abril de 2020.”\nDicho requerimiento hace referencia al reporte de avance de las actividades de la inversión forzosa \nde no menos del 1%, de acuerdo con el cronograma aprobado, lo cual fue analizado en el concepto \ntécnico 8141 del 23 de noviembre de 2023 ([P]áginas 130 a 132 – 155 y 264), donde se consideró \nque para el periodo de seguimiento no se reportaron soportes financieros, lo que dio origen al \nrequerimiento 3, que correspondió a lo siguiente:\n“REQUERIMIENTO No. 3 \nc. Aclarar los montos relacionados en las referencias de cliente 0001500244, 0001500269 y \n0001502728 entregadas en el informe de detalle de transacciones y estado de cuenta \n(radicado 2023066564-1-000 del 30 de marzo de 2023), qué valor corresponde al expediente \nLAM1226, anexando los soportes técnicos y financieros ([F]actura, contrato, documento \nequivalente, etc.)”.\nEl literal c) del requerimiento 3 del Acta 881 del 30 de noviembre de 2023, precisa en sus \nconsideraciones que revisados los avances financieros presentados con el  radicado 2023066564-\n1-000 del 30 de marzo de 2023, estos reportan valores sin detallar el proyecto al cual corresponden; \ntampoco se identifica el objeto o la descripción de las actividades que soportan dichos pagos y, a su \nvez, la totalidad de las transacciones superan el valor con cargo a la inversión forzosa de no menos \ndel 1%, el cual corresponde a $340.703.633, por lo que se hizo necesario establecer el \nrequerimiento. \nAhora bien, frente al argumento con el cual la Sociedad presenta respuesta al requerimiento del Acta \n881 del 30 de noviembre de 2023, en el recurso de reposición objeto de análisis y señala “[C]on el \nfin de que el monto de ejecución sea tenido en cuenta en el marco del seguimiento de la obligación \npor parte de la ANLA” y detalla los montos que corresponden al proyecto LAM1226, se precisa que \nesta información será tenida en cuenta en el próximo seguimiento ambiental al proyecto, dado que \nel recurso de reposición no es la instancia jurídica para valorar o analizar información  que no se \nencontraba en el expediente previo a la Resolución 3147 del 29 de diciembre de 2023.\nAdemás, como se indicó en apartes anteriores, la Resolución 3147 del 29 de diciembre de 2023 \nconsideró un periodo y corte documental específico, que es anterior a la expedición del Concepto \nTécnico 8141 del 23 de noviembre de 2023, acogido por el Acta de Reunión de Control y Seguimiento \n881 del 30 de noviembre de 2023. \nPor lo anterior, no es posible acceder a la solicitud de modificación del parágrafo tercero del artículo \nprimero de la Resolución 3147 del 29 de diciembre de 2023 para considerar la suma de \nTRESCIENTOS TREINTA Y CUATRO MILLONES SEISCIENTOS TRECE MIL DOSCIENTOS \nNOVENTA Y NUEVE PESOS ($334.613.299) como valor ejecutado a la fecha, como parte del \ncumplimiento del Plan de Inversión forzosa de no menos del 1%. \n(…)”\nDicho lo anterior y como se indicó en el numeral 1.3 “Consideraciones de la Autoridad Nacional” \ndel presente acto administrativo, la Resolución 3147 del 29 de diciembre de 2023 acogió el \nconcepto técnico 5533 del 13 de septiembre de 2022, cuyo periodo de seguimiento \ncorresponde al Informe de Cumplimiento Ambiental - ICA 19 del Año 2021, presentado \nmediante comunicación con radicación 2022107968-1-000 del 31 de mayo de 2022 y corte \ndocumental del 26 de octubre de 2021 al 15 de agosto de 2022, (Correspondiente al período \n\nResolución No. 000670       Del 16 ABR. 2024          Hoja No. 24 de 26\n “POR LA CUAL SE RESUELVE UN RECURSO DE REPOSICIÓN”\nPágina 24 de 26\ndel 1 de enero de 2021 al 31 de diciembre de 2021), por tanto se consideró un periodo y \ncorte documental específico.\nDe conformidad con lo anterior y una vez evaluados los argumentos expuestos por la \nSociedad recurrente y en concordancia con las consideraciones señaladas en el Concepto \ntécnico 1746 del 26 de marzo de 2024, la Autoridad Nacional confirmará el contenido del \nparágrafo tercero del artículo primero de la Resolución 3147 del 29 de diciembre de 2023.\nRESUELVE\nARTÍCULO PRIMERO. Confirmar el contenido del parágrafo primero y del artículo primero \nde la Resolución 3147 del 29 de diciembre de 2023, de conformidad con lo expuesto en la \nparte motiva del presente acto administrativo.\nARTÍCULO SEGUNDO. Confirmar el contenido del parágrafo tercero del artículo primero \nde la Resolución 3147 del 29 de diciembre de 2023, de conformidad con lo expuesto en la \nparte motiva del presente acto administrativo.\nARTÍCULO TERCERO. Los demás términos, condiciones y obligaciones establecidas en \nla Resolución 3147 del 29 de diciembre de 2023 que no fueron objeto de pronunciamiento \nen el presente acto administrativo, continúan vigentes y exigibles en cualquier momento\nARTÍCULO CUARTO. Notificar el presente acto administrativo al representante legal, o al \napoderado debidamente constituido o a la persona debidamente autorizada de la Sociedad \nOLEODUCTO CENTRAL S.A. – OCENSA S.A., o a quien haga sus veces, de conformidad \ncon lo dispuesto en los artículos 67 y 69 del Código de Procedimiento Administrativo y de \nlo Contencioso Administrativo. \nPARÁGRAFO. En el evento en que el titular de la licencia o el permiso, según el caso, sea \nuna persona natural que se acoja al proceso de insolvencia regulado por las normas \nvigentes, o se trate de una sociedad comercial o de una sucursal de sociedad extranjera \nque entre en proceso de disolución o régimen de insolvencia empresarial o liquidación \nregulados por las normas vigentes, informará inmediatamente de esta situación a la \nAutoridad Nacional, con fundamento, entre otros, en los artículos 8, 58, 79, 80, 81, 95 \nnumeral 8 de la Constitución Política de 1991, en la Ley 43 de 1990, en la Ley 222 de 1995, \nen la Ley 1333 de 2009 y demás normas vigentes y jurisprudencia aplicable. \nAdicional a la obligación de informar a la Autoridad Nacional de tal situación, el titular de la \nlicencia o permiso aprovisionará contablemente las obligaciones contingentes que se \nderiven de la existencia de un procedimiento ambiental sancionatorio conforme con el \nartículo 40 de la Ley 1333 de 2009 o la norma que la adicione, modifique o derogue. \nARTÍCULO QUINTO. Por la Autoridad Nacional de Licencias Ambientales (ANLA), \ncomunicar el contenido del presente acto administrativo a la Corporación Autónoma \nRegional de la Orinoquía –CORPORINOQUIA, para su conocimiento y fines pertinentes.\nARTÍCULO SEXTO. Publicar la presente Resolución en la Gaceta Ambiental de la \nAutoridad Nacional de Licencias Ambientales (ANLA) de conformidad con lo señalado en el \nartículo 71 de la Ley 99 del 22 de diciembre de 1993.\n\nResolución No. 000670       Del 16 ABR. 2024          Hoja No. 25 de 26\n “POR LA CUAL SE RESUELVE UN RECURSO DE REPOSICIÓN”\nPágina 25 de 26\nARTÍCULO SÉPTIMO. Contra el presente acto administrativo no procede recurso alguno, \nde conformidad con lo establecido en el artículo 87 del Código de Procedimiento \nAdministrativo y de lo Contencioso Administrativo.\nNOTIFÍQUESE, COMUNÍQUESE, PUBLÍQUESE Y CÚMPLASE\nDado en Bogotá D.C., a los 16 ABR. 2024\nEDILBERTO PENARANDA CORREA\nASESOR\nERIKA LORENA PARRADO CEPEDA\nPROFESIONAL ESPECIALIZADO\nOSCAR GILBERTO GALVIS CAMACHO\nCONTRATISTA\nExpediente No. LAM1226\nConcepto Técnico 1746 del 26 de marzo de 2024\nFecha: 8 de abril de 2024\nProceso No.: 20241000006704\nNota: Este es un documento electrónico generado desde los Sistemas de Información de la ANLA. El original reposa en los \narchivos digitales de la Entidad\n\nResolución No. 000670       Del 16 ABR. 2024          Hoja No. 26 de 26\n “POR LA CUAL SE RESUELVE UN RECURSO DE REPOSICIÓN”\nPágina 26 de 26\n"
}