{
  "fuente": "ANLA_GACETA",
  "numero_resolución": "RESOLUCIÓN N° 000926",
  "fecha_resolución": "1993-09-30",
  "anio_resolucion": "1993",
  "nombre_proyecto": "diagnóstico,",
  "nombre_proyecto_normalizado": "DIAGNOSTICO",
  "ubicación": "departamento de Boyacá",
  "empresa": "ECOPETROL",
  "empresa_normalizada": "ECOPETROL",
  "numero_expediente": "LAM0232",
  "radicados": [
    "20236200786262",
    "20236200797852"
  ],
  "descripcion": "Por la cual se resuelve un recurso de reposición interpuesto en contra de la Resolución 2358 del 11 octubre de 2023",
  "tipos_infraccion": [
    "Vertimientos",
    "Manejo de aguas",
    "Incumplimiento del PMA"
  ],
  "tipos_infraccion_normalizados": [
    "VERTIMIENTOS",
    "MANEJO DE AGUAS",
    "INCUMPLIMIENTO DEL PMA"
  ],
  "pdf_id": "46377",
  "file_name": "ANLA_46377.pdf",
  "texto_completo": "República de Colombia\nMinisterio de Ambiente y Desarrollo Sostenible\nAUTORIDAD NACIONAL DE LICENCIAS \nAMBIENTALES\n- ANLA –\nRESOLUCIÓN N° 000926\n(20 MAY. 2024)\nPágina 1 de 74\n“Por la cual se resuelve un recurso de reposición interpuesto en contra de la \nResolución 2358 del 11 octubre de 2023”\nEL DIRECTOR DE LA AUTORIDAD NACIONAL DE LICENCIAS AMBIENTALES – \nANLA\nEn ejercicio de sus funciones legales, en especial de aquellas conferidas por medio de la \nLey 99 de 1993, el Decreto ley 3573 de 2011, el Decreto 376 de 2020, en armonía con las \nreglas del Decreto 1076 de 2015, y \nCONSIDERANDO:\nQue mediante Resolución 782 del 30 de septiembre de 1993, el Instituto Nacional de los \nRecursos Naturales Renovables y del Ambiente, (INDERENA), aprobó el Plan de \nMejoramiento Ambiental a la sociedad TEXAS PETROLEUM COMPANY para el proyecto \n“Campo de Producción Velásquez”, ubicado en jurisdicción del municipio de Puerto Boyacá \ndel departamento de Boyacá. \nQue mediante Resolución 885 del 8 de octubre de 1993, el INDERENA aclaró y modificó el \nartículo sexto de la Resolución 782 del 30 de septiembre de 1993, en el sentido de \nestablecer que contra el artículo primero y siguientes procede recurso de reposición. \nQue mediante Resolución 537 del 13 de diciembre de 1994, el Ministerio de Medio \nAmbiente, hoy Ministerio de Ambiente y Desarrollo Sostenible (en adelante el Ministerio), \nmodificó parcialmente el artículo primero de la Resolución 782 del 30 de septiembre de \n1993, en el sentido de incluir dentro del programa de reforestación, los afluentes y efluentes \nde la ciénaga Palagua y no autorizó la conducción de aguas de producción al río \nMagdalena. \nQue mediante la Resolución 412 del 12 de mayo de 1998, el Ministerio impuso a la sociedad \nla presentación de un Plan de Restauración para el proyecto “Campo de Producción \nVelásquez”, que incluyera todos los aspectos contemplados en el Plan de Mejoramiento \nestablecido en la Resolución 782 del 30 de septiembre de 1993. \n\nResolución No. 000926       Del 20 MAY. 2024          Hoja No. 2 de 74\n“Por la cual se resuelve un recurso de reposición interpuesto en contra de la \nResolución 2358 del 11 octubre de 2023” \nPágina 2 de 74\nQue por medio de la Resolución 707 del 30 de junio de 1998, el Ministerio resolvió el recurso \nde reposición interpuesto en contra de la Resolución 412 del 12 de mayo de 1998, en el \nsentido de confirmar en todas sus partes el acto administrativo recurrido. \nQue por medio de la Resolución 1134 del 3 de diciembre de 1998, el Ministerio autorizó la \ncesión del Plan de Restauración Ambiental (Resolución 412 del 12 de mayo de 1998), a \ncargo de la sociedad TEXAS PETROLEUM COMPANY en favor de la sociedad OMIMEX \nDE COLOMBIA LTD. \nQue mediante Resolución 905 del 8 de julio de 2005, el Ministerio impuso el Plan de Manejo \nAmbiental a la sociedad para la operación del Campo Velásquez, localizado en el municipio \nde Puerto Boyacá, en el departamento de Boyacá. \nQue mediante Resolución 1616 del 28 de octubre de 2005, el Ministerio resolvió un recurso \nde reposición interpuesto contra la Resolución 905 del 8 de julio del 2005, en el sentido de \nmodificar el numeral 6 del artículo segundo y requerir a la sociedad la presentación de \nanálisis mensuales en el efluente de la planta de tratamiento de aguas industriales.  \nQue mediante Resolución 99 del 18 de enero de 2007, el Ministerio modificó las \nResoluciones 1134 del 3 de diciembre de 1998 y 905 del 8 de julio de 2005, en el sentido \nde cambiar la razón social de la sociedad titular del Plan de Manejo Ambiental por el de \nMANSAROVAR ENERGY COLOMBIA LTD.\nQue mediante Resolución 2600 del 23 de diciembre de 2009, el Ministerio modificó la \nResolución 905 del 8 de julio de 2005, en el sentido de establecer a la sociedad los \nmonitoreos de los pozos sépticos a la entrada y salida de los mismos y la periodicidad de \npresentación de los Informes de Cumplimiento Ambiental (ICA). \nQue mediante Resolución 408 del 12 de abril de 2017, la Autoridad Nacional modificó la \nResolución 905 del 8 de julio de 2005, en el sentido de establecer la ubicación del proyecto \nde hidrocarburos Campo Velásquez, localizado en jurisdicción del municipio de Puerto \nBoyacá, departamento de Boyacá, el cual ocupa un área de 3.179 hectáreas; autorizar \nnuevas obras, entre otras. \nQue mediante Resolución 731 del 28 de junio de 2017, esta Autoridad Nacional resolvió el \nrecurso de reposición contra la Resolución 400 del 11 de abril de 2017, en el sentido de \nrevocar la Resolución 400 del 11 de abril de 2017 “Por la cual se modifica el Plan de Manejo \nAmbiental establecido mediante la Resolución 905 del 8 de julio de 2005”, entre otras \ndeterminaciones.\nQue mediante Resolución 2358 del 11 de octubre de 2023, esta Autoridad Nacional ajustó \nvía seguimiento el Plan del Manejo Ambiental del proyecto Campo Velásquez, establecido \nen el artículo décimo noveno de la Resolución 408 del 12 de abril de 2017, en el sentido de \naprobar la Ficha de Manejo 001 Impactos No Resueltos (INR), y se toman otras \ndeterminaciones.\nQue mediante comunicación 20236200786262 del 26 de octubre de 2023, la Sociedad \nMANSAROVAR ENERGY COLOMBIA LTD, interpuso recurso de reposición contra la \n\nResolución No. 000926       Del 20 MAY. 2024          Hoja No. 3 de 74\n“Por la cual se resuelve un recurso de reposición interpuesto en contra de la \nResolución 2358 del 11 octubre de 2023” \nPágina 3 de 74\nResolución 2358 del 11 de octubre de 2023, solicitando modificar el artículo segundo, \nespecíficamente: el literal d) del numeral 2, subnumerales ii y iii, literal a) del numeral 3,  \nliteral b) del numeral 3, literal d) del numeral 3, numeral 7 y numeral 9; y aclarar los \nnumerales 3 y 6 del artículo tercero y los artículos quinto, sexto y séptimo.\nQue mediante comunicación 20236200797852 del 27 de octubre de 2023, la Sociedad \nMANSAROVAR ENERGY COLOMBIA LTD, dio alcance al recurso de reposición contra la \nResolución 2358 del 11 de octubre de 2023, solicitando revocar el artículo cuarto.\nQue mediante Concepto Técnico 9059 del 19 de diciembre de 2023, esta Autoridad \nNacional realizó el análisis de los aspectos puestos en consideración del titular en el recurso \nde reposición.\nCOMPETENCIA DE LA AUTORIDAD NACIONAL DE LICENCIAS AMBIENTALES.\nQue mediante el artículo 2 de la Ley 99 de 1993, se dispuso la creación del Ministerio del \nMedio Ambiente, como el organismo rector de la gestión del medio ambiente y de los \nrecursos naturales renovables, encargado entre otras cosas de definir las regulaciones a \nlas que se sujetarán la conservación, protección, manejo, uso y aprovechamiento de los \nrecursos naturales renovables y el medio ambiente de la Nación, a fin de asegurar el \ndesarrollo sostenible, estableciendo en el numeral 15 del artículo 5, como una de sus \nfunciones, evaluar los estudios ambientales y expedir, negar o suspender la Licencia \nAmbiental correspondiente, en los casos que se señalan en el Título VIII de la ley precitada, \ncompetencia expresamente indicada en el artículo 52 de la misma norma. \nQue mediante el Decreto-ley 3570 de 2011, se modificaron los objetivos y la estructura del \nMinisterio de Ambiente y Desarrollo Sostenible y se advierte en su artículo 38, que todas \nlas referencias que hagan las disposiciones legales y reglamentarias vigentes en materia \nambiental al Ministerio de Ambiente, Vivienda y Desarrollo Territorial deben entenderse \nreferidas al Ministerio de Ambiente y Desarrollo Sostenible, si se relacionan con las \nfunciones asignadas en dicho Decreto a este último.\nQue por medio del Decreto-ley 3573 de 2011, se creó la Autoridad Nacional de Licencias \nAmbientales – ANLA., como entidad encargada de que los proyectos, obras o actividades \nsujetos a licenciamiento, permiso o trámite ambiental cumplan con la normativa ambiental, \nde tal manera que contribuyan al desarrollo sostenible ambiental del país. \nQue el mismo Decreto-ley 3573 de 2011, en su artículo tercero, numeral 2, le confiere a \nesta Autoridad Nacional, entre otras funciones, la de otorgar o negar las licencias, permisos \ny trámites ambientales de competencia del Ministerio de Ambiente y Desarrollo Sostenible, \nde conformidad con la ley y los reglamentos. \nQue por medio del artículo 2, numeral 2 del Decreto 376 del 11 de marzo de 2020, “Por el \ncual se modifica la estructura de la Autoridad Nacional de Licencias Ambientales ANLA”, se \nle atribuyó al Despacho de la Dirección General, entre otras, la función de suscribir los actos \nadministrativos que otorgan, niegan, modifican, ajustan o declaran la terminación de las \nlicencias, permisos y trámites ambientales.\n\nResolución No. 000926       Del 20 MAY. 2024          Hoja No. 4 de 74\n“Por la cual se resuelve un recurso de reposición interpuesto en contra de la \nResolución 2358 del 11 octubre de 2023” \nPágina 4 de 74\nA través del Decreto 1076 del 26 de mayo de 2015 el Gobierno Nacional expidió el Decreto \nÚnico Reglamentario del Sector Ambiente y Desarrollo Sostenible, cuyo objeto es compilar \nla normativa expedida por el Gobierno Nacional en ejercicio de las facultades \nreglamentarias conferidas por el numeral 11 del artículo 189 de la Constitución Política de \n1991, para la cumplida ejecución de las leyes del sector Ambiente. Ahora bien, el artículo \n3.1.2 de la Parte 1 del Libro 3 del citado Decreto, señala que el mismo rige a partir de su \npublicación en el Diario Oficial, hecho acaecido el día 26 de mayo de 2015 en razón a la \npublicación efectuada en el Diario Oficial N° 49523. \nQue de acuerdo con lo previsto en el parágrafo del artículo 2.2.2.3.9.1 del Decreto 1076 de \n2015 “Por medio del cual se expide el Decreto Único Reglamentario del Sector Ambiente y \nDesarrollo Sostenible”, la autoridad ambiental que otorgó la licencia ambiental o estableció \nel plan de manejo ambiental respectivo, será la encargada de efectuar el control y \nseguimiento a los proyectos, obras o actividades autorizadas. \nQue mediante la Resolución 1957 del 5 de noviembre de 2021, “Por la cual se adopta el \nManual Específico de Funciones y de Competencias Laborales para los empleos de la \nplanta de personal de la Autoridad Nacional de Licencias Ambientales - ANLA”, se señala \nque corresponde al director general la función de suscribir los actos administrativos que \notorgan, niegan, modifican, ajustan o declaran la terminación de las licencias, permisos y \ntrámites ambientales.\nQue en consideración a que el director general de la Autoridad Nacional de Licencias \nAmbientales -ANLA-, suscribió la Resolución 2358 del 11 de octubre de 2023, es el \nfuncionario competente para resolver el presente recurso de reposición interpuesto por la \nsociedad MANSAROVAR ENERGY COLOMBIA LTD., de conformidad con lo señalado en \nartículo 74 de la Ley 1437 de 2011.\nFUNDAMENTOS CONSTITUCIONALES Y LEGALES.\nQue el artículo 8 de la Constitución Política establece que \"Es obligación del Estado y de \nlas personas proteger las riquezas culturales y naturales de la nación\".\nQue la Constitución Política elevó a rango constitucional la obligación que tiene el Estado \nde proteger el medio ambiente, y el derecho que tienen todos los ciudadanos a gozar de un \nambiente sano y así mismo \"Es deber del Estado proteger la diversidad e integridad del \nambiente, conservar las áreas de especial importancia ecológica y fomentar la educación \npara el logro de estos fines.\" (Artículo 79 de la Constitución Política). El medio ambiente es \nun derecho colectivo que debe ser protegido por el Estado, estableciendo todos los \nmecanismos necesarios para su protección.\nQue el Estado debe planificar el manejo y aprovechamiento de los recursos naturales para \ngarantizar su desarrollo sostenible, su conservación, restauración o sustitución, tal y como \nlo establece el artículo 80 de la Constitución Política; razón por la cual la planificación se \ndebe realizar utilizando una serie de mecanismos que permitan analizar, evaluar y prever \n\nResolución No. 000926       Del 20 MAY. 2024          Hoja No. 5 de 74\n“Por la cual se resuelve un recurso de reposición interpuesto en contra de la \nResolución 2358 del 11 octubre de 2023” \nPágina 5 de 74\nunas circunstancias que faciliten la toma de decisión, con el fin de alcanzar un objetivo \npropuesto, en este caso, el Desarrollo Sostenible.\nQue el artículo 1º del Decreto ley 2811 de 1974 “Por el cual se dicta el Código Nacional de \nRecursos Naturales Renovables y de Protección al Medio Ambiente”, considera el ambiente \ncomo patrimonio común; de manera que el Estado y los particulares deben participar en su \npreservación y manejo, actividades calificadas como de utilidad pública e interés social; \nseñala dicho artículo, además, que la preservación y manejo de los recursos naturales \nrenovables también son de utilidad pública e interés social. \nQue según el artículo 3 de la Ley 99 de 1993, se entiende por desarrollo sostenible el que \nconduzca al crecimiento económico, a la elevación de la calidad de vida y al bienestar \nsocial, sin agotar la base de los recursos naturales renovables en que se sustenta, ni \ndeteriorar el medio ambiente o el de las generaciones futuras a utilizarlo para la satisfacción \nde sus propias necesidades.\nDEL RECURSO DE REPOSICIÓN.\nQue conforme las reglas del Procedimiento administrativo establecido en la Ley 1437 de \n2011 “Por la cual se expide el Código de Procedimiento Administrativo y de lo Contencioso \nAdministrativo”, el recurso de reposición constituye un instrumento legal mediante el cual la \nparte interesada tiene la oportunidad de ejercer el derecho de controvertir una decisión, \npara que la administración previa su evaluación, la confirme, aclare modifique o revoque, \nprevio el lleno de las exigencias legales establecidas para dicho efecto. \nQue frente al recurso de reposición, ha manifestado la doctrina: \n“El de reposición se ha considerado históricamente como recurso connatural al \nEstado de derecho; en especial al derecho fundamental a la controversia de toda \ndecisión administrativa. Se funda esta tesis en el criterio de que no existe acto \nadministrativo sin control. Se trata, pues, del más elemental de todos los recursos \npara garantizar el principio de la contradicción y el debido proceso”1\nQue la finalidad esencial del recurso de reposición no es otra distinta, que facultar al \nfuncionario de la administración que tomó una decisión administrativa para enmendar o \ncorregir un error, o los posibles errores que se hayan podido presentar en el acto \nadministrativo por él expedido, en ejercicio de sus funciones, o de confirmar la decisión \ntomada.\nREQUISITOS PARA SU PROCEDENCIA. \n1 Santofimio Gamboa Jaime Orlando. Tratado de derecho Administrativo, 4ta edición. Universidad \nExternado de Colombia, 1998, p. 266\n\nResolución No. 000926       Del 20 MAY. 2024          Hoja No. 6 de 74\n“Por la cual se resuelve un recurso de reposición interpuesto en contra de la \nResolución 2358 del 11 octubre de 2023” \nPágina 6 de 74\nQue es oportuno indicar algunos aspectos relacionados con las facultades de las \nautoridades administrativas en la expedición de los actos administrativos, mediante los \ncuales se resuelven recursos contra las decisiones de la administración.\nQue el procedimiento, oportunidad y requisitos para la interposición del recurso de \nreposición se encuentra regulado por el Código de Procedimiento Administrativo y de lo \nContencioso Administrativo, en los siguientes artículos:\n\"ARTICULO 74. Recursos contra los actos administrativos. Por regla general, contra \nlos actos definitivos procederán los siguientes recursos:\nEl de reposición, ante quien expidió la decisión, para que la aclare, modifique o \nrevoque.\n(…)\nARTICULO 76. Oportunidad y presentación. Los recursos de reposición y apelación \ndeberán interponerse por escrito en la diligencia de notificación personal, o dentro \nde los diez (10) días siguientes a ella, o a la notificación por aviso, o al vencimiento \ndel término de publicación, según el caso (…) \nLos recursos se presentarán ante el funcionario que dictó la decisión…”\nQue el artículo 77 del precitado Código señala:\n\"ARTICULO 77. Requisitos. Por regla general los recursos se interpondrán por \nescrito que no requiere de presentación personal sí quien lo presenta ha sido \nreconocido en la actuación. Igualmente, podrán presentarse por medios \nelectrónicos.\nLos recursos deberán reunir, además los siguientes requisitos:\n1.\nInterponerse dentro del plazo legal, por el interesado o su representante o \napoderado debidamente constituido.\n2.\nSustentarse con expresión concreta de los motivos de inconformidad.\n3.\nSolicitar y aportar las pruebas que se pretende hacer valer.\n4.\nIndicar el nombre y la dirección del recurrente, así como la dirección electrónica \nsi desea ser notificado por este medio. ( ... )”\nQue el artículo 80 del Código de Procedimiento Administrativo y de lo Contencioso \nAdministrativo, determina:\n\"ARTÍCULO 80. Decisión de los Recursos. Vencido el periodo probatorio, si a ello \nhubiere lugar, y sin necesidad de acto que así lo declare, deberá proferirse la \ndecisión motivada que resuelva el recurso.\n\nResolución No. 000926       Del 20 MAY. 2024          Hoja No. 7 de 74\n“Por la cual se resuelve un recurso de reposición interpuesto en contra de la \nResolución 2358 del 11 octubre de 2023” \nPágina 7 de 74\nLa decisión resolverá todas las peticiones que hayan sido oportunamente \nplanteadas y las que surjan con motivo del recurso.\"\nQue la Resolución 2358 del 11 de octubre de 2023, es un proveído susceptible de ser \nrecurrido, según el artículo 74 de la Ley 1437 de 2011, puesto que se trata de un acto \ndefinitivo en la medida en que adopta una decisión que manifiesta la voluntad del Estado y \nes generadora de efectos jurídicos que, en los términos del Consejo de Estado, tal como lo \nseñaló en sentencia de la Sección Tercera de la Sala de lo Contencioso Administrativo del \n8 de marzo de 2012, se caracteriza por lo siguiente:\n“… los actos definitivos ponen fin de manera perentoria a la actuación administrativa \nsea de oficio o impulsada a petición de parte, de modo que en ellos se agota la \nactividad de la administración, o tan sólo queda pendiente la ejecución de lo \ndecidido. Ahora bien, es cierto que los únicos actos susceptibles de la Acción \nContenciosa Administrativa son los actos definitivos, es decir que se excluyen los \nde trámite, pues éstos se controlan jurisdiccionalmente como parte integrante del \nacto definitivo y conjuntamente con éste, es decir de aquel que cierra la actuación \nadministrativa.”\nQue al amparo de lo antes expuesto, se procede a revisar si el recurso de reposición \ninterpuesto y que es objeto de este pronunciamiento administrativo, ha cumplido los \nrequisitos legales que lo rigen para efectos de proceder a su decisión de fondo:\nQue la Resolución 2358 del 11 de octubre de 2023, fue notificada a MANSAROVAR \nENERGY COLOMBIA LTD. mediante correo electrónico el 12 de octubre de 2023 y el \nrecurso de reposición fue interpuesto por la Sociedad el 26 de octubre de 2023, mediante \nla comunicación con radicado 20236200786262, y dio alcance a dicho recurso por medio \nde la comunicación con radicado 20236200797852 del 27 de octubre de 2023; es decir, \ndentro del término de diez (10) días hábiles siguientes a la fecha de la citada notificación, \nobservando así, el requisito de oportunidad legal para su interposición.\nQue el recurso de reposición fue interpuesto por el doctor JORGE HERNÁN GUTIERREZ \nHERNÁNDEZ, en su calidad de representante Legal para asuntos judiciales y \nadministrativos de la sociedad MANSAROVAR ENERGY COLOMBIA LTD., quien se \nencuentra facultado según escritura pública 1673 del 14 de junio de 2011, de la Notaría \nTreinta del círculo de Bogotá D.C., registrada en el certificado de existencia de \nrepresentación legal expedido por la Cámara de Comercio de Bogotá, de fecha 17 de \noctubre de 2023, que se adjunta al recurso interpuesto, verificándose así, la legitimidad por \nactiva para impulsar dicho recurso en representación de la titular de la Licencia Ambiental; \nse verificó, además, que el escrito contiene los motivos de inconformidad y dirección de \nnotificaciones, cumpliéndose así los requisitos expuestos en el artículo 77 de la Ley 1437 \nde 2011. \nQue una vez verificado el cumplimiento de los requisitos legales establecidos en la \nnormativa vigente para la procedencia del recurso de reposición, se efectuará el análisis de \nfondo de los motivos de inconformidad del recurrente, tal y como se expone a continuación:\n\nResolución No. 000926       Del 20 MAY. 2024          Hoja No. 8 de 74\n“Por la cual se resuelve un recurso de reposición interpuesto en contra de la \nResolución 2358 del 11 octubre de 2023” \nPágina 8 de 74\nCONSIDERACIONES DE LA AUTORIDAD NACIONAL DE LICENCIAS \nAMBIENTALES.\nQue a continuación, se realiza el análisis y las consideraciones de la Autoridad Nacional de \nLicencias Ambientales, en respuesta al recurso de reposición, presentado por el apoderado \nde la sociedad MANSAROVAR ENERGY COLOMBIA LTD., mediante comunicación con \nradicado 20236200786262 del 26 de octubre de 2023, cuyo petitum consistió en que se \n“REPONGA en el sentido de MODIFICAR Y/O PRECISAR la decisión contenida en la \nResolución No 2358 del 11 de octubre de 2023, de manera concreta:\nModificar el artículo segundo, específicamente:\n•\nLiteral (d) del numeral 2 del artículo segundo.\n•\nSubnumerales ii y iii, literal (a) del numeral 3 del artículo segundo. \n•\nLiteral (b) del numeral 3 del artículo segundo.\n•\nLiteral (d) del numeral 3 del artículo segundo.\n•\nNumeral 7 del artículo segundo. \n•\nNumeral 9 del artículo segundo\nPrecisar los numerales 3 y 6 del artículo tercero y los artículos quinto, sexto y séptimo.”\nQue dando alcance al recurso de reposición, la Sociedad solicitó mediante comunicación \ncon radicado 20236200797852 del 27 de octubre de 2023, que esta Autoridad Nacional \n“REPONGA en el sentido de REVOCAR la decisión contenida en el artículo cuarto de la \nResolución No 2358 del 11 de octubre de 2023.”\nQue para resolver se indicará, en primer lugar, la petición elevada por la recurrente; \nposteriormente, los argumentos o motivos de inconformidad del recurso y seguido ello, las \nconsideraciones de esta Autoridad frente a cada argumento, con el objeto de adoptar las \ndecisiones de fondo.\nQue se debe precisar que si bien escrito del recurso de reposición presentado por la \nSociedad, en el título 4.2. Argumentos Técnicos. 4.2.1. del título segundo hizo referencia al \nAuto 2358 de 2023, el acto administrativo objeto de recurso es la Resolución 2358 del 11 \nde octubre de 2023, así como el propio escrito lo señala en el capítulo V. Petición y se hizo \nmención anteriormente.\n1.\nOBLIGACIÓN RECURRIDA – LITERAL D) DEL NUMERAL 2 DEL ARTÍCULO \nSEGUNDO.\nEl acto administrativo, señala:\n“ARTÍCULO SEGUNDO. La sociedad MANSAROVAR ENERGY COLOMBIA LTD., \ndeberá realizar los siguientes ajustes a la ficha aprobada en el artículo primero de \nesta Resolución, y en el término de dos (2) meses contados a partir de la ejecutoria \nde este acto administrativo, presentar los ajustes de las actividades señalados a \ncontinuación:\n\nResolución No. 000926       Del 20 MAY. 2024          Hoja No. 9 de 74\n“Por la cual se resuelve un recurso de reposición interpuesto en contra de la \nResolución 2358 del 11 octubre de 2023” \nPágina 9 de 74\n2. Ajustar la Actividad 1 en el sentido de incluir las siguientes actividades:\nd) Informes Bimensuales de avance hasta que se declare el cierre y/o recuperación \nde los INR en donde se incluirá como mínimo: \ni. Avances realizados en el diagnóstico y monitoreo en unidades de volumen y \nárea por cada INR y por la suma de todos los INR.\nii. Informes, reportes y soportes de laboratorio, resoluciones de acreditación de \nlaboratorios. \niii. Mapas de contornos.\niv. Análisis gráfico y estadístico de los diferentes parámetros monitoreados por \ncada INR, haciéndolo de forma multitemporal para los análisis estadísticos. \nv. Explicación técnica de los criterios y la metodología usada para la delimitación \nvertical y lateral del monitoreo realizado en pro garantizar la representatividad de \nla red de monitoreo en cada predio diagnosticado y como se define la densidad \nde puntos o apiques a realizar para el monitoreo.” (Subrayado fuera de texto).\nPetición de la Sociedad. \nLa Sociedad en el Recurso de Reposición presentado mediante comunicación con radicado \nANLA 20236200786262 del 26 de octubre de 2023, solicitó:\n“MANSAROVAR propone una periodicidad semestral para la presentación de \ninformes. Esta frecuencia propuesta permitirá evaluar los indicadores de gestión de \nimpactos no resueltos de manera eficaz”.\nArgumentos de la Sociedad. \nSegún lo enunciado en el recurso de reposición, la Sociedad, argumenta lo siguiente:\n“Mansarovar, con base a las tecnologías presentadas por los especialistas en manejo \nde tratamiento en procesos de diagnóstico y remediación de áreas, considera que la \nperiodicidad bimensual (2 veces por mes cada 15 días) propuesta por la Autoridad \nNacional de Licencias Ambientales para la presentación de informes de avance, no \nes eficiente para el análisis de datos y evaluación del avance de la gestión integral \nde impactos no resueltos, esto, debido a que los informes en periodos de tiempo tan \ncortos aportarían pocos o nulos cambios representativos para evidenciar avances y \nevaluar el proceso de gestión.\nLa presentación de informes donde se relacione el estado y avance en todas las fases \ndel proyecto, incluyendo el diagnóstico, remediación y cierre de los INR es \nprocedente, sin embargo, la periodicidad de entrega de dichos informes debe de tal \nmanera que se logre apreciar avances significativos de todos los hitos que conforman \nla gestión de INR, tales como monitoreos, prospección geológica, estudios \ngeofísicos, modelamientos para dimensionamiento de áreas y volúmenes, estudios \nambientales, sondeos de alterativas de tecnologías, licitaciones, procesos de \nremediación y cierre.”\n\nResolución No. 000926       Del 20 MAY. 2024          Hoja No. 10 de 74\n“Por la cual se resuelve un recurso de reposición interpuesto en contra de la \nResolución 2358 del 11 octubre de 2023” \nPágina 10 de 74\nConsideraciones Técnicas y Jurídicas de la ANLA. \nQue frente a lo anterior, esta Autoridad Nacional consideró en el Concepto Técnico 9059 \ndel 19 de diciembre de 2023, lo siguiente:\n“Frente a los argumentos presentados por la Sociedad frente al Literal d del Numeral \n2 del Artículo 2 esta Autoridad Nacional se permite aclarar en primera medida que las \nactividades establecidas en dicho Literal corresponden a acciones de diagnóstico que \nno implican la remediación y tratamiento, adicionalmente se aclara que la frecuencia \nde entrega de informes de avance hasta la declaración de cierre y/o recuperación de \nlos Impactos No Resueltos (INR) es del orden de un informe cada dos meses, lo cual \nno es equivalente a la entrega de estos dos (2) veces por mes, cada 15 días o dos \n(2) veces cada quince (15) días como es posible que se indique en los argumentos \nexpuestos, sino a una entrega cada dos meses.\nPor otra parte, la Sociedad señala que dicha frecuencia (sobre la cual se aclara que \nla periodicidad de entrega es cada dos meses) es insuficiente para el análisis de datos \ny evaluación del avance de la gestión integral de impactos no resueltos argumentando \nque “(…) los informes en periodos de tiempo tan cortos aportarían pocos o nulos \ncambios representativos para evidenciar avances y evaluar el proceso de gestión (…)”\nNo obstante, las actividades relacionadas con la compilación de datos del monitoreo \nde parámetros, con los respectivos informes y soportes son actividades que \ncorresponden al laboratorio prestador del servicio y no a la Sociedad como tal.  \nAdicionalmente, el reporte del área o volumen avanzado en monitoreos y diagnóstico \nes una actividad puntual que implica una sumatoria u operaciones matemáticas que \nsi bien deben contar con la información reportada por los laboratorios contratados se \npuede realizar en el orden de días o semanas. Por otra parte, la explicación técnica \nde los criterios y la metodología usada para la delimitación vertical y lateral del \nmonitoreo es una actividad puntual para cada predio la cual no debe estarse \nactualizando con frecuencia.\nRespecto a la propuesta de periodicidad semestral para la presentación de informes \nde diagnóstico y monitoreo como se propone por parte de la Sociedad esta Autoridad \nNacional, se permite recordar que, a tiempos de esta respuesta, la fecha del plazo \nmáximo para la remediación de áreas, la cual fue establecida en el Numeral 2 del \nArtículo segundo del Auto 12084 de 21 de diciembre de 2020 y corresponde al primero \nde diciembre de 2024, se encuentra a menos de un año. Por lo anterior, un informe \nde diagnóstico y monitoreo cada seis meses no permite hacer y realizar un \nseguimiento adecuado por parte de esta Autoridad Nacional respecto del avance de \nestos, así como generar alertas tempranas que se materialicen en ajustes de proceso. \nAdicionalmente, considerando que dicho plazo se encuentra a menos de un año las \nactividades realizadas en un periodo de dos (2) meses no deben corresponder a \npocos o nulos cambios o avances en la remediación o gestión de INR como se señala \npor parte de la Sociedad. Considerando lo anterior, esta Autoridad se permite \nmanifestar que no acepta la propuesta periodicidad semestral para la presentación de \ninformes de avance de remediación como se propone por parte de la Sociedad.\n\nResolución No. 000926       Del 20 MAY. 2024          Hoja No. 11 de 74\n“Por la cual se resuelve un recurso de reposición interpuesto en contra de la \nResolución 2358 del 11 octubre de 2023” \nPágina 11 de 74\nSin embargo, considerando que sobre la información entregada por el laboratorio se \ndebe realizar una interpretación de datos a partir de métodos estadísticos y que \nadicionalmente la Sociedad manifiesta su objetivo de realizar estudios geofísicos y \nmodelamientos para dimensionamiento de áreas y volúmenes, esta Autoridad \nNacional considera que es pertinente conceder un (1) mes adicional al plazo \nestablecido cambiando el plazo de entrega de los informes de diagnóstico y monitoreo \ndetallados en el Literal d del Numeral 2 del Artículo Segundo de la Resolución 2358 \ndel 11 octubre de 2023 de cada dos (2) meses a cada tres (3) meses.”\nQue esta Autoridad encuentra procedente modificar la periodicidad de presentación de los \ninformes de diagnóstico y monitoreo, pero no conforme la propuesta presentada por la \nSociedad, pues, como quiera que el Concepto Técnico 9059 del 19 de diciembre de 2023 \nconsideró que, tratándose de informes de avance sin que ello deba evidenciar cambios \nsignificativos, como si el seguimiento efectivo por parte de la Autoridad Nacional, el literal \nd) del numeral 2 del artículo segundo de la Resolución 2358 del 11 octubre de 2023, se \nprocederá a adicionar un mes al tiempo de cumplimiento de la medida, esto es, a la \nactividad 1 de la FICHA 001 IMPACTOS NO RESUELTOS (INR) CAMPO VELÁSQUEZ, la \ncual quedará con la presentación de Informes trimestrales de avance hasta que se declare \nel cierre y/o recuperación de los INR.\n2.\nOBLIGACIÓN RECURRIDA – SUBNUMERALES II Y III DEL LITERAL A DEL \nNUMERAL 3 DEL ARTÍCULO SEGUNDO. \nEl acto administrativo recurrido señala:\n“ARTÍCULO SEGUNDO. La sociedad MANSAROVAR ENERGY COLOMBIA LTD \ndeberá realizar los siguientes ajustes a la ficha aprobada en el artículo primero de \nesta Resolución, y en el término de dos (2) meses contados a partir de la ejecutoria \nde este acto administrativo, presentar los ajustes de las actividades señalados a \ncontinuación:\n(…)\n3. Ajustar la Actividad 2 denominada recuperación áreas afectadas en el sentido de \nincluir las siguientes actividades: \na) Diagnóstico y remediación de nuevos Impactos No Resueltos - INR:\n(…)\nii. Para nuevas quejas o identificaciones organolépticas de contaminación el \ndiagnóstico y monitoreo debe iniciarse en un plazo de dos meses de radicada \ny/o reportada la queja o la identificación organoléptica de la contaminación y la \nremediación debe iniciarse tan pronto sea terminado el diagnóstico y monitoreo. \niii. El cierre de los nuevos Impactos No Resueltos -INR no debe superar los \ntiempos otorgados por la Autoridad Ambiental en otras disposiciones”.\n\nResolución No. 000926       Del 20 MAY. 2024          Hoja No. 12 de 74\n“Por la cual se resuelve un recurso de reposición interpuesto en contra de la \nResolución 2358 del 11 octubre de 2023” \nPágina 12 de 74\nPetición de la sociedad. \nLa Sociedad en el recurso de reposición presentado mediante comunicación con radicado \nANLA 20236200786262 del 26 de octubre de 2023, solicitó:\n“(…)\n(En relación con los términos otorgados) MANSAROVAR propone que el tiempo este \nde conformidad con la tecnología aplicable en la cual se presentará un plan detallado \nde trabajo que involucre aspectos técnicos, ecológicos, sociales, legales. Dicho plan \nserá avalado por la autoridad, quien realizará el respectivo seguimiento y control en \nlas visitas de seguimiento de esta Autoridad.\nEl mencionado plan detallado de trabajo se actualizará semestralmente con el objeto \nde incluir, si aplica, cambios en las diferentes fases del proyecto: diagnóstico, \ntratamiento y cierre de INR.”\nArgumentos de la Sociedad.\nLa Sociedad argumenta en su solicitud de modificación de este artículo como se señala a \ncontinuación:\n“La sociedad se permite precisar lo siguiente: En relación con los términos otorgados \nen otras disposiciones para el cierre de los denominados impactos no resueltos, se \ncuenta con el auto 7536 del 07 de septiembre de 2022, el cual establece:\n (…)\nTal como se observa, el literal (b) del numeral 1 del artículo cuarto del Auto 7536, (en \nel que) se estableció un tiempo máximo de 24 meses para la recuperación ambiental \nde aquellos impactos que se confirmen como INR en la fase de diagnóstico.\nMANSAROVAR considera que el tiempo de 24 meses para remediación no es viable \na nivel técnico, teniendo en cuenta las razones que se exponen a continuación:\n \n•\nLas zonas con posible presencia de impactos no resueltos o áreas sospechosas \ncorresponden a zonas de bajo inundable colmatadas y pantanosas, de difícil \nacceso y alta complejidad para movilizarse en su interior. Teniendo en cuenta \nestas características, una de la tecnología que mejor se podría ajustar para su \ntratamiento de este tipo de áreas es la de Bioventeo, un tipo de remediación In \nsitu que consiste en la ventilación forzada del suelo mediante la inyección a \npresión de oxígeno (aire) y fluidos en la zona saturada y no saturada del suelo a \ntravés de pozos de inyección para degradar los hidrocarburos pesados y livianos \nque se encuentran en fracción libre en suelos, sedimentos, agua y vegetación. \nEn esta técnica remediativa, los microorganismos presentes en los productos de \nremediación descomponen las cadenas de hidrocarburo, estos procesos de \nbiodegradación son lentos y requieren control de vigilancia a largo plazo para \nverificar que las concentraciones disminuyan, se garantice la eficacia en la \nreducción de concentración de hidrocarburos y se cumpla con los objetivos de \n\nResolución No. 000926       Del 20 MAY. 2024          Hoja No. 13 de 74\n“Por la cual se resuelve un recurso de reposición interpuesto en contra de la \nResolución 2358 del 11 octubre de 2023” \nPágina 13 de 74\nremediación y seguimiento para el cierre del área. Sumado a esto, existen \nfactores ambientales y climáticos que influyen directamente en mayores tiempos \nde degradación de hidrocarburos, entre estos, temperatura, humedad y pH.\n•\nEl proyecto requiere el desarrollo de un programa de control y seguimiento, lo \ncual implica la toma de muestras, análisis e interpretación de resultados de \nlaboratorio. Este programa aplica a todas las fases del proyecto desde la etapa \nde remediación hasta el cierre del posible impacto no resuelto y demanda una \nparte importante del tiempo de tratamiento.\n•\nCampo Velásquez cuenta con un área licenciada extensa, dentro de la cual se \nubican que revisten cierta complejidad, por lo tanto, se requieren labores \nadministrativas como análisis financiero, sondeos de alternativas de tecnologías, \nprocesos licitatorios, análisis legal y de negociación de predios, gestión social. \nEstos pasos administrativos demandan tiempo dentro de la planeación, \nintervención y cierre de los potenciales INR.\n•\nActualmente existen predios que son propiedad de CHEVRON PETROLEUM \nCOMPANY (La antigua Texas Petroleum Company) los cuales no fueron \nentregado a OMIMEX DE COLOMBIA LTD y a MANSAROVAR. MANSAROVAR \nestá realizando un análisis de información geográfica, encontrando que varios de \nellos se encuentran superpuestos en áreas con potencial presencia de impactos \nno resueltos o áreas sospechosas. La situación descrita representa un punto \nclave a la hora de definir tiempos y plazos de tratamiento. MANSAROVAR \nrequiere desarrollar los estudios de títulos prediales y, mientras no se aclare este \npunto, MANSAROVAR no puede intervenir estas áreas para los respectivos \nmonitoreos, diagnósticos. Se anexa Escritura Pública Nº 1602 de 2014 y archivo \nKMZ con la información geográfica de áreas con posible presencia de INR que \nse superponen en predios propiedad de CHEVRON PETROLEUM COMPANY \n(La antigua Texas Petroleum Company)”.\nConsideraciones Técnicas y Jurídicas de la ANLA. \nQue frente a lo anterior, esta Autoridad Nacional consideró en el Concepto Técnico 9059 \ndel 19 de diciembre de 2023, lo que se señala a continuación:\n“Frente a los argumentos presentados por la Sociedad frente al subnumeral ii del \nLiteral a del Numeral 3 del Artículo Segundo de la Resolución 2358 del 11 octubre de \n2023, esta Autoridad Nacional se permite presentar las siguientes observaciones:\nRespecto a que “cada proceso de tratamiento durara el tiempo que técnicamente sea \nviable de acuerdo con la tecnología a seleccionar ya las variables mencionadas” esta \nAutoridad Nacional aclara que dicho subnumeral hace referencia exclusivamente al \ninicio de las labores de remediación las cuales deben realizarse tan pronto sea \nterminado el diagnóstico y monitoreo.\nFrente a la propuesta de que “el tiempo este de conformidad con la tecnología \naplicable en la cual se presentara un plan detallado de trabajo que involucre aspectos \ntécnicos, ecológicos, sociales, legales” la ANLA considera que no se encuentran \n\nResolución No. 000926       Del 20 MAY. 2024          Hoja No. 14 de 74\n“Por la cual se resuelve un recurso de reposición interpuesto en contra de la \nResolución 2358 del 11 octubre de 2023” \nPágina 14 de 74\nargumentos sobre las razones que justifican esta propuesta, razón por la cual no \nexiste un fundamento sobre el cual evaluar la pertinencia de esta.\nPor otra parte, en el análisis que esta Autoridad Nacional hace de los argumentos \nexpuestos por la Sociedad frente al subnumeral de referencia no se encuentran \nargumentos sobre la insuficiencia o imposibilidad de cumplir con la obligación de que \n“Para nuevas quejas o identificaciones organolépticas de contaminación el \ndiagnóstico y monitoreo debe iniciarse en un plazo de dos meses de radicada y/o \nreportada la queja o la identificación organoléptica de la contaminación y la \nremediación debe iniciarse tan pronto sea terminado el diagnóstico y monitoreo” por \nlo cual no encuentra un fundamento sobre el cual manifestarse contrario al tiempo ya \nestablecido. Por lo anterior, esta Autoridad Nacional manifiesta que no acepta la \npropuesta de modificación presentada por la Sociedad respecto al subnumeral ii del \nLiteral a del Numeral 3 del Artículo Segundo de la Resolución 2358 del 11 octubre de \n2023.\nEn relación con los planteamientos presentados por la Sociedad frente al subnumeral \niii del Literal a) del Numeral 3 del Artículo Segundo de la Resolución 2358 del 11 \noctubre de 2023 esta Autoridad Nacional se permite presentar las siguientes \nobservaciones.\nFrente al subnumeral iii de igual manera que frente al subnumeral ii, la Sociedad \npropone que “Considerando estas premisas, cada proceso de tratamiento durará el \ntiempo que técnicamente sea viable de acuerdo con la tecnología a seleccionar ya las \nvariables mencionadas. MANSAROVAR propone que el tiempo este de conformidad \ncon la tecnología aplicable en la cual se presentara un plan detallado de trabajo que \ninvolucre aspectos técnicos, ecológicos, sociales, legales. Dicho plan será avalado \npor la autoridad, quien realizará el respectivo seguimiento y control en las visitas de \nseguimiento de esta Autoridad” haciendo referencia a lo establecido en el Auto 7536 \ndel 7 de septiembre de 2022.\nPor las anteriores razones, esta Autoridad Nacional se permite manifestar que no \nacepta la propuesta presentada por parte de la Sociedad frente a los subnumerales ii \ny iii del Literal a del Numeral 3 del Artículo Segundo de la Resolución 2358 del 11 \noctubre de 2023.”\nDe conformidad con lo indicado en el Concepto Técnico 909 del 19 de diciembre de 2023, \nse debe aclarar a la sociedad que la obligación recurrida hace referencia al diagnóstico y \nremediación de nuevos impactos no resueltos y en ese sentido no se encuentra coherencia \nentre la solicitud de modificar los subnumerales ii y iii del Literal a) del numeral 3 del Artículo \nSegundo de la Resolución 2358 del 11 octubre de 2023 y los argumentos expuestos en el \nescrito del recurso. \nEl Auto 7536 del 7 de septiembre de 2022, expuesto por la Sociedad en sus argumentos, \nes un acto administrativo ejecutoriado, en el cual esta Autoridad Nacional requirió a la \nSociedad a realizar actividades de remediación y diagnóstico posremediación para áreas o \npredios del proyecto en las que se tuviese la confirmación de la existencia de grasas, \naceites e hidrocarburos o, Impactos No Resueltos confirmados por MANSAROVAR \n\nResolución No. 000926       Del 20 MAY. 2024          Hoja No. 15 de 74\n“Por la cual se resuelve un recurso de reposición interpuesto en contra de la \nResolución 2358 del 11 octubre de 2023” \nPágina 15 de 74\nENERGY COLOMBIA LTD. Dicha actividad de remediación y diagnóstico no debía \nextenderse más allá de 24 meses. \nEs necesario advertir que no procede la revisión del Auto 7536 del 7 de septiembre de 2022 \npor vía de este recurso dado que como lo han señalado en diversas oportunidades nuestras \naltas cortes: \n“(…) Ahora bien, los motivos de inconformidad planteados mediante el recurso de \napelación deben guardar correspondencia con el fallo recurrido, esto es, con las \nconsideraciones expuestas por el juez de primera instancia que determinaron una \ndecisión total o parcialmente adversa a los intereses de quien apela. La sentencia \nproferida por el juez de lo contencioso administrativo, a su turno, debe ser motivada \ny resolver todos los puntos objeto de controversia formulados por las partes \ndemandante y demandada dentro de la oportunidad procesal respectiva.  En este \nsentido, a la luz de lo establecido en el artículo 170 del C.C.A., debe concluirse que \nla sentencia proferida por el juez de lo contencioso administrativo no puede ser infra, \nextra o ultra petita, sino, en virtud de la naturaleza predominantemente rogada de la \njurisdicción, sujetarse a todos y cada uno de los aspectos sometidos a su decisión.  \n(…)” Consejo de Estado Sala de lo Contencioso Administrativo- Sección Segunda. \nRadicado No. 25000-23-25-000-2002-12297-01 de mayo de 2010.\nPor su parte el tratadista Carlos Jaramillo Betancur en su libro “Derecho procesal \nadministrativo”, señaló:\n“(…) Al contrario de los procesos laborales a los cuales asimila el demandante su \nasunto, el ejercicio de la función judicial en materia contencioso administrativa, la \ncompetencia del juez al momento de fallar no le permite decidir ultra petita o extra \npetita, porque la resolución judicial que se extienda más allá de lo pedido o que se \ntome fuera del petitum de la demanda, a más de resultar violatoria del derecho de \ndefensa de la contraparte sería contraria a la estructura misma del proceso que en \nesta materia se guía por el principio de que la materia del litigio se define por las \npartes y, estas al hacerlo, delimitan la competencia del juzgador (…)”2.\nPor lo anterior, no formó parte de la decisión recurrida la norma al Auto 7536 del 7 de \nseptiembre de 2022, sino solo las obligaciones relacionadas con la Resolución 2358 del 11 \nde octubre de 2023\nAdemás, no le asiste razón a la Sociedad al oponerse a los tiempos de ejecución de \nactividades contenidas en el Auto 7536 del 7 de septiembre de 2022, toda vez que este \nacto administrativo se encuentra debidamente ejecutoriado y cuyos lineamientos recaen \nsobre impactos no resueltos ya existentes para el 2022, mientras que el acto administrativo \nobjeto del presente recurso de reposición versa sobre la Resolución 2358 del 11 de octubre \nde 2023, y para este caso en concreto, sobre nuevos Impactos No Resueltos. \nAsí las cosas, en el marco del recurso de reposición, el principio de unidad de materia \nimplica que el pronunciamiento de la Autoridad Nacional guarde coherencia con la petición \n2 Carlos Jaramillo Betancur, Derecho procesal administrativo, Colombia. Señal Editora, 2013.\n\nResolución No. 000926       Del 20 MAY. 2024          Hoja No. 16 de 74\n“Por la cual se resuelve un recurso de reposición interpuesto en contra de la \nResolución 2358 del 11 octubre de 2023” \nPágina 16 de 74\npresentada por el recurrente, y sobre cuestiones que fueron materia de oposición, evitando \nasí una decisión extrapetita. De esta manera, se salvaguarda el debido proceso, la \ntransparencia y la publicidad en las actuaciones administrativas, en virtud de los principios \ncontenidos en la Constitución Política y la Ley 1437 de 2011. Por lo tanto, no se repone y \nen consecuencia se confirma la obligación determinada por los subnumerales ii y iii del \nLiteral a) del numeral 3 del Artículo Segundo de la Resolución 2358 del 11 octubre de 2023.\n3.\nOBLIGACIÓN RECURRIDA – LITERAL B DEL NUMERAL 3 DEL ARTÍCULO \nSEGUNDO. \nEl acto administrativo, señala:\n“ARTÍCULO SEGUNDO. La sociedad MANSAROVAR ENERGY COLOMBIA LTD., \ndeberá realizar los siguientes ajustes a la ficha aprobada en el artículo primero de \nesta Resolución, y en el término de dos (2) meses contados a partir de la ejecutoria \nde este acto administrativo, presentar los ajustes de las actividades señalados a \ncontinuación:\n3. Ajustar la Actividad 2 denominada recuperación áreas afectadas en el sentido de \nincluir las siguientes actividades:\n(…)\nb) Presentar informes bimensuales de los avances realizados para la remediación \nen unidades de volumen y área por cada INR y por la suma de todos los INR, los \ncuales deben incluir:\ni. la caracterización química y física de las sustancias usadas para bio-\nremediación, Fitoremediación y/o cualquier otra técnica usada.\nii. Análisis gráfico y estadístico de los diferentes parámetros monitoreados por \ncada INR de forma multitemporal.\niii. Los cambios y aumentos de capacidad operativa (volumen y metros por \nmes) en el proceso de remediación que se hayan presentado para el \nproyecto señalando el cambio en el número de áreas operativas para \nremediación, el tamaño de dichas áreas y el inventario de maquinaria de \nexcavación con las que se cuenta entre otras variables.\niv. Un inventario actualizado de zonas, áreas y predios que incluya para cada \nuno de ellos los siguientes estados por año según sea el caso:\n• i. Posible INR sin diagnóstico.\n• ii.Posible INR en diagnóstico de identificación.\n• iii.INR en diagnóstico de delimitación.\n• iv.Sin remediación.\n• En proceso de remediación.\n• vi.Remediación finalizada.\n• En diagnostico post-remediación.\n•Predio remediado con nuevos hallazgos.\n• En proceso de reconformación.\n• Reconformación finalizada.\n\nResolución No. 000926       Del 20 MAY. 2024          Hoja No. 17 de 74\n“Por la cual se resuelve un recurso de reposición interpuesto en contra de la \nResolución 2358 del 11 octubre de 2023” \nPágina 17 de 74\n• Área estimada de remediación para los casos en que aplique como se \nmuestra a continuación”.\nFuente: literal b) del numeral 3 del artículo segundo, Resolución 2358 del 11 de octubre de \n2023 \nPetición de la Sociedad. \nLa Sociedad en el recurso de reposición presentado mediante comunicación con radicado \nANLA 20236200786262 del 26 de octubre de 2023, solicitó:\n“Teniendo en cuenta los argumentos mencionados, MANSAROVAR propone \nuna periodicidad semestral para la presentación de informes. Esta frecuencia \npropuesta permitirá evaluar los indicadores de gestión de impactos no resueltos \nde manera eficaz.”\nArgumentos de la Sociedad. \nSegún lo enunciado en el recurso de reposición, la Sociedad, argumenta lo siguiente:\n “MANSAROVAR, Teniendo la tecnología que mejor se podrá ajustar para su \ntratamiento de este tipo de áreas considera que la periodicidad bimensual (2 veces \npor mes cada 15 días) propuesta por la Autoridad Nacional de Licencias \nAmbientales para la presentación de informes de avance, no es eficiente para el \nanálisis de datos y evaluación del avance de la gestión integral de impactos no \nresueltos, esto, debido a que los informes en periodos de tiempo tan cortos \naportaran pocos o nulos cambios representativos para evidenciar avances y evaluar \nel proceso de gestión.\nMANSAROVAR, considera importante la presentación de informes donde se \nrelacione el estado y avance en todas las fases del proyecto, incluyendo el \ndiagnóstico, tratamiento y cierre de los INR, sin embargo, la periodicidad de \nentrega de dichos informes debe ser de tal manera que se logre apreciar avances \nsignificativos de todos los hitos que conforman la gestión de INR, tales como \nmonitoreos, prospección geológica, estudios geofísicos, modelamientos para \ndimensionamiento de áreas y volúmenes, estudios ambientales, sondeos de \nalterativas de tecnologías, licitaciones, procesos de tratamiento y cierre.”\nConsideraciones Técnicas y Jurídicas de la ANLA. \nQue frente a lo anterior, esta Autoridad Nacional consideró en el Concepto Técnico 9059 \ndel 19 de diciembre de 2023, lo siguiente:\n\nResolución No. 000926       Del 20 MAY. 2024          Hoja No. 18 de 74\n“Por la cual se resuelve un recurso de reposición interpuesto en contra de la \nResolución 2358 del 11 octubre de 2023” \nPágina 18 de 74\n“Frente a los argumentos presentados por la Sociedad frente al Literal b del \nNumeral 3 del Artículo 2 esta Autoridad Nacional se permite aclarar en primera \nmedida, que las actividades establecidas en dicho Literal corresponden a \nacciones de remediación fundamentalmente. Adicionalmente se aclara que la \nfrecuencia de presentación de los informes de la remediación es del orden de un \ninforme cada dos meses, lo cual no es equivalente a la entrega de estos dos (2) \nveces por mes o dos (2) veces cada quince (15) días como es posible que se \nindique en los argumentos expuestos por la Sociedad, sino a una entrega cada \ndos meses.\nLa Sociedad señala que la frecuencia establecida en el Literal b del Numeral 3 \ndel Artículo 2 es insuficiente para la evaluación del avance en la gestión integral \nde INR pues estos reflejarían pocos o nulos cambios representativos.  Respecto \na lo anterior esta Autoridad Nacional, se permite recordar que a tiempos de esta \nrespuesta, la fecha del plazo máximo para la remediación de áreas (diciembre 1 \nde 2024) se encuentra a menos de un año, por lo cual un informe cada seis \nmeses no permitiría realizar un seguimiento adecuado respecto al avance de la \nremediación y si es el caso generar alertas tempranas y/o hacer ajustes a los \nobjetivos definidos para alcanzar los plazos establecidos en el Numeral 2 del \nArtículo segundo del Auto 12084 de 21 de diciembre de 2020. \nAdicionalmente, considerando que dicho plazo se encuentra a menos de un año \nlas actividades realizadas en un periodo de 2 meses no deben corresponder a \npocos o nulos cambios o avances en la remediación o gestión de INR como se \nseñala por parte de la Sociedad. Considerando lo anterior esta Autoridad se \npermite manifestar que no acepta la propuesta periodicidad semestral para la \npresentación de informes de avance de remediación como se propone por parte \nde la Sociedad.\nNo obstante, teniendo en cuenta que en esta Autoridad Nacional concedió un (1) \nmes adicional al plazo establecido en el Literal d) del numeral 2 del Artículo \nSegundo de la Resolución 2358 del 11 octubre de 2023 cambiando el plazo de \nentrega de informes de diagnóstico y monitoreo de cada 2 meses a cada tres \nmeses y en pro de que tanto los informes de diagnóstico-monitoreo como los \ninformes de remediación puedan ser comparables para un mismo periodo y \nentendidos de manera unificada ya que son dos partes interrelacionadas de un \nmismo proceso de gestión de INR, esta Autoridad Nacional considera pertinente \nconceder un (1) mes adicional al plazo establecido en el Literal b) del Numeral 3 \ndel Artículo 2, cambiando el plazo de entrega de los informes de avance de la \nremediación de cada 2 meses a cada tres meses.” \nAsí las cosas, como quiera que dentro del análisis del Concepto Técnico 9059 del 19 de \ndiciembre de 2023 se consideró procedente adicionar el término de un mes en la \nperiodicidad de la obligación establecida en el literal d) del numeral 2 del artículo \nsegundo de la Resolución 2358 del 11 octubre de 2023, en el sentido de modificar el \nperiodo de presentación de los informes de diagnóstico y monitoreo de forma trimestral, \nesta Autoridad Nacional considera coherente, asimismo, modificar la periodicidad de \nentrega de los informes de avance de la remediación de bimensual a trimestral. Es de \naclarar que con esta determinación no se accede a lo solicitado por la Sociedad, sino \n\nResolución No. 000926       Del 20 MAY. 2024          Hoja No. 19 de 74\n“Por la cual se resuelve un recurso de reposición interpuesto en contra de la \nResolución 2358 del 11 octubre de 2023” \nPágina 19 de 74\nque obedece al objetivo de asegurar la comparabilidad y comprensión unificada de los \ninformes de diagnóstico-monitoreo y remediación, partes esenciales de la gestión del \nINR. \n4.\nOBLIGACIÓN RECURRIDA – LITERAL D DEL NUMERAL 3 DEL \nARTÍCULO SEGUNDO.\nEl acto administrativo recurrido señala:\n“ARTÍCULO SEGUNDO. La sociedad MANSAROVAR ENERGY COLOMBIA \nLTD deberá realizar los siguientes ajustes a la ficha aprobada en el artículo \nprimero de esta Resolución, y en el término de dos (2) meses contados a partir \nde la ejecutoria de este acto administrativo, presentar los ajustes de las \nactividades señalados a continuación:\n3. Ajustar la Actividad 2 denominada recuperación áreas afectadas en el sentido \nde incluir las siguientes actividades:\nd) Presentar, a modo de indicador de seguimiento, una curva o gráfica del \nnúmero de metros cuadrados y metros cúbicos a remediar mes a mes para el \nconjunto total de INR en los meses faltantes hasta el primero de diciembre de \n2024, fecha correspondiente al plazo máximo para la remediación de áreas \ny/o predios según el Numeral 2 del Artículo Segundo del Auto 12084 de 21 de \ndiciembre de 2020, el cual estableció la obligación de presentación de ficha \ncon indicadores de recuperación de INR en un plazo no mayor a 2 años \ncontados a partir de la fecha de radicación de la misma”.\nPetición de la Sociedad. \nLa Sociedad en el recurso de reposición presentado mediante comunicación con radicado \nANLA 20236200786262 del 26 de octubre de 2023, solicitó:\n(…) “cada proceso de tratamiento durará el tiempo que técnicamente sea viable de \nacuerdo con la tecnología a seleccionar y a las variables mencionadas. \nMANSAROVAR propone que el tiempo este de conformidad con la tecnología \naplicable en la cual se presentara un plan detallado de trabajo que involucre \naspectos técnicos, ecológicos, sociales, legales. Dicho plan será avalado por la \nautoridad, quien realizará el respectivo seguimiento y control en las visitas de \nseguimiento de esta Autoridad.\nMANSAROVAR propone presentar una curva gráfica del número de metros \ncuadrados y metros cúbicos a remediar, a modo de indicador, la cual está alineado \nal tiempo que se proyecte en el plan detallado de trabajo. De la misma manera, \nMANSAROVAR propone presentar los indicadores mencionados con una \nperiodicidad semestral y no mensual, de tal manera que se puedan apreciar cambios \nrepresentatives en los reportes de avance, lo anterior, teniendo en cuenta que los \nprocesos de tratamiento son lentos”.\nArgumentos de la Sociedad. \n\nResolución No. 000926       Del 20 MAY. 2024          Hoja No. 20 de 74\n“Por la cual se resuelve un recurso de reposición interpuesto en contra de la \nResolución 2358 del 11 octubre de 2023” \nPágina 20 de 74\nSegún lo enunciado en el recurso de reposición, la Sociedad, argumenta lo siguiente:\n“MANSAROVAR, considera que el tiempo límite de 2 años para el tratamiento de \nposibles INR al que hace referencia el literal d del numeral 3 del artículo segundo de \nla resolución 2358 de 2023, no es viable a nivel técnicamente\n•\nLas zonas con posible presencia de impactos no resueltos corresponden a \nzonas de bajo inundable colmatadas y pantanosas, de difícil acceso y alta \ncomplejidad para movilizarse en su interior. Teniendo en cuenta estas \ncaracterísticas, una de la tecnología que mejor se podrá ajustar para su \ntratamiento de este tipo de áreas es la de Bioventeo para la recuperación \nambiental de este tipo de áreas es la de Bioventeo, un tipo de remediación \nin situ que consiste en la ventilación forzada del suelo mediante la inyección \na presión de oxígeno (aire) y fluidos en la zona saturada y no saturada del \nsuelo a través de pozos de inyección para degradar los hidrocarburos \npesados y livianos que se encuentran en fracción libre en suelos, \nsedimentos, agua y vegetación. En esta técnica remediativa, los \nmicroorganismos presentes en los productos de remediación descomponen \nlas cadenas de hidrocarburo, estos procesos de biodegradación son lentos \ny requieren control de vigilancia a largo plazo para verificar que las \nconcentraciones disminuyan, se garantice la eficacia en la reducción de \nconcentración de hidrocarburos y se cumpla con los objetivos de \nremediación y seguimiento para el cierre del área recuperada. Sumado a \nesto, existen factores ambientales y climáticos que influyen directamente en \nmayores tiempos de degradación de hidrocarburos, entre estos, \ntemperatura, humedad y pH.\n•\nEl proyecto requiere el desarrollo de un programa de control y seguimiento, \nlo cual implica la toma de muestras, análisis e interpretación de resultados \nde laboratorio. este programa aplica a todas las fases del proyecto desde la \netapa de tratamiento hasta el cierre del posible impacto no resuelto y \ndemanda una parte importante del tiempo de tratamiento ambiental.\n•\nCampo Velásquez cuenta con un área licenciada extensa, dentro de la cual \nse ubican áreas que revisten cierta complejidad, por lo tanto, se requieren \nlabores administrativas como  análisis financiero, sondeos de alternativas de \ntecnologías, procesos licitatorios, análisis legal y de negociación de predios, \ngestión social. Estos pasos administrativos demandan tiempo dentro de la \nplaneación, intervención y cierre de los potenciales INR.\n•\nActualmente existen pedios que son propiedad de CHEVRON PETROLEUM \nCOMPANY (La antigua Texas Petroleum Company) los cuales no fueron \nentregados a OMIMEX DE COLOMBIA LTD y a MANSAROVAR.\n•\nMANSAROVAR está realizando un análisis de información geográfica, \nencontrando que varios de ellos se encuentran superpuestos en áreas con \npotencial presencia de impactos no resueltos o áreas sospechosas. la \n\nResolución No. 000926       Del 20 MAY. 2024          Hoja No. 21 de 74\n“Por la cual se resuelve un recurso de reposición interpuesto en contra de la \nResolución 2358 del 11 octubre de 2023” \nPágina 21 de 74\nsituación descrita representa un punto clave a la hora de definir tiempos y \nplazos de tratamiento. MANSAROVAR requiere desarrollar los estudios de \ntítulos prediales y, mientras no se aclare este punto, MANSAROVAR no \npuede intervenir estas áreas para los respectivos monitoreos, diagnósticos. \nSe anexa Escritura Publica N\" 1602 de 2014 y archivo KMZ con la \ninformación geográfica de áreas con posible presencia de INR que se \nsuperponen en predios propiedad de CHEVRON PETROLEUM COMPANY \n(La antigua Texas Petroleum Company)”.\nConsideraciones Técnicas y Jurídicas de la ANLA. \nQue frente a lo anterior, esta Autoridad Nacional consideró en el Concepto Técnico 9059 \ndel 19 de diciembre de 2023, lo siguiente:\n“Respecto a la propuesta presentada por la Sociedad frente al literal d) del numeral \n3 del artículo 2 en cuanto a que (…) “cada proceso de tratamiento durara el tiempo \nque técnicamente sea viable de acuerdo con la tecnología a seleccionar y a las \nvariables mencionadas. MANSAROVAR propone que el tiempo este de conformidad \ncon la tecnología aplicable en la cual se presentara un plan detallado de trabajo que \ninvolucre aspectos técnicos, ecológicos, sociales, legales. Dicho plan será avalado \npor la autoridad, quien realizará el respectivo seguimiento y control en las visitas de \nseguimiento de esta Autoridad” esta Autoridad Nacional, se permite señalar que esta \npropuesta no señala un tiempo específico el cual pueda ser evaluado, tampoco \nseñala cuál es ese tiempo que, según el argumento presentado, es técnicamente \nviable de acuerdo con la tecnología a seleccionar. La Sociedad propone que los \ntiempos estén sujetos a un “plan detallado de trabajo que involucre aspectos técnicos, \necológicos, sociales, legales” el cual no ha sido allegado a esta Autoridad Nacional \npara ser evaluado. \nRespecto a la afirmación realizada de que “el tiempo límite de 2 años para el \ntratamiento de posibles INR al que hace referencia el literal d) del numeral 3 del \nartículo segundo de la Resolución 2358 del 19 de diciembre 2023, no es viable a nivel \ntécnicamente” esta Autoridad Nacional, se permite señalar que el tiempo señalado \nen el literal d) del numeral 3 del artículo segundo de la Resolución 2358 de 19 de \ndiciembre 2023 obedece a lo establecido en el numeral 2 del artículo segundo del \nAuto 12084 de 21 de diciembre de 2020 el cual no es objeto del presente recurso de \nreposición. El recurso de reposición presentado tiene por objeto la Resolución 2358 \ndel 11 de octubre de 2023 la cual constituye la unidad de materia de dicho recurso. \nSiendo que el numeral 2 del artículo segundo del Auto 12084 de 21 de diciembre de \n2020 no es objeto del presente recurso de reposición no corresponde la evaluación \nde modificaciones sobre dicho acto administrativo. \nPor otra parte, respecto a la obligación de presentar, a modo de indicador de \nseguimiento, una curva o gráfica del número de metros cuadrados y metros cúbicos \na remediar mes a mes para el conjunto total de INR (…) la Sociedad propone “una \nperiodicidad semestral y no mensual de tal manera que se puedan apreciar cambios \nrepresentatives en los reportes de avance, lo anterior, teniendo en cuenta que los \nprocesos de tratamiento son lentos”. No obstante, una curva o gráfica del número de \nmetros cuadrados y metros cúbicos a remediar cada seis meses no permite hacer un \n\nResolución No. 000926       Del 20 MAY. 2024          Hoja No. 22 de 74\n“Por la cual se resuelve un recurso de reposición interpuesto en contra de la \nResolución 2358 del 11 octubre de 2023” \nPágina 22 de 74\nseguimiento adecuado al avance de la remediación y/o hacer ajustes a los objetivos \nde velocidad de la remediación para alcanzar los plazos establecidos en el Numeral \n2 del Artículo segundo del Auto 12084 de 21 de diciembre de 2020.\nPor todo lo anterior, esta Autoridad Ambiental se permite informar que no es aceptada \nla propuesta realizada por la Sociedad respecto a la propuesta presentada por la \nSociedad frente al Literal d del Numeral 3 del Artículo 2 de la Resolución 2358 del 11 \nde octubre de 2023.”\nAsí las cosas, no le asiste razón a la empresa el oponerse al plazo máximo de 2 años \nestablecido para la remediación de INR en áreas y/o predios del proyecto, mencionado \nen el literal d) del numeral 3 del artículo Segundo de la Resolución 2358 del 11 de \noctubre de 2023, toda vez que es el tiempo límite que corresponde a una temporalidad \nestablecida por el numeral 2 del artículo segundo del Auto 12084 de 21 de diciembre de \n2020, obligación que no es objeto de reposición. \nComo se mencionó anteriormente, en el marco del recurso de reposición, el principio de \nunidad de materia implica que el pronunciamiento de la Autoridad Nacional guarde \ncoherencia con la petición presentada por el recurrente, y sobre cuestiones que fueron \nmateria de oposición, evitando así una decisión extrapetita. De esta manera, se \nsalvaguarda el debido proceso, la transparencia y la publicidad en las actuaciones \nadministrativas, en virtud de los principios contenidos en la Constitución Política y la Ley \n1437 de 2011.\nEn este sentido, no se repone y en consecuencia se confirma la obligación el literal d) del \nnumeral 3 del artículo 2 de la Resolución 2358 del 11 de octubre de 2023.\n5.\nOBLIGACIÓN RECURRIDA – NUMERAL 7 DEL ARTÍCULO SEGUNDO\nSegún lo enunciado en el recurso de reposición, la Sociedad, argumenta lo siguiente:\n“ARTÍCULO SEGUNDO. La sociedad MANSAROVAR ENERGY COLOMBIA LTD \ndeberá realizar los siguientes ajustes a la ficha aprobada en el artículo primero de \nesta Resolución, y en el término de dos (2) meses contados a partir de la ejecutoria \nde este acto administrativo, presentar los ajustes de las actividades señalados a \ncontinuación:\n7. Presentar un valor específico de área y volumen bimensual objetivo por el tiempo \nrestante de plazo para la remediación del 100% de los Impactos No Resueltos (INR).”\nPetición de la Sociedad. \nLa Sociedad en el recurso de reposición, presentado mediante comunicación con radicado \nANLA 20236200786262 del 26 de octubre de 2023, solicitó:\n\nResolución No. 000926       Del 20 MAY. 2024          Hoja No. 23 de 74\n“Por la cual se resuelve un recurso de reposición interpuesto en contra de la \nResolución 2358 del 11 octubre de 2023” \nPágina 23 de 74\n“Teniendo en cuenta los argumentos mencionados, Mansarovar Energy propone una \nperiodicidad semestral para la presentación de informes donde se incluya el valor \nespecifico de área y volumen restante por tratar”.\nArgumentos de la Sociedad. \nSegún lo enunciado en el recurso de reposición, la Sociedad, argumenta lo siguiente:\n“Cada proceso de tratamiento durara el tiempo que técnicamente sea viable de \nacuerdo con la tecnología a seleccionar y a las variables climáticas, labores \nadministrativas como análisis financiero, sondeos de alternativas de tecnologías, \nprocesos licitatorios, análisis legal y de negociación de predios, gestión social. Estos \npasos administrativos demandan tiempo dentro de la planeación, intervención y \ncierre de los potenciales INR,\nMANSAROVAR propone que el tiempo este de conformidad con la tecnología \naplicable en la cual se presentara un plan detallado de trabajo que involucre aspectos \ntécnicos, ecológicos, sociales, legales. Dicho plan será avalado por la autoridad, \nquien realizaría el respectivo seguimiento y control en las visitas de seguimiento de \nesta Autoridad. La periodicidad bimensual (2 veces por mes cada 15 días) propuesta \npor la Autoridad Nacional de Licencias Ambientales para la presentación de informes \nde avance, no es eficiente para el análisis de datos y evaluación del avance de la \ngestión integral de impactos no resueltos, esto, debido a que los informes en periodos \nde tiempo tan cortos aportarían pocos o nulos cambios representativos para \nevidenciar avances y evaluar el proceso de gestión.\nLa sociedad considera importante la presentación de informes donde se relacione el \nestado y avance en todas las fases del proyecto, incluyendo el diagnóstico, \ntratamiento y cierre de los INR, sin embargo, la periodicidad de entrega de dichos \ninformes debe de tal manera que se logre apreciar avances significativos de todos \nlos hitos que conforman o apliquen en la gestión de INR, tales como monitores, \nprospección geológica, estudios geofísicos, modelamientos para dimensionamiento \nde áreas y volúmenes, estudios ambientales, sondeos de alternativas de tecnología, \nlicitaciones, procesos de tratamiento y cierre”.\nConsideraciones Técnicas y Jurídicas de la ANLA. \nQue frente a lo anterior, esta Autoridad Nacional consideró en el Concepto Técnico 9059 \ndel 19 de diciembre de 2023, lo siguiente:\n“Respecto al Numeral 7 del Artículo 2 la Sociedad señala que (…) “cada proceso de \ntratamiento durara el tiempo que técnicamente sea viable de acuerdo con la \ntecnología a seleccionar y a las variables mencionadas. MANSAROVAR propone que \nel tiempo este de conformidad con la tecnología aplicable en la cual se presentara un \nplan detallado de trabajo que involucre aspectos técnicos, ecológicos, sociales, \nlegales. Dicho plan será avalado por la autoridad, quien realizará el respectivo \nseguimiento y control en las visitas de seguimiento de esta Autoridad”, respecto a lo \nanterior esta Autoridad Nacional, se permite señalar que la propuesta anterior no \n\nResolución No. 000926       Del 20 MAY. 2024          Hoja No. 24 de 74\n“Por la cual se resuelve un recurso de reposición interpuesto en contra de la \nResolución 2358 del 11 octubre de 2023” \nPágina 24 de 74\nseñala un tiempo específico el cual pueda ser evaluado, tampoco señala cuál es ese \ntiempo que, según el argumento presentado por la Sociedad, es técnicamente viable \nde acuerdo con la tecnología a seleccionar y no señala tampoco cual será dicha \ntecnología a la que se hace referencia. Adicionalmente, la Sociedad propone que los \ntiempos estén sujetos a un “plan detallado de trabajo que involucre aspectos técnicos, \necológicos, sociales, legales” el cual no ha sido allegado a esta Autoridad para ser \nevaluado. \nRespecto a la obligación de “(…) presentar un valor específico de área y volumen \nbimensual objetivo por el tiempo restante de plazo para la remediación del 100% de \nlos Impactos No Resueltos (INR) a ser incorporado en la Ficha de INR (…)” la \nSociedad propone “una periodicidad semestral para la presentación de informes \ndonde se incluya el valor especifico de área y volumen restante por tratar”. A pesar \nde que el numeral 7 del artículo 2 hace referencia a ajustar la ficha agregando un \nobjetivo cuantitativo de área y volumen a remediar cada 2 meses, la Sociedad \npresenta una propuesta que hace referencia a la periodicidad de entrega de informes \ndonde se incluya el valor especifico de área y volumen restante por tratar, lo cual \ncorresponde a un tema diferente que no es el objeto de la obligación establecida en \nel literal 7 del numeral 3 del artículo 2.\nPor lo anterior, esta Autoridad Nacional manifiesta que no acepta la propuesta \npresentada por la Sociedad frente al numeral 7 del artículo 2 de la Resolución 2358 \ndel 11 de octubre de 2023.\nSegún lo indicado en el Concepto Técnico 9059 del 19 de diciembre de 2023, es de anotar \nque, de conformidad con lo establecido en la obligación recurrida, esta se refiere a que la \nSociedad debe presentar el objetivo en términos de área y volumen que se va a remediar \nde manera bimensual (cada 2 meses) teniendo como punto de referencia el plazo máximo \ncon el que cuenta la Sociedad para remediar el 100% de los Impactos No Resueltos. Dicho \nesto, es de aclarar que la obligación establecida no obedece a la presentación de informes \nbimensuales en los cuales se reporte cual fue el área y volumen recuperado, sino que se \npresente de forma previa el objetivo bimensual trazado por la Sociedad, y de esta manera \nestablecer y medir el cumplimiento de la medida, la cual, de manera alguna puede quedar \nsujeta a las variables expuestas por MANSAROVAR ENERGY COLOMBIA LTD. en su \nescrito de reposición.\nAsí las cosas, no se repone y en consecuencia se confirma la obligación determinada por \nel numeral 7 del artículo segundo de la Resolución 2358 del 11 de octubre de 2023.  \n6.\nOBLIGACIÓN RECURRIDA – NUMERAL 9 DEL ARTÍCULO SEGUNDO\nEl acto administrativo recurrido señala:\n“ARTÍCULO SEGUNDO. La sociedad MANSAROVAR ENERGY COLOMBIA LTD \ndeberá realizar los siguientes ajustes a la ficha aprobada en el artículo primero de \nesta Resolución, y en el término de dos (2) meses contados a partir de la ejecutoria \nde este acto administrativo, presentar los ajustes de las actividades señalados a \ncontinuación:\n\nResolución No. 000926       Del 20 MAY. 2024          Hoja No. 25 de 74\n“Por la cual se resuelve un recurso de reposición interpuesto en contra de la \nResolución 2358 del 11 octubre de 2023” \nPágina 25 de 74\n9. Incluir una actividad denominada “MONITOREO DE PECES Y DE MACRÓFITAS” \ncon una propuesta de metodología de cierre de los Impactos No Resueltos (INR), \nque contemple lo siguiente:\nEn relación con las Macrófitas.\na) Reubicar los puntos de monitoreo de bioacumulación en macrófitas en la Ciénaga \nde Palagua mostrados a continuación aplica solamente para los que se encuentran \nen la Ciénaga de Palagua, los demás puntos de monitoreo mantienen su localización \nadoptando (en los puntos que apliquen) los códigos asignados en la columna “Código \nID ANLA:\nUbicación espacial de los puntos de monitoreo de bioacumulación en macrófitas en \nla Ciénaga de Palagua\n\nResolución No. 000926       Del 20 MAY. 2024          Hoja No. 26 de 74\n“Por la cual se resuelve un recurso de reposición interpuesto en contra de la \nResolución 2358 del 11 octubre de 2023” \nPágina 26 de 74\nb) Detallar y estandarizar la metodología (como mínimo especie, tipo de órgano y \ncantidad de individuos) para determinar la presencia de metales pesados e \nhidrocarburos en macrófitas de manera que se garantice que la muestra sea \nrepresentativa para la detección de estos parámetros por bioacumulación.\nc) Tomar muestras de macrófitas de habito enraizado y hábito flotante; en caso de \nque las macrófitas enraizadas se encuentren más cercanas a la orilla, se desplazará \nel punto de monitoreo de manera perpendicular a la orilla, con el objetivo que se logre \nque incluir este hábito en la muestra, de acuerdo con los puntos planteados en la \nficha ASM-1. Aguas Residuales y Corrientes Receptoras (LENT6, LENT5, LENT4, \nLENT3, LENT2, LEMT18, LENT17, LEN13, LENT11, LENT9 y LENT 8).\nd) Incluir como mínimo los siguientes parámetros con los siguientes límites de \ndetección:\n\nResolución No. 000926       Del 20 MAY. 2024          Hoja No. 27 de 74\n“Por la cual se resuelve un recurso de reposición interpuesto en contra de la \nResolución 2358 del 11 octubre de 2023” \nPágina 27 de 74\nEn relación con los Peces\na) Reubicar los puntos de monitoreo de bioacumulación en peces en la Ciénaga de \nPalagua, es importante indicar que aplica solamente para los que se encuentran en \nla Ciénaga de Palagua, lo demás puntos de monitoreo mantienen su localización.\nUbicación espacial de los puntos de monitoreo de bioacumulación en macrófitas en \nla Ciénaga de Palagua.\n\nResolución No. 000926       Del 20 MAY. 2024          Hoja No. 28 de 74\n“Por la cual se resuelve un recurso de reposición interpuesto en contra de la \nResolución 2358 del 11 octubre de 2023” \nPágina 28 de 74\n\nResolución No. 000926       Del 20 MAY. 2024          Hoja No. 29 de 74\n“Por la cual se resuelve un recurso de reposición interpuesto en contra de la \nResolución 2358 del 11 octubre de 2023” \nPágina 29 de 74\nb) Detallar y estandarizar la metodología (como mínimo especie, tipo de tejido, \ncantidad de organismos) para determinar la presencia de metales pesados e \nhidrocarburos en peces de manera que se garantice que la muestra sea \nrepresentativa para la detección de estos parámetros por bioacumulación.\nc) Garantizar que la muestra provenga de tejido muscular, se deben tomar \nmuestras de peces de diferentes hábitos tróficos, (orden Siluriformes), omnívoros \ne insectívoros (órdenes Characiformes y Cichliformes), teniendo en cuenta los \nsiguientes parámetros:\nPetición de la Sociedad. \nLa Sociedad en el recurso de reposición presentado mediante comunicación con radicado \nANLA 20236200786262 del 26 de octubre de 2023, solicitó:\n“(…) para la compañía la medida propuesta por la autoridad no es procedente, más \nallá de resultar redundante, no representa una base para evaluar el criterio del cierre \nde un INR tratado”.\nArgumentos de la Sociedad. \nSegún lo enunciado en el recurso de reposición, la Sociedad, argumenta lo siguiente:\n“La Autoridad Nacional de Licencias Ambientales propone incluir el monitoreo de \npeces y macrófitas en diferentes puntos de la Ciénaga Palagua como metodología \npara el cierre de impactos no resueltos, sin embargo, MANSAROVAR considera que \ndicha medida no aplica en el marco de la gestión de INR ya que no representa un \nindicador que funcione como criterio para determinar el cierre de un área donde se \nhaya realizado tratamiento, teniendo en cuenta las razones que se exponen a \ncontinuación:\n•\nEl espejo de agua de la Ciénaga Palagua no se superpone área INR, y la \nciénaga de Palagua no es un INR. Los posibles INR están ubicados en bajos \ninundables asociados a plataformas y baterías.\nPor otro lado, MANSAROVAR realiza el monitoreo permanente de peces, macrófitas \ny sedimentos en la Ciénaga Palagua desde sus inicios como operadora en Campo \nVelásquez, en cumplimiento a las medidas de manejo que están incluidas en el PMA \ny en los siguientes actos administrativos (…)”\n\nResolución No. 000926       Del 20 MAY. 2024          Hoja No. 30 de 74\n“Por la cual se resuelve un recurso de reposición interpuesto en contra de la \nResolución 2358 del 11 octubre de 2023” \nPágina 30 de 74\nConsideraciones Técnicas y Jurídicas de la ANLA. \nQue frente a lo anterior, esta Autoridad Nacional consideró en el Concepto Técnico 9059 \ndel 19 de diciembre de 2023, lo siguiente:\n“Teniendo en cuenta los argumentos presentados por la Sociedad y considerando \nque lo aquí solicitado es redundante con lo requerido en Artículo Quinto de la \nResolución 2358 del 11 octubre de 2023, se considera viable ACEPTAR la solicitud \nde suprimir el numeral 9 del Artículo Segundo de la Resolución 2358 del 11 octubre \nde 2023.”\nEsta Autoridad Nacional considera procedente reponer en el sentido de revocar el numeral \n9 del artículo Segundo de la Resolución 2358 del 11 octubre de 2023, atendiendo al \nprincipio de economía del Derecho Administrativo. Este principio establece que, se debe \nevitar la repetición innecesaria de trámites o actuaciones administrativas cuando ya existe \nuna normativa o disposición que aborda la misma situación o contenido. En este contexto, \nal considerar que lo determinado por el numeral 9 del Artículo Segundo de la Resolución \n2358 del 11 octubre de 2023, es redundante con lo establecido en el artículo quinto de la \nmisma Resolución, se acepta la solicitud de suprimir el numeral 9 del artículo segundo para \nevitar duplicidad y simplificar el procedimiento administrativo y el cumplimiento de los \nrequerimientos de la Sociedad.\n7.\nOBLIGACIÓN RECURRIDA – NUMERALES 3, 6 Y 7 DEL ARTÍCULO \nTERCERO\nEl acto administrativo, señala:\n“ARTÍCULO TERCERO. Ajustar vía seguimiento la ficha ASM-1 Aguas residuales, \nestablecida en el artículo vigésimo primero de la Resolución 408 del 12 de abril de \n2017, en el sentido de incluir las siguientes medidas, de conformidad con las \nconsideraciones expuesta en la parte considerativa del presente acto administrativo:\n3. Incluir como mínimo los siguientes parámetros fisicoquímicos e hidrobiológicos:\n(…)\n6. Incluir indicadores que reflejen la recuperación de las condiciones ambientales \nsobre el cuerpo de agua, siendo estos coherentes con el objetivo general del \nprograma de monitoreo en la Ciénaga\n7. Analizar dentro de la definición de parámetros a monitorear en la matriz de \nsedimentos, como mínimo los siguientes parámetros: \n (…).\nPetición de la Sociedad. \n\nResolución No. 000926       Del 20 MAY. 2024          Hoja No. 31 de 74\n“Por la cual se resuelve un recurso de reposición interpuesto en contra de la \nResolución 2358 del 11 octubre de 2023” \nPágina 31 de 74\nLa Sociedad en el recurso de reposición presentado mediante comunicación con radicado \nANLA 20236200786262 del 26 de octubre de 2023, solicitó:\n“La ficha ASM-1 Aguas Residuales, hace referencia a que los puntos a Monitorear se \ndeben realizar a los Cuerpos de agua Superficial (Bajos y Caños o quebradas \ntributarias a la ciénaga de Palagua), por lo anterior los puntos de muestreo indicados \nen el numeral 2 del artículo tercero, corresponden a puntos ubicados geográficamente \ndentro del área de la ciénega de Palagua, por lo que se hace necesario que la \nAutoridad Ambiental precise este requerimiento indicando que la ficha que aplica a \neste requerimiento es la MSM-10 PROGRAMA DE SEGUIMIENTO Y MONITOREO \nDE LAS COMUNIDADES HIDROBIOLOGICAS.\nPrecisar que los parámetros referidos en la Resolución 2358 del 11 de octubre de \n2023, en su artículo tercero, numeral 3 y 7, con referencia a los parámetros físico \nquímico e hidrobiológicos, y la matriz de sedimento, deben ser los parámetros que la \nAutoridad requiera a MANSAROVAR como únicos a ejecutar en  cumplimiento del \nplan de manejo ambiental, y dejar claridad que los parámetros establecidos en actos \nadministrativos anteriores a este último requerimiento y los parámetros relacionados \nen las fichas de monitoreo no se seguirán llevando a cabo. Mansanrovar Energy solo \nrealizaría los indicados en la Resolución 2358 del 11 de octubre de 2023”\nArgumentos de la Sociedad. \nSegún lo enunciado en el recurso de reposición, la Sociedad, argumenta lo siguiente:\n“(…)\nPor su parte el numeral sexto prevé que Mansarovar debe incluir indicadores que \nreflejen la recuperación de las conclusiones ambientales sobre el cuerpo de agua, \nsiendo estos coherentes con el objetivo general del programa de monitoreo de la \nciénaga.\nLos indicadores no pueden estar enfocados a la Recuperación de la Ciénaga, toda \nvez que las acciones de Manejo e indicadores establecidos por Mansarovar, son para \nel cumplimiento de requerimientos Legales establecidos dentro de su plan de Manejo \nAmbiental, los cuales dentro de  su alcance no se encuentra realizar la recuperación \nde la Ciénaga de Palagua, ya que la misma tiene otros aspectos relevantes que \nafectan directa o indirectamente este cuerpo de agua, como lo son la Ganadería, \ndescarga de aguas residuales domesticas entre otros. Por lo anterior, es importante \nindicar que MANSAROVAR, realiza seguimiento a parámetros fisicoquímicos que \npuedan verse afectados por las actividades propias de la operación del campo. \nAdicionalmente, actualmente no se cuenta con un diagnóstico técnico elaborado por \nparte de las autoridades competentes, que indique el estado ambiental de la Ciénaga, \nque permita determinar los diferentes proyectos licenciados que conviven con otros \nactores que convergen e interactúan con el cuerpo de agua puedan estar \nocasionando posibles tensiones ambientales sobre el ecosistema, para de esta forma \npoder establecer indicadores que midan de forma equitativa o justa el posible impacto \ngenerado por cada uno de ellos.”\n\nResolución No. 000926       Del 20 MAY. 2024          Hoja No. 32 de 74\n“Por la cual se resuelve un recurso de reposición interpuesto en contra de la \nResolución 2358 del 11 octubre de 2023” \nPágina 32 de 74\nConsideraciones Técnicas y Jurídicas de la ANLA. \nQue frente a lo anterior, esta Autoridad Nacional consideró en el Concepto Técnico 9059 \ndel 19 de diciembre de 2023, lo siguiente:\n“Numerales 3 y 7 del Artículo Tercero\nRevisado el Plan de Seguimiento y Monitoreo del Campo Velásquez, en la Ficha \nASM-1. Aguas Residuales y Corrientes Receptoras, con relación al monitoreo de \nAguas Superficiales se estipuló la siguiente medida general:\n“Monitoreos a cuerpos de agua superficial \nSe realizarán muestreos de carácter semestral en 4 caños o quebradas tributarias a \nla ciénaga de Palagua que atraviesen la infraestructura del Campo Velásquez, los \ncuales deberán realizarse tanto aguas arriba como aguas abajo de dicha \ninfraestructura. Los parámetros para analizar serán: temperatura, pH, conductividad, \ncloruros, color, oxígeno disuelto, nitritos, nitratos, fosforo, amonio, fenoles, coliformes \nfecales y totales, grasas y aceites, hidrocarburos alifáticos, hidrocarburos aromáticos \npolinucleares, hierro, bario, cadmio, plomo, cromo, molibdeno, vanadio y zinc.\n* Se debe anexar los monitoreos dentro de los Informes ICA del campo, los \nmonitoreos deben ser realizados por un laboratorio acreditado.”\nDicha medida, en efecto apunta hacia el monitoreo de cuerpos hídricos lóticos al \ninterior del área licenciada para el proyecto Campo Velásquez, más no al cuerpo \nhídrico denominado Ciénaga de Palagua, el cual es objeto de actualización del Plan \nde Monitoreo de Aguas Superficiales y Sedimentos.\nAsimismo, en la Ficha BSM-10 programa de seguimiento y monitoreo de las \ncomunidades hidrobiológicas se estipula lo siguiente:\nMonitoreo fisicoquímico, bacteriológico e hidrobiológico de los ecosistemas \nacuáticos \nSe analizarán las características físico-bióticas de los cuerpos de agua susceptibles \nde intervención debido a las actividades del proyecto y aledaños a locaciones, en la \nTabla BSM-10.1 se presentan los parámetros a tener en cuenta para este monitoreo.\nTabla BSM-10.1\nMonitoreos de parámetros fisicoquímicos y comunidades hidrobiológicas\nActividad\nFrecuencia\nEspecificaciones\nRequerido por\nEfectuar \nmonitoreo a \nla ciénaga \nPalagua\nSemestral y en \ndos épocas \nclimáticas \ndiferentes con el \nobjetivo de \nanalizar \nParámetros Fisicoquímicos\nLos parámetros que se deben \nanalizar en agua son: INSITU: \nConductividad, oxígeno disuelto, pH, \nTemperatura. En laboratorio: Bario, \ncadmio, cloruros, color verdadero, \nDe \nacuerdo \ncon \nel \nnumeral 5 del artículo \ncuarto de la Resolución \n412 de 1998 \n1. Se deben efectuar 8 \nmuestras \npara \nla \n\nResolución No. 000926       Del 20 MAY. 2024          Hoja No. 33 de 74\n“Por la cual se resuelve un recurso de reposición interpuesto en contra de la \nResolución 2358 del 11 octubre de 2023” \nPágina 33 de 74\nMonitoreos de parámetros fisicoquímicos y comunidades hidrobiológicas\nActividad\nFrecuencia\nEspecificaciones\nRequerido por\nperiodos \nclimáticos \ncompletos\ncromo, fenoles, fosfatos, grasas y \naceites, \nHAP \nHidrocarburos \naromáticos \npolicíclicos, \nhidrocarburos totales, hierro total, \nmolibdeno, nitratos, nitritos, TPH, \nselenio, mercurio, plomo.\nEn peces, vegetación y sedimentos: \nCadmio, Cromo total, plomo, HAP, \nhidrocarburos alifáticos, mercurio y \nselenio.\nEn \nadición \na \nlo \nanterior, \nse \nanalizarán \nlos \nparámetros \nrequeridos en el numeral 3.2.5 de los \nTérminos de Referencia HI-TER-1-\n03\nParámetros Hidrobiológicos\nLas comunidades hidrobiológicas \nque se deben integrar al análisis de \nla calidad del agua en los cuerpos de \nagua susceptibles de intervención o \nde \nafectación \nson: \nPerifiton, \nzooplancton, fitoplancton, macrófitas \ny fauna íctica\nCiénaga Palagua y 4 \npara los bajos aledaños. \nEste monitoreo se debe \nrealizar en (14) puntos en \nla ciénaga de Palagua y \n(10) puntos  en los bajos \ny caños aledaños  a las \nBaterías 1, 2, 2A, 3 y \nVelasquez-26.\n*Los resultados deben ser presentados al Ministerio del Medio Ambiente y a \nCORPOBOYACA.\nLa medición de parámetros in situ y la toma de muestras, así como los análisis de \nlaboratorio, se realizarán de acuerdo con los protocolos establecidos en la guía \nStandard Methods for Examination of Water and Wastewater, tanto para las variables \nfisicoquímicas como bióticas.\nLos muestreos de las comunidades hidrobiológicas se desarrollarán bajo las mismas \ncondiciones de áreas, tiempos, y métodos. Adicionalmente, serán comparables a \naquellos contenidos en la caracterización de los ecosistemas acuáticos que se vienen \ndesarrollando en el campo desde 2010 y han sido reportados en los Informes de \nCumplimiento Ambiental. Se evaluará la calidad de los cuerpos de agua y la variación \nde las comunidades hidrobiológicas bajo un análisis integral e histórico, partiendo de \nla información presentada en las caracterizaciones previas y complementando con \nlos análisis de resultados más recientes.\nLos resultados obtenidos serán comparados con la normatividad ambiental vigente \nen cuanto a los límites permisibles en el agua, según su uso (Decreto 1594 de 1984 \no el que lo sustituya). Adicionalmente, se analizará la correlación entre los parámetros \nfisicoquímicos, bacteriológicos e hidrobiológicos, y la bio-indicación de los \norganismos registrados, con el fin de establecer cambios sobre la calidad del agua y \nlas comunidades hidrobiológicas. En la Tabla BSM-10.2 se relacionan los cuerpos \nlénticos y lóticos en donde se desarrollarán las jornadas de monitoreo.\nTabla BSM-10.2\n\nResolución No. 000926       Del 20 MAY. 2024          Hoja No. 34 de 74\n“Por la cual se resuelve un recurso de reposición interpuesto en contra de la \nResolución 2358 del 11 octubre de 2023” \nPágina 34 de 74\nCódigo\nNombre\nLOT1\nCaño \nPalagua \n(Desembocadura \nciénaga)\nLOT2\nCaño \nPalagua \n(Aguas \nabajo \ndesembocadura)\nLOT3\nCaño Las Pavas aguas arriba\nLOT4\nCaño Las Pavas aguas abajo\nLOT5\nCaño Sacamujeres aguas arriba\nLOT6\nCaño Sacamujeres aguas abajo\nLOT7\nCaño NN1 aguas arriba\nLOT8\nCaño NN1 aguas abajo\nLEN1\nMuelle Velásquez\nLEN2\nEntrada Aceitero\nLEN3\nBoca del Caño Agualinda\nLEN4\n1 Km Caño Agualinda\nLEN5\nBatería 3 Palagua\nLEN6\nMuelle Palagua\nLEN7\nDetrás de la Isla de la Fantasía ( Rincón \nOscuro)\nLEN8\nEntre Islas\nLEN9\nRincón Oscuro (La Cruz)\nLEN10\nEntrada del río\nLEN11\n1 Km entrada del río\nLEN12\n2 Km entrada del río\nLEN13\nBatería 2ª\nLEN14\nRincón de Cuadro\nLEN15\nBatería 1 aguas arriba\nLEN16\nBatería 1 aguas abajo\nLEN17\nBatería 2 aguas arriba\nLEN18\nBatería 2 aguas abajo\nLEN19\nBatería 3 aguas arriba\nLEN20\nBatería 3 aguas abajo\nLEN21\nVelásquez 26 aguas arriba\nLEN22\nVelásquez 26 aguas abajo\n(…)…”\nSegún lo anteriormente citado, en la Ficha BSM-10 programa de seguimiento y \nmonitoreo de las comunidades hidrobiológicas se enumeran los parámetros y los \npuntos de monitoreo en la Ciénaga y en puntos adicionales al interior del polígono \nlicenciado del Campo Velásquez. \nTeniendo en cuenta que en dicha tabla (Tabla BSM-10.2) de la ficha antes \nmencionada se incluyen puntos adicionales a los monitoreados en la Ciénaga de \nPalagua, la Sociedad deberá suprimir los puntos de monitoreo que actualmente son \ncaracterizados en la Ciénaga de Palagua y que corresponden a los enumerados en \nla siguiente tabla\nPuntos monitoreados actualmente en la Ciénaga de Palagua\n\nResolución No. 000926       Del 20 MAY. 2024          Hoja No. 35 de 74\n“Por la cual se resuelve un recurso de reposición interpuesto en contra de la \nResolución 2358 del 11 octubre de 2023” \nPágina 35 de 74\nCOORDENADAS \nDATUM MAGNA \nSIRGAS ORIGEN \nBOGOTÁ\nCOORDENADAS DATUM \nMAGNA SIRGAS ORIGEN \nÚNICO NACIONAL\nPUNTO\nUBICACIÓN\nESTE\nNORTE\nESTE\nNORTE\n(PUNTO 1) \nMUELLE \nVELÁSQUEZ\n953048\n1161583\n4833880.27\n6\n2227540.56\n8\n(PUNTO 2)\nENTRADA ACEITERO\n953120\n1161606\n4833952.28\n6\n2227563.41\n4\n(PUNTO 3)\nDESEMBOCADURA \nCAÑO AGUALINDA\n953719\n1162216\n4834552.20\n5\n2228171.92\n7\n(PUNTO 4)\nKM 1 CAÑO \nAGUALINDA\n954283\n1161776\n4835115.05\n5\n2227731.02\n3\n (PUNTO 5)\nBATERÍA 3\n953081\n1162449\n4833914.97\n9\n2228406.08\n0\n (PUNTO 6)\nISLA DE LA \nFANTASÍA\n952036\n1162535\n4832870.65\n8\n2228494.11\n5\n (PUNTO 7)\nPUNTO CENTRAL DE \nCIÉNAGA \n952203\n1162008\n4833036.53\n0\n2227967.03\n9\n(PUNTO 8) \nMONTE OSCURO \n953120\n1162606\n4833954.27\n2\n2228562.92\n6\n (PUNTO 9) \nDESEMBOCADURA \nAL \nCAÑO PALAGUA\n951013\n1161833\n4831846.75\n8\n2227794.48\n5\n(PUNTO 10)\nEL PEÑÓN \n951470\n1162025\n4832303.91\n9\n2227985.48\n6\n(PUNTO 11)\nRINCÓN BATERÍA 2\n952223\n1161726\n4833055.96\n1\n2227685.13\n6\n(PUNTO 12)\nISLA EL ENCANTO \n952833\n1162250\n4833666.70\n5\n2228207.67\n0\n (PUNTO 13)\n1 KM ANTES DE \nCAÑO \nPALAGUA\n951033\n1161793\n4831866.66\n9\n2227754.46\n5\n(PUNTO 14) \nMUELLE PALAGUA\n952788\n1162424\n4833622.07\n2\n2228381.67\n5\n(PUNTO 15)\nACEITERO \n953123\n1161633\n4833954.33\n7\n2227589.39\n7\nFuente: ANLA con base en el Plan de Monitoreo en Ciénaga de Palagua presentado \npor Mansarovar en el ICA 35. 2023.\nLos demás puntos establecidos en la Tabla BSM-10.2 de la Ficha BSM-10 del \nPrograma de seguimiento y monitoreo de las comunidades hidrobiológicas se \nmantendrán en las mismas condiciones de localización y los parametros establecidos \nen la misma. Así las cosas, se acoge la solicitud de la Sociedad en donde se refiere \na que los nuevos parámetros establecidos en los numerales 3 y 7 del artículo \nsegundo de la Resolución 2358 del 11 de octubre de 2023 serán los únicos a ejecutar \nen cumplimiento del Plan de Manejo Ambiental.\nAsí las cosas, los veinte (20) puntos de monitoreo que serán permanentes en la \nCiénaga de Palagua serán los siguientes:\nPuntos de monitoreo de aguas superficiales y sedimentos en la Ciénaga de \nPalagua\n\nResolución No. 000926       Del 20 MAY. 2024          Hoja No. 36 de 74\n“Por la cual se resuelve un recurso de reposición interpuesto en contra de la \nResolución 2358 del 11 octubre de 2023” \nPágina 36 de 74\nCoordenadas Magna Origen Único \nNacional\nCoordenadas \nGeográficas\nNOMBRE\nCódigo ID \nANLA\nESTE\nNORTE\nLATITUD\nLONGITU\nD\nLENT_1\nMSP-LAM0332-\n001\n4834465,65\n2228221,55\n6,06339\n-74,49636\nLENT_2\nMSP-LAM0332-\n002\n4834309,73\n2228494,49\n6,065855\n-\n74,497776\nLENT_3\nMSP-LAM0332-\n003\n4833755,23\n2228344,06\n6,064481\n-\n74,502783\nLENT_4\nMSP-LAM0332-\n004\n4833344,63\n2228299,23\n6,064065\n-\n74,506493\nLENT_5\nMSP-LAM0332-\n005\n4832472,21\n2228572,87\n6,066518\n-\n74,514384\nLENT 6\nMSP-LAM0332-\n006\n4831981,11\n2228461,69\n6,0655\n-74,51882\nLENT 7\nMSP-LAM0332-\n007\n4832023,8\n2228101,11\n6,062239\n-\n74,518425\nLENT_8\nMSP-LAM0332-\n008\n4831975,26\n2227766,95\n6,059215\n-\n74,518855\nLENT 9\nMSP-LAM0332-\n009\n4832661,66\n2227865,52\n6,060124\n-\n74,512654\nLENT_10\nMSP-LAM0332-\n010\n4832685,46\n2228285,07\n6,06392\n-74,51245\nLENT_11\nMSP-LAM0332-\n011\n4833181,18\n2227738,62\n6,058989\n-\n74,507956\nLENT_12\nMSP-LAM0332-\n012\n4833037,34\n2228114,91\n6,062389\n-\n74,509266\nLENT 13\nMSP-LAM0332-\n013\n4833589,23\n2227763,07\n6,05922\n-\n74,504269\nLENT 14\nMSP-LAM0332-\n014\n4833879,21\n2227555,59\n6,057351\n-\n74,501643\nLENT_15\nMSP-LAM0332-\n015\n4833625,8\n2228009,97\n6,061455\n-\n74,503945\nLENT 16\nMSP-LAM0332-\n016\n4833968,37\n2227467,36\n6,056555\n-\n74,500835\nLENT_17\nMSP-LAM0332-\n017\n4833952,24\n2227696,54\n6,058627\n-\n74,500987\nLENT_18\nMSP-LAM0332-\n018\n4834089,08\n2227956\n6,060978\n-\n74,499757\nCAÑO \nAGUALIND\nA\nMSP-LAM0332-\n019\n4834694\n2228123,84\n6,062512\n-\n74,494294\nCAÑO \nPALAGUA\nMSP-LAM0332-\n020\n4831454,30\n2227636,35\n6,05802\n-74,52356\nFuente: ANLA.2023.\nParámetros fisicoquímicos e hidrobiológicos\nNo.\nParámetro para \nmonitorear\nNo.\nParámetro para \nmonitorear\nNo.\nParámetro para \nmonitorear\n1\nConductividad eléctrica\n22\nColor verdadero\n43\nNitrógeno Total\n2\nOxígeno disuelto\n23\nCobre Total\n44\nPlata Total\n3\npH in situ \n24\nCromo total\n45\nPlomo total\n4\nTemperatura ambiente\n25\nDBO5\n46\nSAAM\n\nResolución No. 000926       Del 20 MAY. 2024          Hoja No. 37 de 74\n“Por la cual se resuelve un recurso de reposición interpuesto en contra de la \nResolución 2358 del 11 octubre de 2023” \nPágina 37 de 74\nNo.\nParámetro para \nmonitorear\nNo.\nParámetro para \nmonitorear\nNo.\nParámetro para \nmonitorear\n5\nTemperatura insitu\n26\nDQO\n47\nSelenio total\n6\nAceites y Grasas\n27\nDureza total\n48\nSolidos sedimentables\n7\nAcidez total\n28\nCompuestos fenólicos\n49\nSólidos totales \n8\nAlcalinidad total\n29\nFosfatos\n50\nSolidos totales \ndisueltos\n9\nAluminio Total\n30\nFósforo Inorgánico\n51\nSolidos totales en \nsuspensión\n10\nArsénico total\n31\nFosforo orgánico\n52\nSulfatos\n11\nBario total\n32\nFósforo total\n53\nSulfuros\n12\nBicarbonatos\n33\nHidrocarburos Totales\n54\nSuma HAPs\n13\nCadmio total\n34\nHierro total\n55\nTurbidez\n14\nCalcio total\n35\nLitio Total\n56\nVanadio Total\n15\nCarbono orgánico total\n36\nMagnesio total\n57\nHidrocarburos Alifáticos\n16\nCloruros\n37\nMercurio total\n58\nCompuestos Orgánicos \nno Halogenados \n17\nCobalto total\n38\nMolibdeno total\n18\nBTEX\n39\nNitratos\n59\nCompuestos Orgánicos \nHalogenados \nabsorbibles (AOX)\n19\nColiformes fecales por \nNMP\n40\nNitritos\n20\nColiformes Totales por \nNMP\n41\nNíquel Total\n21\nCianuro Total\n42\nNitrógeno amoniacal \nFuente: ANLA.2023.\nParámetros hidrobiológicos\nNo\nParámetro hidrobiológico para \nmonitorear\n1\nFitoplancton\n2\nZooplancton\n3\nMacroinvertebrados bentónicos\n4\nMacroinvertebrados asociados a \nmacrófitas\n5\nPerifiton\n6\nIctiofauna\n7\nMacrófitas acuáticas\n8\nMetales \npesados \ne \nhidrocarburos \nen \ntejidos \nde \npeces y de macrófitas\nFuente: ANLA.2023.\nParámetros Sedimentos\nN\no.\nParámetros \nmínimos \npara \nmonitorear en matriz de Sedimentos \nen Ciénaga de Palagua\n1\nPlata total\n2\nBario total\n\nResolución No. 000926       Del 20 MAY. 2024          Hoja No. 38 de 74\n“Por la cual se resuelve un recurso de reposición interpuesto en contra de la \nResolución 2358 del 11 octubre de 2023” \nPágina 38 de 74\nN\no.\nParámetros \nmínimos \npara \nmonitorear en matriz de Sedimentos \nen Ciénaga de Palagua\n3\nCadmio total\n4\nPlomo total\n5\nMercurio total\n6\nSelenio total\n7\nCromo total\n8\nHidrocarburos totales\n9\nHAPs\n10\nConductividad eléctrica\n11\nHidrocarburos alifáticos\n12\nHierro Total\n13\nHumedad\n14\nPh\n15\nArsénico\n16\nMolibdeno\n17\nVanadio\n18\nCobalto\n19\nManganeso\nFuente: ANLA.2023.\nNumeral 6 del Artículo Tercero\nLa Sociedad indica con respecto al presente numeral lo siguiente:\n“Los indicadores no pueden estar enfocados a la Recuperación de la Ciénaga, toda \nvez que las acciones de Manejo e indicadores establecidos por Mansarovar, son para \nel cumplimiento de requerimientos Legales establecidos dentro de su plan de Manejo \nAmbiental, los cuales dentro de  su alcance no se encuentra realizar la recuperación \nde la Ciénaga de Palagua, ya que la misma tiene otros aspectos relevantes que \nafectan directa o indirectamente este cuerpo de agua, como lo son la Ganadería, \ndescarga de aguas residuales domesticas entre otros. Por lo anterior, es importante \nindicar que MANSAROVAR, realiza seguimiento a parámetros fisicoquímicos que \npuedan verse afectados por las actividades propias de la operación del campo. \nAdicionalmente, actualmente no se cuenta con un diagnóstico técnico elaborado por \nparte de las autoridades competentes, que indique el estado ambiental de la Ciénaga, \nque permita determinar los diferentes proyectos licenciados que conviven con otros \nactores que convergen e interactúan con el cuerpo de agua puedan estar \nocasionando posibles tensiones ambientales sobre el ecosistema, para de esta forma \npoder establecer indicadores que midan de forma equitativa o justa el posible impacto \ngenerado por cada uno de ellos.”\nEn la Ficha BSM-10 programa de seguimiento y monitoreo de las comunidades \nhidrobiológicas se incluyen los siguientes indicadores:\n\nResolución No. 000926       Del 20 MAY. 2024          Hoja No. 39 de 74\n“Por la cual se resuelve un recurso de reposición interpuesto en contra de la \nResolución 2358 del 11 octubre de 2023” \nPágina 39 de 74\n•\nNo. De monitoreos programados/ No. de monitoreos efectuados\n•\nNo. De parámetros analizados/ No. de parámetros analizados con resultados \nfavorables bajo el Decreto 1594/84 Art. 72, 73 y 74 del Ministerio de salud.\nEl objetivo principal del Plan de monitoreo en la Ciénaga de Palagua es conocer el \nestado de la calidad del recurso hídrico superficial. Por lo tanto, es importante que la \nSociedad incluya indicadores relacionados con los parámetros específicos asociados \na la industria que desarrolla el proyecto en la región y que puedan afectar la calidad \ndel recurso en algún momento. Por lo tanto, se mantiene el requerimiento de “Incluir \nindicadores que reflejen la recuperación de las condiciones ambientales sobre el \ncuerpo de agua, siendo estos coherentes con el objetivo general del programa de \nmonitoreo en la Ciénaga” los cuales deberán ser considerados e incluidos dentro del \nPlan de Seguimiento y Monitoreo.\nAsí las cosas, esta Autoridad Nacional encuentra razón en la solicitud presentada por la \nSociedad en cuanto a que, los nuevos parámetros establecidos en los numerales 3 y 7 \ndel artículo tercero de la Resolución 2358 del 11 de octubre de 2023 serán los únicos a \nejecutar en cumplimiento del Plan de Manejo Ambiental, teniendo en cuenta que, la Tabla \nBSM-10.2 de la Ficha BSM-10 incluye puntos adicionales a los monitoreados en la Ciénaga \nde Palagua, y por tanto se procederá a reponer en el sentido de modificar los puntos de \nmonitoreo suprimiendo los puntos que actualmente son caracterizados allí y que \ncorresponden a los enumerados por el Concepto Técnico 9059 de 19 de diciembre de \n2023, pues pierden relación con la obligación . \nNo obstante, en referencia al numeral 6 del artículo tercero de la Resolución 2358 del 11 \nde octubre de 2023, no se encuentra sustento para retirar dicha obligación, por cuanto la \nverificación de los indicadores de recuperación de las condiciones ambientales de la \nCiénaga pues, si bien no son los únicos determinantes del estado ambiental del cuerpo \nhídrico, ello no le sustrae de su aporte contamínate, aspecto que debe ser monitoreado \npara el efectivo ejercicio de seguimiento y control ambiental, en este sentido esta Autoridad \nencuentra procedente no reponer y en consecuencia confirmar el precitado numeral.\n8.\nOBLIGACIÓN RECURRIDA – ARTÍCULO CUARTO. \nEl acto administrativo recurrido señala:\n“ARTÍCULO CUARTO. Ajustar vía seguimiento la FICHA MB-18 PROTECCIÓN Y \nCONSERVACIÓN DE HÁBITATS, establecida en el artículo décimo noveno de la \nResolución 408 del 12 de abril de 2017, y la medida 4 de la FICHA BSM-9 \nPROGRAMA DE SEGUIMIENTO Y MONITOREO A LOS ECOSISTEMAS \nESTRATÉGICOS Y SENSIBLES establecida en el artículo vigésimo primero de la \nResolución 408 del 12 de abril de 2017, en el sentido de incluir la siguiente medida, \nde conformidad con lo expuesto en la parte considerativa del presente acto \nadministrativo:\n\nResolución No. 000926       Del 20 MAY. 2024          Hoja No. 40 de 74\n“Por la cual se resuelve un recurso de reposición interpuesto en contra de la \nResolución 2358 del 11 octubre de 2023” \nPágina 40 de 74\n“Notificar en un término no mayor a tres (3) meses a la Autoridad Nacional en caso \nde que se detecten concentraciones inusuales en los parámetros fisicoquímicos, \nmicrobiológicos y/o hidrobiológicos, objeto de monitoreo y seguimiento.”\nPetición de la Sociedad. \nLa Sociedad en el recurso de reposición presentado mediante comunicación con radicado \nANLA 20236200797852 del 27 de octubre de 2023, indicó:\n“ruego de forma respetuosa a esta Autoridad adicional a lo planteado en el escrito con \nradicado ANLA 2023- 620- 078626-2 REPONGA en el sentido de REVOCAR la \ndecisión contenida en el artículo cuarto de la Resolución 2358 del 11 de octubre de \n2023”.\nArgumentos de la Sociedad. \nSegún lo enunciado en el recurso de reposición, la Sociedad, argumenta lo siguiente:\n(…) “dentro del ordenamiento jurídico ambiental vigente no existe definición alguna \ndel término empleado por la autoridad ambiental en el artículo cuarto de la Resolución \nobjeto de recurso “concentraciones inusuales” por lo que no hay regulación para \nparámetros fisicoquímicos, microbiológicos y/o hidrobiológicos que permitan \nestablecer cuando se trata o no de una “concentración inusual”.\nPor otra parte, la ANLA debe considerar que en muchas ocasiones las \nconcentraciones inusuales como lo expone la ANLA podrían tener origen en la \ndinámica natural propia de la Ciénega de Palagua en su conexión directa con el Rio \nMagdalena. Así, los cambios de comportamiento en las concentraciones estarán \nrelacionados con fenómenos naturales asociados al cuerpo de agua, los cuales a su \nvez tienen tiempos de equilibrio y/o resiliencia. La normalidad o estabilidad del \nsistema obedece a tiempos superiores, en su mayoría a tres meses, teniendo en \ncuenta los comportamientos pluviométricos que definen en gran medida este tipo de \nparámetros. Cada periodo climático – tiempo seco y de lluvias, tiene un espacio de \ntiempo de alrededor de 6 meses, momentos en los cuales el sistema se regula y las \nposibles anomalías de forma puntual no son un indicador espacio temporal que defina \nel estado del sistema.\n¿Cuándo es inusual? ¿Cuándo es una concentración inusual? todo depende de las \ncondiciones al momento del muestreo? ¿Puede ser por Causas naturales? \nFinalmente, en el Plan de Manejo Ambiental de Campo Velásquez, en específico el \nplan de monitoreo de la Ciénaga, la ANLA ya ha requerido el seguimiento y análisis \nde forma frecuente a los parámetros fisicoquímicos, microbiológicos y/o \nhidrobiológicos. De esta forma ya se vienen realizando el seguimiento específico al \ncomportamiento de los valores y este es reportado con el análisis suficiente.” \nConsideraciones Técnicas y Jurídicas de la ANLA. \nQue frente a lo anterior, esta Autoridad Nacional consideró en el Concepto Técnico 9059 \ndel 19 de diciembre de 2023, lo siguiente:\n\nResolución No. 000926       Del 20 MAY. 2024          Hoja No. 41 de 74\n“Por la cual se resuelve un recurso de reposición interpuesto en contra de la \nResolución 2358 del 11 octubre de 2023” \nPágina 41 de 74\n“De acuerdo con las metas establecidas en la FICHA No 18 Protección y conservación \nde ecosistemas estratégicos, áreas sensibles y/o áreas naturales protegidas se \nestablece:\nReducir el impacto negativo que pueden generar cada una de las actividades del \nproyecto sobre los ecosistemas identificados en el área de influencia, especialmente \naquellos categorizados como ecosistemas estratégicos, sensibles y/o áreas naturales \nprotegidas, a través del cumplimiento al 100% de las medidas de manejo propuestas \nen este programa.\nEn este sentido esta medida se encuentra alineada con la meta toda vez que la \nprevención de impactos negativos indirectos sobre ecosistemas estratégicos, en este \ncaso la ciénaga de Palagua, \nSin embargo, una vez revisados los argumentos de la Sociedad, teniendo en cuenta \nque el término “inusuales” es subjetivo y da lugar a diferentes interpretaciones; y que \nno es claro el momento al partir del cual se contaría el tiempo para reportar.\nDe conformidad con lo preceptuado por el Concepto Técnico 9059 del 19 de diciembre de \n2023, en relación con el término “inusuales” dentro de la medida que se pretendía ajustar \nvía seguimiento para incluirla a la Ficha MB-18 Protección y Conservación de Hábitats y la \nmedida 4 de la Ficha BSM-9 Programa de Seguimiento y Monitoreo a los Ecosistemas \nEstratégicos Sensibles, en cuanto a: “Notificar en un término no mayor a tres (3) meses a \nla Autoridad Nacional en caso de que se detecten concentraciones inusuales en los \nparámetros físicoquímicos, microbiológicos y/ hidrobiológicos, objeto de monitoreo y \nseguimiento” según la obligación del artículo cuarto de la Resolución 2358 del 11 de octubre \nde 2023, esta Autoridad Nacional le halla razón a la Sociedad en cuanto a que la palabra \n“inusual” es subjetiva y en consecuencia, acepta revocar este requerimiento.\nEs dado mencionar que la exigibilidad de una norma en el ámbito jurídico requiere que esta \nsea objetiva, clara y previsible, evitando cualquier forma de subjetividad que pueda generar \nincertidumbre, arbitrariedad o discriminación. La objetividad en las normas es esencial para \ngarantizar el cumplimiento del principio de legalidad, la seguridad jurídica, la igualdad ante \nla ley y el adecuado control administrativo y judicial conforme a la Constitución y a las leyes.\nPor lo anterior, esta Autoridad Nacional repondrá, en el sentido de revocar, el artículo cuarto \nde la Resolución 2358 del 11 de octubre de 2023, por los argumentos expuestos por la \nSociedad recurrente y decisión que será visible en la parte resolutiva del presente acto \nadministrativo.\n9.\nOBLIGACIÓN RECURRIDA – ARTÍCULO QUINTO.\nEl acto administrativo, señala:\n“ARTÍCULO QUINTO. Ajustar vía seguimiento la medida de seguimiento y monitoreo \nde bioacumulación en peces y macrófitas establecida en las FICHAS BSM-10 \nPROGRAMA DE SEGUIMIENTO Y MONITOREO DE LAS COMUNIDADES \nHIDROBIOLÓGICAS y MB-21 REMOCIÓN DE TARULLA, establecidas en el artículo \n\nResolución No. 000926       Del 20 MAY. 2024          Hoja No. 42 de 74\n“Por la cual se resuelve un recurso de reposición interpuesto en contra de la \nResolución 2358 del 11 octubre de 2023” \nPágina 42 de 74\nvigésimo primero de la Resolución 408 del 12 de abril de 2017, de conformidad con \nlo expuesto en la parte considerativa del presente acto administrativo, que contenga \nlas siguientes actividades:\nEn relación con las Macrófitas\na) Reubicar los puntos de monitoreo de bioacumulación en macrófitas en la Ciénaga \nde Palagua mostrados a continuación; aplica solamente para los que se encuentran \nen la Ciénaga de Palagua, los demás puntos de monitoreo mantienen su localización, \nadoptando (en los puntos que apliquen) los códigos asignados en la columna “Código \nID ANLA:\nUbicación espacial de los puntos de monitoreo de bioacumulación en \nmacrófitas en la Ciénaga de Palagua\n\nResolución No. 000926       Del 20 MAY. 2024          Hoja No. 43 de 74\n“Por la cual se resuelve un recurso de reposición interpuesto en contra de la \nResolución 2358 del 11 octubre de 2023” \nPágina 43 de 74\nb) Detallar y estandarizar la metodología (como mínimo especie, tipo de órgano y \ncantidad de individuos) para determinar la presencia de metales pesados e \nhidrocarburos en macrófitas de manera que se garantice que la muestra sea \nrepresentativa para la detección de estos parámetros por bioacumulación.\nc) Tomar muestras de macrófitas de habito enraizado y hábito flotante; en caso de \nque las macrófitas enrizadas se encuentren más cercanas a la orilla, se desplazará el \npunto de monitoreo de manera perpendicular a la orilla, con el objetivo que se logre \nque incluir este hábito en la muestra, de acuerdo con los puntos planteados en la ficha \nASM-1. Aguas Residuales y Corrientes Receptoras (LENT6, LENT5, LENT4, LENT3, \nLENT2, LEMT18, LENT17, LEN13, LENT11, LENT9 y LENT 8)\nd) Incluir como mínimo los siguientes parámetros con los siguientes límites de \ndetección:\nEn relación con los Peces\na) Reubicar los puntos de monitoreo de bioacumulación en peces en la Ciénaga de \nPalagua, es importante indicar que aplica solamente para los que se encuentran en \nla Ciénaga de Palagua, lo demás puntos de monitoreo mantienen su localización.\nUbicación espacial de los puntos de monitoreo de bioacumulación en \nmacrófitas en la Ciénaga de Palagua.\n\nResolución No. 000926       Del 20 MAY. 2024          Hoja No. 44 de 74\n“Por la cual se resuelve un recurso de reposición interpuesto en contra de la \nResolución 2358 del 11 octubre de 2023” \nPágina 44 de 74\nb) Detallar y estandarizar la metodología (como mínimo especie, tipo de tejido, \ncantidad de organismos) para determinar la presencia de metales pesados e \nhidrocarburos en peces de manera que se garantice que la muestra sea \nrepresentativa para la detección de estos parámetros por bioacumulación.\nc) Garantizar que la muestra provenga de tejido muscular, se deben tomar muestras \nde peces de diferentes hábitos tróficos, (orden Siluriformes), omnívoros e insectívoros \n(órdenes Characiformes y Cichliformes), teniendo en cuenta los siguientes \nparámetros:\nPetición de la Sociedad. \nLa Sociedad en el recurso de reposición presentado mediante comunicación con radicado \nANLA 20236200786262 del 26 de octubre de 2023, solicitó “que la ANLA precise que los \nparámetros referidos en la Resolución 2358 del 11 de octubre de 2023, en su artículo quinto \nliteral d, con relación a las Macrófitas y los parámetros establecidos en el literal c con \nrelación a Peces, deben ser los parámetros que la Autoridad requiera a Mansarovar como \núnicos a ejecutar en cumplimiento del plan de manejo ambiental, y dejar claridad que los \nparámetros establecidos en actos administrativos anteriores a este último requerimiento y \nlos parámetros relacionados en las fichas de monitoreo no se seguirán ejecutando, es que \nMansarovar Energy solo realizara los indicados en la Resolución 2358 del11 de octubre de \n2023” (subrayado fuera de texto).\nArgumentos de la Sociedad. \nSegún lo enunciado en el recurso de reposición, la Sociedad, argumenta lo siguiente:\n“Es necesario que la ANLA precise que los parámetros referidos en la Resolución \n2358 del 11 de octubre de 2023, en su artículo quinto literal d, con relación a las \nMacrófitas y los parámetros establecidos en el literal c con relación a Peces, deben \nser los parámetros que la Autoridad requiera a Mansarovar como únicos a ejecutar \n\nResolución No. 000926       Del 20 MAY. 2024          Hoja No. 45 de 74\n“Por la cual se resuelve un recurso de reposición interpuesto en contra de la \nResolución 2358 del 11 octubre de 2023” \nPágina 45 de 74\nen cumplimiento del plan de manejo ambiental, y dejar claridad que los parámetros \nestablecidos en actos administrativos anteriores a este último requerimiento y los \nparámetros relacionados en las fichas de monitoreo no se seguirán ejecutando, es \nque Mansarovar Energy solo realizara los indicados en la Resolución 2358 del11 de \noctubre de 2023.\nDe la misma manera la ANLA debe precisar el contenido del literal C, indicando que \nlos puntos planteados a Monitorear serán los indicados en la Fichas BSM-10 \nPROGRAMA DE SEGUIMIENTO Y MONITORED DE LAS COMUNIDADES \nHIDROBIOLOGICAS, según la ubicación de los puntos para el plan de muestreo de \naguas superficiales y Sedimentos de la Ciénaga de Palagua referido en el artículo \ntercero numeral 2”.\nConsideraciones Técnicas y Jurídicas de la ANLA. \nQue frente a lo anterior, esta Autoridad Nacional consideró en el Concepto Técnico 9059 \ndel 19 de diciembre de 2023, lo siguiente:\n“De acuerdo con la solicitado por la Sociedad, manifiesta que el ANLA debe precisar \nrespecto a los parámetros a medir en tejidos de peces y macrófitas “como únicos a \nejecutar” y que los puntos a “Monitorear serán los indicados”\nAl respecto, esta Autoridad Nacional se permite aclarar que no es posible condicionar \nobligaciones futuras desde el presente, teniendo en cuenta que estas pueden variar \nen la medida que cambien las condiciones.\nRespecto a “que los parámetros establecidos en actos administrativos anteriores a \neste último requerimiento y los parámetros relacionados en las fichas de monitoreo \nno se seguirán ejecutando”. Esta Autoridad Nacional se permite aclarar que no se han \nsolicitado parámetros nuevos por lo que se considera que no es viable aceptar esta \nsolicitud\nSin embargo, tanto para macrófitas como para peces es importante aclarar los \nsiguientes aspectos:\n•\nTeniendo en cuenta las características de movilidad que pueden tener los \norganismos vivos es importante aclarar que estas coordenadas son el centroide \nde un radio de acción de hasta 50 metros (100m de diámetro), dependiendo de la \npresencia de organismos al momento del muestreo.\n•\nPor otra parte, esta Autoridad Nacional se permite aclarar que, si bien existe oferta \nen el mercado de laboratorios que realizan la medición de estos parámetros con \nlos límites de detección propuestos, de acuerdo con lo informado por el IDEAM a \ncorte del 31 de octubre de 2023, estos no se encuentran acreditados para tejidos \nvegetales y/o animales. En consecuencia, se considera viable la modificación de \nlos límites de detección establecidos en el literal d) del apartado “en relación con \nlas macrófitas” del artículo quinto de la Resolución 2358 del 11 de octubre de 2023, \nen el sentido de suprimir los límites de detección propuestos. Sin embargo, se pone \na consideración de la Sociedad la selección de un laboratorio que ofrezca los \n\nResolución No. 000926       Del 20 MAY. 2024          Hoja No. 46 de 74\n“Por la cual se resuelve un recurso de reposición interpuesto en contra de la \nResolución 2358 del 11 octubre de 2023” \nPágina 46 de 74\nlímites de detección con la sensibilidad propuesta o en su defecto con la mayor \nsensibilidad posible y que a su vez cuenten con una metodología de análisis \naprobada por estándares internacionales y /o avaladas dentro del sistema de \ncalidad del laboratorio contratado.\nPor otra parte esta Autoridad Nacional se permite aclarar que tanto para el apartado \nde macrófitas como para el de peces se sustituye el verbo reubicar por el de \nreemplazar teniendo en cuenta que hay un incremento de puntos y reubicar sería \naplicable solo si se mantuviera el mismo número de puntos.\nAdicionalmente para el caso de monitoreo parámetros en tejidos tanto de peces como \nde macrófitas, las técnicas usadas, deberán ser validadas por los laboratorios que las \nrealicen.”\nDe conformidad con el Concepto Técnico 9059 del 19 de diciembre de 2023, esta Autoridad \nNacional no accede a la petición de la Sociedad en relación con que se indicara como \n“únicos” los parámetros de la medida de seguimiento y monitoreo de bioacumulación en \npeces y macrófitas establecida en las Fichas BSM-10 Programa de Seguimiento y \nMonitoreo de las Comunidades Hidrobiológicas determinados por el artículo quinto  literal \nd), en relación con los parámetros frente a las Macrófitas y literal c) con respecto a los \nPeces, de la Resolución 2358 del 11 de octubre de 2023, toda vez que dichos parámetros \npueden variar en el futuro según las condiciones propias del proyecto.\nAtendiendo al argumento anteriormente esbozado, y aun cuando no se repone respecto a \nlo recurrido por la Sociedad, esta Autoridad encuentra procedente realizar algunas \nmodificaciones teniendo en cuenta el análisis técnico efectuado. \nPor una parte, tanto en relación con las Macrófitas como para los Peces, en ambos casos \nel literal a), del artículo quinto de la Resolución 2358 del 11 de octubre de 2023, las \ncoordenadas determinadas son el centroide de un radio de acción de hasta 100 metros de \ndiámetro, sujeto a la presencia de organismos al momento de muestreo. Se modificará el \nverbo de la medida de “reubicar” a “reemplazar” los puntos de monitoreo de bioacumulación \nen la Ciénaga de Palagua, por cuanto se está haciendo referencia a coordenadas.\nPor otra parte, es de mencionar que ante la oportunidad de revisar la obligación contenida \nen el artículo quinto de la Resolución 2358 del 11 de octubre de 2023, objeto de recurso, y \npoder ajustar las decisiones de esta Autoridad Nacional a Derecho, se estima oportuno \nacoger la consideración del Concepto Técnico 9059 del 19 de diciembre de 2023, en el \nsentido de modificar el literal d) para Macrófitas y el literal c) para peces, del artículo quinto \npara suprimir los límites de detección propuestos para los parámetros por bioacumulación, \ntoda vez que no se cuenta con laboratorios acreditados por el IDEAM, para tejidos vegetales \ny/o animales. Por lo tanto, no es dado exigir a la Sociedad una obligación que no puede \ncumplir. \n10. OBLIGACIÓN RECURRIDA – ARTÍCULO SEXTO\nEl acto administrativo recurrido señala:\n\nResolución No. 000926       Del 20 MAY. 2024          Hoja No. 47 de 74\n“Por la cual se resuelve un recurso de reposición interpuesto en contra de la \nResolución 2358 del 11 octubre de 2023” \nPágina 47 de 74\n“ARTÍCULO SEXTO. Para la presentación de los monitoreos hidrobiológicos y \nfisicoquímicos a realizarse en la ciénaga de Palagua, así como para las muestras de \nsedimentos, la Sociedad ECOPETROL deberá cumplir con las siguientes \ncondiciones:\n1.\nEn los Informes de Cumplimiento Ambiental- ICA se deberá anexar la información \nde soporte de los monitoreos como registro fotográfico, formatos de campo \ndurante la toma de muestras, cadenas de custodia y reportes de laboratorio. \nAdicionalmente, se deberá reportar la información del resultado de los monitoreos \ndel uso y aprovechamiento de los recursos naturales a través del instrumento de \ninforme de cumplimiento ambiental acogiendo el código ID ANLA asignado, es \ndecir, que dentro del modelo de datos geográfico en el campo de “OBSERV” \nsegún corresponda el componente, el usuario debe remplazar y adoptar esta \ncodificación, garantizando que sea el mismo en todas las entregas que realice a \nesta Autoridad.\n2.\nLos resultados de los monitoreos en cuerpos hídricos superficiales deberán ser \npresentados en el Modelo de Almacenamiento Geográficos – MAG de \nconformidad con las disposiciones de la Resolución 2182 del 23 de diciembre de \n2016 o aquella que la modifique o sustituya, diligenciando de manera completa \ntodos los campos solicitados y reportando los códigos designados por ANLA \n(asociando el código único ID_ANLA asignado) para los puntos de monitoreo. El \nusuario debe adoptar esta codificación y no podrá ser modificada parcial o \ntotalmente, garantizando que sea el mismo código en todas las entregas que \nrealice a esta Autoridad.\n3.\nRemitir los resultados de los monitoreos fisicoquímicos y microbiológicos en un \nplazo no mayor a tres meses después de realizar el monitoreo de cada campaña. \nLa información deberá ser remitida a esta autoridad a través del portal de \nrecepción de información de ÁGIL disponible en la página web de la Entidad, para \nel cual la Sociedad deberá solicitar usuario y contraseña de acceso en el correo \nlicencias@anla.gov.co con copia al correo centromonitoreo@anla.gov.co. Se \naclara que el usuario es único y debe solicitarse a través del representante legal \nde la empresa a cargo del instrumento de manejo y control.\n4.\nLos resultados de monitoreo hidrobiológicos y de matiz de sedimentos deberán \nseguir siendo remitidos vía ICA.\n5.\nAdicionalmente, todos los resultados de los monitoreos fisicoquímicos e \nhidrobiológicos deberán presentarse de forma acumulada en los Informes de \nCumplimiento Ambiental – ICA, presentando la información consolidada y \ntabulada, con su respectivo análisis de tendencia, comparando los resultados del \nperiodo reportado con los obtenidos en periodos anteriores.\nPetición de la Sociedad. \nLa Sociedad en el recurso de reposición presentado mediante comunicación con radicado \nANLA 20236200786262 del 26 de octubre de 2023, solicitó:\n\nResolución No. 000926       Del 20 MAY. 2024          Hoja No. 48 de 74\n“Por la cual se resuelve un recurso de reposición interpuesto en contra de la \nResolución 2358 del 11 octubre de 2023” \nPágina 48 de 74\n“Se solicita aclaración a la Autoridad en el sentido de precisar si se remitir algún \nprocedimiento o si se efectuara capacitación para realizar el cargue requerido en el \nportal de información AGIL Adicionalmente, MANSAROVAR solicita que no se \ncontemple el cargue de la información en la plataforma, dentro de los tiempos de \ncumplimiento, teniendo en cuenta que las plataformas o portales a veces tienen \ninconvenientes para realizar el cargue de la información por inconvenientes de Red, \nAdicionalmente esta plataforma o portal no es de autonomía de Mansarovar si llega \na presentar faIla”.\nArgumentos de la Sociedad. \nSegún lo enunciado en el recurso de reposición, la Sociedad, argumenta lo siguiente:\n“En primer lugar, debe indicarse que este artículo establece como destinatario de la \nobligación a Ecopetrol S.A., por lo que, la totalidad del artículo sexto debe reponer en \nel sentido de excluir a Ecopetrol S.A. como destinatario de lo allí dispuesto y por ende \nserá deber de la ANLA aclarar si lo previsto en el artículo sexto es también exigible a \nMansarovar de ser es importante precisar:\n-En dicho artículo se indica que se debería reportar la información del resultado de \nlos monitores del uso y aprovechamiento de los recursos naturales, sin embargo, \nMANSAROVAR aclara que no realiza ningún tipo de aprovechamiento de los recursos \nnaturales de la Ciénaga.\n-Respecto de los resultados de los monitoreos en cuerpos hídricos superficiales, \ndeben ser presentados en el Modelo de almacenamiento geográfico -MAG de \nconformidad con las disposiciones de la Resolución 2182 del 23 de diciembre de 2016 \no aquella que la modifique o sustituya, diligenciando de manera completa todos los \ncampos solicitados y reportando los códigos designados por la ANLA (asociando el \ncódigo único ID_ANLA asignado) para los puntos de monitoreo. El usuario debe \nadoptar esta codificación y no podrá ser modificada parcial o totalmente, garantizando \nque sea el mismo código en todas las entregas que realice a esta autoridad.\nPor lo anterior, exponer las aclaraciones sobre los campos específicos de cada \nfeature class o tabla que compone la GDB de los monitoreos en Campo Velásquez, \nde acuerdo con el modelo de datos geográfico de conformidad con las disposiciones \nde la Resolución 2182 del 23 de diciembre de 2016:\nFeature class “Punto Muestreo Agua super\"\ncampos Condicionales:\nOCASIONAL: Solo aplica para contingencia o requerimientos de entes de control, \netc, por lo tanto, los seguimientos son de carácter periódico, este campo estará vacío.\nFC_MON_AGU: Solo aplica para Ocupación de Cauce, Captaciones de Agua \nSuperficiales y Vertimientos; Los cuerpos de agua monitoreados por Mansarovar \nEnergy Colombia LTD no presentan dichas afectaciones y/o no se relacionan con \nestas actividades, por lo que no se incluye en la GDB.\n\nResolución No. 000926       Del 20 MAY. 2024          Hoja No. 49 de 74\n“Por la cual se resuelve un recurso de reposición interpuesto en contra de la \nResolución 2358 del 11 octubre de 2023” \nPágina 49 de 74\nID_ACT_REL: Es lisada al campo FC_MON_AGU. El cual no se diligencia por las \nrazones anteriormente descritas.\nT_CAUDAL: solo se diligencia en puntos de muestreo lotico o que presenten flujo \nmedible como los pozos sépticos.\nN_NV_SUB: La información en la zona esta desactualizada, esta debe ser publicada \npor la Corporación Autónoma de Boyacá (CORPOBOYACÁ) y a la fecha no se tiene \ninformación.\nTabla “Muestreo FisocoquimSuperTB\"\nCampos Condicionales:\n“N_VERTICAL”: Este campo solo aplica para muestreos integrados. Los muestreos \nde agua superficial, hidrobiológicos y agua residual son de tipo puntual.\n“N_SUBMUEST”: Este campo solo aplica para muestreos compuestos. Los \nmuestreos de agua superficial, hidrobiológicos y agua residual son de tipo puntual.\n“INTERV_H”: Este campo solo aplica para muestreos compuestos e integrados. Los \nmuestreos de agua superficial, hidrobiológicos y agua residual son de tipo puntual.\n“DURACIÓN”: Este campo solo aplica para muestreos compuestos e integrados. Los \nmuestreos de agua superficial hidrobiológicos y agua residual son de tipo puntual.\n“PROF_MUES\": Las muestras son tomadas en la parte superficial de los cuerpos de \nagua.\n“NUBOSIDAD, \nTEMP_AIRE, \nVEL_VIENTO, \nHUM_REL, \nTEMP_ROC, \nPRESIO_ATM, \nAREA_EST, \nME_MED_OF, \nCOT_MAX_IN, \nNIV_AGUA. \nMET_ME_NIV, CAUDAL: No hacen parte del alcance del monitoreo ya que no son \nrequeridos según los actos administrativos de campo Velásquez (Res. 412 del 12 de \nMay/98. Art 4 Num 5 MAVDT, Res. 905 del 08 de Jul/05, Art 2 Num 5.3 y 14 MAVDT., \nAuto 0899 del 10 de May/06 Art 1 Num 1 MAVDT, Auto 2814 del 12 de Oct/07 Art 2 \nNum 1a y 4.3.2. MAVDT, Auto 2903 de 2014 Art 5, Resolución 2905 de 2014, Art 4 \nptp 2, Resolución 1212 de 2015 Art 2. CORPOBOYACA.\n- Resolución 408 de 2017, Art.22-PMA Ficha ASM-1Aguas residuales y corrientes \nreceptoras, Ficha BSM-10 Programa de seguimiento a comunidades hidrobiológicas, \nAuto 03472 de 2018- Art 3 Num.1).\nCampos obligatorios:\n“ME_MED_OF”: No hacen parte del alcance del monitoreo ya que no son requeridos \nsegún los actos administrativos de Campo Velásquez (Res. 412 del 12 de May/98. Art \n4 Num 5 MAVDT, Res. 905 del 08 de Jul/05 Art 2 Num 5.3 y 14 MAVDT, Auto 0899 \ndel 10 de May/06, Art 1 Num 1 MAVDT, Auto 2814 del12 de Oct/07 Art 2 Num 1a y \n43.2. MAVDT, Auto 2903 de 2014 Art 5, Resolución 2905 de 2014, Art 4 ptp 2, \nResolución 1212 de 2015 Art 2. CORPOBOYACÁ.\n\nResolución No. 000926       Del 20 MAY. 2024          Hoja No. 50 de 74\n“Por la cual se resuelve un recurso de reposición interpuesto en contra de la \nResolución 2358 del 11 octubre de 2023” \nPágina 50 de 74\n- Resolución 408 de 2017, Art.22-PMA Ficha ASM-1Aguas residuales y corrientes \nreceptoras, Ficha BSM-10 Programa de seguimiento a comunidades hidrobiológicas, \nAuto 03472 de 2018-Art 3 Num.1).\n“INDICE_ICA, ICOMO, ICOMI, ICOSUS: Cuando no se diligencia indica que solo \naplican para agua superficial natural.\n----------------------------------------------\nTabla \"ParamFisicoquimSuperTB\"\nCampos Condicionales:\n“COND_DETEC\": Solo aplica cuando el valor reportado es menor al límite \ncuantificable por la técnica analítica empleada en el laboratorio.\n----------------------------------------------\nTabla “CaracterizaSedimentoTB\"\n \nCampos Condicionales:\n“tNTERV_h\": Este campo solo aplica para muestreos compuestos e integrados. Los \nmuestreos de sedimentos son de tipo puntual.\n“GRAVAS, ARENAS, LIMOS, ARCILLAS, TEMP, PH, SOL_TOT, CONT_HUM, \nPES_ESP, POROS, ALCAL, DUREZA, CONDUCT, DBO_SOL, DBO_PART, \nDQO_SOL, DQO_PART, MAT_ORG, DEM_BENT, SULF_TOT, SULF_AC_VO, \nCIC, POT_OR, SVT, CAR_ORG_DI, HIERRO, CALCO, MAGNESIO, SODIO, \nNITR_TOT, NITR_AMON, NITRITOS, NITRATOS, AMON, FOSFAT, FOSF_ORGA, \nFOSF, PCB, BTEX, ARSENICO, CROMO_HEXA, ZINC, COBRE, PLATA, NIQUEL, \nGRASAC, ORGANOC, ORGANOF, FENOL. CIANURO, COT:  No hacen parte del \nalcance del monitoreo ya que no son requeridos según los actos administrativos de \nCampo Velásquez (Res. 412 del 12 de May/98. Art 4 Num S MAVDT, Res. 905 del 08 \nde Jul/05 Art 2 Num 5.3 y14 MAVDT, Auto 0899 del 10 de May/06 Art 1 Num 1 \nMAVDT, Auto 2814 del 12 de Oct/07 Art 2 Num la y 4.3.2. MAVDT, Auto 2903 de 2014 \nArt 5, Resolución 2905 de 2014 Art 4 ptp 2, Resolución 1212 de 2015 Art 2. \nCORPOBOYACÁ.\n- Resolución 408 de 2017, Art.22-PMA Ficha ASM-1 Aguas residuales y corrientes \nreceptoras, Ficha BSM-10 Programa de seguimiento a comunidades hidrobiológicas, \nAuto 03472 de 2018- Art 3 Num.1)\n------------------------------------------\nTabla “MuestreoHidrobioTB\"\nCampos Condicionales:\n“PROF_MUES”: Solo aplica a cuerpos de agua lénticos.\n\"INTERV_h,, AREA_EST, PROF_SECCH\": No hacen parte del alcance del \nmonitoreo ya que no son requeridos según los actos administrativos de Campo \nVelásquez (Res. 412 del12 de May/98. Art 4 Num 5 MAVDT, Res. 905 del 08 de Jul/05 \nArt 2 Num 5.3 y 14 MAVDT, Auto 0899 del 10 de May/06 Art 1 Num 1 MAVDT, Auto \n2814 del 12 de Oct/07 Art 2 Num 1ª y 4.3.2. MAVDT, Auto 2903 de 2014, Art 5, \nResolución 2905 de 2014, Art 4 ptp 2, Resolución 1212 de 2015, Art 2. \nCORPOBOYACÁ.\n\nResolución No. 000926       Del 20 MAY. 2024          Hoja No. 51 de 74\n“Por la cual se resuelve un recurso de reposición interpuesto en contra de la \nResolución 2358 del 11 octubre de 2023” \nPágina 51 de 74\n- Resolución 408 de 2017, Art.22-PMA Ficha ASM-1 Aguas residuales y corrientes \nreceptoras, Ficha BSM-10 Programa de seguimiento a comunidades hidrobiológicas, \nAuto 03472 de 2018- Art 3 Num.1).\n-Remitir los resultados de los monitoreos fisicoquímicos y microbiológicos en un plazo \nno mayor a tres meses después de realizar el monitoreo de cada campaña. La \ninformación deberá ser remitida a esta autoridad a través del portal de recepción de \ninformación de AGIL (Aplicativo de Gestión e información en línea), disponible en la \npágina web de la entidad, para el cual la sociedad deberá solicitar usuario y \ncontraseña de acceso al correo licencias@anla.gov.co con copia al correo \ncentromonitoreo@anla.gov.co. Se aclara que el usuario es único y debe solicitarse a \ntravés del representante legal de la empresa a cargo del instrumento de manejo y \ncontrol.”\nConsideraciones Técnicas y Jurídicas de la ANLA. \nQue frente a lo anterior, esta Autoridad Nacional consideró en el Concepto Técnico 9059 \ndel 19 de diciembre de 2023, lo siguiente:\n“Revisado el documento de Concepto Técnico de Alcance donde se establece la \nentrega de la información de los monitoreos de agua superficial mediante el portal \ndado por ANLA para la unificación de los mismos, con la respectiva codificación, \nrespecto al programa 10.3. Propuesta de Ajuste de fichas de seguimiento y monitoreo \ndel medio Físico y del medio Biótico- 10.3.1. Ajuste de la Ficha ASM-1. Aguas \nresiduales y corrientes superficiales:\nAjustar la Ficha ASM-1. Aguas residuales y corrientes superficiales en el sentido de:\nAgua superficial; a. Periodicidad de los monitoreos: tendrá una intensidad trimestral \ncompartida entre las Sociedades ECOPETROL y MANSAROVAR; en donde \nMANSAROVAR realizará el monitoreo semestral en los meses de junio y diciembre.\nSe da en cumplimiento a la estrategia regional de monitoreo del recurso hídrico \nsuperficial para el Valle Medio Magdalena; Condición dada a conocer en las mesas \ntécnicas los días 20 de enero, 10 y 24 de febrero, así como el 6 y 7 de marzo, tanto \ncon Ecopetrol S.A (titular del instrumento de control y seguimiento del Expediente \nLAM0232) como con Mansarovar Energy Colombia Ltd, proyecto que colinda con el \nexpediente LAM0332, comparte puntos de monitoreo en la ciénaga Palagua. En \ndichas mesas técnicas se concertaron condiciones de modo, tiempo y lugar de los \nmonitoreos.\nDentro de la solicitud de ajuste a la ficha 10.3.1. Ajuste de la Ficha ASM-1. Aguas \nresiduales y corrientes superficiales, se hace relación de la obligación de la siguiente \nmanera:\n(…)\na. Periodicidad de los monitoreos: tendrá una intensidad trimestral compartida entre \nlas Sociedades ECOPETROL y MANSAROVAR; en donde MANSAROVAR realizará \nel monitoreo semestral en los meses de junio y diciembre.\n\nResolución No. 000926       Del 20 MAY. 2024          Hoja No. 52 de 74\n“Por la cual se resuelve un recurso de reposición interpuesto en contra de la \nResolución 2358 del 11 octubre de 2023” \nPágina 52 de 74\nb. Ubicación de los puntos de muestreo para el Plan de Monitoreo de Aguas \nSuperficiales y Sedimentos de la Ciénaga de Palagua, el cual garantice que las \nmuestras tomadas sean representativas para el área de la Ciénaga de Palagua, esto \nde acuerdo con la distribución relacionada en la siguiente tabla, aclarando que la \nsociedad MANSAROVAR ENERGY COLOMBIA LTD deberá adoptar los códigos \nasignados en la columna “Código ID ANLA”:\n(…)\nDonde se deja clara la obligación a cumplir por parte de la sociedad MANSAROVAR \nENERGY COLOMBIA LTD; Finalmente frente a la solicitud por parte de la sociedad, \nrespecto a la entrega de un procedimiento o capacitación para el cargue en el portal \nde recepción de información de ÁGIL disponible en la página web de la Entidad, se \ninforma que la Sociedad deberá solicitar usuario y contraseña de acceso en el correo \nlicencias@anla.gov.co con copia al correo centromonitoreo@anla.gov.co. Se aclara \nque el usuario es único y debe solicitarse a través del representante legal de la \nempresa a cargo del instrumento de manejo y control. De igual manera, en caso de \nrequerirse espacio de capacitación se debe realizar la solicitud a través de correo \nelectrónico centromonitoreo@anla.gov.co para la programación del mismo.\nPor último, respecto a los tiempos de entrega de la información, esta se deberá dar \nen los términos establecidos en la obligación; en caso de presentarse algún \ninconveniente en el cargue de la misma a través del portal de la entidad, se deberá \ninformar por los canales de comunicación de la entidad con un tiempo prudencial \nsobre la indisponibilidad y/o inconveniente presentado. De igual manera, la sociedad, \ndeberá realizar la entrega de los soportes de los monitoreos de acuerdo a las \ncondiciones ya establecidas.” \nAsí las cosas, y en virtud del análisis realizado por esta Autoridad Nacional, se considera \nprocedente aclarar el artículo sexto de la Resolución 2358 del 11 octubre de 2023, una vez \nevaluados los argumentos presentados por la Sociedad a través del Concepto Técnico 9059 \ndel 19 de diciembre de 2023.\nPrimero, la obligación de presentar los monitoreos hidrobiológicos y fisicoquímicos a \nrealizarse en la ciénaga de Palagua, así como para las muestras de sedimentos, \nciertamente corresponde tanto a ECOPETROL S.A. como a la Sociedad MANSAROVAR \nENERGY COLOMBIA LTD., lo cual atiende a una medida que da cumplimiento a la \nestrategia regional de monitoreo del recurso hídrico superficial para el Valle Medio \nMagdalena, previamente conocido por MANSAROVAR, no obstante es de anotar que el \nacto administrativo recurrido va dirigido expresamente a esta última sociedad como titular \nde la licencia ambiental que nos ocupa en el presente expediente, esta Autoridad procede \na aclarar que la determinación contenida por el artículo sexto de la Resolución 2358 del 11 \noctubre de 2023 va dirigida a dicha Sociedad.  \nSegundo, el numeral uno del artículo sexto de la Resolución objeto del presente análisis \nindica que la Sociedad debe reportar la información del resultado de los monitoreos del uso \ny aprovechamiento de los recursos naturales. Esta Autoridad Nacional confirma que en \nefecto la Sociedad actualmente no realiza ningún uso ni aprovechamiento de recursos \n\nResolución No. 000926       Del 20 MAY. 2024          Hoja No. 53 de 74\n“Por la cual se resuelve un recurso de reposición interpuesto en contra de la \nResolución 2358 del 11 octubre de 2023” \nPágina 53 de 74\nnaturales en la Ciénaga de Palagua, pero no encuentra procedente excluir esta \ndeterminación toda vez que las condiciones en el futuro pueden cambiar. Así las cosas, \nMANSAROVAR ENERGY COLOMBIA LTD. debe efectuar los reportes conforme a la \nrealidad en la que se encuentre el proyecto al momento de la presentación de los informes, \nsegún lo concertado en las mesas técnicas en las condiciones de modo, tiempo y lugar de \nlos monitoreos.\nTercero, en cuanto, al reporte de la información en la plataforma ÁGIL, se reitera a la \nSociedad que puede solicitar un espacio de capacitación ante esta Autoridad a través del \ncorreo electrónico centromonitoreo@anla.gov.co , para así despejar las dudas que tenga \nen esta operación. Mientras que los tiempos de cumplimiento se mantienen toda vez que \nse considera tres (3) meses como un plazo razonable para realizar los reportes \ncorrespondientes y acordes con lo concertado en las mesas técnicas.\nPor último, respecto a las aclaraciones que realiza la Sociedad sobre la presentación de los \nresultados de los monitoreos en cuerpos hídricos superficiales en el Modelo de \nalmacenamiento geográfico – MAG de conformidad con las disposiciones de la Resolución \n2182 del 23 de diciembre de 2016 o aquella que la modifique o sustituya, diligenciando de \nmanera completa todos los campos solicitados y reportando los códigos designados por la \nANLA (asociando el código único ID_ANLA asignado) para los puntos de monitoreo, el \nequipo evaluador aclaró que las justificaciones asociadas con el no diligenciamiento de \nalgún campo, deben presentarse en cada entrega de resultados de monitoreo conforme \ncorresponda. Por lo tanto, esta Autoridad no encuentra procedente reponer la obligación y \nen consecuencia se confirma la decisión.\n11. OBLIGACIÓN RECURRIDA – LITERAL B DEL NUMERAL CINCO, ARTÍCULO \nSÉPTIMO.\nEl acto administrativo recurrido señala:\n“ARTÍCULO SÉPTIMO. Ajustar vía seguimiento la obligación establecida en el literal \nb numeral 5 del artículo cuarto de la Resolución 412 del 12 de mayo de 1998, en el \nsentido de modificar la intensidad de muestreo de los puntos de caracterización de \nagua superficial. Así la cosas la obligación quedaría de la siguiente manera:\n“ARTÍCULO CUARTO. (…)\n5. (…)\nb. Se efectuarán veinte (20) muestras para la ciénaga y cuatro (4) para los bajos \naledaños.”\nPetición de la Sociedad. \nLa Sociedad en el recurso de reposición presentado mediante comunicación con radicado \nANLA 20236200786262 del 26 de octubre de 2023, solicitó:\n“MANSAROVAR, Solicita precisar la ficha de Manejo que requiere el ajuste o \nmodificación es la Ficha BSM-10 PROGRAMA DE SEGUIMIENTO Y MONITOREO \n\nResolución No. 000926       Del 20 MAY. 2024          Hoja No. 54 de 74\n“Por la cual se resuelve un recurso de reposición interpuesto en contra de la \nResolución 2358 del 11 octubre de 2023” \nPágina 54 de 74\nDE LAS COMUNIDADES HIDROBIOLOGICAS. Una vez aclarado este punto, se \nprocederá a ajustar este requerimiento en la Resolución 412 del 12 de mayo de 1998, \ndentro de la ficha 3 A”.\nArgumentos de la Sociedad. \nLa Sociedad no presentó argumentos frente a la solicitud de aclaración de este artículo. \nConsideraciones Técnicas y Jurídicas de la ANLA. \nQue frente a lo anterior, esta Autoridad Nacional consideró en el Concepto Técnico 9059 \ndel 19 de diciembre de 2023, lo siguiente:\n“Revisado el Plan de Seguimiento y Monitoreo del Campo Velásquez, en la Ficha \nASM-1. Aguas Residuales y Corrientes Receptoras, con relación al monitoreo de \nAguas Superficiales se estipuló la siguiente medida general:\n“Monitoreos a cuerpos de agua superficial \nSe realizarán muestreos de carácter semestral en 4 caños o quebradas tributarias a \nla ciénaga de Palagua que atraviesen la infraestructura del Campo Velásquez, los \ncuales deberán realizarse tanto aguas arriba como aguas abajo de dicha \ninfraestructura. Los parámetros a analizar serán: temperatura, pH, conductividad, \ncloruros, color, oxígeno disuelto, nitritos, nitratos, fosforo, amonio, fenoles, coliformes \nfecales y totales, grasas y aceites, hidrocarburos alifáticos, hidrocarburos aromáticos \npolinucleares, hierro, bario, cadmio, plomo, cromo, molibdeno, vanadio y zinc.\n* Se debe anexar los monitoreos dentro de los Informes ICA del campo, los \nmonitoreos deben ser realizados por un laboratorio acreditado.”\nDicha medida, en efecto apunta hacia el monitoreo de cuerpos hídricos lóticos al \ninterior del área licenciada para el proyecto Campo Velásquez, más no al cuerpo \nhídrico denominado Ciénaga de Palagua, el cual es objeto de actualización del Plan \nde Monitoreo de Aguas Superficiales y Sedimentos.\nAsimismo, en la Ficha BSM-10 programa de seguimiento y monitoreo de las \ncomunidades hidrobiológicas se estipula lo siguiente:\n“Monitoreo fisicoquímico, bacteriológico e hidrobiológico de los ecosistemas \nacuáticos \nSe analizarán las características físico-bióticas de los cuerpos de agua susceptibles \nde intervención debido a las actividades del proyecto y aledaños a locaciones, en la \nTabla BSM-10.1 se presentan los parámetros a tener en cuenta para este monitoreo.\nTabla BSM-10.1\n\nResolución No. 000926       Del 20 MAY. 2024          Hoja No. 55 de 74\n“Por la cual se resuelve un recurso de reposición interpuesto en contra de la \nResolución 2358 del 11 octubre de 2023” \nPágina 55 de 74\nMonitoreos de parámetros fisicoquímicos y comunidades hidrobiológicas\nActividad\nFrecuencia\nEspecificaciones\nRequerido por\nEfectuar \nmonitoreo a \nla ciénaga \nPalagua\nSemestral y en dos \népocas climáticas \ndiferentes con el \nobjetivo de analizar \nperiodos climáticos \ncompletos\nParámetros Fisicoquímicos\nLos parámetros que se deben \nanalizar en agua son: INSITU: \nConductividad, oxígeno disuelto, \npH, Temperatura. En laboratorio: \nBario, \ncadmio, \ncloruros, \ncolor \nverdadero, \ncromo, \nfenoles, \nfosfatos, grasas y aceites, HAP \nHidrocarburos \naromáticos \npolicíclicos, hidrocarburos totales, \nhierro total, molibdeno, nitratos, \nnitritos, TPH, selenio, mercurio, \nplomo.\nEn \npeces, \nvegetación \ny \nsedimentos: Cadmio, Cromo total, \nplomo, \nHAP, \nhidrocarburos \nalifáticos, mercurio y selenio.\nEn adición a lo anterior, se \nanalizarán \nlos \nparámetros \nrequeridos en el numeral 3.2.5 de \nlos Términos de Referencia HI-\nTER-1-03\nParámetros Hidrobiológicos\nLas comunidades hidrobiológicas \nque se deben integrar al análisis de \nla calidad del agua en los cuerpos \nde \nagua \nsusceptibles \nde \nintervención o de afectación son: \nPerifiton, zooplancton, fitoplancton, \nmacrófitas y fauna íctica\nDe acuerdo con el numeral \n5 del artículo cuarto de la \nResolución 412 de 1998 \n1. Se deben efectuar 8 \nmuestras para la Ciénaga \nPalagua y 4 para los bajos \naledaños. Este monitoreo \nse debe realizar en  (14) \npuntos en la ciénaga de \nPalagua y (10) puntos  en \nlos bajos y caños aledaños \na las Baterías 1, 2, 2A, 3 y \nVelasquez-26.\n*Los resultados deben ser presentados al Ministerio del Medio Ambiente y a CORPOBOYACA.\nLa medición de parámetros in situ y la toma de muestras, así como los análisis de \nlaboratorio, se realizarán de acuerdo con los protocolos establecidos en la guía \nStandard Methods for Examination of Water and Wastewater, tanto para las variables \nfisicoquímicas como bióticas.\nLos muestreos de las comunidades hidrobiológicas se desarrollarán bajo las mismas \ncondiciones de áreas, tiempos, y métodos. Adicionalmente, serán comparables a \naquellos contenidos en la caracterización de los ecosistemas acuáticos que se vienen \ndesarrollando en el campo desde 2010 y han sido reportados en los Informes de \nCumplimiento Ambiental. Se evaluará la calidad de los cuerpos de agua y la variación \nde las comunidades hidrobiológicas bajo un análisis integral e histórico, partiendo de \nla información presentada en las caracterizaciones previas y complementando con \nlos análisis de resultados más recientes.\nLos resultados obtenidos serán comparados con la normatividad ambiental vigente \nen cuanto a los límites permisibles en el agua, según su uso (Decreto 1594 de 1984 \no el que lo sustituya). Adicionalmente, se analizará la correlación entre los parámetros \nfisicoquímicos, bacteriológicos e hidrobiológicos, y la bio-indicación de los organismos \nregistrados, con el fin de establecer cambios sobre la calidad del agua y las \n\nResolución No. 000926       Del 20 MAY. 2024          Hoja No. 56 de 74\n“Por la cual se resuelve un recurso de reposición interpuesto en contra de la \nResolución 2358 del 11 octubre de 2023” \nPágina 56 de 74\ncomunidades hidrobiológicas. En la Tabla BSM-10.2 se relacionan los cuerpos \nlénticos y lóticos en donde se desarrollarán las jornadas de monitoreo.\nTabla BSM-10.2\nCódigo\nNombre\nLOT1\nCaño \nPalagua \n(Desembocadura \nciénaga)\nLOT2\nCaño \nPalagua \n(Aguas \nabajo \ndesembocadura)\nLOT3\nCaño Las Pavas aguas arriba\nLOT4\nCaño Las Pavas aguas abajo\nLOT5\nCaño Sacamujeres aguas arriba\nLOT6\nCaño Sacamujeres aguas abajo\nLOT7\nCaño NN1 aguas arriba\nLOT8\nCaño NN1 aguas abajo\nLEN1\nMuelle Velásquez\nLEN2\nEntrada Aceitero\nLEN3\nBoca del Caño Agualinda\nLEN4\n1 Km Caño Agualinda\nLEN5\nBatería 3 Palagua\nLEN6\nMuelle Palagua\nLEN7\nDetrás de la Isla de la Fantasía ( Rincón \nOscuro)\nLEN8\nEntre Islas\nLEN9\nRincón Oscuro (La Cruz)\nLEN10\nEntrada del río\nLEN11\n1 Km entrada del río\nLEN12\n2 Km entrada del río\nLEN13\nBatería 2ª\nLEN14\nRincón de Cuadro\nLEN15\nBatería 1 aguas arriba\nLEN16\nBatería 1 aguas abajo\nLEN17\nBatería 2 aguas arriba\nLEN18\nBatería 2 aguas abajo\nLEN19\nBatería 3 aguas arriba\nLEN20\nBatería 3 aguas abajo\nLEN21\nVelásquez 26 aguas arriba\nLEN22\nVelásquez 26 aguas abajo\n(…)…”\nSegún lo anteriormente citado, en la Ficha BSM-10 programa de seguimiento y \nmonitoreo de las comunidades hidrobiológicas se enumeran los parámetros y los \npuntos de monitoreo en la Ciénaga y en puntos adicionales al interior del polígono \nlicenciado del Campo Velásquez. \nTeniendo en cuenta que en dicha tabla (Tabla BSM-10.2) de la ficha antes \nmencionada se incluyen puntos adicionales a los monitoreados en la Ciénaga de \nPalagua, la Sociedad deberá suprimir los puntos de monitoreo que actualmente son \n\nResolución No. 000926       Del 20 MAY. 2024          Hoja No. 57 de 74\n“Por la cual se resuelve un recurso de reposición interpuesto en contra de la \nResolución 2358 del 11 octubre de 2023” \nPágina 57 de 74\nmuestreados en la Ciénaga de Palagua y que corresponden a los enumerados en la \nsiguiente tabla:\nPuntos monitoreados actualmente en la Ciénaga de Palagua\nCOORDENADAS \nDATUM MAGNA \nSIRGAS ORIGEN \nBOGOTÁ\nCOORDENADAS DATUM \nMAGNA SIRGAS ORIGEN \nÚNICO NACIONAL\nPUNTO\nUBICACIÓN\nESTE\nNORTE\nESTE\nNORTE\n(PUNTO 1) \nMUELLE VELÁSQUEZ\n953048\n1161583\n4833880.27\n6\n2227540.56\n8\n(PUNTO 2)\nENTRADA ACEITERO\n953120\n1161606\n4833952.28\n6\n2227563.41\n4\n(PUNTO 3)\nDESEMBOCADURA \nCAÑO AGUALINDA\n953719\n1162216\n4834552.20\n5\n2228171.92\n7\n(PUNTO 4)\nKM 1 CAÑO \nAGUALINDA\n954283\n1161776\n4835115.05\n5\n2227731.02\n3\n (PUNTO 5)\nBATERÍA 3\n953081\n1162449\n4833914.97\n9\n2228406.08\n0\n (PUNTO 6)\nISLA DE LA FANTASÍA\n952036\n1162535\n4832870.65\n8\n2228494.11\n5\n (PUNTO 7)\nPUNTO CENTRAL DE \nCIÉNAGA \n952203\n1162008\n4833036.53\n0\n2227967.03\n9\n(PUNTO 8) \nMONTE OSCURO \n953120\n1162606\n4833954.27\n2\n2228562.92\n6\n (PUNTO 9) \nDESEMBOCADURA AL \nCAÑO PALAGUA\n951013\n1161833\n4831846.75\n8\n2227794.48\n5\n(PUNTO 10)\nEL PEÑÓN \n951470\n1162025\n4832303.91\n9\n2227985.48\n6\n(PUNTO 11)\nRINCÓN BATERÍA 2\n952223\n1161726\n4833055.96\n1\n2227685.13\n6\n(PUNTO 12)\nISLA EL ENCANTO \n952833\n1162250\n4833666.70\n5\n2228207.67\n0\n (PUNTO 13)\n1 KM ANTES DE CAÑO \nPALAGUA\n951033\n1161793\n4831866.66\n9\n2227754.46\n5\n(PUNTO 14) \nMUELLE PALAGUA\n952788\n1162424\n4833622.07\n2\n2228381.67\n5\n(PUNTO 15)\nACEITERO \n953123\n1161633\n4833954.33\n7\n2227589.39\n7\nFuente: ANLA con base en el Plan de Monitoreo en Cienaga de Palagua presentado por \nMansarovar en el ICA 35. 2023.\nLos demás puntos establecidos en la Tabla BSM-10.2 de la Ficha BSM-10 programa \nde seguimiento y monitoreo de las comunidades hidrobiológicas se mantendrán en \nlas mismas condiciones de localización, acogiendo los parámetros establecidos en \nlos numerales 3 y 7 del artículo segundo de la Resolución 2358 del 11 de octubre de \n2023.\nSe considera pertinente acoger lo recomendado por el Concepto Técnico 9059 del 19 de \ndiciembre de 2023 en relación con el artículo séptimo de la Resolución 2358 del 11 de \noctubre de 2023, para reponer en el sentido de aclarar que la ficha de manejo que será \nobjeto de ajuste y/o modificación es la denominada “Ficha BSM-10 programa de \nseguimiento y monitoreo de las comunidades hidrobiológicas”, lo cual se dispondrá en la \nparte resolutiva del presente acto administrativo”.\n\nResolución No. 000926       Del 20 MAY. 2024          Hoja No. 58 de 74\n“Por la cual se resuelve un recurso de reposición interpuesto en contra de la \nResolución 2358 del 11 octubre de 2023” \nPágina 58 de 74\nCONSIDERACIONES JURÍDICAS DE LA AUTORIDAD NACIONAL RESPECTO DE LAS \nOBLIGACIONES RECURRIDAS. \nQue en virtud de los principios orientadores consagrados en el Artículo 209 de la Carta \nPolítica, en concordancia con lo establecido en el artículo tercero del Código de \nProcedimiento Administrativo y de lo Contencioso Administrativo, las actuaciones \nadministrativas deben ampararse, de manera especial, en los principios de responsabilidad, \nlegalidad, coordinación, eficacia y celeridad, a saber:\n“Artículo 3°. Principios. Todas las autoridades deberán interpretar y aplicar las \ndisposiciones que regulan las actuaciones y procedimientos administrativos a la luz \nde los principios consagrados en la Constitución Política, en la Parte Primera de este \nCódigo y en las leyes especiales. Las actuaciones administrativas se desarrollarán, \nespecialmente, con arreglo a los principios del debido proceso, igualdad, \nimparcialidad, buena fe, moralidad, participación, responsabilidad, transparencia, \npublicidad, coordinación, eficacia, economía y celeridad.\n(…)\n7. En virtud del principio de responsabilidad, las autoridades y sus agentes asumirán \nlas consecuencias por sus decisiones, omisiones o extralimitación de funciones, de \nacuerdo con la Constitución, las leyes y los reglamentos.\n(…)\n10. En virtud del principio de coordinación, las autoridades concertarán sus \nactividades con las de otras instancias estatales en el cumplimiento de sus \ncometidos y en el reconocimiento de sus derechos a los particulares.\n (…)\n11. En virtud del principio de eficacia, las autoridades buscarán que los \nprocedimientos logren su finalidad y, para el efecto, removerán de oficio los \nobstáculos puramente formales, evitarán decisiones inhibitorias, dilaciones o \nretardos y sanearán, de acuerdo con este Código las irregularidades \nprocedimentales que se presenten, en procura de la efectividad del derecho material \nobjeto de la actuación administrativa. \n(…)\n13. En virtud del principio de celeridad, las autoridades impulsarán oficiosamente los \nprocedimientos, e incentivarán el uso de las tecnologías de la información y las \ncomunicaciones, a efectos de que los procedimientos se adelanten con diligencia, \ndentro de los términos legales y sin dilaciones injustificadas.”\n\nResolución No. 000926       Del 20 MAY. 2024          Hoja No. 59 de 74\n“Por la cual se resuelve un recurso de reposición interpuesto en contra de la \nResolución 2358 del 11 octubre de 2023” \nPágina 59 de 74\nQue esta Autoridad Nacional, en sus actuaciones administrativas, debe cumplir con los \nprincipios orientadores antes mencionados toda vez que dichas actuaciones son la \nmanifestación de la voluntad de la administración, sus efectos se traducen en crear, \nmodificar o extinguir derechos u obligaciones de carácter particular, personal y concreto, \ncon el fin de establecer una obligación tendiente a crear situaciones específicas, teniendo \ncomo presupuesto la sujeción al orden público y el respeto por las garantías y derechos de \nlos administrados.\nQue es preciso señalar la importancia que el principio fundamental al debido proceso reviste \npara asegurar también el cumplimiento de otros postulados fundamentales y de derechos \nde consagración constitucional y legal, como el derecho colectivo al ambiente sano, \nresponsabilidad de autoridades y particulares.\nQue la Corte Constitucional ha establecido que el derecho al debido proceso tiene unas \ngarantías previas y unas garantías posteriores, así:\n“La jurisprudencia constitucional ha diferenciado entre las garantías previas y \nposteriores que implica el derecho al debido proceso en materia administrativa. Las \ngarantías mínimas previas se relacionan con aquellas garantías mínimas que \nnecesariamente deben cobijar la expedición y ejecución de cualquier acto o \nprocedimiento administrativo, tales como el acceso libre y en condiciones de \nigualdad a la justicia, el juez natural, el derecho de defensa, la razonabilidad de los \nplazos y la imparcialidad, autonomía e independencia de los jueces, entre otras.\nDe otro lado, las garantías mínimas posteriores se refieren a la posibilidad de \ncuestionar la validez jurídica de una decisión administrativa, mediante los recursos \nde la vía gubernativa y la jurisdicción contenciosa administrativa.”\nQue es evidente que esta Autoridad respetó las garantías previas, ya que cumplió con todas \nlas formalidades para emitir la Resolución 2358 de 11 de octubre de 2023, por medio de la \ncual se realizó un ajuste vía seguimiento al Plan de Manejo Ambiental, entre otros, \nestableciendo una ficha de manejo relacionada con la atención de los Impactos No \nResueltos (INR), del proyecto “Campo Velásquez”, localizado en jurisdicción del municipio \nde Puerto Boyacá, en el departamento de Boyacá; y respetó las garantías posteriores, en \ntanto se concedió el respectivo recurso de reposición sobre el acto administrativo.\nQue con base en las consideraciones técnicas, descritas en el Concepto Técnico 9059 del \n19 de diciembre de 2023 y, teniendo en cuenta que esta Autoridad Ambiental consideró lo \nexpuesto por la sociedad recurrente, estableciendo para cada obligación recurrida un \nanálisis claro de las medidas que se establecieron, circunstancia que permitió confirmar su \npertinencia y proporcionalidad.\nQue es preciso aclarar que, cuando en el Concepto Técnico 9059 del 19 de diciembre de \n2023, se hizo referencia a las consideraciones que esta Autoridad Nacional hizo frente al \nliteral d) del artículo quinto de la Resolución 2358 de 11 de octubre de 2023, respecto a los \nparámetros a tener en cuenta en las FICHAS BSM-10 PROGRAMA DE SEGUIMIENTO Y \nMONITOREO DE LAS COMUNIDADES HIDROBIOLÓGICAS y MB-21 REMOCIÓN DE \nTARULLA, indicó: “(…). En consecuencia, se considera viable la modificación de los límites \nde detección establecidos en el literal d del apartado “en relación con las macrófitas” del \n\nResolución No. 000926       Del 20 MAY. 2024          Hoja No. 60 de 74\n“Por la cual se resuelve un recurso de reposición interpuesto en contra de la \nResolución 2358 del 11 octubre de 2023” \nPágina 60 de 74\nartículo tercero de la Resolución 2131 del 18 de septiembre de 2023, en el sentido de \nsuprimir los límites de detección propuestos.” (subrayado fuera de texto), esta Autoridad, \nrealmente hacía referencia al literal d) del artículo quinto de la Resolución 2358 de 11 de \noctubre de 2023, no del artículo tercero de la Resolución 2131 del 18 de septiembre de \n2023. \nQue se debe resaltar que, si bien esta Autoridad resolvió suprimir los límites de detección \npropuestos inicialmente en el literal d) del artículo quinto de la Resolución 2358 de 11 de \noctubre de 2023, en todo caso se pone a consideración de la Sociedad la selección de un \nlaboratorio que ofrezca los límites de detección con la sensibilidad indicada o en su defecto \ncon la mayor sensibilidad posible y que a su vez, cuente con una metodología de análisis \naprobada por estándares internacionales y /o avaladas dentro del sistema de calidad del \nlaboratorio contratado.\nOTRAS CONSIDERACIONES JURÍDICAS\nQue se estima oportuno acoger la recomendación del Concepto Técnico 9059 del 19 de \ndiciembre de 2023, en el sentido de aclarar el numeral 4 del artículo tercero de la Resolución \n2358 del 11 de octubre de 2023, aun cuando no fue recurrido por la Sociedad.\nQue el texto de la determinación en mención indica: “4. Garantizar que las técnicas \nanalíticas empleadas deben ser las mismas que se tienen acreditadas ante el IDEAM.”; no \nobstante, el análisis técnico permite afirmar que el método es el que debe garantizar que \nlos límites sean detectables, mas no la técnica. \nQue en armonía con las consideraciones precedentes, se debe resaltar que el Instituto de \nHidrología, Meteorología y Estudios Ambientales - IDEAM es la autoridad que valida el \nmétodo; de manera que el numeral 4 del artículo tercero de la Resolución 2358 del 11 de \noctubre de 2023 quedará así: “4. Garantizar que los métodos de ensayo empleados estén \nacreditados ante el IDEAM” y así estará dispuesto en la parte resolutiva del presente acto \nadministrativo.\nQue en aplicación de los principios que rigen las actuaciones administrativas, consagrados \nen el artículo 209 de la Constitución Política de 1991, así como en el artículo 3 de la Ley \n1437 de 2011, y demás normas concordantes, aunado al ejercicio permanente de \nobservancia de los principios que rigen la política ambiental en el territorio nacional \nprevistos en la Ley 99 de 1993 y en el Decreto 1076 de 2015, esta Entidad adoptará las \ndecisiones que corresponden en torno al presente recurso, habiendo además, respetado el \nderecho de defensa del administrado.\nQue el presente pronunciamiento se emite bajo el amparo de los principios de la función \nadministrativa, consagrados en el artículo 209 de la Constitución Política de Colombia, \ndesarrollados, entre otras, por la Ley 1437 de 2011, así como los principios de la política \nambiental previstos en la Ley 99 de 1993 y sus reglamentos, y en aplicación de la garantía \ndel derecho de defensa y contradicción que le asiste al administrado – en este caso a la \nsociedad MANSAROVAR ENERGY COLOMBIA LTD., conforme al artículo 29 de la Carta \n\nResolución No. 000926       Del 20 MAY. 2024          Hoja No. 61 de 74\n“Por la cual se resuelve un recurso de reposición interpuesto en contra de la \nResolución 2358 del 11 octubre de 2023” \nPágina 61 de 74\nPolítica Nacional; por lo tanto, contra la presente providencia no procede recurso de \nreposición, como se establecerá en la parte resolutiva del presente acto administrativo.\nQue en mérito de lo expuesto, \nRESUELVE\nARTÍCULO PRIMERO. No reponer y en consecuencia confirmar los subnumerales ii y iii \ndel literal a del numeral 3 del artículo segundo, literal d) del numeral 3 del artículo segundo; \nnumeral 7 del artículo segundo de la Resolución 2358 del 11 de octubre de 2023, de \nconformidad con las razones expuestas en la parte motiva del presente acto administrativo.\nARTÍCULO SEGUNDO. Reponer en el sentido de aclarar el artículo séptimo de la \nResolución 2358 del 11 de octubre de 2023, de conformidad con la parte motiva del \npresente acto administrativo, el cual quedará en los siguientes términos:\nARTÍCULO SÉPTIMO. Ajustar vía seguimiento la Ficha BSM-10 programa de \nseguimiento y monitoreo de las comunidades hidrobiológicas, en el sentido de \nmodificar la intensidad de muestreo de los puntos de caracterización de agua \nsuperficial. Así la cosas la obligación quedaría de la siguiente manera:\n“ARTÍCULO CUARTO. (...)\n5. (...)\nb. Se efectuarán veinte (20) muestras para la ciénaga y cuatro (4) para los bajos \naledaños.” \nARTÍCULO TERCERO. Reponer en el sentido de modificar lo dispuesto en literal d) del \nnumeral 2 del artículo segundo de la Resolución 2358 del 11 de octubre de 2023, de \nconformidad con la parte motiva del presente acto administrativo, el cual quedará en los \nsiguientes términos:\n“ARTÍCULO SEGUNDO. La sociedad MANSAROVAR ENERGY COLOMBIA LTD. \ndeberá realizar los siguientes ajustes a la ficha aprobada en el artículo primero de \nesta Resolución, y en el término de dos (2) meses contados a partir de la ejecutoria \nde este acto administrativo, presentar los ajustes de las actividades señalados a \ncontinuación:\n2. Ajustar la Actividad 1 en el sentido de incluir las siguientes actividades:\nd) Presentar Informes Trimestrales de avance en el diagnóstico y monitoreo de INR \ny posibles INR hasta que se declare el cierre y/o recuperación de los INR, en donde \nse incluirá como mínimo:\ni. Avances realizados en el diagnóstico y monitoreo en unidades de volumen y \nárea por cada INR y por la suma de todos los INR.\n\nResolución No. 000926       Del 20 MAY. 2024          Hoja No. 62 de 74\n“Por la cual se resuelve un recurso de reposición interpuesto en contra de la \nResolución 2358 del 11 octubre de 2023” \nPágina 62 de 74\nii. Informes, reportes y soportes de laboratorio, resoluciones de acreditación de \nlaboratorios. \niii. Mapas de contornos.\niv. Análisis gráfico y estadístico de los diferentes parámetros monitoreados por \ncada INR, haciéndolo de forma multitemporal para los análisis estadísticos. \nv. Explicación técnica de los criterios y la metodología usada para la delimitación \nvertical y lateral del monitoreo realizado con el fin de garantizar la \nrepresentatividad de la red de monitoreo en cada predio diagnosticado y como \nse define la densidad de puntos o apiques a realizar para el monitoreo.” \nARTÍCULO CUARTO. Reponer en el sentido de modificar lo dispuesto en el literal b) del \nnumeral 3 del artículo segundo de la Resolución 2358 del 11 de octubre de 2023, de \nconformidad con la parte motiva del presente acto administrativo, el cual quedará en los \nsiguientes términos:\n“ARTÍCULO SEGUNDO. La sociedad MANSAROVAR ENERGY COLOMBIA LTD \ndeberá realizar los siguientes ajustes a la ficha aprobada en el artículo primero de \nesta Resolución, y en el término de dos (2) meses contados a partir de la ejecutoria \nde este acto administrativo, presentar los ajustes de las actividades señalados a \ncontinuación:\n3. Ajustar la Actividad 2 denominada recuperación áreas afectadas en el sentido de \nincluir las siguientes actividades:\nb) Presentar informes trimestrales de los avances realizados para la remediación \nen unidades de volumen y área por cada INR y por la suma de todos los INR, los \ncuales deben incluir:\ni. La caracterización química y física de las sustancias usadas para bio-\nremediación, Fitoremediación y/o cualquier otra técnica usada.\nii. El análisis gráfico y estadístico de los diferentes parámetros monitoreados \npor cada INR de forma multitemporal.\niii. Los cambios y aumentos de capacidad operativa (volumen y metros por \nmes) en el proceso de remediación que se hayan presentado para el \nproyecto señalando el cambio en el número de áreas operativas para \nremediación, el tamaño de dichas áreas y el inventario de maquinaria de \nexcavación con las que se cuenta entre otras variables.\niv. Un inventario actualizado de zonas, áreas y predios que incluya para cada \nuno de ellos los siguientes estados por año según sea el caso:\n1.\nPosible INR sin diagnóstico.\n2.\nPosible INR en diagnóstico de identificación.\n3.\nINR en diagnóstico de delimitación.\n4.\nSin remediación.\n5.\nEn proceso de remediación.\n6.\nRemediación finalizada.\n7.\nEn diagnostico post-remediación.\n8.\nPredio remediado con nuevos hallazgos.\n9.\nEn proceso de reconformación.\n10. Reconformación finalizada.\n\nResolución No. 000926       Del 20 MAY. 2024          Hoja No. 63 de 74\n“Por la cual se resuelve un recurso de reposición interpuesto en contra de la \nResolución 2358 del 11 octubre de 2023” \nPágina 63 de 74\n11. Área estimada de remediación para los casos en que aplique como se \nmuestra a continuación”.\nARTÍCULO QUINTO. Reponer en el sentido de modificar el artículo tercero de la Resolución \n2358 del 11 de octubre de 2023, de conformidad con la parte motiva del presente acto \nadministrativo, el cual quedará en los siguientes términos:\n“ARTÍCULO TERCERO. Ajustar vía seguimiento la Ficha BSM-10 programa de \nseguimiento y monitoreo de las comunidades hidrobiológicas, establecida en el \nartículo vigésimo primero de la Resolución 408 del 12 de abril de 2017, en el sentido \nde incluir las siguientes medidas, de conformidad con las consideraciones expuesta \nen la parte considerativa del presente acto administrativo: \n(1. Observar la periodicidad de los monitoreos: tendrá una intensidad trimestral \ncompartida entre las Sociedades ECOPETROL S.A. y MANSAROVAR ENERGY \nCOLOMBIA LTD; en donde MANSAROVAR ENERGY COLOMBIA LTD realizará el \nmonitoreo semestral en los meses de junio y diciembre.)\n2. Reemplazar los puntos de muestreo para el Plan de Monitoreo de Aguas \nSuperficiales y Sedimentos de la Ciénaga de Palagua, el cual garantice que las \nmuestras tomadas sean representativas para el área de la Ciénaga de Palagua, esto \nde acuerdo con la distribución relacionada en la siguiente tabla adoptando (en los \npuntos que apliquen) los códigos asignados en la columna “Código ID ANLA.\nPuntos de muestreo para el Plan de Monitoreo de Aguas Superficiales y \nSedimentos de la Ciénaga de Palagua\nCoordenadas Magna Origen \nÚnico Nacional\nCoordenadas Geográficas\nNOMBRE\nCódigo ID ANLA\nESTE\nNORTE\nLATITUD\nLONGITUD\nLENT_1\nMSP-LAM0332-\n0001 \n4834465,65\n2228221,55\n6,06339\n-74,49636\nLENT_2\nMSP-LAM0332-\n0002\n4834309,73\n2228494,49\n6,065855\n-74,497776\nLENT_3\nMSP-LAM0332-\n0003\n4833755,23\n2228344,06\n6,064481\n-74,502783\nLENT_4\nMSP-LAM0332-\n0004\n4833344,63\n2228299,23\n6,064065\n-74,506493\nLENT_5\nMSP-LAM0332-\n0005\n4832472,21\n2228572,87\n6,066518\n-74,514384\n\nResolución No. 000926       Del 20 MAY. 2024          Hoja No. 64 de 74\n“Por la cual se resuelve un recurso de reposición interpuesto en contra de la \nResolución 2358 del 11 octubre de 2023” \nPágina 64 de 74\nCoordenadas Magna Origen \nÚnico Nacional\nCoordenadas Geográficas\nNOMBRE\nCódigo ID ANLA\nESTE\nNORTE\nLATITUD\nLONGITUD\nLENT 6\nMSP-LAM0332-\n0006\n4831981,11\n2228461,69\n6,0655\n-74,51882\nLENT 7\nMSP-LAM0332-\n0007\n4832023,8\n2228101,11\n6,062239\n-74,518425\nLENT_8\nMSP-LAM0332-\n0008\n4831975,26\n2227766,95\n6,059215\n-74,518855\nLENT 9\nMSP-LAM0332-\n0009\n4832661,66\n2227865,52\n6,060124\n-74,512654\nLENT_10\nMSP-LAM0332-\n0010\n4832685,46\n2228285,07\n6,06392\n-74,51245\nLENT_11\nMSP-LAM0332-\n0011\n4833181,18\n2227738,62\n6,058989\n-74,507956\nLENT_12\nMSP-LAM0332-\n0012\n4833037,34\n2228114,91\n6,062389\n-74,509266\nLENT 13\nMSP-LAM0332-\n0013\n4833589,23\n2227763,07\n6,05922\n-74,504269\nLENT 14\nMSP-LAM0332-\n0014\n4833879,21\n2227555,59\n6,057351\n-74,501643\nLENT_15\nMSP-LAM0332-\n0015\n4833625,8\n2228009,97\n6,061455\n-74,503945\nLENT 16\nMSP-LAM0332-\n0016\n4833968,37\n2227467,36\n6,056555\n-74,500835\nLENT_17\nMSP-LAM0332-\n0017\n4833952,24\n2227696,54\n6,058627\n-74,500987\nLENT_18\nMSP-LAM0332-\n0018\n4834089,08\n2227956\n6,060978\n-74,499757\nCAÑO \nAGUALINDA\nMSP-LAM0332-\n0019\n4834694\n2228123,84\n6,062512\n-74,494294\nCAÑO \nPALAGUA\nMSP-LAM0332-\n0020\n4831454,3\n2227636,35\n6,05802\n-74,52356\n3. Reemplazar como mínimo los siguientes parámetros fisicoquímicos e \nhidrobiológicos, los cuales serán los únicos por muestrear en el Plan de \nSeguimiento y Monitoreo:\n(negrita y subrayado fuera de texto)\nParámetros fisicoquímicos y microbiológicos\nNo.\nParámetro para \nmonitorear\nNo.\nParámetro para \nmonitorear\nNo.\nParámetro para \nmonitorear\n1\nConductividad eléctrica\n22\nColor verdadero\n43\nNitrógeno Total\n2\nOxígeno disuelto\n23\nCobre Total\n44\nPlata Total\n3\npH in situ \n24\nCromo total\n45\nPlomo total\n4\nTemperatura ambiente\n25\nDBO5\n46\nSAAM\n5\nTemperatura insitu\n26\nDQO\n47\nSelenio total\n6\nAceites y Grasas\n27\nDureza total\n48\nSolidos sedimentables\n\nResolución No. 000926       Del 20 MAY. 2024          Hoja No. 65 de 74\n“Por la cual se resuelve un recurso de reposición interpuesto en contra de la \nResolución 2358 del 11 octubre de 2023” \nPágina 65 de 74\nNo.\nParámetro para \nmonitorear\nNo.\nParámetro para \nmonitorear\nNo.\nParámetro para \nmonitorear\n7\nAcidez total\n28\nCompuestos fenólicos\n49\nSólidos totales \n8\nAlcalinidad total\n29\nFosfatos\n50\nSolidos totales disueltos\n9\nAluminio Total\n30\nFósforo Inorgánico\n51\nSolidos totales en \nsuspensión\n10\nArsénico total\n31\nFosforo orgánico\n52\nSulfatos\n11\nBario total\n32\nFósforo total\n53\nSulfuros\n12\nBicarbonatos\n33\nHidrocarburos Totales\n54\nSuma HAPs\n13\nCadmio total\n34\nHierro total\n55\nTurbidez\n14\nCalcio total\n35\nLitio Total\n56\nVanadio Total\n15\nCarbono orgánico total\n36\nMagnesio total\n57\nHidrocarburos Alifáticos\n16\nCloruros\n37\nMercurio total\n58\nCompuestos Orgánicos no \nHalogenados \n17\nCobalto total\n38\nMolibdeno total\n18\nBTEX\n39\nNitratos\n59\nCompuestos Orgánicos \nHalogenados absorbibles \n(AOX)\n19\nColiformes fecales por \nNMP\n40\nNitritos\n20\nColiformes Totales por \nNMP\n41\nNíquel Total\n21\nCianuro Total\n42\nNitrógeno amoniacal \nParámetros hidrobiológicos para monitorear\nNo\nParámetro hidrobiológico para monitorear\n1\nFitoplancton\n2\nZooplancton\n3\nMacroinvertebrados bentónicos\n4\nMacroinvertebrados asociados a macrófitas\n5\nPerifiton\n6\nIctiofauna\n7\nMacrófitas acuáticas\n8\nMetales pesados e hidrocarburos en tejidos de peces y de macrófitas\n5. Garantizar que la sensibilidad del método de ensayo, el cual se ve reflejado en los \nlímites de detección y el límite de cuantificación sean inferiores al límite normativo \nestablecido para la matriz evaluada. \n6. Incluir indicadores relacionados con los parámetros específicos asociados a \nla industria de producción de hidrocarburos, que en algún momento puedan \nafectar la calidad del recurso en la Ciénaga. (negrita y subrayado fuera de texto)\n7. Analizar dentro de la definición de parámetros a monitorear en la matriz de \nsedimentos, como mínimo los siguientes parámetros, los cuales serán los únicos por \nmuestrear en el Plan de Seguimiento y Monitoreo:\nParámetros mínimos para monitorear en matriz de Sedimentos en Ciénaga de \nPalagua\n\nResolución No. 000926       Del 20 MAY. 2024          Hoja No. 66 de 74\n“Por la cual se resuelve un recurso de reposición interpuesto en contra de la \nResolución 2358 del 11 octubre de 2023” \nPágina 66 de 74\nNo\n.\nParámetros mínimos para monitorear en \nmatriz \nde Sedimentos en Ciénaga de Palagua\n1\nPlata total\n2\nBario total\n3\nCadmio total\n4\nPlomo total\n5\nMercurio total\n6\nSelenio total\n7\nCromo total\n8\nHidrocarburos totales\n9\nHAPs\n10\nConductividad eléctrica\n11\nHidrocarburos alifáticos\n12\nHierro Total\n13\nHumedad\n14\nPh\n15\nArsénico\n16\nMolibdeno\n17\nVanadio\n18\nCobalto\n19\nManganeso\nARTÍCULO SEXTO. Reponer en el sentido de modificar el artículo quinto de la Resolución \n2358 del 11 de octubre de 2023, de conformidad con la parte motiva del presente acto \nadministrativo, por lo que el artículo en mención quedará en los siguientes términos:\n“ARTÍCULO QUINTO. Ajustar vía seguimiento la medida de seguimiento y monitoreo \nde bioacumulación en peces y macrófitas establecida en las FICHAS BSM-10 \nPROGRAMA DE SEGUIMIENTO Y MONITOREO DE LAS COMUNIDADES \nHIDROBIOLÓGICAS y MB-21 REMOCIÓN DE TARULLA, establecidas en el artículo \nvigésimo primero de la Resolución 408 del 12 de abril de 2017, de conformidad con \nlo expuesto en la parte considerativa del presente acto administrativo, que contenga \nlas siguientes actividades: \nEn relación con las Macrófitas. \na) Reemplazar los puntos de monitoreo de bioacumulación en macrófitas en la \nCiénaga de Palagua mostrados a continuación. Estas coordenadas son el centroide \nde un radio de acción de hasta 50 metros (100 metros de diámetro), dependiendo de \nla presencia de organismos al momento del muestreo. Aplica solamente para los que \nse encuentran en la Ciénaga de Palagua, los demás puntos de monitoreo mantienen \nsu localización, adoptando (en los puntos que apliquen) los códigos asignados en la \ncolumna “Código ID ANLA:\nUbicación espacial de los puntos de monitoreo de bioacumulación en \nmacrófitas en la Ciénaga de Palagua\n\nResolución No. 000926       Del 20 MAY. 2024          Hoja No. 67 de 74\n“Por la cual se resuelve un recurso de reposición interpuesto en contra de la \nResolución 2358 del 11 octubre de 2023” \nPágina 67 de 74\nb) Detallar y estandarizar la metodología (como mínimo especie, tipo de órgano y \ncantidad de individuos) para determinar la presencia de metales pesados e \nhidrocarburos en macrófitas de manera que se garantice que la muestra sea \nrepresentativa para la detección de estos parámetros por bioacumulación.\nc) Tomar muestras de macrófitas de habito enraizado y hábito flotante; en caso de \nque las macrófitas enrizadas se encuentren más cercanas a la orilla, se desplazará el \npunto de monitoreo de manera perpendicular a la orilla, con el objetivo que se logre \nque incluir este hábito en la muestra, de acuerdo con los puntos planteados en la ficha \nASM-1. Aguas Residuales y Corrientes Receptoras (LENT6, LENT5, LENT4, LENT3, \nLENT2, LEMT18, LENT17, LEN13, LENT11, LENT9 y LENT 8).\nd) Incluir como mínimo los siguientes parámetros de detección. Se sugiere que los \nlímites de detección y de cuantificación sean los más bajos posibles con el propósito \nde detectar presencia o ausencia de estos compuestos en tejidos animales y que a \n\nResolución No. 000926       Del 20 MAY. 2024          Hoja No. 68 de 74\n“Por la cual se resuelve un recurso de reposición interpuesto en contra de la \nResolución 2358 del 11 octubre de 2023” \nPágina 68 de 74\nsu vez cuenten con una metodología de análisis aprobada por estándares \ninternacionales y validada por el laboratorio:\nEn relación con los Peces\na) Reemplazar los puntos de monitoreo de bioacumulación en peces en la Ciénaga \nde Palagua. Estas coordenadas son el centroide de un radio de acción de hasta 50 \nmetros (100 metros de diámetro), dependiendo de la presencia de organismos al \nmomento del muestreo. Es importante indicar que aplica solamente para los que se \nencuentran en la Ciénaga de Palagua, lo demás puntos de monitoreo mantienen su \nlocalización.\nUbicación espacial de los puntos de monitoreo de bioacumulación en peces en la \nCiénaga de Palagua\n\nResolución No. 000926       Del 20 MAY. 2024          Hoja No. 69 de 74\n“Por la cual se resuelve un recurso de reposición interpuesto en contra de la \nResolución 2358 del 11 octubre de 2023” \nPágina 69 de 74\nb) Detallar y estandarizar la metodología (como mínimo especie, tipo de tejido, \ncantidad de organismos) para determinar la presencia de metales pesados e \nhidrocarburos en peces de manera que se garantice que la muestra sea \nrepresentativa para la detección de estos parámetros por bioacumulación.\n\nResolución No. 000926       Del 20 MAY. 2024          Hoja No. 70 de 74\n“Por la cual se resuelve un recurso de reposición interpuesto en contra de la \nResolución 2358 del 11 octubre de 2023” \nPágina 70 de 74\nc) Garantizar que la muestra provenga de tejido muscular. Se deben tomar muestras \nde peces de diferentes hábitos tróficos detritívoros, omnívoros e insectívoros \nrepresentados en los órdenes Siluriformes, Characiformes y Cichliformes. \nd) Incluir como mínimo los siguientes parámetros de detección. Los límites de \ndetección y de cuantificación deben ser los más bajos posibles de acuerdo con la \ntécnica acreditada con el propósito de detectar presencia o ausencia de estos \ncompuestos en tejidos animales y que a su vez cuenten con una metodología de \nanálisis aprobada por estándares internacionales y validada por el laboratorio:\nParágrafo. Las técnicas para el monitoreo de parámetros en tejidos, tanto de peces \ncomo de macrófitas, deberán ser validadas por los laboratorios que las realicen. \nARTÍCULO SÉPTIMO. Reponer en el sentido de aclarar el artículo sexto de la Resolución \n2358 del 11 de octubre de 2023, de conformidad con la parte motiva del presente acto \nadministrativo, el cual quedará en los siguientes términos:\n“ARTÍCULO SEXTO. Para la presentación de los monitoreos hidrobiológicos y \nfisicoquímicos a realizarse en la ciénaga de Palagua, así como para las muestras de \nsedimentos, la Sociedad MANSAROVAR ENERGY COLOMBIA LTD., deberá cumplir \ncon las siguientes condiciones:\n1.\nEn los Informes de Cumplimiento Ambiental- ICA se deberá anexar la información de \nsoporte de los monitoreos como registro fotográfico, formatos de campo durante la \ntoma de muestras, cadenas de custodia y reportes de laboratorio. Adicionalmente, se \ndeberá reportar la información del resultado de los monitoreos del uso y \naprovechamiento de los recursos naturales a través del instrumento de informe de \ncumplimiento ambiental acogiendo el código ID ANLA asignado, es decir, que dentro \ndel modelo de datos geográfico en el campo de “OBSERV” según corresponda el \ncomponente, el usuario debe remplazar y adoptar esta codificación, garantizando que \nsea el mismo en todas las entregas que realice a esta Autoridad.\n2.\nLos resultados de los monitoreos en cuerpos hídricos superficiales deberán ser \npresentados en el Modelo de Almacenamiento Geográficos – MAG de conformidad \ncon las disposiciones de la Resolución 2182 del 23 de diciembre de 2016 o aquella \nque la modifique o sustituya, diligenciando de manera completa todos los campos \nsolicitados y reportando los códigos designados por ANLA (asociando el código único \n\nResolución No. 000926       Del 20 MAY. 2024          Hoja No. 71 de 74\n“Por la cual se resuelve un recurso de reposición interpuesto en contra de la \nResolución 2358 del 11 octubre de 2023” \nPágina 71 de 74\nID_ANLA asignado) para los puntos de monitoreo. El usuario debe adoptar esta \ncodificación y no podrá ser modificada parcial o totalmente, garantizando que sea el \nmismo código en todas las entregas que realice a esta Autoridad.\n3.\nRemitir los resultados de los monitoreos fisicoquímicos y microbiológicos en un plazo \nno mayor a tres meses después de realizar el monitoreo de cada campaña. La \ninformación deberá ser remitida a esta autoridad a través del portal de recepción de \ninformación de ÁGIL disponible en la página web de la Entidad, para el cual la \nSociedad deberá solicitar usuario y contraseña de acceso en el correo \nlicencias@anla.gov.co con copia al correo centromonitoreo@anla.gov.co. Se aclara \nque el usuario es único y debe solicitarse a través del representante legal de la \nempresa a cargo del instrumento de manejo y control.\n4.\nLos resultados de monitoreo hidrobiológicos y de matiz de sedimentos deberán seguir \nsiendo remitidos vía ICA.\n5.\nAdicionalmente, todos los resultados de los monitoreos fisicoquímicos e \nhidrobiológicos deberán presentarse de forma acumulada en los Informes de \nCumplimiento Ambiental – ICA, presentando la información consolidada y tabulada, \ncon su respectivo análisis de tendencia, comparando los resultados del periodo \nreportado con los obtenidos en periodos anteriores.\nARTÍCULO OCTAVO. Reponer en el sentido de revocar el numeral 9 del artículo segundo \ny el artículo cuarto de la Resolución 2358 del 11 de octubre de 2023, de conformidad con \nla parte motiva del presente acto administrativo.\nARTÍCULO NOVENO: Aclarar el numeral 4 del artículo tercero de la Resolución 2358 del \n11 de octubre de 2023, quedando bajo el siguiente tenor:\n“ARTÍCULO TERCERO. Ajustar vía seguimiento la Ficha BSM-10 programa de \nseguimiento y monitoreo de las comunidades hidrobiológicas, establecida en el \nartículo vigésimo primero de la Resolución 408 del 12 de abril de 2017, en el sentido \nde incluir las siguientes medidas, de conformidad con las consideraciones expuesta \nen la parte considerativa del presente acto administrativo: \n(…)\n4. Garantizar que los métodos de ensayo empleados estén acreditados ante el \nIDEAM.” \nARTÍCULO DÉCIMO. Los demás términos, condiciones y obligaciones establecidos en la \nResolución 2358 del 11 de octubre de 2023, expedida por esta Autoridad Nacional, no \nmodificadas en el presente acto administrativo, continúan vigentes, exigibles y rigen en los \ntérminos y condiciones del acto administrativo recurrido.\nARTÍCULO DÉCIMO PRIMERO. Notificar el contenido del presente acto administrativo al \nrepresentante legal, o al apoderado debidamente constituido o a la persona debidamente \n\nResolución No. 000926       Del 20 MAY. 2024          Hoja No. 72 de 74\n“Por la cual se resuelve un recurso de reposición interpuesto en contra de la \nResolución 2358 del 11 octubre de 2023” \nPágina 72 de 74\nautorizada por de la sociedad MANSAROVAR ENERGY COLOMBIA LTD., por medios \nelectrónicos.\nPARÁGRAFO. Para la notificación electrónica se tendrá en cuenta lo previsto en el artículo \n10 de la ley 2080 de 2021 por medio del cual se modifica el artículo 56 de la Ley 1437 de \n2011. En el evento en que la notificación no pueda surtirse de manera electrónica, se \nseguirá el procedimiento en los términos del artículo 67 y siguientes de la Ley 1437 de 2011.\nARTÍCULO DÉCIMO SEGUNDO. En el evento en que el titular de la licencia sea una \nsociedad comercial o de una sucursal de sociedad extranjera que entre en proceso de \ndisolución o régimen de insolvencia empresarial o liquidación regulados por las normas \nvigentes, informará inmediatamente de esta situación a esta Autoridad, con fundamento, \nentre otros, en los artículos 8, 58, 79, 80, 81, 95 numeral 8 de la Constitución Política de \n1991, en la Ley 43 de 1990, en la Ley 222 de 1995, en la Ley 1333 de 2009 y demás normas \nvigentes y jurisprudencia aplicable. Adicional a la obligación de informar a esta Autoridad \nde tal situación, el titular de la licencia o permiso aprovisionará contablemente las \nobligaciones contingentes que se deriven de la existencia de un procedimiento ambiental \nsancionatorio conforme con el artículo 40 de la Ley 1333 de 2009 o la norma que la adicione, \nmodifique o derogue.\nARTÍCULO DÉCIMO TERCERO. Comunicar el presente acto administrativo al municipio \nde Puerto Boyacá, en el departamento de Boyacá, a la Corporación Autónoma Regional de \nBoyacá – CORPOBOYACÁ, a la procuraduría Delegada para Asuntos Ambientales, Minero \nEnergéticos y Agrarios y a la Contraloría General de la República.\nARTÍCULO DÉCIMO CUARTO. Por la Autoridad Nacional de Licencias Ambientales – \nANLA, publicar el presente acto administrativo en la Gaceta Ambiental de la Entidad.\nARTÍCULO DÉCIMO QUINTO. Contra el presente acto administrativo no procede recurso \nalguno, de conformidad con lo establecido en el artículo 75 del Código de Procedimiento \nAdministrativo y de lo Contencioso Administrativo.\nNOTIFIQUESE, COMUNÍQUESE, PUBLIQUESE Y CÚMPLASE\nDado en Bogotá D.C., a los 20 MAY. 2024\nRODRIGO ELIAS NEGRETE MONTES\nDIRECTOR GENERAL\n\nResolución No. 000926       Del 20 MAY. 2024          Hoja No. 73 de 74\n“Por la cual se resuelve un recurso de reposición interpuesto en contra de la \nResolución 2358 del 11 octubre de 2023” \nPágina 73 de 74\nMARIANA DEL PILAR RODRIGUEZ PATARROYO\nCONTRATISTA\nGLADYS CATALINA PELAEZ MENDIETA\nCONTRATISTA\nSANDRA PATRICIA BEJARANO RINCON\nCONTRATISTA\nNATALIA ANDREA BARAJAS MUNOZ\nCONTRATISTA\nGERMAN BARRETO ARCINIEGAS\nSUBDIRECTOR DE SEGUIMIENTO DE LICENCIAS AMBIENTALES\nMANUEL SANTIAGO BURGOS NAVARRO\nCONTRATISTA\nExpediente No. LAM0332\nConcepto Técnico N° \n9059 del 19 de diciembre de 2023.\nFecha: mayo de 2024\nProceso No.: 20241000009264\nNota: Este es un documento electrónico generado desde los Sistemas de Información de la ANLA. El original reposa en los \narchivos digitales de la Entidad\n\nResolución No. 000926       Del 20 MAY. 2024          Hoja No. 74 de 74\n“Por la cual se resuelve un recurso de reposición interpuesto en contra de la \nResolución 2358 del 11 octubre de 2023” \nPágina 74 de 74\n"
}