{
  "fuente": "ANLA_GACETA",
  "numero_resolución": "RESOLUCIÓN N° 003142",
  "fecha_resolución": "2023-09-18",
  "anio_resolucion": "2023",
  "nombre_proyecto": "Bloque Casanare A1a, localizado en jurisdicción de los municipios de Yopal, Maní",
  "nombre_proyecto_normalizado": "BLOQUE CASANARE A1A LOCALIZADO EN JURISDICCION DE LOS MUNICIPIOS DE YOPAL MANI",
  "ubicación": "departamento de Casanare",
  "empresa": "PERENCO COLOMBIA LIMITED",
  "empresa_normalizada": "PERENCO COLOMBIA LIMITED",
  "numero_expediente": "LAM0715",
  "radicados": [
    "20236200692062",
    "2019184507",
    "2020004616",
    "2020026415",
    "2020094717",
    "2020175753",
    "2021058780",
    "2021094482",
    "2021196217",
    "2022061280",
    "2022108535",
    "2016000865",
    "2017066632",
    "2017122802",
    "2018170884",
    "2019166291",
    "2021115744"
  ],
  "descripcion": "Por la cual se resuelve recurso de reposición interpuesto en contra de la Resolución 2136 del 18 de septiembre de 2023",
  "tipos_infraccion": [
    "Incumplimiento del PMA"
  ],
  "tipos_infraccion_normalizados": [
    "INCUMPLIMIENTO DEL PMA"
  ],
  "pdf_id": "45113",
  "file_name": "ANLA_45113.pdf",
  "texto_completo": "República de Colombia\nMinisterio de Ambiente y Desarrollo Sostenible\nAUTORIDAD NACIONAL DE LICENCIAS \nAMBIENTALES\n- ANLA –\nRESOLUCIÓN N° 003142\n(29 DIC. 2023)\nPágina 1 de 35\n“Por la cual se resuelve recurso de reposición interpuesto en contra de la \nResolución 2136 del 18 de septiembre de 2023”\nEL ASESOR DEL DESPACHO DEL DIRECTOR DE LA AUTORIDAD \nNACIONAL DE LICENCIAS AMBIENTALES – ANLA\nEn uso de las facultades legales establecidas mediante la Ley 99 del 22 de \ndiciembre de 1993, el Decreto Ley 3573 del 27 de septiembre de 2011, modificado \npor el Decreto 376 del 11 de marzo de 2020, el Decreto 1076 del 26 de mayo de \n2015, Resolución 669 del 14 de abril de 2020, Resolución 1957 de 5 de noviembre \nde 2021 y Resolución 02795 del 25 de noviembre de 2022  \nCONSIDERANDO:\n1. Antecedentes \nQue mediante la Resolución 121 del 7 de febrero de 1996, el entonces Ministerio \nde Medio Ambiente hoy Ministerio de Medio Ambiente y Desarrollo Sostenible, en \nadelante el Ministerio, otorgó Licencia Ambiental Ordinaria a la sociedad \nPERENCO COLOMBIA LIMITED, para el proyecto, Pozos de Desarrollo La Gloria \nNorte-5, La Gloria Norte-6, La Gloria-7 y La Gloria-8 de la Asociación Casanare, \nubicados en jurisdicción de los municipios de Yopal, Aguazul y Maní en el \ndepartamento del Casanare. \nQue por medio de la Resolución 891 del 8 de octubre de 1997, el Ministerio otorgó \nLicencia Ambiental a la sociedad PERENCO COLOMBIA LIMITED, para la \nperforación de los Pozos de Desarrollo La Gloria 9, 10, 11, 12 y 13, del Contrato \nde Asociación Casanare, en jurisdicción de los municipios de Aguazul y Maní en el \ndepartamento del Casanare. \nQue con Resolución 1301 del 21 de julio de 2008, el Ministerio otorgó Licencia \nAmbiental Global a la sociedad PERENCO COLOMBIA LIMITED, para el proyecto \nBloque Casanare A1a, localizado en jurisdicción de los municipios de Yopal, Maní \ny Aguazul, en el departamento de Casanare. \n\nResolución No. 003142       Del 29 DIC. 2023          Hoja No. 2 de 35\n“Por la cual se resuelve recurso de reposición interpuesto en contra de la \nResolución 2136 del 18 de septiembre de 2023”\nPágina 2 de 35\nQue mediante Resolución 345 del 22 de mayo de 2012, la Autoridad Nacional de \nLicencias Ambientales ANLA, en adelante Autoridad Nacional, modificó la \nResolución 1301 del 21 de julio de 2008, por la cual se otorgó Licencia Ambiental \nGlobal para el Bloque Casanare A1a, en el sentido de incluir la actividad de \nreinyección del agua residual industrial, entre otros aspectos. \nQue por medio de la Resolución 1219 del 18 de octubre de 2016, la Autoridad \nNacional, impuso medidas adicionales en desarrollo de un control y seguimiento \nambiental, relacionada con realizar monitoreos en el parea del pozo LGL 18.\nQue a través de la Resolución 114 del 24 de junio de 2020, se realiza un ajuste vía \nseguimiento em donde se actualizan las fichas del Plan de Manejo Ambiental y el \nPlan de Seguimiento y Monitoreo presentada por la sociedad PERENCO \nCOLOMBIA LIMITED por medio del radicado No. 2017025669- 1-000 del 7 de abril \nde 2017. \nQue esta Autoridad Nacional, efectuó seguimiento y control ambiental integral con \nvisita presencial del 6 al 9 de julio de 2022, al proyecto “Bloque Casanare A1a”, \nlocalizado en jurisdicción de los municipios de Yopal, Aguazul y Maní \ndepartamento del Casanare y como resultado se expidió el Concepto Técnico \n5783 del 23 de septiembre de 2022, el cual, entre otros aspectos técnicos, evaluó \nlo referente al Plan de Inversión Forzosa de no menos del 1%.\nQue producto del análisis técnico, efectuado por esta Autoridad Nacional a través \ndel Concepto Técnico 5783 del 23 de septiembre de 2022, la ANLA expidió la \nResolución 2136 del 18 de septiembre de 2023, en cuya parte resolutiva entre \notros aspectos jurídicos, declaró el desistimiento tácito de la propuesta \n2019184507-1-000 del 25 de noviembre de 2019, relacionada con la “Solicitud de \nacogimiento al porcentaje incremental contenido en el Artículo 321 de la Ley 1955 \ndel 25 de mayo de 2019, para el proyecto “Bloque Casanare A1a” (Campo La \nGloria)”. \nQue la sociedad PERENCO COLOMBIA LIMITED, a través de la comunicación \ncon radicado ANLA 20236200692062 de fecha (3)  tres de octubre de 2023, \npresentó recurso de reposición en contra de la Resolución 2136 del 18 de \nseptiembre de 2023.      \n2. FUNDAMENTOS CONSTITUCIONALES Y LEGALES\na. De la protección del derecho al medio ambiente como deber social del \nestado.\nQue el artículo 8 de la Constitución Política, consagra como obligación del Estado \ny de las personas proteger las riquezas culturales y naturales de la Nación.\n\nResolución No. 003142       Del 29 DIC. 2023          Hoja No. 3 de 35\n“Por la cual se resuelve recurso de reposición interpuesto en contra de la \nResolución 2136 del 18 de septiembre de 2023”\nPágina 3 de 35\nQue el artículo 58 de la Constitución Política de Colombia, establece en su inciso \nsegundo que la propiedad lleva inmersa una función social que implica \nobligaciones. Como tal, le es inherente una función ecológica que implica el \nrespeto por el derecho a un medio ambiente sano y la protección a los recursos \nnaturales.   \nQue el artículo 79 de la Constitución Política, establece la obligación que tiene el \nEstado de proteger el medio ambiente y el derecho que tienen todos los \nciudadanos a gozar de un ambiente sano. Así mismo le impuso al Estado el deber \nde proteger la diversidad e integridad del ambiente, conservar las áreas de \nespecial importancia ecológica y fomentar la educación para el logro de estos \nfines.\nQue el artículo 80 de la Constitución Política de Colombia establece: “El Estado \nplanificará el manejo y aprovechamiento de los recursos naturales, para garantizar \nsu desarrollo sostenible, su conservación, restauración o sustitución; además, \ndeberá prevenir y controlar los factores de deterioro ambiental, imponer las \nsanciones legales y exigir la reparación de los daños causados”.\nQue el artículo 95 constitucional señala que es deber de la persona y del \nciudadano proteger los recursos culturales y naturales del país y velar por la \nconservación de un ambiente sano. \nQue en relación con la responsabilidad en la conservación y defensa del ambiente, \nes del caso tener en cuenta lo establecido en el artículo 333 de la Constitución \nPolítica, según el cual, la actividad económica y la iniciativa privada son libres, \npero “dentro de los límites del bien común”, al respecto la Corte Constitucional en \nla sentencia T-325 - 17 del quince (15) de mayo de dos mil diecisiete (2017), ha \nconceptuado con relación a la defensa del derecho al Medio Ambiente Sano:\n“(…) La Corte ha atendido a la necesidad que propugna por la defensa del \nambiente y de los ecosistemas, por lo que ha calificado al ambiente como un bien \njurídico constitucionalmente protegido, en el que concurren las siguientes \ndimensiones: “(i) es un principio que irradia todo el orden jurídico en cuanto se le \natribuye al Estado la obligación de conservarlo y protegerlo, procurando que el \ndesarrollo económico y social sea compatible con las políticas que buscan \nsalvaguardar las riquezas naturales de la Nación; (ii) aparece como un derecho \nconstitucional de todos los individuos que es exigible por distintas vías judiciales; \n(iii) tiene el carácter de servicio público, erigiéndose junto con la salud, la \neducación y el agua potable, en un objetivo social cuya realización material \nencuentra pleno fundamento en el fin esencial de propender por el mejoramiento \nde la calidad de vida de la población del país; y (iv) aparece como una prioridad \ndentro de los fines del Estado, comprometiendo la responsabilidad directa del \nEstado al atribuirle los deberes de prevención y control de los factores de deterioro \nambiental y la adopción de las medidas de protección…” (…).\n\nResolución No. 003142       Del 29 DIC. 2023          Hoja No. 4 de 35\n“Por la cual se resuelve recurso de reposición interpuesto en contra de la \nResolución 2136 del 18 de septiembre de 2023”\nPágina 4 de 35\nDe conformidad con lo anterior, la protección al medio ambiente corresponde a \nuno de los más importantes cometidos estatales, es deber del Estado garantizar a \nlas generaciones futuras la conservación del ambiente y la preservación de los \nrecursos naturales. De ahí la necesidad de contar con entidades como el \nMinisterio de Ambiente y Desarrollo Sostenible, como organismo rector de la \ngestión ambiental y de los recursos naturales, al que corresponde impulsar una \nrelación de respeto entre el hombre y la naturaleza y definir la política ambiental \nde protección, conservación y preservación, y la Autoridad Nacional de Licencias \nAmbientales –ANLA en su calidad de entidad encargada de que los proyectos \nsujetos a licenciamiento, permiso o trámite ambiental cumplan con la normativa \nambiental, de tal manera que contribuyan al desarrollo sostenible ambiental del \npaís.\nAsí las cosas, toda actividad, obra o proyecto que se enmarque dentro de las \ncontempladas en el artículo 2.2.2.3.2.2. del Decreto 1076 de 2015, requiere de \nLicencia Ambiental, es decir requiere de un instrumento de control ambiental \naprobado por Autoridad competente, que garantice que el desarrollo del proyecto \na ejecutar mitiga, maneja y compensa los impactos ambientales que genera su \nejecución y finalización del mismo, al respecto la Corte Constitucional en \nSentencia C-746 de 2012, señaló;\n(…)\n“…Con fundamento en la jurisprudencia constitucional, se concluye que la licencia \nambiental: (i) es una autorización que otorga el Estado para la ejecución de obras o la \nrealización de proyectos o actividades que puedan ocasionar un deterioro grave al \nambiente o a los recursos naturales o introducir una alteración significativa al paisaje \n(Ley 99/93 art. 49); (ii) tiene como propósitos prevenir, mitigar, manejar, corregir y \ncompensar los efectos ambientales que produzcan tales actividades; (iii) es de \ncarácter obligatoria y previa, por lo que debe ser obtenida antes de la ejecución o \nrealización de dichas obras, actividades o proyectos; (iv) opera como instrumento \ncoordinador, planificador, preventivo, cautelar y de gestión, mediante el cual el Estado \ncumple diversos mandatos constitucionales, entre ellos proteger los recursos naturales \ny el medio ambiente, conservar áreas de especial importancia ecológica, prevenir y \ncontrolar el deterioro ambiental y realizar la función ecológica de la propiedad; (v) es el \nresultado de un proceso administrativo reglado y complejo que permite la participación \nciudadana, la cual puede cualificarse con la aplicación del derecho a la consulta previa \nsi en la zona de influencia de la obra, actividad o proyecto existen asentamientos \nindígenas o afrocolombianos; (vi) tiene simultáneamente un carácter técnico y otro \nparticipativo, en donde se evalúan varios aspectos relacionados con los estudios de \nimpacto ambiental y, en ocasiones, con los diagnósticos ambientales de alternativas, \nen un escenario a su vez técnico científico y sensible a los intereses de las \npoblaciones afectadas (Ley 99/93 arts. 56 y ss); y, finalmente, (vii) se concreta en la \nexpedición de un acto administrativo de carácter especial, el cual puede ser \nmodificado unilateralmente por la administración e incluso revocado sin el \nconsentimiento previo, expreso y escrito de su titular, cuando se advierta el \nincumplimiento de los términos que condicionan la autorización (Ley 99/93 art. 62). En \n\nResolución No. 003142       Del 29 DIC. 2023          Hoja No. 5 de 35\n“Por la cual se resuelve recurso de reposición interpuesto en contra de la \nResolución 2136 del 18 de septiembre de 2023”\nPágina 5 de 35\nestos casos funciona como garantía de intereses constitucionales protegidos por el \nprincipio de prevención y demás normas con carácter de orden público…” (…).\nb. Competencia de la Autoridad Nacional de Licencia Ambientales - \nANLA       \nEl artículo 49 de la Ley 99 de 1993, indicó que la ejecución de obras, el \nestablecimiento de industrias o el desarrollo de cualquier actividad, que de \nacuerdo con la ley y los reglamentos, pueda producir deterioro grave a los \nrecursos naturales renovables o al medio ambiente o introducir modificaciones \nconsiderables o notorias al paisaje, requerirán de una licencia ambiental. \nEl numeral 1 del Artículo 52 de la Ley 99 de 1993, establece que el hoy Ministerio \nde Ambiente y Desarrollo Sostenible, otorgará la licencia ambiental para la \nejecución de obras y actividades de exploración, explotación, transporte, \nconducción y depósito de hidrocarburos, y construcción de refinerías, sin perjuicio \nde la potestad de la Autoridad Ambiental para adicionar o establecer condiciones \nambientales especificas requeridas en cada caso. \nMediante Decreto Ley 3573 del 27 de septiembre de 2011, el presidente de la \nRepública en ejercicio de las facultades extraordinarias conferidas en los literales \nd), e) y f) del artículo 18 de la Ley 1444 de 2011, creó la Autoridad Nacional de \nLicencias Ambientales – ANLA, en los términos del artículo 67 de la Ley 489 de \n1998, con autonomía administrativa y financiera, sin personería jurídica, la cual \nhará parte del Sector Administrativo de Ambiente y Desarrollo Sostenible. \nEs del caso señalar que la Autoridad Nacional de Licencias Ambientales - ANLA, \nacorde con lo establecido en el artículo 2 del Decreto Ley 3573 del 27 de \nseptiembre de 2011, es la entidad encargada de que los proyectos, obras o \nactividades sujetos de licenciamiento, permiso o trámite ambiental cumplan con la \nnormativa ambiental, de tal manera que contribuyan al desarrollo sostenible \nambiental del país. \nDe acuerdo con la función establecida en el numeral 2 del artículo tercero del \ncitado Decreto 3573 del 27 de septiembre de 2011, a la Autoridad Nacional de \nLicencias Ambientales – ANLA le corresponde realizar el seguimiento de las \nlicencias, permisos y trámites ambientales.\nEn ejercicio de las facultades extraordinarias conferidas en los literales d), e) y f), \ndel artículo 18 de la Ley 1444 de 2011, el Gobierno Nacional expidió el Decreto \n3573 del 27 de septiembre de 2011, y creó la AUTORIDAD NACIONAL DE \nLICENCIAS AMBIENTALES – ANLA. \nEl Decreto 1076 de 2015 en su artículo 2.2.2.3.9.1 establece en su parágrafo 1º \nque “La autoridad ambiental que otorgó la licencia ambiental o estableció el plan \n\nResolución No. 003142       Del 29 DIC. 2023          Hoja No. 6 de 35\n“Por la cual se resuelve recurso de reposición interpuesto en contra de la \nResolución 2136 del 18 de septiembre de 2023”\nPágina 6 de 35\nde manejo ambiental respectivo, será la encargada de efectuar el control y \nseguimiento a los proyectos, obras o actividades autorizadas.” \nPor medio del artículo décimo del Decreto 376 del 11 de marzo de 2020 “Por el \ncual se modifica la estructura de la Autoridad Nacional de Licencias Ambientales -\nANLA- “, el Ministro de Ambiente y Desarrollo Sostenible, se dispuso la escisión de \nla Subdirección de Evaluación y Seguimiento y la creación de la Subdirección de \nSeguimiento de Licencias Ambientales, la cual de acuerdo al numeral primero del \nmencionado artículo, tiene la función de realizar el control y seguimiento a los \nproyectos, obras o actividades que cuenten con licencia ambiental. \nMediante la Resolución 423 del 12 de marzo de 2020 “Por la cual se delegan unas \nfunciones y se dictan otras disposiciones”, se delegó en el Asesor Código 1020 \nGrado 15 del Despacho del Director General, la función de suscribir los actos \nadministrativos que aprueben los planes de compensación y de no menos del 1%. \nMediante la Resolución 669 del 14 de abril de 2020, se nombró al servidor público \nEDILBERTO PEÑARANDA CORREA, identificado con cedula de ciudadanía No. \n4.052.851, en el empleo de libre nombramiento y remoción de Asesor, código \n1020, grado 15, adscrito a la Dirección General de la planta global de la ANLA.\nMediante la Resolución 1957 del 5 de noviembre de 2021, se adoptó el Manual \nEspecífico de Funciones y de Competencias Laborales para los empleos de la \nAutoridad Nacional de Licencias Ambientales – ANLA, y en el que se establece la \nfunción de elaborar, revisar y suscribir los actos administrativos requeridos en el \nproceso de seguimiento de licencias ambientales y otros instrumentos. \nTeniendo en cuenta lo anterior, es el Asesor del Despacho del Director General de \nla Autoridad Nacional de Licencias Ambientales el funcionario competente para \nfirmar el presente acto administrativo.\nAunado a lo anterior, el numeral primero del artículo 74 de la Ley 1437 de 2011, \nestablece que el recurso de reposición lo deberá resolver quien expidió la decisión \npara que la aclare, modifique, adicione o revoque, en el presente caso, lo \nresolverá el asesor del despacho del Director de la Autoridad Nacional de \nLicencias Ambientales – ANLA.  \nc. Procedencia, oportunidad, presentación y requisitos del recurso de \nReposición1\n1 El recurso de reposición constituye un instrumento legal mediante el cual la parte interesada tiene la oportunidad de \nejercer el derecho de controvertir una decisión, para que la administración previa su evaluación, la confirme, aclare, \nmodifique o revoque, previo el lleno de las exigencias legales establecidas para el efecto. Lla finalidad esencial del recurso \nde reposición no es otra distinta a que al funcionario de la administración que tomó una decisión administrativa, se le dé la \noportunidad para que enmiende o corrija un error, o los posibles errores que se hayan podido presentar en el acto \nadministrativo por él expedido en ejercicio de sus funciones.\n\nResolución No. 003142       Del 29 DIC. 2023          Hoja No. 7 de 35\n“Por la cual se resuelve recurso de reposición interpuesto en contra de la \nResolución 2136 del 18 de septiembre de 2023”\nPágina 7 de 35\nConforme a lo previsto en el artículo sexto de la Resolución 2136 del 18 de \nseptiembre de 2023, contra dicho acto administrativo procede el recurso de \nreposición dentro de los 10 días siguientes a su notificación, cumpliendo los \nrequisitos establecidos en los artículos 74 y siguientes del Código de \nProcedimiento Administrativo y de lo Contencioso Administrativo (Ley 1437 de \n2011). \nLa Resolución 2136 del 18 de septiembre de 2023, fue notificada de manera \nelectrónica el 19 de septiembre de 2023 y fue objeto de recurso de reposición \nmediante comunicación 20236200692062 de fecha (3)  tres de octubre de 2023, \nes decir, fue presentado de manera oportuna. \nAdicionalmente, en cuanto a los requisitos legales establecidos en el artículo 77 de \nla Ley 1437 de 2011, para presentar el recurso de reposición, se constató que \nfueron debidamente cumplidos por el recurrente, por cuanto se expresaron los \nmotivos de inconformidad así como su nombre y dirección del recurrente y fue \npresentado por el representante legal suplente, de la sociedad PERENCO \nCOLOMBIA LIMITED, como lo acredita el certificado de cámara de comercio, \nexpedido por la Cámara de Comercio de Bogotá y anexo al recurso de reposición, \nresaltando que dicha sociedad es la  titular del instrumento de control ambiental \ndel proyecto  “Bloque Casanare A1a” (Campo La Gloria)”.\nA su vez, el artículo 79 ibídem, sobre el trámite de los recursos preceptúa que el \nrecurso de reposición deberá resolverse de plano, a no ser que al interponerlo se \nhaya solicitado la práctica de pruebas, o que el funcionario que ha de decidir el \nrecurso considere necesario decretarlas de oficio, situaciones que no se presentan \nen el caso de estudio.\nEn tal sentido, el funcionario de la administración a quien corresponde tomar la \ndecisión definitiva, debe hacerlo con base en la información que disponga; para \neste caso, es la contenida en el expediente LAM0715, que aquí nos ocupa.\n3. CONSIDERACIONES DE LA AUTORIDAD NACIONAL DE LICENCIAS \nAMBIENTALES \nFRENTE \nAL \nRECURSO \nDE \nREPOSICIÓN \nINTERPUESTO POR LA SOCIEDAD PERENCO COLOMBIA LIMITED.\nA continuación, se procederá a resolver el recurso de reposición interpuesto por la \nsociedad PERENCO COLOMBIA LIMITED., contra la Resolución 2136 del 18 de \nseptiembre de 2023, conforme se expuso en las anteriores consideraciones y en \ntal sentido los argumentos emitidos por esta Autoridad Nacional.\nEl recurso de reposición objeto de estudio por parte de esta Autoridad Nacional, \nversa sobre 1 petición, donde la sociedad PERENCO COLOMBIA LIMITED, \nsolicita: \n\nResolución No. 003142       Del 29 DIC. 2023          Hoja No. 8 de 35\n“Por la cual se resuelve recurso de reposición interpuesto en contra de la \nResolución 2136 del 18 de septiembre de 2023”\nPágina 8 de 35\n“(…)\nPERENCO LIMITED, respetuosamente solicita a la Autoridad Nacional de \nLicencias Ambientales-ANLA, en ejercicio del recurso de reposición que nos \nocupa, se REVOQUE en todo su contexto lo dispuesto en la Resolución No. \n2136 del 18 de septiembre de 2023 y se realice una mesa de trabajo que \npermita al recurrente continuar con el acogimiento a lo dispuesto en el artículo \n321 de la ley 1955 de 2019, teniendo en cuenta la realidad de la situación. \n(…)”\nEn tal circunstancia, y en aras de resolver con apego a la Constitución, la Ley y las \nnormas especiales que rigen la materia la petición de la sociedad PERENCO \nCOLOMBIA LIMITED., esta Autoridad Nacional analizará los argumentos \nexpuestos en el escrito de recurso de reposición con radicación 20236200692062 \nde fecha (3)  tres de octubre de 2023, obrante en el expediente LAM0715.\n \nFinalmente es de resaltar, que el recurso de reposición interpuesto, se dirige \ncontra  todo el contenido de la Resolución 2136 del 18 de septiembre de 2023, por \nlo que una vez se transcriba la parte del argumento de la petición incoada por la \nsociedad \nPERENCO \nCOLOMBIA \nLIMITED., \n \nse \nrealizará \nel \nanálisis \ncorrespondiente, por parte de esta Autoridad Nacional, a fin de resolver el mismo, \nya sea aclarando, revocando, modificando o confirmando la disposición \ncorrespondiente. \nA. Argumentos de la sociedad PERENCO COLOMBIA LIMITED\nDISPOSICIÓN RECURRIDA\n“(…) \nEn primer lugar, es preciso indicar que dentro de las funciones y competencias \natribuidas a la ANLA no se encuentra inmersa la interpretación de las normas que \nregulan la organización y el funcionamiento del Estado, por lo que bajo el principio \nde legalidad debe ceñirse estrictamente a lo señalado en la normatividad.\nLa anterior claridad, resulta pertinente teniendo en cuenta que, el acogimiento a lo \ndispuesto en el artículo 321 de la ley 1955 de 2019, no es suceptible de emisión de \npronunciamiento de fondo por parte de la autoridad ambiental, sino que \ncorresponde a la decisión libre y espontánea de la empresa de acogerse a lo \ndispuesto en tal disposición, por lo que decretar el desistimiento tácito de dicha \nmanifestación libre y espontánea, va en contra vía del principio de legalidad y \nvulnera innegablemente el debido proceso del recurrente como se expondrá a \ncontinuación:\nARTICULO 321 DE LA LEY 1955 DE 2019 – PROCEDIMIENTO NO REGLADO \n\nResolución No. 003142       Del 29 DIC. 2023          Hoja No. 9 de 35\n“Por la cual se resuelve recurso de reposición interpuesto en contra de la \nResolución 2136 del 18 de septiembre de 2023”\nPágina 9 de 35\nEs preciso indicar  que en observancia de lo estipulado en el artículo 321 del Plan \nNacional de Desarrollo (Ley 1955 de 2019) que al tenor de su letra expresa:\n“ARTÍCULO 321. ACTUALIZACIÓN DEL VALOR DE LA INVERSIÓN DE NO \nMENOS DEL 1%, DE COMPETENCIA DE LA AUTORIDAD NACIONAL DE \nLICENCIAS AMBIENTALES (ANLA). Todos aquellos titulares de una licencia \nambiental que tengan inversiones pendientes a la fecha de promulgación de la \npresente ley, relativas a la inversión forzosa de no menos del 1% de que trata el \nparágrafo del artículo 43 de la Ley 99 de 1993, PODRÁN ACOGERSE al \nporcentaje de incremento del valor de la base de liquidación de la inversión forzosa \nde no menos del 1%, según el año de inicio de actividades autorizadas en la \nlicencia ambiental, de acuerdo con lo señalado en la siguiente tabla:\nLas inversiones ejecutadas o que estén en proceso de ejecución en el marco de \nun plan de inversión del 1% aprobado por la Autoridad Nacional de Licencias \nAmbientales (ANLA), no serán tenidas en cuenta para efectos del cálculo de la \nactualización del valor de la base de liquidación de la inversión del 1%. \nPARA ACOGERSE deberán presentar la solicitud dentro de los seis (6) \nmeses siguientes a la promulgación de la presente ley, junto con: a) el \ncertificado que soporta el cálculo de la base de liquidación; b) el plan de inversión \ncon la base actualizada aplicando el porcentaje de incremento definido en la tabla \nanterior; c) la proyección financiera para la ejecución del plan de inversión y d) el \ncronograma del plan de inversión del 1% con inicio de ejecución no superior a los \nseis (6) meses siguientes de la aprobación de la solicitud de acogimiento. (Negrilla \ny subrayado del autor)\n En caso de no ejecutar las inversiones de acuerdo con el cronograma, por un \ntiempo superior a un año fiscal, deberán actualizar los valores no ejecutados, de \nacuerdo con la fórmula señalada en el parágrafo 1° del presente artículo.\nPARA LOS QUE SE ACOJAN o no al presente artículo y los nuevos titulares de \nlicencia, la liquidación de la inversión se realizará de conformidad con los \nsiguientes ítems: a) adquisición de terrenos e inmuebles, b) obras civiles, c) \nadquisición y alquiler de maquinaria y equipo utilizado en las obras civiles y d) \nconstitución de servidumbres. Los costos y gastos, incluidos los capitalizados en el \nactivo, a que se refieren los literales anteriores, corresponden a los realizados en \n\nResolución No. 003142       Del 29 DIC. 2023          Hoja No. 10 de 35\n“Por la cual se resuelve recurso de reposición interpuesto en contra de la \nResolución 2136 del 18 de septiembre de 2023”\nPágina 10 de 35\nlas etapas previas a la producción de proyectos, obras o actividades sujetos de \nlicenciamiento ambiental o aquellas modificaciones de proyectos, obras o \nactividades que tengan como instrumento de control un plan de manejo ambiental, \nsiempre y cuando dicha modificación cumpla con las condiciones establecidas en \nla reglamentación vigente. (…)” (subrayado y negrilla fuera del texto del Autor del \nrecurso)\nEs de precisar que el artículo 321, va dirigido exclusivamente a la búsqueda de la \nmanifestación de la voluntad de los administrados, quienes en su calidad de \ntitulares de una licencia ambiental con inversiones pendientes, a través de su \npronunciamiento positivo o negativo, tenían la facultad de acogerse o no al \nporcentaje de incremento del valor de la base de liquidación de la inversión forzosa \nde no menos del 1% , por lo que cual dicha actuación no resulta impositiva, pero si \nconstituye una potestad para quien en calidad de titular de una licencia ambiental \npueda o decida hacerlo. \nDe la lectura fiel del artículo transcrito se establecen que existe una obligación que \nse traducen en dos situaciones para los titulares de las licencias ambientales o \nbien se acogen al porcentaje previamente determinado en la ley o se acoge a la \nliquidación del costo de inversión conforme lo determina la fórmula del parágrafo. \nAsí mismo, de tal lectura al referido texto legal, no es posible deducir de manera \nadicional ni mucho menos interpretar, que allí se determinó alguna reglamentación \nya que su texto es claro, lucido y preciso, por lo que tratar de incluirla, no \ncorresponde a la simple interpretación subjetiva del literal correspondiente al \nartículo en cuestión, pues vale precisar, que la regla interpretativa de las normas \nes la literal, y asi lo refiere la doctrina que expresa, “si los términos de la Ley son \nclaros ha de estarse al sentido gramatical, y así el mecanismo interpretativo no ha \nde ponerse en marcha si la norma legal aparece redactada con tal claridad y \nprecisión que su contenido, el alcance de lo establecido, el sentido de su \nregulación y el ámbito material de su imperio, se deducen del texto de manera tan \npatente que la interpretación del precepto deviene innecesaria, ineficaz, pudiendo \nconducir, a deformar la intención del legislador llevando a soluciones jurídicas \ndistintas o contrarias a las que efectivamente la ley consagra”.(Wolters Kluwer). \nEl objetivo de la norma que hoy se discute, sin hacer extensa hermenéutica sobre \nla misma, era traer a valor presente el valor del costo de inversión, aspecto éste \nque constituía un asunto controversial al pretenderse a través de actos \nadministrativos requerir la indexación de esos valores.\nAsí las cosas, el Gobierno Nacional, pretendió a través de la Ley 1955 de 2019 \ncesar las interpretaciones frente a este elemento de ajuste meramente contable \n(indexación), no ambiental y crear a través de esta ley del plan nacional de \ndesarrollo, unos porcentajes puntuales de incremento del valor de la base de \nliquidación, buscando a través del requerimiento perentorio estatuido en el artículo \n321 que los administrados sujetos a esta obligación derivada de la Ley 99 de 1993, \nse acogieran o no a ese marco porcentual de incremento. \n\nResolución No. 003142       Del 29 DIC. 2023          Hoja No. 11 de 35\n“Por la cual se resuelve recurso de reposición interpuesto en contra de la \nResolución 2136 del 18 de septiembre de 2023”\nPágina 11 de 35\nPor lo anterior ha de reiterarse que el objeto de la norma era obtener de los \ntitulares de los instrumentos de manejo y control ambiental ese pronunciamiento \nde acogimiento o no a ese porcentaje de incremento que recoge el mentado \nartículo 321, en otras era un asunto de mera voluntad, tomar una o la otra opción. \nTema accesorio representa, según la lectura literal del artículo 321, de que dicho \npronunciamiento de acogimiento viniese acompañado de una información adjunta1 \n, que es la que hoy reclama la Autoridad ambiental como no conforme.\nPor ello, en gracia de discusión de la suficiencia o no de dicha información adjunta, \nsu no recibo por parte de la Autoridad ambiental NO puede ser motivación o \npremisa legal para desechar o inobservar la manifestación expresa de acogimiento \ndel incremento porcentual de los costos de liquidación de la inversión del 1% a la \nque refiere el encabezamiento del artículo 321 que hizo manifiesta PERENCO \nLIMITED mediante el comunicado 2019184507-1-000 del 25 de noviembre de \n2019 y sobre la cual se ha entregado multiple información tal como lo refiere la \nautoridad ambiental en la parte motiva de la Resolución 2136 del 18 de septiembre \nde 2023, más aún cuando esta se hizo conocer dentro de la oportunidad temporal \nestablecida en el entonces Plan Nacional de Desarrollo. \nAhora bien, con anterioridad referíamos que el citado artículo 321 de la Ley 1955 \nde 2019, carece de reglamentación, y por ello per se, da su aplicación legal a partir \nde la redacción legal del texto. \nEn esta redacción se hace ausente disposición legal que determine el \nprocedimiento a seguir, por parte de las autoridades ambientales titulares de la \nfunción de evaluación y seguimiento ambiental, cuando de acuerdo al criterio \nevaluador se determine su inconformidad; por ello, el requerimiento desarrollado \npor la autoridad ambiental a través del comunicado 2020004616-2-000 del 14 de \nenero de 2020 y Auto 8371 de 31 de agosto de 2020, se constituye en una \nactuación meramente discrecional a la luz de la doctrina y la jurisprudencia, y es \npor ello nuestra razón de insistir respetuosamente, que la intención del legislador, \nmaterializado en el fin de la ley, fue darle al particular la opción de acogerse o no a \nlos parametros de la misma, y en ningún aparte del texto normativo se lee, que se \npueda despojar al titular de la manifestación relacionada con la voluntad de \nacogerse o no a la misma y mucho menos que se imponga como salida presurosa \nal tema, un desistimiento tácito, que por demás no aplica, para un trámite que ya \nfijó la misma ley (…)”\nConsideraciones de la ANLA frente a  los anteriores argumentos indicados \npor la sociedad PERENCO COLOMBIA LIMITED:  \nEsta Autoridad Nacional, en efecto comparte el criterio indicado por la sociedad \nPERENCO COLOMBIA LIMITED, cuando esta establece que la Autoridad \nNacional, bajo el principio de legalidad debe ceñirse estrictamente a lo señalado \nen la normatividad.\nPues en efecto, el artículo 3 de la Ley 1437 de 2011, indica:             \n\nResolución No. 003142       Del 29 DIC. 2023          Hoja No. 12 de 35\n“Por la cual se resuelve recurso de reposición interpuesto en contra de la \nResolución 2136 del 18 de septiembre de 2023”\nPágina 12 de 35\n“(…) Artículo 3°. Principios. Todas las autoridades deberán interpretar y aplicar \nlas disposiciones que regulan las actuaciones y procedimientos administrativos a \nla luz de los principios consagrados en la Constitución Política, en la Parte Primera \nde este Código y en las leyes especiales (…)”.\nEn tal sentido, esta Autoridad debe actuar bajo lo reglado en la Norma Superior, la \nLey 1437 de 2011 y las normas especiales que rigen la materia, que para el caso \nen estudio es la Ley 99 de 1993, el Decreto 1076 de 2015 y el artículo 321 de la \nLey 1955 de 2019.\nAsí las cosas, en el trámite en comento, la Ley 1955 de 2019, en su artículo 321, \nclaramente indicó que  todos aquellos titulares de una licencia ambiental que \ntengan inversiones pendientes a la fecha de promulgación de la norma ibídem, \nrelativas a la inversión forzosa de no menos del 1% de que trata el parágrafo del \nartículo 43 de la Ley 99 de 1993, podrán acogerse al porcentaje de incremento del \nvalor de la base de liquidación de la inversión forzosa de no menos del 1%, según \nel año de inicio de actividades autorizadas en la licencia ambiental, de acuerdo al \nporcentaje de incremento de base que indica el artículo y Ley ibídem.\nNo obstante, de  acuerdo al inciso tercero, de artículo 321 de la Ley 1955 de 2019, \nel titular del proyecto Licenciado,  para acogerse deberá presentar la solicitud \ndentro de los seis (6) meses siguientes a la promulgación de la presente Ley, \njunto con: \na) el certificado que soporta el cálculo de la base de liquidación, \nb) el plan de inversión con la base actualizada aplicando el porcentaje de \nincremento definido en la tabla anterior, \nc) la proyección financiera para la ejecución del plan de inversión y \nd) el cronograma del plan de inversión del 1% con inicio de ejecución no \nsuperior a los seis (6) meses siguientes de la aprobación de la solicitud de \nacogimiento.   \nDe acuerdo a lo anterior, denótese que la solicitud debe estar acompañada junto \ncon 4 documentos técnico –jurídicos, en tal sentido en un hecho notorio Sine qua \nnon, que la ausencia de uno de ellos, genera que no se pueda acceder al \nacogimiento al artículo 321 de la Ley 1955 de 2019, porque la norma ibídem \nclaramente y sin interpretación alguna indica que “(…) para acogerse deberán \npresentar la solicitud dentro de los seis (6) meses siguientes a la promulgación de \nla presente Ley, junto con (...)” los requisitos indicados en el párrafo anterior.\nEn el presente caso, se declaró el desistimiento tácito de la propuesta mediante \nradicado No. 2019184507-1-000 del 25 de noviembre de 2019, relacionada con la \n“Solicitud de acogimiento al porcentaje incremental contenido en el Artículo 321 de \nla Ley 1955 del 25 de mayo de 2019, para el proyecto “Bloque Casanare A1a” \n\nResolución No. 003142       Del 29 DIC. 2023          Hoja No. 13 de 35\n“Por la cual se resuelve recurso de reposición interpuesto en contra de la \nResolución 2136 del 18 de septiembre de 2023”\nPágina 13 de 35\n(Campo La Gloria)”, porque la sociedad no presentó en su solicitud de \nacogimiento al artículo 321 Ley 1955 de 2019: \nI.\nEl plan de inversión con la base actualizada aplicando el porcentaje \naplicando el porcentaje de incremento definido en la tabla del artículo \n321 de la Ley 1955 del 25 de mayo de 2019.\nII.\nLa proyección financiera para la ejecución del plan de inversión. \nIII.\nEl cronograma del plan de inversión del 1% con inicio de ejecución \nno superior a los seis (6) meses siguientes de la aprobación de la \nsolicitud de acogimiento.  \n        \nEn este orden de ideas, la sociedad junto con la solicitud de acogimiento, no \nadjuntó el literal b2 es decir no allegó plan de inversión con la base actualizada \naplicando el porcentaje de incremento definido en la tabla anterior, no presentó el \nrequisito c)3 tendiente a entregar la proyección financiera para la ejecución del plan \nde inversión y del mismo modo no remitió  el cronograma del plan de inversión del \n1% con inicio de ejecución no superior a los seis (6) meses, en tal sentido no \nallegó el requisito d)4 del inciso tercero del artículo 321 de la Ley 1955 de 2019.\nAsí las cosas, una solicitud para definir una situación jurídica, tendiente a \nestablecer si se acepta o no la solicitud de acogimiento al artículo 321 de la Ley \n1955 de 2019, debe venir completa con los requisitos de la Ley Especial,  por \ntanto no es ajustado a la realidad procesal del presente expediente, inferir que la \nAutoridad Nacional le esta cercenando “al particular la opción de acogerse o no a los \nparametros de la misma, y en ningún aparte del texto normativo se lee, que se pueda \ndespojar al titular de la manifestación relacionada con la voluntad de acogerse o no a la \nmisma” por cuanto sin bien es cierto en efecto el artículo 321 de la Ley 1955 de \n2019, no señala la consecuencia jurídica de que puede pasar si el  titular del \nproyecto, presenta la solicitud incompleta, también lo es  que el inciso 2º del \nartículo 13 de la Ley 1755 de 2015, consagra: \n2 Inciso tercero del artículo 321 de la Ley 1955 de 2019 “(…) Para acogerse deberán presentar la solicitud dentro de los seis (6) meses \nsiguientes a la promulgación de la presente Ley, junto con: a) el certificado que soporta el cálculo de la base de liquidación, b) el plan \nde inversión con la base actualizada aplicando el porcentaje de incremento definido en la tabla anterior, c) la proyección financiera \npara la ejecución del plan de inversión y d) el cronograma del plan de inversión del 1% con inicio de ejecución no superior a los seis (6) \nmeses siguientes de la aprobación de la solicitud de acogimiento (…)”.\n3 Inciso tercero del artículo 321 de la Ley 1955 de 2019 “(…) Para acogerse deberán presentar la solicitud dentro de los seis (6) meses \nsiguientes a la promulgación de la presente Ley, junto con: a) el certificado que soporta el cálculo de la base de liquidación, b) el plan \nde inversión con la base actualizada aplicando el porcentaje de incremento definido en la tabla anterior, c) la proyección financiera \npara la ejecución del plan de inversión y d) el cronograma del plan de inversión del 1% con inicio de ejecución no superior a los seis (6) \nmeses siguientes de la aprobación de la solicitud de acogimiento (…)”.\n4 Inciso tercero del artículo 321 de la Ley 1955 de 2019 “(…) Para acogerse deberán presentar la solicitud dentro de los seis (6) meses \nsiguientes a la promulgación de la presente Ley, junto con: a) el certificado que soporta el cálculo de la base de liquidación, b) el plan \nde inversión con la base actualizada aplicando el porcentaje de incremento definido en la tabla anterior, c) la proyección financiera \npara la ejecución del plan de inversión y d) el cronograma del plan de inversión del 1% con inicio de ejecución no superior a los seis (6) \nmeses siguientes de la aprobación de la solicitud de acogimiento (…)”\n\nResolución No. 003142       Del 29 DIC. 2023          Hoja No. 14 de 35\n“Por la cual se resuelve recurso de reposición interpuesto en contra de la \nResolución 2136 del 18 de septiembre de 2023”\nPágina 14 de 35\n“Toda actuación que inicie cualquier persona ante las autoridades implica el \nejercicio del derecho de petición consagrado en el artículo 23 de la Constitución \nPolítica, sin que sea necesario invocarlo. Mediante él, entre otras actuaciones, \nse podrá solicitar: el reconocimiento de un derecho, la intervención de una \nentidad o funcionario, la resolución de una situación jurídica, la prestación de un \nservicio, requerir información, consultar, examinar y requerir copias de \ndocumentos, formular consultas, quejas, denuncias y reclamos e interponer \nrecursos”. (Negrilla y subrayado fuera de texto)   \nEn este orden de ideas, frente a la petición de solicitud de acogimiento, con el \nánimo de definir la situación jurídica solicitada, la misma no es procedente \nacogerla porque la sociedad en su comunicación con radicado ANLA 2019184507-\n1-000 del 25 de noviembre de 2019, no cumple con los  requisitos previstos en el \nartículo 321 de la Ley 1955 del 25 de mayo de 2019, como se explicó en párrafos \nanteriores y esta acción no es interpretativa, es taxativa, por cuanto la ausencia de \nuno de los requisitos genera que no se pueda conceder el acogimiento solicitado.\nEl argumento indicado tiene sustento probatorio en el informe técnico 5783 del 23 \nde septiembre de 2022, el cual reza:\n“(…) La Sociedad PERENCO COLOMBIA LIMITED mediante radicado 2019184507-1-\n000 del 25 de noviembre de 2019, presentó a esta Autoridad Nacional la solicitud de \nacogimiento al porcentaje incremental contenido en el Artículo 321 de la Ley 1955 del 25 \nde mayo de 2019, para el proyecto “Bloque Casanare A1a” (Campo La Gloria). \nEn esta solicitud se incluye únicamente el oficio mediante el cual realiza la solicitud, la \ncopia del radicado 4120-E1-50483 del 19 de noviembre de 2013 donde el titular de la \nlicencia entregó previamente 16 certificados expedidos por los Contadores Públicos Jorge \nEnrique Lozano Plata, con Tarjeta profesional 55022-T, y Jaime Lizarazo Rubiano, con \nTarjeta profesional No. 123121-T, expedidos el 27 de mayo de 2010 y el 12 de noviembre \nde 2013, de los pozos Gloria 5, 7, 8, 9, 10, 11, 12, 13, 14, 15, 16, 17, 18, 19 y 20 y Gloria \nNorte 6, del periodo comprendido entre 1996 y 2012, del proyecto “PROYECTO \nPERFORACIÓN Y OPERACIÓN CAMPO LA GLORIA; y un documento Excel con el \n“cálculo de la inversión del 1%, conforme el artículo 321 de la Ley 1955 de 20192.”\nSe observa que en la mencionada solicitud (radicado 2019184507-1-000 del 25 de \nnoviembre de 2019) no se presentó la totalidad de la información necesaria para la \nsolicitud de acogimiento, conforme con lo establecido en el Artículo 321 de la Ley 1955 \nde 2019 en el cual se requiere lo siguiente:\n“ARTÍCULO 321. ACTUALIZACIÓN DEL VALOR DE LA INVERSIÓN DE NO MENOS \nDEL 1%, DE COMPETENCIA DE LA AUTORIDAD NACIONAL DE LICENCIAS \nAMBIENTALES – ANLA, Todos aquellos titulares de una licencia ambiental que tengan \ninversiones pendientes a la fecha de promulgación de la presente Ley, relativas a la \ninversión forzosa de no menos del 1 % de que trata el parágrafo del artículo 43 de la Ley \n99 de 1993, podrán acogerse al porcentaje de incremento del valor de la base de \nliquidación de la inversión forzosa de no menos del 1 %, según el año de inicio de \nactividades autorizadas en la licencia ambiental, de acuerdo con lo señalado en la \nsiguiente tabla:\n(…)\n\nResolución No. 003142       Del 29 DIC. 2023          Hoja No. 15 de 35\n“Por la cual se resuelve recurso de reposición interpuesto en contra de la \nResolución 2136 del 18 de septiembre de 2023”\nPágina 15 de 35\nLas inversiones ejecutadas o que estén en proceso de ejecución en el marco de un plan \nde inversión del 1% aprobado por la Autoridad Nacional de Licencias Ambientales - \nANLA, no serán tenidas en cuenta para efectos del cálculo de la actualización del valor \nde la base de liquidación de la inversión del 1%.\nPara acogerse deberán presentar la solicitud dentro de los seis (6) meses siguientes a la \npromulgación de la presente Ley, junto con: a) el certificado que soporta el cálculo de la \nbase de liquidación, b) el plan de inversión con la base actualizada aplicando el \nporcentaje de incremento definido en la tabla anterior, c) la proyección financiera para la \nejecución del plan de inversión y d) el cronograma del plan de inversión del 1% con inicio \nde ejecución no superior a los seis (6) meses siguientes de la aprobación de la solicitud \nde acogimiento. (…)”. (Subrayado fuera del texto).\nAl respecto de este radicado (2019184507-1-000 del 25 de noviembre de 2019), la \nAutoridad Nacional de Licencias Ambientales con radicado 2020004616-2-000 del 14 de \nenero de 2020, requirió a la Sociedad que, en los términos del Artículo 17 del Código de \nProcedimiento Administrativo y lo Contencioso Administrativo, presentara la información \ncomplementaria con el fin de resolver de fondo la solicitud de acogimiento al porcentaje \nincremental contenido en el Artículo 321 de la Ley 1955 del 25 de mayo de 2019. \nEs pertinente señalar que el oficio de solicitud de información complementaria fue \nrecibido\npor la Sociedad el día 14 de enero de 2020 de acuerdo con lo informado por el Grupo de \ncorrespondencia, razón por la cual contaba con término para presentar la solicitud de \nprórroga hasta el día 14 de febrero de 2020.\nLa Sociedad mediante radicado 2020026415-1-000 del 20 de febrero de 2020, presentó \nsolicitud de prórroga para dar cumplimiento al requerimiento de información \ncomplementaria requerida con oficio radicado 2020004616-2-000 del 14 de enero de \n2020, sin allegar poder, mandato o representación debidamente constituido para actuar \nen nombre de la Sociedad.\nPosteriormente la Autoridad Nacional de Licencias Ambientales radicación 2020056051-\n2-000 del 13 de abril de 2020, informó a la Sociedad que, como consecuencia de no \naportar la información complementaria dentro del plazo otorgado, se entendería que se \nha desistido de la solicitud y se procedería al archivo de esta mediante acto \nadministrativo motivado.\nEn el artículo primero del Auto 4900 del 29 de mayo de 2020, se decreta el desistimiento \ntácito de la solicitud de acogimiento al porcentaje de incremento del valor de la base de \nliquidación de la inversión forzosa de no menos del 1%, previsto en el artículo 321 Ley \n1955 del 25 de mayo de 2019, presentada por la Sociedad mediante comunicación con \nradicación 2019184507-1-000 del 25 de noviembre de 2019.\nMediante radicado 2020094717-1-000 del 16 de junio de 2020, la Sociedad presentó \nrecurso de reposición contra el Auto 04900 del 29 de mayo de 2020.\nEn el artículo primero del Auto 8371 de 31 de agosto de 2020, se repone el Auto 4900 del \n29 de mayo de 2020 y en su artículo segundo ordena el desarchivo de la solicitud \nacogimiento al porcentaje de incremento del valor de la base de liquidación de la \ninversión forzosa de no menos del 1%, previsto en el artículo 321 Ley 1955 del 25 de \nmayo de 2019.\n\nResolución No. 003142       Del 29 DIC. 2023          Hoja No. 16 de 35\n“Por la cual se resuelve recurso de reposición interpuesto en contra de la \nResolución 2136 del 18 de septiembre de 2023”\nPágina 16 de 35\nSe resalta que como parte de las consideraciones jurídicas del Auto 8371 de 31 de \nagosto de 2020 se describe que:\n“La norma en mención resulta aplicable de cara a concluir la actuación administrativa \niniciada por la Sociedad, y en ese sentido, la Autoridad Nacional repondrá las decisiones \ncontenidas en el Auto objeto de recurso, por lo que la solicitud de acogimiento al \nporcentaje incremental contenido en el artículo 321 de la Ley 1955 del 25 de mayo de \n2019 deberá seguir su curso en aras de dar cumplimiento al principio de eficiencia \nadministrativa y el artículo 41 del Código de Procedimiento Administrativo y de lo \ncontencioso Administrativo, con base en lo cual, se procederá a requerir en la parte \nresolutiva del presente acto administrativo la información solicitada por la Autoridad \nNacional, a través del oficio 2020004616-2-000 del 14 de enero de 2020, para que la \nmisma sea presentada en el término de un (1) mes, contado a partir del día siguiente a la \nejecutoria del presente acto administrativo”.\nA partir de lo cual mediante el artículo tercero del mencionado Auto 8371 de 31 de agosto \nde 2020 se requiere a la Sociedad la siguiente información:\n“ARTÍCULO TERCERO. Requerir a la Sociedad PERENCO COLOMBIA LIMITED para \nque en el término de un (1) mes, contado a partir del día siguiente a la ejecutoria del \npresente acto, allegue la información y los soportes correspondientes de la misma, de \nconformidad con los requerimientos efectuados a través del oficio con radicación \n2020004616-2-000 del 14 de enero de 2020., emitido por la Autoridad Nacional de \nLicencias Ambientales”.\nAl revisar el expediente posterior a la fecha de ejecutoria del Auto 8371 de 31 de agosto \nde 2020,  con el fin de verificar si la Sociedad presentó la información requerida en el \nartículo 321 de la Ley 1955 de 2019, solicitada a la Sociedad mediante oficio con \nradicado 2020004616-2-000 del 14 de enero de 2020 y en el artículo tercero del Auto \n8371 de 31 de agosto de 2020 para el acogimiento consistente en: “b) el plan de \ninversión con la base actualizada aplicando el porcentaje de incremento definido en la \ntabla anterior, c) la proyección financiera para la ejecución del plan de inversión y d) el \ncronograma del plan de inversión del 1% con inicio de ejecución no superior a los seis (6) \nmeses siguientes de la aprobación de la solicitud de acogimiento.(…)” (Subrayado fuera \nde texto); al respecto se encuentra lo siguiente:\n-\nMediante radicado 2020175753-1-000 del 8 de octubre de 2020 se presentó el ICA 12, \ncorrespondiente al periodo enero – diciembre 2019, en el cual no se presenta la \ninformación requerida.\n-\nMediante radicado 2021058780-1-000 del 31 de marzo de 2021 se presenta comunicación \ncon asunto: “actualización valor base de la inversión 1%, artículo 321 de la Ley 1955 de \n2019”, en donde se relaciona el cálculo del valor base de liquidación actualizado a 2020. \nSe observa que en esta información no se presenta el plan de inversión forzosa de no \nmenos del 1% en donde especifique en que proyectos destinará el monto por ejecutar, \ncronograma, ni proyección financiera.\n-\nMediante radicado 2021094482-1-000 del 13 de mayo de 2021 la Sociedad realizo solicitud \nde pronunciamiento a los radicados 2018170884-1-000 y 2019166291-1-000, relacionada \ncon la aprobación de proyecto de inversión del 1%. Bloque Casanare A1a (también \nllamado La Gloria). Exp. LAM0715. \n\nResolución No. 003142       Del 29 DIC. 2023          Hoja No. 17 de 35\n“Por la cual se resuelve recurso de reposición interpuesto en contra de la \nResolución 2136 del 18 de septiembre de 2023”\nPágina 17 de 35\nEs de resaltar que Mediante oficio 2021115744-2-000 del 9 de junio de 2021 la Autoridad \nNacional de Licencias, emite respuesta al radicado 2021094482-1-000 del 13 de mayo de \n2021, en el cual como conclusión manifiesta:\n“Esta Autoridad se permite manifestar lo siguiente; la Sociedad, deberá presentar la \nnueva propuesta de actividades a ejecutar como parte de la inversión del 1%, \nreemplazando la propuesta de fortalecimiento del monitoreo hidrometereológico en las \ncuencas, en cumplimiento del parágrafo primero del artículo décimo octavo de la \nResolución 1301 del 21 de julio de 2008, numeral 1 del artículo segundo del Auto 1138 \ndel 18 de abril de 2011, artículos tercero, cuarto, quinto, sexto, séptimo, octavo, noveno, \ndécimo primero, décimo segundo del Auto 4734 del 23 de octubre de 2014, artículo \noctavo del Auto 2918 del 27 de julio de 2015, dicha propuesta deberá realizarse en la \ncuenca del Río Charte, Caños Corozos, Arrecifes, El Tigre y/o Mojaculos, toda vez que la \nSociedad mediante comunicación 2017122802-1-000 del 28 de diciembre de 2017, \npresenta a esta autoridad el oficio de desistimiento de la solicitud de acogimiento a lo \nestablecido en el Decreto 2099 del 22 de diciembre de 2016, por lo tanto, la norma \naplicable para la inversión de no menos del 1% es el Decreto 1900 de 2006, por lo tanto, \nel ámbito geográfico será la cuenca del Río Charte, como se mencionó anteriormente.\nAdemás, presentar los criterios de selección de las áreas a restaurar o reforestar, las \nespecies y cantidad a sembrar, en cuanto al programa consistente en la restauración \nconservación y protección de la cobertura vegetal, enriquecimientos vegetales y \naislamiento de áreas para facilitar la sucesión natural en el Río Charte, Caños Corozos, \nArrecifes, El Tigre y/o Mojaculos, y demás información solicitada en el artículo décimo \noctavo y sus parágrafos primero y segundo de la Resolución 1301 del 21 de julio de \n2008”.\nEn esta comunicación no se presentó la información requerida.\n-\nMediante radicado 2021196217-1-000 del 13 de septiembre de 2021 se presentó el ICA \n13, correspondiente al periodo enero – diciembre 2020, en el cual no se presenta la \ninformación requerida.\n-\nMediante radicado 2022061280-1-000 del 31 de marzo de 2022 La Sociedad PERENCO \nCOLOMBIA LIMITED entrega la actualización del valor base de liquidación de la inversión \nde no menos del 1% con corte a diciembre de 2021. Se observa que en esta información \nno se presenta el plan de inversión forzosa de no menos del 1% en donde especifique en \nque proyectos destinará el monto por ejecutar, cronograma, ni proyección financiera.\n-\nMediante radicado 2022108535-1-000 del 31 de mayo de 2022 se presentó el ICA 14, \ncorrespondiente al periodo enero – diciembre 2021, en el cual no se presenta la \ninformación requerida.\nDe acuerdo con lo anterior se evidencia que la Sociedad no presentó la información \nrequerida en el artículo 321 de la Ley 1955 de 2019, solicitada a la Sociedad mediante \noficio con radicado 2020004616-2-000 del 14 de enero de 2020 y en el artículo tercero \ndel Auto 8371 de 31 de agosto de 2020 para el acogimiento.\nIgualmente, se observa que a la fecha de emisión del presente concepto Técnico la \nSociedad no ha ejecutado ningún valor asociado a la obligación de la inversión forzosa de \nno menos del 1%. \nEs por lo tanto que se considera lo siguiente:\n\nResolución No. 003142       Del 29 DIC. 2023          Hoja No. 18 de 35\n“Por la cual se resuelve recurso de reposición interpuesto en contra de la \nResolución 2136 del 18 de septiembre de 2023”\nPágina 18 de 35\n-\nNo se acepta la solicitud de acogimiento al porcentaje de incremento del valor de la base \nde liquidación de la inversión forzosa de no menos del 1% establecida en el Artículo 321 de \nla Ley 1955 de 2019.\nAcorde con lo anterior, se le requiere a la Sociedad lo siguiente:\n-\nPresentar la actualización de la base de liquidación de la inversión forzosa de no menos \ndel 1% de acuerdo con los términos establecidos en el Parágrafo Primero del Artículo 321 \nde la Ley 1955 de 2019, a saber: \na.\nLos certificados correspondientes a los años 1996 a 2021.\nb.\nEl plan de inversión con la base actualizada aplicando la fórmula del Parágrafo \nPrimero del Artículo 321 de la Ley 1955 del 25 de mayo de 2019.\nc.\nLa proyección financiera para la ejecución del plan de inversión.\nd.\nEl cronograma del plan de inversión del 1% con inicio de ejecución no superior a \nlos seis (6) meses siguientes de la aprobación del plan de inversión actualizado \n(…)”. \n         \n Así las cosas, lo que la Autoridad Nacional, solicitó en cumplimiento al apego \nnormativo, es que simplemente la sociedad PERENCO COLOMBIA LIMITED, \nallegue en su solicitud conforme el requisito legal establecido en el inciso tercero \ndel artículo 321 de la Ley 1955 de 2019, lo siguiente:           \na) El plan de inversión con la base actualizada aplicando el porcentaje \naplicando el porcentaje de incremento definido en la tabla del artículo 321 \nde la Ley 1955 del 25 de mayo de 2019.\nb) La proyección financiera para la ejecución del plan de inversión.\nc) El cronograma del plan de inversión del 1% con inicio de ejecución no \nsuperior a los seis (6) meses siguientes de la aprobación de la solicitud de \nacogimiento.\nSe indica que esta información requerida por Ley, no se  presentó, pese a \npreviamente requerirlo para que la allegara, a fin que poder resolver la situación \njurídica de su solicitud a acogimiento a lo contemplado al artículo 321 de la Ley \n1955 de 2019, por tanto,  lo requerido no es producto de una interpretación, es \nproducto de unos requisitos de Ley que la sociedad no quiso presentar.     \nAsí las cosas, la Resolución 2136 del 18 de septiembre de 2023, se mantiene \nincólume.\nB. Argumentos de la sociedad PERENCO COLOMBIA LIMITED\nDISPOSICIÓN RECURRIDA\n“(…)\n   \nAl carecer de un procedimiento reglado y constituirse la actuación en una \npronunciamiento de carácter discrecional, su contenido debe enmarcarse dentro \n\nResolución No. 003142       Del 29 DIC. 2023          Hoja No. 19 de 35\n“Por la cual se resuelve recurso de reposición interpuesto en contra de la \nResolución 2136 del 18 de septiembre de 2023”\nPágina 19 de 35\nde los preceptos o principios generales del derecho administrativo que regulan la \ninteracción entre el Estado y los particulares y preceptuados en el artículo tercero \nde la ley 1437 de 2011, entre ellos, el principio de eficacia administrativa, en virtud \ndel cual las autoridades administrativas han de remover los obstáculos meramente \nformales para que los procedimientos logren su finalidad y en los cuales no se \npuede desconocer la voluntad del administrado cuando la expresión de la misma \nse la ha solicitado y asignado la propia ley, en otras palabras, puede decirse que \nen este caso se presentó una manifestación de voluntad fruto del libre albedrio, \ncuyo fin es provocar consecuencias de derecho, en otras el cumplimiento de una \nobligación estipulada en un acto administrativo de carácter ambiental. \nAhora bien, el Honorable Consejo de Estado CONSEJERO PONENTE William \nHernández Gómez a través de sentencia con radicado número 11001-03-24-000- \n2008-00390-00(0585-09), en relación con la potestad reglamentaria dispuso que:\n“la función que cumple el Gobierno con el ejercicio del poder reglamentario es la \nde complementar la ley, en la medida en que sea necesario para lograr su \ncumplida aplicación, cuando se requiera por ejemplo, precisar definiciones o \naclarar etapas del procedimiento previsto en aquella, con el propósito de permitir \nsu ejecución, pero ello no conlleva la interpretación de los contenidos legislativos, \ncomo tampoco el modo de encuadrar las distintas situaciones jurídicas en los \nsupuestos que contiene. Para el ejercicio de la atribución en cuestión, el ejecutivo \ndebe limitarse a desarrollar la ley y subordinarse a su contenido, en ese orden, no \nle está dado introducir normas que no se desprendan natural y lógicamente de sus \ndisposiciones, ampliar o restringir el sentido de la ley, como tampoco puede \nsuprimirla o modificarla ni reglamentar materias que estén reservadas a ella, pues \nexcedería sus competencias e invadiría las asignadas por la Constitución al \nlegislador. Igualmente, es importante precisar que no todas las leyes son \nsusceptibles de ser reglamentadas. Para el efecto debe tenerse en cuenta lo \nsiguiente: 1. Existen materias cuya regulación está reservada a la ley, caso en el \ncual, al legislador le corresponde desarrollarla de manera exclusiva. 2. Las leyes \nque deban ser ejecutadas por la administración no pueden ser objeto de \nregulación. 3. Cuando la ley ha sido formulada de manera tan detallada y los \ntemas en ella contenidos han sido desarrollados en forma tan minuciosa, que en \nprincipio, no necesitaría de reglamentación.” \nLo mencionado por el Consejo de Estado, se trae a colación teniendo en cuenta \nque a la fecha el artículo 321 no ha sido reglamentado, toda vez que no ha \nestablecido que para acogerse al porcentaje del incremento del valor base de \nliquidación de la inversión forzosa del 1% este sujeta a un procedimiento o tramite, \npues fue clara al establecer un límite para poder acogerse es decir la \nmanifestación de la voluntad del titular del instrumento ambiental de manera \npositiva, dentro de los seis meses siguientes a la promulgación de la ley 1955 de \n2019 y más nada, por lo que ir más allá, es una actuación sin marco legal que la \nsoporte. \nPor lo anterior, es claro que la potestad reglamentaria es una función que le \ncompete a la rama legislativa y excepcionalmente a la rama ejecutiva, pero que \nestá limitada para este último, es decir que la Autoridad Nacional de licencias \n\nResolución No. 003142       Del 29 DIC. 2023          Hoja No. 20 de 35\n“Por la cual se resuelve recurso de reposición interpuesto en contra de la \nResolución 2136 del 18 de septiembre de 2023”\nPágina 20 de 35\nAmbientales dentro de las funciones que desempeña no es el dable reglamentar \nartículos del ordenamiento jurídico, ni aplicar de forma subjetiva procedimientos \nque la norma no ha contemplado pues violaría el principio de legalidad.\nLEY 1755 DE 2015 - ARTICULO 321 DEL PND – PETICIÓN O ACOGIMIENTO \nComo ya se mencionó y se argumentó anteriormente, la Autoridad Nacional de \nLicencias Ambientales -ANLA, debe dar cumplimiento a lo estipulado en el artículo \n321 del PND y por ende NO está facultado para implementar procedimientos que \nla norma no ha estipulado y mucho menos que de su lectura se evidencie que lo \nhaya solicitado. \nNo obstante, lo anterior, PERENCO LIMITED en relación con la parte motiva del \nacto administrativo aquí recurrido, evidencia que esa Autoridad Ambiental da plena \naplicación al Decreto ley 1755 de 2015 “Por medio de la cual se regula el Derecho \nFundamental de Petición y se sustituye un título del Código de Procedimiento \nAdministrativo y de lo Contencioso Administrativo.” Y que decreta el desistimiento \ntácito con fundamento en la normativa mencionada. Lo que en principio desconoce \nel objeto de la ley 1755 de 2015, pues en observancia de lo que estipula en el \nartículo 321 del PND, no es una petición ni un derecho de petición con la que eleva \nel administrado su intención de acogerse al porcentaje del incremento del valor \nbase de liquidación de la inversión forzosa del 1%, sobre la cual deba espera \nrespuesta de la entidad, ya que tal manifestación no depende de la voluntad de la \nentidad sino precisamente del titular del instrumento ambiental, por disposición del \nya mencionado artículo.\nAhora bien, no se explica esta empresa como la Autoridad Ambiental, si se \nencontraba aplicando un procedimiento de conformidad con lo que contempla la \nley 1755 de 2015 no se respetaron los términos, tal cual como lo señala el artículo \n14 de la norma en mención, que establece que: \n“Artículo 14. Términos para resolver las distintas modalidades de peticiones. Salvo \nnorma legal especial y so pena de sanción disciplinaria, toda petición deberá \nresolverse dentro de los quince (15) días siguientes a su recepción. Estará \nsometida a término especial la resolución de las siguientes peticiones: \n1. Las peticiones de documentos y de información deberán resolverse dentro de \nlos diez (10) días siguientes a su recepción. Si en ese lapso no se ha dado \nrespuesta al peticionario, se entenderá, para todos los efectos legales, que la \nrespectiva solicitud ha sido aceptada y, por consiguiente, la administración ya no \npodrá negar la entrega de dichos documentos al peticionario, y como \nconsecuencia las copias se entregarán dentro de los tres (3) días siguientes. \n2. Las peticiones mediante las cuales se eleva una consulta a las autoridades en \nrelación con las materias a su cargo deberán resolverse dentro de los treinta (30) \ndías siguientes a su recepción.” \nLo anterior teniendo en cuenta que PERENCO LIMITED, presentó la propuesta \ntécnica de la inversión forzosa de no menos del 1% mediante radicado \n\nResolución No. 003142       Del 29 DIC. 2023          Hoja No. 21 de 35\n“Por la cual se resuelve recurso de reposición interpuesto en contra de la \nResolución 2136 del 18 de septiembre de 2023”\nPágina 21 de 35\n2019184507- 1-000 del 25 de noviembre de 2019 por medio de la cual materializa \nsu voluntad de acogimiento a lo estipulado en el artículo 321 del PND, del cual \nobtuvo pronunciamiento que no era de fondo mediante comunicado 2020004616-\n2-000 del 14 de enero de 2020 es decir transcurridos dos meses es decir por fuera \nde los términos dispuesto en la ley que hoy se pretende aplicar a la manifestación \nde la voluntad de la empresa, razón por la cual considera el recurrente que la \nadministración en relación con sus particulares está en la obligación de respetar \ntanto los principios que orientan la administración pública, como los derechos que \nle corresponden al administrado, así como la protección de sus derechos \nfundamentales, y no dar aplicación de la norma de manera parcial, desprotegiendo \ny dejando de lado derechos que han sido elevados por nuestra constitución política \ncon la connotación de fundamentales, así como el sometimiento de la ley para \nproteger y salvaguardar el principio de legalidad. \nAsí mismo, la Autoridad Ambiental fundamenta su decisión de conformidad con lo \nestablecido en el artículo 17 de la ley 1437 de 2011, el cual al tenor de su letra \nexpresa:\nARTÍCULO 17. PETICIONES INCOMPLETAS Y DESISTIMIENTO TÁCITO. En \nvirtud del principio de eficacia, cuando la autoridad constate que una petición ya \nradicada está incompleta o que el peticionario deba realizar una gestión de trámite \na su cargo, necesaria para adoptar una decisión de fondo, y que la actuación \npueda continuar sin oponerse a la ley, requerirá al peticionario dentro de los diez \n(10) días siguientes a la fecha de radicación para que la complete en el término \nmáximo de un (1) mes. \nA partir del día siguiente en que el interesado aporte los documentos o informes \nrequeridos, se reactivará el término para resolver la petición. \nSe entenderá que el peticionario ha desistido de su solicitud o de la actuación \ncuando no satisfaga el requerimiento, salvo que antes de vencer el plazo \nconcedido solicite prórroga hasta por un término igual. \nVencidos los términos establecidos en este artículo, sin que el peticionario haya \ncumplido el requerimiento, la autoridad decretará el desistimiento y el archivo del \nexpediente, \nmediante \nacto \nadministrativo \nmotivado, \nque \nse \nnotificará \npersonalmente, contra el cual únicamente procede recurso de reposición, sin \nperjuicio de que la respectiva solicitud pueda ser nuevamente presentada con el \nlleno de los requisitos legales” (Subrayado y negrita fuera del texto)\nEn ese entendido, la Autoridad Ambiental pretende aplicar las normas que regulan \nel derecho de petición imponiendo que el acogimiento al artículo 321 del PND se \naplique bajo el procedimiento contemplado en la ley 1755 de 2015,(del cual ya se \nexpresaron los argumentos del porque no es procedente) sobre el que, en el \nsupuesto de llegar a ser así, esa entidad desconoce que debió actuar conforme a \nlo que la norma de manera impositiva ha establecido, pues los términos no solo le \natañen al particular, de hecho el objeto de la norma va encaminada a la protección \ndel derecho fundamental del peticionario, por lo que resulta inconcebible que se \npretenda decretar un desistimiento tácito, aun cuando la Autoridad ambiental no \n\nResolución No. 003142       Del 29 DIC. 2023          Hoja No. 22 de 35\n“Por la cual se resuelve recurso de reposición interpuesto en contra de la \nResolución 2136 del 18 de septiembre de 2023”\nPágina 22 de 35\ndio cumplimiento a los 10 días que le ha otorgado la norma para pronunciarse en \ncuanto a las peticiónes incompletas.\nAsi mismo, la norma es clara al establecer que una vez vencidos los términos sin \nque el peticionario haya cumplido el requerimiento, la autoridad decretara el \ndesistimiento tácito, sobre el cual se observa que si la motivación del desistimiento \nse da con ocasión a lo dispuesto en el Auto No. 8371 del 31 de agosto de 2020, \ndesconoce esa autoridad ambiental la inmediatez que le impone la norma para \ndecretar dicha situación pues han transcurridos más de tres años sin que existiera \npronunciamiento de fondo, pero lo que resulta más gravoso es que la norma \nestablece que aun cuando se decrete dicho desistimiento tácito sin perjuicio de \ndicha actuación se podrá volver a presentar la solicitud, condición que no le sería \naplicable a la empresa pues su manifestación voluntaria de acogerse a lo \ndispuesto en el artículo 321 del PND no es suceptible de presentarse nuevamente, \nes decir no se estaría garantizando lo dispuesto en la ley ibídem\nComo complemento de lo anterior, este escenario sin duda no es un derecho de \npetición, para usar su reglamentación como herramienta, con el fin de declarar el \ndesistimiento, pues se trata de una actuación administrativa del particular, en la \nfase complementaria de seguimiento y control, que se realiza posterior al \notorgamiento de una licencia ambiental, en otras es una actuación al interior de un \nprocedimiento reglado, por el Decreto 1076 de 2015. \nNo obstante lo anterior, PERENCO al entender que no se trata de una petición el \nacogimiento al porcentaje de incremento del valor de la base de liquidación de la \ninversión forzosa de no menos del 1% contemplado en el artículo 321 del PND, \nacogimiento que solo va hasta ese momento, pues a partir de ahí no existe \nreglamentación alguna, no llevo a cabo ninguna acción constitucional para la \nprotección de derechos fundamentales, por considerar, no tener la manifestación \nde la voluntad del 321, relación alguna con la ley 1755 de 2015, sobre el \nreglamento del derecho de petición (…)”\nConsideraciones de la ANLA frente a  los anteriores argumentos indicados \npor la sociedad PERENCO COLOMBIA LIMITED:  \nAl respecto es preciso indicar que el inciso 3º del artículo segundo de la Ley \n14347, indica que: \n“(…) Las autoridades sujetarán sus actuaciones a los procedimientos que se \nestablecen en este Código, sin perjuicio de los procedimientos regulados en \nleyes especiales. En lo no previsto en los mismos se aplicarán las \ndisposiciones de este Código (…)”   (Negrilla fuera de texto)\nDe igual manera, es preciso indicar que la Ley 1755 de 2015 que regula el \nDerecho Fundamental de Petición y sustituye el título del Código de Procedimiento \nAdministrativo y de lo Contencioso Administrativo, debe entenderse que como la \nnorma especial, que no regula el procedimiento de solicitudes relacionadas con la \n\nResolución No. 003142       Del 29 DIC. 2023          Hoja No. 23 de 35\n“Por la cual se resuelve recurso de reposición interpuesto en contra de la \nResolución 2136 del 18 de septiembre de 2023”\nPágina 23 de 35\ninversión forzosa de no menos del 1%, sin embargo, se adopta como lo indica el \nprocedimiento de la Ley ibidem. \nArgumentado lo anterior, el inciso 2º del artículo 13 de la Ley 1755 de 2015, \nconsagra que:\n“Toda actuación que inicie cualquier persona ante las autoridades implica el \nejercicio del derecho de petición consagrado en el artículo 23 de la Constitución \nPolítica, sin que sea necesario invocarlo. Mediante él, entre otras actuaciones, se \npodrá solicitar: el reconocimiento de un derecho, la intervención de una entidad o \nfuncionario, la resolución de una situación jurídica, la prestación de un servicio, \nrequerir información, consultar, examinar y requerir copias de documentos, \nformular consultas, quejas, denuncias y reclamos e interponer recursos”. (Negrilla \ny subrayado fuera de texto)\n       \nBajo el citado presento legal no es verídico lo que sustenta la sociedad PERENCO \nCOLOMBIA LIMITED, cuando argumenta: \n“(…) es claro que la potestad reglamentaria es una función que le compete a la \nrama legislativa y excepcionalmente a la rama ejecutiva, pero que está limitada \npara este último, es decir que la Autoridad Nacional de licencias Ambientales \ndentro de las funciones que desempeña no es el dable reglamentar artículos del \nordenamiento jurídico, ni aplicar de forma subjetiva procedimientos que la norma \nno ha contemplado pues violaría el principio de legalidad (…).”,  \nAl respecto, no se comparte la citada postura jurídica,   toda vez que la Resolución \n2136 del 18 de septiembre de 2023, hoy objeto de recurso, está ajustado al marco \nnormativo vigente Nacional y no es cierto que la misma cercene el principio de \nLegalidad. \nLo indicado en el párrafo anterior, tiene asidero jurídico en el artículo 2 de la Ley \n1437 de 2011, cuando esta reza que las normas de la Parte Primera del Código de \nProcedimiento Administrativo y de lo Contencioso Administrativo, se aplican a \ntodos los organismos y entidades que conforman las ramas del poder público \nen sus distintos órdenes, sectores y niveles, a los órganos autónomos e \nindependientes del Estado y a los particulares, cuando cumplan funciones \nadministrativas, en tal sentido la Resolución 2136 de 2023, expedida por esta  \nEntidad Pública de ordena Nacional, sujetó su actuación a los procedimientos que \nestablece la Ley ibídem, por cuanto la Ley Especial 1955 de 2019 artículo 321, no \ncontemplo que sucede cuando un titular no presenta de manera completa su \nsolicitud de acogimiento para que se defina de manera concreta una situación \njurídica de actualización del valor de la inversión de no menos del 1%, de \ncompetencia de la autoridad nacional de licencias ambientales – ANLA y cuando \nsucede ello el inciso final del artículo 2 del citado código administrativo contemplo:\n“(…) Las autoridades sujetarán sus actuaciones a los procedimientos que \nse establecen en este Código, sin perjuicio de los procedimientos regulados \n\nResolución No. 003142       Del 29 DIC. 2023          Hoja No. 24 de 35\n“Por la cual se resuelve recurso de reposición interpuesto en contra de la \nResolución 2136 del 18 de septiembre de 2023”\nPágina 24 de 35\nen leyes especiales. En lo no previsto en los mismos se aplicarán las \ndisposiciones de este Código (…)”\nEn tal razón conforme el principio de legalidad,  el cual indica que   todo ejercicio \nde un poder público debe realizarse acorde a la ley vigente y su jurisdicción y no a \nla voluntad o arbitrio de personas particulares o mandatarios, esta Autoridad \nNacional actuó, pues la norma especial al no contemplar que pasa con las \nsolicitudes incompletas, tal como se explicó en párrafos anteriores,  debe en lo no \nprevisto aplicar las disposiciones de las Ley 1437 de 2011 y en relación a \nsolicitudes incompletas contempló:\nInciso 2º del artículo 13 de la Ley 1755 de 20155, consagra que:\n“Toda actuación que inicie cualquier persona ante las autoridades implica el \nejercicio del derecho de petición consagrado en el artículo 23 de la \nConstitución Política, sin que sea necesario invocarlo. Mediante él, entre \notras actuaciones, se podrá solicitar: el reconocimiento de un derecho, la \nintervención de una entidad o funcionario, la resolución de una situación \njurídica, la prestación de un servicio, requerir información, consultar, examinar y \nrequerir copias de documentos, formular consultas, quejas, denuncias y reclamos \ne interponer recursos”. (Negrilla y subrayado fuera de texto)\n       \nAdicionalmente el artículo 17 de la ley 1755 de 2015, indica que\n“Peticiones incompletas y desistimiento tácito. En virtud del principio de \neficacia, cuando la autoridad constate que una petición ya radicada está \nincompleta o que el peticionario deba realizar una gestión de trámite a su \ncargo, necesaria para adoptar una decisión de fondo, y que la actuación pueda \ncontinuar sin oponerse a la ley, requerirá al peticionario dentro de los diez (10) \ndías siguientes a la fecha de radicación para que la complete en el término \nmáximo de un (1) mes.\nA partir del día siguiente en que el interesado aporte los documentos o informes \nrequeridos, se reactivará el término para resolver la petición.\nSe entenderá que el peticionario ha desistido de su solicitud o de la \nactuación cuando no satisfaga el requerimiento, salvo que antes de vencer el \nplazo concedido solicite prórroga hasta por un término igual.\nVencidos los términos establecidos en este artículo, sin que el peticionario haya \ncumplido el requerimiento, la autoridad decretará el desistimiento y el archivo del \nexpediente, \nmediante \nacto \nadministrativo \nmotivado, \nque \nse \nnotificará \npersonalmente, contra el cual únicamente procede recurso de reposición, sin \n5 “(…) LEY 1755 DE 2015(Junio 30) “Por medio de la cual se regula el Derecho Fundamental de Petición y se sustituye un título del \nCódigo de Procedimiento Administrativo y de lo Contencioso Administrativo”. EL CONGRESO DE COLOMBIA DECRETA: \nARTÍCULO 1°. Sustitúyase el Título II, Derecho de Petición, Capítulo I, Derecho de Petición ante las autoridades-Reglas Generales, \nCapítulo II Derecho de petición ante autoridades-Reglas Especiales y Capítulo III Derecho de Petición ante organizaciones e \ninstituciones privadas, artículos 13 a 33, de la Parte Primera de la Ley 1437 de 2011, por el siguiente (…):\n\nResolución No. 003142       Del 29 DIC. 2023          Hoja No. 25 de 35\n“Por la cual se resuelve recurso de reposición interpuesto en contra de la \nResolución 2136 del 18 de septiembre de 2023”\nPágina 25 de 35\nperjuicio de que la respectiva solicitud pueda ser nuevamente presentada con el \nlleno de los requisitos legales”. (Negrilla y subrayado fuera de texto) \n        \nEn tal razón, la sociedad PERENCO COLOMBIA LIMITED, no le asiste la razón \nen definir que no es aplicable el procedimiento de peticiones incompletas, por las \nrazones antes dadas.\nAhora bien, alude el recurrente que decretar el desistimiento tácito con \nfundamento en la Ley 1755 de 2015, desconoce el objeto de la citada ley, “(…) \npues en observancia de lo que estipula en el artículo 321 del PND, no es una petición ni \nun derecho de petición con la que eleva el administrado su intención de acogerse al \nporcentaje del incremento del valor base de liquidación de la inversión forzosa del 1%, \nsobre la cual deba espera respuesta de la entidad, ya que tal manifestación no depende \nde la voluntad de la entidad sino precisamente del titular del instrumento ambiental, por \ndisposición del ya mencionado artículo (…)” (Negrilla y subrayado fuera de texto)\nAl respecto, no se comparte la postura indicada en el párrafo anterior de la \nsociedad PERENCO COLOMBIA LIMITED, pues no es cierto que una solicitud \ndirigida a la Autoridad Nacional, a fin de acogerse a  la “actualización del valor de \nla inversión de no menos del 1%, de competencia de la AUTORIDAD NACIONAL \nDE LICENCIAS AMBIENTALES – ANLA” contemplada en el artículo 321 de la Ley \n1955 de 2019, la citada compañía no la contemple como una petición, pues al \nrespecto es de recordar que el artículo 136 de la Ley 1755 de 2015 indicó:\n“(…) ARTÍCULO 13. Objeto y modalidades del derecho de petición ante \nautoridades. Toda persona tiene derecho a presentar peticiones respetuosas a \nlas autoridades, en los términos señalados en este código, por motivos de interés \ngeneral o particular, y a obtener pronta resolución completa y de fondo sobre la \nmisma.\nToda actuación que inicie cualquier persona ante las autoridades implica el \nejercicio del derecho de petición consagrado en el artículo 23 de la Constitución \nPolítica, sin que sea necesario invocarlo. Mediante él, entre otras actuaciones, se \npodrá solicitar: el reconocimiento de un derecho, la intervención de una \nentidad o funcionario, la resolución de una situación jurídica, la prestación de \nun servicio, requerir información, consultar, examinar y requerir copias de \ndocumentos, formular consultas, quejas, denuncias y reclamos e interponer \nrecursos.\nEl ejercicio del derecho de petición es gratuito y puede realizarse sin necesidad de \nrepresentación a través de abogado, o de persona mayor cuando se trate de \nmenores en relación a las entidades dedicadas a su protección o formación (…)” \n(Negrilla y subrayado fuera de texto)\n    \n6 ARTÍCULO 1°. Sustitúyase el Título II, Derecho de Petición, Capítulo I, Derecho de Petición ante las autoridades-Reglas Generales, \nCapítulo II Derecho de petición ante autoridades-Reglas Especiales y Capítulo III Derecho de Petición ante organizaciones e \ninstituciones privadas, artículos 13 a 33, de la Parte Primera de la Ley 1437 de 2011\n\nResolución No. 003142       Del 29 DIC. 2023          Hoja No. 26 de 35\n“Por la cual se resuelve recurso de reposición interpuesto en contra de la \nResolución 2136 del 18 de septiembre de 2023”\nPágina 26 de 35\nEn este sentido y por disposición normativa, toda actuación que se radique ante \ncualquier Autoridad pública, es un derecho de petición conforme el artículo 137 de \nla Ley 1755 de 2015 y en tal razón la solicitud dirigida a esta Autoridad Nacional \nbajo radicado ANLA 2019184507-1-000 del 25 de noviembre de 2019, donde la \nsociedad PERENCO COLOMBIA LIMITED, solicita voluntariamente acogerse a lo \ndispuesto en el artículo 321 de la Ley 1955 de 2019, es una petición y como tal \ndebe resolverse.\nAhora bien, es de recordar que para resolver la situación jurídica solicitada por la \nsociedad PERENCO COLOMBIA LIMITED, tendiente a la “actualización del valor \nde la inversión de no menos del 1%, de competencia de la AUTORIDAD \nNACIONAL DE LICENCIAS AMBIENTALES – ANLA” la misma es una actividad \nreglada, es decir la Ley,  ha señalado a la Administración en forma expresa los \nrequisitos que debe contener la solicitud para conceder o no el acogimiento8, si el \npeticionario no presenta la solicitud con los requisitos de Ley, porque  la autoridad \nconstató que la petición ya radicada está incompleta el peticionario deberá realizar \nuna gestión de trámite a su cargo, pero si el interesado no aportó los documentos \no informes requeridos, entenderá que el peticionario ha desistido de su solicitud. \nAhora bien, es de indicar que no debemos confundir que es una manifestación de \nla voluntad, la cual  se realiza en forma oral o escrita, a través de cualquier medio \ndirecto, manual, mecánico, electrónico u otro análogo, que nadie impide ello, con \nla de conceder un derecho y resolver una situación jurídica, la cual implica verificar \nque esa manifestación de la voluntad, cumpla con unos requisitos reglados que \nSine qua non no es procedente conceder el Derecho.\nAunado lo anterior, es de indicar que las normas ambientales como es el caso del \nartículo 321  de la Ley 1955 de 2019, para quien desea acogerse son de utilidad \npública e interés social, por tanto  no podrán ser objeto de transacción o de \nrenuncia a su aplicación por las autoridades o por los particulares, en tal razón los \nrequisitos contemplados en el inciso tercero de la citada norma son de obligatorio \ncumplimiento, el no adjuntarlos genera que no se conceda el acogimiento.                            \n7 ARTÍCULO 1°. Sustitúyase el Título II, Derecho de Petición, Capítulo I, Derecho de Petición ante las autoridades-Reglas Generales, \nCapítulo II Derecho de petición ante autoridades-Reglas Especiales y Capítulo III Derecho de Petición ante organizaciones e \ninstituciones privadas, artículos 13 a 33, de la Parte Primera de la Ley 1437 de 2011\n8 Ley 1755 de 2015 “ARTÍCULO 321. ACTUALIZACIÓN DEL VALOR DE LA INVERSIÓN DE NO MENOS DEL 1%, DE \nCOMPETENCIA DE LA AUTORIDAD NACIONAL DE LICENCIAS AMBIENTALES - ANLA. Todos aquellos titulares de una \nlicencia ambiental que tengan inversiones pendientes a la fecha de promulgación de la presente Ley, relativas a la inversión forzosa de \nno menos del 1% de que trata el parágrafo del artículo 43 de la Ley 99 de 1993, podrán acogerse al porcentaje de incremento del valor \nde la base de liquidación de la inversión forzosa de no menos del 1%, según el año de inicio de actividades autorizadas en la licencia \nambiental (…)\nLas inversiones ejecutadas o que estén en proceso de ejecución en el marco de un plan de inversión del 1% aprobado por \nla Autoridad Nacional de Licencias Ambientales - ANLA, no serán tenidas en cuenta para efectos del cálculo de la \nactualización del valor de la base de liquidación de la inversión del 1%.\nPara acogerse deberán presentar la solicitud dentro de los seis (6) meses siguientes a la promulgación de la presente Ley, \njunto con: a) el certificado que soporta el cálculo de la base de liquidación, b) el plan de inversión con la base actualizada \naplicando el porcentaje de incremento definido en la tabla anterior, c) la proyección financiera para la ejecución del plan de \ninversión y d) el cronograma del plan de inversión del 1% con inicio de ejecución no superior a los seis (6) meses siguientes \nde la aprobación de la solicitud de acogimiento (…)”.\n\nResolución No. 003142       Del 29 DIC. 2023          Hoja No. 27 de 35\n“Por la cual se resuelve recurso de reposición interpuesto en contra de la \nResolución 2136 del 18 de septiembre de 2023”\nPágina 27 de 35\nPor otro lado la sociedad PERENCO COLOMBIA LIMITED, manifiesta que si \nutilizamos el procedimiento de la Ley 1755 de 2015, estamos cercenando el \nprocedimiento de la citada norma, pues los tiempos procesales no los cumplió la \nautoridad, lo que genera violación al debido proceso.\nAl respecto, dicha conclusión no está ajustada a la verdad procesal, pues es de \nindicar que esta Autoridad realizó todas las actuaciones administrativas tendientes \na la procura de la efectividad del derecho material objeto de la actuación \nadministrativa, que es determinar si se acepta o no el acogimiento, prueba del \nhecho factico es lo evaluado en el concepto técnico 57832 del 23 de septiembre \nde 2022, el cual indicó:\n“(…) Información general del plan de inversión forzosa de no menos del 1%. \n“A continuación, la información general y antecedentes del estado de la \nobligación:\nMediante Resolución 121 del 7 de febrero de 1996, se otorgó Licencia Ambiental \nOrdinaria para los proyectos de desarrollo Gloria Norte 5, Gloria Norte 6, La \nGloria 7 y la Gloria 8.\nMediante el Artículo Sexto de la Resolución 891 de 8 de octubre de 1997 se \nestableció la obligación de la inversión forzosa de no menos del 1% de acuerdo \ncon lo siguiente:\n“ARTÍCULO SEXTO. El beneficiario de la licencia ambiental deberá \ndestinar no menos del 1% del costo total del proyecto, para la recuperación, \npreservación y vigilancia de la cuenca hidrográfica del río Charte”.\nMediante el Artículo Décimo Séptimo de la Resolución 1301 del 21 de julio de \n2008 se otorgó licencia ambiental global, aprobando transitoriamente el programa \nde inversión del 1%, así: \n“ARTÍCULO DÉCIMO SÉPTIMO. Aprobar transitoriamente el programa de \ninversión del 1% presentado por la empresa PERENCO COLOMBIA \nLIMITED para el Pozo La Gloria 17 (LGL-17) consistente en la restauración, \nconservación y protección de la cobertura vegetal, enriquecimientos \nvegetales y aislamiento de áreas para facilitar la sucesión natural en el Río \nCharte, Caños Corozos, Arrecifes, El Tigre y/o Mojaculos”.\nMediante Artículo Décimo del Auto 4734 del 23 de octubre de 2014, la Autoridad \nNacional de Licencias Ambientales, aceptó el desistimiento de la empresa \nPERENCO COLOMBIALIMITED., de invertir el monto del 1% del Bloque \nCasanare A1a (La Gloria) en la propuesta del convenio con el IDEAM, \ndenominada “Fortalecimiento Monitoreo Hidrometeorológico cuencas principales \nzonas de operación PERENCO”, presentada por la Sociedad mediante radicado  \n\nResolución No. 003142       Del 29 DIC. 2023          Hoja No. 28 de 35\n“Por la cual se resuelve recurso de reposición interpuesto en contra de la \nResolución 2136 del 18 de septiembre de 2023”\nPágina 28 de 35\n4120-E1-50483 del 19 de noviembre de 2013 y posteriormente de la cual solicitó \ndesistimiento mediante radicado No. 4120-E1-40899 del 06 de agosto de 2014.\nMediante radicado 2016000865-1-000 del 7 de enero de 2016 la Sociedad \nPERENCO COLOMBIA LIMITED solicitó a la Autoridad Nacional de Licencias \nAmbientales, invertir como parte de la inversión forzosa de no menos del 1% en \n“la compra de predios en la ronda del nacedero del Caño Palo Blanco”, sin \nembargo, la Sociedad no presentó una propuesta de inversión clara, asociada o \nun plan de inversión, más allá del oficio el cual no detallo ningún aspecto técnico \no financiero al respecto. Por lo anterior, es de aclarar que lo relacionado con “la \ncompra de predios en la ronda del nacedero del Caño Palo Blanco” es un \nproyecto que no se  encuentra aprobado o vigente para la obligación de la \ninversión forzosa de no menos del 1% del expediente LAM0715.\nMediante radicado 2017066632-1-000 del 22 de agosto de 2017, la Sociedad \nPERENCO COLOMBIA LIMITED solicitó el acogimiento al Decreto 2099 de 2016 \npara la línea “Acciones de vigilancia del recurso hídrico a través de la \ninstrumentación y monitoreo de variables climatológicas e hidrológicas con \nestaciones hidrometereológicas y/o con radares, según la tecnología que defina \nel IDEAM”.\nPosteriormente mediante radicado 2017122802-1-000 del 28 de diciembre de \n2017, presentó a esta autoridad el oficio de desistimiento de la solicitud de \nacogimiento a lo establecido en el Decreto 2099 del 22 de diciembre de 2016, por \nlo que la Autoridad Nacional de Licencias Ambientales no evaluó la pertinencia \nde dicha línea de destinación, por ende, este proyecto no se encuentra aprobado \no vigente para la obligación de la inversión forzosa de no menos del 1% del \nexpediente LAM0715.  \nMás adelante, mediante radicado 2018170884-1-000 del 6 de diciembre de 2018, \nla Sociedad PERENCO COLOMBIA LIMITED solicitó concepto técnico para la \naprobación de la inversión de no menos del 1% del bloque Casanare A1a. \nSeguidamente, mediante radicado 2019166291-1-000, del 24 de octubre de \n2019, reiteró la solicitud realizada mediante comunicado 2018170884-1-000 del 6 \nde diciembre de 2018 con relación a la aprobación de las actividades de no \nmenos del 1%. Es de resaltar que, en estas comunicaciones, la Sociedad hace \nun recuento de actividades de socialización y concertación del plan de inversión \ncon las comunidades y autoridades del área; sin embargo, no presentó una \npropuesta de inversión clara, soportada técnica y financieramente.\n \nAl respecto de las dos comunicaciones mencionadas en el párrafo anterior, es de \nresaltar que mediante oficio con radicado 2021115744-2-000 del 9 de junio de \n2021, la Autoridad Nacional de Licencias Ambientales emitió respuesta a la \n\nResolución No. 003142       Del 29 DIC. 2023          Hoja No. 29 de 35\n“Por la cual se resuelve recurso de reposición interpuesto en contra de la \nResolución 2136 del 18 de septiembre de 2023”\nPágina 29 de 35\nSociedad, donde le informó que deberá presentar la nueva propuesta de \nactividades a ejecutar como parte de la inversión forzosa de no menos del 1%, \nreemplazando la propuesta de fortalecimiento del monitoreo hidrometereológico \nen las cuencas, en cumplimiento del parágrafo primero del artículo décimo octavo \nde la Resolución 1301 del 21 de julio de 2008: del numeral 1 del artículo segundo \ndel Auto 1138 del 18 de abril de 2011: de los artículos tercero, cuarto, quinto, \nsexto, séptimo, octavo, noveno, décimo primero y décimo segundo del Auto 4734 \ndel 23 de octubre de 2014: y del artículo octavo del Auto 2918 del 27 de julio de \n2015. \nPor medio del radicado 2019184507-1-000 del 25 de noviembre de 2019, la \nSociedad PERENCO COLOMBIA LIMITED entregó la actualización del valor de \nla inversión de no menos del 1% y solicitó acogimiento al porcentaje de \nincremento del valor de la base de liquidación de la inversión forzosa de no \nmenos del 1% del artículo 321 de la Ley 1955 del 25 de mayo de 2019.\nEn respuesta al radicado 2019184507-1-000 del 25 de noviembre de 2019, la \nAutoridad Nacional de Licencias Ambientales remitió oficio 2020004616-2-000 del \n14 de enero de 2020, en donde le informó a PERENCO COLOMBIA LIMITED, \nque:\n“(…) la solicitud de acogimiento al artículo 321 Ley 1955 de 2019 no cumple con \nlos siguientes requisitos previstos en el artículo 321 de la Ley 1955 del 25 de \nmayo de 2019, a saber:\na) El plan de inversión con la base actualizada aplicando el porcentaje aplicando \nel porcentaje de incremento definido en la tabla del artículo 321 de la Ley 1955 \ndel 25 de mayo de 2019.\nb) La proyección financiera para la ejecución del plan de inversión.\nc) El cronograma del plan de inversión del 1% con inicio de ejecución no superior \na los seis (6) meses siguientes de la aprobación de la solicitud de acogimiento.\nPor lo anteriormente expuesto y de acuerdo con lo dispuesto en el Artículo 17 del \nCódigo de Procedimiento Administrativo y lo Contencioso Administrativo, la \nSociedad PERENCO COLOMBIA LIMITED, deberá presentar la información \nrequerida, dentro del mes siguiente al recibo del presente oficio, de no cumplir el \nrequerimiento dentro del término otorgado, se entenderá que ha desistido de su \nsolicitud, salvo que antes de vencerse solicite prórroga hasta por un término \nigual.”\nPosteriormente mediante radicado 2020026415-1-000 del 20 de febrero de 2020 \nPERENCO COLOMBIA LIMITED solicitó prórroga para entregar la información \nsolicitada mediante oficio 2020004616-2-000 del 14 de enero de 2020, en el \nmarco de la solicitud de acogimiento al porcentaje incremental contemplado en \nartículo 321 del Plan Nacional de Desarrollo - PND (Ley 1955 del 25 de mayo del \n2019).\n\nResolución No. 003142       Del 29 DIC. 2023          Hoja No. 30 de 35\n“Por la cual se resuelve recurso de reposición interpuesto en contra de la \nResolución 2136 del 18 de septiembre de 2023”\nPágina 30 de 35\nMediante oficio 2020056051-2-000 del 13 de abril de 2020, la Autoridad Nacional \nde Licencias Ambientales dio respuesta al radicado 2020026415-1-000 del 20 de \nfebrero de 2020 sobre solicitud de prórroga, donde se negó la misma, debido a \nque la solicitud fue radicada de manera extemporánea.\nMediante el artículo primero del Auto 4900 del 29 de mayo de 2020, se decretó el \ndesistimiento tácito de la solicitud de acogimiento al porcentaje de incremento del \nvalor de la base de liquidación de la inversión forzosa de no menos del 1%, \nprevisto en el artículo 321 Ley 1955 del 25 de mayo de 2019, presentada por la \nSociedad mediante comunicación con radicación 2019184507-1-000 del 25 de \nnoviembre de 2019.\nMediante radicado 2020094717-1-000 del 16 de junio de 2020, la Sociedad \npresentó recurso de reposición contra el Auto 04900 del 29 de mayo de 2020.\nMediante el artículo primero del Auto 8371 de 31 de agosto de 2020, se repuso el \nAuto 4900 del 29 de mayo de 2020 y en su artículo segundo ordenó el desarchivo \nde la solicitud de acogimiento al porcentaje de incremento del valor de la base de \nliquidación de la inversión forzosa de no menos del 1%, previsto en el artículo \n321 Ley 1955 del 25 de mayo de 2019.\nIgualmente, en el artículo tercero del mencionado Auto 8371 de 31 de agosto de \n2020 se le requirió a la Sociedad información:\n“ARTÍCULO TERCERO. Requerir a la Sociedad PERENCO COLOMBIA \nLIMITED para que en el término de un (1) mes, contado a partir del día siguiente \na la ejecutoria del presente acto, allegue la información y los soportes \ncorrespondientes de la misma, de conformidad con los requerimientos efectuados \na través del oficio con radicación 2020004616-2-000 del 14 de enero de 2020., \nemitido por la Autoridad Nacional de Licencias Ambientales”.\nMediante radicado 2021058780-1-000 del 31 de marzo de 2021 la Sociedad \npresentó comunicación con asunto: “actualización valor base de la inversión 1%, \nartículo 321 de la Ley 1955 de 2019”, donde relacionó el cálculo del valor base de \nliquidación actualizado a 2020. Se observa que en esta información no presentó \npropuesta de inversión o plan de inversión forzosa de no menos del 1% donde \nespecifique los proyectos en que destinaría el monto por ejecutar, cronograma y \nproyección financiera.\nMediante radicado 2021094482-1-000 del 13 de mayo de 2021 la Sociedad \nrealizó solicitud de pronunciamiento a los radicados 2018170884-1-000 y \n2019166291-1-000, relacionada con la aprobación del proyecto de inversión \nforzosa de no menos del 1% para el Bloque Casanare A1a (también llamado La \nGloria), asociado al Expediente LAM0715.\nMediante oficio 2021115744-2-000 del 9 de junio de 2021, la Autoridad Nacional \nde Licencias, emitió respuesta al radicado 2021094482-1-000 del 13 de mayo de \n2021, con el siguiente asunto: “Respuesta al oficio con radicación en la ANLA, \n2021094482-1-000 del 21 de mayo del 2021, en relación con el pronunciamiento \n\nResolución No. 003142       Del 29 DIC. 2023          Hoja No. 31 de 35\n“Por la cual se resuelve recurso de reposición interpuesto en contra de la \nResolución 2136 del 18 de septiembre de 2023”\nPágina 31 de 35\nde los radicados 2018170884-1-000 y 2019166291-1-000, relacionados con la \naprobación del proyecto de inversión del 1%. Bloque Casanare A1a. Expediente: \nLAM0715”, en el cual como conclusión manifiesta lo siguiente:\n“Esta Autoridad se permite manifestar lo siguiente; la Sociedad, deberá presentar \nla nueva propuesta de actividades a ejecutar como parte de la inversión del 1%, \nreemplazando la propuesta de fortalecimiento del monitoreo hidrometereológico \nen las cuencas, en cumplimiento del parágrafo primero del artículo décimo octavo \nde la Resolución 1301 del 21 de julio de 2008, numeral 1 del artículo segundo del \nAuto 1138 del 18 de abril de 2011, artículos tercero, cuarto, quinto, sexto, \nséptimo, octavo, noveno, décimo primero, décimo segundo del Auto 4734 del 23 \nde octubre de 2014, artículo octavo del Auto 2918 del 27 de julio de 2015, dicha \npropuesta deberá realizarse en la cuenca del Río Charte, Caños Corozos, \nArrecifes, El Tigre y/o Mojaculos, toda vez que la Sociedad mediante \ncomunicación 2017122802-1-000 del 28 de diciembre de 2017, presenta a esta \nautoridad el oficio de desistimiento de la solicitud de acogimiento a lo establecido \nen el Decreto 2099 del 22 de diciembre de 2016, por lo tanto, la norma aplicable \npara la inversión de no menos del 1% es el Decreto 1900 de 2006, por lo tanto, el \námbito geográfico será la cuenca del Río Charte, como se mencionó \nanteriormente.\nAdemás, presentar los criterios de selección de las áreas a restaurar o reforestar, \nlas especies y cantidad a sembrar, en cuanto al programa consistente en la \nrestauración conservación y protección de la cobertura vegetal, enriquecimientos \nvegetales y aislamiento de áreas para facilitar la sucesión natural en el Río \nCharte, Caños Corozos, Arrecifes, El Tigre y/o Mojaculos, y demás información \nsolicitada en el artículo décimo octavo y sus parágrafos primero y segundo de la \nResolución 1301 del 21 de julio de 2008”.\nAl revisar la información que reposa en el expediente, la Sociedad no presentó la \ninformación requerida en el Artículo 321 de la Ley 1955 de 2019 para el \nacogimiento al porcentaje de incremento del valor de la base de liquidación de la \ninversión forzosa de no menos del 1%. Por lo anterior, (…) se realizó la \nevaluación de la solicitud con base en el radicado 2019184507-1-000 del 25 de \nnoviembre de 2019 y la información que reposa en el expediente LAM0715 (…)”\nEn tal razón, desde el ámbito fáctico, denótese todo el esfuerzo que ha realizado \nla Autoridad Nacional para que la sociedad allegue los requisitos faltantes y que la \nempresa  PERENCO COLOMBIA LIMITED, se ha rehusado adjuntar, \ndesconociendo las razones del mismo, ahora bien desde lo jurídico, es de indicar \nque lo procesal no puede prevalecer sobre lo sustancial conforme lo señala el \nartículo 228 de la Norma Superior.\nSe indica lo anterior, porque la sociedad  PERENCO COLOMBIA LIMITED, no \npuede excusar  su inoperancia en la entrega de los documentos que respaldan la \nsolicitud de acogimiento al artículo 321 de la Ley 1955 de 2019, en el no \ncumplimiento a los términos procesales que trae la Ley 1755 de 2015, en materia \ndel procedimiento del derecho de petición.\n\nResolución No. 003142       Del 29 DIC. 2023          Hoja No. 32 de 35\n“Por la cual se resuelve recurso de reposición interpuesto en contra de la \nResolución 2136 del 18 de septiembre de 2023”\nPágina 32 de 35\nEs de anotar que el principio de eficacia, consagrado en el numeral 11 del artículo \nde la Ley 1437 de 2011, indica que  las autoridades buscarán que los \nprocedimientos logren su finalidad y, para el efecto, removerán de oficio los \nobstáculos puramente formales, evitarán decisiones inhibitorias, dilaciones o \nretardos y sanearán, de acuerdo con este Código las irregularidades \nprocedimentales que se presenten, en procura de la efectividad del derecho \nmaterial objeto de la actuación administrativa.\nAsí las cosas, para lograr la efectividad del derecho material objeto de la \nactuación administrativa,  la Autoridad Nacional,  a través  del Auto  08371 del  \n31 de agosto de 2020, el cual quedó ejecutoriado y en firme el día 7 de septiembre  \nde 2020, subsano todos los yerros procesales que se desprendieron de la solicitud \nadministrativa de acogimiento al artículo 321 de la Ley 1955 de 2019, radicada por \nla sociedad  recurrente a través de la comunicación con radicado ANLA         \n2020004616-2-000 del 14 de enero de 2020, y en dicho Acto Administrativo entre \notras disposiciones jurídicas, claramente estableció en su artículo tercero:\n“(…) ARTÍCULO TERCERO. Requerir a la Sociedad PERENCO COLOMBIA \nLIMITED para que en el término de un (1) mes, contado a partir del día siguiente a \nla ejecutoria del presente acto, allegue la información y los soportes \ncorrespondientes de la misma, de conformidad con los requerimientos efectuados \na través del oficio con radicación 2020004616-2-000 del 14 de enero de 2020., \nemitido por la Autoridad Nacional de Licencias Ambientales (…)”    \nEn este caso, la Autoridad Nacional, por medio de oficio con radicado ANLA No. \n2020004614-2-000 del 14 de enero de 2020, requirió a la Sociedad PERENCO \nCOLOMBIA LIMITED, para que en un tiempo de un mes presentara el ajuste de la \npropuesta presentada por medio del radicado 2019184507-1-000 del 25 de \nnoviembre de 2019, con el fin de resolver de fondo la solicitud de acogimiento al \nporcentaje incremental contenido en el Artículo 321 de la Ley 1955 del 25 de mayo \nde 2019. \nEn teste orden de ideas, en lo reportado se evidenció que la Sociedad no presentó \nla información requerida en el artículo 321 de la Ley 1955 de 2019, solicitada \nmediante oficio con radicado 2020004616-2-000 del 14 de enero de 2020 y en el \nartículo tercero del Auto 8371 de 31 de agosto de 2020, para el acogimiento. \nAsí las cosas y teniendo en cuenta el caso concreto, esta Autoridad Nacional \ndeclaró el desistimiento tácito de la solicitud con radicado No. 2019184507-1-000 \ndel 25 de noviembre de 2019, en tanto el plazo otorgado a la sociedad fue de un \nmes y ha pasado más de un año y no se ha presentado la información, \ntiempo totalmente justo y adecuado y que la sociedad no presentó la información \nlegal requerida.\n\nResolución No. 003142       Del 29 DIC. 2023          Hoja No. 33 de 35\n“Por la cual se resuelve recurso de reposición interpuesto en contra de la \nResolución 2136 del 18 de septiembre de 2023”\nPágina 33 de 35\nAhora bien en respeto al debido proceso y derecho de contracción,  el artículo  87 \nde la Ley 1437 reza:\n“(…) Artículo 87. Firmeza de los actos administrativos. Los actos \nadministrativos quedarán en firme: \n1. Cuando contra ellos no proceda ningún recurso, desde el día siguiente al de su \nnotificación, comunicación o publicación según el caso. \n2. Desde el día siguiente a la publicación, comunicación o notificación de la \ndecisión sobre los recursos interpuestos. \n3. Desde el día siguiente al del vencimiento del término para interponer los \nrecursos, si estos no fueron interpuestos, o se hubiere renunciado expresamente a \nellos. \n4. Desde el día siguiente al de la notificación de la aceptación del desistimiento de \nlos recursos. \n5. Desde el día siguiente al de la protocolización a que alude el artículo 85 para el \nsilencio administrativo positivo (…)” (Negrilla y subrayado fuera de texto)\n  \nDenótese que la firmeza del Acto Administrativo, entre otros aspectos jurídicos, \nestá supeditada desde el día siguiente a la publicación, comunicación o \nnotificación de la decisión sobre los recursos interpuestos, acción garantista al \nderecho de defensa, contradicción y debido proceso, acciones propias de un \nEstado social de derecho como el colombiano.\nSe indica lo anterior, porque esta Autoridad, a la Luz de hacer efectivo el derecho \nmaterial objeto de esta  actuación administrativa, esperaba que la sociedad  \nPERENCO COLOMBIA LIMITED, presentara la documentación faltante, en el \npresente recurso, para que la misma fuera evaluada, acción que no ocurrió y por \nel contrario en su legítimo derecho de defensa argumento aspectos que no se \najustan a la realidad jurídica del caso, como se ha explicado en párrafos \nanteriores, en tal sentido se confirma la decisión indicada en la Resolución 2136 \ndel  18  de septiembre de  2023.    \nCONSIDERACIONES FINALES \nAhora bien, es importante señalar que las decisiones adoptadas en esta instancia \nprocesal,  se suscribieron  de conformidad a la normatividad vigente, resaltando \nque es preciso mantener incólume la Resolución 2136 del 18 de septiembre de \n2023,   pues es claro que dentro de los principios de la administración está el \ncontrol gubernativo, el cual permite que la administración revise sus propios actos, \nlos confirme,  modifique, aclare o revoque, de acuerdo con la pertinencia y \nconducencia de los argumentos y pruebas presentados por el interesado en la \ndecisión. Para el caso de la autoridad ambiental, sus decisiones deben estar \nenmarcadas dentro de los principios generales del derecho y valores \nconstitucionales de la protección de los recursos naturales renovables, y la \nobligación de garantizar el derecho a un medio ambiente sano. \n\nResolución No. 003142       Del 29 DIC. 2023          Hoja No. 34 de 35\n“Por la cual se resuelve recurso de reposición interpuesto en contra de la \nResolución 2136 del 18 de septiembre de 2023”\nPágina 34 de 35\nDe otro lado es importante manifestar que estando en el trámite de una actuación \nadministrativa de acogimiento o no al artículo 321 de la Ley 1955 de 2019,  es \nindiscutible que la administración revise su actuación con motivo de un recurso de \nreposición, por lo que para el presente caso se dispondrá mantener incólume las \ndisposiciones de la Resolución 2136 del 18 de septiembre de 2023, conforme a lo \nmotivado en el presente acto administrativo.  \nEn mérito de lo anterior,\nRESUELVE:\nARTÍCULO PRIMERO. No reponer y en consecuencia confirmar la Resolución \n2136 del 18 de septiembre de 2023, de conformidad con lo expuesto en la parte \nmotiva del presente acto administrativo. \nARTÍCULO SEGUNDO. Por la Autoridad Nacional de Licencias Ambientales – \nANLA, notificar el contenido del presente acto administrativo al Representante \nLegal o Apoderado debidamente constituido de la sociedad PERENCO \nCOLOMBIA LIMITED, o a quien haga sus veces por medios electrónicos, de \nconformidad con lo dispuesto en los artículos 67, 68 y subsiguientes de la Ley \n1437 de 2011. \nPARÁGRAFO PRIMERO. En el suceso en que el titular de la licencia o el \npermiso, entre en proceso de disolución o régimen de insolvencia empresarial o \nliquidación regulados por las normas vigentes, informará inmediatamente de esta \nsituación a esta Autoridad, con fundamento, entre otros, en los artículos 8, 58, 79, \n80, 81, 95 numeral 8 de la Constitución Política de 1991, en la Ley 43 de 1990, en \nla Ley 222 de 1995, en la Ley 1333 de 2009 y demás normas vigentes al y \njurisprudencia aplicable. \nARTÍCULO TERCERO. Por la Autoridad Nacional de Licencias Ambientales- \nANLA, comunicar el contenido del presente acto administrativo a la Corporación \nAutónoma Regional de la Orinoquía – CORPORINOQUIA, para su conocimiento y \nfines pertinentes.   \nARTÍCULO CUARTO. Publicar la presente Resolución en la Gaceta Ambiental de \nla Autoridad Nacional de Licencias Ambientales - ANLA y la copia de la \npublicación deberá remitirse al expediente LAM0715.  \nARTÍCULO QUINTO. Contra el presente acto administrativo no procede recurso \nalguno de conformidad con lo establecido en el artículo 87 del Código de \nProcedimiento Administrativo y de lo Contencioso Administrativo.\nNOTIFÍQUESE, COMUNÍQUESE, PUBLÍQUESE Y CÚMPLASE\n\nResolución No. 003142       Del 29 DIC. 2023          Hoja No. 35 de 35\n“Por la cual se resuelve recurso de reposición interpuesto en contra de la \nResolución 2136 del 18 de septiembre de 2023”\nPágina 35 de 35\nDado en Bogotá D.C., a los 29 DIC. 2023\nEDILBERTO PENARANDA CORREA\nASESOR\nMARIA ALEJANDRA SANTOYO ORTIZ\nCONTRATISTA\nMARCELO ROJAS BALLESTEROS\nCONTRATISTA\nExpediente No. LAM0715\nFecha: 26  de diciembre de 2023\nProceso No.: 20231000031424\nNota: Este es un documento electrónico generado desde los Sistemas de Información de la ANLA. El original reposa en los \narchivos digitales de la Entidad\n"
}