{
  "fuente": "ANLA_GACETA",
  "numero_resolución": "RESOLUCIÓN N° 00588",
  "fecha_resolución": "2023-03-23",
  "nombre_proyecto": "proyecto denominado “Campo de Producción Medina”",
  "ubicación": "departamento de Boyacá, en el municipio de Sabanalarga en el departamento de Casanare; en el municipio de Paratebueno en el departamento de Cundinamarca y en el municipio de Barranca de Upía, en el departamento del Meta.",
  "empresa": "el Ministerio de Ambiente, Vivienda y Desarrollo Territorial- MAVD, en adelante el Ministerio, otorgó Licencia Ambiental Global a la sociedad LUKOIL OVERSEAS COLOMBIA LTD",
  "numero_expediente": "ANLA",
  "radicados": [
    "2022292697",
    "2022148264",
    "2022044932"
  ],
  "descripcion": "Por la cual se resuelve un recurso de reposición interpuesto contra la Resolución 2969 de 14 de diciembre de 2022",
  "tipos_infraccion": [
    "Residuos sólidos",
    "Manejo de aguas",
    "Incumplimiento del PMA"
  ],
  "pdf_id": "42047",
  "file_name": "ANLA_42047.pdf",
  "texto_completo": "|\nRepública de Colombia\nMinisterio de Ambiente y Desarrollo Sostenible\nAUTORIDAD NACIONAL DE LICENCIAS AMBIENTALES \n- ANLA –\nRESOLUCIÓN N°  00588\n( 23 de marzo de 2023 )\nOficinas: Carrera 13 A No. 34 – 72 Edificio 13 35 Pisos 8 Bogotá, D.C.\nCentro de Orientación y Radicación de Correspondencia: Carrera 13 A No. 34 – 72 Edificio 13 35 \nLocales 110 al 112 Bogotá, D.C.  \nCódigo Postal 110311156\nNit.: 900.467.239-2\nLínea de Orientación y Contacto Ciudadano: 57 (1) 2540100 / 018000112998 PBX: 57 (1) 2540111\nwww.anla.gov.co    Email: licencias@anla.gov.co  \nPágina 1 de 23\n“Por la cual se resuelve un recurso de reposición interpuesto contra la Resolución 2969 de 14 \nde diciembre de 2022”\nEL DIRECTOR GENERAL DE LA AUTORIDAD NACIONAL DE LICENCIAS AMBIENTALES – \nANLA\nEn uso de sus facultades legales establecidas en la Ley 99 de 1993 y las funciones asignadas en el \nDecreto 1076 del 26 de mayo de 2015, Decreto-ley 3573 del 27 de septiembre de 2011, Decreto 376 \ndel 11 de marzo de 2020, la Resolución 1957 del 5 de noviembre de 2021 de la ANLA y Resolución \n1223 del 19 de septiembre de 2022 del Ministerio de Ambiente y Desarrollo Sostenible, y\nCONSIDERANDO:\nQue a través de la Resolución 999 de 29 de mayo de 2009, el Ministerio de Ambiente, Vivienda y \nDesarrollo Territorial- MAVD, en adelante el Ministerio, otorgó Licencia Ambiental Global a la sociedad \nLUKOIL OVERSEAS COLOMBIA LTD, para el proyecto denominado “Campo de Producción Medina” \nlocalizado en el municipio de San Luis de Gaceno, departamento de Boyacá, en el municipio de \nSabanalarga en el departamento de Casanare; en el municipio de Paratebueno en el departamento \nde Cundinamarca y en el municipio de Barranca de Upía, en el departamento del Meta. \nQue bajo la Resolución 1417 de 24 de julio de 2009, el Ministerio resolvió un recurso de reposición \ninterpuesto contra la Resolución 999 del 29 de mayo de 2009, modificando el contenido del artículo \nquinto, en el sentido de autorizar la ocupación de cauces, para la construcción de nuevas vías de \nacceso, adecuación de las existentes y construcción de líneas de flujo. \nQue de acuerdo con la Resolución 2687 de 23 de diciembre de 2010, el Ministerio modificó el artículo \nprimero de la Resolución 999 del 29 de mayo de 2009, en el sentido de ajustar las coordenadas que \ndefinen el polígono de la Licencia Ambiental Global. \nQue mediante Resolución 241 del 13 de marzo de 2013, (LAM 2981), la Autoridad Nacional de \nLicencias Ambientales - ANLA, aceptó el cambio de razón social la empresa LUKOIL OVERSEAS \nCOLOMBIA LTD, por el de NIKOIL ENERGY CORP. SUC. COLOMBIA, de conformidad con el \nradicado 4120-E1-6523 del 13 de febrero de 2013, allegado por el representante legal de la empresa, \ny copia de la escritura pública 137 otorgada en la Notaria 69 de Bogotá. \nQue de conformidad con la Resolución 1310 del 2 de noviembre de 2016, la Autoridad Nacional de \nLicencias Ambientales – ANLA, en adelante Autoridad Nacional ajustó vía seguimiento el literal a. del \nartículo cuarto de la Resolución 999 de 29 de mayo de 2009, en el sentido de indicar la disposición \nfinal de los residuos sólidos domésticos.\n\nResolución No.  00588           Del   23 de marzo de 2023            Hoja No. 2 de 23\n““Por la cual se resuelve un recurso de reposición interpuesto contra la Resolución 2969 de \n14 de diciembre de 2022\nOficinas: Carrera 13 A No. 34 – 72 Edificio 13 35 Pisos 8 Bogotá, D.C.\nCentro de Orientación y Radicación de Correspondencia: Carrera 13 A No. 34 – 72 Edificio 13 35 \nLocales 110 al 112 Bogotá, D.C.  \nCódigo Postal 110311156\nNit.: 900.467.239-2\nLínea de Orientación y Contacto Ciudadano: 57 (1) 2540100 / 018000112998 PBX: 57 (1) 2540111\nwww.anla.gov.co    Email: licencias@anla.gov.co  \nPágina 2 de 23\nQue mediante la Resolución 1111 de 24 de junio de 2020, la ANLA modificó vía seguimiento la \nResolución 999 del 29 de mayo de 2009. \nQue mediante Resolución 455 del 25 de febrero de 2022, la Autoridad Nacional de Licencias \nAmbientales – ANLA, impuso medidas adicionales a la sociedad NIKOIL ENERGY CORP. SUC. \nCOLOMBIA, en el sentido de realizar exploración geofísica de tipo geoeléctrica continua (tomografías) \nque involucre la plataforma Cóndor y la zona de afectación de los afloramientos, en donde se generen \ndos (2) perfiles 2D de resistividad del subsuelo en dirección de la plataforma hacia los afloramientos, \nentre otras actividades. \nQue mediante Resolución 1015 del 16 de mayo de 2022, la Autoridad Nacional de Licencias \nAmbientales – ANLA resolvió recurso de reposición interpuesto contra la Resolución 455 del 25 de \nfebrero de 2022.\nQue mediante Resolución 2969 del 14 de diciembre de 2022, la Autoridad Nacional de Licencias \nAmbientales – ANLA impuso medidas adicionales a la sociedad NIKOIL ENERGY CORP. SUC. \nCOLOMBIA, relacionadas con implementar un seguimiento permanente a cada uno de los puntos de \nafloramientos tanto líquidos como de gas identificados, entre otras actividades. \nQue por medio de la comunicación con radicación 2022292697-1-000 del 27 de diciembre de 2022, el \nrepresentante legal de la sociedad NIKOIL ENERGY CORP. SUC. COLOMBIA, presentó recurso de \nreposición contra la Resolución 2969 del 14 de diciembre de 2022.\nQue esta Autoridad Nacional, evaluó técnicamente el recurso de reposición interpuesto por la \nSociedad NIKOIL ENERGY CORP. SUC. COLOMBIA y emitió concepto técnico 653 del 23 de febrero \nde 2023.\nFUNDAMENTOS LEGALES\nCompetencia \nEl Título VIII de la Ley 99 de 1993, estableció las disposiciones generales que regulan el otorgamiento \nde las licencias ambientales.\nDe conformidad con el numeral 15 del artículo 5 de la Ley 99 de 1993, corresponde al Ministerio del \nMedio Ambiente, hoy Ministerio de Ambiente y Desarrollo Sostenible, evaluar los estudios ambientales \ny expedir, negar o suspender la licencia ambiental en los casos señalados en el Título VIII de la \nmencionada Ley.\nEl artículo 49 de la Ley 99 de 1993 indicó que la ejecución de obras, el establecimiento de industrias \no el desarrollo de cualquier actividad que, de acuerdo con la ley y los reglamentos, pueda producir \ndeterioro grave a los recursos naturales renovables o al medio ambiente o introducir modificaciones \nconsiderables o notorias al paisaje, requerirán de una licencia ambiental. \nLa competencia general para el otorgamiento de las licencias ambientales tiene su fundamento en el \nartículo 51 de la Ley 99 de 1993 que establece:\n“Artículo 51. Competencia. Las Licencias Ambientales serán otorgadas por el Ministerio del Medio \nAmbiente, las Corporaciones Autónomas Regionales y algunos municipios y distritos, de conformidad \ncon lo previsto en esta Ley. \nEn la expedición de las licencias ambientales y para el otorgamiento de los permisos, concesiones y \nautorizaciones se acatarán las disposiciones relativas al medio ambiente y al control, la preservación \n\nResolución No.  00588           Del   23 de marzo de 2023            Hoja No. 3 de 23\n““Por la cual se resuelve un recurso de reposición interpuesto contra la Resolución 2969 de \n14 de diciembre de 2022\nOficinas: Carrera 13 A No. 34 – 72 Edificio 13 35 Pisos 8 Bogotá, D.C.\nCentro de Orientación y Radicación de Correspondencia: Carrera 13 A No. 34 – 72 Edificio 13 35 \nLocales 110 al 112 Bogotá, D.C.  \nCódigo Postal 110311156\nNit.: 900.467.239-2\nLínea de Orientación y Contacto Ciudadano: 57 (1) 2540100 / 018000112998 PBX: 57 (1) 2540111\nwww.anla.gov.co    Email: licencias@anla.gov.co  \nPágina 3 de 23\ny la defensa del patrimonio ecológico, expedidas por las entidades territoriales de la jurisdicción \nrespectiva.” \nDe acuerdo al numeral 1 del artículo 52 de la Ley 99 de 1993, el Ministerio del Medio Ambiente, hoy \nMinisterio de Ambiente y Desarrollo Sostenible, otorgará de manera privativa la licencia ambiental para \nla ejecución de obras de exploración, explotación, transporte, conducción y depósito de hidrocarburos.\nEl artículo 12 de la Ley 1444 de 2011, reorganizó el Ministerio de Ambiente, Vivienda y Desarrollo \nTerritorial y lo denominó Ministerio de Ambiente y Desarrollo Sostenible. \nMediante Decreto-Ley 3573 de septiembre 27 de 2011, el Gobierno Nacional, en uso de las facultades \nextraordinarias conferidas por la Ley 1444 de 2011, creó la Autoridad Nacional de Licencias \nAmbientales -ANLA- como una Unidad Administrativa Especial, con autonomía administrativa y \nfinanciera, sin personería jurídica, adscrita al Ministerio de Ambiente y Desarrollo Sostenible, \nencargada de que los proyectos, obras o actividades sujetos a licenciamiento, permiso o trámite \nambiental cumplan con la normativa ambiental, de tal manera que contribuyan al desarrollo sostenible \nambiental del país; desconcentrando así funciones del Ministerio de Ambiente y Desarrollo Sostenible \nque, antes de la escisión del Ministerio de Ambiente, Vivienda y Desarrollo Territorial, ejercía éste a \ntravés la Dirección de Licencias, Permisos y Trámites Ambientales.\nDentro de las actividades administrativas funcionales, territoriales y temporales que legalmente fueron \ndesconcentradas en la ANLA, está la función de conocer administrativamente de los instrumentos de \ncontrol y manejo ambiental que para los proyectos de su competencia se hayan adoptado, siendo por \ntanto perfectamente viable que conozca las solicitudes de modificación, seguimiento y control \nambiental, y hasta el desmantelamiento y abandono de acuerdo con lo dispuesto por la Ley 99 de \n1993, Decreto 1076 de 2015 y sus Decretos reglamentarios.\nEn este sentido, la Autoridad Nacional de Licencias Ambientales, al ser una Unidad Administrativa \nespecial, adscrita al Ministerio de Ambiente y Desarrollo Sostenible, tiene competencia administrativa \n-funcional y territorial- sobre aquéllos proyectos, obras y actividades del orden nacional que, desde \n1993 o inclusive antes, tienen instrumento de control y manejo ambiental o con posterioridad a este \naño se les ha impuesto u otorgado licencia, permiso, autorización o plan de manejo ambiental en virtud \nde las competencias establecidas a esta Autoridad en el Decreto reglamentario del título VIII de la Ley \n99 de 1993, y frente a los cuales, conforme a la ley, les hace control y seguimiento. \nEl Decreto 1076 del 26 de mayo de 2015, establece en el numeral 8 del artículo 2.2.2.3.9.1 del Libro \n2, Parte 2, Título 2, Capítulo 3, Sección 9 del Control y Seguimiento que uno de los propósitos de las \nactividades de control y seguimiento y que desempeña la autoridad ambiental competente cuando \nverifica el cumplimiento de los proyectos, obras o actividades conforme a las normas ambientales y a \nsu respectivo instrumento de manejo, es el de \"imponer medidas ambientales adicionales para \nprevenir, mitigar o corregir impactos ambientales no previstos en los estudios ambientales del \nproyecto\". (Subrayado fuera de texto).\nAunado a lo anterior, el artículo mencionado también dispone que \"En el desarrollo de dicha gestión, \nla autoridad ambiental podrá realizar entre otras actividades, visitas al lugar donde se desarrolla el \nproyecto, hacer requerimientos, imponer obligaciones ambientales, corroborar técnicamente o a través \nde pruebas los resultados de los monitoreos realizados por el beneficiario de la Licencia Ambiental”. \n(Subrayado fuera de texto).\nMediante la Resolución 1223 del 19 de septiembre de 2022, se nombra al doctor RODRIGO ELÍAS \nNEGRETE MONTES en el empleo de director general de la Unidad Administrativa Código 015, de la \nAutoridad Nacional de Licencias Ambientales – ANLA.\n\nResolución No.  00588           Del   23 de marzo de 2023            Hoja No. 4 de 23\n““Por la cual se resuelve un recurso de reposición interpuesto contra la Resolución 2969 de \n14 de diciembre de 2022\nOficinas: Carrera 13 A No. 34 – 72 Edificio 13 35 Pisos 8 Bogotá, D.C.\nCentro de Orientación y Radicación de Correspondencia: Carrera 13 A No. 34 – 72 Edificio 13 35 \nLocales 110 al 112 Bogotá, D.C.  \nCódigo Postal 110311156\nNit.: 900.467.239-2\nLínea de Orientación y Contacto Ciudadano: 57 (1) 2540100 / 018000112998 PBX: 57 (1) 2540111\nwww.anla.gov.co    Email: licencias@anla.gov.co  \nPágina 4 de 23\nAsí mismo y en virtud de lo establecido en el numeral 2 de la descripción de funciones esenciales del \nempleo denominado “Director General de Unidad Administrativa Especial”, de la Resolución 1957 del \n5 de noviembre de 2021 modificada por la Resolución 407 del 18 de febrero de 2022, \"Por la cual se \nadopta el Manual Específico de Funciones y de Competencias Laborales para los empleos de la planta \nde personal de la Autoridad Nacional de Licencias Ambientales - ANLA\", le corresponde al Director \nGeneral de la ANLA para suscribir el presente Acto Administrativo, tal como se anuncia a continuación:\n(…) \n“2. Suscribir los actos administrativos que otorgan, niegan, modifican, ajustan o declaran la terminación \nde las licencias, permisos y trámites ambientales.”\nAl Director General de la ANLA le fue asignada la función de suscribir los actos administrativos que \nmodifican las licencias ambientales, como lo es, la imposición de medidas adicionales. Por tal motivo, \nes el funcionario competente para suscribir el presente acto administrativo que resuelve el recurso de \nreposición de interpuesto contra la Resolución 2969 del 14 de diciembre de 2022 por la cual se \nimpusieron medidas adicionales de seguimiento y monitoreo al proyecto Campo de Producción \nMedina.\nProcedimiento\nEl procedimiento para la presentación y resolución de recursos contra los actos administrativos se \nencuentra reglado en el Código de Procedimiento Administrativo y de lo Contencioso Administrativo, \nartículos 74 y siguientes, que particularmente respecto del recurso de reposición establecen:\n“Artículo 74. Recursos contra los actos administrativos. - Por regla general, contra los actos \ndefinitivos procederán los siguientes recursos:\n \n1.\nEl de reposición, ante quien expidió la decisión para que la aclare, modifique, adicione o revoque”\n(…) \nA su vez, el artículo 76 y 77 del Código enunciado señalan: \n“Artículo 76. Oportunidad y presentación. - Los recursos de reposición y apelación deberán \ninterponerse por escrito en la diligencia de notificación personal, o dentro de los diez (10) días \nsiguientes a ella, o a la notificación por aviso, o al vencimiento del término de publicación, según el \ncaso. Los recursos contra los actos presuntos podrán interponerse en cualquier tiempo, salvo en el \nevento en que se haya acudido ante el juez. \nLos recursos se presentarán ante el funcionario que dictó la decisión, salvo lo dispuesto para el de \nqueja, y si quien fuere competente no quisiere recibirlos podrán presentarse ante el procurador regional \no ante el personero municipal, para que ordene recibirlos y tramitarlos, e imponga las sanciones \ncorrespondientes, si a ello hubiere lugar. \nEl recurso de apelación podrá interponerse directamente, o como subsidiario del de reposición y \ncuando proceda será obligatorio para acceder a la jurisdicción. \nLos recursos de reposición y de queja no serán obligatorios. \nArtículo 77. Requisitos. - Por regla general los recursos se interpondrán por escrito que no requiere \nde presentación personal si quien lo presenta ha sido reconocido en la actuación. Igualmente, podrán \npresentarse por medios electrónicos. \nLos recursos deberán reunir, además, los siguientes requisitos: \n\nResolución No.  00588           Del   23 de marzo de 2023            Hoja No. 5 de 23\n““Por la cual se resuelve un recurso de reposición interpuesto contra la Resolución 2969 de \n14 de diciembre de 2022\nOficinas: Carrera 13 A No. 34 – 72 Edificio 13 35 Pisos 8 Bogotá, D.C.\nCentro de Orientación y Radicación de Correspondencia: Carrera 13 A No. 34 – 72 Edificio 13 35 \nLocales 110 al 112 Bogotá, D.C.  \nCódigo Postal 110311156\nNit.: 900.467.239-2\nLínea de Orientación y Contacto Ciudadano: 57 (1) 2540100 / 018000112998 PBX: 57 (1) 2540111\nwww.anla.gov.co    Email: licencias@anla.gov.co  \nPágina 5 de 23\n1.\nInterponerse dentro del plazo legal, por el interesado o su representante o apoderado debidamente \nconstituido. \n2.\nSustentarse con expresión concreta de los motivos de inconformidad. \n3.\nSolicitar y aportar las pruebas que se pretende hacer valer. \n4.\nIndicar el nombre y la dirección del recurrente, así como la dirección electrónica si desea ser \nnotificado por este medio. \nSólo los abogados en ejercicio podrán ser apoderados. Si la recurrente obra como agente oficioso, \ndeberá acreditar la calidad de abogado en ejercicio, y prestar la caución que se le señale para \ngarantizar que la persona por quien obra ratificará su actuación dentro del término de dos (2) meses. \nSi no hay ratificación se hará efectiva la caución y se archivará el expediente. \nPara el trámite del recurso el recurrente no está en la obligación de pagar la suma que el acto recurrido \nle exija. Con todo, podrá pagar lo que reconoce deber.”\nEn el caso en examen, la sociedad NIKOIL ENERGY CORP. SUC. COLOMBIA, a través de \nrepresentante legal presentó mediante radicación ANLA 2022292697-1-000 del 27 de diciembre de \n2022, el escrito de recurso de reposición contra la Resolución 2969 del 14 de diciembre de 2022, con \nel lleno de los requisitos establecidos en el artículo 77 del Código de Procedimiento Administrativo y \nde lo Contencioso Administrativo. \nCONSIDERACIONES DE LA AUTORIDAD NACIONAL DE LICENCIAS AMBIENTALES FRENTE \nAL RECURSO DE REPOSICIÓN INTERPUESTO POR LA SOCIEDAD \nDesde el punto de vista procedimental se observa que el recurso de reposición interpuesto por la \nsociedad NIKOIL ENERGY CORP. SUC. COLOMBIA, contra la Resolución 2969 del 14 de diciembre \nde 2022, cumple con los requisitos establecidos en el artículo 77 y concordantes del Código de \nProcedimiento Administrativo y de lo Contencioso Administrativo. \nEn efecto tenemos que, la sociedad NIKOIL ENERGY CORP. SUC. COLOMBIA., fue notificada por \ncorreo electrónico el día 14 de diciembre de 2022 de la Resolución 2969 de 2022, “Por la cual se \nimponen medidas ambientales adicionales” e interpuso el recurso de reposición contra dicho acto \nadministrativo el día 27 de diciembre de 2022 a través de Representante Legal, es decir, dentro de los \ndiez (10) días hábiles siguientes, y sustenta los motivos de inconformidad en cumplimiento con lo \ndispuesto en el artículo 76 de la Ley 1437 del 18 de enero de 2011.\nEl titular del instrumento de manejo y control, en el escrito del recurso de reposición solicitó tener como \npruebas los siguientes documentos:\n1.\nAnexo 1: Informe de Muestreo de Afloramientos de Hidrocarburos en inmediaciones del \nCampo Medina – Bloque Cóndor. \n2.\nAnexo 2: Resultados de Análisis de Laboratorio Muestras del Bloque Cóndor - Cromatografía \nde Gas de Alta Resolución de Fluidos Hidrocarburos, SGS OIL, Gas & Chemicals Division, \naño 2019 \n3.\nAnexo 3: Informe Análisis de Muestras de Afloramientos Campo Medina Bloque Cóndor, año \n2019. \n4.\nAnexo 4: Análisis Composicional de Fluido Atmosférico para Nikoil Energy Corp. Sucursal \nColombia, muestra de afloramiento, empresa CORELAB RESERVOIR OPTIMIZATION, año \n2019 \n5.\nAnexo 5: Mapa de la ANH sobre Afloramientos Naturales de Hidrocarburos en Colombia. \n6.\nAnexo 6: Inventario Preliminar de Rezumaderos de Hidrocarburos en Colombia por la ANH. \n7.\nAnexo 7: Radicado de ANLA 2022131273-1-000 de 28 de junio de 2022. \n\nResolución No.  00588           Del   23 de marzo de 2023            Hoja No. 6 de 23\n““Por la cual se resuelve un recurso de reposición interpuesto contra la Resolución 2969 de \n14 de diciembre de 2022\nOficinas: Carrera 13 A No. 34 – 72 Edificio 13 35 Pisos 8 Bogotá, D.C.\nCentro de Orientación y Radicación de Correspondencia: Carrera 13 A No. 34 – 72 Edificio 13 35 \nLocales 110 al 112 Bogotá, D.C.  \nCódigo Postal 110311156\nNit.: 900.467.239-2\nLínea de Orientación y Contacto Ciudadano: 57 (1) 2540100 / 018000112998 PBX: 57 (1) 2540111\nwww.anla.gov.co    Email: licencias@anla.gov.co  \nPágina 6 de 23\n8.\nAnexo 8: Informe Final de Diseño de una Red de Monitoreo de Aguas Subsuperficiales y \nEstudio Hidrogeológico en el sitio de los Afloramientos de Hidrocarburos en veredas Caño \nGrande y Río Chiquito de San Luis de Gaceno, Junio de 2022.\nDe acuerdo con lo anterior esta Autoridad Nacional procederá a resolver el recurso de reposición \npresentado por la sociedad NIKOIL ENERGY CORP. SUC. COLOMBIA, en donde solicitó lo siguiente: \n1.\n“NIKOIL, se encuentra y enmarca dentro de las causales descritas por la Ley para que la \nAutoridad Ambiental no requiera al titular del instrumento para desarrollar actividades que no \nson procedentes”\nEn el mismo orden de los argumentos presentados por la sociedad NIKOIL ENERGY CORP. SUC. \nCOLOMBIA, esta Autoridad analizará la petición, teniendo en cuenta las consideraciones realizadas \nen el concepto técnico 653 del 23 de febrero de 2023.\n1. Recurso contra la Resolución 2969 de 14 de diciembre de 2022\nToda vez que el peticionario no formulo de manera específica alguna disposición de la citada \nResolución, sino que de manera general recurrió su totalidad, a continuación se hará el análisis \nigualmente de manera general puesto que no se señalan apartes del mismo, como causantes de la \ninconformidad. \n \n1.1. Argumentos de la Sociedad recurrente: \nA continuación, se destacan los argumentos expuestos por la Sociedad a través del escrito de recurso \nde reposición presentado, respecto a la Resolución 2969 del 14 de diciembre de 2022, que impuso \nmedidas adicionales relacionadas con implementar un seguimiento permanente a cada uno de los \npuntos de afloramientos tanto líquidos como de gas identificados, entre otras actividades:\n“Como se ha venido informando por parte de NIKOIL, en respuesta a los actos administrativos:\n<0000>\nAUTO N° 00099 de 14 de enero de 2020\n, por el cual se ordena el inicio de un procedimiento \nsancionatorio ambiental y se adoptan otras determinaciones.\n<0000>\nAUTO N° 09060 de 15 de septiembre de 2020\n, Por el cual se efectúa control y seguimiento \nambiental.\n<0000>\nAUTO N° 12218 de 24 de diciembre de 2020\n, por el cual se formula pliego de cargos dentro de \nun procedimiento administrativo sancionatorio ambiental y se adoptan otras Determinaciones.\n<0000>\nAUTO N° 08899 de 20 de octubre de 2021\n, por el cual se formulan cargos dentro de un \nprocedimiento sancionatorio ambiental y se adoptan otras determinaciones.\n<0000>\nAUTO N° 08931 de 20 de octubre de 2021\n, por el cual se ordena la incorporación de una(s) \nprueba(s) y se adoptan otras determinaciones.\nLos anteriores actos administrativos corresponden a seguimiento efectuado por la ANLA a los afloramientos \nnaturales de hidrocarburos en predios privados de las veredas Caño Grande y Río Chiquito del municipio \nde San Luis de Gaceno, Boyacá; de tal forma que con base en la realidad fáctica que nos ocupa, \nprocedemos a expresar las razones de nuestro disenso frente a las actividades adicionales endilgadas a \nla UTOE, y nos permitimos rendir las respectivas explicaciones, aportar las pruebas necesarias y remitir la \ninformación requerida, con el fin de demostrar que NIKOIL, se encuentra y enmarca dentro de las causales \ndescritas por la Ley para que la Autoridad Ambiental no requiera al titular del instrumento para desarrollar \nactividades que no son procedentes, por las siguiente razones:\nEn consonancia como lo hemos manifestado en anteriores oportunidades, ante las autoridades \nambientales y judiciales, la aparición de estos afloramientos comenzó a ser reportada hacia el año 2015, \njustamente cuando NIKOIL no se encontraba adelantando operaciones en el bloque, por cuanto el cese de \n\nResolución No.  00588           Del   23 de marzo de 2023            Hoja No. 7 de 23\n““Por la cual se resuelve un recurso de reposición interpuesto contra la Resolución 2969 de \n14 de diciembre de 2022\nOficinas: Carrera 13 A No. 34 – 72 Edificio 13 35 Pisos 8 Bogotá, D.C.\nCentro de Orientación y Radicación de Correspondencia: Carrera 13 A No. 34 – 72 Edificio 13 35 \nLocales 110 al 112 Bogotá, D.C.  \nCódigo Postal 110311156\nNit.: 900.467.239-2\nLínea de Orientación y Contacto Ciudadano: 57 (1) 2540100 / 018000112998 PBX: 57 (1) 2540111\nwww.anla.gov.co    Email: licencias@anla.gov.co  \nPágina 7 de 23\nactividades operativas se dio desde julio de 2014 hasta noviembre de 2017. Lo anterior debido a bloqueos \nde las comunidades del área de influencia directa del Proyecto de Desarrollo del Campo Medina y por \ntemas de viabilidad económica por los bajos precios del crudo que registraban los mercados \ninternacionales. Adicionalmente, es pertinente mencionar que dentro de varias acciones legales \nadelantadas por la comunidad en contra de NIKOIL, (Acción de Tutela, Demanda ante el Concejo de Estado \ny Demanda de Acción Popular ante el Tribunal Administrativo de Boyacá), la compañía que represento \natendió oportunamente y con fundamentos científicos y técnicos tan sólidos que le representaron \nrespuestas favorables por parte de la jurisdicción en los procesos jurídicos anteriormente mencionados.\nComo consecuencia de lo anterior, y en cumplimiento de las obligaciones derivadas de la licencia ambiental \nglobal, NIKOIL adelantó de manera eficiente estudios que permitieron concluir que el hidrocarburo presente \nen los manaderos naturales de hidrocarburos tiene características físico químicas totalmente diferentes al \nhidrocarburo presente en el yacimiento del Bloque Cóndor. Por lo tanto, pese a las insistentes \ncomunicaciones que hemos atendido, no existe relación alguna entre los afloramientos naturales que se \nhan presentado cerca del área de influencia de nuestro proyecto y el yacimiento producido en el mismo.\nNIKOIL, se permite informar a la ANLA que, desde el año 2018 hasta la fecha se han realizado los \nsiguientes estudios en la zona de los afloramientos naturales de hidrocarburos en las veredas Caño Grande \ny Río Chiquito del municipio de San Luis de Gaceno, Boyacá:\n<0000>\nInforme de Muestreo de Afloramientos de Hidrocarburos en inmediaciones del Campo Medina – \nBloque Cóndor, año 2018, (Anexo 1).\n<0000>\nResultados de Análisis de Laboratorio muestras del Bloque Cóndor - Cromatografía de Gas de \nAlta Resolución de Fluidos Hidrocarburos, SGS Oil, Gas & Chemicals Division, año 2019, (Anexo \n2).\n<0000>\nInforme Análisis de Muestras de Afloramientos Campo Medina Bloque Cóndor, año 2019, (Anexo \n3).\n<0000>\nAnálisis Composicional de Fluido Atmosférico para Nikoil Energy Corp. Sucursal Colombia, \nMuestra de afloramiento, empresa CoreLab Reservoir Optimization, año 2019, (Anexo 4).\nPor lo anterior, NIKOIL se permite informar a la ANLA respetuosamente que las medidas adicionales \nimpuestas en el acto administrativo recurrido resultan innecesarias y en su lugar onerosas para la \ncompañía, toda vez que, como reposa en los archivos de la Entidad, en mayo de 2018, NIKOIL presentó \nante ANLA un informe técnico que contiene el análisis profundo de la composición y origen de los \nafloramientos, el cual, fue contratado con la firma SGS Colombia S.A.S., con los siguientes resultados:\n“RESULTADOS DE LOS ANÁLISIS:\nLos resultados de los análisis realizados por la empresa SGS se resumen de la siguiente manera:\n- De las tres muestras recolectadas de los afloramientos, como se explica en el informe de SGS, \nposterior a los trabajos de centrifugar y separar el agua del fluido a analizar, fue descartada por el bajo \ncontenido de aceite la muestra 4.02 presentó un contenido muy bajo de aceite. Con respecto a las \nmuestras 4.01 y 4.03 se procedió a realizar los respectivos análisis.\n- Se reciben de la empresa SGS los análisis composicionales, donde acorde a los resultados de la \ncromatografía de alta resolución, SGS informa que basado en su composición es más parecido a un \nhidrocarburo que a un producto refinado.\n- En el informe expresa SGS que, si el fluido fuese un lodo base aceite o en su mayoría, generalmente \nse esperarían ver picos de mayor concentración entre los compuestos C14-C20, donde se observan \nen ambas muestras valores muy suaves para estos componentes.\n- Adicionalmente la comparación de la composición de las muestras de los afloramientos contra la \ncomposición del Crudo de producción de las operaciones, muestran diferencias, donde se solicitó a la \nEmpresa SGS realizar el grafico comparativo de las muestras 4.01, 4.03 y 4.04 (crudo de producción).\nCONCLUSIONES DEL ANÁLISIS DE LAS MUESTRAS:\nLas condiciones composicionales de los fluidos de los afloramientos analizados no son coincidentes \ncon las características del fluido producido en los pozos del Campo Medina. • El fluido recuperado de \n\nResolución No.  00588           Del   23 de marzo de 2023            Hoja No. 8 de 23\n““Por la cual se resuelve un recurso de reposición interpuesto contra la Resolución 2969 de \n14 de diciembre de 2022\nOficinas: Carrera 13 A No. 34 – 72 Edificio 13 35 Pisos 8 Bogotá, D.C.\nCentro de Orientación y Radicación de Correspondencia: Carrera 13 A No. 34 – 72 Edificio 13 35 \nLocales 110 al 112 Bogotá, D.C.  \nCódigo Postal 110311156\nNit.: 900.467.239-2\nLínea de Orientación y Contacto Ciudadano: 57 (1) 2540100 / 018000112998 PBX: 57 (1) 2540111\nwww.anla.gov.co    Email: licencias@anla.gov.co  \nPágina 8 de 23\nlos afloramientos por su composición tiende a ser más un hidrocarburo que un producto refinado. • \nBasado en la composición de las muestras no son fluidos de lodos base aceite, donde se descarta \ndicha hipótesis. • Los procesos de afloramientos pueden ser continuos, intermitentes o esporádicos, \npor lo que es improbable predecirlos desde el ámbito técnico. (…)”.\nDe tal forma que, en cumplimiento de las obligaciones ambientales y propendiendo por el cuidado ambiental \ndel área, NIKOIL ha desarrollado cuidadosamente análisis, estudios, visitas y ejecutado actividades \ntendientes a determinar lo que la ANLA pretende evidenciar con tan bastas medidas adicionales que \nademás, imponen una carga administrativa y económica que NIKOIL no está en condiciones de soportar, \npor cuanto en lugar de propender por el desarrollo del instrumento ambiental, perjudica ostensiblemente \nsu economía, al tratarse de estudios que están enfocados a obtener los mismos resultados que ya en \nocasiones anteriores hemos demostrado.\nNo obstante, en el presente escrito queremos nuevamente exponer que, con base en estudios científicos \nlos cuales han sido debidamente soportados y mediante los cuales, NIKOIL ha demostrado que los fluidos \nno coinciden en su composición y adicionalmente, descartan que el hidrocarburo presente en los \nafloramientos provenga de los tanques y/o diques de almacenamiento del Diésel utilizado dentro de la \noperación del Bloque Cóndor, pues los equipos de almacenamiento de Diésel, cuentan con integridad de \nalmacenamiento, descartando fugas al medio ambiente.\nDel mismo modo, es importante mencionar que la ANH ha realizado estudios de identificación, mapeo y \nanálisis de los rezumaderos (afloramientos) existentes en Colombia (Anexo 5), y en la gráfica se encuentran \nmás de 150 afloramientos de crudo, asfalto y gas en todo el territorio colombiano, sin incluir la Isla de San \nAndrés y Providencia, los cuales, de acuerdo con el concepto técnico de la Entidad SON ENTERAMENTE \nNATURALES, y no corresponden a una consecuencia de la actividad desarrollada por NIKOIL en el área. \nDe acuerdo con el concepto de la Entidad, existe presencia de los afloramientos incluso en sitios donde no \nexiste actividad de hidrocarburos ni de carácter exploratorio ni de explotación. Una vez más, haciendo \nmención al mapa proferido por el área técnica de la ANH, es posible que en el área del municipio de San \nLuis de Gaceno se identificaran varios rezumaderos naturales de hidrocarburos.\nAdicionalmente, de acuerdo con el Inventario Preliminar de Rezumaderos de Hidrocarburos en Colombia, \npublicado en la página web de la ANH, se puede observar que actualmente existen más de 1800 \nrezumaderos naturales en Colombia, de los cuales, más de 140 están ubicados en el departamento de \nBoyacá y la mayoría de ellos, en sitios donde no hay actividades de explotación de hidrocarburos (Anexo \n6), con lo cual se afirma lo concluido en el estudio técnico adelantado por NIKOIL, que la proveniencia y \norigen de este tipo de afloramiento es enteramente natural, no ocasionado por la actividad desarrollada en \nlos pozos aludidos en la comunicación de la ANLA.\nAsí mismo, consideramos pertinente mencionar que el Campo Medina es un anticlinal con cierre en todas \nlas direcciones, y donde el reservorio productor (Mirador), está a una profundidad de 8556 ft en el subsuelo. \nUna migración hacia la superficie es una trayectoria larga donde, se esperaría que el petróleo saliera crudo, \ncon las mismas características que presenta el extraído de los pozos en el tanque de almacenamiento, sin \nser refinado, argumento técnico que solicitamos sea tenido en cuenta de igual forma y exonerar en este \ncaso a NIKOIL de la responsabilidad derivada de los afloramientos en el área.\nDe manera que, NIKOIL reitera las respuestas dadas a los autos mencionados anteriormente e informa \nrespetuosamente a la ANLA que, debido a proceso en el TRIBUNAL ADMINISTRATIVO DE BOYACÁ -\nTAB, este Tribunal dispuso unas medidas cautelares a NIKOIL con respecto a los afloramientos naturales \nde hidrocarburos en predios privados de las veredas mencionadas anteriormente del municipio de San Luis \nde Gaceno, Boyacá, para lo cual NIKOIL contrató con una empresa especializada El Diseño y Construcción \nde una Red de Monitoreo de Aguas Subsuperficiales y Estudio Hidrogeológico en el área de los \nAfloramientos de Hidrocarburos en predios privados de las veredas Caño Grande y Río Chiquito, dando \ncomo resultado que dichos afloramientos SON DE PROCEDENCIA NATURAL Y NO PRRODUCTO DE \nLAS ACTIVIDADES DE EXPLOTACIÓN DE HIDROCARBUROS DEL CAMPO MEDIONA. (sic) Estudio \nque fue radicado ante ANLA el 28 de junio de 2022 con radicación: 2022131273-1-000. (Anexo 7).\nPor lo que, respetuosamente nos permitimos reiterar que la ANLA, como Autoridad en materia ambiental \ncuenta con la facultad privativa para el otorgamiento de licencias ambientales al Sector de hidrocarburos y \n\nResolución No.  00588           Del   23 de marzo de 2023            Hoja No. 9 de 23\n““Por la cual se resuelve un recurso de reposición interpuesto contra la Resolución 2969 de \n14 de diciembre de 2022\nOficinas: Carrera 13 A No. 34 – 72 Edificio 13 35 Pisos 8 Bogotá, D.C.\nCentro de Orientación y Radicación de Correspondencia: Carrera 13 A No. 34 – 72 Edificio 13 35 \nLocales 110 al 112 Bogotá, D.C.  \nCódigo Postal 110311156\nNit.: 900.467.239-2\nLínea de Orientación y Contacto Ciudadano: 57 (1) 2540100 / 018000112998 PBX: 57 (1) 2540111\nwww.anla.gov.co    Email: licencias@anla.gov.co  \nPágina 9 de 23\nsu respectivo seguimiento, de tal suerte que solicitamos a la Entidad no desconocer tan importante y \nfundamental estudio científico y prueba fehaciente que NIKOIL, no tiene ninguna injerencia en estos \nfenómenos naturales de rezumaderos y emanaciones de hidrocarburos en predios privados de veredas \nCaño Grande y Río Chiquito. Por tal razón, sorprende la determinación de imponer nuevas medidas de \nseguimiento y control adicionales a las ya establecidas, las cuales, son suficientes, por demás. La ejecución \nde nuevas medidas de seguimiento, resultan supremamente onerosas, e improcedentes, sobre todo \nteniendo en cuenta que para este tipo de fenómenos la normativa ambiental vigente en el País es bastante \nclara, precisa y objetiva, como lo es la Ley 99 de 1993 que establece para estos casos:\nLey 99 de 1993 en su Artículo 5º Numeral 13:\n“Funciones del Ministerio. Corresponde al Ministerio del Medio Ambiente: (….)\n13) Definir la ejecución de programas y proyectos que la Nación, o ésta en asocio con \notras entidades públicas, deba adelantar para el saneamiento del medio ambiente o en \nrelación con el manejo, aprovechamiento, conservación, recuperación o protección de los \nrecursos naturales renovables y del medio ambiente (…)”. Resaltado fuera de texto \noriginal.\nEs claro que, ante el hecho físico de los mencionados afloramientos naturales de hidrocarburos, \ncorresponde al Estado Colombiano en cabeza del Ministerio de Ambiente y Desarrollo Sostenible, ahora \nANLA, definir si es necesario, en asocio con otras entidades de carácter público, en este caso particular \ncon CORPOCHIVOR, e igualmente con la Agencia Nacional de Hidrocarburos, la ejecución de programas \ny proyectos que la Nación deba adelantar para el saneamiento del medio ambiente, que es lo que \nactualmente se requiere para la protección de los recursos naturales renovables en el sitio de los \nafloramientos naturales de hidrocarburos en predios privados de las veredas Caño Grande y Río Chiquito \ndel municipio de San Luis de Gaceno, Boyacá; por lo tanto NO CORRESPONDE A NIKOIL asumir roles y \nfunciones propias de la autoridad ambiental en Colombia, pues al hacerlo, la sociedad que represento \nestaría infringiendo lo dispuesto en la Ley 99 de 1993, y así, usurpando funciones que corresponden de \nmanera exclusiva y privativa al Ministerio de Ambiente y Desarrollo Sostenible, como lo estableció la \nmencionada Ley en 1993.\nAsí mismo, el numeral 17 de la citada Ley 99 de 1993 establece:\n“Funciones del Ministerio. Corresponde al Ministerio del Medio Ambiente:\n17) Contratar, cuando sea necesario para el cumplimiento de sus funciones, la \nelaboración de estudios de investigación y de seguimiento de procesos ecológicos y \nambientales y la evaluación de estudios de impacto ambiental”. Resaltado fuera de texto \noriginal.\nVista la cita anterior, se colige la claridad respecto de la función encomendada por el Ejecutivo al Ministerio \nde Ambiente y Desarrollo Sostenible, y este caso específico de afloramientos naturales corresponde a \nprocesos ecológicos y ambientales, para lo cual el Estado Colombiano delegó en la Autoridad Ambiental \nesta función, y mal haría NIKOIL en acometer acciones encaminadas a la elaboración de estudios de \ninvestigación y de seguimiento de procesos ecológicos, cuando corresponde al estado realizarlos por \nmandato de la Ley 99 de 1993, contando además el Estado con todos los recursos económicos, técnicos, \ntecnológicos y humanos necesarios para la contratación de tales estudios de investigación.\nSe reitera que NO es función de NIKOIL acometer estudios de investigación y de seguimiento de procesos \necológicos naturales y menos atender “Per se” la imposición arbitraria, injusta y atropelladora de medidas \nadicionales improcedentes establecidas en la resolución de se recurre.\nComo si lo anterior no fuese suficiente para que ANLA comprenda que NO es NIKOIL quien debe acometer \nlas acciones para el control y mitigación de los efectos adversos originados por los afloramientos naturales \nde hidrocarburos, sino el mismo estado colombiano en cabeza de ANLA Y Corpochivor hacerlo, NIKOIL, \nse permite referir el Artículo 5º. Numeral 35 de la Ley 99 de 1993, 35, el cual establece:\n\nResolución No.  00588           Del   23 de marzo de 2023            Hoja No. 10 de 23\n““Por la cual se resuelve un recurso de reposición interpuesto contra la Resolución 2969 de \n14 de diciembre de 2022\nOficinas: Carrera 13 A No. 34 – 72 Edificio 13 35 Pisos 8 Bogotá, D.C.\nCentro de Orientación y Radicación de Correspondencia: Carrera 13 A No. 34 – 72 Edificio 13 35 \nLocales 110 al 112 Bogotá, D.C.  \nCódigo Postal 110311156\nNit.: 900.467.239-2\nLínea de Orientación y Contacto Ciudadano: 57 (1) 2540100 / 018000112998 PBX: 57 (1) 2540111\nwww.anla.gov.co    Email: licencias@anla.gov.co  \nPágina 10 de 23\n“Funciones del Ministerio. Corresponde al Ministerio del Medio Ambiente:\n35) Hacer evaluación, seguimiento y control de los factores de riesgo ecológico y de los \nque puedan incidir en la ocurrencia de desastres naturales y coordinar con las demás \nautoridades las acciones tendientes a prevenir la emergencia o a impedir la extensión de \nsus efectos” Resaltado fuera de texto original.\nEs decir, la misma Ley 99 de 1993 establece a la Autoridad Ambiental como función exclusiva y privativa, \nla de realizar evaluaciones, seguimiento y control cuando ocurran desastres naturales y además coordinar \ncon las demás autoridades, llámese CORPOCHIVOR, ANH, las acciones de control tendientes a prevenir \nla emergencia, es decir elaborar el Plan de Contingencia para impedir la extensión de esos efectos \noriginados por afloramientos naturales, por lo que mal haría NIKOIL en elaborar un Plan de Contingencia \npara un fenómeno natural, cuya responsabilidad por ley es del Estado Colombiano, quien ha delgado esta \nfunción en la Autoridad Ambiental, más aún en predios privados, cuyos impactos ambientales han sido \ncausados por acciones naturales y no por la actividad que desarrolla la Empresa.\nAhora bien, con respecto al rol o papel de CORPOCHIVOR, en este caso específico de los afloramientos \nnaturales en veredas Caño Grande y Río Chiquito del municipio de San Luis de Gaceno; la ley 99 de 1993 \nen su Título VI, “DE LAS CORPORACIONES AUTÓNOMAS REGIONALES” en su Artículo 31, Numerales \n7, 20 y 23, establece:\n“(…) Funciones. Las Corporaciones Autónomas Regionales ejercerán las siguientes funciones:\n7) Promover y realizar conjuntamente con los organismos nacionales adscritos y \nvinculados al Ministerio del Medio Ambiente, y con las entidades de apoyo técnico y \ncientífico del Sistema Nacional Ambiental (SINA), estudios e investigaciones en materia de \nmedio ambiente y recursos naturales renovables.\n20) Ejecutar, administrar, operar y mantener en coordinación con las entidades \nterritoriales, proyectos, programas de desarrollo sostenible y obras de infraestructura \ncuya realización sea necesaria para la defensa y protección o para la descontaminación \no recuperación del medio ambiente y los recursos naturales renovables;\n23) Realizar actividades de análisis, seguimiento, prevención y control de desastres, en \ncoordinación con las demás autoridades competentes, y asistirlas en los aspectos \nmedioambientales en la prevención y atención de emergencias y desastres; adelantar con \nlas administraciones municipales o distritales programas de adecuación de áreas urbanas en \nzonas de alto riesgo, tales como control de erosión, manejo de cauces y reforestación (…)”. \nResaltado fuera de texto original\nEs decir, la misma Ley 99 de 1993, máximo mandato legal ambiental en Colombia, estableció funciones \nclaras y precisas a las Corporaciones Autónomas Regionales y les dio herramientas jurídicas para que \npuedan adelantar conjuntamente con organismos nacionales adscritos y vinculados al Ministerio de \nAmbiente, llámense ANLA, Servicio Geológico Colombiano, IDEAM, Direcciones, entre otros, estudios e \ninvestigaciones como para el caso de los afloramientos naturales de hidrocarburos en predios privados de \nlas veredas Caño Grande y Río Chiquito del municipio de San Luis de Gaceno; por lo tanto, es \nIMPROCEDENTE que se le exija y requiera a una empresa privada como NIKOIL adelantar las acciones \nque por ley y los reglamentos le corresponden tanto a Ministerio de Ambiente y Desarrollo Sostenible, como \na ANLA y CORPOCHIVOR, en este caso.\nFinalmente, y teniendo en cuenta todo lo que se mencionó anteriormente, con respecto a los requerimientos \nestablecidos por la Resolución 02969 de 14 de diciembre de 2022, si ANLA por algunos motivos, no puede \nacometer las acciones y funciones que le otorgó y le delegó el Estado Colombiano mediante las leyes y los \nreglamentos, NIKOIL le informa a ANLA que podemos realizar las actividades establecidas en las medidas \nadicionales previa solicitud de ANLA a NIKOIL con copia a la Procuraduría General de la República (a \nquien Nikoil enterará para que hagan la investigación que corresponde a actuaciones de servidores \npúblicos que se exceden y extralimitan en sus funciones con aplicación del Código Disciplinario Único y las \ncorrespondientes acciones de repetición a que haya lugar legalmente), para lo cual la Empresa realizará la \nplaneación necesaria con respecto al Alcance, Costos y Cronogramas de ejecución, para que la Autoridad \nAmbiental asuma los costos incluida la respectiva administración, la cual será del 25 % del valor estimado.\n\nResolución No.  00588           Del   23 de marzo de 2023            Hoja No. 11 de 23\n““Por la cual se resuelve un recurso de reposición interpuesto contra la Resolución 2969 de \n14 de diciembre de 2022\nOficinas: Carrera 13 A No. 34 – 72 Edificio 13 35 Pisos 8 Bogotá, D.C.\nCentro de Orientación y Radicación de Correspondencia: Carrera 13 A No. 34 – 72 Edificio 13 35 \nLocales 110 al 112 Bogotá, D.C.  \nCódigo Postal 110311156\nNit.: 900.467.239-2\nLínea de Orientación y Contacto Ciudadano: 57 (1) 2540100 / 018000112998 PBX: 57 (1) 2540111\nwww.anla.gov.co    Email: licencias@anla.gov.co  \nPágina 11 de 23\nPRUEBAS\nAllego a su despacho los siguientes documentos: \n<0000>\nAnexo 1: Informe de Muestreo de Afloramientos de Hidrocarburos en inmediaciones del Campo \nMedina – Bloque Cóndor. \n<0000>\nAnexo 2: Resultados de Análisis de Laboratorio Muestras del Bloque Cóndor - Cromatografía de \nGas de Alta Resolución de Fluidos Hidrocarburos, SGS OIL, Gas & Chemicals Division, año 2019 \n<0000>\nAnexo 3: Informe Análisis de Muestras de Afloramientos Campo Medina Bloque Cóndor, año 2019. \n<0000>\nAnexo 4: Análisis Composicional de Fluido Atmosférico para Nikoil Energy Corp. Sucursal \nColombia, muestra de afloramiento, empresa CORELAB RESERVOIR OPTIMIZATION, año 2019 \n<0000>\nAnexo 5: Mapa de la ANH sobre Afloramientos Naturales de Hidrocarburos en Colombia. \n<0000>\nAnexo 6: Inventario Preliminar de Rezumaderos de Hidrocarburos en Colombia por la ANH. \n<0000>\nAnexo 7: Radicado de ANLA 2022131273-1-000 de 28 de junio de 2022. \n<0000>\nAnexo 8: Informe Final de Diseño de una Red de Monitoreo de Aguas Subsuperficiales y Estudio \nHidrogeológico en el sitio de los Afloramientos de Hidrocarburos en veredas Caño Grande y Río \nChiquito de San Luis de Gaceno, Junio de 2022.\n1.2.Consideraciones de esta Autoridad Nacional:\nFrente a la solicitud realizada por la sociedad NIKOIL ENERGY CORP. SUC. COLOMBIA, se realizó \nuna revisión de las pruebas presentadas en el escrito de recurso bajo el radicado 2022292697-1-000 \ndel 27 de diciembre de 2022; producto del cual se emitió el concepto técnico 653 del 23 de febrero de \n2023, en el cual se realizan las siguientes consideraciones técnicas: \n“Con ocasión de la lectura y valoración de la argumentación presentada por la Sociedad NIKOIL ENERGY \nCORP. SUC. COLOMBIA, como parte del Recurso de Reposición interpuesto contra la Resolución 2969 del \n14 de diciembre de 2022 (por la cual se imponen medidas ambientales adicionales al proyecto CAMPO DE \nPRODUCCIÓN DE HIDROCARBUROS MEDINA, Expediente ANLA LAM4273); esta Autoridad se permite \nmanifestar que las tesis expuestas se presentan de manera generalizada y transversal hacia la totalidad del \nActo Administrativo antes referido:\n“… presentamos mediante el presente escrito RECURSO DE REPOSICIÓN contra la Resolución 02969 \nde 14 de diciembre de 2022, proferida por la Autoridad Nacional de Licencias Ambientales (ANLA)”.\nEn este sentido, no se encuentra una relación directa de argumentación que exponga motivos, pruebas, \nesclarecimiento o explicación, referentes a los ítems o numerales que integran el articulado de la parte \nresolutiva en la Resolución 2969 del 14 de diciembre de 2022.\nPor lo anterior, esta Autoridad Nacional se pronunciará de manera general, presentando a continuación las \nconsideraciones que tengan lugar en torno a los argumentos presentados por la Sociedad en su Recurso \nde Reposición:\n<0000>\nEn relación con el argumento presentado por la Sociedad:\n“…la aparición de estos afloramientos comenzó a ser reportada hacia el año 2015, justamente \ncuando NIKOIL no se encontraba adelantando operaciones en el bloque, por cuanto el cese de \nactividades operativas se dio desde julio de 2014 hasta noviembre de 2017.”\nEs importante resaltar que en el área del proyecto no coexisten otros proyectos de exploración y/o \nexplotación de hidrocarburos, o similar, como pueden ser ductos para el transporte de hidrocarburos o \nestaciones de servicio. En este sentido, la Sociedad es la única Empresa en la zona dedicada a la \nactividad petrolera; así mismo, según la información suministrada a esta Autoridad Nacional por la \nSociedad y consignada en el Expediente LAM4273, se realizaron actividades de workover, entre las \nque se encuentra el workover ejecutado durante el segundo semestre del año 2013 y principios del año \n2014, para Cóndor 1 (Junio 2 al 11 del 2013), en Cóndor 2 (Junio 19 a Julio 3 del 2013) y en Medina 1 \n(Julio 3 a Agosto 15 del 2013 y 1 Diciembre del 2013 a Enero 11 del 2014), que conforme lo expuesto \npor la comunidad de la zona en las diferentes visitas realizadas por la ANLA, los afloramientos \n\nResolución No.  00588           Del   23 de marzo de 2023            Hoja No. 12 de 23\n““Por la cual se resuelve un recurso de reposición interpuesto contra la Resolución 2969 de \n14 de diciembre de 2022\nOficinas: Carrera 13 A No. 34 – 72 Edificio 13 35 Pisos 8 Bogotá, D.C.\nCentro de Orientación y Radicación de Correspondencia: Carrera 13 A No. 34 – 72 Edificio 13 35 \nLocales 110 al 112 Bogotá, D.C.  \nCódigo Postal 110311156\nNit.: 900.467.239-2\nLínea de Orientación y Contacto Ciudadano: 57 (1) 2540100 / 018000112998 PBX: 57 (1) 2540111\nwww.anla.gov.co    Email: licencias@anla.gov.co  \nPágina 12 de 23\nempezaron a presentarse en el año 2014, pero las quejas de su aparición fueron presentadas \ninicialmente a la Corporación y posteriormente a la ANLA.\nAsimismo, en reunión del Puesto de Mando Unificado - PMU sostenida el 22 de junio de 2022, como \nen la denuncia con número de radicado ANLA 2022148264-1-000 del 18 de julio de 2022 en su numeral \n5, la comunidad señaló como posible responsable de la aparición de los afloramientos a la Sociedad, \nmencionando hechos presentados durante el workover especialmente del Pozo Medina, indicando lo \nsiguiente: \n“Teniendo en cuenta los testimonios recolectados de la gente que reside en el sector y que para \nfinales del año 2013 e inicios del 2014 se encontraban laborando en el campo medina, \nmanifiestan que para esa época el pozo Medina 1 se encontraba produciendo de manera natural \nun poco producción de hidrocarburo por tanto la empresa realizó una intervención de una posible \nfracturación hidráulica que consistía en inyectarle lo que presuntamente era Nitrógeno teniendo \nen cuenta que eran unas capsulas que emanaban como un humo, este era inyectado con una \nsonda para estimularlo y aumentar la producción, sin embargo al momento de realizar dicha \nactividad hubo un derrumbe interno en el pozo y provoco su taponamiento, a lo cual la empresa \ndetermino dejar quieto el pozo ya que no volvió a producir y coincidencialmente meses después \nempezaron a aparecer los afloramientos en los predios mencionados en el numeral 2 al 4 y que \nse encuentran cerca a dicho pozo”.\n<0000>\nEn cuanto al argumento recurrente de la Sociedad relacionando el calificativo de afloramientos \nnaturales:\n“(…) afloramientos naturales de hidrocarburos en predios privados (…)\nSe hace necesario reiterar que esta Autoridad Nacional ya se pronunció en el Concepto Técnico 5703 \ndel 20 de septiembre de 2021 acogido mediante el Auto 10045 del 23 de noviembre de 2021, concepto \nque a su vez sirvió como soporte para proferir la Resolución 00455 del 25 de febrero de 2022, \nconcluyendo lo siguiente1:\n(…) “se debe señalar que una vez revisada la información existente para el proyecto y realizando \nun análisis de la posibilidad de migración de los hidrocarburos desde las diferentes alternativas \nde origen, como son el bloque ubicado al SE del sistema de fallas de Guaicaramo, las capas de \nla formación Carbonera C1 ubicadas en el flanco Noroccidental del anticlinal del Guavio, las \nestructuras de la formación Carbonera C1 al NE y al SO del anticlinal del Guavio, desde el \nyacimiento y desde los segmentos inferiores de la Formación Carbonera, se pudo concluir que \nno existen rutas de migración que con un grado de probabilidad o posibilidad razonable hayan \nconducido a las acumulaciones o afloramientos que se encuentran en los alrededores de los \npozos Condor de manera natural. Por lo anterior ESTA AUTORIDAD CONCLUYE QUE LOS \nAFLORAMIENTOS NO TIENEN UN ORIGEN NATURAL.” Negrita fuera de texto. \n<0000>\nFrente al argumento del recurrente: \n“(…) la ANH ha realizado estudios de identificación, mapeo y análisis de los rezumaderos \n(afloramientos) existentes en Colombia (Anexo 5), y en la gráfica se encuentran más de 150 \nafloramientos de crudo, asfalto y gas en todo el territorio colombiano, sin incluir la Isla de San \nAndrés y Providencia, los cuales, de acuerdo con el concepto técnico de la Entidad SON \nENTERAMENTE NATURALES, y no corresponden a una consecuencia de la actividad \ndesarrollada por NIKOIL en el área. De acuerdo con el concepto de la Entidad, existe presencia \nde los afloramientos incluso en sitios donde no existe actividad de hidrocarburos ni de carácter \nexploratorio ni de explotación. Una vez más, haciendo mención al mapa proferido por el área \n1 Concepto Técnico 5703 del 20 de septiembre de 2021. Capítulo 3.2.1 Medio Abiótico, “Análisis de proveniencia de los \nafloramientos de hidrocarburos por migraciones verticales de las formaciones profundas de Carbonera hacia el Carbonera \nC1.” Pág. 35.\n\nResolución No.  00588           Del   23 de marzo de 2023            Hoja No. 13 de 23\n““Por la cual se resuelve un recurso de reposición interpuesto contra la Resolución 2969 de \n14 de diciembre de 2022\nOficinas: Carrera 13 A No. 34 – 72 Edificio 13 35 Pisos 8 Bogotá, D.C.\nCentro de Orientación y Radicación de Correspondencia: Carrera 13 A No. 34 – 72 Edificio 13 35 \nLocales 110 al 112 Bogotá, D.C.  \nCódigo Postal 110311156\nNit.: 900.467.239-2\nLínea de Orientación y Contacto Ciudadano: 57 (1) 2540100 / 018000112998 PBX: 57 (1) 2540111\nwww.anla.gov.co    Email: licencias@anla.gov.co  \nPágina 13 de 23\ntécnica de la ANH, es posible que en el área del municipio de San Luis de Gaceno se identificaran \nvarios rezumaderos naturales de hidrocarburos”.\n “(…) de acuerdo con el Inventario Preliminar de Rezumaderos de Hidrocarburos en Colombia, \npublicado en la página web de la ANH, se puede observar que actualmente existen más de 1800 \nrezumaderos naturales en Colombia, de los cuales, más de 140 están ubicados en el \ndepartamento de Boyacá y la mayoría de ellos, en sitios donde no hay actividades de explotación \nde hidrocarburos (Anexo 6), con lo cual se afirma lo concluido en el estudio técnico adelantado \npor NIKOIL, que la proveniencia y origen de este tipo de afloramiento es enteramente natural, no \nocasionado por la actividad desarrollada en los pozos aludidos en la comunicación de la ANLA”.\nEsta Autoridad Nacional ha indicado y concluido que los afloramientos no tienen un origen natural, como \nse explicó antes en este Concepto Técnico. Adicionalmente, en el Concepto Técnico 5788 del 23 de \nseptiembre de 2022 acogido mediante Auto 10451 del 23 de noviembre de 2022 y Resolución 2969 del \n14 de diciembre de 2022, se indicó que el mapa de inventario de rezumaderos de Colombia (ANH) \nidentifica manifestaciones de hidrocarburos en superficie a una escala regional y, como se ha \nidentificado en otras zonas de interés ambiental con relación a la presencia de rezumaderos, muchas \nde estas manifestaciones no se encuentran cartografiadas en esa base de datos, encontrándose en su \ngran mayoría, alineadas a estructuras principales como fallas y ejes de pliegues anticlinales.\nPor otra parte, y como se ha venido especificando, se ha concluido que las estructuras, como el \nanticlinal del Guavio, pertenecen a un sistema de estructuras en donde “no existen rutas de migración \nque con un grado de probabilidad o posibilidad razonable hayan conducido a las acumulaciones o \nafloramientos que se encuentran en los alrededores de los pozos Condor de manera natural”. \nAsimismo, en el Documento 2021IE1175, Concepto Técnico realizado por CORPOCHIVOR, \nMemorando 120 del 12/05/2021 con No. EXPEDIENTE: 2014ER222, en la página 21, se indica en \nrespuesta al análisis de rezumaderos identificados por la Agencia Nacional de Hidrocarburos que:\n“Los rezumaderos más cercanos a los afloramientos identificados en Horizontes, se ubican a 7,8 \nkm de tipo Gas en el municipio de Medina y a 21,3 km de tipo Petróleo en el municipio de Santa \nMaría. Ver Mapa de ubicación de rezumaderos respecto al mapa de rezumaderos de la ANH \n(Figura 8)”.\nFinalmente, vale la pena resaltar que el Anexo 5 Mapa de la ANH sobre Afloramientos Naturales de \nHidrocarburos en Colombia tiene fecha de publicación del 22 de noviembre del 2010, siendo esto \nanterior a las fechas de radicación de quejas y aparición de afloramientos de hidrocarburos en el área \nde interés. Por lo anterior, estas consideraciones están en línea con la conclusión que los rezumaderos \nno tienen un origen natural.\nLocalización Pozos Condor 1 y Medina 1 y su distancia respecto al Rezumadero más cercano \nreportado por la ANH.\nFuente: Equipo de Servicios Geoespaciales – SSLA ANLA, 2023\n\nResolución No.  00588           Del   23 de marzo de 2023            Hoja No. 14 de 23\n““Por la cual se resuelve un recurso de reposición interpuesto contra la Resolución 2969 de \n14 de diciembre de 2022\nOficinas: Carrera 13 A No. 34 – 72 Edificio 13 35 Pisos 8 Bogotá, D.C.\nCentro de Orientación y Radicación de Correspondencia: Carrera 13 A No. 34 – 72 Edificio 13 35 \nLocales 110 al 112 Bogotá, D.C.  \nCódigo Postal 110311156\nNit.: 900.467.239-2\nLínea de Orientación y Contacto Ciudadano: 57 (1) 2540100 / 018000112998 PBX: 57 (1) 2540111\nwww.anla.gov.co    Email: licencias@anla.gov.co  \nPágina 14 de 23\n<0000>\nEn cuanto al argumento sobre: \n“(…) Campo Medina es un anticlinal con cierre en todas las direcciones, y donde el reservorio \nproductor (Mirador), está a una profundidad de 8556 ft en el subsuelo. Una migración hacia la \nsuperficie es una trayectoria larga donde, se esperaría que el petróleo saliera crudo, con las \nmismas características que presenta el extraído de los pozos en el tanque de almacenamiento, \nsin ser refinado, argumento técnico que solicitamos sea tenido en cuenta de igual forma y \nexonerar en este caso a NIKOIL de la responsabilidad derivada de los afloramientos en el área”\nEsta Autoridad Nacional resalta que en el Concepto Técnico 05703 del 20 de septiembre de 2021 \nacogido mediante el Auto 10045 del 23 de noviembre de 2021, se realiza un análisis de la posibilidad \nde migración de los hidrocarburos desde las diferentes alternativas de origen y se concluye:\n“… no existen rutas de migración que con un grado de probabilidad o posibilidad razonable hayan \nconducido a las acumulaciones o afloramientos que se encuentran en los alrededores de los \npozos Condor de manera natural. Por lo anterior ESTA AUTORIDAD CONCLUYE QUE LOS \nAFLORAMIENTOS NO TIENEN UN ORIGEN NATURAL y considera pertinente contar con \ninformación de carácter operativo que permita construir un análisis de causalidad entre \nlas actividades de explotación realizadas en el pasado en el proyecto y el comportamiento \nde los afloramientos de hidrocarburos en los alrededores de los pozos Condor”\n<0000>\nEn relación con los argumentos relacionados con los estudios presentados por la Sociedad en los que \nseñala que: \n“(…) la compañía … atendió oportunamente y con fundamentos científicos y técnicos tan sólidos \nque le representaron respuestas favorables por parte de la jurisdicción en los procesos jurídicos \nanteriormente mencionados.\nNIKOIL adelantó de manera eficiente estudios que permitieron concluir que el hidrocarburo \npresente en los manaderos naturales de hidrocarburos tiene características físico químicas \ntotalmente diferentes al hidrocarburo presente en el yacimiento del Bloque Cóndor. Por lo tanto, \npese a las insistentes comunicaciones que hemos atendido, no existe relación alguna entre los \nafloramientos naturales que se han presentado cerca del área de influencia de nuestro proyecto \ny el yacimiento producido en el mismo.\nNIKOIL, se permite informar a la ANLA que, desde el año 2018 hasta la fecha se han realizado \nlos siguientes estudios en la zona de los afloramientos naturales de hidrocarburos en las veredas \nCaño Grande y Río Chiquito del municipio de San Luis de Gaceno, Boyacá:\n- Informe de Muestreo de Afloramientos de Hidrocarburos en inmediaciones del Campo Medina \n– Bloque Cóndor, año 2018, (Anexo 1).\n- Resultados de Análisis de Laboratorio muestras del Bloque Cóndor - Cromatografía de Gas \nde Alta Resolución de Fluidos Hidrocarburos, SGS Oil, Gas & Chemicals Division, año \n2019, (Anexo 2).\n- Informe Análisis de Muestras de Afloramientos Campo Medina Bloque Cóndor, año 2019, \n(Anexo 3).\n- Análisis Composicional de Fluido Atmosférico para Nikoil Energy Corp. Sucursal Colombia, \nMuestra de afloramiento, empresa CoreLab Reservoir Optimization, año 2019, (Anexo 4).”\nLa Sociedad allega los siguientes documentos como pruebas:\n-Anexo 1: Informe de Muestreo de Afloramientos de Hidrocarburos en inmediaciones del \nCampo Medina – Bloque Cóndor.\n-Anexo 2: Resultados de Análisis de Laboratorio Muestras del Bloque Cóndor - Cromatografía \nde Gas de Alta Resolución de Fluidos Hidrocarburos, SGS OIL, Gas & Chemicals Division, \naño 2019.\n-Anexo 3: Informe Análisis de Muestras de Afloramientos Campo Medina Bloque Cóndor, año \n2019.\n\nResolución No.  00588           Del   23 de marzo de 2023            Hoja No. 15 de 23\n““Por la cual se resuelve un recurso de reposición interpuesto contra la Resolución 2969 de \n14 de diciembre de 2022\nOficinas: Carrera 13 A No. 34 – 72 Edificio 13 35 Pisos 8 Bogotá, D.C.\nCentro de Orientación y Radicación de Correspondencia: Carrera 13 A No. 34 – 72 Edificio 13 35 \nLocales 110 al 112 Bogotá, D.C.  \nCódigo Postal 110311156\nNit.: 900.467.239-2\nLínea de Orientación y Contacto Ciudadano: 57 (1) 2540100 / 018000112998 PBX: 57 (1) 2540111\nwww.anla.gov.co    Email: licencias@anla.gov.co  \nPágina 15 de 23\n-Anexo 4: Análisis Composicional de Fluido Atmosférico para Nikoil Energy Corp. Sucursal \nColombia, muestra de afloramiento, empresa CORELAB RESERVOIR OPTIMIZATION, \naño 2019.\n-Anexo 5: Mapa de la ANH sobre Afloramientos Naturales de Hidrocarburos en Colombia. \n-Anexo 6: Inventario Preliminar de Rezumaderos de Hidrocarburos en Colombia por la ANH.\n-Anexo 7: Radicado de ANLA 2022131273-1-000 de 28 de junio de 2022. \n-Anexo 8: Informe Final de Diseño de una Red de Monitoreo de Aguas Subsuperficiales y \nEstudio Hidrogeológico en el sitio de los Afloramientos de Hidrocarburos en veredas Caño \nGrande y Río Chiquito de San Luis de Gaceno, Junio de 2022.\nEs importante mencionar que varios de estos estudios relacionados en los Anexos 1 a 8, previamente \ny en varias oportunidades, han sido presentados por la Sociedad a esta Autoridad; por lo que \nreiterativamente la ANLA ha incluido como parte de sus consideraciones, que dichos estudios, o los \nextractos de estos, presentados por la Sociedad, en ningún caso son considerados como concluyentes \no suficientes para determinar que los rezumaderos deben considerarse como naturales. Nuevamente, \nse presenta a continuación una recopilación de las consideraciones realizadas por la ANLA frente a los \nestudios mencionados: \nLos documentos referidos como Anexo 1, Anexo 2, Anexo 3 y Anexo 4, fueron presentados como \nsoportes del Recurso de Reposición interpuesto contra la Resolución 455 del 25 de febrero de 2022 \n(Radicado ANLA 2022044932-1-000 del 10 de marzo de 2022). Así las cosas, en el Concepto Técnico \n2393 del 5 de mayo de 2022 acogido mediante la Resolución 1015 del 16 de mayo de 2022, se \nincluyeron las explicaciones y razones pertinentes por las cuales esta Autoridad Nacional no consideró \nlos estudios y argumentos entregados como válidos para soportar de manera suficiente los argumentos \npresentados por NIKOIL ENERGY CORP SUC. \nA continuación, se reitera lo ya manifestado a la Sociedad en el mencionado Concepto Técnico:\nTal como se indicó en el Concepto Técnico 01940 del 31 de marzo de 2020, acogido por el Auto 9060 \ndel 15 de septiembre de 2020 (ambos del Expediente LAM2981) y tenido en cuenta como soporte para \nproferir la Resolución 455 del 25 de febrero de 2022; en relación con la información allegada por NIKOIL \nENERGY CORP SUC COLOMBIA sobre los resultados del análisis de la cromatografía de gases \nentregados a esta Autoridad Nacional: \n“Se realizó el muestreo en tres corrientes de agua, una de estas muestras no presentó la cantidad \nde hidrocarburo suficiente para realizar los ensayos de laboratorio, por lo tanto, se tienen dos \nmuestras para análisis de laboratorio de un total de seis afloramientos reportados. La muestra \n4.01A es la obtenida en el predio Villa Luz propiedad del señor Dumar Martínez y la muestra 4.03 \nes la obtenida en el predio las banquetas propiedad del señor Salvador Ávila.\nEn el informe de resultados de laboratorio del SGS se menciona “se analizó la muestra 4.04 \nenviada por Nikoil a nuestro laboratorio del pozo Cóndor-1 por el mismo método”; sin embargo, \nno se indica la cadena de custodia de la muestra, donde se pueda consultar la identificación de \nla muestra, fecha, hora, las personas que participaron en el muestreo, manejo y envío de muestra.\nLas muestras fueron analizadas por cromatografía de gases de alta resolución de crudo total \n(Whole Oil High Resolution GC). Los resultados del laboratorio SGS indican: “Según los \nresultados analizados, las muestras 4.01A y 4.03 se parecen más a un aceite que a un refinado. \nLa mayoría de los compuestos livianos no se encuentran en la composición, pero esto podría ser \nel resultado del contacto con agua de las muestras y un poco de biodegradación”, “Los \ncromatogramas obtenidos de la cromatografía de gases de alta resolución (HRGC) muestran que \nhay algunas diferencias entre la muestra 4.04 y las muestras 4.03 / 4.01A\". Estos resultados \nestán acordes a lo descrito anteriormente con respecto a los procesos de lavado, evaporación y \noxidación que se pueden estar presentando en los hidrocarburos de los manaderos donde se \nmanifiesta un enriquecimiento de la fracción pesada y empobrecimiento de la fracción liviana.\nPor otra parte, no es posible probar la diferencia entre la muestra 4.04 y las muestras 4.03/4.01A, \nya que, además de no presentar la cadena de custodia de la muestra 4.04, no se presenta el \n\nResolución No.  00588           Del   23 de marzo de 2023            Hoja No. 16 de 23\n““Por la cual se resuelve un recurso de reposición interpuesto contra la Resolución 2969 de \n14 de diciembre de 2022\nOficinas: Carrera 13 A No. 34 – 72 Edificio 13 35 Pisos 8 Bogotá, D.C.\nCentro de Orientación y Radicación de Correspondencia: Carrera 13 A No. 34 – 72 Edificio 13 35 \nLocales 110 al 112 Bogotá, D.C.  \nCódigo Postal 110311156\nNit.: 900.467.239-2\nLínea de Orientación y Contacto Ciudadano: 57 (1) 2540100 / 018000112998 PBX: 57 (1) 2540111\nwww.anla.gov.co    Email: licencias@anla.gov.co  \nPágina 16 de 23\nresultado de laboratorio de dicha muestra y solamente se tiene una imagen donde se compara el \nperfil cromatográfico composicional. La técnica analítica de cromatografía de gases de alta \nresolución de crudo total (Whole Oil High Resolution GC) identifica los compuestos n-alcanos y \nuna gran cantidad de isoprenoides; con estos resultados de laboratorio es posible identificar \nsimilitudes o diferencias entre hidrocarburos. De esta manera, se puede emplear el método \nfingerprint para obtener correlaciones entre crudo – crudo, procesos de biodegradación y poder \ndistinguir el yacimiento de donde provienen los hidrocarburos. Algunas de las relaciones más \nutilizadas para determinar diferencias o similitudes entre hidrocarburos son las siguientes:\n-\nPristano / n-C17, Fitano/n-18: permiten indicar la evolución debido a la estabilidad superior \nde los hidrocarburos isoprenoides frente a los n-alcanos. \n-\nPristano/Fitano: las altas concentraciones de pristano con relación a fitano es un indicativo \npara determinar el origen biogénico.\n-\nCPI (índice de preferencia del carbono): permite conocer el grado de madurez térmica de \nroca madre. Por ejemplo, existe una fuerte predominancia de n-parafinas con números \nimpares de los átomos de carbonos en la materia orgánica presente en los sedimentos \nrecientes.\nCon estas relaciones se puede colegir que las muestras de los manaderos son similares tanto en \nel perfil cromatógrafo composicional como en las relaciones de isoprenoides/nalcanos y en el \níndice de preferencia del carbono CPI.\nEn segundo lugar, se presenta el resultado composicional preliminar de un fluido atmosférico \nrealizado por el laboratorio CoreLab. El resultado hace referencia a una muestra de la cual no se \ntiene información de la cadena de custodia, no se presenta la identificación, ubicación geográfica, \nfecha, hora, personas que participaron en el muestreo, manejo y envío de muestra.\nLos resultados del laboratorio CoreLab indican: “La muestra indican que posiblemente es un \ndiésel por el grado de densidad API (41,21°) y por el rango de destilación de 350 - 650°F”. Sin \nembargo, es posible encontrar crudos con densidades °API de 40 que no son necesariamente \nproductos refinados como el diésel, y el rango de destilación de 350 – 650°F (176,7 – 343,3 °C) \ntampoco es un indicativo de identificación de sustancia ya que este rango es amplio.”\nConsiderando lo anterior, respecto al documento “Análisis Composicional de Fluido Atmosférico para \nNikoil Energy Corp. Sucursal Colombia, Muestra de afloramiento, empresa CoreLab Reservoir \nOptimization, año 2019, (Anexo 4)”, es evidente que las conclusiones del informe aluden una \nposibilidad de ser un diésel de características refinadas sin una suficiente certeza que así sea. Esta \nsituación fue relacionada en los argumentos del Numeral 9.1.2 Afloramientos Gas del Concepto \nTécnico 05788 del 23 de septiembre de 2022 acogido por la Resolución 2969 del 14 de diciembre de \n2022.\nCabe resaltar que los estudios solicitados en la Resolución 00455 del 25 de febrero de 2022 \nconfirmados en el artículo segundo Resolución 01015 del 16 de mayo de 2022 y los establecidos en \nla Resolución 2969 del 14 de diciembre de 2022, son fundamentales para correlacionar la procedencia \ne interacción de los hidrocarburos en los pozos de producción y los afloramientos presentes en el área \nde influencia del proyecto donde se involucran los procesos de lavado, partición, migración o difusión, \nbiodegradación, evaporación y oxidación de los compuestos en las fases liviana, saturada y aromática, \ny se reitera que el estudio “Análisis Composicional de Fluido Atmosférico para Nikoil Energy Corp. \nSucursal Colombia, Muestra de afloramiento, empresa CoreLab Reservoir Optimization, año 2019, \n(Anexo 4).” mencionado en las pruebas del recurso de reposición ya analizados y verificados en los \nactos administrativos precitados, no soporta de manera suficiente los argumentos presentados por \nNIKOIL.\nEn adición, el informe en mención en su sección B en lo concerniente con el “Resumen de las Muestras \nRecibidas y Análisis Composicional” hace referencia a la muestra de afloramiento numero 1.01 recibida \nel 29 de marzo de 2019, muestra sin cadena de custodia ni relación aparente con los muestreos (4.01A, \n4.01B, 4.02 y 4.03) realizados y especificados en el Anexo 1: Informe de Muestreo de Afloramientos \nde Hidrocarburos en inmediaciones del Campo Medina – Bloque Cóndor. Además, y como ya se indicó, \n\nResolución No.  00588           Del   23 de marzo de 2023            Hoja No. 17 de 23\n““Por la cual se resuelve un recurso de reposición interpuesto contra la Resolución 2969 de \n14 de diciembre de 2022\nOficinas: Carrera 13 A No. 34 – 72 Edificio 13 35 Pisos 8 Bogotá, D.C.\nCentro de Orientación y Radicación de Correspondencia: Carrera 13 A No. 34 – 72 Edificio 13 35 \nLocales 110 al 112 Bogotá, D.C.  \nCódigo Postal 110311156\nNit.: 900.467.239-2\nLínea de Orientación y Contacto Ciudadano: 57 (1) 2540100 / 018000112998 PBX: 57 (1) 2540111\nwww.anla.gov.co    Email: licencias@anla.gov.co  \nPágina 17 de 23\nlos resultados obtenidos por el laboratorio CoreLab  son contradictorios con los resultados de los \nanálisis de cromatografía Anexo 2 Resultados de Análisis de Laboratorio Muestras del Bloque Cóndor \n- Cromatografía de Gas de Alta Resolución de Fluidos Hidrocarburos, SGS OIL, Gas & Chemicals \nDivision, año 2019, que, en cuanto en el primero (fluido atmosférico) la sustancia analizada se puede \ntratar de un Diesel y en el segundo (cromatografía), las muestras 4.01A y 4.03 se parecen más a un \naceite que a un refinado. \nRespecto a lo anterior, es importante resaltar que la ausencia de soportes y trazabilidad sobre la \ncustodia y los resultados de análisis aumenta la incertidumbre sobre toda conclusión alusiva a dichos \nresultados, de conformidad con la norma técnica ISO/IEC 17025:2017 en la cual se soportan las \nacreditaciones de cualquier laboratorio que realiza muestreos de contaminantes, reforzando así lo ya \nindicado previamente respecto a los resultados del “Análisis Composicional de Fluido Atmosférico para \nNikoil Energy Corp. Sucursal Colombia, Muestra de afloramiento, empresa CoreLab Reservoir \nOptimization, año 2019, (Anexo 4).” los cuales no soportan los argumentos de NIKOIL.\nTeniendo en cuenta las inconsistencias encontradas en los estudios presentados por NIKOIL, estos \nno aportan información complementaria a la ya evaluada por lo cual no es posible realizar una \nverificación adicional; por lo anterior, para la ANLA es necesario que la Sociedad además de dar \nrespuesta a las obligaciones establecidas en Numeral 1 del Artículo Segundo de la Resolución 00455 \ndel 25 de febrero de 2022 confirmadas en el Artículo Segundo de la Resolución 01015 del 16 de mayo \nde 2022, de manera complementaria debe dar respuesta a cada una de las obligaciones adicionales \nimpuestas para la caracterización de los contaminantes establecidos en la Resolución 2969 del 14 de \ndiciembre de 2022, para poder así establecer el grado de contaminación causada por los afloramientos \nsobre los cuales ya se ha indicado no tienen un origen natural. \nEs necesario recalcar nuevamente la conclusión presentada en la parte considerativa de la Resolución \n1015 del 26 de mayo de 2022 (“por medio de la cual se resuelve recurso de reposición interpuesto \ncontra la Resolución 0455 del 25 de febrero de 2022”), en cuanto a la pertinencia de los estudios \npresentados por la Sociedad:\n“… esta Autoridad Nacional considera que los análisis presentados por NIKOIL ENERGY CORP \nSUC COLOMBIA en los documentos “Anexo 3. Informe de Campo SGS (Field Report – \n16/05/2018)”, “ANEXO 2, RESULTADOS DE ANÁLISIS DE LABORATORIO MUESTRAS DEL \nBLOQUE CÓNDOR - CROMATOGRAFÍA DE GAS DE ALTA RESOLUCIÓN DE FLUIDOS \nHIDROCARBUROS, SGS OIL, GAS & CHEMICALS DIVISION, AÑO 2019” y “ANEXO 4 \nANÁLISIS COMPOSICIONAL DE FLUIDO ATMOSFÉRICO PARA NIKOIL ENERGY CORP. \nSUCURSAL COLOMBIA, MUESTRA DE AFLORAMIENTO, EMPRESA CORELAB \nRESERVOIR OPTIMIZATION, AÑO 2019”, no cumplen con las características necesarias para \nconcluir que el fluido presente en los afloramientos no está relacionado con el hidrocarburo que \nse extrae en Campo Medina, como ya se había concluido por parte de esta Autoridad en líneas \nanteriores.” \n<0000>\nFinalmente, respecto del argumento concluyente de la Sociedad en el que señala:\n“De manera que, NIKOIL reitera las respuestas dadas a los autos mencionados anteriormente e \ninforma respetuosamente a la ANLA que, debido a proceso en el TRIBUNAL ADMINISTRATIVO \nDE BOYACÁ -TAB, este Tribunal dispuso unas medidas cautelares a NIKOIL con respecto a los \nafloramientos naturales de hidrocarburos en predios privados de las veredas mencionadas \nanteriormente del municipio de San Luis de Gaceno, Boyacá, para lo cual NIKOIL contrató con \nuna empresa especializada El Diseño y Construcción de una Red de Monitoreo de Aguas \nSubsuperficiales y Estudio Hidrogeológico en el área de los Afloramientos de Hidrocarburos en \npredios privados de las veredas Caño Grande y Río Chiquito, dando como resultado que dichos \nafloramientos SON DE PROCEDENCIA NATURAL Y NO PRRODUCTO DE LAS ACTIVIDADES \nDE EXPLOTACIÓN DE HIDROCARBUROS DEL CAMPO MEDIONA. Estudio que fue radicado \nante ANLA el 28 de junio de 2022 con radicación: 2022131273-1-000. (Anexo 7). (…) La ejecución \nde nuevas medidas de seguimiento, resultan supremamente onerosas, e improcedentes, sobre \ntodo teniendo en cuenta que para este tipo de fenómenos la normativa ambiental vigente en el \nPaís es bastante clara, precisa y objetiva, como lo es la Ley 99 de 1993 que establece para estos \n\nResolución No.  00588           Del   23 de marzo de 2023            Hoja No. 18 de 23\n““Por la cual se resuelve un recurso de reposición interpuesto contra la Resolución 2969 de \n14 de diciembre de 2022\nOficinas: Carrera 13 A No. 34 – 72 Edificio 13 35 Pisos 8 Bogotá, D.C.\nCentro de Orientación y Radicación de Correspondencia: Carrera 13 A No. 34 – 72 Edificio 13 35 \nLocales 110 al 112 Bogotá, D.C.  \nCódigo Postal 110311156\nNit.: 900.467.239-2\nLínea de Orientación y Contacto Ciudadano: 57 (1) 2540100 / 018000112998 PBX: 57 (1) 2540111\nwww.anla.gov.co    Email: licencias@anla.gov.co  \nPágina 18 de 23\ncasos (CITA LEY 99 DE 93 ART 5 NUMERAL 13, 17 FUNCIONES MINISTERIO, \nCORPORACIÓN ETC…)”\nEs importante destacar que, para el componente hidrogeológico, una vez revisado el ANEXO 7 y 8 \n(“Informe Final de Diseño de una Red de Monitoreo de Aguas Subsuperficiales y Estudio \nHidrogeológico en el sitio de los Afloramientos de Hidrocarburos en veredas Caño Grande y Río \nChiquito de San Luis de Gaceno”), este fue revisado y analizado en el Concepto Técnico 5788 del 23 \nde septiembre de 2022 acogido mediante Auto 10451 del 23 de noviembre de 2022. Si bien el estudio \npresenta aspectos relacionados a la integración geofísica, geológica, hidrológica e hidrogeoquímica \nen un modelo hidrogeológico conceptual, la Autoridad Nacional considera que esta documentación, \nanálisis y discusión del componente hidrogeológico no permiten verificar ni refutar el análisis de \ncausalidad entre las actividades de explotación del proyecto y los afloramientos de hidrocarburos en \nel Campo de Producción Medina, bajo el entendido que el estudio hidrogeológico presentado define la \nunidad hidrogeológica somera, inventario de puntos de agua, dirección de flujo e Hidrogeoquímica del \nagua subterránea, pero no concluye técnicamente el origen de los afloramientos, ni la relación de \nporosidad secundaria asociada al fracturamiento que pueda favorecer migraciones de fluidos de \nunidades yacentes a Carboneara C, tal y como se evidencia en las conclusiones del estudio \npresentado:\n“• De acuerdo al modelo geológico construido en el marco del presente estudio, se concluye la \nbaja probabilidad de migración de fluidos de los intervalos productores de los pozos Condor 1 y \nCondor 2 ST a las unidades hidrogeológicas más superficiales, toda vez que la secuencia de \nunidades hidrogeológicas que se comportan como barreras hidráulicas y aíslan la unidad más \nsuperficial es de más de 800 metros.\n• De acuerdo a la estructura geológica (anticlinal) sobre la cual se encuentran localizados los \npozos Condor 1 y Condor 2ST y cuya existencia ha sido comprobada a través de los registros e \ninterpretaciones sísmicas construidas por la compañía, se puede concluir la presencia de un \nmacizo rocoso diaclasado en la cresta del anticlinal. La anterior situación pudo condicionar la \nmigración de fluidos de la unidad Carbonera C3 a la unidad C1 y presentar así afloramientos \nnaturales de hidrocarburos o rezumaderos naturales.\n• De acuerdo a la exploración geofísicas realizada por GEODA INGENIERÍA a través de Sondeos \nEléctricos Verticales No 9 y 10 localizaos geográficamente en inmediaciones a los afloramientos \nde hidrocarburos reportados en el predio de Salvador Ávila Vanegas, presentan una respuesta \neléctrica que permite inferir un aumento en el espesor de la capa de areniscas o una anomalía \ngeo eléctrica producto de Los afloramientos de hidrocarburos.”\nDe lo anterior, es importante destacar que, la incertidumbre en el escenario de migración del \nhidrocarburo desde los intervalos productores Condor 1 y Condor 2 ST a los acuíferos superficiales es \nmuy alta, por un lado la sociedad manifiesta que el intervalo que se comporta como barrera hidráulica \nes de aproximadamente 800 m, sugiriendo una baja probabilidad de conectividad y desvirtuando la \nhipótesis de surgencias naturales de hidrocarburos, por otro lado continúan diciendo que, la estructura \nde anticlinal corroborada por la sísmica de reflexión puede generar diaclasas que permiten la migración; \nsin embargo, esta afirmación surge de una apreciación regional, afirmaciones que son contradictorias, \ndejando como conclusiones del estudio hidrogeológico apreciaciones que no son contundentes y que no \ndan alcance a lo requerido por esta Autoridad Nacional. Finalmente, también concluyen, que a partir de \nla geofísica realizada se observa lo que puede llegar a ser una anomalía geo eléctrica en el predio del \nseñor Salvador Ávila Vanegas; llegar a esta conclusión a partir de un método unidimensional, si bien \ntiene una incertidumbre alta, tampoco es un argumento contundente para determinar el origen de las \nsurgencias de hidrocarburo y su naturaleza.\nAdicionalmente, es importante destacar que con respecto a los estudios de isotopía requeridos por la \nANLA, para determinar la naturaleza de las surgencias, la sociedad no allega a esta autoridad ningún \navance o evidencia de esta actividad, no presentan resultados de estudios de isotopía u otros, que \nsugieran o no conectividad hidráulica o relación entre el Campo de Producción Medina y los \nafloramientos inventariados; al respecto, es importante indicar que, no es claro ni contundente el análisis \ndel origen de las surgencias de hidrocarburo.\n\nResolución No.  00588           Del   23 de marzo de 2023            Hoja No. 19 de 23\n““Por la cual se resuelve un recurso de reposición interpuesto contra la Resolución 2969 de \n14 de diciembre de 2022\nOficinas: Carrera 13 A No. 34 – 72 Edificio 13 35 Pisos 8 Bogotá, D.C.\nCentro de Orientación y Radicación de Correspondencia: Carrera 13 A No. 34 – 72 Edificio 13 35 \nLocales 110 al 112 Bogotá, D.C.  \nCódigo Postal 110311156\nNit.: 900.467.239-2\nLínea de Orientación y Contacto Ciudadano: 57 (1) 2540100 / 018000112998 PBX: 57 (1) 2540111\nwww.anla.gov.co    Email: licencias@anla.gov.co  \nPágina 19 de 23\nEn concordancia con lo anterior, esta Autoridad Nacional en cumplimiento de las funciones asignadas por \nla Ley, ha requerido a la sociedad NIKOIL ENERGY CORP. SUC. COLOMBIA información técnica detallada, \nque permita dar claridad respecto al origen de los afloramientos y el manejo a los impactos ambientales \ngenerados por dicha problemática en su área de influencia. \nHasta la fecha, la sociedad NIKOIL ENERGY CORP. SUC. COLOMBIA ha entregado solo parte de la \ninformación requerida relacionada con la problemática de afloramientos y como ya se explicó en los párrafos \nanteriores, en reiteradas oportunidades esta Autoridad Nacional le ha informado a la Sociedad, las razones \npor las que la información presentada no brinda certeza para concluir lo argumentado por el Titular de la \nLicencia Ambiental. \nEs claro para esta Autoridad Nacional que la Sociedad ha venido presentado en forma reiterativa \ninformación que ya ha sido valorada y sobre la cual se han presentado las debidas consideraciones \noportunamente. Por lo contrario, no presenta estudios o evidencias que soporte la no existencia de relación \nde causalidad entre las actividades desarrolladas en el Campo de Producción Medina y la ocurrencia del \nfenómeno de afloramientos de hidrocarburo en la vereda Horizontes del municipio de San Luis de Gaceno, \nBoyacá.\nTeniendo en cuenta las consideraciones expuestas por esta Autoridad Nacional en el presente acto \nadministrativo no se considera procedente acceder a las pretensiones del recurrente respecto a revocar el \ncontenido de la Resolución 2969 del 14 de diciembre de 2022; por lo tanto, se conceptúa y recomienda al \ngrupo jurídico, la confirmación de los Artículos Primero, Segundo y Tercero de la Resolución 2969 del 14 de \ndiciembre de 2022.”\nFrente a la manifestación realizada en el escrito del recurso de reposición por el titular de la licencia \nambiental conforme al cual no resulta justificable imponer medidas de manejo adicionales esta \nAutoridad Nacional consideró necesaria su imposición, teniendo en cuenta que fueron identificados \nafloramientos líquidos en las cuencas del caño Grande y rio Chiquito y esto con el fin de conocer los \nposibles impactos que se deriven hacia el recurso hídrico superficial, así como a la hidrobiota asociada \ny las comunidades locales que utilizan el recurso hídrico y se ubican aguas abajo de los sitios de \nafloramientos.\n \nAsí mismo se en la visita de seguimiento se pudo constatar afloramientos de gas los cuales no se \nhabían presentado con anterioridad, de tal manera que con las medidas adicionales impuestas se \nhace necesario determinar la causa que los origina y si están relacionados con los afloramientos \nlíquidos, de tal manera se resalta que esta facultad que otorga la normativa ambiental a esta Autoridad \npara imponer estas medidas, obedece a la necesidad de prevenir, mitigar o corregir impactos que no \nfueron previstos en los estudios ambientales. \nEn igual sentido, además del seguimiento al comportamiento a estos tipos de afloramientos, las \nmedidas que orientan el monitoreo, efectividad de contención, medidas de mitigación, limpieza y \ndemás, que fueron establecidas en el acto recurrido, su propósito conlleva en sí mismo, la prevención \nde eventuales riesgos y/o contingencias ambientales que puedan originarse a causa de los \nafloramientos tanto líquidos como gaseosos, en una temporada por ejemplo de sequía, donde estos \npuedan verse alcanzados por incendios forestales y en la época invernal la afectación de las fuentes \nhídricas aledañas por el transporte de los hidrocarburos que afloran con ocasión de la escorrentía \nsuperficial, por lo que se requirió la contención, control y limpieza, como medidas preventivas y de \nmitigación de los impactos en la zona.    \nEs relevante significar, que el contenido de la Resolución 02969 de 2022, no circunscribe la \njustificación de la imposición de medidas adicionales a la sola identificación o existencia de los \nafloramientos, sino que se fundamenta en que específicamente los afloramientos líquidos afectan \ndirectamente el recurso hídrico, es decir es un impacto generador de contaminación y que igualmente \nimpacta a las comunidades que hacen uso de estas fuentes hídricas y al ecosistema mismo. \n\nResolución No.  00588           Del   23 de marzo de 2023            Hoja No. 20 de 23\n““Por la cual se resuelve un recurso de reposición interpuesto contra la Resolución 2969 de \n14 de diciembre de 2022\nOficinas: Carrera 13 A No. 34 – 72 Edificio 13 35 Pisos 8 Bogotá, D.C.\nCentro de Orientación y Radicación de Correspondencia: Carrera 13 A No. 34 – 72 Edificio 13 35 \nLocales 110 al 112 Bogotá, D.C.  \nCódigo Postal 110311156\nNit.: 900.467.239-2\nLínea de Orientación y Contacto Ciudadano: 57 (1) 2540100 / 018000112998 PBX: 57 (1) 2540111\nwww.anla.gov.co    Email: licencias@anla.gov.co  \nPágina 20 de 23\nAl respecto, es pertinente exponer lo considerado por la Corte Constitucional en la Sentencia T-325 \nde 2017 en relación con el derecho al ambiente sano: \n“La Corte ha atendido a la necesidad que propugna por la defensa del ambiente y de los \necosistemas, por lo que ha calificado al ambiente como un bien jurídico constitucionalmente \nprotegido, en el que concurren las siguientes dimensiones: “(i) es un principio que irradia todo el \norden jurídico en cuanto se le atribuye al Estado la obligación de conservarlo y protegerlo, \nprocurando que el desarrollo económico y social sea compatible con las políticas que buscan \nsalvaguardar las riquezas naturales de la Nación; (ii) aparece como un derecho constitucional de \ntodos los individuos que es exigible por distintas vías judiciales; (iii) tiene el carácter de servicio \npúblico, erigiéndose junto con la salud, la educación y el agua potable, en un objetivo social cuya \nrealización material encuentra pleno fundamento en el fin esencial de propender por el \nmejoramiento de la calidad de vida de la población del país; y (iv) aparece como una prioridad \ndentro de los fines del Estado, comprometiendo la responsabilidad directa del Estado al atribuirle \nlos deberes de prevención y control de los factores de deterioro ambiental y la adopción de las \nmedidas de protección”.\nPor otra parte, la Sociedad en sus argumentos manifiesta que la ejecución de las nuevas medidas de \nseguimiento son improcedentes teniendo en cuenta que para este tipo de fenómenos la normativa \nambiental vigente en el País es bastante clara, precisa y objetiva, como lo es la Ley 99 de 1993 que \nestablece para estos casos: \n“(…) Funciones del Ministerio. Corresponde al Ministerio del Medio Ambiente: \n13) Definir la ejecución de programas y proyectos que la Nación, o ésta en asocio con otras \nentidades públicas, deba adelantar para el saneamiento del medio ambiente o en relación con \nel manejo, aprovechamiento, conservación, recuperación o protección de los recursos \nnaturales renovables y del medio ambiente (…)”. \n17) Contratar, cuando sea necesario para el cumplimiento de sus funciones, la elaboración de \nestudios de investigación y de seguimiento de procesos ecológicos y ambientales y la \nevaluación de estudios de impacto ambiental (…)”. \n35) Hacer evaluación, seguimiento y control de los factores de riesgo ecológico y de los que \npuedan incidir en la ocurrencia de desastres naturales y coordinar con las demás autoridades \nlas acciones tendientes a prevenir la emergencia o a impedir la extensión de sus efectos (…)\nComo lo señala en su escrito el titular de la licencia ambiental, asegura que el hecho físico de los \nafloramientos tiene origen natural y por tal razón considera que corresponde al Estado, en cabeza del \nMinisterio de Ambiente y Desarrollo Sostenible y de la Autoridad Nacional de Licencias Ambientales \nrealizar la ejecución de programas y proyectos que la Nación deba adelantar para el saneamiento del \nmedio ambiente y por ende NO CORRESPONDE A NIKOIL asumir roles y funciones propias de la \nautoridad ambiental en Colombia.\nSobre el particular la ANLA reitera el pronunciamiento realizado en el Concepto Técnico 5703 del 20 \nde septiembre de 2021 acogido mediante el Auto 10045 del 23 de noviembre de 2021 en el cual se \nconcluyó que: no existen rutas de migración que con un grado de probabilidad o posibilidad razonable \nhayan conducido a las acumulaciones o afloramientos que se encuentran en los alrededores de los \npozos Condor de manera natural. Por lo anterior ESTA AUTORIDAD CONCLUYE QUE LOS \nAFLORAMIENTOS NO TIENEN UN ORIGEN NATURAL. Anulado a lo anterior, y teniendo en cuenta \nla problemática social presentada en el territorio por parte de la comunidad del sector Horizontes del \nmunicipio de San Luis de Gaceno, fue necesario la activación del Puesto de Mando Unificado – PMU \npara el municipio, que convocó a diferentes instituciones (Ministerio de Minas y Energía, Agencia \n\nResolución No.  00588           Del   23 de marzo de 2023            Hoja No. 21 de 23\n““Por la cual se resuelve un recurso de reposición interpuesto contra la Resolución 2969 de \n14 de diciembre de 2022\nOficinas: Carrera 13 A No. 34 – 72 Edificio 13 35 Pisos 8 Bogotá, D.C.\nCentro de Orientación y Radicación de Correspondencia: Carrera 13 A No. 34 – 72 Edificio 13 35 \nLocales 110 al 112 Bogotá, D.C.  \nCódigo Postal 110311156\nNit.: 900.467.239-2\nLínea de Orientación y Contacto Ciudadano: 57 (1) 2540100 / 018000112998 PBX: 57 (1) 2540111\nwww.anla.gov.co    Email: licencias@anla.gov.co  \nPágina 21 de 23\nNacional de Hidrocarburos, Servicio Geológico Colombiano, Ministerio de Ambiente y Desarrollo \nSostenible, Corpochivor, Procuraduría de Boyacá, Nikoil Energy).\nEl objetivo del PMU era brindar solución a los afloramientos de hidrocarburos que se han presentado \nen la zona, por lo cual, se realizó una reunión con las comunidades del área de influencia del proyecto \ny autoridades locales el día 22 de junio de 2022, y los días 23 y 24 de junio del mismo año, se hizo \nrecorrido por los diferentes puntos identificados; producto de esa visita de seguimiento la Autoridad \nNacional generó concepto técnico 5788 del 23 de septiembre de 2022 acogido por la Resolución 2969 \nde 14 de diciembre de 2022, objeto el presente pronunciamiento.\nTeniendo en cuenta que NIKOIL ENERGY CORP. SUC. COLOMBIA sustentó el recurso de reposición \nde manera general respecto a las obligaciones impuestas, el análisis realizado por esta Autoridad \nNacional fue de la misma manera; al verificar que los estudios que se aportan como pruebas han sido \npresentados previamente y analizados por esta Autoridad, es decir, no aporta información \ncomplementaria a la ya evaluada. Por lo cual, no es posible realizar una verificación adicional; y sobre \nlos cuales se han realizado las consideraciones correspondientes que han llevado a concluir lo \nmencionado anteriormente respecto del origen no natural de los afloramientos, de manera que se \nconsidera necesario que la Sociedad presente respuesta a las obligaciones establecidas en la \nResolución 2969 de 2022, para poder así establecer el grado de contaminación causada por los \nafloramientos. \nFinalmente, una vez analizados los argumentos técnicos y jurídicos expuestos por la sociedad NIKOIL \nENERGY CORP. SUC. COLOMBIA, en el escrito de recurso interpuesto contra de las disposiciones \nestablecidas en la Resolución 2969 de 14 de diciembre de 2022, esta Autoridad Nacional considera \nprocedente confirmar la totalidad del acto administrativo recurrido, de conformidad con lo establecido \nen el concepto técnico 653 del 23 de febrero de 2023, como puntualmente se indicará en la parte \nresolutiva del presente acto administrativo.\nEn mérito de lo expuesto,\nRESUELVE\nARTÍCULO PRIMERO. Confirmar en su totalidad la Resolución 2969 de 14 de diciembre de 2022, de \nacuerdo con lo expuesto en la parte motiva del presente acto administrativo.\nARTÍCULO SEGUNDO. En el evento en que el titular de la licencia o el permiso, según el caso, sea \nuna persona natural que se acoja al proceso de insolvencia regulado por las normas vigentes, o se \ntrate de una sociedad comercial o de una sucursal de sociedad extranjera que entre en proceso de \ndisolución o régimen de insolvencia empresarial o liquidación regulados por las normas vigentes, \ninformará inmediatamente de esta situación a esta Autoridad, con fundamento, entre otros, en los \nartículos 8, 58, 79, 80, 81, 95 numeral 8 de la Constitución Política de 1991, en la Ley 43 de 1990, en \nla Ley 222 de 1995, en la Ley 1333 de 2009 y demás normas vigentes al y jurisprudencia aplicable. \nPARÁGRAFO. Adicional a la obligación de informar a esta Autoridad de tal situación, el titular de la \nlicencia o permiso aprovisionará contablemente las obligaciones contingentes que se deriven de la \nexistencia de un procedimiento ambiental sancionatorio conforme con el artículo 40 de la ley 1333 de \n2009 o la norma que la adicione, modifique o derogue.\nARTÍCULO TERCERO. Por la Autoridad Nacional de Licencias Ambientales – ANLA, notificar el \ncontenido del presente acto administrativo al Representante Legal o Apoderado debidamente \nconstituido de la sociedad NIKOIL ENERGY CORP. SUC. COLOMBIA, con NIT 830.104.866-1.\n\nResolución No.  00588           Del   23 de marzo de 2023            Hoja No. 22 de 23\n““Por la cual se resuelve un recurso de reposición interpuesto contra la Resolución 2969 de \n14 de diciembre de 2022\nOficinas: Carrera 13 A No. 34 – 72 Edificio 13 35 Pisos 8 Bogotá, D.C.\nCentro de Orientación y Radicación de Correspondencia: Carrera 13 A No. 34 – 72 Edificio 13 35 \nLocales 110 al 112 Bogotá, D.C.  \nCódigo Postal 110311156\nNit.: 900.467.239-2\nLínea de Orientación y Contacto Ciudadano: 57 (1) 2540100 / 018000112998 PBX: 57 (1) 2540111\nwww.anla.gov.co    Email: licencias@anla.gov.co  \nPágina 22 de 23\nARTÍCULO CUARTO. Por la Autoridad Nacional de Licencias Ambientales – ANLA, comunicar el \npresente acto administrativo a la Corporación Autónoma Regional de Chivor - CORPOCHIVOR, a la \nAlcaldía Municipal de San Luis de Gaceno, en el departamento de Boyacá, a la Procuraduría Delegada \npara Asuntos Ambientales, a la Agencia Nacional de Hidrocarburos, al Ministerio de Ambiente y \nDesarrollo Sostenible y al Tribunal Administrativo de Boyacá para su conocimiento y fines pertinentes\nARTÍCULO QUINTO. Publicar la presente Resolución en la Gaceta Ambiental de la Autoridad Nacional \nde Licencias Ambientales - ANLA y copia de la publicación deberá remitirse al expediente LAM4273.\nARTÍCULO SEXTO. Contra el presente acto administrativo no procede recurso alguno de conformidad \ncon lo establecido en el artículo 87 de la Ley 1437 del 18 de enero de 2011 por medio del cual se \nexpidió el Código de Procedimiento Administrativo y de lo Contencioso Administrativo.\nNOTIFÍQUESE, COMUNÍQUESE, PUBLÍQUESE Y CÚMPLASE\nDada en Bogotá D.C., a los 23 de marzo de 2023\nRODRIGO ELIAS NEGRETE MONTES\nDirector General\nEjecutores\nPAULA MILENA CUCUNUBA \nACOSTA\nProfesional Especializado\n \n \nRevisor / L\u0000der\nGERMAN BARRETO ARCINIEGAS\nSubdirector de Seguimiento de \nLicencias Ambientales\n \nNANCY RUBIELA CUBIDES \nPERILLA\nContratista\n \nALEXANDER MARTINEZ \nMONTERO\nAsesor de la Dirección General\n \nSANDRA PATRICIA BEJARANO \nRINCON\nContratista\n \nHERNAN DARIO PAEZ GUTIERREZ\nContratista\n \n \nExpediente LAM4273\nConcepto Técnico 653 del 23 de febrero de 2023\nProceso No.: 2023060354\nArchívese en: LAM4273 \n\nResolución No.  00588           Del   23 de marzo de 2023            Hoja No. 23 de 23\n““Por la cual se resuelve un recurso de reposición interpuesto contra la Resolución 2969 de \n14 de diciembre de 2022\nOficinas: Carrera 13 A No. 34 – 72 Edificio 13 35 Pisos 8 Bogotá, D.C.\nCentro de Orientación y Radicación de Correspondencia: Carrera 13 A No. 34 – 72 Edificio 13 35 \nLocales 110 al 112 Bogotá, D.C.  \nCódigo Postal 110311156\nNit.: 900.467.239-2\nLínea de Orientación y Contacto Ciudadano: 57 (1) 2540100 / 018000112998 PBX: 57 (1) 2540111\nwww.anla.gov.co    Email: licencias@anla.gov.co  \nPágina 23 de 23\nPlantilla_Resolución_SILA_v3_42852\nNota: Este es un documento electrónico generado desde los Sistemas de Información de la ANLA. El original reposa en los archivos digitales de la \nEntidad.\n"
}