{
  "fuente": "ANLA_GACETA",
  "numero_resolución": "RESOLUCIÓN N° 002151",
  "fecha_resolución": "2024-06-18",
  "anio_resolucion": "2024",
  "nombre_proyecto": "Campo de",
  "nombre_proyecto_normalizado": "CAMPO DE",
  "ubicación": "municipio de San Martín,",
  "empresa": "GRAN TIERRA",
  "empresa_normalizada": "GRAN TIERRA",
  "numero_expediente": "LAV0105-00-2014",
  "radicados": [
    "20200389631000",
    "2021135757",
    "20236200309622",
    "20246200755382",
    "2022063181",
    "202460200717552",
    "20246200567462"
  ],
  "descripcion": "Por la cual se resuelve un recurso de reposición interpuesto en contra de la Resolución 1177 del 18 de junio de 2024",
  "tipos_infraccion": [
    "Tala o afectación de bosques",
    "Incumplimiento del PMA"
  ],
  "tipos_infraccion_normalizados": [
    "TALA O AFECTACION DE BOSQUES",
    "INCUMPLIMIENTO DEL PMA"
  ],
  "pdf_id": "48137",
  "file_name": "ANLA_48137.pdf",
  "texto_completo": "AUTORIDAD NACIONAL DE LICENCIAS \nAMBIENTALES\n- ANLA –\nRESOLUCIÓN N° 002151\n(30 SEP. 2024)\nPágina 1 de 56\n“Por la cual se resuelve un recurso de reposición interpuesto en contra de la \nResolución 1177 del 18 de junio de 2024”\nEL DIRECTOR DE LA AUTORIDAD NACIONAL DE LICENCIAS AMBIENTALES – \nANLA\nEn uso de las competencias asignadas en la Ley 99 del 22 de diciembre de 1993, la Ley \n1437 del 18 de enero de 2011, el Decreto-ley 3573 del 27 de septiembre 2011, el Decreto \n1076 del 26 de mayo de 2015, el Decreto 376 de 11 de marzo de 2020, la Resolución \n1957 del 5 de noviembre de 2021 de la ANLA, la Resolución 1223 del 19 de septiembre \nde 2022 del MADS, y, \nCONSIDERANDO:\nQue mediante Resolución 916 del 30 de julio de 2015, la Autoridad Nacional de Licencia \nAmbientales -ANLA, en adelante esta Autoridad Nacional, otorgó Licencia Ambiental Global \na la sociedad UNION TEMPORAL MIDAS para el proyecto denominado “Campo de \nExplotación de Hidrocarburos Acordionero”, localizado en el municipio de San Martín, \ndepartamento del Cesar. \nQue mediante Resolución 215 del 3 de marzo de 2016, esta Autoridad Nacional aclaró las \nobligaciones establecidas en los literales c) y e) del numeral 5 del artículo segundo de la \nResolución 916 del 30 de julio de 2015, entre otras disposiciones. \nQue mediante Resolución 1114 del 29 de septiembre de 2016, esta Autoridad Nacional \nresolvió el recurso de reposición presentado por la sociedad UNIÓN TEMPORAL MIDAS \ncontra la Resolución 215 del 3 de marzo de 2016, en el sentido de corregir un error de \ntrascripción en las coordenadas de las vías sujetas a rehabilitación y mejoramiento, para lo \ncual se modificaron los literales a y b del numeral 1 y el literal d del numeral 5 del artículo \nsegundo de la Resolución 916 del 30 de julio de 2015 respecto a las líneas de flujo.\nQue mediante Resolución 1339 del 8 de noviembre de 2016, esta Autoridad Nacional \nmodificó la Licencia Ambiental Global en el sentido de otorgar concesión de aguas \nsubterráneas para el pozo profundo ubicado en la plataforma Acordionero 1, además de \nincluir algunas fichas del Plan de Manejo Ambiental, entre otros aspectos. \n\nResolución No. 002151       Del 30 SEP. 2024          Hoja No. 2 de 56\n“Por la cual se resuelve un recurso de reposición interpuesto en contra de la \nResolución 1177 del 18 de junio de 2024”\nPágina 2 de 56\nQue mediante Resolución 1549 del 30 de noviembre de 2017, esta Autoridad Nacional \nresolvió́ recurso de reposición interpuesto por la Sociedad contra la Resolución 1339 del 8 \nde noviembre de 2016, en el sentido de confirmar la decisión recurrida. \nQue mediante Resolución 1627 del 14 de diciembre de 2017, esta Autoridad Nacional \nautorizó la cesión total de derechos de la Licencia Ambiental Global otorgada mediante \nResolución 916 de 30 de julio de 2015, sus aclaraciones y modificaciones, para el proyecto \n\"Campo de Explotación de Hidrocarburos Acordionero\", de la UNION TEMPORAL MIDAS \na favor de la sociedad GRAN TIERRA ENERGY COLOMBIA LTD. \nQue mediante Resolución 2001 del 8 de noviembre de 2018, esta Autoridad Nacional \nmodificó la Resolución 916 de 30 de julio de 2015 en relación con la inversión forzosa de \nno menos del 1%, entre otras disposiciones. \nQue mediante Resolución 2312 del 12 de diciembre de 2018, esta Autoridad Nacional \naprobó el Plan de Compensación por pérdida de biodiversidad y compensación por \nafectación de ecosistemas diferentes a los naturales (compensación por cambio de uso de \nsuelo)” para el proyecto. \nQue mediante Resolución 181 del 15 de febrero de 2019, esta Autoridad Nacional modificó \nvía seguimiento el artículo décimo cuarto de la Resolución 916 del 30 de julio de 2015, \nautorizando por un tiempo máximo de seis (6) meses continuar con la prueba piloto de \ninyección de aguas para recobro secundario en el campo de explotación. \nQue mediante Resolución 1014 del 10 de junio de 2019, esta Autoridad Nacional modificó \nla Licencia Ambiental Global, autorizando nuevas actividades, modificando y adicionando \notras. \nQue mediante Resolución 862 del 12 de mayo de 2020, esta Autoridad Nacional aclaró la \nResolución 1014 del 10 de junio de 2019, con relación a la tabla contenida en el literal c) \ndel numeral 2 del artículo segundo, el literal b) de las obligaciones contenidas en el numeral \n5, del artículo quinto, y la tabla de Zonificación de Manejo Ambiental del artículo vigésimo \ntercero, en cuanto a las Zonas de Acuífero de Alta Permeabilidad.\nQue mediante Auto 10662 del 6 de noviembre de 2020, esta Autoridad Nacional avocó \nconocimiento de las actuaciones administrativas remitidas por el Ministerio de Ambiente y \nDesarrollo Sostenible -MADS, obrantes en los expedientes ATV00595, ATV00686 y \nATV00812 allegado mediante radicado ANLA 20200389631000 de 11 de marzo de 2020, \ncontentivo de la autorización de levantamiento de veda, a favor de la sociedad GRAN \nTIERRA ENERGY COLOMBIA LTDA., hoy GRAN TIERRA ENERGY COLOMBIA GMBH \nSUCURSAL COLOMBIA titular de la Licencia Ambiental otorgada para el proyecto \"Campo \nde Explotación de Hidrocarburos Acordionero\".\nQue mediante Resolución 801 del 5 mayo de 2021, esta Autoridad Nacional aceptó la \ncompra de los predios El Porvenir y El Cobre, para la ejecución de la línea de inversión \n“Acciones complementarias, mediante la adquisición de predios y/o mejoras en áreas o \necosistemas de interés estratégico para la conservación de los recursos naturales, al igual \nque en áreas protegidas que hagan parte del Sistema Nacional de Áreas Protegidas – \nSINAP”, modificó el artículo trigésimo quinto de la Resolución 916 del 30 de julio del 2015, \n\nResolución No. 002151       Del 30 SEP. 2024          Hoja No. 3 de 56\n“Por la cual se resuelve un recurso de reposición interpuesto en contra de la \nResolución 1177 del 18 de junio de 2024”\nPágina 3 de 56\nen el sentido de aprobar la actualización conforme al parágrafo primero del Articulo 321 de \nla Ley 1955 del 25 de mayo de 2019, entre otras disposiciones. \nQue mediante Resolución 2270 del 14 de diciembre de 2021, esta Autoridad Nacional \nevaluó la actualización del plan de compensación por pérdida de biodiversidad, presentado \npor la Sociedad mediante radicado 2021135757-1-000 del 2 de julio de 2021, donde no \naceptó o el plan presentado por la sociedad y se estableció como obligación identificar las \náreas destinadas a la implementación de acuerdos de conservación, diferenciando las \náreas de preservación y recuperación ecológica de las áreas productivas, resaltando que \nestas deberán ser inferiores a las áreas con acciones de preservación y recuperación, entre \notras determinaciones. \nQue mediante Resolución 831 del 27 de abril de 2022, esta Autoridad Nacional modificó la \nLicencia Ambiental Global en el sentido de incluir 15 teas (9 permanentes y 6 temporales), \npara un total de 29 autorizadas para el proyecto, así mismo, se autorizó el uso de un \nquemador en las operaciones de perforación y workover y se adicionaron 28 líneas a las \n102 líneas de flujo autorizadas, manteniendo la longitud total de 709,5 km de líneas de flujo \npara el transporte de fluidos, al interior del polígono licenciado para el proyecto “CAMPO \nDE EXPLOTACIÓN DE HIDROCARBUROS ACORDIONERO”, incluyendo los métodos \nconstructivos y las especificaciones técnicas presentados para las líneas de 4”.\nQue mediante Resolución 1775 del 19 de agosto de 2022, la Autoridad Nacional aclaró el \nartículo décimo séptimo de la Resolución 831 del 27 de abril de 2022, en el sentido de \nautorizar la utilización de aguas mejoradas con soluciones alcalinas, surfactantes y \npolímeros con el objetivo de incrementar los porcentajes de recuperación de crudo. \nQue mediante Auto 11790 del 28 de diciembre de 2022, esta Autoridad Nacional realizó o \ncontrol y seguimiento ambiental al proyecto, y requirió una propuesta de la localización y \ndelimitación de las áreas seleccionadas para realizar las acciones de rehabilitación de las \nespecies objeto de levantamiento de veda, entre otras determinaciones. \nQue mediante Resolución 496 del 9 de marzo de 2023, esta Autoridad Nacional resolvió no \naprobar el Plan de Compensación para el medio biótico del proyecto, y a su vez aceptó la \ncompra de los predios El Turpial y Las Palmas, localizados en la verada El Limón del \nmunicipio de San Martín – Cesar, para la implementación de la línea de inversión de \n“Adquisición de predios y/o mejoras en áreas o ecosistemas de interés estratégico para la \nconservación de los recursos naturales, al igual que en áreas protegidas que hagan parte \ndel Sistema Nacional de Áreas Protegidas- SINAP”, con recursos de la inversión forzosa de \nno menos del 1%, entre otras disposiciones. \nQue mediante Resolución 1388 del 28 de junio de 2023, esta Autoridad Nacional realizó \naclaración a la Resolución 831 del 27 de abril de 2022, en el sentido de autorizar la \nutilización de aguas mejoradas con soluciones alcalinas, surfactantes y polímeros con el \nobjetivo de incrementar los porcentajes de recuperación de crudo, entre otras disposiciones.\nQue mediante el comunicado con radicado ANLA 20236200309622 del 5 de julio 2023, la \nsociedad GRAN TIERRA ENERGY COLOMBIA GMBH SUCURSAL COLOMBIA presentó \nante esta Autoridad Nacional las medidas de retribución por la afectación de líquenes y \nplantas no vasculares en veda, en respuesta al Auto 11790 del 28 de diciembre de 2022.\n\nResolución No. 002151       Del 30 SEP. 2024          Hoja No. 4 de 56\n“Por la cual se resuelve un recurso de reposición interpuesto en contra de la \nResolución 1177 del 18 de junio de 2024”\nPágina 4 de 56\nQue mediante Resolución 1875 del 25 de agosto de 2023, esta Autoridad Nacional ajustó \nvía seguimiento el artículo trigésimo cuarto de la Resolución 1014 del 10 de junio de 2019, \nen el sentido de modificar la periodicidad en la que se deberá presentar semestralmente los \nInformes de Cumplimiento Ambiental -ICA, entre otras disposiciones.\nQue mediante Auto 8911 del 25 de octubre de 2023, esta Autoridad Nacional reconoció \ncomo tercero interviniente a la CORPORACION CENTRO DE ESTUDIOS SOCIALES Y \nPOLITICAS PÚBLICAS –CESOPP identificada con NIT 901.484.575- 8, representada \nlegalmente por el señor JAIME ANTONIO ESCOBAR ESCOBAR, identificado con cédula \nde ciudadanía 92.550.243 de Corozal, dentro del proyecto “Campo de Explotación de \nHidrocarburos Acordionero”, entre otras disposiciones. \nQue mediante Resolución 2482 del 26 de octubre de 2023, esta Autoridad Nacional aceptó \nel cambio de razón de la sociedad GRAN TIERRA ENERGY COLOMBIA LTD., a GRAN \nTIERRA ENERGY COLOMBIA GMBH SUCURSAL COLOMBIA, con NIT 860516431-7, \nquien se tendrá́ como titular de la licencia ambiental otorgada mediante Resolución 916 del \n30 de julio de 2015 para el proyecto “Campo de Explotación de Hidrocarburos Acordionero”, \nentre otras disposiciones.\nQue mediante Resolución 407 del 13 de marzo de 2024, esta Autoridad Nacional aceptó o \nel Plan de Compensación por Pérdida de Biodiversidad del Medio Biótico y compensación \npor afectación de ecosistemas diferentes a los Naturales presentado por la Sociedad GRAN \nTIERRA ENERGY COLOMBIA GMBH SUCURSAL COLOMBIA con radicado ANLA \n20236200309622 del 5 de julio 2023.\nQue mediante Concepto Técnico 7675 del 10 de noviembre de 2023, esta Autoridad \nNacional realizó control y seguimiento ambiental al proyecto, acogido mediante el Auto \n10544 del 18 de diciembre de 2023, dentro del cual también se evaluó la propuesta \npresentada por la sociedad mediante el radicado ANLA 20236200309622 del 5 de julio 2023 \npara la medida de retribución por la afectación de líquenes y plantas no vasculares en veda, \ny a su vez sirvió como fundamento para expedir la Resolución 1177 del 18 de junio de 2024.\nQue mediante Resolución 684 del 17 de abril de 2024, esta Autoridad Nacional resolvió el \nrecurso de reposición interpuesto por la Sociedad contra la Resolución 1875 del 25 de \nagosto de 2023, revocando en su integralidad esta resolución. \nQue mediante la Resolución 1177 del 18 de junio de 2024, la Autoridad Nacional aprobó \náreas de predios para la implementación de las medidas de rehabilitación por la afectación \nde líquenes y plantas no vasculares relacionadas con las Resoluciones 1808 del 5 de \nseptiembre de 2017 (11 áreas), Resolución 687 del 25 de abril de 2018 (Plataforma \nmultipozo Totumillo) y Resolución 1955 del 17 de octubre de 2018 (South West), entre otras \ndeterminaciones. \nQue mediante la comunicación con radicado ANLA 20246200755382 del 4 de julio de 2024, \nla Sociedad GRAN TIERRA ENERGY COLOMBIA GMBH SUCURSAL COLOMBIA, \ninterpuso el recurso de reposición en contra de la Resolución 1177 del 18 de julio de 2024, \n“Por la cual se aprueban unos predios para la rehabilitación de líquenes y plantas no \nvasculares en veda y se adoptan otras determinaciones”, solicitando modificar en su \n\nResolución No. 002151       Del 30 SEP. 2024          Hoja No. 5 de 56\n“Por la cual se resuelve un recurso de reposición interpuesto en contra de la \nResolución 1177 del 18 de junio de 2024”\nPágina 5 de 56\nintegridad el artículo primero y revocar el artículo segundo, con la finalidad de que se ajuste \nla asignación de áreas para la implementación de las medidas de rehabilitación por la \nafectación de líquenes y plantas no vasculares relacionadas con las Resoluciones 1808 del \n5 de septiembre de 2017 (11 áreas), Resolución 687 del 25 de abril de 2018 (Plataforma \nmultipozo Totumillo) y Resolución 1955 del 17 de octubre de 2018 (South West).\nQue mediante Auto 6112 del 31 de julio de 2023, esta Autoridad Nacional reconoció como \ntercero interviniente a la Gobernación del Cesar con NIT 892399999-1, dentro del proyecto \n“Campo de Explotación de Hidrocarburos Acordionero”, entre otras disposiciones. \nQue mediante Concepto Técnico 5886 del 13 de agosto de 2024, la Autoridad Nacional \nrealizó el análisis de los aspectos puestos en consideración del titular en el recurso de \nreposición, el cual sirve de sustento para la presente actuación.\nCOMPETENCIA DE LA AUTORIDAD NACIONAL DE LICENCIAS AMBIENTALES.\nEl artículo 2 de la Ley 99 de 1993, dispuso la creación del Ministerio del Medio Ambiente, \ncomo el organismo rector de la gestión del medio ambiente y de los recursos naturales \nrenovables, encargado entre otras cosas de definir las regulaciones a las que se sujetarán \nla conservación, protección, manejo, uso y aprovechamiento de los recursos naturales \nrenovables y el medio ambiente de la Nación, a fin de asegurar el desarrollo sostenible, \nestableciendo en el numeral 15 del artículo 5, como una de sus funciones, evaluar los \nestudios ambientales y expedir, negar o suspender la Licencia Ambiental correspondiente, \nen los casos que se señalan en el Título VIII de la ley precitada, competencia expresamente \nindicada en el artículo 52 de la misma norma. \nEn ejercicio de las facultades extraordinarias conferidas en los literales d), e) y f), del artículo \n18 de la Ley 1444 de 2011, el Gobierno Nacional expidió el Decreto 3573 del 27 de \nseptiembre de 2011, creando la Autoridad Nacional de Licencias Ambientales - ANLA, y le \nasigna entre otras funciones, la de otorgar o negar las licencias, permisos y trámites \nambientales de competencia del Ministerio de Ambiente y Desarrollo Sostenible.\nA través del Decreto 1076 del 26 de mayo de 2015 el Gobierno Nacional expidió el Decreto \nÚnico Reglamentario del Sector Ambiente y Desarrollo Sostenible, cuyo objeto es compilar \nla normativa expedida por el Gobierno Nacional en ejercicio de las facultades \nreglamentarias conferidas por el numeral 11 del artículo 189 de la Constitución Política de \n1991, para la cumplida ejecución de las leyes del sector Ambiente. Ahora bien, el artículo \n3.1.2 de la Parte 1 del Libro 3 del citado Decreto, señala que el mismo rige a partir de su \npublicación en el Diario Oficial, hecho acaecido el día 26 de mayo de 2015 en razón a la \npublicación efectuada en el Diario Oficial 49523. \nPor su parte, de acuerdo con el numeral 2 del artículo segundo del Decreto 376 del 11 de \nmarzo de 2020, “por medio del cual se modifica la estructura de la Autoridad Nacional de \nLicencias Ambientales”, corresponde al director general de la Entidad, suscribir los actos \nadministrativos que otorgan, niegan, modifican, ajustan o declaran la terminación de las \nlicencias, permisos y trámites ambientales. \n\nResolución No. 002151       Del 30 SEP. 2024          Hoja No. 6 de 56\n“Por la cual se resuelve un recurso de reposición interpuesto en contra de la \nResolución 1177 del 18 de junio de 2024”\nPágina 6 de 56\nPor medio de la Resolución 1957 del 5 de noviembre de 2021, se adoptó el Manual \nEspecífico de Funciones y de Competencias Laborales para los empleos de la planta de \npersonal de la Autoridad Nacional de Licencias Ambientales – ANLA. \nMediante la Resolución 1223 del 19 de septiembre de 2022, expedida por el Ministerio de \nAmbiente y Desarrollo Sostenible, se nombra con carácter ordinario al señor RODRIGO \nELÍAS NEGRETE MONTES, como director general de la Autoridad Nacional de Licencias \nAmbientales – ANLA-.\nDado que el director general de la Autoridad Nacional de Licencias Ambientales -ANLA-, \nsuscribió la Resolución 1177 del 18 junio de 2024, es el funcionario competente para \nresolver el presente recurso de reposición interpuesto por la sociedad GRAN TIERRA \nENERGY COLOMBIA GMBH SUCURSAL COLOMBIA, de conformidad con lo señalado en \nartículo 74 de la Ley 1437 de 2011.\nFUNDAMENTOS CONSTITUCIONALES Y LEGALES.\nEl artículo 8 de la Constitución Política establece que \"Es obligación del Estado y de las \npersonas proteger las riquezas culturales y naturales de la nación\".\nLa Constitución Política elevó a rango constitucional la obligación que tiene el Estado de \nproteger el medio ambiente, y el derecho que tienen todos los ciudadanos a gozar de un \nambiente sano y así mismo \"Es deber del Estado proteger la diversidad e integridad del \nambiente, conservar las áreas de especial importancia ecológica y fomentar la educación \npara el logro de estos fines\" (artículo 79 de la Constitución Política). El medio ambiente es \nun derecho colectivo que debe ser protegido por el Estado, estableciendo todos los \nmecanismos necesarios para su protección.\nAdicionalmente, el Estado debe planificar el manejo y aprovechamiento de los recursos \nnaturales para garantizar su desarrollo sostenible, su conservación, restauración o \nsustitución, tal y como lo establece el artículo 80 de la Constitución Política. Al efecto, la \nplanificación se debe realizar utilizando una serie de mecanismos que permitan analizar, \nevaluar y prever unas circunstancias que faciliten la toma de decisión, con el fin de alcanzar \nun objetivo propuesto, en este caso, el desarrollo sostenible.\nDEL RECURSO DE REPOSICIÓN.\nDe acuerdo con la legislación, el recurso de reposición constituye un instrumento legal \nmediante el cual la parte interesada tiene la oportunidad de ejercer el derecho de \ncontrovertir una decisión, para que la administración, previa evaluación de las razones \nfácticas y jurídicas que motivaron la inconformidad, confirme, aclare, modifique o revoque \nla misma, previo cumplimiento de las exigencias legales establecidas para dicho efecto. \nFrente al recurso de reposición, ha manifestado la doctrina: \n\nResolución No. 002151       Del 30 SEP. 2024          Hoja No. 7 de 56\n“Por la cual se resuelve un recurso de reposición interpuesto en contra de la \nResolución 1177 del 18 de junio de 2024”\nPágina 7 de 56\n“El de reposición se ha considerado históricamente como recurso connatural al \nEstado de derecho; en especial al derecho fundamental a la controversia de toda \ndecisión administrativa. Se funda esta tesis en el criterio de que no existe acto \nadministrativo sin control. Se trata, pues, del más elemental de todos los recursos \npara garantizar el principio de la contradicción y el debido proceso”1\nEn dicho sentido, la finalidad esencial del recurso de reposición no es otra distinta que \nfacultar para que el funcionario de la administración que tomó una decisión administrativa \ntenga la oportunidad para enmendar o corregir un error, o los posibles errores que se hayan \npodido presentar en el acto administrativo por él expedido, en ejercicio de sus funciones.\nREQUISITOS PARA SU PROCEDENCIA. \nEsta Autoridad considera necesario indicar algunos aspectos relacionados con las \nfacultades de las autoridades administrativas en la expedición de los actos administrativos \nmediante los cuales se resuelven recursos contra los actos administrativos.\nEl procedimiento, oportunidad y requisitos para la interposición del recurso de reposición se \nencuentra reglado en el Código de Procedimiento Administrativo y de lo Contencioso \nAdministrativo en los siguientes artículos:\n\"ARTICULO 74. Recursos contra los actos administrativos. Por regla general, \ncontra los actos definitivos procederán los siguientes recursos:\nEl de reposición, ante quien expidió la decisión, para que la aclare, modifique o \nrevoque.\n(…)\nARTICULO 76. Oportunidad y presentación. Los recursos de reposición y \napelación deberán interponerse por escrito en la diligencia de notificación personal, \no dentro de los diez (10) días siguientes a ella, o a la notificación por aviso, o al \nvencimiento del término de publicación, según el caso (…) \nLos recursos se presentarán ante el funcionario que dictó la decisión…”\nA su vez, el artículo 77 del precitado Código señala:\n\"ARTICULO 77. Requisitos. Por regla general los recursos se interpondrán por \nescrito que no requiere de presentación personal sí quien lo presenta ha sido \nreconocido en la actuación. Igualmente, podrán presentarse por medios \nelectrónicos.\nLos recursos deberán reunir, además los siguientes requisitos:\n1 Santofimio Gamboa Jaime Orlando. Tratado de derecho Administrativo, 4ta edición. Universidad Externado \nde Colombia, 1998, p. 266\n\nResolución No. 002151       Del 30 SEP. 2024          Hoja No. 8 de 56\n“Por la cual se resuelve un recurso de reposición interpuesto en contra de la \nResolución 1177 del 18 de junio de 2024”\nPágina 8 de 56\n1.\nInterponerse dentro del plazo legal, por el interesado o su representante \no apoderado debidamente constituido.\n2.\nSustentarse con expresión concreta de los motivos de inconformidad.\n3.\nSolicitar y aportar las pruebas que se pretende hacer valer.\n4.\nIndicar el nombre y la dirección del recurrente, así como la dirección \nelectrónica si desea ser notificado por este medio. ( ... )”\nPor su parte, el artículo 80 del Código de Procedimiento Administrativo y de lo Contencioso \nAdministrativo, determina:\n\"ARTÍCULO 80. Decisión de los Recursos. Vencido el periodo probatorio, si a ello \nhubiere lugar, y sin necesidad de acto que así lo declare, deberá proferirse la \ndecisión motivada que resuelva el recurso.\nLa decisión resolverá todas las peticiones que hayan sido oportunamente \nplanteadas y las que surjan con motivo del recurso.\"\nPara el caso que ocupa la atención, la Resolución 1177 del 18 de junio de 2024, es un \nproveído susceptible de ser recurrido, según el artículo 74 de la Ley 1437 de 2011, puesto \nque se trata de un acto definitivo en la medida en que adopta una decisión que manifiesta \nla voluntad del Estado y es generadora de efectos jurídicos que, en los términos del Consejo \nde Estado, tal como lo señaló en sentencia de la Sección Tercera de la Sala de lo \nContencioso Administrativo del 8 de marzo de 2012, se caracteriza por lo siguiente:\n“… los actos definitivos ponen fin de manera perentoria a la actuación administrativa \nsea de oficio o impulsada a petición de parte, de modo que en ellos se agota la \nactividad de la administración, o tan sólo queda pendiente la ejecución de lo \ndecidido. Ahora bien, es cierto que los únicos actos susceptibles de la Acción \nContenciosa Administrativa son los actos definitivos, es decir que se excluyen los \nde trámite, pues éstos se controlan jurisdiccionalmente como parte integrante del \nacto definitivo y conjuntamente con éste, es decir de aquel que cierra la actuación \nadministrativa.”\nA partir de lo anteriormente expuesto, se procede a revisar si el recurso de reposición \ninterpuesto y que es objeto de este pronunciamiento administrativo, ha cumplido los \nrequisitos legales que lo rigen para efectos de proceder a su decisión de fondo:\nLa Resolución 1177 del 18 de junio de 2024 objeto de censura, fue notificada a GRAN \nTIERRA ENERGY COLOMBIA GMBH SUCURSAL COLOMBIA, mediante correo \nelectrónico el 19 de junio de 2024 y el recurso de reposición fue interpuesto por la Sociedad \nel 4 de julio de 2024, a través de la comunicación con radicado ANLA 20246200755382, es \ndecir, dentro del término de diez (10) días hábiles siguientes a la fecha de la citada \nnotificación, observando así, el requisito de oportunidad legal para su interposición.\nDe igual manera, el recurso de reposición fue interpuesto por el doctor DIEGO PERÉZ \nCLARAMUNT, en su calidad de representante legal suplente de la sociedad GRAN TIERRA \nENERGY COLOMBIA GMBH SUCURSAL COLOMBIA, quien ostenta la legitimidad por \nactiva para impulsar el presente recurso en representación de la titular de la Licencia \nAmbiental. A su vez, el recurso contiene los motivos de inconformidad y dirección de \n\nResolución No. 002151       Del 30 SEP. 2024          Hoja No. 9 de 56\n“Por la cual se resuelve un recurso de reposición interpuesto en contra de la \nResolución 1177 del 18 de junio de 2024”\nPágina 9 de 56\nnotificaciones, cumpliéndose así los requisitos expuestos en el artículo 77 de la Ley 1437 \nde 2011. \nSiendo ello así, al verificarse el cumplimiento de los requisitos legales establecidos en la \nnormativa vigente para la procedencia del recurso de reposición, se efectuará el análisis de \nfondo de los motivos de inconformidad del recurrente, tal y como se expone a continuación:\nCONSIDERACIONES DE LA AUTORIDAD NACIONAL DE LICENCIAS AMBIENTALES.\nA continuación, se realiza el análisis y las consideraciones de la Autoridad Nacional de \nLicencias Ambientales, en respuesta al recurso de reposición, presentado por el \nrepresentante legal de la sociedad GRAN TIERRA ENERGY COLOMBIA GMBH \nSUCURSAL COLOMBIA, mediante comunicación con radicado ANLA 20246200755382 del \n4 de julio de 2024. \nPara tal efecto, se indicará, en primer lugar, la petición elevada por la recurrente; \nposteriormente, los argumentos o motivos de inconformidad del recurso y seguido ello, las \nconsideraciones de esta Autoridad frente a cada argumento, con el objeto de adoptar las \ndecisiones de fondo.\n1.\nOBLIGACIÓN RECURRIDA – Artículo primero de la Resolución 1177 del 18 \nde junio de 2024.\nEl acto administrativo, señala:\nARTÍCULO PRIMERO. APROBAR los predios Las Palmas y El Turpial, ubicados en la \nvereda El Cobre, municipio de San Martín en el departamento del Cesar, teniendo en cuenta \nla siguiente asignación de áreas para la implementación de las medidas de rehabilitación \npor la afectación de líquenes y plantas no vasculares relacionadas con las Resoluciones \n1808 del 5 de septiembre de 2017 (11 áreas), Resolución 687 del 25 de abril de 2018 \n(Plataforma multipozo Totumillo) y Resolución 1955 del 17 de octubre de 2018 (South \nWest), asociados al proyecto denominado “Campo de Explotación de Hidrocarburos \nAcordionero”, de conformidad con la parte motiva del presente acto administrativo:\nResumen de la asignación de los polígonos para la rehabilitación\nProyecto\n/ pozo\nActo\nadministrativo\nExpedient\ne\nATV\nPolígono\ns\nÁrea\nsolicitada\nÁrea \npara\nrehabilitació\nn\n11 áreas\nResolución1808\ndel \n5 \nde\nseptiembre \nde\n2017\nATV0595\nTurpial 3\n1 ha\n2,14 has\nTotumillo\nResolución 687\ndel 26 de abril \nde\n2018\nATV0686\nPalmas 3\n1 ha\n1,14 has\n\nResolución No. 002151       Del 30 SEP. 2024          Hoja No. 10 de 56\n“Por la cual se resuelve un recurso de reposición interpuesto en contra de la \nResolución 1177 del 18 de junio de 2024”\nPágina 10 de 56\nSouth\nWest\nResolución \n1955\ndel \n17 \nde \noctubre\nde 2018\nATV0812\nPalmas\n1,2,4,5,6,7 \ny\n8; Turpial\n1,2,4,5 y 6\n15 has\n1,14 has\nPARÁGRAFO PRIMERO. Las coordenadas del área aprobada en el predio Las Palmas, \nubicado en el municipio de San Martín en el departamento del Cesar, son las siguientes:\nCoordenadas de delimitación predio Las Palmas\nPARÁGRAFO SEGUNDO. Las coordenadas del área aprobada en el predio El Turpial, \nubicado en el municipio de San Martín en el departamento del Cesar, son las siguientes:\nCoordenadas de delimitación predio El Turpial\n\nResolución No. 002151       Del 30 SEP. 2024          Hoja No. 11 de 56\n“Por la cual se resuelve un recurso de reposición interpuesto en contra de la \nResolución 1177 del 18 de junio de 2024”\nPágina 11 de 56\nPetición de la Sociedad. \nLa Sociedad en el Recurso de Reposición presentado mediante comunicación con radicado \nANLA 20246200755382 del 4 de julio de 2024, solicitó:\n“PRIMERA PETICIÓN: Que se MODIFIQUE en su integridad el artículo 1 de la \nResolución 001177 del 18 de junio de 2024, en los términos expuestos en este \nrecurso, con la finalidad de que la asignación de áreas para la implementación de \nlas medidas de rehabilitación por la afectación de líquenes y plantas no vasculares \nrelacionadas con las Resoluciones 1808 del 5 de septiembre de 2017 (11 áreas), \nResolución 687 del 25 de abril de 2018 (Plataforma multipozo Totumillo) y \nResolución 1955 del 17 de octubre de 2018 (South West), corresponda con la \nrealidad fáctica y operativa del caso en concreto.” \nLa Sociedad propuso la siguiente asignación de áreas para la implementación de las \nmedidas de rehabilitación por la afectación de líquenes y plantas no vasculares:\n\nResolución No. 002151       Del 30 SEP. 2024          Hoja No. 12 de 56\n“Por la cual se resuelve un recurso de reposición interpuesto en contra de la \nResolución 1177 del 18 de junio de 2024”\nPágina 12 de 56\n\nResolución No. 002151       Del 30 SEP. 2024          Hoja No. 13 de 56\n“Por la cual se resuelve un recurso de reposición interpuesto en contra de la \nResolución 1177 del 18 de junio de 2024”\nPágina 13 de 56\n\nResolución No. 002151       Del 30 SEP. 2024          Hoja No. 14 de 56\n“Por la cual se resuelve un recurso de reposición interpuesto en contra de la \nResolución 1177 del 18 de junio de 2024”\nPágina 14 de 56\n\nResolución No. 002151       Del 30 SEP. 2024          Hoja No. 15 de 56\n“Por la cual se resuelve un recurso de reposición interpuesto en contra de la \nResolución 1177 del 18 de junio de 2024”\nPágina 15 de 56\n\nResolución No. 002151       Del 30 SEP. 2024          Hoja No. 16 de 56\n“Por la cual se resuelve un recurso de reposición interpuesto en contra de la \nResolución 1177 del 18 de junio de 2024”\nPágina 16 de 56\n\nResolución No. 002151       Del 30 SEP. 2024          Hoja No. 17 de 56\n“Por la cual se resuelve un recurso de reposición interpuesto en contra de la \nResolución 1177 del 18 de junio de 2024”\nPágina 17 de 56\n\nResolución No. 002151       Del 30 SEP. 2024          Hoja No. 18 de 56\n“Por la cual se resuelve un recurso de reposición interpuesto en contra de la \nResolución 1177 del 18 de junio de 2024”\nPágina 18 de 56\n\nResolución No. 002151       Del 30 SEP. 2024          Hoja No. 19 de 56\n“Por la cual se resuelve un recurso de reposición interpuesto en contra de la \nResolución 1177 del 18 de junio de 2024”\nPágina 19 de 56\nArgumentos de la Sociedad. \nSegún lo enunciado en el recurso de reposición, la Sociedad, argumenta lo siguiente:\n“6. FUNDAMENTOS DE HECHO \nEn cumplimiento del numeral 2 del artículo 77 de la Ley 1437 de 2011, la Compañía \nsustenta este recurso en los siguientes fundamentos de hecho:\n6.1. Por medio de la Resolución 916 de 30 de julio de 2015, así como a través de sus \naclaraciones y modificaciones, la ANLA otorgó la Licencia Ambiental Global (en adelante la \n“Licencia”) para el proyecto \"Campo de Explotación de Hidrocarburos Acordionero” (en \nadelante el “Proyecto”). \n6.2. La Resolución 1627 del 14 de diciembre de 2017 autorizó la cesión total de derechos \nde la Licencia a favor de la Compañía. \n6.3. El Auto 10662 del 6 de noviembre de 2020, avocó conocimiento de unas actuaciones \nadministrativas remitidas por el Ministerio de Ambiente y Desarrollo Sostenible. \n\nResolución No. 002151       Del 30 SEP. 2024          Hoja No. 20 de 56\n“Por la cual se resuelve un recurso de reposición interpuesto en contra de la \nResolución 1177 del 18 de junio de 2024”\nPágina 20 de 56\n6.4. El Auto 8088 del 28 de septiembre de 2021, realizó control y seguimiento ambiental de \nveda e hizo requerimientos. \n6.5. Mediante radicado 2022063181-1-000 del 4 de abril de 2022, la Sociedad presentó \nrespuesta al Auto 08088 del 28 de septiembre de 2021, sobre las especies en categoría de \nveda. \n6.6. La Resolución 2270 del 14 de diciembre de 2021, evaluó la actualización del plan de \ncompensación por pérdida de biodiversidad, presentado por la Compañía mediante \nradicado 2021135757-1-000 del 2 de julio de 2021. En esta oportunidad la ANLA no aceptó \nel plan y realizó requerimientos. \n6.7. Por medio de la Resolución 496 del 9 de marzo de 2023, la ANLA aceptó la compra de \nlos predios El Turpial y Las Palmas, localizados en la verada El Limón del municipio de San \nMartín – Cesar, para la implementación de la línea de inversión de “Adquisición de predios \ny/o mejoras en áreas o ecosistemas de interés estratégico para la conservación de los \nrecursos naturales, al igual que en áreas protegidas que hagan parte del Sistema Nacional \nde Áreas Protegidas- SINAP”, con recursos de la inversión forzosa de no menos del 1%, \nentre otras disposiciones y no aceptó el plan de compensación para el medio biótico.\n6.8. Por medio del radicado 20236200309622 del 5 de julio 2023, la Compañía presentó \nante la ANLA las medidas de retribución por la afectación de líquenes y plantas no \nvasculares en veda, en respuesta al Auto 11790 del 28 de diciembre de 2022. \n6.9. Por medio del Concepto Técnico 7675 del 10 de noviembre de 2023, la ANLA realizó \ncontrol y seguimiento ambiental al Proyecto, acogido mediante el Auto 10544 del 18 de \ndiciembre de 2023, dentro del cual también se evaluó la propuesta presentada por la \nCompañía, mediante el radicado ANLA 20236200309622 del 5 de julio 2023, para la medida \nde retribución por la afectación de especies de flora silvestre como líquenes y plantas no \nvasculares en condición de veda, el cual sirve como fundamento para el presente acto \nadministrativo recurrido. \n6.10. Por medio del Auto 10544 del 18 de diciembre de 2023, la ANLA hizo el siguiente \nrequerimiento a la Compañía: \n“Presentar un informe en el que se consolide la propuesta de la medida de \nrehabilitación para las especies no vasculares; el informe debe incluir los siguientes \naspectos: \na. La presentación de las 15 hectáreas a rehabilitar. \nb. La caracterización física del ecosistema de referencia. \nc. La caracterización biótica, que incluya de los líquenes y plantas en veda y el \nestado sucesional del ecosistema de referencia. \nd. El estado sucesional de las áreas a rehabilitar antes de la implementación de las \nsiembras. \ne. El número de individuos de cada especie y su ubicación dentro de cada núcleo. \nf. Los indicadores de sobrevivencia, estado dasométrico y fitosanitario de los \nindividuos sembrados. \ng. Los indicadores de la colonización por líquenes y no vasculares. \nh. El cronograma detallado de las actividades de mantenimiento y seguimiento”. \n\nResolución No. 002151       Del 30 SEP. 2024          Hoja No. 21 de 56\n“Por la cual se resuelve un recurso de reposición interpuesto en contra de la \nResolución 1177 del 18 de junio de 2024”\nPágina 21 de 56\n6.11. En enero y febrero de 2024, para dar respuesta al Auto 10544 del 18 de diciembre de \n2023, se realizaron recorridos de verificación en los predios comprados con los recursos de \nla inversión forzosa de no menos del 1% del Campo Acordionero. Los recorridos de campo \nse realizaron en los meses de enero y febrero del año 2024, lo que permitió identificar las \nsiguientes condiciones operativas y técnicas que plantean la necesidad de realizar ajuste a \nlos polígonos enviados a la ANLA para las medidas de rehabilitación por la afectación de \nlíquenes y plantas no vasculares y su posterior correcta adecuación a los fines de la \ncompensación: \n6.11.1. Mayor incidencia de los factores ambientales sobre algunos polígonos que se \nencuentran expuestos a procesos de remoción en masa y erosión laminar. \n6.11.2. Algunos polígonos previamente identificados han sufrido procesos de \ndeslizamientos, flujos y reptaciones debido a la intensa temporada invernal\n6.11.3. Existe un elevado riesgo de accidentalidad del personal que ejecutará las \nactividades en polígonos con pendientes superiores al 15%. Es importante recordar que los \npredios aprobados por la ANLA hacen parte de la zona de protección de la cuenca alta de \nla Quebrada Torcoroma y sus afluentes, esta área ha sido conservada en parte porque \nalgunas zonas presentan una elevada pendiente. \n6.11.4. No existen vías de acceso seguras para ejecutar las actividades propias del proceso \nde restauración, incluyendo el movimiento de personal, semovientes y, por ende, equipos, \nmateriales y plántulas. \n6.11.5. Incremento de las distancias entre frentes de restauración, lo que afecta el proceso \nde conectividad que se busca entre los parches de vegetación que se mantienen \nconservados en el área. Además, se afecta la colonización de las epifitas no vasculares. \n6.11.6. Las rutas de movilidad del personal son más eficientes y tienen una menor \nintervención de las áreas para no afectar los procesos de sucesión de las áreas destinadas \na restauración y conservación. \n6.12. En este orden de ideas, para dar respuesta al Auto 10544 del 18 de diciembre de \n2023, la Compañía definió y estableció los polígonos al interior de los predios aprobados \npor la ANLA, para realizar las medidas de rehabilitación por la afectación de líquenes y \nplantas no vasculares. A continuación, se remite la taba (sic) con la ubicación de los \npolígonos de rehabilitación (en adelante los “Polígonos Definidos”)\n\nResolución No. 002151       Del 30 SEP. 2024          Hoja No. 22 de 56\n“Por la cual se resuelve un recurso de reposición interpuesto en contra de la \nResolución 1177 del 18 de junio de 2024”\nPágina 22 de 56\n(…)\nEs importante mencionar que las 15 hectáreas de rehabilitación que se identifican en los \npolígonos antes mencionados para el cumplimiento del numeral 2 del artículo séptimo de la \nResolución 1955 del 17 de octubre de 2018, se encuentran al interior de los Predios El \nTurpial, Las Palmas y La Florida, predios que fueron aprobados a través del artículo \nprimero de la Resolución 0407 del 13 de marzo de 2024, en donde la ANLA aceptó el \nPlan de Compensación por Pérdida de Biodiversidad y por compensación de \necosistemas diferentes a los naturales presentado por la Compañía a través del \nradicado ANLA 20236200309622 del 5 de julio de 2023. \n6.13. Posteriormente la Resolución 407 del 13 de marzo de 2024, aceptó el plan de \ncompensación por pérdida de biodiversidad del medio biótico y compensación por \nafectación a ecosistemas diferentes a los naturales, presentado por la Compañía por medio \ndel radicado 20236200309622 del 5 de julio de 2023. En esta Resolución la ANLA indicó \nque el “(..) Concepto Técnico 7675 del 10 de noviembre de 2023 se realizó control y \nseguimiento ambiental al proyecto, acogido mediante el Auto 10544 de 18 de diciembre de \n2023, dentro del cual también se evalúo el documento denominado “Plan de compensación \npor pérdida de biodiversidad del medio biótico y compensación por afectación a \necosistemas diferentes a los naturales -Resolución 916 Resolución 916 del 30 de julio de \n2015, Resolución 1014 junio 10 de 2019 y Resolución 831 del 27 de abril de 2022” \n6.14. Mediante radicado 202460200717552 del 26 de junio de 2024, la Compañía remitió \nla respuesta al Auto 10544 del 18 de diciembre de 2023 a la ANLA, incluyendo la respuesta \n\nResolución No. 002151       Del 30 SEP. 2024          Hoja No. 23 de 56\n“Por la cual se resuelve un recurso de reposición interpuesto en contra de la \nResolución 1177 del 18 de junio de 2024”\nPágina 23 de 56\nal requerimiento de presentación de las 15 hectáreas a rehabilitar (ARTÍCULO 3, \nNUMERAL 17). En dicho documento, la Compañía le presentó a la ANLA la información \nsobre los Polígonos Definidos. \n6.15. Posteriormente, por medio de los artículos 1 y 2 de la Resolución 1177 del 18 de junio \nde 2024, la ANLA adoptó las siguientes decisiones, con fundamento en el Concepto Técnico \n7675 del 10 de noviembre de 2023:\n“ARTÍCULO PRIMERO. APROBAR los predios Las Palmas y El Turpial, ubicados \nen la vereda El Cobre, municipio de San Martín en el departamento del Cesar, \nteniendo en cuenta la siguiente asignación de áreas para la implementación de las \nmedidas de rehabilitación por la afectación de líquenes y plantas no vasculares \nrelacionadas con las Resoluciones 1808 del 5 de septiembre de 2017 (11 áreas), \nResolución 687 del 25 de abril de 2018 (Plataforma multipozo Totumillo) y \nResolución 1955 del 17 de octubre de 2018 (South West), asociados al proyecto \ndenominado “Campo de Explotación de Hidrocarburos Acordionero”, de \nconformidad con la parte motiva del presente acto administrativo: (…)”\n(…)\n6.16. Los polígonos referidos en los artículos 1 y 2 de la Resolución 1177 del 18 de junio \nde 2024 no corresponden con los Polígonos Definidos por la Compañía, los cuales ya fueron \nestablecidos en virtud de criterios científicos, técnicos y operativos, cumpliendo con el plan \naplicable y con lo dispuesto en el expediente LAV0105-00-2014.\n7. FUNDAMENTOS DE DERECHO \nEn cumplimiento del numeral 2 del artículo 77 de la Ley 1437 de 2011, la Compañía \nsustenta este recurso de reposición en los siguientes fundamentos de derecho. \nComo se demostrará a continuación, la ANLA debe modificar los artículos 1 y 2 de la \nResolución, en los términos previstos en este recurso. Lo anterior, debido a que los \npolígonos referidos en los artículos 1 y 2 de la Resolución no corresponden con los \nPolígonos Definidos por la Compañía, los cuales ya fueron establecidos en virtud de \ncriterios científicos, técnicos y operativos, cumpliendo con el plan aplicable aprobado por la \nANLA y con lo dispuesto en el expediente LAV0105-00-2014. En términos específicos, este \nrecurso se fundamenta en los siguientes argumentos y principios: (i) desde el punto de vista \ntécnico y científico existe equivalencia entre los Polígonos Definidos y los polígonos \nreferidos en la Resolución; (ii) la ANLA debe interpretar el caso en virtud del principio de \nprevalencia del derecho sustancial sobre el derecho formal, derivado del principio de \neficacia; (iii) la ANLA debe interpretar el caso en virtud del principio de economía; y (iv) la \nANLA debe interpretar el caso en virtud del principio de sustracción de materia.\n7.1. \nCONSIDERACIONES \nTÉCNICAS \nY \nCIENTÍFICAS \nPRELIMINARES \n– \nEQUIVALENCIA CIENTÍFICA Y TÉCNICA ENTRE LOS POLÍGONOS DEFINIDOS Y LOS \nPOLÍGONOS REFERIDOS EN LA RESOLUCIÓN \n7.1.1. Los Polígonos Definidos no coinciden con los polígonos referidos en los artículos 1 y \n2 de la Resolución. Sin embargo, los Polígonos Definidos tienen las mismas características \n\nResolución No. 002151       Del 30 SEP. 2024          Hoja No. 24 de 56\n“Por la cual se resuelve un recurso de reposición interpuesto en contra de la \nResolución 1177 del 18 de junio de 2024”\nPágina 24 de 56\ntécnicas y científicas. Esto se debe a que los Polígonos Definidos hacen parte de los predios \naprobados por la ANLA, es decir, hacen parte de los mismos predios en los que se ubican \nlos polígonos referidos en los artículos 1 y 2 de la Resolución y cumplen con lo previsto en \nel expediente y en el plan aplicable y aprobado por la ANLA.\n7.1.2. En este orden de ideas, los Polígonos Definidos cumplen las mismas funciones \necosistémicas y de rehabilitación que los Polígonos Definidos, según se explica a \ncontinuación. \n7.1.2.1. Los Polígonos Definidos y los aprobados por la Resolución 1177 de 2024 se ubican \nen la misma zona de vida (Bosque Húmedo tropical Bh-T) y en el mismo Bioma (Zonobioma \nHúmedo tropical Cordillera oriental Magdalena medio).\n7.1.2.2. Los Polígonos Definidos se encuentran al interior de los Predios El Turpial, Las \nPalmas y La Florida, predios que fueron aprobados a través del artículo primero de la \nResolución 0407 del 13 de marzo de 2024, en donde la ANLA aceptó el Plan de \ncompensación por pérdida de biodiversidad y por compensación de ecosistemas diferentes \na los naturales presentado por la Compañía a través del radicado ANLA 20236200309622 \ndel 5 de julio de 2023. \n7.1.2.3. Los Polígonos Definidos y actualmente identificados a través de la zonificación, \npermiten desarrollar las acciones de compensación en áreas totalmente diferenciadas de \nacuerdo con las obligaciones que se cumplan (compensación por el cambio de uso del \nsuelo, aprovechamiento forestal o rehabilitación por el levantamiento de veda). \n7.1.2.4. Los Polígonos Definidos propenden por la conectividad de los parches de \nvegetación secundaria alta del Zonobioma Húmedo Tropical Cordillera Oriental Magdalena \nMedio, lo cual asegura la colonización de epifitas no vasculares que puedan dispersarse de \nlas áreas cercanas. \n7.1.2.5. En los parches de vegetación secundaria alta del Zonobioma Húmedo Tropical \nCordillera Oriental Magdalena Medio, se presentan forófitos reportados en las áreas \npreviamente intervenidas, como se registró en la caracterización de áreas para \nrehabilitación. \n7.1.2.6. En los Polígonos Definidos y los polígonos a los que se refieren los artículos 1 y 2 \nde la Resolución están contiguos, de tal manera que el estado sucesional de las áreas a \nrehabilitar antes de la implementación de las siembras es el mismo al planteado en el \ndocumento de caracterización. \n7.1.2.7. En los Polígonos Definidos y los polígonos a los que se refieren los artículos 1 y 2 \nde la Resolución, los indicadores de la colonización por líquenes y no vasculares se \nmantienen para realizar el seguimiento del éxito del programa de compensación. \n7.1.3. Con fundamento en las consideraciones científicas y técnicas expuestas, la ANLA \ndebe modificar los artículos 1 y 2 de la Resolución, con la finalidad de que estas normas se \nrefieran a los Polígonos Definidos. Toda vez que, estos cumplen con la finalidad científica \ny técnica de las medidas de rehabilitación, al tener las mismas condiciones y estar en los \nmismos predios de los polígonos referidos en los artículos 1 y 2 de la Resolución. Por lo \n\nResolución No. 002151       Del 30 SEP. 2024          Hoja No. 25 de 56\n“Por la cual se resuelve un recurso de reposición interpuesto en contra de la \nResolución 1177 del 18 de junio de 2024”\nPágina 25 de 56\ntanto, desde el punto de vista técnico y científico es procedente que se hagan las \nmodificaciones solicitadas por la Compañía, con la finalidad de que los artículos 1 y 2 se \najusten a la realidad fáctica del caso en concreto. \n7.1.4. En suma, existen argumentos científicos y técnicos suficientes para que la ANLA \nmodifique los artículos 1 y 2 de la Resolución, en el sentido de aprobar los Polígonos \nDefinidos, en vez de los actualmente referidos en dichas disposiciones.\n(…)\n7.2. PRINCIPIO DE PREVALENCIA DEL DERECHO SUSTANCIAL SOBRE EL \nDERECHO FORMAL, DERIVADO DEL PRINCIPIO DE EFICACIA\n7.2.1. La ANLA debe modificar los artículos 1 y 2 de la Resolución, en virtud del principio \nde prevalencia del derecho sustancial sobre el derecho formal. Lo anterior, debido a que \nlos Polígonos Definidos cumplen con los mismos fines sustanciales (técnicos y científicos) \nque los polígonos referidos en los artículos 1 y 2 de la Resolución. Por lo cual, se le solicita \nrespetuosamente a la ANLA que apruebe los Polígonos Definidos, eliminando cualquier \nobstáculo formal para ello.\n7.2.2. El principio de prevalencia del derecho sustancial sobre el derecho formal se deriva \ndel principio de eficacia consagrado en el numeral 11 del artículo 3 de la Ley 1437 de 2011,\nveamos:\n“11. En virtud del principio de eficacia, las autoridades buscarán que los procedimientos \nlogren su finalidad y, para el efecto, removerán de oficio los obstáculos puramente formales, \nevitarán decisiones inhibitorias, dilaciones o retardos y sanearán, de acuerdo con este \nCódigo las irregularidades procedimentales que se presenten, en procura de la efectividad \ndel derecho material objeto de la actuación administrativa” (Subrayado fuera del texto \noriginal).\n7.2.3. Con fundamento en lo anterior, la ANLA debe propender por tomar decisiones que \ngaranticen el fin material y sustancial de las medidas de rehabilitación por la afectación de \nlíquenes y plantas no vasculares relacionadas, y a su vez, debe remover cualquier \nobstáculo puramente formal que afecte la consecución de los fines materiales de esas \nmedidas de rehabilitación.\n7.2.4. En este orden de ideas, la ANLA debe modificar los artículos 1 y 2 de la Resolución, \nen virtud del principio de prevalencia del derecho sustancial, considerando que: (a) los \nPolígonos Definidos garantizan el fin sustancial de las medidas de rehabilitación; (b) los \nPolígonos se encuentran dentro de los predios aprobados por la ANLA; y (b) los Polígonos \ncumplen con las mismas condiciones técnicas y científicas de los polígonos referidos en los \nartículos 1 y 2 de la Resolución. En este sentido, desde el punto de vista sustancial los \nPolígonos Definidos tendrían que ser aprobados por la ANLA, de lo contrario, si la ANLA no \naccede a las pretensiones de este recurso y mantiene en firme la aprobación de otros \npolígonos, estará dando prevalencia a factores formales y desconociendo el argumento \nsustancial que sustenta este recurso, a saber: los Polígonos Definidos cumplen con los \nmismos fines científicos y técnicos que los ya aprobados.\n\nResolución No. 002151       Del 30 SEP. 2024          Hoja No. 26 de 56\n“Por la cual se resuelve un recurso de reposición interpuesto en contra de la \nResolución 1177 del 18 de junio de 2024”\nPágina 26 de 56\n7.2.5. En caso de no modificar los artículos 1 y 2 de la Resolución, la ANLA estaría dando \nprevalencia a obstáculos netamente formales, sobre los fines sustanciales de las medidas \nde rehabilitación que ya se están garantizando en los Polígonos Definidos.\n7.2.6. Con fundamento en lo expuesto, la ANLA debe modificar los artículos 1 y 2 de la \nResolución para garantizar que este acto administrativo apruebe los Polígonos Definidos, \ngarantizando así la efectividad del derecho material objeto de las - 21 - obligaciones y \nactuaciones administrativas contenidas en el expediente LAV0105-00-2014.\n7.3. PRINCIPIO DE ECONOMÍA\n7.3.1. La ANLA debe modificar los artículos 1 y 2 de la Resolución, en virtud del principio \nde economía. En términos específicos, la ANLA debe valorar las pretensiones de la \nCompañía a la luz de dicho principio.\n7.3.2. El principio de economía consagrado en el numeral 12 del artículo 3 de la Ley 1437 \nde 2011, establece lo siguiente:\n“12. En virtud del principio de economía, las autoridades deberán proceder con austeridad \ny eficiencia, optimizar el uso del tiempo y de los demás recursos, procurando el más alto \nnivel de calidad en sus actuaciones y la protección de los derechos de las personas” \n(Subrayado fuera del texto original).\n7.3.3. En este orden de ideas, la ANLA debe optimizar el uso del tiempo y de los demás \nrecursos en el marco del seguimiento y control del expediente LAV0105-00-2014, \nprocurando el más alto nivel de calidad en sus actuaciones y la protección de los derechos \nde la Compañía.\n7.3.4. En el caso en concreto, la ANLA debe considerar que operativamente los Polígonos \nDefinidos representan una mayor austeridad y eficiencia para el Proyecto, sin poner en \nriesgo el fin sustancial (científico y técnico) de las medidas de rehabilitación.\n7.3.5. Las consideraciones operativas que sustentan que los Polígonos Definidos son más \neficientes y austeros, son las siguientes:\n7.3.5.1. Mayor incidencia de los factores ambientales sobre algunos polígonos que se \nencuentran expuestos a procesos de remoción en masa y erosión laminar.\n7.3.5.2. Algunos polígonos previamente identificados han sufrido procesos de \ndeslizamientos, flujos y reptaciones debido a la intensa temporada invernal.\n7.3.5.3. Existe un elevado riesgo de accidentalidad del personal que ejecutará las \nactividades en polígonos con pendientes superiores al 15%. Es importante recordar que los \npredios aprobados por la ANLA hacen parte de la zona de protección de la cuenca alta de \nla Quebrada Torcoroma y sus afluentes, esta área ha sido conservada en parte porque \nalgunas zonas presentan una la elevada pendiente.\n\nResolución No. 002151       Del 30 SEP. 2024          Hoja No. 27 de 56\n“Por la cual se resuelve un recurso de reposición interpuesto en contra de la \nResolución 1177 del 18 de junio de 2024”\nPágina 27 de 56\n7.3.5.4. No existen vías de acceso seguras para ejecutar las actividades propias del \nproceso de restauración, incluyendo el movimiento de personal, semovientes y, por ende, \nequipos, materiales y plántulas.\n7.3.5.5. Incremento de las distancias entre frentes de restauración, lo que afecta el proceso \nde conectividad que se busca entre los parches de vegetación que se mantienen \nconservados en el área. Además, se afecta la colonización de las epifitas no vasculares.\n7.3.5.6. Las rutas de movilidad del personal son más eficientes y tienen una menor \nintervención de las áreas para no afectar los procesos de sucesión de las áreas destinadas \na restauración y conservación.\n7.3.6. En este orden de ideas, considerando que el numeral 12 del artículo 3 de la Ley 1437 \nde 2011 se refiere a los principios que rigen la función administrativa, la ANLA está llamada \na analizar este caso en virtud de dicho principio y a tomar una decisión sobre los Polígonos \nDefinidos que sea eficiente y austera.\n7.3.7. Con fundamento en lo expuesto, la ANLA debe modificar los artículos 1 y 2 de la \nResolución, en el sentido de aprobar los Polígonos Definidos que se alinean con la \neconomía operativa, para garantizar que este acto administrativo se encuentre alineado con \nel principio de economía que rige la función administrativa.\n7.4. PRINCIPIO DE SUSTRACCIÓN DE MATERIA\n7.4.1. La ANLA debe modificar los artículos 1 y 2 de la Resolución, en virtud del principio \nde sustracción de materia, pues los hechos que sustentan la decisión contenida en dichas \ndisposiciones han perdido vigencia y desconocen que la Compañía ya le había presentado \na la ANLA los Polígonos Definidos, veamos.\n7.4.2. El Consejo de Estado ha definido este principio en los siguientes términos:\n“Como regla general se entiende por sustracción de materia la desaparición de supuestos, \nhechos o normas que sustentan una acción, lo cual ocasiona que el juez no pueda \npronunciarse porque se ha extinguido la causa que originó acudir a la jurisdicción” (Consejo \nde Estado. Providencia del 27 de febrero de 2023, identificada con el radicado No. 11001-\n03-25-000-2010-00088-00(0798-10).\n7.4.3. A la luz de la jurisprudencia, ha operado la sustracción de materia respecto de los \npolígonos actualmente aprobados en los artículos 1 y 2 de la Resolución. Lo anterior, debido \na que en el momento de notificación de la Resolución, la Compañía ya había identificado e \nimplementado los Polígonos Definidos, con fundamento en un análisis técnico, científico y \noperativo. Para el momento de notificación de la Resolución, la Compañía no esperaba que \nla ANLA expidiera un acto de su naturaleza, porque entre el 10 de noviembre de 2023 y el \n18 de junio de 2024, la ANLA ya se había pronunciado en el expediente sin hacer alusión \na la aprobación de polígonos. Si bien es cierto que el 10 de noviembre de 2023, la ANLA \nexpidió el Concepto Técnico 7675 en el que se fundamenta la Resolución, este acto \nadministrativo solo fue expedido hasta siete meses después del concepto técnico. En el \ninterino de esos seis meses, la ANLA se pronunció dos veces (Auto 10544 del 18 de \ndiciembre de 2023 y Resolución 00047 del 13 de marzo de 2024), realizando requerimientos \n\nResolución No. 002151       Del 30 SEP. 2024          Hoja No. 28 de 56\n“Por la cual se resuelve un recurso de reposición interpuesto en contra de la \nResolución 1177 del 18 de junio de 2024”\nPágina 28 de 56\nsin pronunciarse sobre los polígonos. En el tiempo transcurrido entre el 10 de noviembre \nde 2023 y el 18 de junio de 2024, la Compañía actuó diligentemente, de conformidad con \nlo previsto en el 1 Consejo de Estado. Providencia del 27 de febrero de 2023, identificada \ncon el radicado No. 11001-03-25-000-2010-00088-00(0798-10) - 23 - expediente, e \nidentificó los Polígonos Definidos. Por lo cual, para el momento de la notificación de la \nResolución, los motivos en los que eventualmente se sustentaban los polígonos referidos \nen el Concepto Técnico 7675 desaparecieron. Precisamente, por medio del radicado \n202460200717552 del 26 de junio de 2024, la Compañía dio respuesta al Auto 10544 del \n18 de diciembre de 2023 y presentó la información de los Polígonos Definidos.\n7.4.4. Así las cosas, la Resolución fue expedida con posterioridad a la implementación de \nlos Polígonos Definidos. Esto se debe a que la ANLA aprobó los predios y después dejó \npasar un tiempo sustancial sin pronunciarse, durante el cual la Compañía actuó \ndiligentemente para empezar a dar cumplimiento a sus obligaciones de rehabilitación.\nEn este sentido, para el momento en que la ANLA definió polígonos en los artículos 1 y 2 \nde la Resolución, la Compañía ya había establecido los Polígonos Definidos, con \nfundamento en criterios técnicos, científicos y operativos que garantizan el cumplimiento de \nsus obligaciones. Motivo por el cual, para el momento de expedición de la Resolución ya \nhabían desaparecido los supuestos de hecho que sustentaban la definición de los polígonos \npor parte de la ANLA, ya que la Compañía ya los había definido, con sujeción a lo previsto \nen el expediente LAV0105-00-2014.\n7.4.5. Con fundamento en lo expuesto, la ANLA debe modificar los artículos 1 y 2 de la \nResolución, porque respecto de su contenido ha operado la sustracción de materia, ya que \nla Compañía ya había establecido los Polígonos Definidos antes de ser notificada de la \nResolución.\nConsideraciones Técnicas y Jurídicas de la ANLA. \nQue frente a lo anterior, esta Autoridad Nacional consideró en el Concepto Técnico 5886 \ndel 13 de agosto de 2024, lo siguiente:\n“Una vez revisados los argumentos presentados sobre la solicitud de MODIFICAR en su \nintegridad el artículo primero de la Resolución 1177 del 18 de junio de 2024, se realizan las \nsiguientes consideraciones:\n•\nEn cuanto a lo expuesto en el ítem 6. FUNDAMENTOS DE HECHO, específicamente en \nlos numerales 6.1 al 6.9, se precisa que en el concepto No. 7675 del 10 noviembre 2023, \nacogido mediante Resolución 1177 del 18 de junio de 2024, esta Autoridad Nacional \nevaluó las medidas de retribución por la afectación de líquenes y plantas no vasculares \nen veda, asociadas a los expedientes ATVs 0595 (Resolución Resolución1808 del 5 de \nseptiembre de 2017), 0686 (Resolución 687 del 26 de abril de 2018) y 0812 (Resolución \n1955 del 17 de octubre de 2018), que fueron remitidas por la Sociedad GRAN TIERRA \nENERGY COLOMBIA GMBH SUCURSAL COLOMBIA mediante radicado ANLA \n20236200309622 del 5 de julio 2023; aprobando mediante el artículo primero de la \nResolución 1177 del 18 de junio de 2024, los polígonos y/o lotes que se ubicaban al \ninterior de los predios Las palmas y El Turpial.\n\nResolución No. 002151       Del 30 SEP. 2024          Hoja No. 29 de 56\n“Por la cual se resuelve un recurso de reposición interpuesto en contra de la \nResolución 1177 del 18 de junio de 2024”\nPágina 29 de 56\nA continuación se presenta la procedencia de las áreas y polígonos propuestas en la \ninformación documental remitida por la Sociedad mediante el radicado ANLA \n20236200309622 del 5 de julio 2023, para desarrollar las medidas de retribución por la \nafectación de líquenes y plantas no vasculares en veda, que fueron evaluadas mediante \nel concepto No. 7675 del 10 noviembre 2023 y que motivaron la aprobación de los \npolígonos del artículo primero de la Resolución 1177 del 18 de junio de 2024:\nTabla: Relación de áreas disponibles de los predios propuestos y las áreas según su \nobligación\nFuente: Radicado 20236200309622 del 5 de julio 2023\nEn cuanto a los numerales 6.9 al 6.16 del ítem 6. FUNDAMENTOS DE HECHO, la Sociedad \nmenciona que producto de la evaluación realizada por esta Autoridad Nacional a las \nmedidas de retribución por la afectación de líquenes y plantas no vasculares en veda, \nremitidas mediante radicado ANLA 20236200309622 del 5 de julio 2023, en el Auto 10544 \ndel 18 de diciembre de 2023 (numeral 17 del artículo tercero), que acogió el Concepto \nTécnico No. 7675 del 10 de noviembre de 2023, se estableció un requerimiento a la \npropuesta o medida de rehabilitación de 15 hectáreas asociadas a la Resolución 1955 del \n17 de octubre de 2018 (Expediente ATV 0812), para lo cual, la Sociedad relaciona las \nactividades realizadas en respuesta a la citada obligación, y que los motivan a solicitar el \najuste a los polígonos o áreas aprobadas mediante el Artículo primero de la Resolución \n1177 del 18 de junio de 2024 para la implementación de las medidas de retribución, \nfundamentado estos cambios principalmente por la presencia de pendientes elevadas, \nprocesos de remoción en masa, deslizamientos, erosión laminar, falta de vías seguras para \nel acceso, entre otros, definiendo nuevos polígonos (Polígonos definidos), los cuales \ninforman que también fueron presentados en el Anexo 1 GDB de la respuesta al Auto 10544 \ndel 2023, remitida mediante radicado ANLA 202460200717552 del 26 de junio de 2024.\nAhora, con respecto a lo indicado anteriormente, esta Autoridad Nacional precisa lo \nsiguiente:\n\nResolución No. 002151       Del 30 SEP. 2024          Hoja No. 30 de 56\n“Por la cual se resuelve un recurso de reposición interpuesto en contra de la \nResolución 1177 del 18 de junio de 2024”\nPágina 30 de 56\nPara resolver el recurso de reposición interpuesto contra la Resolución 1177 del 18 de junio \nde 2024, no es posible valorar la información técnica remitida mediante radicado ANLA \n202460200717552 del 26 de junio de 2024, en respuesta al Auto 10544 del 18 de diciembre \nde 2023, por lo que solamente será considerada la información remitida mediante el \nradicado ANLA 20236200309622 del 5 de julio 2023 y que fue valorada en el Concepto \nTécnico No. 7675 del 10 de noviembre de 2023, acogido mediante el Auto 10544 del 18 de \ndiciembre de 2023 y la Resolución 1177 del 18 de junio de 2024. Por consiguiente, la \ninformación remitida por la Sociedad mediante radicado ANLA 202460200717552 del 26 de \njunio de 2024, con respecto a los ajustes o cambios de los polígonos y de la cual la Sociedad \nha hecho referencia en la solicitud del recurso de reposición, será objeto de valoración en \nel seguimiento ambiental que se realice al proyecto para la vigencia 2024. \nSe aclara que la información remitida mediante radicado ANLA 202460200717552 del 26 \nde junio de 2024 y que es citada por la Sociedad, corresponde a la respuesta de la \nobligación establecida mediante el numeral 9 del artículo primero del Auto 10544 del 18 de \ndiciembre de 2023, referente al reporte en la Ventanilla Integral de Trámites Ambientales \nen Línea VITAL, de los informes de las contingencias ocurridas en el año 2022. No obstante, \nen la revisión del expediente LAV0105-00-2014, se observó que la información que contiene \nlos ajustes o cambios de los polígonos para la implementación de las medidas de retribución \nfue remitida mediante el radicado ANLA 20246200567462 del 20 de mayo de 2024, la cual, \ncomo se indicó en el inciso anterior, será valorada en el seguimiento ambiental que se \nrealice al proyecto para la vigencia 2024.\nPara lo señalado en el numeral 6.12, en donde la Sociedad indica que “(…) las 15 hectáreas \nde rehabilitación que se identifican en los polígonos antes mencionados para el \ncumplimiento del numeral 2 del artículo séptimo de la Resolución 1955 del 17 de octubre \nde 2018, se encuentran al interior de los Predios El Turpial, Las Palmas y La Florida, \npredios que fueron aprobados a través del artículo primero de la Resolución 0407 del \n13 de marzo de 2024, en donde la ANLA aceptó el Plan de Compensación por Pérdida \nde Biodiversidad y por compensación de ecosistemas diferentes a los naturales \npresentado por la Compañía a través del radicado ANLA 20236200309622 del 5 de \njulio de 2023”, es importante precisar que mediante el artículo 11 de la Resolución 1955 \ndel 17 de octubre de 2018, sobre levantamiento de veda, se estableció que: \n“La Sociedad Gran Tierra Energy Colombia Ltda., con NIT 860.516.431-7, deberá tener en \ncuenta que, en ningún caso será posible atribuir las compensaciones realizadas en el marco \nde la licencia ambiental, con las medidas de manejo establecidas por la afectación de las \nespecies de flora objeto de levantamiento parcial de veda, por lo tanto, las áreas en donde \nse adelantarán estas medidas deberán estar delimitadas y diferenciadas para su reporte y \nseguimiento”. \nEn consecuencia, las áreas o polígonos dentro de los predios aprobadas a través del \nartículo primero de la Resolución 0407 del 13 de marzo de 2024, en donde la ANLA aceptó \nel Plan de Compensación por Pérdida de Biodiversidad y por compensación de ecosistemas \ndiferentes a los naturales, deben ser distintas a las áreas o polígonos destinados para la \nimplementación de las medidas por afectación de líquenes y flora en veda. \n\nResolución No. 002151       Del 30 SEP. 2024          Hoja No. 31 de 56\n“Por la cual se resuelve un recurso de reposición interpuesto en contra de la \nResolución 1177 del 18 de junio de 2024”\nPágina 31 de 56\nPara polígonos o áreas aprobadas mediante el inciso del artículo Primero (Resumen de la \nasignación de los polígonos para la rehabilitación) de la Resolución 1177 del 18 de junio de \n2024 y que se presentan a continuación, no se relacionaron y/o aprobaron coordenadas \nque delimitara o estableciera su ubicación espacial:     \nProyecto \n/pozo\nActo \nadministrativo\nPolígonos\nÁrea \nsolicitada\nÁrea \npara \nrehabilitación\n11 áreas\nRes.1808\nTurpial 3\n1 ha\n2,14 has\nTotumillo\nRes 687\nPalmas 3\n1 ha\n1.14 has\nSouth \nWest\nRes.\nPalmas \n1,2,4,5,6,7 y 8;\n Turpial 1,2,4,5 y6\n15 has\n13.91 has\nNo obstante, estos polígonos o áreas se ubican dentro de los predios Las Palmas y El \nTurpial, para los cuales sí fueron definidos su ubicación espacial en los parágrafos 1 y 2 del \nartículo primero de la Resolución 1177 del 18 de junio de 2024. Por consiguiente, para \ndefinir la ubicación espacial (coordenadas) de los polígonos o áreas aprobadas presentadas \nanteriormente, se procedió a verificar nuevamente el radicado ANLA 20236200309622 del \n5 de julio 2023 (evaluado en el Concepto Técnico No. 7675 del 10 de noviembre de 2023), \na través del cual la Sociedad presentó las áreas de retribución por la afectación de líquenes \ny plantas no vasculares en veda, en respuesta al Auto 11790 del 28 de diciembre de 2022, \nencontrándose lo siguiente: \nQue mediante el radicado ANLA 20236200309622 del 5 de julio 2023, se presenta la \ncarpeta “VEDA” en donde se incluye la información geográfica (GDB) denominada \n“LAV0105_00_2014.gdb” con shape denominado “Levantamiento de vedas”, del cual se \nelabora la siguiente salida gráfica, donde se visualizan los polígonos o áreas propuestas \npara la retribución por la afectación de líquenes y plantas no vasculares en veda:\n\nResolución No. 002151       Del 30 SEP. 2024          Hoja No. 32 de 56\n“Por la cual se resuelve un recurso de reposición interpuesto en contra de la \nResolución 1177 del 18 de junio de 2024”\nPágina 32 de 56\nFuente: Radicado ANLA 20236200309622 del 5 de julio 2023- Anexo \n“LAV0105_00_2014.gdb” – shape “Otras compensaciones” capa “Levantamiento de \nvedas”.  Componente Geomático - Grupo de Servicios Geoespaciales-ANLA, 2024.\nResultado de la verificación de la información geográfica (LAV0105_00_2014.gdb) \nrealizada por el equipo de servicios geoespaciales y el equipo de seguimiento ambiental \n(ESA) de esta Autoridad Nacional, se identificaron los siguientes polígonos seleccionados \ninicialmente por la Sociedad, dentro de los predios Las Palmas, El Turpial y La Florida, \ndiscriminados por plataforma y asociados a cada expediente ATV de levantamiento de \nveda, los cuales se detallan a continuación:\nPlataforma \n/pozo\nExpedien\nte ATV\nResolución \nveda\nÁrea \nestablecida-\nmedida\nPolígono \npropuesto \ngdb\nÁrea \npropuesta \ngdb\nFlorida5*\n1,10566\nTotumillo\nATV0686\n687 del 24 de \nabril de 2018\n1 ha\nSubtotal\n1,10566\nTurpial1\n2,654097\n11 áreas\nATV0595\n1808 del 05 \nde \nseptiembre \nde 2017\n1 ha\nTurpial2\n1,548831\nSubtotal\n4,202928\nFlorida1*\n3,10596\nPalmas1\n0,209205\nPalmas2\n1,562345\nPalmas3\n1,167687\nPalmas4\n1,303493\nPalmas5\n0,559918\nPalmas6\n0,564267\nPalmas7\n1,205521\nPalmas8\n1,055914\nTurpial3\n2,093634\nTurpial4\n1,40137\nTurpial5\n1,167626\nTurpial6\n0,677956\nSubtotal\n16,074896\nSouth West\nATV0812\n1955 del 17 \nde \noctubre \nde 2018\n15 ha\nTotal\n21,383484\nFuente: Radicado ANLA 20236200309622 del 5 de julio 2023- Anexo \n“LAV0105_00_2014.gdb” – shape “Otras compensaciones” capa “Levantamiento de \nvedas”.  Componente Geomático - Grupo de Servicios Geoespaciales-ANLA, 2024.\n*Polígonos no incluidos en la Resolución 1177 del 18 de junio de 2024\nAl verificar dichos polígonos generados en la tabla anterior, a partir de la información \ngeográfica (GDB) remitida mediante radicado ANLA 20236200309622 del 5 de julio 2023, \nse observó que no coinciden con los presentados en la información documental del mismo \nradicado, ni con los aprobados en la tabla Resumen del artículo primero de la Resolución \n1177 del 18 de junio de 2024. Además, se evidencia el reporte de otros polígonos no \n\nResolución No. 002151       Del 30 SEP. 2024          Hoja No. 33 de 56\n“Por la cual se resuelve un recurso de reposición interpuesto en contra de la \nResolución 1177 del 18 de junio de 2024”\nPágina 33 de 56\nincluidos previamente en la citada Resolución, correspondientes a Florida 1 y Florida 5 \n(predio La Florida); teniendo entonces, 16 polígonos distribuidos en tres (3) predios, que \npresentan un área conjunta de 21,38 hectáreas. \nEn cuanto al numeral 7.1. CONSIDERACIONES TÉCNICAS Y CIENTÍFICAS \nPRELIMINARES – EQUIVALENCIA CIENTÍFICA Y TÉCNICA ENTRE LOS POLÍGONOS \nDEFINIDOS Y LOS POLÍGONOS REFERIDOS EN LA RESOLUCIÓN, en donde la \nempresa indica que los nuevos “Polígonos Definidos”, cumplen con las mismas \ncaracterísticas técnicas y científicas dado que hacen parte de los predios aprobados por la \nANLA, se reitera que el presente recurso de reposición se resuelve sobre la información \npresentada y valorada mediante el Concepto Técnico No. 7675 del 10 de noviembre de \n2023, acogido mediante Resolución 1177 del 18 de junio de 2024, y que la nueva \ninformación remitida en el presente recurso de reposición, será objeto de valoración en el \nseguimiento ambiental que se realice al proyecto para la vigencia 2024. \nDe conformidad con el anterior análisis, esta Autoridad Nacional considera que no es \nprocedente acceder a la pretensión de MODIFICAR el artículo primero de la Resolución \n1177 del 18 de junio de 2024, bajo los términos señalados por la Sociedad.\nNo obstante, de conformidad con las aclaraciones realizadas anteriormente a los polígonos \ny áreas para la implementación de las medidas de rehabilitación por la afectación de \nlíquenes y plantas no vasculares, a partir de la información geográfica (GDB) del radicado \nANLA 20236200309622 del 5 de julio 2023, se recomienda MODIFICAR en su integridad \nel artículo primero de la Resolución 1177 del 18 de junio de 2024.\"\nEs oportuno indicar que la información remitida por parte de GRAN TIERRA ENERGY \nCOLOMBIA \nGMBH \nSUCURSAL \nCOLOMBIA \nmediante \nel \nradicado \nANLA \n202460200717552 del 26 de junio de 2024, y expuesto por la Sociedad en sus argumentos \npara sustentar la petición en su escrito de reposición, es una respuesta a la obligación del \nnumeral 9 del artículo primero del Auto 10544 del 18 de diciembre de 2023 y, en \nconsecuencia, para esta Autoridad Nacional es nueva información que será objeto de \nvaloración en el seguimiento ambiental que se realice al proyecto para la vigencia 2024, \nmás no para ser analizada en el marco de este recurso de reposición.\nAdemás, es necesario advertir que no procede la revisión del radicado ANLA \n202460200717552 del 26 de junio de 2024, por vía de este recurso dado que como lo han \nseñalado en diversas oportunidades nuestras altas Cortes: \n“(…) Ahora bien, los motivos de inconformidad planteados mediante el recurso de \napelación deben guardar correspondencia con el fallo recurrido, esto es, con las \nconsideraciones expuestas por el juez de primera instancia que determinaron una \ndecisión total o parcialmente adversa a los intereses de quien apela. La sentencia \nproferida por el juez de lo contencioso administrativo, a su turno, debe ser motivada \ny resolver todos los puntos objeto de controversia formulados por las partes \ndemandante y demandada dentro de la oportunidad procesal respectiva.  En este \nsentido, a la luz de lo establecido en el artículo 170 del C.C.A., debe concluirse que \nla sentencia proferida por el juez de lo contencioso administrativo no puede ser infra, \nextra o ultra petita, sino, en virtud de la naturaleza predominantemente rogada de la \njurisdicción, sujetarse a todos y cada uno de los aspectos sometidos a su decisión.  \n\nResolución No. 002151       Del 30 SEP. 2024          Hoja No. 34 de 56\n“Por la cual se resuelve un recurso de reposición interpuesto en contra de la \nResolución 1177 del 18 de junio de 2024”\nPágina 34 de 56\n(…)” Consejo de Estado Sala de lo Contencioso Administrativo- Sección Segunda. \nRadicado No. 25000-23-25-000-2002-12297-01 de mayo de 2010.\nPor su parte el tratadista Carlos Jaramillo Betancur en su libro “Derecho procesal \nadministrativo”, señaló:\n“(…) Al contrario de los procesos laborales a los cuales asimila el demandante su \nasunto, el ejercicio de la función judicial en materia contencioso administrativa, la \ncompetencia del juez al momento de fallar no le permite decidir ultra petita o extra \npetita, porque la resolución judicial que se extienda más allá de lo pedido o que se \ntome fuera del petitum de la demanda, a más de resultar violatoria del derecho de \ndefensa de la contraparte sería contraria a la estructura misma del proceso que en \nesta materia se guía por el principio de que la materia del litigio se define por las \npartes y, estas al hacerlo, delimitan la competencia del juzgador (…)”2.\nPor lo anterior, como se señaló anteriormente, no formó parte de la decisión recurrida la \ninformación contenida en el radicado ANLA 202460200717552 del 26 de junio de 2024, \nsino que se valoró la información por la cual se adoptó la decisión para expedir la \nResolución 1177 del 18 de junio de 2024.\nEs oportuno resaltar que en el marco del recurso de reposición, el principio de unidad de \nmateria implica que el pronunciamiento de la Autoridad Nacional guarde coherencia con la \npetición presentada por el recurrente, y sobre cuestiones que fueron materia de oposición, \nevitando así una decisión extrapetita. De esta manera, se salvaguarda el debido proceso, \nla transparencia y la publicidad en las actuaciones administrativas, en virtud de los \nprincipios contenidos en la Constitución Política y la Ley 1437 de 2011. \nAsí las cosas, la Autoridad Nacional solo consideró la información remitida por la Sociedad \nmediante el radicado ANLA 20236200309622 del 5 de julio 2023, la cual fue valorada en el \nConcepto Técnico 7675 del 10 de noviembre de 2023, acogido mediante el Auto 10544 del \n18 de diciembre de 2023 y la Resolución 1177 del 18 de junio de 2024, esta última, objeto \ndel presente recurso de reposición. La Autoridad Nacional también tuvo en cuenta los \nargumentos esbozados por la Sociedad en el documento del recurso para tomar la decisión.\nPor otra parte, en este sentido, es de señalar que no le asiste razón a la Sociedad el \nequiparar los polígonos o áreas para implementar el Plan de Compensación por Pérdida de \nBiodiversidad y por compensación de ecosistemas diferentes a los naturales, con las áreas \nde retribución por la afectación de líquenes y plantas no vasculares en veda, por cuanto \natienden distintas finalidades como su misma denominación lo indica. \nPor último, respecto a los fundamentos de derecho que expuso la Sociedad para presentar \nel recurso de reposición que nos convoca, la Autoridad Nacional se permite indicar que \nprecisamente se realizó una interpretación del caso en virtud del principio de prevalencia \ndel derecho sustancial sobre el derecho formal, derivado del principio de eficacia; el \nprincipio de economía; y principio de sustracción de materia. \n2 Carlos Jaramillo Betancur, Derecho procesal administrativo, Colombia. Señal Editora, 2013.\n\nResolución No. 002151       Del 30 SEP. 2024          Hoja No. 35 de 56\n“Por la cual se resuelve un recurso de reposición interpuesto en contra de la \nResolución 1177 del 18 de junio de 2024”\nPágina 35 de 56\nAsí las cosas, y toda vez que fue verificada la información geográfica (GDB) remitida \nmediante radicado ANLA 20236200309622 del 5 de julio 2023, se logró identificar que los \npolígonos seleccionados inicialmente por la Sociedad, no coincidían con los presentados \nen la información documental del mismo radicado, ni con los aprobados en la tabla \nResumen del artículo primero de la Resolución 1177 del 18 de junio de 2024, objeto del \npresente recurso de reposición. Asimismo, esta verificación de información puso en \nevidencia polígonos no incluidos previamente en la citada Resolución. \nPor lo anteriormente expuesto, la Autoridad Nacional considera pertinente reponer en el \nsentido de modificar el artículo primero de la Resolución 1177 del 18 de agosto de 2024, de \nconformidad con lo preceptuado en el Concepto Técnico 5886 del 13 de agosto de 2024, lo \ncual se dispondrá en la parte resolutiva del presente acto administrativo.\n2.\nOBLIGACIÓN RECURRIDA – ARTÍCULO SEGUNDO Artículo segundo de la \nResolución 1177 del 18 de junio de 2024. \nEl acto administrativo recurrido señala:\n“ARTÍCULO SEGUNDO. La sociedad GRAN TIERRA ENERGY COLOMBIA GMBH \nSUCURSAL COLOMBIA deberá presentar en un término no superior a seis (6) \nmeses para el predio El Turpial, las coordenadas del polígono de las 1,09 ha \nfaltantes para la rehabilitación de líquenes y plantas no vasculares.”\nPetición de la Sociedad.\nLa Sociedad en el recurso de reposición presentado mediante comunicación con radicado \nANLA 20246200755382 del 4 de julio de 2024, solicitó:\n“SEGUNDA PETICIÓN: Que se REVOQUE en su integridad el artículo 2 de la \nResolución 001177 del 18 de junio de 2024, con la finalidad de que la asignación de \náreas para la implementación de las medidas de rehabilitación por la afectación de \nlíquenes y plantas no vasculares relacionadas con las Resoluciones 1808 del 5 de \nseptiembre de 2017 (11 áreas), Resolución 687 del 25 de abril de 2018 (Plataforma \nMultipozo Totumillo) y Resolución 1955 del 17 de octubre de 2018 (South West), \ncorresponda con la realidad fáctica y operativa del caso concreto. Las mismas se \nencuentran incluidas en los polígonos descritos en la primera petición.”\nArgumentos de la Sociedad.\nLos argumentos corresponden a los mismos que fueron presentados para la primera \npetición.\nConsideraciones Técnicas y Jurídicas de la ANLA. \nQue frente a lo anterior, esta Autoridad Nacional consideró en el Concepto Técnico 5886 \ndel 13 de agosto de 2024, lo que se señala a continuación:\n“De conformidad con las consideraciones y aclaraciones realizadas en el numeral 2.1.3 del \nConcepto Técnico, a partir de la revisión de la información geográfica (GDB) de las áreas \n\nResolución No. 002151       Del 30 SEP. 2024          Hoja No. 36 de 56\n“Por la cual se resuelve un recurso de reposición interpuesto en contra de la \nResolución 1177 del 18 de junio de 2024”\nPágina 36 de 56\nde retribución por la afectación de líquenes y plantas no vasculares en veda, remitidas \nmediante radicado ANLA 20236200309622 del 5 de julio 2023, se generaron los siguientes \npolígonos seleccionados inicialmente por la Sociedad, dentro de los predios Las Palmas, El \nTurpial y La Florida, discriminados por plataforma y asociados a cada expediente ATV de \nlevantamiento de veda, los cuales se detallan a continuación:\nPlataforma \n/pozo\nExpediente \nATV\nResolución \nveda\nÁrea \nestablecida-\nmedida\nPolígono \npropuesto \ngdb\nÁrea \npropuesta \ngdb\nFlorida5*\n1,10566\nTotumillo\nATV0686\n687 del 24 \nde abril de \n2018\n1 ha\nSubtotal\n1,10566\nTurpial1\n2,654097\n11 áreas\nATV0595\n1808 del 05 \nde \nseptiembre \nde 2017\n1 ha\nTurpial2\n1,548831\nSubtotal\n4,202928\nFlorida1*\n3,10596\nPalmas1\n0,209205\nPalmas2\n1,562345\nPalmas3\n1,167687\nPalmas4\n1,303493\nPalmas5\n0,559918\nPalmas6\n0,564267\nPalmas7\n1,205521\nPalmas8\n1,055914\nTurpial3\n2,093634\nTurpial4\n1,40137\nTurpial5\n1,167626\nTurpial6\n0,677956\nSubtotal\n16,074896\nSouth West ATV0812\n1955 del 17 \nde \noctubre \nde 2018\n15 ha\nTotal\n21,383484\nFuente: Radicado ANLA 20236200309622 del 5 de julio 2023- Anexo \n“LAV0105_00_2014.gdb” – shape “Otras compensaciones” capa “Levantamiento de \nvedas”.  Componente Geomático - Grupo de Servicios Geoespaciales-ANLA, 2024.\n*Polígonos no incluidos en la Resolución 1177 del 18 de junio de 2024\nDe conformidad con lo anterior y en consideración al Concepto Técnico del recurso de \nreposición, Concepto Técnico 5886 del 13 de agosto de 2024,  se está recomendando la \nmodificación del artículo primero de la Resolución 1177 del 18 de junio de 2024, \nestableciendo los polígonos y áreas propuestas en la tabla anterior, para la implementación \nde las medidas de rehabilitación por la afectación de líquenes y briofitos en veda, para lo \ncual se cumple con las áreas establecidas en la medida para cada expediente ATV, \nmedidas que serán objeto de verificación por parte de esta Autoridad en los seguimientos \nque se realicen al proyecto. \n\nResolución No. 002151       Del 30 SEP. 2024          Hoja No. 37 de 56\n“Por la cual se resuelve un recurso de reposición interpuesto en contra de la \nResolución 1177 del 18 de junio de 2024”\nPágina 37 de 56\nAhora, de acuerdo con lo establecido en la Resolución 1955 del 17 de octubre de 2018 \n(ATV0812), la Sociedad debe realizar una rehabilitación ecológica en 15 ha por la \nafectación de especies no vasculares en veda, y teniendo en cuenta lo resultante de la \nverificación de la información geográfica (GDB) remitida mediante radicado ANLA \n20236200309622 del 5 de julio 2023, la Sociedad propone 13 polígonos para el expediente \nATV0812, que suman un total de 16,07 ha, cumpliendo así con el área mínima solicitada \nde 15 ha.  \nPor lo anterior, y en atención al análisis técnico efectuado, se sugiere al equipo jurídico esta \nAutoridad encuentra procedente acceder a la pretensión de REVOCAR en su integridad el \nartículo Segundo de la Resolución 1177 del 18 de junio de 2024.”\nDe conformidad con lo preceptuado en el Concepto Técnico 5886 del 13 de agosto de 2024, \ny gracias a la verificación geográfica (GDB) remitida mediante radicado ANLA \n20236200309622 del 5 de julio 2023, la Autoridad Nacional declara el cumplimiento del área \nmínima solicitada para el expediente ATV0812 en la Resolución 1955 del 17 de octubre de \n2018. En consecuencia, por cuanto han desaparecido los fundamentos de hecho que \nsustentaron la obligación recurrida, y en aplicación del principio de sustracción de materia, \ncarece de objeto el requerir a la Sociedad el presentar en un término no superior a seis (6) \nmeses para el predio El Turpial, las coordenadas del polígono de las 1,09 ha faltantes para \nla rehabilitación de líquenes y plantas no vasculares. Así las cosas, la Autoridad Nacional \nrepone en el sentido de revocar el artículo segundo de la Resolución 1177 del 18 de junio \nde 2024, y estará contenido en la parte resolutiva del presente acto administrativo.\nCONSIDERACIONES JURÍDICAS DE LA AUTORIDAD NACIONAL RESPECTO DE LAS \nOBLIGACIONES RECURRIDAS. \nEn virtud de los principios orientadores consagrados en el Artículo 209 de la Carta Política, \nen concordancia con lo establecido en el artículo tercero del Código de Procedimiento \nAdministrativo y de lo Contencioso Administrativo, que establece los principios orientadores \nde las actuaciones administrativas, especialmente, en los principios de responsabilidad, \nlegalidad, coordinación, eficacia y celeridad, a saber:\n“Artículo 3°. Principios. Todas las autoridades deberán interpretar y aplicar las \ndisposiciones que regulan las actuaciones y procedimientos administrativos a la luz \nde los principios consagrados en la Constitución Política, en la Parte Primera de este \nCódigo y en las leyes especiales. Las actuaciones administrativas se desarrollarán, \nespecialmente, con arreglo a los principios del debido proceso, igualdad, \nimparcialidad, buena fe, moralidad, participación, responsabilidad, transparencia, \npublicidad, coordinación, eficacia, economía y celeridad.\n(…)\n7. En virtud del principio de responsabilidad, las autoridades y sus agentes asumirán \nlas consecuencias por sus decisiones, omisiones o extralimitación de funciones, de \nacuerdo con la Constitución, las leyes y los reglamentos.\n(…)\n\nResolución No. 002151       Del 30 SEP. 2024          Hoja No. 38 de 56\n“Por la cual se resuelve un recurso de reposición interpuesto en contra de la \nResolución 1177 del 18 de junio de 2024”\nPágina 38 de 56\n10. En virtud del principio de coordinación, las autoridades concertarán sus \nactividades con las de otras instancias estatales en el cumplimiento de sus \ncometidos y en el reconocimiento de sus derechos a los particulares.\n (…)\n11. En virtud del principio de eficacia, las autoridades buscarán que los \nprocedimientos logren su finalidad y, para el efecto, removerán de oficio los \nobstáculos puramente formales, evitarán decisiones inhibitorias, dilaciones o \nretardos y sanearán, de acuerdo con este Código las irregularidades \nprocedimentales que se presenten, en procura de la efectividad del derecho material \nobjeto de la actuación administrativa. \n(…)\n13. En virtud del principio de celeridad, las autoridades impulsarán oficiosamente los \nprocedimientos, e incentivarán el uso de las tecnologías de la información y las \ncomunicaciones, a efectos de que los procedimientos se adelanten con diligencia, \ndentro de los términos legales y sin dilaciones injustificadas.”\nAhora bien, esta Autoridad en sus actuaciones administrativas debe cumplir con los \nprincipios orientadores antes mencionados toda vez que dichas actuaciones son la \nmanifestación de la voluntad de la administración, sus efectos se traducen en crear, \nmodificar o extinguir derechos u obligaciones de carácter particular, personal y concreto, \ncon el fin de establecer una obligación tendiente a crear situaciones específicas, teniendo \ncomo presupuesto la sujeción al orden público y el respeto por las garantías y derechos de \nlos administrados.\nEs preciso señalar en el presente caso, la importancia que el principio fundamental al debido \nproceso reviste para asegurar también el cumplimiento de otros postulados fundamentales \ny de derechos de consagración constitucional y legal, como el derecho colectivo al ambiente \nsano, responsabilidad de autoridades y particulares.\nLa Corte Constitucional ha establecido que el derecho al debido proceso tiene unas \ngarantías previas y unas garantías posteriores, así:\n“La jurisprudencia constitucional ha diferenciado entre las garantías previas y \nposteriores que implica el derecho al debido proceso en materia administrativa. Las \ngarantías mínimas previas se relacionan con aquellas garantías mínimas que \nnecesariamente deben cobijar la expedición y ejecución de cualquier acto o \nprocedimiento administrativo, tales como el acceso libre y en condiciones de \nigualdad a la justicia, el juez natural, el derecho de defensa, la razonabilidad de los \nplazos y la imparcialidad, autonomía e independencia de los jueces, entre otras.\nDe otro lado, las garantías mínimas posteriores se refieren a la posibilidad de \ncuestionar la validez jurídica de una decisión administrativa, mediante los recursos \nde la vía gubernativa y la jurisdicción contenciosa administrativa.”\n\nResolución No. 002151       Del 30 SEP. 2024          Hoja No. 39 de 56\n“Por la cual se resuelve un recurso de reposición interpuesto en contra de la \nResolución 1177 del 18 de junio de 2024”\nPágina 39 de 56\nEn ese sentido, esta Autoridad respetó las garantías previas, ya que cumplió con todas las \nformalidades para emitir la Resolución 1177 del 18 de junio de 2024, “Por la cual se \naprueban unos predios para la rehabilitación de líquenes y plantas no vasculares en veda \ny se adoptan otras determinaciones”, para el proyecto denominado “Campo de Explotación \nde Hidrocarburos Acordionero”, localizado en jurisdicción del municipio de San Martín en el \ndepartamento del Cesar, respetó las garantías posteriores, en tanto que se concedió el \nrespectivo recurso de reposición sobre el acto administrativo.\nCon base en las consideraciones técnicas descritas en el Concepto Técnico 5886 del 13 de \nagosto de 2024 y teniendo en cuenta que esta Autoridad Ambiental consideró lo expuesto \npor la sociedad recurrente, estableciendo un análisis claro de las medidas que se \nestablecieron, su pertinencia y proporcionalidad.\nAsí las cosas, el presente acto administrativo acogerá lo preceptuado por el Concepto \nTécnico 5886 del 13 de agosto de 2024, para reponer en el sentido de modificar el artículo \nprimero de la Resolución 1177 del 18 de junio de 2024, de tal manera que esta Autoridad \nNacional aprueba las áreas para la implementación de las medidas de rehabilitación por la \nafectación de líquenes y plantas no vasculares relacionadas con las Resoluciones 1808 del \n5 de septiembre de 2017 (11 áreas), Resolución 687 del 25 de abril de 2018 (Plataforma \nmultipozo Totumillo) y Resolución 1955 del 17 de octubre de 2018 (South West) y en \nconsecuencia por carecer de objeto el requerir las 1,09 ha faltantes para la rehabilitación \nde líquenes y plantas no vasculares ante la desaparición de los fundamentos de hecho, y \nen consecuencia se procede a reponer en el sentido de revocar el artículo segundo de la \nResolución 1177 del 18 de junio de 2024. \nAsí las cosas, en aplicación de los principios que rigen las actuaciones administrativas, \nconsagrados en el artículo 209 de la Constitución Política de 1991, así como en el artículo \n3 de la Ley 1437 de 2011, y demás normas concordantes, aunado al ejercicio permanente \nde observancia de los principios que rigen la política ambiental en el territorio nacional \nprevistos en la Ley 99 de 1993 y en el Decreto 1076 de 2015, esta Entidad adoptará las \ndecisiones que corresponden en torno al presente recurso, habiendo además, respetado el \nderecho de defensa del administrado.\nPara culminar, el presente pronunciamiento se emite con verificación de los principios de la \nfunción administrativa, consagrados en el artículo 209 de la Constitución Política de \nColombia, desarrollados, entre otras, por la Ley 1437 de 2011, así como los principios de \nla política ambiental previstos en la Ley 99 de 1993 y sus reglamentos, y en aplicación de \nla garantía del derecho de defensa y contradicción que le asiste al administrado – en este \ncaso a la sociedad GRAN TIERRA ENERGY COLOMBIA GMBH SUCURSAL COLOMBIA-, \nconforme al artículo 29 de la Carta Política Nacional; por lo tanto, contra la presente \nprovidencia no procede recurso de reposición, como se establecerá en la parte resolutiva \ndel presente acto administrativo.\nEn mérito de lo expuesto, la Autoridad Nacional de Licencias Ambientales – ANLA,\nRESUELVE\n\nResolución No. 002151       Del 30 SEP. 2024          Hoja No. 40 de 56\n“Por la cual se resuelve un recurso de reposición interpuesto en contra de la \nResolución 1177 del 18 de junio de 2024”\nPágina 40 de 56\nARTÍCULO PRIMERO. Reponer en el sentido de modificar el artículo primero de la \nResolución 1177 del 18 de junio de 2024, de conformidad con las razones expuestas en la \nparte motiva del presente acto administrativo, el cual quedará en los siguientes términos:\n“ARTÍCULO PRIMERO. APROBAR los polígonos Florida 1 y 5, Turpial 1, 2, 3, 4, 5 \ny 6, y Palmas 1, 2, 3, 4, 5, 6, 7 y 8, propuestos dentro de los predios privados Las \nPalmas y El Turpial, ubicados en la vereda El Cobre y predio La Florida, ubicado en \nla vereda El Loro, del municipio de San Martín en el departamento del Cesar, para \nla implementación de las medidas de rehabilitación por la afectación de líquenes y \nbriofitos en veda relacionadas con las Resoluciones 1808 del 5 de septiembre de \n2017 (11 áreas), Resolución 687 del 25 de abril de 2018 (Plataforma Multipozo \nTotumillo) y Resolución 1955 del 17 de octubre de 2018 (South West), asociados al \nproyecto denominado “Campo de Explotación de Hidrocarburos Acordionero”, y que \nse detallan en la siguiente tabla:\nResumen de la asignación de los polígonos para la rehabilitación\nPlataforma \n/pozo\nExpedien\nte ATV\nResolución \nveda\nÁrea \nestablecida-\nmedida\nPolígono \npropuesto \ngdb\nÁrea \npropuesta \ngdb\nFlorida5\n1,10566\nTotumillo\nATV0686\n687 del 24 de \nabril de 2018\n1 ha\nSubtotal\n1,10566\nTurpial1\n2,654097\n11 áreas\nATV0595\n1808 del 05 \nde \nseptiembre \nde 2017\n1 ha\nTurpial2\n1,548831\nSubtotal\n4,202928\nFlorida1\n3,10596\nPalmas1\n0,209205\nPalmas2\n1,562345\nPalmas3\n1,167687\nPalmas4\n1,303493\nPalmas5\n0,559918\nPalmas6\n0,564267\nPalmas7\n1,205521\nPalmas8\n1,055914\nTurpial3\n2,093634\nTurpial4\n1,40137\nTurpial5\n1,167626\nTurpial6\n0,677956\nSubtotal\n16,074896\nSouth West\nATV0812\n1955 del 17 \nde \noctubre \nde 2018\n15 ha\nTotal\n21,383484\nPARÁGRAFO PRIMERO: Las coordenadas de cada uno de los polígonos se enlistan a \ncontinuación: \nTabla 1. Polígono Florida 5 - ATV0686 – Resolución 687 del 24 de abril de 2018\n\nResolución No. 002151       Del 30 SEP. 2024          Hoja No. 41 de 56\n“Por la cual se resuelve un recurso de reposición interpuesto en contra de la \nResolución 1177 del 18 de junio de 2024”\nPágina 41 de 56\nCOORDENADAS \nMAGNA \nSIRGAS \nORIGEN NACIONAL\nCOORDENADAS \nMAGNA \nSIRGAS \nORIGEN NACIONAL\nCOORDENADAS \nMAGNA \nSIRGAS \nORIGEN NACIONAL\nORIG_F\nID\nESTE\nNORTE\nORIG_F\nID\nESTE\nNORTE\nORIG_F\nID\nESTE\nNORTE\n1\n4956515,\n53\n2443364,\n26\n17\n4956460,\n77\n2443485,\n7\n33\n4956531,\n41\n2443451,\n57\n2\n4956508,\n39\n2443371,\n4\n18\n4956462,\n35\n2443493,\n64\n34\n4956536,\n97\n2443449,\n98\n3\n4956483,\n78\n2443390,\n45\n19\n4956468,\n7\n2443502,\n37\n35\n4956544,\n11\n2443446,\n81\n4\n4956467,\n91\n2443398,\n39\n20\n4956468,\n7\n2443512,\n69\n36\n4956551,\n25\n2443443,\n63\n5\n4956459,\n18\n2443411,\n88\n21\n4956461,\n56\n2443517,\n45\n37\n4956556,\n02\n2443441,\n25\n6\n4956446,\n48\n2443424,\n58\n22\n4956462,\n35\n2443526,\n98\n38\n4956559,\n98\n2443434,\n11\n7\n4956439,\n33\n2443434,\n11\n23\n4956470,\n29\n2443534,\n92\n39\n4956560,\n78\n2443428,\n55\n8\n4956430,\n6\n2443438,\n87\n24\n4956486,\n96\n2443538,\n88\n40\n4956562,\n37\n2443418,\n23\n9\n4956417,\n9\n2443444,\n43\n25\n4956494,\n1\n2443526,\n98\n41\n4956559,\n98\n2443414,\n27\n10\n4956411,\n55\n2443447,\n6\n26\n4956495,\n69\n2443508,\n72\n42\n4956551,\n25\n2443408,\n71\n11\n4956406,\n79\n2443453,\n16\n27\n4956506,\n01\n2443498,\n4\n43\n4956537,\n76\n2443407,\n92\n12\n4956413,\n14\n2443461,\n89\n28\n4956506,\n01\n2443487,\n29\n44\n4956530,\n62\n2443402,\n36\n13\n4956424,\n25\n2443461,\n1\n29\n4956508,\n39\n2443474,\n59\n45\n4956526,\n65\n2443389,\n66\n14\n4956439,\n33\n2443466,\n65\n30\n4956514,\n74\n2443464,\n27\n46\n4956525,\n06\n2443388,\n07\n15\n4956444,\n1\n2443469,\n83\n31\n4956517,\n92\n2443461,\n89\n47\n4956515,\n53\n2443364,\n26\n16\n4956451,\n24\n2443476,\n97\n32\n4956527,\n44\n2443453,\n95\nFuente: Radicado ANLA 20236200309622 del 5 de julio 2023- Anexo \n“LAV0105_00_2014.gdb” – shape “Otras compensaciones” capa “Levantamiento de \nvedas”.  Componente Geomático - Grupo de Servicios Geoespaciales-ANLA, 2024.\nTabla 2. Polígono Turpial 1 - ATV0595 - Resolución 1808 del 05 de septiembre de 2017\nCOORDENADAS \nMAGNA \nSIRGAS \nORIGEN NACIONAL\nCOORDENADAS \nMAGNA \nSIRGAS \nORIGEN NACIONAL\nCOORDENADAS \nMAGNA \nSIRGAS \nORIGEN NACIONAL\nORIG_F\nID\nESTE\nNORTE\nORIG_F\nID\nESTE\nNORTE\nORIG_F\nID\nESTE\nNORTE\n1\n4954878,\n56\n2443200,\n49\n19\n4954869,\n04\n2443080,\n63\n37\n4954744,\n54\n2443220,\n92\n2\n4954889,\n67\n2443202,\n87\n20\n4954858,\n72\n2443071,\n11\n38\n4954744,\n54\n2443232,\n57\n3\n4954897,\n61\n2443193,\n34\n21\n4954850,\n78\n2443063,\n17\n39\n4954733,\n95\n2443236,\n11\n\nResolución No. 002151       Del 30 SEP. 2024          Hoja No. 42 de 56\n“Por la cual se resuelve un recurso de reposición interpuesto en contra de la \nResolución 1177 del 18 de junio de 2024”\nPágina 42 de 56\nFuente: Radicado ANLA 20236200309622 del 5 de julio 2023- Anexo \n“LAV0105_00_2014.gdb” – shape “Otras compensaciones” capa “Levantamiento de \nvedas”.  Componente Geomático - Grupo de Servicios Geoespaciales-ANLA, 2024.\nTabla 3. Polígono Turpial 2 - ATV0595 - Resolución 1808 del 05 de septiembre de 2017\nCOORDENADAS \nMAGNA \nSIRGAS \nORIGEN NACIONAL\nCOORDENADAS \nMAGNA \nSIRGAS \nORIGEN NACIONAL\nCOORDENADAS \nMAGNA \nSIRGAS \nORIGEN NACIONAL\nORIG_F\nID\nESTE\nNORTE\nORIG_F\nID\nESTE\nNORTE\nORIG_F\nID\nESTE\nNORTE\n1\n4954955,\n55\n2443129,\n05\n19\n4954992,\n86\n2443056,\n82\n37\n4954846,\n81\n2442971,\n09\n2\n4954965,\n87\n2443127,\n46\n20\n4954986,\n51\n2443050,\n47\n38\n4954842,\n84\n2442975,\n06\n3\n4954971,\n43\n2443125,\n88\n21\n4954978,\n57\n2443043,\n33\n39\n4954838,\n08\n2442986,\n97\n4\n4954973,\n81\n2443119,\n53\n22\n4954967,\n46\n2443033,\n01\n40\n4954836,\n49\n2442999,\n67\n5\n4954988,\n89\n2443119,\n53\n23\n4954958,\n73\n2443032,\n21\n41\n4954839,\n67\n2443004,\n43\n6\n4955002,\n39\n2443123,\n49\n24\n4954955,\n55\n2443029,\n04\n42\n4954843,\n64\n2443016,\n34\n4\n4954903,\n96\n2443184,\n61\n22\n4954838,\n08\n2443062,\n38\n40\n4954732,\n79\n2443253,\n82\n5\n4954914,\n28\n2443174,\n29\n23\n4954828,\n55\n2443067,\n93\n41\n4954756,\n79\n2443291,\n5\n6\n4954920,\n63\n2443167,\n15\n24\n4954822,\n2\n2443074,\n28\n42\n4954810,\n49\n2443319,\n52\n7\n4954925,\n39\n2443158,\n42\n25\n4954819,\n03\n2443080,\n63\n43\n4954821,\n8\n2443300,\n3\n8\n4954927,\n77\n2443149,\n69\n26\n4954819,\n03\n2443083,\n81\n44\n4954830,\n27\n2443293,\n95\n9\n4954923,\n01\n2443139,\n37\n27\n4954809,\n1\n2443093,\n92\n45\n4954837,\n68\n2443285,\n48\n10\n4954916,\n66\n2443130,\n64\n28\n4954801,\n69\n2443107,\n68\n46\n4954849,\n32\n2443271,\n73\n11\n4954913,\n49\n2443125,\n88\n29\n4954796,\n4\n2443120,\n38\n47\n4954854,\n61\n2443264,\n32\n12\n4954907,\n93\n2443121,\n11\n30\n4954791,\n11\n2443134,\n14\n48\n4954852,\n49\n2443250,\n56\n13\n4954903,\n96\n2443116,\n35\n31\n4954777,\n35\n2443155,\n31\n49\n4954857,\n78\n2443237,\n86\n14\n4954895,\n23\n2443110\n32\n4954766,\n77\n2443165,\n89\n50\n4954869,\n43\n2443231,\n51\n15\n4954884,\n91\n2443108,\n41\n33\n4954759,\n36\n2443177,\n53\n51\n4954876,\n83\n2443226,\n22\n16\n4954873,\n8\n2443102,\n86\n34\n4954756,\n18\n2443190,\n23\n52\n4954878,\n95\n2443218,\n81\n17\n4954873,\n8\n2443095,\n71\n35\n4954753,\n01\n2443205,\n05\n53\n4954872,\n6\n2443213,\n52\n18\n4954876,\n97\n2443086,\n98\n36\n4954746,\n66\n2443212,\n46\n54\n4954878,\n56\n2443200,\n49\n\nResolución No. 002151       Del 30 SEP. 2024          Hoja No. 43 de 56\n“Por la cual se resuelve un recurso de reposición interpuesto en contra de la \nResolución 1177 del 18 de junio de 2024”\nPágina 43 de 56\n7\n4955008,\n74\n2443125,\n08\n25\n4954950\n2443021,\n89\n43\n4954844,\n43\n2443025,\n07\n8\n4955024,\n61\n2443129,\n05\n26\n4954946,\n82\n2443013,\n96\n44\n4954854,\n75\n2443029,\n83\n9\n4955033,\n34\n2443129,\n05\n27\n4954940,\n47\n2443003,\n64\n45\n4954865,\n07\n2443036,\n98\n10\n4955034,\n14\n2443127,\n46\n28\n4954938,\n09\n2443000,\n46\n46\n4954876,\n97\n2443047,\n29\n11\n4955034,\n93\n2443117,\n94\n29\n4954934,\n12\n2442994,\n11\n47\n4954890,\n47\n2443055,\n23\n12\n4955035,\n72\n2443109,\n21\n30\n4954928,\n57\n2442989,\n35\n48\n4954899,\n2\n2443065,\n55\n13\n4955035,\n72\n2443099,\n68\n31\n4954918,\n25\n2442983\n49\n4954911,\n1\n2443080,\n63\n14\n4955028,\n58\n2443089,\n36\n32\n4954910,\n31\n2442980,\n62\n50\n4954920,\n63\n2443087,\n78\n15\n4955023,\n02\n2443083,\n01\n33\n4954897,\n61\n2442971,\n89\n51\n4954927,\n77\n2443100,\n48\n16\n4955016,\n67\n2443075,\n87\n34\n4954881,\n74\n2442967,\n13\n52\n4954941,\n27\n2443112,\n38\n17\n4955012,\n7\n2443070,\n31\n35\n4954860,\n3\n2442960,\n78\n53\n4954950\n2443119,\n53\n18\n4955002,\n39\n2443062,\n38\n36\n4954850,\n78\n2442965,\n54\n54\n4954955,\n55\n2443129,\n05\nFuente: Radicado ANLA 20236200309622 del 5 de julio 2023- Anexo \n“LAV0105_00_2014.gdb” – shape “Otras compensaciones” capa “Levantamiento de \nvedas”.  Componente Geomático - Grupo de Servicios Geoespaciales-ANLA, 2024.\nTabla 4. Polígono Florida 1- ATV0812 – Resolución 1955 del 17 de octubre de 2018\nCOORDENADAS \nMAGNA \nSIRGAS \nORIGEN NACIONAL\nCOORDENADAS \nMAGNA \nSIRGAS \nORIGEN NACIONAL\nCOORDENADAS \nMAGNA \nSIRGAS \nORIGEN NACIONAL\nORIG_F\nID\nESTE\nNORTE\nORIG_F\nID\nESTE\nNORTE\nORIG_F\nID\nESTE\nNORTE\n1\n4956162,\n36\n2443352,\n3\n25\n4956314,\n71\n2443289,\n65\n49\n4956287,\n73\n2443195,\n19\n2\n4956178,\n98\n2443340,\n45\n26\n4956328,\n21\n2443281,\n71\n50\n4956278,\n2\n2443195,\n98\n3\n4956188,\n51\n2443330,\n13\n27\n4956336,\n94\n2443280,\n12\n51\n4956273,\n44\n2443197,\n57\n4\n4956194,\n06\n2443326,\n16\n28\n4956347,\n26\n2443277,\n74\n52\n4956258,\n36\n2443204,\n72\n5\n4956204,\n38\n2443322,\n19\n29\n4956352,\n81\n2443273,\n77\n53\n4956249,\n63\n2443208,\n68\n6\n4956213,\n91\n2443311,\n87\n30\n4956363,\n93\n2443269,\n8\n54\n4956240,\n9\n2443215,\n83\n7\n4956233,\n75\n2443307,\n11\n31\n4956371,\n87\n2443265,\n04\n55\n4956224,\n23\n2443222,\n18\n8\n4956248,\n04\n2443294,\n41\n32\n4956375,\n83\n2443257,\n1\n56\n4956219,\n46\n2443226,\n15\n9\n4956254,\n39\n2443289,\n65\n33\n4956379,\n8\n2443247,\n58\n57\n4956187,\n71\n2443232,\n5\n10\n4956278,\n2\n2443276,\n95\n34\n4956384,\n57\n2443235,\n67\n58\n4956175,\n01\n2443238,\n05\n\nResolución No. 002151       Del 30 SEP. 2024          Hoja No. 44 de 56\n“Por la cual se resuelve un recurso de reposición interpuesto en contra de la \nResolución 1177 del 18 de junio de 2024”\nPágina 44 de 56\n11\n4956290,\n9\n2443271,\n39\n35\n4956388,\n53\n2443231,\n7\n59\n4956161,\n52\n2443243,\n61\n12\n4956295,\n66\n2443269,\n01\n36\n4956393,\n3\n2443224,\n56\n60\n4956146,\n44\n2443249,\n17\n13\n4956291,\n7\n2443279,\n33\n37\n4956403,\n62\n2443208,\n68\n61\n4956142,\n47\n2443257,\n9\n14\n4956284,\n55\n2443282,\n5\n38\n4956409,\n17\n2443194,\n4\n62\n4956142,\n47\n2443265,\n83\n15\n4956279,\n79\n2443287,\n27\n39\n4956401,\n23\n2443184,\n08\n63\n4956140,\n88\n2443274,\n57\n16\n4956269,\n47\n2443293,\n62\n40\n4956394,\n09\n2443176,\n93\n64\n4956133,\n03\n2443283,\n6\n17\n4956259,\n15\n2443300,\n76\n41\n4956383,\n77\n2443166,\n61\n65\n4956120,\n91\n2443251,\n79\n18\n4956254,\n39\n2443304,\n73\n42\n4956367,\n1\n2443165,\n82\n66\n4956054,\n71\n2443300,\n89\n19\n4956250,\n42\n2443312,\n67\n43\n4956352,\n81\n2443169\n67\n4956068,\n32\n2443320,\n76\n20\n4956253,\n6\n2443318,\n22\n44\n4956339,\n32\n2443173,\n76\n68\n4956113,\n61\n2443354,\n9\n21\n4956259,\n95\n2443315,\n84\n45\n4956330,\n59\n2443173,\n76\n69\n4956134,\n99\n2443377,\n29\n22\n4956277,\n41\n2443311,\n87\n46\n4956310,\n75\n2443184,\n08\n70\n4956162,\n36\n2443352,\n3\n23\n4956288,\n52\n2443304,\n73\n47\n4956309,\n16\n2443192,\n81\n24\n4956293,\n28\n2443303,\n14\n48\n4956299,\n63\n2443195,\n19\nFuente: Radicado ANLA 20236200309622 del 5 de julio 2023- Anexo \n“LAV0105_00_2014.gdb” – shape “Otras compensaciones” capa “Levantamiento de \nvedas”.  Componente Geomático - Grupo de Servicios Geoespaciales-ANLA, 2024.\nTabla 5. Polígono Palmas 1- ATV0812 – Resolución 1955 del 17 de octubre de 2018\nCOORDENADAS \nMAGNA \nSIRGAS \nORIGEN NACIONAL\nCOORDENADAS \nMAGNA \nSIRGAS \nORIGEN NACIONAL\nCOORDENADAS \nMAGNA \nSIRGAS \nORIGEN NACIONAL\nORIG_F\nID\nESTE\nNORTE\nORIG_F\nID\nESTE\nNORTE\nORIG_F\nID\nESTE\nNORTE\n1\n4955365,\n76\n2442855,\n26\n10\n4955323,\n7\n2442893,\n36\n19\n4955364,\n18\n2442885,\n42\n2\n4955347,\n51\n2442856,\n05\n11\n4955330,\n84\n2442900,\n5\n20\n4955364,\n18\n2442883,\n04\n3\n4955337,\n19\n2442860,\n82\n12\n4955334,\n01\n2442906,\n06\n21\n4955372,\n91\n2442883,\n83\n4\n4955333,\n22\n2442863,\n99\n13\n4955337,\n19\n2442909,\n23\n22\n4955374,\n5\n2442877,\n48\n5\n4955328,\n46\n2442863,\n99\n14\n4955341,\n95\n2442911,\n62\n23\n4955379,\n26\n2442874,\n31\n6\n4955318,\n14\n2442863,\n99\n15\n4955345,\n13\n2442905,\n27\n24\n4955374,\n5\n2442872,\n72\n7\n4955311,\n79\n2442868,\n75\n16\n4955349,\n1\n2442901,\n3\n25\n4955372,\n12\n2442871,\n13\n8\n4955306,\n23\n2442872,\n72\n17\n4955349,\n1\n2442895,\n74\n26\n4955365,\n76\n2442855,\n26\n\nResolución No. 002151       Del 30 SEP. 2024          Hoja No. 45 de 56\n“Por la cual se resuelve un recurso de reposición interpuesto en contra de la \nResolución 1177 del 18 de junio de 2024”\nPágina 45 de 56\n9\n4955311\n2442879,\n87\n18\n4955358,\n62\n2442885,\n42\nFuente: Radicado ANLA 20236200309622 del 5 de julio 2023- Anexo \n“LAV0105_00_2014.gdb” – shape “Otras compensaciones” capa “Levantamiento de \nvedas”. Componente Geomático - Grupo de Servicios Geoespaciales-ANLA, 2024.\nTabla 6. Polígono Palmas 2- ATV0812 – Resolución 1955 del 17 de octubre de 2018\nCOORDENADAS \nMAGNA \nSIRGAS \nORIGEN NACIONAL\nCOORDENADAS \nMAGNA \nSIRGAS \nORIGEN NACIONAL\nCOORDENADAS \nMAGNA \nSIRGAS \nORIGEN NACIONAL\nORIG_F\nID\nESTE\nNORTE\nORIG_F\nID\nESTE\nNORTE\nORIG_F\nID\nESTE\nNORTE\n1\n4955353,\n06\n2442914\n26\n4955576,\n9\n2442882,\n25\n51\n4955452,\n28\n2442864,\n78\n2\n4955361\n2442920,\n35\n27\n4955562,\n62\n2442875,\n1\n52\n4955443,\n55\n2442866,\n37\n3\n4955368,\n15\n2442932,\n25\n28\n4955548,\n33\n2442873,\n52\n53\n4955436,\n41\n2442871,\n13\n4\n4955382,\n43\n2442936,\n22\n29\n4955545,\n15\n2442871,\n13\n54\n4955438\n2442879,\n07\n5\n4955388,\n78\n2442942,\n57\n30\n4955540,\n39\n2442865,\n58\n55\n4955441,\n97\n2442884,\n63\n6\n4955402,\n28\n2442954,\n48\n31\n4955534,\n04\n2442863,\n2\n56\n4955438,\n79\n2442888,\n6\n7\n4955409,\n42\n2442963,\n21\n32\n4955532,\n45\n2442859,\n23\n57\n4955432,\n44\n2442888,\n6\n8\n4955427,\n68\n2442955,\n27\n33\n4955525,\n31\n2442847,\n32\n58\n4955424,\n5\n2442885,\n42\n9\n4955444,\n35\n2442950,\n51\n34\n4955521,\n34\n2442837,\n8\n59\n4955427,\n68\n2442894,\n15\n10\n4955458,\n63\n2442938,\n6\n35\n4955515,\n78\n2442837,\n8\n60\n4955436,\n41\n2442899,\n71\n11\n4955469,\n75\n2442939,\n4\n36\n4955503,\n08\n2442839,\n38\n61\n4955434,\n82\n2442903,\n68\n12\n4955480,\n07\n2442937,\n02\n37\n4955496,\n73\n2442847,\n32\n62\n4955430,\n85\n2442907,\n65\n13\n4955490,\n38\n2442932,\n25\n38\n4955487,\n21\n2442847,\n32\n63\n4955423,\n71\n2442906,\n85\n14\n4955491,\n97\n2442932,\n25\n39\n4955488\n2442840,\n18\n64\n4955411,\n01\n2442902,\n88\n15\n4955504,\n67\n2442925,\n9\n40\n4955480,\n07\n2442833,\n03\n65\n4955401,\n48\n2442894,\n95\n16\n4955506,\n26\n2442925,\n9\n41\n4955475,\n3\n2442824,\n3\n66\n4955397,\n52\n2442889,\n39\n17\n4955533,\n25\n2442919,\n55\n42\n4955467,\n37\n2442818,\n75\n67\n4955390,\n37\n2442883,\n04\n18\n4955544,\n36\n2442917,\n17\n43\n4955466,\n57\n2442814,\n78\n68\n4955384,\n02\n2442886,\n22\n19\n4955553,\n09\n2442913,\n2\n44\n4955462,\n6\n2442810,\n02\n69\n4955380,\n05\n2442889,\n39\n20\n4955568,\n97\n2442909,\n23\n45\n4955458,\n63\n2442810,\n81\n70\n4955372,\n11\n2442892,\n57\n21\n4955595,\n16\n2442906,\n85\n46\n4955453,\n08\n2442816,\n37\n71\n4955368,\n15\n2442894,\n15\n\nResolución No. 002151       Del 30 SEP. 2024          Hoja No. 46 de 56\n“Por la cual se resuelve un recurso de reposición interpuesto en contra de la \nResolución 1177 del 18 de junio de 2024”\nPágina 46 de 56\n22\n4955600,\n72\n2442903,\n68\n47\n4955450,\n7\n2442817,\n95\n72\n4955364,\n18\n2442898,\n92\n23\n4955602,\n3\n2442898,\n12\n48\n4955441,\n17\n2442829,\n07\n73\n4955358,\n62\n2442906,\n06\n24\n4955597,\n54\n2442895,\n74\n49\n4955438,\n79\n2442841,\n77\n74\n4955353,\n06\n2442914\n25\n4955587,\n22\n2442887,\n8\n50\n4955443,\n55\n2442848,\n12\nFuente: Radicado ANLA 20236200309622 del 5 de julio 2023- Anexo \n“LAV0105_00_2014.gdb” – shape “Otras compensaciones” capa “Levantamiento de \nvedas”. Componente Geomático - Grupo de Servicios Geoespaciales-ANLA, 2024.\nTabla 7. Polígono Palmas 3 - ATV0812 – Resolución 1955 del 17 de octubre de 2018\nCOORDENADAS \nMAGNA \nSIRGAS \nORIGEN NACIONAL\nCOORDENADAS \nMAGNA \nSIRGAS \nORIGEN NACIONAL\nCOORDENADAS \nMAGNA \nSIRGAS \nORIGEN NACIONAL\nORIG_F\nID\nESTE\nNORTE\nORIG_F\nID\nESTE\nNORTE\nORIG_F\nID\nESTE\nNORTE\n1\n4955615\n2442915,\n58\n19\n4955630,\n88\n2442804,\n46\n37\n4955550,\n71\n2442828,\n27\n2\n4955635,\n64\n2442924,\n32\n20\n4955625,\n32\n2442790,\n97\n38\n4955560,\n23\n2442829,\n86\n3\n4955657,\n07\n2442928,\n28\n21\n4955618,\n18\n2442785,\n41\n39\n4955572,\n93\n2442837,\n8\n4\n4955665,\n01\n2442930,\n67\n22\n4955613,\n42\n2442783,\n03\n40\n4955578,\n49\n2442840,\n18\n5\n4955688,\n82\n2442936,\n22\n23\n4955600,\n72\n2442783,\n03\n41\n4955585,\n63\n2442844,\n94\n6\n4955701,\n52\n2442933,\n84\n24\n4955592,\n78\n2442781,\n44\n42\n4955591,\n19\n2442851,\n29\n7\n4955705,\n49\n2442927,\n49\n25\n4955577,\n7\n2442777,\n47\n43\n4955596,\n75\n2442858,\n43\n8\n4955702,\n32\n2442919,\n55\n26\n4955564,\n2\n2442770,\n33\n44\n4955600,\n72\n2442860,\n82\n9\n4955688,\n82\n2442902,\n09\n27\n4955559,\n44\n2442773,\n5\n45\n4955603,\n1\n2442862,\n4\n10\n4955688,\n82\n2442896,\n53\n28\n4955556,\n27\n2442780,\n65\n46\n4955606,\n27\n2442872,\n72\n11\n4955684,\n06\n2442887,\n01\n29\n4955556,\n27\n2442788,\n58\n47\n4955611,\n03\n2442876,\n69\n12\n4955672,\n95\n2442874,\n31\n30\n4955556,\n27\n2442790,\n17\n48\n4955615\n2442885,\n42\n13\n4955671,\n36\n2442870,\n34\n31\n4955549,\n92\n2442794,\n93\n49\n4955612,\n62\n2442888,\n6\n14\n4955661,\n04\n2442857,\n64\n32\n4955547,\n53\n2442797,\n32\n50\n4955611,\n03\n2442890,\n18\n15\n4955661,\n83\n2442849,\n7\n33\n4955549,\n92\n2442802,\n87\n51\n4955610,\n24\n2442894,\n15\n16\n4955653,\n1\n2442829,\n86\n34\n4955545,\n95\n2442807,\n63\n52\n4955612,\n62\n2442903,\n68\n17\n4955643,\n58\n2442819,\n54\n35\n4955545,\n95\n2442811,\n6\n53\n4955615\n2442915,\n58\n18\n4955640,\n4\n2442811,\n6\n36\n4955543,\n57\n2442820,\n33\n\nResolución No. 002151       Del 30 SEP. 2024          Hoja No. 47 de 56\n“Por la cual se resuelve un recurso de reposición interpuesto en contra de la \nResolución 1177 del 18 de junio de 2024”\nPágina 47 de 56\nFuente: Radicado ANLA 20236200309622 del 5 de julio 2023- Anexo \n“LAV0105_00_2014.gdb” – shape “Otras compensaciones” capa “Levantamiento de \nvedas”. Componente Geomático - Grupo de Servicios Geoespaciales-ANLA, 2024.\nTabla 8. Polígono Palmas 4 - ATV0812 – Resolución 1955 del 17 de octubre de 2018\nCOORDENADAS \nMAGNA \nSIRGAS \nORIGEN NACIONAL\nCOORDENADAS \nMAGNA \nSIRGAS \nORIGEN NACIONAL\nCOORDENADAS \nMAGNA \nSIRGAS \nORIGEN NACIONAL\nORIG_F\nID\nESTE\nNORTE\nORIG_F\nID\nESTE\nNORTE\nORIG_F\nID\nESTE\nNORTE\n1\n4955498,\n32\n2443056,\n08\n20\n4955415,\n77\n2443013,\n22\n39\n4955334,\n01\n2443096,\n56\n2\n4955484,\n03\n2443052,\n11\n21\n4955414,\n18\n2443021,\n15\n40\n4955339,\n57\n2443098,\n94\n3\n4955480,\n86\n2443048,\n14\n22\n4955409,\n42\n2443024,\n33\n41\n4955346,\n71\n2443103,\n7\n4\n4955480,\n86\n2443039,\n41\n23\n4955403,\n07\n2443028,\n3\n42\n4955357,\n03\n2443106,\n08\n5\n4955478,\n48\n2443033,\n85\n24\n4955391,\n17\n2443021,\n95\n43\n4955364,\n97\n2443110,\n85\n6\n4955476,\n1\n2443026,\n71\n25\n4955388,\n78\n2443028,\n3\n44\n4955373,\n7\n2443114,\n02\n7\n4955473,\n72\n2443018,\n77\n26\n4955381,\n64\n2443031,\n47\n45\n4955387,\n2\n2443114,\n02\n8\n4955471,\n33\n2443010,\n04\n27\n4955373,\n7\n2443030,\n68\n46\n4955396,\n72\n2443113,\n23\n9\n4955468,\n16\n2443002,\n9\n28\n4955367,\n35\n2443025,\n12\n47\n4955414,\n98\n2443117,\n2\n10\n4955463,\n4\n2442998,\n93\n29\n4955357,\n83\n2443025,\n12\n48\n4955432,\n44\n2443102,\n12\n11\n4955461,\n02\n2442998,\n93\n30\n4955357,\n03\n2443031,\n47\n49\n4955437,\n2\n2443096,\n56\n12\n4955458,\n63\n2443000,\n52\n31\n4955360,\n21\n2443035,\n44\n50\n4955450,\n7\n2443094,\n18\n13\n4955454,\n67\n2443004,\n48\n32\n4955360,\n21\n2443041,\n79\n51\n4955456,\n25\n2443094,\n18\n14\n4955450,\n7\n2443007,\n66\n33\n4955349,\n1\n2443052,\n9\n52\n4955469,\n75\n2443094,\n18\n15\n4955444,\n35\n2443010,\n83\n34\n4955343,\n54\n2443056,\n87\n53\n4955484,\n83\n2443101,\n32\n16\n4955438,\n79\n2443011,\n63\n35\n4955330,\n84\n2443063,\n22\n54\n4955496,\n73\n2443095,\n77\n17\n4955432,\n44\n2443010,\n04\n36\n4955326,\n08\n2443072,\n75\n55\n4955497,\n53\n2443089,\n42\n18\n4955422,\n92\n2443007,\n66\n37\n4955318,\n93\n2443086,\n24\n56\n4955496,\n73\n2443072,\n75\n19\n4955417,\n36\n2443007,\n66\n38\n4955325,\n28\n2443093,\n38\n57\n4955498,\n32\n2443056,\n08\nFuente: Radicado ANLA 20236200309622 del 5 de julio 2023- Anexo \n“LAV0105_00_2014.gdb” – shape “Otras compensaciones” capa “Levantamiento de \nvedas”. Componente Geomático - Grupo de Servicios Geoespaciales-ANLA, 2024.\nTabla 9. Polígono Palmas 5 - ATV0812 – Resolución 1955 del 17 de octubre de 2018\n\nResolución No. 002151       Del 30 SEP. 2024          Hoja No. 48 de 56\n“Por la cual se resuelve un recurso de reposición interpuesto en contra de la \nResolución 1177 del 18 de junio de 2024”\nPágina 48 de 56\nCOORDENADAS \nMAGNA \nSIRGAS \nORIGEN NACIONAL\nCOORDENADAS \nMAGNA \nSIRGAS \nORIGEN NACIONAL\nCOORDENADAS \nMAGNA \nSIRGAS \nORIGEN NACIONAL\nORIG_F\nID\nESTE\nNORTE\nORIG_F\nID\nESTE\nNORTE\nORIG_F\nID\nESTE\nNORTE\n1\n4955489,\n59\n2443182,\n28\n13\n4955413,\n39\n2443251,\n34\n25\n4955515,\n78\n2443226,\n74\n2\n4955477,\n68\n2443188,\n63\n14\n4955420,\n53\n2443252,\n93\n26\n4955522,\n13\n2443226,\n73\n3\n4955465,\n78\n2443191,\n02\n15\n4955429,\n27\n2443252,\n93\n27\n4955527,\n69\n2443221,\n97\n4\n4955458,\n63\n2443198,\n16\n16\n4955438\n2443254,\n52\n28\n4955533,\n25\n2443218\n5\n4955453,\n08\n2443207,\n68\n17\n4955450,\n7\n2443258,\n49\n29\n4955534,\n83\n2443214,\n83\n6\n4955447,\n52\n2443210,\n07\n18\n4955460,\n22\n2443260,\n07\n30\n4955533,\n25\n2443209,\n27\n7\n4955435,\n62\n2443213,\n24\n19\n4955468,\n16\n2443256,\n9\n31\n4955530,\n87\n2443202,\n13\n8\n4955425,\n3\n2443220,\n39\n20\n4955477,\n68\n2443250,\n55\n32\n4955524,\n52\n2443190,\n22\n9\n4955421,\n33\n2443226,\n73\n21\n4955487,\n21\n2443244,\n99\n33\n4955517,\n37\n2443186,\n25\n10\n4955415,\n77\n2443233,\n09\n22\n4955492,\n77\n2443237,\n05\n34\n4955510,\n23\n2443179,\n11\n11\n4955413,\n39\n2443241,\n02\n23\n4955499,\n91\n2443232,\n29\n35\n4955503,\n08\n2443179,\n11\n12\n4955413,\n39\n2443244,\n99\n24\n4955506,\n26\n2443227,\n53\n36\n4955489,\n59\n2443182,\n28\nFuente: Radicado ANLA 20236200309622 del 5 de julio 2023- Anexo \n“LAV0105_00_2014.gdb” – shape “Otras compensaciones” capa “Levantamiento de \nvedas”. Componente Geomático - Grupo de Servicios Geoespaciales-ANLA, 2024.\nTabla 10. Polígono Palmas 6 - ATV0812 – Resolución 1955 del 17 de octubre de 2018\nCOORDENADAS \nMAGNA \nSIRGAS \nORIGEN NACIONAL\nCOORDENADAS \nMAGNA \nSIRGAS \nORIGEN NACIONAL\nCOORDENADAS \nMAGNA \nSIRGAS \nORIGEN NACIONAL\nORIG_F\nID\nESTE\nNORTE\nORIG_F\nID\nESTE\nNORTE\nORIG_F\nID\nESTE\nNORTE\n1\n4955505,\n3\n2443288,\n54\n14\n4955595,\n16\n2443286,\n66\n27\n4955526,\n9\n2443229,\n12\n2\n4955521,\n07\n2443282,\n57\n15\n4955595,\n16\n2443276,\n74\n28\n4955521,\n74\n2443233,\n88\n3\n4955527,\n66\n2443283,\n67\n16\n4955593,\n97\n2443271,\n58\n29\n4955511,\n02\n2443235,\n47\n4\n4955536,\n99\n2443285,\n22\n17\n4955591,\n19\n2443263,\n25\n30\n4955505,\n07\n2443239,\n04\n5\n4955546,\n34\n2443281,\n5\n18\n4955587,\n22\n2443254,\n91\n31\n4955495,\n15\n2443243,\n8\n6\n4955552,\n69\n2443281,\n5\n19\n4955586,\n82\n2443249,\n36\n32\n4955488\n2443250,\n94\n7\n4955559,\n04\n2443282,\n3\n20\n4955581,\n67\n2443243,\n4\n33\n4955481,\n65\n2443257,\n29\n8\n4955569,\n36\n2443284,\n28\n21\n4955575,\n32\n2443236,\n66\n34\n4955473,\n49\n2443271,\n95\n\nResolución No. 002151       Del 30 SEP. 2024          Hoja No. 49 de 56\n“Por la cual se resuelve un recurso de reposición interpuesto en contra de la \nResolución 1177 del 18 de junio de 2024”\nPágina 49 de 56\n9\n4955573,\n06\n2443292,\n69\n22\n4955565,\n79\n2443230,\n7\n35\n4955482,\n02\n2443276,\n4\n10\n4955577,\n89\n2443294,\n47\n23\n4955556,\n66\n2443227,\n93\n36\n4955491,\n46\n2443281,\n33\n11\n4955582,\n42\n2443296,\n14\n24\n4955551,\n9\n2443222,\n37\n37\n4955497,\n93\n2443284,\n7\n12\n4955588,\n97\n2443296,\n42\n25\n4955542,\n37\n2443218,\n4\n38\n4955505,\n3\n2443288,\n54\n13\n4955594,\n93\n2443294,\n33\n26\n4955536,\n82\n2443226,\n34\nFuente: Radicado ANLA 20236200309622 del 5 de julio 2023- Anexo \n“LAV0105_00_2014.gdb” – shape “Otras compensaciones” capa “Levantamiento de \nvedas”. Componente Geomático - Grupo de Servicios Geoespaciales-ANLA, 2024.\nTabla 11. Polígono Palmas 7 - ATV0812 – Resolución 1955 del 17 de octubre de 2018\nCOORDENADAS \nMAGNA \nSIRGAS \nORIGEN NACIONAL\nCOORDENADAS \nMAGNA \nSIRGAS \nORIGEN NACIONAL\nCOORDENADAS \nMAGNA \nSIRGAS \nORIGEN NACIONAL\nORIG_F\nID\nESTE\nNORTE\nORIG_F\nID\nESTE\nNORTE\nORIG_F\nID\nESTE\nNORTE\n1\n4955603,\n59\n2442920,\n71\n24\n4955517,\n87\n2443021,\n52\n47\n4955563,\n11\n2443066,\n76\n2\n4955591,\n69\n2442916,\n74\n25\n4955528,\n19\n2443011,\n99\n48\n4955567,\n87\n2443062\n3\n4955582,\n16\n2442917,\n54\n26\n4955535,\n33\n2443000,\n88\n49\n4955575,\n02\n2443058,\n82\n4\n4955554,\n38\n2442922,\n3\n27\n4955541,\n68\n2442990,\n56\n50\n4955583,\n75\n2443062,\n79\n5\n4955540,\n09\n2442927,\n06\n28\n4955546,\n44\n2442982,\n62\n51\n4955594,\n86\n2443055,\n65\n6\n4955532,\n95\n2442938,\n17\n29\n4955555,\n97\n2442975,\n48\n52\n4955596,\n45\n2443047,\n71\n7\n4955531,\n36\n2442944,\n52\n30\n4955570,\n26\n2442981,\n04\n53\n4955598,\n83\n2443044,\n54\n8\n4955531,\n36\n2442949,\n29\n31\n4955571,\n05\n2442985,\n8\n54\n4955603,\n59\n2443036,\n6\n9\n4955540,\n09\n2442956,\n43\n32\n4955571,\n05\n2442999,\n29\n55\n4955602,\n01\n2443025,\n49\n10\n4955537,\n71\n2442965,\n16\n33\n4955571,\n84\n2443002,\n47\n56\n4955609,\n94\n2443018,\n34\n11\n4955534,\n54\n2442967,\n54\n34\n4955554,\n38\n2443015,\n17\n57\n4955611,\n53\n2443008,\n82\n12\n4955518,\n66\n2442970,\n72\n35\n4955543,\n27\n2443020,\n72\n58\n4955607,\n56\n2442993,\n74\n13\n4955507,\n55\n2442973,\n89\n36\n4955533,\n74\n2443028,\n66\n59\n4955603,\n59\n2442987,\n39\n14\n4955499,\n61\n2442982,\n62\n37\n4955523,\n42\n2443037,\n39\n60\n4955608,\n36\n2442973,\n89\n15\n4955491,\n67\n2442989,\n77\n38\n4955513,\n9\n2443047,\n71\n61\n4955604,\n39\n2442964,\n37\n16\n4955482,\n94\n2443003,\n26\n39\n4955508,\n34\n2443052,\n47\n62\n4955605,\n97\n2442954,\n84\n17\n4955482,\n15\n2443011,\n2\n40\n4955510,\n72\n2443064,\n38\n63\n4955603,\n59\n2442949,\n29\n\nResolución No. 002151       Del 30 SEP. 2024          Hoja No. 50 de 56\n“Por la cual se resuelve un recurso de reposición interpuesto en contra de la \nResolución 1177 del 18 de junio de 2024”\nPágina 50 de 56\n18\n4955483,\n74\n2443020,\n72\n41\n4955517,\n07\n2443074,\n7\n64\n4955602,\n01\n2442943,\n73\n19\n4955486,\n91\n2443032,\n63\n42\n4955525,\n81\n2443074,\n7\n65\n4955600,\n42\n2442938,\n17\n20\n4955497,\n23\n2443032,\n63\n43\n4955535,\n33\n2443081,\n05\n66\n4955600,\n42\n2442932,\n62\n21\n4955501,\n99\n2443031,\n04\n44\n4955539,\n3\n2443078,\n67\n67\n4955603,\n59\n2442920,\n71\n22\n4955505,\n96\n2443027,\n87\n45\n4955549,\n62\n2443072,\n32\n23\n4955509,\n93\n2443023,\n9\n46\n4955554,\n38\n2443072,\n32\nFuente: Radicado ANLA 20236200309622 del 5 de julio 2023- Anexo \n“LAV0105_00_2014.gdb” – shape “Otras compensaciones” capa “Levantamiento de \nvedas”. Componente Geomático - Grupo de Servicios Geoespaciales-ANLA, 2024.\nTabla 12. Polígono Palmas 8 - ATV0812 – Resolución 1955 del 17 de octubre de 2018\nCOORDENADAS \nMAGNA \nSIRGAS \nORIGEN NACIONAL\nCOORDENADAS \nMAGNA \nSIRGAS \nORIGEN NACIONAL\nCOORDENADAS \nMAGNA \nSIRGAS \nORIGEN NACIONAL\nORIG_F\nID\nESTE\nNORTE\nORIG_F\nID\nESTE\nNORTE\nORIG_F\nID\nESTE\nNORTE\n1\n4955669,\n42\n2442708,\n12\n19\n4955511,\n52\n2442624,\n64\n37\n4955582,\n96\n2442733,\n39\n2\n4955649,\n45\n2442692,\n83\n20\n4955502,\n79\n2442634,\n17\n38\n4955586,\n13\n2442736,\n56\n3\n4955612,\n78\n2442664,\n77\n21\n4955498,\n02\n2442645,\n28\n39\n4955586,\n92\n2442739,\n74\n4\n4955604,\n39\n2442675,\n44\n22\n4955510,\n72\n2442655,\n6\n40\n4955592,\n48\n2442742,\n12\n5\n4955605,\n97\n2442678,\n62\n23\n4955514,\n69\n2442658,\n77\n41\n4955602,\n01\n2442747,\n67\n6\n4955609,\n15\n2442688,\n14\n24\n4955517,\n87\n2442670,\n68\n42\n4955609,\n15\n2442748,\n47\n7\n4955605,\n97\n2442693,\n7\n25\n4955527,\n39\n2442683,\n38\n43\n4955611,\n53\n2442749,\n26\n8\n4955597,\n24\n2442692,\n9\n26\n4955530,\n57\n2442693,\n7\n44\n4955617,\n88\n2442748,\n47\n9\n4955594,\n86\n2442690,\n52\n27\n4955530,\n57\n2442703,\n22\n45\n4955626,\n61\n2442744,\n5\n10\n4955588,\n51\n2442684,\n17\n28\n4955531,\n36\n2442707,\n99\n46\n4955635,\n34\n2442739,\n74\n11\n4955579,\n78\n2442677,\n03\n29\n4955532,\n95\n2442711,\n16\n47\n4955642,\n49\n2442738,\n94\n12\n4955572,\n64\n2442670,\n68\n30\n4955535,\n33\n2442722,\n27\n48\n4955644,\n07\n2442741,\n32\n13\n4955568,\n67\n2442657,\n98\n31\n4955536,\n92\n2442725,\n45\n49\n4955656,\n77\n2442742,\n91\n14\n4955567,\n08\n2442645,\n28\n32\n4955540,\n09\n2442731\n50\n4955664,\n71\n2442737,\n35\n15\n4955560,\n73\n2442637,\n34\n33\n4955551,\n21\n2442731,\n8\n51\n4955665,\n51\n2442732,\n59\n16\n4955548,\n03\n2442631,\n79\n34\n4955560,\n73\n2442725,\n45\n52\n4955667,\n09\n2442720,\n69\n\nResolución No. 002151       Del 30 SEP. 2024          Hoja No. 51 de 56\n“Por la cual se resuelve un recurso de reposición interpuesto en contra de la \nResolución 1177 del 18 de junio de 2024”\nPágina 51 de 56\n17\n4955529,\n77\n2442617,\n5\n35\n4955571,\n84\n2442727,\n04\n53\n4955669,\n42\n2442708,\n12\n18\n4955522,\n63\n2442619,\n88\n36\n4955576,\n61\n2442734,\n97\nFuente: Radicado ANLA 20236200309622 del 5 de julio 2023- Anexo \n“LAV0105_00_2014.gdb” – shape “Otras compensaciones” capa “Levantamiento de \nvedas”. Componente Geomático - Grupo de Servicios Geoespaciales-ANLA, 2024.\nTabla 13. Polígono Turpial 3 - ATV0812 – Resolución 1955 del 17 de octubre de 2018\nCOORDENADAS \nMAGNA \nSIRGAS \nORIGEN NACIONAL\nCOORDENADAS \nMAGNA \nSIRGAS \nORIGEN NACIONAL\nCOORDENADAS \nMAGNA \nSIRGAS \nORIGEN NACIONAL\nORIG_F\nID\nESTE\nNORTE\nORIG_F\nID\nESTE\nNORTE\nORIG_F\nID\nESTE\nNORTE\n1\n4954848,\n24\n2442910,\n03\n15\n4955024,\n45\n2443044,\n17\n29\n4954956,\n21\n2442888,\n61\n2\n4954852,\n21\n2442926,\n7\n16\n4955030,\n01\n2443047,\n35\n30\n4954938,\n22\n2442867,\n44\n3\n4954860,\n94\n2442937,\n02\n17\n4955041,\n91\n2443030,\n68\n31\n4954926,\n58\n2442853,\n68\n4\n4954877,\n61\n2442943,\n37\n18\n4955041,\n91\n2443023,\n53\n32\n4954913,\n88\n2442838,\n87\n5\n4954898,\n25\n2442950,\n51\n19\n4955034,\n77\n2443012,\n42\n33\n4954898\n2442826,\n17\n6\n4954915,\n71\n2442958,\n45\n20\n4955037,\n95\n2443002,\n1\n34\n4954875,\n78\n2442826,\n17\n7\n4954933,\n17\n2442970,\n35\n21\n4955044,\n3\n2442992,\n58\n35\n4954859,\n9\n2442833,\n57\n8\n4954954,\n6\n2442976,\n7\n22\n4955054,\n64\n2442979,\n62\n36\n4954854,\n61\n2442839,\n92\n9\n4954966,\n51\n2442989,\n4\n23\n4955055,\n69\n2442972,\n22\n37\n4954844,\n03\n2442856,\n86\n10\n4954970,\n48\n2442994,\n17\n24\n4955044,\n05\n2442952,\n11\n38\n4954839,\n79\n2442872,\n73\n11\n4954988,\n73\n2443014,\n8\n25\n4955027,\n12\n2442935,\n17\n39\n4954839,\n79\n2442888,\n61\n12\n4955004,\n61\n2443025,\n92\n26\n4955004,\n89\n2442921,\n42\n40\n4954849,\n03\n2442904,\n47\n13\n4955012,\n55\n2443034,\n65\n27\n4954987,\n96\n2442912,\n95\n41\n4954848,\n24\n2442910,\n03\n14\n4955021,\n28\n2443039,\n41\n28\n4954966,\n79\n2442900,\n25\nFuente: Radicado ANLA 20236200309622 del 5 de julio 2023- Anexo \n“LAV0105_00_2014.gdb” – shape “Otras compensaciones” capa “Levantamiento de \nvedas”.  Componente Geomático - Grupo de Servicios Geoespaciales-ANLA, 2024.\nTabla 14. Polígono Turpial 4 - ATV0812 – Resolución 1955 del 17 de octubre de 2018\nCOORDENADAS \nMAGNA \nSIRGAS \nORIGEN NACIONAL\nCOORDENADAS \nMAGNA \nSIRGAS \nORIGEN NACIONAL\nCOORDENADAS \nMAGNA \nSIRGAS \nORIGEN NACIONAL\nORIG_F\nID\nESTE\nNORTE\nORIG_F\nID\nESTE\nNORTE\nORIG_F\nID\nESTE\nNORTE\n1\n4955111,\n76\n2442914,\n79\n22\n4955111,\n76\n2442825,\n89\n43\n4954984,\n76\n2442817,\n16\n\nResolución No. 002151       Del 30 SEP. 2024          Hoja No. 52 de 56\n“Por la cual se resuelve un recurso de reposición interpuesto en contra de la \nResolución 1177 del 18 de junio de 2024”\nPágina 52 de 56\n2\n4955114,\n94\n2442903,\n68\n23\n4955104,\n62\n2442823,\n51\n44\n4954988,\n73\n2442821,\n13\n3\n4955121,\n29\n2442903,\n68\n24\n4955101,\n45\n2442823,\n51\n45\n4955000,\n64\n2442822,\n72\n4\n4955128,\n43\n2442903,\n68\n25\n4955097,\n48\n2442816,\n37\n46\n4955006,\n2\n2442832,\n24\n5\n4955138,\n75\n2442905,\n27\n26\n4955095,\n1\n2442808,\n43\n47\n4955003,\n02\n2442840,\n18\n6\n4955150,\n66\n2442907,\n65\n27\n4955080,\n81\n2442801,\n28\n48\n4955005,\n4\n2442851,\n29\n7\n4955157,\n01\n2442902,\n09\n28\n4955065,\n73\n2442798,\n11\n49\n4955010,\n16\n2442856,\n05\n8\n4955160,\n18\n2442895,\n74\n29\n4955059,\n38\n2442798,\n11\n50\n4955014,\n93\n2442863,\n2\n9\n4955162,\n56\n2442890,\n98\n30\n4955055,\n41\n2442798,\n11\n51\n4955016,\n51\n2442873,\n52\n10\n4955166,\n53\n2442888,\n6\n31\n4955044,\n3\n2442794,\n14\n52\n4955024,\n45\n2442875,\n9\n11\n4955167,\n33\n2442879,\n87\n32\n4955035,\n56\n2442783,\n82\n53\n4955040,\n33\n2442883,\n83\n12\n4955165,\n74\n2442873,\n52\n33\n4955032,\n39\n2442781,\n44\n54\n4955050,\n65\n2442889,\n39\n13\n4955157,\n8\n2442867,\n96\n34\n4955026,\n83\n2442778,\n27\n55\n4955060,\n96\n2442894,\n95\n14\n4955149,\n86\n2442863,\n2\n35\n4955025,\n25\n2442779,\n06\n56\n4955069,\n7\n2442895,\n74\n15\n4955141,\n13\n2442861,\n61\n36\n4955009,\n37\n2442779,\n85\n57\n4955076,\n05\n2442902,\n09\n16\n4955137,\n16\n2442856,\n85\n37\n4955003,\n02\n2442782,\n23\n58\n4955076,\n84\n2442917,\n17\n17\n4955133,\n2\n2442853,\n67\n38\n4954994,\n29\n2442786,\n2\n59\n4955081,\n6\n2442926,\n7\n18\n4955123,\n67\n2442851,\n29\n39\n4954985,\n56\n2442791,\n76\n60\n4955095,\n1\n2442934,\n63\n19\n4955117,\n32\n2442847,\n32\n40\n4954982,\n38\n2442798,\n11\n61\n4955105,\n41\n2442922,\n73\n20\n4955114,\n94\n2442837\n41\n4954980,\n8\n2442806,\n84\n62\n4955111,\n76\n2442914,\n79\n21\n4955115,\n73\n2442829,\n86\n42\n4954980,\n8\n2442812,\n4\nFuente: Radicado ANLA 20236200309622 del 5 de julio 2023- Anexo \n“LAV0105_00_2014.gdb” – shape “Otras compensaciones” capa “Levantamiento de \nvedas”. Componente Geomático - Grupo de Servicios Geoespaciales-ANLA, 2024.\nTabla 15. Polígono Turpial 5 - ATV0812 – Resolución 1955 del 17 de octubre de 2018\nCOORDENADAS \nMAGNA \nSIRGAS \nORIGEN NACIONAL\nCOORDENADAS \nMAGNA \nSIRGAS \nORIGEN NACIONAL\nCOORDENADAS \nMAGNA \nSIRGAS \nORIGEN NACIONAL\nORIG_F\nID\nESTE\nNORTE\nORIG_F\nID\nESTE\nNORTE\nORIG_F\nID\nESTE\nNORTE\n1\n4955118,\n14\n2442734,\n09\n18\n4955021,\n28\n2442679,\n84\n35\n4955043,\n5\n2442754,\n45\n2\n4955128,\n72\n2442736,\n21\n19\n4954996,\n67\n2442679,\n84\n36\n4955046,\n68\n2442743,\n34\n\nResolución No. 002151       Del 30 SEP. 2024          Hoja No. 53 de 56\n“Por la cual se resuelve un recurso de reposición interpuesto en contra de la \nResolución 1177 del 18 de junio de 2024”\nPágina 53 de 56\n3\n4955148,\n91\n2442724,\n32\n20\n4954980\n2442681,\n43\n37\n4955056,\n2\n2442743,\n34\n4\n4955157,\n59\n2442724,\n32\n21\n4954975,\n24\n2442684,\n6\n38\n4955056,\n2\n2442745,\n72\n5\n4955174,\n94\n2442725,\n77\n22\n4954983,\n18\n2442688,\n57\n39\n4955056,\n2\n2442752,\n07\n6\n4955190,\n86\n2442721,\n43\n23\n4954994,\n29\n2442690,\n16\n40\n4955063,\n35\n2442760,\n01\n7\n4955203,\n87\n2442719,\n98\n24\n4954995,\n88\n2442697,\n3\n41\n4955066,\n52\n2442767,\n95\n8\n4955209,\n17\n2442701,\n83\n25\n4954993,\n5\n2442702,\n07\n42\n4955071,\n28\n2442762,\n39\n9\n4955127,\n48\n2442682,\n69\n26\n4954983,\n18\n2442712,\n38\n43\n4955072,\n08\n2442756,\n04\n10\n4955112,\n7\n2442679,\n23\n27\n4954983,\n18\n2442722,\n7\n44\n4955072,\n08\n2442745,\n72\n11\n4955110,\n89\n2442678,\n81\n28\n4954982,\n38\n2442730,\n64\n45\n4955079,\n22\n2442736,\n2\n12\n4955100,\n44\n2442676,\n36\n29\n4954987,\n94\n2442740,\n96\n46\n4955085,\n57\n2442732,\n23\n13\n4955086,\n36\n2442683,\n81\n30\n4954991,\n91\n2442748,\n9\n47\n4955091,\n13\n2442730,\n64\n14\n4955069,\n7\n2442684,\n6\n31\n4955000,\n64\n2442751,\n28\n48\n4955104,\n38\n2442729,\n86\n15\n4955058,\n58\n2442679,\n84\n32\n4955009,\n37\n2442751,\n28\n49\n4955113,\n9\n2442733,\n03\n16\n4955046,\n68\n2442680,\n63\n33\n4955026,\n83\n2442752,\n87\n50\n4955118,\n14\n2442734,\n09\n17\n4955033,\n18\n2442680,\n63\n34\n4955034,\n77\n2442752,\n87\nFuente: Radicado ANLA 20236200309622 del 5 de julio 2023- Anexo \n“LAV0105_00_2014.gdb” – shape “Otras compensaciones” capa “Levantamiento de \nvedas”. Componente Geomático - Grupo de Servicios Geoespaciales-ANLA, 2024.\nTabla 16. Polígono Turpial 6 - ATV0812 – Resolución 1955 del 17 de octubre de 2018\nCOORDENADAS \nMAGNA \nSIRGAS \nORIGEN NACIONAL\nCOORDENADAS \nMAGNA \nSIRGAS \nORIGEN NACIONAL\nCOORDENADAS \nMAGNA \nSIRGAS \nORIGEN NACIONAL\nORIG_F\nID\nESTE\nNORTE\nORIG_F\nID\nESTE\nNORTE\nORIG_F\nID\nESTE\nNORTE\n1\n4955226,\n06\n2442783,\n82\n14\n4955101,\n45\n2442770,\n33\n27\n4955172,\n09\n2442857,\n64\n2\n4955207,\n01\n2442784,\n62\n15\n4955103,\n83\n2442778,\n27\n28\n4955179,\n23\n2442852,\n88\n3\n4955192,\n73\n2442786,\n2\n16\n4955107\n2442790,\n97\n29\n4955184,\n79\n2442845,\n73\n4\n4955179,\n23\n2442788,\n58\n17\n4955111,\n76\n2442801,\n28\n30\n4955191,\n93\n2442843,\n35\n5\n4955172,\n88\n2442788,\n58\n18\n4955114,\n15\n2442808,\n43\n31\n4955195,\n11\n2442839,\n38\n6\n4955160,\n18\n2442784,\n62\n19\n4955120,\n5\n2442813,\n19\n32\n4955203,\n84\n2442837\n7\n4955151,\n45\n2442779,\n85\n20\n4955127,\n64\n2442813,\n98\n33\n4955213,\n36\n2442824,\n3\n\nResolución No. 002151       Del 30 SEP. 2024          Hoja No. 54 de 56\n“Por la cual se resuelve un recurso de reposición interpuesto en contra de la \nResolución 1177 del 18 de junio de 2024”\nPágina 54 de 56\n8\n4955140,\n34\n2442772,\n71\n21\n4955130,\n81\n2442822,\n72\n34\n4955214,\n95\n2442822,\n72\n9\n4955136,\n37\n2442766,\n36\n22\n4955140,\n34\n2442827,\n48\n35\n4955220,\n51\n2442820,\n33\n10\n4955122,\n88\n2442756,\n83\n23\n4955146,\n69\n2442834,\n62\n36\n4955227,\n65\n2442816,\n37\n11\n4955113,\n35\n2442752,\n07\n24\n4955147,\n48\n2442840,\n97\n37\n4955229,\n24\n2442796,\n52\n12\n4955102,\n24\n2442754,\n45\n25\n4955160,\n18\n2442846,\n53\n38\n4955226,\n06\n2442783,\n82\n13\n4955099,\n86\n2442762,\n39\n26\n4955166,\n53\n2442848,\n91\nFuente: Radicado ANLA 20236200309622 del 5 de julio 2023- Anexo \n“LAV0105_00_2014.gdb” – shape “Otras compensaciones” capa “Levantamiento de \nvedas”. Componente Geomático - Grupo de Servicios Geoespaciales-ANLA, 2024.\nARTÍCULO SEGUNDO. Reponer en el sentido de revocar el artículo segundo de la \nResolución 1177 del 18 de agosto de 2024, de conformidad con la parte motiva del presente \nacto administrativo.\nARTÍCULO TERCERO. Los demás términos, condiciones y obligaciones establecidos en \nResolución 1177 del 18 de agosto de 2024, expedida por esta Autoridad Nacional, no \nmodificadas en el presente acto administrativo, continúan vigentes, exigibles y rigen en los \ntérminos y condiciones del acto administrativo recurrido.\nARTÍCULO CUARTO. Notificar el contenido del presente acto administrativo al \nrepresentante legal, o al apoderado debidamente constituido o a la persona debidamente \nautorizada por de la sociedad GRAN TIERRA ENERGY COLOMBIA GMBH SUCURSAL \nCOLOMBIA, por medios electrónicos.\nPARÁGRAFO. Para la notificación electrónica se tendrá en cuenta lo previsto en el artículo \n10 de la ley 2080 de 2021 por medio del cual se modifica el artículo 56 de la Ley 1437 de \n2011. En el evento en que la notificación no pueda surtirse de manera electrónica, se \nseguirá el procedimiento en los términos del artículo 67 y siguientes de la Ley 1437 de 2011.\nARTÍCULO QUINTO. En el evento en que el titular de la licencia sea una sociedad \ncomercial o de una sucursal de sociedad extranjera que entre en proceso de disolución o \nrégimen de insolvencia empresarial o liquidación regulados por las normas vigentes, \ninformará inmediatamente de esta situación a esta Autoridad, con fundamento, entre otros, \nen los artículos 8, 58, 79, 80, 81, 95 numeral 8 de la Constitución Política de 1991, en la \nLey 43 de 1990, en la Ley 222 de 1995, en la Ley 1333 de 2009 y demás normas vigentes \ny jurisprudencia aplicable. Adicional a la obligación de informar a esta Autoridad de tal \nsituación, el titular de la licencia o permiso aprovisionará contablemente las obligaciones \ncontingentes que se deriven de la existencia de un procedimiento ambiental sancionatorio \nconforme con el artículo 40 de la Ley 1333 de 2009 o la norma que la adicione, modifique \no derogue.\nARTÍCULO SEXTO. Comunicar el presente acto administrativo al municipio de San Martín \nen el departamento del Cesar, a la Corporación Centro de Estudios Sociales y Políticas \nPúblicas –CESOPP, a la Gobernación del Cesar, a la Procuraduría Delegada para Asuntos \n\nResolución No. 002151       Del 30 SEP. 2024          Hoja No. 55 de 56\n“Por la cual se resuelve un recurso de reposición interpuesto en contra de la \nResolución 1177 del 18 de junio de 2024”\nPágina 55 de 56\nAmbientales y Agrarios de la Procuraduría General de la Nación, a la Corporación \nAutónoma Regional del Cesar – CORPOCESAR, a la Corporación Centro de Estudios \nSociales y Políticas Públicas –CESOPP con NIT 901.484.575-8 y a la Gobernación del \nCesar con NIT 892399999-1. \nARTÍCULO SÉPTIMO. Por la Autoridad Nacional de Licencias Ambientales – ANLA, \npublicar el presente acto administrativo en la Gaceta Ambiental de la Entidad.\nARTÍCULO OCTAVO. Contra el presente acto administrativo no procede recurso alguno, \nde conformidad con lo establecido en el artículo 75 del Código de Procedimiento \nAdministrativo y de lo Contencioso Administrativo.\nNOTIFIQUESE, COMUNÍQUESE, PUBLIQUESE Y CÚMPLASE\nDado en Bogotá D.C., a los 30 SEP. 2024\nRODRIGO ELIAS NEGRETE MONTES\nDIRECTOR GENERAL\nMARIANA DEL PILAR RODRIGUEZ PATARROYO\nCONTRATISTA\nGLADYS CATALINA PELAEZ MENDIETA\nCONTRATISTA\nSANDRA PATRICIA BEJARANO RINCON\nCONTRATISTA\nALEXANDER MARTINEZ MONTERO\nASESOR\nDANIEL ESTEBAN JURADO OSORIO\nCONTRATISTA\nGERMAN BARRETO ARCINIEGAS\nSUBDIRECTOR DE SEGUIMIENTO DE LICENCIAS AMBIENTALES\n\nResolución No. 002151       Del 30 SEP. 2024          Hoja No. 56 de 56\n“Por la cual se resuelve un recurso de reposición interpuesto en contra de la \nResolución 1177 del 18 de junio de 2024”\nPágina 56 de 56\nExpediente No. LAV0105-00-2014\nConcepto Técnico N° 5886 del 13 de agosto de 2024. \nFecha: Septiembre de 2024\nProceso No.: 20241000021514\nNota: Este es un documento electrónico generado desde los Sistemas de Información de la ANLA. El original reposa en los \narchivos digitales de la Entidad\n"
}