{
  "fuente": "ANLA_GACETA",
  "numero_resolución": "RESOLUCIÓN N° 2475",
  "fecha_resolución": "1993-12-22",
  "nombre_proyecto": "denominado “Bloque de exploración Bocachico”, localizado entre los Municipios de Puerto Salgar, Caparrapí y Guaduas en e",
  "nombre_proyecto_normalizada": "denominado \"bloque de exploracion bocachico\", localizado entre los municipios de puerto salgar, caparrapi y guaduas en e",
  "ubicación": "la vereda Reinés, en jurisdicción del Municipio de Puerto salgar Departamento de Cundinamarca, y estableció Plan de Manejo para la ejecución de la perforación exploratoria de los Pozo Torcaz 3 y Torcaz 4",
  "ubicacion_normalizada": "la vereda reines, en jurisdiccion del municipio de puerto salgar departamento de cundinamarca, y establecio plan de manejo para la ejecucion de la perforacion exploratoria de los pozo torcaz 3 y torcaz 4",
  "empresa": "HARKEN DE COLOMBIA LTD",
  "empresa_normalizada": "harken de colombia ltd",
  "numero_expediente": "LAM0347",
  "radicados": [
    "20236200511532",
    "2019183949",
    "2023060220",
    "20236200240412"
  ],
  "descripcion": "POR LA CUAL SE RESUELVE UN RECURSO DE REPOSICIÓN",
  "tipos_infraccion": [
    "Vertimientos"
  ],
  "tipos_infraccion_normalizada": [
    "vertimientos"
  ],
  "pdf_id": "44382",
  "file_name": "ANLA_44382.pdf",
  "texto_completo": " \nRepública de Colombia \nMinisterio de Ambiente y Desarrollo Sostenible \n \nAUTORIDAD NACIONAL DE LICENCIAS AMBIENTALES \n- ANLA – \nRESOLUCIÓN N° 2475 \n(25 OCT. 2023) \n \nPágina 1 de 16 \n \n“POR LA CUAL SE RESUELVE UN RECURSO DE REPOSICIÓN” \n \nEL ASESOR DEL DESPACHO DEL DIRECTOR DE LA AUTORIDAD NACIONAL DE \nLICENCIAS AMBIENTALES – ANLA \n \nEn ejercicio de las facultades legales establecidas mediante la Ley 99 del 22 de diciembre \nde 1993, el Decreto Ley 3573 del 27 de septiembre de 2011, modificado por el Decreto \n376 del 11 de marzo de 2020, por el cual se modifica la estructura de la Autoridad \nNacional de Licencias Ambientales y acorde con lo regulado en el Decreto 1076 del 26 de \nmayo de 2015, la Resolución 669 del 14 de abril de 2020, la Resolución 1957 del 5 de \nnoviembre de 2021 y la Resolución 2795 del 25 de noviembre de 2022, expedidas por la \nAutoridad Nacional de Licencias Ambientales, y \n \nCONSIDERANDO \n \nQue mediante Resolución 586 del 30 de mayo de 1995, el entonces Ministerio del Medio \nAmbiente hoy Ministerio de Ambiente y Desarrollo Sostenible (En adelante el Ministerio), \notorgó a la sociedad HARKEN DE COLOMBIA LTD, identificada con el NIT. 830.077.898 – \n9, Licencia Ambiental Ordinaria para la ejecución del proyecto denominado “Bloque de \nexploración Bocachico”, localizado entre los Municipios de Puerto Salgar, Caparrapí y \nGuaduas en el Departamento de Cundinamarca, y los Municipios de Honda y La Dorada en \nlos Departamentos de Tolima y Caldas, respectivamente. \n \nQue por medio de la Resolución 374 del 12 de abril de 1996, el Ministerio, otorgó a la \nsociedad HARKEN DE COLOMBIA LTD, Licencia Ambiental Ordinaria, para la ejecución \ndel proyecto denominado “Perforación exploratoria del pozo Torcaz 2”, el cual se ubica \ndentro del Bloque Bocachico, aproximadamente a 40 kilómetros de la población de La \nDorada en el Departamento de Caldas, Municipio de Puerto Salgar, jurisdicción de la vereda \nReinés Departamento de Cundinamarca. \n \nQue mediante la Resolución 517 del 23 de mayo de 1996, el Ministerio, resolvió el recurso \nde reposición interpuesto en contra de la Resolución 374 del 12 de abril de 1996, \nconfirmando todas sus partes. \n \nQue a través de la Resolución 1245 del 20 de noviembre de 1996, el Ministerio, otorgó \nLicencia Ambiental Ordinaria, a la sociedad HARKEN DE COLOMBIA LTD, para el proyecto \n“Bloque de Perforación Río Negro”, localizado en la vereda Reinés, en jurisdicción del \nMunicipio de Puerto salgar Departamento de Cundinamarca, y estableció Plan de Manejo \npara la ejecución de la perforación exploratoria de los Pozo Torcaz 3 y Torcaz 4. \n \n\nResolución No. 2475       Del 25 OCT. 2023          Hoja No. 2 de 16 \n \n“POR LA CUAL SE RESUELVE UN RECURSO DE REPOSICIÓN” \n \nPágina 2 de 16 \n \nQue mediante Resolución 770 del 20 de agosto de 1997, el Ministerio, otorgó Licencia \nAmbiental Ordinaria a la sociedad HARKEN DE COLOMBIA LTD, para el proyecto “Bloque \nde perforación exploratoria Torcaz”, en una extensión de 21 Km2, localizado en jurisdicción \ndel Municipio de Puerto Salgar Departamento de Cundinamarca. \n \nQue por medio de la Resolución 887 del 1 de septiembre de 1998, el Ministerio, modificó la \nResolución 374 del 12 de abril de 1996, en el sentido que autorizó pruebas extensas de \nproducción en torcaz 2 durante 1 mes y transporte de crudo en carrotanque hasta campo \nVelásquez 26. \n \nQue mediante la Resolución 482 del 7 de junio de 2002, el Ministerio, modificó la \nResolución1245 del 20 de noviembre de 1996, del proyecto “Bloque de Perforación Río \nNegro”. \n \nQue por medio de la Resolución 1383 del 1 diciembre de 2004, el Ministerio otorgó Licencia \nAmbiental Global a la sociedad HARKEN DE COLOMBIA LTD., para el proyecto “Explotación \ny Desarrollo del Campo Torcaz”, ubicado en la vereda Reinés, en jurisdicción del Municipio de \nPuerto salgar Departamento de Cundinamarca. \n \nQue por medio de la Resolución 745 del 15 de abril de 2010, el Ministerio modificó el literal \nc) del numeral 2 – Vertimientos Etapa de Producción del artículo 4 de la Resolución 1383 \ndel 1 de diciembre de 2004, en el sentido de autorizar su ejecución semestral de los \nmonitoreos. \n \nQue por medio de la Resolución 2027 del 15 de octubre de 2010, el Ministerio tuvo en \ncuenta el cambio de razón social de la sociedad HARKEN DE COLOMBIA LTD., por el de \nsociedad COLOMBIA ENERGY DEVELOPMENT CO. \n \nQue por medio de la Resolución 1485 del 20 de noviembre de 2015, la Autoridad Nacional \nde Licencias Ambientales (En adelante la Autoridad Nacional) autorizó la cesión total de los \nderechos y obligaciones originados y derivados de la Licencia Ambiental otorgada mediante \nResolución 1383 del 1 de diciembre de 2004, a la sociedad COLOMBIA ENERGY \nDEVELOPMENT CO., para el proyecto denominado “Explotación y Desarrollo del Campo \nTorcaz”, a favor de la sociedad CINCO RANCH PETROLEUM COLOMBIA INC SUCURSAL \nCOLOMBIA., identificada con NIT. 900.695.373-9 (En adelante la Sociedad). \n \nQue mediante Resolución 1846 del 18 de noviembre de 2020, la Autoridad Nacional \nmodificó el artículo séptimo de la Resolución 1383 del 1 de diciembre de 2004, en el sentido \nde aprobar el acogimiento al porcentaje incremental de la base de liquidación de la inversión \nforzosa de no menos del 1%, de conformidad con lo señalado en el artículo 321 de la Ley \n1955 del 25 de mayo del 2019. \n \nQue a través de la Resolución 539 del 15 de marzo de 2023, la Autoridad Nacional aceptó \ncomo ejecutada la actividad de “Construcción de sistemas de tratamiento de aguas residuales en \nla cuenca del río Negrito”, con cargo a la obligación de inversión forzosa de no menos del 1% \ndel proyecto “Explotación y Desarrollo del Campo Torcaz”. El acto administrativo fue notificado \npor conducta concluyente a la sociedad el día 09 de agosto de 2023, según constancia de \nnotificación expedida por el Grupo de Gestión de Notificaciones. \n \n\nResolución No. 2475       Del 25 OCT. 2023          Hoja No. 3 de 16 \n \n“POR LA CUAL SE RESUELVE UN RECURSO DE REPOSICIÓN” \n \nPágina 3 de 16 \n \nQue a través de la comunicación con radicación 20236200511532 del 23 de agosto de \n2023, la Sociedad interpuso Recurso de Reposición en contra de la Resolución 539 del 15 \nde marzo de 2023, argumentos que fueron evaluados por el equipo técnico de la Autoridad \nNacional y en consecuencia expidió el Concepto técnico 6693 del 11 de octubre de 2023. \n \nCOMPETENCIA DE LA AUTORIDAD NACIONAL \n \nEl Gobierno Nacional, mediante Decreto Ley 3573 del 27 de septiembre de 2011, creó la \nAutoridad Nacional de Licencias Ambientales – ANLA, como una entidad con autonomía \nadministrativa y financiera, sin personería jurídica, la cual hace parte del Sector \nAdministrativo de Ambiente y Desarrollo Sostenible, en los términos del artículo 67 de la \nLey 489 de 1998. \n \nEl numeral 1° del artículo tercero del mencionado decreto estableció dentro de las funciones \nde la Autoridad Nacional, la de otorgar o negar las licencias, permisos y trámites \nambientales de competencia del Ministerio, de conformidad con la ley y los reglamentos. \n \nMediante el Decreto 376 del 11 de marzo de 2020, se modificó la estructura de la Autoridad \nNacional de Licencias Ambientales. \n \nMediante la Resolución 669 del 14 de abril de 2020, se nombró como servidor público a \nEDILBERTO PEÑARANDA CORREA, identificado con cédula de ciudadanía 4.052.851, en \nel empleo de libre nombramiento y remoción de Asesor, código 1020, grado 15, adscrito a \nla Dirección General de la planta global de la ANLA. \n \nEl 5 de noviembre de 2021, la Autoridad Nacional emitió la Resolución 1957 “Por la cual se \nadopta el Manual Específico de Funciones y de Competencias Laborales para los empleos \nde la planta de personal de la Autoridad Nacional de Licencias Ambientales - ANLA”, en \ndonde se establece que corresponde al Despacho del Director General de la Autoridad \nNacional de Licencias Ambientales - ANLA, “Suscribir los actos administrativos que otorgan, \nniegan, modifican, ajustan o declaran la terminación de las licencias, permisos y trámites \nambientales”. \n \nEn ejercicio de las facultades conferidas por la Ley 489 de 1998, se expidió la Resolución \n2795 del 25 de noviembre de 2022 “Por la cual se delegan unas funciones y se dictan otras \ndisposiciones”, en su artículo primero, numeral 15° delegó en el Asesor Código 1020 Grado \n15 del Despacho del Director General, la función de “Resolver los recursos de reposición \ninterpuestos contra los actos administrativos que se emiten en cumplimiento de las \nfunciones anteriores.” \n \nTeniendo en cuenta lo anterior, es el Asesor del Despacho del Director General de la \nAutoridad Nacional el competente para pronunciarse sobre el recurso de reposición \ninterpuesto por la Sociedad en contra de la Resolución 539 del 15 de marzo de 2023. \n \nFUNDAMENTOS JURÍDICOS \n \nEl procedimiento para la presentación y resolución de recursos contra los actos \nadministrativos se encuentra reglado en el Código de Procedimiento Administrativo y de lo \nContencioso Administrativo artículos 74 y siguientes, que particularmente respecto del \nrecurso de reposición al tenor literal expresan: \n \n \n \n\nResolución No. 2475       Del 25 OCT. 2023          Hoja No. 4 de 16 \n \n“POR LA CUAL SE RESUELVE UN RECURSO DE REPOSICIÓN” \n \nPágina 4 de 16 \n \n“Artículo 74. Recursos contra los actos administrativos. \n \nPor regla general, contra los actos definitivos procederán los siguientes recursos:  \n \n1. El de reposición, ante quien expidió la decisión para que la aclare, modifique, adicione o \nrevoque (…)” \n \nA su vez, los artículos 76 y 77 del Código enunciado preceptúan:  \n \n“Artículo 76. Oportunidad y presentación. \n \nLos recursos de reposición y apelación deberán interponerse por escrito en la diligencia de \nnotificación personal, o dentro de los diez (10) días siguientes a ella, o a la notificación por aviso, \no al vencimiento del término de publicación, según el caso. Los recursos contra los actos \npresuntos podrán interponerse en cualquier tiempo, salvo en el evento en que se haya acudido \nante el juez.  \n \nLos recursos se presentarán ante el funcionario que dictó la decisión (…)” \n \nArtículo 77. Requisitos. \n \nPor regla general los recursos se interpondrán por escrito que no requiere de presentación \npersonal si quien lo presenta ha sido reconocido en la actuación. Igualmente, podrán presentarse \npor medios electrónicos.  \n \nLos recursos deberán reunir, además, los siguientes requisitos:  \n \n1. Interponerse dentro del plazo legal, por el interesado o su representante o apoderado \ndebidamente constituido.  \n \n2. Sustentarse con expresión concreta de los motivos de inconformidad. \n \n3. Solicitar y aportar las pruebas que se pretende hacer valer.  \n \n4. Indicar el nombre y la dirección del recurrente, así como la dirección electrónica si desea ser \nnotificado por este medio.  \n \nSólo los abogados en ejercicio podrán ser apoderados (…) \n \nA su vez, el artículo 80 del citado Código, establece el alcance del contenido de la decisión \nque resuelve el recurso: \n \n“Artículo 80. Decisión de los recursos. -Vencido el período probatorio, si a ello hubiere \nlugar, y sin necesidad de acto que así lo declare, deberá proferirse la decisión motivada que \nresuelva el recurso.  \n \nLa decisión resolverá todas las peticiones que hayan sido oportunamente planteadas y las \nque surjan con motivo del recurso.”  \n \nCONSIDERACIONES DE LA AUTORIDAD NACIONAL FRENTE AL RECURSO DE \nREPOSICIÓN INTERPUESTO POR LA SOCIEDAD. \n \nDesde el punto de vista procedimental, se observa que el recurso de reposición interpuesto \npor la Sociedad en contra de la Resolución 539 del 15 de marzo de 2023, cumple con los \nrequisitos establecidos en el artículo 77 y concordantes del Código de Procedimiento \nAdministrativo y de lo Contencioso Administrativo, en cuanto a lo siguiente: \n \n\nResolución No. 2475       Del 25 OCT. 2023          Hoja No. 5 de 16 \n \n“POR LA CUAL SE RESUELVE UN RECURSO DE REPOSICIÓN” \n \nPágina 5 de 16 \n \n1. Interponerse dentro del plazo legal, por el interesado o su representante o apoderado \ndebidamente constituido. \n \nSe encuentra acreditado que el día 09 de agosto de 2023 la sociedad fue notificada por \nconducta concluyente de la Resolución 539 del 15 de marzo de 2023, según constancia de \nnotificación expedida por el Grupo de Gestión de Notificaciones, frente a la cual interpuso \nrecurso de reposición por intermedio de la Representante Legal el día 23 de agosto de 2023 \nbajo el radicado 20236200511532, es decir, que la presentación del recurso se efectuó \ndentro de los diez (10) días siguientes a la notificación, de conformidad con lo preceptuado \nen el artículo 76 de la Ley 1437 de 2011. \n \n2. Sustentarse con expresión concreta de los motivos de inconformidad. \n \nLa Sociedad presentó los argumentos en contra de las disposiciones recurridas de la \nResolución 539 del 15 de marzo de 2023, los cuales serán tenidos en cuenta para decidir \nel presente recurso de reposición. \n \n3. Solicitar y aportar las pruebas que se pretende hacer valer. \n \nEn el recurso de reposición la Sociedad aportó las siguientes pruebas: \n \n“Anexo 1. Certificado de Existencia y Representación Legal de Cinco Ranch Petroleum Colombia \nInc. Sucursal Colombia \nAnexo 2- Radicado 4120-E1-58858 Plan de Inversión del 1% \nAnexo 3. Concepto Técnico 1107 del 30 de junio de2010 \nAnexo 4. Auto 2726 del 14 de julio de 2010 \nAnexo 5. Auto 1983 del 23 de mayo de 2016 \nAnexo 6. Radicado ANLA 2019183949-1-000 del 25 de noviembre de 2019 Plan de Inversión 2019 \nAnexo 7. Concepto Técnico 6589 del 26 de octubre de 2020 y Resolución 1846 de 2020. \nAnexo 8. Certificado de entrega al correo lorena.gil@cedco.com \nAnexo 9. Radicado No. 2022239633-1-00 del 26 de octubre de 2022 mediante el cual CINCO \nRANCH notificó a ANLA el cambio de dirección electrónica para notificaciones. \nAnexo 10. Certificado de revisor fiscal pozo Torcaz 3. \nAnexo 11. Radicado 2023060220-1-000 del 23 de marzo de 2023” \n \n4. Indicar el nombre y la dirección del recurrente, así como la dirección electrónica si desea ser \nnotificado por este medio. \n \nLa Sociedad manifestó que, para efectos de la notificación: “en la ciudad de Bogotá en la Cra \n11 N° 93A - 20 Edificio Torre Once 93 o al correo bogota-notificaciones-judiciales@sierracol.com” \n \nCon base en lo anterior, verificado el cumplimiento de los requisitos establecidos en el \nCódigo de Procedimiento Administrativo y de lo Contencioso Administrativo -CPACA-, \nrespecto a la procedencia del señalado recurso de reposición, la Autoridad Nacional \nprocederá a resolverlo, teniendo en cuenta las consideraciones realizadas en el Concepto \ntécnico 6693 del 11 de octubre de 2023; en el mismo orden de los argumentos presentados \npor la Sociedad, a saber: \n \n1. OBLIGACIÓN RECURRIDA – ARTÍCULO SEGUNDO. \n \n“ARTÍCULO SEGUNDO. Reiterar a la Sociedad CINCO RANCH PETROLEUM COLOMBIA \nINC. SUCURSAL COLOMBIA, que debe dar cumplimiento de la obligación Legal contenida \nen el parágrafo 1 del artículo 321 de la Ley 1955 del 25 de mayo de 2019 y presentar la \nactualización de la base de liquidación forzosa de no menos del 1% para los proyectos \n\nResolución No. 2475       Del 25 OCT. 2023          Hoja No. 6 de 16 \n \n“POR LA CUAL SE RESUELVE UN RECURSO DE REPOSICIÓN” \n \nPágina 6 de 16 \n \n“Bloque de Perforación Río Negro” (Licencia Ambiental otorgada mediante Resolución 1245 \ndel 20 de noviembre de 1996).”  \n \n1.1. Petición de la sociedad \n \n“(…) que se modifique el Artículo Segundo de la Resolución en el sentido de dar por cumplida \nla presentación de la actualización de la base de liquidación forzosa de no menos del 1% para \nlos proyectos \"Bloque de Perforación Río Negro\" (Licencia Ambiental otorgada mediante \nResolución 1245 del 20 de noviembre de 1996), así:  \n \n(…) “ARTÍCULO SEGUNDO. DAR POR CUMPLIDA la obligación Legal contenida en el \nparágrafo 1 del artículo 321 de la Ley 1955 del 25 de mayo de 2019, teniendo en cuenta \nque la Sociedad con radicado ANLA 2019183949-1-000 del 25 de noviembre de 2019 \npresentó la actualización de la base de liquidación forzosa de no menos del 7% para los \nproyectos “Bloque de Perforación Río Negro\" (Licencia Ambiental otorgada mediante \nResolución 1245 del 20 de noviembre de 1996) y con la cual se perforó el pozo Torcaz \n3.” \n \n1.2. Argumentos de la sociedad \n \nMediante comunicación con radicación 20236200511532 del 23 de agosto de 2023, la \nSociedad presentó los siguientes argumentos: \n \n“(…) respetuosamente se resaltan algunos puntos con fundamento en los cuales se solicita \nla revocatoria del artículo segundo de la Resolución y, en su lugar, que esa Autoridad \nconsidere dar por cumplida la presentación de la base de liquidación forzosa de no menos del \n1% para los proyectos del Bloque Río Negro.  \n \n1. En el marco de la Resolución 1245 del 20 de noviembre de 1996 solamente se realizaron \nlas actividades de la etapa exploratoria del pozo Torcaz 3 que incluyeron construcción de \nplataforma y perforación del pozo mencionado, actividades que fueron aprobadas en el \nartículo Décimo Cuarto de la Resolución 1245.  \n \n2. Posteriormente, en el marco de la Resolución 1383 del 1 de diciembre de 2004, no se \nejecutaron obras ni actividades adicionales, solamente se realizó la operación del pozo Torcaz \n3. \n \n3. En cuanto a la presentación de la información financiera correspondiente a la base de \nliquidación del proyecto Bloque de Perforación Río Negro y de forma específica a las únicas \nactividades ejecutadas que, como se mencionó anteriormente, corresponden a la etapa \nexploratoria del pozo Torcaz 3, ésta ha venido siendo reportada desde el radicado 4120-E1-\n58858 del 11 de mayo de 2010,  en el cual de forma explícita se indica que el Plan de Inversión \ndel 1% que contiene la información financiera, incluye la etapa exploratoria y de explotación \ndel Campo Torcaz.  \n \n4. Teniendo en cuenta lo anterior y de acuerdo con el concepto técnico 1107 del 30 de junio \nde 2010 en donde se analiza el Plan de Inversión presentado en el radicado 4120-E1-58858 \ndel 11 de mayo de 2010, es claro que en el Plan de inversión del 1% sí se incluyó la etapa de \nexploración y explotación, tal como lo presenta la imagen siguiente: \n \n(Ver imagen en la página 4 del Concepto técnico 6693 del 11 de octubre de 2023) \n \n(...) \n \n\nResolución No. 2475       Del 25 OCT. 2023          Hoja No. 7 de 16 \n \n“POR LA CUAL SE RESUELVE UN RECURSO DE REPOSICIÓN” \n \nPágina 7 de 16 \n \n5. Este concepto técnico 1107 del 30 de junio de 2010 fue acogido en el Auto 2726 del 14 de \njulio de 2010, al cual establece que el valor parcial de la Inversión del 1% del proyecto Campo \nTorcaz corresponde a $23.695.868,27.  \n \n6. En resumen, como se evidencia en los párrafos anteriores es claro desde el año 2011, que \nla información financiera que se venía presentando incluía la etapa exploratoria del proyecto \npara los pozos Torcaz 2, Torcaz 3 y Torcaz 5, cada una de estas correspondiente a los actos \nadministrativos que se presentan en la Tabla 3: \n \n(Ver tabla 3 en la página 4 del Concepto técnico 6693 del 11 de octubre de 2023) \n \n(...) \n \n7. Ahora, en cumplimiento del artículo 321 de la Ley 1955 de 2019, CINCO RANCH con \nradicado ANLA 2019183949-1-000 del 25 de noviembre de 2019, presentó los certificados de \nrevisoría fiscal que incluyeron la construcción y perforación de los únicos tres (3) proyectos \nejecutados en el área del Campo Torcaz y que específicamente para la Resolución 1245 del \n20 de noviembre de 1996 \"Bloque Río Negro'; corresponde al pozo Torcaz 3.  \n \n8. El certificado de revisor fiscal presentado como parte del radicado ANLA 2019183949-1-\n000 del 25 de noviembre de 2019, en el numeral primero indica que los valores corresponden \na la etapa de exploración y perforación (ver imagen 7) \n \n(Ver imagen en la página 5 del Concepto técnico 6693 del 11 de octubre de 2023) \n \n(...) \n \n9. En el Anexo 1 del certificado de Revisor Fiscal denominado \"base de liquidación\" se \nevidencia que la información de costos y gastos correspondientes a la base de liquidación del \n1% del pozo Torcaz 3 corresponde a los años 1996 - 2003, haciendo evidente que se \npresentan la información asociada a la etapa exploratoria correspondiente a lo autorizado en \nla Resolución 1245 del 20 de noviembre de 1996 \"Bloque Río Negro''. En la imagen 8 se \nobserva lo aquí mencionado. En el Anexo 10 se presenta el certificado con su Anexo \ncorrespondiente. \n \n(Ver imagen en la página 6 del Concepto técnico 6693 del 11 de octubre de 2023) \n \n(...) \n \n10. Esta información fue evaluada en el concepto técnico 6589 del del (sic) 26 de octubre de \n2020 que fue acogido en la Resolución 1846 de 2020. En la página 25 del concepto se analiza \nel certificado de Revisoría Fiscal presentado indicando que el periodo corresponde al año \n1996 a 2002, tal como se observa en la imagen 9: \n \n(Ver imagen en la página 7 del Concepto técnico 6693 del 11 de octubre de 2023) \n \n(...) \n \n11. Al evidenciar las fechas para las cuales se presenta el certificado de Revisoría Fiscal \nevaluado por la Autoridad Ambiental y que reconoce que los periodos asociados a la \ninformación presentada corresponden a los años 1996 al 2003, es claro que la información \nes previa a la expedición de la Resolución 1383 del 1 de diciembre de 2004, por lo cual se \nhace aún más evidente que la misma corresponde a la etapa exploratoria del proyecto y \n\nResolución No. 2475       Del 25 OCT. 2023          Hoja No. 8 de 16 \n \n“POR LA CUAL SE RESUELVE UN RECURSO DE REPOSICIÓN” \n \nPágina 8 de 16 \n \nespecíficamente para el pozo Torcaz 3 hace parte del cumplimiento de la Resolución 1245 \ndel 20 de noviembre de 1996.  \n \n12. Finalmente, CINCO RANCH, ha presentado la actualización de los valores no ejecutados \nantes del 31 de marzo de cada año, tal como lo requiere el artículo 321 de la ley 1955 de 2019 \ny la Resolución 1846 de 2020. En el Anexo 11 se presenta el radicado 2023060220-1-000 del \n23 de marzo de 2023. \n \nTeniendo en cuenta lo anterior, respetuosamente se solicita a ANLA dar por cumplida la \nobligación de “presentar la actualización de la base de liquidación forzosa de no menos del \n1% para los proyectos “Bloque de Perforación Río Negro”'. Debido a que la información ha \nvenido siendo presentada desde el año 2010 y fue remitida tal como lo estableció el artículo \n321 de la Ley 1955 de 2019 en los términos y plazos requeridos.” \n \n1.3. Consideraciones de la Autoridad Nacional \n \nLos argumentos de inconformidad presentados por el recurrente fueron objeto de \nevaluación por el equipo técnico de la Autoridad Nacional y mediante Concepto técnico \n6693 del 11 de octubre de 2023, se presentaron las siguientes consideraciones: \n \n“Verificado el Sistema de Información de Licencias Ambientales -SILA-, se identifica que los \nargumentos planteados en el recurso de reposición interpuesto en contra de la Resolución 539 del \n15 de marzo de 2023 hacen parte de la información entregada por la Sociedad en el radicado \n20236200240412 del 16 de junio de 2023, que dio respuesta al Auto 2736 del 24 de abril de 2023, \ndonde en algunos apartes informó lo siguiente: \n \n“El expediente LAM0347 contiene los Actos Administrativos mediante los cuales se adelantó la etapa \nexploratoria del Bloque Torcaz y así mismo la etapa de explotación y producción, en estas etapas se \nejecutaron las actividades que presenta la Tabla 1:  \n \n \n \nLa compañía con radicado Ministerio de Ambiente, Vivienda y Desarrollo Territorial 4120-E1-58858 del \n11 de mayo de 2010 (Anexo 1), presentó el Plan de Inversión del 1% del proyecto Campo Torcaz \ninformando que el mismo incluía las etapas de exploración y explotación (…) del expediente LAM 0347. \n \nY en este mismo documento presentó lo valores de la inversión del 1% haciendo explicito (sic) que \ncorrespondían a la etapa de exploración y explotación del proyecto, folio 1432 del expediente LAM \n0347 (…). \n \n(…)  \n \nMediante Auto 1983 del 23 de mayo de 2016 (…) se requiere lo siguiente: Artículo Tercero, numeral 3: \n“Presentar el Plan total de inversión del 1% de los costos efectivamente ejecutados por las actividades \nde exploración y explotación de hidrocarburos. El reporte de los valores o costos de las actividades de \nexploración y explotación de hidrocarburos, efectivamente ejecutadas, deben presentarse en valor \n\nResolución No. 2475       Del 25 OCT. 2023          Hoja No. 9 de 16 \n \n“POR LA CUAL SE RESUELVE UN RECURSO DE REPOSICIÓN” \n \nPágina 9 de 16 \n \npresente. Adicionalmente, debe presentar de forma inmediata el cronograma de las actividades \ndesarrolladas con la CAR, en cumplimiento de lo dispuesto en el artículo séptimo de la Resolución \n1383 del 1 de diciembre de 2004, numeral 4 del artículo primero de la Auto 988 de 31 de marzo de \n2010. \n \n(…)  \n \nLa Resolución 1846 del 18 de noviembre de 2020 acepta el acogimiento al porcentaje incremental y \nen su artículo octavo acepta la liquidación presentada, la cual siempre incluyo (sic) los valores de la \netapa exploratoria del proyecto tal como fue informado en el Plan de Inversión del 1% y se evidencia \nen los certificados de revisor fiscal. Así mismo la Resolución reconoce que la compañía tiene en \nejecución un valor de $23.695.868,27, que corresponden a los aprobados en el Auto 2726 del 14 de \njulio de 2010 que como se presenta en los numerales 3 y 4 también incluyeron la etapa exploratoria \ndel expediente LAM 0347.” \n \nEn relación con estos argumentos, en el expediente LAM0347 se identifica que mediante radicado \n2019183949-1-000 del 25 de noviembre de 2019 la Sociedad presentó la solicitud de acogimiento al \nporcentaje de incremento del valor de la base de liquidación de la inversión forzosa de no menos del \n1%, de acuerdo con lo establecido en el Artículo 321 de la Ley 1955 del 25 de mayo de 2019, para \ntodo el proyecto, es decir, integró lo autorizado en las Resoluciones correspondientes a las etapas \nexploratorias y de explotación del proyecto. \n \nDe acuerdo con la información que reposa en el SILA, para la obligación de la inversión forzosa de \nno menos del 1%, se tiene la siguiente línea de tiempo: \n \n− \nResolución 586 del 30 de mayo de 1995, por medio de la cual se otorgó Licencia Ambiental \nOrdinaria para la ejecución del proyecto “Bloque de Exploración Bocachico”. \n \n− \nResolución 374 del 12 de abril de 1996, referente a la Licencia Ambiental Ordinaria para la \nejecución del proyecto “Perforación Exploratoria del Pozo Torcaz 2”. \n \n− \nResolución 1245 del 20 de noviembre de 1996, por la cual se otorgó Licencia Ambiental \nOrdinaria para el proyecto “Bloque de Perforación Río Negro” y estableció el Plan de Manejo \npara la ejecución de la “Perforación Exploratoria de los Pozos Torcaz 3 y Torcaz 4”. \n \n− \nResolución 770 del 20 de agosto de 1997, que otorgó Licencia Ambiental Ordinaria para el \nproyecto “Bloque de perforación exploratoria Torcaz”. \n \n− \nResolución 1383 del 1 diciembre de 2004, que corresponde a la Licencia Ambiental Global \npara el proyecto “Explotación y Desarrollo del Campo Torcaz”. \n \nPor otro lado, la Sociedad realiza una línea histórica de los requerimientos realizados por el entonces \nMinisterio de Ambiente, Vivienda y Desarrollo Territorial -MAVDT- y por la Autoridad Nacional de \nLicencias Ambientales -ANLA-, en cuanto a la obligación de la inversión forzosa de no menos del \n1%; y en el subnumeral 3.3. Liquidación de la Inversión Forzosa de no menos del 1%, relaciona el \ncálculo del valor base para la liquidación de la inversión en la perforación de los pozos Torcaz 2, \nTorcaz 3 y Torcaz 5, perforados en los años 1996, 1997 y 1998, respectivamente. Dicho cálculo se \nencuentra referenciado para las etapas de exploración y explotación: \n\nResolución No. 2475       Del 25 OCT. 2023          Hoja No. 10 de 16 \n \n“POR LA CUAL SE RESUELVE UN RECURSO DE REPOSICIÓN” \n \nPágina 10 de 16 \n \n \nFuente: Radicado 2019183949-1-000 del 25 de noviembre de 2019 \n \n \nFuente: Radicado 2019183949-1-000 del 25 de noviembre de 2019 \n \nAhora bien, de acuerdo con los argumentos presentados por la Sociedad en el recurso de reposición \ninterpuesto en contra de la Resolución 539 del 15 de marzo de 2023, la Sociedad manifestó que la \nsolicitud de acogimiento al porcentaje incremental se había presentado como un solo proyecto y no \npor Resoluciones separadas, debido a que así venían presentando la información desde que se \notorgó la licencia de Explotación y Desarrollo del Campo Torcaz -Resolución 1383 del 1 de diciembre \nde 2004-. \n \nAl revisar el expediente, se encuentra tal y como lo expresa la Sociedad, que en el radicado No. \n4120-E1-58858 del 11 de mayo de 2010, esta presentó el Plan de Inversión del 1% del proyecto \nCampo Torcaz informando que el mismo incluía las etapas de exploración y explotación, separando \nlos montos y las acciones a ejecutar por cada etapa. \n \nPosteriormente, en el Auto 1983 del 23 de mayo de 2016, esta Autoridad le requirió a la Sociedad, \nla presentación del Plan total de inversión del 1% de los costos efectivamente ejecutados por las \nactividades de exploración y explotación de hidrocarburos, en cumplimiento de lo dispuesto en el \nartículo séptimo de la Resolución 1383 del 7 de diciembre de 2004, es decir, de la licencia ambiental \nglobal para el proyecto de explotación y desarrollo del Campo Torcaz. \n \nDe lo anterior, se tiene que en el radicado 2019183949-1-000 del 25 de noviembre de 2019, la \nSociedad presentó la solicitud de acogimiento al Artículo 321 de la Ley 1955 de 2019 asociado a la \nlicencia ambiental otorgada en la Resolución 1383 del 7 de diciembre de 2004, incluyendo la etapa \nde exploración y explotación. \n\nResolución No. 2475       Del 25 OCT. 2023          Hoja No. 11 de 16 \n \n“POR LA CUAL SE RESUELVE UN RECURSO DE REPOSICIÓN” \n \nPágina 11 de 16 \n \n \nEl pronunciamiento de la ANLA sobre esta solicitud de acogimiento se dio en el artículo primero de \nla Resolución 1846 del 18 de noviembre de 2020, que modificó la Resolución 1383 del 1 de diciembre \nde 2004, en el sentido de aprobar el acogimiento al porcentaje incremental contemplado en el \nArtículo 321 de la Ley 1955 del 25 de mayo del 2019, para el proyecto “Explotación y Desarrollo del \nCampo Torcaz”; y al verificar los certificados base de liquidación de la inversión forzosa de no menos \ndel 1%, se encuentra la certificación para el pozo Torcaz 3, aprobado en la Resolución 1245 del 20 \nde noviembre de 1996. \n \n \nFuente: Anexo B. Comunicación con radicación No. 2019183949-1-000 del 25 de noviembre de 2019 \n \n \n\nResolución No. 2475       Del 25 OCT. 2023          Hoja No. 12 de 16 \n \n“POR LA CUAL SE RESUELVE UN RECURSO DE REPOSICIÓN” \n \nPágina 12 de 16 \n \nPor lo anterior, se considera que, en la solicitud de acogimiento al porcentaje incremental, la \nSociedad indicó que dicha solicitud incluía las etapas de exploración y explotación para los proyectos \n“Bloque de Exploración Bocachico” y “Campo de Desarrollo Torcaz”.  \n \nDe acuerdo con esto, se hace necesario aclarar el artículo primero de la Resolución 1846 del 18 de \nnoviembre de 2020, en el sentido de incluir la modificación al artículo vigésimo cuarto de la \nResolución 1245 del 20 de noviembre de 1996, quedando de la siguiente manera:  \n \n“ARTÍCULO PRIMERO: Modificar el artículo séptimo de la Resolución 1383 del 1 de diciembre de 2004 \ny el artículo vigésimo cuarto de la Resolución 1245 del 20 de noviembre de 1996, expedidas por el hoy \nMinisterio de Ambiente y Desarrollo Sostenible, en el sentido de aprobar el acogimiento al porcentaje \nincremental contemplado en el artículo 321 de la Ley 1955 del 25 de mayo del 2019, presentado por la \nSociedad Cinco Ranch Petroleum Colombia Inc. Sucursal Colombia, identificada con NIT. 900695373-\n9, para los proyectos “Explotación y Desarrollo del Campo Torcaz” y “Bloque de Perforación Río Negro”, \nlocalizados en jurisdicción del municipio de Puerto Salgar, departamento de Cundinamarca.” \n \nAhora, respecto a la solicitud de dar por cumplido el artículo segundo de la Resolución 539 del 15 \nde marzo de 2023, que requirió la presentación de la actualización de la base de liquidación forzosa \nde no menos del 1% para el “Bloque de Perforación Río Negro”, esta Autoridad considera que la \nobligación impuesta en el precitado acto administrativo no es aplicable dado que esa obligación hace \nreferencia a la actualización de la base de liquidación de acuerdo con lo establecido en el Parágrafo \nPrimero del Artículo 321 de la Ley 1955 de 0291 y no al acogimiento porcentual al que hace \nreferencia el Artículo Primero [de la Resolución 1846 del 18 de noviembre de 2020] y que incluyó las \nactividades licenciadas tanto para el “Bloque de Perforación Río Negro” (Licencia Ambiental otorgada \nmediante Resolución 1245 del 20 de noviembre de 1996) como para el proyecto “Explotación y \nDesarrollo del Campo Torcaz” (Resolución 1383 del 1 diciembre de 2004). \n \nAhora, dada la modificación que se genera en el artículo primero de la Resolución 1846 del 18 de \nnoviembre de 2020, en el sentido de especificar que la solicitud de acogimiento al porcentaje \nincremental contemplado en el Artículo 321 de la Ley 1955 del 25 de mayo del 2019 se resolvió para \nlos proyectos “Explotación y Desarrollo del Campo Torcaz” y “Bloque de Perforación Río Negro”, se \nrequiere ajustar los artículos cuarto y quinto de la misma Resolución. \n \nEstos también deben especificar que la aprobación del proyecto de reforestación protectora con \nenfoque de restauración activa -REAA- y la definición de ámbito geográfico, también es para el \nproyecto “Bloque de Perforación Río Negro”; y no solamente para el proyecto “Explotación y \nDesarrollo del Campo Torcaz”. En consecuencia, dichos artículos quedarán así: \n \n“ARTÍCULO CUARTO. Aceptar el proyecto de reforestación protectora con enfoque de restauración \nactiva REAA, planteado en la línea de Restauración, conservación y protección de la cobertura vegetal, \nenriquecimientos vegetales y aislamiento de áreas para facilitar la sucesión natural, para los proyectos \n“Explotación y Desarrollo del Campo Torcaz” y “Bloque de Perforación Río Negro”. \n \nARTÍCULO QUINTO. El ámbito geográfico para realizar la inversión forzosa de no menos del 1% para \nlos proyectos “Explotación y Desarrollo del Campo Torcaz” y “Bloque de Perforación Río Negro”, \ncorresponde a la cuenca del río Negrito, microcuencas de los caños La Reines y Vicente, según lo \nestablecido en la Resolución 1383 del 1 de diciembre de 2004.” \n \nEn ese sentido [se deberá] REVOCAR el artículo segundo de la Resolución 0539 del 15 de marzo \nde 2023, referente a “Reiterar a la Sociedad CINCO RANCH PETROLEUM COLOMBIA INC. \nSUCURSAL COLOMBIA, que debe dar cumplimiento de la obligación Legal contenida en el \nparágrafo 1 del artículo 321 de la Ley 1955 del 25 de mayo de 2019 y presentar la actualización de \nla base de liquidación forzosa de no menos del 1% para los proyectos “Bloque de Perforación Río \nNegro” (Licencia Ambiental otorgada mediante Resolución 1245 del 20 de noviembre de 1996)”; y \nMODIFICAR los artículos primero, cuarto y quinto de la Resolución 1846 del 18 de noviembre de \n2020.  \n\nResolución No. 2475       Del 25 OCT. 2023          Hoja No. 13 de 16 \n \n“POR LA CUAL SE RESUELVE UN RECURSO DE REPOSICIÓN” \n \nPágina 13 de 16 \n \n \n(…)” \n \nTal como se indicó en las consideraciones expuestas por el Concepto técnico 6693 del 11 \nde octubre de 2023, la Autoridad Nacional a través de la Resolución 1846 del 18 de \nnoviembre de 2020, modificó el artículo séptimo de la Resolución 1383 del 1 de diciembre \nde 2004, en el sentido de aprobar el acogimiento al porcentaje incremental contemplado en \nel artículo 321 de la Ley 1955 del 25 de mayo del 2019, presentado por la Sociedad para \nel proyecto “Explotación y Desarrollo del Campo Torcaz”, localizado en jurisdicción del \nmunicipio de Puerto Salgar, departamento de Cundinamarca. \n \nVale la pena señalar, que la Resolución 1846 del 18 de noviembre de 2020 cobró ejecutoria \nsin que la sociedad haya interpuesto recurso alguno. \n \nAsí mismo, mediante el artículo segundo de la Resolución 539 del 15 de marzo de 2023 la \nAutoridad Nacional reiteró a la Sociedad el cumplimiento de la obligación Legal contenida \nen el parágrafo 1 del artículo 321 de la Ley 1955 del 25 de mayo de 2019 y, como \nconsecuencia de ello, la presentación de la actualización de la base de liquidación forzosa \nde no menos del 1% para el proyecto “Bloque de Perforación Río Negro” Licencia \nAmbiental otorgada mediante Resolución 1245 del 20 de noviembre de 1996. \n \nNo obstante, de acuerdo con las consideraciones técnicas presentadas con antelación, \ndentro de los certificados base de liquidación de la inversión forzosa de no menos del 1% \npresentados para la solicitud de acogimiento al porcentaje incremental, se incluyó la \ncertificación para el pozo Torcaz 3, aprobado en la Resolución 1245 del 20 de noviembre \nde 1996. \n \nAsí las cosas, acorde con los argumentos expuestos por el recurrente mediante \ncomunicación con radicación 20236200511532 del 23 de agosto de 2023 y el análisis \nrealizado mediante Concepto técnico 6693 del 11 de octubre de 2023, esta Autoridad \nconcluye que la solicitud de acogimiento al porcentaje incremental aprobada mediante \nResolución 1846 del 18 de noviembre de 2020, incluía las etapas de exploración y \nexplotación tanto del proyecto “Bloque de Exploración Bocachico”, como del proyecto \n“Campo de Desarrollo Torcaz”.   \n \nPor lo anterior, es claro que no hay lugar a retirar el cumplimiento de la obligación Legal \ncontenida en el parágrafo 1 del artículo 321 de la Ley 1955 del 25 de mayo de 2019 para \nel proyecto “Bloque de Perforación Río Negro”, tal como se estableció en el artículo \nsegundo de la Resolución 539 del 15 de marzo de 2023; por lo anterior, la Autoridad \nNacional resolverá dejar sin efectos jurídicos dicha obligación, tal como se señalará en la \nparte resolutiva del presente acto administrativo. \n \nFinalmente, en virtud de los principios de celeridad y economía que rigen la actuación \nadministrativa, según la cual: \n \n“(…) para los funcionarios públicos el objetivo de otorgar agilidad al cumplimiento de sus \ntareas, funciones y obligaciones públicas, hasta que logren alcanzar sus deberes básicos \n\nResolución No. 2475       Del 25 OCT. 2023          Hoja No. 14 de 16 \n \n“POR LA CUAL SE RESUELVE UN RECURSO DE REPOSICIÓN” \n \nPágina 14 de 16 \n \ncon la mayor prontitud, y que de esta manera su gestión se preste oportunamente cubriendo \nlas necesidades y solicitudes de los destinatarios y usuarios (…)”1 \n \nSe hace necesario modificar de oficio los artículos primero, cuarto y quinto de la Resolución \n1846 del 18 de noviembre de 2020, en el sentido de establecer que los pronunciamientos \nallí establecidos se hacen extensivos al proyecto “Bloque de Perforación Río Negro”, tal \ncomo se indicará en la parte resolutiva del presente acto administrativo. \n \nEn mérito de lo expuesto, \n \nRESUELVE \n \nARTÍCULO PRIMERO. Dejar sin efecto jurídico lo dispuesto en el artículo segundo de la \nResolución 539 del 15 de marzo de 2023, de conformidad con lo expuesto en la parte motiva \ndel presente acto administrativo. \n \nARTÍCULO SEGUNDO. Modificar de oficio lo dispuesto en el artículo primero de la \nResolución 1846 del 18 de noviembre de 2020, de conformidad con lo expuesto en la parte \nmotiva del presente acto administrativo, el cual quedará de la siguiente manera: \n \n“ARTÍCULO PRIMERO. Modificar el artículo séptimo de la Resolución 1383 del 1 \nde diciembre de 2004 y el artículo vigésimo cuarto de la Resolución 1245 del 20 de \nnoviembre de 1996, expedidas por el hoy Ministerio de Ambiente y Desarrollo \nSostenible, en el sentido de aprobar el acogimiento al porcentaje incremental \ncontemplado en el Artículo 321 de la Ley 1955 del 25 de mayo del 2019, presentado \npor la Sociedad Cinco Ranch Petroleum Colombia Inc. Sucursal Colombia, \nIdentificada con NIT. 900695373-9, para los proyectos “Explotación y Desarrollo del \nCampo Torcaz” y “Bloque de Perforación Río Negro”, localizados en jurisdicción del \nmunicipio de Puerto Salgar, departamento de Cundinamarca.” \n \nARTÍCULO TERCERO. Modificar de oficio lo dispuesto en el artículo cuarto de la \nResolución 1846 del 18 de noviembre de 2020, de conformidad con lo expuesto en la parte \nmotiva del presente acto administrativo, el cual quedará de la siguiente manera: \n \n“ARTÍCULO CUARTO. Aceptar el proyecto de reforestación protectora con enfoque \nde restauración activa REAA, planteado en la línea de Restauración, conservación \ny protección de la cobertura vegetal, enriquecimientos vegetales y aislamiento de \náreas para facilitar la sucesión natural, para los proyectos “Explotación y Desarrollo \ndel Campo Torcaz” y “Bloque de Perforación Río Negro”. \n \nARTÍCULO CUARTO. Modificar de oficio lo dispuesto en el artículo quinto de la \nResolución 1846 del 18 de noviembre de 2020, de conformidad con lo expuesto en la parte \nmotiva del presente acto administrativo, el cual quedará de la siguiente manera: \n \n“ARTÍCULO QUINTO. El ámbito geográfico para realizar la inversión forzosa de no \nmenos del 1% para los proyectos “Explotación y Desarrollo del Campo Torcaz” y \n“Bloque de Perforación Río Negro”, corresponde a la cuenca del río Negrito, \nmicrocuencas de los caños La Reines y Vicente, según lo establecido en la \n \n1 Sentencia C-826/13 de la Honorable Corte Constitucional \n\nResolución No. 2475       Del 25 OCT. 2023          Hoja No. 15 de 16 \n \n“POR LA CUAL SE RESUELVE UN RECURSO DE REPOSICIÓN” \n \nPágina 15 de 16 \n \nResolución 1383 del 1 de diciembre de 2004 y la Resolución 1245 del 20 de \nnoviembre de 1996.” \n \nARTÍCULO QUINTO. Notificar el presente acto administrativo al representante legal, o al \napoderado debidamente constituido o a la persona debidamente autorizada por la Sociedad \nCINCO RANCH PETROLEUM COLOMBIA INC. SUCURSAL COLOMBIA, identificada con \nNIT. 900.695.373-9, o a quien haga sus veces de conformidad con lo dispuesto en los \nartículos 67 y siguientes de la Ley 1437 de 2011. \n \nPARÁGRAFO. En el suceso en que el titular de la licencia o el permiso, entre en proceso \nde disolución o régimen de insolvencia empresarial o liquidación regulados por las normas \nvigentes, informará inmediatamente de esta situación a esta Autoridad, con fundamento, \nentre otros, en los artículos 8, 58, 79, 80, 81, 95 numeral 8 de la Constitución Política de \n1991, en la Ley 43 de 1990, en la Ley 222 de 1995, en la Ley 1333 de 2009 y demás normas \nvigentes y jurisprudencia aplicable.  \n \nAdicional a la obligación de informar a esta Autoridad de tal situación, el titular de la licencia \no permiso aprovisionará contablemente las obligaciones contingentes que se deriven de la \nexistencia de un procedimiento ambiental sancionatorio conforme con el artículo 40 de la \nLey 1333 de 2009 o la norma que la adicione, modifique o derogue. \n \nARTÍCULO SEXTO. Comunicar el contenido del presente acto administrativo a la \nCorporación Autónoma Regional de Cundinamarca - CAR y a la Agencia Nacional de \nHidrocarburos (ANH). \n \nARTÍCULO SÉPTIMO. Publicar la presente Resolución en la Gaceta Ambiental de la \nAutoridad Nacional de Licencias Ambientales - ANLA, de conformidad con lo señalado en \nel artículo 71 de la Ley 99 de 1993. \n \nARTÍCULO OCTAVO. Contra el presente acto administrativo no procede recurso alguno \nde conformidad con lo establecido en el artículo 87 del Código de Procedimiento \nAdministrativo y de lo Contencioso Administrativo. \n \nNOTIFÍQUESE, COMUNÍQUESE, PUBLÍQUESE Y CÚMPLASE \n \nDado en Bogotá D.C., a los 25 OCT. 2023 \n \n \n \n \n \nEDILBERTO PENARANDA CORREA \nASESOR \n \n \n \n \n\nResolución No. 2475       Del 25 OCT. 2023          Hoja No. 16 de 16 \n \n“POR LA CUAL SE RESUELVE UN RECURSO DE REPOSICIÓN” \n \nPágina 16 de 16 \n \n \nIBLER ANDERSON MOLANO RINCON \nCONTRATISTA \n \n \n \nANDREA DEL PILAR SANABRIA DEL RIO \nCONTRATISTA \n \n \n \nExpediente No. LAM0347 \nConcepto Técnico 6693 del 11 de octubre de 2023 \nFecha: 25 de octubre de 2023 \n \nProceso No.: 20231000024754 \n \nNota: Este es un documento electrónico generado desde los Sistemas de Información de la ANLA. El original reposa en los archivos digitales de la \nEntidad \n \n \n \n \n \n \n \n \n \n \n \n \n \n \n \n \n \n \n \n \n \n"
}