{
  "fuente": "ANLA_GACETA",
  "numero_resolución": "RESOLUCIÓN N° 000197",
  "fecha_resolución": "2011-09-27",
  "nombre_proyecto": "proyecto “Bloque de Perforación",
  "ubicación": "Departamento del Cesar.",
  "empresa": "el entonces Ministerio del Medio Ambiente, otorgó licencia ambiental a la sociedad HARKEN de COLOMBIA LTD",
  "numero_expediente": "No",
  "radicados": [
    "2022177546",
    "20236200268942",
    "2022239642",
    "20236200329842"
  ],
  "descripcion": "POR LA CUAL SE RESUELVE UN RECURSO DE REPOSICIÓN",
  "tipos_infraccion": [
    "Incumplimiento del PMA"
  ],
  "pdf_id": "45466",
  "file_name": "ANLA_45466.pdf",
  "texto_completo": "República de Colombia\nMinisterio de Ambiente y Desarrollo Sostenible\nAUTORIDAD NACIONAL DE LICENCIAS \nAMBIENTALES\n- ANLA –\nRESOLUCIÓN N° 000197\n(12 FEB. 2024)\nPágina 1 de 18\n“POR LA CUAL SE RESUELVE UN RECURSO DE REPOSICIÓN”\nEL DIRECTOR GENERAL DE LA AUTORIDAD NACIONAL DE LICENCIAS \nAMBIENTALES – ANLA.\nEn uso de las competencias asignadas en la Ley 99 de 1993, la Ley 1437 de \n2011, el Decreto-ley 3573 del 27 de septiembre de 2011, el Decreto 1076 del 26 \nde mayo de 2015, el Decreto 376 de 11 de marzo de 2020, la Resolución 1957 del \n5 de noviembre de 2021 de la ANLA, la Resolución 1223 del 19 de septiembre de \n2022 del MADS, y\nCONSIDERANDO:\nQue mediante Resolución 0788 del 25 de agosto de 1997, el entonces Ministerio \ndel Medio Ambiente, otorgó licencia ambiental a la sociedad HARKEN de \nCOLOMBIA LTD., para la ejecución del proyecto “Bloque de Perforación \nExploratoria Buturama”, localizado en jurisdicción de los municipios de Aguachica y \nGamarra del Departamento del Cesar. \nQue por medio de la Resolución 273 del 19 de marzo de 1998, el entonces Ministerio \ndel Medio Ambiente, modificó la Licencia Ambiental otorgada mediante Resolución \n788 de 1997 a la empresa HARKEN DE COLOMBIA LTD., en el sentido de incluir \nla utilización de las aguas subterráneas del pozo denominado Catalina 1; aceptó el \nPlan de Contingencia presentado para el transporte de crudo de los pozos \nperforados desde la plataforma Catalina B e impuso la obligación del Plan de \nInversión de no menos del 1% en actividades de recuperación preservación y \nvigilancia de la microcuenca del caño Gallinazo. \nQue a través de la Resolución 690 del 26 de julio de 2001, el entonces Ministerio de \nAmbiente, Vivienda y Desarrollo Territorial – MAVDT, otorgó a la Sociedad HARKEN \nde COLOMBIA LTD, licencia ambiental global para la \"Explotación de Hidrocarburos \nen el Campo Catalina”, localizado en jurisdicción de los municipios de Aguachica y \nGamarra del Departamento del Cesar. \n\nResolución No. 000197       Del 12 FEB. 2024          Hoja No. 2 de 18\n“Por la cual se resuelve un recurso de reposición”\nPágina 2 de 18\nQue mediante la Resolución 2027 del 15 de octubre de 2010, el entonces Ministerio \nde Ambiente, Vivienda y Desarrollo Territorial – MAVDT, aceptó el cambio de razón \nsocial del titular de los trámites administrativos ambientales otorgados mediante \nResolución 0788 del 25 de agosto de 1997 y Resolución 0690 del 26 de julio de \n2001, de la sociedad HARKEN de COLOMBIA LTD por la Sociedad COLOMBIA \nENERGY DEVELOPMENT CO. \nQue mediante Resolución 1453 del 12 de noviembre de 2015, la Autoridad Nacional \nde Licencias Ambientales – ANLA- autorizó la cesión total de los derechos y \nobligaciones originados y derivados del instrumento de control ambiental otorgados \nmediante Resolución 788 del 25 de agosto de 1997 y Resolución 690 del 26 de julio \nde 2001, a cargo de la sociedad COLOMBIA ENERGY DEVELOPMENT CO., a \nfavor de la sociedad LAGOSUR PETROLEUM COLOMBIA INC SUCURSAL \nCOLOMBIA. \nQue mediante la Resolución 1182 del 7 de julio de 2021, la Autoridad Nacional de \nLicencias Ambientales -ANLA, modificó el artículo decimo noveno de la Resolución \n273 del 19 de marzo de 1998, en el sentido aprobar el acogimiento al porcentaje \nincremental de la base de liquidación de la inversión forzosa de no menos del 1%, \nde conformidad con lo señalado en el artículo 321 del Plan Nacional de Desarrollo - \nPND (Ley 1955 del 25 de mayo del 2019). \nQue mediante Resolución 464 de 08 de marzo de 2023, está Autoridad Nacional, \nincorporo unas medidas al Plan de Manejo Ambiental para la fase de operación y \nmantenimiento del proyecto “Bloque de Perforación Exploratoria Buturama y Campo \nCatalina” presentadas mediante radicado 2022177546-1- 000 de 18 de agosto de \n2022.\nQue mediante el oficio con radicado ANLA 20236200268942 del 26 de junio de \n2023, el primer suplente del representante legal de la sociedad, solicitó a esta \nAutoridad Nacional que se tuviera por notificada por conducta concluyente la \nResolución 464 de 08 de marzo de 2023 el 23 de junio de 2023, toda vez que la \nnotificación se envió al correo lorena.gil@cedco.com, el cual ya no se encuentra \nhabilitada en la Compañía, ya que las sociedad cambio los dominios, lo cual había \nsido informado de manera oportuna a la Autoridad, mediante oficio con radicado No. \n2022239642-1-000 del 26 de octubre de 2022, en el cual se informó que el correo \npara notificaciones es: Bogota-Notificaciones-Judiciales@sierracol.com, lo cual \nademás se evidencia en el Certificado de Existencia y Representación de la \nsociedad.\nEn contestación, esta Autoridad Nacional mediante radicado ANLA  15DPE59762-\n00-2023 de 04 de julio de 2023, informó a la sociedad que el Grupo de Gestión de \nNotificaciones de la Subdirección Administrativa y Financiera, dejó sin efecto la \nconstancia de ejecutoria de la Resolución 464 de 8 de marzo de 2023, además \n\nResolución No. 000197       Del 12 FEB. 2024          Hoja No. 3 de 18\n“Por la cual se resuelve un recurso de reposición”\nPágina 3 de 18\ninformo que se entiende por notificada por conducta concluyente la Resolución en \nmención el día 23 de junio de 2023.\nQue a través de comunicación con radicación 20236200329842 del 10 de julio de \n2023, la sociedad LAGOSUR PETROLEUM COLOMBIA INC. SUCURSAL \nCOLOMBIA, presentó recurso de reposición en contra de la Resolución 464 del 08 \nde marzo de 2023.\nQue mediante Concepto Técnico 6300 del 28 de septiembre de 2023, la Autoridad \nNacional de Licencias Ambientales – ANLA, realizó las consideraciones técnicas \npertinentes para resolver el citado recurso, el cual sirve de soporte técnico de las \ndisposiciones que se adoptan en la presente actuación administrativa.\nCOMPETENCIA \nDE \nLA \nAUTORIDAD \nNACIONAL \nDE \nLICENCIAS \nAMBIENTALES – ANLA.\n \nEl artículo 2º de la Ley 99 de 1993, dispuso la creación del Ministerio del Medio \nAmbiente, como el organismo rector de la gestión del medio ambiente y de los \nrecursos naturales renovables, encargado entre otras cosas de definir las \nregulaciones a las que se sujetarán la conservación, protección, manejo, uso y \naprovechamiento de los recursos naturales renovables y el medio ambiente de la \nNación, a fin de asegurar el desarrollo sostenible, estableciendo en el numeral 15 \ndel artículo 5, como una de sus funciones, evaluar los estudios ambientales y \nexpedir, negar o suspender la Licencia Ambiental correspondiente, en los casos que \nse señalan en el Título VIII de la ley precitada, competencia expresamente indicada \nen el artículo 52 de la misma norma.\nEn ejercicio de las facultades extraordinarias conferidas en los literales d), e) y f), \ndel artículo 18 de la Ley 1444 de 2011, el Gobierno Nacional expidió el Decreto 3573 \ndel 27 de septiembre de 2011, creando la Autoridad Nacional de Licencias \nAmbientales - ANLA, y le asigna entre otras funciones, la de otorgar o negar las \nlicencias, permisos y trámites ambientales de competencia del Ministerio de \nAmbiente y Desarrollo Sostenible. \n \nA través del Decreto 1076 del 26 de mayo de 2015 el Gobierno Nacional expidió el \nDecreto Único Reglamentario del Sector Ambiente y Desarrollo Sostenible, cuyo \nobjeto es compilar la normativa expedida por el Gobierno Nacional en ejercicio de \nlas facultades reglamentarias conferidas por el numeral 11 del artículo 189 de la \nConstitución Política de 1991, para la cumplida ejecución de las leyes del sector \nAmbiente. Ahora bien, el artículo 3.1.2 de la Parte 1 del Libro 3 del citado Decreto, \nseñala que el mismo rige a partir de su publicación en el Diario Oficial, hecho \nacaecido el día 26 de mayo de 2015 en razón a la publicación efectuada en el Diario \nOficial N° 49523. \n\nResolución No. 000197       Del 12 FEB. 2024          Hoja No. 4 de 18\n“Por la cual se resuelve un recurso de reposición”\nPágina 4 de 18\nPor su parte, de acuerdo con el numeral 2 del artículo segundo del Decreto 376 del \n11 de marzo de 2020, “por medio del cual se modifica la estructura de la Autoridad \nNacional de Licencias Ambientales”, corresponde al director general de la Entidad, \nsuscribir los actos administrativos que otorgan, niegan, modifican, ajustan o \ndeclaran la terminación de las licencias, permisos y trámites ambientales.\nPor medio de la Resolución 1957 del 5 de noviembre de 2021, “Por la cual se adoptó \nel Manual Específico de Funciones y de Competencias Laborales para los empleos \nde la planta de personal de la Autoridad Nacional de Licencias Ambientales - ANLA”\nMediante la Resolución 1223 del 19 de septiembre de 2022, expedida por el \nMinisterio de Ambiente y Desarrollo Sostenible “Por la cual se efectúa un \nnombramiento ordinario”, se nombró director general de la Autoridad Nacional de \nLicencias Ambientales -ANLA-, al doctor RODRIGO NEGRETE MONTES.\nDado que el director general de la Autoridad Nacional de Licencias Ambientales -\nANLA-, suscribió la Resolución 464 del 8 de marzo de 2023, es el funcionario \ncompetente para resolver el presente recurso de reposición interpuesto por la \nsociedad LAGOSUR PETROLEUM COLOMBIA INC. SUCURSAL COLOMBIA, de \nconformidad con lo señalado en artículo 74 de la Ley 1437 de 2011.\nDEL RECURSO DE REPOSICIÓN.\nDe acuerdo con la legislación, el recurso de reposición constituye un instrumento \nlegal mediante el cual la parte interesada tiene la oportunidad de ejercer el derecho \nde controvertir una decisión, para que la administración previa su evaluación, la \nconfirme, aclare modifique o revoque, previo el lleno de las exigencias legales \nestablecidas para dicho efecto. \nFrente al recurso de reposición, ha manifestado la doctrina: \n“El de reposición se ha considerado históricamente como recurso connatural \nal Estado de derecho; en especial al derecho fundamental a la controversia \nde toda decisión administrativa. Se funda esta tesis en el criterio de que no \nexiste acto administrativo sin control. Se trata, pues, del más elemental de \ntodos los recursos para garantizar el principio de la contradicción y el debido \nproceso”1\nEn dicho sentido, la finalidad esencial del recurso de reposición no es otra distinta \nque facultar para que el funcionario de la administración que tomó una decisión \nadministrativa tenga la oportunidad para enmendar o corregir un error, o los posibles \n1 Santofimio Gamboa Jaime Orlando. Tratado de derecho Administrativo, 4ta edición. Universidad Externado \nde Colombia, 1998, p. 266\n\nResolución No. 000197       Del 12 FEB. 2024          Hoja No. 5 de 18\n“Por la cual se resuelve un recurso de reposición”\nPágina 5 de 18\nerrores que se hayan podido presentar en el acto administrativo por él expedido, en \nejercicio de sus funciones.\nRequisitos para su procedencia. \nEsta Autoridad considera necesario indicar algunos aspectos relacionados con las \nfacultades de las autoridades administrativas en la expedición de los actos \nadministrativos mediante los cuales se resuelven recursos contra los actos \nadministrativos.\nEl procedimiento, oportunidad y requisitos para la interposición del recurso de \nreposición se encuentra reglado en el Código de Procedimiento Administrativo y de \nlo Contencioso Administrativo en los siguientes artículos:\n\"ARTICULO 74. Recursos contra los actos administrativos. Por regla \ngeneral, contra los actos definitivos procederán los siguientes recursos:\nEl de reposición, ante quien expidió la decisión, para que la aclare, modifique \no revoque.\n(…)\nARTICULO 76. Oportunidad y presentación. Los recursos de reposición y \napelación deberán interponerse por escrito en la diligencia de notificación \npersonal, o dentro de los diez (10) días siguientes a ella, o a la notificación \npor aviso, o al vencimiento del término de publicación, según el caso (…) \nLos recursos se presentarán ante el funcionario que dictó la decisión…”\nA su vez, el artículo 77 del precitado Código señala:\n\"ARTICULO 77. Requisitos. Por regla general los recursos se interpondrán \npor escrito que no requiere de presentación personal sí quien lo presenta ha \nsido reconocido en la actuación. Igualmente, podrán presentarse por medios \nelectrónicos.\nLos recursos deberán reunir, además los siguientes requisitos:\n1. Interponerse dentro del plazo legal, por el interesado o su \nrepresentante o apoderado debidamente constituido.\n2. Sustentarse con expresión concreta de los motivos de inconformidad.\n3. Solicitar y aportar las pruebas que se pretende hacer valer.\n4. Indicar el nombre y la dirección del recurrente, así como la dirección \nelectrónica si desea ser notificado por este medio. ( ... )”\n\nResolución No. 000197       Del 12 FEB. 2024          Hoja No. 6 de 18\n“Por la cual se resuelve un recurso de reposición”\nPágina 6 de 18\nPor su parte, el artículo 80 del Código de Procedimiento Administrativo y de lo \nContencioso Administrativo, determina:\n\"ARTÍCULO 80. Decisión de los Recursos. Vencido el periodo probatorio, \nsi a ello hubiere lugar, y sin necesidad de acto que así lo declare, deberá \nproferirse la decisión motivada que resuelva el recurso.\nLa decisión resolverá todas las peticiones que hayan sido oportunamente \nplanteadas y las que surjan con motivo del recurso.\"\nPara el caso concreto que nos ocupa, la Resolución 464 del 8 de marzo de 2023, \nes un proveído susceptible de ser recurrido, según el artículo 74 de la Ley 1437 de \n2011, puesto que se trata de un acto definitivo en la medida en que adopta una \ndecisión que manifiesta la voluntad del Estado y es generadora de efectos jurídicos \nque, en los términos del Consejo de Estado, tal como lo señaló en sentencia de la \nSección Tercera de la Sala de lo Contencioso Administrativo del 8 de marzo de \n2012, se caracteriza por lo siguiente:\n“… Por el contrario, los actos definitivos ponen fin de manera perentoria a la \nactuación administrativa sea de oficio o impulsada a petición de parte, de \nmodo que en ellos se agota la actividad de la administración, o tan sólo queda \npendiente la ejecución de lo decidido. Ahora bien, es cierto que los únicos \nactos susceptibles de la Acción Contenciosa Administrativa son los actos \ndefinitivos, es decir que se excluyen los de trámite, pues éstos se controlan \njurisdiccionalmente como parte integrante del acto definitivo y conjuntamente \ncon éste, es decir de aquel que cierra la actuación administrativa.”\nA partir de lo anteriormente expuesto, se procede a revisar si el recurso de \nreposición interpuesto y que es objeto de este pronunciamiento administrativo, ha \ncumplido los requisitos legales que lo rigen para efectos de emitir decisión de fondo:\nLa Resolución 464 del 8 de marzo de 2023, objeto de censura fue notificada \nelectrónicamente a la sociedad LAGOSUR PETROLEUM COLOMBIA INC. \nSUCURSAL COLOMBIA, el 9 de marzo de 2023. No obstante, mediante el oficio \ncon radicado ANLA 20236200268942 del 26 de junio de 2023, el primer suplente \ndel representante legal de la sociedad, solicitó a esta Autoridad Nacional que se \ntuviera por notificada por conducta concluyente el 23 de junio de 2023, toda vez que \nla notificación se envió al correo lorena.gil@cedco.com, el cual ya no se encuentra \nhabilitada en la Compañía, ya que las sociedad cambio los dominios, situación que \nindica había sido informado de manera oportuna a la Autoridad mediante \ncomunicación con radicado 2022239642-1-000 del 26 de octubre de 2022, donde \nse manifestó que el correo para notificaciones sería bogota-notificaciones- \nJudiciales@sierracol.com, de conformidad con el Certificado de Existencia y \nRepresentación de la sociedad.\n\nResolución No. 000197       Del 12 FEB. 2024          Hoja No. 7 de 18\n“Por la cual se resuelve un recurso de reposición”\nPágina 7 de 18\nEn respuesta a lo anterior, esta Autoridad Nacional mediante oficio ANLA  \n15DPE59762-00-2023 del 4 de julio de 2023, informó a la sociedad que el Grupo de \nGestión de Notificaciones de la Subdirección Administrativa y Financiera, dejó sin \nefecto la constancia de ejecutoria de la Resolución 464 de 8 de marzo de 2023, y \nen consecuencia se entiende por notificada a través de conducta concluyente la \nResolución 464 del 08 de marzo de 2023, el día 23 de junio de 2023.\nAhora bien, el recurso de reposición se interpuso el 10 de julio de 2023, es decir, \ndentro del término de diez (10) días hábiles siguientes al de la fecha de la citada \nnotificación, observando así, el requisito de oportunidad legal para su presentación.\nDe igual manera, el recurso de reposición fue interpuesto mediante comunicación \ncon radicado ANLA 20236200329842 del 10 de julio de 2023, por el señor FABIO \nANDRÉS CUENCA, en calidad de representante legal de la sociedad LAGOSUR \nPETROLEUM COLOMBIA INC. SUCURSAL COLOMBIA, conforme al Certificado \nde Existencia y Representación Legal adjunto al recurso, verificándose así, la \nlegitimidad por activa para impulsar el presente recurso como apoderado de la titular \nde la licencia ambiental. A su vez, el recurso contiene los motivos de inconformidad \ny dirección de notificaciones, cumpliéndose así los requisitos expuestos en el \nartículo 77 de la Ley 1437 de 2011. \nSiendo ello así, al verificarse el cumplimiento de los requisitos legales establecidos \npara la procedencia del recurso de reposición, se efectuará el análisis de fondo de \nlos motivos de inconformidad del recurrente tal y como se expone a continuación.\nCONSIDERACIONES DE LA AUTORIDAD.\nA continuación, se realiza el análisis uno a uno de los argumentos del recurso de \nreposición presentado por el representante legal de la sociedad LAGOSUR \nPETROLEUM COLOMBIA INC. SUCURSAL COLOMBIA, mediante comunicación \ncon radicación 20236200329842 del 10 de julio de 2023, teniendo en cuenta las \nconsideraciones efectuadas por esta Autoridad mediante el Concepto Técnico 6300 \ndel 28 de septiembre de 2023.\nPara tal efecto, el desarrollo de la presente actuación administrativa se llevará a \ncabo de la siguiente manera:  1. Cita de la disposición administrativa recurrida; 2. \nLa petición del recurrente; 3. Los argumentos o motivos de inconformidad del \nrecurrente y 4. Consideraciones técnicas y jurídicas de la ANLA, tal y como se \nexpone a continuación. \n1. OBLIGACIÓN RECURRIDA – Numeral 9.2 del artículo sexto de la \nResolución 464 de 08 de marzo de 2023. \nEl acto administrativo en cita señala:\n\nResolución No. 000197       Del 12 FEB. 2024          Hoja No. 8 de 18\n“Por la cual se resuelve un recurso de reposición”\nPágina 8 de 18\n“ARTÍCULO SEXTO. Requerir a la sociedad LAGOSUR PETROLEUM \nCOLOMBIA INC SUCURSAL COLOMBIA, para que en un término de tres (3) \nmeses contados a partir de la ejecutoria del presente acto administrativo o en el \nplazo que se establezca en cada obligación, dé cumplimiento a las siguientes \nobligaciones y allegue los correspondientes soportes en donde se evidencie la \nobservancia a las mismas: \n(…)\n9. En cuanto a la ficha Plan de Seguimiento y Monitoreo de Agua Subterráneas, \nincluir lo siguiente: \n(…)\n9.2.  Realizar una vez al mes mediciones del nivel estático y dinámico del pozo, \nasí́ como la medición de parámetros in situ (pH, temperatura, conductividad \neléctrica, oxígeno disuelto y sólidos disueltos totales), y presentar en los \nrespectivos Informes de Cumplimiento Ambiental - ICA: \na) Base de datos con la información solicitada de manera acumulada, en hoja \nde cálculo, analizando la tendencia y comportamiento de los niveles y variables \nquímicas in situ solicitadas. \nb)  Registros de campo de la toma de datos, para el periodo reportado. \nc)  Certificados de calibración del(los) equipo(s) de medición vigentes de \ncalibración según la periodicidad que establezca el fabricante del equipo.”\n(…)\nPETICIÓN DE LA SOCIEDAD \nLa sociedad en el Recurso de Reposición presentado mediante comunicación con \nradicado ANLA   20236200329842 del 10 de julio de 2023, solicitó:\n(…) solicitamos respetuosamente la ANLA MODIFICAR el numeral 9.2 del \nartículo sexto de la Resolución No. 00464 del 08 de marzo de 2023 para \nestablecer que las mediciones del nivel estático y dinámico del pozo se realicen \nuna vez al año y cuando el proyecto esté en operación y no una vez al mes como \nquedó establecido.\nARGUMENTOS DE LA SOCIEDAD LAGOSUR PETROLEUM COLOMBIA INC. \nSUCURSAL COLOMBIA\nEn el escrito de impugnación, la sociedad presentó las siguientes consideraciones: \n\nResolución No. 000197       Del 12 FEB. 2024          Hoja No. 9 de 18\n“Por la cual se resuelve un recurso de reposición”\nPágina 9 de 18\n•\nA través del oficio con radicado No. 2023029655-1-000 del 16 de febrero de \n2023 LAGOSUR avisó a la ANLA acerca de la finalización de actividades \noperativas en Campo en Catalina. En este oficio mencionamos que, dadas \nlas condiciones de inactividad del campo, las actividades estarán sujetas \núnicamente a los cuidados diarios de limpieza y seguridad del campo (es \ndecir, un vigilante). Por consiguiente, es importante precisar, que el campo al \nestar en las condiciones antes descritas no genera impactos ambientales, ni \ntampoco ejerce una presión sobre los recursos naturales del área, debido a \nla ausencia de las actividades operativas. Por consiguiente, no se hace \ncaptación del recurso hídrico, dado que la única persona que se encuentra \nen campo consume agua de botellón, ya que la ausencia de operación no \nrequiere una planta de tratamiento para el agua. Por lo tanto, \nrespetuosamente consideramos que realizar un ajuste de una ficha que \nincluye pruebas dinámicas y estáticas de manera mensual con los \nrespectivos monitoreos como lo establece el requerimiento a que se refiere \nel numeral 9.2. del artículo sexto de la Resolución no tiene fundamento \ncuando no se hace uso ni se ejerce presión sobre del recurso hídrico. \n•\nIgualmente, si se hiciera uso del recurso, tal como se evidencio en la tabla \nNo. 1, donde se muestra la captación entre los meses de agosto y octubre \nde 2022, se puede determinar que el máximo consumo de agua acumulado \nde LAGOSUR durante la etapa de perforación fue de 3570,42 m3 y que el \nvolumen promedio diario captado fue de 0,64 L/s valor correspondiente al \n25,43% de lo autorizado en el literal A Artículo tercero de la Resolución 0690 \ndel 26 de julio de 2001, por lo que aún si se estuviese realizando la actividad \nque genera más consumo de agua, lo cual no es el caso, no se generaría \npresión sobre el recurso y tampoco sobre el acuífero que amerite el \nestablecimiento del requerimiento en los términos del numeral 9.2. del \nartículo sexto de la Resolución. \n(…)\n•\nAdicionalmente, como se puede verificar en el anexo No. 4, se encuentran \nlos resultados físicoquímicos del agua del pozo profundo de campo catalina, \nlo que también demuestra que durante la etapa de perforación no se alteran \nlas condiciones del agua subterránea.\n•\nAsí mismo, respetuosamente consideramos que una prueba dinámica y \nestática (prueba de bombeo) de forma mensual genera más impacto negativo \nal recurso subterráneo dado que se necesita mínimo 24 horas de bombeo \ncontinuo de agua para establecer su dinamismo y tiempo de recuperación, \npor lo que el recurso hídrico se desperdiciaría ya que no se utilizaría para \nninguna actividad del campo. \n\nResolución No. 000197       Del 12 FEB. 2024          Hoja No. 10 de 18\n“Por la cual se resuelve un recurso de reposición”\nPágina 10 de 18\n•\nPor otro lado, la ANLA a través del comunicado con radicado No. \n20234300203541 del 04 de julio de 2023 (Anexo No. 5) indicó una Alerta el \ncrecimiento de la probabilidad de desarrollo del Fenómeno El Niño en \nColombia y un 63% de aumento de este en las zonas de Magdalena Medio, \npor lo que insistimos que realizar una prueba de bombeo mensual en el \nCampo Catalina no solo no es necesario, sino que además se constituiría en \nun uso no eficiente del agua que podría ser ahorrada.\nCONSIDERACIONES TECNICAS Y JURÍDICAS DE LA ANLA.\nQue, frente a lo anterior, el equipo de seguimiento ambiental de la Autoridad \nNacional consideró en el Concepto Técnico 6300 del 28 de septiembre de 2023, lo \nsiguiente:\n“(…) Durante la visita de seguimiento ambiental realizada los días 14, 15 y 16 de \njunio de 2023, el ESA verificó que la Sociedad suspendió las labores en el \nCampo. LAGOSUR PETROLEUM indicó que no es económicamente viable la \nextracción del crudo debido al alto contenido de agua en el crudo extraído. \nEvidenciando que no se encuentra haciendo uso ni aprovechamiento de \nrecursos naturales, tal como lo indico la Sociedad en la comunicación con \nradicación en la ANLA 2023029655-1-000 del 16 de febrero de 2023.\nAhora bien, teniendo en cuenta que el sub numeral 9.2, requiere las mediciones \nde los niveles estáticos y dinámicos del pozo, es de precisar que los mismos son \nobtenidos a través de una prueba de bombeo en el pozo de agua subterránea, \nla cual se realiza con la extracción de agua por mínimo 24 horas/día. En términos \ngenerales, el nivel estático se da cuando no se está extrayendo agua del acuífero \ny una vez se inicia la prueba, el nivel estático empieza descender o abatirse, y \nse va conociendo el nivel dinámico.\nDe acuerdo con lo anterior, en el escenario en el que no se realice captación, se \nentiende que no se genera un impacto sobre el recurso, toda vez que no hay un \nabatimiento del acuífero, por tanto no habría lugar al monitoreo mensual \nestablecido, dado que los datos que se obtendrían de una prueba de bombeo \nsin operación en el Campo, no estarían asociados a las actividades del proyecto \ny los datos obtenidos no tendrán una variación mes a mes; por tanto, se \nconsidera que la Sociedad debe realizar las pruebas en los momentos de uso y \naprovechamiento del recurso, que corresponden a la etapa de perforación de \npozos y de operación del Campo.\nEs importante mencionar que de acuerdo con los reportes de captación \npresentados por la Sociedad en los ICA 19 del periodo 2022 evaluados en los \nCT 3942 del 4 de julio de 2023, el nivel de captación se ha mantenido por debajo \nde lo autorizado en la Licencia Ambiental, lo cual ayuda a mantener los niveles \ndel acuífero impidiendo su abatimiento. Por tanto, el ESA, considera que el \n\nResolución No. 000197       Del 12 FEB. 2024          Hoja No. 11 de 18\n“Por la cual se resuelve un recurso de reposición”\nPágina 11 de 18\nproyecto no requiere un monitoreo mensual, dado que no cuenta con una \noperación constante, además que los niveles de captación no alcanzan o \nsuperan lo autorizado y conforme al monitoreo del periodo enero y agosto de \n2022 ( antes y después de la perforación del pozo Catalina-2), donde se encontró \npara los dos monitoreos que la presencia de Hidrocarburos en la mayoría de los \npiezómetros es baja o nula, dado que obtuvieron un valor menor al límite de \ncuantificación del método analítico de tal forma que se evidencia una baja o nula \ncontaminación en los acuíferos asociado a las actividades ejecutadas por el \nproyecto.\nAsí mismo, respecto a los metales analizados obtuvieron un valor menor al límite \nde cuantificación del método analítico de tal forma que se evidencia una baja o \nnula presencia de estos.\nAdicionalmente, en términos generales no se identificó una variación de los \nvalores obtenidos posterior a la perforación en comparación con las \nconcentraciones previas a la perforación., Adicionalmente, el ESA considera que \nal realizase una prueba de bombeo mensual, la sociedad estaría haciendo uso \ndel recurso sin posibilidad de usarlo en algún proceso del Campo, generado un \nmayor impacto.\nEn ese mismo sentido, se precisa que, dado que estas pruebas son necesarias \npara determinar las causas de perdida de eficiencia de un pozo, a causa de la \ncorrosión e incrustación, lo cual se ve reflejado en las características hidráulicas; \nél ESA considera apropiado que la Sociedad implemente el monitoreo de aguas \nsubterráneas anualmente, toda vez que esto permite verificar dichas condiciones \ny el estado del mismo conforme a los periodos anteriores.\nPor tanto, el ESA considera acertado lo señalado por la Sociedad por lo cual se \naccede a la modificación de la periodicidad señalada en el subnumeral 9.2.(…)”\nCONSIDERACIONES JURÍDICAS DE LA AUTORIDAD NACIONAL RESPECTO \nDE LOS INDICADORES RECURRIDOS. \nEn virtud de los principios orientadores consagrados en el Artículo 209 de la Carta \nPolítica, en concordancia con lo establecido en el artículo tercero del Código de \nProcedimiento Administrativo y de lo Contencioso Administrativo, que establece los \nprincipios orientadores de las actuaciones administrativas, especialmente, en los \nprincipios de responsabilidad, legalidad, coordinación, eficacia y celeridad, a saber:\n“Artículo 3°. Principios. Todas las autoridades deberán interpretar y aplicar las \ndisposiciones que regulan las actuaciones y procedimientos administrativos a la \nluz de los principios consagrados en la Constitución Política, en la Parte Primera \nde este Código y en las leyes especiales. Las actuaciones administrativas se \ndesarrollarán, especialmente, con arreglo a los principios del debido proceso, \n\nResolución No. 000197       Del 12 FEB. 2024          Hoja No. 12 de 18\n“Por la cual se resuelve un recurso de reposición”\nPágina 12 de 18\nigualdad, imparcialidad, buena fe, moralidad, participación, responsabilidad, \ntransparencia, publicidad, coordinación, eficacia, economía y celeridad.\n(…)\n7. En virtud del principio de responsabilidad, las autoridades y sus agentes \nasumirán las consecuencias por sus decisiones, omisiones o extralimitación de \nfunciones, de acuerdo con la Constitución, las leyes y los reglamentos.\n(…)\n10. En virtud del principio de coordinación, las autoridades concertarán sus \nactividades con las de otras instancias estatales en el cumplimiento de sus \ncometidos y en el reconocimiento de sus derechos a los particulares.\n (…)\n11. En virtud del principio de eficacia, las autoridades buscarán que los \nprocedimientos logren su finalidad y, para el efecto, removerán de oficio los \nobstáculos puramente formales, evitarán decisiones inhibitorias, dilaciones o \nretardos y sanearán, de acuerdo con este Código las irregularidades \nprocedimentales que se presenten, en procura de la efectividad del derecho \nmaterial objeto de la actuación administrativa. \n(…)\n13. En virtud del principio de celeridad, las autoridades impulsarán oficiosamente \nlos procedimientos, e incentivarán el uso de las tecnologías de la información y \nlas comunicaciones, a efectos de que los procedimientos se adelanten con \ndiligencia, dentro de los términos legales y sin dilaciones injustificadas.”\nAhora bien, esta Autoridad en sus actuaciones administrativas debe cumplir con los \nprincipios orientadores antes mencionados toda vez que dichas actuaciones son la \nmanifestación de la voluntad de la administración, sus efectos se traducen en crear, \nmodificar o extinguir derechos u obligaciones de carácter particular, personal y \nconcreto, con el fin de establecer una obligación tendiente a crear situaciones \nespecíficas, teniendo como presupuesto la sujeción al orden público y el respeto por \nlas garantías y derechos de los administrados.\nEs preciso señalar en el presente caso, la importancia que el principio fundamental \nal debido proceso reviste para asegurar también el cumplimiento de otros \npostulados fundamentales y de derechos de consagración constitucional y legal, \ncomo el derecho colectivo al ambiente sano, responsabilidad de autoridades y \nparticulares.\n\nResolución No. 000197       Del 12 FEB. 2024          Hoja No. 13 de 18\n“Por la cual se resuelve un recurso de reposición”\nPágina 13 de 18\nLa Corte Constitucional ha establecido que el derecho al debido proceso tiene unas \ngarantías previas y unas garantías posteriores, así:\n“La jurisprudencia constitucional ha diferenciado entre las garantías previas y \nposteriores que implica el derecho al debido proceso en materia administrativa. \nLas garantías mínimas previas se relacionan con aquellas garantías mínimas \nque necesariamente deben cobijar la expedición y ejecución de cualquier acto o \nprocedimiento administrativo, tales como el acceso libre y en condiciones de \nigualdad a la justicia, el juez natural, el derecho de defensa, la razonabilidad de \nlos plazos y la imparcialidad, autonomía e independencia de los jueces, entre \notras.\nDe otro lado, las garantías mínimas posteriores se refieren a la posibilidad de \ncuestionar la validez jurídica de una decisión administrativa, mediante los recursos \nde la vía gubernativa y la jurisdicción contenciosa administrativa.”\nEn ese sentido, esta Autoridad respetó las garantías previas, ya que cumplió con \ntodas las formalidades para emitir la Resolución 464 de 8 de marzo de 2023, por \nmedio de la cual se realizó ajuste vía seguimiento incorporando medidas de manejo \nal Plan de Manejo Ambiental, en el marco del control y seguimiento ambiental que \nse realiza al Proyecto “Bloque de Perforación Exploratoria Buturama y Campo \nCatalina”, localizado en jurisdicción de los municipios de Aguachica y Gamarra, \ndepartamento de Cesar. Asimismo, respetó las garantías posteriores, puesto que \nse concedió el respectivo recurso de reposición sobre el acto administrativo.\nCon base en las consideraciones técnicas descritas en el Concepto Técnico 6300 \ndel 28 de septiembre de 2023 y teniendo en cuenta que esta Autoridad Ambiental \nconsideró lo expuesto por la sociedad recurrente, encuentra razón toda vez, que en \nla visita de seguimiento ambiental el Equipo de Seguimiento Ambiental verificó que \nla sociedad LAGOSUR PETROLEUM COLOMBIA INC. SUCURSAL COLOMBIA, \nsuspendió las labores en el Campo Catalina. Así mismo se evidencio que \nactualmente, no realiza captación de agua del pozo profundo autorizado mediante \nla Resolución 690 del 26 de julio de 2001, mediante la cual se otorgó en la licencia \nambiental al proyecto y, por lo tanto, no genera un impacto sobre el recurso hídrico. \nLo anterior, teniendo en cuenta que no hay un abatimiento del acuífero, por tanto, \nno habría lugar a las mediciones mensuales establecidas, dado que los datos que \nse obtendrían de una prueba de bombeo sin operación en el Campo, no estarían \nasociados a las actividades del proyecto y no tendrán una variación mes a mes.\nAdicional a lo anterior, se verificó que de acuerdo con los reportes de captación \npresentados en los ICA 19 del periodo 2022 evaluados en el Concepto Técnico de \nSeguimiento 3942 del 4 de julio de 2023, el nivel de captación se ha mantenido por \ndebajo de lo autorizado en la Licencia Ambiental, por tanto, esta Autoridad Nacional, \nconsidera que, la medida adoptada no es proporcional con el uso que actualmente \n\nResolución No. 000197       Del 12 FEB. 2024          Hoja No. 14 de 18\n“Por la cual se resuelve un recurso de reposición”\nPágina 14 de 18\nle está dando la sociedad al recurso hídrico, dado que no cuenta con una operación \nconstante.\nConforme lo anterior, frente a la solicitud de modificación de la periodicidad de las \nmediciones de nivel estático y dinámico del pozo, establecida en el subnumeral 9.2 \ndel numeral 9 del artículo sexto de la Resolución 464 de 8 de marzo de 2023, es el \ncaso señalar que efectivamente se procederá a realizar el ajuste en el sentido de \nestablecer que dichas mediciones deberán realizarse en periodos de un año y \ncuando el proyecto esté en operación y/o perforación; y en ese sentido se \ndeberá ajustar la ficha Plan de Seguimiento y Monitoreo de Aguas Subterráneas \npresentada mediante radicado 2022177546-1- 000 de 18 de agosto de 2022, de \nacuerdo con lo expresado en el Concepto Técnico 6300 del 28 de septiembre de \n2023.\nLo anterior permite afirmar que esta Autoridad, no solo respeta los preceptos \nconstitucionales y legales a que se haya sujeta, sino que garantiza que sus \ndecisiones se adoptan acorde con las competencias, funciones y facultades \notorgadas por el ordenamiento jurídico, en procura de una protección más efectiva \nde los recursos naturales. De manera que las actividades de seguimiento relativas \na los proyectos que le corresponde conocer se realizan bajo unos criterios \npreviamente definidos y de público conocimiento, con lo cual brinda a estos, \ncondiciones de igualdad y seguridad jurídica.\nEs notorio entonces que el actuar de la administración, en cabeza de esta Autoridad \nNacional, ha sido legal y técnicamente fundamentado y que todas sus actuaciones \nhan sido emitidas bajo criterios de proporcionalidad y razonabilidad a partir de la \njuiciosa aplicación del ordenamiento jurídico y de recomendaciones técnicas \nplenamente conocidas por la empresa titular de la Licencia Ambiental.\nDe acuerdo con las consideraciones de orden técnico y jurídico anteriormente \ndescritas, esta Autoridad considera procedente reponer en el sentido de modificar \nel numeral 9.2 del artículo sexto de la Resolución 464 de 08 de marzo de 2023, tal \ncomo se describirá en la parte resolutiva del presente acto administrativo.\nPara culminar, el presente pronunciamiento se emite con verificación de los \nprincipios de la función administrativa, consagrados en el artículo 209 de la \nConstitución Política de Colombia, desarrollados, entre otras, por la Ley 1437 de \n2011, así como los principios de la política ambiental previstos en la Ley 99 de 1993 \ny sus reglamentos, y en aplicación de la garantía del derecho de defensa y \ncontradicción que le asiste al administrado – en este caso a la sociedad  LAGOSUR \nPETROLEUM COLOMBIA INC. SUCURSAL COLOMBIA, conforme al artículo 29 \nde la Carta Política Nacional; por lo tanto, contra el presente acto administrativo no \nprocede  el recurso de reposición.\nEn mérito de lo antes expuesto,\n\nResolución No. 000197       Del 12 FEB. 2024          Hoja No. 15 de 18\n“Por la cual se resuelve un recurso de reposición”\nPágina 15 de 18\nRESUELVE:\nARTÍCULO PRIMERO. Reponer en el sentido de modificar el subnumeral 9.2 del \nnumeral 9 del artículo sexto de la Resolución 464 de 8 de marzo de 2023, de \nacuerdo con las consideraciones expuestas en el presente acto administrativo, el \ncual quedará así:\nARTÍCULO SEXTO. Requerir a la sociedad LAGOSUR PETROLEUM \nCOLOMBIA INC SUCURSAL COLOMBIA, para que en un término de tres (3) \nmeses contados a partir de la ejecutoria del presente acto administrativo o en el \nplazo que se establezca en cada obligación, dé cumplimiento a las siguientes \nobligaciones y allegue los correspondientes soportes en donde se evidencie la \nobservancia a las mismas:\n(…)\n9. En cuanto a la ficha Plan de Seguimiento y Monitoreo de Agua Subterráneas, \nincluir lo siguiente:\n(…)\n9.2. Realizar una vez al año y cuando el proyecto esté en operación y/o \nperforación, mediciones del nivel estático y dinámico del pozo, así como la \nmedición de parámetros in situ (pH, temperatura, conductividad eléctrica, \noxígeno disuelto y sólidos disueltos totales), y presentar en los respectivos \nInformes de Cumplimiento Ambiental - ICA:\na) Base de datos con la información solicitada de manera acumulada, en hoja \nde cálculo, analizando la tendencia y comportamiento de los niveles y variables \nquímicas in situ solicitadas.\nb) Registros de campo de la toma de datos, para el periodo reportado.\nc) Certificados de calibración del(los) equipo(s) de medición vigentes de \ncalibración según la periodicidad que establezca el fabricante del equipo.\nARTÍCULO SEGUNDO. Los demás términos, condiciones y obligaciones \nestablecidas en la Resolución 464 del 08 de marzo de 2023, que no fueron objeto \nde recurso y/o aclaración en este acto administrativo, continúan plenamente \nvigentes y son de obligatorio cumplimiento para la sociedad LAGOSUR \nPETROLEUM COLOMBIA INC SUCURSAL COLOMBIA.\nARTÍCULO TERCERO. Por la Autoridad Nacional de Licencias Ambientales - \nANLA, notificar el presente acto administrativo al representante legal, o al \n\nResolución No. 000197       Del 12 FEB. 2024          Hoja No. 16 de 18\n“Por la cual se resuelve un recurso de reposición”\nPágina 16 de 18\napoderado debidamente constituido o a la persona debidamente autorizada de la \nSociedad LAGOSUR PETROLEUM COLOMBIA INC SUCURSAL COLOMBIA con \nNIT 900695425 de forma electrónica.\nPARÁGRAFO PRIMERO. Para la notificación electrónica se tendrá en cuenta lo \nprevisto en el artículo 56 de la Ley 1437 de 2011, modificado por el artículo 56 de la \nLey 2080 de 2021. En el evento en que la notificación no pueda hacerse de forma \nelectrónica, se seguirá el procedimiento previsto en los artículos 67 y siguientes de \nla Ley 1437 de 2011.\nPARÁGRAFO SEGUNDO. En el evento en que el titular de la licencia ambiental \nsea admitido a proceso de disolución o régimen de insolvencia empresarial o \nliquidación, regulados por las normas vigentes, informará inmediatamente de esta \nsituación a esta Autoridad, con fundamento, entre otros, en los artículos 8, 58, 79, \n80, 81, 95 Numeral 8 de la Constitución Política de 1991, en la Ley 43 de 1990, en \nla Ley 222 de 1995, en la Ley 1333 de 2009 y demás normas vigentes al y \njurisprudencia aplicable. Adicional a la obligación de informar a esta Autoridad de \ntal situación, el titular de la licencia o permiso aprovisionará contablemente las \nobligaciones contingentes que se deriven de la existencia de un procedimiento \nambiental sancionatorio conforme con el artículo 40 de la ley 1333 de 2009 o la \nnorma que la adicione, modifique o derogue.\nARTÍCULO CUARTO. Comunicar el presente acto administrativo a la Corporación \nAutónoma Regional del Cesar – CORPOCESAR-, a la Procuraduría delegada para \nAsuntos Ambientales y Agrarios, a la Gobernación del Departamento del Cesar, y a \nlas Alcaldías Municipales de Aguachica y Gamarra en el departamento de Antioquia.\nARTÍCULO QUINTO. Por la Autoridad Nacional de Licencias Ambientales – ANLA, \npublicar el presente acto administrativo en la Gaceta Ambiental de la Entidad.\nARTÍCULO SEXTO. Contra el presente acto administrativo no procede recurso \nalguno, de conformidad con lo establecido en el artículo 87 del Código de \nProcedimiento Administrativo y de lo Contencioso Administrativo.\nNOTIFÍQUESE, COMUNÍQUESE, PUBLÍQUESE Y CÚMPLASE\nDado en Bogotá D.C., a los 12 FEB. 2024\n\nResolución No. 000197       Del 12 FEB. 2024          Hoja No. 17 de 18\n“Por la cual se resuelve un recurso de reposición”\nPágina 17 de 18\nRODRIGO ELIAS NEGRETE MONTES\nDIRECTOR GENERAL\nCRYSTIAN MAURICIO BECERRA LEON\nCONTRATISTA\nOSCAR MAURICIO JARAMILLO RODRIGUEZ\nASESOR\nSTEPHANIE CASAS FARFAN\nCONTRATISTA\nSANDRA PATRICIA BEJARANO RINCON\nCONTRATISTA\nNATALIA ANDREA BARAJAS MUNOZ\nCONTRATISTA\nGERMAN BARRETO ARCINIEGAS\nSUBDIRECTOR DE SEGUIMIENTO DE LICENCIAS AMBIENTALES\nExpediente No. EXPEDIENTE LAM1277\nConcepto Técnico N° 6300 de 28 de septiembre de 2023  \nFecha: Octubre de 2023\nProceso No.: 20241000001974\nNota: Este es un documento electrónico generado desde los Sistemas de Información de la ANLA. El original reposa en los \narchivos digitales de la Entidad\n\nResolución No. 000197       Del 12 FEB. 2024          Hoja No. 18 de 18\n“Por la cual se resuelve un recurso de reposición”\nPágina 18 de 18\n"
}