{
  "fuente": "ANLA_GACETA",
  "numero_resolución": "RESOLUCIÓN N° 000220",
  "fecha_resolución": "1993-12-22",
  "anio_resolucion": "1993",
  "nombre_proyecto": "Desarrollo",
  "nombre_proyecto_normalizado": "DESARROLLO",
  "ubicación": null,
  "empresa": "ECOPETROL S.A.",
  "empresa_normalizada": "ECOPETROL",
  "numero_expediente": "LAM2307",
  "radicados": [
    "2021216768",
    "20236200172452",
    "2017057866",
    "2022108696",
    "2021035229"
  ],
  "descripcion": "POR LA CUAL SE RESUELVE UN RECURSO DE REPOSICIÓN",
  "tipos_infraccion": [
    "Manejo de aguas",
    "Tala o afectación de bosques",
    "Incumplimiento del PMA"
  ],
  "tipos_infraccion_normalizados": [
    "MANEJO DE AGUAS",
    "TALA O AFECTACION DE BOSQUES",
    "INCUMPLIMIENTO DEL PMA"
  ],
  "pdf_id": "45479",
  "file_name": "ANLA_45479.pdf",
  "texto_completo": "República de Colombia\nMinisterio de Ambiente y Desarrollo Sostenible\nAUTORIDAD NACIONAL DE LICENCIAS \nAMBIENTALES\n- ANLA –\nRESOLUCIÓN N° 000220\n(14 FEB. 2024)\nPágina 1 de 40\n“POR LA CUAL SE RESUELVE UN RECURSO DE REPOSICIÓN”\nEL ASESOR DEL DESPACHO DEL DIRECTOR DE LA AUTORIDAD NACIONAL DE \nLICENCIAS AMBIENTALES – ANLA\nEn ejercicio de las facultades legales establecidas mediante la Ley 99 del 22 de diciembre \nde 1993, el Decreto Ley 3573 del 27 de septiembre de 2011, modificado por el Decreto \n376 del 11 de marzo de 2020, por el cual se modifica la estructura de la Autoridad \nNacional de Licencias Ambientales y acorde con lo regulado en el Decreto 1076 del 26 de \nmayo de 2015, la Resolución 669 del 14 de abril de 2020, la Resolución 1957 del 5 de \nnoviembre de 2021 y la Resolución 2795 del 25 de noviembre de 2022, expedidas por la \nAutoridad Nacional de Licencias Ambientales, y\nCONSIDERANDO\nQue mediante Resolución 3 del 7 de enero de 2003, el entonces Ministerio de Medio \nAmbiente, hoy Ministerio de Ambiente y Desarrollo Sostenible, en adelante el Ministerio, \nestableció medidas ambientales a la Sociedad Ecopetrol S.A., para el proyecto “Desarrollo \nde los campos Brisas, Dina Terciarios Pijao, Cebú, Palo grande, Dina Cretáceos, Tenay y \nSanta Clara”, igualmente denominado \"Campos Huila Norte\", ubicado en jurisdicción de los \nmunicipios de Aipe, Neiva, Palermo, Tello y Villa Vieja del departamento del Huila. \nQue por medio de la Resolución 1008 del 22 de septiembre de 2003, el Ministerio resolvió \nel recurso de reposición interpuesto contra de la Resolución 3 del 7 de enero de 2003, en \nel sentido de modificar el artículo 30 de la Resolución 3 del 7 de enero de 2003, \nestableciendo que la Sociedad debe continuar con la recuperación de los sitios afectados \nen todos los campos que integran el proyecto “Campos Huila Norte”. \nQue a través de la Resolución 455 del 15 de mayo de 2013, la Autoridad Nacional de \nLicencias Ambientales - ANLA, en adelante la Autoridad Nacional, modificó el artículo \nprimero de la Resolución 3 del 7 de enero de 2003, en el sentido de adicionar actividades \ne infraestructura para desarrollar dentro del proyecto “Desarrollo de los campos Brisas, Dina \nTerciarios Pijao, Cebú, Palo grande, Dina Cretáceos, Tenay y Santa Clara”, igualmente \ndenominado \"Campos Huila Norte\", entre otras.\nQue mediante la Resolución 1410 del 11 de agosto de 2021, la Autoridad Nacional aprobó \nel plan de compensación del componente biótico presentado por la Sociedad. \nAdicionalmente se aprobó la implementación de Buenas Prácticas Agrícolas (BPA) en la \n\nResolución No. 000220       Del 14 FEB. 2024          Hoja No. 2 de 40\n“POR LA CUAL SE RESUELVE UN RECURSO DE REPOSICIÓN”\nPágina 2 de 40\nrecolección de frutos maduros y sobremaduros e hizo requerimientos en el marco del plan \nde monitoreo y seguimiento a la compensación. \nQue por medio de la Resolución 1673 del  22 de septiembre de 2021, la Autoridad Nacional \nmodificó el artículo quinto de la Resolución 455 del 15 de mayo de 2013, en el sentido de \nincluir la estandarización de los parámetros y frecuencias de monitoreo de agua \nsubterráneas en los pozos “DT 5”, “Palo Grande”, “Santa Clara”, “Dina” y “DK-5”, y aquellos \npuntos adicionales de los cuales la sociedad realice uso y aprovechamiento de dicho \nrecurso o sean monitoreados en el marco del programa de seguimiento y monitoreo \nimplementado. \nQue a través de la Resolución 852 del 29 de abril de 2022, la Autoridad Nacional modificó \nla tabla denominada “Georreferenciación de los piezómetros para el monitoreo regional de \nla ANLA presentes en el AID del proyecto” de la página 11 de la Resolución 1673 del 22 de \nseptiembre de 2021, en atención al recurso de reposición interpuesto por la sociedad \nECOPETROL S.A. por medio de la comunicación con radicado ANLA 2021216768-1-000 \ndel 06 de octubre de 2021.\nQue mediante Resolución 2606 del 10 de noviembre de 2023, la Autoridad Nacional no \naceptó el plan de compensación por cambio de uso del suelo y afectación al medio biótico \npor los Clúster 1, 2, 3 y 4 del campo Dina Cretáceos, correspondiente al establecimiento de \nsistemas agroforestales en un área equivalente a 3,814 ha. Acto administrativo notificado \npor correo electrónico el 10 de noviembre de 2023.\nQue por medio de la comunicación con radicación 20236200913022 del 27 de noviembre \nde 2023, la Sociedad interpuso Recurso de Reposición en contra de la Resolución 2606 del \n10 de noviembre de 2023; argumentos que fueron evaluados por el equipo técnico de la \nAutoridad Nacional y en consecuencia expidió el Concepto técnico 131 del 18 de enero de \n2024.\nQue a través de la Resolución 2816 del 4 de diciembre de 2023, la Autoridad Nacional \nmodificó el artículo quinto de la Resolución 455 del 15 de mayo de 2013, en el sentido de \nincluir la estandarización de los parámetros y frecuencias de monitoreo de agua \nsubterránea en algunos puntos, además de aquellos puntos adicionales de los cuales la \nsociedad realice uso y aprovechamiento de dicho recurso o sean monitoreados en el marco \ndel programa de seguimiento y monitoreo de agua subterránea.\nCOMPETENCIA DE LA AUTORIDAD NACIONAL \nEl Gobierno Nacional, mediante Decreto Ley 3573 del 27 de septiembre de 2011, creó la \nAutoridad Nacional de Licencias Ambientales – ANLA, como una entidad con autonomía \nadministrativa y financiera, sin personería jurídica, la cual hace parte del Sector \nAdministrativo de Ambiente y Desarrollo Sostenible, en los términos del artículo 67 de la \nLey 489 de 1998.\nEl numeral 1° del artículo tercero del mencionado decreto estableció dentro de las funciones \nde la Autoridad Nacional, la de otorgar o negar las licencias, permisos y trámites \nambientales de competencia del Ministerio, de conformidad con la ley y los reglamentos.\n\nResolución No. 000220       Del 14 FEB. 2024          Hoja No. 3 de 40\n“POR LA CUAL SE RESUELVE UN RECURSO DE REPOSICIÓN”\nPágina 3 de 40\nMediante el Decreto 376 del 11 de marzo de 2020, se modificó la estructura de la Autoridad \nNacional de Licencias Ambientales.\nMediante la Resolución 669 del 14 de abril de 2020, se nombró como servidor público a \nEDILBERTO PEÑARANDA CORREA, identificado con cédula de ciudadanía 4.052.851, en \nel empleo de libre nombramiento y remoción de Asesor, código 1020, grado 15, adscrito a \nla Dirección General de la planta global de la ANLA.\nEl 5 de noviembre de 2021, la Autoridad Nacional emitió la Resolución 1957 “Por la cual se \nadopta el Manual Específico de Funciones y de Competencias Laborales para los empleos \nde la planta de personal de la Autoridad Nacional de Licencias Ambientales - ANLA”, en \ndonde se establece que corresponde al Despacho del Director General de la Autoridad \nNacional de Licencias Ambientales - ANLA, “Suscribir los actos administrativos que otorgan, \nniegan, modifican, ajustan o declaran la terminación de las licencias, permisos y trámites \nambientales”.\nEn ejercicio de las facultades conferidas por la Ley 489 de 1998, se expidió la Resolución \n2795 del 25 de noviembre de 2022 “Por la cual se delegan unas funciones y se dictan otras \ndisposiciones”, en su artículo primero, numeral 15° delegó en el Asesor Código 1020 Grado \n15 del Despacho del Director General, la función de “Resolver los recursos de reposición \ninterpuestos contra los actos administrativos que se emiten en cumplimiento de las \nfunciones anteriores.”\nTeniendo en cuenta lo anterior, es el Asesor del Despacho del Director General de la \nAutoridad Nacional el competente para pronunciarse sobre el recurso de reposición \ninterpuesto por la Sociedad en contra de la Resolución 2606 del 10 de noviembre de 2023.\nFUNDAMENTOS JURÍDICOS\nEl procedimiento para la presentación y resolución de recursos contra los actos \nadministrativos se encuentra reglado en el Código de Procedimiento Administrativo y de lo \nContencioso Administrativo artículos 74 y siguientes, que particularmente respecto del \nrecurso de reposición al tenor literal expresan:\n“(…) \nArtículo 74. Recursos contra los actos administrativos.\n Por regla general, contra los actos definitivos procederán los siguientes recursos: \n1.\nEl de reposición, ante quien expidió la decisión para que la aclare, modifique, adicione o \nrevoque \n(…)”\nA su vez, los artículos 76 y 77 del Código enunciado preceptúan: \n“Artículo 76. Oportunidad y presentación.\nLos recursos de reposición y apelación deberán interponerse por escrito en la diligencia de \nnotificación personal, o dentro de los diez (10) días siguientes a ella, o a la notificación por aviso, o \n\nResolución No. 000220       Del 14 FEB. 2024          Hoja No. 4 de 40\n“POR LA CUAL SE RESUELVE UN RECURSO DE REPOSICIÓN”\nPágina 4 de 40\nal vencimiento del término de publicación, según el caso. Los recursos contra los actos presuntos \npodrán interponerse en cualquier tiempo, salvo en el evento en que se haya acudido ante el juez. \nLos recursos se presentarán ante el funcionario que dictó la decisión, salvo lo dispuesto para el de \nqueja, y si quien fuere competente no quisiere recibirlos podrán presentarse ante el procurador \nregional o ante el personero municipal, para que ordene recibirlos y tramitarlos, e imponga las \nsanciones correspondientes, si a ello hubiere lugar. \nEl recurso de apelación podrá interponerse directamente, o como subsidiario del de reposición y \ncuando proceda será obligatorio para acceder a la jurisdicción. \nLos recursos de reposición y de queja no serán obligatorios. \nArtículo 77. Requisitos.\nPor regla general los recursos se interpondrán por escrito que no requiere de presentación personal \nsi quien lo presenta ha sido reconocido en la actuación. Igualmente, podrán presentarse por medios \nelectrónicos. \nLos recursos deberán reunir, además, los siguientes requisitos: \n1. Interponerse dentro del plazo legal, por el interesado o su representante o apoderado debidamente \nconstituido. \n2. Sustentarse con expresión concreta de los motivos de inconformidad.\n3. Solicitar y aportar las pruebas que se pretende hacer valer. \n4. Indicar el nombre y la dirección del recurrente, así como la dirección electrónica si desea ser \nnotificado por este medio. \nSólo los abogados en ejercicio podrán ser apoderados (…)\nA su vez, el artículo 80 del citado Código, establece el alcance del contenido de la decisión que \nresuelve el recurso:\n“Artículo 80. Decisión de los recursos. -Vencido el período probatorio, si a ello hubiere lugar, y sin \nnecesidad de acto que así lo declare, deberá proferirse la decisión motivada que resuelva el recurso. \nLa decisión resolverá todas las peticiones que hayan sido oportunamente planteadas y las que surjan \ncon motivo del recurso.\n(…)”\nCONSIDERACIONES DE LA AUTORIDAD NACIONAL FRENTE AL RECURSO DE \nREPOSICIÓN INTERPUESTO POR LA SOCIEDAD. \nDesde el punto de vista procedimental, se observa que el recurso de reposición interpuesto \npor la sociedad ECOPETROL S.A. en contra de la Resolución 2606 del 10 de noviembre \nde 2023, cumple con los requisitos establecidos en el artículo 77 y concordantes del Código \nde Procedimiento Administrativo y de lo Contencioso Administrativo, en cuanto a lo \nsiguiente: \n\nResolución No. 000220       Del 14 FEB. 2024          Hoja No. 5 de 40\n“POR LA CUAL SE RESUELVE UN RECURSO DE REPOSICIÓN”\nPágina 5 de 40\n1.\nInterponerse dentro del plazo legal, por el interesado o su representante o \napoderado debidamente constituido.\nSe encuentra acreditado que el día 10 de noviembre de 2023, la Sociedad fue debidamente \nnotificada por correo electrónico de la Resolución 2606 del 10 de noviembre de 2023; frente \na la cual interpuso recurso de reposición por intermedio de su representante legal el día 27 \nde noviembre del 2023 y radicado en la Autoridad Nacional bajo el número \n20236200913022 esto es, dentro de los diez (10) días siguientes a la notificación, de \nconformidad con lo preceptuado en el artículo 76 de la Ley 1437 de 2011.\n2.\nSustentarse con expresión concreta de los motivos de inconformidad. \nLa Sociedad presentó los argumentos en contra de las disposiciones recurridas de la \nResolución 2606 del 10 de noviembre de 2023, los cuales serán tenidos en cuenta para \ndecidir el presente recurso de reposición.\n3.\nSolicitar y aportar las pruebas que se pretende hacer valer.\nEn el recurso de reposición la Sociedad no solicitó, ni aportó pruebas de ninguna índole.\n4.\nIndicar el nombre y la dirección del recurrente, así como la dirección electrónica si \ndesea ser notificado por este medio.\nLa sociedad manifestó que, para efectos de la notificación dentro del presente expediente, \nque “(…) Estaremos atentos a brindar la información adicional que se considere necesaria, la cual \npuede ser solicitada a la Gerencia Jurídica de Entorno de ECOPETROL S.A., al correo electrónico \nnotificacionesjudicialesecopetrol@ecopetrol.com.co (…)”\nCon base en lo anterior, verificado el cumplimiento de los requisitos establecidos en el \nCódigo de Procedimiento Administrativo y de lo Contencioso Administrativo -CPACA-, \nrespecto a la procedencia del señalado recurso de reposición, la Autoridad Nacional \nprocederá a resolverlo, teniendo en cuenta las consideraciones realizadas en el Concepto \nTécnico 131 del 18 de enero de 2024; en el mismo orden de los argumentos presentados \npor la sociedad, a saber:\n1.\nDISPOSICIÓN RECURRIDA –ARTÍCULO PRIMERO DE LA RESOLUCIÓN 2606 \nDEL 10 DE NOVIEMBRE DE 2023.\n“(…) ARTÍCULO PRIMERO. MODIFICAR el artículo primero de la Resolución 1410 del 11 de \nagosto de 2021, en mérito de lo expuesto en la parte motiva del presente acto administrativo, \nel cual quedará de la siguiente manera: \n“ARTÍCULO PRIMERO. Aprobar e implementar el Plan de Compensación por cambio de \nuso del suelo y afectación al medio biótico en los siguientes predios, los cuales deben \nadicionarse a los previamente aprobados:\nPredio\nMunicipio\nVereda\nÁrea (ha)\n1\nEl cují\nDindal Alto\n1\n2\nEl Refugio\nDindal Alto\n1\n3\nLote 1 (Luis Ignacio Charry)\nDindal Alto\n1\n4\nMirador\nAipe\nDindal Alto\n1\n\nResolución No. 000220       Del 14 FEB. 2024          Hoja No. 6 de 40\n“POR LA CUAL SE RESUELVE UN RECURSO DE REPOSICIÓN”\nPágina 6 de 40\nPredio\nMunicipio\nVereda\nÁrea (ha)\n5\nLote 1- La Ponderosa\nDindal Alto\n2\n6\nEl Limón\nDindal Alto\n2\n7\nLa Sombra\nDindal Alto\n2\n8\nLote 66\nHato Nuevo 2\n2\n9\nLote 4 Las Coloradas\nPolonia\n2\n10\nLa Pista B\nPolonia\n1\n11\nBuenos Aires\nPolonia\n1\n12\nBuenos Aires\nVillanueva\nPolonia\n2\nPARÁGRAFO PRIMERO. En los predios antes aprobados se deberá ejecutar la \ncompensación de acuerdo con lo establecido en la Resolución 1410 del 11 de agosto de 2021. \nPARÁGRAFO SEGUNDO. La sociedad ECOPETROL S.A., deberá ajustar la zona de \nintervención de los predios Lote 1 (Luis Ignacio Charry) y Buenos Aires para que no se incluya \nen la ronda de las quebradas y ríos que los colinda”. \n1.1\nPetición de la Sociedad.\n“(…) Aprobar la implementación del Plan de Compensación por cambio de uso del suelo y \nafectación al medio biótico en el predio La Esperanza, ubicado en la vereda Hato Nuevo, \nMunicipio de Villavieja, matrícula inmobiliaria No. 200-35763 de propiedad del señor Juan José \nMonje Valdés, conforme a las siguientes consideraciones”.\nCorregir el nombre del Municipio en el cual se ubican los predios Lote 66, Lote 4 Las \nColoradas, La Pista B y Buenos Aires, relacionado en la tabla de predios aprobados en el \nArtículo Primero de la resolución 2606 del 10 de noviembre de 2023, conforme a las siguientes \nconsideraciones.\n(…)”\n1.2\nArgumentos de la Sociedad.\n“(…) \n1.\nReposición en contra del ARTICULO PRIMERO: MODIFICAR el artículo primero de la \nResolución 1410 del 11 de agosto de 2021, en mérito de lo expuesto en la parte motiva del \npresente acto administrativo, el cual quedará de la siguiente manera: \n“ARTÍCULO PRIMERO. Aprobar e implementar el Plan de Compensación por cambio de uso \ndel suelo y afectación al medio biótico en los siguientes predios, los cuales deben adicionarse \na los previamente aprobados:\n(…) \nPetición: \nECOPETROL S.A., bajo sus fundamentos legales, solicita a esta Autoridad Aprobar la \nimplementación del Plan de Compensación por cambio de uso del suelo y afectación al medio biótico \nen el predio La Esperanza, ubicado en la vereda Hato Nuevo, Municipio de Villavieja, matrícula \ninmobiliaria No. 200-35763 de propiedad del señor Juan José Monje Valdés; conforme a las \nsiguientes consideraciones:\n\nResolución No. 000220       Del 14 FEB. 2024          Hoja No. 7 de 40\n“POR LA CUAL SE RESUELVE UN RECURSO DE REPOSICIÓN”\nPágina 7 de 40\nA.\nMediante comunicación con radicado ANLA 20236200172452 del 31 de mayo de 2023, \nEcopetrol remite Informe de Cumplimiento Ambiental No. 14 (Correspondiente al Periodo \n2022), en donde se anexa el primer Informe de Actividades Plan de Compensación por cambio \nde uso del Suelo y Afectación del Medio Biótico Campo de producción Huila Norte.\nEn dicho informe se presenta la Tabla 7. Desistimiento de la implementación del Plan de \ncompensación; en donde se relaciona el desistimiento en quince (15) predios así:\nTabla 7. Reuniones de resocialización y desistimiento Plan de Compensación\nDe igual forma, en la Tabla 8 del mismo informe, se relaciona “Una vez surtido el proceso de \nselección de nuevos participantes de acuerdo con los desistimientos, se presenta el \nconsolidado de los predios y participantes en los cuales se ejecutan las actividades del Plan \nde Compensación por cambio de uso del suelo y afectación del medio biótico”.\n\nResolución No. 000220       Del 14 FEB. 2024          Hoja No. 8 de 40\n“POR LA CUAL SE RESUELVE UN RECURSO DE REPOSICIÓN”\nPágina 8 de 40\nAsí mismo en el numeral 4.3. se relacionan las actividades de aislamiento y establecimiento \nen los predios.\nB.\nRevisada la información reportada en la Tabla 8 del Primer Informe de Actividades Plan de \nCompensación por cambio de uso del Suelo y Afectación del Medio Biótico Campo de \nProducción Huila Norte, los participantes aprobados por la Autoridad en el Artículo Primero de \nla Resolución 2606 de 2023, no relaciona y aprueba el Predio La Esperanza, ubicado en la \nvereda Hato Nuevo, Municipio de Villavieja, matrícula inmobiliaria No. 200-35763 de propiedad \ndel señor Juan José Monje Valdés, así:\n\nResolución No. 000220       Del 14 FEB. 2024          Hoja No. 9 de 40\n“POR LA CUAL SE RESUELVE UN RECURSO DE REPOSICIÓN”\nPágina 9 de 40\nDe igual forma, en el primer informe de avance del Plan de compensación (Aprobado en el \nAuto 1305 del 28 de marzo de 2018 y la Resolución 1410 del 11 de agosto de 2021), radicado \nen el ICA 14 (radicado ANLA 20236200172452 del 31 de marzo de 2023), se relacionan trece \n(13) predios nuevos con un total de veintiún (21) hectáreas a implementar en el Plan de \ncompensación, NO doce (12) predios nuevos con diecinueve (19) hectáreas, como lo relaciona \nla autoridad ambiental en el Concepto Técnico No 5682 de 2023 pagina 439 y Tabla 35, \nnumeral 5.8.1.2 (página 454).\nC.\nConclusión de la imprecisión: En la Tabla 33 “Predios para la implementación del Plan de \ncompensación aprobado por el Auto 1305 del 28 de marzo de 2018 y la Resolución 1410 del \n11 de agosto de 2021”, del Concepto Técnico No 5682 de 2023 (página 439) la autoridad \nrelaciona:\n\nResolución No. 000220       Del 14 FEB. 2024          Hoja No. 10 de 40\n“POR LA CUAL SE RESUELVE UN RECURSO DE REPOSICIÓN”\nPágina 10 de 40\ni.\nSeis (6) predios aprobados por la Resolución 1410 de 2021.\nLos predios que NO desistieron y manifestaron la continuidad en el establecimiento del Plan \nde Compensación corresponden a cinco (5).\nii.\nEl sexto predio que relaciona la autoridad como aprobado en la Resolución 1410 del 11 \nde agosto de 2021 es el siguiente:\nAsí las cosas, se evidencian los siguientes errores:\n•\nUbicación: Este predio se ubica en el Municipio de Villavieja, Vereda Hato Nuevo.\n•\nEste predio no fue aprobado por la Resolución 1410 del 11 de agosto de 2021, el predio \ndenominado La Esperanza aprobado por dicha resolución corresponde a la propiedad \nde Mily Yojana Blanco.\nLos dos (2) predios con el mismo nombre (La Esperanza) pudo generar el error de la Autoridad. \nEs de aclarar que el predio la Esperanza de propiedad de Mily Yojana Blanco, ubicado en la \nvereda Hato Nuevo, Municipio de Villavieja, no continuó como participante en la \nimplementación del Plan de compensación por cuanto como poseedora no logró concretar la \ncompra, motivo por el cual desistió. En lugar de este predio se presentó el predio El Triunfo \nubicado en la Vereda El Cucharo del Municipio de Tello de propiedad de Liliana Serrano, \nsituación informada a la Autoridad en la respuesta del Numeral 56 del Artículo Primero del \nAuto 05544 de 2021 el cual se adjuntó en el ICA No 13 radicado mediante comunicación \nANLA, 2022108696-1-000 del 31 de mayo de 2022.\nEl predio La Esperanza de propiedad de Juan José Monje Valdez ubicado en la Vereda Hato \nNuevo, Municipio de Villavieja, fue seleccionado una vez se presentaron los desistimientos \nrelacionados en la Tabla 7 del Primer Informe de Actividades Plan de Compensación por \nCambio de uso del Suelo y Afectación del Medio Biótico Campo de Producción Huila Norte, \nAnexo 12 del ICA No 14 radicado ANLA, 20236200172452 del 31 de mayo de 2023.\nFundamentos de la impugnación\nAl no aprobar la implementación del plan de compensación por cambio de uso del suelo y afectación \nal medio biótico en el predio La Esperanza, ubicado en la vereda Hato Nuevo, Municipio de Villavieja, \nmatrícula inmobiliaria No. 200-35763 de propiedad del señor Juan José Monje Valdés; se \ndesconocería:\n\nResolución No. 000220       Del 14 FEB. 2024          Hoja No. 11 de 40\n“POR LA CUAL SE RESUELVE UN RECURSO DE REPOSICIÓN”\nPágina 11 de 40\na)\nLa información relacionada en el primer Informe de Actividades Plan de Compensación por \ncambio de uso del Suelo y Afectación del Medio Biótico Campo de producción Huila Norte \nradicación en la ANLA, Mediante comunicación 20236200172452 del 31 de mayo de 2023, \nespecíficamente la información de la tabla 8 del mismo informe en donde se aclara que; \n“…Una vez surtido el proceso de selección de nuevos participantes de acuerdo con los \ndesistimientos, se presenta el consolidado de los predios y participantes en los cuales se \nejecutan las actividades del Plan de Compensación por cambio de uso del suelo y afectación \ndel medio biótico.”\nb)\nb) Que en el predio en comento ya se implementó el Plan de Compensación conforme a la \ninformación relacionada en el numeral 4.3. Implementación de Acuerdos de Conservación \ndel primer Informe de Actividades Plan de Compensación por cambio de uso del Suelo y \nAfectación del Medio Biótico Campo de producción Huila Norte.\nc)\nMáxime cuando se aprecian errores como los siguientes:\n•\nUbicación: Este predio se ubica en el Municipio de Villavieja, Vereda Hato Nuevo y no \nen la vereda Mesa Redonda.\n•\nEste predio no fue aprobado por la Resolución 1410 del 11 de agosto de 2021, el predio \ndenominado La Esperanza aprobado por dicha resolución corresponde a la propiedad \nde Mily Yojana Blanco.\n•\nDos (2) predios con el mismo nombre, pudo generar el error de la Autoridad. Es de \naclarar que el predio La Esperanza de propiedad de Mily Yojana Blanco, ubicado en la \nvereda Hato Nuevo, Municipio de Villavieja, no continuó como participante en la \nimplementación del Plan de compensación por cuanto como poseedora no logró \nconcretar la compra, motivo por el cual desistió. En lugar de este predio se presentó el \npredio El Triunfo ubicado en la Vereda El Cucharo del Municipio de Tello de propiedad \nde Liliana Serrano, situación informada a la Autoridad en la respuesta del Numeral 56 \ndel Artículo Primero del Auto 05544 de 2021 el cual se adjuntó en el ICA No 13 radicado \nmediante comunicación ANLA, 2022108696-1-000 del 31 de mayo de 2022.\n•\nEl predio La Esperanza de propiedad de Juan José Monje Valdez ubicado en la Vereda \nHato Nuevo, Municipio de Villavieja, fue seleccionado una vez se presentaron los \ndesistimientos relacionados en la Tabla 7 del Primer Informe de Actividades Plan de \nCompensación por Cambio de uso del Suelo y Afectación del Medio Biótico Campo de \nProducción Huila Norte, anexo al ICA No 14 radicado ANLA, 20236200172452 del 31 \nde mayo de 2023.”\n2.\nCorregir en la tabla relacionada en el Artículo Primero el nombre del Municipio en el cual se \nubican los predios Lote 66, Lote 4 Las Coloradas, La Pista B y Buenos Aires. \n(…) ARTICULO PRIMERO: MODIFICAR el artículo primero de la Resolución 1410 del 11 de agosto \nde 2021, en mérito de lo expuesto en la parte motiva del presente acto administrativo, el cual quedará \nde la siguiente manera: \n“ARTÍCULO PRIMERO. Aprobar e implementar el Plan de Compensación por cambio de uso del \nsuelo y afectación al medio biótico en los siguientes predios, los cuales deben adicionarse a los \npreviamente aprobados:\n(…)\n\nResolución No. 000220       Del 14 FEB. 2024          Hoja No. 12 de 40\n“POR LA CUAL SE RESUELVE UN RECURSO DE REPOSICIÓN”\nPágina 12 de 40\nPetición: \nECOPETROL S.A., bajo sus fundamentos legales, solicita a esta Autoridad corregir el nombre del \nMunicipio en el cual se ubican los predios Lote 66, Lote 4 Las Coloradas, La Pista B y Buenos Aires, \nrelacionado en la tabla de predios aprobados en el Artículo Primero de la resolución 2606 del 10 de \nnoviembre de 2023, conforme a las siguientes consideraciones:\nA.\nResolución 0455 del 15 de mayo de 2013 la cual resuelve:\nARTICULO PRIMERO: Modificar el artículo primero de la Resolución 0003 del 7 de enero \nde 2003, modificada a su vez por la Resolución 1008 del 22 de septiembre de 2003, en el \nsentido de adicionar las actividades e infraestructura a desarrollar dentro del proyecto de \ndesarrollo de los campos Brisas, Dina terciarios, Pijao, Cebú, Palogrande, Dina cretáceos, \nTenay y Santa Clara, localizado en jurisdicción de los municipio de Aipe, Neiva, Palermo, \nTello y Villavieja, departamento del Huila, igualmente denominado “Campos Huila Norte”, a \ncargo de la empresa ECOPETROL S.A.\nB.\nComunicación Radicado ANLA 2017057866-1-000 del 28 de julio de 2017:\nEcopetrol S.A en cumplimiento del Artículo Noveno de la Resolución 0455 de 2015, se remite la \npropuesta de compensación ajustada denominada “Plan de Compensación por Cambio de uso del \nSuelo y Afectación al medio Biótico” CAMPO HUILA NORTE, la cual corresponde a la \nimplementación de proyectos de uso sostenible (agroforestal de Cítricos, Plátano y árboles nativos \nen cercas vivas) a implementar en la vereda Hato Nuevo del municipio de Villavieja y Dindal en el \nmunicipio de Aipe, a fin que sea evaluada y aprobada por la autoridad ambiental; toda vez que \na la fecha de presentación se habían intervenido dos áreas del Campo Huila Norte.\nC.\nComunicación con radicación en la ANLA, 20236200172452 del 31 de mayo de 2023, \nECOPETROL S.A remite Informe de Cumplimiento Ambiental No 14 correspondiente al Periodo \n2022, en donde se anexa primer Informe de Actividades Plan de Compensación por cambio de uso \ndel Suelo y Afectación del Medio Biótico Campo de producción Huila Norte.\nEn dicho informe se presenta la Tabla 8. En la cual se informa; “…Una vez surtido el proceso de \nselección de nuevos participantes de acuerdo con los desistimientos, se presenta el consolidado de \nlos predios y participantes en los cuales se ejecutan las actividades del Plan de Compensación por \ncambio de uso del suelo y afectación del medio biótico.\n\nResolución No. 000220       Del 14 FEB. 2024          Hoja No. 13 de 40\n“POR LA CUAL SE RESUELVE UN RECURSO DE REPOSICIÓN”\nPágina 13 de 40\nFundamentos de la impugnación\nLa Autoridad en la tabla de predios aprobados en el Artículo Primero de la resolución 2606 del 10 de \nnoviembre de 2023 relaciona el municipio de Villanueva, presentándose un error. El nombre correcto \ndel municipio conforme a los actos administrativos y documentos relacionados en esta petición \ncorresponde al municipio de Villavieja.”\n1.3\nConsideraciones de la Autoridad Nacional.\nA través del Concepto Técnico 131 del 18 de enero de 2024, el equipo técnico de la \nAutoridad Nacional consideró:\n“(…) \n❖\nCon respecto a la solicitud de aprobar el predio La Esperanza ubicado en la vereda \nHato Nuevo, Municipio de Villavieja, matrícula inmobiliaria No. 200-35763\nEn atención a los argumentos que expresa la Sociedad ECOPETROL S.A, esta Autoridad verificó el \nanálisis desarrollado en el Concepto Técnico 5682 del 6 de septiembre de 2023 que acogió la \nResolución 2606 del 10 de noviembre de 2023 en el que se concretó el listado definitivo de predios \npara la implementación del plan de compensación por cambio de uso del suelo y afectación al medio \nbiótico, encontrando que hay una inconsistencia en el reconocimiento del predio La Esperanza de \npropiedad de Juan José Monje Valdez ubicado en la Vereda Hato Nuevo, Municipio de Villavieja.\nLo anterior dado que, en el informe de avance de las actividades de compensación presentado por \nla Sociedad en el anexo 12 del ICA No. 14 (comunicación con radicación 20236200172452 del 31 \nde mayo de 2023), que fue la base para el seguimiento que se realizó en el Concepto Técnico 5682 \nde 2023, la Sociedad relaciona en la Tabla 6 del mencionado informe, el listado de predios \naprobados por la Resolución 1410 del 11 de agosto de 2021, en la Tabla 7 del mismo, el listado de \npredios desistidos y en la Tabla 8 los “predios definitivos”, incluyendo nuevos predios adicionales a \nlos aprobados en la mencionada resolución. \nA continuación, se presenta captura de pantalla de las tres tablas presentadas en el informe de \navance de compensación y mencionadas en el documento del recurso de reposición por parte de la \nSociedad.\n\nResolución No. 000220       Del 14 FEB. 2024          Hoja No. 14 de 40\n“POR LA CUAL SE RESUELVE UN RECURSO DE REPOSICIÓN”\nPágina 14 de 40\nFigura 1. Captura de pantalla de la “Tabla 6” del informe de avance de compensación.\nFuente: Tomado del ICA No. 14 radicado ANLA 20236200172452 del 31 de mayo del 2023\n\nResolución No. 000220       Del 14 FEB. 2024          Hoja No. 15 de 40\n“POR LA CUAL SE RESUELVE UN RECURSO DE REPOSICIÓN”\nPágina 15 de 40\nFigura 2. Captura de pantalla de la “Tabla 7” del informe de avance de compensación.\nFuente: Tomado del ICA No. 14 radicado ANLA 20236200172452 del 31 de mayo del 2023\n\nResolución No. 000220       Del 14 FEB. 2024          Hoja No. 16 de 40\n“POR LA CUAL SE RESUELVE UN RECURSO DE REPOSICIÓN”\nPágina 16 de 40\nFigura 3. Captura de pantalla de la “Tabla 8” del informe de avance de compensación.\nFuente: Tomado del ICA No. 14 radicado ANLA 20236200172452 del 31 de mayo del 2023\nDe estos listados, el predio La Esperanza, ubicado en el municipio de Villavieja de 1 hectárea \npropiedad de Mily Yojana Blanco, está integrado en la fila No. 20, de la Tabla 6 del informe de avance \nde las actividades de compensación presentado en el ICA No. 14, es decir, en el grupo de predios \naprobados mediante Resolución 1410 del 11 de agosto de 2021 que se ubican en el municipio de \nVillavieja; ahora bien, este mismo predio no se relaciona en el listado de la Tabla 7 del mismo \ndocumento (predios desistidos), por lo cual la Autoridad Nacional entendió que el mismo continuaba \nvigente más aún cuando en la fila No. 13 de la Tabla 8 (Participantes implementación del Plan de \nCompensación) en la cual se presentan los predios definitivos incluyendo los nuevos predios, se \nrelaciona también un predio con el mismo nombre en el mismo municipio de Villavieja; en ese orden \nde ideas, la información que presentó la Sociedad dio a entender que el predio del listado definitivo \ncorrespondía al previamente aprobado.\nEsta idea se fortaleció al encontrar que en el anexo cartográfico GDB anexa al ICA No. 14 y en el \ninforme de avance de compensación, la Sociedad reportó el desarrollo de actividades de \nestablecimiento del sistema agroforestal en un predio denominado también “La Esperanza” en el \nmunicipio de Villavieja, dando a entender que el predio reportado, correspondía al que ya estaba \npreviamente aprobado (predio propiedad de Mily Yojana Blanco), sin embargo, y según se expone \nen los argumentos de ECOPETROL S.A, este predio donde la Sociedad reporta la ejecución del plan \n(reportado en la fila 13 de la Tabla 8 del informe de avance de compensación), realmente no estaba \naprobado.\n\nResolución No. 000220       Del 14 FEB. 2024          Hoja No. 17 de 40\n“POR LA CUAL SE RESUELVE UN RECURSO DE REPOSICIÓN”\nPágina 17 de 40\nAhora bien, una vez verificada la información que hizo parte del seguimiento que se realizó en el \nConcepto Técnico 5682 del 6 de septiembre de 2023 con respecto a las aclaraciones que hace \nECOPETROL S.A en el recurso de reposición, se confirma que el predio La Esperanza ubicado en \nel municipio de Villavieja, vereda Hato Nuevo, de 2 hectáreas cuyo propietario es Juan José Monje \nValdez, es distinto al que previamente se aprobó en la Resolución 1410 del 11 de agosto de 2021 al \nconsiderar tres (3) aspectos los cuales se señalan a continuación.\nEn primer lugar, en el Concepto Técnico 2399 del 5 de mayo de 2021 acogido por la Resolución \n1410 del 11 de agosto de 2021, en donde se evaluaron y aprobaron los 20 predios en donde se \nejecutaría el plan de compensación, se reconoce que el predio La Esperanza ubicado en el municipio \nde Villavieja es propiedad de Mily Yojana Blanco, por lo cual, es distinto al que se presentó en la \nnueva propuesta de predios presentada en el anexo 12 del ICA No. 14 (comunicación con radicación \n20236200172452 del 31 de mayo de 2023), que para el caso, el propietario, corresponde a Juan \nJosé Monje Valdez.\nUn segundo aspecto es que en el ICA No. 13 (comunicación con radicación 2022108696-1-000 del \n31 de mayo de 2022) se presenta la respuesta al numeral 56, artículo segundo del Auto 5544 del 22 \nde julio de 2021 en el que se requirió lo siguiente:\n“ARTÍCULO SEGUNDO. Requerir a la sociedad ECOPETROL S.A., para que, en el Informe \nde Cumplimiento Ambiental - ICA 13, presente los soportes de cumplimiento de las \nobligaciones que se enlistan a continuación:\n(…)\n56. Presentar la información de los predios la Esperanza y el Arrayán para completar el área \nestablecida como medida de compensación por cambio de uso de suelo por las intervenciones \nllevadas a cabo en los campos Dina Norte y Loma Larga, esto en cumplimiento del artículo \nnoveno de la Resolución 0455 del 15 de mayo de 2013.”\nAsí, en la respuesta se precisa,\n“Conforme al requerimientos emanados de la Autoridad Nacional de Licencias Ambientales- \nANLA en el Auto 4455 del 22 de junio del 2021, “Por el cual se efectúa seguimiento y control \nambiental”, Ecopetrol S.A en el presente documento se permite presentar el predio Arrayan \nubicado en la Vereda Dindal del Municipio de Aipe y el predio El Triunfo ubicado en la Vereda \nEl Cucharo del Municipio de Tello; aclarando que se ha presentado un desistimiento de la \nseñora Mily Yojana Blanco quien actuaba como poseedora del predio La Esperanza al \nno concretarse una compra de este.” (Negrita fuera de texto original)\nPor lo anterior, se confirma lo indicado por la Sociedad en su argumento y es que el predio La \nEsperanza, perteneciente a la señora Mily Yojana Blanco se descartó como alternativa para la \nejecución del plan de compensación, en ese sentido, a pesar de que no se incluyó en la Tabla 7 \n(listado de predios desistidos) del informe de avance de las actividades de compensación presentado \nen el ICA No. 14, si hace parte de los predios desistidos que se aprobaron en la Resolución 1410 de \n2021.\nPor último, como se mencionó previamente, en la GDB del ICA No. 14 se presentan los ocho (8) \npredios reportados por la Sociedad como definitivos, en los cuales ya se inició con la implementación \ndel plan de compensación, de los cuales, el predio La Esperanza de propiedad de Juan José Monje \nValdez ubicado en la Vereda Hato Nuevo, Municipio de Villavieja, coincide con uno de los 13 \npolígonos que se presentaron en el subanexo 2, del Anexo 12 (COMPENSACION_INVERSION_1%) \ndel mismo ICA, que corresponde a los predios nuevos.\n\nResolución No. 000220       Del 14 FEB. 2024          Hoja No. 18 de 40\n“POR LA CUAL SE RESUELVE UN RECURSO DE REPOSICIÓN”\nPágina 18 de 40\nDicho esto, en donde se entiende que el predio La Esperanza de propiedad de Juan José Monje \nValdez ubicado en la Vereda Hato Nuevo, Municipio de Villavieja es una propuesta nueva, se \nprocede a verificar su condición con respecto a los criterios para la selección y la aprobación de las \náreas a compensar, así, para iniciar es preciso indicar que de acuerdo con el literal b, artículo \nsegundo del Auto 1305 del 28 de marzo de 2018, para la selección de los predios se debe tener en \ncuenta particularmente lo siguiente:\n“ARTICULO SEGUNDO.\nb)\nLas áreas a intervenir podrán implementarse únicamente en áreas degradadas por \nactividades antrópicas, las cuales carezcan de coberturas vegetales nativas, esta \ncondición deberá incluirse dentro de los criterios para la selección de predios, los cuales \nserán objeto de aprobación por parte de esta Autoridad.”\nSegún lo mencionado, este es el criterio de mayor relevancia para la selección de los predios y es el \natributo principal para su aprobación. Es así, que para el predio La Esperanza de propiedad de Juan \nJosé Monje Valdez ubicado en la Vereda Hato Nuevo, Municipio de Villavieja, se hace la respectiva \nverificación a partir de imágenes satelitales de año 2021(Maxar, resolución espacial 0,46 m) y 2022 \n(RapideEye, resolución espacial: 3.9 m), fecha previa a su selección, con el fin de confirmar que se \nencontraba desprovisto de vegetación antes o en el momento del acuerdo con el propietario, \nencontrando el escenario que se observa en las siguientes figuras: (Ver Figuras 4 y 5 en la página \n17 del concepto técnico 131 del 18 de enero de 2024).\nDe lo que puede observarse se tiene entonces que el predio está particularmente rodeado de \ncoberturas transformadas con presencia de pastos, cultivos transitorios y desprovistas de \nvegetación. Por lo tanto, se espera que, ante el escenario actual de intervención, se conforme una \ncomunidad vegetal estable que, aunque tiene parcialmente un carácter productivo, ofrece servicios \necosistémicos y un entorno natural funcional.\nOtro de los aspectos que debe considerarse con respecto a la selección del predio y particularmente \nla posibilidad de establecer la siembra es que, en el literal h, del numeral 1 del artículo primero de la \nResolución 1410 del 11 de agosto de 2021 se indica un limitante con relación a la presencia de \ncuerpos de agua, tal como se precisa:\n“ARTÍCULO PRIMERO. (…)\n1. Obligaciones (…)\nh)\nRequerir a la sociedad para que se mantenga el área de ronda de las quebradas y ríos \nque se encuentran en los predios a intervenir, es decir en estas zonas NO se puede \nhacer establecimientos de cultivos (cítricos ni pan coger).”\nPara verificar esta condición se consultó la cartografía base del IGAC a escala 1:100.000 y se generó \nuna ronda de 30 m a cada lado del drenaje sencillo, encontrando que el predio La Esperanza de \npropiedad de Juan José Monje Valdez ubicado en la Vereda Hato Nuevo, Municipio de Villavieja está \nparcialmente dentro de dicha ronda, sin embargo, es una proporción muy baja, y el predio cuenta en \nla mayor parte de su área con las condiciones adecuadas, para desarrollar la actividad. En la \nsiguiente figura se muestra el soporte de la revisión realizada: (Ver Figura 6 en la página 19 del \nconcepto técnico 131 del 18 de enero de 2024).\nFinalmente, teniendo en cuenta que se cumplen los dos criterios principales tanto para la selección \ndel predio como para el establecimiento del sistema agroforestal, se considera que es viable la \naprobación del predio La Esperanza ubicado en la vereda Hato Nuevo, Municipio de Villavieja, de \npropiedad del señor Juan José Monje Valdés.\n\nResolución No. 000220       Del 14 FEB. 2024          Hoja No. 19 de 40\n“POR LA CUAL SE RESUELVE UN RECURSO DE REPOSICIÓN”\nPágina 19 de 40\nDebe resaltarse a la Sociedad, que el área en específico de dos (2) hectáreas, al interior del predio \nLa Esperanza propiedad de Juan José Monje Valdés en la vereda Hato nuevo del municipio de \nVillavieja, en la cual se implementarán las acciones de compensación, deberá cumplir con las \ncondicionantes impuestas en el literal b, artículo segundo del Auto 1305 del 28 de marzo de 2018 y \nel literal h del numeral 1 del artículo primero de la Resolución 1410 del 11 de agosto de 2021, así \ncomo las demás obligaciones impuestas relacionadas, para declarar el cumplimiento.\n❖\nCon respecto a la corrección del nombre del municipio en el cual se ubican los predios \nLote 66, Lote 4 Las Coloradas, La Pista B y Buenos Aires\nEn atención a los argumentos que expresa la Sociedad ECOPETROL S.A, esta Autoridad verificó el \nanálisis desarrollado en el Concepto Técnico 5682 del 3 de septiembre de 2023 que acogió la \nResolución 2606 del 10 de noviembre de 2023, ante lo cual se confirma que se cometió un error \ninvoluntario al momento de relacionar el nombre del municipio para los predios Lote 66, Lote 4 Las \nColoradas, La Pista B y Buenos Aires.\nEquivocadamente en la Tabla 37 y en el numeral 11.3.3 (Imposición de medidas (obligaciones \nnuevas) y/o ajustes vía seguimiento) concepto técnico 5682 del 3 de septiembre de 2023, se les \nasignó el municipio de Villanueva a los predios en mención, sin embargo, para esta Autoridad es \nclaro que su ubicación es el municipio de Villavieja, departamento del Huila, tal como se demuestra \nen los distintos apartes y en las tablas 33, 35, 39 del concepto técnico.\nDicho lo anterior, se acepta la solicitud efectuada por ECOPETROL S.A en cuanto a que se debe \ncorregir el nombre del municipio que se indica en el artículo primero de la Resolución 2606 del 10 de \nnoviembre de 2023 para los predios Lote 66, Lote 4 Las Coloradas, La Pista B y Buenos Aires, el \ncual corresponde a Villavieja, departamento del Huila. \nAsí mismo, se solicita MODIFICAR de oficio el artículo segundo de la Resolución 2606 del 10 de \nnoviembre del 2023, teniendo en cuenta que pese a que no fue recurrido por la Sociedad mediante \ncomunicación con radicación 20236200913022 del 27 de noviembre de 2023, si requiere ser \nmodificado, dado que deberá incluirse en el listado de desistimientos los predios La Esperanza de \npropiedad de Mily Yojana Blanco, ubicado en la vereda Hato Nuevo, Municipio de Villavieja y Nuevo \npredio (cambio de Belén y el Bosque) localizado en el municipio de Aipe, como parte de los \ndesistimientos otorgados para los predios aprobados mediante el artículo primero de la Resolución \n1410 del 11 de agosto de 2021, conforme a las siguientes consideraciones: \n•\nPredio La Esperanza de propiedad de Mily Yojana Blanco, ubicado en la vereda Hato Nuevo, \nMunicipio de Villavieja: la Sociedad indica que dicho predio no continuó como participante \nen la implementación del Plan de compensación dado a que no fue posible concretar su \ncompra con la propietaria, situación informada a esta Autoridad Nacional en la respuesta del \nNumeral 56 del Artículo Primero del Auto 05544 de 2021 el cual se adjuntó en el ICA No 13 \nradicado mediante comunicación ANLA, 2022108696-1-000 del 31 de mayo de 2022. \n•\nPredio denominado “Nuevo predio (cambio de Belén y el Bosque)” localizado en el municipio \nde Aipe: mediante concepto técnico 5682 del 06 de septiembre de 2023 en la página 462 se \nconsideró aprobar el desistimiento del predio en mención, sin embargo, en la parte resolutiva \ny acto administrativo que acogió este concepto técnico no quedó consignado. De igual forma, \nrevisando la información presentada en el anexo 12 del ICA No. 14 (radicado ANLA \n20236200172452 del 31 de mayo de 2023) en el documento “PRIMER INFORME DE \nACTIVIDADES PLAN DE COMPENSACION POR CAMBIO DE USO DEL SUELO Y \nAFECTACION AL MEDIO BIOTICO CAMPO DE PRODUCCION HUILA NORTE” y \nespecíficamente en la tabla 8 denominada “Participantes implementación del Plan de \nCompensación”, que fue la base para el seguimiento que se realizó en el Concepto Técnico \n\nResolución No. 000220       Del 14 FEB. 2024          Hoja No. 20 de 40\n“POR LA CUAL SE RESUELVE UN RECURSO DE REPOSICIÓN”\nPágina 20 de 40\n5682 de 2023, la Sociedad no incluye en el listado al predio “Nuevo predio (cambio de Belén \ny el Bosque), por lo que se concluye que el mismo fue desistido. \nPor consiguiente, se aceptan las peticiones de ECOPETROL S.A y, consecuencia se realizan los \nsiguientes ajustes:\n1.\nLos predios nuevos que se aprueban para ejecutar la medida de compensación que se \nestableció en el Auto 1305 del 28 de marzo de 2018, son los siguientes:\nPredio\nMunicipio\nVereda\nÁrea (ha)\n1\nEl Cují\nDindal Alto\n1\n2\nEl Refugio\nDindal Alto\n1\n3\nLote 1 (Luis Ignacio Charry)\nDindal Alto\n1\n4\nMirador\nDindal Alto\n1\n5\nLote 1-La Ponderosa\nDindal Alto\n2\n6\nEl Limón\nDindal Alto\n2\n7\nLa Sombra\nAipe\nDindal Alto\n2\n8\nLote 66\nHato Nuevo\n2\n9\nLa Esperanza (Juan José \nMonje Valdés)\nHato Nuevo\n2\n10\nLote 4 Las Coloradas\nPolonia\n2\n11\nLa Pista B\nPolonia\n1\n12\nBuenos Aires\nVillavieja\nPolonia\n2\n13\nLa Esperanza (Armando \nMosquera Trujillo)\nTello\nMesa \nRedonda\n2\nTOTAL\n21\n2.\nLos predios sobre los cuales se acepta su desistimiento, que fueron previamente aprobados \nen el artículo primero de la Resolución 1410 del 11 de agosto de 2021 son los siguientes:\nPredio\nMunicipio\nÁrea\nLa Arcadia\nAipe\n1 hectárea\nNuevo predio (cambio de Belén y el Bosque)\nAipe\n1 hectárea\nLos Robles\nAipe\n3 hectáreas\nMonte Zión\nAipe\n1 hectárea\nLote 5 Guadalupe\nAipe\n1 hectárea\nEl Igua\nAipe\n1 hectárea\nEl Arrayan\nAipe\n2 hectáreas\nLa Sabana\nTello\n2 hectáreas\nLa Caraguaja\nTello\n2 hectáreas\nPredio Villa Sofía (Nuevo Sr. Álvaro Salano)\nVillavieja\n1,5 hectárea\nVilla Alejandro\nVillavieja\n0,5 hectárea\nEl Dinde\nVillavieja\n1 hectárea\nSan José 1\nVillavieja\n1 hectárea\nBella Vista 1\nVillavieja\n2 hectáreas\nLa Esperanza (Mily Yojana Blanco)\nVillavieja\n1 hectárea\n (…)”\nLa Autoridad Nacional, considera pertinente señalar que es garante de la Constitución, de \nla Ley, de los principios de la función administrativa y de los procedimientos que rigen la \nactuación administrativa en materia ambiental; en ese sentido los actos y pronunciamientos \n\nResolución No. 000220       Del 14 FEB. 2024          Hoja No. 21 de 40\n“POR LA CUAL SE RESUELVE UN RECURSO DE REPOSICIÓN”\nPágina 21 de 40\nque se profieren en el marco de los procesos de seguimiento de los instrumentos de manejo \ny control se encuentran debidamente sustentados tanto técnica como jurídicamente; es así \ncomo en aplicación de los principios del debido proceso, igualdad, imparcialidad, buena fe, \nmoralidad, participación, responsabilidad, transparencia, publicidad, coordinación, eficacia, \neconomía y celeridad, la Autoridad Nacional expidió la Resolución 2606 del 10 de \nnoviembre de 2023 respetando las normas jurídicas superiores, la normativa ambiental \nvigente y conforme a los soportes presentados por la Sociedad. \nAhora bien, es de precisar que el predio La esperanza de propiedad de Mily Yojana Blanco \n(1 hectárea) localizado en la Vereda el Hato en el Municipio de Villavieja el cual se aprobó \nen la Resolución 1410 del 11 de agosto de 2021, es distinto al predio La Esperanza ubicado \nen el municipio de Villavieja, vereda Hato Nuevo de 2 hectáreas cuyo propietario es Juan \nJosé Monje Valdez; dado que éste predio se relacionó en la nueva propuesta de predios \npresentada por medio de la comunicación con radicación 20236200172452 del 31 de mayo \nde 2023 en el Informe de Cumplimiento Ambiental ICA No. 14.\nEs así como de la evaluación de dicha propuesta se aprobó el predio La Esperanza ubicado \nen la vereda Hato Nuevo, Municipio de Villavieja, de propiedad del señor Juan José Monje \nValdés puesto que se cumplen los dos criterios principales tanto para la selección del predio \ncomo para el establecimiento del sistema agroforestal, y de la evaluación de dicha \npropuesta se considera viable la aprobación del predio La Esperanza ubicado en la vereda \nHato Nuevo, Municipio de Villavieja, de propiedad del señor Juan José Monje Valdés.\nAsí las cosas, y teniendo en cuenta las consideraciones expuestas en el Concepto Técnico \n131 del 18 de enero de 2024, la Autoridad Nacional procederá a modificar el artículo primero \nde la Resolución 2606 del 10 de noviembre de 2023, tal como se reflejará en la parte \nresolutiva del presente acto administrativo.\nCon todo y lo anterior, es de precisar que el artículo 45 de la Ley 1437 de 2011, por la cual \nse expide el Código de Procedimiento Administrativo y de lo Contencioso Administrativo, \nseñala lo siguiente en relación a la corrección de los errores simplemente formales: \n“Artículo 45. Corrección de errores formales. En cualquier tiempo, de oficio o a petición de \nparte, se podrán corregir los errores simplemente formales contenidos en los actos \nadministrativos, ya sean aritméticos, de digitación, de transcripción o de omisión de palabras. \nEn ningún caso la corrección dará lugar a cambios en el sentido material de la decisión, ni \nrevivirá los términos legales para demandar el acto. Realizada la corrección, esta deberá ser \nnotificada o comunicada a todos los interesados, según corresponda.” \nEn cuanto a la corrección de errores formales el Consejo de Estado en sentencia del \nveintiséis (26) de febrero de dos mil catorce (2014) de la Sección Cuarta de la Sala de lo \nContencioso Administrativo con ponencia de la Consejera Martha Briceño de Valencia, \nseñaló: \n“Así pues, para que la Administración pueda ejercer la facultad de corregir los errores \naritméticos o de transcripción, es necesario que el error sea evidente, esto es, que no \nmodifique la “[E]ficacia sustancial del acto en que existe” o, como lo ha dicho la Sala, que no \nafecte el contenido sustancial del acto administrativo que se corrige. Asimismo, la apreciación \ndel error descarta una “[O]peración de calificación jurídica”, como lo precisó la doctrina, y la \ncorrección de este no puede alterar fundamentalmente el sentido del acto corregido […] \n\nResolución No. 000220       Del 14 FEB. 2024          Hoja No. 22 de 40\n“POR LA CUAL SE RESUELVE UN RECURSO DE REPOSICIÓN”\nPágina 22 de 40\nteniendo en cuenta que los errores de transcripción pueden corregirse en cualquier tiempo, \nporque no afectan el contenido sustancial del acto corregido” (Subrayado fuera del texto). \n(…)”\nPara el caso en concreto, el Concepto Técnico 131 del 18 de enero de 2024, concluye que \nen la elaboración de la Resolución recurrida, se incurrió en errores de digitación al momento \nde relacionar en la Tabla del artículo primero de la Resolución 2606 del 10 de noviembre \nde 2023 el nombre del municipio Villanueva para los predios “Lote 66”, “Lote 4” “Las \nColoradas”, “La Pista B” y “Buenos Aires”, cuando el nombre del municipio que corresponde \nes el municipio de Villavieja teniendo en cuenta la ubicación de éste en el departamento del \nHuila, tal como se demuestra en la parte considerativa y en las tablas 33, 35, 39 del \nconcepto técnico 5682 del 3 de septiembre de 2023.\nDe otra parte, de manera oficiosa la Autoridad Nacional, modificará el artículo segundo de \nla Resolución 2606 del 10 de noviembre de 2023, en el sentido de incluir en el listado de \ndesistimiento los predios La Esperanza de propiedad de Mily Yojana Blanco, ubicado en la \nvereda Hato Nuevo, Municipio de Villavieja y Nuevo predio (cambio de Belén y el Bosque) \nlocalizado en el municipio de Aipe, tal como se reflejará en la parte resolutiva del presente \nacto administrativo.\n2.\nDISPOSICIÓN RECURRIDA –ARTÍCULO TERCERO DE LA RESOLUCIÓN 2606 \nDEL 10 DE NOVIEMBRE DEL 2023\n“ARTÍCULO TERCERO. NO ACEPTAR el plan de compensación por cambio de uso del \nsuelo y afectación al medio biótico por los Clúster 1, 2, 3 y 4 del campo Dina Cretáceos, \ncorrespondiente al establecimiento de sistemas agroforestales en un área equivalente a 3,814 \nha, presentado por la sociedad ECOPETROL S.A. mediante la comunicación con radicado \nANLA 2022108696-1-000 del 31 de mayo de 2022”.\n(…)”\n2.1 Petición de la Sociedad.\n“(…) “Aceptar el Plan de Compensación por cambio de uso del suelo y afectación al medio \nbiótico por los Clúster 1, 2, 3 y 4 del campo Dina Cretáceos, correspondiente al establecimiento \nde sistemas agroforestales en un área equivalente a 3,814 ha, presentado por la sociedad \nECOPETROL S.A. mediante la comunicación con radicado ANLA 2022108696-1-000 del 31 \nde mayo de 2022, en cumplimiento a los requerimientos del Numeral 61 del artículo Segundo \ndel Auto 05544 del 22 de junio de 2021”\n2.2 Argumentos de la Sociedad.\n“    (…)\nA.\nResolución 0455 del 15 de mayo de 2013 la cual resuelve:\nARTICULO PRIMERO: Modificar el artículo primero de la Resolución 0003 del 7 de enero de \n2003, modificada a su vez por la Resolución 1008 del 22 de septiembre de 2003, en el sentido \nde adicionar las actividades e infraestructura a desarrollar dentro del proyecto de desarrollo \nde los campos Brisas, Dina terciarios, Pijao, Cebú, Palogrande, Dina cretáceos, Tenay y Santa \n\nResolución No. 000220       Del 14 FEB. 2024          Hoja No. 23 de 40\n“POR LA CUAL SE RESUELVE UN RECURSO DE REPOSICIÓN”\nPágina 23 de 40\nClara, localizado en jurisdicción de los municipio de Aipe, Neiva, Palermo, Tello y Villavieja, \ndepartamento del Huila, igualmente denominado “Campos Huila Norte”, a cargo de la empresa \nECOPETROL S.A.\nDentro de las actividades e infraestructura a desarrollar se encuentra:\n1.\nConstrucción de 150 kilómetros de vías nuevas, según especificaciones.\n2.\nAdecuación y mantenimiento de las vías existentes listadas.\n3.\nConstrucción de un máximo 126 locaciones nuevas, con un área máxima por locación de 2.5 \nhectáreas y hasta 6 pozos.\n4.\nÁreas para ZODME, ubicadas por zonificación y aplicando las medidas de manejo propuestas \npara los mismos, así como con condiciones de diseño\n5.\nPerforación de pozos.\n6.\nConstrucción de máximo 8 kilómetros para cada línea de flujo o línea de inyección nueva y 16 \nkilómetros para la línea Arrayán- Dina Cretáceos, para un total de 180 km de redes de \nconducción de fluidos a construir, bajo especificaciones.\n7.\nConstrucción de dos (2) Plantas de Inyección de Aguas — PIA adicionales.\n8.\nAmpliación de la Batería Loma Larga en un área de 10.325 m2 y la instalación de un módulo \npara 5.000 Bis de fluido. Así mismo se autoriza la ampliación de las Baterías Dina Norte, \nTerciarios y Cretáceos para un módulo con capacidad para 20.000 Bis cada una.\n9.\nDisposición de agua por reinyección para los campos, número de pozos y formaciones que a \ncontinuación se listan.\n10. Recuperación mejorada de petróleo, por métodos y condiciones.\nARTICULO TERCERO: Modificar el Artículo Tercero de la Resolución 0003 del 7 de enero de 2003, \nmodificada a su vez por la Resolución 1008 del 22 de septiembre de 2003, respecto a la \nconformación del Plan de Manejo para los Campos Brisas, Dina Terciarios, Pijao, Cebú, Palogrande, \nDina Cretáceas, Tenay, Hatonuevo y Santa Clara en el área de Neiva, localizados en los municipios \nde Aipe, Neiva, Palermo, Tello y Villavieja, departamento del Huila, igualmente denominado \"Campos \nHuila Norte\", con los programas y fichas enunciados a continuación, dentro de las cuales en el \nPROGRAMA MEDIO BIOTICO Y ABIOTICO se relaciona la ficha de Compensación por afectación \na la cobertura vegetal y uso del suelo.\nARTICULO CUARTO: - Las medidas del Plan de Manejo Ambiental deberán ser complementadas, \najustadas, conforme se indica a continuación, y presentadas al igual que el avance de su ejecución \nen el primer Informe de Cumplimiento Ambiental — ICA siguiente al término de ejecutoria de este \nacto administrativo:\nDe la ficha 7.9.5. Compensación por afectación a la cobertura vegetal y uso del suelo. Se debe incluir \nun indicador de número de especies plantadas comparado con el número de especies adaptadas ya \nque solo realizar la actividad no implica una compensación, esta debe ser un proceso que implica \nseguimiento y control.\nARTICULO NOVENO: Establecer medida de compensación a la empresa ECOPETROL S.A. por \ncambio de uso del suelo y afectación al medio biótico, en razón del Proyecto, en una relación 1:2 \n(por cada hectárea intervenida, dos compensadas) sin perjuicio del cumplimiento de las \ncompensaciones que debe hacer por aprovechamiento forestal. En el término de seis (6) meses, \ncontados a partir de ejecutoria de este acto administrativo, la Empresa deberá presentar un plan de \ncompensación para la respectiva evaluación y pronunciamiento de esta Autoridad.\nB.\nComunicación 4120-E1-1703 del 17 de enero de 2014:\n\nResolución No. 000220       Del 14 FEB. 2024          Hoja No. 24 de 40\n“POR LA CUAL SE RESUELVE UN RECURSO DE REPOSICIÓN”\nPágina 24 de 40\nEcopetrol S.A. presenta los ajustes a la ficha de manejo 7.9.5 Compensación por afectación a la \ncobertura vegetal y uso del suelo, en cumplimiento al Artículo Cuarto de la Resolución 0455 del 15 \nde mayo de 2013.\nC.\nComunicación Radicado ANLA 2017057866-1-000 del 28 de julio de 2017:\nEcopetrol S.A en cumplimiento del Artículo Noveno de la Resolución 0455 de 2015, remite la \npropuesta de compensación ajustada denominada “Plan de Compensación por Cambio de uso del \nSuelo y Afectación al medio Biótico” CAMPO HUILA NORTE, la cual corresponde a la \nimplementación de proyectos de uso sostenible (agroforestal de Cítricos, Plátano y árboles nativos \nen cercas vivas) a implementar en la vereda Hato Nuevo del municipio de Villavieja y Dindal en el \nmunicipio de Aipe, a fin que sea evaluada y aprobada por la autoridad ambiental; toda vez que \na la fecha de presentación se habían intervenido dos áreas del Campo Huila Norte.\nD.\nAuto 01305 del 28 de marzo de 2018 el cual dispone:\nARTICULO PRIMERO. Aprobar la medida de compensación presentada por la sociedad \nECOPETROL S.A. mediante comunicación con radicación en la ANLA, 2017057866-1-000 del 28 de \njulio de 2017, sobre establecimiento de sistemas agroforestales para las obligaciones de \ncompensación por cambio en el uso de los suelos y afectación del medio Biótico, en cumplimiento a \nlo establecido en el artículo noveno de la Resolución 455 del 15 de mayo de 2013.\nARTICULO SEGUNDO. La sociedad ECOPETROL S.A. deberá ajustar el Plan de Compensación \nen un término máximo de seis (6) meses, previo al inicio de la ejecución de actividades de dicho \nPlan, de acuerdo a los siguientes requerimientos y la información específica de los predios a \nbeneficiar. Para ello ECOPETROL S.A. mediante comunicación 2018140523-1-000 del 08 de \noctubre de 2018 da respuesta al requerimiento del artículo en comento, resaltando que el Plan \npresentado mediante comunicación 2017057866-1-000 del 28 de julio de 2017 como la \npresente respuesta corresponde a los Campo Huila Norte.\nE.\nAuto 05544 del 28 de julio de 2021, Artículo Segundo, Numeral 61 la el cual dispone:\nARTICULO SEGUNDO. Requerir a la sociedad ECOPETROL S.A., para que, en el Informe de \nCumplimiento Ambiental - ICA 13, presente los soportes de cumplimiento de las obligaciones que se \nenlistan a continuación:\n61. Presentar en el marco de la compensación por cambio de uso del suelo de 1,907 hectáreas \nintervenidas por la ampliación de cuatro Clúster (Clúster 1, Clúster 2, Clúster 3 y Clúster 4) del campo \nDina Cretáceos:\na)\nCaracterización biótica, física y social del área intervenida por Cambio de uso del suelo.\nb)\nFormato de actas de \"Acuerdo y compromiso de ejecución y cuidado del sistema entre la \nsociedad Ecopetrol S.A. y el propietario\", para aprobación por parte de esta Autoridad Nacional.\nc)\nLas áreas para intervenir podrán implementarse únicamente en áreas degradadas por \nactividades antrópicas, se debe incluir este criterio en la ficha de selección de beneficiarios.\nd)\nSe debe presentar informe de los predios seleccionados con su respectiva caracterización \nbiótica, física y social, la cual debe contener información relacionada con ecosistemas \nasociados, inventario de fauna y flora, información cartográfica; para su verificación en campo \ny posterior aprobación por parte de esta Autoridad. Es importante que los beneficiarios sean \ndiferentes a los presentados en cumplimiento de la intervención de los campos Dina Norte y \nLoma Larga.\ne)\nPara el componente forestal o protector se deben utilizar solamente especies NATIVAS y \npropias del ecosistema de referencia, en arreglos que generen heterogeneidad y no \nmonocultivos; en una proporción superior o igual al cultivo permanente.\n\nResolución No. 000220       Del 14 FEB. 2024          Hoja No. 25 de 40\n“POR LA CUAL SE RESUELVE UN RECURSO DE REPOSICIÓN”\nPágina 25 de 40\nf)\nEl ajuste de la propuesta debe incluir la equivalencia ecosistémica y la adicionalidad e impacto \npositivo a la conservación.\nLo anterior, de acuerdo con lo establecido en el artículo noveno de la Resolución 0455 del 15 de \nmayo de 2013.\nEste requerimiento fue realizado en virtud del control y seguimiento ambiental al proyecto, de \nconformidad con la visita realizada entre los días 22 al 26 de febrero de 2021, en su fase de \nOperación durante el periodo del 17 de agosto de 2018 al 26 de febrero de 2021, en donde se \nreportan nuevas áreas intervenidas en la vigencia 2018 a 2020, que deben ser compensadas \nconforme al Artículo Noveno de la Resolución 0455 de 2013.\nF.\nComunicación radicado ANLA 2022108696-1-000 del 31 de mayo de 2022\nECOPETROL S.A, en el Informe de cumplimiento Ambiental ICA No 13 correspondiente al periodo \n2021 - Anexo 12, hace entrega de los soportes de cumplimiento a los numerales 56, 58, 59 y 61 del \nArtículo Segundo del Auto 05544 del 22 de julio de 2021 “Plan de Compensación por Cambio de Uso \ndel Suelo y Afectación al medio Biótico Clúster 1, Clúster 2, Clúster 3 y Clúster 4 en cumplimiento a \nlos requerimientos a, b, c, d, e, f realizados por la Autoridad en el numeral 61 del Artículo Segundo \ndel Auto 05544 del 28 de julio de 2021 y Resolución 0455 del 15 de mayo de 2013, para implementar \nen la Vereda Dina, Municipio de Neiva, Campo Huila Norte”.\nG.\nLa Resolución 2606 del 10 de noviembre de 2023 soportada en el concepto técnico 5682 de \n2023 (Página 452) concluye:\n“En primer lugar, lo que fue establecido en el Auto 1305 del 28 de marzo de 2018 corresponde \na la propuesta que se presentó mediante radicado ANLA 2017057866-1-000 del 28 de julio de \n2017 en el que se contemplaba exclusivamente la compensación de lo intervenido en los \ncampos Dina Norte y Loma Larga, tal como se señala en el artículo primero:\nARTÍCULO PRIMERO. Aprobar la medida de compensación presentada por la sociedad \nECOPETROL S.A. mediante comunicación con radicación en la ANLA, 2017057866-1-000 \ndel 28 de julio de 2017, sobre establecimiento de sistemas agroforestales para las \nobligaciones de compensación por cambio en el uso de los suelos y afectación del medio \nBiótico, en cumplimiento a lo establecido en el artículo noveno de la Resolución 455 del 15 \nde mayo de 2013.\nPor esto, la compensación a través de sistemas agroforestales aplica únicamente para la \nintervención generada por los mencionados campos y no para todo el proyecto “Campos Huila \nNorte”, sobre esto debe tenerse presente que en el artículo noveno de la Resolución 455 del 15 \nde mayo de 2013 (impone obligación de compensación) se estableció el factor de \ncompensación, pero no estableció acciones específicas para la implementación ni definió \ncaracterísticas particulares que debían tener las áreas seleccionadas para el cumplimiento de \nla obligación, como se cita a continuación:\n“ARTÍCULO NOVENO. - Establecer medida de compensación a la empresa ECOPETROL \nS.A. por cambio de uso del suelo y afectación al medio biótico, en razón del Proyecto, en \nuna relación 1:2 (por cada hectárea intervenida, dos compensadas) sin perjuicio del \ncumplimiento de las compensaciones que debe hacer por aprovechamiento forestal. En el \ntérmino de seis (6) meses, contados a partir de ejecutoria de este acto administrativo, la \nEmpresa deberá presentar un plan de compensación para la respectiva evaluación y \npronunciamiento de esta Autoridad.”\n\nResolución No. 000220       Del 14 FEB. 2024          Hoja No. 26 de 40\n“POR LA CUAL SE RESUELVE UN RECURSO DE REPOSICIÓN”\nPágina 26 de 40\nPese a lo anterior, las acciones para la ejecución están determinadas por la Ficha 7.9.5 \nCompensación por afectación a la cobertura vegetal y uso del suelo (aprobada en el artículo \ntercero de la Resolución 455 del 15 de mayo de 2013) en la que se proponen los siguientes \ntipos de actividades:\n•\nReforestación de áreas degradadas y con aptitud forestal.\n•\nEnriquecimiento de bosque ripario.\n•\nCompra de predios en áreas sensibles y ambientalmente estratégicos.\nDicho esto, la compensación debe formularse bajo las líneas que establece la Ficha 7.9.5 y no \nampararse en la propuesta de compensación que se aprobó en el Auto 1305 del 28 de marzo \nde 2018 que como se mencionó previamente, aplica particularmente para la compensación de \nlas 27,3566 ha por la intervención en los campos Dina Norte y Loma Larga.\nEn virtud de esto, las obligaciones de compensación que están pendientes por aprobar, incluida \nla de 3,814 ha y las que surjan en adelante producto de nuevas intervenciones, deben \nformularse basándose en las acciones que establece la Ficha 7.9.5 Compensación por \nafectación a la cobertura vegetal y uso del suelo (aprobada en el artículo tercero de la \nResolución 455 del 15 de mayo de 2013), y las acciones de uso sostenible a través de sistemas \nagroforestales puede considerarse como una acción que se ejecute como una herramienta de \nmanejo del paisaje, es decir, que se integre en un proyecto donde prevalezcan de acciones de \npreservación y restauración, conformando y aumentando el hábitat natural.\nEn conclusión, ECOPETROL S.A. en el Anexo 12 del Informe de Cumplimiento Ambiental ICA No \n13 hizo entrega a esta autoridad de los soportes del cumplimiento de los requerimientos del numeral \n61 Artículo Segundo del Auto 05544 del 22 de julio de 2021 en el marco del artículo Noveno de la \nResolución 0455 del 15 de mayo de 2013 entre ellos:\n•\nLa presentación de los predios con la respectiva caracterización biótica, física y social, la cual \ndebe contener información relacionada con ecosistemas asociados, inventario de fauna y \nflora, información cartográfica.\n•\nEl objetivo de la presentación de estos predios como lo determina la autoridad es su \nverificación en campo y posterior aprobación por parte de esta.\n•\nPara el proceso de presentación de los predios ECOPETROL S.A. surtió un proceso de \ninformación y socialización con la comunidad, visitas de campo para valoración y selección de \npredios y levantamiento de información requerida por la Autoridad.\nNo aprobar el documento denominado Plan de Compensación por Cambio de Uso del Suelo y \nAfectación al medio Biótico Clúster 1, Clúster 2, Clúster 3 y Clúster 4 en cumplimiento a los \nrequerimientos a, b, c, d, e, f realizados por la Autoridad en el numeral 61 del Artículo Segundo del \nAuto 05544 del 28 de julio de 2021, genera:\n•\nPérdida de recursos económicos empleados en la información y socialización con la \ncomunidad.\n•\nPérdida de recursos económicos empleados en las visitas de campo y documentación de la \ncaracterización biótica, física y social.\n•\nAfectación en la Imagen de ECOPETROL S.A. con la comunidad y los propietarios de los \npredios participantes, afectando la credibilidad y buen nombre de ECOPETROL S.A.\n\nResolución No. 000220       Del 14 FEB. 2024          Hoja No. 27 de 40\n“POR LA CUAL SE RESUELVE UN RECURSO DE REPOSICIÓN”\nPágina 27 de 40\n•\nAunado a esto el documento plan de compensación por cambio de uso del suelo y afectación \ndel medio biótico con Radicado ANLA, 2017057866-1-000 del 28 de julio de 2017, se elaboró \npara el campo Huila Norte, del cual hacen parte los campos Brisas, Dina Terciarios, Pijao, \nCebú, Palogrande, Dina Cretáceos, Tenay y Santa Clara y para la fecha de presentación (julio \nde 2017) se habían desarrollado actividades aprobadas en el Artículo primero de la Resolución \n0455 de 2013, las cuales dieron lugar a el cálculo de áreas intervenidas, el caculo del área a \ncompensar.\n•\nEl Artículo Noveno de la Resolución 0455 de 2013 requiere presentar un Plan de \ncompensación para la respectiva evaluación y pronunciamiento en el marco de la modificación \ndel Plan de Manejo de los campos Brisas, Dina Terciarios, Pijao, Cebú, Palogrande, Dina \nCretáceos, Tenay y Santa Clara, localizado en jurisdicción de los municipios de Aipe, Neiva, \nPalermo, Tello y Villavieja, departamento del Huila, igualmente denominado \"Campos Huila \nNorte\".\n•\nEl Auto 1305 del 28 de marzo de 2018, aprueba la medida de compensación presentada por \nla sociedad ECOPETROL S.A. mediante comunicación con radicación en la ANLA, \n2017057866-1-000 del 28 de julio de 2017, sobre establecimiento de sistemas agroforestales \npara las obligaciones de compensación por cambio en el uso de los suelos y afectación del \nmedio Biótico, en cumplimiento a lo establecido en el artículo noveno de la Resolución 455 del \n15 de mayo de 2013, en ningún aparte del Auto en comento se relaciona que la medida \npresentada solo aplica para las áreas intervenidas en los campos Dina Norte y \nLomalarga.\n•\nLa presentación de la medida de compensación para los Clúster 1, Clúster 2, Clúster 3 y \nClúster 4) del campo Dina Cretáceos, se elaboró en el marco del requerimiento realizado por \nla autoridad en el numeral 61 del artículo segundo del auto 05544 de 2021, en ninguno de \nlos apartes del mencionado Auto y concepto técnico No 2399 del 5 de mayo de 2021, \nrequieren la presentación de un nuevo Plan de compensación para estas áreas, fue \nrequerido en el marco normativo de la resolución 0455 de 2013 y Auto 05544 de 2021 \n(Ver página 128).\n“…Mediante radicado 2021035229-1-000 del 1 de marzo de 2021, la sociedad indica que “En \nlas vigencias 2018 a 2020, se planeó, aprobó y ejecuto el caso de negocio denominado \n“Recobro Mejorado Monserrate” para campo Dina Cretáceos”. Se desarrolló la ampliación de \ncuatro Clúster; estas ampliaciones generaron un cambio de uso del suelo, cuya área es la \nsiguiente:\n\nResolución No. 000220       Del 14 FEB. 2024          Hoja No. 28 de 40\n“POR LA CUAL SE RESUELVE UN RECURSO DE REPOSICIÓN”\nPágina 28 de 40\nDe acuerdo al área intervenida y las relaciones de compensación cambio de uso del suelo y \nafectación al medio biótico establecidas en el artículo noveno de la Resolución 0455 del 15 de \nmayo de 2013, el área a compensar es de 3,814 ha, tal como se presenta en la Tabla 3.”\nFundamentos de la impugnación\nAl No Aceptar el plan de compensación por cambio de uso del suelo y afectación al medio biótico \npor los Clúster 1, 2, 3 y 4 del campo Dina Cretáceos, correspondiente al establecimiento de sistemas \nagroforestales en un área equivalente a 3,814 ha, presentado por la sociedad ECOPETROL S.A. \nmediante la comunicación con radicado ANLA 2022108696-1-000 del 31 de mayo de 2022; se \ndesconocería:\nA) Resolución 0455 del 15 de mayo de 2013 la cual resuelve en su Artículo Primero:\nModificar el artículo primero de la Resolución 0003 del 7 de enero de 2003, modificada a su vez por \nla Resolución 1008 del 22 de septiembre de 2003, en el sentido de adicionar las actividades e \ninfraestructura a desarrollar dentro del proyecto de desarrollo de los campos Brisas, Dina terciarios, \nPijao, Cebú, Palogrande, Dina cretáceos, Tenay y Santa Clara, localizado en jurisdicción de los \nmunicipio de Aipe, Neiva, Palermo, Tello y Villavieja, departamento del Huila, igualmente \ndenominado “Campos Huila Norte”; es decir este artículo regla las actividades en la totalidad del \npolígono del Campo Huila Norte (negrita y subrayado fuera de texto).\nB) Resolución 0455 del 15 de mayo de 2013 la cual resuelve en su Artículo Noveno:\nEstablecer medida de compensación a la empresa ECOPETROL S.A. por cambio de uso del suelo \ny afectación al medio biótico, en razón del Proyecto, proyecto denominado Huila Norte, del cual \nhacen parte los campos Brisas, Dina terciarios, Pijao, Cebú, Palogrande, Dina cretáceos, \nTenay y Santa Clara, localizado en jurisdicción de los municipios de Aipe, Neiva, Palermo, \nTello y Villavieja, departamento del Huila (negrita y subrayado fuera de texto), en relación 1:2 (por \ncada hectárea intervenida, dos compensadas) sin perjuicio del cumplimiento de las compensaciones \nque debe hacer por aprovechamiento forestal. En el término de seis (6) meses, contados a partir de \nejecutoria de este acto administrativo, la Empresa deberá presentar un plan de compensación para \nla respectiva evaluación y pronunciamiento de esta Autoridad.\nC) Auto 01305 del 28 de marzo de 2018 el cual dispone en su Artículo Primero\nAprobar la medida de compensación presentada por la sociedad ECOPETROL S.A. mediante \ncomunicación con radicación en la ANLA, 2017057866-1-000 del 28 de julio de 2017, sobre \nestablecimiento de sistemas agroforestales para las obligaciones de compensación por cambio en \nel uso de los suelos y afectación del medio Biótico, en cumplimiento a lo establecido en el artículo \nnoveno de la Resolución 455 del 15 de mayo de 2013, medida de compensación que \nECOPETROL S.A. elaboró para el Campo Huila Norte y la aprobación la Autoridad en ningún \naparte del Auto en comento se relaciona que la medida presentada solo aplica para las áreas \nintervenidas en los campos Dina Norte y Lomalarga. (negrita y subrayado fuera de texto).\n\nResolución No. 000220       Del 14 FEB. 2024          Hoja No. 29 de 40\n“POR LA CUAL SE RESUELVE UN RECURSO DE REPOSICIÓN”\nPágina 29 de 40\nD) Auto 05544 del 28 de julio de 2021, el cual dispone en su Artículo Segundo, Numeral 61:\nPresentar en el marco de la compensación por cambio de uso del suelo de 1,907 hectáreas \nintervenidas por la ampliación de cuatro Clúster (Clúster 1, Clúster 2, Clúster 3 y Clúster 4) del campo \nDina Cretáceos:\na. Caracterización biótica, física y social del área intervenida por Cambio de uso del suelo.\nb. Formato de actas de \"Acuerdo y compromiso de ejecución y cuidado del sistema entre la \nsociedad Ecopetrol S.A. y el propietario\", para aprobación por parte de esta Autoridad Nacional.\nc. Las áreas para intervenir podrán implementarse únicamente en áreas degradadas por \nactividades antrópicas, se debe incluir este criterio en la ficha de selección de beneficiarios.\nd. Se debe presentar informe de los predios seleccionados con su respectiva caracterización \nbiótica, física y social, la cual debe contener información relacionada con ecosistemas asociados, \ninventario de fauna y flora, información cartográfica; para su verificación en campo y posterior \naprobación por parte de esta Autoridad. Es importante que los beneficiarios sean diferentes a los \npresentados en cumplimiento de la intervención de los campos Dina Norte y Loma Larga.\ne. Para el componente forestal o protector se deben utilizar solamente especies NATIVAS y \npropias del ecosistema de referencia, en arreglos que generen heterogeneidad y no monocultivos; \nen una proporción superior o igual al cultivo permanente.\nf. El ajuste de la propuesta debe incluir la equivalencia ecosistémica y la adicionalidad e impacto \npositivo a la conservación.\nLo anterior de acuerdo con lo establecido en el artículo noveno de la Resolución 0455 del 15 de \nmayo de 2013.\nEn ninguno de los apartes del mencionado Auto y concepto técnico No 2399 del 5 de mayo \nde 2021, requieren la presentación de un nuevo Plan de compensación para estas áreas. Estas \ndisposiciones del numeral 61 del Artículo Segundo del Auto 0544 de 2021 las realiza la Autoridad en \nel marco normativo de la Resolución 0455 de 2013 y Auto 05544 del 28 de julio de 2021 (Ver página \n128).\nPara el cumplimiento de lo dispuesto en numeral 61 del Artículo Segundo del Auto 0544 de 2021, \nEcopetrol realizó una serie de actividades que requirieron de personal, logística e inversión de \nrecursos económicos, para el proceso de presentación de los predios, proceso en el cual realizó el \nproceso de información y socialización con la comunidad, visitas de campo para valoración y \nselección de predios y levantamiento de información requerida por la Autoridad y reversar la \ncompensación generaría Perdida de recursos económicos empleados en la información y \nsocialización con la comunidad, Perdida de recursos económicos empleados en las visitas de campo \ny documentación de la caracterización biótica, física y social, afectación en la Imagen de \nECOPETROL S.A. con la comunidad y los propietarios de los predios participantes, afectando las \nrelaciones con la comunidad y el buen nombre de la sociedad”.\n(…)”\n2.3\nConsideraciones de la Autoridad Nacional.\nA través del Concepto Técnico 131 del 18 de enero de 2024, el equipo técnico de la \nAutoridad Nacional consideró:\n“(…) Una vez revisados los argumentos expuestos por la Sociedad ECOPETROL S.A, esta Autoridad \nse dispone a verificar el análisis realizado en el Concepto Técnico 5682 del 6 de septiembre de 2023 \nque acogió la Resolución 2606 del 10 de noviembre de 2023, con respecto a los criterios empleados \npara tomar la decisión de negar el plan de compensación por cambio de uso del suelo y afectación \n\nResolución No. 000220       Del 14 FEB. 2024          Hoja No. 30 de 40\n“POR LA CUAL SE RESUELVE UN RECURSO DE REPOSICIÓN”\nPágina 30 de 40\nal medio biótico del campo Dina Cretáceos presentado mediante radicado ANLA 2022108696-1-000 \ndel 31 de mayo de 2022.\nActualmente, para el proyecto “Campos Huila Norte” expediente LAM2307 la obligación de \ncompensación por cambio de uso del suelo y afectación al medio biótico se deriva de las \nintervenciones generadas en tres (3) campos: Dina Norte, Loma Larga y Dina Cretáceos. \nPara los dos (2) primeros campos por medio del Auto 1305 del 28 de marzo de 2018 se aprobó la \nmedida de compensación sobre establecimiento de sistemas agroforestales en cumplimiento a las \nobligaciones de compensación por cambio de uso del suelo y afectación del medio Biótico conforme \na lo establecido en el artículo noveno de la Resolución 455 del 15 de mayo de 2013. \nNo obstante, el artículo segundo del auto en mención requirió hacer ajustes al plan de compensación \nen relación con los predios a beneficiar, es así como, mediante la Resolución 01410 del 11 de agosto \nde 2021 fueron aprobados veinte (20) predios para ejecutar el plan de compensación. \nAhora bien, en relación con el campo Dina Cretáceos no se cuenta con una propuesta de \ncompensación avalada y aprobada por parte de esta Autoridad Nacional.\nDebe aclararse que en el Auto 1305 del 28 de marzo de 2018 se aprobó particularmente la propuesta \nde compensación presentada en el radicado ANLA 2017057866-1-000 del 28 de julio de 2017, tal \ncomo se precisa en su artículo primero:\n“ARTÍCULO PRIMERO. Aprobar la medida de compensación presentada por la sociedad \nECOPETROL S.A. mediante comunicación con radicación en la ANLA, 2017057866-1-\n000 del 28 de julio de 2017, sobre establecimiento de sistemas agroforestales para las \nobligaciones de compensación por cambio en el uso de los suelos y afectación del medio \nBiótico, en cumplimiento a lo establecido en el artículo noveno de la Resolución 455 del 15 de \nmayo de 2013.” (Negrita fuera de texto).\nEl plan mencionado se presentó en cumplimiento a la compensación por la intervención de los \ncampos Dina Norte y Loma Larga, siendo hasta ese momento el origen por el cual se configuró la \nmencionada obligación, específicamente para estos campos. Es así como todo el contenido del plan \npresentado con radicado 2017057866-1-000 del 28 de julio de 2017 y aprobado mediante Auto 1305 \nde 2018 hace referencia a este objetivo particular, y no corresponde a la estrategia para compensar \ntodas las afectaciones derivadas de la totalidad de los “Campos Huila Norte”, y con esto no se debe \ninferir que, para tal fin solo deba ser actualizada la cifra de compensación, pues esto no fue propuesto \nen el plan ni quedó establecido en el Auto 1305 de 2018. \nIgualmente, debe resaltarse que en cada caso debe realizarse la evaluación de la propuesta de \ncompensación teniendo en cuenta los criterios específicos respecto al DÓNDE y CÓMO compensar, \nasí como la pertinencia de las acciones a desarrollar frente a las condiciones de las áreas \npropuestas. Así las cosas, la Sociedad debe presentar una propuesta específica de compensación \npor cambio de uso del suelo y afectación al medio biótico producto de las intervenciones generadas \ndurante la construcción del campo Dina Cretáceos. \nEn ese sentido, el plan vigente y actualmente aprobado cobija específicamente lo que refiere el \nradicado ANLA 2017057866-1-000 del 28 de julio de 2017 (compensación de los campos Dina Norte \ny Loma Larga) teniendo en cuenta, además, lo que se indica en el artículo primero del Auto 1305 de \n2018, y es que, la aprobación se dio a la propuesta presentada en ese radicado particular mas no \nfue la aprobación del plan de compensación para la totalidad del proyecto y todos los “Campos Huila \nNorte”. Es por lo anterior que el plan de compensación vigente es exclusivo para los campos Dina \nNorte y Loma Larga.\n\nResolución No. 000220       Del 14 FEB. 2024          Hoja No. 31 de 40\n“POR LA CUAL SE RESUELVE UN RECURSO DE REPOSICIÓN”\nPágina 31 de 40\nAhora bien, ante el reporte de nuevas áreas intervenidas en el campo Dina Cretáceos, realizado por \nla Sociedad (de manera posterior a la ejecutoria del Auto 1305 de 2018), en el Auto 5544 del 22 de \njulio de 2021 se requirió por parte de esta Autoridad a la Sociedad, información de la propuesta \nespecifica de compensación por las intervenciones asociadas al mencionado Campo, la cual debió \nser sujeta a evaluación y pronunciamiento por parte de esta Autoridad con el fin de verificar si con \nesta se da cumplimiento a la obligación, motivo por el cual, fue sometida al análisis bajo los criterios \npertinentes para concluir sobre su viabilidad.\nPor otra parte, antes de entrar en detalle sobre los criterios que llevaron a esta Autoridad a la decisión \nfinal, es preciso indicar que la obligación de compensación impuesta en el artículo noveno de la \nResolución 455 del 15 de mayo de 2013 no estableció el tipo de acciones que podrían implementarse \npara su cumplimiento, como puede detallarse a continuación:\n“ARTÍCULO NOVENO. - Establecer medida de compensación a la empresa ECOPETROL \nS.A. por cambio de uso del suelo y afectación al medio biótico, en razón del Proyecto, en una \nrelación 1:2 (por cada hectárea intervenida, dos compensadas) sin perjuicio del cumplimiento \nde las compensaciones que debe hacer por aprovechamiento forestal. En el término de seis \n(6) meses, contados a partir de ejecutoria de este acto administrativo, la Empresa deberá \npresentar un plan de compensación para la respectiva evaluación y pronunciamiento de esta \nAutoridad.”\nNo obstante, debe tenerse en cuenta que, el Plan de Manejo Ambiental del proyecto si lo especificó \nen su Ficha 7.9.5 Compensación por afectación a la cobertura vegetal y uso del suelo (aprobada en \nel artículo tercero de la Resolución 455 del 15 de mayo de 2013) en la que se disponen los siguientes \ntipos de actividades para dar cumplimiento a la medida:\n•\nReforestación de áreas degradadas y con aptitud forestal.\n•\nEnriquecimiento de bosque ripario. \n•\nCompra de predios en áreas sensibles y ambientalmente estratégicos.\nDebe aclararse que mediante radicado 4120-E1-1703 del 17 de enero de 2014 la Sociedad presentó \nla ficha 7.9.5 ajustada, en cumplimiento al Artículo Cuarto de la Resolución 0455 del 15 de mayo de \n2013 en la cual se reitera que las acciones para el cumplimiento corresponden a las nombradas en \nel párrafo anterior y en la cual no se especificó que se realizaría como actividad un proyecto de uso \nsostenible, o que este por sí solo daría cumplimiento a la obligación. \nAsí las cosas, una vez evaluado, se encontró que el plan de compensación presentado en el Anexo \n12 del Informe de Cumplimento Ambiental-ICA No. 13 (radicado ANLA 2022108696-1-000 del 31 de \nmayo de 2022), que atiende la compensación especifica por la intervención generada en el Campo \nDina Cretáceos, no está orientado conforme los lineamientos de la Ficha 7.9.5, del plan de manejo \ndel proyecto, motivo por el cual, en la evaluación que realizó esta Autoridad se resolvió rechazar el \nplan de compensación por cambio de uso del suelo y afectación al medio biótico por los Clúster 1, \n2, 3 y 4 del campo Dina Cretáceos, por tanto, la Sociedad si así lo desea, podrá presentar una nueva \npropuesta de compensación que dé cumplimiento a lo dispuesto en la ficha 7.9.5, del plan de manejo \nambiental del proyecto. \nEn ese sentido, con la decisión no se está restringiendo el desarrollo de los Sistemas Agroforestales \nsino que se insta a la Sociedad a que, si así lo dispone, rehaga la propuesta para que se incorporen \nacciones de preservación y/o restauración mediante reforestación, enriquecimiento y/o compra de \npredios, las cuales a su vez constituyan el eje fundamental del plan evitando que el mismo recaiga \núnicamente o en mayor medida sobre el proyecto agroforestal o que presente una propuesta que \natienda estas consideraciones. \n\nResolución No. 000220       Del 14 FEB. 2024          Hoja No. 32 de 40\n“POR LA CUAL SE RESUELVE UN RECURSO DE REPOSICIÓN”\nPágina 32 de 40\nLo anterior en cumplimiento a lo dispuesto en la ficha 7.9.5 del Plan de Manejo Ambiental, tal como \nse indicó en el Concepto Técnico 5682 del 6 de septiembre de 2023:\n“(…) Dicho esto, la compensación debe formularse bajo las líneas que establece la Ficha 7.9.5 \ny no ampararse en la propuesta de compensación que se aprobó en el Auto 1305 del 28 de \nmarzo de 2018 que como se mencionó previamente, aplica particularmente para la \ncompensación de las 27,3566 ha por la intervención en los campos Dina Norte y Loma Larga.\n(…)\n…Debe reconocerse que el enfoque principal que debe tener la compensación es lograr la \nconservación a través de acciones de preservación y/o restauración, de esta manera, las \nacciones de uso sostenible deben enmarcarse como herramienta de manejo del paisaje, es \ndecir, debe hacer parte de un mosaico que constituya o mejore el hábitat e incremente la \nconectividad funcional.\nBajo la estructura de las herramientas de manejo del paisaje, los remanentes naturales son el \nprincipal objetivo de manejo, por lo cual las acciones deben enfocarse en lograr su ampliación \no su enriquecimiento, entendiendo que en estás [SIC] áreas es donde está el potencial de \nmantener la biodiversidad. Otro aspecto que debe contemplarse es que la conectividad \necológica es la característica del paisaje que se debe promover a partir del mantenimiento o \nla restauración de corredores de hábitat a través del manejo de los sistemas productivos, como \nlo son los sistemas agroforestales.\nTeniendo en cuenta estas premisas, el abordaje de la conservación en la compensación debe \ndarle mayor relevancia a la preservación y a la restauración para el establecimiento de áreas \ncontinuas de hábitat natural, que no se logra con el arreglo de siembra que establecen los \nsistemas agroforestales.\nAhora bien, es importante precisar que, en el marco de los acuerdos de conservación \nplanteados por la Sociedad en la propuesta, se debe garantizar la conservación de unas áreas \ncon connotación ecosistémica relevante; en donde el titular del instrumento, pueda ofrecer al \npropietario del predio la implementación de un Sistema Agroforestal (SAF) como incentivo por \nel ejercicio de la conservación y/o preservación de estos sitios, de este modo, es a través de \nla conservación de estas áreas que se busca dar cumplimiento a la medida, siendo los SAF \nun estímulo, sin que estos sean el fin”\n En virtud de esto, las obligaciones de compensación que están pendientes por aprobar, \nincluida la de 3,814 ha y las que surjan en adelante producto de nuevas intervenciones, deben \nformularse basándose en las acciones que establece la Ficha 7.9.5 Compensación por \nafectación a la cobertura vegetal y uso del suelo (aprobada en el artículo tercero de la \nResolución 455 del 15 de mayo de 2013), que dicho sea de paso, debe aclararse que no ha \nsido modificada o reemplazada por lo establecido en el Auto 1305 del 28 de marzo de 2018, \ny las acciones de uso sostenible a través de sistemas agroforestales puede considerarse como \nuna acción que se ejecute como una herramienta de manejo del paisaje, es decir, que se \nintegre en un proyecto donde prevalezcan de acciones de preservación y restauración, \nconformando y aumentando el hábitat natural.”\nAhora bien, respecto a la consideración presentada por la Sociedad en relación con los recursos \ninvertidos en la propuesta de compensación que fue rechazada por esta Autoridad mediante el \nartículo tercero de la Resolución 2606 del 10 de noviembre del 2023:\n“Ecopetrol realizó una serie de actividades que requirieron de personal, logística e inversión \nde recursos económicos, para el proceso de presentación de los predios, proceso en el cual \n\nResolución No. 000220       Del 14 FEB. 2024          Hoja No. 33 de 40\n“POR LA CUAL SE RESUELVE UN RECURSO DE REPOSICIÓN”\nPágina 33 de 40\nrealizó el proceso de información y socialización con la comunidad, visitas de campo para \nvaloración y selección de predios y levantamiento de información requerida por la Autoridad y \nreversar la compensación generaría Perdida de recursos económicos empleados en la \ninformación y socialización con la comunidad, Perdida de recursos económicos empleados en \nlas visitas de campo y documentación de la caracterización biótica, física y social, afectación \nen la Imagen de ECOPETROL S.A. con la comunidad y los propietarios de los predios \nparticipantes, afectando las relaciones con la comunidad y el buen nombre de la sociedad” \nSe aclara a la Sociedad que, las actividades de compensación que se ejecuten deben realizarse en \náreas y acciones previamente aprobadas, de lo contrario, se deberá asumir el riesgo de perder los \nesfuerzos y los recursos ante cualquier situación o circunstancia que impida reconocerlos como parte \ndel cumplimiento de la obligación de compensación. Así mismo, frente a las propuestas o planes \npresentados, la Autoridad Nacional de Licencias Ambientales, debe en el marco de sus funciones, \nevaluar la viabilidad de estas y emitir pronunciamiento al respecto conforme lo estipulado en la \nnormativa vigente; por tanto, los recursos económicos invertidos en la propuesta por parte de la \nSociedad no constituyen una determinante para los resultados de la evaluación de esta.\nEn conclusión, se mantiene la decisión de no aceptar el plan de compensación por cambio de uso \ndel suelo y afectación al medio biótico presentado mediante el radicado ANLA 2022108696-1-000 \ndel 31 de mayo de 2022, pues más allá de estar amparada en el plan aprobado en el Auto 1305 de \n2018, se encontró que la propuesta no estaba cumpliendo con el PMA y consecuencia debe \nreenfocarse de acuerdo con las consideraciones realizadas en el Concepto Técnico 5682 del 6 de \nseptiembre de 2023 acogido por la Resolución 2606 del 10 de noviembre de 2023. \nAsí las cosas, la Sociedad deberá presentar ante esta Autoridad Nacional para su evaluación y \naprobación, una nueva propuesta de compensación por cambio de uso del suelo y afectación al \nmedio biótico producto de las intervenciones generadas durante la construcción del campo Dina \nCretáceo. Por tanto, se confirma el artículo tercero de la Resolución 2606 del 10 de noviembre de \n2023.\n(…)”\nDicho lo anterior y frente a lo expuesto por la recurrente, con relación a los principios \ngenerales del Derecho de acuerdo con lo señalado por el tratadista Libardo Rodríguez1, en \nsu escrito Derecho Administrativo General y Colombiano se menciona lo siguiente:\nEl principio de legalidad (arts. 6 y 121). “En el derecho administrativo, este principio, consiste en \nque la administración está sujeta en su actividad al ordenamiento jurídico, es decir que todos los \nactos administrativos y actuaciones que realice deben respetar las normas jurídicas superiores”.\nEl principio de la tutela judicial efectiva. (art. 29) “En virtud de este principio, el ordenamiento \njurídico debe garantizar el derecho el derecho de acceder a la administración de justicia para obtener \nuna decisión en derecho, a un debido proceso y a que una vez dictada la decisión, la misma sea \nejecutada y tenga plena efectividad”.\nEl principio de la buena fe (art 83). “Este principio se traduce en el deber, tanto para las \nautoridades administrativas como para los particulares que se relacionan con ellas, de actuar con \nhonestidad, corrección fidelidad y lealtad, esto es, de conformidad con lo que podría esperarse de \nuna persona que goza de los citados atributos, de tal manera que se garantice la confianza, la \nseguridad y la credibilidad a la palabra dada”.  (Negrita y Subrayado fuera de texto) \n1 Rodríguez Ramírez Libardo, Derecho Administrativo General y Colombiano., Editorial Temis 2017, págs. 98-101\n\nResolución No. 000220       Del 14 FEB. 2024          Hoja No. 34 de 40\n“POR LA CUAL SE RESUELVE UN RECURSO DE REPOSICIÓN”\nPágina 34 de 40\nLos principios de la función administrativa (art. 209). “De acuerdo con esta norma constitucional \nejercicio de la función administrativa debe desarrollarse de conformidad con los principios de \nigualdad, moralidad, eficacia, economía, celeridad, imparcialidad y publicidad, los cuales son \ndesarrollados por las leyes expedidas para los diferentes sectores de la actividad administrativa”. \nLos principios de origen jurisprudencial: De otra parte, también dentro del marco de las \ncaracterísticas generales del derecho administrativo colombiano, en particular, en relación con la \nimportancia de la jurisprudencia en su construcción, debe hacerse notar que, además de los \nprincipios generales del derecho que han sido consagrados expresamente en nomas políticas \nexisten otros que se encuentran implícitos dentro de las normas de derecho positivo o que surgen \nde la naturaleza misma y razón de ser del derecho administrativo, Se puede  afirmar que estos \nprincipios realmente existen en el derecho administrativo colombiano en la medida en que han sido \nreconocidos por la jurisprudencia. \nAsí por ejemplo, reconocidos por la jurisprudencia administrativa y constitucional \nencontramos entre otros, (…) el principio de venire contra factum proprium non valet \n(prohibición de volver contra el acto propio)2 y el principio de confianza legítima3.  \n(Negrita y Subrayado fuera de texto) \nAdicional a lo anterior, es de precisar lo dispuesto por la Ley 1437 del 18 de enero de 2011 \nque establece: \n“ARTÍCULO 3o. PRINCIPIOS. Todas las autoridades deberán interpretar y aplicar las \ndisposiciones que regulan las actuaciones y procedimientos administrativos a la luz de los \nprincipios consagrados en la Constitución Política, en la Parte Primera de este Código y en las \nleyes especiales. Las actuaciones administrativas se desarrollarán, especialmente, con arreglo a \nlos principios del debido proceso, igualdad, imparcialidad, buena fe, moralidad, participación, \nresponsabilidad, transparencia, publicidad, coordinación, eficacia, economía y celeridad. 1. En \nvirtud del principio del debido proceso, las actuaciones administrativas se adelantarán de \nconformidad con las normas de procedimiento y competencia establecidas en la Constitución y la \nley, con plena garantía de los derechos de representación, defensa y contradicción.”\nAhora bien, es pertinente tener en cuenta que el principio de seguridad jurídica, conforme \nlo señaló la Corte Constitucional en la sentencia C-250/12, supone una garantía de certeza \nrespecto de las normas que regulan una situación jurídica concreta, esto es, la existencia \nde términos precisos que deben ser considerados por la administración o el juez según sea \nel caso, al adoptar sus decisiones, los cuales fijan condiciones de estabilidad respecto de \nlos cambios normativos que se suceden en el futuro frente a situaciones particulares.\nPor otro lado, el principio de confianza legítima tiene su génesis en el artículo 83 de la \nConstitución Política, que consagra:\n“Artículo 83. Las actuaciones de los particulares y de las autoridades públicas deberán ceñirse \na los postulados de la buena fe, la cual se presumirá en todas las gestiones que aquellos \nadelanten ante éstas.”\n2 Vease C:E., sents. 16 mayo 1991, S3a, exp. 5.931 y 26 de abril 2006, S3a, exp 16.041 y Corte Const., sents T-295 de 1999 \ny T-793 de 2004. \n3 Vease C:E., sent, 5 dciembre 2005, S3a, exp. 12158, y Corte Const., SU-360 de 1999. \n\nResolución No. 000220       Del 14 FEB. 2024          Hoja No. 35 de 40\n“POR LA CUAL SE RESUELVE UN RECURSO DE REPOSICIÓN”\nPágina 35 de 40\nFrente a la vulneración al principio de la confianza legítima, en el que a juicio de la \nrecurrente, incurre la Autoridad Nacional, se considera pertinente destacar que este \nprincipio debe entenderse como una expresión del principio de buena fe, tal como lo trae \nla Carta Política en el artículo antes citado, en virtud del cual las autoridades públicas están \nobligadas a respetar las expectativas jurídicas y legítimas creadas a los particulares en las \ndiferentes actuaciones surtidas, lo que implica que la Administración, una vez creadas \nexpectativas favorables a los administrados, no pueden de manera sorpresiva eliminar esas \ncondiciones afectando de forma intempestiva sus derechos. \nEn tal sentido, el alegado principio propugna por la edificación de un ambiente de \ntranquilidad en las relaciones que construyen los asociados frente a las Autoridades \npúblicas o los particulares, de tal forma que puedan esperar, de buena fe, que sus \nactuaciones no sean variadas de manera abrupta a menos de que prime un fin \nconstitucionalmente legítimo.\nAsí, en el marco de las relaciones entre la Administración y los administrados, la doctrina \nha definido la confianza legítima como un valor ético que integra la buena fe y que \ncomprende “[L]a necesidad de una conducta leal, honesta, aquella conducta que, según la \nestimación de la gente, puede esperarse de una persona.” Así mismo, “La aplicación del principio de \nla buena fe permitirá al administrado recobrar la confianza en que la administración no va a exigirle \nmás de lo que estrictamente sea necesario para la realización de los fines públicos que en cada caso \nconcreto persiga. Y en que no le va a ser exigido en su lugar, en el momento ni en la forma más \ninadecuados, en atención a sus circunstancias personales y sociales, y a las propias necesidades \npúblicas.”\nEn ese orden de ideas, el principio de confianza legítima se presenta como la expectativa \ninnegable de que una situación jurídica abordada de cierta forma en el pasado no sea \ntratada de modo extremadamente desigual en otro periodo, salvo que exista una causa \nconstitucionalmente aceptable que legitime su variación. En este sentido, la Corte \nConstitucional4, igualmente ha sostenido que:\n“[E]l administrado no es titular de un derecho adquirido, sino que simplemente tiene una mera \nexpectativa en que una determinada situación de hecho o regulación jurídica no serán \nmodificadas intempestivamente, y en consecuencia su situación jurídica puede ser modificada \npor la Administración.” (Subrayado fuera del texto)\nPor lo tanto, el principio de confianza legítima le exige a la Administración el respeto por las \nnormas y reglamentos previamente establecidos en interés de los ciudadanos que \nconforman el Estado Social de Derecho, toda vez que el fundamento consolidado de la \njusticia es la buena fe; esto es, la fidelidad de los términos que integran las decisiones \nadoptadas por la Administración en sus diferentes actuaciones.\nIgualmente, es del caso anotar que el derecho5 administrativo colombiano ha considerado \nque para la consolidación de la confianza legítima que se debe realizar el análisis de este \ndesde la óptica de cuatro elementos que permiten verificar si este principio pudo verse \nvulnerado o no con el actuar de la entidad. Tales elementos son: \n4 Sentencia C-4352 de 2010, Expediente D-7946\n5 Mesa Valencia, Andrés Fernando. “El principio de la fe: el acto propio y la confianza legítima.” Facultad de Derecho y Ciencias \nPolíticas – Universidad de Antioquia, págs. 41 y 42.\n\nResolución No. 000220       Del 14 FEB. 2024          Hoja No. 36 de 40\n“POR LA CUAL SE RESUELVE UN RECURSO DE REPOSICIÓN”\nPágina 36 de 40\ni. La existencia de una relación jurídica. Es decir, la actuación administrativa \nconsolidada debe surtir plenos efectos jurídicos en el mundo del derecho; es decir, \nel acto administrativo emanado de la Administración debe nacer a la vida jurídica.\nii. La existencia de una palabra dada. Esta es la base sobre la cual se construye la \nconfianza legítima; se exige entonces que ella tenga existencia cierta en el \nordenamiento jurídico, que no tenga vigencia temporal y que exista identidad entre \nlos destinatarios de la palabra previa y la posteriormente emitida.\niii. La conformación de la palabra dada con actos posteriores armónicos y \ncoherentes. La confianza del particular surge con ocasión del nacimiento en el \nmundo jurídico de una palabra dada o promesa de la Administración, pero se \nfortalece y arraiga con la cadena de conductas posteriores asumidas por ésta, toda \nvez que estas vayan orientadas a fortalecer y desarrollar la palabra emitida \npreviamente, de tal forma que sin la existencia de dichos actos posteriores \narmónicos y coherentes, la promesa dada previamente pierde su vocación de \nconsolidación de la confianza legítima. \nAl respecto, la Corte Constitucional ha sostenido que los principios de buena fe y \nconfianza legítima les imponen a las Autoridades “[E]l deber de ser coherentes en sus \nactuaciones y respetar los compromisos adquiridos en sus acuerdos y convenios”6 \niv. La actuación diligente del interesado. La carga de diligencia impuesta al particular \nes el último elemento necesario para la consolidación de la confianza legítima, toda \nvez que esta carga hace alusión al actuar diligente del administrado, el cual pese a \nhaber obrado con prudencia no le fue posible conocer el hecho jurídico que defraudó \nla confianza depositada por él.\nDe esta manera, siempre que el administrado pretenda invocar la protección del principio \nde la confianza legítima, deberá probar que actuó con la diligencia según el grado o la \nintensidad que se le exija con ocasión del rol que desempeñe. \nAsí las cosas, para que el particular pueda ser cobijado por la protección del principio en \nmención, se debe acreditar que el hecho o la circunstancia es atribuible al Estado o a la \nAdministración y contraría la injerencia razonable, justificada y confiada de la estabilidad, \nperdurabilidad, vigencia o mantenimiento de una situación jurídica plenamente consolidada \ny efectiva.\nConforme con lo anterior, se señala que los argumentos esgrimidos por la recurrente sobre \ndicho precepto Constitucional no se predica para el caso en concreto pues la Autoridad \nNacional no ha quebrantado o modificado los Actos Administrativos antepuestos, por el \ncontrario, como ya se indicó de manera previa, la finalidad de la Resolución 2606 del 10 de \nnoviembre de 2023, es señalar lo ya dicho en actos administrativos anteriores y que se \nencuentran debidamente fundamentados con los argumentos técnicos y jurídicos \nnecesarios y en caminados al cumplimiento de la obligación de Compensación de acuerdo \ncon la normativa que la regula. \n6 Corte Constitucional. Sentencia T-642/04 [Cita de la Sentencia T-929 de 2011].\n\nResolución No. 000220       Del 14 FEB. 2024          Hoja No. 37 de 40\n“POR LA CUAL SE RESUELVE UN RECURSO DE REPOSICIÓN”\nPágina 37 de 40\nSumado a lo anterior, la Autoridad Nacional considera que el principio de confianza legítima, \nseguridad jurídica, legalidad y de buena fe no han sido vulnerados, pues la Autoridad no ha \ndesplegado comportamiento alguno fuera del estricto cumplimiento de las disposiciones \nlegales de carácter general para la evaluación del Plan de Compensación por cambio de \nuso del suelo y afectación al medio biótico presentado a través de la comunicación con \nradicación 2022108696-1-000 del 31 de mayo de 2022.\nUna vez evaluados los argumentos expuestos por la Sociedad recurrente y en concordancia \ncon las consideraciones señaladas en el Concepto Técnico 131 del 18 de enero de 2024, \nla Autoridad Nacional confirmará el contenido del artículo tercero de la Resolución 2606 del \n10 de noviembre de 2023, tal como se reflejará en la parte resolutiva del presente acto \nadministrativo.\nRESUELVE\nARTÍCULO PRIMERO. Modificar el contenido del artículo primero de la Resolución 2606 \ndel 10 de noviembre de 2023, de conformidad con lo expuesto en la parte motiva del \npresente acto administrativo, el cual quedará de la siguiente manera:\n“ARTÍCULO PRIMERO. MODIFICAR el artículo primero de la Resolución 1410 del 11 de \nagosto de 2021, en mérito de lo expuesto en la parte motiva del presente acto administrativo, \nel cual quedará de la siguiente manera:\n“ARTÍCULO PRIMERO. Aprobar e implementar el Plan de Compensación por cambio \nde uso del suelo y afectación al medio biótico en los siguientes predios, los cuales deben \nadicionarse a los previamente aprobados:\n \nPredio\nMunicipio\nVereda\nÁrea (ha)\n1\nEl Cují\nDindal Alto\n1\n2\nEl Refugio\nDindal Alto\n1\n3\nLote 1 (Luis Ignacio Charry)\nDindal Alto\n1\n4\nMirador\nDindal Alto\n1\n5\nLote 1-La Ponderosa\nDindal Alto\n2\n6\nEl Limón\nDindal Alto\n2\n7\nLa Sombra\nAipe\nDindal Alto\n2\n8\nLote 66\nHato Nuevo\n2\n9\nLa Esperanza (Juan José \nMonje Valdés)\nHato Nuevo\n2\n10\nLote 4 Las Coloradas\nPolonia\n2\n11\nLa Pista B\nPolonia\n1\n12\nBuenos Aires\nVillavieja\nPolonia\n2\n13\nLa \nEsperanza \n(Armando \nMosquera Trujillo)\nTello\nMesa Redonda\n2\nTOTAL\n21\nPARÁGRAFO PRIMERO. En los predios antes aprobados se deberá ejecutar la \ncompensación de acuerdo con lo establecido en la Resolución 1410 del 11 de agosto \nde 2021.\nPARÁGRAFO SEGUNDO. La sociedad ECOPETROL S.A., deberá ajustar la zona de \nintervención de los predios predios Lote 1 (Luis Ignacio Charry), Buenos Aires, La \nEsperanza (Juan José Monje Valdez) para que no se incluya en la ronda de las \n\nResolución No. 000220       Del 14 FEB. 2024          Hoja No. 38 de 40\n“POR LA CUAL SE RESUELVE UN RECURSO DE REPOSICIÓN”\nPágina 38 de 40\nquebradas y ríos que los colinda.” (…)” \nARTÍCULO SEGUNDO. Modificar de oficio el contenido del artículo segundo de la \nResolución 2606 del 10 de noviembre de 2023, de conformidad con lo expuesto en la parte \nmotiva del presente acto administrativo, el cual quedará de la siguiente manera:\n“ARTÍCULO SEGUNDO. ACEPTAR el desistimiento de los siguientes predios aprobados en \nel artículo primero de la Resolución 1410 del 11 de agosto de 2021, en mérito de lo expuesto \nen la parte motiva del presente acto administrativo:\nPredio\nMunicipio\nÁrea\nLa Arcadia\nAipe\n1 hectárea\nNuevo predio (cambio de Belén y el \nBosque)\nAipe\n1 hectárea\nLos Robles\nAipe\n3 hectáreas\nMonte Zión\nAipe\n1 hectárea\nLote 5 Guadalupe\nAipe\n1 hectárea\nEl Igua\nAipe\n1 hectárea\nEl Arrayan\nAipe\n2 hectáreas\nLa Sabana\nTello\n2 hectáreas\nLa Caraguaja\nTello\n2 hectáreas\nPredio Villa Sofía (Nuevo Sr. Álvaro \nSalano)\nVillavieja\n1,5 hectárea\nVilla Alejandro\nVillavieja\n0,5 hectárea\nEl Dinde\nVillavieja\n1 hectárea\nSan José 1\nVillavieja\n1 hectárea\nBella Vista 1\nVillavieja\n2 hectáreas\nLa Esperanza (Mily Yojana Blanco)\nVillavieja\n1 hectárea\n (…)” \nARTÍCULO TERCERO. Confirmar el contenido del artículo tercero de la Resolución 2606 \ndel 10 de noviembre de 2023, de conformidad con lo expuesto en la parte motiva del \npresente acto administrativo.\nARTÍCULO CUARTO. Los demás términos, condiciones y obligaciones establecidas en la \nResolución 2606 del 10 de noviembre de 2023, que no fueron objeto de pronunciamiento \nen el presente acto administrativo, continúan vigentes y exigibles en cualquier momento\nARTÍCULO QUINTO. Notificar el presente acto administrativo al representante legal, o al \napoderado debidamente constituido o a la persona debidamente autorizada de la Sociedad \nECOPETROL S.A., o a quien haga sus veces, de conformidad con lo dispuesto en los \nartículos 67 y 69 del Código de Procedimiento Administrativo y de lo Contencioso \nAdministrativo. \nPARÁGRAFO. En el evento en que el titular de la licencia o el permiso, según el caso, sea \nuna persona natural que se acoja al proceso de insolvencia regulado por las normas \nvigentes, o se trate de una sociedad comercial o de una sucursal de sociedad extranjera \nque entre en proceso de disolución o régimen de insolvencia empresarial o liquidación \nregulados por las normas vigentes, informará inmediatamente de esta situación a esta \n\nResolución No. 000220       Del 14 FEB. 2024          Hoja No. 39 de 40\n“POR LA CUAL SE RESUELVE UN RECURSO DE REPOSICIÓN”\nPágina 39 de 40\nAutoridad, con fundamento, entre otros, en los artículos 8, 58, 79, 80, 81, 95 numeral 8 de \nla Constitución Política de 1991, en la Ley 43 de 1990, en la Ley 222 de 1995, en la Ley \n1333 de 2009 y demás normas vigentes y jurisprudencia aplicable. \nAdicional a la obligación de informar a esta Autoridad de tal situación, el titular de la licencia \no permiso aprovisionará contablemente las obligaciones contingentes que se deriven de la \nexistencia de un procedimiento ambiental sancionatorio conforme con el artículo 40 de la \nLey 1333 de 2009 o la norma que la adicione, modifique o derogue. \nARTÍCULO SEXTO. Por la Autoridad Nacional de Licencias Ambientales (ANLA), \ncomunicar el contenido del presente acto administrativo a la Corporación Autónoma \nRegional del Alto Magdalena CAM y los municipios de Neiva, Aipe, Palermo, Tello y \nVillavieja (Huila) para su conocimiento y fines pertinentes.\nARTÍCULO SÉPTIMO. Publicar la presente Resolución en la Gaceta Ambiental de la \nAutoridad Nacional de Licencias Ambientales (ANLA) de conformidad con lo señalado en el \nartículo 71 de la Ley 99 del 22 de diciembre de 1993.\nARTÍCULO OCTAVO. Contra el presente acto administrativo no procede recurso alguno, \nde conformidad con lo establecido en el artículo 87 del Código de Procedimiento \nAdministrativo y de lo Contencioso Administrativo.\nNOTIFÍQUESE, COMUNÍQUESE, PUBLÍQUESE Y CÚMPLASE\nDado en Bogotá D.C., a los 14 FEB. 2024\nEDILBERTO PENARANDA CORREA\nASESOR\nERIKA LORENA PARRADO CEPEDA\nPROFESIONAL ESPECIALIZADO\nANDREA DEL PILAR SANABRIA DEL RIO\nCONTRATISTA\nExpediente No. LAM2307\nConcepto Técnico N° 131 del 18 de enero de 2024\nFecha: 9 de febrero de 2024\n\nResolución No. 000220       Del 14 FEB. 2024          Hoja No. 40 de 40\n“POR LA CUAL SE RESUELVE UN RECURSO DE REPOSICIÓN”\nPágina 40 de 40\nProceso No.: 20241000002204\nNota: Este es un documento electrónico generado desde los Sistemas de Información de la ANLA. El original reposa en los \narchivos digitales de la Entidad\n"
}