{
  "fuente": "ANLA_GACETA",
  "numero_resolución": "RESOLUCIÓN N° 2767",
  "fecha_resolución": "2023-05-30",
  "nombre_proyecto": "proyecto “Reactivación de las actividades que incluye el reentry a los Pozos Hato",
  "ubicación": "departamento del Huila.",
  "empresa": "el Consorcio informó a esta Autoridad Nacional sobre la inactividad de las operaciones y los trabajos en el campo Hato Nuevo y dio a conocer el acta de terminación del contrato de producción entre ECOPETROL S.A.",
  "numero_expediente": "LAM3756",
  "radicados": [
    "2021083178",
    "2022194947",
    "20236200224692",
    "2018034372",
    "2023067560"
  ],
  "descripcion": "POR LA CUAL SE RESUELVE UN RECURSO DE REPOSICIÓN INTERPUESTO EN CONTRA DE LA RESOLUCIÓN 1105 DEL 30 DE MAYO DE 2023 Y SE ADOPTAN OTRAS DETERMINACIONES",
  "tipos_infraccion": [
    "Tala o afectación de bosques",
    "Incumplimiento del PMA"
  ],
  "pdf_id": "44825",
  "file_name": "ANLA_44825.pdf",
  "texto_completo": " \nRepública de Colombia \nMinisterio de Ambiente y Desarrollo Sostenible \n \nAUTORIDAD NACIONAL DE LICENCIAS AMBIENTALES \n- ANLA – \nRESOLUCIÓN N° 2767 \n(27 NOV. 2023) \n \nPágina 1 de 26 \n \n“POR LA CUAL SE RESUELVE UN RECURSO DE REPOSICIÓN INTERPUESTO EN \nCONTRA DE LA RESOLUCIÓN 1105 DEL 30 DE MAYO DE 2023 Y SE ADOPTAN \nOTRAS DETERMINACIONES” \n \n \nEL DIRECTOR GENERAL DE LA AUTORIDAD NACIONAL DE LICENCIAS \nAMBIENTALES – ANLA \n \n \nEn uso de sus facultades legales establecidas mediante la Ley 99 de 1993, el Decreto Ley \n3573 del 2011, acorde con lo regulado en el Decreto 1076 del 26 de mayo de 2015, el \nDecreto 376 del 11 de marzo de 2020 y la Resolución 1957 del 5 de noviembre de 2021 \nde la ANLA y la Resolución 1223 del 19 de septiembre de 2022 del Ministerio de \nAmbiente y Desarrollo Sostenible y, \n \nCONSIDERANDO: \n \nQue mediante Resolución 841 del 17 de mayo de 2007, el entonces, Ministerio de Ambiente, \nVivienda y Desarrollo Territorial, hoy Ministerio de Ambiente y Desarrollo Sostenible (en \nadelante el Ministerio) estableció Plan de Manejo Ambiental al CONSORCIO EMPESA NCT \npara el proyecto “Reactivación de las actividades que incluye el reentry a los Pozos Hato \nNuevo 1, Hato Nuevo 2, Hato Nuevo 3 y Polonia 1, localizados dentro del Campo Hato \nNuevo”, ubicado en el municipio de Villavieja, departamento del Huila.  \n \nQue mediante el Auto 923 del 9 de abril de 2013 la Autoridad Nacional de Licencias \nAmbientales – ANLA (en adelante esta Autoridad Nacional), efectuó seguimiento y control \nambiental al proyecto, estableciendo requerimientos relacionados con los soportes del \ncumplimiento al Programa de Gestión Social, la Ficha 7.2.3. Manejo de Fauna, entre otros.  \n \nQue mediante el Auto 00119 del 23 de enero de 2017 esta Autoridad Nacional efectuó \nseguimiento y control ambiental al proyecto, determinando requerimientos relacionados con \nlos soportes de actividades realizadas en cumplimiento de la ficha S-1 Información a la \ncomunidad y la ficha S3- Relaciones con la comunidad, entre otros.  \n \n \n \n\nResolución No. 2767       Del 27 NOV. 2023          Hoja No. 2 de 26 \n \n“Por la cual se resuelve un recurso de reposición interpuesto en contra de la \nResolución 1105 del 30 de mayo de 2023 y se adoptan otras determinaciones” \n \nPágina 2 de 26 \n \nQue mediante Auto 4755 del 13 de agosto de 2018 esta Autoridad Nacional efectuó \nseguimiento y control ambiental y acogió el concepto técnico 2632 del 25 de mayo de 2018.  \n \nQue a través del Auto 11177 del 17 de diciembre de 2019 esta Autoridad Nacional efectuó \nseguimiento y control ambiental y acogió el concepto técnico 5654 del 30 de septiembre de \n2019. \n \nQue mediante el Acta 325 de Reunión de Control y Seguimiento Ambiental de 22 de \nseptiembre de 2020, esta Autoridad Nacional realizó seguimiento y control al proyecto y \nefectuó requerimientos al CONSORCIO EMPESA NCT.  \n \nQue mediante el radicado 2021083178-1-000 del 29 de abril de 2021 el CONSORCIO \nEMPESA NCT presentó ante esta Autoridad Nacional el documento “Plan de Abandono, \nDesmantelamiento y Recuperación Ambiental de los Pozos, Hato Nuevo 1, Hato Nuevo 2, \nHato Nuevo 3 y Polonia 1 del Campo Hato Nuevo en el Municipio de Villavieja, \nDepartamento del Huila”. \n \nQue a través del Acta 252 del 23 de junio de 2021, esta Autoridad Nacional efectuó \nseguimiento y control ambiental al proyecto, acogió Concepto Técnico 3360 del 17 de junio \nde 2021 y realizó requerimientos al CONSORCIO EMPESA NCT relacionados con informar \nsi se presentaron PQRS para los periodos 2018, primer semestre de 2019 y 2020, entre \notros. \n \nQue mediante comunicación con radicado ANLA 2022194947-1-000 del 6 de septiembre \nde 2022, el CONSORCIO EMPESA NCT presentó el documento “Plan de Abandono, \nDesmantelamiento y Recuperación Ambiental de los Pozos, Hato Nuevo 1, Hato Nuevo 2, \nHato Nuevo 3 y Polonia 1 del Campo Hato Nuevo en el Municipio de Villavieja, \nDepartamento del Huila” ajustado. \n \nQue a través del Acta 818 del 21 de noviembre de 2022 esta Autoridad Nacional efectuó \nseguimiento y control ambiental y acogió el Concepto Técnico 7130 del 21 de noviembre \nde 2022. \n \nQue mediante Resolución 1105 del 30 de mayo de 2023, esta Autoridad Nacional consideró \najustar la propuesta presentada mediante el documento “Plan de Abandono, \nDesmantelamiento y Recuperación Ambiental de los Pozos, Hato Nuevo 1, Hato Nuevo 2, \nHato Nuevo 3 y Polonia 1 del Campo Hato Nuevo en el municipio de Villavieja, \ndepartamento del Huila” y adoptó otras determinaciones. \n \nQue a través de comunicación con radicado ANLA 20236200224692 del 14 de junio de \n2023 el apoderado del CONSORCIO EMPESA NCT, presentó el recurso de reposición en \ncontra de la Resolución 1105 del 30 de mayo de 2023. \n \nQue la Autoridad Nacional de Licencias Ambientales - ANLA, efectuó una revisión de los \ndocumentos obrantes en el expediente LAM3756 y con base en el resultado de la citada \nrevisión, elaboró el Concepto Técnico 4720 del 31 de julio de 2023, el cual sirve de soporte \ny fundamento a las disposiciones que se incluyen en el presente acto administrativo. \n\nResolución No. 2767       Del 27 NOV. 2023          Hoja No. 3 de 26 \n \n“Por la cual se resuelve un recurso de reposición interpuesto en contra de la \nResolución 1105 del 30 de mayo de 2023 y se adoptan otras determinaciones” \n \nPágina 3 de 26 \n \n \nCOMPETENCIA DE LA AUTORIDAD NACIONAL DE LICENCIAS AMBIENTALES. \n \nMediante el Decreto-ley 3570 del 27 de septiembre de 2011, el Gobierno Nacional, en uso \nde las facultades extraordinarias conferidas mediante la Ley 1444 de 2011, creó el \nMinisterio de Ambiente y Desarrollo Sostenible y de conformidad con lo preceptuado en su \nartículo 38, todas las referencias que hagan las disposiciones legales y reglamentarias \nvigentes en materia ambiental al Ministerio de Ambiente, Vivienda y Desarrollo Territorial \ndeben entenderse referidas al Ministerio de Ambiente y Desarrollo Sostenible, si se \nrelacionan con las funciones asignadas en dicho Decreto a este último.  \n \nDe acuerdo con lo establecido en el parágrafo del artículo 2.2.2.3.9.1 del Decreto Único \nReglamentario Sector Ambiental 1076 de 2015, “La autoridad ambiental que otorgó la \nlicencia ambiental o estableció el plan de manejo ambiental respectivo, será la encargada \nde efectuar el control y seguimiento a los proyectos, obras o actividades autorizadas.”  \n \nPor medio del Decreto-ley 3573 del 27 de septiembre de 2011, el Gobierno Nacional, en \nuso de las facultades extraordinarias conferidas mediante la Ley 1444 de 2011, creó la \nAutoridad Nacional de Licencias Ambientales – ANLA, como entidad encargada de que los \nproyectos, obras o actividades sujetos a licenciamiento, permiso o trámite ambiental \ncumplan con la normativa ambiental, de tal manera que contribuyan al desarrollo sostenible \nambiental del país.  \n \nEl Decreto 376 del 11 de marzo de 2020, “Por el cual se modifica la estructura de la \nAutoridad Nacional de Licencias Ambientales ANLA”, modificó la estructura de la Entidad, \ncorrespondiéndole al Despacho de la Dirección General de esta Entidad la suscripción del \npresente acto administrativo, conforme se establece en el artículo segundo del precitado \nDecreto.  \n \nAunado a lo anterior, teniendo en cuenta lo dispuesto en la Resolución 1957 del 5 de \nnoviembre de 2021, “Por la cual se adopta el Manual Específico de Funciones y de \nCompetencias Laborales para los empleos de la planta de personal de la Autoridad \nNacional de Licencias Ambientales - ANLA”, le fue asignada al director general la función \nde suscribir los actos administrativos que otorgan, niegan, modifican, ajustan o declaran la \nterminación de las licencias, permisos y trámites ambientales.  \n \nMediante Resolución 1223 del 19 de septiembre de 2022, la Viceministra encargada del \nDespacho de la Ministra del Ambiente y Desarrollo Sostenible, designó en el empleo de \nDirector General de Unidad Administrativa Código 0015, de la Autoridad Nacional de \nLicencias Ambientales – ANLA, al doctor RODRIGO ELÍAS NEGRETE MONTES, razón por \nla cual es el funcionario competente para suscribir el presente acto administrativo. \n \n \n\nResolución No. 2767       Del 27 NOV. 2023          Hoja No. 4 de 26 \n \n“Por la cual se resuelve un recurso de reposición interpuesto en contra de la \nResolución 1105 del 30 de mayo de 2023 y se adoptan otras determinaciones” \n \nPágina 4 de 26 \n \nFUNDAMENTOS CONSTITUCIONALES Y LEGALES. \n \nEl artículo 8 de la Constitución Política establece que \"Es obligación del Estado y de las \npersonas proteger las riquezas culturales y naturales de la nación\" \n \nLa Constitución Política elevó a rango constitucional la obligación que tiene el Estado de \nproteger el medio ambiente, y el derecho que tienen todos los ciudadanos a gozar de un \nambiente sano y así mismo \"Es deber del Estado proteger la diversidad e integridad del \nambiente, conservar las áreas de especial importancia ecológica y fomentar la educación \npara el logro de estos fines.\" (artículo 79 de la Constitución Política). El medio ambiente es \nun derecho colectivo que debe ser protegido por el Estado, estableciendo todos los \nmecanismos necesarios para su protección. \n \nAdicionalmente, el Estado debe planificar el manejo y aprovechamiento de los recursos \nnaturales para garantizar su desarrollo sostenible, su conservación, restauración o \nsustitución, tal y como lo establece el artículo 80 de la Constitución Política. Al efecto, la \nplanificación se debe realizar utilizando una serie de mecanismos que permitan analizar, \nevaluar y prever unas circunstancias que faciliten la toma de decisión, con el fin de alcanzar \nun objetivo propuesto, en este caso, el Desarrollo Sostenible. \n \nDEL RECURSO DE REPOSICIÓN. \n \nDe acuerdo con la legislación, el recurso de reposición constituye un instrumento legal \nmediante el cual la parte interesada tiene la oportunidad de ejercer el derecho de \ncontrovertir una decisión, para que la administración previa su evaluación, la confirme, \naclare modifique o revoque, previo el lleno de las exigencias legales establecidas para dicho \nefecto.  \n \nFrente al recurso de reposición, ha manifestado la doctrina:  \n \n“El de reposición se ha considerado históricamente como recurso connatural al Estado de \nderecho; en especial al derecho fundamental a la controversia de toda decisión \nadministrativa. Se funda esta tesis en el criterio de que no existe acto administrativo sin \ncontrol. Se trata, pues, del más elemental de todos los recursos para garantizar el principio \nde la contradicción y el debido proceso”1 \n \nEn dicho sentido, la finalidad esencial del recurso de reposición no es otra distinta que \nfacultar para que el funcionario de la administración que tomó una decisión administrativa, \ntenga la oportunidad para enmendar o corregir un error, o los posibles errores que se hayan \npodido presentar en el acto administrativo por él expedido, en ejercicio de sus funciones. \n \n \n1 Santofimio Gamboa Jaime Orlando. Tratado de derecho Administrativo, 4ta edición. Universidad Externado \nde Colombia, 1998, p. 266 \n \n\nResolución No. 2767       Del 27 NOV. 2023          Hoja No. 5 de 26 \n \n“Por la cual se resuelve un recurso de reposición interpuesto en contra de la \nResolución 1105 del 30 de mayo de 2023 y se adoptan otras determinaciones” \n \nPágina 5 de 26 \n \nPROCEDENCIA DEL RECURSO DE REPOSICIÓN.  \n \nEsta Autoridad considera necesario indicar algunos aspectos relacionados con las \nfacultades de las autoridades administrativas en la expedición de los actos administrativos \nmediante los cuales se resuelven recursos contra los actos administrativos. \n \nEl procedimiento, oportunidad y requisitos para la interposición del recurso de reposición se \nencuentra reglado en el Código de Procedimiento Administrativo y de lo Contencioso \nAdministrativo (Ley 1437 de 18 de enero de 2011) en los siguientes artículos: \n \n\"ARTICULO 74. Recursos contra los actos administrativos. Por regla general, contra los \nactos definitivos procederán los siguientes recursos: \n \nEl de reposición, ante quien expidió la decisión, para que la aclare, modifique o revoque. \n \n(…) \n \nARTICULO 76. Oportunidad y presentación. Los recursos de reposición y apelación deberán \ninterponerse por escrito en la diligencia de notificación personal, o dentro de los diez (10) \ndías siguientes a ella, o a la notificación por aviso, o al vencimiento del término de \npublicación, según el caso (…)  \n \nLos recursos se presentarán ante el funcionario que dictó la decisión…” \n \nA su vez, el artículo 77 del precitado Código señala: \n \n\"ARTICULO 77. Requisitos. Por regla general los recursos se interpondrán por escrito que \nno requiere de presentación personal sí quien lo presenta ha sido reconocido en la actuación. \nIgualmente, podrán presentarse por medios electrónicos. \n \nLos recursos deberán reunir, además los siguientes requisitos: \n \n1. Interponerse dentro del plazo legal, por el interesado o su representante o apoderado \ndebidamente constituido. \n2. Sustentarse con expresión concreta de los motivos de inconformidad. \n3. Solicitar y aportar las pruebas que se pretende hacer valer. \n4. Indicar el nombre y la dirección del recurrente, así como la dirección electrónica si desea \nser notificado por este medio. ( ... )” \n \nPor su parte, el artículo 80 del Código de Procedimiento Administrativo y de lo Contencioso \nAdministrativo, determina: \n \n\"ARTÍCULO 80. Decisión de los Recursos. Vencido el periodo probatorio, si a ello hubiere \nlugar, y sin necesidad de acto que así lo declare, deberá proferirse la decisión motivada que \nresuelva el recurso. \n \n\nResolución No. 2767       Del 27 NOV. 2023          Hoja No. 6 de 26 \n \n“Por la cual se resuelve un recurso de reposición interpuesto en contra de la \nResolución 1105 del 30 de mayo de 2023 y se adoptan otras determinaciones” \n \nPágina 6 de 26 \n \nLa decisión resolverá todas las peticiones que hayan sido oportunamente planteadas y las \nque surjan con motivo del recurso.\" \n \nPara el caso concreto que nos ocupa, la Resolución 1105 del 30 de mayo de 2023, es un \nproveído susceptible de ser recurrido, según el artículo 74 de la Ley 1437 de 2011, puesto \nque se trata de un acto definitivo en la medida en que adopta una decisión que manifiesta \nla voluntad del Estado y es generadora de efectos jurídicos que, en los términos del Consejo \nde Estado, tal como lo señaló en sentencia de la Sección Tercera de la Sala de lo \nContencioso Administrativo del 8 de marzo de 2012, se caracteriza por lo siguiente: \n \n“… Por el contrario, los actos definitivos ponen fin de manera perentoria a la actuación \nadministrativa sea de oficio o impulsada a petición de parte, de modo que en ellos se agota \nla actividad de la administración, o tan sólo queda pendiente la ejecución de lo decidido. \nAhora bien, es cierto que los únicos actos susceptibles de la Acción Contenciosa \nAdministrativa son los actos definitivos, es decir que se excluyen los de trámite, pues éstos \nse controlan jurisdiccionalmente como parte integrante del acto definitivo y conjuntamente \ncon éste, es decir de aquel que cierra la actuación administrativa.” \n \nA partir de lo anteriormente expuesto, se procede a revisar si el recurso de reposición \ninterpuesto y que es objeto de este pronunciamiento administrativo, ha cumplido los \nrequisitos legales que lo rigen para efectos de proceder a su decisión de fondo: \n \nEn primera instancia la Resolución 1105 del 30 de mayo de 2023, objeto de censura, fue \nnotificada al CONSORCIO EMPESA NCT, mediante correo electrónico el 31 de mayo de \n2023 y el recurso de reposición se interpuso el 14 de junio de 2023, es decir, dentro del \ntérmino de diez (10) días hábiles siguientes a la fecha de la citada notificación, los cuales \nvencían el 15 de junio de 2023, observando así, el requisito de oportunidad legal para su \ninterposición. \n \nDe igual manera, el recurso de reposición fue interpuesto por el doctor OSCAR FABIÁN \nLÓPEZ FORERO en su calidad de apoderado de la sociedad, quien se encuentra facultado \nsegún los documentos obrantes en el expediente LAM3756, verificándose así, la legitimidad \npor activa para impulsar el presente recurso en representación de la titular de la Licencia \nAmbiental. A su vez, el recurso contiene los motivos de inconformidad y dirección de \nnotificaciones, cumpliéndose así los requisitos expuestos en el artículo 77 de la Ley 1437 \nde 2011.  \n \nA su vez, el artículo tercero de la Ley 1437 de 2011, por la cual se expidió el Código de \nProcedimiento Administrativo y de lo Contencioso Administrativo, establece que las \nactuaciones administrativas se desarrollarán con arreglo a los principios de economía, \nceleridad, eficacia, imparcialidad, publicidad y contradicción. Estos principios, por ser \nprevalentes deben observarse en las actuaciones administrativas que los requieran con las \ncondiciones de forma y fondo, que constituyen verdaderas garantías para los administrados \ny los particulares. \n\nResolución No. 2767       Del 27 NOV. 2023          Hoja No. 7 de 26 \n \n“Por la cual se resuelve un recurso de reposición interpuesto en contra de la \nResolución 1105 del 30 de mayo de 2023 y se adoptan otras determinaciones” \n \nPágina 7 de 26 \n \n \nSiendo ello así, al verificarse el cumplimiento de los requisitos legales establecidos en la \nnormatividad vigente para la procedencia del recurso de reposición, se procederá al análisis \nde fondo de los motivos de inconformidad del recurrente tal y como se expone a \ncontinuación. \n \nSOBRE EL RECURSO DE REPOSICIÓN INTERPUESTO. \n \nA continuación, se realiza el análisis y las consideraciones de la Autoridad Nacional de \nLicencias Ambientales, en respuesta al recurso de reposición presentado por el doctor \nOSCAR FABIÁN LÓPEZ FORERO en su calidad de Representante Legal de la sociedad, \nmediante comunicación con radicado ANLA 20236200224692 de 14 de junio de 2023.  \n \nPara tal efecto, se indicará (con literales), en primer lugar, las disposiciones recurridas; en \nsegundo lugar, la petición elevada por la recurrente; posteriormente, los argumentos o \nmotivos de inconformidad del recurso y seguido ello, de las consideraciones de esta \nAutoridad Nacional frente a cada argumento, con el objeto de adoptar las decisiones de \nfondo.  \n \nA. OBLIGACIÓN RECURRIDA – Artículo primero de la Resolución 1105 del 30 de mayo de \n2023, el cual señala: \n \n“ARTÍCULO \nPRIMERO. \nAjustar \nel \ndocumento \n“PLAN \nDE \nABANDONO, \nDESMANTELAMIENTO Y RECUPERACION AMBIENTAL DE LOS POZOS, HATO NUEVO 1, \nHATO NUEVO 2, HATO NUEVO 3 Y POLONIA 1 DEL CAMPO HATO NUEVO EN EL \nMUNICIPIO DE VILLAVIEJA, DEPARTAMENTO DEL HUILA”, en el sentido de incluir las \nsiguientes obligaciones en las fichas que a continuación se enuncian y de conformidad con lo \nexpuesto en la parte motiva del presente acto administrativo: \n \n1. En la Ficha MA-4- Recuperación ambiental incluir lo siguiente: \n \na. La composición de la plantación debe manejar especies con hábitos de crecimiento \ndiferente logrando establecer estratos similares al ecosistema original. \nb. Las actividades de mantenimiento estarán orientadas al manejo de limpias periódicas, \nfertilización, resiembra y control fitosanitario, programados durante la etapa de \nestablecimiento y no debe ser inferior a tres años. \nc. El cerramiento de las áreas a revegetalizar para garantizar el crecimiento y adecuado \ndesarrollo de las especies. \nd. El porcentaje de supervivencia de las especies vegetales debe ser superior al 90%, en \naras de garantizar la efectividad de la medida. \ne. Los Informes de mantenimiento deben tener una periodicidad semestral. \n \n2. En la Ficha FMS 4 - Manejo de infraestructura y predio, incluir lo siguiente: \n \na. En las acciones a desarrollar: \n \ni. \nEl Consorcio evaluará los impactos (positivos y negativos) asociados a la permanencia \nparcial o total de las infraestructuras que el propietario del predio manifieste su deseo \n\nResolución No. 2767       Del 27 NOV. 2023          Hoja No. 8 de 26 \n \n“Por la cual se resuelve un recurso de reposición interpuesto en contra de la \nResolución 1105 del 30 de mayo de 2023 y se adoptan otras determinaciones” \n \nPágina 8 de 26 \n \nde permanencia, en tanto, puedan generar impactos negativos sobre cualquiera de los \nmedios físico, biótico y/o socioeconómico. \nii. \nEn el caso que el propietario, habiendo conocido todos los posibles impactos asociados \na la permanencia de cada una de las infraestructuras, se mantenga en su deseo de \npermanencia de tales, se debe incluir de manera explícita en la correspondiente acta \nde paz y salvo, la precisión que el Consorcio le dio a conocer todos y cada uno de los \nposibles impactos negativos asociados y que, a partir de la firma del acta, será el \npropietario el responsable por asumir dichos impactos. \n \nb. En los indicadores de seguimiento y monitoreo: El acta de paz y salvo, se presentará \nacompañada del respectivo registro de socialización de los impactos negativos asociados \na la permanencia de infraestructura, presentados al propietario, así como los respectivos \nsoportes que acrediten su titularidad sobre el predio. \n \n3. En la ficha FMS 5 - Programa de seguimiento y monitoreo para el abandono y \ndesmantelamiento, incluir lo siguiente: \n \na. En las estrategias de seguimiento y monitoreo: \n \ni. \nMatriz de seguimiento a respuestas de PQRS \nii. \nMatriz de seguimiento a las capacitaciones realizada al personal vinculado al proyecto. \niii. \nMatriz de seguimiento a las comunicaciones generadas por el proyecto para informar \na comunidades y autoridades municipales y \niv. \nMatriz de seguimiento a las comunicaciones establecidas con los propietarios de los \npredios hasta la firma de los respectivos paz y salvo \n \n4. Incluir dentro del cronograma las acciones de desmantelamiento, revegetalización y \nmonitoreos ambientales para el pozo Hato Nuevo 1. \n \nPARÁGRAFO PRIMERO. El CONSORCIO EMPESA – NCT deberá presentar la anterior \ninformación en el término de seis (6) meses contados a partir de la ejecutoria de este acto \nadministrativo.” \n \nB. PETICIÓN DEL CONSORCIO EMPESA NCT. \n \nSeñala el escrito de recurso: \n “Le solicito comedidamente, se sirva REVOCAR el artículo primero de la Resolución No. \n1105 del 30 de mayo de 2023, mediante la cual se ordena ajustar el documento “PLAN DE \nABANDONO, DESMANTELAMIENTO Y RECUPERACION AMBIENTAL DE LOS POZOS, \nHATO NUEVO 1, HATO NUEVO 2, HATO NUEVO 3 Y POLONIA 1 DEL CAMPO HATO \nNUEVO EN EL MUNICIPIO DE VILLAVIEJA, DEPARTAMENTO DEL HUILA”, y en su lugar \nse tenga en cuenta el documento ya presentado, puesto que cumple con lo requerido por la \nAutoridad.” \n \nC. ARGUMENTOS DEL CONSORCIO EMPESA NCT \n \nSeñala el escrito de recurso: \n\nResolución No. 2767       Del 27 NOV. 2023          Hoja No. 9 de 26 \n \n“Por la cual se resuelve un recurso de reposición interpuesto en contra de la \nResolución 1105 del 30 de mayo de 2023 y se adoptan otras determinaciones” \n \nPágina 9 de 26 \n \n“Sobre el particular nos permitimos señalar que debe desestimarse lo señalado en el artículo \nprimero de la Resolución No. 1105 del 30 de mayo de 2023, toda vez que no existe \nfundamento factico y jurídico que lo sustente, de acuerdo con lo consagrado en el Concepto \nTécnico 3360 del 17 de junio de 2021, acogido mediante el Acta 252 del 23 de junio de \n2021, puesto que en el numeral 6 ‘OBLIGACIONES CUMPLIDAS Y/O CONCLUIDAS’, se \ndeterminó que No Aplica el seguimiento a dicha obligación y se da por concluida por parte \nde la Autoridad Ambiental Nacional al numeral 3 del artículo segundo del Auto 4755 del 13 \nde agosto de 2018. ‘En el cual la autoridad solicitó la presentación de un PDA para el \nproyecto’. \n \n Teniendo en cuenta lo anterior, es importante señalar que la autoridad ambiental ya realizó \nun pronunciamiento sobre lo planteado en la resolución atacada, razón por la cual actuó en \ncontravía del principio de que ‘nadie puede ir contra sus propios actos’, que además tiene \nfundamento constitucional y está intrínsecamente ligado con el principio de buena fe, \nteniendo en cuenta que su Entidad ya incurrió en un hecho jurídico y creó confianza en mi \nrepresentado como titular de la licencia sobre dicha decisión, por lo tanto dicha contradicción \ndebe operar en favor de mi prohijado. Bajo este principio y en concordancia con lo \nmencionado en el Decreto 2820 de 2010 proferido por el Ministerio de Ambiente, Vivienda y \nDesarrollo Territorial (MAVDT), estableció la obligatoriedad a los titulares de los instrumentos \nambientales de la presentación de un Plan de Desmantelamiento y Abandono a partir de su \nentrada en vigencia, cabe indicar que el decreto referido entró en vigor a partir del 5 de \nagosto de 2010, por lo tanto, el Consorcio EMPESA NCT a quien le fue establecido el Plan \nde Manejo Ambiental del proyecto mediante Resolución 841 del 17 de mayo de 2007, no le \naplica el Decreto 2820 de 2010 y en consecuencia, no está obligada a presentar el PDA \nrequerido en el Auto 4755 de 2018 y reiterado en el Concepto Técnico 5541 de 2020. \n \n Cabe resaltar que dentro del Informe de Cumplimiento Ambiental No. 31 con radicado No. \n2023067560-1-000 de marzo 30 de 2023, en la ficha No. 3 a, como respuesta a los \nrequerimientos 8, 9, 10, 11 del acta 818 de 2022 ya se expuso el cumplimiento de cada una \nde estas bajo la premisa del cumplimiento de las obligaciones en mención ligadas al Plan de \nAbandono con fundamente al pronunciamiento del acta 252 del 23 de junio de 2021. \n \n En consecuencia, es \nclaro que los ajustes en el \nPLAN DE ABANDONO, \nDESMANTELAMIENTO Y RECUPERACION AMBIENTAL DE LOS POZOS, HATO NUEVO \n1, HATO NUEVO 2, HATO NUEVO 3 Y POLONIA 1 DEL CAMPO HATO NUEVO EN EL \nMUNICIPIO DE VILLAVIEJA, DEPARTAMENTO DEL HUILA, no proceden ya que de \nacuerdo con la normatividad vigente al momento del establecimiento del Plan de Manejo \nAmbiental del proyecto, no aplica la solicitud de un plan de abandono, además se configura \nel principio de la confianza legitima, toda vez que la autoridad ya había manifestado que no \nse continuaba con el seguimiento de este requerimiento, al declararse dentro de las \nobligaciones cumplidas o concluidas, por lo tanto, se solicita a la autoridad declarar cumplida \ndichas obligaciones y nuevamente excluirlas del seguimiento.” \n \nD. CONSIDERACIONES DE ESTA AUTORIDAD NACIONAL.  \n \nSeñala el Concepto Técnico 4720 del 31 de julio de 2023: \n \n“(…)  \n \n2.1.3. Consideraciones de la ANLA \n \n\nResolución No. 2767       Del 27 NOV. 2023          Hoja No. 10 de 26 \n \n“Por la cual se resuelve un recurso de reposición interpuesto en contra de la \nResolución 1105 del 30 de mayo de 2023 y se adoptan otras determinaciones” \n \nPágina 10 de 26 \n \nDe forma inicial es relevante señalar que mediante comunicación con radicado 2018034372-\n1-000 de 23 de marzo de 2018, el CONSORCIO EMPESA NCT informó a la ANLA sobre la \ninactividad de operaciones y trabajos en el campo Hato Nuevo, asimismo, se dio a conocer \nel acta de terminación del contrato de producción entre ECOPETROL S.A y el CONSORCIO \nEMPESA NCT. \n \nAl respecto, dentro del concepto técnico 2632 del 25 de mayo de 2018, acogido por el Auto \n4755 del 13 de agosto de 2018, se indica que los pozos Hato Nuevo 1, Hato Nuevo 2, Hato \nNuevo 3 y Polonia 1 fueron abandonados, esto, con base en lo evidenciado durante la visita \nde seguimiento ambiental realizada los días 4 y 5 de abril de 2018 (…). \n \nEn relación con lo anterior, es de señalar que mediante el Literal h) del Artículo Segundo y \nArtículo Quinto de la Resolución 841 del 17 de mayo de 2007, se establecieron claramente \nlas actividades de desmantelamiento y abandono, las cuales deben ser cumplidas por la \nsociedad, así:  \n \n“ARTÍCULO SEGUNDO. El presente Plan de Manejo Ambiental autoriza al CONSORCIO \nEMPESA –NCT., la realización de las siguientes actividades para la reactivación de los \npozos Hato Nuevo 1, Hato Nuevo 2, Hato Nuevo 3 y Polonia 1 dentro del Campo Hato Nuevo, \nasí: (…)  \n \nh) Desmantelamiento y recuperación \n \n(…) ARTÍCULO QUINTO. (…) \n \nEn el evento que los pozos resulten improductivos, el informe deberá contener las \nacciones de desmantelamiento y recuperación desarrolladas. Los informes deben incluir \nanálisis comparativos de los impactos ambientales previstos y los que se han presentado en \nla ejecución del proyecto; dificultades presentadas en la aplicación de las medidas de manejo \nambiental y las medidas adoptadas para superarlas; ponderación de la eficacia de las \nmedidas de manejo ambiental; análisis de los resultados de las medidas de compensación; \nanálisis de los resultados de los monitoreos realizados, incluyendo el análisis de resultados \ny conclusiones, comparando con la línea base presentada en los estudios ambientales; \nrecomendaciones a la gestión ambiental del proyecto y balance de la gestión social \ndesarrollada. Igualmente se informará sobre las contingencias que se presenten, de las \ncuales se llevará un registro mensual. Para la elaboración de los Informes de Cumplimiento \nAmbiental (ICA), la empresa deberá seguir los formatos incluidos en el Apéndice 2 (AP 2) \ndel Manual de Seguimiento Ambiental de Proyectos elaborado por este Ministerio. Los \nresultados de los monitoreos deben ser presentados ante la Corporación y ante este \nMinisterio en los informes de cumplimiento ambiental. “Negrita fuera de texto” \n \nTeniendo en cuenta lo expuesto dentro del concepto técnico 2632 del 25 de mayo de 2018, \nmediante el Numeral 3 del Artículo Segundo del Auto 4755 del 13 de agosto de 2018 la ANLA \nrequirió al CONSORCIO EMPESA NCT, la presentación de un Plan de desmantelamiento y \nabandono, como se cita a continuación: \n \n“ARTÍCULO SEGUNDO. Requerir al CONSORCIO EMPESA NCT para que en el término de \ntres (3) meses contabilizados desde el día siguiente de la ejecutoria de este acto \nadministrativo presente ante esta Autoridad la siguiente información: \n \n3. La presentación del Plan de desmantelamiento y abandono de conformidad con el Literal \nh) del Artículo Segundo y literal a) del Artículo Quinto de la Resolución 841 del 17 de mayo \n\nResolución No. 2767       Del 27 NOV. 2023          Hoja No. 11 de 26 \n \n“Por la cual se resuelve un recurso de reposición interpuesto en contra de la \nResolución 1105 del 30 de mayo de 2023 y se adoptan otras determinaciones” \n \nPágina 11 de 26 \n \nde 2007 y en cumplimiento de lo indicado en el artículo 2.2.2.3.9.2 del decreto 1076 de 2015. \nAplicable a los pozos y locaciones Hato Nuevo 1, Hato Nuevo 2, Hato Nuevo 3 \n(desmantelamiento de obras duras) y Polonia 1.” \n \nFrente al cumplimiento de lo requerido, dentro del concepto técnico 5654 del 30 de septiembre \nde 2019 acogido mediante el Auto 11177 del 17 de diciembre de 2019, se señala que el \nConsorcio dando respuesta describió las actividades de desmantelamiento y abandono que \nestaban siendo desarrolladas, pero estas no contaban con un cronograma, o el destino final \nde residuos, entre otra información considerada relevante: \n \n“En respuesta a este requerimiento el Consorcio presentó en su comunicación 2019134195-\n1-000, del 6 de septiembre de 2019, un breve recuento de las actividades de \ndesmantelamiento y abandono desarrolladas hasta el momento, sin embargo, se solicita es el \ndetalle de las actividades a desarrollar dentro de esta fase, incluyendo el cronograma y la \nproyección de la destinación final de los residuos generados durante esta actividad, así como \nlos gestores certificados correspondientes; por consiguiente el ESA considera que el \nConsorcio no cumple con la presente obligación.” \n \nPosteriormente, el CONSORCIO EMPESA NCT mediante radicado 2021083178-1-000 del 29 \nde abril de 2021 presentó ante la ANLA el documento denominado “PLAN DE ABANDONO, \nDESMANTELAMIENTO Y RECUPERACIÓN AMBIENTAL DE LOS POZOS, HATO NUEVO \n1, HATO NUEVO 2, HATO NUEVO 3 Y POLONIA 1 DEL CAMPO HATO NUEVO EN EL \nMUNICIPIO DE VILLAVIEJA, DEPARTAMENTO DEL HUILA” con fecha de elaboración julio \nde 2020. El documento mencionado fue presentado por el Consorcio, con el fin de dar \ncumplimiento a lo requerido en el Numeral 3 del Artículo Segundo del Auto 4755 del 13 de \nagosto de 2018. \n \nEs relevante en este punto aclarar que el Consorcio, dentro del documento Plan De Abandono, \nDesmantelamiento y Recuperación Ambiental, presentó cuatro fichas de manejo ambiental y \ncinco fichas de manejo social que actualizan y complementan el Plan de Manejo Ambiental \ndel proyecto2, las cuales son aplicables a las actividades que son desarrolladas en los pozos; \nesto, en línea con los objetivos de la Ficha DR-1 Desmantelamiento y recuperación ambiental, \nla cual hace parte del Plan de Manejo Ambiental para la reactivación del campo aprobado \nmediante la Resolución 841 del 17 de mayo de 2007. (…). \n \nTeniendo en cuenta la actualización de las fichas de manejo ambiental presentada, dentro del \nconcepto técnico 3360 del 17 de junio de 2021 acogido mediante Acta 252 del 23 de junio de \n2021, se realizó una evaluación de estas, encontrando viable su implementación para mitigar, \ncorregir y evitar los impactos generados durante el desarrollo de las actividades de \ndesmantelamiento y recuperación ambiental desarrolladas e imponiendo algunos ajustes para \nsu posterior seguimiento y control. \n \nDe esta manera, si bien, como se menciona en el argumento del Recurso de Reposición, el \nConsorcio no está obligado a cumplir lo establecido en el Decreto 2820 de 2010 en relación \ncon la “Fase de desmantelamiento y abandono”, esta Autoridad Nacional vio la necesidad de \ncomplementar el Plan de Manejo Ambiental del proyecto, considerando la propuesta \npresentada dentro del documento con radicado 2021083178-1-000 del 29 de abril de 2021 \n \n2 Si bien, la Sociedad dentro del documento Plan de Abandono, Desmantelamiento y Recuperación Ambiental indica que fueron presentadas en total \nseis fichas de Manejo Ambiental actualizadas, fueron presentadas un total de cuatro fichas de manejo ambiental adicionales a la ficha DR-1 \nDesmantelamiento y Recuperación Ambiental. \n\nResolución No. 2767       Del 27 NOV. 2023          Hoja No. 12 de 26 \n \n“Por la cual se resuelve un recurso de reposición interpuesto en contra de la \nResolución 1105 del 30 de mayo de 2023 y se adoptan otras determinaciones” \n \nPágina 12 de 26 \n \npreviamente mencionado. Frente a lo anterior, el concepto técnico 3360 del 17 de junio de \n2021, acogido mediante Acta 252 del 23 de junio de 2021, señala lo siguiente: \n \n“Teniendo en cuenta que el Decreto 2820 de 5 de agosto de 2010 proferido por el Ministerio \nde Ambiente, Vivienda y Desarrollo Territorial (MAVDT), estableció la obligatoriedad a los \ntitulares de los instrumentos ambientales de la presentación de un Plan de Desmantelamiento \ny Abandono a partir de su entrada en vigencia y dado que la Resolución 841 del 17 de mayo \ndel año 2007 fue el acto administrativo que otorgó el Plan de Manejo Ambiental al Consorcio \nEMPESA NCT este NO se encuentra obligado a presentar el PDA. \n \nSin embargo, si es una obligación dar cumplimiento a los programas de manejo presentados \ny autorizados en el referido acto, en este sentido, el Consorcio debe dar cumplimiento a la \nmedida aprobada en Programa DR-1 Desmantelamiento y recuperación ambiental, cuya \nverificación de estado de cumplimiento para los periodos de reporte de los ICAS 22, 23, 24, \n26 y 27 se desarrolló en el capítulo 4.1.1 seguimiento al Plan de Manejo ambiental -PMA. \n \nAhora bien, mediante Radicado 2021083178-1-000 del 29 de abril de 2021, el usuario dentro \nel \ndocumento \ndenominado \nPLAN \nDE \nABANDONO, \nDESMANTELAMIENTO \nY \nRECUPERACIÓN AMBIENTAL DE LOS POZOS, HATO NUEVO 1, HATO NUEVO 2, HATO \nNUEVO 3 Y POLONIA 1 DEL CAMPO HATO NUEVO EN EL MUNICIPIO DE VILLAVIEJA, \nDEPARTAMENTO DEL HUILA, por medio del cual adelanta la actualización a la ficha del \nreferido programa, las cuales serán abordadas en el capítulo 8 que corresponde a “otras \nconsideraciones” (SIC) \n \nCon base en lo expuesto en el concepto técnico 3360 del 17 de junio de 2021, dentro del Acta \n252 del 23 de junio de 2021 se dio por concluida la obligación impuesta en el Numeral 3 del \nArtículo Segundo del Auto 4755 del 13 de agosto de 2018 (donde se requiere la presentación \ndel Plan de Desmantelamiento y Abandono), considerando lo siguiente: \n \n“En coherencia con el memorando ANLA 2020161510-3-000 22 de septiembre de 2020 el cual \nrecomienda: \n \n(…)’Teniendo en cuenta que el Decreto 2820 de 2010 proferido por el Ministerio de Ambiente, \nVivienda y Desarrollo Territorial (MAVDT), estableció la obligatoriedad a los titulares de los \ninstrumentos ambientales de la presentación de un Plan de Desmantelamiento y Abandono a \npartir de su entrada en vigencia, es decir el decreto inició a regir a partir del 5 de agosto de \n2010, por lo tanto, el Consorcio EMPESA NCT a quien le fue establecido el Plan de Manejo \nAmbiental del proyecto mediante Resolución 841 del 17 de mayo de 2007 no le aplica el \nDecreto 2820 de 2010 y en consecuencia, no está obligada a presentar el PDA requerido en \nel Auto 4755 de 2018 y reiterado en el Concepto Técnico 5541 de 2020 (…) Se recomienda al \ngrupo jurídico dar por concluido o dejar sin efectos jurídicos por la no aplicación de la norma \nal requerimiento, teniendo en cuenta que este no es procedente por la normatividad vigente al \nmomento del establecimiento del Plan de Manejo Ambiental del proyecto.’(…) \n \nDicho lo anterior, No Aplica el seguimiento a la presente obligación y se da por concluida” \n \nEn línea con lo precedente, es relevante mencionar que la Resolución 841 del 17 de mayo de \n2007 estableció el Plan de Manejo Ambiental para el desarrollo del proyecto “Reactivación de \nactividades que incluye el reentry a los Pozos Hato Nuevo 1, Hato Nuevo 2, Hato Nuevo 3 y \nPolonia 1”, de conformidad con el numeral 3 del Artículo 40 del Decreto 1220 de 2005, donde \nse señala que los proyectos, obras o actividades que hayan iniciado su operación antes de la \nexpedición de la Ley 99 de 1993 y que pretendan reanudar actividades, deben presentar un \n\nResolución No. 2767       Del 27 NOV. 2023          Hoja No. 13 de 26 \n \n“Por la cual se resuelve un recurso de reposición interpuesto en contra de la \nResolución 1105 del 30 de mayo de 2023 y se adoptan otras determinaciones” \n \nPágina 13 de 26 \n \nPlan de Manejo Ambiental para su respectiva evaluación y establecimiento. Es así como, el \ninstrumento de seguimiento y control ambiental para la ejecución del proyecto fue establecido \nen virtud de lo dispuesto en el Decreto 1220 de 2005, por lo que no le aplica lo previsto en el \nArtículo 40 del Decreto 2820 de 2010, el cual, como se ha mencionado previamente, determina \nla entrega del Plan de Desmantelamiento y Abandono para los proyectos que deban iniciar \ndicha fase.       \n \nPor otro lado, frente a la actualización de las medidas de manejo ambiental para el desarrollo \nde las actividades de desmantelamiento y recuperación ambiental del proyecto, dentro del \nActa 252 del 23 de junio de 2021, se incluyen los siguientes requerimientos: \n \n          “REQUERIMIENTO No. 5 \n \nAjustar la información presentada mediante radicado 2021083178-1-000 del 29 de abril de \n2021, con referencia al documento Plan de abandono, desmantelamiento y recuperación \nambiental de los pozos, hato nuevo 1, Hato Nuevo 2, Hato Nuevo 3 y Polonia 1 del campo \nhato nuevo en el municipio de Villavieja, departamento del Huila, en los siguientes aspectos: \n \nMedio social: \n \na. Ajustar la Ficha FMS 4, de Manejo de Infraestructuras y Predios de la Gestión Social para el \nDesmantelamiento y Recuperación Ambiental del proyecto, en el sentido de: \n \n1. Si los predios se van a dejar en las condiciones iniciales o si se va a generar un acuerdo \ncon el propietario para dejar las infraestructuras. \n2. En el evento de suscribir un acuerdo, previo al mismo el Consorcio deberá socializar los \nimpactos y medidas de manejo asociados a la permanencia de infraestructura \n3. Con respecto a los indicadores, el citado acuerdo debe incluir el respectivo registro de \nsocialización de los impactos negativos asociados a la permanencia de infraestructura \npresentados al propietario y los soportes que acrediten su titularidad sobre el predio. \n \nb. Ajustar la Ficha FMS 5, del Programa de Seguimiento y Monitoreo de la Gestión Social para \nel Desmantelamiento y Recuperación Ambiental del proyecto, en el sentido de incluir en las \nestrategias presentadas, las siguientes: \n \n1. Matriz de seguimiento a respuestas de PQRS;  \n2. Matriz de seguimiento a las capacitaciones realizada al personal vinculado al proyecto; \n3. Matriz de seguimiento a las comunicaciones generadas por el proyecto para informar a \ncomunidades y autoridades municipales y \n4. Matriz de seguimiento a las comunicaciones establecidas con los propietarios de los \npredios hasta la firma de los respectivos paz y salvo. \n \nMedio biótico \n \nc. Suministrar los polígonos de la ubicación de las áreas finales sujetas a intervención por \nrevegetalización para cada una de las locaciones (HN1, HN2, HN3 y Polonia 1) en aras de \ncontrastar la información y adelantar su adecuado seguimiento teniendo en cuenta la \nInformación geográfica según el modelo de almacenamiento geográfico GDB, conforme a lo \nestablecido en la Resolución 2182 de 2016. \n \nd. Con relación a las actividades de revegetalización contempladas en la Ficha de Manejo DR-\n1 Programa de desmantelamiento y recuperación ambiental, mediante la empradización y \narborización con el uso de cespedones y biomantos a base de fibras (fique) biodegradables \n\nResolución No. 2767       Del 27 NOV. 2023          Hoja No. 14 de 26 \n \n“Por la cual se resuelve un recurso de reposición interpuesto en contra de la \nResolución 1105 del 30 de mayo de 2023 y se adoptan otras determinaciones” \n \nPágina 14 de 26 \n \nla plantación de especies nativas arbóreas y arbustivas de rápido crecimiento \nrespectivamente, incluir lo siguiente: \n \n1. La composición de la plantación debe manejar especies con hábitos de crecimiento \ndiferente logrando establecer estratos similares al ecosistema original. \n2. Las actividades de mantenimiento estarán orientadas al manejo de limpias periódicas, \nfertilización, resiembra y control fitosanitario, programados durante la etapa de \nestablecimiento y no debe ser inferior a tres años. \n3. El cerramiento de las áreas a revegetalizar ya que es fundamental para garantizar el \ncrecimiento y adecuado desarrollo de las especies. \n4. Ajustar el porcentaje de supervivencia de las especies vegetales a plantar, el cual debe \nser superior al 90%, en aras de garantizar la efectividad de la medida. \n5. Informes de mantenimiento mínimo semestrales. \n6. El cronograma que se ajuste al plan de trabajo necesario para el desarrollo de este tipo \nde labor, el cual incluya: periodo de entrega de presentación de informes \ncorrespondientes a la actividad de establecimiento y sus respetivos mantenimientos. \n \ne. Realizar la selección de especies a emplear, priorizando sobre aquellas especies nativas \nreportadas con alguna categoría de amenaza de UICN, Libros rojos, y consideradas de gran \nimportancia para la conservación del Bosque Seco Tropical, como son las priorizadas por el \nInstituto Alexander Von Humboldt y documentadas en el libro El Bosque Seco Tropical en \nColombia, 2014. \n \nf. \nGarantizar que las actividades de revegetalización que adelante como parte de las acciones \nde desmantelamiento y recuperación ambiental, cuenten con indicadores medibles para \nfacilitar su seguimiento, así mismo en aras de aportar en la recuperación para la \nfuncionalidad del ecosistema y que como mínimo tengan en cuenta lo siguiente: \n \n1. Reconformar el paisaje de la zona del proyecto de acuerdo a las condiciones físicas, \nbióticas y socioeconómicas de la región. \n2. Estabilizar los suelos de las zonas intervenidas.  \n3. Realizar la correspondiente restauración de las condiciones del área para que retorne \na sus condiciones iniciales, restableciendo la cobertura vegetal.” \n \nPosteriormente, el Consorcio presenta de nuevo mediante radicado 2022194947-1-000 del \n6 de septiembre de 2022 el documento “PLAN DE ABANDONO, DESMANTELAMIENTO Y \nRECUPERACIÓN AMBIENTAL DE LOS POZOS, HATO NUEVO 1, HATO NUEVO 2, HATO \nNUEVO 3 Y POLONIA 1 DEL CAMPO HATO NUEVO EN EL MUNICIPIO DE VILLAVIEJA, \nDEPARTAMENTO DEL HUILA”, con fecha de elaboración del documento julio de 2022, \ndonde se incluyen parte de los ajustes a las medidas de manejo solicitados en el \nRequerimiento 5 del Acta 252 del 23 de junio de 2021. \n \nEste nuevo documento es valorado mediante el concepto técnico 7130 del 21 de noviembre \nde 2022, acogido por el Acta 818 del 21 de noviembre de 2022 y por la Resolución 1105 del \n30 de mayo de 2023. Dentro del concepto 7130 del 21 de noviembre de 2022 se especifica \nque son requeridos algunos ajustes puntuales a las fichas presentadas dentro del \ndocumento, específicamente a las Fichas MA-4 Recuperación Ambiental, FMS-4 Manejo de \ninfraestructura y predio y FMS-5 Programa de seguimiento y monitoreo. Los ajustes fueron \nrequeridos, al considerar que el instrumento de manejo y control ambiental del proyecto \n(PMA establecido mediante la Resolución 841 del 17 de mayo de 2007), no contempla en su \ntotalidad las actividades de desmantelamiento y recuperación ambiental que deben \ndesarrollarse para que el área intervenida vuelva a su estado inicial. \n\nResolución No. 2767       Del 27 NOV. 2023          Hoja No. 15 de 26 \n \n“Por la cual se resuelve un recurso de reposición interpuesto en contra de la \nResolución 1105 del 30 de mayo de 2023 y se adoptan otras determinaciones” \n \nPágina 15 de 26 \n \n \nPor lo tanto, en el marco de sus competencias, la ANLA mediante la Resolución 1105 del 30 \nde mayo de 2023, estableció en su Artículo Primero la obligación de ajustar las Fichas de \nmanejo \nambiental \ncontenidas \nen \nel \ndocumento \n“PLAN \nDE \nABANDONO, \nDESMANTELAMIENTO Y RECUPERACION AMBIENTAL DE LOS POZOS, HATO NUEVO \n1, HATO NUEVO 2, HATO NUEVO 3 Y POLONIA 1 DEL CAMPO HATO NUEVO EN EL \nMUNICIPIO DE VILLAVIEJA, DEPARTAMENTO DEL HUILA” con el fin de que estas sean \nincluidas en los seguimientos ambientales realizados al proyecto. \n \nEn línea con los antecedentes descritos anteriormente y con el propósito de aclarar el \nobjetivo de la obligación impuesta mediante la Resolución 1105 del 30 de mayo de 2023, se \nconsidera que su Artículo Primero debe ser modificado, en el sentido de incluir las fichas \ncontenidas en el documento “PLAN DE ABANDONO, DESMANTELAMIENTO Y \nRECUPERACION AMBIENTAL DE LOS POZOS, HATO NUEVO 1, HATO NUEVO 2, HATO \nNUEVO 3 Y POLONIA 1 DEL CAMPO HATO NUEVO EN EL MUNICIPIO DE VILLAVIEJA, \nDEPARTAMENTO DEL HUILA” dentro del PMA aprobado mediante la Resolución 841 del \n17 de mayo de 2007, teniendo en cuenta lo considerado en los conceptos técnicos de \nseguimiento 3360 del 17 de junio de 2021 (Acta 252 del 23 de junio de 2021) y 7130 del 21 \nde noviembre de 2022 (Acta 818 del 21 de noviembre de 2022), donde se realizó la \nevaluación de las medidas de manejo y se establecieron ajustes sobre estas.  \n \nAhora bien, el Consorcio dentro de los argumentos presentados en el Recurso de Reposición \nresalta que dentro del Informe de Cumplimiento Ambiental 31 con radicado 2023067560-1-\n000 de marzo 30 de 2023, da respuesta a los Requerimientos 8, 9, 10, 11 del Acta 818 del \n21 de noviembre de 2022; al respecto, esta Autoridad Nacional aclara que dichos \nrequerimientos reiteran lo solicitado en los literales b, c, e, y f del Requerimiento 5 del Acta \n252 del 23 de junio de 2021 citados previamente. En ese sentido, es preciso mencionar que \nla respuesta a los requerimientos realizados en el Acta 252 del 23 de junio de 2021 reiterados \nen el Acta 818 del 21 de noviembre de 2022, será verificada en los seguimientos ambientales \nque la ANLA realice, con el fin de corroborar que los ajustes hayan sido incorporados dentro \nde las Fichas de Manejo para las actividades de desmantelamiento y restauración ambiental \nque se desarrollan dentro del proyecto. \n \nFinalmente, con respecto a la petición realizada por el CONSORCIO EMPESA NCT, no se \nconsidera pertinente revocar el Artículo Primero de la Resolución 1105 del 30 de mayo de \n2023, no obstante, como se hizo mención anteriormente, si se considera pertinente su \nmodificación, con el fin incluir las Fichas presentadas en el documento “PLAN DE \nABANDONO, DESMANTELAMIENTO Y RECUPERACION AMBIENTAL DE LOS POZOS, \nHATO NUEVO 1, HATO NUEVO 2, HATO NUEVO 3 Y POLONIA 1 DEL CAMPO HATO \nNUEVO EN EL MUNICIPIO DE VILLAVIEJA, DEPARTAMENTO DEL HUILA” dentro del \nPMA del proyecto.  \n \nLo anterior teniendo en cuenta que, si bien el Consorcio no está obligado a presentar el Plan \nde Abandono, Desmantelamiento y Recuperación Ambiental requerido en el Auto 4755 de \n2018, sí debe dar cumplimiento a las medidas de manejo del Programa de desmantelamiento \ny recuperación ambiental que fueron autorizadas en el Plan de Manejo Ambiental del \nproyecto, las cuales se considera deben ser actualizadas y complementadas (…). \n \n1. Sobre el principio “nadie puede ir contra sus propios actos” y la buena fe: \n \n\nResolución No. 2767       Del 27 NOV. 2023          Hoja No. 16 de 26 \n \n“Por la cual se resuelve un recurso de reposición interpuesto en contra de la \nResolución 1105 del 30 de mayo de 2023 y se adoptan otras determinaciones” \n \nPágina 16 de 26 \n \nManifiesta el Consorcio que la Autoridad Nacional previamente “realizó un pronunciamiento \nsobre lo planteado en la resolución atacada, razón por la cual actuó en contravía del \nprincipio de que nadie puede ir contra sus propios actos, que además tiene fundamento \nconstitucional y esta intrínsecamente ligado con el principio de buena fe” puesto que ya \nincurrió en un hecho jurídico creando confianza para el recurrente. Lo anterior, basado en \nque de acuerdo con el Decreto 2820 de 2010, la obligatoriedad de la presentación de un \nPlan de Desmantelamiento y Abandono para los titulares de los instrumentos ambientales, \nse estableció a partir de su vigencia, es decir el 5 de agosto de 2010 y por lo tanto el mismo \nno es aplicable al Consorcio EMPESA NCT, a quien le fue establecido el Plan de Manejo \nAmbiental del proyecto mediante Resolución 841 del 17 de mayo 2007. En consecuencia, \nno está obligado a presentar el PDA requerido en el Auto 4755 de 2018 y reiterado en el \nConcepto Técnico 5541 de 2020.  \n \nAl respecto, esta Autoridad Nacional se permite mencionar que de acuerdo con la honorable \nCorte Constitucional en la Sentencia T-295-99 en virtud del acto propio “las actuaciones de \nlos particulares y de las autoridades púbicas deberán ceñirse a los postulados de la buena \nfe, principio constitucional, que sanciona como inadmisible toda pretensión lícita, pero \nobjetivamente contradictoria con respecto al propio comportamiento efectuado por el \nsujeto”. Adicionalmente, señala la Corte que al considerar la aplicación del acto propio se \nrequiere el cumplimiento de tres condiciones: “a. Una conducta jurídicamente anterior, \nrelevante y eficaz, b. El ejercicio de una facultad o de un derecho subjetivo por la misma \npersona o centros de interés que crea la situación litigiosa, debido a la contradicción -\natentatorio de la buena fe- existente entre ambas conductas, c.La identidad del sujeto o \ncentros de interés que se vinculan en ambas conductas”.  \n \nAhora bien, en el caso concreto, la obligación consistente en la presentación de acciones \nde desmantelamiento y recuperación desarrolladas, fue requerida mediante el instrumento \nde manejo y control ambiental, es decir en la Resolución 841 del 17 de mayo de 2007 \nespecíficamente en el literal h del artículo segundo que menciona “(…) el presente Plan de \nManejo Ambiental autoriza al Consorcio Empesa NCT, la realización de las siguientes \nactividades para la reactivación de los pozos Hato Nuevo 1, Hato Nuevo 2, Hato Nuevo 3 y \nPolonia 1 dentro del Campo Hato Nuevo así: (…) h) desmantelamiento y recuperación”.  \nDe igual forma, el artículo quinto de la Resolución 841 del 17 de mayo de 2007, mencionó \nque: “(…) en el evento que los pozos resulten improductivos, el informe deberá contener \nlas acciones de desmantelamiento y recuperación desarrolladas”. \n \nEn ese sentido, conforme la comunicación con radicado 2018034372-1-000 de 23 de marzo \nde 2018, el Consorcio informó a esta Autoridad Nacional sobre la inactividad de las \noperaciones y los trabajos en el campo Hato Nuevo y dio a conocer el acta de terminación \ndel contrato de producción entre ECOPETROL S.A. y el CONSORCIO EMPESA NCT. \n \nPor otra parte, si bien esta Autoridad Nacional requirió al Consorcio la presentación del Plan \nde Desmantelamiento y Abandono a través del numeral 3 del artículo segundo del Auto \n\nResolución No. 2767       Del 27 NOV. 2023          Hoja No. 17 de 26 \n \n“Por la cual se resuelve un recurso de reposición interpuesto en contra de la \nResolución 1105 del 30 de mayo de 2023 y se adoptan otras determinaciones” \n \nPágina 17 de 26 \n \n4755 del 13 de agosto de 2018, posteriormente, mediante el Acta 252 de 23 de junio de \n2021 se dio por concluida la obligación impuesta en el Numeral 3 del Auto 4755 del 13 de \nagosto de 2018, considerando que el Decreto 2820 de 2010 en el cual se basa el \nrequerimiento no le era aplicable. \n \nNo obstante lo anterior, esto no implica que el Consorcio no estaba obligado a la \npresentación de acciones de desmantelamiento y recuperación, ya que este requerimiento \nse estableció en el instrumento de manejo y control, es decir la Resolución 841 del 17 de \nmayo de 2007, basándose en lo dispuesto en el Decreto 1220 de 2005. De esta forma, esta \nAutoridad Nacional al solicitar lo relacionado con el Plan de Desmantelamiento y Abandono \nactuó en virtud de las referidas normas y no como lo indica el Consorcio basándose en el \nartículo 40 del Decreto 2820 de 2010, el cual como se indicó anteriormente no le es \naplicable al proyecto.  \n \nAsí las cosas, esta Autoridad Nacional en el requerimiento 5 del Acta 252 del 23 de Junio \nde 2021, solicitó el ajuste de la información presentada mediante el radicado 2021083178-\n1-000 del 29 de abril de 2021, con referencia al documento Plan de Abandono, \nDesmantelamiento y Recuperación Ambiental de los pozos, Hato Nuevo 1, Hato Nuevo 2, \nHato Nuevo 3 y Polonia 1 del campo Hato Nuevo en el municipio de Villavieja, departamento \ndel Huila en varios aspectos relacionados con el medio social y medio biótico, entre otros. \n \nAtendiendo a este requerimiento, el Consorcio presentó mediante radicado 2022194947 -\n1-000 del 6 de septiembre de 2022, el documento “Plan de Abandono, Desmantelamiento \ny Recuperación Ambiental de los Pozos, Hato Nuevo 1, Hato Nuevo 2, Hato Nuevo 3 y \nPolonia 1 del Campo Hato Nuevo en el municipio de Villavieja, Departamento del Huila”, \nmediante el cual, se incluyeron los ajustes a las medidas de manejo solicitadas previamente \nen el requerimiento 5 del Acta 252 del 23 de junio de 2021.   \n \nEn ese entendido, esta Autoridad Nacional valoró el documento mediante el Concepto \nTécnico 7130 del 21 de noviembre de 2022, acogido en el Acta 818 de 21 de noviembre de \n2022 y por la Resolución 1105 del 30 de mayo de 2023. Los referidos actos administrativos \nrequirieron ajustes puntuales a las fichas presentadas en el documento, ya que no \ncontemplaban en su totalidad las actividades de desmantelamiento y recuperación \nambiental que deben desarrollarse para que el área intervenida vuelva a su estado inicial. \n \nSobre estos requerimientos, manifestó el Consorcio que se dio respuesta mediante el \nInforme de Cumplimiento Ambiental 31 con radicado ANLA 2023067560-1-000 de 30 de \nmarzo de 2023, los cuales serán verificados en los seguimientos ambientales que esta \nAutoridad Nacional desarrolle. \n \nPor otra parte, es conveniente señalar que los proyectos, obras o actividades sujetas a \nlicenciamiento ambiental persisten hasta tanto el proyecto se encuentre en operación. En \nese entendido, una vez superada o terminada esta etapa es obligación de los titulares \n\nResolución No. 2767       Del 27 NOV. 2023          Hoja No. 18 de 26 \n \n“Por la cual se resuelve un recurso de reposición interpuesto en contra de la \nResolución 1105 del 30 de mayo de 2023 y se adoptan otras determinaciones” \n \nPágina 18 de 26 \n \ndesmantelar y recuperar el área del proyecto. Lo anterior, es de aplicación \nindependientemente de los postulados respecto al plan de desmantelamiento y abandono \nque incorporó el decreto  2820 de 2010. En este sentido, los titulares deberán continuar \nrealizando sus actividades sujetas a los términos, condiciones y obligaciones señalados en \nlos actos administrativos expedidos y demás normas aplicables.    \n \nTeniendo en cuenta lo expuesto, esta Autoridad Nacional ha realizado sus requerimientos \nde acuerdo con el instrumento de manejo y control, sin ir en contravía del principio del acto \npropio y de la buena fe. De igual forma, se debe tener presente que los instrumentos de \nmanejo y control ambiental no constituyen actos administrativos estáticos, si no que por el \ncontrario deben ser dinámicos para adaptarse a los cambios normativos y responder a las \nnecesidades medioambientales en aras de su protección, por lo tanto la solicitud de ajuste \nrealizada por esta Autoridad Nacional responde a estas necesidades.  \n \n2. Sobre el principio de confianza legitima: \nAdicionalmente, menciona el Consorcio que “los ajustes en el Plan de abandono, \ndesmantelamiento y recuperación ambiental de los pozos, Hato nuevo 1, Hato Nuevo 2, \nHato Nuevo 3 y Polonia del Campo Hato Nuevo en el Municipio de Villavieja, Departamento \ndel Huila, no proceden ya que de acuerdo con la normatividad vigente al momento del \nestablecimiento del Plan de Manejo Ambiental del proyecto, no aplica la solicitud de un plan \nde abandono, además se configura el principio de la confianza legitima, toda vez que la \nautoridad ya había manifestado que no se continuaba con el seguimiento de este \nrequerimiento, al declararse dentro de las obligaciones cumplidas o concluidas”.  \nDe acuerdo con el Consejo de Estado3, el principio de confianza legítima es la expectativa \nque alberga el particular sobre que las reglas determinadas por el Estado para el ejercicio \nde una actividad o reconocimiento de un derecho no serán variadas súbitamente. En ese \nsentido, como se indicó anteriormente, los requerimientos realizados por esta Autoridad \nAmbiental se basan en el instrumento de manejo y control y no han sido producto de \nvariaciones arbitrarias.   \nEs importante precisar, que el Decreto 1076 del 26 de mayo de 2015 estableció en su \nartículo 2.2.2.3.9.1,  el deber de la autoridad ambiental de realizar el control y seguimiento \na los proyectos, obras o actividades sujetos a licencia ambiental o plan de manejo \nambiental, durante su construcción, operación, desmantelamiento o abandono, y en el \ndesarrollo de dicha gestión, la potestad de realizar entre otras actividades, visitas al lugar \ndonde se desarrolla el proyecto, requerimientos, imponer obligaciones ambientales, \ncorroborar técnicamente o a través de pruebas los resultados de los monitoreos realizados \npor el beneficiario de la Licencia Ambiental o Plan de Manejo Ambiental. \n \n \n3 Consejo de Estado. Sala de lo Contencioso Administrativo. Sección Quinta. Consejero Ponente: Rocío Araújo Oñate. \nRadicación número: 25000-23-24-000-2009-00348-01. Julio 12, 2018.  \n\nResolución No. 2767       Del 27 NOV. 2023          Hoja No. 19 de 26 \n \n“Por la cual se resuelve un recurso de reposición interpuesto en contra de la \nResolución 1105 del 30 de mayo de 2023 y se adoptan otras determinaciones” \n \nPágina 19 de 26 \n \nPor su parte, en el parágrafo primero del artículo 2.2.2.3.11.1 del precitado Decreto, se \nconsagra la facultad de las autoridades ambientales de realizar ajustes periódicos a los \ninstrumentos de manejo y control ambiental cuando a ello hubiere lugar, estableciendo \nmediante acto administrativo motivado las medidas de manejo ambiental que se consideren \nnecesarias y/o suprimir las innecesarias. \n \nAsí las cosas, la Autoridad Nacional de Licencias Ambientales en el marco de sus \ncompetencias y en virtud del seguimiento ambiental profirió la Resolución 1105 de 30 de \nmayo de 2023, toda vez que encontró necesario ajustar las fichas de manejo aprobadas \nque fueron anexadas al documento denominado “Plan de Abandono, Desmantelamiento y \nRecuperación Ambiental de los Pozos, Hato Nuevo 1, Hato Nuevo 2, Hato Nuevo 3 y \nPolonia 1 del Campo Hato Nuevo en el Municipio de Villavieja, Departamento del Huila” a \nfin garantizar la protección eficiente de los recursos naturales y el medio ambiente y a su \nvez la interacción armónica entre los proyectos obras y actividades que se desarrollan, los \necosistemas presentes en la zona y los habitantes del área circundante. \n \nAdemás, se resalta que dicha decisión se fundamentó en los principios orientadores \nconsagrados en el artículo 209 de la Carta Política, en concordancia con lo establecido en \nel artículo tercero de la Ley 489 de 1998 y en el artículo tercero del Código de Procedimiento \nAdministrativo y de lo Contencioso Administrativo, que establece los principios orientadores \nde las actuaciones administrativas, especialmente, en los principios de debido proceso, \nproporcionalidad, y legalidad, así como en la aplicación rigurosa de los principios de política \nambiental consagrados en instrumentos internacionales y adoptados por la legislación \ncolombiana en diversas leyes, entre ellas, con una preponderancia evidente, la Ley 99 de \n1993. \n \nPor otra parte, la decisión se ha fundamentado en los principios de eficacia y eficiencia.  El \nprincipio de eficacia soportado en varios conceptos en la Constitución Política \n“especialmente en el artículo 2 al prever como uno de los fines esenciales del Estado el de \ngarantizar la efectividad de los principios, deberes y derechos consagrados en la \nConstitución”4, con lo cual, la administración debe garantizar una “real y efectiva ejecución \nde las medidas que se deban tomar en el caso que sea necesario, en armonía y de \nconformidad con el debido proceso”5. Por su parte, el de eficiencia que implica que la \nadministración pública debe procurar “la máxima racionalidad de la relación costos- \nbeneficios, de manera que la administración pública tiene el deber de maximizar el \nrendimiento o los resultados con costos menores y garantizar la adopción de medidas \nprevención y atención”6. En ese entendido, esta Autoridad Nacional una vez analizados los \nargumentos expuestos por el Consorcio, ha considerado en la decisión de modificar del \nartículo primero de la decisión recurrida aplicando los principios de eficacia y eficiencia en \nlas actuaciones administrativas, toda vez que el ajuste de las medidas tiene como objetivo \n \n4 Corte Constitucional de Colombia. Sentencia  C-826 de 2013. Magistrado Ponente: Luis Ernesto Vargas Silva.  \n5 Ibid. \n6 Ibid.  \n\nResolución No. 2767       Del 27 NOV. 2023          Hoja No. 20 de 26 \n \n“Por la cual se resuelve un recurso de reposición interpuesto en contra de la \nResolución 1105 del 30 de mayo de 2023 y se adoptan otras determinaciones” \n \nPágina 20 de 26 \n \nel mitigar, corregir, compensar los impactos generados durante la vida útil del proyecto a \nlos diferentes medios biótico, abiótico y socioeconómico.  \n \nPor otro lado, no es de recibo para esta Autoridad Nacional, los argumentos expuestos por \nel Consorcio, toda vez que la ANLA no ha vulnerado el principio de confianza legítima con \nla actuación objeto de recurso, teniendo en cuenta que la decisión adoptada es concordante \ncon lo establecido en el instrumento de manejo y control y en atención a las competencias \nque le asisten a esta Autoridad como se indica en párrafos anteriores, de acuerdo con las \ncondiciones propias del proyecto y en cumplimiento del deber que como Autoridad \nAmbiental corresponde de prevención y protección. Adicionalmente, es conveniente \nresaltar que la infraestructura del proyecto, requiere una disposición adecuada, al igual que \ngarantizar el entorno restaurado.  \n \nVale agregar que, en las actuaciones administrativas, para efectos de modificar las \nsituaciones jurídicas, desempeña un papel importante el concepto de la discrecionalidad \nadministrativa, conforme al cual la Administración puede adoptar decisiones, con el fin de \natender una realidad específica que afecta la situación jurídica actual, que requiere su \nactuar de tal manera que la discrecionalidad debe fundarse, causarse, sustentarse, \nafirmarse en la realidad y cuando expresa un juicio debe ser el reflejo de las cualidades \ncomprobadas, como consecuencia del buen proceder administrativo7.  \nEn adición a lo indicado, no puede perderse de vista que las actuaciones de esta Autoridad \nNacional, como ente administrativo, deben buscar un equilibrio entre la discrecionalidad y \nlas motivaciones legales para modificar los efectos jurídicos generados en las anteriores \ndecisiones adoptadas en torno a la función de seguimiento y control ambiental que le asiste.  \nEs así como la realidad del proyecto objeto de pronunciamiento y el deber encomendado \nen el acto jurídico de creación de la Entidad, plantea la necesidad de ajustar obligaciones \nderivadas del instrumento de manejo, considerando que la decisión que hoy se adopta, \nfundamentada técnica y jurídicamente, en las competencias discrecionales con que cuenta, \npermitirán cumplir su función de control ambiental, en concordancia con los fines del \nservicio público, la protección de los bienes colectivos y los principios de la función \nadministrativa, de una manera adecuada y eficiente. \nComo ya se mencionó, el Decreto 1076 del 26 de mayo de 2015 estableció en su artículo \n2.2.2.3.9.1, el deber de la autoridad ambiental de realizar el control y seguimiento a los \nproyectos, obras o actividades sujetos a licencia ambiental o plan de manejo ambiental, \ndurante su construcción, operación, desmantelamiento o abandono, y en el desarrollo de \ndicha gestión, la potestad de realizar entre otras actividades, visitas al lugar donde se \ndesarrolla el proyecto, requerimientos, imponer obligaciones ambientales, corroborar \ntécnicamente o a través de pruebas los resultados de los monitoreos realizados por el \nbeneficiario de la Licencia Ambiental o Plan de Manejo Ambiental. \n \n7 MARIN HERNANDEZ Humberto, “Algunas anotaciones en relación con la discrecionalidad administrativa”, Revista de \nDerecho Administrativo, No.2, Primer semestre 2009, Universidad Externado de Colombia, Bogotá, 2009. \n\nResolución No. 2767       Del 27 NOV. 2023          Hoja No. 21 de 26 \n \n“Por la cual se resuelve un recurso de reposición interpuesto en contra de la \nResolución 1105 del 30 de mayo de 2023 y se adoptan otras determinaciones” \n \nPágina 21 de 26 \n \n \nPor su parte, es pertinente señalar que la gestión de seguimiento y control permite a la \nAutoridad Ambiental conocer el estado de cumplimiento de las obligaciones a cargo del \ntitular de la licencia ambiental, así como del respectivo Plan de Manejo Ambiental y demás \nactos administrativos expedidos, lo que conlleva a efectuar los requerimientos del caso.  \n \nEs por ello que la Resolución 1105 del 30 de mayo de 2023, encuentra sustento jurídico de \nconformidad con lo dispuesto en el parágrafo primero del artículo 2.2.2.3.11.1 del Decreto \n1076 de 2015, en el cual se consagra la facultad de las autoridades ambientales de realizar \najustes periódicos a los instrumentos de manejo y control ambiental cuando a ello hubiere \nlugar: \n“(...) continuarán realizando las actividades de control y seguimiento necesarias, con \nel objeto de determinar el cumplimiento de las normas ambientales. De igual forma, \npodrán realizar ajustes periódicos cuando a ello haya lugar, establecer mediante \nacto administrativo motivado las medidas de manejo ambiental que se consideren \nnecesarias y/o suprimir las innecesarias.” (Subrayado fuera de texto).  \nDe igual forma, la señala Resolución es congruente con lo establecido en el instrumento de \nmanejo y control.  \n \nEn tal sentido, la ANLA tiene competencia para tomar las medidas de ajuste vía seguimiento \nde los instrumentos de manejo y control establecidos previamente en el marco de sus \ncompetencias normativas. Así mismo, la función de control y seguimiento ambiental permite \na la autoridad adecuar las medidas de manejo ambiental del proyecto, a la realidad actual \nde los impactos ambientales que el mismo genera, de tal manera que dichas medidas no \npierdan pertinencia y eficacia respecto del impacto previsto. \n \nEn relación con el carácter dinámico del instrumento de manejo y control, se debe precisar \nque el mismo como el vehículo dirigido a garantizar el cumplimiento de postulados \nconstitucionales y legales esenciales de protección del medio ambiente y los recursos \nnaturales, son instrumentos dinámicos cuya naturaleza jurídica les imprime también la \nposibilidad de ser ajustados, de tal forma que los efectos derivados de la actividad que \nautorizan sean debidamente, prevenidos, mitigados, corregidos y compensados. \n \nPor tanto, la normatividad ambiental vigente, regula y permite la modificación de dichos \ninstrumentos, a efecto de garantizar que las medidas de manejo que se implementen sean \nsuficientes y adecuadas a la realidad de los bienes jurídicos objeto de protección. En el \ncaso que nos ocupa, dicho instrumento debe ser modificado en el sentido de adicionar \nciertas obligaciones. \n \nPor otro lado, en Colombia el principio de prevención tiene base constitucional y ha sido \nincluida como fundamento de la acción ambiental del Estado, es por ello que el artículo 80 \nde la Constitución Política determina que “El Estado planificará el manejo y \n\nResolución No. 2767       Del 27 NOV. 2023          Hoja No. 22 de 26 \n \n“Por la cual se resuelve un recurso de reposición interpuesto en contra de la \nResolución 1105 del 30 de mayo de 2023 y se adoptan otras determinaciones” \n \nPágina 22 de 26 \n \naprovechamiento de los recursos naturales, para garantizar su desarrollo sostenible, su \nconservación, restauración o sustitución. Además, deberá prevenir y controlar los factores \nde deterioro ambiental, imponer las sanciones legales y exigir la reparación de los daños \ncausados (...)” \nNo es desconocido que, la acción preventiva data de normas como la Ley 23 de 1973 que \nen el artículo 1 estableció como objetivo la de “(…) prevenir y controlar la contaminación \ndel medio ambiente (…)”, asimismo el Decreto Ley 2811 de 1974 (Código Nacional de \nRecursos Naturales Renovables y de Protección al Medio Ambiente) decretó dentro de sus \nobjetivos el de “(…) Prevenir y controlar los efectos nocivos de la explotación de los recursos \nnaturales no renovables sobre los demás recursos” \nPor su parte la Ley 99 de 1993, en el artículo 1 de los principios generales ambientales, en \nel numeral 7 establece que “El Estado fomentará la incorporación de los costos ambientales \ny el uso de instrumentos económicos para la prevención, corrección y restauración del \ndeterioro ambiental y para la conservación de los recursos naturales renovables.” \nDe igual manera, el Decreto 1076 de 2015 hace referencia en varios apartados a la \nnecesidad de adelantar medidas de prevención, y el artículo 2.2.2.3.1.1., las define como \n“(…) las acciones encaminadas a evitar los impactos y efectos negativos que pueda generar \nun proyecto, obra o actividad sobre el medio ambiente”. \nPor lo anterior, es claro que la acción preventiva presente en la normatividad ambiental no \nbusca otra cosa que, lograr la prevención en todas y cada una de las acciones que se \nadelanten en ejercicio de la autoridad ambiental.  \nFinalmente y atendiendo a lo señalado, y en aplicación de los principios que rigen las \nactuaciones administrativas, consagrados en el artículo 209 de la Constitución Política de \n1991, así como en el artículo 3 de la Ley 1437 de 2011, y demás normas concordantes, \naunado al ejercicio permanente de observancia de los principios que rigen la política \nambiental en el territorio nacional previstos en la Ley 99 de 1993 y en el Decreto 1076 de \n2015, esta Entidad adoptará las decisiones que corresponden en torno al presente recurso, \nhabiendo además, respetado el derecho de defensa del administrado, realizando una \nmodificación al acto administrativo objeto de este recurso, tal y como se dejará establecido \nen la parte resolutiva del presente acto administrativo, en el entendido que las decisiones \nque se adoptaron mediante el acto administrativo objeto de recurso buscan una protección \nefectiva de los recursos naturales que son aprovechados en virtud del proyecto. \nEn mérito de lo antes expuesto, \nRESUELVE \nARTÍCULO PRIMERO. MODIFICAR el artículo primero de la Resolución 1105 del 30 de \nmayo de 2023, el cual quedará de la siguiente manera:  \n \n1. El CONSORCIO EMPESA NCT deberá ejecutar las actividades de desmantelamiento \ny recuperación ambiental conforme a las Fichas de Manejo Ambiental propuestas en la \n\nResolución No. 2767       Del 27 NOV. 2023          Hoja No. 23 de 26 \n \n“Por la cual se resuelve un recurso de reposición interpuesto en contra de la \nResolución 1105 del 30 de mayo de 2023 y se adoptan otras determinaciones” \n \nPágina 23 de 26 \n \ncomunicación con radicado ANLA 2022194947-1-000 del 6 de septiembre de 2022, \nmencionadas a continuación: \n \nFicha \nDescripción \nDR-1 \nPrograma de Desmantelamiento y Recuperación Ambiental \nFMA 1 \nAdecuación y mantenimiento de vías para el ingreso y salida de equipos \npesados  \nFMA 2 \nDemolición y desmantelamiento de infraestructura existente en los pozos \nHato nuevo 1, Hato nuevo2, Hato nuevo 3 y Polonia 1 \nFMA 3 \nRecolección, cargue, transporte y disposición de Residuos \nFMA 4 \nRecuperación ambiental \nFMS 1 \nAtención de quejas y reclamos ambientales \nFMS 2  \nEducación y Capacitación al personal vinculado al proyecto \nFDA 3 \nComunicación e Información a Comunidades y Autoridades Municipales \nFMS 4  \nManejo de Infraestructura y Predios \nFMS 5 \nPrograma \nde \nseguimiento \ny \nmonitoreo \npara \nel \nabandono \ny \ndesmantelamiento \n \n2. Incluir en las Fichas de Manejo Ambiental propuestas en la comunicación con radicado \nANLA 2022194947-1-000 del 6 de septiembre de 2022, los ajustes solicitados en el \nRequerimiento 5 del Acta de reunión de control y seguimiento 252 del 23 de junio de \n2021 y en los Requerimientos 8, 9, 10 y 11 del Acta de reunión de control y seguimiento \n818 del 21 de noviembre de 2022. \n \n3. Incluir las siguientes medidas en las Fichas que a continuación se enuncian y de \nconformidad con lo expuesto en la parte motiva del presente acto administrativo: \n \na. En la Ficha MA-4- Recuperación ambiental incluir lo siguiente: \n \ni. La composición de la plantación debe manejar especies con hábitos de \ncrecimiento diferente logrando establecer estratos similares al ecosistema \noriginal. \nii. Las actividades de mantenimiento estarán orientadas al manejo de limpias \nperiódicas, fertilización, resiembra y control fitosanitario, programados durante \nla etapa de establecimiento y no debe ser inferior a tres años. \niii. El cerramiento de las áreas a revegetalizar para garantizar el crecimiento y \nadecuado desarrollo de las especies. \niv. El porcentaje de supervivencia de las especies vegetales debe ser superior al \n90%, en aras de garantizar la efectividad de la medida. \nv. Los informes de mantenimiento deben tener una periodicidad semestral. \n \nb. En la Ficha FMS 4 - Manejo de infraestructura y predio, incluir lo siguiente: \n \ni. En las acciones a desarrollar: \n \n1. El Consorcio evaluará los impactos (positivos y negativos) asociados a la \npermanencia parcial o total de las infraestructuras que el propietario del \n\nResolución No. 2767       Del 27 NOV. 2023          Hoja No. 24 de 26 \n \n“Por la cual se resuelve un recurso de reposición interpuesto en contra de la \nResolución 1105 del 30 de mayo de 2023 y se adoptan otras determinaciones” \n \nPágina 24 de 26 \n \npredio manifieste su deseo de permanencia, en tanto, puedan generar \nimpactos negativos sobre cualquiera de los medios físico, biótico y/o \nsocioeconómico. \n2. En el caso que el propietario, habiendo conocido todos los posibles \nimpactos asociados a la permanencia de cada una de las infraestructuras, \nse mantenga en su deseo de permanencia de tales, se debe incluir de \nmanera explícita en la correspondiente acta de paz y salvo, la precisión que \nel Consorcio le dio a conocer todos y cada uno de los posibles impactos \nnegativos asociados y que, a partir de la firma del acta, será el propietario \nel responsable por asumir dichos impactos. \n \nii. En los indicadores de seguimiento y monitoreo: El acta de paz y salvo, se \npresentará acompañada del respectivo registro de socialización de los \nimpactos negativos asociados a la permanencia de infraestructura, \npresentados al propietario, así como los respectivos soportes que acrediten \nsu titularidad sobre el predio. \n \nc. En la ficha FMS 5 - Programa de seguimiento y monitoreo para el abandono y \ndesmantelamiento, incluir lo siguiente: \n \nEn las estrategias de seguimiento y monitoreo: \n \n1. Matriz de seguimiento a respuestas de PQRS \n2. Matriz de seguimiento a las capacitaciones realizada al personal vinculado \nal proyecto. \n3. Matriz de seguimiento a las comunicaciones generadas por el proyecto \npara informar a comunidades y autoridades municipales y \n4. Matriz de seguimiento a las comunicaciones establecidas con los \npropietarios de los predios hasta la firma de los respectivos paz y salvo \n \nd. Incluir dentro del cronograma las acciones de desmantelamiento, revegetalización \ny monitoreos ambientales para el pozo Hato Nuevo 1. \n \nPÁRAGRAFO. El CONSORCIO EMPESA – NCT deberá presentar las Fichas de Manejo \nAmbiental para las actividades de desmantelamiento y recuperación ambiental ajustadas, \nen el término de seis (6) meses contados a partir de la ejecutoria de este acto \nadministrativo. \n \nARTÍCULO SEGUNDO. Por la Autoridad Nacional de Licencias Ambientales - ANLA, \nnotificar el contenido del presente acto administrativo al representante legal del \nCONSORCIO EMPESA – NCT, o a su apoderado debidamente constituido o a la \npersona debidamente autorizada, de conformidad con lo previsto en los artículos 67 y \nsiguientes de la Ley 1437 de 2011. \n \nARTÍCULO TERCERO. En el evento en que el (los) titular (es) del instrumento de manejo \nsea (n) admitido (s) en proceso de disolución o régimen de insolvencia empresarial o \nliquidación regulados por las normas vigentes, informará (n) inmediatamente de esta \n\nResolución No. 2767       Del 27 NOV. 2023          Hoja No. 25 de 26 \n \n“Por la cual se resuelve un recurso de reposición interpuesto en contra de la \nResolución 1105 del 30 de mayo de 2023 y se adoptan otras determinaciones” \n \nPágina 25 de 26 \n \nsituación a esta Autoridad, con fundamento, entre otros, en los artículos 8,58,79,80,81 y 95 \nnumeral 8 de la Constitución Política de Colombia de 1991, en la Ley 43 de 1990, en la Ley \n222 de 1995, en la Ley 1333 de 2009 y demás normas vigentes y jurisprudencia aplicable. \nAdicional a la obligación de informar a esta Autoridad Nacional de tal situación, \naprovisionará (n) contablemente, las obligaciones contingentes que se deriven de la \nexistencia de un procedimiento ambiental sancionatorio, conforme con el artículo 40 de la \nLey 1333 de 2009 o la norma que la adicione, modifique o derogue. \n \nARTÍCULO CUARTO. Por la Autoridad Nacional de Licencias Ambientales - ANLA, \ncomunicar el presente acto administrativo a la Procuraduría Delegada para Asuntos \nAmbientales y Agrarios y a la Corporación Autónoma Regional del Alto Magdalena -CAM, \npara su conocimiento y fines pertinentes.   \n \nARTÍCULO QUINTO. Por la Autoridad Nacional de Licencias Ambientales - ANLA, ordenar \nla publicación del presente acto administrativo en la Gaceta Ambiental de la Entidad. \n \nARTÍCULO SEXTO. Contra el presente acto administrativo no procede recurso alguno, de \nconformidad con lo establecido en el artículo 87 del Código de Procedimiento Administrativo \ny de lo Contencioso Administrativo. \n \nNOTIFÍQUESE, COMUNÍQUESE, PUBLÍQUESE Y CÚMPLASE \n \nDado en Bogotá D.C., a los 27 NOV. 2023 \n \n \n \n \n \nRODRIGO ELIAS NEGRETE MONTES \nDIRECTOR GENERAL \n \n \n \n \n \nNATALIA PEREZ JARAMILLO \nCONTRATISTA \n \n \n \nCARMINA DEL SOCORRO IMBACHI CERON \nCONTRATISTA \n\nResolución No. 2767       Del 27 NOV. 2023          Hoja No. 26 de 26 \n \n“Por la cual se resuelve un recurso de reposición interpuesto en contra de la \nResolución 1105 del 30 de mayo de 2023 y se adoptan otras determinaciones” \n \nPágina 26 de 26 \n \n \n \n \nSANDRA PATRICIA BEJARANO RINCON \nCONTRATISTA \n \n \n \nJUAN JOSE GRAJALES BLANCO \nCONTRATISTA \n \n \n \nALEXANDER MARTINEZ MONTERO \nASESOR \n \n \n \nGERMAN BARRETO ARCINIEGAS \nSUBDIRECTOR DE SEGUIMIENTO DE LICENCIAS AMBIENTALES \n \n \n \nExpediente No. LAM3756  \nConcepto Técnico N° 4720 de 31 de julio de 2023 \nFecha: agosto de 2023 \n \nProceso No.: 20231000027674 \n \nNota: Este es un documento electrónico generado desde los Sistemas de Información de la ANLA. El original reposa en los archivos digitales de la \nEntidad \n \n \n \n \n \n \n \n \n \n \n \n \n \n \n \n \n \n \n \n \n \n"
}