{
  "fuente": "ANLA_GACETA",
  "numero_resolución": "RESOLUCIÓN N° 003125",
  "fecha_resolución": "1993-12-22",
  "anio_resolucion": "1993",
  "nombre_proyecto": "Explotación y Desarrollo del",
  "nombre_proyecto_normalizado": "EXPLOTACION Y DESARROLLO DEL",
  "ubicación": "departamento de Casanare",
  "empresa": "HARKEN DE COLOMBIA LTD",
  "empresa_normalizada": "HARKEN DE COLOMBIA",
  "numero_expediente": "No",
  "radicados": [
    "2022022824",
    "2022061282",
    "2023008631",
    "2023060317"
  ],
  "descripcion": "POR LA CUAL SE RESUELVE UN RECURSO DE REPOSICIÓN",
  "tipos_infraccion": [
    "Tala o afectación de bosques"
  ],
  "tipos_infraccion_normalizados": [
    "TALA O AFECTACION DE BOSQUES"
  ],
  "pdf_id": "45127",
  "file_name": "ANLA_45127.pdf",
  "texto_completo": "República de Colombia\nMinisterio de Ambiente y Desarrollo Sostenible\nAUTORIDAD NACIONAL DE LICENCIAS \nAMBIENTALES\n- ANLA –\nRESOLUCIÓN N° 003125\n(28 DIC. 2023)\nPágina 1 de 16\n“POR LA CUAL SE RESUELVE UN RECURSO DE REPOSICIÓN”\nEL ASESOR DEL DESPACHO DEL DIRECTOR DE LA AUTORIDAD NACIONAL DE \nLICENCIAS AMBIENTALES – ANLA\nEn ejercicio de las facultades legales establecidas mediante la Ley 99 del 22 de diciembre \nde 1993, el Decreto Ley 3573 del 27 de septiembre de 2011, modificado por el Decreto \n376 del 11 de marzo de 2020, por el cual se modifica la estructura de la Autoridad \nNacional de Licencias Ambientales y acorde con lo regulado en el Decreto 1076 del 26 de \nmayo de 2015, la Resolución 669 del 14 de abril de 2020, la Resolución 1957 del 5 de \nnoviembre de 2021, y la Resolución 2795 del 25 de noviembre de 2022, expedidas por la \nAutoridad Nacional de Licencias Ambientales, y\n  \nCONSIDERANDO:\nQue mediante la Resolución 2211 del 30 de diciembre de 2005, el Ministerio del Medio \nAmbiente, hoy Ministerio de Ambiente y Desarrollo Sostenible, (En adelante el Ministerio), \notorgó a la SOCIEDAD HARKEN DE COLOMBIA LIMITED identificada con NIT \n800.187.974-3, Licencia Ambiental Global para el proyecto “Explotación y Desarrollo del \nCampo Río Verde”, ubicado en los municipios de Yopal y San Luis de Palenque del \ndepartamento de Casanare. \nQue mediante la Resolución 984 del 28 de mayo de 2009, el Ministerio autorizó a la \nsociedad HARKEN DE COLOMBIA LTD., la modificación de la Licencia Ambiental Global \nexpedida mediante Resolución 2211 del 30 de diciembre 2005, en el sentido de adicionar \nla construcción de 15 plataformas multipozos con una extensión de seis hectáreas cada \nuna, para perforar un máximo de ocho (8) pozos, el área autorizada incluye la zona de \npréstamo e instalaciones de apoyo como campamentos y piscinas de tratamiento, además \nautorizó la construcción de nuevos accesos a las plataformas. \nQue por medio de Resolución 2274 del 24 de noviembre de 2009, el Ministerio, resolvió \nrecurso de reposición contra la Resolución 984 del 28 de mayo de 2009, en el sentido de \nrevocar el numeral 3 del artículo quinto de la Resolución 2211 de 2005, y adicionar, la \nperforación de los pozos en el Campo Río Verde a una profundidad máxima de 20000 pies, \ncon lodos base agua y/o base aceite.\n\nResolución No. 003125       Del 28 DIC. 2023          Hoja No. 2 de 16\n“POR LA CUAL SE RESUELVE UN RECURSO DE REPOSICIÓN”\nPágina 2 de 16\nQue a través de la Resolución 2027 del 15 de octubre de 2010, el Ministerio tuvo en cuenta \nel cambio de razón social de la Sociedad HARKEN DE COLOMBIA LTD., a la Sociedad \nCOLOMBIA ENERGY DEVELOPMENT CO, en adelante la Sociedad.\nQue mediante la Resolución 1590 del 9 de agosto de 2019, la Autoridad Nacional autorizó \nla modificación a la obligación legal de inversión forzosa de no menos del 1% en el sentido \nde aprobar, entre otros, la línea de inversión propuesta relacionada con el desarrollo de \nProyectos de usos sostenible, mediante sistema agroforestal con cacao, en el marco de la \nsolicitud de acogimiento al Decreto 2099 del 22 de diciembre de 2016, modificado por el \nDecreto 75 del 20 de enero 2017 y el Decreto 1120 del 29 de junio 2017. \nQue mediante comunicación con radicado 2022022824-1-000 del 11 de febrero de 2022, la \nSociedad presentó informe de avance de las actividades de la obligación de inversión \nforzosa de no menos del 1%. \nQue mediante comunicación con radicado 2022061282-1-000 del 31 de marzo de 2022, la \nSociedad presentó la actualización base de liquidación de la inversión forzosa de no menos \ndel 1% para el periodo 2021.\nQue mediante la Resolución 769 del 18 de abril de 2022, la Autoridad Nacional aceptó la \nsolicitud de acogimiento a la Resolución 256 del 22 de febrero de 2018, en virtud del artículo \nprimero de la Resolución 370 del 15 de abril de 2021 expedida por el Ministerio de Ambiente \ny Desarrollo Sostenible, y aprobó las áreas propuestas para compensación del componente \nbiótico al interior de la Reserva Natural de la Sociedad Civil El Madroño, entre otras \ndisposiciones. \nQue mediante comunicación con radicado 2023008631-1-000 del 16 de enero de 2023, la \nSociedad presentó el ajuste al Plan de inversión forzosa de no menos del 1% del proyecto \n“Explotación y Desarrollo Campo Rio Verde”, consistente en el cambio de actividad \nproductiva aprobada en el Resolución 1590 del 9 de agosto de 2019. \nQue mediante comunicación con radicado 2023060317-1-000 del 23 de marzo de 2023, la \nSociedad presentó la actualización base de liquidación de la inversión forzosa de no menos \ndel 1% para el periodo 2022.\nQue mediante la Resolución 2453 del 24 octubre de 2023, la Autoridad Nacional estableció \na la Sociedad la liquidación parcial actualizada de la inversión forzosa de no menos del 1% \nacorde con el Parágrafo Primero del Artículo 321 de la Ley 1955 del 25 de mayo de 2019, \nque corresponde a la suma de MIL CIENTO NOVENTA MILLONES OCHOCIENTOS \nTREINTA Y CUATRO MIL NOVECIENTOS VEINTIDÓS PESOS CON VEINTISIETE \nCENTAVOS MCTE. ($1.190.834.922,27), liquidado sobre la base de liquidación actualizada \nque asciende a la suma de CIENTO DIECINUEVE MIL OCHENTA Y TRES MILLONES \nCUATROCIENTOS NOVENTA Y DOS MIL DOSCIENTOS VEINTISIETE PESOS \n($119.083.492.227), para el período comprendido entre el 31 de diciembre del 2005 y 2006, \ny los años 2008, 2009, 2010, 2011, 2016, 2017, 2018 y 2021; así mismo, estableció las \nespecies que no podía utilizar en la ejecución del Plan de inversión forzosa de no menos \ndel 1%. Acto administrativo que fue notificado por correo electrónico el 25 de octubre de \n2023.\nQue mediante la comunicación con radicación 20236200849932 del 9 de noviembre de \n2023, la Sociedad interpuso recurso de reposición contra la Resolución 2453 del 24 octubre \n\nResolución No. 003125       Del 28 DIC. 2023          Hoja No. 3 de 16\n“POR LA CUAL SE RESUELVE UN RECURSO DE REPOSICIÓN”\nPágina 3 de 16\nde 2023, argumentos que fueron evaluados por el equipo técnico de la Autoridad Nacional \na través del Concepto técnico 8786 del 13 de diciembre de 2023.\nCOMPETENCIA DE LA AUTORIDAD NACIONAL \nEl Gobierno Nacional, mediante Decreto Ley 3573 del 27 de septiembre de 2011, creó la \nAutoridad Nacional de Licencias Ambientales (ANLA), como una entidad con autonomía \nadministrativa y financiera, sin personería jurídica, la cual hace parte del Sector \nAdministrativo de Ambiente y Desarrollo Sostenible, en los términos del artículo 67 de la \nLey 489 de 1998.\nEl numeral 1° del artículo tercero del mencionado decreto estableció dentro de las funciones \nde la Autoridad Nacional, la de otorgar o negar las licencias, permisos y trámites \nambientales de competencia del Ministerio, de conformidad con la ley y los reglamentos.\nMediante el Decreto 376 del 11 de marzo de 2020, se modificó la estructura de la Autoridad \nNacional de Licencias Ambientales.\nMediante la Resolución 669 del 14 de abril de 2020, se nombró como servidor público a \nEDILBERTO PEÑARANDA CORREA, identificado con cédula de ciudadanía 4.052.851, en \nel empleo de libre nombramiento y remoción de Asesor, código 1020, grado 15, adscrito a \nla Dirección General de la planta global de la ANLA.\nEl 5 de noviembre de 2021, la Autoridad Nacional emitió la Resolución 1957 -Por la cual se \nadopta el Manual Específico de Funciones y de Competencias Laborales para los empleos de la \nplanta de personal de la Autoridad Nacional de Licencias Ambientales – ANLA-, en donde se \nestablece que corresponde al Despacho del Director General de la Autoridad Nacional de \nLicencias Ambientales - ANLA, -Suscribir los actos administrativos que otorgan, niegan, \nmodifican, ajustan o declaran la terminación de las licencias, permisos y trámites ambientales-.\nEn ejercicio de las facultades conferidas por la Ley 489 de 1998, se expidió la Resolución \n2795 del 25 de noviembre de 2022, “Por la cual se delegan unas funciones y se dictan otras \ndisposiciones”, que en el numeral 15 del artículo primero se delegó en el Asesor Código \n1020 Grado 15 del Despacho del Director General, entre otras, la función de resolver los \nrecursos de reposición interpuestos contra los actos administrativos que se emiten en \ncumplimiento de las funciones delegadas.\nTeniendo en cuenta lo anterior, es el Asesor del Despacho del Director General de la \nAutoridad Nacional el competente para pronunciarse sobre el recurso de reposición \ninterpuesto por la Sociedad COLOMBIA ENERGY DEVELOPMENT CO. en contra de la \nResolución 2453 del 24 octubre de 2023.\nFUNDAMENTOS JURÍDICOS\nEl procedimiento para la presentación y resolución de recursos contra los actos \nadministrativos se encuentra reglado en el Código de Procedimiento Administrativo y de lo \nContencioso Administrativo artículos 74 y siguientes, que particularmente respecto del \nrecurso de reposición al tenor literal expresan:\n“Artículo 74. Recursos contra los actos administrativos.\n\nResolución No. 003125       Del 28 DIC. 2023          Hoja No. 4 de 16\n“POR LA CUAL SE RESUELVE UN RECURSO DE REPOSICIÓN”\nPágina 4 de 16\n Por regla general, contra los actos definitivos procederán los siguientes recursos: \n1. El de reposición, ante quien expidió la decisión para que la aclare, modifique, adicione o \nrevoque (…)”\nA su vez, los artículos 76 y 77 del Código enunciado preceptúan: \n“Artículo 76. Oportunidad y presentación.\nLos recursos de reposición y apelación deberán interponerse por escrito en la diligencia de \nnotificación personal, o dentro de los diez (10) días siguientes a ella, o a la notificación por aviso, \no al vencimiento del término de publicación, según el caso. Los recursos contra los actos \npresuntos podrán interponerse en cualquier tiempo, salvo en el evento en que se haya acudido \nante el juez. \nLos recursos se presentarán ante el funcionario que dictó la decisión, salvo lo dispuesto para el \nde queja, y si quien fuere competente no quisiere recibirlos podrán presentarse ante el procurador \nregional o ante el personero municipal, para que ordene recibirlos y tramitarlos, e imponga las \nsanciones correspondientes, si a ello hubiere lugar. \nEl recurso de apelación podrá interponerse directamente, o como subsidiario del de reposición y \ncuando proceda será obligatorio para acceder a la jurisdicción. \nLos recursos de reposición y de queja no serán obligatorios. \nArtículo 77. Requisitos.\nPor regla general los recursos se interpondrán por escrito que no requiere de presentación \npersonal si quien lo presenta ha sido reconocido en la actuación. Igualmente, podrán presentarse \npor medios electrónicos. \nLos recursos deberán reunir, además, los siguientes requisitos: \n1. Interponerse dentro del plazo legal, por el interesado o su representante o apoderado \ndebidamente constituido. \n2. Sustentarse con expresión concreta de los motivos de inconformidad.\n3. Solicitar y aportar las pruebas que se pretende hacer valer. \n4. Indicar el nombre y la dirección del recurrente, así como la dirección electrónica si desea ser \nnotificado por este medio. \nSólo los abogados en ejercicio podrán ser apoderados (…)\nA su vez, el artículo 80 del citado Código, establece el alcance del contenido de la decisión \nque resuelve el recurso:\n“Artículo 80. Decisión de los recursos. -Vencido el período probatorio, si a ello hubiere \nlugar, y sin necesidad de acto que así lo declare, deberá proferirse la decisión motivada que \nresuelva el recurso. \nLa decisión resolverá todas las peticiones que hayan sido oportunamente planteadas y las \nque surjan con motivo del recurso.” \n\nResolución No. 003125       Del 28 DIC. 2023          Hoja No. 5 de 16\n“POR LA CUAL SE RESUELVE UN RECURSO DE REPOSICIÓN”\nPágina 5 de 16\nCONSIDERACIONES DE LA AUTORIDAD NACIONAL FRENTE AL RECURSO DE \nREPOSICIÓN INTERPUESTO POR LA SOCIEDAD. \nDesde el punto de vista procedimental, se observa que la petición presentada por la \nSociedad COLOMBIA ENERGY DEVELOPMENT CO. en contra de la Resolución 2453 del \n24 octubre de 2023, cumple con los requisitos establecidos en el artículo 77 y concordantes \ndel Código de Procedimiento Administrativo y de lo Contencioso Administrativo, en cuanto \na lo siguiente: \n1.\nInterponerse dentro del plazo legal, por el interesado o su representante o apoderado \ndebidamente constituido.\nSe encuentra acreditado que el día 25 octubre de 2023, la Sociedad se notificó por correo \nelectrónico de la Resolución 2453 del 24 octubre de 2023, frente a la cual presentó recurso \nde reposición a través de su Apoderada General el día 9 de noviembre de 2023, mediante \nla comunicación con radicación 20236200849932, es decir, dentro de los diez (10) días \nhábiles siguientes a la notificación, los cuales vencían el 9 de noviembre de 2023, de \nconformidad con lo preceptuado en el artículo 76 de la Ley 1437 del 18 de enero de 2011.\n2.\nSustentarse con expresión concreta de los motivos de inconformidad. \nLa Sociedad presentó los argumentos en contra de las disposiciones recurridas de la \nResolución 2453 del 24 octubre de 2023, los cuales serán tenidos en cuenta para decidir la \npresente solicitud.\n3.\nSolicitar y aportar las pruebas que se pretende hacer valer.\nEn la solicitud no se aportaron pruebas.\nEn la solicitud presentada, la Sociedad señaló que recibe notificaciones en el correo \nelectrónico bogotanotificaciones-judiciales@sierracol.com. \nCon base en lo anterior, verificado el cumplimiento de los requisitos establecidos en el \nCódigo de Procedimiento Administrativo y de lo Contencioso Administrativo (CPACA), \nrespecto a la procedencia del señalad recurso de reposición, la Autoridad Nacional \nprocederá a resolverlo, teniendo en cuenta las consideraciones realizadas en el Concepto \nTécnico 8786 del 13 de diciembre de 2023; en el mismo orden de los argumentos \npresentados por la Sociedad, a saber:\n1.\nDISPOSICIÓN RECURRIDA – ARTÍCULO SÉPTIMO DE LA RESOLUCIÓN 2453 \nDEL 24 OCTUBRE DE 2023.\n“ARTÍCULO SÉPTIMO. La Sociedad COLOMBIA ENERGY DEVELOPMENT CO., no podrá \nimplementar las siguientes especies: \n1. Guamo machete. Inga spectabilis (Vahl) Willd. \n2. Guamo rabo de mico. Inga thibaudiana var. latifolia Benth. \n3. Balso. Ochroma pyramidale (Cav. ex Lam.) Urb. \n4. Cambulo. Erythrina poeppigiana (Walp.) DE Cook \n5. Gualanday. Jacaranda obtusifolia Bonpl. \n6. Mango. Manguifera indica \n\nResolución No. 003125       Del 28 DIC. 2023          Hoja No. 6 de 16\n“POR LA CUAL SE RESUELVE UN RECURSO DE REPOSICIÓN”\nPágina 6 de 16\n7. Cuba 22. Pennisetum sp \n8. King Grass. Pennisetum hybridum \n9. Botón de oro. Tithonia diversifolia \n10. Matarraton. Gliricidia sepium \n11. Guacimo. Guazuma ulmifolia\n1.1 Petición de la Sociedad.\n“Se MODIFIQUE el artículo séptimo de la Resolución 2453 de 24 de octubre de 2023, eliminando de \nsu contenido las especies Guazuma ulmifolia, Jacaranda obtusifolia, Erythrina poeppigiana e Inga \nthibaudiana, de forma que las mismas sí puedan ser usadas en la implementación de la \nreforestación.”\n1.2 Argumentos de la Sociedad.\n(...)\nIII. Consideraciones Jurídicas y Fácticas Respecto del Acto Administrativo Recurrido\nEl recurso de reposición es la vía procesal a través de la cual se solicita directamente al funcionario \nque emitió un acto administrativo que lo aclare, modifique o revoque. Según lo dispuesto en el \nArtículo Décimo Quinto de la Resolución No. 2453 del 24 de octubre de 2023, contra la misma \nprocede el recurso de reposición, y teniendo en cuenta que CEDCO está en desacuerdo con la no \naprobación de las especies Guazuma ulmifolia, Jacaranda obtusifolia, Erythrina poeppigiana e Inga \nthibaudiana en la implementación de las acciones de restauración en cumplimiento del Plan de \ninversión del 1%, efectuada en el artículo séptimo de la mencionada Resolución, a continuación se \npresentan las consideraciones de hecho y de derecho en las cuales se fundamenta el presente \nrecurso de reposición.\nPor medio de la presente, CEDCO, respetuosamente solicita MODIFICAR el Artículo Séptimo de la \nResolución, el cual establece lo siguiente:\n“ARTÍCULO SÉPTIMO: La Sociedad COLOMBIA ENERGY DEVELOPMENT CO., no podrá \nimplementar las siguientes especies:\n1. Guamo machete. Inga spectabilis (Vahl) Willd.\n2. Guamo rabo de mico. Inga thibaudiana var. latifolia Benth.\n3. Balso. Ochroma pyramidale (Cav. ex Lam.) Urb.\n4. Cambulo. Erythrina poeppigiana (Walp.) DE Cook\n5. Gualanday. Jacaranda obtusifolia Bonpl.\n6. Mango. Manguifera indica\n7. Cuba 22. Pennisetum sp\n8. King Grass. Pennisetum hybridum\n9. Botón de oro. Tithonia diversifolia\n10. Matarraton. Gliricidia sepium\n11. Guacimo. Guazuma ulmifolia” (subrayado y negrilla fuera de texto)\n3.1. En relación con este artículo de la Resolución, en la página 35 del concepto técnico 4868 del 09 \nde agosto de 2023 se hace referencia a las especies mencionadas, manifestando lo siguiente: “debe \nrestringirse el uso de las especies que se listan a continuación dado que no se reportan registros \nni probabilidad de distribución dentro de la región en la que se implementará la reforestación” \n(subrayado y negrilla fuera de texto). En la Imagen No. 1 a continuación se muestra lo expresado en \nel Concepto Técnico:\n\nResolución No. 003125       Del 28 DIC. 2023          Hoja No. 7 de 16\n“POR LA CUAL SE RESUELVE UN RECURSO DE REPOSICIÓN”\nPágina 7 de 16\n3.1.1. Frente a lo anterior, respetuosamente resaltamos que al consultar información bibliográfica \nsobre la distribución de las especies no aprobadas para el proceso de implementación, se evidencia \nque las especies Guazuma ulmifolia, Jacaranda obtusifolia, Erythrina poeppigiana e Inga thibaudiana \nsí cuentan con reportes de identificación en condición natural para los bosques de la Orinoquia-\nCasanare, teniendo distribución regional y local. Así mismo, estas especies son ampliamente usadas \nen los procesos de restauración ecológica en la zona de Casanare.\n3.1.2. A continuación, se presenta el resumen de los reportes con mayor relevancia y que permiten \nevidenciar que las especies Guazuma ulmifolia, Jacaranda obtusifolia, Erythrina poeppigiana e Inga \nthibaudiana, corresponden a especies nativas para Casanare, por lo cual es importante contar con \nsu presencia en los procesos de restauración que fueron propuestos para el proyecto Campo Río \nVerde.\n3.1.3. Cómo primer elemento de análisis se presenta la información contenida en la página \nSiBColombia que corresponde a la red nacional de datos abiertos de biodiversidad, en la cual se \nhace pública la información obtenida por cientos de organizaciones y personas que comparten datos \ne información recopilada en el marco de los diferentes estudios ambientales que incluyen inventarios, \ncaracterizaciones biológicas y botánicas entre otros.\nEn esta gran base datos, en la cual participan tanto empresas privadas como institutos de \ninvestigación como el Instituto Alexander Von Humbolt, se hace referencia a la presencia de las \nespecies Guazuma ulmifolia, Jacaranda obtusifolia, Erythrina poeppigiana e Inga thibaudiana, en el \ndepartamento del Casanare, tal como se muestra en la Tabla No. 1 a continuación:\n3.1.4. Adicionalmente, Minorta-Cely, V. (2020) en su publicación “LA VEGETACIÓN DE LA \nORINOQUÍA COLOMBIANA: RIQUEZA DIVERSIDAD Y CONSERVACIÓN, en la cual Se presenta \nel arreglo sintaxonómico de la vegetación Orinocense Colombiana, según su composición florística \ny sus principales aspectos estructurales”., realizó una caracterización según la composición florística \ny los aspectos estructurales de la vegetación de sectores representativos de la heterogeneidad \nfisiográfica de la Orinoquia colombiana, partiendo de levantamientos de información en campo \nmediante inventarios de vegetación teniendo registros evidenciables de las especies Guazuma \n\nResolución No. 003125       Del 28 DIC. 2023          Hoja No. 8 de 16\n“POR LA CUAL SE RESUELVE UN RECURSO DE REPOSICIÓN”\nPágina 8 de 16\nulmifolia, Jacaranda obtusifolia, Erythrina poeppigiana e Inga thibaudiana, en la localidad de los \nLlanos del Casanare en el departamento de Casanare, encontrando que los registros se presentaron \nen las siguientes asociaciones :\n•\nGuazuma ulmifolia: en más de cuatro asociaciones, en diferentes tipos de coberturas de \nbosques y palmares con diferentes grados de transformación.\n•\nJacaranda obtusifolia: en más de cuatro asociaciones, en diferentes tipos de coberturas de \nbosques y palmares con diferentes grados de transformación.\n•\nErythrina poeppigiana: en más de dos asociaciones.\n•\nInga thibaudiana: En otras especies presentes en los inventarios.\n3.1.5. Además del estudio antes mencionado y a los reportes de la página SiBColombia, se han \nrealizado registros de distribución en el departamento del Casanare para las especies Guazuma \nulmifolia, Jacaranda obtusifolia, Erythrina poeppigiana e Inga thibaudiana, en los documentos que \nse presentan a continuación:\n3.1.5.1. Guamo: Guazuma ulmifolia Lam\nLa especie Guazuma ulmifolia, comúnmente conocida como Guácimo, perteneciente a la familia \nMalvaceae, es originaria de América y se caracteriza por su capacidad de adaptarse a una amplia \ngama de hábitats, desde bosques tropicales hasta zonas alteradas y riberas de ríos (De La Rosa et \nal., 2001).\nEn el contexto de Colombia, y específicamente en el departamento de Casanare, se ha registrado \nde manera consistente la presencia de Guazuma ulmifolia, como lo reporta Flórez et al. (2015) en el \nestudio de la flora en la región de los Llanos Orientales de Colombia, donde se ubica \ngeográficamente Casanare; en los resultados de esta investigación se identifica y clasifica la \nespecies Guazuma ulmifolia como una especie autóctona presente en este territorio, colectada en \nborde de bosque de galería.\nLa existencia de Guazuma ulmifolia en Casanare también ha sido verificada en investigaciones más \ndetalladas que incluyen estudios sobre la vegetación a lo largo de las riberas de los ríos Orinoco y \nMeta, que atraviesan parte de Casanare, han registrado la presencia de esta especie en dichas áreas \n(Pérez et al., 2018).\nPor otra parte, también hace parte de los listados de las especies encontradas en las sábanas \ninundables asociadas en la cuenca del río Pauto en el departamento de Casanare (Mora-Fernández \nC. & Peñuela-Recio L. (Eds.) 2013).\nPor último, en la publicación realizada por la Fundación Horizonte Verde y RESNATUR, en los \nprocesos de establecimiento de las Reservas Naturales del Nodo de la Orinoquía, registraron la \npresencia de la especie en el Departamento del Casanare. (Peñuela, L, Castro, F & Ocampo-\nPeñuela, 2011).\nReferencias:\n•\nDe La Rosa, J. P., Mora, E. A., & Calonje, M. (2001). Guazuma ulmifolia Lam. In: M. M. \nGrandtner & Julien Chevrette (Eds.), Dictionary of Trees, Volume 2: South America: \nNomenclature, Taxonomy and Ecology (pp. 355-357). Academic Press.\n•\nPeñuela, L, Castro, F & Ocampo-Peñuela, 2011. Las Reservas Naturales del Nodo Orinoquia \nen su rol de Conservación de la biodiversidad. Fundación Horizonte Verde y RESNATUR. 104p. \nColombia.\n•\nSuarez-Castro F., J.C. Bueno-Castellanos & C. Mora-Fernández 2013. Flora. Asociada a la \ncuenca del río Pauto, Casanare (Colombia). Serie Biodiversidad para la Sociedad No. 3. Yoluka \nONG, fundación de investigación en biodiversidad y conservación, Fundación Horizonte Verde \ny Ecopetrol S.A. 350pp.\n\nResolución No. 003125       Del 28 DIC. 2023          Hoja No. 9 de 16\n“POR LA CUAL SE RESUELVE UN RECURSO DE REPOSICIÓN”\nPágina 9 de 16\n•\nFlórez, D., Monsalve, L. I., Quijano, M. L., & Rosales, G. (2015). Plantas útiles de los llanos \norientales de Colombia: aportes a la etnobotánica y la conservación. Revista de Biología \nTropical, 63(1), 245-270.\n•\nPérez, G., Murillo, F., & Mejía, S. (2018). Estructura y composición de la vegetación riparia de \nlos ríos Orinoco y Meta, Piedemonte de los Llanos Orientales de Colombia. Colombia Forestal, \n21(1), 29-46.\n3.1.5.2. Gualanday: Jacaranda obtusifolia\nJacaranda obtusifolia, también conocida como Jacarandá o Gualanday, es un árbol perteneciente a \nla familia Bignoniaceae. Originaria de América del Sur, esta especie es reconocida por sus atractivas \nflores de tonalidades azul-violeta que le han otorgado popularidad como planta ornamental a nivel \nmundial (Smith et al., 2000).\nEn el contexto de Colombia, se ha registrado la presencia de Jacaranda obtusifolia en diversas áreas \ndel país, incluyendo el departamento de Casanare. Estudios botánicos y florísticos han documentado \nla existencia de esta especie tanto en entornos naturales como urbanos de la región, como ejemplo \nse menciona el estudio realizado por Pérez y Sánchez (2019), en el cual se incluyó la Jacaranda \nobtusifolia en un inventario florístico de la vegetación ribereña en el departamento de Casanare, lo \nque proporciona evidencia de su presencia en esta zona.\nFlórez et al. (2015) llevaron a cabo un estudio de la flora en la región de los Llanos Orientales de \nColombia, donde se ubica geográficamente el departamento del Casanare. Los resultados de esta \ninvestigación incluyeron la identificación y clasificación de J. obtusifolia como una especie autóctona \npresente en este territorio, colectado en borde de bosque de galería.\nOtro elemento de referenciación corresponde a la página web biovirtual (UNIVERSIDAD NACIONAL \nDE COLOMBIA, 2017) en la cual se indica que su distribución está ampliamente presente en la \nOrinoquia, y los especímenes más representativos se encuentran en el río Casanare, Yopal y en \notras locaciones presentes en Casanare.\nPor último, en la publicación que realizaron la Fundación Horizonte Verde y RESNATUR, En los \nprocesos de establecimiento de las Reservas Naturales del Nodo de la Orinoquía, registraron la \npresencia de la especie en el departamento del Casanare. (Peñuela, L, Castro, F & Ocampo-\nPeñuela, 2011).\nReferencias:\n•\nSmith, N., Mori, S. A., Henderson, A., Stevenson, D. W., & Heald, S. V. (2000). Flowering plants \nof the Neotropics. Princeton University Press.\n•\nFlórez, D., Monsalve, L. I., Quijano, M. L., & Rosales, G. (2015). Plantas útiles de los llanos \norientales de Colombia: aportes a la etnobotánica y la conservación. Revista de Biología \nTropical, 63(1), 245-270.\n•\nPérez, G., & Sánchez, D. (2019). Composición y estructura de la vegetación riparia en el \ndepartamento de Casanare, Colombia. Colombia Forestal, 22(1), 51-69.\n•\nSiB Colombia. (2023). Jacaranda obtusifolia (Bonpl.) Cham. Consultado en línea el 15 de \noctubre de 2022, desde https://sibcolombia.net\n•\nUNIVERSIDAD NACIONAL DE COLOMBIA. (2017). biovirtual.unal.edu.co/floradecolombia. \nObtenido \nde \nJacaranda \nobtusifolia \nsubsp. \nobtusifolia: \nhttp://www.biovirtual.unal.edu.co/floradecolombia/es/description/345/\n•\nPeñuela, L, Castro, F & Ocampo-Peñuela, 2011. Las Reservas Naturales del Nodo Orinoquia \nen su rol de Conservación de la biodiversidad. Fundación Horizonte Verde y Resnatur. 104p. \nColombia.\n\nResolución No. 003125       Del 28 DIC. 2023          Hoja No. 10 de 16\n“POR LA CUAL SE RESUELVE UN RECURSO DE REPOSICIÓN”\nPágina 10 de 16\n3.1.5.3. Cambulo, Erythrina poeppigiana:\nErythrina poeppigiana, comúnmente conocida como \"Chocho\", pertenece a la familia Fabaceae y es \nendémica de las regiones tropicales y subtropicales de América. Esta especie destaca por sus flores \nde color rojo intenso y ha sido valorada tanto por su atractivo ornamental como por sus propiedades \nmedicinales en diversas culturas (Gentry, 1992).\nEn el contexto de Colombia y, en particular, en el departamento de Casanare, se ha registrado de \nforma reiterada la presencia de Erythrina poeppigiana en estudios botánicos y florísticos que han \ndocumentado su existencia en variados hábitats, que abarcan desde bosques naturales hasta áreas \nribereñas y entornos urbanos en la región. A manera de ejemplo, el trabajo de Martínez et al. (2016) \nincluyó a Erythrina poeppigiana en un censo florístico de la vegetación presente en los Llanos \nOrientales, ratificando así su presencia en el departamento de Casanare.\nFlórez et al. (2015) llevaron a cabo un estudio de la flora en la región de los Llanos Orientales de \nColombia. Los resultados de esta investigación incluyeron la identificación y clasificación de E. \npoeppigiana como una especie autóctona de la Orinoquia, colectado en borde de bosque de galería.\nReferencias\n•\nGentry, A. H. (1992). A synopsis of Bignoniaceae ethnobotany and economic botany. Annals of \nthe Missouri Botanical Garden, 79(1), 53-64.\n•\nFlórez, D., Monsalve, L. I., Quijano, M. L., & Rosales, G. (2015). Plantas útiles de los llanos \norientales de Colombia: aportes a la etnobotánica y la conservación. Revista de Biología \nTropical, 63(1), 245-270.\n•\nMartínez, D. S., et al. (2016). Flora de los Llanos Orientales de Colombia: Guía ilustrada de \nespecies de la vegetación de la Orinoquia. Instituto de Ciencias Naturales, Universidad Nacional \nde Colombia.\n•\nSiB Colombia. (2023). Erythrina poeppigiana (Walp.) O.F. Cook\n•\nSinopsis de las especies colombianas del género Erythrina (Leguminosae: Papilionoideae: \nPhaseoleae). Pp. 358-398 en Forero, E & C. Romero C. ed(s.). Estud. Legum. Colomb. \nColección\n•\nJorge Alvarez Lleras 25. Academia Colombiana de Ciencias Exactas, Fisicas y Naturales. \nBogotá, D.C.\n3.1.5.4. Guamo rabo de mico, Inga thibaudiana\nInga thibaudiana, comúnmente conocida como \"Guamo\", es una especie perteneciente a la familia \nFabaceae, originaria de las zonas tropicales y subtropicales de América. Destaca por su frondoso \nfollaje y las vainas de semillas de llamativo color rojo, y su importancia es reconocida tanto en \nsistemas agroforestales como en la alimentación de diversas especies de fauna silvestre (Boshier et \nal., 1995).\nEn el contexto colombiano y más específicamente en el departamento de Casanare, se ha \nconstatado de forma consistente la presencia de Inga thibaudiana. Investigaciones botánicas y \nflorísticas han confirmado su existencia en diversos tipos de ecosistemas, incluyendo desde bosques \nnaturales hasta áreas degradadas y sistemas agroforestales en la región. Por ejemplo, el estudio de \nGonzález et al. (2018) incluyó a Inga thibaudiana en un análisis detallado de la composición de \nespecies florísticas en los bosques secos tropicales del departamento de Casanare, lo que respalda \nsu presencia en este territorio.\nReferencias\n•\nBoshier, D. H., et al. (1995). Ecofisiología de Inga thibaudiana y su importancia en los \nagroecosistemas cafeteros del Parque Nacional Natural Tatamá. Revista de la Academia \nColombiana de Ciencias Exactas, Físicas y Naturales, 20(77), 321-336.\n\nResolución No. 003125       Del 28 DIC. 2023          Hoja No. 11 de 16\n“POR LA CUAL SE RESUELVE UN RECURSO DE REPOSICIÓN”\nPágina 11 de 16\n•\nFlórez, D., Monsalve, L. I., Quijano, M. L., & Rosales, G. (2015). Plantas útiles de los llanos \norientales de Colombia: aportes a la etnobotánica y la conservación. Revista de Biología \nTropical, 63(1), 245-270.\n•\nGonzález, F. G., et al. (2018). Diversidad y composición florística de los bosques secos \ntropicales del nororiente del departamento de Casanare, Colombia. Colombia Forestal, 21(2), \n159-181.\n•\nSiB Colombia. (2023). Inga thibaudiana DC.\n3.1.6. Teniendo en cuenta los reportes bibliográficos existentes, es evidente que las especies \nGuazuma ulmifolia, Jacaranda obtusifolia, Erythrina poeppigiana e Inga thibaudiana sí tienen \nregistros y probabilidad de distribución dentro de la región en la que se implementará la reforestación, \nrazón por la cual respetuosamente se solicita modificar el artículo séptimo de la Resolución 2453 de \n2023, teniendo en cuenta que de las especies excluidas se encuentran registros verificables de su \nexistencia en condiciones naturales en el departamento del Casanare.”\n(…)”\n1.3 Consideraciones de la Autoridad Nacional.\nA través del Concepto Técnico 8786 del 13 de diciembre de 2023, el equipo técnico de la \nAutoridad Nacional, señaló:\n“Una vez evaluados los argumentos de la Sociedad, esta Autoridad se permite realizar ciertas \nclaridades:\nLa primera precisión a tener en cuenta, es que el Concepto Técnico 4668 del 9 de agosto de 2023 \n(acogido por la Resolución 2453 del 24 de octubre de 2023) evaluó un Plan de Inversión de no menos \ndel 1%, entregado mediante radicado ANLA 2023008631-1-000 del 16 de enero de 2023, en donde \nla Sociedad propone las siguientes tres (3) acciones y seis (6) tipos de actividades:\n1)\nPreservación:\na) Aislamiento de ecosistemas de importancia ambiental.\nb) Estrategias complementarias (perchas y refugios).\n2)\nRestauración ecológica con enfoque de rehabilitación\na) Reforestación.\nb) Enriquecimiento.\n3)\nUso sostenible mediante sistemas silvopastoriles\na) Núcleos de sombrío.\nb) Banco mixto de forraje.\nPara lo cual, la Resolución 2453 del 24 de octubre de 2023, ACEPTÓ la acción de Restauración con \nenfoque de rehabilitación ecológica en un área de 14,95 ha a través de una reforestación protectora.\nTeniendo en cuenta que, de acuerdo al Plan Nacional de Restauración, la rehabilitación ecológica \nconsiste en:\n“2. Rehabilitación ecológica (rehabilitation): llevar al sistema degradado a un sistema similar o no al \nsistema predisturbio, éste debe ser autosostenible, preservar algunas especies y prestar algunos \nservicios ecosistémicos.”\n\nResolución No. 003125       Del 28 DIC. 2023          Hoja No. 12 de 16\n“POR LA CUAL SE RESUELVE UN RECURSO DE REPOSICIÓN”\nPágina 12 de 16\nDebido a que esta acción pretende llevar un ecosistema degradado a una aproximación de lo que \nera antes de su afectación (estado predisturbio), en términos de composición función y estructura, \nintentando llegar algo similar, haciendo la salvedad que puede no llegar a ese punto debido a la \ndimensión del disturbio ocasionado.\nEn el mismo Plan Nacional de Restauración se establece que uno de los impulsores o motores de \npérdida y transformación de ecosistemas identificados para el país son las invasiones biológicas, \npuesto que pueden llegar a “(...) suprimir poblaciones nativas hasta alterar funciones de los \necosistemas tales como el ciclo de nutrientes”.\nEs en ese contexto que el Concepto Técnico 4668 del 9 de agosto de 2023 (acogido por la \nResolución 2453 del 24 de octubre de 2023) acierta en mencionar que se deben “(...) Seleccionar \npara las siembras únicamente especies que tengan una distribución natural dentro de la región \nbiogeográfica en donde se ejecutarán las acciones” y que “(...) dada la relevancia que tiene el \nseleccionar especies de origen nativo, del listado presentado en el Plan debe restringirse el uso de \nlas especies”, que, de acuerdo con lo establecido por el Plan Nacional de Restauración, básicamente \npuedan ser especies introducidas, foráneas o invasoras, que afecten a las poblaciones nativas.\nEs en ese contexto que el Concepto Técnico, genera un listado que restringe el uso de ciertas \nespecies.\nLa segunda precisión que se debe hacer, es que si bien la Sociedad presenta una serie de \ndocumentos en donde se reporta la presencia de las especies en la región, lo cual no significa que \ndichas especies deban ser consideradas como nativas o deban ser consideradas con \ndistribuciones naturales de la zona geográfica en donde se realizarán las acciones de \nrehabilitación.\nA manera de ilustración, se puede observar que al remitirse a la página del SiBColombia, se puede \nencontrar especies como Ulex europaeus, mejor conocido como retamo espinoso, el cual presenta \namplia bibliografía frente a su carácter invasivo y que llegó a Colombia a través de unos procesos \nde control de la erosión e implementación de cercas vivas. De manera que, no por registros \nbiológicos en SiBColombia, una especie pueda ser considerada como nativa o con distribuciones \nnaturales en el país.\nEn el mismo sentido, los esfuerzos de registro de las comunidades vegetales en diferentes zonas \ndel país, que son muy valiosos para determinar la biodiversidad de un área, no son determinantes \nen asegurar que todas las especies encontradas son propias o nativas de la región, algunas pueden \nhaber sido introducidas y tener mecanismos de dispersión exitosos en el nuevo ecosistema o área \nde siembra.\nSe debe tener muy presente que la introducción de especies, normalmente por factores económicos \n(ej: café, caña de azúcar, frutales), hace que estas se establezcan, lleguen a tener poblaciones \nprósperas y hasta pueden llegar a ser parte de un ecosistema dado, pero que para llegar a ese punto \nfrecuentemente han desplazado a las especies nativas, mediante la interferencia de sus relaciones \necosistémicas, llegando a ser potencialmente especies invasoras, tal como lo menciona, en otras \npalabras, el artículo de Cárdenas y colaboradores del año 2011 (Cárdenas L., Castaño A., Cárdenas-\nToro D. 2011. Plantas Introducidas, establecidas e invasoras en Amazonia Colombiana. Instituto \nAmazónico de Investigaciones Científicas – SINCHI.), en donde concluye que “Este beneficio para \nel hombre se convierte en perjuicio para los ecosistemas y sus poblaciones naturales1, lo cual reduce \nlos servicios ecosistémicos que éstos prestan y se generan, a fin de cuentas, inmensas pérdidas \neconómicas y sociales (Pimentel, et al., 2005; Xu, et al., 2006; Hierro & Callaway, 2003).”\nLo anterior, va de la mano con lo plasmado en el Convenio sobre la Diversidad Biológica, suscrito \nen Río de Janeiro en 1992 y aprobado por Colombia mediante la Ley 165 del 9 de noviembre de \n1994, y promulgado por el Decreto 205 del 29 de enero de 1996, publicado en el Diario Oficial No. \n42.704 del 30 de enero de 1996), Ley declarada EXEQUIBLE por la Corle Constitucional, mediante \n\nResolución No. 003125       Del 28 DIC. 2023          Hoja No. 13 de 16\n“POR LA CUAL SE RESUELVE UN RECURSO DE REPOSICIÓN”\nPágina 13 de 16\nSentencia No. C-S19-94 de 21 de noviembre de 1994), en donde se establece que:\n“ARTÍCULO 8o. CONSERVACIÓN IN SITU\n(…)\nh) Impedirá que se introduzcan, controlará o erradicará las especies exóticas que amenacen a \necosistemas, hábitats o especies”. (Subrayado fuera del texto original).\nAhora bien, teniendo presente que para una rehabilitación ecológica no resulta coherente sembrar \nespecies que no sean nativas de las región y que los reportes de presencia – ausencia que tienen \nlos inventarios de biodiversidad en diferentes zonas del país no significa que las especies reportadas \ndeban ser consideradas como nativas del área, la Autoridad Nacional procedió a verificar las \nespecies que son objeto de análisis en el presente recurso de reposición, buscando básicamente si \nse precisan orígenes específicos de las especies, así como si existen reportes que las relacionen \ncomo introducida, foránea (exótica) o invasora, en la siguiente literatura para Colombia:\n•\nResolución 346 del 24 de marzo de 2022: Por el cual se modifica el artículo primero de la \nResolución 848 del 23 de mayo de 2008.\n•\nFAUNA \nEXÓTICA \nE \nINVASORA \nEN \nColombia, \nen \nhttp://repository.humboldt.org.co/handle/20.500.11761/31181.\n•\nCárdenas-López, D., Baptiste M.P. y Castaño N. (Eds). 2017. Plantas exóticas con alto potencial \nde invasión en Colombia. Instituto de Investigación de Recursos Biológicos Alexander von \nHumboldt. Bogotá D.C. 295pp.\n•\nhttps://catalogo.biodiversidad.co/\n•\nCARDENAS LÓPEZ, Dairon; CASTAÑO ARBOLEDA, Nicolás; CÁRDENAS-TORO, Juliana. \nPlantas introducidas, establecidas e invasoras en Amazonia colombiana. Dairon Cárdenas \nLópez; Nicolás Castaño Arboleda; Juliana Cárdenas-Toro, Bogotá, Colombia: Instituto \nAmazónico de Investigaciones Científicas –Sinchi-, 2011\n•\nSistema Global de Información sobre Biodiversidad–GBIF: En https://www.gbif.org.\nAl revisar la literatura específica, no se encontró que las especies citadas: Guamo rabo de mico \n(Inga thibaudiana var. latifolia Benth), Cambulo (Erythrina poeppigiana (Walp.) DE Cook), \nGualanday (Jacaranda obtusifolia Bonpl.) y Guacimo (Guazuma ulmifolia), fueran identificadas \ndentro de alguno de los listados y/o catálogos oficiales nacionales, como especies, introducidas, \nforáneas, exóticas, invasoras o con algún potencial de invasión, de igual manera no se encontró en \nla literatura un origen específico de las mismas, que haga presumir que las especies han sido \nintroducidas en la región en donde se van a realizar las acciones de Rehabilitación ecológica; por lo \nque resulta pertinente recomendar la MODIFICACIÓN del artículo séptimo de la Resolución 2453 de \n24 de octubre de 2023, el cual quedará de la siguiente manera:\n“ARTÍCULO SÉPTIMO: La Sociedad COLOMBIA ENERGY DEVELOPMENT CO., no podrá \nimplementar las siguientes especies:\n1. Guamo machete. Inga spectabilis (Vahl) Willd.\n2. Balso. Ochroma pyramidale (Cav. ex Lam.) Urb.\n3. Mango. Manguifera indica\n4. Cuba 22. Pennisetum sp\n5. King Grass. Pennisetum hybridum\n6. Botón de oro. Tithonia diversifolia\n7. Matarraton. Gliricidia sepium\n(…)”\n\nResolución No. 003125       Del 28 DIC. 2023          Hoja No. 14 de 16\n“POR LA CUAL SE RESUELVE UN RECURSO DE REPOSICIÓN”\nPágina 14 de 16\nAsí las cosas, es importante enfatizar que en ningún caso el titular del instrumento de \nmanejo y control ambiental puede hacer uso de especies introducidas, foráneas o \ninvasoras, que afecten a las poblaciones nativas, en el marco de los lineamientos \nestablecidos por el Plan Nacional de Restauración Ecológica, Rehabilitación y \nRecuperación de Áreas Degradadas (PNR), y en cumplimiento del literal h) del artículo 8 \nde la Ley 165 del 9 de noviembre de 1994, “Por medio de la cual se aprueba el \"Convenio \nsobre la Diversidad Biológica\", hecho en Río de Janeiro el 5 de junio de 1992”.\nTeniendo lo anterior como punto de partida y tras la revisión de las especies listadas en la \nliteratura técnica colombiana, la Autoridad Nacional considera procedente modificar el \nartículo séptimo de la Resolución 2453 del 24 octubre de 2023, en el sentido de excluir las \nespecies Guamo rabo de mico (Inga thibaudiana var. latifolia Benth), Cambulo (Erythrina \npoeppigiana (Walp.) DE Cook), Gualanday (Jacaranda obtusifolia Bonpl.) y Guacimo \n(Guazuma ulmifolia), tal y como quedará plasmado en la parte resolutiva.\nRESUELVE\nARTÍCULO PRIMERO. Reponer en el sentido de modificar el contenido del artículo séptimo \nde la Resolución 2453 del 24 de octubre de 2023, de conformidad con lo expuesto en la \nparte motiva del presente acto administrativo, el cual quedará de la siguiente manera:\n“ARTÍCULO SÉPTIMO: La Sociedad COLOMBIA ENERGY DEVELOPMENT CO., no podrá \nimplementar las siguientes especies:\n1.\nGuamo machete. Inga spectabilis (Vahl) Willd.\n2.\nBalso. Ochroma pyramidale (Cav. ex Lam.) Urb.\n3.\nMango. Manguifera indica.\n4.\nCuba 22. Pennisetum sp.\n5.\nKing Grass. Pennisetum hybridum.\n6.\nBotón de oro. Tithonia diversifolia.\n7.\nMatarraton. Gliricidia sepium.”\nARTÍCULO SEGUNDO. Los demás términos, condiciones y obligaciones establecidas en \nla Resolución 2453 del 24 de octubre de 2023, que no fueron objeto de modificación en el \npresente acto administrativo, continúan vigentes y exigibles en cualquier momento.\nARTÍCULO TERCERO. Notificar el presente acto administrativo al representante legal, o al \napoderado debidamente constituido o a la persona debidamente autorizada de la Sociedad \nCOLOMBIA ENERGY DEVELOPMENT CO., identificada con NIT 800.187.974-3, o a quien \nhaga sus veces, de conformidad con lo dispuesto en los artículos 67 y 69 del Código de \nProcedimiento Administrativo y de lo Contencioso Administrativo.\nPARÁGRAFO. En el evento en que el titular de la licencia o el permiso, según el caso, sea \nuna persona natural que se acoja al proceso de insolvencia regulado por las normas \nvigentes, o se trate de una sociedad comercial o de una sucursal de sociedad extranjera \nque entre en proceso de disolución o régimen de insolvencia empresarial o liquidación \nregulados por las normas vigentes, informará inmediatamente de esta situación a la \nAutoridad Nacional, con fundamento, entre otros, en los artículos 8, 58, 79, 80, 81, 95 \nnumeral 8 de la Constitución Política de 1991, en la Ley 43 de 1990, en la Ley 222 de 1995, \nen la Ley 1333 de 2009 y demás normas vigentes y jurisprudencia aplicable.\n\nResolución No. 003125       Del 28 DIC. 2023          Hoja No. 15 de 16\n“POR LA CUAL SE RESUELVE UN RECURSO DE REPOSICIÓN”\nPágina 15 de 16\nAdicional a la obligación de informar a la Autoridad Nacional de tal situación, el titular de la \nlicencia o permiso aprovisionará contablemente las obligaciones contingentes que se \nderiven de la existencia de un procedimiento ambiental sancionatorio conforme con el \nartículo 40 de la Ley 1333 de 2009 o la norma que la adicione, modifique o derogue.\nARTÍCULO CUARTO. Por parte de la Autoridad Nacional, comunicar el contenido del \npresente acto administrativo a la Corporación Autónoma Regional de la Orinoquia – \nCORPORINOQUIA, y al municipio de Yopal del departamento del Casanare.\nARTÍCULO QUINTO. Publicar la presente Resolución en la Gaceta Ambiental de la \nAutoridad Nacional de Licencias Ambientales (ANLA) de conformidad con lo señalado en el \nartículo 71 de la Ley 99 del 22 de diciembre de 1993.\nARTÍCULO SEXTO. Contra el presente acto administrativo no procede recurso alguno, de \nconformidad con lo establecido en el artículo 87 del Código de Procedimiento Administrativo \ny de lo Contencioso Administrativo.\nNOTIFÍQUESE, COMUNÍQUESE, PUBLÍQUESE Y CÚMPLASE\nDado en Bogotá D.C., a los 28 DIC. 2023\nEDILBERTO PENARANDA CORREA\nASESOR\nYURI KATHERINE ROA BUITRAGO\nCONTRATISTA\nANDREA DEL PILAR SANABRIA DEL RIO\nCONTRATISTA\nExpediente No. LAM3337\nConcepto Técnico N° 8786 del 13 de diciembre de 2023.\nFecha: 19 de diciembre de 2023\nProceso No.: 20231000031254\nNota: Este es un documento electrónico generado desde los Sistemas de Información de la ANLA. El original reposa en los \narchivos digitales de la Entidad\n\nResolución No. 003125       Del 28 DIC. 2023          Hoja No. 16 de 16\n“POR LA CUAL SE RESUELVE UN RECURSO DE REPOSICIÓN”\nPágina 16 de 16\n"
}