{
  "fuente": "ANLA_GACETA",
  "numero_resolución": "RESOLUCIÓN N° 003060",
  "fecha_resolución": "2023-10-26",
  "anio_resolucion": "2023",
  "nombre_proyecto": null,
  "nombre_proyecto_normalizado": null,
  "ubicación": "departamento de Cesar, a la Corporación Autónoma Regional del Cesar – CORPOCESAR",
  "empresa": "COLOMBIAN NATURAL RESOURCES I S.A.",
  "empresa_normalizada": "COLOMBIAN NATURAL RESOURCES I",
  "numero_expediente": "ASB0008",
  "radicados": [
    "20236200861812"
  ],
  "descripcion": "Por la cual se resuelve un recurso de reposición interpuesto en contra de la Resolución 2487 del 26 de octubre de 2023 y se adoptan otras determinaciones",
  "tipos_infraccion": null,
  "tipos_infraccion_normalizados": null,
  "pdf_id": "45001",
  "file_name": "ANLA_45001.pdf",
  "texto_completo": "República de Colombia\nMinisterio de Ambiente y Desarrollo Sostenible\nAUTORIDAD NACIONAL DE LICENCIAS \nAMBIENTALES\n- ANLA –\nRESOLUCIÓN N° 003060\n(21 DIC. 2023)\nPágina 1 de 18\n“Por la cual se resuelve un recurso de reposición interpuesto en contra de la \nResolución 2487 del 26 de octubre de 2023 y se adoptan otras \ndeterminaciones”\nLA SUBDIRECTORA DE EVALUACIÓN DE LICENCIAS AMBIENTALES DE LA \nAUTORIDAD NACIONAL DE LICENCIAS AMBIENTALES – ANLA\nEn ejercicio de las funciones asignadas por la Ley 99 de 1993, el Decreto-Ley 3573 del 27 \nde septiembre de 2011 modificado por el Decreto 376 del 11 de marzo de 2020, el \nDecreto 1076 de 2015, las Resoluciones 1957 del 5 de noviembre de 2021, 2666 del 8 de \nnoviembre de 2022, 2795 del 25 de noviembre de 2022\n   \nCONSIDERANDO:\nQue mediante Resolución 2487 del 26 de octubre de 2023, la Autoridad Nacional de \nLicencias Ambientales – ANLA prorrogó por un periodo de cinco (5) años la concesión de \naguas subterráneas procedentes del pozo denominado “La Francia”, en jurisdicción del \nmunicipio de El Paso en el departamento del Cesar, que fue otorgada mediante la \nResolución 1396 del 6 de agosto de 2008, y prorrogada mediante las Resoluciones 1140 \ndel 2 de octubre de 2014 y 1110 del 24 de junio de 2020, a nombre de la sociedad  C.I. \nCOLOMBIAN NATURAL RESOURCES I S.A.S. EN REORGANIZACIÓN, de conformidad \ncon lo expuesto en el referido acto administrativo. Así mismo, el término de la prórroga \nempezó a contar a partir del 27 de agosto de 2023, fecha en la cual tiene vencimiento el \nplazo que fue prorrogado mediante la Resolución 1110 del 24 de junio de 2020.\nQue el precitado acto administrativo fue notificado el día 27 de octubre del 2023 mediante \ncorreo electrónico dirigido a la sociedad C.I.  COLOMBIAN NATURAL RESOURCES I \nS.A.S. EN REORGANIZACIÓN y fue publicado el 29 de noviembre del 2023.\nQue mediante comunicación con radicado ANLA 20236200861812 del 14 de noviembre del \n2023, \nla \nsociedad \nC.I. \nCOLOMBIAN \nNATURAL \nRESOURCES \nI \nS.A.S \nEN \nREORGANIZACIÓN, interpuso recurso de reposición en contra del numeral segundo del \nartículo segundo de la Resolución 2487 del 26 de octubre de 2023, en el sentido de \nmodificar la periodicidad establecida en dicho numeral para la presentación del \ncumplimiento de las obligaciones establecidas para la concesión de aguas objeto de la \nprórroga.\n\nResolución No. 003060       Del 21 DIC. 2023          Hoja No. 2 de 18\n“Por la cual se resuelve un recurso de reposición interpuesto en contra de la Resolución \n2487 del 26 de octubre de 2023 y se adoptan otras determinaciones”\nPágina 2 de 18\nQue esta Autoridad Nacional efectuará el análisis de los argumentos y peticiones \npresentados por el recurrente frente a la Resolución 2487 del 26 de octubre de 2023, para \nlo cual se presentarán las consideraciones técnicas y jurídicas de la Autoridad Nacional de \nLicencias Ambientales - ANLA, a efectos de aceptar o denegar las peticiones planteadas \nen el recurso de reposición y en aplicación de los principios de eficacia y economía de las \nactuaciones administrativas, resolver el recurso reposición interpuesto en contra del \nnumeral segundo del artículo segundo de la Resolución 2487 del 26 de octubre de 2023.\nEn este sentido, el equipo evaluador ambiental de la Autoridad Nacional de Licencias \nAmbientales – ANLA a través del Concepto Técnico 9112 del 20 de diciembre de 2023, \nevaluó los argumentos expuestos por el recurrente, en el escrito de reposición, cuyas \nconsideraciones sirven de insumo al presente acto administrativo.\nFUNDAMENTOS CONSTITUCIONALES Y LEGALES \nLa Constitución Política de Colombia en el Capítulo Tercero del Título Segundo denominado \n“De los derechos, las garantías y los deberes”, incluyó los derechos colectivos y del \nambiente, o también llamados derechos de tercera generación, con el fin de regular la \npreservación del ambiente y de sus recursos naturales, comprendiendo el deber que tienen \nel Estado y sus ciudadanos de realizar todas las acciones para protegerlo, e implementar \naquellas que sean necesarias para mitigar el impacto que genera la actividad antrópica \nsobre el entorno natural. \nEn relación con la protección del medio ambiente, la Carta Política establece que es \nobligación del Estado y de las personas, proteger las riquezas culturales y naturales de la \nNación (Art. 8º); en el mismo sentido, se señala que es deber de la persona y del ciudadano \nproteger los recursos culturales y naturales del país y velar por la conservación de un \nambiente sano (Art. 95). Adicionalmente, la Carta Constitucional establece que todas las \npersonas tienen derecho a gozar de un ambiente sano, y es deber del Estado proteger la \ndiversidad e integridad del ambiente, conservar las áreas de especial importancia ecológica \ny fomentar la educación para el logro de estos fines (Art. 79). \nAsí mismo, por mandato constitucional le corresponde al Estado planificar el manejo y \naprovechamiento de los recursos naturales, para garantizar su desarrollo sostenible, su \nconservación, restauración o sustitución. Además, deberá prevenir y controlar los factores \nde deterioro ambiental, imponiendo las sanciones legales y exigiendo la reparación de los \ndaños causados (Art. 80). \nIgualmente, el artículo 209 de la Carta Política establece que “La función administrativa está \nal servicio de los intereses generales y se desarrolla con fundamento en los principios de \nigualdad, moralidad, eficacia, economía, celeridad, imparcialidad y publicidad, mediante la \ndescentralización, la delegación y la desconcentración de funciones”. \nPor su parte, el artículo tercero de la Ley 1437 de 2011, mediante la cual se expidió el \nCódigo de Procedimiento Administrativo y de lo Contencioso Administrativo, señala que \n“Las actuaciones administrativas se desarrollarán, especialmente, con arreglo a los \nprincipios del debido proceso, igualdad, imparcialidad, buena fe, moralidad, participación, \nresponsabilidad, transparencia, publicidad, coordinación, eficacia, economía y celeridad. \n\nResolución No. 003060       Del 21 DIC. 2023          Hoja No. 3 de 18\n“Por la cual se resuelve un recurso de reposición interpuesto en contra de la Resolución \n2487 del 26 de octubre de 2023 y se adoptan otras determinaciones”\nPágina 3 de 18\nDe otro lado, es preciso mencionar que los principios orientadores del derecho constituyen \npostulados rectores de las actuaciones administrativas, que garantizan un eficaz y justo \nobrar de las entidades a través de sus funcionarios públicos, quienes deben observarlos, \nen su condición de servidores del Estado y de la comunidad, para asegurar el cumplimiento \nde los cometidos estatales y demás directrices que determina el artículo 3 del Código de \nProcedimiento Administrativo y de lo Contencioso Administrativo.\nDE LA COMPETENCIA DE LA AUTORIDAD NACIONAL DE LICENCIAS AMBIENTALES \n– ANLA \nLa Autoridad Nacional de Licencias Ambientales – ANLA, es la autoridad competente para \npronunciarse frente al recurso de reposición que nos ocupa, teniendo en cuenta que: \nEs la autoridad facultada para otorgar o negar las licencias, permisos y trámites ambientales \nde competencia del Ministerio de Ambiente y Desarrollo Sostenible -MADS, de conformidad \ncon la ley y los reglamentos, en virtud de la desconcentración administrativa prevista en el \nnumeral 1º del artículo tercero del Decreto-Ley 3573 de 2011, por medio del cual se crea la \nAutoridad Nacional de Licencias Ambientales -ANLA. \nA su vez, el artículo 76 de la Ley 1437 de 2011 dispone que “… Los recursos se presentarán \nante el funcionario que dictó la decisión, salvo lo dispuesto para el de queja…”. \nPor medio del Decreto 1076 del 26 de mayo de 2015, el Gobierno Nacional expidió el \nDecreto Único Reglamentario del Sector Ambiente y Desarrollo Sostenible, estableciendo \nen su artículo 1.1.2.2.1, que la Autoridad Nacional de Licencias Ambientales – ANLA – es \nla encargada de que los proyectos, obras o actividades sujetos de licenciamiento, permiso \no trámite ambiental cumplan con la normativa ambiental, tal manera que contribuyan al \ndesarrollo sostenible ambiental del País. \nAsí, a través del Decreto 376 de 11 de marzo de 2020, el Gobierno Nacional, modificó la \nestructura de la Autoridad Nacional de Licencias Ambientales– ANLA, con el fin de \nfortalecer los mecanismos de participación ciudadana ambiental, los procesos de \nevaluación y seguimiento de licencias ambientales, los de gestión de tecnologías de la \ninformación, disciplinarios y de gestión de la Entidad. \nPosteriormente, mediante la Resolución 1957 del 5 de noviembre de 2021, se adoptó el \nManual Específico de Funciones y de Competencias Laborales para los empleos de la \nplanta de personal de la Autoridad Nacional de Licencias Ambientales – ANLA. \nAsí mismo, a través de la Resolución 2666 del 8 de noviembre de 2022, el director general \nde la Autoridad Nacional de Licencias Ambientales – ANLA, nombró con carácter ordinario \na la ingeniera ANA MARÍA LLORENTE VALBUENA, en el empleo de subdirector Técnico \nCódigo 0150 Grado 21, de libre nombramiento y remoción de la planta de personal de la \nANLA. \nPor medio de la Resolución 2795 del 25 de noviembre de 2022, se delegó a la Subdirección \nde Evaluación de Licencias Ambientales la función de otorgar, negar o modificar permisos, \nconcesiones y/o autorizaciones para el uso, aprovechamiento y/o afectación de recursos \n\nResolución No. 003060       Del 21 DIC. 2023          Hoja No. 4 de 18\n“Por la cual se resuelve un recurso de reposición interpuesto en contra de la Resolución \n2487 del 26 de octubre de 2023 y se adoptan otras determinaciones”\nPágina 4 de 18\nnaturales renovables, así como suscribir los actos administrativos necesarios para dar \nimpulso a estos trámites. \nDe igual forma, considerando que la Subdirección de Evaluación de Licencias Ambientales \nde la Autoridad Nacional de Licencias Ambientales – ANLA suscribió la Resolución 2487 \ndel 26 de octubre de 2023, en contra de la cual se presentó el recurso de reposición, la \ningeniera ANA MARÍA LLORENTE VALBUENA es la funcionaria competente para suscribir \nel presente acto administrativo, considerando lo establecido en el artículo 76 del Código de \nProcedimiento Administrativo y de lo Contencioso Administrativo.  \nDEL RECURSO DE REPOSICIÓN \nAntes de analizar los argumentos del recurso, es necesario tener en cuenta que, de acuerdo \ncon nuestra legislación y la doctrina existente, el recurso de reposición constituye un \ninstrumento legal mediante el cual, la parte interesada tiene la oportunidad de ejercer el \nderecho de controvertir una decisión, para que la administración previa su evaluación, la \nconfirme, aclare, modifique, adicione o revoque, con el lleno de las exigencias legales \nestablecidas para dicho efecto. \nEn dicho sentido, la finalidad esencial del recurso de reposición obedece, por una parte, a \nque al funcionario de la administración que tomó una decisión administrativa, se le dé la \noportunidad para que enmiende o corrija un error, o los posibles errores que se hayan \npodido presentar en el acto administrativo por él expedido, en ejercicio de sus funciones, y \npor otra, a la definición de los asuntos objeto de controversia.\nAsí las cosas, mediante la Resolución 2487 del 26 de octubre de 2023, por medio de la cual \nse prorrogó por un periodo de cinco (5) años la concesión de aguas subterráneas \nprocedentes del pozo denominado “La Francia”, se señaló en su artículo noveno la \noportunidad de interposición del recurso de reposición en la diligencia de notificación \npersonal, o dentro de los diez (10) días hábiles siguientes a ella, o a la notificación por aviso, \ncomunicación o publicación en la Gaceta de la ANLA según el caso, de conformidad con lo \nestablecido en los artículos 76 y 77 del Código de Procedimiento Administrativo y de lo \nContencioso Administrativo.\nEl Capítulo VI de la Ley 1437 del 18 de enero de 2011, por la cual se expidió el Código de \nProcedimiento Administrativo y de lo Contencioso Administrativo – CPACA -, en su artículo \n74 establece: \n“Recursos contra los actos administrativos. Por regla general, contra los actos \ndefinitivos procederán los siguientes recursos: \n1. El de reposición, ante quien expidió la decisión, para que la aclare, modifique, \nadicione o revoque. \n2. El de apelación, para ante el inmediato superior administrativo o funcional con \nel mismo propósito. \nNo habrá apelación de las decisiones de los Ministros, Directores de Departamento \nAdministrativo, superintendentes y representantes legales de las entidades \n\nResolución No. 003060       Del 21 DIC. 2023          Hoja No. 5 de 18\n“Por la cual se resuelve un recurso de reposición interpuesto en contra de la Resolución \n2487 del 26 de octubre de 2023 y se adoptan otras determinaciones”\nPágina 5 de 18\ndescentralizadas ni de los directores u organismos superiores de los órganos \nconstitucionales autónomos. (…)” \nEn lo que respecta a la oportunidad y presentación de los recursos, el artículo 76 ibidem, \ndispone: \n“Oportunidad y presentación. De los recursos de reposición y apelación deberán \ninterponerse por escrito en la diligencia de notificación personal, o dentro de los diez \n(10) días siguientes a ella, o a la notificación por aviso, o al vencimiento del término \nde publicación, según el caso. Los recursos contra los actos presuntos podrán \ninterponerse en cualquier tiempo, salvo en el evento en que se haya acudido ante \nel juez. \nLos recursos se presentarán ante el funcionario que dictó la decisión, salvo lo \ndispuesto para el de queja, y si quien fuere competente no quisiere recibirlos podrán \npresentarse ante el procurador regional o ante el personero municipal, para que \nordene recibirlos y tramitarlos, e imponga las sanciones correspondientes, si a ello \nhubiere lugar. \nEl recurso de apelación podrá interponerse directamente, o como subsidiario del de \nreposición y cuando proceda será obligatorio para acceder a la jurisdicción. Los \nrecursos de reposición y de queja no serán obligatorios”\nPor su parte, atendiendo a lo previsto en el artículo 77 del CPACA, los recursos deberán \nreunir los siguientes requisitos: \n“Artículo 77. Requisitos. Por regla general los recursos se interpondrán por escrito \nque no requiere de presentación personal si quien lo presenta ha sido reconocido en \nla actuación. Igualmente, podrán presentarse por medios electrónicos. \nLos recursos deberán reunir, además los siguientes requisitos: \n1.\nInterponerse dentro del plazo legal, por el interesado o su representante o \napoderado debidamente constituido. \n2. Sustentarse con expresión concreta de los motivos de inconformidad. \n3. Solicitar y aportar las pruebas que se pretende hacer valer. \n4.\nIndicar el nombre y la dirección del recurrente, así como la dirección electrónica \nsi desea ser notificado por este medio. (…)” \nFinalmente, los artículos 78, 79 y 80 de la misma normativa, regulan lo concerniente al \nprocedimiento y trámite para resolver el recurso de reposición interpuesto, en los siguientes \ntérminos: \n“Artículo 78. Rechazo del Recurso. Si el escrito con el cual se formula el recurso no se \npresenta con los requisitos previstos en los numerales 1, 2 y 4 del artículo anterior, el \nfuncionario competente deberá rechazarlo. Contra el rechazo del recurso de apelación \nprocederá el de queja.\n\nResolución No. 003060       Del 21 DIC. 2023          Hoja No. 6 de 18\n“Por la cual se resuelve un recurso de reposición interpuesto en contra de la Resolución \n2487 del 26 de octubre de 2023 y se adoptan otras determinaciones”\nPágina 6 de 18\nArtículo 79. Trámite de los recursos y pruebas. Los recursos se tramitarán en el efecto \nsuspensivo. \nLos recursos de reposición y de apelación deberán resolverse de plano, a no ser que al \ninterponerlos se haya solicitado la práctica de pruebas, o que el funcionario que ha de \ndecidir el recurso considere necesario decretarlas de oficio. \nCuando con un recurso se presenten pruebas, si se trata de un trámite en el que \ninterviene más de una parte, deberá darse traslado a las demás por el término de cinco \n(5) días. \nCuando sea del caso practicar pruebas, se señalará para ello un término no mayor de \ntreinta (30) días.  Los términos inferiores podrán prorrogarse por una sola vez, sin que \ncon la prórroga el término exceda de treinta (30) días. \nEn el acto que decrete la práctica de pruebas se indicará el día en que vence el término \nprobatorio. \nArtículo 80. Decisión de los recursos. Vencido el período probatorio, si a ello hubiere \nlugar, y sin necesidad de acto que así lo declare, deberá proferirse la decisión motivada \nque resuelva el recurso. \nLa decisión resolverá todas las peticiones que hayan sido oportunamente planteadas y \nlas que surjan con motivo del recurso.”\nAsí las cosas, en virtud de la competencia para conocer del recurso de reposición contra \nun acto administrativo, le exige e impone a la autoridad, el deber de analizar los diferentes \nfactores dentro del cual la razonabilidad de la materia objeto de decisión debe primar y ser \ncoherente con los principios que rigen las actuaciones administrativas.\nUna vez revisado el escrito por medio del cual se ha interpuesto el recurso de reposición \npor parte de la Sociedad C.I. COLOMBIAN NATURAL RESOURCES I S.A.S. EN \nREORGANIZACIÓN en contra de la Resolución 2487 del 26 de octubre de 2023 y los \nantecedentes que dieron lugar al mismo, se verificó que los requisitos a los que alude el \nartículo 77 del Código de Procedimiento Administrativo y de lo Contencioso fueron \ndebidamente cumplidos por el recurrente, como se expone a continuación:\n-\nSer interpuesto dentro del término establecido, esto es, dentro de los diez (10) días \nhábiles siguientes a la fecha de notificación del acto administrativo: Frente a este \nrequisito, se observa que el recurso de reposición se interpuso el 14 de noviembre \ndel 2023, esto es, dentro de los diez (10) días hábiles después de la notificación del \nacto que se recurre, lo cual sucedió efectivamente el día 27 de octubre de 2023.\n-\nCapacidad legal del recurrente: Al respecto, una vez verificado el escrito de \nreposición, se constató que el recurso de reposición fue interpuesto por el señor Luis \nMiguel García, quien ostenta la calidad de Representante legal de la sociedad C.I. \nCOLOMBIAN NATURAL RESOURCES I S.A.S EN REORGANIZACIÓN, de \nacuerdo con el Certificado de Existencia y Representación Legal, que remiten junto \ncon el recurso de reposición. \n\nResolución No. 003060       Del 21 DIC. 2023          Hoja No. 7 de 18\n“Por la cual se resuelve un recurso de reposición interpuesto en contra de la Resolución \n2487 del 26 de octubre de 2023 y se adoptan otras determinaciones”\nPágina 7 de 18\n-\nIndicación de los argumentos de inconformidad: El recurso de reposición \npresentado, indica cuales son las razones de inconformidad con la decisión \nadoptada por esta Autoridad Nacional mediante la Resolución 2487 del 26 de \noctubre de 2023. \n-\nIndicar el nombre y la dirección del recurrente, así como la dirección electrónica si \ndesea ser notificado por este medio: Frente a este requisito, el recurrente indicó la \ncalle 90 No. 19 - 41, o en el correo electrónico: juridica@cnrcol.com.\n-\nSolicitar y aportar las pruebas que se pretende hacer valer: Para el caso que nos \nocupa, dentro del recurso de reposición en comento, el recurrente no solicitó que se \ndecrete y/o practiquen pruebas, y por parte de esta Autoridad Nacional no se hace \nnecesario decretarlas de oficio.\nEn consonancia con lo anterior, dado que se verificó el cumplimiento de los requisitos \nlegales establecidos en la norma vigente para la procedencia del recurso de reposición, se \nencuentra pertinente continuar con el análisis de los motivos de inconformidad del \nrecurrente.\nCONSIDERACIONES DE LA ANLA FRENTE AL RECURSO DE REPOSICIÓN \nINTERPUESTO\nEsta Autoridad Nacional analizará el recurso presentado por el recurrente frente a la \nResolución 2487 del 26 de octubre de 2023, en razón a ello, primero se exponen los \nargumentos y peticiones, frente a los cuales serán expuestas las consideraciones técnicas \ny jurídicas, a efectos de confirmar, modificar, aclarar, adicionar o revocar, según el caso.\nI.\nDEL RECURSO DE REPOSICIÓN INTERPUESTO POR LA SOCIEDAD C.I. \nCOLOMBIAN NATURAL RESOURCES I S.A.S EN REORGANIZACIÓN. \nA.\nDisposición recurrida \nLa sociedad C.I. COLOMBIAN NATURAL RESOURCES I S.A.S EN REORGANIZACIÓN, \ninterpuso recurso de reposición mediante comunicación con radicación ANLA \n20236200861812 del 14 de noviembre del 2023, en contra del numeral segundo del artículo \nsegundo de la Resolución 2487 del 26 de octubre de 2023, por la cual entre otras cosas, \nesta Autoridad Nacional, decidió prorrogar por un periodo de cinco (5) años la concesión de \naguas subterráneas procedentes del pozo denominado “La Francia”, e imponer \nobligaciones en los siguientes términos:\n“ARTÍCULO SEGUNDO. La sociedad C.I. COLOMBIAN NATURAL RESOURCES I \nS.A.S, deberá dar cumplimiento a las siguientes obligaciones en los términos y \ncondiciones establecidos para cada una de ellas, de conformidad con lo expuesto en \nla parte considerativa del presente acto administrativo:\n(…)\n\nResolución No. 003060       Del 21 DIC. 2023          Hoja No. 8 de 18\n“Por la cual se resuelve un recurso de reposición interpuesto en contra de la Resolución \n2487 del 26 de octubre de 2023 y se adoptan otras determinaciones”\nPágina 8 de 18\n2. Remitir a la Autoridad, con destino al expediente ASB0008 con una frecuencia \nbimestral, el Informe de Cumplimiento Ambiental donde se detallen las obligaciones \nestablecidas a la concesión. \n(…)”\nB.\nPetición del recurrente \nA continuación, se citan las peticiones presentadas por parte de la sociedad C.I. \nCOLOMBIAN NATURAL RESOURCES I S.A.S. EN REORGANIZACIÓN así:\n“De acuerdo con los argumentos de reproche expuestos, solicitamos a la ANLA se \nREPONGA en el sentido de MODIFICAR el numeral segundo del artículo segundo de \nla Resolución No. 2487 de 2023, estableciendo que la periodicidad en la presentación \nde los Informes de Cumplimiento Ambiental es semestral”\nC.\nArgumentos del recurrente \nA continuación, se citan los argumentos presentados por parte del recurrente que sustentan \nel escrito de reposición interpuesto, acto seguido se incluirán las consideraciones tanto \ntécnicas como jurídicas de la ANLA frente a cada uno de ellos, a efectos de decidir en \nderecho el acto impugnado:\n“(…)\nDel Precepto Normativo Impugnado. \nLa ANLA con la Resolución No. 2487 de 2023, estableció: \n“Artículo Segundo. La sociedad C.I. COLOMBIAN NATURAL RESOURCES I S.A.S, \ndeberá dar cumplimiento a las siguientes obligaciones en los términos y condiciones \nestablecidos para cada una de ellas, de conformidad con lo expuesto en la parte \nconsiderativa del presente acto administrativo: \n2. Remitir a esta Autoridad Nacional, con una frecuencia bimestral dentro del \nInforme de Cumplimiento Ambiental, y con destino al expediente ASB0008, el \ncumplimiento de las obligaciones establecidas para la concesión de aguas objeto de \nla presente prórroga”. Destacado es nuestro. \nDel Principio de Proporcionalidad y el Principio de Razonabilidad \nCon la Resolución No. 2487 de 2023, en concreto el numeral segundo del artículo \nsegundo, la ANLA le impuso a CNR I la obligación de presentar o remitir de manera \nbimestral el Informe de Cumplimiento Ambiental junto las evidencias de cumplimiento \nde las obligaciones derivadas de la concesión de aguas subterráneas que le fue \nprorrogada. \nSin embargo, analizada la Resolución Impugnada por la ANLA, no se identificaron los \nfundamentos fácticos, técnicos o jurídicos en virtud de los cuales la autoridad \n\nResolución No. 003060       Del 21 DIC. 2023          Hoja No. 9 de 18\n“Por la cual se resuelve un recurso de reposición interpuesto en contra de la Resolución \n2487 del 26 de octubre de 2023 y se adoptan otras determinaciones”\nPágina 9 de 18\nambiental resolvió establecer o fijar la periodicidad referida, modificando el término \ninicialmente dado de seis (06) meses para satisfacer esa misma obligación. \nAl respecto, en los considerandos del acto administrativo únicamente se indicó: \n“Así mismo, la sociedad C. I. COLOMBIAN NATURAL RESOURCES I S.A.S., deberá \nrealizar mediciones trimestrales del nivel estático, previa interrupción del bombeo \ndurante un periodo de 24 horas mínimo; los resultados obtenidos se deben \nrelacionar en los Informes de Cumplimiento Ambiental correspondientes, \nincluyendo todos los consecutivos históricos de los datos adquiridos comparados \nentre sí, de forma tal que se logren identificar descensos de nivel piezométrico en el \ntiempo de vigencia de la concesión, de conformidad con lo establecido en el concepto \ntécnico 6749 del 12 de octubre de 2023”. Destacado es nuestro. \nDe acuerdo con lo anterior, el numeral tercero del artículo segundo de la Resolución \nNo. 2487 de 2023 estableció, paralelamente, la obligación de realizar mediciones del \nnivel estático trimestralmente, remitiendo los resultados en los respectivos Informes \nde Cumplimiento Ambiental. \nCon lo expuesto, queda en evidencia la desproporcionalidad del plazo de la obligación \nrecurrida, pues parte de la información que con estos debe remitirse a la autoridad \nambiental \ntiene \nun \nplazo \nde \ncumplimiento \nsuperior.\nConsiderando además que dicho termino resulta ampliamente insuficiente, el \npresente recurso tiene por objeto solicitar su modificación, en el sentido que se \nmantenga en una periodicidad semestral, esto, en virtud de los principios de \nproporcionalidad y razonabilidad que deben permear todas las actuaciones proferidas \npor la administración. \nLo anterior, en la medida que el plazo dado para la presentación a la ANLA de los \nInformes de Cumplimiento Ambiental excede el límite de lo que debe entenderse por \nun análisis de razonabilidad, obteniendo como resultado una decisión que resulta \ndesproporcionada. \nEn este sentido se llama la atención de la autoridad, respecto de las actividades \npreparatorias que se requieren para la elaboración y alistamiento del Informe en \ncomento, el cual debe ir acompañado de los respectivos soportes o evidencias de \ncumplimiento. \nNos referimos por ejemplo al desarrollo de las actividades que incluyen, pero no se \nlimitan a, la suspensión de las actividades de bombeo, la programación de mediciones \nque conforme ordena la Resolución Impugnada debe ser de mínimo 24 horas, la \ncomparación de los datos históricos, el alistamiento de los documentos, la \npreparación del insumo y la final presentación a la ANLA. Actividades que por su \nespecialidad requieren en algunos de los casos la contratación de terceros idóneos, \ncalificados y acreditados, para quienes el plazo en mención resulta igualmente \ninsuficiente. Además del procesamiento y análisis de la información recabada. \n\nResolución No. 003060       Del 21 DIC. 2023          Hoja No. 10 de 18\n“Por la cual se resuelve un recurso de reposición interpuesto en contra de la Resolución \n2487 del 26 de octubre de 2023 y se adoptan otras determinaciones”\nPágina 10 de 18\nAsí las cosas, cabe precisar que el principio de proporcionalidad tiene como fin \nracionalizar las decisiones de la función administrativa, propendiendo por garantizar \nel interés general el cual deberá ser entendido como la razón de ésta. Finalidad que \ncomo hemos expuesto no se cumple en el caso concreto, en donde el fin del Informe \nde Cumplimiento Ambiental es desnaturalizado al requerirse en una periodicidad que \nno permite cumplir con su objetivo, el cual es informar sobre el cumplimiento de las \nobligaciones de la concesión de aguas y facilitar el correspondiente seguimiento \nambiental por parte de la ANLA. \nSobre el particular, resulta importante poner de presente que el artículo 209 de la \nConstitución Política de Colombia establece que, “Las autoridades administrativas \ndeben coordinar sus actuaciones para el adecuado cumplimiento de los fines del \nEstado.”. Esto, propendiendo por la observancia de los principios que ha establecido \nla Carta Magna, la ley y la jurisprudencia en lo que respecta al ejercicio de la función \nadministrativa. \nConsiderando lo anterior, se tiene que, dentro de los principios en comento, se \nencuentra el de proporcionalidad, frente al cual la Honorable Corte Constitucional \nmediante Sentencia T 209 del 2006, Magistrado ponente Jaime Córdoba Triviño, ha \nmanifestado: \n“Es claro que una arista del principio de la buena fe es la proporcionalidad en la \nsanción o prestación impuesta. Es decir, que el de proporcionalidad es también un \npostulado que informa toda la actividad administrativa y no pretende otra cosa \nque la adecuación entre medios y fines, entre las medidas utilizadas y las \nnecesidades que se tratan de satisfacer.” Destacado es nuestro.\nSobre el particular, ha manifestado también la Honorable Corte Constitucional: \n“El concepto de proporcionalidad comprende tres conceptos parciales: la adecuación \nde los medios escogidos para la consecución del fin perseguido, la necesidad de la \nutilización de esos medios para el logro del fin (esto es, que no exista otro medio que \npueda conducir al fin y que sacrifique en menor medida los principios constitucionales \nafectados por el uso de esos medios), y la proporcionalidad en sentido estricto entre \nmedios y fin, es decir, que el principio satisfecho por el logro de este fin no sacrifique \nprincipios constitucionalmente más importantes.”2 \nAsí las cosas, puede colegirse que por el hecho de que las autoridades ambientales \nestén en la obligación de ejercer la defensa y preservación del medio ambiente las \nmismas no podrán entrar a emitir pronunciamientos por medio de los cuales \nocasionen unas situaciones desproporcionadas a los administrados, por medio de las \ncuales generen cargas excesivas para estos, como lo es la exigencia de Informes de \nCumplimiento Ambiental cada dos meses. \nLo aquí expuesto, sin perjuicio que nuestro ordenamiento legal ambiental prevé que \nel Informe de Cumplimiento Ambiental, se tenga como una herramienta de verificación \ndel cumplimiento y efectividad de los compromisos que el titular de una licencia \nambiental haya asumido ante la autoridad ambiental competente. \n\nResolución No. 003060       Del 21 DIC. 2023          Hoja No. 11 de 18\n“Por la cual se resuelve un recurso de reposición interpuesto en contra de la Resolución \n2487 del 26 de octubre de 2023 y se adoptan otras determinaciones”\nPágina 11 de 18\nEn tal sentido, de manera expresa la Resolución No. 0077 de 20191 proferida por el \nMinisterio de Ambiente y Desarrollo Sostenible con el propósito de reglamentar la \nfecha o periodicidad de entrega de los Informes de Cumplimiento Ambiental, sostuvo:\nEn este orden de ideas, el Informe de Cumplimiento Ambiental resultará exigible \núnicamente cuando nos encontremos ante una Licencia Ambiental o Plan de Manejo \nAmbiental, lo cual no es nuestro caso. (…)”\nCONSIDERACIONES TÉCNICAS DE LA AUTORIDAD NACIONAL DE LICENCIAS \nAMBIENTALES – ANLA, FRENTE AL RECURSO DE REPOSICIÓN INTERPUESTO POR \nLA \nSOCIEDAD \nC.I. \nCOLOMBIAN \nNATURAL \nRESOURCES \nI \nS.A.S. \nEN \nREORGANIZACIÓN.\nEl equipo evaluador ambiental de la ANLA una vez adelantado el análisis de los argumentos \ntécnicos presentados por el recurrente en el recurso de reposición interpuesto a través de \ncomunicación con radicado ANLA 20236200861812 del 14 de noviembre del 2023, emitió \nel Concepto Técnico 9112 del 20 de diciembre de 2023, en el cual se consideró lo siguiente: \n“(…)\nCon respecto a lo indicado por la Sociedad:\nRespecto a la solicitud de modificación del numeral 2 del artículo segundo de la \nResolución 2487 del 26 de octubre de 2023, allegada por la Sociedad C.I. \nCOLOMBIAN NATURAL RESOURCES I S.A.S EN REORGANIZACIÓN, mediante el \nradicado ANLA 20236200861812 del 14 de noviembre de 2023, el equipo evaluador \nambiental de la ANLA identificó que la petición se sustenta principalmente en tres \nargumentos. En primer lugar, el hecho de que la modificación de la frecuencia en la \npresentación de los informes (semestral a bimestral) es algo que no se encuentra \njustificado en el pronunciamiento emitido por esta Autoridad. En este mismo sentido, \nel segundo argumento es que el numeral 3 del mismo artículo segundo de la \nResolución 2487 del 26 de octubre de 2023 obliga a reportar las mediciones de los \nniveles estáticos del pozo con una frecuencia trimestral, mayor a la de la presentación \nde los informes. En último lugar, en su solicitud la Sociedad manifestó la imposibilidad \nde presentar los informes con la frecuencia requerida tomando en cuenta que las \n“actividades preparatorias que se requieren para la elaboración y alistamiento del \nInforme en comento, el cual debe ir acompañado de los respectivos soportes o \nevidencias del cumplimiento” demandan unos tiempos para los que dos meses no \nresultan suficientes. \nCon relación al primer argumento, el equipo evaluador ambiental de la ANLA \nreconoce que los Informes de Cumplimiento Ambiental han sido presentados por la \nSociedad con una frecuencia semestral durante la vigencia de la Resolución 1110 del \n\nResolución No. 003060       Del 21 DIC. 2023          Hoja No. 12 de 18\n“Por la cual se resuelve un recurso de reposición interpuesto en contra de la Resolución \n2487 del 26 de octubre de 2023 y se adoptan otras determinaciones”\nPágina 12 de 18\n24 de junio de 2020 y estos incluyen información medida con una frecuencia menor a \nla semestral. Lo anterior es el caso de los caudales de explotación y el monitoreo de \nlos parámetros fisicoquímicos y microbiológicos del pozo, los cuales se monitorean \ncon una repetición mensual y trimestral respectivamente. \nEn este mismo sentido, dando respuesta al segundo argumento planteado por la \nSociedad, el equipo evaluador ambiental de la ANLA está de acuerdo con el hecho \nde que la obligación de monitorear los niveles estáticos del pozo y realizar su \nmonitoreo fisicoquímico y microbiológico con una frecuencia trimestral no es \nconsecuente con la obligación de presentar los informes de cumplimiento ambiental \ncada dos meses, como lo establece el numeral 2 del artículo segundo de la \nResolución 2487 del 26 de octubre de 2023. Lo anterior, llevaría a un escenario en \ndonde múltiples informes contarían con la misma información reportada más de una \nvez, dado que la Sociedad deberá presentar un informe antes de que se haya \ncumplido el plazo para realizar un nuevo monitoreo de niveles y parámetros. \nPor lo anterior, el equipo evaluador ambiental de la ANLA considera que la \npresentación de Informes de Cumplimiento Ambiental con una frecuencia semestral \nha resultado adecuada para llevar a cabo el seguimiento de la captación que se \nrealiza en el pozo profundo La Francia. Dado que de esta manera la Sociedad reporta \ninsumos y análisis con una frecuencia que permite a la Autoridad identificar cualquier \nanomalía en el comportamiento de las aguas subterráneas que pudieran divergir de \nlo autorizado por el permiso otorgado. \nEn cuanto al tercer argumento, asociado con las dificultades de cumplir con el \nalistamiento y presentación de los informes en una frecuencia bimestral, como se \nexpuso anteriormente, el equipo evaluador ambiental de la ANLA reconoce que \npresentar informes cada dos meses va en contravía de otras obligaciones. En este \nsentido, se acepta que resulta innecesario que la Sociedad lleve a cabo todas las \nactividades que conllevan presentar un Informe de Cumplimiento Ambiental si para \ndos informes seguidos no se estaría presentando información nueva que aporte al \nseguimiento de las actividades que se realizan en el pozo. \nPor los motivos expuestos anteriormente, el equipo evaluador ambiental de la ANLA \nconsidera pertinente modificar el numeral 2 del Artículo Segundo de la Resolución \n2487 del 26 de octubre de 2023, el cual quedará de la siguiente manera: \n“2. Remitir a esta Autoridad Nacional, con una frecuencia semestral dentro del \nInforme de Cumplimiento Ambiental, y con destino al expediente ASB0008, el \ncumplimiento de las obligaciones establecidas para la concesión de aguas \nobjeto de la presente prórroga.”  (…)\nCONSIDERACIONES JURÍDICAS DE LA AUTORIDAD NACIONAL DE LICENCIAS \nAMBIENTALES – ANLA, FRENTE AL RECURSO DE REPOSICIÓN INTERPUESTO POR \nLA \nSOCIEDAD \nC.I. \nCOLOMBIAN \nNATURAL \nRESOURCES \nI \nS.A.S. \nEN \nREORGANIZACIÓN.   \nLa sociedad recurrente manifiesta que el plazo establecido en el numeral segundo del \nartículo segundo de la Resolución 2487 del 26 de octubre de 2023 excede el límite de lo \n\nResolución No. 003060       Del 21 DIC. 2023          Hoja No. 13 de 18\n“Por la cual se resuelve un recurso de reposición interpuesto en contra de la Resolución \n2487 del 26 de octubre de 2023 y se adoptan otras determinaciones”\nPágina 13 de 18\nque debe entenderse por un análisis de razonabilidad, obteniendo como resultado una \ndecisión que resulta desproporcionada. Aunado a ello, hace referencia al artículo 209 \nConstitucional en cuanto a que “… Las autoridades administrativas deben coordinar sus \nactuaciones para el adecuado cumplimiento de los fines del Estado.” \nAl respecto, es pertinente hacer referencia al principio de proporcionalidad que, a criterio \ndel recurrente, es transgredido con la decisión establecida en el numeral segundo del \nartículo segundo del acto recurrido. \nEn primer lugar, debe mencionarse que el deber de adoptar decisiones honrando el \nprincipio de proporcionalidad, se encuentra consagrado en el artículo 44 de la Ley 1437 de \n2011, en los siguientes términos “… En la medida en que el contenido de una decisión de \ncarácter general o particular sea discrecional, debe ser adecuada a los fines de la norma \nque la autoriza, y proporcional a los hechos que le sirven de causa” (subrayado fuera del \ntexto)\n \nDe lo anterior, se destaca que la proporcionalidad tiene su esencia en que las decisiones \nadministrativas se adecúen a los preceptos normativos que rigen los respectivos trámites y \nademás cuente con la debida motivación que da origen a la decisión. \nAhora bien, la jurisprudencia constitucional ha desarrollado el concepto del principio de \nproporcionalidad, el cual a consideración de la Corte Constitucional, “… comprende tres \nconceptos parciales: la adecuación  de los medios escogidos para la consecución del fin \nperseguido, la necesidad de la utilización de esos medios para el logro del fin (esto es, que \nno exista otro medio que pueda conducir al fin y que sacrifique en menor medida \nlos principios constitucionales afectados por el uso de esos medios), y la proporcionalidad \nen sentido estricto entre medios y fin, es decir, que el principio satisfecho por el logro de \neste fin no sacrifique principios constitucionalmente más importantes..”1\nAsí mismo, frente al mencionado principio el Alto Tribunal Constitucional, ha señalado que \n“… la proporcionalidad, a pesar de constituirse en “una directiva no explícitamente \npositivada de la Carta Política”, encuentra sustento como principio de interpretación \nconstitucional en su función como el “marco del estado de derecho” que busca asegurar \nque el poder público actúe dentro de sus competencias y sin excederse en el ejercicio de \nsus funciones. También, ha indicado que la proporcionalidad como juicio rector de las \nactuaciones públicas permite establecer, en materia de control jurisdiccional de \nconstitucionalidad, cuándo una determinada norma genera una afectación ius fundamental \nque resulta excesiva para el beneficio que reporta. (…)”2 \nEn este sentido, en el trámite de interés se dio estricto cumplimiento al debido proceso, \ngarantizando el cumplimiento normativo aplicable y los preceptos legales y constitucionales, \nadelantando en forma adecuada el trámite administrativo de evaluación de la solicitud de \nprórroga de la concesión de aguas subterráneas procedentes del pozo denominado “La \nFrancia”, es evidente la garantía del debido proceso que se otorga la posibilidad de \ninterponer recurso de reposición contra las decisiones adoptadas, con la finalidad, como se \n1 Corte Constitucional, Sentencia C-022/96, Magistrado Ponente: Dr. Carlos Gaviria. \n2 Corte Constitucional. Sentencia C-144/15, Referencia: Expediente D-10347. Magistrada (e) Ponente: Martha Victoria \nSáchica Méndez. 6 de abril de 2015.\n\nResolución No. 003060       Del 21 DIC. 2023          Hoja No. 14 de 18\n“Por la cual se resuelve un recurso de reposición interpuesto en contra de la Resolución \n2487 del 26 de octubre de 2023 y se adoptan otras determinaciones”\nPágina 14 de 18\npresenta en este caso, que el interesado pueda hacer ver un posible error en la decisión \nque puede ser corregido por la misma vía, por lo que se aclara que en el caso que nos \natañe le asiste la razón al recurrente pues como se expuso en las consideraciones técnicas \nla obligación del numeral segundo del artículo segundo de la Resolución 2487 de 2023 \nresulta desproporcional al fin perseguido, por ende se acepta la pretensión del recurrente. \nEn cuanto al principio de razonabilidad, se tiene que la Corte Constitucional, lo ha definido \ncomo:\n“El contenido mismo del concepto de “razonabilidad” ha sido explorado por la Corte, \nque en sentencia, dijo “hace relación a que un juicio, raciocinio o idea esté conforme \ncon la prudencia, la justicia o la equidad que rigen para el caso concreto. Es decir, \ncuando se justifica una acción o expresión de una idea, juicio o raciocinio por su \nconveniencia o necesidad”. Se trata de garantizar que, en cada caso, la interpretación \nde las disposiciones jurídicas se lleve a cabo acudiendo a un criterio finalista, que \ntome en cuenta las metas y objetivos establecidos en la Carta, de acuerdo con los \ncriterios “pro-libertatis” y “pro-homine”, derivados de la filosofía humanista que inspira \nel constitucionalismo colombiano.”3\nPor todo lo anterior, en el caso en concreto, luego del análisis, el equipo evaluador \nambiental de la ANLA manifestó que “la obligación de monitorear los niveles estáticos del \npozo y realizar su monitoreo fisicoquímico y microbiológico con una frecuencia trimestral no \nes consecuente con la obligación de presentar los informes de cumplimiento ambiental cada \ndos meses, como lo establece el numeral 2 del artículo segundo de la Resolución 2487 del \n26 de octubre de 2023” , por lo anterior se reitera que le asiste la razón al recurrente y se \nprocederá a ajustar de conformidad en la parte resolutiva del presente acto administrativo.\nPor su parte, el artículo 209 de la Constitución establece que: “La función administrativa \nestá al servicio de los intereses generales y se desarrolla con fundamento en los principios \nde igualdad, moralidad, eficacia, economía, celeridad, imparcialidad y publicidad, mediante \nla descentralización, la delegación y la desconcentración de funciones. Las autoridades \nadministrativas deben coordinar sus actuaciones para el adecuado cumplimiento de los \nfines del Estado. La administración pública, en todos sus órdenes, tendrá un control interno \nque se ejercerá en los términos que señale la ley”\n \nEn razón a lo anterior esta Autoridad Nacional, se permite manifestar que si ha dado \ncabalidad a los principios mencionados anteriormente en todo el trámite administrativo \nadelantado por esta Entidad, toda vez que todos los actos administrativos fueron \ndebidamente notificados y publicados Gaceta Ambiental de la página web de la Autoridad \nNacional de Licencias Ambientales, igualmente con la finalidad de que las personas que \nquisieran oponerse al trámite se fijó aviso mediante el cual se informó que se practicaría \nvisita técnica, dando cumplimiento a las obligaciones legales impuestas por el ordenamiento \njurídico. \nFrente a los principios generales que rigen el actuar de la administración que se encuentran \nconsagrados en el artículo 3 del Código de Procedimiento Administrativo y lo de \n3 Corte Constitucional, Sentencia C-1026/01, Referencia: Expediente D-3468. Magistrado Ponente: Eduardo Montealegre. 26 \nde septiembre de 2001.\n\nResolución No. 003060       Del 21 DIC. 2023          Hoja No. 15 de 18\n“Por la cual se resuelve un recurso de reposición interpuesto en contra de la Resolución \n2487 del 26 de octubre de 2023 y se adoptan otras determinaciones”\nPágina 15 de 18\nContencioso Administrativo, se tiene que el trámite de evaluación de solicitud de prórroga \nde la concesión para el uso de las aguas, se encuentra fundamentado en los principios \nconstitucionales y por ello, responden y atienden las exigencias legales y se encuentran \nsujetas al marco normativo que rige su actuación, respetando de esta manera el debido \nproceso y honrando el principio de legalidad en todas sus manifestaciones, lo que garantiza \nel respeto consecuente del principio de seguridad jurídica y del debido proceso.\nAsí mismo, en concordancia con dicha garantía constitucional, el artículo 3 del Código de \nProcedimiento Administrativo y de lo Contencioso Administrativo, señala que las \nactuaciones administrativas se desarrollarán, especialmente, con arreglo a los principios \ndel debido proceso, igualdad, imparcialidad, buena fe, moralidad, participación, \nresponsabilidad, transparencia, publicidad, coordinación, eficacia, economía y celeridad.\nEn tal virtud, frente al principio del debido proceso, debe señalarse que el mismo se \nencuentra consagrado como derecho fundamental en el artículo 29 de la Constitución \nPolítica de Colombia y garantiza que exista una seguridad sustancial y procedimental en \ntoda decisión judicial o administrativa que se adopte, lo cual implica que dichas decisiones \ndeben ser proferidas con estricta sujeción a las ritualidades establecidas en la ley para cada \nproceso, sin dilaciones injustificadas y emitidas por la autoridad competente.\nPor su parte, en cuanto al principio de eficacia, esta Autoridad considera que en el trámite \nen comento se propendió porque el procedimiento ambiental de prórroga de la concesión \nde aguas subterránea, lograra su finalidad dando cumplimiento al principio de eficacia de \nlas actuaciones administrativas, que para el caso del permiso de concesión de aguas, arrojó \ncomo resultado la prórroga del mismo, ya que como se explicó, se dio cumplimiento a lo \nrequerido por el Decreto 1076 de 2015 dentro del trámite de evaluación emitiendo el acto \nadministrativo aquí recurrido.\n \nLo anterior implica que esta Autoridad logró la finalidad del trámite puesto que de acuerdo \ncon el procedimiento establecido en el Decreto 1076 de 2015, se prorrogó la concesión de \naguas solicitada. Así las cosas, el procedimiento se surtió hasta su culminación, de \nconformidad con lo establecido en dicho precepto normativo.\nEn razón a ello, esta Autoridad Nacional dio cabal cumplimiento de los principios de las \nactuaciones administrativas y de las normas en materia ambiental, ya que para el trámite \nde evaluación de prórroga de la concesión de aguas subterráneas procedentes del pozo \ndenominado “La Francia”, como se ha venido mencionando, la ANLA dio cabal \ncumplimiento a las ritualidades establecidas en el procedimiento establecido en el Decreto \n1076 de 2015 y demás normas aplicables para el trámite de prórroga de concesión de aguas  \nsubterráneas. \n \nTambién, es menester señalar que el artículo 42 de la ley 1437 de 2011, establece la \nobligación de motivación de los actos administrativos. Al respecto el Consejo de Estado ha \nsentado jurisprudencia refiriéndose a los requisitos de la motivación de los actos \nadministrativos afirmando que los motivos de la decisión deben ser ciertos claros y \nobjetivos:\n\nResolución No. 003060       Del 21 DIC. 2023          Hoja No. 16 de 18\n“Por la cual se resuelve un recurso de reposición interpuesto en contra de la Resolución \n2487 del 26 de octubre de 2023 y se adoptan otras determinaciones”\nPágina 16 de 18\n\"La motivación de un acto implica que la manifestación de la administración tiene \nuna causa que la justifica, y ella debe obedecer a criterios de legalidad, certeza de \nlos hechos, debida calificación jurídica y apreciación razonable\"4\nAsí las cosas, frente al principio legalidad de las actuaciones de la administración y la debida \nmotivación del acto administrativo, debemos acudir a que los actos administrativos \nproferidos por esta Autoridad Nacional se expiden atendiendo las competencias del Decreto \n3573 de 20115 y Decreto 1076 de 2015, y que las motivaciones de orden legal y técnico de \naquellos corresponden al ordenamiento jurídico vigente, lo anterior sin perjuicio de que las \nmotivaciones y decisiones puedan ser objeto de cuestionamientos, los cuales son \ntramitados vía recurso de reposición.\nVale decir, que, en todo caso esta es una acción (la del recurso de reposición) que, si bien \npermite al interesado señalar ante la Administración, las razones de su desacuerdo, \ntambién permite que la Administración revise, ella misma, sus propios actos, los modifique, \naclare, adicione o revoque, de acuerdo con la pertinencia y conducencia de los argumentos \ny pruebas presentados por el interesado en la decisión.\nLo anterior, encuentra pleno sustento además en los principios orientadores de las \nactuaciones administrativas, especialmente, en los principios de economía, celeridad y \neficacia, cuyo alcance ha sido definido en el artículo tercero del Código de Procedimiento \nAdministrativo y de lo Contencioso Administrativo.\nAunado a lo anterior, el Concepto Técnico 9112 del 20 de diciembre de 2023, señaló:\n“(…) En cuanto al tercer argumento, asociado con las dificultades de cumplir con el \nalistamiento y presentación de los informes en una frecuencia bimestral, como se \nexpuso anteriormente, el equipo evaluador ambiental de la ANLA reconoce que \npresentar informes cada dos meses va en contravía de otras obligaciones. En \neste sentido, se acepta que resulta innecesario que la Sociedad lleve a cabo \ntodas las actividades que conllevan presentar un Informe de Cumplimiento \nAmbiental si para dos informes seguidos no se estaría presentando información \nnueva que aporte al seguimiento de las actividades que se realizan en el pozo.  \n(…)”.  (Negrilla fuera del texto)\nPor lo anterior, teniendo en cuenta que nos encontramos en el escenario en que esta \nAutoridad Nacional puede revisar sus actuaciones de conformidad con lo establecido en el \nartículo 74 de la Ley 1437 del 2011, y en aras de garantizar el derecho de defensa y \ncontradicción del recurrente, se realizó el correspondiente análisis técnico de las \npretensiones y argumentos esgrimidos por el recurrente, considerando que es factible \ndespachar de manera favorable su solicitud, por lo que en la parte resolutiva del presente \nacto administrativo se dispondrá sobre el particular. \nEn mérito de lo expuesto,\nRESUELVE\n4 Consejo de Estado, Sección Cuarta, Sentencia 2007-00169 de junio 13 de 2013. M.P. Carmen Teresa Ortiz.\n5 Modificado por el Decreto 376 de 2020.\n\nResolución No. 003060       Del 21 DIC. 2023          Hoja No. 17 de 18\n“Por la cual se resuelve un recurso de reposición interpuesto en contra de la Resolución \n2487 del 26 de octubre de 2023 y se adoptan otras determinaciones”\nPágina 17 de 18\nARTÍCULO PRIMERO. Reponer en el sentido de modificar el numeral 2 del artículo \nsegundo de la Resolución 2487 del 26 de octubre de 2023, de conformidad con las razones \nexpuestas en la parte considerativa del presente acto administrativo, el cual quedará así:\n“2. Remitir a esta Autoridad Nacional, con una frecuencia semestral dentro del Informe \nde Cumplimiento Ambiental, y con destino al expediente ASB0008, el cumplimiento \nde las obligaciones establecidas para la concesión de aguas objeto de la presente \nprórroga.”\nARTÍCULO SEGUNDO. Por la Autoridad Nacional de Licencias Ambientales – ANLA, \nnotificar el contenido del presente acto administrativo personalmente o por aviso, cuando a \nello hubiere lugar, al representante legal o apoderado debidamente constituido de la \nsociedad C.I. COLOMBIAN NATURAL RESOURCES I S.A.S. EN REORGANIZACIÓN, de \nconformidad con los artículos 67 y siguientes del Código de Procedimiento Administrativo y \nde lo Contencioso Administrativo. \nARTÍCULO TERCERO. Por la Autoridad Nacional de Licencias Ambientales – ANLA, \ncomunicar el presente acto administrativo a la alcaldía del municipio de El Paso en el \ndepartamento de Cesar, a la Corporación Autónoma Regional del Cesar – CORPOCESAR \ny a la Procuraduría Delegada para Asuntos Ambientales, Minero Energéticos y Agrarios.\nARTICULO CUARTO. Por la Autoridad Nacional de Licencias Ambientales, publicar la \npresente Resolución en la Gaceta Ambiental de esta Autoridad de conformidad con lo \nestablecido en el artículo 71 de la Ley 99 de 1993. \nARTÍCULO QUINTO. Contra el presente acto administrativo no procede recurso alguno, de \nconformidad con lo dispuesto en el artículo 87 del Código de Procedimiento Administrativo \ny de lo Contencioso Administrativo. \nNOTIFÍQUESE, COMUNÍQUESE, PUBLÍQUESE Y CÚMPLASE\nDado en Bogotá D.C., a los 21 DIC. 2023\nANA MARIA LLORENTE VALBUENA\nSUBDIRECTOR DE EVALUACION DE LICENCIAS AMBIENTALES\n\nResolución No. 003060       Del 21 DIC. 2023          Hoja No. 18 de 18\n“Por la cual se resuelve un recurso de reposición interpuesto en contra de la Resolución \n2487 del 26 de octubre de 2023 y se adoptan otras determinaciones”\nPágina 18 de 18\nIVONNE NATALIA PULIDO RINCON\nCONTRATISTA\nLUISA FERNANDA OLAYA OLAYA\nCONTRATISTA\nDIANA LLANOS DIAZ\nPROFESIONAL ESPECIALIZADO\nMIGUEL FERNANDO SALGADO PAEZ\nCONTRATISTA\nExpediente No. ASB0008\nConcepto Técnico 9112 del 20 de diciembre de 2023\nFecha: diciembre de 2023\nProceso No.: 20233000030604\nNota: Este es un documento electrónico generado desde los Sistemas de Información de la ANLA. El original reposa en los \narchivos digitales de la Entidad\n"
}