{
  "fuente": "ANLA_GACETA",
  "numero_resolución": "RESOLUCIÓN N° 00905",
  "fecha_resolución": "2022-05-05",
  "anio_resolucion": "2022",
  "nombre_proyecto": null,
  "nombre_proyecto_normalizado": null,
  "ubicación": "localizado en jurisdicción de los Municipios de",
  "empresa": "OLEODUCTO CENTRAL S.A.",
  "empresa_normalizada": "OLEODUCTO CENTRAL",
  "numero_expediente": "LAM0318",
  "radicados": [
    "2018096106",
    "2021012738",
    "2021135640"
  ],
  "descripcion": "POR LA CUAL SE RESUELVE UN RECURSO DE REPOSICIÓN",
  "tipos_infraccion": [
    "Tala o afectación de bosques"
  ],
  "tipos_infraccion_normalizados": [
    "TALA O AFECTACION DE BOSQUES"
  ],
  "pdf_id": "39033",
  "file_name": "ANLA_39033.pdf",
  "texto_completo": "|\nRepública de Colombia\nMinisterio de Ambiente y Desarrollo Sostenible\nAUTORIDAD NACIONAL DE LICENCIAS AMBIENTALES \n- ANLA –\nRESOLUCIÓN N°  00905\n( 05 de mayo de 2022 )\nOficinas: Carrera 13 A No. 34 – 72 Edificio 13 35 Pisos 8 al 11 Bogotá, D.C.\nCentro de Orientación y Radicación de Correspondencia: Carrera 13 A No. 34 – 72 Edificio 13 35 \nLocales 110 al 112 Bogotá, D.C.  \nCódigo Postal 110311156\nNit.: 900.467.239-2\nLínea de Orientación y Contacto Ciudadano: 57 (1) 2540100 / 018000112998 PBX: 57 (1) 2540111\nwww.anla.gov.co    Email: licencias@anla.gov.co  \nPágina 1 de 19\n“POR LA CUAL SE RESUELVE UN RECURSO DE REPOSICIÓN”\nEL ASESOR DEL DESPACHO DEL DIRECTOR DE LA AUTORIDAD NACIONAL DE \nLICENCIAS AMBIENTALES – ANLA\nEn ejercicio de las facultades legales establecidas mediante la Ley 99 del 22 de diciembre \nde 1993, el Decreto Ley 3573 del 27 de septiembre de 2011, modificado por el Decreto \n376 del 11 de marzo de 2020, por el cual se modifica la estructura de la Autoridad \nNacional de Licencias Ambientales y acorde con lo regulado en el Decreto 1076 del 26 de \nmayo de 2015, la Resolución 423 del 12 de marzo de 2020, la Resolución 669 del 14 de \nabril de 2020 y la Resolución 1957 del 5 de noviembre de 2021, expedidas por la \nAutoridad Nacional de Licencias Ambientales, y\nCONSIDERANDO\nQue mediante Resolución 952 del 31 de agosto de 1995, el entonces Ministerio del Medio \nAmbiente, hoy Ministerio de Ambiente y Desarrollo Sostenible, (En adelante el Ministerio) \notorgó Licencia Ambiental Ordinaria a la Sociedad Oleoducto Central S.A. – OCENSA S.A, \nidentificada con el NIT. 800.251.163-0 para la construcción, operación y funcionamiento del \nOleoducto Cusiana - La Belleza – Vasconia - Coveñas e instalaciones anexas y para la \nampliación del puerto petrolero de Coveñas, localizado en jurisdicción de los Municipios de \nTauramena, Sabanalarga y Monterrey (Casanare); San Luis de Gaceno, Páez, Campo \nHermoso, Miraflores, Zetaquíra, Ramiriquí, Jenesano, Boyacá, Ventaquemada, Rondón, \nTunja, Cucaita, Sora, Samacá, Villa de Leyva, Sáchica, Sutamarchán, Santa Sofía, \nGachantivá, Moniquirá, Otanche y Puerto Boyacá (Boyacá); Puente Nacional, Jesús María, \nFlorián, Albania, La Belleza, Bolívar (Santander); Puerto Nare, Puerto Berrío, Remedios, \nYondó, Segovia, Zaragoza, Caucasia (Antioquia); La Apartada, Buenavista, Planeta Rica, \nPueblo Nuevo, Sahagún, Ciénaga de Oro, Chinú, Chimá, San Andrés de Sotavento, Momil \n(Córdoba); y Palmito y Coveñas (Sucre).\nQue mediante Resolución 189 del 1 de marzo de 1996, el Ministerio modificó la Resolución \n952 del 31 de agosto de 1995, en el sentido de incluir la obligación de utilizar de acuerdo \ncon la oferta y existencias del mercado, sacos fabricados con materiales naturales para la \nejecución de las obras de tendido y bajado de tubería y obras de protección geotécnica.\nQue mediante Resolución 773 del 19 de julio de 1997, el Ministerio resolvió un recurso de \nreposición confirmando en todas sus partes la Resolución 189 del 1 de marzo de 1996.\nQue mediante Resolución 895 del 2 de octubre de 2001, el Ministerio modificó parcialmente \nla Resolución 952 del 31 de agosto de 1995, en el sentido de autorizar a la Sociedad adquirir \npredios como áreas de conservación de los recursos naturales renovables y del medio \nambiente, a localizarse en los municipios pertenecientes a la Corporación Autónoma \nRegional de Chivor (CORPOCHIVOR) afectados por la construcción y operación del \nOleoducto Cusiana — Coveñas.\nQue mediante Auto 2823 del 12 de octubre de 2007, el Ministerio declaró que el \ncumplimiento de las obligaciones de compensación forestal en cuanto a la implementación \n\nResolución No.  00905           Del   05 de mayo de 2022            Hoja No. 2 de 19\n“POR LA CUAL SE RESUELVE UN RECURSO DE REPOSICIÓN”\nOficinas: Carrera 13 A No. 34 – 72 Edificio 13 35 Pisos 8 al 11 Bogotá, D.C.\nCentro de Orientación y Radicación de Correspondencia: Carrera 13 A No. 34 – 72 Edificio 13 35 \nLocales 110 al 112 Bogotá, D.C.  \nCódigo Postal 110311156\nNit.: 900.467.239-2\nLínea de Orientación y Contacto Ciudadano: 57 (1) 2540100 / 018000112998 PBX: 57 (1) 2540111\nwww.anla.gov.co    Email: licencias@anla.gov.co  \nPágina 2 de 19\ndel Programa de Reforestación de 120 hectáreas ubicadas en predios de los Municipios de \nSanta Sofía (40 hectáreas) y Moniquirá (40 hectáreas en la primera etapa) en el \nDepartamento de Boyacá y en el Municipio de Yondó (40 hectáreas) en el Departamento \nde Antioquia, y se requieren las actas de compromiso suscritas con las Corporaciones y/o \nlos municipios involucrados.\nQue mediante Auto 2943 del 22 de septiembre de 2008, el Ministerio reiteró el cumplimiento \nen las obligaciones de compensación forestal establecidas en el artículo segundo de la \nResolución 895 del 2 de octubre de 2001, consistente en la continuación de compra de \npredios en los Municipios de Boyacá, Jenesano y Ventaquemada del Departamento de \nBoyacá.\nQue mediante Resolución 431 del 2 de marzo de 2009, el Ministerio modificó parcialmente \nla Resolución 952 del 31 de agosto de 1995, en el sentido de establecer que de conformidad \ncon lo establecido en el parágrafo del artículo 43 de la ley 99 de 1993 reglamentado por el \nDecreto 1900 de 2006, deberá destinar como mínimo un uno por ciento (1%) del valor del \nproyecto, en actividades de recuperación, preservación y vigilancia de las Cuencas \nhidrográficas de las cuales se toma el recurso hídrico para el desarrollo del proyecto.\nQue mediante Resolución 1546 del 11 de agosto de 2009, el Ministerio resolvió recurso de \nreposición interpuesto contra la Resolución 431 del 2 de marzo de 2009, en el sentido \nestablecer que en el caso que la Sociedad hubiera ejecutado actividades con anterioridad \nal Decreto 1900 de 2006, las mismas podrán ser presentadas dentro del proceso de \nverificación del cumplimiento de la obligación que se está llevando a cabo, con sus \ncorrespondientes soportes de ejecución, para su evaluación por parte de éste Ministerio, \nsiempre y cuando dichas actividades no correspondan al cumplimiento del Plan de Manejo \nAmbiental y/o Licencia Ambiental del proyecto y cumplan con los objetivos de la inversión \ndel 1%.\nQue mediante Resolución 2332 del 30 de noviembre de 2009, el Ministerio modificó la \nResolución 952 del 31 de agosto de 1995, en el sentido de aceptar las fichas de manejo \nambiental propuestas para las actuales actividades de operación y mantenimiento del \noleoducto.\nQue mediante la Resolución 550 del 15 de marzo de 2010, el Ministerio resolvió recurso de \nreposición interpuesto contra la Resolución 2332 del 30 de noviembre de 2009, en el sentido \nde confirmando el numeral 6 del artículo cuarto de la resolución recurrida.\nQue mediante la Resolución 820 del 28 de septiembre de 2012, la Autoridad Nacional de \nLicencias Ambientales (ANLA), en adelante la Autoridad Nacional, tomó medidas de ajuste \nvía seguimiento a la Resolución 895 del 2 de octubre de 2001, en el sentido de autorizar la \nadquisición de 53 hectáreas faltantes como parte del Plan de Compensación Forestal en el \npáramo de Rabanal, o en su defecto la Sociedad debería allegar el pronunciamiento de la \nCorporación Autónoma Regional de Chivor (CORPOCHIVOR), mediante el cual se avalará \ny homologarán las 128.88 ha adquiridas voluntariamente.\nQue mediante Resolución 1095 del 20 de diciembre de 2012, la Autoridad Nacional modificó \nla Resolución 952 del 31 de agosto de 1995, en el sentido de adicionar la construcción de \ncinco (5) estaciones de rebombeo y la adecuación de las ya existentes.\nQue mediante Resolución 652 del 5 junio de 2015, la Autoridad Nacional modificó el literal \na) del numeral 2 del artículo primero de la Resolución 1095 del 20 de diciembre de 2012, \nrelacionado con las coordenadas de la estación de rebombeo Puerto Chorizo.\nQue mediante Resolución 834 de fecha 5 de junio de 2018, la Autoridad Nacional aprueba \nla modificación del Plan de Inversión forzosa de no menos del 1%.\n\nResolución No.  00905           Del   05 de mayo de 2022            Hoja No. 3 de 19\n“POR LA CUAL SE RESUELVE UN RECURSO DE REPOSICIÓN”\nOficinas: Carrera 13 A No. 34 – 72 Edificio 13 35 Pisos 8 al 11 Bogotá, D.C.\nCentro de Orientación y Radicación de Correspondencia: Carrera 13 A No. 34 – 72 Edificio 13 35 \nLocales 110 al 112 Bogotá, D.C.  \nCódigo Postal 110311156\nNit.: 900.467.239-2\nLínea de Orientación y Contacto Ciudadano: 57 (1) 2540100 / 018000112998 PBX: 57 (1) 2540111\nwww.anla.gov.co    Email: licencias@anla.gov.co  \nPágina 3 de 19\nQue mediante Resolución 294 del 5 de marzo de 2019 la Autoridad Nacional resolvió \nrecurso de reposición interpuesto contra la Resolución 834 del 5 de junio de 2018, en \nrelación con el Plan Inversión forzosa de no menos del 1%.\nQue mediante Resolución 1162 del 3 de julio de 2020 la Autoridad Nacional modificó el \nartículo primero de la Resolución 1546 del 11 de agosto de 2009, la cual modificó el artículo \nprimero de la Resolución 431 del 2 de marzo de 2009, que a su vez modificó la Resolución \n952 de agosto 31 de 1995, en el sentido de aprobar el acogimiento al porcentaje incremental \nseñalado en artículo 321 del Plan Nacional de Desarrollo – PND (Ley 1955 del 25 de mayo \ndel 2019).\nQue mediante Resolución 1746 del 27 de octubre de 2020, la Autoridad Nacional, resolvió \nrecurso de reposición interpuesto contra la Resolución 1162 del 3 de julio de 2020, en el \nsentido de reponer lo establecido en el artículo primero de la Resolución 1162 del 3 de julio \nde 2020, entre otros.\nQue mediante la Resolución 293 del 1 de febrero de 2022, la Autoridad Nacional modificó \nel artículo séptimo de la Resolución 1162 del 3 de julio de 2020, relacionado con la \nliquidación parcial actualizada al artículo 321 de la Ley 1955 del 25 de mayo de 2019, de la \ninversión forzosa de no menos del 1%.\nQue mediante Resolución 360 del 11 de febrero de 2022 la Autoridad Nacional resolvió \naprobar a la Sociedad el predio Zaragocilla en jurisdicción del Municipio de Remedios del \nDepartamento de Antioquia para ejecutar 11.7 ha en cumplimiento de la obligación de \ncompensación del medio biótico, por recuperación de áreas y restauración ecológica, \nestablecida en el numeral 8 del literal a) del artículo cuarto de la Resolución 1095 del 20 de \ndiciembre de 2012, Ficha No. 41 asociada a la Estación Chiquillo, propuesto mediante la \ncomunicación con radicación 2021122196-1-000 del 18 de junio de 2021. Decisión que fue \nnotificada mediante correo electrónico a la Sociedad el día 14 de febrero de 2022.\nQue a través de la comunicación con radicación 2022035211-1-000 del 28 de febrero de \n2022, la Sociedad interpuso Recurso de Reposición en contra de la Resolución 360 del 11 \nde febrero de 2022; argumentos que fueron evaluados por el equipo técnico de la Autoridad \nNacional y en consecuencia expidió el Concepto técnico 2298 del 29 de abril de 2022.\nCOMPETENCIA DE LA AUTORIDAD NACIONAL \nEl Gobierno Nacional, mediante Decreto Ley 3573 del 27 de septiembre de 2011, creó la \nAutoridad Nacional de Licencias Ambientales – ANLA, como una entidad con autonomía \nadministrativa y financiera, sin personería jurídica, la cual hace parte del Sector \nAdministrativo de Ambiente y Desarrollo Sostenible, en los términos del artículo 67 de la \nLey 489 de 1998.\nEl numeral 1° del artículo tercero del mencionado decreto estableció dentro de las funciones \nde la Autoridad Nacional, la de otorgar o negar las licencias, permisos y trámites \nambientales de competencia del Ministerio, de conformidad con la ley y los reglamentos.\nMediante el Decreto 376 del 11 de marzo de 2020, se modificó la estructura de la Autoridad \nNacional de Licencias Ambientales.\nEn ejercicio de las facultades conferidas por la Ley 489 de 1998, se expidió la Resolución \n423 del 12 de marzo de 2020, “Por la cual se delegan unas funciones y se dictan otras \ndisposiciones”, que en su artículo 8, se delegó en el Asesor Código 1020 Grado 15 del \nDespacho del Director General, entre otras, la función de resolver los recursos de reposición \ninterpuestos contra los actos administrativos que se emiten en cumplimiento de las \nfunciones delegadas.\nMediante la Resolución 669 del 14 de abril de 2020, se nombró como servidor público a \nEDILBERTO PEÑARANDA CORREA, identificado con cedula de ciudadanía 4.052.851, en \nel empleo de libre nombramiento y remoción de Asesor, código 1020, grado 15, adscrito a \nla Dirección General de la planta global de la ANLA.\n\nResolución No.  00905           Del   05 de mayo de 2022            Hoja No. 4 de 19\n“POR LA CUAL SE RESUELVE UN RECURSO DE REPOSICIÓN”\nOficinas: Carrera 13 A No. 34 – 72 Edificio 13 35 Pisos 8 al 11 Bogotá, D.C.\nCentro de Orientación y Radicación de Correspondencia: Carrera 13 A No. 34 – 72 Edificio 13 35 \nLocales 110 al 112 Bogotá, D.C.  \nCódigo Postal 110311156\nNit.: 900.467.239-2\nLínea de Orientación y Contacto Ciudadano: 57 (1) 2540100 / 018000112998 PBX: 57 (1) 2540111\nwww.anla.gov.co    Email: licencias@anla.gov.co  \nPágina 4 de 19\nEl 5 de noviembre  de 2021, la Autoridad Nacional emitió la Resolución 1957 “Por la cual se \nadopta el Manual Específico de Funciones y de Competencias Laborales para los empleos de la \nplanta de personal de la Autoridad Nacional de Licencias Ambientales - ANLA”, en donde se \nestablece que corresponde al Despacho del Director General de la Autoridad Nacional de \nLicencias Ambientales - ANLA, “Suscribir los actos administrativos que otorgan, niegan, \nmodifican, ajustan o declaran la terminación de las licencias, permisos y trámites ambientales”.\nTeniendo en cuenta lo anterior, es el Asesor del Despacho del Director General de la \nAutoridad Nacional el competente para pronunciarse sobre el recurso de reposición \ninterpuesto por la Sociedad en contra de la Resolución 360 del 11 de febrero de 2022.\nFUNDAMENTOS JURIDICOS\nEl procedimiento para la presentación y resolución de recursos contra los actos \nadministrativos se encuentra reglado en el Código de Procedimiento Administrativo y de lo \nContencioso Administrativo artículos 74 y siguientes, que particularmente respecto del \nrecurso de reposición al tenor literal expresan:\n“Artículo 74. Recursos contra los actos administrativos.\n Por regla general, contra los actos definitivos procederán los siguientes recursos: \n1. El de reposición, ante quien expidió la decisión para que la aclare, modifique, adicione o \nrevoque (…)”\nA su vez, los artículos 76 y 77 del Código enunciado preceptúan: \n“Artículo 76. Oportunidad y presentación.\nLos recursos de reposición y apelación deberán interponerse por escrito en la diligencia de \nnotificación personal, o dentro de los diez (10) días siguientes a ella, o a la notificación por aviso, \no al vencimiento del término de publicación, según el caso. Los recursos contra los actos \npresuntos podrán interponerse en cualquier tiempo, salvo en el evento en que se haya acudido \nante el juez. \nLos recursos se presentarán ante el funcionario que dictó la decisión (…)”\nArtículo 77. Requisitos.\nPor regla general los recursos se interpondrán por escrito que no requiere de presentación \npersonal si quien lo presenta ha sido reconocido en la actuación. Igualmente, podrán presentarse \npor medios electrónicos. \nLos recursos deberán reunir, además, los siguientes requisitos: \n1. Interponerse dentro del plazo legal, por el interesado o su representante o apoderado \ndebidamente constituido. \n2. Sustentarse con expresión concreta de los motivos de inconformidad.\n3. Solicitar y aportar las pruebas que se pretende hacer valer. \n4. Indicar el nombre y la dirección del recurrente, así como la dirección electrónica si desea ser \nnotificado por este medio. \nSólo los abogados en ejercicio podrán ser apoderados (…)\nA su vez, el artículo 80 del citado Código, establece el alcance del contenido de la decisión \nque resuelve el recurso:\n“Artículo 80. Decisión de los recursos. -Vencido el período probatorio, si a ello hubiere \nlugar, y sin necesidad de acto que así lo declare, deberá proferirse la decisión motivada que \nresuelva el recurso. \nLa decisión resolverá todas las peticiones que hayan sido oportunamente planteadas y las \nque surjan con motivo del recurso.” \n\nResolución No.  00905           Del   05 de mayo de 2022            Hoja No. 5 de 19\n“POR LA CUAL SE RESUELVE UN RECURSO DE REPOSICIÓN”\nOficinas: Carrera 13 A No. 34 – 72 Edificio 13 35 Pisos 8 al 11 Bogotá, D.C.\nCentro de Orientación y Radicación de Correspondencia: Carrera 13 A No. 34 – 72 Edificio 13 35 \nLocales 110 al 112 Bogotá, D.C.  \nCódigo Postal 110311156\nNit.: 900.467.239-2\nLínea de Orientación y Contacto Ciudadano: 57 (1) 2540100 / 018000112998 PBX: 57 (1) 2540111\nwww.anla.gov.co    Email: licencias@anla.gov.co  \nPágina 5 de 19\nCONSIDERACIONES DE LA AUTORIDAD NACIONAL FRENTE AL RECURSO DE \nREPOSICIÓN INTERPUESTO POR LA SOCIEDAD.\nDesde el punto de vista procedimental, se observa que el recurso de reposición interpuesto \npor la Sociedad en contra de la Resolución 360 del 11 de febrero de 2022, cumple con los \nrequisitos establecidos en el artículo 77 y concordantes del Código de Procedimiento \nAdministrativo y de lo Contencioso Administrativo, en cuanto a lo siguiente:\n1.\nInterponerse dentro del plazo legal, por el interesado o su representante o apoderado \ndebidamente constituido.\nSe encuentra acreditado que el día 14 de febrero de 2022, la Sociedad fue debidamente \nnotificada mediante correo electrónico de la Resolución 360 del 11 de febrero de 2022, \nfrente a la cual interpuso recurso de reposición por intermedio de su Apoderado General el \ndía 28 de febrero de 2022 y radicado en la Autoridad Nacional bajo el número 2022035211-\n1-000, esto es, dentro de los diez (10) días siguientes a la notificación, de conformidad con \nlo preceptuado en el artículo 76 de la Ley 1437 de 2011.\n2.\nSustentarse con expresión concreta de los motivos de inconformidad.\nLa Sociedad presentó los argumentos en contra de las disposiciones recurridas de la \nResolución 360 del 11 de febrero de 2022, los cuales serán tenidos en cuenta para decidir \nel presente recurso de reposición.\n3.\nSolicitar y aportar las pruebas que se pretende hacer valer.\nEn el recurso de reposición la Sociedad aportó las siguientes pruebas:\n“1. Comunicación identificada con radicado No. 2018096106 del 19 de julio de 2018.\n2. Soporte de radicación de la comunicación identificada con radicado No. 2018096106 del 19 de \njulio de 2018.\n3. Comunicación identificada con radicado No. 2018146447-1-000 del 19 de octubre de 2018.\n4. Soporte de radicación de la comunicación identificada con radicado No. 2018146447-1-000 del 19 \nde octubre de 2018.\n5. Comunicación identificada con radicado No. 2019005556-1-1-000 del 22 de enero de 2019.\n6. Soporte de radicación de la comunicación identificada con radicado No. 2019005556-1-1-000 del \n22 de enero de 2019.\n7. Informe Preliminar del Mantenimiento a la compensación establecida en el predio “La Culebra” \nefectuado en los meses de enero y febrero del año 2022.”\n4.\nIndicar el nombre y la dirección del recurrente, así como la dirección electrónica si desea ser \nnotificado por este medio.\nLa Sociedad manifestó que, para efectos de la notificación: “[P]odrá ser notificada en el correo \nelectrónico notificaciones.judiciales@ocensa.com.co, y en la dirección de correspondencia: Avenida \nCalle 82 No. 11 – 40, Piso 2, Bogotá D.C.”.\nCon base en lo anterior, verificado el cumplimiento de los requisitos establecidos en el \nCódigo de Procedimiento Administrativo y de lo Contencioso Administrativo -CPACA-, \nrespecto a la procedencia del señalado recurso de reposición, la Autoridad Nacional \nprocederá a resolverlo, teniendo en cuenta las consideraciones realizadas en el Concepto \nTécnico 2298 del 29 de abril de 2022; en el mismo orden de los argumentos presentados \npor la Sociedad, a saber:\n1.\nOBLIGACIÓNES RECURRIDAS – ARTÍCULO SEGUNDO, ARTÍCULO TERCERO\n“ARTÍCULO SEGUNDO. Descartar los polígonos 1, 2, 3, 4, 5, 7, 8, 11, 12, 14 localizados en el \npredio La Culebra, vereda Otú, ubicados en jurisdicción del Municipio de Remedios del \nDepartamento de Antioquia (Estación Chiquillo), asociados al Programa Compensación para el \n\nResolución No.  00905           Del   05 de mayo de 2022            Hoja No. 6 de 19\n“POR LA CUAL SE RESUELVE UN RECURSO DE REPOSICIÓN”\nOficinas: Carrera 13 A No. 34 – 72 Edificio 13 35 Pisos 8 al 11 Bogotá, D.C.\nCentro de Orientación y Radicación de Correspondencia: Carrera 13 A No. 34 – 72 Edificio 13 35 \nLocales 110 al 112 Bogotá, D.C.  \nCódigo Postal 110311156\nNit.: 900.467.239-2\nLínea de Orientación y Contacto Ciudadano: 57 (1) 2540100 / 018000112998 PBX: 57 (1) 2540111\nwww.anla.gov.co    Email: licencias@anla.gov.co  \nPágina 6 de 19\nMedio Biótico – Ficha No 41- Recuperación de áreas y restauración ecológica, en área total \n21.31 ha., de conformidad con lo expuesto en la parte motiva del presente acto administrativo.”\n“ARTÍCULO TERCERO. La Sociedad OLEODUCTO CENTRAL S.A. – OCENSA – S.A. deberá \npresentar una propuesta complementaria o plan de compensación para las 9.62 ha faltante por \ncompensar, en la cual deberán indicar y demostrar como garantizarán la supervivencia de los \nindividuos sembrados, cumpliendo con el total de las áreas descartadas del predio La Culebra.”\n1.1. PETICIÓN DE LA SOCIEDAD\n“PRIMERA PETICIÓN: MODIFICAR y ACLARAR los artículos 2 y 3 de la Resolución 0360 del \n11 de febrero de 2022, en el sentido de corregir los valores de las áreas objeto de compensación \nen ellos establecidos, indicando que el área total a compensar son 20,0 hectáreas, por lo tanto, \nque el área de compensación objeto de cambio al predio “Zaragocilla” corresponde a 11,3 (sic) \nhectáreas y que el área susceptible de mantenimiento, que no presenta afectaciones en el predio \n“La Culebra” corresponde a 8,3 hectáreas.\nSEGUNDA PETICIÓN: MODIFICAR y ACLARAR los artículos 2 y 3 de la Resolución 0360 del \n11 de febrero de 2022, de acuerdo con lo expuesto en el presente documento en el sentido de \ncorregir los polígonos descartados y esclarecer que es necesaria la presentación de una \npropuesta complementaria para las 8,3 hectáreas del predio “La Culebra”, refiriendo como se \ngarantizará la supervivencia de los individuos sembrados, tal y como se establece en el artículo \ntercero, pero eliminando la afirmación de que estas son áreas “faltantes de compensación”.\n1.2. ARGUMENTOS DE LA SOCIEDAD\nMediante comunicación con radicación 2022035211-1-000 del 28 de febrero de 2022, la \nSociedad presentó los siguientes argumentos:\n“De acuerdo con lo dispuesto en el numeral 2 del artículo 77 de la Ley 1437 de 2011, la \nCompañía sustenta este recurso de reposición en los siguientes fundamentos de derecho:\nFrente a la confusión en las áreas objeto de compensación:\nComo se indicó en el acápite de fundamentos fácticos del presente escrito, mediante la \nResolución 1095 del 20 de diciembre de 2012, la ANLA modificó la Resolución 952 del 31 \nde agosto de 1995, en el sentido de adicionar la construcción de cinco (5) estaciones de \nrebombeo y la adecuación de las ya existentes, y en su artículo cuarto, literal A, numeral 8 \nestableció lo siguiente, respecto al plan de compensación para el medio biótico por la \nintervención de las coberturas vegetales y cambio de uso del suelo:\n“Reevaluar el plan de compensación, para el medio biótico por la intervención de las \ncoberturas vegetales y cambio de uso del suelo, en el sentido que las reforestaciones a \nestablecer sean de carácter eminentemente protector, en áreas compatibles con este uso del \nsuelo, especies nativas protectoras propias de la zona y que haga parte de las áreas de rondas \nhídricas de las cuencas hidrográficas del área de influencia del proyecto. Se deberá incluir la \nsiguiente información con respecto al plan de compensación: actividades de establecimiento \ny mantenimiento a realizar para la reforestación protectora, especificar los sitios donde se \nrealizarán las actividades de compensación por la intervención de las diferentes coberturas \nvegetales y cambio del uso del suelo y las especies forestales protectoras a utilizar”.\nSiguiendo la misma línea, el artículo cuarto, literal B, numeral 8 de la Resolución 1095 del \n20 de diciembre de 2012, la ANLA dispuso:\n“b. La compensación del medio biótico establecida por la intervención de las diferentes \ncoberturas vegetales y por la afectación del suelo por la construcción del proyecto, es la \nsiguiente:\n3) En una proporción de 1:5 respecto al área real intervenida en las coberturas identificadas \ncomo Bosque fragmentado con pastos y cultivos; Bosque de galería y tipario (Intervención en \nvías únicamente) y vegetación secundaria alta y baja (1 hectárea intervenida – 5 hectáreas \nreforestadas).\n4) En una proporción de 1:1 respecto al área real intervenida en las coberturas identificadas \ncomo pastos limpios y pastos arbolados (1 hectárea intervenida –1 hectárea reforestada)”.\n\nResolución No.  00905           Del   05 de mayo de 2022            Hoja No. 7 de 19\n“POR LA CUAL SE RESUELVE UN RECURSO DE REPOSICIÓN”\nOficinas: Carrera 13 A No. 34 – 72 Edificio 13 35 Pisos 8 al 11 Bogotá, D.C.\nCentro de Orientación y Radicación de Correspondencia: Carrera 13 A No. 34 – 72 Edificio 13 35 \nLocales 110 al 112 Bogotá, D.C.  \nCódigo Postal 110311156\nNit.: 900.467.239-2\nLínea de Orientación y Contacto Ciudadano: 57 (1) 2540100 / 018000112998 PBX: 57 (1) 2540111\nwww.anla.gov.co    Email: licencias@anla.gov.co  \nPágina 7 de 19\nCon estricta observancia de lo anterior, la Compañía efectuó el cálculo del área a compensar, \nde la siguiente forma:\nComo se puede observar, el área total a compensar fue calculada con estricto cumplimiento \nde las proporciones establecidas por la ANLA en el artículo cuarto, literal B, numeral 8 de la \nResolución 1095 del 20 de diciembre de 2012. De conformidad con lo anterior, el cálculo \nexacto del área total objeto de la obligación de compensación es de 19.44 hectáreas, por lo \nque la Compañía decidió presentar el Plan de Establecimiento y Manejo Forestal por un \ntotal de 20 hectáreas.\nEn concordancia con esto, tanto en el Plan de Establecimiento y Manejo Forestal, como en \nel Informe de Establecimiento de la compensación presentado, y en los informes de \nmantenimiento, siempre se ha hecho referencia a la obligación de la compensación por el \nmedio biótico en un área de 20 hectáreas.\nSituación diferente, es que en el marco del reporte de las áreas objeto de compensación \npresentado mediante la GDB del ICA No. 16, se presentarán polígonos, que por motivos de \ncaracterísticas en el terreno, no permitieron separar las áreas donde se realizó el \nestablecimiento, arrojando un total de 22,7 hectáreas. Lo anterior, sin implicar que el área \ntotal objeto de la compensación haya cambiado, pues como se indicó, esta corresponde a \nun total de 20 hectáreas.\nDe acuerdo con esto, el área a compensar en el predio “Zaragocilla” corresponde a 11,7 \nhectáreas y el área compensada en el predio “La Culebra” que no presenta afectaciones y \nes apta para hacer parte del área objeto de la compensación corresponde a 8,3 hectáreas, \npara un total de 20,0 hectáreas.\nAsí las cosas, en virtud de las proporciones establecidas por la misma ANLA mediante el \nartículo cuarto, literal B, numeral 8 de la Resolución 1095 del 20 de diciembre de 2012, no \ncorresponde que se establezca un área total objeto de la compensación diferente a 20 \nhectáreas.\nHabiendo dicho lo anterior, cabe mencionar que OCENSA basándose en los principios de \nbuena fe y confianza legítima inherentes al ordenamiento jurídico colombiano, y partiendo \nde la teoría del acto propio, confiaba en que la ANLA no iba a modificar unilateralmente el \nárea objeto de compensación, pues el cálculo de las 20 hectáreas efectuado por la \nCompañía se hizo con estricta observancia de lo establecido por la misma ANLA, y porque \nla ANLA en ningún momento se pronunció sobre la necesidad de modificar el área objeto de \ncompensación, la cual fue socializada por la Compañía en diversas ocasiones desde el año \n2018, mediante documentos como el Plan de Establecimiento de la Compensación, el \nInforme de Establecimiento, los Informes de Mantenimiento, y demás documentos \npresentados.\nLa Corte Constitucional en la sentencia T- 295 de 1999, desarrolló el concepto de acto propio \ndefiniéndolo como una noción jurídica en virtud de la cual “[L]as actuaciones de los \nparticulares y de las autoridades públicas deberán ceñirse a los postulados de la buena fe. \nPrincipio constitucional, que sanciona como inadmisible toda pretensión lícita, pero \nobjetivamente contradictoria, con respecto al propio comportamiento efectuado por el sujeto. \nSe trata de una limitación del ejercicio de derechos que, en otras circunstancias podrían ser \n\nResolución No.  00905           Del   05 de mayo de 2022            Hoja No. 8 de 19\n“POR LA CUAL SE RESUELVE UN RECURSO DE REPOSICIÓN”\nOficinas: Carrera 13 A No. 34 – 72 Edificio 13 35 Pisos 8 al 11 Bogotá, D.C.\nCentro de Orientación y Radicación de Correspondencia: Carrera 13 A No. 34 – 72 Edificio 13 35 \nLocales 110 al 112 Bogotá, D.C.  \nCódigo Postal 110311156\nNit.: 900.467.239-2\nLínea de Orientación y Contacto Ciudadano: 57 (1) 2540100 / 018000112998 PBX: 57 (1) 2540111\nwww.anla.gov.co    Email: licencias@anla.gov.co  \nPágina 8 de 19\nejercidos lícitamente; en cambio, en las circunstancias concretas del caso, dichos derechos \nno pueden ejercerse por ser contradictorias respecto de una anterior conducta, esto es lo \nque el ordenamiento jurídico no puede tolerar, porque el ejercicio contradictorio del derecho \nse traduce en una extralimitación del propio derecho” (subrayado por fuera del texto original).\nSiguiendo la misma línea, la misma Alta Corte por medio de la Sentencia T-122 de 2015, \ndestaca que es posible la aplicación de la teoría del acto propio cuando se obedecen tres \ncriterios a saber:\n“(i) Una conducta jurídicamente anterior, relevante y eficaz. Conducta que indica un acto o \nuna serie de actos que exponen una determinada actitud de una persona, respecto de unos \nintereses vitales, la cual debe ser jurídicamente relevante, y por ende debe ser ejecutada \ndentro una relación jurídica. Es decir, el acto debe suscitar la confianza de un tercero o revelar \nuna actitud, debiendo excluirse las conductas que no incidan o sean ajenas a dicha relación \njurídica. En este sentido, la conducta vinculante o primera conducta, debe ser jurídicamente \neficaz, por cuanto el comportamiento que se pone de relieve afecta una esfera de intereses. \nPero, además, hay una conducta posterior, temporalmente hablando. Así pues, el sujeto emite \ndos conductas: una primera o anterior y otra posterior, que es la contradictoria con aquella;\n(ii) El ejercicio de una facultad o de un derecho subjetivo por la misma persona o centros de \ninterés que crea la situación litigiosa debido a la contradicción existente entre ambas \nconductas, lo cual atenta el principio de buena fe; y,\n(ii) La identidad del sujeto o centros de interés que se vinculan en ambas conductas”.\nResulta entonces pertinente, evidenciar como para el caso que nos ocupa, la teoría del acto \npropio dilucidada anteriormente, tiene cabal aplicación. (i) En primer lugar, porque mediante \nel artículo cuarto, literal B, numeral 8 de la Resolución 1095 del 20 de diciembre de 2012, la \nANLA estableció claramente las proporciones por las cuales debían realizarse los cálculos \nde las áreas totales objeto de compensación. Adicionalmente, la ANLA recibió las diferentes \ncomunicaciones remitidas por OCENSA refiriendo el total del área a compensar, esto es las \n20 hectáreas y aceptó la realización de las actividades de compensación sobre el total de \nlas 20 hectáreas. De acuerdo con lo anterior, OCENSA de buena fe confiaba en que la ANLA \nno iba a modificar el total de las áreas a compensar y realizó todas las actividades, tanto de \nestablecimiento, como de mantenimiento y la posterior solicitud de aprobación de cambio de \náreas partiendo de la certeza de que la compensación versaba sobre 20 hectáreas. De igual \nforma, se presenta una conducta posterior y contraría a la conducta inicial, que puede ser \napreciada en la decisión de la ANLA contenida en la Resolución 0360 del 11 de febrero de \n2022, donde indica que el área total a compensar no son 20 hectáreas, como se había \ncalculado y reportado inicialmente, sino 21,31 hectáreas. Lo que a su vez modifica las \nhectáreas a mantener en el predio “La Culebra”, que son 8,3 hectáreas y no 9,67 hectáreas.\n(ii) En segundo lugar, es posible evidenciar el ejercicio de una facultad por parte de la ANLA \nque crea una situación litigiosa debido a la contradicción existente las conductas descritas \nanteriormente. El ejercicio de la facultad por parte de la ANLA sería entonces la decisión de \nordenar que se debe realizar una compensación por un área total superior a la inicialmente \npresupuestada.\n(iii) Por último, es posible evidenciar la identidad del sujeto de interés que se vincula en \nambas conductas que en este caso sería OCENSA como administrado de la ANLA.\nHabiendo dicho lo anterior, se hace evidente que se configura la teoría del acto propio \nexpuesta, en la medida en que la ANLA reconociendo previamente que la compensación \nversa sobre 20 hectáreas, decide unilateralmente modificar el área total objeto de \ncompensación, desconociendo las proporciones que ella misma estableció mediante el \nartículo cuarto, literal B, numeral 8 de la Resolución 1095 del 20 de diciembre de 2012.\nDe acuerdo con lo anteriormente expuesto, se hace necesario que la ANLA proceda a \nMODIFICAR y ACLARAR los artículos 2 y 3 de la Resolución 0360 del 11 de febrero de \n2022, en el sentido de corregir los valores de las áreas objeto de compensación en ellos \nestablecidos, indicando que el área total a compensar son 20,0 hectáreas, por lo tanto, que \nel área de compensación objeto de cambio al predio “Zaragocilla” corresponde a 11,3 (sic) \nhectáreas y que el área susceptible de mantenimiento, que no presenta afectaciones en el \npredio “La Culebra” corresponde a 8,3 hectáreas.\n\nResolución No.  00905           Del   05 de mayo de 2022            Hoja No. 9 de 19\n“POR LA CUAL SE RESUELVE UN RECURSO DE REPOSICIÓN”\nOficinas: Carrera 13 A No. 34 – 72 Edificio 13 35 Pisos 8 al 11 Bogotá, D.C.\nCentro de Orientación y Radicación de Correspondencia: Carrera 13 A No. 34 – 72 Edificio 13 35 \nLocales 110 al 112 Bogotá, D.C.  \nCódigo Postal 110311156\nNit.: 900.467.239-2\nLínea de Orientación y Contacto Ciudadano: 57 (1) 2540100 / 018000112998 PBX: 57 (1) 2540111\nwww.anla.gov.co    Email: licencias@anla.gov.co  \nPágina 9 de 19\nFrente a la compensación realizada en el predio “La Culebra” que no presenta \nafectaciones:\nComo se dijo anteriormente, de las 20 hectáreas de compensación establecidas inicialmente \nen el predio “La Culebra”, 11,7 hectáreas presentaron afectaciones antropogénicas, \ntotalmente ajenas a la Compañía. Sin embargo, las 8,3 hectáreas restantes se encuentran \nen buen estado, no fueron objeto de afectación y son susceptibles de hacer parte de la \nobligación de compensación por el medio biótico de acuerdo con lo establecido en el artículo \ncuarto, literal A, numeral 8 de la Resolución 1095 del 20 de diciembre de 2012.\nAsí las cosas, no resulta procedente que la ANLA afirme que las 8,3 hectáreas del predio \n“La Culebra” son hectáreas “faltantes por compensar”. Lo anterior, cobra especial relevancia \nsi observamos el informe del mantenimiento a estas 8,3 hectáreas realizado en los meses \nde enero y febrero del presente año, en donde se evidencia lo siguiente:\n• Del total del área inicial se tiene que 8,3 hectáreas se encuentran libres de asentamientos \nhumanos y que el 61% de los árboles sobrevivieron a pesar de no realizar el mantenimiento \ndesde el año 2019, debido a la situación de orden público que se ha presentado en el predio, \nasí como las restricciones en la movilidad en el marco de la emergencia sanitaria causada \npor el COVID-19, lo cual afectó las labores ordinarias de mantenimiento de las áreas \nsembradas. A continuación se presenta la información de los individuos y las áreas:\n• A partir de esta información se realizaron las actividades de mantenimiento, las cuales \nincluyeron control de malezas, control fitosanitario, fertilización, poda y resiembra.\nControl de malezas: En el terreno de varios de los lotes se encontró maleza de 2 a 3 metros \nde alto por lo que el control de malezas consistió en realizar una rocería con guadaña por \ntoda el área establecida teniendo en cuenta no dañar los individuos sembrados. \nAdicionalmente, se realizó el plateo de 1 metro de diámetro con la ayuda de un azadón. Esta \nactividad se realizó con el fin de generar las condiciones adecuadas para las plantas, \neliminando la competencia por espacio, luz, agua y nutrientes que generaban las plantas \nherbáceas.\n(Ver registro fotográfico en la página 8 del Concepto técnico 2298 del 29 de abril de 2022)\n(…)\nControl fitosanitario: Se realizó la inspección de los árboles encontrando algunas \nafectaciones por hormiga arriera, comején y algunas larvas, por lo que se procedió a aplicar \nRafaga, el cual es un insecticida de amplio espectro por contacto. Este se ha aplicado con \nbomba de espalda.\n(Ver fotografía en la página 9 del Concepto técnico 2298 del 29 de abril de 2022).\n(…)\nFertilización: Se realizó fertilización a los árboles en pie, esta consistió en realizar la \naplicación de 30gr de urea mezclado con cal dolomita y triple 15, en corona con un perímetro \nde 30 cm alrededor del árbol.\n(Ver registro fotográfico en la página 9 del Concepto técnico 2298 del 29 de abril de 2022)\n(…)\nAdicionalmente, se hizo fertilización foliar a los árboles que presentaban signos de \ndeficiencia nutricional y un porte bajo con respecto a los demás árboles, esto se realizó \nmediante la aplicación con bomba de espalda de amonialexin con una concentración de 100 \n\nResolución No.  00905           Del   05 de mayo de 2022            Hoja No. 10 de 19\n“POR LA CUAL SE RESUELVE UN RECURSO DE REPOSICIÓN”\nOficinas: Carrera 13 A No. 34 – 72 Edificio 13 35 Pisos 8 al 11 Bogotá, D.C.\nCentro de Orientación y Radicación de Correspondencia: Carrera 13 A No. 34 – 72 Edificio 13 35 \nLocales 110 al 112 Bogotá, D.C.  \nCódigo Postal 110311156\nNit.: 900.467.239-2\nLínea de Orientación y Contacto Ciudadano: 57 (1) 2540100 / 018000112998 PBX: 57 (1) 2540111\nwww.anla.gov.co    Email: licencias@anla.gov.co  \nPágina 10 de 19\nml por 20 lt de agua, con el fin de estimular su crecimiento al aumentar la pigmentación en \nlas hojas.\n \n(Ver fotografía en la página 10 del Concepto técnico 2298 del 29 de abril de 2022).\n(…)\nPoda: Se realizó poda de formación de los árboles con el fin conseguir un tronco más fuerte \ny unas ramas mejor distribuidas para que los árboles crezcan con una distribución \nequilibrada, adicionalmente se podaron las ramas secas que se encontraron. Esta poda se \nrealizó con tijeras, posterior a esto se aplicó un cicatrizante en el tejido expuesto después de \nla posa, con el fin de proteger la herida del árbol de diversos patógenos y enfermedades.\n(Ver registro fotográfico en la página 10 del Concepto técnico 2298 del 29 de abril de 2022).\n(…)\nResiembra: Actualmente se está llevando a cabo la resiembra de los árboles, aprovechando \nlas lluvias que hay en la zona. La resiembra incluye actividades como ahoyado, plateo, \nsiembra y fertilización, se han sembrado 1809 árboles, faltando 839 individuos para terminar \nla siembra, una vez se finalice esta actividad, se procederá a realizar la fertilización y así \nculminar la resiembra y el mantenimiento. A continuación se presenta el número de \nindividuos resembrados hasta el momento en cada lote:\n(Ver tabla y fotografía en la página 11 del Concepto técnico 2298 del 29 de abril de 2022).\n(…)\nAsí las cosas, no corresponde que mediante el artículo segundo de la Resolución 0360 del \n11 de febrero de 2022, se descarten los polígonos 1, 2, 3, 4, 5, 7, 8, 11, 12 y 14 localizados \nen el predio “La Culebra”, por los motivos técnicos anteriormente expuestos, sino que solo \ndeberían ser descartados los polígonos 1, 2, 3, 11, 12, 13, 14, 15, 16 y 17, los cuales hacen \nparte de las 11,7 hectáreas para las que se solicitó la aprobación de cambio de áreas al \npredio “Zaragocilla”, pues estos son los polígonos que efectivamente presentan afectaciones \ny no cumplen con los estándares necesarios para hacer parte de la compensación.\nEn este punto, es preciso recordar que de acuerdo con el Consejo de Estado, la falsa \nmotivación de un acto administrativo se traduce en “[A]quel error de hecho o de derecho que \nen determinado momento puede afectar la legalidad del acto y el desvió de poder, en la \nintención con la cual la autoridad toma una decisión persiguiendo un fin diferente al previsto \npor el legislador, que obedece a un propósito particular, personal o arbitrario” (Sentencia del \n07 de marzo de 2013 – Sección Segunda – Rad. 13001-23-31-000-2007-00052-01).\nAdicionalmente, esta misma corporación indica que para qué (sic) prospere una pretensión \nfundamentada en la causal de falsa motivación, es necesario que se demuestre una de dos \ncircunstancias: “a) O bien que los hechos que la Administración tuvo en cuenta como motivos \ndeterminantes de la decisión no estuvieron debidamente probados dentro de la actuación \nadministrativa; o b) Que la Administración omitió tener en cuenta hechos que sí estaban demostrados \ny que si hubiesen sido considerados habrían conducido a una decisión sustancialmente diferente\" \n(Sentencia del 26 de julio de 2017 – Sección Cuarta – Rad. 11001-03-27- 000-2018 00006-\n00).\nAsí las cosas, en el caso que nos ocupa la ANLA omitió tener en cuenta hechos que sí \nestaban demostrados, esto es la existencia de 8,3 hectáreas en el predio “La Culebra”, que \nson susceptibles de hacer parte de la compensación por sus condiciones óptimas, hecho \nque de haber sido considerado hubiese conducido a una decisión sustancialmente diferente.\nEn este punto, es igualmente importante resaltar que OCENSA presentará una propuesta \ncomplementaria para las 8,3 hectáreas del predio “La Culebra”, indicando como se \ngarantizará la supervivencia de los individuos sembrados.\nDe acuerdo con lo anteriormente expuesto, se hace necesario que la ANLA proceda a \nMODIFICAR y ACLARAR los artículos 2 y 3 de la Resolución 0360 del 11 de febrero de \n2022, en el sentido de corregir los polígonos descartados y esclarecer que es necesaria la \npresentación de una propuesta complementaria para las 8,3 hectáreas del predio “La \nCulebra”, refiriendo como se garantizará la supervivencia de los individuos sembrados, tal y \n\nResolución No.  00905           Del   05 de mayo de 2022            Hoja No. 11 de 19\n“POR LA CUAL SE RESUELVE UN RECURSO DE REPOSICIÓN”\nOficinas: Carrera 13 A No. 34 – 72 Edificio 13 35 Pisos 8 al 11 Bogotá, D.C.\nCentro de Orientación y Radicación de Correspondencia: Carrera 13 A No. 34 – 72 Edificio 13 35 \nLocales 110 al 112 Bogotá, D.C.  \nCódigo Postal 110311156\nNit.: 900.467.239-2\nLínea de Orientación y Contacto Ciudadano: 57 (1) 2540100 / 018000112998 PBX: 57 (1) 2540111\nwww.anla.gov.co    Email: licencias@anla.gov.co  \nPágina 11 de 19\ncomo se establece en el artículo tercero, pero eliminando la afirmación de que estas son \náreas “faltantes de compensación”.\n1.3. CONSIDERACIONES DE LA AUTORIDAD NACIONAL\nLos argumentos de inconformidad presentados por el recurrente fueron objeto de \nevaluación por el equipo técnico de la Autoridad Nacional y mediante Concepto técnico \n2298 del 29 de abril de 2022, se presentaron las siguientes consideraciones:\n“Consideraciones respecto a la confusión en las áreas objeto de compensación:\nEn el Formato ICA 1a del ICA No. 13 ([R]adicado 2018024437-1-000 del 2 de marzo de 2018), la \nSociedad ajustó los factores de compensación por tipo de cobertura intervenida para la Ficha No. 41 \n“Compensación para el medio biótico - Recuperación de áreas y restauración ecológica”, conforme \na lo dispuesto en el literal b del numeral 8 del literal A del Artículo Cuarto de la Resolución 1095 del \n20 de diciembre de 2012.\nDicho ajuste fue objeto de seguimiento en el Concepto Técnico 3972 del 25 de julio de 2019, acogido \nmediante el Auto 9995 del 18 de noviembre de 2019; donde se tiene que efectivamente el área \nreportada calculada a compensar para la Estación Chiquillo corresponde a 20 ha, como indica la \nSociedad y como se relaciona en la Tabla 1:\nTabla 1. Áreas a compensar\nESTACIÓN\nÁREA INTERVENIDA \n(ha)\nCOBERTURA \nINTERVENIDA\nÁREA A \nCOMPENSAR (ha)\n0,14\nVegetación secundaria \nalta\nEstación Páez\n4,86\nPastos limpios\n5,56\n1,39\nPastos Limpios\nEstación Chiquillo\n3,61\nCoberturas vegetales\n20\nEstación Granjita\n5\nPastos Limpios\n5\nAhora bien, OCENSA S.A. manifiesta que mediante radicado 2018096106-1-000 del 19 de julio de \n2018, hizo entrega a la Autoridad Nacional de Licencias Ambientales -ANLA- del Plan de \nEstablecimiento y Manejo Forestal en el marco de la Compensación para el medio biótico por \nrecuperación de áreas y restauración ecológica, para 20 hectáreas ubicadas en el predio La Culebra, \nMunicipio de Remedios, Departamento de Antioquia.\nAl respecto, esta Autoridad reitera lo señalado en el Concepto Técnico 03972 del 25 de julio de 2019:\n“En el caso de la Estación Chiquillo, en el (sic) no se encontró evidencia del radicado del Plan de \nEstablecimiento de la Compensación de que trata la presente ficha, habiendo presentado solo el \ninforme de establecimiento y primer mantenimiento mediante radicado 2018096106-1-000 de fecha 19 \nde julio de 2018.”\nAdicionalmente, conforme a los argumentos expuestos por parte de la Sociedad donde menciona \nque “(…) [E]n el marco del reporte de las áreas objeto de compensación presentado mediante la GDB del ICA \nNo. 16, se presentarán polígonos, que por motivos de características en el terreno, no permitieron separar las \náreas donde se realizó el establecimiento, arrojando un total de 22,7 hectáreas.”, cabe resaltar que dicho \ndocumento NO cuenta con información cartográfica, como se evidencia en la siguiente imagen:\n(Ver imagen en la página 13 del Concepto técnico 2298 del 29 de abril de 2022)\n(…)\nPor otro lado, como se indicó en el Concepto Técnico 8358 del 23 de diciembre de 2021, se tiene \nque mediante radicado 2021012738-1-000 del 28 de enero de 2021, la Sociedad presentó respuesta \na requerimientos contenidos en el Auto 07182 del 30 de julio de 2020; y respecto al Programa \nCompensación para el Medio Biótico – Ficha No 41- Recuperación de áreas y restauración ecológica, \nallegó la Carpeta “Mantenimiento RestEcologica-Primer Semestre_2020”, que incluye el documento “Informe \nComp Rest_Ecologica_Chiquillo_2020.docx” e indicó que realizó una compensación por afectación de \náreas y restauración ecológica de 22,78 ha con la siembra de 16.062 individuos en 17 lotes del predio \nmicrocuenca La Culebra, vereda Otú, Municipio de Remedios, Departamento de Antioquia (Tabla 2).\n(Ver tabla en la página 14 del Concepto técnico 2298 del 29 de abril de 2022)\n\nResolución No.  00905           Del   05 de mayo de 2022            Hoja No. 12 de 19\n“POR LA CUAL SE RESUELVE UN RECURSO DE REPOSICIÓN”\nOficinas: Carrera 13 A No. 34 – 72 Edificio 13 35 Pisos 8 al 11 Bogotá, D.C.\nCentro de Orientación y Radicación de Correspondencia: Carrera 13 A No. 34 – 72 Edificio 13 35 \nLocales 110 al 112 Bogotá, D.C.  \nCódigo Postal 110311156\nNit.: 900.467.239-2\nLínea de Orientación y Contacto Ciudadano: 57 (1) 2540100 / 018000112998 PBX: 57 (1) 2540111\nwww.anla.gov.co    Email: licencias@anla.gov.co  \nPágina 12 de 19\n(…)\nEn línea con lo anterior, la Sociedad ratifica en los radicados 2021132674-1-000 del 30 de junio de \n2021 y 2021169913-1-000 del 12 de agosto de 2021 que ejecutó el establecimiento de 16.602 \nindividuos de diferentes especies en 22,78 hectáreas, divididos en 17 lotes (Ver Anexos: 3_ANEXOS \n\\ ANEXO 8 COMPENSACION Y 1% \\ 2. SEGUIMIENTO_COMPENSACIONES_FORESTALES\\\n2.2 COMPENSACIÓN_CHIQUILLO \\ Anexo 2.2.1_Comp_Restauración_EcolChiquillo\\ \nnumeral 6.1 Información del establecimiento efectuado en el 2018 de las 22,78 (ha)).\nAhora bien, mediante radicado 2021135640-1-000 del 2 de julio de 2021, la Sociedad OLEODUCTO \nCENTRAL S.A. OCENSA S.A. presentó respuesta a requerimientos contenidos en el Auto 12208 del \n24 de diciembre de 2020, donde incluyen información cartográfica, relacionada con la Compensación \npara el medio biótico - recuperación de áreas y restauración ecológica, la cual fue evaluada por esta \nAutoridad, encontrando que las áreas comprometidas y descartadas son 21,32 ha:\nID_OT_COMP\nÁrea (ha)\nPolígono-1\n1,939206\nPolígono-4\n3,013802\nPolígono-3\n4,570352\nPolígono-5\n4,740199\nPolígono-7\n1,020415\nPolígono-2\n1,797046\nPolígono-11\n0,047812\nPolígono-12\n0,453275\nPolígono-14\n0,072775\nPolígono-8\n3,665381\nTotal\n21,32\nFuente: Adaptado del Concepto Técnico 8358 del 23 de diciembre de 2021.\nDicho esto, se tiene que de las 22,78 ha que han reportado en los mantenimientos, 21,32 ha \ncorresponden a los predios que fueron excluidos en el Artículo Segundo de la Resolución 0360 del \n11 de febrero de 2022, los cuales se muestran a continuación basados en una imagen del año 2020 \n(Imagen 2020-01-12-WV02-Strip):\n(Ver imágenes 1 y 2 en la página 15 del Concepto técnico 2298 del 29 de abril de 2022).\n(…)\nEl polígono 01 tiene un área de 1,939206 ha. El área desprovista de vegetación y con poca \nvegetación suma 1,147695 ha (área achurada). En ese sentido, el área cubierta por vegetación \ncorresponde a 0,7915 ha.\n \nEl polígono 04 cuya área es de 3,013802 ha cuenta con poca vegetación arbórea. Según el análisis \npresentado en el Concepto Técnico 08358 del 23 de diciembre de 2021 y teniendo en cuenta la visita \nrealizada el 29 de julio de 2021, en esta área se “(…) [E]videnció proceso de regeneración avanzada. \nEl cerramiento se encuentra en buen estado y no se presenta evidencia de la intervención de \ntensionantes (…)”. (pág.135 del CT08358 del 23/12/2021).\n(Ver imágenes 3 y 4 en la página 16 del Concepto técnico 2298 del 29 de abril de 2022).\n(…)\nEl polígono 02 tiene un área de 1,797046 ha y el polígono 03 de 4,570352 ha. Como se evidencia \nen la anterior imagen, por su cercanía a un área urbanizada, es probable que no conserven la \nvegetación natural que existe en ellos.\nEl polígono 11 tiene un área de 0,047812 ha; el polígono 12 de 0,453275 ha; y el polígono 14 de \n0,072775 ha. Como se evidencia en la anterior imagen, estos polígonos presentan cobertura árborea \ny, según el análisis presentado en el Concepto Técnico 08358 del 23 de diciembre de 2021 y teniendo \nen cuenta la visita realizada el 29 de julio de 2021, estas tres (3) áreas “(…) [C]uentan con un proceso \nde regeneración natural avanzado (…)” (pág.136 del CT08358 del 23/12/2021).\n(Ver imagen 5 en la página 17 del Concepto técnico 2298 del 29 de abril de 2022).\n(…)\n\nResolución No.  00905           Del   05 de mayo de 2022            Hoja No. 13 de 19\n“POR LA CUAL SE RESUELVE UN RECURSO DE REPOSICIÓN”\nOficinas: Carrera 13 A No. 34 – 72 Edificio 13 35 Pisos 8 al 11 Bogotá, D.C.\nCentro de Orientación y Radicación de Correspondencia: Carrera 13 A No. 34 – 72 Edificio 13 35 \nLocales 110 al 112 Bogotá, D.C.  \nCódigo Postal 110311156\nNit.: 900.467.239-2\nLínea de Orientación y Contacto Ciudadano: 57 (1) 2540100 / 018000112998 PBX: 57 (1) 2540111\nwww.anla.gov.co    Email: licencias@anla.gov.co  \nPágina 13 de 19\nEl polígono 05 tiene un área de 4,740199 ha. Como se evidencia en la anterior imagen, este polígono \npresenta poca cobertura árborea, y según el análisis presentado en el Concepto Técnico 08358 del \n23 de diciembre de 2021 y teniendo en cuenta la visita realizada el 29 de julio de 2021, en esta área \nse “(…) [E]videncia intervención antrópica, es posible identificar cultivos de plátano en una parte del \npredio, en otra parte se evidenció que hubo presencia de individuos sin embargo fueron removidos \n(…)” (pág.136 del CT08358 del 23/12/2021).\n(Ver imagen 6 en la página 17 del Concepto técnico 2298 del 29 de abril de 2022).\n(…)\nEl polígono 07 tiene un área de 1,020415 ha. Como se evidencia en la anterior imagen, este polígono \npresenta poca cobertura árborea y, según el análisis presentado en el Concepto Técnico 08358 del \n23 de diciembre de 2021 y teniendo en cuenta la visita realizada el 29 de julio de 2021, en esta área \nse “(…) [E]videncia siembra de cacao, plátano y maíz (…)”. (pág.139 del CT08358 del 23/12/2021).\n(Ver imagen 7 en la página 18 del Concepto técnico 2298 del 29 de abril de 2022).\n(…)\nEl polígono 08 tiene un área de 3,665381 ha. Como se evidencia en la anterior imagen, este polígono \npresenta poca cobertura árborea y, según el análisis presentado en el Concepto Técnico 08358 del \n23 de diciembre de 2021 y teniendo en cuenta la visita realizada el 29 de julio de 2021, en esta área \nse “(…) [P]resentan procesos de asentamientos humanos, el proceso de invasión fue imposible de controlar \npor parte de la Alcaldía, por lo tanto, se consideran áreas descartadas para dar cumplimiento a la obligación \n(…).” (pág.141 del CT08358 del 23/12/2021).\nDe esta manera, es pertinente aclarar que, acorde con la actual información que se tiene sobre áreas \nintervenidas y lo establecido en los actos administrativos sobre la obligación de compensación, esta \nAutoridad no pretende establecer un área total objeto de la compensación diferente a las 20 \nhectáreas calculadas por la Sociedad conforme a los factores de compensación por tipo de cobertura \nintervenida dispuestos en el literal b del numeral 8 del literal A del Artículo Cuarto de la Resolución \n1095 del 20 de diciembre de 2012, salvo que, en cumplimiento del numeral 3 del Artículo Segundo \ndel Auto 713 del 16 de febrero de 2022, la Sociedad presente un valor de áreas/coberturas \nintervenidas superior.\nAcorde con lo anterior, se tiene que el valor de 21,32 ha que se mencionan en el Artículo Segundo \nde la Resolución 0360 del 11 de febrero de 2022 corresponde a la sumatoria de áreas descartadas \npara los polígonos 1, 2, 3, 4, 5, 7, 8, 11, 12, 14, más no al área que la Sociedad tiene como obligación \na compensar.\nEn ese sentido, se hará el respectivo ajuste con base en las 20 hectáreas que a la fecha la Sociedad \ntiene como obligación de compensación.\nConsideraciones respecto a la compensación realizada en el predio “La Culebra” que no \npresenta afectaciones:\nDe acuerdo con la información que reposa en el expediente, se tiene que en el Informe de \nCumplimiento Ambiental No 16, entregado mediante radicados 2021132674-1-000 del 30 de junio \nde 2021 y 2021169913-1-000 del 12 de agosto de 2021, la Sociedad presentó el “INFORME \nESTADO ACTUAL DE LA COMPENSACION ESTABLECIDA EN 20 HECTAREAS EN EL PREDIO \nLA CULEBRA, MUNICIPIO DE REMEDIOS, DEPARTAMENTO DE ANTIOQUIA” (Anexos: \n3_ANEXOS \n\\ \nANEXO \n8 \nCOMPENSACION \nY \n1% \n\\ \n2. \nSEGUIMIENTO_COMPENSACIONES_FORESTALES\\ 2.2 COMPENSACIÓN_CHIQUILLO \\ Anexo \n2.2.1_Comp_Restauración_EcolChiquillo), que detalla las actividades realizadas entre julio y \ndiciembre de 2020 en el predio afectado La Culebra.\nDicho informe tuvo por objeto poner en conocimiento de esta Autoridad el grado de afectación y \nhallazgos de los 17 polígonos donde la Sociedad llevó a cabo la actividad de compensación.\nAsí es que, en función de dar respuesta a los argumentos presentados por la Sociedad en relación \ncon los polígonos que deberían ser descartados, en la Tabla 3 se relacionan los polígonos que \nOCENSA S.A consideró inviables para dar continuidad a las actividades de mantenimiento:\n\nResolución No.  00905           Del   05 de mayo de 2022            Hoja No. 14 de 19\n“POR LA CUAL SE RESUELVE UN RECURSO DE REPOSICIÓN”\nOficinas: Carrera 13 A No. 34 – 72 Edificio 13 35 Pisos 8 al 11 Bogotá, D.C.\nCentro de Orientación y Radicación de Correspondencia: Carrera 13 A No. 34 – 72 Edificio 13 35 \nLocales 110 al 112 Bogotá, D.C.  \nCódigo Postal 110311156\nNit.: 900.467.239-2\nLínea de Orientación y Contacto Ciudadano: 57 (1) 2540100 / 018000112998 PBX: 57 (1) 2540111\nwww.anla.gov.co    Email: licencias@anla.gov.co  \nPágina 14 de 19\nTabla 1 Hallazgos para los polígonos descartados por la Sociedad\nPOLÍGONO\nÁREA (ha)\nGRADO DE \nAFECTACIÓN\nHALLAZGOS\n1\n1,94\nAlto\n• Aumento de asentamientos de viviendas \n• Tala y quema de individuos para establecimiento de \ncultivos pancoger \n• Rocería para loteo por terceros \n• Pocas especies sobrevivientes \n• Maleza alta zarza negra • Explanación de lotes \n• Cultivos de pancoger piñas, plátano y yuca\n2\n1,8\nAlto\n• Asentamientos de viviendas \n• Explanación de lotes \n• Cultivos de pancoger yuca \n• Rocería para afectación • Tala de individuos \n• Tala y quema\n3\n1,8\nAlto\n• Asentamientos de vivienda \n• Especies sobrevivientes en peligro por afectación \n• Cultivo de pancoger plátano \n• Cultivo de pancoger maíz\n• Porcentaje mínimos de sobrevivientes \n• Tala y quema\n4\n0,01*\nBajo\n• Abundante capa vegetal alta \n• Falta de plateo / abunda enredadera \n• Falta de control fitosanitario \n• Mayor adaptabilidad cajonea arbórea (Carboneros) \nPolvillo y \n• Se mantiene afectación por cultivos de pancoger sin \naumento (yuca, piña, plátano) \n• Mortalidad de algunos individuos por quema o incendio \nforestal (Ocobo)\n5\n0,24*\nBajo\n• Maleza alta agresiva, enredadera controlable con \nmantenimiento \n• Porcentaje alto de supervivencia\n6\n0,46\nBajo\n• Buena adaptabilidad de la especie Ceiba \n• Se mantiene afectación por cultivos de pancoger sin \naumento (yuca y plátano) \n• Tala y quema\n7\n1,02\nBajo\n• Maleza agresiva por falta de mantenimiento\n8\n3,67\nMedio\n•Tutores, desenterrados por terceros \n• Plántulas deshidratadas, algunas sin vidas por seguía \n• Quema y tala por terceros \n• Siembra de Pancoger (piña) \n• Zona demarcadas y rocería por terceros para loteo \n• Asentamientos de viviendas \n• Construcciones de caminos, tala de individuos \n• Maleza agresiva \n• Individuos con vida \n• Mayor adaptabilidad Ceiba \n• Maleza agresiva por tramos\n9\n0,21\nBajo\n• Maleza agresiva alta, individuos con supervivencia \n• Crecimiento de cultivo de pancoger (maíz) \n• Rocería para loteo\n10\n0,4\nBajo\n• Tala de acacias existentes, afectando la supervivencia \nde los nativos al caer \n• Individuos con supervivencia, rodeado de maleza alta\n15\n0,16\nMedio\n• Especies sobrevivientes \n• Mínimo porcentaje de mortalidad \n• Maleza alta agresiva zarza negra\nTOTAL\n11,71\nFuente: Informe Estado Actual de la Compensación establecida en 20 hectáreas en el predio La Culebra, \nmunicipio de Remedios, departamento de Antioquia.\n*No se descarta la totalidad del polígono\nConforme a las condiciones descritas anteriormente, OLEODUCTO CENTRAL S.A. – OCENSA S.A. \npresentó solicitud de aprobación para el cambio de áreas equivalentes a 11,7 hectáreas, asociadas \nal predio La Culebra, para desarrollarlas en el predio Zaragocilla ubicado en la vereda Mata, \ncorregimiento San Mateo, [M]unicipio de Remedios, [D]epartamento de Antioquia.\nEn ese sentido, cuando la Sociedad argumenta “(…) [Q]ue solo deberían ser descartados los polígonos 1, \n2, 3, 11, 12, 13, 14, 15, 16 y 17, los cuales hacen parte de las 11,7 hectáreas para las que se solicitó la \n\nResolución No.  00905           Del   05 de mayo de 2022            Hoja No. 15 de 19\n“POR LA CUAL SE RESUELVE UN RECURSO DE REPOSICIÓN”\nOficinas: Carrera 13 A No. 34 – 72 Edificio 13 35 Pisos 8 al 11 Bogotá, D.C.\nCentro de Orientación y Radicación de Correspondencia: Carrera 13 A No. 34 – 72 Edificio 13 35 \nLocales 110 al 112 Bogotá, D.C.  \nCódigo Postal 110311156\nNit.: 900.467.239-2\nLínea de Orientación y Contacto Ciudadano: 57 (1) 2540100 / 018000112998 PBX: 57 (1) 2540111\nwww.anla.gov.co    Email: licencias@anla.gov.co  \nPágina 15 de 19\naprobación de cambio de áreas al predio “Zaragocilla”, pues estos son los polígonos que efectivamente \npresentan afectaciones y no cumplen con los estándares necesarios para hacer parte de la compensación”, se \ntiene que esto no es coincidente con el informe presentado a esta Autoridad en agosto de 2021 y \nque fue objeto de evaluación por parte de esta Autoridad e insumo para el pronunciamiento mediante \nla Resolución 0360 del 11 de febrero de 2022.\nAdicionalmente, en el Informe de Cumplimiento Ambiental No 16, la Sociedad indicó que el área \ncompensada en el predio La Culebra que no presenta afectaciones y que es apta para hacer parte \nde la compensación, corresponde a 8,3 hectáreas, asociados a los polígonos 4, 5, 11, 12, 13, 14, \n16, 17, razón por la cual serían tenidos en cuenta en actividades de mantenimiento.\nNo obstante lo anterior, en los argumentos presentados en el presente Recurso de Reposición, la \nSociedad manifiesta que ha realizado actividades de control de malezas, control fitosanitario, \nfertilización, poda y resiembra únicamente para los polígonos 4, 5, 6, 7, 8, 9 y 10, lo que no es \nconcordante ni coherente con los hallazgos anteriormente descritos, pues como bien se indica en la \nTabla 3, los polígonos 6, 9 y 10 fueron descartados por el titular por intervención antrópica donde se \nencuentran, entre otros, cultivos de pancoger.\nSin embargo, respecto a los polígonos 6, 9 y 10 que descarta la Sociedad en el Informe de \nCumplimiento Ambiental 16, posteriormente fueron incluidos dentro de los mantenimientos del año \nen curso, por lo tanto, esta Autoridad considera que, teniendo en cuenta que de acuerdo con la visita \nde seguimiento y con la revisión cartográfica estos cuentan con cobertura vegetal con un estado \nfitosanitario aceptable, coincidente con los hallazgos de OCENSA S.A. que los ubican en un grado \nde afectación bajo, por ende, es viable continuar con los mantenimientos y acciones dirigidas a \ncontrolar los tensionantes en estas áreas.\nCabe aclarar que en los polígonos 4, 5, 7 y 8, de acuerdo con el análisis cartográfico del Concepto \nTécnico 08358 del 23 de diciembre de 2021 y la visita de campo realizada entre el 27 y el 31 de julio \nde 2021, se identificó presencia de tejido urbano, por lo tanto, no se cuenta con las garantías que \npermitan asegurar que las áreas de compensación poco intervenidas y sin intervenir cercanas a las \nzonas de aumento de asentamientos perduren en el tiempo.\nAhora bien, retomando el argumento donde la Sociedad manifiesta que los polígonos 1, 2, 3, 11, 12, \n13, 14, 15, 16 y 17 deberían ser descartados, se tiene que no es claro para esta Autoridad la razón \npor la que sugieren excluir los polígonos 13, 16 y 17 teniendo en cuenta que estos no hacen parte \nde los polígonos con algún grado de afectación. Además, tal como se manifestó en el Concepto \nTécnico No. 08358 del 23 de diciembre de 2021, en los polígonos 13, 16 y 17 se describió que “(…) \n[E]n cuanto al cerramiento este se encuentra en buen estado y no se presenta evidencia de la intervención de \ntensionantes, la población loteó una parte del predio con el fin de establecer cultivos de pancoger, la Alcaldía \nlogró evitar esta práctica. Se evidencia un proceso de regeneración natural avanzado.” (pág. 136 del CT08358 \ndel 23/12/2021).\nTeniendo en cuenta esto, esta Autoridad procede a revisar de nuevo estos tres (3) polígonos (13, 16 \ny 17) usando una imagen con una resolución (2020-01-12-WV02-Strip) del año 2020:\n-\nPolígonos 13 y 16. En estos polígonos se evidencia una buena cobertura vegetal en toda su \nárea (0,085 ha para el polígono 13 y 0,118 ha para el polígono 16), tal como se muestra en \nla imagen 6.\n-\nPolígono 17: En este polígono, se evidencia una buena cobertura vegetal en toda su área \n(0,023 ha), tal como se muestra en la imagen 7.\n(Ver imagen 6 y 7 (sic) en la página 22 del Concepto técnico 2298 del 29 de abril de 2022)\n(…)\nDe acuerdo con lo anterior no es viable descartar los polígonos 13, 16 y 17 dado que estos presentan \ncobertura vegetal y no se presenta evidencia de tensionantes como se verificó en la visita de \nseguimiento, sin embargo, si la Sociedad considera que deben ser descartados; podrá presentar sus \nargumentos para sean evaluados en el marco del próximo seguimiento, dado que no es procedente \nhacerlo en el marco del Recurso de Reposición.\nPor otro lado, respecto al polígono 15 como se indicó en la Tabla 3, se evidenció un grado de \nafectación medio por maleza alta agresiva zarza negra, sumado a esto, en los argumentos \npresentados por la Sociedad para el presente recurso de reposición, esta manifiesta que el área no \n\nResolución No.  00905           Del   05 de mayo de 2022            Hoja No. 16 de 19\n“POR LA CUAL SE RESUELVE UN RECURSO DE REPOSICIÓN”\nOficinas: Carrera 13 A No. 34 – 72 Edificio 13 35 Pisos 8 al 11 Bogotá, D.C.\nCentro de Orientación y Radicación de Correspondencia: Carrera 13 A No. 34 – 72 Edificio 13 35 \nLocales 110 al 112 Bogotá, D.C.  \nCódigo Postal 110311156\nNit.: 900.467.239-2\nLínea de Orientación y Contacto Ciudadano: 57 (1) 2540100 / 018000112998 PBX: 57 (1) 2540111\nwww.anla.gov.co    Email: licencias@anla.gov.co  \nPágina 16 de 19\nestá incluida dentro de los polígonos objeto de mantenimiento y por tanto propone descartarla. En \nconsecuencia, esta Autoridad considera viable incluir dicho polígono dentro de las áreas excluidas.\nDicho esto, a continuación, se relacionan los polígonos descartados con las áreas reportadas \ncartográficamente mediante el radicado 2021135640-1-000 del 2 de julio de 2021:\nID_OT_COMP\nÁREA (ha)\nPolígono-1\n1,939206\nPolígono-2\n1,797046\nPolígono-3\n4,570352\nPolígono-4\n3,013802\nPolígono-5\n4,740199\nPolígono-7\n1,020415\nPolígono-8\n3,665381\nPolígono-11\n0,047812\nPolígono-12\n0,453275\nPolígono-14\n0,072775\nPolígono-15\n0,163866\nTOTAL\n21,48\nAhora bien, a continuación, se presenta una tabla resumen con el estado actual de cada uno de los \npolígonos del predio La Culebra:\nESTADO\nPOLÍGONOS\nDescartado por la Resolución 0360 del 11 de \nfebrero de 2022\n1, 2, 3, 4, 5, 7, 8, 11, 12, 14\nDescartado en atención al Recurso de Reposición \ninterpuesto contra la Resolución 0360 del 11 de \nfebrero de 2022\n15\nÁreas en ejecución\n6, 9, 10, 13, 16, 17\nEn este sentido y a fin de evitar confusiones acerca de las áreas a compensar asociados al Programa \nCompensación para el Medio Biótico – Ficha No 41- Recuperación de áreas y restauración ecológica, \nse considera pertinente modificar el Artículo Segundo, de la siguiente manera:\n“ARTÍCULO SEGUNDO. Descartar los polígonos 1, 2, 3, 4, 5, 7, 8, 11, 12, 14 y 15 localizados en el \npredio La Culebra, vereda Otú, ubicados en jurisdicción del Municipio de Remedios del Departamento \nde Antioquia (Estación Chiquillo), asociados al Programa Compensación para el Medio Biótico – Ficha \nNo 41- Recuperación de áreas y restauración ecológica.”\nAl mismo tiempo, entendiendo que el Artículo Segundo no hace referencia al área total a compensar, \nsi no al área total descartada y que además entendiendo que el área calculada a compensar hasta \nla fecha corresponde a 20 ha, para las que existe una propuesta de compensación aprobada para \n11,7 ha ([P]or ejecutar), la Sociedad deberá presentar una propuesta adicional para las 8,3 ha \nrestantes y no para 9,62 ha como se indicó en el Artículo Tercero.\nEn relación con la solicitud de eliminar la afirmación de que son “[Á]reas faltantes de compensar”, se \ntiene que como la Sociedad tiene áreas en mantenimiento y que el Artículo Tercero de la Resolución \n0360 del 11 de febrero de 2022 requiere la entrega de una propuesta complementaria o plan de \ncompensación en la cual se indique cómo garantizarían la supervivencia de los individuos \nsembrados, cumpliendo con el total de las áreas descartadas del predio La Culebra, se considera \npertinente aclarar su solicitud, en el sentido de que estarán pendientes de evaluación y aprobación.\n(…)”\nDe otro lado, en lo que corresponde al argumento expuesto por el recurrente, según el cual, \ncon la expedición del acto administrativo recurrido se trasgreden los principios de seguridad \njurídica y confianza legítima, para cuyo sustento trae a colación jurisprudencia, la Autoridad \nNacional efectúa las siguientes precisiones:\nDe una parte, el principio de seguridad jurídica, conforme lo señala la Corte Constitucional \nen Sentencia C-250/12, supone una garantía de certeza respecto de las normas que \nregulan una situación jurídica concreta, esto es, la existencia de términos precisos que \ndeben ser considerados por la administración o el juez según sea el caso, al adoptar sus \ndecisiones, los cuales fijan condiciones de estabilidad respecto de los cambios normativos \n\nResolución No.  00905           Del   05 de mayo de 2022            Hoja No. 17 de 19\n“POR LA CUAL SE RESUELVE UN RECURSO DE REPOSICIÓN”\nOficinas: Carrera 13 A No. 34 – 72 Edificio 13 35 Pisos 8 al 11 Bogotá, D.C.\nCentro de Orientación y Radicación de Correspondencia: Carrera 13 A No. 34 – 72 Edificio 13 35 \nLocales 110 al 112 Bogotá, D.C.  \nCódigo Postal 110311156\nNit.: 900.467.239-2\nLínea de Orientación y Contacto Ciudadano: 57 (1) 2540100 / 018000112998 PBX: 57 (1) 2540111\nwww.anla.gov.co    Email: licencias@anla.gov.co  \nPágina 17 de 19\nque se suceden en el futuro frente a situaciones particulares; de otra parte, el principio de \nconfianza legítima, conforme lo desarrolla la señalada Corporación en Sentencia C-131/04, \nse materializa en la obligación de las autoridades públicas de preservar un comportamiento \nconsecuente frente a los particulares respecto de sus acciones anteriores, de las cuales si \nbien no se derivan derechos adquiridos, sí corresponden a situaciones de hecho que deben \nser protegidas con base en la conducta aquiescente de las Autoridades respecto de \naquellos, lo cual genera legítimas expectativas en los administrados.\nEn este orden de ideas, la Autoridad Nacional no observa una vulneración al principio de \nseguridad jurídica alegado por la Sociedad en el acto administrativo recurrido, tal como se \nanalizó técnicamente.\nCon relación con la trasgresión aducida al principio de confianza legítima y de buena fe, \nconsidera la Autoridad Nacional que no se configura, pues la administración pública no ha \ndesplegado comportamiento alguno fuera del estricto cumplimiento de las disposiciones \nlegales de carácter general y particular que atañen al cumplimiento en las condiciones \nnecesarias para la ejecución del Plan de Compensación en el marco del Proyecto “Oleoducto \nCusiana – La Belleza – Vasconia – Coveñas e Instalaciones Anexas”, que pudiera generar una \nexpectativa legítima en la Sociedad, objeto de reconocimiento.\nVale la pena señalar que, si bien no se accede a algunas pretensiones imploradas en el \nrecurso de reposición, la Sociedad podrá allegar la información necesaria para la revisión \npor parte de la Autoridad Nacional, pero en el marco del seguimiento ambiental, como \nquiera que este no es el escenario jurídico propicio para tal fin.\nDe acuerdo con las consideraciones técnicas presentadas, se procederá a reponer en el \nsentido de modificar lo dispuesto en los artículos segundo y tercero de la Resolución 360 \ndel 11 de febrero de 2022, tal como se señalará en la parte resolutiva del presente acto \nadministrativo.\nEn mérito de lo expuesto, se\nRESUELVE\nARTÍCULO PRIMERO. Reponer en el sentido de modificar el contenido del artículo \nsegundo de la Resolución 360 del 11 de febrero de 2022, de conformidad con lo expuesto \nen la parte motiva del presente acto administrativo, el cual quedará de la siguiente manera:\n“ARTÍCULO SEGUNDO. Descartar los polígonos 1, 2, 3, 4, 5, 7, 8, 11, 12, 14 y 15 \nlocalizados en el predio La Culebra, vereda Otú, ubicados en jurisdicción del \nMunicipio de Remedios del Departamento de Antioquia (Estación Chiquillo), \nasociados al Programa Compensación para el Medio Biótico – Ficha No 41- \nRecuperación de áreas y restauración ecológica.”\nARTÍCULO SEGUNDO. Reponer en el sentido de modificar el contenido del artículo tercero \nde la Resolución 360 del 11 de febrero de 2022, de conformidad con lo expuesto en la parte \nmotiva del presente acto administrativo, el cual quedará de la siguiente manera:\n“ARTÍCULO TERCERO. La Sociedad OLEODUCTO CENTRAL S.A. – OCENSA – \nS.A. deberá presentar una propuesta complementaria o plan de compensación para \nlas 8,3 ha pendientes de evaluación y aprobación, en la cual deberán indicar y \ndemostrar como garantizarán la supervivencia de los individuos sembrados”\nARTÍCULO TERCERO. Notificar el presente acto administrativo al representante legal, o al \napoderado debidamente constituido o a la persona debidamente autorizada por la Sociedad \nOLEODUCTO CENTRAL S.A. – OCENSA – S.A., identificada con NIT. 800.251.163-0, o a \nquien haga sus veces, por medios electrónicos, de conformidad con lo dispuesto en el \nartículo 4 del Decreto Legislativo 491 del 28 de marzo de 2020.\nPARÁGRAFO PRIMERO. En el evento en que la notificación no pueda hacerse de forma \nelectrónica, se seguirá el procedimiento previsto en los artículos 67 y siguientes de la Ley \n1437 de 2011.\n\nResolución No.  00905           Del   05 de mayo de 2022            Hoja No. 18 de 19\n“POR LA CUAL SE RESUELVE UN RECURSO DE REPOSICIÓN”\nOficinas: Carrera 13 A No. 34 – 72 Edificio 13 35 Pisos 8 al 11 Bogotá, D.C.\nCentro de Orientación y Radicación de Correspondencia: Carrera 13 A No. 34 – 72 Edificio 13 35 \nLocales 110 al 112 Bogotá, D.C.  \nCódigo Postal 110311156\nNit.: 900.467.239-2\nLínea de Orientación y Contacto Ciudadano: 57 (1) 2540100 / 018000112998 PBX: 57 (1) 2540111\nwww.anla.gov.co    Email: licencias@anla.gov.co  \nPágina 18 de 19\nPARÁGRAFO SEGUNDO. En el suceso en que el titular de la licencia o el permiso, entre \nen proceso de disolución o régimen de insolvencia empresarial o liquidación regulados por \nlas normas vigentes, informará inmediatamente de esta situación a esta Autoridad, con \nfundamento, entre otros, en los artículos 8, 58, 79, 80, 81, 95 numeral 8 de la Constitución \nPolítica de 1991, en la Ley 43 de 1990, en la Ley 222 de 1995, en la Ley 1333 de 2009 y \ndemás normas vigentes y jurisprudencia aplicable. \nAdicional a la obligación de informar a esta Autoridad de tal situación, el titular de la licencia \no permiso aprovisionará contablemente las obligaciones contingentes que se deriven de la \nexistencia de un procedimiento ambiental sancionatorio conforme con el artículo 40 de la \nLey 1333 de 2009 o la norma que la adicione, modifique o derogue.\nARTÍCULO CUARTO. Comunicar el contenido del presente acto administrativo a la \nCorporación Autónoma Regional de la Orinoquia (CORPORINOQUIA), Corporación \nAutónoma Regional de Boyacá (CORPOBOYACÁ), Corporación Autónoma Regional de \nChivor (CORPOCHIVOR), Corporación Autónoma Regional de Santander (CAS), \nCorporación Autónoma Regional de los Valles del Sinú y de San Jorge (CVS), Corporación \nAutónoma Regional del Centro de Antioquia (Corantioquia) y Corporación Autónoma \nRegional de Sucre (CARSUCRE), y la Agencia Nacional de Hidrocarburos (ANH).\nARTÍCULO QUINTO. Publicar la presente Resolución en la Gaceta Ambiental de la \nAutoridad Nacional de Licencias Ambientales – ANLA, de conformidad con lo señalado en \nel artículo 71 de la Ley 99 de 1993.\nARTÍCULO SEXTO. Contra el presente acto administrativo no procede recurso alguno de \nconformidad con lo establecido en el artículo 87 del Código de Procedimiento Administrativo \ny de lo Contencioso Administrativo.\nNOTIFÍQUESE, COMUNÍQUESE, PUBLÍQUESE Y CÚMPLASE\nDada en Bogotá D.C., a los 05 de mayo de 2022\nEDILBERTO PEÑARANDA CORREA\nAsesor\nEjecutores\nIBLER ANDERSON MOLANO \nRINCON\nContratista\n \n \nRevisor / L\u0000der\nOSCAR GILBERTO GALVIS \nCAMACHO\nRevisor Jurídico/Contratista\n \n \nExpediente LAM0318\nConcepto técnico 2298 del 29 de abril de 2022\nFecha: 4 de mayo de 2022\nProceso No.: 2022087283\n\nResolución No.  00905           Del   05 de mayo de 2022            Hoja No. 19 de 19\n“POR LA CUAL SE RESUELVE UN RECURSO DE REPOSICIÓN”\nOficinas: Carrera 13 A No. 34 – 72 Edificio 13 35 Pisos 8 al 11 Bogotá, D.C.\nCentro de Orientación y Radicación de Correspondencia: Carrera 13 A No. 34 – 72 Edificio 13 35 \nLocales 110 al 112 Bogotá, D.C.  \nCódigo Postal 110311156\nNit.: 900.467.239-2\nLínea de Orientación y Contacto Ciudadano: 57 (1) 2540100 / 018000112998 PBX: 57 (1) 2540111\nwww.anla.gov.co    Email: licencias@anla.gov.co  \nPágina 19 de 19\nArchívese en: LAM0318 \nPlantilla_Resolución_SILA_v3_42852\nNota: Este es un documento electrónico generado desde los Sistemas de Información de la ANLA. El original reposa en los archivos digitales de la \nEntidad.\n"
}