{
  "fuente": "ANLA_GACETA",
  "numero_resolución": "RESOLUCIÓN N° 01568",
  "fecha_resolución": "2022-07-21",
  "anio_resolucion": "2022",
  "nombre_proyecto": "de “Explotación de los",
  "nombre_proyecto_normalizado": "DE EXPLOTACION DE LOS",
  "ubicación": "Municipio de Purificación, Departamento de Tolima",
  "empresa": "LASMO",
  "empresa_normalizada": "LASMO",
  "numero_expediente": "LAM",
  "radicados": [
    "2021133493",
    "2021192846",
    "2021263391",
    "2020079396",
    "2019203708",
    "2020048832",
    "2020088828",
    "2020114415",
    "2021055731",
    "2022032343"
  ],
  "descripcion": "POR LA CUAL SE RESUELVE UN RECURSO DE REPOSICIÓN Y SE TOMAN OTRAS DETERMINACIONES",
  "tipos_infraccion": [
    "Vertimientos",
    "Tala o afectación de bosques"
  ],
  "tipos_infraccion_normalizados": [
    "VERTIMIENTOS",
    "TALA O AFECTACION DE BOSQUES"
  ],
  "pdf_id": "39809",
  "file_name": "ANLA_39809.pdf",
  "texto_completo": "|\nRepública de Colombia\nMinisterio de Ambiente y Desarrollo Sostenible\nAUTORIDAD NACIONAL DE LICENCIAS AMBIENTALES \n- ANLA –\nRESOLUCIÓN N°  01568\n( 21 de julio de 2022 )\nOficinas: Carrera 13 A No. 34 – 72 Edificio 13 35 Pisos 8 al 11 Bogotá, D.C.\nCentro de Orientación y Radicación de Correspondencia: Carrera 13 A No. 34 – 72 Edificio 13 35 \nLocales 110 al 112 Bogotá, D.C.  \nCódigo Postal 110311156\nNit.: 900.467.239-2\nLínea de Orientación y Contacto Ciudadano: 57 (1) 2540100 / 018000112998 PBX: 57 (1) 2540111\nwww.anla.gov.co    Email: licencias@anla.gov.co  \nPágina 1 de 18\n“POR LA CUAL SE RESUELVE UN RECURSO DE REPOSICIÓN Y SE TOMAN OTRAS \nDETERMINACIONES”\nEL ASESOR DE LA DIRECCIÓN GENERAL DE LA AUTORIDAD NACIONAL DE LICENCIAS \nAMBIENTALES – ANLA\nEn uso de las facultades legales establecidas en la Ley 99 de 1993, el Decreto Ley 3573 del 27 de \nseptiembre de 2011, el Decreto 1076 del 26 de mayo de 2015, el Decreto 376 del 11 de marzo de \n2020, las Resoluciones ANLA 423 y 669 de 2020 y 1957 del 5 de noviembre de 2021 \ny,\nCONSIDERANDO:\nQue mediante la Resolución 41 de 9 de enero de 1996, el Ministerio del Medio Ambiente, hoy Ministerio \nde Ambiente y Desarrollo Sostenible - MADS, (en adelante el Ministerio), otorgó a la sociedad LASMO \nOIL (COLOMBIA) LIMITED, Licencia Ambiental ordinaria para el proyecto de “Explotación de los \nCampos Venganza y Revancha” localizados en el municipio de Purificación en el Departamento del \nTolima. \nQue mediante la Resolución 1071 del 2 de octubre de 1996, el Ministerio modificó la Resolución 41 \ndel 9 de enero de 1996, en el sentido de autorizar a la sociedad LASMO OIL (COLOMBIA) LIMITED, \nla evaporación del agua de producción en la locación Revancha (Matachín Sur). \nQue mediante la Resolución 353 de 6 de mayo de 1997, el Ministerio otorgó Licencia Ambiental \nOrdinaria a la sociedad LASMO OIL (COLOMBIA) LIMITED, para el proyecto de Perforación del Pozo \nExploratorio Venganza - 3, ubicado en el municipio de Purificación en el Departamento del Tolima. \nQue mediante la Resolución 163 del 17 de febrero de 1998, el Ministerio modificó la Licencia Ambiental \ncontenida en la Resolución 353 del 6 de mayo de 1997, otorgada a la sociedad LASMO OIL \n(COLOMBIA) LIMITED para las líneas de flujo Pozo Venganza-3 – Matachín Norte. \nQue mediante la Resolución 708 de 31 de julio de 1998, el Ministerio otorgó Licencia Ambiental a la \nsociedad LASMO OIL (COLOMBIA) LTD, para el proyecto de “Construcción y operación de la línea de \nflujo del pozo Venganza-3 hasta las instalaciones del Campo Matachín Norte”, localizado en el \nmunicipio de Purificación en el Departamento del Tolima.\nQue mediante la Resolución 1283 del 24 de diciembre de 1998, el Ministerio aceptó el cambio de razón \nsocial de la sociedad LASMO OIL (COLOMBIA) LTD por la sociedad PETROBRAS COLOMBIA \nLIMITED, con NIT. 860521658-1, de acuerdo con lo informado mediante comunicación 3110-1-23853 \ndel 28 de octubre de 1998. \n\nResolución No.  01568           Del   21 de julio de 2022            Hoja No. 2 de 18\n“POR LA CUAL SE RESUELVE UN RECURSO DE REPOSICIÓN Y SE TOMAN OTRAS DETERMINACIONES”\nOficinas: Carrera 13 A No. 34 – 72 Edificio 13 35 Pisos 8 al 11 Bogotá, D.C.\nCentro de Orientación y Radicación de Correspondencia: Carrera 13 A No. 34 – 72 Edificio 13 35 \nLocales 110 al 112 Bogotá, D.C.  \nCódigo Postal 110311156\nNit.: 900.467.239-2\nLínea de Orientación y Contacto Ciudadano: 57 (1) 2540100 / 018000112998 PBX: 57 (1) 2540111\nwww.anla.gov.co    Email: licencias@anla.gov.co  \nPágina 2 de 18\nQue mediante la Resolución 665 del 18 de agosto de 1999, el Ministerio modificó la Resolución 41 del \n9 de enero de 1996, en el sentido de ampliar el área licenciada e incluir unas actividades.\nQue mediante la Resolución 1754 del 27 de septiembre de 2007, el Ministerio modificó la Resolución \n41 del 9 de enero de 1996, modificada por la Resolución 665 del 18 de agosto de 1999, en el sentido \nde adicionar dos (2) áreas de mayor interés denominadas Venganza L y Venganza M para el \nestablecimiento de cuatro pozos de producción, dos por plataforma, dentro del proyecto “Explotación \nde los Campos Venganza y Revancha”, localizado en el municipio de Purificación en el Departamento \ndel Tolima.\nQue mediante la Resolución 1369 del 31 de julio de 2008, el Ministerio modificó la Resolución 41 del \n9 de enero de 1996, en el sentido de requerir el plan de inversión forzosa de no menos del 1%.\nQue mediante la Resolución 577 del 28 de marzo de 2011, el Ministerio modificó la Resolución 41 de \n9 de enero de 1996 y la Resolución 665 del 18 de agosto de 1999, en el sentido de adicionar entre \notras actividades, la construcción y operación de la plataforma multipozos Venganza N, y la \nconstrucción y operación de 4 líneas de flujo. \nQue mediante la Resolución 1104 del 18 de julio de 2018, esta Autoridad Nacional autorizó la cesión \ntotal de los derechos y obligaciones originados y derivados de la Licencia Ambiental otorgada para el \nproyecto “Explotación de los Campos Venganza y Revancha”, hoy llamado “Campo Matachín Norte y \nMatachín sur”, respectivamente, de la sociedad PERENCO OIL AND GAS COLOMBIA a favor de la \nsociedad ECOPETROL S.A. con NIT. 899.999.068-1. \nQue mediante la Resolución 1813 del 09 de septiembre de 2019, esta Autoridad Nacional autorizó la \ncesión total de la Licencia Ambiental otorgada para el proyecto “Explotación de los Campos Venganza \ny Revancha”, hoy llamado “Campo Matachín Norte y Matachín sur”, respectivamente, de la sociedad \nECOPETROL S.A., a favor de la sociedad HOCOL S.A. con NIT. 860.072.134- 7, en adelante la \nSociedad. \nQue mediante la Resolución 1602 del 30 de septiembre del 2020, esta Autoridad Nacional no aceptó \nel valor de la actualización por IPC de la base de liquidación de la inversión forzosa de no menos del \n1%, acorde con lo establecido en el parágrafo primero del artículo 321 de la Ley 1955 del 25 de mayo \nde 2019\nQue mediante la Resolución 196 del 25 de enero del 2021, esta Autoridad Nacional resolvió un recurso \nde reposición interpuesto contra la Resolución 1602 del 30 de septiembre de 2020, en donde se \nconfirmó el artículo primero, se repuso el literal b) del artículo noveno, entre otros.\nQue mediante el Auto 11286 del 27 de diciembre del 2021, esta Autoridad Nacional realizó control y \nseguimiento ambiental donde se efectuaron requerimientos concernientes a la presentación de los \nmonitoreos de agua de las fuentes, presuntamente afectados por las actividades de fumigación, La \nimplementación de la estrategia de relacionamiento previo a las actividades de fumigación, entre otros.\nQue mediante la Resolución 366 del 14 de febrero de 2022, esta Autoridad Nacional modificó el \nartículo 16 la Resolución 353 del 06 de mayo de 1997, en el sentido de aprobar la actualización de la \nbase de liquidación de la inversión forzosa de no menos del 1%.\nQue mediante comunicación con radicación ANLA 2022032343-1-000 del 24 de febrero del 2022, la \nsociedad HOCOL S.A. encontrándose dentro del término legal interpuso recurso de reposición contra \nel artículo primero, parágrafos primero y segundo del artículo segundo de la Resolución 366 del 14 de \nfebrero de 2022.\n\nResolución No.  01568           Del   21 de julio de 2022            Hoja No. 3 de 18\n“POR LA CUAL SE RESUELVE UN RECURSO DE REPOSICIÓN Y SE TOMAN OTRAS DETERMINACIONES”\nOficinas: Carrera 13 A No. 34 – 72 Edificio 13 35 Pisos 8 al 11 Bogotá, D.C.\nCentro de Orientación y Radicación de Correspondencia: Carrera 13 A No. 34 – 72 Edificio 13 35 \nLocales 110 al 112 Bogotá, D.C.  \nCódigo Postal 110311156\nNit.: 900.467.239-2\nLínea de Orientación y Contacto Ciudadano: 57 (1) 2540100 / 018000112998 PBX: 57 (1) 2540111\nwww.anla.gov.co    Email: licencias@anla.gov.co  \nPágina 3 de 18\nDE LA COMPETENCIA DE LA AUTORIDAD NACIONAL DE LICENCIAS AMBIENTALES – ANLA\nEn ejercicio de las facultades extraordinarias conferidas en los literales d), e) y f), del artículo 18 de la \nLey 1444 de 2011, el Gobierno Nacional expidió el Decreto 3573 del 27 de septiembre de 2011, \ncreando la Autoridad Nacional de Licencias Ambientales - ANLA, y le asignó entre otras funciones, la \nde otorgar o negar las licencias, permisos y trámites ambientales de competencia del Ministerio de \nAmbiente y Desarrollo Sostenible. \nEl Gobierno Nacional, mediante Decreto Ley 3573 del 27 de septiembre de 2011, creó la Autoridad \nNacional de Licencias Ambientales – ANLA, como una entidad con autonomía administrativa y \nfinanciera, sin personería jurídica, la cual hace parte del Sector Administrativo de Ambiente y \nDesarrollo Sostenible, en los términos del artículo 67 de la Ley 489 de 1998.\nQue el numeral 1 del artículo tercero del Decreto 3573 del 27 de septiembre de 2011, le estableció a \nla Autoridad Nacional de Licencias Ambientales – ANLA, entre otras, la función de otorgar o negar las \nlicencias, permisos y trámites ambientales de competencia del Ministerio de Ambiente y Desarrollo \nSostenible, de conformidad con la ley y los reglamentos. \nQue a través del Decreto 1076 del 26 de mayo de 2015, se expidió el Decreto Único Reglamentario \ndel Sector Ambiente y Desarrollo Sostenible. \nQue mediante Decreto 376 del 11 de marzo de 2020, se modificó la estructura de la Autoridad Nacional \nde Licencias Ambientales – ANLA, escindiéndose la Subdirección de Evaluación y Seguimiento, \ngenerando dos subdirecciones independientes, dentro de la estructura de la Entidad.\nMediante la Resolución 423 del 12 de marzo de 2020 “Por la cual se delegan unas funciones y se \ndictan otras disposiciones” en su artículo 8, se delegó en el Asesor Código 1020 Grado 15, adscrito al \nDespacho del director general, la función de suscribir los actos administrativos que aprueben los \nplanes de compensación y de la inversión forzosa de no menos del 1%.\nA través de la Resolución 669 del 14 de abril de 2020, se nombró al servidor público EDILBERTO \nPEÑARANDA CORREA, en el empleo de libre nombramiento y remoción de Asesor, código 1020, \ngrado 15, adscrito a la Dirección General de la planta global de la ANLA. \nPor su parte, la Resolución 1957 del 5 de noviembre de 2021, adopta el Manual Específico de \nFunciones y de Competencias Laborales para los empleos de la planta de personal de la Autoridad \nNacional de Licencias Ambientales – ANLA.\nTeniendo en cuenta lo anterior, es el Asesor del Despacho del Director general de la Autoridad \nNacional de Licencias Ambientales el competente para firmar el presente Acto Administrativo. \nFUNDAMENTOS LEGALES\nDE LA PROTECCIÓN AL MEDIO AMBIENTE COMO DEBER SOCIAL DEL ESTADO\nQue el artículo 8 de la Constitución Política establece que \"Es obligación del Estado y de las personas\nproteger las riquezas culturales y naturales de la nación\".\nQue la Constitución Política elevó a rango constitucional la obligación que tiene el Estado de proteger\nel medio ambiente, y el derecho que tienen todos los ciudadanos a gozar de un ambiente sano y así \nmismo \"Es deber del Estado proteger la diversidad e integridad del ambiente, conservar las áreas de\nespecial importancia ecológica y fomentar la educación para el logro de estos fines.\" (Artículo 79 de la\nConstitución Política). El medio ambiente es un Derecho colectivo que debe ser protegido por el \nEstado, estableciendo todos los mecanismos necesarios para su protección.\n\nResolución No.  01568           Del   21 de julio de 2022            Hoja No. 4 de 18\n“POR LA CUAL SE RESUELVE UN RECURSO DE REPOSICIÓN Y SE TOMAN OTRAS DETERMINACIONES”\nOficinas: Carrera 13 A No. 34 – 72 Edificio 13 35 Pisos 8 al 11 Bogotá, D.C.\nCentro de Orientación y Radicación de Correspondencia: Carrera 13 A No. 34 – 72 Edificio 13 35 \nLocales 110 al 112 Bogotá, D.C.  \nCódigo Postal 110311156\nNit.: 900.467.239-2\nLínea de Orientación y Contacto Ciudadano: 57 (1) 2540100 / 018000112998 PBX: 57 (1) 2540111\nwww.anla.gov.co    Email: licencias@anla.gov.co  \nPágina 4 de 18\nQue, adicionalmente, el Estado debe planificar el manejo y aprovechamiento de los recursos naturales\npara garantizar su desarrollo sostenible, su conservación, restauración o sustitución, tal y como lo \nestablece el artículo 80 de la Constitución Política. Al efecto, la planificación se debe realizar utilizando\nuna serie de mecanismos que permitan analizar, evaluar y prever unas circunstancias que faciliten la\ntoma de decisión, con el fin de alcanzar un objetivo propuesto, en este caso, el Desarrollo Sostenible.\nLa protección al medio ambiente corresponde a uno de los más importantes cometidos estatales, es \ndeber del Estado garantizar a las generaciones futuras la conservación del ambiente y la preservación\nde los recursos naturales. Con esta finalidad se creó el Ministerio del Medio Ambiente, hoy Ministerio\nde Ambiente y Desarrollo Sostenible, como organismo rector de la gestión ambiental y de los recursos\nnaturales, al que corresponde impulsar una relación de respeto entre el hombre y la naturaleza y definir\nla política ambiental de protección, conservación y preservación.\nDe lo anteriormente expuesto, se debe entender que los proyectos, obras o actividades que \nemprendan las personas, sea naturales o jurídicas, que eventualmente produzcan un impacto de \ncarácter ambiental al medioambiente, comprendiendo sus recursos naturales renovables o no \nrenovables, los ecosistemas y la diversidad biológica allí existente, deberán efectuarse en el marco de\nun desarrollo sostenible, entendiéndose éste en el sentido de que las actividades se deberán ejecutar\nde tal manera que se preserve, de manera equitativa, el medio ambiente y sus recursos naturales para\nlas generaciones presentes y futuras.\nNATURALEZA Y PROCEDENCIA DEL RECURSO DE REPOSICIÓN\nAl respecto, es preciso señalar que los recursos son instrumentos dirigidos a controvertir las decisiones \nque adopta la administración pública sobre determinados aspectos jurídicos que cambian el mundo \nexterior; creando, modificando o extinguiendo situaciones jurídicas determinadas.\nEl Capítulo VI de la Ley 1437 de 18 de enero de 2011, por la cual se expidió el Código de Procedimiento \nAdministrativo y de lo Contencioso Administrativo (en adelante CPACA), en su artículo 74 establece:\n“Artículo 74. Recursos contra los actos administrativos. Por regla general, contra los actos \ndefinitivos procederán los siguientes recursos:\n1. El de reposición, ante quien expidió la decisión para que la aclare, modifique, adicione o revoque.\n(…).”\nAsí las cosas, mediante el recurso de reposición la sociedad HOCOL S.A tiene la oportunidad de \nejercer el derecho de contradicción de una decisión, para que la administración, previa a su evaluación, \nla confirme, aclare, modifique, adicione o revoque; sin embargo, el Congreso en uso de la libertad de \nconfiguración legislativa limitó la presentación de recursos, según el contenido de la decisión, a los \nactos definitivos; igualmente, determinó que, frente a los actos de carácter general, de trámite, \npreparatorios o de ejecución, no procede recurso alguno, al tenor de lo establecido en el referido \nartículo 75 del precitado Código.\nEn cuanto a la oportunidad y presentación de los recursos, el artículo 76 del CPACA, dispone:\n“Artículo 76. Oportunidad y presentación. Los recursos de reposición y apelación deberán \ninterponerse por escrito en la diligencia de notificación personal, o dentro de los diez (10) días \nsiguientes a ella, o a la notificación por aviso, o al vencimiento del término de publicación, según el caso. \nLos recursos contra los actos presuntos podrán interponerse en cualquier tiempo, salvo en el evento en \nque se haya acudido ante el juez.” (Negrilla fuera de texto).\nLos recursos se presentarán ante el funcionario que dictó la decisión, salvo lo dispuesto para el de queja, \ny si quien fuere competente no quisiere recibirlos podrán presentarse ante el procurador regional o ante \n\nResolución No.  01568           Del   21 de julio de 2022            Hoja No. 5 de 18\n“POR LA CUAL SE RESUELVE UN RECURSO DE REPOSICIÓN Y SE TOMAN OTRAS DETERMINACIONES”\nOficinas: Carrera 13 A No. 34 – 72 Edificio 13 35 Pisos 8 al 11 Bogotá, D.C.\nCentro de Orientación y Radicación de Correspondencia: Carrera 13 A No. 34 – 72 Edificio 13 35 \nLocales 110 al 112 Bogotá, D.C.  \nCódigo Postal 110311156\nNit.: 900.467.239-2\nLínea de Orientación y Contacto Ciudadano: 57 (1) 2540100 / 018000112998 PBX: 57 (1) 2540111\nwww.anla.gov.co    Email: licencias@anla.gov.co  \nPágina 5 de 18\nel personero municipal, para que ordene recibirlos y tramitarlos, e imponga las sanciones \ncorrespondientes, si a ello hubiere lugar.\nEl recurso de apelación podrá interponerse directamente, o como subsidiario del de reposición y cuando \nproceda será obligatorio para acceder a la jurisdicción.\nLos recursos de reposición y de queja no serán obligatorios.”\nEs decir, la sociedad HOCOL S.A contaba con un térmimo de diez (10) días, contabilizados desde su \nnotificación para presentar recurso de reposición, y de acuerdo con la comunicación con radicación \nANLA 2022032343-1-000 del 24 de febrero del 2022 se puede concluir que la recurrente se encontraba \nen términos, ya que el plazo legal para el interposición del recurso venció el 28 de febrero del 2022.\nDe otro lado, y de acuerdo con lo previsto en el artículo 77 del CPACA, los recursos deberán reunir \nlos siguientes requisitos:\n“Artículo 77. Requisitos. Por regla general los recursos se interpondrán por escrito que no requiere de \npresentación personal si quien lo presenta ha sido reconocido en la actuación. Igualmente, podrán \npresentarse por medios electrónicos.\nLos recursos deberán reunir, además, los siguientes requisitos:\n1.\nInterponerse dentro del plazo legal, por el interesado o su representante o apoderado \ndebidamente constituido.\n2.\nSustentarse con expresión concreta de los motivos de inconformidad.\n3.\nSolicitar y aportar las pruebas que se pretende hacer valer.\n4.\nIndicar el nombre y la dirección del recurrente, así como la dirección electrónica si desea ser \nnotificado por este medio.\nSólo los abogados en ejercicio podrán ser apoderados. Si la recurrente obra como agente oficioso, \ndeberá acreditar la calidad de abogado en ejercicio, y prestar la caución que se le señale para \ngarantizar que la persona por quien obra ratificará su actuación dentro del término de dos (2) meses.\nSi no hay ratificación se hará efectiva la caución y se archivará el expediente.\nPara el trámite del recurso el recurrente no está en la obligación de pagar la suma que el acto recurrido \nle exija. Con todo, podrá pagar lo que reconoce deber.”\nAhora bien, esta Autoridad Nacional verificó los documentos que fueron anexados al recurso de \nreposición, y se pudo verificar en el Certificado de existencia y representación legal de la sociedad \nHOCOL S.A. que la Doctora Guillermina Viuchy Gaitán ostenta la calidad de Representante legal \ntraduciendose esto en una legitimacion para radicar el recurso en comento. \nDe igual forma, se verificaron los requisitos restantes para presentar un recurso, y se concluye que los \ncuatro (4) numerales fueron debidamente cumplidos por la sociedad HOCOL S.A., ya que el recurso \nfue: (i) Interpuesto dentro del término establecido, (ii) acreditó la capacidad legal del recurrente, y (iii) \nse indicaron los argumentos de inconformidad.\nEn sentencia del 17 de julio de 1991 la Sección Tercera de la Sala de lo Contencioso Administrativo\ndel Consejo de Estado hizo el siguiente pronunciamiento:\n“Si bien es cierto la norma que se deja transcrita agrega: \"Y las (cuestiones) que aparezcan con motivo \ndel recurso, aunque no lo hayan sido antes\",' no quiere esto significar que a la administración se le \nconcedan poderes oficiosos de revocatoria. No, el texto impone otra interpretación armónica y \nsistemática: en él se le da amplitud al recurrente para que con motivo del recurso pueda plantear puntos \nnuevos no alegados durante el procedimiento de expedición del acto inicial (o definitivo en la \n\nResolución No.  01568           Del   21 de julio de 2022            Hoja No. 6 de 18\n“POR LA CUAL SE RESUELVE UN RECURSO DE REPOSICIÓN Y SE TOMAN OTRAS DETERMINACIONES”\nOficinas: Carrera 13 A No. 34 – 72 Edificio 13 35 Pisos 8 al 11 Bogotá, D.C.\nCentro de Orientación y Radicación de Correspondencia: Carrera 13 A No. 34 – 72 Edificio 13 35 \nLocales 110 al 112 Bogotá, D.C.  \nCódigo Postal 110311156\nNit.: 900.467.239-2\nLínea de Orientación y Contacto Ciudadano: 57 (1) 2540100 / 018000112998 PBX: 57 (1) 2540111\nwww.anla.gov.co    Email: licencias@anla.gov.co  \nPágina 6 de 18\nterminología de inciso final del artículo 50 ibidem); y se le permite a la administración que estime o \nconsidere puntos nuevos, siempre y cuando encajen en la órbita de lo pretendido por el recurrente.”\nEn este mismo sentido, en sentencia del 1 de junio de 2001 la Sección Primera de la Sala de lo \nContencioso Administrativo del Consejo de Estado se pronunció así:\n“Por la misma razón, estando en trámite la vía gubernativa, como es apenas obvio, la Administración \npuede revisar su actuación y, si es el caso, modificarla, sin necesidad de consentimiento escrito y \nexpreso del afectado, pues el artículo 59, inciso 2º, del C.C.A. le da amplias facultades para ello, cuando \nal efecto prevé: “La decisión resolverá todas las cuestiones que hayan sido planteadas y las que \naparezcan con motivo del recurso, aunque no lo hayan sido antes.”\nDe igual manera, la doctrina especializada sobre el tema, en concordancia con la interpretación que \nha realizado el Consejo de Estado, ha reconocido que la autoridad administrativa está obligada a \ndecidir sobre las cuestiones que se hayan planteado con motivo del recurso, aun si se trata de \ncuestiones que no hayan surgido anteriormente:\n“La decisión que pone fin a la vía gubernativa deberá ser motivada tanto en sus aspectos de hecho \ncomo de derecho, lo mismo que en los de conveniencia si son del caso. Lo anterior se reafirma en razón \nde que estamos frente a una nueva decisión administrativa, que no se aparte formalmente de las \nproducidas durante la etapa de la actuación administrativa. De aquí que el legislador exija los mismos \nrequisitos que para la expedición del primer acto, para el acto final, esto es, para el que resuelve la vía \ngubernativa; en este sentido, abordará todas las cuestiones que se hayan planteado y las que \naparezcan con motivo del recurso, aunque no lo hubieren sido antes.”\nSe destaca que, de acuerdo con nuestra legislación y doctrina existente, el recurso de reposición \nconstituye un instrumento legal mediante el cual la parte interesada tiene la oportunidad de ejercer el\nderecho de controvertir una decisión, para que la administración previa su evaluación la confirme, \naclare, modifique o revoque.\nBajo ese orden de ideas, es deber de la administración decidir en derecho el acto impugnado, \nhabiéndose ejercido en oportunidad legal el derecho de contradicción, que no solamente garantiza el\nderecho de conocer las decisiones de la administración sino también la oportunidad de controvertir \npor el medio de defensa aludido.\nA su vez, el numeral 2 del artículo 87 del CPACA señala:\n“Artículo 87. Firmeza de los actos administrativos. Los actos administrativos quedarán en firme:\n(…)\n2. Desde el día siguiente a la publicación, comunicación o notificación de la decisión sobre los recursos \ninterpuestos. (…)”\nFrente a este aspecto, el Consejo de Estado se ha pronunciado de la siguiente manera:\n“El fenómeno procesal de la firmeza implica en principio, que la decisión se torna incuestionable en sede \nadministrativa, lo que a su vez conlleva su ejecutoriedad. Y acaece, para este caso, ante la ocurrencia \nde cualquiera de dos condiciones: el transcurso del plazo sin mediar la interposición del recurso, o la \nnotificación de la providencia definitoria, de conformidad con lo establecido en el artículo 62 numerales \n2° y 3° del Código Contencioso Administrativo (…)”\nAsí las cosas, se entiende que con el presente acto administrativo que resuelve el recurso de \nreposición interpuesto contra la Resolución 366 del 14 de febrero del 2022, acontece además señalar \nque no procederá recurso alguno una vez surta la etapa de publicidad; teniendo en cuenta que la \ndecisión proferida pone fin a la etapa de la actuación administrativa, dándole firmeza a la \n\nResolución No.  01568           Del   21 de julio de 2022            Hoja No. 7 de 18\n“POR LA CUAL SE RESUELVE UN RECURSO DE REPOSICIÓN Y SE TOMAN OTRAS DETERMINACIONES”\nOficinas: Carrera 13 A No. 34 – 72 Edificio 13 35 Pisos 8 al 11 Bogotá, D.C.\nCentro de Orientación y Radicación de Correspondencia: Carrera 13 A No. 34 – 72 Edificio 13 35 \nLocales 110 al 112 Bogotá, D.C.  \nCódigo Postal 110311156\nNit.: 900.467.239-2\nLínea de Orientación y Contacto Ciudadano: 57 (1) 2540100 / 018000112998 PBX: 57 (1) 2540111\nwww.anla.gov.co    Email: licencias@anla.gov.co  \nPágina 7 de 18\ndeterminación de la Autoridad, lo que conlleva su ejecutoriedad, conforme a lo señalado en el artículo \n89 de la Ley 1437 de 2011.\nCon fundamento en las anteriores disposiciones legales, desde el punto de vista procedimental se \ncumplen con la universalidad de los presupuestos legales para que esta Autoridad Nacional se \npronuncie de fondo frente cada uno de los artículos y parágrafos recurridos.\nDefinida la viabilidad del recurso de reposición, esta Autoridad Nacional lo evaluó en su integridad y \ncada una de las consideraciones técnicas están plasmadas en el Concepto Técnico 3209 del 08 de \njunio del 2022.\nConocido lo anterior, se procede a desarrollar el recurso de conformidad a los recurrido por la titular \ndel instrumento de manejo y control ambiental, para lo cual se indicarán: La obligación recurrida, la \npetición y los argumentos expuestas por la titular del instrumento de manejo, y las consideraciones de \nla Autoridad Nacional de Licencias Ambientales con relación a las obligaciones recurridas.\nUna vez señalas, esta Autoridad Nacional prosigue a desarrollarlas de forma individual:\n \nA. LA OBLIGACIÓN RECURRIDA\nLa sociedad HOCOL S.A. mediante comunicación con radicación ANLA 2022032343-1-000 del 24 de \nfebrero del 2022, interpuso recurso de reposición en el sentido de modificar / aclarar el artículo primero \ny los parágrafos primero y segundo del artículo segundo de la Resolución 366 del 14 de febrero del \n2022.\nEn los cuales esta Autoridad Nacional, dispuso:\n“ARTÍCULO PRIMERO. Modificar el artículo 16 la Resolución 353 del 06 de mayo de 1997, en el sentido \nde aprobar la actualización de la base de liquidación de la inversión forzosa de no menos del 1%, en \nvirtud de lo señalado en el parágrafo primero del artículo 321 de la Ley 1955 del 25 de mayo del 2019, \npresentado por la Sociedad Hocol S.A,  para el proyecto “Campos Matachín Norte y Matachín Sur”, \nlocalizado en el municipio de Purificación en el Departamento del Tolima, de conformidad con lo \nexpuesto en la parte motiva del presente acto administrativo.\nARTÍCULO SEGUNDO…\nPARÁGRAFO PRIMERO. El valor de los proyectos del Plan de inversión forzosa de no menos del 1% \nejecutados, corresponde a la suma de CERO ($0) PESOS MCTE.\nPARÁGRAFO SEGUNDO. El valor de los proyectos del Plan de inversión forzosa de no menos del 1% \nque se encuentran en ejecución, corresponde a la suma de CERO ($0) PESOS MCTE.”\nB. LAS PETICIONES Y LOS ARGUMENTOS EXPUESTAS POR LA TITULAR DEL \nINSTRUMENTO DE MANEJO\n1.\nLAS PETICIONES\n“Primera petición principal. Se ADICIONE en el literal g, numeral 3, del artículo octavo de la \nResolución 529 de marzo de 2020 la autorización para que los municipios puedan asumir la titularidad \nde predios, así como presentar escritura que evidencia la entrega de predios a alguno de los municipios \ndel área de influencia del proyecto. En dicho sentido se propone los siguientes ajustes en la redacción: \nRedacción original: \nARTÍCULO PRIMERO. Modificar el artículo 16 la Resolución 353 del 06 de mayo de 1997, en el \nsentido de aprobar la actualización de la base de liquidación de la inversión forzosa de no menos \n\nResolución No.  01568           Del   21 de julio de 2022            Hoja No. 8 de 18\n“POR LA CUAL SE RESUELVE UN RECURSO DE REPOSICIÓN Y SE TOMAN OTRAS DETERMINACIONES”\nOficinas: Carrera 13 A No. 34 – 72 Edificio 13 35 Pisos 8 al 11 Bogotá, D.C.\nCentro de Orientación y Radicación de Correspondencia: Carrera 13 A No. 34 – 72 Edificio 13 35 \nLocales 110 al 112 Bogotá, D.C.  \nCódigo Postal 110311156\nNit.: 900.467.239-2\nLínea de Orientación y Contacto Ciudadano: 57 (1) 2540100 / 018000112998 PBX: 57 (1) 2540111\nwww.anla.gov.co    Email: licencias@anla.gov.co  \nPágina 8 de 18\ndel 1%, en virtud de lo señalado en el parágrafo primero del artículo 321 de la Ley 1955 del 25 \nde mayo del 2019, presentado por la Sociedad Hocol S.A, para el proyecto “Campos Matachín \nNorte y Matachín Sur”, localizado en el municipio de Purificación en el Departamento del Tolima, \nde conformidad con lo expuesto en la parte motiva del presente acto administrativo.\nRedacción propuesta: \nARTÍCULO PRIMERO. Modificar el artículo 16 la Resolución 353 del 06 de mayo de 1997, y \ndemás actos administrativos concordantes, en el sentido de aprobar la actualización de la base \nde liquidación de la inversión forzosa de no menos del 1%, en virtud de lo señalado en el \nparágrafo primero del artículo 321 de la Ley 1955 del 25 de mayo del 2019, presentado por la \nSociedad Hocol S.A, para el proyecto “Campos Matachín Norte y Matachín Sur”, localizado en el \nmunicipio de Purificación en el Departamento del Tolima, de conformidad con lo expuesto en la \nparte motiva del presente acto administrativo. En cuyo caso, el respectivo ente territorial podrá \nasumir la titularidad de predios, para lo cual HOCOL S. A. deberá remitir la respectiva escritura \npública debidamente registrada en el folio de matrícula correspondiente en el que se evidencie la \ntransferencia de los predios a alguno de los municipios del área de influencia del proyecto.\nSegunda petición principal. ACLARAR los valores incluidos en los parágrafos primero y segundo del \nartículo segundo de la Resolución 366 del 14 de febrero de 2022, en el sentido de reconocer que se ha \nrealizado inversiones por COP$ 2.565.257.402 con cargo a la obligación de inversión forzosa de no \nmenos del 1%, del Campo Matachines”\n2.\nLOS ARGUMENTOS EXPUESTOS POR LA TITULAR DEL INSTRUMENTO DE MANEJO\n“A. Artículo Primero de la Resolución 366 del 14 de febrero de 2022\nMediante la Resolución 366 del 14 de febrero de 2022 la ANLA modifica “el artículo 16 la Resolución \n353 del 06 de mayo de 1997, en el sentido de aprobar la actualización de la base de liquidación de la \ninversión forzosa de no menos del 1%, en virtud de lo señalado en el parágrafo primero del artículo 321 \nde la Ley 1955 del 25 de mayo del 2019, presentado por la Sociedad Hocol S.A, para el proyecto \n“Campos Matachín Norte y Matachín Sur”, localizado en el municipio de Purificación en el Departamento \ndel Tolima, de conformidad con lo expuesto en la parte motiva del presente acto administrativo.” \nLlama la atención que la Resolución 353 de mayo de 1997 otorgó licencia ambiental Ordinaria \núnicamente para la perforación del pozo exploratorio Venganza-3, por lo cual se solicita a la ANLA \naclarar si esta modificación (Resolución 366 del 14 de febrero de 2022) también aplica para las demás \nactividades del campo de desarrollo Matachín Norte y Sur,\nB. Parágrafo Primero y Segundo del artículo Segundo de la Resolución 366 del 14 de febrero de \n2022 \nHOCOL S.A mediante radicado ANLA 2021133493-1-000 del 30 de junio de 2021 presentó el Informe \nde Cumplimiento Ambiental - ICA No. 19 correspondiente a las actividades desarrolladas en el periodo \ncomprendido de enero a diciembre de 2020 en el proyecto “Campo de desarrollo Matachín Norte y Sur”. \nMunicipio de Purificación – Tolima. Exp. LAM1248., a su vez presentó ajuste al Informe de Cumplimiento \nAmbiental - ICA No. 19 del mediante radicado 2021192846-1-000 del 08 de septiembre de 2021, \nincluyendo el numeral 7.2 (página 130- 132), donde se da repuesta a la obligación No 11 de acta de \ncontrol y seguimiento ambiental 186 del 21 de mayo de 2021 la cual solicita lo siguiente: \nActa Oralidad 186/2021: Requerimiento 11. Presentar el balance actualizado y demás soportes \ncontables y financieros que permitan verificar el aporte de cada una de las partes para la \nejecución de la ampliación de la PTAR del municipio de Purificación. En cumplimiento del artículo \ntercero del Auto 4933 del 29 de mayo de 2020. \nEn respuesta a este requerimiento HOCOL, sustentó lo siguiente:\n“El proyecto ampliación de la PTAR del municipio de Purificación se llevó a cabo con los aportes \nde recursos de la inversión del 1% en cabeza del entonces titular de la licencia ambiental, \n\nResolución No.  01568           Del   21 de julio de 2022            Hoja No. 9 de 18\n“POR LA CUAL SE RESUELVE UN RECURSO DE REPOSICIÓN Y SE TOMAN OTRAS DETERMINACIONES”\nOficinas: Carrera 13 A No. 34 – 72 Edificio 13 35 Pisos 8 al 11 Bogotá, D.C.\nCentro de Orientación y Radicación de Correspondencia: Carrera 13 A No. 34 – 72 Edificio 13 35 \nLocales 110 al 112 Bogotá, D.C.  \nCódigo Postal 110311156\nNit.: 900.467.239-2\nLínea de Orientación y Contacto Ciudadano: 57 (1) 2540100 / 018000112998 PBX: 57 (1) 2540111\nwww.anla.gov.co    Email: licencias@anla.gov.co  \nPágina 9 de 18\nPERENCO OIL & GAS COLOMBIA LIMITED y la Alcaldía del Municipio de Purificación, Tolima \nde la siguiente manera: $ 1.136.732.360 invertidos con los recursos provenientes de la inversión \ndel 1% del expediente LAM 1428, por el expediente del campo Purificación LAM0093 se \naportaron $ 358 .421.050 y por el Expediente 457 proyecto Líneas de flujo $ 296.951.840 para \nun total de $ 1.792.105.250 como lo evidencia los soportes pago de los giros realizado por \nPERENCO a la empresa PURIFICA en el marco del Convenio 038 de 2015.\n(…)\nEn el anexo 18/Acta 186/Requerimiento 11/ se incluye un balance actualizado con los soportes \ncontables y financieros que permitan verificar el aporte por parte de PERENCO OIL & GAS \nCOLOMBIA LIMITED en proyecto de la ampliación de la PTAR del municipio de Purificación.\n(…)\nAdicional se incluye copia del Convenio 038 de 2015, suscrito entre PERENCO OILD AND GAS \nY PURIFICA. E.S P cuyo objeto es apoyara el desarrollo del proyecto “Ampliación Planta de \nTratamiento de aguas Residuales PTARD, Barrio Camilo Totes- Purificación –Tolima”, de igual \nmanera se adjunta informes de avances de la ejecución del convenio y copia del acta de recibo \nfinal de la obra” \nPor otra parte mediante radicado 2021263391-1-000 del 03/12/2021, se presentó respuesta al \nrequerimiento No. 18 Literal B, del Acta de Control y Seguimiento Ambiental # 186 del 21 mayo de 2021- \nProyecto “Campo de Desarrollo Matachín Norte y Sur”. Municipio de Purificación – Tolima. Expediente. \nLAM1248.; presentando lo siguiente:\n(…)\nA continuación Hocol presenta la Tabla 1, la cual describe los valores efectivamente ejecutados \ncon cargo a la inversión forzosa de no menos del 1%, para los predios Paraguay y El Canelo, \nrelacionando en cada fila los respectivos soportes de pago los cuales se incluyen en el anexo 18 \nde la presente respuesta. \nHasta el momento se tiene un valor efectivamente ejecutado con cargo a la inversión forzosa de \nno menos del 1% de $ 1.428.525.142 para la compra de los predios Paraguay y El Canelo.\n(…)\nComo bien se puede apreciar, HOCOL si realizó inversiones con cargo a la inversión forzosa de no \nmenos del 1% del Campo Matachín Norte y Sur, según soportes financieros que muestran  ejecuciones \nen los años 2015, 2016 y 2018 para la ampliación de la PTAR del Barrio Camilo Torres (ver radicado \n2021192846-1-000 del 08 de septiembre de 2021); así mismo, se ejecutaron otros recursos de inversión \ndel 1% en el año 2020 para la adquisición del predio Paraguay y El Canelo (ver radicado 2021263391-\n1-000 del 03/12/2021). \nPor esta situación solicitamos se valoren los soportes allegados con el fin de aclarar lo dispuesto en los \nparágrafos primero y segundo del artículo segundo de la Resolución 366 del 14 de febrero de 2022, ya \nque sí se presentaron informes de ejecución y esto demuestra que existe contrariedad entre los actos \nadministrativos emitidos por la ANLA con los valores ejecutados a la fecha. \nDe manera que carece de debida motivación el acto administrativo al desconocer que se han realizado \ninversiones por valor de COP$ 2.565.257.402, lo cual se ha hecho con cargo a la obligación de inversión \nforzosa de no menos del 1%, de manera que se requiere que la ANLA reconozca dicha inversión, y por \nlo mismo, realice las aclaraciones y modificaciones del acto administrativo objeto del presente recurso \nde reposición, so pena de que esté gestando una nulidad del acto administrativo.”\n\nResolución No.  01568           Del   21 de julio de 2022            Hoja No. 10 de 18\n“POR LA CUAL SE RESUELVE UN RECURSO DE REPOSICIÓN Y SE TOMAN OTRAS DETERMINACIONES”\nOficinas: Carrera 13 A No. 34 – 72 Edificio 13 35 Pisos 8 al 11 Bogotá, D.C.\nCentro de Orientación y Radicación de Correspondencia: Carrera 13 A No. 34 – 72 Edificio 13 35 \nLocales 110 al 112 Bogotá, D.C.  \nCódigo Postal 110311156\nNit.: 900.467.239-2\nLínea de Orientación y Contacto Ciudadano: 57 (1) 2540100 / 018000112998 PBX: 57 (1) 2540111\nwww.anla.gov.co    Email: licencias@anla.gov.co  \nPágina 10 de 18\nC.\nCONSIDERACIONES DE LA AUTORIDAD NACIONAL DE LICENCIAS AMBIENTALES CON \nRELACION A LAS OBLIGACIONES RECURIDAS\nCon relación a este literal, en el concepto técnico 3209 del 08 de junio del 2022 se indicaron las \nsiguientes consideraciones:\n1.\nOBLIGACIÓN RECURRIDA - ARTÍCULO PRIMERO\n“Verificado el argumento presentado por la Sociedad, es importante precisar que en el concepto técnico \n2770 del 21 de mayo de 2021, se acepta la liquidación parcial de la inversión forzosa de no menos del \n1% a costo histórico, la cual corresponde a los valores certificados que la Sociedad ha invertido en cada \nperiodo para la ejecución del proyecto.\nDichos periodos corresponden a los años 1994 a 2012 y 2017 a 2020, sin llevar a cabo la actualización \na valor presente que para el caso específico correspondería al Parágrafo Primero del artículo 321 de la \nLey 1955 del 25 de mayo de 2019. Adicionalmente, se indica en los resultados del citado concepto \ntécnico que el monto aceptado no incluye el incremento por la actualización de que trata el Parágrafo \nPrimero del Artículo 321 de la Ley 1955 de 2019.\n(…)\nAdemás, al verificar lo señalado en el artículo primero de la Resolución 366 del 14 de febrero de 2022, \nse encuentra que lo resuelto en dicho acto administrativo difiere de lo conceptuado en el numeral 9.1. \ndel concepto técnico 2770 del 21 de mayo de 2021, dado que en la Resolución se modifica el artículo \n16 la Resolución 353 del 06 de mayo de 1997, en el sentido de aprobar la actualización de la base de \nliquidación de la inversión forzosa de no menos del 1%, en virtud de lo señalado en el parágrafo primero \ndel artículo 321 de la Ley 1955 del 25 de mayo del 2019, pero el concepto técnico acepta la liquidación \nparcial de la inversión forzosa de no menos del 1%, sin incluir el incremento por la actualización del \nParágrafo Primero del artículo 321 de la Ley 1955 de 2019.\nAdicionalmente se aclara frente a la modificación del artículo décimo sexto la Resolución 353 del 06 de \nmayo de 1997, resuelta en el artículo primero de la Resolución 366 del 14 de febrero de 2022, este se \nmantiene vigente toda vez que corresponde a la obligación global de la inversión forzosa de no menos \ndel 1% para el Pozo Exploratorio Venganza-3.\nAhora, frente a la solicitud de aclarar si la modificación (Resolución 366 del 14 de febrero de 2022) \ntambién aplica para las demás actividades del campo de desarrollo Matachín Norte y Sur, autorizadas \nmediante la Resolución 041 del de 9 de enero de 1996 y sus modificatorias, se presentan las siguientes \nconsideraciones:\nPara empezar, es necesario mencionar que la Resolución 353 de 6 de mayo de 1997 en su artículo \nDécimo Sexto menciona lo siguiente:\nARTICULO DECIMO SEXTO-, La Empresa Laísmo OIL (Colombia) LIMITED. Deberá invertir no \nmenos del uno por ciento del costo total del proyecto en actividades de recuperación, \npreservación, y vigilancia de la cuenca hidrográfica de la Quebrada “El tigre”, para lo cual \npresentará a este Ministerio, en un plazo no mayor a tres meses, un plan de inversiones con su \nrespectivo cronograma de actividades, en el que se especifique cuál de las siguientes actividades \ndesarrollará: reforestación, obras de control de erosión y recuperación de suelos, actividades de \nmanejo de zonas de bosque en proceso de regeneración, corrección de torrentes etc. Estas \nactividades o planes en los que se resuelva realizar la inversión deben ser avalada por la \nCorporación Autónoma Regional del Tolima (CORTOLIMA). (Artículo 43 de ley 99 de 1.993).\nAdemás, se aclara que en la Resolución 353 del 06 de mayo de 1997, el Ministerio del Medio Ambiente \notorga Licencia Ambiental Ordinaria a LASMO OIL (Colombia) LTD, para la Perforación del Pozo \nExploratorio Venganza-3, ubicado en jurisdicción del municipio de Purificación en el Departamento del \nTolima y en el artículo Décimo Sexto cita la totalidad del proyecto mas no de las actividades específicas \nque se autorizan dentro del mismo acto administrativo. Al verificar la información certificada por la \n\nResolución No.  01568           Del   21 de julio de 2022            Hoja No. 11 de 18\n“POR LA CUAL SE RESUELVE UN RECURSO DE REPOSICIÓN Y SE TOMAN OTRAS DETERMINACIONES”\nOficinas: Carrera 13 A No. 34 – 72 Edificio 13 35 Pisos 8 al 11 Bogotá, D.C.\nCentro de Orientación y Radicación de Correspondencia: Carrera 13 A No. 34 – 72 Edificio 13 35 \nLocales 110 al 112 Bogotá, D.C.  \nCódigo Postal 110311156\nNit.: 900.467.239-2\nLínea de Orientación y Contacto Ciudadano: 57 (1) 2540100 / 018000112998 PBX: 57 (1) 2540111\nwww.anla.gov.co    Email: licencias@anla.gov.co  \nPágina 11 de 18\nSociedad y analizada en el concepto técnico 2770 del 31 de mayo de 2021, en la cual se acepta la \nliquidación parcial de la inversión forzosa de no menos del 1% a costo histórico, esta aceptación del \nvalor base de liquidación corresponde a las siguientes actividades:\nActividades presentadas por HOCOL S.A. para la liquidación de la base de liquidación de la Inversión Forzosa de \nno menos del 1%\nPOZOS INCLUIDOS - MATACHÍN NORTE - 1994 a 2012\nCERTIFICADOS REVISOR FISCAL\nPLATAFORMA\nPOZOS\nPozos perforados desde 1994 a 2001.\nVenganza: H, G, J, I.\nEstación Matachín Norte.\nVEN-03, VEN-04H, VEN-06H, VEN-08H, VEN-05H, VEN-\n09H, VEN-12H\nPozos perforados desde 2002 a 2010.\nVenganza: F, E, D.\nMON-001, VEN-10, VEN-07, VEN-11, VEN-14, VEN-15, \nVEN-16, VEN-17, VEN-18, VEN-19, VEN-20, VEN-21, \nVEN-23, VEN-25.\nPozos perforados en el 2011.\nRevancha: C.\nVenganza: E, I.\nVEN-22, VEN-26, VEN-27\nVEN-29, VEN-30, VEN-33, VEN-38\nPozos perforados en el 2012.\nVenganza: N, J, I.\nRevancha: C.\nVEN-34H, VEN-35, VEN-36, VEN-37, VEN-39, VEN-40, \nVEN-59\nTotal\n35\nPOZOS INCLUIDOS - MATACHÍN SUR – 1994 a 2012\nPozos perforados desde 1994 a 2001.\nEstación Matachín Sur.\nRevancha: B, A\nREV-01, REV-02, REV-03, REV-4H, REV-5, REV-7H\nPozos perforados desde 2002 a 2010.\nRevancha A\nREV-9\nPozos perforados en el 2011.\nEstación Matachín Sur\nRevancha B\nREV-6, REV-11, REV-8\nPozos perforados en el 2012.\nRevancha A\nEstación Matachín Sur\nREV-10, REV-14\nREV-12\nTotal\n13\nPOZOS INCLUIDOS - MATACHÍN NORTE – 2015 a 2018\nPozos perforados de 2015 a 2018.\nRevancha C\nVEN-41H, pozo 45, pozo 31\nTotal\n3\nFuente: Comunicación con Radicado 2020079396-1-000 del 21 de mayo de 2020\nAhora bien, teniendo en cuenta que esta autoridad nacional considera no modificar el artículo Décimo \nSexto de la Resolución 353 de 6 de mayo de 1997, dado que esta modificación no fue considerada en \nel concepto técnico 2770 del 2021 y que la liquidación parcial de la inversión forzosa de no menos del \n1% a costo histórico aceptada, corresponde al anexo detallado presentado por la Sociedad con las \ninversiones del periodo analizado por los pozos perforados en el proyecto los cuales fueron identificados \na partir de las fechas de perforación de cada uno de ellos y aclarándose por parte de la Sociedad que \n“HOCOL no ejecutó actividades en el Campo durante el periodo requerido en éste numeral (1994 a \n2012)”, es sobre estas actividades referenciadas y analizadas que se reitera, se aceptó la liquidación \nparcial de la inversión forzosa de no menos del 1% a costo histórico, sin incluir el incremento por la \nactualización de que trata el Parágrafo Primero del Artículo 321 de la Ley 1955 de 2019.\nPor lo cual es de recordar que quien determina si estas actividades corresponden a la totalidad de las \nactividades del campo de desarrollo Matachín Norte y Sur, autorizadas mediante la Resolución 041 del \nde 9 de enero de 1996 y/o demás modificaciones posteriores, es el titular del instrumento y esta \nAutoridad Nacional verifica la información presentada.\nTeniendo en cuenta las consideraciones realizadas se considera reponer en sentido de dejar sin efecto \nel artículo primero de la Resolución 366 del 14 de febrero de 2022.\nAdicionalmente, la Sociedad propone modificar el artículo primero de la siguiente manera:\nARTÍCULO PRIMERO. Modificar el artículo 16 la Resolución 353 del 06 de mayo de 1997, y \ndemás actos administrativos concordantes, en el sentido de aprobar la actualización de la base \nde liquidación de la inversión forzosa de no menos del 1%, en virtud de lo señalado en el \nparágrafo primero del artículo 321 de la Ley 1955 del 25 de mayo del 2019, presentado por la \nSociedad Hocol S.A, para el proyecto “Campos Matachín Norte y Matachín Sur”, localizado en el \nmunicipio de Purificación en el Departamento del Tolima, de conformidad con lo expuesto en la \nparte motiva del presente acto administrativo. En cuyo caso, el respectivo ente territorial podrá \nasumir la titularidad de predios, para lo cual HOCOL S. A. deberá remitir la respectiva escritura \npública debidamente registrada en el folio de matrícula correspondiente en el que se evidencie la \ntransferencia de los predios a alguno de los municipios del área de influencia del proyecto.\n\nResolución No.  01568           Del   21 de julio de 2022            Hoja No. 12 de 18\n“POR LA CUAL SE RESUELVE UN RECURSO DE REPOSICIÓN Y SE TOMAN OTRAS DETERMINACIONES”\nOficinas: Carrera 13 A No. 34 – 72 Edificio 13 35 Pisos 8 al 11 Bogotá, D.C.\nCentro de Orientación y Radicación de Correspondencia: Carrera 13 A No. 34 – 72 Edificio 13 35 \nLocales 110 al 112 Bogotá, D.C.  \nCódigo Postal 110311156\nNit.: 900.467.239-2\nLínea de Orientación y Contacto Ciudadano: 57 (1) 2540100 / 018000112998 PBX: 57 (1) 2540111\nwww.anla.gov.co    Email: licencias@anla.gov.co  \nPágina 12 de 18\nAl respecto, esta Autoridad no encontró los argumentos expuestos por parte de la Sociedad para \nconsiderar la solicitud.\nTeniendo en cuenta lo analizado anteriormente, se recomienda mantener vigente el articulo décimo sexto \nde la Resolución 353 de 6 de mayo de 1997 hasta el cumplimiento del 100% de la inversión forzosa de \nno menos del 1% y no considerar la aprobación de la actualización de la base de liquidación de la \ninversión forzosa de no menos del 1%, en virtud de lo señalado en el parágrafo primero del artículo 321 \nde la Ley 1955 del 25 de mayo del 2019, debido a que las decisiones adoptadas en el acto administrativo \nobjeto de recurso no concuerdan con las consideraciones efectuadas en el Concepto Técnico 2770 del \n21 de mayo de 2021 ya que no está soportada la motivación jurídica para modificar el artículo décimo \nsexto de la Resolución 353 de 1997 y para la aprobación de la actualización de la base de liquidación \nde la inversión forzosa de no menos del 1%,. Por lo anterior, se recomienda reponer en el sentido de \ndejar sin efecto el artículo primero de la Resolución 366 del 14 de febrero de 2022.”\n2.\nOBLIGACIÓN RECURRIDA - ARTICULO SEGUNDO, PARÁGRAFO PRIMERO Y \nSEGUNDO\n“Respecto a los argumentos presentados por la Sociedad frente a la petición de “Aclarar los valores \nincluidos en los parágrafos primero y segundo del artículo segundo de la   Resolución 366 del 14 de \nfebrero de 2022, en el sentido de reconocer que se ha realizado inversiones por COP$ 2.565.257.402 \ncon cargo a la obligación de inversión forzosa de no menos del 1%, del Campo Matachines.” Es \nnecesario precisar que La Autoridad Nacional de Licencias Ambientales – ANLA, adelantó la evaluación \nde la información presentada por la sociedad Hocol S.A. mediante las siguientes comunicaciones:\n-\nRadicado 2019203708- 1-000 del 24 de diciembre de 2019, donde solicitó acogimiento al \nartículo 321 de la Ley 1955 del 25 de mayo de 2019.\n-\n Radicado 2020079396-1-000 del 21 de mayo de 2020.\n-\nRadicado 2020048832-1-000 del 30 de marzo de 2020.\n-\nRadicado 2020088828-1-000 del 5 de junio de 2020.\n-\nRadicado 2020114415-1-000 del 16 de julio de 2020.\n-\nRadicado 2021055731-1- 000 del 29 de marzo de 2021\nDonde se informó las inversiones base de liquidación de la inversión forzosa de no menos del 1% \nmediante certificados firmados por revisor fiscal y documento equivalente firmado por el Representante \nLegal, y se presentaron soportes relacionados con la inversión forzosa de no menos del 1%, lo cual fue \nanalizado y considerado en el Concepto Técnico 2770 del 21 de mayo del 2021, cuyo alcance \ncorrespondió a la verificación de los aspectos ambientales y sociales referentes al proyecto “Campos \nMatachín Norte y Matachín Sur” en su fase de Operación, durante el periodo comprendido entre el 01 \nde julio al 31 de diciembre de 2018, y entre 01 de enero al 31 de diciembre de 2019 correspondientes a \nlos Informes de Cumplimiento Ambiental - ICA 17 y 18, lo observado en la visita de seguimiento realizada\npor el Equipo de Seguimiento Ambiental – ESA de la ANLA entre los días 23 al 26 de marzo de 2021 y \nla información documental que se encuentra en el expediente del 15 de mayo de 2019 al 16 de abril de \n2021 y el cual fue acogido mediante Acta de Reunión No. 186 del 21 de mayo de 2021, donde se \nsolicitaron requerimientos a HOCOL S.A. entre otros temas de la Inversión Forzosa de no menos del \n1%.\nCabe aclarar que mediante el artículo segundo de la Resolución 366 del 14 de febrero de 2022, se \naceptó a la sociedad HOCOL S.A. el valor base de liquidación parcial de la inversión forzosa de no \nmenos del 1% a costo histórico, para el proyecto “Campos Matachín Norte y Matachín Sur”, la suma de \ncuatrocientos sesenta y cinco mil ciento cuarenta y cuatro millones cuatrocientos noventa y ocho mil \ntrescientos treinta y nueve pesos colombianos ($465.144.498.339,00), para los períodos comprendidos \nentre los años 1994 a 2012 y 2017 a 2020.\nSin embargo, al verificar la información consignada en el concepto técnico 2770 del 21 de mayo de 2021 \nel acto administrativo (Resolución 366 del 14 de febrero de 2022) difiere de lo considerado en el citado \nconcepto técnico ya que en este se considera “ACEPTAR la liquidación parcial de la inversión forzosa \nde no menos del 1% a costo histórico, que corresponde a la suma de CUATRO MIL SEISCIENTOS \nCINCUENTA Y UN MILLONES CUATROCIENTOS CUARENTA Y CUATRO MIL NOVESCIENTOS \nOCHENTA Y TRES PESOS CON TREINTA Y NUEVE CENTAVOS ($4.651.444.983,39), liquidado \n\nResolución No.  01568           Del   21 de julio de 2022            Hoja No. 13 de 18\n“POR LA CUAL SE RESUELVE UN RECURSO DE REPOSICIÓN Y SE TOMAN OTRAS DETERMINACIONES”\nOficinas: Carrera 13 A No. 34 – 72 Edificio 13 35 Pisos 8 al 11 Bogotá, D.C.\nCentro de Orientación y Radicación de Correspondencia: Carrera 13 A No. 34 – 72 Edificio 13 35 \nLocales 110 al 112 Bogotá, D.C.  \nCódigo Postal 110311156\nNit.: 900.467.239-2\nLínea de Orientación y Contacto Ciudadano: 57 (1) 2540100 / 018000112998 PBX: 57 (1) 2540111\nwww.anla.gov.co    Email: licencias@anla.gov.co  \nPágina 13 de 18\nsobre la base de liquidación que asciende a la suma de CUATROSCIENTOS SESENTA Y CINCO MIL \nCIENTO CUARENTA Y CUATRO MILLONES CUATROCIENTOS NOVENTA Y OCHO MIL \nTRESCIENTOS TREINTA Y NUEVE PESOS MCTE. ($465.144.498.339,00), para el período \ncomprendido entre 1994 a 2012 y 2017 a 2020. El monto anterior no incluye el incremento por la \nactualización de que trata el Parágrafo Primero del Artículo 321 de la Ley 1955 de 2019.\nAhora bien, en el artículo segundo de la citada Resolución se acepta la liquidación parcial de la inversión \nforzosa de no menos del 1% a costo histórico, y no se señala lo considerado frente a que dicho monto \nno incluye el incremento por la actualización de que trata el Parágrafo Primero del Artículo 321 de la Ley \n1955 de 2019, por lo que se recomienda modificar el artículo segundo de la Resolución 366 del 14 de \nfebrero de 2022, el cual quedara de la siguiente manera:\nARTÍCULO SEGUNDO. ACEPTAR la liquidación parcial de la inversión forzosa de no menos del \n1% a costo histórico, que corresponde a la suma de CUATRO MIL SEISCIENTOS CINCUENTA \nY UN MILLONES CUATROCIENTOS CUARENTA Y CUATRO MIL NOVESCIENTOS OCHENTA \nY TRES PESOS CON TREINTA Y NUEVE CENTAVOS ($4.651.444.983,39), liquidado sobre la \nbase de liquidación que asciende a la suma de CUATROSCIENTOS SESENTA Y CINCO MIL \nCIENTO CUARENTA Y CUATRO MILLONES CUATROCIENTOS NOVENTA Y OCHO MIL \nTRESCIENTOS TREINTA Y NUEVE PESOS MCTE. ($465.144.498.339,00), para el período \ncomprendido entre 1994 a 2012 y 2017 a 2020. El monto anterior no incluye el incremento por la \nactualización de que trata el Parágrafo Primero del Artículo 321 de la Ley 1955 de 2019, para el \nproyecto “Campos Matachín Norte y Matachín Sur”, localizado en el municipio de Purificación en \nel Departamento del Tolima.\nPor otro lado, el monto base corresponde a los pozos relacionados por la Sociedad mediante el radicado \n2019203708-1-000 del 24 de diciembre de 2019 y en el radicado 2020079396- 1-000 del 21 de mayo de \n2020. Los cuales se relacionan a continuación:\n(…)\nAhora bien, de acuerdo con la Resolución 366 del 14 de febrero de 2022, en el artículo tercero se acepta \ncomo ejecutado con cargo al Plan de Inversión del 1%, la suma de ciento veinte millones doscientos \nsetenta y cuatro mil novecientos cuarenta y cinco mil pesos mcte. ($120.274.945), monto que \ncorresponde a la adquisición del inmueble denominado “Paraguay”, ubicado en el municipio de \nPurificación en el Departamento de Tolima.\n(…)\nAdicionalmente, al verificar en los resultados del concepto técnico 2770 del 21 de mayo del 2021 y el \nresuelve de la Resolución 366 del 14 de febrero de 2022, se observa un error de digitación en el \nParágrafo Primero del artículo segundo de la Resolución 366 del 14 de febrero de 2022, ya que se \npresenta una contradicción en relación con lo citado en el Artículo Tercero del citado acto administrativo. \nPor lo anterior se considera reponer en sentido de dejar sin efecto el parágrafo primero del artículo \nsegundo de la Resolución 366 del 14 de febrero de 2022, teniendo en cuenta que en el artículo tercero \nde la citada Resolución se acepta como ejecutado con cargo al Plan de Inversión forzosa de no menos\ndel 1% la suma de ciento veinte millones doscientos setenta y cuatro mil novecientos cuarenta y cinco \nmil pesos mcte. ($120.274.945) PESOS MCTE.\nPor otro lado, en relación con la petición de “reconocer que se ha realizado inversiones por COP$ \n2.565.257.402 con cargo a la obligación de inversión forzosa de no menos del 1%, del Campo \nMatachines.”, es de precisar que en el concepto técnico 2770 del 21 de mayo del 2021, acogido mediante \nla Resolución 366 del 14 de febrero de 2022, se indica frente a los valores en ejecución lo siguiente:\n(…)\nAl verificar lo anterior, se identifica en la parte considerativa del citado acto administrativo montos en \nejecución correspondientes a: La ampliación de la planta de tratamiento de aguas residuales PTARD del \nBarrio Camilo Torres, compra de predios el Canelo y parte del predio el Paraguay, como se indica en la \nsiguiente tabla:\n\nResolución No.  01568           Del   21 de julio de 2022            Hoja No. 14 de 18\n“POR LA CUAL SE RESUELVE UN RECURSO DE REPOSICIÓN Y SE TOMAN OTRAS DETERMINACIONES”\nOficinas: Carrera 13 A No. 34 – 72 Edificio 13 35 Pisos 8 al 11 Bogotá, D.C.\nCentro de Orientación y Radicación de Correspondencia: Carrera 13 A No. 34 – 72 Edificio 13 35 \nLocales 110 al 112 Bogotá, D.C.  \nCódigo Postal 110311156\nNit.: 900.467.239-2\nLínea de Orientación y Contacto Ciudadano: 57 (1) 2540100 / 018000112998 PBX: 57 (1) 2540111\nwww.anla.gov.co    Email: licencias@anla.gov.co  \nPágina 14 de 18\n(…)\nSin embargo, en los resultados del concepto técnico 2770 del 21 de mayo del 2021, no se relacionan \nmontos aprobados en ejecución o señalados con valor cero ($0), hasta tanto la Sociedad no presente \nlos respectivos soportes, por lo cual se observa un error de digitación en el Parágrafo Segundo del \nartículo segundo de la Resolución 366 del 14 de febrero de 2022, por lo cual se considera pertinente \nreponer en el sentido de dejar sin efecto el citado parágrafo.\nPor otro lado, la información que argumenta la Sociedad en el recurso de reposición corresponde a los \nradicados ANLA 2021133493-1-000 del 30 de junio de 2021, en el que se presenta el Informe de \nCumplimiento Ambiental - ICA No. 19 para el periodo comprendido de enero a diciembre de 2020, la \ncomunicación con radicado 2021192846-1- 000 del 08 de septiembre de 2021 en el cual se realiza \najustes al ICA 19 y el radicado ANLA 2021263391-1-000 del 03 de diciembre de 2021, en el cual presentó \nrespuesta a los requerimientos del Acta 186 del 21 de mayo de 2021, como se observa de forma general \na continuación:\n(…)\nEsta información fue radicada posterior a la fecha de corte documental del seguimiento acogido mediante \nActa 186 del 21 de mayo de 2021, razón por la cual no fue considerada en el concepto técnico 02770 \ndel 21 de mayo de 2021 que es acogido por la Resolución 366 del 14 de febrero de 2022, como se indica \nen la hoja 4 de la citada Resolución:\n(…)\nSin embargo, es importante mencionar que la información presentada el 30 de junio, 08 de septiembre \ny 3 de diciembre de 2021, es objeto de verificación y es considerada en la presente vigencia (año 2022), \nen la cual el equipo regional Alto Magdalena, se encuentra evaluando.\nPor lo cual, una vez sea verificada y analizada la información citada en el argumento del recurso de \nreposición presentado bajo la comunicación con radicado 2022032343-1-000 del 24 de febrero de 2022, \nse realizarán las consideraciones a las que haya lugar en el respectivo concepto técnico que será \nposteriormente acogido mediante acto administrativo.\nDe lo anterior, se considera pertinente reponer en el sentido de Modificar el artículo segundo de la \nResolución 366 del 14 de febrero de 2022, el cual quedara de la siguiente manera:\nARTÍCULO SEGUNDO. ACEPTAR la liquidación parcial de la inversión forzosa de no menos del \n1% a costo histórico, que corresponde a la suma de CUATRO MIL SEISCIENTOS CINCUENTA \nY UN MILLONES CUATROCIENTOS CUARENTA Y CUATRO MIL NOVESCIENTOS OCHENTA \nY TRES PESOS CON TREINTA Y NUEVE CENTAVOS ($4.651.444.983,39), liquidado sobre la \nbase de liquidación que asciende a la suma de CUATROSCIENTOS SESENTA Y CINCO MIL \nCIENTO CUARENTA Y CUATRO MILLONES CUATROCIENTOS NOVENTA Y OCHO MIL \nTRESCIENTOS TREINTA Y NUEVE PESOS MCTE. ($465.144.498.339,00), para el período \ncomprendido entre 1994 a 2012 y 2017 a 2020. El monto anterior no incluye el incremento por la \nactualización de que trata el Parágrafo Primero del Artículo 321 de la Ley 1955 de 2019, para el \nproyecto “Campos Matachín Norte y Matachín Sur”, localizado en el municipio de Purificación en \nel Departamento del Tolima.\nAsí como; reponer en el sentido de dejar sin efectos los parágrafos primero y segundo del artículo \nsegundo de la Resolución 366 del 14 de febrero de 2022.”\nCONSIDERACIONES JURÍDICAS\nComo ha sido señalado a lo largo de este recurso, esta Autoridad Nacional desarrolló el estudio y la \nevaluación de lo pretendido por la titular del instrumento de manejo y control, y como primera medida \nse permite señalar que todas las decisiones que adopten las autoridades administrativas deben ser \nprecedidas de legalidad, y proporcionalidad respecto al TIEMPO y el MODO, ya que estas solo \npersiguen garantizar una coherencia y reciprocidad entre la práctica y lo sustancial.\n\nResolución No.  01568           Del   21 de julio de 2022            Hoja No. 15 de 18\n“POR LA CUAL SE RESUELVE UN RECURSO DE REPOSICIÓN Y SE TOMAN OTRAS DETERMINACIONES”\nOficinas: Carrera 13 A No. 34 – 72 Edificio 13 35 Pisos 8 al 11 Bogotá, D.C.\nCentro de Orientación y Radicación de Correspondencia: Carrera 13 A No. 34 – 72 Edificio 13 35 \nLocales 110 al 112 Bogotá, D.C.  \nCódigo Postal 110311156\nNit.: 900.467.239-2\nLínea de Orientación y Contacto Ciudadano: 57 (1) 2540100 / 018000112998 PBX: 57 (1) 2540111\nwww.anla.gov.co    Email: licencias@anla.gov.co  \nPágina 15 de 18\nEn consideración a esta premisa, y una vez efectuada la interpretación de lo señalado en el artículo \nprimero, y parágrafo primero y segundo del artículo segundo de la Resolución 366 del 14 de febrero \ndel 2022, podemos concluir que lo allí señalado dista de la realidad, ya que la sociedad HOCOL S.A. \ndurante el desarrollo y ejecución de este proyecto, no acreditó el cumplimiento de los requisitos legales \nexigidos para obtener la aprobación de la actualización de la base de liquidación de la inversión forzosa \nde no menos del 1%.\nDe otro lado, la titular del instrumento de manejo y control ambiental logró demostrarle a esta Autoridad \nNacional el desarrollo de obras y/o actividades, esto último en cumplimiento del plan de inversión \nseñalado; ahora bien, los hechos y consideraciones técnicas con relación a estas obras y actividades \nestán señalados en el concepto técnico 2770 del 21 de mayo de 2021, de la siguiente forma:\n“\n(…)\nACEPTAR como ejecutado con cargo al Plan de Inversión del 1%, la suma de CIENTO VEINTE MILLONES \nDOSCIENTOS SETENTA Y CUATRO MIL NOVESCIENTOS CUARENTA Y CINCO MIL PESOS MCTE. \n($120.274.945), monto que corresponde a la adquisición del predio, denominado Paraguay, ubicado en el municipio \nde Purificación Departamento de Tolima. \nDetalle\nValor\nConcepto\nAdquisición Predio Paraguay. (20,6 \nha) ubicado en el municipio de \nPurificación- Tolima.\n$119.084.145\nVr. Adquisición soportada con E.P. 1012 del 15-\n11-2018\nImpuesto de Registro\n$1.190.800\nBoleta fiscal, que soporta el pago del impuesto \nde registro por la adquisición del predio.\nTotal Soportado Financieramente.\n$120.274.945\nValor Viable de aceptar en el presente \nconcepto.\n(…)\nMontos de inversión que no fueron señalados dentro de la parte resolutiva de la Resolución 366 del \n14 de febrero de 2022, pero que en la parte resolutiva de este acto administrativo se subsana y se \nconsidera este valor bajo la modalidad de monto de inversión en cumplimiento del Plan de inversión \nde menos del 1%\nEn consideración de lo anterior, es pertinente señalar que las actuaciones administrativas se \ndesarrollarán, especialmente, con arreglo a los principios del debido proceso, igualdad, imparcialidad, \nbuena fe, moralidad, participación, responsabilidad, transparencia, publicidad, coordinación, eficacia, \neconomía y celeridad; en este sentido, los numerales 11, 12, y 13 del artículo 3 del CPACA los define \ntal y como se cita a continuación:\n“Artículo 3°. Principios. Todas las autoridades deberán interpretar y aplicar las disposiciones que regulan \nlas actuaciones y procedimientos administrativos a la luz de los principios consagrados en la Constitución \nPolítica, en la Parte Primera de este Código y en las leyes especiales. \nLas actuaciones administrativas se desarrollarán, especialmente, con arreglo a los principios del debido \nproceso, igualdad, imparcialidad, buena fe, moralidad, participación, responsabilidad, transparencia, \npublicidad, coordinación, eficacia, economía y celeridad.\n(...) \n11. En virtud del principio de eficacia, las autoridades buscarán que los procedimientos logren su \nfinalidad y, para el efecto, removerán de oficio los obstáculos puramente formales, evitarán decisiones \ninhibitorias, dilaciones o retardos y sanearán, de acuerdo con este Código las irregularidades \nprocedimentales que se presenten, en procura de la efectividad del derecho material objeto de la \nactuación administrativa. (Negrilla fuera de texto)\n\nResolución No.  01568           Del   21 de julio de 2022            Hoja No. 16 de 18\n“POR LA CUAL SE RESUELVE UN RECURSO DE REPOSICIÓN Y SE TOMAN OTRAS DETERMINACIONES”\nOficinas: Carrera 13 A No. 34 – 72 Edificio 13 35 Pisos 8 al 11 Bogotá, D.C.\nCentro de Orientación y Radicación de Correspondencia: Carrera 13 A No. 34 – 72 Edificio 13 35 \nLocales 110 al 112 Bogotá, D.C.  \nCódigo Postal 110311156\nNit.: 900.467.239-2\nLínea de Orientación y Contacto Ciudadano: 57 (1) 2540100 / 018000112998 PBX: 57 (1) 2540111\nwww.anla.gov.co    Email: licencias@anla.gov.co  \nPágina 16 de 18\n12. En virtud del principio de economía, las autoridades deberán proceder con austeridad y eficiencia, \noptimizar el uso del tiempo y de los demás recursos, procurando el más alto nivel de calidad en sus \nactuaciones y la protección de los derechos de las personas.\n13. En virtud del principio de celeridad, las autoridades impulsarán oficiosamente los procedimientos, e \nincentivarán el uso de las tecnologías de la información y las comunicaciones, a efectos de que los \nprocedimientos se adelanten con diligencia, dentro de los términos legales y sin dilaciones injustificadas.”\n(...)\nConocido lo anteriormente expresado, esta Autoridad tiene como imperativo evitar que las decisiones \npor ella adoptadas nazcan y se conserven en el tiempo con vicios y conservando situaciones que \ndifieren de la realidad técnica, jurídica, social , entre otras.\nEs por ello, que le asiste a la Autoridad Nacional de Licencias Ambientales la obligación de revisar su \npropio acto, con la finalidad de determinar la pertinencia de la actuación administrativa que configura \nuna situación jurídica diferente al administrado, señalando dentro de cada una de estos tramites las \nsituaciones que no reflejan la realidad del proyecto, y precisando además la pertinencia, conducencia \ne importancia de la definido en cada actuación administrativa.\nQueda definido que el recurso de reposición tiene por propósito que las Autoridades que emiten actos \nadministrativos cuenten con la posibilidad de realizar el control de estos para revisar, modificar o \nrevocar sus propios actos (art 74 ley 1437 de 2011), el cual es facultativo en virtud de lo establecido \nen el artículo 76 y siguientes del CPACA, por lo cual corresponde ultimar que el titular contaba con la \nposibilidad de abstenerse de hacer uso de este.\nEs pertinente resaltar ahora, que finalizado el análisis del recurso incoado por la sociedad HOCOL \nS.A., se concluye que existe disparidad entre las consideraciones técnicas señaladas en el Concepto \ntécnico 2770 del 21 de mayo de 2021 y el acto administrativo recurrido, y debido a ello, se procede en \nla parte resolutiva del presente subsanar dicha irregularidad.\nLa presente actuación administrativa tiene por objeto ajustar una decisión administrativa a las \ncondiciones actuales, reales y condicionadas a lo solicitado durante el desarrollo del proyecto, por lo \ncual se procederá a revocar aquellos artículos y expresiones que sean contrarias a dicha motivación.\nQue, en mérito de lo expuesto,\n \nRESUELVE:\nARTÍCULO PRIMERO. Revocar el artículo primero de la Resolución 366 del 14 de febrero de 2022, \npor medio del cual esta Autoridad Nacional modifico el artículo 16 la Resolución 353 del 06 de mayo \nde 1997, en el sentido de aprobar la actualización de la base de liquidación de la inversión forzosa de \nno menos del 1%, en virtud de lo señalado en el parágrafo primero del artículo 321 de la Ley 1955 del \n25 de mayo del 2019, presentado por la Sociedad Hocol S.A, para el proyecto “Campos Matachín \nNorte y Matachín Sur”, localizado en el municipio de Purificación en el Departamento del Tolima, de \nconformidad con lo expuesto en la parte motiva del presente acto administrativo.\nARTÍCULO SEGUNDO. Reponer en el sentido de revocar el parágrafo primero y parágrafo segundo \ndel artículo segundo de la Resolución 366 del 14 de febrero de 2022, por las razones expuestas en el \npresente acto administrativo, y en consecuencia el artículo segundo de la Resolución 366 del 14 de \nfebrero de 2022, quedará en los siguientes términos: \n“ARTÍCULO SEGUNDO. ACEPTAR la liquidación parcial de la inversión forzosa de no menos del 1% a \ncosto histórico, que corresponde a la suma de CUATRO MIL SEISCIENTOS CINCUENTA Y UN \nMILLONES CUATROCIENTOS CUARENTA Y CUATRO MIL NOVESCIENTOS OCHENTA Y TRES \n\nResolución No.  01568           Del   21 de julio de 2022            Hoja No. 17 de 18\n“POR LA CUAL SE RESUELVE UN RECURSO DE REPOSICIÓN Y SE TOMAN OTRAS DETERMINACIONES”\nOficinas: Carrera 13 A No. 34 – 72 Edificio 13 35 Pisos 8 al 11 Bogotá, D.C.\nCentro de Orientación y Radicación de Correspondencia: Carrera 13 A No. 34 – 72 Edificio 13 35 \nLocales 110 al 112 Bogotá, D.C.  \nCódigo Postal 110311156\nNit.: 900.467.239-2\nLínea de Orientación y Contacto Ciudadano: 57 (1) 2540100 / 018000112998 PBX: 57 (1) 2540111\nwww.anla.gov.co    Email: licencias@anla.gov.co  \nPágina 17 de 18\nPESOS CON TREINTA Y NUEVE CENTAVOS ($4.651.444.983,39), liquidado sobre la base de \nliquidación que asciende a la suma de CUATROSCIENTOS SESENTA Y CINCO MIL CIENTO \nCUARENTA Y CUATRO MILLONES CUATROCIENTOS NOVENTA Y OCHO MIL TRESCIENTOS \nTREINTA Y NUEVE PESOS MCTE. ($465.144.498.339,00), para el período comprendido entre 1994 a \n2012 y 2017 a 2020. El monto anterior no incluye el incremento por la actualización de que trata el \nParágrafo Primero del Artículo 321 de la Ley 1955 de 2019, para el proyecto “Campos Matachín Norte y \nMatachín Sur”, localizado en el municipio de Purificación en el Departamento del Tolima.”\nARTÍCULO TERCERO. Los demás términos, condiciones y obligaciones de la Resolución 366 del 14 \nde febrero del 2022, que no son objeto de revocatoria y modificación expresa en este proveído, se \nmantienen vigentes y son exigibles para el titular del instrumento de manejo ambiental.\nARTÍCULO CUARTO. Por la Autoridad Nacional de Licencias Ambientales ANLA, notificar \npersonalmente o por aviso, cuando a ello hubiere lugar, el contenido del presente acto administrativo \nal representante legal y al apoderado debidamente constituido de la sociedad HOCOL S.A. con NIT. \n860.072.134- 7 conformidad con los artículos 67 y 69 de la ley 1437 de 2011.\nPARÁGRAFO. En el evento en que el titular de la licencia o el permiso, según el caso, sea una persona \nnatural que se acoja al proceso de insolvencia regulado por las normas vigentes, o se trate de una \nsociedad comercial o de una sucursal de sociedad extranjera que entre en proceso de disolución o \nrégimen de insolvencia empresarial o liquidación regulados por las normas vigentes, informará \ninmediatamente de esta situación a esta Autoridad, con fundamento, entre otros, en los artículos 8, \n58, 79, 80, 81, 95 numeral 8 de la Constitución Política de 1991, en la Ley 43 de 1990, en la Ley 222 \nde 1995, en la Ley 1333 de 2009 y demás normas vigentes al y jurisprudencia aplicable. Adicional a \nla obligación de informar a esta Autoridad de tal situación, el titular de la licencia o permiso \naprovisionará contablemente las obligaciones contingentes que se deriven de la existencia de un \nprocedimiento ambiental sancionatorio conforme con el artículo 40 de la ley 1333 de 2009 o la norma \nque la adicione, modifique o derogue.\nARTÍCULO QUINTO. Por la Autoridad Nacional de Licencias Ambientales, comunicar el presente acto \nadministrativo a la Corporación Autónoma Regional del Tolima (Cortolima).\nARTÍCULO SEXTO. Por la Autoridad Nacional de Licencias Ambientales, disponer la publicación del \npresente acto administrativo en la Gaceta Ambiental de esta Entidad.\nARTÍCULO SÉPTIMO. Contra el presente acto administrativo no procede recurso alguno, de \nconformidad con lo establecido en el artículo 87 del Código de Procedimiento Administrativo y de lo \nContencioso Administrativo.\nNOTIFÍQUESE, COMUNÍQUESE, PUBLÍQUESE Y CÚMPLASE\nDada en Bogotá D.C., a los 21 de julio de 2022\nEDILBERTO PEÑARANDA CORREA\nAsesor\n\nResolución No.  01568           Del   21 de julio de 2022            Hoja No. 18 de 18\n“POR LA CUAL SE RESUELVE UN RECURSO DE REPOSICIÓN Y SE TOMAN OTRAS DETERMINACIONES”\nOficinas: Carrera 13 A No. 34 – 72 Edificio 13 35 Pisos 8 al 11 Bogotá, D.C.\nCentro de Orientación y Radicación de Correspondencia: Carrera 13 A No. 34 – 72 Edificio 13 35 \nLocales 110 al 112 Bogotá, D.C.  \nCódigo Postal 110311156\nNit.: 900.467.239-2\nLínea de Orientación y Contacto Ciudadano: 57 (1) 2540100 / 018000112998 PBX: 57 (1) 2540111\nwww.anla.gov.co    Email: licencias@anla.gov.co  \nPágina 18 de 18\nEjecutores\nJUAN GABRIEL PABON OLARTE\nAbogado\n \n \nRevisor / L\u0000der\nJUAN JOSE GRAJALES BLANCO\nContratista\n \n \nExpediente No. \nLAM1248\nConcepto Técnico N° 3209 del 8 de junio del 2022\nFecha:\nJulio del 2022\nProceso No.: 2022151626\nArchívese en: LAM1248   \nPlantilla_Resolución_SILA_v3_42852\nNota: Este es un documento electrónico generado desde los Sistemas de Información de la ANLA. El original reposa en los archivos digitales de la \nEntidad.\n"
}