{
  "fuente": "ANLA_GACETA",
  "numero_resolución": "RESOLUCIÓN N° 001893",
  "fecha_resolución": "1993-12-22",
  "nombre_proyecto": "proyecto “Perforación",
  "ubicación": "Departamento de Magdalena.",
  "empresa": "FALSA MOTIVACIÓN El Concepto Técnico contiene valoraciones técnicas, fácticas y jurídicas imprecisas",
  "numero_expediente": "LAM4155",
  "radicados": [
    "2019189191",
    "20236200655952",
    "20246200663912",
    "2023056097",
    "2019189194"
  ],
  "descripcion": "POR LA CUAL SE RESUELVE UN RECURSO DE REPOSICIÓN",
  "tipos_infraccion": [
    "Manejo de aguas",
    "Tala o afectación de bosques",
    "Incumplimiento del PMA"
  ],
  "pdf_id": "47732",
  "file_name": "ANLA_47732.pdf",
  "texto_completo": "AUTORIDAD NACIONAL DE LICENCIAS \nAMBIENTALES\n- ANLA –\nRESOLUCIÓN N° 001893\n(29 AGO. 2024)\nPágina 1 de 40\n“POR LA CUAL SE RESUELVE UN RECURSO DE REPOSICIÓN”\nEL ASESOR DEL DESPACHO DEL DIRECTOR DE LA AUTORIDAD \nNACIONAL DE LICENCIAS AMBIENTALES – ANLA\nEn ejercicio de las facultades legales establecidas mediante la Ley 99 del 22 de \ndiciembre de 1993, el Decreto Ley 3573 del 27 de septiembre de 2011, modificado \npor el Decreto 376 del 11 de marzo de 2020, por el cual se modifica la estructura \nde la Autoridad Nacional de Licencias Ambientales y acorde con lo regulado en el \nDecreto 1076 del 26 de mayo de 2015, la Resolución 669 del 14 de abril de 2020, \nla Resolución 1957 del 5 de noviembre de 2021 y la Resolución 2795 del 25 de \nnoviembre de 2022, expedidas por la Autoridad Nacional de Licencias \nAmbientales, y\nCONSIDERANDO\nQue mediante Resolución 320 del 18 de febrero de 2009, el entonces Ministerio de \nAmbiente, Vivienda y Desarrollo Territorial, hoy Ministerio de Ambiente y Desarrollo \nSostenible (En adelante el Ministerio), otorgó Licencia Ambiental a la sociedad \nPETROLÍFERA PETROLEUM COLOMBIA LIMITED, para el proyecto “Perforación \nExploratoria del Prospecto Brillante Sureste”, localizado en los Municipios de Ariguaní \n(El Difícil), Santa Ana y El Pijiño del Carmen, en el Departamento de Magdalena.\nQue por medio de Resolución 1079 del 9 de junio de 2011, el Ministerio, modificó la \nResolución 320 del 18 de febrero de 2009, en el sentido de adicionar la \nconstrucción, adecuación y operación de máximo 10 nuevas locaciones en el \nproyecto “Perforación Exploratoria del Prospecto Brillante Sureste”.\nQue por medio de la Resolución 311 del 12 de febrero de 2021, la Autoridad \nNacional de Licencias Ambientales - ANLA (En adelante la Autoridad Nacional), \naprobó el plan de compensación por aprovechamiento forestal y cambio de uso de \nsuelo presentado por la sociedad, mediante comunicación con radicado \n2019189191-1-000 del 2 de diciembre de 2019 y adoptó otras determinaciones.\nQue mediante la Resolución 973 del 27 de mayo de 2024 la Autoridad Nacional, \nnegó la propuesta de “Adquisición de predios en áreas o ecosistemas de interés \n\nResolución No. 001893       Del 29 AGO. 2024          Hoja No. 2 de 40\n“POR LA CUAL SE RESUELVE UN RECURSO DE REPOSICIÓN”\nPágina 2 de 40\nestratégico para la conservación de los recursos naturales, en el área de ampliación \ndel Parque Nacional Natural Sierra Nevada de Santa Marta”, presentada por la \nsociedad mediante comunicación con radicado 20236200655952 del 26 de \nseptiembre de 2023, para dar cumplimiento al Plan de Compensación por \naprovechamiento forestal y cambio de uso del suelo, asociada al proyecto \n“Perforación Exploratoria del Prospecto Brillante Sureste”. Acto administrativo que fue \nnotificado a la sociedad el día 28 de mayo de 2024.\nQue a través de la comunicación con radicación 20246200663912 del 13 de junio \nde 2024, la Sociedad interpuso recurso de reposición en contra de Resolución 973 \ndel 27 de mayo de 2024, argumentos que fueron evaluados por el equipo técnico \nde la Autoridad Nacional y en consecuencia se expidió el Concepto técnico 5755 \ndel 8 de agosto de 2024.\nCOMPETENCIA DE LA AUTORIDAD NACIONAL\nEl Gobierno Nacional, mediante Decreto Ley 3573 del 27 de septiembre de 2011, \ncreó la Autoridad Nacional de Licencias Ambientales - ANLA, como una entidad con \nautonomía administrativa y financiera, sin personería jurídica, la cual hace parte del \nSector Administrativo de Ambiente y Desarrollo Sostenible, en los términos del \nartículo 67 de la Ley 489 de 1998.\nEl numeral 1° del artículo tercero del mencionado decreto estableció dentro de las \nfunciones de la Autoridad Nacional, la de otorgar o negar las licencias, permisos y \ntrámites ambientales de competencia del Ministerio, de conformidad con la ley y los \nreglamentos.\nMediante el Decreto 376 del 11 de marzo de 2020, se modificó la estructura de la \nAutoridad Nacional de Licencias Ambientales.\nMediante la Resolución 669 del 14 de abril de 2020, se nombró como servidor \npúblico a EDILBERTO PEÑARANDA CORREA, identificado con cédula de \nciudadanía 4.052.851, en el empleo de libre nombramiento y remoción de Asesor, \ncódigo 1020, grado 15, adscrito a la Dirección General de la planta global de la \nANLA.\nEl 5 de noviembre de 2021, la Autoridad Nacional emitió la Resolución 1957 “Por la \ncual se adopta el Manual Específico de Funciones y de Competencias Laborales para los \nempleos de la planta de personal de la Autoridad Nacional de Licencias Ambientales - \nANLA”, en donde se establece que corresponde al Despacho del Director General \nde la Autoridad Nacional de Licencias Ambientales - ANLA, “Suscribir los actos \nadministrativos que otorgan, niegan, modifican, ajustan o declaran la terminación de las \nlicencias, permisos y trámites ambientales”.\nEn ejercicio de las facultades conferidas por la Ley 489 de 1998, se expidió la \nResolución 2795 del 25 de noviembre de 2022 “Por la cual se delegan unas \n\nResolución No. 001893       Del 29 AGO. 2024          Hoja No. 3 de 40\n“POR LA CUAL SE RESUELVE UN RECURSO DE REPOSICIÓN”\nPágina 3 de 40\nfunciones y se dictan otras disposiciones”, en su artículo primero, numeral 15° \ndelegó en el Asesor Código 1020 Grado 15 del Despacho del Director General, la \nfunción de “Resolver los recursos de reposición interpuestos contra los actos \nadministrativos que se emiten en cumplimiento de las funciones anteriores.”\nTeniendo en cuenta lo anterior, es el Asesor del Despacho del Director General de \nla Autoridad Nacional el competente para pronunciarse sobre el recurso de \nreposición interpuesto por la Sociedad en contra de la Resolución 973 del 27 de \nmayo de 2024.\nFUNDAMENTOS JURÍDICOS\nEl procedimiento para la presentación y resolución de recursos contra los actos \nadministrativos se encuentra reglado en el Código de Procedimiento Administrativo \ny de lo Contencioso Administrativo artículos 74 y siguientes, que particularmente \nrespecto del recurso de reposición al tenor literal expresan:\n“Artículo 74. Recursos contra los actos administrativos.\nPor regla general, contra los actos definitivos procederán los siguientes recursos: \n1. El de reposición, ante quien expidió la decisión para que la aclare, modifique, adicione \no revoque (…)”\nA su vez, los artículos 76 y 77 del Código enunciado preceptúan: \n“Artículo 76. Oportunidad y presentación.\nLos recursos de reposición y apelación deberán interponerse por escrito en la diligencia \nde notificación personal, o dentro de los diez (10) días siguientes a ella, o a la notificación \npor aviso, o al vencimiento del término de publicación, según el caso. Los recursos \ncontra los actos presuntos podrán interponerse en cualquier tiempo, salvo en el evento \nen que se haya acudido ante el juez. \nLos recursos se presentarán ante el funcionario que dictó la decisión (…)”\nArtículo 77. Requisitos.\nPor regla general los recursos se interpondrán por escrito que no requiere de \npresentación personal si quien lo presenta ha sido reconocido en la actuación. \nIgualmente, podrán presentarse por medios electrónicos. \nLos recursos deberán reunir, además, los siguientes requisitos: \n1. Interponerse dentro del plazo legal, por el interesado o su representante o apoderado \ndebidamente constituido. \n2. Sustentarse con expresión concreta de los motivos de inconformidad.\n\nResolución No. 001893       Del 29 AGO. 2024          Hoja No. 4 de 40\n“POR LA CUAL SE RESUELVE UN RECURSO DE REPOSICIÓN”\nPágina 4 de 40\n3. Solicitar y aportar las pruebas que se pretende hacer valer. \n4. Indicar el nombre y la dirección del recurrente, así como la dirección electrónica si \ndesea ser notificado por este medio. \nSólo los abogados en ejercicio podrán ser apoderados (…)”\nA su vez, el artículo 80 del citado Código, establece el alcance del contenido de la \ndecisión que resuelve el recurso:\n“Artículo 80. Decisión de los recursos. -Vencido el período probatorio, si a ello hubiere \nlugar, y sin necesidad de acto que así lo declare, deberá proferirse la decisión motivada \nque resuelva el recurso. \nLa decisión resolverá todas las peticiones que hayan sido oportunamente planteadas y \nlas que surjan con motivo del recurso.” \nCONSIDERACIONES DE LA AUTORIDAD NACIONAL FRENTE AL RECURSO \nDE REPOSICIÓN INTERPUESTO POR LA SOCIEDAD.\nDesde el punto de vista procedimental, se observa que el recurso de reposición \ninterpuesto por la Sociedad en contra de Resolución 973 del 27 de mayo de 2024, \ncumple con los requisitos establecidos en el artículo 77 y concordantes del Código \nde Procedimiento Administrativo y de lo Contencioso Administrativo, en cuanto a lo \nsiguiente:\n1. Interponerse dentro del plazo legal, por el interesado o su representante o \napoderado debidamente constituido.\nSe encuentra acreditado que el día 28 de mayo de 2024 la Sociedad fue notificada \nmediante correo electrónico de la Resolución 973 del 27 de mayo de 2024, frente a \nla cual interpuso recurso de reposición por intermedio del Liquidador el día 13 de \njunio de 2024 bajo el radicado 20246200663912; es decir, que la presentación del \nrecurso se efectuó dentro de los diez (10) días siguientes a la notificación, de \nconformidad con lo preceptuado en el artículo 76 de la Ley 1437 de 2011.\n2. Sustentarse con expresión concreta de los motivos de inconformidad.\nLa Sociedad presentó los argumentos en contra de las disposiciones recurridas de \nla Resolución 973 del 27 de mayo de 2024, los cuales serán tenidos en cuenta para \ndecidir el presente recurso de reposición.\n3. Solicitar y aportar las pruebas que se pretende hacer valer.\nEn el recurso de reposición, la Sociedad aportó las siguientes pruebas:\n\nResolución No. 001893       Del 29 AGO. 2024          Hoja No. 5 de 40\n“POR LA CUAL SE RESUELVE UN RECURSO DE REPOSICIÓN”\nPágina 5 de 40\n•\nAnexo 0. Certificado de Existencia y Representación Legal & Copia de la \nCédula del Liquidador.\n•\nAnexo 1. Solicitud remitida a CORPAMAG.\n•\nAnexo 2. 1/Prueba 1. Auto 000866 del 27 de febrero de 2024\n•\nRadicado 20236200655952 del 26 de septiembre de 2023\n4. Indicar el nombre y la dirección del recurrente, así como la dirección \nelectrónica si desea ser notificado por este medio.\nLa Sociedad manifestó que, para efectos de la notificación: “(…) la Compañía podrá \nser notificada en el correo electrónico correspondencia@grantierra.com.”\nCon base en lo anterior, verificado el cumplimiento de los requisitos establecidos en \nel Código de Procedimiento Administrativo y de lo Contencioso Administrativo -\nCPACA-, respecto a la procedencia del señalado recurso de reposición, la Autoridad \nNacional procederá a resolverlo, teniendo en cuenta las consideraciones realizadas \nen el Concepto técnico 5755 del 8 de agosto de 2024; en el mismo orden de los \nargumentos presentados por la Sociedad, a saber:\n1. DISPOSICIÓN RECURRIDA - ARTÍCULO PRIMERO.\n“ARTÍCULO PRIMERO. No Aprobar la propuesta de “Adquisición de predios en áreas o \necosistemas de interés estratégico para la conservación de los recursos naturales, en el \nárea de ampliación del Parque Nacional Natural Sierra Nevada de Santa Marta”, presentada \npor la sociedad PETROLIFERA PETROLEUM COLOMBIA LIMITED EN LIQUIDACIÓN \nmediante comunicación con radicado 20236200655952 del 26 de septiembre de 2023, para \ndar cumplimiento al Plan de Compensación por aprovechamiento forestal y cambio de uso \ndel suelo, asociada al proyecto “Perforación Exploratoria Prospecto Brillante Sureste (…)”\n1.1.Petición de la sociedad\n“8.1. PRIMERA PETICIÓN: Que se REVOQUE en su integridad la Resolución y que, en su \nlugar, se APRUEBE la Propuesta.\n8.2. PRIMERA PETICIÓN SUBSIDIARIA: Que en caso de que no se REVOQUE la \nResolución para APROBAR la Propuesta, se REVOQUE la Resolución y, en su lugar, se \nexpida un acto administrativo en el que se realiza una solicitud de información adicional \nsobre la Propuesta, tendiente a que la Compañía pueda subsanar la información y obtener \nla posterior APROBACIÓN de la Propuesta.”\n1.2.Argumentos de la sociedad\nMediante comunicación con radicación 20246200663912 del 13 de junio de 2024, \nla Sociedad presentó los siguientes argumentos:\n\nResolución No. 001893       Del 29 AGO. 2024          Hoja No. 6 de 40\n“POR LA CUAL SE RESUELVE UN RECURSO DE REPOSICIÓN”\nPágina 6 de 40\n“7. MOTIVOS DE INCONFORMIDAD\nEn el caso en concreto, a continuación, presentamos los motivos de inconformidad frente a \nlas decisiones adoptadas por la ANLA.\n7.1. FALSA MOTIVACIÓN\nEl Concepto Técnico contiene valoraciones técnicas, fácticas y jurídicas imprecisas sobre \nla Propuesta. Motivo por el cual, la Resolución se encuentra falsamente motivada a la luz \ndel principio de motivación de los actos administrativos y de la jurisprudencia del Consejo \nde Estado. \nConsecuentemente, en las siguientes páginas la Compañía presenta las consideraciones \nfácticas, técnicas y jurídicas por las cuales se considera que la decisión se basa en una \nfalsa motivación de la Resolución. Para estos efectos, la Compañía seguirá la siguiente \nestructura \nargumentativa: \n(7.1.1.) \nNormativa \nsobre \nfalsa \nmotivación; \n(7.1.2) \nConsideraciones técnicas que evidencian la falsedad de los motivos de la Resolución; y \n(7.1.3) Recapitulación sobre los motivos falsos contenidos en el análisis que la ANLA \nefectuó de cada uno de los elementos de la Propuesta. \nPor medio de esta estructura, la Compañía evidenciará que la decisión de no aprobar el \nplan de compensación debe ser revocada por ser contraria al principio de motivación de los \nactos administrativos como por desconocer las normas en las que se debía fundar, y por lo \nmismo, lo que corresponde es aprobar el plan sometido a consideración antela (sic) ANLA. \n7.1.1. Normativa sobre falsa motivación: sea lo primero hacer un recuento de la \nnormativa vigente sobre la motivación de los actos administrativos y el fenómeno de falsa \nmotivación: \n7.1.1.1. De acuerdo con el artículo 6 de la Constitución Política: “Los particulares sólo son \nresponsables ante las autoridades por infringir la Constitución y las leyes. Los servidores \npúblicos lo son por la misma causa y por omisión o extralimitación en el ejercicio de sus \nfunciones”. \n7.1.1.2. A su turno, el artículo 121 de la Constitución Política señala que ninguna autoridad \ndel Estado podrá ejercer funciones distintas de las que le atribuyen la Constitución y la Ley. \n7.1.1.3. En línea con lo anterior, el artículo 209 de la Constitución Política dispone que la \nfunción administrativa está al servicio de los intereses generales y se desarrolla con \nfundamento en los principios de igualdad, moralidad, eficacia, economía, celeridad, \nimparcialidad y publicidad, mediante la descentralización, la delegación y la \ndesconcentración de funciones. \n7.1.1.4. Por lo tanto, cualquier actuación de cualquier autoridad administrativa, como lo es \nla ANLA, debe ceñirse no sólo a lo dispuesto en las normas aplicables, sino que debe \ngarantizar el derecho y principio al debido proceso establecido en el artículo 29 \nConstitucional. \n\nResolución No. 001893       Del 29 AGO. 2024          Hoja No. 7 de 40\n“POR LA CUAL SE RESUELVE UN RECURSO DE REPOSICIÓN”\nPágina 7 de 40\n7.1.1.5. Así mismo, el artículo 3 de la Ley 489 de 1998 establece que “la función \nadministrativa se desarrollará conforme a los principios constitucionales, en particular los \natinentes a la buena fe, igualdad, moralidad, celeridad, economía, imparcialidad, eficacia, \neficiencia, participación, publicidad, responsabilidad y transparencia.” De igual forma, el \nartículo 3 de la Ley 1437 de 2011 dispone que “todas las autoridades deberán interpretar y \naplicar las disposiciones que regulan las actuaciones y procedimientos administrativos a la \nluz de los principios consagrados en la Constitución Política, en la Parte Primera de este \nCódigo y en las leyes especiales. Las actuaciones administrativas se desarrollarán, \nespecialmente, con arreglo a los principios del debido proceso, igualdad, imparcialidad, \nbuena \nfe, \nmoralidad, \nparticipación, \nresponsabilidad, \ntransparencia, \npublicidad, \ncoordinación, eficacia, economía y celeridad.” \n7.1.1.6. A su turno, la jurisprudencia del Consejo de Estado ha señalado que un elemento \nfundamental en el desarrollo del derecho al debido proceso es aquel relacionado con la \nmotivación de los actos por parte de la administración pública. \n7.1.1.7. Sobre el particular señaló el Consejo de Estado mediante sentencia del 16 de \nnoviembre de 2001 de la Sección Cuarta con ponencia de la doctora Ligia López Díaz: “(…) \nEl Derecho fundamental al debido proceso, consagrado en el artículo 29 de la Constitución \nPolítica, es aplicable a las actuaciones administrativas y su garantía se hace efectiva \ncuando se impone el deber a los agentes estatales de adelantar procedimientos que \npermitan el pleno ejercicio del derecho de defensa y el de contradicción; cuando se obliga \nal Estado a desvirtuar la presunción de inocencia de las personas, y con la necesidad de \nmotivar las decisiones. (…) la motivación es imprescindible en los actos (…), con el fin de \nhacer posible un adecuado control de legalidad y poder determinar que se están cumpliendo \nlos fines de las normas (…) Esta motivación debe ser real y seria, adecuada, suficiente y \nademás íntimamente relacionada con la decisión que se toma, de manera que la justifiquen \ndentro de la idea de satisfacer el interés general para el cual se otorgaron las competencias \nadministrativas (…)”. \n7.1.1.8. En igual sentido, se ha pronunciado la Corte Constitucional en sentencia unificadora \nSU- 917 de 2010, con ponencia del doctor Jorge Iván Palacio: “(…) El deber de motivación \nde los actos administrativos que (por regla general) tiene la administración, hace efectiva la \ncláusula de Estado de Derecho, el principio democrático, el principio de publicidad en las \nactuaciones de la administración, al tiempo que permite a los asociados contar con \nelementos de juicio suficientes para ejercer su derecho de contradicción y defensa a fin de \nacudir ante las instancias gubernativas y autoridades judiciales para controlar los abusos \nen el ejercicio del poder. De esta forma a la Administración corresponde motivar los actos, \nestos son, hacer expresas las razones de su decisión, mientras que a la jurisdicción \ncompete definir si esas razones son justificadas constitucional y legalmente. (…)”. \n7.1.1.9. A su turno, el Consejo de Estado ha indicado que la falsa motivación se traduce en: \n“(…) aquel error de hecho o de derecho que en determinado momento puede afectar la \nlegalidad del acto y el desvió de poder, en la intención con la cual la autoridad toma una \ndecisión persiguiendo un fin diferente al previsto por el legislador, que obedece a un \npropósito particular, personal o arbitrario”. 1\n1 Sentencia del 07 de marzo de 2013 – Sección Segunda – Rad. 13001-23-31-000-2007-00052-01.\n\nResolución No. 001893       Del 29 AGO. 2024          Hoja No. 8 de 40\n“POR LA CUAL SE RESUELVE UN RECURSO DE REPOSICIÓN”\nPágina 8 de 40\n7.1.1.10. Adicionalmente, esta misma corporación indica que para que prosperase una \npretensión fundamentada en la causal de falsa motivación, es necesario que se demuestre \nuna de dos circunstancias: “a) O bien que los hechos que la Administración tuvo en cuenta \ncomo motivos determinantes de la decisión no estuvieron debidamente probados dentro de \nla actuación administrativa; o b) Que la Administración omitió́ tener en cuenta hechos que \nsí estaban demostrados y que si hubiesen sido considerados habrían conducido a una \ndecisión sustancialmente diferente2\" (Subrayado fuera del texto original). \n7.1.1.11. Habiendo hecho el recuento de las normas que condenan la falsa motivación, la \nCompañía procede a evidenciar que la Resolución se encuentra falsamente motivada \nconforme se explicará en el presente recurso de reposición ya que se negó la aprobación \ndel plan a pesar de que el mismo plan, bajo otros expedientes, había sido aprobado por la \nmisma ANLA, por lo cual se falta al principio de unidad de materia y de criterio como de \nseguridad jurídica tal y como se explicará adelante. \n7.1.2. Consideraciones técnicas que evidencian la falsedad de los motivos de la \nResolución: a continuación, la Compañía procede a formular las consideraciones técnicas \nque evidencian que la ANLA incurrió en el fenómeno de falsa motivación. \n7.1.2.1. La Compañía remitió a través del radicado ANLA 20236200655952 del 26 de \nseptiembre de 2023 la propuesta de ajuste del Plan de Compensación por aprovechamiento \nforestal y cambio del uso del suelo por la obligación de compensación del Área del \nProspecto Brillante Sureste, dentro del Bloque Sierra Nevada. \n7.1.2.2. Esta propuesta se encuentra dirigida a áreas de especial importancia al interior del \nParque Nacional Natural Sierra Nevada de Santa Marta, en cumplimiento de la medida de \ncompensación establecida en el artículo quinto (numerales c, d y e) de la Resolución 320 \nde 18 de febrero de 2009 y el parágrafo del artículo décimo primero de la Resolución 1079 \nde 9 de junio de 2011, que posteriormente fueron modificadas por la Resolución 00311 del \n12 de febrero de 2021. \n7.1.2.3. A través del último acto administrativo en mención, se estableció entre varios \naspectos lo siguiente: “ARTÍCULO PRIMERO. Aprobar el Plan de Compensación por \naprovechamiento forestal y cambio de uso del suelo del proyecto denominado \"Perforación \nExploratoria del Prospecto Brillante Sureste\", localizado en los municipios de Ariguaní (El \nDifícil), Santa Ana y El Pijiño del Carmen en el departamento del Magdalena, presentado \npor la Sociedad PETROLÍFERA PETROLEUM COLOMBIA LIMITED, mediante  \ncomunicación con radicado 2019189191-1-000 del 2 de diciembre de 2019, de conformidad \na lo expuesto en la parte motiva de este acto administrativo. \n(…) \nARTÍCULO SÉPTIMO. Requerir a la Sociedad PETROLÍFERA PETROLEUM COLOMBIA \nLIMITED, para que en un plazo no superior a seis (6) meses, contados a partir de la \nejecutoria de este acto administrativo, presente la identificación de los propietarios y la \nGeorreferenciación de los polígonos donde desarrollará la obligación de compensación del \nproyecto Perforación Exploratoria del Prospecto Brillante Sureste (24,264 ha), mediante \nactividades el establecimiento de especies nativas en las cuencas hidrográficas y \n2 Sentencia del 26 de julio de 2017 – Sección Cuarta – Rad. 11001-03-27-000-2018 00006-00.\n\nResolución No. 001893       Del 29 AGO. 2024          Hoja No. 9 de 40\n“POR LA CUAL SE RESUELVE UN RECURSO DE REPOSICIÓN”\nPágina 9 de 40\nenriquecimiento en áreas de bosque de galería localizadas dentro de la alternativa uno (1) \nsobre el arroyo Cacagüero y las rondas menores en el municipio de Sabanas de San Ángel \ny/o la alternativa dos (2) en la ribera del río Ariguaní en el municipio de El Difícil así como \nlos respectivos soportes que permitan verificar el inicio de las actividades descritas en el \nplan presentado. (…)”. \n7.1.2.4. Con respecto a lo establecido, la compañía, a través del plan de compensación \npresentado con radicado 20236200655952 del 26 de septiembre de 2023 argumentó que, \nuna vez se generó la aprobación del Plan de Compensación del APE Brillante, se procedió \na realizar una solicitud vía correo electrónico, con el fin de adelantar una reunión con \nCORPOMAG; para compartir el acto administrativo e identificar junto a ellos los predios \ndisponibles; ya que las áreas aprobadas eran extensas para definir un predio especifico. En \neste sentido, no se recibió ninguna respuesta y procedió a enviar solicitud de reunión por \nmedio de correo certificado, aclarando el alcance y objetivo de la reunión (Anexo 1). \n7.1.2.5. A pesar de la insistencia en la definición especifica de áreas no se contó con \nrespuesta de la Autoridad Ambiental, por lo tanto, y reconociendo las dificultades de gestión \ncon la Autoridad Ambiental, que se documentaron en la primera propuesta de \ncompensación, la Empresa inició la revisión de las áreas para identificar los posibles \npropietarios interesados en las acciones de reforestación y además estableció contacto con \notra autoridad ambiental que es Parques Nacionales Naturales de Colombia (o “PNN”), con \nel fin de identificar nuevas alternativas. Ambas iniciativas fueron documentadas en los \nrespectivos Informes de Cumplimiento Ambiental (\"ICA”) correspondientes a los años 2022 \ny 2023. \n7.1.2.6. Una vez se realizaron los recorridos por las áreas autorizadas: Alternativa 1: \nArroyo Cacagüero (Área total 1367,35 Ha), Alternativa 2: Rio Ariguaní (Área total 3303,34 \nHa), con el fin de focalizar sitios específicos para materializar la compensación; se identificó \ny documento en los ICA la existencia de algunas limitantes para el desarrollo del plan de \ncompensación ya que actualmente en las áreas se encuentran extensos pastizales \ndedicados a actividades pecuarias, cultivos de palma y reforestaciones de especies \nforáneas con fines comerciales, por la cercanía al río como medio de transporte para llevar \nproductos y subproductos de las plantaciones forestales. Es importante mencionar que la \nCompañía REFORESTADORA DE LA COSTA S.A.S, tiene áreas dedicadas a cultivos \ncomerciales en la zona. Las anteriores actividades son catalogadas como tensionates y \nlimitantes en el desarrollo del plan de compensación a través de reforestaciones \nprotectoras. \n7.1.2.7. En los recorridos iniciales, no se pudo focalizar un predio con disponibilidad de área \npara reforestación, ya que las personas consultadas expresaban que el área de interés para \nellos es la margen de los ríos en franjas bien demarcadas, de tal manera que no se interfiera \ncon la ganadería y que en los predios se deben establecer especies como Teca (Tectona \ngrandis) y Meliana (Gmelia arborea), que son las especies que se pueden aprovechar en \nlas fincas. \n7.1.2.8. En la segunda visita programada para la ubicación del área de reforestación, las \nzonas de intereses para desarrollar el Plan de Compensación estaban siendo afectadas por \nlas inundaciones que se presentaron en el año 2021, llevando a que se declarara \nemergencia en el departamento, como consecuencia de la pérdida del cauce y de la ronda \nhídrica del río Ariguaní. Esta situación se vio agudizada por la ausencia de obras hidráulicas \n\nResolución No. 001893       Del 29 AGO. 2024          Hoja No. 10 de 40\n“POR LA CUAL SE RESUELVE UN RECURSO DE REPOSICIÓN”\nPágina 10 de 40\nsobre el río Ariguaní, que actualmente están bajo la responsabilidad del Fondo Nacional de \nGestión del Riesgo de Desastres. La oleada invernal se extendió hasta 20223 (sic), por lo \ncual se generaron varias alertas desde la perspectiva de la Gestión del Riesgo. \n7.1.2.9. Continuando con la respectiva gestión y con el objetivo de dar respuesta a los \nrequerimientos del Acta 29 de diciembre de 2021 y el Acta 986 del 22 de diciembre de 2022, \nse revisaron cuatro predios, en los cuales los propietarios expresaron su voluntad de venta \ndel área requerida para ejecutar el proyecto de reforestación. \n7.1.2.10. Inicialmente, se planteó la adquisición de las áreas, porque las personas no \nestaban de acuerdo en el registro futuro de las plantaciones con fines de conservación. Sin \nembargo, no procedió la compra de las áreas porque se presentaban diversos riesgos en \nla tenencia de la tierra que permitieran la posterior cesión de las áreas de conservación a \nla Alcaldía o la Autoridad Ambiental y que permitieran el registro de las plantaciones. En la \nTabla 1 se retoman los predios revisados que no fueron viables para el establecimiento de \nlas reforestaciones debido a las restricciones técnicas, legales y de análisis del riesgo de \ndesastres, los cuales fueron también mencionados en el plan de compensación presentado \npara evaluación.\n\nResolución No. 001893       Del 29 AGO. 2024          Hoja No. 11 de 40\n“POR LA CUAL SE RESUELVE UN RECURSO DE REPOSICIÓN”\nPágina 11 de 40\n7.1.2.11. Conforme a la dificultad de ubicación de áreas que garantizaran la mejor \noportunidad de compensación efectiva y que fueran destinadas a la reforestación en las \náreas aprobadas y donde se pudiera garantizar la permanencia de la obligación, se continuó \ncon la gestión en PNN proponiendo ejecutar la obligación de compensación del proyecto \nen la adquisición de un predio destinado para la preservación y conservación del Parque \n\nResolución No. 001893       Del 29 AGO. 2024          Hoja No. 12 de 40\n“POR LA CUAL SE RESUELVE UN RECURSO DE REPOSICIÓN”\nPágina 12 de 40\nNacional Natural Sierra Nevada de Santa Marta que hace parte de la ampliación del área \nprotegida.\n7.1.2.12. \nConsecuentemente, \nal \nejecutar \nla \nobligación \nde \ncompensación \npor \naprovechamiento forestal y cambio de uso del suelo de 24,264 Ha en la adquisición de un \npredio destinado para la preservación y conservación del área protegida mencionada se \nbusca complementar esta acción a través de la vinculación conjunta con el Pueblo Kogui \n(Resguardo Kogui Malayo Arhuaco) en un proyecto de conservación para el cumplimiento \na las fichas de manejo MB 6.2 (afectación paisajística) y MB 6.3 (Fauna) del proyecto APE \nBrillante Sureste, orientando estas actividades de conservación con la comunidad \nincentivando el uso adecuado de la tierra de acuerdo con su aptitud en cumplimiento de la \nfunción social y ecológica de la propiedad.\n7.1.2.13. Asimismo, es imperativo aclarar que la propuesta de compensación va \nencaminada a agrupar las compensaciones a través de la compra de los predios Las \nDelicias y El Pensamiento, ubicados en el corregimiento de Minguelo, municipio de Dibulla, \ndepartamento de La Guajira, para dos (2) expedientes localizados en el sur del \ndepartamento del Magdalena, y que cuentan con el mismo titular del instrumento de manejo \nde control, que para el caso corresponde a la Compañía (LAM4155 APE La Pinta 1 y el \nLAM4269 APE Brillante Sureste), lo expuesto con el fin de buscar la maximización de los \nbeneficios ambientales, económicos y sociales. \n7.1.2.14. Lo anterior, buscando cerrar las brechas entre el campo y la ciudad, creando \ncondiciones de bienestar y buen vivir para la población rural a través de la protección de \náreas de especial interés ambiental y la generación de alternativas equilibradas entre el \nmedio ambiente y el bienestar para la población que colinda con ellas o las ocupan, bajo \nlos principios de participación de las comunidades y desarrollo sostenible. De este modo se \ncoadyuva al logro de los objetivos propuestos en la Política Nacional para la Gestión Integral \nde la Biodiversidad y sus Servicios Ecosistémicos, principio orientador de la conservación \nen el país. \n7.1.2.15. Continuando con los argumentos, la parte considerativa de la Resolución 973 del \n27 de mayo de 2024, en su página 20, establece lo siguiente: \n“Respecto al ámbito geográfico para la compensación, el articulo (sic) décimo primero de la \nResolución 1079 del 9 de junio de 2011 establece al respecto que “Como medida de \ncompensación por aprovechamiento forestal y cambio de uso de suelo, la Empresa deberá \nrealizar el establecimiento de especies nativas en las cuencas hidrográficas y \nenriquecimiento en áreas de bosque de galería dentro del área de influencia del proyecto. \nDe tal forma, se tiene que desde un comienzo la Autoridad Nacional fue clara en el sentido \nde indicar que la compensación debe realizarse sobre las márgenes hídricas de los cuerpos \nde agua del área de influencia del proyecto Perforación Exploratoria del Prospecto Brillante \nSureste. En tal sentido, la Autoridad Nacional observa que los predios las Delicias y El \nPensamiento, se ubican en el corregimiento de Minguelo, municipio de Dibulla, \ndepartamento de La Guajira, y por consiguiente fuera del ámbito geográfico del área de \ninfluencia del proyecto Perforación Exploratoria del Prospecto Brillante Sureste. \nPor otro lado, en lo que respecta a la equivalencia ecosistémica, el área de influencia del \nproyecto se encuentra circunscrita al Zonobioma Alternohigrico Tropical Ariguaní-Cesar y \n\nResolución No. 001893       Del 29 AGO. 2024          Hoja No. 13 de 40\n“POR LA CUAL SE RESUELVE UN RECURSO DE REPOSICIÓN”\nPágina 13 de 40\nel Helobioma Ariguaní-Cesar, entre tanto que los predios propuestos se encuentran \ninmersos en el Zonobioma Alternohigrico Tropical Estribación norte Sierra Nevada de Santa \nMarta, y el Zonobioma Alternohigrico Tropical Sierra nevada de Santa Marta, de tal forma \nque no existe una equivalencia ecosistémica de los predios propuestos con el área de \ninfluencia del proyecto”. \n7.1.2.16. Ahora bien, a pesar de extender la visión sobre los atributos en términos de \necosistema, es importante destacar que uno de los argumentos de la ANLA sobre la no \nviabilidad de los predios corresponde al no cumplimiento de la equivalencia ecosistémica, \nno obstante, frente a este argumento es imperativo aclarar que el plan de compensación \npropuesto para el proyecto respecto aquellos impactos por aprovechamiento forestal y \ncambio de uso del suelo en coberturas de pastos limpios, arbolados, rastrojos bajos que se \ndieron antes de la entrada en vigencia de las Resoluciones 1517 de 2012 y 256 de 2018, \npor lo tanto, no le puede ser aplicable como concepto relacionado el cumplimiento de la \nequivalencia ecosistémica, aunque, en este caso, al tratarse de unidad biótica, se cumpliría \nla equivalencia ecosistémica sobre el bioma “Zonobioma Alternohigrico Tropical”, ligados al \ntipo de clima, geopedología y coberturas con un distrito biogeográfico diferente.  \nEn otras palabras, al compararse las áreas de las tres alternativas aprobadas por la \nResolución 311 del 12 de febrero de 2021 con las áreas propuestas al interior de los predios \nLas Delicias y El Pensamiento, ubicados en el corregimiento de Minguelo, municipio de \nDibulla, departamento de La Guajira, específicamente sobre los criterios ecosistémicos \ncomo presencia del  ecosistema de bosque seco tropical, ecosistemas En Peligro y \nVulnerables de la lista roja de ecosistemas, presencia bajo áreas prioritarias de \nconservación entre otros aspectos presentados en el Plan radicado, es evidente que existe \nuna oportunidad de conservación real de estas áreas, situación que debe valorar la \nAutoridad Ambiental sobre todo con la debida diligencia soportada por la compañía en \ntérminos de ejecutar acciones que perduren en el tiempo sobre las áreas ya aprobadas. \n7.1.2.17. Por otro lado, uno de los argumentos expresados por la ANLA frente a la no \npertinencia de la solicitud de la Compañía para modificar la forma de compensación a través \ndel saneamiento predial, corresponde a que las áreas propuestas no se encuentran \nubicadas al interior del ámbito geográfico señalado por la Resolución 311 de 2021. \nCon relación a esto, la Resolución 1079 del 9 de junio de 2011 establece al respecto que \n“Como medida de compensación por aprovechamiento forestal y cambio de uso de suelo, \nla Empresa deberá realizar el establecimiento de especies nativas en las cuencas \nhidrográficas y enriquecimiento en áreas de bosque de galería dentro del área de influencia \ndel proyecto”, no obstante, las áreas aprobadas por la Resolución 311 del 12 de febrero de \n2021 no se encuentran directamente relacionadas al área de influencia del proyecto. \n7.1.2.18. En la siguiente Figura se muestra la ubicación del bloque Sierra Nevada \n(AreaProyecto) y la ubicación de las áreas aprobadas para la compensación \n(OtraCompensación) a través de la Resolución 311 del 12 de febrero de 2021.\n(Ver figura 1 en la página 13 del Concepto técnico 5755 del 8 de agosto de 2024)\n(...)\n\nResolución No. 001893       Del 29 AGO. 2024          Hoja No. 14 de 40\n“POR LA CUAL SE RESUELVE UN RECURSO DE REPOSICIÓN”\nPágina 14 de 40\n7.1.2.19. Aunado a lo expuesto, el parágrafo tercero del artículo 2.2.2.1.6.5, establece que \n“La reglamentación sobre compensaciones ambientales deberá incorporar acciones de \nconservación y manejo de áreas protegidas integrantes del Sinap”, así las cosas, la \ncompensación al interior de áreas protegidas del SINAP y aquellas acciones que se \nencuentren directamente relacionadas con fortalecer el logro de los objetivos de \nconservación de las áreas protegidas deben contar con priorización por parte de las \nAutoridades Ambientales así como orientar la toma de decisión a los análisis que busquen \nque la compensación sea efectiva a través del tiempo y garantice condiciones de \nadicionalidad más allá de reforestaciones que puedan no ser exitosas, situaciones que no \nfueron evaluadas detalladamente por parte de la Autoridad a través del concepto técnico \n1545 del 19 de marzo de 2024 y la Resolución 973 del 27 de mayo de 2024. \n7.1.2.20. Así las cosas, la protección ambiental del territorio ancestral en la Sierra Nevada \nde Santa Marta ha estado vinculada con el surgimiento y consolidación de los resguardos \nKogui-Wiwa-Arhuaco y Resguardo Arhuaco de la Sierra. Unido a lo anterior, la misión de \nconservación ambiental en la Sierra Nevada de Santa Marta ha sido impulsada desde los \naños 1960 por el Ministerio de Agricultura, en los años 1970 por el INDERENA como Parque \nNacional Sierra Nevada y posteriormente continuada por la Unidad de Parques Nacionales \nNaturales. \n7.1.2.21. Al momento de la creación del Parque, se reconocieron los valores naturales a \nproteger, en su íntima relación con el manejo ancestral indígena que permitió su \nconservación a lo largo de centurias de presión colonial y moderna sobre la Sierra, y ello \nha dado lugar a una vinculación histórica. Asimismo, en los objetivos del parque, se \ncontempló la doble protección (natural y cultural) de dicho espacio, explícitamente \nreconocido como territorio indígena (Resoluciones 191 de 1964 INCORA; 255 de 1964, 230 \nde 1971 y 164 de 1977 del Ministerio de Agricultura, y Acuerdos 06 de 1971 y 25 de 1977 \ndel Inderena, Convenio 169 de la OIT aprobado por la Ley 21 de 1991). \n7.1.2.22. El entonces Ministerio de Ambiente, Vivienda y Desarrollo Territorial expidió la \nResolución 0621 de 2002, en la que indica que en los procesos de planificación y de gestión \nambiental del Ministerio del Medio Ambiente-PNN y las corporaciones CORPOCESAR, \nCORPOGUAJIRA CORPAMAG, se incorporarán y desarrollarán los temas prioritarios de \ntrabajo conjunto acordados con el Consejo Territorial de Cabildos en el Comité Directivo \nAmpliado del Plan de Desarrollo Sostenible de la Sierra. Además, se estableció que el \nMinisterio - Parques Nacionales Naturales y las Corporaciones ya citadas, a través de su \nrespectiva participación en la Sierra, deberán promover el fortalecimiento del gobierno \nindígena y el manejo armónico, integral y sostenible de esta ecorregión estratégica, \nincorporando prácticas tradicionales. \n7.1.2.23. En la Propuesta, la cual fue presentada ante la imposibilidad de ejecutar la \ncompensación inicialmente aprobada en 2021, la Compañía fortalece el componente social. \nLo anterior, debido a la ausencia de alguna figura de protección que pueda asegurar la \npermanencia de la obligación de compensación en las áreas aprobadas por la Resolución \n00311 del 12 de febrero de 2021. Esto, considerado que la precitada Resolución concentra \nsu aprobación en fuentes hídricas y en bosques de galería, los cuáles han sido ampliamente \ntransformados en los últimos 50 años. \n7.1.2.24. Es importante mencionar que la obligación de compensación surge por las \nactividades de construcción de locaciones y vías del proyecto Área de Perforación \n\nResolución No. 001893       Del 29 AGO. 2024          Hoja No. 15 de 40\n“POR LA CUAL SE RESUELVE UN RECURSO DE REPOSICIÓN”\nPágina 15 de 40\nExploratoria Brillante Sureste del Bloque Sierra Nevada, que incluye el cambio de uso del \nsuelo que ya era una cobertura no natural porque estaba conformado por pastos mejorados \ny sólo existía un rastrojo bajo (0,413 Ha) sin ningún tipo de conectividad y el \naprovechamiento forestal se da por árboles aislados en la cobertura de pastos, como está \ndocumentado en los ICA. \n7.1.2.25. Con lo anterior, se evidencia que desde el inicio del proyecto (2009) ya existía una \nextensa transformación del área que a la fecha continua, por lo cual, la equivalencia que se \nplantea en el plan de compensación se enfoca en actividades para la conservación de \necosistemas estratégicos protegidos en búsqueda de mejorar la conectividad ecológica \nentre los fragmentos de bosques existentes en el área de cuencas que han guardan \natributos de la biodiversidad y donde se pueden conservar el 100% de sus áreas núcleos \necológicos y de endemismos de especies. Implementar la propuesta establecida en la \nResolución 311 de 2021, consistente en reforestar 24.264 Ha en áreas degradadas sin \nconectividad configuraría una fuga de biodiversidad en áreas con presiones antrópicas altas \ny sin figuras de protección que las mantengan en el tiempo. \n7.1.2.26. La equivalencia que presenta el plan de compensación con radicado \n20236200655952 del 26 de septiembre de 2023, se concentra en la presencia del \nEcosistema de Bosque Seco Tropical, que se define como una formación vegetal de \ntierras bajas, que se distribuye entre los 0 y los 1000 m.s.n.m., presenta temperaturas \nsuperiores a los 24°C y precipitaciones entre 700 y 2000 mm/año, con uno o dos periodos \nde sequía al año. Cuenta con una biodiversidad particular que se destaca por su capacidad \nadaptativa a las condiciones climáticas y por su alto grado de endemismo en especies de \nflora y fauna, especialmente en especies vegetales de tipo subxerofítico y xerofítico. Los \nanterior se presenta en el área de intervención de proyecto y en el predio Las Delicias. \n7.1.2.27. El Bosque Seco Tropical es un ecosistema de gran fragilidad y baja \nrepresentatividad en el país, susceptibles a la erosión y las presiones antrópicas que \ndemandan acciones para su recuperación, orientadas a regular el equilibrio en el \necosistema propiamente dicho y los bienes y servicios ambientales que oferta por lo anterior \nreforestar un área de 24.264 Ha, no logra mantener estos atributos en una matriz \nfragmentada. Es importante recordar que el BsT es el ecosistema más amenazado a nivel \nnacional según el Instituto Alexander von Humboldt. Actualmente queda menos del 4% de \nla cobertura original (alrededor de 9 millones de hectáreas) del BsT. En otras palabras, más \ndel 90% de los bosques secos del país han sido deforestados, conllevando a la \ndesertificación de muchas zonas del país (Pizano & García, 2014; Peñuela, 2014).  \n7.1.2.28. El Ministerio de Ambiente abordó el bosque seco tropical inicialmente desde el \nPlan de Acción Nacional de Lucha contra la Desertificación y sequía- PAN (instrumento que \nejecuta las directrices de la Convención de Naciones Unidas de Lucha contra la \nDesertificación y la Sequía UNCCD adoptado en el país mediante la ley 461 de 1998). En \neste documento se determinó que, de las tres regiones con Bosque Seco Tropical en el \npaís, la llanura Caribe donde se encuentra el Área de Perforación Exploratoria Brillante \nSureste del Bloque Sierra Nevada, incluye el sur de La Guajira, que es la región con mayor \ncobertura en la actualidad de bosque seco que requiere ser conservación. \n7.1.2.29. Aunado a lo anterior, el área de intervención y de compensación hacen parte del \nPortafolio de áreas prioritarias para conservación de la biodiversidad, escala 1:250.000. \n(Región Andes, Caribe y Pacífico 4). Así como aquellas áreas asociadas al Sistema \n\nResolución No. 001893       Del 29 AGO. 2024          Hoja No. 16 de 40\n“POR LA CUAL SE RESUELVE UN RECURSO DE REPOSICIÓN”\nPágina 16 de 40\nRegional de Áreas Protegidas del Caribe colombiano - SIRAP Caribe. Al respecto, es \nimportante precisar que el artículo 8 de la Ley 812 de 2003 Descripción de los principales \nprogramas de Inversión, literal B Crecimiento Económico sostenible y Generación de \nEmpleo, numeral 8. Sostenibilidad ambiental establecen que: \n“Con el objeto de mantener la base natural como factor para el desarrollo del país, aumentar \nla producción y oferta de bienes y servicios ambientalmente sanos y la sostenibilidad de la \nproducción nacional, y de contar con un Sistema Nacional fortalecido, se adelantarán los \nsiguientes programas: Conservación y uso sostenible de bienes y servicios ambientales. \nComprende la consolidación del Sistema de Áreas protegidas; el manejo de \npoblaciones de especies silvestres amenazadas y de uso potencial; el fomento de \ndesarrollos biotecnológicos a partir de los componentes de la biodiversidad y gestión en \nmateria de bioseguridad; y la conservación, manejo, uso y restauración de ecosistemas de \nbosques y otros ecosistemas. ….” \n7.1.2.30. De acuerdo con lo expuesto las áreas de los predios propuestos por la compañía \nse encuentran asociados al área identificada en SIRAP Caribe como Bosques y arbustales \nsecos de los ríos San Salvador, Santa Clara y Jerez. Con lo cual se cumple con la \nprotección de fuentes hídricas.\n(Ver figura 2 en la página 16 del Concepto técnico 5755 del 8 de agosto de 2024)\n(...)\n7.1.2.31. Finalmente, las áreas propuestas por la compañía se encuentran asociadas a \náreas vinculadas a la priorización de áreas y macroproyectos para adelantar las \nobligaciones de compensaciones ambientales e inversión de no menos del 1%, áreas cuyo \nfin está asociado a promover la articulación de las obligaciones impuestas en los \ninstrumentos de control y manejo ambiental, con otros instrumentos normativos de \nplanificación como los Planes de Ordenamiento Territorial (“POT”) y los Planes de \nOrdenación y Manejo de Cuencas Hidrográfica (“POMCA”), entre otros.\n(Ver figura 3 en la página 17 del Concepto técnico 5755 del 8 de agosto de 2024)\n(...)\n7.1.2.32. Así las cosas, las áreas propuestas cumplen con el objetivo que persiguen las \ncompensaciones bióticas tanto para el mejoramiento de la biodiversidad y recuperación de \ncuencas, así como el apoyo a la conservación de áreas prioritarias acorde al trabajo \narticulado con los aliados estratégicos.  \n7.1.2.33. En resumen, al compararse las áreas de las tres alternativas aprobadas por la \nResolución 311 del 12 de febrero de 2021 con las áreas propuestas al interior de los predios \nLas Delicias y El Pensamiento, ubicados en el corregimiento de Minguelo, municipio de \nDibulla, departamento de La Guajira, específicamente sobre los criterios ecosistémicos \ncomo presencia del ecosistema de bosque seco tropical, ecosistemas En Peligro y \nVulnerables de la lista roja de ecosistemas, presencia bajo áreas prioritarias de \nconservación entre otros aspectos presentados en el Plan radicado, es evidente que existe \nuna oportunidad de conservación real de estas áreas, situación que debe valorar la \n\nResolución No. 001893       Del 29 AGO. 2024          Hoja No. 17 de 40\n“POR LA CUAL SE RESUELVE UN RECURSO DE REPOSICIÓN”\nPágina 17 de 40\nAutoridad Ambiental sobre todo con la debida diligencia soportada por la compañía en \ntérminos de ejecutar acciones que perduren en el tiempo sobre las áreas ya aprobadas. \n7.1.2.34. La mejor oportunidad de conservación efectiva tenderá a trascender, es \nimportante que la compensación realmente tienda a ser efectiva a través del tiempo, razón \npor la cual, las áreas propuestas para saneamiento predial al interior de la ampliación del \nPNN Sierra Nevada de Santa Marta tienen un objetivo de conservación mucho más amplio \ny diferencial que cualquier propuesta de reforestación con enfoques de recuperación o \nrehabilitación en áreas puntuales altamente fragmentadas.  \n7.1.3. Recapitulación sobre los motivos falsos contenidos en el análisis que la ANLA \nefectuó de cada uno de los elementos de la Propuesta: a continuación, la Compañía \nhace una recapitulación que evidencia que a la luz de la jurisprudencia del Consejo de \nEstado el Concepto Técnico contiene valoraciones técnicas, fácticas y jurídicas imprecisas \nsobre la Propuesta, Como se recapitulará a continuación, la ANLA incurrió en falsa \nmotivación al valorar los siguientes elementos de la Propuesta: (7.1.3.1) el dónde \ncompensar de la Propuesta; (7.1.3.2) modo, lugar y tiempo de la Propuesta; (7.1.3.3) \nindicadores de seguimiento de la Propuesta; (7.1.3.4) cronograma de implementación, \nmonitoreo y seguimiento de la Propuesta; y (7.1.3.5) conclusiones sobre la Propuesta, \nveamos: \n7.1.3.1. El Concepto Técnico cuestionó el dónde compensar de la Propuesta así: \n“En tal sentido, la Autoridad Nacional observa que los predios las Delicias y El Pensamiento, \nse ubican en el corregimiento de Minguelo, municipio de Dibulla, departamento de La \nGuajira, y por consiguiente fuera del ámbito Geográfico del área de influencia del proyecto \nPerforación Exploratoria del Prospecto Brillante Sureste. \n(…) \nPor otro lado, en lo que respecta a la equivalencia ecosistémica, el área de influencia del \nproyecto se encuentra circunscrita al Zonobioma Alternohigrico Tropical Ariguaní́-Cesar y \nel Helobioma Ariguaní́-Cesar, entre tanto que los predios propuestos se encuentran \ninmersos en el Zonobioma Alternohigrico Tropical Estribación norte Sierra Nevada de Santa \nMarta, y el Zonobioma Alternohigrico Tropical Sierra nevada de Santa Marta, de tal forma \nque no existe una equivalencia ecosistémica de los predios propuestos con él área de \ninfluencia del proyecto”. \nLa motivación anterior es falsa, debido a las siguientes razones: (i) la ANLA omitió tener en \ncuenta que la Propuesta aborda las medidas para dos compensaciones, una por \naprovechamiento y otra por cambio de uso del suelo; (ii) ignorar el hecho anterior, conllevó \na que la ANLA aplicará normas de compensaciones regladas a una compensación no \nreglada, como lo es la compensación por cambio de uso del suelo. Como se evidenciará en \nlas consideraciones expuestas en el numeral 7.1.3.17, las compensaciones por cambio de \nuso del suelo no son regladas, por lo cual, la exigencia de la ANLA de que esta \ncompensación cumpla con equivalencia ecosistémica y ámbito geográfico es contraria al \nordenamiento jurídico vigente. Toda vez que, las normas actuales no exigen eso. Por lo \ntanto, los argumentos de la ANLA sobre donde compensar son falsos. \n\nResolución No. 001893       Del 29 AGO. 2024          Hoja No. 18 de 40\n“POR LA CUAL SE RESUELVE UN RECURSO DE REPOSICIÓN”\nPágina 18 de 40\nAsí las cosas, en el numeral 7.1.3.17 de este recurso, la Compañía evidenciará que al \ncompararse las áreas de las tres alternativas aprobadas por la Resolución 311 del 12 de \nfebrero de 2021 con las áreas propuestas al interior de los predios Las Delicias y El \nPensamiento, ubicados en el corregimiento de Minguelo, municipio de Dibulla, \ndepartamento de La Guajira, específicamente sobre los criterios ecosistémicos como \npresencia del ecosistema de bosque seco tropical, ecosistemas En Peligro y Vulnerables \nde la lista roja de ecosistemas, presencia bajo áreas prioritarias de conservación entre otros \naspectos presentados en el Plan radicado, es evidente que existe una oportunidad de \nconservación real de estas áreas, situación que debe valorar la Autoridad Ambiental sobre \ntodo con la debida diligencia soportada por la compañía en términos de ejecutar acciones \nque perduren en el tiempo sobre las áreas ya aprobadas.\n7.1.3.2. En la valoración del modo, lugar y tiempo de la Propuesta, la ANLA también \nincurrió en falsa motivación al desarrollar el Concepto Técnico, veamos: \n“En tal caso, respecto al COMO compensar, se observa que si bien la Resolución 311 del \n12 de febrero de 2021, establece que la medida de compensación se realizará mediante “el \nestablecimiento de especies nativas en las cuencas hidrográficas y enriquecimiento en \náreas de bosque de galería localizadas dentro de la alternativa uno (1) sobre el arroyo \nCacagüero y las rondas menores en el municipio de Sabanas de San Angel y/o la alternativa \ndos (2) en la ribera del río Ariguaní́ en el municipio de El Difícil” la Sociedad en \ncontraposición presenta unas acciones diferentes (compra de predios y su posterior entrega \nal PNN SNSM, a llevar a cabo en un año) a las que se encuentran establecidas como \nobligación”. \nEn este caso, ANLA omitió tener en cuenta todas las actuaciones y la debida diligencia que \nla Compañía adelantó para para garantizar que, en la medida que las actuaciones de \nterceros lo permitieran, la Propuesta cumpliera con todo lo previsto en la Resolución 311 \ndel 12 de febrero de 2021. Si la ANLA hubiese tenido en cuenta todos los argumentos \ntécnicos, fácticos y jurídicos planteados por la Compañía en la Propuesta, habría \nevidenciado que la Compañía presentó la Propuesta con fundamento en lo que le era viable \ny posible, según la realidad del caso en concreto. \nEn este caso, la falsa motivación consiste en que la ANLA omitió tener en cuenta los hechos \npresentados por la Compañía, que evidenciaban la imposibilidad de la Compañía de cumplir \ncon las obligaciones establecidas en la Resolución 311 de 2021, los cuales, de haberse \ntenido en cuenta, habrían derivado en una valoración totalmente diferente del modo, lugar \ny tiempo de la Propuesta. \nAdicionalmente, al valorar el modo, lugar y tiempo de la Propuesta la ANLA omitió tener \nen cuenta cuatro principios jurídicos, como a continuación se señala: \nPrimero: la ANLA omitió aplicar el principio de buena fe (previsto en el artículo 83 de la \nConstitución) que le exige a la ANLA presumir la buena fe de la Compañía, en relación con \nlas razones por las cuáles el modo, lugar y tiempo de la Propuesta se estructuraron de una \nforma determinada. \nSegundo, la ANLA omitió implementar el principio de prevalencia del derecho sustancial \nsobre el derecho formal (que se deriva del numeral 11 del artículo 3 de la Ley 1437 de \n2011). Este principio le exige a la ANLA tomar decisiones en procura de la prevalencia de \n\nResolución No. 001893       Del 29 AGO. 2024          Hoja No. 19 de 40\n“POR LA CUAL SE RESUELVE UN RECURSO DE REPOSICIÓN”\nPágina 19 de 40\nlos fines materiales de los procedimientos. Por lo cual, considerando que la Propuesta logra \nel fin sustancial del Plan de Compensación, la ANLA debió aprobarla sin dilaciones. Lo \nanterior, debido a que desde una perspectiva sustancial la Propuesta cumple \nindiscutiblemente con lo requerido en el Plan de Compensación que ya fue aprobado por la \nANLA, mediante un acto administrativo que se encuentra ejecutoriado y en firme, motivo \npor el cual, si la ANLA aprobó el Plan, lo cierto es que ahora debe propender porque este \ncumpla con sus fines sustanciales, los cuáles se ven reflejados en la Propuesta. \nTercero, la ANLA omitió implementar el principio de acuerdo con el cual, nadie está \nobligado a lo imposible, el cual ha sido reconocido en múltiples pronunciamientos del \nConsejo de Estado. Este principio le exige a la ANLA abstenerse de exigir el cumplimiento \nde obligaciones cuyo objeto se ha tornado sustancialmente imposible, ya sea bien técnica \no jurídicamente. Así las cosas, en el caso en concreto, la ANLA debió valorar las \nlimitaciones que la Compañía le explicó al momento de presentar la Propuesta. Una \nadecuada valoración de estas consideraciones le habría permitido a la ANLA entender las \nrazones fácticas que imposibilitaban presentar algo distinto. En otras palabras, si la ANLA \nhubiese considerado los argumentos de la imposibilidad de ejecutar la obligación en los \ntérminos de la Resolución 331, la autoridad habría aprobado la Propuesta y, \nconsecuentemente, el contenido del Auto sería sustancialmente diferente. Sin embargo, en \nel caso en concreto la ANLA evidentemente no aplicó este principio y, por lo tanto, negó la \nPropuesta en contravía del mismo.  \nCuarto, la ANLA omitió implementar el principio de eficacia (previsto en el numeral 11 del \nartículo 3 de la Ley 1437 de 2011). Lo cierto es que, en virtud de este principio la ANLA \ndebió abstenerse de no aprobar la Propuesta y, si consideraba necesario que esta tuviera \najustes menores, debió hacer un requerimiento de información adicional, pero no debió \nnegar la Propuesta. Toda vez que, el principio de eficacia le exige a las autoridades buscar \nque los procedimientos logren su finalidad y, para el efecto, deben remover de oficio los \nobstáculos puramente formales.\n7.1.3.3. En cuanto a los indicadores de seguimiento de la Propuesta, la ANLA también \nincurrió en falsa motivación, veamos: \n“Tal como se mencionó en la evaluación del COMO compensar, la Autoridad Nacional \nconsidera que la propuesta planteada por la Sociedad PETROLIFERA PETROLEUM \nCOLOMBIA LIMITED EN LIQUIDACIÓN no da cumplimiento a lo establecido en el artículo \nséptimo de la Resolución 311 del 12 de febrero de 2021, por tanto, en atención a que la \nacción principal planteada no se consideró viable de ejecutar en cumplimiento de la \ncompensación por aprovechamiento forestal y cambio de uso del suelo, no se realizará \npronunciamiento respecto los indicadores de seguimiento”.  \nEn la valoración de los indicadores el Concepto Técnico incurrió en falsa motivación, porque \nla ANLA si debió valorar los indicadores, considerando que la Propuesta si cumple con la \nResolución 311 del 12 de febrero de 2021. Es decir, como es falso lo indicado por el \nConcepto Técnico en el CÓMO compensar, también es falso lo indicado respecto de los \nindicadores, pues la Propuesta si cumple con lo requerido por la ANLA y los indicadores si \ndebieron ser valorados. \nAdemás de lo anterior, al momento de valorar los indicadores la ANLA también omitió \naplicar el principio de eficacia (previsto en el numeral 11 del artículo 3 de la Ley 1437 de \n\nResolución No. 001893       Del 29 AGO. 2024          Hoja No. 20 de 40\n“POR LA CUAL SE RESUELVE UN RECURSO DE REPOSICIÓN”\nPágina 20 de 40\n2011). Esto se debe a que este principio le exige a la autoridad abstenerse de tomar \ndecisiones inhibitorias y es claro que la ausencia de pronunciamiento técnico sobre los \nindicadores es absolutamente inhibitoria. Por lo tanto, si la ANLA hubiera tenido en cuenta \nel principio de eficacia, la decisión sobre los indicadores habría sido sustancialmente \ndiferente. \n7.1.3.4. En cuanto al cronograma de implementación, monitoreo y seguimiento de la \nPropuesta, la ANLA también incurrió en falsa motivación, veamos: \n“Tal como se mencionóó en la evaluación del COMO compensar, la Autoridad Nacional \nconsidera que la propuesta planteada por la Sociedad no da cumplimiento a lo establecido \nen el artículo séptimo de la Resolución 311 del 12 de febrero de 2021, por tanto, en atención \na que la acción principal planteada no se consideró viable de ejecutar en cumplimiento de \nla compensación por aprovechamiento forestal y cambio de uso del suelo, no se realizará \npronunciamiento respecto al cronograma, Implementación, monitoreo y seguimiento”. \nEn la valoración del cronograma de la Propuesta, el Concepto Técnico incurrió en falsa \nmotivación. Esto se debe a que la ANLA si debió valorar los indicadores, considerando que \nla Propuesta si cumple con los fines ustanciales del Plan de Compensación. Es decir, como \nes falso lo afirmado por el Concepto Técnico en cuánto al CÓMO compensar de la \nPropuesta, también es falso lo señalado en dicho documento respecto del cronograma de \nla Propuesta. En otras palabras, la Propuesta si cumple con lo requerido por la ANLA en el \nPlan de Compensación y, en consecuencia, el cronograma de implementación, monitoreo \ny seguimiento si debió ser valorado en el Concepto Técnico. \nAdemás de lo anterior, al momento de valorar el cronograma la ANLA también omitió aplicar \nel principio de eficacia (previsto en el numeral 11 del artículo 3 de la Ley 1437 de 2011). \nEsto se debe a que este principio le exige a la autoridad abstenerse de tomar decisiones \ninhibitorias y es claro que la ausencia de pronunciamiento técnico sobre el cronograma es \nabsolutamente inhibitoria. Por lo tanto, si la ANLA hubiera tenido en cuenta el principio de \neficacia, la decisión sobre el cronograma habría sido sustancialmente diferente. \n7.1.3.5. Finalmente, la conclusión a la que llega el Concepto Técnico sobre la \nPropuesta es falsa, pues se fundamenta en toda la línea argumentativa falsa que se \nevidenció en puntos anteriores, veamos: \n“Teniendo en cuenta la evaluación realizada por la Autoridad Nacional respecto a la \n“PROPUESTA DE AJUSTE DEL PLAN DE COMPENSACIÓN POR APROVECHAMIENTO \nFORESTAL Y CAMBIO DEL USO DEL SUELO” presentada por la Sociedad mediante \ncomunicación con radicado ANLA 20236200655952 del 26 de septiembre de 2023, se \nconsidera que esta NO ES VIABLE DE SER ACEPTADA, por cuanto no da cumplimiento a \nlo requerido en el artículo séptimo de la Resolución 311 del 12 de febrero de 2021”. \nComo ya se evidenció, la conclusión anterior se deriva de una línea argumentativa falsa en \nla que incurrió la ANLA en el Concepto Técnico, pues no se analizaron múltiples \nconsideraciones técnicas, fácticas y jurídicas que de haber sido tenidas en cuenta, habrían \ngenerado una decisión sustancialmente diferente a la contenida en la Resolución. En otras \npalabras, si la ANLA hubiese tenido en cuenta todas las consideraciones técnicas, fácticas \ny jurídicas que la Compañía expuso al presentar la Propuesta, la ANLA la habría aprobado, \n\nResolución No. 001893       Del 29 AGO. 2024          Hoja No. 21 de 40\n“POR LA CUAL SE RESUELVE UN RECURSO DE REPOSICIÓN”\nPágina 21 de 40\ncontrario a lo que hizo en la Resolución. Esto, debido a que la autoridad habría evidenciado \nla imposibilidad de ejecución que la Compañía ha puesto de manifiesto. \nAsí las cosas, el Concepto Técnico contiene errores respecto de la valoración de la situación \nfáctica y jurídica del caso que derivan en que la Resolución esté falsamente motivada. \nRazón por la cual, la ANLA debe revocar la Resolución y, en su lugar, aprobar la Propuesta.  \n7.1.4. Consideraciones finales sobre la falsa motivación: Con fundamento en lo \nexpuesto a lo largo del Capítulo 7.1. de este recurso, la Resolución se encuentra falsamente \nmotivada, a la luz del principio de motivación de los actos administrativos y de la \njurisprudencia del Consejo de Estado. Esto quedó evidenciado con la exposición de la \nnormativa sobre falsa motivación que expuso la Compañía, las consideraciones fácticas, \ntécnicas y jurídicas expuestas que evidencian la falsedad de los motivos de la Resolución; \ny la recapitulación sobre los motivos contenidos en el análisis que la ANLA efectuó sobre \ncada uno de los elementos de la Propuesta. \n7.2. VULNERACIÓN DEL PRINCIPIO DE CONFIANZA LEGÍTIMA \nLa Resolución vulnera la confianza legítima que la Compañía tiene de que la ANLA analice \nel Plan de Compensación con unidad de criterio en los tres expedientes a los que se refiere \ny que, en consecuencia, apruebe la Propuesta, veamos: \n7.2.1. Normativa sobre confianza legítima: previo a evidenciar la vulneración del principio \nde confianza legítima en el que incurrió la ANLA, es necesario recordar que de acuerdo con \nlas Sentencias T-244 de 2012, T-386 de 2013 y T-715 de 2014 de la Corte Constitucional, \nel principio de confianza legítima se deriva del principio de buena fe previsto en el artículo \n83 de la Constitución Política, en tanto que: “Tal norma constitucional ha sido desarrollada \npor esa corporación, indicando que las relaciones con la comunidad han de ceñirse a ese \nprincipio, lo que implica, de una parte, el deber de proceder con lealtad en las relaciones \njurídicas y, de otra, el derecho a esperar que los demás obren de la misma forma. Ello se \npredica de todas las relaciones comunitarias y asume especial relevancia cuando participa \nla administración pública, en cualquiera de sus formas, dado el poder del que se encuentra \ninvestida. De tal manera, toda la actividad del Estado se ha de desarrollar dentro del respeto \nal acto propio y la confianza legítima. La Corte Constitucional ha indicado que es deber de \nla administración actuar en sus relaciones jurídicas con los particulares de manera \nconsecuente con sus conductas precedentes, de manera que los administrados no se vean \nsorprendidos con conductas que resulten contrarias a sus expectativas legítimamente \nfundadas, basado como está el principio de confianza legítima en que las autoridades \npúblicas no pueden alterar, en forma inopinada, las reglas que gobiernan las relaciones del \nEstado con los asociados.”. \nPor su parte, la Sentencia T-084 de 2015 de la Corte Constitucional precisó que la confianza \nlegítima: “(…) se traduce en una prohibición impuesta a los órganos de la administración \npara modificar determinadas situaciones jurídicas originadas en actuaciones precedentes \nque generan expectativas justificadas (y en ese sentido legítimas) en los ciudadanos, con \nbase en la seriedad que -se presume- informa las actuaciones de las autoridades públicas, \nen virtud del principio de buena fe y de la inadmisibilidad de conductas arbitrarias, que \ncaracteriza al estado constitucional de derecho.”. \n\nResolución No. 001893       Del 29 AGO. 2024          Hoja No. 22 de 40\n“POR LA CUAL SE RESUELVE UN RECURSO DE REPOSICIÓN”\nPágina 22 de 40\nAsimismo, en la Sentencia de Unificación 00031 de 2019 el Consejo de Estado estableció \nque la confianza legítima supone corroborar los siguientes hechos: “(…) La confianza \nlegítima supone corroborar que existen hechos claros, precisos y contundentes, de los que \nse puede concluir la voluntad estatal encaminada a producir determinados efectos jurídicos, \nasí como la confianza de los administrados en tales mandatos. (…) En segundo lugar y a \npartir de las circunstancias objetivas verificadas, se requiere la legitimidad de la confianza, \nes decir, que la convicción del destinatario sea genuina, ajustada al derecho y a la razón y \npor tanto justificada en razón a la existencia de las circunstancias objetivas en las que confió \n(…) En tercer lugar, se requiere que exista toma de decisiones u oposiciones jurídicas \nbasadas en la confianza. En otras palabras, se requiere la exteriorización de la confianza \ndel administrado, actuando u omitiendo una conducta ante el Estado. (…) En cuarto lugar, \nes necesaria la defraudación de la confianza legítima, esto es, que se presente una \nactuación intempestiva e inesperada de la autoridad que, de manera evidente y razonable, \nmodifique las reglas que rigen las relaciones entre los administrados y el Estado”. \n7.2.2. Vulneración de la confianza legítima en el caso en concreto: Explicado lo anterior, \nla Compañía procede a evidenciar que la Resolución vulnera la confianza legítima que la \nCompañía tiene de que la ANLA analice el Plan de Compensación con unidad de criterio \nen los tres expedientes a los que se refiere y que, en consecuencia, apruebe la Propuesta, \nveamos \n7.2.2.1. Hechos claros, precisos y contundentes de los que se desprende la voluntad de la \nANLA: \n7.2.2.1.1. La Resolución 311 de 12 de febrero de 2021, por medio de la cual la ANLA aprobó \nel Plan de Compensación, es un hecho del que se desprende la voluntad clara, precisa y \ncontundente de la ANLA de aprobar un Plan de Compensación conjunto para tres \nexpedientes diferentes. Con la aprobación de un Plan de Compensación conjunto, se \nconforma la voluntad de tratarlo como tal, es decir, la voluntad de remitirlo de manera \nindependiente a cada expediente, pero tratarlo como un único plan, con un posterior \nseguimiento ambiental individual, pero que se rija bajo la unidad de criterio. Es decir, si la \nANLA aprobó el Plan de Compensación es porque reconoció la viabilidad de tratarlo como \nun documento uniforme, que si bien sería allegado a tres expedientes distintos, sería tratado \nbajo parámetro de unidad de criterio en los tres seguimientos diferentes, al tratarse de un \nmismo documento técnico. \n7.2.2.1.2. En línea con lo anterior, el Auto 000866 del 27 de febrero de 2024, proferido en \nel marco del expediente LAM4155 es un hecho claro, preciso y contundente del que se \ndesprende la voluntad de la ANLA de aprobar las propuestas asociadas al Plan de \nCompensación, de manera uniforme en cada uno de los tres expedientes.  \n7.2.2.2. Convicción genuina y legítima de la Compañía: La convicción de la Compañía es \ngenuina y legítima porque se desprende de dos actos administrativos proferidos por la \nANLA en virtud de sus facultades de seguimiento y control. Ambos actos administrativos se \nencuentran ejecutoriados y en firme y gozan de la presunción de legalidad, en virtud de lo \ndispuesto en los artículos 87 y 88 de la Ley 1437 de 2011. Motivo por el cual, la convicción \nde la Compañía de que la ANLA evaluaría el Plan de Compensación y sus propuestas de \nmanera uniforme en los 3 expedientes y que, en consecuencia, aprobaría la Propuesta, se \ndesprende de actos ejecutoriados y en firme que se presumen legales, a saber: Resolución \n\nResolución No. 001893       Del 29 AGO. 2024          Hoja No. 23 de 40\n“POR LA CUAL SE RESUELVE UN RECURSO DE REPOSICIÓN”\nPágina 23 de 40\n311 de 12 de febrero de 2021 (expediente LAM4269) y Auto 000866 del 27 de febrero de \n2024 (expediente LAM4155). \n7.2.2.3. La Resolución se opone manifiestamente a la voluntad que la ANLA ha manifestado \nen otras actuaciones: La Resolución (expediente LAM4269) se opone manifiestamente a la \nvoluntad plasmada por la ANLA en el Auto 000866 del 27 de febrero de 2024 (expediente \nLAM4155). En dicho auto la ANLA revisó una propuesta relacionada con el Plan de \nCompensación en el caso del expediente LAM4155 y, en vez de no aprobar esa propuesta, \nhizo requerimientos información adicional. Por el contrario, en el caso de la Resolución la \nANLA valoró la Propuesta y no la aprobó, en vez de hacer requerimientos de información \nadicional como lo hizo en el expediente (expediente LAM4269). Motivo por el cual, ante \ndocumentos y situaciones de hecho iguales, al tratarse ambas propuestas del Plan de la \nCompensación, la ANLA hizo un cambio intempestivo e injustificado de su postura, \nexpidiendo la Resolución que se opone manifiestamente a la voluntad plasmada en el Auto \n000866 del 27 de febrero de 2024 (expediente LAM4155). \n7.2.2.4. Defraudación de la confianza legítima de la Compañía: La Resolución defraudó la \nconfianza legítima de la Compañía. Lo anterior, debido a que la Compañía tenía una \nconfianza legítima basada en actos administrativos ejecutoriados y legales (Resolución 311 \nde 2021 y Auto 000866 de 2024) y por medio de la Resolución la ANLA intempestivamente \ncambió la voluntad plasmada en dichos actos. \n7.2.3. Consideraciones finales sobre la confianza legítima: La ANLA vulneró la \nconfianza legítima que la Compañía tiene sobre la postura de la autoridad ante el Plan de \nCompensación y sus criterios de evaluación. Por lo tanto, la Resolución debe ser revocada \ny, en su lugar, la ANLA debe aprobar la Propuesta, con la finalidad de adoptar una decisión \ncomo la que fue tomada en el expediente, en virtud de la unidad de criterio que debe regir \nlas decisiones de las autoridades. \n7.3. VULNERACIÓN DEL DERECHO A LA IGUALDAD \nLa Resolución vulnera el derecho a la igualdad de la Compañía, porque le da un tratamiento \ndiferenciado injustificado a la Compañía respecto al tratamiento otorgado por la ANLA a la \nmisma sociedad en el Auto 000866 de 2024, veamos.\n7.3.1. Normativa sobre el derecho a la igualdad: El preámbulo y el artículo 13 de la \nConstitución Política, obligan a la ANLA a darle el mismo tratamiento a todos los titulares \nde licencias ambientales. Por un lado, la igualdad es un principio constitucional consagrado \nen el preámbulo y transversal al ordenamiento jurídico, de acuerdo con el cual toda función \nadministrativa se debe ejercer de forma igual en todos los casos, evitando situaciones de \ndiscriminación para ciertos sujetos. Por otro lado, la igualdad es un derecho fundamental \nde la Compañía que se encuentra consagrado en el artículo 13 constitucional y que la \nprotege de cualquier trato discriminatorio por parte de las autoridades ambientales. En este \nsentido, la Constitución Política le exige a la ANLA tratar a la Compañía de la misma forma \nque trataría a cualquier otro sujeto que se encuentra en sus mismas condiciones. \nEn línea con lo anterior, la Compañía le recuerda a la ANLA que la Corte Constitucional ha \nsido reiterativa en la importancia de la garantía de la igualdad en su doble dimensión de \nprincipio y derecho. Sobre el particular, se resaltan las siguientes reglas jurisprudenciales \ncontenidas en la Sentencia C-178 de 2014: \n\nResolución No. 001893       Del 29 AGO. 2024          Hoja No. 24 de 40\n“POR LA CUAL SE RESUELVE UN RECURSO DE REPOSICIÓN”\nPágina 24 de 40\n“El principio de igualdad es uno de los elementos más relevantes del Estado constitucional \nde derecho. Este principio, en términos generales, ordena dar un trato igual a quienes se \nencuentran en la misma situación fáctica, y un trato diverso a quienes se hallan en distintas \ncondiciones de hecho. Esta formulación general no refleja sin embargo (sic) la complejidad \nque supone su eficacia en un orden jurídico orientado bajo los principios del Estado Social \nde Derecho, ni deja en claro qué elementos son relevantes para el derecho al momento de \nverificar las condiciones de hecho, considerando que todas las personas y situaciones \npresentan semejanzas y diferencias. \nPor ese motivo, la Sala recuerda que este principio es un mandato complejo en un Estado \nSocial de Derecho. De acuerdo con el artículo 13 Superior, comporta un conjunto de \nmandatos independientes y no siempre armónicos, entre los que se destacan (i) la igualdad \nformal o igualdad ante la ley, relacionada con el carácter general y abstracto de las \ndisposiciones normativas dictadas por el Congreso de la República y su aplicación uniforme \na todas las personas; (ii) la prohibición de discriminación, que excluye la legitimidad \nconstitucional de cualquier acto (no solo las leyes) que involucre una distinción basada en \nmotivos definidos como prohibidos por la Constitución Política, el derecho internacional de \nlos derechos humanos, o bien, la prohibición de distinciones irrazonables; y (iii) el principio \nde igualdad material, que ordena la adopción de medidas afirmativas para asegurar la \nvigencia del principio de igualdad ante circunstancias fácticas desiguales” (subrayado fuera \ndel texto original). \n7.3.2. Vulneración de la igualdad en el caso en concreto: Al momento de expedir la \nResolución la ANLA estaba llamada a aplicar tres de las reglas jurisprudenciales anteriores, \na saber: (i) dar un trato igual a todos los expedientes asociados al Plan de Compensación; \n(ii) evitar la discriminación de la Compañía en el expediente LAM4269 frente a otros \nexpedientes; y (iii) asegurar la igualdad material de la Compañía en el expediente LAM4269. \nEn términos específicos, la aplicación de estas reglas jurisprudenciales en el caso en \nconcreto se ve de la siguiente manera: \n7.3.2.1. “dar un trato igual a todos los expedientes asociados al Plan de Compensación”: \nLa ANLA no le puede dar un tratamiento diferente a la Compañía en el expediente \nLAM4269, frente al tratamiento que le dio en el expediente LAM4155. En ambos \nexpedientes aplica el mismo Plan de Compensación y se han presentado propuestas de la \nmisma naturaleza, es decir, ambo expedientes se encuentran en la misma situación de \nhecho, por lo cual, la ANLA estaba llamada a darles un trato igual; \n7.3.2.2. “evitar la discriminación de la Compañía en el expediente LAM4269 frente a otros \nexpedientes”: La ANLA debe evitar la discriminación de la Compañía respecto de otros \nusuarios/expedientes. En este caso, eso se traduce en que la ANLA debe evitar que un \ntrato discriminatorio en la evaluación que hace el Plan de Compensación y sus propuestas \nen cada uno de los tres expedientes. Por ende, la autoridad debe evitar tratar de forma \ndistinta a la Compañía en el expediente LAM4269 y en el expediente LAM4155. \n7.3.2.3. “asegurar la igualdad material de la Compañía en el expediente LAM4269”: La \nANLA estaba llamada a adoptar una decisión en la Resolución que asegurase la igualdad \nmaterial de la Compañía en el expediente LAM4269, respecto de lo decidido en el \nexpediente LAM4155. Esta igualdad material implica que, más allá de la literalidad de las \ndecisiones de la ANLA, en la vida real y en la ejecución de esas decisiones, la Compañía \n\nResolución No. 001893       Del 29 AGO. 2024          Hoja No. 25 de 40\n“POR LA CUAL SE RESUELVE UN RECURSO DE REPOSICIÓN”\nPágina 25 de 40\nse encuentre en igualdad de condiciones en los tres expedientes asociados al Plan de \nCompensación.\n7.3.3. Consideraciones finales sobre la vulneración de la igualdad: Con fundamento en \nla interpretación jurisprudencial anterior, si la ANLA no revoca la Resolución, estará \nconfirmando un acto administrativo cuyo contenido es contrario al derecho a la igualdad de \nla Compañía. Por ende, en reemplazo de la Resolución, la ANLA debe adoptar una nueva \ndecisión tendiente a aprobar la Propuesta, de manera que, los expedientes LAM4269 y \nLAM4155 se encuentren en igualdad de condiciones. En este sentido, la ANLA debe \nrevocar la Resolución y en su lugar, debe aprobar la Propuesta o, en su defecto, solicitarle \ninformación adicional a la Compañía para tomar una decisión de fondo posterior.”\n1.3. Consideraciones de la Autoridad Nacional\nLos argumentos de inconformidad presentados por el recurrente fueron objeto de \nevaluación por el equipo técnico de la Autoridad Nacional y mediante Concepto técnico \n5755 del 8 de agosto de 2024, se presentaron las siguientes consideraciones:\n“En respuesta a las apreciaciones realizadas por la sociedad PETROLIFERA PETRO \nCOLOMBIA LIMITED en relación con la Resolución 973 del 27 de mayo de 2024, emitida \npor la Autoridad Nacional, inicialmente se expone al interesado que la Autoridad Nacional \ntiene como misión contribuir al desarrollo sostenible del país, con excelencia en la \nevaluación y el seguimiento de las licencias, permisos y trámites ambientales, por lo que, \nen el marco del seguimiento ambiental que se realiza periódicamente al proyecto \n“Perforación Exploratoria Prospecto Brillante Sureste”, expediente LAM4269, el equipo de \ncompensación y 1% del grupo de valoración y manejo de impactos de la subdirección de \nseguimiento de la Autoridad Nacional realizó la evaluación y correspondiente \npronunciamiento en acto administrativo de la propuesta entregada por la Sociedad \nmediante radicado ANLA 20236200655952 del 26 de septiembre de 2023, para el \ncumplimiento de la obligación de compensación ambiental por aprovechamiento forestal y \ncambio de uso del suelo, en los términos establecidos en la licencia ambiental del proyecto, \nque corresponde a la Resolución 320 del 18 de febrero de 2009 y modificada por la \nResolución 1079 del 9 de junio de 2011, y la normatividad ambiental relacionada con las \ncompensaciones bióticas, vigente y aplicable tal y como se describe a continuación.\nEn primera instancia, cabe recordar que, por los impactos generados por las intervenciones \ndel proyecto, la Sociedad tiene la obligación de realizar las acciones de compensación en \nlos términos antes descritos en 24,264 ha, acorde con lo que se describen a continuación:\nTabla 1 Consolidado de áreas por compensar.\nProyecto\nActividad\nÁrea \nintervenida (ha)\nCobertura \nvegetal\nFC\nÁrea \npor \ncompensar (ha)\nPozo \nBrillante \nSur Este 1\nLocación\n2\nPastos\n1:1\n2\nLocación\n0,905\nPastos \nArbolados\n1:5\n4,525\nPozo \nBrillante \nSur Este 2\nVía \nde \nAcceso\n0,413\nRastrojo bajo\n1:3\n1,239\nPozo \nFlorida \nOeste 1\nLocación\n0,82\nPastos \nArbolados\n1:5\n4,1\n\nResolución No. 001893       Del 29 AGO. 2024          Hoja No. 26 de 40\n“POR LA CUAL SE RESUELVE UN RECURSO DE REPOSICIÓN”\nPágina 26 de 40\nVía \nde \nAcceso\n2,48\nPastos \nArbolados\n1:5\n12,4\nTOTAL\n6,18\n-\n-\n24,264\nFuente: Elaborado por el Grupo de Valoración y Manejo de Impactos en procesos de \nSeguimiento (GVMIS) a partir de la información contenida en el radicado ANLA \n20236200655952 del 26 de septiembre de 2023\nLo anterior acorde con el artículo décimo primero de la Resolución 1079 del 9 de junio de \n2011, que modificó el artículo cuarto de la Resolución 320 del 18 de febrero de 2009, y que \nestableció la medida de compensación por aprovechamiento forestal y cambio de uso de \nsuelo, en los siguientes términos:\n“ARTÍCULO DÉCIMO PRIMERO Modificar el Artículo Cuarto de la Resolución 320 del 18 de \nfebrero de 2009, en el sentido de otorgar permiso de aprovechamiento forestal así:\n(…)\n4. APROVECHAMIENTO FORESTAL\nOtorgar a la empresa PETROLÍFERA PETROLEUM (COLOMBIA) LTD., permiso de \nAprovechamiento Forestal Único para el desarrollo del proyecto “Perforación Exploratoria del \nProspecto Brillante Sureste”, así:”.\n(…)\nCompensación forestal\nComo medida de compensación por aprovechamiento forestal y cambio de uso de suelo, la \nEmpresa deberá realizar el establecimiento de especies nativas en las cuencas hidrográficas \ny enriquecimiento en áreas de bosque de galería dentro del área de influencia del proyecto en \nuna proporción de 1:10, es decir que por cada árbol talado se deberán plantar 10 árboles \ncuando la intervención sea en bosque de galería y 1:5 cuando la intervención se realice en \náreas de pastos arbolados. \nPor otra parte, teniendo en cuenta la intervención en áreas de rastrojo y matorral espinoso, se \ndeberá realizar una compensación por área intervenida así: 1:3 en áreas con rastrojo alto, bajo \ny matorral espinoso y 1:1 cuando se realice en áreas pastos. La compensación se deberá \nrealizar en sitios concertados con CORPAMAG. La reforestación debe ser realizada con \nespecies propias de la región y el mantenimiento debe efectuarse durante un período mínimo \nde tres (3) años, al cabo de dicho tiempo la plantación deberá garantizar una supervivencia \nde 85% y una altura promedio de 1,5 metros. La empresa debe contar con la asesoría técnica \nde personal experto en programas de reforestación. Para el desarrollo de esta obligación la \nEmpresa deberá consultar y solicitar el concepto de la Corporación, y presentarlo a este \nMinisterio. En caso que la Corporación no se pronuncie dentro del mes siguiente a la \nradicación de la solicitud de la Empresa, se entenderán por acertadas las determinaciones \nque adopte este Ministerio, situación que se produce con la remisión de la copia radicada ante \nla Corporación.” \nPARÁGRAFO. Además del cumplimiento del programa MB-6 Programa de Compensación \npara el Medio Biótico del PMA, la Empresa deberá dar cumplimiento a las obligaciones \nestablecidas en el Artículo Quinto de la Resolución No 320 del 18 de febrero de 2009.”\n\nResolución No. 001893       Del 29 AGO. 2024          Hoja No. 27 de 40\n“POR LA CUAL SE RESUELVE UN RECURSO DE REPOSICIÓN”\nPágina 27 de 40\nEs así como, el argumento expuesto por la Sociedad en el que señala que “7.1.2.2. Esta \npropuesta se encuentra dirigida a áreas de especial importancia al interior del Parque Nacional \nNatural Sierra Nevada de Santa Marta, en cumplimiento de la medida de compensación establecida \nen el artículo quinto (numerales c, d y e) de la Resolución 320 de 18 de febrero de 2009 y el parágrafo \ndel artículo décimo primero de la Resolución 1079 de 9 de junio de 2011, que posteriormente fueron \nmodificadas por la Resolución 00311 del 12 de febrero de 2021”, no es procedente teniendo en \ncuenta que, tal y como se señaló en los párrafos anteriores y en el Concepto Técnico 1545 \ndel 19 de marzo de 2024, insumo fundamental de la Resolución 973 del 27 de mayo de \n2024, la obligación inicial tiene un ámbito geográfico claramente establecido (Cuencas \nhidrográficas y enriquecimiento en áreas de bosque de galería dentro del área de influencia \ndel proyecto), y en el cual no se encuentran los predios propuestos, como se describió en \nel citado concepto técnico y se detalla más adelante.\nComo bien se mencionó en el Concepto Técnico 1545 del 19 de marzo de 2024, insumo \nfundamental de la Resolución 973 del 27 de mayo de 2024, como antecedentes al \ncumplimiento de la obligación de compensación, la Sociedad mediante radicado ANLA \n2019189191-1-000 del 2 de diciembre de 2019, remitió el Plan de Compensación por las \nactividades de construcción de locaciones y vías del proyecto “Perforación Exploratoria del \nProspecto Brillante Sureste”, el cual fue evaluado y aprobado mediante Concepto Técnico \n5836 del 18 de septiembre de 2020, acogido mediante la Resolución 311 del 12 de febrero \nde 2021.\nEn línea con lo anterior, en el artículo séptimo de la citada Resolución de aprobación se \nrequirió a la Sociedad la identificación de los propietarios y la georreferenciación de los \npolígonos específicos para el establecimiento de especies nativas en las cuencas \nhidrográficas y enriquecimiento en áreas de bosque de galería, localizadas dentro de las \nalternativas propuestas por la Sociedad y aprobadas por la Autoridad Nacional.\nTal y como se mencionó en el Concepto Técnico 1545 del 19 de marzo de 2024, insumo \nfundamental de la Resolución 973 del 27 de mayo de 2024, en el documento con radicado \nANLA 20236200655952 del 26 de septiembre de 2023 la Sociedad describió las actividades \ndesarrolladas para la ejecución del plan de compensación aprobado, por cuanto intentó \nestablecer comunicación con CORPAMAG, con el objeto de identificar en conjunto algunos \npredios específicos que fueran de interés para el establecimiento de las reforestaciones en \nlos términos establecidos por la Autoridad Nacional.\nDadas las dificultades en la comunicación con la Corporación, la Sociedad señaló que \nrealizó la verificación de los posibles predios cuyos propietarios mostraran interés en el \ndesarrollo de acciones de reforestación; sin embargo, la vocación de uso del suelo en las \náreas inicialmente priorizadas por la Sociedad dificulta la implementación de estas \nactividades teniendo en cuenta que en el área se establecen reforestaciones con carácter \ncomercial, y por tanto, no es del interés de los propietarios disponer áreas exclusivas para \nla protección o recuperación de la vegetación, y por otra parte, la presencia de vegetación \ntipo bosque de galería es reducido.\nEn línea con lo anterior, la Sociedad señaló que propuso a la comunidad la adquisición de \nlas posibles áreas para la compensación, sin embargo, la Sociedad desistió de esta \nposibilidad dadas las condiciones jurídicas de los predios, que podían a futuro dificultar la \ncesión de las áreas a las entidades competentes.\n\nResolución No. 001893       Del 29 AGO. 2024          Hoja No. 28 de 40\n“POR LA CUAL SE RESUELVE UN RECURSO DE REPOSICIÓN”\nPágina 28 de 40\nEs así como, en el documento remitido mediante radicado ANLA 20236200655952 del 26 \nde septiembre de 2023, la Sociedad presentó, una nueva propuesta para la compensación \npor aprovechamiento forestal y cambio de uso de suelo de 24,264 ha, la cual consiste en la \nadquisición de predios destinados para la preservación y conservación del Parque Nacional \nNatural Sierra Nevada de Santa Marta, y que hace parte de la ampliación del área protegida, \ny la posterior entrega a Parques Nacionales Naturales, y cuyos argumentos técnicos la \nSociedad retoma nuevamente en la comunicación con radicado ANLA 20246200663912 \ndel 13 de junio de 2024, como parte de los argumentos del recurso de reposición interpuesto \nen contra de la Resolución 973 del 27 de mayo de 2024.\nEn línea con lo anterior, es necesario aclarar algunos aspectos relacionados con la \ninformación incluida en el radicado ANLA 20246200663912 del 13 de junio de 2024, la cual \nfue en su totalidad objeto de evaluación y pronunciamiento en la Resolución 973 del 27 de \nmayo de 2024, y que es objeto de recurso de reposición. Uno de los argumentos expuestos \npor la Sociedad en el recurso de reposición es el siguiente:\n“7.1.2.11. Conforme a la dificultad de ubicación de áreas que garantizaran la mejor oportunidad \nde compensación efectiva y que fueran destinadas a la reforestación en las áreas aprobadas \ny donde se pudiera garantizar la permanencia de la obligación, se continuó con la gestión en \nPNN proponiendo ejecutar la obligación de compensación del proyecto en la adquisición de \nun predio destinado para la preservación y conservación del Parque Nacional Natural Sierra \nNevada de Santa Marta que hace parte de la ampliación del área protegida.”\nCon relación a las gestiones sociales y posición de la comunidad frente a la compensación \nbiótica, si bien la Autoridad Nacional reconoce que el relacionamiento con la comunidad \npuede ser difícil y que en algunos casos la concertación o la generación de interés por las \ncompensaciones ambientales puede tener resultados nulos por las implicaciones o \nrestricciones en el libre desarrollo o explotación agrícola de estas áreas en el mediano o \nlargo plazo, la Sociedad no incluyó soportes que corroboren que, en efecto, la comunidad \nde las 532.550,61 ha que constituyen el área de influencia del proyecto, es decir, el ámbito \ngeográfico definido en la obligación para la compensación, no se encuentran interesados \nen participar voluntariamente del plan de compensación en los términos vigentes.\nPor otra parte, en el Concepto Técnico 5836 del 18 de septiembre de 2020, acogido \nmediante la Resolución 311 del 12 de febrero de 2021, la viabilización de las áreas \npreseleccionados dentro del portafolio de áreas priorizadas para reforestar en el \n[D]epartamento del Magdalena tiene como principal criterio el ámbito geográfico impuesto \nen la Resolución 1079 de 9 de junio de 2011 que modificó la Resolución 320 de 18 de \nfebrero de 2009, es decir, “[L]as cuencas hidrográficas (…) en áreas de bosque de galería dentro \ndel área de influencia del proyecto”. Así las cosas, en el citado concepto técnico se estableció \nque las alternativas viables, por encontrarse dentro de la cuenca del río Ariguaní ([Á]rea de \ninfluencia indirecta) eran la alternativa uno (1) sobre el arroyo Cacagüero y las rondas \nmenores en el [M]unicipio de Sabanas de San Ángel, y la alternativa dos (2) en la ribera del \nrío Ariguaní en el [M]unicipio de El Difícil ambas pertenecientes al Complejo ribereño de los \nríos Cesar y Ariguaní.\nEstas dos (2) alternativas suman un área total de 4670,69 ha, de las cuales, la Sociedad \nseñala que realizó la validación de aproximadamente 780 ha correspondientes a cuatro \npredios, lo cual corresponde al 17% (Aproximado), del total del área viabilizada (Alternativas \n1 y 2), y al 0,14 % del ámbito geográfico establecido, es decir la cuenca del río Ariguaní \n\nResolución No. 001893       Del 29 AGO. 2024          Hoja No. 29 de 40\n“POR LA CUAL SE RESUELVE UN RECURSO DE REPOSICIÓN”\nPágina 29 de 40\n(Área de influencia indirecta). Si bien, la Autoridad Nacional no desconoce las gestiones \nrealizadas con el objeto de establecer un predio para el desarrollo de la reforestación, el \nárea a partir de la cual la Sociedad señala el imposible cumplimiento de la obligación en los \ntérminos establecidos no es representativa, toda vez que no supera el 20% si solamente se \nconsideran las dos (2) alternativas que fueron aprobadas en la Resolución 311 del 12 de \nfebrero de 2021.\nAsí las cosas, y atendiendo al argumento presentado por la Sociedad mencionando que \n“[L]a ANLA omitió implementar el principio de acuerdo con el cual, nadie está obligado a lo imposible”, \nel porcentaje, la Sociedad cuenta con cerca del 80% del área viabilizada en la Resolución \n311 del 12 de febrero de 2021 y casi el 100% del área definida como “Área de influencia”, \npara explorar posibilidades para el cumplimiento de la obligación de compensación, por lo \nque no es cierto que se esté “Obligando a lo imposible.”\nPor otra parte, en el documento con radicado ANLA 20236200655952 del 26 de septiembre \nde 2023, la Sociedad presentó una propuesta para el cumplimiento de la obligación de \ncompensación en los términos inicialmente establecidos en el artículo décimo primero de \nla Resolución 1079 del 9 de junio de 2011, esto es: “El establecimiento de especies \nnativas en las cuencas hidrográficas y enriquecimiento en áreas de bosque de galería \ndentro del área de influencia del proyecto”, y en cumplimiento del plan de \ncompensación aprobado en la Resolución 311 del 12 de febrero de 2021. \nEn línea con lo anterior, la Sociedad no presentó una propuesta para la ejecución de un \n“[E]stablecimiento de especies nativas”, por el contrario, la propuesta describe la \nejecución de unas acciones que, si bien cuentan con una justificación técnica enfocada en \nla situación actual y vulnerabilidad de las coberturas vegetales forestales dentro del Parque \nNacional Natural Sierra Nevada de Santa Marta, las cuales han disminuido en área, no hay \nuna justificación clara en cuanto a cómo la actividad de compra de predios se relaciona \ndirectamente con la compensación por los impactos generados por las intervenciones del \nproyecto.\nEn ese sentido, si bien la Sociedad en el documento entregado mediante radicado ANLA \n20236200655952 del 26 de septiembre de 2023, incluyó un resumen “(…) de la información \ndisponible en el Plan de Manejo del PNN SNSM3 construido de forma colectiva con las comunidades \nancestrales; con el objetivo de evidenciar el contexto de conservación que se quiere apoyar con el \ncambio de la obligación de compensación a través de reforestación por la compra de predios y \ntrabajo conjunto con la comunidad Kogui en el Parque Sierra Nevada de Santa Marta.”, la \nevaluación de esta información en el Concepto Técnico 1545 del 19 de marzo de 2024, \ninsumo fundamental de la Resolución 973 del 27 de mayo de 2024, concluyó que la \nlocalización geográfica de la propuesta no es coherente y pertinente con el área en la cual \nfueron generados los impactos por las actividades del proyecto, como se describe en detalle \nmás adelante.\nAsí las cosas, en el Concepto Técnico 1545 del 19 de marzo de 2024, insumo fundamental \nde la Resolución 973 del 27 de mayo de 2024, se realizó la evaluación de las áreas \npropuestas para la adquisición de predios para la compensación de las áreas intervenidas \npor aprovechamiento forestal y cambio del uso del suelo para las cuales la Sociedad \npropone como ejecución de la obligación de compensación por aprovechamiento forestal y \n3 Parque Nacional Natural Sierra Nevada de Santa Marta\n\nResolución No. 001893       Del 29 AGO. 2024          Hoja No. 30 de 40\n“POR LA CUAL SE RESUELVE UN RECURSO DE REPOSICIÓN”\nPágina 30 de 40\ncambio de uso del suelo de 24,264 ha, y se incluyeron, entre otras, las siguientes \nconsideraciones:\n“Respecto a lo planteado por la Sociedad se le recuerda, que la información de los polígonos \ndonde desarrollara la obligación de compensación del proyecto Perforación Exploratoria del \nProspecto Brillante Sureste (24,264 ha) corresponde únicamente al cumplimiento de las \nobligaciones del Plan de Compensación Forestal (Cumplimiento de la FICHA: MB-6.1 Por \naprovechamiento de la Cobertura Vegetal), establecidas en los artículos primero al séptimo de la \nResolución 311 del 12 de febrero de 2021, sin abarcar el cumplimiento por afectación paisajística, \ny compensación por afectación de fauna del Plan de Manejo (Ficha MB-6.2 y Ficha MB-6.3 \nrespectivamente).\nLo anterior obedece a que la Sociedad dentro de la propuesta de “Adquisición de predios en áreas \no ecosistemas de interés estratégico para la conservación de los recursos naturales, en el área \nde ampliación del PNN SNSM”, incluye las actividades a realizar dentro de los predios a adquirir, \npara dar cumplimiento a las fichas de manejo MB-6.2 Por Afectación Paisajística, y MB-6.3 \nCompensación por Fauna.\n(…)\nAsí las cosas, la Sociedad propone dos (2) polígonos ubicados en el Parque Nacional Natural \nSierra Nevada de Santa Marta, con el fin de dar cumplimiento a las medidas de compensación \nque fueron establecidas en el plan de compensación forestal aprobado en la Resolución 311 del \n12 de febrero de 2021.\n(…)\nVale la pena mencionar que la Sociedad, dentro del documento de propuesta de adquisición de \npredios en el PNN SNSM, integra la propuesta de compra de predios para dos (2) expedientes \nlocalizados en el sur del departamento del Magdalena, y que cuentan con el mismo titular del \ninstrumento de manejo de control, que para el caso corresponde a la sociedad PETROLIFERA \nPETROLEUM COLOMBIA LIMITED (LAM4155 APE La Pinta 1 y el LAM4269 APE Brillante \nSureste).\nAl respecto, la Autoridad Nacional considera pertinente mencionar que en el Auto 866 del 27 de \nfebrero de 2024 del expediente LAM4155, el cual acogió el concepto técnico 347 del 31 de enero \nde 2024, se realizaron consideraciones frente a la información presentada por la sociedad \nPETROLIFERA PETROLEUM COLOMBIA LIMITED mediante la comunicación con radicado \nANLA 2023056097-1-000 del 17 de marzo del 2023, relacionada con la “Propuesta Plan de \nCompensación por Aprovechamiento Forestal para el Área de Perforación Exploratoria La Pinta”, \npara el expediente LAM4155.\nAl respecto en el Auto en comento, la Autoridad Nacional consideró, en relación a la propuesta, \nque “ante la ausencia de insumos técnicos básicos para emitir un pronunciamiento de fondo sobre \nla aprobación del Plan de Compensación por aprovechamiento forestal, en la parte dispositiva de \neste proveído se establecerán las obligaciones a cargo de la Sociedad”, de acuerdo con lo \nanterior, debido a que la Sociedad no presentó la información suficiente que permitiera hacer el \nseguimiento y verificación del cumplimiento de la obligación, la Autoridad Nacional no pudo \nrealizar un pronunciamiento de fondo entorno a la propuesta remitida.\nPropuesta Agregada\nConforme a las necesidades de conservación identificadas en este Plan se propone ejecutar las \nobligaciones de compensación del Bloque Sierra Nevada es decir del APE Brillante Sureste \n\nResolución No. 001893       Del 29 AGO. 2024          Hoja No. 31 de 40\n“POR LA CUAL SE RESUELVE UN RECURSO DE REPOSICIÓN”\nPágina 31 de 40\nExpediente - LAM4249 (Pozos Brillante Sureste 1, 2 y Florida Oeste 1) y APE La Pinta Expediente \nLAM4155 (Pozo La Pinta 1X) con la compra de los dos predios focalizados por Parques \nNacionales. El área total por compensar de los dos expedientes corresponde a 34,764 Ha (Tabla \n16).\nPara cada expediente se realizará seguimiento de manera individual, de tal manera que el Área \nde perforación exploratoria La Pinta reportaría un área total de 31,5 Ha específicamente en el \npredio Las Delicias. Para el Área de interés de Perforación Exploratoria Brillante Sureste \nreportaría un área total de 72,792 Ha que se distribuye en todo el predio El Pensamiento y una \nparte del predio Las Delicias. En conjunto los dos proyectos (Expediente LAM4249 y LAM4155) \nestarían comprando en total 116,89 Ha en el PNN Sierra Nevada de Santa Marta (…)”.\nNo obstante lo anterior, la Autoridad Nacional ha realizado la evaluación para cada uno de los \nexpedientes citados y a continuación se relacionan las consideraciones particulares de acuerdo \ncon las obligaciones de la licencia y sus modificaciones que se han establecido respecto a la \ncompensación forestal del expediente LAM4269.\nLa Sociedad presenta como área de compensación (Área a adquirir), el predio Las Delicias y el \npredio El Pensamiento, ubicados en el corregimiento de Minguelo, municipio de Dibulla, \ndepartamento de La Guajira.\nDe acuerdo a la descripción de la Sociedad en el aparte anterior es de interés para el PNN SNSM \nlos predios en comento dentro del proceso de ampliación del área protegida. Bajo este contexto \nse procedió por parte de la Autoridad Nacional a validar la ubicación de los predios dentro del \npolígono del PNN SNSM a partir de la capa “Anexo 3.3 SHP/compensacion_delicias.shp” y \n“Anexo 3.3 SHP/compensacion_pensamiento.shp” del modelo de almacenamiento geográfico \npresentado por la Sociedad, la cual incluye los polígonos compensación Delicias de 56,2 ha \naproximadamente y compensación Pensamiento, el cual tiene un área de 60 ha (116,2 hectáreas \nen conjunto), los cuales se ubican dentro del polígono del PNN SNSM, tal y como se muestra a \ncontinuación:\n“(…)\nRespecto al ámbito geográfico para la compensación, el articulo décimo primero de la Resolución \n1079 del 9 de junio de 2011 establece al respecto que “Como medida de compensación por \naprovechamiento forestal y cambio de uso de suelo, la Empresa deberá realizar el \nestablecimiento de especies nativas en las cuencas hidrográficas y enriquecimiento en áreas de \nbosque de galería dentro del área de influencia del proyecto”. En el mismo sentido en el artículo \nprimero de la Resolución 311 del 12 de 2021 a través de la cual se evaluó el plan de \ncompensación por aprovechamiento forestal y cambio de uso del suelo estableció “Aprobar el \nPlan de Compensación por aprovechamiento forestal y cambio de uso del suelo del proyecto \ndenominado \"Perforación Exploratoria del Prospecto Brillante Sureste\", localizado en los \nmunicipios de Ariguaní (El Difícil), Santa Ana y El Pijiño del Carmen en el departamento del \nMagdalena”, especificando en su artículo séptimo que “desarrollará la obligación de \ncompensación del proyecto Perforación Exploratoria del Prospecto Brillante Sureste (24,264 ha), \nmediante actividades el establecimiento de especies nativas en las cuencas hidrográficas y \nenriquecimiento en áreas de bosque de galería localizadas dentro de la alternativa uno (1) sobre \nel arroyo Cacagüero y las rondas menores en el municipio de Sabanas de San Ángel y/o la \nalternativa dos (2) en la ribera del río Ariguaní en el municipio de El Difícil”, zonas circunscritas al \nárea de influencia del proyecto.\nDe tal forma, se tiene que desde un comienzo la Autoridad Nacional fue clara en el sentido de \nindicar que la compensación debe realizarse sobre las márgenes hídricas de los cuerpos de agua \ndel área de influencia del proyecto, frente a lo cual los predios las Delicias y El Pensamiento, se \nubican en el corregimiento de Minguelo, municipio de Dibulla, departamento de La Guajira, y por \n\nResolución No. 001893       Del 29 AGO. 2024          Hoja No. 32 de 40\n“POR LA CUAL SE RESUELVE UN RECURSO DE REPOSICIÓN”\nPágina 32 de 40\nconsiguiente fuera del ámbito geográfico del área de influencia del proyecto Perforación \nExploratoria del Prospecto Brillante Sureste.\n(…)\nRespecto a las coberturas presentes en los predios Las Delicias y El Pensamiento, se pudo \nevidenciar que las mismas corresponde a vegetación secundaria alta, herbazal denso inundable \nno arbolado, pastos limpios y cultivos transitorios, de tal forma que no se evidencia dentro de los \npredios, la presencia de la cobertura de bosque de galería, la cual fue la establecida dentro del \nacto administrativo como la receptora de las actividades de reforestación:\n(…)\nCon base en lo anterior, en cuanto a su ubicación y los criterios de selección contemplados, la \nAutoridad Nacional considera NO VIABLE ACEPTAR los predios Las Delicias y El Pensamiento, \nubicados en el corregimiento de Minguelo, municipio de Dibulla, departamento de la Guajira, para \nllevar a cabo las acciones del plan de compensación por aprovechamiento forestal y cambio de \nuso del suelo, establecidas en el artículo séptimo de la Resolución 311 del 12 de febrero de 2023.”\nAsí las cosas, los argumentos que motivaron a la Autoridad Nacional la no aprobación de \nla propuesta para la compensación del proyecto, están relacionados directamente con el \nincumplimiento con los aspectos de ámbito geográfico (Cuencas hidrográficas - áreas de \nbosque de galería dentro del área de influencia del proyecto) y acciones por desarrollar \n(Establecimiento de especies nativas y enriquecimiento en áreas de bosque de galería) que \nestableció la Autoridad Nacional en la obligación establecida.\nEn línea con lo anterior, el establecimiento de un ámbito geográfico para el cumplimiento \nde la obligación tiene por objeto que la compensación por el cambio de uso del suelo y \naprovechamiento forestal aporte en términos ecosistémicos y de biodiversidad en el área, \necosistema, región biogeográfica o subzona hidrográfica en la que fueron generados los \nimpactos. Al verificar la ubicación de los predios propuestos para la adquisición y entrega a \nPNN, la Autoridad Nacional evidenció que no comparten cercanía geográfica o una \nequivalencia o relación entre el ecosistema impactado por el proyecto con relación al \necosistema o área en la que se propone compensar, tal y como se observa en la siguiente \nfigura, y por tanto se constituyó como un argumento adicional que soportó la decisión de la \nAutoridad Nacional con relación al plan remitido.\n(Ver figura 1 en la página 35 del Concepto técnico 5755 del 8 de agosto de 2024)\n(...)\nEn línea con lo anterior, la Sociedad presentó los siguientes argumentos relacionados con \nel ámbito geográfico y equivalencia ecosistémica:\n“7.1.2.16. Ahora bien, a pesar de extender la visión sobre los atributos en términos de ecosistema, \nes importante destacar que uno de los argumentos de la ANLA sobre la no viabilidad de los \npredios corresponde al no cumplimiento de la equivalencia ecosistémica, no obstante, frente a \neste argumento es imperativo aclarar que el plan de compensación propuesto para el proyecto \nrespecto aquellos impactos por aprovechamiento forestal y cambio de uso del suelo en coberturas \nde pastos limpios, arbolados, rastrojos bajos que se dieron antes de la entrada en vigencia de las \nResoluciones 1517 de 2012 y 256 de 2018, por lo tanto, no le puede ser aplicable como concepto \nrelacionado el cumplimiento de la equivalencia ecosistémica, aunque, en este caso, al tratarse de \n\nResolución No. 001893       Del 29 AGO. 2024          Hoja No. 33 de 40\n“POR LA CUAL SE RESUELVE UN RECURSO DE REPOSICIÓN”\nPágina 33 de 40\nunidad biótica, se cumpliría la equivalencia ecosistémica sobre el bioma “Zonobioma \nAlternohigrico Tropical”, ligados al tipo de clima, geopedología y coberturas con un distrito \nbiogeográfico diferente.  \nEn otras palabras, al compararse las áreas de las tres alternativas aprobadas por la Resolución \n311 del 12 de febrero de 2021 con las áreas propuestas al interior de los predios Las Delicias y \nEl Pensamiento, ubicados en el corregimiento de Minguelo, municipio de Dibulla, departamento \nde La Guajira, específicamente sobre los criterios ecosistémicos como presencia del  ecosistema \nde bosque seco tropical, ecosistemas En Peligro y Vulnerables de la lista roja de ecosistemas, \npresencia bajo áreas prioritarias de conservación entre otros aspectos presentados en el Plan \nradicado, es evidente que existe una oportunidad de conservación real de estas áreas, situación \nque debe valorar la Autoridad Ambiental sobre todo con la debida diligencia soportada por la \ncompañía en términos de ejecutar acciones que perduren en el tiempo sobre las áreas ya \naprobadas.”\nEn cuanto a la equivalencia ecosistémica, es claro para la Autoridad Nacional que el marco \nnormativo que compete al proyecto en cuanto a la compensación por aprovechamiento \nforestal y cambio de uso del suelo es el establecido en la Resolución 1079 de 9 de junio de \n2011 que modificó la Resolución 320 de 18 de febrero de 2009, y que el proyecto no se rige \nbajo lo establecido en los manuales de Compensación por Pérdida de Biodiversidad o \nCompensación Biótica. Sin embargo, la validación realizada en el Concepto Técnico 1545 \ndel 19 de marzo de 2024, tanto a nivel de ecosistemas como de coberturas vegetales, tenía \npor objeto evidenciar condiciones similares entre el ecosistema impactado y el ecosistema \nen el que se propone la compensación, de modo que, a pesar de la distancia, se pudiera \nvalidar la propuesta presentada.\nAhora bien, con relación a la ubicación de las alternativas presentadas y aprobadas en la \nResolución 311 del 12 de febrero de 2021, la Sociedad señala lo siguiente:\n“7.1.2.17. Por otro lado, uno de los argumentos expresados por la ANLA frente a la no pertinencia \nde la solicitud de la Compañía para modificar la forma de compensación a través del saneamiento \npredial, corresponde a que las áreas propuestas no se encuentran ubicadas al interior del ámbito \ngeográfico señalado por la Resolución 311 de 2021. \nCon relación a esto, la Resolución 1079 del 9 de junio de 2011 establece al respecto que “Como \nmedida de compensación por aprovechamiento forestal y cambio de uso de suelo, la Empresa \ndeberá realizar el establecimiento de especies nativas en las cuencas hidrográficas y \nenriquecimiento en áreas de bosque de galería dentro del área de influencia del proyecto”, no \nobstante, las áreas aprobadas por la Resolución 311 del 12 de febrero de 2021 no se encuentran \ndirectamente relacionadas al área de influencia del proyecto.\n7.1.2.18. En la siguiente Figura se muestra la ubicación del bloque Sierra Nevada (AreaProyecto) \ny la ubicación de las áreas aprobadas para la compensación (OtraCompensación) a través de la \nResolución 311 del 12 de febrero de 2021.\n(…)\n7.1.2.19. Aunado a lo expuesto, el parágrafo tercero del artículo 2.2.2.1.6.5, establece que “La \nreglamentación sobre compensaciones ambientales deberá incorporar acciones de conservación \ny manejo de áreas protegidas integrantes del Sinap”, así las cosas, la compensación al interior \nde áreas protegidas del SINAP y aquellas acciones que se encuentren directamente relacionadas \ncon fortalecer el logro de los objetivos de conservación de las áreas protegidas deben contar con \npriorización por parte de las Autoridades Ambientales así como orientar la toma de decisión a los \n\nResolución No. 001893       Del 29 AGO. 2024          Hoja No. 34 de 40\n“POR LA CUAL SE RESUELVE UN RECURSO DE REPOSICIÓN”\nPágina 34 de 40\nanálisis que busquen que la compensación sea efectiva a través del tiempo y garantice \ncondiciones de adicionalidad más allá de reforestaciones que puedan no ser exitosas, situaciones \nque no fueron evaluadas detalladamente por parte de la Autoridad a través del concepto técnico \n1545 del 19 de marzo de 2024 y la Resolución 973 del 27 de mayo de 2024.”\nAl respecto, en el Concepto Técnico 5836 del 18 de septiembre de 2020, la Autoridad \nNacional menciona lo siguientes con relación a la ubicación de las alternativas propuestas:\n“Así mismo, se evidencia la gestión realizada con CORPAMAG haciendo entrega del soporte \ndocumental donde esa Corporación da respuesta mediante comunicación escrita 170012.01-\n4200 del 7 de noviembre de 2019 a la solicitud de aprobación y evaluación del Plan  de \nCompensación en cumplimiento, entre otras, a la Resolución 1079 de 9 de junio de 2011  que  \nmodificó la Resolución 320 de 18 de febrero de 2009 proferidas por el entonces Ministerio de \nAmbiente, Vivienda y Desarrollo Territorial otorgadas a la empresa Petrolífera Petroleum \n(Colombia) Limited, para ejecutar el proyecto de Perforación Exploratoria del Prospecto Brillante \nSureste, presentando una caracterización físico-biótica de las áreas, en donde se destaca que \nlas alternativas el arroyo Cacagüero y del río Ariguaní presentan “… grandes áreas con \necosistemas naturales de bosque de galería con presencia de áreas prioritarias para la \nconservación (Portafolio de compensación), así mismo, brinda posibilidad de generar corredores \nde conectividad ya que estas franjas rivereñas se encuentran fragmentadas” y la alternativa 3 “se \nencuentran fragmentos de vegetación de Bosque de galería, Arbustal Abierto esclerófilo, y pastos \nen un paisaje de bosque seco, es también un área de gran importancia debido a la confluencia \nde muchas rondas hídricas. ”  Y concluyendo en esa comunicación que “Estas áreas son \nconsideradas como prioridad por la presencia de bosques de galería con fragmentación, la cual \nbrindaría la oportunidad para realizar ejercicios de conectividad ecosistémica y por su importancia \nbiológica y de conservación. Además, algunas hacen parte de humedales del Magdalena, y \nrepresenta un papel importante en la dinámica hídrica al interactuar con los cuerpos de agua que \nse encuentran en la zona.” \nEn consecuencia a lo anterior, la Sociedad en el Plan de compensación mediante comunicación \nescrita con radicado 2019189194 -1-000 del 2 de diciembre de 2019 presenta un resumen de un \nportafolio de áreas en donde se realizará la selección de los predios y una caracterización \nambiental de esas áreas preseleccionados dentro del portafolio de áreas priorizadas para \nreforestar en el departamento del Magdalena, una (1) en el municipio de Sabanas de San Ángel, \nabarcando un total de 1367,35 ha del complejo de humedales del Magdalena, sobre el arroyo \nCacagüero y las rondas menores; otra (2) en la ribera del río Ariguaní en el municipio de El Difícil \nde 3303.34 ha y la última (3) en el municipio de Plato, sobre la ribera de la quebrada Chimicuica \nde 9110.52 Ha en el sistema de humedales del Magdalena.\nRespecto a lo anterior teniendo en cuenta lo impuesto en la Resolución 1079 de 9 de junio de \n2011 que modificó la Resolución 320 de 18 de febrero de 2009 donde se establece realizar el \nestablecimiento de especies nativas en las cuencas hidrográficas y enriquecimiento en áreas de \nbosque de galería dentro del área de influencia del proyecto, las alternativas viables por \nencontrarse dentro de la cuenca del río Araguanni (área de influencia indirecta) serán la \nalternativa uno (1) sobre el arroyo Cacagüero y las rondas menores en el municipio de Sabanas \nde San Ángel, y la alternativa dos (2) en la ribera del río Ariguaní en el municipio de El Difícil \nambas pertenecientes al Complejo ribereño de los ríos Cesar y Ariguaní.”\nEn línea con lo anterior, parte de los argumentos técnicos incluidos por la Sociedad en la \npropuesta remitida mediante radicado ANLA 2019189194 -1-000 del 2 de diciembre de \n2019 y evaluada por la Autoridad Nacional en el Concepto Técnico 5836 del 18 de \nseptiembre de 2020, insumo fundamental de la Resolución 311 del 12 de febrero de 2021, \nson el cumplimiento de los criterios establecidos en la Resolución 1079 de 9 de junio de \n\nResolución No. 001893       Del 29 AGO. 2024          Hoja No. 35 de 40\n“POR LA CUAL SE RESUELVE UN RECURSO DE REPOSICIÓN”\nPágina 35 de 40\n2011 que modificó la Resolución 320 de 18 de febrero de 2009. Sin embargo, siendo un \ncriterio importante el ámbito geográfico, la Autoridad Nacional aprobó solamente dos de las \ntres alternativas propuestas, ya que la Alternativa 3 se encontraba por fuera del área de \ninfluencia definida para el proyecto, que corresponde a la cuenca hidrográfica del rio \nAriguaní.\nEs así como, no es cierto que la Autoridad Nacional no haya realizado la evaluación \ndetallada de las situaciones o contextos de las propuestas presentadas; por el contrario, la \nAutoridad Nacional evaluó las dos propuestas teniendo en cuenta las condiciones \nestablecidas inicialmente por la obligación en relación con el ámbito geográfico para la \ncompensación.\nPor otra parte, otros argumentos expuestos por la Sociedad en el recurso de reposición con \nradicado ANLA 20246200663912 del 13 de junio de 2024, hacen referencia a la agrupación \ncon las obligaciones generadas en otros proyectos aledaños, como se relaciona a \ncontinuación:\n“7.1.2.13. Asimismo, es imperativo aclarar que la propuesta de compensación va encaminada a \nagrupar las compensaciones a través de la compra de los predios Las Delicias y El Pensamiento, \nubicados en el corregimiento de Minguelo, municipio de Dibulla, departamento de La Guajira, \npara dos (2) expedientes localizados en el sur del departamento del Magdalena, y que cuentan \ncon el mismo titular del instrumento de manejo de control, que para el caso corresponde a la \nCompañía (LAM4155 APE La Pinta 1 y el LAM4269 APE Brillante Sureste), lo expuesto con el fin \nde buscar la maximización de los beneficios ambientales, económicos y sociales.\n7.1.2.14. Lo anterior, buscando cerrar las brechas entre el campo y la ciudad, creando \ncondiciones de bienestar y buen vivir para la población rural a través de la protección de áreas \nde especial interés ambiental y la generación de alternativas equilibradas entre el medio ambiente \ny el bienestar para la población que colinda con ellas o las ocupan, bajo los principios de \nparticipación de las comunidades y desarrollo sostenible. De este modo se coadyuva al logro de \nlos objetivos propuestos en la Política Nacional para la Gestión Integral de la Biodiversidad y sus \nServicios Ecosistémicos, principio orientador de la conservación en el país.\n(…)\n7.2.2.3. La Resolución se opone manifiestamente a la voluntad que la ANLA ha manifestado en \notras actuaciones: La Resolución (expediente LAM4269) se opone manifiestamente a la voluntad \nplasmada por la ANLA en el Auto 000866 del 27 de febrero de 2024 (expediente LAM4155). En \ndicho auto la ANLA revisó una propuesta relacionada con el Plan de Compensación en el caso \ndel expediente LAM4155 y, en vez de no aprobar esa propuesta, hizo requerimientos información \nadicional. Por el contrario, en el caso de la Resolución la ANLA valoró la Propuesta y no la aprobó, \nen vez de hacer requerimientos de información adicional como lo hizo en el expediente \n(expediente LAM4269). Motivo por el cual, ante documentos y situaciones de hecho iguales, al \ntratarse ambas propuestas del Plan de la Compensación, la ANLA hizo un cambio intempestivo \ne injustificado de su postura, expidiendo la Resolución que se opone manifiestamente a la \nvoluntad plasmada en el Auto 000866 del 27 de febrero de 2024 (expediente LAM4155).”\nEn línea con lo anterior, la Autoridad Nacional no desconoce que la agrupación de \nobligaciones para la ejecución en conjunto maximiza los beneficios obtenidos o por obtener \nen términos ambientales; sin embargo, en el caso específico del expediente LAM4155, tal \ny como se menciona en la página 24 del Auto 866 del 27 de febrero de 2024:\n\nResolución No. 001893       Del 29 AGO. 2024          Hoja No. 36 de 40\n“POR LA CUAL SE RESUELVE UN RECURSO DE REPOSICIÓN”\nPágina 36 de 40\n“(…) [L]a ausencia de insumos cartográficos impiden que pueda evaluarse el ¿Cómo \nCompensar?, ¿Cuánto Compensar? ¿Dónde Compensar? y la adicionalidad de la propuesta de \ncompra de predios en áreas del Parque Nacional Natural Sierra Nevada de Santa Marta.\nEn consecuencia, ante la ausencia de insumos técnicos básicos para emitir un pronunciamiento \nde fondo sobre la aprobación del Plan de Compensación por aprovechamiento forestal, en la \nparte dispositiva de este proveído se establecerán las obligaciones a cargo de la Sociedad \nasociadas a la presentación de la información geográfica conforme a lo dispuesto en la \nResolución 2182 del 23 de diciembre de 2016, entre otros aspectos.”\nAsí las cosas, no es cierto que la Autoridad Nacional se pronunciase contrariamente en los \ndos casos, ya que para el expediente LAM4155 se señala claramente una ausencia de \ninformación que no permitió un pronunciamiento de fondo, como si se realizó para el \nexpediente LAM4269, para el cual la Sociedad incluyó como anexo los soportes \ncartográficos pertinentes que permitieron verificar la ubicación de los predios con relación \nal área del proyecto y ámbito geográfico, y que constituye el principal criterio para la \nnegación del plan presentado.\nCon base en lo anteriormente expuesto, se [deberá] CONFIRMAR lo dispuesto en el artículo \nprimero de la Resolución 973 del 27 de mayo de 2024, toda vez que el plan de compensación \npresentado por la Sociedad mediante radicado ANLA 20236200655952 del 26 de septiembre \nde 2023, no cumple con los criterios de ámbito geográfico y acción establecida para la \ncompensación por el aprovechamiento forestal y cambio de uso del suelo en el artículo \ndécimo primero de la Resolución 1079 del 9 de junio de 2011, que modificó el artículo cuarto \nde la Resolución 320 del 18 de febrero de 2009.”\nSumado a las consideraciones del Concepto técnico 5755 del 8 de agosto de 2024, \nes importante resaltar que, en ausencia de un procedimiento especial que regule la \nactuación para la evaluación de los Planes de compensación, la Autoridad Nacional \nda aplicación a lo dispuesto en el artículo 34 de la Ley 1437 de 2011, según el cual \n“En lo no previsto en dichas leyes se aplicarán las disposiciones de esta Parte Primera del \nCódigo.”\nConforme con lo anterior, el trámite previsto por la Autoridad Nacional para la \nevaluación y pronunciamiento de fondo sobre los planes de compensación \npresentados a la Autoridad Nacional como cumplimiento de las obligaciones \nambientales establecidas en los instrumentos de control y manejo ambiental, se \nciñen a las disposiciones de artículo 34 y ss de la Ley 1437 de 2011.\nBajo ese entendido y con la observancia de los principios que rigen la actuación \nadministrativa, en el especial el principio de eficacia4, la Autoridad Nacional evalúa \nla información presentada por el titular de la Licencia o Plan de Manejo Ambiental \nprevio a emitir una decisión de fondo.\n4 11. En virtud del principio de eficacia, las autoridades buscarán que los procedimientos logren su finalidad y, para el efecto, \nremoverán de oficio los obstáculos puramente formales, evitarán decisiones inhibitorias, dilaciones o retardos y sanearán, de \nacuerdo con este Código las irregularidades procedimentales que se presenten, en procura de la efectividad del derecho \nmaterial objeto de la actuación administrativa.\n\nResolución No. 001893       Del 29 AGO. 2024          Hoja No. 37 de 40\n“POR LA CUAL SE RESUELVE UN RECURSO DE REPOSICIÓN”\nPágina 37 de 40\nSi de acuerdo con la evaluación realizada a la información presentada por la \nsociedad, se advierte la necesidad que realizar un requerimiento de información \nadicional a la sociedad, previo a emitir un pronunciamiento de fondo, así lo hará la \nAutoridad Nacional mediante comunicado dirigido al solicitante.\nPor el contrario, si la información aportada resulta suficiente para adoptar una \ndecisión de fondo, la Autoridad Nacional procederá de conformidad y la decisión \nserá oportunamente notificada al interesado en los términos del artículo 67 de la Ley \n1437 de 2011.\nTodo lo anterior, de conformidad con lo señalado en el artículo 1.1.2.2.1 del Decreto \n1076 del 26 de mayo 2015, el cual establece que “La Autoridad Nacional de Licencias \nAmbientales -ANLA- es la encargada de que los proyectos, obras o actividades sujetos de \nlicenciamiento, permiso o trámite ambiental cumplan con la normativa ambiental, de tal \nmanera que contribuyan al desarrollo sostenible ambiental del País.” (Subraya fuera del \ntexto original).\nAhora bien, en contravía con los argumentos jurídicos expuestos por el recurrente \nen el recurso de reposición presentado mediante comunicación con radicación \n20246200663912 del 13 de junio de 2024 especialmente los relacionados con la \npresunta vulneración de los derechos de confianza legitima, derecho a la igualdad, \neficacia, la prevalencia del derecho sustancial sobre el derecho formal y otros, \nconviene precisar que, si bien la Autoridad Nacional realiza la evaluación de los \nPlanes de compensación bajo una misma línea tanto técnica y jurídica, no todos los \ncasos pueden ser vistos de la misma manera toda vez que en cada uno se \npresentan antecedentes, permisos, medidas de compensación, aspectos técnicos y \ncondiciones técnicas y jurídicas, entre muchos otros, que los hacen diferentes y que \ndeben ser visto de manera particular y concreta.\nEn ese sentido, no es admisible el argumento de que la Autoridad Nacional debe \naprobar o negar un Plan de compensación, porque la información fue allegada de \nla misma manera en que se presentó para otro proyecto y se obtuvo un \npronunciamiento diferente.\nPretender lo anterior, es pasar por alto aspectos técnicos particulares y concretos \ndel proyecto, tales como los permisos otorgados, las medidas de compensación \nestablecidas, el ámbito geográfico aplicable al proyecto, el marco normativo \naplicable al mismo, entre otros.\nPara el caso en concreto, la decisión adoptada en la Resolución 973 del 27 de mayo \nde 2024, consistente en no aprobar la propuesta de “Adquisición de predios en áreas \no ecosistemas de interés estratégico para la conservación de los recursos naturales, en el \nárea de ampliación del Parque Nacional Natural Sierra Nevada de Santa Marta”, \npresentada por la sociedad mediante comunicación con radicado 20236200655952 \ndel 26 de septiembre de 2023, se fundamenta en que la localización geográfica de \nla propuesta no es coherente y pertinente con el área en la cual fueron generados \n\nResolución No. 001893       Del 29 AGO. 2024          Hoja No. 38 de 40\n“POR LA CUAL SE RESUELVE UN RECURSO DE REPOSICIÓN”\nPágina 38 de 40\nlos impactos por las actividades del proyecto. Esta situación no puede ser \nequiparada con otros pronunciamientos de la Autoridad Nacional para otros \nproyectos.\nLo anterior, a menos que se indique de manera clara y precisa los aspectos que se \nomitió evaluar en la citada resolución en relación con el ámbito geográfico del \nproyecto, situación que no se advierte en la comunicación con radicación \n20246200663912 del 13 de junio de 2024, la cual se fundamenta principalmente en \nque la Autoridad Nacional debió realizar un requerimiento de información a la \nsociedad, situación que, además de innecesaria resultaba improcedente pues no se \ntrataba de aportar documentos adicionales sino de ajustar la propuesta de manera \nintegral.\nAunado a lo anterior, se recuerda al recurrente la relevancia del principio de Buena \nfe reciproco entre las autoridades y los particulares, establecido en el artículo 3 de \nla Ley 1437 de 2011, a saber:\n“Artículo 3.\n(…)\n4. En virtud del principio de buena fe, las autoridades y los particulares presumirán el \ncomportamiento leal y fiel de unos y otros en el ejercicio de sus competencias, derechos \ny deberes.”\nAsí las cosas, atendiendo a las consideraciones presentadas por el Concepto \ntécnico 5755 del 8 de agosto de 2024, la Autoridad Nacional confirmará el contenido \ndel artículo primero de la Resolución 973 del 27 de mayo de 2024, tal como se \nseñalará en la parte resolutiva del presente acto administrativo.\nEn mérito de lo expuesto,\nRESUELVE\nARTÍCULO PRIMERO. Confirmar el contenido del artículo primero de la \nResolución 973 del 27 de mayo de 2024, de conformidad con lo expuesto en la parte \nmotiva del presente acto administrativo.\nARTÍCULO SEGUNDO. Notificar el presente acto administrativo al representante \nlegal, o al apoderado debidamente constituido o a la persona debidamente \nautorizada por la Sociedad PETROLIFERA PETROLEUM (COLOMBIA) LIMITED \nEN LIQUIDACION, o a quien haga sus veces de conformidad con lo dispuesto en \nlos artículos 67 y siguientes de la Ley 1437 de 2011.\nPARÁGRAFO. En el suceso en que el titular de la licencia o el permiso, entre en \nproceso de disolución o régimen de insolvencia empresarial o liquidación regulados \n\nResolución No. 001893       Del 29 AGO. 2024          Hoja No. 39 de 40\n“POR LA CUAL SE RESUELVE UN RECURSO DE REPOSICIÓN”\nPágina 39 de 40\npor las normas vigentes, informará inmediatamente de esta situación a la Autoridad \nNacional, con fundamento, entre otros, en los artículos 8, 58, 79, 80, 81, 95 numeral \n8 de la Constitución Política de 1991, en la Ley 43 de 1990, en la Ley 222 de 1995, \nen la Ley 1333 de 2009 modificada por la ley 2387 del 25 de julio de 2024 y demás \nnormas vigentes y jurisprudencia aplicable.\nAdicional a la obligación de informar a la Autoridad Nacional de tal situación, el titular \nde la licencia o permiso aprovisionará contablemente las obligaciones contingentes \nque se deriven de la existencia de un procedimiento ambiental sancionatorio \nconforme con el artículo 40 de la Ley 1333 de 2009 modificada por la ley 2387 del \n25 de julio de 2024 o la norma que la adicione, modifique o derogue.\nARTÍCULO TERCERO. Comunicar el presente acto administrativo a la Alcaldía de \nlos Municipios de Ariguaní, Santa Ana y Pijiño del Carmen en el Departamento del \nMagdalena y a la Corporación Autónoma Regional del Magdalena - CORPMAG.\nARTÍCULO CUARTO. Publicar la presente Resolución en la Gaceta Ambiental de \nla Autoridad Nacional de Licencias Ambientales - ANLA, de conformidad con lo \nseñalado en el artículo 71 de la Ley 99 de 1993.\nARTÍCULO QUINTO. Contra el presente acto administrativo no procede recurso \nalguno de conformidad con lo establecido en el artículo 87 del Código de \nProcedimiento Administrativo y de lo Contencioso Administrativo.\nNOTIFÍQUESE, COMUNÍQUESE, PUBLÍQUESE Y CÚMPLASE\nDado en Bogotá D.C., a los 29 AGO. 2024\nEDILBERTO PENARANDA CORREA\nASESOR\nIBLER ANDERSON MOLANO RINCON\nCONTRATISTA\nOSCAR GILBERTO GALVIS CAMACHO\n\nResolución No. 001893       Del 29 AGO. 2024          Hoja No. 40 de 40\n“POR LA CUAL SE RESUELVE UN RECURSO DE REPOSICIÓN”\nPágina 40 de 40\nCONTRATISTA\nExpediente No. LAM4269\nConcepto técnico 5755 del 8 de agosto de 2024\nFecha: 27 de agosto de 2024\nProceso No.: 20241000018934\nNota: Este es un documento electrónico generado desde los Sistemas de Información de la ANLA. El original reposa en los \narchivos digitales de la Entidad\n"
}