{
  "fuente": "ANLA_GACETA",
  "numero_resolución": "RESOLUCIÓN N° 000150",
  "fecha_resolución": "1993-12-22",
  "anio_resolucion": "1993",
  "nombre_proyecto": "para la",
  "nombre_proyecto_normalizado": "PARA LA",
  "ubicación": "departamento de Casanare",
  "empresa": "ECOPETROL",
  "empresa_normalizada": "ECOPETROL",
  "numero_expediente": "LAM0722",
  "radicados": [
    "2019182384",
    "2015040118",
    "2021258260"
  ],
  "descripcion": "POR LA CUAL SE RESUELVE UN RECURSO DE REPOSICIÓN",
  "tipos_infraccion": [
    "Tala o afectación de bosques"
  ],
  "tipos_infraccion_normalizados": [
    "TALA O AFECTACION DE BOSQUES"
  ],
  "pdf_id": "45409",
  "file_name": "ANLA_45409.pdf",
  "texto_completo": "República de Colombia\nMinisterio de Ambiente y Desarrollo Sostenible\nAUTORIDAD NACIONAL DE LICENCIAS \nAMBIENTALES\n- ANLA –\nRESOLUCIÓN N° 000150\n(02 FEB. 2024)\nPágina 1 de 28\n““POR LA CUAL SE RESUELVE UN RECURSO DE REPOSICIÓN”\nEL ASESOR DEL DESPACHO DEL DIRECTOR DE LA AUTORIDAD NACIONAL DE \nLICENCIAS AMBIENTALES – ANLA\nEn ejercicio de las facultades legales establecidas mediante la Ley 99 del 22 de diciembre \nde 1993, el Decreto Ley 3573 del 27 de septiembre de 2011, modificado por el Decreto \n376 del 11 de marzo de 2020, por el cual se modifica la estructura de la Autoridad \nNacional de Licencias Ambientales y acorde con lo regulado en el Decreto 1076 del 26 de \nmayo de 2015, la Resolución 669 del 14 de abril de 2020, la Resolución 1957 del 5 de \nnoviembre de 2021 y la Resolución 2795 del 25 de noviembre de 2022, expedidas por la \nAutoridad Nacional de Licencias Ambientales, y\nCONSIDERANDO\nQue mediante Resolución 1633 del 26 de diciembre de 1995, el Ministerio del Medio \nAmbiente, hoy Ministerio de Ambiente y Desarrollo Sostenible, (En adelante el Ministerio), \notorgó Licencia Ambiental Ordinaria a la Sociedad BRITISH PETROLEUM EXPLORATION \nCOMPANY COLOMBIA LTDA identificada con NIT 860.002.426-3, para la construcción y \noperación de las áreas de pozos múltiples Cupiagua XB y XC, en jurisdicción del municipio \nde Aguazul en el departamento de Casanare\nQue por medio de la Resolución 954 del 2 de septiembre de 1996, el Ministerio modificó la \nResolución 1633 del 26 de diciembre de 1995, en el sentido de revocar parcialmente el \nnumeral 6 del artículo cuarto de la Resolución en mención.\nQue a través de la Resolución 1086 del 2 de diciembre de 1997, el Ministerio modificó la \nResolución 1633 del 26 de diciembre de 1995, en el sentido de autorizar a la Sociedad \nBRITISH PETROLEUM EXPLORATION COMPANY COLOMBIA LTDA, la construcción de \nla vía de acceso al pozo Cupiagua XB en el Municipio de Aguazul en el Departamento de \nCasanare. \nQue mediante Resolución 76 del 20 de enero de 2009, modificó la Resolución 1633 del 26 \nde diciembre de 1995, en el sentido de ampliar la cobertura para la construcción de la vía \nde acceso al pozo Cupiagua XB, entre otros aspectos.\n\nResolución No. 000150       Del 02 FEB. 2024          Hoja No. 2 de 28\n “POR LA CUAL SE RESUELVE UN RECURSO DE REPOSICIÓN”\nPágina 2 de 28\nQue por medio de la Resolución 1167 del 16 de junio de 2009, el Ministerio modificó la \nResolución 1633 del 26 de diciembre de 1995, en el sentido de adicionar la obligación de \ndestinar como mínimo un uno por ciento (1%) del valor del proyecto denominado para la \nconstrucción y operación de los pozos exploratorios CUPIAGUA XB y XC y a la vía de \nacceso al área del pozo CUPIAGUA XC, para la recuperación, conservación, preservación \ny vigilancia de la cuenca hidrográfica de la fuente Quebrada Chichaca, localizada en la \nvereda Honduras en jurisdicción del Municipio de Aguazul, Departamento de Casanare, \nQue a través de la Resolución 2105 del 29 de octubre de 2009, el Ministerio resolvió recurso \nde reposición en contra de la Resolución 1167 del 16 de junio de 2009 en el sentido de \nconfirmarla en todas sus partes. \nQue mediante Resolución 1943 del 4 de octubre de 2010, autorizó la cesión de la Licencia \nAmbiental otorgada a la Sociedad BRITISH PETROLEUM EXPLORATION COMPANY \nCOLOMBIA LTDA mediante Resolución 1633 del 26 de diciembre de 1995, a la Sociedad \nECOPETROL S.A. (En adelante la Sociedad) identificada con NIT 899999068-1. \nQue por medio de la Resolución 2326 del 23 de noviembre de 2010, el Ministerio resolvió \nrecurso de reposición interpuesto contra la Resolución 1943 del 4 de octubre de 2010, en \nel sentido de modificar el artículo cuarto, teniendo en cuenta que la Sociedad será \nresponsable ante el Ministerio de todos los efectos económicos que resulten de la decisión \nde los procesos sancionatorios y administrativos que se encuentren en curso, relacionados \nen los actos administrativos contenidos en el expediente LAM0722. \nQue a través de la Resolución 2161 del 23 de noviembre de 2018, la Autoridad Nacional de \nLicencias Ambientales - ANLA (En adelante la Autoridad Nacional) modificó a la obligación \nlegal de inversión forzosa de no menos del 1%, impuesta a través del artículo primero de la \nResolución 1167 del 16 de junio de 2009, en el sentido de incluir como línea general de \ninversión del 1% las Acciones de protección, conservación y preservación a través de \nrestauración ecológica, rehabilitación y recuperación, dentro de las cuales se incluye el \ndesarrollo de proyectos de uso sostenible, para desarrollarse a través del desarrollo de los \nProyectos productivos de uso sostenible de Sistemas Agroforestales con Cacao – \nForestales o Cacao – Plátano – Forestales en el área del Núcleo Piedemonte II, de \nconformidad con dispuesto en el literal a) del numeral 1 del Artículo 2.2.9.3.1.9 del Decreto \n2099 del 22 de diciembre de 2016, modificado por el Decreto 075 del 20 de enero 2017 y \nel Decreto 1120 del 29 de junio 2017, compilados en el Decreto 1076 de 2015\nQue mediante Resolución 1049 del 14 de junio de 2019, la Autoridad Nacional resolvió el \nrecurso de reposición interpuesto en contra la Resolución 2161 del 23 de noviembre de \n2018, en el sentido de aclarar, modificar y no reponer varias imposiciones establecidas en \nla Resolución 2161 del 23 de noviembre de 2018.\nQue por medio de la Resolución 477 del 20 de marzo de 2020, la Autoridad Nacional \nmodificó el Artículo Primero de la Resolución 1167 del 16 de junio de 2009, en el sentido \nde aprobar el acogimiento al porcentaje incremental de la base de liquidación de la inversión \nforzosa de no menos del 1%, de conformidad con lo señalado en artículo 321 del Plan \nNacional de Desarrollo - PND (Ley 1955 del 25 de mayo del 2019).\n\nResolución No. 000150       Del 02 FEB. 2024          Hoja No. 3 de 28\n “POR LA CUAL SE RESUELVE UN RECURSO DE REPOSICIÓN”\nPágina 3 de 28\nQue a través de la Resolución 1606 del 30 de septiembre de 2020, la Autoridad Nacional \nresolvió el recurso de reposición contra la Resolución 2161 del 23 de noviembre de 2018, \nen el sentido de aclarar, modificar y no reponer varias imposiciones establecidas en la \nResolución 2161 del 23 de noviembre de 2018.\nQue mediante Resolución 2438 del 31 de diciembre de 2021, actualizó el Plan de Gestión \nSocial Integrado – PGSI, aprobado para los expedientes LAM0017, LAM0026, LAM0045, \nLAM0046, LAM0049, LAM0068, LAM0109, LAM0133, LAM0134, LAM0135, LAM0216, \nLAM0248, LAM0370, LAM0376, LAM0443, LAM0444, LAM0524, LAM0532, LAM0668, \nLAM0685, LAM0690, LAM0691, LAM0706, LAM0722, LAM0944, LAM0965, LAM1006, \nLAM1019, LAM1124, LAM1125, LAM1145, LAM1146, LAM1232, LAM1233, LAM1247, \nLAM1282, LAM1651, LAM1888, LAM1951, LAM1960, LAM2017, LAM2032, LAM2049, \nLAM2068, LAM2130, LAM2345, LAM2495, LAM2512, LAM2513, LAM2917, LAM2995, \nLAM3159, LAM3424, LAM4754, de acuerdo con la actualización presentada mediante \n2021147332-1-000 del 19 de julio de 2021, para los Campos Cusiana, Cupiagua y Recetor, \nen su etapa de operación.\nQue por medio de la Resolución 1186 del 7 de junio de 2022, la Autoridad Nacional resolvió \nel recurso de reposición contra la Resolución 2438 del 31 de diciembre de 2021 en el \nsentido de revocar, modificar y no reponer varias imposiciones establecidas en la \nResolución 2438 del 31 de diciembre de 2021.\nQue a través de la Resolución 2104 del 13 de septiembre de 2023, la Autoridad Nacional, \naceptó a la Sociedad liquidación parcial de la inversión forzosa de no menos del 1%, que \ncorresponde a la suma de VEINTISÉIS MILLONES TRESCIENTOS DIECISIETE \nSEISCIENTOS TREINTA Y UN PESOS CON NOVENTA Y SIETE CENTAVOS MCTE \n($26.317.631,97), en relación a la línea de inversión de “Restauración, conservación y \nprotección de la cobertura vegetal, enriquecimientos vegetales y aislamiento de áreas para \nfacilitar la sucesión natural” el proyecto “Conservación de 27,59 ha” distribuidas en ocho (8) \nlotes localizados en inmediaciones de Cupiagua XC, cuenca La Vegana, del proyecto \nCupiagua XC, aprobado mediante el artículo primero de la Resolución 1606 del 30 de \nseptiembre de 2020. Acto administrativo notificado por correo electrónico el 14 de \nseptiembre de 2023.\nQue por medio de la comunicación con radicación 20236200671532 del 28 de septiembre \nde 2023, la Sociedad interpuso Recurso de Reposición en contra de la Resolución 2104 del \n13 de septiembre de 2023; argumentos que fueron evaluados por el equipo técnico de la \nAutoridad Nacional y en consecuencia expidió el Concepto técnico 31 del 5 de enero de \n2024.\nCOMPETENCIA DE LA AUTORIDAD NACIONAL \nEl Gobierno Nacional, mediante Decreto Ley 3573 del 27 de septiembre de 2011, creó la \nAutoridad Nacional de Licencias Ambientales – ANLA, como una entidad con autonomía \nadministrativa y financiera, sin personería jurídica, la cual hace parte del Sector \nAdministrativo de Ambiente y Desarrollo Sostenible, en los términos del artículo 67 de la \nLey 489 de 1998.\n\nResolución No. 000150       Del 02 FEB. 2024          Hoja No. 4 de 28\n “POR LA CUAL SE RESUELVE UN RECURSO DE REPOSICIÓN”\nPágina 4 de 28\nEl numeral 1° del artículo tercero del mencionado decreto estableció dentro de las funciones \nde la Autoridad Nacional, la de otorgar o negar las licencias, permisos y trámites \nambientales de competencia del Ministerio, de conformidad con la ley y los reglamentos.\nMediante el Decreto 376 del 11 de marzo de 2020, se modificó la estructura de la Autoridad \nNacional de Licencias Ambientales.\nMediante la Resolución 669 del 14 de abril de 2020, se nombró como servidor público a \nEDILBERTO PEÑARANDA CORREA, identificado con cédula de ciudadanía 4.052.851, en \nel empleo de libre nombramiento y remoción de Asesor, código 1020, grado 15, adscrito a \nla Dirección General de la planta global de la ANLA.\nEl 5 de noviembre de 2021, la Autoridad Nacional emitió la Resolución 1957 “Por la cual se \nadopta el Manual Específico de Funciones y de Competencias Laborales para los empleos \nde la planta de personal de la Autoridad Nacional de Licencias Ambientales - ANLA”, en \ndonde se establece que corresponde al Despacho del Director General de la Autoridad \nNacional de Licencias Ambientales - ANLA, “Suscribir los actos administrativos que otorgan, \nniegan, modifican, ajustan o declaran la terminación de las licencias, permisos y trámites \nambientales”.\nEn ejercicio de las facultades conferidas por la Ley 489 de 1998, se expidió la Resolución \n2795 del 25 de noviembre de 2022 “Por la cual se delegan unas funciones y se dictan otras \ndisposiciones”, en su artículo primero, numeral 15° delegó en el Asesor Código 1020 Grado \n15 del Despacho del Director General, la función de “Resolver los recursos de reposición \ninterpuestos contra los actos administrativos que se emiten en cumplimiento de las \nfunciones anteriores.”\nTeniendo en cuenta lo anterior, es el Asesor del Despacho del Director General de la \nAutoridad Nacional el competente para pronunciarse sobre el recurso de reposición \ninterpuesto por la Sociedad en contra de la Resolución 2104 del 13 de septiembre de 2023\nFUNDAMENTOS JURIDICOS\nEl procedimiento para la presentación y resolución de recursos contra los actos \nadministrativos se encuentra reglado en el Código de Procedimiento Administrativo y de lo \nContencioso Administrativo artículos 74 y siguientes, que particularmente respecto del \nrecurso de reposición al tenor literal expresan:\n“Artículo 74. Recursos contra los actos administrativos.\n Por regla general, contra los actos definitivos procederán los siguientes recursos: \n1.\nEl de reposición, ante quien expidió la decisión para que la aclare, modifique, adicione o \nrevoque (…)”\nA su vez, los artículos 76 y 77 del Código enunciado preceptúan: \n“Artículo 76. Oportunidad y presentación.\nLos recursos de reposición y apelación deberán interponerse por escrito en la diligencia de \nnotificación personal, o dentro de los diez (10) días siguientes a ella, o a la notificación por aviso, o \n\nResolución No. 000150       Del 02 FEB. 2024          Hoja No. 5 de 28\n “POR LA CUAL SE RESUELVE UN RECURSO DE REPOSICIÓN”\nPágina 5 de 28\nal vencimiento del término de publicación, según el caso. Los recursos contra los actos presuntos \npodrán interponerse en cualquier tiempo, salvo en el evento en que se haya acudido ante el juez. \nLos recursos se presentarán ante el funcionario que dictó la decisión, salvo lo dispuesto para el de \nqueja, y si quien fuere competente no quisiere recibirlos podrán presentarse ante el procurador \nregional o ante el personero municipal, para que ordene recibirlos y tramitarlos, e imponga las \nsanciones correspondientes, si a ello hubiere lugar. \nEl recurso de apelación podrá interponerse directamente, o como subsidiario del de reposición y \ncuando proceda será obligatorio para acceder a la jurisdicción. \nLos recursos de reposición y de queja no serán obligatorios. \nArtículo 77. Requisitos.\nPor regla general los recursos se interpondrán por escrito que no requiere de presentación personal \nsi quien lo presenta ha sido reconocido en la actuación. Igualmente, podrán presentarse por medios \nelectrónicos. \nLos recursos deberán reunir, además, los siguientes requisitos: \n1. Interponerse dentro del plazo legal, por el interesado o su representante o apoderado debidamente \nconstituido. \n2. Sustentarse con expresión concreta de los motivos de inconformidad.\n3. Solicitar y aportar las pruebas que se pretende hacer valer. \n4. Indicar el nombre y la dirección del recurrente, así como la dirección electrónica si desea ser \nnotificado por este medio. \nSólo los abogados en ejercicio podrán ser apoderados (…)\nA su vez, el artículo 80 del citado Código, establece el alcance del contenido de la decisión que \nresuelve el recurso:\n“Artículo 80. Decisión de los recursos. -Vencido el período probatorio, si a ello hubiere lugar, y sin \nnecesidad de acto que así lo declare, deberá proferirse la decisión motivada que resuelva el recurso. \n(…)”\nCONSIDERACIONES DE LA AUTORIDAD NACIONAL FRENTE AL RECURSO DE \nREPOSICIÓN INTERPUESTO POR LA SOCIEDAD. \nDesde el punto de vista procedimental, se observa que el recurso de reposición interpuesto \npor la sociedad ECOPETROL S.A. en contra de la Resolución 2104 del 13 de septiembre \nde 2023, cumple con los requisitos establecidos en el artículo 77 y concordantes del Código \nde Procedimiento Administrativo y de lo Contencioso Administrativo, en cuanto a lo \nsiguiente: \n1.\nInterponerse dentro del plazo legal, por el interesado o su representante o apoderado \ndebidamente constituido.\nSe encuentra acreditado que el día 14 de septiembre de 2023, la Sociedad fue debidamente \nnotificada por correo electrónico de la Resolución 2104 del 13 de septiembre de 2023; frente \n\nResolución No. 000150       Del 02 FEB. 2024          Hoja No. 6 de 28\n “POR LA CUAL SE RESUELVE UN RECURSO DE REPOSICIÓN”\nPágina 6 de 28\na la cual interpuso recurso de reposición por intermedio de su Apoderado especial el día 28 \nde septiembre de 2023 y radicado en la Autoridad Nacional bajo el número \n20236200671532 esto es, dentro de los diez (10) días siguientes a la notificación, de \nconformidad con lo preceptuado en el artículo 76 de la Ley 1437 de 2011.\n2.\nSustentarse con expresión concreta de los motivos de inconformidad. \nLa Sociedad presentó los argumentos en contra de las disposiciones recurridas de la \nResolución 2104 del 13 de septiembre de 2023, los cuales serán tenidos en cuenta para \ndecidir el presente recurso de reposición.\n3.\nSolicitar y aportar las pruebas que se pretende hacer valer.\nEn el recurso de reposición la Sociedad no solicitó, ni aportó pruebas de ninguna índole.\n4.\nIndicar el nombre y la dirección del recurrente, así como la dirección electrónica si desea ser \nnotificado por este medio.\nLa sociedad manifestó que, para efectos de la notificación dentro del presente expediente, \nque “(…) recibe notificaciones a través de la Gerencia Jurídica de Entorno de la Vicepresidencia \nJurídica \nde \nEcopetrol \nS.A., \nal \ncorreo \nelectrónico \noficial \nde \nla \nempresa: \nnotificacionesjudicialesecopetrol@ecopetrol.com.co (…)”\nCon base en lo anterior, verificado el cumplimiento de los requisitos establecidos en el \nCódigo de Procedimiento Administrativo y de lo Contencioso Administrativo -CPACA-, \nrespecto a la procedencia del señalado recurso de reposición, la Autoridad Nacional \nprocederá a resolverlo, teniendo en cuenta las consideraciones realizadas en el Concepto \nTécnico 31 del 5 de enero de 2024; en el mismo orden de los argumentos presentados por \nla sociedad, a saber:\n1.\nDISPOSICIÓN RECURRIDA –ARTÍCULO SEGUNDO DE LA RESOLUCIÓN 2104 \nDEL 13 DE SEPTIEMBRE DE 2023.\n“(…) ARTÍCULO SEGUNDO. ACEPTAR a la sociedad ECOPÉTROL S.A., liquidación parcial \nde la inversión forzosa de no menos del 1%, que corresponde a la suma de TREINTA Y OCHO \nMILLONES SEISCIENTOS SESENTA Y CUATRO MIL OCHOCIENTOS DIECISÉIS PESOS \nCON DIECINUEVE CENTAVOS MCTE ($38.664.816,19), en relación a la línea de inversión \nde “Restauración, conservación y protección de la cobertura vegetal, enriquecimientos \nvegetales y aislamiento de áreas para facilitar la sucesión natural” el proyecto “Reforestación \nde 5 ha.” Ubicado en el predio El Deseo Alto Cupiagua, del proyecto Cupiagua XB, aprobado \nmediante el artículo primero de la Resolución 01606 del 30 de septiembre de 2020.”\n (…)”\n1.1\nPetición de la Sociedad.\n“(…) REPONER y en consecuencia MODIFICAR el artículo segundo de la Resolución No. \n2104 de 13 de septiembre de 2023 en el sentido de señalar como valor ejecutado por \nECOPETROL S.A., la suma de: CINCUENTA Y TRES MILLONES OCHOCIENTOS \nNOVENTA Y DOS MIL CIENTO TREINTA Y DOS PESOS CON NUEVE CENTAVOS \n\nResolución No. 000150       Del 02 FEB. 2024          Hoja No. 7 de 28\n “POR LA CUAL SE RESUELVE UN RECURSO DE REPOSICIÓN”\nPágina 7 de 28\n($53.892.132,09) M/CTE, en el predio Altos de Cupiagua, los cuales fueron ejecutados bajo \nlos convenios ENV002 de 2004 y ENV007 de 2007, en la conservación y protección de la \ncobertura vegetal, enriquecimientos vegetales y aislamiento de áreas para facilitar la sucesión \nnatural”, del proyecto Cupiagua XB. \n(…)”\n1.2\nArgumentos de la Sociedad.\n“(…) Mediante el Concepto Técnico No. 07298 de 25 de noviembre de 2022, acogido mediante el \nActa de reunión de control y seguimiento ambiental No. 853 de 28 de noviembre de 2022, la ANLA \nefectuó la evaluación de la información suministrada por Ecopetrol S.A., a través de los radicados \nNos. 2021258260-1-000 de 29 de noviembre de 2021 y 2022242163-1-000 de 28 de octubre de \n2022, en la cual estableció, entre otras las siguientes consideraciones (páginas 217 a la 222): \n(…) Locación Cupiagua XB \nReforestación de 5 ha bajo convenio ENV002 de 2004\nPara tener claridad respecto al estado de cumplimiento de esta actividad, el ESA retoma lo \ninformado por la sociedad en el documento “20191125 CUP XB-XC PLAN DE INVERSION ACOG \nART 321”, presentado con radicado 2019182384-1-000 del 21 de noviembre del 2019.\n(…) Equión Energía Limited durante el proceso de liquidación de los convenios interinstitucionales \ncon CORPORINOQUIA determinó que el valor real y soportado de la reforestación de 5 \nhectáreas en el lote 14 del predio El Deseo de Alto Cupiagua del municipio de Aguazul, es \nde $53.892.132,90, donde $38.664.816,19 corresponde a la siembra bajo el convenio \nENV002 de 2004 y $ 15.227.316,71 a la resiembra ejecutada bajo el convenio ENV007 de \n2007”. (Subrayado y negrita fuera de Texto)\n(…) Así mismo, lo conceptuado por Autoridad Nacional en el Concepto Técnico 6667 del 20 de \nnoviembre de 2019 acogido mediante Auto 11753 del 26 de diciembre de 2019: (…)\n(…) Con base en lo informado por la sociedad, lo conceptuado por la Autoridad Nacional en \nseguimientos anteriores, lo validado en la plataforma Ágil de la ANLA y el hecho de que no \npersisten obligaciones pendientes de cumplimiento para esta actividad, el ESA considera viable \naceptar la ejecución técnica de la actividad de reforestación de 5 hectáreas en el lote 14 \ndel predio El Deseo - Altos de Cupiagua (Reforestación de 5 ha bajo convenio ENV002 de \n2004), como parte de la inversión forzosa de no menos del 1%. (Subrayado fuera de texto) \n(…) Locación Cupiagua XC (Página 221)\nReforestación de 4,5 ha bajo convenio ENV002 de 2004\nEn el análisis de cumplimiento de esta actividad, es necesario tener presente lo conceptuado por \nla Autoridad Nacional en el Concepto Técnico 6667 del 20 de noviembre de 2019 acogido \nmediante Auto 11753 del 26 de diciembre de 2019, en donde indica los siguiente: \nRevisada la información contenida en los ICA 20 al 22 para la locación Cupiagua XB, la Empresa \nindica lo siguiente: (…)\nTeniendo en cuenta lo anterior, se realizan las siguientes precisiones:\n1.\n Las reforestaciones en cumplimiento de la inversión del 1% para las locaciones Cupiagua \nXB y Cupiagua XC se realizaron entre los años 2006 y 2007.\n\nResolución No. 000150       Del 02 FEB. 2024          Hoja No. 8 de 28\n “POR LA CUAL SE RESUELVE UN RECURSO DE REPOSICIÓN”\nPágina 8 de 28\n2.\nA la fecha del presente seguimiento, las reforestaciones se encuentran en buenas \ncondiciones físicas y sanitarias. Se ha desarrollado otra vegetación arbórea y arbustiva y \nse presenta regeneración natural, lo que indica que la reforestación se ha integrado con el \nentorno natural por lo que no es técnicamente viable realizar un trabajo de campo \nconsistente en hacer mediciones dasométricas por lote.\n3.\nEn cuanto a los soportes de los costos de establecimiento y mantenimiento, la Empresa \nindica que la información se manejó en su momento de manera global en el marco del \nconvenio ENV002 de 2004.\n4.\nEn la parte considerativa del Auto 5284 del 26 de octubre de 2016 se indica que “De igual \nmanera se aceptó como parte del programa de inversión del 1% con cargo a Cupiagua XB \ny XC las actividades de reforestación ya ejecutadas que de acuerdo al anexo del radicado \n2015040118-1-000 del 29 de julio de 2015 suman 12,353 hectáreas”\n(…)\nAsí mismo se considera viable declarar ejecutada la actividad de reforestación de 4.5 has \nen los lotes 1,2,3,5,8, y 14 en el predio XC, por un monto de (…) con cargo al proyecto \nCupiagua XC”. (Subrayado y negrita fuera de texto).\nCon base en lo informado por la sociedad, lo conceptuado por la Autoridad Nacional en \nseguimientos anteriores, lo validado en la plataforma Ágil de la ANLA y el hecho de que no \npersisten obligaciones pendientes de cumplimiento para esta actividad, el ESA considera viable \naceptar la ejecución técnica de la actividad de Reforestación de 4,5 ha bajo convenio \nENV002 de 2004, como parte de la inversión forzosa de no menos del 1%”\nPor otro lado, dentro del numeral 11.3 del Concepto técnico No. 07298 de 25 de noviembre de 2022, \nel ESA recomendó al área jurídica que en el acto administrativo que acoja el mencionado concepto \ntécnico emita y tenga en cuenta lo siguiente (Ver página 372):\n“11.3.17 Imposición de medidas (obligaciones nuevas) y/o ajustes vía seguimiento \n(…)\n2.\nDeclarar a la sociedad ECOPETROL S.A. que ha ejecutado con relación a la línea de \ninversión “Restauración, conservación y protección de la cobertura vegetal, \nenriquecimientos vegetales y aislamiento de áreas para facilitar la sucesión natural” el \nproyecto “Reforestación de 5 ha. “ubicado en el predio El Deseo Alto Cupiagua, en \ncumplimiento parcial de la inversión forzosa de no menos del 1% del proyecto Cupiagua \nXB, por un valor de TREINTA Y OCHO MILLONES SEISCIENTOS SESENTA Y \nCUATRO MIL OCHOCIENTOS DIECISÉIS PESOS CON DIECINUEVE CENTAVOS \nMCTE ($38.664.816,19).\n3.\nDeclarar a la sociedad ECOPETROL S.A. que ha ejecutado con relación a la línea de \ninversión de “Restauración, conservación y protección de la cobertura vegetal, \nenriquecimiento de áreas para facilitar la sucesión natural” el proyecto “Reforestación de \n4.5 ha.” ubicado en el  predio Cupiagua XC, en cumplimiento parcial de la inversión \nforzosa de no menos del 1% del proyecto Cupiagua XC, por un valor de CUARENTA Y \nNUEVE MILLONES MIL TRESCIENTOS OCHENTA Y CUATRO PESOS CON \nSETENTAY OCHO CENTAVOS MCTE ($49.001.384,78).”\n\nResolución No. 000150       Del 02 FEB. 2024          Hoja No. 9 de 28\n “POR LA CUAL SE RESUELVE UN RECURSO DE REPOSICIÓN”\nPágina 9 de 28\nDe acuerdo con lo anterior, en el Concepto técnico No. 07298 de 2022, la ANLA solo consideró el \nmonto ejecutado a través del convenio ENV002 de 2004 y pretermitió (sic) realizar la revisión de los \nmontos ejecutados y financieramente soportados por Ecopetrol S.A a través del radicado No. \n2021258260-1-000 de 29 de noviembre de 2021, que fueron discriminaron en el citado documento \nde la siguiente manera (ver páginas 5 y 6 del oficio precitado):\n“Tabla 2. Costos de la actividad de reforestación con cargo a la inversión de 1% del proyecto \nConstrucción y operación de las áreas de pozos múltiples Cupiagua XB-XC.\nFuente: radicado ANLA No. 2021258260-1-000 de 29 de noviembre de 2021\nDurante la reunión de seguimiento y control realizada por la ANLA el 28 de noviembre de 2022, y \nconsignada en el Acta 853, dicha autoridad ambiental requirió de parte de Ecopetrol S.A., en el No. \n2, actualizar la base de liquidación en un monto de ($24.626.919,55) correspondientes a los ajustes \nen montos por las actividades de conservación ($1.104.299,96), y las reforestaciones de 4,5 has \n($15.227.316,71) y 5 has ($8.295.302.88).\nEcopetrol S.A. presentó las correspondientes observaciones y aclaraciones al requerimiento antes \nmencionado, poniendo de presente las actuaciones y soportes que mostraron cumplimiento de los \nmontos de las reforestaciones, razón por la cual la ANLA modificó el requerimiento No. 2, el cual \nquedó finalmente de la siguiente manera:\nREQUERIMIENTO No. 2: Actualizar con porcentaje incremental utilizado, el valor de \n$24.626.919,55 en razón del mayor valor reportado como en ejecución para efectos del \nacogimiento al citado artículo y al valor efectivamente soportado para la validación de los \nmismos por parte de esta Autoridad…Lo anterior, en cumplimiento al acogimiento al artículo \n321 de la Ley 1955 de 2019.\nARGUMENTACIÓN DEL TITULAR DEL INSTRUMENTO DE MANEJO Y CONTROL \nAMBIENTAL: La sociedad ECOPETROL S.A., solicita que se modifique el requerimiento, toda \nvez que la actualización deberá realizarse no sobre el valor de $24.626.919,55; sino de \n$1.104.299,96 teniendo en cuenta que mediante el radicado No. 2021258260-1-000 de 29 de \nnoviembre de 2021 la empresa remitió los valores de las reforestaciones soportando los \nmontos de $53.892.132,9 para el predio Altos de Cupiagua y $57.296.687,65 para el predio \nCupiagua XC, ejecutados bajo dos (2) convenios correspondientes al ENV002 de 2004 y \n\nResolución No. 000150       Del 02 FEB. 2024          Hoja No. 10 de 28\n “POR LA CUAL SE RESUELVE UN RECURSO DE REPOSICIÓN”\nPágina 10 de 28\nENV007 de 2007, evidenciando una diferencia entre lo reportado por Ecopetrol S.A. y el \npresentado por la ANLA.\nLa ANLA procede a realizar una revisión encontrando que tiene razón la sociedad y que en lo \nque corresponde a los valores soportados para las Reforestaciones de los predios Cupiagua \nXC y Altos de Cupiagua, estos se encuentran debidamente ajustados a lo reportado para el \nacogimiento; es decir se encuentran soportes por valores de $57.296.687,65 y 53.892.132,90, \nrespectivamente.\nTeniendo en cuenta lo anterior, se accede a la petición de modificación quedando el \nrequerimiento de la siguiente manera:\n“Actualizar con porcentaje incremental utilizado, el valor de $1.104.299,96 en razón del mayor \nvalor reportado como en ejecución para efectos del acogimiento al artículo 321 de la Ley 1955 \nde 2019 y al valor efectivamente soportado para la validación de los mismos por parte de esta \nAutoridad.\nLo anterior, en cumplimiento al acogimiento al artículo 321 de la Ley 1955 de 2019.”\nRequerimiento definitivo. Se modifica el requerimiento:\n“Actualizar con porcentaje incremental utilizado, el valor de $1.104.299,96 en razón del mayor \nvalor reportado como en ejecución para efectos del acogimiento al artículo 321 de la Ley 1955 \nde 2019 y al valor efectivamente soportado para la validación de los mismos por parte de esta \nAutoridad. Lo anterior, en cumplimiento al acogimiento al artículo 321 de la Ley 1955 de 2019” \n(Subrayado fuera de texto)\nAdicionalmente, en las observaciones del Acta No. 853 de 28 de noviembre de 2022 en la página \n12, indica lo siguiente:\n“Observaciones: Se deja constancia que las consideraciones y recomendaciones señaladas \nen el Concepto Técnico No. 07298 el 25 de noviembre de 2022, relacionadas con los valores \nejecutados por concepto de la inversión forzosa de no menos del 1% serán acogidos mediante \nacto administrativo independiente, incluyendo lo relacionado con la línea de inversión de \n“Elaboración del Plan de Ordenación y Manejo de la Cuenca Hidrográfica” para el Rio Unete, \ny atendiendo de igual manera los ajustes efectuados en el transcurso de la presente reunión \na las consideraciones del requerimiento 2 de la presente acta y a la modificación de dicho \nrequerimiento.”\nAsí las cosas, es claro que el artículo segundo y tercero de la Resolución No. 2104 de 13 de \nseptiembre de 2023, no acogieron ni tuvieron en cuenta las observaciones contenidas en el \nActa No. 853 de 28 de noviembre de 2022, adicionalmente carecen de pertinencia y fundamento \ntécnico, lo que ocasiona una consecuencia jurídica desfavorable, toda vez que Ecopetrol S.A. dio \ncumplimiento a las citadas obligaciones bajo los montos establecidos y soportados en los Convenios \nENV002-2004 y ENV007-2007, cuyos soportes fueron presentados oportunamente con el radicado \nNo. 2021258260-1-000 de 29 de noviembre de 2021, el cual hace parte del expediente de la \nreferencia.\nLas precitadas disposiciones presentan relación directa con las funciones asignadas a la ANLA, \nrazón por la que Ecopetrol S.A. considera que se encuentran debidamente aprobados mediante los \nconceptos técnicos ya indicados y la documentación que sustenta su cumplimiento y que reposa en \nel expediente LAM0722, por lo que la ANLA no puede desconocer las acciones y gestiones que \n\nResolución No. 000150       Del 02 FEB. 2024          Hoja No. 11 de 28\n “POR LA CUAL SE RESUELVE UN RECURSO DE REPOSICIÓN”\nPágina 11 de 28\nhasta la fecha Ecopetrol S.A. ha realizado, que se sustentan en los diferentes Actos administrativos \nantecedentes a la Resolución No. 2104 de 13 de septiembre de 2023.\nDe acuerdo con lo anterior, es indispensable traer a colación lo dispuesto en el artículo 3° (numerales \n7, 11 y 13) de la Ley 1437 de 2011, el cual establece que:\nARTÍCULO 3º. Principios. Todas las autoridades deberán interpretar y aplicar las \ndisposiciones que regulan las actuaciones y procedimientos administrativos a la luz de los \nprincipios consagrados en la Constitución política, en la Parte primera de este Código y en \nlas leyes especiales. (…)\n7. En virtud del principio de responsabilidad, las autoridades y sus agentes asumirán las \nconsecuencias por sus decisiones, omisiones o extralimitación de funciones, de acuerdo con \nla Constitución, las leyes y los reglamentos.\n11. En virtud del principio de eficacia, las autoridades buscarán que los procedimientos \nlogren su finalidad y, para el efecto, removerán de oficio los obstáculos puramente formales, \nevitarán decisiones inhibitorias, dilaciones o retardos y sanearán, de acuerdo con este \nCódigo las irregularidades procedimentales que se presenten, en procura de la efectividad \ndel derecho material objeto de la actuación administrativa.\n13. En virtud del principio de celeridad, las autoridades impulsarán oficiosamente los \nprocedimientos, e incentivarán el uso de las tecnologías de la información y las \ncomunicaciones, a efectos de que los procedimientos se adelanten con diligencia, dentro de \nlos términos legales y sin dilaciones injustificadas.\nPor lo expuesto, respetuosamente se solicita a ANLA, modificar el artículo segundo de la Resolución \nNo. 2104 de 13 de septiembre de 2023, en lo que refiere al valor ejecutado, el cual corresponde a la \nsuma de: CINCUENTA Y TRES MILLONES OCHOCIENTOS NOVENTA Y DOS MIL CIENTO \nTREINTA Y DOS PESOS CON NUEVE CENTAVOS ($53.892.132,09) M/CTE, para el predio Altos \nde Cupiagua ejecutados bajo los convenios ENV002 de 2004 y ENV007de 2007, para el proyecto \nCupiagua XB, en la línea de inversión de “Restauración conservación y protección de la cobertura \nvegetal, enriquecimientos vegetales y aislamiento de áreas para facilitar la sucesión natural” el \nproyecto “Reforestación de 5 has” ubicado en el predio El Deseo Alto Cupiagua, aprobado mediante \nel artículo primero de la Resolución No. 01606 de 30 de septiembre de 2020.\nDel mismo modo, se solicita respetuosamente modificar el artículo tercero de la Resolución No. 2104 \nde 13 de septiembre de 2023, en el sentido de establecer como valor ejecutado la suma de \nCINCUENTA Y SIETE MILLONES DOSCIENTOS NOVENTA Y SEIS MIL SEISCIENTOS \nOCHENTA Y SIETE PESOS CON SESENTA Y CINCO CENTAVOS ($57.296.687,65) M/CTE , para \nel predio Cupiagua XC, ejecutados bajo los convenios ENV002 de 2004 y ENV007 de 2007, para el \nproyecto Cupiagua XC, en la línea de inversión de “Restauración, conservación y protección de la \ncobertura vegetal, enriquecimientos vegetales y aislamiento de áreas para protección de la cobertura \nvegetal, enriquecimientos vegetales y aislamiento de áreas para facilitar la sucesión natural” el \nproyecto “Reforestación de 4.5 has.” Ubicado en el predio Cupiagua XC, aprobado mediante el \nartículo primero de la Resolución No. 01606 de 30 de septiembre de 2020. (…)\n1.3\nConsideraciones de la Autoridad Nacional.\nA través del Concepto Técnico 31 del 5 de enero de 2024, el equipo técnico de la Autoridad \nNacional consideró:\n“(…)  Una vez revisado el radicado 2021258260-1-000 del 29 de noviembre de 2021 y sus anexos, \ncon relación a la línea de inversión de “Restauración, conservación y protección de la cobertura \n\nResolución No. 000150       Del 02 FEB. 2024          Hoja No. 12 de 28\n “POR LA CUAL SE RESUELVE UN RECURSO DE REPOSICIÓN”\nPágina 12 de 28\nvegetal, enriquecimientos vegetales y aislamiento de áreas para facilitar la sucesión natural” se \nencuentran los soportes de ejecución del programa “Reforestación de 5 ha.”  realizado en el predio \nEl Deseo ubicado en la vereda Altos de Cupiagua, el cual fue ejecutado con cargo a los recursos de \nla obligación de la inversión forzosa de no menos del 1% del proyecto “Cupiagua XB”. Este programa \nfue aprobado para su ejecución mediante el artículo primero de la Resolución 01606 del 30 de \nseptiembre de 2020.\nEn primer lugar, se aclara que la reforestación de las 5 ha en el predio El Deseo ubicado en la vereda \nAltos de Cupiagua, se ejecutó a través de dos (2) convenios: Convenio ENV002 de 2004 y ENV007 \nde 2007, suscritos entre CORPORINOQUIA y la Fundación Amanecer.\n➢\nValor ejecutado mediante el convenio ENV002 de 2004.\nLa primera etapa de la Reforestación de 5 ha en el predio denominado El Deseo, se realizó mediante \nel convenio ENV002 del 26 de noviembre de 2004, el cual tuvo cuatro modificaciones según consta \nen los otrosí de fechas 30 de noviembre de 2004, 15 de noviembre de 2005 y 23 de octubre de 2008. \nA través del convenio ENV 002-2004 se reforestaron 231,72 ha con una inversión total a cargo de la \nobligación de inversión forzosa de no menos del 1% de $1.756.023.214,67; según consta en el \ndocumento de liquidación del convenio que a continuación se relaciona:\nImagen \n1 \nCaptura \nde \nPantalla \nConsolidado \nliquidación \nconvenio \nENV002-2004\nFuente: Radicado 2021258260-1-000 del 29 de noviembre de 2021\nAhora bien, luego de la distribución de costos en proporción a las hectáreas reforestadas de cada \nproyecto, la Sociedad asignó la suma de $38.664.816,19 para el expediente LAM0272, proyecto \n“Cupiagua XB”, según se observa en la siguiente Imagen.\n\nResolución No. 000150       Del 02 FEB. 2024          Hoja No. 13 de 28\n “POR LA CUAL SE RESUELVE UN RECURSO DE REPOSICIÓN”\nPágina 13 de 28\nImagen 2 Captura de Pantalla distribución de montos convenio ENV002-2004 por proyecto.\nFuente: Radicado 2021258260-1-000 del 29 de noviembre de 2021\nDe acuerdo con los anteriores soportes financieros, mediante el convenio ENV002-2004 se ejecutó \nla suma de TREINTA Y OCHO MILLONES SEISCIENTOS SESENTA Y CUATRO MIL \nOCHOCIENTOS DIECISÉIS PESOS CON DIECINUEVE CENTAVOS MCTE ($38.664.816,19) \ncorresponde al establecimiento de 5 ha en el lote 14 del predio El Deseo ubicado en la vereda Alto \nCupiagua, de propiedad de la Alcaldía de Aguazul, la siembra fue realizada por BP antiguo operador \ndel proyecto.\n\nResolución No. 000150       Del 02 FEB. 2024          Hoja No. 14 de 28\n “POR LA CUAL SE RESUELVE UN RECURSO DE REPOSICIÓN”\nPágina 14 de 28\nPosteriormente a través del convenio ENV007-2007, la Sociedad efectúo una resiembra, en el predio \nEl Deseo cuyos costos se adicionan al valor anteriormente mencionado.\n➢\nValor ejecutado mediante el convenio ENV007 de 2007.\nLa segunda etapa de la reforestación con cargo a la inversión forzosa de no menos del 1% se realizó \nmediante el convenio ENV007 de 2007, suscrito entre CORPORINOQUIA y la Fundación Amanecer. \nA través del convenio ENV 007-2007 se realizó una resiembra con una inversión total a cargo de la \nobligación de inversión forzosa de no menos del 1% de $2.410.446.726, según consta en el \ndocumento firmado por el jefe de contabilidad de la Fundación Amanecer, expedido el 29 de abril de \n2023, que a continuación se relaciona:\nImagen 3 Captura de Pantalla Documento inversión contrato ENV007-2007\nFuente: Radicado 2021258260-1-000 del 29 de noviembre de 2021\nLa Sociedad efectúo la distribución de costos en proporción a las hectáreas reforestadas de cada \nproyecto, asignando la suma de $15.5227.316,71 para el expediente LAM0272, proyecto “Cupiagua \nXB”, según se observa en las siguientes Imágenes:\n\nResolución No. 000150       Del 02 FEB. 2024          Hoja No. 15 de 28\n “POR LA CUAL SE RESUELVE UN RECURSO DE REPOSICIÓN”\nPágina 15 de 28\nImagen 4 Captura de Pantalla Distribución de costos Convenio ENV007-2007\nFuente: Radicado 2021258260-1-000 del 29 de noviembre de 2021\nAcorde con lo anterior mediante el convenio ENV007-2007 se ejecutó la suma ($15.227.316,71) \ncorresponde a la resiembra del lote 14 del predio El Deseo ubicado en la vereda Alto Cupiagua, de \npropiedad de la Alcaldía de Aguazul.\nEn la siguiente tabla se resumen los valores ejecutados en desarrollo del proyecto de “Restauración, \nconservación y protección de la cobertura vegetal, enriquecimientos vegetales y aislamiento de áreas \npara facilitar la sucesión natural”, Programa “Reforestación de 5 ha.”  realizado en el predio El Deseo \nubicado en la vereda Altos de Cupiagua, municipio de Aguazul.\nTabla 1. Resumen valores ejecutados proyecto Reforestación 4.5 ha predio Cupiagua XC\nActividades \nValor \nConvenio \nENV002-2004\nConvenio \nENV007-\n2007\nTotal\nAislamiento\n $     1.415.752,32 \n $                         -   \n $       1.415.752,32 \nAsistencia Técnica\n        3.687.523,06 \n0\n          7.291.888,46 \nEstablecimiento\n        9.958.265,98 \n          3.604.365,40 \n        17.951.798,75 \nMantenimiento\n      22.804.894,29 \n          7.993.532,77 \n        26.434.312,83 \nGuardabosques\n           798.380,55 \n          3.629.418,54 \n        16.025.697,26 \nSubtotal\n $   38.664.816,20 \n $     15.227.316,71 \n $     53.892.132,91 \nFuente: Radicado 2021258260-1-000 del 29 de noviembre de 2021\n\nResolución No. 000150       Del 02 FEB. 2024          Hoja No. 16 de 28\n “POR LA CUAL SE RESUELVE UN RECURSO DE REPOSICIÓN”\nPágina 16 de 28\nAsí las cosas, de conformidad con los soportes financieros entregados en el radicado 2021258260-\n1-000 del 29 de noviembre de 2021, se concluye que el valor ejecutado del proyecto de Reforestación \nde 5 ha, en el predio El Desengaño ubicado en la vereda Altos de Cupiagua corresponde a la suma \nde CINCUENTA Y TRES MILLONES OCHOCIENTOS NOVENTA Y DOS MIL CIENTO TREINTA Y \nDOS PESOS CON NOVENTA Y UN CENTAVOS ($53.892.132,91) M/CTE, el cual fue ejecutado a \ntravés de los convenios ENV002-2004 y ENV-007 de 2007, suscritos entre  CORPORINOQUIA y la \nFundación Amanecer.\nAcorde con lo anterior se recomienda al área jurídica, modificar el artículo segundo de la Resolución \n2104 del 13 de septiembre de 2023, el cual quedará así.\nARTÍCULO SEGUNDO. ACEPTAR como ejecutado la suma de CINCUENTA Y TRES MILLONES \nOCHOCIENTOS NOVENTA Y DOS MIL CIENTO TREINTA Y DOS PESOS CON NOVENTA Y UN \nCENTAVOS ($53.892.132,91) M/CTE, del proyecto de “Reforestación de 5 ha” realizado en el Predio \nEl Deseo, ubicado en la vereda Altos de Cupiagua, municipio de Aguazul. El cual fue desarrollado \nbajo los convenios ENV002 de 2004 y ENV007 de 2007, en la línea de “conservación y protección \nde la cobertura vegetal, enriquecimientos vegetales y aislamiento de áreas para facilitar la sucesión \nnatural”, del proyecto Cupiagua XB, con cargo al plan de inversión forzosa de no menos del 1%. (…)” \nCon relación a los principios, éstos son considerados normas jurídicas toda vez que \nestablecen un deber ser y demandan un determinado comportamiento, por lo que en sí \nmismos son fuente de derecho. La jurisprudencia del Consejo de Estado ha señalado que \nlos principios constituyen un criterio o parámetro de conducta (Sentencia, 2013, Rad. \n11001-03-06-000-2013-00516-00, Col.), así: \n“Los principios son los valores de la sociedad transformados por el derecho en criterios o \nparámetros de conducta fundamentales que instruyen y rigen las relaciones jurídicas en el \nEstado, pues a la vez que inspiran las reglas de conducta, también se proyectan en el \nordenamiento jurídico para irradiar e impregnar esos axiomas, patrones, modelos o arquetipos \nde comportamiento ético, cultural o social a las situaciones generales e individuales; y mientras \nen las reglas el juicio de valor ya se encuentra establecido al consagrar la proposición en que \nella consiste, en los principios, sea que se contemplen o no en normas positivas, corresponde \nal intérprete realizar ese juicio a través de una operación intelectiva acerca de la coincidencia \nde una situación concreta con el valor correspondiente, para determinar su observancia.”\nConforme con lo expuesto, el Código de Procedimiento Administrativo y de lo Contencioso \nAdministrativo en su artículo 3, establece que las autoridades administrativas deben \ninterpretar y aplicar las disposiciones que regulan las actuaciones y procedimientos \nadministrativos tomando en consideración, además de los principios señalados en la \nConstitución, los establecidos en leyes especiales y en el Código.\n“(…) ARTÍCULO 3o. PRINCIPIOS. Todas las autoridades deberán interpretar y aplicar las \ndisposiciones que regulan las actuaciones y procedimientos administrativos a la luz de los \nprincipios consagrados en la Constitución Política, en la Parte Primera de este Código y en las \nleyes especiales. Las actuaciones administrativas se desarrollarán, especialmente, con arreglo a \nlos principios del debido proceso, igualdad, imparcialidad, buena fe, moralidad, participación, \nresponsabilidad, transparencia, publicidad, coordinación, eficacia, economía y celeridad. 1. En \nvirtud del principio del debido proceso, las actuaciones administrativas se adelantarán de \nconformidad con las normas de procedimiento y competencia establecidas en la Constitución y la \nley, con plena garantía de los derechos de representación, defensa y contradicción. (…)”\nEn dicho artículo 3 del CPACA, se encuentran direccionamientos claros del alcance, entre \notros, de los principios de eficacia, y celeridad administrativa:\n\nResolución No. 000150       Del 02 FEB. 2024          Hoja No. 17 de 28\n “POR LA CUAL SE RESUELVE UN RECURSO DE REPOSICIÓN”\nPágina 17 de 28\n “(…) 7. En virtud del principio de responsabilidad, las autoridades y sus agentes asumirán las \nconsecuencias por sus decisiones, omisiones o extralimitación de funciones, de acuerdo con \nla Constitución, las leyes y los reglamentos.\n(…)\n11. En virtud del principio de eficacia, las autoridades buscarán que los procedimientos logren \nsu finalidad y, para el efecto, removerán de oficio los obstáculos puramente formales, evitarán \ndecisiones inhibitorias, dilaciones o retardos y sanearán, de acuerdo con este Código las \nirregularidades procedimentales que se presenten, en procura de la efectividad del derecho \nmaterial objeto de la actuación administrativa. \n(…)\n13. En virtud del principio de celeridad, las autoridades impulsarán oficiosamente los \nprocedimientos, e incentivarán el uso de las tecnologías de la información y las \ncomunicaciones, a efectos de que los procedimientos se adelanten con diligencia, dentro de \nlos términos legales y sin dilaciones injustificadas. (…)”\nAhora bien, conforme lo señala el tratadista Libardo Rodríguez1, en su escrito Derecho \nAdministrativo General y Colombiano menciona lo siguiente:\n“El principio de la responsabilidad patrimonial del Estado (art.90). En virtud de este principio, \nlas entidades públicas son responsables por la reparación de los daños antijurídicos que se \ncausen como consecuencia de sus actuaciones y omisiones2. \nEn línea con lo anterior, sobre el principio de eficacia, la Corte Constitucional (Sentencia T-\n733/2009) ha declarado: \n“(…) Como se ve, el principio de eficacia de la administración pública impide a las autoridades \nadministrativas permanecer impávidas o inactivas frente a situaciones que afecten a los \nciudadanos; además de configurarse como un fin hacia el cual deben tender dichas \nautoridades. En este orden, la implementación práctica de ello supone la obligación de \nactuación de la administración, y de la real y efectiva ejecución de medidas, y no sólo la \naceptación o reflexión sobre aquello que requiere su intervención. De ahí, que la jurisprudencia \nconstitucional haya puntualizado también la necesidad de considerar los procedimientos de \nlas autoridades bajo la noción de debido proceso administrativo. (…)”\nSumado a lo anterior, es claro que el principio de eficacia está orientado a que los \nprocedimientos que adelanta la administración logren su finalidad, y si bien es cierto que se \ndeben remover los obstáculos meramente formales, también es cierto que se deben evitar \nlas decisiones inhibitorias. Dicho de otra manera, la eficacia administrativa no implica que \nse deban pasar por alto requisitos fundamentales para la toma de decisiones. \nEste principio ha sido desarrollado por el Doctor Santofimio (2003, p. 75), así: \n“(…) Se pretende con su aplicación que las normas de procedimiento administrativo agilicen \nlas decisiones y, en consecuencia, que las actuaciones administrativas se cumplan en el \nmenor tiempo posible. El procedimiento debe buscar, de igual modo, la disminución de los \n1 Rodríguez Ramírez Libardo, Derecho Administrativo General y Colombiano., Editorial Temis 2017, pág. 99\n2 Sobre la responsabilidad patrimonial del Estado, veáse infra, núms 916 y ss.\n\nResolución No. 000150       Del 02 FEB. 2024          Hoja No. 18 de 28\n “POR LA CUAL SE RESUELVE UN RECURSO DE REPOSICIÓN”\nPágina 18 de 28\ngastos en que pueda incurrir tanto el administrado como la administración, y desde el punto \nde vista material, que no se exijan más documentos y copias que los estrictamente necesarios, \nni autenticaciones ni notas de presentación personal, sino cuando la ley lo ordene de forma \nexpresa. (…) \n[E]l agotamiento de los procedimientos administrativos no es otra cosa, desde el punto de vista \nmaterial, que la efectividad de los derechos e intereses de los administrados. Esto es, a través \ndel acatamiento a los contenidos del principio de la economía no solo se consolida el concepto \nde debido proceso, sino también el de las finalidades propias de la administración pública en \nsu relación con los asociados. Aspecto este que a todas luces le otorga relevancia al derecho \nsustancial sobre el estrictamente formal en las actuaciones administrativas. (…)”\nConcordante con los anteriores, referente al principio de celeridad el Doctor Santofimio \n(2003, p. 75-76) ha señalado a la luz de lo dispuesto por la Corte Constitucional mediante \nSentencia T-731 de 1998, así como lo expresado por el Consejo de Estado en la Sentencia \ndel 21 de noviembre de 1989, lo siguiente: \n“A través de la celeridad se le imprime la fuerza necesaria tanto a los elementos formales \ncomo sustanciales del procedimiento que permitan proteger al asociado, otorgándole las \ngarantías indispensables y logrando decisiones de fondo. Se trata, por lo tanto, de un principio \ndinámico de impulso permanente y continuo cuyo objeto no es otro que el de la preservación \ndel debido proceso; y su finalidad, la efectividad de los derechos e intereses de los \nadministrados. Comporta necesariamente agilidad y prontitud, con el propósito que su gestión \nse cumpla cabalmente. Pretende este principio que en la actividad administrativa las \nautoridades impriman al procedimiento la máxima dinámica posible. De ahí que deberán ser \nlos conductores oficiosos de las actuaciones administrativas, podrán suprimir todos aquellos \ntrámites innecesarios y procurarán, en la medida de lo posible, utilizar formas impresas en \naquellas actuaciones que por su estricta formalidad lo faciliten. La ejecución de este principio \nno puede ser motivo para que las autoridades se abstengan de considerar todos los \nargumentos y pruebas que los interesados aporten de manera legal y oportuna. La celeridad \nprocesal implica para los funcionarios el cumplimiento de sus obligaciones procesales-\nadministrativas. (…)” \nAl respecto, vale la pena resaltar lo señalado en la sentencia C-035 de 1999:\n \n“Los principios de eficacia, economía y celeridad que rigen las actuaciones de las autoridades \nadministrativas, constituyen precisamente orientaciones que deben guiar la actividad de éstas \npara que la acción de la administración se dirija a obtener la finalidad o los efectos \nprácticos a que apuntan las normas constitucionales y legales, buscando el mayor \nbeneficio social al menor costo. En tal virtud, la observancia de dichos principios no \nconstituye un fin en sí mismo, pues su acatamiento busca precisamente que se convierta en \nrealidad el cumplimiento de los deberes sociales del Estado en materia ambiental. El posible \nconflicto entre la efectividad de los aludidos principios de la función administrativa y la \nnecesidad de cumplimiento de los deberes sociales del Estado se resuelve en beneficio de \nesto último, porque es inconcebible que aquéllos predominen sobre el bien superior de \natender valiosos deberes sociales del Estado, como son los atinentes a la preservación del \nambiente. (…)”\nAsí las cosas, la Autoridad Nacional es garante de la Constitución, de la Ley, de los \nprincipios de la función administrativa y de los procedimientos que rigen la actuación \nadministrativa en materia ambiental; en ese sentido los actos y pronunciamientos que se \nprofieren en el marco de los procesos de seguimiento de los instrumentos de manejo y \ncontrol se encuentran debidamente sustentados tanto técnica como jurídicamente; es así \n\nResolución No. 000150       Del 02 FEB. 2024          Hoja No. 19 de 28\n “POR LA CUAL SE RESUELVE UN RECURSO DE REPOSICIÓN”\nPágina 19 de 28\ncomo en aplicación de los principios de responsabilidad, eficacia, celeridad y debido \nproceso la Autoridad Nacional expidió la Resolución 2104 del 13 de septiembre de 2023 \nrespetando las normas jurídicas superiores, la normativa ambiental vigente y conforme a \nlos soportes presentados por la Sociedad. \nAhora bien, luego de revisar la información obrante en el Sistema de Información de \nLicencias Ambientales – SILA, respecto al expediente LAM0722, con relación a la línea de \ninversión de “Restauración, conservación y protección de la cobertura vegetal, \nenriquecimientos vegetales y aislamiento de áreas para facilitar la sucesión natural” se \nconstató que a través de la comunicación con radicación 2021258260-1-000 del 29 de \nnoviembre de 2021 la Sociedad presentó los soportes de ejecución del programa \n“Reforestación de 5 ha.”  realizado en el predio El Deseo el cual fue ejecutado con cargo a \nlos recursos de la obligación de la inversión forzosa de no menos del 1%, el cual se ejecutó \na través de dos (2) convenios: Convenio ENV002 de 2004 y Convenio ENV007 de 2007, \nsuscritos entre CORPORINOQUIA y la Fundación Amanecer.\nAcorde con lo anterior, mediante el convenio ENV002-2004 se ejecutó la suma de TREINTA \nY OCHO MILLONES SEISCIENTOS SESENTA Y CUATRO MIL OCHOCIENTOS \nDIECISÉIS PESOS CON DIECINUEVE CENTAVOS MCTE ($38.664.816,19) que \ncorresponde al establecimiento de 5 ha en el lote 14 del predio El Deseo ubicado en la \nvereda Alto Cupiagua, de propiedad de la Alcaldía de Aguazul, la siembra fue realizada por \nla Sociedad BRITISH PETROLEUM EXPLORATION COMPANY COLOMBIA LTDA antigua \ntitular de la licencia ambiental y adicionalmente mediante el convenio ENV007-2007 se \nejecutó la suma de ($15.227.316,71) que corresponde a la resiembra del lote 14 del predio \nEl Deseo ubicado en la vereda Alto Cupiagua, de propiedad de la Alcaldía de Aguazul.\nDicho lo anterior, de conformidad con los soportes financieros de ejecución del programa \n“Reforestación de 5 ha.” presentados a través de la comunicación con radicación \n2021258260-1-000 del 29 de noviembre de 2021 se concluye que el valor ejecutado del \nproyecto de “Reforestación de 5 ha”, en el predio El Desengaño ubicado en la vereda Altos \nde Cupiagua corresponde a la suma de CINCUENTA Y TRES MILLONES OCHOCIENTOS \nNOVENTA Y DOS MIL CIENTO TREINTA Y DOS PESOS CON NOVENTA Y UN \nCENTAVOS ($53.892.132,91) M/CTE, el cual fue ejecutado a través de los convenios \nENV002-2004 y ENV-007 de 2007, suscritos entre  CORPORINOQUIA y la Fundación \nAmanecer.\nAdicional a esto, frente a lo expuesto por la Sociedad, con relación a “(…) es claro que el \nartículo segundo y tercero de la Resolución No. 2104 de 13 de septiembre de 2023, no acogieron \nni tuvieron en cuenta las observaciones contenidas en el Acta No. 853 de 28 de noviembre de \n2022, adicionalmente carecen de pertinencia y fundamento técnico, lo que ocasiona una \nconsecuencia jurídica desfavorable, toda vez que Ecopetrol S.A. dio cumplimiento a las citadas \nobligaciones bajo los montos establecidos y soportados en los Convenios ENV002-2004 y ENV007-\n2007, cuyos soportes fueron presentados oportunamente con el radicado No. 2021258260-1-000 de \n29 de noviembre de 2021, el cual hace parte del expediente de la referencia. (…)”, no es cierta \nesta afirmación dado que esta Autoridad actúo en estricto acatamiento de los principios del \ndebido \nproceso, \nigualdad, \nimparcialidad, \nbuena \nfe, \nmoralidad, \nparticipación, \nresponsabilidad, transparencia, publicidad, coordinación, eficacia, economía y celeridad, en \ntanto, la Resolución 2104 de 13 de septiembre de 2023, se emitió respetando las normas \n\nResolución No. 000150       Del 02 FEB. 2024          Hoja No. 20 de 28\n “POR LA CUAL SE RESUELVE UN RECURSO DE REPOSICIÓN”\nPágina 20 de 28\njurídicas superiores, la normativa ambiental vigente y conforme a los soportes presentados \npor la Sociedad. \nAsí las cosas, no son de recibo los argumentos expuestos por la Sociedad recurrente; y \nteniendo en cuenta las consideraciones expuestas en el Concepto Técnico 31 del 5 de \nenero de 2024, la Autoridad Nacional, procederá a modificar el Artículo segundo de la \nResolución 2104 del 13 de septiembre de 2023, tal como se reflejará en la parte resolutiva \ndel presente acto administrativo. \n2.\nDISPOSICIÓN RECURRIDA –ARTÍCULO TERCERO DE LA RESOLUCIÓN 2104 DEL \n13 DE SEPTIEMBRE DE 2023.\n2.1 Petición de la Sociedad.\n“(…) ARTÍCULO TERCERO. ACEPTAR a la sociedad ECOPÉTROL S.A., liquidación parcial \nde la inversión forzosa de no menos del 1%, que corresponde a la suma de CUARENTA Y \nNUEVE MILLONES MIL TRESCIENTOS OCHENTA Y CUATRO PESOS CON SETENTA Y \nOCHO CENTAVOS MCTE ($49.001.384,78), en relación a la línea de inversión de \n“Restauración, conservación y protección de la cobertura vegetal, enriquecimientos vegetales \ny aislamiento de áreas para facilitar la sucesión natural” el proyecto “Reforestación de 4.5 ha \n.” ubicado en el predio Cupiagua XC, del proyecto Cupiagua XC, aprobado mediante el artículo \nprimero de la Resolución 01606 del 30 de septiembre de 2020. (…)”\n2.2 Argumentos de la Sociedad.\nCon relación al Artículo Tercero de la Resolución 2104 del 13 de septiembre de 2023, esta \nAutoridad Nacional, tendrá en cuenta los argumentos presentados por la sociedad de \nmanera unificada los cuales se encuentran contenidos en el Numeral 1.2 \"Argumentos de \nla Sociedad\" del presente acto administrativo.\n2.3\nConsideraciones de la Autoridad Nacional.\nA través del Concepto Técnico 31 del 5 de enero de 2024, el equipo técnico de la Autoridad \nNacional consideró:\n“(…) Una vez revisado el radicado 2021258260-1-000 del 29 de noviembre de 2021 y sus anexos, \ncon relación a la línea de inversión de “Restauración, conservación y protección de la cobertura \nvegetal, enriquecimientos vegetales y aislamiento de áreas para facilitar la sucesión natural” se \nencuentran los soportes de ejecución del programa “Reforestación de 4.55 ha.”  realizado en el \npredio Cupiagua XC, el cual fue ejecutado con cargo a los recursos de la obligación de la inversión \nforzosa de no menos del 1% del proyecto “Cupiagua XC”. \nEn primer lugar, esta Autoridad se permite aclarar que la reforestación de las 4.5 ha en el predio \nCupiagua XC, se ejecutó a través de dos (2) convenios: Convenio ENV002 de 2004 y ENV007 de \n2007, suscritos entre CORPORINOQUIA y la Fundación Amanecer. A continuación, se exponen los \nmontos ejecutados en cada uno de los convenios mencionados.\n➢\nValor ejecutado mediante el convenio ENV002 de 2004.\nLa primera etapa de la Reforestación de 4.5 ha en el predio denominado Cupiagua XC, se realizó \nmediante el convenio ENV002 del 26 de noviembre de 2004.\n\nResolución No. 000150       Del 02 FEB. 2024          Hoja No. 21 de 28\n “POR LA CUAL SE RESUELVE UN RECURSO DE REPOSICIÓN”\nPágina 21 de 28\nA través del convenio ENV 002-2004 se reforestaron 231,72 ha con una inversión total a cargo de la \nobligación de inversión forzosa de no menos del 1% de $1.756.023.214,67; según consta en el \ndocumento de liquidación del convenio, que la Sociedad entregó en el radicado 2021258260-1-000 \ndel 29 de noviembre de 2021.\nAhora bien, luego de la distribución de costos en proporción a las hectáreas reforestadas de cada \nproyecto, la Sociedad asignó la suma de $49.001.384,78 al proyecto “Cupiagua XC”, según se \nobserva en la siguiente Imagen.\nImagen 5 Captura de Pantalla distribución de montos convenio ENV002-2004 por proyecto.\nFuente: Radicado 2021258260-1-000 del 29 de noviembre de 2021\n\nResolución No. 000150       Del 02 FEB. 2024          Hoja No. 22 de 28\n “POR LA CUAL SE RESUELVE UN RECURSO DE REPOSICIÓN”\nPágina 22 de 28\nDe acuerdo con los anteriores soportes financieros, mediante el convenio ENV002-2004 se ejecutó \nla suma de CUARENTA Y NUEVE MILLONES UN MIL TRESCIENTOS OCHENTA Y CUATRO \nPESOS CON SETENTA Y OCHO CENTAVOS MCTE ($49.001.384,78) corresponde al \nestablecimiento de 4.55 ha en el predio Cupiagua XC.\nPosteriormente a través del convenio ENV007-2007, la Sociedad efectúo una resiembra, en el predio \nCupiagua XC, cuyos costos se adicionan al valor anteriormente mencionado.\n➢\nValor ejecutado mediante el convenio ENV007 de 2007.\nLa segunda etapa de la reforestación de 4.5 ha en el predio Cupiagua XC con cargo a la inversión \nforzosa de no menos del 1% se realizó mediante el convenio ENV007 de 2007, suscrito entre \nCORPORINOQUIA y la Fundación Amanecer. \nA través del convenio ENV 007-2007 se realizó una resiembra con una inversión total a cargo de la \nobligación de inversión forzosa de no menos del 1% de $2.410.446.726, según consta en el \ndocumento firmado por el jefe de contabilidad de la Fundación Amanecer, expedido el 29 de abril de \n2023, entregado mediante radicado 2021258260-1-000 del 29 de noviembre de 2021.\nLa Sociedad efectúo la distribución de costos en proporción a las hectáreas reforestadas de cada \nproyecto, asignando la suma de $8.295.302,88 para el expediente LAM0272, proyecto “Cupiagua \nXC”, según se observa en las siguientes Imágenes.\nImagen 6 Captura de Pantalla Distribución de costos Convenio ENV007-2007\n\nResolución No. 000150       Del 02 FEB. 2024          Hoja No. 23 de 28\n “POR LA CUAL SE RESUELVE UN RECURSO DE REPOSICIÓN”\nPágina 23 de 28\nFuente: Radicado 2021258260-1-000 del 29 de noviembre de 2021\nAcorde con lo anterior mediante el convenio ENV007-2007 se ejecutó la suma ($8.295.302,88) \ncorresponde a la resiembra del predio Cupiagua XC.\nEn la siguiente tabla se resumen los valores ejecutados en desarrollo del proyecto de “Restauración, \nconservación y protección de la cobertura vegetal, enriquecimientos vegetales y aislamiento de áreas \npara facilitar la sucesión natural”, Programa “Reforestación de 4.5 ha.”  realizado en el predio \nCupiagua XC, ubicado en la vereda Altos de Cupiagua, municipio de Aguazul.\nTabla 2. Resumen valores ejecutados proyecto Reforestación 4.5 ha predio Cupiagua XC\nActividades \nValor Convenio \nENV002-2004\nConvenio ENV007-\n2007\nTotal\nAislamiento\n $     1.274.177,08 \n $       1.148.571,02 \n $       2.422.748,10 \nAsistecia Técnica\n        4.375.426,31 \n0\n          4.375.426,31 \nEstablecimiento\n        5.054.798,53 \n                            -  \n        11.379.750,72 \nMantenimiento\n      27.105.573,82 \n          6.324.952,19 \n        27.927.353,49 \nGuardabosques\n      11.191.409,03 \n             821.779,67 \n        19.486.711,91 \nSubtotal\n $   49.001.384,77 \n $       8.295.302,88 \n $     57.296.687,65 \nFuente: Radicado 2021258260-1-000 del 29 de noviembre de 2021\nAsí las cosas, de conformidad con los soportes financieros entregados en el radicado 2021258260-\n1-000 del 29 de noviembre de 2021, se concluye que el valor ejecutado del proyecto de Reforestación \nde 4.5 ha, en el predio Cupiagua XC, corresponde a la suma de CINCUENTA Y SIETE MILLONES \nDOSCIENTOS NOVENTA Y SEIS MIL SEISCIENTOS OCHENTA Y SIETE PESOS CON SESENTA \nY CINCO CENTAVOS ($57.296.687,65) M/CTE, el cual fue ejecutado a través de los convenios \nENV002-2004 y ENV-007 de 2007, suscritos entre  CORPORINOQUIA y la Fundación Amanecer.\n(…)”\nAhora bien, luego de revisar la información obrante en el Sistema de Información de \nLicencias Ambientales – SILA, respecto al expediente LAM0722, con relación a la línea de \ninversión de “Restauración, conservación y protección de la cobertura vegetal, \nenriquecimientos vegetales y aislamiento de áreas para facilitar la sucesión natural” se \nconstató que a través de la comunicación con radicación 2021258260-1-000 del 29 de \nnoviembre de 2021 la Sociedad presentó los soportes de ejecución del programa \n“Reforestación de 4.55 ha.”  realizado en el predio Cupiagua XC, el cual fue ejecutado con \ncargo a los recursos de la obligación de la inversión forzosa de no menos del 1%, el cual \nse ejecutó a través de dos (2) convenios: Convenio ENV002 de 2004 y Convenio ENV007 \nde 2007, suscritos entre CORPORINOQUIA y la Fundación Amanecer.\n\nResolución No. 000150       Del 02 FEB. 2024          Hoja No. 24 de 28\n “POR LA CUAL SE RESUELVE UN RECURSO DE REPOSICIÓN”\nPágina 24 de 28\nAcorde con lo anterior mediante el convenio ENV002-2004 se ejecutó la suma de \nCUARENTA Y NUEVE MILLONES UN MIL TRESCIENTOS OCHENTA Y CUATRO \nPESOS CON SETENTA Y OCHO CENTAVOS MCTE ($49.001.384,78) corresponde al \nestablecimiento de 4.55 ha en el predio Cupiagua XC y adicionalmente mediante el \nconvenio ENV007-2007 se ejecutó la suma de ($8.295.302,88) que corresponde a la \nresiembra del predio Cupiagua XC.\nDicho lo anterior, de conformidad con los soportes financieros de ejecución del programa \n“Reforestación de 4.5 ha.” presentados a través de la comunicación con radicación \n2021258260-1-000 del 29 de noviembre de 2021 se concluye que el valor ejecutado del \nproyecto de “Reforestación de 4.5 ha.” en el predio Cupiagua XC, ubicado en la vereda \nAltos de Cupiagua, municipio de Aguazul, corresponde a la suma de CINCUENTA Y SIETE \nMILLONES DOSCIENTOS NOVENTA Y SEIS MIL SEISCIENTOS OCHENTA Y SIETE \nPESOS CON SESENTA Y CINCO CENTAVOS ($57.296.687,65) M/CTE, el cual fue \nejecutado a través de los convenios ENV002-2004 y ENV-007 de 2007, suscritos entre \nCORPORINOQUIA y la Fundación Amanecer.\nAsí las cosas, y teniendo en cuenta las consideraciones expuestas en el Concepto Técnico \n31 del 5 de enero de 2024, la Autoridad Nacional procederá a modificar el Artículo Tercero \nde la Resolución 2104 del 13 de septiembre de 2023, tal como se reflejará en la parte \nresolutiva del presente acto administrativo.\nCon todo y lo anterior, es de precisar que el artículo 45 de la Ley 1437 de 2011, por la cual \nse expide el Código de Procedimiento Administrativo y de lo Contencioso Administrativo, \nseñala lo siguiente en relación a la corrección de los errores simplemente formales: \n“Artículo 45. Corrección de errores formales. En cualquier tiempo, de oficio o a petición de \nparte, se podrán corregir los errores simplemente formales contenidos en los actos \nadministrativos, ya sean aritméticos, de digitación, de transcripción o de omisión de palabras. \nEn ningún caso la corrección dará lugar a cambios en el sentido material de la decisión, ni \nrevivirá los términos legales para demandar el acto. Realizada la corrección, esta deberá ser \nnotificada o comunicada a todos los interesados, según corresponda.” \nEn cuanto a la corrección de errores formales el Consejo de Estado en sentencia del \nveintiséis (26) de febrero de dos mil catorce (2014) de la Sección Cuarta de la Sala de lo \nContencioso Administrativo con ponencia de la Consejera Martha Briceño de Valencia, \nseñaló: \n“Así pues, para que la Administración pueda ejercer la facultad de corregir los errores \naritméticos o de transcripción, es necesario que el error sea evidente, esto es, que no \nmodifique la “[E]ficacia sustancial del acto en que existe” o, como lo ha dicho la Sala, que no \nafecte el contenido sustancial del acto administrativo que se corrige. Asimismo, la apreciación \ndel error descarta una “[O]peración de calificación jurídica”, como lo precisó la doctrina, y la \ncorrección de este no puede alterar fundamentalmente el sentido del acto corregido […] \nteniendo en cuenta que los errores de transcripción pueden corregirse en cualquier tiempo, \nporque no afectan el contenido sustancial del acto corregido” (Subrayado fuera del texto). \n\nResolución No. 000150       Del 02 FEB. 2024          Hoja No. 25 de 28\n “POR LA CUAL SE RESUELVE UN RECURSO DE REPOSICIÓN”\nPágina 25 de 28\nPara el caso en concreto, el Concepto Técnico 31 del 5 de enero de 2024, concluye que en \nla elaboración de la Resolución recurrida, se incurrió en errores de digitación en los artículos \nprimero, cuarto y sexto de la Resolución 2104 del 13 de septiembre de 2023 (Concepto \ntécnico insumo/fundamento 7298 del 25 de noviembre de 2022), dado que se mencionó \n“Aceptar a la Sociedad ECOPETROL S.A., liquidación parcial de la inversión forzosa de no \nmenos del 1%”; cuando lo que se acepta como ejecutados con cargo al plan de inversión \nforzosa de no menos del 1% son los cinco programas y/o proyectos: “Conservación de \n27,59 ha”, “Reforestación de 5 ha.”, “Reforestación de 4.5 ha”, “Elaboración del Plan de \nOrdenación y Manejo de la Cuenca Hidrográfica” para el Rio Únete, del proyecto Cupiagua \nXB y “Elaboración del Plan de Ordenación y Manejo de la Cuenca Hidrográfica” para el Rio \nÚnete, del proyecto Cupiagua XC del proyecto Área de Pozos Cupiagua múltiples XB y XC \nlos cuales hacen parte de la línea de inversión de “Restauración, conservación y protección \nde la cobertura vegetal, enriquecimientos vegetales y aislamiento de áreas para facilitar la \nsucesión natural”\nConforme con lo expuesto, de manera oficiosa la Autoridad Nacional, modificará los \nartículos primero, cuarto y quinto de la Resolución 2104 del 13 de septiembre de 2023, en \nel sentido de señalar que se acepta como ejecutado con cargo al plan de inversión forzosa \nde no menos del 1%, los programas y/o proyectos en mención, tal como se reflejará en la \nparte resolutiva del presente acto administrativo.\nRESUELVE\nARTÍCULO PRIMERO. Modificar el contenido del Artículo Primero de la Resolución 2104 \ndel 13 de septiembre de 2023, de conformidad con lo expuesto en la parte motiva del \npresente acto administrativo, el cual quedará de la siguiente manera.\n“ARTÍCULO PRIMERO. ACEPTAR como ejecutado con cargo al plan de inversión forzosa \nde no menos del 1%, la suma de VEINTISÉIS MILLONES TRESCIENTOS DIECISIETE \nSEISCIENTOS TREINTA Y UN PESOS CON NOVENTA Y SIETE CENTAVOS MCTE \n($26.317.631,97), del proyecto de “Conservación de 27,59 ha” distribuidas en ocho (8) lotes \nlocalizados en inmediaciones de Cupiagua XC, cuenca La Vegana, del proyecto Cupiagua \nXC, en la línea de inversión de “Restauración, conservación y protección de la cobertura \nvegetal, enriquecimientos vegetales y aislamiento de áreas para facilitar la sucesión natural”, \naprobado mediante el artículo primero de la Resolución 01606 del 30 de septiembre de 2020.” \nARTÍCULO SEGUNDO. Modificar el contenido del Artículo Segundo de la Resolución 2104 \ndel 13 de septiembre de 2023, de conformidad con lo expuesto en la parte motiva del \npresente acto administrativo, el cual quedará de la siguiente manera:\n“ARTICULO SEGUNDO. ACEPTAR como ejecutado con cargo al plan de inversión forzosa \nde no menos del 1%, la suma de CINCUENTA Y TRES MILLONES OCHOCIENTOS \nNOVENTA Y DOS MIL CIENTO TREINTA Y DOS PESOS CON NOVENTA Y UN \nCENTAVOS ($53.892.132,91) M/CTE, del proyecto de “Reforestación de 5 ha” realizado en \nel Predio El Deseo, ubicado en la vereda Altos de Cupiagua, municipio de Aguazul. El cual \nfue desarrollado bajo los convenios ENV002 de 2004 y ENV007 de 2007, en la línea de \n“Conservación y protección de la cobertura vegetal, enriquecimientos vegetales y aislamiento \nde áreas para facilitar la sucesión natural”, del proyecto Cupiagua XB, aprobado mediante el \nartículo primero de la Resolución 01606 del 30 de septiembre de 2020\n\nResolución No. 000150       Del 02 FEB. 2024          Hoja No. 26 de 28\n “POR LA CUAL SE RESUELVE UN RECURSO DE REPOSICIÓN”\nPágina 26 de 28\nARTÍCULO TERCERO. Modificar el contenido del Artículo Tercero de la Resolución 2104 \ndel 13 de septiembre de 2023, de conformidad con lo expuesto en la parte motiva del \npresente acto administrativo, el cual quedará de la siguiente manera;\n“ARTICULO TERCERO. ACEPTAR como ejecutado con cargo al plan de inversión forzosa \nde no menos del 1%, la suma de CINCUENTA Y SIETE MILLONES DOSCIENTOS \nNOVENTA Y SEIS MIL SEISCIENTOS OCHENTA Y SIETE PESOS CON SESENTA Y \nCINCO CENTAVOS ($57.296.687,65) M/CTE, del proyecto de “Reforestación de 4.5 ha” \nrealizado en el predio Cupiagua XC, ubicado en el municipio de Aguazul. El cual fue \ndesarrollado bajo los convenios ENV002 de 2004 y ENV007 de 2007, en la línea de \n“Conservación y protección de la cobertura vegetal, enriquecimientos vegetales y aislamiento \nde áreas para facilitar la sucesión natural”, del proyecto Cupiagua XC, aprobado mediante el \nartículo primero de la Resolución 01606 del 30 de septiembre de 2020.\nARTÍCULO CUARTO. Modificar el contenido del Artículo Cuarto de la Resolución 2104 del \n13 de septiembre de 2023, de conformidad con lo expuesto en la parte motiva del presente \nacto administrativo, el cual quedará de la siguiente manera:\n“ARTÍCULO CUARTO. ACEPTAR como ejecutado con cargo al plan de inversión forzosa \nde no menos del 1% la suma de SIETE MILLONES CIENTO SESENTA Y TRES MIL \nNOVENTA Y OCHO PESOS CON SESENTA CENTAVOS ($7.163.098.60), del proyecto \nformulación del POMCA del río Únete en relación con la línea de inversión de “Elaboración \ndel Plan de Ordenación y Manejo de la Cuenca Hidrográfica”, del proyecto Cupiagua XB, \naprobado mediante el artículo primero de la Resolución 01606 del 30 de septiembre de \n2020.”\nARTÍCULO QUINTO. Modificar el contenido del Artículo Quinto de la Resolución 2104 del \n13 de septiembre de 2023, de conformidad con lo expuesto en la parte motiva del presente \nacto administrativo, el cual quedará de la siguiente manera:\n“ARTÍCULO QUINTO. ACEPTAR como ejecutado con cargo al plan de inversión forzosa \nde no menos del 1% la suma de SIETE MILLONES CIENTO SESENTA Y TRES MIL \nNOVENTA Y OCHO PESOS CON SESENTA CENTAVOS ($7.163.098.60), del proyecto \nformulación del POMCA del río Únete, en relación a la línea de “Elaboración del Plan de \nOrdenación y Manejo de la Cuenca Hidrográfica”, del proyecto Cupiagua XC, aprobado \nmediante el artículo primero de la Resolución 01606 del 30 de septiembre de 2020.”\nARTÍCULO SEXTO. Los demás términos, condiciones y obligaciones establecidas en la \nResolución 2104 del 13 de septiembre de 2023, que no fueron objeto de pronunciamiento \nen el presente acto administrativo, continúan vigentes y exigibles en cualquier momento\nARTÍCULO SÉPTIMO. Notificar el presente acto administrativo al representante legal, o al \napoderado debidamente constituido o a la persona debidamente autorizada de la Sociedad \nECOPETROL S.A. con NIT 899999068-1, o a quien haga sus veces, de conformidad con \nlo dispuesto en los artículos 67 y 69 del Código de Procedimiento Administrativo y de lo \nContencioso Administrativo. \nPARÁGRAFO. En el evento en que el titular de la licencia o el permiso, según el caso, sea \nuna persona natural que se acoja al proceso de insolvencia regulado por las normas \nvigentes, o se trate de una sociedad comercial o de una sucursal de sociedad extranjera \nque entre en proceso de disolución o régimen de insolvencia empresarial o liquidación \n\nResolución No. 000150       Del 02 FEB. 2024          Hoja No. 27 de 28\n “POR LA CUAL SE RESUELVE UN RECURSO DE REPOSICIÓN”\nPágina 27 de 28\nregulados por las normas vigentes, informará inmediatamente de esta situación a esta \nAutoridad, con fundamento, entre otros, en los artículos 8, 58, 79, 80, 81, 95 numeral 8 de \nla Constitución Política de 1991, en la Ley 43 de 1990, en la Ley 222 de 1995, en la Ley \n1333 de 2009 y demás normas vigentes y jurisprudencia aplicable. \nAdicional a la obligación de informar a esta Autoridad de tal situación, el titular de la licencia \no permiso aprovisionará contablemente las obligaciones contingentes que se deriven de la \nexistencia de un procedimiento ambiental sancionatorio conforme con el artículo 40 de la \nLey 1333 de 2009 o la norma que la adicione, modifique o derogue. \nARTÍCULO OCTAVO. Por la Autoridad Nacional de Licencias Ambientales (ANLA), \ncomunicar el contenido del presente acto administrativo a la Corporación Autónoma \nRegional de la Orinoquía – CORPORINOQUÍA, y a la Alcaldía Municipal de Aguazul en el \ndepartamento de Casanare, para su conocimiento y fines pertinentes.\nARTÍCULO NOVENO. Publicar la presente Resolución en la Gaceta Ambiental de la \nAutoridad Nacional de Licencias Ambientales (ANLA) de conformidad con lo señalado en el \nartículo 71 de la Ley 99 del 22 de diciembre de 1993.\nARTÍCULO DÉCIMO. Contra el presente acto administrativo no procede recurso alguno, \nde conformidad con lo establecido en el artículo 87 del Código de Procedimiento \nAdministrativo y de lo Contencioso Administrativo.\nNOTIFÍQUESE, COMUNÍQUESE, PUBLÍQUESE Y CÚMPLASE \nDado en Bogotá D.C., a los 02 FEB. 2024\nEDILBERTO PENARANDA CORREA\nASESOR\nERIKA LORENA PARRADO CEPEDA\nPROFESIONAL ESPECIALIZADO\nBERTHA CECILIA MATTOS RODRIGUEZ\nCONTRATISTA\nExpediente No. LAM0722\n\nResolución No. 000150       Del 02 FEB. 2024          Hoja No. 28 de 28\n “POR LA CUAL SE RESUELVE UN RECURSO DE REPOSICIÓN”\nPágina 28 de 28\nConcepto Técnico N° 31 del 5 de enero de 2024\nFecha: 2 de febrero 2024\nProceso No.: 20241000001504\nNota: Este es un documento electrónico generado desde los Sistemas de Información de la ANLA. El original reposa en los \narchivos digitales de la Entidad\n"
}