{
  "fuente": "ANLA_GACETA",
  "numero_resolución": "RESOLUCIÓN N° 000998",
  "fecha_resolución": "2024-02-02",
  "nombre_proyecto": "proyecto “Cupiagua K”, en el sentido de autorizar la quema",
  "ubicación": "departamento del Casanare.",
  "empresa": "a la Sociedad BP EXPLORATION COMPANY -COLOMBIA- LIMITED, a favor de la empresa ECOPETROL S.A.",
  "numero_expediente": "LAM0134",
  "radicados": [
    "2020062137",
    "2022005776",
    "20246200170942"
  ],
  "descripcion": "Por la cual se resuelve recurso de reposición interpuesto contra la Resolución 000138 del 02 de febrero de 2024",
  "tipos_infraccion": [
    "Residuos sólidos",
    "Incumplimiento del PMA"
  ],
  "pdf_id": "46541",
  "file_name": "ANLA_46541.pdf",
  "texto_completo": "República de Colombia\nMinisterio de Ambiente y Desarrollo Sostenible\nAUTORIDAD NACIONAL DE LICENCIAS \nAMBIENTALES\n- ANLA –\nRESOLUCIÓN N° 000998\n(30 MAY. 2024)\nPágina 1 de 24\n“Por la cual se resuelve recurso de reposición interpuesto contra la\nResolución 000138 del 02 de febrero de 2024”\nEL DIRECTOR DE LA AUTORIDAD NACIONAL DE LICENCIAS AMBIENTALES \n– ANLA\nEn uso de las competencias asignadas en la Ley 99 de 1993, la Ley 1437 de \n2011, el Decreto-ley 3573 del 27 de septiembre de 2011, el Decreto 1076 del 26 \nde mayo de 2015, el Decreto 376 de 11 de marzo de 2020, Resolución 1957 del 5 \nde noviembre de 2021, y La Resolución 1223 del 19 de septiembre de 2022, y  \nCONSIDERANDO:\nI.\nANTECEDENTES \nQue mediante la Resolución 0101 del 24 de mayo de 1994, el entonces Ministerio \ndel Medio Ambiente hoy Ministerio de Ambiente y Desarrollo Sostenible, en adelante \nMinisterio, otorgó a la sociedad BP EXPLORATION COMPANY COLOMBIA \nUMITED – BPXC Licencia Ambiental para la perforación del primer pozo Cupiagua \nK, en la plataforma del mismo nombre, a desarrollarse en el municipio de Aguazul, \ndepartamento del Casanare. \nQue a través de la Resolución 147 del 16 de febrero de 1996, el Ministerio, modificó \nla Licencia Ambiental al proyecto “Cupiagua K”, en el sentido de autorizar la quema \nde crudo de las pruebas de los pozos, hasta cuando empezara a operar la línea de \nflujo que une Cupiagua B4con la PST-1 de Cupiagua. \nQue mediante la Resolución 352 del 6 de mayo de 1997, el Ministerio, modificó el \nartículo 1° de la Resolución 147 del 16 de febrero de 1996, para autorizar la quema \nde los residuos de la operación de fracturamiento hidráulico en los pozos múltiples \nCupiagua K. \n\nResolución No. 000998       Del 30 MAY. 2024          Hoja No. 2 de 24\n“Por la cual se resuelve recurso de reposición interpuesto contra la Resolución 000138 del 02 de \nfebrero de 2024”\nPágina 2 de 24\nQue mediante la Resolución 1563 del 21 de octubre de 2005, el Ministerio modificó \nel numeral 9 del artículo tercero de la Resolución 0101 del 24 de mayo de 1994, \nestableciendo que los informes de cumplimiento deberían ser presentados por la \nsociedad BP EXPLORATION COMPANY COLOMBIA UMITED (BPXC) de forma \nanual.\nQue con Resolución 2125 del 6 de diciembre de 2007, el Ministerio, modificó la \nResolución 0101 del 24 de mayo de 1994, en el sentido de adicionar la siguiente \nobligación: \"La BP de conformidad con lo establecido en el parágrafo del artículo 43 \nde la Ley 99 de 1993 reglamentado por el Decreto 1900 de 2006, deberá destinar \ncomo mínimo un 1%, del valor del proyecto en actividades de recuperación, \npreservación y vigilancia de la cuenca hidrográfica del río Unete”. \nQue mediante Resolución 0623 del 31 de marzo de 2009, el Ministerio, resolvió \nrecurso de reposición interpuesto por la sociedad BP. EXPLORATION COMPANY \n(COLOMBIA) LTD. con radicado 4120-E1-1680 del 12 de octubre de 2006, \nmodificando el Artículo Primero de la Resolución 2125 del 6 de diciembre de 2007.\nQue por medio de la Resolución 1222 del 26 de junio de 2009, el Ministerio, declaró \nimprocedente el recurso de reposición interpuesto por la sociedad BP. \nEXPLORATION COMPANY (COLOMBIA) LTD. con radicado 4120-E1-56846 del \n22 de mayo de 2009, contra el parágrafo del artículo 1º de la Resolución 0623 del \n31 de marzo de 2009.\nQue a través de la Resolución 1913 del 30 de septiembre de 2010, el Ministerio \nautorizó la cesión de la licencia Ambiental otorgada mediante la Resolución 101 del \n24 de mayo de 1994 a la Sociedad BP EXPLORATION COMPANY -COLOMBIA- \nLIMITED, a favor de la empresa ECOPETROL S.A.\nQue mediante Resolución 2305 del 19 de noviembre de 2010, el Ministerio, resolvió \nrecurso de reposición interpuesto por la sociedad ECOPETROL S.A. con radicado \n4120-E1-134626-2010 del 20 de octubre de 2010, modificando el Artículo Cuarto de \nla Resolución 1913 del 30 de septiembre de 2010.\nQue con Resolución 1485 del 5 de septiembre de 2018, la Autoridad Nacional de \nLicencias Ambientales ANLA, en adelante la Autoridad Nacional, modificó la \nResolución 2125 del 6 de diciembre de 2007, en el sentido de incluir como línea \ngeneral de inversión del 1% las “Acciones de protección, conservación y \npreservación a través de restauración ecológica, rehabilitación y recuperación, \ndentro de las cuales se incluye el desarrollo de proyectos de uso sostenible, para \ndesarrollarse a través de Acciones de conservación con Proyecto productivo de uso \nsostenible de Sistema Silvopastoril, en áreas con vocación silvopastoril y de \npastoreo semi intensivo, en el área del Núcleo Piedemonte”, de conformidad con \ndispuesto en el literal a) del numeral 1 del Artículo 2.2.9.3.1.9 del Decreto 2099 de \n\nResolución No. 000998       Del 30 MAY. 2024          Hoja No. 3 de 24\n“Por la cual se resuelve recurso de reposición interpuesto contra la Resolución 000138 del 02 de \nfebrero de 2024”\nPágina 3 de 24\n2016, modificado por el Decreto 075 del 20 de enero 2017 y el Decreto 1120 del 29 \nde junio 2017, compilados en el Decreto 1076 de 2015.\nQue con la Resolución 1084 del 17 de junio de 2019, la Autoridad Nacional, resolvió \nrecurso de reposición interpuesto por la sociedad ECOPETROL S.A., en contra de \nla Resolución 1485 del 17 de junio de 2019 y en cuya parte resolutiva, aclaró, \nconfirmó y revocó algunas obligaciones contendidas en la Resolución ibidem.  \nQue mediante la Resolución 00556 del 30 de marzo de 2020, esta Autoridad \nNacional, autorizó el acogimiento al artículo 321 de la Ley 1955 de 2019, para el \nproyecto \"Pozos Múltiples Cupiagua K\". \nQue a través de la Resolución 1594 del 28 de septiembre de 2020, esta Autoridad \nNacional, resolvió el recurso de reposición interpuesto por la sociedad \nECOPETROL S.A. con radicado 2020062137-1000 del 23 de abril de 2020, con la \ncual repuso y dejó sin efecto lo dispuesto en el numeral 4 del artículo décimo cuarto \ny el artículo quinto de la Resolución 556 de 30 de marzo de 2020, modificó lo \ndispuesto en los numerales 9 (literal c) y 12 del artículo décimo cuarto de la \nResolución ibidem y confirmó las demás disposiciones de la resolución recurrida.\nQue mediante Resolución 2108 del 24 de noviembre de 2021, esta Autoridad \nNacional, aceptó la adquisición del predio “El Vergel” ubicado en la vereda Cachiza \ndel municipio de Aguazul con un área destinada al proyecto Cupiagua K-LAM0134, \nde 28,1 ha, como parte de la inversión de no menos del 1%, inmueble que fue \ndonado a CORPORINOQUIA a fin de preservar y contribuir con la conservación de \nla cuenca hidrográfica donde opera el proyecto \"Pozos Múltiples Cupiagua K\".\nQue con la Resolución 2438 del 31 de diciembre de 2021, la Autoridad Nacional, \naprobó la actualización del  Plan de Gestión Social Integrado – PGSI aprobado para \nlos expedientes LAM0017, LAM0026, LAM0045, LAM0046, LAM0049, LAM0068, \nLAM0109, LAM0133, LAM0134, LAM0135, LAM0216, LAM0248, LAM0370, \nLAM0376, LAM0443, LAM0444, LAM0524, LAM0532, LAM0668, LAM0685, \nLAM0690, LAM0691, LAM0706, LAM0722, LAM0944, LAM0965, LAM1006, \nLAM1019, LAM1124, LAM1125, LAM1145, LAM1146, LAM1232, LAM1233, \nLAM1247, LAM1282, LAM1651, LAM1888, LAM1951, LAM1960, LAM2017, \nLAM2032, LAM2049, LAM2068, LAM2130, LAM2345, LAM2495, LAM2512, \nLAM2513, LAM2917, LAM2995, LAM3159, LAM3424, LAM4754, para los Campos \nCusiana, Cupiagua y Recetor y así mismo realizo unos requerimientos a la sociedad \nECOPETROL S.A. relacionados con la  complementación y socialización al plan \naprobado.\nQue mediante Resolución 1186 del 7 de junio de 2022, esta Autoridad Nacional, \nresolvió el recurso de reposición interpuesto por la sociedad ECOPETROL S.A. con \nradicado 2022005776-1-000 24 de enero de 2022, por la cual repuso y dejó sin \nefecto los numerales 2 (literales a y d), 5 (literal b) y 9 (inciso ii y literal b) del artículo \nsegundo de la Resolución 2438 del 31 de diciembre de 2021, repuso y modificó los \n\nResolución No. 000998       Del 30 MAY. 2024          Hoja No. 4 de 24\n“Por la cual se resuelve recurso de reposición interpuesto contra la Resolución 000138 del 02 de \nfebrero de 2024”\nPágina 4 de 24\nnumerales 1 ( inciso iii, literales c y d), 4 (literales b y e), 5 (literal f), 6 (literal b) y 8 \n(literal d) del artículo segundo de la Resolución ibidem  y no repuso y confirmó las \ndemás disposiciones de la resolución recurrida.\nQue a través de la Resolución 000138 del 02 de febrero del 2024, se aprobó el \najuste de las fichas del Plan de Manejo Ambiental y Plan seguimiento y monitoreo \npara los medios biótico y Abiótico presentadas por la sociedad ECOPETROL S.A, \nmediante radicados 4120- E1- 53457 del 29 de abril de 2010, 2020225119-1-000 de \n18 de diciembre de 2020 y 2021194290-1-000 del 9 de septiembre de 2021, para el \nproyecto Pozos Múltiples Cupiagua K.\nQue por medio del radicado 20246200170942 de fecha 16 de febrero de 2024, la \nsociedad ECOPETROL S.A., presentó recurso de reposición frente a la Resolución \n000138 del 02 de febrero del 2024.\nII.\nFUNDAMENTOS CONSTITUCIONALES Y LEGALES\na. De la protección del derecho al medio ambiente como deber social del \nEstado  \nQue el artículo 8 de la Constitución Política, consagra como obligación del Estado y \nde las personas proteger las riquezas culturales y naturales de la Nación.\nQue el artículo 58 de la Constitución Política de Colombia, establece en su inciso \nsegundo que la propiedad lleva inmersa una función social que implica obligaciones. \nComo tal, le es inherente una función ecológica que implica el respeto por el derecho \na un medio ambiente sano y la protección a los recursos naturales.   \nQue el artículo 79 de la Constitución Política, establece la obligación que tiene el \nEstado de proteger el medio ambiente y el derecho que tienen todos los ciudadanos \na gozar de un ambiente sano. Así mismo le impuso al Estado el deber de proteger \nla diversidad e integridad del ambiente, conservar las áreas de especial importancia \necológica y fomentar la educación para el logro de estos fines.\nQue el artículo 80 de la Constitución Política de Colombia establece: “El Estado \nplanificará el manejo y aprovechamiento de los recursos naturales, para garantizar \nsu desarrollo sostenible, su conservación, restauración o sustitución; además, \ndeberá prevenir y controlar los factores de deterioro ambiental, imponer las \nsanciones legales y exigir la reparación de los daños causados”.\n\nResolución No. 000998       Del 30 MAY. 2024          Hoja No. 5 de 24\n“Por la cual se resuelve recurso de reposición interpuesto contra la Resolución 000138 del 02 de \nfebrero de 2024”\nPágina 5 de 24\nQue el artículo 95 constitucional señala que es deber de la persona y del ciudadano \nproteger los recursos culturales y naturales del país y velar por la conservación de \nun ambiente sano. \nQue, en relación con la responsabilidad en la conservación y defensa del ambiente, \nes del caso tener en cuenta lo establecido en el artículo 333 de la Constitución \nPolítica, según el cual, la actividad económica y la iniciativa privada son libres, pero \n“dentro de los límites del bien común”, al respecto la Corte Constitucional en la \nsentencia T-325 - 17 del quince (15) de mayo de dos mil diecisiete (2017), ha \nconceptuado con relación a la defensa del derecho al Medio Ambiente Sano:\n“(…) La Corte ha atendido a la necesidad que propugna por la defensa del ambiente \ny de los ecosistemas, por lo que ha calificado al ambiente como un bien jurídico \nconstitucionalmente protegido, en el que concurren las siguientes dimensiones: “(i) \nes un principio que irradia todo el orden jurídico en cuanto se le atribuye al Estado \nla obligación de conservarlo y protegerlo, procurando que el desarrollo económico y \nsocial sea compatible con las políticas que buscan salvaguardar las riquezas \nnaturales de la Nación; (ii) aparece como un derecho constitucional de todos los \nindividuos que es exigible por distintas vías judiciales; (iii) tiene el carácter de \nservicio público, erigiéndose junto con la salud, la educación y el agua potable, en \nun objetivo social cuya realización material encuentra pleno fundamento en el fin \nesencial de propender por el mejoramiento de la calidad de vida de la población del \npaís; y (iv) aparece como una prioridad dentro de los fines del Estado, \ncomprometiendo la responsabilidad directa del Estado al atribuirle los deberes de \nprevención y control de los factores de deterioro ambiental y la adopción de las \nmedidas de protección…” (…).\nDe conformidad con lo anterior, la protección al medio ambiente corresponde a uno \nde los más importantes cometidos estatales, es deber del Estado garantizar a las \ngeneraciones futuras la conservación del ambiente y la preservación de los recursos \nnaturales. De ahí la necesidad de contar con entidades como el Ministerio de \nAmbiente y Desarrollo Sostenible, como organismo rector de la gestión ambiental y \nde los recursos naturales, al que corresponde impulsar una relación de respeto entre \nel hombre y la naturaleza y definir la política ambiental de protección, conservación \ny preservación, y la Autoridad Nacional de Licencias Ambientales –ANLA en su \ncalidad de entidad encargada de que los proyectos sujetos a licenciamiento, \npermiso o trámite ambiental cumplan con la normativa ambiental, de tal manera que \ncontribuyan al desarrollo sostenible ambiental del país.\nAsí las cosas, toda actividad, obra o proyecto que se enmarque dentro de las \ncontempladas en el artículo 2.2.2.3.2.2. del Decreto 1076 de 2015, requiere de \nLicencia Ambiental, es decir requiere de un instrumento de control ambiental \naprobado por Autoridad competente, que garantice que el desarrollo del proyecto a \nejecutar mitiga, maneja y compensa los impactos ambientales que genera su \nejecución y finalización del mismo, al respecto la Corte Constitucional en Sentencia \nC-746 de 2012, señaló;\n\nResolución No. 000998       Del 30 MAY. 2024          Hoja No. 6 de 24\n“Por la cual se resuelve recurso de reposición interpuesto contra la Resolución 000138 del 02 de \nfebrero de 2024”\nPágina 6 de 24\n“…Con fundamento en la jurisprudencia constitucional, se concluye que la licencia \nambiental: (i) es una autorización que otorga el Estado para la ejecución de obras o \nla realización de proyectos o actividades que puedan ocasionar un deterioro grave \nal ambiente o a los recursos naturales o introducr una alteración significativa al \npaisaje (Ley 99/93 art. 49); (ii) tiene como propósitos prevenir, mitigar, manejar, \ncorregir y compensar los efectos ambientales que produzcan tales actividades; (iii) \nes de carácter obligatoria y previa, por lo que debe ser obtenida antes de la ejecución \no realización de dichas obras, actividades o proyectos; (iv) opera como instrumento \ncoordinador, planificador, preventivo, cautelar y de gestión, mediante el cual el \nEstado cumple diversos mandatos constitucionales, entre ellos proteger los recursos \nnaturales y el medio ambiente, conservar áreas de especial importancia ecológica, \nprevenir y controlar el deterioro ambiental y realizar la función ecológica de la \npropiedad; (v) es el resultado de un proceso administrativo reglado y complejo que \npermite la participación ciudadana, la cual puede cualificarse con la aplicación del \nderecho a la consulta previa si en la zona de influencia de la obra, actividad o \nproyecto existen asentamientos indígenas o afrocolombianos; (vi) tiene \nsimultáneamente un carácter técnico y otro participativo, en donde se evalúan varios \naspectos relacionados con los estudios de impacto ambiental y, en ocasiones, con \nlos diagnósticos ambientales de alternativas, en un escenario a su vez técnico \ncientífico y sensible a los intereses de las poblaciones afectadas (Ley 99/93 arts. 56 \ny ss); y, finalmente, (vii) se concreta en la expedición de un acto administrativo de \ncarácter especial, el cual puede ser modificado unilateralmente por la administración \ne incluso revocado sin el consentimiento previo, expreso y escrito de su titular, \ncuando se advierta el incumplimiento de los términos que condicionan la \nautorización (Ley 99/93 art. 62). En estos casos funciona como garantía de intereses \nconstitucionales protegidos por el principio de prevención y demás normas con \ncarácter de orden público…” (…)\nb. Competencia de La Autoridad Nacional de Licencias Ambientales - \nANLA\nEl artículo 49 de la Ley 99 de 1993, indicó que la ejecución de obras, el \nestablecimiento de industrias o el desarrollo de cualquier actividad, que, de acuerdo \ncon la ley y los reglamentos, pueda producir deterioro grave a los recursos naturales \nrenovables o al medio ambiente o introducir modificaciones considerables o notorias \nal paisaje, requerirán de una licencia ambiental. \nEl numeral 1 del Artículo 52 de la Ley 99 de 1993, establece que el hoy Ministerio \nde Ambiente y Desarrollo Sostenible, otorgará la licencia ambiental para la ejecución \nde obras y actividades de exploración, explotación, transporte, conducción y \ndepósito de hidrocarburos, y construcción de refinerías, sin perjuicio de la potestad \nde la Autoridad Ambiental para adicionar o establecer condiciones ambientales \nespecificas requeridas en cada caso. \nMediante Decreto Ley 3573 del 27 de septiembre de 2011, el presidente de la \nRepública en ejercicio de las facultades extraordinarias conferidas en los literales \nd), e) y f) del artículo 18 de la Ley 1444 de 2011, creó la Autoridad Nacional de \n\nResolución No. 000998       Del 30 MAY. 2024          Hoja No. 7 de 24\n“Por la cual se resuelve recurso de reposición interpuesto contra la Resolución 000138 del 02 de \nfebrero de 2024”\nPágina 7 de 24\nLicencias Ambientales – ANLA, en los términos del artículo 67 de la Ley 489 de \n1998, con autonomía administrativa y financiera, sin personería jurídica, la cual hará \nparte del Sector Administrativo de Ambiente y Desarrollo Sostenible. \nEs del caso señalar que la Autoridad Nacional de Licencias Ambientales - ANLA, \nacorde con lo establecido en el artículo 2 del Decreto Ley 3573 del 27 de septiembre \nde 2011, es la entidad encargada de que los proyectos, obras o actividades sujetos \nde licenciamiento, permiso o trámite ambiental cumplan con la normativa ambiental, \nde tal manera que contribuyan al desarrollo sostenible ambiental del país. \nDe acuerdo con la función establecida en el numeral 2 del artículo tercero del citado \nDecreto 3573 del 27 de septiembre de 2011, a la Autoridad Nacional de Licencias \nAmbientales – ANLA le corresponde realizar el seguimiento de las licencias, \npermisos y trámites ambientales.\nEl artículo segundo del Decreto 376 del 11 de marzo de 2020, por medio del cual \nse modificó el Decreto - Ley 3573 de 2011, en su numeral segundo señala que es \nfunción del Director General suscribir los actos administrativos que otorgan, niegan, \nmodifican, ajustan o declaran la terminación de las licencias, permisos y trámites \nambientales, de conformidad a lo establecido en el numeral 1 del artículo décimo \ndel Decreto ibidem.    \nMediante la Resolución 1957 del 5 de noviembre de 2021, se adoptó el Manual \nEspecífico de Funciones y de Competencias Laborales para los empleos de la \nAutoridad Nacional de Licencias Ambientales – ANLA, y en el que se establece la \nfunción de elaborar, revisar y suscribir los actos administrativos requeridos en el \nproceso de seguimiento de licencias ambientales y otros instrumentos.\nQue mediante la Resolución 1223 del 19 de septiembre de 2022, la Viceministra de \nPolíticas y Normalización Ambiental Encargada de las funciones de Ministra de \nAmbiente y Desarrollo Sostenible nombró al doctor Rodrigo Elías Negrete Montes \nen el empleo de director general de la Unidad Administrativa Código 015, de la \nAutoridad Nacional de Licencias Ambientales – ANLA.\nAunado a lo anterior, el numeral primero del artículo 74 de la Ley 1437 de 2011, \nestablece que el recurso de reposición lo deberá resolver quien expidió la decisión \npara que la aclare, modifique, adicione o revoque, en el presente caso, lo resolverá \nel Doctor Rodrigo Elías Negrete Montes, quien se encuentra en el empleo de \nDirector General de la planta de personal de la Autoridad Nacional de Licencias \nAmbientales y quien expidió la Resolución 000138 del 02 de febrero del 2024, objeto \nde recurso de reposición. \nTeniendo en cuenta lo anterior, es el Director General de la Autoridad Nacional de \nLicencias Ambientales el funcionario competente para firmar el presente acto \nadministrativo.\n\nResolución No. 000998       Del 30 MAY. 2024          Hoja No. 8 de 24\n“Por la cual se resuelve recurso de reposición interpuesto contra la Resolución 000138 del 02 de \nfebrero de 2024”\nPágina 8 de 24\nc. Procedencia, oportunidad, presentación y requisitos del recurso de \nReposición1\nConforme a lo previsto en el artículo séptimo de la Resolución 000138 del 02 de \nfebrero del 2024, contra dicho acto administrativo procede el recurso de reposición \ndentro de los 10 días siguientes a su notificación, cumpliendo los requisitos \nestablecidos en los artículos 74 y siguientes del Código de Procedimiento \nAdministrativo y de lo Contencioso Administrativo (Ley 1437 de 2011).  \nLa Resolución 000138 del 02 de febrero del 2024, fue notificada de manera \nelectrónica el día 02 de febrero del 2024 y fue objeto de recurso de reposición \nmediante correo electrónico de fecha 16 de febrero de 2024 a las 9: 49 a.m., cuya \ncomunicación ANLA quedo radicada el mismo 16 de febrero de 2024 con radicación \n20246200170942, es decir, la sociedad ECOPETROL S.A. presentó el recurso de \nmanera oportuna. \nAdicionalmente, en cuanto a los requisitos legales establecidos en el artículo 77 de \nla Ley 1437 de 2011, para presentar el recurso de reposición, se constató que fueron \ndebidamente cumplidos por el recurrente, por cuanto expresaron los motivos de \ninconformidad, así como su nombre y dirección del recurrente y fue presentado por \nel apoderado general de la sociedad ECOPETROL S.A. como lo acredita el \ncertificado de cámara de comercio de fecha 1 de febrero de 2024, expedido por la \nCámara de Comercio de Bogotá (anexado al recurso de reposición) y resaltando \nque dicha sociedad es la  titular del expediente LAM0134. \nA su vez, el artículo 79 ibídem, sobre el trámite de los recursos preceptúa que el \nrecurso de reposición deberá resolverse de plano, a no ser que al interponerlo se \nhaya solicitado la práctica de pruebas, o que el funcionario que ha de decidir el \nrecurso considere necesario decretarlas de oficio, situaciones que no se presentan \nen el caso de estudio.\nEn tal sentido, el funcionario de la administración a quien corresponde tomar la \ndecisión definitiva, debe hacerlo con base en la información que disponga; para este \ncaso, es la contenida en el expediente LAM0134, que aquí nos ocupa.\n1 El recurso de reposición constituye un instrumento legal mediante el cual la parte interesada tiene la oportunidad de ejercer \nel derecho de controvertir una decisión, para que la administración previa su evaluación, la confirme, aclare, modifique o \nrevoque, previo el lleno de las exigencias legales establecidas para el efecto. Lla finalidad esencial del recurso de reposición \nno es otra distinta a que al funcionario de la administración que tomó una decisión administrativa, se le dé la oportunidad para \nque enmiende o corrija un error, o los posibles errores que se hayan podido presentar en el acto administrativo por él expedido \nen ejercicio de sus funciones.\n\nResolución No. 000998       Del 30 MAY. 2024          Hoja No. 9 de 24\n“Por la cual se resuelve recurso de reposición interpuesto contra la Resolución 000138 del 02 de \nfebrero de 2024”\nPágina 9 de 24\nIII.\nCONSIDERACIONES DE LA AUTORIDAD NACIONAL DE LICENCIAS \nAMBIENTALES FRENTE AL RECURSO DE REPOSICIÓN INTERPUESTO \nPOR LA SOCIEDAD ECOPETROL S.A.\nA continuación, se procederá a resolver el recurso de reposición interpuesto por la \nsociedad ECOPETROL S.A. contra el contenido del Artículo Primero de la \nResolución 000138 del 02 de febrero del 2024, conforme se expondrá en las \nsiguientes consideraciones. \nEl recurso de reposición objeto de estudio por parte de esta Autoridad Nacional, \nversa sobre la siguiente petición, donde la sociedad ECOPETROL S.A.  solicita a \ntravés de la comunicación con radicado 20246200170942 del 16 de febrero de 2024, \nlo siguiente: \n“PRIMERO: MODIFICAR el Artículo Primero de la Resolución No. 000138 de 2024, \nen el sentido de corregir la denominación establecida por la ANLA, a la ficha de \nmanejo: PLA-2 - cierre de piscinas programa de manejo de residuos y la ficha \nPrograma de manejo de residuos PMR–1 manejo, tratamiento y disposición de \nresiduos sólidos, por la denominación propuesta por Ecopetrol S.A., así:\n-\nPROGRAMA DE LIMPIEZA DE ÁREAS -PLA\nPLA-2 CIERRE DE PISCINAS\n-\nPROGRAMA DE MANEJO DE RESIDUOS \nPMR–1 MANEJO, TRATAMIENTO Y DISPOSICIÓN DE RESIDUOS SÓLIDOS \nDOMÉSTICOS.”\nEn tal circunstancia, y en aras de resolver con apego a la Constitución, la Ley y las \nnormas especiales que rigen la materia, la petición incoada por la sociedad \nECOPETROL S.A.  a través de recurso de reposición, esta Autoridad Nacional, \nanalizará los argumentos expuestos en la comunicación con radicado ANLA \n20246200170942 del 16 de febrero de 2024, obrante en el expediente LAM0134.\n \nEl recurso de reposición interpuesto se dirige contra el contenido del Artículo \nPrimero de la Resolución 000138 del 02 de febrero del 2024, por lo que una vez se \ntranscriba la parte del argumento de la petición incoada por la sociedad \nECOPETROL S.A.  para cada numeral, se realizará el análisis correspondiente, por \nparte de esta Autoridad Nacional, a fin de resolver el mismo, ya sea aclarando, \nrevocando, modificando o confirmando la disposición correspondiente. \n1.\nDISPOSICIÓN RECURRIDA-RESOLUCIÓN 000138 DEL 02 DE FEBRERO \nDEL 2024- ARTÍCULO PRIMERO \n“(…) ARTÍCULO PRIMERO. Aprobar el ajuste de las fichas del Plan de Manejo \nAmbiental y Plan seguimiento y monitoreo para los medios biótico y Abiótico \npresentadas por la sociedad ECOPETROL S.A, mediante radicados 4120- E153457 \ndel 29 de abril de 2010, 2020225119-1-000 de 18 de diciembre de 2020 y 2021194290-\n\nResolución No. 000998       Del 30 MAY. 2024          Hoja No. 10 de 24\n“Por la cual se resuelve recurso de reposición interpuesto contra la Resolución 000138 del 02 de \nfebrero de 2024”\nPágina 10 de 24\n1-000 del 9 de septiembre de 2021, para el proyecto Pozos Múltiples Cupiagua K, \ncorrespondiente al expediente LAM0134 de conformidad con la parte motiva, el cual a \npartir de la ejecutoria de la presente resolución tendrá la siguiente estructura:\nPrograma de adecuación y mantenimiento de obras – AMO \n•\nFicha de manejo: AMO-1 mantenimiento de obras civiles y geotécnicas \n•\nFicha de manejo: AMO-2 mantenimiento de locaciones \n•\nFicha de manejo: AMO-3 manejo de la captación \n•\nFicha de manejo: AMO-4 ubicación, construcción y uso del foso de \nquemado \n•\nFicha de manejo: AMO-5 manejo de flora, fauna y protección y \nconservación de hábitats \nPrograma de limpieza de áreas – PLA \n•\nFicha de manejo: PLA-1 desmovilización y limpieza de áreas \n•\nFicha de manejo: PLA-2 cierre de piscinas programa de manejo de \nresiduos. \nPrograma de manejo de residuos – PMR \n•\nFicha de manejo: PMR-1 manejo, tratamiento y disposición de residuos \nsólidos \n•\nFicha de manejo: PMR-2 manejo de materiales peligrosos \n•\nFicha de manejo: PMR-3 manejo, tratamiento y disposición de residuos \npeligrosos. \n•\nFicha de manejo: PMR-4 transporte de sustancias y materiales peligrosos \n•\nFicha de manejo: PMR-5 manejo, tratamiento y disposición de residuos \nlíquidos domésticos e industriales  \nPrograma de seguimiento y monitoreo – PMS \n•\nFicha de manejo: PMS-1 monitoreo y seguimiento a los recursos naturales \n(…)”\n1.1   Petición de la Sociedad \n “PRIMERO: MODIFICAR el Artículo Primero de la Resolución No. 000138 de 2024, \nen el sentido de corregir la denominación establecida por la ANLA, a la ficha de \nmanejo: PLA-2 - cierre de piscinas programa de manejo de residuos y la ficha \nPrograma de manejo de residuos PMR–1 manejo, tratamiento y disposición de \nresiduos sólidos, por la denominación propuesta por Ecopetrol S.A., así:\n-\nPROGRAMA DE LIMPIEZA DE ÁREAS -PLA\nPLA-2 CIERRE DE PISCINAS\n-\nPROGRAMA DE MANEJO DE RESIDUOS \n\nResolución No. 000998       Del 30 MAY. 2024          Hoja No. 11 de 24\n“Por la cual se resuelve recurso de reposición interpuesto contra la Resolución 000138 del 02 de \nfebrero de 2024”\nPágina 11 de 24\nPMR–1 MANEJO, TRATAMIENTO Y DISPOSICIÓN DE RESIDUOS SÓLIDOS \nDOMÉSTICOS.”\n1.2   Argumentos de la Sociedad\n“(…) B. Argumentos técnicos y jurídicos que sustentan el presente recurso de \nreposición. \n \nUna vez efectuada la revisión del acto administrativo que aprobó la actualización de \nlas fichas del Plan de Manejo Ambiental y Plan seguimiento y monitoreo para los \nmedios biótico y abiótico para el proyecto Cupiagua K, se pudo determinar que la \nANLA incurrió en error en la denominación respecto al programa de limpieza de áreas \n(ficha PLA-2) y el programa de manejo de residuos (ficha PMR-1), de acuerdo con los \nargumentos que se exponen: \n \nComo se indicó en el acápite de antecedentes, Ecopetrol S.A. presentó ante la ANLA \nmediante los radicados Nos. 4120-E1-53457 de 29 de abril de 2010, 2020225119-1-\n000 de 18 de diciembre de 2020 y 2021194290-1-000 de 9 de septiembre de 2021 el \najuste de las fichas, incluyendo dentro de estas, el programa de limpieza de áreas – \nPLA la ficha de manejo PLA-2 y el programa de manejo de residuos que incluye la \nficha PMR-1, así: \n \n“(…) 2. PROGRAMA DE LIMPIEZA DE ÁREAS -PLA. \n(..) 2.2 FICHA DE MANEJO: PLA -2 CIERRE DE PISCINAS.  \n \n \n \n3. PROGRAMA DE MANEJO DE RESIDUOS. \n(..) 3.1 FICHA DE MANEJO: PMR – 1 MANEJO, TRATAMIENTO Y \nDISPOSCION DE RESIDUOS SOLIDOS DOMESTICOS (…)”.  \n \n\nResolución No. 000998       Del 30 MAY. 2024          Hoja No. 12 de 24\n“Por la cual se resuelve recurso de reposición interpuesto contra la Resolución 000138 del 02 de \nfebrero de 2024”\nPágina 12 de 24\n \n \nNo obstante, de la lectura del Artículo Primero de la Resolución No. 000138 de 2024, \nse pudo determinar que la ANLA incurrió en una imprecisión y no tuvo en cuenta la \ndenominación de las fichas presentadas por Ecopetrol S.A. al establecer lo siguiente \nfrente a la ficha PLA-2 y PMR-1:  \n \n“(…) “ARTÍCULO PRIMERO. Aprobar el ajuste de las fichas del Plan de \nManejo Ambiental y Plan seguimiento y monitoreo para los medios biótico y \nAbiótico presentadas por la sociedad ECOPETROL S.A. (…) \n \nPROGRAMA DE LIMPIEZA DE ÁREAS -PLA. \n(..) FICHA DE MANEJO: PLA -2 CIERRE DE PISCINAS PROGRAMA DE \nMANEJO DE RESIDUOS.  \n \nPROGRAMA DE MANEJO DE RESIDUOS - PMR. \nFICHA DE MANEJO: PMR – 1 MANEJO, TRATAMIENTO Y DISPOSICIÓN DE \nRESIDUOS SOLIDOS (…)”.  \n \nComo se observa, en el aparte resolutivo, la ANLA modificó la denominación de las \nfichas, pese a que, en el aparte considerativo de la Resolución No. 000138 de 2024 \nespecíficamente en la evaluación y seguimiento al cumplimiento del Auto No. 6798 \nde 26 de agosto de 2021 (página 13 de 23) se contempló el cumplimiento de las fichas \npresentadas bajo el nombre de (i) Ficha de manejo: PLA-2 Cierre de piscinas y (ii) \nFicha de manejo: PMR-1 Manejo, tratamiento y disposición de residuos sólidos \ndomésticos,  conforme a la denominación con que fueron presentadas por Ecopetrol \nS.A, mediante radicados Nos. 4120- E1- 53457 de 29 de abril de 2010 y \n20202251191-000 de 18 de diciembre de 2020. \nLo anterior, teniendo en cuenta que al momento de aprobar el ajuste de las fichas del \nPlan de Manejo Ambiental y Plan seguimiento y monitoreo para los medios biótico y \nAbiótico presentadas por Ecopetrol S.A., la ANLA modificó la denominación de las \nfichas propuestas por la Empresa, alterando de esta forma el objetivo perseguido en \nlas precitadas fichas, así como las metas propuestas; por lo que para el caso sub \nexamine al indicar la Autoridad Ambiental en la ficha de manejo: PLA-2 Cierre de \npiscinas adicionó la denominación programa de manejo de residuos, sin tener en \ncuenta que en la actualización del PMA se contempló el PROGRAMA DE MANEJO \nDE RESIDUOS – PMR que difiere a las fichas propuestas en el PROGRAMA DE \nLIMPIEZA DE ÁREAS -PLA incluyendo el cierre de piscinas. \n\nResolución No. 000998       Del 30 MAY. 2024          Hoja No. 13 de 24\n“Por la cual se resuelve recurso de reposición interpuesto contra la Resolución 000138 del 02 de \nfebrero de 2024”\nPágina 13 de 24\nDel mismo modo la ANLA en la ficha PMR-1 manejo, tratamiento y disposición de \nresiduos no puntualizó que esta comprende las medidas de manejo a emplear para \nlos residuos sólidos domésticos, y al emplear la denominación Residuos en la \nResolución objeto del presente recurso estaría abarcando a su vez las demás fichas \ncontenidas en el programa de manejo de residuos (domésticos y peligrosos). \nLas disposiciones emanadas por la ANLA, genera a Ecopetrol S.A. un vacío y \nconfusión al momento de realizar no solo su implementación y reporte de \ncumplimiento, sino además para realizar el correspondiente seguimiento por parte de \nla Autoridad ambiental; para soslayar esta situación y dar aplicación a las \nmencionadas fichas, se requiere que estas sean ajustadas, para evitar errores y \nsubsanar definitivamente la ambigüedad que se registra. (…)”\n1.3   Consideraciones de la Autoridad Nacional\na. Consideraciones jurídicas \nEn cuanto a la decisión que se adopta en el presente acto administrativo, y en \nparticular sobre la obligación contenida en Artículo Primero de la Resolución 000138 \ndel 02 de febrero del 2024, es preciso considerar que las mismas se encuentran \nsoportadas sobre argumentos jurídicos que son proporcionales y debidamente \nanalizados de manera objetiva de manera tal que se adecúe a la realidad del \nproyecto\nTeniendo en cuenta lo expuesto y una vez revisados los antecedentes contenidos \nen el expediente LAM0134, se evidencio lo siguiente:\nLa sociedad ECOPETROL S.A. a través de los radicados No. 4120-E1-53457 de 29 \nde abril de 2010, 2020225119-1-000 de 18 de diciembre de 2020 y 2021194290-1-\n000 de 9 de septiembre de 2021, presento a esta Autoridad el ajuste de las fichas \ndel Plan de Manejo Ambiental y Plan seguimiento y monitoreo para los medios \nbiótico y Abiótico, entre ellas el programa de limpieza de áreas – PLA que relaciona \nla ficha de manejo PLA-2 y el programa de manejo de residuos que incluye la ficha \nPMR-1 \n así: \n“(…) 2. PROGRAMA DE LIMPIEZA DE ÁREAS -PLA.\n(..) 2.2 FICHA DE MANEJO: PLA -2 CIERRE DE PISCINAS.\n\nResolución No. 000998       Del 30 MAY. 2024          Hoja No. 14 de 24\n“Por la cual se resuelve recurso de reposición interpuesto contra la Resolución 000138 del 02 de \nfebrero de 2024”\nPágina 14 de 24\n3. PROGRAMA DE MANEJO DE RESIDUOS.\n(..) 3.1 FICHA DE MANEJO: PMR – 1 MANEJO, TRATAMIENTO Y DISPOSCION DE \nRESIDUOS SOLIDOS DOMESTICOS (…)”.\n(…)”\nQue, la Autoridad Nacional mediante la Resolución 000138 del 02 de febrero del \n2024, acogió jurídicamente la precitada solicitud de ajuste de las fichas del Plan de \nManejo Ambiental y Plan seguimiento y monitoreo para los medios biótico y Abiótico, \nde la siguiente manera:\n“(…) ARTÍCULO PRIMERO. Aprobar el ajuste de las fichas del Plan de Manejo \nAmbiental y Plan seguimiento y monitoreo para los medios biótico y Abiótico \npresentadas por la sociedad ECOPETROL S.A, mediante radicados 4120- E153457 \ndel 29 de abril de 2010, 2020225119-1-000 de 18 de diciembre de 2020 y 2021194290-\n1-000 del 9 de septiembre de 2021, para el proyecto Pozos Múltiples Cupiagua K, \ncorrespondiente al expediente LAM0134 de conformidad con la parte motiva, el cual a \npartir de la ejecutoria de la presente resolución tendrá la siguiente estructura:\nPrograma de adecuación y mantenimiento de obras – AMO \n•\nFicha de manejo: AMO-1 mantenimiento de obras civiles y geotécnicas \n•\nFicha de manejo: AMO-2 mantenimiento de locaciones \n•\nFicha de manejo: AMO-3 manejo de la captación \n\nResolución No. 000998       Del 30 MAY. 2024          Hoja No. 15 de 24\n“Por la cual se resuelve recurso de reposición interpuesto contra la Resolución 000138 del 02 de \nfebrero de 2024”\nPágina 15 de 24\n•\nFicha de manejo: AMO-4 ubicación, construcción y uso del foso de \nquemado \n•\nFicha de manejo: AMO-5 manejo de flora, fauna y protección y \nconservación de hábitats \nPrograma de limpieza de áreas – PLA \n•\nFicha de manejo: PLA-1 desmovilización y limpieza de áreas \n•\nFicha de manejo: PLA-2 cierre de piscinas programa de manejo de \nresiduos. \nPrograma de manejo de residuos – PMR \n•\nFicha de manejo: PMR-1 manejo, tratamiento y disposición de residuos \nsólidos \n•\nFicha de manejo: PMR-2 manejo de materiales peligrosos \n•\nFicha de manejo: PMR-3 manejo, tratamiento y disposición de residuos \npeligrosos. \n•\nFicha de manejo: PMR-4 transporte de sustancias y materiales peligrosos \n•\nFicha de manejo: PMR-5 manejo, tratamiento y disposición de residuos \nlíquidos domésticos e industriales  \nPrograma de seguimiento y monitoreo – PMS \n•\nFicha de manejo: PMS-1 monitoreo y seguimiento a los recursos naturales \n(…)”\nQue, una vez cotejada la Resolución 000138 del 02 de febrero del 2024 y la solicitud \nde ajuste de las fichas del Plan de Manejo Ambiental y Plan seguimiento y monitoreo \npara los medios biótico y Abiótico, presentada por la Sociedad ECOPETROL S.A. \na través de los radicado No. 4120-E1-53457 de 29 de abril de 2010, 2020225119-\n1-000 de 18 de diciembre de 2020 y 2021194290-1-000 de 9 de septiembre de 2021, \nse pudo identificar que se existe un error de transcripción en la denominación de la \nficha de manejo PLA-2 del programa de limpieza de áreas PLA y la ficha PMR-1 del \nprograma de manejo de residuos.\nQue, la denominación correcta de las fichas de manejo es: i) Ficha de manejo: \nPLA-2 Cierre de piscinas y (ii) Ficha de manejo: PMR-1 Manejo, tratamiento y \ndisposición de residuos sólidos domésticos, y no la dispuesta en la Resolución \n000138 del 02 de febrero del 2024, la cual para la ficha PLA-2 adicionó el título \n“programa de manejo de residuos” y para la ficha PMR-1 suprimió la designación \n“domésticos”. \nEs importante destacar, que el error de trascripción que se evidencia en el artículo \nprimero de la Resolución 000138 del 2 de febrero de 2024, no afecta el sentido \nmaterial de la decisión, toda vez que se observa que en la parte motiva de la \nresolución se describe con precisión y de forma correcta el contenido de cada ficha \n\nResolución No. 000998       Del 30 MAY. 2024          Hoja No. 16 de 24\n“Por la cual se resuelve recurso de reposición interpuesto contra la Resolución 000138 del 02 de \nfebrero de 2024”\nPágina 16 de 24\ndel Plan de Manejo Ambiental y Plan seguimiento y monitoreo para los medios \nbiótico y Abiótico presentadas por la sociedad ECOPETROL S.A, mediante los \nradicados 4120- E153457 del 29 de abril de 2010, 2020225119-1-000 de 18 de \ndiciembre de 2020 y 2021194290-1-000 del 9 de septiembre de 2021, para el \nproyecto Pozos Múltiples Cupiagua K, sin embargo la parte resolutiva de la misma \nes la que contiene una imprecisión respecto a la denominación de la fichas de \nmanejo PLA-2 y  PMR-1 presentadas por la sociedad, lo cual es necesario subsanar \npara evitar dilaciones y obstáculos en el proceso administrativo.\nQue, la parte motiva de la Resolución 000138 del 2 de febrero de 2024, expresa \nrespecto a la denominación de las fichas del Plan de Manejo Ambiental objeto de \nanálisis lo siguiente:\n“(…) CONSIDERACIONES TÉCNICAS \nQue el equipo técnico de seguimiento del grupo Norte de Orinoquia, de la \nSubdirección de Seguimiento de Licencias Ambientales de la ANLA, emitió los \nConceptos Técnicos 02991 del 31 de mayo de 2022, 05579 del 15 de septiembre \nde 2022 y 4292 del 17 de julio de 2023, en donde se presentan las consideraciones \nrespecto a la evaluación a los ajustes de las fichas del Plan de Manejo Ambiental \n(PMA) y Plan de Seguimiento y Monitoreo (PSM) presentados por la sociedad \nECOPETROL S.A., mediante radicados 4120- E1-53457 del 29 de abril de 2010, \n2020225119-1-000 de 18 de diciembre de 2020 y 2021194290-1-000 del 9 de \nseptiembre de 2021, y en consecuencia indicó lo siguiente:\nConcepto Técnico 05579 del 15 de septiembre de 2022\n“(…)\n•\nFicha de manejo: PLA-2 Cierre de piscinas\nRequerimiento\nConsideraciones\nMetas e indicadores\nEn la ficha la sociedad presenta 3 \nmetas medibles y claras para la etapa \ndel proyecto, los indicadores esta \nalineados con el cierre de piscinas, \nrehabilitación de áreas intervenidas y \ncalidad de agua almacenada previo al \ncierre de las piscinas. Por lo anterior se \ncumple con el literal a\ny b.\nAcciones de manejo\nLas medidas de manejo de la presente \nficha se encuentran enfocadas en la \n\nResolución No. 000998       Del 30 MAY. 2024          Hoja No. 17 de 24\n“Por la cual se resuelve recurso de reposición interpuesto contra la Resolución 000138 del 02 de \nfebrero de 2024”\nPágina 17 de 24\nrecuperación del área donde se \nencuentran las piscinas, con previo \nanálisis para la disposición del agua \nalmacenada. Por lo anterior se cumple \ncon el literal c.\nCronograma de ejecución\nSe \npresenta \nel \ncronograma \nde \nejecución aplicable para la etapa de \nfinalización \nde \nla \noperación, \ncumpliendo así con el literal d.\nMecanismos y estrategias\nparticipativas\nLos mecanismos y estrategias de \nparticipación se alinean con el Plan de \nGestión Social Integrado para los \ncampos de Cusiana y Cupiagua y \nRecetor, permitiendo la interacción \nentre \nlas \npartes \ninteresada, \ncumpliendo con el literal e.\nPrograma manejo de residuos\n•\nFicha de manejo: PMR-1 Manejo, tratamiento y disposición de \nresiduos sólidos domésticos\nRequerimiento\nConsideraciones\nMetas e indicadores\nEn las 4 metas presentadas por la \nsociedad \nse \nincluye \nel \nmanejo, \ntratamiento \ny \ndisposición \nde \nlos \nresiduos y se incluye lo relacionado \ncon\nel personal, con respecto a los \nindicadores se encuentran alineados y \npermiten el correcto seguimiento y \nmonitoreo a las medidas de manejo. \nPor lo anterior se cumple con el literal \na y b.\nAcciones de manejo\nLas acciones presentadas por la \nsociedad involucran el manejo en la \ngeneración, \nseparación, \nalmacenamiento \ntemporal, \nrecolección, transporte y disposición \nfinal, \nel \ncumplimiento \nde \nestas \nmedidas, permitirá un manejo de \nadecuado de residuos, de acuerdo a lo \nrequerido. Por lo anterior se cumple \ncon el literal c.\nCronograma de ejecución\nSe \npresenta \nel \ncronograma \nde \nejecución aplicable para las etapas del \nproyecto, cumpliendo así con el literal \nd.\n\nResolución No. 000998       Del 30 MAY. 2024          Hoja No. 18 de 24\n“Por la cual se resuelve recurso de reposición interpuesto contra la Resolución 000138 del 02 de \nfebrero de 2024”\nPágina 18 de 24\nMecanismos y estrategias\nparticipativas\nLos mecanismos y estrategias de \nparticipación se alinean con el Plan de \nGestión Social Integrado para los \ncampos de Cusiana y Cupiagua y \nRecetor, permitiendo la interacción \nentre \nlas \npartes \ninteresada, \ncumpliendo con el literal e.\n(…)”\nDe la corrección del contenido de los actos administrativos por errores de \nforma\nEl artículo 209 de la Constitución Política de 1991, establece que la función \nadministrativa está al servicio de los intereses generales y se desarrolla con \nfundamento en los principios de igualdad, moralidad, eficacia, economía, celeridad, \nimparcialidad y publicidad, mediante la descentralización, la delegación y la \ndesconcentración de funciones. \nA su vez, el artículo 3º de la Ley 1437 de 2011, por la cual se expidió el Código de \nProcedimiento Administrativo y de lo Contencioso Administrativo, establece que las \nactuaciones administrativas se desarrollarán con arreglo a los principios de \neconomía, celeridad, eficacia, imparcialidad, publicidad y contradicción. \nEstos principios, por ser prevalentes, deben observarse en las actuaciones \nadministrativas que los requieran con las condiciones de forma y fondo, que \nconstituyen verdaderas garantías para los administrados y los particulares, dentro \nde los cuales se encuentra la sociedad ECOPETROL S.A.\nEn virtud del principio de eficacia dispuesto en el artículo 3º del referido Código, la \nadministración tendrá en cuenta que los procedimientos deben lograr su finalidad, \nremoviendo de oficio los obstáculos puramente formales y evitando decisiones \ninhibitorias. \nDe igual forma, es necesario señalar que el acto administrativo es toda \nmanifestación unilateral de voluntad de quienes ejercen funciones administrativas, \ntendientes a la producción de efectos jurídicos, el cual produce una consecuencia \ncomún a todos los actos jurídicos, es decir, crea, modifica o extingue una situación \njurídica.\nQue así mismo, los artículos 41 y 45 de la Ley 1437 de 2011, por la cual se expide \nel Código de Procedimiento Administrativo y de lo Contencioso Administrativo -\nCPACA -, señalan lo siguiente: \n\nResolución No. 000998       Del 30 MAY. 2024          Hoja No. 19 de 24\n“Por la cual se resuelve recurso de reposición interpuesto contra la Resolución 000138 del 02 de \nfebrero de 2024”\nPágina 19 de 24\n“ARTÍCULO 41. CORRECCIÓN DE IRREGULARIDADES EN LA ACTUACIÓN \nADMINISTRATIVA. La autoridad, en cualquier momento anterior a la expedición del \nacto, de oficio o a petición de parte, corregirá las irregularidades que se hayan \npresentado en la actuación administrativa para ajustarla a derecho, y adoptará las \nmedidas necesarias para concluirla. (…)\n(…)\n Artículo 45. Corrección de errores formales. En cualquier tiempo, de oficio o a \npetición de parte, se podrán corregir los errores simplemente formales contenidos \nen los actos administrativos, ya sean aritméticos, de digitación, de transcripción o \nde omisión de palabras. En ningún caso la corrección dará lugar a cambios en el \nsentido material de la decisión, ni revivirá los términos legales para demandar el \nacto. Realizada la corrección, esta deberá ser notificada o comunicada a todos los \ninteresados, según corresponda.” (subrayado fuera de texto)”\nDe otra parte, el Consejo de Estado en sentencia del veintiséis (26) de febrero de \ndos mil catorce (2014) de la Sección Cuarta de la Sala de lo Contencioso \nAdministrativo con ponencia de la Consejera Martha Briceño de Valencia, señaló: \n“Así pues, para que la Administración pueda ejercer la facultad de corregir los \nerrores aritméticos o de transcripción, es necesario que el error sea evidente, esto \nes, que no modifique la “eficacia sustancial del acto en que existe” o, como lo ha \ndicho la Sala, que no afecte el contenido sustancial del acto administrativo que se \ncorrige. \nAsimismo, la apreciación del error descarta una “operación de calificación jurídica”, \ncomo lo precisó la doctrina, y la corrección de este no puede alterar \nfundamentalmente el sentido del acto corregido […] teniendo en cuenta que los \nerrores de transcripción pueden corregirse en cualquier tiempo, porque no afectan \nel contenido sustancial del acto corregido” (subrayado fuera de texto) \nDe conformidad con lo precitado, la Autoridad Nacional coincide con la posición de \nla sociedad ECOPETROL S.A. en cuanto al error en la denominación de las fichas \nde manejo PLA-2 y PMR-1 en el artículo primero de la Resolución 000138 del 2 de \nfebrero de 2024, motivo del recurso, por tal razón, se realizará el ajuste \ncorrespondiente respecto a la denominación de las mismas, acción que en derecho \nse encuentra amparada en los artículos 41 y 45 de la Ley 1437 de 2011, que \npermiten la corrección de irregularidades en la actuación administrativa y la \ncorrección de errores formales en cualquier tiempo, de oficio o a petición de parte, \nantes de consolidarse una situación jurídica, razón por la cual en el presente acto \nadministrativo se modificara el precitado artículo, en el sentido de corregir la \ndenominación de las fichas PLA-2 y PMR-1, el cual quedará de la siguiente manera:\n“(…) ARTÍCULO PRIMERO. Aprobar el ajuste de las fichas del Plan de Manejo \nAmbiental y Plan seguimiento y monitoreo para los medios biótico y Abiótico \npresentadas por la sociedad ECOPETROL S.A, mediante radicados 4120- E153457 \ndel 29 de abril de 2010, 2020225119-1-000 de 18 de diciembre de 2020 y 2021194290-\n\nResolución No. 000998       Del 30 MAY. 2024          Hoja No. 20 de 24\n“Por la cual se resuelve recurso de reposición interpuesto contra la Resolución 000138 del 02 de \nfebrero de 2024”\nPágina 20 de 24\n1-000 del 9 de septiembre de 2021, para el proyecto Pozos Múltiples Cupiagua K, \ncorrespondiente al expediente LAM0134 de conformidad con la parte motiva, el cual a \npartir de la ejecutoria de la presente resolución tendrá la siguiente estructura:\nPrograma de adecuación y mantenimiento de obras – AMO \n•\nFicha de manejo: AMO-1 mantenimiento de obras civiles y geotécnicas \n•\nFicha de manejo: AMO-2 mantenimiento de locaciones \n•\nFicha de manejo: AMO-3 manejo de la captación \n•\nFicha de manejo: AMO-4 ubicación, construcción y uso del foso de \nquemado \n•\nFicha de manejo: AMO-5 manejo de flora, fauna y protección y \nconservación de hábitats \nPrograma de limpieza de áreas – PLA \n•\nFicha de manejo: PLA-1 desmovilización y limpieza de áreas \n•\nFicha de manejo: PLA-2 Cierre de piscinas. \nPrograma de manejo de residuos – PMR \n•\nFicha de manejo: PMR-1 Manejo, tratamiento y disposición de residuos \nsólidos domésticos\n•\nFicha de manejo: PMR-2 manejo de materiales peligrosos \n•\nFicha de manejo: PMR-3 manejo, tratamiento y disposición de residuos \npeligrosos. \n•\nFicha de manejo: PMR-4 transporte de sustancias y materiales peligrosos \n•\nFicha de manejo: PMR-5 manejo, tratamiento y disposición de residuos \nlíquidos domésticos e industriales  \nPrograma de seguimiento y monitoreo – PMS \n•\nFicha de manejo: PMS-1 monitoreo y seguimiento a los recursos naturales \n(…)”\nCONSIDERACIONES FINALES \nAhora bien, es importante señalar que las decisiones adoptadas en esta instancia \nprocesal,  se suscribieron  de conformidad a la normatividad vigente, resaltando que \nfue preciso reconsiderar algunas de ellas y mantener incólume otras obligaciones, \npues es claro que dentro de los principios de la administración está el control \ngubernativo, el cual permite que la administración revise sus propios actos, los \nmodifique, aclare o revoque, de acuerdo con la pertinencia y conducencia de los \nargumentos y pruebas presentados por el interesado en la decisión. Para el caso \nde la autoridad ambiental, sus decisiones deben estar enmarcadas dentro de los \nprincipios generales del derecho y valores constitucionales de la protección de los \nrecursos naturales renovables, y la obligación de garantizar el derecho a un medio \nambiente sano. \n\nResolución No. 000998       Del 30 MAY. 2024          Hoja No. 21 de 24\n“Por la cual se resuelve recurso de reposición interpuesto contra la Resolución 000138 del 02 de \nfebrero de 2024”\nPágina 21 de 24\nDe otro lado es importante manifestar que estando en el trámite de una actuación \nadministrativa en el marco del instrumento de control ambiental, vía seguimiento, es \nindiscutible que la administración revise su actuación con motivo de un recurso de \nreposición, por lo que para el presente caso se dispondrá dar alcance y corregir el \nerror formal de un acto administrativo, y mantener incólume las demás disposiciones \nde la Resolución Ibídem, conforme a lo motivado en el presente acto administrativo.  \nEn mérito de lo anterior,\nRESUELVE\nARTÍCULO PRIMERO. Reponer en el sentido de MODIFICAR  el artículo primero \nde la Resolución 000138 del 02 de febrero del 2024, conforme a lo indicado en la \nparte motiva del presente acto administrativo, el cual quedará de la siguiente \nmanera:\n“(…) ARTÍCULO PRIMERO. Aprobar el ajuste de las fichas del Plan de Manejo \nAmbiental y Plan seguimiento y monitoreo para los medios biótico y Abiótico \npresentadas por la sociedad ECOPETROL S.A, mediante radicados 4120- \nE153457 del 29 de abril de 2010, 2020225119-1-000 de 18 de diciembre de \n2020 y 2021194290-1-000 del 9 de septiembre de 2021, para el proyecto Pozos \nMúltiples Cupiagua K, correspondiente al expediente LAM0134 de conformidad \ncon la parte motiva, el cual a partir de la ejecutoria de la presente resolución \ntendrá la siguiente estructura:\nPrograma de adecuación y mantenimiento de obras – AMO \n•\nFicha de manejo: AMO-1 mantenimiento de obras civiles y \ngeotécnicas \n•\nFicha de manejo: AMO-2 mantenimiento de locaciones \n•\nFicha de manejo: AMO-3 manejo de la captación \n•\nFicha de manejo: AMO-4 ubicación, construcción y uso del foso de \nquemado \n•\nFicha de manejo: AMO-5 manejo de flora, fauna y protección y \nconservación de hábitats \nPrograma de limpieza de áreas – PLA \n•\nFicha de manejo: PLA-1 desmovilización y limpieza de áreas \n•\nFicha de manejo: PLA-2 Cierre de piscinas. \nPrograma de manejo de residuos – PMR \n•\nFicha de manejo: PMR-1 Manejo, tratamiento y disposición de \nresiduos sólidos domésticos\n•\nFicha de manejo: PMR-2 manejo de materiales peligrosos \n•\nFicha de manejo: PMR-3 manejo, tratamiento y disposición de \nresiduos peligrosos. \n•\nFicha de manejo: PMR-4 transporte de sustancias y materiales \npeligrosos \n\nResolución No. 000998       Del 30 MAY. 2024          Hoja No. 22 de 24\n“Por la cual se resuelve recurso de reposición interpuesto contra la Resolución 000138 del 02 de \nfebrero de 2024”\nPágina 22 de 24\n•\nFicha de manejo: PMR-5 manejo, tratamiento y disposición de \nresiduos líquidos domésticos e industriales  \nPrograma de seguimiento y monitoreo – PMS \n•\nFicha de manejo: PMS-1 monitoreo y seguimiento a los recursos \nnaturales (…)”\nARTÍCULO SEGUNDO. Los demás términos y condiciones establecidos en la \nResolución 000138 del 02 de febrero del 2024, que no fueron objeto de aclaración \nen el presente acto administrativo, continúan vigentes.\nARTÍCULO TERCERO. Por la Autoridad Nacional de Licencias Ambientales – \nANLA, notificar el contenido del presente acto administrativo al Representante Legal \no Apoderado debidamente constituido de la sociedad ECOPETROL S.A., \nidentificada con NIT.  899.999.068-1, o a quien haga sus veces, de conformidad con \nlo dispuesto en los artículos 67, 68 y 69 de la ley 1437 de 2011.\nPARÁGRAFO PRIMERO. En el suceso en que el titular de la licencia o el permiso, \nentre en proceso de disolución o régimen de insolvencia empresarial o liquidación \nregulados por las normas vigentes, informará inmediatamente de esta situación a \nesta Autoridad, con fundamento, entre otros, en los artículos 8, 58, 79, 80, 81, 95 \nnumeral 8 de la Constitución Política de 1991, en la Ley 43 de 1990, en la Ley 222 \nde 1995, en la Ley 1333 de 2009 y demás normas vigentes y jurisprudencia \naplicable.\nPARÁGRAFO SEGUNDO. Adicional a la obligación de informar a esta Autoridad \nde tal situación, el titular de la licencia o permiso aprovisionará contablemente las \nobligaciones contingentes que se deriven de la existencia de un procedimiento \nambiental sancionatorio conforme con el artículo 40 de la Ley 1333 de 2009 o la \nnorma que la adicione, modifique o derogue.\nARTÍCULO CUARTO . Por la Autoridad Nacional de Licencias Ambientales- ANLA, \ncomunicar el contenido del presente acto administrativo a la Corporación Autónoma \nRegional de la Orinoquía – CORPORINOQUIA, al municipio de Aguazul en el \ndepartamento de Casanare y a la Procuraduría Judicial Ambiental y Agraria para su \nconocimiento y fines pertinentes.\nARTÍCULO QUINTO. Por la Autoridad Nacional de Licencias Ambientales – ANLA, \npublicar el presente acto administrativo en la Gaceta Ambiental de esta Entidad, de \nconformidad con el artículo 71 de la Ley 99 del 22 de diciembre 1993 y la copia de \nla publicación deberá remitirse al expediente LAM0134.\n\nResolución No. 000998       Del 30 MAY. 2024          Hoja No. 23 de 24\n“Por la cual se resuelve recurso de reposición interpuesto contra la Resolución 000138 del 02 de \nfebrero de 2024”\nPágina 23 de 24\nARTÍCULO SEXTO. Contra el presente acto administrativo no procede recurso \nalguno de conformidad con lo establecido en el artículo 87 del Código de \nProcedimiento Administrativo y de lo Contencioso Administrativo.\nNOTIFÍQUESE, COMUNÍQUESE, PUBLÍQUESE Y CÚMPLASE\nDado en Bogotá D.C., a los 30 MAY. 2024\nRODRIGO ELIAS NEGRETE MONTES\nDIRECTOR GENERAL\nLAURA FERNANDA SIERRA PENARANDA\nCONTRATISTA\nOSCAR MAURICIO JARAMILLO RODRIGUEZ\nASESOR\nMONICA LILIANA JURADO GUTIERREZ\nCONTRATISTA\nSANDRA PATRICIA BEJARANO RINCON\nCONTRATISTA\nMARCELO ROJAS BALLESTEROS\nCONTRATISTA\nGERMAN BARRETO ARCINIEGAS\nSUBDIRECTOR DE SEGUIMIENTO DE LICENCIAS AMBIENTALES\nExpediente No. LAM0134\nFecha: marzo de 2024\nProceso No.: 20241000009984\nNota: Este es un documento electrónico generado desde los Sistemas de Información de la ANLA. El original reposa en los \narchivos digitales de la Entidad\n\nResolución No. 000998       Del 30 MAY. 2024          Hoja No. 24 de 24\n“Por la cual se resuelve recurso de reposición interpuesto contra la Resolución 000138 del 02 de \nfebrero de 2024”\nPágina 24 de 24\n"
}