{
  "fuente": "ANLA_GACETA",
  "numero_resolución": "RESOLUCIÓN N° 001458",
  "fecha_resolución": "2023-12-19",
  "nombre_proyecto": "proyecto denominado “Campo Toqui Toqui”, localizado en jurisdicción del",
  "ubicación": "departamento del Tolima.",
  "empresa": "a la sociedad Ecopetrol S.A.",
  "numero_expediente": "SAN0155-00-2018",
  "radicados": [
    "2022194982",
    "2021263160"
  ],
  "descripcion": "POR LA CUAL SE RESUELVE EL RECURSO DE REPOSICIÓN INTERPUESTO CONTRA LA RESOLUCIÓN No. 3016 DEL 19 DE DICIEMBRE DE 2023 Y SE TOMAN OTRAS DETERMINACIONES",
  "tipos_infraccion": [
    "Tala o afectación de bosques"
  ],
  "pdf_id": "47071",
  "file_name": "ANLA_47071.pdf",
  "texto_completo": "AUTORIDAD NACIONAL DE LICENCIAS \nAMBIENTALES\n- ANLA –\nRESOLUCIÓN N° 001458\n(16 JUL. 2024)\nPágina 1 de 18\n“POR LA CUAL SE RESUELVE EL RECURSO DE REPOSICIÓN \nINTERPUESTO CONTRA LA RESOLUCIÓN No. 3016 DEL 19 DE DICIEMBRE \nDE 2023 Y SE TOMAN OTRAS DETERMINACIONES”\nEL DIRECTOR GENERAL DE LA AUTORIDAD NACIONAL DE LICENCIAS \nAMBIENTALES – ANLA\nEn ejercicio de las facultades legales establecidas en las Leyes 99 de 1993, 1333 \nde 2009, 1437 de 2011 y en el Decreto 1076 de 2015, así como de las funciones \nconferidas por el Decreto – Ley 3573 de 2011 modificado por el Decreto 376 de \n2020, la Resolución No. 1223 del 19 de septiembre de 2022 del Ministerio de \nAmbiente y Desarrollo Sostenible, y\nCONSIDERANDO\nI.\nAsunto por decidir\nDentro del procedimiento administrativo sancionatorio ambiental adelantado bajo \nexpediente SAN0155-00-2018, se procede a resolver el recurso de reposición \ninterpuesto por la sociedad Interoil Colombia Exploration and Production con NIT. \n860.529.657 – 0, en contra de la Resolución No. 3016 del 19 de diciembre de 2023, \nmediante la cual se declaró la responsabilidad ambiental de la referida sociedad y \nse le impuso una sanción en modalidad de multa con ocasión a la infracción \nambiental acaecida en los proyectos Campo Desarrollo Puli C y Campo Toqui Toqui, \nlocalizados en jurisdicción de los departamentos del Tolima y Cundinamarca.\nII. Competencia\nLa Autoridad Nacional de Licencias Ambientales (en adelante ANLA), es \ncompetente para iniciar, adelantar y culminar el procedimiento de investigación, \npreventivo y sancionatorio en materia ambiental, teniendo en cuenta que es la \nautoridad facultada para otorgar y efectuar seguimiento al instrumento ambiental del \npresente proyecto.\n\nResolución No. 001458       Del 16 JUL. 2024          Hoja No. 2 de 18\n“POR LA CUAL SE RESUELVE EL RECURSO DE REPOSICIÓN \nINTERPUESTO CONTRA LA RESOLUCIÓN No. 3016 DEL 19 DE DICIEMBRE \nDE 2023 Y SE TOMA OTRAS DETERMINACIONES”\nPágina 2 de 18\nDicha facultad le fue transferida del Ministerio de Ambiente y Desarrollo Sostenible \n(MADS), de acuerdo con la desconcentración administrativa prevista en los \nnumerales 1°, 2° y 7° del artículo 3 del Decreto – Ley 3573 de 2011, en concordancia \ncon lo previsto en el artículo 2 de la Ley 1333 de 2009, siendo, por ende, competente \npara el ejercicio de la potestad sancionatoria ambiental.\nAhora bien, teniendo en cuenta que los artículos 74 y 76 de la Ley 1437 de 2011, \nseñalan que el recurso de reposición deberá presentarse ante el funcionario que \nprofirió la decisión para que la aclare, modifique, adicione o revoque, en el presente \ncaso el funcionario llamado a resolver el recurso interpuesto contra la Resolución \nNo. 2773 del 28 de noviembre de 2023 y expedir la decisión que corresponda, es el \nDirector General de la ANLA. \nFinalmente, se resalta que mediante la Resolución No. 1223 del 19 de septiembre \nde 2022 del Ministerio de Ambiente y Desarrollo Sostenible, se determinó:\n“(…) Artículo 1. Nombrar con carácter ordinario al señor RODRIGO ELIAS NEGRETE \nMONTES, identificado con la cédula de ciudadanía No. 78.691.601, en el empleo de \nDirector General, Código 0015, de la planta de personal de la Autoridad Nacional de \nLicencias Ambientales-ANLA. (…)”\nIII. Antecedentes relevantes y actuación administrativa\nAntecedentes Permisivos- Expedientes LAM0203 y LAV0046-00-2015\n3.1. Mediante Resolución No. 319 del 03 de abril de 1995, el Ministerio del Medio \nAmbiente, hoy Ministerio de Ambiente y Desarrollo Sostenible (en adelante \nMinisterio), otorgó Licencia Ambiental Global Ordinaria a la sociedad American \nInternational Petroleum Corporation of Colombia, para el desarrollo del \nproyecto denominado “Campo Toqui Toqui”, localizado en jurisdicción del \ndepartamento del Tolima.\n3.2. A través del radicado No. 3111-1-00041 del 3 de enero de 2001, la sociedad \nAmerican International Petroleum Corporation of Colombia, informó su cambio \nde razón social por Mercantile Colombia Oil and Gas - MCOG.\n3.3. Mediante Resolución No. 705 del 25 de julio de 2002, el Ministerio modificó la \nLicencia Ambiental otorgada a través de la Resolución No. 319 del 03 de abril \nde 1995, en el sentido de autorizar la ampliación del área licenciada Toqui-\nToqui a la extensión de todo el Bloque Puli C.\n3.4. A través de la Resolución No. 814 del 24 de julio de 2003, el Ministerio modificó \nla Resolución No. 705 del 25 de julio de 2002, mediante la cual se modificó la \nResolución No. 319 del 03 de abril de 1995, en el sentido de autorizar la \n\nResolución No. 001458       Del 16 JUL. 2024          Hoja No. 3 de 18\n“POR LA CUAL SE RESUELVE EL RECURSO DE REPOSICIÓN \nINTERPUESTO CONTRA LA RESOLUCIÓN No. 3016 DEL 19 DE DICIEMBRE \nDE 2023 Y SE TOMA OTRAS DETERMINACIONES”\nPágina 3 de 18\nperforación del Pozo de Desarrollo Río Opia -1, localizado dentro del Bloque \nPulí C.\n3.5. Mediante Resolución No. 1239 del 18 de noviembre de 2003, el Ministerio \naclaró la Resolución No. 319 del 03 de abril de 1995 y modificó el artículo 4° \nde la Resolución No. 705 del 25 de julio de 2002, en el sentido de adicionar \nlas actividades de adecuación y construcción de locaciones de perforación, \nadecuación y construcción de vías de acceso, perforación de pozos de \ndesarrollo, construcción de líneas de flujo, facilidades de superficies \nproyectadas y pruebas de producción.\n3.6. A través de la Escritura Pública No. 2072 de la Notaria 41 de Bogotá D.C., del \n18 de septiembre de 2006, inscrita el 21 de septiembre del mismo año bajo el \nNo. 138057 del Libro VI de la Cámara de Comercio de Bogotá D.C., se \nprotocolizó el documento mediante el cual se aprobó el cambio de razón social \nde la sociedad Mercantile Colombia Oil and Gas - MCOG por Interoil Colombia \nExploration and Production.\n3.7. Mediante Resolución No. 174 del 17 de febrero de 2015, esta Autoridad aceptó \nla cesión parcial de los derechos y obligaciones derivados de la Licencia \nambiental otorgada mediante la Resolución No. 319 del 03 de abril de 1995 y \nsus modificaciones, en relación con el proyecto “Campo Toqui Toqui”, a la \nsociedad Ecopetrol S.A.\n3.8. Teniendo como fundamento técnico el Concepto Técnico No. 11012 del 19 de \nseptiembre de 2014, la ANLA a través del Auto No. 838 del 03 de marzo de \n2015 efectuó seguimiento y control ambiental y realizó una serie de \nrequerimientos.\n3.9. Entre el 12 y el 15 de febrero de 2018 la ANLA practicó visita al área de \ninfluencia del proyecto “Área de Desarrollo Bloque Puli C”, cuyos resultados \nquedaron consignados en el Concepto Técnico No. 1502 del 9 de abril de \n2018, realizando requerimientos dentro del Auto No. 7509 del 30 de noviembre \nde 2018.\n3.10.Mediante oficio No. 2018143613-1-000 del 12 de octubre de 2018 (VITAL \n4100086052965718001) la sociedad Interoil Colombia Exploration and \nProduction presentó el reporte inicial del evento de contingencia ocurrido el 10 \nde octubre de 2018, en la vereda Manga de los Rodríguez del municipio de \nPiedras, departamento de Tolima, donde se presentó un derrame de crudo de \n3 Bbls debido a un segueteo en la línea del pozo MN-10ST1 por acción de \nterceros, afectando suelo, agua y vegetación.\n\nResolución No. 001458       Del 16 JUL. 2024          Hoja No. 4 de 18\n“POR LA CUAL SE RESUELVE EL RECURSO DE REPOSICIÓN \nINTERPUESTO CONTRA LA RESOLUCIÓN No. 3016 DEL 19 DE DICIEMBRE \nDE 2023 Y SE TOMA OTRAS DETERMINACIONES”\nPágina 4 de 18\n3.11.En ejercicio de sus funciones de seguimiento y control, la ANLA llevó a cabo \nvisita técnica al proyecto entre los días 08 y 09 de noviembre de 2018, con el \nfin de atender la queja remitida por la Procuraduría Judicial Ambiental y Agraria \ndel Tolima mediante radicado No. 2018147469-1-000 del 22 de octubre de \n2018, cuyos resultados quedaron consignados en el Concepto Técnico No. \n7860 del 18 de diciembre de 2018.\nAntecedentes Sancionatorios – Expediente SAN0155-00-2018\n3.12.Mediante Auto No. 3123 de 19 de junio de 2018 la ANLA ordenó la apertura \nde investigación sancionatoria en contra de las sociedades Interoil Colombia \nExploration and Production con NIT. 860.529.657 - 0 y Ecopetrol S.A. con NIT. \n899.999.068 - 1, con el fin de verificar los hechos constitutivos de infracción \nambiental en el marco del desarrollo de los proyectos Campo Toqui Toqui y \nÁrea de Desarrollo Bloque Pulí C.\n3.13.A través de la Resolución No. 389 del 18 de marzo de 2019 la ANLA impuso a \nla sociedad Interoil una medida preventiva de suspensión de la operación de \nlas líneas de flujo que del pozo MN-10 ST1 que se comunica con la batería \nManá, las cuales hacen parte del desarrollo del proyecto “Campo Toqui Toqui\", \ndentro del Área de Desarrollo Bloque Pulí C, ubicado en jurisdicción del \nmunicipio de Piedras, en el departamento del Tolima; frente a la cual se \nestablecieron dos condiciones de levantamiento, relacionadas con la \nreubicación de la línea de flujo y la aprobación de un Plan de Restauración y/o \nRecuperación.\n3.14.Mediante Auto No. 5385 del 13 de julio de 2022, la ANLA adelantó una \ndiligencia administrativa de incorporación documental.\n3.15.A través del Auto No. 6964 del 24 de agosto de 2022 la ANLA formuló el \nsiguiente cargo en contra de las sociedades Interoil Colombia Exploration and \nProduction con NIT. 860.529.657 - 0 y Ecopetrol S.A. con NIT. 899.999.068 - \n1:\nÚNICO CARGO: Por no haber construido algunas de las líneas de flujo de manera \nparalela a las vías sobre marcos H, ni haberlas protegido en los cruces viales con \ncañuelas de fibra de vidrio de un espesor de 2” a 3”, ni haberlas pintado o revestido \nde manera especial; como es el caso, de las líneas que se ubican en las \ncoordenadas E 914.531 – N 1.001.426, E 916.000 – N 998.161, E 914.229 – N \n999.072, E 915.066 – N 997.046, E 915.126 – N 996.787, E 914.836 – N 996.654, \nE 915.075 – N 997.046, E 915.188 – N 997.765, E 914.969 – N 997.332, E 915.461 \n– N 999.042, E 915.450 – N 999.037, E 914.500 – N 1.001.147, E 915.601 – N \n997.360, E 912.486 – N 1.001.910, E 914.755 – N 1.000.843, E 914.504 – N \n999.873, E 914.509 – N 998.902, E 915.080 – N 998.962, E 915.120 – N 998.591, \n\nResolución No. 001458       Del 16 JUL. 2024          Hoja No. 5 de 18\n“POR LA CUAL SE RESUELVE EL RECURSO DE REPOSICIÓN \nINTERPUESTO CONTRA LA RESOLUCIÓN No. 3016 DEL 19 DE DICIEMBRE \nDE 2023 Y SE TOMA OTRAS DETERMINACIONES”\nPágina 5 de 18\nE 915.447 – N 998.771, en el municipio de Piedras – Tolima, contrario a lo \nestablecido en el Numeral 8 del Artículo Segundo de la Resolución 1239 del 18 de \nnoviembre de 2003.\nEl precitado acto administrativo fue notificado electrónicamente a la sociedad \nInteroil mediante radicado No. 2022183707-2-000 del 25 de agosto de 2022, \nteniendo en cuenta la autorización presentada por radicado No. 2021149917-\n1-000 del 22 de julio de 2021; y a la sociedad ECOPETROL mediante radicado \nNo. 2022183709-2-000 del 25 de agosto de 2022, teniendo en cuenta la \nautorización presentada por radicado No. 2021260980-1-000 del 1 de \ndiciembre de 2021.\n3.16.Mediante radicados Nos. 2022194982-1-000 del 06 de septiembre de 2022, \n2022197564-1-000 y 2022197613-1-000 del 08 de septiembre de 2022, las \nsociedad investigadas presentaron escrito de descargos frente al Auto No. \n6964 del 24 de agosto de 2022.\n3.17.En cumplimiento de los artículos 25 y 26 de la Ley 1333 de 2009, a través de \nAuto No. 9201 del 19 de octubre de 2022 esta Autoridad adelantó la etapa \nprobatoria ordenando la incorporación de las pruebas presentadas en los \ndescargos.\n3.18.Mediante Resolución No. 43 del 17 de enero de 2023, la ANLA levantó la \nmedida preventiva de suspensión impuesta a la sociedad INTEROIL por \nResolución No. 389 del 18 de marzo de 2019.\n3.19.A través de Resolución No. 3016 del 19 de diciembre de 2023, teniendo en \ncuenta la valoración realizada por Concepto Técnico No. 5398 del 29 de \nagosto de 2023, la ANLA declaró responsable a la sociedad Interoil de la \ninfracción ambiental, imponiendo una sanción en la modalidad de multa, y \nexoneró de responsabilidad a la sociedad ECOPETROL.\n3.20.Mediante radicado No. 20246200013622 del 04 de enero de 2024 la sociedad \nsancionada presentó recurso de reposición en contra de la Resolución No. \n3016 del 19 de diciembre de 2023.\nIV. Del recurso de reposición \nEn el marco del procedimiento sancionatorio ambiental, el artículo 30 de la Ley 1333 \nde 2009 establece que cuando no haya superior jerárquico, contra el acto \nadministrativo que pone fin a una investigación sancionatoria ambiental procede el \n\nResolución No. 001458       Del 16 JUL. 2024          Hoja No. 6 de 18\n“POR LA CUAL SE RESUELVE EL RECURSO DE REPOSICIÓN \nINTERPUESTO CONTRA LA RESOLUCIÓN No. 3016 DEL 19 DE DICIEMBRE \nDE 2023 Y SE TOMA OTRAS DETERMINACIONES”\nPágina 6 de 18\nrecurso de reposición en los términos y condiciones señalados en el Código \nContencioso Administrativo1.\nEn el presente caso, se tiene que la sociedad Interoil Colombia Exploration and \nProduction interpuso recurso de reposición en contra de la Resolución No. 3016 del \n19 de diciembre de 2023 mediante radicado No. 20246200013622 del 4 de enero \nde 2024, estando dentro del término legal establecido para tales efectos. \nAsí las cosas, una vez verificado el cumplimiento de los requisitos establecidos en \nlos artículos 74 y siguientes de la Ley 1437 de 2011, en lo relativo a la oportunidad, \npresentación y requisitos del recurso de reposición, se encuentra que los mismos \nfueron satisfechos y se procederá con el respectivo análisis.\nV. Análisis del recurso\nRevisado el escrito del recurso de reposición, la sociedad solicitó que se revocara \nla Resolución No. 3016 de 2023 resaltando distintos motivos de inconformidad, \nentre los cuales se encontró la configuración de la caducidad para el cargo objeto \nde reproche.\nAsí pues, de conformidad con la sancionada se debía diferenciar entre las líneas \nconstruidas antes y/o después del 21 de julio de 2009 (fecha en que entró en vigor \nla Ley 1333 de 2009), pues en su consideración frente a aquellas que fueron \nmontadas antes de dicha fecha se genera el fenómeno de la caducidad de la \nfacultad sancionatoria. Sobre el particular la recurrente precisó:\nA. CADUCIDAD DE LA FACULTAD SANCIONATORIA – PRINCIPIO DE \nFAVORABILIDAD - IRRETROACTIVIDAD DE LA LEY 1333 DE 2009 Y EN \nGENERAL DE LAS NORMAS EN MATERIA SANCIONATORIA - EL CÓMPUTO \nDE LA CADUCIDAD DEBE HACERSE BAJO EL DECRETO 1594 DE 1994 \n(NORMA PREVIA A LA LEY 1333 DE 2009).\nEn primer lugar, debo señalar que la Resolución Sanción indicó que el presunto \nincumplimiento por el que se le sanciona a INTEROIL es por la no construcción de \nlas líneas de flujo después de 2003 sobre marcos H o en su defecto enterradas.\nBajo esa línea argumentativa, -sin perjuicio de lo que señalará más adelante-, lo \ncierto es que la ANLA debe precisar y diferenciar entre las líneas construidas antes \ny/o después del del 21 de julio 2009, fecha en que entró en vigor la Ley 1333 de \n2009, pues todas las que sean previas a dicha fecha, no pueden ni deben ser objeto \nde sanción ambiental, pues ciertamente el periodo de la caducidad antes de dicha \nLey 1333 de 2009 era de tres (3) años y no de veinte (20).\n1 Hoy Código de Procedimiento Administrativo y de lo Contencioso Administrativo, Ley 1437 de 2011.\n\nResolución No. 001458       Del 16 JUL. 2024          Hoja No. 7 de 18\n“POR LA CUAL SE RESUELVE EL RECURSO DE REPOSICIÓN \nINTERPUESTO CONTRA LA RESOLUCIÓN No. 3016 DEL 19 DE DICIEMBRE \nDE 2023 Y SE TOMA OTRAS DETERMINACIONES”\nPágina 7 de 18\nEn efecto, antes de julio de 2009, la norma aplicable en materia sancionatoria \nambiental era el Decreto 1594 de 1984, el cual en materia de caducidad se remitía \nal antiguo Código Contencioso Administrativo (“CCA”) – Decreto 01 de 1984 como \nnorma general, cuyo artículo 38 señalaba lo siguiente:\nARTÍCULO 38. Salvo disposición especial en contrario, la facultad que tienen las \nautoridades administrativas para imponer sanciones caduca a los tres (3) años de \nproducido el acto que pueda ocasionarlas.“\nA partir de ello, es evidente que todas las presuntas conductas que hubiesen \nocurrido antes del 21 de julio de 2009, tenían una caducidad de la facultad \nsancionatoria de tres años contados a partir del acto que pudo ocasionarlas \n(construcción de líneas de flujo) conducta que debe analizarse para cada \nconstrucción en particular y que donde indefectiblemente la caducidad de dicha \nfacultad sancionatoria ocurrió en el escenario más extenso y favorable el 21 de julio \nde 2012, ante la entrada en vigencia de la Ley 1333 de 2009.\nSobre este punto, es de total relevancia señalar que la caducidad en materia \nsancionatoria no es retroactiva salvo que sea más favorable para el investigado. Lo \nanterior, en virtud del principio de favorabilidad plenamente aplicable al presente \nasunto.\nEn verdad, para el caso concreto, la norma aplicable más favorable y en todo caso \nla vigente para la época de los hechos, es el Decreto 1594 de 1984 y el Decreto 01 \nde 1984. Al respecto, el H. Consejo de Estado, citando a la H. Corte Constitucional \nha indicado lo siguiente:\n“(…) la Corte advierte que si bien la Constitución de manera general prohíbe la \naplicación retroactiva de las disposiciones sancionatorias, establece sin \nembargo una excepción a dicha prohibición general. Esta excepción se da en el caso \nen el cual las normas posteriores son más favorables al sancionado que las \nanteriores, pues entonces la retroactividad no solo no es inconstitucional, sino que \nademás tal aplicación retroactiva es ordenada por la Constitución. Así lo dice \nclaramente el artículo 29 antes transcrito: (…) En materia penal, la ley permisiva o \nfavorable, aun cuando sea posterior, se aplicará de preferencia a la restrictiva o \ndesfavorable (…)”. 5 (Negrillas propias)\nA partir de allí resulta indiscutible que en materia sancionatoria: (i) las normas no \nson retroactivas por regla general; (ii) solo son retroactivas de manera excepcional, \nsi la norma es más favorable, en virtud del artículo 29 de la Constitución.\nAsí, para la Sanción impuesta a INTEROIL, la caducidad vigente y aplicable para la \népoca de los hechos era de tres (3) años, no de veinte (20). En todo caso, en virtud \ndel principio de favorabilidad, a pesar de que la ANLA iniciara el procedimiento \nsancionatorio en 2018 e imputara cargos en 2022, ello no obsta para desconocer \nque los hechos objeto de la Sanción datan de antes de la Ley 1333 de 2009 donde \nnaturalmente su aplicación no puede ser retroactiva.\n\nResolución No. 001458       Del 16 JUL. 2024          Hoja No. 8 de 18\n“POR LA CUAL SE RESUELVE EL RECURSO DE REPOSICIÓN \nINTERPUESTO CONTRA LA RESOLUCIÓN No. 3016 DEL 19 DE DICIEMBRE \nDE 2023 Y SE TOMA OTRAS DETERMINACIONES”\nPágina 8 de 18\nLo anterior, se evidencia incluso de la propia información entregada por \nECOPETROL al presente expediente, donde detalla la fecha de construcción de las \nlíneas de flujo que fueron objeto de cesión así:\nFecha aproximada construcción Líneas de Flujo cedidas a ECOPETROL\nEn ese sentido, si la última línea de flujo cedida a ECOPETROL fue construida el 3 \nde noviembre de 2007, -cesión aprobada por la ANLA en la Resolución No. 174 del \n\nResolución No. 001458       Del 16 JUL. 2024          Hoja No. 9 de 18\n“POR LA CUAL SE RESUELVE EL RECURSO DE REPOSICIÓN \nINTERPUESTO CONTRA LA RESOLUCIÓN No. 3016 DEL 19 DE DICIEMBRE \nDE 2023 Y SE TOMA OTRAS DETERMINACIONES”\nPágina 9 de 18\n17 de febrero de 2015- es evidente que dicha línea de flujo es de antes de la Ley \n1333 de 2009.\nPor ello, en virtud del artículo 29 de la Constitución, el principio de favorabilidad, la \nirretroactividad de las normas sancionatorias y el artículo 38 del Decreto 01 de 1984, \nla caducidad de tres (3) años de la facultad sancionatoria de la ANLA se materializó \nel 3 de noviembre de 2010 (para las líneas de flujo nates indicadas), donde el \nanálisis de caducidad debe hacerlo la autoridad, respetuosamente, línea por línea \nal constituirse conductas independientes.\nDicho de otra forma, claramente operó el fenómeno de la caducidad e INTEROIL no \npodía, ni debía ser sancionada por líneas de flujo construidas antes de 2009, ante \nla caducidad de la facultad sancionatoria, por lo que la Resolución Sanción debe ser \nrevocada y el expediente archivado.\nEn todo caso, tal como se expondrá en el acápite siguiente, la ANLA hizo \nseguimiento a todas las líneas de flujo construidas en su momento por la Compañía, \npor lo que a partir de dicho conocimiento de la ANLA y del cumplimiento de Interoil, \nno solo se viola la confianza legítima de la Compañía -como se expondrá a \ncontinuación- sino que se refuerza la caducidad de la presente actuación, al tener \nconocimiento la ANLA de las líneas de flujo más de 15 años atrás, sin realizar \nobservaciones y menos aún sin sancionar en su momento a la Compañía.\nPor lo anterior, es evidente que la ANLA debe diferenciar la fecha de construcción \nde las diferentes líneas de flujo, pues ciertamente todas las líneas de flujo que \nfueron construidas antes del 2009 no pueden, ni deben ser objeto de sanción, en \ntanto y en cuanto, la facultad sancionatoria de la ANLA se encuentra caducada”.\nEn relación con los anteriores argumentos, este Despacho encuentra que le asiste \nrazón a la recurrente, por las razones que se proceden a exponer:\nAl revisar las fechas de construcción de las líneas de flujo que pudieron ser \nidentificadas dentro de las coordenadas relacionadas en el cargo único formulado \nmediante Auto No. 6964 del 24 de agosto de 2022, se halla que éstas corresponden \na periodos anteriores a la entrada en vigor de la Ley 1333 de 2009 (21 de julio de \n2009).\nSobre el particular, cabe recordar que dentro de las coordenadas del cargo objeto \nde estudio se encontraron individualizadas las líneas de flujo TC1, TC8 (Trillizos), \nTC9, TT4, TC-15, TC-16, TT-27, TT-31 y TT29, las cuales hacen parte del Campo \nToqui Toqui. Partiendo de dicha delimitación, y con el fin de verificar los argumentos \nesgrimidos por la sociedad recurrente, se verificaron los soportes relacionados con \nla construcción de líneas de flujo dentro de los expedientes LAM0203 y LAV0046-\n00-2015 encontrando lo siguiente:\n\nResolución No. 001458       Del 16 JUL. 2024          Hoja No. 10 de 18\n“POR LA CUAL SE RESUELVE EL RECURSO DE REPOSICIÓN \nINTERPUESTO CONTRA LA RESOLUCIÓN No. 3016 DEL 19 DE DICIEMBRE \nDE 2023 Y SE TOMA OTRAS DETERMINACIONES”\nPágina 10 de 18\n1. Dentro del radicado No. 2021263160-1-000 del 03 de diciembre de 2021, por el \ncual se presentó el Informe de Cumplimiento Ambiental – ICA No. 34 de la fase \nde operación del Campo Toqui – Toqui correspondiente al primer semestre del \n2021, se presentó información relacionada con la infraestructura asociada a las \nplataformas construidas para el proyecto, el inicio de perforación, el pozo \nasociado y la temporalidad de manera independiente, así:\n2.\n3. De igual forma, dentro de los hallazgos plasmados en Concepto Técnico de \nSeguimiento No. 1204 del 30 de octubre de 2003, fundamento técnico de la \nResolución No. 1239 del 18 de noviembre de 2003, se presenta una relación de \nlos pozos de desarrollo existentes en el Campo Toqui Toqui, Bloque Puli C, al \n\nResolución No. 001458       Del 16 JUL. 2024          Hoja No. 11 de 18\n“POR LA CUAL SE RESUELVE EL RECURSO DE REPOSICIÓN \nINTERPUESTO CONTRA LA RESOLUCIÓN No. 3016 DEL 19 DE DICIEMBRE \nDE 2023 Y SE TOMA OTRAS DETERMINACIONES”\nPágina 11 de 18\nmomento de la visita, esto es, del 16 al 17 de septiembre de 2003, entre las \ncuales se encuentran algunas de las líneas identificadas, así:\nUna vez cotejada la información - aunque para algunos pozos las fechas de \nperforación disienten en términos de días y para el TC1 en términos de años -, se \npuede determinar que su construcción se adelantó en un periodo entre 1988 y 2007, \nasí:\nPozos\nAño de perforación\nTT4\n1988\nTT-31\n1992\nTT-29\n1992\nTT-27\n1993\nTC1\n1993 o 1997\n\nResolución No. 001458       Del 16 JUL. 2024          Hoja No. 12 de 18\n“POR LA CUAL SE RESUELVE EL RECURSO DE REPOSICIÓN \nINTERPUESTO CONTRA LA RESOLUCIÓN No. 3016 DEL 19 DE DICIEMBRE \nDE 2023 Y SE TOMA OTRAS DETERMINACIONES”\nPágina 12 de 18\nTC8\n1997\nTC9\n1997\nTC-15\n2005\nTC-16\n2006\nDichas fechas fueron a su vez comparadas con la información presentada por la \nsociedad ECOPETROL S.A. en su escrito de descargos, encontrando coincidencia \nentre la perforación de los pozos y los años en los cuales se adujo que se habían \nconstruido/instalado las líneas de flujo, a excepción de la línea TC1, que a pesar de \nno coincidir la información al año de construcción se encuentra que fue registrada \ndentro del Concepto Técnico No. 1204 del 30 de octubre de 2003, es decir, con \nanterioridad a la entrada en vigencia de la Resolución No. 1239 del 18 de noviembre \nde 2003, así:\nAÑO DE \nINSTALACIÓN/CONSTRUCCI\nÓN\nCOORDENADAS\nDescargos \npresentados \npor \nECOPETROL \nS.A.\n(Magna Bogotá)\nConcepto técnico \nseguimiento 1204 del \n30 de octubre de 2003\nLÍNEA\nS DE \nFLUJO\nDescargos \nECOPETROL \nS.A. \n(radicado \n2022194982-\n1-000 del \n6/09/2022)\nConcepto \ntécnico 1204 \ndel \n30/10/2003 y \nradicado \n2021263160-\n1-000 del \n3/12/2021\nEste\nNorte\nEste\nNorte\nTC1\n1997\n914.257.0\n0\n999.131.50\nTC8\n1997\n914.300.0\n0\n999.113.00\nTC9\n1997\n1997\n91422\n9\n999072\n914.263.5\n0\n999.079.80\nTT4\n1988\n1988\n91475\n5\n100084\n3\n914.754.3\n1\n1.000.834.8\n1\nTT27\n1993\n1993\n91508\n0\n998962\n915.080.0\n6\n998.953.13\nTT31\n1992\n1992\n91512\n0\n998591\n915.121.2\n5\n998.558.56\nTT29\n1992\n1992\n91544\n7\n998771\n915.450.1\n3\n998.764.69\nTC15\n2005\nTC16\n2006\n2006\n91450\n9\n998902\nN/A\nN/A\nDe lo anterior se colige que, frente a las líneas construidas con posterioridad a la \nResolución No. 1239 del 18 de noviembre de 2003 (a las cuales es aplicable la \nobligación del numeral 8 del artículo 2°) opera el fenómeno de la caducidad, en la \n\nResolución No. 001458       Del 16 JUL. 2024          Hoja No. 13 de 18\n“POR LA CUAL SE RESUELVE EL RECURSO DE REPOSICIÓN \nINTERPUESTO CONTRA LA RESOLUCIÓN No. 3016 DEL 19 DE DICIEMBRE \nDE 2023 Y SE TOMA OTRAS DETERMINACIONES”\nPágina 13 de 18\nmedida en que, al delimitarse el hecho como una acción, su acaecimiento debía \ncontarse desde el momento en que culminó la construcción de cada línea, de \nconformidad con la jurisprudencia del Consejo de Estado, según la cual:\n“(…) la producción del acto que ocasionó la sanción, supone que al margen de las \nconductas de ejecución instantánea, es decir, aquellas que se consuman en el \nmomento de su ejecución, el término empieza a contarse desde el instante en que \nse realiza o acontece. Mientras que para las conductas de ejecución permanente, el \ntérmino empieza a correr a partir de la fecha en la cual cesa su realización. Por su \nparte, y para aquellas que comportan un carácter omisivo, consistente en el \nincumplimiento de un deber contenido en una norma, el término de caducidad \nempezará a contarse desde el momento en que debió darse el cumplimiento de \naquel deber.”  (Subrayado y negrilla fuera de texto).2\nSiendo así, de conformidad con el proceso sancionatorio ambiental establecido por \nla Ley 1333 de 2009, desde el 21 de julio de 2009 (fecha en que entró en vigencia \nla presente norma), la acción sancionatoria ambiental caduca a los 20 años de haber \nsucedido el hecho u omisión generadora de la infracción. \nPese a ello, tratándose de eventos ocurridos con anterioridad a la Ley 1333 de 2009, \nel parágrafo 3 del artículo 85 de la Ley 99 de 1993, señala que para la imposición \nde las medidas y sanciones a que se refiere dicho artículo se aplicaría al \nprocedimiento previsto por el Decreto 1594 de 1984 o al estatuto que lo modifique \no sustituya; sin embargo, frente al fenómeno de la caducidad de la facultad \nsancionatoria, al no encontrarse regulada en las normas precedentes, se acude al \nCódigo Contencioso Administrativo (Decreto 01 de 1984) derogado por el artículo \n309 de la Ley 1437 de 2011, el cual fijó un término de tres (3) años para adelantar \ne imponer sanciones, así:\n“Artículo 38. Salvo disposición especial en contrario, la facultad que tienen las \nautoridades administrativas para imponer sanciones caduca a los tres (3) años de \nproducido el acto que pueda ocasionarlas”.\nAsí las cosas, dado que la caducidad es una institución jurídica que no se halla \ninmersa en el procedimiento sancionatorio como tal, sino que alude al término con \nque cuenta la Autoridad para ejercer válidamente la potestad sancionatoria respecto \nde una infracción ambiental, se encuentra que, en virtud del principio legalidad, no \nes viable jurídicamente aplicar el término de caducidad previsto en el artículo 10 de \nla Ley 1333 de 2009 (20 años), en la medida en que dicha normatividad entró en \nvigencia el 21 de julio del año 2009.\n2 Colombia. Consejo de Estado. Sala de lo Contencioso Administrativo. Sección Quinta. Rad.: 25000-23-24-000-2010-\n00702-01 (31, mayo, 2018) C.P.: Lucy Jeannette Bermúdez Bermúdez.\n\nResolución No. 001458       Del 16 JUL. 2024          Hoja No. 14 de 18\n“POR LA CUAL SE RESUELVE EL RECURSO DE REPOSICIÓN \nINTERPUESTO CONTRA LA RESOLUCIÓN No. 3016 DEL 19 DE DICIEMBRE \nDE 2023 Y SE TOMA OTRAS DETERMINACIONES”\nPágina 14 de 18\nPor lo tanto, tratándose del presente hecho, el Ministerio, autoridad competente para \nla época, contaba con tres (3) años desde el momento en que se realizó la \nconstrucción y se tuvo conocimiento de esta para iniciar la investigación y expedir y \nnotificar el acto administrativo que debía imponer la respectiva sanción, ya que el \ntiempo de contabilización se alcanzó a dar en los términos del artículo 38 del \nentonces Código Contencioso Administrativo (Decreto 01 de 1984).\nSobre el particular, la Sección Primera del Consejo de Estado, ha explicado en su \njurisprudencia que:\n“En ausencia de una disposición especial que rija la materia, el artículo 38 del CCA \nes el precepto llamado a garantizar que la administración obre con prontitud en el \ndesarrollo de las investigaciones que adelanta, estableciendo para la generalidad \nun término de tres años con el propósito de imponer las sanciones necesarias por \nconductas contrarias a derecho, definiendo así un margen temporal.\n(…) la Sala debe prevenir que desde el año 2009 la posición unívoca y consolidada \nque se impone al interior de la Corporación, al haber sido acogida por la Sala Plena \nde lo Contencioso Administrativo, tiene que ver con aquella que guarda la postura \nintermedia, esto es, que basta que el acto principal, aquel que impuso la sanción, se \nhaya expedido y notificado dentro de los tres años señalados en el artículo 38 del \nCCA, para entender que la facultad sancionatoria de la administración fue ejercida \nen tiempo, sin asomo de incuria que lleve a suponer que el inexorable paso del \ntiempo surgió como obstáculo absoluto para llevar a cabo la potestad sancionatoria. \n[…] Corolario de lo anterior es que, los tres años deben contabilizarse entre la \nconducta a sancionar (incumplimiento) y la expedición y notificación del acto \nsancionatorio”.\nEn consideración a lo expuesto, en el presente caso se superó dicho término, toda \nvez que al delimitarse el cargo bajo una acción (construir) que fue realizada bajo la \nnormatividad vigente antes de la expedición de la Ley 1333 de 2009, el término de \ncaducidad aplicable era de 3 años, los cuales ya fueron superados por creces, \nimpidiendo entonces que la ANLA pueda ejercer su potestad sancionatoria. \nPor lo anterior, este Despacho, considerando inocuo continuar con la verificación de \nlos demás argumentos expuestos en el recurso de reposición, procederá a revocar \nla decisión contenida en la Resolución No. 3016 del 19 de diciembre de 2023.\nVI. Archivo del expediente\nPor último, teniendo en cuenta que la Ley 1333 de 2009 - norma especial que regula \nel procedimiento sancionatorio ambiental – no alude en su articulado al archivo de \nexpediente cuando ha culminado el proceso sancionatorio, es necesario remitirse a \nla Ley 1437 de 2011, pues de conformidad con su artículo 2 , en lo no previsto en \n\nResolución No. 001458       Del 16 JUL. 2024          Hoja No. 15 de 18\n“POR LA CUAL SE RESUELVE EL RECURSO DE REPOSICIÓN \nINTERPUESTO CONTRA LA RESOLUCIÓN No. 3016 DEL 19 DE DICIEMBRE \nDE 2023 Y SE TOMA OTRAS DETERMINACIONES”\nPágina 15 de 18\nlos procedimientos regulados en normas especiales, se deberán aplicar sus \ndisposiciones.\nUna vez precisado lo anterior y al advertir que el Código de Procedimiento \nAdministrativo y de lo Contencioso Administrativo tampoco regula la materia, es \ndable destacar que el artículo 306 de la Ley 1437 de 2011 - Código de \nProcedimiento Administrativo y de lo Contencioso Administrativo, establece que:\n“En los aspectos no contemplados en este Código se seguirá el Código de \nProcedimiento Civil en lo que sea compatible con la naturaleza de los procesos y \nactuaciones que correspondan a la Jurisdicción de lo Contencioso Administrativo”.\nEs del caso destacar que el Código de Procedimiento Civil fue derogado por la Ley \n1564 del 12 de julio de 2012 “Por medio de la cual se expide el Código General del \nProceso y se dictan otras disposiciones”, en los términos establecidos en su artículo \n626; por lo que, en los aspectos no regulados en el Código de Procedimiento \nAdministrativo y de lo Contencioso Administrativo, debe hacerse remisión a las \ndisposiciones del Código General del Proceso.\nDe esta manera, al referir la procedencia del archivo de un expediente, es preciso \nacudir al artículo 122 del Código General del Proceso el cual señaló que el \n“expediente de cada proceso concluido se archivará […] La oficina de archivo \nordenará la expedición de las copias requeridas y efectuará los desgloses del caso”.\nAunado a lo anterior, en materia de disposición final de los archivos documentales \nse debe acudir a lo establecido en la Ley 594 de 2000, la cual refiere:\n“(…) ARTÍCULO 1. Objeto. La presente ley tiene por objeto establecer las reglas y \nprincipios generales que regulan la función archivística del Estado.\nARTÍCULO 2. Ámbito de aplicación. La presente ley comprende a la administración \npública en sus diferentes niveles, las entidades privadas que cumplen funciones \npúblicas y los demás organismos regulados por la presente ley. \n(…)\nARTÍCULO 23. Formación de archivos. Teniendo en cuenta el ciclo vital de los \ndocumentos, los archivos se clasifican en:\na) Archivo de gestión. Comprende toda la documentación que es sometida a \ncontinua utilización y consulta administrativa por las oficinas productoras u otras que \nla soliciten. Su circulación o trámite se realiza para dar respuesta o solución a los \nasuntos iniciados; \n\nResolución No. 001458       Del 16 JUL. 2024          Hoja No. 16 de 18\n“POR LA CUAL SE RESUELVE EL RECURSO DE REPOSICIÓN \nINTERPUESTO CONTRA LA RESOLUCIÓN No. 3016 DEL 19 DE DICIEMBRE \nDE 2023 Y SE TOMA OTRAS DETERMINACIONES”\nPágina 16 de 18\nb) Archivo central. En el que se agrupan documentos transferidos por los distintos \narchivos de gestión de la entidad respectiva, cuya consulta no es tan frecuente pero \nque siguen teniendo vigencia y son objeto de consulta por las propias oficinas y \nparticulares en general. \nc) Archivo histórico. Es aquel al que se transfieren desde el archivo central los \ndocumentos de archivo de conservación permanente (…)”.\nSiendo así, una vez se haya concluido la presente actuación administrativa, el \nexpediente SAN0155-00-2018 pasará a hacer parte del archivo central, sin perjuicio \nde la normativa aplicable sobre tablas de retención documental. \nEn mérito de lo expuesto,\nRESUELVE\nARTÍCULO PRIMERO. Reponer y en consecuencia revocar la Resolución No. 3016 \ndel 19 de diciembre de 2023, expedida dentro del procedimiento sancionatorio \nambiental iniciado mediante Auto No. 3123 de 19 de junio de 2018, por las razones \nexpuestas en el presente acto administrativo.\nARTÍCULO SEGUNDO. Notificar esta Resolución a la sociedad Interoil Colombia \nExploration and Production, identificada con NIT. 860.529.657 – 0, a través de su \napoderado debidamente constituido, o en su defecto, por intermedio de su \nrepresentante legal.\nARTÍCULO TERCERO. Comunicar esta Resolución a la Procuraduría Delegada \npara Asuntos Ambientales, Minero - Energéticos y Agrarios, para su conocimiento y \nfines pertinentes en cumplimiento de lo establecido en el artículo 56 de la Ley 1333 \nde 2009.\nARTÍCULO CUARTO. Publicar esta Resolución en la Gaceta Ambiental de la \nAutoridad Nacional de Licencias Ambientales, de conformidad con lo dispuesto en \nel artículo 71 de la Ley 99 de 1993.\nARTÍCULO QUINTO. Una vez ejecutoriado el presente acto, procédase al archivo \ndefinitivo de la actuación administrativa ambiental de carácter sancionatorio \npromovida dentro del expediente SAN0155-00-2018.\nARTÍCULO SEXTO. Contra lo establecido en el presente acto administrativo no \nproceden recursos.\nNOTIFÍQUESE, COMUNÍQUESE, PUBLÍQUESE Y CÚMPLASE\n\nResolución No. 001458       Del 16 JUL. 2024          Hoja No. 17 de 18\n“POR LA CUAL SE RESUELVE EL RECURSO DE REPOSICIÓN \nINTERPUESTO CONTRA LA RESOLUCIÓN No. 3016 DEL 19 DE DICIEMBRE \nDE 2023 Y SE TOMA OTRAS DETERMINACIONES”\nPágina 17 de 18\nDado en Bogotá D.C., a los 16 JUL. 2024\nRODRIGO ELIAS NEGRETE MONTES\nDIRECTOR GENERAL\nKAROLL PAOLA GOMEZ SOLANO\nCONTRATISTA\nMARIA ANGELICA GOMEZ PINTO\nCONTRATISTA\nOLGA LUCIA CARREÑO QUINTERO\nCONTRATISTA\nANDREA DIAZ VARGAS\nCONTRATISTA\nLEIDY ALEJANDRA VARGAS CALDERON\nPROFESIONAL ESPECIALIZADO\nExpediente No. SAN0155-00-2018 \nProceso No.: 20241000014584\nNota: Este es un documento electrónico generado desde los Sistemas de Información de la ANLA. El original reposa en los \narchivos digitales de la Entidad\n\nResolución No. 001458       Del 16 JUL. 2024          Hoja No. 18 de 18\n“POR LA CUAL SE RESUELVE EL RECURSO DE REPOSICIÓN \nINTERPUESTO CONTRA LA RESOLUCIÓN No. 3016 DEL 19 DE DICIEMBRE \nDE 2023 Y SE TOMA OTRAS DETERMINACIONES”\nPágina 18 de 18\n"
}