{
  "fuente": "ANLA_GACETA",
  "numero_resolución": "RESOLUCIÓN N° 1882",
  "fecha_resolución": "1993-12-22",
  "nombre_proyecto": "“Perforación de los pozos de Desarrollo Trinidad 8 y 9 de la Concesión Yalea”, localizado en el municipio de Trinidad, e",
  "nombre_proyecto_normalizada": "\"perforacion de los pozos de desarrollo trinidad 8 y 9 de la concesion yalea\", localizado en el municipio de trinidad, e",
  "ubicación": "el municipio de Trinidad, en el departamento de Casanare",
  "ubicacion_normalizada": "el municipio de trinidad, en el departamento de casanare",
  "empresa": "una medida adicional para el manejo y disposición final de residuos sólidos domésticos",
  "empresa_normalizada": "una medida adicional para el manejo y disposicion final de residuos solidos domesticos",
  "numero_expediente": "LAM0395",
  "radicados": [
    "2020123545",
    "2023042338",
    "20236200285352",
    "2020123553",
    "2020123680",
    "2020123571",
    "2020123573",
    "2020123579",
    "2020123583",
    "2020123671",
    "2019184537",
    "2020011066",
    "2020029614"
  ],
  "descripcion": "POR LA CUAL SE RESUELVE UN RECURSO DE REPOSICIÓN",
  "tipos_infraccion": [
    "Incumplimiento de norma",
    "Incumplimiento del PMA"
  ],
  "tipos_infraccion_normalizada": [
    "incumplimiento de norma",
    "incumplimiento del pma"
  ],
  "pdf_id": "43697",
  "file_name": "ANLA_43697.pdf",
  "texto_completo": " \nRepública de Colombia \nMinisterio de Ambiente y Desarrollo Sostenible \n \nAUTORIDAD NACIONAL DE LICENCIAS AMBIENTALES \n- ANLA – \nRESOLUCIÓN N° 1882 \n(25 AGO. 2023) \n \nPágina 1 de 17 \n \n“POR LA CUAL SE RESUELVE UN RECURSO DE REPOSICIÓN” \nEL ASESOR DEL DESPACHO DEL DIRECTOR DE LA AUTORIDAD NACIONAL DE \nLICENCIAS AMBIENTALES – ANLA \nEn ejercicio de las facultades legales establecidas mediante la Ley 99 del 22 de diciembre \nde 1993, el Decreto Ley 3573 del 27 de septiembre de 2011, modificado por el Decreto \n376 del 11 de marzo de 2020, por el cual se modifica la estructura de la Autoridad \nNacional de Licencias Ambientales y acorde con lo regulado en el Decreto 1076 del 26 de \nmayo de 2015,  la Resolución 669 del 14 de abril de 2020, la Resolución 1957 del 5 de \nnoviembre de 2021, y la Resolución 2795 del 25 de noviembre de 2022, expedidas por la \nAutoridad Nacional de Licencias Ambientales, \n \nCONSIDERANDO \n \nQue mediante Resolución 412 del 2 de mayo de 1995, el entonces Ministerio de Ambiente, \nVivienda y Desarrollo Territorial, hoy Ministerio de Ambiente y Desarrollo Sostenible, en \nadelante el Ministerio, otorgó Licencia Ambiental Ordinaria a la empresa KELT COLOMBIA \nS.A. identificada con el NIT. 860.032.463 - 4, para el proyecto “Perforación de los pozos de \nDesarrollo Trinidad 8 y 9 de la Concesión Yalea”, localizado en el municipio de Trinidad, en el \ndepartamento de Casanare. \n \nQue por medio de la Resolución 422 del 23 de abril de 1996, el Ministerio otorgó a la \nempresa KELT COLOMBIA S.A., Licencia Ambiental Ordinaria, para el proyecto “Perforación \ndel pozo de Desarrollo Trinidad 10”, localizado en el municipio de Trinidad, en el departamento \nde Casanare. \n \nQue, a través de la Resolución 230 del 18 de marzo de 1997, el Ministerio otorgó a la \nempresa KELT COLOMBIA S.A., Licencia Ambiental Ordinaria, para el proyecto de \n“Perforación de los pozos de Desarrollo Trinidad 11, 12, 13 y 14 de la Concesión Yalea”, localizado \nen el municipio de Trinidad, en el departamento de Casanare; así mismo, se dispuso en el \nartículo décimo del citado acto administrativo, la obligación de destinar como mínimo el 1% \npor ciento del total de la inversión del proyecto para la recuperación, preservación y \nvigilancia de las cuencas hidrográficas de los Caños Piñalito, El Banco, Campana y \nMarabares, en el evento de utilizar las aguas del rio Pauto. \n \nQue por Escritura Pública 279 de la Notaría 16 de Santafé de Bogotá D.C., del 13 de febrero \nde 1997, inscrita el 17 de marzo 1997, bajo el No. 75.238 del libro VI, la sociedad cambió \nsu nombre de KELT COLOMBIA S.A., por el de sociedad PERENCO COLOMBIA S.A. \n\nResolución No. 1882       Del 25 AGO. 2023          Hoja No. 2 de 17 \n \n“POR LA CUAL SE RESUELVE UN RECURSO DE REPOSICIÓN”  \n \nPágina 2 de 17 \n \nQue mediante comunicación con radicación 4355 del 4 de abril de 1997, la sociedad KELT \nCOLOMBIA S.A., informó al Ministerio, el cambio de su razón social por la de sociedad \nPERENCO COLOMBIA LIMITED., (en adelante la Sociedad). \n \nQue mediante Auto 287 del 28 de enero de 2015, la Autoridad Nacional de Licencias \nAmbientales – ANLA -, en adelante la Autoridad Nacional, requirió por última vez a la \nSociedad, para que diera estricto cumplimiento a las obligaciones relacionadas con la \ninversión de no menos del 1%. \n \nQue mediante la Resolución 1484 del 5 de diciembre de 2016, la Autoridad Nacional, \nimpuso a la Sociedad una medida adicional para el manejo y disposición final de residuos \nsólidos domésticos.  \n \nQue por medio de la Resolución 815 del 17 de julio de 2017, la Autoridad Nacional, modificó \nla Resolución 1484 del 5 de diciembre de 2016, con ocasión del recurso de reposición \ninterpuesto por la Sociedad. \n \nQue por medio de la Resolución 265 del 26 de febrero de 2018, la Autoridad Nacional, \nautorizó la modificación al Plan de inversión forzosa de no menos del 1% aprobado \nmediante la Resolución 230 del 18 de marzo de 1997. \n \nQue mediante comunicación con radicado 2020123545-1-000 del 31 de julio de 2020, la \nSociedad presentó la propuesta técnica de la inversión forzosa de no menos del 1%, bajo \nel documento denominado “Propuesta de inversión 1% Ideam- Perenco, junio 2020”. \n \nQue mediante Resolución 1955 del 5 de noviembre de 2021, la Autoridad Nacional, modificó \nla Resolución 412 del 2 de mayo de 1995, correspondiente al proyecto “Perforación Pozos de \nDesarrollo Trinidad 8 y 9 de la Concesión Yalea”, la Resolución 422 del 23 de abril de 1996 \ncorrespondiente al proyecto “Perforación del pozo de Desarrollo Trinidad 10”, y la Resolución \n230 del 18 de marzo de 1997, correspondiente al proyecto “Perforación de los pozos de \nDesarrollo Trinidad 11, 12, 13 y 14 de la Concesión Yalea”, en el sentido de aprobar el \nacogimiento al porcentaje incremental de la base de liquidación de la inversión forzosa de \nno menos del 1%, en virtud de lo señalado en el artículo 321 de la Ley 1955 del 25 de mayo \ndel 2019; a su vez en el Artículo Décimo Primero, se requirió a la Sociedad para que en el \ntérmino de un mes, allegara información adicional con el objeto de evaluar la propuesta de \ninversión  denominada “Propuesta de inversión 1% Ideam- Perenco, junio 2020”. \n \nQue a través de la Resolución 2430 del 30 de diciembre de 2021, la Autoridad Nacional, \nresolvió el recurso de reposición interpuesto por la Sociedad, confirmando el contenido de \nlos parágrafos tercero y cuarto del artículo octavo de la Resolución 1955 del 5 de noviembre \nde 2021, a través de los cuales se estableció el valor en ejecución y por ejecutar del Plan \nde Inversión Forzosa de no menos del 1%; respectivamente. \nQue a través de la Resolución 1461 del 12 de julio de 2022, se impuso a la sociedad \nPERENCO COLOMBIA LIMITED, una medida ambiental adicional, consistente en la \npresentación de un informe detallado de la situación presentada en el área afectada por \npresencia de hidrocarburos en suelo de la locación TRD-13 del proyecto “Perforación de los \npozos de Desarrollo Trinidad 8 y 9 de la Concesión Yalea; Perforación del pozo de Desarrollo \nTrinidad 10; y Perforación de los pozos de Desarrollo Trinidad 11, 12, 13 y 14 de la Concesión Yalea”. \n\nResolución No. 1882       Del 25 AGO. 2023          Hoja No. 3 de 17 \n \n“POR LA CUAL SE RESUELVE UN RECURSO DE REPOSICIÓN”  \n \nPágina 3 de 17 \n \n \nQue mediante comunicación con radicado 2023042338-1-000 del 02 de marzo de 2023, la \nSociedad da respuesta parcial a los requerimientos efectuados en el Artículo Décimo \nPrimero de la Resolución 1955 del 5 de noviembre de 2021. \n \nQue por medio de la Resolución 1203 del 9 de junio de 2023, la Autoridad Nacional, declaró \nel desistimiento tácito de la “Propuesta de recursos de inversión 1% IDEAM – PERENCO \nCOLOMBIA LIMITED de junio 2020”, la cual fue debidamente notificada a la Sociedad el 13 de \njunio de 2023 mediante correo electrónico. \n \nQue mediante comunicación con radicado 20236200285352 del 28 de junio de 2023, la \nSociedad, interpuso Recurso de Reposición contra la Resolución 1203 del 9 de junio de \n2023, argumentos que fueron evaluados por el equipo técnico de la Autoridad Nacional y \nen consecuencia expidió el Concepto 4869 del 9 de agosto de 2023.  \n \nCOMPETENCIA DE LA AUTORIDAD NACIONAL  \n \nEl Gobierno Nacional, mediante Decreto Ley 3573 del 27 de septiembre de 2011, creó la \nAutoridad Nacional de Licencias Ambientales (ANLA), como una entidad con autonomía \nadministrativa y financiera, sin personería jurídica, la cual hace parte del Sector \nAdministrativo de Ambiente y Desarrollo Sostenible, en los términos del artículo 67 de la \nLey 489 de 1998. \n \nEl numeral 1° del artículo tercero del mencionado decreto estableció dentro de las funciones \nde la Autoridad Nacional, la de otorgar o negar las licencias, permisos y trámites \nambientales de competencia del Ministerio, de conformidad con la ley y los reglamentos. \n \nMediante el Decreto 376 del 11 de marzo de 2020, se modificó la estructura de la Autoridad \nNacional de Licencias Ambientales. \n \nMediante la Resolución 669 del 14 de abril de 2020, se nombró como servidor público a \nEDILBERTO PEÑARANDA CORREA, identificado con cédula de ciudadanía 4.052.851, en \nel empleo de libre nombramiento y remoción de Asesor, código 1020, grado 15, adscrito a \nla Dirección General de la planta global de la ANLA. \n \nEl 5 de noviembre de 2021, la Autoridad Nacional emitió la Resolución 1957 “Por la cual se \nadopta el Manual Específico de Funciones y de Competencias Laborales para los empleos \nde la planta de personal de la Autoridad Nacional de Licencias Ambientales - ANLA”, en \ndonde se establece que corresponde al Despacho del Director General de la Autoridad \nNacional de Licencias Ambientales - ANLA, “Suscribir los actos administrativos que otorgan, \nniegan, modifican, ajustan o declaran la terminación de las licencias, permisos y trámites \nambientales”.  \n \nEn ejercicio de las facultades conferidas por la Ley 489 de 1998, se expidió la Resolución \n2795 del 25 de noviembre de 2022, -Por la cual se delegan unas funciones y se dictan otras \ndisposiciones-, que en el numeral 15 del artículo primero se delegó en el Asesor Código \n1020 Grado 15 del Despacho del Director General, entre otras, la función de resolver los \nrecursos de reposición interpuestos contra los actos administrativos que se emitan en \ncumplimiento de las funciones delegadas.  \n \n\nResolución No. 1882       Del 25 AGO. 2023          Hoja No. 4 de 17 \n \n“POR LA CUAL SE RESUELVE UN RECURSO DE REPOSICIÓN”  \n \nPágina 4 de 17 \n \nTeniendo en cuenta lo anterior, es el Asesor del Despacho del Director General de la \nAutoridad Nacional el competente para pronunciarse sobre el recurso de reposición \ninterpuesto por la Sociedad en contra de la Resolución 1203 del 9 de junio de 2023. \n \nFUNDAMENTOS JURIDICOS \n \nEl procedimiento para la presentación y resolución de recursos contra los actos \nadministrativos se encuentra reglado en el Código de Procedimiento Administrativo y de lo \nContencioso Administrativo artículos 74 y siguientes, que particularmente respecto del \nrecurso de reposición al tenor literal expresan: \n \n“Artículo 74. Recursos contra los actos administrativos. \n \nPor regla general, contra los actos definitivos procederán los siguientes recursos:  \n \n1. El de reposición, ante quien expidió la decisión para que la aclare, modifique, adicione o \nrevoque (…)” \n \nA su vez, los artículos 76 y 77 del Código enunciado preceptúan:  \n \n“Artículo 76. Oportunidad y presentación. \n \nLos recursos de reposición y apelación deberán interponerse por escrito en la diligencia de \nnotificación personal, o dentro de los diez (10) días siguientes a ella, o a la notificación por \naviso, o al vencimiento del término de publicación, según el caso. Los recursos contra los \nactos presuntos podrán interponerse en cualquier tiempo, salvo en el evento en que se haya \nacudido ante el juez.  \n \nLos recursos se presentarán ante el funcionario que dictó la decisión, salvo lo dispuesto para \nel de queja, y si quien fuere competente no quisiere recibirlos podrán presentarse ante el \nprocurador regional o ante el personero municipal, para que ordene recibirlos y tramitarlos, \ne imponga las sanciones correspondientes, si a ello hubiere lugar.  \n \nEl recurso de apelación podrá interponerse directamente, o como subsidiario del de \nreposición y cuando proceda será obligatorio para acceder a la jurisdicción.  \n \nLos recursos de reposición y de queja no serán obligatorios.  \n \nArtículo 77. Requisitos. \n \nPor regla general los recursos se interpondrán por escrito que no requiere de presentación \npersonal si quien lo presenta ha sido reconocido en la actuación. Igualmente, podrán \npresentarse por medios electrónicos.  \n \nLos recursos deberán reunir, además, los siguientes requisitos:  \n \n1. Interponerse dentro del plazo legal, por el interesado o su representante o apoderado \ndebidamente constituido.  \n \n2. Sustentarse con expresión concreta de los motivos de inconformidad. \n \n3. Solicitar y aportar las pruebas que se pretende hacer valer.  \n \n4. Indicar el nombre y la dirección del recurrente, así como la dirección electrónica si desea \nser notificado por este medio.  \n\nResolución No. 1882       Del 25 AGO. 2023          Hoja No. 5 de 17 \n \n“POR LA CUAL SE RESUELVE UN RECURSO DE REPOSICIÓN”  \n \nPágina 5 de 17 \n \n \nSólo los abogados en ejercicio podrán ser apoderados (…) \n \nA su vez, el artículo 80 del citado Código, establece el alcance del contenido de la decisión \nque resuelve el recurso: \n \n“Artículo 80. Decisión de los recursos. -Vencido el período probatorio, si a ello hubiere \nlugar, y sin necesidad de acto que así lo declare, deberá proferirse la decisión motivada que \nresuelva el recurso.  \n \nLa decisión resolverá todas las peticiones que hayan sido oportunamente planteadas y las \nque surjan con motivo del recurso. \n \n \nCONSIDERACIONES DE LA AUTORIDAD NACIONAL FRENTE AL RECURSO DE \nREPOSICIÓN INTERPUESTO POR LA SOCIEDAD  \n \nDesde el punto de vista procedimental, se observa que el recurso de reposición interpuesto \npor la sociedad PERENCO COLOMBIA LIMITED, en contra de la Resolución 1203 del 9 de \njunio de 2023, cumple con los requisitos establecidos en el artículo 77 y concordantes del \nCódigo de Procedimiento Administrativo y de lo Contencioso Administrativo, en cuanto a lo \nsiguiente:  \n \n1. \nInterponerse dentro del plazo legal, por el interesado o su representante o apoderado \ndebidamente constituido. \n \nSe encuentra acreditado que el día 13 de junio de 2023, la Sociedad fue debidamente \nnotificada mediante correo electrónico de la Resolución 1203 del 9 de junio de 2023, frente \na la cual interpuso recurso de reposición por intermedio de su Representante Legal el día \n28 de junio de 2023, radicado en la Autoridad Nacional bajo el número 20236200285352, \nesto es, dentro de los diez (10) días siguientes a la notificación, de conformidad con lo \npreceptuado en el artículo 76 de la Ley 1437 de 2011. \n \n2. \nSustentarse con expresión concreta de los motivos de inconformidad.  \n \nLa Sociedad presentó los argumentos en contra de la disposición recurrida de la Resolución \n1203 del 9 de junio de 2023, los cuales serán tenidos en cuenta para decidir el presente \nrecurso de reposición. \n \n3. \nSolicitar y aportar las pruebas que se pretende hacer valer. \n \nLa Sociedad solicitó se tuvieran como prueba documental las comunicaciones con \nradicados 2020123553-1-000, 2020123680-1-000, 2020123571-1-000, 2020123573-1-000, \n2020123579-1-000, 2020123583-1-000 y 2020123671-1-000 del 31 de julio de 2020.  \n \n4. \nIndicar el nombre y la dirección del recurrente, así como la dirección electrónica si desea \nser notificado por este medio. \n \nLa sociedad manifestó que, para efectos de la notificación dentro del presente expediente, \nlas recibiría en: “Carrera 7 No 71-21 Torre B, Piso 17, Chapinero, en la ciudad de Bogotá DC. \nCorreo electrónico notificaciones@co.perenco.com ” \n \n\nResolución No. 1882       Del 25 AGO. 2023          Hoja No. 6 de 17 \n \n“POR LA CUAL SE RESUELVE UN RECURSO DE REPOSICIÓN”  \n \nPágina 6 de 17 \n \nCon base en lo anterior, verificado el cumplimiento de los requisitos establecidos en el  \nCódigo de Procedimiento Administrativo y de lo Contencioso Administrativo -CPACA-, \nrespecto a la procedencia del señalado recurso de reposición, la Autoridad Nacional \nprocederá a resolverlo, teniendo en cuenta las consideraciones realizadas en el Concepto \nTécnico 4869 del 9 de agosto de 2023; en el mismo orden de los argumentos presentados \npor la sociedad, a saber: \n \n \n1. DISPOSICIÓN RECURRIDA –RESOLUCIÓN 1203 DEL 9 DE JUNIO DE 2023.  \n \n“ARTÍCULO PRIMERO. DECLARAR el desistimiento tácito de la propuesta 2020123545-1-000 del \n31 de julio de 2020 relacionada con la “Propuesta de recursos de inversión 1% IDEAM – PERENCO \nCOLOMBIA LIMITED de junio 2020”, por argumentos expuestos en la parte motiva de este acto \nadministrativo.  \n \nARTÍCULO SEGUNDO. DECLARAR por concluido el Artículo Décimo Primero de la Resolución \n1955 del 05 de noviembre de 2021, conforme a lo expuesto en la parte motiva del presente acto \nadministrativo. \n \n (…)” \n \n1.1. Petición de la Sociedad. \n \n“(…), Se REVOQUE en todo su contexto lo dispuesto en el Resolución 1203 del 09 de junio de 2023 \ny como consecuencia de ello se efectue (sic) un análisis integral de la propuesta denominada \n“Propuesta de inversión 1% Ideam- Perenco, junio 2020” teniendo en cuenta todos y cada uno de \nlos expedientes que se encuentran cobijdas (sic) en el documento allegado que permita un ajuste y \ncomplementación global de ser necesario, y que permitan llevar a cabo el cumplimiento a la \nobligación de destinar como mínimo un uno (1%) por ciento del total de la inversión en el proyecto \npara la recuperación, preservación y vigilancia de las respectivas cuencas hidrográficas.”  \n \n1.2 Argumentos de la Sociedad. \n \n“(...)” \n \nEn primer lugar, ha de resaltarse que el documento presentado ante esa Autoridad Ambiental \nmediante radicado No. 2020123545-1-000 del 31 de julio de 2020 relacionado con la “Propuesta de \nrecursos de inversión 1% IDEAM – PERENCO COLOMBIA LIMITED de junio 2020” no solo hace \nparte del expediente LAM0395 sino que la misma corresponde a una propuesta global que cobija \notros expedientes, que si bien se presentaron a través de radicados distintos, la misma no puede ser \nanalizada de manera parcial, teniendo en cuenta que esta propende la inclusión de más expedientes, \nlos cuales nos permitimos relacionar a continuación con el respectivo número de radicado: \n \n- LAM 0165 Bloque Garcero C propuesta presentada con numero de radicado 2020123553-1-\n000 del 31 de julio de 2020. \n - LAM 0471 Bloque Cocora A2 propuesta presentada con numero de radicado 2020123680-1-\n000 del 31 de julio de 2020. \n - LAM 0841 Pozos de desarrollo Palmarito 4 y 5 propuesta presentada con numero de radicado \n2020123571-1-000 del 31 de julio de 2020. \n - LAM 1265 Pozos de desarrollo Tocaria 6-13 propuesta presentada con numero de radicado \n2020123573-1-000 del 31 de julio de 2020. \n - LAM 1700 Bloque Cravo Sur propuesta presentada con numero de radicado 2020123579-1-\n000 del 31 de julio de 2020. \n\nResolución No. 1882       Del 25 AGO. 2023          Hoja No. 7 de 17 \n \n“POR LA CUAL SE RESUELVE UN RECURSO DE REPOSICIÓN”  \n \nPágina 7 de 17 \n \n - LAM 3610 Bloque Cocora A2 propuesta presentada con numero de radicado 2020123583-1-\n000 del 31 de julio de 2020. \n - LAM 3629 Bloque Orocué propuesta presentada con numero de radicado 2020123671-1-000 \ndel 31 de julio de 2020. \n \nEn ese escenario, debe tenerse en cuenta que la propuesta presentada ante esa autoridad ambiental \nimplica un análisis integral de los expedientes antes relacionados, pues efectuar requerimientos de \nmanera individualizada para cada expediente, obstaculiza al administrado que de manera global se \ncomplemente, ajuste o aclare la propuesta correspondiente a “Propuesta de recursos de inversión \n1% IDEAM – PERENCO COLOMBIA LIMITED de junio 2020”. \n \nPor lo anterior, si bien la empresa PERENCO COLOMBIA LIMITED en atención a lo dispuesto en la \nResolución 1955 del 05 de noviembre de 2021 mediante radicado 2023042338-1-000 del 02 de \nmarzo de 2023 dio alcance a los requerimientos efectuados por la autoridad, esta no fue posible \nentregarla en su totalidad teniendo en cuenta que la información requerida no era posible presentar \nsu complementación y ajuste aun cuando se encuentra pendiente por parte de la ANLA la revisión \nde los demás expedientes, que obedecen y atienden a la propuesta global presentada. \n \nEs así como no es dable efectuar unos ajustes parciales aun cuando se trata de una propuesta global \ndel cual de considerar que la propuesta era susceptible de ajustes esta debio (sic) efectuarse de \nmanera total con el análisis de todos y cado (sic) uno de los expedientes que se ven inmersos en la \nactuación administrativa iniciada por el hoy recurrente. \n \nPor otra parte, tal como lo señala la parte motiva de la Resolución 1203 del 09 de junio de 2023, la \ndecisión adoptada por la Autoridad Ambiental mediante Resolución 1955 del 05 de noviembre de \n2021 por medio de la cual fue aprobado el acogimiento de la empresa PERENCO COLOMBIA \nLIMITED al articulo (sic) 321 de la ley 1955 de 2019, desconoce que el mismo no es susceptible (sic) \nde emisión de pronunciamiento de fondo, sino que corresponde a la decisión libre y espontanea (sic) \nde la empresa de acogerse a lo dispuesto en tal disposición. \n \nARTICULO 321 DE LA LEY 1955 DE 2019 – PROCEDIMIENTO NO REGLADO \n \n Es preciso indicar que en observancia de lo estipulado en el artículo 321 del Plan Nacional de \nDesarrollo (Ley 1955 de 2019) que al tenor de su letra expresa: \n \n“ARTÍCULO 321. ACTUALIZACIÓN DEL VALOR DE LA INVERSIÓN DE NO MENOS DEL \n1%, DE COMPETENCIA DE LA AUTORIDAD NACIONAL DE LICENCIAS AMBIENTALES \n(ANLA). Todos aquellos titulares de una licencia ambiental que tengan inversiones \npendientes a la fecha de promulgación de la presente ley, relativas a la inversión forzosa de \nno menos del 1% de que trata el parágrafo del artículo 43 de la Ley 99 de 1993, PODRÁN \nACOGERSE al porcentaje de incremento del valor de la base de liquidación de la inversión \nforzosa de no menos del 1%, según el año de inicio de actividades autorizadas en la licencia \nambiental, de acuerdo con lo señalado en la siguiente tabla: \n \n \nAño de inicio de actividades \nautorizadas en la Licencia \nAmbiental \nPorcentaje de incremento del \nvalor de la base de liquidación \nde la inversión forzosa de no \nmenos del 1% \n1993-2000 \n45% \n2001-2006 \n35% \n2007-2018 \n10% \n \n \n\nResolución No. 1882       Del 25 AGO. 2023          Hoja No. 8 de 17 \n \n“POR LA CUAL SE RESUELVE UN RECURSO DE REPOSICIÓN”  \n \nPágina 8 de 17 \n \nLas inversiones ejecutadas o que estén en proceso de ejecución en el marco de un plan de inversión \ndel 1% aprobado por la Autoridad Nacional de Licencias Ambientales (ANLA), no serán tenidas en \ncuenta para efectos del cálculo de la actualización del valor de la base de liquidación de la inversión \ndel 1%.  \n \nPARA ACOGERSE deberán presentar la solicitud dentro de los seis (6) meses siguientes a la \npromulgación de la presente ley, junto con: a) el certificado que soporta el cálculo de la base de \nliquidación; b) el plan de inversión con la base actualizada aplicando el porcentaje de incremento \ndefinido en la tabla anterior; c) la proyección financiera para la ejecución del plan de inversión y d) el \ncronograma del plan de inversión del 1% con inicio de ejecución no superior a los seis (6) meses \nsiguientes de la aprobación de la solicitud de acogimiento. \n \nEn caso de no ejecutar las inversiones de acuerdo con el cronograma, por un tiempo superior a un \naño fiscal, deberán actualizar los valores no ejecutados, de acuerdo con la fórmula señalada en el \nparágrafo 1° del presente artículo. \n \nPARA LOS QUE SE ACOJAN o no al presente artículo y los nuevos titulares de licencia, la \nliquidación de la inversión se realizará de conformidad con los siguientes ítems: a) adquisición de \nterrenos e inmuebles, b) obras civiles, c) adquisición y alquiler de maquinaria y equipo utilizado en \nlas obras civiles y d) constitución de servidumbres. Los costos y gastos, incluidos los capitalizados \nen el activo, a que se refieren los literales anteriores, corresponden a los realizados en las etapas \nprevias a la producción de proyectos, obras o actividades sujetos de licenciamiento ambiental o \naquellas modificaciones de proyectos, obras o actividades que tengan como instrumento de control \nun plan de manejo ambiental, siempre y cuando dicha modificación cumpla con las condiciones \nestablecidas en la reglamentación vigente. (…)” (subrayado y negrilla fuera del texto). \n \nEs de precisar que el artículo 321, va dirigido exclusivamente a la búsqueda de la manifestación de \nla voluntad de los administrados, quienes en su calidad de titulares de una licencia ambiental con \ninversiones pendientes, a través de su pronunciamiento positivo o negativo, tenían la facultad de \nacogerse o no al porcentaje de incremento del valor de la base de liquidación de la inversión forzosa \nde no menos del 1%, por lo cual dicha actuación no resulta impositiva, pero si constituye una potestad \npara quien en calidad de titular de una licencia ambiental pueda o decida hacerlo. \n \nDe la lectura fiel del artículo transcrito se establece que existe una obligación que se traduce en dos \nsituaciones para los titulares de las licencias ambientales o bien se acogen al porcentaje previamente \ndeterminado en la ley o se acoge a la liquidación del costo de inversión conforme lo determina la \nformula (sic) del parágrafo. \n \nAsí mismo, de tal lectura al referido texto legal, no es posible deducir de manera adicional ni mucho \nmenos interpretar, que allí se determinó alguna reglamentación ya que su texto es claro, por lo que \ntratar de incluirla, no corresponde a la simple interpretación subjetiva del literal correspondiente al \nartículo en cuestión, pues vale precisar, que la regla interpretativa de las normas es la literal y en \nese sentido lo que hoy se discute, sin hacer extensa hermenéutica sobre la misma, es traer a valor \npresente el valor del costo de inversión, aspecto éste que constituía un asunto controversial al \npretenderse a través de actos administrativos requerir la indexación de esos valores. \n \nAsí las cosas, el Gobierno Nacional, pretendió a través de la Ley 1955 de 2019 cesar las \ninterpretaciones frente a este elemento de ajuste meramente contable (indexación), no ambiental y \ncrear a través de esta ley del plan nacional de desarrollo, unos porcentajes puntuales de incremento \ndel valor de la base de liquidación, buscando a través del requerimiento perentorio estatuido en el \nartículo 321 que los administrados sujetos a esta obligación derivada de la Ley 99 de 1993, se \nacogieran o no a ese marco porcentual de incremento. \n \nPor lo anterior ha de reiterarse que el objeto de la norma era obtener de los titulares de los \n\nResolución No. 1882       Del 25 AGO. 2023          Hoja No. 9 de 17 \n \n“POR LA CUAL SE RESUELVE UN RECURSO DE REPOSICIÓN”  \n \nPágina 9 de 17 \n \ninstrumentos de manejo y control ambiental ese pronunciamiento de acogimiento o no a ese \nporcentaje de incremento que recoge el mentado artículo 321, en otras era un asunto de mera \nvoluntad, tomar una o la otra opción. \n \n Tema accesorio representa, según la lectura literal del artículo 321, que dicho pronunciamiento de \nacogimiento viniese acompañado de una información adjunta, que es la que hoy reclama la Autoridad \nambiental como no conforme.  \n \nPor ello, en gracia de discusión de la suficiencia o no de dicha información adjunta, su no recibo por \nparte de la Autoridad ambiental NO puede ser motivación o premisa legal para desechar o inobservar \nla manifestación expresa de acogimiento del incremento porcentual de los costos de liquidación de \nla inversión del 1% a la que refiere el encabezamiento del artículo 321 que hizo manifiesta PERENCO \nLIMITED en los comunicado (sic) con radicado 2019184537-1-000 del 25 de noviembre de 2019, \n2021123545-1-000 del 31 de julio de 2020, 2020225872-1-000 del 21 de diciembre de 2020 y \n2021058822-1-000 del 31 de marzo de 2021, más aún cuando esta se hizo conocer dentro de la \noportunidad temporal establecida en el Plan Nacional de Desarrollo. \n \n Ahora bien, con anterioridad referíamos que el citado artículo 321 de la Ley 1955 de 2019, carece \nde reglamentación, y por ello per se, da su aplicación legal a partir de la redacción legal del texto. \n \nEn esta redacción se hace ausente disposición legal que determine el procedimiento a seguir, por \nparte de las autoridades ambientales titulares de la función de evaluación y seguimiento ambiental, \ncuando de acuerdo al criterio evaluador se determine su inconformidad; por ello, el requerimiento \ndesarrollado por la autoridad ambiental a través de la Resolución 1955 de 2021, se constituye en \nuna actuación meramente discrecional a la luz de la doctrina y la jurisprudencia, y es por ello nuestra \nrazón de insistir respetuosamente, que la intención del legislador, materializado en el fin de la ley, \nfue darle al particular la opción de acogerse o no a los parametros (sic) de la misma, y en ningún \naparte del texto normativo se lee, que se pueda despojar al titular de la manifestación relacionada \ncon la voluntad de acogerse o no a la misma y mucho menos que se imponga como salida presurosa \nal tema, un desistimiento tacito (sic), que por demás no aplica, para un trámite que ya fijó la misma \nley. \n \nAl carecer de un procedimiento reglado y constituirse la actuación en una (sic) pronunciamiento de \ncarácter discrecional, su contenido debe enmarcarse dentro de los preceptos o principios generales \ndel derecho administrativo que regulan la interacción entre el Estado y los particulares y \npreceptuados en el artículo tercero de la ley 1437 de 2011, entre ellos, el principio de eficacia \nadministrativa, en virtud del cual las autoridades administrativas han de remover los obstáculos \nmeramente formales para que los procedimientos logren su finalidad y en los cuales no se puede \ndesconocer la voluntad del administrado cuando la expresión de la misma se la ha solicitado y \nasignado la propia ley, en otras palabras, puede decirse que en este caso se presentó una \nmanifestación de voluntad fruto del libre albedrio (sic), cuyo fin es provocar consecuencias de \nderecho, en otras el cumplimiento de una obligación estipulada en un acto administrativo de carácter \nambiental. \n \nAhora bien, el Honorable Consejo de Estado CONSEJERO PONENTE William Hernández Gómez a \ntravés de sentencia con radicado número 11001-03-24-000- 2008-00390-00(0585-09), en relación \ncon la potestad reglamentaria dispuso que: \n \n“la función que cumple el Gobierno con el ejercicio del poder reglamentario es la de complementar \nla ley, en la medida en que sea necesario para lograr su cumplida aplicación, cuando se requiera por \nejemplo, precisar definiciones o aclarar etapas del procedimiento previsto en aquella, con el propósito \nde permitir su ejecución, pero ello no conlleva la interpretación de los contenidos legislativos, como \ntampoco el modo de encuadrar las distintas situaciones jurídicas en los supuestos que contiene. \nPara el ejercicio de la atribución en cuestión, el ejecutivo debe limitarse a desarrollar la ley y \n\nResolución No. 1882       Del 25 AGO. 2023          Hoja No. 10 de 17 \n \n“POR LA CUAL SE RESUELVE UN RECURSO DE REPOSICIÓN”  \n \nPágina 10 de 17 \n \nsubordinarse a su contenido, en ese orden, no le está dado introducir normas que no se desprendan \nnatural y lógicamente de sus disposiciones, ampliar o restringir el sentido de la ley, como tampoco \npuede suprimirla o modificarla ni reglamentar materias que estén reservadas a ella, pues excedería \nsus competencias e invadiría las asignadas por la Constitución al legislador. Igualmente, es \nimportante precisar que no todas las leyes son susceptibles de ser reglamentadas. Para el efecto \ndebe tenerse en cuenta lo siguiente: 1. Existen materias cuya regulación está reservada a la ley, \ncaso en el cual, al legislador le corresponde desarrollarla de manera exclusiva. 2. Las leyes que \ndeban ser ejecutadas por la administración no pueden ser objeto de regulación. 3. Cuando la ley ha \nsido formulada de manera tan detallada y los temas en ella contenidos han sido desarrollados \nen forma tan minuciosa, que, en principio, no necesitaría de reglamentación.” (subrayado y \nfuera del texto). \n \nLo mencionado por el Consejo de Estado, se trae a colación teniendo en cuenta que a la fecha el \narticulo 321 no ha sido reglamentado, toda vez que no ha establecido que para acogerse al \nporcentaje del incremento del valor base de liquidación de la inversión forzosa del 1% este (sic) \nsujeta a un procedimiento o tramite (sic), pues fue clara al establecer un límite para poder acogerse \nes decir la manifestación de la voluntad del titular del instrumento ambiental de manera positiva, \ndentro de los seis meses siguientes a la promulgación de la ley 1955 de 2019 y más (sic) nada, por \nlo que ir mas (sic) allá, es una actuación sin marco legal que la soporte. \n \nPor lo anterior, es claro que la potestad reglamentaria es una función que le compete a la rama \nlegislativa y excepcionalmente a la rama ejecutiva, pero que está limitada para este último, es decir \nque la Autoridad Nacional de licencias Ambientales dentro de las funciones que desempeña no es \nel dable reglamentar artículos del ordenamiento jurídico, ni aplicar de forma subjetiva procedimientos \nque la norma no ha contemplado pues violaría el principio de legalidad. \n \nLEY 1755 DE 2015 - ARTICULO 321 DEL PND – PETICIÓN O ACOGIMIENTO \n \nComo ya se mencionó y se argumentó anteriormente, la Autoridad Nacional de Licencias \nAmbientales -ANLA, debe dar cumplimiento a lo estipulado en el artículo 321 del PND y por ende \nNO está facultado para implementar procedimientos que la norma no ha estipulado y mucho menos \nque de su lectura se evidencie que lo haya solicitado. \n \nNo obstante, lo anterior, PERENCO en relación con la parte motiva del acto administrativo aquí \nrecurrido, evidencia que esa Autoridad Ambiental da plena aplicación al Decreto ley 1755 de 2015 \n“Por medio de la cual se regula el Derecho Fundamental de Petición y se sustituye un título del \nCódigo de Procedimiento Administrativo y de lo Contencioso Administrativo.” Y que decreta el \ndesistimiento tácito con fundamento en la normativa mencionada. Lo que en principio desconoce el \nobjeto de la ley 1755 de 2015, pues en observancia de lo que estipula en el artículo 321 del PND, no \nes una petición ni un derecho de petición con la que eleva el administrado su intención de acogerse \nal porcentaje del incremento del valor base de liquidación de la inversión forzosa del 1%, sobre la \ncual deba espera (sic) respuesta de la entidad, ya que tal manifestación no depende de la voluntad \nde la entidad sino precisamente del titular del instrumento ambiental, por disposición del ya \nmencionado artículo. \n \nAhora bien, no se explica esta empresa como la Autoridad Ambiental, si se encontraba aplicando un \nprocedimiento de conformidad con lo que contempla la ley 1755 de 2015 no se respetaron los \ntérminos, tal cual como lo señala el artículo 14 de la norma en mención, que establece que: \n \n“Artículo 14. Términos para resolver las distintas modalidades de peticiones. Salvo norma legal \nespecial y so pena de sanción disciplinaria, toda petición deberá resolverse dentro de los quince (15) \ndías siguientes a su recepción. Estará sometida a término especial la resolución de las siguientes \npeticiones: \n \n\nResolución No. 1882       Del 25 AGO. 2023          Hoja No. 11 de 17 \n \n“POR LA CUAL SE RESUELVE UN RECURSO DE REPOSICIÓN”  \n \nPágina 11 de 17 \n \n1. Las peticiones de documentos y de información deberán resolverse dentro de los diez (10) días \nsiguientes a su recepción. Si en ese lapso no se ha dado respuesta al peticionario, se entenderá, \npara todos los efectos legales, que la respectiva solicitud ha sido aceptada y, por consiguiente, \nla administración ya no podrá negar la entrega de dichos documentos al peticionario, y como \nconsecuencia las copias se entregarán dentro de los tres (3) días siguientes.  \n \n2. Las peticiones mediante las cuales se eleva una consulta a las autoridades en relación con las \nmaterias a su cargo deberán resolverse dentro de los treinta (30) días siguientes a su recepción.” \n(subrayado fuera del texto). \n \nLo anterior teniendo en cuenta que PERENCO, presentó la propuesta técnica de la inversión forzosa \nde no menos del 1% mediante radicado 2020123545-1-000 del 31 de julio de 2020 por medio de la \ncual materializa su voluntad de acogimiento a lo estipulado en el artículo 321 del PND, del cual \nobtuvo pronunciamiento que no era de fondo con la decisión adoptada mediante la Resolución 1955 \ndel 05 de noviembre de 2021, es decir transcurrió más de un año desde su radicación, razón por la \ncual considera la empresa que la administración en relación con sus particulares está en la obligación \nde respetar tanto los principios que orientan la administración pública, como los derechos que les \ncorresponden al administrado, así como la protección de sus derechos fundamentales, y no dar \naplicación de la norma de manera parcial, desprotegiendo y dejando de lado derechos que han sido \nelevados por nuestra constitución política con la connotación de fundamentales, así como el \nsometimiento de la ley para proteger y salvaguardar el principio de legalidad. \nAsí mismo, la Autoridad Ambiental fundamenta su decisión de conformidad con lo establecido en el \nartículo 17 de la ley 1437 de 2011, el cual al tenor de su letra expresa: \nARTÍCULO 17. PETICIONES INCOMPLETAS Y DESISTIMIENTO TÁCITO. En virtud del principio \nde eficacia, cuando la autoridad constate que una petición ya radicada está incompleta o que el \npeticionario deba realizar una gestión de trámite a su cargo, necesaria para adoptar una decisión de \nfondo, y que la actuación pueda continuar sin oponerse a la ley, requerirá al peticionario dentro de \nlos diez (10) días siguientes a la fecha de radicación para que la complete en el término máximo de \nun (1) mes. (…)” \nEn ese entendido, la Autoridad Ambiental pretende aplicar las normas que regulan el derecho de \npetición imponiendo que el acogimiento al artículo 321 del PND se aplique bajo el procedimiento \ncontemplado en la ley 1755 de 2015,(del cual ya se expresaron los argumentos del porque no es \nprocedente) sobre el que, en el supuesto de llegar a ser así, esa entidad desconoce que debió actuar \nconforme a lo que la norma de manera impositiva ha establecido, pues los términos no solo le atañen \nal particular, de hecho el objeto de la norma va encaminada a la protección del derecho fundamental \ndel peticionario, por lo que resulta inconcebible que se pretenda decretar un desistimiento tácito, aun \ncuando la Autoridad ambiental no dio cumplimiento a los 10 días que le ha otorgado la norma para \npronunciarse en cuanto a las peticiónes (sic) incompletas. \nComo complemento de lo anterior, este escenario sin duda no es un derecho de petición, para usar \nsu reglamentación como herramienta, con el fin de declarar el desistimiento, pues se trata de una \nactuación administrativa del particular, en la fase complementaria de seguimento (sic) y control, que \nse realiza posterior al otorgamiento de una licencia ambiental, en otras es una actuación al interior \nde un procedimiento reglado, por el Decreto 1076 de 2015. \n \nPues si la presentación de la propuesta de la inversión de no menos del 1% fue allegada desde el \n31 de julio de 2020, la Autoridad Ambiental tenía hasta el 18 de agosto de ese mismo año para \nrealizar la gestión de tramite (sic) a su cargo, hecho que no sucedió pues fue hasta el mes de \nnoviembre de 2021, que se recibió pronunciamiento de esa Autoridad Ambiental, por lo que se \nevidencia que la norma en la cual fundamenta su decisión solo es aplicable en aspecto (sic) \ndesfavorables para la empresa, pero no se cumplieron términos por parte de la Autoridad Ambiental \nque permitan afirmar que se protegieron los derechos de PERENCO. \n\nResolución No. 1882       Del 25 AGO. 2023          Hoja No. 12 de 17 \n \n“POR LA CUAL SE RESUELVE UN RECURSO DE REPOSICIÓN”  \n \nPágina 12 de 17 \n \nNo obstante lo anterior, PERENCO al entender que no se trata de una petición el acogimiento al \nporcentaje de incremento del valor de la base de liquidación de la inversión forzosa de no menos del \n1% contemplado en el artículo 321 del PND, acogimiento que solo va hasta ese momento, pues a \npartir de ahí no existe reglamentación alguna, no llevo (sic) a cabo ninguna acción constitucional \npara la protección de derechos fundamentales, por considerar, no tener la manifestación de la \nvoluntad del 321, relación alguna con la ley 1755 de 2015, sobre el reglamento del derecho de \npetición. \nPor lo anterior y atendiendo a las razones esgrimidas PERENCO, recurre la Resolución 1203 del 09 \nde junio de 2023, con el objetivo de que no se desconozca, omita o desatienda la manifestación de \nacogimiento al porcentaje de incremento del valor de la base de liquidación de la inversión forzosa \nde no menos del 1% a través de motivación inexistente en la ley, y que en orden al desarrollo de la \nfunción de seguimiento y control, se continúe (sic) por parte de la autoridad ambiental con la \nevaluación de la propuesta encaminada al cumplimiento de la inversión del 1%, en la cual se \ninvolucran más expediente (sic) por lo que resulta necesario que se evalúe la propuesta de manera \nglobal e integral y no parcial conforme cada uno de los expedientes antes relacionados. \n \n1.2. Consideraciones de la Autoridad Nacional. \n \nA través del Concepto Técnico 4869 del 9 de agosto de 2023, el equipo técnico de la \nAutoridad Nacional señaló: \n \n“(…)” \n \nLa Sociedad, en el sentido de aclarar que la información presentada a través del radicado ANLA \n2020123545-1-000 del 31 de julio de 2020, el cual correspondió a la presentación de la “Propuesta \nde recursos de inversión 1% IDEAM – PERENCO COLOMBIA LIMITED de junio 2020”, y que abarcó \nuna propuesta de proyecto a desarrollar para dar cumplimiento a las obligaciones establecidas, no \nsolamente para el expediente LAM0395, argumentó que “(…) no es dable efectuar unos ajustes \nparciales aun cuando se trata de una propuesta global del cual de considerar que la propuesta \nera susceptible de ajustes esta debió efectuarse de manera total con el análisis de todos y cada uno \nde los expedientes que se ven inmersos en la actuación administrativa iniciada por el hoy recurrente.” \n \nEs importante resaltar que, si bien, la Sociedad como titular de la licencia ambiental presentó una \npropuesta “global”, esta Autoridad en el marco de sus funciones, evalúa cada expediente de manera \nindependiente bajo un contexto regional, acorde con las obligaciones y particularidades de cada uno \nde ellos. \n \nAhora bien, en el documento denominado “Recurso de reposición en contra de la Resolución No. \n1203 de 09 de junio de 2023. Expediente LAM0395.”, la Sociedad manifestó que esta Autoridad “(…) \ndesconoce que el mismo no es suceptible (sic) de emisión de pronunciamiento de fondo, sino que \ncorresponde a la decisión libre y espontanea (sic) de la empresa de acogerse a lo dispuesto en tal \ndisposición.” \n \nAl respecto, se le aclara a la Sociedad que, mediante radicado 2019184537-1-000 del 25 de \nnoviembre de 2019, la Sociedad solicitó el acogimiento a lo establecido en el Artículo 321 de la Ley \n1955 del 25 de mayo de 2019. \n \nProducto de la evaluación de dicha propuesta, no fue posible para esta Autoridad realizar un \npronunciamiento de fondo, por lo que fue necesario requerir información adicional, lo cual se llevó a \ncabo mediante el oficio con radicado 2020011066-2-000 del 27 de enero de 2020. \n \nAnte dicha solicitud, la Sociedad solicitó prórroga para la presentación de la información requerida a \ntravés del oficio con radicado 2020029614-1-000 del 25 de febrero de 2020, para finalmente, \n\nResolución No. 1882       Del 25 AGO. 2023          Hoja No. 13 de 17 \n \n“POR LA CUAL SE RESUELVE UN RECURSO DE REPOSICIÓN”  \n \nPágina 13 de 17 \n \npresentar la propuesta mediante radicado 2020123545-1-000 del 31 de julio de 2020, la cual fue \nevaluada por esta Autoridad en el Concepto Técnico 5435 del 7 de septiembre y acogido por la \nResolución 1955 del 05 de noviembre de 2021, sin que se tuviese la suficiente claridad en la \npropuesta para determinar su viabilidad, por lo que se requirió información con un plazo de entrega \na un (1) mes posterior a la ejecutoria del acto administrativo. \n \nTeniendo en cuenta que la Sociedad interpuso recurso de reposición en contra de la Resolución \n1955 del 05 de noviembre de 2021, y la cual fue resuelta a través de la Resolución 2430 del 30 de \ndiciembre de 2021, con fecha de ejecutoria el 31 de diciembre de 2021, es a partir de esta fecha y \nhasta el 30 de enero de 2022, que la Sociedad tuvo el plazo para haber presentado lo requerido en \nel Artículo Décimo Primero de la Resolución 1955 del 05 de noviembre de 2021. \n \nAhora bien, en el seguimiento realizado en el año 2022, esta Autoridad reiteró la solicitud de la \ninformación a través del Requerimiento 39 del Acta 131 del 08 de abril de 2022, donde se evidenció \nel incumplimiento por parte de la Sociedad respecto a la entrega de la información solicitada, aun \ncuando ya se habían superado los tiempos establecidos para dicha presentación. \n \nEs así como esta Autoridad, y ante la falta de soportes que permitieran dar claridad y cumplimiento \na lo requerido desde el año 2021, expuso las siguientes consideraciones en el Concepto Técnico \n1483 del 31 de marzo de 2023 y, que soporta el pronunciamiento establecido en los Artículos Primero \ny Segundo de la Resolución 1203 del 09 de junio de 2023: \n \n“Finalmente, una vez que la Sociedad no presentó respuesta alguna frente a los numerales 3, \n4, 8 y 10 del Artículo Décimo Primero de la Resolución 1955 del 05 de noviembre de 2021, y \nque sobre los numerales 5, 6, 7 y 9 no se dio claro ni pleno cumplimiento, se concluye que la \nSociedad no dio atención oportuna ni completa a lo requerido mediante el Artículo Décimo \nPrimero de la Resolución 1955 del 05 de noviembre de 2021, reiterado mediante el \nRequerimiento 39 del Acta 131 del 08 de abril de 2022, con la cual esta Autoridad pretendía \nevaluar la opción de aceptar su nueva propuesta denominada “Propuesta de recursos de \ninversión 1% Ideam - Perenco, Junio 2020”, lo cual imposibilitó finalmente esto. \n \nDe esta manera, actualmente los únicos proyectos vigentes para los proyectos “Perforación \nPozos de Desarrollo Trinidad 8 y 9 de la Concesión Yalea”, “Perforación del pozo de Desarrollo \nTrinidad 10” y “Perforación de los pozos de Desarrollo Trinidad 11, 12, 13 y 14 de la Concesión \nYalea asociados al expediente LAM0395 son el “Fortalecimiento hidrometeorológico en las \ncuencas principales de la zona de operación de Perenco” y “Proyecto Fortalecimiento \nMonitoreo Hidrometeorológico zona hidrográfica Río Meta”, referenciados en el Artículo \nTercero de la Resolución 1955 del 05 de noviembre de 2021. \n \nSi bien el Artículo Décimo Primero de la Resolución 1955 del 05 de noviembre de 2021 \notorgó un (1) mes para la entrega de los ajustes de la “Propuesta de recursos de \ninversión 1% Ideam - Perenco, Junio 2020” para poder pronunciarse de fondo respecto a la \naprobación de un nuevo proyecto en el marco del plan de inversión forzosa de no menos del \n1%, esta Autoridad reiteró esta solicitud en el Requerimiento 39 del Acta 131 del 08 de \nabril de 2022, obligación a la cual al momento de elaborar el presente concepto técnico, \nla Sociedad aún no ha remitido respuesta satisfactoria, llevando más de un año para la \nentrega de esta información. Así las cosas, se considera que el término de tiempo fue \nsuperado ya de manera excesiva para su atención y no remitido de forma completa la \ndocumentación requerida para poder emitir un pronunciamiento de fondo sobre la “Propuesta \nde recursos de inversión 1% Ideam - Perenco, Junio 2020”. (negrilla fuera de texto original). \n \n \n \n\nResolución No. 1882       Del 25 AGO. 2023          Hoja No. 14 de 17 \n \n“POR LA CUAL SE RESUELVE UN RECURSO DE REPOSICIÓN”  \n \nPágina 14 de 17 \n \nTeniendo en cuenta los argumentos anteriormente expuestos, es que esta Autoridad en el marco de \nsus funciones, declaró el desistimiento tácito para la “Propuesta de recursos de inversión 1% Ideam \n– Perenco, Junio 2020”, toda vez que la Sociedad no solamente excedió el tiempo establecido para \nla entrega de la información, sino que para la fecha de corte del seguimiento realizado, es decir, al \n02 de marzo de 2023, no se contó con la totalidad ni con la precisión y claridad de la información \nrequerida desde el año 2021. \n \n “(…)”. \n \nEs importante aclarar que, mediante radicado 2019184537-1-000 del 25 de noviembre de \n2019, la Sociedad solicitó el acogimiento al porcentaje incremental de la base de liquidación \nde la inversión forzosa de no menos del 1%  establecido en el Artículo 321 de la Ley 1955 \ndel 25 de mayo de 2019, y que luego de que se allegara la información adicional solicitada \nen varias oportunidades por esta Autoridad Nacional, se emitió la Resolución 1955 del 05 \nde noviembre de 2021 confirmada por la Resolución 2430 del 30 de diciembre de 2021, en \nla cual se aprueba la solicitud realizada; sin embargo, en el artículo décimo primero del \ncitado proveído, se otorgó el término de 1 mes contado a partir de la ejecutoria para que se \nrealizaran algunos ajustes a la propuesta denominada “Propuesta de recursos de inversión \n1% Ideam - Perenco, Junio 2020”, ajustes que no fueron allegados por la empresa pese a \nla reiteración realizada en el Acta 131 de 2022.  \n \nAhora bien, corresponde a esta Autoridad Nacional, efectuar las precisiones legales, frente \nal  argumento expuesto por la Sociedad, en el sentido que, en el caso particular no es \naplicable lo dispuesto en el Artículo 17 de la Ley 1437 del 18 de enero  2011, atendiendo 2 \ncircunstancias específicas; la primera que el Artículo 321 de la Ley 1955 del 25 de mayo de \n2019 no establece ninguna consecuencia frente a la inconformidad de la autoridad \nambiental respecto de la información accesoria a la solicitud de acogimiento al porcentaje \nincremental de la base de liquidación de la inversión forzosa de no menos del 1%, bajo el \nentendido que, acogerse o no a esta disposición legal depende de la discrecionalidad del \ntitular de la obligación; y en segundo lugar, porque al no establecerse un proceso específico \npara estos eventos, a la autoridad administrativa le está vedado llenar dichos vacíos \nacudiendo a normas que regulan aspectos diferentes. \n \nSobre lo afirmado por la Sociedad, es importante advertir, que las normas de la Parte \nPrimera de la Ley 1437 del 18 de enero  2011, lo cual incluye el “Título II sustituido por art. \n1, ley 1755 de 2015 capítulo I derecho de petición ante autoridades”, se aplican a todos los \norganismos y entidades que conforman las ramas del poder público en sus distintos \nórdenes, sectores y niveles, a los órganos autónomos e independientes del Estado y a los \nparticulares, cuando cumplan funciones administrativas. A su vez, en el inciso tercero \nestablece que “Las autoridades sujetarán sus actuaciones a los procedimientos que se \nestablecen en este Código, sin perjuicio de los procedimientos regulados en leyes \nespeciales. En lo no previsto en los mismos se aplicarán las disposiciones de este Código. \n(Subrayado fuera de texto) \n \nConforme a lo anterior, es diáfano que la Autoridad Nacional, como Unidad Administrativa \nEspecial de Orden Nacional, adscrita al Ministerio de Ambiente y Desarrollo Sostenible, \ntiene a su cargo, el deber legal de aplicar lo dispuesto en la Ley 1437 del 18 de enero  2011, \nla cual establece en el artículo 17, el desistimiento tácito, figura que procede cuando el \n\nResolución No. 1882       Del 25 AGO. 2023          Hoja No. 15 de 17 \n \n“POR LA CUAL SE RESUELVE UN RECURSO DE REPOSICIÓN”  \n \nPágina 15 de 17 \n \ninteresado en una actuación administrativa incumple con la carga de presentar información \nnecesaria para resolver de fondo su solicitud; a lo anterior se suma que el Artículo 321 de \nla Ley 1955 del 25 de mayo de 2019, reglamenta el procedimiento, temporalidad y requisitos \npara el acogimiento al porcentaje incremental de la base de liquidación de la inversión \nforzosa de no menos del 1% lo cual incluye la presentación del Plan de inversión elaborado \nconforme a las directrices del Decreto 1076 del 26 de mayo de 2015, o en la norma aplicable \nsegún el régimen de transición normativa; mientras que, las actuaciones administrativas \ntendientes a evaluar y aprobar solicitudes adicionales, se reglamentan por lo dispuesto en \nla primera parte de la Ley 1437 del 18 de enero  2011; este último argumento se soporta \nadicionalmente, en la remisión normativa que denotan los artículos 2.2.9.3.1.8 y \n2.2.9.3.1.16 del Decreto 1076 del 26 de mayo de 2015. \nDe acuerdo con los argumentos expuestos, ante el incumplimiento de la Sociedad de \nallegar a completitud la información requerida en el artículo Décimo Primero de la \nResolución 1955 del 05 de noviembre de 2021, en el plazo previsto por la Autoridad \nNacional; lo legalmente procedente es declarar el desistimiento tácito de la misma. \n \nConforme con lo anterior, la Autoridad Nacional confirmará el contenido de la Resolución \n1203 del 9 de junio de 2023. \n \n \nEn mérito de lo expuesto,  \n \nRESUELVE \n \n \nARTÍCULO PRIMERO: Confirmar el contenido de la Resolución 1203 del 9 de junio de \n2023, de conformidad con lo expuesto en la parte motiva del presente acto administrativo.  \n \nARTÍCULO SEGUNDO: Notificar el contenido del presente acto administrativo al \nRepresentante Legal o apoderado debidamente constituido de la Sociedad PERENCO \nCOLOMBIA LIMITED, identificada con NIT. 860.032.463-4, o a quien haga sus veces, de \nconformidad con lo dispuesto en los artículos 67 y 69 del Código de Procedimiento \nAdministrativo y de lo Contencioso Administrativo. \n \nARTÍCULO TERCERO: En el evento en que el titular de la licencia o el permiso, según el \ncaso, sea una persona natural que se acoja al proceso de insolvencia regulado por las \nnormas vigentes, o se trate de una sociedad comercial o de una sucursal de sociedad \nextranjera que entre en proceso de disolución o régimen de insolvencia empresarial o \nliquidación regulados por las normas vigentes, informará inmediatamente de esta situación \na esta Autoridad, con fundamento, entre otros, en los artículos 8, 58, 79, 80, 81, 95 numeral \n8 de la Constitución Política de 1991, en la Ley 43 de 1990, en la Ley 222 de 1995, en la \nLey 1333 de 2009 y demás normas vigentes y jurisprudencia aplicable. Adicional a la \nobligación de informar a esta Autoridad de tal situación, el titular de la licencia o permiso \naprovisionará contablemente las obligaciones contingentes que se deriven de la existencia \nde un procedimiento ambiental sancionatorio conforme con el artículo 40 de la Ley 1333 de \n2009 o la norma que la adicione, modifique o derogue. \n \nARTÍCULO CUARTO: Comunicar el presente acto administrativo a la Corporación \nAutónoma Regional de la Orinoquia – (CORPORINOQUIA). \n \n\nResolución No. 1882       Del 25 AGO. 2023          Hoja No. 16 de 17 \n \n“POR LA CUAL SE RESUELVE UN RECURSO DE REPOSICIÓN”  \n \nPágina 16 de 17 \n \nARTÍCULO QUINTO: Publicar la presente Resolución en la Gaceta Ambiental de la \nAutoridad Nacional de Licencias Ambientales (ANLA) de conformidad con lo señalado en el \nartículo 71 de la Ley 99 del 22 de diciembre de 1993. \n \nARTÍCULO SEXTO: Contra el presente acto administrativo no procede recurso alguno, de \nconformidad con lo establecido en el artículo 87 del Código de Procedimiento Administrativo \ny de lo Contencioso Administrativo. \n \n \nNOTIFÍQUESE, COMUNÍQUESE, PUBLÍQUESE Y CÚMPLASE \n \nDado en Bogotá D.C., a los 25 AGO. 2023 \n \n \n \n \n \nEDILBERTO PENARANDA CORREA \nASESOR \n \n \n \n \n \nCARMEN SUSANA CAMACHO GUALDRON \nCONTRATISTA \n \n \n \nANDREA DEL PILAR SANABRIA DEL RIO \nCONTRATISTA \n \n \n \nExpediente No. LAM0395 \nConcepto Técnico 4869 del 9 de agosto de 2023 \nFecha: 18 de agosto de 2023 \n \nProceso No.: 20231000018824 \n \nNota: Este es un documento electrónico generado desde los Sistemas de Información de la ANLA. El original reposa en los archivos digitales de la \nEntidad \n \n \n \n \n \n \n \n \n\nResolución No. 1882       Del 25 AGO. 2023          Hoja No. 17 de 17 \n \n“POR LA CUAL SE RESUELVE UN RECURSO DE REPOSICIÓN”  \n \nPágina 17 de 17 \n \n \n \n \n \n \n \n \n \n \n \n \n \n \n"
}